[I 2025-01-12 23:19:54,898] Trial 309 finished with value: 2.0 and parameters: {'x_0_0': 'cd', 'x_0_1': 'cd', 'x_1_0': 'cd', 'x_1_1': 'cd'}. Best is trial 17 with value: 0.5.
[I 2025-01-12 23:19:54,904] Trial 320 finished with value: 2.0 and parameters: {'x_0_0': 'cd', 'x_0_1': 'cd', 'x_1_0': 'cd', 'x_1_1': 'cd'}. Best is trial 120 with value: 0.5.
[I 2025-01-12 23:19:54,906] Trial 313 finished with value: 2.0 and parameters: {'x_0_0': 'cd', 'x_0_1': 'cd', 'x_1_0': 'cd', 'x_1_1': 'cd'}. Best is trial 86 with value: 0.5.
[I 2025-01-12 23:19:54,926] Trial 294 finished with value: 1.0714285714285714 and parameters: {'x_0_0': 'ad', 'x_0_1': 'oo', 'x_1_0': 'cd', 'x_1_1': 'bd'}. Best is trial 62 with value: 0.5.
[I 2025-01-12 23:19:54,942] Trial 313 finished with value: 2.0 and parameters: {'x_0_0': 'cd', 'x_0_1': 'cd', 'x_1_0': 'cd', 'x_1_1': 'cd'}. Best is trial 78 with value: 0.5.
[I 2025-01-12 23:19:54,954] Trial 299 finished with value: 1.3214285714285714 and parameters: {'x_0_0': 'bc', 'x_0_1': 'cd', 'x_1_0': 'oo', 'x_1_1': 'bc'}. Best is trial 50 with value: 0.5.
[I 2025-01-12 23:19:54,968] Trial 313 finished with value: 2.0 and parameters: {'x_0_0': 'cd', 'x_0_1': 'cd', 'x_1_0': 'cd', 'x_1_1': 'cd'}. Best is trial 11 with value: 0.5.
[I 2025-01-12 23:19:54,977] Trial 305 finished with value: 2.0 and parameters: {'x_0_0': 'cd', 'x_0_1': 'cd', 'x_1_0': 'cd', 'x_1_1': 'cd'}. Best is trial 68 with value: 0.5.
[I 2025-01-12 23:19:55,001] Trial 310 finished with value: 2.0 and parameters: {'x_0_0': 'cd', 'x_0_1': 'cd', 'x_1_0': 'cd', 'x_1_1': 'cd'}. Best is trial 76 with value: 0.5.
[I 2025-01-12 23:19:55,009] Trial 296 finished with value: 1.0714285714285714 and parameters: {'x_0_0': 'bc', 'x_0_1': 'oo', 'x_1_0': 'ad', 'x_1_1': 'ad'}. Best is trial 35 with value: 0.5.
[I 2025-01-12 23:19:55,029] Trial 321 finished with value: 2.0 and parameters: {'x_0_0': 'cd', 'x_0_1': 'cd', 'x_1_0': 'cd', 'x_1_1': 'cd'}. Best is trial 120 with value: 0.5.
[I 2025-01-12 23:19:55,029] Trial 310 finished with value: 2.0 and parameters: {'x_0_0': 'cd', 'x_0_1': 'cd', 'x_1_0': 'cd', 'x_1_1': 'cd'}. Best is trial 17 with value: 0.5.
[I 2025-01-12 23:19:55,056] Trial 314 finished with value: 2.0 and parameters: {'x_0_0': 'cd', 'x_0_1': 'cd', 'x_1_0': 'cd', 'x_1_1': 'cd'}. Best is trial 86 with value: 0.5.
[I 2025-01-12 23:19:55,071] Trial 314 finished with value: 2.0 and parameters: {'x_0_0': 'cd', 'x_0_1': 'cd', 'x_1_0': 'cd', 'x_1_1': 'cd'}. Best is trial 78 with value: 0.5.
[I 2025-01-12 23:19:55,072] Trial 295 finished with value: 1.3214285714285714 and parameters: {'x_0_0': 'bd', 'x_0_1': 'bc', 'x_1_0': 'oo', 'x_1_1': 'ab'}. Best is trial 62 with value: 0.5.
[I 2025-01-12 23:19:55,091] Trial 300 finished with value: 1.5 and parameters: {'x_0_0': 'cd', 'x_0_1': 'oo', 'x_1_0': 'ad', 'x_1_1': 'ab'}. Best is trial 50 with value: 0.5.
[I 2025-01-12 23:19:55,105] Trial 314 finished with value: 2.0 and parameters: {'x_0_0': 'cd', 'x_0_1': 'cd', 'x_1_0': 'cd', 'x_1_1': 'cd'}. Best is trial 11 with value: 0.5.
[I 2025-01-12 23:19:55,111] Trial 306 finished with value: 2.0 and parameters: {'x_0_0': 'cd', 'x_0_1': 'cd', 'x_1_0': 'cd', 'x_1_1': 'cd'}. Best is trial 68 with value: 0.5.
[I 2025-01-12 23:19:55,131] Trial 297 finished with value: 1.5 and parameters: {'x_0_0': 'cd', 'x_0_1': 'oo', 'x_1_0': 'ad', 'x_1_1': 'bd'}. Best is trial 35 with value: 0.5.
[I 2025-01-12 23:19:55,134] Trial 311 finished with value: 2.0 and parameters: {'x_0_0': 'cd', 'x_0_1': 'cd', 'x_1_0': 'cd', 'x_1_1': 'cd'}. Best is trial 76 with value: 0.5.
[I 2025-01-12 23:19:55,162] Trial 311 finished with value: 2.0 and parameters: {'x_0_0': 'cd', 'x_0_1': 'cd', 'x_1_0': 'cd', 'x_1_1': 'cd'}. Best is trial 17 with value: 0.5.
[I 2025-01-12 23:19:55,162] Trial 322 finished with value: 2.0 and parameters: {'x_0_0': 'cd', 'x_0_1': 'cd', 'x_1_0': 'cd', 'x_1_1': 'cd'}. Best is trial 120 with value: 0.5.
[I 2025-01-12 23:19:55,199] Trial 315 finished with value: 2.0 and parameters: {'x_0_0': 'cd', 'x_0_1': 'cd', 'x_1_0': 'cd', 'x_1_1': 'cd'}. Best is trial 78 with value: 0.5.
[I 2025-01-12 23:19:55,200] Trial 315 finished with value: 2.0 and parameters: {'x_0_0': 'cd', 'x_0_1': 'cd', 'x_1_0': 'cd', 'x_1_1': 'cd'}. Best is trial 86 with value: 0.5.
[I 2025-01-12 23:19:55,205] Trial 296 finished with value: 1.0714285714285714 and parameters: {'x_0_0': 'bd', 'x_0_1': 'oo', 'x_1_0': 'cd', 'x_1_1': 'bd'}. Best is trial 62 with value: 0.5.
[I 2025-01-12 23:19:55,230] Trial 307 finished with value: 2.0 and parameters: {'x_0_0': 'cd', 'x_0_1': 'cd', 'x_1_0': 'cd', 'x_1_1': 'cd'}. Best is trial 68 with value: 0.5.
[I 2025-01-12 23:19:55,233] Trial 301 finished with value: 2.0 and parameters: {'x_0_0': 'cd', 'x_0_1': 'cd', 'x_1_0': 'cd', 'x_1_1': 'cd'}. Best is trial 50 with value: 0.5.
[I 2025-01-12 23:19:55,233] Trial 315 finished with value: 2.0 and parameters: {'x_0_0': 'cd', 'x_0_1': 'cd', 'x_1_0': 'cd', 'x_1_1': 'cd'}. Best is trial 11 with value: 0.5.
[I 2025-01-12 23:19:55,266] Trial 298 finished with value: 1.3214285714285714 and parameters: {'x_0_0': 'ad', 'x_0_1': 'bc', 'x_1_0': 'oo', 'x_1_1': 'bc'}. Best is trial 35 with value: 0.5.
[I 2025-01-12 23:19:55,283] Trial 312 finished with value: 2.0 and parameters: {'x_0_0': 'cd', 'x_0_1': 'cd', 'x_1_0': 'cd', 'x_1_1': 'cd'}. Best is trial 17 with value: 0.5.
[I 2025-01-12 23:19:55,297] Trial 312 finished with value: 2.0 and parameters: {'x_0_0': 'cd', 'x_0_1': 'cd', 'x_1_0': 'cd', 'x_1_1': 'cd'}. Best is trial 76 with value: 0.5.
[I 2025-01-12 23:19:55,305] Trial 316 finished with value: 2.0 and parameters: {'x_0_0': 'cd', 'x_0_1': 'cd', 'x_1_0': 'cd', 'x_1_1': 'cd'}. Best is trial 86 with value: 0.5.
[I 2025-01-12 23:19:55,313] Trial 323 finished with value: 2.0 and parameters: {'x_0_0': 'cd', 'x_0_1': 'cd', 'x_1_0': 'cd', 'x_1_1': 'cd'}. Best is trial 120 with value: 0.5.
[I 2025-01-12 23:19:55,329] Trial 316 finished with value: 2.0 and parameters: {'x_0_0': 'cd', 'x_0_1': 'cd', 'x_1_0': 'cd', 'x_1_1': 'cd'}. Best is trial 78 with value: 0.5.
[I 2025-01-12 23:19:55,333] Trial 297 finished with value: 1.0714285714285714 and parameters: {'x_0_0': 'ac', 'x_0_1': 'oo', 'x_1_0': 'cd', 'x_1_1': 'ad'}. Best is trial 62 with value: 0.5.
[I 2025-01-12 23:19:55,353] Trial 302 finished with value: 2.0 and parameters: {'x_0_0': 'cd', 'x_0_1': 'cd', 'x_1_0': 'cd', 'x_1_1': 'cd'}. Best is trial 50 with value: 0.5.
[I 2025-01-12 23:19:55,364] Trial 316 finished with value: 2.0 and parameters: {'x_0_0': 'cd', 'x_0_1': 'cd', 'x_1_0': 'cd', 'x_1_1': 'cd'}. Best is trial 11 with value: 0.5.
[I 2025-01-12 23:19:55,380] Trial 299 finished with value: 1.5 and parameters: {'x_0_0': 'cd', 'x_0_1': 'oo', 'x_1_0': 'ad', 'x_1_1': 'ad'}. Best is trial 35 with value: 0.5.
[I 2025-01-12 23:19:55,385] Trial 308 finished with value: 2.0 and parameters: {'x_0_0': 'cd', 'x_0_1': 'cd', 'x_1_0': 'cd', 'x_1_1': 'cd'}. Best is trial 68 with value: 0.5.
[I 2025-01-12 23:19:55,419] Trial 313 finished with value: 2.0 and parameters: {'x_0_0': 'cd', 'x_0_1': 'cd', 'x_1_0': 'cd', 'x_1_1': 'cd'}. Best is trial 17 with value: 0.5.
[I 2025-01-12 23:19:55,421] Trial 324 finished with value: 2.0 and parameters: {'x_0_0': 'cd', 'x_0_1': 'cd', 'x_1_0': 'cd', 'x_1_1': 'cd'}. Best is trial 120 with value: 0.5.
[I 2025-01-12 23:19:55,426] Trial 313 finished with value: 2.0 and parameters: {'x_0_0': 'cd', 'x_0_1': 'cd', 'x_1_0': 'cd', 'x_1_1': 'cd'}. Best is trial 76 with value: 0.5.
[I 2025-01-12 23:19:55,454] Trial 317 finished with value: 2.0 and parameters: {'x_0_0': 'cd', 'x_0_1': 'cd', 'x_1_0': 'cd', 'x_1_1': 'cd'}. Best is trial 86 with value: 0.5.
[I 2025-01-12 23:19:55,459] Trial 317 finished with value: 2.0 and parameters: {'x_0_0': 'cd', 'x_0_1': 'cd', 'x_1_0': 'cd', 'x_1_1': 'cd'}. Best is trial 78 with value: 0.5.
[I 2025-01-12 23:19:55,466] Trial 298 finished with value: 2.0 and parameters: {'x_0_0': 'cd', 'x_0_1': 'cd', 'x_1_0': 'cd', 'x_1_1': 'cd'}. Best is trial 62 with value: 0.5.
[I 2025-01-12 23:19:55,480] Trial 317 finished with value: 2.0 and parameters: {'x_0_0': 'cd', 'x_0_1': 'cd', 'x_1_0': 'cd', 'x_1_1': 'cd'}. Best is trial 11 with value: 0.5.
[I 2025-01-12 23:19:55,492] Trial 303 finished with value: 2.0 and parameters: {'x_0_0': 'cd', 'x_0_1': 'cd', 'x_1_0': 'cd', 'x_1_1': 'cd'}. Best is trial 50 with value: 0.5.
[I 2025-01-12 23:19:55,519] Trial 309 finished with value: 2.0 and parameters: {'x_0_0': 'cd', 'x_0_1': 'cd', 'x_1_0': 'cd', 'x_1_1': 'cd'}. Best is trial 68 with value: 0.5.
[I 2025-01-12 23:19:55,531] Trial 300 finished with value: 1.0714285714285714 and parameters: {'x_0_0': 'bc', 'x_0_1': 'oo', 'x_1_0': 'ac', 'x_1_1': 'bd'}. Best is trial 35 with value: 0.5.
[I 2025-01-12 23:19:55,543] Trial 314 finished with value: 2.0 and parameters: {'x_0_0': 'cd', 'x_0_1': 'cd', 'x_1_0': 'cd', 'x_1_1': 'cd'}. Best is trial 17 with value: 0.5.
[I 2025-01-12 23:19:55,558] Trial 325 finished with value: 2.0 and parameters: {'x_0_0': 'cd', 'x_0_1': 'cd', 'x_1_0': 'cd', 'x_1_1': 'cd'}. Best is trial 120 with value: 0.5.
[I 2025-01-12 23:19:55,566] Trial 314 finished with value: 2.0 and parameters: {'x_0_0': 'cd', 'x_0_1': 'cd', 'x_1_0': 'cd', 'x_1_1': 'cd'}. Best is trial 76 with value: 0.5.
[I 2025-01-12 23:19:55,587] Trial 318 finished with value: 2.0 and parameters: {'x_0_0': 'cd', 'x_0_1': 'cd', 'x_1_0': 'cd', 'x_1_1': 'cd'}. Best is trial 86 with value: 0.5.
[I 2025-01-12 23:19:55,592] Trial 299 finished with value: 2.0 and parameters: {'x_0_0': 'cd', 'x_0_1': 'cd', 'x_1_0': 'cd', 'x_1_1': 'cd'}. Best is trial 62 with value: 0.5.
[I 2025-01-12 23:19:55,592] Trial 318 finished with value: 2.0 and parameters: {'x_0_0': 'cd', 'x_0_1': 'cd', 'x_1_0': 'cd', 'x_1_1': 'cd'}. Best is trial 78 with value: 0.5.
[I 2025-01-12 23:19:55,628] Trial 318 finished with value: 2.0 and parameters: {'x_0_0': 'cd', 'x_0_1': 'cd', 'x_1_0': 'cd', 'x_1_1': 'cd'}. Best is trial 11 with value: 0.5.
[I 2025-01-12 23:19:55,638] Trial 304 finished with value: 2.0 and parameters: {'x_0_0': 'cd', 'x_0_1': 'cd', 'x_1_0': 'cd', 'x_1_1': 'cd'}. Best is trial 50 with value: 0.5.
[I 2025-01-12 23:19:55,639] Trial 310 finished with value: 2.0 and parameters: {'x_0_0': 'cd', 'x_0_1': 'cd', 'x_1_0': 'cd', 'x_1_1': 'cd'}. Best is trial 68 with value: 0.5.
[I 2025-01-12 23:19:55,664] Trial 301 finished with value: 2.0 and parameters: {'x_0_0': 'cd', 'x_0_1': 'cd', 'x_1_0': 'cd', 'x_1_1': 'cd'}. Best is trial 35 with value: 0.5.
[I 2025-01-12 23:19:55,681] Trial 326 finished with value: 2.0 and parameters: {'x_0_0': 'cd', 'x_0_1': 'cd', 'x_1_0': 'cd', 'x_1_1': 'cd'}. Best is trial 120 with value: 0.5.
[I 2025-01-12 23:19:55,684] Trial 315 finished with value: 2.0 and parameters: {'x_0_0': 'cd', 'x_0_1': 'cd', 'x_1_0': 'cd', 'x_1_1': 'cd'}. Best is trial 17 with value: 0.5.
[I 2025-01-12 23:19:55,705] Trial 315 finished with value: 2.0 and parameters: {'x_0_0': 'cd', 'x_0_1': 'cd', 'x_1_0': 'cd', 'x_1_1': 'cd'}. Best is trial 76 with value: 0.5.
[I 2025-01-12 23:19:55,720] Trial 319 finished with value: 2.0 and parameters: {'x_0_0': 'cd', 'x_0_1': 'cd', 'x_1_0': 'cd', 'x_1_1': 'cd'}. Best is trial 86 with value: 0.5.
[I 2025-01-12 23:19:55,733] Trial 300 finished with value: 1.0714285714285714 and parameters: {'x_0_0': 'bc', 'x_0_1': 'oo', 'x_1_0': 'ad', 'x_1_1': 'bd'}. Best is trial 62 with value: 0.5.
[I 2025-01-12 23:19:55,737] Trial 319 finished with value: 2.0 and parameters: {'x_0_0': 'cd', 'x_0_1': 'cd', 'x_1_0': 'cd', 'x_1_1': 'cd'}. Best is trial 78 with value: 0.5.
[I 2025-01-12 23:19:55,745] Trial 319 finished with value: 2.0 and parameters: {'x_0_0': 'cd', 'x_0_1': 'cd', 'x_1_0': 'cd', 'x_1_1': 'cd'}. Best is trial 11 with value: 0.5.
[I 2025-01-12 23:19:55,781] Trial 311 finished with value: 2.0 and parameters: {'x_0_0': 'cd', 'x_0_1': 'cd', 'x_1_0': 'cd', 'x_1_1': 'cd'}. Best is trial 68 with value: 0.5.
[I 2025-01-12 23:19:55,801] Trial 302 finished with value: 2.0 and parameters: {'x_0_0': 'cd', 'x_0_1': 'cd', 'x_1_0': 'cd', 'x_1_1': 'cd'}. Best is trial 35 with value: 0.5.
[I 2025-01-12 23:19:55,816] Trial 327 finished with value: 2.0 and parameters: {'x_0_0': 'cd', 'x_0_1': 'cd', 'x_1_0': 'cd', 'x_1_1': 'cd'}. Best is trial 120 with value: 0.5.
[I 2025-01-12 23:19:55,822] Trial 316 finished with value: 2.0 and parameters: {'x_0_0': 'cd', 'x_0_1': 'cd', 'x_1_0': 'cd', 'x_1_1': 'cd'}. Best is trial 17 with value: 0.5.
[I 2025-01-12 23:19:55,845] Trial 316 finished with value: 2.0 and parameters: {'x_0_0': 'cd', 'x_0_1': 'cd', 'x_1_0': 'cd', 'x_1_1': 'cd'}. Best is trial 76 with value: 0.5.
[I 2025-01-12 23:19:55,850] Trial 320 finished with value: 2.0 and parameters: {'x_0_0': 'cd', 'x_0_1': 'cd', 'x_1_0': 'cd', 'x_1_1': 'cd'}. Best is trial 78 with value: 0.5.
[I 2025-01-12 23:19:55,870] Trial 320 finished with value: 2.0 and parameters: {'x_0_0': 'cd', 'x_0_1': 'cd', 'x_1_0': 'cd', 'x_1_1': 'cd'}. Best is trial 86 with value: 0.5.
[I 2025-01-12 23:19:55,880] Trial 320 finished with value: 2.0 and parameters: {'x_0_0': 'cd', 'x_0_1': 'cd', 'x_1_0': 'cd', 'x_1_1': 'cd'}. Best is trial 11 with value: 0.5.
[I 2025-01-12 23:19:55,880] Trial 301 finished with value: 2.0 and parameters: {'x_0_0': 'cd', 'x_0_1': 'cd', 'x_1_0': 'cd', 'x_1_1': 'cd'}. Best is trial 62 with value: 0.5.
[I 2025-01-12 23:19:55,916] Trial 312 finished with value: 2.0 and parameters: {'x_0_0': 'cd', 'x_0_1': 'cd', 'x_1_0': 'cd', 'x_1_1': 'cd'}. Best is trial 68 with value: 0.5.
[I 2025-01-12 23:19:55,929] Trial 317 finished with value: 2.0 and parameters: {'x_0_0': 'cd', 'x_0_1': 'cd', 'x_1_0': 'cd', 'x_1_1': 'cd'}. Best is trial 17 with value: 0.5.
[I 2025-01-12 23:19:55,939] Trial 303 finished with value: 2.0 and parameters: {'x_0_0': 'cd', 'x_0_1': 'cd', 'x_1_0': 'cd', 'x_1_1': 'cd'}. Best is trial 35 with value: 0.5.
[I 2025-01-12 23:19:55,945] Trial 328 finished with value: 2.0 and parameters: {'x_0_0': 'cd', 'x_0_1': 'cd', 'x_1_0': 'cd', 'x_1_1': 'cd'}. Best is trial 120 with value: 0.5.
[I 2025-01-12 23:19:55,953] Trial 317 finished with value: 2.0 and parameters: {'x_0_0': 'cd', 'x_0_1': 'cd', 'x_1_0': 'cd', 'x_1_1': 'cd'}. Best is trial 76 with value: 0.5.
[I 2025-01-12 23:19:55,968] Trial 321 finished with value: 2.0 and parameters: {'x_0_0': 'cd', 'x_0_1': 'cd', 'x_1_0': 'cd', 'x_1_1': 'cd'}. Best is trial 78 with value: 0.5.
[I 2025-01-12 23:19:56,006] Trial 321 finished with value: 2.0 and parameters: {'x_0_0': 'cd', 'x_0_1': 'cd', 'x_1_0': 'cd', 'x_1_1': 'cd'}. Best is trial 86 with value: 0.5.
[I 2025-01-12 23:19:56,008] Trial 321 finished with value: 2.0 and parameters: {'x_0_0': 'cd', 'x_0_1': 'cd', 'x_1_0': 'cd', 'x_1_1': 'cd'}. Best is trial 11 with value: 0.5.
[I 2025-01-12 23:19:56,013] Trial 302 finished with value: 2.0 and parameters: {'x_0_0': 'cd', 'x_0_1': 'cd', 'x_1_0': 'cd', 'x_1_1': 'cd'}. Best is trial 62 with value: 0.5.
[I 2025-01-12 23:19:56,044] Trial 313 finished with value: 2.0 and parameters: {'x_0_0': 'cd', 'x_0_1': 'cd', 'x_1_0': 'cd', 'x_1_1': 'cd'}. Best is trial 68 with value: 0.5.
[I 2025-01-12 23:19:56,065] Trial 329 finished with value: 2.0 and parameters: {'x_0_0': 'cd', 'x_0_1': 'cd', 'x_1_0': 'cd', 'x_1_1': 'cd'}. Best is trial 120 with value: 0.5.
[I 2025-01-12 23:19:56,071] Trial 318 finished with value: 2.0 and parameters: {'x_0_0': 'cd', 'x_0_1': 'cd', 'x_1_0': 'cd', 'x_1_1': 'cd'}. Best is trial 17 with value: 0.5.
[I 2025-01-12 23:19:56,081] Trial 304 finished with value: 2.0 and parameters: {'x_0_0': 'cd', 'x_0_1': 'cd', 'x_1_0': 'cd', 'x_1_1': 'cd'}. Best is trial 35 with value: 0.5.
[I 2025-01-12 23:19:56,098] Trial 318 finished with value: 2.0 and parameters: {'x_0_0': 'cd', 'x_0_1': 'cd', 'x_1_0': 'cd', 'x_1_1': 'cd'}. Best is trial 76 with value: 0.5.
[I 2025-01-12 23:19:56,102] Trial 322 finished with value: 2.0 and parameters: {'x_0_0': 'cd', 'x_0_1': 'cd', 'x_1_0': 'cd', 'x_1_1': 'cd'}. Best is trial 78 with value: 0.5.
[I 2025-01-12 23:19:56,125] Trial 322 finished with value: 2.0 and parameters: {'x_0_0': 'cd', 'x_0_1': 'cd', 'x_1_0': 'cd', 'x_1_1': 'cd'}. Best is trial 11 with value: 0.5.
[I 2025-01-12 23:19:56,136] Trial 322 finished with value: 2.0 and parameters: {'x_0_0': 'cd', 'x_0_1': 'cd', 'x_1_0': 'cd', 'x_1_1': 'cd'}. Best is trial 86 with value: 0.5.
[I 2025-01-12 23:19:56,153] Trial 303 finished with value: 2.0 and parameters: {'x_0_0': 'cd', 'x_0_1': 'cd', 'x_1_0': 'cd', 'x_1_1': 'cd'}. Best is trial 62 with value: 0.5.
[I 2025-01-12 23:19:56,173] Trial 314 finished with value: 2.0 and parameters: {'x_0_0': 'cd', 'x_0_1': 'cd', 'x_1_0': 'cd', 'x_1_1': 'cd'}. Best is trial 68 with value: 0.5.
[I 2025-01-12 23:19:56,201] Trial 330 finished with value: 2.0 and parameters: {'x_0_0': 'cd', 'x_0_1': 'cd', 'x_1_0': 'cd', 'x_1_1': 'cd'}. Best is trial 120 with value: 0.5.
[I 2025-01-12 23:19:56,203] Trial 319 finished with value: 2.0 and parameters: {'x_0_0': 'cd', 'x_0_1': 'cd', 'x_1_0': 'cd', 'x_1_1': 'cd'}. Best is trial 17 with value: 0.5.
[I 2025-01-12 23:19:56,224] Trial 319 finished with value: 2.0 and parameters: {'x_0_0': 'cd', 'x_0_1': 'cd', 'x_1_0': 'cd', 'x_1_1': 'cd'}. Best is trial 76 with value: 0.5.
[I 2025-01-12 23:19:56,238] Trial 305 finished with value: 2.0 and parameters: {'x_0_0': 'cd', 'x_0_1': 'cd', 'x_1_0': 'cd', 'x_1_1': 'cd'}. Best is trial 35 with value: 0.5.
[I 2025-01-12 23:19:56,242] Trial 323 finished with value: 2.0 and parameters: {'x_0_0': 'cd', 'x_0_1': 'cd', 'x_1_0': 'cd', 'x_1_1': 'cd'}. Best is trial 78 with value: 0.5.
[I 2025-01-12 23:19:56,259] Trial 323 finished with value: 2.0 and parameters: {'x_0_0': 'cd', 'x_0_1': 'cd', 'x_1_0': 'cd', 'x_1_1': 'cd'}. Best is trial 86 with value: 0.5.
[I 2025-01-12 23:19:56,268] Trial 323 finished with value: 2.0 and parameters: {'x_0_0': 'cd', 'x_0_1': 'cd', 'x_1_0': 'cd', 'x_1_1': 'cd'}. Best is trial 11 with value: 0.5.
[I 2025-01-12 23:19:56,285] Trial 304 finished with value: 1.0714285714285714 and parameters: {'x_0_0': 'ac', 'x_0_1': 'oo', 'x_1_0': 'cd', 'x_1_1': 'ab'}. Best is trial 62 with value: 0.5.
[I 2025-01-12 23:19:56,310] Trial 315 finished with value: 2.0 and parameters: {'x_0_0': 'cd', 'x_0_1': 'cd', 'x_1_0': 'cd', 'x_1_1': 'cd'}. Best is trial 68 with value: 0.5.
[I 2025-01-12 23:19:56,329] Trial 331 finished with value: 2.0 and parameters: {'x_0_0': 'cd', 'x_0_1': 'cd', 'x_1_0': 'cd', 'x_1_1': 'cd'}. Best is trial 120 with value: 0.5.
[I 2025-01-12 23:19:56,344] Trial 320 finished with value: 2.0 and parameters: {'x_0_0': 'cd', 'x_0_1': 'cd', 'x_1_0': 'cd', 'x_1_1': 'cd'}. Best is trial 17 with value: 0.5.
[I 2025-01-12 23:19:56,354] Trial 320 finished with value: 2.0 and parameters: {'x_0_0': 'cd', 'x_0_1': 'cd', 'x_1_0': 'cd', 'x_1_1': 'cd'}. Best is trial 76 with value: 0.5.
[I 2025-01-12 23:19:56,364] Trial 324 finished with value: 2.0 and parameters: {'x_0_0': 'cd', 'x_0_1': 'cd', 'x_1_0': 'cd', 'x_1_1': 'cd'}. Best is trial 78 with value: 0.5.
[I 2025-01-12 23:19:56,385] Trial 324 finished with value: 2.0 and parameters: {'x_0_0': 'cd', 'x_0_1': 'cd', 'x_1_0': 'cd', 'x_1_1': 'cd'}. Best is trial 86 with value: 0.5.
[I 2025-01-12 23:19:56,405] Trial 324 finished with value: 2.0 and parameters: {'x_0_0': 'cd', 'x_0_1': 'cd', 'x_1_0': 'cd', 'x_1_1': 'cd'}. Best is trial 11 with value: 0.5.
[I 2025-01-12 23:19:56,423] Trial 305 finished with value: 2.0 and parameters: {'x_0_0': 'cd', 'x_0_1': 'cd', 'x_1_0': 'cd', 'x_1_1': 'cd'}. Best is trial 62 with value: 0.5.
[I 2025-01-12 23:19:56,460] Trial 316 finished with value: 2.0 and parameters: {'x_0_0': 'cd', 'x_0_1': 'cd', 'x_1_0': 'cd', 'x_1_1': 'cd'}. Best is trial 68 with value: 0.5.
[I 2025-01-12 23:19:56,481] Trial 321 finished with value: 2.0 and parameters: {'x_0_0': 'cd', 'x_0_1': 'cd', 'x_1_0': 'cd', 'x_1_1': 'cd'}. Best is trial 17 with value: 0.5.
[I 2025-01-12 23:19:56,482] Trial 332 finished with value: 2.0 and parameters: {'x_0_0': 'cd', 'x_0_1': 'cd', 'x_1_0': 'cd', 'x_1_1': 'cd'}. Best is trial 120 with value: 0.5.
[I 2025-01-12 23:19:56,516] Trial 321 finished with value: 2.0 and parameters: {'x_0_0': 'cd', 'x_0_1': 'cd', 'x_1_0': 'cd', 'x_1_1': 'cd'}. Best is trial 76 with value: 0.5.
[I 2025-01-12 23:19:56,521] Trial 325 finished with value: 2.0 and parameters: {'x_0_0': 'cd', 'x_0_1': 'cd', 'x_1_0': 'cd', 'x_1_1': 'cd'}. Best is trial 86 with value: 0.5.
[I 2025-01-12 23:19:56,527] Trial 325 finished with value: 2.0 and parameters: {'x_0_0': 'cd', 'x_0_1': 'cd', 'x_1_0': 'cd', 'x_1_1': 'cd'}. Best is trial 78 with value: 0.5.
[I 2025-01-12 23:19:56,565] Trial 325 finished with value: 2.0 and parameters: {'x_0_0': 'cd', 'x_0_1': 'cd', 'x_1_0': 'cd', 'x_1_1': 'cd'}. Best is trial 11 with value: 0.5.
[I 2025-01-12 23:19:56,572] Trial 306 finished with value: 2.0 and parameters: {'x_0_0': 'cd', 'x_0_1': 'cd', 'x_1_0': 'cd', 'x_1_1': 'cd'}. Best is trial 62 with value: 0.5.
[I 2025-01-12 23:19:56,586] Trial 317 finished with value: 2.0 and parameters: {'x_0_0': 'cd', 'x_0_1': 'cd', 'x_1_0': 'cd', 'x_1_1': 'cd'}. Best is trial 68 with value: 0.5.
[I 2025-01-12 23:19:56,622] Trial 322 finished with value: 2.0 and parameters: {'x_0_0': 'cd', 'x_0_1': 'cd', 'x_1_0': 'cd', 'x_1_1': 'cd'}. Best is trial 17 with value: 0.5.
[I 2025-01-12 23:19:56,654] Trial 333 finished with value: 2.0 and parameters: {'x_0_0': 'cd', 'x_0_1': 'cd', 'x_1_0': 'cd', 'x_1_1': 'cd'}. Best is trial 120 with value: 0.5.
[I 2025-01-12 23:19:56,683] Trial 326 finished with value: 2.0 and parameters: {'x_0_0': 'cd', 'x_0_1': 'cd', 'x_1_0': 'cd', 'x_1_1': 'cd'}. Best is trial 86 with value: 0.5.
[I 2025-01-12 23:19:56,695] Trial 322 finished with value: 2.0 and parameters: {'x_0_0': 'cd', 'x_0_1': 'cd', 'x_1_0': 'cd', 'x_1_1': 'cd'}. Best is trial 76 with value: 0.5.
[I 2025-01-12 23:19:56,710] Trial 326 finished with value: 2.0 and parameters: {'x_0_0': 'cd', 'x_0_1': 'cd', 'x_1_0': 'cd', 'x_1_1': 'cd'}. Best is trial 78 with value: 0.5.
