[I 2025-01-12 23:19:50,012] Trial 287 finished with value: 1.0714285714285714 and parameters: {'x_0_0': 'bc', 'x_0_1': 'oo', 'x_1_0': 'ab', 'x_1_1': 'ac'}. Best is trial 120 with value: 0.5.
/Users/keisukeonoue/ws/constrained_BO_v3/bo-env_v3/lib/python3.12/site-packages/numpy/_core/_methods.py:208: RuntimeWarning: overflow encountered in reduce
  ret = umr_sum(x, axis, dtype, out, keepdims=keepdims, where=where)
[I 2025-01-12 23:19:50,058] Trial 278 finished with value: 1.5 and parameters: {'x_0_0': 'cd', 'x_0_1': 'oo', 'x_1_0': 'bd', 'x_1_1': 'bd'}. Best is trial 78 with value: 0.5.
[I 2025-01-12 23:19:50,067] Trial 271 finished with value: 1.0714285714285714 and parameters: {'x_0_0': 'ac', 'x_0_1': 'oo', 'x_1_0': 'ad', 'x_1_1': 'ac'}. Best is trial 68 with value: 0.5.
[I 2025-01-12 23:19:50,075] Trial 258 finished with value: 1.1785714285714286 and parameters: {'x_0_0': 'ac', 'x_0_1': 'ab', 'x_1_0': 'oo', 'x_1_1': 'ac'}. Best is trial 62 with value: 0.5.
[I 2025-01-12 23:19:50,079] Trial 282 finished with value: 1.3214285714285714 and parameters: {'x_0_0': 'bc', 'x_0_1': 'bc', 'x_1_0': 'oo', 'x_1_1': 'bc'}. Best is trial 86 with value: 0.5.
[I 2025-01-12 23:19:50,101] Trial 259 finished with value: 1.0714285714285714 and parameters: {'x_0_0': 'ac', 'x_0_1': 'oo', 'x_1_0': 'ac', 'x_1_1': 'bc'}. Best is trial 35 with value: 0.5.
/Users/keisukeonoue/ws/constrained_BO_v3/bo-env_v3/lib/python3.12/site-packages/numpy/_core/_methods.py:208: RuntimeWarning: overflow encountered in reduce
  ret = umr_sum(x, axis, dtype, out, keepdims=keepdims, where=where)
[I 2025-01-12 23:19:50,119] Trial 280 finished with value: 1.3214285714285714 and parameters: {'x_0_0': 'ad', 'x_0_1': 'bd', 'x_1_0': 'oo', 'x_1_1': 'ac'}. Best is trial 76 with value: 0.5.
[I 2025-01-12 23:19:50,128] Trial 279 finished with value: 1.0714285714285714 and parameters: {'x_0_0': 'ac', 'x_0_1': 'oo', 'x_1_0': 'cd', 'x_1_1': 'ab'}. Best is trial 11 with value: 0.5.
[I 2025-01-12 23:19:50,132] Trial 279 finished with value: 1.3214285714285714 and parameters: {'x_0_0': 'ac', 'x_0_1': 'bc', 'x_1_0': 'oo', 'x_1_1': 'ad'}. Best is trial 17 with value: 0.5.
[I 2025-01-12 23:19:50,146] Trial 264 finished with value: 1.0714285714285714 and parameters: {'x_0_0': 'ac', 'x_0_1': 'oo', 'x_1_0': 'ab', 'x_1_1': 'ab'}. Best is trial 50 with value: 0.5.
[I 2025-01-12 23:19:50,148] Trial 288 finished with value: 1.75 and parameters: {'x_0_0': 'cd', 'x_0_1': 'cd', 'x_1_0': 'oo', 'x_1_1': 'bc'}. Best is trial 120 with value: 0.5.
/Users/keisukeonoue/ws/constrained_BO_v3/bo-env_v3/lib/python3.12/site-packages/numpy/_core/_methods.py:208: RuntimeWarning: overflow encountered in reduce
  ret = umr_sum(x, axis, dtype, out, keepdims=keepdims, where=where)
[I 2025-01-12 23:19:50,185] Trial 272 finished with value: 1.75 and parameters: {'x_0_0': 'cd', 'x_0_1': 'bc', 'x_1_0': 'oo', 'x_1_1': 'bc'}. Best is trial 68 with value: 0.5.
[I 2025-01-12 23:19:50,188] Trial 279 finished with value: 1.3214285714285714 and parameters: {'x_0_0': 'ac', 'x_0_1': 'bd', 'x_1_0': 'oo', 'x_1_1': 'ad'}. Best is trial 78 with value: 0.5.
[I 2025-01-12 23:19:50,210] Trial 283 finished with value: 1.3214285714285714 and parameters: {'x_0_0': 'bd', 'x_0_1': 'bd', 'x_1_0': 'oo', 'x_1_1': 'bc'}. Best is trial 86 with value: 0.5.
[I 2025-01-12 23:19:50,217] Trial 260 finished with value: 1.0714285714285714 and parameters: {'x_0_0': 'ac', 'x_0_1': 'oo', 'x_1_0': 'ac', 'x_1_1': 'ac'}. Best is trial 35 with value: 0.5.
[I 2025-01-12 23:19:50,232] Trial 259 finished with value: 1.3214285714285714 and parameters: {'x_0_0': 'ad', 'x_0_1': 'bd', 'x_1_0': 'oo', 'x_1_1': 'ad'}. Best is trial 62 with value: 0.5.
[I 2025-01-12 23:19:50,237] Trial 281 finished with value: 1.0714285714285714 and parameters: {'x_0_0': 'bc', 'x_0_1': 'oo', 'x_1_0': 'cd', 'x_1_1': 'bc'}. Best is trial 76 with value: 0.5.
/Users/keisukeonoue/ws/constrained_BO_v3/bo-env_v3/lib/python3.12/site-packages/numpy/_core/_methods.py:208: RuntimeWarning: overflow encountered in reduce
  ret = umr_sum(x, axis, dtype, out, keepdims=keepdims, where=where)
[I 2025-01-12 23:19:50,268] Trial 280 finished with value: 1.5 and parameters: {'x_0_0': 'cd', 'x_0_1': 'oo', 'x_1_0': 'bc', 'x_1_1': 'ab'}. Best is trial 11 with value: 0.5.
[I 2025-01-12 23:19:50,268] Trial 280 finished with value: 1.3214285714285714 and parameters: {'x_0_0': 'bc', 'x_0_1': 'bd', 'x_1_0': 'oo', 'x_1_1': 'bd'}. Best is trial 17 with value: 0.5.
[I 2025-01-12 23:19:50,270] Trial 289 finished with value: 1.0714285714285714 and parameters: {'x_0_0': 'ac', 'x_0_1': 'oo', 'x_1_0': 'ad', 'x_1_1': 'ac'}. Best is trial 120 with value: 0.5.
[I 2025-01-12 23:19:50,284] Trial 265 finished with value: 1.5 and parameters: {'x_0_0': 'cd', 'x_0_1': 'oo', 'x_1_0': 'bd', 'x_1_1': 'ac'}. Best is trial 50 with value: 0.5.
/Users/keisukeonoue/ws/constrained_BO_v3/bo-env_v3/lib/python3.12/site-packages/numpy/_core/_methods.py:208: RuntimeWarning: overflow encountered in reduce
  ret = umr_sum(x, axis, dtype, out, keepdims=keepdims, where=where)
[I 2025-01-12 23:19:50,316] Trial 280 finished with value: 1.3214285714285714 and parameters: {'x_0_0': 'ad', 'x_0_1': 'bc', 'x_1_0': 'oo', 'x_1_1': 'ac'}. Best is trial 78 with value: 0.5.
[I 2025-01-12 23:19:50,317] Trial 273 finished with value: 1.3214285714285714 and parameters: {'x_0_0': 'ac', 'x_0_1': 'bd', 'x_1_0': 'oo', 'x_1_1': 'bc'}. Best is trial 68 with value: 0.5.
[I 2025-01-12 23:19:50,335] Trial 261 finished with value: 1.0714285714285714 and parameters: {'x_0_0': 'ac', 'x_0_1': 'oo', 'x_1_0': 'cd', 'x_1_1': 'bd'}. Best is trial 35 with value: 0.5.
[I 2025-01-12 23:19:50,339] Trial 284 finished with value: 1.3214285714285714 and parameters: {'x_0_0': 'bc', 'x_0_1': 'cd', 'x_1_0': 'oo', 'x_1_1': 'ac'}. Best is trial 86 with value: 0.5.
/Users/keisukeonoue/ws/constrained_BO_v3/bo-env_v3/lib/python3.12/site-packages/numpy/_core/_methods.py:208: RuntimeWarning: overflow encountered in reduce
  ret = umr_sum(x, axis, dtype, out, keepdims=keepdims, where=where)
[I 2025-01-12 23:19:50,365] Trial 260 finished with value: 1.3214285714285714 and parameters: {'x_0_0': 'ad', 'x_0_1': 'ab', 'x_1_0': 'oo', 'x_1_1': 'ac'}. Best is trial 62 with value: 0.5.
[I 2025-01-12 23:19:50,378] Trial 282 finished with value: 1.75 and parameters: {'x_0_0': 'cd', 'x_0_1': 'ab', 'x_1_0': 'oo', 'x_1_1': 'ab'}. Best is trial 76 with value: 0.5.
[I 2025-01-12 23:19:50,392] Trial 281 finished with value: 1.75 and parameters: {'x_0_0': 'cd', 'x_0_1': 'ac', 'x_1_0': 'oo', 'x_1_1': 'ac'}. Best is trial 17 with value: 0.5.
[I 2025-01-12 23:19:50,395] Trial 281 finished with value: 1.0714285714285714 and parameters: {'x_0_0': 'ac', 'x_0_1': 'oo', 'x_1_0': 'ac', 'x_1_1': 'ab'}. Best is trial 11 with value: 0.5.
[I 2025-01-12 23:19:50,402] Trial 290 finished with value: 1.75 and parameters: {'x_0_0': 'cd', 'x_0_1': 'bc', 'x_1_0': 'oo', 'x_1_1': 'bc'}. Best is trial 120 with value: 0.5.
[I 2025-01-12 23:19:50,412] Trial 266 finished with value: 1.3214285714285714 and parameters: {'x_0_0': 'bd', 'x_0_1': 'cd', 'x_1_0': 'oo', 'x_1_1': 'ac'}. Best is trial 50 with value: 0.5.
/Users/keisukeonoue/ws/constrained_BO_v3/bo-env_v3/lib/python3.12/site-packages/numpy/_core/_methods.py:208: RuntimeWarning: overflow encountered in reduce
  ret = umr_sum(x, axis, dtype, out, keepdims=keepdims, where=where)
[I 2025-01-12 23:19:50,445] Trial 274 finished with value: 1.0714285714285714 and parameters: {'x_0_0': 'bc', 'x_0_1': 'oo', 'x_1_0': 'ac', 'x_1_1': 'ad'}. Best is trial 68 with value: 0.5.
[I 2025-01-12 23:19:50,453] Trial 262 finished with value: 1.0714285714285714 and parameters: {'x_0_0': 'ac', 'x_0_1': 'oo', 'x_1_0': 'ad', 'x_1_1': 'ac'}. Best is trial 35 with value: 0.5.
[I 2025-01-12 23:19:50,456] Trial 281 finished with value: 1.0714285714285714 and parameters: {'x_0_0': 'bc', 'x_0_1': 'oo', 'x_1_0': 'ac', 'x_1_1': 'ac'}. Best is trial 78 with value: 0.5.
[I 2025-01-12 23:19:50,476] Trial 285 finished with value: 1.0714285714285714 and parameters: {'x_0_0': 'ac', 'x_0_1': 'oo', 'x_1_0': 'cd', 'x_1_1': 'ad'}. Best is trial 86 with value: 0.5.
[I 2025-01-12 23:19:50,484] Trial 283 finished with value: 1.0714285714285714 and parameters: {'x_0_0': 'bc', 'x_0_1': 'oo', 'x_1_0': 'ac', 'x_1_1': 'bc'}. Best is trial 76 with value: 0.5.
[I 2025-01-12 23:19:50,486] Trial 261 finished with value: 1.0714285714285714 and parameters: {'x_0_0': 'ac', 'x_0_1': 'oo', 'x_1_0': 'ab', 'x_1_1': 'bd'}. Best is trial 62 with value: 0.5.
/Users/keisukeonoue/ws/constrained_BO_v3/bo-env_v3/lib/python3.12/site-packages/numpy/_core/_methods.py:208: RuntimeWarning: overflow encountered in reduce
  ret = umr_sum(x, axis, dtype, out, keepdims=keepdims, where=where)
[I 2025-01-12 23:19:50,515] Trial 291 finished with value: 1.5 and parameters: {'x_0_0': 'cd', 'x_0_1': 'oo', 'x_1_0': 'ac', 'x_1_1': 'ac'}. Best is trial 120 with value: 0.5.
[I 2025-01-12 23:19:50,518] Trial 282 finished with value: 1.75 and parameters: {'x_0_0': 'cd', 'x_0_1': 'bd', 'x_1_0': 'oo', 'x_1_1': 'ab'}. Best is trial 11 with value: 0.5.
[I 2025-01-12 23:19:50,525] Trial 282 finished with value: 1.0357142857142856 and parameters: {'x_0_0': 'bc', 'x_0_1': 'ac', 'x_1_0': 'oo', 'x_1_1': 'ad'}. Best is trial 17 with value: 0.5.
/Users/keisukeonoue/ws/constrained_BO_v3/bo-env_v3/lib/python3.12/site-packages/numpy/_core/_methods.py:208: RuntimeWarning: overflow encountered in reduce
  ret = umr_sum(x, axis, dtype, out, keepdims=keepdims, where=where)
[I 2025-01-12 23:19:50,552] Trial 267 finished with value: 1.3214285714285714 and parameters: {'x_0_0': 'bd', 'x_0_1': 'bd', 'x_1_0': 'oo', 'x_1_1': 'ab'}. Best is trial 50 with value: 0.5.
[I 2025-01-12 23:19:50,570] Trial 275 finished with value: 1.0714285714285714 and parameters: {'x_0_0': 'ac', 'x_0_1': 'oo', 'x_1_0': 'ad', 'x_1_1': 'bc'}. Best is trial 68 with value: 0.5.
[I 2025-01-12 23:19:50,583] Trial 286 finished with value: 1.3214285714285714 and parameters: {'x_0_0': 'bc', 'x_0_1': 'bc', 'x_1_0': 'oo', 'x_1_1': 'ad'}. Best is trial 86 with value: 0.5.
[I 2025-01-12 23:19:50,601] Trial 282 finished with value: 1.5 and parameters: {'x_0_0': 'cd', 'x_0_1': 'oo', 'x_1_0': 'cd', 'x_1_1': 'ac'}. Best is trial 78 with value: 0.5.
[I 2025-01-12 23:19:50,612] Trial 262 finished with value: 1.3214285714285714 and parameters: {'x_0_0': 'ac', 'x_0_1': 'bc', 'x_1_0': 'oo', 'x_1_1': 'ac'}. Best is trial 62 with value: 0.5.
[I 2025-01-12 23:19:50,615] Trial 263 finished with value: 1.0714285714285714 and parameters: {'x_0_0': 'ac', 'x_0_1': 'oo', 'x_1_0': 'ac', 'x_1_1': 'ab'}. Best is trial 35 with value: 0.5.
[I 2025-01-12 23:19:50,635] Trial 284 finished with value: 1.3214285714285714 and parameters: {'x_0_0': 'bd', 'x_0_1': 'bd', 'x_1_0': 'oo', 'x_1_1': 'ab'}. Best is trial 76 with value: 0.5.
/Users/keisukeonoue/ws/constrained_BO_v3/bo-env_v3/lib/python3.12/site-packages/numpy/_core/_methods.py:208: RuntimeWarning: overflow encountered in reduce
  ret = umr_sum(x, axis, dtype, out, keepdims=keepdims, where=where)
[I 2025-01-12 23:19:50,671] Trial 283 finished with value: 1.75 and parameters: {'x_0_0': 'cd', 'x_0_1': 'bc', 'x_1_0': 'oo', 'x_1_1': 'ac'}. Best is trial 17 with value: 0.5.
[I 2025-01-12 23:19:50,676] Trial 292 finished with value: 1.3214285714285714 and parameters: {'x_0_0': 'bc', 'x_0_1': 'cd', 'x_1_0': 'oo', 'x_1_1': 'bd'}. Best is trial 120 with value: 0.5.
[I 2025-01-12 23:19:50,681] Trial 283 finished with value: 1.3214285714285714 and parameters: {'x_0_0': 'bd', 'x_0_1': 'ab', 'x_1_0': 'oo', 'x_1_1': 'bc'}. Best is trial 11 with value: 0.5.
[I 2025-01-12 23:19:50,704] Trial 268 finished with value: 1.3214285714285714 and parameters: {'x_0_0': 'bc', 'x_0_1': 'bc', 'x_1_0': 'oo', 'x_1_1': 'ad'}. Best is trial 50 with value: 0.5.
[I 2025-01-12 23:19:50,717] Trial 276 finished with value: 1.3214285714285714 and parameters: {'x_0_0': 'ad', 'x_0_1': 'ab', 'x_1_0': 'oo', 'x_1_1': 'ac'}. Best is trial 68 with value: 0.5.
[I 2025-01-12 23:19:50,745] Trial 287 finished with value: 1.0714285714285714 and parameters: {'x_0_0': 'bc', 'x_0_1': 'oo', 'x_1_0': 'cd', 'x_1_1': 'ab'}. Best is trial 86 with value: 0.5.
[I 2025-01-12 23:19:50,750] Trial 283 finished with value: 1.5 and parameters: {'x_0_0': 'cd', 'x_0_1': 'oo', 'x_1_0': 'ab', 'x_1_1': 'ac'}. Best is trial 78 with value: 0.5.
[I 2025-01-12 23:19:50,781] Trial 263 finished with value: 1.3214285714285714 and parameters: {'x_0_0': 'ac', 'x_0_1': 'bd', 'x_1_0': 'oo', 'x_1_1': 'ab'}. Best is trial 62 with value: 0.5.
/Users/keisukeonoue/ws/constrained_BO_v3/bo-env_v3/lib/python3.12/site-packages/numpy/_core/_methods.py:208: RuntimeWarning: overflow encountered in reduce
  ret = umr_sum(x, axis, dtype, out, keepdims=keepdims, where=where)
[I 2025-01-12 23:19:50,799] Trial 264 finished with value: 1.0714285714285714 and parameters: {'x_0_0': 'ac', 'x_0_1': 'oo', 'x_1_0': 'ad', 'x_1_1': 'ab'}. Best is trial 35 with value: 0.5.
[I 2025-01-12 23:19:50,800] Trial 285 finished with value: 1.3214285714285714 and parameters: {'x_0_0': 'ac', 'x_0_1': 'cd', 'x_1_0': 'oo', 'x_1_1': 'bd'}. Best is trial 76 with value: 0.5.
[I 2025-01-12 23:19:50,801] Trial 284 finished with value: 1.3214285714285714 and parameters: {'x_0_0': 'bd', 'x_0_1': 'bc', 'x_1_0': 'oo', 'x_1_1': 'bd'}. Best is trial 17 with value: 0.5.
[I 2025-01-12 23:19:50,834] Trial 284 finished with value: 1.0714285714285714 and parameters: {'x_0_0': 'ac', 'x_0_1': 'oo', 'x_1_0': 'ac', 'x_1_1': 'ad'}. Best is trial 11 with value: 0.5.
[I 2025-01-12 23:19:50,840] Trial 269 finished with value: 1.3214285714285714 and parameters: {'x_0_0': 'ad', 'x_0_1': 'bd', 'x_1_0': 'oo', 'x_1_1': 'ab'}. Best is trial 50 with value: 0.5.
[I 2025-01-12 23:19:50,840] Trial 293 finished with value: 1.0714285714285714 and parameters: {'x_0_0': 'bc', 'x_0_1': 'oo', 'x_1_0': 'ac', 'x_1_1': 'ac'}. Best is trial 120 with value: 0.5.
[I 2025-01-12 23:19:50,855] Trial 277 finished with value: 1.3214285714285714 and parameters: {'x_0_0': 'ac', 'x_0_1': 'bc', 'x_1_0': 'oo', 'x_1_1': 'ab'}. Best is trial 68 with value: 0.5.
[I 2025-01-12 23:19:50,878] Trial 284 finished with value: 1.3214285714285714 and parameters: {'x_0_0': 'bc', 'x_0_1': 'bc', 'x_1_0': 'oo', 'x_1_1': 'ac'}. Best is trial 78 with value: 0.5.
[I 2025-01-12 23:19:50,882] Trial 288 finished with value: 1.3214285714285714 and parameters: {'x_0_0': 'bc', 'x_0_1': 'bd', 'x_1_0': 'oo', 'x_1_1': 'ab'}. Best is trial 86 with value: 0.5.
/Users/keisukeonoue/ws/constrained_BO_v3/bo-env_v3/lib/python3.12/site-packages/numpy/_core/_methods.py:197: RuntimeWarning: overflow encountered in multiply
  x = um.multiply(x, x, out=x)
/Users/keisukeonoue/ws/constrained_BO_v3/bo-env_v3/lib/python3.12/site-packages/numpy/_core/_methods.py:208: RuntimeWarning: overflow encountered in reduce
  ret = umr_sum(x, axis, dtype, out, keepdims=keepdims, where=where)
[I 2025-01-12 23:19:50,911] Trial 264 finished with value: 1.3214285714285714 and parameters: {'x_0_0': 'ac', 'x_0_1': 'bd', 'x_1_0': 'oo', 'x_1_1': 'ac'}. Best is trial 62 with value: 0.5.
[I 2025-01-12 23:19:50,912] Trial 285 finished with value: 1.5 and parameters: {'x_0_0': 'cd', 'x_0_1': 'oo', 'x_1_0': 'ab', 'x_1_1': 'bc'}. Best is trial 17 with value: 0.5.
[I 2025-01-12 23:19:50,938] Trial 265 finished with value: 1.75 and parameters: {'x_0_0': 'cd', 'x_0_1': 'ab', 'x_1_0': 'oo', 'x_1_1': 'bc'}. Best is trial 35 with value: 0.5.
[I 2025-01-12 23:19:50,974] Trial 286 finished with value: 1.3214285714285714 and parameters: {'x_0_0': 'ac', 'x_0_1': 'cd', 'x_1_0': 'oo', 'x_1_1': 'ab'}. Best is trial 76 with value: 0.5.
[I 2025-01-12 23:19:50,978] Trial 285 finished with value: 1.3214285714285714 and parameters: {'x_0_0': 'ac', 'x_0_1': 'bd', 'x_1_0': 'oo', 'x_1_1': 'ad'}. Best is trial 11 with value: 0.5.
[I 2025-01-12 23:19:50,979] Trial 270 finished with value: 1.0714285714285714 and parameters: {'x_0_0': 'ac', 'x_0_1': 'oo', 'x_1_0': 'ad', 'x_1_1': 'bc'}. Best is trial 50 with value: 0.5.
[I 2025-01-12 23:19:50,980] Trial 294 finished with value: 1.3214285714285714 and parameters: {'x_0_0': 'bc', 'x_0_1': 'bc', 'x_1_0': 'oo', 'x_1_1': 'bc'}. Best is trial 120 with value: 0.5.
[I 2025-01-12 23:19:50,980] Trial 278 finished with value: 1.3214285714285714 and parameters: {'x_0_0': 'ac', 'x_0_1': 'bc', 'x_1_0': 'oo', 'x_1_1': 'bd'}. Best is trial 68 with value: 0.5.
[I 2025-01-12 23:19:50,998] Trial 289 finished with value: 1.0714285714285714 and parameters: {'x_0_0': 'bc', 'x_0_1': 'oo', 'x_1_0': 'cd', 'x_1_1': 'ad'}. Best is trial 86 with value: 0.5.
[I 2025-01-12 23:19:51,001] Trial 285 finished with value: 1.0714285714285714 and parameters: {'x_0_0': 'bc', 'x_0_1': 'oo', 'x_1_0': 'ad', 'x_1_1': 'ab'}. Best is trial 78 with value: 0.5.
/Users/keisukeonoue/ws/constrained_BO_v3/bo-env_v3/lib/python3.12/site-packages/numpy/_core/_methods.py:197: RuntimeWarning: overflow encountered in multiply
  x = um.multiply(x, x, out=x)
/Users/keisukeonoue/ws/constrained_BO_v3/bo-env_v3/lib/python3.12/site-packages/numpy/_core/_methods.py:208: RuntimeWarning: overflow encountered in reduce
  ret = umr_sum(x, axis, dtype, out, keepdims=keepdims, where=where)
[I 2025-01-12 23:19:51,039] Trial 286 finished with value: 1.5 and parameters: {'x_0_0': 'cd', 'x_0_1': 'oo', 'x_1_0': 'cd', 'x_1_1': 'ab'}. Best is trial 17 with value: 0.5.
[I 2025-01-12 23:19:51,071] Trial 265 finished with value: 1.75 and parameters: {'x_0_0': 'cd', 'x_0_1': 'bc', 'x_1_0': 'oo', 'x_1_1': 'ad'}. Best is trial 62 with value: 0.5.
[I 2025-01-12 23:19:51,071] Trial 266 finished with value: 1.3214285714285714 and parameters: {'x_0_0': 'ac', 'x_0_1': 'bd', 'x_1_0': 'oo', 'x_1_1': 'ab'}. Best is trial 35 with value: 0.5.
[I 2025-01-12 23:19:51,089] Trial 286 finished with value: 1.75 and parameters: {'x_0_0': 'cd', 'x_0_1': 'bd', 'x_1_0': 'oo', 'x_1_1': 'bd'}. Best is trial 11 with value: 0.5.
[I 2025-01-12 23:19:51,091] Trial 287 finished with value: 1.0714285714285714 and parameters: {'x_0_0': 'ac', 'x_0_1': 'oo', 'x_1_0': 'ac', 'x_1_1': 'ad'}. Best is trial 76 with value: 0.5.
[I 2025-01-12 23:19:51,103] Trial 295 finished with value: 1.0714285714285714 and parameters: {'x_0_0': 'ac', 'x_0_1': 'oo', 'x_1_0': 'ac', 'x_1_1': 'ab'}. Best is trial 120 with value: 0.5.
[I 2025-01-12 23:19:51,114] Trial 271 finished with value: 1.3214285714285714 and parameters: {'x_0_0': 'bd', 'x_0_1': 'ab', 'x_1_0': 'oo', 'x_1_1': 'ac'}. Best is trial 50 with value: 0.5.
[I 2025-01-12 23:19:51,130] Trial 286 finished with value: 1.3214285714285714 and parameters: {'x_0_0': 'bc', 'x_0_1': 'cd', 'x_1_0': 'oo', 'x_1_1': 'ad'}. Best is trial 78 with value: 0.5.
[I 2025-01-12 23:19:51,132] Trial 290 finished with value: 1.5 and parameters: {'x_0_0': 'cd', 'x_0_1': 'oo', 'x_1_0': 'bd', 'x_1_1': 'ab'}. Best is trial 86 with value: 0.5.
/Users/keisukeonoue/ws/constrained_BO_v3/bo-env_v3/lib/python3.12/site-packages/numpy/_core/_methods.py:197: RuntimeWarning: overflow encountered in multiply
  x = um.multiply(x, x, out=x)
/Users/keisukeonoue/ws/constrained_BO_v3/bo-env_v3/lib/python3.12/site-packages/numpy/_core/_methods.py:208: RuntimeWarning: overflow encountered in reduce
  ret = umr_sum(x, axis, dtype, out, keepdims=keepdims, where=where)
[I 2025-01-12 23:19:51,144] Trial 279 finished with value: 1.3214285714285714 and parameters: {'x_0_0': 'ad', 'x_0_1': 'cd', 'x_1_0': 'oo', 'x_1_1': 'ab'}. Best is trial 68 with value: 0.5.
[I 2025-01-12 23:19:51,163] Trial 287 finished with value: 1.0714285714285714 and parameters: {'x_0_0': 'bc', 'x_0_1': 'oo', 'x_1_0': 'ab', 'x_1_1': 'bc'}. Best is trial 17 with value: 0.5.
[I 2025-01-12 23:19:51,200] Trial 266 finished with value: 0.8928571428571428 and parameters: {'x_0_0': 'ac', 'x_0_1': 'ad', 'x_1_0': 'oo', 'x_1_1': 'ab'}. Best is trial 62 with value: 0.5.
[I 2025-01-12 23:19:51,205] Trial 267 finished with value: 1.1785714285714286 and parameters: {'x_0_0': 'ac', 'x_0_1': 'ab', 'x_1_0': 'oo', 'x_1_1': 'ac'}. Best is trial 35 with value: 0.5.
[I 2025-01-12 23:19:51,229] Trial 287 finished with value: 1.5 and parameters: {'x_0_0': 'cd', 'x_0_1': 'oo', 'x_1_0': 'cd', 'x_1_1': 'bc'}. Best is trial 11 with value: 0.5.
[I 2025-01-12 23:19:51,233] Trial 288 finished with value: 1.3214285714285714 and parameters: {'x_0_0': 'ad', 'x_0_1': 'bd', 'x_1_0': 'oo', 'x_1_1': 'ab'}. Best is trial 76 with value: 0.5.
[I 2025-01-12 23:19:51,235] Trial 296 finished with value: 1.5 and parameters: {'x_0_0': 'cd', 'x_0_1': 'oo', 'x_1_0': 'ad', 'x_1_1': 'ac'}. Best is trial 120 with value: 0.5.
[I 2025-01-12 23:19:51,254] Trial 287 finished with value: 1.3214285714285714 and parameters: {'x_0_0': 'ac', 'x_0_1': 'bd', 'x_1_0': 'oo', 'x_1_1': 'ac'}. Best is trial 78 with value: 0.5.
[I 2025-01-12 23:19:51,254] Trial 291 finished with value: 1.3214285714285714 and parameters: {'x_0_0': 'bd', 'x_0_1': 'bd', 'x_1_0': 'oo', 'x_1_1': 'ab'}. Best is trial 86 with value: 0.5.
[I 2025-01-12 23:19:51,258] Trial 272 finished with value: 1.0714285714285714 and parameters: {'x_0_0': 'bc', 'x_0_1': 'oo', 'x_1_0': 'ad', 'x_1_1': 'ab'}. Best is trial 50 with value: 0.5.
[I 2025-01-12 23:19:51,260] Trial 280 finished with value: 1.3214285714285714 and parameters: {'x_0_0': 'ad', 'x_0_1': 'cd', 'x_1_0': 'oo', 'x_1_1': 'bc'}. Best is trial 68 with value: 0.5.
[I 2025-01-12 23:19:51,304] Trial 288 finished with value: 1.3214285714285714 and parameters: {'x_0_0': 'bd', 'x_0_1': 'bc', 'x_1_0': 'oo', 'x_1_1': 'ab'}. Best is trial 17 with value: 0.5.
[I 2025-01-12 23:19:51,319] Trial 268 finished with value: 1.3214285714285714 and parameters: {'x_0_0': 'ac', 'x_0_1': 'bc', 'x_1_0': 'oo', 'x_1_1': 'bc'}. Best is trial 35 with value: 0.5.
[I 2025-01-12 23:19:51,333] Trial 267 finished with value: 1.3214285714285714 and parameters: {'x_0_0': 'bd', 'x_0_1': 'cd', 'x_1_0': 'oo', 'x_1_1': 'bc'}. Best is trial 62 with value: 0.5.
