[I 2025-01-12 23:19:05,647] Trial 0 finished with value: 1.875 and parameters: {'x_0_0': 'cd', 'x_0_1': 'cd', 'x_1_0': 'bd', 'x_1_1': 'oo'}. Best is trial 0 with value: 1.875.
/Users/keisukeonoue/ws/constrained_BO_v3/src/samplers/tf_continual.py:294: RuntimeWarning: Mean of empty slice
  mean_ = np.nanmean(finite_values)
/Users/keisukeonoue/ws/constrained_BO_v3/bo-env_v3/lib/python3.12/site-packages/numpy/lib/_nanfunctions_impl.py:2053: RuntimeWarning: Degrees of freedom <= 0 for slice.
  var = nanvar(a, axis=axis, dtype=dtype, out=out, ddof=ddof,
[I 2025-01-12 23:19:05,678] Trial 0 finished with value: 1.5892857142857144 and parameters: {'x_0_0': 'ab', 'x_0_1': 'bd', 'x_1_0': 'ad', 'x_1_1': 'oo'}. Best is trial 0 with value: 1.5892857142857144.
/Users/keisukeonoue/ws/constrained_BO_v3/src/samplers/tf_continual.py:294: RuntimeWarning: Mean of empty slice
  mean_ = np.nanmean(finite_values)
/Users/keisukeonoue/ws/constrained_BO_v3/bo-env_v3/lib/python3.12/site-packages/numpy/lib/_nanfunctions_impl.py:2053: RuntimeWarning: Degrees of freedom <= 0 for slice.
  var = nanvar(a, axis=axis, dtype=dtype, out=out, ddof=ddof,
[I 2025-01-12 23:19:07,317] Trial 1 finished with value: 1.0714285714285714 and parameters: {'x_0_0': 'bc', 'x_0_1': 'oo', 'x_1_0': 'bc', 'x_1_1': 'bc'}. Best is trial 1 with value: 1.0714285714285714.
[I 2025-01-12 23:19:07,443] Trial 2 finished with value: 1.0714285714285714 and parameters: {'x_0_0': 'bc', 'x_0_1': 'oo', 'x_1_0': 'bc', 'x_1_1': 'ac'}. Best is trial 1 with value: 1.0714285714285714.
[I 2025-01-12 23:19:07,597] Trial 1 finished with value: 1.3214285714285714 and parameters: {'x_0_0': 'bd', 'x_0_1': 'ac', 'x_1_0': 'oo', 'x_1_1': 'ab'}. Best is trial 1 with value: 1.3214285714285714.
[I 2025-01-12 23:19:07,611] Trial 3 finished with value: 1.0714285714285714 and parameters: {'x_0_0': 'bc', 'x_0_1': 'oo', 'x_1_0': 'ad', 'x_1_1': 'ab'}. Best is trial 1 with value: 1.0714285714285714.
[I 2025-01-12 23:19:07,731] Trial 1 finished with value: 1.0714285714285714 and parameters: {'x_0_0': 'bc', 'x_0_1': 'oo', 'x_1_0': 'ad', 'x_1_1': 'ab'}. Best is trial 1 with value: 1.0714285714285714.
[I 2025-01-12 23:19:07,737] Trial 4 finished with value: 1.0714285714285714 and parameters: {'x_0_0': 'ac', 'x_0_1': 'oo', 'x_1_0': 'bc', 'x_1_1': 'bc'}. Best is trial 1 with value: 1.0714285714285714.
[I 2025-01-12 23:19:07,761] Trial 1 finished with value: 1.0714285714285714 and parameters: {'x_0_0': 'bd', 'x_0_1': 'oo', 'x_1_0': 'cd', 'x_1_1': 'ac'}. Best is trial 1 with value: 1.0714285714285714.
[I 2025-01-12 23:19:07,854] Trial 2 finished with value: 1.5 and parameters: {'x_0_0': 'cd', 'x_0_1': 'oo', 'x_1_0': 'cd', 'x_1_1': 'ab'}. Best is trial 1 with value: 1.3214285714285714.
[I 2025-01-12 23:19:07,882] Trial 5 finished with value: 1.0714285714285714 and parameters: {'x_0_0': 'bc', 'x_0_1': 'oo', 'x_1_0': 'bc', 'x_1_1': 'ad'}. Best is trial 1 with value: 1.0714285714285714.
[I 2025-01-12 23:19:07,936] Trial 2 finished with value: 1.3214285714285714 and parameters: {'x_0_0': 'bd', 'x_0_1': 'ad', 'x_1_0': 'oo', 'x_1_1': 'bc'}. Best is trial 1 with value: 1.0714285714285714.
[I 2025-01-12 23:19:07,960] Trial 1 finished with value: 1.3214285714285714 and parameters: {'x_0_0': 'bc', 'x_0_1': 'bc', 'x_1_0': 'oo', 'x_1_1': 'ab'}. Best is trial 0 with value: 1.3214285714285714.
[I 2025-01-12 23:19:07,963] Trial 2 finished with value: 1.3214285714285714 and parameters: {'x_0_0': 'ad', 'x_0_1': 'bc', 'x_1_0': 'oo', 'x_1_1': 'ad'}. Best is trial 1 with value: 1.0714285714285714.
[I 2025-01-12 23:19:08,000] Trial 1 finished with value: 0.7857142857142857 and parameters: {'x_0_0': 'ad', 'x_0_1': 'oo', 'x_1_0': 'bd', 'x_1_1': 'bc'}. Best is trial 1 with value: 0.7857142857142857.
[I 2025-01-12 23:19:08,040] Trial 6 finished with value: 1.0714285714285714 and parameters: {'x_0_0': 'ac', 'x_0_1': 'oo', 'x_1_0': 'bc', 'x_1_1': 'ac'}. Best is trial 1 with value: 1.0714285714285714.
[I 2025-01-12 23:19:08,086] Trial 2 finished with value: 1.3214285714285714 and parameters: {'x_0_0': 'ad', 'x_0_1': 'bd', 'x_1_0': 'oo', 'x_1_1': 'bc'}. Best is trial 0 with value: 1.3214285714285714.
[I 2025-01-12 23:19:08,117] Trial 3 finished with value: 0.9285714285714286 and parameters: {'x_0_0': 'bd', 'x_0_1': 'oo', 'x_1_0': 'ab', 'x_1_1': 'ad'}. Best is trial 3 with value: 0.9285714285714286.
[I 2025-01-12 23:19:08,135] Trial 3 finished with value: 1.3214285714285714 and parameters: {'x_0_0': 'ac', 'x_0_1': 'bc', 'x_1_0': 'oo', 'x_1_1': 'ad'}. Best is trial 1 with value: 1.3214285714285714.
[I 2025-01-12 23:19:08,151] Trial 7 finished with value: 1.0714285714285714 and parameters: {'x_0_0': 'bc', 'x_0_1': 'oo', 'x_1_0': 'ac', 'x_1_1': 'ad'}. Best is trial 1 with value: 1.0714285714285714.
[I 2025-01-12 23:19:08,154] Trial 3 finished with value: 1.0714285714285714 and parameters: {'x_0_0': 'bc', 'x_0_1': 'oo', 'x_1_0': 'ad', 'x_1_1': 'ad'}. Best is trial 1 with value: 1.0714285714285714.
[I 2025-01-12 23:19:08,165] Trial 1 finished with value: 0.9285714285714286 and parameters: {'x_0_0': 'ad', 'x_0_1': 'oo', 'x_1_0': 'ab', 'x_1_1': 'ab'}. Best is trial 1 with value: 0.9285714285714286.
[I 2025-01-12 23:19:08,216] Trial 3 finished with value: 1.3214285714285714 and parameters: {'x_0_0': 'bc', 'x_0_1': 'bd', 'x_1_0': 'oo', 'x_1_1': 'ab'}. Best is trial 0 with value: 1.3214285714285714.
[I 2025-01-12 23:19:08,230] Trial 1 finished with value: 1.3214285714285714 and parameters: {'x_0_0': 'ad', 'x_0_1': 'cd', 'x_1_0': 'oo', 'x_1_1': 'ad'}. Best is trial 0 with value: 1.3214285714285714.
[I 2025-01-12 23:19:08,260] Trial 4 finished with value: 1.0714285714285714 and parameters: {'x_0_0': 'ad', 'x_0_1': 'oo', 'x_1_0': 'cd', 'x_1_1': 'bc'}. Best is trial 3 with value: 0.9285714285714286.
[I 2025-01-12 23:19:08,288] Trial 8 finished with value: 1.3214285714285714 and parameters: {'x_0_0': 'bc', 'x_0_1': 'bc', 'x_1_0': 'oo', 'x_1_1': 'bd'}. Best is trial 1 with value: 1.0714285714285714.
[I 2025-01-12 23:19:08,303] Trial 2 finished with value: 1.3214285714285714 and parameters: {'x_0_0': 'bc', 'x_0_1': 'cd', 'x_1_0': 'oo', 'x_1_1': 'bc'}. Best is trial 1 with value: 0.7857142857142857.
[I 2025-01-12 23:19:08,311] Trial 4 finished with value: 1.0714285714285714 and parameters: {'x_0_0': 'bc', 'x_0_1': 'oo', 'x_1_0': 'bc', 'x_1_1': 'bd'}. Best is trial 1 with value: 1.0714285714285714.
[I 2025-01-12 23:19:08,349] Trial 4 finished with value: 1.3214285714285714 and parameters: {'x_0_0': 'bd', 'x_0_1': 'bd', 'x_1_0': 'oo', 'x_1_1': 'ab'}. Best is trial 0 with value: 1.3214285714285714.
[I 2025-01-12 23:19:08,388] Trial 4 finished with value: 1.0714285714285714 and parameters: {'x_0_0': 'bd', 'x_0_1': 'oo', 'x_1_0': 'cd', 'x_1_1': 'bd'}. Best is trial 4 with value: 1.0714285714285714.
[I 2025-01-12 23:19:08,415] Trial 2 finished with value: 1.0714285714285714 and parameters: {'x_0_0': 'ac', 'x_0_1': 'oo', 'x_1_0': 'bc', 'x_1_1': 'ad'}. Best is trial 2 with value: 1.0714285714285714.
[I 2025-01-12 23:19:08,435] Trial 1 finished with value: 1.3214285714285714 and parameters: {'x_0_0': 'bc', 'x_0_1': 'cd', 'x_1_0': 'oo', 'x_1_1': 'ac'}. Best is trial 1 with value: 1.3214285714285714.
[I 2025-01-12 23:19:08,437] Trial 5 finished with value: 1.75 and parameters: {'x_0_0': 'cd', 'x_0_1': 'bc', 'x_1_0': 'oo', 'x_1_1': 'bd'}. Best is trial 3 with value: 0.9285714285714286.
[I 2025-01-12 23:19:08,450] Trial 5 finished with value: 1.3214285714285714 and parameters: {'x_0_0': 'bc', 'x_0_1': 'bd', 'x_1_0': 'oo', 'x_1_1': 'bc'}. Best is trial 0 with value: 1.3214285714285714.
[I 2025-01-12 23:19:08,468] Trial 3 finished with value: 1.3214285714285714 and parameters: {'x_0_0': 'bc', 'x_0_1': 'bc', 'x_1_0': 'oo', 'x_1_1': 'bc'}. Best is trial 1 with value: 0.7857142857142857.
[I 2025-01-12 23:19:08,469] Trial 9 finished with value: 1.5 and parameters: {'x_0_0': 'cd', 'x_0_1': 'oo', 'x_1_0': 'ad', 'x_1_1': 'ab'}. Best is trial 1 with value: 1.0714285714285714.
[I 2025-01-12 23:19:08,473] Trial 1 finished with value: 1.5 and parameters: {'x_0_0': 'cd', 'x_0_1': 'oo', 'x_1_0': 'ad', 'x_1_1': 'ac'}. Best is trial 1 with value: 1.5.
[I 2025-01-12 23:19:08,498] Trial 2 finished with value: 1.5 and parameters: {'x_0_0': 'cd', 'x_0_1': 'oo', 'x_1_0': 'ac', 'x_1_1': 'bd'}. Best is trial 1 with value: 0.9285714285714286.
[I 2025-01-12 23:19:08,542] Trial 3 finished with value: 1.5 and parameters: {'x_0_0': 'cd', 'x_0_1': 'oo', 'x_1_0': 'bc', 'x_1_1': 'ad'}. Best is trial 2 with value: 1.0714285714285714.
[I 2025-01-12 23:19:08,546] Trial 6 finished with value: 1.3214285714285714 and parameters: {'x_0_0': 'bc', 'x_0_1': 'cd', 'x_1_0': 'oo', 'x_1_1': 'ab'}. Best is trial 0 with value: 1.3214285714285714.
[I 2025-01-12 23:19:08,548] Trial 5 finished with value: 1.0714285714285714 and parameters: {'x_0_0': 'ad', 'x_0_1': 'oo', 'x_1_0': 'ad', 'x_1_1': 'ad'}. Best is trial 1 with value: 1.0714285714285714.
[I 2025-01-12 23:19:08,586] Trial 4 finished with value: 1.75 and parameters: {'x_0_0': 'cd', 'x_0_1': 'ac', 'x_1_0': 'oo', 'x_1_1': 'bc'}. Best is trial 1 with value: 0.7857142857142857.
[I 2025-01-12 23:19:08,597] Trial 10 finished with value: 1.0714285714285714 and parameters: {'x_0_0': 'ac', 'x_0_1': 'oo', 'x_1_0': 'ab', 'x_1_1': 'ac'}. Best is trial 1 with value: 1.0714285714285714.
[I 2025-01-12 23:19:08,616] Trial 2 finished with value: 1.5 and parameters: {'x_0_0': 'cd', 'x_0_1': 'oo', 'x_1_0': 'ab', 'x_1_1': 'ac'}. Best is trial 1 with value: 1.5.
[I 2025-01-12 23:19:08,621] Trial 5 finished with value: 0.7857142857142857 and parameters: {'x_0_0': 'ad', 'x_0_1': 'oo', 'x_1_0': 'bd', 'x_1_1': 'ab'}. Best is trial 5 with value: 0.7857142857142857.
[I 2025-01-12 23:19:08,647] Trial 6 finished with value: 1.75 and parameters: {'x_0_0': 'cd', 'x_0_1': 'bc', 'x_1_0': 'oo', 'x_1_1': 'ad'}. Best is trial 3 with value: 0.9285714285714286.
[I 2025-01-12 23:19:08,650] Trial 2 finished with value: 1.3214285714285714 and parameters: {'x_0_0': 'ad', 'x_0_1': 'bc', 'x_1_0': 'oo', 'x_1_1': 'bd'}. Best is trial 1 with value: 1.3214285714285714.
[I 2025-01-12 23:19:08,664] Trial 7 finished with value: 1.3214285714285714 and parameters: {'x_0_0': 'ad', 'x_0_1': 'bd', 'x_1_0': 'oo', 'x_1_1': 'ab'}. Best is trial 0 with value: 1.3214285714285714.
[I 2025-01-12 23:19:08,671] Trial 4 finished with value: 1.3214285714285714 and parameters: {'x_0_0': 'ac', 'x_0_1': 'cd', 'x_1_0': 'oo', 'x_1_1': 'ad'}. Best is trial 2 with value: 1.0714285714285714.
[I 2025-01-12 23:19:08,701] Trial 3 finished with value: 1.5 and parameters: {'x_0_0': 'cd', 'x_0_1': 'oo', 'x_1_0': 'ac', 'x_1_1': 'ac'}. Best is trial 1 with value: 0.9285714285714286.
[I 2025-01-12 23:19:08,706] Trial 5 finished with value: 1.3214285714285714 and parameters: {'x_0_0': 'ad', 'x_0_1': 'ac', 'x_1_0': 'oo', 'x_1_1': 'bc'}. Best is trial 1 with value: 0.7857142857142857.
[I 2025-01-12 23:19:08,710] Trial 6 finished with value: 1.0714285714285714 and parameters: {'x_0_0': 'bc', 'x_0_1': 'oo', 'x_1_0': 'ad', 'x_1_1': 'bc'}. Best is trial 1 with value: 1.0714285714285714.
[I 2025-01-12 23:19:08,743] Trial 8 finished with value: 1.0357142857142856 and parameters: {'x_0_0': 'bc', 'x_0_1': 'ac', 'x_1_0': 'oo', 'x_1_1': 'bc'}. Best is trial 8 with value: 1.0357142857142856.
[I 2025-01-12 23:19:08,758] Trial 11 finished with value: 1.3214285714285714 and parameters: {'x_0_0': 'bd', 'x_0_1': 'ac', 'x_1_0': 'oo', 'x_1_1': 'bd'}. Best is trial 1 with value: 1.0714285714285714.
[I 2025-01-12 23:19:08,776] Trial 3 finished with value: 1.0714285714285714 and parameters: {'x_0_0': 'bc', 'x_0_1': 'oo', 'x_1_0': 'ad', 'x_1_1': 'ac'}. Best is trial 3 with value: 1.0714285714285714.
[I 2025-01-12 23:19:08,783] Trial 5 finished with value: 0.9285714285714286 and parameters: {'x_0_0': 'ad', 'x_0_1': 'oo', 'x_1_0': 'ab', 'x_1_1': 'ac'}. Best is trial 5 with value: 0.9285714285714286.
[I 2025-01-12 23:19:08,804] Trial 7 finished with value: 1.3214285714285714 and parameters: {'x_0_0': 'bc', 'x_0_1': 'cd', 'x_1_0': 'oo', 'x_1_1': 'bd'}. Best is trial 3 with value: 0.9285714285714286.
[I 2025-01-12 23:19:08,829] Trial 6 finished with value: 1.0357142857142856 and parameters: {'x_0_0': 'ac', 'x_0_1': 'ac', 'x_1_0': 'oo', 'x_1_1': 'bc'}. Best is trial 1 with value: 0.7857142857142857.
[I 2025-01-12 23:19:08,835] Trial 3 finished with value: 1.3214285714285714 and parameters: {'x_0_0': 'bd', 'x_0_1': 'bc', 'x_1_0': 'oo', 'x_1_1': 'bc'}. Best is trial 1 with value: 1.3214285714285714.
[I 2025-01-12 23:19:08,847] Trial 7 finished with value: 1.3214285714285714 and parameters: {'x_0_0': 'bd', 'x_0_1': 'ac', 'x_1_0': 'oo', 'x_1_1': 'ac'}. Best is trial 1 with value: 1.0714285714285714.
[I 2025-01-12 23:19:08,847] Trial 4 finished with value: 0.6428571428571428 and parameters: {'x_0_0': 'bd', 'x_0_1': 'oo', 'x_1_0': 'bc', 'x_1_1': 'ab'}. Best is trial 4 with value: 0.6428571428571428.
[I 2025-01-12 23:19:08,889] Trial 9 finished with value: 1.3214285714285714 and parameters: {'x_0_0': 'bd', 'x_0_1': 'bd', 'x_1_0': 'oo', 'x_1_1': 'ad'}. Best is trial 8 with value: 1.0357142857142856.
[I 2025-01-12 23:19:08,912] Trial 4 finished with value: 1.5 and parameters: {'x_0_0': 'cd', 'x_0_1': 'oo', 'x_1_0': 'cd', 'x_1_1': 'ad'}. Best is trial 3 with value: 1.0714285714285714.
[I 2025-01-12 23:19:08,917] Trial 6 finished with value: 1.3214285714285714 and parameters: {'x_0_0': 'ad', 'x_0_1': 'ac', 'x_1_0': 'oo', 'x_1_1': 'ad'}. Best is trial 5 with value: 0.7857142857142857.
[I 2025-01-12 23:19:08,945] Trial 7 finished with value: 1.5 and parameters: {'x_0_0': 'cd', 'x_0_1': 'oo', 'x_1_0': 'bd', 'x_1_1': 'bc'}. Best is trial 1 with value: 0.7857142857142857.
[I 2025-01-12 23:19:08,985] Trial 5 finished with value: 1.5 and parameters: {'x_0_0': 'cd', 'x_0_1': 'oo', 'x_1_0': 'ab', 'x_1_1': 'bd'}. Best is trial 4 with value: 0.6428571428571428.
[I 2025-01-12 23:19:08,985] Trial 12 finished with value: 0.9285714285714286 and parameters: {'x_0_0': 'bd', 'x_0_1': 'oo', 'x_1_0': 'ab', 'x_1_1': 'bc'}. Best is trial 12 with value: 0.9285714285714286.
[I 2025-01-12 23:19:08,996] Trial 10 finished with value: 1.3214285714285714 and parameters: {'x_0_0': 'ac', 'x_0_1': 'bd', 'x_1_0': 'oo', 'x_1_1': 'ab'}. Best is trial 8 with value: 1.0357142857142856.
[I 2025-01-12 23:19:08,999] Trial 4 finished with value: 1.75 and parameters: {'x_0_0': 'cd', 'x_0_1': 'ab', 'x_1_0': 'oo', 'x_1_1': 'ac'}. Best is trial 1 with value: 1.3214285714285714.
[I 2025-01-12 23:19:09,023] Trial 6 finished with value: 1.3214285714285714 and parameters: {'x_0_0': 'ac', 'x_0_1': 'cd', 'x_1_0': 'oo', 'x_1_1': 'ac'}. Best is trial 5 with value: 0.9285714285714286.
[I 2025-01-12 23:19:09,026] Trial 8 finished with value: 1.5 and parameters: {'x_0_0': 'cd', 'x_0_1': 'oo', 'x_1_0': 'bc', 'x_1_1': 'bd'}. Best is trial 1 with value: 1.0714285714285714.
[I 2025-01-12 23:19:09,039] Trial 8 finished with value: 1.0357142857142856 and parameters: {'x_0_0': 'ac', 'x_0_1': 'ac', 'x_1_0': 'oo', 'x_1_1': 'ac'}. Best is trial 3 with value: 0.9285714285714286.
[I 2025-01-12 23:19:09,063] Trial 8 finished with value: 1.0714285714285714 and parameters: {'x_0_0': 'ad', 'x_0_1': 'oo', 'x_1_0': 'cd', 'x_1_1': 'ab'}. Best is trial 1 with value: 0.7857142857142857.
[I 2025-01-12 23:19:09,082] Trial 5 finished with value: 1.0714285714285714 and parameters: {'x_0_0': 'bc', 'x_0_1': 'oo', 'x_1_0': 'ab', 'x_1_1': 'ac'}. Best is trial 3 with value: 1.0714285714285714.
[I 2025-01-12 23:19:09,097] Trial 7 finished with value: 1.3214285714285714 and parameters: {'x_0_0': 'bd', 'x_0_1': 'ab', 'x_1_0': 'oo', 'x_1_1': 'ad'}. Best is trial 5 with value: 0.7857142857142857.
[I 2025-01-12 23:19:09,121] Trial 6 finished with value: 1.5 and parameters: {'x_0_0': 'cd', 'x_0_1': 'oo', 'x_1_0': 'bd', 'x_1_1': 'ad'}. Best is trial 4 with value: 0.6428571428571428.
[I 2025-01-12 23:19:09,127] Trial 11 finished with value: 1.0357142857142856 and parameters: {'x_0_0': 'ac', 'x_0_1': 'ac', 'x_1_0': 'oo', 'x_1_1': 'ab'}. Best is trial 8 with value: 1.0357142857142856.
[I 2025-01-12 23:19:09,187] Trial 7 finished with value: 1.3214285714285714 and parameters: {'x_0_0': 'ac', 'x_0_1': 'bd', 'x_1_0': 'oo', 'x_1_1': 'ab'}. Best is trial 5 with value: 0.9285714285714286.
[I 2025-01-12 23:19:09,188] Trial 13 finished with value: 1.3214285714285714 and parameters: {'x_0_0': 'ad', 'x_0_1': 'cd', 'x_1_0': 'oo', 'x_1_1': 'ad'}. Best is trial 12 with value: 0.9285714285714286.
[I 2025-01-12 23:19:09,188] Trial 9 finished with value: 1.75 and parameters: {'x_0_0': 'cd', 'x_0_1': 'bd', 'x_1_0': 'oo', 'x_1_1': 'ac'}. Best is trial 1 with value: 1.0714285714285714.
[I 2025-01-12 23:19:09,203] Trial 6 finished with value: 1.5 and parameters: {'x_0_0': 'cd', 'x_0_1': 'oo', 'x_1_0': 'ab', 'x_1_1': 'ab'}. Best is trial 3 with value: 1.0714285714285714.
[I 2025-01-12 23:19:09,234] Trial 8 finished with value: 1.3214285714285714 and parameters: {'x_0_0': 'bc', 'x_0_1': 'bd', 'x_1_0': 'oo', 'x_1_1': 'ad'}. Best is trial 5 with value: 0.7857142857142857.
[I 2025-01-12 23:19:09,236] Trial 5 finished with value: 1.0714285714285714 and parameters: {'x_0_0': 'bc', 'x_0_1': 'oo', 'x_1_0': 'ad', 'x_1_1': 'bc'}. Best is trial 5 with value: 1.0714285714285714.
[I 2025-01-12 23:19:09,250] Trial 12 finished with value: 1.3214285714285714 and parameters: {'x_0_0': 'ad', 'x_0_1': 'bd', 'x_1_0': 'oo', 'x_1_1': 'ad'}. Best is trial 8 with value: 1.0357142857142856.
[I 2025-01-12 23:19:09,262] Trial 9 finished with value: 1.0714285714285714 and parameters: {'x_0_0': 'ac', 'x_0_1': 'oo', 'x_1_0': 'bd', 'x_1_1': 'bc'}. Best is trial 1 with value: 0.7857142857142857.
[I 2025-01-12 23:19:09,280] Trial 9 finished with value: 1.5 and parameters: {'x_0_0': 'cd', 'x_0_1': 'oo', 'x_1_0': 'ab', 'x_1_1': 'ad'}. Best is trial 3 with value: 0.9285714285714286.
[I 2025-01-12 23:19:09,307] Trial 7 finished with value: 1.5 and parameters: {'x_0_0': 'cd', 'x_0_1': 'oo', 'x_1_0': 'ac', 'x_1_1': 'ab'}. Best is trial 4 with value: 0.6428571428571428.
[I 2025-01-12 23:19:09,355] Trial 10 finished with value: 1.0714285714285714 and parameters: {'x_0_0': 'bc', 'x_0_1': 'oo', 'x_1_0': 'cd', 'x_1_1': 'ad'}. Best is trial 1 with value: 0.7857142857142857.
[I 2025-01-12 23:19:09,363] Trial 7 finished with value: 1.5 and parameters: {'x_0_0': 'cd', 'x_0_1': 'oo', 'x_1_0': 'ad', 'x_1_1': 'ab'}. Best is trial 3 with value: 1.0714285714285714.
[I 2025-01-12 23:19:09,374] Trial 10 finished with value: 1.3214285714285714 and parameters: {'x_0_0': 'bd', 'x_0_1': 'bd', 'x_1_0': 'oo', 'x_1_1': 'ad'}. Best is trial 1 with value: 1.0714285714285714.
[I 2025-01-12 23:19:09,396] Trial 13 finished with value: 1.3214285714285714 and parameters: {'x_0_0': 'bd', 'x_0_1': 'bd', 'x_1_0': 'oo', 'x_1_1': 'ac'}. Best is trial 8 with value: 1.0357142857142856.
[I 2025-01-12 23:19:09,403] Trial 9 finished with value: 1.5 and parameters: {'x_0_0': 'cd', 'x_0_1': 'oo', 'x_1_0': 'ad', 'x_1_1': 'ad'}. Best is trial 5 with value: 0.7857142857142857.
[I 2025-01-12 23:19:09,406] Trial 8 finished with value: 1.75 and parameters: {'x_0_0': 'cd', 'x_0_1': 'bc', 'x_1_0': 'oo', 'x_1_1': 'ac'}. Best is trial 5 with value: 0.9285714285714286.
[I 2025-01-12 23:19:09,425] Trial 14 finished with value: 1.0357142857142856 and parameters: {'x_0_0': 'bc', 'x_0_1': 'ad', 'x_1_0': 'oo', 'x_1_1': 'ad'}. Best is trial 12 with value: 0.9285714285714286.
[I 2025-01-12 23:19:09,429] Trial 10 finished with value: 1.3214285714285714 and parameters: {'x_0_0': 'bc', 'x_0_1': 'bd', 'x_1_0': 'oo', 'x_1_1': 'ab'}. Best is trial 3 with value: 0.9285714285714286.
[I 2025-01-12 23:19:09,431] Trial 8 finished with value: 1.0714285714285714 and parameters: {'x_0_0': 'bd', 'x_0_1': 'oo', 'x_1_0': 'ad', 'x_1_1': 'ab'}. Best is trial 4 with value: 0.6428571428571428.
[I 2025-01-12 23:19:09,496] Trial 11 finished with value: 1.0714285714285714 and parameters: {'x_0_0': 'bc', 'x_0_1': 'oo', 'x_1_0': 'bd', 'x_1_1': 'ac'}. Best is trial 1 with value: 1.0714285714285714.
[I 2025-01-12 23:19:09,507] Trial 8 finished with value: 0.9285714285714286 and parameters: {'x_0_0': 'ad', 'x_0_1': 'oo', 'x_1_0': 'ab', 'x_1_1': 'ac'}. Best is trial 8 with value: 0.9285714285714286.
[I 2025-01-12 23:19:09,520] Trial 14 finished with value: 1.75 and parameters: {'x_0_0': 'cd', 'x_0_1': 'ac', 'x_1_0': 'oo', 'x_1_1': 'bc'}. Best is trial 8 with value: 1.0357142857142856.
[I 2025-01-12 23:19:09,524] Trial 11 finished with value: 1.0357142857142856 and parameters: {'x_0_0': 'ac', 'x_0_1': 'ac', 'x_1_0': 'oo', 'x_1_1': 'ab'}. Best is trial 1 with value: 0.7857142857142857.
[I 2025-01-12 23:19:09,540] Trial 10 finished with value: 1.0714285714285714 and parameters: {'x_0_0': 'ac', 'x_0_1': 'oo', 'x_1_0': 'bd', 'x_1_1': 'ac'}. Best is trial 5 with value: 0.7857142857142857.
[I 2025-01-12 23:19:09,548] Trial 6 finished with value: 1.0714285714285714 and parameters: {'x_0_0': 'ac', 'x_0_1': 'oo', 'x_1_0': 'ac', 'x_1_1': 'bd'}. Best is trial 5 with value: 1.0714285714285714.
[I 2025-01-12 23:19:09,582] Trial 9 finished with value: 1.3214285714285714 and parameters: {'x_0_0': 'ac', 'x_0_1': 'bd', 'x_1_0': 'oo', 'x_1_1': 'ab'}. Best is trial 4 with value: 0.6428571428571428.
[I 2025-01-12 23:19:09,585] Trial 9 finished with value: 1.0714285714285714 and parameters: {'x_0_0': 'ad', 'x_0_1': 'oo', 'x_1_0': 'ac', 'x_1_1': 'bc'}. Best is trial 5 with value: 0.9285714285714286.
[I 2025-01-12 23:19:09,617] Trial 11 finished with value: 1.0714285714285714 and parameters: {'x_0_0': 'ac', 'x_0_1': 'oo', 'x_1_0': 'bd', 'x_1_1': 'ab'}. Best is trial 3 with value: 0.9285714285714286.
[I 2025-01-12 23:19:09,626] Trial 15 finished with value: 1.75 and parameters: {'x_0_0': 'cd', 'x_0_1': 'cd', 'x_1_0': 'oo', 'x_1_1': 'ab'}. Best is trial 12 with value: 0.9285714285714286.
[I 2025-01-12 23:19:09,630] Trial 12 finished with value: 1.3214285714285714 and parameters: {'x_0_0': 'bd', 'x_0_1': 'cd', 'x_1_0': 'oo', 'x_1_1': 'ab'}. Best is trial 1 with value: 1.0714285714285714.
