[I 2025-01-12 23:20:05,870] Trial 375 finished with value: 2.0 and parameters: {'x_0_0': 'cd', 'x_0_1': 'cd', 'x_1_0': 'cd', 'x_1_1': 'cd'}. Best is trial 11 with value: 0.5.
[I 2025-01-12 23:20:05,872] Trial 376 finished with value: 2.0 and parameters: {'x_0_0': 'cd', 'x_0_1': 'cd', 'x_1_0': 'cd', 'x_1_1': 'cd'}. Best is trial 78 with value: 0.5.
[I 2025-01-12 23:20:05,884] Trial 372 finished with value: 2.0 and parameters: {'x_0_0': 'cd', 'x_0_1': 'cd', 'x_1_0': 'cd', 'x_1_1': 'cd'}. Best is trial 17 with value: 0.5.
[I 2025-01-12 23:20:05,901] Trial 353 finished with value: 2.0 and parameters: {'x_0_0': 'cd', 'x_0_1': 'cd', 'x_1_0': 'cd', 'x_1_1': 'cd'}. Best is trial 62 with value: 0.5.
[I 2025-01-12 23:20:05,910] Trial 384 finished with value: 2.0 and parameters: {'x_0_0': 'cd', 'x_0_1': 'cd', 'x_1_0': 'cd', 'x_1_1': 'cd'}. Best is trial 120 with value: 0.5.
[I 2025-01-12 23:20:05,917] Trial 376 finished with value: 2.0 and parameters: {'x_0_0': 'cd', 'x_0_1': 'cd', 'x_1_0': 'cd', 'x_1_1': 'cd'}. Best is trial 86 with value: 0.5.
[I 2025-01-12 23:20:05,974] Trial 366 finished with value: 2.0 and parameters: {'x_0_0': 'cd', 'x_0_1': 'cd', 'x_1_0': 'cd', 'x_1_1': 'cd'}. Best is trial 68 with value: 0.5.
[I 2025-01-12 23:20:05,993] Trial 372 finished with value: 2.0 and parameters: {'x_0_0': 'cd', 'x_0_1': 'cd', 'x_1_0': 'cd', 'x_1_1': 'cd'}. Best is trial 76 with value: 0.5.
[I 2025-01-12 23:20:05,996] Trial 376 finished with value: 2.0 and parameters: {'x_0_0': 'cd', 'x_0_1': 'cd', 'x_1_0': 'cd', 'x_1_1': 'cd'}. Best is trial 11 with value: 0.5.
[I 2025-01-12 23:20:06,002] Trial 377 finished with value: 2.0 and parameters: {'x_0_0': 'cd', 'x_0_1': 'cd', 'x_1_0': 'cd', 'x_1_1': 'cd'}. Best is trial 78 with value: 0.5.
[I 2025-01-12 23:20:06,018] Trial 373 finished with value: 2.0 and parameters: {'x_0_0': 'cd', 'x_0_1': 'cd', 'x_1_0': 'cd', 'x_1_1': 'cd'}. Best is trial 17 with value: 0.5.
[I 2025-01-12 23:20:06,042] Trial 354 finished with value: 2.0 and parameters: {'x_0_0': 'cd', 'x_0_1': 'cd', 'x_1_0': 'cd', 'x_1_1': 'cd'}. Best is trial 62 with value: 0.5.
[I 2025-01-12 23:20:06,047] Trial 385 finished with value: 2.0 and parameters: {'x_0_0': 'cd', 'x_0_1': 'cd', 'x_1_0': 'cd', 'x_1_1': 'cd'}. Best is trial 120 with value: 0.5.
[I 2025-01-12 23:20:06,048] Trial 377 finished with value: 2.0 and parameters: {'x_0_0': 'cd', 'x_0_1': 'cd', 'x_1_0': 'cd', 'x_1_1': 'cd'}. Best is trial 86 with value: 0.5.
[I 2025-01-12 23:20:06,103] Trial 367 finished with value: 2.0 and parameters: {'x_0_0': 'cd', 'x_0_1': 'cd', 'x_1_0': 'cd', 'x_1_1': 'cd'}. Best is trial 68 with value: 0.5.
[I 2025-01-12 23:20:06,128] Trial 373 finished with value: 2.0 and parameters: {'x_0_0': 'cd', 'x_0_1': 'cd', 'x_1_0': 'cd', 'x_1_1': 'cd'}. Best is trial 76 with value: 0.5.
[I 2025-01-12 23:20:06,134] Trial 377 finished with value: 2.0 and parameters: {'x_0_0': 'cd', 'x_0_1': 'cd', 'x_1_0': 'cd', 'x_1_1': 'cd'}. Best is trial 11 with value: 0.5.
[I 2025-01-12 23:20:06,136] Trial 378 finished with value: 2.0 and parameters: {'x_0_0': 'cd', 'x_0_1': 'cd', 'x_1_0': 'cd', 'x_1_1': 'cd'}. Best is trial 78 with value: 0.5.
[I 2025-01-12 23:20:06,155] Trial 374 finished with value: 2.0 and parameters: {'x_0_0': 'cd', 'x_0_1': 'cd', 'x_1_0': 'cd', 'x_1_1': 'cd'}. Best is trial 17 with value: 0.5.
[I 2025-01-12 23:20:06,169] Trial 378 finished with value: 2.0 and parameters: {'x_0_0': 'cd', 'x_0_1': 'cd', 'x_1_0': 'cd', 'x_1_1': 'cd'}. Best is trial 86 with value: 0.5.
[I 2025-01-12 23:20:06,188] Trial 386 finished with value: 2.0 and parameters: {'x_0_0': 'cd', 'x_0_1': 'cd', 'x_1_0': 'cd', 'x_1_1': 'cd'}. Best is trial 120 with value: 0.5.
[I 2025-01-12 23:20:06,194] Trial 355 finished with value: 2.0 and parameters: {'x_0_0': 'cd', 'x_0_1': 'cd', 'x_1_0': 'cd', 'x_1_1': 'cd'}. Best is trial 62 with value: 0.5.
[I 2025-01-12 23:20:06,231] Trial 368 finished with value: 2.0 and parameters: {'x_0_0': 'cd', 'x_0_1': 'cd', 'x_1_0': 'cd', 'x_1_1': 'cd'}. Best is trial 68 with value: 0.5.
[I 2025-01-12 23:20:06,259] Trial 378 finished with value: 2.0 and parameters: {'x_0_0': 'cd', 'x_0_1': 'cd', 'x_1_0': 'cd', 'x_1_1': 'cd'}. Best is trial 11 with value: 0.5.
[I 2025-01-12 23:20:06,261] Trial 374 finished with value: 2.0 and parameters: {'x_0_0': 'cd', 'x_0_1': 'cd', 'x_1_0': 'cd', 'x_1_1': 'cd'}. Best is trial 76 with value: 0.5.
[I 2025-01-12 23:20:06,266] Trial 379 finished with value: 2.0 and parameters: {'x_0_0': 'cd', 'x_0_1': 'cd', 'x_1_0': 'cd', 'x_1_1': 'cd'}. Best is trial 78 with value: 0.5.
[I 2025-01-12 23:20:06,312] Trial 375 finished with value: 2.0 and parameters: {'x_0_0': 'cd', 'x_0_1': 'cd', 'x_1_0': 'cd', 'x_1_1': 'cd'}. Best is trial 17 with value: 0.5.
[I 2025-01-12 23:20:06,319] Trial 379 finished with value: 2.0 and parameters: {'x_0_0': 'cd', 'x_0_1': 'cd', 'x_1_0': 'cd', 'x_1_1': 'cd'}. Best is trial 86 with value: 0.5.
[I 2025-01-12 23:20:06,355] Trial 356 finished with value: 2.0 and parameters: {'x_0_0': 'cd', 'x_0_1': 'cd', 'x_1_0': 'cd', 'x_1_1': 'cd'}. Best is trial 35 with value: 0.5.
[I 2025-01-12 23:20:06,355] Trial 387 finished with value: 2.0 and parameters: {'x_0_0': 'cd', 'x_0_1': 'cd', 'x_1_0': 'cd', 'x_1_1': 'cd'}. Best is trial 120 with value: 0.5.
[I 2025-01-12 23:20:06,356] Trial 356 finished with value: 2.0 and parameters: {'x_0_0': 'cd', 'x_0_1': 'cd', 'x_1_0': 'cd', 'x_1_1': 'cd'}. Best is trial 62 with value: 0.5.
[I 2025-01-12 23:20:06,394] Trial 369 finished with value: 2.0 and parameters: {'x_0_0': 'cd', 'x_0_1': 'cd', 'x_1_0': 'cd', 'x_1_1': 'cd'}. Best is trial 68 with value: 0.5.
[I 2025-01-12 23:20:06,418] Trial 379 finished with value: 2.0 and parameters: {'x_0_0': 'cd', 'x_0_1': 'cd', 'x_1_0': 'cd', 'x_1_1': 'cd'}. Best is trial 11 with value: 0.5.
[I 2025-01-12 23:20:06,425] Trial 380 finished with value: 2.0 and parameters: {'x_0_0': 'cd', 'x_0_1': 'cd', 'x_1_0': 'cd', 'x_1_1': 'cd'}. Best is trial 78 with value: 0.5.
[I 2025-01-12 23:20:06,437] Trial 375 finished with value: 2.0 and parameters: {'x_0_0': 'cd', 'x_0_1': 'cd', 'x_1_0': 'cd', 'x_1_1': 'cd'}. Best is trial 76 with value: 0.5.
[I 2025-01-12 23:20:06,505] Trial 376 finished with value: 2.0 and parameters: {'x_0_0': 'cd', 'x_0_1': 'cd', 'x_1_0': 'cd', 'x_1_1': 'cd'}. Best is trial 17 with value: 0.5.
[I 2025-01-12 23:20:06,509] Trial 388 finished with value: 2.0 and parameters: {'x_0_0': 'cd', 'x_0_1': 'cd', 'x_1_0': 'cd', 'x_1_1': 'cd'}. Best is trial 120 with value: 0.5.
[I 2025-01-12 23:20:06,520] Trial 380 finished with value: 2.0 and parameters: {'x_0_0': 'cd', 'x_0_1': 'cd', 'x_1_0': 'cd', 'x_1_1': 'cd'}. Best is trial 86 with value: 0.5.
[I 2025-01-12 23:20:06,542] Trial 357 finished with value: 2.0 and parameters: {'x_0_0': 'cd', 'x_0_1': 'cd', 'x_1_0': 'cd', 'x_1_1': 'cd'}. Best is trial 35 with value: 0.5.
[I 2025-01-12 23:20:06,559] Trial 370 finished with value: 2.0 and parameters: {'x_0_0': 'cd', 'x_0_1': 'cd', 'x_1_0': 'cd', 'x_1_1': 'cd'}. Best is trial 68 with value: 0.5.
[I 2025-01-12 23:20:06,583] Trial 380 finished with value: 2.0 and parameters: {'x_0_0': 'cd', 'x_0_1': 'cd', 'x_1_0': 'cd', 'x_1_1': 'cd'}. Best is trial 11 with value: 0.5.
[I 2025-01-12 23:20:06,590] Trial 381 finished with value: 2.0 and parameters: {'x_0_0': 'cd', 'x_0_1': 'cd', 'x_1_0': 'cd', 'x_1_1': 'cd'}. Best is trial 78 with value: 0.5.
[I 2025-01-12 23:20:06,610] Trial 376 finished with value: 2.0 and parameters: {'x_0_0': 'cd', 'x_0_1': 'cd', 'x_1_0': 'cd', 'x_1_1': 'cd'}. Best is trial 76 with value: 0.5.
[I 2025-01-12 23:20:06,668] Trial 381 finished with value: 2.0 and parameters: {'x_0_0': 'cd', 'x_0_1': 'cd', 'x_1_0': 'cd', 'x_1_1': 'cd'}. Best is trial 86 with value: 0.5.
[I 2025-01-12 23:20:06,671] Trial 389 finished with value: 2.0 and parameters: {'x_0_0': 'cd', 'x_0_1': 'cd', 'x_1_0': 'cd', 'x_1_1': 'cd'}. Best is trial 120 with value: 0.5.
[I 2025-01-12 23:20:06,681] Trial 377 finished with value: 2.0 and parameters: {'x_0_0': 'cd', 'x_0_1': 'cd', 'x_1_0': 'cd', 'x_1_1': 'cd'}. Best is trial 17 with value: 0.5.
[I 2025-01-12 23:20:06,708] Trial 358 finished with value: 2.0 and parameters: {'x_0_0': 'cd', 'x_0_1': 'cd', 'x_1_0': 'cd', 'x_1_1': 'cd'}. Best is trial 35 with value: 0.5.
[I 2025-01-12 23:20:06,741] Trial 371 finished with value: 2.0 and parameters: {'x_0_0': 'cd', 'x_0_1': 'cd', 'x_1_0': 'cd', 'x_1_1': 'cd'}. Best is trial 68 with value: 0.5.
[I 2025-01-12 23:20:06,766] Trial 382 finished with value: 2.0 and parameters: {'x_0_0': 'cd', 'x_0_1': 'cd', 'x_1_0': 'cd', 'x_1_1': 'cd'}. Best is trial 78 with value: 0.5.
[I 2025-01-12 23:20:06,766] Trial 381 finished with value: 2.0 and parameters: {'x_0_0': 'cd', 'x_0_1': 'cd', 'x_1_0': 'cd', 'x_1_1': 'cd'}. Best is trial 11 with value: 0.5.
[I 2025-01-12 23:20:06,796] Trial 377 finished with value: 2.0 and parameters: {'x_0_0': 'cd', 'x_0_1': 'cd', 'x_1_0': 'cd', 'x_1_1': 'cd'}. Best is trial 76 with value: 0.5.
[I 2025-01-12 23:20:06,846] Trial 382 finished with value: 2.0 and parameters: {'x_0_0': 'cd', 'x_0_1': 'cd', 'x_1_0': 'cd', 'x_1_1': 'cd'}. Best is trial 86 with value: 0.5.
[I 2025-01-12 23:20:06,850] Trial 390 finished with value: 2.0 and parameters: {'x_0_0': 'cd', 'x_0_1': 'cd', 'x_1_0': 'cd', 'x_1_1': 'cd'}. Best is trial 120 with value: 0.5.
[I 2025-01-12 23:20:06,851] Trial 378 finished with value: 2.0 and parameters: {'x_0_0': 'cd', 'x_0_1': 'cd', 'x_1_0': 'cd', 'x_1_1': 'cd'}. Best is trial 17 with value: 0.5.
[I 2025-01-12 23:20:06,912] Trial 359 finished with value: 2.0 and parameters: {'x_0_0': 'cd', 'x_0_1': 'cd', 'x_1_0': 'cd', 'x_1_1': 'cd'}. Best is trial 35 with value: 0.5.
[I 2025-01-12 23:20:06,920] Trial 372 finished with value: 2.0 and parameters: {'x_0_0': 'cd', 'x_0_1': 'cd', 'x_1_0': 'cd', 'x_1_1': 'cd'}. Best is trial 68 with value: 0.5.
[I 2025-01-12 23:20:06,944] Trial 383 finished with value: 2.0 and parameters: {'x_0_0': 'cd', 'x_0_1': 'cd', 'x_1_0': 'cd', 'x_1_1': 'cd'}. Best is trial 78 with value: 0.5.
[I 2025-01-12 23:20:06,959] Trial 382 finished with value: 2.0 and parameters: {'x_0_0': 'cd', 'x_0_1': 'cd', 'x_1_0': 'cd', 'x_1_1': 'cd'}. Best is trial 11 with value: 0.5.
[I 2025-01-12 23:20:06,963] Trial 378 finished with value: 2.0 and parameters: {'x_0_0': 'cd', 'x_0_1': 'cd', 'x_1_0': 'cd', 'x_1_1': 'cd'}. Best is trial 76 with value: 0.5.
[I 2025-01-12 23:20:07,013] Trial 391 finished with value: 2.0 and parameters: {'x_0_0': 'cd', 'x_0_1': 'cd', 'x_1_0': 'cd', 'x_1_1': 'cd'}. Best is trial 120 with value: 0.5.
[I 2025-01-12 23:20:07,046] Trial 383 finished with value: 2.0 and parameters: {'x_0_0': 'cd', 'x_0_1': 'cd', 'x_1_0': 'cd', 'x_1_1': 'cd'}. Best is trial 86 with value: 0.5.
[I 2025-01-12 23:20:07,054] Trial 379 finished with value: 2.0 and parameters: {'x_0_0': 'cd', 'x_0_1': 'cd', 'x_1_0': 'cd', 'x_1_1': 'cd'}. Best is trial 17 with value: 0.5.
[I 2025-01-12 23:20:07,095] Trial 373 finished with value: 2.0 and parameters: {'x_0_0': 'cd', 'x_0_1': 'cd', 'x_1_0': 'cd', 'x_1_1': 'cd'}. Best is trial 68 with value: 0.5.
[I 2025-01-12 23:20:07,098] Trial 360 finished with value: 2.0 and parameters: {'x_0_0': 'cd', 'x_0_1': 'cd', 'x_1_0': 'cd', 'x_1_1': 'cd'}. Best is trial 35 with value: 0.5.
[I 2025-01-12 23:20:07,164] Trial 379 finished with value: 2.0 and parameters: {'x_0_0': 'cd', 'x_0_1': 'cd', 'x_1_0': 'cd', 'x_1_1': 'cd'}. Best is trial 76 with value: 0.5.
[I 2025-01-12 23:20:07,165] Trial 384 finished with value: 2.0 and parameters: {'x_0_0': 'cd', 'x_0_1': 'cd', 'x_1_0': 'cd', 'x_1_1': 'cd'}. Best is trial 86 with value: 0.5.
[I 2025-01-12 23:20:07,168] Trial 383 finished with value: 2.0 and parameters: {'x_0_0': 'cd', 'x_0_1': 'cd', 'x_1_0': 'cd', 'x_1_1': 'cd'}. Best is trial 11 with value: 0.5.
[I 2025-01-12 23:20:07,169] Trial 384 finished with value: 2.0 and parameters: {'x_0_0': 'cd', 'x_0_1': 'cd', 'x_1_0': 'cd', 'x_1_1': 'cd'}. Best is trial 78 with value: 0.5.
[I 2025-01-12 23:20:07,193] Trial 392 finished with value: 2.0 and parameters: {'x_0_0': 'cd', 'x_0_1': 'cd', 'x_1_0': 'cd', 'x_1_1': 'cd'}. Best is trial 120 with value: 0.5.
[I 2025-01-12 23:20:07,210] Trial 380 finished with value: 2.0 and parameters: {'x_0_0': 'cd', 'x_0_1': 'cd', 'x_1_0': 'cd', 'x_1_1': 'cd'}. Best is trial 17 with value: 0.5.
[I 2025-01-12 23:20:07,227] Trial 374 finished with value: 2.0 and parameters: {'x_0_0': 'cd', 'x_0_1': 'cd', 'x_1_0': 'cd', 'x_1_1': 'cd'}. Best is trial 68 with value: 0.5.
[I 2025-01-12 23:20:07,262] Trial 361 finished with value: 2.0 and parameters: {'x_0_0': 'cd', 'x_0_1': 'cd', 'x_1_0': 'cd', 'x_1_1': 'cd'}. Best is trial 35 with value: 0.5.
[I 2025-01-12 23:20:07,269] Trial 385 finished with value: 2.0 and parameters: {'x_0_0': 'cd', 'x_0_1': 'cd', 'x_1_0': 'cd', 'x_1_1': 'cd'}. Best is trial 78 with value: 0.5.
[I 2025-01-12 23:20:07,293] Trial 385 finished with value: 2.0 and parameters: {'x_0_0': 'cd', 'x_0_1': 'cd', 'x_1_0': 'cd', 'x_1_1': 'cd'}. Best is trial 86 with value: 0.5.
[I 2025-01-12 23:20:07,296] Trial 380 finished with value: 2.0 and parameters: {'x_0_0': 'cd', 'x_0_1': 'cd', 'x_1_0': 'cd', 'x_1_1': 'cd'}. Best is trial 76 with value: 0.5.
[I 2025-01-12 23:20:07,299] Trial 384 finished with value: 2.0 and parameters: {'x_0_0': 'cd', 'x_0_1': 'cd', 'x_1_0': 'cd', 'x_1_1': 'cd'}. Best is trial 11 with value: 0.5.
[I 2025-01-12 23:20:07,326] Trial 393 finished with value: 2.0 and parameters: {'x_0_0': 'cd', 'x_0_1': 'cd', 'x_1_0': 'cd', 'x_1_1': 'cd'}. Best is trial 120 with value: 0.5.
[I 2025-01-12 23:20:07,346] Trial 381 finished with value: 2.0 and parameters: {'x_0_0': 'cd', 'x_0_1': 'cd', 'x_1_0': 'cd', 'x_1_1': 'cd'}. Best is trial 17 with value: 0.5.
[I 2025-01-12 23:20:07,367] Trial 375 finished with value: 2.0 and parameters: {'x_0_0': 'cd', 'x_0_1': 'cd', 'x_1_0': 'cd', 'x_1_1': 'cd'}. Best is trial 68 with value: 0.5.
[I 2025-01-12 23:20:07,394] Trial 362 finished with value: 2.0 and parameters: {'x_0_0': 'cd', 'x_0_1': 'cd', 'x_1_0': 'cd', 'x_1_1': 'cd'}. Best is trial 35 with value: 0.5.
[I 2025-01-12 23:20:07,395] Trial 355 finished with value: 2.0 and parameters: {'x_0_0': 'cd', 'x_0_1': 'cd', 'x_1_0': 'cd', 'x_1_1': 'cd'}. Best is trial 50 with value: 0.5.
[I 2025-01-12 23:20:07,410] Trial 386 finished with value: 2.0 and parameters: {'x_0_0': 'cd', 'x_0_1': 'cd', 'x_1_0': 'cd', 'x_1_1': 'cd'}. Best is trial 78 with value: 0.5.
[I 2025-01-12 23:20:07,429] Trial 381 finished with value: 2.0 and parameters: {'x_0_0': 'cd', 'x_0_1': 'cd', 'x_1_0': 'cd', 'x_1_1': 'cd'}. Best is trial 76 with value: 0.5.
[I 2025-01-12 23:20:07,433] Trial 386 finished with value: 2.0 and parameters: {'x_0_0': 'cd', 'x_0_1': 'cd', 'x_1_0': 'cd', 'x_1_1': 'cd'}. Best is trial 86 with value: 0.5.
[I 2025-01-12 23:20:07,434] Trial 385 finished with value: 2.0 and parameters: {'x_0_0': 'cd', 'x_0_1': 'cd', 'x_1_0': 'cd', 'x_1_1': 'cd'}. Best is trial 11 with value: 0.5.
[I 2025-01-12 23:20:07,464] Trial 394 finished with value: 2.0 and parameters: {'x_0_0': 'cd', 'x_0_1': 'cd', 'x_1_0': 'cd', 'x_1_1': 'cd'}. Best is trial 120 with value: 0.5.
[I 2025-01-12 23:20:07,478] Trial 382 finished with value: 2.0 and parameters: {'x_0_0': 'cd', 'x_0_1': 'cd', 'x_1_0': 'cd', 'x_1_1': 'cd'}. Best is trial 17 with value: 0.5.
[I 2025-01-12 23:20:07,510] Trial 376 finished with value: 2.0 and parameters: {'x_0_0': 'cd', 'x_0_1': 'cd', 'x_1_0': 'cd', 'x_1_1': 'cd'}. Best is trial 68 with value: 0.5.
[I 2025-01-12 23:20:07,539] Trial 363 finished with value: 2.0 and parameters: {'x_0_0': 'cd', 'x_0_1': 'cd', 'x_1_0': 'cd', 'x_1_1': 'cd'}. Best is trial 35 with value: 0.5.
[I 2025-01-12 23:20:07,543] Trial 387 finished with value: 2.0 and parameters: {'x_0_0': 'cd', 'x_0_1': 'cd', 'x_1_0': 'cd', 'x_1_1': 'cd'}. Best is trial 78 with value: 0.5.
[I 2025-01-12 23:20:07,567] Trial 382 finished with value: 2.0 and parameters: {'x_0_0': 'cd', 'x_0_1': 'cd', 'x_1_0': 'cd', 'x_1_1': 'cd'}. Best is trial 76 with value: 0.5.
[I 2025-01-12 23:20:07,571] Trial 356 finished with value: 2.0 and parameters: {'x_0_0': 'cd', 'x_0_1': 'cd', 'x_1_0': 'cd', 'x_1_1': 'cd'}. Best is trial 50 with value: 0.5.
[I 2025-01-12 23:20:07,573] Trial 387 finished with value: 2.0 and parameters: {'x_0_0': 'cd', 'x_0_1': 'cd', 'x_1_0': 'cd', 'x_1_1': 'cd'}. Best is trial 86 with value: 0.5.
[I 2025-01-12 23:20:07,580] Trial 386 finished with value: 2.0 and parameters: {'x_0_0': 'cd', 'x_0_1': 'cd', 'x_1_0': 'cd', 'x_1_1': 'cd'}. Best is trial 11 with value: 0.5.
[I 2025-01-12 23:20:07,612] Trial 395 finished with value: 2.0 and parameters: {'x_0_0': 'cd', 'x_0_1': 'cd', 'x_1_0': 'cd', 'x_1_1': 'cd'}. Best is trial 120 with value: 0.5.
[I 2025-01-12 23:20:07,632] Trial 383 finished with value: 2.0 and parameters: {'x_0_0': 'cd', 'x_0_1': 'cd', 'x_1_0': 'cd', 'x_1_1': 'cd'}. Best is trial 17 with value: 0.5.
[I 2025-01-12 23:20:07,672] Trial 357 finished with value: 2.0 and parameters: {'x_0_0': 'cd', 'x_0_1': 'cd', 'x_1_0': 'cd', 'x_1_1': 'cd'}. Best is trial 62 with value: 0.5.
[I 2025-01-12 23:20:07,684] Trial 377 finished with value: 2.0 and parameters: {'x_0_0': 'cd', 'x_0_1': 'cd', 'x_1_0': 'cd', 'x_1_1': 'cd'}. Best is trial 68 with value: 0.5.
[I 2025-01-12 23:20:07,690] Trial 388 finished with value: 2.0 and parameters: {'x_0_0': 'cd', 'x_0_1': 'cd', 'x_1_0': 'cd', 'x_1_1': 'cd'}. Best is trial 78 with value: 0.5.
[I 2025-01-12 23:20:07,700] Trial 364 finished with value: 2.0 and parameters: {'x_0_0': 'cd', 'x_0_1': 'cd', 'x_1_0': 'cd', 'x_1_1': 'cd'}. Best is trial 35 with value: 0.5.
[I 2025-01-12 23:20:07,737] Trial 357 finished with value: 2.0 and parameters: {'x_0_0': 'cd', 'x_0_1': 'cd', 'x_1_0': 'cd', 'x_1_1': 'cd'}. Best is trial 50 with value: 0.5.
[I 2025-01-12 23:20:07,739] Trial 383 finished with value: 2.0 and parameters: {'x_0_0': 'cd', 'x_0_1': 'cd', 'x_1_0': 'cd', 'x_1_1': 'cd'}. Best is trial 76 with value: 0.5.
[I 2025-01-12 23:20:07,746] Trial 387 finished with value: 2.0 and parameters: {'x_0_0': 'cd', 'x_0_1': 'cd', 'x_1_0': 'cd', 'x_1_1': 'cd'}. Best is trial 11 with value: 0.5.
[I 2025-01-12 23:20:07,748] Trial 388 finished with value: 2.0 and parameters: {'x_0_0': 'cd', 'x_0_1': 'cd', 'x_1_0': 'cd', 'x_1_1': 'cd'}. Best is trial 86 with value: 0.5.
[I 2025-01-12 23:20:07,776] Trial 396 finished with value: 2.0 and parameters: {'x_0_0': 'cd', 'x_0_1': 'cd', 'x_1_0': 'cd', 'x_1_1': 'cd'}. Best is trial 120 with value: 0.5.
[I 2025-01-12 23:20:07,801] Trial 384 finished with value: 2.0 and parameters: {'x_0_0': 'cd', 'x_0_1': 'cd', 'x_1_0': 'cd', 'x_1_1': 'cd'}. Best is trial 17 with value: 0.5.
[I 2025-01-12 23:20:07,851] Trial 358 finished with value: 2.0 and parameters: {'x_0_0': 'cd', 'x_0_1': 'cd', 'x_1_0': 'cd', 'x_1_1': 'cd'}. Best is trial 62 with value: 0.5.
[I 2025-01-12 23:20:07,861] Trial 378 finished with value: 2.0 and parameters: {'x_0_0': 'cd', 'x_0_1': 'cd', 'x_1_0': 'cd', 'x_1_1': 'cd'}. Best is trial 68 with value: 0.5.
[I 2025-01-12 23:20:07,868] Trial 365 finished with value: 2.0 and parameters: {'x_0_0': 'cd', 'x_0_1': 'cd', 'x_1_0': 'cd', 'x_1_1': 'cd'}. Best is trial 35 with value: 0.5.
[I 2025-01-12 23:20:07,869] Trial 389 finished with value: 2.0 and parameters: {'x_0_0': 'cd', 'x_0_1': 'cd', 'x_1_0': 'cd', 'x_1_1': 'cd'}. Best is trial 78 with value: 0.5.
[I 2025-01-12 23:20:07,916] Trial 388 finished with value: 2.0 and parameters: {'x_0_0': 'cd', 'x_0_1': 'cd', 'x_1_0': 'cd', 'x_1_1': 'cd'}. Best is trial 11 with value: 0.5.
[I 2025-01-12 23:20:07,922] Trial 389 finished with value: 2.0 and parameters: {'x_0_0': 'cd', 'x_0_1': 'cd', 'x_1_0': 'cd', 'x_1_1': 'cd'}. Best is trial 86 with value: 0.5.
[I 2025-01-12 23:20:07,923] Trial 384 finished with value: 2.0 and parameters: {'x_0_0': 'cd', 'x_0_1': 'cd', 'x_1_0': 'cd', 'x_1_1': 'cd'}. Best is trial 76 with value: 0.5.
[I 2025-01-12 23:20:07,927] Trial 358 finished with value: 2.0 and parameters: {'x_0_0': 'cd', 'x_0_1': 'cd', 'x_1_0': 'cd', 'x_1_1': 'cd'}. Best is trial 50 with value: 0.5.
[I 2025-01-12 23:20:07,956] Trial 397 finished with value: 2.0 and parameters: {'x_0_0': 'cd', 'x_0_1': 'cd', 'x_1_0': 'cd', 'x_1_1': 'cd'}. Best is trial 120 with value: 0.5.
[I 2025-01-12 23:20:07,969] Trial 385 finished with value: 2.0 and parameters: {'x_0_0': 'cd', 'x_0_1': 'cd', 'x_1_0': 'cd', 'x_1_1': 'cd'}. Best is trial 17 with value: 0.5.
[I 2025-01-12 23:20:08,018] Trial 390 finished with value: 2.0 and parameters: {'x_0_0': 'cd', 'x_0_1': 'cd', 'x_1_0': 'cd', 'x_1_1': 'cd'}. Best is trial 78 with value: 0.5.
[I 2025-01-12 23:20:08,021] Trial 359 finished with value: 2.0 and parameters: {'x_0_0': 'cd', 'x_0_1': 'cd', 'x_1_0': 'cd', 'x_1_1': 'cd'}. Best is trial 62 with value: 0.5.
[I 2025-01-12 23:20:08,041] Trial 379 finished with value: 2.0 and parameters: {'x_0_0': 'cd', 'x_0_1': 'cd', 'x_1_0': 'cd', 'x_1_1': 'cd'}. Best is trial 68 with value: 0.5.
[I 2025-01-12 23:20:08,066] Trial 366 finished with value: 2.0 and parameters: {'x_0_0': 'cd', 'x_0_1': 'cd', 'x_1_0': 'cd', 'x_1_1': 'cd'}. Best is trial 35 with value: 0.5.
[I 2025-01-12 23:20:08,086] Trial 385 finished with value: 2.0 and parameters: {'x_0_0': 'cd', 'x_0_1': 'cd', 'x_1_0': 'cd', 'x_1_1': 'cd'}. Best is trial 76 with value: 0.5.
[I 2025-01-12 23:20:08,091] Trial 389 finished with value: 2.0 and parameters: {'x_0_0': 'cd', 'x_0_1': 'cd', 'x_1_0': 'cd', 'x_1_1': 'cd'}. Best is trial 11 with value: 0.5.
[I 2025-01-12 23:20:08,109] Trial 390 finished with value: 2.0 and parameters: {'x_0_0': 'cd', 'x_0_1': 'cd', 'x_1_0': 'cd', 'x_1_1': 'cd'}. Best is trial 86 with value: 0.5.
[I 2025-01-12 23:20:08,123] Trial 359 finished with value: 2.0 and parameters: {'x_0_0': 'cd', 'x_0_1': 'cd', 'x_1_0': 'cd', 'x_1_1': 'cd'}. Best is trial 50 with value: 0.5.
[I 2025-01-12 23:20:08,144] Trial 386 finished with value: 2.0 and parameters: {'x_0_0': 'cd', 'x_0_1': 'cd', 'x_1_0': 'cd', 'x_1_1': 'cd'}. Best is trial 17 with value: 0.5.
