[I 2025-01-12 23:19:21,264] Trial 83 finished with value: 1.0714285714285714 and parameters: {'x_0_0': 'ad', 'x_0_1': 'oo', 'x_1_0': 'ad', 'x_1_1': 'ad'}. Best is trial 50 with value: 0.5.
[I 2025-01-12 23:19:21,284] Trial 91 finished with value: 1.0357142857142856 and parameters: {'x_0_0': 'bc', 'x_0_1': 'ad', 'x_1_0': 'oo', 'x_1_1': 'ad'}. Best is trial 78 with value: 0.5.
[I 2025-01-12 23:19:21,298] Trial 94 finished with value: 1.0714285714285714 and parameters: {'x_0_0': 'bd', 'x_0_1': 'oo', 'x_1_0': 'ac', 'x_1_1': 'bd'}. Best is trial 17 with value: 0.5.
[I 2025-01-12 23:19:21,311] Trial 83 finished with value: 1.0714285714285714 and parameters: {'x_0_0': 'ad', 'x_0_1': 'oo', 'x_1_0': 'ac', 'x_1_1': 'ac'}. Best is trial 35 with value: 0.5.
[I 2025-01-12 23:19:21,321] Trial 98 finished with value: 1.3214285714285714 and parameters: {'x_0_0': 'bd', 'x_0_1': 'bc', 'x_1_0': 'oo', 'x_1_1': 'ad'}. Best is trial 86 with value: 0.5.
[I 2025-01-12 23:19:21,326] Trial 80 finished with value: 1.0357142857142856 and parameters: {'x_0_0': 'ac', 'x_0_1': 'ad', 'x_1_0': 'oo', 'x_1_1': 'ad'}. Best is trial 62 with value: 0.5.
[I 2025-01-12 23:19:21,328] Trial 101 finished with value: 1.3214285714285714 and parameters: {'x_0_0': 'bd', 'x_0_1': 'bd', 'x_1_0': 'oo', 'x_1_1': 'bc'}. Best is trial 100 with value: 0.6428571428571428.
[I 2025-01-12 23:19:21,356] Trial 96 finished with value: 1.0714285714285714 and parameters: {'x_0_0': 'bc', 'x_0_1': 'oo', 'x_1_0': 'ab', 'x_1_1': 'ab'}. Best is trial 76 with value: 0.5.
[I 2025-01-12 23:19:21,360] Trial 88 finished with value: 0.5 and parameters: {'x_0_0': 'ad', 'x_0_1': 'oo', 'x_1_0': 'bc', 'x_1_1': 'ad'}. Best is trial 68 with value: 0.5.
[I 2025-01-12 23:19:21,382] Trial 95 finished with value: 0.6428571428571428 and parameters: {'x_0_0': 'ad', 'x_0_1': 'oo', 'x_1_0': 'bc', 'x_1_1': 'ab'}. Best is trial 11 with value: 0.5.
[I 2025-01-12 23:19:21,389] Trial 92 finished with value: 0.7857142857142857 and parameters: {'x_0_0': 'ad', 'x_0_1': 'oo', 'x_1_0': 'bc', 'x_1_1': 'bc'}. Best is trial 78 with value: 0.5.
[I 2025-01-12 23:19:21,395] Trial 84 finished with value: 0.7857142857142857 and parameters: {'x_0_0': 'bd', 'x_0_1': 'oo', 'x_1_0': 'bc', 'x_1_1': 'bd'}. Best is trial 50 with value: 0.5.
[I 2025-01-12 23:19:21,417] Trial 95 finished with value: 1.3214285714285714 and parameters: {'x_0_0': 'bd', 'x_0_1': 'ad', 'x_1_0': 'oo', 'x_1_1': 'ac'}. Best is trial 17 with value: 0.5.
[I 2025-01-12 23:19:21,432] Trial 102 finished with value: 0.6428571428571428 and parameters: {'x_0_0': 'bd', 'x_0_1': 'oo', 'x_1_0': 'bc', 'x_1_1': 'ab'}. Best is trial 100 with value: 0.6428571428571428.
[I 2025-01-12 23:19:21,432] Trial 99 finished with value: 0.7857142857142857 and parameters: {'x_0_0': 'bd', 'x_0_1': 'oo', 'x_1_0': 'bd', 'x_1_1': 'bd'}. Best is trial 86 with value: 0.5.
[I 2025-01-12 23:19:21,446] Trial 84 finished with value: 1.0714285714285714 and parameters: {'x_0_0': 'ac', 'x_0_1': 'oo', 'x_1_0': 'bc', 'x_1_1': 'ac'}. Best is trial 35 with value: 0.5.
[I 2025-01-12 23:19:21,459] Trial 89 finished with value: 0.7857142857142857 and parameters: {'x_0_0': 'ad', 'x_0_1': 'oo', 'x_1_0': 'bd', 'x_1_1': 'ac'}. Best is trial 68 with value: 0.5.
[I 2025-01-12 23:19:21,463] Trial 97 finished with value: 1.0714285714285714 and parameters: {'x_0_0': 'bd', 'x_0_1': 'oo', 'x_1_0': 'ac', 'x_1_1': 'ab'}. Best is trial 76 with value: 0.5.
[I 2025-01-12 23:19:21,478] Trial 81 finished with value: 0.5 and parameters: {'x_0_0': 'bd', 'x_0_1': 'oo', 'x_1_0': 'bc', 'x_1_1': 'ac'}. Best is trial 62 with value: 0.5.
[I 2025-01-12 23:19:21,492] Trial 96 finished with value: 1.3214285714285714 and parameters: {'x_0_0': 'bd', 'x_0_1': 'ad', 'x_1_0': 'oo', 'x_1_1': 'ac'}. Best is trial 11 with value: 0.5.
[I 2025-01-12 23:19:21,494] Trial 85 finished with value: 1.0714285714285714 and parameters: {'x_0_0': 'bc', 'x_0_1': 'oo', 'x_1_0': 'bc', 'x_1_1': 'ac'}. Best is trial 50 with value: 0.5.
[I 2025-01-12 23:19:21,515] Trial 93 finished with value: 0.5 and parameters: {'x_0_0': 'bd', 'x_0_1': 'oo', 'x_1_0': 'bc', 'x_1_1': 'ac'}. Best is trial 78 with value: 0.5.
[I 2025-01-12 23:19:21,543] Trial 96 finished with value: 0.7857142857142857 and parameters: {'x_0_0': 'ad', 'x_0_1': 'oo', 'x_1_0': 'bc', 'x_1_1': 'bd'}. Best is trial 17 with value: 0.5.
[I 2025-01-12 23:19:21,544] Trial 100 finished with value: 0.7857142857142857 and parameters: {'x_0_0': 'bd', 'x_0_1': 'oo', 'x_1_0': 'bc', 'x_1_1': 'bd'}. Best is trial 86 with value: 0.5.
[I 2025-01-12 23:19:21,550] Trial 103 finished with value: 1.0357142857142856 and parameters: {'x_0_0': 'ac', 'x_0_1': 'ac', 'x_1_0': 'oo', 'x_1_1': 'ac'}. Best is trial 100 with value: 0.6428571428571428.
[I 2025-01-12 23:19:21,569] Trial 85 finished with value: 1.5 and parameters: {'x_0_0': 'cd', 'x_0_1': 'oo', 'x_1_0': 'bd', 'x_1_1': 'bd'}. Best is trial 35 with value: 0.5.
[I 2025-01-12 23:19:21,571] Trial 90 finished with value: 1.0714285714285714 and parameters: {'x_0_0': 'bc', 'x_0_1': 'oo', 'x_1_0': 'bc', 'x_1_1': 'ac'}. Best is trial 68 with value: 0.5.
[I 2025-01-12 23:19:21,572] Trial 98 finished with value: 0.7857142857142857 and parameters: {'x_0_0': 'ad', 'x_0_1': 'oo', 'x_1_0': 'bd', 'x_1_1': 'bc'}. Best is trial 76 with value: 0.5.
[I 2025-01-12 23:19:21,579] Trial 97 finished with value: 1.0714285714285714 and parameters: {'x_0_0': 'ad', 'x_0_1': 'oo', 'x_1_0': 'cd', 'x_1_1': 'bc'}. Best is trial 11 with value: 0.5.
[I 2025-01-12 23:19:21,588] Trial 82 finished with value: 1.3214285714285714 and parameters: {'x_0_0': 'ad', 'x_0_1': 'ab', 'x_1_0': 'oo', 'x_1_1': 'ab'}. Best is trial 62 with value: 0.5.
[I 2025-01-12 23:19:21,611] Trial 86 finished with value: 1.3214285714285714 and parameters: {'x_0_0': 'ad', 'x_0_1': 'ac', 'x_1_0': 'oo', 'x_1_1': 'ad'}. Best is trial 50 with value: 0.5.
[I 2025-01-12 23:19:21,631] Trial 94 finished with value: 1.3214285714285714 and parameters: {'x_0_0': 'ad', 'x_0_1': 'ab', 'x_1_0': 'oo', 'x_1_1': 'ab'}. Best is trial 78 with value: 0.5.
[I 2025-01-12 23:19:21,644] Trial 101 finished with value: 1.0357142857142856 and parameters: {'x_0_0': 'bc', 'x_0_1': 'ac', 'x_1_0': 'oo', 'x_1_1': 'ac'}. Best is trial 86 with value: 0.5.
[I 2025-01-12 23:19:21,657] Trial 97 finished with value: 1.0714285714285714 and parameters: {'x_0_0': 'bc', 'x_0_1': 'oo', 'x_1_0': 'bd', 'x_1_1': 'ac'}. Best is trial 17 with value: 0.5.
[I 2025-01-12 23:19:21,671] Trial 104 finished with value: 0.7857142857142857 and parameters: {'x_0_0': 'bd', 'x_0_1': 'oo', 'x_1_0': 'bd', 'x_1_1': 'ac'}. Best is trial 100 with value: 0.6428571428571428.
[I 2025-01-12 23:19:21,676] Trial 99 finished with value: 0.5 and parameters: {'x_0_0': 'bd', 'x_0_1': 'oo', 'x_1_0': 'bc', 'x_1_1': 'ad'}. Best is trial 76 with value: 0.5.
[I 2025-01-12 23:19:21,679] Trial 86 finished with value: 0.7857142857142857 and parameters: {'x_0_0': 'ad', 'x_0_1': 'oo', 'x_1_0': 'bc', 'x_1_1': 'bc'}. Best is trial 35 with value: 0.5.
[I 2025-01-12 23:19:21,688] Trial 98 finished with value: 1.0714285714285714 and parameters: {'x_0_0': 'bc', 'x_0_1': 'oo', 'x_1_0': 'bc', 'x_1_1': 'ac'}. Best is trial 11 with value: 0.5.
[I 2025-01-12 23:19:21,709] Trial 91 finished with value: 0.7857142857142857 and parameters: {'x_0_0': 'ad', 'x_0_1': 'oo', 'x_1_0': 'bd', 'x_1_1': 'ab'}. Best is trial 68 with value: 0.5.
[I 2025-01-12 23:19:21,712] Trial 83 finished with value: 1.0714285714285714 and parameters: {'x_0_0': 'bc', 'x_0_1': 'oo', 'x_1_0': 'bc', 'x_1_1': 'ac'}. Best is trial 62 with value: 0.5.
[I 2025-01-12 23:19:21,724] Trial 87 finished with value: 1.0714285714285714 and parameters: {'x_0_0': 'ad', 'x_0_1': 'oo', 'x_1_0': 'cd', 'x_1_1': 'ad'}. Best is trial 50 with value: 0.5.
[I 2025-01-12 23:19:21,732] Trial 95 finished with value: 1.3214285714285714 and parameters: {'x_0_0': 'ad', 'x_0_1': 'ab', 'x_1_0': 'oo', 'x_1_1': 'ac'}. Best is trial 78 with value: 0.5.
[I 2025-01-12 23:19:21,750] Trial 102 finished with value: 1.0714285714285714 and parameters: {'x_0_0': 'ad', 'x_0_1': 'oo', 'x_1_0': 'ac', 'x_1_1': 'ac'}. Best is trial 86 with value: 0.5.
[I 2025-01-12 23:19:21,768] Trial 98 finished with value: 0.7857142857142857 and parameters: {'x_0_0': 'bd', 'x_0_1': 'oo', 'x_1_0': 'bd', 'x_1_1': 'ad'}. Best is trial 17 with value: 0.5.
[I 2025-01-12 23:19:21,783] Trial 105 finished with value: 0.7857142857142857 and parameters: {'x_0_0': 'bd', 'x_0_1': 'oo', 'x_1_0': 'bd', 'x_1_1': 'ab'}. Best is trial 100 with value: 0.6428571428571428.
[I 2025-01-12 23:19:21,790] Trial 100 finished with value: 1.0714285714285714 and parameters: {'x_0_0': 'ac', 'x_0_1': 'oo', 'x_1_0': 'ab', 'x_1_1': 'ab'}. Best is trial 76 with value: 0.5.
[I 2025-01-12 23:19:21,800] Trial 87 finished with value: 0.7857142857142857 and parameters: {'x_0_0': 'bd', 'x_0_1': 'oo', 'x_1_0': 'bd', 'x_1_1': 'bd'}. Best is trial 35 with value: 0.5.
[I 2025-01-12 23:19:21,806] Trial 99 finished with value: 1.0357142857142856 and parameters: {'x_0_0': 'bc', 'x_0_1': 'ac', 'x_1_0': 'oo', 'x_1_1': 'ad'}. Best is trial 11 with value: 0.5.
[I 2025-01-12 23:19:21,820] Trial 84 finished with value: 1.0714285714285714 and parameters: {'x_0_0': 'ac', 'x_0_1': 'oo', 'x_1_0': 'bd', 'x_1_1': 'ac'}. Best is trial 62 with value: 0.5.
[I 2025-01-12 23:19:21,831] Trial 92 finished with value: 0.9285714285714286 and parameters: {'x_0_0': 'ad', 'x_0_1': 'oo', 'x_1_0': 'ab', 'x_1_1': 'ad'}. Best is trial 68 with value: 0.5.
[I 2025-01-12 23:19:21,841] Trial 88 finished with value: 0.7857142857142857 and parameters: {'x_0_0': 'bd', 'x_0_1': 'oo', 'x_1_0': 'bd', 'x_1_1': 'ac'}. Best is trial 50 with value: 0.5.
[I 2025-01-12 23:19:21,859] Trial 96 finished with value: 1.0714285714285714 and parameters: {'x_0_0': 'bc', 'x_0_1': 'oo', 'x_1_0': 'bc', 'x_1_1': 'ac'}. Best is trial 78 with value: 0.5.
[I 2025-01-12 23:19:21,861] Trial 103 finished with value: 1.3214285714285714 and parameters: {'x_0_0': 'bd', 'x_0_1': 'ab', 'x_1_0': 'oo', 'x_1_1': 'ac'}. Best is trial 86 with value: 0.5.
[I 2025-01-12 23:19:21,904] Trial 99 finished with value: 1.3214285714285714 and parameters: {'x_0_0': 'bd', 'x_0_1': 'cd', 'x_1_0': 'oo', 'x_1_1': 'ab'}. Best is trial 17 with value: 0.5.
[I 2025-01-12 23:19:21,916] Trial 100 finished with value: 0.9285714285714286 and parameters: {'x_0_0': 'bd', 'x_0_1': 'oo', 'x_1_0': 'ab', 'x_1_1': 'ac'}. Best is trial 11 with value: 0.5.
[I 2025-01-12 23:19:21,921] Trial 101 finished with value: 0.7857142857142857 and parameters: {'x_0_0': 'bd', 'x_0_1': 'oo', 'x_1_0': 'bd', 'x_1_1': 'bc'}. Best is trial 76 with value: 0.5.
[I 2025-01-12 23:19:21,932] Trial 88 finished with value: 1.0714285714285714 and parameters: {'x_0_0': 'bc', 'x_0_1': 'oo', 'x_1_0': 'cd', 'x_1_1': 'bc'}. Best is trial 35 with value: 0.5.
[I 2025-01-12 23:19:21,939] Trial 85 finished with value: 0.7857142857142857 and parameters: {'x_0_0': 'ad', 'x_0_1': 'oo', 'x_1_0': 'bd', 'x_1_1': 'ac'}. Best is trial 62 with value: 0.5.
[I 2025-01-12 23:19:21,965] Trial 104 finished with value: 0.7857142857142857 and parameters: {'x_0_0': 'ad', 'x_0_1': 'oo', 'x_1_0': 'bd', 'x_1_1': 'bd'}. Best is trial 86 with value: 0.5.
[I 2025-01-12 23:19:21,969] Trial 97 finished with value: 0.7857142857142857 and parameters: {'x_0_0': 'bd', 'x_0_1': 'oo', 'x_1_0': 'bc', 'x_1_1': 'bc'}. Best is trial 78 with value: 0.5.
[I 2025-01-12 23:19:21,970] Trial 93 finished with value: 1.3214285714285714 and parameters: {'x_0_0': 'ad', 'x_0_1': 'bd', 'x_1_0': 'oo', 'x_1_1': 'bd'}. Best is trial 68 with value: 0.5.
[I 2025-01-12 23:19:21,973] Trial 89 finished with value: 1.0714285714285714 and parameters: {'x_0_0': 'bd', 'x_0_1': 'oo', 'x_1_0': 'cd', 'x_1_1': 'ab'}. Best is trial 50 with value: 0.5.
[I 2025-01-12 23:19:22,006] Trial 100 finished with value: 0.7857142857142857 and parameters: {'x_0_0': 'bd', 'x_0_1': 'oo', 'x_1_0': 'bd', 'x_1_1': 'ac'}. Best is trial 17 with value: 0.5.
[I 2025-01-12 23:19:22,032] Trial 101 finished with value: 1.0357142857142856 and parameters: {'x_0_0': 'bc', 'x_0_1': 'ac', 'x_1_0': 'oo', 'x_1_1': 'ac'}. Best is trial 11 with value: 0.5.
[I 2025-01-12 23:19:22,036] Trial 102 finished with value: 1.0714285714285714 and parameters: {'x_0_0': 'bc', 'x_0_1': 'oo', 'x_1_0': 'ab', 'x_1_1': 'ac'}. Best is trial 76 with value: 0.5.
[I 2025-01-12 23:19:22,044] Trial 89 finished with value: 0.7857142857142857 and parameters: {'x_0_0': 'ad', 'x_0_1': 'oo', 'x_1_0': 'bd', 'x_1_1': 'ab'}. Best is trial 35 with value: 0.5.
[I 2025-01-12 23:19:22,062] Trial 86 finished with value: 0.7857142857142857 and parameters: {'x_0_0': 'ad', 'x_0_1': 'oo', 'x_1_0': 'bc', 'x_1_1': 'bd'}. Best is trial 62 with value: 0.5.
[I 2025-01-12 23:19:22,078] Trial 105 finished with value: 1.3214285714285714 and parameters: {'x_0_0': 'bd', 'x_0_1': 'ad', 'x_1_0': 'oo', 'x_1_1': 'ab'}. Best is trial 86 with value: 0.5.
[I 2025-01-12 23:19:22,078] Trial 94 finished with value: 1.0714285714285714 and parameters: {'x_0_0': 'bc', 'x_0_1': 'oo', 'x_1_0': 'bd', 'x_1_1': 'bd'}. Best is trial 68 with value: 0.5.
[I 2025-01-12 23:19:22,080] Trial 98 finished with value: 1.3214285714285714 and parameters: {'x_0_0': 'ad', 'x_0_1': 'ad', 'x_1_0': 'oo', 'x_1_1': 'bd'}. Best is trial 78 with value: 0.5.
[I 2025-01-12 23:19:22,104] Trial 90 finished with value: 1.0714285714285714 and parameters: {'x_0_0': 'ad', 'x_0_1': 'oo', 'x_1_0': 'cd', 'x_1_1': 'ab'}. Best is trial 50 with value: 0.5.
[I 2025-01-12 23:19:22,117] Trial 101 finished with value: 1.3214285714285714 and parameters: {'x_0_0': 'bd', 'x_0_1': 'cd', 'x_1_0': 'oo', 'x_1_1': 'ad'}. Best is trial 17 with value: 0.5.
[I 2025-01-12 23:19:22,130] Trial 102 finished with value: 1.0714285714285714 and parameters: {'x_0_0': 'bc', 'x_0_1': 'oo', 'x_1_0': 'bc', 'x_1_1': 'ad'}. Best is trial 11 with value: 0.5.
[I 2025-01-12 23:19:22,157] Trial 87 finished with value: 1.3214285714285714 and parameters: {'x_0_0': 'ad', 'x_0_1': 'ad', 'x_1_0': 'oo', 'x_1_1': 'ac'}. Best is trial 62 with value: 0.5.
[I 2025-01-12 23:19:22,168] Trial 103 finished with value: 1.0714285714285714 and parameters: {'x_0_0': 'bc', 'x_0_1': 'oo', 'x_1_0': 'bc', 'x_1_1': 'bd'}. Best is trial 76 with value: 0.5.
[I 2025-01-12 23:19:22,175] Trial 90 finished with value: 0.7857142857142857 and parameters: {'x_0_0': 'ad', 'x_0_1': 'oo', 'x_1_0': 'bd', 'x_1_1': 'bd'}. Best is trial 35 with value: 0.5.
[I 2025-01-12 23:19:22,225] Trial 95 finished with value: 1.0357142857142856 and parameters: {'x_0_0': 'bc', 'x_0_1': 'ad', 'x_1_0': 'oo', 'x_1_1': 'ac'}. Best is trial 68 with value: 0.5.
[I 2025-01-12 23:19:22,229] Trial 99 finished with value: 0.7857142857142857 and parameters: {'x_0_0': 'ad', 'x_0_1': 'oo', 'x_1_0': 'bd', 'x_1_1': 'ac'}. Best is trial 78 with value: 0.5.
[I 2025-01-12 23:19:22,241] Trial 91 finished with value: 1.0714285714285714 and parameters: {'x_0_0': 'bc', 'x_0_1': 'oo', 'x_1_0': 'bc', 'x_1_1': 'bd'}. Best is trial 50 with value: 0.5.
[I 2025-01-12 23:19:22,260] Trial 106 finished with value: 1.0714285714285714 and parameters: {'x_0_0': 'bd', 'x_0_1': 'oo', 'x_1_0': 'ad', 'x_1_1': 'bc'}. Best is trial 100 with value: 0.6428571428571428.
[I 2025-01-12 23:19:22,277] Trial 103 finished with value: 1.0714285714285714 and parameters: {'x_0_0': 'ad', 'x_0_1': 'oo', 'x_1_0': 'ac', 'x_1_1': 'ad'}. Best is trial 11 with value: 0.5.
[I 2025-01-12 23:19:22,281] Trial 102 finished with value: 0.9285714285714286 and parameters: {'x_0_0': 'ad', 'x_0_1': 'oo', 'x_1_0': 'ab', 'x_1_1': 'ac'}. Best is trial 17 with value: 0.5.
[I 2025-01-12 23:19:22,339] Trial 104 finished with value: 0.7857142857142857 and parameters: {'x_0_0': 'bd', 'x_0_1': 'oo', 'x_1_0': 'bd', 'x_1_1': 'ab'}. Best is trial 76 with value: 0.5.
[I 2025-01-12 23:19:22,340] Trial 88 finished with value: 1.3214285714285714 and parameters: {'x_0_0': 'ad', 'x_0_1': 'ab', 'x_1_0': 'oo', 'x_1_1': 'ad'}. Best is trial 62 with value: 0.5.
[I 2025-01-12 23:19:22,346] Trial 100 finished with value: 1.0714285714285714 and parameters: {'x_0_0': 'bd', 'x_0_1': 'oo', 'x_1_0': 'cd', 'x_1_1': 'ac'}. Best is trial 78 with value: 0.5.
[I 2025-01-12 23:19:22,354] Trial 91 finished with value: 1.1785714285714286 and parameters: {'x_0_0': 'ac', 'x_0_1': 'ab', 'x_1_0': 'oo', 'x_1_1': 'bc'}. Best is trial 35 with value: 0.5.
[I 2025-01-12 23:19:22,379] Trial 103 finished with value: 1.0357142857142856 and parameters: {'x_0_0': 'bc', 'x_0_1': 'ac', 'x_1_0': 'oo', 'x_1_1': 'bc'}. Best is trial 17 with value: 0.5.
[I 2025-01-12 23:19:22,389] Trial 107 finished with value: 1.0714285714285714 and parameters: {'x_0_0': 'bc', 'x_0_1': 'oo', 'x_1_0': 'ad', 'x_1_1': 'bc'}. Best is trial 100 with value: 0.6428571428571428.
[I 2025-01-12 23:19:22,393] Trial 92 finished with value: 0.5 and parameters: {'x_0_0': 'bd', 'x_0_1': 'oo', 'x_1_0': 'bc', 'x_1_1': 'ad'}. Best is trial 50 with value: 0.5.
[I 2025-01-12 23:19:22,397] Trial 96 finished with value: 1.75 and parameters: {'x_0_0': 'cd', 'x_0_1': 'bc', 'x_1_0': 'oo', 'x_1_1': 'ac'}. Best is trial 68 with value: 0.5.
[I 2025-01-12 23:19:22,430] Trial 104 finished with value: 1.0714285714285714 and parameters: {'x_0_0': 'ad', 'x_0_1': 'oo', 'x_1_0': 'ad', 'x_1_1': 'bd'}. Best is trial 11 with value: 0.5.
[I 2025-01-12 23:19:22,458] Trial 105 finished with value: 1.0714285714285714 and parameters: {'x_0_0': 'ac', 'x_0_1': 'oo', 'x_1_0': 'bd', 'x_1_1': 'bc'}. Best is trial 76 with value: 0.5.
[I 2025-01-12 23:19:22,460] Trial 89 finished with value: 1.0714285714285714 and parameters: {'x_0_0': 'ad', 'x_0_1': 'oo', 'x_1_0': 'ac', 'x_1_1': 'bc'}. Best is trial 62 with value: 0.5.
[I 2025-01-12 23:19:22,469] Trial 101 finished with value: 0.9285714285714286 and parameters: {'x_0_0': 'ad', 'x_0_1': 'oo', 'x_1_0': 'ab', 'x_1_1': 'bd'}. Best is trial 78 with value: 0.5.
[I 2025-01-12 23:19:22,471] Trial 92 finished with value: 1.0714285714285714 and parameters: {'x_0_0': 'ad', 'x_0_1': 'oo', 'x_1_0': 'ad', 'x_1_1': 'bc'}. Best is trial 35 with value: 0.5.
[I 2025-01-12 23:19:22,517] Trial 97 finished with value: 0.75 and parameters: {'x_0_0': 'bc', 'x_0_1': 'ad', 'x_1_0': 'oo', 'x_1_1': 'bc'}. Best is trial 68 with value: 0.5.
[I 2025-01-12 23:19:22,524] Trial 108 finished with value: 0.8928571428571428 and parameters: {'x_0_0': 'ac', 'x_0_1': 'ad', 'x_1_0': 'oo', 'x_1_1': 'ab'}. Best is trial 100 with value: 0.6428571428571428.
[I 2025-01-12 23:19:22,530] Trial 93 finished with value: 1.0714285714285714 and parameters: {'x_0_0': 'ac', 'x_0_1': 'oo', 'x_1_0': 'bd', 'x_1_1': 'ac'}. Best is trial 50 with value: 0.5.
[I 2025-01-12 23:19:22,571] Trial 102 finished with value: 1.0714285714285714 and parameters: {'x_0_0': 'ad', 'x_0_1': 'oo', 'x_1_0': 'cd', 'x_1_1': 'ac'}. Best is trial 78 with value: 0.5.
[I 2025-01-12 23:19:22,580] Trial 90 finished with value: 1.0714285714285714 and parameters: {'x_0_0': 'ac', 'x_0_1': 'oo', 'x_1_0': 'bc', 'x_1_1': 'ab'}. Best is trial 62 with value: 0.5.
[I 2025-01-12 23:19:22,591] Trial 93 finished with value: 1.3214285714285714 and parameters: {'x_0_0': 'bd', 'x_0_1': 'bd', 'x_1_0': 'oo', 'x_1_1': 'ad'}. Best is trial 35 with value: 0.5.
[I 2025-01-12 23:19:22,638] Trial 109 finished with value: 1.3214285714285714 and parameters: {'x_0_0': 'ac', 'x_0_1': 'bd', 'x_1_0': 'oo', 'x_1_1': 'ab'}. Best is trial 100 with value: 0.6428571428571428.
[I 2025-01-12 23:19:22,639] Trial 98 finished with value: 1.0714285714285714 and parameters: {'x_0_0': 'bd', 'x_0_1': 'oo', 'x_1_0': 'ac', 'x_1_1': 'bd'}. Best is trial 68 with value: 0.5.
[I 2025-01-12 23:19:22,651] Trial 94 finished with value: 1.0714285714285714 and parameters: {'x_0_0': 'ac', 'x_0_1': 'oo', 'x_1_0': 'bc', 'x_1_1': 'ab'}. Best is trial 50 with value: 0.5.
[I 2025-01-12 23:19:22,681] Trial 103 finished with value: 0.7857142857142857 and parameters: {'x_0_0': 'bd', 'x_0_1': 'oo', 'x_1_0': 'bd', 'x_1_1': 'ad'}. Best is trial 78 with value: 0.5.
[I 2025-01-12 23:19:22,783] Trial 106 finished with value: 1.0714285714285714 and parameters: {'x_0_0': 'ac', 'x_0_1': 'oo', 'x_1_0': 'cd', 'x_1_1': 'bc'}. Best is trial 86 with value: 0.5.
[I 2025-01-12 23:19:22,826] Trial 94 finished with value: 1.0714285714285714 and parameters: {'x_0_0': 'ac', 'x_0_1': 'oo', 'x_1_0': 'bd', 'x_1_1': 'ac'}. Best is trial 35 with value: 0.5.
[I 2025-01-12 23:19:22,845] Trial 91 finished with value: 1.0714285714285714 and parameters: {'x_0_0': 'bc', 'x_0_1': 'oo', 'x_1_0': 'bd', 'x_1_1': 'ac'}. Best is trial 62 with value: 0.5.
[I 2025-01-12 23:19:22,901] Trial 99 finished with value: 0.7857142857142857 and parameters: {'x_0_0': 'bd', 'x_0_1': 'oo', 'x_1_0': 'bd', 'x_1_1': 'bc'}. Best is trial 68 with value: 0.5.
[I 2025-01-12 23:19:22,914] Trial 95 finished with value: 1.0714285714285714 and parameters: {'x_0_0': 'ac', 'x_0_1': 'oo', 'x_1_0': 'bd', 'x_1_1': 'bd'}. Best is trial 50 with value: 0.5.
[I 2025-01-12 23:19:22,920] Trial 110 finished with value: 1.3214285714285714 and parameters: {'x_0_0': 'ac', 'x_0_1': 'bd', 'x_1_0': 'oo', 'x_1_1': 'bc'}. Best is trial 100 with value: 0.6428571428571428.
[I 2025-01-12 23:19:22,955] Trial 104 finished with value: 0.9285714285714286 and parameters: {'x_0_0': 'bd', 'x_0_1': 'oo', 'x_1_0': 'ab', 'x_1_1': 'ad'}. Best is trial 78 with value: 0.5.
[I 2025-01-12 23:19:22,990] Trial 95 finished with value: 1.3214285714285714 and parameters: {'x_0_0': 'ac', 'x_0_1': 'bd', 'x_1_0': 'oo', 'x_1_1': 'bd'}. Best is trial 35 with value: 0.5.
[I 2025-01-12 23:19:23,006] Trial 92 finished with value: 0.7857142857142857 and parameters: {'x_0_0': 'bd', 'x_0_1': 'oo', 'x_1_0': 'bd', 'x_1_1': 'ac'}. Best is trial 62 with value: 0.5.
[I 2025-01-12 23:19:23,021] Trial 107 finished with value: 1.3214285714285714 and parameters: {'x_0_0': 'ad', 'x_0_1': 'bd', 'x_1_0': 'oo', 'x_1_1': 'ad'}. Best is trial 86 with value: 0.5.
