[I 2025-01-12 23:19:39,945] Trial 208 finished with value: 0.9285714285714286 and parameters: {'x_0_0': 'ad', 'x_0_1': 'oo', 'x_1_0': 'ab', 'x_1_1': 'ad'}. Best is trial 78 with value: 0.5.
[I 2025-01-12 23:19:39,966] Trial 210 finished with value: 1.3214285714285714 and parameters: {'x_0_0': 'ad', 'x_0_1': 'cd', 'x_1_0': 'oo', 'x_1_1': 'bc'}. Best is trial 76 with value: 0.5.
[I 2025-01-12 23:19:39,966] Trial 196 finished with value: 1.3214285714285714 and parameters: {'x_0_0': 'ad', 'x_0_1': 'ab', 'x_1_0': 'oo', 'x_1_1': 'bc'}. Best is trial 62 with value: 0.5.
[I 2025-01-12 23:19:39,978] Trial 219 finished with value: 1.1785714285714286 and parameters: {'x_0_0': 'ac', 'x_0_1': 'ab', 'x_1_0': 'oo', 'x_1_1': 'bd'}. Best is trial 120 with value: 0.5.
/Users/keisukeonoue/ws/constrained_BO_v3/bo-env_v3/lib/python3.12/site-packages/numpy/_core/_methods.py:208: RuntimeWarning: overflow encountered in reduce
  ret = umr_sum(x, axis, dtype, out, keepdims=keepdims, where=where)
[I 2025-01-12 23:19:40,030] Trial 209 finished with value: 1.0714285714285714 and parameters: {'x_0_0': 'ac', 'x_0_1': 'oo', 'x_1_0': 'cd', 'x_1_1': 'bc'}. Best is trial 17 with value: 0.5.
[I 2025-01-12 23:19:40,036] Trial 198 finished with value: 1.0714285714285714 and parameters: {'x_0_0': 'ac', 'x_0_1': 'oo', 'x_1_0': 'ad', 'x_1_1': 'ad'}. Best is trial 35 with value: 0.5.
[I 2025-01-12 23:19:40,036] Trial 211 finished with value: 1.75 and parameters: {'x_0_0': 'cd', 'x_0_1': 'cd', 'x_1_0': 'oo', 'x_1_1': 'ab'}. Best is trial 11 with value: 0.5.
[I 2025-01-12 23:19:40,059] Trial 209 finished with value: 1.75 and parameters: {'x_0_0': 'cd', 'x_0_1': 'ad', 'x_1_0': 'oo', 'x_1_1': 'ac'}. Best is trial 78 with value: 0.5.
[I 2025-01-12 23:19:40,067] Trial 211 finished with value: 1.3214285714285714 and parameters: {'x_0_0': 'ad', 'x_0_1': 'ab', 'x_1_0': 'oo', 'x_1_1': 'ab'}. Best is trial 76 with value: 0.5.
[I 2025-01-12 23:19:40,083] Trial 220 finished with value: 1.3214285714285714 and parameters: {'x_0_0': 'bc', 'x_0_1': 'bc', 'x_1_0': 'oo', 'x_1_1': 'ac'}. Best is trial 120 with value: 0.5.
[I 2025-01-12 23:19:40,098] Trial 212 finished with value: 1.0357142857142856 and parameters: {'x_0_0': 'bc', 'x_0_1': 'ad', 'x_1_0': 'oo', 'x_1_1': 'ad'}. Best is trial 86 with value: 0.5.
[I 2025-01-12 23:19:40,103] Trial 197 finished with value: 1.0714285714285714 and parameters: {'x_0_0': 'ac', 'x_0_1': 'oo', 'x_1_0': 'bd', 'x_1_1': 'bc'}. Best is trial 62 with value: 0.5.
/Users/keisukeonoue/ws/constrained_BO_v3/bo-env_v3/lib/python3.12/site-packages/numpy/_core/_methods.py:208: RuntimeWarning: overflow encountered in reduce
  ret = umr_sum(x, axis, dtype, out, keepdims=keepdims, where=where)
[I 2025-01-12 23:19:40,132] Trial 210 finished with value: 1.3214285714285714 and parameters: {'x_0_0': 'bd', 'x_0_1': 'ac', 'x_1_0': 'oo', 'x_1_1': 'bc'}. Best is trial 17 with value: 0.5.
[I 2025-01-12 23:19:40,166] Trial 199 finished with value: 1.0714285714285714 and parameters: {'x_0_0': 'bd', 'x_0_1': 'oo', 'x_1_0': 'ad', 'x_1_1': 'bd'}. Best is trial 35 with value: 0.5.
[I 2025-01-12 23:19:40,170] Trial 212 finished with value: 1.3214285714285714 and parameters: {'x_0_0': 'bd', 'x_0_1': 'bc', 'x_1_0': 'oo', 'x_1_1': 'bd'}. Best is trial 11 with value: 0.5.
[I 2025-01-12 23:19:40,191] Trial 210 finished with value: 1.5 and parameters: {'x_0_0': 'cd', 'x_0_1': 'oo', 'x_1_0': 'bd', 'x_1_1': 'bc'}. Best is trial 78 with value: 0.5.
[I 2025-01-12 23:19:40,197] Trial 198 finished with value: 1.3214285714285714 and parameters: {'x_0_0': 'bd', 'x_0_1': 'bc', 'x_1_0': 'oo', 'x_1_1': 'ac'}. Best is trial 62 with value: 0.5.
[I 2025-01-12 23:19:40,209] Trial 212 finished with value: 1.3214285714285714 and parameters: {'x_0_0': 'bd', 'x_0_1': 'bd', 'x_1_0': 'oo', 'x_1_1': 'ac'}. Best is trial 76 with value: 0.5.
[I 2025-01-12 23:19:40,214] Trial 201 finished with value: 1.75 and parameters: {'x_0_0': 'cd', 'x_0_1': 'ab', 'x_1_0': 'oo', 'x_1_1': 'ab'}. Best is trial 50 with value: 0.5.
[I 2025-01-12 23:19:40,215] Trial 204 finished with value: 1.1785714285714286 and parameters: {'x_0_0': 'bc', 'x_0_1': 'ab', 'x_1_0': 'oo', 'x_1_1': 'ad'}. Best is trial 68 with value: 0.5.
[I 2025-01-12 23:19:40,227] Trial 221 finished with value: 1.1785714285714286 and parameters: {'x_0_0': 'ac', 'x_0_1': 'ab', 'x_1_0': 'oo', 'x_1_1': 'bc'}. Best is trial 120 with value: 0.5.
[I 2025-01-12 23:19:40,229] Trial 213 finished with value: 1.0714285714285714 and parameters: {'x_0_0': 'ac', 'x_0_1': 'oo', 'x_1_0': 'cd', 'x_1_1': 'bd'}. Best is trial 86 with value: 0.5.
/Users/keisukeonoue/ws/constrained_BO_v3/bo-env_v3/lib/python3.12/site-packages/numpy/_core/_methods.py:208: RuntimeWarning: overflow encountered in reduce
  ret = umr_sum(x, axis, dtype, out, keepdims=keepdims, where=where)
[I 2025-01-12 23:19:40,251] Trial 211 finished with value: 1.0714285714285714 and parameters: {'x_0_0': 'ac', 'x_0_1': 'oo', 'x_1_0': 'cd', 'x_1_1': 'ab'}. Best is trial 17 with value: 0.5.
[I 2025-01-12 23:19:40,307] Trial 213 finished with value: 1.0714285714285714 and parameters: {'x_0_0': 'bd', 'x_0_1': 'oo', 'x_1_0': 'ad', 'x_1_1': 'ad'}. Best is trial 11 with value: 0.5.
[I 2025-01-12 23:19:40,328] Trial 211 finished with value: 1.5 and parameters: {'x_0_0': 'cd', 'x_0_1': 'oo', 'x_1_0': 'cd', 'x_1_1': 'ab'}. Best is trial 78 with value: 0.5.
[I 2025-01-12 23:19:40,344] Trial 200 finished with value: 1.3214285714285714 and parameters: {'x_0_0': 'ac', 'x_0_1': 'bd', 'x_1_0': 'oo', 'x_1_1': 'ac'}. Best is trial 35 with value: 0.5.
[I 2025-01-12 23:19:40,348] Trial 205 finished with value: 1.1785714285714286 and parameters: {'x_0_0': 'bc', 'x_0_1': 'ab', 'x_1_0': 'oo', 'x_1_1': 'bc'}. Best is trial 68 with value: 0.5.
[I 2025-01-12 23:19:40,348] Trial 199 finished with value: 1.0714285714285714 and parameters: {'x_0_0': 'ac', 'x_0_1': 'oo', 'x_1_0': 'cd', 'x_1_1': 'bc'}. Best is trial 62 with value: 0.5.
[I 2025-01-12 23:19:40,358] Trial 213 finished with value: 0.9285714285714286 and parameters: {'x_0_0': 'bd', 'x_0_1': 'oo', 'x_1_0': 'ab', 'x_1_1': 'bc'}. Best is trial 76 with value: 0.5.
[I 2025-01-12 23:19:40,358] Trial 214 finished with value: 1.0714285714285714 and parameters: {'x_0_0': 'ac', 'x_0_1': 'oo', 'x_1_0': 'ad', 'x_1_1': 'ad'}. Best is trial 86 with value: 0.5.
[I 2025-01-12 23:19:40,362] Trial 202 finished with value: 1.3214285714285714 and parameters: {'x_0_0': 'ac', 'x_0_1': 'bc', 'x_1_0': 'oo', 'x_1_1': 'bd'}. Best is trial 50 with value: 0.5.
[I 2025-01-12 23:19:40,381] Trial 222 finished with value: 1.3214285714285714 and parameters: {'x_0_0': 'bc', 'x_0_1': 'bc', 'x_1_0': 'oo', 'x_1_1': 'ab'}. Best is trial 120 with value: 0.5.
/Users/keisukeonoue/ws/constrained_BO_v3/bo-env_v3/lib/python3.12/site-packages/numpy/_core/_methods.py:208: RuntimeWarning: overflow encountered in reduce
  ret = umr_sum(x, axis, dtype, out, keepdims=keepdims, where=where)
[I 2025-01-12 23:19:40,407] Trial 212 finished with value: 1.0714285714285714 and parameters: {'x_0_0': 'bc', 'x_0_1': 'oo', 'x_1_0': 'cd', 'x_1_1': 'ab'}. Best is trial 17 with value: 0.5.
[I 2025-01-12 23:19:40,434] Trial 201 finished with value: 1.75 and parameters: {'x_0_0': 'cd', 'x_0_1': 'cd', 'x_1_0': 'oo', 'x_1_1': 'bc'}. Best is trial 35 with value: 0.5.
[I 2025-01-12 23:19:40,450] Trial 214 finished with value: 1.5 and parameters: {'x_0_0': 'cd', 'x_0_1': 'oo', 'x_1_0': 'bd', 'x_1_1': 'ac'}. Best is trial 11 with value: 0.5.
[I 2025-01-12 23:19:40,467] Trial 203 finished with value: 1.0357142857142856 and parameters: {'x_0_0': 'bc', 'x_0_1': 'ac', 'x_1_0': 'oo', 'x_1_1': 'bd'}. Best is trial 50 with value: 0.5.
[I 2025-01-12 23:19:40,468] Trial 212 finished with value: 1.0714285714285714 and parameters: {'x_0_0': 'bc', 'x_0_1': 'oo', 'x_1_0': 'ab', 'x_1_1': 'bc'}. Best is trial 78 with value: 0.5.
[I 2025-01-12 23:19:40,477] Trial 215 finished with value: 0.75 and parameters: {'x_0_0': 'bc', 'x_0_1': 'ad', 'x_1_0': 'oo', 'x_1_1': 'bc'}. Best is trial 86 with value: 0.5.
[I 2025-01-12 23:19:40,478] Trial 200 finished with value: 1.0357142857142856 and parameters: {'x_0_0': 'bc', 'x_0_1': 'ac', 'x_1_0': 'oo', 'x_1_1': 'ac'}. Best is trial 62 with value: 0.5.
[I 2025-01-12 23:19:40,488] Trial 206 finished with value: 1.75 and parameters: {'x_0_0': 'cd', 'x_0_1': 'bd', 'x_1_0': 'oo', 'x_1_1': 'ad'}. Best is trial 68 with value: 0.5.
[I 2025-01-12 23:19:40,491] Trial 214 finished with value: 1.3214285714285714 and parameters: {'x_0_0': 'ad', 'x_0_1': 'ab', 'x_1_0': 'oo', 'x_1_1': 'ad'}. Best is trial 76 with value: 0.5.
[I 2025-01-12 23:19:40,503] Trial 223 finished with value: 1.3214285714285714 and parameters: {'x_0_0': 'ad', 'x_0_1': 'cd', 'x_1_0': 'oo', 'x_1_1': 'ab'}. Best is trial 120 with value: 0.5.
/Users/keisukeonoue/ws/constrained_BO_v3/bo-env_v3/lib/python3.12/site-packages/numpy/_core/_methods.py:208: RuntimeWarning: overflow encountered in reduce
  ret = umr_sum(x, axis, dtype, out, keepdims=keepdims, where=where)
[I 2025-01-12 23:19:40,539] Trial 213 finished with value: 1.3214285714285714 and parameters: {'x_0_0': 'bd', 'x_0_1': 'ac', 'x_1_0': 'oo', 'x_1_1': 'ab'}. Best is trial 17 with value: 0.5.
[I 2025-01-12 23:19:40,553] Trial 202 finished with value: 1.0714285714285714 and parameters: {'x_0_0': 'bd', 'x_0_1': 'oo', 'x_1_0': 'ad', 'x_1_1': 'ad'}. Best is trial 35 with value: 0.5.
[I 2025-01-12 23:19:40,571] Trial 215 finished with value: 1.0714285714285714 and parameters: {'x_0_0': 'ad', 'x_0_1': 'oo', 'x_1_0': 'ac', 'x_1_1': 'bc'}. Best is trial 11 with value: 0.5.
[I 2025-01-12 23:19:40,589] Trial 213 finished with value: 1.75 and parameters: {'x_0_0': 'cd', 'x_0_1': 'ad', 'x_1_0': 'oo', 'x_1_1': 'ad'}. Best is trial 78 with value: 0.5.
[I 2025-01-12 23:19:40,594] Trial 201 finished with value: 1.75 and parameters: {'x_0_0': 'cd', 'x_0_1': 'ac', 'x_1_0': 'oo', 'x_1_1': 'bd'}. Best is trial 62 with value: 0.5.
[I 2025-01-12 23:19:40,637] Trial 215 finished with value: 1.0714285714285714 and parameters: {'x_0_0': 'bd', 'x_0_1': 'oo', 'x_1_0': 'ac', 'x_1_1': 'bc'}. Best is trial 76 with value: 0.5.
[I 2025-01-12 23:19:40,656] Trial 207 finished with value: 1.1785714285714286 and parameters: {'x_0_0': 'bc', 'x_0_1': 'ab', 'x_1_0': 'oo', 'x_1_1': 'ac'}. Best is trial 68 with value: 0.5.
[I 2025-01-12 23:19:40,671] Trial 216 finished with value: 1.1785714285714286 and parameters: {'x_0_0': 'ac', 'x_0_1': 'ab', 'x_1_0': 'oo', 'x_1_1': 'ad'}. Best is trial 86 with value: 0.5.
[I 2025-01-12 23:19:40,674] Trial 204 finished with value: 1.5 and parameters: {'x_0_0': 'cd', 'x_0_1': 'oo', 'x_1_0': 'bc', 'x_1_1': 'bd'}. Best is trial 50 with value: 0.5.
[I 2025-01-12 23:19:40,685] Trial 224 finished with value: 1.75 and parameters: {'x_0_0': 'cd', 'x_0_1': 'ad', 'x_1_0': 'oo', 'x_1_1': 'ac'}. Best is trial 120 with value: 0.5.
/Users/keisukeonoue/ws/constrained_BO_v3/bo-env_v3/lib/python3.12/site-packages/numpy/_core/_methods.py:208: RuntimeWarning: overflow encountered in reduce
  ret = umr_sum(x, axis, dtype, out, keepdims=keepdims, where=where)
[I 2025-01-12 23:19:40,736] Trial 214 finished with value: 1.3214285714285714 and parameters: {'x_0_0': 'bd', 'x_0_1': 'ab', 'x_1_0': 'oo', 'x_1_1': 'bd'}. Best is trial 17 with value: 0.5.
[I 2025-01-12 23:19:40,736] Trial 203 finished with value: 1.5 and parameters: {'x_0_0': 'cd', 'x_0_1': 'oo', 'x_1_0': 'bc', 'x_1_1': 'ac'}. Best is trial 35 with value: 0.5.
[I 2025-01-12 23:19:40,767] Trial 214 finished with value: 1.0714285714285714 and parameters: {'x_0_0': 'ac', 'x_0_1': 'oo', 'x_1_0': 'ab', 'x_1_1': 'ad'}. Best is trial 78 with value: 0.5.
[I 2025-01-12 23:19:40,768] Trial 216 finished with value: 1.3214285714285714 and parameters: {'x_0_0': 'ad', 'x_0_1': 'bc', 'x_1_0': 'oo', 'x_1_1': 'bc'}. Best is trial 11 with value: 0.5.
[I 2025-01-12 23:19:40,782] Trial 202 finished with value: 1.1785714285714286 and parameters: {'x_0_0': 'bc', 'x_0_1': 'ab', 'x_1_0': 'oo', 'x_1_1': 'bd'}. Best is trial 62 with value: 0.5.
[I 2025-01-12 23:19:40,795] Trial 216 finished with value: 1.3214285714285714 and parameters: {'x_0_0': 'ac', 'x_0_1': 'bd', 'x_1_0': 'oo', 'x_1_1': 'ac'}. Best is trial 76 with value: 0.5.
[I 2025-01-12 23:19:40,818] Trial 208 finished with value: 1.0714285714285714 and parameters: {'x_0_0': 'ac', 'x_0_1': 'oo', 'x_1_0': 'cd', 'x_1_1': 'ab'}. Best is trial 68 with value: 0.5.
[I 2025-01-12 23:19:40,836] Trial 217 finished with value: 1.0714285714285714 and parameters: {'x_0_0': 'ac', 'x_0_1': 'oo', 'x_1_0': 'ad', 'x_1_1': 'ac'}. Best is trial 86 with value: 0.5.
[I 2025-01-12 23:19:40,841] Trial 225 finished with value: 1.0714285714285714 and parameters: {'x_0_0': 'ac', 'x_0_1': 'oo', 'x_1_0': 'ab', 'x_1_1': 'ab'}. Best is trial 120 with value: 0.5.
/Users/keisukeonoue/ws/constrained_BO_v3/bo-env_v3/lib/python3.12/site-packages/numpy/_core/_methods.py:208: RuntimeWarning: overflow encountered in reduce
  ret = umr_sum(x, axis, dtype, out, keepdims=keepdims, where=where)
[I 2025-01-12 23:19:40,862] Trial 204 finished with value: 1.3214285714285714 and parameters: {'x_0_0': 'ad', 'x_0_1': 'ac', 'x_1_0': 'oo', 'x_1_1': 'bc'}. Best is trial 35 with value: 0.5.
[I 2025-01-12 23:19:40,870] Trial 215 finished with value: 1.3214285714285714 and parameters: {'x_0_0': 'ac', 'x_0_1': 'cd', 'x_1_0': 'oo', 'x_1_1': 'bc'}. Best is trial 17 with value: 0.5.
[I 2025-01-12 23:19:40,886] Trial 215 finished with value: 1.75 and parameters: {'x_0_0': 'cd', 'x_0_1': 'ac', 'x_1_0': 'oo', 'x_1_1': 'ad'}. Best is trial 78 with value: 0.5.
[I 2025-01-12 23:19:40,891] Trial 217 finished with value: 1.0714285714285714 and parameters: {'x_0_0': 'bd', 'x_0_1': 'oo', 'x_1_0': 'ac', 'x_1_1': 'ad'}. Best is trial 11 with value: 0.5.
[I 2025-01-12 23:19:40,928] Trial 203 finished with value: 1.75 and parameters: {'x_0_0': 'cd', 'x_0_1': 'cd', 'x_1_0': 'oo', 'x_1_1': 'ab'}. Best is trial 62 with value: 0.5.
/Users/keisukeonoue/ws/constrained_BO_v3/bo-env_v3/lib/python3.12/site-packages/numpy/_core/_methods.py:208: RuntimeWarning: overflow encountered in reduce
  ret = umr_sum(x, axis, dtype, out, keepdims=keepdims, where=where)
[I 2025-01-12 23:19:40,956] Trial 226 finished with value: 1.75 and parameters: {'x_0_0': 'cd', 'x_0_1': 'ac', 'x_1_0': 'oo', 'x_1_1': 'bc'}. Best is trial 120 with value: 0.5.
[I 2025-01-12 23:19:40,967] Trial 209 finished with value: 1.0714285714285714 and parameters: {'x_0_0': 'ac', 'x_0_1': 'oo', 'x_1_0': 'cd', 'x_1_1': 'ac'}. Best is trial 68 with value: 0.5.
[I 2025-01-12 23:19:40,968] Trial 218 finished with value: 1.3214285714285714 and parameters: {'x_0_0': 'bd', 'x_0_1': 'ac', 'x_1_0': 'oo', 'x_1_1': 'bc'}. Best is trial 86 with value: 0.5.
[I 2025-01-12 23:19:40,974] Trial 205 finished with value: 1.75 and parameters: {'x_0_0': 'cd', 'x_0_1': 'cd', 'x_1_0': 'oo', 'x_1_1': 'ac'}. Best is trial 35 with value: 0.5.
[I 2025-01-12 23:19:40,980] Trial 216 finished with value: 1.5 and parameters: {'x_0_0': 'cd', 'x_0_1': 'oo', 'x_1_0': 'ad', 'x_1_1': 'ac'}. Best is trial 17 with value: 0.5.
[I 2025-01-12 23:19:40,986] Trial 218 finished with value: 1.3214285714285714 and parameters: {'x_0_0': 'ad', 'x_0_1': 'bc', 'x_1_0': 'oo', 'x_1_1': 'ad'}. Best is trial 11 with value: 0.5.
[I 2025-01-12 23:19:41,014] Trial 216 finished with value: 1.5 and parameters: {'x_0_0': 'cd', 'x_0_1': 'oo', 'x_1_0': 'bd', 'x_1_1': 'ac'}. Best is trial 78 with value: 0.5.
[I 2025-01-12 23:19:41,052] Trial 227 finished with value: 1.75 and parameters: {'x_0_0': 'cd', 'x_0_1': 'bd', 'x_1_0': 'oo', 'x_1_1': 'bd'}. Best is trial 120 with value: 0.5.
[I 2025-01-12 23:19:41,063] Trial 204 finished with value: 1.3214285714285714 and parameters: {'x_0_0': 'ad', 'x_0_1': 'ac', 'x_1_0': 'oo', 'x_1_1': 'bc'}. Best is trial 62 with value: 0.5.
/Users/keisukeonoue/ws/constrained_BO_v3/bo-env_v3/lib/python3.12/site-packages/numpy/_core/_methods.py:208: RuntimeWarning: overflow encountered in reduce
  ret = umr_sum(x, axis, dtype, out, keepdims=keepdims, where=where)
[I 2025-01-12 23:19:41,092] Trial 219 finished with value: 1.75 and parameters: {'x_0_0': 'cd', 'x_0_1': 'ac', 'x_1_0': 'oo', 'x_1_1': 'bc'}. Best is trial 86 with value: 0.5.
[I 2025-01-12 23:19:41,093] Trial 210 finished with value: 1.75 and parameters: {'x_0_0': 'cd', 'x_0_1': 'ac', 'x_1_0': 'oo', 'x_1_1': 'ac'}. Best is trial 68 with value: 0.5.
[I 2025-01-12 23:19:41,101] Trial 219 finished with value: 1.5 and parameters: {'x_0_0': 'cd', 'x_0_1': 'oo', 'x_1_0': 'bd', 'x_1_1': 'ab'}. Best is trial 11 with value: 0.5.
[I 2025-01-12 23:19:41,119] Trial 217 finished with value: 1.0714285714285714 and parameters: {'x_0_0': 'ac', 'x_0_1': 'oo', 'x_1_0': 'ad', 'x_1_1': 'bd'}. Best is trial 17 with value: 0.5.
[I 2025-01-12 23:19:41,122] Trial 217 finished with value: 1.3214285714285714 and parameters: {'x_0_0': 'ad', 'x_0_1': 'bc', 'x_1_0': 'oo', 'x_1_1': 'ab'}. Best is trial 76 with value: 0.5.
[I 2025-01-12 23:19:41,148] Trial 217 finished with value: 1.75 and parameters: {'x_0_0': 'cd', 'x_0_1': 'ac', 'x_1_0': 'oo', 'x_1_1': 'ac'}. Best is trial 78 with value: 0.5.
[I 2025-01-12 23:19:41,170] Trial 205 finished with value: 1.0714285714285714 and parameters: {'x_0_0': 'bc', 'x_0_1': 'oo', 'x_1_0': 'cd', 'x_1_1': 'bc'}. Best is trial 62 with value: 0.5.
[I 2025-01-12 23:19:41,199] Trial 228 finished with value: 1.5 and parameters: {'x_0_0': 'cd', 'x_0_1': 'oo', 'x_1_0': 'bd', 'x_1_1': 'ac'}. Best is trial 120 with value: 0.5.
/Users/keisukeonoue/ws/constrained_BO_v3/bo-env_v3/lib/python3.12/site-packages/numpy/_core/_methods.py:208: RuntimeWarning: overflow encountered in reduce
  ret = umr_sum(x, axis, dtype, out, keepdims=keepdims, where=where)
[I 2025-01-12 23:19:41,205] Trial 211 finished with value: 1.0714285714285714 and parameters: {'x_0_0': 'bc', 'x_0_1': 'oo', 'x_1_0': 'ad', 'x_1_1': 'ab'}. Best is trial 68 with value: 0.5.
[I 2025-01-12 23:19:41,213] Trial 220 finished with value: 1.75 and parameters: {'x_0_0': 'cd', 'x_0_1': 'ac', 'x_1_0': 'oo', 'x_1_1': 'bd'}. Best is trial 86 with value: 0.5.
[I 2025-01-12 23:19:41,220] Trial 220 finished with value: 1.0714285714285714 and parameters: {'x_0_0': 'ac', 'x_0_1': 'oo', 'x_1_0': 'ad', 'x_1_1': 'ad'}. Best is trial 11 with value: 0.5.
[I 2025-01-12 23:19:41,227] Trial 218 finished with value: 1.1785714285714286 and parameters: {'x_0_0': 'ac', 'x_0_1': 'ab', 'x_1_0': 'oo', 'x_1_1': 'ad'}. Best is trial 17 with value: 0.5.
[I 2025-01-12 23:19:41,238] Trial 218 finished with value: 1.0357142857142856 and parameters: {'x_0_0': 'bc', 'x_0_1': 'ac', 'x_1_0': 'oo', 'x_1_1': 'ac'}. Best is trial 76 with value: 0.5.
[I 2025-01-12 23:19:41,274] Trial 218 finished with value: 1.3214285714285714 and parameters: {'x_0_0': 'ad', 'x_0_1': 'ac', 'x_1_0': 'oo', 'x_1_1': 'ab'}. Best is trial 78 with value: 0.5.
[I 2025-01-12 23:19:41,306] Trial 206 finished with value: 1.3214285714285714 and parameters: {'x_0_0': 'bc', 'x_0_1': 'bc', 'x_1_0': 'oo', 'x_1_1': 'ac'}. Best is trial 62 with value: 0.5.
[I 2025-01-12 23:19:41,313] Trial 229 finished with value: 1.1785714285714286 and parameters: {'x_0_0': 'bc', 'x_0_1': 'ab', 'x_1_0': 'oo', 'x_1_1': 'bd'}. Best is trial 120 with value: 0.5.
[I 2025-01-12 23:19:41,325] Trial 212 finished with value: 1.5 and parameters: {'x_0_0': 'cd', 'x_0_1': 'oo', 'x_1_0': 'cd', 'x_1_1': 'bc'}. Best is trial 68 with value: 0.5.
[I 2025-01-12 23:19:41,332] Trial 221 finished with value: 1.3214285714285714 and parameters: {'x_0_0': 'bd', 'x_0_1': 'ab', 'x_1_0': 'oo', 'x_1_1': 'ad'}. Best is trial 86 with value: 0.5.
[I 2025-01-12 23:19:41,343] Trial 221 finished with value: 1.3214285714285714 and parameters: {'x_0_0': 'bd', 'x_0_1': 'bc', 'x_1_0': 'oo', 'x_1_1': 'ac'}. Best is trial 11 with value: 0.5.
/Users/keisukeonoue/ws/constrained_BO_v3/bo-env_v3/lib/python3.12/site-packages/numpy/_core/_methods.py:208: RuntimeWarning: overflow encountered in reduce
  ret = umr_sum(x, axis, dtype, out, keepdims=keepdims, where=where)
[I 2025-01-12 23:19:41,355] Trial 219 finished with value: 1.0714285714285714 and parameters: {'x_0_0': 'ac', 'x_0_1': 'oo', 'x_1_0': 'ac', 'x_1_1': 'bd'}. Best is trial 76 with value: 0.5.
[I 2025-01-12 23:19:41,372] Trial 219 finished with value: 1.1785714285714286 and parameters: {'x_0_0': 'bc', 'x_0_1': 'ab', 'x_1_0': 'oo', 'x_1_1': 'ad'}. Best is trial 17 with value: 0.5.
[I 2025-01-12 23:19:41,397] Trial 219 finished with value: 1.75 and parameters: {'x_0_0': 'cd', 'x_0_1': 'ab', 'x_1_0': 'oo', 'x_1_1': 'ac'}. Best is trial 78 with value: 0.5.
[I 2025-01-12 23:19:41,411] Trial 205 finished with value: 1.0714285714285714 and parameters: {'x_0_0': 'ac', 'x_0_1': 'oo', 'x_1_0': 'ac', 'x_1_1': 'ad'}. Best is trial 50 with value: 0.5.
[I 2025-01-12 23:19:41,436] Trial 213 finished with value: 1.0714285714285714 and parameters: {'x_0_0': 'bc', 'x_0_1': 'oo', 'x_1_0': 'cd', 'x_1_1': 'bd'}. Best is trial 68 with value: 0.5.
[I 2025-01-12 23:19:41,441] Trial 230 finished with value: 1.3214285714285714 and parameters: {'x_0_0': 'ad', 'x_0_1': 'ab', 'x_1_0': 'oo', 'x_1_1': 'bd'}. Best is trial 120 with value: 0.5.
/Users/keisukeonoue/ws/constrained_BO_v3/bo-env_v3/lib/python3.12/site-packages/numpy/_core/_methods.py:208: RuntimeWarning: overflow encountered in reduce
  ret = umr_sum(x, axis, dtype, out, keepdims=keepdims, where=where)
[I 2025-01-12 23:19:41,460] Trial 222 finished with value: 1.75 and parameters: {'x_0_0': 'cd', 'x_0_1': 'ac', 'x_1_0': 'oo', 'x_1_1': 'bd'}. Best is trial 11 with value: 0.5.
[I 2025-01-12 23:19:41,467] Trial 222 finished with value: 1.5 and parameters: {'x_0_0': 'cd', 'x_0_1': 'oo', 'x_1_0': 'ab', 'x_1_1': 'ab'}. Best is trial 86 with value: 0.5.
[I 2025-01-12 23:19:41,481] Trial 220 finished with value: 1.5 and parameters: {'x_0_0': 'cd', 'x_0_1': 'oo', 'x_1_0': 'ad', 'x_1_1': 'bd'}. Best is trial 17 with value: 0.5.
