[I 2025-01-12 23:20:30,841] Trial 481 finished with value: 2.0 and parameters: {'x_0_0': 'cd', 'x_0_1': 'cd', 'x_1_0': 'cd', 'x_1_1': 'cd'}. Best is trial 50 with value: 0.5.
[I 2025-01-12 23:20:30,884] Trial 480 finished with value: 2.0 and parameters: {'x_0_0': 'cd', 'x_0_1': 'cd', 'x_1_0': 'cd', 'x_1_1': 'cd'}. Best is trial 62 with value: 0.5.
[I 2025-01-12 23:20:30,969] Trial 482 finished with value: 2.0 and parameters: {'x_0_0': 'cd', 'x_0_1': 'cd', 'x_1_0': 'cd', 'x_1_1': 'cd'}. Best is trial 35 with value: 0.5.
/Users/keisukeonoue/ws/constrained_BO_v3/bo-env_v3/lib/python3.12/site-packages/numpy/_core/_methods.py:208: RuntimeWarning: overflow encountered in reduce
  ret = umr_sum(x, axis, dtype, out, keepdims=keepdims, where=where)
[I 2025-01-12 23:20:31,271] Trial 482 finished with value: 2.0 and parameters: {'x_0_0': 'cd', 'x_0_1': 'cd', 'x_1_0': 'cd', 'x_1_1': 'cd'}. Best is trial 50 with value: 0.5.
[I 2025-01-12 23:20:31,289] Trial 481 finished with value: 2.0 and parameters: {'x_0_0': 'cd', 'x_0_1': 'cd', 'x_1_0': 'cd', 'x_1_1': 'cd'}. Best is trial 62 with value: 0.5.
[I 2025-01-12 23:20:31,355] Trial 483 finished with value: 2.0 and parameters: {'x_0_0': 'cd', 'x_0_1': 'cd', 'x_1_0': 'cd', 'x_1_1': 'cd'}. Best is trial 35 with value: 0.5.
/Users/keisukeonoue/ws/constrained_BO_v3/bo-env_v3/lib/python3.12/site-packages/numpy/_core/_methods.py:208: RuntimeWarning: overflow encountered in reduce
  ret = umr_sum(x, axis, dtype, out, keepdims=keepdims, where=where)
[I 2025-01-12 23:20:31,560] Trial 482 finished with value: 2.0 and parameters: {'x_0_0': 'cd', 'x_0_1': 'cd', 'x_1_0': 'cd', 'x_1_1': 'cd'}. Best is trial 62 with value: 0.5.
[I 2025-01-12 23:20:31,636] Trial 483 finished with value: 2.0 and parameters: {'x_0_0': 'cd', 'x_0_1': 'cd', 'x_1_0': 'cd', 'x_1_1': 'cd'}. Best is trial 50 with value: 0.5.
[I 2025-01-12 23:20:31,782] Trial 484 finished with value: 2.0 and parameters: {'x_0_0': 'cd', 'x_0_1': 'cd', 'x_1_0': 'cd', 'x_1_1': 'cd'}. Best is trial 35 with value: 0.5.
/Users/keisukeonoue/ws/constrained_BO_v3/bo-env_v3/lib/python3.12/site-packages/numpy/_core/_methods.py:208: RuntimeWarning: overflow encountered in reduce
  ret = umr_sum(x, axis, dtype, out, keepdims=keepdims, where=where)
[I 2025-01-12 23:20:31,954] Trial 483 finished with value: 2.0 and parameters: {'x_0_0': 'cd', 'x_0_1': 'cd', 'x_1_0': 'cd', 'x_1_1': 'cd'}. Best is trial 62 with value: 0.5.
[I 2025-01-12 23:20:32,010] Trial 484 finished with value: 2.0 and parameters: {'x_0_0': 'cd', 'x_0_1': 'cd', 'x_1_0': 'cd', 'x_1_1': 'cd'}. Best is trial 50 with value: 0.5.
[I 2025-01-12 23:20:32,023] Trial 485 finished with value: 2.0 and parameters: {'x_0_0': 'cd', 'x_0_1': 'cd', 'x_1_0': 'cd', 'x_1_1': 'cd'}. Best is trial 35 with value: 0.5.
/Users/keisukeonoue/ws/constrained_BO_v3/bo-env_v3/lib/python3.12/site-packages/numpy/_core/_methods.py:208: RuntimeWarning: overflow encountered in reduce
  ret = umr_sum(x, axis, dtype, out, keepdims=keepdims, where=where)
[I 2025-01-12 23:20:32,180] Trial 484 finished with value: 2.0 and parameters: {'x_0_0': 'cd', 'x_0_1': 'cd', 'x_1_0': 'cd', 'x_1_1': 'cd'}. Best is trial 62 with value: 0.5.
[I 2025-01-12 23:20:32,264] Trial 486 finished with value: 2.0 and parameters: {'x_0_0': 'cd', 'x_0_1': 'cd', 'x_1_0': 'cd', 'x_1_1': 'cd'}. Best is trial 35 with value: 0.5.
[I 2025-01-12 23:20:32,277] Trial 485 finished with value: 2.0 and parameters: {'x_0_0': 'cd', 'x_0_1': 'cd', 'x_1_0': 'cd', 'x_1_1': 'cd'}. Best is trial 50 with value: 0.5.
/Users/keisukeonoue/ws/constrained_BO_v3/bo-env_v3/lib/python3.12/site-packages/numpy/_core/_methods.py:208: RuntimeWarning: overflow encountered in reduce
  ret = umr_sum(x, axis, dtype, out, keepdims=keepdims, where=where)
[I 2025-01-12 23:20:32,469] Trial 485 finished with value: 2.0 and parameters: {'x_0_0': 'cd', 'x_0_1': 'cd', 'x_1_0': 'cd', 'x_1_1': 'cd'}. Best is trial 62 with value: 0.5.
[I 2025-01-12 23:20:32,510] Trial 486 finished with value: 2.0 and parameters: {'x_0_0': 'cd', 'x_0_1': 'cd', 'x_1_0': 'cd', 'x_1_1': 'cd'}. Best is trial 50 with value: 0.5.
[I 2025-01-12 23:20:32,569] Trial 487 finished with value: 2.0 and parameters: {'x_0_0': 'cd', 'x_0_1': 'cd', 'x_1_0': 'cd', 'x_1_1': 'cd'}. Best is trial 35 with value: 0.5.
Best Direction Matrix:
[['ad' 'oo']
 ['bc' 'ac']]
2025-01-12 23:20:32,741 - INFO - Saved optimization history plot to results/2025-01-12_23-19-00/plots/2025-01-12_23-19-00_warcraft_map1_train_seed9_optimization_history.png
/Users/keisukeonoue/ws/constrained_BO_v3/bo-env_v3/lib/python3.12/site-packages/numpy/_core/_methods.py:208: RuntimeWarning: overflow encountered in reduce
  ret = umr_sum(x, axis, dtype, out, keepdims=keepdims, where=where)
[I 2025-01-12 23:20:32,768] Trial 486 finished with value: 2.0 and parameters: {'x_0_0': 'cd', 'x_0_1': 'cd', 'x_1_0': 'cd', 'x_1_1': 'cd'}. Best is trial 62 with value: 0.5.
[I 2025-01-12 23:20:32,815] Trial 487 finished with value: 2.0 and parameters: {'x_0_0': 'cd', 'x_0_1': 'cd', 'x_1_0': 'cd', 'x_1_1': 'cd'}. Best is trial 50 with value: 0.5.
[I 2025-01-12 23:20:32,902] Trial 488 finished with value: 2.0 and parameters: {'x_0_0': 'cd', 'x_0_1': 'cd', 'x_1_0': 'cd', 'x_1_1': 'cd'}. Best is trial 35 with value: 0.5.
/Users/keisukeonoue/ws/constrained_BO_v3/bo-env_v3/lib/python3.12/site-packages/numpy/_core/_methods.py:208: RuntimeWarning: overflow encountered in reduce
  ret = umr_sum(x, axis, dtype, out, keepdims=keepdims, where=where)
[I 2025-01-12 23:20:33,079] Trial 488 finished with value: 2.0 and parameters: {'x_0_0': 'cd', 'x_0_1': 'cd', 'x_1_0': 'cd', 'x_1_1': 'cd'}. Best is trial 50 with value: 0.5.
[I 2025-01-12 23:20:33,085] Trial 487 finished with value: 2.0 and parameters: {'x_0_0': 'cd', 'x_0_1': 'cd', 'x_1_0': 'cd', 'x_1_1': 'cd'}. Best is trial 62 with value: 0.5.
Best Direction Matrix:
[['bd' 'oo']
 ['bc' 'ac']]
2025-01-12 23:20:33,123 - INFO - Saved optimization history plot to results/2025-01-12_23-19-00/plots/2025-01-12_23-19-00_warcraft_map1_train_seed2_optimization_history.png
[I 2025-01-12 23:20:33,186] Trial 489 finished with value: 2.0 and parameters: {'x_0_0': 'cd', 'x_0_1': 'cd', 'x_1_0': 'cd', 'x_1_1': 'cd'}. Best is trial 35 with value: 0.5.
/Users/keisukeonoue/ws/constrained_BO_v3/bo-env_v3/lib/python3.12/site-packages/numpy/_core/_methods.py:208: RuntimeWarning: overflow encountered in reduce
  ret = umr_sum(x, axis, dtype, out, keepdims=keepdims, where=where)
[I 2025-01-12 23:20:33,287] Trial 489 finished with value: 2.0 and parameters: {'x_0_0': 'cd', 'x_0_1': 'cd', 'x_1_0': 'cd', 'x_1_1': 'cd'}. Best is trial 50 with value: 0.5.
[I 2025-01-12 23:20:33,289] Trial 488 finished with value: 2.0 and parameters: {'x_0_0': 'cd', 'x_0_1': 'cd', 'x_1_0': 'cd', 'x_1_1': 'cd'}. Best is trial 62 with value: 0.5.
[I 2025-01-12 23:20:33,375] Trial 490 finished with value: 2.0 and parameters: {'x_0_0': 'cd', 'x_0_1': 'cd', 'x_1_0': 'cd', 'x_1_1': 'cd'}. Best is trial 35 with value: 0.5.
/Users/keisukeonoue/ws/constrained_BO_v3/bo-env_v3/lib/python3.12/site-packages/numpy/_core/_methods.py:208: RuntimeWarning: overflow encountered in reduce
  ret = umr_sum(x, axis, dtype, out, keepdims=keepdims, where=where)
[I 2025-01-12 23:20:33,435] Trial 489 finished with value: 2.0 and parameters: {'x_0_0': 'cd', 'x_0_1': 'cd', 'x_1_0': 'cd', 'x_1_1': 'cd'}. Best is trial 62 with value: 0.5.
[I 2025-01-12 23:20:33,504] Trial 490 finished with value: 2.0 and parameters: {'x_0_0': 'cd', 'x_0_1': 'cd', 'x_1_0': 'cd', 'x_1_1': 'cd'}. Best is trial 50 with value: 0.5.
Best Direction Matrix:
[['bd' 'oo']
 ['bc' 'ad']]
2025-01-12 23:20:33,551 - INFO - Saved optimization history plot to results/2025-01-12_23-19-00/plots/2025-01-12_23-19-00_warcraft_map1_train_seed6_optimization_history.png
/Users/keisukeonoue/ws/constrained_BO_v3/bo-env_v3/lib/python3.12/site-packages/numpy/_core/_methods.py:208: RuntimeWarning: overflow encountered in reduce
  ret = umr_sum(x, axis, dtype, out, keepdims=keepdims, where=where)
[I 2025-01-12 23:20:33,629] Trial 491 finished with value: 2.0 and parameters: {'x_0_0': 'cd', 'x_0_1': 'cd', 'x_1_0': 'cd', 'x_1_1': 'cd'}. Best is trial 35 with value: 0.5.
[I 2025-01-12 23:20:33,648] Trial 490 finished with value: 2.0 and parameters: {'x_0_0': 'cd', 'x_0_1': 'cd', 'x_1_0': 'cd', 'x_1_1': 'cd'}. Best is trial 62 with value: 0.5.
[I 2025-01-12 23:20:33,657] Trial 491 finished with value: 2.0 and parameters: {'x_0_0': 'cd', 'x_0_1': 'cd', 'x_1_0': 'cd', 'x_1_1': 'cd'}. Best is trial 50 with value: 0.5.
[I 2025-01-12 23:20:33,735] Trial 492 finished with value: 2.0 and parameters: {'x_0_0': 'cd', 'x_0_1': 'cd', 'x_1_0': 'cd', 'x_1_1': 'cd'}. Best is trial 35 with value: 0.5.
/Users/keisukeonoue/ws/constrained_BO_v3/bo-env_v3/lib/python3.12/site-packages/numpy/_core/_methods.py:208: RuntimeWarning: overflow encountered in reduce
  ret = umr_sum(x, axis, dtype, out, keepdims=keepdims, where=where)
[I 2025-01-12 23:20:33,758] Trial 491 finished with value: 2.0 and parameters: {'x_0_0': 'cd', 'x_0_1': 'cd', 'x_1_0': 'cd', 'x_1_1': 'cd'}. Best is trial 62 with value: 0.5.
[I 2025-01-12 23:20:33,767] Trial 492 finished with value: 2.0 and parameters: {'x_0_0': 'cd', 'x_0_1': 'cd', 'x_1_0': 'cd', 'x_1_1': 'cd'}. Best is trial 50 with value: 0.5.
/Users/keisukeonoue/ws/constrained_BO_v3/bo-env_v3/lib/python3.12/site-packages/numpy/_core/_methods.py:208: RuntimeWarning: overflow encountered in reduce
  ret = umr_sum(x, axis, dtype, out, keepdims=keepdims, where=where)
[I 2025-01-12 23:20:33,858] Trial 493 finished with value: 2.0 and parameters: {'x_0_0': 'cd', 'x_0_1': 'cd', 'x_1_0': 'cd', 'x_1_1': 'cd'}. Best is trial 35 with value: 0.5.
[I 2025-01-12 23:20:33,872] Trial 492 finished with value: 2.0 and parameters: {'x_0_0': 'cd', 'x_0_1': 'cd', 'x_1_0': 'cd', 'x_1_1': 'cd'}. Best is trial 62 with value: 0.5.
[I 2025-01-12 23:20:33,906] Trial 493 finished with value: 2.0 and parameters: {'x_0_0': 'cd', 'x_0_1': 'cd', 'x_1_0': 'cd', 'x_1_1': 'cd'}. Best is trial 50 with value: 0.5.
/Users/keisukeonoue/ws/constrained_BO_v3/bo-env_v3/lib/python3.12/site-packages/numpy/_core/_methods.py:208: RuntimeWarning: overflow encountered in reduce
  ret = umr_sum(x, axis, dtype, out, keepdims=keepdims, where=where)
[I 2025-01-12 23:20:34,016] Trial 494 finished with value: 2.0 and parameters: {'x_0_0': 'cd', 'x_0_1': 'cd', 'x_1_0': 'cd', 'x_1_1': 'cd'}. Best is trial 35 with value: 0.5.
[I 2025-01-12 23:20:34,040] Trial 493 finished with value: 2.0 and parameters: {'x_0_0': 'cd', 'x_0_1': 'cd', 'x_1_0': 'cd', 'x_1_1': 'cd'}. Best is trial 62 with value: 0.5.
[I 2025-01-12 23:20:34,071] Trial 494 finished with value: 2.0 and parameters: {'x_0_0': 'cd', 'x_0_1': 'cd', 'x_1_0': 'cd', 'x_1_1': 'cd'}. Best is trial 50 with value: 0.5.
[I 2025-01-12 23:20:34,148] Trial 495 finished with value: 2.0 and parameters: {'x_0_0': 'cd', 'x_0_1': 'cd', 'x_1_0': 'cd', 'x_1_1': 'cd'}. Best is trial 35 with value: 0.5.
/Users/keisukeonoue/ws/constrained_BO_v3/bo-env_v3/lib/python3.12/site-packages/numpy/_core/_methods.py:208: RuntimeWarning: overflow encountered in reduce
  ret = umr_sum(x, axis, dtype, out, keepdims=keepdims, where=where)
[I 2025-01-12 23:20:34,174] Trial 494 finished with value: 2.0 and parameters: {'x_0_0': 'cd', 'x_0_1': 'cd', 'x_1_0': 'cd', 'x_1_1': 'cd'}. Best is trial 62 with value: 0.5.
[I 2025-01-12 23:20:34,198] Trial 495 finished with value: 2.0 and parameters: {'x_0_0': 'cd', 'x_0_1': 'cd', 'x_1_0': 'cd', 'x_1_1': 'cd'}. Best is trial 50 with value: 0.5.
[I 2025-01-12 23:20:34,250] Trial 496 finished with value: 2.0 and parameters: {'x_0_0': 'cd', 'x_0_1': 'cd', 'x_1_0': 'cd', 'x_1_1': 'cd'}. Best is trial 35 with value: 0.5.
/Users/keisukeonoue/ws/constrained_BO_v3/bo-env_v3/lib/python3.12/site-packages/numpy/_core/_methods.py:208: RuntimeWarning: overflow encountered in reduce
  ret = umr_sum(x, axis, dtype, out, keepdims=keepdims, where=where)
[I 2025-01-12 23:20:34,288] Trial 495 finished with value: 2.0 and parameters: {'x_0_0': 'cd', 'x_0_1': 'cd', 'x_1_0': 'cd', 'x_1_1': 'cd'}. Best is trial 62 with value: 0.5.
[I 2025-01-12 23:20:34,297] Trial 496 finished with value: 2.0 and parameters: {'x_0_0': 'cd', 'x_0_1': 'cd', 'x_1_0': 'cd', 'x_1_1': 'cd'}. Best is trial 50 with value: 0.5.
[I 2025-01-12 23:20:34,379] Trial 497 finished with value: 2.0 and parameters: {'x_0_0': 'cd', 'x_0_1': 'cd', 'x_1_0': 'cd', 'x_1_1': 'cd'}. Best is trial 35 with value: 0.5.
/Users/keisukeonoue/ws/constrained_BO_v3/bo-env_v3/lib/python3.12/site-packages/numpy/_core/_methods.py:208: RuntimeWarning: overflow encountered in reduce
  ret = umr_sum(x, axis, dtype, out, keepdims=keepdims, where=where)
[I 2025-01-12 23:20:34,409] Trial 496 finished with value: 2.0 and parameters: {'x_0_0': 'cd', 'x_0_1': 'cd', 'x_1_0': 'cd', 'x_1_1': 'cd'}. Best is trial 62 with value: 0.5.
[I 2025-01-12 23:20:34,418] Trial 497 finished with value: 2.0 and parameters: {'x_0_0': 'cd', 'x_0_1': 'cd', 'x_1_0': 'cd', 'x_1_1': 'cd'}. Best is trial 50 with value: 0.5.
[I 2025-01-12 23:20:34,485] Trial 498 finished with value: 2.0 and parameters: {'x_0_0': 'cd', 'x_0_1': 'cd', 'x_1_0': 'cd', 'x_1_1': 'cd'}. Best is trial 35 with value: 0.5.
/Users/keisukeonoue/ws/constrained_BO_v3/bo-env_v3/lib/python3.12/site-packages/numpy/_core/_methods.py:208: RuntimeWarning: overflow encountered in reduce
  ret = umr_sum(x, axis, dtype, out, keepdims=keepdims, where=where)
[I 2025-01-12 23:20:34,523] Trial 497 finished with value: 2.0 and parameters: {'x_0_0': 'cd', 'x_0_1': 'cd', 'x_1_0': 'cd', 'x_1_1': 'cd'}. Best is trial 62 with value: 0.5.
[I 2025-01-12 23:20:34,523] Trial 498 finished with value: 2.0 and parameters: {'x_0_0': 'cd', 'x_0_1': 'cd', 'x_1_0': 'cd', 'x_1_1': 'cd'}. Best is trial 50 with value: 0.5.
[I 2025-01-12 23:20:34,655] Trial 499 finished with value: 2.0 and parameters: {'x_0_0': 'cd', 'x_0_1': 'cd', 'x_1_0': 'cd', 'x_1_1': 'cd'}. Best is trial 35 with value: 0.5.
/Users/keisukeonoue/ws/constrained_BO_v3/bo-env_v3/lib/python3.12/site-packages/numpy/_core/_methods.py:208: RuntimeWarning: overflow encountered in reduce
  ret = umr_sum(x, axis, dtype, out, keepdims=keepdims, where=where)
[I 2025-01-12 23:20:34,679] Trial 498 finished with value: 2.0 and parameters: {'x_0_0': 'cd', 'x_0_1': 'cd', 'x_1_0': 'cd', 'x_1_1': 'cd'}. Best is trial 62 with value: 0.5.
[I 2025-01-12 23:20:34,689] Trial 499 finished with value: 2.0 and parameters: {'x_0_0': 'cd', 'x_0_1': 'cd', 'x_1_0': 'cd', 'x_1_1': 'cd'}. Best is trial 50 with value: 0.5.
/Users/keisukeonoue/ws/constrained_BO_v3/bo-env_v3/lib/python3.12/site-packages/numpy/_core/_methods.py:208: RuntimeWarning: overflow encountered in reduce
  ret = umr_sum(x, axis, dtype, out, keepdims=keepdims, where=where)
[I 2025-01-12 23:20:34,771] Trial 499 finished with value: 2.0 and parameters: {'x_0_0': 'cd', 'x_0_1': 'cd', 'x_1_0': 'cd', 'x_1_1': 'cd'}. Best is trial 62 with value: 0.5.
Best Direction Matrix:
[['bd' 'oo']
 ['bc' 'ac']]
2025-01-12 23:20:36,281 - INFO - Saved optimization history plot to results/2025-01-12_23-19-00/plots/2025-01-12_23-19-00_warcraft_map1_train_seed5_optimization_history.png
Best Direction Matrix:
[['ad' 'oo']
 ['bc' 'ac']]
2025-01-12 23:20:36,284 - INFO - Saved optimization history plot to results/2025-01-12_23-19-00/plots/2025-01-12_23-19-00_warcraft_map1_train_seed8_optimization_history.png
Best Direction Matrix:
[['bd' 'oo']
 ['bc' 'ad']]
2025-01-12 23:20:36,339 - INFO - Saved optimization history plot to results/2025-01-12_23-19-00/plots/2025-01-12_23-19-00_warcraft_map1_train_seed4_optimization_history.png
All experiments completed!
