[I 2025-01-12 23:19:52,944] Trial 300 finished with value: 2.0 and parameters: {'x_0_0': 'cd', 'x_0_1': 'cd', 'x_1_0': 'cd', 'x_1_1': 'cd'}. Best is trial 78 with value: 0.5.
[I 2025-01-12 23:19:52,944] Trial 284 finished with value: 1.0714285714285714 and parameters: {'x_0_0': 'ac', 'x_0_1': 'oo', 'x_1_0': 'ad', 'x_1_1': 'bd'}. Best is trial 50 with value: 0.5.
[I 2025-01-12 23:19:52,952] Trial 301 finished with value: 2.0 and parameters: {'x_0_0': 'cd', 'x_0_1': 'cd', 'x_1_0': 'cd', 'x_1_1': 'cd'}. Best is trial 76 with value: 0.5.
[I 2025-01-12 23:19:52,963] Trial 304 finished with value: 2.0 and parameters: {'x_0_0': 'cd', 'x_0_1': 'cd', 'x_1_0': 'cd', 'x_1_1': 'cd'}. Best is trial 86 with value: 0.5.
[I 2025-01-12 23:19:52,974] Trial 301 finished with value: 2.0 and parameters: {'x_0_0': 'cd', 'x_0_1': 'cd', 'x_1_0': 'cd', 'x_1_1': 'cd'}. Best is trial 17 with value: 0.5.
[I 2025-01-12 23:19:52,977] Trial 279 finished with value: 1.3214285714285714 and parameters: {'x_0_0': 'bd', 'x_0_1': 'bc', 'x_1_0': 'oo', 'x_1_1': 'bc'}. Best is trial 62 with value: 0.5.
[I 2025-01-12 23:19:53,005] Trial 293 finished with value: 1.3214285714285714 and parameters: {'x_0_0': 'ac', 'x_0_1': 'cd', 'x_1_0': 'oo', 'x_1_1': 'ab'}. Best is trial 68 with value: 0.5.
[I 2025-01-12 23:19:53,020] Trial 301 finished with value: 2.0 and parameters: {'x_0_0': 'cd', 'x_0_1': 'cd', 'x_1_0': 'cd', 'x_1_1': 'cd'}. Best is trial 11 with value: 0.5.
[I 2025-01-12 23:19:53,033] Trial 281 finished with value: 1.3214285714285714 and parameters: {'x_0_0': 'ad', 'x_0_1': 'bd', 'x_1_0': 'oo', 'x_1_1': 'bc'}. Best is trial 35 with value: 0.5.
[I 2025-01-12 23:19:53,074] Trial 285 finished with value: 1.5 and parameters: {'x_0_0': 'cd', 'x_0_1': 'oo', 'x_1_0': 'ac', 'x_1_1': 'bc'}. Best is trial 50 with value: 0.5.
[I 2025-01-12 23:19:53,078] Trial 301 finished with value: 2.0 and parameters: {'x_0_0': 'cd', 'x_0_1': 'cd', 'x_1_0': 'cd', 'x_1_1': 'cd'}. Best is trial 78 with value: 0.5.
[I 2025-01-12 23:19:53,087] Trial 302 finished with value: 2.0 and parameters: {'x_0_0': 'cd', 'x_0_1': 'cd', 'x_1_0': 'cd', 'x_1_1': 'cd'}. Best is trial 76 with value: 0.5.
[I 2025-01-12 23:19:53,092] Trial 305 finished with value: 2.0 and parameters: {'x_0_0': 'cd', 'x_0_1': 'cd', 'x_1_0': 'cd', 'x_1_1': 'cd'}. Best is trial 86 with value: 0.5.
[I 2025-01-12 23:19:53,104] Trial 302 finished with value: 2.0 and parameters: {'x_0_0': 'cd', 'x_0_1': 'cd', 'x_1_0': 'cd', 'x_1_1': 'cd'}. Best is trial 17 with value: 0.5.
[I 2025-01-12 23:19:53,114] Trial 280 finished with value: 1.3214285714285714 and parameters: {'x_0_0': 'bd', 'x_0_1': 'bd', 'x_1_0': 'oo', 'x_1_1': 'ab'}. Best is trial 62 with value: 0.5.
[I 2025-01-12 23:19:53,120] Trial 294 finished with value: 1.3214285714285714 and parameters: {'x_0_0': 'bd', 'x_0_1': 'bc', 'x_1_0': 'oo', 'x_1_1': 'ab'}. Best is trial 68 with value: 0.5.
[I 2025-01-12 23:19:53,138] Trial 302 finished with value: 2.0 and parameters: {'x_0_0': 'cd', 'x_0_1': 'cd', 'x_1_0': 'cd', 'x_1_1': 'cd'}. Best is trial 11 with value: 0.5.
[I 2025-01-12 23:19:53,158] Trial 282 finished with value: 1.3214285714285714 and parameters: {'x_0_0': 'ad', 'x_0_1': 'bc', 'x_1_0': 'oo', 'x_1_1': 'ac'}. Best is trial 35 with value: 0.5.
[I 2025-01-12 23:19:53,196] Trial 302 finished with value: 2.0 and parameters: {'x_0_0': 'cd', 'x_0_1': 'cd', 'x_1_0': 'cd', 'x_1_1': 'cd'}. Best is trial 78 with value: 0.5.
[I 2025-01-12 23:19:53,211] Trial 303 finished with value: 2.0 and parameters: {'x_0_0': 'cd', 'x_0_1': 'cd', 'x_1_0': 'cd', 'x_1_1': 'cd'}. Best is trial 76 with value: 0.5.
[I 2025-01-12 23:19:53,213] Trial 303 finished with value: 2.0 and parameters: {'x_0_0': 'cd', 'x_0_1': 'cd', 'x_1_0': 'cd', 'x_1_1': 'cd'}. Best is trial 17 with value: 0.5.
[I 2025-01-12 23:19:53,235] Trial 286 finished with value: 1.3214285714285714 and parameters: {'x_0_0': 'bc', 'x_0_1': 'bc', 'x_1_0': 'oo', 'x_1_1': 'ab'}. Best is trial 50 with value: 0.5.
[I 2025-01-12 23:19:53,238] Trial 307 finished with value: 2.0 and parameters: {'x_0_0': 'cd', 'x_0_1': 'cd', 'x_1_0': 'cd', 'x_1_1': 'cd'}. Best is trial 120 with value: 0.5.
[I 2025-01-12 23:19:53,253] Trial 303 finished with value: 2.0 and parameters: {'x_0_0': 'cd', 'x_0_1': 'cd', 'x_1_0': 'cd', 'x_1_1': 'cd'}. Best is trial 11 with value: 0.5.
[I 2025-01-12 23:19:53,254] Trial 295 finished with value: 1.0714285714285714 and parameters: {'x_0_0': 'ac', 'x_0_1': 'oo', 'x_1_0': 'ad', 'x_1_1': 'bd'}. Best is trial 68 with value: 0.5.
[I 2025-01-12 23:19:53,268] Trial 281 finished with value: 1.3214285714285714 and parameters: {'x_0_0': 'bd', 'x_0_1': 'ac', 'x_1_0': 'oo', 'x_1_1': 'bc'}. Best is trial 62 with value: 0.5.
[I 2025-01-12 23:19:53,286] Trial 283 finished with value: 1.3214285714285714 and parameters: {'x_0_0': 'bc', 'x_0_1': 'bc', 'x_1_0': 'oo', 'x_1_1': 'bc'}. Best is trial 35 with value: 0.5.
[I 2025-01-12 23:19:53,321] Trial 303 finished with value: 2.0 and parameters: {'x_0_0': 'cd', 'x_0_1': 'cd', 'x_1_0': 'cd', 'x_1_1': 'cd'}. Best is trial 78 with value: 0.5.
[I 2025-01-12 23:19:53,342] Trial 304 finished with value: 2.0 and parameters: {'x_0_0': 'cd', 'x_0_1': 'cd', 'x_1_0': 'cd', 'x_1_1': 'cd'}. Best is trial 76 with value: 0.5.
[I 2025-01-12 23:19:53,360] Trial 287 finished with value: 1.3214285714285714 and parameters: {'x_0_0': 'ac', 'x_0_1': 'bc', 'x_1_0': 'oo', 'x_1_1': 'ab'}. Best is trial 50 with value: 0.5.
[I 2025-01-12 23:19:53,368] Trial 296 finished with value: 1.3214285714285714 and parameters: {'x_0_0': 'bd', 'x_0_1': 'bc', 'x_1_0': 'oo', 'x_1_1': 'ac'}. Best is trial 68 with value: 0.5.
[I 2025-01-12 23:19:53,378] Trial 308 finished with value: 2.0 and parameters: {'x_0_0': 'cd', 'x_0_1': 'cd', 'x_1_0': 'cd', 'x_1_1': 'cd'}. Best is trial 120 with value: 0.5.
[I 2025-01-12 23:19:53,382] Trial 282 finished with value: 1.3214285714285714 and parameters: {'x_0_0': 'bc', 'x_0_1': 'cd', 'x_1_0': 'oo', 'x_1_1': 'ac'}. Best is trial 62 with value: 0.5.
[I 2025-01-12 23:19:53,406] Trial 304 finished with value: 2.0 and parameters: {'x_0_0': 'cd', 'x_0_1': 'cd', 'x_1_0': 'cd', 'x_1_1': 'cd'}. Best is trial 11 with value: 0.5.
[I 2025-01-12 23:19:53,417] Trial 284 finished with value: 1.3214285714285714 and parameters: {'x_0_0': 'bd', 'x_0_1': 'bd', 'x_1_0': 'oo', 'x_1_1': 'ac'}. Best is trial 35 with value: 0.5.
[I 2025-01-12 23:19:53,451] Trial 304 finished with value: 2.0 and parameters: {'x_0_0': 'cd', 'x_0_1': 'cd', 'x_1_0': 'cd', 'x_1_1': 'cd'}. Best is trial 78 with value: 0.5.
[I 2025-01-12 23:19:53,467] Trial 305 finished with value: 2.0 and parameters: {'x_0_0': 'cd', 'x_0_1': 'cd', 'x_1_0': 'cd', 'x_1_1': 'cd'}. Best is trial 76 with value: 0.5.
[I 2025-01-12 23:19:53,482] Trial 288 finished with value: 1.75 and parameters: {'x_0_0': 'cd', 'x_0_1': 'cd', 'x_1_0': 'oo', 'x_1_1': 'ab'}. Best is trial 50 with value: 0.5.
[I 2025-01-12 23:19:53,487] Trial 297 finished with value: 1.1785714285714286 and parameters: {'x_0_0': 'ac', 'x_0_1': 'ab', 'x_1_0': 'oo', 'x_1_1': 'bc'}. Best is trial 68 with value: 0.5.
[I 2025-01-12 23:19:53,497] Trial 283 finished with value: 1.0714285714285714 and parameters: {'x_0_0': 'ac', 'x_0_1': 'oo', 'x_1_0': 'ad', 'x_1_1': 'bd'}. Best is trial 62 with value: 0.5.
[I 2025-01-12 23:19:53,502] Trial 309 finished with value: 2.0 and parameters: {'x_0_0': 'cd', 'x_0_1': 'cd', 'x_1_0': 'cd', 'x_1_1': 'cd'}. Best is trial 120 with value: 0.5.
[I 2025-01-12 23:19:53,549] Trial 285 finished with value: 1.3214285714285714 and parameters: {'x_0_0': 'bd', 'x_0_1': 'bd', 'x_1_0': 'oo', 'x_1_1': 'bd'}. Best is trial 35 with value: 0.5.
[I 2025-01-12 23:19:53,565] Trial 305 finished with value: 2.0 and parameters: {'x_0_0': 'cd', 'x_0_1': 'cd', 'x_1_0': 'cd', 'x_1_1': 'cd'}. Best is trial 78 with value: 0.5.
[I 2025-01-12 23:19:53,596] Trial 289 finished with value: 1.3214285714285714 and parameters: {'x_0_0': 'bc', 'x_0_1': 'bc', 'x_1_0': 'oo', 'x_1_1': 'bc'}. Best is trial 50 with value: 0.5.
[I 2025-01-12 23:19:53,609] Trial 284 finished with value: 1.5 and parameters: {'x_0_0': 'cd', 'x_0_1': 'oo', 'x_1_0': 'ab', 'x_1_1': 'ad'}. Best is trial 62 with value: 0.5.
[I 2025-01-12 23:19:53,625] Trial 310 finished with value: 2.0 and parameters: {'x_0_0': 'cd', 'x_0_1': 'cd', 'x_1_0': 'cd', 'x_1_1': 'cd'}. Best is trial 120 with value: 0.5.
[I 2025-01-12 23:19:53,629] Trial 298 finished with value: 1.3214285714285714 and parameters: {'x_0_0': 'ad', 'x_0_1': 'bc', 'x_1_0': 'oo', 'x_1_1': 'ad'}. Best is trial 68 with value: 0.5.
[I 2025-01-12 23:19:53,667] Trial 286 finished with value: 1.3214285714285714 and parameters: {'x_0_0': 'ad', 'x_0_1': 'ab', 'x_1_0': 'oo', 'x_1_1': 'bc'}. Best is trial 35 with value: 0.5.
[I 2025-01-12 23:19:53,721] Trial 290 finished with value: 1.0714285714285714 and parameters: {'x_0_0': 'bd', 'x_0_1': 'oo', 'x_1_0': 'cd', 'x_1_1': 'bc'}. Best is trial 50 with value: 0.5.
[I 2025-01-12 23:19:53,732] Trial 285 finished with value: 1.3214285714285714 and parameters: {'x_0_0': 'ad', 'x_0_1': 'bc', 'x_1_0': 'oo', 'x_1_1': 'bc'}. Best is trial 62 with value: 0.5.
[I 2025-01-12 23:19:53,757] Trial 311 finished with value: 2.0 and parameters: {'x_0_0': 'cd', 'x_0_1': 'cd', 'x_1_0': 'cd', 'x_1_1': 'cd'}. Best is trial 120 with value: 0.5.
[I 2025-01-12 23:19:53,758] Trial 299 finished with value: 1.3214285714285714 and parameters: {'x_0_0': 'ad', 'x_0_1': 'ab', 'x_1_0': 'oo', 'x_1_1': 'bd'}. Best is trial 68 with value: 0.5.
[I 2025-01-12 23:19:53,794] Trial 287 finished with value: 1.75 and parameters: {'x_0_0': 'cd', 'x_0_1': 'ab', 'x_1_0': 'oo', 'x_1_1': 'ad'}. Best is trial 35 with value: 0.5.
[I 2025-01-12 23:19:53,859] Trial 291 finished with value: 1.3214285714285714 and parameters: {'x_0_0': 'bc', 'x_0_1': 'bd', 'x_1_0': 'oo', 'x_1_1': 'ab'}. Best is trial 50 with value: 0.5.
[I 2025-01-12 23:19:53,859] Trial 286 finished with value: 1.5 and parameters: {'x_0_0': 'cd', 'x_0_1': 'oo', 'x_1_0': 'ad', 'x_1_1': 'ad'}. Best is trial 62 with value: 0.5.
[I 2025-01-12 23:19:53,871] Trial 300 finished with value: 1.3214285714285714 and parameters: {'x_0_0': 'bd', 'x_0_1': 'bc', 'x_1_0': 'oo', 'x_1_1': 'bc'}. Best is trial 68 with value: 0.5.
[I 2025-01-12 23:19:53,894] Trial 312 finished with value: 2.0 and parameters: {'x_0_0': 'cd', 'x_0_1': 'cd', 'x_1_0': 'cd', 'x_1_1': 'cd'}. Best is trial 120 with value: 0.5.
[I 2025-01-12 23:19:53,919] Trial 305 finished with value: 2.0 and parameters: {'x_0_0': 'cd', 'x_0_1': 'cd', 'x_1_0': 'cd', 'x_1_1': 'cd'}. Best is trial 11 with value: 0.5.
[I 2025-01-12 23:19:53,923] Trial 288 finished with value: 1.3214285714285714 and parameters: {'x_0_0': 'ad', 'x_0_1': 'cd', 'x_1_0': 'oo', 'x_1_1': 'ac'}. Best is trial 35 with value: 0.5.
[I 2025-01-12 23:19:53,995] Trial 301 finished with value: 2.0 and parameters: {'x_0_0': 'cd', 'x_0_1': 'cd', 'x_1_0': 'cd', 'x_1_1': 'cd'}. Best is trial 68 with value: 0.5.
[I 2025-01-12 23:19:53,996] Trial 292 finished with value: 1.5 and parameters: {'x_0_0': 'cd', 'x_0_1': 'oo', 'x_1_0': 'bd', 'x_1_1': 'bc'}. Best is trial 50 with value: 0.5.
[I 2025-01-12 23:19:53,999] Trial 287 finished with value: 1.0714285714285714 and parameters: {'x_0_0': 'ac', 'x_0_1': 'oo', 'x_1_0': 'ad', 'x_1_1': 'ad'}. Best is trial 62 with value: 0.5.
[I 2025-01-12 23:19:54,001] Trial 313 finished with value: 2.0 and parameters: {'x_0_0': 'cd', 'x_0_1': 'cd', 'x_1_0': 'cd', 'x_1_1': 'cd'}. Best is trial 120 with value: 0.5.
[I 2025-01-12 23:19:54,023] Trial 306 finished with value: 2.0 and parameters: {'x_0_0': 'cd', 'x_0_1': 'cd', 'x_1_0': 'cd', 'x_1_1': 'cd'}. Best is trial 78 with value: 0.5.
[I 2025-01-12 23:19:54,023] Trial 306 finished with value: 2.0 and parameters: {'x_0_0': 'cd', 'x_0_1': 'cd', 'x_1_0': 'cd', 'x_1_1': 'cd'}. Best is trial 86 with value: 0.5.
[I 2025-01-12 23:19:54,038] Trial 306 finished with value: 2.0 and parameters: {'x_0_0': 'cd', 'x_0_1': 'cd', 'x_1_0': 'cd', 'x_1_1': 'cd'}. Best is trial 11 with value: 0.5.
[I 2025-01-12 23:19:54,068] Trial 289 finished with value: 1.3214285714285714 and parameters: {'x_0_0': 'ad', 'x_0_1': 'cd', 'x_1_0': 'oo', 'x_1_1': 'ad'}. Best is trial 35 with value: 0.5.
[I 2025-01-12 23:19:54,117] Trial 293 finished with value: 1.3214285714285714 and parameters: {'x_0_0': 'bc', 'x_0_1': 'bd', 'x_1_0': 'oo', 'x_1_1': 'bd'}. Best is trial 50 with value: 0.5.
[I 2025-01-12 23:19:54,118] Trial 302 finished with value: 2.0 and parameters: {'x_0_0': 'cd', 'x_0_1': 'cd', 'x_1_0': 'cd', 'x_1_1': 'cd'}. Best is trial 68 with value: 0.5.
[I 2025-01-12 23:19:54,131] Trial 314 finished with value: 2.0 and parameters: {'x_0_0': 'cd', 'x_0_1': 'cd', 'x_1_0': 'cd', 'x_1_1': 'cd'}. Best is trial 120 with value: 0.5.
[I 2025-01-12 23:19:54,138] Trial 288 finished with value: 1.3214285714285714 and parameters: {'x_0_0': 'ac', 'x_0_1': 'bc', 'x_1_0': 'oo', 'x_1_1': 'ad'}. Best is trial 62 with value: 0.5.
[I 2025-01-12 23:19:54,154] Trial 307 finished with value: 2.0 and parameters: {'x_0_0': 'cd', 'x_0_1': 'cd', 'x_1_0': 'cd', 'x_1_1': 'cd'}. Best is trial 78 with value: 0.5.
[I 2025-01-12 23:19:54,157] Trial 307 finished with value: 2.0 and parameters: {'x_0_0': 'cd', 'x_0_1': 'cd', 'x_1_0': 'cd', 'x_1_1': 'cd'}. Best is trial 86 with value: 0.5.
[I 2025-01-12 23:19:54,167] Trial 307 finished with value: 2.0 and parameters: {'x_0_0': 'cd', 'x_0_1': 'cd', 'x_1_0': 'cd', 'x_1_1': 'cd'}. Best is trial 11 with value: 0.5.
[I 2025-01-12 23:19:54,193] Trial 290 finished with value: 1.3214285714285714 and parameters: {'x_0_0': 'bd', 'x_0_1': 'bd', 'x_1_0': 'oo', 'x_1_1': 'bc'}. Best is trial 35 with value: 0.5.
[I 2025-01-12 23:19:54,232] Trial 303 finished with value: 2.0 and parameters: {'x_0_0': 'cd', 'x_0_1': 'cd', 'x_1_0': 'cd', 'x_1_1': 'cd'}. Best is trial 68 with value: 0.5.
[I 2025-01-12 23:19:54,255] Trial 289 finished with value: 1.5 and parameters: {'x_0_0': 'cd', 'x_0_1': 'oo', 'x_1_0': 'cd', 'x_1_1': 'bd'}. Best is trial 62 with value: 0.5.
[I 2025-01-12 23:19:54,264] Trial 315 finished with value: 2.0 and parameters: {'x_0_0': 'cd', 'x_0_1': 'cd', 'x_1_0': 'cd', 'x_1_1': 'cd'}. Best is trial 120 with value: 0.5.
[I 2025-01-12 23:19:54,268] Trial 304 finished with value: 2.0 and parameters: {'x_0_0': 'cd', 'x_0_1': 'cd', 'x_1_0': 'cd', 'x_1_1': 'cd'}. Best is trial 17 with value: 0.5.
[I 2025-01-12 23:19:54,272] Trial 308 finished with value: 2.0 and parameters: {'x_0_0': 'cd', 'x_0_1': 'cd', 'x_1_0': 'cd', 'x_1_1': 'cd'}. Best is trial 86 with value: 0.5.
[I 2025-01-12 23:19:54,283] Trial 308 finished with value: 2.0 and parameters: {'x_0_0': 'cd', 'x_0_1': 'cd', 'x_1_0': 'cd', 'x_1_1': 'cd'}. Best is trial 11 with value: 0.5.
[I 2025-01-12 23:19:54,283] Trial 294 finished with value: 1.3214285714285714 and parameters: {'x_0_0': 'bd', 'x_0_1': 'cd', 'x_1_0': 'oo', 'x_1_1': 'bc'}. Best is trial 50 with value: 0.5.
[I 2025-01-12 23:19:54,302] Trial 308 finished with value: 2.0 and parameters: {'x_0_0': 'cd', 'x_0_1': 'cd', 'x_1_0': 'cd', 'x_1_1': 'cd'}. Best is trial 78 with value: 0.5.
[I 2025-01-12 23:19:54,319] Trial 291 finished with value: 1.3214285714285714 and parameters: {'x_0_0': 'bd', 'x_0_1': 'cd', 'x_1_0': 'oo', 'x_1_1': 'ac'}. Best is trial 35 with value: 0.5.
[I 2025-01-12 23:19:54,379] Trial 290 finished with value: 1.3214285714285714 and parameters: {'x_0_0': 'bc', 'x_0_1': 'bc', 'x_1_0': 'oo', 'x_1_1': 'ad'}. Best is trial 62 with value: 0.5.
[I 2025-01-12 23:19:54,394] Trial 316 finished with value: 2.0 and parameters: {'x_0_0': 'cd', 'x_0_1': 'cd', 'x_1_0': 'cd', 'x_1_1': 'cd'}. Best is trial 120 with value: 0.5.
[I 2025-01-12 23:19:54,395] Trial 309 finished with value: 2.0 and parameters: {'x_0_0': 'cd', 'x_0_1': 'cd', 'x_1_0': 'cd', 'x_1_1': 'cd'}. Best is trial 86 with value: 0.5.
[I 2025-01-12 23:19:54,399] Trial 295 finished with value: 1.3214285714285714 and parameters: {'x_0_0': 'ac', 'x_0_1': 'cd', 'x_1_0': 'oo', 'x_1_1': 'bc'}. Best is trial 50 with value: 0.5.
[I 2025-01-12 23:19:54,401] Trial 305 finished with value: 2.0 and parameters: {'x_0_0': 'cd', 'x_0_1': 'cd', 'x_1_0': 'cd', 'x_1_1': 'cd'}. Best is trial 17 with value: 0.5.
[I 2025-01-12 23:19:54,420] Trial 309 finished with value: 2.0 and parameters: {'x_0_0': 'cd', 'x_0_1': 'cd', 'x_1_0': 'cd', 'x_1_1': 'cd'}. Best is trial 78 with value: 0.5.
[I 2025-01-12 23:19:54,425] Trial 309 finished with value: 2.0 and parameters: {'x_0_0': 'cd', 'x_0_1': 'cd', 'x_1_0': 'cd', 'x_1_1': 'cd'}. Best is trial 11 with value: 0.5.
[I 2025-01-12 23:19:54,451] Trial 292 finished with value: 1.3214285714285714 and parameters: {'x_0_0': 'ad', 'x_0_1': 'bc', 'x_1_0': 'oo', 'x_1_1': 'ab'}. Best is trial 35 with value: 0.5.
[I 2025-01-12 23:19:54,482] Trial 306 finished with value: 2.0 and parameters: {'x_0_0': 'cd', 'x_0_1': 'cd', 'x_1_0': 'cd', 'x_1_1': 'cd'}. Best is trial 76 with value: 0.5.
[I 2025-01-12 23:19:54,509] Trial 317 finished with value: 2.0 and parameters: {'x_0_0': 'cd', 'x_0_1': 'cd', 'x_1_0': 'cd', 'x_1_1': 'cd'}. Best is trial 120 with value: 0.5.
[I 2025-01-12 23:19:54,514] Trial 291 finished with value: 1.0714285714285714 and parameters: {'x_0_0': 'ac', 'x_0_1': 'oo', 'x_1_0': 'cd', 'x_1_1': 'ac'}. Best is trial 62 with value: 0.5.
[I 2025-01-12 23:19:54,517] Trial 310 finished with value: 2.0 and parameters: {'x_0_0': 'cd', 'x_0_1': 'cd', 'x_1_0': 'cd', 'x_1_1': 'cd'}. Best is trial 86 with value: 0.5.
[I 2025-01-12 23:19:54,527] Trial 306 finished with value: 2.0 and parameters: {'x_0_0': 'cd', 'x_0_1': 'cd', 'x_1_0': 'cd', 'x_1_1': 'cd'}. Best is trial 17 with value: 0.5.
[I 2025-01-12 23:19:54,539] Trial 296 finished with value: 1.0714285714285714 and parameters: {'x_0_0': 'ac', 'x_0_1': 'oo', 'x_1_0': 'ad', 'x_1_1': 'ab'}. Best is trial 50 with value: 0.5.
[I 2025-01-12 23:19:54,557] Trial 310 finished with value: 2.0 and parameters: {'x_0_0': 'cd', 'x_0_1': 'cd', 'x_1_0': 'cd', 'x_1_1': 'cd'}. Best is trial 78 with value: 0.5.
[I 2025-01-12 23:19:54,562] Trial 310 finished with value: 2.0 and parameters: {'x_0_0': 'cd', 'x_0_1': 'cd', 'x_1_0': 'cd', 'x_1_1': 'cd'}. Best is trial 11 with value: 0.5.
[I 2025-01-12 23:19:54,590] Trial 293 finished with value: 1.3214285714285714 and parameters: {'x_0_0': 'ac', 'x_0_1': 'bc', 'x_1_0': 'oo', 'x_1_1': 'ad'}. Best is trial 35 with value: 0.5.
[I 2025-01-12 23:19:54,620] Trial 307 finished with value: 2.0 and parameters: {'x_0_0': 'cd', 'x_0_1': 'cd', 'x_1_0': 'cd', 'x_1_1': 'cd'}. Best is trial 76 with value: 0.5.
[I 2025-01-12 23:19:54,636] Trial 292 finished with value: 1.3214285714285714 and parameters: {'x_0_0': 'ad', 'x_0_1': 'cd', 'x_1_0': 'oo', 'x_1_1': 'bd'}. Best is trial 62 with value: 0.5.
[I 2025-01-12 23:19:54,638] Trial 311 finished with value: 2.0 and parameters: {'x_0_0': 'cd', 'x_0_1': 'cd', 'x_1_0': 'cd', 'x_1_1': 'cd'}. Best is trial 86 with value: 0.5.
[I 2025-01-12 23:19:54,642] Trial 318 finished with value: 2.0 and parameters: {'x_0_0': 'cd', 'x_0_1': 'cd', 'x_1_0': 'cd', 'x_1_1': 'cd'}. Best is trial 120 with value: 0.5.
[I 2025-01-12 23:19:54,666] Trial 297 finished with value: 1.0714285714285714 and parameters: {'x_0_0': 'ac', 'x_0_1': 'oo', 'x_1_0': 'ab', 'x_1_1': 'bd'}. Best is trial 50 with value: 0.5.
[I 2025-01-12 23:19:54,666] Trial 307 finished with value: 2.0 and parameters: {'x_0_0': 'cd', 'x_0_1': 'cd', 'x_1_0': 'cd', 'x_1_1': 'cd'}. Best is trial 17 with value: 0.5.
[I 2025-01-12 23:19:54,689] Trial 311 finished with value: 2.0 and parameters: {'x_0_0': 'cd', 'x_0_1': 'cd', 'x_1_0': 'cd', 'x_1_1': 'cd'}. Best is trial 78 with value: 0.5.
[I 2025-01-12 23:19:54,694] Trial 311 finished with value: 2.0 and parameters: {'x_0_0': 'cd', 'x_0_1': 'cd', 'x_1_0': 'cd', 'x_1_1': 'cd'}. Best is trial 11 with value: 0.5.
[I 2025-01-12 23:19:54,723] Trial 294 finished with value: 1.5 and parameters: {'x_0_0': 'cd', 'x_0_1': 'oo', 'x_1_0': 'ac', 'x_1_1': 'bd'}. Best is trial 35 with value: 0.5.
[I 2025-01-12 23:19:54,757] Trial 319 finished with value: 2.0 and parameters: {'x_0_0': 'cd', 'x_0_1': 'cd', 'x_1_0': 'cd', 'x_1_1': 'cd'}. Best is trial 120 with value: 0.5.
[I 2025-01-12 23:19:54,759] Trial 312 finished with value: 2.0 and parameters: {'x_0_0': 'cd', 'x_0_1': 'cd', 'x_1_0': 'cd', 'x_1_1': 'cd'}. Best is trial 86 with value: 0.5.
[I 2025-01-12 23:19:54,763] Trial 308 finished with value: 2.0 and parameters: {'x_0_0': 'cd', 'x_0_1': 'cd', 'x_1_0': 'cd', 'x_1_1': 'cd'}. Best is trial 76 with value: 0.5.
[I 2025-01-12 23:19:54,779] Trial 308 finished with value: 2.0 and parameters: {'x_0_0': 'cd', 'x_0_1': 'cd', 'x_1_0': 'cd', 'x_1_1': 'cd'}. Best is trial 17 with value: 0.5.
[I 2025-01-12 23:19:54,788] Trial 293 finished with value: 1.0714285714285714 and parameters: {'x_0_0': 'ac', 'x_0_1': 'oo', 'x_1_0': 'ab', 'x_1_1': 'ad'}. Best is trial 62 with value: 0.5.
[I 2025-01-12 23:19:54,809] Trial 312 finished with value: 2.0 and parameters: {'x_0_0': 'cd', 'x_0_1': 'cd', 'x_1_0': 'cd', 'x_1_1': 'cd'}. Best is trial 78 with value: 0.5.
[I 2025-01-12 23:19:54,813] Trial 298 finished with value: 1.5 and parameters: {'x_0_0': 'cd', 'x_0_1': 'oo', 'x_1_0': 'ad', 'x_1_1': 'bd'}. Best is trial 50 with value: 0.5.
[I 2025-01-12 23:19:54,825] Trial 312 finished with value: 2.0 and parameters: {'x_0_0': 'cd', 'x_0_1': 'cd', 'x_1_0': 'cd', 'x_1_1': 'cd'}. Best is trial 11 with value: 0.5.
[I 2025-01-12 23:19:54,839] Trial 304 finished with value: 2.0 and parameters: {'x_0_0': 'cd', 'x_0_1': 'cd', 'x_1_0': 'cd', 'x_1_1': 'cd'}. Best is trial 68 with value: 0.5.
[I 2025-01-12 23:19:54,863] Trial 295 finished with value: 1.3214285714285714 and parameters: {'x_0_0': 'ad', 'x_0_1': 'cd', 'x_1_0': 'oo', 'x_1_1': 'bd'}. Best is trial 35 with value: 0.5.
[I 2025-01-12 23:19:54,894] Trial 309 finished with value: 2.0 and parameters: {'x_0_0': 'cd', 'x_0_1': 'cd', 'x_1_0': 'cd', 'x_1_1': 'cd'}. Best is trial 76 with value: 0.5.
