[I 2025-01-12 23:19:25,062] Trial 124 finished with value: 0.9285714285714286 and parameters: {'x_0_0': 'bd', 'x_0_1': 'oo', 'x_1_0': 'ab', 'x_1_1': 'ab'}. Best is trial 120 with value: 0.5.
[I 2025-01-12 23:19:25,072] Trial 121 finished with value: 1.3214285714285714 and parameters: {'x_0_0': 'ad', 'x_0_1': 'ad', 'x_1_0': 'oo', 'x_1_1': 'bc'}. Best is trial 86 with value: 0.5.
[I 2025-01-12 23:19:25,079] Trial 115 finished with value: 0.75 and parameters: {'x_0_0': 'ac', 'x_0_1': 'ad', 'x_1_0': 'oo', 'x_1_1': 'bc'}. Best is trial 78 with value: 0.5.
[I 2025-01-12 23:19:25,086] Trial 118 finished with value: 1.0714285714285714 and parameters: {'x_0_0': 'ac', 'x_0_1': 'oo', 'x_1_0': 'ad', 'x_1_1': 'ad'}. Best is trial 76 with value: 0.5.
[I 2025-01-12 23:19:25,088] Trial 105 finished with value: 1.0714285714285714 and parameters: {'x_0_0': 'ad', 'x_0_1': 'oo', 'x_1_0': 'cd', 'x_1_1': 'ab'}. Best is trial 62 with value: 0.5.
[I 2025-01-12 23:19:25,093] Trial 106 finished with value: 1.75 and parameters: {'x_0_0': 'cd', 'x_0_1': 'ab', 'x_1_0': 'oo', 'x_1_1': 'bc'}. Best is trial 50 with value: 0.5.
[I 2025-01-12 23:19:25,122] Trial 118 finished with value: 1.3214285714285714 and parameters: {'x_0_0': 'ad', 'x_0_1': 'ab', 'x_1_0': 'oo', 'x_1_1': 'ac'}. Best is trial 17 with value: 0.5.
[I 2025-01-12 23:19:25,135] Trial 117 finished with value: 1.3214285714285714 and parameters: {'x_0_0': 'bd', 'x_0_1': 'ac', 'x_1_0': 'oo', 'x_1_1': 'ad'}. Best is trial 11 with value: 0.5.
[I 2025-01-12 23:19:25,139] Trial 110 finished with value: 0.9285714285714286 and parameters: {'x_0_0': 'ad', 'x_0_1': 'oo', 'x_1_0': 'ab', 'x_1_1': 'bc'}. Best is trial 68 with value: 0.5.
[I 2025-01-12 23:19:25,181] Trial 125 finished with value: 1.3214285714285714 and parameters: {'x_0_0': 'ac', 'x_0_1': 'bc', 'x_1_0': 'oo', 'x_1_1': 'bc'}. Best is trial 120 with value: 0.5.
[I 2025-01-12 23:19:25,184] Trial 122 finished with value: 1.0714285714285714 and parameters: {'x_0_0': 'ad', 'x_0_1': 'oo', 'x_1_0': 'ad', 'x_1_1': 'bc'}. Best is trial 86 with value: 0.5.
[I 2025-01-12 23:19:25,189] Trial 116 finished with value: 1.0714285714285714 and parameters: {'x_0_0': 'bd', 'x_0_1': 'oo', 'x_1_0': 'ac', 'x_1_1': 'ac'}. Best is trial 78 with value: 0.5.
[I 2025-01-12 23:19:25,189] Trial 119 finished with value: 1.3214285714285714 and parameters: {'x_0_0': 'ad', 'x_0_1': 'bc', 'x_1_0': 'oo', 'x_1_1': 'bd'}. Best is trial 76 with value: 0.5.
[I 2025-01-12 23:19:25,190] Trial 106 finished with value: 0.7857142857142857 and parameters: {'x_0_0': 'bd', 'x_0_1': 'oo', 'x_1_0': 'bd', 'x_1_1': 'bc'}. Best is trial 62 with value: 0.5.
[I 2025-01-12 23:19:25,217] Trial 107 finished with value: 1.3214285714285714 and parameters: {'x_0_0': 'ad', 'x_0_1': 'ab', 'x_1_0': 'oo', 'x_1_1': 'ab'}. Best is trial 50 with value: 0.5.
[I 2025-01-12 23:19:25,240] Trial 119 finished with value: 1.3214285714285714 and parameters: {'x_0_0': 'bd', 'x_0_1': 'ad', 'x_1_0': 'oo', 'x_1_1': 'ad'}. Best is trial 17 with value: 0.5.
[I 2025-01-12 23:19:25,248] Trial 118 finished with value: 1.0714285714285714 and parameters: {'x_0_0': 'bc', 'x_0_1': 'oo', 'x_1_0': 'bc', 'x_1_1': 'bc'}. Best is trial 11 with value: 0.5.
[I 2025-01-12 23:19:25,268] Trial 111 finished with value: 1.5 and parameters: {'x_0_0': 'cd', 'x_0_1': 'oo', 'x_1_0': 'bc', 'x_1_1': 'ab'}. Best is trial 68 with value: 0.5.
[I 2025-01-12 23:19:25,274] Trial 123 finished with value: 1.3214285714285714 and parameters: {'x_0_0': 'bd', 'x_0_1': 'ac', 'x_1_0': 'oo', 'x_1_1': 'ab'}. Best is trial 86 with value: 0.5.
[I 2025-01-12 23:19:25,293] Trial 106 finished with value: 0.5 and parameters: {'x_0_0': 'bd', 'x_0_1': 'oo', 'x_1_0': 'bc', 'x_1_1': 'ac'}. Best is trial 35 with value: 0.5.
[I 2025-01-12 23:19:25,315] Trial 120 finished with value: 1.3214285714285714 and parameters: {'x_0_0': 'bd', 'x_0_1': 'cd', 'x_1_0': 'oo', 'x_1_1': 'ac'}. Best is trial 76 with value: 0.5.
[I 2025-01-12 23:19:25,326] Trial 126 finished with value: 1.0714285714285714 and parameters: {'x_0_0': 'ac', 'x_0_1': 'oo', 'x_1_0': 'bd', 'x_1_1': 'ab'}. Best is trial 120 with value: 0.5.
[I 2025-01-12 23:19:25,328] Trial 117 finished with value: 0.8928571428571428 and parameters: {'x_0_0': 'ac', 'x_0_1': 'ad', 'x_1_0': 'oo', 'x_1_1': 'ab'}. Best is trial 78 with value: 0.5.
[I 2025-01-12 23:19:25,330] Trial 108 finished with value: 1.3214285714285714 and parameters: {'x_0_0': 'bd', 'x_0_1': 'bd', 'x_1_0': 'oo', 'x_1_1': 'bc'}. Best is trial 50 with value: 0.5.
[I 2025-01-12 23:19:25,355] Trial 120 finished with value: 1.3214285714285714 and parameters: {'x_0_0': 'bd', 'x_0_1': 'ab', 'x_1_0': 'oo', 'x_1_1': 'ab'}. Best is trial 17 with value: 0.5.
[I 2025-01-12 23:19:25,358] Trial 119 finished with value: 1.3214285714285714 and parameters: {'x_0_0': 'ad', 'x_0_1': 'ab', 'x_1_0': 'oo', 'x_1_1': 'bc'}. Best is trial 11 with value: 0.5.
[I 2025-01-12 23:19:25,376] Trial 112 finished with value: 1.0714285714285714 and parameters: {'x_0_0': 'ac', 'x_0_1': 'oo', 'x_1_0': 'bc', 'x_1_1': 'bc'}. Best is trial 68 with value: 0.5.
[I 2025-01-12 23:19:25,389] Trial 124 finished with value: 1.0714285714285714 and parameters: {'x_0_0': 'bc', 'x_0_1': 'oo', 'x_1_0': 'bc', 'x_1_1': 'ab'}. Best is trial 86 with value: 0.5.
[I 2025-01-12 23:19:25,402] Trial 107 finished with value: 1.5 and parameters: {'x_0_0': 'cd', 'x_0_1': 'oo', 'x_1_0': 'bc', 'x_1_1': 'bc'}. Best is trial 35 with value: 0.5.
[I 2025-01-12 23:19:25,427] Trial 121 finished with value: 0.5 and parameters: {'x_0_0': 'ad', 'x_0_1': 'oo', 'x_1_0': 'bc', 'x_1_1': 'ad'}. Best is trial 76 with value: 0.5.
[I 2025-01-12 23:19:25,429] Trial 118 finished with value: 1.3214285714285714 and parameters: {'x_0_0': 'ad', 'x_0_1': 'ad', 'x_1_0': 'oo', 'x_1_1': 'ab'}. Best is trial 78 with value: 0.5.
[I 2025-01-12 23:19:25,439] Trial 127 finished with value: 1.3214285714285714 and parameters: {'x_0_0': 'bd', 'x_0_1': 'bd', 'x_1_0': 'oo', 'x_1_1': 'ad'}. Best is trial 120 with value: 0.5.
[I 2025-01-12 23:19:25,453] Trial 109 finished with value: 1.3214285714285714 and parameters: {'x_0_0': 'bc', 'x_0_1': 'bd', 'x_1_0': 'oo', 'x_1_1': 'bc'}. Best is trial 50 with value: 0.5.
[I 2025-01-12 23:19:25,472] Trial 120 finished with value: 1.0714285714285714 and parameters: {'x_0_0': 'ac', 'x_0_1': 'oo', 'x_1_0': 'bd', 'x_1_1': 'ab'}. Best is trial 11 with value: 0.5.
[I 2025-01-12 23:19:25,474] Trial 121 finished with value: 1.0714285714285714 and parameters: {'x_0_0': 'ad', 'x_0_1': 'oo', 'x_1_0': 'cd', 'x_1_1': 'ac'}. Best is trial 17 with value: 0.5.
[I 2025-01-12 23:19:25,479] Trial 113 finished with value: 1.3214285714285714 and parameters: {'x_0_0': 'bc', 'x_0_1': 'bc', 'x_1_0': 'oo', 'x_1_1': 'bc'}. Best is trial 68 with value: 0.5.
[I 2025-01-12 23:19:25,506] Trial 125 finished with value: 1.3214285714285714 and parameters: {'x_0_0': 'ad', 'x_0_1': 'cd', 'x_1_0': 'oo', 'x_1_1': 'bd'}. Best is trial 86 with value: 0.5.
[I 2025-01-12 23:19:25,515] Trial 108 finished with value: 1.3214285714285714 and parameters: {'x_0_0': 'ad', 'x_0_1': 'bd', 'x_1_0': 'oo', 'x_1_1': 'ac'}. Best is trial 35 with value: 0.5.
[I 2025-01-12 23:19:25,543] Trial 128 finished with value: 1.3214285714285714 and parameters: {'x_0_0': 'ad', 'x_0_1': 'ac', 'x_1_0': 'oo', 'x_1_1': 'bc'}. Best is trial 120 with value: 0.5.
[I 2025-01-12 23:19:25,547] Trial 122 finished with value: 1.0714285714285714 and parameters: {'x_0_0': 'bd', 'x_0_1': 'oo', 'x_1_0': 'cd', 'x_1_1': 'ab'}. Best is trial 76 with value: 0.5.
[I 2025-01-12 23:19:25,555] Trial 119 finished with value: 0.9285714285714286 and parameters: {'x_0_0': 'bd', 'x_0_1': 'oo', 'x_1_0': 'ab', 'x_1_1': 'ab'}. Best is trial 78 with value: 0.5.
[I 2025-01-12 23:19:25,556] Trial 121 finished with value: 1.3214285714285714 and parameters: {'x_0_0': 'ad', 'x_0_1': 'ad', 'x_1_0': 'oo', 'x_1_1': 'ac'}. Best is trial 11 with value: 0.5.
[I 2025-01-12 23:19:25,571] Trial 110 finished with value: 1.3214285714285714 and parameters: {'x_0_0': 'ad', 'x_0_1': 'ab', 'x_1_0': 'oo', 'x_1_1': 'bd'}. Best is trial 50 with value: 0.5.
[I 2025-01-12 23:19:25,585] Trial 114 finished with value: 1.3214285714285714 and parameters: {'x_0_0': 'bc', 'x_0_1': 'bc', 'x_1_0': 'oo', 'x_1_1': 'ad'}. Best is trial 68 with value: 0.5.
[I 2025-01-12 23:19:25,592] Trial 122 finished with value: 1.0714285714285714 and parameters: {'x_0_0': 'bc', 'x_0_1': 'oo', 'x_1_0': 'bd', 'x_1_1': 'ab'}. Best is trial 17 with value: 0.5.
[I 2025-01-12 23:19:25,618] Trial 109 finished with value: 1.3214285714285714 and parameters: {'x_0_0': 'bd', 'x_0_1': 'bc', 'x_1_0': 'oo', 'x_1_1': 'ac'}. Best is trial 35 with value: 0.5.
[I 2025-01-12 23:19:25,627] Trial 126 finished with value: 0.9285714285714286 and parameters: {'x_0_0': 'bd', 'x_0_1': 'oo', 'x_1_0': 'ab', 'x_1_1': 'ab'}. Best is trial 86 with value: 0.5.
[I 2025-01-12 23:19:25,647] Trial 123 finished with value: 1.3214285714285714 and parameters: {'x_0_0': 'bd', 'x_0_1': 'bc', 'x_1_0': 'oo', 'x_1_1': 'bc'}. Best is trial 76 with value: 0.5.
[I 2025-01-12 23:19:25,672] Trial 120 finished with value: 0.9285714285714286 and parameters: {'x_0_0': 'ad', 'x_0_1': 'oo', 'x_1_0': 'ab', 'x_1_1': 'ab'}. Best is trial 78 with value: 0.5.
[I 2025-01-12 23:19:25,683] Trial 122 finished with value: 1.0714285714285714 and parameters: {'x_0_0': 'ac', 'x_0_1': 'oo', 'x_1_0': 'bd', 'x_1_1': 'bc'}. Best is trial 11 with value: 0.5.
[I 2025-01-12 23:19:25,689] Trial 111 finished with value: 1.3214285714285714 and parameters: {'x_0_0': 'ad', 'x_0_1': 'ab', 'x_1_0': 'oo', 'x_1_1': 'ad'}. Best is trial 50 with value: 0.5.
[I 2025-01-12 23:19:25,698] Trial 115 finished with value: 1.3214285714285714 and parameters: {'x_0_0': 'bc', 'x_0_1': 'bc', 'x_1_0': 'oo', 'x_1_1': 'bd'}. Best is trial 68 with value: 0.5.
[I 2025-01-12 23:19:25,702] Trial 129 finished with value: 1.3214285714285714 and parameters: {'x_0_0': 'bd', 'x_0_1': 'ad', 'x_1_0': 'oo', 'x_1_1': 'ab'}. Best is trial 120 with value: 0.5.
[I 2025-01-12 23:19:25,704] Trial 123 finished with value: 0.9285714285714286 and parameters: {'x_0_0': 'ad', 'x_0_1': 'oo', 'x_1_0': 'ab', 'x_1_1': 'bd'}. Best is trial 17 with value: 0.5.
[I 2025-01-12 23:19:25,726] Trial 110 finished with value: 1.0714285714285714 and parameters: {'x_0_0': 'bc', 'x_0_1': 'oo', 'x_1_0': 'bd', 'x_1_1': 'ac'}. Best is trial 35 with value: 0.5.
[I 2025-01-12 23:19:25,734] Trial 127 finished with value: 1.75 and parameters: {'x_0_0': 'cd', 'x_0_1': 'bc', 'x_1_0': 'oo', 'x_1_1': 'bc'}. Best is trial 86 with value: 0.5.
[I 2025-01-12 23:19:25,757] Trial 124 finished with value: 0.7857142857142857 and parameters: {'x_0_0': 'ad', 'x_0_1': 'oo', 'x_1_0': 'bd', 'x_1_1': 'ab'}. Best is trial 76 with value: 0.5.
[I 2025-01-12 23:19:25,772] Trial 107 finished with value: 1.0357142857142856 and parameters: {'x_0_0': 'bc', 'x_0_1': 'ac', 'x_1_0': 'oo', 'x_1_1': 'ab'}. Best is trial 62 with value: 0.5.
[I 2025-01-12 23:19:25,797] Trial 121 finished with value: 1.0357142857142856 and parameters: {'x_0_0': 'ac', 'x_0_1': 'ad', 'x_1_0': 'oo', 'x_1_1': 'ad'}. Best is trial 78 with value: 0.5.
[I 2025-01-12 23:19:25,815] Trial 123 finished with value: 1.0714285714285714 and parameters: {'x_0_0': 'ac', 'x_0_1': 'oo', 'x_1_0': 'ab', 'x_1_1': 'ad'}. Best is trial 11 with value: 0.5.
[I 2025-01-12 23:19:25,831] Trial 116 finished with value: 1.0714285714285714 and parameters: {'x_0_0': 'bc', 'x_0_1': 'oo', 'x_1_0': 'bd', 'x_1_1': 'ad'}. Best is trial 68 with value: 0.5.
[I 2025-01-12 23:19:25,843] Trial 111 finished with value: 1.0357142857142856 and parameters: {'x_0_0': 'bc', 'x_0_1': 'ac', 'x_1_0': 'oo', 'x_1_1': 'bd'}. Best is trial 35 with value: 0.5.
[I 2025-01-12 23:19:25,845] Trial 130 finished with value: 1.0357142857142856 and parameters: {'x_0_0': 'ac', 'x_0_1': 'ac', 'x_1_0': 'oo', 'x_1_1': 'bd'}. Best is trial 120 with value: 0.5.
[I 2025-01-12 23:19:25,853] Trial 124 finished with value: 1.75 and parameters: {'x_0_0': 'cd', 'x_0_1': 'cd', 'x_1_0': 'oo', 'x_1_1': 'ac'}. Best is trial 17 with value: 0.5.
[I 2025-01-12 23:19:25,853] Trial 112 finished with value: 1.75 and parameters: {'x_0_0': 'cd', 'x_0_1': 'ad', 'x_1_0': 'oo', 'x_1_1': 'bc'}. Best is trial 50 with value: 0.5.
[I 2025-01-12 23:19:25,872] Trial 128 finished with value: 1.3214285714285714 and parameters: {'x_0_0': 'bd', 'x_0_1': 'ad', 'x_1_0': 'oo', 'x_1_1': 'bc'}. Best is trial 86 with value: 0.5.
[I 2025-01-12 23:19:25,884] Trial 125 finished with value: 1.0714285714285714 and parameters: {'x_0_0': 'bc', 'x_0_1': 'oo', 'x_1_0': 'bd', 'x_1_1': 'ab'}. Best is trial 76 with value: 0.5.
[I 2025-01-12 23:19:25,899] Trial 108 finished with value: 0.9285714285714286 and parameters: {'x_0_0': 'bd', 'x_0_1': 'oo', 'x_1_0': 'ab', 'x_1_1': 'ab'}. Best is trial 62 with value: 0.5.
[I 2025-01-12 23:19:25,929] Trial 124 finished with value: 1.3214285714285714 and parameters: {'x_0_0': 'bd', 'x_0_1': 'ad', 'x_1_0': 'oo', 'x_1_1': 'ab'}. Best is trial 11 with value: 0.5.
[I 2025-01-12 23:19:25,936] Trial 122 finished with value: 1.3214285714285714 and parameters: {'x_0_0': 'bd', 'x_0_1': 'ad', 'x_1_0': 'oo', 'x_1_1': 'ab'}. Best is trial 78 with value: 0.5.
[I 2025-01-12 23:19:25,939] Trial 113 finished with value: 1.3214285714285714 and parameters: {'x_0_0': 'ad', 'x_0_1': 'ab', 'x_1_0': 'oo', 'x_1_1': 'ac'}. Best is trial 50 with value: 0.5.
[I 2025-01-12 23:19:25,953] Trial 125 finished with value: 1.0714285714285714 and parameters: {'x_0_0': 'bd', 'x_0_1': 'oo', 'x_1_0': 'ad', 'x_1_1': 'ac'}. Best is trial 17 with value: 0.5.
[I 2025-01-12 23:19:25,956] Trial 117 finished with value: 1.3214285714285714 and parameters: {'x_0_0': 'bd', 'x_0_1': 'ad', 'x_1_0': 'oo', 'x_1_1': 'ac'}. Best is trial 68 with value: 0.5.
[I 2025-01-12 23:19:25,970] Trial 112 finished with value: 1.3214285714285714 and parameters: {'x_0_0': 'bd', 'x_0_1': 'bc', 'x_1_0': 'oo', 'x_1_1': 'ad'}. Best is trial 35 with value: 0.5.
[I 2025-01-12 23:19:25,981] Trial 131 finished with value: 1.0714285714285714 and parameters: {'x_0_0': 'bc', 'x_0_1': 'oo', 'x_1_0': 'ab', 'x_1_1': 'bc'}. Best is trial 120 with value: 0.5.
[I 2025-01-12 23:19:25,984] Trial 129 finished with value: 1.0714285714285714 and parameters: {'x_0_0': 'bd', 'x_0_1': 'oo', 'x_1_0': 'ac', 'x_1_1': 'ad'}. Best is trial 86 with value: 0.5.
[I 2025-01-12 23:19:26,010] Trial 126 finished with value: 1.0714285714285714 and parameters: {'x_0_0': 'ac', 'x_0_1': 'oo', 'x_1_0': 'ac', 'x_1_1': 'ab'}. Best is trial 76 with value: 0.5.
[I 2025-01-12 23:19:26,022] Trial 109 finished with value: 0.9285714285714286 and parameters: {'x_0_0': 'bd', 'x_0_1': 'oo', 'x_1_0': 'ab', 'x_1_1': 'ad'}. Best is trial 62 with value: 0.5.
[I 2025-01-12 23:19:26,051] Trial 114 finished with value: 0.9285714285714286 and parameters: {'x_0_0': 'bd', 'x_0_1': 'oo', 'x_1_0': 'ab', 'x_1_1': 'ac'}. Best is trial 50 with value: 0.5.
[I 2025-01-12 23:19:26,056] Trial 123 finished with value: 1.3214285714285714 and parameters: {'x_0_0': 'bc', 'x_0_1': 'bc', 'x_1_0': 'oo', 'x_1_1': 'bd'}. Best is trial 78 with value: 0.5.
[I 2025-01-12 23:19:26,068] Trial 125 finished with value: 1.3214285714285714 and parameters: {'x_0_0': 'bd', 'x_0_1': 'ac', 'x_1_0': 'oo', 'x_1_1': 'ac'}. Best is trial 11 with value: 0.5.
[I 2025-01-12 23:19:26,076] Trial 130 finished with value: 0.75 and parameters: {'x_0_0': 'ac', 'x_0_1': 'ad', 'x_1_0': 'oo', 'x_1_1': 'bd'}. Best is trial 86 with value: 0.5.
[I 2025-01-12 23:19:26,079] Trial 113 finished with value: 0.7857142857142857 and parameters: {'x_0_0': 'ad', 'x_0_1': 'oo', 'x_1_0': 'bd', 'x_1_1': 'ac'}. Best is trial 35 with value: 0.5.
[I 2025-01-12 23:19:26,097] Trial 118 finished with value: 1.0714285714285714 and parameters: {'x_0_0': 'ad', 'x_0_1': 'oo', 'x_1_0': 'ac', 'x_1_1': 'ab'}. Best is trial 68 with value: 0.5.
[I 2025-01-12 23:19:26,106] Trial 126 finished with value: 1.3214285714285714 and parameters: {'x_0_0': 'bd', 'x_0_1': 'ab', 'x_1_0': 'oo', 'x_1_1': 'ac'}. Best is trial 17 with value: 0.5.
[I 2025-01-12 23:19:26,109] Trial 132 finished with value: 1.75 and parameters: {'x_0_0': 'cd', 'x_0_1': 'bc', 'x_1_0': 'oo', 'x_1_1': 'ad'}. Best is trial 120 with value: 0.5.
[I 2025-01-12 23:19:26,131] Trial 127 finished with value: 1.0357142857142856 and parameters: {'x_0_0': 'bc', 'x_0_1': 'ad', 'x_1_0': 'oo', 'x_1_1': 'ad'}. Best is trial 76 with value: 0.5.
[I 2025-01-12 23:19:26,161] Trial 110 finished with value: 1.0357142857142856 and parameters: {'x_0_0': 'bc', 'x_0_1': 'ac', 'x_1_0': 'oo', 'x_1_1': 'bc'}. Best is trial 62 with value: 0.5.
[I 2025-01-12 23:19:26,199] Trial 124 finished with value: 1.0714285714285714 and parameters: {'x_0_0': 'ac', 'x_0_1': 'oo', 'x_1_0': 'bd', 'x_1_1': 'ab'}. Best is trial 78 with value: 0.5.
[I 2025-01-12 23:19:26,199] Trial 115 finished with value: 1.0714285714285714 and parameters: {'x_0_0': 'ac', 'x_0_1': 'oo', 'x_1_0': 'bc', 'x_1_1': 'bc'}. Best is trial 50 with value: 0.5.
[I 2025-01-12 23:19:26,210] Trial 126 finished with value: 1.0714285714285714 and parameters: {'x_0_0': 'bc', 'x_0_1': 'oo', 'x_1_0': 'ab', 'x_1_1': 'bd'}. Best is trial 11 with value: 0.5.
[I 2025-01-12 23:19:26,231] Trial 114 finished with value: 0.9285714285714286 and parameters: {'x_0_0': 'ad', 'x_0_1': 'oo', 'x_1_0': 'ab', 'x_1_1': 'bd'}. Best is trial 35 with value: 0.5.
[I 2025-01-12 23:19:26,240] Trial 133 finished with value: 0.9285714285714286 and parameters: {'x_0_0': 'ad', 'x_0_1': 'oo', 'x_1_0': 'ab', 'x_1_1': 'ad'}. Best is trial 120 with value: 0.5.
[I 2025-01-12 23:19:26,245] Trial 131 finished with value: 1.3214285714285714 and parameters: {'x_0_0': 'ad', 'x_0_1': 'cd', 'x_1_0': 'oo', 'x_1_1': 'ad'}. Best is trial 86 with value: 0.5.
[I 2025-01-12 23:19:26,274] Trial 119 finished with value: 1.3214285714285714 and parameters: {'x_0_0': 'ac', 'x_0_1': 'cd', 'x_1_0': 'oo', 'x_1_1': 'ac'}. Best is trial 68 with value: 0.5.
[I 2025-01-12 23:19:26,281] Trial 127 finished with value: 1.0714285714285714 and parameters: {'x_0_0': 'ad', 'x_0_1': 'oo', 'x_1_0': 'ad', 'x_1_1': 'ab'}. Best is trial 17 with value: 0.5.
[I 2025-01-12 23:19:26,288] Trial 128 finished with value: 1.75 and parameters: {'x_0_0': 'cd', 'x_0_1': 'ad', 'x_1_0': 'oo', 'x_1_1': 'ac'}. Best is trial 76 with value: 0.5.
[I 2025-01-12 23:19:26,340] Trial 111 finished with value: 1.0714285714285714 and parameters: {'x_0_0': 'ac', 'x_0_1': 'oo', 'x_1_0': 'ab', 'x_1_1': 'ab'}. Best is trial 62 with value: 0.5.
[I 2025-01-12 23:19:26,345] Trial 127 finished with value: 0.9285714285714286 and parameters: {'x_0_0': 'ad', 'x_0_1': 'oo', 'x_1_0': 'ab', 'x_1_1': 'ab'}. Best is trial 11 with value: 0.5.
[I 2025-01-12 23:19:26,362] Trial 132 finished with value: 1.0714285714285714 and parameters: {'x_0_0': 'bd', 'x_0_1': 'oo', 'x_1_0': 'cd', 'x_1_1': 'bc'}. Best is trial 86 with value: 0.5.
[I 2025-01-12 23:19:26,379] Trial 125 finished with value: 0.7857142857142857 and parameters: {'x_0_0': 'ad', 'x_0_1': 'oo', 'x_1_0': 'bd', 'x_1_1': 'ad'}. Best is trial 78 with value: 0.5.
[I 2025-01-12 23:19:26,383] Trial 115 finished with value: 0.5 and parameters: {'x_0_0': 'bd', 'x_0_1': 'oo', 'x_1_0': 'bc', 'x_1_1': 'ad'}. Best is trial 35 with value: 0.5.
[I 2025-01-12 23:19:26,387] Trial 116 finished with value: 1.0714285714285714 and parameters: {'x_0_0': 'bc', 'x_0_1': 'oo', 'x_1_0': 'ad', 'x_1_1': 'ad'}. Best is trial 50 with value: 0.5.
[I 2025-01-12 23:19:26,393] Trial 134 finished with value: 0.5 and parameters: {'x_0_0': 'bd', 'x_0_1': 'oo', 'x_1_0': 'bc', 'x_1_1': 'ac'}. Best is trial 120 with value: 0.5.
[I 2025-01-12 23:19:26,405] Trial 120 finished with value: 0.9285714285714286 and parameters: {'x_0_0': 'bd', 'x_0_1': 'oo', 'x_1_0': 'ab', 'x_1_1': 'bd'}. Best is trial 68 with value: 0.5.
[I 2025-01-12 23:19:26,424] Trial 128 finished with value: 0.9285714285714286 and parameters: {'x_0_0': 'bd', 'x_0_1': 'oo', 'x_1_0': 'ab', 'x_1_1': 'bd'}. Best is trial 17 with value: 0.5.
[I 2025-01-12 23:19:26,445] Trial 129 finished with value: 1.3214285714285714 and parameters: {'x_0_0': 'ad', 'x_0_1': 'ad', 'x_1_0': 'oo', 'x_1_1': 'bc'}. Best is trial 76 with value: 0.5.
[I 2025-01-12 23:19:26,459] Trial 128 finished with value: 1.1785714285714286 and parameters: {'x_0_0': 'bc', 'x_0_1': 'ab', 'x_1_0': 'oo', 'x_1_1': 'ad'}. Best is trial 11 with value: 0.5.
[I 2025-01-12 23:19:26,471] Trial 112 finished with value: 1.3214285714285714 and parameters: {'x_0_0': 'bd', 'x_0_1': 'ac', 'x_1_0': 'oo', 'x_1_1': 'ab'}. Best is trial 62 with value: 0.5.
[I 2025-01-12 23:19:26,499] Trial 126 finished with value: 1.0714285714285714 and parameters: {'x_0_0': 'bd', 'x_0_1': 'oo', 'x_1_0': 'cd', 'x_1_1': 'ab'}. Best is trial 78 with value: 0.5.
[I 2025-01-12 23:19:26,499] Trial 121 finished with value: 1.0357142857142856 and parameters: {'x_0_0': 'ac', 'x_0_1': 'ad', 'x_1_0': 'oo', 'x_1_1': 'ac'}. Best is trial 68 with value: 0.5.
[I 2025-01-12 23:19:26,511] Trial 117 finished with value: 1.3214285714285714 and parameters: {'x_0_0': 'ad', 'x_0_1': 'bc', 'x_1_0': 'oo', 'x_1_1': 'ac'}. Best is trial 50 with value: 0.5.
[I 2025-01-12 23:19:26,515] Trial 135 finished with value: 1.0357142857142856 and parameters: {'x_0_0': 'bc', 'x_0_1': 'ac', 'x_1_0': 'oo', 'x_1_1': 'bc'}. Best is trial 120 with value: 0.5.
[I 2025-01-12 23:19:26,517] Trial 133 finished with value: 1.0714285714285714 and parameters: {'x_0_0': 'bd', 'x_0_1': 'oo', 'x_1_0': 'ad', 'x_1_1': 'ad'}. Best is trial 86 with value: 0.5.
[I 2025-01-12 23:19:26,524] Trial 116 finished with value: 1.5 and parameters: {'x_0_0': 'cd', 'x_0_1': 'oo', 'x_1_0': 'ad', 'x_1_1': 'ac'}. Best is trial 35 with value: 0.5.
[I 2025-01-12 23:19:26,540] Trial 129 finished with value: 1.0714285714285714 and parameters: {'x_0_0': 'bd', 'x_0_1': 'oo', 'x_1_0': 'ac', 'x_1_1': 'ac'}. Best is trial 17 with value: 0.5.
