Running: python3 experiments/tf_continual.py --timestamp 2025-01-12_23-19-00 --function warcraft --seed 0 --map_option 1 --tf_method train --tf_rank 3 --tf_lr 0.01 --tf_tol 1e-6 --tf_reg_lambda 0 --tf_constraint_lambda 1.0 --decomp_iter_num 10 --mask_ratio 1 --n_startup_trials 1 --acquisition_function ei --acq_trade_off_param 1.0 --iter_bo 500 --plot_save_dir results/2025-01-12_23-19-00/plots --tf_max_iter 10000 --constraint
Running: python3 experiments/tf_continual.py --timestamp 2025-01-12_23-19-00 --function warcraft --seed 1 --map_option 1 --tf_method train --tf_rank 3 --tf_lr 0.01 --tf_tol 1e-6 --tf_reg_lambda 0 --tf_constraint_lambda 1.0 --decomp_iter_num 10 --mask_ratio 1 --n_startup_trials 1 --acquisition_function ei --acq_trade_off_param 1.0 --iter_bo 500 --plot_save_dir results/2025-01-12_23-19-00/plots --tf_max_iter 10000 --constraint
Running: python3 experiments/tf_continual.py --timestamp 2025-01-12_23-19-00 --function warcraft --seed 2 --map_option 1 --tf_method train --tf_rank 3 --tf_lr 0.01 --tf_tol 1e-6 --tf_reg_lambda 0 --tf_constraint_lambda 1.0 --decomp_iter_num 10 --mask_ratio 1 --n_startup_trials 1 --acquisition_function ei --acq_trade_off_param 1.0 --iter_bo 500 --plot_save_dir results/2025-01-12_23-19-00/plots --tf_max_iter 10000 --constraint
Running: python3 experiments/tf_continual.py --timestamp 2025-01-12_23-19-00 --function warcraft --seed 4 --map_option 1 --tf_method train --tf_rank 3 --tf_lr 0.01 --tf_tol 1e-6 --tf_reg_lambda 0 --tf_constraint_lambda 1.0 --decomp_iter_num 10 --mask_ratio 1 --n_startup_trials 1 --acquisition_function ei --acq_trade_off_param 1.0 --iter_bo 500 --plot_save_dir results/2025-01-12_23-19-00/plots --tf_max_iter 10000 --constraint
Running: python3 experiments/tf_continual.py --timestamp 2025-01-12_23-19-00 --function warcraft --seed 3 --map_option 1 --tf_method train --tf_rank 3 --tf_lr 0.01 --tf_tol 1e-6 --tf_reg_lambda 0 --tf_constraint_lambda 1.0 --decomp_iter_num 10 --mask_ratio 1 --n_startup_trials 1 --acquisition_function ei --acq_trade_off_param 1.0 --iter_bo 500 --plot_save_dir results/2025-01-12_23-19-00/plots --tf_max_iter 10000 --constraint
Running: python3 experiments/tf_continual.py --timestamp 2025-01-12_23-19-00 --function warcraft --seed 6 --map_option 1 --tf_method train --tf_rank 3 --tf_lr 0.01 --tf_tol 1e-6 --tf_reg_lambda 0 --tf_constraint_lambda 1.0 --decomp_iter_num 10 --mask_ratio 1 --n_startup_trials 1 --acquisition_function ei --acq_trade_off_param 1.0 --iter_bo 500 --plot_save_dir results/2025-01-12_23-19-00/plots --tf_max_iter 10000 --constraint
Running: python3 experiments/tf_continual.py --timestamp 2025-01-12_23-19-00 --function warcraft --seed 7 --map_option 1 --tf_method train --tf_rank 3 --tf_lr 0.01 --tf_tol 1e-6 --tf_reg_lambda 0 --tf_constraint_lambda 1.0 --decomp_iter_num 10 --mask_ratio 1 --n_startup_trials 1 --acquisition_function ei --acq_trade_off_param 1.0 --iter_bo 500 --plot_save_dir results/2025-01-12_23-19-00/plots --tf_max_iter 10000 --constraint
Running: python3 experiments/tf_continual.py --timestamp 2025-01-12_23-19-00 --function warcraft --seed 8 --map_option 1 --tf_method train --tf_rank 3 --tf_lr 0.01 --tf_tol 1e-6 --tf_reg_lambda 0 --tf_constraint_lambda 1.0 --decomp_iter_num 10 --mask_ratio 1 --n_startup_trials 1 --acquisition_function ei --acq_trade_off_param 1.0 --iter_bo 500 --plot_save_dir results/2025-01-12_23-19-00/plots --tf_max_iter 10000 --constraint
Running: python3 experiments/tf_continual.py --timestamp 2025-01-12_23-19-00 --function warcraft --seed 5 --map_option 1 --tf_method train --tf_rank 3 --tf_lr 0.01 --tf_tol 1e-6 --tf_reg_lambda 0 --tf_constraint_lambda 1.0 --decomp_iter_num 10 --mask_ratio 1 --n_startup_trials 1 --acquisition_function ei --acq_trade_off_param 1.0 --iter_bo 500 --plot_save_dir results/2025-01-12_23-19-00/plots --tf_max_iter 10000 --constraint
Running: python3 experiments/tf_continual.py --timestamp 2025-01-12_23-19-00 --function warcraft --seed 9 --map_option 1 --tf_method train --tf_rank 3 --tf_lr 0.01 --tf_tol 1e-6 --tf_reg_lambda 0 --tf_constraint_lambda 1.0 --decomp_iter_num 10 --mask_ratio 1 --n_startup_trials 1 --acquisition_function ei --acq_trade_off_param 1.0 --iter_bo 500 --plot_save_dir results/2025-01-12_23-19-00/plots --tf_max_iter 10000 --constraint
2025-01-12 23:19:03,735 - INFO - Experiment settings: {'name': '2025-01-12_23-19-00_warcraft_map1_train_seed0', 'seed': 0, 'dimension': 2, 'function': 'warcraft', 'constraint': True, 'direction': False, 'map': array([[0.125, 0.5  ],
       [0.25 , 0.125]]), 'iter_bo': 500, 'storage': 'sqlite:///results/2025-01-12_23-19-00/warcraft_map1_train_seed0.db', 'results_dir': 'results/2025-01-12_23-19-00', 'plot_save_dir': 'results/2025-01-12_23-19-00/plots', 'tf_settings': {'method': 'train', 'rank': 3, 'optim_params': {'lr': 0.01, 'max_iter': 10000, 'tol': 1e-06, 'reg_lambda': 0.0, 'constraint_lambda': 1.0}}, 'acqf_settings': {'acquisition_function': 'ei', 'trade_off_param': 1.0}, 'sampler_settings': {'decomp_iter_num': 10, 'mask_ratio': 1.0, 'include_observed_points': False, 'unique_sampling': False, 'n_startup_trials': 1}}
2025-01-12 23:19:03,935 - INFO - Experiment settings: {'name': '2025-01-12_23-19-00_warcraft_map1_train_seed2', 'seed': 2, 'dimension': 2, 'function': 'warcraft', 'constraint': True, 'direction': False, 'map': array([[0.125, 0.5  ],
       [0.25 , 0.125]]), 'iter_bo': 500, 'storage': 'sqlite:///results/2025-01-12_23-19-00/warcraft_map1_train_seed2.db', 'results_dir': 'results/2025-01-12_23-19-00', 'plot_save_dir': 'results/2025-01-12_23-19-00/plots', 'tf_settings': {'method': 'train', 'rank': 3, 'optim_params': {'lr': 0.01, 'max_iter': 10000, 'tol': 1e-06, 'reg_lambda': 0.0, 'constraint_lambda': 1.0}}, 'acqf_settings': {'acquisition_function': 'ei', 'trade_off_param': 1.0}, 'sampler_settings': {'decomp_iter_num': 10, 'mask_ratio': 1.0, 'include_observed_points': False, 'unique_sampling': False, 'n_startup_trials': 1}}
2025-01-12 23:19:03,961 - INFO - Experiment settings: {'name': '2025-01-12_23-19-00_warcraft_map1_train_seed1', 'seed': 1, 'dimension': 2, 'function': 'warcraft', 'constraint': True, 'direction': False, 'map': array([[0.125, 0.5  ],
       [0.25 , 0.125]]), 'iter_bo': 500, 'storage': 'sqlite:///results/2025-01-12_23-19-00/warcraft_map1_train_seed1.db', 'results_dir': 'results/2025-01-12_23-19-00', 'plot_save_dir': 'results/2025-01-12_23-19-00/plots', 'tf_settings': {'method': 'train', 'rank': 3, 'optim_params': {'lr': 0.01, 'max_iter': 10000, 'tol': 1e-06, 'reg_lambda': 0.0, 'constraint_lambda': 1.0}}, 'acqf_settings': {'acquisition_function': 'ei', 'trade_off_param': 1.0}, 'sampler_settings': {'decomp_iter_num': 10, 'mask_ratio': 1.0, 'include_observed_points': False, 'unique_sampling': False, 'n_startup_trials': 1}}
2025-01-12 23:19:03,978 - INFO - Experiment settings: {'name': '2025-01-12_23-19-00_warcraft_map1_train_seed9', 'seed': 9, 'dimension': 2, 'function': 'warcraft', 'constraint': True, 'direction': False, 'map': array([[0.125, 0.5  ],
       [0.25 , 0.125]]), 'iter_bo': 500, 'storage': 'sqlite:///results/2025-01-12_23-19-00/warcraft_map1_train_seed9.db', 'results_dir': 'results/2025-01-12_23-19-00', 'plot_save_dir': 'results/2025-01-12_23-19-00/plots', 'tf_settings': {'method': 'train', 'rank': 3, 'optim_params': {'lr': 0.01, 'max_iter': 10000, 'tol': 1e-06, 'reg_lambda': 0.0, 'constraint_lambda': 1.0}}, 'acqf_settings': {'acquisition_function': 'ei', 'trade_off_param': 1.0}, 'sampler_settings': {'decomp_iter_num': 10, 'mask_ratio': 1.0, 'include_observed_points': False, 'unique_sampling': False, 'n_startup_trials': 1}}
2025-01-12 23:19:03,987 - INFO - Experiment settings: {'name': '2025-01-12_23-19-00_warcraft_map1_train_seed3', 'seed': 3, 'dimension': 2, 'function': 'warcraft', 'constraint': True, 'direction': False, 'map': array([[0.125, 0.5  ],
       [0.25 , 0.125]]), 'iter_bo': 500, 'storage': 'sqlite:///results/2025-01-12_23-19-00/warcraft_map1_train_seed3.db', 'results_dir': 'results/2025-01-12_23-19-00', 'plot_save_dir': 'results/2025-01-12_23-19-00/plots', 'tf_settings': {'method': 'train', 'rank': 3, 'optim_params': {'lr': 0.01, 'max_iter': 10000, 'tol': 1e-06, 'reg_lambda': 0.0, 'constraint_lambda': 1.0}}, 'acqf_settings': {'acquisition_function': 'ei', 'trade_off_param': 1.0}, 'sampler_settings': {'decomp_iter_num': 10, 'mask_ratio': 1.0, 'include_observed_points': False, 'unique_sampling': False, 'n_startup_trials': 1}}
2025-01-12 23:19:04,006 - INFO - Experiment settings: {'name': '2025-01-12_23-19-00_warcraft_map1_train_seed7', 'seed': 7, 'dimension': 2, 'function': 'warcraft', 'constraint': True, 'direction': False, 'map': array([[0.125, 0.5  ],
       [0.25 , 0.125]]), 'iter_bo': 500, 'storage': 'sqlite:///results/2025-01-12_23-19-00/warcraft_map1_train_seed7.db', 'results_dir': 'results/2025-01-12_23-19-00', 'plot_save_dir': 'results/2025-01-12_23-19-00/plots', 'tf_settings': {'method': 'train', 'rank': 3, 'optim_params': {'lr': 0.01, 'max_iter': 10000, 'tol': 1e-06, 'reg_lambda': 0.0, 'constraint_lambda': 1.0}}, 'acqf_settings': {'acquisition_function': 'ei', 'trade_off_param': 1.0}, 'sampler_settings': {'decomp_iter_num': 10, 'mask_ratio': 1.0, 'include_observed_points': False, 'unique_sampling': False, 'n_startup_trials': 1}}
2025-01-12 23:19:04,128 - INFO - Experiment settings: {'name': '2025-01-12_23-19-00_warcraft_map1_train_seed6', 'seed': 6, 'dimension': 2, 'function': 'warcraft', 'constraint': True, 'direction': False, 'map': array([[0.125, 0.5  ],
       [0.25 , 0.125]]), 'iter_bo': 500, 'storage': 'sqlite:///results/2025-01-12_23-19-00/warcraft_map1_train_seed6.db', 'results_dir': 'results/2025-01-12_23-19-00', 'plot_save_dir': 'results/2025-01-12_23-19-00/plots', 'tf_settings': {'method': 'train', 'rank': 3, 'optim_params': {'lr': 0.01, 'max_iter': 10000, 'tol': 1e-06, 'reg_lambda': 0.0, 'constraint_lambda': 1.0}}, 'acqf_settings': {'acquisition_function': 'ei', 'trade_off_param': 1.0}, 'sampler_settings': {'decomp_iter_num': 10, 'mask_ratio': 1.0, 'include_observed_points': False, 'unique_sampling': False, 'n_startup_trials': 1}}
2025-01-12 23:19:04,221 - INFO - Experiment settings: {'name': '2025-01-12_23-19-00_warcraft_map1_train_seed5', 'seed': 5, 'dimension': 2, 'function': 'warcraft', 'constraint': True, 'direction': False, 'map': array([[0.125, 0.5  ],
       [0.25 , 0.125]]), 'iter_bo': 500, 'storage': 'sqlite:///results/2025-01-12_23-19-00/warcraft_map1_train_seed5.db', 'results_dir': 'results/2025-01-12_23-19-00', 'plot_save_dir': 'results/2025-01-12_23-19-00/plots', 'tf_settings': {'method': 'train', 'rank': 3, 'optim_params': {'lr': 0.01, 'max_iter': 10000, 'tol': 1e-06, 'reg_lambda': 0.0, 'constraint_lambda': 1.0}}, 'acqf_settings': {'acquisition_function': 'ei', 'trade_off_param': 1.0}, 'sampler_settings': {'decomp_iter_num': 10, 'mask_ratio': 1.0, 'include_observed_points': False, 'unique_sampling': False, 'n_startup_trials': 1}}
2025-01-12 23:19:04,255 - INFO - Experiment settings: {'name': '2025-01-12_23-19-00_warcraft_map1_train_seed4', 'seed': 4, 'dimension': 2, 'function': 'warcraft', 'constraint': True, 'direction': False, 'map': array([[0.125, 0.5  ],
       [0.25 , 0.125]]), 'iter_bo': 500, 'storage': 'sqlite:///results/2025-01-12_23-19-00/warcraft_map1_train_seed4.db', 'results_dir': 'results/2025-01-12_23-19-00', 'plot_save_dir': 'results/2025-01-12_23-19-00/plots', 'tf_settings': {'method': 'train', 'rank': 3, 'optim_params': {'lr': 0.01, 'max_iter': 10000, 'tol': 1e-06, 'reg_lambda': 0.0, 'constraint_lambda': 1.0}}, 'acqf_settings': {'acquisition_function': 'ei', 'trade_off_param': 1.0}, 'sampler_settings': {'decomp_iter_num': 10, 'mask_ratio': 1.0, 'include_observed_points': False, 'unique_sampling': False, 'n_startup_trials': 1}}
[I 2025-01-12 23:19:04,270] A new study created in RDB with name: 2025-01-12_23-19-00_warcraft_map1_train_seed0
2025-01-12 23:19:04,282 - INFO - Experiment settings: {'name': '2025-01-12_23-19-00_warcraft_map1_train_seed8', 'seed': 8, 'dimension': 2, 'function': 'warcraft', 'constraint': True, 'direction': False, 'map': array([[0.125, 0.5  ],
       [0.25 , 0.125]]), 'iter_bo': 500, 'storage': 'sqlite:///results/2025-01-12_23-19-00/warcraft_map1_train_seed8.db', 'results_dir': 'results/2025-01-12_23-19-00', 'plot_save_dir': 'results/2025-01-12_23-19-00/plots', 'tf_settings': {'method': 'train', 'rank': 3, 'optim_params': {'lr': 0.01, 'max_iter': 10000, 'tol': 1e-06, 'reg_lambda': 0.0, 'constraint_lambda': 1.0}}, 'acqf_settings': {'acquisition_function': 'ei', 'trade_off_param': 1.0}, 'sampler_settings': {'decomp_iter_num': 10, 'mask_ratio': 1.0, 'include_observed_points': False, 'unique_sampling': False, 'n_startup_trials': 1}}
2025-01-12 23:19:04,288 - INFO - Using sample_independent for sampling with RandomSampler sampler.
2025-01-12 23:19:04,296 - INFO - Using sample_independent for sampling with RandomSampler sampler.
2025-01-12 23:19:04,298 - INFO - Using sample_independent for sampling with RandomSampler sampler.
2025-01-12 23:19:04,299 - INFO - Using sample_independent for sampling with RandomSampler sampler.
[I 2025-01-12 23:19:04,418] Trial 0 finished with value: 1.7142857142857144 and parameters: {'x_0_0': 'ab', 'x_0_1': 'ab', 'x_1_0': 'cd', 'x_1_1': 'cd'}. Best is trial 0 with value: 1.7142857142857144.
/Users/keisukeonoue/ws/constrained_BO_v3/src/samplers/tf_continual.py:294: RuntimeWarning: Mean of empty slice
  mean_ = np.nanmean(finite_values)
/Users/keisukeonoue/ws/constrained_BO_v3/bo-env_v3/lib/python3.12/site-packages/numpy/lib/_nanfunctions_impl.py:2053: RuntimeWarning: Degrees of freedom <= 0 for slice.
  var = nanvar(a, axis=axis, dtype=dtype, out=out, ddof=ddof,
[I 2025-01-12 23:19:04,580] A new study created in RDB with name: 2025-01-12_23-19-00_warcraft_map1_train_seed1
2025-01-12 23:19:04,614 - INFO - Using sample_independent for sampling with RandomSampler sampler.
[I 2025-01-12 23:19:04,616] A new study created in RDB with name: 2025-01-12_23-19-00_warcraft_map1_train_seed9
2025-01-12 23:19:04,625 - INFO - Using sample_independent for sampling with RandomSampler sampler.
2025-01-12 23:19:04,627 - INFO - Using sample_independent for sampling with RandomSampler sampler.
2025-01-12 23:19:04,628 - INFO - Using sample_independent for sampling with RandomSampler sampler.
2025-01-12 23:19:04,637 - INFO - Using sample_independent for sampling with RandomSampler sampler.
2025-01-12 23:19:04,643 - INFO - Using sample_independent for sampling with RandomSampler sampler.
2025-01-12 23:19:04,645 - INFO - Using sample_independent for sampling with RandomSampler sampler.
2025-01-12 23:19:04,648 - INFO - Using sample_independent for sampling with RandomSampler sampler.
[I 2025-01-12 23:19:04,657] A new study created in RDB with name: 2025-01-12_23-19-00_warcraft_map1_train_seed7
[I 2025-01-12 23:19:04,673] A new study created in RDB with name: 2025-01-12_23-19-00_warcraft_map1_train_seed2
2025-01-12 23:19:04,713 - INFO - Using sample_independent for sampling with RandomSampler sampler.
2025-01-12 23:19:04,729 - INFO - Using sample_independent for sampling with RandomSampler sampler.
2025-01-12 23:19:04,735 - INFO - Using sample_independent for sampling with RandomSampler sampler.
2025-01-12 23:19:04,749 - INFO - Using sample_independent for sampling with RandomSampler sampler.
2025-01-12 23:19:04,762 - INFO - Using sample_independent for sampling with RandomSampler sampler.
2025-01-12 23:19:04,787 - INFO - Using sample_independent for sampling with RandomSampler sampler.
2025-01-12 23:19:04,871 - INFO - Using sample_independent for sampling with RandomSampler sampler.
2025-01-12 23:19:04,875 - INFO - Using sample_independent for sampling with RandomSampler sampler.
[I 2025-01-12 23:19:04,945] A new study created in RDB with name: 2025-01-12_23-19-00_warcraft_map1_train_seed3
2025-01-12 23:19:05,004 - INFO - Using sample_independent for sampling with RandomSampler sampler.
2025-01-12 23:19:05,009 - INFO - Using sample_independent for sampling with RandomSampler sampler.
2025-01-12 23:19:05,012 - INFO - Using sample_independent for sampling with RandomSampler sampler.
2025-01-12 23:19:05,014 - INFO - Using sample_independent for sampling with RandomSampler sampler.
[I 2025-01-12 23:19:05,024] Trial 0 finished with value: 1.5892857142857144 and parameters: {'x_0_0': 'ab', 'x_0_1': 'cd', 'x_1_0': 'cd', 'x_1_1': 'oo'}. Best is trial 0 with value: 1.5892857142857144.
/Users/keisukeonoue/ws/constrained_BO_v3/src/samplers/tf_continual.py:294: RuntimeWarning: Mean of empty slice
  mean_ = np.nanmean(finite_values)
/Users/keisukeonoue/ws/constrained_BO_v3/bo-env_v3/lib/python3.12/site-packages/numpy/lib/_nanfunctions_impl.py:2053: RuntimeWarning: Degrees of freedom <= 0 for slice.
  var = nanvar(a, axis=axis, dtype=dtype, out=out, ddof=ddof,
[I 2025-01-12 23:19:05,044] Trial 0 finished with value: 1.7142857142857144 and parameters: {'x_0_0': 'ab', 'x_0_1': 'bd', 'x_1_0': 'ac', 'x_1_1': 'bd'}. Best is trial 0 with value: 1.7142857142857144.
[I 2025-01-12 23:19:05,072] A new study created in RDB with name: 2025-01-12_23-19-00_warcraft_map1_train_seed5
/Users/keisukeonoue/ws/constrained_BO_v3/src/samplers/tf_continual.py:294: RuntimeWarning: Mean of empty slice
  mean_ = np.nanmean(finite_values)
/Users/keisukeonoue/ws/constrained_BO_v3/bo-env_v3/lib/python3.12/site-packages/numpy/lib/_nanfunctions_impl.py:2053: RuntimeWarning: Degrees of freedom <= 0 for slice.
  var = nanvar(a, axis=axis, dtype=dtype, out=out, ddof=ddof,
[I 2025-01-12 23:19:05,094] Trial 0 finished with value: 1.4464285714285714 and parameters: {'x_0_0': 'bc', 'x_0_1': 'bc', 'x_1_0': 'bc', 'x_1_1': 'oo'}. Best is trial 0 with value: 1.4464285714285714.
[I 2025-01-12 23:19:05,105] Trial 0 finished with value: 1.0 and parameters: {'x_0_0': 'ac', 'x_0_1': 'ad', 'x_1_0': 'ac', 'x_1_1': 'bc'}. Best is trial 0 with value: 1.0.
2025-01-12 23:19:05,106 - INFO - Using sample_independent for sampling with RandomSampler sampler.
/Users/keisukeonoue/ws/constrained_BO_v3/src/samplers/tf_continual.py:294: RuntimeWarning: Mean of empty slice
  mean_ = np.nanmean(finite_values)
2025-01-12 23:19:05,112 - INFO - Using sample_independent for sampling with RandomSampler sampler.
/Users/keisukeonoue/ws/constrained_BO_v3/bo-env_v3/lib/python3.12/site-packages/numpy/lib/_nanfunctions_impl.py:2053: RuntimeWarning: Degrees of freedom <= 0 for slice.
  var = nanvar(a, axis=axis, dtype=dtype, out=out, ddof=ddof,
2025-01-12 23:19:05,114 - INFO - Using sample_independent for sampling with RandomSampler sampler.
2025-01-12 23:19:05,117 - INFO - Using sample_independent for sampling with RandomSampler sampler.
/Users/keisukeonoue/ws/constrained_BO_v3/src/samplers/tf_continual.py:294: RuntimeWarning: Mean of empty slice
  mean_ = np.nanmean(finite_values)
/Users/keisukeonoue/ws/constrained_BO_v3/bo-env_v3/lib/python3.12/site-packages/numpy/lib/_nanfunctions_impl.py:2053: RuntimeWarning: Degrees of freedom <= 0 for slice.
  var = nanvar(a, axis=axis, dtype=dtype, out=out, ddof=ddof,
[I 2025-01-12 23:19:05,232] A new study created in RDB with name: 2025-01-12_23-19-00_warcraft_map1_train_seed6
[I 2025-01-12 23:19:05,311] A new study created in RDB with name: 2025-01-12_23-19-00_warcraft_map1_train_seed4
[I 2025-01-12 23:19:05,321] A new study created in RDB with name: 2025-01-12_23-19-00_warcraft_map1_train_seed8
[I 2025-01-12 23:19:05,328] Trial 0 finished with value: 1.3214285714285714 and parameters: {'x_0_0': 'bd', 'x_0_1': 'bd', 'x_1_0': 'oo', 'x_1_1': 'bc'}. Best is trial 0 with value: 1.3214285714285714.
2025-01-12 23:19:05,349 - INFO - Using sample_independent for sampling with RandomSampler sampler.
2025-01-12 23:19:05,349 - INFO - Using sample_independent for sampling with RandomSampler sampler.
2025-01-12 23:19:05,353 - INFO - Using sample_independent for sampling with RandomSampler sampler.
2025-01-12 23:19:05,359 - INFO - Using sample_independent for sampling with RandomSampler sampler.
2025-01-12 23:19:05,361 - INFO - Using sample_independent for sampling with RandomSampler sampler.
2025-01-12 23:19:05,362 - INFO - Using sample_independent for sampling with RandomSampler sampler.
2025-01-12 23:19:05,368 - INFO - Using sample_independent for sampling with RandomSampler sampler.
2025-01-12 23:19:05,369 - INFO - Using sample_independent for sampling with RandomSampler sampler.
2025-01-12 23:19:05,377 - INFO - Using sample_independent for sampling with RandomSampler sampler.
[I 2025-01-12 23:19:05,538] Trial 0 finished with value: 1.3214285714285714 and parameters: {'x_0_0': 'ad', 'x_0_1': 'bc', 'x_1_0': 'oo', 'x_1_1': 'cd'}. Best is trial 0 with value: 1.3214285714285714.
/Users/keisukeonoue/ws/constrained_BO_v3/src/samplers/tf_continual.py:294: RuntimeWarning: Mean of empty slice
  mean_ = np.nanmean(finite_values)
/Users/keisukeonoue/ws/constrained_BO_v3/bo-env_v3/lib/python3.12/site-packages/numpy/lib/_nanfunctions_impl.py:2053: RuntimeWarning: Degrees of freedom <= 0 for slice.
  var = nanvar(a, axis=axis, dtype=dtype, out=out, ddof=ddof,
2025-01-12 23:19:05,609 - INFO - Using sample_independent for sampling with RandomSampler sampler.
2025-01-12 23:19:05,612 - INFO - Using sample_independent for sampling with RandomSampler sampler.
2025-01-12 23:19:05,613 - INFO - Using sample_independent for sampling with RandomSampler sampler.
[I 2025-01-12 23:19:05,624] Trial 0 finished with value: 1.875 and parameters: {'x_0_0': 'oo', 'x_0_1': 'bc', 'x_1_0': 'ab', 'x_1_1': 'cd'}. Best is trial 0 with value: 1.875.
/Users/keisukeonoue/ws/constrained_BO_v3/src/samplers/tf_continual.py:294: RuntimeWarning: Mean of empty slice
  mean_ = np.nanmean(finite_values)
/Users/keisukeonoue/ws/constrained_BO_v3/bo-env_v3/lib/python3.12/site-packages/numpy/lib/_nanfunctions_impl.py:2053: RuntimeWarning: Degrees of freedom <= 0 for slice.
  var = nanvar(a, axis=axis, dtype=dtype, out=out, ddof=ddof,
