[I 2025-01-12 23:20:12,649] Trial 405 finished with value: 2.0 and parameters: {'x_0_0': 'cd', 'x_0_1': 'cd', 'x_1_0': 'cd', 'x_1_1': 'cd'}. Best is trial 68 with value: 0.5.
[I 2025-01-12 23:20:12,661] Trial 414 finished with value: 2.0 and parameters: {'x_0_0': 'cd', 'x_0_1': 'cd', 'x_1_0': 'cd', 'x_1_1': 'cd'}. Best is trial 78 with value: 0.5.
[I 2025-01-12 23:20:12,692] Trial 410 finished with value: 2.0 and parameters: {'x_0_0': 'cd', 'x_0_1': 'cd', 'x_1_0': 'cd', 'x_1_1': 'cd'}. Best is trial 76 with value: 0.5.
[I 2025-01-12 23:20:12,693] Trial 410 finished with value: 2.0 and parameters: {'x_0_0': 'cd', 'x_0_1': 'cd', 'x_1_0': 'cd', 'x_1_1': 'cd'}. Best is trial 17 with value: 0.5.
[I 2025-01-12 23:20:12,703] Trial 388 finished with value: 2.0 and parameters: {'x_0_0': 'cd', 'x_0_1': 'cd', 'x_1_0': 'cd', 'x_1_1': 'cd'}. Best is trial 62 with value: 0.5.
[I 2025-01-12 23:20:12,714] Trial 417 finished with value: 2.0 and parameters: {'x_0_0': 'cd', 'x_0_1': 'cd', 'x_1_0': 'cd', 'x_1_1': 'cd'}. Best is trial 120 with value: 0.5.
[I 2025-01-12 23:20:12,755] Trial 388 finished with value: 2.0 and parameters: {'x_0_0': 'cd', 'x_0_1': 'cd', 'x_1_0': 'cd', 'x_1_1': 'cd'}. Best is trial 50 with value: 0.5.
[I 2025-01-12 23:20:12,772] Trial 416 finished with value: 2.0 and parameters: {'x_0_0': 'cd', 'x_0_1': 'cd', 'x_1_0': 'cd', 'x_1_1': 'cd'}. Best is trial 11 with value: 0.5.
[I 2025-01-12 23:20:12,778] Trial 416 finished with value: 2.0 and parameters: {'x_0_0': 'cd', 'x_0_1': 'cd', 'x_1_0': 'cd', 'x_1_1': 'cd'}. Best is trial 86 with value: 0.5.
[I 2025-01-12 23:20:12,795] Trial 396 finished with value: 2.0 and parameters: {'x_0_0': 'cd', 'x_0_1': 'cd', 'x_1_0': 'cd', 'x_1_1': 'cd'}. Best is trial 35 with value: 0.5.
[I 2025-01-12 23:20:12,803] Trial 406 finished with value: 2.0 and parameters: {'x_0_0': 'cd', 'x_0_1': 'cd', 'x_1_0': 'cd', 'x_1_1': 'cd'}. Best is trial 68 with value: 0.5.
[I 2025-01-12 23:20:12,809] Trial 415 finished with value: 2.0 and parameters: {'x_0_0': 'cd', 'x_0_1': 'cd', 'x_1_0': 'cd', 'x_1_1': 'cd'}. Best is trial 78 with value: 0.5.
[I 2025-01-12 23:20:12,844] Trial 411 finished with value: 2.0 and parameters: {'x_0_0': 'cd', 'x_0_1': 'cd', 'x_1_0': 'cd', 'x_1_1': 'cd'}. Best is trial 76 with value: 0.5.
[I 2025-01-12 23:20:12,845] Trial 411 finished with value: 2.0 and parameters: {'x_0_0': 'cd', 'x_0_1': 'cd', 'x_1_0': 'cd', 'x_1_1': 'cd'}. Best is trial 17 with value: 0.5.
[I 2025-01-12 23:20:12,853] Trial 389 finished with value: 2.0 and parameters: {'x_0_0': 'cd', 'x_0_1': 'cd', 'x_1_0': 'cd', 'x_1_1': 'cd'}. Best is trial 62 with value: 0.5.
[I 2025-01-12 23:20:12,865] Trial 418 finished with value: 2.0 and parameters: {'x_0_0': 'cd', 'x_0_1': 'cd', 'x_1_0': 'cd', 'x_1_1': 'cd'}. Best is trial 120 with value: 0.5.
[I 2025-01-12 23:20:12,907] Trial 389 finished with value: 2.0 and parameters: {'x_0_0': 'cd', 'x_0_1': 'cd', 'x_1_0': 'cd', 'x_1_1': 'cd'}. Best is trial 50 with value: 0.5.
[I 2025-01-12 23:20:12,908] Trial 417 finished with value: 2.0 and parameters: {'x_0_0': 'cd', 'x_0_1': 'cd', 'x_1_0': 'cd', 'x_1_1': 'cd'}. Best is trial 11 with value: 0.5.
[I 2025-01-12 23:20:12,927] Trial 417 finished with value: 2.0 and parameters: {'x_0_0': 'cd', 'x_0_1': 'cd', 'x_1_0': 'cd', 'x_1_1': 'cd'}. Best is trial 86 with value: 0.5.
[I 2025-01-12 23:20:12,944] Trial 416 finished with value: 2.0 and parameters: {'x_0_0': 'cd', 'x_0_1': 'cd', 'x_1_0': 'cd', 'x_1_1': 'cd'}. Best is trial 78 with value: 0.5.
[I 2025-01-12 23:20:12,951] Trial 397 finished with value: 2.0 and parameters: {'x_0_0': 'cd', 'x_0_1': 'cd', 'x_1_0': 'cd', 'x_1_1': 'cd'}. Best is trial 35 with value: 0.5.
[I 2025-01-12 23:20:12,952] Trial 407 finished with value: 2.0 and parameters: {'x_0_0': 'cd', 'x_0_1': 'cd', 'x_1_0': 'cd', 'x_1_1': 'cd'}. Best is trial 68 with value: 0.5.
[I 2025-01-12 23:20:12,990] Trial 412 finished with value: 2.0 and parameters: {'x_0_0': 'cd', 'x_0_1': 'cd', 'x_1_0': 'cd', 'x_1_1': 'cd'}. Best is trial 76 with value: 0.5.
[I 2025-01-12 23:20:12,992] Trial 412 finished with value: 2.0 and parameters: {'x_0_0': 'cd', 'x_0_1': 'cd', 'x_1_0': 'cd', 'x_1_1': 'cd'}. Best is trial 17 with value: 0.5.
[I 2025-01-12 23:20:13,015] Trial 419 finished with value: 2.0 and parameters: {'x_0_0': 'cd', 'x_0_1': 'cd', 'x_1_0': 'cd', 'x_1_1': 'cd'}. Best is trial 120 with value: 0.5.
[I 2025-01-12 23:20:13,022] Trial 390 finished with value: 2.0 and parameters: {'x_0_0': 'cd', 'x_0_1': 'cd', 'x_1_0': 'cd', 'x_1_1': 'cd'}. Best is trial 62 with value: 0.5.
[I 2025-01-12 23:20:13,049] Trial 418 finished with value: 2.0 and parameters: {'x_0_0': 'cd', 'x_0_1': 'cd', 'x_1_0': 'cd', 'x_1_1': 'cd'}. Best is trial 11 with value: 0.5.
[I 2025-01-12 23:20:13,052] Trial 390 finished with value: 2.0 and parameters: {'x_0_0': 'cd', 'x_0_1': 'cd', 'x_1_0': 'cd', 'x_1_1': 'cd'}. Best is trial 50 with value: 0.5.
[I 2025-01-12 23:20:13,058] Trial 418 finished with value: 2.0 and parameters: {'x_0_0': 'cd', 'x_0_1': 'cd', 'x_1_0': 'cd', 'x_1_1': 'cd'}. Best is trial 86 with value: 0.5.
[I 2025-01-12 23:20:13,087] Trial 408 finished with value: 2.0 and parameters: {'x_0_0': 'cd', 'x_0_1': 'cd', 'x_1_0': 'cd', 'x_1_1': 'cd'}. Best is trial 68 with value: 0.5.
[I 2025-01-12 23:20:13,094] Trial 417 finished with value: 2.0 and parameters: {'x_0_0': 'cd', 'x_0_1': 'cd', 'x_1_0': 'cd', 'x_1_1': 'cd'}. Best is trial 78 with value: 0.5.
[I 2025-01-12 23:20:13,108] Trial 398 finished with value: 2.0 and parameters: {'x_0_0': 'cd', 'x_0_1': 'cd', 'x_1_0': 'cd', 'x_1_1': 'cd'}. Best is trial 35 with value: 0.5.
[I 2025-01-12 23:20:13,136] Trial 413 finished with value: 2.0 and parameters: {'x_0_0': 'cd', 'x_0_1': 'cd', 'x_1_0': 'cd', 'x_1_1': 'cd'}. Best is trial 17 with value: 0.5.
[I 2025-01-12 23:20:13,141] Trial 413 finished with value: 2.0 and parameters: {'x_0_0': 'cd', 'x_0_1': 'cd', 'x_1_0': 'cd', 'x_1_1': 'cd'}. Best is trial 76 with value: 0.5.
[I 2025-01-12 23:20:13,145] Trial 420 finished with value: 2.0 and parameters: {'x_0_0': 'cd', 'x_0_1': 'cd', 'x_1_0': 'cd', 'x_1_1': 'cd'}. Best is trial 120 with value: 0.5.
[I 2025-01-12 23:20:13,147] Trial 391 finished with value: 2.0 and parameters: {'x_0_0': 'cd', 'x_0_1': 'cd', 'x_1_0': 'cd', 'x_1_1': 'cd'}. Best is trial 62 with value: 0.5.
[I 2025-01-12 23:20:13,209] Trial 419 finished with value: 2.0 and parameters: {'x_0_0': 'cd', 'x_0_1': 'cd', 'x_1_0': 'cd', 'x_1_1': 'cd'}. Best is trial 11 with value: 0.5.
[I 2025-01-12 23:20:13,209] Trial 391 finished with value: 2.0 and parameters: {'x_0_0': 'cd', 'x_0_1': 'cd', 'x_1_0': 'cd', 'x_1_1': 'cd'}. Best is trial 50 with value: 0.5.
[I 2025-01-12 23:20:13,215] Trial 419 finished with value: 2.0 and parameters: {'x_0_0': 'cd', 'x_0_1': 'cd', 'x_1_0': 'cd', 'x_1_1': 'cd'}. Best is trial 86 with value: 0.5.
[I 2025-01-12 23:20:13,219] Trial 409 finished with value: 2.0 and parameters: {'x_0_0': 'cd', 'x_0_1': 'cd', 'x_1_0': 'cd', 'x_1_1': 'cd'}. Best is trial 68 with value: 0.5.
[I 2025-01-12 23:20:13,242] Trial 418 finished with value: 2.0 and parameters: {'x_0_0': 'cd', 'x_0_1': 'cd', 'x_1_0': 'cd', 'x_1_1': 'cd'}. Best is trial 78 with value: 0.5.
[I 2025-01-12 23:20:13,253] Trial 399 finished with value: 2.0 and parameters: {'x_0_0': 'cd', 'x_0_1': 'cd', 'x_1_0': 'cd', 'x_1_1': 'cd'}. Best is trial 35 with value: 0.5.
[I 2025-01-12 23:20:13,278] Trial 414 finished with value: 2.0 and parameters: {'x_0_0': 'cd', 'x_0_1': 'cd', 'x_1_0': 'cd', 'x_1_1': 'cd'}. Best is trial 76 with value: 0.5.
[I 2025-01-12 23:20:13,282] Trial 414 finished with value: 2.0 and parameters: {'x_0_0': 'cd', 'x_0_1': 'cd', 'x_1_0': 'cd', 'x_1_1': 'cd'}. Best is trial 17 with value: 0.5.
[I 2025-01-12 23:20:13,303] Trial 392 finished with value: 2.0 and parameters: {'x_0_0': 'cd', 'x_0_1': 'cd', 'x_1_0': 'cd', 'x_1_1': 'cd'}. Best is trial 62 with value: 0.5.
[I 2025-01-12 23:20:13,309] Trial 421 finished with value: 2.0 and parameters: {'x_0_0': 'cd', 'x_0_1': 'cd', 'x_1_0': 'cd', 'x_1_1': 'cd'}. Best is trial 120 with value: 0.5.
[I 2025-01-12 23:20:13,349] Trial 392 finished with value: 2.0 and parameters: {'x_0_0': 'cd', 'x_0_1': 'cd', 'x_1_0': 'cd', 'x_1_1': 'cd'}. Best is trial 50 with value: 0.5.
[I 2025-01-12 23:20:13,360] Trial 420 finished with value: 2.0 and parameters: {'x_0_0': 'cd', 'x_0_1': 'cd', 'x_1_0': 'cd', 'x_1_1': 'cd'}. Best is trial 11 with value: 0.5.
[I 2025-01-12 23:20:13,363] Trial 420 finished with value: 2.0 and parameters: {'x_0_0': 'cd', 'x_0_1': 'cd', 'x_1_0': 'cd', 'x_1_1': 'cd'}. Best is trial 86 with value: 0.5.
[I 2025-01-12 23:20:13,364] Trial 410 finished with value: 2.0 and parameters: {'x_0_0': 'cd', 'x_0_1': 'cd', 'x_1_0': 'cd', 'x_1_1': 'cd'}. Best is trial 68 with value: 0.5.
[I 2025-01-12 23:20:13,392] Trial 419 finished with value: 2.0 and parameters: {'x_0_0': 'cd', 'x_0_1': 'cd', 'x_1_0': 'cd', 'x_1_1': 'cd'}. Best is trial 78 with value: 0.5.
[I 2025-01-12 23:20:13,401] Trial 400 finished with value: 2.0 and parameters: {'x_0_0': 'cd', 'x_0_1': 'cd', 'x_1_0': 'cd', 'x_1_1': 'cd'}. Best is trial 35 with value: 0.5.
[I 2025-01-12 23:20:13,406] Trial 415 finished with value: 2.0 and parameters: {'x_0_0': 'cd', 'x_0_1': 'cd', 'x_1_0': 'cd', 'x_1_1': 'cd'}. Best is trial 17 with value: 0.5.
[I 2025-01-12 23:20:13,426] Trial 415 finished with value: 2.0 and parameters: {'x_0_0': 'cd', 'x_0_1': 'cd', 'x_1_0': 'cd', 'x_1_1': 'cd'}. Best is trial 76 with value: 0.5.
[I 2025-01-12 23:20:13,448] Trial 393 finished with value: 2.0 and parameters: {'x_0_0': 'cd', 'x_0_1': 'cd', 'x_1_0': 'cd', 'x_1_1': 'cd'}. Best is trial 62 with value: 0.5.
[I 2025-01-12 23:20:13,450] Trial 422 finished with value: 2.0 and parameters: {'x_0_0': 'cd', 'x_0_1': 'cd', 'x_1_0': 'cd', 'x_1_1': 'cd'}. Best is trial 120 with value: 0.5.
[I 2025-01-12 23:20:13,500] Trial 421 finished with value: 2.0 and parameters: {'x_0_0': 'cd', 'x_0_1': 'cd', 'x_1_0': 'cd', 'x_1_1': 'cd'}. Best is trial 86 with value: 0.5.
[I 2025-01-12 23:20:13,502] Trial 393 finished with value: 2.0 and parameters: {'x_0_0': 'cd', 'x_0_1': 'cd', 'x_1_0': 'cd', 'x_1_1': 'cd'}. Best is trial 50 with value: 0.5.
[I 2025-01-12 23:20:13,512] Trial 421 finished with value: 2.0 and parameters: {'x_0_0': 'cd', 'x_0_1': 'cd', 'x_1_0': 'cd', 'x_1_1': 'cd'}. Best is trial 11 with value: 0.5.
[I 2025-01-12 23:20:13,515] Trial 411 finished with value: 2.0 and parameters: {'x_0_0': 'cd', 'x_0_1': 'cd', 'x_1_0': 'cd', 'x_1_1': 'cd'}. Best is trial 68 with value: 0.5.
[I 2025-01-12 23:20:13,530] Trial 420 finished with value: 2.0 and parameters: {'x_0_0': 'cd', 'x_0_1': 'cd', 'x_1_0': 'cd', 'x_1_1': 'cd'}. Best is trial 78 with value: 0.5.
[I 2025-01-12 23:20:13,546] Trial 416 finished with value: 2.0 and parameters: {'x_0_0': 'cd', 'x_0_1': 'cd', 'x_1_0': 'cd', 'x_1_1': 'cd'}. Best is trial 17 with value: 0.5.
[I 2025-01-12 23:20:13,560] Trial 401 finished with value: 2.0 and parameters: {'x_0_0': 'cd', 'x_0_1': 'cd', 'x_1_0': 'cd', 'x_1_1': 'cd'}. Best is trial 35 with value: 0.5.
[I 2025-01-12 23:20:13,561] Trial 416 finished with value: 2.0 and parameters: {'x_0_0': 'cd', 'x_0_1': 'cd', 'x_1_0': 'cd', 'x_1_1': 'cd'}. Best is trial 76 with value: 0.5.
[I 2025-01-12 23:20:13,592] Trial 423 finished with value: 2.0 and parameters: {'x_0_0': 'cd', 'x_0_1': 'cd', 'x_1_0': 'cd', 'x_1_1': 'cd'}. Best is trial 120 with value: 0.5.
[I 2025-01-12 23:20:13,611] Trial 394 finished with value: 2.0 and parameters: {'x_0_0': 'cd', 'x_0_1': 'cd', 'x_1_0': 'cd', 'x_1_1': 'cd'}. Best is trial 62 with value: 0.5.
[I 2025-01-12 23:20:13,640] Trial 422 finished with value: 2.0 and parameters: {'x_0_0': 'cd', 'x_0_1': 'cd', 'x_1_0': 'cd', 'x_1_1': 'cd'}. Best is trial 86 with value: 0.5.
[I 2025-01-12 23:20:13,648] Trial 412 finished with value: 2.0 and parameters: {'x_0_0': 'cd', 'x_0_1': 'cd', 'x_1_0': 'cd', 'x_1_1': 'cd'}. Best is trial 68 with value: 0.5.
[I 2025-01-12 23:20:13,651] Trial 422 finished with value: 2.0 and parameters: {'x_0_0': 'cd', 'x_0_1': 'cd', 'x_1_0': 'cd', 'x_1_1': 'cd'}. Best is trial 11 with value: 0.5.
[I 2025-01-12 23:20:13,656] Trial 394 finished with value: 2.0 and parameters: {'x_0_0': 'cd', 'x_0_1': 'cd', 'x_1_0': 'cd', 'x_1_1': 'cd'}. Best is trial 50 with value: 0.5.
[I 2025-01-12 23:20:13,683] Trial 421 finished with value: 2.0 and parameters: {'x_0_0': 'cd', 'x_0_1': 'cd', 'x_1_0': 'cd', 'x_1_1': 'cd'}. Best is trial 78 with value: 0.5.
[I 2025-01-12 23:20:13,703] Trial 417 finished with value: 2.0 and parameters: {'x_0_0': 'cd', 'x_0_1': 'cd', 'x_1_0': 'cd', 'x_1_1': 'cd'}. Best is trial 76 with value: 0.5.
[I 2025-01-12 23:20:13,703] Trial 417 finished with value: 2.0 and parameters: {'x_0_0': 'cd', 'x_0_1': 'cd', 'x_1_0': 'cd', 'x_1_1': 'cd'}. Best is trial 17 with value: 0.5.
[I 2025-01-12 23:20:13,706] Trial 402 finished with value: 2.0 and parameters: {'x_0_0': 'cd', 'x_0_1': 'cd', 'x_1_0': 'cd', 'x_1_1': 'cd'}. Best is trial 35 with value: 0.5.
[I 2025-01-12 23:20:13,747] Trial 424 finished with value: 2.0 and parameters: {'x_0_0': 'cd', 'x_0_1': 'cd', 'x_1_0': 'cd', 'x_1_1': 'cd'}. Best is trial 120 with value: 0.5.
[I 2025-01-12 23:20:13,760] Trial 395 finished with value: 2.0 and parameters: {'x_0_0': 'cd', 'x_0_1': 'cd', 'x_1_0': 'cd', 'x_1_1': 'cd'}. Best is trial 62 with value: 0.5.
[I 2025-01-12 23:20:13,781] Trial 395 finished with value: 2.0 and parameters: {'x_0_0': 'cd', 'x_0_1': 'cd', 'x_1_0': 'cd', 'x_1_1': 'cd'}. Best is trial 50 with value: 0.5.
[I 2025-01-12 23:20:13,793] Trial 423 finished with value: 2.0 and parameters: {'x_0_0': 'cd', 'x_0_1': 'cd', 'x_1_0': 'cd', 'x_1_1': 'cd'}. Best is trial 11 with value: 0.5.
[I 2025-01-12 23:20:13,802] Trial 423 finished with value: 2.0 and parameters: {'x_0_0': 'cd', 'x_0_1': 'cd', 'x_1_0': 'cd', 'x_1_1': 'cd'}. Best is trial 86 with value: 0.5.
[I 2025-01-12 23:20:13,806] Trial 422 finished with value: 2.0 and parameters: {'x_0_0': 'cd', 'x_0_1': 'cd', 'x_1_0': 'cd', 'x_1_1': 'cd'}. Best is trial 78 with value: 0.5.
[I 2025-01-12 23:20:13,821] Trial 418 finished with value: 2.0 and parameters: {'x_0_0': 'cd', 'x_0_1': 'cd', 'x_1_0': 'cd', 'x_1_1': 'cd'}. Best is trial 17 with value: 0.5.
[I 2025-01-12 23:20:13,844] Trial 403 finished with value: 2.0 and parameters: {'x_0_0': 'cd', 'x_0_1': 'cd', 'x_1_0': 'cd', 'x_1_1': 'cd'}. Best is trial 35 with value: 0.5.
[I 2025-01-12 23:20:13,848] Trial 418 finished with value: 2.0 and parameters: {'x_0_0': 'cd', 'x_0_1': 'cd', 'x_1_0': 'cd', 'x_1_1': 'cd'}. Best is trial 76 with value: 0.5.
[I 2025-01-12 23:20:13,867] Trial 425 finished with value: 2.0 and parameters: {'x_0_0': 'cd', 'x_0_1': 'cd', 'x_1_0': 'cd', 'x_1_1': 'cd'}. Best is trial 120 with value: 0.5.
[I 2025-01-12 23:20:13,905] Trial 413 finished with value: 2.0 and parameters: {'x_0_0': 'cd', 'x_0_1': 'cd', 'x_1_0': 'cd', 'x_1_1': 'cd'}. Best is trial 68 with value: 0.5.
[I 2025-01-12 23:20:13,922] Trial 396 finished with value: 2.0 and parameters: {'x_0_0': 'cd', 'x_0_1': 'cd', 'x_1_0': 'cd', 'x_1_1': 'cd'}. Best is trial 50 with value: 0.5.
[I 2025-01-12 23:20:13,932] Trial 396 finished with value: 2.0 and parameters: {'x_0_0': 'cd', 'x_0_1': 'cd', 'x_1_0': 'cd', 'x_1_1': 'cd'}. Best is trial 62 with value: 0.5.
[I 2025-01-12 23:20:13,935] Trial 424 finished with value: 2.0 and parameters: {'x_0_0': 'cd', 'x_0_1': 'cd', 'x_1_0': 'cd', 'x_1_1': 'cd'}. Best is trial 86 with value: 0.5.
[I 2025-01-12 23:20:13,940] Trial 423 finished with value: 2.0 and parameters: {'x_0_0': 'cd', 'x_0_1': 'cd', 'x_1_0': 'cd', 'x_1_1': 'cd'}. Best is trial 78 with value: 0.5.
[I 2025-01-12 23:20:13,943] Trial 424 finished with value: 2.0 and parameters: {'x_0_0': 'cd', 'x_0_1': 'cd', 'x_1_0': 'cd', 'x_1_1': 'cd'}. Best is trial 11 with value: 0.5.
[I 2025-01-12 23:20:13,973] Trial 419 finished with value: 2.0 and parameters: {'x_0_0': 'cd', 'x_0_1': 'cd', 'x_1_0': 'cd', 'x_1_1': 'cd'}. Best is trial 17 with value: 0.5.
[I 2025-01-12 23:20:13,995] Trial 419 finished with value: 2.0 and parameters: {'x_0_0': 'cd', 'x_0_1': 'cd', 'x_1_0': 'cd', 'x_1_1': 'cd'}. Best is trial 76 with value: 0.5.
[I 2025-01-12 23:20:14,001] Trial 404 finished with value: 2.0 and parameters: {'x_0_0': 'cd', 'x_0_1': 'cd', 'x_1_0': 'cd', 'x_1_1': 'cd'}. Best is trial 35 with value: 0.5.
[I 2025-01-12 23:20:14,010] Trial 426 finished with value: 2.0 and parameters: {'x_0_0': 'cd', 'x_0_1': 'cd', 'x_1_0': 'cd', 'x_1_1': 'cd'}. Best is trial 120 with value: 0.5.
[I 2025-01-12 23:20:14,049] Trial 414 finished with value: 2.0 and parameters: {'x_0_0': 'cd', 'x_0_1': 'cd', 'x_1_0': 'cd', 'x_1_1': 'cd'}. Best is trial 68 with value: 0.5.
[I 2025-01-12 23:20:14,070] Trial 425 finished with value: 2.0 and parameters: {'x_0_0': 'cd', 'x_0_1': 'cd', 'x_1_0': 'cd', 'x_1_1': 'cd'}. Best is trial 86 with value: 0.5.
[I 2025-01-12 23:20:14,071] Trial 397 finished with value: 2.0 and parameters: {'x_0_0': 'cd', 'x_0_1': 'cd', 'x_1_0': 'cd', 'x_1_1': 'cd'}. Best is trial 50 with value: 0.5.
[I 2025-01-12 23:20:14,077] Trial 424 finished with value: 2.0 and parameters: {'x_0_0': 'cd', 'x_0_1': 'cd', 'x_1_0': 'cd', 'x_1_1': 'cd'}. Best is trial 78 with value: 0.5.
[I 2025-01-12 23:20:14,079] Trial 397 finished with value: 2.0 and parameters: {'x_0_0': 'cd', 'x_0_1': 'cd', 'x_1_0': 'cd', 'x_1_1': 'cd'}. Best is trial 62 with value: 0.5.
[I 2025-01-12 23:20:14,081] Trial 425 finished with value: 2.0 and parameters: {'x_0_0': 'cd', 'x_0_1': 'cd', 'x_1_0': 'cd', 'x_1_1': 'cd'}. Best is trial 11 with value: 0.5.
[I 2025-01-12 23:20:14,120] Trial 420 finished with value: 2.0 and parameters: {'x_0_0': 'cd', 'x_0_1': 'cd', 'x_1_0': 'cd', 'x_1_1': 'cd'}. Best is trial 17 with value: 0.5.
[I 2025-01-12 23:20:14,138] Trial 405 finished with value: 2.0 and parameters: {'x_0_0': 'cd', 'x_0_1': 'cd', 'x_1_0': 'cd', 'x_1_1': 'cd'}. Best is trial 35 with value: 0.5.
[I 2025-01-12 23:20:14,140] Trial 420 finished with value: 2.0 and parameters: {'x_0_0': 'cd', 'x_0_1': 'cd', 'x_1_0': 'cd', 'x_1_1': 'cd'}. Best is trial 76 with value: 0.5.
[I 2025-01-12 23:20:14,157] Trial 427 finished with value: 2.0 and parameters: {'x_0_0': 'cd', 'x_0_1': 'cd', 'x_1_0': 'cd', 'x_1_1': 'cd'}. Best is trial 120 with value: 0.5.
[I 2025-01-12 23:20:14,190] Trial 415 finished with value: 2.0 and parameters: {'x_0_0': 'cd', 'x_0_1': 'cd', 'x_1_0': 'cd', 'x_1_1': 'cd'}. Best is trial 68 with value: 0.5.
[I 2025-01-12 23:20:14,215] Trial 426 finished with value: 2.0 and parameters: {'x_0_0': 'cd', 'x_0_1': 'cd', 'x_1_0': 'cd', 'x_1_1': 'cd'}. Best is trial 86 with value: 0.5.
[I 2025-01-12 23:20:14,219] Trial 398 finished with value: 2.0 and parameters: {'x_0_0': 'cd', 'x_0_1': 'cd', 'x_1_0': 'cd', 'x_1_1': 'cd'}. Best is trial 62 with value: 0.5.
[I 2025-01-12 23:20:14,225] Trial 425 finished with value: 2.0 and parameters: {'x_0_0': 'cd', 'x_0_1': 'cd', 'x_1_0': 'cd', 'x_1_1': 'cd'}. Best is trial 78 with value: 0.5.
[I 2025-01-12 23:20:14,225] Trial 426 finished with value: 2.0 and parameters: {'x_0_0': 'cd', 'x_0_1': 'cd', 'x_1_0': 'cd', 'x_1_1': 'cd'}. Best is trial 11 with value: 0.5.
[I 2025-01-12 23:20:14,230] Trial 398 finished with value: 2.0 and parameters: {'x_0_0': 'cd', 'x_0_1': 'cd', 'x_1_0': 'cd', 'x_1_1': 'cd'}. Best is trial 50 with value: 0.5.
[I 2025-01-12 23:20:14,259] Trial 421 finished with value: 2.0 and parameters: {'x_0_0': 'cd', 'x_0_1': 'cd', 'x_1_0': 'cd', 'x_1_1': 'cd'}. Best is trial 17 with value: 0.5.
[I 2025-01-12 23:20:14,289] Trial 421 finished with value: 2.0 and parameters: {'x_0_0': 'cd', 'x_0_1': 'cd', 'x_1_0': 'cd', 'x_1_1': 'cd'}. Best is trial 76 with value: 0.5.
[I 2025-01-12 23:20:14,298] Trial 428 finished with value: 2.0 and parameters: {'x_0_0': 'cd', 'x_0_1': 'cd', 'x_1_0': 'cd', 'x_1_1': 'cd'}. Best is trial 120 with value: 0.5.
[I 2025-01-12 23:20:14,320] Trial 416 finished with value: 2.0 and parameters: {'x_0_0': 'cd', 'x_0_1': 'cd', 'x_1_0': 'cd', 'x_1_1': 'cd'}. Best is trial 68 with value: 0.5.
[I 2025-01-12 23:20:14,359] Trial 399 finished with value: 2.0 and parameters: {'x_0_0': 'cd', 'x_0_1': 'cd', 'x_1_0': 'cd', 'x_1_1': 'cd'}. Best is trial 50 with value: 0.5.
[I 2025-01-12 23:20:14,366] Trial 399 finished with value: 2.0 and parameters: {'x_0_0': 'cd', 'x_0_1': 'cd', 'x_1_0': 'cd', 'x_1_1': 'cd'}. Best is trial 62 with value: 0.5.
[I 2025-01-12 23:20:14,367] Trial 427 finished with value: 2.0 and parameters: {'x_0_0': 'cd', 'x_0_1': 'cd', 'x_1_0': 'cd', 'x_1_1': 'cd'}. Best is trial 11 with value: 0.5.
[I 2025-01-12 23:20:14,371] Trial 426 finished with value: 2.0 and parameters: {'x_0_0': 'cd', 'x_0_1': 'cd', 'x_1_0': 'cd', 'x_1_1': 'cd'}. Best is trial 78 with value: 0.5.
[I 2025-01-12 23:20:14,379] Trial 427 finished with value: 2.0 and parameters: {'x_0_0': 'cd', 'x_0_1': 'cd', 'x_1_0': 'cd', 'x_1_1': 'cd'}. Best is trial 86 with value: 0.5.
[I 2025-01-12 23:20:14,407] Trial 422 finished with value: 2.0 and parameters: {'x_0_0': 'cd', 'x_0_1': 'cd', 'x_1_0': 'cd', 'x_1_1': 'cd'}. Best is trial 17 with value: 0.5.
[I 2025-01-12 23:20:14,431] Trial 422 finished with value: 2.0 and parameters: {'x_0_0': 'cd', 'x_0_1': 'cd', 'x_1_0': 'cd', 'x_1_1': 'cd'}. Best is trial 76 with value: 0.5.
[I 2025-01-12 23:20:14,446] Trial 429 finished with value: 2.0 and parameters: {'x_0_0': 'cd', 'x_0_1': 'cd', 'x_1_0': 'cd', 'x_1_1': 'cd'}. Best is trial 120 with value: 0.5.
[I 2025-01-12 23:20:14,453] Trial 417 finished with value: 2.0 and parameters: {'x_0_0': 'cd', 'x_0_1': 'cd', 'x_1_0': 'cd', 'x_1_1': 'cd'}. Best is trial 68 with value: 0.5.
[I 2025-01-12 23:20:14,495] Trial 428 finished with value: 2.0 and parameters: {'x_0_0': 'cd', 'x_0_1': 'cd', 'x_1_0': 'cd', 'x_1_1': 'cd'}. Best is trial 11 with value: 0.5.
[I 2025-01-12 23:20:14,512] Trial 400 finished with value: 2.0 and parameters: {'x_0_0': 'cd', 'x_0_1': 'cd', 'x_1_0': 'cd', 'x_1_1': 'cd'}. Best is trial 50 with value: 0.5.
