[I 2024-12-06 23:36:21,292] Trial 52 finished with value: 1.0714285714285714 and parameters: {'x_0_0': 'ad', 'x_0_1': 'oo', 'x_1_0': 'ad', 'x_1_1': 'bd'}. Best is trial 33 with value: 0.6964285714285714.
2024-12-06 23:36:21,444 - INFO - Candidate Mean Stats: {'Max': np.float64(2.0), 'Min': np.float64(-0.8113039552153574), 'Mean': np.float64(0.27569355057992223), 'Std': np.float64(0.4044985848868166)}
2024-12-06 23:36:21,444 - INFO - Candidate Std Stats: {'Max': np.float64(1.6817824162057868), 'Min': np.float64(0.0), 'Mean': np.float64(0.5903892657516882), 'Std': np.float64(0.24947403293664727)}
[I 2024-12-06 23:36:21,460] Trial 52 finished with value: 1.0714285714285714 and parameters: {'x_0_0': 'bc', 'x_0_1': 'oo', 'x_1_0': 'ac', 'x_1_1': 'ab'}. Best is trial 23 with value: 0.5.
2024-12-06 23:36:21,599 - INFO - Candidate Mean Stats: {'Max': np.float64(2.0), 'Min': np.float64(-0.6326084612084287), 'Mean': np.float64(0.2532954176167159), 'Std': np.float64(0.39624726156819)}
2024-12-06 23:36:21,599 - INFO - Candidate Std Stats: {'Max': np.float64(1.857466211992044), 'Min': np.float64(0.0), 'Mean': np.float64(0.6105170505621363), 'Std': np.float64(0.25934243097096654)}
[I 2024-12-06 23:36:21,617] Trial 53 finished with value: 1.0714285714285714 and parameters: {'x_0_0': 'bc', 'x_0_1': 'oo', 'x_1_0': 'cd', 'x_1_1': 'ad'}. Best is trial 14 with value: 0.6428571428571428.
2024-12-06 23:36:21,617 - INFO - Candidate Mean Stats: {'Max': np.float64(2.0), 'Min': np.float64(-0.9077662270903254), 'Mean': np.float64(0.22622248602649875), 'Std': np.float64(0.443700628481821)}
2024-12-06 23:36:21,617 - INFO - Candidate Std Stats: {'Max': np.float64(1.5817497659684079), 'Min': np.float64(0.0), 'Mean': np.float64(0.5703207882642741), 'Std': np.float64(0.24517512426737345)}
[I 2024-12-06 23:36:21,633] Trial 53 finished with value: 0.6964285714285714 and parameters: {'x_0_0': 'bd', 'x_0_1': 'oo', 'x_1_0': 'oo', 'x_1_1': 'oo'}. Best is trial 50 with value: 0.6607142857142857.
2024-12-06 23:36:21,654 - INFO - Candidate Mean Stats: {'Max': np.float64(2.08408167841948), 'Min': np.float64(-1.104172638774611), 'Mean': np.float64(0.2253867681682115), 'Std': np.float64(0.48348003464776057)}
2024-12-06 23:36:21,654 - INFO - Candidate Std Stats: {'Max': np.float64(1.5099262286511135), 'Min': np.float64(0.0), 'Mean': np.float64(0.6343493609584423), 'Std': np.float64(0.26105429905819)}
[I 2024-12-06 23:36:21,667] Trial 53 finished with value: 0.8214285714285714 and parameters: {'x_0_0': 'bc', 'x_0_1': 'oo', 'x_1_0': 'oo', 'x_1_1': 'ad'}. Best is trial 33 with value: 0.6964285714285714.
2024-12-06 23:36:21,831 - INFO - Candidate Mean Stats: {'Max': np.float64(2.0), 'Min': np.float64(-1.1545069472368668), 'Mean': np.float64(0.2363851531503082), 'Std': np.float64(0.42514955199501187)}
2024-12-06 23:36:21,831 - INFO - Candidate Std Stats: {'Max': np.float64(1.7720406508923245), 'Min': np.float64(0.0), 'Mean': np.float64(0.6140025352625998), 'Std': np.float64(0.26039340115788606)}
[I 2024-12-06 23:36:21,846] Trial 53 finished with value: 0.8214285714285714 and parameters: {'x_0_0': 'bc', 'x_0_1': 'oo', 'x_1_0': 'oo', 'x_1_1': 'ad'}. Best is trial 23 with value: 0.5.
2024-12-06 23:36:21,974 - INFO - Candidate Mean Stats: {'Max': np.float64(2.0), 'Min': np.float64(-1.0081168944100376), 'Mean': np.float64(0.24202253293204243), 'Std': np.float64(0.4307045650111608)}
2024-12-06 23:36:21,974 - INFO - Candidate Std Stats: {'Max': np.float64(1.5598639910623282), 'Min': np.float64(0.0), 'Mean': np.float64(0.5918836853629614), 'Std': np.float64(0.24682292932892838)}
[I 2024-12-06 23:36:21,986] Trial 54 finished with value: 1.2857142857142856 and parameters: {'x_0_0': 'bd', 'x_0_1': 'ac', 'x_1_0': 'bc', 'x_1_1': 'cd'}. Best is trial 14 with value: 0.6428571428571428.
2024-12-06 23:36:21,987 - INFO - Candidate Mean Stats: {'Max': np.float64(2.0), 'Min': np.float64(-0.7513697695310324), 'Mean': np.float64(0.27008776691530234), 'Std': np.float64(0.38200577345689457)}
2024-12-06 23:36:21,987 - INFO - Candidate Std Stats: {'Max': np.float64(1.6928682835335294), 'Min': np.float64(0.0), 'Mean': np.float64(0.5803645066147948), 'Std': np.float64(0.25671387536391543)}
[I 2024-12-06 23:36:22,000] Trial 54 finished with value: 1.0714285714285714 and parameters: {'x_0_0': 'ac', 'x_0_1': 'oo', 'x_1_0': 'cd', 'x_1_1': 'ac'}. Best is trial 50 with value: 0.6607142857142857.
2024-12-06 23:36:22,008 - INFO - Candidate Mean Stats: {'Max': np.float64(2.0), 'Min': np.float64(-1.0756098467804012), 'Mean': np.float64(0.2791973451020115), 'Std': np.float64(0.4392456799448192)}
2024-12-06 23:36:22,008 - INFO - Candidate Std Stats: {'Max': np.float64(1.4653161009145668), 'Min': np.float64(0.0), 'Mean': np.float64(0.5641879418554925), 'Std': np.float64(0.2385307921779738)}
[I 2024-12-06 23:36:22,021] Trial 54 finished with value: 1.0714285714285714 and parameters: {'x_0_0': 'ad', 'x_0_1': 'oo', 'x_1_0': 'ad', 'x_1_1': 'bc'}. Best is trial 33 with value: 0.6964285714285714.
2024-12-06 23:36:22,183 - INFO - Candidate Mean Stats: {'Max': np.float64(2.0), 'Min': np.float64(-1.1848469730644862), 'Mean': np.float64(0.2484370611321614), 'Std': np.float64(0.393221206000893)}
2024-12-06 23:36:22,183 - INFO - Candidate Std Stats: {'Max': np.float64(1.7234864866857729), 'Min': np.float64(0.0), 'Mean': np.float64(0.620664764456474), 'Std': np.float64(0.27254138414254603)}
[I 2024-12-06 23:36:22,197] Trial 54 finished with value: 0.5 and parameters: {'x_0_0': 'bd', 'x_0_1': 'oo', 'x_1_0': 'bc', 'x_1_1': 'ac'}. Best is trial 23 with value: 0.5.
2024-12-06 23:36:22,319 - INFO - Candidate Mean Stats: {'Max': np.float64(2.0), 'Min': np.float64(-1.015210790199155), 'Mean': np.float64(0.24215440039698985), 'Std': np.float64(0.4383179694268595)}
2024-12-06 23:36:22,320 - INFO - Candidate Std Stats: {'Max': np.float64(1.4876864089331332), 'Min': np.float64(0.0), 'Mean': np.float64(0.5472004633082141), 'Std': np.float64(0.23850702560769932)}
2024-12-06 23:36:22,329 - INFO - Candidate Mean Stats: {'Max': np.float64(2.0), 'Min': np.float64(-0.7832474228681523), 'Mean': np.float64(0.2819449509912906), 'Std': np.float64(0.4199219556037483)}
2024-12-06 23:36:22,329 - INFO - Candidate Std Stats: {'Max': np.float64(1.4173540093768484), 'Min': np.float64(0.0), 'Mean': np.float64(0.5123998786518426), 'Std': np.float64(0.2282450105287664)}
[I 2024-12-06 23:36:22,332] Trial 55 finished with value: 1.0714285714285714 and parameters: {'x_0_0': 'bd', 'x_0_1': 'oo', 'x_1_0': 'cd', 'x_1_1': 'ab'}. Best is trial 14 with value: 0.6428571428571428.
[I 2024-12-06 23:36:22,341] Trial 55 finished with value: 1.0714285714285714 and parameters: {'x_0_0': 'bc', 'x_0_1': 'oo', 'x_1_0': 'ad', 'x_1_1': 'ad'}. Best is trial 50 with value: 0.6607142857142857.
2024-12-06 23:36:22,350 - INFO - Candidate Mean Stats: {'Max': np.float64(2.0), 'Min': np.float64(-1.256593828055241), 'Mean': np.float64(0.3132118244630617), 'Std': np.float64(0.4498466870058912)}
2024-12-06 23:36:22,350 - INFO - Candidate Std Stats: {'Max': np.float64(1.6921387450411978), 'Min': np.float64(0.0), 'Mean': np.float64(0.5543637970238796), 'Std': np.float64(0.25564247863266265)}
[I 2024-12-06 23:36:22,363] Trial 55 finished with value: 0.8214285714285714 and parameters: {'x_0_0': 'ac', 'x_0_1': 'oo', 'x_1_0': 'oo', 'x_1_1': 'bc'}. Best is trial 33 with value: 0.6964285714285714.
2024-12-06 23:36:22,525 - INFO - Candidate Mean Stats: {'Max': np.float64(2.0), 'Min': np.float64(-0.924460298872054), 'Mean': np.float64(0.2578377212476355), 'Std': np.float64(0.41938058965872893)}
2024-12-06 23:36:22,525 - INFO - Candidate Std Stats: {'Max': np.float64(1.6320503153932404), 'Min': np.float64(0.0), 'Mean': np.float64(0.6267390410877575), 'Std': np.float64(0.26969287911606166)}
[I 2024-12-06 23:36:22,538] Trial 55 finished with value: 0.8214285714285714 and parameters: {'x_0_0': 'bc', 'x_0_1': 'oo', 'x_1_0': 'oo', 'x_1_1': 'bc'}. Best is trial 23 with value: 0.5.
2024-12-06 23:36:22,677 - INFO - Candidate Mean Stats: {'Max': np.float64(2.0), 'Min': np.float64(-1.0299547471722952), 'Mean': np.float64(0.293613165187293), 'Std': np.float64(0.4861968851468897)}
2024-12-06 23:36:22,678 - INFO - Candidate Std Stats: {'Max': np.float64(1.590865583865967), 'Min': np.float64(0.0), 'Mean': np.float64(0.5876516134577211), 'Std': np.float64(0.24587834308254264)}
2024-12-06 23:36:22,692 - INFO - Candidate Mean Stats: {'Max': np.float64(2.0), 'Min': np.float64(-1.020604191914663), 'Mean': np.float64(0.31585678087050706), 'Std': np.float64(0.4152379571276169)}
2024-12-06 23:36:22,693 - INFO - Candidate Std Stats: {'Max': np.float64(1.59958703538573), 'Min': np.float64(0.0), 'Mean': np.float64(0.5675475597438515), 'Std': np.float64(0.24192608006266797)}
[I 2024-12-06 23:36:22,798] Trial 56 finished with value: 1.3214285714285714 and parameters: {'x_0_0': 'bd', 'x_0_1': 'cd', 'x_1_0': 'oo', 'x_1_1': 'cd'}. Best is trial 14 with value: 0.6428571428571428.
2024-12-06 23:36:22,798 - INFO - Candidate Mean Stats: {'Max': np.float64(2.1050424033948687), 'Min': np.float64(-1.3278127956865233), 'Mean': np.float64(0.2879817384276877), 'Std': np.float64(0.43261941679078453)}
2024-12-06 23:36:22,798 - INFO - Candidate Std Stats: {'Max': np.float64(1.6475331275722966), 'Min': np.float64(0.0), 'Mean': np.float64(0.6382831788226999), 'Std': np.float64(0.2663885612781427)}
[I 2024-12-06 23:36:22,799] Trial 56 finished with value: 0.8214285714285714 and parameters: {'x_0_0': 'bd', 'x_0_1': 'oo', 'x_1_0': 'oo', 'x_1_1': 'ad'}. Best is trial 50 with value: 0.6607142857142857.
[I 2024-12-06 23:36:22,822] Trial 56 finished with value: 0.8214285714285714 and parameters: {'x_0_0': 'bc', 'x_0_1': 'oo', 'x_1_0': 'oo', 'x_1_1': 'cd'}. Best is trial 33 with value: 0.6964285714285714.
2024-12-06 23:36:23,057 - INFO - Candidate Mean Stats: {'Max': np.float64(2.0), 'Min': np.float64(-0.9043680452077624), 'Mean': np.float64(0.28113337697226487), 'Std': np.float64(0.40623224404374253)}
2024-12-06 23:36:23,057 - INFO - Candidate Std Stats: {'Max': np.float64(1.6761396399015218), 'Min': np.float64(0.0), 'Mean': np.float64(0.5994482453464277), 'Std': np.float64(0.2615813026431341)}
[I 2024-12-06 23:36:23,082] Trial 56 finished with value: 1.5 and parameters: {'x_0_0': 'cd', 'x_0_1': 'oo', 'x_1_0': 'bc', 'x_1_1': 'ab'}. Best is trial 23 with value: 0.5.
2024-12-06 23:36:23,255 - INFO - Candidate Mean Stats: {'Max': np.float64(2.0), 'Min': np.float64(-1.0800065502897824), 'Mean': np.float64(0.23883975892398354), 'Std': np.float64(0.49972174292174776)}
2024-12-06 23:36:23,255 - INFO - Candidate Std Stats: {'Max': np.float64(1.4692634295943479), 'Min': np.float64(0.0), 'Mean': np.float64(0.5579789321858363), 'Std': np.float64(0.24025074369748609)}
2024-12-06 23:36:23,265 - INFO - Candidate Mean Stats: {'Max': np.float64(2.0), 'Min': np.float64(-1.0369186446545915), 'Mean': np.float64(0.3216349251210845), 'Std': np.float64(0.41502570026198565)}
2024-12-06 23:36:23,265 - INFO - Candidate Std Stats: {'Max': np.float64(1.8900327723413786), 'Min': np.float64(0.0), 'Mean': np.float64(0.5528147301621146), 'Std': np.float64(0.24809514551785222)}
[I 2024-12-06 23:36:23,267] Trial 57 finished with value: 1.0714285714285714 and parameters: {'x_0_0': 'bc', 'x_0_1': 'oo', 'x_1_0': 'cd', 'x_1_1': 'bc'}. Best is trial 14 with value: 0.6428571428571428.
2024-12-06 23:36:23,272 - INFO - Candidate Mean Stats: {'Max': np.float64(2.031978557420124), 'Min': np.float64(-1.1499127357048127), 'Mean': np.float64(0.2993735635686101), 'Std': np.float64(0.43365435288423343)}
2024-12-06 23:36:23,272 - INFO - Candidate Std Stats: {'Max': np.float64(1.6430519186413257), 'Min': np.float64(0.0), 'Mean': np.float64(0.5929012192312875), 'Std': np.float64(0.25911150023626406)}
[I 2024-12-06 23:36:23,279] Trial 57 finished with value: 0.7857142857142857 and parameters: {'x_0_0': 'ad', 'x_0_1': 'oo', 'x_1_0': 'bd', 'x_1_1': 'cd'}. Best is trial 50 with value: 0.6607142857142857.
[I 2024-12-06 23:36:23,285] Trial 57 finished with value: 1.0714285714285714 and parameters: {'x_0_0': 'ac', 'x_0_1': 'oo', 'x_1_0': 'cd', 'x_1_1': 'cd'}. Best is trial 33 with value: 0.6964285714285714.
2024-12-06 23:36:23,437 - INFO - Candidate Mean Stats: {'Max': np.float64(2.0), 'Min': np.float64(-1.1484204724191296), 'Mean': np.float64(0.26496397555613016), 'Std': np.float64(0.41665693239372564)}
2024-12-06 23:36:23,437 - INFO - Candidate Std Stats: {'Max': np.float64(1.6079569883891722), 'Min': np.float64(0.0), 'Mean': np.float64(0.6173708901006214), 'Std': np.float64(0.2793895036531688)}
[I 2024-12-06 23:36:23,450] Trial 57 finished with value: 1.0714285714285714 and parameters: {'x_0_0': 'bd', 'x_0_1': 'oo', 'x_1_0': 'cd', 'x_1_1': 'ab'}. Best is trial 23 with value: 0.5.
2024-12-06 23:36:23,595 - INFO - Candidate Mean Stats: {'Max': np.float64(2.0), 'Min': np.float64(-1.1011484604877795), 'Mean': np.float64(0.25012434698229075), 'Std': np.float64(0.4529684879107242)}
2024-12-06 23:36:23,595 - INFO - Candidate Std Stats: {'Max': np.float64(1.5392352580180475), 'Min': np.float64(0.0), 'Mean': np.float64(0.6213658414898601), 'Std': np.float64(0.2619107631382469)}
[I 2024-12-06 23:36:23,612] Trial 58 finished with value: 1.0714285714285714 and parameters: {'x_0_0': 'ad', 'x_0_1': 'oo', 'x_1_0': 'cd', 'x_1_1': 'cd'}. Best is trial 14 with value: 0.6428571428571428.
2024-12-06 23:36:23,613 - INFO - Candidate Mean Stats: {'Max': np.float64(2.0), 'Min': np.float64(-1.0634620447474044), 'Mean': np.float64(0.24654101398670403), 'Std': np.float64(0.44075853596631215)}
2024-12-06 23:36:23,613 - INFO - Candidate Std Stats: {'Max': np.float64(1.547154189426368), 'Min': np.float64(0.0), 'Mean': np.float64(0.6461452492027232), 'Std': np.float64(0.26493892650248924)}
2024-12-06 23:36:23,618 - INFO - Candidate Mean Stats: {'Max': np.float64(2.1720239053623547), 'Min': np.float64(-1.3081484783294541), 'Mean': np.float64(0.19386555912063966), 'Std': np.float64(0.5068666428811432)}
2024-12-06 23:36:23,618 - INFO - Candidate Std Stats: {'Max': np.float64(1.7138096047084828), 'Min': np.float64(0.0), 'Mean': np.float64(0.6174446312385565), 'Std': np.float64(0.26035597550577055)}
[I 2024-12-06 23:36:23,630] Trial 58 finished with value: 0.9464285714285714 and parameters: {'x_0_0': 'ad', 'x_0_1': 'oo', 'x_1_0': 'cd', 'x_1_1': 'oo'}. Best is trial 50 with value: 0.6607142857142857.
[I 2024-12-06 23:36:23,633] Trial 58 finished with value: 1.25 and parameters: {'x_0_0': 'cd', 'x_0_1': 'oo', 'x_1_0': 'oo', 'x_1_1': 'ad'}. Best is trial 33 with value: 0.6964285714285714.
2024-12-06 23:36:23,824 - INFO - Candidate Mean Stats: {'Max': np.float64(2.0), 'Min': np.float64(-0.8824494644871054), 'Mean': np.float64(0.33068161214706854), 'Std': np.float64(0.42156865416494516)}
2024-12-06 23:36:23,824 - INFO - Candidate Std Stats: {'Max': np.float64(1.7475729275012684), 'Min': np.float64(0.0), 'Mean': np.float64(0.6051682868021119), 'Std': np.float64(0.28109954317911684)}
[I 2024-12-06 23:36:23,840] Trial 58 finished with value: 1.2857142857142856 and parameters: {'x_0_0': 'bc', 'x_0_1': 'ac', 'x_1_0': 'ad', 'x_1_1': 'ac'}. Best is trial 23 with value: 0.5.
2024-12-06 23:36:23,980 - INFO - Candidate Mean Stats: {'Max': np.float64(2.0), 'Min': np.float64(-1.1832058134609889), 'Mean': np.float64(0.22213554445783254), 'Std': np.float64(0.47205974932201367)}
2024-12-06 23:36:23,980 - INFO - Candidate Std Stats: {'Max': np.float64(1.7541376971026594), 'Min': np.float64(0.0), 'Mean': np.float64(0.6166012178299995), 'Std': np.float64(0.26180300377496013)}
[I 2024-12-06 23:36:23,996] Trial 59 finished with value: 1.0714285714285714 and parameters: {'x_0_0': 'bd', 'x_0_1': 'oo', 'x_1_0': 'cd', 'x_1_1': 'ad'}. Best is trial 14 with value: 0.6428571428571428.
2024-12-06 23:36:24,004 - INFO - Candidate Mean Stats: {'Max': np.float64(2.392608892074141), 'Min': np.float64(-0.9243746482141516), 'Mean': np.float64(0.2968067309829237), 'Std': np.float64(0.4263153451321652)}
2024-12-06 23:36:24,004 - INFO - Candidate Std Stats: {'Max': np.float64(1.851372918549641), 'Min': np.float64(0.0), 'Mean': np.float64(0.5655326316342204), 'Std': np.float64(0.246099051278222)}
2024-12-06 23:36:24,009 - INFO - Candidate Mean Stats: {'Max': np.float64(2.0), 'Min': np.float64(-1.173536876384702), 'Mean': np.float64(0.2323685794020954), 'Std': np.float64(0.4308436867960986)}
2024-12-06 23:36:24,009 - INFO - Candidate Std Stats: {'Max': np.float64(1.5923645323670417), 'Min': np.float64(0.0), 'Mean': np.float64(0.6189488798874303), 'Std': np.float64(0.2507753416046819)}
[I 2024-12-06 23:36:24,019] Trial 59 finished with value: 0.7857142857142857 and parameters: {'x_0_0': 'ad', 'x_0_1': 'oo', 'x_1_0': 'bd', 'x_1_1': 'bd'}. Best is trial 50 with value: 0.6607142857142857.
[I 2024-12-06 23:36:24,025] Trial 59 finished with value: 0.6964285714285714 and parameters: {'x_0_0': 'bc', 'x_0_1': 'oo', 'x_1_0': 'oo', 'x_1_1': 'oo'}. Best is trial 33 with value: 0.6964285714285714.
2024-12-06 23:36:24,201 - INFO - Candidate Mean Stats: {'Max': np.float64(2.0), 'Min': np.float64(-0.659604061260988), 'Mean': np.float64(0.27723036669291495), 'Std': np.float64(0.35542908899358916)}
2024-12-06 23:36:24,201 - INFO - Candidate Std Stats: {'Max': np.float64(1.5849129607775727), 'Min': np.float64(0.0), 'Mean': np.float64(0.5233828443616108), 'Std': np.float64(0.2430764813763513)}
[I 2024-12-06 23:36:24,214] Trial 59 finished with value: 1.0714285714285714 and parameters: {'x_0_0': 'bd', 'x_0_1': 'oo', 'x_1_0': 'cd', 'x_1_1': 'ac'}. Best is trial 23 with value: 0.5.
2024-12-06 23:36:24,331 - INFO - Candidate Mean Stats: {'Max': np.float64(2.2548825020923813), 'Min': np.float64(-0.89670885336805), 'Mean': np.float64(0.3136061459058265), 'Std': np.float64(0.40769886809581185)}
2024-12-06 23:36:24,332 - INFO - Candidate Std Stats: {'Max': np.float64(1.421277490938718), 'Min': np.float64(0.0), 'Mean': np.float64(0.5465125847727237), 'Std': np.float64(0.2470471566331129)}
[I 2024-12-06 23:36:24,345] Trial 60 finished with value: 0.7857142857142857 and parameters: {'x_0_0': 'bd', 'x_0_1': 'oo', 'x_1_0': 'bc', 'x_1_1': 'bd'}. Best is trial 14 with value: 0.6428571428571428.
2024-12-06 23:36:24,354 - INFO - Candidate Mean Stats: {'Max': np.float64(2.0), 'Min': np.float64(-0.9373812011230832), 'Mean': np.float64(0.2875302729401177), 'Std': np.float64(0.43541046345220713)}
2024-12-06 23:36:24,355 - INFO - Candidate Std Stats: {'Max': np.float64(1.4504148149502576), 'Min': np.float64(0.0), 'Mean': np.float64(0.5785620725565962), 'Std': np.float64(0.2375523423627381)}
2024-12-06 23:36:24,357 - INFO - Candidate Mean Stats: {'Max': np.float64(2.0), 'Min': np.float64(-0.8968897612845386), 'Mean': np.float64(0.29518030707618), 'Std': np.float64(0.4281040695220646)}
2024-12-06 23:36:24,357 - INFO - Candidate Std Stats: {'Max': np.float64(1.903319791434968), 'Min': np.float64(0.0), 'Mean': np.float64(0.6210766023681271), 'Std': np.float64(0.2761291371474041)}
[I 2024-12-06 23:36:24,369] Trial 60 finished with value: 1.0714285714285714 and parameters: {'x_0_0': 'ad', 'x_0_1': 'oo', 'x_1_0': 'ad', 'x_1_1': 'ad'}. Best is trial 33 with value: 0.6964285714285714.
[I 2024-12-06 23:36:24,373] Trial 60 finished with value: 0.9464285714285714 and parameters: {'x_0_0': 'ad', 'x_0_1': 'oo', 'x_1_0': 'ac', 'x_1_1': 'oo'}. Best is trial 50 with value: 0.6607142857142857.
2024-12-06 23:36:24,563 - INFO - Candidate Mean Stats: {'Max': np.float64(2.0), 'Min': np.float64(-1.0689034293558635), 'Mean': np.float64(0.19148731284633663), 'Std': np.float64(0.45521983235373414)}
2024-12-06 23:36:24,563 - INFO - Candidate Std Stats: {'Max': np.float64(1.8471314534905838), 'Min': np.float64(0.0), 'Mean': np.float64(0.664974606789658), 'Std': np.float64(0.2786484209267614)}
[I 2024-12-06 23:36:24,577] Trial 60 finished with value: 0.9464285714285714 and parameters: {'x_0_0': 'bc', 'x_0_1': 'oo', 'x_1_0': 'ab', 'x_1_1': 'oo'}. Best is trial 23 with value: 0.5.
2024-12-06 23:36:24,700 - INFO - Candidate Mean Stats: {'Max': np.float64(2.0), 'Min': np.float64(-1.2769489332849255), 'Mean': np.float64(0.3350400290750683), 'Std': np.float64(0.4376559233680373)}
2024-12-06 23:36:24,700 - INFO - Candidate Std Stats: {'Max': np.float64(1.4626349306402515), 'Min': np.float64(0.0), 'Mean': np.float64(0.523711693086729), 'Std': np.float64(0.23617400922721876)}
[I 2024-12-06 23:36:24,713] Trial 61 finished with value: 0.9285714285714286 and parameters: {'x_0_0': 'bd', 'x_0_1': 'oo', 'x_1_0': 'ab', 'x_1_1': 'cd'}. Best is trial 14 with value: 0.6428571428571428.
2024-12-06 23:36:24,722 - INFO - Candidate Mean Stats: {'Max': np.float64(2.179528277886314), 'Min': np.float64(-0.8939997997664438), 'Mean': np.float64(0.21320543436948344), 'Std': np.float64(0.4356517550559829)}
2024-12-06 23:36:24,722 - INFO - Candidate Std Stats: {'Max': np.float64(1.4228960887429876), 'Min': np.float64(0.0), 'Mean': np.float64(0.5626859549745975), 'Std': np.float64(0.2338815722218928)}
2024-12-06 23:36:24,728 - INFO - Candidate Mean Stats: {'Max': np.float64(2.0), 'Min': np.float64(-1.3607684640840279), 'Mean': np.float64(0.1786766611081282), 'Std': np.float64(0.4450086581266821)}
2024-12-06 23:36:24,728 - INFO - Candidate Std Stats: {'Max': np.float64(1.7739365559633318), 'Min': np.float64(0.0), 'Mean': np.float64(0.6529772824041015), 'Std': np.float64(0.2796041875594038)}
[I 2024-12-06 23:36:24,736] Trial 61 finished with value: 1.5 and parameters: {'x_0_0': 'cd', 'x_0_1': 'oo', 'x_1_0': 'cd', 'x_1_1': 'cd'}. Best is trial 33 with value: 0.6964285714285714.
