[I 2024-12-07 00:57:33,228] Trial 205 finished with value: 1.2555555555555555 and parameters: {'x_0_0': 'ac', 'x_0_1': 'ab', 'x_0_2': 'bd', 'x_1_0': 'oo', 'x_1_1': 'oo', 'x_1_2': 'bd'}. Best is trial 200 with value: 0.6.
2024-12-07 00:57:39,003 - INFO - Candidate Mean Stats: {'Max': np.float64(2.0), 'Min': np.float64(0.2817646571780482), 'Mean': np.float64(0.5072602565296163), 'Std': np.float64(0.07383516071519186)}
2024-12-07 00:57:39,003 - INFO - Candidate Std Stats: {'Max': np.float64(0.4204698995034715), 'Min': np.float64(0.0), 'Mean': np.float64(0.1087148984398908), 'Std': np.float64(0.04395767049229501)}
[I 2024-12-07 00:57:39,048] Trial 205 finished with value: 1.6666666666666665 and parameters: {'x_0_0': 'bd', 'x_0_1': 'ac', 'x_0_2': 'ac', 'x_1_0': 'cd', 'x_1_1': 'ad', 'x_1_2': 'ad'}. Best is trial 74 with value: 0.8222222222222222.
2024-12-07 00:57:42,744 - INFO - Candidate Mean Stats: {'Max': np.float64(2.0), 'Min': np.float64(0.2511090763240622), 'Mean': np.float64(0.4888186490922114), 'Std': np.float64(0.0742719182549751)}
2024-12-07 00:57:42,745 - INFO - Candidate Std Stats: {'Max': np.float64(0.4393796853509055), 'Min': np.float64(0.0), 'Mean': np.float64(0.1107597538574345), 'Std': np.float64(0.046755245077081224)}
[I 2024-12-07 00:57:42,788] Trial 206 finished with value: 1.6666666666666665 and parameters: {'x_0_0': 'bd', 'x_0_1': 'bd', 'x_0_2': 'ab', 'x_1_0': 'cd', 'x_1_1': 'bc', 'x_1_2': 'ad'}. Best is trial 148 with value: 0.8333333333333333.
2024-12-07 00:57:46,090 - INFO - Candidate Mean Stats: {'Max': np.float64(2.0), 'Min': np.float64(0.27937297496740304), 'Mean': np.float64(0.48450951232280964), 'Std': np.float64(0.07078225609852123)}
2024-12-07 00:57:46,090 - INFO - Candidate Std Stats: {'Max': np.float64(0.4214796370879394), 'Min': np.float64(0.0), 'Mean': np.float64(0.10294397992678891), 'Std': np.float64(0.04244553952462086)}
[I 2024-12-07 00:57:46,136] Trial 206 finished with value: 1.0666666666666667 and parameters: {'x_0_0': 'bc', 'x_0_1': 'oo', 'x_0_2': 'bd', 'x_1_0': 'bd', 'x_1_1': 'oo', 'x_1_2': 'oo'}. Best is trial 49 with value: 0.7999999999999999.
2024-12-07 00:57:53,974 - INFO - Candidate Mean Stats: {'Max': np.float64(2.0), 'Min': np.float64(0.1121996317918498), 'Mean': np.float64(0.49029890862965386), 'Std': np.float64(0.07597654981754975)}
2024-12-07 00:57:53,975 - INFO - Candidate Std Stats: {'Max': np.float64(0.7625941255758658), 'Min': np.float64(0.0), 'Mean': np.float64(0.11637751386231625), 'Std': np.float64(0.05679828315699717)}
[I 2024-12-07 00:57:54,019] Trial 206 finished with value: 1.0444444444444443 and parameters: {'x_0_0': 'ad', 'x_0_1': 'oo', 'x_0_2': 'ab', 'x_1_0': 'bc', 'x_1_1': 'cd', 'x_1_2': 'ac'}. Best is trial 200 with value: 0.6.
2024-12-07 00:57:59,525 - INFO - Candidate Mean Stats: {'Max': np.float64(2.0), 'Min': np.float64(0.25123044667030264), 'Mean': np.float64(0.49390246246142916), 'Std': np.float64(0.07399400441216913)}
2024-12-07 00:57:59,525 - INFO - Candidate Std Stats: {'Max': np.float64(0.6834087389703707), 'Min': np.float64(0.0), 'Mean': np.float64(0.10437127981209235), 'Std': np.float64(0.04657179975488284)}
[I 2024-12-07 00:57:59,568] Trial 206 finished with value: 1.3666666666666667 and parameters: {'x_0_0': 'ac', 'x_0_1': 'bd', 'x_0_2': 'oo', 'x_1_0': 'ab', 'x_1_1': 'oo', 'x_1_2': 'oo'}. Best is trial 74 with value: 0.8222222222222222.
2024-12-07 00:58:03,057 - INFO - Candidate Mean Stats: {'Max': np.float64(2.0), 'Min': np.float64(0.19299915705896364), 'Mean': np.float64(0.48663772947717887), 'Std': np.float64(0.07616482376179239)}
2024-12-07 00:58:03,057 - INFO - Candidate Std Stats: {'Max': np.float64(0.4622468956679677), 'Min': np.float64(0.0), 'Mean': np.float64(0.11096227688736271), 'Std': np.float64(0.04759382520142791)}
[I 2024-12-07 00:58:03,100] Trial 207 finished with value: 1.5666666666666667 and parameters: {'x_0_0': 'bd', 'x_0_1': 'bd', 'x_0_2': 'bc', 'x_1_0': 'cd', 'x_1_1': 'oo', 'x_1_2': 'ac'}. Best is trial 148 with value: 0.8333333333333333.
2024-12-07 00:58:06,721 - INFO - Candidate Mean Stats: {'Max': np.float64(2.0), 'Min': np.float64(0.2624896262426912), 'Mean': np.float64(0.4887112946406232), 'Std': np.float64(0.07437755361462768)}
2024-12-07 00:58:06,721 - INFO - Candidate Std Stats: {'Max': np.float64(0.4668267220433401), 'Min': np.float64(0.0), 'Mean': np.float64(0.10007501390796081), 'Std': np.float64(0.04257007550263399)}
[I 2024-12-07 00:58:06,766] Trial 207 finished with value: 1.5666666666666667 and parameters: {'x_0_0': 'bd', 'x_0_1': 'cd', 'x_0_2': 'ac', 'x_1_0': 'cd', 'x_1_1': 'bc', 'x_1_2': 'oo'}. Best is trial 49 with value: 0.7999999999999999.
2024-12-07 00:58:14,738 - INFO - Candidate Mean Stats: {'Max': np.float64(2.0), 'Min': np.float64(0.26476585225861515), 'Mean': np.float64(0.49501496440972276), 'Std': np.float64(0.07261733264722248)}
2024-12-07 00:58:14,739 - INFO - Candidate Std Stats: {'Max': np.float64(0.37461281342316544), 'Min': np.float64(0.0), 'Mean': np.float64(0.09756778404096164), 'Std': np.float64(0.040162905358101776)}
[I 2024-12-07 00:58:14,784] Trial 207 finished with value: 1.3555555555555556 and parameters: {'x_0_0': 'ac', 'x_0_1': 'ab', 'x_0_2': 'cd', 'x_1_0': 'oo', 'x_1_1': 'ab', 'x_1_2': 'ac'}. Best is trial 200 with value: 0.6.
2024-12-07 00:58:20,207 - INFO - Candidate Mean Stats: {'Max': np.float64(2.0), 'Min': np.float64(0.2565393812293928), 'Mean': np.float64(0.4860504834501193), 'Std': np.float64(0.07461287323877806)}
2024-12-07 00:58:20,208 - INFO - Candidate Std Stats: {'Max': np.float64(0.3973208041590326), 'Min': np.float64(0.0), 'Mean': np.float64(0.10970957275394545), 'Std': np.float64(0.042399445497835905)}
[I 2024-12-07 00:58:20,252] Trial 207 finished with value: 1.5555555555555556 and parameters: {'x_0_0': 'ac', 'x_0_1': 'ab', 'x_0_2': 'ab', 'x_1_0': 'bd', 'x_1_1': 'bc', 'x_1_2': 'cd'}. Best is trial 74 with value: 0.8222222222222222.
2024-12-07 00:58:23,290 - INFO - Candidate Mean Stats: {'Max': np.float64(2.0), 'Min': np.float64(0.22906086851222227), 'Mean': np.float64(0.48356630394685607), 'Std': np.float64(0.0705791452862449)}
2024-12-07 00:58:23,291 - INFO - Candidate Std Stats: {'Max': np.float64(0.8302752017626055), 'Min': np.float64(0.0), 'Mean': np.float64(0.10146874339797757), 'Std': np.float64(0.04426718216729977)}
[I 2024-12-07 00:58:23,333] Trial 208 finished with value: 1.077777777777778 and parameters: {'x_0_0': 'ab', 'x_0_1': 'oo', 'x_0_2': 'bc', 'x_1_0': 'oo', 'x_1_1': 'bd', 'x_1_2': 'oo'}. Best is trial 148 with value: 0.8333333333333333.
2024-12-07 00:58:27,292 - INFO - Candidate Mean Stats: {'Max': np.float64(2.0), 'Min': np.float64(0.2682131126269001), 'Mean': np.float64(0.4908265455103498), 'Std': np.float64(0.07177162794400557)}
2024-12-07 00:58:27,293 - INFO - Candidate Std Stats: {'Max': np.float64(1.845293655430902), 'Min': np.float64(0.0), 'Mean': np.float64(0.1016555499957009), 'Std': np.float64(0.04979903574107285)}
[I 2024-12-07 00:58:27,337] Trial 208 finished with value: 1.3444444444444443 and parameters: {'x_0_0': 'ad', 'x_0_1': 'ad', 'x_0_2': 'oo', 'x_1_0': 'bd', 'x_1_1': 'ab', 'x_1_2': 'ad'}. Best is trial 49 with value: 0.7999999999999999.
2024-12-07 00:58:34,999 - INFO - Candidate Mean Stats: {'Max': np.float64(2.0), 'Min': np.float64(0.21141826480917197), 'Mean': np.float64(0.49606787982010664), 'Std': np.float64(0.07344633144080859)}
2024-12-07 00:58:34,999 - INFO - Candidate Std Stats: {'Max': np.float64(0.8128079948860747), 'Min': np.float64(0.0), 'Mean': np.float64(0.11337570339927477), 'Std': np.float64(0.04924556310196976)}
[I 2024-12-07 00:58:35,044] Trial 208 finished with value: 0.9444444444444444 and parameters: {'x_0_0': 'bd', 'x_0_1': 'oo', 'x_0_2': 'ab', 'x_1_0': 'bd', 'x_1_1': 'oo', 'x_1_2': 'ac'}. Best is trial 200 with value: 0.6.
2024-12-07 00:58:40,808 - INFO - Candidate Mean Stats: {'Max': np.float64(2.0), 'Min': np.float64(0.20699211449276586), 'Mean': np.float64(0.4829597332230238), 'Std': np.float64(0.07567478054700472)}
2024-12-07 00:58:40,809 - INFO - Candidate Std Stats: {'Max': np.float64(0.9616221711106597), 'Min': np.float64(0.0), 'Mean': np.float64(0.12593351734801775), 'Std': np.float64(0.0647314712468862)}
[I 2024-12-07 00:58:40,853] Trial 208 finished with value: 1.2666666666666666 and parameters: {'x_0_0': 'bd', 'x_0_1': 'oo', 'x_0_2': 'ad', 'x_1_0': 'ac', 'x_1_1': 'ad', 'x_1_2': 'bd'}. Best is trial 74 with value: 0.8222222222222222.
2024-12-07 00:58:43,623 - INFO - Candidate Mean Stats: {'Max': np.float64(2.0), 'Min': np.float64(0.2558292687831706), 'Mean': np.float64(0.49277723630467973), 'Std': np.float64(0.07453738777488436)}
2024-12-07 00:58:43,624 - INFO - Candidate Std Stats: {'Max': np.float64(0.41934432673832844), 'Min': np.float64(0.0), 'Mean': np.float64(0.10148204679579027), 'Std': np.float64(0.04203654087355633)}
[I 2024-12-07 00:58:43,669] Trial 209 finished with value: 1.5666666666666664 and parameters: {'x_0_0': 'ac', 'x_0_1': 'cd', 'x_0_2': 'oo', 'x_1_0': 'ac', 'x_1_1': 'ac', 'x_1_2': 'ad'}. Best is trial 148 with value: 0.8333333333333333.
2024-12-07 00:58:47,774 - INFO - Candidate Mean Stats: {'Max': np.float64(2.0), 'Min': np.float64(0.2670661170801575), 'Mean': np.float64(0.49539594669446235), 'Std': np.float64(0.07126997900060117)}
2024-12-07 00:58:47,775 - INFO - Candidate Std Stats: {'Max': np.float64(0.46953112113685275), 'Min': np.float64(0.0), 'Mean': np.float64(0.10068390554222824), 'Std': np.float64(0.04177578620920595)}
[I 2024-12-07 00:58:47,819] Trial 209 finished with value: 1.3 and parameters: {'x_0_0': 'oo', 'x_0_1': 'oo', 'x_0_2': 'ad', 'x_1_0': 'oo', 'x_1_1': 'ad', 'x_1_2': 'cd'}. Best is trial 49 with value: 0.7999999999999999.
2024-12-07 00:58:55,743 - INFO - Candidate Mean Stats: {'Max': np.float64(2.0), 'Min': np.float64(0.2826643173414009), 'Mean': np.float64(0.4956046391770842), 'Std': np.float64(0.0698529383316744)}
2024-12-07 00:58:55,744 - INFO - Candidate Std Stats: {'Max': np.float64(0.45861878607459494), 'Min': np.float64(0.0), 'Mean': np.float64(0.10442522983132331), 'Std': np.float64(0.04458372847750129)}
[I 2024-12-07 00:58:55,787] Trial 209 finished with value: 0.8222222222222222 and parameters: {'x_0_0': 'ad', 'x_0_1': 'oo', 'x_0_2': 'ab', 'x_1_0': 'bc', 'x_1_1': 'ac', 'x_1_2': 'cd'}. Best is trial 200 with value: 0.6.
2024-12-07 00:59:01,491 - INFO - Candidate Mean Stats: {'Max': np.float64(2.0), 'Min': np.float64(0.2839814032351543), 'Mean': np.float64(0.49120546082339034), 'Std': np.float64(0.0707685003356283)}
2024-12-07 00:59:01,492 - INFO - Candidate Std Stats: {'Max': np.float64(0.3797450850533466), 'Min': np.float64(0.0), 'Mean': np.float64(0.09690790207537636), 'Std': np.float64(0.03960454462512372)}
[I 2024-12-07 00:59:01,533] Trial 209 finished with value: 1.3666666666666667 and parameters: {'x_0_0': 'ad', 'x_0_1': 'ab', 'x_0_2': 'oo', 'x_1_0': 'oo', 'x_1_1': 'ac', 'x_1_2': 'ad'}. Best is trial 74 with value: 0.8222222222222222.
2024-12-07 00:59:04,079 - INFO - Candidate Mean Stats: {'Max': np.float64(2.0), 'Min': np.float64(0.21353618489652887), 'Mean': np.float64(0.4828604276101013), 'Std': np.float64(0.08473881475742834)}
2024-12-07 00:59:04,080 - INFO - Candidate Std Stats: {'Max': np.float64(1.089766480919542), 'Min': np.float64(0.0), 'Mean': np.float64(0.1165721914767372), 'Std': np.float64(0.05936790763042985)}
[I 2024-12-07 00:59:04,121] Trial 210 finished with value: 1.4666666666666666 and parameters: {'x_0_0': 'ac', 'x_0_1': 'bd', 'x_0_2': 'bd', 'x_1_0': 'oo', 'x_1_1': 'ab', 'x_1_2': 'bd'}. Best is trial 148 with value: 0.8333333333333333.
2024-12-07 00:59:08,341 - INFO - Candidate Mean Stats: {'Max': np.float64(2.0), 'Min': np.float64(0.24930888782668575), 'Mean': np.float64(0.4972993087202677), 'Std': np.float64(0.06964534387342856)}
2024-12-07 00:59:08,342 - INFO - Candidate Std Stats: {'Max': np.float64(0.46982810782652296), 'Min': np.float64(0.0), 'Mean': np.float64(0.10693241682176123), 'Std': np.float64(0.04575368627680764)}
[I 2024-12-07 00:59:08,384] Trial 210 finished with value: 1.9 and parameters: {'x_0_0': 'oo', 'x_0_1': 'bc', 'x_0_2': 'ad', 'x_1_0': 'cd', 'x_1_1': 'bd', 'x_1_2': 'cd'}. Best is trial 49 with value: 0.7999999999999999.
2024-12-07 00:59:16,154 - INFO - Candidate Mean Stats: {'Max': np.float64(2.0), 'Min': np.float64(0.19427576716300837), 'Mean': np.float64(0.4801052853382014), 'Std': np.float64(0.0840664420198315)}
2024-12-07 00:59:16,154 - INFO - Candidate Std Stats: {'Max': np.float64(1.5359957457880917), 'Min': np.float64(0.0), 'Mean': np.float64(0.12859038441841994), 'Std': np.float64(0.06761850617669721)}
[I 2024-12-07 00:59:16,197] Trial 210 finished with value: 1.3777777777777778 and parameters: {'x_0_0': 'ab', 'x_0_1': 'ab', 'x_0_2': 'oo', 'x_1_0': 'oo', 'x_1_1': 'ac', 'x_1_2': 'oo'}. Best is trial 200 with value: 0.6.
2024-12-07 00:59:22,046 - INFO - Candidate Mean Stats: {'Max': np.float64(2.0), 'Min': np.float64(0.24950377295896833), 'Mean': np.float64(0.4863692235451452), 'Std': np.float64(0.07263873708536735)}
2024-12-07 00:59:22,047 - INFO - Candidate Std Stats: {'Max': np.float64(0.5906052959802452), 'Min': np.float64(0.0), 'Mean': np.float64(0.1078105389880125), 'Std': np.float64(0.04689769285186024)}
[I 2024-12-07 00:59:22,093] Trial 210 finished with value: 1.5555555555555556 and parameters: {'x_0_0': 'bc', 'x_0_1': 'ab', 'x_0_2': 'ac', 'x_1_0': 'ab', 'x_1_1': 'bd', 'x_1_2': 'ac'}. Best is trial 74 with value: 0.8222222222222222.
2024-12-07 00:59:24,392 - INFO - Candidate Mean Stats: {'Max': np.float64(2.0), 'Min': np.float64(0.22946751866064252), 'Mean': np.float64(0.48047024994723286), 'Std': np.float64(0.07105491994132018)}
2024-12-07 00:59:24,392 - INFO - Candidate Std Stats: {'Max': np.float64(0.588437145765529), 'Min': np.float64(0.0), 'Mean': np.float64(0.10478021742361258), 'Std': np.float64(0.043822011591653234)}
[I 2024-12-07 00:59:24,435] Trial 211 finished with value: 1.4555555555555555 and parameters: {'x_0_0': 'bd', 'x_0_1': 'bd', 'x_0_2': 'oo', 'x_1_0': 'ab', 'x_1_1': 'bd', 'x_1_2': 'bc'}. Best is trial 148 with value: 0.8333333333333333.
2024-12-07 00:59:28,772 - INFO - Candidate Mean Stats: {'Max': np.float64(2.0), 'Min': np.float64(0.2293696006427079), 'Mean': np.float64(0.4820867240759706), 'Std': np.float64(0.07200189170904628)}
2024-12-07 00:59:28,773 - INFO - Candidate Std Stats: {'Max': np.float64(0.45878113409662824), 'Min': np.float64(0.0), 'Mean': np.float64(0.10896905481206093), 'Std': np.float64(0.04430628136986472)}
[I 2024-12-07 00:59:28,818] Trial 211 finished with value: 0.8666666666666667 and parameters: {'x_0_0': 'bc', 'x_0_1': 'oo', 'x_0_2': 'oo', 'x_1_0': 'oo', 'x_1_1': 'ad', 'x_1_2': 'oo'}. Best is trial 49 with value: 0.7999999999999999.
2024-12-07 00:59:36,662 - INFO - Candidate Mean Stats: {'Max': np.float64(2.0), 'Min': np.float64(0.19161381546743655), 'Mean': np.float64(0.4887819235570813), 'Std': np.float64(0.07320957352133142)}
2024-12-07 00:59:36,663 - INFO - Candidate Std Stats: {'Max': np.float64(0.41242015361693996), 'Min': np.float64(0.0), 'Mean': np.float64(0.1044865618076781), 'Std': np.float64(0.0447198838894285)}
[I 2024-12-07 00:59:36,704] Trial 211 finished with value: 1.4666666666666668 and parameters: {'x_0_0': 'bc', 'x_0_1': 'bc', 'x_0_2': 'ab', 'x_1_0': 'cd', 'x_1_1': 'oo', 'x_1_2': 'oo'}. Best is trial 200 with value: 0.6.
2024-12-07 00:59:42,753 - INFO - Candidate Mean Stats: {'Max': np.float64(2.0), 'Min': np.float64(0.23983826405953454), 'Mean': np.float64(0.49353798258990494), 'Std': np.float64(0.07088923360920094)}
2024-12-07 00:59:42,754 - INFO - Candidate Std Stats: {'Max': np.float64(0.3993897022629488), 'Min': np.float64(0.0), 'Mean': np.float64(0.10780885112695186), 'Std': np.float64(0.04589787493664038)}
[I 2024-12-07 00:59:42,800] Trial 211 finished with value: 1.5666666666666664 and parameters: {'x_0_0': 'bd', 'x_0_1': 'ab', 'x_0_2': 'oo', 'x_1_0': 'ad', 'x_1_1': 'bc', 'x_1_2': 'bc'}. Best is trial 74 with value: 0.8222222222222222.
2024-12-07 00:59:44,619 - INFO - Candidate Mean Stats: {'Max': np.float64(2.0), 'Min': np.float64(0.21602433539065302), 'Mean': np.float64(0.48997996043668807), 'Std': np.float64(0.07806255560295841)}
2024-12-07 00:59:44,620 - INFO - Candidate Std Stats: {'Max': np.float64(1.293786983796673), 'Min': np.float64(0.0), 'Mean': np.float64(0.10987272101279054), 'Std': np.float64(0.05293380249816563)}
[I 2024-12-07 00:59:44,662] Trial 212 finished with value: 1.1666666666666665 and parameters: {'x_0_0': 'bc', 'x_0_1': 'oo', 'x_0_2': 'ab', 'x_1_0': 'bd', 'x_1_1': 'ad', 'x_1_2': 'oo'}. Best is trial 148 with value: 0.8333333333333333.
2024-12-07 00:59:49,098 - INFO - Candidate Mean Stats: {'Max': np.float64(2.0), 'Min': np.float64(0.10729439686534525), 'Mean': np.float64(0.4837878090856333), 'Std': np.float64(0.08562626512752367)}
2024-12-07 00:59:49,099 - INFO - Candidate Std Stats: {'Max': np.float64(0.9356833304467153), 'Min': np.float64(0.0), 'Mean': np.float64(0.12488525935571969), 'Std': np.float64(0.0667259229919378)}
[I 2024-12-07 00:59:49,140] Trial 212 finished with value: 1.5666666666666667 and parameters: {'x_0_0': 'bd', 'x_0_1': 'bc', 'x_0_2': 'bd', 'x_1_0': 'ac', 'x_1_1': 'oo', 'x_1_2': 'ab'}. Best is trial 49 with value: 0.7999999999999999.
2024-12-07 00:59:57,177 - INFO - Candidate Mean Stats: {'Max': np.float64(2.0), 'Min': np.float64(0.19510694198609593), 'Mean': np.float64(0.4908220061079299), 'Std': np.float64(0.07963547738670221)}
2024-12-07 00:59:57,177 - INFO - Candidate Std Stats: {'Max': np.float64(0.5917814120532999), 'Min': np.float64(0.0), 'Mean': np.float64(0.11045857224186699), 'Std': np.float64(0.04982904186113132)}
[I 2024-12-07 00:59:57,220] Trial 212 finished with value: 1.5666666666666667 and parameters: {'x_0_0': 'bc', 'x_0_1': 'cd', 'x_0_2': 'cd', 'x_1_0': 'ad', 'x_1_1': 'oo', 'x_1_2': 'bc'}. Best is trial 200 with value: 0.6.
2024-12-07 01:00:03,140 - INFO - Candidate Mean Stats: {'Max': np.float64(2.0), 'Min': np.float64(0.20456097454527442), 'Mean': np.float64(0.48094282656179665), 'Std': np.float64(0.08331127832192767)}
2024-12-07 01:00:03,140 - INFO - Candidate Std Stats: {'Max': np.float64(1.472689746829029), 'Min': np.float64(0.0), 'Mean': np.float64(0.1148671553006565), 'Std': np.float64(0.059851303780112275)}
[I 2024-12-07 01:00:03,183] Trial 212 finished with value: 1.2444444444444445 and parameters: {'x_0_0': 'ac', 'x_0_1': 'ac', 'x_0_2': 'oo', 'x_1_0': 'ab', 'x_1_1': 'ab', 'x_1_2': 'oo'}. Best is trial 74 with value: 0.8222222222222222.
2024-12-07 01:00:04,682 - INFO - Candidate Mean Stats: {'Max': np.float64(2.0), 'Min': np.float64(0.236566022588886), 'Mean': np.float64(0.48928325771631115), 'Std': np.float64(0.07367421759628255)}
2024-12-07 01:00:04,682 - INFO - Candidate Std Stats: {'Max': np.float64(0.4051601151909806), 'Min': np.float64(0.0), 'Mean': np.float64(0.10483376559846387), 'Std': np.float64(0.04243158848357736)}
[I 2024-12-07 01:00:04,725] Trial 213 finished with value: 1.4666666666666666 and parameters: {'x_0_0': 'bd', 'x_0_1': 'ad', 'x_0_2': 'ab', 'x_1_0': 'oo', 'x_1_1': 'bd', 'x_1_2': 'ab'}. Best is trial 148 with value: 0.8333333333333333.
2024-12-07 01:00:09,537 - INFO - Candidate Mean Stats: {'Max': np.float64(2.0), 'Min': np.float64(0.24235365785771204), 'Mean': np.float64(0.4796876888638482), 'Std': np.float64(0.07365316834397811)}
2024-12-07 01:00:09,538 - INFO - Candidate Std Stats: {'Max': np.float64(0.33771782834048686), 'Min': np.float64(0.0), 'Mean': np.float64(0.09999192192157802), 'Std': np.float64(0.04096027310585786)}
[I 2024-12-07 01:00:09,580] Trial 213 finished with value: 0.9666666666666667 and parameters: {'x_0_0': 'bc', 'x_0_1': 'oo', 'x_0_2': 'oo', 'x_1_0': 'oo', 'x_1_1': 'bc', 'x_1_2': 'ab'}. Best is trial 49 with value: 0.7999999999999999.
2024-12-07 01:00:17,711 - INFO - Candidate Mean Stats: {'Max': np.float64(2.0), 'Min': np.float64(0.26586567807037975), 'Mean': np.float64(0.4998945393138224), 'Std': np.float64(0.07195516066644163)}
2024-12-07 01:00:17,711 - INFO - Candidate Std Stats: {'Max': np.float64(0.4862834116127202), 'Min': np.float64(0.0), 'Mean': np.float64(0.10488741696716093), 'Std': np.float64(0.0447000851187756)}
[I 2024-12-07 01:00:17,751] Trial 213 finished with value: 1.2666666666666666 and parameters: {'x_0_0': 'bc', 'x_0_1': 'oo', 'x_0_2': 'bc', 'x_1_0': 'bd', 'x_1_1': 'bd', 'x_1_2': 'bd'}. Best is trial 200 with value: 0.6.
2024-12-07 01:00:23,612 - INFO - Candidate Mean Stats: {'Max': np.float64(2.0), 'Min': np.float64(0.27896907037444924), 'Mean': np.float64(0.49158635957632185), 'Std': np.float64(0.07579493538350443)}
2024-12-07 01:00:23,612 - INFO - Candidate Std Stats: {'Max': np.float64(1.105194929309043), 'Min': np.float64(0.0), 'Mean': np.float64(0.10762364853368322), 'Std': np.float64(0.053289196488876)}
[I 2024-12-07 01:00:23,654] Trial 213 finished with value: 1.4666666666666666 and parameters: {'x_0_0': 'bd', 'x_0_1': 'cd', 'x_0_2': 'bd', 'x_1_0': 'oo', 'x_1_1': 'ab', 'x_1_2': 'ac'}. Best is trial 74 with value: 0.8222222222222222.
2024-12-07 01:00:25,164 - INFO - Candidate Mean Stats: {'Max': np.float64(2.0), 'Min': np.float64(0.2521159517959524), 'Mean': np.float64(0.49048377798789367), 'Std': np.float64(0.07356611751692485)}
2024-12-07 01:00:25,164 - INFO - Candidate Std Stats: {'Max': np.float64(1.6675782696389219), 'Min': np.float64(0.0), 'Mean': np.float64(0.10035425179996726), 'Std': np.float64(0.04732641364360898)}
