[I 2024-12-07 00:46:00,880] Trial 171 finished with value: 1.3 and parameters: {'x_0_0': 'oo', 'x_0_1': 'oo', 'x_0_2': 'bc', 'x_1_0': 'ac', 'x_1_1': 'oo', 'x_1_2': 'oo'}. Best is trial 118 with value: 0.8666666666666667.
2024-12-07 00:46:08,523 - INFO - Candidate Mean Stats: {'Max': np.float64(2.0), 'Min': np.float64(0.24207503428802365), 'Mean': np.float64(0.4845375691091096), 'Std': np.float64(0.07036866757561148)}
2024-12-07 00:46:08,523 - INFO - Candidate Std Stats: {'Max': np.float64(0.558516887439823), 'Min': np.float64(0.0), 'Mean': np.float64(0.09938253193115264), 'Std': np.float64(0.0397797030845683)}
[I 2024-12-07 00:46:08,565] Trial 171 finished with value: 1.5666666666666667 and parameters: {'x_0_0': 'bd', 'x_0_1': 'bd', 'x_0_2': 'ac', 'x_1_0': 'cd', 'x_1_1': 'oo', 'x_1_2': 'ad'}. Best is trial 74 with value: 0.8222222222222222.
2024-12-07 00:46:11,902 - INFO - Candidate Mean Stats: {'Max': np.float64(2.0), 'Min': np.float64(0.24168147301974052), 'Mean': np.float64(0.4916406609197537), 'Std': np.float64(0.06892957888273543)}
2024-12-07 00:46:11,902 - INFO - Candidate Std Stats: {'Max': np.float64(0.3667953946676507), 'Min': np.float64(0.0), 'Mean': np.float64(0.1016200910150619), 'Std': np.float64(0.0428558283799433)}
[I 2024-12-07 00:46:11,944] Trial 172 finished with value: 1.6666666666666665 and parameters: {'x_0_0': 'bd', 'x_0_1': 'ad', 'x_0_2': 'bc', 'x_1_0': 'cd', 'x_1_1': 'bc', 'x_1_2': 'ab'}. Best is trial 148 with value: 0.8333333333333333.
2024-12-07 00:46:13,250 - INFO - Candidate Mean Stats: {'Max': np.float64(2.0), 'Min': np.float64(0.22069954712919357), 'Mean': np.float64(0.489894400768509), 'Std': np.float64(0.0732077809230548)}
2024-12-07 00:46:13,250 - INFO - Candidate Std Stats: {'Max': np.float64(1.9449708783331199), 'Min': np.float64(0.0), 'Mean': np.float64(0.11183270698361839), 'Std': np.float64(0.049557233879193745)}
[I 2024-12-07 00:46:13,291] Trial 172 finished with value: 1.3777777777777778 and parameters: {'x_0_0': 'ab', 'x_0_1': 'oo', 'x_0_2': 'bd', 'x_1_0': 'ab', 'x_1_1': 'cd', 'x_1_2': 'bc'}. Best is trial 49 with value: 0.7999999999999999.
2024-12-07 00:46:20,623 - INFO - Candidate Mean Stats: {'Max': np.float64(2.0), 'Min': np.float64(0.3074182360932749), 'Mean': np.float64(0.49131095596974206), 'Std': np.float64(0.07467380928462514)}
2024-12-07 00:46:20,623 - INFO - Candidate Std Stats: {'Max': np.float64(0.9381153038300779), 'Min': np.float64(0.0), 'Mean': np.float64(0.12052831045897956), 'Std': np.float64(0.058446171248967616)}
[I 2024-12-07 00:46:20,662] Trial 172 finished with value: 1.9 and parameters: {'x_0_0': 'oo', 'x_0_1': 'ad', 'x_0_2': 'ab', 'x_1_0': 'cd', 'x_1_1': 'bc', 'x_1_2': 'bc'}. Best is trial 118 with value: 0.8666666666666667.
2024-12-07 00:46:28,544 - INFO - Candidate Mean Stats: {'Max': np.float64(2.0), 'Min': np.float64(0.2415100390685896), 'Mean': np.float64(0.485426359476058), 'Std': np.float64(0.06704753350297771)}
2024-12-07 00:46:28,545 - INFO - Candidate Std Stats: {'Max': np.float64(0.5705701420917949), 'Min': np.float64(0.0), 'Mean': np.float64(0.10072071205332213), 'Std': np.float64(0.044985326481976666)}
[I 2024-12-07 00:46:28,589] Trial 172 finished with value: 1.2222222222222223 and parameters: {'x_0_0': 'ac', 'x_0_1': 'ad', 'x_0_2': 'ad', 'x_1_0': 'ab', 'x_1_1': 'bc', 'x_1_2': 'cd'}. Best is trial 74 with value: 0.8222222222222222.
2024-12-07 00:46:32,318 - INFO - Candidate Mean Stats: {'Max': np.float64(2.0), 'Min': np.float64(0.2512641822185766), 'Mean': np.float64(0.4927558580447757), 'Std': np.float64(0.07380964892192564)}
2024-12-07 00:46:32,319 - INFO - Candidate Std Stats: {'Max': np.float64(0.32533679798697096), 'Min': np.float64(0.0), 'Mean': np.float64(0.10073378923875412), 'Std': np.float64(0.03819849493978941)}
[I 2024-12-07 00:46:32,360] Trial 173 finished with value: 1.1555555555555554 and parameters: {'x_0_0': 'ac', 'x_0_1': 'ab', 'x_0_2': 'oo', 'x_1_0': 'oo', 'x_1_1': 'ac', 'x_1_2': 'oo'}. Best is trial 148 with value: 0.8333333333333333.
2024-12-07 00:46:33,321 - INFO - Candidate Mean Stats: {'Max': np.float64(2.0), 'Min': np.float64(0.2900848577731866), 'Mean': np.float64(0.48756266226189887), 'Std': np.float64(0.0684025204363366)}
2024-12-07 00:46:33,321 - INFO - Candidate Std Stats: {'Max': np.float64(0.36350346418348534), 'Min': np.float64(0.0), 'Mean': np.float64(0.1063773844989384), 'Std': np.float64(0.04288900430577691)}
[I 2024-12-07 00:46:33,365] Trial 173 finished with value: 1.4666666666666666 and parameters: {'x_0_0': 'ad', 'x_0_1': 'ad', 'x_0_2': 'oo', 'x_1_0': 'ac', 'x_1_1': 'cd', 'x_1_2': 'oo'}. Best is trial 49 with value: 0.7999999999999999.
2024-12-07 00:46:40,468 - INFO - Candidate Mean Stats: {'Max': np.float64(2.0), 'Min': np.float64(0.2555111587610658), 'Mean': np.float64(0.4958127250190763), 'Std': np.float64(0.07311868384405096)}
2024-12-07 00:46:40,469 - INFO - Candidate Std Stats: {'Max': np.float64(1.4210941913474284), 'Min': np.float64(0.0), 'Mean': np.float64(0.09769489542604305), 'Std': np.float64(0.045903587136075036)}
[I 2024-12-07 00:46:40,509] Trial 173 finished with value: 1.1666666666666665 and parameters: {'x_0_0': 'bd', 'x_0_1': 'oo', 'x_0_2': 'ac', 'x_1_0': 'cd', 'x_1_1': 'oo', 'x_1_2': 'bd'}. Best is trial 118 with value: 0.8666666666666667.
2024-12-07 00:46:47,699 - INFO - Candidate Mean Stats: {'Max': np.float64(2.0), 'Min': np.float64(0.26075411691608597), 'Mean': np.float64(0.48528485232885776), 'Std': np.float64(0.07203476979694705)}
2024-12-07 00:46:47,699 - INFO - Candidate Std Stats: {'Max': np.float64(1.449534809378993), 'Min': np.float64(0.0), 'Mean': np.float64(0.11629699830325127), 'Std': np.float64(0.05994210915128623)}
[I 2024-12-07 00:46:47,741] Trial 173 finished with value: 2.0 and parameters: {'x_0_0': 'cd', 'x_0_1': 'ac', 'x_0_2': 'ad', 'x_1_0': 'bc', 'x_1_1': 'ab', 'x_1_2': 'bc'}. Best is trial 74 with value: 0.8222222222222222.
2024-12-07 00:46:52,387 - INFO - Candidate Mean Stats: {'Max': np.float64(2.0), 'Min': np.float64(0.24415609488736453), 'Mean': np.float64(0.4946397653866814), 'Std': np.float64(0.07578395688246173)}
2024-12-07 00:46:52,387 - INFO - Candidate Std Stats: {'Max': np.float64(0.7524632116963107), 'Min': np.float64(0.0), 'Mean': np.float64(0.1057711215700581), 'Std': np.float64(0.05198157623097775)}
[I 2024-12-07 00:46:52,430] Trial 174 finished with value: 1.2666666666666666 and parameters: {'x_0_0': 'ad', 'x_0_1': 'ac', 'x_0_2': 'oo', 'x_1_0': 'oo', 'x_1_1': 'bd', 'x_1_2': 'oo'}. Best is trial 148 with value: 0.8333333333333333.
2024-12-07 00:46:53,358 - INFO - Candidate Mean Stats: {'Max': np.float64(2.0), 'Min': np.float64(0.21725404757553185), 'Mean': np.float64(0.48940170899938784), 'Std': np.float64(0.07380869851556256)}
2024-12-07 00:46:53,358 - INFO - Candidate Std Stats: {'Max': np.float64(0.4343703683328011), 'Min': np.float64(0.0), 'Mean': np.float64(0.11130046477750849), 'Std': np.float64(0.04873102844317759)}
[I 2024-12-07 00:46:53,400] Trial 174 finished with value: 1.5 and parameters: {'x_0_0': 'oo', 'x_0_1': 'bc', 'x_0_2': 'ad', 'x_1_0': 'oo', 'x_1_1': 'oo', 'x_1_2': 'oo'}. Best is trial 49 with value: 0.7999999999999999.
2024-12-07 00:47:00,467 - INFO - Candidate Mean Stats: {'Max': np.float64(2.0), 'Min': np.float64(0.27865829105807627), 'Mean': np.float64(0.489273740603464), 'Std': np.float64(0.07317014370596252)}
2024-12-07 00:47:00,467 - INFO - Candidate Std Stats: {'Max': np.float64(0.8767143116947095), 'Min': np.float64(0.0), 'Mean': np.float64(0.10773825199303128), 'Std': np.float64(0.052733066975200804)}
[I 2024-12-07 00:47:00,508] Trial 174 finished with value: 1.0666666666666667 and parameters: {'x_0_0': 'bc', 'x_0_1': 'oo', 'x_0_2': 'ac', 'x_1_0': 'oo', 'x_1_1': 'bd', 'x_1_2': 'bc'}. Best is trial 118 with value: 0.8666666666666667.
2024-12-07 00:47:06,447 - INFO - Candidate Mean Stats: {'Max': np.float64(2.0), 'Min': np.float64(0.17280604649366577), 'Mean': np.float64(0.48048156699821687), 'Std': np.float64(0.07982323879942674)}
2024-12-07 00:47:06,449 - INFO - Candidate Std Stats: {'Max': np.float64(1.5017001147269786), 'Min': np.float64(0.0), 'Mean': np.float64(0.12536731396472767), 'Std': np.float64(0.06178867337027659)}
[I 2024-12-07 00:47:06,491] Trial 174 finished with value: 1.4444444444444444 and parameters: {'x_0_0': 'ad', 'x_0_1': 'bd', 'x_0_2': 'cd', 'x_1_0': 'bc', 'x_1_1': 'bc', 'x_1_2': 'ab'}. Best is trial 74 with value: 0.8222222222222222.
2024-12-07 00:47:12,217 - INFO - Candidate Mean Stats: {'Max': np.float64(2.0), 'Min': np.float64(0.2783401130263285), 'Mean': np.float64(0.4895065778980184), 'Std': np.float64(0.07488448349811498)}
2024-12-07 00:47:12,218 - INFO - Candidate Std Stats: {'Max': np.float64(0.40339372225726133), 'Min': np.float64(0.0), 'Mean': np.float64(0.1059916780833197), 'Std': np.float64(0.04625421296866367)}
[I 2024-12-07 00:47:12,260] Trial 175 finished with value: 1.7999999999999998 and parameters: {'x_0_0': 'oo', 'x_0_1': 'ad', 'x_0_2': 'ad', 'x_1_0': 'ad', 'x_1_1': 'oo', 'x_1_2': 'ac'}. Best is trial 148 with value: 0.8333333333333333.
2024-12-07 00:47:12,951 - INFO - Candidate Mean Stats: {'Max': np.float64(2.0), 'Min': np.float64(0.24895680508224088), 'Mean': np.float64(0.49284749279500417), 'Std': np.float64(0.0758413267459663)}
2024-12-07 00:47:12,952 - INFO - Candidate Std Stats: {'Max': np.float64(1.4050824891322649), 'Min': np.float64(0.0), 'Mean': np.float64(0.11472591194339356), 'Std': np.float64(0.058894771466487965)}
[I 2024-12-07 00:47:12,994] Trial 175 finished with value: 1.9 and parameters: {'x_0_0': 'oo', 'x_0_1': 'ac', 'x_0_2': 'ab', 'x_1_0': 'ac', 'x_1_1': 'ac', 'x_1_2': 'ac'}. Best is trial 49 with value: 0.7999999999999999.
2024-12-07 00:47:20,398 - INFO - Candidate Mean Stats: {'Max': np.float64(2.0), 'Min': np.float64(0.2611391369120209), 'Mean': np.float64(0.4932771705403573), 'Std': np.float64(0.06970330258193251)}
2024-12-07 00:47:20,399 - INFO - Candidate Std Stats: {'Max': np.float64(0.3943209947263352), 'Min': np.float64(0.0), 'Mean': np.float64(0.10066654153513245), 'Std': np.float64(0.04364153178306732)}
[I 2024-12-07 00:47:20,438] Trial 175 finished with value: 1.5666666666666664 and parameters: {'x_0_0': 'bd', 'x_0_1': 'ab', 'x_0_2': 'oo', 'x_1_0': 'ac', 'x_1_1': 'ac', 'x_1_2': 'bd'}. Best is trial 118 with value: 0.8666666666666667.
2024-12-07 00:47:26,318 - INFO - Candidate Mean Stats: {'Max': np.float64(2.0), 'Min': np.float64(0.21832550181111307), 'Mean': np.float64(0.4842508110617589), 'Std': np.float64(0.06925297158326883)}
2024-12-07 00:47:26,318 - INFO - Candidate Std Stats: {'Max': np.float64(0.3783268513295777), 'Min': np.float64(0.0), 'Mean': np.float64(0.10381752627308281), 'Std': np.float64(0.042447871170562354)}
[I 2024-12-07 00:47:26,358] Trial 175 finished with value: 1.5777777777777777 and parameters: {'x_0_0': 'ab', 'x_0_1': 'cd', 'x_0_2': 'oo', 'x_1_0': 'bd', 'x_1_1': 'oo', 'x_1_2': 'cd'}. Best is trial 74 with value: 0.8222222222222222.
2024-12-07 00:47:32,036 - INFO - Candidate Mean Stats: {'Max': np.float64(2.0), 'Min': np.float64(0.2935417521598231), 'Mean': np.float64(0.5031729029802916), 'Std': np.float64(0.06859962941273716)}
2024-12-07 00:47:32,037 - INFO - Candidate Std Stats: {'Max': np.float64(0.4248545311973079), 'Min': np.float64(0.0), 'Mean': np.float64(0.10288997178773637), 'Std': np.float64(0.04186279666088696)}
[I 2024-12-07 00:47:32,079] Trial 176 finished with value: 1.2666666666666666 and parameters: {'x_0_0': 'ac', 'x_0_1': 'oo', 'x_0_2': 'bc', 'x_1_0': 'cd', 'x_1_1': 'bd', 'x_1_2': 'bd'}. Best is trial 148 with value: 0.8333333333333333.
2024-12-07 00:47:32,900 - INFO - Candidate Mean Stats: {'Max': np.float64(2.0), 'Min': np.float64(0.26017175312700597), 'Mean': np.float64(0.4818549588100502), 'Std': np.float64(0.0747459844959468)}
2024-12-07 00:47:32,900 - INFO - Candidate Std Stats: {'Max': np.float64(0.9354836892779484), 'Min': np.float64(0.0), 'Mean': np.float64(0.11515509749901794), 'Std': np.float64(0.05603485425637579)}
[I 2024-12-07 00:47:32,942] Trial 176 finished with value: 1.4666666666666666 and parameters: {'x_0_0': 'ac', 'x_0_1': 'cd', 'x_0_2': 'ac', 'x_1_0': 'oo', 'x_1_1': 'cd', 'x_1_2': 'ac'}. Best is trial 49 with value: 0.7999999999999999.
2024-12-07 00:47:40,199 - INFO - Candidate Mean Stats: {'Max': np.float64(2.0), 'Min': np.float64(0.2939376159249868), 'Mean': np.float64(0.4920046296041346), 'Std': np.float64(0.06906697158275381)}
2024-12-07 00:47:40,199 - INFO - Candidate Std Stats: {'Max': np.float64(1.0291072556615497), 'Min': np.float64(0.0), 'Mean': np.float64(0.10381199633942985), 'Std': np.float64(0.047625987091962654)}
[I 2024-12-07 00:47:40,241] Trial 176 finished with value: 1.9 and parameters: {'x_0_0': 'cd', 'x_0_1': 'ab', 'x_0_2': 'oo', 'x_1_0': 'cd', 'x_1_1': 'bd', 'x_1_2': 'ad'}. Best is trial 118 with value: 0.8666666666666667.
2024-12-07 00:47:46,502 - INFO - Candidate Mean Stats: {'Max': np.float64(2.0), 'Min': np.float64(0.2756491444135833), 'Mean': np.float64(0.49439293225826714), 'Std': np.float64(0.06907122843519581)}
2024-12-07 00:47:46,502 - INFO - Candidate Std Stats: {'Max': np.float64(0.5731901812751028), 'Min': np.float64(0.0), 'Mean': np.float64(0.1032121382987828), 'Std': np.float64(0.045138548027468015)}
[I 2024-12-07 00:47:46,545] Trial 176 finished with value: 1.0666666666666667 and parameters: {'x_0_0': 'ad', 'x_0_1': 'oo', 'x_0_2': 'ad', 'x_1_0': 'oo', 'x_1_1': 'ab', 'x_1_2': 'ab'}. Best is trial 74 with value: 0.8222222222222222.
2024-12-07 00:47:52,283 - INFO - Candidate Mean Stats: {'Max': np.float64(2.0), 'Min': np.float64(0.2267114419095726), 'Mean': np.float64(0.4858389652154484), 'Std': np.float64(0.0725790494877492)}
2024-12-07 00:47:52,284 - INFO - Candidate Std Stats: {'Max': np.float64(0.4178187836427523), 'Min': np.float64(0.0), 'Mean': np.float64(0.09936220438033962), 'Std': np.float64(0.04520389958214399)}
[I 2024-12-07 00:47:52,327] Trial 177 finished with value: 1.6666666666666665 and parameters: {'x_0_0': 'bc', 'x_0_1': 'bc', 'x_0_2': 'bd', 'x_1_0': 'ab', 'x_1_1': 'bc', 'x_1_2': 'cd'}. Best is trial 148 with value: 0.8333333333333333.
2024-12-07 00:47:52,989 - INFO - Candidate Mean Stats: {'Max': np.float64(2.0), 'Min': np.float64(0.20563901044605423), 'Mean': np.float64(0.4878245588531304), 'Std': np.float64(0.0724085726469297)}
2024-12-07 00:47:52,989 - INFO - Candidate Std Stats: {'Max': np.float64(0.34275095476356443), 'Min': np.float64(0.0), 'Mean': np.float64(0.11236055695637688), 'Std': np.float64(0.04298676878252559)}
[I 2024-12-07 00:47:53,035] Trial 177 finished with value: 0.8444444444444444 and parameters: {'x_0_0': 'ad', 'x_0_1': 'oo', 'x_0_2': 'oo', 'x_1_0': 'bd', 'x_1_1': 'oo', 'x_1_2': 'cd'}. Best is trial 49 with value: 0.7999999999999999.
2024-12-07 00:48:00,312 - INFO - Candidate Mean Stats: {'Max': np.float64(2.0), 'Min': np.float64(0.22520081913458764), 'Mean': np.float64(0.4817717000598043), 'Std': np.float64(0.0737203134009428)}
2024-12-07 00:48:00,312 - INFO - Candidate Std Stats: {'Max': np.float64(1.4489402283112929), 'Min': np.float64(0.0), 'Mean': np.float64(0.10133011325014075), 'Std': np.float64(0.044658793685334895)}
[I 2024-12-07 00:48:00,355] Trial 177 finished with value: 1.3666666666666667 and parameters: {'x_0_0': 'ac', 'x_0_1': 'cd', 'x_0_2': 'oo', 'x_1_0': 'oo', 'x_1_1': 'cd', 'x_1_2': 'ad'}. Best is trial 118 with value: 0.8666666666666667.
2024-12-07 00:48:06,362 - INFO - Candidate Mean Stats: {'Max': np.float64(2.0), 'Min': np.float64(0.26040554610043276), 'Mean': np.float64(0.4833307119911583), 'Std': np.float64(0.06825270020922847)}
2024-12-07 00:48:06,363 - INFO - Candidate Std Stats: {'Max': np.float64(0.5185442180800498), 'Min': np.float64(0.0), 'Mean': np.float64(0.10276400610000018), 'Std': np.float64(0.04376881711755796)}
[I 2024-12-07 00:48:06,405] Trial 177 finished with value: 1.6666666666666665 and parameters: {'x_0_0': 'bc', 'x_0_1': 'bd', 'x_0_2': 'cd', 'x_1_0': 'ab', 'x_1_1': 'bd', 'x_1_2': 'ab'}. Best is trial 74 with value: 0.8222222222222222.
2024-12-07 00:48:12,311 - INFO - Candidate Mean Stats: {'Max': np.float64(2.0), 'Min': np.float64(0.18140125899876983), 'Mean': np.float64(0.4925827029522858), 'Std': np.float64(0.07467531988999229)}
2024-12-07 00:48:12,312 - INFO - Candidate Std Stats: {'Max': np.float64(0.5268902646761113), 'Min': np.float64(0.0), 'Mean': np.float64(0.11085921941719105), 'Std': np.float64(0.04694176231345843)}
[I 2024-12-07 00:48:12,356] Trial 178 finished with value: 1.6666666666666665 and parameters: {'x_0_0': 'bc', 'x_0_1': 'bc', 'x_0_2': 'bd', 'x_1_0': 'bc', 'x_1_1': 'ab', 'x_1_2': 'ad'}. Best is trial 148 with value: 0.8333333333333333.
2024-12-07 00:48:13,283 - INFO - Candidate Mean Stats: {'Max': np.float64(2.0), 'Min': np.float64(0.20148649157633938), 'Mean': np.float64(0.4860946939135205), 'Std': np.float64(0.0673107912555904)}
2024-12-07 00:48:13,283 - INFO - Candidate Std Stats: {'Max': np.float64(0.5016181382371633), 'Min': np.float64(0.0), 'Mean': np.float64(0.10643304740368258), 'Std': np.float64(0.046025469251263704)}
[I 2024-12-07 00:48:13,326] Trial 178 finished with value: 1.5 and parameters: {'x_0_0': 'oo', 'x_0_1': 'oo', 'x_0_2': 'ac', 'x_1_0': 'ad', 'x_1_1': 'bd', 'x_1_2': 'ab'}. Best is trial 49 with value: 0.7999999999999999.
2024-12-07 00:48:20,400 - INFO - Candidate Mean Stats: {'Max': np.float64(2.0), 'Min': np.float64(0.21582911250794354), 'Mean': np.float64(0.4809359525916153), 'Std': np.float64(0.06812954505138459)}
2024-12-07 00:48:20,401 - INFO - Candidate Std Stats: {'Max': np.float64(0.44580459893598695), 'Min': np.float64(0.0), 'Mean': np.float64(0.10761796425190386), 'Std': np.float64(0.04425833183387268)}
[I 2024-12-07 00:48:20,441] Trial 178 finished with value: 1.4666666666666666 and parameters: {'x_0_0': 'bd', 'x_0_1': 'bd', 'x_0_2': 'ad', 'x_1_0': 'oo', 'x_1_1': 'ab', 'x_1_2': 'ac'}. Best is trial 118 with value: 0.8666666666666667.
2024-12-07 00:48:26,379 - INFO - Candidate Mean Stats: {'Max': np.float64(2.0), 'Min': np.float64(0.2571666769107612), 'Mean': np.float64(0.48430330115800735), 'Std': np.float64(0.06683606866010616)}
2024-12-07 00:48:26,379 - INFO - Candidate Std Stats: {'Max': np.float64(0.41152792484832945), 'Min': np.float64(0.0), 'Mean': np.float64(0.10147025005105997), 'Std': np.float64(0.04112957659994163)}
[I 2024-12-07 00:48:26,422] Trial 178 finished with value: 1.4444444444444444 and parameters: {'x_0_0': 'bd', 'x_0_1': 'ac', 'x_0_2': 'ab', 'x_1_0': 'bd', 'x_1_1': 'bc', 'x_1_2': 'ad'}. Best is trial 74 with value: 0.8222222222222222.
2024-12-07 00:48:32,281 - INFO - Candidate Mean Stats: {'Max': np.float64(2.0), 'Min': np.float64(0.24333925373218873), 'Mean': np.float64(0.4873280697406604), 'Std': np.float64(0.0756550747307539)}
2024-12-07 00:48:32,281 - INFO - Candidate Std Stats: {'Max': np.float64(1.3006869535996664), 'Min': np.float64(0.0), 'Mean': np.float64(0.11048779517313477), 'Std': np.float64(0.05128926457256261)}
[I 2024-12-07 00:48:32,322] Trial 179 finished with value: 1.5666666666666667 and parameters: {'x_0_0': 'ad', 'x_0_1': 'bd', 'x_0_2': 'ab', 'x_1_0': 'cd', 'x_1_1': 'oo', 'x_1_2': 'ab'}. Best is trial 148 with value: 0.8333333333333333.
2024-12-07 00:48:33,398 - INFO - Candidate Mean Stats: {'Max': np.float64(2.0), 'Min': np.float64(0.21890089026988857), 'Mean': np.float64(0.490091071131107), 'Std': np.float64(0.0704906333367334)}
2024-12-07 00:48:33,398 - INFO - Candidate Std Stats: {'Max': np.float64(0.5851839602457732), 'Min': np.float64(0.0), 'Mean': np.float64(0.09592342000995284), 'Std': np.float64(0.04354985016399604)}
[I 2024-12-07 00:48:33,440] Trial 179 finished with value: 1.5555555555555556 and parameters: {'x_0_0': 'bc', 'x_0_1': 'ab', 'x_0_2': 'ac', 'x_1_0': 'bd', 'x_1_1': 'ab', 'x_1_2': 'ab'}. Best is trial 49 with value: 0.7999999999999999.
2024-12-07 00:48:40,704 - INFO - Candidate Mean Stats: {'Max': np.float64(2.0), 'Min': np.float64(0.2873981434905547), 'Mean': np.float64(0.4892752153263813), 'Std': np.float64(0.07287730683194628)}
2024-12-07 00:48:40,705 - INFO - Candidate Std Stats: {'Max': np.float64(1.548140637669721), 'Min': np.float64(0.0), 'Mean': np.float64(0.10349054904854271), 'Std': np.float64(0.04485953029114445)}
[I 2024-12-07 00:48:40,745] Trial 179 finished with value: 0.8333333333333333 and parameters: {'x_0_0': 'ad', 'x_0_1': 'oo', 'x_0_2': 'ad', 'x_1_0': 'bc', 'x_1_1': 'ab', 'x_1_2': 'oo'}. Best is trial 179 with value: 0.8333333333333333.
2024-12-07 00:48:46,609 - INFO - Candidate Mean Stats: {'Max': np.float64(2.0), 'Min': np.float64(0.18606252359744527), 'Mean': np.float64(0.4835791694093659), 'Std': np.float64(0.07207552513388629)}
2024-12-07 00:48:46,609 - INFO - Candidate Std Stats: {'Max': np.float64(0.517579710295235), 'Min': np.float64(0.0), 'Mean': np.float64(0.10816060085291841), 'Std': np.float64(0.04900354205398652)}
[I 2024-12-07 00:48:46,652] Trial 179 finished with value: 1.6666666666666665 and parameters: {'x_0_0': 'bc', 'x_0_1': 'bd', 'x_0_2': 'bd', 'x_1_0': 'bd', 'x_1_1': 'cd', 'x_1_2': 'ab'}. Best is trial 74 with value: 0.8222222222222222.
2024-12-07 00:48:52,575 - INFO - Candidate Mean Stats: {'Max': np.float64(2.0), 'Min': np.float64(0.2739883122226293), 'Mean': np.float64(0.4978165883461906), 'Std': np.float64(0.07130616276975109)}
2024-12-07 00:48:52,576 - INFO - Candidate Std Stats: {'Max': np.float64(0.4659780787505516), 'Min': np.float64(0.0), 'Mean': np.float64(0.10036670368028959), 'Std': np.float64(0.041732676287230576)}
