[I 2024-12-06 23:37:36,549] Trial 258 finished with value: 1.2857142857142856 and parameters: {'x_0_0': 'bd', 'x_0_1': 'ac', 'x_1_0': 'bd', 'x_1_1': 'ad'}. Best is trial 23 with value: 0.5.
2024-12-06 23:37:36,678 - INFO - Candidate Mean Stats: {'Max': np.float64(2.815299841792279), 'Min': np.float64(-0.8233889850129004), 'Mean': np.float64(0.5551180016387129), 'Std': np.float64(0.5760617010189927)}
2024-12-06 23:37:36,678 - INFO - Candidate Std Stats: {'Max': np.float64(1.6881234385200572), 'Min': np.float64(0.0), 'Mean': np.float64(0.5433839654438953), 'Std': np.float64(0.2906859895440619)}
2024-12-06 23:37:36,681 - INFO - Candidate Mean Stats: {'Max': np.float64(2.7844794039169627), 'Min': np.float64(-0.773819458006796), 'Mean': np.float64(0.5401506157024099), 'Std': np.float64(0.5367069085825467)}
2024-12-06 23:37:36,681 - INFO - Candidate Std Stats: {'Max': np.float64(1.787607904262266), 'Min': np.float64(0.0), 'Mean': np.float64(0.5772402677239211), 'Std': np.float64(0.30997755829862694)}
[I 2024-12-06 23:37:36,692] Trial 260 finished with value: 1.4464285714285714 and parameters: {'x_0_0': 'ad', 'x_0_1': 'ac', 'x_1_0': 'cd', 'x_1_1': 'oo'}. Best is trial 165 with value: 0.5.
2024-12-06 23:37:36,693 - INFO - Candidate Mean Stats: {'Max': np.float64(2.8074831330435557), 'Min': np.float64(-0.7465062771883374), 'Mean': np.float64(0.5525004008359251), 'Std': np.float64(0.5123117008068631)}
2024-12-06 23:37:36,693 - INFO - Candidate Std Stats: {'Max': np.float64(1.7082621048162645), 'Min': np.float64(0.0), 'Mean': np.float64(0.5375933510505949), 'Std': np.float64(0.30706116122912197)}
[I 2024-12-06 23:37:36,694] Trial 260 finished with value: 1.375 and parameters: {'x_0_0': 'oo', 'x_0_1': 'oo', 'x_1_0': 'ac', 'x_1_1': 'cd'}. Best is trial 76 with value: 0.5.
[I 2024-12-06 23:37:36,708] Trial 260 finished with value: 1.0 and parameters: {'x_0_0': 'oo', 'x_0_1': 'oo', 'x_1_0': 'oo', 'x_1_1': 'oo'}. Best is trial 63 with value: 0.5.
2024-12-06 23:37:36,910 - INFO - Candidate Mean Stats: {'Max': np.float64(2.765236273154624), 'Min': np.float64(-1.0863794985373638), 'Mean': np.float64(0.49469754600114946), 'Std': np.float64(0.6370091354979842)}
2024-12-06 23:37:36,910 - INFO - Candidate Std Stats: {'Max': np.float64(1.6339190875692662), 'Min': np.float64(0.0), 'Mean': np.float64(0.5991790458634808), 'Std': np.float64(0.31906533277047544)}
[I 2024-12-06 23:37:36,924] Trial 259 finished with value: 1.2142857142857144 and parameters: {'x_0_0': 'ab', 'x_0_1': 'oo', 'x_1_0': 'cd', 'x_1_1': 'bc'}. Best is trial 23 with value: 0.5.
2024-12-06 23:37:37,050 - INFO - Candidate Mean Stats: {'Max': np.float64(3.2245894994919397), 'Min': np.float64(-0.9439850216434523), 'Mean': np.float64(0.6700998080382605), 'Std': np.float64(0.5146026904158185)}
2024-12-06 23:37:37,050 - INFO - Candidate Std Stats: {'Max': np.float64(1.7336277394615598), 'Min': np.float64(0.0), 'Mean': np.float64(0.566893383579925), 'Std': np.float64(0.3169957466799352)}
2024-12-06 23:37:37,052 - INFO - Candidate Mean Stats: {'Max': np.float64(2.71736301835542), 'Min': np.float64(-0.8115234450948872), 'Mean': np.float64(0.6241404284850293), 'Std': np.float64(0.5098594653276551)}
2024-12-06 23:37:37,052 - INFO - Candidate Std Stats: {'Max': np.float64(1.4313555049968885), 'Min': np.float64(0.0), 'Mean': np.float64(0.49126319874582297), 'Std': np.float64(0.2643945647346327)}
[I 2024-12-06 23:37:37,064] Trial 261 finished with value: 1.0714285714285714 and parameters: {'x_0_0': 'bd', 'x_0_1': 'oo', 'x_1_0': 'cd', 'x_1_1': 'ac'}. Best is trial 165 with value: 0.5.
[I 2024-12-06 23:37:37,065] Trial 261 finished with value: 1.0714285714285714 and parameters: {'x_0_0': 'ac', 'x_0_1': 'oo', 'x_1_0': 'cd', 'x_1_1': 'ad'}. Best is trial 76 with value: 0.5.
2024-12-06 23:37:37,065 - INFO - Candidate Mean Stats: {'Max': np.float64(2.525487635211667), 'Min': np.float64(-0.8073674541286291), 'Mean': np.float64(0.5524085732474195), 'Std': np.float64(0.4981148562549202)}
2024-12-06 23:37:37,065 - INFO - Candidate Std Stats: {'Max': np.float64(1.5293032633414416), 'Min': np.float64(0.0), 'Mean': np.float64(0.5740219860726085), 'Std': np.float64(0.30404651487571194)}
[I 2024-12-06 23:37:37,080] Trial 261 finished with value: 1.0714285714285714 and parameters: {'x_0_0': 'bc', 'x_0_1': 'oo', 'x_1_0': 'ad', 'x_1_1': 'ac'}. Best is trial 63 with value: 0.5.
2024-12-06 23:37:37,283 - INFO - Candidate Mean Stats: {'Max': np.float64(2.7054980344291084), 'Min': np.float64(-1.1283679610539965), 'Mean': np.float64(0.6011129244110506), 'Std': np.float64(0.5480298332138998)}
2024-12-06 23:37:37,284 - INFO - Candidate Std Stats: {'Max': np.float64(1.7382082067681492), 'Min': np.float64(0.0), 'Mean': np.float64(0.5849854173616783), 'Std': np.float64(0.3191984119063551)}
[I 2024-12-06 23:37:37,297] Trial 260 finished with value: 1.0714285714285714 and parameters: {'x_0_0': 'ad', 'x_0_1': 'oo', 'x_1_0': 'ad', 'x_1_1': 'bd'}. Best is trial 23 with value: 0.5.
2024-12-06 23:37:37,421 - INFO - Candidate Mean Stats: {'Max': np.float64(3.0705192020529757), 'Min': np.float64(-1.0126742408212999), 'Mean': np.float64(0.5418374405661653), 'Std': np.float64(0.5461233090550024)}
2024-12-06 23:37:37,421 - INFO - Candidate Std Stats: {'Max': np.float64(1.973064542606648), 'Min': np.float64(0.0), 'Mean': np.float64(0.5914529071604894), 'Std': np.float64(0.32423277162021424)}
2024-12-06 23:37:37,422 - INFO - Candidate Mean Stats: {'Max': np.float64(2.973104362373609), 'Min': np.float64(-0.9114953095632755), 'Mean': np.float64(0.5212268164321718), 'Std': np.float64(0.5785649907642818)}
2024-12-06 23:37:37,423 - INFO - Candidate Std Stats: {'Max': np.float64(1.9677412283918072), 'Min': np.float64(0.0), 'Mean': np.float64(0.6075107188053409), 'Std': np.float64(0.3446154798312323)}
[I 2024-12-06 23:37:37,435] Trial 262 finished with value: 1.0714285714285714 and parameters: {'x_0_0': 'ad', 'x_0_1': 'oo', 'x_1_0': 'ac', 'x_1_1': 'cd'}. Best is trial 165 with value: 0.5.
[I 2024-12-06 23:37:37,436] Trial 262 finished with value: 1.5714285714285714 and parameters: {'x_0_0': 'ad', 'x_0_1': 'bd', 'x_1_0': 'cd', 'x_1_1': 'bd'}. Best is trial 76 with value: 0.5.
2024-12-06 23:37:37,437 - INFO - Candidate Mean Stats: {'Max': np.float64(2.815637346022929), 'Min': np.float64(-1.0295174187524125), 'Mean': np.float64(0.6282886477943684), 'Std': np.float64(0.5129467698780624)}
2024-12-06 23:37:37,437 - INFO - Candidate Std Stats: {'Max': np.float64(1.833900490469412), 'Min': np.float64(0.0), 'Mean': np.float64(0.5608049800368405), 'Std': np.float64(0.3016082963817936)}
[I 2024-12-06 23:37:37,451] Trial 262 finished with value: 1.0714285714285714 and parameters: {'x_0_0': 'ad', 'x_0_1': 'oo', 'x_1_0': 'ac', 'x_1_1': 'ac'}. Best is trial 63 with value: 0.5.
2024-12-06 23:37:37,657 - INFO - Candidate Mean Stats: {'Max': np.float64(3.039715650277519), 'Min': np.float64(-0.7309659379628026), 'Mean': np.float64(0.5650236398596142), 'Std': np.float64(0.5662352213626698)}
2024-12-06 23:37:37,657 - INFO - Candidate Std Stats: {'Max': np.float64(1.644182539514271), 'Min': np.float64(0.0), 'Mean': np.float64(0.5719076940093215), 'Std': np.float64(0.30936197010101707)}
[I 2024-12-06 23:37:37,670] Trial 261 finished with value: 1.5 and parameters: {'x_0_0': 'cd', 'x_0_1': 'oo', 'x_1_0': 'ad', 'x_1_1': 'ac'}. Best is trial 23 with value: 0.5.
2024-12-06 23:37:37,795 - INFO - Candidate Mean Stats: {'Max': np.float64(3.188047357832115), 'Min': np.float64(-1.1129717259288632), 'Mean': np.float64(0.5683949803210739), 'Std': np.float64(0.5979863888751629)}
2024-12-06 23:37:37,796 - INFO - Candidate Std Stats: {'Max': np.float64(1.680282914163612), 'Min': np.float64(0.0), 'Mean': np.float64(0.5504060639530041), 'Std': np.float64(0.2901979376326081)}
2024-12-06 23:37:37,796 - INFO - Candidate Mean Stats: {'Max': np.float64(3.1712880147189537), 'Min': np.float64(-0.6368430233049331), 'Mean': np.float64(0.6319571861639173), 'Std': np.float64(0.5481801737627297)}
2024-12-06 23:37:37,796 - INFO - Candidate Std Stats: {'Max': np.float64(1.484795544540089), 'Min': np.float64(0.0), 'Mean': np.float64(0.49184095748631473), 'Std': np.float64(0.26288300487492755)}
[I 2024-12-06 23:37:37,810] Trial 263 finished with value: 1.0714285714285714 and parameters: {'x_0_0': 'bd', 'x_0_1': 'oo', 'x_1_0': 'ad', 'x_1_1': 'cd'}. Best is trial 165 with value: 0.5.
[I 2024-12-06 23:37:37,810] Trial 263 finished with value: 1.0 and parameters: {'x_0_0': 'ac', 'x_0_1': 'ad', 'x_1_0': 'bc', 'x_1_1': 'bc'}. Best is trial 76 with value: 0.5.
2024-12-06 23:37:37,811 - INFO - Candidate Mean Stats: {'Max': np.float64(2.8438856815022695), 'Min': np.float64(-1.1230861954884843), 'Mean': np.float64(0.6092531465570741), 'Std': np.float64(0.500708614580141)}
2024-12-06 23:37:37,811 - INFO - Candidate Std Stats: {'Max': np.float64(1.4895041147363497), 'Min': np.float64(0.0), 'Mean': np.float64(0.4407988809114837), 'Std': np.float64(0.26575541069193265)}
[I 2024-12-06 23:37:37,825] Trial 263 finished with value: 1.0714285714285714 and parameters: {'x_0_0': 'bc', 'x_0_1': 'oo', 'x_1_0': 'cd', 'x_1_1': 'bd'}. Best is trial 63 with value: 0.5.
2024-12-06 23:37:38,033 - INFO - Candidate Mean Stats: {'Max': np.float64(3.5194418653942328), 'Min': np.float64(-0.7819768347627191), 'Mean': np.float64(0.6551101629317144), 'Std': np.float64(0.5506576539685246)}
2024-12-06 23:37:38,033 - INFO - Candidate Std Stats: {'Max': np.float64(1.7673268833996612), 'Min': np.float64(0.0), 'Mean': np.float64(0.5257421908482874), 'Std': np.float64(0.2816122545585523)}
[I 2024-12-06 23:37:38,047] Trial 262 finished with value: 0.8214285714285714 and parameters: {'x_0_0': 'ad', 'x_0_1': 'oo', 'x_1_0': 'oo', 'x_1_1': 'bd'}. Best is trial 23 with value: 0.5.
2024-12-06 23:37:38,166 - INFO - Candidate Mean Stats: {'Max': np.float64(2.8725589703551586), 'Min': np.float64(-1.118402758185725), 'Mean': np.float64(0.5281771858432927), 'Std': np.float64(0.5750161415852566)}
2024-12-06 23:37:38,166 - INFO - Candidate Std Stats: {'Max': np.float64(2.216212393690047), 'Min': np.float64(0.0), 'Mean': np.float64(0.6418907292035052), 'Std': np.float64(0.35666493711558406)}
2024-12-06 23:37:38,168 - INFO - Candidate Mean Stats: {'Max': np.float64(2.8304279159128884), 'Min': np.float64(-0.9104930851996811), 'Mean': np.float64(0.5774365705178247), 'Std': np.float64(0.5358264427830419)}
2024-12-06 23:37:38,168 - INFO - Candidate Std Stats: {'Max': np.float64(1.7021262704348359), 'Min': np.float64(0.0), 'Mean': np.float64(0.5712171781464802), 'Std': np.float64(0.329855484518433)}
[I 2024-12-06 23:37:38,180] Trial 264 finished with value: 1.5714285714285714 and parameters: {'x_0_0': 'bd', 'x_0_1': 'ac', 'x_1_0': 'ad', 'x_1_1': 'bd'}. Best is trial 165 with value: 0.5.
[I 2024-12-06 23:37:38,182] Trial 264 finished with value: 1.2142857142857144 and parameters: {'x_0_0': 'ab', 'x_0_1': 'oo', 'x_1_0': 'bc', 'x_1_1': 'ab'}. Best is trial 76 with value: 0.5.
2024-12-06 23:37:38,184 - INFO - Candidate Mean Stats: {'Max': np.float64(2.5776348063764787), 'Min': np.float64(-0.7859850567040676), 'Mean': np.float64(0.5774311828573219), 'Std': np.float64(0.5098476697834838)}
2024-12-06 23:37:38,184 - INFO - Candidate Std Stats: {'Max': np.float64(1.7250264686467571), 'Min': np.float64(0.0), 'Mean': np.float64(0.5393594223679072), 'Std': np.float64(0.29512471339175644)}
[I 2024-12-06 23:37:38,198] Trial 264 finished with value: 1.3214285714285714 and parameters: {'x_0_0': 'ad', 'x_0_1': 'bc', 'x_1_0': 'oo', 'x_1_1': 'ad'}. Best is trial 63 with value: 0.5.
2024-12-06 23:37:38,408 - INFO - Candidate Mean Stats: {'Max': np.float64(2.9623704830742597), 'Min': np.float64(-1.0255683510430935), 'Mean': np.float64(0.5494117458730006), 'Std': np.float64(0.6303991557266175)}
2024-12-06 23:37:38,408 - INFO - Candidate Std Stats: {'Max': np.float64(1.6622862183135543), 'Min': np.float64(0.0), 'Mean': np.float64(0.5986788243945669), 'Std': np.float64(0.32013115685423393)}
[I 2024-12-06 23:37:38,421] Trial 263 finished with value: 1.2142857142857144 and parameters: {'x_0_0': 'ab', 'x_0_1': 'oo', 'x_1_0': 'bd', 'x_1_1': 'bc'}. Best is trial 23 with value: 0.5.
2024-12-06 23:37:38,538 - INFO - Candidate Mean Stats: {'Max': np.float64(3.2701215262145595), 'Min': np.float64(-0.7341729823834303), 'Mean': np.float64(0.5819388860263744), 'Std': np.float64(0.5685084377798999)}
2024-12-06 23:37:38,538 - INFO - Candidate Std Stats: {'Max': np.float64(1.6003379591176645), 'Min': np.float64(0.0), 'Mean': np.float64(0.564152110624954), 'Std': np.float64(0.2988089535100422)}
2024-12-06 23:37:38,544 - INFO - Candidate Mean Stats: {'Max': np.float64(2.9367831832140494), 'Min': np.float64(-0.7239667398634484), 'Mean': np.float64(0.5795275617078486), 'Std': np.float64(0.5074414705295628)}
2024-12-06 23:37:38,544 - INFO - Candidate Std Stats: {'Max': np.float64(1.9042665357701503), 'Min': np.float64(0.0), 'Mean': np.float64(0.5299583548483253), 'Std': np.float64(0.3067803461118997)}
[I 2024-12-06 23:37:38,552] Trial 265 finished with value: 1.3035714285714286 and parameters: {'x_0_0': 'bc', 'x_0_1': 'ab', 'x_1_0': 'ac', 'x_1_1': 'oo'}. Best is trial 165 with value: 0.5.
2024-12-06 23:37:38,555 - INFO - Candidate Mean Stats: {'Max': np.float64(3.453213197987929), 'Min': np.float64(-0.7645627727606594), 'Mean': np.float64(0.6463946647138377), 'Std': np.float64(0.5218268202648213)}
2024-12-06 23:37:38,555 - INFO - Candidate Std Stats: {'Max': np.float64(2.00271189276709), 'Min': np.float64(0.0), 'Mean': np.float64(0.5639594301377243), 'Std': np.float64(0.31875767324175613)}
[I 2024-12-06 23:37:38,558] Trial 265 finished with value: 1.2857142857142856 and parameters: {'x_0_0': 'ac', 'x_0_1': 'ad', 'x_1_0': 'ab', 'x_1_1': 'cd'}. Best is trial 76 with value: 0.5.
[I 2024-12-06 23:37:38,569] Trial 265 finished with value: 1.0714285714285714 and parameters: {'x_0_0': 'bc', 'x_0_1': 'oo', 'x_1_0': 'bd', 'x_1_1': 'bd'}. Best is trial 63 with value: 0.5.
2024-12-06 23:37:38,784 - INFO - Candidate Mean Stats: {'Max': np.float64(3.330890547766072), 'Min': np.float64(-0.7260485790082817), 'Mean': np.float64(0.6466097358510154), 'Std': np.float64(0.5037073150908973)}
2024-12-06 23:37:38,784 - INFO - Candidate Std Stats: {'Max': np.float64(1.4882168931244388), 'Min': np.float64(0.0), 'Mean': np.float64(0.5212401363438574), 'Std': np.float64(0.284417854603923)}
[I 2024-12-06 23:37:38,798] Trial 264 finished with value: 1.0714285714285714 and parameters: {'x_0_0': 'ad', 'x_0_1': 'oo', 'x_1_0': 'ac', 'x_1_1': 'bd'}. Best is trial 23 with value: 0.5.
2024-12-06 23:37:38,908 - INFO - Candidate Mean Stats: {'Max': np.float64(2.9724959721229074), 'Min': np.float64(-0.7707917995942969), 'Mean': np.float64(0.5858047364785002), 'Std': np.float64(0.5258217721642986)}
2024-12-06 23:37:38,908 - INFO - Candidate Std Stats: {'Max': np.float64(1.7151782309159507), 'Min': np.float64(0.0), 'Mean': np.float64(0.5873149498674305), 'Std': np.float64(0.326971068618853)}
2024-12-06 23:37:38,915 - INFO - Candidate Mean Stats: {'Max': np.float64(2.937890834084892), 'Min': np.float64(-1.020122076541192), 'Mean': np.float64(0.5797857189705864), 'Std': np.float64(0.5625719495432304)}
2024-12-06 23:37:38,915 - INFO - Candidate Std Stats: {'Max': np.float64(1.985196487921504), 'Min': np.float64(0.0), 'Mean': np.float64(0.5927213310056472), 'Std': np.float64(0.332910442184915)}
[I 2024-12-06 23:37:38,923] Trial 266 finished with value: 1.0714285714285714 and parameters: {'x_0_0': 'ac', 'x_0_1': 'oo', 'x_1_0': 'ab', 'x_1_1': 'ab'}. Best is trial 165 with value: 0.5.
2024-12-06 23:37:38,927 - INFO - Candidate Mean Stats: {'Max': np.float64(3.0128722149192324), 'Min': np.float64(-1.3502159310998347), 'Mean': np.float64(0.541804733345757), 'Std': np.float64(0.5755966890441101)}
2024-12-06 23:37:38,927 - INFO - Candidate Std Stats: {'Max': np.float64(1.9220438585501884), 'Min': np.float64(0.0), 'Mean': np.float64(0.5933002808529907), 'Std': np.float64(0.3364784316224585)}
[I 2024-12-06 23:37:38,929] Trial 266 finished with value: 1.0714285714285714 and parameters: {'x_0_0': 'bc', 'x_0_1': 'oo', 'x_1_0': 'ac', 'x_1_1': 'bc'}. Best is trial 76 with value: 0.5.
[I 2024-12-06 23:37:38,941] Trial 266 finished with value: 1.0714285714285714 and parameters: {'x_0_0': 'ad', 'x_0_1': 'oo', 'x_1_0': 'ad', 'x_1_1': 'ac'}. Best is trial 63 with value: 0.5.
2024-12-06 23:37:39,160 - INFO - Candidate Mean Stats: {'Max': np.float64(2.984551945427394), 'Min': np.float64(-0.7361442256571593), 'Mean': np.float64(0.6296088677198628), 'Std': np.float64(0.5566987904810642)}
2024-12-06 23:37:39,160 - INFO - Candidate Std Stats: {'Max': np.float64(1.8561213382815027), 'Min': np.float64(0.0), 'Mean': np.float64(0.5214327767306146), 'Std': np.float64(0.3050828083568522)}
[I 2024-12-06 23:37:39,174] Trial 265 finished with value: 0.9107142857142857 and parameters: {'x_0_0': 'ac', 'x_0_1': 'ad', 'x_1_0': 'oo', 'x_1_1': 'oo'}. Best is trial 23 with value: 0.5.
2024-12-06 23:37:39,281 - INFO - Candidate Mean Stats: {'Max': np.float64(3.066027978916951), 'Min': np.float64(-0.9967080870986311), 'Mean': np.float64(0.6547093196632078), 'Std': np.float64(0.5423648768177487)}
2024-12-06 23:37:39,281 - INFO - Candidate Std Stats: {'Max': np.float64(1.61914238065374), 'Min': np.float64(0.0), 'Mean': np.float64(0.5974793637751575), 'Std': np.float64(0.32458860406782114)}
2024-12-06 23:37:39,286 - INFO - Candidate Mean Stats: {'Max': np.float64(2.6743582958592764), 'Min': np.float64(-1.2150480567420825), 'Mean': np.float64(0.5377770404970161), 'Std': np.float64(0.5972915378465993)}
2024-12-06 23:37:39,286 - INFO - Candidate Std Stats: {'Max': np.float64(1.5941304213409133), 'Min': np.float64(0.0), 'Mean': np.float64(0.6282923486044836), 'Std': np.float64(0.32798281626000503)}
[I 2024-12-06 23:37:39,294] Trial 267 finished with value: 1.0714285714285714 and parameters: {'x_0_0': 'ac', 'x_0_1': 'oo', 'x_1_0': 'cd', 'x_1_1': 'cd'}. Best is trial 165 with value: 0.5.
2024-12-06 23:37:39,299 - INFO - Candidate Mean Stats: {'Max': np.float64(3.136354164093564), 'Min': np.float64(-0.8310115889613137), 'Mean': np.float64(0.6943453640072038), 'Std': np.float64(0.47815788894416894)}
[I 2024-12-06 23:37:39,300] Trial 267 finished with value: 1.0892857142857144 and parameters: {'x_0_0': 'ab', 'x_0_1': 'oo', 'x_1_0': 'ad', 'x_1_1': 'oo'}. Best is trial 76 with value: 0.5.
2024-12-06 23:37:39,300 - INFO - Candidate Std Stats: {'Max': np.float64(1.4699248521893005), 'Min': np.float64(0.0), 'Mean': np.float64(0.4637489015302915), 'Std': np.float64(0.2656772198599648)}
[I 2024-12-06 23:37:39,313] Trial 267 finished with value: 1.125 and parameters: {'x_0_0': 'oo', 'x_0_1': 'oo', 'x_1_0': 'oo', 'x_1_1': 'ad'}. Best is trial 63 with value: 0.5.
2024-12-06 23:37:39,532 - INFO - Candidate Mean Stats: {'Max': np.float64(2.895928832248715), 'Min': np.float64(-0.8671779885610166), 'Mean': np.float64(0.5779011704785669), 'Std': np.float64(0.5709719126485586)}
2024-12-06 23:37:39,532 - INFO - Candidate Std Stats: {'Max': np.float64(1.544038674015398), 'Min': np.float64(0.0), 'Mean': np.float64(0.5651439166770054), 'Std': np.float64(0.296663598504785)}
[I 2024-12-06 23:37:39,546] Trial 266 finished with value: 0.9107142857142857 and parameters: {'x_0_0': 'bc', 'x_0_1': 'ad', 'x_1_0': 'oo', 'x_1_1': 'oo'}. Best is trial 23 with value: 0.5.
2024-12-06 23:37:39,652 - INFO - Candidate Mean Stats: {'Max': np.float64(2.9125683881329234), 'Min': np.float64(-0.9977578040666348), 'Mean': np.float64(0.5260424633729457), 'Std': np.float64(0.5953591447917825)}
2024-12-06 23:37:39,653 - INFO - Candidate Std Stats: {'Max': np.float64(2.474788446580967), 'Min': np.float64(0.0), 'Mean': np.float64(0.5998221644288653), 'Std': np.float64(0.35836544410417703)}
2024-12-06 23:37:39,657 - INFO - Candidate Mean Stats: {'Max': np.float64(3.1196510906438983), 'Min': np.float64(-0.707045007560313), 'Mean': np.float64(0.5487431882521415), 'Std': np.float64(0.557649927583827)}
2024-12-06 23:37:39,657 - INFO - Candidate Std Stats: {'Max': np.float64(1.426332386992015), 'Min': np.float64(0.0), 'Mean': np.float64(0.5617741271718253), 'Std': np.float64(0.29818477838385127)}
[I 2024-12-06 23:37:39,667] Trial 268 finished with value: 2.0 and parameters: {'x_0_0': 'cd', 'x_0_1': 'ab', 'x_1_0': 'cd', 'x_1_1': 'ab'}. Best is trial 165 with value: 0.5.
[I 2024-12-06 23:37:39,671] Trial 268 finished with value: 1.5 and parameters: {'x_0_0': 'cd', 'x_0_1': 'oo', 'x_1_0': 'cd', 'x_1_1': 'bc'}. Best is trial 76 with value: 0.5.
2024-12-06 23:37:39,671 - INFO - Candidate Mean Stats: {'Max': np.float64(2.8074727568480995), 'Min': np.float64(-0.9993651514026578), 'Mean': np.float64(0.5838045729084768), 'Std': np.float64(0.5362102832653349)}
2024-12-06 23:37:39,671 - INFO - Candidate Std Stats: {'Max': np.float64(1.743516181529374), 'Min': np.float64(0.0), 'Mean': np.float64(0.575228006439539), 'Std': np.float64(0.3187719253490079)}
[I 2024-12-06 23:37:39,685] Trial 268 finished with value: 0.9285714285714286 and parameters: {'x_0_0': 'bd', 'x_0_1': 'oo', 'x_1_0': 'ab', 'x_1_1': 'bd'}. Best is trial 63 with value: 0.5.
2024-12-06 23:37:39,907 - INFO - Candidate Mean Stats: {'Max': np.float64(2.850166166739343), 'Min': np.float64(-1.1210752317659063), 'Mean': np.float64(0.4853879805996252), 'Std': np.float64(0.6361677657681974)}
2024-12-06 23:37:39,907 - INFO - Candidate Std Stats: {'Max': np.float64(1.7651660914616227), 'Min': np.float64(0.0), 'Mean': np.float64(0.6461629489086599), 'Std': np.float64(0.32956413461796263)}
