[I 2024-12-06 23:37:33,188] Trial 249 finished with value: 1.0714285714285714 and parameters: {'x_0_0': 'bc', 'x_0_1': 'oo', 'x_1_0': 'ac', 'x_1_1': 'bc'}. Best is trial 23 with value: 0.5.
2024-12-06 23:37:33,329 - INFO - Candidate Mean Stats: {'Max': np.float64(3.0379557022224324), 'Min': np.float64(-1.0679309249719935), 'Mean': np.float64(0.5680199408918064), 'Std': np.float64(0.622849466871493)}
2024-12-06 23:37:33,329 - INFO - Candidate Std Stats: {'Max': np.float64(1.4801186348832058), 'Min': np.float64(0.0), 'Mean': np.float64(0.5778474972088811), 'Std': np.float64(0.2952586517544151)}
2024-12-06 23:37:33,339 - INFO - Candidate Mean Stats: {'Max': np.float64(2.841313770226229), 'Min': np.float64(-1.040360737445763), 'Mean': np.float64(0.5259173989751408), 'Std': np.float64(0.5319587136180527)}
2024-12-06 23:37:33,339 - INFO - Candidate Std Stats: {'Max': np.float64(1.725507316483056), 'Min': np.float64(0.0), 'Mean': np.float64(0.5646162989203112), 'Std': np.float64(0.2969864357313413)}
[I 2024-12-06 23:37:33,344] Trial 251 finished with value: 1.125 and parameters: {'x_0_0': 'oo', 'x_0_1': 'oo', 'x_1_0': 'oo', 'x_1_1': 'bd'}. Best is trial 165 with value: 0.5.
2024-12-06 23:37:33,352 - INFO - Candidate Mean Stats: {'Max': np.float64(2.6554970493731647), 'Min': np.float64(-0.9258521322962696), 'Mean': np.float64(0.48900655448674424), 'Std': np.float64(0.5540643927080164)}
2024-12-06 23:37:33,352 - INFO - Candidate Std Stats: {'Max': np.float64(1.4990785131308406), 'Min': np.float64(0.0), 'Mean': np.float64(0.570516061283134), 'Std': np.float64(0.2970689504117278)}
[I 2024-12-06 23:37:33,353] Trial 251 finished with value: 1.0714285714285714 and parameters: {'x_0_0': 'bd', 'x_0_1': 'oo', 'x_1_0': 'cd', 'x_1_1': 'ab'}. Best is trial 76 with value: 0.5.
[I 2024-12-06 23:37:33,366] Trial 251 finished with value: 1.7142857142857144 and parameters: {'x_0_0': 'ab', 'x_0_1': 'bc', 'x_1_0': 'bd', 'x_1_1': 'bc'}. Best is trial 63 with value: 0.5.
2024-12-06 23:37:33,544 - INFO - Candidate Mean Stats: {'Max': np.float64(3.578353351146118), 'Min': np.float64(-0.8481504857208522), 'Mean': np.float64(0.554748595965967), 'Std': np.float64(0.5853768272507516)}
2024-12-06 23:37:33,544 - INFO - Candidate Std Stats: {'Max': np.float64(1.5291575987989543), 'Min': np.float64(0.0), 'Mean': np.float64(0.5232114430489757), 'Std': np.float64(0.2807525341905025)}
[I 2024-12-06 23:37:33,558] Trial 250 finished with value: 0.9464285714285714 and parameters: {'x_0_0': 'ac', 'x_0_1': 'oo', 'x_1_0': 'ac', 'x_1_1': 'oo'}. Best is trial 23 with value: 0.5.
2024-12-06 23:37:33,701 - INFO - Candidate Mean Stats: {'Max': np.float64(3.029180476472887), 'Min': np.float64(-1.2253706427731523), 'Mean': np.float64(0.5332256558984114), 'Std': np.float64(0.5827757742084629)}
2024-12-06 23:37:33,701 - INFO - Candidate Std Stats: {'Max': np.float64(1.6477903527982398), 'Min': np.float64(0.0), 'Mean': np.float64(0.6071219891470655), 'Std': np.float64(0.3318874994879804)}
2024-12-06 23:37:33,710 - INFO - Candidate Mean Stats: {'Max': np.float64(2.6003385374658468), 'Min': np.float64(-0.78970381423119), 'Mean': np.float64(0.6072417332532102), 'Std': np.float64(0.5245534646621468)}
2024-12-06 23:37:33,710 - INFO - Candidate Std Stats: {'Max': np.float64(1.5243276980677622), 'Min': np.float64(0.0), 'Mean': np.float64(0.5462038966054568), 'Std': np.float64(0.2916979287870605)}
[I 2024-12-06 23:37:33,716] Trial 252 finished with value: 1.5714285714285714 and parameters: {'x_0_0': 'bc', 'x_0_1': 'bd', 'x_1_0': 'bd', 'x_1_1': 'bc'}. Best is trial 165 with value: 0.5.
2024-12-06 23:37:33,721 - INFO - Candidate Mean Stats: {'Max': np.float64(3.113926746206416), 'Min': np.float64(-0.7263660823138202), 'Mean': np.float64(0.5922770398273618), 'Std': np.float64(0.5343270757512567)}
2024-12-06 23:37:33,722 - INFO - Candidate Std Stats: {'Max': np.float64(1.9351947040429356), 'Min': np.float64(0.0), 'Mean': np.float64(0.543562712699097), 'Std': np.float64(0.3035042089516747)}
[I 2024-12-06 23:37:33,723] Trial 252 finished with value: 1.0714285714285714 and parameters: {'x_0_0': 'bd', 'x_0_1': 'oo', 'x_1_0': 'ac', 'x_1_1': 'ab'}. Best is trial 76 with value: 0.5.
[I 2024-12-06 23:37:33,735] Trial 252 finished with value: 0.8214285714285714 and parameters: {'x_0_0': 'ad', 'x_0_1': 'oo', 'x_1_0': 'oo', 'x_1_1': 'bd'}. Best is trial 63 with value: 0.5.
2024-12-06 23:37:33,918 - INFO - Candidate Mean Stats: {'Max': np.float64(3.141290850128415), 'Min': np.float64(-1.1087157809011572), 'Mean': np.float64(0.5418238582831801), 'Std': np.float64(0.5622042819479828)}
2024-12-06 23:37:33,918 - INFO - Candidate Std Stats: {'Max': np.float64(1.665075124750326), 'Min': np.float64(0.0), 'Mean': np.float64(0.5718004309882533), 'Std': np.float64(0.30220963484219177)}
[I 2024-12-06 23:37:33,932] Trial 251 finished with value: 1.0714285714285714 and parameters: {'x_0_0': 'bc', 'x_0_1': 'oo', 'x_1_0': 'ab', 'x_1_1': 'ad'}. Best is trial 23 with value: 0.5.
2024-12-06 23:37:34,074 - INFO - Candidate Mean Stats: {'Max': np.float64(2.8338771399819565), 'Min': np.float64(-0.7512422899157694), 'Mean': np.float64(0.6225299635590839), 'Std': np.float64(0.505165719067096)}
2024-12-06 23:37:34,074 - INFO - Candidate Std Stats: {'Max': np.float64(1.5301412963482548), 'Min': np.float64(0.0), 'Mean': np.float64(0.5631422998592898), 'Std': np.float64(0.301541503136763)}
2024-12-06 23:37:34,080 - INFO - Candidate Mean Stats: {'Max': np.float64(3.0731646214320993), 'Min': np.float64(-0.8028394936834156), 'Mean': np.float64(0.6577280532452773), 'Std': np.float64(0.5167996276225673)}
2024-12-06 23:37:34,080 - INFO - Candidate Std Stats: {'Max': np.float64(1.468556249891715), 'Min': np.float64(0.0), 'Mean': np.float64(0.503535689011063), 'Std': np.float64(0.27190196025945784)}
[I 2024-12-06 23:37:34,088] Trial 253 finished with value: 1.2142857142857144 and parameters: {'x_0_0': 'ab', 'x_0_1': 'oo', 'x_1_0': 'ab', 'x_1_1': 'ad'}. Best is trial 165 with value: 0.5.
2024-12-06 23:37:34,092 - INFO - Candidate Mean Stats: {'Max': np.float64(2.627940487053943), 'Min': np.float64(-0.8591198705947993), 'Mean': np.float64(0.5680532520249186), 'Std': np.float64(0.5241418597730668)}
2024-12-06 23:37:34,092 - INFO - Candidate Std Stats: {'Max': np.float64(1.7104255068348828), 'Min': np.float64(0.0), 'Mean': np.float64(0.6089307494896319), 'Std': np.float64(0.3369267838705625)}
[I 2024-12-06 23:37:34,093] Trial 253 finished with value: 1.375 and parameters: {'x_0_0': 'oo', 'x_0_1': 'oo', 'x_1_0': 'ab', 'x_1_1': 'bc'}. Best is trial 76 with value: 0.5.
[I 2024-12-06 23:37:34,105] Trial 253 finished with value: 0.8214285714285714 and parameters: {'x_0_0': 'bd', 'x_0_1': 'oo', 'x_1_0': 'oo', 'x_1_1': 'bd'}. Best is trial 63 with value: 0.5.
2024-12-06 23:37:34,289 - INFO - Candidate Mean Stats: {'Max': np.float64(2.8914670174376904), 'Min': np.float64(-1.3163625438944444), 'Mean': np.float64(0.5574905705736724), 'Std': np.float64(0.5864018075203671)}
2024-12-06 23:37:34,289 - INFO - Candidate Std Stats: {'Max': np.float64(2.2472625124561527), 'Min': np.float64(0.0), 'Mean': np.float64(0.6385182824824776), 'Std': np.float64(0.3492797872499623)}
[I 2024-12-06 23:37:34,303] Trial 252 finished with value: 1.2142857142857144 and parameters: {'x_0_0': 'ab', 'x_0_1': 'oo', 'x_1_0': 'ac', 'x_1_1': 'ad'}. Best is trial 23 with value: 0.5.
2024-12-06 23:37:34,445 - INFO - Candidate Mean Stats: {'Max': np.float64(3.102360862257164), 'Min': np.float64(-1.0197871707252149), 'Mean': np.float64(0.5233692113575552), 'Std': np.float64(0.5844554927063804)}
2024-12-06 23:37:34,445 - INFO - Candidate Std Stats: {'Max': np.float64(1.756004423694757), 'Min': np.float64(0.0), 'Mean': np.float64(0.6340700826937775), 'Std': np.float64(0.3282373354740084)}
2024-12-06 23:37:34,448 - INFO - Candidate Mean Stats: {'Max': np.float64(2.6696370812932395), 'Min': np.float64(-0.9768902532929971), 'Mean': np.float64(0.5899725727671464), 'Std': np.float64(0.5574749031042654)}
2024-12-06 23:37:34,448 - INFO - Candidate Std Stats: {'Max': np.float64(1.877671847180735), 'Min': np.float64(0.0), 'Mean': np.float64(0.5737581861750599), 'Std': np.float64(0.3158139726564575)}
[I 2024-12-06 23:37:34,459] Trial 254 finished with value: 1.375 and parameters: {'x_0_0': 'oo', 'x_0_1': 'oo', 'x_1_0': 'ad', 'x_1_1': 'cd'}. Best is trial 165 with value: 0.5.
[I 2024-12-06 23:37:34,461] Trial 254 finished with value: 1.0714285714285714 and parameters: {'x_0_0': 'ac', 'x_0_1': 'oo', 'x_1_0': 'bc', 'x_1_1': 'ad'}. Best is trial 76 with value: 0.5.
2024-12-06 23:37:34,464 - INFO - Candidate Mean Stats: {'Max': np.float64(2.593943804068698), 'Min': np.float64(-1.1482555575612299), 'Mean': np.float64(0.4946116995313282), 'Std': np.float64(0.5729462830862794)}
2024-12-06 23:37:34,464 - INFO - Candidate Std Stats: {'Max': np.float64(1.7962792152416671), 'Min': np.float64(0.0), 'Mean': np.float64(0.6210713841721036), 'Std': np.float64(0.34137869330654425)}
[I 2024-12-06 23:37:34,477] Trial 254 finished with value: 1.0714285714285714 and parameters: {'x_0_0': 'bc', 'x_0_1': 'oo', 'x_1_0': 'cd', 'x_1_1': 'ac'}. Best is trial 63 with value: 0.5.
2024-12-06 23:37:34,664 - INFO - Candidate Mean Stats: {'Max': np.float64(3.192739553648493), 'Min': np.float64(-0.9333835574188776), 'Mean': np.float64(0.596853910911091), 'Std': np.float64(0.5640873064474538)}
2024-12-06 23:37:34,664 - INFO - Candidate Std Stats: {'Max': np.float64(1.7039313062531438), 'Min': np.float64(0.0), 'Mean': np.float64(0.5812553240468468), 'Std': np.float64(0.3099553395532128)}
[I 2024-12-06 23:37:34,678] Trial 253 finished with value: 1.2142857142857144 and parameters: {'x_0_0': 'ab', 'x_0_1': 'oo', 'x_1_0': 'ac', 'x_1_1': 'cd'}. Best is trial 23 with value: 0.5.
2024-12-06 23:37:34,818 - INFO - Candidate Mean Stats: {'Max': np.float64(2.8185443612195655), 'Min': np.float64(-0.6260395419216309), 'Mean': np.float64(0.6059945333079898), 'Std': np.float64(0.5196204020912419)}
2024-12-06 23:37:34,818 - INFO - Candidate Std Stats: {'Max': np.float64(1.6699014456102115), 'Min': np.float64(0.0), 'Mean': np.float64(0.5495706837097993), 'Std': np.float64(0.31110039371422743)}
2024-12-06 23:37:34,821 - INFO - Candidate Mean Stats: {'Max': np.float64(2.7271500695502877), 'Min': np.float64(-1.092787985467925), 'Mean': np.float64(0.6018215972519926), 'Std': np.float64(0.5230105834862995)}
2024-12-06 23:37:34,821 - INFO - Candidate Std Stats: {'Max': np.float64(1.6772940430973364), 'Min': np.float64(0.0), 'Mean': np.float64(0.543080467684072), 'Std': np.float64(0.2931331399694513)}
[I 2024-12-06 23:37:34,833] Trial 255 finished with value: 1.2142857142857144 and parameters: {'x_0_0': 'ab', 'x_0_1': 'oo', 'x_1_0': 'bd', 'x_1_1': 'ab'}. Best is trial 165 with value: 0.5.
[I 2024-12-06 23:37:34,835] Trial 255 finished with value: 0.9285714285714286 and parameters: {'x_0_0': 'ad', 'x_0_1': 'oo', 'x_1_0': 'ab', 'x_1_1': 'cd'}. Best is trial 76 with value: 0.5.
2024-12-06 23:37:34,836 - INFO - Candidate Mean Stats: {'Max': np.float64(2.912471594306516), 'Min': np.float64(-0.857184252854778), 'Mean': np.float64(0.6355939108963932), 'Std': np.float64(0.5257729838736829)}
2024-12-06 23:37:34,836 - INFO - Candidate Std Stats: {'Max': np.float64(1.4811558196888939), 'Min': np.float64(0.0), 'Mean': np.float64(0.5300135547994921), 'Std': np.float64(0.2801167946157153)}
[I 2024-12-06 23:37:34,849] Trial 255 finished with value: 0.8214285714285714 and parameters: {'x_0_0': 'bc', 'x_0_1': 'oo', 'x_1_0': 'oo', 'x_1_1': 'bd'}. Best is trial 63 with value: 0.5.
2024-12-06 23:37:35,037 - INFO - Candidate Mean Stats: {'Max': np.float64(3.0237114278752446), 'Min': np.float64(-0.7654073734525687), 'Mean': np.float64(0.5946910400963628), 'Std': np.float64(0.5425091062011522)}
2024-12-06 23:37:35,037 - INFO - Candidate Std Stats: {'Max': np.float64(1.5396477965683668), 'Min': np.float64(0.0), 'Mean': np.float64(0.5319084444064015), 'Std': np.float64(0.2951207062359699)}
[I 2024-12-06 23:37:35,051] Trial 254 finished with value: 1.5714285714285714 and parameters: {'x_0_0': 'bc', 'x_0_1': 'bd', 'x_1_0': 'bd', 'x_1_1': 'ad'}. Best is trial 23 with value: 0.5.
2024-12-06 23:37:35,189 - INFO - Candidate Mean Stats: {'Max': np.float64(3.0190662486885294), 'Min': np.float64(-1.1773318484542927), 'Mean': np.float64(0.529354273851264), 'Std': np.float64(0.6483095638816215)}
2024-12-06 23:37:35,189 - INFO - Candidate Std Stats: {'Max': np.float64(1.9278177666325835), 'Min': np.float64(0.0), 'Mean': np.float64(0.6388795935616013), 'Std': np.float64(0.3566542245080522)}
2024-12-06 23:37:35,193 - INFO - Candidate Mean Stats: {'Max': np.float64(3.122282847496861), 'Min': np.float64(-0.7292595659361171), 'Mean': np.float64(0.6292600340404366), 'Std': np.float64(0.5100031172385894)}
2024-12-06 23:37:35,193 - INFO - Candidate Std Stats: {'Max': np.float64(1.7620525249993055), 'Min': np.float64(0.0), 'Mean': np.float64(0.5666544042790899), 'Std': np.float64(0.32044618531502794)}
[I 2024-12-06 23:37:35,204] Trial 256 finished with value: 1.0 and parameters: {'x_0_0': 'ad', 'x_0_1': 'cd', 'x_1_0': 'bc', 'x_1_1': 'ad'}. Best is trial 165 with value: 0.5.
[I 2024-12-06 23:37:35,207] Trial 256 finished with value: 0.9285714285714286 and parameters: {'x_0_0': 'ad', 'x_0_1': 'oo', 'x_1_0': 'ab', 'x_1_1': 'ab'}. Best is trial 76 with value: 0.5.
2024-12-06 23:37:35,209 - INFO - Candidate Mean Stats: {'Max': np.float64(3.3659368794432054), 'Min': np.float64(-0.8234374186821058), 'Mean': np.float64(0.6161500628279223), 'Std': np.float64(0.4707863586171405)}
2024-12-06 23:37:35,209 - INFO - Candidate Std Stats: {'Max': np.float64(1.5677903928617223), 'Min': np.float64(0.0), 'Mean': np.float64(0.47997121432448225), 'Std': np.float64(0.2739272662508139)}
[I 2024-12-06 23:37:35,222] Trial 256 finished with value: 1.0714285714285714 and parameters: {'x_0_0': 'ad', 'x_0_1': 'oo', 'x_1_0': 'cd', 'x_1_1': 'ab'}. Best is trial 63 with value: 0.5.
2024-12-06 23:37:35,408 - INFO - Candidate Mean Stats: {'Max': np.float64(3.1086181529291212), 'Min': np.float64(-0.901677715747207), 'Mean': np.float64(0.6117324732269815), 'Std': np.float64(0.5852505205597417)}
2024-12-06 23:37:35,408 - INFO - Candidate Std Stats: {'Max': np.float64(1.5854739947961987), 'Min': np.float64(0.0), 'Mean': np.float64(0.5243988726148946), 'Std': np.float64(0.28279172625952365)}
[I 2024-12-06 23:37:35,422] Trial 255 finished with value: 1.0 and parameters: {'x_0_0': 'bc', 'x_0_1': 'ad', 'x_1_0': 'cd', 'x_1_1': 'bc'}. Best is trial 23 with value: 0.5.
2024-12-06 23:37:35,562 - INFO - Candidate Mean Stats: {'Max': np.float64(3.0912670689759496), 'Min': np.float64(-0.8359855823883338), 'Mean': np.float64(0.61987507478802), 'Std': np.float64(0.49626197347614537)}
2024-12-06 23:37:35,562 - INFO - Candidate Std Stats: {'Max': np.float64(1.5580396893098059), 'Min': np.float64(0.0), 'Mean': np.float64(0.5387809190094529), 'Std': np.float64(0.29515197485637756)}
2024-12-06 23:37:35,564 - INFO - Candidate Mean Stats: {'Max': np.float64(3.009822123409248), 'Min': np.float64(-0.8329747794442298), 'Mean': np.float64(0.5493953611534469), 'Std': np.float64(0.5737947612639676)}
2024-12-06 23:37:35,565 - INFO - Candidate Std Stats: {'Max': np.float64(1.6818953715118223), 'Min': np.float64(0.0), 'Mean': np.float64(0.5957810310040665), 'Std': np.float64(0.32518299480033663)}
[I 2024-12-06 23:37:35,577] Trial 257 finished with value: 1.375 and parameters: {'x_0_0': 'cd', 'x_0_1': 'oo', 'x_1_0': 'ac', 'x_1_1': 'oo'}. Best is trial 165 with value: 0.5.
[I 2024-12-06 23:37:35,578] Trial 257 finished with value: 0.8392857142857143 and parameters: {'x_0_0': 'ab', 'x_0_1': 'oo', 'x_1_0': 'oo', 'x_1_1': 'oo'}. Best is trial 76 with value: 0.5.
2024-12-06 23:37:35,580 - INFO - Candidate Mean Stats: {'Max': np.float64(2.7075803543053683), 'Min': np.float64(-0.9713836881647475), 'Mean': np.float64(0.5446474603640398), 'Std': np.float64(0.562503161435457)}
2024-12-06 23:37:35,580 - INFO - Candidate Std Stats: {'Max': np.float64(1.7099489660136489), 'Min': np.float64(0.0), 'Mean': np.float64(0.5467422858489634), 'Std': np.float64(0.29903004644956)}
[I 2024-12-06 23:37:35,592] Trial 257 finished with value: 1.375 and parameters: {'x_0_0': 'oo', 'x_0_1': 'oo', 'x_1_0': 'bc', 'x_1_1': 'cd'}. Best is trial 63 with value: 0.5.
2024-12-06 23:37:35,785 - INFO - Candidate Mean Stats: {'Max': np.float64(3.935079906932849), 'Min': np.float64(-0.8901877968876647), 'Mean': np.float64(0.6167782373653199), 'Std': np.float64(0.581914547145739)}
2024-12-06 23:37:35,785 - INFO - Candidate Std Stats: {'Max': np.float64(1.5434306959419857), 'Min': np.float64(0.0), 'Mean': np.float64(0.4997065050876462), 'Std': np.float64(0.2845571486684046)}
[I 2024-12-06 23:37:35,799] Trial 256 finished with value: 1.1607142857142856 and parameters: {'x_0_0': 'ac', 'x_0_1': 'ad', 'x_1_0': 'ac', 'x_1_1': 'oo'}. Best is trial 23 with value: 0.5.
2024-12-06 23:37:35,932 - INFO - Candidate Mean Stats: {'Max': np.float64(2.931162379573618), 'Min': np.float64(-0.8726683990992148), 'Mean': np.float64(0.606955665029411), 'Std': np.float64(0.5234046203657978)}
2024-12-06 23:37:35,932 - INFO - Candidate Std Stats: {'Max': np.float64(1.5578508867071286), 'Min': np.float64(0.0), 'Mean': np.float64(0.5798477972856504), 'Std': np.float64(0.29578944605690294)}
2024-12-06 23:37:35,935 - INFO - Candidate Mean Stats: {'Max': np.float64(2.7419297926637634), 'Min': np.float64(-0.8303635834406695), 'Mean': np.float64(0.5157750347443202), 'Std': np.float64(0.579356817945513)}
2024-12-06 23:37:35,935 - INFO - Candidate Std Stats: {'Max': np.float64(1.582891549968966), 'Min': np.float64(0.0), 'Mean': np.float64(0.576321720030496), 'Std': np.float64(0.31097035006474383)}
[I 2024-12-06 23:37:35,947] Trial 258 finished with value: 0.9642857142857143 and parameters: {'x_0_0': 'ab', 'x_0_1': 'oo', 'x_1_0': 'oo', 'x_1_1': 'ad'}. Best is trial 165 with value: 0.5.
[I 2024-12-06 23:37:35,949] Trial 258 finished with value: 1.4464285714285714 and parameters: {'x_0_0': 'ad', 'x_0_1': 'bd', 'x_1_0': 'ac', 'x_1_1': 'oo'}. Best is trial 76 with value: 0.5.
2024-12-06 23:37:35,951 - INFO - Candidate Mean Stats: {'Max': np.float64(2.7588094204428417), 'Min': np.float64(-0.9213297123876709), 'Mean': np.float64(0.5736894916134637), 'Std': np.float64(0.5596959079629628)}
2024-12-06 23:37:35,951 - INFO - Candidate Std Stats: {'Max': np.float64(1.8719919474163982), 'Min': np.float64(0.0), 'Mean': np.float64(0.5570509316135549), 'Std': np.float64(0.3065987019835669)}
[I 2024-12-06 23:37:35,965] Trial 258 finished with value: 1.0714285714285714 and parameters: {'x_0_0': 'bd', 'x_0_1': 'oo', 'x_1_0': 'ac', 'x_1_1': 'ac'}. Best is trial 63 with value: 0.5.
2024-12-06 23:37:36,161 - INFO - Candidate Mean Stats: {'Max': np.float64(2.874782591226019), 'Min': np.float64(-1.294236159530243), 'Mean': np.float64(0.49715066668624514), 'Std': np.float64(0.6547182826934339)}
2024-12-06 23:37:36,162 - INFO - Candidate Std Stats: {'Max': np.float64(1.8779247486631463), 'Min': np.float64(0.0), 'Mean': np.float64(0.6460425161259191), 'Std': np.float64(0.34025965814434234)}
[I 2024-12-06 23:37:36,174] Trial 257 finished with value: 1.375 and parameters: {'x_0_0': 'oo', 'x_0_1': 'oo', 'x_1_0': 'bc', 'x_1_1': 'ab'}. Best is trial 23 with value: 0.5.
2024-12-06 23:37:36,303 - INFO - Candidate Mean Stats: {'Max': np.float64(3.0878889090100445), 'Min': np.float64(-1.3781904975312067), 'Mean': np.float64(0.3740313241628346), 'Std': np.float64(0.7145022691376857)}
2024-12-06 23:37:36,303 - INFO - Candidate Std Stats: {'Max': np.float64(1.8964932172182654), 'Min': np.float64(0.0), 'Mean': np.float64(0.6726197624662819), 'Std': np.float64(0.3540584956462253)}
2024-12-06 23:37:36,306 - INFO - Candidate Mean Stats: {'Max': np.float64(2.685448044210725), 'Min': np.float64(-0.9520214173168856), 'Mean': np.float64(0.6134991519449987), 'Std': np.float64(0.5811170339231526)}
2024-12-06 23:37:36,306 - INFO - Candidate Std Stats: {'Max': np.float64(1.5162119750289094), 'Min': np.float64(0.0), 'Mean': np.float64(0.5679859607523867), 'Std': np.float64(0.3027626210153751)}
[I 2024-12-06 23:37:36,318] Trial 259 finished with value: 1.2857142857142856 and parameters: {'x_0_0': 'bd', 'x_0_1': 'ac', 'x_1_0': 'bd', 'x_1_1': 'ad'}. Best is trial 165 with value: 0.5.
[I 2024-12-06 23:37:36,320] Trial 259 finished with value: 1.4285714285714286 and parameters: {'x_0_0': 'ad', 'x_0_1': 'ad', 'x_1_0': 'ab', 'x_1_1': 'bd'}. Best is trial 76 with value: 0.5.
2024-12-06 23:37:36,320 - INFO - Candidate Mean Stats: {'Max': np.float64(3.1509748560959063), 'Min': np.float64(-0.658621350368466), 'Mean': np.float64(0.6390308105357709), 'Std': np.float64(0.4941758331863303)}
2024-12-06 23:37:36,320 - INFO - Candidate Std Stats: {'Max': np.float64(1.9906292209008527), 'Min': np.float64(0.0), 'Mean': np.float64(0.5317862733968377), 'Std': np.float64(0.3216508997096959)}
[I 2024-12-06 23:37:36,335] Trial 259 finished with value: 1.5714285714285714 and parameters: {'x_0_0': 'ac', 'x_0_1': 'cd', 'x_1_0': 'bc', 'x_1_1': 'bc'}. Best is trial 63 with value: 0.5.
2024-12-06 23:37:36,535 - INFO - Candidate Mean Stats: {'Max': np.float64(2.9070934531958246), 'Min': np.float64(-1.0053114706324202), 'Mean': np.float64(0.5453084209911538), 'Std': np.float64(0.6263280811401447)}
2024-12-06 23:37:36,535 - INFO - Candidate Std Stats: {'Max': np.float64(1.6710060831834799), 'Min': np.float64(0.0), 'Mean': np.float64(0.5610315152181741), 'Std': np.float64(0.3021650175313332)}
