[I 2024-12-06 23:37:10,107] Trial 186 finished with value: 1.1607142857142856 and parameters: {'x_0_0': 'bd', 'x_0_1': 'ac', 'x_1_0': 'bc', 'x_1_1': 'oo'}. Best is trial 23 with value: 0.5.
2024-12-06 23:37:10,333 - INFO - Candidate Mean Stats: {'Max': np.float64(3.1192354359510284), 'Min': np.float64(-1.1821131632719968), 'Mean': np.float64(0.47469118557442136), 'Std': np.float64(0.5937730028884224)}
2024-12-06 23:37:10,333 - INFO - Candidate Std Stats: {'Max': np.float64(1.7037224401960516), 'Min': np.float64(0.0), 'Mean': np.float64(0.5952262994619866), 'Std': np.float64(0.30096468173351054)}
2024-12-06 23:37:10,344 - INFO - Candidate Mean Stats: {'Max': np.float64(2.8541972211037603), 'Min': np.float64(-0.9156990157841228), 'Mean': np.float64(0.5120483445849364), 'Std': np.float64(0.5480780819709877)}
2024-12-06 23:37:10,344 - INFO - Candidate Std Stats: {'Max': np.float64(1.7953929699868345), 'Min': np.float64(0.0), 'Mean': np.float64(0.5831150633173935), 'Std': np.float64(0.30055379135568616)}
[I 2024-12-06 23:37:10,346] Trial 188 finished with value: 0.9464285714285714 and parameters: {'x_0_0': 'ac', 'x_0_1': 'oo', 'x_1_0': 'ad', 'x_1_1': 'oo'}. Best is trial 165 with value: 0.5.
2024-12-06 23:37:10,353 - INFO - Candidate Mean Stats: {'Max': np.float64(2.8216135146792896), 'Min': np.float64(-1.2435741282786725), 'Mean': np.float64(0.2714756942654743), 'Std': np.float64(0.6194761075160431)}
2024-12-06 23:37:10,354 - INFO - Candidate Std Stats: {'Max': np.float64(1.9221939736749627), 'Min': np.float64(0.0), 'Mean': np.float64(0.7043520126735967), 'Std': np.float64(0.3407607640551321)}
[I 2024-12-06 23:37:10,357] Trial 188 finished with value: 1.375 and parameters: {'x_0_0': 'cd', 'x_0_1': 'oo', 'x_1_0': 'ad', 'x_1_1': 'oo'}. Best is trial 76 with value: 0.5.
[I 2024-12-06 23:37:10,366] Trial 188 finished with value: 1.0714285714285714 and parameters: {'x_0_0': 'bc', 'x_0_1': 'oo', 'x_1_0': 'ad', 'x_1_1': 'bd'}. Best is trial 63 with value: 0.5.
2024-12-06 23:37:10,453 - INFO - Candidate Mean Stats: {'Max': np.float64(2.9816459077277013), 'Min': np.float64(-1.212068981859075), 'Mean': np.float64(0.47796805674068293), 'Std': np.float64(0.5891716560305063)}
2024-12-06 23:37:10,454 - INFO - Candidate Std Stats: {'Max': np.float64(1.526571655331432), 'Min': np.float64(0.0), 'Mean': np.float64(0.5544693539509405), 'Std': np.float64(0.2773261637876138)}
[I 2024-12-06 23:37:10,466] Trial 187 finished with value: 1.125 and parameters: {'x_0_0': 'oo', 'x_0_1': 'oo', 'x_1_0': 'oo', 'x_1_1': 'ac'}. Best is trial 23 with value: 0.5.
2024-12-06 23:37:10,691 - INFO - Candidate Mean Stats: {'Max': np.float64(3.2018259148830213), 'Min': np.float64(-0.9001296554091059), 'Mean': np.float64(0.470865471402543), 'Std': np.float64(0.5865295070384938)}
2024-12-06 23:37:10,691 - INFO - Candidate Std Stats: {'Max': np.float64(1.6253779640839103), 'Min': np.float64(0.0), 'Mean': np.float64(0.6243183403722219), 'Std': np.float64(0.30447572004389817)}
2024-12-06 23:37:10,702 - INFO - Candidate Mean Stats: {'Max': np.float64(2.9898541846609996), 'Min': np.float64(-0.9861249639730758), 'Mean': np.float64(0.49515468428100795), 'Std': np.float64(0.5567884907389365)}
2024-12-06 23:37:10,702 - INFO - Candidate Std Stats: {'Max': np.float64(1.690458213634448), 'Min': np.float64(0.0), 'Mean': np.float64(0.581166018260468), 'Std': np.float64(0.28155014919631)}
[I 2024-12-06 23:37:10,704] Trial 189 finished with value: 1.5714285714285714 and parameters: {'x_0_0': 'ad', 'x_0_1': 'cd', 'x_1_0': 'ad', 'x_1_1': 'ad'}. Best is trial 165 with value: 0.5.
2024-12-06 23:37:10,711 - INFO - Candidate Mean Stats: {'Max': np.float64(2.8935230135978083), 'Min': np.float64(-0.8417091430103396), 'Mean': np.float64(0.5205007410969625), 'Std': np.float64(0.5145024499084541)}
2024-12-06 23:37:10,711 - INFO - Candidate Std Stats: {'Max': np.float64(1.5766707360828958), 'Min': np.float64(0.0), 'Mean': np.float64(0.5786871461125864), 'Std': np.float64(0.29083456145579883)}
[I 2024-12-06 23:37:10,715] Trial 189 finished with value: 1.0714285714285714 and parameters: {'x_0_0': 'ac', 'x_0_1': 'oo', 'x_1_0': 'ab', 'x_1_1': 'bc'}. Best is trial 76 with value: 0.5.
[I 2024-12-06 23:37:10,724] Trial 189 finished with value: 0.8392857142857143 and parameters: {'x_0_0': 'ab', 'x_0_1': 'oo', 'x_1_0': 'oo', 'x_1_1': 'oo'}. Best is trial 63 with value: 0.5.
2024-12-06 23:37:10,813 - INFO - Candidate Mean Stats: {'Max': np.float64(2.9389235810387455), 'Min': np.float64(-0.9747239934668237), 'Mean': np.float64(0.47661383266563995), 'Std': np.float64(0.5552724304843554)}
2024-12-06 23:37:10,814 - INFO - Candidate Std Stats: {'Max': np.float64(1.7758427301996353), 'Min': np.float64(0.0), 'Mean': np.float64(0.565351669603787), 'Std': np.float64(0.2818392750766769)}
[I 2024-12-06 23:37:10,826] Trial 188 finished with value: 0.7857142857142857 and parameters: {'x_0_0': 'ad', 'x_0_1': 'oo', 'x_1_0': 'bd', 'x_1_1': 'ab'}. Best is trial 23 with value: 0.5.
2024-12-06 23:37:11,049 - INFO - Candidate Mean Stats: {'Max': np.float64(2.9060640447548263), 'Min': np.float64(-0.9815280420292789), 'Mean': np.float64(0.4843772274514243), 'Std': np.float64(0.5688661154056178)}
2024-12-06 23:37:11,049 - INFO - Candidate Std Stats: {'Max': np.float64(1.5844626167856708), 'Min': np.float64(0.0), 'Mean': np.float64(0.5936582209290727), 'Std': np.float64(0.29344809877596484)}
2024-12-06 23:37:11,060 - INFO - Candidate Mean Stats: {'Max': np.float64(3.1628869875228567), 'Min': np.float64(-0.8761765218419623), 'Mean': np.float64(0.49619637024484825), 'Std': np.float64(0.5758245290931602)}
2024-12-06 23:37:11,060 - INFO - Candidate Std Stats: {'Max': np.float64(1.4458952274138894), 'Min': np.float64(0.0), 'Mean': np.float64(0.5480840713223333), 'Std': np.float64(0.2695422229571633)}
[I 2024-12-06 23:37:11,062] Trial 190 finished with value: 1.0714285714285714 and parameters: {'x_0_0': 'bc', 'x_0_1': 'oo', 'x_1_0': 'cd', 'x_1_1': 'bd'}. Best is trial 165 with value: 0.5.
2024-12-06 23:37:11,069 - INFO - Candidate Mean Stats: {'Max': np.float64(2.8429890350962794), 'Min': np.float64(-1.0289874525773155), 'Mean': np.float64(0.46356541934556994), 'Std': np.float64(0.5283714222891329)}
2024-12-06 23:37:11,069 - INFO - Candidate Std Stats: {'Max': np.float64(1.757957164212891), 'Min': np.float64(0.0), 'Mean': np.float64(0.6067886441026056), 'Std': np.float64(0.32188734562584126)}
[I 2024-12-06 23:37:11,073] Trial 190 finished with value: 1.0714285714285714 and parameters: {'x_0_0': 'ac', 'x_0_1': 'oo', 'x_1_0': 'bc', 'x_1_1': 'cd'}. Best is trial 76 with value: 0.5.
[I 2024-12-06 23:37:11,082] Trial 190 finished with value: 0.9464285714285714 and parameters: {'x_0_0': 'bc', 'x_0_1': 'oo', 'x_1_0': 'bd', 'x_1_1': 'oo'}. Best is trial 63 with value: 0.5.
2024-12-06 23:37:11,172 - INFO - Candidate Mean Stats: {'Max': np.float64(2.8476899791692656), 'Min': np.float64(-1.460789453228596), 'Mean': np.float64(0.47330781731757576), 'Std': np.float64(0.6010256144259405)}
2024-12-06 23:37:11,172 - INFO - Candidate Std Stats: {'Max': np.float64(2.024294968882009), 'Min': np.float64(0.0), 'Mean': np.float64(0.6458888025258451), 'Std': np.float64(0.3159037211090082)}
[I 2024-12-06 23:37:11,185] Trial 189 finished with value: 1.0714285714285714 and parameters: {'x_0_0': 'ac', 'x_0_1': 'oo', 'x_1_0': 'bd', 'x_1_1': 'cd'}. Best is trial 23 with value: 0.5.
2024-12-06 23:37:11,407 - INFO - Candidate Mean Stats: {'Max': np.float64(2.8928849688784526), 'Min': np.float64(-0.9083807945175482), 'Mean': np.float64(0.47659517617231606), 'Std': np.float64(0.5632346721561167)}
2024-12-06 23:37:11,407 - INFO - Candidate Std Stats: {'Max': np.float64(1.730181049839645), 'Min': np.float64(0.0), 'Mean': np.float64(0.6077396218910885), 'Std': np.float64(0.3066946548285366)}
2024-12-06 23:37:11,417 - INFO - Candidate Mean Stats: {'Max': np.float64(2.6547930051831896), 'Min': np.float64(-1.4048515389919747), 'Mean': np.float64(0.5053086226471116), 'Std': np.float64(0.5671222706861259)}
2024-12-06 23:37:11,417 - INFO - Candidate Std Stats: {'Max': np.float64(1.7910815151874273), 'Min': np.float64(0.0), 'Mean': np.float64(0.6053556943991679), 'Std': np.float64(0.3214780653819921)}
[I 2024-12-06 23:37:11,421] Trial 191 finished with value: 1.5 and parameters: {'x_0_0': 'oo', 'x_0_1': 'ab', 'x_1_0': 'oo', 'x_1_1': 'oo'}. Best is trial 165 with value: 0.5.
2024-12-06 23:37:11,427 - INFO - Candidate Mean Stats: {'Max': np.float64(2.857213479860167), 'Min': np.float64(-1.0065599640647096), 'Mean': np.float64(0.4465119468912122), 'Std': np.float64(0.5189309819002117)}
2024-12-06 23:37:11,427 - INFO - Candidate Std Stats: {'Max': np.float64(1.7600266400367348), 'Min': np.float64(0.0), 'Mean': np.float64(0.6164005265742389), 'Std': np.float64(0.29793642820003907)}
[I 2024-12-06 23:37:11,431] Trial 191 finished with value: 1.0714285714285714 and parameters: {'x_0_0': 'bc', 'x_0_1': 'oo', 'x_1_0': 'ac', 'x_1_1': 'cd'}. Best is trial 76 with value: 0.5.
[I 2024-12-06 23:37:11,442] Trial 191 finished with value: 1.2142857142857144 and parameters: {'x_0_0': 'ab', 'x_0_1': 'oo', 'x_1_0': 'bc', 'x_1_1': 'ac'}. Best is trial 63 with value: 0.5.
2024-12-06 23:37:11,532 - INFO - Candidate Mean Stats: {'Max': np.float64(3.4146467560616514), 'Min': np.float64(-1.2310679041573216), 'Mean': np.float64(0.40223086653035234), 'Std': np.float64(0.6208400639783087)}
2024-12-06 23:37:11,532 - INFO - Candidate Std Stats: {'Max': np.float64(1.9361181579697235), 'Min': np.float64(0.0), 'Mean': np.float64(0.6477829561773726), 'Std': np.float64(0.33093071402206975)}
[I 2024-12-06 23:37:11,545] Trial 190 finished with value: 0.7857142857142857 and parameters: {'x_0_0': 'ad', 'x_0_1': 'oo', 'x_1_0': 'bd', 'x_1_1': 'bd'}. Best is trial 23 with value: 0.5.
2024-12-06 23:37:11,775 - INFO - Candidate Mean Stats: {'Max': np.float64(2.824604671549886), 'Min': np.float64(-0.8688047149873401), 'Mean': np.float64(0.5747823655262729), 'Std': np.float64(0.5035977264942382)}
2024-12-06 23:37:11,775 - INFO - Candidate Std Stats: {'Max': np.float64(1.5327314176541487), 'Min': np.float64(0.0), 'Mean': np.float64(0.5409977060044578), 'Std': np.float64(0.27381567700708775)}
2024-12-06 23:37:11,781 - INFO - Candidate Mean Stats: {'Max': np.float64(3.2742033443423644), 'Min': np.float64(-1.228415430560395), 'Mean': np.float64(0.40534236170371907), 'Std': np.float64(0.615172951410466)}
2024-12-06 23:37:11,781 - INFO - Candidate Std Stats: {'Max': np.float64(1.7365702325130743), 'Min': np.float64(0.0), 'Mean': np.float64(0.6047945481652861), 'Std': np.float64(0.3073570318418265)}
[I 2024-12-06 23:37:11,790] Trial 192 finished with value: 1.0714285714285714 and parameters: {'x_0_0': 'bc', 'x_0_1': 'oo', 'x_1_0': 'ab', 'x_1_1': 'ab'}. Best is trial 165 with value: 0.5.
2024-12-06 23:37:11,791 - INFO - Candidate Mean Stats: {'Max': np.float64(2.3556384546766957), 'Min': np.float64(-0.8725632340532726), 'Mean': np.float64(0.4398297026488137), 'Std': np.float64(0.5258354563486093)}
2024-12-06 23:37:11,791 - INFO - Candidate Std Stats: {'Max': np.float64(1.6510066893566788), 'Min': np.float64(0.0), 'Mean': np.float64(0.5894564802965486), 'Std': np.float64(0.2973292225099617)}
[I 2024-12-06 23:37:11,799] Trial 192 finished with value: 0.7857142857142857 and parameters: {'x_0_0': 'bd', 'x_0_1': 'oo', 'x_1_0': 'bc', 'x_1_1': 'bc'}. Best is trial 76 with value: 0.5.
[I 2024-12-06 23:37:11,804] Trial 192 finished with value: 1.0714285714285714 and parameters: {'x_0_0': 'bc', 'x_0_1': 'oo', 'x_1_0': 'bc', 'x_1_1': 'cd'}. Best is trial 63 with value: 0.5.
2024-12-06 23:37:11,896 - INFO - Candidate Mean Stats: {'Max': np.float64(2.889061036916136), 'Min': np.float64(-1.0082311536399666), 'Mean': np.float64(0.4853071176626673), 'Std': np.float64(0.5507677397942432)}
2024-12-06 23:37:11,896 - INFO - Candidate Std Stats: {'Max': np.float64(1.831777152071461), 'Min': np.float64(0.0), 'Mean': np.float64(0.6272241263793183), 'Std': np.float64(0.3186199860837277)}
[I 2024-12-06 23:37:11,908] Trial 191 finished with value: 0.5 and parameters: {'x_0_0': 'ad', 'x_0_1': 'oo', 'x_1_0': 'bc', 'x_1_1': 'ad'}. Best is trial 23 with value: 0.5.
2024-12-06 23:37:12,135 - INFO - Candidate Mean Stats: {'Max': np.float64(2.5525013892053243), 'Min': np.float64(-0.6829355873914744), 'Mean': np.float64(0.5669245556513418), 'Std': np.float64(0.4665684046955678)}
2024-12-06 23:37:12,135 - INFO - Candidate Std Stats: {'Max': np.float64(1.8661683444198318), 'Min': np.float64(0.0), 'Mean': np.float64(0.5291265789462778), 'Std': np.float64(0.28317936922428744)}
2024-12-06 23:37:12,144 - INFO - Candidate Mean Stats: {'Max': np.float64(2.894383086737261), 'Min': np.float64(-0.8289305371646846), 'Mean': np.float64(0.50146494784631), 'Std': np.float64(0.5532078922466853)}
2024-12-06 23:37:12,145 - INFO - Candidate Std Stats: {'Max': np.float64(1.5307892349314305), 'Min': np.float64(0.0), 'Mean': np.float64(0.5946440285636855), 'Std': np.float64(0.2820972545921404)}
[I 2024-12-06 23:37:12,148] Trial 193 finished with value: 1.0714285714285714 and parameters: {'x_0_0': 'ac', 'x_0_1': 'oo', 'x_1_0': 'ab', 'x_1_1': 'bc'}. Best is trial 165 with value: 0.5.
2024-12-06 23:37:12,150 - INFO - Candidate Mean Stats: {'Max': np.float64(2.6189022816619585), 'Min': np.float64(-1.310297968728004), 'Mean': np.float64(0.41667908384322033), 'Std': np.float64(0.5901397628927944)}
2024-12-06 23:37:12,150 - INFO - Candidate Std Stats: {'Max': np.float64(1.9239057628669116), 'Min': np.float64(0.0), 'Mean': np.float64(0.6262746506347485), 'Std': np.float64(0.32577842140698005)}
[I 2024-12-06 23:37:12,159] Trial 193 finished with value: 1.0714285714285714 and parameters: {'x_0_0': 'bd', 'x_0_1': 'oo', 'x_1_0': 'ac', 'x_1_1': 'bd'}. Best is trial 76 with value: 0.5.
[I 2024-12-06 23:37:12,164] Trial 193 finished with value: 1.4464285714285714 and parameters: {'x_0_0': 'bd', 'x_0_1': 'ac', 'x_1_0': 'ac', 'x_1_1': 'oo'}. Best is trial 63 with value: 0.5.
2024-12-06 23:37:12,256 - INFO - Candidate Mean Stats: {'Max': np.float64(3.0538554801165176), 'Min': np.float64(-1.3299153650099007), 'Mean': np.float64(0.4965607668508964), 'Std': np.float64(0.59018658383573)}
2024-12-06 23:37:12,256 - INFO - Candidate Std Stats: {'Max': np.float64(1.5343355067069258), 'Min': np.float64(0.0), 'Mean': np.float64(0.5889528236142627), 'Std': np.float64(0.2889702516505236)}
[I 2024-12-06 23:37:12,269] Trial 192 finished with value: 1.0714285714285714 and parameters: {'x_0_0': 'ac', 'x_0_1': 'oo', 'x_1_0': 'ad', 'x_1_1': 'ac'}. Best is trial 23 with value: 0.5.
2024-12-06 23:37:12,495 - INFO - Candidate Mean Stats: {'Max': np.float64(2.9514243288659374), 'Min': np.float64(-0.8880421093433586), 'Mean': np.float64(0.5235605796436917), 'Std': np.float64(0.49732081214217655)}
2024-12-06 23:37:12,495 - INFO - Candidate Std Stats: {'Max': np.float64(1.6248720299274841), 'Min': np.float64(0.0), 'Mean': np.float64(0.5535561971117647), 'Std': np.float64(0.286715681649402)}
2024-12-06 23:37:12,504 - INFO - Candidate Mean Stats: {'Max': np.float64(2.478011251871551), 'Min': np.float64(-0.9235300167430509), 'Mean': np.float64(0.5428561652917798), 'Std': np.float64(0.5392408480926667)}
2024-12-06 23:37:12,504 - INFO - Candidate Std Stats: {'Max': np.float64(1.46477480470497), 'Min': np.float64(0.0), 'Mean': np.float64(0.523575807113633), 'Std': np.float64(0.26439577958636024)}
[I 2024-12-06 23:37:12,508] Trial 194 finished with value: 0.8392857142857143 and parameters: {'x_0_0': 'ab', 'x_0_1': 'oo', 'x_1_0': 'oo', 'x_1_1': 'oo'}. Best is trial 165 with value: 0.5.
2024-12-06 23:37:12,509 - INFO - Candidate Mean Stats: {'Max': np.float64(2.8742953371222875), 'Min': np.float64(-1.2543074953480258), 'Mean': np.float64(0.46054530158171086), 'Std': np.float64(0.5456259572615756)}
2024-12-06 23:37:12,509 - INFO - Candidate Std Stats: {'Max': np.float64(1.8319199276432863), 'Min': np.float64(0.0), 'Mean': np.float64(0.5219219449809619), 'Std': np.float64(0.267895556451344)}
[I 2024-12-06 23:37:12,517] Trial 194 finished with value: 1.0714285714285714 and parameters: {'x_0_0': 'ad', 'x_0_1': 'oo', 'x_1_0': 'ac', 'x_1_1': 'ab'}. Best is trial 76 with value: 0.5.
[I 2024-12-06 23:37:12,522] Trial 194 finished with value: 1.5 and parameters: {'x_0_0': 'cd', 'x_0_1': 'oo', 'x_1_0': 'bc', 'x_1_1': 'ad'}. Best is trial 63 with value: 0.5.
2024-12-06 23:37:12,622 - INFO - Candidate Mean Stats: {'Max': np.float64(3.3854010194290196), 'Min': np.float64(-1.0614524817824045), 'Mean': np.float64(0.5307783758792268), 'Std': np.float64(0.5642076068142612)}
2024-12-06 23:37:12,622 - INFO - Candidate Std Stats: {'Max': np.float64(1.4639176323129133), 'Min': np.float64(0.0), 'Mean': np.float64(0.5670049990576979), 'Std': np.float64(0.28115201980280596)}
[I 2024-12-06 23:37:12,636] Trial 193 finished with value: 1.0714285714285714 and parameters: {'x_0_0': 'bd', 'x_0_1': 'oo', 'x_1_0': 'ad', 'x_1_1': 'bd'}. Best is trial 23 with value: 0.5.
2024-12-06 23:37:12,872 - INFO - Candidate Mean Stats: {'Max': np.float64(3.066285082624646), 'Min': np.float64(-0.8059084859337873), 'Mean': np.float64(0.5375896515479986), 'Std': np.float64(0.5177917523382909)}
2024-12-06 23:37:12,872 - INFO - Candidate Std Stats: {'Max': np.float64(1.6506374440618605), 'Min': np.float64(0.0), 'Mean': np.float64(0.5818016929686525), 'Std': np.float64(0.28266983026654513)}
[I 2024-12-06 23:37:12,884] Trial 195 finished with value: 0.8214285714285714 and parameters: {'x_0_0': 'ac', 'x_0_1': 'oo', 'x_1_0': 'oo', 'x_1_1': 'ab'}. Best is trial 165 with value: 0.5.
2024-12-06 23:37:12,890 - INFO - Candidate Mean Stats: {'Max': np.float64(3.276417848318424), 'Min': np.float64(-0.6441337270022006), 'Mean': np.float64(0.57472355997827), 'Std': np.float64(0.5006192022812881)}
2024-12-06 23:37:12,890 - INFO - Candidate Std Stats: {'Max': np.float64(1.6565460291453877), 'Min': np.float64(0.0), 'Mean': np.float64(0.516752595670167), 'Std': np.float64(0.2759519231104866)}
2024-12-06 23:37:12,891 - INFO - Candidate Mean Stats: {'Max': np.float64(2.718675972661792), 'Min': np.float64(-0.8803138377959732), 'Mean': np.float64(0.504210962865139), 'Std': np.float64(0.5539166559776385)}
2024-12-06 23:37:12,891 - INFO - Candidate Std Stats: {'Max': np.float64(1.6673029247799513), 'Min': np.float64(0.0), 'Mean': np.float64(0.5989119916687918), 'Std': np.float64(0.3040425593484455)}
[I 2024-12-06 23:37:12,903] Trial 195 finished with value: 1.0714285714285714 and parameters: {'x_0_0': 'ac', 'x_0_1': 'oo', 'x_1_0': 'ab', 'x_1_1': 'cd'}. Best is trial 76 with value: 0.5.
[I 2024-12-06 23:37:12,904] Trial 195 finished with value: 1.5714285714285714 and parameters: {'x_0_0': 'bd', 'x_0_1': 'ac', 'x_1_0': 'ad', 'x_1_1': 'bc'}. Best is trial 63 with value: 0.5.
2024-12-06 23:37:12,997 - INFO - Candidate Mean Stats: {'Max': np.float64(2.7492514508853567), 'Min': np.float64(-0.9623113235896638), 'Mean': np.float64(0.42769756036550194), 'Std': np.float64(0.5988581324989546)}
2024-12-06 23:37:12,997 - INFO - Candidate Std Stats: {'Max': np.float64(1.531720304786769), 'Min': np.float64(0.0), 'Mean': np.float64(0.5908307237599824), 'Std': np.float64(0.29200800882486166)}
[I 2024-12-06 23:37:13,010] Trial 194 finished with value: 1.0714285714285714 and parameters: {'x_0_0': 'ad', 'x_0_1': 'oo', 'x_1_0': 'cd', 'x_1_1': 'ab'}. Best is trial 23 with value: 0.5.
2024-12-06 23:37:13,230 - INFO - Candidate Mean Stats: {'Max': np.float64(3.039352395339697), 'Min': np.float64(-0.7908723034067803), 'Mean': np.float64(0.583184467359413), 'Std': np.float64(0.4668594454164282)}
2024-12-06 23:37:13,230 - INFO - Candidate Std Stats: {'Max': np.float64(1.607182277137384), 'Min': np.float64(0.0), 'Mean': np.float64(0.552735967517547), 'Std': np.float64(0.28114947373312793)}
[I 2024-12-06 23:37:13,244] Trial 196 finished with value: 1.375 and parameters: {'x_0_0': 'oo', 'x_0_1': 'oo', 'x_1_0': 'ad', 'x_1_1': 'bd'}. Best is trial 165 with value: 0.5.
2024-12-06 23:37:13,247 - INFO - Candidate Mean Stats: {'Max': np.float64(3.4460408346709075), 'Min': np.float64(-1.3005503980283737), 'Mean': np.float64(0.4274486066524211), 'Std': np.float64(0.5647710692601291)}
2024-12-06 23:37:13,247 - INFO - Candidate Std Stats: {'Max': np.float64(1.8405765951169148), 'Min': np.float64(0.0), 'Mean': np.float64(0.6344025998502302), 'Std': np.float64(0.3196380947159866)}
2024-12-06 23:37:13,253 - INFO - Candidate Mean Stats: {'Max': np.float64(2.8493420567391836), 'Min': np.float64(-1.0616948235281602), 'Mean': np.float64(0.45860351453378634), 'Std': np.float64(0.5859684524381708)}
2024-12-06 23:37:13,253 - INFO - Candidate Std Stats: {'Max': np.float64(1.6840405931254019), 'Min': np.float64(0.0), 'Mean': np.float64(0.6424650395505564), 'Std': np.float64(0.3183066623188359)}
[I 2024-12-06 23:37:13,260] Trial 196 finished with value: 0.9464285714285714 and parameters: {'x_0_0': 'ad', 'x_0_1': 'oo', 'x_1_0': 'ac', 'x_1_1': 'oo'}. Best is trial 76 with value: 0.5.
[I 2024-12-06 23:37:13,266] Trial 196 finished with value: 1.2142857142857144 and parameters: {'x_0_0': 'ab', 'x_0_1': 'oo', 'x_1_0': 'cd', 'x_1_1': 'ad'}. Best is trial 63 with value: 0.5.
2024-12-06 23:37:13,359 - INFO - Candidate Mean Stats: {'Max': np.float64(3.4846029126610345), 'Min': np.float64(-1.4549865871440073), 'Mean': np.float64(0.518636936352907), 'Std': np.float64(0.584256530149894)}
2024-12-06 23:37:13,359 - INFO - Candidate Std Stats: {'Max': np.float64(1.7086696004716109), 'Min': np.float64(0.0), 'Mean': np.float64(0.535274593468669), 'Std': np.float64(0.27005697348158036)}
