[I 2024-12-06 23:38:28,281] Trial 395 finished with value: 1.5714285714285714 and parameters: {'x_0_0': 'bd', 'x_0_1': 'ac', 'x_1_0': 'ac', 'x_1_1': 'bd'}. Best is trial 165 with value: 0.5.
2024-12-06 23:38:28,312 - INFO - Candidate Mean Stats: {'Max': np.float64(3.1682908317723983), 'Min': np.float64(-0.4591564450311778), 'Mean': np.float64(0.7506905891797339), 'Std': np.float64(0.4904053456267464)}
2024-12-06 23:38:28,312 - INFO - Candidate Std Stats: {'Max': np.float64(1.414925282946878), 'Min': np.float64(0.0), 'Mean': np.float64(0.4402353145258568), 'Std': np.float64(0.28367425821284115)}
[I 2024-12-06 23:38:28,327] Trial 395 finished with value: 1.1428571428571428 and parameters: {'x_0_0': 'bd', 'x_0_1': 'cd', 'x_1_0': 'bc', 'x_1_1': 'ab'}. Best is trial 63 with value: 0.5.
2024-12-06 23:38:28,337 - INFO - Candidate Mean Stats: {'Max': np.float64(3.2870377064641234), 'Min': np.float64(-0.6110867109691183), 'Mean': np.float64(0.7609594200241324), 'Std': np.float64(0.5081571237747805)}
2024-12-06 23:38:28,337 - INFO - Candidate Std Stats: {'Max': np.float64(1.5538669185005876), 'Min': np.float64(0.0), 'Mean': np.float64(0.4614658896178509), 'Std': np.float64(0.3030625902970486)}
[I 2024-12-06 23:38:28,351] Trial 393 finished with value: 1.75 and parameters: {'x_0_0': 'cd', 'x_0_1': 'bc', 'x_1_0': 'oo', 'x_1_1': 'cd'}. Best is trial 23 with value: 0.5.
2024-12-06 23:38:28,592 - INFO - Candidate Mean Stats: {'Max': np.float64(3.0050944275874656), 'Min': np.float64(-0.9105704552735554), 'Mean': np.float64(0.6654759023813562), 'Std': np.float64(0.6094078793873613)}
2024-12-06 23:38:28,592 - INFO - Candidate Std Stats: {'Max': np.float64(1.5729577277619118), 'Min': np.float64(0.0), 'Mean': np.float64(0.5719269360666411), 'Std': np.float64(0.34042671377733125)}
[I 2024-12-06 23:38:28,607] Trial 396 finished with value: 1.0357142857142856 and parameters: {'x_0_0': 'bc', 'x_0_1': 'ad', 'x_1_0': 'oo', 'x_1_1': 'cd'}. Best is trial 76 with value: 0.5.
2024-12-06 23:38:28,657 - INFO - Candidate Mean Stats: {'Max': np.float64(3.046176060430547), 'Min': np.float64(-0.5800499192449087), 'Mean': np.float64(0.7755760638643114), 'Std': np.float64(0.5217874116957116)}
2024-12-06 23:38:28,657 - INFO - Candidate Std Stats: {'Max': np.float64(1.9505901038831033), 'Min': np.float64(0.0), 'Mean': np.float64(0.5262594206752302), 'Std': np.float64(0.3372364258849055)}
[I 2024-12-06 23:38:28,671] Trial 396 finished with value: 1.375 and parameters: {'x_0_0': 'oo', 'x_0_1': 'oo', 'x_1_0': 'ad', 'x_1_1': 'ac'}. Best is trial 165 with value: 0.5.
2024-12-06 23:38:28,702 - INFO - Candidate Mean Stats: {'Max': np.float64(2.7426742636999752), 'Min': np.float64(-0.5684330245606868), 'Mean': np.float64(0.794387036456629), 'Std': np.float64(0.49319157775295547)}
2024-12-06 23:38:28,702 - INFO - Candidate Std Stats: {'Max': np.float64(1.6700002528713287), 'Min': np.float64(0.0), 'Mean': np.float64(0.4969445974391945), 'Std': np.float64(0.31728079570794976)}
[I 2024-12-06 23:38:28,716] Trial 396 finished with value: 1.375 and parameters: {'x_0_0': 'oo', 'x_0_1': 'oo', 'x_1_0': 'cd', 'x_1_1': 'ad'}. Best is trial 63 with value: 0.5.
2024-12-06 23:38:28,727 - INFO - Candidate Mean Stats: {'Max': np.float64(3.0590563915677143), 'Min': np.float64(-0.310914083125401), 'Mean': np.float64(0.8057992923276988), 'Std': np.float64(0.45856267922862026)}
2024-12-06 23:38:28,728 - INFO - Candidate Std Stats: {'Max': np.float64(1.371361908287254), 'Min': np.float64(0.0), 'Mean': np.float64(0.4452702060951523), 'Std': np.float64(0.28141686013657063)}
[I 2024-12-06 23:38:28,742] Trial 394 finished with value: 1.2857142857142856 and parameters: {'x_0_0': 'ad', 'x_0_1': 'ac', 'x_1_0': 'bc', 'x_1_1': 'cd'}. Best is trial 23 with value: 0.5.
2024-12-06 23:38:28,980 - INFO - Candidate Mean Stats: {'Max': np.float64(3.2566678222268215), 'Min': np.float64(-0.630914986060878), 'Mean': np.float64(0.7523376902325876), 'Std': np.float64(0.5536285111383339)}
2024-12-06 23:38:28,980 - INFO - Candidate Std Stats: {'Max': np.float64(1.4829782494249306), 'Min': np.float64(0.0), 'Mean': np.float64(0.4879540581079605), 'Std': np.float64(0.3016597579789011)}
[I 2024-12-06 23:38:28,994] Trial 397 finished with value: 1.0357142857142856 and parameters: {'x_0_0': 'ac', 'x_0_1': 'ad', 'x_1_0': 'oo', 'x_1_1': 'ad'}. Best is trial 76 with value: 0.5.
2024-12-06 23:38:29,044 - INFO - Candidate Mean Stats: {'Max': np.float64(3.0816669644925483), 'Min': np.float64(-0.6148560130306338), 'Mean': np.float64(0.7090255963905054), 'Std': np.float64(0.5307635247168678)}
2024-12-06 23:38:29,044 - INFO - Candidate Std Stats: {'Max': np.float64(1.7320972389419367), 'Min': np.float64(0.0), 'Mean': np.float64(0.5538205649767162), 'Std': np.float64(0.3506523894948385)}
[I 2024-12-06 23:38:29,058] Trial 397 finished with value: 1.5714285714285714 and parameters: {'x_0_0': 'bc', 'x_0_1': 'bd', 'x_1_0': 'bc', 'x_1_1': 'cd'}. Best is trial 165 with value: 0.5.
2024-12-06 23:38:29,089 - INFO - Candidate Mean Stats: {'Max': np.float64(3.0391404758011915), 'Min': np.float64(-0.7173643841822036), 'Mean': np.float64(0.7917447486907844), 'Std': np.float64(0.5093658617326091)}
2024-12-06 23:38:29,089 - INFO - Candidate Std Stats: {'Max': np.float64(1.6485488332305773), 'Min': np.float64(0.0), 'Mean': np.float64(0.49973399227511744), 'Std': np.float64(0.31502277285012426)}
[I 2024-12-06 23:38:29,103] Trial 397 finished with value: 1.25 and parameters: {'x_0_0': 'oo', 'x_0_1': 'oo', 'x_1_0': 'bc', 'x_1_1': 'oo'}. Best is trial 63 with value: 0.5.
2024-12-06 23:38:29,118 - INFO - Candidate Mean Stats: {'Max': np.float64(2.81758687431548), 'Min': np.float64(-0.4636507885332358), 'Mean': np.float64(0.7972204151995418), 'Std': np.float64(0.47912720014992405)}
2024-12-06 23:38:29,118 - INFO - Candidate Std Stats: {'Max': np.float64(1.6275039505231068), 'Min': np.float64(0.0), 'Mean': np.float64(0.424466077753197), 'Std': np.float64(0.2656708981230125)}
[I 2024-12-06 23:38:29,132] Trial 395 finished with value: 1.3214285714285714 and parameters: {'x_0_0': 'ac', 'x_0_1': 'bc', 'x_1_0': 'oo', 'x_1_1': 'ac'}. Best is trial 23 with value: 0.5.
2024-12-06 23:38:29,365 - INFO - Candidate Mean Stats: {'Max': np.float64(3.1800289429815387), 'Min': np.float64(-0.6367289842027838), 'Mean': np.float64(0.7882723034407731), 'Std': np.float64(0.5650854820476249)}
2024-12-06 23:38:29,365 - INFO - Candidate Std Stats: {'Max': np.float64(1.6050518490111554), 'Min': np.float64(0.0), 'Mean': np.float64(0.48960431741980437), 'Std': np.float64(0.30833582604399035)}
[I 2024-12-06 23:38:29,379] Trial 398 finished with value: 1.2857142857142856 and parameters: {'x_0_0': 'ac', 'x_0_1': 'ad', 'x_1_0': 'bd', 'x_1_1': 'cd'}. Best is trial 76 with value: 0.5.
2024-12-06 23:38:29,432 - INFO - Candidate Mean Stats: {'Max': np.float64(2.9324701498692756), 'Min': np.float64(-0.6605391654846067), 'Mean': np.float64(0.7425312178870763), 'Std': np.float64(0.5331587580206357)}
2024-12-06 23:38:29,432 - INFO - Candidate Std Stats: {'Max': np.float64(1.543273302420681), 'Min': np.float64(0.0), 'Mean': np.float64(0.5085756532328369), 'Std': np.float64(0.3203454674037078)}
[I 2024-12-06 23:38:29,446] Trial 398 finished with value: 1.2857142857142856 and parameters: {'x_0_0': 'bc', 'x_0_1': 'ac', 'x_1_0': 'cd', 'x_1_1': 'ad'}. Best is trial 165 with value: 0.5.
2024-12-06 23:38:29,476 - INFO - Candidate Mean Stats: {'Max': np.float64(3.1407374332988636), 'Min': np.float64(-0.5725761611602256), 'Mean': np.float64(0.7374872733892709), 'Std': np.float64(0.5213811794267977)}
2024-12-06 23:38:29,476 - INFO - Candidate Std Stats: {'Max': np.float64(1.5325830171844965), 'Min': np.float64(0.0), 'Mean': np.float64(0.4899395827777962), 'Std': np.float64(0.3177398252742288)}
[I 2024-12-06 23:38:29,490] Trial 398 finished with value: 1.5714285714285714 and parameters: {'x_0_0': 'bc', 'x_0_1': 'cd', 'x_1_0': 'bd', 'x_1_1': 'ad'}. Best is trial 63 with value: 0.5.
2024-12-06 23:38:29,512 - INFO - Candidate Mean Stats: {'Max': np.float64(2.8156545918267617), 'Min': np.float64(-0.31818071931486475), 'Mean': np.float64(0.7819705207015358), 'Std': np.float64(0.4775672046275526)}
2024-12-06 23:38:29,512 - INFO - Candidate Std Stats: {'Max': np.float64(1.4411967489535404), 'Min': np.float64(0.0), 'Mean': np.float64(0.46668059650276833), 'Std': np.float64(0.29579851886915737)}
[I 2024-12-06 23:38:29,526] Trial 396 finished with value: 1.3214285714285714 and parameters: {'x_0_0': 'bd', 'x_0_1': 'cd', 'x_1_0': 'oo', 'x_1_1': 'bd'}. Best is trial 23 with value: 0.5.
2024-12-06 23:38:29,753 - INFO - Candidate Mean Stats: {'Max': np.float64(2.863665161205078), 'Min': np.float64(-0.7990972156862876), 'Mean': np.float64(0.7095951562435576), 'Std': np.float64(0.5965959591296008)}
2024-12-06 23:38:29,753 - INFO - Candidate Std Stats: {'Max': np.float64(1.6201163024561704), 'Min': np.float64(0.0), 'Mean': np.float64(0.5551927403220799), 'Std': np.float64(0.33918172535360114)}
[I 2024-12-06 23:38:29,767] Trial 399 finished with value: 1.5714285714285714 and parameters: {'x_0_0': 'ac', 'x_0_1': 'cd', 'x_1_0': 'cd', 'x_1_1': 'ac'}. Best is trial 76 with value: 0.5.
2024-12-06 23:38:29,818 - INFO - Candidate Mean Stats: {'Max': np.float64(2.751932423258073), 'Min': np.float64(-0.5923556981052798), 'Mean': np.float64(0.7782678876595466), 'Std': np.float64(0.49022577560969316)}
2024-12-06 23:38:29,818 - INFO - Candidate Std Stats: {'Max': np.float64(1.5830199844030346), 'Min': np.float64(0.0), 'Mean': np.float64(0.48547499448626785), 'Std': np.float64(0.3052345934556801)}
[I 2024-12-06 23:38:29,832] Trial 399 finished with value: 0.9107142857142857 and parameters: {'x_0_0': 'ac', 'x_0_1': 'ad', 'x_1_0': 'oo', 'x_1_1': 'oo'}. Best is trial 165 with value: 0.5.
2024-12-06 23:38:29,862 - INFO - Candidate Mean Stats: {'Max': np.float64(2.853352001274992), 'Min': np.float64(-0.7878574389056902), 'Mean': np.float64(0.7421742893645215), 'Std': np.float64(0.5600414250895501)}
2024-12-06 23:38:29,862 - INFO - Candidate Std Stats: {'Max': np.float64(1.810754126009312), 'Min': np.float64(0.0), 'Mean': np.float64(0.4960883453875807), 'Std': np.float64(0.3036799390289645)}
[I 2024-12-06 23:38:29,876] Trial 399 finished with value: 0.8928571428571428 and parameters: {'x_0_0': 'ac', 'x_0_1': 'ad', 'x_1_0': 'oo', 'x_1_1': 'ab'}. Best is trial 63 with value: 0.5.
2024-12-06 23:38:29,901 - INFO - Candidate Mean Stats: {'Max': np.float64(2.7860699955408834), 'Min': np.float64(-0.6263559871849754), 'Mean': np.float64(0.729681033448008), 'Std': np.float64(0.5474429974164143)}
2024-12-06 23:38:29,901 - INFO - Candidate Std Stats: {'Max': np.float64(2.0297290206726037), 'Min': np.float64(0.0), 'Mean': np.float64(0.4968833979661362), 'Std': np.float64(0.3260816563812476)}
[I 2024-12-06 23:38:29,915] Trial 397 finished with value: 1.3214285714285714 and parameters: {'x_0_0': 'bd', 'x_0_1': 'ab', 'x_1_0': 'oo', 'x_1_1': 'cd'}. Best is trial 23 with value: 0.5.
2024-12-06 23:38:30,138 - INFO - Candidate Mean Stats: {'Max': np.float64(3.2597079099076316), 'Min': np.float64(-0.5205854442948559), 'Mean': np.float64(0.8003754674091234), 'Std': np.float64(0.5357881664614645)}
2024-12-06 23:38:30,138 - INFO - Candidate Std Stats: {'Max': np.float64(1.4770611857536706), 'Min': np.float64(0.0), 'Mean': np.float64(0.4869437578622162), 'Std': np.float64(0.29891026295218004)}
[I 2024-12-06 23:38:30,152] Trial 400 finished with value: 0.7857142857142857 and parameters: {'x_0_0': 'bd', 'x_0_1': 'oo', 'x_1_0': 'bd', 'x_1_1': 'ad'}. Best is trial 76 with value: 0.5.
2024-12-06 23:38:30,202 - INFO - Candidate Mean Stats: {'Max': np.float64(3.609787467617808), 'Min': np.float64(-0.5229937071662498), 'Mean': np.float64(0.7710078047777036), 'Std': np.float64(0.5160865585245874)}
2024-12-06 23:38:30,202 - INFO - Candidate Std Stats: {'Max': np.float64(1.7987449539316356), 'Min': np.float64(0.0), 'Mean': np.float64(0.45839806366131647), 'Std': np.float64(0.3006057650299681)}
[I 2024-12-06 23:38:30,216] Trial 400 finished with value: 1.4285714285714286 and parameters: {'x_0_0': 'ac', 'x_0_1': 'ab', 'x_1_0': 'bd', 'x_1_1': 'cd'}. Best is trial 165 with value: 0.5.
2024-12-06 23:38:30,250 - INFO - Candidate Mean Stats: {'Max': np.float64(2.702493961728371), 'Min': np.float64(-0.36256061459629807), 'Mean': np.float64(0.8194105203782801), 'Std': np.float64(0.42322638993730677)}
2024-12-06 23:38:30,250 - INFO - Candidate Std Stats: {'Max': np.float64(1.8920524820186473), 'Min': np.float64(0.0), 'Mean': np.float64(0.40655798735841175), 'Std': np.float64(0.3007595332516971)}
[I 2024-12-06 23:38:30,264] Trial 400 finished with value: 1.375 and parameters: {'x_0_0': 'oo', 'x_0_1': 'oo', 'x_1_0': 'cd', 'x_1_1': 'bd'}. Best is trial 63 with value: 0.5.
2024-12-06 23:38:30,290 - INFO - Candidate Mean Stats: {'Max': np.float64(2.9282051487304415), 'Min': np.float64(-0.4599328043394175), 'Mean': np.float64(0.8064736897153618), 'Std': np.float64(0.5020540406050384)}
2024-12-06 23:38:30,290 - INFO - Candidate Std Stats: {'Max': np.float64(1.635110657635748), 'Min': np.float64(0.0), 'Mean': np.float64(0.45145143744397376), 'Std': np.float64(0.2841671617074394)}
[I 2024-12-06 23:38:30,304] Trial 398 finished with value: 1.3035714285714286 and parameters: {'x_0_0': 'bd', 'x_0_1': 'ad', 'x_1_0': 'ab', 'x_1_1': 'oo'}. Best is trial 23 with value: 0.5.
2024-12-06 23:38:30,525 - INFO - Candidate Mean Stats: {'Max': np.float64(3.141329965587996), 'Min': np.float64(-0.4782747861384786), 'Mean': np.float64(0.7486088870197349), 'Std': np.float64(0.5182608938297247)}
2024-12-06 23:38:30,525 - INFO - Candidate Std Stats: {'Max': np.float64(1.9011437605551784), 'Min': np.float64(0.0), 'Mean': np.float64(0.44641481875202926), 'Std': np.float64(0.2806826355853154)}
[I 2024-12-06 23:38:30,539] Trial 401 finished with value: 1.4464285714285714 and parameters: {'x_0_0': 'bd', 'x_0_1': 'bc', 'x_1_0': 'ac', 'x_1_1': 'oo'}. Best is trial 76 with value: 0.5.
2024-12-06 23:38:30,589 - INFO - Candidate Mean Stats: {'Max': np.float64(3.1493880684905755), 'Min': np.float64(-0.7330850184509567), 'Mean': np.float64(0.7428866461101521), 'Std': np.float64(0.5421968020973641)}
2024-12-06 23:38:30,589 - INFO - Candidate Std Stats: {'Max': np.float64(1.7665923570385993), 'Min': np.float64(0.0), 'Mean': np.float64(0.5091611423506703), 'Std': np.float64(0.3223720707327443)}
[I 2024-12-06 23:38:30,603] Trial 401 finished with value: 0.9285714285714286 and parameters: {'x_0_0': 'ad', 'x_0_1': 'oo', 'x_1_0': 'ab', 'x_1_1': 'bd'}. Best is trial 165 with value: 0.5.
2024-12-06 23:38:30,637 - INFO - Candidate Mean Stats: {'Max': np.float64(2.8310253267220054), 'Min': np.float64(-0.6230260278916461), 'Mean': np.float64(0.7774968281690402), 'Std': np.float64(0.5137003598679545)}
2024-12-06 23:38:30,637 - INFO - Candidate Std Stats: {'Max': np.float64(1.5767575009305785), 'Min': np.float64(0.0), 'Mean': np.float64(0.47859813890240904), 'Std': np.float64(0.30603397129649074)}
[I 2024-12-06 23:38:30,651] Trial 401 finished with value: 1.4285714285714286 and parameters: {'x_0_0': 'ad', 'x_0_1': 'ad', 'x_1_0': 'ab', 'x_1_1': 'cd'}. Best is trial 63 with value: 0.5.
2024-12-06 23:38:30,676 - INFO - Candidate Mean Stats: {'Max': np.float64(3.3662667161523423), 'Min': np.float64(-0.5421393363192999), 'Mean': np.float64(0.7989672314086729), 'Std': np.float64(0.4680494761333894)}
2024-12-06 23:38:30,676 - INFO - Candidate Std Stats: {'Max': np.float64(1.3044608473559467), 'Min': np.float64(0.0), 'Mean': np.float64(0.4442332558130775), 'Std': np.float64(0.2710540852245242)}
[I 2024-12-06 23:38:30,689] Trial 399 finished with value: 1.2857142857142856 and parameters: {'x_0_0': 'ac', 'x_0_1': 'ac', 'x_1_0': 'ad', 'x_1_1': 'ac'}. Best is trial 23 with value: 0.5.
2024-12-06 23:38:30,910 - INFO - Candidate Mean Stats: {'Max': np.float64(3.012916576071322), 'Min': np.float64(-0.47240285436332935), 'Mean': np.float64(0.8002018737014394), 'Std': np.float64(0.5277885751935597)}
2024-12-06 23:38:30,910 - INFO - Candidate Std Stats: {'Max': np.float64(1.667496870243677), 'Min': np.float64(0.0), 'Mean': np.float64(0.44127373889962035), 'Std': np.float64(0.28716994827213205)}
[I 2024-12-06 23:38:30,925] Trial 402 finished with value: 1.0357142857142856 and parameters: {'x_0_0': 'ac', 'x_0_1': 'ac', 'x_1_0': 'oo', 'x_1_1': 'bd'}. Best is trial 76 with value: 0.5.
2024-12-06 23:38:30,976 - INFO - Candidate Mean Stats: {'Max': np.float64(3.090903486299208), 'Min': np.float64(-0.9380764344654164), 'Mean': np.float64(0.7091433410147195), 'Std': np.float64(0.5770680321418302)}
2024-12-06 23:38:30,977 - INFO - Candidate Std Stats: {'Max': np.float64(1.5754173245793937), 'Min': np.float64(0.0), 'Mean': np.float64(0.5009851553853243), 'Std': np.float64(0.3119066993724138)}
[I 2024-12-06 23:38:30,991] Trial 402 finished with value: 1.375 and parameters: {'x_0_0': 'oo', 'x_0_1': 'oo', 'x_1_0': 'bd', 'x_1_1': 'bd'}. Best is trial 165 with value: 0.5.
2024-12-06 23:38:31,024 - INFO - Candidate Mean Stats: {'Max': np.float64(2.8874716299884646), 'Min': np.float64(-0.5322625163521455), 'Mean': np.float64(0.7355118629644799), 'Std': np.float64(0.5259971318259528)}
2024-12-06 23:38:31,025 - INFO - Candidate Std Stats: {'Max': np.float64(1.5719054677383968), 'Min': np.float64(0.0), 'Mean': np.float64(0.49722524739957713), 'Std': np.float64(0.3069684802505605)}
[I 2024-12-06 23:38:31,039] Trial 402 finished with value: 1.4464285714285714 and parameters: {'x_0_0': 'ac', 'x_0_1': 'bc', 'x_1_0': 'cd', 'x_1_1': 'oo'}. Best is trial 63 with value: 0.5.
2024-12-06 23:38:31,064 - INFO - Candidate Mean Stats: {'Max': np.float64(3.184871357226373), 'Min': np.float64(-0.24112195378974147), 'Mean': np.float64(0.8110817478277604), 'Std': np.float64(0.4812149598751976)}
2024-12-06 23:38:31,064 - INFO - Candidate Std Stats: {'Max': np.float64(1.4235191711030932), 'Min': np.float64(0.0), 'Mean': np.float64(0.4574484602624958), 'Std': np.float64(0.28356687609553244)}
[I 2024-12-06 23:38:31,078] Trial 400 finished with value: 1.5714285714285714 and parameters: {'x_0_0': 'ac', 'x_0_1': 'bc', 'x_1_0': 'ab', 'x_1_1': 'bd'}. Best is trial 23 with value: 0.5.
2024-12-06 23:38:31,297 - INFO - Candidate Mean Stats: {'Max': np.float64(2.7967610007586936), 'Min': np.float64(-1.1835529895396968), 'Mean': np.float64(0.7564042999644095), 'Std': np.float64(0.5764614752537548)}
2024-12-06 23:38:31,298 - INFO - Candidate Std Stats: {'Max': np.float64(1.743415999657056), 'Min': np.float64(0.0), 'Mean': np.float64(0.5146104635869015), 'Std': np.float64(0.3221625893798671)}
[I 2024-12-06 23:38:31,311] Trial 403 finished with value: 1.1428571428571428 and parameters: {'x_0_0': 'ac', 'x_0_1': 'ad', 'x_1_0': 'ad', 'x_1_1': 'ab'}. Best is trial 76 with value: 0.5.
2024-12-06 23:38:31,363 - INFO - Candidate Mean Stats: {'Max': np.float64(2.791822217376928), 'Min': np.float64(-0.6593286436038772), 'Mean': np.float64(0.7047021824055564), 'Std': np.float64(0.5527081222869215)}
2024-12-06 23:38:31,363 - INFO - Candidate Std Stats: {'Max': np.float64(1.7671197526126359), 'Min': np.float64(0.0), 'Mean': np.float64(0.5576240385156727), 'Std': np.float64(0.33408013067183995)}
[I 2024-12-06 23:38:31,377] Trial 403 finished with value: 1.1607142857142856 and parameters: {'x_0_0': 'bd', 'x_0_1': 'ab', 'x_1_0': 'bd', 'x_1_1': 'oo'}. Best is trial 165 with value: 0.5.
2024-12-06 23:38:31,410 - INFO - Candidate Mean Stats: {'Max': np.float64(3.0605728962599654), 'Min': np.float64(-0.48007927457395744), 'Mean': np.float64(0.7771508276186296), 'Std': np.float64(0.48693175459661026)}
2024-12-06 23:38:31,410 - INFO - Candidate Std Stats: {'Max': np.float64(1.4317321058522507), 'Min': np.float64(0.0), 'Mean': np.float64(0.44581497552056476), 'Std': np.float64(0.27862576090746033)}
[I 2024-12-06 23:38:31,425] Trial 403 finished with value: 1.2857142857142856 and parameters: {'x_0_0': 'ac', 'x_0_1': 'ac', 'x_1_0': 'bc', 'x_1_1': 'cd'}. Best is trial 63 with value: 0.5.
2024-12-06 23:38:31,451 - INFO - Candidate Mean Stats: {'Max': np.float64(3.336122325624481), 'Min': np.float64(-0.45941859700362625), 'Mean': np.float64(0.7757202062356615), 'Std': np.float64(0.5088756234382805)}
2024-12-06 23:38:31,451 - INFO - Candidate Std Stats: {'Max': np.float64(1.3850985089015324), 'Min': np.float64(0.0), 'Mean': np.float64(0.4606467100739444), 'Std': np.float64(0.29695417828596243)}
[I 2024-12-06 23:38:31,465] Trial 401 finished with value: 1.5714285714285714 and parameters: {'x_0_0': 'ac', 'x_0_1': 'bc', 'x_1_0': 'ab', 'x_1_1': 'ac'}. Best is trial 23 with value: 0.5.
2024-12-06 23:38:31,684 - INFO - Candidate Mean Stats: {'Max': np.float64(3.257526023754341), 'Min': np.float64(-0.71039768100149), 'Mean': np.float64(0.6921268831437929), 'Std': np.float64(0.5777728425859608)}
2024-12-06 23:38:31,684 - INFO - Candidate Std Stats: {'Max': np.float64(1.6697614157888319), 'Min': np.float64(0.0), 'Mean': np.float64(0.5630959047158306), 'Std': np.float64(0.34596271162576275)}
[I 2024-12-06 23:38:31,698] Trial 404 finished with value: 1.4464285714285714 and parameters: {'x_0_0': 'ad', 'x_0_1': 'ac', 'x_1_0': 'ad', 'x_1_1': 'oo'}. Best is trial 76 with value: 0.5.
2024-12-06 23:38:31,750 - INFO - Candidate Mean Stats: {'Max': np.float64(3.356842186997065), 'Min': np.float64(-0.4260410456656361), 'Mean': np.float64(0.8430776884415084), 'Std': np.float64(0.42952754362376544)}
2024-12-06 23:38:31,750 - INFO - Candidate Std Stats: {'Max': np.float64(1.6385192103635016), 'Min': np.float64(0.0), 'Mean': np.float64(0.42354356707731494), 'Std': np.float64(0.285767265909923)}
