[I 2024-12-07 00:29:07,022] Trial 120 finished with value: 1.2666666666666666 and parameters: {'x_0_0': 'bc', 'x_0_1': 'oo', 'x_0_2': 'ad', 'x_1_0': 'ab', 'x_1_1': 'bd', 'x_1_2': 'bd'}. Best is trial 118 with value: 0.8666666666666667.
2024-12-07 00:29:14,778 - INFO - Candidate Mean Stats: {'Max': np.float64(2.0), 'Min': np.float64(0.26760021106151044), 'Mean': np.float64(0.48859024055996897), 'Std': np.float64(0.06533218353893115)}
2024-12-07 00:29:14,778 - INFO - Candidate Std Stats: {'Max': np.float64(1.286613909894897), 'Min': np.float64(0.0), 'Mean': np.float64(0.10697003743330892), 'Std': np.float64(0.048512709927833984)}
[I 2024-12-07 00:29:14,816] Trial 120 finished with value: 1.7777777777777777 and parameters: {'x_0_0': 'ab', 'x_0_1': 'ac', 'x_0_2': 'ac', 'x_1_0': 'ad', 'x_1_1': 'ab', 'x_1_2': 'ab'}. Best is trial 74 with value: 0.8222222222222222.
2024-12-07 00:29:20,774 - INFO - Candidate Mean Stats: {'Max': np.float64(2.0), 'Min': np.float64(0.19529213313480548), 'Mean': np.float64(0.48647947684242826), 'Std': np.float64(0.07958073747055354)}
2024-12-07 00:29:20,774 - INFO - Candidate Std Stats: {'Max': np.float64(1.574703484521577), 'Min': np.float64(0.0), 'Mean': np.float64(0.1202732121928908), 'Std': np.float64(0.06562821714504534)}
[I 2024-12-07 00:29:20,814] Trial 121 finished with value: 1.9 and parameters: {'x_0_0': 'oo', 'x_0_1': 'ab', 'x_0_2': 'bc', 'x_1_0': 'ad', 'x_1_1': 'bd', 'x_1_2': 'ac'}. Best is trial 108 with value: 0.9666666666666667.
2024-12-07 00:29:23,127 - INFO - Candidate Mean Stats: {'Max': np.float64(2.0), 'Min': np.float64(0.2460571577788387), 'Mean': np.float64(0.48295191356821565), 'Std': np.float64(0.0794823018777583)}
2024-12-07 00:29:23,127 - INFO - Candidate Std Stats: {'Max': np.float64(1.338390594395839), 'Min': np.float64(0.0), 'Mean': np.float64(0.11237140391311722), 'Std': np.float64(0.061628362613405284)}
[I 2024-12-07 00:29:23,168] Trial 121 finished with value: 1.4444444444444444 and parameters: {'x_0_0': 'bc', 'x_0_1': 'ad', 'x_0_2': 'ad', 'x_1_0': 'bd', 'x_1_1': 'ad', 'x_1_2': 'bc'}. Best is trial 49 with value: 0.7999999999999999.
2024-12-07 00:29:24,527 - INFO - Candidate Mean Stats: {'Max': np.float64(2.0), 'Min': np.float64(0.2814612713217019), 'Mean': np.float64(0.4965013936578189), 'Std': np.float64(0.06866962991346029)}
2024-12-07 00:29:24,528 - INFO - Candidate Std Stats: {'Max': np.float64(0.3659385521618467), 'Min': np.float64(0.0), 'Mean': np.float64(0.10767150553128906), 'Std': np.float64(0.042985364871543835)}
[I 2024-12-07 00:29:24,566] Trial 121 finished with value: 1.5666666666666667 and parameters: {'x_0_0': 'ad', 'x_0_1': 'bd', 'x_0_2': 'ac', 'x_1_0': 'ad', 'x_1_1': 'ac', 'x_1_2': 'oo'}. Best is trial 118 with value: 0.8666666666666667.
2024-12-07 00:29:32,461 - INFO - Candidate Mean Stats: {'Max': np.float64(2.0), 'Min': np.float64(0.21216156623552399), 'Mean': np.float64(0.4860052374477459), 'Std': np.float64(0.06833837990594208)}
2024-12-07 00:29:32,462 - INFO - Candidate Std Stats: {'Max': np.float64(1.7022372756711488), 'Min': np.float64(0.0), 'Mean': np.float64(0.10422428156277228), 'Std': np.float64(0.049341802418785344)}
[I 2024-12-07 00:29:32,505] Trial 121 finished with value: 1.0666666666666667 and parameters: {'x_0_0': 'bd', 'x_0_1': 'oo', 'x_0_2': 'bd', 'x_1_0': 'oo', 'x_1_1': 'ab', 'x_1_2': 'ac'}. Best is trial 74 with value: 0.8222222222222222.
2024-12-07 00:29:38,947 - INFO - Candidate Mean Stats: {'Max': np.float64(2.0), 'Min': np.float64(0.2304753754045783), 'Mean': np.float64(0.4827527912980573), 'Std': np.float64(0.06997973330614331)}
2024-12-07 00:29:38,948 - INFO - Candidate Std Stats: {'Max': np.float64(0.41097881148420307), 'Min': np.float64(0.0), 'Mean': np.float64(0.11754780926095824), 'Std': np.float64(0.047303513547996875)}
[I 2024-12-07 00:29:38,992] Trial 122 finished with value: 1.6666666666666665 and parameters: {'x_0_0': 'bd', 'x_0_1': 'bc', 'x_0_2': 'ac', 'x_1_0': 'ac', 'x_1_1': 'cd', 'x_1_2': 'ad'}. Best is trial 108 with value: 0.9666666666666667.
2024-12-07 00:29:41,441 - INFO - Candidate Mean Stats: {'Max': np.float64(2.0), 'Min': np.float64(0.1206826383476973), 'Mean': np.float64(0.48920166378963986), 'Std': np.float64(0.0712961006420775)}
2024-12-07 00:29:41,441 - INFO - Candidate Std Stats: {'Max': np.float64(0.5471542580075054), 'Min': np.float64(0.0), 'Mean': np.float64(0.1058854959176104), 'Std': np.float64(0.047255143999894625)}
[I 2024-12-07 00:29:41,482] Trial 122 finished with value: 1.6 and parameters: {'x_0_0': 'cd', 'x_0_1': 'oo', 'x_0_2': 'ab', 'x_1_0': 'ac', 'x_1_1': 'bc', 'x_1_2': 'ac'}. Best is trial 49 with value: 0.7999999999999999.
2024-12-07 00:29:42,788 - INFO - Candidate Mean Stats: {'Max': np.float64(2.0), 'Min': np.float64(0.20671266824377926), 'Mean': np.float64(0.49033374054368056), 'Std': np.float64(0.07627214773694532)}
2024-12-07 00:29:42,789 - INFO - Candidate Std Stats: {'Max': np.float64(0.8155038190995094), 'Min': np.float64(0.0), 'Mean': np.float64(0.11946029333201327), 'Std': np.float64(0.056847773575958625)}
[I 2024-12-07 00:29:42,829] Trial 122 finished with value: 1.7999999999999998 and parameters: {'x_0_0': 'cd', 'x_0_1': 'ac', 'x_0_2': 'ab', 'x_1_0': 'oo', 'x_1_1': 'bc', 'x_1_2': 'bc'}. Best is trial 118 with value: 0.8666666666666667.
2024-12-07 00:29:50,954 - INFO - Candidate Mean Stats: {'Max': np.float64(2.0), 'Min': np.float64(0.20663232085397), 'Mean': np.float64(0.49554965743839535), 'Std': np.float64(0.06729196908872427)}
2024-12-07 00:29:50,955 - INFO - Candidate Std Stats: {'Max': np.float64(0.4301794903623792), 'Min': np.float64(0.0), 'Mean': np.float64(0.10938400453477011), 'Std': np.float64(0.0450163768425236)}
[I 2024-12-07 00:29:50,996] Trial 122 finished with value: 1.4555555555555557 and parameters: {'x_0_0': 'bd', 'x_0_1': 'ab', 'x_0_2': 'bc', 'x_1_0': 'ab', 'x_1_1': 'bc', 'x_1_2': 'oo'}. Best is trial 74 with value: 0.8222222222222222.
2024-12-07 00:29:57,386 - INFO - Candidate Mean Stats: {'Max': np.float64(2.0), 'Min': np.float64(0.15328349852447026), 'Mean': np.float64(0.48310689317546635), 'Std': np.float64(0.07796750305468579)}
2024-12-07 00:29:57,386 - INFO - Candidate Std Stats: {'Max': np.float64(1.1342794219051902), 'Min': np.float64(0.0), 'Mean': np.float64(0.1176064518720518), 'Std': np.float64(0.057965970439613546)}
[I 2024-12-07 00:29:57,427] Trial 123 finished with value: 1.4666666666666666 and parameters: {'x_0_0': 'bd', 'x_0_1': 'ac', 'x_0_2': 'cd', 'x_1_0': 'oo', 'x_1_1': 'cd', 'x_1_2': 'cd'}. Best is trial 108 with value: 0.9666666666666667.
2024-12-07 00:29:59,864 - INFO - Candidate Mean Stats: {'Max': np.float64(2.0), 'Min': np.float64(0.18277684356113824), 'Mean': np.float64(0.48193825548575264), 'Std': np.float64(0.066399485038934)}
2024-12-07 00:29:59,864 - INFO - Candidate Std Stats: {'Max': np.float64(0.5703062051869645), 'Min': np.float64(0.0), 'Mean': np.float64(0.09735480287872778), 'Std': np.float64(0.04374642627838577)}
[I 2024-12-07 00:29:59,906] Trial 123 finished with value: 1.6666666666666665 and parameters: {'x_0_0': 'ad', 'x_0_1': 'ac', 'x_0_2': 'cd', 'x_1_0': 'ad', 'x_1_1': 'bc', 'x_1_2': 'ad'}. Best is trial 49 with value: 0.7999999999999999.
2024-12-07 00:30:01,217 - INFO - Candidate Mean Stats: {'Max': np.float64(2.0), 'Min': np.float64(0.2869889553675768), 'Mean': np.float64(0.4961872447652657), 'Std': np.float64(0.06349017849237175)}
2024-12-07 00:30:01,217 - INFO - Candidate Std Stats: {'Max': np.float64(0.3745224568322261), 'Min': np.float64(0.0), 'Mean': np.float64(0.10155482241929034), 'Std': np.float64(0.04188435497849726)}
[I 2024-12-07 00:30:01,257] Trial 123 finished with value: 1.3666666666666667 and parameters: {'x_0_0': 'ad', 'x_0_1': 'bc', 'x_0_2': 'ad', 'x_1_0': 'oo', 'x_1_1': 'bc', 'x_1_2': 'oo'}. Best is trial 118 with value: 0.8666666666666667.
2024-12-07 00:30:09,652 - INFO - Candidate Mean Stats: {'Max': np.float64(2.0), 'Min': np.float64(0.22969693082083223), 'Mean': np.float64(0.5002109360672552), 'Std': np.float64(0.06830177362327128)}
2024-12-07 00:30:09,653 - INFO - Candidate Std Stats: {'Max': np.float64(0.5780065542101592), 'Min': np.float64(0.0), 'Mean': np.float64(0.10525039186475076), 'Std': np.float64(0.0442599925309433)}
[I 2024-12-07 00:30:09,695] Trial 123 finished with value: 1.2666666666666666 and parameters: {'x_0_0': 'bc', 'x_0_1': 'oo', 'x_0_2': 'ad', 'x_1_0': 'bd', 'x_1_1': 'ab', 'x_1_2': 'ab'}. Best is trial 74 with value: 0.8222222222222222.
2024-12-07 00:30:16,010 - INFO - Candidate Mean Stats: {'Max': np.float64(2.0), 'Min': np.float64(0.25087560376677825), 'Mean': np.float64(0.48290330857503316), 'Std': np.float64(0.07384436216209783)}
2024-12-07 00:30:16,011 - INFO - Candidate Std Stats: {'Max': np.float64(1.4475395491039391), 'Min': np.float64(0.0), 'Mean': np.float64(0.11913663857353426), 'Std': np.float64(0.05551994098463523)}
[I 2024-12-07 00:30:16,055] Trial 124 finished with value: 1.4777777777777779 and parameters: {'x_0_0': 'ab', 'x_0_1': 'bd', 'x_0_2': 'ac', 'x_1_0': 'oo', 'x_1_1': 'oo', 'x_1_2': 'ab'}. Best is trial 108 with value: 0.9666666666666667.
2024-12-07 00:30:18,449 - INFO - Candidate Mean Stats: {'Max': np.float64(2.0), 'Min': np.float64(0.23406898399968382), 'Mean': np.float64(0.4842521628402104), 'Std': np.float64(0.07379181374156128)}
2024-12-07 00:30:18,450 - INFO - Candidate Std Stats: {'Max': np.float64(0.9432544083326017), 'Min': np.float64(0.0), 'Mean': np.float64(0.11637315687564713), 'Std': np.float64(0.05087916546542785)}
[I 2024-12-07 00:30:18,494] Trial 124 finished with value: 1.7999999999999998 and parameters: {'x_0_0': 'cd', 'x_0_1': 'bd', 'x_0_2': 'ac', 'x_1_0': 'oo', 'x_1_1': 'bc', 'x_1_2': 'ad'}. Best is trial 49 with value: 0.7999999999999999.
2024-12-07 00:30:19,886 - INFO - Candidate Mean Stats: {'Max': np.float64(2.0), 'Min': np.float64(0.2672281592538133), 'Mean': np.float64(0.49583054805354637), 'Std': np.float64(0.06756891660342063)}
2024-12-07 00:30:19,887 - INFO - Candidate Std Stats: {'Max': np.float64(1.746207519805653), 'Min': np.float64(0.0), 'Mean': np.float64(0.10321632686433888), 'Std': np.float64(0.047484223333175736)}
[I 2024-12-07 00:30:19,929] Trial 124 finished with value: 1.5666666666666667 and parameters: {'x_0_0': 'bd', 'x_0_1': 'ab', 'x_0_2': 'bc', 'x_1_0': 'cd', 'x_1_1': 'bc', 'x_1_2': 'oo'}. Best is trial 118 with value: 0.8666666666666667.
2024-12-07 00:30:28,578 - INFO - Candidate Mean Stats: {'Max': np.float64(2.0), 'Min': np.float64(0.25889857689042706), 'Mean': np.float64(0.48431718527715256), 'Std': np.float64(0.06968011435210779)}
2024-12-07 00:30:28,579 - INFO - Candidate Std Stats: {'Max': np.float64(0.47478506518720265), 'Min': np.float64(0.0), 'Mean': np.float64(0.10873849525998273), 'Std': np.float64(0.04441378878870529)}
[I 2024-12-07 00:30:28,620] Trial 124 finished with value: 1.1666666666666665 and parameters: {'x_0_0': 'ac', 'x_0_1': 'oo', 'x_0_2': 'ad', 'x_1_0': 'bc', 'x_1_1': 'ab', 'x_1_2': 'oo'}. Best is trial 74 with value: 0.8222222222222222.
2024-12-07 00:30:34,634 - INFO - Candidate Mean Stats: {'Max': np.float64(2.0), 'Min': np.float64(0.26693904990469497), 'Mean': np.float64(0.4906735356571166), 'Std': np.float64(0.06234344260110718)}
2024-12-07 00:30:34,635 - INFO - Candidate Std Stats: {'Max': np.float64(0.38193840928976885), 'Min': np.float64(0.0), 'Mean': np.float64(0.09769500074482036), 'Std': np.float64(0.0393743394328002)}
[I 2024-12-07 00:30:34,677] Trial 125 finished with value: 1.6666666666666665 and parameters: {'x_0_0': 'bd', 'x_0_1': 'ad', 'x_0_2': 'ab', 'x_1_0': 'ac', 'x_1_1': 'bc', 'x_1_2': 'bd'}. Best is trial 108 with value: 0.9666666666666667.
2024-12-07 00:30:37,171 - INFO - Candidate Mean Stats: {'Max': np.float64(2.0), 'Min': np.float64(0.27065847982950253), 'Mean': np.float64(0.49705846295724826), 'Std': np.float64(0.06898756255060505)}
2024-12-07 00:30:37,171 - INFO - Candidate Std Stats: {'Max': np.float64(0.8905406850949287), 'Min': np.float64(0.0), 'Mean': np.float64(0.11210790230757521), 'Std': np.float64(0.04878611180022355)}
[I 2024-12-07 00:30:37,212] Trial 125 finished with value: 1.1222222222222222 and parameters: {'x_0_0': 'bc', 'x_0_1': 'ad', 'x_0_2': 'bd', 'x_1_0': 'ab', 'x_1_1': 'bc', 'x_1_2': 'oo'}. Best is trial 49 with value: 0.7999999999999999.
2024-12-07 00:30:38,711 - INFO - Candidate Mean Stats: {'Max': np.float64(2.0), 'Min': np.float64(0.29225222910196824), 'Mean': np.float64(0.48159226250308185), 'Std': np.float64(0.06186084860068874)}
2024-12-07 00:30:38,712 - INFO - Candidate Std Stats: {'Max': np.float64(0.5595782974012619), 'Min': np.float64(0.0), 'Mean': np.float64(0.10012882041107601), 'Std': np.float64(0.04249895566872285)}
[I 2024-12-07 00:30:38,753] Trial 125 finished with value: 1.4666666666666668 and parameters: {'x_0_0': 'bc', 'x_0_1': 'bd', 'x_0_2': 'bc', 'x_1_0': 'bc', 'x_1_1': 'oo', 'x_1_2': 'oo'}. Best is trial 118 with value: 0.8666666666666667.
2024-12-07 00:30:47,477 - INFO - Candidate Mean Stats: {'Max': np.float64(2.0), 'Min': np.float64(0.22229090704572077), 'Mean': np.float64(0.4891673782363425), 'Std': np.float64(0.07329932243454305)}
2024-12-07 00:30:47,478 - INFO - Candidate Std Stats: {'Max': np.float64(0.4888502307774444), 'Min': np.float64(0.0), 'Mean': np.float64(0.10736154561177216), 'Std': np.float64(0.04799375679575274)}
[I 2024-12-07 00:30:47,519] Trial 125 finished with value: 1.7777777777777777 and parameters: {'x_0_0': 'ab', 'x_0_1': 'bc', 'x_0_2': 'bc', 'x_1_0': 'bc', 'x_1_1': 'cd', 'x_1_2': 'bc'}. Best is trial 74 with value: 0.8222222222222222.
2024-12-07 00:30:53,307 - INFO - Candidate Mean Stats: {'Max': np.float64(2.0), 'Min': np.float64(0.2620398095766233), 'Mean': np.float64(0.4952547984626072), 'Std': np.float64(0.07169521052482826)}
2024-12-07 00:30:53,308 - INFO - Candidate Std Stats: {'Max': np.float64(1.9842361765006484), 'Min': np.float64(0.0), 'Mean': np.float64(0.10137709673570701), 'Std': np.float64(0.05560287157087988)}
[I 2024-12-07 00:30:53,348] Trial 126 finished with value: 1.5555555555555556 and parameters: {'x_0_0': 'bc', 'x_0_1': 'ab', 'x_0_2': 'cd', 'x_1_0': 'ac', 'x_1_1': 'ac', 'x_1_2': 'bd'}. Best is trial 108 with value: 0.9666666666666667.
2024-12-07 00:30:56,065 - INFO - Candidate Mean Stats: {'Max': np.float64(2.0), 'Min': np.float64(0.2913945058582808), 'Mean': np.float64(0.49181160335769036), 'Std': np.float64(0.06728937694629727)}
2024-12-07 00:30:56,066 - INFO - Candidate Std Stats: {'Max': np.float64(1.6113454979813686), 'Min': np.float64(0.0), 'Mean': np.float64(0.10029673683527243), 'Std': np.float64(0.048184635546543966)}
[I 2024-12-07 00:30:56,106] Trial 126 finished with value: 0.9555555555555556 and parameters: {'x_0_0': 'ad', 'x_0_1': 'oo', 'x_0_2': 'oo', 'x_1_0': 'ab', 'x_1_1': 'oo', 'x_1_2': 'bd'}. Best is trial 49 with value: 0.7999999999999999.
2024-12-07 00:30:57,712 - INFO - Candidate Mean Stats: {'Max': np.float64(2.0), 'Min': np.float64(0.2743037175751084), 'Mean': np.float64(0.48208120043239516), 'Std': np.float64(0.06654721507163155)}
2024-12-07 00:30:57,713 - INFO - Candidate Std Stats: {'Max': np.float64(0.48305249211392826), 'Min': np.float64(0.0), 'Mean': np.float64(0.09837693793914254), 'Std': np.float64(0.04015215459086702)}
[I 2024-12-07 00:30:57,753] Trial 126 finished with value: 1.7999999999999998 and parameters: {'x_0_0': 'cd', 'x_0_1': 'ad', 'x_0_2': 'oo', 'x_1_0': 'bc', 'x_1_1': 'ac', 'x_1_2': 'oo'}. Best is trial 118 with value: 0.8666666666666667.
2024-12-07 00:31:06,349 - INFO - Candidate Mean Stats: {'Max': np.float64(2.0), 'Min': np.float64(0.16395886659978134), 'Mean': np.float64(0.48123996367972005), 'Std': np.float64(0.07066607581554032)}
2024-12-07 00:31:06,351 - INFO - Candidate Std Stats: {'Max': np.float64(1.501153995614452), 'Min': np.float64(0.0), 'Mean': np.float64(0.11506187277667751), 'Std': np.float64(0.05213866655564459)}
[I 2024-12-07 00:31:06,393] Trial 126 finished with value: 0.9444444444444444 and parameters: {'x_0_0': 'ad', 'x_0_1': 'oo', 'x_0_2': 'oo', 'x_1_0': 'bd', 'x_1_1': 'cd', 'x_1_2': 'bd'}. Best is trial 74 with value: 0.8222222222222222.
2024-12-07 00:31:12,511 - INFO - Candidate Mean Stats: {'Max': np.float64(2.0), 'Min': np.float64(0.245461583526629), 'Mean': np.float64(0.49484924974176075), 'Std': np.float64(0.07327528338321056)}
2024-12-07 00:31:12,512 - INFO - Candidate Std Stats: {'Max': np.float64(0.4363096466470122), 'Min': np.float64(0.0), 'Mean': np.float64(0.10281770141817591), 'Std': np.float64(0.04241547697122259)}
[I 2024-12-07 00:31:12,554] Trial 127 finished with value: 1.9 and parameters: {'x_0_0': 'oo', 'x_0_1': 'bd', 'x_0_2': 'ac', 'x_1_0': 'bd', 'x_1_1': 'ab', 'x_1_2': 'bd'}. Best is trial 108 with value: 0.9666666666666667.
2024-12-07 00:31:15,218 - INFO - Candidate Mean Stats: {'Max': np.float64(2.0), 'Min': np.float64(0.2969843294853003), 'Mean': np.float64(0.49180149819137053), 'Std': np.float64(0.06733498686497943)}
2024-12-07 00:31:15,219 - INFO - Candidate Std Stats: {'Max': np.float64(0.8244535106842624), 'Min': np.float64(0.0), 'Mean': np.float64(0.10562936559839722), 'Std': np.float64(0.047936507974061064)}
[I 2024-12-07 00:31:15,261] Trial 127 finished with value: 1.3444444444444443 and parameters: {'x_0_0': 'bd', 'x_0_1': 'ab', 'x_0_2': 'oo', 'x_1_0': 'bc', 'x_1_1': 'bc', 'x_1_2': 'bc'}. Best is trial 49 with value: 0.7999999999999999.
2024-12-07 00:31:16,915 - INFO - Candidate Mean Stats: {'Max': np.float64(2.0), 'Min': np.float64(0.27653574151015214), 'Mean': np.float64(0.49662471626880356), 'Std': np.float64(0.06785522658063381)}
2024-12-07 00:31:16,915 - INFO - Candidate Std Stats: {'Max': np.float64(0.4765345097087903), 'Min': np.float64(0.0), 'Mean': np.float64(0.10156264985010088), 'Std': np.float64(0.04186843995580543)}
[I 2024-12-07 00:31:16,957] Trial 127 finished with value: 1.2666666666666666 and parameters: {'x_0_0': 'bd', 'x_0_1': 'oo', 'x_0_2': 'ab', 'x_1_0': 'ac', 'x_1_1': 'bc', 'x_1_2': 'ad'}. Best is trial 118 with value: 0.8666666666666667.
2024-12-07 00:31:25,599 - INFO - Candidate Mean Stats: {'Max': np.float64(2.0), 'Min': np.float64(0.267505410881283), 'Mean': np.float64(0.49164660210646904), 'Std': np.float64(0.07119357127006877)}
2024-12-07 00:31:25,599 - INFO - Candidate Std Stats: {'Max': np.float64(0.9377039464047643), 'Min': np.float64(0.0), 'Mean': np.float64(0.11141377617404087), 'Std': np.float64(0.05480600557595733)}
[I 2024-12-07 00:31:25,641] Trial 127 finished with value: 1.7 and parameters: {'x_0_0': 'cd', 'x_0_1': 'bc', 'x_0_2': 'oo', 'x_1_0': 'oo', 'x_1_1': 'bd', 'x_1_2': 'bc'}. Best is trial 74 with value: 0.8222222222222222.
2024-12-07 00:31:31,345 - INFO - Candidate Mean Stats: {'Max': np.float64(2.0), 'Min': np.float64(0.2481355794529878), 'Mean': np.float64(0.481820597680816), 'Std': np.float64(0.07712653416195131)}
2024-12-07 00:31:31,345 - INFO - Candidate Std Stats: {'Max': np.float64(1.5231874341579308), 'Min': np.float64(0.0), 'Mean': np.float64(0.12210130735493539), 'Std': np.float64(0.06294280792072504)}
[I 2024-12-07 00:31:31,388] Trial 128 finished with value: 1.8 and parameters: {'x_0_0': 'oo', 'x_0_1': 'bc', 'x_0_2': 'oo', 'x_1_0': 'bc', 'x_1_1': 'ac', 'x_1_2': 'ab'}. Best is trial 108 with value: 0.9666666666666667.
2024-12-07 00:31:34,443 - INFO - Candidate Mean Stats: {'Max': np.float64(2.0), 'Min': np.float64(0.28249440512765156), 'Mean': np.float64(0.48864748738232683), 'Std': np.float64(0.06580837183483047)}
2024-12-07 00:31:34,444 - INFO - Candidate Std Stats: {'Max': np.float64(0.39806128096445065), 'Min': np.float64(0.0), 'Mean': np.float64(0.10324108269353145), 'Std': np.float64(0.04285554392438085)}
[I 2024-12-07 00:31:34,486] Trial 128 finished with value: 0.9444444444444444 and parameters: {'x_0_0': 'bd', 'x_0_1': 'oo', 'x_0_2': 'oo', 'x_1_0': 'bd', 'x_1_1': 'ac', 'x_1_2': 'ac'}. Best is trial 49 with value: 0.7999999999999999.
2024-12-07 00:31:36,139 - INFO - Candidate Mean Stats: {'Max': np.float64(2.0), 'Min': np.float64(0.22147139629513662), 'Mean': np.float64(0.49579987320464103), 'Std': np.float64(0.06469216305776426)}
2024-12-07 00:31:36,141 - INFO - Candidate Std Stats: {'Max': np.float64(0.35776190234229277), 'Min': np.float64(0.0), 'Mean': np.float64(0.09326878303662335), 'Std': np.float64(0.03893835172779494)}
[I 2024-12-07 00:31:36,184] Trial 128 finished with value: 1.2222222222222223 and parameters: {'x_0_0': 'ad', 'x_0_1': 'cd', 'x_0_2': 'ad', 'x_1_0': 'bc', 'x_1_1': 'ac', 'x_1_2': 'bd'}. Best is trial 118 with value: 0.8666666666666667.
2024-12-07 00:31:44,960 - INFO - Candidate Mean Stats: {'Max': np.float64(2.0), 'Min': np.float64(0.2750126671330306), 'Mean': np.float64(0.48462490045996404), 'Std': np.float64(0.06618585826431876)}
2024-12-07 00:31:44,961 - INFO - Candidate Std Stats: {'Max': np.float64(0.43630344492372375), 'Min': np.float64(0.0), 'Mean': np.float64(0.09915057101350905), 'Std': np.float64(0.04035237002686961)}
[I 2024-12-07 00:31:45,004] Trial 128 finished with value: 1.9 and parameters: {'x_0_0': 'oo', 'x_0_1': 'ac', 'x_0_2': 'ab', 'x_1_0': 'bc', 'x_1_1': 'ac', 'x_1_2': 'ad'}. Best is trial 74 with value: 0.8222222222222222.
2024-12-07 00:31:50,714 - INFO - Candidate Mean Stats: {'Max': np.float64(2.0), 'Min': np.float64(0.1955667282027782), 'Mean': np.float64(0.49386034691578784), 'Std': np.float64(0.06771716852697421)}
2024-12-07 00:31:50,715 - INFO - Candidate Std Stats: {'Max': np.float64(0.4742207421599247), 'Min': np.float64(0.0), 'Mean': np.float64(0.1017060960428929), 'Std': np.float64(0.04524885262708175)}
