[I 2024-12-07 01:29:43,444] Trial 298 finished with value: 1.0666666666666667 and parameters: {'x_0_0': 'ad', 'x_0_1': 'oo', 'x_0_2': 'ac', 'x_1_0': 'oo', 'x_1_1': 'cd', 'x_1_2': 'ab'}. Best is trial 280 with value: 0.6222222222222222.
2024-12-07 01:29:44,014 - INFO - Candidate Mean Stats: {'Max': np.float64(2.0), 'Min': np.float64(0.20510370763109137), 'Mean': np.float64(0.501666520049219), 'Std': np.float64(0.0769471762841059)}
2024-12-07 01:29:44,014 - INFO - Candidate Std Stats: {'Max': np.float64(0.5786819668262965), 'Min': np.float64(0.0), 'Mean': np.float64(0.09696514347894716), 'Std': np.float64(0.04430330871339836)}
[I 2024-12-07 01:29:44,058] Trial 299 finished with value: 1.3444444444444446 and parameters: {'x_0_0': 'ad', 'x_0_1': 'ab', 'x_0_2': 'bd', 'x_1_0': 'bc', 'x_1_1': 'oo', 'x_1_2': 'bc'}. Best is trial 49 with value: 0.7999999999999999.
2024-12-07 01:29:52,769 - INFO - Candidate Mean Stats: {'Max': np.float64(2.0), 'Min': np.float64(0.21761142169322573), 'Mean': np.float64(0.4880224738656293), 'Std': np.float64(0.07620912312369037)}
2024-12-07 01:29:52,770 - INFO - Candidate Std Stats: {'Max': np.float64(0.40713043943365046), 'Min': np.float64(0.0), 'Mean': np.float64(0.10030570045163857), 'Std': np.float64(0.04049185646330251)}
[I 2024-12-07 01:29:52,814] Trial 300 finished with value: 1.3555555555555556 and parameters: {'x_0_0': 'ac', 'x_0_1': 'ab', 'x_0_2': 'bd', 'x_1_0': 'bd', 'x_1_1': 'oo', 'x_1_2': 'oo'}. Best is trial 148 with value: 0.8333333333333333.
2024-12-07 01:29:55,935 - INFO - Candidate Mean Stats: {'Max': np.float64(2.0), 'Min': np.float64(0.23045323264224357), 'Mean': np.float64(0.48677488496746146), 'Std': np.float64(0.08146022845024908)}
2024-12-07 01:29:55,936 - INFO - Candidate Std Stats: {'Max': np.float64(1.6894188953607223), 'Min': np.float64(0.0), 'Mean': np.float64(0.11333526212181137), 'Std': np.float64(0.059238288119302804)}
[I 2024-12-07 01:29:55,980] Trial 299 finished with value: 1.5666666666666664 and parameters: {'x_0_0': 'bd', 'x_0_1': 'bc', 'x_0_2': 'oo', 'x_1_0': 'ac', 'x_1_1': 'ab', 'x_1_2': 'ab'}. Best is trial 200 with value: 0.6.
2024-12-07 01:30:03,646 - INFO - Candidate Mean Stats: {'Max': np.float64(2.0), 'Min': np.float64(0.1972148280113526), 'Mean': np.float64(0.48653496719450817), 'Std': np.float64(0.08161411296310374)}
2024-12-07 01:30:03,648 - INFO - Candidate Std Stats: {'Max': np.float64(0.7068940001654824), 'Min': np.float64(0.0), 'Mean': np.float64(0.10461522192333599), 'Std': np.float64(0.04385599596234261)}
[I 2024-12-07 01:30:03,692] Trial 299 finished with value: 1.4444444444444444 and parameters: {'x_0_0': 'bc', 'x_0_1': 'ac', 'x_0_2': 'bd', 'x_1_0': 'ab', 'x_1_1': 'ad', 'x_1_2': 'cd'}. Best is trial 280 with value: 0.6222222222222222.
2024-12-07 01:30:04,171 - INFO - Candidate Mean Stats: {'Max': np.float64(2.0), 'Min': np.float64(0.2508998922875444), 'Mean': np.float64(0.4955966809970404), 'Std': np.float64(0.07812600571924273)}
2024-12-07 01:30:04,172 - INFO - Candidate Std Stats: {'Max': np.float64(0.4132257757931351), 'Min': np.float64(0.0), 'Mean': np.float64(0.10008701294539268), 'Std': np.float64(0.040562718601745026)}
[I 2024-12-07 01:30:04,212] Trial 300 finished with value: 1.1666666666666665 and parameters: {'x_0_0': 'ac', 'x_0_1': 'oo', 'x_0_2': 'bd', 'x_1_0': 'ab', 'x_1_1': 'bd', 'x_1_2': 'oo'}. Best is trial 49 with value: 0.7999999999999999.
2024-12-07 01:30:13,234 - INFO - Candidate Mean Stats: {'Max': np.float64(2.0), 'Min': np.float64(0.1826306725438634), 'Mean': np.float64(0.4892955616210563), 'Std': np.float64(0.08715001606776465)}
2024-12-07 01:30:13,236 - INFO - Candidate Std Stats: {'Max': np.float64(1.3949294118446207), 'Min': np.float64(0.0), 'Mean': np.float64(0.11390272727883335), 'Std': np.float64(0.05649684645301733)}
[I 2024-12-07 01:30:13,281] Trial 301 finished with value: 1.077777777777778 and parameters: {'x_0_0': 'ab', 'x_0_1': 'oo', 'x_0_2': 'oo', 'x_1_0': 'oo', 'x_1_1': 'bc', 'x_1_2': 'ad'}. Best is trial 148 with value: 0.8333333333333333.
2024-12-07 01:30:16,480 - INFO - Candidate Mean Stats: {'Max': np.float64(2.0), 'Min': np.float64(0.26825673342071715), 'Mean': np.float64(0.48212250824943936), 'Std': np.float64(0.07708541012999733)}
2024-12-07 01:30:16,480 - INFO - Candidate Std Stats: {'Max': np.float64(0.42076018401008924), 'Min': np.float64(0.0), 'Mean': np.float64(0.09843941160824363), 'Std': np.float64(0.042467662153245156)}
[I 2024-12-07 01:30:16,526] Trial 300 finished with value: 1.3777777777777778 and parameters: {'x_0_0': 'ab', 'x_0_1': 'oo', 'x_0_2': 'cd', 'x_1_0': 'cd', 'x_1_1': 'ab', 'x_1_2': 'ab'}. Best is trial 200 with value: 0.6.
2024-12-07 01:30:24,438 - INFO - Candidate Mean Stats: {'Max': np.float64(2.0), 'Min': np.float64(0.2522656650638492), 'Mean': np.float64(0.4849371660387775), 'Std': np.float64(0.07587225699166515)}
2024-12-07 01:30:24,439 - INFO - Candidate Std Stats: {'Max': np.float64(0.4292309488697935), 'Min': np.float64(0.0), 'Mean': np.float64(0.10319064713386827), 'Std': np.float64(0.043818495720998454)}
[I 2024-12-07 01:30:24,484] Trial 300 finished with value: 1.1666666666666665 and parameters: {'x_0_0': 'bd', 'x_0_1': 'oo', 'x_0_2': 'bd', 'x_1_0': 'ac', 'x_1_1': 'oo', 'x_1_2': 'ad'}. Best is trial 280 with value: 0.6222222222222222.
2024-12-07 01:30:24,932 - INFO - Candidate Mean Stats: {'Max': np.float64(2.0), 'Min': np.float64(0.26000104670564006), 'Mean': np.float64(0.48356005212410424), 'Std': np.float64(0.07812472713167345)}
2024-12-07 01:30:24,933 - INFO - Candidate Std Stats: {'Max': np.float64(1.1187747952822034), 'Min': np.float64(0.0), 'Mean': np.float64(0.10317226999539898), 'Std': np.float64(0.05051230825728147)}
[I 2024-12-07 01:30:24,978] Trial 301 finished with value: 1.0666666666666667 and parameters: {'x_0_0': 'bc', 'x_0_1': 'oo', 'x_0_2': 'ab', 'x_1_0': 'ab', 'x_1_1': 'oo', 'x_1_2': 'oo'}. Best is trial 49 with value: 0.7999999999999999.
2024-12-07 01:30:34,259 - INFO - Candidate Mean Stats: {'Max': np.float64(2.0), 'Min': np.float64(0.261141107562836), 'Mean': np.float64(0.49064669317119536), 'Std': np.float64(0.0782790886855145)}
2024-12-07 01:30:34,260 - INFO - Candidate Std Stats: {'Max': np.float64(1.0987151295011695), 'Min': np.float64(0.0), 'Mean': np.float64(0.09952103473254362), 'Std': np.float64(0.04779039934576121)}
[I 2024-12-07 01:30:34,305] Trial 302 finished with value: 1.4666666666666668 and parameters: {'x_0_0': 'bc', 'x_0_1': 'bc', 'x_0_2': 'ad', 'x_1_0': 'ab', 'x_1_1': 'oo', 'x_1_2': 'oo'}. Best is trial 148 with value: 0.8333333333333333.
2024-12-07 01:30:37,584 - INFO - Candidate Mean Stats: {'Max': np.float64(2.0), 'Min': np.float64(0.2591586446342287), 'Mean': np.float64(0.49063800608431823), 'Std': np.float64(0.07845939576004536)}
2024-12-07 01:30:37,585 - INFO - Candidate Std Stats: {'Max': np.float64(0.9583414437776656), 'Min': np.float64(0.0), 'Mean': np.float64(0.10810051943142933), 'Std': np.float64(0.04754341880827871)}
[I 2024-12-07 01:30:37,629] Trial 301 finished with value: 1.4555555555555555 and parameters: {'x_0_0': 'bd', 'x_0_1': 'bd', 'x_0_2': 'oo', 'x_1_0': 'ab', 'x_1_1': 'bc', 'x_1_2': 'ad'}. Best is trial 200 with value: 0.6.
2024-12-07 01:30:45,588 - INFO - Candidate Mean Stats: {'Max': np.float64(2.0), 'Min': np.float64(0.19303698930352567), 'Mean': np.float64(0.503454961160471), 'Std': np.float64(0.08572985816963459)}
2024-12-07 01:30:45,588 - INFO - Candidate Std Stats: {'Max': np.float64(0.9199134066094689), 'Min': np.float64(0.0), 'Mean': np.float64(0.09961968349545845), 'Std': np.float64(0.04939794006809221)}
[I 2024-12-07 01:30:45,636] Trial 301 finished with value: 1.4444444444444444 and parameters: {'x_0_0': 'bd', 'x_0_1': 'ab', 'x_0_2': 'ab', 'x_1_0': 'bc', 'x_1_1': 'bc', 'x_1_2': 'ad'}. Best is trial 280 with value: 0.6222222222222222.
2024-12-07 01:30:46,257 - INFO - Candidate Mean Stats: {'Max': np.float64(2.0), 'Min': np.float64(0.14205766238071532), 'Mean': np.float64(0.5030243200641102), 'Std': np.float64(0.07766469049110586)}
2024-12-07 01:30:46,258 - INFO - Candidate Std Stats: {'Max': np.float64(0.42305908280791427), 'Min': np.float64(0.0), 'Mean': np.float64(0.10398384274224348), 'Std': np.float64(0.04585329053022911)}
[I 2024-12-07 01:30:46,301] Trial 302 finished with value: 1.3333333333333333 and parameters: {'x_0_0': 'bc', 'x_0_1': 'ad', 'x_0_2': 'ad', 'x_1_0': 'ab', 'x_1_1': 'ab', 'x_1_2': 'bc'}. Best is trial 49 with value: 0.7999999999999999.
2024-12-07 01:30:54,870 - INFO - Candidate Mean Stats: {'Max': np.float64(2.0), 'Min': np.float64(0.26587277382569785), 'Mean': np.float64(0.4975678886976978), 'Std': np.float64(0.08286652895993238)}
2024-12-07 01:30:54,871 - INFO - Candidate Std Stats: {'Max': np.float64(0.57693444954277), 'Min': np.float64(0.0), 'Mean': np.float64(0.10458043195580698), 'Std': np.float64(0.0469397291646194)}
[I 2024-12-07 01:30:54,915] Trial 303 finished with value: 1.2666666666666666 and parameters: {'x_0_0': 'bd', 'x_0_1': 'oo', 'x_0_2': 'bd', 'x_1_0': 'cd', 'x_1_1': 'bc', 'x_1_2': 'ac'}. Best is trial 148 with value: 0.8333333333333333.
2024-12-07 01:30:58,153 - INFO - Candidate Mean Stats: {'Max': np.float64(2.0), 'Min': np.float64(0.22638637763061692), 'Mean': np.float64(0.49520772730285184), 'Std': np.float64(0.07682467727083278)}
2024-12-07 01:30:58,153 - INFO - Candidate Std Stats: {'Max': np.float64(0.5071885219140716), 'Min': np.float64(0.0), 'Mean': np.float64(0.10400014693636982), 'Std': np.float64(0.043220509479983286)}
[I 2024-12-07 01:30:58,197] Trial 302 finished with value: 1.6666666666666665 and parameters: {'x_0_0': 'bc', 'x_0_1': 'bd', 'x_0_2': 'bc', 'x_1_0': 'bd', 'x_1_1': 'cd', 'x_1_2': 'cd'}. Best is trial 200 with value: 0.6.
2024-12-07 01:31:06,225 - INFO - Candidate Mean Stats: {'Max': np.float64(2.0), 'Min': np.float64(0.278224994083453), 'Mean': np.float64(0.4967855215581213), 'Std': np.float64(0.07514192380265892)}
2024-12-07 01:31:06,225 - INFO - Candidate Std Stats: {'Max': np.float64(0.38529914305695645), 'Min': np.float64(0.0), 'Mean': np.float64(0.1066433173006089), 'Std': np.float64(0.04127587689136402)}
[I 2024-12-07 01:31:06,272] Trial 302 finished with value: 1.2666666666666666 and parameters: {'x_0_0': 'bc', 'x_0_1': 'oo', 'x_0_2': 'ad', 'x_1_0': 'cd', 'x_1_1': 'ad', 'x_1_2': 'cd'}. Best is trial 280 with value: 0.6222222222222222.
2024-12-07 01:31:06,978 - INFO - Candidate Mean Stats: {'Max': np.float64(2.0), 'Min': np.float64(0.2799991423050684), 'Mean': np.float64(0.49473133525239527), 'Std': np.float64(0.07521927949412889)}
2024-12-07 01:31:06,979 - INFO - Candidate Std Stats: {'Max': np.float64(0.39663912329537804), 'Min': np.float64(0.0), 'Mean': np.float64(0.10000323707094794), 'Std': np.float64(0.041706864984377055)}
[I 2024-12-07 01:31:07,022] Trial 303 finished with value: 1.5666666666666667 and parameters: {'x_0_0': 'bc', 'x_0_1': 'bd', 'x_0_2': 'bd', 'x_1_0': 'ab', 'x_1_1': 'bd', 'x_1_2': 'oo'}. Best is trial 49 with value: 0.7999999999999999.
2024-12-07 01:31:15,411 - INFO - Candidate Mean Stats: {'Max': np.float64(2.0), 'Min': np.float64(0.2243724507622812), 'Mean': np.float64(0.4915959421025076), 'Std': np.float64(0.07895887797197966)}
2024-12-07 01:31:15,412 - INFO - Candidate Std Stats: {'Max': np.float64(1.0388306628784238), 'Min': np.float64(0.0), 'Mean': np.float64(0.09672385236725184), 'Std': np.float64(0.04293107041157112)}
[I 2024-12-07 01:31:15,456] Trial 304 finished with value: 1.3444444444444443 and parameters: {'x_0_0': 'bd', 'x_0_1': 'bd', 'x_0_2': 'oo', 'x_1_0': 'bd', 'x_1_1': 'cd', 'x_1_2': 'bc'}. Best is trial 148 with value: 0.8333333333333333.
2024-12-07 01:31:18,704 - INFO - Candidate Mean Stats: {'Max': np.float64(2.0), 'Min': np.float64(0.21176193872512253), 'Mean': np.float64(0.4926671689471112), 'Std': np.float64(0.08111705835726869)}
2024-12-07 01:31:18,705 - INFO - Candidate Std Stats: {'Max': np.float64(0.3705223545587198), 'Min': np.float64(0.0), 'Mean': np.float64(0.10897599275374717), 'Std': np.float64(0.045376113911076064)}
[I 2024-12-07 01:31:18,750] Trial 303 finished with value: 1.3444444444444446 and parameters: {'x_0_0': 'bd', 'x_0_1': 'ad', 'x_0_2': 'ab', 'x_1_0': 'bd', 'x_1_1': 'oo', 'x_1_2': 'ad'}. Best is trial 200 with value: 0.6.
2024-12-07 01:31:27,010 - INFO - Candidate Mean Stats: {'Max': np.float64(2.0), 'Min': np.float64(0.22374386956173548), 'Mean': np.float64(0.48439735612462814), 'Std': np.float64(0.0787358444737449)}
2024-12-07 01:31:27,011 - INFO - Candidate Std Stats: {'Max': np.float64(1.4622593930022378), 'Min': np.float64(0.0), 'Mean': np.float64(0.1080191958056002), 'Std': np.float64(0.05629228792178862)}
[I 2024-12-07 01:31:27,057] Trial 303 finished with value: 1.2666666666666666 and parameters: {'x_0_0': 'ac', 'x_0_1': 'oo', 'x_0_2': 'ac', 'x_1_0': 'ad', 'x_1_1': 'bc', 'x_1_2': 'ac'}. Best is trial 280 with value: 0.6222222222222222.
2024-12-07 01:31:27,818 - INFO - Candidate Mean Stats: {'Max': np.float64(2.0), 'Min': np.float64(0.19972199230169818), 'Mean': np.float64(0.4903142205241773), 'Std': np.float64(0.0776793065050466)}
2024-12-07 01:31:27,819 - INFO - Candidate Std Stats: {'Max': np.float64(0.3868832366055696), 'Min': np.float64(0.0), 'Mean': np.float64(0.10594879735258642), 'Std': np.float64(0.04418067082017826)}
[I 2024-12-07 01:31:27,862] Trial 304 finished with value: 1.2444444444444445 and parameters: {'x_0_0': 'ac', 'x_0_1': 'ad', 'x_0_2': 'cd', 'x_1_0': 'oo', 'x_1_1': 'ac', 'x_1_2': 'bc'}. Best is trial 49 with value: 0.7999999999999999.
2024-12-07 01:31:35,957 - INFO - Candidate Mean Stats: {'Max': np.float64(2.0), 'Min': np.float64(0.2113497080307536), 'Mean': np.float64(0.4897404439655098), 'Std': np.float64(0.0891594756744486)}
2024-12-07 01:31:35,958 - INFO - Candidate Std Stats: {'Max': np.float64(0.9520851936411512), 'Min': np.float64(0.0), 'Mean': np.float64(0.11413696670088574), 'Std': np.float64(0.05344738932175619)}
[I 2024-12-07 01:31:36,000] Trial 305 finished with value: 1.3666666666666667 and parameters: {'x_0_0': 'ad', 'x_0_1': 'bd', 'x_0_2': 'bd', 'x_1_0': 'oo', 'x_1_1': 'oo', 'x_1_2': 'ab'}. Best is trial 148 with value: 0.8333333333333333.
2024-12-07 01:31:39,218 - INFO - Candidate Mean Stats: {'Max': np.float64(2.0), 'Min': np.float64(0.2606008548056804), 'Mean': np.float64(0.4862440610939859), 'Std': np.float64(0.07585614788732112)}
2024-12-07 01:31:39,219 - INFO - Candidate Std Stats: {'Max': np.float64(0.4208122613235958), 'Min': np.float64(0.0), 'Mean': np.float64(0.09989826063543865), 'Std': np.float64(0.043055152755961015)}
[I 2024-12-07 01:31:39,261] Trial 304 finished with value: 1.3333333333333333 and parameters: {'x_0_0': 'ac', 'x_0_1': 'ad', 'x_0_2': 'bd', 'x_1_0': 'ac', 'x_1_1': 'ab', 'x_1_2': 'bd'}. Best is trial 200 with value: 0.6.
2024-12-07 01:31:47,890 - INFO - Candidate Mean Stats: {'Max': np.float64(2.0), 'Min': np.float64(0.15786423816721398), 'Mean': np.float64(0.488305383982034), 'Std': np.float64(0.07902714390889204)}
2024-12-07 01:31:47,891 - INFO - Candidate Std Stats: {'Max': np.float64(0.6893695831170845), 'Min': np.float64(0.0), 'Mean': np.float64(0.10452176541399365), 'Std': np.float64(0.0515413053327278)}
[I 2024-12-07 01:31:47,936] Trial 304 finished with value: 1.0666666666666667 and parameters: {'x_0_0': 'bd', 'x_0_1': 'oo', 'x_0_2': 'oo', 'x_1_0': 'ac', 'x_1_1': 'ab', 'x_1_2': 'oo'}. Best is trial 280 with value: 0.6222222222222222.
2024-12-07 01:31:48,609 - INFO - Candidate Mean Stats: {'Max': np.float64(2.0), 'Min': np.float64(0.13528430328910546), 'Mean': np.float64(0.48952496628892345), 'Std': np.float64(0.09198197688008738)}
2024-12-07 01:31:48,609 - INFO - Candidate Std Stats: {'Max': np.float64(1.865039823523048), 'Min': np.float64(0.0), 'Mean': np.float64(0.11934153046669578), 'Std': np.float64(0.06849548733878232)}
[I 2024-12-07 01:31:48,654] Trial 305 finished with value: 0.9666666666666667 and parameters: {'x_0_0': 'ac', 'x_0_1': 'oo', 'x_0_2': 'oo', 'x_1_0': 'oo', 'x_1_1': 'ab', 'x_1_2': 'ab'}. Best is trial 49 with value: 0.7999999999999999.
2024-12-07 01:31:56,825 - INFO - Candidate Mean Stats: {'Max': np.float64(2.0), 'Min': np.float64(0.28232245099009246), 'Mean': np.float64(0.4950602210571335), 'Std': np.float64(0.0782453954632763)}
2024-12-07 01:31:56,826 - INFO - Candidate Std Stats: {'Max': np.float64(0.8661079780658032), 'Min': np.float64(0.0), 'Mean': np.float64(0.10239465793707589), 'Std': np.float64(0.04532011551363203)}
[I 2024-12-07 01:31:56,866] Trial 306 finished with value: 1.2666666666666666 and parameters: {'x_0_0': 'ac', 'x_0_1': 'oo', 'x_0_2': 'bd', 'x_1_0': 'ab', 'x_1_1': 'bd', 'x_1_2': 'bc'}. Best is trial 148 with value: 0.8333333333333333.
2024-12-07 01:32:00,392 - INFO - Candidate Mean Stats: {'Max': np.float64(2.0), 'Min': np.float64(0.0677635239855003), 'Mean': np.float64(0.4820420104898103), 'Std': np.float64(0.08525964098387906)}
2024-12-07 01:32:00,393 - INFO - Candidate Std Stats: {'Max': np.float64(0.5129025094068139), 'Min': np.float64(0.0), 'Mean': np.float64(0.10426172231601748), 'Std': np.float64(0.05101215921232865)}
[I 2024-12-07 01:32:00,441] Trial 305 finished with value: 1.4666666666666666 and parameters: {'x_0_0': 'ac', 'x_0_1': 'cd', 'x_0_2': 'oo', 'x_1_0': 'bc', 'x_1_1': 'oo', 'x_1_2': 'cd'}. Best is trial 200 with value: 0.6.
2024-12-07 01:32:09,725 - INFO - Candidate Mean Stats: {'Max': np.float64(2.0), 'Min': np.float64(0.20047595213920114), 'Mean': np.float64(0.4835858246398899), 'Std': np.float64(0.07666024488917444)}
2024-12-07 01:32:09,726 - INFO - Candidate Std Stats: {'Max': np.float64(0.9921465333082216), 'Min': np.float64(0.0), 'Mean': np.float64(0.10518746356303355), 'Std': np.float64(0.05140286619364194)}
[I 2024-12-07 01:32:09,774] Trial 305 finished with value: 1.3666666666666667 and parameters: {'x_0_0': 'bd', 'x_0_1': 'ad', 'x_0_2': 'bc', 'x_1_0': 'oo', 'x_1_1': 'oo', 'x_1_2': 'ab'}. Best is trial 280 with value: 0.6222222222222222.
2024-12-07 01:32:10,214 - INFO - Candidate Mean Stats: {'Max': np.float64(2.0), 'Min': np.float64(0.18230547464797733), 'Mean': np.float64(0.48577589510099095), 'Std': np.float64(0.08021026076268928)}
2024-12-07 01:32:10,214 - INFO - Candidate Std Stats: {'Max': np.float64(0.540574915251952), 'Min': np.float64(0.0), 'Mean': np.float64(0.10795652651434784), 'Std': np.float64(0.04748038698238266)}
[I 2024-12-07 01:32:10,260] Trial 306 finished with value: 1.6 and parameters: {'x_0_0': 'oo', 'x_0_1': 'ac', 'x_0_2': 'oo', 'x_1_0': 'oo', 'x_1_1': 'cd', 'x_1_2': 'cd'}. Best is trial 49 with value: 0.7999999999999999.
2024-12-07 01:32:17,799 - INFO - Candidate Mean Stats: {'Max': np.float64(2.0), 'Min': np.float64(0.2531412228384073), 'Mean': np.float64(0.4946945524772236), 'Std': np.float64(0.08451596569774315)}
2024-12-07 01:32:17,799 - INFO - Candidate Std Stats: {'Max': np.float64(0.373220539846196), 'Min': np.float64(0.0), 'Mean': np.float64(0.1038660703662866), 'Std': np.float64(0.045357919383149425)}
[I 2024-12-07 01:32:17,844] Trial 307 finished with value: 1.5666666666666667 and parameters: {'x_0_0': 'bc', 'x_0_1': 'bd', 'x_0_2': 'ab', 'x_1_0': 'ad', 'x_1_1': 'oo', 'x_1_2': 'bd'}. Best is trial 148 with value: 0.8333333333333333.
2024-12-07 01:32:21,241 - INFO - Candidate Mean Stats: {'Max': np.float64(2.0), 'Min': np.float64(0.17532698056658824), 'Mean': np.float64(0.4890937093614093), 'Std': np.float64(0.08042161824942994)}
2024-12-07 01:32:21,242 - INFO - Candidate Std Stats: {'Max': np.float64(0.7130478546833843), 'Min': np.float64(0.0), 'Mean': np.float64(0.10693556552024822), 'Std': np.float64(0.04736887789293718)}
[I 2024-12-07 01:32:21,291] Trial 306 finished with value: 1.0666666666666667 and parameters: {'x_0_0': 'ac', 'x_0_1': 'oo', 'x_0_2': 'bd', 'x_1_0': 'oo', 'x_1_1': 'ac', 'x_1_2': 'cd'}. Best is trial 200 with value: 0.6.
2024-12-07 01:32:30,589 - INFO - Candidate Mean Stats: {'Max': np.float64(2.0), 'Min': np.float64(0.25603813958868354), 'Mean': np.float64(0.4963220597674391), 'Std': np.float64(0.07585970501717515)}
2024-12-07 01:32:30,589 - INFO - Candidate Std Stats: {'Max': np.float64(1.754259301861629), 'Min': np.float64(0.0), 'Mean': np.float64(0.10129293571243028), 'Std': np.float64(0.047725308299372875)}
[I 2024-12-07 01:32:30,632] Trial 306 finished with value: 1.5666666666666667 and parameters: {'x_0_0': 'bd', 'x_0_1': 'ac', 'x_0_2': 'ab', 'x_1_0': 'cd', 'x_1_1': 'ab', 'x_1_2': 'oo'}. Best is trial 280 with value: 0.6222222222222222.
2024-12-07 01:32:31,143 - INFO - Candidate Mean Stats: {'Max': np.float64(2.0), 'Min': np.float64(0.24430403972839362), 'Mean': np.float64(0.48886338357215103), 'Std': np.float64(0.07676468359105679)}
2024-12-07 01:32:31,144 - INFO - Candidate Std Stats: {'Max': np.float64(0.4832186203501046), 'Min': np.float64(0.0), 'Mean': np.float64(0.09496437148104028), 'Std': np.float64(0.04093524445609916)}
[I 2024-12-07 01:32:31,188] Trial 307 finished with value: 1.6777777777777778 and parameters: {'x_0_0': 'ab', 'x_0_1': 'cd', 'x_0_2': 'bc', 'x_1_0': 'cd', 'x_1_1': 'bc', 'x_1_2': 'oo'}. Best is trial 49 with value: 0.7999999999999999.
2024-12-07 01:32:38,654 - INFO - Candidate Mean Stats: {'Max': np.float64(2.0), 'Min': np.float64(0.29467183239051936), 'Mean': np.float64(0.4958594379466118), 'Std': np.float64(0.0771988357297257)}
2024-12-07 01:32:38,654 - INFO - Candidate Std Stats: {'Max': np.float64(0.4872101452266632), 'Min': np.float64(0.0), 'Mean': np.float64(0.10381805201256943), 'Std': np.float64(0.04417899660424141)}
