[I 2024-12-07 01:06:13,584] Trial 231 finished with value: 1.5666666666666664 and parameters: {'x_0_0': 'ad', 'x_0_1': 'ac', 'x_0_2': 'oo', 'x_1_0': 'ad', 'x_1_1': 'ab', 'x_1_2': 'cd'}. Best is trial 148 with value: 0.8333333333333333.
2024-12-07 01:06:19,682 - INFO - Candidate Mean Stats: {'Max': np.float64(2.0), 'Min': np.float64(0.24365454720452062), 'Mean': np.float64(0.4880551117513434), 'Std': np.float64(0.07011769763865897)}
2024-12-07 01:06:19,683 - INFO - Candidate Std Stats: {'Max': np.float64(0.46041872838316833), 'Min': np.float64(0.0), 'Mean': np.float64(0.10023270857680779), 'Std': np.float64(0.04433762237374368)}
[I 2024-12-07 01:06:19,748] Trial 231 finished with value: 1.5666666666666664 and parameters: {'x_0_0': 'ac', 'x_0_1': 'bd', 'x_0_2': 'oo', 'x_1_0': 'ab', 'x_1_1': 'ab', 'x_1_2': 'cd'}. Best is trial 49 with value: 0.7999999999999999.
2024-12-07 01:06:29,646 - INFO - Candidate Mean Stats: {'Max': np.float64(2.0), 'Min': np.float64(0.25939690539398425), 'Mean': np.float64(0.4891695554457741), 'Std': np.float64(0.07518407378171911)}
2024-12-07 01:06:29,648 - INFO - Candidate Std Stats: {'Max': np.float64(0.6876494098573397), 'Min': np.float64(0.0), 'Mean': np.float64(0.10070584894304767), 'Std': np.float64(0.04458644546400538)}
[I 2024-12-07 01:06:29,693] Trial 231 finished with value: 1.1666666666666665 and parameters: {'x_0_0': 'ad', 'x_0_1': 'oo', 'x_0_2': 'ac', 'x_1_0': 'ac', 'x_1_1': 'ac', 'x_1_2': 'oo'}. Best is trial 200 with value: 0.6.
2024-12-07 01:06:34,585 - INFO - Candidate Mean Stats: {'Max': np.float64(2.0), 'Min': np.float64(0.23743433817290321), 'Mean': np.float64(0.4956434883061499), 'Std': np.float64(0.07766360343745549)}
2024-12-07 01:06:34,586 - INFO - Candidate Std Stats: {'Max': np.float64(1.3680793476649906), 'Min': np.float64(0.0), 'Mean': np.float64(0.10566867402375275), 'Std': np.float64(0.052402959095031)}
[I 2024-12-07 01:06:34,632] Trial 231 finished with value: 1.1444444444444444 and parameters: {'x_0_0': 'bc', 'x_0_1': 'ad', 'x_0_2': 'ac', 'x_1_0': 'oo', 'x_1_1': 'oo', 'x_1_2': 'cd'}. Best is trial 74 with value: 0.8222222222222222.
2024-12-07 01:06:34,774 - INFO - Candidate Mean Stats: {'Max': np.float64(2.0), 'Min': np.float64(0.2682222657016598), 'Mean': np.float64(0.4981496646357166), 'Std': np.float64(0.07810589707434464)}
2024-12-07 01:06:34,775 - INFO - Candidate Std Stats: {'Max': np.float64(1.939428808874636), 'Min': np.float64(0.0), 'Mean': np.float64(0.10283048793836146), 'Std': np.float64(0.05028575921820737)}
[I 2024-12-07 01:06:34,818] Trial 232 finished with value: 1.3444444444444446 and parameters: {'x_0_0': 'bd', 'x_0_1': 'ad', 'x_0_2': 'ac', 'x_1_0': 'bd', 'x_1_1': 'ab', 'x_1_2': 'oo'}. Best is trial 148 with value: 0.8333333333333333.
2024-12-07 01:06:40,662 - INFO - Candidate Mean Stats: {'Max': np.float64(2.0), 'Min': np.float64(0.2627286212643186), 'Mean': np.float64(0.4974819889826521), 'Std': np.float64(0.07291541545401442)}
2024-12-07 01:06:40,663 - INFO - Candidate Std Stats: {'Max': np.float64(0.3739990924026115), 'Min': np.float64(0.0), 'Mean': np.float64(0.09692806174761893), 'Std': np.float64(0.03877170049665422)}
[I 2024-12-07 01:06:40,706] Trial 232 finished with value: 1.1666666666666665 and parameters: {'x_0_0': 'ac', 'x_0_1': 'oo', 'x_0_2': 'bd', 'x_1_0': 'ab', 'x_1_1': 'oo', 'x_1_2': 'ad'}. Best is trial 49 with value: 0.7999999999999999.
2024-12-07 01:06:50,021 - INFO - Candidate Mean Stats: {'Max': np.float64(2.0), 'Min': np.float64(0.21771177016664328), 'Mean': np.float64(0.4801575558193012), 'Std': np.float64(0.07530953647528008)}
2024-12-07 01:06:50,021 - INFO - Candidate Std Stats: {'Max': np.float64(0.4408526033359099), 'Min': np.float64(0.0), 'Mean': np.float64(0.10663966194076864), 'Std': np.float64(0.04697377645878126)}
[I 2024-12-07 01:06:50,066] Trial 232 finished with value: 1.5555555555555556 and parameters: {'x_0_0': 'bd', 'x_0_1': 'ab', 'x_0_2': 'bd', 'x_1_0': 'ab', 'x_1_1': 'cd', 'x_1_2': 'bd'}. Best is trial 200 with value: 0.6.
2024-12-07 01:06:55,085 - INFO - Candidate Mean Stats: {'Max': np.float64(2.0), 'Min': np.float64(0.27705532330013954), 'Mean': np.float64(0.49072459199199997), 'Std': np.float64(0.07418884846609969)}
2024-12-07 01:06:55,085 - INFO - Candidate Std Stats: {'Max': np.float64(0.3751252575232589), 'Min': np.float64(0.0), 'Mean': np.float64(0.10290205067585777), 'Std': np.float64(0.04265091637426099)}
2024-12-07 01:06:55,100 - INFO - Candidate Mean Stats: {'Max': np.float64(2.0), 'Min': np.float64(0.261260549708502), 'Mean': np.float64(0.48751525016191766), 'Std': np.float64(0.07469544584378145)}
2024-12-07 01:06:55,100 - INFO - Candidate Std Stats: {'Max': np.float64(0.3881815644389416), 'Min': np.float64(0.0), 'Mean': np.float64(0.10518882511220107), 'Std': np.float64(0.04127015432431094)}
[I 2024-12-07 01:06:55,128] Trial 233 finished with value: 1.2666666666666666 and parameters: {'x_0_0': 'bc', 'x_0_1': 'oo', 'x_0_2': 'cd', 'x_1_0': 'bc', 'x_1_1': 'ab', 'x_1_2': 'bd'}. Best is trial 148 with value: 0.8333333333333333.
[I 2024-12-07 01:06:55,140] Trial 232 finished with value: 1.3444444444444446 and parameters: {'x_0_0': 'bd', 'x_0_1': 'ad', 'x_0_2': 'bc', 'x_1_0': 'bd', 'x_1_1': 'oo', 'x_1_2': 'cd'}. Best is trial 74 with value: 0.8222222222222222.
2024-12-07 01:07:01,145 - INFO - Candidate Mean Stats: {'Max': np.float64(2.0), 'Min': np.float64(0.24628287943131424), 'Mean': np.float64(0.4888658387716863), 'Std': np.float64(0.07205239318930685)}
2024-12-07 01:07:01,145 - INFO - Candidate Std Stats: {'Max': np.float64(0.6179002362021047), 'Min': np.float64(0.0), 'Mean': np.float64(0.10234736251710848), 'Std': np.float64(0.04541087701625684)}
[I 2024-12-07 01:07:01,190] Trial 233 finished with value: 1.6666666666666665 and parameters: {'x_0_0': 'bc', 'x_0_1': 'bd', 'x_0_2': 'ab', 'x_1_0': 'cd', 'x_1_1': 'ab', 'x_1_2': 'ac'}. Best is trial 49 with value: 0.7999999999999999.
2024-12-07 01:07:10,710 - INFO - Candidate Mean Stats: {'Max': np.float64(2.0), 'Min': np.float64(0.16458754153154537), 'Mean': np.float64(0.4824966807804666), 'Std': np.float64(0.08098680584235078)}
2024-12-07 01:07:10,711 - INFO - Candidate Std Stats: {'Max': np.float64(0.4861733977947018), 'Min': np.float64(0.0), 'Mean': np.float64(0.11463545086887264), 'Std': np.float64(0.04898185043912401)}
[I 2024-12-07 01:07:10,756] Trial 233 finished with value: 1.1666666666666665 and parameters: {'x_0_0': 'bd', 'x_0_1': 'oo', 'x_0_2': 'ac', 'x_1_0': 'ad', 'x_1_1': 'oo', 'x_1_2': 'cd'}. Best is trial 200 with value: 0.6.
2024-12-07 01:07:15,594 - INFO - Candidate Mean Stats: {'Max': np.float64(2.0), 'Min': np.float64(0.2623831363428925), 'Mean': np.float64(0.49479638380183694), 'Std': np.float64(0.07352825152300535)}
2024-12-07 01:07:15,595 - INFO - Candidate Std Stats: {'Max': np.float64(0.30828651413827723), 'Min': np.float64(0.0), 'Mean': np.float64(0.09673137708045478), 'Std': np.float64(0.03780387299566306)}
[I 2024-12-07 01:07:15,639] Trial 234 finished with value: 1.3666666666666667 and parameters: {'x_0_0': 'ac', 'x_0_1': 'bd', 'x_0_2': 'oo', 'x_1_0': 'oo', 'x_1_1': 'ab', 'x_1_2': 'ab'}. Best is trial 148 with value: 0.8333333333333333.
2024-12-07 01:07:15,668 - INFO - Candidate Mean Stats: {'Max': np.float64(2.0), 'Min': np.float64(0.2589431462904851), 'Mean': np.float64(0.48484977469634105), 'Std': np.float64(0.07367817527564116)}
2024-12-07 01:07:15,668 - INFO - Candidate Std Stats: {'Max': np.float64(0.48653285636871074), 'Min': np.float64(0.0), 'Mean': np.float64(0.10066640152965166), 'Std': np.float64(0.041192372694633196)}
[I 2024-12-07 01:07:15,713] Trial 233 finished with value: 1.2666666666666666 and parameters: {'x_0_0': 'ad', 'x_0_1': 'oo', 'x_0_2': 'cd', 'x_1_0': 'ac', 'x_1_1': 'cd', 'x_1_2': 'cd'}. Best is trial 74 with value: 0.8222222222222222.
2024-12-07 01:07:21,732 - INFO - Candidate Mean Stats: {'Max': np.float64(2.0), 'Min': np.float64(0.2128442165255177), 'Mean': np.float64(0.4867176683102188), 'Std': np.float64(0.07189619229510279)}
2024-12-07 01:07:21,733 - INFO - Candidate Std Stats: {'Max': np.float64(0.5215115818623565), 'Min': np.float64(0.0), 'Mean': np.float64(0.10460144427492334), 'Std': np.float64(0.04257508033385134)}
[I 2024-12-07 01:07:21,776] Trial 234 finished with value: 1.7 and parameters: {'x_0_0': 'oo', 'x_0_1': 'cd', 'x_0_2': 'ac', 'x_1_0': 'oo', 'x_1_1': 'bc', 'x_1_2': 'bc'}. Best is trial 49 with value: 0.7999999999999999.
2024-12-07 01:07:31,519 - INFO - Candidate Mean Stats: {'Max': np.float64(2.0), 'Min': np.float64(0.2479649837535872), 'Mean': np.float64(0.4932550815301599), 'Std': np.float64(0.07540418372446074)}
2024-12-07 01:07:31,520 - INFO - Candidate Std Stats: {'Max': np.float64(0.6106801399560439), 'Min': np.float64(0.0), 'Mean': np.float64(0.10730506466702078), 'Std': np.float64(0.04863978518465588)}
[I 2024-12-07 01:07:31,563] Trial 234 finished with value: 1.3444444444444446 and parameters: {'x_0_0': 'ac', 'x_0_1': 'ad', 'x_0_2': 'ab', 'x_1_0': 'bd', 'x_1_1': 'oo', 'x_1_2': 'ad'}. Best is trial 200 with value: 0.6.
2024-12-07 01:07:36,223 - INFO - Candidate Mean Stats: {'Max': np.float64(2.0), 'Min': np.float64(0.26720038618131275), 'Mean': np.float64(0.4893454345620848), 'Std': np.float64(0.07161398443097401)}
2024-12-07 01:07:36,224 - INFO - Candidate Std Stats: {'Max': np.float64(0.31946412391385826), 'Min': np.float64(0.0), 'Mean': np.float64(0.09572800825921604), 'Std': np.float64(0.039906374461683644)}
[I 2024-12-07 01:07:36,267] Trial 235 finished with value: 1.1666666666666665 and parameters: {'x_0_0': 'ac', 'x_0_1': 'oo', 'x_0_2': 'oo', 'x_1_0': 'ab', 'x_1_1': 'bd', 'x_1_2': 'bc'}. Best is trial 148 with value: 0.8333333333333333.
2024-12-07 01:07:36,488 - INFO - Candidate Mean Stats: {'Max': np.float64(2.0), 'Min': np.float64(0.21360103403353), 'Mean': np.float64(0.4865444344953643), 'Std': np.float64(0.07837334710991559)}
2024-12-07 01:07:36,488 - INFO - Candidate Std Stats: {'Max': np.float64(0.6694005841447525), 'Min': np.float64(0.0), 'Mean': np.float64(0.1065281677465386), 'Std': np.float64(0.04428408991056563)}
[I 2024-12-07 01:07:36,530] Trial 234 finished with value: 1.4666666666666666 and parameters: {'x_0_0': 'bd', 'x_0_1': 'ad', 'x_0_2': 'cd', 'x_1_0': 'oo', 'x_1_1': 'bd', 'x_1_2': 'ad'}. Best is trial 74 with value: 0.8222222222222222.
2024-12-07 01:07:42,613 - INFO - Candidate Mean Stats: {'Max': np.float64(2.0), 'Min': np.float64(0.2734973644517815), 'Mean': np.float64(0.49097217054409503), 'Std': np.float64(0.0754818554050777)}
2024-12-07 01:07:42,613 - INFO - Candidate Std Stats: {'Max': np.float64(0.381968275978184), 'Min': np.float64(0.0), 'Mean': np.float64(0.10336906875739478), 'Std': np.float64(0.04200933780306969)}
[I 2024-12-07 01:07:42,659] Trial 235 finished with value: 1.3555555555555556 and parameters: {'x_0_0': 'bd', 'x_0_1': 'bd', 'x_0_2': 'oo', 'x_1_0': 'ab', 'x_1_1': 'oo', 'x_1_2': 'bc'}. Best is trial 49 with value: 0.7999999999999999.
2024-12-07 01:07:52,416 - INFO - Candidate Mean Stats: {'Max': np.float64(2.0), 'Min': np.float64(0.23378320687496656), 'Mean': np.float64(0.49070699747746555), 'Std': np.float64(0.077165626598779)}
2024-12-07 01:07:52,418 - INFO - Candidate Std Stats: {'Max': np.float64(0.4573166330232804), 'Min': np.float64(0.0), 'Mean': np.float64(0.10519478147306192), 'Std': np.float64(0.04304292857625285)}
[I 2024-12-07 01:07:52,462] Trial 235 finished with value: 1.0444444444444443 and parameters: {'x_0_0': 'ad', 'x_0_1': 'oo', 'x_0_2': 'ac', 'x_1_0': 'bd', 'x_1_1': 'ac', 'x_1_2': 'bd'}. Best is trial 200 with value: 0.6.
2024-12-07 01:07:56,912 - INFO - Candidate Mean Stats: {'Max': np.float64(2.0), 'Min': np.float64(0.22198947435421953), 'Mean': np.float64(0.49733184758702137), 'Std': np.float64(0.071134513970811)}
2024-12-07 01:07:56,913 - INFO - Candidate Std Stats: {'Max': np.float64(0.3952132030291011), 'Min': np.float64(0.0), 'Mean': np.float64(0.10012306232216506), 'Std': np.float64(0.0408539494839902)}
[I 2024-12-07 01:07:56,959] Trial 236 finished with value: 1.6666666666666665 and parameters: {'x_0_0': 'bd', 'x_0_1': 'ac', 'x_0_2': 'ac', 'x_1_0': 'cd', 'x_1_1': 'ad', 'x_1_2': 'ab'}. Best is trial 148 with value: 0.8333333333333333.
2024-12-07 01:07:57,331 - INFO - Candidate Mean Stats: {'Max': np.float64(2.0), 'Min': np.float64(0.24508473837417316), 'Mean': np.float64(0.48717071502723347), 'Std': np.float64(0.08023323819233755)}
2024-12-07 01:07:57,332 - INFO - Candidate Std Stats: {'Max': np.float64(1.424671250931154), 'Min': np.float64(0.0), 'Mean': np.float64(0.1183735496954769), 'Std': np.float64(0.06174983109797937)}
[I 2024-12-07 01:07:57,376] Trial 235 finished with value: 0.9666666666666667 and parameters: {'x_0_0': 'ad', 'x_0_1': 'oo', 'x_0_2': 'ab', 'x_1_0': 'oo', 'x_1_1': 'oo', 'x_1_2': 'bd'}. Best is trial 74 with value: 0.8222222222222222.
2024-12-07 01:08:03,880 - INFO - Candidate Mean Stats: {'Max': np.float64(2.0), 'Min': np.float64(0.1339234256482366), 'Mean': np.float64(0.48294862131195576), 'Std': np.float64(0.08162984635931059)}
2024-12-07 01:08:03,880 - INFO - Candidate Std Stats: {'Max': np.float64(0.8778298751916015), 'Min': np.float64(0.0), 'Mean': np.float64(0.11108480301131578), 'Std': np.float64(0.05166204322491624)}
[I 2024-12-07 01:08:03,925] Trial 236 finished with value: 1.5666666666666667 and parameters: {'x_0_0': 'bc', 'x_0_1': 'cd', 'x_0_2': 'ab', 'x_1_0': 'cd', 'x_1_1': 'ab', 'x_1_2': 'oo'}. Best is trial 49 with value: 0.7999999999999999.
2024-12-07 01:08:13,353 - INFO - Candidate Mean Stats: {'Max': np.float64(2.0), 'Min': np.float64(0.2995322386600624), 'Mean': np.float64(0.4939088459787161), 'Std': np.float64(0.06920634688012152)}
2024-12-07 01:08:13,354 - INFO - Candidate Std Stats: {'Max': np.float64(0.3824269427236776), 'Min': np.float64(0.0), 'Mean': np.float64(0.10106042492736642), 'Std': np.float64(0.042118555489941444)}
[I 2024-12-07 01:08:13,400] Trial 236 finished with value: 1.3444444444444446 and parameters: {'x_0_0': 'bc', 'x_0_1': 'ac', 'x_0_2': 'cd', 'x_1_0': 'ac', 'x_1_1': 'oo', 'x_1_2': 'cd'}. Best is trial 200 with value: 0.6.
2024-12-07 01:08:17,741 - INFO - Candidate Mean Stats: {'Max': np.float64(2.0), 'Min': np.float64(0.27787934799390973), 'Mean': np.float64(0.49215650400212574), 'Std': np.float64(0.07753464052372645)}
2024-12-07 01:08:17,742 - INFO - Candidate Std Stats: {'Max': np.float64(1.1401750868823233), 'Min': np.float64(0.0), 'Mean': np.float64(0.11396346211987099), 'Std': np.float64(0.05038672939948808)}
[I 2024-12-07 01:08:17,788] Trial 237 finished with value: 1.3555555555555556 and parameters: {'x_0_0': 'ac', 'x_0_1': 'ab', 'x_0_2': 'ad', 'x_1_0': 'oo', 'x_1_1': 'cd', 'x_1_2': 'cd'}. Best is trial 148 with value: 0.8333333333333333.
2024-12-07 01:08:18,114 - INFO - Candidate Mean Stats: {'Max': np.float64(2.0), 'Min': np.float64(0.29481725396667613), 'Mean': np.float64(0.5037741042740952), 'Std': np.float64(0.07050466670458384)}
2024-12-07 01:08:18,115 - INFO - Candidate Std Stats: {'Max': np.float64(0.6416539219933776), 'Min': np.float64(0.0), 'Mean': np.float64(0.09705757338873038), 'Std': np.float64(0.041615538305191685)}
[I 2024-12-07 01:08:18,158] Trial 236 finished with value: 1.2666666666666666 and parameters: {'x_0_0': 'bc', 'x_0_1': 'oo', 'x_0_2': 'bc', 'x_1_0': 'ac', 'x_1_1': 'bd', 'x_1_2': 'ac'}. Best is trial 74 with value: 0.8222222222222222.
2024-12-07 01:08:24,835 - INFO - Candidate Mean Stats: {'Max': np.float64(2.0), 'Min': np.float64(0.26432336774627885), 'Mean': np.float64(0.48490601582427595), 'Std': np.float64(0.0708868184550107)}
2024-12-07 01:08:24,836 - INFO - Candidate Std Stats: {'Max': np.float64(0.6298545312638218), 'Min': np.float64(0.0), 'Mean': np.float64(0.102234492103281), 'Std': np.float64(0.04385986799603008)}
[I 2024-12-07 01:08:24,882] Trial 237 finished with value: 1.4444444444444444 and parameters: {'x_0_0': 'ad', 'x_0_1': 'ab', 'x_0_2': 'ab', 'x_1_0': 'bc', 'x_1_1': 'cd', 'x_1_2': 'ad'}. Best is trial 49 with value: 0.7999999999999999.
2024-12-07 01:08:33,849 - INFO - Candidate Mean Stats: {'Max': np.float64(2.0), 'Min': np.float64(0.25664155043539766), 'Mean': np.float64(0.48998460678816735), 'Std': np.float64(0.08021010833127065)}
2024-12-07 01:08:33,850 - INFO - Candidate Std Stats: {'Max': np.float64(1.1478034313199736), 'Min': np.float64(0.0), 'Mean': np.float64(0.11322317414622038), 'Std': np.float64(0.05606435711481121)}
[I 2024-12-07 01:08:33,894] Trial 237 finished with value: 1.2777777777777777 and parameters: {'x_0_0': 'ab', 'x_0_1': 'oo', 'x_0_2': 'ac', 'x_1_0': 'cd', 'x_1_1': 'oo', 'x_1_2': 'ac'}. Best is trial 200 with value: 0.6.
2024-12-07 01:08:38,338 - INFO - Candidate Mean Stats: {'Max': np.float64(2.0), 'Min': np.float64(0.27647566907135734), 'Mean': np.float64(0.4925275901939965), 'Std': np.float64(0.07193769621171874)}
2024-12-07 01:08:38,339 - INFO - Candidate Std Stats: {'Max': np.float64(0.4721880578914592), 'Min': np.float64(0.0), 'Mean': np.float64(0.09974343841861258), 'Std': np.float64(0.04064326846860477)}
[I 2024-12-07 01:08:38,384] Trial 238 finished with value: 1.4444444444444444 and parameters: {'x_0_0': 'ac', 'x_0_1': 'ad', 'x_0_2': 'ad', 'x_1_0': 'ab', 'x_1_1': 'cd', 'x_1_2': 'cd'}. Best is trial 148 with value: 0.8333333333333333.
2024-12-07 01:08:38,717 - INFO - Candidate Mean Stats: {'Max': np.float64(2.0), 'Min': np.float64(0.23893244488646528), 'Mean': np.float64(0.4941087754723721), 'Std': np.float64(0.07612648914952132)}
2024-12-07 01:08:38,718 - INFO - Candidate Std Stats: {'Max': np.float64(0.5617796908365038), 'Min': np.float64(0.0), 'Mean': np.float64(0.10858904358750825), 'Std': np.float64(0.04918786747704055)}
[I 2024-12-07 01:08:38,762] Trial 237 finished with value: 1.2 and parameters: {'x_0_0': 'oo', 'x_0_1': 'oo', 'x_0_2': 'ad', 'x_1_0': 'oo', 'x_1_1': 'oo', 'x_1_2': 'cd'}. Best is trial 74 with value: 0.8222222222222222.
2024-12-07 01:08:45,651 - INFO - Candidate Mean Stats: {'Max': np.float64(2.0), 'Min': np.float64(0.1736375452169711), 'Mean': np.float64(0.4908781219558473), 'Std': np.float64(0.07731175389161375)}
2024-12-07 01:08:45,652 - INFO - Candidate Std Stats: {'Max': np.float64(1.4122269200980637), 'Min': np.float64(0.0), 'Mean': np.float64(0.10256757075213284), 'Std': np.float64(0.050318857038601957)}
[I 2024-12-07 01:08:45,696] Trial 238 finished with value: 1.1666666666666665 and parameters: {'x_0_0': 'bc', 'x_0_1': 'oo', 'x_0_2': 'ad', 'x_1_0': 'bc', 'x_1_1': 'oo', 'x_1_2': 'ad'}. Best is trial 49 with value: 0.7999999999999999.
2024-12-07 01:08:54,445 - INFO - Candidate Mean Stats: {'Max': np.float64(2.0), 'Min': np.float64(0.28219704031575377), 'Mean': np.float64(0.4959355187996284), 'Std': np.float64(0.07380945202259549)}
2024-12-07 01:08:54,446 - INFO - Candidate Std Stats: {'Max': np.float64(1.1703044213787572), 'Min': np.float64(0.0), 'Mean': np.float64(0.10216272850145856), 'Std': np.float64(0.047608942956750507)}
[I 2024-12-07 01:08:54,489] Trial 238 finished with value: 1.0666666666666667 and parameters: {'x_0_0': 'bc', 'x_0_1': 'oo', 'x_0_2': 'ac', 'x_1_0': 'oo', 'x_1_1': 'bd', 'x_1_2': 'ac'}. Best is trial 200 with value: 0.6.
2024-12-07 01:08:58,773 - INFO - Candidate Mean Stats: {'Max': np.float64(2.0), 'Min': np.float64(0.12075686738491394), 'Mean': np.float64(0.48638448405208407), 'Std': np.float64(0.08024186396475613)}
2024-12-07 01:08:58,773 - INFO - Candidate Std Stats: {'Max': np.float64(0.5422789291020031), 'Min': np.float64(0.0), 'Mean': np.float64(0.1025127195581256), 'Std': np.float64(0.04541770711488388)}
[I 2024-12-07 01:08:58,816] Trial 239 finished with value: 1.0555555555555556 and parameters: {'x_0_0': 'ad', 'x_0_1': 'oo', 'x_0_2': 'oo', 'x_1_0': 'ab', 'x_1_1': 'bd', 'x_1_2': 'cd'}. Best is trial 148 with value: 0.8333333333333333.
2024-12-07 01:08:59,204 - INFO - Candidate Mean Stats: {'Max': np.float64(2.0), 'Min': np.float64(0.26321623680422157), 'Mean': np.float64(0.4926019842611017), 'Std': np.float64(0.07287559441435337)}
2024-12-07 01:08:59,204 - INFO - Candidate Std Stats: {'Max': np.float64(0.8189828518711155), 'Min': np.float64(0.0), 'Mean': np.float64(0.1094496284898887), 'Std': np.float64(0.0465286256001981)}
[I 2024-12-07 01:08:59,249] Trial 238 finished with value: 1.0666666666666667 and parameters: {'x_0_0': 'ac', 'x_0_1': 'oo', 'x_0_2': 'ac', 'x_1_0': 'oo', 'x_1_1': 'bd', 'x_1_2': 'bd'}. Best is trial 74 with value: 0.8222222222222222.
2024-12-07 01:09:06,367 - INFO - Candidate Mean Stats: {'Max': np.float64(2.0), 'Min': np.float64(0.2660101190341224), 'Mean': np.float64(0.5017574174044357), 'Std': np.float64(0.07420452431465255)}
2024-12-07 01:09:06,371 - INFO - Candidate Std Stats: {'Max': np.float64(0.5186642655252062), 'Min': np.float64(0.0), 'Mean': np.float64(0.10863564648848552), 'Std': np.float64(0.04632171403452707)}
[I 2024-12-07 01:09:06,417] Trial 239 finished with value: 1.5666666666666667 and parameters: {'x_0_0': 'bc', 'x_0_1': 'bd', 'x_0_2': 'ad', 'x_1_0': 'ab', 'x_1_1': 'oo', 'x_1_2': 'cd'}. Best is trial 49 with value: 0.7999999999999999.
2024-12-07 01:09:15,444 - INFO - Candidate Mean Stats: {'Max': np.float64(2.0), 'Min': np.float64(0.26257410584790103), 'Mean': np.float64(0.4792760007627606), 'Std': np.float64(0.07346290173885646)}
2024-12-07 01:09:15,445 - INFO - Candidate Std Stats: {'Max': np.float64(0.8314882787410179), 'Min': np.float64(0.0), 'Mean': np.float64(0.10543281783794163), 'Std': np.float64(0.04606683611264948)}
