[I 2024-12-28 14:58:41,896] Trial 2 finished with value: 1.3214285714285714 and parameters: {'x_0_0': 'bd', 'x_0_1': 'ad', 'x_1_0': 'oo', 'x_1_1': 'ad'}. Best is trial 2 with value: 1.3214285714285714.
[I 2024-12-28 14:58:41,955] Trial 3 finished with value: 1.7142857142857144 and parameters: {'x_0_0': 'ab', 'x_0_1': 'bc', 'x_1_0': 'bd', 'x_1_1': 'bd'}. Best is trial 0 with value: 1.3214285714285714.
[I 2024-12-28 14:58:42,329] Trial 3 finished with value: 2.0 and parameters: {'x_0_0': 'cd', 'x_0_1': 'cd', 'x_1_0': 'ac', 'x_1_1': 'ab'}. Best is trial 2 with value: 1.1428571428571428.
[I 2024-12-28 14:58:42,360] Trial 2 finished with value: 1.1964285714285714 and parameters: {'x_0_0': 'ad', 'x_0_1': 'bc', 'x_1_0': 'oo', 'x_1_1': 'oo'}. Best is trial 2 with value: 1.1964285714285714.
[I 2024-12-28 14:58:42,363] Trial 3 finished with value: 1.1607142857142856 and parameters: {'x_0_0': 'bd', 'x_0_1': 'ab', 'x_1_0': 'bd', 'x_1_1': 'oo'}. Best is trial 3 with value: 1.1607142857142856.
[I 2024-12-28 14:58:42,420] Trial 3 finished with value: 1.75 and parameters: {'x_0_0': 'cd', 'x_0_1': 'bd', 'x_1_0': 'oo', 'x_1_1': 'bd'}. Best is trial 2 with value: 1.3214285714285714.
[I 2024-12-28 14:58:42,431] Trial 3 finished with value: 1.875 and parameters: {'x_0_0': 'oo', 'x_0_1': 'cd', 'x_1_0': 'cd', 'x_1_1': 'cd'}. Best is trial 1 with value: 1.0.
[I 2024-12-28 14:58:42,464] Trial 3 finished with value: 1.5714285714285714 and parameters: {'x_0_0': 'bc', 'x_0_1': 'bd', 'x_1_0': 'ac', 'x_1_1': 'bc'}. Best is trial 2 with value: 1.2857142857142856.
[I 2024-12-28 14:58:42,547] Trial 2 finished with value: 1.875 and parameters: {'x_0_0': 'oo', 'x_0_1': 'ad', 'x_1_0': 'ac', 'x_1_1': 'ac'}. Best is trial 0 with value: 1.0.
[I 2024-12-28 14:58:42,575] Trial 3 finished with value: 2.0 and parameters: {'x_0_0': 'cd', 'x_0_1': 'cd', 'x_1_0': 'ad', 'x_1_1': 'ab'}. Best is trial 2 with value: 1.1964285714285714.
[I 2024-12-28 14:58:42,626] Trial 4 finished with value: 1.5714285714285714 and parameters: {'x_0_0': 'ac', 'x_0_1': 'bc', 'x_1_0': 'bd', 'x_1_1': 'ad'}. Best is trial 0 with value: 1.3214285714285714.
[I 2024-12-28 14:58:42,721] Trial 4 finished with value: 2.0 and parameters: {'x_0_0': 'cd', 'x_0_1': 'bc', 'x_1_0': 'ac', 'x_1_1': 'bd'}. Best is trial 1 with value: 1.0.
[I 2024-12-28 14:58:42,756] Trial 4 finished with value: 2.0 and parameters: {'x_0_0': 'cd', 'x_0_1': 'ac', 'x_1_0': 'bc', 'x_1_1': 'ad'}. Best is trial 2 with value: 1.2857142857142856.
[I 2024-12-28 14:58:42,869] Trial 5 finished with value: 1.4642857142857144 and parameters: {'x_0_0': 'ab', 'x_0_1': 'bc', 'x_1_0': 'oo', 'x_1_1': 'ad'}. Best is trial 0 with value: 1.3214285714285714.
[I 2024-12-28 14:58:42,876] Trial 4 finished with value: 2.0 and parameters: {'x_0_0': 'cd', 'x_0_1': 'bc', 'x_1_0': 'ac', 'x_1_1': 'cd'}. Best is trial 3 with value: 1.1607142857142856.
[I 2024-12-28 14:58:42,961] Trial 3 finished with value: 1.1607142857142856 and parameters: {'x_0_0': 'ac', 'x_0_1': 'ac', 'x_1_0': 'ab', 'x_1_1': 'oo'}. Best is trial 1 with value: 1.0714285714285714.
[I 2024-12-28 14:58:42,992] Trial 4 finished with value: 1.5714285714285714 and parameters: {'x_0_0': 'ac', 'x_0_1': 'bc', 'x_1_0': 'ab', 'x_1_1': 'ac'}. Best is trial 2 with value: 1.3214285714285714.
[I 2024-12-28 14:58:43,007] Trial 4 finished with value: 1.875 and parameters: {'x_0_0': 'oo', 'x_0_1': 'ac', 'x_1_0': 'ac', 'x_1_1': 'ab'}. Best is trial 2 with value: 1.1428571428571428.
[I 2024-12-28 14:58:43,019] Trial 5 finished with value: 1.4464285714285714 and parameters: {'x_0_0': 'bc', 'x_0_1': 'bc', 'x_1_0': 'bd', 'x_1_1': 'oo'}. Best is trial 1 with value: 1.0.
[I 2024-12-28 14:58:43,141] Trial 3 finished with value: 0.7857142857142857 and parameters: {'x_0_0': 'ad', 'x_0_1': 'oo', 'x_1_0': 'bd', 'x_1_1': 'ab'}. Best is trial 3 with value: 0.7857142857142857.
[I 2024-12-28 14:58:43,245] Trial 5 finished with value: 1.5714285714285714 and parameters: {'x_0_0': 'ad', 'x_0_1': 'bc', 'x_1_0': 'cd', 'x_1_1': 'ac'}. Best is trial 2 with value: 1.3214285714285714.
[I 2024-12-28 14:58:43,245] Trial 3 finished with value: 1.875 and parameters: {'x_0_0': 'oo', 'x_0_1': 'bc', 'x_1_0': 'cd', 'x_1_1': 'ac'}. Best is trial 0 with value: 1.0.
[I 2024-12-28 14:58:43,247] Trial 4 finished with value: 1.0714285714285714 and parameters: {'x_0_0': 'ac', 'x_0_1': 'oo', 'x_1_0': 'ad', 'x_1_1': 'ac'}. Best is trial 4 with value: 1.0714285714285714.
[I 2024-12-28 14:58:43,278] Trial 5 finished with value: 1.7142857142857144 and parameters: {'x_0_0': 'ab', 'x_0_1': 'bc', 'x_1_0': 'bc', 'x_1_1': 'bc'}. Best is trial 2 with value: 1.2857142857142856.
[I 2024-12-28 14:58:43,302] Trial 6 finished with value: 1.875 and parameters: {'x_0_0': 'oo', 'x_0_1': 'bd', 'x_1_0': 'ab', 'x_1_1': 'cd'}. Best is trial 0 with value: 1.3214285714285714.
[I 2024-12-28 14:58:43,429] Trial 5 finished with value: 1.0714285714285714 and parameters: {'x_0_0': 'bd', 'x_0_1': 'oo', 'x_1_0': 'ac', 'x_1_1': 'ab'}. Best is trial 5 with value: 1.0714285714285714.
[I 2024-12-28 14:58:43,456] Trial 6 finished with value: 1.5714285714285714 and parameters: {'x_0_0': 'bc', 'x_0_1': 'cd', 'x_1_0': 'bd', 'x_1_1': 'ac'}. Best is trial 1 with value: 1.0.
[I 2024-12-28 14:58:43,522] Trial 6 finished with value: 1.2857142857142856 and parameters: {'x_0_0': 'bc', 'x_0_1': 'ac', 'x_1_0': 'cd', 'x_1_1': 'ad'}. Best is trial 6 with value: 1.2857142857142856.
[I 2024-12-28 14:58:43,614] Trial 4 finished with value: 1.5714285714285714 and parameters: {'x_0_0': 'ad', 'x_0_1': 'bc', 'x_1_0': 'cd', 'x_1_1': 'ac'}. Best is trial 0 with value: 1.0.
[I 2024-12-28 14:58:43,654] Trial 4 finished with value: 1.4285714285714286 and parameters: {'x_0_0': 'ac', 'x_0_1': 'ab', 'x_1_0': 'ac', 'x_1_1': 'ab'}. Best is trial 1 with value: 1.0714285714285714.
[I 2024-12-28 14:58:43,738] Trial 5 finished with value: 1.7142857142857144 and parameters: {'x_0_0': 'ab', 'x_0_1': 'ad', 'x_1_0': 'ad', 'x_1_1': 'bc'}. Best is trial 4 with value: 1.0714285714285714.
[I 2024-12-28 14:58:43,766] Trial 6 finished with value: 1.2857142857142856 and parameters: {'x_0_0': 'ad', 'x_0_1': 'bd', 'x_1_0': 'bd', 'x_1_1': 'ad'}. Best is trial 2 with value: 1.2857142857142856.
[I 2024-12-28 14:58:43,889] Trial 5 finished with value: 1.2857142857142856 and parameters: {'x_0_0': 'ad', 'x_0_1': 'ac', 'x_1_0': 'bd', 'x_1_1': 'ac'}. Best is trial 1 with value: 1.0714285714285714.
[I 2024-12-28 14:58:43,900] Trial 7 finished with value: 1.3214285714285714 and parameters: {'x_0_0': 'bd', 'x_0_1': 'cd', 'x_1_0': 'oo', 'x_1_1': 'ab'}. Best is trial 1 with value: 1.0.
[I 2024-12-28 14:58:43,929] Trial 6 finished with value: 1.0714285714285714 and parameters: {'x_0_0': 'ac', 'x_0_1': 'oo', 'x_1_0': 'ab', 'x_1_1': 'ac'}. Best is trial 5 with value: 1.0714285714285714.
[I 2024-12-28 14:58:44,012] Trial 7 finished with value: 1.7142857142857144 and parameters: {'x_0_0': 'ab', 'x_0_1': 'bc', 'x_1_0': 'ab', 'x_1_1': 'bd'}. Best is trial 6 with value: 1.2857142857142856.
[I 2024-12-28 14:58:44,025] Trial 4 finished with value: 1.7142857142857144 and parameters: {'x_0_0': 'ab', 'x_0_1': 'bc', 'x_1_0': 'ad', 'x_1_1': 'ad'}. Best is trial 3 with value: 0.7857142857142857.
[I 2024-12-28 14:58:44,102] Trial 5 finished with value: 2.0 and parameters: {'x_0_0': 'cd', 'x_0_1': 'cd', 'x_1_0': 'bc', 'x_1_1': 'ac'}. Best is trial 2 with value: 1.1428571428571428.
[I 2024-12-28 14:58:44,104] Trial 6 finished with value: 1.875 and parameters: {'x_0_0': 'cd', 'x_0_1': 'ab', 'x_1_0': 'bc', 'x_1_1': 'oo'}. Best is trial 1 with value: 1.0714285714285714.
[I 2024-12-28 14:58:44,123] Trial 7 finished with value: 1.3214285714285714 and parameters: {'x_0_0': 'ad', 'x_0_1': 'cd', 'x_1_0': 'oo', 'x_1_1': 'ab'}. Best is trial 2 with value: 1.2857142857142856.
[I 2024-12-28 14:58:44,195] Trial 8 finished with value: 1.5714285714285714 and parameters: {'x_0_0': 'bd', 'x_0_1': 'bd', 'x_1_0': 'ac', 'x_1_1': 'ab'}. Best is trial 1 with value: 1.0.
[I 2024-12-28 14:58:44,212] Trial 6 finished with value: 2.0 and parameters: {'x_0_0': 'cd', 'x_0_1': 'ad', 'x_1_0': 'ad', 'x_1_1': 'cd'}. Best is trial 4 with value: 1.0714285714285714.
[I 2024-12-28 14:58:44,334] Trial 7 finished with value: 1.2857142857142856 and parameters: {'x_0_0': 'ad', 'x_0_1': 'cd', 'x_1_0': 'bc', 'x_1_1': 'bc'}. Best is trial 5 with value: 1.0714285714285714.
[I 2024-12-28 14:58:44,363] Trial 8 finished with value: 1.3214285714285714 and parameters: {'x_0_0': 'ac', 'x_0_1': 'cd', 'x_1_0': 'oo', 'x_1_1': 'ac'}. Best is trial 6 with value: 1.2857142857142856.
[I 2024-12-28 14:58:44,437] Trial 8 finished with value: 2.0 and parameters: {'x_0_0': 'cd', 'x_0_1': 'ad', 'x_1_0': 'bc', 'x_1_1': 'bd'}. Best is trial 2 with value: 1.2857142857142856.
[I 2024-12-28 14:58:44,486] Trial 5 finished with value: 1.2857142857142856 and parameters: {'x_0_0': 'ad', 'x_0_1': 'cd', 'x_1_0': 'bd', 'x_1_1': 'cd'}. Best is trial 3 with value: 0.7857142857142857.
[I 2024-12-28 14:58:44,532] Trial 7 finished with value: 0.5 and parameters: {'x_0_0': 'ad', 'x_0_1': 'oo', 'x_1_0': 'bc', 'x_1_1': 'ac'}. Best is trial 7 with value: 0.5.
[I 2024-12-28 14:58:44,597] Trial 6 finished with value: 2.0 and parameters: {'x_0_0': 'cd', 'x_0_1': 'ac', 'x_1_0': 'ac', 'x_1_1': 'ac'}. Best is trial 2 with value: 1.1428571428571428.
[I 2024-12-28 14:58:44,658] Trial 8 finished with value: 1.875 and parameters: {'x_0_0': 'oo', 'x_0_1': 'ad', 'x_1_0': 'ac', 'x_1_1': 'cd'}. Best is trial 5 with value: 1.0714285714285714.
[I 2024-12-28 14:58:44,658] Trial 9 finished with value: 1.0 and parameters: {'x_0_0': 'bc', 'x_0_1': 'ad', 'x_1_0': 'ab', 'x_1_1': 'bc'}. Best is trial 1 with value: 1.0.
[I 2024-12-28 14:58:44,730] Trial 7 finished with value: 1.4285714285714286 and parameters: {'x_0_0': 'ad', 'x_0_1': 'cd', 'x_1_0': 'ab', 'x_1_1': 'ac'}. Best is trial 0 with value: 1.3214285714285714.
[I 2024-12-28 14:58:44,801] Trial 6 finished with value: 0.7857142857142857 and parameters: {'x_0_0': 'ad', 'x_0_1': 'oo', 'x_1_0': 'bd', 'x_1_1': 'cd'}. Best is trial 3 with value: 0.7857142857142857.
[I 2024-12-28 14:58:44,851] Trial 7 finished with value: 1.5714285714285714 and parameters: {'x_0_0': 'ac', 'x_0_1': 'bd', 'x_1_0': 'cd', 'x_1_1': 'bc'}. Best is trial 4 with value: 1.0714285714285714.
[I 2024-12-28 14:58:44,904] Trial 5 finished with value: 1.75 and parameters: {'x_0_0': 'oo', 'x_0_1': 'bc', 'x_1_0': 'ac', 'x_1_1': 'oo'}. Best is trial 0 with value: 1.0.
[I 2024-12-28 14:58:44,936] Trial 9 finished with value: 1.75 and parameters: {'x_0_0': 'cd', 'x_0_1': 'ad', 'x_1_0': 'oo', 'x_1_1': 'ad'}. Best is trial 6 with value: 1.2857142857142856.
[I 2024-12-28 14:58:45,021] Trial 7 finished with value: 1.5714285714285714 and parameters: {'x_0_0': 'ad', 'x_0_1': 'ab', 'x_1_0': 'ac', 'x_1_1': 'ac'}. Best is trial 2 with value: 1.1428571428571428.
[I 2024-12-28 14:58:45,126] Trial 9 finished with value: 1.1964285714285714 and parameters: {'x_0_0': 'bd', 'x_0_1': 'ab', 'x_1_0': 'oo', 'x_1_1': 'oo'}. Best is trial 5 with value: 1.0714285714285714.
[I 2024-12-28 14:58:45,126] Trial 8 finished with value: 1.0714285714285714 and parameters: {'x_0_0': 'ac', 'x_0_1': 'oo', 'x_1_0': 'bd', 'x_1_1': 'bd'}. Best is trial 8 with value: 1.0714285714285714.
[I 2024-12-28 14:58:45,139] Trial 9 finished with value: 1.0714285714285714 and parameters: {'x_0_0': 'bd', 'x_0_1': 'oo', 'x_1_0': 'ac', 'x_1_1': 'cd'}. Best is trial 9 with value: 1.0714285714285714.
[I 2024-12-28 14:58:45,183] Trial 10 finished with value: 1.5 and parameters: {'x_0_0': 'cd', 'x_0_1': 'oo', 'x_1_0': 'ab', 'x_1_1': 'ab'}. Best is trial 1 with value: 1.0.
[I 2024-12-28 14:58:45,308] Trial 8 finished with value: 1.2142857142857144 and parameters: {'x_0_0': 'ab', 'x_0_1': 'oo', 'x_1_0': 'cd', 'x_1_1': 'ab'}. Best is trial 2 with value: 1.1428571428571428.
[I 2024-12-28 14:58:45,348] Trial 8 finished with value: 1.5714285714285714 and parameters: {'x_0_0': 'ac', 'x_0_1': 'cd', 'x_1_0': 'ad', 'x_1_1': 'bc'}. Best is trial 4 with value: 1.0714285714285714.
[I 2024-12-28 14:58:45,365] Trial 6 finished with value: 0.8214285714285714 and parameters: {'x_0_0': 'bc', 'x_0_1': 'oo', 'x_1_0': 'oo', 'x_1_1': 'cd'}. Best is trial 6 with value: 0.8214285714285714.
[I 2024-12-28 14:58:45,419] Trial 8 finished with value: 1.0 and parameters: {'x_0_0': 'ac', 'x_0_1': 'ad', 'x_1_0': 'ab', 'x_1_1': 'bc'}. Best is trial 7 with value: 0.5.
[I 2024-12-28 14:58:45,504] Trial 10 finished with value: 2.0 and parameters: {'x_0_0': 'cd', 'x_0_1': 'ac', 'x_1_0': 'bd', 'x_1_1': 'cd'}. Best is trial 9 with value: 1.0714285714285714.
[I 2024-12-28 14:58:45,514] Trial 11 finished with value: 1.875 and parameters: {'x_0_0': 'oo', 'x_0_1': 'bc', 'x_1_0': 'ac', 'x_1_1': 'bc'}. Best is trial 1 with value: 1.0.
[I 2024-12-28 14:58:45,640] Trial 9 finished with value: 1.5 and parameters: {'x_0_0': 'cd', 'x_0_1': 'oo', 'x_1_0': 'cd', 'x_1_1': 'ac'}. Best is trial 8 with value: 1.0714285714285714.
[I 2024-12-28 14:58:45,722] Trial 9 finished with value: 1.2857142857142856 and parameters: {'x_0_0': 'ad', 'x_0_1': 'bd', 'x_1_0': 'bc', 'x_1_1': 'cd'}. Best is trial 2 with value: 1.1428571428571428.
[I 2024-12-28 14:58:45,763] Trial 10 finished with value: 1.5714285714285714 and parameters: {'x_0_0': 'ac', 'x_0_1': 'bc', 'x_1_0': 'cd', 'x_1_1': 'bd'}. Best is trial 6 with value: 1.2857142857142856.
[I 2024-12-28 14:58:45,769] Trial 10 finished with value: 1.4285714285714286 and parameters: {'x_0_0': 'bc', 'x_0_1': 'ab', 'x_1_0': 'cd', 'x_1_1': 'ac'}. Best is trial 5 with value: 1.0714285714285714.
[I 2024-12-28 14:58:45,865] Trial 9 finished with value: 1.0 and parameters: {'x_0_0': 'ad', 'x_0_1': 'ac', 'x_1_0': 'bc', 'x_1_1': 'ac'}. Best is trial 7 with value: 0.5.
[I 2024-12-28 14:58:45,869] Trial 10 finished with value: 1.5714285714285714 and parameters: {'x_0_0': 'bc', 'x_0_1': 'cd', 'x_1_0': 'ad', 'x_1_1': 'bd'}. Best is trial 8 with value: 1.0714285714285714.
[I 2024-12-28 14:58:45,935] Trial 12 finished with value: 1.5714285714285714 and parameters: {'x_0_0': 'bc', 'x_0_1': 'cd', 'x_1_0': 'bd', 'x_1_1': 'bc'}. Best is trial 1 with value: 1.0.
[I 2024-12-28 14:58:45,983] Trial 7 finished with value: 1.0892857142857144 and parameters: {'x_0_0': 'ab', 'x_0_1': 'oo', 'x_1_0': 'ac', 'x_1_1': 'oo'}. Best is trial 6 with value: 0.8214285714285714.
[I 2024-12-28 14:58:45,983] Trial 11 finished with value: 2.0 and parameters: {'x_0_0': 'cd', 'x_0_1': 'cd', 'x_1_0': 'bc', 'x_1_1': 'cd'}. Best is trial 9 with value: 1.0714285714285714.
[I 2024-12-28 14:58:46,000] Trial 11 finished with value: 1.875 and parameters: {'x_0_0': 'oo', 'x_0_1': 'ac', 'x_1_0': 'ad', 'x_1_1': 'bd'}. Best is trial 6 with value: 1.2857142857142856.
[I 2024-12-28 14:58:46,007] Trial 9 finished with value: 1.4464285714285714 and parameters: {'x_0_0': 'bd', 'x_0_1': 'cd', 'x_1_0': 'cd', 'x_1_1': 'oo'}. Best is trial 4 with value: 1.0714285714285714.
[I 2024-12-28 14:58:46,057] Trial 10 finished with value: 1.875 and parameters: {'x_0_0': 'oo', 'x_0_1': 'cd', 'x_1_0': 'bc', 'x_1_1': 'ab'}. Best is trial 2 with value: 1.1428571428571428.
[I 2024-12-28 14:58:46,111] Trial 11 finished with value: 1.0714285714285714 and parameters: {'x_0_0': 'ac', 'x_0_1': 'oo', 'x_1_0': 'bc', 'x_1_1': 'ad'}. Best is trial 5 with value: 1.0714285714285714.
[I 2024-12-28 14:58:46,150] Trial 7 finished with value: 1.7142857142857144 and parameters: {'x_0_0': 'ab', 'x_0_1': 'bc', 'x_1_0': 'ad', 'x_1_1': 'ab'}. Best is trial 3 with value: 0.7857142857142857.
[I 2024-12-28 14:58:46,163] Trial 11 finished with value: 1.5714285714285714 and parameters: {'x_0_0': 'ad', 'x_0_1': 'cd', 'x_1_0': 'ad', 'x_1_1': 'ab'}. Best is trial 8 with value: 1.0714285714285714.
[I 2024-12-28 14:58:46,249] Trial 10 finished with value: 1.0714285714285714 and parameters: {'x_0_0': 'ac', 'x_0_1': 'oo', 'x_1_0': 'cd', 'x_1_1': 'cd'}. Best is trial 7 with value: 0.5.
[I 2024-12-28 14:58:46,339] Trial 13 finished with value: 1.625 and parameters: {'x_0_0': 'cd', 'x_0_1': 'ad', 'x_1_0': 'oo', 'x_1_1': 'oo'}. Best is trial 1 with value: 1.0.
[I 2024-12-28 14:58:46,368] Trial 10 finished with value: 1.0714285714285714 and parameters: {'x_0_0': 'ac', 'x_0_1': 'oo', 'x_1_0': 'ab', 'x_1_1': 'bd'}. Best is trial 4 with value: 1.0714285714285714.
[I 2024-12-28 14:58:46,369] Trial 12 finished with value: 1.2857142857142856 and parameters: {'x_0_0': 'bd', 'x_0_1': 'bc', 'x_1_0': 'bd', 'x_1_1': 'bc'}. Best is trial 5 with value: 1.0714285714285714.
[I 2024-12-28 14:58:46,381] Trial 12 finished with value: 1.2857142857142856 and parameters: {'x_0_0': 'ac', 'x_0_1': 'ac', 'x_1_0': 'ab', 'x_1_1': 'bd'}. Best is trial 6 with value: 1.2857142857142856.
[I 2024-12-28 14:58:46,446] Trial 12 finished with value: 2.0 and parameters: {'x_0_0': 'cd', 'x_0_1': 'cd', 'x_1_0': 'cd', 'x_1_1': 'ac'}. Best is trial 8 with value: 1.0714285714285714.
[I 2024-12-28 14:58:46,479] Trial 12 finished with value: 1.4285714285714286 and parameters: {'x_0_0': 'ac', 'x_0_1': 'ab', 'x_1_0': 'bd', 'x_1_1': 'bc'}. Best is trial 9 with value: 1.0714285714285714.
[I 2024-12-28 14:58:46,489] Trial 8 finished with value: 1.5714285714285714 and parameters: {'x_0_0': 'bd', 'x_0_1': 'bd', 'x_1_0': 'ac', 'x_1_1': 'ac'}. Best is trial 6 with value: 0.8214285714285714.
[I 2024-12-28 14:58:46,496] Trial 11 finished with value: 1.5714285714285714 and parameters: {'x_0_0': 'bd', 'x_0_1': 'bc', 'x_1_0': 'ad', 'x_1_1': 'cd'}. Best is trial 2 with value: 1.1428571428571428.
[I 2024-12-28 14:58:46,501] Trial 11 finished with value: 1.5714285714285714 and parameters: {'x_0_0': 'ac', 'x_0_1': 'bd', 'x_1_0': 'bc', 'x_1_1': 'bc'}. Best is trial 7 with value: 0.5.
[I 2024-12-28 14:58:46,642] Trial 13 finished with value: 2.0 and parameters: {'x_0_0': 'cd', 'x_0_1': 'bc', 'x_1_0': 'bc', 'x_1_1': 'cd'}. Best is trial 5 with value: 1.0714285714285714.
[I 2024-12-28 14:58:46,708] Trial 8 finished with value: 2.0 and parameters: {'x_0_0': 'cd', 'x_0_1': 'bd', 'x_1_0': 'ab', 'x_1_1': 'bd'}. Best is trial 3 with value: 0.7857142857142857.
[I 2024-12-28 14:58:46,738] Trial 12 finished with value: 1.5714285714285714 and parameters: {'x_0_0': 'bd', 'x_0_1': 'bc', 'x_1_0': 'cd', 'x_1_1': 'ad'}. Best is trial 2 with value: 1.1428571428571428.
[I 2024-12-28 14:58:46,781] Trial 9 finished with value: 1.4285714285714286 and parameters: {'x_0_0': 'bc', 'x_0_1': 'ab', 'x_1_0': 'ac', 'x_1_1': 'bc'}. Best is trial 6 with value: 0.8214285714285714.
[I 2024-12-28 14:58:46,796] Trial 13 finished with value: 1.75 and parameters: {'x_0_0': 'oo', 'x_0_1': 'ac', 'x_1_0': 'ab', 'x_1_1': 'oo'}. Best is trial 9 with value: 1.0714285714285714.
[I 2024-12-28 14:58:46,814] Trial 13 finished with value: 1.5892857142857144 and parameters: {'x_0_0': 'ab', 'x_0_1': 'ac', 'x_1_0': 'ad', 'x_1_1': 'oo'}. Best is trial 6 with value: 1.2857142857142856.
[I 2024-12-28 14:58:47,024] Trial 11 finished with value: 1.2857142857142856 and parameters: {'x_0_0': 'bc', 'x_0_1': 'ad', 'x_1_0': 'ad', 'x_1_1': 'cd'}. Best is trial 4 with value: 1.0714285714285714.
[I 2024-12-28 14:58:47,027] Trial 14 finished with value: 1.4464285714285714 and parameters: {'x_0_0': 'bd', 'x_0_1': 'ac', 'x_1_0': 'ac', 'x_1_1': 'oo'}. Best is trial 9 with value: 1.0714285714285714.
[I 2024-12-28 14:58:47,054] Trial 14 finished with value: 2.0 and parameters: {'x_0_0': 'cd', 'x_0_1': 'bc', 'x_1_0': 'ac', 'x_1_1': 'bc'}. Best is trial 6 with value: 1.2857142857142856.
[I 2024-12-28 14:58:47,060] Trial 14 finished with value: 1.375 and parameters: {'x_0_0': 'oo', 'x_0_1': 'oo', 'x_1_0': 'ac', 'x_1_1': 'bd'}. Best is trial 1 with value: 1.0.
[I 2024-12-28 14:58:47,073] Trial 13 finished with value: 2.0 and parameters: {'x_0_0': 'cd', 'x_0_1': 'ab', 'x_1_0': 'ac', 'x_1_1': 'cd'}. Best is trial 2 with value: 1.1428571428571428.
[I 2024-12-28 14:58:47,106] Trial 12 finished with value: 1.5714285714285714 and parameters: {'x_0_0': 'bc', 'x_0_1': 'bc', 'x_1_0': 'cd', 'x_1_1': 'bd'}. Best is trial 7 with value: 0.5.
[I 2024-12-28 14:58:47,201] Trial 15 finished with value: 1.4464285714285714 and parameters: {'x_0_0': 'ad', 'x_0_1': 'ab', 'x_1_0': 'ac', 'x_1_1': 'oo'}. Best is trial 9 with value: 1.0714285714285714.
[I 2024-12-28 14:58:47,264] Trial 15 finished with value: 1.7142857142857144 and parameters: {'x_0_0': 'ab', 'x_0_1': 'cd', 'x_1_0': 'bd', 'x_1_1': 'ad'}. Best is trial 1 with value: 1.0.
[I 2024-12-28 14:58:47,327] Trial 10 finished with value: 1.0714285714285714 and parameters: {'x_0_0': 'ac', 'x_0_1': 'oo', 'x_1_0': 'ad', 'x_1_1': 'ad'}. Best is trial 6 with value: 0.8214285714285714.
[I 2024-12-28 14:58:47,346] Trial 13 finished with value: 1.875 and parameters: {'x_0_0': 'oo', 'x_0_1': 'bc', 'x_1_0': 'cd', 'x_1_1': 'ac'}. Best is trial 7 with value: 0.5.
[I 2024-12-28 14:58:47,402] Trial 14 finished with value: 1.75 and parameters: {'x_0_0': 'cd', 'x_0_1': 'ad', 'x_1_0': 'oo', 'x_1_1': 'bc'}. Best is trial 2 with value: 1.1428571428571428.
[I 2024-12-28 14:58:47,413] Trial 14 finished with value: 1.5714285714285714 and parameters: {'x_0_0': 'ad', 'x_0_1': 'cd', 'x_1_0': 'ac', 'x_1_1': 'ab'}. Best is trial 5 with value: 1.0714285714285714.
[I 2024-12-28 14:58:47,464] Trial 16 finished with value: 1.0357142857142856 and parameters: {'x_0_0': 'ac', 'x_0_1': 'ad', 'x_1_0': 'oo', 'x_1_1': 'cd'}. Best is trial 16 with value: 1.0357142857142856.
[I 2024-12-28 14:58:47,507] Trial 16 finished with value: 2.0 and parameters: {'x_0_0': 'cd', 'x_0_1': 'ac', 'x_1_0': 'cd', 'x_1_1': 'bd'}. Best is trial 1 with value: 1.0.
[I 2024-12-28 14:58:47,529] Trial 12 finished with value: 2.0 and parameters: {'x_0_0': 'cd', 'x_0_1': 'bd', 'x_1_0': 'ad', 'x_1_1': 'ab'}. Best is trial 4 with value: 1.0714285714285714.
[I 2024-12-28 14:58:47,579] Trial 15 finished with value: 1.5714285714285714 and parameters: {'x_0_0': 'bd', 'x_0_1': 'bc', 'x_1_0': 'cd', 'x_1_1': 'ad'}. Best is trial 6 with value: 1.2857142857142856.
