[I 2024-12-07 00:48:52,618] Trial 180 finished with value: 1.4666666666666666 and parameters: {'x_0_0': 'ad', 'x_0_1': 'cd', 'x_0_2': 'bc', 'x_1_0': 'oo', 'x_1_1': 'bc', 'x_1_2': 'ac'}. Best is trial 148 with value: 0.8333333333333333.
2024-12-07 00:48:53,627 - INFO - Candidate Mean Stats: {'Max': np.float64(2.0), 'Min': np.float64(0.29935627105545687), 'Mean': np.float64(0.4919703426202866), 'Std': np.float64(0.06775433629362926)}
2024-12-07 00:48:53,628 - INFO - Candidate Std Stats: {'Max': np.float64(0.50881456933535), 'Min': np.float64(0.0), 'Mean': np.float64(0.09871154862956343), 'Std': np.float64(0.04114437087856766)}
[I 2024-12-07 00:48:53,671] Trial 180 finished with value: 1.1222222222222222 and parameters: {'x_0_0': 'bc', 'x_0_1': 'ac', 'x_0_2': 'ac', 'x_1_0': 'bc', 'x_1_1': 'oo', 'x_1_2': 'bd'}. Best is trial 49 with value: 0.7999999999999999.
2024-12-07 00:49:00,660 - INFO - Candidate Mean Stats: {'Max': np.float64(2.0), 'Min': np.float64(0.22457959519129597), 'Mean': np.float64(0.48633774703548555), 'Std': np.float64(0.07371805438077426)}
2024-12-07 00:49:00,660 - INFO - Candidate Std Stats: {'Max': np.float64(0.5496832751429588), 'Min': np.float64(0.0), 'Mean': np.float64(0.10566581221061488), 'Std': np.float64(0.04497303896713656)}
[I 2024-12-07 00:49:00,702] Trial 180 finished with value: 1.3666666666666667 and parameters: {'x_0_0': 'ad', 'x_0_1': 'bd', 'x_0_2': 'ab', 'x_1_0': 'oo', 'x_1_1': 'bc', 'x_1_2': 'oo'}. Best is trial 179 with value: 0.8333333333333333.
2024-12-07 00:49:06,724 - INFO - Candidate Mean Stats: {'Max': np.float64(2.0), 'Min': np.float64(0.12647098222058425), 'Mean': np.float64(0.4898542611342808), 'Std': np.float64(0.07833670671670176)}
2024-12-07 00:49:06,725 - INFO - Candidate Std Stats: {'Max': np.float64(0.4776810467165626), 'Min': np.float64(0.0), 'Mean': np.float64(0.11183509918387707), 'Std': np.float64(0.05019387114581044)}
[I 2024-12-07 00:49:06,769] Trial 180 finished with value: 1.2666666666666666 and parameters: {'x_0_0': 'bc', 'x_0_1': 'oo', 'x_0_2': 'ac', 'x_1_0': 'ab', 'x_1_1': 'bc', 'x_1_2': 'ab'}. Best is trial 74 with value: 0.8222222222222222.
2024-12-07 00:49:12,541 - INFO - Candidate Mean Stats: {'Max': np.float64(2.0), 'Min': np.float64(0.269172047657174), 'Mean': np.float64(0.4995730934736838), 'Std': np.float64(0.0676657372307325)}
2024-12-07 00:49:12,541 - INFO - Candidate Std Stats: {'Max': np.float64(0.37784148699856374), 'Min': np.float64(0.0), 'Mean': np.float64(0.09009872786583713), 'Std': np.float64(0.03618299476647809)}
[I 2024-12-07 00:49:12,582] Trial 181 finished with value: 1.5555555555555556 and parameters: {'x_0_0': 'ac', 'x_0_1': 'ab', 'x_0_2': 'bd', 'x_1_0': 'cd', 'x_1_1': 'bd', 'x_1_2': 'bd'}. Best is trial 148 with value: 0.8333333333333333.
2024-12-07 00:49:13,706 - INFO - Candidate Mean Stats: {'Max': np.float64(2.0), 'Min': np.float64(0.24941020640683798), 'Mean': np.float64(0.4922462699778439), 'Std': np.float64(0.07341441898698989)}
2024-12-07 00:49:13,706 - INFO - Candidate Std Stats: {'Max': np.float64(0.6787232205381258), 'Min': np.float64(0.0), 'Mean': np.float64(0.1064958179927132), 'Std': np.float64(0.05117217561223691)}
[I 2024-12-07 00:49:13,747] Trial 181 finished with value: 1.5666666666666667 and parameters: {'x_0_0': 'bc', 'x_0_1': 'cd', 'x_0_2': 'ad', 'x_1_0': 'ac', 'x_1_1': 'ad', 'x_1_2': 'oo'}. Best is trial 49 with value: 0.7999999999999999.
2024-12-07 00:49:20,835 - INFO - Candidate Mean Stats: {'Max': np.float64(2.0), 'Min': np.float64(0.1831786578614886), 'Mean': np.float64(0.48761433528819265), 'Std': np.float64(0.07261506612055728)}
2024-12-07 00:49:20,836 - INFO - Candidate Std Stats: {'Max': np.float64(0.48008702226290356), 'Min': np.float64(0.0), 'Mean': np.float64(0.10465950295448392), 'Std': np.float64(0.04492156539637879)}
[I 2024-12-07 00:49:20,878] Trial 181 finished with value: 1.6666666666666665 and parameters: {'x_0_0': 'bc', 'x_0_1': 'bd', 'x_0_2': 'bd', 'x_1_0': 'ab', 'x_1_1': 'bd', 'x_1_2': 'ad'}. Best is trial 179 with value: 0.8333333333333333.
2024-12-07 00:49:26,861 - INFO - Candidate Mean Stats: {'Max': np.float64(2.0), 'Min': np.float64(0.27674359874320587), 'Mean': np.float64(0.4892962940564057), 'Std': np.float64(0.06852318377682036)}
2024-12-07 00:49:26,862 - INFO - Candidate Std Stats: {'Max': np.float64(0.682553944406154), 'Min': np.float64(0.0), 'Mean': np.float64(0.10071370382428471), 'Std': np.float64(0.04221332094359719)}
[I 2024-12-07 00:49:26,908] Trial 181 finished with value: 1.4666666666666666 and parameters: {'x_0_0': 'bd', 'x_0_1': 'ab', 'x_0_2': 'cd', 'x_1_0': 'oo', 'x_1_1': 'cd', 'x_1_2': 'bd'}. Best is trial 74 with value: 0.8222222222222222.
2024-12-07 00:49:32,443 - INFO - Candidate Mean Stats: {'Max': np.float64(2.0), 'Min': np.float64(0.31124472996947355), 'Mean': np.float64(0.4869979180668488), 'Std': np.float64(0.06895439309631886)}
2024-12-07 00:49:32,444 - INFO - Candidate Std Stats: {'Max': np.float64(1.5104737648086155), 'Min': np.float64(0.0), 'Mean': np.float64(0.10198064165963659), 'Std': np.float64(0.04512504612971446)}
[I 2024-12-07 00:49:32,487] Trial 182 finished with value: 1.7777777777777777 and parameters: {'x_0_0': 'ab', 'x_0_1': 'cd', 'x_0_2': 'ac', 'x_1_0': 'ad', 'x_1_1': 'bd', 'x_1_2': 'ac'}. Best is trial 148 with value: 0.8333333333333333.
2024-12-07 00:49:33,586 - INFO - Candidate Mean Stats: {'Max': np.float64(2.0), 'Min': np.float64(0.267357633729875), 'Mean': np.float64(0.480042443350206), 'Std': np.float64(0.07066551823780415)}
2024-12-07 00:49:33,587 - INFO - Candidate Std Stats: {'Max': np.float64(0.49360769565969964), 'Min': np.float64(0.0), 'Mean': np.float64(0.10412069774617037), 'Std': np.float64(0.044668438754163216)}
[I 2024-12-07 00:49:33,629] Trial 182 finished with value: 1.3666666666666667 and parameters: {'x_0_0': 'ac', 'x_0_1': 'bd', 'x_0_2': 'ab', 'x_1_0': 'oo', 'x_1_1': 'ad', 'x_1_2': 'oo'}. Best is trial 49 with value: 0.7999999999999999.
2024-12-07 00:49:41,042 - INFO - Candidate Mean Stats: {'Max': np.float64(2.0), 'Min': np.float64(0.1847386633350524), 'Mean': np.float64(0.49085529948743456), 'Std': np.float64(0.07072619693043303)}
2024-12-07 00:49:41,042 - INFO - Candidate Std Stats: {'Max': np.float64(0.555384168511121), 'Min': np.float64(0.0), 'Mean': np.float64(0.10251961986670365), 'Std': np.float64(0.04364878894977299)}
[I 2024-12-07 00:49:41,085] Trial 182 finished with value: 1.2666666666666666 and parameters: {'x_0_0': 'ac', 'x_0_1': 'oo', 'x_0_2': 'bc', 'x_1_0': 'bc', 'x_1_1': 'ab', 'x_1_2': 'ab'}. Best is trial 179 with value: 0.8333333333333333.
2024-12-07 00:49:46,955 - INFO - Candidate Mean Stats: {'Max': np.float64(2.0), 'Min': np.float64(0.20898712161502128), 'Mean': np.float64(0.48143775865016963), 'Std': np.float64(0.07145119201675681)}
2024-12-07 00:49:46,956 - INFO - Candidate Std Stats: {'Max': np.float64(1.7447941148219754), 'Min': np.float64(0.0), 'Mean': np.float64(0.1069216179811662), 'Std': np.float64(0.05558988134681714)}
[I 2024-12-07 00:49:46,998] Trial 182 finished with value: 1.5555555555555556 and parameters: {'x_0_0': 'ac', 'x_0_1': 'ab', 'x_0_2': 'bd', 'x_1_0': 'ab', 'x_1_1': 'ac', 'x_1_2': 'ab'}. Best is trial 74 with value: 0.8222222222222222.
2024-12-07 00:49:52,256 - INFO - Candidate Mean Stats: {'Max': np.float64(2.0), 'Min': np.float64(0.20195750915251903), 'Mean': np.float64(0.4816709432284847), 'Std': np.float64(0.08608555364192542)}
2024-12-07 00:49:52,257 - INFO - Candidate Std Stats: {'Max': np.float64(1.8313524371067766), 'Min': np.float64(0.0), 'Mean': np.float64(0.13223064789084044), 'Std': np.float64(0.06494138065425395)}
[I 2024-12-07 00:49:52,299] Trial 183 finished with value: 1.5777777777777777 and parameters: {'x_0_0': 'ab', 'x_0_1': 'bc', 'x_0_2': 'cd', 'x_1_0': 'oo', 'x_1_1': 'bd', 'x_1_2': 'ad'}. Best is trial 148 with value: 0.8333333333333333.
2024-12-07 00:49:53,389 - INFO - Candidate Mean Stats: {'Max': np.float64(2.0), 'Min': np.float64(0.23541217053890753), 'Mean': np.float64(0.4924037402744919), 'Std': np.float64(0.07125577910350832)}
2024-12-07 00:49:53,389 - INFO - Candidate Std Stats: {'Max': np.float64(0.35751703920064276), 'Min': np.float64(0.0), 'Mean': np.float64(0.10016990308511858), 'Std': np.float64(0.039679196098231354)}
[I 2024-12-07 00:49:53,431] Trial 183 finished with value: 1.4666666666666666 and parameters: {'x_0_0': 'bd', 'x_0_1': 'ab', 'x_0_2': 'cd', 'x_1_0': 'oo', 'x_1_1': 'cd', 'x_1_2': 'cd'}. Best is trial 49 with value: 0.7999999999999999.
2024-12-07 00:50:01,167 - INFO - Candidate Mean Stats: {'Max': np.float64(2.0), 'Min': np.float64(0.27172829660105513), 'Mean': np.float64(0.48508334141579046), 'Std': np.float64(0.06360960535483812)}
2024-12-07 00:50:01,167 - INFO - Candidate Std Stats: {'Max': np.float64(0.3345470933060013), 'Min': np.float64(0.0), 'Mean': np.float64(0.09780743803461447), 'Std': np.float64(0.03874058474167737)}
[I 2024-12-07 00:50:01,209] Trial 183 finished with value: 1.6777777777777778 and parameters: {'x_0_0': 'ab', 'x_0_1': 'ac', 'x_0_2': 'ac', 'x_1_0': 'ab', 'x_1_1': 'oo', 'x_1_2': 'bc'}. Best is trial 179 with value: 0.8333333333333333.
2024-12-07 00:50:06,877 - INFO - Candidate Mean Stats: {'Max': np.float64(2.0), 'Min': np.float64(0.2943814876191787), 'Mean': np.float64(0.4924934933222218), 'Std': np.float64(0.06577885122556335)}
2024-12-07 00:50:06,878 - INFO - Candidate Std Stats: {'Max': np.float64(0.31981682284825236), 'Min': np.float64(0.0), 'Mean': np.float64(0.09074067665729223), 'Std': np.float64(0.03635943965927994)}
[I 2024-12-07 00:50:06,921] Trial 183 finished with value: 1.5777777777777777 and parameters: {'x_0_0': 'ab', 'x_0_1': 'ac', 'x_0_2': 'ab', 'x_1_0': 'oo', 'x_1_1': 'cd', 'x_1_2': 'bd'}. Best is trial 74 with value: 0.8222222222222222.
2024-12-07 00:50:12,187 - INFO - Candidate Mean Stats: {'Max': np.float64(2.0), 'Min': np.float64(0.16019583272928214), 'Mean': np.float64(0.49210413185062135), 'Std': np.float64(0.0762142821040544)}
2024-12-07 00:50:12,188 - INFO - Candidate Std Stats: {'Max': np.float64(0.3941685004402113), 'Min': np.float64(0.0), 'Mean': np.float64(0.10504548069773167), 'Std': np.float64(0.04426284361928567)}
[I 2024-12-07 00:50:12,230] Trial 184 finished with value: 1.4666666666666666 and parameters: {'x_0_0': 'bd', 'x_0_1': 'ac', 'x_0_2': 'ad', 'x_1_0': 'oo', 'x_1_1': 'ad', 'x_1_2': 'ac'}. Best is trial 148 with value: 0.8333333333333333.
2024-12-07 00:50:13,531 - INFO - Candidate Mean Stats: {'Max': np.float64(2.0), 'Min': np.float64(0.2371505347101956), 'Mean': np.float64(0.4806174901892981), 'Std': np.float64(0.07474252077046468)}
2024-12-07 00:50:13,532 - INFO - Candidate Std Stats: {'Max': np.float64(0.5555372371879804), 'Min': np.float64(0.0), 'Mean': np.float64(0.11121734051881725), 'Std': np.float64(0.04431432508002748)}
[I 2024-12-07 00:50:13,575] Trial 184 finished with value: 1.4555555555555557 and parameters: {'x_0_0': 'ac', 'x_0_1': 'ab', 'x_0_2': 'ac', 'x_1_0': 'ab', 'x_1_1': 'ab', 'x_1_2': 'oo'}. Best is trial 49 with value: 0.7999999999999999.
2024-12-07 00:50:21,376 - INFO - Candidate Mean Stats: {'Max': np.float64(2.0), 'Min': np.float64(0.23438510345055494), 'Mean': np.float64(0.4906992417511699), 'Std': np.float64(0.07347527155550522)}
2024-12-07 00:50:21,377 - INFO - Candidate Std Stats: {'Max': np.float64(0.6876291101111197), 'Min': np.float64(0.0), 'Mean': np.float64(0.10037763527825962), 'Std': np.float64(0.044239203055391245)}
[I 2024-12-07 00:50:21,420] Trial 184 finished with value: 1.1222222222222222 and parameters: {'x_0_0': 'ad', 'x_0_1': 'ac', 'x_0_2': 'cd', 'x_1_0': 'bc', 'x_1_1': 'ad', 'x_1_2': 'oo'}. Best is trial 179 with value: 0.8333333333333333.
2024-12-07 00:50:27,075 - INFO - Candidate Mean Stats: {'Max': np.float64(2.0), 'Min': np.float64(0.28537331942497446), 'Mean': np.float64(0.49449489943911357), 'Std': np.float64(0.07922100808828873)}
2024-12-07 00:50:27,075 - INFO - Candidate Std Stats: {'Max': np.float64(2.2153915498284498), 'Min': np.float64(0.0), 'Mean': np.float64(0.10823473914582674), 'Std': np.float64(0.055625025150625756)}
[I 2024-12-07 00:50:27,118] Trial 184 finished with value: 1.6666666666666665 and parameters: {'x_0_0': 'bc', 'x_0_1': 'cd', 'x_0_2': 'bd', 'x_1_0': 'ab', 'x_1_1': 'bd', 'x_1_2': 'cd'}. Best is trial 74 with value: 0.8222222222222222.
2024-12-07 00:50:31,971 - INFO - Candidate Mean Stats: {'Max': np.float64(2.0), 'Min': np.float64(0.2294609420550863), 'Mean': np.float64(0.48883033211346644), 'Std': np.float64(0.07911446935494387)}
2024-12-07 00:50:31,971 - INFO - Candidate Std Stats: {'Max': np.float64(1.3752798833731463), 'Min': np.float64(0.0), 'Mean': np.float64(0.11136120073142888), 'Std': np.float64(0.0535705590390709)}
[I 2024-12-07 00:50:32,014] Trial 185 finished with value: 1.6666666666666665 and parameters: {'x_0_0': 'bd', 'x_0_1': 'ab', 'x_0_2': 'ac', 'x_1_0': 'ad', 'x_1_1': 'bd', 'x_1_2': 'ad'}. Best is trial 148 with value: 0.8333333333333333.
2024-12-07 00:50:33,600 - INFO - Candidate Mean Stats: {'Max': np.float64(2.0), 'Min': np.float64(0.27563183791223467), 'Mean': np.float64(0.49568055835158975), 'Std': np.float64(0.07174787962747342)}
2024-12-07 00:50:33,600 - INFO - Candidate Std Stats: {'Max': np.float64(0.4889027864500816), 'Min': np.float64(0.0), 'Mean': np.float64(0.10541361615311319), 'Std': np.float64(0.04439115836141522)}
[I 2024-12-07 00:50:33,643] Trial 185 finished with value: 1.2666666666666666 and parameters: {'x_0_0': 'ad', 'x_0_1': 'oo', 'x_0_2': 'ad', 'x_1_0': 'cd', 'x_1_1': 'bc', 'x_1_2': 'ad'}. Best is trial 49 with value: 0.7999999999999999.
2024-12-07 00:50:41,445 - INFO - Candidate Mean Stats: {'Max': np.float64(2.0), 'Min': np.float64(0.3255556620482107), 'Mean': np.float64(0.4944670034139293), 'Std': np.float64(0.06609182250346392)}
2024-12-07 00:50:41,445 - INFO - Candidate Std Stats: {'Max': np.float64(0.6330162365148425), 'Min': np.float64(0.0), 'Mean': np.float64(0.10407281281939083), 'Std': np.float64(0.04308626958919051)}
[I 2024-12-07 00:50:41,488] Trial 185 finished with value: 1.9 and parameters: {'x_0_0': 'cd', 'x_0_1': 'bd', 'x_0_2': 'bc', 'x_1_0': 'ab', 'x_1_1': 'cd', 'x_1_2': 'oo'}. Best is trial 179 with value: 0.8333333333333333.
2024-12-07 00:50:47,465 - INFO - Candidate Mean Stats: {'Max': np.float64(2.0), 'Min': np.float64(0.2493864811820823), 'Mean': np.float64(0.4909680413370775), 'Std': np.float64(0.06924293785719986)}
2024-12-07 00:50:47,468 - INFO - Candidate Std Stats: {'Max': np.float64(1.1309352653298463), 'Min': np.float64(0.0), 'Mean': np.float64(0.10684978269794432), 'Std': np.float64(0.04764894419502328)}
[I 2024-12-07 00:50:47,510] Trial 185 finished with value: 1.3777777777777778 and parameters: {'x_0_0': 'ab', 'x_0_1': 'oo', 'x_0_2': 'cd', 'x_1_0': 'ac', 'x_1_1': 'ad', 'x_1_2': 'cd'}. Best is trial 74 with value: 0.8222222222222222.
2024-12-07 00:50:52,301 - INFO - Candidate Mean Stats: {'Max': np.float64(2.0), 'Min': np.float64(0.15330875214514675), 'Mean': np.float64(0.4825329772728544), 'Std': np.float64(0.07987327336713299)}
2024-12-07 00:50:52,302 - INFO - Candidate Std Stats: {'Max': np.float64(1.2804686993609335), 'Min': np.float64(0.0), 'Mean': np.float64(0.11582110220108474), 'Std': np.float64(0.056419875072887336)}
[I 2024-12-07 00:50:52,345] Trial 186 finished with value: 1.3666666666666667 and parameters: {'x_0_0': 'bd', 'x_0_1': 'ab', 'x_0_2': 'oo', 'x_1_0': 'oo', 'x_1_1': 'bd', 'x_1_2': 'bd'}. Best is trial 148 with value: 0.8333333333333333.
2024-12-07 00:50:54,115 - INFO - Candidate Mean Stats: {'Max': np.float64(2.0), 'Min': np.float64(0.2752209336139499), 'Mean': np.float64(0.49632270728081757), 'Std': np.float64(0.06780824484137948)}
2024-12-07 00:50:54,116 - INFO - Candidate Std Stats: {'Max': np.float64(0.41834521920656775), 'Min': np.float64(0.0), 'Mean': np.float64(0.10524925237784834), 'Std': np.float64(0.04202947772639931)}
[I 2024-12-07 00:50:54,161] Trial 186 finished with value: 1.2666666666666666 and parameters: {'x_0_0': 'ac', 'x_0_1': 'oo', 'x_0_2': 'cd', 'x_1_0': 'bc', 'x_1_1': 'ac', 'x_1_2': 'ab'}. Best is trial 49 with value: 0.7999999999999999.
2024-12-07 00:51:02,472 - INFO - Candidate Mean Stats: {'Max': np.float64(2.0), 'Min': np.float64(0.26547767537604494), 'Mean': np.float64(0.4918162119773796), 'Std': np.float64(0.06745668639077156)}
2024-12-07 00:51:02,473 - INFO - Candidate Std Stats: {'Max': np.float64(0.49334726556390457), 'Min': np.float64(0.0), 'Mean': np.float64(0.10060696732856665), 'Std': np.float64(0.04133389173703312)}
[I 2024-12-07 00:51:02,515] Trial 186 finished with value: 1.5555555555555556 and parameters: {'x_0_0': 'ad', 'x_0_1': 'bc', 'x_0_2': 'ad', 'x_1_0': 'ab', 'x_1_1': 'ab', 'x_1_2': 'ab'}. Best is trial 179 with value: 0.8333333333333333.
2024-12-07 00:51:08,665 - INFO - Candidate Mean Stats: {'Max': np.float64(2.0), 'Min': np.float64(0.24425138991347844), 'Mean': np.float64(0.4998645667858001), 'Std': np.float64(0.06928127140107677)}
2024-12-07 00:51:08,666 - INFO - Candidate Std Stats: {'Max': np.float64(0.33534384276321205), 'Min': np.float64(0.0), 'Mean': np.float64(0.09952739441868749), 'Std': np.float64(0.041860778622687264)}
[I 2024-12-07 00:51:08,711] Trial 186 finished with value: 1.2666666666666666 and parameters: {'x_0_0': 'ac', 'x_0_1': 'oo', 'x_0_2': 'bc', 'x_1_0': 'bc', 'x_1_1': 'ab', 'x_1_2': 'ac'}. Best is trial 74 with value: 0.8222222222222222.
2024-12-07 00:51:13,464 - INFO - Candidate Mean Stats: {'Max': np.float64(2.0), 'Min': np.float64(0.26914573417813925), 'Mean': np.float64(0.4826915133731727), 'Std': np.float64(0.07719247086603924)}
2024-12-07 00:51:13,464 - INFO - Candidate Std Stats: {'Max': np.float64(1.8276401607007422), 'Min': np.float64(0.0), 'Mean': np.float64(0.11410945732357773), 'Std': np.float64(0.05532685015575876)}
[I 2024-12-07 00:51:13,510] Trial 187 finished with value: 2.0 and parameters: {'x_0_0': 'cd', 'x_0_1': 'ab', 'x_0_2': 'cd', 'x_1_0': 'ab', 'x_1_1': 'ac', 'x_1_2': 'ab'}. Best is trial 148 with value: 0.8333333333333333.
2024-12-07 00:51:15,478 - INFO - Candidate Mean Stats: {'Max': np.float64(2.0), 'Min': np.float64(0.22457220054810115), 'Mean': np.float64(0.4883785983395454), 'Std': np.float64(0.07223730773042496)}
2024-12-07 00:51:15,478 - INFO - Candidate Std Stats: {'Max': np.float64(0.4832278638122525), 'Min': np.float64(0.0), 'Mean': np.float64(0.10397249564055351), 'Std': np.float64(0.04455261875286359)}
[I 2024-12-07 00:51:15,520] Trial 187 finished with value: 1.1666666666666665 and parameters: {'x_0_0': 'bc', 'x_0_1': 'oo', 'x_0_2': 'ad', 'x_1_0': 'cd', 'x_1_1': 'oo', 'x_1_2': 'ac'}. Best is trial 49 with value: 0.7999999999999999.
2024-12-07 00:51:23,238 - INFO - Candidate Mean Stats: {'Max': np.float64(2.0), 'Min': np.float64(0.2821388721410227), 'Mean': np.float64(0.4995272847399132), 'Std': np.float64(0.06872194559515801)}
2024-12-07 00:51:23,238 - INFO - Candidate Std Stats: {'Max': np.float64(1.1852718206287343), 'Min': np.float64(0.0), 'Mean': np.float64(0.10093321536234363), 'Std': np.float64(0.04982619013793041)}
[I 2024-12-07 00:51:23,285] Trial 187 finished with value: 1.3444444444444446 and parameters: {'x_0_0': 'ad', 'x_0_1': 'cd', 'x_0_2': 'ac', 'x_1_0': 'bd', 'x_1_1': 'ad', 'x_1_2': 'oo'}. Best is trial 179 with value: 0.8333333333333333.
2024-12-07 00:51:29,541 - INFO - Candidate Mean Stats: {'Max': np.float64(2.0), 'Min': np.float64(0.24266210684571904), 'Mean': np.float64(0.49356885283336593), 'Std': np.float64(0.07441444512790973)}
2024-12-07 00:51:29,542 - INFO - Candidate Std Stats: {'Max': np.float64(0.5414864972076043), 'Min': np.float64(0.0), 'Mean': np.float64(0.10861926001480349), 'Std': np.float64(0.047605619911622314)}
[I 2024-12-07 00:51:29,589] Trial 187 finished with value: 1.0666666666666667 and parameters: {'x_0_0': 'bc', 'x_0_1': 'oo', 'x_0_2': 'bd', 'x_1_0': 'oo', 'x_1_1': 'ac', 'x_1_2': 'bd'}. Best is trial 74 with value: 0.8222222222222222.
2024-12-07 00:51:34,004 - INFO - Candidate Mean Stats: {'Max': np.float64(2.0), 'Min': np.float64(0.2657473811110534), 'Mean': np.float64(0.4960940346287233), 'Std': np.float64(0.07397256610124267)}
2024-12-07 00:51:34,005 - INFO - Candidate Std Stats: {'Max': np.float64(0.4440493659381458), 'Min': np.float64(0.0), 'Mean': np.float64(0.10715511914290371), 'Std': np.float64(0.04455469620784532)}
[I 2024-12-07 00:51:34,050] Trial 188 finished with value: 1.2666666666666666 and parameters: {'x_0_0': 'bd', 'x_0_1': 'oo', 'x_0_2': 'bd', 'x_1_0': 'ad', 'x_1_1': 'ad', 'x_1_2': 'ad'}. Best is trial 148 with value: 0.8333333333333333.
2024-12-07 00:51:36,113 - INFO - Candidate Mean Stats: {'Max': np.float64(2.0), 'Min': np.float64(0.2695946984060242), 'Mean': np.float64(0.4933125207553305), 'Std': np.float64(0.07640788237363476)}
2024-12-07 00:51:36,114 - INFO - Candidate Std Stats: {'Max': np.float64(0.9662635106428951), 'Min': np.float64(0.0), 'Mean': np.float64(0.10929212968567373), 'Std': np.float64(0.05063996296007421)}
[I 2024-12-07 00:51:36,162] Trial 188 finished with value: 0.8666666666666667 and parameters: {'x_0_0': 'bd', 'x_0_1': 'oo', 'x_0_2': 'oo', 'x_1_0': 'oo', 'x_1_1': 'oo', 'x_1_2': 'bd'}. Best is trial 49 with value: 0.7999999999999999.
2024-12-07 00:51:43,787 - INFO - Candidate Mean Stats: {'Max': np.float64(2.0), 'Min': np.float64(0.2769843429170908), 'Mean': np.float64(0.4856525702344844), 'Std': np.float64(0.07243077944444734)}
2024-12-07 00:51:43,787 - INFO - Candidate Std Stats: {'Max': np.float64(1.7316937415975775), 'Min': np.float64(0.0), 'Mean': np.float64(0.10546476014046767), 'Std': np.float64(0.04752897233531055)}
