[I 2024-12-06 23:56:39,508] Trial 43 finished with value: 1.6666666666666665 and parameters: {'x_0_0': 'ad', 'x_0_1': 'ab', 'x_0_2': 'ac', 'x_1_0': 'ac', 'x_1_1': 'ac', 'x_1_2': 'ab'}. Best is trial 32 with value: 0.9444444444444444.
2024-12-06 23:56:49,700 - INFO - Candidate Mean Stats: {'Max': np.float64(2.0), 'Min': np.float64(0.2068952140768368), 'Mean': np.float64(0.4902603820097621), 'Std': np.float64(0.07089968698323322)}
2024-12-06 23:56:49,701 - INFO - Candidate Std Stats: {'Max': np.float64(1.2243662943555922), 'Min': np.float64(0.0), 'Mean': np.float64(0.11768318943306912), 'Std': np.float64(0.06469565473462423)}
[I 2024-12-06 23:56:49,738] Trial 44 finished with value: 1.3444444444444446 and parameters: {'x_0_0': 'ac', 'x_0_1': 'ac', 'x_0_2': 'bd', 'x_1_0': 'cd', 'x_1_1': 'cd', 'x_1_2': 'oo'}. Best is trial 22 with value: 1.1666666666666665.
2024-12-06 23:56:50,102 - INFO - Candidate Mean Stats: {'Max': np.float64(2.0), 'Min': np.float64(0.2810071215844678), 'Mean': np.float64(0.4927089297386682), 'Std': np.float64(0.061760593312942834)}
2024-12-06 23:56:50,102 - INFO - Candidate Std Stats: {'Max': np.float64(0.8820794282918087), 'Min': np.float64(0.0), 'Mean': np.float64(0.10652754652575529), 'Std': np.float64(0.049863225265611225)}
[I 2024-12-06 23:56:50,139] Trial 44 finished with value: 1.6666666666666665 and parameters: {'x_0_0': 'ad', 'x_0_1': 'cd', 'x_0_2': 'ab', 'x_1_0': 'cd', 'x_1_1': 'cd', 'x_1_2': 'cd'}. Best is trial 2 with value: 0.9666666666666667.
2024-12-06 23:56:50,402 - INFO - Candidate Mean Stats: {'Max': np.float64(2.0), 'Min': np.float64(0.26966569248043043), 'Mean': np.float64(0.47907065420368616), 'Std': np.float64(0.05983884210699006)}
2024-12-06 23:56:50,403 - INFO - Candidate Std Stats: {'Max': np.float64(1.593207052324625), 'Min': np.float64(0.0), 'Mean': np.float64(0.09639865985122367), 'Std': np.float64(0.0444077859324891)}
[I 2024-12-06 23:56:50,439] Trial 44 finished with value: 1.6666666666666665 and parameters: {'x_0_0': 'bc', 'x_0_1': 'bd', 'x_0_2': 'bd', 'x_1_0': 'ac', 'x_1_1': 'bc', 'x_1_2': 'ac'}. Best is trial 7 with value: 1.077777777777778.
2024-12-06 23:56:56,712 - INFO - Candidate Mean Stats: {'Max': np.float64(1.9), 'Min': np.float64(0.22393106399964163), 'Mean': np.float64(0.48796180552819274), 'Std': np.float64(0.057910960970787094)}
2024-12-06 23:56:56,713 - INFO - Candidate Std Stats: {'Max': np.float64(0.801699034580512), 'Min': np.float64(0.0), 'Mean': np.float64(0.1099298601647079), 'Std': np.float64(0.046021116314508156)}
[I 2024-12-06 23:56:56,749] Trial 44 finished with value: 1.9 and parameters: {'x_0_0': 'oo', 'x_0_1': 'bc', 'x_0_2': 'ad', 'x_1_0': 'cd', 'x_1_1': 'cd', 'x_1_2': 'ab'}. Best is trial 32 with value: 0.9444444444444444.
2024-12-06 23:57:07,165 - INFO - Candidate Mean Stats: {'Max': np.float64(2.0), 'Min': np.float64(0.27705559196889173), 'Mean': np.float64(0.4903575799489514), 'Std': np.float64(0.058341702030439986)}
2024-12-06 23:57:07,166 - INFO - Candidate Std Stats: {'Max': np.float64(1.112509760625793), 'Min': np.float64(0.0), 'Mean': np.float64(0.10349047682577855), 'Std': np.float64(0.04827326993473146)}
[I 2024-12-06 23:57:07,205] Trial 45 finished with value: 1.4666666666666666 and parameters: {'x_0_0': 'ad', 'x_0_1': 'ab', 'x_0_2': 'bd', 'x_1_0': 'oo', 'x_1_1': 'ac', 'x_1_2': 'ac'}. Best is trial 22 with value: 1.1666666666666665.
2024-12-06 23:57:07,596 - INFO - Candidate Mean Stats: {'Max': np.float64(2.0), 'Min': np.float64(0.26710186532105634), 'Mean': np.float64(0.49377195084529646), 'Std': np.float64(0.059388952385762535)}
2024-12-06 23:57:07,597 - INFO - Candidate Std Stats: {'Max': np.float64(0.4056450420305931), 'Min': np.float64(0.0), 'Mean': np.float64(0.10110644330920457), 'Std': np.float64(0.04259867632513745)}
[I 2024-12-06 23:57:07,634] Trial 45 finished with value: 2.0 and parameters: {'x_0_0': 'cd', 'x_0_1': 'ab', 'x_0_2': 'bc', 'x_1_0': 'ad', 'x_1_1': 'ad', 'x_1_2': 'bd'}. Best is trial 2 with value: 0.9666666666666667.
2024-12-06 23:57:07,922 - INFO - Candidate Mean Stats: {'Max': np.float64(2.0), 'Min': np.float64(0.2583932016764163), 'Mean': np.float64(0.4889554090908928), 'Std': np.float64(0.06787886038789298)}
2024-12-06 23:57:07,923 - INFO - Candidate Std Stats: {'Max': np.float64(1.345475128411404), 'Min': np.float64(0.0), 'Mean': np.float64(0.12473659439354794), 'Std': np.float64(0.06092398059939675)}
[I 2024-12-06 23:57:07,960] Trial 45 finished with value: 1.5555555555555556 and parameters: {'x_0_0': 'bd', 'x_0_1': 'ad', 'x_0_2': 'ab', 'x_1_0': 'ab', 'x_1_1': 'bc', 'x_1_2': 'cd'}. Best is trial 7 with value: 1.077777777777778.
2024-12-06 23:57:14,724 - INFO - Candidate Mean Stats: {'Max': np.float64(1.9), 'Min': np.float64(0.3353137753009649), 'Mean': np.float64(0.49952951955779445), 'Std': np.float64(0.05081620274769809)}
2024-12-06 23:57:14,725 - INFO - Candidate Std Stats: {'Max': np.float64(0.5750290352130759), 'Min': np.float64(0.0), 'Mean': np.float64(0.09614707969072152), 'Std': np.float64(0.040575806669711466)}
[I 2024-12-06 23:57:14,768] Trial 45 finished with value: 2.0 and parameters: {'x_0_0': 'cd', 'x_0_1': 'bc', 'x_0_2': 'ad', 'x_1_0': 'ab', 'x_1_1': 'ad', 'x_1_2': 'bd'}. Best is trial 32 with value: 0.9444444444444444.
2024-12-06 23:57:24,925 - INFO - Candidate Mean Stats: {'Max': np.float64(2.0), 'Min': np.float64(0.25611269862275643), 'Mean': np.float64(0.5031764457743503), 'Std': np.float64(0.06376162805020737)}
2024-12-06 23:57:24,927 - INFO - Candidate Std Stats: {'Max': np.float64(1.4963428124184224), 'Min': np.float64(0.0), 'Mean': np.float64(0.10812240666536213), 'Std': np.float64(0.049399379837045614)}
[I 2024-12-06 23:57:24,966] Trial 46 finished with value: 1.9 and parameters: {'x_0_0': 'cd', 'x_0_1': 'bd', 'x_0_2': 'cd', 'x_1_0': 'ac', 'x_1_1': 'bc', 'x_1_2': 'oo'}. Best is trial 22 with value: 1.1666666666666665.
2024-12-06 23:57:25,882 - INFO - Candidate Mean Stats: {'Max': np.float64(2.0), 'Min': np.float64(0.25561811312115446), 'Mean': np.float64(0.48775432100325367), 'Std': np.float64(0.05979591535182444)}
2024-12-06 23:57:25,882 - INFO - Candidate Std Stats: {'Max': np.float64(0.40616110197673466), 'Min': np.float64(0.0), 'Mean': np.float64(0.10367407804672019), 'Std': np.float64(0.04196112920012161)}
[I 2024-12-06 23:57:25,922] Trial 46 finished with value: 1.5555555555555556 and parameters: {'x_0_0': 'ac', 'x_0_1': 'ab', 'x_0_2': 'ab', 'x_1_0': 'bd', 'x_1_1': 'ab', 'x_1_2': 'cd'}. Best is trial 2 with value: 0.9666666666666667.
2024-12-06 23:57:26,124 - INFO - Candidate Mean Stats: {'Max': np.float64(2.0), 'Min': np.float64(0.29591508251366383), 'Mean': np.float64(0.4856350789817729), 'Std': np.float64(0.056324824845429854)}
2024-12-06 23:57:26,125 - INFO - Candidate Std Stats: {'Max': np.float64(0.6626996060135895), 'Min': np.float64(0.0), 'Mean': np.float64(0.10108551673720442), 'Std': np.float64(0.044266658978526316)}
[I 2024-12-06 23:57:26,163] Trial 46 finished with value: 1.6666666666666665 and parameters: {'x_0_0': 'bd', 'x_0_1': 'ad', 'x_0_2': 'bd', 'x_1_0': 'ad', 'x_1_1': 'ab', 'x_1_2': 'cd'}. Best is trial 7 with value: 1.077777777777778.
2024-12-06 23:57:33,125 - INFO - Candidate Mean Stats: {'Max': np.float64(2.0), 'Min': np.float64(0.23503094595823656), 'Mean': np.float64(0.48058339379924303), 'Std': np.float64(0.06165496313793292)}
2024-12-06 23:57:33,126 - INFO - Candidate Std Stats: {'Max': np.float64(0.44077967253984807), 'Min': np.float64(0.0), 'Mean': np.float64(0.1035440829223602), 'Std': np.float64(0.044632640433090634)}
[I 2024-12-06 23:57:33,165] Trial 46 finished with value: 1.6777777777777778 and parameters: {'x_0_0': 'ab', 'x_0_1': 'cd', 'x_0_2': 'ab', 'x_1_0': 'ad', 'x_1_1': 'ad', 'x_1_2': 'oo'}. Best is trial 32 with value: 0.9444444444444444.
2024-12-06 23:57:42,621 - INFO - Candidate Mean Stats: {'Max': np.float64(2.0), 'Min': np.float64(0.1720973165055928), 'Mean': np.float64(0.47968696859174403), 'Std': np.float64(0.07266070951928617)}
2024-12-06 23:57:42,622 - INFO - Candidate Std Stats: {'Max': np.float64(1.6239873019510878), 'Min': np.float64(0.0), 'Mean': np.float64(0.12192370167914159), 'Std': np.float64(0.06574123310243611)}
[I 2024-12-06 23:57:42,663] Trial 47 finished with value: 1.7777777777777777 and parameters: {'x_0_0': 'ab', 'x_0_1': 'ac', 'x_0_2': 'ab', 'x_1_0': 'ab', 'x_1_1': 'bd', 'x_1_2': 'bd'}. Best is trial 22 with value: 1.1666666666666665.
2024-12-06 23:57:44,595 - INFO - Candidate Mean Stats: {'Max': np.float64(2.0), 'Min': np.float64(0.2367746524435649), 'Mean': np.float64(0.48112522756987713), 'Std': np.float64(0.059650096202124074)}
2024-12-06 23:57:44,596 - INFO - Candidate Std Stats: {'Max': np.float64(0.5002161858624846), 'Min': np.float64(0.0), 'Mean': np.float64(0.11077081886558066), 'Std': np.float64(0.04871755762410621)}
[I 2024-12-06 23:57:44,636] Trial 47 finished with value: 1.7999999999999998 and parameters: {'x_0_0': 'oo', 'x_0_1': 'ab', 'x_0_2': 'bd', 'x_1_0': 'bd', 'x_1_1': 'oo', 'x_1_2': 'ab'}. Best is trial 2 with value: 0.9666666666666667.
2024-12-06 23:57:44,852 - INFO - Candidate Mean Stats: {'Max': np.float64(2.0), 'Min': np.float64(0.2985234456924452), 'Mean': np.float64(0.4896507318740533), 'Std': np.float64(0.053957012645156927)}
2024-12-06 23:57:44,853 - INFO - Candidate Std Stats: {'Max': np.float64(0.3743939191947322), 'Min': np.float64(0.0), 'Mean': np.float64(0.09035483142282204), 'Std': np.float64(0.0374063197152794)}
[I 2024-12-06 23:57:44,893] Trial 47 finished with value: 1.0666666666666667 and parameters: {'x_0_0': 'ad', 'x_0_1': 'oo', 'x_0_2': 'ab', 'x_1_0': 'oo', 'x_1_1': 'ab', 'x_1_2': 'bd'}. Best is trial 47 with value: 1.0666666666666667.
2024-12-06 23:57:52,015 - INFO - Candidate Mean Stats: {'Max': np.float64(2.0), 'Min': np.float64(0.27807493945038825), 'Mean': np.float64(0.4874482436056893), 'Std': np.float64(0.06373825972330449)}
2024-12-06 23:57:52,016 - INFO - Candidate Std Stats: {'Max': np.float64(1.8011922766831125), 'Min': np.float64(0.0), 'Mean': np.float64(0.11261193605725268), 'Std': np.float64(0.05702332968859879)}
[I 2024-12-06 23:57:52,056] Trial 47 finished with value: 1.9 and parameters: {'x_0_0': 'cd', 'x_0_1': 'cd', 'x_0_2': 'oo', 'x_1_0': 'bc', 'x_1_1': 'ac', 'x_1_2': 'ac'}. Best is trial 32 with value: 0.9444444444444444.
2024-12-06 23:58:01,393 - INFO - Candidate Mean Stats: {'Max': np.float64(2.0), 'Min': np.float64(0.29769107778911685), 'Mean': np.float64(0.4905816574225799), 'Std': np.float64(0.06065456710652568)}
2024-12-06 23:58:01,394 - INFO - Candidate Std Stats: {'Max': np.float64(0.698622469010712), 'Min': np.float64(0.0), 'Mean': np.float64(0.1133445266250487), 'Std': np.float64(0.04919850378789903)}
[I 2024-12-06 23:58:01,435] Trial 48 finished with value: 1.9 and parameters: {'x_0_0': 'oo', 'x_0_1': 'ad', 'x_0_2': 'cd', 'x_1_0': 'ac', 'x_1_1': 'cd', 'x_1_2': 'ab'}. Best is trial 22 with value: 1.1666666666666665.
2024-12-06 23:58:02,854 - INFO - Candidate Mean Stats: {'Max': np.float64(2.0), 'Min': np.float64(0.2098398434130006), 'Mean': np.float64(0.490331834126956), 'Std': np.float64(0.07006788936761046)}
2024-12-06 23:58:02,855 - INFO - Candidate Std Stats: {'Max': np.float64(1.3107019935994837), 'Min': np.float64(0.0), 'Mean': np.float64(0.11326181154630012), 'Std': np.float64(0.059074183340551076)}
[I 2024-12-06 23:58:02,895] Trial 48 finished with value: 1.6666666666666665 and parameters: {'x_0_0': 'ac', 'x_0_1': 'cd', 'x_0_2': 'bc', 'x_1_0': 'bc', 'x_1_1': 'bc', 'x_1_2': 'ac'}. Best is trial 2 with value: 0.9666666666666667.
2024-12-06 23:58:03,939 - INFO - Candidate Mean Stats: {'Max': np.float64(2.0), 'Min': np.float64(0.22290083922364468), 'Mean': np.float64(0.47981396615692484), 'Std': np.float64(0.0699496739012376)}
2024-12-06 23:58:03,939 - INFO - Candidate Std Stats: {'Max': np.float64(1.3057052909556943), 'Min': np.float64(0.0), 'Mean': np.float64(0.1291951172629394), 'Std': np.float64(0.07113218084233551)}
[I 2024-12-06 23:58:03,991] Trial 48 finished with value: 1.9 and parameters: {'x_0_0': 'oo', 'x_0_1': 'ab', 'x_0_2': 'ab', 'x_1_0': 'ad', 'x_1_1': 'bc', 'x_1_2': 'ab'}. Best is trial 47 with value: 1.0666666666666667.
2024-12-06 23:58:11,209 - INFO - Candidate Mean Stats: {'Max': np.float64(2.0), 'Min': np.float64(0.24784007710212524), 'Mean': np.float64(0.4882631880440351), 'Std': np.float64(0.06306276033227175)}
2024-12-06 23:58:11,210 - INFO - Candidate Std Stats: {'Max': np.float64(0.7362779235695462), 'Min': np.float64(0.0), 'Mean': np.float64(0.1090080659873057), 'Std': np.float64(0.04679787711333472)}
[I 2024-12-06 23:58:11,252] Trial 48 finished with value: 1.7999999999999998 and parameters: {'x_0_0': 'oo', 'x_0_1': 'bc', 'x_0_2': 'bd', 'x_1_0': 'cd', 'x_1_1': 'bc', 'x_1_2': 'oo'}. Best is trial 32 with value: 0.9444444444444444.
2024-12-06 23:58:20,656 - INFO - Candidate Mean Stats: {'Max': np.float64(2.0), 'Min': np.float64(0.25161999061440943), 'Mean': np.float64(0.4860013091571079), 'Std': np.float64(0.06831102401736723)}
2024-12-06 23:58:20,657 - INFO - Candidate Std Stats: {'Max': np.float64(1.3491671258174933), 'Min': np.float64(0.0), 'Mean': np.float64(0.1082608663207512), 'Std': np.float64(0.05847257983392039)}
[I 2024-12-06 23:58:20,699] Trial 49 finished with value: 1.4666666666666666 and parameters: {'x_0_0': 'ad', 'x_0_1': 'ab', 'x_0_2': 'bd', 'x_1_0': 'oo', 'x_1_1': 'ad', 'x_1_2': 'ad'}. Best is trial 22 with value: 1.1666666666666665.
2024-12-06 23:58:22,191 - INFO - Candidate Mean Stats: {'Max': np.float64(2.0), 'Min': np.float64(0.2586050094268429), 'Mean': np.float64(0.49261449920798506), 'Std': np.float64(0.06158150572773121)}
2024-12-06 23:58:22,192 - INFO - Candidate Std Stats: {'Max': np.float64(1.149146073040077), 'Min': np.float64(0.0), 'Mean': np.float64(0.11146764232765309), 'Std': np.float64(0.052307597193769755)}
[I 2024-12-06 23:58:22,235] Trial 49 finished with value: 0.7999999999999999 and parameters: {'x_0_0': 'bc', 'x_0_1': 'ac', 'x_0_2': 'ad', 'x_1_0': 'oo', 'x_1_1': 'ab', 'x_1_2': 'bd'}. Best is trial 49 with value: 0.7999999999999999.
2024-12-06 23:58:23,191 - INFO - Candidate Mean Stats: {'Max': np.float64(2.0), 'Min': np.float64(0.26698377163810394), 'Mean': np.float64(0.4903282777404758), 'Std': np.float64(0.0637895439577003)}
2024-12-06 23:58:23,192 - INFO - Candidate Std Stats: {'Max': np.float64(1.0025456982565184), 'Min': np.float64(0.0), 'Mean': np.float64(0.1127330494715866), 'Std': np.float64(0.05578776066523857)}
[I 2024-12-06 23:58:23,232] Trial 49 finished with value: 1.7999999999999998 and parameters: {'x_0_0': 'oo', 'x_0_1': 'cd', 'x_0_2': 'bd', 'x_1_0': 'ad', 'x_1_1': 'bc', 'x_1_2': 'oo'}. Best is trial 47 with value: 1.0666666666666667.
2024-12-06 23:58:30,703 - INFO - Candidate Mean Stats: {'Max': np.float64(2.0), 'Min': np.float64(0.27129124028242535), 'Mean': np.float64(0.4888492672811893), 'Std': np.float64(0.059639731104263585)}
2024-12-06 23:58:30,704 - INFO - Candidate Std Stats: {'Max': np.float64(0.4869583390784027), 'Min': np.float64(0.0), 'Mean': np.float64(0.10628007563327227), 'Std': np.float64(0.0472262446680806)}
[I 2024-12-06 23:58:30,746] Trial 49 finished with value: 1.7999999999999998 and parameters: {'x_0_0': 'oo', 'x_0_1': 'ad', 'x_0_2': 'bd', 'x_1_0': 'bc', 'x_1_1': 'oo', 'x_1_2': 'cd'}. Best is trial 32 with value: 0.9444444444444444.
2024-12-06 23:58:40,768 - INFO - Candidate Mean Stats: {'Max': np.float64(2.0), 'Min': np.float64(0.25225523084730334), 'Mean': np.float64(0.48356531311573575), 'Std': np.float64(0.06806479120513131)}
2024-12-06 23:58:40,769 - INFO - Candidate Std Stats: {'Max': np.float64(1.1735065504189437), 'Min': np.float64(0.0), 'Mean': np.float64(0.11905934861929637), 'Std': np.float64(0.05567031115194262)}
[I 2024-12-06 23:58:40,813] Trial 50 finished with value: 1.6666666666666665 and parameters: {'x_0_0': 'ac', 'x_0_1': 'bd', 'x_0_2': 'ad', 'x_1_0': 'bd', 'x_1_1': 'bd', 'x_1_2': 'ac'}. Best is trial 22 with value: 1.1666666666666665.
2024-12-06 23:58:42,312 - INFO - Candidate Mean Stats: {'Max': np.float64(2.0), 'Min': np.float64(0.2697249513324681), 'Mean': np.float64(0.48611005012283603), 'Std': np.float64(0.05787469920060373)}
2024-12-06 23:58:42,313 - INFO - Candidate Std Stats: {'Max': np.float64(1.7498426608025577), 'Min': np.float64(0.0), 'Mean': np.float64(0.09646695045202393), 'Std': np.float64(0.043031690276029114)}
[I 2024-12-06 23:58:42,356] Trial 50 finished with value: 1.6666666666666665 and parameters: {'x_0_0': 'ac', 'x_0_1': 'cd', 'x_0_2': 'cd', 'x_1_0': 'ab', 'x_1_1': 'bc', 'x_1_2': 'cd'}. Best is trial 49 with value: 0.7999999999999999.
2024-12-06 23:58:43,511 - INFO - Candidate Mean Stats: {'Max': np.float64(2.0), 'Min': np.float64(0.2787312044027132), 'Mean': np.float64(0.48296388026546655), 'Std': np.float64(0.05999668744086176)}
2024-12-06 23:58:43,512 - INFO - Candidate Std Stats: {'Max': np.float64(0.3844515075559293), 'Min': np.float64(0.0), 'Mean': np.float64(0.10526421989341012), 'Std': np.float64(0.041933958710800176)}
[I 2024-12-06 23:58:43,560] Trial 50 finished with value: 1.3666666666666667 and parameters: {'x_0_0': 'ac', 'x_0_1': 'cd', 'x_0_2': 'ad', 'x_1_0': 'oo', 'x_1_1': 'oo', 'x_1_2': 'ad'}. Best is trial 47 with value: 1.0666666666666667.
2024-12-06 23:59:32,699 - INFO - Candidate Mean Stats: {'Max': np.float64(2.0), 'Min': np.float64(0.263819836427552), 'Mean': np.float64(0.4906538817005491), 'Std': np.float64(0.057992239542871436)}
2024-12-06 23:59:32,700 - INFO - Candidate Std Stats: {'Max': np.float64(0.3723760517169654), 'Min': np.float64(0.0), 'Mean': np.float64(0.10335055278371932), 'Std': np.float64(0.04301173568234321)}
[I 2024-12-06 23:59:32,743] Trial 50 finished with value: 1.2444444444444445 and parameters: {'x_0_0': 'bd', 'x_0_1': 'ac', 'x_0_2': 'oo', 'x_1_0': 'bd', 'x_1_1': 'oo', 'x_1_2': 'cd'}. Best is trial 32 with value: 0.9444444444444444.
2024-12-06 23:59:40,515 - INFO - Candidate Mean Stats: {'Max': np.float64(2.0), 'Min': np.float64(0.25496546002027276), 'Mean': np.float64(0.494894018772753), 'Std': np.float64(0.05753663750523145)}
2024-12-06 23:59:40,516 - INFO - Candidate Std Stats: {'Max': np.float64(0.37871130968255956), 'Min': np.float64(0.0), 'Mean': np.float64(0.10249876360717332), 'Std': np.float64(0.04309638921728315)}
[I 2024-12-06 23:59:40,554] Trial 51 finished with value: 1.5555555555555556 and parameters: {'x_0_0': 'bc', 'x_0_1': 'ab', 'x_0_2': 'bd', 'x_1_0': 'bc', 'x_1_1': 'ac', 'x_1_2': 'bc'}. Best is trial 22 with value: 1.1666666666666665.
2024-12-06 23:59:41,739 - INFO - Candidate Mean Stats: {'Max': np.float64(2.0), 'Min': np.float64(0.29686172550529377), 'Mean': np.float64(0.48205616483125996), 'Std': np.float64(0.06315005612698708)}
2024-12-06 23:59:41,740 - INFO - Candidate Std Stats: {'Max': np.float64(1.7450776797733676), 'Min': np.float64(0.0), 'Mean': np.float64(0.1053742414538506), 'Std': np.float64(0.055050416878485886)}
[I 2024-12-06 23:59:41,779] Trial 51 finished with value: 1.2222222222222223 and parameters: {'x_0_0': 'ac', 'x_0_1': 'ac', 'x_0_2': 'ac', 'x_1_0': 'bc', 'x_1_1': 'ab', 'x_1_2': 'bc'}. Best is trial 49 with value: 0.7999999999999999.
2024-12-06 23:59:42,646 - INFO - Candidate Mean Stats: {'Max': np.float64(2.0), 'Min': np.float64(0.246180601732587), 'Mean': np.float64(0.4790860502375553), 'Std': np.float64(0.06824285900094891)}
2024-12-06 23:59:42,647 - INFO - Candidate Std Stats: {'Max': np.float64(1.331836373731947), 'Min': np.float64(0.0), 'Mean': np.float64(0.11519470137658597), 'Std': np.float64(0.05923547870157446)}
[I 2024-12-06 23:59:42,683] Trial 51 finished with value: 2.0 and parameters: {'x_0_0': 'cd', 'x_0_1': 'ac', 'x_0_2': 'bd', 'x_1_0': 'ab', 'x_1_1': 'ad', 'x_1_2': 'ad'}. Best is trial 47 with value: 1.0666666666666667.
2024-12-06 23:59:49,276 - INFO - Candidate Mean Stats: {'Max': np.float64(2.0), 'Min': np.float64(0.162512147211422), 'Mean': np.float64(0.4935044665311756), 'Std': np.float64(0.06321881184542014)}
2024-12-06 23:59:49,292 - INFO - Candidate Std Stats: {'Max': np.float64(0.49618918609170076), 'Min': np.float64(0.0), 'Mean': np.float64(0.10747518468119692), 'Std': np.float64(0.04710678058528767)}
[I 2024-12-06 23:59:49,346] Trial 51 finished with value: 1.7999999999999998 and parameters: {'x_0_0': 'cd', 'x_0_1': 'bc', 'x_0_2': 'cd', 'x_1_0': 'oo', 'x_1_1': 'bc', 'x_1_2': 'ad'}. Best is trial 32 with value: 0.9444444444444444.
2024-12-06 23:59:58,392 - INFO - Candidate Mean Stats: {'Max': np.float64(2.0), 'Min': np.float64(0.13509336088312515), 'Mean': np.float64(0.4738268760150371), 'Std': np.float64(0.06528957746050232)}
2024-12-06 23:59:58,393 - INFO - Candidate Std Stats: {'Max': np.float64(0.5257027605181361), 'Min': np.float64(0.0), 'Mean': np.float64(0.10528559891061183), 'Std': np.float64(0.04479131792859227)}
[I 2024-12-06 23:59:58,435] Trial 52 finished with value: 1.6666666666666665 and parameters: {'x_0_0': 'bd', 'x_0_1': 'bd', 'x_0_2': 'ad', 'x_1_0': 'cd', 'x_1_1': 'bd', 'x_1_2': 'bd'}. Best is trial 22 with value: 1.1666666666666665.
2024-12-06 23:59:59,987 - INFO - Candidate Mean Stats: {'Max': np.float64(2.0), 'Min': np.float64(0.18253337938784375), 'Mean': np.float64(0.4847492111243557), 'Std': np.float64(0.06382861176960793)}
2024-12-06 23:59:59,988 - INFO - Candidate Std Stats: {'Max': np.float64(0.594158195701138), 'Min': np.float64(0.0), 'Mean': np.float64(0.10782567417992259), 'Std': np.float64(0.04500372783404076)}
