[I 2024-12-06 23:37:46,690] Trial 285 finished with value: 1.0714285714285714 and parameters: {'x_0_0': 'bc', 'x_0_1': 'oo', 'x_1_0': 'bc', 'x_1_1': 'ac'}. Best is trial 23 with value: 0.5.
2024-12-06 23:37:46,780 - INFO - Candidate Mean Stats: {'Max': np.float64(2.9909467547679705), 'Min': np.float64(-0.6848082399615354), 'Mean': np.float64(0.6572162409728403), 'Std': np.float64(0.5519487972551714)}
2024-12-06 23:37:46,780 - INFO - Candidate Std Stats: {'Max': np.float64(1.8339340093618808), 'Min': np.float64(0.0), 'Mean': np.float64(0.5476902535970211), 'Std': np.float64(0.31123389865168943)}
2024-12-06 23:37:46,781 - INFO - Candidate Mean Stats: {'Max': np.float64(3.0854828320830445), 'Min': np.float64(-0.5595289857178599), 'Mean': np.float64(0.6696196337231568), 'Std': np.float64(0.5290083886447247)}
2024-12-06 23:37:46,781 - INFO - Candidate Std Stats: {'Max': np.float64(1.4312204752391684), 'Min': np.float64(0.0), 'Mean': np.float64(0.4781130330890285), 'Std': np.float64(0.26978568757421384)}
[I 2024-12-06 23:37:46,794] Trial 287 finished with value: 0.9642857142857143 and parameters: {'x_0_0': 'ab', 'x_0_1': 'oo', 'x_1_0': 'oo', 'x_1_1': 'ab'}. Best is trial 165 with value: 0.5.
[I 2024-12-06 23:37:46,795] Trial 287 finished with value: 1.2142857142857144 and parameters: {'x_0_0': 'ab', 'x_0_1': 'oo', 'x_1_0': 'cd', 'x_1_1': 'ac'}. Best is trial 76 with value: 0.5.
2024-12-06 23:37:46,796 - INFO - Candidate Mean Stats: {'Max': np.float64(2.7463130443974695), 'Min': np.float64(-1.2927154675982353), 'Mean': np.float64(0.5023684174399349), 'Std': np.float64(0.6988388997515226)}
2024-12-06 23:37:46,796 - INFO - Candidate Std Stats: {'Max': np.float64(1.9224425732142145), 'Min': np.float64(0.0), 'Mean': np.float64(0.6229787936348685), 'Std': np.float64(0.3334812154085729)}
[I 2024-12-06 23:37:46,810] Trial 287 finished with value: 1.5714285714285714 and parameters: {'x_0_0': 'bc', 'x_0_1': 'cd', 'x_1_0': 'ab', 'x_1_1': 'bd'}. Best is trial 63 with value: 0.5.
2024-12-06 23:37:47,052 - INFO - Candidate Mean Stats: {'Max': np.float64(3.0299969439314314), 'Min': np.float64(-0.867493776546962), 'Mean': np.float64(0.6305165942868315), 'Std': np.float64(0.5612805569490003)}
2024-12-06 23:37:47,052 - INFO - Candidate Std Stats: {'Max': np.float64(1.5280135012769156), 'Min': np.float64(0.0), 'Mean': np.float64(0.5682833335230667), 'Std': np.float64(0.3079879961964574)}
[I 2024-12-06 23:37:47,067] Trial 286 finished with value: 1.0357142857142856 and parameters: {'x_0_0': 'bc', 'x_0_1': 'ac', 'x_1_0': 'oo', 'x_1_1': 'ad'}. Best is trial 23 with value: 0.5.
2024-12-06 23:37:47,156 - INFO - Candidate Mean Stats: {'Max': np.float64(2.835515756742727), 'Min': np.float64(-1.2145458638285747), 'Mean': np.float64(0.4328716886186886), 'Std': np.float64(0.6750943454590543)}
2024-12-06 23:37:47,156 - INFO - Candidate Std Stats: {'Max': np.float64(2.137952655574648), 'Min': np.float64(0.0), 'Mean': np.float64(0.6869015014128753), 'Std': np.float64(0.3888496676173371)}
2024-12-06 23:37:47,158 - INFO - Candidate Mean Stats: {'Max': np.float64(2.894923643644753), 'Min': np.float64(-0.8450940824899739), 'Mean': np.float64(0.6175275716414221), 'Std': np.float64(0.564126325306102)}
2024-12-06 23:37:47,159 - INFO - Candidate Std Stats: {'Max': np.float64(2.064007000711675), 'Min': np.float64(0.0), 'Mean': np.float64(0.5635508725270644), 'Std': np.float64(0.3113522217622342)}
2024-12-06 23:37:47,171 - INFO - Candidate Mean Stats: {'Max': np.float64(2.827037229662833), 'Min': np.float64(-1.2266710721982996), 'Mean': np.float64(0.5831243163555457), 'Std': np.float64(0.5206952919943838)}
2024-12-06 23:37:47,171 - INFO - Candidate Std Stats: {'Max': np.float64(1.5769023592880262), 'Min': np.float64(0.0), 'Mean': np.float64(0.5481532344824378), 'Std': np.float64(0.300751584844733)}
[I 2024-12-06 23:37:47,171] Trial 288 finished with value: 1.25 and parameters: {'x_0_0': 'oo', 'x_0_1': 'oo', 'x_1_0': 'ac', 'x_1_1': 'oo'}. Best is trial 165 with value: 0.5.
[I 2024-12-06 23:37:47,173] Trial 288 finished with value: 1.5714285714285714 and parameters: {'x_0_0': 'ac', 'x_0_1': 'bc', 'x_1_0': 'ad', 'x_1_1': 'bc'}. Best is trial 76 with value: 0.5.
[I 2024-12-06 23:37:47,184] Trial 288 finished with value: 1.0714285714285714 and parameters: {'x_0_0': 'ac', 'x_0_1': 'oo', 'x_1_0': 'ac', 'x_1_1': 'ac'}. Best is trial 63 with value: 0.5.
2024-12-06 23:37:47,430 - INFO - Candidate Mean Stats: {'Max': np.float64(2.84613612753925), 'Min': np.float64(-0.9380151431762476), 'Mean': np.float64(0.6115801858514591), 'Std': np.float64(0.5570012159012137)}
2024-12-06 23:37:47,430 - INFO - Candidate Std Stats: {'Max': np.float64(1.859824134395342), 'Min': np.float64(0.0), 'Mean': np.float64(0.557957173955215), 'Std': np.float64(0.315685849582499)}
[I 2024-12-06 23:37:47,444] Trial 287 finished with value: 1.1964285714285714 and parameters: {'x_0_0': 'ad', 'x_0_1': 'ad', 'x_1_0': 'oo', 'x_1_1': 'oo'}. Best is trial 23 with value: 0.5.
2024-12-06 23:37:47,531 - INFO - Candidate Mean Stats: {'Max': np.float64(2.871533760116434), 'Min': np.float64(-1.0363086527881724), 'Mean': np.float64(0.6331787002407104), 'Std': np.float64(0.5272464907065684)}
2024-12-06 23:37:47,531 - INFO - Candidate Std Stats: {'Max': np.float64(1.8412955047546158), 'Min': np.float64(0.0), 'Mean': np.float64(0.5699833033631191), 'Std': np.float64(0.32399546633056586)}
2024-12-06 23:37:47,533 - INFO - Candidate Mean Stats: {'Max': np.float64(2.927299696168183), 'Min': np.float64(-0.6188433665785226), 'Mean': np.float64(0.7485717868479594), 'Std': np.float64(0.5012266613477077)}
2024-12-06 23:37:47,533 - INFO - Candidate Std Stats: {'Max': np.float64(1.5262588400626784), 'Min': np.float64(0.0), 'Mean': np.float64(0.4786204954221586), 'Std': np.float64(0.2742490946692623)}
2024-12-06 23:37:47,545 - INFO - Candidate Mean Stats: {'Max': np.float64(2.8344109036970324), 'Min': np.float64(-0.810872052115287), 'Mean': np.float64(0.5953931955473102), 'Std': np.float64(0.49363470988251157)}
2024-12-06 23:37:47,545 - INFO - Candidate Std Stats: {'Max': np.float64(1.5252235759992454), 'Min': np.float64(0.0), 'Mean': np.float64(0.5225895088359318), 'Std': np.float64(0.2886928710238759)}
[I 2024-12-06 23:37:47,545] Trial 289 finished with value: 1.2142857142857144 and parameters: {'x_0_0': 'ab', 'x_0_1': 'oo', 'x_1_0': 'ad', 'x_1_1': 'bd'}. Best is trial 165 with value: 0.5.
[I 2024-12-06 23:37:47,547] Trial 289 finished with value: 1.0892857142857144 and parameters: {'x_0_0': 'ab', 'x_0_1': 'oo', 'x_1_0': 'bd', 'x_1_1': 'oo'}. Best is trial 76 with value: 0.5.
[I 2024-12-06 23:37:47,559] Trial 289 finished with value: 1.375 and parameters: {'x_0_0': 'oo', 'x_0_1': 'oo', 'x_1_0': 'cd', 'x_1_1': 'ac'}. Best is trial 63 with value: 0.5.
2024-12-06 23:37:47,808 - INFO - Candidate Mean Stats: {'Max': np.float64(3.7043248400935083), 'Min': np.float64(-0.679366516831239), 'Mean': np.float64(0.7113879043885826), 'Std': np.float64(0.4962774334719676)}
2024-12-06 23:37:47,809 - INFO - Candidate Std Stats: {'Max': np.float64(1.370817936941577), 'Min': np.float64(0.0), 'Mean': np.float64(0.4787115439616516), 'Std': np.float64(0.2717581656757283)}
[I 2024-12-06 23:37:47,823] Trial 288 finished with value: 1.5714285714285714 and parameters: {'x_0_0': 'ad', 'x_0_1': 'ad', 'x_1_0': 'cd', 'x_1_1': 'ab'}. Best is trial 23 with value: 0.5.
2024-12-06 23:37:47,905 - INFO - Candidate Mean Stats: {'Max': np.float64(3.608966349640171), 'Min': np.float64(-1.2016890862035996), 'Mean': np.float64(0.5985987248532895), 'Std': np.float64(0.6063542142766839)}
2024-12-06 23:37:47,905 - INFO - Candidate Std Stats: {'Max': np.float64(1.769630853734334), 'Min': np.float64(0.0), 'Mean': np.float64(0.5722196231722565), 'Std': np.float64(0.33702537443698366)}
2024-12-06 23:37:47,911 - INFO - Candidate Mean Stats: {'Max': np.float64(3.574237188383397), 'Min': np.float64(-0.7674206745039573), 'Mean': np.float64(0.6153237299303385), 'Std': np.float64(0.5520944019550695)}
2024-12-06 23:37:47,911 - INFO - Candidate Std Stats: {'Max': np.float64(1.5510637584284765), 'Min': np.float64(0.0), 'Mean': np.float64(0.5332239435817524), 'Std': np.float64(0.30691034232769815)}
[I 2024-12-06 23:37:47,920] Trial 290 finished with value: 1.4285714285714286 and parameters: {'x_0_0': 'bc', 'x_0_1': 'ab', 'x_1_0': 'ab', 'x_1_1': 'ad'}. Best is trial 165 with value: 0.5.
2024-12-06 23:37:47,920 - INFO - Candidate Mean Stats: {'Max': np.float64(2.6294150509871073), 'Min': np.float64(-0.9542390531713878), 'Mean': np.float64(0.574360624918269), 'Std': np.float64(0.5290152949100841)}
2024-12-06 23:37:47,920 - INFO - Candidate Std Stats: {'Max': np.float64(1.8782578856222643), 'Min': np.float64(0.0), 'Mean': np.float64(0.5394892810948188), 'Std': np.float64(0.3177288514660612)}
[I 2024-12-06 23:37:47,926] Trial 290 finished with value: 1.2857142857142856 and parameters: {'x_0_0': 'ad', 'x_0_1': 'ab', 'x_1_0': 'bd', 'x_1_1': 'ac'}. Best is trial 76 with value: 0.5.
[I 2024-12-06 23:37:47,935] Trial 290 finished with value: 1.375 and parameters: {'x_0_0': 'oo', 'x_0_1': 'oo', 'x_1_0': 'ad', 'x_1_1': 'bc'}. Best is trial 63 with value: 0.5.
2024-12-06 23:37:48,188 - INFO - Candidate Mean Stats: {'Max': np.float64(3.438087101562748), 'Min': np.float64(-0.7473062963144832), 'Mean': np.float64(0.6410055109446414), 'Std': np.float64(0.5531300500799994)}
2024-12-06 23:37:48,188 - INFO - Candidate Std Stats: {'Max': np.float64(1.531166887747322), 'Min': np.float64(0.0), 'Mean': np.float64(0.5401481108480103), 'Std': np.float64(0.30216911263950963)}
[I 2024-12-06 23:37:48,204] Trial 289 finished with value: 1.5 and parameters: {'x_0_0': 'cd', 'x_0_1': 'oo', 'x_1_0': 'cd', 'x_1_1': 'ac'}. Best is trial 23 with value: 0.5.
2024-12-06 23:37:48,281 - INFO - Candidate Mean Stats: {'Max': np.float64(3.080490282843112), 'Min': np.float64(-1.0989391990954398), 'Mean': np.float64(0.5904784868122921), 'Std': np.float64(0.5818627240112111)}
2024-12-06 23:37:48,281 - INFO - Candidate Std Stats: {'Max': np.float64(1.6026358548492163), 'Min': np.float64(0.0), 'Mean': np.float64(0.5949259044789375), 'Std': np.float64(0.3226708137292417)}
2024-12-06 23:37:48,289 - INFO - Candidate Mean Stats: {'Max': np.float64(3.060295988971222), 'Min': np.float64(-0.9879450379135635), 'Mean': np.float64(0.656599592778203), 'Std': np.float64(0.5321830015744415)}
2024-12-06 23:37:48,289 - INFO - Candidate Std Stats: {'Max': np.float64(1.7377281731952317), 'Min': np.float64(0.0), 'Mean': np.float64(0.5383814338547929), 'Std': np.float64(0.2973039105465224)}
[I 2024-12-06 23:37:48,296] Trial 291 finished with value: 1.5714285714285714 and parameters: {'x_0_0': 'bc', 'x_0_1': 'cd', 'x_1_0': 'ab', 'x_1_1': 'bc'}. Best is trial 165 with value: 0.5.
2024-12-06 23:37:48,297 - INFO - Candidate Mean Stats: {'Max': np.float64(2.8944460499197397), 'Min': np.float64(-0.9648046042071042), 'Mean': np.float64(0.6007821988522437), 'Std': np.float64(0.49392664789571755)}
2024-12-06 23:37:48,297 - INFO - Candidate Std Stats: {'Max': np.float64(1.7639614780666426), 'Min': np.float64(0.0), 'Mean': np.float64(0.5533731883845378), 'Std': np.float64(0.3230319787168326)}
[I 2024-12-06 23:37:48,304] Trial 291 finished with value: 0.9642857142857143 and parameters: {'x_0_0': 'ab', 'x_0_1': 'oo', 'x_1_0': 'oo', 'x_1_1': 'bd'}. Best is trial 76 with value: 0.5.
[I 2024-12-06 23:37:48,311] Trial 291 finished with value: 0.9285714285714286 and parameters: {'x_0_0': 'bd', 'x_0_1': 'oo', 'x_1_0': 'ab', 'x_1_1': 'ad'}. Best is trial 63 with value: 0.5.
2024-12-06 23:37:48,569 - INFO - Candidate Mean Stats: {'Max': np.float64(3.1988111575160234), 'Min': np.float64(-0.7535610162947252), 'Mean': np.float64(0.6700381316799013), 'Std': np.float64(0.5069572458656185)}
2024-12-06 23:37:48,569 - INFO - Candidate Std Stats: {'Max': np.float64(1.5121145021401214), 'Min': np.float64(0.0), 'Mean': np.float64(0.5384038309842857), 'Std': np.float64(0.308853164945611)}
[I 2024-12-06 23:37:48,583] Trial 290 finished with value: 1.1607142857142856 and parameters: {'x_0_0': 'bd', 'x_0_1': 'bc', 'x_1_0': 'bd', 'x_1_1': 'oo'}. Best is trial 23 with value: 0.5.
2024-12-06 23:37:48,659 - INFO - Candidate Mean Stats: {'Max': np.float64(2.8426386375391353), 'Min': np.float64(-1.020731202834742), 'Mean': np.float64(0.6399423452936841), 'Std': np.float64(0.6069553719265286)}
2024-12-06 23:37:48,660 - INFO - Candidate Std Stats: {'Max': np.float64(1.7769530365083301), 'Min': np.float64(0.0), 'Mean': np.float64(0.5931080513767651), 'Std': np.float64(0.32061893271670694)}
2024-12-06 23:37:48,666 - INFO - Candidate Mean Stats: {'Max': np.float64(2.788345115083802), 'Min': np.float64(-0.7779696974905226), 'Mean': np.float64(0.6392202876838067), 'Std': np.float64(0.5102775177302479)}
2024-12-06 23:37:48,666 - INFO - Candidate Std Stats: {'Max': np.float64(1.7230806564334165), 'Min': np.float64(0.0), 'Mean': np.float64(0.5219831582812208), 'Std': np.float64(0.30263359499857134)}
[I 2024-12-06 23:37:48,674] Trial 292 finished with value: 1.0892857142857144 and parameters: {'x_0_0': 'ab', 'x_0_1': 'oo', 'x_1_0': 'bd', 'x_1_1': 'oo'}. Best is trial 165 with value: 0.5.
2024-12-06 23:37:48,679 - INFO - Candidate Mean Stats: {'Max': np.float64(3.0124283637653764), 'Min': np.float64(-0.8728144441904219), 'Mean': np.float64(0.6724971461083091), 'Std': np.float64(0.4992016149685487)}
2024-12-06 23:37:48,679 - INFO - Candidate Std Stats: {'Max': np.float64(1.7007723527657224), 'Min': np.float64(0.0), 'Mean': np.float64(0.5471507773989912), 'Std': np.float64(0.3136051000214393)}
[I 2024-12-06 23:37:48,679] Trial 292 finished with value: 1.0714285714285714 and parameters: {'x_0_0': 'bc', 'x_0_1': 'oo', 'x_1_0': 'cd', 'x_1_1': 'ab'}. Best is trial 76 with value: 0.5.
[I 2024-12-06 23:37:48,693] Trial 292 finished with value: 1.0714285714285714 and parameters: {'x_0_0': 'ac', 'x_0_1': 'oo', 'x_1_0': 'ac', 'x_1_1': 'ad'}. Best is trial 63 with value: 0.5.
2024-12-06 23:37:48,945 - INFO - Candidate Mean Stats: {'Max': np.float64(3.5683014306946026), 'Min': np.float64(-0.8660316033804243), 'Mean': np.float64(0.6478710790778103), 'Std': np.float64(0.5910580133858159)}
2024-12-06 23:37:48,945 - INFO - Candidate Std Stats: {'Max': np.float64(1.652166812916616), 'Min': np.float64(0.0), 'Mean': np.float64(0.5530116678574765), 'Std': np.float64(0.3141755341776251)}
[I 2024-12-06 23:37:48,959] Trial 291 finished with value: 1.1964285714285714 and parameters: {'x_0_0': 'bd', 'x_0_1': 'cd', 'x_1_0': 'oo', 'x_1_1': 'oo'}. Best is trial 23 with value: 0.5.
2024-12-06 23:37:49,038 - INFO - Candidate Mean Stats: {'Max': np.float64(3.1096616747689114), 'Min': np.float64(-0.8097068972327653), 'Mean': np.float64(0.6498019379678182), 'Std': np.float64(0.5322899812945372)}
2024-12-06 23:37:49,038 - INFO - Candidate Std Stats: {'Max': np.float64(1.6186327752609853), 'Min': np.float64(0.0), 'Mean': np.float64(0.5364813757691427), 'Std': np.float64(0.3152239020234078)}
2024-12-06 23:37:49,041 - INFO - Candidate Mean Stats: {'Max': np.float64(2.8980640460076725), 'Min': np.float64(-0.5905522601095653), 'Mean': np.float64(0.7223946583154087), 'Std': np.float64(0.5015253439619021)}
2024-12-06 23:37:49,041 - INFO - Candidate Std Stats: {'Max': np.float64(1.5196869109559994), 'Min': np.float64(0.0), 'Mean': np.float64(0.5076400302851333), 'Std': np.float64(0.300983300178634)}
[I 2024-12-06 23:37:49,053] Trial 293 finished with value: 1.375 and parameters: {'x_0_0': 'cd', 'x_0_1': 'oo', 'x_1_0': 'ad', 'x_1_1': 'oo'}. Best is trial 165 with value: 0.5.
2024-12-06 23:37:49,055 - INFO - Candidate Mean Stats: {'Max': np.float64(2.9241062745969937), 'Min': np.float64(-1.015153964846654), 'Mean': np.float64(0.617614806743936), 'Std': np.float64(0.4950457921094922)}
2024-12-06 23:37:49,055 - INFO - Candidate Std Stats: {'Max': np.float64(1.6146438573813915), 'Min': np.float64(0.0), 'Mean': np.float64(0.5266526478001381), 'Std': np.float64(0.3030404227412931)}
[I 2024-12-06 23:37:49,056] Trial 293 finished with value: 1.0714285714285714 and parameters: {'x_0_0': 'bc', 'x_0_1': 'oo', 'x_1_0': 'ab', 'x_1_1': 'ad'}. Best is trial 76 with value: 0.5.
[I 2024-12-06 23:37:49,069] Trial 293 finished with value: 1.0892857142857144 and parameters: {'x_0_0': 'ab', 'x_0_1': 'oo', 'x_1_0': 'ab', 'x_1_1': 'oo'}. Best is trial 63 with value: 0.5.
2024-12-06 23:37:49,326 - INFO - Candidate Mean Stats: {'Max': np.float64(3.0635254775756513), 'Min': np.float64(-0.8588303007043887), 'Mean': np.float64(0.6363701257876637), 'Std': np.float64(0.5378650560043668)}
2024-12-06 23:37:49,326 - INFO - Candidate Std Stats: {'Max': np.float64(2.1762690896299723), 'Min': np.float64(0.0), 'Mean': np.float64(0.5553339291880071), 'Std': np.float64(0.3165676612145775)}
[I 2024-12-06 23:37:49,340] Trial 292 finished with value: 1.3214285714285714 and parameters: {'x_0_0': 'bd', 'x_0_1': 'ac', 'x_1_0': 'oo', 'x_1_1': 'ad'}. Best is trial 23 with value: 0.5.
2024-12-06 23:37:49,418 - INFO - Candidate Mean Stats: {'Max': np.float64(3.0523060562193804), 'Min': np.float64(-1.1637086514114918), 'Mean': np.float64(0.608021479072859), 'Std': np.float64(0.6122474578300209)}
2024-12-06 23:37:49,418 - INFO - Candidate Std Stats: {'Max': np.float64(1.8960164083898399), 'Min': np.float64(0.0), 'Mean': np.float64(0.6049306157677702), 'Std': np.float64(0.3460185423636352)}
2024-12-06 23:37:49,419 - INFO - Candidate Mean Stats: {'Max': np.float64(3.181649163452757), 'Min': np.float64(-0.9013304667366914), 'Mean': np.float64(0.6175292716000805), 'Std': np.float64(0.5504019475773079)}
2024-12-06 23:37:49,419 - INFO - Candidate Std Stats: {'Max': np.float64(1.6156302792506636), 'Min': np.float64(0.0), 'Mean': np.float64(0.5340828168452932), 'Std': np.float64(0.3090288575281858)}
[I 2024-12-06 23:37:49,432] Trial 294 finished with value: 1.5714285714285714 and parameters: {'x_0_0': 'bd', 'x_0_1': 'cd', 'x_1_0': 'cd', 'x_1_1': 'bd'}. Best is trial 165 with value: 0.5.
2024-12-06 23:37:49,432 - INFO - Candidate Mean Stats: {'Max': np.float64(2.9609732062921683), 'Min': np.float64(-0.7750531273434619), 'Mean': np.float64(0.6627909559873015), 'Std': np.float64(0.489859925070982)}
2024-12-06 23:37:49,432 - INFO - Candidate Std Stats: {'Max': np.float64(2.2406135772363553), 'Min': np.float64(0.0), 'Mean': np.float64(0.5269227356566792), 'Std': np.float64(0.3230623676576819)}
[I 2024-12-06 23:37:49,433] Trial 294 finished with value: 1.0714285714285714 and parameters: {'x_0_0': 'bc', 'x_0_1': 'oo', 'x_1_0': 'ac', 'x_1_1': 'ac'}. Best is trial 76 with value: 0.5.
[I 2024-12-06 23:37:49,447] Trial 294 finished with value: 2.0 and parameters: {'x_0_0': 'cd', 'x_0_1': 'bd', 'x_1_0': 'bd', 'x_1_1': 'cd'}. Best is trial 63 with value: 0.5.
2024-12-06 23:37:49,705 - INFO - Candidate Mean Stats: {'Max': np.float64(3.1208475994365434), 'Min': np.float64(-0.8120265352015401), 'Mean': np.float64(0.6196273766637963), 'Std': np.float64(0.5781254086855159)}
2024-12-06 23:37:49,705 - INFO - Candidate Std Stats: {'Max': np.float64(1.7169915249429963), 'Min': np.float64(0.0), 'Mean': np.float64(0.5176091234981507), 'Std': np.float64(0.30254705317443714)}
[I 2024-12-06 23:37:49,719] Trial 293 finished with value: 1.5714285714285714 and parameters: {'x_0_0': 'ac', 'x_0_1': 'cd', 'x_1_0': 'ad', 'x_1_1': 'bc'}. Best is trial 23 with value: 0.5.
2024-12-06 23:37:49,795 - INFO - Candidate Mean Stats: {'Max': np.float64(2.9818394047593086), 'Min': np.float64(-0.5534592827149747), 'Mean': np.float64(0.6635648143216398), 'Std': np.float64(0.5585906600638434)}
2024-12-06 23:37:49,795 - INFO - Candidate Std Stats: {'Max': np.float64(1.3571587500876108), 'Min': np.float64(0.0), 'Mean': np.float64(0.5048061786124021), 'Std': np.float64(0.2694158947187803)}
2024-12-06 23:37:49,797 - INFO - Candidate Mean Stats: {'Max': np.float64(3.415629823420608), 'Min': np.float64(-0.909933068193866), 'Mean': np.float64(0.7347077395614932), 'Std': np.float64(0.5037582445984575)}
2024-12-06 23:37:49,797 - INFO - Candidate Std Stats: {'Max': np.float64(1.721099579836077), 'Min': np.float64(0.0), 'Mean': np.float64(0.539029186495465), 'Std': np.float64(0.30451073423148584)}
[I 2024-12-06 23:37:49,810] Trial 295 finished with value: 1.2142857142857144 and parameters: {'x_0_0': 'ab', 'x_0_1': 'oo', 'x_1_0': 'ab', 'x_1_1': 'ac'}. Best is trial 165 with value: 0.5.
2024-12-06 23:37:49,810 - INFO - Candidate Mean Stats: {'Max': np.float64(3.044387953204786), 'Min': np.float64(-0.6003156757789383), 'Mean': np.float64(0.6863776667807678), 'Std': np.float64(0.47820366951808624)}
2024-12-06 23:37:49,810 - INFO - Candidate Std Stats: {'Max': np.float64(1.6375862211969014), 'Min': np.float64(0.0), 'Mean': np.float64(0.5192626347798921), 'Std': np.float64(0.3011912310080905)}
[I 2024-12-06 23:37:49,811] Trial 295 finished with value: 1.0714285714285714 and parameters: {'x_0_0': 'ac', 'x_0_1': 'oo', 'x_1_0': 'bd', 'x_1_1': 'ad'}. Best is trial 76 with value: 0.5.
[I 2024-12-06 23:37:49,823] Trial 295 finished with value: 0.9642857142857143 and parameters: {'x_0_0': 'ab', 'x_0_1': 'oo', 'x_1_0': 'oo', 'x_1_1': 'bd'}. Best is trial 63 with value: 0.5.
2024-12-06 23:37:50,084 - INFO - Candidate Mean Stats: {'Max': np.float64(3.1688583703510305), 'Min': np.float64(-0.5036246514908158), 'Mean': np.float64(0.6763966778124182), 'Std': np.float64(0.5257220012356248)}
2024-12-06 23:37:50,084 - INFO - Candidate Std Stats: {'Max': np.float64(1.5769387549166984), 'Min': np.float64(0.0), 'Mean': np.float64(0.4924710892645815), 'Std': np.float64(0.27793980865008766)}
