[I 2024-12-28 15:01:45,153] Trial 111 finished with value: 2.0 and parameters: {'x_0_0': 'cd', 'x_0_1': 'ad', 'x_1_0': 'ab', 'x_1_1': 'ac'}. Best is trial 15 with value: 0.6964285714285714.
[I 2024-12-28 15:01:47,303] Trial 94 finished with value: 1.875 and parameters: {'x_0_0': 'oo', 'x_0_1': 'ab', 'x_1_0': 'ab', 'x_1_1': 'ad'}. Best is trial 47 with value: 0.6964285714285714.
[I 2024-12-28 15:01:48,686] Trial 105 finished with value: 1.25 and parameters: {'x_0_0': 'cd', 'x_0_1': 'oo', 'x_1_0': 'oo', 'x_1_1': 'bc'}. Best is trial 93 with value: 0.8214285714285714.
[I 2024-12-28 15:01:48,960] Trial 99 finished with value: 1.0357142857142856 and parameters: {'x_0_0': 'bc', 'x_0_1': 'ad', 'x_1_0': 'oo', 'x_1_1': 'ad'}. Best is trial 7 with value: 0.5.
[I 2024-12-28 15:01:50,396] Trial 109 finished with value: 1.3214285714285714 and parameters: {'x_0_0': 'bd', 'x_0_1': 'ab', 'x_1_0': 'oo', 'x_1_1': 'ab'}. Best is trial 17 with value: 0.7857142857142857.
[I 2024-12-28 15:01:50,512] Trial 106 finished with value: 1.2142857142857144 and parameters: {'x_0_0': 'ab', 'x_0_1': 'oo', 'x_1_0': 'ad', 'x_1_1': 'ac'}. Best is trial 21 with value: 0.7857142857142857.
[I 2024-12-28 15:01:51,652] Trial 109 finished with value: 1.375 and parameters: {'x_0_0': 'oo', 'x_0_1': 'oo', 'x_1_0': 'bd', 'x_1_1': 'ac'}. Best is trial 73 with value: 0.7857142857142857.
[I 2024-12-28 15:01:53,046] Trial 95 finished with value: 1.4285714285714286 and parameters: {'x_0_0': 'bc', 'x_0_1': 'ab', 'x_1_0': 'ab', 'x_1_1': 'ab'}. Best is trial 47 with value: 0.6964285714285714.
[I 2024-12-28 15:01:53,453] Trial 110 finished with value: 1.2857142857142856 and parameters: {'x_0_0': 'bd', 'x_0_1': 'bc', 'x_1_0': 'bc', 'x_1_1': 'bc'}. Best is trial 17 with value: 0.7857142857142857.
[I 2024-12-28 15:01:54,215] Trial 110 finished with value: 1.0714285714285714 and parameters: {'x_0_0': 'bc', 'x_0_1': 'oo', 'x_1_0': 'bc', 'x_1_1': 'bc'}. Best is trial 50 with value: 0.8214285714285714.
[I 2024-12-28 15:01:55,241] Trial 109 finished with value: 1.5892857142857144 and parameters: {'x_0_0': 'ab', 'x_0_1': 'ac', 'x_1_0': 'bc', 'x_1_1': 'oo'}. Best is trial 17 with value: 0.5.
[I 2024-12-28 15:01:56,506] Trial 112 finished with value: 1.5 and parameters: {'x_0_0': 'cd', 'x_0_1': 'oo', 'x_1_0': 'ab', 'x_1_1': 'ad'}. Best is trial 15 with value: 0.6964285714285714.
[I 2024-12-28 15:01:57,315] Trial 107 finished with value: 1.375 and parameters: {'x_0_0': 'oo', 'x_0_1': 'oo', 'x_1_0': 'ab', 'x_1_1': 'ac'}. Best is trial 21 with value: 0.7857142857142857.
[I 2024-12-28 15:01:57,408] Trial 100 finished with value: 1.7142857142857144 and parameters: {'x_0_0': 'ab', 'x_0_1': 'bc', 'x_1_0': 'ad', 'x_1_1': 'ac'}. Best is trial 7 with value: 0.5.
[I 2024-12-28 15:01:58,564] Trial 101 finished with value: 1.5 and parameters: {'x_0_0': 'cd', 'x_0_1': 'oo', 'x_1_0': 'bd', 'x_1_1': 'ab'}. Best is trial 43 with value: 0.6964285714285714.
[I 2024-12-28 15:01:59,226] Trial 96 finished with value: 2.0 and parameters: {'x_0_0': 'cd', 'x_0_1': 'ab', 'x_1_0': 'bd', 'x_1_1': 'ad'}. Best is trial 47 with value: 0.6964285714285714.
[I 2024-12-28 15:02:01,659] Trial 111 finished with value: 0.8214285714285714 and parameters: {'x_0_0': 'bc', 'x_0_1': 'oo', 'x_1_0': 'oo', 'x_1_1': 'ab'}. Best is trial 17 with value: 0.7857142857142857.
[I 2024-12-28 15:02:01,671] Trial 110 finished with value: 1.2857142857142856 and parameters: {'x_0_0': 'bd', 'x_0_1': 'ab', 'x_1_0': 'bc', 'x_1_1': 'bc'}. Best is trial 17 with value: 0.5.
[I 2024-12-28 15:02:02,458] Trial 101 finished with value: 1.4285714285714286 and parameters: {'x_0_0': 'ac', 'x_0_1': 'ab', 'x_1_0': 'ab', 'x_1_1': 'bd'}. Best is trial 7 with value: 0.5.
[I 2024-12-28 15:02:02,546] Trial 106 finished with value: 2.0 and parameters: {'x_0_0': 'cd', 'x_0_1': 'ab', 'x_1_0': 'ab', 'x_1_1': 'ac'}. Best is trial 93 with value: 0.8214285714285714.
[I 2024-12-28 15:02:02,598] Trial 108 finished with value: 1.375 and parameters: {'x_0_0': 'oo', 'x_0_1': 'oo', 'x_1_0': 'bc', 'x_1_1': 'ad'}. Best is trial 21 with value: 0.7857142857142857.
[I 2024-12-28 15:02:03,814] Trial 111 finished with value: 0.8214285714285714 and parameters: {'x_0_0': 'ad', 'x_0_1': 'oo', 'x_1_0': 'oo', 'x_1_1': 'bc'}. Best is trial 50 with value: 0.8214285714285714.
[I 2024-12-28 15:02:03,914] Trial 110 finished with value: 1.2142857142857144 and parameters: {'x_0_0': 'ab', 'x_0_1': 'oo', 'x_1_0': 'ad', 'x_1_1': 'bc'}. Best is trial 73 with value: 0.7857142857142857.
[I 2024-12-28 15:02:04,568] Trial 97 finished with value: 1.5714285714285714 and parameters: {'x_0_0': 'ac', 'x_0_1': 'bd', 'x_1_0': 'ac', 'x_1_1': 'bd'}. Best is trial 47 with value: 0.6964285714285714.
[I 2024-12-28 15:02:05,371] Trial 102 finished with value: 1.5 and parameters: {'x_0_0': 'cd', 'x_0_1': 'oo', 'x_1_0': 'bd', 'x_1_1': 'cd'}. Best is trial 43 with value: 0.6964285714285714.
[I 2024-12-28 15:02:09,197] Trial 109 finished with value: 0.9285714285714286 and parameters: {'x_0_0': 'bd', 'x_0_1': 'oo', 'x_1_0': 'ab', 'x_1_1': 'ad'}. Best is trial 21 with value: 0.7857142857142857.
[I 2024-12-28 15:02:10,198] Trial 111 finished with value: 1.2857142857142856 and parameters: {'x_0_0': 'ad', 'x_0_1': 'ad', 'x_1_0': 'bd', 'x_1_1': 'bc'}. Best is trial 17 with value: 0.5.
[I 2024-12-28 15:02:10,233] Trial 113 finished with value: 1.0714285714285714 and parameters: {'x_0_0': 'ad', 'x_0_1': 'oo', 'x_1_0': 'cd', 'x_1_1': 'bd'}. Best is trial 15 with value: 0.6964285714285714.
[I 2024-12-28 15:02:10,475] Trial 102 finished with value: 1.4285714285714286 and parameters: {'x_0_0': 'ac', 'x_0_1': 'ab', 'x_1_0': 'ad', 'x_1_1': 'ad'}. Best is trial 7 with value: 0.5.
[I 2024-12-28 15:02:11,030] Trial 111 finished with value: 1.2142857142857144 and parameters: {'x_0_0': 'ab', 'x_0_1': 'oo', 'x_1_0': 'ad', 'x_1_1': 'cd'}. Best is trial 73 with value: 0.7857142857142857.
[I 2024-12-28 15:02:11,850] Trial 98 finished with value: 1.7142857142857144 and parameters: {'x_0_0': 'ab', 'x_0_1': 'ab', 'x_1_0': 'ab', 'x_1_1': 'ab'}. Best is trial 47 with value: 0.6964285714285714.
[I 2024-12-28 15:02:13,172] Trial 107 finished with value: 0.6607142857142857 and parameters: {'x_0_0': 'bd', 'x_0_1': 'oo', 'x_1_0': 'bc', 'x_1_1': 'oo'}. Best is trial 107 with value: 0.6607142857142857.
[I 2024-12-28 15:02:14,375] Trial 112 finished with value: 1.5 and parameters: {'x_0_0': 'cd', 'x_0_1': 'oo', 'x_1_0': 'ab', 'x_1_1': 'bd'}. Best is trial 50 with value: 0.8214285714285714.
[I 2024-12-28 15:02:16,100] Trial 99 finished with value: 1.1428571428571428 and parameters: {'x_0_0': 'bd', 'x_0_1': 'ab', 'x_1_0': 'bc', 'x_1_1': 'ab'}. Best is trial 47 with value: 0.6964285714285714.
[I 2024-12-28 15:02:16,711] Trial 112 finished with value: 1.5714285714285714 and parameters: {'x_0_0': 'bd', 'x_0_1': 'ac', 'x_1_0': 'ac', 'x_1_1': 'bd'}. Best is trial 17 with value: 0.5.
[I 2024-12-28 15:02:17,147] Trial 112 finished with value: 1.0714285714285714 and parameters: {'x_0_0': 'bc', 'x_0_1': 'oo', 'x_1_0': 'bd', 'x_1_1': 'ac'}. Best is trial 17 with value: 0.7857142857142857.
[I 2024-12-28 15:02:17,546] Trial 103 finished with value: 1.4285714285714286 and parameters: {'x_0_0': 'ac', 'x_0_1': 'ab', 'x_1_0': 'bc', 'x_1_1': 'ad'}. Best is trial 7 with value: 0.5.
[I 2024-12-28 15:02:17,827] Trial 110 finished with value: 0.6964285714285714 and parameters: {'x_0_0': 'ac', 'x_0_1': 'oo', 'x_1_0': 'oo', 'x_1_1': 'oo'}. Best is trial 110 with value: 0.6964285714285714.
[I 2024-12-28 15:02:17,951] Trial 103 finished with value: 1.25 and parameters: {'x_0_0': 'oo', 'x_0_1': 'oo', 'x_1_0': 'bc', 'x_1_1': 'oo'}. Best is trial 43 with value: 0.6964285714285714.
[I 2024-12-28 15:02:18,529] Trial 114 finished with value: 1.0714285714285714 and parameters: {'x_0_0': 'bc', 'x_0_1': 'oo', 'x_1_0': 'ab', 'x_1_1': 'ac'}. Best is trial 15 with value: 0.6964285714285714.
[I 2024-12-28 15:02:18,766] Trial 112 finished with value: 1.3214285714285714 and parameters: {'x_0_0': 'bd', 'x_0_1': 'ad', 'x_1_0': 'oo', 'x_1_1': 'bc'}. Best is trial 73 with value: 0.7857142857142857.
[I 2024-12-28 15:02:20,385] Trial 100 finished with value: 1.3214285714285714 and parameters: {'x_0_0': 'bd', 'x_0_1': 'cd', 'x_1_0': 'oo', 'x_1_1': 'ad'}. Best is trial 47 with value: 0.6964285714285714.
[I 2024-12-28 15:02:22,777] Trial 108 finished with value: 1.625 and parameters: {'x_0_0': 'cd', 'x_0_1': 'ad', 'x_1_0': 'oo', 'x_1_1': 'oo'}. Best is trial 107 with value: 0.6607142857142857.
[I 2024-12-28 15:02:23,066] Trial 113 finished with value: 1.2857142857142856 and parameters: {'x_0_0': 'bc', 'x_0_1': 'ac', 'x_1_0': 'bd', 'x_1_1': 'ac'}. Best is trial 17 with value: 0.7857142857142857.
[I 2024-12-28 15:02:23,339] Trial 113 finished with value: 1.75 and parameters: {'x_0_0': 'cd', 'x_0_1': 'ac', 'x_1_0': 'oo', 'x_1_1': 'ac'}. Best is trial 50 with value: 0.8214285714285714.
