[I 2024-12-06 23:38:35,287] Trial 413 finished with value: 1.1607142857142856 and parameters: {'x_0_0': 'bc', 'x_0_1': 'ad', 'x_1_0': 'ab', 'x_1_1': 'oo'}. Best is trial 165 with value: 0.5.
2024-12-06 23:38:35,319 - INFO - Candidate Mean Stats: {'Max': np.float64(3.1203981224753266), 'Min': np.float64(-0.37807248277064137), 'Mean': np.float64(0.7949659110989123), 'Std': np.float64(0.48853063451923334)}
2024-12-06 23:38:35,319 - INFO - Candidate Std Stats: {'Max': np.float64(1.8712407291984452), 'Min': np.float64(0.0), 'Mean': np.float64(0.4354560971463017), 'Std': np.float64(0.29209591049017436)}
[I 2024-12-06 23:38:35,333] Trial 413 finished with value: 1.1964285714285714 and parameters: {'x_0_0': 'ad', 'x_0_1': 'bc', 'x_1_0': 'oo', 'x_1_1': 'oo'}. Best is trial 63 with value: 0.5.
2024-12-06 23:38:35,379 - INFO - Candidate Mean Stats: {'Max': np.float64(2.961913571036022), 'Min': np.float64(-0.3814075144114079), 'Mean': np.float64(0.7736289487439991), 'Std': np.float64(0.457787435475625)}
2024-12-06 23:38:35,379 - INFO - Candidate Std Stats: {'Max': np.float64(1.4269710263364845), 'Min': np.float64(0.0), 'Mean': np.float64(0.460672319656375), 'Std': np.float64(0.2945131813158142)}
[I 2024-12-06 23:38:35,393] Trial 411 finished with value: 1.0 and parameters: {'x_0_0': 'bd', 'x_0_1': 'ac', 'x_1_0': 'bc', 'x_1_1': 'ad'}. Best is trial 23 with value: 0.5.
2024-12-06 23:38:35,585 - INFO - Candidate Mean Stats: {'Max': np.float64(2.8975204230220024), 'Min': np.float64(-0.8486998468329647), 'Mean': np.float64(0.7774249071909908), 'Std': np.float64(0.5426640130932158)}
2024-12-06 23:38:35,585 - INFO - Candidate Std Stats: {'Max': np.float64(1.6046375513504263), 'Min': np.float64(0.0), 'Mean': np.float64(0.5170193681297621), 'Std': np.float64(0.3293017468006445)}
[I 2024-12-06 23:38:35,600] Trial 414 finished with value: 1.1607142857142856 and parameters: {'x_0_0': 'bc', 'x_0_1': 'ad', 'x_1_0': 'cd', 'x_1_1': 'oo'}. Best is trial 76 with value: 0.5.
2024-12-06 23:38:35,663 - INFO - Candidate Mean Stats: {'Max': np.float64(3.041148714561891), 'Min': np.float64(-0.6958293219142391), 'Mean': np.float64(0.791883879154395), 'Std': np.float64(0.5125919197201978)}
2024-12-06 23:38:35,663 - INFO - Candidate Std Stats: {'Max': np.float64(1.552179598143721), 'Min': np.float64(0.0), 'Mean': np.float64(0.4590544188195745), 'Std': np.float64(0.29675292168358663)}
[I 2024-12-06 23:38:35,677] Trial 414 finished with value: 0.9285714285714286 and parameters: {'x_0_0': 'bd', 'x_0_1': 'oo', 'x_1_0': 'ab', 'x_1_1': 'bd'}. Best is trial 165 with value: 0.5.
2024-12-06 23:38:35,709 - INFO - Candidate Mean Stats: {'Max': np.float64(2.832435607303251), 'Min': np.float64(-0.5240349380190332), 'Mean': np.float64(0.8045313246862217), 'Std': np.float64(0.4784852050036372)}
2024-12-06 23:38:35,709 - INFO - Candidate Std Stats: {'Max': np.float64(1.4892785617301083), 'Min': np.float64(0.0), 'Mean': np.float64(0.4327935412374701), 'Std': np.float64(0.28463431061776256)}
[I 2024-12-06 23:38:35,723] Trial 414 finished with value: 1.3214285714285714 and parameters: {'x_0_0': 'bd', 'x_0_1': 'ad', 'x_1_0': 'oo', 'x_1_1': 'ad'}. Best is trial 63 with value: 0.5.
2024-12-06 23:38:35,770 - INFO - Candidate Mean Stats: {'Max': np.float64(3.1761314160920024), 'Min': np.float64(-0.38609999229173536), 'Mean': np.float64(0.7975580141993773), 'Std': np.float64(0.48249464649156365)}
2024-12-06 23:38:35,770 - INFO - Candidate Std Stats: {'Max': np.float64(1.4316466547536213), 'Min': np.float64(0.0), 'Mean': np.float64(0.4710484036318235), 'Std': np.float64(0.2889635279019814)}
[I 2024-12-06 23:38:35,783] Trial 412 finished with value: 1.5 and parameters: {'x_0_0': 'cd', 'x_0_1': 'oo', 'x_1_0': 'bd', 'x_1_1': 'ab'}. Best is trial 23 with value: 0.5.
2024-12-06 23:38:35,981 - INFO - Candidate Mean Stats: {'Max': np.float64(3.2283843181138985), 'Min': np.float64(-0.6401248110532609), 'Mean': np.float64(0.7949213488114469), 'Std': np.float64(0.5339122772406334)}
2024-12-06 23:38:35,981 - INFO - Candidate Std Stats: {'Max': np.float64(1.5592817510752646), 'Min': np.float64(0.0), 'Mean': np.float64(0.45533328330497547), 'Std': np.float64(0.2859632886212224)}
[I 2024-12-06 23:38:36,003] Trial 415 finished with value: 0.9285714285714286 and parameters: {'x_0_0': 'bd', 'x_0_1': 'oo', 'x_1_0': 'ab', 'x_1_1': 'ab'}. Best is trial 76 with value: 0.5.
2024-12-06 23:38:36,074 - INFO - Candidate Mean Stats: {'Max': np.float64(2.899312914858526), 'Min': np.float64(-0.35565963193063704), 'Mean': np.float64(0.8020068231628527), 'Std': np.float64(0.5040981218869577)}
2024-12-06 23:38:36,074 - INFO - Candidate Std Stats: {'Max': np.float64(1.2760898929196882), 'Min': np.float64(0.0), 'Mean': np.float64(0.42126675809925374), 'Std': np.float64(0.2647991381401994)}
[I 2024-12-06 23:38:36,089] Trial 415 finished with value: 1.1964285714285714 and parameters: {'x_0_0': 'ad', 'x_0_1': 'ad', 'x_1_0': 'oo', 'x_1_1': 'oo'}. Best is trial 165 with value: 0.5.
2024-12-06 23:38:36,129 - INFO - Candidate Mean Stats: {'Max': np.float64(3.205404246656645), 'Min': np.float64(-0.3895478228599888), 'Mean': np.float64(0.7999462170238385), 'Std': np.float64(0.5085315599816601)}
2024-12-06 23:38:36,129 - INFO - Candidate Std Stats: {'Max': np.float64(1.3861548329609892), 'Min': np.float64(0.0), 'Mean': np.float64(0.46300272621857474), 'Std': np.float64(0.2881514908379993)}
[I 2024-12-06 23:38:36,143] Trial 415 finished with value: 1.2142857142857144 and parameters: {'x_0_0': 'ab', 'x_0_1': 'oo', 'x_1_0': 'bd', 'x_1_1': 'bd'}. Best is trial 63 with value: 0.5.
2024-12-06 23:38:36,204 - INFO - Candidate Mean Stats: {'Max': np.float64(3.1271855814482827), 'Min': np.float64(-0.5075374140534499), 'Mean': np.float64(0.784377508933687), 'Std': np.float64(0.5084273571548354)}
2024-12-06 23:38:36,204 - INFO - Candidate Std Stats: {'Max': np.float64(1.6264262894883403), 'Min': np.float64(0.0), 'Mean': np.float64(0.4182417273662518), 'Std': np.float64(0.27773412018370985)}
[I 2024-12-06 23:38:36,219] Trial 413 finished with value: 1.1607142857142856 and parameters: {'x_0_0': 'bc', 'x_0_1': 'ac', 'x_1_0': 'ad', 'x_1_1': 'oo'}. Best is trial 23 with value: 0.5.
2024-12-06 23:38:36,449 - INFO - Candidate Mean Stats: {'Max': np.float64(3.442706866847769), 'Min': np.float64(-0.6031597820881719), 'Mean': np.float64(0.7591140779319336), 'Std': np.float64(0.543746822860027)}
2024-12-06 23:38:36,450 - INFO - Candidate Std Stats: {'Max': np.float64(1.6468450589497845), 'Min': np.float64(0.0), 'Mean': np.float64(0.48471155661977744), 'Std': np.float64(0.3044143170435148)}
[I 2024-12-06 23:38:36,464] Trial 416 finished with value: 1.2857142857142856 and parameters: {'x_0_0': 'bc', 'x_0_1': 'ac', 'x_1_0': 'bc', 'x_1_1': 'cd'}. Best is trial 76 with value: 0.5.
2024-12-06 23:38:36,524 - INFO - Candidate Mean Stats: {'Max': np.float64(3.184185733196619), 'Min': np.float64(-0.7362363852639717), 'Mean': np.float64(0.7429349832414418), 'Std': np.float64(0.561017729276582)}
2024-12-06 23:38:36,524 - INFO - Candidate Std Stats: {'Max': np.float64(1.5087034361592353), 'Min': np.float64(0.0), 'Mean': np.float64(0.504066274185464), 'Std': np.float64(0.30887107764166194)}
[I 2024-12-06 23:38:36,539] Trial 416 finished with value: 1.2142857142857144 and parameters: {'x_0_0': 'ab', 'x_0_1': 'oo', 'x_1_0': 'ab', 'x_1_1': 'bc'}. Best is trial 165 with value: 0.5.
2024-12-06 23:38:36,586 - INFO - Candidate Mean Stats: {'Max': np.float64(2.7140435786645454), 'Min': np.float64(-0.32559953125915214), 'Mean': np.float64(0.7999070591416054), 'Std': np.float64(0.4754746903985101)}
2024-12-06 23:38:36,586 - INFO - Candidate Std Stats: {'Max': np.float64(1.535462202791812), 'Min': np.float64(0.0), 'Mean': np.float64(0.446392818682099), 'Std': np.float64(0.2866574123440546)}
[I 2024-12-06 23:38:36,601] Trial 416 finished with value: 1.3214285714285714 and parameters: {'x_0_0': 'bd', 'x_0_1': 'bc', 'x_1_0': 'oo', 'x_1_1': 'bc'}. Best is trial 63 with value: 0.5.
2024-12-06 23:38:36,647 - INFO - Candidate Mean Stats: {'Max': np.float64(2.8893271684938315), 'Min': np.float64(-0.5876015834116218), 'Mean': np.float64(0.7543027009908282), 'Std': np.float64(0.5514668260322066)}
2024-12-06 23:38:36,647 - INFO - Candidate Std Stats: {'Max': np.float64(1.3211012616807756), 'Min': np.float64(0.0), 'Mean': np.float64(0.47103652593279727), 'Std': np.float64(0.2897961397774851)}
[I 2024-12-06 23:38:36,661] Trial 414 finished with value: 1.0357142857142856 and parameters: {'x_0_0': 'bc', 'x_0_1': 'ac', 'x_1_0': 'oo', 'x_1_1': 'bc'}. Best is trial 23 with value: 0.5.
2024-12-06 23:38:36,851 - INFO - Candidate Mean Stats: {'Max': np.float64(2.9620262107918087), 'Min': np.float64(-0.6112474480396795), 'Mean': np.float64(0.8042767804668032), 'Std': np.float64(0.510019755095446)}
2024-12-06 23:38:36,851 - INFO - Candidate Std Stats: {'Max': np.float64(1.7752669908534398), 'Min': np.float64(0.0), 'Mean': np.float64(0.44258896337890635), 'Std': np.float64(0.3073011398475214)}
[I 2024-12-06 23:38:36,865] Trial 417 finished with value: 1.2857142857142856 and parameters: {'x_0_0': 'bd', 'x_0_1': 'ac', 'x_1_0': 'bd', 'x_1_1': 'ac'}. Best is trial 76 with value: 0.5.
2024-12-06 23:38:36,913 - INFO - Candidate Mean Stats: {'Max': np.float64(2.831013973888252), 'Min': np.float64(-0.7067223937822933), 'Mean': np.float64(0.6990234125039467), 'Std': np.float64(0.587486140972334)}
2024-12-06 23:38:36,913 - INFO - Candidate Std Stats: {'Max': np.float64(1.821725152254851), 'Min': np.float64(0.0), 'Mean': np.float64(0.5188695324955382), 'Std': np.float64(0.33829765051049604)}
[I 2024-12-06 23:38:36,927] Trial 417 finished with value: 1.125 and parameters: {'x_0_0': 'oo', 'x_0_1': 'oo', 'x_1_0': 'oo', 'x_1_1': 'ab'}. Best is trial 165 with value: 0.5.
2024-12-06 23:38:36,975 - INFO - Candidate Mean Stats: {'Max': np.float64(2.725181715498109), 'Min': np.float64(-0.34818596744119323), 'Mean': np.float64(0.8007058566720521), 'Std': np.float64(0.4777824236071933)}
2024-12-06 23:38:36,975 - INFO - Candidate Std Stats: {'Max': np.float64(1.6665058126431258), 'Min': np.float64(0.0), 'Mean': np.float64(0.44739023524401705), 'Std': np.float64(0.2881101906523854)}
[I 2024-12-06 23:38:36,989] Trial 417 finished with value: 1.2857142857142856 and parameters: {'x_0_0': 'ac', 'x_0_1': 'ad', 'x_1_0': 'ab', 'x_1_1': 'cd'}. Best is trial 63 with value: 0.5.
2024-12-06 23:38:37,037 - INFO - Candidate Mean Stats: {'Max': np.float64(2.878698620293324), 'Min': np.float64(-0.31281120987404537), 'Mean': np.float64(0.8378324045244476), 'Std': np.float64(0.48975239010752525)}
2024-12-06 23:38:37,037 - INFO - Candidate Std Stats: {'Max': np.float64(1.4687340096152048), 'Min': np.float64(0.0), 'Mean': np.float64(0.4335073581103678), 'Std': np.float64(0.2765061489335125)}
[I 2024-12-06 23:38:37,051] Trial 415 finished with value: 1.5714285714285714 and parameters: {'x_0_0': 'bd', 'x_0_1': 'ad', 'x_1_0': 'cd', 'x_1_1': 'cd'}. Best is trial 23 with value: 0.5.
2024-12-06 23:38:37,239 - INFO - Candidate Mean Stats: {'Max': np.float64(3.076291332697588), 'Min': np.float64(-0.6483601375300766), 'Mean': np.float64(0.6870029689434868), 'Std': np.float64(0.5760850259646558)}
2024-12-06 23:38:37,239 - INFO - Candidate Std Stats: {'Max': np.float64(1.5297108017283214), 'Min': np.float64(0.0), 'Mean': np.float64(0.49381644567621474), 'Std': np.float64(0.31065374856726424)}
[I 2024-12-06 23:38:37,253] Trial 418 finished with value: 1.2857142857142856 and parameters: {'x_0_0': 'ac', 'x_0_1': 'ac', 'x_1_0': 'bd', 'x_1_1': 'bc'}. Best is trial 76 with value: 0.5.
2024-12-06 23:38:37,302 - INFO - Candidate Mean Stats: {'Max': np.float64(3.1325236235091953), 'Min': np.float64(-0.4434293054334832), 'Mean': np.float64(0.808182084745425), 'Std': np.float64(0.5105315128077539)}
2024-12-06 23:38:37,302 - INFO - Candidate Std Stats: {'Max': np.float64(1.4246715565981092), 'Min': np.float64(0.0), 'Mean': np.float64(0.4545100847857731), 'Std': np.float64(0.27955830180484353)}
[I 2024-12-06 23:38:37,315] Trial 418 finished with value: 0.9107142857142857 and parameters: {'x_0_0': 'ac', 'x_0_1': 'ac', 'x_1_0': 'oo', 'x_1_1': 'oo'}. Best is trial 165 with value: 0.5.
2024-12-06 23:38:37,365 - INFO - Candidate Mean Stats: {'Max': np.float64(2.931757809125465), 'Min': np.float64(-0.3131865804526561), 'Mean': np.float64(0.8237305804538254), 'Std': np.float64(0.5125420392827036)}
2024-12-06 23:38:37,365 - INFO - Candidate Std Stats: {'Max': np.float64(1.6638455881683802), 'Min': np.float64(0.0), 'Mean': np.float64(0.43301722890510397), 'Std': np.float64(0.27976430207512604)}
[I 2024-12-06 23:38:37,381] Trial 418 finished with value: 1.4285714285714286 and parameters: {'x_0_0': 'bd', 'x_0_1': 'bc', 'x_1_0': 'ab', 'x_1_1': 'ac'}. Best is trial 63 with value: 0.5.
2024-12-06 23:38:37,428 - INFO - Candidate Mean Stats: {'Max': np.float64(3.1827953907403326), 'Min': np.float64(-0.3814343211011507), 'Mean': np.float64(0.8672169787784294), 'Std': np.float64(0.48455574274672364)}
2024-12-06 23:38:37,428 - INFO - Candidate Std Stats: {'Max': np.float64(1.3520321493621572), 'Min': np.float64(0.0), 'Mean': np.float64(0.3812943016834883), 'Std': np.float64(0.25390323533467063)}
[I 2024-12-06 23:38:37,442] Trial 416 finished with value: 1.4464285714285714 and parameters: {'x_0_0': 'bd', 'x_0_1': 'ac', 'x_1_0': 'ad', 'x_1_1': 'oo'}. Best is trial 23 with value: 0.5.
2024-12-06 23:38:37,631 - INFO - Candidate Mean Stats: {'Max': np.float64(2.864095578037287), 'Min': np.float64(-0.862357814716327), 'Mean': np.float64(0.7604059649402406), 'Std': np.float64(0.5666414811420394)}
2024-12-06 23:38:37,631 - INFO - Candidate Std Stats: {'Max': np.float64(1.6678006600671056), 'Min': np.float64(0.0), 'Mean': np.float64(0.5164272565705931), 'Std': np.float64(0.326419923866765)}
[I 2024-12-06 23:38:37,645] Trial 419 finished with value: 1.1964285714285714 and parameters: {'x_0_0': 'ad', 'x_0_1': 'bd', 'x_1_0': 'oo', 'x_1_1': 'oo'}. Best is trial 76 with value: 0.5.
2024-12-06 23:38:37,694 - INFO - Candidate Mean Stats: {'Max': np.float64(3.273600323429786), 'Min': np.float64(-0.48118661808602814), 'Mean': np.float64(0.8008658860069385), 'Std': np.float64(0.5246199561136259)}
2024-12-06 23:38:37,694 - INFO - Candidate Std Stats: {'Max': np.float64(1.698929507897299), 'Min': np.float64(0.0), 'Mean': np.float64(0.47422924908361175), 'Std': np.float64(0.3146424519609734)}
[I 2024-12-06 23:38:37,707] Trial 419 finished with value: 1.625 and parameters: {'x_0_0': 'oo', 'x_0_1': 'cd', 'x_1_0': 'oo', 'x_1_1': 'bd'}. Best is trial 165 with value: 0.5.
2024-12-06 23:38:37,758 - INFO - Candidate Mean Stats: {'Max': np.float64(2.8692065307284076), 'Min': np.float64(-0.32986620590852456), 'Mean': np.float64(0.7894814674164514), 'Std': np.float64(0.46109796116962903)}
2024-12-06 23:38:37,758 - INFO - Candidate Std Stats: {'Max': np.float64(1.6873350249159889), 'Min': np.float64(0.0), 'Mean': np.float64(0.40998575920795155), 'Std': np.float64(0.27342810883815155)}
[I 2024-12-06 23:38:37,772] Trial 419 finished with value: 1.1428571428571428 and parameters: {'x_0_0': 'bd', 'x_0_1': 'bd', 'x_1_0': 'bc', 'x_1_1': 'ab'}. Best is trial 63 with value: 0.5.
2024-12-06 23:38:37,821 - INFO - Candidate Mean Stats: {'Max': np.float64(3.2849477746580336), 'Min': np.float64(-0.5298079964990464), 'Mean': np.float64(0.8052353262120036), 'Std': np.float64(0.5332433499236355)}
2024-12-06 23:38:37,821 - INFO - Candidate Std Stats: {'Max': np.float64(1.4769173968570755), 'Min': np.float64(0.0), 'Mean': np.float64(0.43463456862380184), 'Std': np.float64(0.2776060775105619)}
[I 2024-12-06 23:38:37,835] Trial 417 finished with value: 1.1607142857142856 and parameters: {'x_0_0': 'bd', 'x_0_1': 'cd', 'x_1_0': 'bd', 'x_1_1': 'oo'}. Best is trial 23 with value: 0.5.
2024-12-06 23:38:38,021 - INFO - Candidate Mean Stats: {'Max': np.float64(3.0909723362680537), 'Min': np.float64(-0.9231754697674146), 'Mean': np.float64(0.7416505678626931), 'Std': np.float64(0.5730929640805942)}
2024-12-06 23:38:38,021 - INFO - Candidate Std Stats: {'Max': np.float64(1.627485407210317), 'Min': np.float64(0.0), 'Mean': np.float64(0.496213116843147), 'Std': np.float64(0.315968638781467)}
[I 2024-12-06 23:38:38,036] Trial 420 finished with value: 1.0 and parameters: {'x_0_0': 'bc', 'x_0_1': 'ad', 'x_1_0': 'bd', 'x_1_1': 'bc'}. Best is trial 76 with value: 0.5.
2024-12-06 23:38:38,084 - INFO - Candidate Mean Stats: {'Max': np.float64(3.1459071873469697), 'Min': np.float64(-0.7681526362772975), 'Mean': np.float64(0.7959249814815564), 'Std': np.float64(0.5051631913460612)}
2024-12-06 23:38:38,084 - INFO - Candidate Std Stats: {'Max': np.float64(1.6553966152825197), 'Min': np.float64(0.0), 'Mean': np.float64(0.45731096230337887), 'Std': np.float64(0.3151546618237242)}
[I 2024-12-06 23:38:38,098] Trial 420 finished with value: 1.1428571428571428 and parameters: {'x_0_0': 'ac', 'x_0_1': 'ad', 'x_1_0': 'ac', 'x_1_1': 'ab'}. Best is trial 165 with value: 0.5.
2024-12-06 23:38:38,149 - INFO - Candidate Mean Stats: {'Max': np.float64(2.867299814904947), 'Min': np.float64(-0.1651406679439774), 'Mean': np.float64(0.8836023620863209), 'Std': np.float64(0.4248610609877685)}
2024-12-06 23:38:38,150 - INFO - Candidate Std Stats: {'Max': np.float64(1.742825550045553), 'Min': np.float64(0.0), 'Mean': np.float64(0.3812703545417289), 'Std': np.float64(0.28343884315398904)}
[I 2024-12-06 23:38:38,163] Trial 420 finished with value: 1.5 and parameters: {'x_0_0': 'cd', 'x_0_1': 'oo', 'x_1_0': 'bc', 'x_1_1': 'bc'}. Best is trial 63 with value: 0.5.
2024-12-06 23:38:38,210 - INFO - Candidate Mean Stats: {'Max': np.float64(2.8421642524813953), 'Min': np.float64(-0.3887752504875617), 'Mean': np.float64(0.7939014263374747), 'Std': np.float64(0.5038478454888329)}
2024-12-06 23:38:38,210 - INFO - Candidate Std Stats: {'Max': np.float64(1.2671108409204177), 'Min': np.float64(0.0), 'Mean': np.float64(0.45166843388464106), 'Std': np.float64(0.28042349543913436)}
[I 2024-12-06 23:38:38,224] Trial 418 finished with value: 1.2142857142857144 and parameters: {'x_0_0': 'ab', 'x_0_1': 'oo', 'x_1_0': 'bc', 'x_1_1': 'bc'}. Best is trial 23 with value: 0.5.
2024-12-06 23:38:38,411 - INFO - Candidate Mean Stats: {'Max': np.float64(3.071248083648046), 'Min': np.float64(-0.7462697374301982), 'Mean': np.float64(0.7757784806864443), 'Std': np.float64(0.5390133618601847)}
2024-12-06 23:38:38,411 - INFO - Candidate Std Stats: {'Max': np.float64(1.791637092713546), 'Min': np.float64(0.0), 'Mean': np.float64(0.5031244796653184), 'Std': np.float64(0.31915890936794317)}
[I 2024-12-06 23:38:38,425] Trial 421 finished with value: 1.1607142857142856 and parameters: {'x_0_0': 'ad', 'x_0_1': 'ad', 'x_1_0': 'bc', 'x_1_1': 'oo'}. Best is trial 76 with value: 0.5.
2024-12-06 23:38:38,474 - INFO - Candidate Mean Stats: {'Max': np.float64(3.0887274676997167), 'Min': np.float64(-0.5229874628173243), 'Mean': np.float64(0.7483165070873485), 'Std': np.float64(0.5511443942461951)}
2024-12-06 23:38:38,474 - INFO - Candidate Std Stats: {'Max': np.float64(1.4630799736858882), 'Min': np.float64(0.0), 'Mean': np.float64(0.4979402479830459), 'Std': np.float64(0.32533584240458674)}
[I 2024-12-06 23:38:38,488] Trial 421 finished with value: 1.0 and parameters: {'x_0_0': 'bd', 'x_0_1': 'bd', 'x_1_0': 'bc', 'x_1_1': 'ad'}. Best is trial 165 with value: 0.5.
2024-12-06 23:38:38,539 - INFO - Candidate Mean Stats: {'Max': np.float64(3.2256205686266832), 'Min': np.float64(-0.5689194349441852), 'Mean': np.float64(0.7970089189679765), 'Std': np.float64(0.5089194067846827)}
2024-12-06 23:38:38,540 - INFO - Candidate Std Stats: {'Max': np.float64(1.6959883707744428), 'Min': np.float64(0.0), 'Mean': np.float64(0.43863904020948047), 'Std': np.float64(0.2914522849947186)}
[I 2024-12-06 23:38:38,554] Trial 421 finished with value: 1.375 and parameters: {'x_0_0': 'oo', 'x_0_1': 'oo', 'x_1_0': 'bc', 'x_1_1': 'ab'}. Best is trial 63 with value: 0.5.
2024-12-06 23:38:38,603 - INFO - Candidate Mean Stats: {'Max': np.float64(3.128815345708025), 'Min': np.float64(-0.3223346212102907), 'Mean': np.float64(0.8146775490992861), 'Std': np.float64(0.43298339440844796)}
2024-12-06 23:38:38,603 - INFO - Candidate Std Stats: {'Max': np.float64(1.3524365143635053), 'Min': np.float64(0.0), 'Mean': np.float64(0.4044289287262073), 'Std': np.float64(0.26248646216779753)}
[I 2024-12-06 23:38:38,617] Trial 419 finished with value: 1.0714285714285714 and parameters: {'x_0_0': 'bc', 'x_0_1': 'oo', 'x_1_0': 'bc', 'x_1_1': 'bd'}. Best is trial 23 with value: 0.5.
2024-12-06 23:38:38,802 - INFO - Candidate Mean Stats: {'Max': np.float64(3.1110847279163343), 'Min': np.float64(-0.42898319491025394), 'Mean': np.float64(0.798726364434984), 'Std': np.float64(0.5167153999072049)}
2024-12-06 23:38:38,802 - INFO - Candidate Std Stats: {'Max': np.float64(1.7648051488150378), 'Min': np.float64(0.0), 'Mean': np.float64(0.43249750957374145), 'Std': np.float64(0.28852071572817783)}
[I 2024-12-06 23:38:38,816] Trial 422 finished with value: 1.5714285714285714 and parameters: {'x_0_0': 'ac', 'x_0_1': 'cd', 'x_1_0': 'bc', 'x_1_1': 'ad'}. Best is trial 76 with value: 0.5.
2024-12-06 23:38:38,865 - INFO - Candidate Mean Stats: {'Max': np.float64(3.054996822025519), 'Min': np.float64(-0.9252586556067797), 'Mean': np.float64(0.7855280601826995), 'Std': np.float64(0.5599948058559597)}
2024-12-06 23:38:38,865 - INFO - Candidate Std Stats: {'Max': np.float64(1.6968795535678207), 'Min': np.float64(0.0), 'Mean': np.float64(0.4619152270592473), 'Std': np.float64(0.2934669274241515)}
