[I 2024-12-06 23:37:19,903] Trial 213 finished with value: 1.375 and parameters: {'x_0_0': 'oo', 'x_0_1': 'oo', 'x_1_0': 'bc', 'x_1_1': 'ac'}. Best is trial 23 with value: 0.5.
2024-12-06 23:37:20,101 - INFO - Candidate Mean Stats: {'Max': np.float64(3.096826619815084), 'Min': np.float64(-0.7696001566939182), 'Mean': np.float64(0.5589589554681621), 'Std': np.float64(0.545619284983973)}
2024-12-06 23:37:20,101 - INFO - Candidate Std Stats: {'Max': np.float64(1.4652065257042648), 'Min': np.float64(0.0), 'Mean': np.float64(0.5866876844629088), 'Std': np.float64(0.29460019307837876)}
2024-12-06 23:37:20,102 - INFO - Candidate Mean Stats: {'Max': np.float64(3.03022213294046), 'Min': np.float64(-0.7861556580033783), 'Mean': np.float64(0.557787855339805), 'Std': np.float64(0.5237983627752353)}
2024-12-06 23:37:20,102 - INFO - Candidate Std Stats: {'Max': np.float64(1.4549580591541498), 'Min': np.float64(0.0), 'Mean': np.float64(0.5444307467354439), 'Std': np.float64(0.28232129434159053)}
[I 2024-12-06 23:37:20,116] Trial 215 finished with value: 1.0714285714285714 and parameters: {'x_0_0': 'bd', 'x_0_1': 'oo', 'x_1_0': 'cd', 'x_1_1': 'bc'}. Best is trial 76 with value: 0.5.
[I 2024-12-06 23:37:20,116] Trial 215 finished with value: 0.7857142857142857 and parameters: {'x_0_0': 'bd', 'x_0_1': 'oo', 'x_1_0': 'bd', 'x_1_1': 'cd'}. Best is trial 165 with value: 0.5.
2024-12-06 23:37:20,121 - INFO - Candidate Mean Stats: {'Max': np.float64(3.3401087676294), 'Min': np.float64(-1.0153198706508324), 'Mean': np.float64(0.4666871482295208), 'Std': np.float64(0.5598448521216779)}
2024-12-06 23:37:20,121 - INFO - Candidate Std Stats: {'Max': np.float64(1.6006775966040252), 'Min': np.float64(0.0), 'Mean': np.float64(0.5877487150660077), 'Std': np.float64(0.30682827842092614)}
[I 2024-12-06 23:37:20,134] Trial 215 finished with value: 0.9464285714285714 and parameters: {'x_0_0': 'ac', 'x_0_1': 'oo', 'x_1_0': 'ab', 'x_1_1': 'oo'}. Best is trial 63 with value: 0.5.
2024-12-06 23:37:20,251 - INFO - Candidate Mean Stats: {'Max': np.float64(3.0494326966151686), 'Min': np.float64(-0.9590840222101157), 'Mean': np.float64(0.5286710279020589), 'Std': np.float64(0.5345525623054317)}
2024-12-06 23:37:20,251 - INFO - Candidate Std Stats: {'Max': np.float64(1.6881226044927098), 'Min': np.float64(0.0), 'Mean': np.float64(0.5829271616210409), 'Std': np.float64(0.303203452585484)}
[I 2024-12-06 23:37:20,264] Trial 214 finished with value: 1.0714285714285714 and parameters: {'x_0_0': 'ac', 'x_0_1': 'oo', 'x_1_0': 'cd', 'x_1_1': 'ab'}. Best is trial 23 with value: 0.5.
2024-12-06 23:37:20,462 - INFO - Candidate Mean Stats: {'Max': np.float64(2.950134185870043), 'Min': np.float64(-1.2414158649095102), 'Mean': np.float64(0.4429695762377191), 'Std': np.float64(0.541034735959319)}
2024-12-06 23:37:20,462 - INFO - Candidate Std Stats: {'Max': np.float64(1.5126153024556173), 'Min': np.float64(0.0), 'Mean': np.float64(0.5896897872373302), 'Std': np.float64(0.29563020638456755)}
2024-12-06 23:37:20,464 - INFO - Candidate Mean Stats: {'Max': np.float64(3.1025340501550653), 'Min': np.float64(-0.9599427360137718), 'Mean': np.float64(0.5095235905909885), 'Std': np.float64(0.6061673795135439)}
2024-12-06 23:37:20,464 - INFO - Candidate Std Stats: {'Max': np.float64(1.5672098028315269), 'Min': np.float64(0.0), 'Mean': np.float64(0.5703102531445715), 'Std': np.float64(0.2904862605707579)}
[I 2024-12-06 23:37:20,476] Trial 216 finished with value: 1.0714285714285714 and parameters: {'x_0_0': 'bd', 'x_0_1': 'oo', 'x_1_0': 'cd', 'x_1_1': 'cd'}. Best is trial 165 with value: 0.5.
[I 2024-12-06 23:37:20,478] Trial 216 finished with value: 1.3214285714285714 and parameters: {'x_0_0': 'bd', 'x_0_1': 'ac', 'x_1_0': 'oo', 'x_1_1': 'bc'}. Best is trial 76 with value: 0.5.
2024-12-06 23:37:20,482 - INFO - Candidate Mean Stats: {'Max': np.float64(2.7322003811463556), 'Min': np.float64(-1.1438878305609173), 'Mean': np.float64(0.528293363718059), 'Std': np.float64(0.534594867694224)}
2024-12-06 23:37:20,482 - INFO - Candidate Std Stats: {'Max': np.float64(1.6084507295703772), 'Min': np.float64(0.0), 'Mean': np.float64(0.5680230201828947), 'Std': np.float64(0.2931399154620028)}
[I 2024-12-06 23:37:20,495] Trial 216 finished with value: 1.2142857142857144 and parameters: {'x_0_0': 'ab', 'x_0_1': 'oo', 'x_1_0': 'bd', 'x_1_1': 'cd'}. Best is trial 63 with value: 0.5.
2024-12-06 23:37:20,618 - INFO - Candidate Mean Stats: {'Max': np.float64(2.67133339223975), 'Min': np.float64(-0.7935743764664787), 'Mean': np.float64(0.4755735052923499), 'Std': np.float64(0.5499844115228543)}
2024-12-06 23:37:20,618 - INFO - Candidate Std Stats: {'Max': np.float64(2.0235943908613687), 'Min': np.float64(0.0), 'Mean': np.float64(0.6082149972892409), 'Std': np.float64(0.32306954812171407)}
[I 2024-12-06 23:37:20,631] Trial 215 finished with value: 1.625 and parameters: {'x_0_0': 'oo', 'x_0_1': 'ac', 'x_1_0': 'oo', 'x_1_1': 'ac'}. Best is trial 23 with value: 0.5.
2024-12-06 23:37:20,827 - INFO - Candidate Mean Stats: {'Max': np.float64(3.0415815283866676), 'Min': np.float64(-0.9559993273970913), 'Mean': np.float64(0.5454321094196006), 'Std': np.float64(0.5603659773100412)}
2024-12-06 23:37:20,827 - INFO - Candidate Std Stats: {'Max': np.float64(1.4867540279853706), 'Min': np.float64(0.0), 'Mean': np.float64(0.5690948722212192), 'Std': np.float64(0.28655600056807906)}
2024-12-06 23:37:20,829 - INFO - Candidate Mean Stats: {'Max': np.float64(3.3657643332735114), 'Min': np.float64(-1.0824096388979327), 'Mean': np.float64(0.5570549870768866), 'Std': np.float64(0.5229410089608972)}
2024-12-06 23:37:20,829 - INFO - Candidate Std Stats: {'Max': np.float64(1.5104088194500147), 'Min': np.float64(0.0), 'Mean': np.float64(0.5414852840255165), 'Std': np.float64(0.27705363540859207)}
[I 2024-12-06 23:37:20,841] Trial 217 finished with value: 1.0357142857142856 and parameters: {'x_0_0': 'bc', 'x_0_1': 'ac', 'x_1_0': 'oo', 'x_1_1': 'bc'}. Best is trial 165 with value: 0.5.
[I 2024-12-06 23:37:20,843] Trial 217 finished with value: 1.25 and parameters: {'x_0_0': 'cd', 'x_0_1': 'oo', 'x_1_0': 'oo', 'x_1_1': 'bd'}. Best is trial 76 with value: 0.5.
2024-12-06 23:37:20,846 - INFO - Candidate Mean Stats: {'Max': np.float64(2.6798651551993085), 'Min': np.float64(-0.9783754831427961), 'Mean': np.float64(0.5115090260033976), 'Std': np.float64(0.5230947646647818)}
2024-12-06 23:37:20,846 - INFO - Candidate Std Stats: {'Max': np.float64(1.8420299062323793), 'Min': np.float64(0.0), 'Mean': np.float64(0.5897864312341939), 'Std': np.float64(0.3193857600119733)}
[I 2024-12-06 23:37:20,859] Trial 217 finished with value: 1.2142857142857144 and parameters: {'x_0_0': 'ab', 'x_0_1': 'oo', 'x_1_0': 'ad', 'x_1_1': 'ac'}. Best is trial 63 with value: 0.5.
2024-12-06 23:37:20,981 - INFO - Candidate Mean Stats: {'Max': np.float64(2.891952836677332), 'Min': np.float64(-0.968120039116102), 'Mean': np.float64(0.5052040782734298), 'Std': np.float64(0.556461295613382)}
2024-12-06 23:37:20,981 - INFO - Candidate Std Stats: {'Max': np.float64(1.5881935926244086), 'Min': np.float64(0.0), 'Mean': np.float64(0.5572941756575307), 'Std': np.float64(0.2880171005615463)}
[I 2024-12-06 23:37:20,994] Trial 216 finished with value: 0.9464285714285714 and parameters: {'x_0_0': 'ad', 'x_0_1': 'oo', 'x_1_0': 'cd', 'x_1_1': 'oo'}. Best is trial 23 with value: 0.5.
2024-12-06 23:37:21,191 - INFO - Candidate Mean Stats: {'Max': np.float64(2.869236336975106), 'Min': np.float64(-1.1994988450665913), 'Mean': np.float64(0.449958202360487), 'Std': np.float64(0.5617506960260906)}
2024-12-06 23:37:21,191 - INFO - Candidate Std Stats: {'Max': np.float64(2.115363569506068), 'Min': np.float64(0.0), 'Mean': np.float64(0.6540551550207827), 'Std': np.float64(0.3525453111408657)}
2024-12-06 23:37:21,195 - INFO - Candidate Mean Stats: {'Max': np.float64(2.946482874551017), 'Min': np.float64(-0.9405800337071482), 'Mean': np.float64(0.5333231832584275), 'Std': np.float64(0.5864998052314393)}
2024-12-06 23:37:21,195 - INFO - Candidate Std Stats: {'Max': np.float64(1.5797166464421235), 'Min': np.float64(0.0), 'Mean': np.float64(0.5604936538513434), 'Std': np.float64(0.2823312541133484)}
[I 2024-12-06 23:37:21,206] Trial 218 finished with value: 1.4285714285714286 and parameters: {'x_0_0': 'bd', 'x_0_1': 'ad', 'x_1_0': 'ab', 'x_1_1': 'ac'}. Best is trial 165 with value: 0.5.
[I 2024-12-06 23:37:21,208] Trial 218 finished with value: 1.0714285714285714 and parameters: {'x_0_0': 'bc', 'x_0_1': 'oo', 'x_1_0': 'cd', 'x_1_1': 'bd'}. Best is trial 76 with value: 0.5.
2024-12-06 23:37:21,211 - INFO - Candidate Mean Stats: {'Max': np.float64(2.7430007916399033), 'Min': np.float64(-1.019227516566738), 'Mean': np.float64(0.49706355042252975), 'Std': np.float64(0.59606951175437)}
2024-12-06 23:37:21,211 - INFO - Candidate Std Stats: {'Max': np.float64(1.7845143179857654), 'Min': np.float64(0.0), 'Mean': np.float64(0.5870384959975234), 'Std': np.float64(0.2912502990611755)}
[I 2024-12-06 23:37:21,224] Trial 218 finished with value: 1.25 and parameters: {'x_0_0': 'oo', 'x_0_1': 'oo', 'x_1_0': 'cd', 'x_1_1': 'oo'}. Best is trial 63 with value: 0.5.
2024-12-06 23:37:21,348 - INFO - Candidate Mean Stats: {'Max': np.float64(2.845039378577552), 'Min': np.float64(-1.064935990954836), 'Mean': np.float64(0.5406727309209214), 'Std': np.float64(0.5368830723178454)}
2024-12-06 23:37:21,348 - INFO - Candidate Std Stats: {'Max': np.float64(1.7432928030922605), 'Min': np.float64(0.0), 'Mean': np.float64(0.5856595847321318), 'Std': np.float64(0.30524502576514795)}
[I 2024-12-06 23:37:21,362] Trial 217 finished with value: 1.2142857142857144 and parameters: {'x_0_0': 'ab', 'x_0_1': 'oo', 'x_1_0': 'bd', 'x_1_1': 'cd'}. Best is trial 23 with value: 0.5.
2024-12-06 23:37:21,555 - INFO - Candidate Mean Stats: {'Max': np.float64(3.154625140949785), 'Min': np.float64(-1.1097141581048582), 'Mean': np.float64(0.5357452370031203), 'Std': np.float64(0.5595091534087051)}
2024-12-06 23:37:21,555 - INFO - Candidate Std Stats: {'Max': np.float64(1.4878857051332481), 'Min': np.float64(0.0), 'Mean': np.float64(0.5965929013346539), 'Std': np.float64(0.2954308204150116)}
2024-12-06 23:37:21,560 - INFO - Candidate Mean Stats: {'Max': np.float64(3.0488598799404385), 'Min': np.float64(-1.2233825374198846), 'Mean': np.float64(0.4523064403191967), 'Std': np.float64(0.6651535492305263)}
2024-12-06 23:37:21,560 - INFO - Candidate Std Stats: {'Max': np.float64(1.796803598854198), 'Min': np.float64(0.0), 'Mean': np.float64(0.6118661065648082), 'Std': np.float64(0.3131545024280073)}
[I 2024-12-06 23:37:21,569] Trial 219 finished with value: 1.1607142857142856 and parameters: {'x_0_0': 'bd', 'x_0_1': 'ad', 'x_1_0': 'bd', 'x_1_1': 'oo'}. Best is trial 165 with value: 0.5.
2024-12-06 23:37:21,574 - INFO - Candidate Mean Stats: {'Max': np.float64(2.875550168269191), 'Min': np.float64(-1.0523496817734486), 'Mean': np.float64(0.5480846605346439), 'Std': np.float64(0.5126949505316413)}
2024-12-06 23:37:21,574 - INFO - Candidate Std Stats: {'Max': np.float64(1.771107342483558), 'Min': np.float64(0.0), 'Mean': np.float64(0.5207169544968289), 'Std': np.float64(0.2798154957577784)}
[I 2024-12-06 23:37:21,574] Trial 219 finished with value: 1.0 and parameters: {'x_0_0': 'ac', 'x_0_1': 'ad', 'x_1_0': 'bd', 'x_1_1': 'bc'}. Best is trial 76 with value: 0.5.
[I 2024-12-06 23:37:21,587] Trial 219 finished with value: 1.2142857142857144 and parameters: {'x_0_0': 'ab', 'x_0_1': 'oo', 'x_1_0': 'ad', 'x_1_1': 'bd'}. Best is trial 63 with value: 0.5.
2024-12-06 23:37:21,711 - INFO - Candidate Mean Stats: {'Max': np.float64(2.9200018985870226), 'Min': np.float64(-0.9516666097839902), 'Mean': np.float64(0.5337013965516022), 'Std': np.float64(0.5604169584483817)}
2024-12-06 23:37:21,711 - INFO - Candidate Std Stats: {'Max': np.float64(1.387699881207732), 'Min': np.float64(0.0), 'Mean': np.float64(0.5547716372160059), 'Std': np.float64(0.2781829570582276)}
[I 2024-12-06 23:37:21,726] Trial 218 finished with value: 1.5714285714285714 and parameters: {'x_0_0': 'ad', 'x_0_1': 'bc', 'x_1_0': 'ac', 'x_1_1': 'bc'}. Best is trial 23 with value: 0.5.
2024-12-06 23:37:21,922 - INFO - Candidate Mean Stats: {'Max': np.float64(2.62814507033845), 'Min': np.float64(-1.1470618556769447), 'Mean': np.float64(0.5910019482907279), 'Std': np.float64(0.5157837941846419)}
2024-12-06 23:37:21,922 - INFO - Candidate Std Stats: {'Max': np.float64(1.6715575164658596), 'Min': np.float64(0.0), 'Mean': np.float64(0.5417646973518625), 'Std': np.float64(0.28876278433846597)}
2024-12-06 23:37:21,926 - INFO - Candidate Mean Stats: {'Max': np.float64(3.432542946402905), 'Min': np.float64(-1.1919722632972607), 'Mean': np.float64(0.4953725484923208), 'Std': np.float64(0.6100914015369753)}
2024-12-06 23:37:21,926 - INFO - Candidate Std Stats: {'Max': np.float64(1.4017896617898506), 'Min': np.float64(0.0), 'Mean': np.float64(0.5752264775130799), 'Std': np.float64(0.2899426444151087)}
[I 2024-12-06 23:37:21,936] Trial 220 finished with value: 1.0714285714285714 and parameters: {'x_0_0': 'bd', 'x_0_1': 'oo', 'x_1_0': 'cd', 'x_1_1': 'ab'}. Best is trial 165 with value: 0.5.
2024-12-06 23:37:21,939 - INFO - Candidate Mean Stats: {'Max': np.float64(2.8010467135076067), 'Min': np.float64(-0.8990777547922267), 'Mean': np.float64(0.5673003488635712), 'Std': np.float64(0.49760938798375126)}
2024-12-06 23:37:21,939 - INFO - Candidate Std Stats: {'Max': np.float64(1.60446964977532), 'Min': np.float64(0.0), 'Mean': np.float64(0.5128492364518724), 'Std': np.float64(0.2824654246017736)}
[I 2024-12-06 23:37:21,940] Trial 220 finished with value: 0.5 and parameters: {'x_0_0': 'bd', 'x_0_1': 'oo', 'x_1_0': 'bc', 'x_1_1': 'ad'}. Best is trial 76 with value: 0.5.
[I 2024-12-06 23:37:21,952] Trial 220 finished with value: 1.0714285714285714 and parameters: {'x_0_0': 'ac', 'x_0_1': 'oo', 'x_1_0': 'bc', 'x_1_1': 'bd'}. Best is trial 63 with value: 0.5.
2024-12-06 23:37:22,076 - INFO - Candidate Mean Stats: {'Max': np.float64(3.0373829559185372), 'Min': np.float64(-0.9809069737353313), 'Mean': np.float64(0.5937246661554981), 'Std': np.float64(0.501187189156112)}
2024-12-06 23:37:22,076 - INFO - Candidate Std Stats: {'Max': np.float64(1.7434348425265382), 'Min': np.float64(0.0), 'Mean': np.float64(0.5378887395624202), 'Std': np.float64(0.2901255534928115)}
[I 2024-12-06 23:37:22,090] Trial 219 finished with value: 1.0714285714285714 and parameters: {'x_0_0': 'ac', 'x_0_1': 'oo', 'x_1_0': 'ac', 'x_1_1': 'ad'}. Best is trial 23 with value: 0.5.
2024-12-06 23:37:22,287 - INFO - Candidate Mean Stats: {'Max': np.float64(2.9000430120003267), 'Min': np.float64(-1.2331506709306925), 'Mean': np.float64(0.5306053364723085), 'Std': np.float64(0.563340091664196)}
2024-12-06 23:37:22,287 - INFO - Candidate Std Stats: {'Max': np.float64(1.6831387560833926), 'Min': np.float64(0.0), 'Mean': np.float64(0.5601956525229825), 'Std': np.float64(0.28310290997068965)}
2024-12-06 23:37:22,293 - INFO - Candidate Mean Stats: {'Max': np.float64(3.321148622952932), 'Min': np.float64(-1.136599493769899), 'Mean': np.float64(0.5843219564285792), 'Std': np.float64(0.5047303287496662)}
2024-12-06 23:37:22,293 - INFO - Candidate Std Stats: {'Max': np.float64(1.6327941394350172), 'Min': np.float64(0.0), 'Mean': np.float64(0.5275772268819402), 'Std': np.float64(0.30023822668807043)}
[I 2024-12-06 23:37:22,301] Trial 221 finished with value: 1.0714285714285714 and parameters: {'x_0_0': 'bc', 'x_0_1': 'oo', 'x_1_0': 'ac', 'x_1_1': 'ac'}. Best is trial 165 with value: 0.5.
2024-12-06 23:37:22,301 - INFO - Candidate Mean Stats: {'Max': np.float64(2.964430331119292), 'Min': np.float64(-0.9159341721240949), 'Mean': np.float64(0.5907344546068948), 'Std': np.float64(0.49104083157030354)}
2024-12-06 23:37:22,301 - INFO - Candidate Std Stats: {'Max': np.float64(2.4885972939549577), 'Min': np.float64(0.0), 'Mean': np.float64(0.5046869208696151), 'Std': np.float64(0.29417825985057006)}
[I 2024-12-06 23:37:22,306] Trial 221 finished with value: 1.0714285714285714 and parameters: {'x_0_0': 'ac', 'x_0_1': 'oo', 'x_1_0': 'ab', 'x_1_1': 'bd'}. Best is trial 76 with value: 0.5.
[I 2024-12-06 23:37:22,315] Trial 221 finished with value: 0.8214285714285714 and parameters: {'x_0_0': 'ac', 'x_0_1': 'oo', 'x_1_0': 'oo', 'x_1_1': 'ad'}. Best is trial 63 with value: 0.5.
2024-12-06 23:37:22,443 - INFO - Candidate Mean Stats: {'Max': np.float64(2.7796104707337426), 'Min': np.float64(-1.2472670964450132), 'Mean': np.float64(0.533499238596521), 'Std': np.float64(0.5819738870513901)}
2024-12-06 23:37:22,443 - INFO - Candidate Std Stats: {'Max': np.float64(1.91344220263312), 'Min': np.float64(0.0), 'Mean': np.float64(0.5877573892148642), 'Std': np.float64(0.3074141755925369)}
[I 2024-12-06 23:37:22,456] Trial 220 finished with value: 0.7857142857142857 and parameters: {'x_0_0': 'ad', 'x_0_1': 'oo', 'x_1_0': 'bd', 'x_1_1': 'cd'}. Best is trial 23 with value: 0.5.
2024-12-06 23:37:22,651 - INFO - Candidate Mean Stats: {'Max': np.float64(2.916380448482617), 'Min': np.float64(-1.1149597617007747), 'Mean': np.float64(0.4972075847619375), 'Std': np.float64(0.5488693641291008)}
2024-12-06 23:37:22,651 - INFO - Candidate Std Stats: {'Max': np.float64(1.5160773385622563), 'Min': np.float64(0.0), 'Mean': np.float64(0.6058030026615848), 'Std': np.float64(0.30218108819667344)}
2024-12-06 23:37:22,657 - INFO - Candidate Mean Stats: {'Max': np.float64(2.851503921464183), 'Min': np.float64(-0.9970274807304078), 'Mean': np.float64(0.5026851996159911), 'Std': np.float64(0.6159070012712317)}
2024-12-06 23:37:22,657 - INFO - Candidate Std Stats: {'Max': np.float64(1.6780785553398172), 'Min': np.float64(0.0), 'Mean': np.float64(0.5840197886162413), 'Std': np.float64(0.29698307509518856)}
[I 2024-12-06 23:37:22,665] Trial 222 finished with value: 1.0714285714285714 and parameters: {'x_0_0': 'ad', 'x_0_1': 'oo', 'x_1_0': 'ac', 'x_1_1': 'bd'}. Best is trial 165 with value: 0.5.
2024-12-06 23:37:22,667 - INFO - Candidate Mean Stats: {'Max': np.float64(2.998376179026345), 'Min': np.float64(-0.6700925505289035), 'Mean': np.float64(0.6065826649097342), 'Std': np.float64(0.46097526081531054)}
2024-12-06 23:37:22,667 - INFO - Candidate Std Stats: {'Max': np.float64(1.529124776169804), 'Min': np.float64(0.0), 'Mean': np.float64(0.4502096541329086), 'Std': np.float64(0.2647818539547103)}
[I 2024-12-06 23:37:22,671] Trial 222 finished with value: 1.0714285714285714 and parameters: {'x_0_0': 'bd', 'x_0_1': 'oo', 'x_1_0': 'cd', 'x_1_1': 'cd'}. Best is trial 76 with value: 0.5.
[I 2024-12-06 23:37:22,680] Trial 222 finished with value: 1.2142857142857144 and parameters: {'x_0_0': 'ab', 'x_0_1': 'oo', 'x_1_0': 'bd', 'x_1_1': 'ab'}. Best is trial 63 with value: 0.5.
2024-12-06 23:37:22,808 - INFO - Candidate Mean Stats: {'Max': np.float64(2.9179992729884976), 'Min': np.float64(-1.455930762025912), 'Mean': np.float64(0.4840215607876921), 'Std': np.float64(0.5841621249589519)}
2024-12-06 23:37:22,808 - INFO - Candidate Std Stats: {'Max': np.float64(1.9458350084045803), 'Min': np.float64(0.0), 'Mean': np.float64(0.6169410674047067), 'Std': np.float64(0.32627463803568674)}
[I 2024-12-06 23:37:22,822] Trial 221 finished with value: 1.0714285714285714 and parameters: {'x_0_0': 'ad', 'x_0_1': 'oo', 'x_1_0': 'cd', 'x_1_1': 'cd'}. Best is trial 23 with value: 0.5.
2024-12-06 23:37:23,014 - INFO - Candidate Mean Stats: {'Max': np.float64(2.4869817626074164), 'Min': np.float64(-0.9258744401632623), 'Mean': np.float64(0.5862140006584629), 'Std': np.float64(0.5209420930086333)}
2024-12-06 23:37:23,014 - INFO - Candidate Std Stats: {'Max': np.float64(2.087043812011769), 'Min': np.float64(0.0), 'Mean': np.float64(0.6128535261526787), 'Std': np.float64(0.3216820996165775)}
2024-12-06 23:37:23,020 - INFO - Candidate Mean Stats: {'Max': np.float64(3.3957778083970735), 'Min': np.float64(-1.1126605423213802), 'Mean': np.float64(0.5419780902989617), 'Std': np.float64(0.5814372053673673)}
2024-12-06 23:37:23,020 - INFO - Candidate Std Stats: {'Max': np.float64(1.5340136190561777), 'Min': np.float64(0.0), 'Mean': np.float64(0.5690559946483869), 'Std': np.float64(0.2954562303673944)}
[I 2024-12-06 23:37:23,028] Trial 223 finished with value: 0.8214285714285714 and parameters: {'x_0_0': 'ac', 'x_0_1': 'oo', 'x_1_0': 'oo', 'x_1_1': 'bd'}. Best is trial 165 with value: 0.5.
2024-12-06 23:37:23,029 - INFO - Candidate Mean Stats: {'Max': np.float64(2.6814838740036206), 'Min': np.float64(-1.1614375569898199), 'Mean': np.float64(0.5308459827833224), 'Std': np.float64(0.5221509309508134)}
2024-12-06 23:37:23,029 - INFO - Candidate Std Stats: {'Max': np.float64(1.4442082847193467), 'Min': np.float64(0.0), 'Mean': np.float64(0.5320864578823885), 'Std': np.float64(0.26843417595263974)}
[I 2024-12-06 23:37:23,033] Trial 223 finished with value: 1.1964285714285714 and parameters: {'x_0_0': 'ad', 'x_0_1': 'ad', 'x_1_0': 'oo', 'x_1_1': 'oo'}. Best is trial 76 with value: 0.5.
[I 2024-12-06 23:37:23,043] Trial 223 finished with value: 0.9642857142857143 and parameters: {'x_0_0': 'ab', 'x_0_1': 'oo', 'x_1_0': 'oo', 'x_1_1': 'bc'}. Best is trial 63 with value: 0.5.
2024-12-06 23:37:23,174 - INFO - Candidate Mean Stats: {'Max': np.float64(2.9422629095036283), 'Min': np.float64(-1.0863572151624687), 'Mean': np.float64(0.5322639152959117), 'Std': np.float64(0.547617154520753)}
2024-12-06 23:37:23,174 - INFO - Candidate Std Stats: {'Max': np.float64(1.6055803996161984), 'Min': np.float64(0.0), 'Mean': np.float64(0.5800478825155004), 'Std': np.float64(0.30090624835372376)}
