[I 2024-12-06 23:36:39,672] Trial 106 finished with value: 0.8214285714285714 and parameters: {'x_0_0': 'bc', 'x_0_1': 'oo', 'x_1_0': 'oo', 'x_1_1': 'ac'}. Best is trial 50 with value: 0.6607142857142857.
2024-12-06 23:36:39,891 - INFO - Candidate Mean Stats: {'Max': np.float64(2.2367154522203108), 'Min': np.float64(-0.8396374646932575), 'Mean': np.float64(0.3845073572836987), 'Std': np.float64(0.4649824075588154)}
2024-12-06 23:36:39,891 - INFO - Candidate Std Stats: {'Max': np.float64(1.4191714039548615), 'Min': np.float64(0.0), 'Mean': np.float64(0.5193428605040743), 'Std': np.float64(0.2337419238770528)}
[I 2024-12-06 23:36:39,903] Trial 106 finished with value: 0.8035714285714286 and parameters: {'x_0_0': 'ad', 'x_0_1': 'oo', 'x_1_0': 'ab', 'x_1_1': 'oo'}. Best is trial 23 with value: 0.5.
2024-12-06 23:36:39,958 - INFO - Candidate Mean Stats: {'Max': np.float64(2.2976615731893943), 'Min': np.float64(-1.4028314602168113), 'Mean': np.float64(0.34821443345074976), 'Std': np.float64(0.5444923950899829)}
2024-12-06 23:36:39,958 - INFO - Candidate Std Stats: {'Max': np.float64(1.7378597965979696), 'Min': np.float64(0.0), 'Mean': np.float64(0.5940858363026271), 'Std': np.float64(0.27633440074918786)}
[I 2024-12-06 23:36:39,971] Trial 107 finished with value: 0.7857142857142857 and parameters: {'x_0_0': 'bd', 'x_0_1': 'oo', 'x_1_0': 'bd', 'x_1_1': 'ac'}. Best is trial 76 with value: 0.5.
2024-12-06 23:36:39,972 - INFO - Candidate Mean Stats: {'Max': np.float64(2.209042324585996), 'Min': np.float64(-1.1342150708284255), 'Mean': np.float64(0.3206393569385074), 'Std': np.float64(0.5265556528696301)}
2024-12-06 23:36:39,972 - INFO - Candidate Std Stats: {'Max': np.float64(1.5807995034785889), 'Min': np.float64(0.0), 'Mean': np.float64(0.5760759622980981), 'Std': np.float64(0.2641471992161276)}
[I 2024-12-06 23:36:39,985] Trial 107 finished with value: 1.0892857142857144 and parameters: {'x_0_0': 'ab', 'x_0_1': 'oo', 'x_1_0': 'bd', 'x_1_1': 'oo'}. Best is trial 63 with value: 0.5.
2024-12-06 23:36:39,990 - INFO - Candidate Mean Stats: {'Max': np.float64(2.174453345291078), 'Min': np.float64(-1.2940688168126808), 'Mean': np.float64(0.3348936981837211), 'Std': np.float64(0.5280326356612663)}
2024-12-06 23:36:39,990 - INFO - Candidate Std Stats: {'Max': np.float64(1.9088946220287961), 'Min': np.float64(0.0), 'Mean': np.float64(0.644791823453764), 'Std': np.float64(0.30171241630317375)}
[I 2024-12-06 23:36:40,002] Trial 107 finished with value: 1.1607142857142856 and parameters: {'x_0_0': 'ad', 'x_0_1': 'ab', 'x_1_0': 'bd', 'x_1_1': 'oo'}. Best is trial 50 with value: 0.6607142857142857.
2024-12-06 23:36:40,224 - INFO - Candidate Mean Stats: {'Max': np.float64(2.5253001557554167), 'Min': np.float64(-1.0727730691971833), 'Mean': np.float64(0.3128225566389811), 'Std': np.float64(0.5150431739751541)}
2024-12-06 23:36:40,224 - INFO - Candidate Std Stats: {'Max': np.float64(1.8196452040083928), 'Min': np.float64(0.0), 'Mean': np.float64(0.6070392241992407), 'Std': np.float64(0.27381174612708914)}
[I 2024-12-06 23:36:40,236] Trial 107 finished with value: 0.8214285714285714 and parameters: {'x_0_0': 'ad', 'x_0_1': 'oo', 'x_1_0': 'oo', 'x_1_1': 'cd'}. Best is trial 23 with value: 0.5.
2024-12-06 23:36:40,289 - INFO - Candidate Mean Stats: {'Max': np.float64(3.1581375172953194), 'Min': np.float64(-1.1795035733609072), 'Mean': np.float64(0.35963976424938954), 'Std': np.float64(0.5300017659630649)}
2024-12-06 23:36:40,289 - INFO - Candidate Std Stats: {'Max': np.float64(1.4773976638355062), 'Min': np.float64(0.0), 'Mean': np.float64(0.5475763327875693), 'Std': np.float64(0.2399897526109299)}
[I 2024-12-06 23:36:40,301] Trial 108 finished with value: 1.0714285714285714 and parameters: {'x_0_0': 'ac', 'x_0_1': 'oo', 'x_1_0': 'ab', 'x_1_1': 'ad'}. Best is trial 76 with value: 0.5.
2024-12-06 23:36:40,304 - INFO - Candidate Mean Stats: {'Max': np.float64(2.415235965812335), 'Min': np.float64(-1.1718213659430574), 'Mean': np.float64(0.34291676961042), 'Std': np.float64(0.5009715813340774)}
2024-12-06 23:36:40,304 - INFO - Candidate Std Stats: {'Max': np.float64(1.6274734477734896), 'Min': np.float64(0.0), 'Mean': np.float64(0.6006729829912457), 'Std': np.float64(0.2712726769613878)}
[I 2024-12-06 23:36:40,316] Trial 108 finished with value: 1.2142857142857144 and parameters: {'x_0_0': 'ab', 'x_0_1': 'oo', 'x_1_0': 'bc', 'x_1_1': 'bc'}. Best is trial 63 with value: 0.5.
2024-12-06 23:36:40,319 - INFO - Candidate Mean Stats: {'Max': np.float64(2.50552229264004), 'Min': np.float64(-0.8938291500603672), 'Mean': np.float64(0.39648896950249946), 'Std': np.float64(0.4683856905342148)}
2024-12-06 23:36:40,319 - INFO - Candidate Std Stats: {'Max': np.float64(1.5690360214329946), 'Min': np.float64(0.0), 'Mean': np.float64(0.4924751732104725), 'Std': np.float64(0.23593869056759562)}
[I 2024-12-06 23:36:40,331] Trial 108 finished with value: 1.0714285714285714 and parameters: {'x_0_0': 'bc', 'x_0_1': 'oo', 'x_1_0': 'ad', 'x_1_1': 'ab'}. Best is trial 50 with value: 0.6607142857142857.
2024-12-06 23:36:40,556 - INFO - Candidate Mean Stats: {'Max': np.float64(2.598276696915901), 'Min': np.float64(-1.3276183738995386), 'Mean': np.float64(0.38040161408736184), 'Std': np.float64(0.49233625264003944)}
2024-12-06 23:36:40,556 - INFO - Candidate Std Stats: {'Max': np.float64(1.6259491250285527), 'Min': np.float64(0.0), 'Mean': np.float64(0.5895022246639985), 'Std': np.float64(0.2852508459987978)}
[I 2024-12-06 23:36:40,568] Trial 108 finished with value: 0.8214285714285714 and parameters: {'x_0_0': 'ac', 'x_0_1': 'oo', 'x_1_0': 'oo', 'x_1_1': 'ad'}. Best is trial 23 with value: 0.5.
2024-12-06 23:36:40,620 - INFO - Candidate Mean Stats: {'Max': np.float64(2.5811836658840313), 'Min': np.float64(-1.3927535722917121), 'Mean': np.float64(0.24301612031720016), 'Std': np.float64(0.548785194898453)}
2024-12-06 23:36:40,620 - INFO - Candidate Std Stats: {'Max': np.float64(1.9320693054780873), 'Min': np.float64(0.0), 'Mean': np.float64(0.6277841934689706), 'Std': np.float64(0.3008149766471927)}
[I 2024-12-06 23:36:40,633] Trial 109 finished with value: 0.9464285714285714 and parameters: {'x_0_0': 'bc', 'x_0_1': 'oo', 'x_1_0': 'ac', 'x_1_1': 'oo'}. Best is trial 76 with value: 0.5.
2024-12-06 23:36:40,634 - INFO - Candidate Mean Stats: {'Max': np.float64(2.652765389686955), 'Min': np.float64(-1.0955853344613777), 'Mean': np.float64(0.3226182044635414), 'Std': np.float64(0.5172666204710631)}
2024-12-06 23:36:40,634 - INFO - Candidate Std Stats: {'Max': np.float64(1.7734861872783159), 'Min': np.float64(0.0), 'Mean': np.float64(0.5708147487079122), 'Std': np.float64(0.2691391421383073)}
2024-12-06 23:36:40,649 - INFO - Candidate Mean Stats: {'Max': np.float64(2.4531424060972347), 'Min': np.float64(-1.0584603463745594), 'Mean': np.float64(0.3761649708947014), 'Std': np.float64(0.5168147493251748)}
2024-12-06 23:36:40,649 - INFO - Candidate Std Stats: {'Max': np.float64(1.6575435706292068), 'Min': np.float64(0.0), 'Mean': np.float64(0.6027098533187302), 'Std': np.float64(0.2714146738007972)}
[I 2024-12-06 23:36:40,649] Trial 109 finished with value: 0.7857142857142857 and parameters: {'x_0_0': 'ad', 'x_0_1': 'oo', 'x_1_0': 'bd', 'x_1_1': 'ac'}. Best is trial 63 with value: 0.5.
[I 2024-12-06 23:36:40,663] Trial 109 finished with value: 0.8214285714285714 and parameters: {'x_0_0': 'bd', 'x_0_1': 'oo', 'x_1_0': 'oo', 'x_1_1': 'ab'}. Best is trial 50 with value: 0.6607142857142857.
2024-12-06 23:36:40,944 - INFO - Candidate Mean Stats: {'Max': np.float64(2.111061155922255), 'Min': np.float64(-0.7974777548654652), 'Mean': np.float64(0.44437828956814746), 'Std': np.float64(0.45279575597479416)}
2024-12-06 23:36:40,944 - INFO - Candidate Std Stats: {'Max': np.float64(1.632237378053465), 'Min': np.float64(0.0), 'Mean': np.float64(0.5350945408768488), 'Std': np.float64(0.2440340250156979)}
[I 2024-12-06 23:36:40,960] Trial 109 finished with value: 0.7857142857142857 and parameters: {'x_0_0': 'ad', 'x_0_1': 'oo', 'x_1_0': 'bd', 'x_1_1': 'bc'}. Best is trial 23 with value: 0.5.
2024-12-06 23:36:41,030 - INFO - Candidate Mean Stats: {'Max': np.float64(2.6972284530221318), 'Min': np.float64(-1.099913549569677), 'Mean': np.float64(0.35028194100718235), 'Std': np.float64(0.5440175172008677)}
2024-12-06 23:36:41,030 - INFO - Candidate Std Stats: {'Max': np.float64(1.7402562196306424), 'Min': np.float64(0.0), 'Mean': np.float64(0.5812312368930949), 'Std': np.float64(0.276999790587386)}
2024-12-06 23:36:41,035 - INFO - Candidate Mean Stats: {'Max': np.float64(2.2201223794759244), 'Min': np.float64(-1.2682990982819935), 'Mean': np.float64(0.334664603260485), 'Std': np.float64(0.5116003626412199)}
2024-12-06 23:36:41,035 - INFO - Candidate Std Stats: {'Max': np.float64(1.6674876470400724), 'Min': np.float64(0.0), 'Mean': np.float64(0.5277820964673147), 'Std': np.float64(0.24943104727611884)}
[I 2024-12-06 23:36:41,057] Trial 110 finished with value: 1.0714285714285714 and parameters: {'x_0_0': 'ac', 'x_0_1': 'oo', 'x_1_0': 'ab', 'x_1_1': 'ac'}. Best is trial 76 with value: 0.5.
2024-12-06 23:36:41,060 - INFO - Candidate Mean Stats: {'Max': np.float64(2.1867145204275964), 'Min': np.float64(-0.8780885407094547), 'Mean': np.float64(0.409165741261073), 'Std': np.float64(0.4435275172617868)}
2024-12-06 23:36:41,060 - INFO - Candidate Std Stats: {'Max': np.float64(1.3894604934458206), 'Min': np.float64(0.0), 'Mean': np.float64(0.5413209917195877), 'Std': np.float64(0.24472716240029999)}
[I 2024-12-06 23:36:41,061] Trial 110 finished with value: 0.9464285714285714 and parameters: {'x_0_0': 'bd', 'x_0_1': 'oo', 'x_1_0': 'ad', 'x_1_1': 'oo'}. Best is trial 63 with value: 0.5.
[I 2024-12-06 23:36:41,085] Trial 110 finished with value: 1.0714285714285714 and parameters: {'x_0_0': 'bc', 'x_0_1': 'oo', 'x_1_0': 'bd', 'x_1_1': 'ab'}. Best is trial 50 with value: 0.6607142857142857.
2024-12-06 23:36:41,365 - INFO - Candidate Mean Stats: {'Max': np.float64(2.8496329659629414), 'Min': np.float64(-1.104331403275575), 'Mean': np.float64(0.39681982047562125), 'Std': np.float64(0.5166753835651549)}
2024-12-06 23:36:41,365 - INFO - Candidate Std Stats: {'Max': np.float64(1.7244322084347967), 'Min': np.float64(0.0), 'Mean': np.float64(0.6327601594554552), 'Std': np.float64(0.2910942949555878)}
[I 2024-12-06 23:36:41,380] Trial 110 finished with value: 0.8214285714285714 and parameters: {'x_0_0': 'ac', 'x_0_1': 'oo', 'x_1_0': 'oo', 'x_1_1': 'cd'}. Best is trial 23 with value: 0.5.
2024-12-06 23:36:41,444 - INFO - Candidate Mean Stats: {'Max': np.float64(2.388670939859323), 'Min': np.float64(-1.0478860702290838), 'Mean': np.float64(0.3736918123623912), 'Std': np.float64(0.506791116862232)}
2024-12-06 23:36:41,445 - INFO - Candidate Mean Stats: {'Max': np.float64(2.2968204200804254), 'Min': np.float64(-1.1880361467388627), 'Mean': np.float64(0.3302388198883652), 'Std': np.float64(0.5626560801122555)}
2024-12-06 23:36:41,445 - INFO - Candidate Std Stats: {'Max': np.float64(1.6923767528326814), 'Min': np.float64(0.0), 'Mean': np.float64(0.5945017807703993), 'Std': np.float64(0.2772115598809787)}
2024-12-06 23:36:41,445 - INFO - Candidate Std Stats: {'Max': np.float64(1.6399530413187662), 'Min': np.float64(0.0), 'Mean': np.float64(0.6209875709486306), 'Std': np.float64(0.26738850291055194)}
[I 2024-12-06 23:36:41,459] Trial 111 finished with value: 1.0714285714285714 and parameters: {'x_0_0': 'ac', 'x_0_1': 'oo', 'x_1_0': 'ad', 'x_1_1': 'bc'}. Best is trial 76 with value: 0.5.
2024-12-06 23:36:41,461 - INFO - Candidate Mean Stats: {'Max': np.float64(2.2410508068317427), 'Min': np.float64(-1.1893314086054916), 'Mean': np.float64(0.33808999481831753), 'Std': np.float64(0.4703659737111777)}
2024-12-06 23:36:41,461 - INFO - Candidate Std Stats: {'Max': np.float64(1.7726813395461511), 'Min': np.float64(0.0), 'Mean': np.float64(0.5659612418528697), 'Std': np.float64(0.27019905544703193)}
[I 2024-12-06 23:36:41,461] Trial 111 finished with value: 1.0714285714285714 and parameters: {'x_0_0': 'bc', 'x_0_1': 'oo', 'x_1_0': 'bd', 'x_1_1': 'ad'}. Best is trial 63 with value: 0.5.
[I 2024-12-06 23:36:41,475] Trial 111 finished with value: 0.9285714285714286 and parameters: {'x_0_0': 'ad', 'x_0_1': 'oo', 'x_1_0': 'ab', 'x_1_1': 'ad'}. Best is trial 50 with value: 0.6607142857142857.
2024-12-06 23:36:41,739 - INFO - Candidate Mean Stats: {'Max': np.float64(2.4850600334152695), 'Min': np.float64(-1.0068046291337047), 'Mean': np.float64(0.40218540194554997), 'Std': np.float64(0.4750015673463002)}
2024-12-06 23:36:41,739 - INFO - Candidate Std Stats: {'Max': np.float64(1.5485325964442649), 'Min': np.float64(0.0), 'Mean': np.float64(0.5802777119086925), 'Std': np.float64(0.2598749700986265)}
[I 2024-12-06 23:36:41,752] Trial 111 finished with value: 0.9642857142857143 and parameters: {'x_0_0': 'ab', 'x_0_1': 'oo', 'x_1_0': 'oo', 'x_1_1': 'bc'}. Best is trial 23 with value: 0.5.
2024-12-06 23:36:41,810 - INFO - Candidate Mean Stats: {'Max': np.float64(2.3852642594970446), 'Min': np.float64(-1.3179402483669846), 'Mean': np.float64(0.28531861618706617), 'Std': np.float64(0.5857930802901811)}
2024-12-06 23:36:41,810 - INFO - Candidate Std Stats: {'Max': np.float64(1.5986993841887833), 'Min': np.float64(0.0), 'Mean': np.float64(0.6085784337237259), 'Std': np.float64(0.27576230759707576)}
2024-12-06 23:36:41,812 - INFO - Candidate Mean Stats: {'Max': np.float64(2.6465643926374676), 'Min': np.float64(-0.8661464421264519), 'Mean': np.float64(0.4476924336007774), 'Std': np.float64(0.49068504959910086)}
2024-12-06 23:36:41,812 - INFO - Candidate Std Stats: {'Max': np.float64(1.4172302775515853), 'Min': np.float64(0.0), 'Mean': np.float64(0.5272794667738527), 'Std': np.float64(0.24256255556032308)}
2024-12-06 23:36:41,821 - INFO - Candidate Mean Stats: {'Max': np.float64(2.3420675871984566), 'Min': np.float64(-1.0881649736717942), 'Mean': np.float64(0.37800051761487446), 'Std': np.float64(0.5078876992867054)}
2024-12-06 23:36:41,821 - INFO - Candidate Std Stats: {'Max': np.float64(1.64049914865889), 'Min': np.float64(0.0), 'Mean': np.float64(0.6303572616874018), 'Std': np.float64(0.2879262530276167)}
[I 2024-12-06 23:36:41,824] Trial 112 finished with value: 1.0714285714285714 and parameters: {'x_0_0': 'bc', 'x_0_1': 'oo', 'x_1_0': 'ab', 'x_1_1': 'ac'}. Best is trial 76 with value: 0.5.
[I 2024-12-06 23:36:41,826] Trial 112 finished with value: 1.5 and parameters: {'x_0_0': 'cd', 'x_0_1': 'oo', 'x_1_0': 'cd', 'x_1_1': 'ac'}. Best is trial 63 with value: 0.5.
[I 2024-12-06 23:36:41,833] Trial 112 finished with value: 0.6607142857142857 and parameters: {'x_0_0': 'bd', 'x_0_1': 'oo', 'x_1_0': 'bc', 'x_1_1': 'oo'}. Best is trial 50 with value: 0.6607142857142857.
2024-12-06 23:36:42,112 - INFO - Candidate Mean Stats: {'Max': np.float64(2.4371480639060485), 'Min': np.float64(-1.0430963576267611), 'Mean': np.float64(0.36838580853657465), 'Std': np.float64(0.4845747870509309)}
2024-12-06 23:36:42,112 - INFO - Candidate Std Stats: {'Max': np.float64(1.7214169340490828), 'Min': np.float64(0.0), 'Mean': np.float64(0.5760540971195613), 'Std': np.float64(0.2521560992486844)}
[I 2024-12-06 23:36:42,124] Trial 112 finished with value: 1.0714285714285714 and parameters: {'x_0_0': 'ac', 'x_0_1': 'oo', 'x_1_0': 'bd', 'x_1_1': 'bc'}. Best is trial 23 with value: 0.5.
2024-12-06 23:36:42,144 - INFO - Candidate Mean Stats: {'Max': np.float64(2.2786036398769434), 'Min': np.float64(-0.9943603812512393), 'Mean': np.float64(0.31150418849946654), 'Std': np.float64(0.528426229594987)}
2024-12-06 23:36:42,144 - INFO - Candidate Std Stats: {'Max': np.float64(1.7771765186218884), 'Min': np.float64(0.0), 'Mean': np.float64(0.619010856219741), 'Std': np.float64(0.2732848502077269)}
[I 2024-12-06 23:36:42,157] Trial 113 finished with value: 0.8035714285714286 and parameters: {'x_0_0': 'bd', 'x_0_1': 'oo', 'x_1_0': 'ab', 'x_1_1': 'oo'}. Best is trial 63 with value: 0.5.
2024-12-06 23:36:42,165 - INFO - Candidate Mean Stats: {'Max': np.float64(2.6650698197020493), 'Min': np.float64(-1.3039016409903463), 'Mean': np.float64(0.29087792237367005), 'Std': np.float64(0.5595178875202128)}
2024-12-06 23:36:42,165 - INFO - Candidate Std Stats: {'Max': np.float64(1.7883000992314684), 'Min': np.float64(0.0), 'Mean': np.float64(0.6243287117442387), 'Std': np.float64(0.29062874602739963)}
2024-12-06 23:36:42,174 - INFO - Candidate Mean Stats: {'Max': np.float64(2.4244986577301324), 'Min': np.float64(-1.0180476140046657), 'Mean': np.float64(0.34730089155270083), 'Std': np.float64(0.4994375409027264)}
2024-12-06 23:36:42,175 - INFO - Candidate Std Stats: {'Max': np.float64(1.6441654094599862), 'Min': np.float64(0.0), 'Mean': np.float64(0.5974606046223027), 'Std': np.float64(0.27930930662820785)}
[I 2024-12-06 23:36:42,177] Trial 113 finished with value: 0.8214285714285714 and parameters: {'x_0_0': 'ac', 'x_0_1': 'oo', 'x_1_0': 'oo', 'x_1_1': 'ab'}. Best is trial 76 with value: 0.5.
[I 2024-12-06 23:36:42,187] Trial 113 finished with value: 1.0714285714285714 and parameters: {'x_0_0': 'bd', 'x_0_1': 'oo', 'x_1_0': 'ac', 'x_1_1': 'ac'}. Best is trial 50 with value: 0.6607142857142857.
2024-12-06 23:36:42,449 - INFO - Candidate Mean Stats: {'Max': np.float64(2.075636004258957), 'Min': np.float64(-0.8362675433831059), 'Mean': np.float64(0.43263137736991725), 'Std': np.float64(0.42632590623949984)}
2024-12-06 23:36:42,449 - INFO - Candidate Std Stats: {'Max': np.float64(1.362599830607583), 'Min': np.float64(0.0), 'Mean': np.float64(0.48455635646750567), 'Std': np.float64(0.2242247036742662)}
[I 2024-12-06 23:36:42,462] Trial 113 finished with value: 0.9285714285714286 and parameters: {'x_0_0': 'bd', 'x_0_1': 'oo', 'x_1_0': 'ab', 'x_1_1': 'bc'}. Best is trial 23 with value: 0.5.
2024-12-06 23:36:42,485 - INFO - Candidate Mean Stats: {'Max': np.float64(2.1658724687732587), 'Min': np.float64(-1.279057020551658), 'Mean': np.float64(0.36156222684099976), 'Std': np.float64(0.5179315601842472)}
2024-12-06 23:36:42,485 - INFO - Candidate Std Stats: {'Max': np.float64(1.6869395103793994), 'Min': np.float64(0.0), 'Mean': np.float64(0.5581206502742261), 'Std': np.float64(0.26255660785805557)}
[I 2024-12-06 23:36:42,497] Trial 114 finished with value: 0.7857142857142857 and parameters: {'x_0_0': 'ad', 'x_0_1': 'oo', 'x_1_0': 'bc', 'x_1_1': 'cd'}. Best is trial 63 with value: 0.5.
2024-12-06 23:36:42,499 - INFO - Candidate Mean Stats: {'Max': np.float64(2.6210636026780905), 'Min': np.float64(-1.0244169628119666), 'Mean': np.float64(0.3830017250063791), 'Std': np.float64(0.5366320195467205)}
2024-12-06 23:36:42,499 - INFO - Candidate Std Stats: {'Max': np.float64(1.6907401227370324), 'Min': np.float64(0.0), 'Mean': np.float64(0.6086275593088846), 'Std': np.float64(0.28039708370519045)}
2024-12-06 23:36:42,510 - INFO - Candidate Mean Stats: {'Max': np.float64(2.6441280868147845), 'Min': np.float64(-0.959725654696334), 'Mean': np.float64(0.4009128865240512), 'Std': np.float64(0.5066614842707984)}
2024-12-06 23:36:42,510 - INFO - Candidate Std Stats: {'Max': np.float64(1.5365032952491904), 'Min': np.float64(0.0), 'Mean': np.float64(0.5142967988020057), 'Std': np.float64(0.24647451164839035)}
[I 2024-12-06 23:36:42,511] Trial 114 finished with value: 1.0714285714285714 and parameters: {'x_0_0': 'ac', 'x_0_1': 'oo', 'x_1_0': 'bd', 'x_1_1': 'ab'}. Best is trial 76 with value: 0.5.
[I 2024-12-06 23:36:42,523] Trial 114 finished with value: 0.9464285714285714 and parameters: {'x_0_0': 'bd', 'x_0_1': 'oo', 'x_1_0': 'ac', 'x_1_1': 'oo'}. Best is trial 50 with value: 0.6607142857142857.
2024-12-06 23:36:42,804 - INFO - Candidate Mean Stats: {'Max': np.float64(2.007619582265222), 'Min': np.float64(-1.0857963141681546), 'Mean': np.float64(0.43181445145624503), 'Std': np.float64(0.5067231997753492)}
2024-12-06 23:36:42,804 - INFO - Candidate Std Stats: {'Max': np.float64(1.4924293680044889), 'Min': np.float64(0.0), 'Mean': np.float64(0.5439625164205216), 'Std': np.float64(0.24927452412988552)}
[I 2024-12-06 23:36:42,817] Trial 114 finished with value: 0.8214285714285714 and parameters: {'x_0_0': 'ad', 'x_0_1': 'oo', 'x_1_0': 'oo', 'x_1_1': 'ac'}. Best is trial 23 with value: 0.5.
2024-12-06 23:36:42,841 - INFO - Candidate Mean Stats: {'Max': np.float64(2.362137893976397), 'Min': np.float64(-1.1242013729853542), 'Mean': np.float64(0.32366436095342677), 'Std': np.float64(0.5205253934529382)}
2024-12-06 23:36:42,841 - INFO - Candidate Std Stats: {'Max': np.float64(1.6730277206626913), 'Min': np.float64(0.0), 'Mean': np.float64(0.6076046914021331), 'Std': np.float64(0.29420156882612203)}
2024-12-06 23:36:42,851 - INFO - Candidate Mean Stats: {'Max': np.float64(2.2629283435017205), 'Min': np.float64(-0.9505472712844668), 'Mean': np.float64(0.4350126613750694), 'Std': np.float64(0.47120551464417076)}
2024-12-06 23:36:42,851 - INFO - Candidate Std Stats: {'Max': np.float64(1.528409721347384), 'Min': np.float64(0.0), 'Mean': np.float64(0.5434720051165177), 'Std': np.float64(0.2525148048854667)}
[I 2024-12-06 23:36:42,854] Trial 115 finished with value: 1.5714285714285714 and parameters: {'x_0_0': 'bd', 'x_0_1': 'bd', 'x_1_0': 'ad', 'x_1_1': 'ad'}. Best is trial 63 with value: 0.5.
2024-12-06 23:36:42,863 - INFO - Candidate Mean Stats: {'Max': np.float64(2.3257333759584737), 'Min': np.float64(-1.397284254678937), 'Mean': np.float64(0.36100717803066795), 'Std': np.float64(0.5217804932878396)}
2024-12-06 23:36:42,863 - INFO - Candidate Std Stats: {'Max': np.float64(1.8711915547706526), 'Min': np.float64(0.0), 'Mean': np.float64(0.5903352417931346), 'Std': np.float64(0.28925239821720417)}
[I 2024-12-06 23:36:42,864] Trial 115 finished with value: 1.0714285714285714 and parameters: {'x_0_0': 'bc', 'x_0_1': 'oo', 'x_1_0': 'cd', 'x_1_1': 'ac'}. Best is trial 76 with value: 0.5.
