[I 2024-12-06 23:38:03,889] Trial 330 finished with value: 1.0714285714285714 and parameters: {'x_0_0': 'bc', 'x_0_1': 'oo', 'x_1_0': 'cd', 'x_1_1': 'ab'}. Best is trial 23 with value: 0.5.
2024-12-06 23:38:03,949 - INFO - Candidate Mean Stats: {'Max': np.float64(3.287736504041663), 'Min': np.float64(-0.7679733331576061), 'Mean': np.float64(0.6812209870754975), 'Std': np.float64(0.5918871744829719)}
2024-12-06 23:38:03,949 - INFO - Candidate Std Stats: {'Max': np.float64(1.4886141340469765), 'Min': np.float64(0.0), 'Mean': np.float64(0.5326229377310225), 'Std': np.float64(0.3157700938285679)}
2024-12-06 23:38:03,953 - INFO - Candidate Mean Stats: {'Max': np.float64(3.510037426380852), 'Min': np.float64(-0.6312178049473457), 'Mean': np.float64(0.681637433006683), 'Std': np.float64(0.5178439628991217)}
2024-12-06 23:38:03,953 - INFO - Candidate Std Stats: {'Max': np.float64(1.474120793036156), 'Min': np.float64(0.0), 'Mean': np.float64(0.5400588533038083), 'Std': np.float64(0.30913048865277964)}
2024-12-06 23:38:03,955 - INFO - Candidate Mean Stats: {'Max': np.float64(3.0963712791361084), 'Min': np.float64(-0.8592576013478009), 'Mean': np.float64(0.6779488439365294), 'Std': np.float64(0.5838003261180903)}
2024-12-06 23:38:03,955 - INFO - Candidate Std Stats: {'Max': np.float64(1.677499490512771), 'Min': np.float64(0.0), 'Mean': np.float64(0.5345261344699501), 'Std': np.float64(0.3221950842346056)}
[I 2024-12-06 23:38:03,964] Trial 332 finished with value: 1.2142857142857144 and parameters: {'x_0_0': 'ab', 'x_0_1': 'oo', 'x_1_0': 'ac', 'x_1_1': 'bd'}. Best is trial 76 with value: 0.5.
[I 2024-12-06 23:38:03,967] Trial 332 finished with value: 1.0714285714285714 and parameters: {'x_0_0': 'ac', 'x_0_1': 'oo', 'x_1_0': 'ac', 'x_1_1': 'bc'}. Best is trial 63 with value: 0.5.
[I 2024-12-06 23:38:03,968] Trial 332 finished with value: 1.2142857142857144 and parameters: {'x_0_0': 'ab', 'x_0_1': 'oo', 'x_1_0': 'ac', 'x_1_1': 'ac'}. Best is trial 165 with value: 0.5.
2024-12-06 23:38:04,257 - INFO - Candidate Mean Stats: {'Max': np.float64(2.7773666537197625), 'Min': np.float64(-0.9514754476590432), 'Mean': np.float64(0.7395961105364999), 'Std': np.float64(0.49946529044143356)}
2024-12-06 23:38:04,257 - INFO - Candidate Std Stats: {'Max': np.float64(1.6454141323332208), 'Min': np.float64(0.0), 'Mean': np.float64(0.5202183867151638), 'Std': np.float64(0.30375798802440507)}
[I 2024-12-06 23:38:04,271] Trial 331 finished with value: 1.0714285714285714 and parameters: {'x_0_0': 'bc', 'x_0_1': 'oo', 'x_1_0': 'ab', 'x_1_1': 'bd'}. Best is trial 23 with value: 0.5.
2024-12-06 23:38:04,330 - INFO - Candidate Mean Stats: {'Max': np.float64(3.115726779883091), 'Min': np.float64(-0.7332486296758478), 'Mean': np.float64(0.643154104125212), 'Std': np.float64(0.5517572477462068)}
2024-12-06 23:38:04,330 - INFO - Candidate Std Stats: {'Max': np.float64(1.7312230534980584), 'Min': np.float64(0.0), 'Mean': np.float64(0.5839763172900673), 'Std': np.float64(0.3391983922124015)}
2024-12-06 23:38:04,335 - INFO - Candidate Mean Stats: {'Max': np.float64(2.943663139650626), 'Min': np.float64(-0.7853429234105109), 'Mean': np.float64(0.6434104357555223), 'Std': np.float64(0.5731913191245441)}
2024-12-06 23:38:04,335 - INFO - Candidate Std Stats: {'Max': np.float64(1.551958264208744), 'Min': np.float64(0.0), 'Mean': np.float64(0.5210925608284251), 'Std': np.float64(0.30450649732899526)}
2024-12-06 23:38:04,338 - INFO - Candidate Mean Stats: {'Max': np.float64(3.116913942124242), 'Min': np.float64(-0.9709824843640915), 'Mean': np.float64(0.6302754341354724), 'Std': np.float64(0.5585921923703362)}
2024-12-06 23:38:04,339 - INFO - Candidate Std Stats: {'Max': np.float64(2.2080103561005098), 'Min': np.float64(0.0), 'Mean': np.float64(0.5799802724685562), 'Std': np.float64(0.3474888276745834)}
[I 2024-12-06 23:38:04,345] Trial 333 finished with value: 0.9642857142857143 and parameters: {'x_0_0': 'ab', 'x_0_1': 'oo', 'x_1_0': 'oo', 'x_1_1': 'ad'}. Best is trial 76 with value: 0.5.
[I 2024-12-06 23:38:04,350] Trial 333 finished with value: 1.3214285714285714 and parameters: {'x_0_0': 'ac', 'x_0_1': 'cd', 'x_1_0': 'oo', 'x_1_1': 'bc'}. Best is trial 165 with value: 0.5.
[I 2024-12-06 23:38:04,353] Trial 333 finished with value: 1.5714285714285714 and parameters: {'x_0_0': 'ad', 'x_0_1': 'ad', 'x_1_0': 'ad', 'x_1_1': 'ad'}. Best is trial 63 with value: 0.5.
2024-12-06 23:38:04,640 - INFO - Candidate Mean Stats: {'Max': np.float64(3.2647038875994605), 'Min': np.float64(-0.5629791322465516), 'Mean': np.float64(0.7153170615438814), 'Std': np.float64(0.5340001456940886)}
2024-12-06 23:38:04,640 - INFO - Candidate Std Stats: {'Max': np.float64(1.7804456916155926), 'Min': np.float64(0.0), 'Mean': np.float64(0.4903819526756957), 'Std': np.float64(0.29651593822437433)}
[I 2024-12-06 23:38:04,654] Trial 332 finished with value: 1.2142857142857144 and parameters: {'x_0_0': 'ab', 'x_0_1': 'oo', 'x_1_0': 'ab', 'x_1_1': 'cd'}. Best is trial 23 with value: 0.5.
2024-12-06 23:38:04,713 - INFO - Candidate Mean Stats: {'Max': np.float64(3.2373606659646397), 'Min': np.float64(-1.1209533188412615), 'Mean': np.float64(0.6034113794086018), 'Std': np.float64(0.6225962997061484)}
2024-12-06 23:38:04,713 - INFO - Candidate Std Stats: {'Max': np.float64(1.9506245192028224), 'Min': np.float64(0.0), 'Mean': np.float64(0.5783119349469051), 'Std': np.float64(0.3430178695055683)}
2024-12-06 23:38:04,718 - INFO - Candidate Mean Stats: {'Max': np.float64(2.7930622085364076), 'Min': np.float64(-1.0342622857910808), 'Mean': np.float64(0.6807490813928565), 'Std': np.float64(0.5402724572163641)}
2024-12-06 23:38:04,718 - INFO - Candidate Std Stats: {'Max': np.float64(1.867194702960733), 'Min': np.float64(0.0), 'Mean': np.float64(0.5448247226185622), 'Std': np.float64(0.3238776809832835)}
2024-12-06 23:38:04,722 - INFO - Candidate Mean Stats: {'Max': np.float64(3.328085368339292), 'Min': np.float64(-0.7315604933091028), 'Mean': np.float64(0.6713532320506606), 'Std': np.float64(0.5643669373297586)}
2024-12-06 23:38:04,722 - INFO - Candidate Std Stats: {'Max': np.float64(1.8022710808654183), 'Min': np.float64(0.0), 'Mean': np.float64(0.5486459044521157), 'Std': np.float64(0.3234734966918811)}
[I 2024-12-06 23:38:04,728] Trial 334 finished with value: 1.0 and parameters: {'x_0_0': 'ac', 'x_0_1': 'ad', 'x_1_0': 'cd', 'x_1_1': 'bd'}. Best is trial 76 with value: 0.5.
[I 2024-12-06 23:38:04,732] Trial 334 finished with value: 0.9464285714285714 and parameters: {'x_0_0': 'ac', 'x_0_1': 'oo', 'x_1_0': 'bc', 'x_1_1': 'oo'}. Best is trial 165 with value: 0.5.
[I 2024-12-06 23:38:04,735] Trial 334 finished with value: 1.0714285714285714 and parameters: {'x_0_0': 'ac', 'x_0_1': 'oo', 'x_1_0': 'ab', 'x_1_1': 'cd'}. Best is trial 63 with value: 0.5.
2024-12-06 23:38:05,021 - INFO - Candidate Mean Stats: {'Max': np.float64(2.7238450472128486), 'Min': np.float64(-0.9288075281203424), 'Mean': np.float64(0.7211677496943546), 'Std': np.float64(0.5077841893166)}
2024-12-06 23:38:05,021 - INFO - Candidate Std Stats: {'Max': np.float64(1.5963595181997219), 'Min': np.float64(0.0), 'Mean': np.float64(0.48710343563901753), 'Std': np.float64(0.2944831288909408)}
[I 2024-12-06 23:38:05,036] Trial 333 finished with value: 1.0714285714285714 and parameters: {'x_0_0': 'ac', 'x_0_1': 'oo', 'x_1_0': 'cd', 'x_1_1': 'ad'}. Best is trial 23 with value: 0.5.
2024-12-06 23:38:05,095 - INFO - Candidate Mean Stats: {'Max': np.float64(3.275075179807368), 'Min': np.float64(-0.7919414313490006), 'Mean': np.float64(0.6569768903483091), 'Std': np.float64(0.5915493026005586)}
2024-12-06 23:38:05,095 - INFO - Candidate Std Stats: {'Max': np.float64(2.03852639615419), 'Min': np.float64(0.0), 'Mean': np.float64(0.5089648656108985), 'Std': np.float64(0.3019901196222659)}
2024-12-06 23:38:05,100 - INFO - Candidate Mean Stats: {'Max': np.float64(3.1859391445457335), 'Min': np.float64(-1.1032782980279894), 'Mean': np.float64(0.6269734594163775), 'Std': np.float64(0.6392929000347546)}
2024-12-06 23:38:05,100 - INFO - Candidate Std Stats: {'Max': np.float64(1.936062934682115), 'Min': np.float64(0.0), 'Mean': np.float64(0.5989154591097463), 'Std': np.float64(0.3518047525073679)}
2024-12-06 23:38:05,106 - INFO - Candidate Mean Stats: {'Max': np.float64(2.823804141530881), 'Min': np.float64(-0.48222881694111636), 'Mean': np.float64(0.6977705326676069), 'Std': np.float64(0.49918991662077417)}
2024-12-06 23:38:05,106 - INFO - Candidate Std Stats: {'Max': np.float64(1.5866126197573174), 'Min': np.float64(0.0), 'Mean': np.float64(0.5409557905048372), 'Std': np.float64(0.3118099653354467)}
[I 2024-12-06 23:38:05,110] Trial 335 finished with value: 1.4464285714285714 and parameters: {'x_0_0': 'bc', 'x_0_1': 'cd', 'x_1_0': 'bc', 'x_1_1': 'oo'}. Best is trial 76 with value: 0.5.
[I 2024-12-06 23:38:05,115] Trial 335 finished with value: 1.2142857142857144 and parameters: {'x_0_0': 'ab', 'x_0_1': 'oo', 'x_1_0': 'ac', 'x_1_1': 'bd'}. Best is trial 165 with value: 0.5.
[I 2024-12-06 23:38:05,121] Trial 335 finished with value: 1.0892857142857144 and parameters: {'x_0_0': 'ab', 'x_0_1': 'oo', 'x_1_0': 'bc', 'x_1_1': 'oo'}. Best is trial 63 with value: 0.5.
2024-12-06 23:38:05,402 - INFO - Candidate Mean Stats: {'Max': np.float64(3.3079104367007686), 'Min': np.float64(-0.9791652103286237), 'Mean': np.float64(0.7496681771486922), 'Std': np.float64(0.49071760666029696)}
2024-12-06 23:38:05,402 - INFO - Candidate Std Stats: {'Max': np.float64(1.6065966002126404), 'Min': np.float64(0.0), 'Mean': np.float64(0.44748867234739803), 'Std': np.float64(0.264819745211854)}
[I 2024-12-06 23:38:05,417] Trial 334 finished with value: 1.0714285714285714 and parameters: {'x_0_0': 'bc', 'x_0_1': 'oo', 'x_1_0': 'cd', 'x_1_1': 'ad'}. Best is trial 23 with value: 0.5.
2024-12-06 23:38:05,477 - INFO - Candidate Mean Stats: {'Max': np.float64(2.8699267727851883), 'Min': np.float64(-0.9754756042479054), 'Mean': np.float64(0.6792600715389622), 'Std': np.float64(0.5742336584429432)}
2024-12-06 23:38:05,477 - INFO - Candidate Std Stats: {'Max': np.float64(1.6784242926116417), 'Min': np.float64(0.0), 'Mean': np.float64(0.5136894766497715), 'Std': np.float64(0.29810086248330725)}
2024-12-06 23:38:05,484 - INFO - Candidate Mean Stats: {'Max': np.float64(3.6544787493898787), 'Min': np.float64(-0.8636756747402116), 'Mean': np.float64(0.750561321934551), 'Std': np.float64(0.5516586937786196)}
2024-12-06 23:38:05,484 - INFO - Candidate Std Stats: {'Max': np.float64(1.6093040917693813), 'Min': np.float64(0.0), 'Mean': np.float64(0.4770026614425451), 'Std': np.float64(0.2897569723649456)}
2024-12-06 23:38:05,489 - INFO - Candidate Mean Stats: {'Max': np.float64(3.024804896567767), 'Min': np.float64(-0.5946955806638512), 'Mean': np.float64(0.6572458193140578), 'Std': np.float64(0.5516013603845931)}
2024-12-06 23:38:05,489 - INFO - Candidate Std Stats: {'Max': np.float64(1.6125306687548866), 'Min': np.float64(0.0), 'Mean': np.float64(0.5402941119224294), 'Std': np.float64(0.3008614091085672)}
[I 2024-12-06 23:38:05,492] Trial 336 finished with value: 0.7857142857142857 and parameters: {'x_0_0': 'ad', 'x_0_1': 'oo', 'x_1_0': 'bc', 'x_1_1': 'bd'}. Best is trial 76 with value: 0.5.
[I 2024-12-06 23:38:05,499] Trial 336 finished with value: 1.0714285714285714 and parameters: {'x_0_0': 'ac', 'x_0_1': 'oo', 'x_1_0': 'bc', 'x_1_1': 'ab'}. Best is trial 165 with value: 0.5.
[I 2024-12-06 23:38:05,503] Trial 336 finished with value: 1.2857142857142856 and parameters: {'x_0_0': 'bd', 'x_0_1': 'bc', 'x_1_0': 'bd', 'x_1_1': 'ac'}. Best is trial 63 with value: 0.5.
2024-12-06 23:38:05,786 - INFO - Candidate Mean Stats: {'Max': np.float64(3.1690932489335095), 'Min': np.float64(-0.6825758110944684), 'Mean': np.float64(0.6960824081632382), 'Std': np.float64(0.5097691667162333)}
2024-12-06 23:38:05,786 - INFO - Candidate Std Stats: {'Max': np.float64(1.4106859239545504), 'Min': np.float64(0.0), 'Mean': np.float64(0.4684529367812973), 'Std': np.float64(0.28515471002213705)}
[I 2024-12-06 23:38:05,800] Trial 335 finished with value: 1.5714285714285714 and parameters: {'x_0_0': 'bc', 'x_0_1': 'cd', 'x_1_0': 'bc', 'x_1_1': 'bd'}. Best is trial 23 with value: 0.5.
2024-12-06 23:38:05,858 - INFO - Candidate Mean Stats: {'Max': np.float64(3.265151457217912), 'Min': np.float64(-0.934635428324705), 'Mean': np.float64(0.6627306085924892), 'Std': np.float64(0.6175936811806285)}
2024-12-06 23:38:05,858 - INFO - Candidate Std Stats: {'Max': np.float64(1.438440002335064), 'Min': np.float64(0.0), 'Mean': np.float64(0.5282119104641653), 'Std': np.float64(0.29965220792234964)}
2024-12-06 23:38:05,866 - INFO - Candidate Mean Stats: {'Max': np.float64(3.1858770802288086), 'Min': np.float64(-0.9139449978086194), 'Mean': np.float64(0.6790867466749102), 'Std': np.float64(0.5752242429437006)}
2024-12-06 23:38:05,866 - INFO - Candidate Std Stats: {'Max': np.float64(1.724974717773233), 'Min': np.float64(0.0), 'Mean': np.float64(0.5294151437580851), 'Std': np.float64(0.3049995079066352)}
2024-12-06 23:38:05,871 - INFO - Candidate Mean Stats: {'Max': np.float64(2.7501965928361374), 'Min': np.float64(-0.5995460395423438), 'Mean': np.float64(0.6982801902091593), 'Std': np.float64(0.4682586289204174)}
2024-12-06 23:38:05,871 - INFO - Candidate Std Stats: {'Max': np.float64(1.6336243790469038), 'Min': np.float64(0.0), 'Mean': np.float64(0.5240987037678069), 'Std': np.float64(0.3213665216119747)}
[I 2024-12-06 23:38:05,873] Trial 337 finished with value: 1.3214285714285714 and parameters: {'x_0_0': 'bd', 'x_0_1': 'ab', 'x_1_0': 'oo', 'x_1_1': 'ac'}. Best is trial 76 with value: 0.5.
[I 2024-12-06 23:38:05,880] Trial 337 finished with value: 1.3214285714285714 and parameters: {'x_0_0': 'ad', 'x_0_1': 'cd', 'x_1_0': 'oo', 'x_1_1': 'ab'}. Best is trial 165 with value: 0.5.
[I 2024-12-06 23:38:05,885] Trial 337 finished with value: 1.3214285714285714 and parameters: {'x_0_0': 'bd', 'x_0_1': 'ad', 'x_1_0': 'oo', 'x_1_1': 'ac'}. Best is trial 63 with value: 0.5.
2024-12-06 23:38:06,170 - INFO - Candidate Mean Stats: {'Max': np.float64(3.144237993666873), 'Min': np.float64(-0.5670019513714393), 'Mean': np.float64(0.7707765495676585), 'Std': np.float64(0.4854949053792603)}
2024-12-06 23:38:06,170 - INFO - Candidate Std Stats: {'Max': np.float64(1.6146197759225966), 'Min': np.float64(0.0), 'Mean': np.float64(0.4876099125781551), 'Std': np.float64(0.2849445445754488)}
[I 2024-12-06 23:38:06,184] Trial 336 finished with value: 1.2142857142857144 and parameters: {'x_0_0': 'ab', 'x_0_1': 'oo', 'x_1_0': 'cd', 'x_1_1': 'ac'}. Best is trial 23 with value: 0.5.
2024-12-06 23:38:06,239 - INFO - Candidate Mean Stats: {'Max': np.float64(2.8951555376387055), 'Min': np.float64(-0.8555662628204674), 'Mean': np.float64(0.7078963570143804), 'Std': np.float64(0.5872231988246213)}
2024-12-06 23:38:06,239 - INFO - Candidate Std Stats: {'Max': np.float64(1.925330212039886), 'Min': np.float64(0.0), 'Mean': np.float64(0.5769704634879532), 'Std': np.float64(0.3452686555642695)}
2024-12-06 23:38:06,246 - INFO - Candidate Mean Stats: {'Max': np.float64(3.4197043624050187), 'Min': np.float64(-1.1945111875420698), 'Mean': np.float64(0.6149934337318923), 'Std': np.float64(0.6273090422768436)}
2024-12-06 23:38:06,246 - INFO - Candidate Std Stats: {'Max': np.float64(1.7655124580725792), 'Min': np.float64(0.0), 'Mean': np.float64(0.5838305592128588), 'Std': np.float64(0.34206803084487986)}
2024-12-06 23:38:06,253 - INFO - Candidate Mean Stats: {'Max': np.float64(3.01184237335129), 'Min': np.float64(-0.616370946873702), 'Mean': np.float64(0.7406675220210528), 'Std': np.float64(0.46410927440032995)}
2024-12-06 23:38:06,253 - INFO - Candidate Std Stats: {'Max': np.float64(1.8796848348616428), 'Min': np.float64(0.0), 'Mean': np.float64(0.5081775376592758), 'Std': np.float64(0.32020993813423976)}
[I 2024-12-06 23:38:06,254] Trial 338 finished with value: 1.0714285714285714 and parameters: {'x_0_0': 'bc', 'x_0_1': 'oo', 'x_1_0': 'bd', 'x_1_1': 'bd'}. Best is trial 76 with value: 0.5.
[I 2024-12-06 23:38:06,260] Trial 338 finished with value: 1.3214285714285714 and parameters: {'x_0_0': 'ad', 'x_0_1': 'ac', 'x_1_0': 'oo', 'x_1_1': 'cd'}. Best is trial 165 with value: 0.5.
[I 2024-12-06 23:38:06,266] Trial 338 finished with value: 1.375 and parameters: {'x_0_0': 'oo', 'x_0_1': 'oo', 'x_1_0': 'ac', 'x_1_1': 'cd'}. Best is trial 63 with value: 0.5.
2024-12-06 23:38:06,552 - INFO - Candidate Mean Stats: {'Max': np.float64(3.393574680327344), 'Min': np.float64(-0.4671269318597032), 'Mean': np.float64(0.7537943080957065), 'Std': np.float64(0.4747609170212481)}
2024-12-06 23:38:06,552 - INFO - Candidate Std Stats: {'Max': np.float64(1.3338927951833104), 'Min': np.float64(0.0), 'Mean': np.float64(0.4844805915174728), 'Std': np.float64(0.27543489420987743)}
[I 2024-12-06 23:38:06,566] Trial 337 finished with value: 1.0535714285714286 and parameters: {'x_0_0': 'ac', 'x_0_1': 'ab', 'x_1_0': 'oo', 'x_1_1': 'oo'}. Best is trial 23 with value: 0.5.
2024-12-06 23:38:06,624 - INFO - Candidate Mean Stats: {'Max': np.float64(3.579395511884713), 'Min': np.float64(-0.6577862976422808), 'Mean': np.float64(0.7280800933848022), 'Std': np.float64(0.5473366553998575)}
2024-12-06 23:38:06,625 - INFO - Candidate Std Stats: {'Max': np.float64(1.6530940870343465), 'Min': np.float64(0.0), 'Mean': np.float64(0.46870587446952056), 'Std': np.float64(0.2781170209963188)}
2024-12-06 23:38:06,628 - INFO - Candidate Mean Stats: {'Max': np.float64(2.962910836578547), 'Min': np.float64(-1.1048262193307066), 'Mean': np.float64(0.6437938106051547), 'Std': np.float64(0.6053001469004866)}
2024-12-06 23:38:06,628 - INFO - Candidate Std Stats: {'Max': np.float64(1.8411427497764377), 'Min': np.float64(0.0), 'Mean': np.float64(0.5894571911053683), 'Std': np.float64(0.339156191590435)}
2024-12-06 23:38:06,636 - INFO - Candidate Mean Stats: {'Max': np.float64(2.9607635248147104), 'Min': np.float64(-0.5510911444138178), 'Mean': np.float64(0.7458895814263529), 'Std': np.float64(0.4694705787772395)}
2024-12-06 23:38:06,636 - INFO - Candidate Std Stats: {'Max': np.float64(1.5297242512415177), 'Min': np.float64(0.0), 'Mean': np.float64(0.49786963181370736), 'Std': np.float64(0.29569610371121824)}
[I 2024-12-06 23:38:06,638] Trial 339 finished with value: 1.0 and parameters: {'x_0_0': 'oo', 'x_0_1': 'oo', 'x_1_0': 'oo', 'x_1_1': 'oo'}. Best is trial 76 with value: 0.5.
[I 2024-12-06 23:38:06,642] Trial 339 finished with value: 1.1607142857142856 and parameters: {'x_0_0': 'bd', 'x_0_1': 'bd', 'x_1_0': 'bc', 'x_1_1': 'oo'}. Best is trial 165 with value: 0.5.
[I 2024-12-06 23:38:06,650] Trial 339 finished with value: 1.125 and parameters: {'x_0_0': 'oo', 'x_0_1': 'oo', 'x_1_0': 'oo', 'x_1_1': 'ac'}. Best is trial 63 with value: 0.5.
2024-12-06 23:38:06,937 - INFO - Candidate Mean Stats: {'Max': np.float64(3.1111423190890846), 'Min': np.float64(-0.7292530751723147), 'Mean': np.float64(0.7605460304093101), 'Std': np.float64(0.5038469098482004)}
2024-12-06 23:38:06,937 - INFO - Candidate Std Stats: {'Max': np.float64(1.6101404567925728), 'Min': np.float64(0.0), 'Mean': np.float64(0.44753183798306134), 'Std': np.float64(0.2787313204322803)}
[I 2024-12-06 23:38:06,951] Trial 338 finished with value: 1.375 and parameters: {'x_0_0': 'oo', 'x_0_1': 'oo', 'x_1_0': 'cd', 'x_1_1': 'ab'}. Best is trial 23 with value: 0.5.
2024-12-06 23:38:07,005 - INFO - Candidate Mean Stats: {'Max': np.float64(3.267941837457438), 'Min': np.float64(-0.8717597927117284), 'Mean': np.float64(0.6466164575302249), 'Std': np.float64(0.6348129617005506)}
2024-12-06 23:38:07,005 - INFO - Candidate Std Stats: {'Max': np.float64(1.687367462308516), 'Min': np.float64(0.0), 'Mean': np.float64(0.5547887854341728), 'Std': np.float64(0.3247509506711494)}
2024-12-06 23:38:07,011 - INFO - Candidate Mean Stats: {'Max': np.float64(2.9714226327896704), 'Min': np.float64(-0.9388548866505344), 'Mean': np.float64(0.7273369734861833), 'Std': np.float64(0.5515365932616496)}
2024-12-06 23:38:07,011 - INFO - Candidate Std Stats: {'Max': np.float64(2.006634674116325), 'Min': np.float64(0.0), 'Mean': np.float64(0.539870958326802), 'Std': np.float64(0.3357508564509842)}
[I 2024-12-06 23:38:07,020] Trial 340 finished with value: 1.2142857142857144 and parameters: {'x_0_0': 'ab', 'x_0_1': 'oo', 'x_1_0': 'cd', 'x_1_1': 'cd'}. Best is trial 76 with value: 0.5.
2024-12-06 23:38:07,020 - INFO - Candidate Mean Stats: {'Max': np.float64(3.044094402153644), 'Min': np.float64(-0.7492982348241721), 'Mean': np.float64(0.6796711514213527), 'Std': np.float64(0.5407447276576781)}
2024-12-06 23:38:07,020 - INFO - Candidate Std Stats: {'Max': np.float64(1.4661864286411292), 'Min': np.float64(0.0), 'Mean': np.float64(0.5518029769186099), 'Std': np.float64(0.3177949160588486)}
[I 2024-12-06 23:38:07,025] Trial 340 finished with value: 1.1428571428571428 and parameters: {'x_0_0': 'bc', 'x_0_1': 'ad', 'x_1_0': 'ad', 'x_1_1': 'ab'}. Best is trial 165 with value: 0.5.
[I 2024-12-06 23:38:07,034] Trial 340 finished with value: 1.2142857142857144 and parameters: {'x_0_0': 'ab', 'x_0_1': 'oo', 'x_1_0': 'cd', 'x_1_1': 'bc'}. Best is trial 63 with value: 0.5.
2024-12-06 23:38:07,323 - INFO - Candidate Mean Stats: {'Max': np.float64(3.0600987594810998), 'Min': np.float64(-0.3997177939367068), 'Mean': np.float64(0.7777701557715224), 'Std': np.float64(0.5065537112927847)}
2024-12-06 23:38:07,323 - INFO - Candidate Std Stats: {'Max': np.float64(1.5765157945972053), 'Min': np.float64(0.0), 'Mean': np.float64(0.47688386797290166), 'Std': np.float64(0.280061182350431)}
