[I 2024-12-06 23:36:18,093] Trial 43 finished with value: 0.9285714285714286 and parameters: {'x_0_0': 'ad', 'x_0_1': 'oo', 'x_1_0': 'ab', 'x_1_1': 'ad'}. Best is trial 33 with value: 0.6964285714285714.
2024-12-06 23:36:18,238 - INFO - Candidate Mean Stats: {'Max': np.float64(2.0), 'Min': np.float64(-0.8205528433677642), 'Mean': np.float64(0.31794784780693797), 'Std': np.float64(0.38248074671581095)}
2024-12-06 23:36:18,238 - INFO - Candidate Std Stats: {'Max': np.float64(1.588261848049538), 'Min': np.float64(0.0), 'Mean': np.float64(0.5655630667275363), 'Std': np.float64(0.2394618461221393)}
[I 2024-12-06 23:36:18,251] Trial 43 finished with value: 1.1607142857142856 and parameters: {'x_0_0': 'ac', 'x_0_1': 'ad', 'x_1_0': 'bc', 'x_1_1': 'oo'}. Best is trial 23 with value: 0.5.
2024-12-06 23:36:18,371 - INFO - Candidate Mean Stats: {'Max': np.float64(2.0), 'Min': np.float64(-0.8318239836984169), 'Mean': np.float64(0.29976240348501976), 'Std': np.float64(0.40791676558855106)}
2024-12-06 23:36:18,372 - INFO - Candidate Std Stats: {'Max': np.float64(1.5263164809450556), 'Min': np.float64(0.0), 'Mean': np.float64(0.5092829214286786), 'Std': np.float64(0.22967037592089873)}
[I 2024-12-06 23:36:18,385] Trial 44 finished with value: 1.0 and parameters: {'x_0_0': 'bd', 'x_0_1': 'ab', 'x_1_0': 'bc', 'x_1_1': 'ad'}. Best is trial 14 with value: 0.6428571428571428.
2024-12-06 23:36:18,411 - INFO - Candidate Mean Stats: {'Max': np.float64(2.0), 'Min': np.float64(-0.801510748322053), 'Mean': np.float64(0.2728891028820226), 'Std': np.float64(0.4152027737240787)}
2024-12-06 23:36:18,411 - INFO - Candidate Std Stats: {'Max': np.float64(1.4790535352033902), 'Min': np.float64(0.0), 'Mean': np.float64(0.5758704429965316), 'Std': np.float64(0.2381457873660804)}
[I 2024-12-06 23:36:18,426] Trial 44 finished with value: 1.5 and parameters: {'x_0_0': 'cd', 'x_0_1': 'oo', 'x_1_0': 'ac', 'x_1_1': 'ad'}. Best is trial 31 with value: 0.6964285714285714.
2024-12-06 23:36:18,436 - INFO - Candidate Mean Stats: {'Max': np.float64(2.0), 'Min': np.float64(-1.045721537036712), 'Mean': np.float64(0.23763550581461726), 'Std': np.float64(0.45823758973029144)}
2024-12-06 23:36:18,436 - INFO - Candidate Std Stats: {'Max': np.float64(1.701511057091957), 'Min': np.float64(0.0), 'Mean': np.float64(0.6399833235552707), 'Std': np.float64(0.2554759091078293)}
[I 2024-12-06 23:36:18,451] Trial 44 finished with value: 1.0714285714285714 and parameters: {'x_0_0': 'bc', 'x_0_1': 'oo', 'x_1_0': 'ab', 'x_1_1': 'bd'}. Best is trial 33 with value: 0.6964285714285714.
2024-12-06 23:36:18,613 - INFO - Candidate Mean Stats: {'Max': np.float64(2.0), 'Min': np.float64(-0.8880100057681467), 'Mean': np.float64(0.2991000727832558), 'Std': np.float64(0.36190217043045547)}
2024-12-06 23:36:18,613 - INFO - Candidate Std Stats: {'Max': np.float64(1.4438953337016758), 'Min': np.float64(0.0), 'Mean': np.float64(0.5145393407506533), 'Std': np.float64(0.21652617176084876)}
[I 2024-12-06 23:36:18,630] Trial 44 finished with value: 0.6428571428571428 and parameters: {'x_0_0': 'bd', 'x_0_1': 'oo', 'x_1_0': 'bc', 'x_1_1': 'ab'}. Best is trial 23 with value: 0.5.
2024-12-06 23:36:18,777 - INFO - Candidate Mean Stats: {'Max': np.float64(2.0), 'Min': np.float64(-1.2635023128005378), 'Mean': np.float64(0.14019234367138386), 'Std': np.float64(0.508619117494038)}
2024-12-06 23:36:18,778 - INFO - Candidate Std Stats: {'Max': np.float64(1.6386732283136725), 'Min': np.float64(0.0), 'Mean': np.float64(0.6669592983618241), 'Std': np.float64(0.2677250561539429)}
[I 2024-12-06 23:36:18,791] Trial 45 finished with value: 1.5714285714285714 and parameters: {'x_0_0': 'ad', 'x_0_1': 'ab', 'x_1_0': 'ac', 'x_1_1': 'ad'}. Best is trial 14 with value: 0.6428571428571428.
2024-12-06 23:36:18,810 - INFO - Candidate Mean Stats: {'Max': np.float64(2.0), 'Min': np.float64(-1.4912115296549304), 'Mean': np.float64(0.16731052966190973), 'Std': np.float64(0.48682228765176877)}
2024-12-06 23:36:18,810 - INFO - Candidate Std Stats: {'Max': np.float64(1.8919623634123262), 'Min': np.float64(0.0), 'Mean': np.float64(0.6644194782277412), 'Std': np.float64(0.2749229690368418)}
2024-12-06 23:36:18,821 - INFO - Candidate Mean Stats: {'Max': np.float64(2.0), 'Min': np.float64(-1.199192982556739), 'Mean': np.float64(0.17954632916135468), 'Std': np.float64(0.46924259018384773)}
2024-12-06 23:36:18,821 - INFO - Candidate Std Stats: {'Max': np.float64(1.7846248609301345), 'Min': np.float64(0.0), 'Mean': np.float64(0.7005177861344295), 'Std': np.float64(0.2812724220889471)}
[I 2024-12-06 23:36:18,823] Trial 45 finished with value: 0.6964285714285714 and parameters: {'x_0_0': 'ad', 'x_0_1': 'oo', 'x_1_0': 'oo', 'x_1_1': 'oo'}. Best is trial 31 with value: 0.6964285714285714.
[I 2024-12-06 23:36:18,833] Trial 45 finished with value: 1.0714285714285714 and parameters: {'x_0_0': 'ac', 'x_0_1': 'oo', 'x_1_0': 'bc', 'x_1_1': 'bc'}. Best is trial 33 with value: 0.6964285714285714.
2024-12-06 23:36:18,977 - INFO - Candidate Mean Stats: {'Max': np.float64(2.0), 'Min': np.float64(-0.8885093952729379), 'Mean': np.float64(0.17053633710875832), 'Std': np.float64(0.4049206476850382)}
2024-12-06 23:36:18,977 - INFO - Candidate Std Stats: {'Max': np.float64(1.7062872056994014), 'Min': np.float64(0.0), 'Mean': np.float64(0.6509479049000974), 'Std': np.float64(0.25638887781451253)}
[I 2024-12-06 23:36:18,992] Trial 45 finished with value: 1.0714285714285714 and parameters: {'x_0_0': 'bd', 'x_0_1': 'oo', 'x_1_0': 'ad', 'x_1_1': 'ab'}. Best is trial 23 with value: 0.5.
2024-12-06 23:36:19,119 - INFO - Candidate Mean Stats: {'Max': np.float64(2.0), 'Min': np.float64(-1.0450544284546883), 'Mean': np.float64(0.2341574549825811), 'Std': np.float64(0.4469625218840167)}
2024-12-06 23:36:19,119 - INFO - Candidate Std Stats: {'Max': np.float64(2.4217449940495586), 'Min': np.float64(0.0), 'Mean': np.float64(0.6572356160911818), 'Std': np.float64(0.30186583977998327)}
[I 2024-12-06 23:36:19,134] Trial 46 finished with value: 1.5714285714285714 and parameters: {'x_0_0': 'ac', 'x_0_1': 'bd', 'x_1_0': 'ac', 'x_1_1': 'bc'}. Best is trial 14 with value: 0.6428571428571428.
2024-12-06 23:36:19,150 - INFO - Candidate Mean Stats: {'Max': np.float64(2.0), 'Min': np.float64(-1.079627728258023), 'Mean': np.float64(0.29820758962552485), 'Std': np.float64(0.43878518245552794)}
2024-12-06 23:36:19,150 - INFO - Candidate Std Stats: {'Max': np.float64(1.6828738391680917), 'Min': np.float64(0.0), 'Mean': np.float64(0.5237741101179632), 'Std': np.float64(0.2371800750420929)}
[I 2024-12-06 23:36:19,164] Trial 46 finished with value: 1.0714285714285714 and parameters: {'x_0_0': 'bc', 'x_0_1': 'oo', 'x_1_0': 'ac', 'x_1_1': 'bc'}. Best is trial 31 with value: 0.6964285714285714.
2024-12-06 23:36:19,168 - INFO - Candidate Mean Stats: {'Max': np.float64(2.0), 'Min': np.float64(-1.2568869172449533), 'Mean': np.float64(0.2575508457838346), 'Std': np.float64(0.48317016242291894)}
2024-12-06 23:36:19,168 - INFO - Candidate Std Stats: {'Max': np.float64(1.320966661422776), 'Min': np.float64(0.0), 'Mean': np.float64(0.5558397837768688), 'Std': np.float64(0.2303809933612873)}
[I 2024-12-06 23:36:19,182] Trial 46 finished with value: 0.8214285714285714 and parameters: {'x_0_0': 'ac', 'x_0_1': 'oo', 'x_1_0': 'oo', 'x_1_1': 'ac'}. Best is trial 33 with value: 0.6964285714285714.
2024-12-06 23:36:19,341 - INFO - Candidate Mean Stats: {'Max': np.float64(2.0), 'Min': np.float64(-0.8588408131871134), 'Mean': np.float64(0.3044699993057277), 'Std': np.float64(0.3799374443717165)}
2024-12-06 23:36:19,341 - INFO - Candidate Std Stats: {'Max': np.float64(1.6780215020400073), 'Min': np.float64(0.0), 'Mean': np.float64(0.5853347283427877), 'Std': np.float64(0.2396125956439617)}
[I 2024-12-06 23:36:19,355] Trial 46 finished with value: 0.9285714285714286 and parameters: {'x_0_0': 'bd', 'x_0_1': 'oo', 'x_1_0': 'ab', 'x_1_1': 'ab'}. Best is trial 23 with value: 0.5.
2024-12-06 23:36:19,485 - INFO - Candidate Mean Stats: {'Max': np.float64(2.0), 'Min': np.float64(-1.033057364730405), 'Mean': np.float64(0.26007936512146806), 'Std': np.float64(0.4223143875238383)}
2024-12-06 23:36:19,485 - INFO - Candidate Std Stats: {'Max': np.float64(1.808486631621823), 'Min': np.float64(0.0), 'Mean': np.float64(0.6166564029674039), 'Std': np.float64(0.26380011945671133)}
[I 2024-12-06 23:36:19,499] Trial 47 finished with value: 1.3214285714285714 and parameters: {'x_0_0': 'ac', 'x_0_1': 'bd', 'x_1_0': 'oo', 'x_1_1': 'bc'}. Best is trial 14 with value: 0.6428571428571428.
2024-12-06 23:36:19,513 - INFO - Candidate Mean Stats: {'Max': np.float64(2.0), 'Min': np.float64(-0.8510668061729341), 'Mean': np.float64(0.20326968220085906), 'Std': np.float64(0.40239847157143344)}
2024-12-06 23:36:19,514 - INFO - Candidate Std Stats: {'Max': np.float64(1.4569577948325034), 'Min': np.float64(0.0), 'Mean': np.float64(0.5438339076309618), 'Std': np.float64(0.23549058667813758)}
[I 2024-12-06 23:36:19,528] Trial 47 finished with value: 1.3214285714285714 and parameters: {'x_0_0': 'ad', 'x_0_1': 'bc', 'x_1_0': 'oo', 'x_1_1': 'ab'}. Best is trial 31 with value: 0.6964285714285714.
2024-12-06 23:36:19,531 - INFO - Candidate Mean Stats: {'Max': np.float64(2.0), 'Min': np.float64(-1.1301406723228669), 'Mean': np.float64(0.2123218764761996), 'Std': np.float64(0.4416937002658783)}
2024-12-06 23:36:19,531 - INFO - Candidate Std Stats: {'Max': np.float64(2.0055224577387265), 'Min': np.float64(0.0), 'Mean': np.float64(0.6077296112581972), 'Std': np.float64(0.269285489114374)}
[I 2024-12-06 23:36:19,545] Trial 47 finished with value: 1.0714285714285714 and parameters: {'x_0_0': 'bc', 'x_0_1': 'oo', 'x_1_0': 'bc', 'x_1_1': 'cd'}. Best is trial 33 with value: 0.6964285714285714.
2024-12-06 23:36:19,705 - INFO - Candidate Mean Stats: {'Max': np.float64(2.0), 'Min': np.float64(-0.9644492529775499), 'Mean': np.float64(0.3324086537908814), 'Std': np.float64(0.383659295422006)}
2024-12-06 23:36:19,705 - INFO - Candidate Std Stats: {'Max': np.float64(1.6390504973180482), 'Min': np.float64(0.0), 'Mean': np.float64(0.5868572947234701), 'Std': np.float64(0.24653484893373528)}
[I 2024-12-06 23:36:19,718] Trial 47 finished with value: 0.7857142857142857 and parameters: {'x_0_0': 'bd', 'x_0_1': 'oo', 'x_1_0': 'bd', 'x_1_1': 'ac'}. Best is trial 23 with value: 0.5.
2024-12-06 23:36:19,844 - INFO - Candidate Mean Stats: {'Max': np.float64(2.0), 'Min': np.float64(-0.9990606650410129), 'Mean': np.float64(0.28535304089114094), 'Std': np.float64(0.3946938288439015)}
2024-12-06 23:36:19,844 - INFO - Candidate Std Stats: {'Max': np.float64(1.626041113128819), 'Min': np.float64(0.0), 'Mean': np.float64(0.5268255948856263), 'Std': np.float64(0.22728933056162628)}
[I 2024-12-06 23:36:19,860] Trial 48 finished with value: 0.8214285714285714 and parameters: {'x_0_0': 'ad', 'x_0_1': 'oo', 'x_1_0': 'oo', 'x_1_1': 'cd'}. Best is trial 14 with value: 0.6428571428571428.
2024-12-06 23:36:19,869 - INFO - Candidate Mean Stats: {'Max': np.float64(2.0), 'Min': np.float64(-0.7989631443619423), 'Mean': np.float64(0.2859245391905828), 'Std': np.float64(0.4177315912545353)}
2024-12-06 23:36:19,869 - INFO - Candidate Std Stats: {'Max': np.float64(1.5957016165036833), 'Min': np.float64(0.0), 'Mean': np.float64(0.5774211142719559), 'Std': np.float64(0.2360877144525589)}
[I 2024-12-06 23:36:19,884] Trial 48 finished with value: 1.3214285714285714 and parameters: {'x_0_0': 'bd', 'x_0_1': 'ab', 'x_1_0': 'oo', 'x_1_1': 'bc'}. Best is trial 31 with value: 0.6964285714285714.
2024-12-06 23:36:19,893 - INFO - Candidate Mean Stats: {'Max': np.float64(2.0), 'Min': np.float64(-0.9421657880692379), 'Mean': np.float64(0.3014744697029227), 'Std': np.float64(0.4049616893178428)}
2024-12-06 23:36:19,893 - INFO - Candidate Std Stats: {'Max': np.float64(1.61646149688099), 'Min': np.float64(0.0), 'Mean': np.float64(0.5615682645534875), 'Std': np.float64(0.23831199629848715)}
[I 2024-12-06 23:36:19,908] Trial 48 finished with value: 0.8035714285714286 and parameters: {'x_0_0': 'ad', 'x_0_1': 'oo', 'x_1_0': 'ab', 'x_1_1': 'oo'}. Best is trial 33 with value: 0.6964285714285714.
2024-12-06 23:36:20,059 - INFO - Candidate Mean Stats: {'Max': np.float64(2.0), 'Min': np.float64(-1.112844779024771), 'Mean': np.float64(0.2141117650898727), 'Std': np.float64(0.4498856764491345)}
2024-12-06 23:36:20,059 - INFO - Candidate Std Stats: {'Max': np.float64(1.9460151060608797), 'Min': np.float64(0.0), 'Mean': np.float64(0.6719709711002488), 'Std': np.float64(0.28648808116473773)}
[I 2024-12-06 23:36:20,072] Trial 48 finished with value: 0.7857142857142857 and parameters: {'x_0_0': 'bd', 'x_0_1': 'oo', 'x_1_0': 'bc', 'x_1_1': 'bc'}. Best is trial 23 with value: 0.5.
2024-12-06 23:36:20,193 - INFO - Candidate Mean Stats: {'Max': np.float64(2.0), 'Min': np.float64(-0.8141682190589027), 'Mean': np.float64(0.3165521288692413), 'Std': np.float64(0.37571514652121385)}
2024-12-06 23:36:20,194 - INFO - Candidate Std Stats: {'Max': np.float64(1.6479795909575223), 'Min': np.float64(0.0), 'Mean': np.float64(0.5465202562724125), 'Std': np.float64(0.227901176898176)}
[I 2024-12-06 23:36:20,209] Trial 49 finished with value: 1.0714285714285714 and parameters: {'x_0_0': 'bd', 'x_0_1': 'oo', 'x_1_0': 'ac', 'x_1_1': 'ad'}. Best is trial 14 with value: 0.6428571428571428.
2024-12-06 23:36:20,216 - INFO - Candidate Mean Stats: {'Max': np.float64(2.0), 'Min': np.float64(-1.3468616819005153), 'Mean': np.float64(0.22324918190624396), 'Std': np.float64(0.440943429496747)}
2024-12-06 23:36:20,216 - INFO - Candidate Std Stats: {'Max': np.float64(1.6097427082379259), 'Min': np.float64(0.0), 'Mean': np.float64(0.5944574035582643), 'Std': np.float64(0.2368664227005084)}
[I 2024-12-06 23:36:20,232] Trial 49 finished with value: 0.9464285714285714 and parameters: {'x_0_0': 'bc', 'x_0_1': 'oo', 'x_1_0': 'bd', 'x_1_1': 'oo'}. Best is trial 31 with value: 0.6964285714285714.
2024-12-06 23:36:20,234 - INFO - Candidate Mean Stats: {'Max': np.float64(2.0), 'Min': np.float64(-1.1324844033441948), 'Mean': np.float64(0.24784354011670312), 'Std': np.float64(0.4312710643545395)}
2024-12-06 23:36:20,234 - INFO - Candidate Std Stats: {'Max': np.float64(1.5081449581312123), 'Min': np.float64(0.0), 'Mean': np.float64(0.5534365771596503), 'Std': np.float64(0.23476232155876384)}
[I 2024-12-06 23:36:20,249] Trial 49 finished with value: 1.0714285714285714 and parameters: {'x_0_0': 'ac', 'x_0_1': 'oo', 'x_1_0': 'ad', 'x_1_1': 'cd'}. Best is trial 33 with value: 0.6964285714285714.
2024-12-06 23:36:20,418 - INFO - Candidate Mean Stats: {'Max': np.float64(2.0), 'Min': np.float64(-0.8645770387732847), 'Mean': np.float64(0.2741839042986322), 'Std': np.float64(0.411495282856347)}
2024-12-06 23:36:20,418 - INFO - Candidate Std Stats: {'Max': np.float64(1.5114269287974926), 'Min': np.float64(0.0), 'Mean': np.float64(0.549853758515462), 'Std': np.float64(0.2313083541655696)}
[I 2024-12-06 23:36:20,430] Trial 49 finished with value: 1.0714285714285714 and parameters: {'x_0_0': 'ad', 'x_0_1': 'oo', 'x_1_0': 'ac', 'x_1_1': 'ab'}. Best is trial 23 with value: 0.5.
2024-12-06 23:36:20,555 - INFO - Candidate Mean Stats: {'Max': np.float64(2.0), 'Min': np.float64(-0.7497044582867549), 'Mean': np.float64(0.2154533871632193), 'Std': np.float64(0.42664888109733207)}
2024-12-06 23:36:20,555 - INFO - Candidate Std Stats: {'Max': np.float64(1.6232702660547722), 'Min': np.float64(0.0), 'Mean': np.float64(0.583245982905002), 'Std': np.float64(0.24669527976991987)}
[I 2024-12-06 23:36:20,567] Trial 50 finished with value: 1.3214285714285714 and parameters: {'x_0_0': 'ad', 'x_0_1': 'ac', 'x_1_0': 'oo', 'x_1_1': 'ac'}. Best is trial 14 with value: 0.6428571428571428.
2024-12-06 23:36:20,576 - INFO - Candidate Mean Stats: {'Max': np.float64(2.0), 'Min': np.float64(-0.8960091023362662), 'Mean': np.float64(0.2951508962916748), 'Std': np.float64(0.43381726992338493)}
2024-12-06 23:36:20,576 - INFO - Candidate Std Stats: {'Max': np.float64(1.4129625672403112), 'Min': np.float64(0.0), 'Mean': np.float64(0.5637260248342117), 'Std': np.float64(0.2354358819356953)}
[I 2024-12-06 23:36:20,588] Trial 50 finished with value: 0.6607142857142857 and parameters: {'x_0_0': 'ad', 'x_0_1': 'oo', 'x_1_0': 'bd', 'x_1_1': 'oo'}. Best is trial 50 with value: 0.6607142857142857.
2024-12-06 23:36:20,601 - INFO - Candidate Mean Stats: {'Max': np.float64(2.0), 'Min': np.float64(-0.9850017073790646), 'Mean': np.float64(0.2716637019299465), 'Std': np.float64(0.4108110307275734)}
2024-12-06 23:36:20,601 - INFO - Candidate Std Stats: {'Max': np.float64(1.6598963712160224), 'Min': np.float64(0.0), 'Mean': np.float64(0.5422175098999042), 'Std': np.float64(0.2222468713417336)}
[I 2024-12-06 23:36:20,613] Trial 50 finished with value: 0.8214285714285714 and parameters: {'x_0_0': 'ac', 'x_0_1': 'oo', 'x_1_0': 'oo', 'x_1_1': 'cd'}. Best is trial 33 with value: 0.6964285714285714.
2024-12-06 23:36:20,753 - INFO - Candidate Mean Stats: {'Max': np.float64(2.0), 'Min': np.float64(-0.9327726945835779), 'Mean': np.float64(0.24226107686397963), 'Std': np.float64(0.40492564065180375)}
2024-12-06 23:36:20,753 - INFO - Candidate Std Stats: {'Max': np.float64(1.411056503875931), 'Min': np.float64(0.0), 'Mean': np.float64(0.5201940477929026), 'Std': np.float64(0.21601953997442624)}
[I 2024-12-06 23:36:20,765] Trial 50 finished with value: 1.2142857142857144 and parameters: {'x_0_0': 'ab', 'x_0_1': 'oo', 'x_1_0': 'ad', 'x_1_1': 'ac'}. Best is trial 23 with value: 0.5.
2024-12-06 23:36:20,883 - INFO - Candidate Mean Stats: {'Max': np.float64(2.0), 'Min': np.float64(-0.8932714140658687), 'Mean': np.float64(0.21879344705156417), 'Std': np.float64(0.421676530628507)}
2024-12-06 23:36:20,883 - INFO - Candidate Std Stats: {'Max': np.float64(1.5849482723535249), 'Min': np.float64(0.0), 'Mean': np.float64(0.5829928893721956), 'Std': np.float64(0.25474168169352734)}
[I 2024-12-06 23:36:20,896] Trial 51 finished with value: 0.7857142857142857 and parameters: {'x_0_0': 'bd', 'x_0_1': 'oo', 'x_1_0': 'bd', 'x_1_1': 'ad'}. Best is trial 14 with value: 0.6428571428571428.
2024-12-06 23:36:20,902 - INFO - Candidate Mean Stats: {'Max': np.float64(2.0), 'Min': np.float64(-0.8355667141652615), 'Mean': np.float64(0.3106294949967654), 'Std': np.float64(0.4088397071962122)}
2024-12-06 23:36:20,902 - INFO - Candidate Std Stats: {'Max': np.float64(1.3434282751049227), 'Min': np.float64(0.0), 'Mean': np.float64(0.5743827364343336), 'Std': np.float64(0.22455674560248123)}
[I 2024-12-06 23:36:20,914] Trial 51 finished with value: 1.0714285714285714 and parameters: {'x_0_0': 'ac', 'x_0_1': 'oo', 'x_1_0': 'bd', 'x_1_1': 'ad'}. Best is trial 50 with value: 0.6607142857142857.
2024-12-06 23:36:20,929 - INFO - Candidate Mean Stats: {'Max': np.float64(2.0), 'Min': np.float64(-1.1742405045688997), 'Mean': np.float64(0.2886873337186098), 'Std': np.float64(0.44451660005536636)}
2024-12-06 23:36:20,929 - INFO - Candidate Std Stats: {'Max': np.float64(1.6187452507824396), 'Min': np.float64(0.0), 'Mean': np.float64(0.594934475029192), 'Std': np.float64(0.2563317601752842)}
[I 2024-12-06 23:36:20,941] Trial 51 finished with value: 1.0714285714285714 and parameters: {'x_0_0': 'ac', 'x_0_1': 'oo', 'x_1_0': 'cd', 'x_1_1': 'bc'}. Best is trial 33 with value: 0.6964285714285714.
2024-12-06 23:36:21,097 - INFO - Candidate Mean Stats: {'Max': np.float64(2.0), 'Min': np.float64(-0.9797172315469691), 'Mean': np.float64(0.21729073913385114), 'Std': np.float64(0.4060383832132428)}
2024-12-06 23:36:21,097 - INFO - Candidate Std Stats: {'Max': np.float64(1.5791822597114655), 'Min': np.float64(0.0), 'Mean': np.float64(0.6136543302817367), 'Std': np.float64(0.25694258772170536)}
[I 2024-12-06 23:36:21,112] Trial 51 finished with value: 0.9464285714285714 and parameters: {'x_0_0': 'bd', 'x_0_1': 'oo', 'x_1_0': 'ad', 'x_1_1': 'oo'}. Best is trial 23 with value: 0.5.
2024-12-06 23:36:21,232 - INFO - Candidate Mean Stats: {'Max': np.float64(2.0), 'Min': np.float64(-1.0523972284320844), 'Mean': np.float64(0.25466598590370204), 'Std': np.float64(0.4566826401563273)}
2024-12-06 23:36:21,232 - INFO - Candidate Std Stats: {'Max': np.float64(1.6185213847342625), 'Min': np.float64(0.0), 'Mean': np.float64(0.5712620673657354), 'Std': np.float64(0.24501670964198546)}
[I 2024-12-06 23:36:21,244] Trial 52 finished with value: 0.8214285714285714 and parameters: {'x_0_0': 'ac', 'x_0_1': 'oo', 'x_1_0': 'oo', 'x_1_1': 'cd'}. Best is trial 14 with value: 0.6428571428571428.
2024-12-06 23:36:21,245 - INFO - Candidate Mean Stats: {'Max': np.float64(2.0), 'Min': np.float64(-0.8920116362798829), 'Mean': np.float64(0.3275890102914323), 'Std': np.float64(0.40279630417828444)}
2024-12-06 23:36:21,245 - INFO - Candidate Std Stats: {'Max': np.float64(1.6183337355497354), 'Min': np.float64(0.0), 'Mean': np.float64(0.5969156690150429), 'Std': np.float64(0.2547051355198872)}
[I 2024-12-06 23:36:21,258] Trial 52 finished with value: 0.6607142857142857 and parameters: {'x_0_0': 'bd', 'x_0_1': 'oo', 'x_1_0': 'bd', 'x_1_1': 'oo'}. Best is trial 50 with value: 0.6607142857142857.
2024-12-06 23:36:21,280 - INFO - Candidate Mean Stats: {'Max': np.float64(2.0), 'Min': np.float64(-1.1180725500456705), 'Mean': np.float64(0.313948095209133), 'Std': np.float64(0.45509877385407244)}
2024-12-06 23:36:21,280 - INFO - Candidate Std Stats: {'Max': np.float64(1.6206306079615054), 'Min': np.float64(0.0), 'Mean': np.float64(0.6208361152155147), 'Std': np.float64(0.24886397074102354)}
