[I 2024-12-07 01:15:09,725] Trial 256 finished with value: 1.4666666666666666 and parameters: {'x_0_0': 'ad', 'x_0_1': 'bd', 'x_0_2': 'ac', 'x_1_0': 'oo', 'x_1_1': 'bc', 'x_1_2': 'bd'}. Best is trial 200 with value: 0.6.
2024-12-07 01:15:12,544 - INFO - Candidate Mean Stats: {'Max': np.float64(2.0), 'Min': np.float64(0.24462067170545304), 'Mean': np.float64(0.4850531020986264), 'Std': np.float64(0.07819073433092356)}
2024-12-07 01:15:12,544 - INFO - Candidate Std Stats: {'Max': np.float64(0.559078566656734), 'Min': np.float64(0.0), 'Mean': np.float64(0.09861005135745027), 'Std': np.float64(0.04273975586922966)}
[I 2024-12-07 01:15:12,590] Trial 257 finished with value: 1.0444444444444443 and parameters: {'x_0_0': 'ad', 'x_0_1': 'oo', 'x_0_2': 'bc', 'x_1_0': 'bc', 'x_1_1': 'cd', 'x_1_2': 'cd'}. Best is trial 148 with value: 0.8333333333333333.
2024-12-07 01:15:14,618 - INFO - Candidate Mean Stats: {'Max': np.float64(2.0), 'Min': np.float64(0.2697088468680977), 'Mean': np.float64(0.4894288555930445), 'Std': np.float64(0.07445743620427812)}
2024-12-07 01:15:14,618 - INFO - Candidate Std Stats: {'Max': np.float64(1.4901957224614073), 'Min': np.float64(0.0), 'Mean': np.float64(0.10131206197646946), 'Std': np.float64(0.050360503349214866)}
[I 2024-12-07 01:15:14,662] Trial 256 finished with value: 1.3555555555555556 and parameters: {'x_0_0': 'ac', 'x_0_1': 'ab', 'x_0_2': 'ad', 'x_1_0': 'bc', 'x_1_1': 'oo', 'x_1_2': 'oo'}. Best is trial 74 with value: 0.8222222222222222.
2024-12-07 01:15:21,851 - INFO - Candidate Mean Stats: {'Max': np.float64(2.0), 'Min': np.float64(0.2343259449409784), 'Mean': np.float64(0.48083366827222324), 'Std': np.float64(0.0750094910126165)}
2024-12-07 01:15:21,852 - INFO - Candidate Std Stats: {'Max': np.float64(0.3633719217463242), 'Min': np.float64(0.0), 'Mean': np.float64(0.10151698052176095), 'Std': np.float64(0.04191573212251547)}
[I 2024-12-07 01:15:21,898] Trial 257 finished with value: 1.0444444444444443 and parameters: {'x_0_0': 'bd', 'x_0_1': 'oo', 'x_0_2': 'bd', 'x_1_0': 'bd', 'x_1_1': 'ac', 'x_1_2': 'ab'}. Best is trial 49 with value: 0.7999999999999999.
2024-12-07 01:15:30,438 - INFO - Candidate Mean Stats: {'Max': np.float64(2.0), 'Min': np.float64(0.19159166780431075), 'Mean': np.float64(0.48847448059429255), 'Std': np.float64(0.07728903935894621)}
2024-12-07 01:15:30,438 - INFO - Candidate Std Stats: {'Max': np.float64(0.38733179644585375), 'Min': np.float64(0.0), 'Mean': np.float64(0.10147133509661933), 'Std': np.float64(0.04271249891587061)}
[I 2024-12-07 01:15:30,479] Trial 257 finished with value: 1.2666666666666666 and parameters: {'x_0_0': 'ac', 'x_0_1': 'oo', 'x_0_2': 'ad', 'x_1_0': 'ac', 'x_1_1': 'ad', 'x_1_2': 'ac'}. Best is trial 200 with value: 0.6.
2024-12-07 01:15:33,298 - INFO - Candidate Mean Stats: {'Max': np.float64(2.0), 'Min': np.float64(0.2518780130898384), 'Mean': np.float64(0.4852236042010679), 'Std': np.float64(0.07655245518601178)}
2024-12-07 01:15:33,299 - INFO - Candidate Std Stats: {'Max': np.float64(0.5523567634287194), 'Min': np.float64(0.0), 'Mean': np.float64(0.0987075400911073), 'Std': np.float64(0.04130597291298391)}
[I 2024-12-07 01:15:33,344] Trial 258 finished with value: 0.8444444444444444 and parameters: {'x_0_0': 'bd', 'x_0_1': 'oo', 'x_0_2': 'ab', 'x_1_0': 'bd', 'x_1_1': 'oo', 'x_1_2': 'oo'}. Best is trial 148 with value: 0.8333333333333333.
2024-12-07 01:15:35,280 - INFO - Candidate Mean Stats: {'Max': np.float64(2.0), 'Min': np.float64(0.20770944427104826), 'Mean': np.float64(0.4890029307753393), 'Std': np.float64(0.07472641770081515)}
2024-12-07 01:15:35,281 - INFO - Candidate Std Stats: {'Max': np.float64(0.342764736516344), 'Min': np.float64(0.0), 'Mean': np.float64(0.10117884848922552), 'Std': np.float64(0.040401454921279105)}
[I 2024-12-07 01:15:35,324] Trial 257 finished with value: 1.3 and parameters: {'x_0_0': 'oo', 'x_0_1': 'oo', 'x_0_2': 'cd', 'x_1_0': 'oo', 'x_1_1': 'bc', 'x_1_2': 'ac'}. Best is trial 74 with value: 0.8222222222222222.
2024-12-07 01:15:42,514 - INFO - Candidate Mean Stats: {'Max': np.float64(2.0), 'Min': np.float64(0.16254872480881005), 'Mean': np.float64(0.4790766999903307), 'Std': np.float64(0.07681321185835352)}
2024-12-07 01:15:42,515 - INFO - Candidate Std Stats: {'Max': np.float64(0.6233545335168242), 'Min': np.float64(0.0), 'Mean': np.float64(0.10829964169031983), 'Std': np.float64(0.052461593592393774)}
[I 2024-12-07 01:15:42,559] Trial 258 finished with value: 1.6666666666666665 and parameters: {'x_0_0': 'bd', 'x_0_1': 'bd', 'x_0_2': 'bd', 'x_1_0': 'cd', 'x_1_1': 'cd', 'x_1_2': 'bd'}. Best is trial 49 with value: 0.7999999999999999.
2024-12-07 01:15:51,088 - INFO - Candidate Mean Stats: {'Max': np.float64(2.0), 'Min': np.float64(0.2449929383267651), 'Mean': np.float64(0.49083625116740526), 'Std': np.float64(0.07656529534614907)}
2024-12-07 01:15:51,088 - INFO - Candidate Std Stats: {'Max': np.float64(0.5586576696096036), 'Min': np.float64(0.0), 'Mean': np.float64(0.09982411213072684), 'Std': np.float64(0.042551908268952415)}
[I 2024-12-07 01:15:51,131] Trial 258 finished with value: 1.6666666666666665 and parameters: {'x_0_0': 'ac', 'x_0_1': 'cd', 'x_0_2': 'ad', 'x_1_0': 'cd', 'x_1_1': 'bd', 'x_1_2': 'ac'}. Best is trial 200 with value: 0.6.
2024-12-07 01:15:53,529 - INFO - Candidate Mean Stats: {'Max': np.float64(2.0), 'Min': np.float64(0.14871902380126834), 'Mean': np.float64(0.4991160132706151), 'Std': np.float64(0.08024055627132036)}
2024-12-07 01:15:53,529 - INFO - Candidate Std Stats: {'Max': np.float64(0.6515005264612237), 'Min': np.float64(0.0), 'Mean': np.float64(0.10957842518951175), 'Std': np.float64(0.05182513022571477)}
[I 2024-12-07 01:15:53,571] Trial 259 finished with value: 1.4666666666666666 and parameters: {'x_0_0': 'ad', 'x_0_1': 'ad', 'x_0_2': 'bd', 'x_1_0': 'oo', 'x_1_1': 'ab', 'x_1_2': 'ab'}. Best is trial 148 with value: 0.8333333333333333.
2024-12-07 01:15:55,971 - INFO - Candidate Mean Stats: {'Max': np.float64(2.0), 'Min': np.float64(0.29573124856699906), 'Mean': np.float64(0.4898896743987651), 'Std': np.float64(0.06939650179965147)}
2024-12-07 01:15:55,971 - INFO - Candidate Std Stats: {'Max': np.float64(0.380749747204147), 'Min': np.float64(0.0), 'Mean': np.float64(0.09085272986530549), 'Std': np.float64(0.03861521160537158)}
[I 2024-12-07 01:15:56,014] Trial 258 finished with value: 1.1444444444444444 and parameters: {'x_0_0': 'bc', 'x_0_1': 'ac', 'x_0_2': 'bd', 'x_1_0': 'oo', 'x_1_1': 'oo', 'x_1_2': 'ab'}. Best is trial 74 with value: 0.8222222222222222.
2024-12-07 01:16:03,100 - INFO - Candidate Mean Stats: {'Max': np.float64(2.0), 'Min': np.float64(0.18540470292668482), 'Mean': np.float64(0.4752429647041562), 'Std': np.float64(0.08226748091108504)}
2024-12-07 01:16:03,100 - INFO - Candidate Std Stats: {'Max': np.float64(0.40262379048984825), 'Min': np.float64(0.0), 'Mean': np.float64(0.10786661591319405), 'Std': np.float64(0.04817421230810196)}
[I 2024-12-07 01:16:03,145] Trial 259 finished with value: 1.0666666666666667 and parameters: {'x_0_0': 'bd', 'x_0_1': 'oo', 'x_0_2': 'oo', 'x_1_0': 'cd', 'x_1_1': 'ab', 'x_1_2': 'oo'}. Best is trial 49 with value: 0.7999999999999999.
2024-12-07 01:16:11,841 - INFO - Candidate Mean Stats: {'Max': np.float64(2.0), 'Min': np.float64(0.2142284421156706), 'Mean': np.float64(0.47409769429271287), 'Std': np.float64(0.07734633582686844)}
2024-12-07 01:16:11,842 - INFO - Candidate Std Stats: {'Max': np.float64(0.4655917750233001), 'Min': np.float64(0.0), 'Mean': np.float64(0.10489504876170411), 'Std': np.float64(0.047402525067577916)}
[I 2024-12-07 01:16:11,887] Trial 259 finished with value: 1.4444444444444444 and parameters: {'x_0_0': 'bd', 'x_0_1': 'ac', 'x_0_2': 'bc', 'x_1_0': 'bd', 'x_1_1': 'cd', 'x_1_2': 'ab'}. Best is trial 200 with value: 0.6.
2024-12-07 01:16:14,077 - INFO - Candidate Mean Stats: {'Max': np.float64(2.0), 'Min': np.float64(0.2469625784202118), 'Mean': np.float64(0.478162049391059), 'Std': np.float64(0.07682327998180875)}
2024-12-07 01:16:14,077 - INFO - Candidate Std Stats: {'Max': np.float64(1.5736326117670143), 'Min': np.float64(0.0), 'Mean': np.float64(0.10770470374577533), 'Std': np.float64(0.051897775448626025)}
[I 2024-12-07 01:16:14,123] Trial 260 finished with value: 1.1777777777777778 and parameters: {'x_0_0': 'ab', 'x_0_1': 'oo', 'x_0_2': 'bd', 'x_1_0': 'oo', 'x_1_1': 'bd', 'x_1_2': 'bc'}. Best is trial 148 with value: 0.8333333333333333.
2024-12-07 01:16:16,599 - INFO - Candidate Mean Stats: {'Max': np.float64(2.0), 'Min': np.float64(0.27163001884857885), 'Mean': np.float64(0.47718878825177236), 'Std': np.float64(0.07667198344066369)}
2024-12-07 01:16:16,600 - INFO - Candidate Std Stats: {'Max': np.float64(0.8490659521246173), 'Min': np.float64(0.0), 'Mean': np.float64(0.10643193294181012), 'Std': np.float64(0.04733013971170147)}
[I 2024-12-07 01:16:16,643] Trial 259 finished with value: 1.2666666666666666 and parameters: {'x_0_0': 'ac', 'x_0_1': 'oo', 'x_0_2': 'bd', 'x_1_0': 'ad', 'x_1_1': 'bd', 'x_1_2': 'ac'}. Best is trial 74 with value: 0.8222222222222222.
2024-12-07 01:16:23,841 - INFO - Candidate Mean Stats: {'Max': np.float64(2.0), 'Min': np.float64(0.23630490165577606), 'Mean': np.float64(0.4848691040456632), 'Std': np.float64(0.07761282199751428)}
2024-12-07 01:16:23,842 - INFO - Candidate Std Stats: {'Max': np.float64(1.3291526800910678), 'Min': np.float64(0.0), 'Mean': np.float64(0.1108728965914132), 'Std': np.float64(0.054421779522337885)}
[I 2024-12-07 01:16:23,886] Trial 260 finished with value: 1.9 and parameters: {'x_0_0': 'cd', 'x_0_1': 'bd', 'x_0_2': 'ab', 'x_1_0': 'ab', 'x_1_1': 'oo', 'x_1_2': 'bc'}. Best is trial 49 with value: 0.7999999999999999.
2024-12-07 01:16:32,377 - INFO - Candidate Mean Stats: {'Max': np.float64(2.0), 'Min': np.float64(0.2455198715472009), 'Mean': np.float64(0.4912343989324412), 'Std': np.float64(0.0746252386627183)}
2024-12-07 01:16:32,379 - INFO - Candidate Std Stats: {'Max': np.float64(0.6260631042898861), 'Min': np.float64(0.0), 'Mean': np.float64(0.10313924352097971), 'Std': np.float64(0.043669875249976405)}
[I 2024-12-07 01:16:32,419] Trial 260 finished with value: 1.6666666666666665 and parameters: {'x_0_0': 'bc', 'x_0_1': 'bd', 'x_0_2': 'bc', 'x_1_0': 'bc', 'x_1_1': 'ab', 'x_1_2': 'ad'}. Best is trial 200 with value: 0.6.
2024-12-07 01:16:34,517 - INFO - Candidate Mean Stats: {'Max': np.float64(2.0), 'Min': np.float64(0.29660747644874175), 'Mean': np.float64(0.4915998794751075), 'Std': np.float64(0.07279129399607229)}
2024-12-07 01:16:34,517 - INFO - Candidate Std Stats: {'Max': np.float64(0.3883200371909689), 'Min': np.float64(0.0), 'Mean': np.float64(0.09664004417938193), 'Std': np.float64(0.04040085724685993)}
[I 2024-12-07 01:16:34,560] Trial 261 finished with value: 1.1666666666666665 and parameters: {'x_0_0': 'bc', 'x_0_1': 'oo', 'x_0_2': 'oo', 'x_1_0': 'cd', 'x_1_1': 'bd', 'x_1_2': 'cd'}. Best is trial 148 with value: 0.8333333333333333.
2024-12-07 01:16:37,227 - INFO - Candidate Mean Stats: {'Max': np.float64(2.0), 'Min': np.float64(0.24971468687001153), 'Mean': np.float64(0.4913081943047359), 'Std': np.float64(0.07480153695056563)}
2024-12-07 01:16:37,227 - INFO - Candidate Std Stats: {'Max': np.float64(0.8692757494836826), 'Min': np.float64(0.0), 'Mean': np.float64(0.10380971313866354), 'Std': np.float64(0.04445750942682412)}
[I 2024-12-07 01:16:37,274] Trial 260 finished with value: 1.0444444444444443 and parameters: {'x_0_0': 'bc', 'x_0_1': 'ac', 'x_0_2': 'oo', 'x_1_0': 'oo', 'x_1_1': 'oo', 'x_1_2': 'cd'}. Best is trial 74 with value: 0.8222222222222222.
2024-12-07 01:16:44,177 - INFO - Candidate Mean Stats: {'Max': np.float64(2.0), 'Min': np.float64(0.24812902529254077), 'Mean': np.float64(0.49073997464083813), 'Std': np.float64(0.07638833696681717)}
2024-12-07 01:16:44,178 - INFO - Candidate Std Stats: {'Max': np.float64(1.437905508722359), 'Min': np.float64(0.0), 'Mean': np.float64(0.09830307048901646), 'Std': np.float64(0.04324474666532451)}
[I 2024-12-07 01:16:44,219] Trial 261 finished with value: 1.0444444444444443 and parameters: {'x_0_0': 'ad', 'x_0_1': 'oo', 'x_0_2': 'bd', 'x_1_0': 'bd', 'x_1_1': 'ab', 'x_1_2': 'cd'}. Best is trial 49 with value: 0.7999999999999999.
2024-12-07 01:16:53,055 - INFO - Candidate Mean Stats: {'Max': np.float64(2.0), 'Min': np.float64(0.24054474483667673), 'Mean': np.float64(0.48392804872975675), 'Std': np.float64(0.08070275474145887)}
2024-12-07 01:16:53,055 - INFO - Candidate Std Stats: {'Max': np.float64(1.4904738303502736), 'Min': np.float64(0.0), 'Mean': np.float64(0.11527349461055218), 'Std': np.float64(0.056245089091731)}
[I 2024-12-07 01:16:53,102] Trial 261 finished with value: 1.5777777777777777 and parameters: {'x_0_0': 'ab', 'x_0_1': 'bc', 'x_0_2': 'cd', 'x_1_0': 'oo', 'x_1_1': 'bd', 'x_1_2': 'ab'}. Best is trial 200 with value: 0.6.
2024-12-07 01:16:54,838 - INFO - Candidate Mean Stats: {'Max': np.float64(2.0), 'Min': np.float64(0.22988182538711346), 'Mean': np.float64(0.4918800586864897), 'Std': np.float64(0.081087556018317)}
2024-12-07 01:16:54,838 - INFO - Candidate Std Stats: {'Max': np.float64(1.4804218437760601), 'Min': np.float64(0.0), 'Mean': np.float64(0.11222010237194759), 'Std': np.float64(0.050444120074491054)}
[I 2024-12-07 01:16:54,882] Trial 262 finished with value: 1.2666666666666666 and parameters: {'x_0_0': 'bc', 'x_0_1': 'oo', 'x_0_2': 'ab', 'x_1_0': 'bc', 'x_1_1': 'cd', 'x_1_2': 'cd'}. Best is trial 148 with value: 0.8333333333333333.
2024-12-07 01:16:57,824 - INFO - Candidate Mean Stats: {'Max': np.float64(2.0), 'Min': np.float64(0.28055249000224364), 'Mean': np.float64(0.4900825544681326), 'Std': np.float64(0.06959358151531549)}
2024-12-07 01:16:57,824 - INFO - Candidate Std Stats: {'Max': np.float64(0.3149657291304058), 'Min': np.float64(0.0), 'Mean': np.float64(0.09611525923883305), 'Std': np.float64(0.03964968708516472)}
[I 2024-12-07 01:16:57,866] Trial 261 finished with value: 1.0666666666666667 and parameters: {'x_0_0': 'ad', 'x_0_1': 'oo', 'x_0_2': 'ad', 'x_1_0': 'oo', 'x_1_1': 'ad', 'x_1_2': 'ab'}. Best is trial 74 with value: 0.8222222222222222.
2024-12-07 01:17:04,985 - INFO - Candidate Mean Stats: {'Max': np.float64(2.0), 'Min': np.float64(0.23992900760244734), 'Mean': np.float64(0.4877440856011441), 'Std': np.float64(0.07147896880348525)}
2024-12-07 01:17:04,986 - INFO - Candidate Std Stats: {'Max': np.float64(0.7607966082952519), 'Min': np.float64(0.0), 'Mean': np.float64(0.10076604056528067), 'Std': np.float64(0.046607278105729295)}
[I 2024-12-07 01:17:05,034] Trial 262 finished with value: 1.6777777777777776 and parameters: {'x_0_0': 'ab', 'x_0_1': 'cd', 'x_0_2': 'oo', 'x_1_0': 'bc', 'x_1_1': 'bd', 'x_1_2': 'ab'}. Best is trial 49 with value: 0.7999999999999999.
2024-12-07 01:17:13,858 - INFO - Candidate Mean Stats: {'Max': np.float64(2.0), 'Min': np.float64(0.25025550599828705), 'Mean': np.float64(0.49559863591770675), 'Std': np.float64(0.07129135283773526)}
2024-12-07 01:17:13,859 - INFO - Candidate Std Stats: {'Max': np.float64(0.3746951971619279), 'Min': np.float64(0.0), 'Mean': np.float64(0.10057869231211666), 'Std': np.float64(0.03906883243997958)}
[I 2024-12-07 01:17:13,904] Trial 262 finished with value: 1.2777777777777777 and parameters: {'x_0_0': 'ab', 'x_0_1': 'oo', 'x_0_2': 'oo', 'x_1_0': 'bc', 'x_1_1': 'ac', 'x_1_2': 'cd'}. Best is trial 200 with value: 0.6.
2024-12-07 01:17:15,519 - INFO - Candidate Mean Stats: {'Max': np.float64(2.0), 'Min': np.float64(-0.0075743703289787075), 'Mean': np.float64(0.4867748580827355), 'Std': np.float64(0.08584203285484279)}
2024-12-07 01:17:15,519 - INFO - Candidate Std Stats: {'Max': np.float64(0.5801656108181368), 'Min': np.float64(0.0), 'Mean': np.float64(0.11179277936187962), 'Std': np.float64(0.054247070661852165)}
[I 2024-12-07 01:17:15,566] Trial 263 finished with value: 1.4444444444444444 and parameters: {'x_0_0': 'bd', 'x_0_1': 'bd', 'x_0_2': 'ab', 'x_1_0': 'bd', 'x_1_1': 'ad', 'x_1_2': 'ab'}. Best is trial 148 with value: 0.8333333333333333.
2024-12-07 01:17:19,076 - INFO - Candidate Mean Stats: {'Max': np.float64(2.0), 'Min': np.float64(0.18875742974817178), 'Mean': np.float64(0.5001358695662255), 'Std': np.float64(0.07569758453661338)}
2024-12-07 01:17:19,077 - INFO - Candidate Std Stats: {'Max': np.float64(0.6363047507177887), 'Min': np.float64(0.0), 'Mean': np.float64(0.11019922871820434), 'Std': np.float64(0.05172589137355908)}
[I 2024-12-07 01:17:19,122] Trial 262 finished with value: 1.5777777777777777 and parameters: {'x_0_0': 'ab', 'x_0_1': 'ad', 'x_0_2': 'oo', 'x_1_0': 'ab', 'x_1_1': 'oo', 'x_1_2': 'ad'}. Best is trial 74 with value: 0.8222222222222222.
2024-12-07 01:17:26,336 - INFO - Candidate Mean Stats: {'Max': np.float64(2.0), 'Min': np.float64(0.221840505061731), 'Mean': np.float64(0.49385973049120174), 'Std': np.float64(0.07552493670861607)}
2024-12-07 01:17:26,337 - INFO - Candidate Std Stats: {'Max': np.float64(0.3796371655588559), 'Min': np.float64(0.0), 'Mean': np.float64(0.09550353731490217), 'Std': np.float64(0.04038973732866859)}
[I 2024-12-07 01:17:26,383] Trial 263 finished with value: 1.0666666666666667 and parameters: {'x_0_0': 'bc', 'x_0_1': 'oo', 'x_0_2': 'ad', 'x_1_0': 'ab', 'x_1_1': 'oo', 'x_1_2': 'oo'}. Best is trial 49 with value: 0.7999999999999999.
2024-12-07 01:17:34,743 - INFO - Candidate Mean Stats: {'Max': np.float64(2.0), 'Min': np.float64(0.15901269520059821), 'Mean': np.float64(0.48911642166465447), 'Std': np.float64(0.07562728996491223)}
2024-12-07 01:17:34,745 - INFO - Candidate Std Stats: {'Max': np.float64(0.6267570519730625), 'Min': np.float64(0.0), 'Mean': np.float64(0.1130509684782567), 'Std': np.float64(0.053424841441399654)}
[I 2024-12-07 01:17:34,788] Trial 263 finished with value: 1.2444444444444445 and parameters: {'x_0_0': 'bd', 'x_0_1': 'bd', 'x_0_2': 'oo', 'x_1_0': 'bd', 'x_1_1': 'ab', 'x_1_2': 'oo'}. Best is trial 200 with value: 0.6.
2024-12-07 01:17:36,260 - INFO - Candidate Mean Stats: {'Max': np.float64(2.0), 'Min': np.float64(0.23923705545940432), 'Mean': np.float64(0.49744943154543186), 'Std': np.float64(0.07684686111377433)}
2024-12-07 01:17:36,261 - INFO - Candidate Std Stats: {'Max': np.float64(0.39978559182865037), 'Min': np.float64(0.0), 'Mean': np.float64(0.1016661891583741), 'Std': np.float64(0.042118134918689376)}
[I 2024-12-07 01:17:36,302] Trial 264 finished with value: 1.7 and parameters: {'x_0_0': 'oo', 'x_0_1': 'cd', 'x_0_2': 'bd', 'x_1_0': 'oo', 'x_1_1': 'ac', 'x_1_2': 'ad'}. Best is trial 148 with value: 0.8333333333333333.
2024-12-07 01:17:39,914 - INFO - Candidate Mean Stats: {'Max': np.float64(2.0), 'Min': np.float64(0.24767943047677726), 'Mean': np.float64(0.4899378123606169), 'Std': np.float64(0.07554199245514172)}
2024-12-07 01:17:39,915 - INFO - Candidate Std Stats: {'Max': np.float64(1.4986723399024549), 'Min': np.float64(0.0), 'Mean': np.float64(0.10956182430806462), 'Std': np.float64(0.05137494367350092)}
[I 2024-12-07 01:17:39,959] Trial 263 finished with value: 1.0222222222222221 and parameters: {'x_0_0': 'ac', 'x_0_1': 'ad', 'x_0_2': 'bc', 'x_1_0': 'oo', 'x_1_1': 'bd', 'x_1_2': 'ab'}. Best is trial 74 with value: 0.8222222222222222.
2024-12-07 01:17:47,030 - INFO - Candidate Mean Stats: {'Max': np.float64(2.0), 'Min': np.float64(0.19008151257589395), 'Mean': np.float64(0.49186613165676063), 'Std': np.float64(0.07871479375793089)}
2024-12-07 01:17:47,030 - INFO - Candidate Std Stats: {'Max': np.float64(1.4816039055149355), 'Min': np.float64(0.0), 'Mean': np.float64(0.10767237817482377), 'Std': np.float64(0.05173786153579381)}
[I 2024-12-07 01:17:47,077] Trial 264 finished with value: 1.1666666666666665 and parameters: {'x_0_0': 'ac', 'x_0_1': 'oo', 'x_0_2': 'oo', 'x_1_0': 'bc', 'x_1_1': 'bd', 'x_1_2': 'cd'}. Best is trial 49 with value: 0.7999999999999999.
2024-12-07 01:17:55,480 - INFO - Candidate Mean Stats: {'Max': np.float64(2.0), 'Min': np.float64(0.2516428073874273), 'Mean': np.float64(0.490720201189766), 'Std': np.float64(0.07631278857017994)}
2024-12-07 01:17:55,481 - INFO - Candidate Std Stats: {'Max': np.float64(0.4122044048768357), 'Min': np.float64(0.0), 'Mean': np.float64(0.1032616780894168), 'Std': np.float64(0.04257524390508734)}
[I 2024-12-07 01:17:55,525] Trial 264 finished with value: 1.0666666666666667 and parameters: {'x_0_0': 'ad', 'x_0_1': 'oo', 'x_0_2': 'oo', 'x_1_0': 'cd', 'x_1_1': 'oo', 'x_1_2': 'bc'}. Best is trial 200 with value: 0.6.
2024-12-07 01:17:56,516 - INFO - Candidate Mean Stats: {'Max': np.float64(2.0), 'Min': np.float64(0.2354039301587799), 'Mean': np.float64(0.49210055009309983), 'Std': np.float64(0.07859750144800884)}
2024-12-07 01:17:56,517 - INFO - Candidate Std Stats: {'Max': np.float64(0.4346572056897862), 'Min': np.float64(0.0), 'Mean': np.float64(0.09792553472717641), 'Std': np.float64(0.04199698643473336)}
[I 2024-12-07 01:17:56,558] Trial 265 finished with value: 1.2222222222222223 and parameters: {'x_0_0': 'ac', 'x_0_1': 'ad', 'x_0_2': 'bd', 'x_1_0': 'bc', 'x_1_1': 'bd', 'x_1_2': 'cd'}. Best is trial 148 with value: 0.8333333333333333.
2024-12-07 01:18:00,633 - INFO - Candidate Mean Stats: {'Max': np.float64(2.0), 'Min': np.float64(0.22515894851017676), 'Mean': np.float64(0.48923166865365797), 'Std': np.float64(0.07619936587756128)}
2024-12-07 01:18:00,633 - INFO - Candidate Std Stats: {'Max': np.float64(0.4135696256074987), 'Min': np.float64(0.0), 'Mean': np.float64(0.1030135226049575), 'Std': np.float64(0.04407532880822491)}
