[I 2024-12-28 14:58:54,660] Trial 39 finished with value: 1.5 and parameters: {'x_0_0': 'cd', 'x_0_1': 'oo', 'x_1_0': 'bd', 'x_1_1': 'cd'}. Best is trial 21 with value: 0.7857142857142857.
[I 2024-12-28 14:58:54,675] Trial 29 finished with value: 2.0 and parameters: {'x_0_0': 'cd', 'x_0_1': 'cd', 'x_1_0': 'bd', 'x_1_1': 'cd'}. Best is trial 16 with value: 0.8035714285714286.
[I 2024-12-28 14:58:54,715] Trial 38 finished with value: 1.3214285714285714 and parameters: {'x_0_0': 'ad', 'x_0_1': 'bd', 'x_1_0': 'oo', 'x_1_1': 'bd'}. Best is trial 17 with value: 0.7857142857142857.
[I 2024-12-28 14:58:54,769] Trial 26 finished with value: 1.2142857142857144 and parameters: {'x_0_0': 'ab', 'x_0_1': 'oo', 'x_1_0': 'cd', 'x_1_1': 'bd'}. Best is trial 3 with value: 0.7857142857142857.
[I 2024-12-28 14:58:54,875] Trial 35 finished with value: 1.5714285714285714 and parameters: {'x_0_0': 'ad', 'x_0_1': 'ab', 'x_1_0': 'ac', 'x_1_1': 'cd'}. Best is trial 17 with value: 0.5.
Loaded from prev state!
Loaded from prev state!
Loaded from prev state!
Loaded from prev state!
Loaded from prev state!
Loaded from prev state!
Loaded from prev state!
Loaded from prev state!
Loaded from prev state!
Loaded from prev state!
Loaded from prev state!
Loaded from prev state!
Loaded from prev state!
Loaded from prev state!
Loaded from prev state!
Loaded from prev state!
Loaded from prev state!
Loaded from prev state!
Loaded from prev state!
Loaded from prev state!
Loaded from prev state!
Loaded from prev state!
Loaded from prev state!
Loaded from prev state!
Loaded from prev state!
Loaded from prev state!
Loaded from prev state!
Loaded from prev state!
Loaded from prev state!
Loaded from prev state!
Loaded from prev state!
Loaded from prev state!
Loaded from prev state!
Loaded from prev state!
Loaded from prev state!
Loaded from prev state!
Loaded from prev state!
Loaded from prev state!
Loaded from prev state!
Loaded from prev state!
Loaded from prev state!
Loaded from prev state!
Loaded from prev state!
Loaded from prev state!
Loaded from prev state!
Loaded from prev state!
Loaded from prev state!
Loaded from prev state!
Loaded from prev state!
Loaded from prev state!
Loaded from prev state!
Loaded from prev state!
Loaded from prev state!
Loaded from prev state!
Loaded from prev state!
Loaded from prev state!
Loaded from prev state!
Loaded from prev state!
Loaded from prev state!
Loaded from prev state!
Loaded from prev state!
Loaded from prev state!
Loaded from prev state!
Loaded from prev state!
Loaded from prev state!
Loaded from prev state!
Loaded from prev state!
Loaded from prev state!
Loaded from prev state!
Loaded from prev state!
Loaded from prev state!
Loaded from prev state!
Loaded from prev state!
Loaded from prev state!
Loaded from prev state!
Loaded from prev state!
Loaded from prev state!
Loaded from prev state!
Loaded from prev state!
Loaded from prev state!
Loaded from prev state!
Loaded from prev state!
Loaded from prev state!
Loaded from prev state!
Loaded from prev state!
Loaded from prev state!
Loaded from prev state!
Loaded from prev state!
Loaded from prev state!
Loaded from prev state!
Loaded from prev state!
Loaded from prev state!
Loaded from prev state!
Loaded from prev state!
Loaded from prev state!
Loaded from prev state!
Loaded from prev state!
Loaded from prev state!
Loaded from prev state!
Loaded from prev state!
Loaded from prev state!
Loaded from prev state!
Loaded from prev state!
Loaded from prev state!
Loaded from prev state!
Loaded from prev state!
Loaded from prev state!
Loaded from prev state!
Loaded from prev state!
Loaded from prev state!
Loaded from prev state!
Loaded from prev state!
Loaded from prev state!
Loaded from prev state!
Loaded from prev state!
Loaded from prev state!
Loaded from prev state!
Loaded from prev state!
Loaded from prev state!
Loaded from prev state!
Loaded from prev state!
Loaded from prev state!
Loaded from prev state!
Loaded from prev state!
Loaded from prev state!
Loaded from prev state!
Loaded from prev state!
Loaded from prev state!
Loaded from prev state!
Loaded from prev state!
Loaded from prev state!
Loaded from prev state!
Loaded from prev state!
Loaded from prev state!
Loaded from prev state!
Loaded from prev state!
Loaded from prev state!
Loaded from prev state!
Loaded from prev state!
Loaded from prev state!
Loaded from prev state!
Loaded from prev state!
Loaded from prev state!
Loaded from prev state!
Loaded from prev state!
Loaded from prev state!
Loaded from prev state!
Loaded from prev state!
Loaded from prev state!
Loaded from prev state!
Loaded from prev state!
Loaded from prev state!
Loaded from prev state!
Loaded from prev state!
Loaded from prev state!
Loaded from prev state!
Loaded from prev state!
Loaded from prev state!
Loaded from prev state!
Loaded from prev state!
Loaded from prev state!
Loaded from prev state!
Loaded from prev state!
Loaded from prev state!
Loaded from prev state!
Loaded from prev state!
Loaded from prev state!
Loaded from prev state!
Loaded from prev state!
Loaded from prev state!
Loaded from prev state!
Loaded from prev state!
Loaded from prev state!
Loaded from prev state!
Loaded from prev state!
Loaded from prev state!
Loaded from prev state!
Loaded from prev state!
Loaded from prev state!
Loaded from prev state!
Loaded from prev state!
Loaded from prev state!
Loaded from prev state!
Loaded from prev state!
Loaded from prev state!
Loaded from prev state!
Loaded from prev state!
Loaded from prev state!
Loaded from prev state!
Loaded from prev state!
Loaded from prev state!
Loaded from prev state!
Loaded from prev state!
Loaded from prev state!
Loaded from prev state!
Loaded from prev state!
Loaded from prev state!
Loaded from prev state!
Loaded from prev state!
Loaded from prev state!
Loaded from prev state!
Loaded from prev state!
Loaded from prev state!
Loaded from prev state!
Loaded from prev state!
Loaded from prev state!
Loaded from prev state!
Loaded from prev state!
Loaded from prev state!
Loaded from prev state!
Loaded from prev state!
Loaded from prev state!
Loaded from prev state!
Loaded from prev state!
Loaded from prev state!
Loaded from prev state!
Loaded from prev state!
Loaded from prev state!
Loaded from prev state!
Loaded from prev state!
Loaded from prev state!
Loaded from prev state!
Loaded from prev state!
Loaded from prev state!
Loaded from prev state!
Loaded from prev state!
Loaded from prev state!
Loaded from prev state!
Loaded from prev state!
Loaded from prev state!
Loaded from prev state!
Loaded from prev state!
Loaded from prev state!
Loaded from prev state!
Loaded from prev state!
Loaded from prev state!
Loaded from prev state!
Loaded from prev state!
Loaded from prev state!
Loaded from prev state!
Loaded from prev state!
Loaded from prev state!
Loaded from prev state!
Loaded from prev state!
Loaded from prev state!
Loaded from prev state!
Loaded from prev state!
Loaded from prev state!
Loaded from prev state!
Loaded from prev state!
Loaded from prev state!
Loaded from prev state!
Loaded from prev state!
Loaded from prev state!
Loaded from prev state!
Loaded from prev state!
Loaded from prev state!
Loaded from prev state!
Loaded from prev state!
Loaded from prev state!
Loaded from prev state!
Loaded from prev state!
Loaded from prev state!
Loaded from prev state!
Loaded from prev state!
Loaded from prev state!
Loaded from prev state!
Loaded from prev state!
Loaded from prev state!
Loaded from prev state!
Loaded from prev state!
Loaded from prev state!
Loaded from prev state!
Loaded from prev state!
Loaded from prev state!
Loaded from prev state!
Loaded from prev state!
Loaded from prev state!
Loaded from prev state!
Loaded from prev state!
Loaded from prev state!
Loaded from prev state!
Loaded from prev state!
Loaded from prev state!
Loaded from prev state!
Loaded from prev state!
Loaded from prev state!
Loaded from prev state!
Loaded from prev state!
Loaded from prev state!
Loaded from prev state!
Loaded from prev state!
Loaded from prev state!
Loaded from prev state!
Loaded from prev state!
Loaded from prev state!
Loaded from prev state!
Loaded from prev state!
Loaded from prev state!
Loaded from prev state!
Loaded from prev state!
Loaded from prev state!
Loaded from prev state!
Loaded from prev state!
Loaded from prev state!
Loaded from prev state!
Loaded from prev state!
Loaded from prev state!
Loaded from prev state!
Loaded from prev state!
Loaded from prev state!
Loaded from prev state!
Loaded from prev state!
Loaded from prev state!
Loaded from prev state!
Loaded from prev state!
Loaded from prev state!
Loaded from prev state!
Loaded from prev state!
Loaded from prev state!
Loaded from prev state!
Loaded from prev state!
Loaded from prev state!
Loaded from prev state!
Loaded from prev state!
Loaded from prev state!
Loaded from prev state!
Loaded from prev state!
Loaded from prev state!
Loaded from prev state!
Loaded from prev state!
Loaded from prev state!
Loaded from prev state!
Loaded from prev state!
Loaded from prev state!
Loaded from prev state!
Loaded from prev state!
Loaded from prev state!
Loaded from prev state!
Loaded from prev state!
Loaded from prev state!
Loaded from prev state![I 2024-12-28 14:58:54,930] Trial 39 finished with value: 1.75 and parameters: {'x_0_0': 'cd', 'x_0_1': 'bd', 'x_1_0': 'oo', 'x_1_1': 'ac'}. Best is trial 17 with value: 0.7857142857142857.
[I 2024-12-28 14:58:54,961] Trial 40 finished with value: 2.0 and parameters: {'x_0_0': 'cd', 'x_0_1': 'bd', 'x_1_0': 'bc', 'x_1_1': 'bc'}. Best is trial 21 with value: 0.7857142857142857.
[I 2024-12-28 14:58:55,004] Trial 27 finished with value: 0.9642857142857143 and parameters: {'x_0_0': 'ab', 'x_0_1': 'oo', 'x_1_0': 'oo', 'x_1_1': 'ab'}. Best is trial 3 with value: 0.7857142857142857.
[I 2024-12-28 14:58:55,011] Trial 26 finished with value: 1.25 and parameters: {'x_0_0': 'oo', 'x_0_1': 'oo', 'x_1_0': 'cd', 'x_1_1': 'oo'}. Best is trial 4 with value: 1.0714285714285714.
[I 2024-12-28 14:58:55,049] Trial 39 finished with value: 1.5714285714285714 and parameters: {'x_0_0': 'bc', 'x_0_1': 'cd', 'x_1_0': 'bc', 'x_1_1': 'ab'}. Best is trial 1 with value: 1.0.
[I 2024-12-28 14:58:55,050] Trial 27 finished with value: 1.875 and parameters: {'x_0_0': 'oo', 'x_0_1': 'cd', 'x_1_0': 'bd', 'x_1_1': 'bd'}. Best is trial 15 with value: 0.6964285714285714.
[I 2024-12-28 14:58:55,054] Trial 35 finished with value: 2.0 and parameters: {'x_0_0': 'cd', 'x_0_1': 'ad', 'x_1_0': 'bd', 'x_1_1': 'ab'}. Best is trial 29 with value: 1.0.
Loaded from prev state!
Loaded from prev state!
Loaded from prev state!
Loaded from prev state!
Loaded from prev state!
Loaded from prev state!
Loaded from prev state!
Loaded from prev state!
Loaded from prev state!
Loaded from prev state!
Loaded from prev state!
Loaded from prev state!
Loaded from prev state!
Loaded from prev state!
Loaded from prev state!
Loaded from prev state!
Loaded from prev state!
Loaded from prev state!
Loaded from prev state!
Loaded from prev state!
Loaded from prev state!
Loaded from prev state!
Loaded from prev state!
Loaded from prev state!
Loaded from prev state!
Loaded from prev state!
Loaded from prev state!
Loaded from prev state!
Loaded from prev state!
Loaded from prev state!
Loaded from prev state!
Loaded from prev state!
Loaded from prev state!
Loaded from prev state!
Loaded from prev state!
Loaded from prev state!
Loaded from prev state!
Loaded from prev state!
Loaded from prev state!
Loaded from prev state!
Loaded from prev state!
Loaded from prev state!
Loaded from prev state!
Loaded from prev state!
Loaded from prev state!
Loaded from prev state!
Loaded from prev state!
Loaded from prev state!
Loaded from prev state!
Loaded from prev state!
Loaded from prev state!
Loaded from prev state!
Loaded from prev state!
Loaded from prev state!
Loaded from prev state!
Loaded from prev state!
Loaded from prev state!
Loaded from prev state!
Loaded from prev state!
Loaded from prev state!
Loaded from prev state!
Loaded from prev state!
Loaded from prev state!
Loaded from prev state!
Loaded from prev state!
Loaded from prev state!
Loaded from prev state!
Loaded from prev state!
Loaded from prev state!
Loaded from prev state!
Loaded from prev state!
Loaded from prev state!
Loaded from prev state!
Loaded from prev state!
Loaded from prev state!
Loaded from prev state!
Loaded from prev state!
Loaded from prev state!
Loaded from prev state!
Loaded from prev state!
Loaded from prev state!
Loaded from prev state!
Loaded from prev state!
Loaded from prev state!
Loaded from prev state!
Loaded from prev state!
Loaded from prev state!
Loaded from prev state!
Loaded from prev state!
Loaded from prev state!
Loaded from prev state!
Loaded from prev state!
Loaded from prev state!
Loaded from prev state!
Loaded from prev state!
Loaded from prev state!
Loaded from prev state!
Loaded from prev state!
Loaded from prev state!
Loaded from prev state!
Loaded from prev state!
Loaded from prev state!
Loaded from prev state!
Loaded from prev state!
Loaded from prev state!
Loaded from prev state!
Loaded from prev state!
Loaded from prev state!
Loaded from prev state!
Loaded from prev state!
Loaded from prev state!
Loaded from prev state!
Loaded from prev state!
Loaded from prev state!
Loaded from prev state!
Loaded from prev state!
Loaded from prev state!
Loaded from prev state!
Loaded from prev state!
Loaded from prev state!
Loaded from prev state!
Loaded from prev state!
Loaded from prev state!
Loaded from prev state!
Loaded from prev state!
Loaded from prev state!
Loaded from prev state!
Loaded from prev state!
Loaded from prev state!
Loaded from prev state!
Loaded from prev state!
Loaded from prev state!
Loaded from prev state!
Loaded from prev state!
Loaded from prev state!
Loaded from prev state!
Loaded from prev state!
Loaded from prev state!
Loaded from prev state!
Loaded from prev state!
Loaded from prev state!
Loaded from prev state!
Loaded from prev state!
Loaded from prev state!
Loaded from prev state!
Loaded from prev state!
Loaded from prev state!
Loaded from prev state!
Loaded from prev state!
Loaded from prev state!
Loaded from prev state!
Loaded from prev state!
Loaded from prev state!
Loaded from prev state!
Loaded from prev state!
Loaded from prev state!
Loaded from prev state!
Loaded from prev state!
Loaded from prev state!
Loaded from prev state!
Loaded from prev state!
Loaded from prev state!
Loaded from prev state!
Loaded from prev state!
Loaded from prev state!
Loaded from prev state!
Loaded from prev state!
Loaded from prev state!
Loaded from prev state!
Loaded from prev state!
Loaded from prev state!
Loaded from prev state!
Loaded from prev state!
Loaded from prev state!
Loaded from prev state!
Loaded from prev state!
Loaded from prev state!
Loaded from prev state!
Loaded from prev state!
Loaded from prev state!
Loaded from prev state!
Loaded from prev state!
Loaded from prev state!
Loaded from prev state!
Loaded from prev state!
Loaded from prev state!
Loaded from prev state!
Loaded from prev state!
Loaded from prev state!
Loaded from prev state!
Loaded from prev state!
Loaded from prev state!
Loaded from prev state!
Loaded from prev state!
Loaded from prev state!
Loaded from prev state!
Loaded from prev state!
Loaded from prev state!
Loaded from prev state!
Loaded from prev state!
Loaded from prev state!
Loaded from prev state!
Loaded from prev state!
Loaded from prev state!
Loaded from prev state!
Loaded from prev state!
Loaded from prev state!
Loaded from prev state!
Loaded from prev state!
Loaded from prev state!
Loaded from prev state!
Loaded from prev state!
Loaded from prev state!
Loaded from prev state!
Loaded from prev state!
Loaded from prev state!
Loaded from prev state!
Loaded from prev state!
Loaded from prev state!
Loaded from prev state!
Loaded from prev state!
Loaded from prev state!
Loaded from prev state!
Loaded from prev state!
Loaded from prev state!
Loaded from prev state!
Loaded from prev state!
Loaded from prev state!
Loaded from prev state!
Loaded from prev state!
Loaded from prev state!
Loaded from prev state!
Loaded from prev state!
Loaded from prev state!
Loaded from prev state!
Loaded from prev state!
Loaded from prev state!
Loaded from prev state!
Loaded from prev state!
Loaded from prev state!
Loaded from prev state!
Loaded from prev state!
Loaded from prev state!
Loaded from prev state!
Loaded from prev state!
Loaded from prev state!
Loaded from prev state!
Loaded from prev state!
Loaded from prev state!
Loaded from prev state!
Loaded from prev state!
Loaded from prev state!
Loaded from prev state!
Loaded from prev state!
Loaded from prev state!
Loaded from prev state!
Loaded from prev state!
Loaded from prev state!
Loaded from prev state!
Loaded from prev state!
Loaded from prev state!
Loaded from prev state!
Loaded from prev state!
Loaded from prev state!
Loaded from prev state!
Loaded from prev state!
Loaded from prev state!
Loaded from prev state!
Loaded from prev state!
Loaded from prev state!
Loaded from prev state!
Loaded from prev state!
Loaded from prev state!
Loaded from prev state!
Loaded from prev state!
Loaded from prev state!
Loaded from prev state!
Loaded from prev state!
Loaded from prev state!
Loaded from prev state!
Loaded from prev state!
Loaded from prev state!
Loaded from prev state!
Loaded from prev state!
Loaded from prev state!
Loaded from prev state!
Loaded from prev state!
Loaded from prev state!
Loaded from prev state!
Loaded from prev state!
Loaded from prev state!
Loaded from prev state!
Loaded from prev state!
Loaded from prev state!
Loaded from prev state!
Loaded from prev state!
Loaded from prev state!
Loaded from prev state!
Loaded from prev state!
Loaded from prev state!
Loaded from prev state!
Loaded from prev state!
Loaded from prev state!
Loaded from prev state!
Loaded from prev state!
Loaded from prev state!
Loaded from prev state!
Loaded from prev state!
Loaded from prev state!
Loaded from prev state!
Loaded from prev state!
Loaded from prev state!
Loaded from prev state!
Loaded from prev state!
Loaded from prev state!
Loaded from prev state!
Loaded from prev state!
Loaded from prev state!
Loaded from prev state!
Loaded from prev state!
Loaded from prev state!
Loaded from prev state!
Loaded from prev state!
Loaded from prev state!
Loaded from prev state!
Loaded from prev state!
Loaded from prev state!
Loaded from prev state!
Loaded from prev state!
Loaded from prev state!
Loaded from prev state!
Loaded from prev state!
Loaded from prev state!
Loaded from prev state!
Loaded from prev state!
Loaded from prev state!
Loaded from prev state!
Loaded from prev state!
Loaded from prev state!
Loaded from prev state!
Loaded from prev state!
Loaded from prev state![I 2024-12-28 14:58:55,217] Trial 32 finished with value: 1.5714285714285714 and parameters: {'x_0_0': 'ad', 'x_0_1': 'bd', 'x_1_0': 'cd', 'x_1_1': 'ac'}. Best is trial 7 with value: 0.5.
[I 2024-12-28 14:58:55,259] Trial 36 finished with value: 1.125 and parameters: {'x_0_0': 'oo', 'x_0_1': 'oo', 'x_1_0': 'oo', 'x_1_1': 'bd'}. Best is trial 17 with value: 0.5.
[I 2024-12-28 14:58:55,282] Trial 28 finished with value: 1.4464285714285714 and parameters: {'x_0_0': 'bc', 'x_0_1': 'cd', 'x_1_0': 'bc', 'x_1_1': 'oo'}. Best is trial 3 with value: 0.7857142857142857.
[I 2024-12-28 14:58:55,313] Trial 40 finished with value: 1.2857142857142856 and parameters: {'x_0_0': 'bc', 'x_0_1': 'ac', 'x_1_0': 'ad', 'x_1_1': 'cd'}. Best is trial 1 with value: 1.0.
[I 2024-12-28 14:58:55,354] Trial 40 finished with value: 2.0 and parameters: {'x_0_0': 'cd', 'x_0_1': 'ac', 'x_1_0': 'ad', 'x_1_1': 'ab'}. Best is trial 17 with value: 0.7857142857142857.
[I 2024-12-28 14:58:55,376] Trial 27 finished with value: 1.875 and parameters: {'x_0_0': 'cd', 'x_0_1': 'cd', 'x_1_0': 'bd', 'x_1_1': 'oo'}. Best is trial 4 with value: 1.0714285714285714.
[I 2024-12-28 14:58:55,377] Trial 28 finished with value: 1.25 and parameters: {'x_0_0': 'cd', 'x_0_1': 'oo', 'x_1_0': 'oo', 'x_1_1': 'cd'}. Best is trial 15 with value: 0.6964285714285714.
[I 2024-12-28 14:58:55,397] Trial 41 finished with value: 2.0 and parameters: {'x_0_0': 'cd', 'x_0_1': 'ac', 'x_1_0': 'bd', 'x_1_1': 'bc'}. Best is trial 21 with value: 0.7857142857142857.
[I 2024-12-28 14:58:55,503] Trial 33 finished with value: 1.5714285714285714 and parameters: {'x_0_0': 'ad', 'x_0_1': 'ac', 'x_1_0': 'ac', 'x_1_1': 'cd'}. Best is trial 7 with value: 0.5.
[I 2024-12-28 14:58:55,521] Trial 30 finished with value: 1.0714285714285714 and parameters: {'x_0_0': 'bd', 'x_0_1': 'oo', 'x_1_0': 'cd', 'x_1_1': 'bd'}. Best is trial 16 with value: 0.8035714285714286.
[I 2024-12-28 14:58:55,590] Trial 37 finished with value: 1.875 and parameters: {'x_0_0': 'oo', 'x_0_1': 'ac', 'x_1_0': 'bd', 'x_1_1': 'ac'}. Best is trial 17 with value: 0.5.
[I 2024-12-28 14:58:55,621] Trial 36 finished with value: 1.875 and parameters: {'x_0_0': 'cd', 'x_0_1': 'ab', 'x_1_0': 'cd', 'x_1_1': 'oo'}. Best is trial 29 with value: 1.0.
[I 2024-12-28 14:58:55,658] Trial 29 finished with value: 1.2857142857142856 and parameters: {'x_0_0': 'ad', 'x_0_1': 'cd', 'x_1_0': 'bc', 'x_1_1': 'cd'}. Best is trial 3 with value: 0.7857142857142857.
[I 2024-12-28 14:58:55,736] Trial 41 finished with value: 1.7142857142857144 and parameters: {'x_0_0': 'ab', 'x_0_1': 'cd', 'x_1_0': 'ac', 'x_1_1': 'ab'}. Best is trial 1 with value: 1.0.
[I 2024-12-28 14:58:55,774] Trial 29 finished with value: 1.625 and parameters: {'x_0_0': 'oo', 'x_0_1': 'bc', 'x_1_0': 'oo', 'x_1_1': 'cd'}. Best is trial 15 with value: 0.6964285714285714.
[I 2024-12-28 14:58:55,811] Trial 41 finished with value: 1.875 and parameters: {'x_0_0': 'oo', 'x_0_1': 'cd', 'x_1_0': 'ab', 'x_1_1': 'bc'}. Best is trial 17 with value: 0.7857142857142857.
[I 2024-12-28 14:58:55,842] Trial 31 finished with value: 1.875 and parameters: {'x_0_0': 'oo', 'x_0_1': 'bc', 'x_1_0': 'ac', 'x_1_1': 'bd'}. Best is trial 16 with value: 0.8035714285714286.
