[I 2024-12-06 23:38:17,785] Trial 366 finished with value: 1.5 and parameters: {'x_0_0': 'cd', 'x_0_1': 'oo', 'x_1_0': 'ab', 'x_1_1': 'ab'}. Best is trial 23 with value: 0.5.
2024-12-06 23:38:17,796 - INFO - Candidate Mean Stats: {'Max': np.float64(3.1434739322718466), 'Min': np.float64(-0.7944022526064357), 'Mean': np.float64(0.5853101571798817), 'Std': np.float64(0.645409890347539)}
2024-12-06 23:38:17,796 - INFO - Candidate Std Stats: {'Max': np.float64(1.6263721202286305), 'Min': np.float64(0.0), 'Mean': np.float64(0.5767084516278312), 'Std': np.float64(0.3330656961148195)}
[I 2024-12-06 23:38:17,809] Trial 368 finished with value: 1.2857142857142856 and parameters: {'x_0_0': 'ad', 'x_0_1': 'cd', 'x_1_0': 'bd', 'x_1_1': 'ad'}. Best is trial 165 with value: 0.5.
2024-12-06 23:38:17,824 - INFO - Candidate Mean Stats: {'Max': np.float64(2.7910271211724265), 'Min': np.float64(-0.916215502755391), 'Mean': np.float64(0.66177416897868), 'Std': np.float64(0.5886565300721243)}
2024-12-06 23:38:17,824 - INFO - Candidate Std Stats: {'Max': np.float64(1.764272288438355), 'Min': np.float64(0.0), 'Mean': np.float64(0.5491428555712852), 'Std': np.float64(0.3333669766705286)}
[I 2024-12-06 23:38:17,837] Trial 368 finished with value: 1.2142857142857144 and parameters: {'x_0_0': 'ab', 'x_0_1': 'oo', 'x_1_0': 'ab', 'x_1_1': 'bc'}. Best is trial 63 with value: 0.5.
2024-12-06 23:38:18,123 - INFO - Candidate Mean Stats: {'Max': np.float64(3.1585001294332513), 'Min': np.float64(-0.8281385107734145), 'Mean': np.float64(0.7058705608875512), 'Std': np.float64(0.5376886607487185)}
2024-12-06 23:38:18,123 - INFO - Candidate Std Stats: {'Max': np.float64(1.4987801047485863), 'Min': np.float64(0.0), 'Mean': np.float64(0.47278494721964365), 'Std': np.float64(0.2851433543601573)}
[I 2024-12-06 23:38:18,137] Trial 369 finished with value: 1.0892857142857144 and parameters: {'x_0_0': 'ab', 'x_0_1': 'oo', 'x_1_0': 'ac', 'x_1_1': 'oo'}. Best is trial 76 with value: 0.5.
2024-12-06 23:38:18,157 - INFO - Candidate Mean Stats: {'Max': np.float64(3.2041028445810618), 'Min': np.float64(-0.5966537580658551), 'Mean': np.float64(0.7556780944583433), 'Std': np.float64(0.5140824692520654)}
2024-12-06 23:38:18,157 - INFO - Candidate Std Stats: {'Max': np.float64(1.4220354810190554), 'Min': np.float64(0.0), 'Mean': np.float64(0.455906386753297), 'Std': np.float64(0.2791938016875615)}
[I 2024-12-06 23:38:18,170] Trial 367 finished with value: 1.25 and parameters: {'x_0_0': 'cd', 'x_0_1': 'oo', 'x_1_0': 'oo', 'x_1_1': 'bd'}. Best is trial 23 with value: 0.5.
2024-12-06 23:38:18,177 - INFO - Candidate Mean Stats: {'Max': np.float64(3.545906275409667), 'Min': np.float64(-0.5943698518356856), 'Mean': np.float64(0.7646504560138054), 'Std': np.float64(0.5068126251468558)}
2024-12-06 23:38:18,177 - INFO - Candidate Std Stats: {'Max': np.float64(1.9408886646488854), 'Min': np.float64(0.0), 'Mean': np.float64(0.496926038239185), 'Std': np.float64(0.31230898978979027)}
[I 2024-12-06 23:38:18,191] Trial 369 finished with value: 1.0714285714285714 and parameters: {'x_0_0': 'ac', 'x_0_1': 'oo', 'x_1_0': 'cd', 'x_1_1': 'bc'}. Best is trial 165 with value: 0.5.
2024-12-06 23:38:18,208 - INFO - Candidate Mean Stats: {'Max': np.float64(3.190327412464666), 'Min': np.float64(-0.628648653736607), 'Mean': np.float64(0.7034154940766904), 'Std': np.float64(0.568553150947492)}
2024-12-06 23:38:18,209 - INFO - Candidate Std Stats: {'Max': np.float64(1.7483227967580293), 'Min': np.float64(0.0), 'Mean': np.float64(0.5191297572678799), 'Std': np.float64(0.3115481315970748)}
[I 2024-12-06 23:38:18,222] Trial 369 finished with value: 1.1964285714285714 and parameters: {'x_0_0': 'ac', 'x_0_1': 'bd', 'x_1_0': 'oo', 'x_1_1': 'oo'}. Best is trial 63 with value: 0.5.
2024-12-06 23:38:18,505 - INFO - Candidate Mean Stats: {'Max': np.float64(3.5964406274308303), 'Min': np.float64(-0.7171481338201003), 'Mean': np.float64(0.6691387915497476), 'Std': np.float64(0.578970452737466)}
2024-12-06 23:38:18,505 - INFO - Candidate Std Stats: {'Max': np.float64(1.5192140464333006), 'Min': np.float64(0.0), 'Mean': np.float64(0.4990490308632237), 'Std': np.float64(0.30538698267165576)}
[I 2024-12-06 23:38:18,519] Trial 370 finished with value: 1.2857142857142856 and parameters: {'x_0_0': 'bc', 'x_0_1': 'ac', 'x_1_0': 'ab', 'x_1_1': 'ad'}. Best is trial 76 with value: 0.5.
2024-12-06 23:38:18,544 - INFO - Candidate Mean Stats: {'Max': np.float64(3.0817677974141224), 'Min': np.float64(-0.5727450179612507), 'Mean': np.float64(0.7608323817383089), 'Std': np.float64(0.4948529150655069)}
2024-12-06 23:38:18,545 - INFO - Candidate Std Stats: {'Max': np.float64(1.734821130043855), 'Min': np.float64(0.0), 'Mean': np.float64(0.46578484127825237), 'Std': np.float64(0.29855013658820734)}
[I 2024-12-06 23:38:18,559] Trial 368 finished with value: 1.0714285714285714 and parameters: {'x_0_0': 'ac', 'x_0_1': 'oo', 'x_1_0': 'bc', 'x_1_1': 'bd'}. Best is trial 23 with value: 0.5.
2024-12-06 23:38:18,561 - INFO - Candidate Mean Stats: {'Max': np.float64(3.1708039276703515), 'Min': np.float64(-0.6250469795149949), 'Mean': np.float64(0.7385437660782253), 'Std': np.float64(0.5733994512042682)}
2024-12-06 23:38:18,561 - INFO - Candidate Std Stats: {'Max': np.float64(1.4171428147020642), 'Min': np.float64(0.0), 'Mean': np.float64(0.47923228830024156), 'Std': np.float64(0.2889431342546377)}
[I 2024-12-06 23:38:18,575] Trial 370 finished with value: 1.3214285714285714 and parameters: {'x_0_0': 'bc', 'x_0_1': 'bd', 'x_1_0': 'oo', 'x_1_1': 'ab'}. Best is trial 165 with value: 0.5.
2024-12-06 23:38:18,592 - INFO - Candidate Mean Stats: {'Max': np.float64(3.1163382582132195), 'Min': np.float64(-0.8340875752081793), 'Mean': np.float64(0.6586245474110862), 'Std': np.float64(0.6295705066844792)}
2024-12-06 23:38:18,592 - INFO - Candidate Std Stats: {'Max': np.float64(2.1564077755383964), 'Min': np.float64(0.0), 'Mean': np.float64(0.6070248207054818), 'Std': np.float64(0.37997818118439625)}
[I 2024-12-06 23:38:18,606] Trial 370 finished with value: 1.7142857142857144 and parameters: {'x_0_0': 'ab', 'x_0_1': 'ad', 'x_1_0': 'ac', 'x_1_1': 'ac'}. Best is trial 63 with value: 0.5.
2024-12-06 23:38:18,896 - INFO - Candidate Mean Stats: {'Max': np.float64(2.800726109546088), 'Min': np.float64(-1.022800696941231), 'Mean': np.float64(0.6851122399126982), 'Std': np.float64(0.5976720527309418)}
2024-12-06 23:38:18,896 - INFO - Candidate Std Stats: {'Max': np.float64(1.6688110989418876), 'Min': np.float64(0.0), 'Mean': np.float64(0.4887761555208237), 'Std': np.float64(0.30306245279972444)}
[I 2024-12-06 23:38:18,911] Trial 371 finished with value: 1.4285714285714286 and parameters: {'x_0_0': 'bc', 'x_0_1': 'ab', 'x_1_0': 'bc', 'x_1_1': 'ac'}. Best is trial 76 with value: 0.5.
2024-12-06 23:38:18,939 - INFO - Candidate Mean Stats: {'Max': np.float64(2.7510762554086776), 'Min': np.float64(-0.7079469331376684), 'Mean': np.float64(0.741716852890034), 'Std': np.float64(0.5320251171570735)}
2024-12-06 23:38:18,939 - INFO - Candidate Std Stats: {'Max': np.float64(1.5421048429618989), 'Min': np.float64(0.0), 'Mean': np.float64(0.49415579665169795), 'Std': np.float64(0.29903366830375966)}
[I 2024-12-06 23:38:18,953] Trial 369 finished with value: 1.3214285714285714 and parameters: {'x_0_0': 'bc', 'x_0_1': 'bd', 'x_1_0': 'oo', 'x_1_1': 'ac'}. Best is trial 23 with value: 0.5.
2024-12-06 23:38:18,954 - INFO - Candidate Mean Stats: {'Max': np.float64(3.106647645572989), 'Min': np.float64(-1.059943315791291), 'Mean': np.float64(0.614269757230617), 'Std': np.float64(0.619479971088207)}
2024-12-06 23:38:18,954 - INFO - Candidate Std Stats: {'Max': np.float64(1.704969345425582), 'Min': np.float64(0.0), 'Mean': np.float64(0.584927149018062), 'Std': np.float64(0.3458442990221171)}
[I 2024-12-06 23:38:18,967] Trial 371 finished with value: 1.5714285714285714 and parameters: {'x_0_0': 'bd', 'x_0_1': 'ad', 'x_1_0': 'ad', 'x_1_1': 'ad'}. Best is trial 165 with value: 0.5.
2024-12-06 23:38:18,984 - INFO - Candidate Mean Stats: {'Max': np.float64(3.1407392041787445), 'Min': np.float64(-0.7843639725014412), 'Mean': np.float64(0.6839410822502073), 'Std': np.float64(0.6280132156760243)}
2024-12-06 23:38:18,984 - INFO - Candidate Std Stats: {'Max': np.float64(1.5874461642482396), 'Min': np.float64(0.0), 'Mean': np.float64(0.5076518474919723), 'Std': np.float64(0.2945970671111035)}
[I 2024-12-06 23:38:18,998] Trial 371 finished with value: 1.3214285714285714 and parameters: {'x_0_0': 'ac', 'x_0_1': 'bc', 'x_1_0': 'oo', 'x_1_1': 'ac'}. Best is trial 63 with value: 0.5.
2024-12-06 23:38:19,281 - INFO - Candidate Mean Stats: {'Max': np.float64(3.2866028900286657), 'Min': np.float64(-0.6760018333707576), 'Mean': np.float64(0.7867833961173331), 'Std': np.float64(0.5265927617168231)}
2024-12-06 23:38:19,281 - INFO - Candidate Std Stats: {'Max': np.float64(1.9144231091272326), 'Min': np.float64(0.0), 'Mean': np.float64(0.4421245384896869), 'Std': np.float64(0.28383403041407207)}
[I 2024-12-06 23:38:19,295] Trial 372 finished with value: 1.0714285714285714 and parameters: {'x_0_0': 'ac', 'x_0_1': 'oo', 'x_1_0': 'ac', 'x_1_1': 'ac'}. Best is trial 76 with value: 0.5.
2024-12-06 23:38:19,326 - INFO - Candidate Mean Stats: {'Max': np.float64(3.238702230727609), 'Min': np.float64(-0.8829217331474443), 'Mean': np.float64(0.7448462629407967), 'Std': np.float64(0.5739252699963089)}
2024-12-06 23:38:19,326 - INFO - Candidate Std Stats: {'Max': np.float64(1.4744247996669693), 'Min': np.float64(0.0), 'Mean': np.float64(0.5037584000936135), 'Std': np.float64(0.299325577778881)}
2024-12-06 23:38:19,338 - INFO - Candidate Mean Stats: {'Max': np.float64(2.749006874868823), 'Min': np.float64(-0.9070228607074695), 'Mean': np.float64(0.7045025442278687), 'Std': np.float64(0.5610448913728862)}
2024-12-06 23:38:19,338 - INFO - Candidate Std Stats: {'Max': np.float64(1.7059726078902395), 'Min': np.float64(0.0), 'Mean': np.float64(0.5434211224388968), 'Std': np.float64(0.3165633819002689)}
[I 2024-12-06 23:38:19,340] Trial 370 finished with value: 1.2857142857142856 and parameters: {'x_0_0': 'bc', 'x_0_1': 'ac', 'x_1_0': 'ac', 'x_1_1': 'ab'}. Best is trial 23 with value: 0.5.
[I 2024-12-06 23:38:19,351] Trial 372 finished with value: 1.3214285714285714 and parameters: {'x_0_0': 'ad', 'x_0_1': 'ad', 'x_1_0': 'oo', 'x_1_1': 'ad'}. Best is trial 165 with value: 0.5.
2024-12-06 23:38:19,367 - INFO - Candidate Mean Stats: {'Max': np.float64(2.80333270656237), 'Min': np.float64(-0.5645054100447213), 'Mean': np.float64(0.7168509897900349), 'Std': np.float64(0.5138595338591784)}
2024-12-06 23:38:19,367 - INFO - Candidate Std Stats: {'Max': np.float64(1.858357700366603), 'Min': np.float64(0.0), 'Mean': np.float64(0.5177509259328894), 'Std': np.float64(0.33087264132378535)}
[I 2024-12-06 23:38:19,381] Trial 372 finished with value: 1.5 and parameters: {'x_0_0': 'cd', 'x_0_1': 'oo', 'x_1_0': 'ac', 'x_1_1': 'ad'}. Best is trial 63 with value: 0.5.
2024-12-06 23:38:19,665 - INFO - Candidate Mean Stats: {'Max': np.float64(2.953495650889015), 'Min': np.float64(-0.7027076113662624), 'Mean': np.float64(0.6562254573006531), 'Std': np.float64(0.5837453724043655)}
2024-12-06 23:38:19,665 - INFO - Candidate Std Stats: {'Max': np.float64(1.5484274491390992), 'Min': np.float64(0.0), 'Mean': np.float64(0.5385562653738049), 'Std': np.float64(0.3167356885915943)}
[I 2024-12-06 23:38:19,679] Trial 373 finished with value: 1.375 and parameters: {'x_0_0': 'oo', 'x_0_1': 'oo', 'x_1_0': 'bc', 'x_1_1': 'ac'}. Best is trial 76 with value: 0.5.
2024-12-06 23:38:19,714 - INFO - Candidate Mean Stats: {'Max': np.float64(3.005868399046818), 'Min': np.float64(-0.4227472002551094), 'Mean': np.float64(0.7693981670769885), 'Std': np.float64(0.5035927629305952)}
2024-12-06 23:38:19,714 - INFO - Candidate Std Stats: {'Max': np.float64(1.43563632737814), 'Min': np.float64(0.0), 'Mean': np.float64(0.45237427902145333), 'Std': np.float64(0.27559932359642747)}
2024-12-06 23:38:19,723 - INFO - Candidate Mean Stats: {'Max': np.float64(3.669677064248949), 'Min': np.float64(-0.7772407381029665), 'Mean': np.float64(0.6865415286979316), 'Std': np.float64(0.5929809968167672)}
2024-12-06 23:38:19,723 - INFO - Candidate Std Stats: {'Max': np.float64(1.8483493145735257), 'Min': np.float64(0.0), 'Mean': np.float64(0.5652211344492055), 'Std': np.float64(0.3588319394343958)}
[I 2024-12-06 23:38:19,728] Trial 371 finished with value: 1.5 and parameters: {'x_0_0': 'cd', 'x_0_1': 'oo', 'x_1_0': 'ab', 'x_1_1': 'ad'}. Best is trial 23 with value: 0.5.
[I 2024-12-06 23:38:19,737] Trial 373 finished with value: 1.3035714285714286 and parameters: {'x_0_0': 'ac', 'x_0_1': 'ab', 'x_1_0': 'bc', 'x_1_1': 'oo'}. Best is trial 165 with value: 0.5.
2024-12-06 23:38:19,752 - INFO - Candidate Mean Stats: {'Max': np.float64(3.1139578192048254), 'Min': np.float64(-0.5573537511761333), 'Mean': np.float64(0.7700843113462179), 'Std': np.float64(0.5129345949895384)}
2024-12-06 23:38:19,752 - INFO - Candidate Std Stats: {'Max': np.float64(1.3966549107791222), 'Min': np.float64(0.0), 'Mean': np.float64(0.4420197570100162), 'Std': np.float64(0.2704758913518309)}
[I 2024-12-06 23:38:19,765] Trial 373 finished with value: 1.3214285714285714 and parameters: {'x_0_0': 'ac', 'x_0_1': 'bc', 'x_1_0': 'oo', 'x_1_1': 'ad'}. Best is trial 63 with value: 0.5.
2024-12-06 23:38:20,049 - INFO - Candidate Mean Stats: {'Max': np.float64(3.4680256292271445), 'Min': np.float64(-0.6816099320127047), 'Mean': np.float64(0.7095541946496732), 'Std': np.float64(0.5764194789976146)}
2024-12-06 23:38:20,049 - INFO - Candidate Std Stats: {'Max': np.float64(1.7421409454923333), 'Min': np.float64(0.0), 'Mean': np.float64(0.4867986926640453), 'Std': np.float64(0.29425044602432404)}
[I 2024-12-06 23:38:20,064] Trial 374 finished with value: 1.1607142857142856 and parameters: {'x_0_0': 'bc', 'x_0_1': 'ad', 'x_1_0': 'bc', 'x_1_1': 'oo'}. Best is trial 76 with value: 0.5.
2024-12-06 23:38:20,103 - INFO - Candidate Mean Stats: {'Max': np.float64(2.9025423417132603), 'Min': np.float64(-0.8547719498524373), 'Mean': np.float64(0.7136848053513575), 'Std': np.float64(0.5590076098261325)}
2024-12-06 23:38:20,103 - INFO - Candidate Std Stats: {'Max': np.float64(1.8071380586359556), 'Min': np.float64(0.0), 'Mean': np.float64(0.5188171137460972), 'Std': np.float64(0.3201924823597427)}
2024-12-06 23:38:20,110 - INFO - Candidate Mean Stats: {'Max': np.float64(3.2262228862633306), 'Min': np.float64(-0.8947338468968044), 'Mean': np.float64(0.6458668464943539), 'Std': np.float64(0.5958799329445303)}
2024-12-06 23:38:20,110 - INFO - Candidate Std Stats: {'Max': np.float64(1.7785101226234812), 'Min': np.float64(0.0), 'Mean': np.float64(0.5971191751839172), 'Std': np.float64(0.36383255761737093)}
[I 2024-12-06 23:38:20,118] Trial 372 finished with value: 1.3214285714285714 and parameters: {'x_0_0': 'bd', 'x_0_1': 'bd', 'x_1_0': 'oo', 'x_1_1': 'bc'}. Best is trial 23 with value: 0.5.
[I 2024-12-06 23:38:20,124] Trial 374 finished with value: 1.3214285714285714 and parameters: {'x_0_0': 'ac', 'x_0_1': 'bd', 'x_1_0': 'oo', 'x_1_1': 'ab'}. Best is trial 165 with value: 0.5.
2024-12-06 23:38:20,137 - INFO - Candidate Mean Stats: {'Max': np.float64(2.8212090637410467), 'Min': np.float64(-0.5009954866592744), 'Mean': np.float64(0.7242533687363586), 'Std': np.float64(0.5145515990206914)}
2024-12-06 23:38:20,137 - INFO - Candidate Std Stats: {'Max': np.float64(1.560535258497493), 'Min': np.float64(0.0), 'Mean': np.float64(0.508873242521356), 'Std': np.float64(0.3073396151090108)}
[I 2024-12-06 23:38:20,150] Trial 374 finished with value: 1.0714285714285714 and parameters: {'x_0_0': 'bc', 'x_0_1': 'oo', 'x_1_0': 'ab', 'x_1_1': 'bc'}. Best is trial 63 with value: 0.5.
2024-12-06 23:38:20,435 - INFO - Candidate Mean Stats: {'Max': np.float64(3.035336011780013), 'Min': np.float64(-0.7052664122078379), 'Mean': np.float64(0.6727090470098042), 'Std': np.float64(0.5693485717383017)}
2024-12-06 23:38:20,435 - INFO - Candidate Std Stats: {'Max': np.float64(1.591560131397176), 'Min': np.float64(0.0), 'Mean': np.float64(0.5093221113255674), 'Std': np.float64(0.30531513778975317)}
[I 2024-12-06 23:38:20,449] Trial 375 finished with value: 1.2142857142857144 and parameters: {'x_0_0': 'ab', 'x_0_1': 'oo', 'x_1_0': 'ac', 'x_1_1': 'ab'}. Best is trial 76 with value: 0.5.
2024-12-06 23:38:20,489 - INFO - Candidate Mean Stats: {'Max': np.float64(3.6297745176726126), 'Min': np.float64(-0.5362126265811079), 'Mean': np.float64(0.7915678611249755), 'Std': np.float64(0.5118916077646241)}
2024-12-06 23:38:20,489 - INFO - Candidate Std Stats: {'Max': np.float64(1.5278786831315891), 'Min': np.float64(0.0), 'Mean': np.float64(0.43932530270392744), 'Std': np.float64(0.27629068876383905)}
2024-12-06 23:38:20,494 - INFO - Candidate Mean Stats: {'Max': np.float64(2.9187140363397233), 'Min': np.float64(-0.5050319668107586), 'Mean': np.float64(0.6548562518716712), 'Std': np.float64(0.5649590402443561)}
2024-12-06 23:38:20,494 - INFO - Candidate Std Stats: {'Max': np.float64(1.749127812652233), 'Min': np.float64(0.0), 'Mean': np.float64(0.5557211302600928), 'Std': np.float64(0.32648482229829656)}
[I 2024-12-06 23:38:20,504] Trial 373 finished with value: 1.0357142857142856 and parameters: {'x_0_0': 'ac', 'x_0_1': 'ac', 'x_1_0': 'oo', 'x_1_1': 'bc'}. Best is trial 23 with value: 0.5.
[I 2024-12-06 23:38:20,508] Trial 375 finished with value: 1.5714285714285714 and parameters: {'x_0_0': 'ad', 'x_0_1': 'ab', 'x_1_0': 'ac', 'x_1_1': 'ac'}. Best is trial 165 with value: 0.5.
2024-12-06 23:38:20,521 - INFO - Candidate Mean Stats: {'Max': np.float64(3.22759194183417), 'Min': np.float64(-0.716581626096515), 'Mean': np.float64(0.7282978231829804), 'Std': np.float64(0.5420047527905183)}
2024-12-06 23:38:20,521 - INFO - Candidate Std Stats: {'Max': np.float64(1.5690713314093705), 'Min': np.float64(0.0), 'Mean': np.float64(0.4978227943016557), 'Std': np.float64(0.29317346431627844)}
[I 2024-12-06 23:38:20,534] Trial 375 finished with value: 1.4464285714285714 and parameters: {'x_0_0': 'bc', 'x_0_1': 'bc', 'x_1_0': 'bc', 'x_1_1': 'oo'}. Best is trial 63 with value: 0.5.
2024-12-06 23:38:20,821 - INFO - Candidate Mean Stats: {'Max': np.float64(3.55213841672253), 'Min': np.float64(-1.1784129934116507), 'Mean': np.float64(0.6495042602122388), 'Std': np.float64(0.6448582656033167)}
2024-12-06 23:38:20,821 - INFO - Candidate Std Stats: {'Max': np.float64(1.9011348619565422), 'Min': np.float64(0.0), 'Mean': np.float64(0.5327671254882299), 'Std': np.float64(0.32267383374830116)}
[I 2024-12-06 23:38:20,836] Trial 376 finished with value: 1.1428571428571428 and parameters: {'x_0_0': 'ad', 'x_0_1': 'ac', 'x_1_0': 'bc', 'x_1_1': 'ab'}. Best is trial 76 with value: 0.5.
2024-12-06 23:38:20,878 - INFO - Candidate Mean Stats: {'Max': np.float64(3.5036535053292517), 'Min': np.float64(-0.9711847121451266), 'Mean': np.float64(0.6523083227580605), 'Std': np.float64(0.6241132497683756)}
2024-12-06 23:38:20,878 - INFO - Candidate Std Stats: {'Max': np.float64(1.5782847986646), 'Min': np.float64(0.0), 'Mean': np.float64(0.5977103266805885), 'Std': np.float64(0.35135508502458374)}
2024-12-06 23:38:20,881 - INFO - Candidate Mean Stats: {'Max': np.float64(3.0147463142804067), 'Min': np.float64(-0.6626596451704112), 'Mean': np.float64(0.6993550978460084), 'Std': np.float64(0.5747337657905653)}
2024-12-06 23:38:20,881 - INFO - Candidate Std Stats: {'Max': np.float64(1.7930848081220259), 'Min': np.float64(0.0), 'Mean': np.float64(0.5692331807807649), 'Std': np.float64(0.34283257700805203)}
[I 2024-12-06 23:38:20,892] Trial 376 finished with value: 1.2857142857142856 and parameters: {'x_0_0': 'ad', 'x_0_1': 'ac', 'x_1_0': 'bc', 'x_1_1': 'bc'}. Best is trial 165 with value: 0.5.
[I 2024-12-06 23:38:20,895] Trial 374 finished with value: 1.3214285714285714 and parameters: {'x_0_0': 'ac', 'x_0_1': 'bd', 'x_1_0': 'oo', 'x_1_1': 'ad'}. Best is trial 23 with value: 0.5.
2024-12-06 23:38:20,907 - INFO - Candidate Mean Stats: {'Max': np.float64(2.793415458357898), 'Min': np.float64(-0.6126407027025362), 'Mean': np.float64(0.7236083477685017), 'Std': np.float64(0.5281660239355148)}
2024-12-06 23:38:20,907 - INFO - Candidate Std Stats: {'Max': np.float64(1.6358060705290076), 'Min': np.float64(0.0), 'Mean': np.float64(0.5009323194262688), 'Std': np.float64(0.30408807440857455)}
[I 2024-12-06 23:38:20,921] Trial 376 finished with value: 1.1607142857142856 and parameters: {'x_0_0': 'ac', 'x_0_1': 'ac', 'x_1_0': 'cd', 'x_1_1': 'oo'}. Best is trial 63 with value: 0.5.
2024-12-06 23:38:21,208 - INFO - Candidate Mean Stats: {'Max': np.float64(3.076110732366076), 'Min': np.float64(-0.6040407035043908), 'Mean': np.float64(0.7123255142156935), 'Std': np.float64(0.541036795617164)}
2024-12-06 23:38:21,208 - INFO - Candidate Std Stats: {'Max': np.float64(1.4661965697511603), 'Min': np.float64(0.0), 'Mean': np.float64(0.5055029044701032), 'Std': np.float64(0.31335655073213875)}
[I 2024-12-06 23:38:21,222] Trial 377 finished with value: 1.4464285714285714 and parameters: {'x_0_0': 'bc', 'x_0_1': 'bc', 'x_1_0': 'ac', 'x_1_1': 'oo'}. Best is trial 76 with value: 0.5.
2024-12-06 23:38:21,265 - INFO - Candidate Mean Stats: {'Max': np.float64(3.282886770687709), 'Min': np.float64(-0.7997657626586238), 'Mean': np.float64(0.6673561908872865), 'Std': np.float64(0.6124809739457796)}
2024-12-06 23:38:21,265 - INFO - Candidate Std Stats: {'Max': np.float64(1.7926113805955766), 'Min': np.float64(0.0), 'Mean': np.float64(0.5625114593268011), 'Std': np.float64(0.33617097553881065)}
2024-12-06 23:38:21,271 - INFO - Candidate Mean Stats: {'Max': np.float64(3.2351088142817424), 'Min': np.float64(-0.457950705529439), 'Mean': np.float64(0.7781390393471271), 'Std': np.float64(0.4879559940501843)}
2024-12-06 23:38:21,271 - INFO - Candidate Std Stats: {'Max': np.float64(1.5940555577650932), 'Min': np.float64(0.0), 'Mean': np.float64(0.4385594219502981), 'Std': np.float64(0.2774911130357317)}
