[I 2024-12-06 23:38:49,985] Trial 449 finished with value: 1.0357142857142856 and parameters: {'x_0_0': 'bc', 'x_0_1': 'ac', 'x_1_0': 'oo', 'x_1_1': 'ab'}. Best is trial 165 with value: 0.5.
2024-12-06 23:38:50,038 - INFO - Candidate Mean Stats: {'Max': np.float64(3.1179140494836926), 'Min': np.float64(-0.5448468293797475), 'Mean': np.float64(0.8044153696480818), 'Std': np.float64(0.5018365830786512)}
2024-12-06 23:38:50,038 - INFO - Candidate Std Stats: {'Max': np.float64(1.414738705655744), 'Min': np.float64(0.0), 'Mean': np.float64(0.4859161613190313), 'Std': np.float64(0.3133244286390394)}
[I 2024-12-06 23:38:50,053] Trial 449 finished with value: 1.3214285714285714 and parameters: {'x_0_0': 'ac', 'x_0_1': 'bc', 'x_1_0': 'oo', 'x_1_1': 'bd'}. Best is trial 63 with value: 0.5.
2024-12-06 23:38:50,231 - INFO - Candidate Mean Stats: {'Max': np.float64(3.038532217681321), 'Min': np.float64(-0.41245180056199005), 'Mean': np.float64(0.796207992577109), 'Std': np.float64(0.5023604271478257)}
2024-12-06 23:38:50,231 - INFO - Candidate Std Stats: {'Max': np.float64(1.967287614833751), 'Min': np.float64(0.0), 'Mean': np.float64(0.4544560435004529), 'Std': np.float64(0.3014388024783955)}
[I 2024-12-06 23:38:50,249] Trial 447 finished with value: 1.875 and parameters: {'x_0_0': 'oo', 'x_0_1': 'ab', 'x_1_0': 'bc', 'x_1_1': 'ab'}. Best is trial 23 with value: 0.5.
2024-12-06 23:38:50,395 - INFO - Candidate Mean Stats: {'Max': np.float64(2.8793377985113104), 'Min': np.float64(-0.8450531307432959), 'Mean': np.float64(0.7662987122586679), 'Std': np.float64(0.5455099658125522)}
2024-12-06 23:38:50,395 - INFO - Candidate Std Stats: {'Max': np.float64(1.67694271071169), 'Min': np.float64(0.0), 'Mean': np.float64(0.5039633594738777), 'Std': np.float64(0.32530266278212316)}
[I 2024-12-06 23:38:50,412] Trial 450 finished with value: 1.2142857142857144 and parameters: {'x_0_0': 'ab', 'x_0_1': 'oo', 'x_1_0': 'bc', 'x_1_1': 'bd'}. Best is trial 76 with value: 0.5.
2024-12-06 23:38:50,442 - INFO - Candidate Mean Stats: {'Max': np.float64(3.1468511967372685), 'Min': np.float64(-0.4059921877905325), 'Mean': np.float64(0.819731045573464), 'Std': np.float64(0.5390202104425452)}
2024-12-06 23:38:50,442 - INFO - Candidate Std Stats: {'Max': np.float64(1.543392312749707), 'Min': np.float64(0.0), 'Mean': np.float64(0.4329613089091675), 'Std': np.float64(0.28062259565754033)}
[I 2024-12-06 23:38:50,459] Trial 450 finished with value: 1.3214285714285714 and parameters: {'x_0_0': 'bd', 'x_0_1': 'ad', 'x_1_0': 'oo', 'x_1_1': 'cd'}. Best is trial 165 with value: 0.5.
2024-12-06 23:38:50,519 - INFO - Candidate Mean Stats: {'Max': np.float64(2.832216073231552), 'Min': np.float64(-0.44214045616565584), 'Mean': np.float64(0.7987088928691812), 'Std': np.float64(0.5317109690375382)}
2024-12-06 23:38:50,519 - INFO - Candidate Std Stats: {'Max': np.float64(1.3820599188228488), 'Min': np.float64(0.0), 'Mean': np.float64(0.4427056747329972), 'Std': np.float64(0.2825663605318096)}
[I 2024-12-06 23:38:50,536] Trial 450 finished with value: 1.2857142857142856 and parameters: {'x_0_0': 'ad', 'x_0_1': 'ac', 'x_1_0': 'bc', 'x_1_1': 'cd'}. Best is trial 63 with value: 0.5.
2024-12-06 23:38:50,665 - INFO - Candidate Mean Stats: {'Max': np.float64(2.9432487298520065), 'Min': np.float64(-0.4634275883119582), 'Mean': np.float64(0.8300280694092698), 'Std': np.float64(0.5247042818309466)}
2024-12-06 23:38:50,665 - INFO - Candidate Std Stats: {'Max': np.float64(1.3707844451114475), 'Min': np.float64(0.0), 'Mean': np.float64(0.4242606016766346), 'Std': np.float64(0.2816825277830045)}
[I 2024-12-06 23:38:50,680] Trial 448 finished with value: 1.1607142857142856 and parameters: {'x_0_0': 'ac', 'x_0_1': 'ac', 'x_1_0': 'bc', 'x_1_1': 'oo'}. Best is trial 23 with value: 0.5.
2024-12-06 23:38:50,821 - INFO - Candidate Mean Stats: {'Max': np.float64(2.8639371556016453), 'Min': np.float64(-0.3849864173293741), 'Mean': np.float64(0.8486807119935935), 'Std': np.float64(0.4733288642281846)}
2024-12-06 23:38:50,821 - INFO - Candidate Std Stats: {'Max': np.float64(1.7560139184883652), 'Min': np.float64(0.0), 'Mean': np.float64(0.478804654557239), 'Std': np.float64(0.3237214340491908)}
[I 2024-12-06 23:38:50,836] Trial 451 finished with value: 1.25 and parameters: {'x_0_0': 'cd', 'x_0_1': 'oo', 'x_1_0': 'oo', 'x_1_1': 'cd'}. Best is trial 76 with value: 0.5.
2024-12-06 23:38:50,862 - INFO - Candidate Mean Stats: {'Max': np.float64(3.27906907441776), 'Min': np.float64(-0.4136481179050707), 'Mean': np.float64(0.7740551092992098), 'Std': np.float64(0.49669932568360337)}
2024-12-06 23:38:50,863 - INFO - Candidate Std Stats: {'Max': np.float64(1.4689264916031193), 'Min': np.float64(0.0), 'Mean': np.float64(0.4442137045487952), 'Std': np.float64(0.2822846775641038)}
[I 2024-12-06 23:38:50,877] Trial 451 finished with value: 1.3392857142857144 and parameters: {'x_0_0': 'ab', 'x_0_1': 'ad', 'x_1_0': 'oo', 'x_1_1': 'oo'}. Best is trial 165 with value: 0.5.
2024-12-06 23:38:50,942 - INFO - Candidate Mean Stats: {'Max': np.float64(2.7899804900188023), 'Min': np.float64(-0.5885367820563142), 'Mean': np.float64(0.7488122782621933), 'Std': np.float64(0.5365477507209588)}
2024-12-06 23:38:50,942 - INFO - Candidate Std Stats: {'Max': np.float64(1.5979349146221478), 'Min': np.float64(0.0), 'Mean': np.float64(0.4540571876942808), 'Std': np.float64(0.3096353471158507)}
[I 2024-12-06 23:38:50,959] Trial 451 finished with value: 1.2857142857142856 and parameters: {'x_0_0': 'bd', 'x_0_1': 'ac', 'x_1_0': 'bd', 'x_1_1': 'ad'}. Best is trial 63 with value: 0.5.
2024-12-06 23:38:51,089 - INFO - Candidate Mean Stats: {'Max': np.float64(2.9462951375269326), 'Min': np.float64(-0.4724904444856094), 'Mean': np.float64(0.8395909666928175), 'Std': np.float64(0.5095777584293648)}
2024-12-06 23:38:51,089 - INFO - Candidate Std Stats: {'Max': np.float64(1.44164253905022), 'Min': np.float64(0.0), 'Mean': np.float64(0.4483705126224789), 'Std': np.float64(0.3001050293213487)}
[I 2024-12-06 23:38:51,104] Trial 449 finished with value: 1.1785714285714286 and parameters: {'x_0_0': 'ac', 'x_0_1': 'ab', 'x_1_0': 'oo', 'x_1_1': 'cd'}. Best is trial 23 with value: 0.5.
2024-12-06 23:38:51,348 - INFO - Candidate Mean Stats: {'Max': np.float64(3.1717677468675456), 'Min': np.float64(-0.40493711195957405), 'Mean': np.float64(0.8242486399883748), 'Std': np.float64(0.4973955792423663)}
2024-12-06 23:38:51,348 - INFO - Candidate Std Stats: {'Max': np.float64(1.5016401392256988), 'Min': np.float64(0.0), 'Mean': np.float64(0.40328594777416643), 'Std': np.float64(0.27416524161923006)}
[I 2024-12-06 23:38:51,389] Trial 452 finished with value: 1.4464285714285714 and parameters: {'x_0_0': 'ac', 'x_0_1': 'bd', 'x_1_0': 'bc', 'x_1_1': 'oo'}. Best is trial 76 with value: 0.5.
2024-12-06 23:38:51,521 - INFO - Candidate Mean Stats: {'Max': np.float64(3.4215118492126906), 'Min': np.float64(-0.6466240490266518), 'Mean': np.float64(0.7791139403351535), 'Std': np.float64(0.5625758601858162)}
2024-12-06 23:38:51,521 - INFO - Candidate Std Stats: {'Max': np.float64(1.435507297915963), 'Min': np.float64(0.0), 'Mean': np.float64(0.46650139396104773), 'Std': np.float64(0.2983350047024994)}
[I 2024-12-06 23:38:51,566] Trial 452 finished with value: 0.8928571428571428 and parameters: {'x_0_0': 'ac', 'x_0_1': 'ad', 'x_1_0': 'oo', 'x_1_1': 'ab'}. Best is trial 165 with value: 0.5.
2024-12-06 23:38:51,865 - INFO - Candidate Mean Stats: {'Max': np.float64(3.5450332371413467), 'Min': np.float64(-0.5367130477583076), 'Mean': np.float64(0.8324613994169171), 'Std': np.float64(0.5169519823333941)}
2024-12-06 23:38:51,865 - INFO - Candidate Std Stats: {'Max': np.float64(2.1165241785380395), 'Min': np.float64(0.0), 'Mean': np.float64(0.46559432227697944), 'Std': np.float64(0.3079031810595417)}
[I 2024-12-06 23:38:51,965] Trial 452 finished with value: 1.3214285714285714 and parameters: {'x_0_0': 'ac', 'x_0_1': 'bd', 'x_1_0': 'oo', 'x_1_1': 'ab'}. Best is trial 63 with value: 0.5.
2024-12-06 23:38:52,503 - INFO - Candidate Mean Stats: {'Max': np.float64(3.1443385138721793), 'Min': np.float64(-0.44956182200061495), 'Mean': np.float64(0.8300985943024121), 'Std': np.float64(0.5312903468436427)}
2024-12-06 23:38:52,504 - INFO - Candidate Std Stats: {'Max': np.float64(1.719657414046619), 'Min': np.float64(0.0), 'Mean': np.float64(0.4522922982287585), 'Std': np.float64(0.2943389683546071)}
[I 2024-12-06 23:38:52,547] Trial 450 finished with value: 1.2857142857142856 and parameters: {'x_0_0': 'ac', 'x_0_1': 'ac', 'x_1_0': 'cd', 'x_1_1': 'ab'}. Best is trial 23 with value: 0.5.
2024-12-06 23:38:52,834 - INFO - Candidate Mean Stats: {'Max': np.float64(3.042873104772281), 'Min': np.float64(-0.45427034932746385), 'Mean': np.float64(0.8124806444624733), 'Std': np.float64(0.507186646512343)}
2024-12-06 23:38:52,834 - INFO - Candidate Std Stats: {'Max': np.float64(1.3791909494283894), 'Min': np.float64(0.0), 'Mean': np.float64(0.4480017406455912), 'Std': np.float64(0.2940200390337257)}
[I 2024-12-06 23:38:52,921] Trial 453 finished with value: 1.1607142857142856 and parameters: {'x_0_0': 'bc', 'x_0_1': 'ac', 'x_1_0': 'cd', 'x_1_1': 'oo'}. Best is trial 76 with value: 0.5.
2024-12-06 23:38:52,962 - INFO - Candidate Mean Stats: {'Max': np.float64(3.4654457079194088), 'Min': np.float64(-0.4022780948788129), 'Mean': np.float64(0.84728655032698), 'Std': np.float64(0.4684905371711002)}
2024-12-06 23:38:52,963 - INFO - Candidate Std Stats: {'Max': np.float64(1.5749732533025644), 'Min': np.float64(0.0), 'Mean': np.float64(0.42717543295663224), 'Std': np.float64(0.2926495227152702)}
[I 2024-12-06 23:38:53,000] Trial 453 finished with value: 1.375 and parameters: {'x_0_0': 'cd', 'x_0_1': 'oo', 'x_1_0': 'bd', 'x_1_1': 'oo'}. Best is trial 165 with value: 0.5.
2024-12-06 23:38:53,117 - INFO - Candidate Mean Stats: {'Max': np.float64(2.624680840551658), 'Min': np.float64(-0.7729078103888495), 'Mean': np.float64(0.7572110599644204), 'Std': np.float64(0.5245067531887506)}
2024-12-06 23:38:53,118 - INFO - Candidate Std Stats: {'Max': np.float64(1.5925295184477668), 'Min': np.float64(0.0), 'Mean': np.float64(0.47649279053127047), 'Std': np.float64(0.3158798194546264)}
[I 2024-12-06 23:38:53,167] Trial 453 finished with value: 1.3214285714285714 and parameters: {'x_0_0': 'ac', 'x_0_1': 'cd', 'x_1_0': 'oo', 'x_1_1': 'ab'}. Best is trial 63 with value: 0.5.
2024-12-06 23:38:53,517 - INFO - Candidate Mean Stats: {'Max': np.float64(3.2713789690631594), 'Min': np.float64(-0.16025087654502518), 'Mean': np.float64(0.8641899461823468), 'Std': np.float64(0.4674465154560902)}
2024-12-06 23:38:53,517 - INFO - Candidate Std Stats: {'Max': np.float64(1.2901711777833742), 'Min': np.float64(0.0), 'Mean': np.float64(0.3760647661109594), 'Std': np.float64(0.2461378778057519)}
[I 2024-12-06 23:38:53,536] Trial 451 finished with value: 1.2142857142857144 and parameters: {'x_0_0': 'ab', 'x_0_1': 'oo', 'x_1_0': 'ab', 'x_1_1': 'bd'}. Best is trial 23 with value: 0.5.
2024-12-06 23:38:53,702 - INFO - Candidate Mean Stats: {'Max': np.float64(3.690202351190771), 'Min': np.float64(-0.6907268287411764), 'Mean': np.float64(0.8332597053862465), 'Std': np.float64(0.541446498992974)}
2024-12-06 23:38:53,702 - INFO - Candidate Std Stats: {'Max': np.float64(1.4088365645990983), 'Min': np.float64(0.0), 'Mean': np.float64(0.45029453406370235), 'Std': np.float64(0.29513160546934186)}
[I 2024-12-06 23:38:53,723] Trial 454 finished with value: 1.3214285714285714 and parameters: {'x_0_0': 'ad', 'x_0_1': 'bd', 'x_1_0': 'oo', 'x_1_1': 'ac'}. Best is trial 76 with value: 0.5.
2024-12-06 23:38:53,754 - INFO - Candidate Mean Stats: {'Max': np.float64(2.930321400279134), 'Min': np.float64(-0.9293770276291881), 'Mean': np.float64(0.7454606900689331), 'Std': np.float64(0.6096196028597257)}
2024-12-06 23:38:53,754 - INFO - Candidate Std Stats: {'Max': np.float64(1.6726586867327697), 'Min': np.float64(0.0), 'Mean': np.float64(0.48779042117360516), 'Std': np.float64(0.32487174688401266)}
[I 2024-12-06 23:38:53,775] Trial 454 finished with value: 1.5714285714285714 and parameters: {'x_0_0': 'ad', 'x_0_1': 'ac', 'x_1_0': 'ad', 'x_1_1': 'bc'}. Best is trial 165 with value: 0.5.
2024-12-06 23:38:53,859 - INFO - Candidate Mean Stats: {'Max': np.float64(2.869183833236369), 'Min': np.float64(-0.38239744872804693), 'Mean': np.float64(0.8365524361656331), 'Std': np.float64(0.48399577338746624)}
2024-12-06 23:38:53,859 - INFO - Candidate Std Stats: {'Max': np.float64(1.3536388617416228), 'Min': np.float64(0.0), 'Mean': np.float64(0.4185918393613051), 'Std': np.float64(0.27763139952411997)}
[I 2024-12-06 23:38:53,888] Trial 454 finished with value: 1.5714285714285714 and parameters: {'x_0_0': 'ad', 'x_0_1': 'bc', 'x_1_0': 'cd', 'x_1_1': 'bd'}. Best is trial 63 with value: 0.5.
2024-12-06 23:38:54,207 - INFO - Candidate Mean Stats: {'Max': np.float64(3.050045191326597), 'Min': np.float64(-0.5729542651704811), 'Mean': np.float64(0.7664450910640599), 'Std': np.float64(0.5564296954329132)}
2024-12-06 23:38:54,207 - INFO - Candidate Std Stats: {'Max': np.float64(1.28289855857549), 'Min': np.float64(0.0), 'Mean': np.float64(0.44212168555775094), 'Std': np.float64(0.28316393797580425)}
[I 2024-12-06 23:38:54,227] Trial 452 finished with value: 1.2857142857142856 and parameters: {'x_0_0': 'ac', 'x_0_1': 'ac', 'x_1_0': 'bd', 'x_1_1': 'ab'}. Best is trial 23 with value: 0.5.
2024-12-06 23:38:54,398 - INFO - Candidate Mean Stats: {'Max': np.float64(3.3235044009640107), 'Min': np.float64(-0.6655909848591322), 'Mean': np.float64(0.7954548291815157), 'Std': np.float64(0.5083057147969066)}
2024-12-06 23:38:54,398 - INFO - Candidate Std Stats: {'Max': np.float64(1.7233561964556534), 'Min': np.float64(0.0), 'Mean': np.float64(0.45093931473809545), 'Std': np.float64(0.30422692609084706)}
[I 2024-12-06 23:38:54,421] Trial 455 finished with value: 1.3214285714285714 and parameters: {'x_0_0': 'ad', 'x_0_1': 'ad', 'x_1_0': 'oo', 'x_1_1': 'bd'}. Best is trial 76 with value: 0.5.
2024-12-06 23:38:54,523 - INFO - Candidate Mean Stats: {'Max': np.float64(3.1675497447946337), 'Min': np.float64(-0.6851711655053275), 'Mean': np.float64(0.7351375692399704), 'Std': np.float64(0.5571445747751411)}
2024-12-06 23:38:54,523 - INFO - Candidate Std Stats: {'Max': np.float64(1.6602001789113783), 'Min': np.float64(0.0), 'Mean': np.float64(0.5110871444969497), 'Std': np.float64(0.3428167808239044)}
[I 2024-12-06 23:38:54,568] Trial 455 finished with value: 1.5714285714285714 and parameters: {'x_0_0': 'ac', 'x_0_1': 'bc', 'x_1_0': 'bd', 'x_1_1': 'ab'}. Best is trial 165 with value: 0.5.
2024-12-06 23:38:54,669 - INFO - Candidate Mean Stats: {'Max': np.float64(3.095598066812876), 'Min': np.float64(-0.672887122287055), 'Mean': np.float64(0.7967920120816936), 'Std': np.float64(0.5280258693790351)}
2024-12-06 23:38:54,670 - INFO - Candidate Std Stats: {'Max': np.float64(1.4709860642446515), 'Min': np.float64(0.0), 'Mean': np.float64(0.4794112858863008), 'Std': np.float64(0.3160348627894108)}
[I 2024-12-06 23:38:54,705] Trial 455 finished with value: 1.3214285714285714 and parameters: {'x_0_0': 'bd', 'x_0_1': 'ad', 'x_1_0': 'oo', 'x_1_1': 'bc'}. Best is trial 63 with value: 0.5.
2024-12-06 23:38:55,078 - INFO - Candidate Mean Stats: {'Max': np.float64(3.311952514866539), 'Min': np.float64(-0.41160086111331023), 'Mean': np.float64(0.8529276898558139), 'Std': np.float64(0.5193300970159652)}
2024-12-06 23:38:55,078 - INFO - Candidate Std Stats: {'Max': np.float64(1.2911626110435925), 'Min': np.float64(0.0), 'Mean': np.float64(0.39724044844429124), 'Std': np.float64(0.25766228775029154)}
[I 2024-12-06 23:38:55,109] Trial 453 finished with value: 1.3035714285714286 and parameters: {'x_0_0': 'ac', 'x_0_1': 'ab', 'x_1_0': 'ab', 'x_1_1': 'oo'}. Best is trial 23 with value: 0.5.
2024-12-06 23:38:55,267 - INFO - Candidate Mean Stats: {'Max': np.float64(2.945404165301428), 'Min': np.float64(-0.5034724972244901), 'Mean': np.float64(0.7961043532097656), 'Std': np.float64(0.4895916635438042)}
2024-12-06 23:38:55,267 - INFO - Candidate Std Stats: {'Max': np.float64(1.8097498379339798), 'Min': np.float64(0.0), 'Mean': np.float64(0.4938627361862667), 'Std': np.float64(0.3307466878736048)}
[I 2024-12-06 23:38:55,302] Trial 456 finished with value: 1.3214285714285714 and parameters: {'x_0_0': 'bd', 'x_0_1': 'ad', 'x_1_0': 'oo', 'x_1_1': 'cd'}. Best is trial 76 with value: 0.5.
2024-12-06 23:38:55,382 - INFO - Candidate Mean Stats: {'Max': np.float64(3.086544383479491), 'Min': np.float64(-0.6915208160042008), 'Mean': np.float64(0.6915058158044965), 'Std': np.float64(0.6039208139537685)}
2024-12-06 23:38:55,383 - INFO - Candidate Std Stats: {'Max': np.float64(1.616796459187242), 'Min': np.float64(0.0), 'Mean': np.float64(0.5282442977416407), 'Std': np.float64(0.3332029413746358)}
[I 2024-12-06 23:38:55,411] Trial 456 finished with value: 1.4285714285714286 and parameters: {'x_0_0': 'ad', 'x_0_1': 'ac', 'x_1_0': 'ab', 'x_1_1': 'ad'}. Best is trial 165 with value: 0.5.
2024-12-06 23:38:55,482 - INFO - Candidate Mean Stats: {'Max': np.float64(3.0326307022668515), 'Min': np.float64(-0.5092183190049913), 'Mean': np.float64(0.8066207811866648), 'Std': np.float64(0.5356605846899121)}
2024-12-06 23:38:55,482 - INFO - Candidate Std Stats: {'Max': np.float64(1.4694715292705898), 'Min': np.float64(0.0), 'Mean': np.float64(0.46777451639250783), 'Std': np.float64(0.30171098563119064)}
[I 2024-12-06 23:38:55,522] Trial 456 finished with value: 1.3214285714285714 and parameters: {'x_0_0': 'bd', 'x_0_1': 'ac', 'x_1_0': 'oo', 'x_1_1': 'bc'}. Best is trial 63 with value: 0.5.
2024-12-06 23:38:55,841 - INFO - Candidate Mean Stats: {'Max': np.float64(3.1029237537398835), 'Min': np.float64(-0.4000751193600549), 'Mean': np.float64(0.8227868784472129), 'Std': np.float64(0.4824688813784824)}
2024-12-06 23:38:55,841 - INFO - Candidate Std Stats: {'Max': np.float64(1.6288470161280857), 'Min': np.float64(0.0), 'Mean': np.float64(0.4155586655685671), 'Std': np.float64(0.2773696333615589)}
[I 2024-12-06 23:38:55,864] Trial 454 finished with value: 1.375 and parameters: {'x_0_0': 'oo', 'x_0_1': 'oo', 'x_1_0': 'ad', 'x_1_1': 'ab'}. Best is trial 23 with value: 0.5.
2024-12-06 23:38:55,934 - INFO - Candidate Mean Stats: {'Max': np.float64(3.0355730429454097), 'Min': np.float64(-0.6458093170918069), 'Mean': np.float64(0.8028262470781358), 'Std': np.float64(0.5175605769987855)}
2024-12-06 23:38:55,934 - INFO - Candidate Std Stats: {'Max': np.float64(1.4053958043801758), 'Min': np.float64(0.0), 'Mean': np.float64(0.44635251839814294), 'Std': np.float64(0.2959312017187903)}
[I 2024-12-06 23:38:55,951] Trial 457 finished with value: 1.3392857142857144 and parameters: {'x_0_0': 'ab', 'x_0_1': 'ad', 'x_1_0': 'oo', 'x_1_1': 'oo'}. Best is trial 76 with value: 0.5.
2024-12-06 23:38:56,000 - INFO - Candidate Mean Stats: {'Max': np.float64(2.881755288661435), 'Min': np.float64(-0.5637788426078201), 'Mean': np.float64(0.7999529642373802), 'Std': np.float64(0.5377469076622579)}
2024-12-06 23:38:56,000 - INFO - Candidate Std Stats: {'Max': np.float64(1.5839278481170538), 'Min': np.float64(0.0), 'Mean': np.float64(0.43692904936450194), 'Std': np.float64(0.2914776973341017)}
[I 2024-12-06 23:38:56,016] Trial 457 finished with value: 1.3035714285714286 and parameters: {'x_0_0': 'bc', 'x_0_1': 'ab', 'x_1_0': 'ab', 'x_1_1': 'oo'}. Best is trial 165 with value: 0.5.
2024-12-06 23:38:56,061 - INFO - Candidate Mean Stats: {'Max': np.float64(3.1323324863328197), 'Min': np.float64(-0.37162656541740896), 'Mean': np.float64(0.8164884778626522), 'Std': np.float64(0.4734878982429774)}
2024-12-06 23:38:56,062 - INFO - Candidate Std Stats: {'Max': np.float64(1.5049633731267853), 'Min': np.float64(0.0), 'Mean': np.float64(0.4353302769742282), 'Std': np.float64(0.2934319596124223)}
[I 2024-12-06 23:38:56,076] Trial 457 finished with value: 1.375 and parameters: {'x_0_0': 'oo', 'x_0_1': 'oo', 'x_1_0': 'bc', 'x_1_1': 'bd'}. Best is trial 63 with value: 0.5.
2024-12-06 23:38:56,291 - INFO - Candidate Mean Stats: {'Max': np.float64(2.9990321979645462), 'Min': np.float64(-0.4845057046462237), 'Mean': np.float64(0.7916691039505532), 'Std': np.float64(0.5074835841515577)}
2024-12-06 23:38:56,291 - INFO - Candidate Std Stats: {'Max': np.float64(1.7729065380563522), 'Min': np.float64(0.0), 'Mean': np.float64(0.5060690716028895), 'Std': np.float64(0.3235938204441916)}
[I 2024-12-06 23:38:56,306] Trial 455 finished with value: 1.1607142857142856 and parameters: {'x_0_0': 'bc', 'x_0_1': 'ad', 'x_1_0': 'ac', 'x_1_1': 'oo'}. Best is trial 23 with value: 0.5.
2024-12-06 23:38:56,371 - INFO - Candidate Mean Stats: {'Max': np.float64(2.7960752510709788), 'Min': np.float64(-0.40612049883493373), 'Mean': np.float64(0.8250692677520843), 'Std': np.float64(0.5277579386500997)}
2024-12-06 23:38:56,372 - INFO - Candidate Std Stats: {'Max': np.float64(1.9874874644000244), 'Min': np.float64(0.0), 'Mean': np.float64(0.4582506440991219), 'Std': np.float64(0.313134048948531)}
[I 2024-12-06 23:38:56,386] Trial 458 finished with value: 1.5714285714285714 and parameters: {'x_0_0': 'bd', 'x_0_1': 'cd', 'x_1_0': 'ac', 'x_1_1': 'ad'}. Best is trial 76 with value: 0.5.
2024-12-06 23:38:56,435 - INFO - Candidate Mean Stats: {'Max': np.float64(3.4694579393334863), 'Min': np.float64(-0.4492640593842433), 'Mean': np.float64(0.8506434943867547), 'Std': np.float64(0.48528270025216336)}
2024-12-06 23:38:56,435 - INFO - Candidate Std Stats: {'Max': np.float64(1.5110733770604348), 'Min': np.float64(0.0), 'Mean': np.float64(0.4071765889766597), 'Std': np.float64(0.2785193719286283)}
