[I 2024-12-06 23:49:05,667] Trial 26 finished with value: 1.6777777777777778 and parameters: {'x_0_0': 'ab', 'x_0_1': 'cd', 'x_0_2': 'ad', 'x_1_0': 'ad', 'x_1_1': 'ab', 'x_1_2': 'oo'}. Best is trial 13 with value: 1.1222222222222222.
2024-12-06 23:49:23,795 - INFO - Candidate Mean Stats: {'Max': np.float64(2.0), 'Min': np.float64(0.27473171151339093), 'Mean': np.float64(0.4756999885887877), 'Std': np.float64(0.06355634682383829)}
2024-12-06 23:49:23,796 - INFO - Candidate Std Stats: {'Max': np.float64(0.8023912782785076), 'Min': np.float64(0.0), 'Mean': np.float64(0.10927878367689099), 'Std': np.float64(0.05107433511285346)}
[I 2024-12-06 23:49:23,855] Trial 27 finished with value: 1.3444444444444443 and parameters: {'x_0_0': 'ac', 'x_0_1': 'ad', 'x_0_2': 'oo', 'x_1_0': 'ac', 'x_1_1': 'ac', 'x_1_2': 'ad'}. Best is trial 22 with value: 1.1666666666666665.
2024-12-06 23:49:25,149 - INFO - Candidate Mean Stats: {'Max': np.float64(2.0), 'Min': np.float64(0.2504386624623149), 'Mean': np.float64(0.4982888808858371), 'Std': np.float64(0.056879473936552856)}
2024-12-06 23:49:25,150 - INFO - Candidate Std Stats: {'Max': np.float64(0.37458288030159115), 'Min': np.float64(0.0), 'Mean': np.float64(0.09919362719025669), 'Std': np.float64(0.04007376832867122)}
[I 2024-12-06 23:49:25,210] Trial 27 finished with value: 1.3333333333333333 and parameters: {'x_0_0': 'ac', 'x_0_1': 'ad', 'x_0_2': 'bc', 'x_1_0': 'ab', 'x_1_1': 'ab', 'x_1_2': 'ac'}. Best is trial 2 with value: 0.9666666666666667.
2024-12-06 23:49:25,898 - INFO - Candidate Mean Stats: {'Max': np.float64(2.0), 'Min': np.float64(0.28331648748993565), 'Mean': np.float64(0.4917991411729814), 'Std': np.float64(0.05766191109850772)}
2024-12-06 23:49:25,898 - INFO - Candidate Std Stats: {'Max': np.float64(0.47709841204652587), 'Min': np.float64(0.0), 'Mean': np.float64(0.10190009347981421), 'Std': np.float64(0.04228915044612645)}
[I 2024-12-06 23:49:25,954] Trial 27 finished with value: 1.5666666666666667 and parameters: {'x_0_0': 'bd', 'x_0_1': 'ad', 'x_0_2': 'ad', 'x_1_0': 'ad', 'x_1_1': 'oo', 'x_1_2': 'bc'}. Best is trial 7 with value: 1.077777777777778.
2024-12-06 23:49:30,538 - INFO - Candidate Mean Stats: {'Max': np.float64(1.9), 'Min': np.float64(0.23320285313203132), 'Mean': np.float64(0.49470954639305204), 'Std': np.float64(0.056509191543203316)}
2024-12-06 23:49:30,539 - INFO - Candidate Std Stats: {'Max': np.float64(0.4308775704790836), 'Min': np.float64(0.0), 'Mean': np.float64(0.1049964562672115), 'Std': np.float64(0.044297418089576907)}
[I 2024-12-06 23:49:30,588] Trial 27 finished with value: 1.4444444444444444 and parameters: {'x_0_0': 'ad', 'x_0_1': 'bc', 'x_0_2': 'cd', 'x_1_0': 'bd', 'x_1_1': 'ad', 'x_1_2': 'ab'}. Best is trial 13 with value: 1.1222222222222222.
2024-12-06 23:49:49,460 - INFO - Candidate Mean Stats: {'Max': np.float64(2.0), 'Min': np.float64(0.2769905710034122), 'Mean': np.float64(0.4883065608023199), 'Std': np.float64(0.058630240575855516)}
2024-12-06 23:49:49,461 - INFO - Candidate Std Stats: {'Max': np.float64(0.3582855764073676), 'Min': np.float64(0.0), 'Mean': np.float64(0.10039016383145728), 'Std': np.float64(0.04097301096677436)}
[I 2024-12-06 23:49:49,518] Trial 28 finished with value: 1.6666666666666665 and parameters: {'x_0_0': 'ad', 'x_0_1': 'ab', 'x_0_2': 'bc', 'x_1_0': 'cd', 'x_1_1': 'ac', 'x_1_2': 'ad'}. Best is trial 22 with value: 1.1666666666666665.
2024-12-06 23:49:50,774 - INFO - Candidate Mean Stats: {'Max': np.float64(2.0), 'Min': np.float64(0.2675613104973899), 'Mean': np.float64(0.48445608747973), 'Std': np.float64(0.05659975069063697)}
2024-12-06 23:49:50,774 - INFO - Candidate Std Stats: {'Max': np.float64(0.5804462732229443), 'Min': np.float64(0.0), 'Mean': np.float64(0.10481714478150238), 'Std': np.float64(0.04258052698376935)}
[I 2024-12-06 23:49:50,827] Trial 28 finished with value: 1.9 and parameters: {'x_0_0': 'oo', 'x_0_1': 'ac', 'x_0_2': 'cd', 'x_1_0': 'cd', 'x_1_1': 'cd', 'x_1_2': 'bd'}. Best is trial 2 with value: 0.9666666666666667.
2024-12-06 23:49:51,570 - INFO - Candidate Mean Stats: {'Max': np.float64(2.0), 'Min': np.float64(0.26930136130214366), 'Mean': np.float64(0.4963144711241237), 'Std': np.float64(0.059098685687585174)}
2024-12-06 23:49:51,571 - INFO - Candidate Std Stats: {'Max': np.float64(0.36868823104488435), 'Min': np.float64(0.0), 'Mean': np.float64(0.10132234572874241), 'Std': np.float64(0.043855798689113094)}
[I 2024-12-06 23:49:51,625] Trial 28 finished with value: 1.6666666666666665 and parameters: {'x_0_0': 'ad', 'x_0_1': 'cd', 'x_0_2': 'cd', 'x_1_0': 'ac', 'x_1_1': 'ad', 'x_1_2': 'bd'}. Best is trial 7 with value: 1.077777777777778.
2024-12-06 23:49:55,941 - INFO - Candidate Mean Stats: {'Max': np.float64(1.9), 'Min': np.float64(0.26451228445344643), 'Mean': np.float64(0.48597641431621486), 'Std': np.float64(0.0640095294284172)}
2024-12-06 23:49:55,942 - INFO - Candidate Std Stats: {'Max': np.float64(0.5294747202314198), 'Min': np.float64(0.0), 'Mean': np.float64(0.10798046665662754), 'Std': np.float64(0.043968435379422965)}
[I 2024-12-06 23:49:55,990] Trial 28 finished with value: 1.5666666666666667 and parameters: {'x_0_0': 'ac', 'x_0_1': 'cd', 'x_0_2': 'bc', 'x_1_0': 'ab', 'x_1_1': 'oo', 'x_1_2': 'bd'}. Best is trial 13 with value: 1.1222222222222222.
2024-12-06 23:50:11,648 - INFO - Candidate Mean Stats: {'Max': np.float64(2.0), 'Min': np.float64(0.2029627328884056), 'Mean': np.float64(0.48026490800406796), 'Std': np.float64(0.06817507138299514)}
2024-12-06 23:50:11,649 - INFO - Candidate Std Stats: {'Max': np.float64(1.6132517945954454), 'Min': np.float64(0.0), 'Mean': np.float64(0.12295723315476303), 'Std': np.float64(0.06843732523155807)}
[I 2024-12-06 23:50:11,695] Trial 29 finished with value: 1.5666666666666664 and parameters: {'x_0_0': 'bd', 'x_0_1': 'ac', 'x_0_2': 'oo', 'x_1_0': 'cd', 'x_1_1': 'ab', 'x_1_2': 'cd'}. Best is trial 22 with value: 1.1666666666666665.
2024-12-06 23:50:12,992 - INFO - Candidate Mean Stats: {'Max': np.float64(2.0), 'Min': np.float64(0.2162486806860314), 'Mean': np.float64(0.4928036089080396), 'Std': np.float64(0.055789006253485394)}
2024-12-06 23:50:12,992 - INFO - Candidate Std Stats: {'Max': np.float64(0.355858309462762), 'Min': np.float64(0.0), 'Mean': np.float64(0.10008863376523426), 'Std': np.float64(0.04040467749038203)}
[I 2024-12-06 23:50:13,036] Trial 29 finished with value: 1.4555555555555557 and parameters: {'x_0_0': 'ac', 'x_0_1': 'ab', 'x_0_2': 'bd', 'x_1_0': 'ac', 'x_1_1': 'oo', 'x_1_2': 'bc'}. Best is trial 2 with value: 0.9666666666666667.
2024-12-06 23:50:13,637 - INFO - Candidate Mean Stats: {'Max': np.float64(2.0), 'Min': np.float64(0.29155383776559385), 'Mean': np.float64(0.4836252124279047), 'Std': np.float64(0.060286109555502544)}
2024-12-06 23:50:13,637 - INFO - Candidate Std Stats: {'Max': np.float64(0.9172783772185192), 'Min': np.float64(0.0), 'Mean': np.float64(0.10766304698155314), 'Std': np.float64(0.049927043964094045)}
[I 2024-12-06 23:50:13,682] Trial 29 finished with value: 1.9 and parameters: {'x_0_0': 'cd', 'x_0_1': 'ab', 'x_0_2': 'oo', 'x_1_0': 'cd', 'x_1_1': 'ad', 'x_1_2': 'bc'}. Best is trial 7 with value: 1.077777777777778.
2024-12-06 23:50:18,292 - INFO - Candidate Mean Stats: {'Max': np.float64(1.9), 'Min': np.float64(0.268507590999941), 'Mean': np.float64(0.4894260898883813), 'Std': np.float64(0.056907373461673245)}
2024-12-06 23:50:18,293 - INFO - Candidate Std Stats: {'Max': np.float64(0.4151245987268084), 'Min': np.float64(0.0), 'Mean': np.float64(0.10050671807989067), 'Std': np.float64(0.04325685119703639)}
[I 2024-12-06 23:50:18,338] Trial 29 finished with value: 1.4666666666666666 and parameters: {'x_0_0': 'bc', 'x_0_1': 'bd', 'x_0_2': 'ab', 'x_1_0': 'oo', 'x_1_1': 'bc', 'x_1_2': 'ad'}. Best is trial 13 with value: 1.1222222222222222.
2024-12-06 23:50:33,844 - INFO - Candidate Mean Stats: {'Max': np.float64(2.0), 'Min': np.float64(0.23571950348412013), 'Mean': np.float64(0.4906384127638824), 'Std': np.float64(0.062352730729604344)}
2024-12-06 23:50:33,846 - INFO - Candidate Std Stats: {'Max': np.float64(0.752783887485841), 'Min': np.float64(0.0), 'Mean': np.float64(0.11274585028139802), 'Std': np.float64(0.05303342539291823)}
[I 2024-12-06 23:50:33,900] Trial 30 finished with value: 1.6666666666666665 and parameters: {'x_0_0': 'bc', 'x_0_1': 'bd', 'x_0_2': 'bc', 'x_1_0': 'ab', 'x_1_1': 'ac', 'x_1_2': 'ad'}. Best is trial 22 with value: 1.1666666666666665.
2024-12-06 23:50:35,128 - INFO - Candidate Mean Stats: {'Max': np.float64(2.0), 'Min': np.float64(0.25172724989022716), 'Mean': np.float64(0.48171061239211466), 'Std': np.float64(0.059553456559379596)}
2024-12-06 23:50:35,129 - INFO - Candidate Std Stats: {'Max': np.float64(0.5072341966800024), 'Min': np.float64(0.0), 'Mean': np.float64(0.10424633001946146), 'Std': np.float64(0.043610589262552145)}
[I 2024-12-06 23:50:35,175] Trial 30 finished with value: 1.9 and parameters: {'x_0_0': 'oo', 'x_0_1': 'ab', 'x_0_2': 'ab', 'x_1_0': 'bc', 'x_1_1': 'cd', 'x_1_2': 'bc'}. Best is trial 2 with value: 0.9666666666666667.
2024-12-06 23:50:35,971 - INFO - Candidate Mean Stats: {'Max': np.float64(2.0), 'Min': np.float64(0.26517223916629873), 'Mean': np.float64(0.4936330058269454), 'Std': np.float64(0.058694633157213245)}
2024-12-06 23:50:35,971 - INFO - Candidate Std Stats: {'Max': np.float64(0.3850361156915863), 'Min': np.float64(0.0), 'Mean': np.float64(0.1045447827463387), 'Std': np.float64(0.04376975594244456)}
[I 2024-12-06 23:50:36,017] Trial 30 finished with value: 1.6666666666666665 and parameters: {'x_0_0': 'bc', 'x_0_1': 'cd', 'x_0_2': 'cd', 'x_1_0': 'bd', 'x_1_1': 'ab', 'x_1_2': 'ab'}. Best is trial 7 with value: 1.077777777777778.
2024-12-06 23:50:40,807 - INFO - Candidate Mean Stats: {'Max': np.float64(1.9), 'Min': np.float64(0.27055226067780547), 'Mean': np.float64(0.48479995787100905), 'Std': np.float64(0.05773137392059804)}
2024-12-06 23:50:40,807 - INFO - Candidate Std Stats: {'Max': np.float64(0.735609231340729), 'Min': np.float64(0.0), 'Mean': np.float64(0.09788951166371797), 'Std': np.float64(0.04726707154411364)}
[I 2024-12-06 23:50:40,852] Trial 30 finished with value: 1.9 and parameters: {'x_0_0': 'oo', 'x_0_1': 'ab', 'x_0_2': 'ab', 'x_1_0': 'ab', 'x_1_1': 'ac', 'x_1_2': 'ac'}. Best is trial 13 with value: 1.1222222222222222.
2024-12-06 23:50:56,264 - INFO - Candidate Mean Stats: {'Max': np.float64(2.0), 'Min': np.float64(0.2778371080542099), 'Mean': np.float64(0.49738269135601837), 'Std': np.float64(0.0637353033165408)}
2024-12-06 23:50:56,265 - INFO - Candidate Std Stats: {'Max': np.float64(1.605666377223343), 'Min': np.float64(0.0), 'Mean': np.float64(0.10534724337482275), 'Std': np.float64(0.049639484099036325)}
[I 2024-12-06 23:50:56,314] Trial 31 finished with value: 1.5555555555555556 and parameters: {'x_0_0': 'bc', 'x_0_1': 'ab', 'x_0_2': 'ad', 'x_1_0': 'bd', 'x_1_1': 'bd', 'x_1_2': 'cd'}. Best is trial 22 with value: 1.1666666666666665.
2024-12-06 23:50:57,596 - INFO - Candidate Mean Stats: {'Max': np.float64(2.0), 'Min': np.float64(0.2700360463534225), 'Mean': np.float64(0.48705102697117214), 'Std': np.float64(0.06730911091229103)}
2024-12-06 23:50:57,596 - INFO - Candidate Std Stats: {'Max': np.float64(1.611239499036636), 'Min': np.float64(0.0), 'Mean': np.float64(0.1181580304502582), 'Std': np.float64(0.0572221403763633)}
[I 2024-12-06 23:50:57,644] Trial 31 finished with value: 1.4666666666666666 and parameters: {'x_0_0': 'ac', 'x_0_1': 'cd', 'x_0_2': 'bc', 'x_1_0': 'oo', 'x_1_1': 'cd', 'x_1_2': 'ab'}. Best is trial 2 with value: 0.9666666666666667.
2024-12-06 23:50:58,275 - INFO - Candidate Mean Stats: {'Max': np.float64(2.0), 'Min': np.float64(0.16932805876800067), 'Mean': np.float64(0.4800140586400817), 'Std': np.float64(0.05747147693698712)}
2024-12-06 23:50:58,276 - INFO - Candidate Std Stats: {'Max': np.float64(0.5450603917862153), 'Min': np.float64(0.0), 'Mean': np.float64(0.10786933096265254), 'Std': np.float64(0.04889082218075269)}
[I 2024-12-06 23:50:58,322] Trial 31 finished with value: 1.2777777777777777 and parameters: {'x_0_0': 'ab', 'x_0_1': 'oo', 'x_0_2': 'ab', 'x_1_0': 'ac', 'x_1_1': 'oo', 'x_1_2': 'ad'}. Best is trial 7 with value: 1.077777777777778.
2024-12-06 23:51:03,149 - INFO - Candidate Mean Stats: {'Max': np.float64(1.9), 'Min': np.float64(0.22780405414223645), 'Mean': np.float64(0.4895585719178395), 'Std': np.float64(0.0630363515009579)}
2024-12-06 23:51:03,150 - INFO - Candidate Std Stats: {'Max': np.float64(0.8226437690055594), 'Min': np.float64(0.0), 'Mean': np.float64(0.1148215531483856), 'Std': np.float64(0.0563672574357953)}
[I 2024-12-06 23:51:03,195] Trial 31 finished with value: 1.1444444444444444 and parameters: {'x_0_0': 'ac', 'x_0_1': 'ad', 'x_0_2': 'oo', 'x_1_0': 'oo', 'x_1_1': 'ad', 'x_1_2': 'bd'}. Best is trial 13 with value: 1.1222222222222222.
2024-12-06 23:51:17,851 - INFO - Candidate Mean Stats: {'Max': np.float64(2.0), 'Min': np.float64(0.27968195619662356), 'Mean': np.float64(0.4856021183810713), 'Std': np.float64(0.05893037906361897)}
2024-12-06 23:51:17,852 - INFO - Candidate Std Stats: {'Max': np.float64(0.5017232229483785), 'Min': np.float64(0.0), 'Mean': np.float64(0.10914919671749017), 'Std': np.float64(0.04499916189128586)}
[I 2024-12-06 23:51:17,899] Trial 32 finished with value: 1.3555555555555556 and parameters: {'x_0_0': 'ac', 'x_0_1': 'ab', 'x_0_2': 'ab', 'x_1_0': 'oo', 'x_1_1': 'bd', 'x_1_2': 'ab'}. Best is trial 22 with value: 1.1666666666666665.
2024-12-06 23:51:19,278 - INFO - Candidate Mean Stats: {'Max': np.float64(2.0), 'Min': np.float64(0.2523826945377379), 'Mean': np.float64(0.491084175994455), 'Std': np.float64(0.058534190273944714)}
2024-12-06 23:51:19,278 - INFO - Candidate Std Stats: {'Max': np.float64(0.4213496677026221), 'Min': np.float64(0.0), 'Mean': np.float64(0.10726047580870887), 'Std': np.float64(0.04477971903663595)}
[I 2024-12-06 23:51:19,323] Trial 32 finished with value: 1.7999999999999998 and parameters: {'x_0_0': 'oo', 'x_0_1': 'cd', 'x_0_2': 'ab', 'x_1_0': 'bc', 'x_1_1': 'oo', 'x_1_2': 'ac'}. Best is trial 2 with value: 0.9666666666666667.
2024-12-06 23:51:19,717 - INFO - Candidate Mean Stats: {'Max': np.float64(2.0), 'Min': np.float64(0.25640241158148736), 'Mean': np.float64(0.4957725765309697), 'Std': np.float64(0.0584691591872922)}
2024-12-06 23:51:19,717 - INFO - Candidate Std Stats: {'Max': np.float64(0.4555326167956825), 'Min': np.float64(0.0), 'Mean': np.float64(0.10293377927484988), 'Std': np.float64(0.04276952490610398)}
[I 2024-12-06 23:51:19,764] Trial 32 finished with value: 1.4666666666666666 and parameters: {'x_0_0': 'ac', 'x_0_1': 'bd', 'x_0_2': 'oo', 'x_1_0': 'bd', 'x_1_1': 'ab', 'x_1_2': 'oo'}. Best is trial 7 with value: 1.077777777777778.
2024-12-06 23:51:24,598 - INFO - Candidate Mean Stats: {'Max': np.float64(1.9), 'Min': np.float64(0.26149043577741793), 'Mean': np.float64(0.4818379190285962), 'Std': np.float64(0.0642173211008161)}
2024-12-06 23:51:24,599 - INFO - Candidate Std Stats: {'Max': np.float64(1.7450762707187644), 'Min': np.float64(0.0), 'Mean': np.float64(0.10714654758369706), 'Std': np.float64(0.05367020489199868)}
[I 2024-12-06 23:51:24,643] Trial 32 finished with value: 0.9444444444444444 and parameters: {'x_0_0': 'ad', 'x_0_1': 'oo', 'x_0_2': 'bc', 'x_1_0': 'bd', 'x_1_1': 'oo', 'x_1_2': 'ad'}. Best is trial 32 with value: 0.9444444444444444.
2024-12-06 23:51:38,621 - INFO - Candidate Mean Stats: {'Max': np.float64(2.0), 'Min': np.float64(0.24537475470252726), 'Mean': np.float64(0.4892512237962548), 'Std': np.float64(0.0643967618991506)}
2024-12-06 23:51:38,622 - INFO - Candidate Std Stats: {'Max': np.float64(0.5975488437585786), 'Min': np.float64(0.0), 'Mean': np.float64(0.11082886627045105), 'Std': np.float64(0.04779738507364126)}
[I 2024-12-06 23:51:38,666] Trial 33 finished with value: 1.6666666666666665 and parameters: {'x_0_0': 'bd', 'x_0_1': 'bd', 'x_0_2': 'bc', 'x_1_0': 'cd', 'x_1_1': 'cd', 'x_1_2': 'bc'}. Best is trial 22 with value: 1.1666666666666665.
2024-12-06 23:51:39,830 - INFO - Candidate Mean Stats: {'Max': np.float64(2.0), 'Min': np.float64(0.2667032477410885), 'Mean': np.float64(0.49518840372404965), 'Std': np.float64(0.06018788465174803)}
2024-12-06 23:51:39,830 - INFO - Candidate Std Stats: {'Max': np.float64(0.41114982996194943), 'Min': np.float64(0.0), 'Mean': np.float64(0.09825893600009618), 'Std': np.float64(0.04149784962496446)}
[I 2024-12-06 23:51:39,875] Trial 33 finished with value: 1.7777777777777777 and parameters: {'x_0_0': 'ab', 'x_0_1': 'cd', 'x_0_2': 'cd', 'x_1_0': 'ac', 'x_1_1': 'bd', 'x_1_2': 'ac'}. Best is trial 2 with value: 0.9666666666666667.
2024-12-06 23:51:40,573 - INFO - Candidate Mean Stats: {'Max': np.float64(2.0), 'Min': np.float64(0.2591703154183662), 'Mean': np.float64(0.49281909645962546), 'Std': np.float64(0.06759807073109829)}
2024-12-06 23:51:40,573 - INFO - Candidate Std Stats: {'Max': np.float64(0.6411845096826463), 'Min': np.float64(0.0), 'Mean': np.float64(0.11305010824082416), 'Std': np.float64(0.04869444646061046)}
[I 2024-12-06 23:51:40,615] Trial 33 finished with value: 1.7 and parameters: {'x_0_0': 'oo', 'x_0_1': 'bd', 'x_0_2': 'cd', 'x_1_0': 'oo', 'x_1_1': 'ac', 'x_1_2': 'ac'}. Best is trial 7 with value: 1.077777777777778.
2024-12-06 23:51:45,395 - INFO - Candidate Mean Stats: {'Max': np.float64(1.9), 'Min': np.float64(0.24877055571021317), 'Mean': np.float64(0.4829900592823824), 'Std': np.float64(0.064235361739227)}
2024-12-06 23:51:45,396 - INFO - Candidate Std Stats: {'Max': np.float64(1.4633402703748821), 'Min': np.float64(0.0), 'Mean': np.float64(0.11312435003230849), 'Std': np.float64(0.061190318348489266)}
[I 2024-12-06 23:51:45,440] Trial 33 finished with value: 1.2333333333333334 and parameters: {'x_0_0': 'bd', 'x_0_1': 'ad', 'x_0_2': 'ac', 'x_1_0': 'bc', 'x_1_1': 'ab', 'x_1_2': 'oo'}. Best is trial 32 with value: 0.9444444444444444.
2024-12-06 23:51:59,060 - INFO - Candidate Mean Stats: {'Max': np.float64(2.0), 'Min': np.float64(0.24289759641384734), 'Mean': np.float64(0.4900674789146521), 'Std': np.float64(0.058754762346316075)}
2024-12-06 23:51:59,061 - INFO - Candidate Std Stats: {'Max': np.float64(0.33342439194921564), 'Min': np.float64(0.0), 'Mean': np.float64(0.10862415316119643), 'Std': np.float64(0.04405987538171767)}
[I 2024-12-06 23:51:59,108] Trial 34 finished with value: 2.0 and parameters: {'x_0_0': 'cd', 'x_0_1': 'cd', 'x_0_2': 'cd', 'x_1_0': 'bd', 'x_1_1': 'ab', 'x_1_2': 'bd'}. Best is trial 22 with value: 1.1666666666666665.
2024-12-06 23:52:00,186 - INFO - Candidate Mean Stats: {'Max': np.float64(2.0), 'Min': np.float64(0.22806801904097576), 'Mean': np.float64(0.4923981448739479), 'Std': np.float64(0.05932248979750533)}
2024-12-06 23:52:00,186 - INFO - Candidate Std Stats: {'Max': np.float64(0.4834927858352083), 'Min': np.float64(0.0), 'Mean': np.float64(0.10367151943992862), 'Std': np.float64(0.042946612976649194)}
[I 2024-12-06 23:52:00,230] Trial 34 finished with value: 1.4666666666666666 and parameters: {'x_0_0': 'bc', 'x_0_1': 'bc', 'x_0_2': 'ad', 'x_1_0': 'oo', 'x_1_1': 'bd', 'x_1_2': 'ac'}. Best is trial 2 with value: 0.9666666666666667.
2024-12-06 23:52:01,168 - INFO - Candidate Mean Stats: {'Max': np.float64(2.0), 'Min': np.float64(0.26714424098737716), 'Mean': np.float64(0.48410364689065577), 'Std': np.float64(0.06362725482053913)}
2024-12-06 23:52:01,168 - INFO - Candidate Std Stats: {'Max': np.float64(1.3165886747812359), 'Min': np.float64(0.0), 'Mean': np.float64(0.1070801497428692), 'Std': np.float64(0.055411964213339895)}
[I 2024-12-06 23:52:01,212] Trial 34 finished with value: 1.9 and parameters: {'x_0_0': 'oo', 'x_0_1': 'bd', 'x_0_2': 'ad', 'x_1_0': 'ad', 'x_1_1': 'ac', 'x_1_2': 'ab'}. Best is trial 7 with value: 1.077777777777778.
2024-12-06 23:52:06,253 - INFO - Candidate Mean Stats: {'Max': np.float64(1.9), 'Min': np.float64(0.2921428771420479), 'Mean': np.float64(0.4982561184334567), 'Std': np.float64(0.059800695024209434)}
2024-12-06 23:52:06,254 - INFO - Candidate Std Stats: {'Max': np.float64(0.8156546512914441), 'Min': np.float64(0.0), 'Mean': np.float64(0.10672979183989964), 'Std': np.float64(0.04740618844832734)}
[I 2024-12-06 23:52:06,298] Trial 34 finished with value: 1.4444444444444444 and parameters: {'x_0_0': 'bc', 'x_0_1': 'ad', 'x_0_2': 'ac', 'x_1_0': 'bc', 'x_1_1': 'ac', 'x_1_2': 'ac'}. Best is trial 32 with value: 0.9444444444444444.
2024-12-06 23:52:19,741 - INFO - Candidate Mean Stats: {'Max': np.float64(2.0), 'Min': np.float64(0.2957914252734798), 'Mean': np.float64(0.4890325105875044), 'Std': np.float64(0.05609368073459687)}
2024-12-06 23:52:19,742 - INFO - Candidate Std Stats: {'Max': np.float64(0.3530023792264773), 'Min': np.float64(0.0), 'Mean': np.float64(0.10265254706269326), 'Std': np.float64(0.042060392946450115)}
[I 2024-12-06 23:52:19,807] Trial 35 finished with value: 2.0 and parameters: {'x_0_0': 'cd', 'x_0_1': 'bd', 'x_0_2': 'bc', 'x_1_0': 'ac', 'x_1_1': 'ac', 'x_1_2': 'bc'}. Best is trial 22 with value: 1.1666666666666665.
2024-12-06 23:52:21,128 - INFO - Candidate Mean Stats: {'Max': np.float64(2.0), 'Min': np.float64(0.268206425453775), 'Mean': np.float64(0.48397569396903356), 'Std': np.float64(0.06486676943282335)}
2024-12-06 23:52:21,128 - INFO - Candidate Std Stats: {'Max': np.float64(0.8674800493903119), 'Min': np.float64(0.0), 'Mean': np.float64(0.11246681017019236), 'Std': np.float64(0.05275820964781311)}
