[I 2024-12-06 23:38:07,337] Trial 339 finished with value: 1.3035714285714286 and parameters: {'x_0_0': 'ad', 'x_0_1': 'ac', 'x_1_0': 'ab', 'x_1_1': 'oo'}. Best is trial 23 with value: 0.5.
2024-12-06 23:38:07,388 - INFO - Candidate Mean Stats: {'Max': np.float64(3.2285445075381327), 'Min': np.float64(-0.7192021548696937), 'Mean': np.float64(0.6812805125713088), 'Std': np.float64(0.5292314504862944)}
2024-12-06 23:38:07,388 - INFO - Candidate Std Stats: {'Max': np.float64(1.7759856846459265), 'Min': np.float64(0.0), 'Mean': np.float64(0.5551395746314604), 'Std': np.float64(0.32384196501363627)}
2024-12-06 23:38:07,395 - INFO - Candidate Mean Stats: {'Max': np.float64(2.971387594037825), 'Min': np.float64(-1.1368822931199487), 'Mean': np.float64(0.5442452711125845), 'Std': np.float64(0.652190539744738)}
2024-12-06 23:38:07,395 - INFO - Candidate Std Stats: {'Max': np.float64(1.7324609196533591), 'Min': np.float64(0.0), 'Mean': np.float64(0.6355101469815778), 'Std': np.float64(0.36026625739314605)}
[I 2024-12-06 23:38:07,402] Trial 341 finished with value: 1.5 and parameters: {'x_0_0': 'cd', 'x_0_1': 'oo', 'x_1_0': 'ad', 'x_1_1': 'bc'}. Best is trial 76 with value: 0.5.
2024-12-06 23:38:07,404 - INFO - Candidate Mean Stats: {'Max': np.float64(2.587962027708745), 'Min': np.float64(-0.6473810739701313), 'Mean': np.float64(0.6828465504799186), 'Std': np.float64(0.5344649929859309)}
2024-12-06 23:38:07,404 - INFO - Candidate Std Stats: {'Max': np.float64(1.604058188048098), 'Min': np.float64(0.0), 'Mean': np.float64(0.5080312589196346), 'Std': np.float64(0.3007870162693633)}
[I 2024-12-06 23:38:07,409] Trial 341 finished with value: 1.1607142857142856 and parameters: {'x_0_0': 'bd', 'x_0_1': 'cd', 'x_1_0': 'bd', 'x_1_1': 'oo'}. Best is trial 165 with value: 0.5.
[I 2024-12-06 23:38:07,418] Trial 341 finished with value: 1.3214285714285714 and parameters: {'x_0_0': 'bd', 'x_0_1': 'bc', 'x_1_0': 'oo', 'x_1_1': 'ac'}. Best is trial 63 with value: 0.5.
2024-12-06 23:38:07,704 - INFO - Candidate Mean Stats: {'Max': np.float64(3.076144956163156), 'Min': np.float64(-0.4098320479969681), 'Mean': np.float64(0.7894135726587201), 'Std': np.float64(0.4641432858917212)}
2024-12-06 23:38:07,704 - INFO - Candidate Std Stats: {'Max': np.float64(1.529202631147678), 'Min': np.float64(0.0), 'Mean': np.float64(0.4060159699933689), 'Std': np.float64(0.26563159473824993)}
[I 2024-12-06 23:38:07,719] Trial 340 finished with value: 1.375 and parameters: {'x_0_0': 'oo', 'x_0_1': 'oo', 'x_1_0': 'cd', 'x_1_1': 'bc'}. Best is trial 23 with value: 0.5.
2024-12-06 23:38:07,773 - INFO - Candidate Mean Stats: {'Max': np.float64(2.9194158091444686), 'Min': np.float64(-1.45436809762411), 'Mean': np.float64(0.5860384999051275), 'Std': np.float64(0.6686009797558309)}
2024-12-06 23:38:07,773 - INFO - Candidate Std Stats: {'Max': np.float64(1.7363552564761584), 'Min': np.float64(0.0), 'Mean': np.float64(0.6090003188676698), 'Std': np.float64(0.34659926868811486)}
2024-12-06 23:38:07,777 - INFO - Candidate Mean Stats: {'Max': np.float64(3.0423274853756626), 'Min': np.float64(-0.9713553436859256), 'Mean': np.float64(0.635018388828964), 'Std': np.float64(0.6034517424548003)}
2024-12-06 23:38:07,777 - INFO - Candidate Std Stats: {'Max': np.float64(1.9089738991063898), 'Min': np.float64(0.0), 'Mean': np.float64(0.5998011798973989), 'Std': np.float64(0.3645702672110754)}
[I 2024-12-06 23:38:07,787] Trial 342 finished with value: 1.1607142857142856 and parameters: {'x_0_0': 'ac', 'x_0_1': 'ac', 'x_1_0': 'bd', 'x_1_1': 'oo'}. Best is trial 76 with value: 0.5.
2024-12-06 23:38:07,790 - INFO - Candidate Mean Stats: {'Max': np.float64(3.032311633452827), 'Min': np.float64(-0.565719669437389), 'Mean': np.float64(0.7954498340227761), 'Std': np.float64(0.4776168736050922)}
2024-12-06 23:38:07,790 - INFO - Candidate Std Stats: {'Max': np.float64(1.503909173830639), 'Min': np.float64(0.0), 'Mean': np.float64(0.4497038266899889), 'Std': np.float64(0.27058981629563156)}
[I 2024-12-06 23:38:07,790] Trial 342 finished with value: 1.5 and parameters: {'x_0_0': 'cd', 'x_0_1': 'oo', 'x_1_0': 'ac', 'x_1_1': 'cd'}. Best is trial 165 with value: 0.5.
[I 2024-12-06 23:38:07,803] Trial 342 finished with value: 1.375 and parameters: {'x_0_0': 'cd', 'x_0_1': 'oo', 'x_1_0': 'ab', 'x_1_1': 'oo'}. Best is trial 63 with value: 0.5.
2024-12-06 23:38:08,090 - INFO - Candidate Mean Stats: {'Max': np.float64(3.6428135728256157), 'Min': np.float64(-0.543098802052257), 'Mean': np.float64(0.7859287001017432), 'Std': np.float64(0.5240787259148426)}
2024-12-06 23:38:08,091 - INFO - Candidate Std Stats: {'Max': np.float64(1.3729436627435911), 'Min': np.float64(0.0), 'Mean': np.float64(0.46207562827219945), 'Std': np.float64(0.2651094819673731)}
[I 2024-12-06 23:38:08,104] Trial 341 finished with value: 1.1607142857142856 and parameters: {'x_0_0': 'ac', 'x_0_1': 'ad', 'x_1_0': 'ad', 'x_1_1': 'oo'}. Best is trial 23 with value: 0.5.
2024-12-06 23:38:08,155 - INFO - Candidate Mean Stats: {'Max': np.float64(2.985895403201015), 'Min': np.float64(-0.46055561924664756), 'Mean': np.float64(0.7733147828900928), 'Std': np.float64(0.5041666416932243)}
2024-12-06 23:38:08,155 - INFO - Candidate Std Stats: {'Max': np.float64(1.9562797012316249), 'Min': np.float64(0.0), 'Mean': np.float64(0.5354328747074835), 'Std': np.float64(0.31874465925591705)}
2024-12-06 23:38:08,159 - INFO - Candidate Mean Stats: {'Max': np.float64(2.9742633603935427), 'Min': np.float64(-1.3109365350585473), 'Mean': np.float64(0.5875892028540644), 'Std': np.float64(0.6347554224567368)}
2024-12-06 23:38:08,159 - INFO - Candidate Std Stats: {'Max': np.float64(1.8250452096595149), 'Min': np.float64(0.0), 'Mean': np.float64(0.6179599631316631), 'Std': np.float64(0.35681083778114164)}
[I 2024-12-06 23:38:08,169] Trial 343 finished with value: 1.5 and parameters: {'x_0_0': 'cd', 'x_0_1': 'oo', 'x_1_0': 'bc', 'x_1_1': 'bd'}. Best is trial 76 with value: 0.5.
[I 2024-12-06 23:38:08,173] Trial 343 finished with value: 1.3214285714285714 and parameters: {'x_0_0': 'bd', 'x_0_1': 'bd', 'x_1_0': 'oo', 'x_1_1': 'bc'}. Best is trial 165 with value: 0.5.
2024-12-06 23:38:08,175 - INFO - Candidate Mean Stats: {'Max': np.float64(2.9018087602481257), 'Min': np.float64(-0.6429917002781134), 'Mean': np.float64(0.7743627362403407), 'Std': np.float64(0.5495774958777082)}
2024-12-06 23:38:08,175 - INFO - Candidate Std Stats: {'Max': np.float64(1.558067291134228), 'Min': np.float64(0.0), 'Mean': np.float64(0.48300022941502996), 'Std': np.float64(0.28267549617844456)}
[I 2024-12-06 23:38:08,188] Trial 343 finished with value: 1.0 and parameters: {'x_0_0': 'bd', 'x_0_1': 'ac', 'x_1_0': 'bc', 'x_1_1': 'ac'}. Best is trial 63 with value: 0.5.
2024-12-06 23:38:08,477 - INFO - Candidate Mean Stats: {'Max': np.float64(3.482862997609815), 'Min': np.float64(-0.7706997345750499), 'Mean': np.float64(0.7405420832194776), 'Std': np.float64(0.5161917862699124)}
2024-12-06 23:38:08,477 - INFO - Candidate Std Stats: {'Max': np.float64(1.4410175794894575), 'Min': np.float64(0.0), 'Mean': np.float64(0.4864454371030371), 'Std': np.float64(0.2883575972587121)}
[I 2024-12-06 23:38:08,491] Trial 342 finished with value: 1.25 and parameters: {'x_0_0': 'cd', 'x_0_1': 'oo', 'x_1_0': 'oo', 'x_1_1': 'ad'}. Best is trial 23 with value: 0.5.
2024-12-06 23:38:08,539 - INFO - Candidate Mean Stats: {'Max': np.float64(3.7673771343746596), 'Min': np.float64(-0.8530948299315619), 'Mean': np.float64(0.6191769869413011), 'Std': np.float64(0.6185774404212652)}
2024-12-06 23:38:08,539 - INFO - Candidate Std Stats: {'Max': np.float64(1.8778276746521763), 'Min': np.float64(0.0), 'Mean': np.float64(0.5507044752041852), 'Std': np.float64(0.3357891565132586)}
2024-12-06 23:38:08,547 - INFO - Candidate Mean Stats: {'Max': np.float64(3.3585359884724335), 'Min': np.float64(-0.5997718787507142), 'Mean': np.float64(0.7005859515641989), 'Std': np.float64(0.5656541979895549)}
2024-12-06 23:38:08,547 - INFO - Candidate Std Stats: {'Max': np.float64(1.556093113763507), 'Min': np.float64(0.0), 'Mean': np.float64(0.5143238676511087), 'Std': np.float64(0.29635850637046285)}
[I 2024-12-06 23:38:08,553] Trial 344 finished with value: 1.2857142857142856 and parameters: {'x_0_0': 'ac', 'x_0_1': 'ac', 'x_1_0': 'ab', 'x_1_1': 'ab'}. Best is trial 76 with value: 0.5.
[I 2024-12-06 23:38:08,561] Trial 344 finished with value: 1.5 and parameters: {'x_0_0': 'cd', 'x_0_1': 'oo', 'x_1_0': 'bd', 'x_1_1': 'ad'}. Best is trial 165 with value: 0.5.
2024-12-06 23:38:08,562 - INFO - Candidate Mean Stats: {'Max': np.float64(2.9350650563629115), 'Min': np.float64(-0.636102345619465), 'Mean': np.float64(0.7317592176052088), 'Std': np.float64(0.4969382627860288)}
2024-12-06 23:38:08,562 - INFO - Candidate Std Stats: {'Max': np.float64(1.5546807976300439), 'Min': np.float64(0.0), 'Mean': np.float64(0.5032474683245926), 'Std': np.float64(0.29937270654378534)}
[I 2024-12-06 23:38:08,576] Trial 344 finished with value: 1.375 and parameters: {'x_0_0': 'oo', 'x_0_1': 'oo', 'x_1_0': 'ad', 'x_1_1': 'bd'}. Best is trial 63 with value: 0.5.
2024-12-06 23:38:08,863 - INFO - Candidate Mean Stats: {'Max': np.float64(3.505886063047034), 'Min': np.float64(-0.4712653773893515), 'Mean': np.float64(0.7283637768709434), 'Std': np.float64(0.492115822349831)}
2024-12-06 23:38:08,863 - INFO - Candidate Std Stats: {'Max': np.float64(1.5829161956256377), 'Min': np.float64(0.0), 'Mean': np.float64(0.5173272633285422), 'Std': np.float64(0.2997578569961557)}
[I 2024-12-06 23:38:08,877] Trial 343 finished with value: 1.375 and parameters: {'x_0_0': 'oo', 'x_0_1': 'oo', 'x_1_0': 'ab', 'x_1_1': 'bc'}. Best is trial 23 with value: 0.5.
2024-12-06 23:38:08,922 - INFO - Candidate Mean Stats: {'Max': np.float64(3.28925599911886), 'Min': np.float64(-0.8634210991348219), 'Mean': np.float64(0.6329163984082015), 'Std': np.float64(0.5934270496783693)}
2024-12-06 23:38:08,922 - INFO - Candidate Std Stats: {'Max': np.float64(1.5297486701787153), 'Min': np.float64(0.0), 'Mean': np.float64(0.5523679018414512), 'Std': np.float64(0.31908371649042255)}
2024-12-06 23:38:08,930 - INFO - Candidate Mean Stats: {'Max': np.float64(3.8644775428349476), 'Min': np.float64(-0.7703367243252301), 'Mean': np.float64(0.7115473500513861), 'Std': np.float64(0.5267280217562208)}
2024-12-06 23:38:08,930 - INFO - Candidate Std Stats: {'Max': np.float64(1.586665800023423), 'Min': np.float64(0.0), 'Mean': np.float64(0.4723669970502912), 'Std': np.float64(0.2882549497725128)}
[I 2024-12-06 23:38:08,936] Trial 345 finished with value: 1.3214285714285714 and parameters: {'x_0_0': 'ac', 'x_0_1': 'bd', 'x_1_0': 'oo', 'x_1_1': 'bc'}. Best is trial 76 with value: 0.5.
[I 2024-12-06 23:38:08,944] Trial 345 finished with value: 1.2142857142857144 and parameters: {'x_0_0': 'ab', 'x_0_1': 'oo', 'x_1_0': 'bc', 'x_1_1': 'cd'}. Best is trial 165 with value: 0.5.
2024-12-06 23:38:08,947 - INFO - Candidate Mean Stats: {'Max': np.float64(3.2490236179145358), 'Min': np.float64(-1.3638647144901273), 'Mean': np.float64(0.6455660875932591), 'Std': np.float64(0.6595246767221956)}
2024-12-06 23:38:08,947 - INFO - Candidate Std Stats: {'Max': np.float64(1.7810888154148714), 'Min': np.float64(0.0), 'Mean': np.float64(0.5775547903520482), 'Std': np.float64(0.3364270216831254)}
[I 2024-12-06 23:38:08,960] Trial 345 finished with value: 1.1964285714285714 and parameters: {'x_0_0': 'ad', 'x_0_1': 'ab', 'x_1_0': 'oo', 'x_1_1': 'oo'}. Best is trial 63 with value: 0.5.
2024-12-06 23:38:09,249 - INFO - Candidate Mean Stats: {'Max': np.float64(3.1246352463346163), 'Min': np.float64(-0.5403022429770733), 'Mean': np.float64(0.7292521547489076), 'Std': np.float64(0.5198387546656322)}
2024-12-06 23:38:09,249 - INFO - Candidate Std Stats: {'Max': np.float64(1.3778111916792395), 'Min': np.float64(0.0), 'Mean': np.float64(0.4759577737797187), 'Std': np.float64(0.2728201898644813)}
[I 2024-12-06 23:38:09,265] Trial 344 finished with value: 1.0357142857142856 and parameters: {'x_0_0': 'ac', 'x_0_1': 'ac', 'x_1_0': 'oo', 'x_1_1': 'cd'}. Best is trial 23 with value: 0.5.
2024-12-06 23:38:09,313 - INFO - Candidate Mean Stats: {'Max': np.float64(3.5627510834969236), 'Min': np.float64(-1.187063811322293), 'Mean': np.float64(0.5594854314861687), 'Std': np.float64(0.635417364511759)}
2024-12-06 23:38:09,313 - INFO - Candidate Std Stats: {'Max': np.float64(1.8451488785370291), 'Min': np.float64(0.0), 'Mean': np.float64(0.5795144095068955), 'Std': np.float64(0.3499764067545828)}
2024-12-06 23:38:09,316 - INFO - Candidate Mean Stats: {'Max': np.float64(3.3361007150319537), 'Min': np.float64(-0.6048417574123203), 'Mean': np.float64(0.7112236447052288), 'Std': np.float64(0.527956429350942)}
2024-12-06 23:38:09,316 - INFO - Candidate Std Stats: {'Max': np.float64(1.8573343853493847), 'Min': np.float64(0.0), 'Mean': np.float64(0.5170341298927776), 'Std': np.float64(0.3246310384191393)}
[I 2024-12-06 23:38:09,327] Trial 346 finished with value: 1.3035714285714286 and parameters: {'x_0_0': 'bc', 'x_0_1': 'ab', 'x_1_0': 'ac', 'x_1_1': 'oo'}. Best is trial 76 with value: 0.5.
[I 2024-12-06 23:38:09,330] Trial 346 finished with value: 1.2142857142857144 and parameters: {'x_0_0': 'ab', 'x_0_1': 'oo', 'x_1_0': 'cd', 'x_1_1': 'ad'}. Best is trial 165 with value: 0.5.
2024-12-06 23:38:09,332 - INFO - Candidate Mean Stats: {'Max': np.float64(3.181193782347589), 'Min': np.float64(-0.4921644772245333), 'Mean': np.float64(0.7558097032618222), 'Std': np.float64(0.47894189790741704)}
2024-12-06 23:38:09,332 - INFO - Candidate Std Stats: {'Max': np.float64(1.8016884803720075), 'Min': np.float64(0.0), 'Mean': np.float64(0.48378917043672337), 'Std': np.float64(0.2963963544057458)}
[I 2024-12-06 23:38:09,346] Trial 346 finished with value: 1.2142857142857144 and parameters: {'x_0_0': 'ab', 'x_0_1': 'oo', 'x_1_0': 'bc', 'x_1_1': 'bd'}. Best is trial 63 with value: 0.5.
2024-12-06 23:38:09,635 - INFO - Candidate Mean Stats: {'Max': np.float64(3.5577135866254372), 'Min': np.float64(-0.6637411822176517), 'Mean': np.float64(0.7702745912948702), 'Std': np.float64(0.4567696284010798)}
2024-12-06 23:38:09,635 - INFO - Candidate Std Stats: {'Max': np.float64(1.5722523332111384), 'Min': np.float64(0.0), 'Mean': np.float64(0.4675139579782588), 'Std': np.float64(0.29171116333292707)}
[I 2024-12-06 23:38:09,649] Trial 345 finished with value: 1.125 and parameters: {'x_0_0': 'oo', 'x_0_1': 'oo', 'x_1_0': 'oo', 'x_1_1': 'ad'}. Best is trial 23 with value: 0.5.
2024-12-06 23:38:09,694 - INFO - Candidate Mean Stats: {'Max': np.float64(2.725527295275964), 'Min': np.float64(-0.7432739786557635), 'Mean': np.float64(0.6805339673875469), 'Std': np.float64(0.5648655596465842)}
2024-12-06 23:38:09,694 - INFO - Candidate Std Stats: {'Max': np.float64(1.5212777306018719), 'Min': np.float64(0.0), 'Mean': np.float64(0.5323728665942791), 'Std': np.float64(0.3112148280945167)}
2024-12-06 23:38:09,698 - INFO - Candidate Mean Stats: {'Max': np.float64(3.173389300403095), 'Min': np.float64(-1.0649162985771548), 'Mean': np.float64(0.5985856962076683), 'Std': np.float64(0.7041317475656227)}
2024-12-06 23:38:09,698 - INFO - Candidate Std Stats: {'Max': np.float64(1.973552048030943), 'Min': np.float64(0.0), 'Mean': np.float64(0.604351759245696), 'Std': np.float64(0.36592765954234835)}
[I 2024-12-06 23:38:09,709] Trial 347 finished with value: 0.75 and parameters: {'x_0_0': 'bc', 'x_0_1': 'ad', 'x_1_0': 'oo', 'x_1_1': 'bc'}. Best is trial 76 with value: 0.5.
[I 2024-12-06 23:38:09,712] Trial 347 finished with value: 1.3214285714285714 and parameters: {'x_0_0': 'bc', 'x_0_1': 'cd', 'x_1_0': 'oo', 'x_1_1': 'ad'}. Best is trial 165 with value: 0.5.
2024-12-06 23:38:09,715 - INFO - Candidate Mean Stats: {'Max': np.float64(2.974244741513315), 'Min': np.float64(-0.8543423438583397), 'Mean': np.float64(0.6791914982454824), 'Std': np.float64(0.5646166551334393)}
2024-12-06 23:38:09,715 - INFO - Candidate Std Stats: {'Max': np.float64(1.6988667026439204), 'Min': np.float64(0.0), 'Mean': np.float64(0.5300785998596687), 'Std': np.float64(0.3160091096325287)}
[I 2024-12-06 23:38:09,728] Trial 347 finished with value: 1.375 and parameters: {'x_0_0': 'oo', 'x_0_1': 'oo', 'x_1_0': 'ad', 'x_1_1': 'ac'}. Best is trial 63 with value: 0.5.
2024-12-06 23:38:10,019 - INFO - Candidate Mean Stats: {'Max': np.float64(3.2883513662524115), 'Min': np.float64(-0.7501094098344417), 'Mean': np.float64(0.7694292027293649), 'Std': np.float64(0.5021289739039108)}
2024-12-06 23:38:10,019 - INFO - Candidate Std Stats: {'Max': np.float64(1.7913473762345802), 'Min': np.float64(0.0), 'Mean': np.float64(0.4413169700558432), 'Std': np.float64(0.27682241842957944)}
[I 2024-12-06 23:38:10,032] Trial 346 finished with value: 1.3214285714285714 and parameters: {'x_0_0': 'ac', 'x_0_1': 'cd', 'x_1_0': 'oo', 'x_1_1': 'ab'}. Best is trial 23 with value: 0.5.
2024-12-06 23:38:10,073 - INFO - Candidate Mean Stats: {'Max': np.float64(3.7419430748433626), 'Min': np.float64(-0.7523960723172785), 'Mean': np.float64(0.681936406373215), 'Std': np.float64(0.5452663884305241)}
2024-12-06 23:38:10,073 - INFO - Candidate Std Stats: {'Max': np.float64(1.7172294454592045), 'Min': np.float64(0.0), 'Mean': np.float64(0.5486266404713745), 'Std': np.float64(0.32289733534515774)}
2024-12-06 23:38:10,080 - INFO - Candidate Mean Stats: {'Max': np.float64(2.9443026436983346), 'Min': np.float64(-0.5904519253710336), 'Mean': np.float64(0.7572014095144685), 'Std': np.float64(0.5025790192579433)}
2024-12-06 23:38:10,080 - INFO - Candidate Std Stats: {'Max': np.float64(1.6765403136843866), 'Min': np.float64(0.0), 'Mean': np.float64(0.48551931064389103), 'Std': np.float64(0.3079148106478655)}
[I 2024-12-06 23:38:10,088] Trial 348 finished with value: 1.2857142857142856 and parameters: {'x_0_0': 'ac', 'x_0_1': 'ad', 'x_1_0': 'bc', 'x_1_1': 'cd'}. Best is trial 76 with value: 0.5.
[I 2024-12-06 23:38:10,094] Trial 348 finished with value: 1.4464285714285714 and parameters: {'x_0_0': 'ad', 'x_0_1': 'ad', 'x_1_0': 'ad', 'x_1_1': 'oo'}. Best is trial 165 with value: 0.5.
2024-12-06 23:38:10,095 - INFO - Candidate Mean Stats: {'Max': np.float64(2.8972741608389594), 'Min': np.float64(-0.7810324982362269), 'Mean': np.float64(0.7301438675100751), 'Std': np.float64(0.5148633090520327)}
2024-12-06 23:38:10,095 - INFO - Candidate Std Stats: {'Max': np.float64(1.722539694471081), 'Min': np.float64(0.0), 'Mean': np.float64(0.5102836298198876), 'Std': np.float64(0.3086524297427191)}
[I 2024-12-06 23:38:10,109] Trial 348 finished with value: 1.125 and parameters: {'x_0_0': 'oo', 'x_0_1': 'oo', 'x_1_0': 'oo', 'x_1_1': 'cd'}. Best is trial 63 with value: 0.5.
2024-12-06 23:38:10,400 - INFO - Candidate Mean Stats: {'Max': np.float64(2.942820038316496), 'Min': np.float64(-0.7305551275861446), 'Mean': np.float64(0.6499229002041262), 'Std': np.float64(0.5958832381011119)}
2024-12-06 23:38:10,401 - INFO - Candidate Std Stats: {'Max': np.float64(1.6246200280098246), 'Min': np.float64(0.0), 'Mean': np.float64(0.5360357927573618), 'Std': np.float64(0.3134590133302582)}
[I 2024-12-06 23:38:10,415] Trial 347 finished with value: 0.6428571428571428 and parameters: {'x_0_0': 'ad', 'x_0_1': 'oo', 'x_1_0': 'bc', 'x_1_1': 'ab'}. Best is trial 23 with value: 0.5.
2024-12-06 23:38:10,453 - INFO - Candidate Mean Stats: {'Max': np.float64(3.5387087647522875), 'Min': np.float64(-0.871347760381702), 'Mean': np.float64(0.6520236513845195), 'Std': np.float64(0.5711854581750446)}
2024-12-06 23:38:10,453 - INFO - Candidate Std Stats: {'Max': np.float64(1.574356000350305), 'Min': np.float64(0.0), 'Mean': np.float64(0.532405832434268), 'Std': np.float64(0.31932281992784806)}
2024-12-06 23:38:10,461 - INFO - Candidate Mean Stats: {'Max': np.float64(3.0347828022437042), 'Min': np.float64(-0.8415373287300569), 'Mean': np.float64(0.6713936276238388), 'Std': np.float64(0.5580981605964817)}
2024-12-06 23:38:10,461 - INFO - Candidate Std Stats: {'Max': np.float64(2.107193137825878), 'Min': np.float64(0.0), 'Mean': np.float64(0.5740173507544866), 'Std': np.float64(0.3454236964443834)}
[I 2024-12-06 23:38:10,467] Trial 349 finished with value: 1.3214285714285714 and parameters: {'x_0_0': 'bd', 'x_0_1': 'ad', 'x_1_0': 'oo', 'x_1_1': 'ad'}. Best is trial 76 with value: 0.5.
[I 2024-12-06 23:38:10,475] Trial 349 finished with value: 1.2857142857142856 and parameters: {'x_0_0': 'bd', 'x_0_1': 'ab', 'x_1_0': 'bd', 'x_1_1': 'ac'}. Best is trial 165 with value: 0.5.
2024-12-06 23:38:10,476 - INFO - Candidate Mean Stats: {'Max': np.float64(3.2355426708861366), 'Min': np.float64(-0.782836883086204), 'Mean': np.float64(0.6968484874887699), 'Std': np.float64(0.5437352949989115)}
2024-12-06 23:38:10,476 - INFO - Candidate Std Stats: {'Max': np.float64(1.7373163523254918), 'Min': np.float64(0.0), 'Mean': np.float64(0.5822680426646258), 'Std': np.float64(0.3460839419161684)}
[I 2024-12-06 23:38:10,490] Trial 349 finished with value: 1.0714285714285714 and parameters: {'x_0_0': 'ac', 'x_0_1': 'oo', 'x_1_0': 'ab', 'x_1_1': 'bd'}. Best is trial 63 with value: 0.5.
2024-12-06 23:38:10,785 - INFO - Candidate Mean Stats: {'Max': np.float64(3.0391574629048295), 'Min': np.float64(-0.6982566363206784), 'Mean': np.float64(0.7405207279909717), 'Std': np.float64(0.5388692069661654)}
2024-12-06 23:38:10,785 - INFO - Candidate Std Stats: {'Max': np.float64(1.5635256639010666), 'Min': np.float64(0.0), 'Mean': np.float64(0.4974194632505962), 'Std': np.float64(0.2941581035231925)}
