[I 2024-12-06 23:39:10,124] Trial 485 finished with value: 1.3214285714285714 and parameters: {'x_0_0': 'ad', 'x_0_1': 'ab', 'x_1_0': 'oo', 'x_1_1': 'ac'}. Best is trial 76 with value: 0.5.
2024-12-06 23:39:10,214 - INFO - Candidate Mean Stats: {'Max': np.float64(2.7995778248132632), 'Min': np.float64(-0.33785827873942975), 'Mean': np.float64(0.8810225876991711), 'Std': np.float64(0.4375737031748692)}
2024-12-06 23:39:10,215 - INFO - Candidate Std Stats: {'Max': np.float64(1.4301869624320322), 'Min': np.float64(0.0), 'Mean': np.float64(0.3543507234688968), 'Std': np.float64(0.26283182883362816)}
[I 2024-12-06 23:39:10,231] Trial 485 finished with value: 1.4285714285714286 and parameters: {'x_0_0': 'ac', 'x_0_1': 'ab', 'x_1_0': 'ad', 'x_1_1': 'cd'}. Best is trial 63 with value: 0.5.
2024-12-06 23:39:10,492 - INFO - Candidate Mean Stats: {'Max': np.float64(3.2020853510012577), 'Min': np.float64(-0.3276529549985631), 'Mean': np.float64(0.8428281918940552), 'Std': np.float64(0.46380427755567927)}
2024-12-06 23:39:10,492 - INFO - Candidate Std Stats: {'Max': np.float64(1.5176603369700994), 'Min': np.float64(0.0), 'Mean': np.float64(0.4215202430535265), 'Std': np.float64(0.2935812347638512)}
2024-12-06 23:39:10,498 - INFO - Candidate Mean Stats: {'Max': np.float64(2.588875727467577), 'Min': np.float64(-0.08575450738628373), 'Mean': np.float64(0.8902994419531632), 'Std': np.float64(0.389728722495881)}
2024-12-06 23:39:10,498 - INFO - Candidate Std Stats: {'Max': np.float64(1.798772100172285), 'Min': np.float64(0.0), 'Mean': np.float64(0.31885841771480633), 'Std': np.float64(0.2550616119844197)}
[I 2024-12-06 23:39:10,508] Trial 483 finished with value: 1.5 and parameters: {'x_0_0': 'cd', 'x_0_1': 'oo', 'x_1_0': 'bd', 'x_1_1': 'bd'}. Best is trial 23 with value: 0.5.
[I 2024-12-06 23:39:10,515] Trial 486 finished with value: 1.4285714285714286 and parameters: {'x_0_0': 'ac', 'x_0_1': 'ab', 'x_1_0': 'bc', 'x_1_1': 'ad'}. Best is trial 165 with value: 0.5.
2024-12-06 23:39:10,548 - INFO - Candidate Mean Stats: {'Max': np.float64(3.283333329000638), 'Min': np.float64(-0.2958797754523983), 'Mean': np.float64(0.8438228466375238), 'Std': np.float64(0.48847813987202676)}
2024-12-06 23:39:10,549 - INFO - Candidate Std Stats: {'Max': np.float64(1.732716840117962), 'Min': np.float64(0.0), 'Mean': np.float64(0.4082082440293387), 'Std': np.float64(0.29357609269103035)}
[I 2024-12-06 23:39:10,565] Trial 486 finished with value: 1.875 and parameters: {'x_0_0': 'cd', 'x_0_1': 'ac', 'x_1_0': 'cd', 'x_1_1': 'oo'}. Best is trial 76 with value: 0.5.
2024-12-06 23:39:10,651 - INFO - Candidate Mean Stats: {'Max': np.float64(3.050050299654359), 'Min': np.float64(-0.53085922514232), 'Mean': np.float64(0.8593527759373737), 'Std': np.float64(0.4656450994638189)}
2024-12-06 23:39:10,651 - INFO - Candidate Std Stats: {'Max': np.float64(1.4896031595776014), 'Min': np.float64(0.0), 'Mean': np.float64(0.407771018551991), 'Std': np.float64(0.2864943658197624)}
[I 2024-12-06 23:39:10,669] Trial 486 finished with value: 1.3214285714285714 and parameters: {'x_0_0': 'bd', 'x_0_1': 'ac', 'x_1_0': 'oo', 'x_1_1': 'ad'}. Best is trial 63 with value: 0.5.
2024-12-06 23:39:10,931 - INFO - Candidate Mean Stats: {'Max': np.float64(3.1707812033566922), 'Min': np.float64(-0.6126530695996675), 'Mean': np.float64(0.8603650759661623), 'Std': np.float64(0.5444148518105509)}
2024-12-06 23:39:10,931 - INFO - Candidate Std Stats: {'Max': np.float64(1.464165054360997), 'Min': np.float64(0.0), 'Mean': np.float64(0.4269802207509636), 'Std': np.float64(0.28230811073096834)}
2024-12-06 23:39:10,943 - INFO - Candidate Mean Stats: {'Max': np.float64(2.892647914709464), 'Min': np.float64(-0.4876287177690518), 'Mean': np.float64(0.8349638450641816), 'Std': np.float64(0.4775461635326203)}
2024-12-06 23:39:10,943 - INFO - Candidate Std Stats: {'Max': np.float64(1.6518725028044903), 'Min': np.float64(0.0), 'Mean': np.float64(0.45531529768376416), 'Std': np.float64(0.30945263898574854)}
[I 2024-12-06 23:39:10,946] Trial 484 finished with value: 1.1607142857142856 and parameters: {'x_0_0': 'bd', 'x_0_1': 'ac', 'x_1_0': 'bd', 'x_1_1': 'oo'}. Best is trial 23 with value: 0.5.
[I 2024-12-06 23:39:10,959] Trial 487 finished with value: 1.375 and parameters: {'x_0_0': 'oo', 'x_0_1': 'oo', 'x_1_0': 'ac', 'x_1_1': 'ab'}. Best is trial 165 with value: 0.5.
2024-12-06 23:39:10,983 - INFO - Candidate Mean Stats: {'Max': np.float64(3.02670395937688), 'Min': np.float64(-0.3710591882469256), 'Mean': np.float64(0.8255048710970696), 'Std': np.float64(0.538630091020494)}
2024-12-06 23:39:10,984 - INFO - Candidate Std Stats: {'Max': np.float64(1.470261069649971), 'Min': np.float64(0.0), 'Mean': np.float64(0.44876740306224866), 'Std': np.float64(0.30387720000808016)}
[I 2024-12-06 23:39:11,000] Trial 487 finished with value: 1.2857142857142856 and parameters: {'x_0_0': 'bd', 'x_0_1': 'ad', 'x_1_0': 'bd', 'x_1_1': 'bd'}. Best is trial 76 with value: 0.5.
2024-12-06 23:39:11,097 - INFO - Candidate Mean Stats: {'Max': np.float64(3.0305719891811798), 'Min': np.float64(-0.5333624761285346), 'Mean': np.float64(0.8425378179602208), 'Std': np.float64(0.4751076022919375)}
2024-12-06 23:39:11,097 - INFO - Candidate Std Stats: {'Max': np.float64(1.6925654672624966), 'Min': np.float64(0.0), 'Mean': np.float64(0.4121185450039744), 'Std': np.float64(0.29196742467655235)}
[I 2024-12-06 23:39:11,116] Trial 487 finished with value: 1.3214285714285714 and parameters: {'x_0_0': 'bd', 'x_0_1': 'ac', 'x_1_0': 'oo', 'x_1_1': 'cd'}. Best is trial 63 with value: 0.5.
2024-12-06 23:39:11,453 - INFO - Candidate Mean Stats: {'Max': np.float64(2.8159138469146923), 'Min': np.float64(-0.45224883120325154), 'Mean': np.float64(0.8538052149860335), 'Std': np.float64(0.523360609299228)}
2024-12-06 23:39:11,453 - INFO - Candidate Std Stats: {'Max': np.float64(1.267213438803492), 'Min': np.float64(0.0), 'Mean': np.float64(0.4191298786684722), 'Std': np.float64(0.2792081880952001)}
2024-12-06 23:39:11,458 - INFO - Candidate Mean Stats: {'Max': np.float64(3.377491554300087), 'Min': np.float64(-0.4855182373772967), 'Mean': np.float64(0.8483667731536231), 'Std': np.float64(0.49440459051268004)}
2024-12-06 23:39:11,458 - INFO - Candidate Std Stats: {'Max': np.float64(1.5463428660953964), 'Min': np.float64(0.0), 'Mean': np.float64(0.43754122591777117), 'Std': np.float64(0.29252441366817933)}
[I 2024-12-06 23:39:11,475] Trial 485 finished with value: 1.5714285714285714 and parameters: {'x_0_0': 'bd', 'x_0_1': 'bd', 'x_1_0': 'cd', 'x_1_1': 'ab'}. Best is trial 23 with value: 0.5.
[I 2024-12-06 23:39:11,481] Trial 488 finished with value: 1.1964285714285714 and parameters: {'x_0_0': 'bd', 'x_0_1': 'ac', 'x_1_0': 'oo', 'x_1_1': 'oo'}. Best is trial 165 with value: 0.5.
2024-12-06 23:39:11,517 - INFO - Candidate Mean Stats: {'Max': np.float64(3.1664634629276), 'Min': np.float64(-0.6528624708790709), 'Mean': np.float64(0.7609929153190204), 'Std': np.float64(0.56237026762779)}
2024-12-06 23:39:11,518 - INFO - Candidate Std Stats: {'Max': np.float64(1.4772806514766375), 'Min': np.float64(0.0), 'Mean': np.float64(0.4448146333078183), 'Std': np.float64(0.2972925802058558)}
[I 2024-12-06 23:39:11,540] Trial 488 finished with value: 1.1607142857142856 and parameters: {'x_0_0': 'bc', 'x_0_1': 'ad', 'x_1_0': 'ad', 'x_1_1': 'oo'}. Best is trial 76 with value: 0.5.
2024-12-06 23:39:11,627 - INFO - Candidate Mean Stats: {'Max': np.float64(2.849861150887706), 'Min': np.float64(-0.37855216155882715), 'Mean': np.float64(0.7833429972507723), 'Std': np.float64(0.5316175856324186)}
2024-12-06 23:39:11,627 - INFO - Candidate Std Stats: {'Max': np.float64(1.5072427175427094), 'Min': np.float64(0.0), 'Mean': np.float64(0.4699174619158203), 'Std': np.float64(0.30800339126874304)}
[I 2024-12-06 23:39:11,644] Trial 488 finished with value: 1.1964285714285714 and parameters: {'x_0_0': 'ad', 'x_0_1': 'cd', 'x_1_0': 'oo', 'x_1_1': 'oo'}. Best is trial 63 with value: 0.5.
2024-12-06 23:39:11,955 - INFO - Candidate Mean Stats: {'Max': np.float64(2.981693333398379), 'Min': np.float64(-0.3078790791200282), 'Mean': np.float64(0.8374224244435629), 'Std': np.float64(0.47758632328561684)}
2024-12-06 23:39:11,955 - INFO - Candidate Std Stats: {'Max': np.float64(1.7862597471172603), 'Min': np.float64(0.0), 'Mean': np.float64(0.43114876126079726), 'Std': np.float64(0.31091551899542197)}
2024-12-06 23:39:11,966 - INFO - Candidate Mean Stats: {'Max': np.float64(2.8700041362423256), 'Min': np.float64(-0.3122516314233986), 'Mean': np.float64(0.8550199413735832), 'Std': np.float64(0.5024672738916316)}
2024-12-06 23:39:11,966 - INFO - Candidate Std Stats: {'Max': np.float64(1.2928368666558825), 'Min': np.float64(0.0), 'Mean': np.float64(0.4097923200023729), 'Std': np.float64(0.2707453021264757)}
[I 2024-12-06 23:39:11,975] Trial 489 finished with value: 1.375 and parameters: {'x_0_0': 'oo', 'x_0_1': 'oo', 'x_1_0': 'bc', 'x_1_1': 'bd'}. Best is trial 165 with value: 0.5.
[I 2024-12-06 23:39:11,984] Trial 486 finished with value: 1.375 and parameters: {'x_0_0': 'oo', 'x_0_1': 'oo', 'x_1_0': 'ac', 'x_1_1': 'bc'}. Best is trial 23 with value: 0.5.
2024-12-06 23:39:12,014 - INFO - Candidate Mean Stats: {'Max': np.float64(2.673020576938046), 'Min': np.float64(-0.5185905366520298), 'Mean': np.float64(0.820006301979952), 'Std': np.float64(0.4859352285909492)}
2024-12-06 23:39:12,014 - INFO - Candidate Std Stats: {'Max': np.float64(1.6433896387410871), 'Min': np.float64(0.0), 'Mean': np.float64(0.49221026757814196), 'Std': np.float64(0.3347379520284979)}
[I 2024-12-06 23:39:12,035] Trial 489 finished with value: 1.0357142857142856 and parameters: {'x_0_0': 'bc', 'x_0_1': 'ac', 'x_1_0': 'oo', 'x_1_1': 'bc'}. Best is trial 76 with value: 0.5.
2024-12-06 23:39:12,115 - INFO - Candidate Mean Stats: {'Max': np.float64(3.0175635973304002), 'Min': np.float64(-0.5488263056792246), 'Mean': np.float64(0.76589899139967), 'Std': np.float64(0.5579714021175208)}
2024-12-06 23:39:12,116 - INFO - Candidate Std Stats: {'Max': np.float64(1.684850360014423), 'Min': np.float64(0.0), 'Mean': np.float64(0.5019390378092454), 'Std': np.float64(0.34712876989862745)}
[I 2024-12-06 23:39:12,132] Trial 489 finished with value: 1.2857142857142856 and parameters: {'x_0_0': 'bc', 'x_0_1': 'ac', 'x_1_0': 'bd', 'x_1_1': 'bc'}. Best is trial 63 with value: 0.5.
2024-12-06 23:39:12,403 - INFO - Candidate Mean Stats: {'Max': np.float64(2.9761835845891813), 'Min': np.float64(-0.47213717958195833), 'Mean': np.float64(0.7977437329038225), 'Std': np.float64(0.5412323629056376)}
2024-12-06 23:39:12,403 - INFO - Candidate Std Stats: {'Max': np.float64(1.5238443678530498), 'Min': np.float64(0.0), 'Mean': np.float64(0.43819638777377845), 'Std': np.float64(0.29094591588217095)}
2024-12-06 23:39:12,410 - INFO - Candidate Mean Stats: {'Max': np.float64(3.7254581471285375), 'Min': np.float64(-0.4288472974219976), 'Mean': np.float64(0.8668451697567463), 'Std': np.float64(0.5242274241475171)}
2024-12-06 23:39:12,410 - INFO - Candidate Std Stats: {'Max': np.float64(1.2536113118659051), 'Min': np.float64(0.0), 'Mean': np.float64(0.36798741119651635), 'Std': np.float64(0.24083464644120273)}
[I 2024-12-06 23:39:12,421] Trial 490 finished with value: 1.375 and parameters: {'x_0_0': 'oo', 'x_0_1': 'oo', 'x_1_0': 'cd', 'x_1_1': 'cd'}. Best is trial 165 with value: 0.5.
[I 2024-12-06 23:39:12,427] Trial 487 finished with value: 1.1607142857142856 and parameters: {'x_0_0': 'ad', 'x_0_1': 'ad', 'x_1_0': 'bc', 'x_1_1': 'oo'}. Best is trial 23 with value: 0.5.
2024-12-06 23:39:12,453 - INFO - Candidate Mean Stats: {'Max': np.float64(3.2529008862956146), 'Min': np.float64(-0.6583600894814461), 'Mean': np.float64(0.8287133823561682), 'Std': np.float64(0.5538958763894695)}
2024-12-06 23:39:12,453 - INFO - Candidate Std Stats: {'Max': np.float64(1.770682603176385), 'Min': np.float64(0.0), 'Mean': np.float64(0.5019450370681008), 'Std': np.float64(0.3392501655143694)}
[I 2024-12-06 23:39:12,470] Trial 490 finished with value: 1.2857142857142856 and parameters: {'x_0_0': 'ac', 'x_0_1': 'ac', 'x_1_0': 'ab', 'x_1_1': 'bd'}. Best is trial 76 with value: 0.5.
2024-12-06 23:39:12,553 - INFO - Candidate Mean Stats: {'Max': np.float64(3.228257070711602), 'Min': np.float64(-0.5196938679494942), 'Mean': np.float64(0.8358656286703052), 'Std': np.float64(0.5197578427636482)}
2024-12-06 23:39:12,553 - INFO - Candidate Std Stats: {'Max': np.float64(1.57670728723245), 'Min': np.float64(0.0), 'Mean': np.float64(0.436447992266026), 'Std': np.float64(0.3118823869674377)}
[I 2024-12-06 23:39:12,570] Trial 490 finished with value: 1.4285714285714286 and parameters: {'x_0_0': 'ac', 'x_0_1': 'ab', 'x_1_0': 'bc', 'x_1_1': 'cd'}. Best is trial 63 with value: 0.5.
2024-12-06 23:39:12,943 - INFO - Candidate Mean Stats: {'Max': np.float64(2.9363053987949064), 'Min': np.float64(-0.22471447001350153), 'Mean': np.float64(0.8635504948891131), 'Std': np.float64(0.47372410144475)}
2024-12-06 23:39:12,943 - INFO - Candidate Std Stats: {'Max': np.float64(1.6466779240155078), 'Min': np.float64(0.0), 'Mean': np.float64(0.3802054421038786), 'Std': np.float64(0.2659316967185126)}
2024-12-06 23:39:12,955 - INFO - Candidate Mean Stats: {'Max': np.float64(3.2249662667295866), 'Min': np.float64(-0.4918230871801157), 'Mean': np.float64(0.8318222542520609), 'Std': np.float64(0.5250565648504483)}
2024-12-06 23:39:12,955 - INFO - Candidate Std Stats: {'Max': np.float64(1.305297780665323), 'Min': np.float64(0.0), 'Mean': np.float64(0.3872607378465206), 'Std': np.float64(0.26092741271219455)}
[I 2024-12-06 23:39:12,965] Trial 491 finished with value: 1.2857142857142856 and parameters: {'x_0_0': 'ad', 'x_0_1': 'bd', 'x_1_0': 'bd', 'x_1_1': 'bd'}. Best is trial 165 with value: 0.5.
[I 2024-12-06 23:39:12,974] Trial 488 finished with value: 1.3214285714285714 and parameters: {'x_0_0': 'bc', 'x_0_1': 'cd', 'x_1_0': 'oo', 'x_1_1': 'ac'}. Best is trial 23 with value: 0.5.
2024-12-06 23:39:13,006 - INFO - Candidate Mean Stats: {'Max': np.float64(3.282530788628924), 'Min': np.float64(-0.8341205777003816), 'Mean': np.float64(0.8453266147450041), 'Std': np.float64(0.5599498747590722)}
2024-12-06 23:39:13,006 - INFO - Candidate Std Stats: {'Max': np.float64(1.4690197854988285), 'Min': np.float64(0.0), 'Mean': np.float64(0.4206498079742972), 'Std': np.float64(0.28325261008263825)}
[I 2024-12-06 23:39:13,034] Trial 491 finished with value: 1.2857142857142856 and parameters: {'x_0_0': 'bc', 'x_0_1': 'ac', 'x_1_0': 'bd', 'x_1_1': 'bc'}. Best is trial 76 with value: 0.5.
2024-12-06 23:39:13,139 - INFO - Candidate Mean Stats: {'Max': np.float64(3.0577639210986987), 'Min': np.float64(-0.677335345070239), 'Mean': np.float64(0.9058787790257685), 'Std': np.float64(0.44087587124611494)}
2024-12-06 23:39:13,140 - INFO - Candidate Std Stats: {'Max': np.float64(1.6819934753770305), 'Min': np.float64(0.0), 'Mean': np.float64(0.317482998845931), 'Std': np.float64(0.2881947303474434)}
[I 2024-12-06 23:39:13,171] Trial 491 finished with value: 1.75 and parameters: {'x_0_0': 'cd', 'x_0_1': 'cd', 'x_1_0': 'oo', 'x_1_1': 'bc'}. Best is trial 63 with value: 0.5.
2024-12-06 23:39:13,453 - INFO - Candidate Mean Stats: {'Max': np.float64(2.915175578472297), 'Min': np.float64(-0.3594334054231374), 'Mean': np.float64(0.8645416587732339), 'Std': np.float64(0.44880294115919206)}
2024-12-06 23:39:13,453 - INFO - Candidate Std Stats: {'Max': np.float64(1.476869842488215), 'Min': np.float64(0.0), 'Mean': np.float64(0.3970767971411031), 'Std': np.float64(0.2804040662375919)}
2024-12-06 23:39:13,472 - INFO - Candidate Mean Stats: {'Max': np.float64(3.0404267091102604), 'Min': np.float64(-0.2256183071896035), 'Mean': np.float64(0.8554018155572616), 'Std': np.float64(0.4595736242020514)}
2024-12-06 23:39:13,472 - INFO - Candidate Std Stats: {'Max': np.float64(1.346356810560104), 'Min': np.float64(0.0), 'Mean': np.float64(0.4022041480005113), 'Std': np.float64(0.2797406822599471)}
[I 2024-12-06 23:39:13,472] Trial 492 finished with value: 1.5714285714285714 and parameters: {'x_0_0': 'ac', 'x_0_1': 'bc', 'x_1_0': 'cd', 'x_1_1': 'ad'}. Best is trial 165 with value: 0.5.
[I 2024-12-06 23:39:13,490] Trial 489 finished with value: 1.25 and parameters: {'x_0_0': 'oo', 'x_0_1': 'oo', 'x_1_0': 'cd', 'x_1_1': 'oo'}. Best is trial 23 with value: 0.5.
2024-12-06 23:39:13,525 - INFO - Candidate Mean Stats: {'Max': np.float64(3.3015104907617525), 'Min': np.float64(-0.48352579302597826), 'Mean': np.float64(0.8529365715464846), 'Std': np.float64(0.5567521567644838)}
2024-12-06 23:39:13,525 - INFO - Candidate Std Stats: {'Max': np.float64(1.560282287312162), 'Min': np.float64(0.0), 'Mean': np.float64(0.4460211905419802), 'Std': np.float64(0.3111785804218619)}
[I 2024-12-06 23:39:13,547] Trial 492 finished with value: 1.0357142857142856 and parameters: {'x_0_0': 'bc', 'x_0_1': 'ad', 'x_1_0': 'oo', 'x_1_1': 'ac'}. Best is trial 76 with value: 0.5.
2024-12-06 23:39:13,634 - INFO - Candidate Mean Stats: {'Max': np.float64(3.301165413981894), 'Min': np.float64(-0.6193305303151602), 'Mean': np.float64(0.8138817000191035), 'Std': np.float64(0.5638620637352098)}
2024-12-06 23:39:13,634 - INFO - Candidate Std Stats: {'Max': np.float64(1.5500445304319557), 'Min': np.float64(0.0), 'Mean': np.float64(0.46458436770494915), 'Std': np.float64(0.3079633581018432)}
[I 2024-12-06 23:39:13,653] Trial 492 finished with value: 1.1607142857142856 and parameters: {'x_0_0': 'bd', 'x_0_1': 'bc', 'x_1_0': 'bc', 'x_1_1': 'oo'}. Best is trial 63 with value: 0.5.
2024-12-06 23:39:13,929 - INFO - Candidate Mean Stats: {'Max': np.float64(3.210399574091428), 'Min': np.float64(-0.44977620977745814), 'Mean': np.float64(0.7947926430951787), 'Std': np.float64(0.5135096702244675)}
2024-12-06 23:39:13,929 - INFO - Candidate Std Stats: {'Max': np.float64(1.608752521607712), 'Min': np.float64(0.0), 'Mean': np.float64(0.44638908982228603), 'Std': np.float64(0.3078630795076389)}
[I 2024-12-06 23:39:13,948] Trial 493 finished with value: 1.3214285714285714 and parameters: {'x_0_0': 'bd', 'x_0_1': 'ab', 'x_1_0': 'oo', 'x_1_1': 'ac'}. Best is trial 165 with value: 0.5.
2024-12-06 23:39:13,960 - INFO - Candidate Mean Stats: {'Max': np.float64(3.037554938898213), 'Min': np.float64(-0.5280348201597904), 'Mean': np.float64(0.8699487030754651), 'Std': np.float64(0.5021296448569296)}
2024-12-06 23:39:13,960 - INFO - Candidate Std Stats: {'Max': np.float64(1.3174515588201248), 'Min': np.float64(0.0), 'Mean': np.float64(0.3889866976208386), 'Std': np.float64(0.2649562520768639)}
[I 2024-12-06 23:39:13,977] Trial 490 finished with value: 1.0357142857142856 and parameters: {'x_0_0': 'bc', 'x_0_1': 'ac', 'x_1_0': 'oo', 'x_1_1': 'cd'}. Best is trial 23 with value: 0.5.
2024-12-06 23:39:14,016 - INFO - Candidate Mean Stats: {'Max': np.float64(3.059048062460489), 'Min': np.float64(-0.6007850525987963), 'Mean': np.float64(0.8498274066936311), 'Std': np.float64(0.5394537764949082)}
2024-12-06 23:39:14,016 - INFO - Candidate Std Stats: {'Max': np.float64(1.489212842245656), 'Min': np.float64(0.0), 'Mean': np.float64(0.42125983749189294), 'Std': np.float64(0.2816036822531672)}
[I 2024-12-06 23:39:14,034] Trial 493 finished with value: 1.0 and parameters: {'x_0_0': 'bc', 'x_0_1': 'ad', 'x_1_0': 'cd', 'x_1_1': 'bd'}. Best is trial 76 with value: 0.5.
2024-12-06 23:39:14,130 - INFO - Candidate Mean Stats: {'Max': np.float64(3.590475274798032), 'Min': np.float64(-0.30346705720129674), 'Mean': np.float64(0.9080048022153243), 'Std': np.float64(0.48749283626956824)}
2024-12-06 23:39:14,130 - INFO - Candidate Std Stats: {'Max': np.float64(2.0225235674871875), 'Min': np.float64(0.0), 'Mean': np.float64(0.35337161759971275), 'Std': np.float64(0.27442637906838635)}
[I 2024-12-06 23:39:14,147] Trial 493 finished with value: 1.875 and parameters: {'x_0_0': 'cd', 'x_0_1': 'ab', 'x_1_0': 'cd', 'x_1_1': 'oo'}. Best is trial 63 with value: 0.5.
2024-12-06 23:39:14,435 - INFO - Candidate Mean Stats: {'Max': np.float64(3.2951525678417197), 'Min': np.float64(-0.1854636098964297), 'Mean': np.float64(0.89545946565308), 'Std': np.float64(0.44059376787710597)}
2024-12-06 23:39:14,437 - INFO - Candidate Std Stats: {'Max': np.float64(1.3024721300300626), 'Min': np.float64(0.0), 'Mean': np.float64(0.30860217006147245), 'Std': np.float64(0.23379576408207783)}
[I 2024-12-06 23:39:14,454] Trial 494 finished with value: 1.3392857142857144 and parameters: {'x_0_0': 'ab', 'x_0_1': 'ac', 'x_1_0': 'oo', 'x_1_1': 'oo'}. Best is trial 165 with value: 0.5.
2024-12-06 23:39:14,466 - INFO - Candidate Mean Stats: {'Max': np.float64(2.868298046984745), 'Min': np.float64(-0.4872777174186145), 'Mean': np.float64(0.8231517543758115), 'Std': np.float64(0.5069126247384437)}
2024-12-06 23:39:14,466 - INFO - Candidate Std Stats: {'Max': np.float64(1.375684503245727), 'Min': np.float64(0.0), 'Mean': np.float64(0.45337125436400316), 'Std': np.float64(0.30831344409297184)}
[I 2024-12-06 23:39:14,484] Trial 491 finished with value: 1.0535714285714286 and parameters: {'x_0_0': 'bc', 'x_0_1': 'ab', 'x_1_0': 'oo', 'x_1_1': 'oo'}. Best is trial 23 with value: 0.5.
2024-12-06 23:39:14,497 - INFO - Candidate Mean Stats: {'Max': np.float64(3.5008589674812725), 'Min': np.float64(-0.5140893052692398), 'Mean': np.float64(0.8369470751328348), 'Std': np.float64(0.5709644755019113)}
2024-12-06 23:39:14,497 - INFO - Candidate Std Stats: {'Max': np.float64(1.3928262067944264), 'Min': np.float64(0.0), 'Mean': np.float64(0.4167376980383233), 'Std': np.float64(0.2853650056777576)}
