[I 2024-12-28 14:58:47,635] Trial 15 finished with value: 1.4285714285714286 and parameters: {'x_0_0': 'bc', 'x_0_1': 'ab', 'x_1_0': 'ad', 'x_1_1': 'bd'}. Best is trial 2 with value: 1.1428571428571428.
[I 2024-12-28 14:58:47,673] Trial 9 finished with value: 1.5714285714285714 and parameters: {'x_0_0': 'ad', 'x_0_1': 'bc', 'x_1_0': 'ad', 'x_1_1': 'ab'}. Best is trial 3 with value: 0.7857142857142857.
[I 2024-12-28 14:58:47,716] Trial 15 finished with value: 1.4464285714285714 and parameters: {'x_0_0': 'ad', 'x_0_1': 'cd', 'x_1_0': 'ac', 'x_1_1': 'oo'}. Best is trial 5 with value: 1.0714285714285714.
[I 2024-12-28 14:58:47,727] Trial 11 finished with value: 1.4642857142857144 and parameters: {'x_0_0': 'ab', 'x_0_1': 'bc', 'x_1_0': 'oo', 'x_1_1': 'ac'}. Best is trial 6 with value: 0.8214285714285714.
[I 2024-12-28 14:58:47,736] Trial 13 finished with value: 1.4464285714285714 and parameters: {'x_0_0': 'ac', 'x_0_1': 'bc', 'x_1_0': 'ab', 'x_1_1': 'oo'}. Best is trial 8 with value: 1.0714285714285714.
[I 2024-12-28 14:58:47,811] Trial 14 finished with value: 2.0 and parameters: {'x_0_0': 'cd', 'x_0_1': 'ad', 'x_1_0': 'bc', 'x_1_1': 'ac'}. Best is trial 7 with value: 0.5.
[I 2024-12-28 14:58:47,843] Trial 16 finished with value: 1.0357142857142856 and parameters: {'x_0_0': 'bc', 'x_0_1': 'ac', 'x_1_0': 'oo', 'x_1_1': 'ac'}. Best is trial 16 with value: 1.0357142857142856.
[I 2024-12-28 14:58:47,864] Trial 17 finished with value: 0.7857142857142857 and parameters: {'x_0_0': 'bd', 'x_0_1': 'oo', 'x_1_0': 'bd', 'x_1_1': 'ab'}. Best is trial 17 with value: 0.7857142857142857.
[I 2024-12-28 14:58:47,926] Trial 17 finished with value: 2.0 and parameters: {'x_0_0': 'cd', 'x_0_1': 'ac', 'x_1_0': 'ac', 'x_1_1': 'bc'}. Best is trial 1 with value: 1.0.
[I 2024-12-28 14:58:47,943] Trial 16 finished with value: 1.7142857142857144 and parameters: {'x_0_0': 'ab', 'x_0_1': 'bd', 'x_1_0': 'ac', 'x_1_1': 'cd'}. Best is trial 2 with value: 1.1428571428571428.
[I 2024-12-28 14:58:47,971] Trial 13 finished with value: 1.5714285714285714 and parameters: {'x_0_0': 'ad', 'x_0_1': 'ad', 'x_1_0': 'ac', 'x_1_1': 'ab'}. Best is trial 4 with value: 1.0714285714285714.
[I 2024-12-28 14:58:48,067] Trial 14 finished with value: 0.9285714285714286 and parameters: {'x_0_0': 'ad', 'x_0_1': 'oo', 'x_1_0': 'ab', 'x_1_1': 'ad'}. Best is trial 14 with value: 0.9285714285714286.
[I 2024-12-28 14:58:48,080] Trial 12 finished with value: 1.0357142857142856 and parameters: {'x_0_0': 'ac', 'x_0_1': 'ad', 'x_1_0': 'oo', 'x_1_1': 'cd'}. Best is trial 6 with value: 0.8214285714285714.
[I 2024-12-28 14:58:48,096] Trial 16 finished with value: 1.75 and parameters: {'x_0_0': 'cd', 'x_0_1': 'bc', 'x_1_0': 'oo', 'x_1_1': 'cd'}. Best is trial 5 with value: 1.0714285714285714.
[I 2024-12-28 14:58:48,129] Trial 18 finished with value: 1.2857142857142856 and parameters: {'x_0_0': 'bd', 'x_0_1': 'ad', 'x_1_0': 'bc', 'x_1_1': 'bd'}. Best is trial 17 with value: 0.7857142857142857.
[I 2024-12-28 14:58:48,233] Trial 17 finished with value: 1.4285714285714286 and parameters: {'x_0_0': 'bd', 'x_0_1': 'ac', 'x_1_0': 'ab', 'x_1_1': 'ac'}. Best is trial 16 with value: 1.0357142857142856.
[I 2024-12-28 14:58:48,249] Trial 18 finished with value: 1.875 and parameters: {'x_0_0': 'cd', 'x_0_1': 'ac', 'x_1_0': 'ad', 'x_1_1': 'oo'}. Best is trial 1 with value: 1.0.
[I 2024-12-28 14:58:48,314] Trial 17 finished with value: 1.2857142857142856 and parameters: {'x_0_0': 'bd', 'x_0_1': 'ab', 'x_1_0': 'bc', 'x_1_1': 'cd'}. Best is trial 2 with value: 1.1428571428571428.
[I 2024-12-28 14:58:48,401] Trial 18 finished with value: 1.4464285714285714 and parameters: {'x_0_0': 'bc', 'x_0_1': 'cd', 'x_1_0': 'ad', 'x_1_1': 'oo'}. Best is trial 16 with value: 1.0357142857142856.
[I 2024-12-28 14:58:48,462] Trial 17 finished with value: 0.5 and parameters: {'x_0_0': 'bd', 'x_0_1': 'oo', 'x_1_0': 'bc', 'x_1_1': 'ac'}. Best is trial 17 with value: 0.5.
[I 2024-12-28 14:58:48,509] Trial 14 finished with value: 1.4642857142857144 and parameters: {'x_0_0': 'ab', 'x_0_1': 'cd', 'x_1_0': 'oo', 'x_1_1': 'cd'}. Best is trial 4 with value: 1.0714285714285714.
[I 2024-12-28 14:58:48,532] Trial 19 finished with value: 1.5714285714285714 and parameters: {'x_0_0': 'ad', 'x_0_1': 'ac', 'x_1_0': 'cd', 'x_1_1': 'ac'}. Best is trial 17 with value: 0.7857142857142857.
[I 2024-12-28 14:58:48,563] Trial 19 finished with value: 1.2857142857142856 and parameters: {'x_0_0': 'bd', 'x_0_1': 'ad', 'x_1_0': 'bc', 'x_1_1': 'bd'}. Best is trial 1 with value: 1.0.
[I 2024-12-28 14:58:48,580] Trial 18 finished with value: 1.2857142857142856 and parameters: {'x_0_0': 'bd', 'x_0_1': 'ad', 'x_1_0': 'bd', 'x_1_1': 'bd'}. Best is trial 2 with value: 1.1428571428571428.
[I 2024-12-28 14:58:48,613] Trial 19 finished with value: 1.5714285714285714 and parameters: {'x_0_0': 'bd', 'x_0_1': 'ac', 'x_1_0': 'ac', 'x_1_1': 'ac'}. Best is trial 16 with value: 1.0357142857142856.
[I 2024-12-28 14:58:48,660] Trial 13 finished with value: 1.7142857142857144 and parameters: {'x_0_0': 'ab', 'x_0_1': 'ac', 'x_1_0': 'ac', 'x_1_1': 'ac'}. Best is trial 6 with value: 0.8214285714285714.
[I 2024-12-28 14:58:48,685] Trial 10 finished with value: 1.7142857142857144 and parameters: {'x_0_0': 'ab', 'x_0_1': 'ab', 'x_1_0': 'cd', 'x_1_1': 'bd'}. Best is trial 3 with value: 0.7857142857142857.
[I 2024-12-28 14:58:48,762] Trial 15 finished with value: 1.4285714285714286 and parameters: {'x_0_0': 'ad', 'x_0_1': 'ab', 'x_1_0': 'ab', 'x_1_1': 'bc'}. Best is trial 7 with value: 0.5.
[I 2024-12-28 14:58:48,816] Trial 20 finished with value: 1.75 and parameters: {'x_0_0': 'oo', 'x_0_1': 'bd', 'x_1_0': 'ac', 'x_1_1': 'oo'}. Best is trial 17 with value: 0.7857142857142857.
[I 2024-12-28 14:58:48,855] Trial 19 finished with value: 1.5 and parameters: {'x_0_0': 'cd', 'x_0_1': 'oo', 'x_1_0': 'ac', 'x_1_1': 'ab'}. Best is trial 2 with value: 1.1428571428571428.
[I 2024-12-28 14:58:48,857] Trial 15 finished with value: 2.0 and parameters: {'x_0_0': 'cd', 'x_0_1': 'bc', 'x_1_0': 'ad', 'x_1_1': 'ab'}. Best is trial 4 with value: 1.0714285714285714.
[I 2024-12-28 14:58:48,880] Trial 20 finished with value: 1.4285714285714286 and parameters: {'x_0_0': 'ac', 'x_0_1': 'ab', 'x_1_0': 'cd', 'x_1_1': 'ab'}. Best is trial 1 with value: 1.0.
[I 2024-12-28 14:58:48,884] Trial 20 finished with value: 1.75 and parameters: {'x_0_0': 'cd', 'x_0_1': 'cd', 'x_1_0': 'oo', 'x_1_1': 'bc'}. Best is trial 16 with value: 1.0357142857142856.
[I 2024-12-28 14:58:48,955] Trial 18 finished with value: 1.4285714285714286 and parameters: {'x_0_0': 'ac', 'x_0_1': 'ab', 'x_1_0': 'bd', 'x_1_1': 'ad'}. Best is trial 17 with value: 0.5.
[I 2024-12-28 14:58:49,071] Trial 15 finished with value: 1.875 and parameters: {'x_0_0': 'cd', 'x_0_1': 'bc', 'x_1_0': 'ab', 'x_1_1': 'oo'}. Best is trial 14 with value: 0.9285714285714286.
[I 2024-12-28 14:58:49,072] Trial 14 finished with value: 2.0 and parameters: {'x_0_0': 'cd', 'x_0_1': 'bc', 'x_1_0': 'bd', 'x_1_1': 'cd'}. Best is trial 6 with value: 0.8214285714285714.
[I 2024-12-28 14:58:49,098] Trial 21 finished with value: 1.875 and parameters: {'x_0_0': 'oo', 'x_0_1': 'ad', 'x_1_0': 'cd', 'x_1_1': 'bd'}. Best is trial 1 with value: 1.0.
[I 2024-12-28 14:58:49,128] Trial 16 finished with value: 1.4285714285714286 and parameters: {'x_0_0': 'ad', 'x_0_1': 'ab', 'x_1_0': 'ab', 'x_1_1': 'ac'}. Best is trial 7 with value: 0.5.
[I 2024-12-28 14:58:49,134] Trial 11 finished with value: 1.5714285714285714 and parameters: {'x_0_0': 'ad', 'x_0_1': 'ad', 'x_1_0': 'ad', 'x_1_1': 'bc'}. Best is trial 3 with value: 0.7857142857142857.
[I 2024-12-28 14:58:49,143] Trial 20 finished with value: 1.0714285714285714 and parameters: {'x_0_0': 'ac', 'x_0_1': 'oo', 'x_1_0': 'bc', 'x_1_1': 'bc'}. Best is trial 20 with value: 1.0714285714285714.
[I 2024-12-28 14:58:49,162] Trial 21 finished with value: 1.5 and parameters: {'x_0_0': 'cd', 'x_0_1': 'oo', 'x_1_0': 'ac', 'x_1_1': 'ab'}. Best is trial 17 with value: 0.7857142857142857.
[I 2024-12-28 14:58:49,190] Trial 19 finished with value: 1.5714285714285714 and parameters: {'x_0_0': 'ac', 'x_0_1': 'cd', 'x_1_0': 'ac', 'x_1_1': 'ac'}. Best is trial 17 with value: 0.5.
[I 2024-12-28 14:58:49,245] Trial 21 finished with value: 2.0 and parameters: {'x_0_0': 'cd', 'x_0_1': 'ad', 'x_1_0': 'ac', 'x_1_1': 'bd'}. Best is trial 16 with value: 1.0357142857142856.
[I 2024-12-28 14:58:49,374] Trial 12 finished with value: 1.5714285714285714 and parameters: {'x_0_0': 'ad', 'x_0_1': 'cd', 'x_1_0': 'cd', 'x_1_1': 'bd'}. Best is trial 3 with value: 0.7857142857142857.
[I 2024-12-28 14:58:49,401] Trial 22 finished with value: 1.5 and parameters: {'x_0_0': 'cd', 'x_0_1': 'oo', 'x_1_0': 'ad', 'x_1_1': 'cd'}. Best is trial 17 with value: 0.7857142857142857.
[I 2024-12-28 14:58:49,443] Trial 16 finished with value: 0.8035714285714286 and parameters: {'x_0_0': 'ad', 'x_0_1': 'oo', 'x_1_0': 'ab', 'x_1_1': 'oo'}. Best is trial 16 with value: 0.8035714285714286.
[I 2024-12-28 14:58:49,447] Trial 20 finished with value: 1.375 and parameters: {'x_0_0': 'oo', 'x_0_1': 'oo', 'x_1_0': 'ac', 'x_1_1': 'ad'}. Best is trial 17 with value: 0.5.
[I 2024-12-28 14:58:49,452] Trial 22 finished with value: 1.5714285714285714 and parameters: {'x_0_0': 'bc', 'x_0_1': 'bc', 'x_1_0': 'ab', 'x_1_1': 'ab'}. Best is trial 1 with value: 1.0.
[I 2024-12-28 14:58:49,555] Trial 21 finished with value: 0.7857142857142857 and parameters: {'x_0_0': 'ad', 'x_0_1': 'oo', 'x_1_0': 'bd', 'x_1_1': 'ab'}. Best is trial 21 with value: 0.7857142857142857.
[I 2024-12-28 14:58:49,639] Trial 23 finished with value: 1.2857142857142856 and parameters: {'x_0_0': 'bd', 'x_0_1': 'cd', 'x_1_0': 'bd', 'x_1_1': 'ad'}. Best is trial 17 with value: 0.7857142857142857.
[I 2024-12-28 14:58:49,672] Trial 16 finished with value: 1.5714285714285714 and parameters: {'x_0_0': 'bd', 'x_0_1': 'ad', 'x_1_0': 'cd', 'x_1_1': 'cd'}. Best is trial 4 with value: 1.0714285714285714.
[I 2024-12-28 14:58:49,691] Trial 17 finished with value: 1.375 and parameters: {'x_0_0': 'oo', 'x_0_1': 'oo', 'x_1_0': 'bc', 'x_1_1': 'bc'}. Best is trial 7 with value: 0.5.
[I 2024-12-28 14:58:49,715] Trial 23 finished with value: 1.7142857142857144 and parameters: {'x_0_0': 'ab', 'x_0_1': 'ad', 'x_1_0': 'ad', 'x_1_1': 'bc'}. Best is trial 1 with value: 1.0.
[I 2024-12-28 14:58:49,735] Trial 13 finished with value: 1.5 and parameters: {'x_0_0': 'cd', 'x_0_1': 'oo', 'x_1_0': 'bc', 'x_1_1': 'ac'}. Best is trial 3 with value: 0.7857142857142857.
[I 2024-12-28 14:58:49,752] Trial 15 finished with value: 0.6964285714285714 and parameters: {'x_0_0': 'bd', 'x_0_1': 'oo', 'x_1_0': 'oo', 'x_1_1': 'oo'}. Best is trial 15 with value: 0.6964285714285714.
[I 2024-12-28 14:58:49,766] Trial 21 finished with value: 1.7142857142857144 and parameters: {'x_0_0': 'ab', 'x_0_1': 'ab', 'x_1_0': 'bc', 'x_1_1': 'cd'}. Best is trial 17 with value: 0.5.
[I 2024-12-28 14:58:49,842] Trial 22 finished with value: 1.4285714285714286 and parameters: {'x_0_0': 'ac', 'x_0_1': 'ab', 'x_1_0': 'ad', 'x_1_1': 'bc'}. Best is trial 16 with value: 1.0357142857142856.
[I 2024-12-28 14:58:49,953] Trial 17 finished with value: 1.1607142857142856 and parameters: {'x_0_0': 'bc', 'x_0_1': 'ad', 'x_1_0': 'ad', 'x_1_1': 'oo'}. Best is trial 4 with value: 1.0714285714285714.
[I 2024-12-28 14:58:49,986] Trial 18 finished with value: 1.2857142857142856 and parameters: {'x_0_0': 'ac', 'x_0_1': 'ad', 'x_1_0': 'cd', 'x_1_1': 'ad'}. Best is trial 7 with value: 0.5.
[I 2024-12-28 14:58:50,012] Trial 24 finished with value: 1.4464285714285714 and parameters: {'x_0_0': 'bd', 'x_0_1': 'cd', 'x_1_0': 'cd', 'x_1_1': 'oo'}. Best is trial 1 with value: 1.0.
[I 2024-12-28 14:58:50,013] Trial 24 finished with value: 1.1428571428571428 and parameters: {'x_0_0': 'ac', 'x_0_1': 'ad', 'x_1_0': 'bd', 'x_1_1': 'ab'}. Best is trial 17 with value: 0.7857142857142857.
[I 2024-12-28 14:58:50,046] Trial 22 finished with value: 0.9285714285714286 and parameters: {'x_0_0': 'ad', 'x_0_1': 'oo', 'x_1_0': 'ab', 'x_1_1': 'ab'}. Best is trial 21 with value: 0.7857142857142857.
[I 2024-12-28 14:58:50,052] Trial 14 finished with value: 1.0714285714285714 and parameters: {'x_0_0': 'bc', 'x_0_1': 'oo', 'x_1_0': 'ab', 'x_1_1': 'bc'}. Best is trial 3 with value: 0.7857142857142857.
[I 2024-12-28 14:58:50,100] Trial 17 finished with value: 1.875 and parameters: {'x_0_0': 'cd', 'x_0_1': 'bd', 'x_1_0': 'ab', 'x_1_1': 'oo'}. Best is trial 16 with value: 0.8035714285714286.
[I 2024-12-28 14:58:50,130] Trial 23 finished with value: 2.0 and parameters: {'x_0_0': 'cd', 'x_0_1': 'bd', 'x_1_0': 'ab', 'x_1_1': 'bc'}. Best is trial 16 with value: 1.0357142857142856.
[I 2024-12-28 14:58:50,184] Trial 22 finished with value: 1.875 and parameters: {'x_0_0': 'oo', 'x_0_1': 'ad', 'x_1_0': 'bc', 'x_1_1': 'ac'}. Best is trial 17 with value: 0.5.
[I 2024-12-28 14:58:50,222] Trial 16 finished with value: 1.875 and parameters: {'x_0_0': 'oo', 'x_0_1': 'bc', 'x_1_0': 'ac', 'x_1_1': 'ad'}. Best is trial 15 with value: 0.6964285714285714.
[I 2024-12-28 14:58:50,239] Trial 19 finished with value: 0.9464285714285714 and parameters: {'x_0_0': 'ad', 'x_0_1': 'oo', 'x_1_0': 'cd', 'x_1_1': 'oo'}. Best is trial 7 with value: 0.5.
[I 2024-12-28 14:58:50,279] Trial 25 finished with value: 1.5714285714285714 and parameters: {'x_0_0': 'bd', 'x_0_1': 'ab', 'x_1_0': 'cd', 'x_1_1': 'cd'}. Best is trial 1 with value: 1.0.
[I 2024-12-28 14:58:50,306] Trial 25 finished with value: 1.875 and parameters: {'x_0_0': 'oo', 'x_0_1': 'ad', 'x_1_0': 'bd', 'x_1_1': 'ab'}. Best is trial 17 with value: 0.7857142857142857.
[I 2024-12-28 14:58:50,372] Trial 15 finished with value: 1.2857142857142856 and parameters: {'x_0_0': 'bc', 'x_0_1': 'ac', 'x_1_0': 'cd', 'x_1_1': 'ad'}. Best is trial 3 with value: 0.7857142857142857.
[I 2024-12-28 14:58:50,424] Trial 24 finished with value: 2.0 and parameters: {'x_0_0': 'cd', 'x_0_1': 'ac', 'x_1_0': 'ab', 'x_1_1': 'cd'}. Best is trial 16 with value: 1.0357142857142856.
[I 2024-12-28 14:58:50,453] Trial 26 finished with value: 1.7142857142857144 and parameters: {'x_0_0': 'ab', 'x_0_1': 'bc', 'x_1_0': 'bc', 'x_1_1': 'ad'}. Best is trial 1 with value: 1.0.
[I 2024-12-28 14:58:50,483] Trial 20 finished with value: 1.0714285714285714 and parameters: {'x_0_0': 'ac', 'x_0_1': 'oo', 'x_1_0': 'bd', 'x_1_1': 'bc'}. Best is trial 7 with value: 0.5.
[I 2024-12-28 14:58:50,488] Trial 23 finished with value: 1.4285714285714286 and parameters: {'x_0_0': 'ac', 'x_0_1': 'ab', 'x_1_0': 'ac', 'x_1_1': 'ab'}. Best is trial 21 with value: 0.7857142857142857.
[I 2024-12-28 14:58:50,525] Trial 18 finished with value: 1.875 and parameters: {'x_0_0': 'cd', 'x_0_1': 'cd', 'x_1_0': 'ab', 'x_1_1': 'oo'}. Best is trial 16 with value: 0.8035714285714286.
[I 2024-12-28 14:58:50,577] Trial 18 finished with value: 2.0 and parameters: {'x_0_0': 'cd', 'x_0_1': 'ab', 'x_1_0': 'bc', 'x_1_1': 'bc'}. Best is trial 4 with value: 1.0714285714285714.
[I 2024-12-28 14:58:50,616] Trial 23 finished with value: 1.2857142857142856 and parameters: {'x_0_0': 'bd', 'x_0_1': 'bd', 'x_1_0': 'bd', 'x_1_1': 'ac'}. Best is trial 17 with value: 0.5.
[I 2024-12-28 14:58:50,634] Trial 26 finished with value: 1.2857142857142856 and parameters: {'x_0_0': 'ad', 'x_0_1': 'bd', 'x_1_0': 'bc', 'x_1_1': 'cd'}. Best is trial 17 with value: 0.7857142857142857.
[I 2024-12-28 14:58:50,664] Trial 27 finished with value: 1.7142857142857144 and parameters: {'x_0_0': 'ab', 'x_0_1': 'ad', 'x_1_0': 'cd', 'x_1_1': 'cd'}. Best is trial 1 with value: 1.0.
[I 2024-12-28 14:58:50,670] Trial 24 finished with value: 1.25 and parameters: {'x_0_0': 'oo', 'x_0_1': 'oo', 'x_1_0': 'ac', 'x_1_1': 'oo'}. Best is trial 21 with value: 0.7857142857142857.
[I 2024-12-28 14:58:50,764] Trial 17 finished with value: 1.4285714285714286 and parameters: {'x_0_0': 'bd', 'x_0_1': 'ad', 'x_1_0': 'ab', 'x_1_1': 'ab'}. Best is trial 15 with value: 0.6964285714285714.
[I 2024-12-28 14:58:50,805] Trial 16 finished with value: 2.0 and parameters: {'x_0_0': 'cd', 'x_0_1': 'ab', 'x_1_0': 'bc', 'x_1_1': 'bc'}. Best is trial 3 with value: 0.7857142857142857.
[I 2024-12-28 14:58:50,866] Trial 25 finished with value: 1.5714285714285714 and parameters: {'x_0_0': 'bc', 'x_0_1': 'bc', 'x_1_0': 'bd', 'x_1_1': 'ac'}. Best is trial 21 with value: 0.7857142857142857.
[I 2024-12-28 14:58:50,884] Trial 21 finished with value: 1.75 and parameters: {'x_0_0': 'oo', 'x_0_1': 'ad', 'x_1_0': 'bc', 'x_1_1': 'oo'}. Best is trial 7 with value: 0.5.
[I 2024-12-28 14:58:50,930] Trial 24 finished with value: 2.0 and parameters: {'x_0_0': 'cd', 'x_0_1': 'ad', 'x_1_0': 'bd', 'x_1_1': 'ac'}. Best is trial 17 with value: 0.5.
[I 2024-12-28 14:58:50,962] Trial 19 finished with value: 2.0 and parameters: {'x_0_0': 'cd', 'x_0_1': 'bd', 'x_1_0': 'ab', 'x_1_1': 'bc'}. Best is trial 4 with value: 1.0714285714285714.
[I 2024-12-28 14:58:50,999] Trial 27 finished with value: 0.9642857142857143 and parameters: {'x_0_0': 'ab', 'x_0_1': 'oo', 'x_1_0': 'oo', 'x_1_1': 'bd'}. Best is trial 17 with value: 0.7857142857142857.
[I 2024-12-28 14:58:50,999] Trial 19 finished with value: 1.0714285714285714 and parameters: {'x_0_0': 'ac', 'x_0_1': 'oo', 'x_1_0': 'ab', 'x_1_1': 'ab'}. Best is trial 16 with value: 0.8035714285714286.
[I 2024-12-28 14:58:50,999] Trial 18 finished with value: 0.9285714285714286 and parameters: {'x_0_0': 'bd', 'x_0_1': 'oo', 'x_1_0': 'ab', 'x_1_1': 'cd'}. Best is trial 15 with value: 0.6964285714285714.
[I 2024-12-28 14:58:51,038] Trial 25 finished with value: 1.1428571428571428 and parameters: {'x_0_0': 'ac', 'x_0_1': 'ad', 'x_1_0': 'bd', 'x_1_1': 'ab'}. Best is trial 16 with value: 1.0357142857142856.
[I 2024-12-28 14:58:51,091] Trial 28 finished with value: 1.875 and parameters: {'x_0_0': 'oo', 'x_0_1': 'ac', 'x_1_0': 'ac', 'x_1_1': 'bd'}. Best is trial 1 with value: 1.0.
[I 2024-12-28 14:58:51,168] Trial 26 finished with value: 2.0 and parameters: {'x_0_0': 'cd', 'x_0_1': 'bc', 'x_1_0': 'ac', 'x_1_1': 'ad'}. Best is trial 21 with value: 0.7857142857142857.
[I 2024-12-28 14:58:51,242] Trial 28 finished with value: 2.0 and parameters: {'x_0_0': 'cd', 'x_0_1': 'bc', 'x_1_0': 'cd', 'x_1_1': 'cd'}. Best is trial 17 with value: 0.7857142857142857.
[I 2024-12-28 14:58:51,272] Trial 17 finished with value: 0.9642857142857143 and parameters: {'x_0_0': 'ab', 'x_0_1': 'oo', 'x_1_0': 'oo', 'x_1_1': 'cd'}. Best is trial 3 with value: 0.7857142857142857.
[I 2024-12-28 14:58:51,332] Trial 20 finished with value: 2.0 and parameters: {'x_0_0': 'cd', 'x_0_1': 'bd', 'x_1_0': 'ac', 'x_1_1': 'cd'}. Best is trial 16 with value: 0.8035714285714286.
[I 2024-12-28 14:58:51,394] Trial 20 finished with value: 1.75 and parameters: {'x_0_0': 'cd', 'x_0_1': 'ad', 'x_1_0': 'oo', 'x_1_1': 'bd'}. Best is trial 4 with value: 1.0714285714285714.
[I 2024-12-28 14:58:51,426] Trial 29 finished with value: 1.2857142857142856 and parameters: {'x_0_0': 'ac', 'x_0_1': 'ad', 'x_1_0': 'bd', 'x_1_1': 'cd'}. Best is trial 1 with value: 1.0.
[I 2024-12-28 14:58:51,469] Trial 26 finished with value: 2.0 and parameters: {'x_0_0': 'cd', 'x_0_1': 'bc', 'x_1_0': 'ac', 'x_1_1': 'ab'}. Best is trial 16 with value: 1.0357142857142856.
[I 2024-12-28 14:58:51,544] Trial 25 finished with value: 1.5714285714285714 and parameters: {'x_0_0': 'ac', 'x_0_1': 'bd', 'x_1_0': 'ab', 'x_1_1': 'cd'}. Best is trial 17 with value: 0.5.
[I 2024-12-28 14:58:51,549] Trial 22 finished with value: 1.7142857142857144 and parameters: {'x_0_0': 'ab', 'x_0_1': 'cd', 'x_1_0': 'cd', 'x_1_1': 'cd'}. Best is trial 7 with value: 0.5.
[I 2024-12-28 14:58:51,573] Trial 18 finished with value: 1.4642857142857144 and parameters: {'x_0_0': 'ab', 'x_0_1': 'ab', 'x_1_0': 'oo', 'x_1_1': 'bc'}. Best is trial 3 with value: 0.7857142857142857.
[I 2024-12-28 14:58:51,592] Trial 19 finished with value: 1.5714285714285714 and parameters: {'x_0_0': 'bc', 'x_0_1': 'bd', 'x_1_0': 'ac', 'x_1_1': 'cd'}. Best is trial 15 with value: 0.6964285714285714.
[I 2024-12-28 14:58:51,651] Trial 29 finished with value: 0.9285714285714286 and parameters: {'x_0_0': 'bd', 'x_0_1': 'oo', 'x_1_0': 'ab', 'x_1_1': 'ad'}. Best is trial 17 with value: 0.7857142857142857.
[I 2024-12-28 14:58:51,664] Trial 27 finished with value: 1.4285714285714286 and parameters: {'x_0_0': 'ad', 'x_0_1': 'ac', 'x_1_0': 'ab', 'x_1_1': 'bd'}. Best is trial 21 with value: 0.7857142857142857.
[I 2024-12-28 14:58:51,712] Trial 30 finished with value: 1.0 and parameters: {'x_0_0': 'ac', 'x_0_1': 'ad', 'x_1_0': 'bd', 'x_1_1': 'bd'}. Best is trial 1 with value: 1.0.
[I 2024-12-28 14:58:51,744] Trial 21 finished with value: 1.1607142857142856 and parameters: {'x_0_0': 'ad', 'x_0_1': 'cd', 'x_1_0': 'bc', 'x_1_1': 'oo'}. Best is trial 16 with value: 0.8035714285714286.
[I 2024-12-28 14:58:51,821] Trial 23 finished with value: 1.5714285714285714 and parameters: {'x_0_0': 'ad', 'x_0_1': 'bc', 'x_1_0': 'cd', 'x_1_1': 'ab'}. Best is trial 7 with value: 0.5.
[I 2024-12-28 14:58:51,823] Trial 26 finished with value: 2.0 and parameters: {'x_0_0': 'cd', 'x_0_1': 'ab', 'x_1_0': 'bc', 'x_1_1': 'cd'}. Best is trial 17 with value: 0.5.
[I 2024-12-28 14:58:51,884] Trial 28 finished with value: 1.625 and parameters: {'x_0_0': 'oo', 'x_0_1': 'cd', 'x_1_0': 'oo', 'x_1_1': 'bc'}. Best is trial 21 with value: 0.7857142857142857.
[I 2024-12-28 14:58:51,962] Trial 27 finished with value: 1.1785714285714286 and parameters: {'x_0_0': 'bc', 'x_0_1': 'ab', 'x_1_0': 'oo', 'x_1_1': 'bc'}. Best is trial 16 with value: 1.0357142857142856.
[I 2024-12-28 14:58:51,988] Trial 20 finished with value: 1.4642857142857144 and parameters: {'x_0_0': 'ab', 'x_0_1': 'ab', 'x_1_0': 'oo', 'x_1_1': 'ac'}. Best is trial 15 with value: 0.6964285714285714.
[I 2024-12-28 14:58:52,078] Trial 31 finished with value: 1.4285714285714286 and parameters: {'x_0_0': 'bd', 'x_0_1': 'bc', 'x_1_0': 'ab', 'x_1_1': 'bd'}. Best is trial 1 with value: 1.0.
