[I 2024-12-07 01:32:38,697] Trial 308 finished with value: 1.2666666666666666 and parameters: {'x_0_0': 'ac', 'x_0_1': 'oo', 'x_0_2': 'cd', 'x_1_0': 'ab', 'x_1_1': 'ac', 'x_1_2': 'ab'}. Best is trial 148 with value: 0.8333333333333333.
2024-12-07 01:32:41,895 - INFO - Candidate Mean Stats: {'Max': np.float64(2.0), 'Min': np.float64(0.2365183747053498), 'Mean': np.float64(0.4877115856075231), 'Std': np.float64(0.08200320070414534)}
2024-12-07 01:32:41,895 - INFO - Candidate Std Stats: {'Max': np.float64(0.6017426011258081), 'Min': np.float64(0.0), 'Mean': np.float64(0.11375374473388275), 'Std': np.float64(0.04920300797231191)}
[I 2024-12-07 01:32:41,938] Trial 307 finished with value: 1.2666666666666666 and parameters: {'x_0_0': 'ad', 'x_0_1': 'oo', 'x_0_2': 'ac', 'x_1_0': 'ad', 'x_1_1': 'bd', 'x_1_2': 'ac'}. Best is trial 200 with value: 0.6.
2024-12-07 01:32:50,953 - INFO - Candidate Mean Stats: {'Max': np.float64(2.0), 'Min': np.float64(0.199889099469645), 'Mean': np.float64(0.48691741015234385), 'Std': np.float64(0.0810113655072817)}
2024-12-07 01:32:50,953 - INFO - Candidate Std Stats: {'Max': np.float64(0.6429362904159232), 'Min': np.float64(0.0), 'Mean': np.float64(0.10343083184021154), 'Std': np.float64(0.045807689789539204)}
[I 2024-12-07 01:32:50,994] Trial 307 finished with value: 1.0666666666666667 and parameters: {'x_0_0': 'ac', 'x_0_1': 'oo', 'x_0_2': 'ab', 'x_1_0': 'oo', 'x_1_1': 'ab', 'x_1_2': 'bd'}. Best is trial 280 with value: 0.6222222222222222.
2024-12-07 01:32:51,408 - INFO - Candidate Mean Stats: {'Max': np.float64(2.0), 'Min': np.float64(0.2300534447170947), 'Mean': np.float64(0.4875597712400709), 'Std': np.float64(0.08472557693314367)}
2024-12-07 01:32:51,408 - INFO - Candidate Std Stats: {'Max': np.float64(0.41062467784756385), 'Min': np.float64(0.0), 'Mean': np.float64(0.10685960434896291), 'Std': np.float64(0.04568390893844758)}
[I 2024-12-07 01:32:51,452] Trial 308 finished with value: 0.9666666666666667 and parameters: {'x_0_0': 'ac', 'x_0_1': 'oo', 'x_0_2': 'oo', 'x_1_0': 'bd', 'x_1_1': 'oo', 'x_1_2': 'oo'}. Best is trial 49 with value: 0.7999999999999999.
2024-12-07 01:32:58,566 - INFO - Candidate Mean Stats: {'Max': np.float64(2.0), 'Min': np.float64(0.2566124942416645), 'Mean': np.float64(0.49581245463811147), 'Std': np.float64(0.07621940703477302)}
2024-12-07 01:32:58,566 - INFO - Candidate Std Stats: {'Max': np.float64(0.39904195190457953), 'Min': np.float64(0.0), 'Mean': np.float64(0.09649644272596267), 'Std': np.float64(0.04085562923818401)}
[I 2024-12-07 01:32:58,607] Trial 309 finished with value: 1.5777777777777777 and parameters: {'x_0_0': 'ab', 'x_0_1': 'bd', 'x_0_2': 'bc', 'x_1_0': 'oo', 'x_1_1': 'ac', 'x_1_2': 'bd'}. Best is trial 148 with value: 0.8333333333333333.
2024-12-07 01:33:01,799 - INFO - Candidate Mean Stats: {'Max': np.float64(2.0), 'Min': np.float64(0.24334831543522983), 'Mean': np.float64(0.4931099347180005), 'Std': np.float64(0.08015348741013753)}
2024-12-07 01:33:01,800 - INFO - Candidate Std Stats: {'Max': np.float64(0.5211046826984221), 'Min': np.float64(0.0), 'Mean': np.float64(0.1005924822559662), 'Std': np.float64(0.04306541454547607)}
[I 2024-12-07 01:33:01,843] Trial 308 finished with value: 1.2666666666666666 and parameters: {'x_0_0': 'ad', 'x_0_1': 'oo', 'x_0_2': 'bc', 'x_1_0': 'ac', 'x_1_1': 'ac', 'x_1_2': 'ab'}. Best is trial 200 with value: 0.6.
2024-12-07 01:33:11,308 - INFO - Candidate Mean Stats: {'Max': np.float64(2.0), 'Min': np.float64(0.25763173324444716), 'Mean': np.float64(0.4896130479995923), 'Std': np.float64(0.07586545372295334)}
2024-12-07 01:33:11,308 - INFO - Candidate Std Stats: {'Max': np.float64(0.4436629814306468), 'Min': np.float64(0.0), 'Mean': np.float64(0.09857430705597617), 'Std': np.float64(0.04110320094569155)}
[I 2024-12-07 01:33:11,350] Trial 308 finished with value: 1.2666666666666666 and parameters: {'x_0_0': 'bc', 'x_0_1': 'oo', 'x_0_2': 'ab', 'x_1_0': 'ad', 'x_1_1': 'bd', 'x_1_2': 'bd'}. Best is trial 280 with value: 0.6222222222222222.
2024-12-07 01:33:11,800 - INFO - Candidate Mean Stats: {'Max': np.float64(2.0), 'Min': np.float64(0.2519075910591145), 'Mean': np.float64(0.4933840053270362), 'Std': np.float64(0.08179393128349882)}
2024-12-07 01:33:11,800 - INFO - Candidate Std Stats: {'Max': np.float64(0.929433487887569), 'Min': np.float64(0.0), 'Mean': np.float64(0.10898426346150247), 'Std': np.float64(0.050292972904748906)}
[I 2024-12-07 01:33:11,840] Trial 309 finished with value: 1.3444444444444446 and parameters: {'x_0_0': 'ac', 'x_0_1': 'ac', 'x_0_2': 'bd', 'x_1_0': 'ab', 'x_1_1': 'ac', 'x_1_2': 'oo'}. Best is trial 49 with value: 0.7999999999999999.
2024-12-07 01:33:18,728 - INFO - Candidate Mean Stats: {'Max': np.float64(2.0), 'Min': np.float64(0.19306519790581772), 'Mean': np.float64(0.4874045528094844), 'Std': np.float64(0.0828128636476002)}
2024-12-07 01:33:18,729 - INFO - Candidate Std Stats: {'Max': np.float64(0.5812405321318024), 'Min': np.float64(0.0), 'Mean': np.float64(0.11079481059699015), 'Std': np.float64(0.04667513363137422)}
[I 2024-12-07 01:33:18,771] Trial 310 finished with value: 1.2222222222222223 and parameters: {'x_0_0': 'ad', 'x_0_1': 'bd', 'x_0_2': 'cd', 'x_1_0': 'bc', 'x_1_1': 'ad', 'x_1_2': 'ab'}. Best is trial 148 with value: 0.8333333333333333.
2024-12-07 01:33:21,673 - INFO - Candidate Mean Stats: {'Max': np.float64(2.0), 'Min': np.float64(0.1375353629705513), 'Mean': np.float64(0.4819165910257028), 'Std': np.float64(0.08673655948255043)}
2024-12-07 01:33:21,674 - INFO - Candidate Std Stats: {'Max': np.float64(1.6722286390709604), 'Min': np.float64(0.0), 'Mean': np.float64(0.12405922841110582), 'Std': np.float64(0.06793151510053552)}
[I 2024-12-07 01:33:21,716] Trial 309 finished with value: 1.6666666666666665 and parameters: {'x_0_0': 'bc', 'x_0_1': 'bd', 'x_0_2': 'ac', 'x_1_0': 'ac', 'x_1_1': 'bc', 'x_1_2': 'cd'}. Best is trial 200 with value: 0.6.
2024-12-07 01:33:31,416 - INFO - Candidate Mean Stats: {'Max': np.float64(2.0), 'Min': np.float64(0.13006470658460226), 'Mean': np.float64(0.4747573147341733), 'Std': np.float64(0.08679873652044282)}
2024-12-07 01:33:31,417 - INFO - Candidate Std Stats: {'Max': np.float64(1.4397690638920695), 'Min': np.float64(0.0), 'Mean': np.float64(0.1188428343791979), 'Std': np.float64(0.06455767423961871)}
[I 2024-12-07 01:33:31,459] Trial 310 finished with value: 1.1666666666666665 and parameters: {'x_0_0': 'ad', 'x_0_1': 'oo', 'x_0_2': 'bc', 'x_1_0': 'ad', 'x_1_1': 'ac', 'x_1_2': 'oo'}. Best is trial 49 with value: 0.7999999999999999.
2024-12-07 01:33:31,600 - INFO - Candidate Mean Stats: {'Max': np.float64(2.0), 'Min': np.float64(0.26212121108889386), 'Mean': np.float64(0.49245881832555805), 'Std': np.float64(0.07757752812742234)}
2024-12-07 01:33:31,601 - INFO - Candidate Std Stats: {'Max': np.float64(0.63811055033294), 'Min': np.float64(0.0), 'Mean': np.float64(0.10238314569068872), 'Std': np.float64(0.04481413443930127)}
[I 2024-12-07 01:33:31,641] Trial 309 finished with value: 1.7777777777777777 and parameters: {'x_0_0': 'ab', 'x_0_1': 'bc', 'x_0_2': 'bd', 'x_1_0': 'ac', 'x_1_1': 'bd', 'x_1_2': 'bd'}. Best is trial 280 with value: 0.6222222222222222.
2024-12-07 01:33:38,806 - INFO - Candidate Mean Stats: {'Max': np.float64(2.0), 'Min': np.float64(0.25433893345773184), 'Mean': np.float64(0.4949675643809234), 'Std': np.float64(0.08377630533127664)}
2024-12-07 01:33:38,807 - INFO - Candidate Std Stats: {'Max': np.float64(1.505197923449004), 'Min': np.float64(0.0), 'Mean': np.float64(0.10907887749155133), 'Std': np.float64(0.05134656274597091)}
[I 2024-12-07 01:33:38,849] Trial 311 finished with value: 1.3444444444444443 and parameters: {'x_0_0': 'bd', 'x_0_1': 'bc', 'x_0_2': 'oo', 'x_1_0': 'bc', 'x_1_1': 'bd', 'x_1_2': 'cd'}. Best is trial 148 with value: 0.8333333333333333.
2024-12-07 01:33:41,760 - INFO - Candidate Mean Stats: {'Max': np.float64(2.0), 'Min': np.float64(0.2202097770903091), 'Mean': np.float64(0.48792352694888075), 'Std': np.float64(0.09337155966323372)}
2024-12-07 01:33:41,761 - INFO - Candidate Std Stats: {'Max': np.float64(0.8361518134600799), 'Min': np.float64(0.0), 'Mean': np.float64(0.12287343782493787), 'Std': np.float64(0.056728397369033026)}
[I 2024-12-07 01:33:41,804] Trial 310 finished with value: 1.2666666666666666 and parameters: {'x_0_0': 'bc', 'x_0_1': 'oo', 'x_0_2': 'ac', 'x_1_0': 'ac', 'x_1_1': 'cd', 'x_1_2': 'cd'}. Best is trial 200 with value: 0.6.
2024-12-07 01:33:51,693 - INFO - Candidate Mean Stats: {'Max': np.float64(2.0), 'Min': np.float64(0.2481259215640291), 'Mean': np.float64(0.4872980002051899), 'Std': np.float64(0.08144178563663229)}
2024-12-07 01:33:51,693 - INFO - Candidate Std Stats: {'Max': np.float64(0.5026992935783321), 'Min': np.float64(0.0), 'Mean': np.float64(0.10963441869828093), 'Std': np.float64(0.04705715940778253)}
[I 2024-12-07 01:33:51,735] Trial 311 finished with value: 0.9666666666666667 and parameters: {'x_0_0': 'bc', 'x_0_1': 'oo', 'x_0_2': 'bd', 'x_1_0': 'oo', 'x_1_1': 'bd', 'x_1_2': 'oo'}. Best is trial 49 with value: 0.7999999999999999.
2024-12-07 01:33:52,090 - INFO - Candidate Mean Stats: {'Max': np.float64(2.0), 'Min': np.float64(0.23044298534183855), 'Mean': np.float64(0.48742256902421166), 'Std': np.float64(0.07665256082536286)}
2024-12-07 01:33:52,091 - INFO - Candidate Std Stats: {'Max': np.float64(0.35652870639212836), 'Min': np.float64(0.0), 'Mean': np.float64(0.0996526210242847), 'Std': np.float64(0.040667851442137824)}
[I 2024-12-07 01:33:52,133] Trial 310 finished with value: 1.4666666666666666 and parameters: {'x_0_0': 'bd', 'x_0_1': 'ac', 'x_0_2': 'bc', 'x_1_0': 'oo', 'x_1_1': 'ad', 'x_1_2': 'ad'}. Best is trial 280 with value: 0.6222222222222222.
2024-12-07 01:33:59,054 - INFO - Candidate Mean Stats: {'Max': np.float64(2.0), 'Min': np.float64(0.23658536833309318), 'Mean': np.float64(0.48486271204497206), 'Std': np.float64(0.08807039948864201)}
2024-12-07 01:33:59,054 - INFO - Candidate Std Stats: {'Max': np.float64(1.497992841034063), 'Min': np.float64(0.0), 'Mean': np.float64(0.11997578501717297), 'Std': np.float64(0.06263185493043251)}
[I 2024-12-07 01:33:59,096] Trial 312 finished with value: 1.3555555555555556 and parameters: {'x_0_0': 'ac', 'x_0_1': 'ab', 'x_0_2': 'ac', 'x_1_0': 'oo', 'x_1_1': 'bd', 'x_1_2': 'ac'}. Best is trial 148 with value: 0.8333333333333333.
2024-12-07 01:34:01,916 - INFO - Candidate Mean Stats: {'Max': np.float64(2.0), 'Min': np.float64(0.19651408396694764), 'Mean': np.float64(0.49149153051759087), 'Std': np.float64(0.0857432333907959)}
2024-12-07 01:34:01,916 - INFO - Candidate Std Stats: {'Max': np.float64(0.3334746979589319), 'Min': np.float64(0.0), 'Mean': np.float64(0.10617520473598324), 'Std': np.float64(0.041391747502527804)}
[I 2024-12-07 01:34:01,958] Trial 311 finished with value: 1.4 and parameters: {'x_0_0': 'oo', 'x_0_1': 'oo', 'x_0_2': 'bc', 'x_1_0': 'bc', 'x_1_1': 'oo', 'x_1_2': 'ac'}. Best is trial 200 with value: 0.6.
2024-12-07 01:34:11,801 - INFO - Candidate Mean Stats: {'Max': np.float64(2.0), 'Min': np.float64(0.08258435406203671), 'Mean': np.float64(0.49406585899541805), 'Std': np.float64(0.08343143028259745)}
2024-12-07 01:34:11,803 - INFO - Candidate Std Stats: {'Max': np.float64(0.5906332447947183), 'Min': np.float64(0.0), 'Mean': np.float64(0.10610912523785727), 'Std': np.float64(0.05042093540572589)}
[I 2024-12-07 01:34:11,845] Trial 312 finished with value: 1.0666666666666667 and parameters: {'x_0_0': 'ad', 'x_0_1': 'oo', 'x_0_2': 'oo', 'x_1_0': 'cd', 'x_1_1': 'ad', 'x_1_2': 'oo'}. Best is trial 49 with value: 0.7999999999999999.
2024-12-07 01:34:12,306 - INFO - Candidate Mean Stats: {'Max': np.float64(2.0), 'Min': np.float64(0.26756068247907305), 'Mean': np.float64(0.4837715902633125), 'Std': np.float64(0.07499333097612318)}
2024-12-07 01:34:12,307 - INFO - Candidate Std Stats: {'Max': np.float64(0.5000267773192615), 'Min': np.float64(0.0), 'Mean': np.float64(0.10161917106259064), 'Std': np.float64(0.04344446598050187)}
[I 2024-12-07 01:34:12,349] Trial 311 finished with value: 1.0555555555555556 and parameters: {'x_0_0': 'ad', 'x_0_1': 'oo', 'x_0_2': 'oo', 'x_1_0': 'ab', 'x_1_1': 'bd', 'x_1_2': 'cd'}. Best is trial 280 with value: 0.6222222222222222.
2024-12-07 01:34:19,110 - INFO - Candidate Mean Stats: {'Max': np.float64(2.0), 'Min': np.float64(0.20178279970646534), 'Mean': np.float64(0.4873045475061826), 'Std': np.float64(0.07920544617311127)}
2024-12-07 01:34:19,111 - INFO - Candidate Std Stats: {'Max': np.float64(0.6029187607856157), 'Min': np.float64(0.0), 'Mean': np.float64(0.10294575117030955), 'Std': np.float64(0.045251996648916874)}
[I 2024-12-07 01:34:19,152] Trial 313 finished with value: 1.9 and parameters: {'x_0_0': 'oo', 'x_0_1': 'ad', 'x_0_2': 'bd', 'x_1_0': 'cd', 'x_1_1': 'cd', 'x_1_2': 'ad'}. Best is trial 148 with value: 0.8333333333333333.
2024-12-07 01:34:21,862 - INFO - Candidate Mean Stats: {'Max': np.float64(2.0), 'Min': np.float64(0.20032987936546495), 'Mean': np.float64(0.4986841799644038), 'Std': np.float64(0.0845809267190936)}
2024-12-07 01:34:21,863 - INFO - Candidate Std Stats: {'Max': np.float64(0.4164905197402909), 'Min': np.float64(0.0), 'Mean': np.float64(0.10698087252036162), 'Std': np.float64(0.04566928514250944)}
[I 2024-12-07 01:34:21,905] Trial 312 finished with value: 0.7222222222222222 and parameters: {'x_0_0': 'ad', 'x_0_1': 'oo', 'x_0_2': 'oo', 'x_1_0': 'bc', 'x_1_1': 'ad', 'x_1_2': 'cd'}. Best is trial 200 with value: 0.6.
2024-12-07 01:34:31,527 - INFO - Candidate Mean Stats: {'Max': np.float64(2.0), 'Min': np.float64(0.23269859776904758), 'Mean': np.float64(0.4878303017933587), 'Std': np.float64(0.08512359743386673)}
2024-12-07 01:34:31,527 - INFO - Candidate Std Stats: {'Max': np.float64(1.6880616021376822), 'Min': np.float64(0.0), 'Mean': np.float64(0.10461897246884978), 'Std': np.float64(0.04852875907161262)}
[I 2024-12-07 01:34:31,570] Trial 313 finished with value: 0.7444444444444445 and parameters: {'x_0_0': 'ad', 'x_0_1': 'oo', 'x_0_2': 'oo', 'x_1_0': 'bd', 'x_1_1': 'oo', 'x_1_2': 'oo'}. Best is trial 313 with value: 0.7444444444444445.
2024-12-07 01:34:32,599 - INFO - Candidate Mean Stats: {'Max': np.float64(2.0), 'Min': np.float64(0.2785221120073308), 'Mean': np.float64(0.4930670362819469), 'Std': np.float64(0.0752879606555867)}
2024-12-07 01:34:32,599 - INFO - Candidate Std Stats: {'Max': np.float64(0.4785621653010851), 'Min': np.float64(0.0), 'Mean': np.float64(0.09941186926357151), 'Std': np.float64(0.041738544004622825)}
[I 2024-12-07 01:34:32,640] Trial 312 finished with value: 0.8444444444444444 and parameters: {'x_0_0': 'bd', 'x_0_1': 'oo', 'x_0_2': 'oo', 'x_1_0': 'bd', 'x_1_1': 'oo', 'x_1_2': 'ab'}. Best is trial 280 with value: 0.6222222222222222.
2024-12-07 01:34:39,217 - INFO - Candidate Mean Stats: {'Max': np.float64(2.0), 'Min': np.float64(0.1818441070884907), 'Mean': np.float64(0.4929905643990481), 'Std': np.float64(0.08114261174802369)}
2024-12-07 01:34:39,218 - INFO - Candidate Std Stats: {'Max': np.float64(0.3378175275658906), 'Min': np.float64(0.0), 'Mean': np.float64(0.09841111677870526), 'Std': np.float64(0.03980736411685671)}
[I 2024-12-07 01:34:39,259] Trial 314 finished with value: 0.8666666666666667 and parameters: {'x_0_0': 'ac', 'x_0_1': 'oo', 'x_0_2': 'bc', 'x_1_0': 'oo', 'x_1_1': 'oo', 'x_1_2': 'oo'}. Best is trial 148 with value: 0.8333333333333333.
2024-12-07 01:34:41,724 - INFO - Candidate Mean Stats: {'Max': np.float64(2.0), 'Min': np.float64(0.2654179081094064), 'Mean': np.float64(0.5034241781825294), 'Std': np.float64(0.0791431708317495)}
2024-12-07 01:34:41,725 - INFO - Candidate Std Stats: {'Max': np.float64(0.6308729467018486), 'Min': np.float64(0.0), 'Mean': np.float64(0.10082335618209907), 'Std': np.float64(0.043202825545033526)}
[I 2024-12-07 01:34:41,766] Trial 313 finished with value: 1.1666666666666665 and parameters: {'x_0_0': 'bc', 'x_0_1': 'oo', 'x_0_2': 'ad', 'x_1_0': 'ad', 'x_1_1': 'oo', 'x_1_2': 'ac'}. Best is trial 200 with value: 0.6.
2024-12-07 01:34:51,560 - INFO - Candidate Mean Stats: {'Max': np.float64(2.0), 'Min': np.float64(0.24923851345110468), 'Mean': np.float64(0.49226463548388616), 'Std': np.float64(0.07792990232192783)}
2024-12-07 01:34:51,561 - INFO - Candidate Std Stats: {'Max': np.float64(1.9251764788552048), 'Min': np.float64(0.0), 'Mean': np.float64(0.09843081692914328), 'Std': np.float64(0.04579298628113326)}
[I 2024-12-07 01:34:51,602] Trial 314 finished with value: 1.0666666666666667 and parameters: {'x_0_0': 'ad', 'x_0_1': 'oo', 'x_0_2': 'oo', 'x_1_0': 'cd', 'x_1_1': 'bc', 'x_1_2': 'oo'}. Best is trial 313 with value: 0.7444444444444445.
2024-12-07 01:34:52,611 - INFO - Candidate Mean Stats: {'Max': np.float64(2.0), 'Min': np.float64(0.2750362296223975), 'Mean': np.float64(0.5006432795086624), 'Std': np.float64(0.07407363640622695)}
2024-12-07 01:34:52,612 - INFO - Candidate Std Stats: {'Max': np.float64(1.776097856727882), 'Min': np.float64(0.0), 'Mean': np.float64(0.10324393732165198), 'Std': np.float64(0.051541585120138865)}
[I 2024-12-07 01:34:52,654] Trial 313 finished with value: 1.6666666666666665 and parameters: {'x_0_0': 'ac', 'x_0_1': 'bd', 'x_0_2': 'ad', 'x_1_0': 'ad', 'x_1_1': 'ab', 'x_1_2': 'ac'}. Best is trial 280 with value: 0.6222222222222222.
