[I 2024-12-07 01:03:22,863] Trial 222 finished with value: 1.1666666666666665 and parameters: {'x_0_0': 'ad', 'x_0_1': 'oo', 'x_0_2': 'oo', 'x_1_0': 'ad', 'x_1_1': 'ac', 'x_1_2': 'ac'}. Best is trial 200 with value: 0.6.
2024-12-07 01:03:28,893 - INFO - Candidate Mean Stats: {'Max': np.float64(2.0), 'Min': np.float64(0.2720272852857187), 'Mean': np.float64(0.4922805595432427), 'Std': np.float64(0.06920804826915737)}
2024-12-07 01:03:28,894 - INFO - Candidate Std Stats: {'Max': np.float64(1.3956779945992945), 'Min': np.float64(0.0), 'Mean': np.float64(0.09643354721214158), 'Std': np.float64(0.04170301100979579)}
[I 2024-12-07 01:03:28,938] Trial 222 finished with value: 1.2222222222222223 and parameters: {'x_0_0': 'bd', 'x_0_1': 'ad', 'x_0_2': 'ac', 'x_1_0': 'bc', 'x_1_1': 'ac', 'x_1_2': 'cd'}. Best is trial 74 with value: 0.8222222222222222.
2024-12-07 01:03:29,889 - INFO - Candidate Mean Stats: {'Max': np.float64(2.0), 'Min': np.float64(0.26528404572167813), 'Mean': np.float64(0.4904978716238728), 'Std': np.float64(0.0719629376818529)}
2024-12-07 01:03:29,890 - INFO - Candidate Std Stats: {'Max': np.float64(0.46968153744272), 'Min': np.float64(0.0), 'Mean': np.float64(0.10122459707571518), 'Std': np.float64(0.04554282567534732)}
[I 2024-12-07 01:03:29,933] Trial 223 finished with value: 1.7999999999999998 and parameters: {'x_0_0': 'cd', 'x_0_1': 'ad', 'x_0_2': 'oo', 'x_1_0': 'bd', 'x_1_1': 'ad', 'x_1_2': 'oo'}. Best is trial 148 with value: 0.8333333333333333.
2024-12-07 01:03:34,710 - INFO - Candidate Mean Stats: {'Max': np.float64(2.0), 'Min': np.float64(0.2641994548472851), 'Mean': np.float64(0.47610261992774977), 'Std': np.float64(0.07545715702483859)}
2024-12-07 01:03:34,711 - INFO - Candidate Std Stats: {'Max': np.float64(1.773892350755132), 'Min': np.float64(0.0), 'Mean': np.float64(0.11450482377739074), 'Std': np.float64(0.05661257833626117)}
[I 2024-12-07 01:03:34,755] Trial 223 finished with value: 1.4444444444444444 and parameters: {'x_0_0': 'ac', 'x_0_1': 'ad', 'x_0_2': 'bc', 'x_1_0': 'bd', 'x_1_1': 'ac', 'x_1_2': 'ac'}. Best is trial 49 with value: 0.7999999999999999.
2024-12-07 01:03:43,583 - INFO - Candidate Mean Stats: {'Max': np.float64(2.0), 'Min': np.float64(0.18106764772286338), 'Mean': np.float64(0.47938408204727373), 'Std': np.float64(0.08434117947118616)}
2024-12-07 01:03:43,584 - INFO - Candidate Std Stats: {'Max': np.float64(1.7460274910249465), 'Min': np.float64(0.0), 'Mean': np.float64(0.12383876754944947), 'Std': np.float64(0.06115952066695651)}
[I 2024-12-07 01:03:43,628] Trial 223 finished with value: 1.6666666666666665 and parameters: {'x_0_0': 'bc', 'x_0_1': 'bd', 'x_0_2': 'bc', 'x_1_0': 'bd', 'x_1_1': 'bc', 'x_1_2': 'ac'}. Best is trial 200 with value: 0.6.
2024-12-07 01:03:49,620 - INFO - Candidate Mean Stats: {'Max': np.float64(2.0), 'Min': np.float64(0.16044562343490043), 'Mean': np.float64(0.4843448193737575), 'Std': np.float64(0.07694947832220445)}
2024-12-07 01:03:49,621 - INFO - Candidate Std Stats: {'Max': np.float64(1.5220517164360423), 'Min': np.float64(0.0), 'Mean': np.float64(0.11444006239108553), 'Std': np.float64(0.0655513985407207)}
[I 2024-12-07 01:03:49,666] Trial 223 finished with value: 1.1666666666666665 and parameters: {'x_0_0': 'ac', 'x_0_1': 'oo', 'x_0_2': 'cd', 'x_1_0': 'bc', 'x_1_1': 'ab', 'x_1_2': 'oo'}. Best is trial 74 with value: 0.8222222222222222.
2024-12-07 01:03:50,301 - INFO - Candidate Mean Stats: {'Max': np.float64(2.0), 'Min': np.float64(0.2886619196126946), 'Mean': np.float64(0.496618156370218), 'Std': np.float64(0.07346435868771456)}
2024-12-07 01:03:50,302 - INFO - Candidate Std Stats: {'Max': np.float64(1.319855176257898), 'Min': np.float64(0.0), 'Mean': np.float64(0.09224087185543332), 'Std': np.float64(0.04397747870392319)}
[I 2024-12-07 01:03:50,345] Trial 224 finished with value: 1.4666666666666666 and parameters: {'x_0_0': 'bd', 'x_0_1': 'ab', 'x_0_2': 'cd', 'x_1_0': 'oo', 'x_1_1': 'bc', 'x_1_2': 'ac'}. Best is trial 148 with value: 0.8333333333333333.
2024-12-07 01:03:55,527 - INFO - Candidate Mean Stats: {'Max': np.float64(2.0), 'Min': np.float64(0.24218670353970523), 'Mean': np.float64(0.4826582284794645), 'Std': np.float64(0.08322083916982805)}
2024-12-07 01:03:55,528 - INFO - Candidate Std Stats: {'Max': np.float64(1.3064325526629093), 'Min': np.float64(0.0), 'Mean': np.float64(0.1246790706503526), 'Std': np.float64(0.06804263298732055)}
[I 2024-12-07 01:03:55,572] Trial 224 finished with value: 1.4444444444444444 and parameters: {'x_0_0': 'ad', 'x_0_1': 'bd', 'x_0_2': 'ad', 'x_1_0': 'bd', 'x_1_1': 'cd', 'x_1_2': 'ad'}. Best is trial 49 with value: 0.7999999999999999.
2024-12-07 01:04:04,101 - INFO - Candidate Mean Stats: {'Max': np.float64(2.0), 'Min': np.float64(0.2550798956764241), 'Mean': np.float64(0.49242139351631414), 'Std': np.float64(0.07339139279537805)}
2024-12-07 01:04:04,101 - INFO - Candidate Std Stats: {'Max': np.float64(0.43062713837245103), 'Min': np.float64(0.0), 'Mean': np.float64(0.10280352898384251), 'Std': np.float64(0.043007225676222935)}
[I 2024-12-07 01:04:04,145] Trial 224 finished with value: 1.6666666666666665 and parameters: {'x_0_0': 'ad', 'x_0_1': 'bc', 'x_0_2': 'ab', 'x_1_0': 'cd', 'x_1_1': 'ab', 'x_1_2': 'cd'}. Best is trial 200 with value: 0.6.
2024-12-07 01:04:10,147 - INFO - Candidate Mean Stats: {'Max': np.float64(2.0), 'Min': np.float64(0.22370251763102145), 'Mean': np.float64(0.47736364559470745), 'Std': np.float64(0.07287008378569584)}
2024-12-07 01:04:10,147 - INFO - Candidate Std Stats: {'Max': np.float64(0.4494820930901167), 'Min': np.float64(0.0), 'Mean': np.float64(0.10995186205110917), 'Std': np.float64(0.04538749773341702)}
[I 2024-12-07 01:04:10,193] Trial 224 finished with value: 1.0666666666666667 and parameters: {'x_0_0': 'bc', 'x_0_1': 'oo', 'x_0_2': 'cd', 'x_1_0': 'oo', 'x_1_1': 'ab', 'x_1_2': 'ab'}. Best is trial 74 with value: 0.8222222222222222.
2024-12-07 01:04:10,793 - INFO - Candidate Mean Stats: {'Max': np.float64(2.0), 'Min': np.float64(0.24504951126646887), 'Mean': np.float64(0.4951493407119291), 'Std': np.float64(0.07991107031845393)}
2024-12-07 01:04:10,793 - INFO - Candidate Std Stats: {'Max': np.float64(0.7233111555958275), 'Min': np.float64(0.0), 'Mean': np.float64(0.10392755983976723), 'Std': np.float64(0.04784975243578381)}
[I 2024-12-07 01:04:10,837] Trial 225 finished with value: 1.6666666666666665 and parameters: {'x_0_0': 'bd', 'x_0_1': 'bd', 'x_0_2': 'ad', 'x_1_0': 'ac', 'x_1_1': 'bc', 'x_1_2': 'bc'}. Best is trial 148 with value: 0.8333333333333333.
2024-12-07 01:04:16,146 - INFO - Candidate Mean Stats: {'Max': np.float64(2.0), 'Min': np.float64(0.2809646302745489), 'Mean': np.float64(0.4835815705078638), 'Std': np.float64(0.06919399271263764)}
2024-12-07 01:04:16,146 - INFO - Candidate Std Stats: {'Max': np.float64(0.41244484315357877), 'Min': np.float64(0.0), 'Mean': np.float64(0.10005425073708468), 'Std': np.float64(0.04288771214364015)}
[I 2024-12-07 01:04:16,188] Trial 225 finished with value: 0.9444444444444444 and parameters: {'x_0_0': 'ad', 'x_0_1': 'oo', 'x_0_2': 'oo', 'x_1_0': 'bc', 'x_1_1': 'bc', 'x_1_2': 'ab'}. Best is trial 49 with value: 0.7999999999999999.
2024-12-07 01:04:24,875 - INFO - Candidate Mean Stats: {'Max': np.float64(2.0), 'Min': np.float64(0.21502053761705398), 'Mean': np.float64(0.48927426015850023), 'Std': np.float64(0.07816077511533234)}
2024-12-07 01:04:24,875 - INFO - Candidate Std Stats: {'Max': np.float64(0.49906391905648456), 'Min': np.float64(0.0), 'Mean': np.float64(0.11357260500378619), 'Std': np.float64(0.04834630056155736)}
[I 2024-12-07 01:04:24,920] Trial 225 finished with value: 1.1666666666666665 and parameters: {'x_0_0': 'ad', 'x_0_1': 'oo', 'x_0_2': 'oo', 'x_1_0': 'ac', 'x_1_1': 'ac', 'x_1_2': 'ab'}. Best is trial 200 with value: 0.6.
2024-12-07 01:04:30,634 - INFO - Candidate Mean Stats: {'Max': np.float64(2.0), 'Min': np.float64(0.20821313418046233), 'Mean': np.float64(0.4983330489502643), 'Std': np.float64(0.08039007739370647)}
2024-12-07 01:04:30,635 - INFO - Candidate Std Stats: {'Max': np.float64(1.3481705502881005), 'Min': np.float64(0.0), 'Mean': np.float64(0.10746235119075205), 'Std': np.float64(0.05281040778133853)}
[I 2024-12-07 01:04:30,680] Trial 226 finished with value: 1.1444444444444444 and parameters: {'x_0_0': 'ac', 'x_0_1': 'ac', 'x_0_2': 'oo', 'x_1_0': 'oo', 'x_1_1': 'cd', 'x_1_2': 'cd'}. Best is trial 148 with value: 0.8333333333333333.
2024-12-07 01:04:30,831 - INFO - Candidate Mean Stats: {'Max': np.float64(2.0), 'Min': np.float64(0.26483039710169265), 'Mean': np.float64(0.48991188973812005), 'Std': np.float64(0.07572826092977113)}
2024-12-07 01:04:30,832 - INFO - Candidate Std Stats: {'Max': np.float64(0.7440399344523498), 'Min': np.float64(0.0), 'Mean': np.float64(0.11114759321967028), 'Std': np.float64(0.04805381254372656)}
[I 2024-12-07 01:04:30,875] Trial 225 finished with value: 1.1666666666666665 and parameters: {'x_0_0': 'ac', 'x_0_1': 'oo', 'x_0_2': 'bc', 'x_1_0': 'ad', 'x_1_1': 'ac', 'x_1_2': 'oo'}. Best is trial 74 with value: 0.8222222222222222.
2024-12-07 01:04:36,671 - INFO - Candidate Mean Stats: {'Max': np.float64(2.0), 'Min': np.float64(0.19763634495411458), 'Mean': np.float64(0.4831031727931322), 'Std': np.float64(0.07096945583840635)}
2024-12-07 01:04:36,672 - INFO - Candidate Std Stats: {'Max': np.float64(0.44367369778248283), 'Min': np.float64(0.0), 'Mean': np.float64(0.10650535748128814), 'Std': np.float64(0.04612905808074269)}
[I 2024-12-07 01:04:36,715] Trial 226 finished with value: 1.3666666666666667 and parameters: {'x_0_0': 'bd', 'x_0_1': 'ad', 'x_0_2': 'ab', 'x_1_0': 'oo', 'x_1_1': 'oo', 'x_1_2': 'ab'}. Best is trial 49 with value: 0.7999999999999999.
2024-12-07 01:04:45,788 - INFO - Candidate Mean Stats: {'Max': np.float64(2.0), 'Min': np.float64(0.23387173318646198), 'Mean': np.float64(0.4947405420958653), 'Std': np.float64(0.07747024727881888)}
2024-12-07 01:04:45,788 - INFO - Candidate Std Stats: {'Max': np.float64(0.9904345538846798), 'Min': np.float64(0.0), 'Mean': np.float64(0.11412600281368643), 'Std': np.float64(0.058031755700092495)}
[I 2024-12-07 01:04:45,833] Trial 226 finished with value: 1.5777777777777777 and parameters: {'x_0_0': 'ab', 'x_0_1': 'cd', 'x_0_2': 'ac', 'x_1_0': 'oo', 'x_1_1': 'bc', 'x_1_2': 'cd'}. Best is trial 200 with value: 0.6.
2024-12-07 01:04:51,124 - INFO - Candidate Mean Stats: {'Max': np.float64(2.0), 'Min': np.float64(0.25170487427994936), 'Mean': np.float64(0.48583070377542736), 'Std': np.float64(0.07127233199613388)}
2024-12-07 01:04:51,124 - INFO - Candidate Std Stats: {'Max': np.float64(0.3188514789792947), 'Min': np.float64(0.0), 'Mean': np.float64(0.09523805486885567), 'Std': np.float64(0.040521062114239226)}
[I 2024-12-07 01:04:51,166] Trial 227 finished with value: 1.0666666666666667 and parameters: {'x_0_0': 'ac', 'x_0_1': 'oo', 'x_0_2': 'oo', 'x_1_0': 'ad', 'x_1_1': 'oo', 'x_1_2': 'cd'}. Best is trial 148 with value: 0.8333333333333333.
2024-12-07 01:04:51,279 - INFO - Candidate Mean Stats: {'Max': np.float64(2.0), 'Min': np.float64(0.2319053139392862), 'Mean': np.float64(0.4950953371121758), 'Std': np.float64(0.07128919775244333)}
2024-12-07 01:04:51,279 - INFO - Candidate Std Stats: {'Max': np.float64(0.37043847974728844), 'Min': np.float64(0.0), 'Mean': np.float64(0.09815113277839214), 'Std': np.float64(0.039234764010451575)}
[I 2024-12-07 01:04:51,319] Trial 226 finished with value: 1.3444444444444446 and parameters: {'x_0_0': 'ad', 'x_0_1': 'cd', 'x_0_2': 'ac', 'x_1_0': 'bd', 'x_1_1': 'bd', 'x_1_2': 'oo'}. Best is trial 74 with value: 0.8222222222222222.
2024-12-07 01:04:57,301 - INFO - Candidate Mean Stats: {'Max': np.float64(2.0), 'Min': np.float64(0.2745373057425631), 'Mean': np.float64(0.48557461696399096), 'Std': np.float64(0.07623155393349874)}
2024-12-07 01:04:57,301 - INFO - Candidate Std Stats: {'Max': np.float64(1.6065244522693929), 'Min': np.float64(0.0), 'Mean': np.float64(0.1033864335593395), 'Std': np.float64(0.053944064737822005)}
[I 2024-12-07 01:04:57,343] Trial 227 finished with value: 1.3666666666666667 and parameters: {'x_0_0': 'ad', 'x_0_1': 'ad', 'x_0_2': 'ab', 'x_1_0': 'oo', 'x_1_1': 'ad', 'x_1_2': 'oo'}. Best is trial 49 with value: 0.7999999999999999.
2024-12-07 01:05:06,393 - INFO - Candidate Mean Stats: {'Max': np.float64(2.0), 'Min': np.float64(0.18446190020508335), 'Mean': np.float64(0.4977140772903716), 'Std': np.float64(0.07549145925736511)}
2024-12-07 01:05:06,393 - INFO - Candidate Std Stats: {'Max': np.float64(1.602251094009602), 'Min': np.float64(0.0), 'Mean': np.float64(0.1050346962321847), 'Std': np.float64(0.05224904975274058)}
[I 2024-12-07 01:05:06,439] Trial 227 finished with value: 1.0666666666666667 and parameters: {'x_0_0': 'ad', 'x_0_1': 'oo', 'x_0_2': 'ac', 'x_1_0': 'oo', 'x_1_1': 'ac', 'x_1_2': 'ac'}. Best is trial 200 with value: 0.6.
2024-12-07 01:05:11,931 - INFO - Candidate Mean Stats: {'Max': np.float64(2.0), 'Min': np.float64(0.2148755322286892), 'Mean': np.float64(0.49490310372522434), 'Std': np.float64(0.07354386252063803)}
2024-12-07 01:05:11,933 - INFO - Candidate Std Stats: {'Max': np.float64(0.5168557139655873), 'Min': np.float64(0.0), 'Mean': np.float64(0.1135315000255812), 'Std': np.float64(0.05021082716172574)}
2024-12-07 01:05:11,960 - INFO - Candidate Mean Stats: {'Max': np.float64(2.0), 'Min': np.float64(0.2501524916012202), 'Mean': np.float64(0.49072846860693914), 'Std': np.float64(0.08119980220428949)}
2024-12-07 01:05:11,960 - INFO - Candidate Std Stats: {'Max': np.float64(1.1148035861315475), 'Min': np.float64(0.0), 'Mean': np.float64(0.11884849496542055), 'Std': np.float64(0.06002551733664044)}
[I 2024-12-07 01:05:11,978] Trial 227 finished with value: 1.0666666666666667 and parameters: {'x_0_0': 'ad', 'x_0_1': 'oo', 'x_0_2': 'cd', 'x_1_0': 'oo', 'x_1_1': 'bd', 'x_1_2': 'bc'}. Best is trial 74 with value: 0.8222222222222222.
[I 2024-12-07 01:05:12,006] Trial 228 finished with value: 1.4666666666666666 and parameters: {'x_0_0': 'ac', 'x_0_1': 'bc', 'x_0_2': 'cd', 'x_1_0': 'oo', 'x_1_1': 'cd', 'x_1_2': 'ad'}. Best is trial 148 with value: 0.8333333333333333.
2024-12-07 01:05:18,064 - INFO - Candidate Mean Stats: {'Max': np.float64(2.0), 'Min': np.float64(0.1488472235067564), 'Mean': np.float64(0.48425246000610916), 'Std': np.float64(0.07620265333780664)}
2024-12-07 01:05:18,065 - INFO - Candidate Std Stats: {'Max': np.float64(0.5419779434268782), 'Min': np.float64(0.0), 'Mean': np.float64(0.11196246468630684), 'Std': np.float64(0.050068409325085064)}
[I 2024-12-07 01:05:18,109] Trial 228 finished with value: 1.4666666666666666 and parameters: {'x_0_0': 'bd', 'x_0_1': 'bc', 'x_0_2': 'cd', 'x_1_0': 'oo', 'x_1_1': 'ac', 'x_1_2': 'ad'}. Best is trial 49 with value: 0.7999999999999999.
2024-12-07 01:05:27,231 - INFO - Candidate Mean Stats: {'Max': np.float64(2.0), 'Min': np.float64(0.13293742111423854), 'Mean': np.float64(0.48310109716896926), 'Std': np.float64(0.07959424059901954)}
2024-12-07 01:05:27,232 - INFO - Candidate Std Stats: {'Max': np.float64(0.9403067797607556), 'Min': np.float64(0.0), 'Mean': np.float64(0.11074982538625934), 'Std': np.float64(0.05185876527694947)}
[I 2024-12-07 01:05:27,277] Trial 228 finished with value: 1.7777777777777777 and parameters: {'x_0_0': 'ab', 'x_0_1': 'bc', 'x_0_2': 'bc', 'x_1_0': 'cd', 'x_1_1': 'ad', 'x_1_2': 'cd'}. Best is trial 200 with value: 0.6.
2024-12-07 01:05:32,235 - INFO - Candidate Mean Stats: {'Max': np.float64(2.0), 'Min': np.float64(0.2826676088724689), 'Mean': np.float64(0.49321390613263566), 'Std': np.float64(0.06980440320943808)}
2024-12-07 01:05:32,235 - INFO - Candidate Std Stats: {'Max': np.float64(0.8394432275633792), 'Min': np.float64(0.0), 'Mean': np.float64(0.1021075588738906), 'Std': np.float64(0.0498042711206834)}
[I 2024-12-07 01:05:32,280] Trial 228 finished with value: 1.6666666666666665 and parameters: {'x_0_0': 'bd', 'x_0_1': 'bc', 'x_0_2': 'ac', 'x_1_0': 'ad', 'x_1_1': 'ab', 'x_1_2': 'ad'}. Best is trial 74 with value: 0.8222222222222222.
2024-12-07 01:05:32,621 - INFO - Candidate Mean Stats: {'Max': np.float64(2.0), 'Min': np.float64(0.21231807380681378), 'Mean': np.float64(0.4841921107104205), 'Std': np.float64(0.08161823238418578)}
2024-12-07 01:05:32,621 - INFO - Candidate Std Stats: {'Max': np.float64(1.4193629216559027), 'Min': np.float64(0.0), 'Mean': np.float64(0.11970489184427145), 'Std': np.float64(0.062282996941109586)}
[I 2024-12-07 01:05:32,663] Trial 229 finished with value: 2.0 and parameters: {'x_0_0': 'cd', 'x_0_1': 'ad', 'x_0_2': 'ab', 'x_1_0': 'ac', 'x_1_1': 'ab', 'x_1_2': 'bc'}. Best is trial 148 with value: 0.8333333333333333.
2024-12-07 01:05:38,624 - INFO - Candidate Mean Stats: {'Max': np.float64(2.0), 'Min': np.float64(0.30215200437186607), 'Mean': np.float64(0.5014760753953443), 'Std': np.float64(0.0691400966870986)}
2024-12-07 01:05:38,624 - INFO - Candidate Std Stats: {'Max': np.float64(0.5138653771165786), 'Min': np.float64(0.0), 'Mean': np.float64(0.0994134321303131), 'Std': np.float64(0.04176565924114421)}
[I 2024-12-07 01:05:38,667] Trial 229 finished with value: 1.2222222222222223 and parameters: {'x_0_0': 'bc', 'x_0_1': 'ad', 'x_0_2': 'ab', 'x_1_0': 'bc', 'x_1_1': 'bc', 'x_1_2': 'bc'}. Best is trial 49 with value: 0.7999999999999999.
2024-12-07 01:05:47,708 - INFO - Candidate Mean Stats: {'Max': np.float64(2.0), 'Min': np.float64(0.20829151379773844), 'Mean': np.float64(0.4853432321873646), 'Std': np.float64(0.07763523746467042)}
2024-12-07 01:05:47,709 - INFO - Candidate Std Stats: {'Max': np.float64(1.6563377680757965), 'Min': np.float64(0.0), 'Mean': np.float64(0.10398876387075484), 'Std': np.float64(0.05660585238743133)}
[I 2024-12-07 01:05:47,753] Trial 229 finished with value: 1.1111111111111112 and parameters: {'x_0_0': 'bc', 'x_0_1': 'ad', 'x_0_2': 'ac', 'x_1_0': 'ac', 'x_1_1': 'bc', 'x_1_2': 'ab'}. Best is trial 200 with value: 0.6.
2024-12-07 01:05:52,882 - INFO - Candidate Mean Stats: {'Max': np.float64(2.0), 'Min': np.float64(0.23243560019911075), 'Mean': np.float64(0.4878672128091674), 'Std': np.float64(0.07131557261473964)}
2024-12-07 01:05:52,882 - INFO - Candidate Std Stats: {'Max': np.float64(1.6543746190092645), 'Min': np.float64(0.0), 'Mean': np.float64(0.09807960357062988), 'Std': np.float64(0.04625754261415173)}
[I 2024-12-07 01:05:52,926] Trial 229 finished with value: 1.3 and parameters: {'x_0_0': 'oo', 'x_0_1': 'oo', 'x_0_2': 'bd', 'x_1_0': 'oo', 'x_1_1': 'ac', 'x_1_2': 'ad'}. Best is trial 74 with value: 0.8222222222222222.
2024-12-07 01:05:52,995 - INFO - Candidate Mean Stats: {'Max': np.float64(2.0), 'Min': np.float64(0.28643055078089696), 'Mean': np.float64(0.48783094508015906), 'Std': np.float64(0.06939439653271873)}
2024-12-07 01:05:52,995 - INFO - Candidate Std Stats: {'Max': np.float64(0.4459142527503466), 'Min': np.float64(0.0), 'Mean': np.float64(0.09879176992771728), 'Std': np.float64(0.03829270620967156)}
[I 2024-12-07 01:05:53,037] Trial 230 finished with value: 1.4555555555555555 and parameters: {'x_0_0': 'bd', 'x_0_1': 'ab', 'x_0_2': 'oo', 'x_1_0': 'ab', 'x_1_1': 'ab', 'x_1_2': 'ad'}. Best is trial 148 with value: 0.8333333333333333.
2024-12-07 01:05:58,912 - INFO - Candidate Mean Stats: {'Max': np.float64(2.0), 'Min': np.float64(0.22793080139141372), 'Mean': np.float64(0.4890300837390091), 'Std': np.float64(0.07275490559413048)}
2024-12-07 01:05:58,912 - INFO - Candidate Std Stats: {'Max': np.float64(0.4269064251854592), 'Min': np.float64(0.0), 'Mean': np.float64(0.10391083556736595), 'Std': np.float64(0.04342816865599484)}
[I 2024-12-07 01:05:58,955] Trial 230 finished with value: 1.4 and parameters: {'x_0_0': 'oo', 'x_0_1': 'oo', 'x_0_2': 'bc', 'x_1_0': 'cd', 'x_1_1': 'ab', 'x_1_2': 'oo'}. Best is trial 49 with value: 0.7999999999999999.
2024-12-07 01:06:08,351 - INFO - Candidate Mean Stats: {'Max': np.float64(2.0), 'Min': np.float64(0.22662743710771532), 'Mean': np.float64(0.4978809244919267), 'Std': np.float64(0.07326979295506264)}
2024-12-07 01:06:08,352 - INFO - Candidate Std Stats: {'Max': np.float64(0.4083814177962251), 'Min': np.float64(0.0), 'Mean': np.float64(0.10351189290097103), 'Std': np.float64(0.04682735706784558)}
[I 2024-12-07 01:06:08,395] Trial 230 finished with value: 1.4444444444444444 and parameters: {'x_0_0': 'ac', 'x_0_1': 'ac', 'x_0_2': 'bc', 'x_1_0': 'cd', 'x_1_1': 'ac', 'x_1_2': 'ab'}. Best is trial 200 with value: 0.6.
2024-12-07 01:06:13,474 - INFO - Candidate Mean Stats: {'Max': np.float64(2.0), 'Min': np.float64(0.24760706365027413), 'Mean': np.float64(0.48913715134834523), 'Std': np.float64(0.07197446928234695)}
2024-12-07 01:06:13,475 - INFO - Candidate Std Stats: {'Max': np.float64(0.4818634413378488), 'Min': np.float64(0.0), 'Mean': np.float64(0.10314338743921461), 'Std': np.float64(0.04480459366265987)}
[I 2024-12-07 01:06:13,518] Trial 230 finished with value: 0.9666666666666667 and parameters: {'x_0_0': 'bd', 'x_0_1': 'oo', 'x_0_2': 'ad', 'x_1_0': 'oo', 'x_1_1': 'oo', 'x_1_2': 'cd'}. Best is trial 74 with value: 0.8222222222222222.
2024-12-07 01:06:13,541 - INFO - Candidate Mean Stats: {'Max': np.float64(2.0), 'Min': np.float64(0.26850759085609893), 'Mean': np.float64(0.48892551739287343), 'Std': np.float64(0.07557836190694285)}
2024-12-07 01:06:13,541 - INFO - Candidate Std Stats: {'Max': np.float64(1.2993100118826988), 'Min': np.float64(0.0), 'Mean': np.float64(0.11592290880819699), 'Std': np.float64(0.05849265598251066)}
