[I 2024-12-06 23:39:21,608] Trial 0 finished with value: 1.7777777777777777 and parameters: {'x_0_0': 'ab', 'x_0_1': 'ab', 'x_0_2': 'ab', 'x_1_0': 'ab', 'x_1_1': 'ab', 'x_1_2': 'ab'}. Best is trial 0 with value: 1.7777777777777777.
[I 2024-12-06 23:39:21,610] Trial 0 finished with value: 1.2222222222222223 and parameters: {'x_0_0': 'ac', 'x_0_1': 'ac', 'x_0_2': 'ac', 'x_1_0': 'ac', 'x_1_1': 'ac', 'x_1_2': 'ac'}. Best is trial 0 with value: 1.2222222222222223.
2024-12-06 23:39:42,771 - INFO - Candidate Mean Stats: {'Max': np.float64(1.4444444444444444), 'Min': np.float64(0.2774939467374731), 'Mean': np.float64(0.4939422103750273), 'Std': np.float64(0.057339848438576854)}
2024-12-06 23:39:42,772 - INFO - Candidate Std Stats: {'Max': np.float64(1.1690546637908343), 'Min': np.float64(0.0), 'Mean': np.float64(0.10788728018630991), 'Std': np.float64(0.04796151947293529)}
[I 2024-12-06 23:39:42,841] Trial 1 finished with value: 1.9 and parameters: {'x_0_0': 'oo', 'x_0_1': 'ac', 'x_0_2': 'ac', 'x_1_0': 'cd', 'x_1_1': 'bd', 'x_1_2': 'bd'}. Best is trial 0 with value: 1.4444444444444444.
2024-12-06 23:39:43,200 - INFO - Candidate Mean Stats: {'Max': np.float64(1.7777777777777777), 'Min': np.float64(0.26088012023541374), 'Mean': np.float64(0.4868280933443508), 'Std': np.float64(0.060427976842940614)}
2024-12-06 23:39:43,201 - INFO - Candidate Std Stats: {'Max': np.float64(1.305220845299768), 'Min': np.float64(0.0), 'Mean': np.float64(0.105536972077787), 'Std': np.float64(0.055568415576151636)}
[I 2024-12-06 23:39:43,251] Trial 1 finished with value: 1.1333333333333333 and parameters: {'x_0_0': 'bd', 'x_0_1': 'bd', 'x_0_2': 'oo', 'x_1_0': 'bc', 'x_1_1': 'ab', 'x_1_2': 'oo'}. Best is trial 1 with value: 1.1333333333333333.
2024-12-06 23:39:43,391 - INFO - Candidate Mean Stats: {'Max': np.float64(1.2222222222222223), 'Min': np.float64(0.2563327506534127), 'Mean': np.float64(0.48488165591520277), 'Std': np.float64(0.05472085119454559)}
2024-12-06 23:39:43,392 - INFO - Candidate Std Stats: {'Max': np.float64(0.4018835966022944), 'Min': np.float64(0.0), 'Mean': np.float64(0.09619771019253608), 'Std': np.float64(0.041390338061887584)}
2024-12-06 23:39:43,417 - INFO - Candidate Mean Stats: {'Max': np.float64(1.7777777777777777), 'Min': np.float64(0.18844004748238435), 'Mean': np.float64(0.48100205829744513), 'Std': np.float64(0.06681974782711662)}
2024-12-06 23:39:43,417 - INFO - Candidate Std Stats: {'Max': np.float64(0.5795498929904493), 'Min': np.float64(0.0), 'Mean': np.float64(0.12246350870848953), 'Std': np.float64(0.0562445294297447)}
[I 2024-12-06 23:39:43,447] Trial 1 finished with value: 1.0666666666666667 and parameters: {'x_0_0': 'ac', 'x_0_1': 'oo', 'x_0_2': 'ad', 'x_1_0': 'oo', 'x_1_1': 'ac', 'x_1_2': 'bd'}. Best is trial 1 with value: 1.0666666666666667.
[I 2024-12-06 23:39:43,464] Trial 1 finished with value: 1.5666666666666664 and parameters: {'x_0_0': 'ac', 'x_0_1': 'bd', 'x_0_2': 'oo', 'x_1_0': 'bc', 'x_1_1': 'bc', 'x_1_2': 'ac'}. Best is trial 1 with value: 1.5666666666666664.
2024-12-06 23:40:03,396 - INFO - Candidate Mean Stats: {'Max': np.float64(1.9), 'Min': np.float64(0.2434179186893648), 'Mean': np.float64(0.494232615644497), 'Std': np.float64(0.05995239759478925)}
2024-12-06 23:40:03,397 - INFO - Candidate Std Stats: {'Max': np.float64(1.2344153625516323), 'Min': np.float64(0.0), 'Mean': np.float64(0.10864322185774776), 'Std': np.float64(0.05449266060271003)}
[I 2024-12-06 23:40:03,443] Trial 2 finished with value: 1.2222222222222223 and parameters: {'x_0_0': 'bc', 'x_0_1': 'ad', 'x_0_2': 'ad', 'x_1_0': 'ac', 'x_1_1': 'bd', 'x_1_2': 'ad'}. Best is trial 2 with value: 1.2222222222222223.
2024-12-06 23:40:03,845 - INFO - Candidate Mean Stats: {'Max': np.float64(1.7777777777777777), 'Min': np.float64(0.2880751091019316), 'Mean': np.float64(0.48006312117294586), 'Std': np.float64(0.05529331039290766)}
2024-12-06 23:40:03,846 - INFO - Candidate Std Stats: {'Max': np.float64(0.48062969571080133), 'Min': np.float64(0.0), 'Mean': np.float64(0.10322552947770323), 'Std': np.float64(0.04223137455604249)}
[I 2024-12-06 23:40:03,891] Trial 2 finished with value: 1.9 and parameters: {'x_0_0': 'oo', 'x_0_1': 'cd', 'x_0_2': 'ad', 'x_1_0': 'ac', 'x_1_1': 'ad', 'x_1_2': 'bc'}. Best is trial 1 with value: 1.1333333333333333.
2024-12-06 23:40:04,238 - INFO - Candidate Mean Stats: {'Max': np.float64(1.7777777777777777), 'Min': np.float64(0.2782564418664707), 'Mean': np.float64(0.49526108732459684), 'Std': np.float64(0.05778278801599642)}
2024-12-06 23:40:04,238 - INFO - Candidate Std Stats: {'Max': np.float64(0.3896483548392317), 'Min': np.float64(0.0), 'Mean': np.float64(0.1042855757638428), 'Std': np.float64(0.04380435333345109)}
2024-12-06 23:40:04,260 - INFO - Candidate Mean Stats: {'Max': np.float64(1.2222222222222223), 'Min': np.float64(0.28250807166306935), 'Mean': np.float64(0.4890614544146328), 'Std': np.float64(0.052374038254767566)}
2024-12-06 23:40:04,263 - INFO - Candidate Std Stats: {'Max': np.float64(0.4735203045901315), 'Min': np.float64(0.0), 'Mean': np.float64(0.1064402235216429), 'Std': np.float64(0.04545071043698675)}
[I 2024-12-06 23:40:04,285] Trial 2 finished with value: 1.4666666666666666 and parameters: {'x_0_0': 'bc', 'x_0_1': 'cd', 'x_0_2': 'ad', 'x_1_0': 'oo', 'x_1_1': 'ac', 'x_1_2': 'bd'}. Best is trial 2 with value: 1.4666666666666666.
[I 2024-12-06 23:40:04,310] Trial 2 finished with value: 0.9666666666666667 and parameters: {'x_0_0': 'ac', 'x_0_1': 'oo', 'x_0_2': 'bd', 'x_1_0': 'oo', 'x_1_1': 'oo', 'x_1_2': 'cd'}. Best is trial 2 with value: 0.9666666666666667.
2024-12-06 23:40:23,917 - INFO - Candidate Mean Stats: {'Max': np.float64(1.9), 'Min': np.float64(0.28307989053870675), 'Mean': np.float64(0.4861211464475341), 'Std': np.float64(0.05674321995851703)}
2024-12-06 23:40:23,918 - INFO - Candidate Std Stats: {'Max': np.float64(0.9995562909681508), 'Min': np.float64(0.0), 'Mean': np.float64(0.10615045914764716), 'Std': np.float64(0.0545315284174806)}
[I 2024-12-06 23:40:23,969] Trial 3 finished with value: 1.6666666666666665 and parameters: {'x_0_0': 'ad', 'x_0_1': 'ad', 'x_0_2': 'bc', 'x_1_0': 'ac', 'x_1_1': 'bd', 'x_1_2': 'ab'}. Best is trial 2 with value: 1.2222222222222223.
2024-12-06 23:40:24,508 - INFO - Candidate Mean Stats: {'Max': np.float64(1.9), 'Min': np.float64(0.19914589457832996), 'Mean': np.float64(0.47494162555690744), 'Std': np.float64(0.07560816025158872)}
2024-12-06 23:40:24,510 - INFO - Candidate Std Stats: {'Max': np.float64(1.614391668455208), 'Min': np.float64(0.0), 'Mean': np.float64(0.13062631269769978), 'Std': np.float64(0.07194194555453581)}
[I 2024-12-06 23:40:24,563] Trial 3 finished with value: 1.5666666666666667 and parameters: {'x_0_0': 'ad', 'x_0_1': 'ab', 'x_0_2': 'ab', 'x_1_0': 'ad', 'x_1_1': 'oo', 'x_1_2': 'cd'}. Best is trial 1 with value: 1.1333333333333333.
2024-12-06 23:40:25,081 - INFO - Candidate Mean Stats: {'Max': np.float64(1.2222222222222223), 'Min': np.float64(0.3041840158573309), 'Mean': np.float64(0.48353270510025054), 'Std': np.float64(0.05232396629711643)}
2024-12-06 23:40:25,082 - INFO - Candidate Std Stats: {'Max': np.float64(0.426983635282935), 'Min': np.float64(0.0), 'Mean': np.float64(0.09861270876405778), 'Std': np.float64(0.04062168035252547)}
2024-12-06 23:40:25,099 - INFO - Candidate Mean Stats: {'Max': np.float64(1.7777777777777777), 'Min': np.float64(0.28003247092717326), 'Mean': np.float64(0.487144814118271), 'Std': np.float64(0.05787472588696601)}
2024-12-06 23:40:25,100 - INFO - Candidate Std Stats: {'Max': np.float64(0.8238274004075345), 'Min': np.float64(0.0), 'Mean': np.float64(0.10732833143746767), 'Std': np.float64(0.04616399081747459)}
[I 2024-12-06 23:40:25,131] Trial 3 finished with value: 1.4444444444444444 and parameters: {'x_0_0': 'ad', 'x_0_1': 'bd', 'x_0_2': 'ac', 'x_1_0': 'bd', 'x_1_1': 'cd', 'x_1_2': 'bd'}. Best is trial 2 with value: 0.9666666666666667.
[I 2024-12-06 23:40:25,148] Trial 3 finished with value: 1.9 and parameters: {'x_0_0': 'oo', 'x_0_1': 'cd', 'x_0_2': 'cd', 'x_1_0': 'bd', 'x_1_1': 'bc', 'x_1_2': 'bc'}. Best is trial 2 with value: 1.4666666666666666.
2024-12-06 23:40:44,800 - INFO - Candidate Mean Stats: {'Max': np.float64(1.9), 'Min': np.float64(0.2585000391648889), 'Mean': np.float64(0.49547314048459173), 'Std': np.float64(0.05744246491063928)}
2024-12-06 23:40:44,801 - INFO - Candidate Std Stats: {'Max': np.float64(0.4149428240264733), 'Min': np.float64(0.0), 'Mean': np.float64(0.10637903926282652), 'Std': np.float64(0.042394937873201435)}
[I 2024-12-06 23:40:44,844] Trial 4 finished with value: 1.6666666666666665 and parameters: {'x_0_0': 'bd', 'x_0_1': 'bc', 'x_0_2': 'ab', 'x_1_0': 'ad', 'x_1_1': 'bd', 'x_1_2': 'bc'}. Best is trial 2 with value: 1.2222222222222223.
2024-12-06 23:40:45,368 - INFO - Candidate Mean Stats: {'Max': np.float64(1.9), 'Min': np.float64(0.2900126438495413), 'Mean': np.float64(0.5005540939578729), 'Std': np.float64(0.052719240709522976)}
2024-12-06 23:40:45,369 - INFO - Candidate Std Stats: {'Max': np.float64(0.3213273622136152), 'Min': np.float64(0.0), 'Mean': np.float64(0.09165540478188286), 'Std': np.float64(0.03753148165079225)}
[I 2024-12-06 23:40:45,412] Trial 4 finished with value: 1.3666666666666667 and parameters: {'x_0_0': 'ac', 'x_0_1': 'cd', 'x_0_2': 'bc', 'x_1_0': 'oo', 'x_1_1': 'bc', 'x_1_2': 'oo'}. Best is trial 1 with value: 1.1333333333333333.
2024-12-06 23:40:46,056 - INFO - Candidate Mean Stats: {'Max': np.float64(1.4444444444444444), 'Min': np.float64(0.24147507064644805), 'Mean': np.float64(0.48616130776960537), 'Std': np.float64(0.07393302960053189)}
2024-12-06 23:40:46,057 - INFO - Candidate Std Stats: {'Max': np.float64(1.25954263419068), 'Min': np.float64(0.0), 'Mean': np.float64(0.12431201701086966), 'Std': np.float64(0.06501365399254026)}
[I 2024-12-06 23:40:46,105] Trial 4 finished with value: 1.6666666666666665 and parameters: {'x_0_0': 'bd', 'x_0_1': 'ac', 'x_0_2': 'bd', 'x_1_0': 'cd', 'x_1_1': 'ab', 'x_1_2': 'cd'}. Best is trial 2 with value: 0.9666666666666667.
2024-12-06 23:40:46,147 - INFO - Candidate Mean Stats: {'Max': np.float64(1.9), 'Min': np.float64(0.264172948330134), 'Mean': np.float64(0.4913316725586226), 'Std': np.float64(0.06509447278242732)}
2024-12-06 23:40:46,147 - INFO - Candidate Std Stats: {'Max': np.float64(1.459534684602827), 'Min': np.float64(0.0), 'Mean': np.float64(0.10775928623082505), 'Std': np.float64(0.04867084805141569)}
[I 2024-12-06 23:40:46,195] Trial 4 finished with value: 1.7777777777777777 and parameters: {'x_0_0': 'ab', 'x_0_1': 'bc', 'x_0_2': 'ac', 'x_1_0': 'ac', 'x_1_1': 'ac', 'x_1_2': 'ac'}. Best is trial 2 with value: 1.4666666666666666.
2024-12-06 23:41:05,591 - INFO - Candidate Mean Stats: {'Max': np.float64(1.9), 'Min': np.float64(0.24794658540059134), 'Mean': np.float64(0.4830811974716794), 'Std': np.float64(0.05567080970139215)}
2024-12-06 23:41:05,593 - INFO - Candidate Std Stats: {'Max': np.float64(0.3828525113833369), 'Min': np.float64(0.0), 'Mean': np.float64(0.1036178056287429), 'Std': np.float64(0.04214829574573129)}
[I 2024-12-06 23:41:05,652] Trial 5 finished with value: 1.8 and parameters: {'x_0_0': 'oo', 'x_0_1': 'cd', 'x_0_2': 'oo', 'x_1_0': 'ad', 'x_1_1': 'cd', 'x_1_2': 'ab'}. Best is trial 2 with value: 1.2222222222222223.
2024-12-06 23:41:06,280 - INFO - Candidate Mean Stats: {'Max': np.float64(1.9), 'Min': np.float64(0.2515662843210479), 'Mean': np.float64(0.4779582529463813), 'Std': np.float64(0.06399689662996785)}
2024-12-06 23:41:06,281 - INFO - Candidate Std Stats: {'Max': np.float64(0.5920070758449415), 'Min': np.float64(0.0), 'Mean': np.float64(0.11234777292226862), 'Std': np.float64(0.04846837967577546)}
[I 2024-12-06 23:41:06,334] Trial 5 finished with value: 1.5777777777777777 and parameters: {'x_0_0': 'ab', 'x_0_1': 'ac', 'x_0_2': 'cd', 'x_1_0': 'oo', 'x_1_1': 'bd', 'x_1_2': 'ab'}. Best is trial 1 with value: 1.1333333333333333.
2024-12-06 23:41:06,992 - INFO - Candidate Mean Stats: {'Max': np.float64(1.6666666666666665), 'Min': np.float64(0.29131655574554766), 'Mean': np.float64(0.49625595191202937), 'Std': np.float64(0.05801906092931805)}
2024-12-06 23:41:06,993 - INFO - Candidate Std Stats: {'Max': np.float64(0.4963272211159871), 'Min': np.float64(0.0), 'Mean': np.float64(0.10905137699973634), 'Std': np.float64(0.04510127931704258)}
[I 2024-12-06 23:41:07,046] Trial 5 finished with value: 1.4555555555555557 and parameters: {'x_0_0': 'ac', 'x_0_1': 'ab', 'x_0_2': 'bd', 'x_1_0': 'cd', 'x_1_1': 'oo', 'x_1_2': 'bc'}. Best is trial 2 with value: 0.9666666666666667.
2024-12-06 23:41:07,075 - INFO - Candidate Mean Stats: {'Max': np.float64(1.9), 'Min': np.float64(0.3008422786232452), 'Mean': np.float64(0.49062952147341626), 'Std': np.float64(0.0603230769816703)}
2024-12-06 23:41:07,075 - INFO - Candidate Std Stats: {'Max': np.float64(1.679339651181659), 'Min': np.float64(0.0), 'Mean': np.float64(0.10653688990101702), 'Std': np.float64(0.05367862820544118)}
[I 2024-12-06 23:41:07,143] Trial 5 finished with value: 1.9 and parameters: {'x_0_0': 'oo', 'x_0_1': 'cd', 'x_0_2': 'cd', 'x_1_0': 'ac', 'x_1_1': 'cd', 'x_1_2': 'bd'}. Best is trial 2 with value: 1.4666666666666666.
2024-12-06 23:41:27,727 - INFO - Candidate Mean Stats: {'Max': np.float64(1.9), 'Min': np.float64(0.23622066988230403), 'Mean': np.float64(0.4844712956845165), 'Std': np.float64(0.0713868449958781)}
2024-12-06 23:41:27,728 - INFO - Candidate Std Stats: {'Max': np.float64(1.5140809567645883), 'Min': np.float64(0.0), 'Mean': np.float64(0.11607284225066414), 'Std': np.float64(0.05929692715523407)}
[I 2024-12-06 23:41:27,777] Trial 6 finished with value: 1.7777777777777777 and parameters: {'x_0_0': 'ab', 'x_0_1': 'ac', 'x_0_2': 'ac', 'x_1_0': 'ab', 'x_1_1': 'bd', 'x_1_2': 'ac'}. Best is trial 2 with value: 1.2222222222222223.
2024-12-06 23:41:28,556 - INFO - Candidate Mean Stats: {'Max': np.float64(1.9), 'Min': np.float64(0.1598362741926691), 'Mean': np.float64(0.4863248993133977), 'Std': np.float64(0.056417265279007665)}
2024-12-06 23:41:28,557 - INFO - Candidate Std Stats: {'Max': np.float64(0.5776406343279128), 'Min': np.float64(0.0), 'Mean': np.float64(0.10413139015884179), 'Std': np.float64(0.046162480459358925)}
[I 2024-12-06 23:41:28,627] Trial 6 finished with value: 1.6666666666666665 and parameters: {'x_0_0': 'bd', 'x_0_1': 'ac', 'x_0_2': 'cd', 'x_1_0': 'ac', 'x_1_1': 'bd', 'x_1_2': 'bd'}. Best is trial 1 with value: 1.1333333333333333.
2024-12-06 23:41:29,250 - INFO - Candidate Mean Stats: {'Max': np.float64(1.6666666666666665), 'Min': np.float64(0.21863400406157293), 'Mean': np.float64(0.4778276459609204), 'Std': np.float64(0.06332560195254454)}
2024-12-06 23:41:29,251 - INFO - Candidate Std Stats: {'Max': np.float64(1.28468138919062), 'Min': np.float64(0.0), 'Mean': np.float64(0.12138927604761074), 'Std': np.float64(0.05718684811945413)}
[I 2024-12-06 23:41:29,292] Trial 6 finished with value: 1.4555555555555557 and parameters: {'x_0_0': 'ad', 'x_0_1': 'ad', 'x_0_2': 'cd', 'x_1_0': 'ab', 'x_1_1': 'oo', 'x_1_2': 'cd'}. Best is trial 2 with value: 0.9666666666666667.
2024-12-06 23:41:29,426 - INFO - Candidate Mean Stats: {'Max': np.float64(1.9), 'Min': np.float64(0.23325681505828205), 'Mean': np.float64(0.49509475313426826), 'Std': np.float64(0.06470589463602175)}
2024-12-06 23:41:29,427 - INFO - Candidate Std Stats: {'Max': np.float64(1.8312702364620301), 'Min': np.float64(0.0), 'Mean': np.float64(0.11665637610814138), 'Std': np.float64(0.05901273540732362)}
[I 2024-12-06 23:41:29,473] Trial 6 finished with value: 1.4555555555555555 and parameters: {'x_0_0': 'ad', 'x_0_1': 'ad', 'x_0_2': 'oo', 'x_1_0': 'ab', 'x_1_1': 'cd', 'x_1_2': 'ac'}. Best is trial 6 with value: 1.4555555555555555.
2024-12-06 23:41:48,259 - INFO - Candidate Mean Stats: {'Max': np.float64(1.9), 'Min': np.float64(0.28499147670159297), 'Mean': np.float64(0.49302683751179527), 'Std': np.float64(0.05181972272032575)}
2024-12-06 23:41:48,259 - INFO - Candidate Std Stats: {'Max': np.float64(0.36491799498495875), 'Min': np.float64(0.0), 'Mean': np.float64(0.09975179764858304), 'Std': np.float64(0.04136336716826334)}
[I 2024-12-06 23:41:48,313] Trial 7 finished with value: 1.7777777777777777 and parameters: {'x_0_0': 'ab', 'x_0_1': 'ab', 'x_0_2': 'ac', 'x_1_0': 'ab', 'x_1_1': 'ab', 'x_1_2': 'cd'}. Best is trial 2 with value: 1.2222222222222223.
2024-12-06 23:41:49,523 - INFO - Candidate Mean Stats: {'Max': np.float64(1.9), 'Min': np.float64(0.29155744856151), 'Mean': np.float64(0.49749934863161516), 'Std': np.float64(0.057850924433929765)}
2024-12-06 23:41:49,524 - INFO - Candidate Std Stats: {'Max': np.float64(1.4560190082963351), 'Min': np.float64(0.0), 'Mean': np.float64(0.10093686572007578), 'Std': np.float64(0.0466696123059069)}
[I 2024-12-06 23:41:49,568] Trial 7 finished with value: 1.077777777777778 and parameters: {'x_0_0': 'ab', 'x_0_1': 'oo', 'x_0_2': 'bc', 'x_1_0': 'oo', 'x_1_1': 'bc', 'x_1_2': 'oo'}. Best is trial 7 with value: 1.077777777777778.
2024-12-06 23:41:50,023 - INFO - Candidate Mean Stats: {'Max': np.float64(1.6666666666666665), 'Min': np.float64(0.14336576918260352), 'Mean': np.float64(0.490825273926198), 'Std': np.float64(0.06012127125851296)}
2024-12-06 23:41:50,024 - INFO - Candidate Std Stats: {'Max': np.float64(0.7653572762532617), 'Min': np.float64(0.0), 'Mean': np.float64(0.11396321752310952), 'Std': np.float64(0.05267223780236813)}
2024-12-06 23:41:50,049 - INFO - Candidate Mean Stats: {'Max': np.float64(1.9), 'Min': np.float64(0.27220853536752687), 'Mean': np.float64(0.4890992522327018), 'Std': np.float64(0.06425068008799355)}
2024-12-06 23:41:50,050 - INFO - Candidate Std Stats: {'Max': np.float64(1.6781027887697813), 'Min': np.float64(0.0), 'Mean': np.float64(0.10883477473954702), 'Std': np.float64(0.05364450937445744)}
[I 2024-12-06 23:41:50,066] Trial 7 finished with value: 1.7 and parameters: {'x_0_0': 'oo', 'x_0_1': 'bd', 'x_0_2': 'cd', 'x_1_0': 'oo', 'x_1_1': 'bd', 'x_1_2': 'ac'}. Best is trial 2 with value: 0.9666666666666667.
[I 2024-12-06 23:41:50,091] Trial 7 finished with value: 1.5666666666666664 and parameters: {'x_0_0': 'bd', 'x_0_1': 'ab', 'x_0_2': 'oo', 'x_1_0': 'ac', 'x_1_1': 'bd', 'x_1_2': 'ac'}. Best is trial 6 with value: 1.4555555555555555.
2024-12-06 23:42:10,670 - INFO - Candidate Mean Stats: {'Max': np.float64(1.9), 'Min': np.float64(0.27199083253635525), 'Mean': np.float64(0.494506946901139), 'Std': np.float64(0.05982402499278105)}
2024-12-06 23:42:10,671 - INFO - Candidate Std Stats: {'Max': np.float64(1.3236270172024696), 'Min': np.float64(0.0), 'Mean': np.float64(0.10925866959092423), 'Std': np.float64(0.048921257122678925)}
[I 2024-12-06 23:42:10,727] Trial 8 finished with value: 1.9 and parameters: {'x_0_0': 'oo', 'x_0_1': 'bc', 'x_0_2': 'ad', 'x_1_0': 'ad', 'x_1_1': 'ad', 'x_1_2': 'ad'}. Best is trial 2 with value: 1.2222222222222223.
2024-12-06 23:42:12,119 - INFO - Candidate Mean Stats: {'Max': np.float64(1.9), 'Min': np.float64(0.22237350120915322), 'Mean': np.float64(0.47802588964087456), 'Std': np.float64(0.06522511990560703)}
2024-12-06 23:42:12,121 - INFO - Candidate Std Stats: {'Max': np.float64(1.4168915266508277), 'Min': np.float64(0.0), 'Mean': np.float64(0.11771547634515937), 'Std': np.float64(0.06152436489288201)}
[I 2024-12-06 23:42:12,179] Trial 8 finished with value: 1.7777777777777777 and parameters: {'x_0_0': 'ab', 'x_0_1': 'ac', 'x_0_2': 'ad', 'x_1_0': 'cd', 'x_1_1': 'ac', 'x_1_2': 'cd'}. Best is trial 7 with value: 1.077777777777778.
2024-12-06 23:42:12,667 - INFO - Candidate Mean Stats: {'Max': np.float64(1.7), 'Min': np.float64(0.29120344555600514), 'Mean': np.float64(0.4844726225895032), 'Std': np.float64(0.05626846292210963)}
2024-12-06 23:42:12,668 - INFO - Candidate Std Stats: {'Max': np.float64(1.6174299310584586), 'Min': np.float64(0.0), 'Mean': np.float64(0.09614113975303253), 'Std': np.float64(0.048287066500968846)}
[I 2024-12-06 23:42:12,743] Trial 8 finished with value: 1.6666666666666665 and parameters: {'x_0_0': 'bd', 'x_0_1': 'bd', 'x_0_2': 'bc', 'x_1_0': 'cd', 'x_1_1': 'bd', 'x_1_2': 'bc'}. Best is trial 2 with value: 0.9666666666666667.
2024-12-06 23:42:12,938 - INFO - Candidate Mean Stats: {'Max': np.float64(1.9), 'Min': np.float64(0.11605631757472383), 'Mean': np.float64(0.48182035198251955), 'Std': np.float64(0.06122956897792138)}
2024-12-06 23:42:12,939 - INFO - Candidate Std Stats: {'Max': np.float64(0.6592350565447977), 'Min': np.float64(0.0), 'Mean': np.float64(0.10720159196905966), 'Std': np.float64(0.05432351768292643)}
[I 2024-12-06 23:42:12,992] Trial 8 finished with value: 1.2444444444444445 and parameters: {'x_0_0': 'bd', 'x_0_1': 'bd', 'x_0_2': 'oo', 'x_1_0': 'bd', 'x_1_1': 'oo', 'x_1_2': 'bc'}. Best is trial 8 with value: 1.2444444444444445.
2024-12-06 23:42:33,684 - INFO - Candidate Mean Stats: {'Max': np.float64(1.9), 'Min': np.float64(0.3019225478635056), 'Mean': np.float64(0.49396740106341164), 'Std': np.float64(0.052624714733505176)}
2024-12-06 23:42:33,685 - INFO - Candidate Std Stats: {'Max': np.float64(0.5015263815435517), 'Min': np.float64(0.0), 'Mean': np.float64(0.09085229170254978), 'Std': np.float64(0.03745687742081299)}
[I 2024-12-06 23:42:33,729] Trial 9 finished with value: 1.7999999999999998 and parameters: {'x_0_0': 'oo', 'x_0_1': 'ac', 'x_0_2': 'cd', 'x_1_0': 'ac', 'x_1_1': 'oo', 'x_1_2': 'bc'}. Best is trial 2 with value: 1.2222222222222223.
2024-12-06 23:42:35,132 - INFO - Candidate Mean Stats: {'Max': np.float64(1.9), 'Min': np.float64(0.25047432570637995), 'Mean': np.float64(0.48340399566824094), 'Std': np.float64(0.055538503111789796)}
2024-12-06 23:42:35,133 - INFO - Candidate Std Stats: {'Max': np.float64(1.079157134740239), 'Min': np.float64(0.0), 'Mean': np.float64(0.10082562457715982), 'Std': np.float64(0.04349822191005556)}
