[I 2024-12-06 23:36:11,803] Trial 25 finished with value: 1.0714285714285714 and parameters: {'x_0_0': 'ad', 'x_0_1': 'oo', 'x_1_0': 'cd', 'x_1_1': 'cd'}. Best is trial 15 with value: 0.7857142857142857.
2024-12-06 23:36:11,892 - INFO - Candidate Mean Stats: {'Max': np.float64(1.875), 'Min': np.float64(-0.8450447525987925), 'Mean': np.float64(0.12403218537212765), 'Std': np.float64(0.36796816976222035)}
2024-12-06 23:36:11,892 - INFO - Candidate Std Stats: {'Max': np.float64(1.7117442527690911), 'Min': np.float64(0.0), 'Mean': np.float64(0.6742578884905406), 'Std': np.float64(0.2674373891210174)}
[I 2024-12-06 23:36:11,904] Trial 25 finished with value: 2.0 and parameters: {'x_0_0': 'cd', 'x_0_1': 'cd', 'x_1_0': 'cd', 'x_1_1': 'ad'}. Best is trial 23 with value: 0.5.
2024-12-06 23:36:12,051 - INFO - Candidate Mean Stats: {'Max': np.float64(2.0), 'Min': np.float64(-0.9694347855793108), 'Mean': np.float64(0.20620266333533271), 'Std': np.float64(0.4079038040033162)}
2024-12-06 23:36:12,052 - INFO - Candidate Std Stats: {'Max': np.float64(1.4846084061559306), 'Min': np.float64(0.0), 'Mean': np.float64(0.65122054074999), 'Std': np.float64(0.2477000766718751)}
[I 2024-12-06 23:36:12,063] Trial 26 finished with value: 1.7142857142857144 and parameters: {'x_0_0': 'ab', 'x_0_1': 'ab', 'x_1_0': 'ab', 'x_1_1': 'ad'}. Best is trial 14 with value: 0.6428571428571428.
2024-12-06 23:36:12,100 - INFO - Candidate Mean Stats: {'Max': np.float64(2.0), 'Min': np.float64(-1.2708469763093677), 'Mean': np.float64(0.14514709025351125), 'Std': np.float64(0.4310087144350848)}
2024-12-06 23:36:12,100 - INFO - Candidate Std Stats: {'Max': np.float64(1.834962508491106), 'Min': np.float64(0.0), 'Mean': np.float64(0.6348007579343682), 'Std': np.float64(0.2589187500530524)}
[I 2024-12-06 23:36:12,112] Trial 26 finished with value: 1.2857142857142856 and parameters: {'x_0_0': 'ad', 'x_0_1': 'ac', 'x_1_0': 'bd', 'x_1_1': 'ad'}. Best is trial 11 with value: 0.7857142857142857.
2024-12-06 23:36:12,116 - INFO - Candidate Mean Stats: {'Max': np.float64(2.0), 'Min': np.float64(-0.7737605146747042), 'Mean': np.float64(0.22172662081683286), 'Std': np.float64(0.3736344087991318)}
2024-12-06 23:36:12,116 - INFO - Candidate Std Stats: {'Max': np.float64(1.5431557745566837), 'Min': np.float64(0.0), 'Mean': np.float64(0.5808795187823508), 'Std': np.float64(0.23799772598581975)}
[I 2024-12-06 23:36:12,127] Trial 26 finished with value: 1.0714285714285714 and parameters: {'x_0_0': 'ad', 'x_0_1': 'oo', 'x_1_0': 'cd', 'x_1_1': 'bc'}. Best is trial 15 with value: 0.7857142857142857.
2024-12-06 23:36:12,215 - INFO - Candidate Mean Stats: {'Max': np.float64(2.0), 'Min': np.float64(-0.9916178387204344), 'Mean': np.float64(0.21928072449700584), 'Std': np.float64(0.34145056319704375)}
2024-12-06 23:36:12,215 - INFO - Candidate Std Stats: {'Max': np.float64(1.6298453769921137), 'Min': np.float64(0.0), 'Mean': np.float64(0.5856458956673989), 'Std': np.float64(0.24069639538736926)}
[I 2024-12-06 23:36:12,227] Trial 26 finished with value: 0.8214285714285714 and parameters: {'x_0_0': 'bd', 'x_0_1': 'oo', 'x_1_0': 'oo', 'x_1_1': 'ac'}. Best is trial 23 with value: 0.5.
2024-12-06 23:36:12,376 - INFO - Candidate Mean Stats: {'Max': np.float64(2.0), 'Min': np.float64(-1.1476578618190256), 'Mean': np.float64(0.15622765233951047), 'Std': np.float64(0.41369991226863306)}
2024-12-06 23:36:12,376 - INFO - Candidate Std Stats: {'Max': np.float64(1.740001999371294), 'Min': np.float64(0.0), 'Mean': np.float64(0.6674693967706841), 'Std': np.float64(0.26680097171455186)}
[I 2024-12-06 23:36:12,388] Trial 27 finished with value: 0.8214285714285714 and parameters: {'x_0_0': 'bd', 'x_0_1': 'oo', 'x_1_0': 'oo', 'x_1_1': 'cd'}. Best is trial 14 with value: 0.6428571428571428.
2024-12-06 23:36:12,424 - INFO - Candidate Mean Stats: {'Max': np.float64(2.0), 'Min': np.float64(-0.8339601235670827), 'Mean': np.float64(0.31169475072053515), 'Std': np.float64(0.3817985601774298)}
2024-12-06 23:36:12,424 - INFO - Candidate Std Stats: {'Max': np.float64(1.747018209886521), 'Min': np.float64(0.0), 'Mean': np.float64(0.6038329547542932), 'Std': np.float64(0.2564897551565626)}
[I 2024-12-06 23:36:12,436] Trial 27 finished with value: 0.9464285714285714 and parameters: {'x_0_0': 'bc', 'x_0_1': 'oo', 'x_1_0': 'ad', 'x_1_1': 'oo'}. Best is trial 11 with value: 0.7857142857142857.
2024-12-06 23:36:12,440 - INFO - Candidate Mean Stats: {'Max': np.float64(2.0), 'Min': np.float64(-1.4206433067350996), 'Mean': np.float64(0.06947786605736517), 'Std': np.float64(0.4594144440643658)}
2024-12-06 23:36:12,440 - INFO - Candidate Std Stats: {'Max': np.float64(2.358026502067139), 'Min': np.float64(0.0), 'Mean': np.float64(0.7132788071888703), 'Std': np.float64(0.330398199010497)}
[I 2024-12-06 23:36:12,452] Trial 27 finished with value: 1.0714285714285714 and parameters: {'x_0_0': 'bc', 'x_0_1': 'oo', 'x_1_0': 'ad', 'x_1_1': 'ad'}. Best is trial 15 with value: 0.7857142857142857.
2024-12-06 23:36:12,545 - INFO - Candidate Mean Stats: {'Max': np.float64(2.0), 'Min': np.float64(-0.8619606038895204), 'Mean': np.float64(0.19838664287006127), 'Std': np.float64(0.41111906844093815)}
2024-12-06 23:36:12,545 - INFO - Candidate Std Stats: {'Max': np.float64(1.4654795990970098), 'Min': np.float64(0.0), 'Mean': np.float64(0.6186113332855661), 'Std': np.float64(0.2598700097064009)}
[I 2024-12-06 23:36:12,558] Trial 27 finished with value: 1.2857142857142856 and parameters: {'x_0_0': 'bd', 'x_0_1': 'ad', 'x_1_0': 'bd', 'x_1_1': 'ac'}. Best is trial 23 with value: 0.5.
2024-12-06 23:36:12,728 - INFO - Candidate Mean Stats: {'Max': np.float64(2.0), 'Min': np.float64(-0.9300259483946134), 'Mean': np.float64(0.23134247553931991), 'Std': np.float64(0.38654585876512393)}
2024-12-06 23:36:12,728 - INFO - Candidate Std Stats: {'Max': np.float64(1.5893870640209322), 'Min': np.float64(0.0), 'Mean': np.float64(0.5737052684721486), 'Std': np.float64(0.23655264467410814)}
[I 2024-12-06 23:36:12,746] Trial 28 finished with value: 1.4285714285714286 and parameters: {'x_0_0': 'ad', 'x_0_1': 'bd', 'x_1_0': 'ab', 'x_1_1': 'ac'}. Best is trial 14 with value: 0.6428571428571428.
2024-12-06 23:36:12,797 - INFO - Candidate Mean Stats: {'Max': np.float64(2.0), 'Min': np.float64(-0.6407880001183146), 'Mean': np.float64(0.2721182094273505), 'Std': np.float64(0.37104926765015517)}
2024-12-06 23:36:12,797 - INFO - Candidate Std Stats: {'Max': np.float64(1.50612522900768), 'Min': np.float64(0.0), 'Mean': np.float64(0.6089945392695599), 'Std': np.float64(0.24656888173244856)}
2024-12-06 23:36:12,804 - INFO - Candidate Mean Stats: {'Max': np.float64(2.0), 'Min': np.float64(-1.0457162195772554), 'Mean': np.float64(0.20828372867591247), 'Std': np.float64(0.4263566465273081)}
2024-12-06 23:36:12,805 - INFO - Candidate Std Stats: {'Max': np.float64(1.6218697349103888), 'Min': np.float64(0.0), 'Mean': np.float64(0.5910416952064613), 'Std': np.float64(0.2534607508023026)}
[I 2024-12-06 23:36:12,810] Trial 28 finished with value: 0.9107142857142857 and parameters: {'x_0_0': 'bc', 'x_0_1': 'ac', 'x_1_0': 'oo', 'x_1_1': 'oo'}. Best is trial 11 with value: 0.7857142857142857.
[I 2024-12-06 23:36:12,816] Trial 28 finished with value: 1.5714285714285714 and parameters: {'x_0_0': 'ad', 'x_0_1': 'ab', 'x_1_0': 'cd', 'x_1_1': 'ad'}. Best is trial 15 with value: 0.7857142857142857.
2024-12-06 23:36:12,910 - INFO - Candidate Mean Stats: {'Max': np.float64(2.0), 'Min': np.float64(-0.9610206843566639), 'Mean': np.float64(0.19487770482624556), 'Std': np.float64(0.38894251393038326)}
2024-12-06 23:36:12,910 - INFO - Candidate Std Stats: {'Max': np.float64(1.883231174440333), 'Min': np.float64(0.0), 'Mean': np.float64(0.6628678908398872), 'Std': np.float64(0.2541539979644774)}
[I 2024-12-06 23:36:12,923] Trial 28 finished with value: 1.0714285714285714 and parameters: {'x_0_0': 'bd', 'x_0_1': 'oo', 'x_1_0': 'ac', 'x_1_1': 'ab'}. Best is trial 23 with value: 0.5.
2024-12-06 23:36:13,064 - INFO - Candidate Mean Stats: {'Max': np.float64(2.0), 'Min': np.float64(-0.6888000415755748), 'Mean': np.float64(0.2117281612464611), 'Std': np.float64(0.335400438365151)}
2024-12-06 23:36:13,064 - INFO - Candidate Std Stats: {'Max': np.float64(1.3450822155030278), 'Min': np.float64(0.0), 'Mean': np.float64(0.5746704559947966), 'Std': np.float64(0.2289416523962134)}
[I 2024-12-06 23:36:13,076] Trial 29 finished with value: 1.1964285714285714 and parameters: {'x_0_0': 'bd', 'x_0_1': 'ac', 'x_1_0': 'oo', 'x_1_1': 'oo'}. Best is trial 14 with value: 0.6428571428571428.
2024-12-06 23:36:13,121 - INFO - Candidate Mean Stats: {'Max': np.float64(2.0), 'Min': np.float64(-0.8915284342281125), 'Mean': np.float64(0.16511560214307505), 'Std': np.float64(0.3847476329183111)}
2024-12-06 23:36:13,121 - INFO - Candidate Std Stats: {'Max': np.float64(1.8506644262581717), 'Min': np.float64(0.0), 'Mean': np.float64(0.6472650530561114), 'Std': np.float64(0.28108717249155724)}
2024-12-06 23:36:13,129 - INFO - Candidate Mean Stats: {'Max': np.float64(2.0), 'Min': np.float64(-0.8490908151270082), 'Mean': np.float64(0.21917273195112882), 'Std': np.float64(0.359140188657022)}
2024-12-06 23:36:13,129 - INFO - Candidate Std Stats: {'Max': np.float64(1.920468726387768), 'Min': np.float64(0.0), 'Mean': np.float64(0.5937789856888278), 'Std': np.float64(0.24588818567831322)}
[I 2024-12-06 23:36:13,135] Trial 29 finished with value: 1.0714285714285714 and parameters: {'x_0_0': 'ad', 'x_0_1': 'oo', 'x_1_0': 'ac', 'x_1_1': 'ac'}. Best is trial 11 with value: 0.7857142857142857.
[I 2024-12-06 23:36:13,141] Trial 29 finished with value: 0.8928571428571428 and parameters: {'x_0_0': 'ac', 'x_0_1': 'ad', 'x_1_0': 'oo', 'x_1_1': 'ab'}. Best is trial 15 with value: 0.7857142857142857.
2024-12-06 23:36:13,240 - INFO - Candidate Mean Stats: {'Max': np.float64(2.0), 'Min': np.float64(-1.1273450864789276), 'Mean': np.float64(0.1756426792454087), 'Std': np.float64(0.42880436906026975)}
2024-12-06 23:36:13,240 - INFO - Candidate Std Stats: {'Max': np.float64(1.646931610225988), 'Min': np.float64(0.0), 'Mean': np.float64(0.6360602506857426), 'Std': np.float64(0.2717552410338584)}
[I 2024-12-06 23:36:13,252] Trial 29 finished with value: 1.375 and parameters: {'x_0_0': 'oo', 'x_0_1': 'oo', 'x_1_0': 'ab', 'x_1_1': 'ac'}. Best is trial 23 with value: 0.5.
2024-12-06 23:36:13,390 - INFO - Candidate Mean Stats: {'Max': np.float64(2.0), 'Min': np.float64(-0.9372108899528169), 'Mean': np.float64(0.26861440907062567), 'Std': np.float64(0.34716486438568306)}
2024-12-06 23:36:13,390 - INFO - Candidate Std Stats: {'Max': np.float64(1.6518249360143153), 'Min': np.float64(0.0), 'Mean': np.float64(0.6275670980339911), 'Std': np.float64(0.2580861916567033)}
[I 2024-12-06 23:36:13,403] Trial 30 finished with value: 1.5714285714285714 and parameters: {'x_0_0': 'ac', 'x_0_1': 'bd', 'x_1_0': 'ab', 'x_1_1': 'ac'}. Best is trial 14 with value: 0.6428571428571428.
2024-12-06 23:36:13,447 - INFO - Candidate Mean Stats: {'Max': np.float64(2.0), 'Min': np.float64(-0.9937356005910907), 'Mean': np.float64(0.21546753186057424), 'Std': np.float64(0.42916814969787853)}
2024-12-06 23:36:13,447 - INFO - Candidate Std Stats: {'Max': np.float64(1.8279207914807423), 'Min': np.float64(0.0), 'Mean': np.float64(0.6412237691295365), 'Std': np.float64(0.26591665272054277)}
2024-12-06 23:36:13,454 - INFO - Candidate Mean Stats: {'Max': np.float64(2.0), 'Min': np.float64(-0.9963013392953851), 'Mean': np.float64(0.19582917510556894), 'Std': np.float64(0.37398133698703817)}
2024-12-06 23:36:13,454 - INFO - Candidate Std Stats: {'Max': np.float64(1.6281710678376153), 'Min': np.float64(0.0), 'Mean': np.float64(0.6239223260167125), 'Std': np.float64(0.25947308725203855)}
[I 2024-12-06 23:36:13,460] Trial 30 finished with value: 1.2857142857142856 and parameters: {'x_0_0': 'bc', 'x_0_1': 'ad', 'x_1_0': 'bc', 'x_1_1': 'cd'}. Best is trial 11 with value: 0.7857142857142857.
[I 2024-12-06 23:36:13,466] Trial 30 finished with value: 1.875 and parameters: {'x_0_0': 'oo', 'x_0_1': 'bc', 'x_1_0': 'bd', 'x_1_1': 'ad'}. Best is trial 15 with value: 0.7857142857142857.
2024-12-06 23:36:13,570 - INFO - Candidate Mean Stats: {'Max': np.float64(2.0), 'Min': np.float64(-0.8923135009393164), 'Mean': np.float64(0.29171714875469235), 'Std': np.float64(0.3476905702847151)}
2024-12-06 23:36:13,570 - INFO - Candidate Std Stats: {'Max': np.float64(1.662173198952476), 'Min': np.float64(0.0), 'Mean': np.float64(0.602415541648978), 'Std': np.float64(0.2438264166919662)}
[I 2024-12-06 23:36:13,582] Trial 30 finished with value: 0.7857142857142857 and parameters: {'x_0_0': 'bd', 'x_0_1': 'oo', 'x_1_0': 'bd', 'x_1_1': 'ab'}. Best is trial 23 with value: 0.5.
2024-12-06 23:36:13,716 - INFO - Candidate Mean Stats: {'Max': np.float64(2.0), 'Min': np.float64(-0.8018773032742489), 'Mean': np.float64(0.26748412000793903), 'Std': np.float64(0.37592560581029055)}
2024-12-06 23:36:13,716 - INFO - Candidate Std Stats: {'Max': np.float64(1.629691143022732), 'Min': np.float64(0.0), 'Mean': np.float64(0.5884773774847106), 'Std': np.float64(0.2509636595090704)}
[I 2024-12-06 23:36:13,728] Trial 31 finished with value: 1.0714285714285714 and parameters: {'x_0_0': 'ac', 'x_0_1': 'oo', 'x_1_0': 'cd', 'x_1_1': 'bc'}. Best is trial 14 with value: 0.6428571428571428.
2024-12-06 23:36:13,772 - INFO - Candidate Mean Stats: {'Max': np.float64(2.0), 'Min': np.float64(-0.5073912864704537), 'Mean': np.float64(0.3067393693985641), 'Std': np.float64(0.33904545413238607)}
2024-12-06 23:36:13,772 - INFO - Candidate Std Stats: {'Max': np.float64(1.5776637745706903), 'Min': np.float64(0.0), 'Mean': np.float64(0.5602821853524482), 'Std': np.float64(0.2342623496400147)}
2024-12-06 23:36:13,780 - INFO - Candidate Mean Stats: {'Max': np.float64(2.0), 'Min': np.float64(-1.2628399235777819), 'Mean': np.float64(0.19049022849444172), 'Std': np.float64(0.38623055813955703)}
2024-12-06 23:36:13,780 - INFO - Candidate Std Stats: {'Max': np.float64(1.688210579040498), 'Min': np.float64(0.0), 'Mean': np.float64(0.7054031928302835), 'Std': np.float64(0.28034168498326845)}
[I 2024-12-06 23:36:13,785] Trial 31 finished with value: 0.6964285714285714 and parameters: {'x_0_0': 'bc', 'x_0_1': 'oo', 'x_1_0': 'oo', 'x_1_1': 'oo'}. Best is trial 31 with value: 0.6964285714285714.
[I 2024-12-06 23:36:13,792] Trial 31 finished with value: 1.1607142857142856 and parameters: {'x_0_0': 'ac', 'x_0_1': 'ac', 'x_1_0': 'cd', 'x_1_1': 'oo'}. Best is trial 15 with value: 0.7857142857142857.
2024-12-06 23:36:13,899 - INFO - Candidate Mean Stats: {'Max': np.float64(2.0), 'Min': np.float64(-0.8834443033076681), 'Mean': np.float64(0.20281595893982296), 'Std': np.float64(0.35962994646028623)}
2024-12-06 23:36:13,899 - INFO - Candidate Std Stats: {'Max': np.float64(1.6266724102679933), 'Min': np.float64(0.0), 'Mean': np.float64(0.5832070400001671), 'Std': np.float64(0.2434207213938208)}
[I 2024-12-06 23:36:13,914] Trial 31 finished with value: 0.7857142857142857 and parameters: {'x_0_0': 'bd', 'x_0_1': 'oo', 'x_1_0': 'bc', 'x_1_1': 'bd'}. Best is trial 23 with value: 0.5.
2024-12-06 23:36:14,049 - INFO - Candidate Mean Stats: {'Max': np.float64(2.0), 'Min': np.float64(-0.9429744468042841), 'Mean': np.float64(0.26379673927008207), 'Std': np.float64(0.39660127596015443)}
2024-12-06 23:36:14,049 - INFO - Candidate Std Stats: {'Max': np.float64(1.4427811407729343), 'Min': np.float64(0.0), 'Mean': np.float64(0.5996447031711776), 'Std': np.float64(0.2405188400492987)}
[I 2024-12-06 23:36:14,062] Trial 32 finished with value: 1.3214285714285714 and parameters: {'x_0_0': 'ad', 'x_0_1': 'bd', 'x_1_0': 'oo', 'x_1_1': 'ab'}. Best is trial 14 with value: 0.6428571428571428.
2024-12-06 23:36:14,107 - INFO - Candidate Mean Stats: {'Max': np.float64(2.0), 'Min': np.float64(-1.2585560148468815), 'Mean': np.float64(0.174672467254155), 'Std': np.float64(0.4266793266800273)}
2024-12-06 23:36:14,107 - INFO - Candidate Std Stats: {'Max': np.float64(1.7034469801659018), 'Min': np.float64(0.0), 'Mean': np.float64(0.6665427551451043), 'Std': np.float64(0.26413913902182096)}
2024-12-06 23:36:14,114 - INFO - Candidate Mean Stats: {'Max': np.float64(2.0), 'Min': np.float64(-0.9551328205701758), 'Mean': np.float64(0.2178399363235467), 'Std': np.float64(0.40918591782304503)}
2024-12-06 23:36:14,114 - INFO - Candidate Std Stats: {'Max': np.float64(1.5252282242199213), 'Min': np.float64(0.0), 'Mean': np.float64(0.5913474168937727), 'Std': np.float64(0.24113722648828392)}
[I 2024-12-06 23:36:14,119] Trial 32 finished with value: 0.8214285714285714 and parameters: {'x_0_0': 'bd', 'x_0_1': 'oo', 'x_1_0': 'oo', 'x_1_1': 'cd'}. Best is trial 31 with value: 0.6964285714285714.
[I 2024-12-06 23:36:14,126] Trial 32 finished with value: 1.5714285714285714 and parameters: {'x_0_0': 'bd', 'x_0_1': 'ac', 'x_1_0': 'ad', 'x_1_1': 'bc'}. Best is trial 15 with value: 0.7857142857142857.
2024-12-06 23:36:14,274 - INFO - Candidate Mean Stats: {'Max': np.float64(2.0), 'Min': np.float64(-0.9766984414457461), 'Mean': np.float64(0.16124028511644872), 'Std': np.float64(0.384847583214391)}
2024-12-06 23:36:14,274 - INFO - Candidate Std Stats: {'Max': np.float64(2.022148144211642), 'Min': np.float64(0.0), 'Mean': np.float64(0.7018976009929638), 'Std': np.float64(0.31492628697022607)}
[I 2024-12-06 23:36:14,288] Trial 32 finished with value: 1.0714285714285714 and parameters: {'x_0_0': 'ac', 'x_0_1': 'oo', 'x_1_0': 'bd', 'x_1_1': 'ab'}. Best is trial 23 with value: 0.5.
2024-12-06 23:36:14,425 - INFO - Candidate Mean Stats: {'Max': np.float64(2.0), 'Min': np.float64(-0.8890265709900248), 'Mean': np.float64(0.1481925227206332), 'Std': np.float64(0.41326195739174426)}
2024-12-06 23:36:14,425 - INFO - Candidate Std Stats: {'Max': np.float64(1.5327485578822062), 'Min': np.float64(0.0), 'Mean': np.float64(0.6086813306769702), 'Std': np.float64(0.24764790768434622)}
[I 2024-12-06 23:36:14,440] Trial 33 finished with value: 1.4285714285714286 and parameters: {'x_0_0': 'bc', 'x_0_1': 'ab', 'x_1_0': 'cd', 'x_1_1': 'bc'}. Best is trial 14 with value: 0.6428571428571428.
2024-12-06 23:36:14,495 - INFO - Candidate Mean Stats: {'Max': np.float64(2.0), 'Min': np.float64(-0.8674649778572293), 'Mean': np.float64(0.20478621029592706), 'Std': np.float64(0.42532376125374544)}
2024-12-06 23:36:14,495 - INFO - Candidate Std Stats: {'Max': np.float64(1.700921351918226), 'Min': np.float64(0.0), 'Mean': np.float64(0.6476927378778222), 'Std': np.float64(0.25065732857556916)}
2024-12-06 23:36:14,499 - INFO - Candidate Mean Stats: {'Max': np.float64(2.0), 'Min': np.float64(-0.8428048235854746), 'Mean': np.float64(0.2604332464249828), 'Std': np.float64(0.42300670918076294)}
2024-12-06 23:36:14,499 - INFO - Candidate Std Stats: {'Max': np.float64(1.7768524025845438), 'Min': np.float64(0.0), 'Mean': np.float64(0.585026587865939), 'Std': np.float64(0.2523172324553513)}
[I 2024-12-06 23:36:14,510] Trial 33 finished with value: 0.6964285714285714 and parameters: {'x_0_0': 'ad', 'x_0_1': 'oo', 'x_1_0': 'oo', 'x_1_1': 'oo'}. Best is trial 33 with value: 0.6964285714285714.
[I 2024-12-06 23:36:14,514] Trial 33 finished with value: 1.0714285714285714 and parameters: {'x_0_0': 'ac', 'x_0_1': 'oo', 'x_1_0': 'ad', 'x_1_1': 'ac'}. Best is trial 31 with value: 0.6964285714285714.
2024-12-06 23:36:14,651 - INFO - Candidate Mean Stats: {'Max': np.float64(2.0), 'Min': np.float64(-0.7540321901931817), 'Mean': np.float64(0.2099265088315979), 'Std': np.float64(0.38357390590836166)}
2024-12-06 23:36:14,651 - INFO - Candidate Std Stats: {'Max': np.float64(1.6366395812213888), 'Min': np.float64(0.0), 'Mean': np.float64(0.6027765821027011), 'Std': np.float64(0.25014415594020506)}
[I 2024-12-06 23:36:14,666] Trial 33 finished with value: 1.0714285714285714 and parameters: {'x_0_0': 'ac', 'x_0_1': 'oo', 'x_1_0': 'ac', 'x_1_1': 'ab'}. Best is trial 23 with value: 0.5.
2024-12-06 23:36:14,808 - INFO - Candidate Mean Stats: {'Max': np.float64(2.0), 'Min': np.float64(-1.0787432765794986), 'Mean': np.float64(0.18265114389587261), 'Std': np.float64(0.44569738588436847)}
2024-12-06 23:36:14,808 - INFO - Candidate Std Stats: {'Max': np.float64(1.8916613951466983), 'Min': np.float64(0.0), 'Mean': np.float64(0.6273647946886388), 'Std': np.float64(0.27328750058429735)}
[I 2024-12-06 23:36:14,822] Trial 34 finished with value: 1.3214285714285714 and parameters: {'x_0_0': 'ad', 'x_0_1': 'bd', 'x_1_0': 'oo', 'x_1_1': 'bd'}. Best is trial 14 with value: 0.6428571428571428.
2024-12-06 23:36:14,860 - INFO - Candidate Mean Stats: {'Max': np.float64(2.0), 'Min': np.float64(-1.018301323750443), 'Mean': np.float64(0.1807694797484554), 'Std': np.float64(0.4245383931299963)}
2024-12-06 23:36:14,860 - INFO - Candidate Std Stats: {'Max': np.float64(1.465976372637317), 'Min': np.float64(0.0), 'Mean': np.float64(0.6080849675744157), 'Std': np.float64(0.249182896123805)}
2024-12-06 23:36:14,872 - INFO - Candidate Mean Stats: {'Max': np.float64(2.0), 'Min': np.float64(-0.88528437018131), 'Mean': np.float64(0.2801509145650684), 'Std': np.float64(0.381204689707623)}
2024-12-06 23:36:14,872 - INFO - Candidate Std Stats: {'Max': np.float64(1.5467082725263268), 'Min': np.float64(0.0), 'Mean': np.float64(0.6800945938854517), 'Std': np.float64(0.27570392653140074)}
[I 2024-12-06 23:36:14,873] Trial 34 finished with value: 0.8214285714285714 and parameters: {'x_0_0': 'ad', 'x_0_1': 'oo', 'x_1_0': 'oo', 'x_1_1': 'cd'}. Best is trial 33 with value: 0.6964285714285714.
