[I 2024-12-07 00:34:32,657] Trial 137 finished with value: 1.2666666666666666 and parameters: {'x_0_0': 'bc', 'x_0_1': 'oo', 'x_0_2': 'ad', 'x_1_0': 'ac', 'x_1_1': 'cd', 'x_1_2': 'bd'}. Best is trial 118 with value: 0.8666666666666667.
2024-12-07 00:34:42,374 - INFO - Candidate Mean Stats: {'Max': np.float64(2.0), 'Min': np.float64(0.29654710545228113), 'Mean': np.float64(0.4996813956668753), 'Std': np.float64(0.06542954990922087)}
2024-12-07 00:34:42,375 - INFO - Candidate Std Stats: {'Max': np.float64(0.7647222797258458), 'Min': np.float64(0.0), 'Mean': np.float64(0.10593566403210973), 'Std': np.float64(0.04523406545300522)}
[I 2024-12-07 00:34:42,419] Trial 137 finished with value: 1.1666666666666665 and parameters: {'x_0_0': 'bc', 'x_0_1': 'oo', 'x_0_2': 'oo', 'x_1_0': 'bd', 'x_1_1': 'bd', 'x_1_2': 'ad'}. Best is trial 74 with value: 0.8222222222222222.
2024-12-07 00:34:47,878 - INFO - Candidate Mean Stats: {'Max': np.float64(2.0), 'Min': np.float64(0.1863669790842032), 'Mean': np.float64(0.47870563930080756), 'Std': np.float64(0.07771348864018701)}
2024-12-07 00:34:47,878 - INFO - Candidate Std Stats: {'Max': np.float64(1.2597790082689475), 'Min': np.float64(0.0), 'Mean': np.float64(0.12217206901330804), 'Std': np.float64(0.06248476728741357)}
[I 2024-12-07 00:34:47,920] Trial 138 finished with value: 1.9 and parameters: {'x_0_0': 'cd', 'x_0_1': 'ab', 'x_0_2': 'ab', 'x_1_0': 'bd', 'x_1_1': 'bd', 'x_1_2': 'oo'}. Best is trial 108 with value: 0.9666666666666667.
2024-12-07 00:34:49,505 - INFO - Candidate Mean Stats: {'Max': np.float64(2.0), 'Min': np.float64(0.23079604513259583), 'Mean': np.float64(0.489102996979167), 'Std': np.float64(0.06759501922552286)}
2024-12-07 00:34:49,505 - INFO - Candidate Std Stats: {'Max': np.float64(0.4116284338407387), 'Min': np.float64(0.0), 'Mean': np.float64(0.10212029739483137), 'Std': np.float64(0.045856414200233474)}
[I 2024-12-07 00:34:49,546] Trial 138 finished with value: 1.2666666666666666 and parameters: {'x_0_0': 'bc', 'x_0_1': 'oo', 'x_0_2': 'ac', 'x_1_0': 'cd', 'x_1_1': 'ad', 'x_1_2': 'ad'}. Best is trial 49 with value: 0.7999999999999999.
2024-12-07 00:34:52,405 - INFO - Candidate Mean Stats: {'Max': np.float64(2.0), 'Min': np.float64(0.2844884022306305), 'Mean': np.float64(0.4983140895644065), 'Std': np.float64(0.06040953795405926)}
2024-12-07 00:34:52,406 - INFO - Candidate Std Stats: {'Max': np.float64(1.3904495119081492), 'Min': np.float64(0.0), 'Mean': np.float64(0.09711657372587706), 'Std': np.float64(0.043888798715450886)}
[I 2024-12-07 00:34:52,447] Trial 138 finished with value: 1.6777777777777776 and parameters: {'x_0_0': 'ab', 'x_0_1': 'cd', 'x_0_2': 'oo', 'x_1_0': 'ac', 'x_1_1': 'cd', 'x_1_2': 'cd'}. Best is trial 118 with value: 0.8666666666666667.
2024-12-07 00:35:02,193 - INFO - Candidate Mean Stats: {'Max': np.float64(2.0), 'Min': np.float64(0.20012970203784342), 'Mean': np.float64(0.48651535248612415), 'Std': np.float64(0.07197194267280443)}
2024-12-07 00:35:02,193 - INFO - Candidate Std Stats: {'Max': np.float64(0.7006234691648899), 'Min': np.float64(0.0), 'Mean': np.float64(0.10699559939599557), 'Std': np.float64(0.04777101669390896)}
[I 2024-12-07 00:35:02,234] Trial 138 finished with value: 1.0666666666666667 and parameters: {'x_0_0': 'bd', 'x_0_1': 'oo', 'x_0_2': 'ac', 'x_1_0': 'oo', 'x_1_1': 'bd', 'x_1_2': 'bd'}. Best is trial 74 with value: 0.8222222222222222.
2024-12-07 00:35:07,881 - INFO - Candidate Mean Stats: {'Max': np.float64(2.0), 'Min': np.float64(0.2925704518392244), 'Mean': np.float64(0.49373423723536697), 'Std': np.float64(0.06853216725393423)}
2024-12-07 00:35:07,881 - INFO - Candidate Std Stats: {'Max': np.float64(1.3053497462778318), 'Min': np.float64(0.0), 'Mean': np.float64(0.10736390136062066), 'Std': np.float64(0.047135882973491965)}
[I 2024-12-07 00:35:07,924] Trial 139 finished with value: 1.7777777777777777 and parameters: {'x_0_0': 'ab', 'x_0_1': 'cd', 'x_0_2': 'bc', 'x_1_0': 'bc', 'x_1_1': 'ab', 'x_1_2': 'ac'}. Best is trial 108 with value: 0.9666666666666667.
2024-12-07 00:35:09,446 - INFO - Candidate Mean Stats: {'Max': np.float64(2.0), 'Min': np.float64(0.2507252798402784), 'Mean': np.float64(0.48772456613687687), 'Std': np.float64(0.06925317704894672)}
2024-12-07 00:35:09,446 - INFO - Candidate Std Stats: {'Max': np.float64(1.645645183672727), 'Min': np.float64(0.0), 'Mean': np.float64(0.10064527071327833), 'Std': np.float64(0.0501582413657327)}
[I 2024-12-07 00:35:09,488] Trial 139 finished with value: 1.6666666666666665 and parameters: {'x_0_0': 'ac', 'x_0_1': 'cd', 'x_0_2': 'bc', 'x_1_0': 'bd', 'x_1_1': 'ab', 'x_1_2': 'cd'}. Best is trial 49 with value: 0.7999999999999999.
2024-12-07 00:35:12,436 - INFO - Candidate Mean Stats: {'Max': np.float64(2.0), 'Min': np.float64(0.23974960523424663), 'Mean': np.float64(0.48699997997899025), 'Std': np.float64(0.08167638924938357)}
2024-12-07 00:35:12,437 - INFO - Candidate Std Stats: {'Max': np.float64(1.1760486597092523), 'Min': np.float64(0.0), 'Mean': np.float64(0.11799384249466235), 'Std': np.float64(0.05850652750835017)}
[I 2024-12-07 00:35:12,478] Trial 139 finished with value: 1.2666666666666666 and parameters: {'x_0_0': 'bc', 'x_0_1': 'oo', 'x_0_2': 'ab', 'x_1_0': 'ad', 'x_1_1': 'bd', 'x_1_2': 'cd'}. Best is trial 118 with value: 0.8666666666666667.
2024-12-07 00:35:22,063 - INFO - Candidate Mean Stats: {'Max': np.float64(2.0), 'Min': np.float64(0.2752838246812332), 'Mean': np.float64(0.49097853510797224), 'Std': np.float64(0.06635127421787021)}
2024-12-07 00:35:22,063 - INFO - Candidate Std Stats: {'Max': np.float64(1.0989350484019769), 'Min': np.float64(0.0), 'Mean': np.float64(0.10811505385407894), 'Std': np.float64(0.04771268582189856)}
[I 2024-12-07 00:35:22,107] Trial 139 finished with value: 1.4666666666666666 and parameters: {'x_0_0': 'bc', 'x_0_1': 'bc', 'x_0_2': 'bc', 'x_1_0': 'oo', 'x_1_1': 'ab', 'x_1_2': 'ac'}. Best is trial 74 with value: 0.8222222222222222.
2024-12-07 00:35:28,041 - INFO - Candidate Mean Stats: {'Max': np.float64(2.0), 'Min': np.float64(0.20742222657596754), 'Mean': np.float64(0.4849413897853702), 'Std': np.float64(0.08167698374739328)}
2024-12-07 00:35:28,042 - INFO - Candidate Std Stats: {'Max': np.float64(1.7976943996237122), 'Min': np.float64(0.0), 'Mean': np.float64(0.12842893886427437), 'Std': np.float64(0.06755485843097234)}
[I 2024-12-07 00:35:28,082] Trial 140 finished with value: 1.2666666666666666 and parameters: {'x_0_0': 'ad', 'x_0_1': 'oo', 'x_0_2': 'ab', 'x_1_0': 'cd', 'x_1_1': 'ad', 'x_1_2': 'ab'}. Best is trial 108 with value: 0.9666666666666667.
2024-12-07 00:35:29,426 - INFO - Candidate Mean Stats: {'Max': np.float64(2.0), 'Min': np.float64(0.19082533668743795), 'Mean': np.float64(0.49488803621615823), 'Std': np.float64(0.06807918400867304)}
2024-12-07 00:35:29,426 - INFO - Candidate Std Stats: {'Max': np.float64(0.40983112822595325), 'Min': np.float64(0.0), 'Mean': np.float64(0.09907025074277372), 'Std': np.float64(0.04252564063602682)}
[I 2024-12-07 00:35:29,469] Trial 140 finished with value: 1.6777777777777778 and parameters: {'x_0_0': 'ab', 'x_0_1': 'cd', 'x_0_2': 'ac', 'x_1_0': 'bd', 'x_1_1': 'ac', 'x_1_2': 'oo'}. Best is trial 49 with value: 0.7999999999999999.
2024-12-07 00:35:32,467 - INFO - Candidate Mean Stats: {'Max': np.float64(2.0), 'Min': np.float64(0.2713543168907364), 'Mean': np.float64(0.4878254868661883), 'Std': np.float64(0.06748933926180639)}
2024-12-07 00:35:32,467 - INFO - Candidate Std Stats: {'Max': np.float64(0.40271147106627003), 'Min': np.float64(0.0), 'Mean': np.float64(0.09949780879262299), 'Std': np.float64(0.039598507836213076)}
[I 2024-12-07 00:35:32,509] Trial 140 finished with value: 0.9333333333333333 and parameters: {'x_0_0': 'ad', 'x_0_1': 'oo', 'x_0_2': 'bc', 'x_1_0': 'bc', 'x_1_1': 'ab', 'x_1_2': 'bc'}. Best is trial 118 with value: 0.8666666666666667.
2024-12-07 00:35:42,097 - INFO - Candidate Mean Stats: {'Max': np.float64(2.0), 'Min': np.float64(0.22646977089331694), 'Mean': np.float64(0.48027073447496244), 'Std': np.float64(0.07019588865243533)}
2024-12-07 00:35:42,098 - INFO - Candidate Std Stats: {'Max': np.float64(0.6701204692255119), 'Min': np.float64(0.0), 'Mean': np.float64(0.11458144072370356), 'Std': np.float64(0.049430567806394286)}
[I 2024-12-07 00:35:42,139] Trial 140 finished with value: 1.6666666666666665 and parameters: {'x_0_0': 'ac', 'x_0_1': 'cd', 'x_0_2': 'ad', 'x_1_0': 'bd', 'x_1_1': 'ad', 'x_1_2': 'bc'}. Best is trial 74 with value: 0.8222222222222222.
2024-12-07 00:35:47,822 - INFO - Candidate Mean Stats: {'Max': np.float64(2.0), 'Min': np.float64(0.22413083604672765), 'Mean': np.float64(0.4925111462504162), 'Std': np.float64(0.06686993462095016)}
2024-12-07 00:35:47,822 - INFO - Candidate Std Stats: {'Max': np.float64(0.4603553827508835), 'Min': np.float64(0.0), 'Mean': np.float64(0.10135296990384125), 'Std': np.float64(0.04073374479460301)}
[I 2024-12-07 00:35:47,864] Trial 141 finished with value: 1.6666666666666665 and parameters: {'x_0_0': 'ac', 'x_0_1': 'bd', 'x_0_2': 'ad', 'x_1_0': 'ac', 'x_1_1': 'bd', 'x_1_2': 'cd'}. Best is trial 108 with value: 0.9666666666666667.
2024-12-07 00:35:49,095 - INFO - Candidate Mean Stats: {'Max': np.float64(2.0), 'Min': np.float64(0.25977745262892926), 'Mean': np.float64(0.4836215525918996), 'Std': np.float64(0.0641996237796324)}
2024-12-07 00:35:49,096 - INFO - Candidate Std Stats: {'Max': np.float64(1.2594035696428187), 'Min': np.float64(0.0), 'Mean': np.float64(0.09771443696219043), 'Std': np.float64(0.04252729260657895)}
[I 2024-12-07 00:35:49,136] Trial 141 finished with value: 1.2666666666666666 and parameters: {'x_0_0': 'bc', 'x_0_1': 'oo', 'x_0_2': 'bc', 'x_1_0': 'ab', 'x_1_1': 'cd', 'x_1_2': 'ad'}. Best is trial 49 with value: 0.7999999999999999.
2024-12-07 00:35:52,980 - INFO - Candidate Mean Stats: {'Max': np.float64(2.0), 'Min': np.float64(0.30098401853112866), 'Mean': np.float64(0.4960025997876789), 'Std': np.float64(0.062095761056747655)}
2024-12-07 00:35:52,980 - INFO - Candidate Std Stats: {'Max': np.float64(0.6382383346549315), 'Min': np.float64(0.0), 'Mean': np.float64(0.09951484771823887), 'Std': np.float64(0.0416875894059018)}
[I 2024-12-07 00:35:53,024] Trial 141 finished with value: 1.2777777777777777 and parameters: {'x_0_0': 'ab', 'x_0_1': 'oo', 'x_0_2': 'oo', 'x_1_0': 'bc', 'x_1_1': 'ac', 'x_1_2': 'ad'}. Best is trial 118 with value: 0.8666666666666667.
2024-12-07 00:36:01,967 - INFO - Candidate Mean Stats: {'Max': np.float64(2.0), 'Min': np.float64(0.29129484545352746), 'Mean': np.float64(0.4993412901276592), 'Std': np.float64(0.0639129346336208)}
2024-12-07 00:36:01,967 - INFO - Candidate Std Stats: {'Max': np.float64(0.4049857096398977), 'Min': np.float64(0.0), 'Mean': np.float64(0.10341624023544978), 'Std': np.float64(0.041753610198050406)}
[I 2024-12-07 00:36:02,009] Trial 141 finished with value: 1.7 and parameters: {'x_0_0': 'oo', 'x_0_1': 'ac', 'x_0_2': 'cd', 'x_1_0': 'oo', 'x_1_1': 'cd', 'x_1_2': 'bd'}. Best is trial 74 with value: 0.8222222222222222.
2024-12-07 00:36:07,595 - INFO - Candidate Mean Stats: {'Max': np.float64(2.0), 'Min': np.float64(0.30308074688633635), 'Mean': np.float64(0.4951998340444152), 'Std': np.float64(0.06817238887541073)}
2024-12-07 00:36:07,595 - INFO - Candidate Std Stats: {'Max': np.float64(1.4410101098592294), 'Min': np.float64(0.0), 'Mean': np.float64(0.10616064293821878), 'Std': np.float64(0.047361919793247755)}
[I 2024-12-07 00:36:07,636] Trial 142 finished with value: 1.2666666666666666 and parameters: {'x_0_0': 'ad', 'x_0_1': 'oo', 'x_0_2': 'bc', 'x_1_0': 'cd', 'x_1_1': 'bd', 'x_1_2': 'ab'}. Best is trial 108 with value: 0.9666666666666667.
2024-12-07 00:36:09,141 - INFO - Candidate Mean Stats: {'Max': np.float64(2.0), 'Min': np.float64(0.2637601272417537), 'Mean': np.float64(0.4899454442617071), 'Std': np.float64(0.07129449784524924)}
2024-12-07 00:36:09,141 - INFO - Candidate Std Stats: {'Max': np.float64(0.5750227044258187), 'Min': np.float64(0.0), 'Mean': np.float64(0.11629429555787249), 'Std': np.float64(0.050960321696599066)}
[I 2024-12-07 00:36:09,183] Trial 142 finished with value: 1.3444444444444446 and parameters: {'x_0_0': 'ad', 'x_0_1': 'cd', 'x_0_2': 'bd', 'x_1_0': 'bc', 'x_1_1': 'oo', 'x_1_2': 'ac'}. Best is trial 49 with value: 0.7999999999999999.
2024-12-07 00:36:12,954 - INFO - Candidate Mean Stats: {'Max': np.float64(2.0), 'Min': np.float64(0.20861001396164175), 'Mean': np.float64(0.4831770383135255), 'Std': np.float64(0.07032102450952071)}
2024-12-07 00:36:12,955 - INFO - Candidate Std Stats: {'Max': np.float64(0.5494726922594937), 'Min': np.float64(0.0), 'Mean': np.float64(0.10409337049356783), 'Std': np.float64(0.04650328722834866)}
[I 2024-12-07 00:36:12,995] Trial 142 finished with value: 1.6777777777777778 and parameters: {'x_0_0': 'ab', 'x_0_1': 'bd', 'x_0_2': 'bd', 'x_1_0': 'ab', 'x_1_1': 'ac', 'x_1_2': 'oo'}. Best is trial 118 with value: 0.8666666666666667.
2024-12-07 00:36:21,977 - INFO - Candidate Mean Stats: {'Max': np.float64(2.0), 'Min': np.float64(0.23612529705535482), 'Mean': np.float64(0.48800496630958684), 'Std': np.float64(0.07547541461658357)}
2024-12-07 00:36:21,978 - INFO - Candidate Std Stats: {'Max': np.float64(0.6016000033116237), 'Min': np.float64(0.0), 'Mean': np.float64(0.11058472076913464), 'Std': np.float64(0.048861504099227314)}
[I 2024-12-07 00:36:22,023] Trial 142 finished with value: 1.2555555555555555 and parameters: {'x_0_0': 'bc', 'x_0_1': 'ab', 'x_0_2': 'cd', 'x_1_0': 'oo', 'x_1_1': 'bc', 'x_1_2': 'oo'}. Best is trial 74 with value: 0.8222222222222222.
2024-12-07 00:36:27,634 - INFO - Candidate Mean Stats: {'Max': np.float64(2.0), 'Min': np.float64(0.253549531017666), 'Mean': np.float64(0.4961721462003326), 'Std': np.float64(0.0665687934968991)}
2024-12-07 00:36:27,635 - INFO - Candidate Std Stats: {'Max': np.float64(0.4190329439931864), 'Min': np.float64(0.0), 'Mean': np.float64(0.10442850059544594), 'Std': np.float64(0.04324481901717999)}
[I 2024-12-07 00:36:27,679] Trial 143 finished with value: 1.5666666666666664 and parameters: {'x_0_0': 'ad', 'x_0_1': 'ab', 'x_0_2': 'oo', 'x_1_0': 'ad', 'x_1_1': 'bc', 'x_1_2': 'cd'}. Best is trial 108 with value: 0.9666666666666667.
2024-12-07 00:36:29,293 - INFO - Candidate Mean Stats: {'Max': np.float64(2.0), 'Min': np.float64(0.2885106353183645), 'Mean': np.float64(0.485537050869926), 'Std': np.float64(0.06398677660144846)}
2024-12-07 00:36:29,293 - INFO - Candidate Std Stats: {'Max': np.float64(0.6831612072628035), 'Min': np.float64(0.0), 'Mean': np.float64(0.1105063112048894), 'Std': np.float64(0.04568474753108075)}
[I 2024-12-07 00:36:29,335] Trial 143 finished with value: 1.0333333333333332 and parameters: {'x_0_0': 'ac', 'x_0_1': 'ad', 'x_0_2': 'ad', 'x_1_0': 'oo', 'x_1_1': 'ab', 'x_1_2': 'oo'}. Best is trial 49 with value: 0.7999999999999999.
2024-12-07 00:36:33,041 - INFO - Candidate Mean Stats: {'Max': np.float64(2.0), 'Min': np.float64(0.26762544578358344), 'Mean': np.float64(0.4951327298961261), 'Std': np.float64(0.0674324417232196)}
2024-12-07 00:36:33,042 - INFO - Candidate Std Stats: {'Max': np.float64(0.42913948521790846), 'Min': np.float64(0.0), 'Mean': np.float64(0.10789359860550135), 'Std': np.float64(0.047020312032845915)}
[I 2024-12-07 00:36:33,085] Trial 143 finished with value: 1.4444444444444444 and parameters: {'x_0_0': 'ac', 'x_0_1': 'ad', 'x_0_2': 'ad', 'x_1_0': 'bc', 'x_1_1': 'ac', 'x_1_2': 'cd'}. Best is trial 118 with value: 0.8666666666666667.
2024-12-07 00:36:41,733 - INFO - Candidate Mean Stats: {'Max': np.float64(2.0), 'Min': np.float64(0.29174849029942634), 'Mean': np.float64(0.4953430227548239), 'Std': np.float64(0.06688537717795692)}
2024-12-07 00:36:41,733 - INFO - Candidate Std Stats: {'Max': np.float64(0.36874209713522993), 'Min': np.float64(0.0), 'Mean': np.float64(0.09783855800737591), 'Std': np.float64(0.03956038890584964)}
[I 2024-12-07 00:36:41,776] Trial 143 finished with value: 1.7777777777777777 and parameters: {'x_0_0': 'ab', 'x_0_1': 'bc', 'x_0_2': 'bd', 'x_1_0': 'ad', 'x_1_1': 'bd', 'x_1_2': 'ab'}. Best is trial 74 with value: 0.8222222222222222.
2024-12-07 00:36:47,919 - INFO - Candidate Mean Stats: {'Max': np.float64(2.0), 'Min': np.float64(0.20638537186409162), 'Mean': np.float64(0.48855078988188977), 'Std': np.float64(0.07603136452106236)}
2024-12-07 00:36:47,919 - INFO - Candidate Std Stats: {'Max': np.float64(1.3746977912942473), 'Min': np.float64(0.0), 'Mean': np.float64(0.10762067070418112), 'Std': np.float64(0.050478152299567175)}
[I 2024-12-07 00:36:47,961] Trial 144 finished with value: 1.5666666666666667 and parameters: {'x_0_0': 'bc', 'x_0_1': 'bd', 'x_0_2': 'ab', 'x_1_0': 'ab', 'x_1_1': 'bc', 'x_1_2': 'oo'}. Best is trial 108 with value: 0.9666666666666667.
2024-12-07 00:36:49,514 - INFO - Candidate Mean Stats: {'Max': np.float64(2.0), 'Min': np.float64(0.21750881128930777), 'Mean': np.float64(0.4891941559402661), 'Std': np.float64(0.06877073376857065)}
2024-12-07 00:36:49,515 - INFO - Candidate Std Stats: {'Max': np.float64(0.5167374471304312), 'Min': np.float64(0.0), 'Mean': np.float64(0.10882908837528005), 'Std': np.float64(0.050654826951805405)}
[I 2024-12-07 00:36:49,556] Trial 144 finished with value: 1.5666666666666667 and parameters: {'x_0_0': 'ad', 'x_0_1': 'ad', 'x_0_2': 'cd', 'x_1_0': 'ad', 'x_1_1': 'oo', 'x_1_2': 'ab'}. Best is trial 49 with value: 0.7999999999999999.
2024-12-07 00:36:52,886 - INFO - Candidate Mean Stats: {'Max': np.float64(2.0), 'Min': np.float64(0.26922595811294414), 'Mean': np.float64(0.4887319384469896), 'Std': np.float64(0.064680951503231)}
2024-12-07 00:36:52,886 - INFO - Candidate Std Stats: {'Max': np.float64(0.7566785127108363), 'Min': np.float64(0.0), 'Mean': np.float64(0.10409034241847402), 'Std': np.float64(0.048685141267712805)}
[I 2024-12-07 00:36:52,929] Trial 144 finished with value: 1.6777777777777778 and parameters: {'x_0_0': 'ab', 'x_0_1': 'cd', 'x_0_2': 'ab', 'x_1_0': 'bc', 'x_1_1': 'oo', 'x_1_2': 'ad'}. Best is trial 118 with value: 0.8666666666666667.
2024-12-07 00:37:01,438 - INFO - Candidate Mean Stats: {'Max': np.float64(2.0), 'Min': np.float64(0.2013435470582529), 'Mean': np.float64(0.5015907711662979), 'Std': np.float64(0.06311573217391554)}
2024-12-07 00:37:01,439 - INFO - Candidate Std Stats: {'Max': np.float64(0.4325557817750461), 'Min': np.float64(0.0), 'Mean': np.float64(0.1007061210796606), 'Std': np.float64(0.047434741377019585)}
[I 2024-12-07 00:37:01,481] Trial 144 finished with value: 0.9666666666666667 and parameters: {'x_0_0': 'bc', 'x_0_1': 'oo', 'x_0_2': 'ad', 'x_1_0': 'oo', 'x_1_1': 'ac', 'x_1_2': 'oo'}. Best is trial 74 with value: 0.8222222222222222.
2024-12-07 00:37:08,054 - INFO - Candidate Mean Stats: {'Max': np.float64(2.0), 'Min': np.float64(0.23103256365298525), 'Mean': np.float64(0.49025123652157554), 'Std': np.float64(0.07708207502757165)}
2024-12-07 00:37:08,054 - INFO - Candidate Std Stats: {'Max': np.float64(1.0219083169514782), 'Min': np.float64(0.0), 'Mean': np.float64(0.1173803014468586), 'Std': np.float64(0.05933923623284555)}
[I 2024-12-07 00:37:08,096] Trial 145 finished with value: 1.7777777777777777 and parameters: {'x_0_0': 'ab', 'x_0_1': 'bc', 'x_0_2': 'ad', 'x_1_0': 'bc', 'x_1_1': 'bd', 'x_1_2': 'bc'}. Best is trial 108 with value: 0.9666666666666667.
2024-12-07 00:37:09,471 - INFO - Candidate Mean Stats: {'Max': np.float64(2.0), 'Min': np.float64(0.25506879833143914), 'Mean': np.float64(0.4931556629721949), 'Std': np.float64(0.07056083236302857)}
2024-12-07 00:37:09,471 - INFO - Candidate Std Stats: {'Max': np.float64(0.43043624358882293), 'Min': np.float64(0.0), 'Mean': np.float64(0.10099275694309183), 'Std': np.float64(0.0417385257649367)}
[I 2024-12-07 00:37:09,514] Trial 145 finished with value: 1.6666666666666665 and parameters: {'x_0_0': 'ad', 'x_0_1': 'ad', 'x_0_2': 'bd', 'x_1_0': 'ac', 'x_1_1': 'bc', 'x_1_2': 'ad'}. Best is trial 49 with value: 0.7999999999999999.
2024-12-07 00:37:13,176 - INFO - Candidate Mean Stats: {'Max': np.float64(2.0), 'Min': np.float64(0.22310541593332972), 'Mean': np.float64(0.48905129876449854), 'Std': np.float64(0.06877477482697006)}
2024-12-07 00:37:13,176 - INFO - Candidate Std Stats: {'Max': np.float64(1.4952735654109646), 'Min': np.float64(0.0), 'Mean': np.float64(0.10672236506857397), 'Std': np.float64(0.054401345868064194)}
[I 2024-12-07 00:37:13,219] Trial 145 finished with value: 1.4444444444444444 and parameters: {'x_0_0': 'bc', 'x_0_1': 'ad', 'x_0_2': 'bd', 'x_1_0': 'bc', 'x_1_1': 'cd', 'x_1_2': 'ab'}. Best is trial 118 with value: 0.8666666666666667.
2024-12-07 00:37:21,544 - INFO - Candidate Mean Stats: {'Max': np.float64(2.0), 'Min': np.float64(0.27983104070407006), 'Mean': np.float64(0.48685521266136284), 'Std': np.float64(0.07096683740690256)}
2024-12-07 00:37:21,545 - INFO - Candidate Std Stats: {'Max': np.float64(0.9936406301986103), 'Min': np.float64(0.0), 'Mean': np.float64(0.10859360929461785), 'Std': np.float64(0.0519537155686917)}
[I 2024-12-07 00:37:21,585] Trial 145 finished with value: 1.6666666666666665 and parameters: {'x_0_0': 'ad', 'x_0_1': 'bd', 'x_0_2': 'bd', 'x_1_0': 'ad', 'x_1_1': 'bd', 'x_1_2': 'ac'}. Best is trial 74 with value: 0.8222222222222222.
2024-12-07 00:37:28,036 - INFO - Candidate Mean Stats: {'Max': np.float64(2.0), 'Min': np.float64(0.2527520024584427), 'Mean': np.float64(0.48675549722767625), 'Std': np.float64(0.07455756398820813)}
2024-12-07 00:37:28,037 - INFO - Candidate Std Stats: {'Max': np.float64(1.4989810998302797), 'Min': np.float64(0.0), 'Mean': np.float64(0.11040770117848796), 'Std': np.float64(0.05652382100172449)}
