[I 2024-12-28 15:07:44,523] Trial 149 finished with value: 1.25 and parameters: {'x_0_0': 'cd', 'x_0_1': 'oo', 'x_1_0': 'oo', 'x_1_1': 'ac'}. Best is trial 17 with value: 0.7857142857142857.

Loaded from prev state!
Loaded from prev state!
Loaded from prev state!
Loaded from prev state!
Loaded from prev state!
Loaded from prev state!
Loaded from prev state!
Loaded from prev state!
Loaded from prev state!
Loaded from prev state!
Loaded from prev state!
Loaded from prev state!
Loaded from prev state!
Loaded from prev state!
Loaded from prev state!
Loaded from prev state!
Loaded from prev state!
Loaded from prev state!
Loaded from prev state!
Loaded from prev state!
Loaded from prev state!
Loaded from prev state!
Loaded from prev state!
Loaded from prev state!
Loaded from prev state!
Loaded from prev state!
Loaded from prev state!
Loaded from prev state!
Loaded from prev state!
Loaded from prev state!
Loaded from prev state!
Loaded from prev state!
Loaded from prev state!
Loaded from prev state!
Loaded from prev state!
Loaded from prev state!
Loaded from prev state!
Loaded from prev state!
Loaded from prev state!
Loaded from prev state!
Loaded from prev state!
Loaded from prev state!
Loaded from prev state!
Loaded from prev state!
Loaded from prev state!
Loaded from prev state!
Loaded from prev state!
Loaded from prev state!
Loaded from prev state!
Loaded from prev state!
Loaded from prev state!
Loaded from prev state!
Loaded from prev state!
Loaded from prev state!
Loaded from prev state!
Loaded from prev state!
Loaded from prev state!
Loaded from prev state!
Loaded from prev state!
Loaded from prev state!
Loaded from prev state!
Loaded from prev state!
Loaded from prev state!
Loaded from prev state!
Loaded from prev state!
Loaded from prev state!
Loaded from prev state!
Loaded from prev state!
Loaded from prev state!
Loaded from prev state!
Loaded from prev state!
Loaded from prev state!
Loaded from prev state!
Loaded from prev state!
Loaded from prev state!
Loaded from prev state!
Loaded from prev state!
Loaded from prev state!
Loaded from prev state!
Loaded from prev state!
Loaded from prev state!
Loaded from prev state!
Loaded from prev state!
Loaded from prev state!
Loaded from prev state!
Loaded from prev state!
Loaded from prev state!
Loaded from prev state!
Loaded from prev state!
Loaded from prev state!
Loaded from prev state!
Loaded from prev state!
Loaded from prev state!
Loaded from prev state!
Loaded from prev state!
Loaded from prev state!
Loaded from prev state!
Loaded from prev state!
Loaded from prev state!
Loaded from prev state!
Loaded from prev state!
Loaded from prev state!
Loaded from prev state!
Loaded from prev state!
Loaded from prev state!
Loaded from prev state!
Loaded from prev state!
Loaded from prev state!
Loaded from prev state!
Loaded from prev state!
Loaded from prev state!
Loaded from prev state!
Loaded from prev state!
Loaded from prev state!
Loaded from prev state!
Loaded from prev state!
Loaded from prev state!
Loaded from prev state!
Loaded from prev state!
Loaded from prev state!
Loaded from prev state!
Loaded from prev state!
Loaded from prev state!
Loaded from prev state!
Loaded from prev state!
Loaded from prev state!
Loaded from prev state!
Loaded from prev state!
Loaded from prev state!
Loaded from prev state!
Loaded from prev state!
Loaded from prev state!
Loaded from prev state!
Loaded from prev state!
Loaded from prev state!
Loaded from prev state!
Loaded from prev state!
Loaded from prev state!
Loaded from prev state!
Loaded from prev state!
Loaded from prev state!
Loaded from prev state!
Loaded from prev state!
Loaded from prev state!
Loaded from prev state!
Loaded from prev state!
Loaded from prev state!
Loaded from prev state!
Loaded from prev state!
Loaded from prev state!
Loaded from prev state!
Loaded from prev state!
Loaded from prev state!
Loaded from prev state!
Loaded from prev state!
Loaded from prev state!
Loaded from prev state!
Loaded from prev state!
Loaded from prev state!
Loaded from prev state!
Loaded from prev state!
Loaded from prev state!
Loaded from prev state!
Loaded from prev state!
Loaded from prev state!
Loaded from prev state!
Loaded from prev state!
Loaded from prev state!
Loaded from prev state!
Loaded from prev state!
Loaded from prev state!
Loaded from prev state!
Loaded from prev state!
Loaded from prev state!
Loaded from prev state!
Loaded from prev state!
Loaded from prev state!
Loaded from prev state!
Loaded from prev state!
Loaded from prev state!
Loaded from prev state!
Loaded from prev state!
Loaded from prev state!
Loaded from prev state!
Loaded from prev state!
Loaded from prev state!
Loaded from prev state!
Loaded from prev state!
Loaded from prev state!
Loaded from prev state!
Loaded from prev state!
Loaded from prev state!
Loaded from prev state!
Loaded from prev state!
Loaded from prev state!
Loaded from prev state!
Loaded from prev state!
Loaded from prev state!
Loaded from prev state!
Loaded from prev state!
Loaded from prev state!
Loaded from prev state!
Loaded from prev state!
Loaded from prev state!
Loaded from prev state!
Loaded from prev state!
Loaded from prev state!
Loaded from prev state!
Loaded from prev state!
Loaded from prev state!
Loaded from prev state!
Loaded from prev state!
Loaded from prev state!
Loaded from prev state!
Loaded from prev state!
Loaded from prev state!
Loaded from prev state!
Loaded from prev state!
Loaded from prev state!
Loaded from prev state!
Loaded from prev state!
Loaded from prev state!
Loaded from prev state!
Loaded from prev state!
Loaded from prev state!
Loaded from prev state!
Loaded from prev state!
Loaded from prev state!
Loaded from prev state!
Loaded from prev state!
Loaded from prev state!
Loaded from prev state!
Loaded from prev state!
Loaded from prev state!
Loaded from prev state!
Loaded from prev state!
Loaded from prev state!
Loaded from prev state!
Loaded from prev state!
Loaded from prev state!
Loaded from prev state!
Loaded from prev state!
Loaded from prev state!
Loaded from prev state!
Loaded from prev state!
Loaded from prev state!
Loaded from prev state!
Loaded from prev state!
Loaded from prev state!
Loaded from prev state!
Loaded from prev state!
Loaded from prev state!
Loaded from prev state!
Loaded from prev state!
Loaded from prev state!
Loaded from prev state!
Loaded from prev state!
Loaded from prev state!
Loaded from prev state!
Loaded from prev state!
Loaded from prev state!
Loaded from prev state!
Loaded from prev state!
Loaded from prev state!
Loaded from prev state!
Loaded from prev state!
Loaded from prev state!
Loaded from prev state!
Loaded from prev state!
Loaded from prev state!
Loaded from prev state!
Loaded from prev state!
Loaded from prev state!
Loaded from prev state!
Loaded from prev state!
Loaded from prev state!
Loaded from prev state!
Loaded from prev state!
Loaded from prev state!
Loaded from prev state!
Loaded from prev state!
Loaded from prev state!
Loaded from prev state!
Loaded from prev state!
Loaded from prev state!
Loaded from prev state!
Loaded from prev state!
Loaded from prev state!
Loaded from prev state!
Loaded from prev state!
Loaded from prev state!
Loaded from prev state!
Loaded from prev state!
Loaded from prev state!
Loaded from prev state!
Loaded from prev state!
Loaded from prev state!
Loaded from prev state!
Loaded from prev state!
Loaded from prev state!
Loaded from prev state!
Loaded from prev state!
Loaded from prev state!
Loaded from prev state!
Loaded from prev state!
Loaded from prev state!
Loaded from prev state!
Loaded from prev state!
Loaded from prev state!
Loaded from prev state!
Loaded from prev state!
Loaded from prev state!
Loaded from prev state!
Loaded from prev state!
Loaded from prev state!
Loaded from prev state!
Loaded from prev state!
Loaded from prev state!
Loaded from prev state!
Loaded from prev state!
Loaded from prev state!
Loaded from prev state!
Loaded from prev state!
Loaded from prev state!
Loaded from prev state!
Loaded from prev state!
Loaded from prev state!
Loaded from prev state!
Loaded from prev state!
Loaded from prev state!
Loaded from prev state!
Loaded from prev state!
Loaded from prev state!
Loaded from prev state!
Loaded from prev state!
Loaded from prev state!
Loaded from prev state!
Loaded from prev state!
Loaded from prev state!
Loaded from prev state!
Loaded from prev state!
Loaded from prev state![I 2024-12-28 15:07:45,352] Trial 141 finished with value: 1.7142857142857144 and parameters: {'x_0_0': 'ab', 'x_0_1': 'ac', 'x_1_0': 'bc', 'x_1_1': 'ad'}. Best is trial 7 with value: 0.5.
[I 2024-12-28 15:07:46,615] Trial 150 finished with value: 1.5714285714285714 and parameters: {'x_0_0': 'ad', 'x_0_1': 'bd', 'x_1_0': 'ad', 'x_1_1': 'bc'}. Best is trial 73 with value: 0.7857142857142857.
[I 2024-12-28 15:07:48,006] Trial 138 finished with value: 1.0714285714285714 and parameters: {'x_0_0': 'ac', 'x_0_1': 'oo', 'x_1_0': 'cd', 'x_1_1': 'ac'}. Best is trial 107 with value: 0.6607142857142857.
[I 2024-12-28 15:07:48,758] Trial 150 finished with value: 1.5714285714285714 and parameters: {'x_0_0': 'ad', 'x_0_1': 'cd', 'x_1_0': 'ad', 'x_1_1': 'ad'}. Best is trial 17 with value: 0.5.
[I 2024-12-28 15:07:49,654] Trial 134 finished with value: 1.5714285714285714 and parameters: {'x_0_0': 'bc', 'x_0_1': 'cd', 'x_1_0': 'ac', 'x_1_1': 'cd'}. Best is trial 47 with value: 0.6964285714285714.
[I 2024-12-28 15:07:50,511] Trial 143 finished with value: 2.0 and parameters: {'x_0_0': 'cd', 'x_0_1': 'ad', 'x_1_0': 'ac', 'x_1_1': 'ab'}. Best is trial 15 with value: 0.6964285714285714.
[I 2024-12-28 15:07:50,793] Trial 150 finished with value: 1.2857142857142856 and parameters: {'x_0_0': 'ad', 'x_0_1': 'bd', 'x_1_0': 'bd', 'x_1_1': 'bd'}. Best is trial 142 with value: 0.6607142857142857.
[I 2024-12-28 15:07:51,416] Trial 144 finished with value: 1.1428571428571428 and parameters: {'x_0_0': 'bd', 'x_0_1': 'ad', 'x_1_0': 'bc', 'x_1_1': 'ab'}. Best is trial 140 with value: 0.6607142857142857.
[I 2024-12-28 15:07:53,044] Trial 142 finished with value: 0.5 and parameters: {'x_0_0': 'bd', 'x_0_1': 'oo', 'x_1_0': 'bc', 'x_1_1': 'ad'}. Best is trial 7 with value: 0.5.
[I 2024-12-28 15:07:53,171] Trial 151 finished with value: 1.5714285714285714 and parameters: {'x_0_0': 'ad', 'x_0_1': 'cd', 'x_1_0': 'ad', 'x_1_1': 'bc'}. Best is trial 73 with value: 0.7857142857142857.
[I 2024-12-28 15:07:53,461] Trial 132 finished with value: 1.625 and parameters: {'x_0_0': 'oo', 'x_0_1': 'ab', 'x_1_0': 'oo', 'x_1_1': 'cd'}. Best is trial 43 with value: 0.6964285714285714.
[I 2024-12-28 15:07:56,486] Trial 139 finished with value: 1.5 and parameters: {'x_0_0': 'cd', 'x_0_1': 'oo', 'x_1_0': 'bc', 'x_1_1': 'cd'}. Best is trial 107 with value: 0.6607142857142857.
[I 2024-12-28 15:07:56,908] Trial 152 finished with value: 1.875 and parameters: {'x_0_0': 'oo', 'x_0_1': 'bd', 'x_1_0': 'ab', 'x_1_1': 'ad'}. Best is trial 73 with value: 0.7857142857142857.
[I 2024-12-28 15:07:57,127] Trial 151 finished with value: 1.2857142857142856 and parameters: {'x_0_0': 'ad', 'x_0_1': 'ad', 'x_1_0': 'bd', 'x_1_1': 'ad'}. Best is trial 142 with value: 0.6607142857142857.
[I 2024-12-28 15:07:57,487] Trial 150 finished with value: 1.625 and parameters: {'x_0_0': 'cd', 'x_0_1': 'ab', 'x_1_0': 'oo', 'x_1_1': 'oo'}. Best is trial 17 with value: 0.7857142857142857.
[I 2024-12-28 15:07:57,688] Trial 135 finished with value: 1.2142857142857144 and parameters: {'x_0_0': 'ab', 'x_0_1': 'oo', 'x_1_0': 'ac', 'x_1_1': 'cd'}. Best is trial 47 with value: 0.6964285714285714.
[I 2024-12-28 15:07:58,373] Trial 145 finished with value: 2.0 and parameters: {'x_0_0': 'cd', 'x_0_1': 'ad', 'x_1_0': 'bc', 'x_1_1': 'ab'}. Best is trial 140 with value: 0.6607142857142857.
[I 2024-12-28 15:07:58,459] Trial 151 finished with value: 0.9464285714285714 and parameters: {'x_0_0': 'bd', 'x_0_1': 'oo', 'x_1_0': 'ad', 'x_1_1': 'oo'}. Best is trial 17 with value: 0.5.
[I 2024-12-28 15:08:02,021] Trial 144 finished with value: 1.2857142857142856 and parameters: {'x_0_0': 'bc', 'x_0_1': 'ad', 'x_1_0': 'ad', 'x_1_1': 'cd'}. Best is trial 15 with value: 0.6964285714285714.
[I 2024-12-28 15:08:02,851] Trial 152 finished with value: 0.8214285714285714 and parameters: {'x_0_0': 'ad', 'x_0_1': 'oo', 'x_1_0': 'oo', 'x_1_1': 'ad'}. Best is trial 142 with value: 0.6607142857142857.
[I 2024-12-28 15:08:04,337] Trial 136 finished with value: 1.0714285714285714 and parameters: {'x_0_0': 'ac', 'x_0_1': 'oo', 'x_1_0': 'ac', 'x_1_1': 'ab'}. Best is trial 47 with value: 0.6964285714285714.
[I 2024-12-28 15:08:04,526] Trial 151 finished with value: 1.2857142857142856 and parameters: {'x_0_0': 'ad', 'x_0_1': 'bc', 'x_1_0': 'bc', 'x_1_1': 'cd'}. Best is trial 17 with value: 0.7857142857142857.
[I 2024-12-28 15:08:04,837] Trial 133 finished with value: 1.75 and parameters: {'x_0_0': 'cd', 'x_0_1': 'ac', 'x_1_0': 'oo', 'x_1_1': 'ab'}. Best is trial 43 with value: 0.6964285714285714.
[I 2024-12-28 15:08:06,523] Trial 146 finished with value: 1.3214285714285714 and parameters: {'x_0_0': 'bc', 'x_0_1': 'cd', 'x_1_0': 'oo', 'x_1_1': 'cd'}. Best is trial 140 with value: 0.6607142857142857.
[I 2024-12-28 15:08:09,481] Trial 152 finished with value: 1.0714285714285714 and parameters: {'x_0_0': 'bc', 'x_0_1': 'oo', 'x_1_0': 'bc', 'x_1_1': 'ac'}. Best is trial 17 with value: 0.5.
[I 2024-12-28 15:08:10,778] Trial 143 finished with value: 2.0 and parameters: {'x_0_0': 'cd', 'x_0_1': 'ac', 'x_1_0': 'bc', 'x_1_1': 'ad'}. Best is trial 7 with value: 0.5.
[I 2024-12-28 15:08:10,859] Trial 153 finished with value: 1.375 and parameters: {'x_0_0': 'oo', 'x_0_1': 'oo', 'x_1_0': 'ab', 'x_1_1': 'bc'}. Best is trial 73 with value: 0.7857142857142857.
[I 2024-12-28 15:08:14,299] Trial 152 finished with value: 1.75 and parameters: {'x_0_0': 'cd', 'x_0_1': 'cd', 'x_1_0': 'oo', 'x_1_1': 'bd'}. Best is trial 17 with value: 0.7857142857142857.
[I 2024-12-28 15:08:14,820] Trial 147 finished with value: 1.5714285714285714 and parameters: {'x_0_0': 'ac', 'x_0_1': 'cd', 'x_1_0': 'bd', 'x_1_1': 'cd'}. Best is trial 140 with value: 0.6607142857142857.
[I 2024-12-28 15:08:15,115] Trial 137 finished with value: 1.5714285714285714 and parameters: {'x_0_0': 'ad', 'x_0_1': 'bc', 'x_1_0': 'cd', 'x_1_1': 'ab'}. Best is trial 47 with value: 0.6964285714285714.
[I 2024-12-28 15:08:15,420] Trial 153 finished with value: 1.3214285714285714 and parameters: {'x_0_0': 'ad', 'x_0_1': 'cd', 'x_1_0': 'oo', 'x_1_1': 'ad'}. Best is trial 142 with value: 0.6607142857142857.
[I 2024-12-28 15:08:15,995] Trial 145 finished with value: 2.0 and parameters: {'x_0_0': 'cd', 'x_0_1': 'ab', 'x_1_0': 'bc', 'x_1_1': 'bc'}. Best is trial 15 with value: 0.6964285714285714.
