[I 2024-12-06 23:37:53,514] Trial 303 finished with value: 1.2142857142857144 and parameters: {'x_0_0': 'ab', 'x_0_1': 'oo', 'x_1_0': 'ad', 'x_1_1': 'cd'}. Best is trial 23 with value: 0.5.
2024-12-06 23:37:53,589 - INFO - Candidate Mean Stats: {'Max': np.float64(3.3758929132714024), 'Min': np.float64(-0.7551209172395861), 'Mean': np.float64(0.6543393269489799), 'Std': np.float64(0.543379765088046)}
2024-12-06 23:37:53,589 - INFO - Candidate Std Stats: {'Max': np.float64(1.5397391978361712), 'Min': np.float64(0.0), 'Mean': np.float64(0.5761625301920511), 'Std': np.float64(0.31512374422726713)}
2024-12-06 23:37:53,592 - INFO - Candidate Mean Stats: {'Max': np.float64(3.0374519376993483), 'Min': np.float64(-1.108467466596462), 'Mean': np.float64(0.6221298872273191), 'Std': np.float64(0.5652118561800481)}
2024-12-06 23:37:53,592 - INFO - Candidate Std Stats: {'Max': np.float64(1.5293383159653384), 'Min': np.float64(0.0), 'Mean': np.float64(0.5865557635973628), 'Std': np.float64(0.33209520419953925)}
2024-12-06 23:37:53,593 - INFO - Candidate Mean Stats: {'Max': np.float64(3.024282554983084), 'Min': np.float64(-0.7651606968482614), 'Mean': np.float64(0.5887524987174244), 'Std': np.float64(0.5619782045917895)}
2024-12-06 23:37:53,593 - INFO - Candidate Std Stats: {'Max': np.float64(1.7005569111870182), 'Min': np.float64(0.0), 'Mean': np.float64(0.6134403333560029), 'Std': np.float64(0.33896083700978497)}
[I 2024-12-06 23:37:53,604] Trial 305 finished with value: 1.25 and parameters: {'x_0_0': 'cd', 'x_0_1': 'oo', 'x_1_0': 'oo', 'x_1_1': 'ad'}. Best is trial 165 with value: 0.5.
[I 2024-12-06 23:37:53,606] Trial 305 finished with value: 1.0714285714285714 and parameters: {'x_0_0': 'bc', 'x_0_1': 'oo', 'x_1_0': 'bd', 'x_1_1': 'ad'}. Best is trial 76 with value: 0.5.
[I 2024-12-06 23:37:53,607] Trial 305 finished with value: 0.9464285714285714 and parameters: {'x_0_0': 'bc', 'x_0_1': 'oo', 'x_1_0': 'bc', 'x_1_1': 'oo'}. Best is trial 63 with value: 0.5.
2024-12-06 23:37:53,880 - INFO - Candidate Mean Stats: {'Max': np.float64(3.3095233611069816), 'Min': np.float64(-0.5858407566569338), 'Mean': np.float64(0.7008819086170218), 'Std': np.float64(0.43912726332152985)}
2024-12-06 23:37:53,880 - INFO - Candidate Std Stats: {'Max': np.float64(1.8015100948499732), 'Min': np.float64(0.0), 'Mean': np.float64(0.499455582213071), 'Std': np.float64(0.3058235545390699)}
[I 2024-12-06 23:37:53,894] Trial 304 finished with value: 0.8214285714285714 and parameters: {'x_0_0': 'ac', 'x_0_1': 'oo', 'x_1_0': 'oo', 'x_1_1': 'bd'}. Best is trial 23 with value: 0.5.
2024-12-06 23:37:53,968 - INFO - Candidate Mean Stats: {'Max': np.float64(3.129323000987815), 'Min': np.float64(-0.7868147717554483), 'Mean': np.float64(0.6519380617558556), 'Std': np.float64(0.5579907142692726)}
2024-12-06 23:37:53,968 - INFO - Candidate Std Stats: {'Max': np.float64(1.6450765106755787), 'Min': np.float64(0.0), 'Mean': np.float64(0.5446125179632378), 'Std': np.float64(0.3177441826873948)}
2024-12-06 23:37:53,973 - INFO - Candidate Mean Stats: {'Max': np.float64(3.432072533932428), 'Min': np.float64(-0.8176354225817015), 'Mean': np.float64(0.7251319822249805), 'Std': np.float64(0.525627751935181)}
2024-12-06 23:37:53,973 - INFO - Candidate Std Stats: {'Max': np.float64(1.6417023563873157), 'Min': np.float64(0.0), 'Mean': np.float64(0.5271783640140412), 'Std': np.float64(0.30417921507276763)}
2024-12-06 23:37:53,976 - INFO - Candidate Mean Stats: {'Max': np.float64(3.061460893067804), 'Min': np.float64(-0.515299218083175), 'Mean': np.float64(0.6991293894872121), 'Std': np.float64(0.5190397442715445)}
2024-12-06 23:37:53,976 - INFO - Candidate Std Stats: {'Max': np.float64(1.4113092406920953), 'Min': np.float64(0.0), 'Mean': np.float64(0.5126697909363304), 'Std': np.float64(0.28108527635555175)}
[I 2024-12-06 23:37:53,983] Trial 306 finished with value: 1.0714285714285714 and parameters: {'x_0_0': 'ac', 'x_0_1': 'oo', 'x_1_0': 'ad', 'x_1_1': 'bd'}. Best is trial 165 with value: 0.5.
[I 2024-12-06 23:37:53,988] Trial 306 finished with value: 1.2142857142857144 and parameters: {'x_0_0': 'ab', 'x_0_1': 'oo', 'x_1_0': 'bc', 'x_1_1': 'bc'}. Best is trial 76 with value: 0.5.
[I 2024-12-06 23:37:53,990] Trial 306 finished with value: 1.4285714285714286 and parameters: {'x_0_0': 'bc', 'x_0_1': 'ab', 'x_1_0': 'ad', 'x_1_1': 'cd'}. Best is trial 63 with value: 0.5.
2024-12-06 23:37:54,261 - INFO - Candidate Mean Stats: {'Max': np.float64(2.885545689345824), 'Min': np.float64(-1.0676676007744745), 'Mean': np.float64(0.6642316754837174), 'Std': np.float64(0.5657779111943463)}
2024-12-06 23:37:54,261 - INFO - Candidate Std Stats: {'Max': np.float64(1.951567695355912), 'Min': np.float64(0.0), 'Mean': np.float64(0.5333098085312803), 'Std': np.float64(0.3082011614147804)}
[I 2024-12-06 23:37:54,275] Trial 305 finished with value: 1.0714285714285714 and parameters: {'x_0_0': 'bc', 'x_0_1': 'oo', 'x_1_0': 'ab', 'x_1_1': 'bc'}. Best is trial 23 with value: 0.5.
2024-12-06 23:37:54,347 - INFO - Candidate Mean Stats: {'Max': np.float64(2.9750141358474393), 'Min': np.float64(-0.7447564576978651), 'Mean': np.float64(0.670228377786399), 'Std': np.float64(0.5810081611880523)}
2024-12-06 23:37:54,347 - INFO - Candidate Std Stats: {'Max': np.float64(1.5695691243334895), 'Min': np.float64(0.0), 'Mean': np.float64(0.4656184973551925), 'Std': np.float64(0.28302884325109184)}
2024-12-06 23:37:54,351 - INFO - Candidate Mean Stats: {'Max': np.float64(3.2968603617897534), 'Min': np.float64(-0.4952521750543449), 'Mean': np.float64(0.7049345067701439), 'Std': np.float64(0.47725404984999953)}
2024-12-06 23:37:54,351 - INFO - Candidate Std Stats: {'Max': np.float64(1.5488929229474167), 'Min': np.float64(0.0), 'Mean': np.float64(0.5079078626324613), 'Std': np.float64(0.2865786620289356)}
2024-12-06 23:37:54,355 - INFO - Candidate Mean Stats: {'Max': np.float64(3.0541531507357904), 'Min': np.float64(-1.0457274174521225), 'Mean': np.float64(0.5491867903839912), 'Std': np.float64(0.6011121736540194)}
2024-12-06 23:37:54,355 - INFO - Candidate Std Stats: {'Max': np.float64(1.4362842851431936), 'Min': np.float64(0.0), 'Mean': np.float64(0.5629368103311237), 'Std': np.float64(0.2993220844856561)}
[I 2024-12-06 23:37:54,362] Trial 307 finished with value: 1.0714285714285714 and parameters: {'x_0_0': 'ac', 'x_0_1': 'oo', 'x_1_0': 'ac', 'x_1_1': 'ab'}. Best is trial 165 with value: 0.5.
[I 2024-12-06 23:37:54,365] Trial 307 finished with value: 1.0892857142857144 and parameters: {'x_0_0': 'ab', 'x_0_1': 'oo', 'x_1_0': 'cd', 'x_1_1': 'oo'}. Best is trial 76 with value: 0.5.
[I 2024-12-06 23:37:54,369] Trial 307 finished with value: 0.9285714285714286 and parameters: {'x_0_0': 'bd', 'x_0_1': 'oo', 'x_1_0': 'ab', 'x_1_1': 'ac'}. Best is trial 63 with value: 0.5.
2024-12-06 23:37:54,646 - INFO - Candidate Mean Stats: {'Max': np.float64(3.7432702507412556), 'Min': np.float64(-0.5888186753409629), 'Mean': np.float64(0.7353414928146951), 'Std': np.float64(0.47839819533112204)}
2024-12-06 23:37:54,646 - INFO - Candidate Std Stats: {'Max': np.float64(1.821690926208645), 'Min': np.float64(0.0), 'Mean': np.float64(0.46881828303916523), 'Std': np.float64(0.2745121521707588)}
[I 2024-12-06 23:37:54,660] Trial 306 finished with value: 0.8214285714285714 and parameters: {'x_0_0': 'bc', 'x_0_1': 'oo', 'x_1_0': 'oo', 'x_1_1': 'bd'}. Best is trial 23 with value: 0.5.
2024-12-06 23:37:54,728 - INFO - Candidate Mean Stats: {'Max': np.float64(2.980950176273187), 'Min': np.float64(-0.7999794798483686), 'Mean': np.float64(0.6400622962601356), 'Std': np.float64(0.5670242630874306)}
2024-12-06 23:37:54,728 - INFO - Candidate Std Stats: {'Max': np.float64(1.7135664374222308), 'Min': np.float64(0.0), 'Mean': np.float64(0.5743350658205729), 'Std': np.float64(0.32104985584450724)}
2024-12-06 23:37:54,738 - INFO - Candidate Mean Stats: {'Max': np.float64(3.1967120243954907), 'Min': np.float64(-0.8336882820426805), 'Mean': np.float64(0.6881941344118964), 'Std': np.float64(0.5221771783676366)}
2024-12-06 23:37:54,738 - INFO - Candidate Std Stats: {'Max': np.float64(1.7951005854564264), 'Min': np.float64(0.0), 'Mean': np.float64(0.5271485420922762), 'Std': np.float64(0.292965470404106)}
2024-12-06 23:37:54,742 - INFO - Candidate Mean Stats: {'Max': np.float64(2.797156680238192), 'Min': np.float64(-0.7868883967403069), 'Mean': np.float64(0.6709513646498066), 'Std': np.float64(0.5198065941965565)}
2024-12-06 23:37:54,742 - INFO - Candidate Std Stats: {'Max': np.float64(1.6586349471555182), 'Min': np.float64(0.0), 'Mean': np.float64(0.5285232185570569), 'Std': np.float64(0.3066901818613784)}
[I 2024-12-06 23:37:54,742] Trial 308 finished with value: 1.4285714285714286 and parameters: {'x_0_0': 'bc', 'x_0_1': 'ab', 'x_1_0': 'bd', 'x_1_1': 'bd'}. Best is trial 165 with value: 0.5.
[I 2024-12-06 23:37:54,752] Trial 308 finished with value: 0.7857142857142857 and parameters: {'x_0_0': 'bd', 'x_0_1': 'oo', 'x_1_0': 'bc', 'x_1_1': 'bd'}. Best is trial 76 with value: 0.5.
[I 2024-12-06 23:37:54,755] Trial 308 finished with value: 0.9464285714285714 and parameters: {'x_0_0': 'ac', 'x_0_1': 'oo', 'x_1_0': 'bc', 'x_1_1': 'oo'}. Best is trial 63 with value: 0.5.
2024-12-06 23:37:55,024 - INFO - Candidate Mean Stats: {'Max': np.float64(3.250391862289818), 'Min': np.float64(-0.6675201165238456), 'Mean': np.float64(0.7259451023726314), 'Std': np.float64(0.49262262626704234)}
2024-12-06 23:37:55,024 - INFO - Candidate Std Stats: {'Max': np.float64(1.4604282510968027), 'Min': np.float64(0.0), 'Mean': np.float64(0.4791657362928966), 'Std': np.float64(0.2775672712480241)}
[I 2024-12-06 23:37:55,038] Trial 307 finished with value: 1.5 and parameters: {'x_0_0': 'cd', 'x_0_1': 'oo', 'x_1_0': 'bc', 'x_1_1': 'cd'}. Best is trial 23 with value: 0.5.
2024-12-06 23:37:55,107 - INFO - Candidate Mean Stats: {'Max': np.float64(3.1519799699285995), 'Min': np.float64(-0.9153891101469824), 'Mean': np.float64(0.6387709091471725), 'Std': np.float64(0.6217130345926576)}
2024-12-06 23:37:55,107 - INFO - Candidate Std Stats: {'Max': np.float64(1.8309054773620164), 'Min': np.float64(0.0), 'Mean': np.float64(0.5411397714677647), 'Std': np.float64(0.3072771097828934)}
2024-12-06 23:37:55,117 - INFO - Candidate Mean Stats: {'Max': np.float64(2.6467364837377323), 'Min': np.float64(-1.048669637090805), 'Mean': np.float64(0.7166462599074538), 'Std': np.float64(0.5479669165307206)}
2024-12-06 23:37:55,117 - INFO - Candidate Std Stats: {'Max': np.float64(1.7896349625907668), 'Min': np.float64(0.0), 'Mean': np.float64(0.5374117550331476), 'Std': np.float64(0.3079634552131692)}
[I 2024-12-06 23:37:55,121] Trial 309 finished with value: 1.0714285714285714 and parameters: {'x_0_0': 'ac', 'x_0_1': 'oo', 'x_1_0': 'ac', 'x_1_1': 'ac'}. Best is trial 165 with value: 0.5.
2024-12-06 23:37:55,123 - INFO - Candidate Mean Stats: {'Max': np.float64(3.031031599694084), 'Min': np.float64(-0.7663874132555888), 'Mean': np.float64(0.5939200684888172), 'Std': np.float64(0.5862862940253433)}
2024-12-06 23:37:55,123 - INFO - Candidate Std Stats: {'Max': np.float64(1.543961509635856), 'Min': np.float64(0.0), 'Mean': np.float64(0.582275176284611), 'Std': np.float64(0.31391365887592887)}
[I 2024-12-06 23:37:55,131] Trial 309 finished with value: 1.2142857142857144 and parameters: {'x_0_0': 'ab', 'x_0_1': 'oo', 'x_1_0': 'bd', 'x_1_1': 'ac'}. Best is trial 76 with value: 0.5.
[I 2024-12-06 23:37:55,137] Trial 309 finished with value: 1.0 and parameters: {'x_0_0': 'ac', 'x_0_1': 'ad', 'x_1_0': 'cd', 'x_1_1': 'bc'}. Best is trial 63 with value: 0.5.
2024-12-06 23:37:55,405 - INFO - Candidate Mean Stats: {'Max': np.float64(2.8720016237364043), 'Min': np.float64(-0.7620194045677199), 'Mean': np.float64(0.6571362636304093), 'Std': np.float64(0.5213052326969255)}
2024-12-06 23:37:55,405 - INFO - Candidate Std Stats: {'Max': np.float64(1.545940163776423), 'Min': np.float64(0.0), 'Mean': np.float64(0.5431139269037021), 'Std': np.float64(0.30036252015650083)}
[I 2024-12-06 23:37:55,420] Trial 308 finished with value: 1.3214285714285714 and parameters: {'x_0_0': 'bc', 'x_0_1': 'bd', 'x_1_0': 'oo', 'x_1_1': 'ad'}. Best is trial 23 with value: 0.5.
2024-12-06 23:37:55,486 - INFO - Candidate Mean Stats: {'Max': np.float64(3.20520486248227), 'Min': np.float64(-0.9433718027234047), 'Mean': np.float64(0.6441951282755567), 'Std': np.float64(0.597206638747587)}
2024-12-06 23:37:55,486 - INFO - Candidate Std Stats: {'Max': np.float64(1.6245633121658052), 'Min': np.float64(0.0), 'Mean': np.float64(0.5713675404453693), 'Std': np.float64(0.3285336017453948)}
2024-12-06 23:37:55,497 - INFO - Candidate Mean Stats: {'Max': np.float64(3.0618600496512243), 'Min': np.float64(-0.9009605711686781), 'Mean': np.float64(0.6479269434783586), 'Std': np.float64(0.5457401391696404)}
2024-12-06 23:37:55,497 - INFO - Candidate Std Stats: {'Max': np.float64(1.696977892550005), 'Min': np.float64(0.0), 'Mean': np.float64(0.5533933447299416), 'Std': np.float64(0.30429739245674253)}
[I 2024-12-06 23:37:55,501] Trial 310 finished with value: 1.2142857142857144 and parameters: {'x_0_0': 'ab', 'x_0_1': 'oo', 'x_1_0': 'ac', 'x_1_1': 'bc'}. Best is trial 165 with value: 0.5.
2024-12-06 23:37:55,504 - INFO - Candidate Mean Stats: {'Max': np.float64(3.5143897501270116), 'Min': np.float64(-0.8646553191285655), 'Mean': np.float64(0.6165924695415168), 'Std': np.float64(0.5842687791975256)}
2024-12-06 23:37:55,504 - INFO - Candidate Std Stats: {'Max': np.float64(1.7461687822343075), 'Min': np.float64(0.0), 'Mean': np.float64(0.5824860455721541), 'Std': np.float64(0.3236432620467509)}
[I 2024-12-06 23:37:55,511] Trial 310 finished with value: 1.3035714285714286 and parameters: {'x_0_0': 'bc', 'x_0_1': 'ab', 'x_1_0': 'ab', 'x_1_1': 'oo'}. Best is trial 76 with value: 0.5.
[I 2024-12-06 23:37:55,517] Trial 310 finished with value: 1.2142857142857144 and parameters: {'x_0_0': 'ab', 'x_0_1': 'oo', 'x_1_0': 'ac', 'x_1_1': 'bd'}. Best is trial 63 with value: 0.5.
2024-12-06 23:37:55,790 - INFO - Candidate Mean Stats: {'Max': np.float64(3.196760274333026), 'Min': np.float64(-0.6578213096923948), 'Mean': np.float64(0.6775487622748412), 'Std': np.float64(0.518669834542618)}
2024-12-06 23:37:55,790 - INFO - Candidate Std Stats: {'Max': np.float64(1.3483796314539427), 'Min': np.float64(0.0), 'Mean': np.float64(0.48866085967151857), 'Std': np.float64(0.2688983940371954)}
[I 2024-12-06 23:37:55,803] Trial 309 finished with value: 0.9285714285714286 and parameters: {'x_0_0': 'ad', 'x_0_1': 'oo', 'x_1_0': 'ab', 'x_1_1': 'bd'}. Best is trial 23 with value: 0.5.
2024-12-06 23:37:55,867 - INFO - Candidate Mean Stats: {'Max': np.float64(3.47328407168782), 'Min': np.float64(-0.8087914991016245), 'Mean': np.float64(0.6113710433992432), 'Std': np.float64(0.543743128315233)}
2024-12-06 23:37:55,867 - INFO - Candidate Std Stats: {'Max': np.float64(1.8230219008252702), 'Min': np.float64(0.0), 'Mean': np.float64(0.6162839380825987), 'Std': np.float64(0.351711674386154)}
2024-12-06 23:37:55,876 - INFO - Candidate Mean Stats: {'Max': np.float64(3.1690308945891488), 'Min': np.float64(-0.45499713619884236), 'Mean': np.float64(0.7023634981961281), 'Std': np.float64(0.46500963022269287)}
2024-12-06 23:37:55,877 - INFO - Candidate Std Stats: {'Max': np.float64(1.670727718927568), 'Min': np.float64(0.0), 'Mean': np.float64(0.502987295120569), 'Std': np.float64(0.28984622686186357)}
[I 2024-12-06 23:37:55,882] Trial 311 finished with value: 1.0714285714285714 and parameters: {'x_0_0': 'ac', 'x_0_1': 'oo', 'x_1_0': 'ab', 'x_1_1': 'cd'}. Best is trial 165 with value: 0.5.
2024-12-06 23:37:55,883 - INFO - Candidate Mean Stats: {'Max': np.float64(3.1419204115460033), 'Min': np.float64(-0.6353556666874958), 'Mean': np.float64(0.6608404407127225), 'Std': np.float64(0.5709348504358444)}
2024-12-06 23:37:55,883 - INFO - Candidate Std Stats: {'Max': np.float64(1.4972996538928853), 'Min': np.float64(0.0), 'Mean': np.float64(0.5282427388885932), 'Std': np.float64(0.29053877656450056)}
[I 2024-12-06 23:37:55,891] Trial 311 finished with value: 1.2142857142857144 and parameters: {'x_0_0': 'ab', 'x_0_1': 'oo', 'x_1_0': 'ad', 'x_1_1': 'bd'}. Best is trial 76 with value: 0.5.
[I 2024-12-06 23:37:55,897] Trial 311 finished with value: 1.2142857142857144 and parameters: {'x_0_0': 'ab', 'x_0_1': 'oo', 'x_1_0': 'ac', 'x_1_1': 'cd'}. Best is trial 63 with value: 0.5.
2024-12-06 23:37:56,172 - INFO - Candidate Mean Stats: {'Max': np.float64(3.4787143500446724), 'Min': np.float64(-0.6797601460535259), 'Mean': np.float64(0.746847755504825), 'Std': np.float64(0.45281659659399776)}
2024-12-06 23:37:56,172 - INFO - Candidate Std Stats: {'Max': np.float64(1.4771353073614348), 'Min': np.float64(0.0), 'Mean': np.float64(0.45768591660080826), 'Std': np.float64(0.26552439932143945)}
[I 2024-12-06 23:37:56,186] Trial 310 finished with value: 1.0714285714285714 and parameters: {'x_0_0': 'bc', 'x_0_1': 'oo', 'x_1_0': 'ad', 'x_1_1': 'ab'}. Best is trial 23 with value: 0.5.
2024-12-06 23:37:56,248 - INFO - Candidate Mean Stats: {'Max': np.float64(3.1654642332815444), 'Min': np.float64(-1.0118909107268572), 'Mean': np.float64(0.5936621927738861), 'Std': np.float64(0.6257123772844937)}
2024-12-06 23:37:56,248 - INFO - Candidate Std Stats: {'Max': np.float64(1.8027617259789726), 'Min': np.float64(0.0), 'Mean': np.float64(0.5951690391597761), 'Std': np.float64(0.3502756961298847)}
2024-12-06 23:37:56,257 - INFO - Candidate Mean Stats: {'Max': np.float64(3.203782420829019), 'Min': np.float64(-0.8706103141066395), 'Mean': np.float64(0.5898702792490016), 'Std': np.float64(0.5967318497839408)}
2024-12-06 23:37:56,257 - INFO - Candidate Std Stats: {'Max': np.float64(1.7436141464551451), 'Min': np.float64(0.0), 'Mean': np.float64(0.5631152637090057), 'Std': np.float64(0.315335274507461)}
2024-12-06 23:37:56,262 - INFO - Candidate Mean Stats: {'Max': np.float64(2.7325712987537187), 'Min': np.float64(-0.7431402517138401), 'Mean': np.float64(0.6910232006630003), 'Std': np.float64(0.4802753570988239)}
2024-12-06 23:37:56,262 - INFO - Candidate Std Stats: {'Max': np.float64(1.6374468227506067), 'Min': np.float64(0.0), 'Mean': np.float64(0.5372703214563934), 'Std': np.float64(0.31649840312904304)}
[I 2024-12-06 23:37:56,263] Trial 312 finished with value: 1.3035714285714286 and parameters: {'x_0_0': 'bd', 'x_0_1': 'cd', 'x_1_0': 'ab', 'x_1_1': 'oo'}. Best is trial 165 with value: 0.5.
[I 2024-12-06 23:37:56,271] Trial 312 finished with value: 1.3035714285714286 and parameters: {'x_0_0': 'bc', 'x_0_1': 'ab', 'x_1_0': 'bd', 'x_1_1': 'oo'}. Best is trial 76 with value: 0.5.
[I 2024-12-06 23:37:56,275] Trial 312 finished with value: 0.7857142857142857 and parameters: {'x_0_0': 'ad', 'x_0_1': 'oo', 'x_1_0': 'bd', 'x_1_1': 'bd'}. Best is trial 63 with value: 0.5.
2024-12-06 23:37:56,555 - INFO - Candidate Mean Stats: {'Max': np.float64(3.0079889942484566), 'Min': np.float64(-0.7751067386416943), 'Mean': np.float64(0.6673164490012664), 'Std': np.float64(0.5063422687024293)}
2024-12-06 23:37:56,556 - INFO - Candidate Std Stats: {'Max': np.float64(1.7512370759641385), 'Min': np.float64(0.0), 'Mean': np.float64(0.5023068705233373), 'Std': np.float64(0.2858163603138034)}
[I 2024-12-06 23:37:56,570] Trial 311 finished with value: 1.0892857142857144 and parameters: {'x_0_0': 'ab', 'x_0_1': 'oo', 'x_1_0': 'ab', 'x_1_1': 'oo'}. Best is trial 23 with value: 0.5.
2024-12-06 23:37:56,633 - INFO - Candidate Mean Stats: {'Max': np.float64(2.763586982668401), 'Min': np.float64(-1.4847723873459568), 'Mean': np.float64(0.5030425253116302), 'Std': np.float64(0.6893340260613402)}
2024-12-06 23:37:56,633 - INFO - Candidate Std Stats: {'Max': np.float64(2.0074099109767185), 'Min': np.float64(0.0), 'Mean': np.float64(0.6873667507786111), 'Std': np.float64(0.3796578397149723)}
2024-12-06 23:37:56,639 - INFO - Candidate Mean Stats: {'Max': np.float64(3.4115803625587544), 'Min': np.float64(-0.9032452530162403), 'Mean': np.float64(0.6770564521276446), 'Std': np.float64(0.5642651711336449)}
2024-12-06 23:37:56,639 - INFO - Candidate Std Stats: {'Max': np.float64(1.9171975583673737), 'Min': np.float64(0.0), 'Mean': np.float64(0.610375083711569), 'Std': np.float64(0.34612942860684015)}
2024-12-06 23:37:56,646 - INFO - Candidate Mean Stats: {'Max': np.float64(2.834814103771553), 'Min': np.float64(-0.8370340468110997), 'Mean': np.float64(0.657644792309446), 'Std': np.float64(0.5358514574782969)}
2024-12-06 23:37:56,646 - INFO - Candidate Std Stats: {'Max': np.float64(1.6970256991818813), 'Min': np.float64(0.0), 'Mean': np.float64(0.5258581186973605), 'Std': np.float64(0.3134688944946018)}
[I 2024-12-06 23:37:56,649] Trial 313 finished with value: 1.0714285714285714 and parameters: {'x_0_0': 'ac', 'x_0_1': 'oo', 'x_1_0': 'ad', 'x_1_1': 'bc'}. Best is trial 165 with value: 0.5.
[I 2024-12-06 23:37:56,654] Trial 313 finished with value: 0.9642857142857143 and parameters: {'x_0_0': 'ab', 'x_0_1': 'oo', 'x_1_0': 'oo', 'x_1_1': 'ab'}. Best is trial 76 with value: 0.5.
[I 2024-12-06 23:37:56,660] Trial 313 finished with value: 1.25 and parameters: {'x_0_0': 'cd', 'x_0_1': 'oo', 'x_1_0': 'oo', 'x_1_1': 'ad'}. Best is trial 63 with value: 0.5.
2024-12-06 23:37:56,934 - INFO - Candidate Mean Stats: {'Max': np.float64(3.4418797710318527), 'Min': np.float64(-0.7702282218088874), 'Mean': np.float64(0.676556592673475), 'Std': np.float64(0.4993431726105194)}
2024-12-06 23:37:56,934 - INFO - Candidate Std Stats: {'Max': np.float64(1.50415712444032), 'Min': np.float64(0.0), 'Mean': np.float64(0.5324202617135998), 'Std': np.float64(0.29610229952417433)}
