[I 2024-12-06 23:37:29,830] Trial 240 finished with value: 1.0714285714285714 and parameters: {'x_0_0': 'bd', 'x_0_1': 'oo', 'x_1_0': 'ac', 'x_1_1': 'ad'}. Best is trial 23 with value: 0.5.
2024-12-06 23:37:29,989 - INFO - Candidate Mean Stats: {'Max': np.float64(2.643804387468111), 'Min': np.float64(-0.9425794137445418), 'Mean': np.float64(0.5325506057075882), 'Std': np.float64(0.58079202276355)}
2024-12-06 23:37:29,989 - INFO - Candidate Std Stats: {'Max': np.float64(1.686117030693143), 'Min': np.float64(0.0), 'Mean': np.float64(0.5711802877421042), 'Std': np.float64(0.3018505258910081)}
2024-12-06 23:37:30,002 - INFO - Candidate Mean Stats: {'Max': np.float64(2.4989060514212067), 'Min': np.float64(-1.097741484021185), 'Mean': np.float64(0.5252143250601533), 'Std': np.float64(0.5269004256496074)}
2024-12-06 23:37:30,002 - INFO - Candidate Std Stats: {'Max': np.float64(1.6917672754757251), 'Min': np.float64(0.0), 'Mean': np.float64(0.6460312509388784), 'Std': np.float64(0.3305012270355318)}
[I 2024-12-06 23:37:30,003] Trial 242 finished with value: 1.0714285714285714 and parameters: {'x_0_0': 'ad', 'x_0_1': 'oo', 'x_1_0': 'cd', 'x_1_1': 'bd'}. Best is trial 165 with value: 0.5.
[I 2024-12-06 23:37:30,015] Trial 242 finished with value: 1.0714285714285714 and parameters: {'x_0_0': 'ad', 'x_0_1': 'oo', 'x_1_0': 'cd', 'x_1_1': 'bd'}. Best is trial 76 with value: 0.5.
2024-12-06 23:37:30,017 - INFO - Candidate Mean Stats: {'Max': np.float64(2.831142295991763), 'Min': np.float64(-1.1566675493451988), 'Mean': np.float64(0.512088969758308), 'Std': np.float64(0.539141398680783)}
2024-12-06 23:37:30,017 - INFO - Candidate Std Stats: {'Max': np.float64(1.5532839410901134), 'Min': np.float64(0.0), 'Mean': np.float64(0.5605175582320601), 'Std': np.float64(0.295182985306213)}
[I 2024-12-06 23:37:30,030] Trial 242 finished with value: 1.0714285714285714 and parameters: {'x_0_0': 'ac', 'x_0_1': 'oo', 'x_1_0': 'ad', 'x_1_1': 'ac'}. Best is trial 63 with value: 0.5.
2024-12-06 23:37:30,185 - INFO - Candidate Mean Stats: {'Max': np.float64(3.0163535283243057), 'Min': np.float64(-1.4052656305734939), 'Mean': np.float64(0.44442816535708535), 'Std': np.float64(0.677373128956096)}
2024-12-06 23:37:30,186 - INFO - Candidate Std Stats: {'Max': np.float64(2.089304596107608), 'Min': np.float64(0.0), 'Mean': np.float64(0.7179505919629899), 'Std': np.float64(0.4036834585948042)}
[I 2024-12-06 23:37:30,199] Trial 241 finished with value: 0.75 and parameters: {'x_0_0': 'ac', 'x_0_1': 'ad', 'x_1_0': 'oo', 'x_1_1': 'bc'}. Best is trial 23 with value: 0.5.
2024-12-06 23:37:30,356 - INFO - Candidate Mean Stats: {'Max': np.float64(3.390600888476147), 'Min': np.float64(-0.7721713716030941), 'Mean': np.float64(0.6099336524163267), 'Std': np.float64(0.5039341747095557)}
2024-12-06 23:37:30,356 - INFO - Candidate Std Stats: {'Max': np.float64(1.5033450976429437), 'Min': np.float64(0.0), 'Mean': np.float64(0.5386796334332553), 'Std': np.float64(0.29556253634057733)}
2024-12-06 23:37:30,368 - INFO - Candidate Mean Stats: {'Max': np.float64(2.931528645517483), 'Min': np.float64(-0.9699275955159044), 'Mean': np.float64(0.45725543679602715), 'Std': np.float64(0.6038323890963816)}
2024-12-06 23:37:30,368 - INFO - Candidate Std Stats: {'Max': np.float64(1.5417078194167753), 'Min': np.float64(0.0), 'Mean': np.float64(0.5802697957196886), 'Std': np.float64(0.29716299931794227)}
[I 2024-12-06 23:37:30,370] Trial 243 finished with value: 1.0714285714285714 and parameters: {'x_0_0': 'ac', 'x_0_1': 'oo', 'x_1_0': 'bc', 'x_1_1': 'bd'}. Best is trial 165 with value: 0.5.
[I 2024-12-06 23:37:30,381] Trial 243 finished with value: 1.5714285714285714 and parameters: {'x_0_0': 'ad', 'x_0_1': 'ab', 'x_1_0': 'ad', 'x_1_1': 'cd'}. Best is trial 76 with value: 0.5.
2024-12-06 23:37:30,382 - INFO - Candidate Mean Stats: {'Max': np.float64(2.889850790516939), 'Min': np.float64(-1.1546741027284242), 'Mean': np.float64(0.4270926797154863), 'Std': np.float64(0.6323328828347892)}
2024-12-06 23:37:30,382 - INFO - Candidate Std Stats: {'Max': np.float64(2.0267258831173436), 'Min': np.float64(0.0), 'Mean': np.float64(0.7038809364313305), 'Std': np.float64(0.37456801301530873)}
[I 2024-12-06 23:37:30,395] Trial 243 finished with value: 1.4464285714285714 and parameters: {'x_0_0': 'ac', 'x_0_1': 'bd', 'x_1_0': 'cd', 'x_1_1': 'oo'}. Best is trial 63 with value: 0.5.
2024-12-06 23:37:30,554 - INFO - Candidate Mean Stats: {'Max': np.float64(2.9852507068555854), 'Min': np.float64(-0.9996751792151036), 'Mean': np.float64(0.5730261054687261), 'Std': np.float64(0.5638824223575465)}
2024-12-06 23:37:30,554 - INFO - Candidate Std Stats: {'Max': np.float64(1.4536870769470438), 'Min': np.float64(0.0), 'Mean': np.float64(0.53394730713798), 'Std': np.float64(0.27923068276655444)}
[I 2024-12-06 23:37:30,568] Trial 242 finished with value: 1.0714285714285714 and parameters: {'x_0_0': 'bc', 'x_0_1': 'oo', 'x_1_0': 'ad', 'x_1_1': 'cd'}. Best is trial 23 with value: 0.5.
2024-12-06 23:37:30,721 - INFO - Candidate Mean Stats: {'Max': np.float64(3.045711379524703), 'Min': np.float64(-0.9867766133348823), 'Mean': np.float64(0.5481459643259032), 'Std': np.float64(0.5570678406144602)}
2024-12-06 23:37:30,721 - INFO - Candidate Std Stats: {'Max': np.float64(1.6900955362569792), 'Min': np.float64(0.0), 'Mean': np.float64(0.5991766737529313), 'Std': np.float64(0.3154269378109485)}
2024-12-06 23:37:30,735 - INFO - Candidate Mean Stats: {'Max': np.float64(2.709787184595119), 'Min': np.float64(-0.8984783046405118), 'Mean': np.float64(0.47840487496995815), 'Std': np.float64(0.6039699664389542)}
2024-12-06 23:37:30,735 - INFO - Candidate Std Stats: {'Max': np.float64(2.1349931992169804), 'Min': np.float64(0.0), 'Mean': np.float64(0.6268923182367565), 'Std': np.float64(0.35227870225120766)}
[I 2024-12-06 23:37:30,735] Trial 244 finished with value: 1.0714285714285714 and parameters: {'x_0_0': 'bc', 'x_0_1': 'oo', 'x_1_0': 'cd', 'x_1_1': 'ad'}. Best is trial 165 with value: 0.5.
[I 2024-12-06 23:37:30,748] Trial 244 finished with value: 1.375 and parameters: {'x_0_0': 'oo', 'x_0_1': 'oo', 'x_1_0': 'cd', 'x_1_1': 'bc'}. Best is trial 76 with value: 0.5.
2024-12-06 23:37:30,749 - INFO - Candidate Mean Stats: {'Max': np.float64(2.5319872720127305), 'Min': np.float64(-0.9257839083304115), 'Mean': np.float64(0.6297567223637448), 'Std': np.float64(0.49497813185359074)}
2024-12-06 23:37:30,749 - INFO - Candidate Std Stats: {'Max': np.float64(1.914971882631816), 'Min': np.float64(0.0), 'Mean': np.float64(0.5300307539881701), 'Std': np.float64(0.2905604797526194)}
[I 2024-12-06 23:37:30,763] Trial 244 finished with value: 0.9464285714285714 and parameters: {'x_0_0': 'bc', 'x_0_1': 'oo', 'x_1_0': 'ab', 'x_1_1': 'oo'}. Best is trial 63 with value: 0.5.
2024-12-06 23:37:30,920 - INFO - Candidate Mean Stats: {'Max': np.float64(3.3082957433140714), 'Min': np.float64(-1.07124335867064), 'Mean': np.float64(0.5268075269815639), 'Std': np.float64(0.6194757038986591)}
2024-12-06 23:37:30,920 - INFO - Candidate Std Stats: {'Max': np.float64(1.7969990074026922), 'Min': np.float64(0.0), 'Mean': np.float64(0.5662271087981128), 'Std': np.float64(0.3080320717440729)}
[I 2024-12-06 23:37:30,933] Trial 243 finished with value: 1.2857142857142856 and parameters: {'x_0_0': 'ad', 'x_0_1': 'ac', 'x_1_0': 'bd', 'x_1_1': 'ad'}. Best is trial 23 with value: 0.5.
2024-12-06 23:37:31,088 - INFO - Candidate Mean Stats: {'Max': np.float64(2.8482371079307858), 'Min': np.float64(-0.840423600512928), 'Mean': np.float64(0.5886534696550791), 'Std': np.float64(0.5156884024720029)}
2024-12-06 23:37:31,088 - INFO - Candidate Std Stats: {'Max': np.float64(1.6247210200345583), 'Min': np.float64(0.0), 'Mean': np.float64(0.561192555241638), 'Std': np.float64(0.2987331023753048)}
[I 2024-12-06 23:37:31,102] Trial 245 finished with value: 1.0714285714285714 and parameters: {'x_0_0': 'bd', 'x_0_1': 'oo', 'x_1_0': 'ad', 'x_1_1': 'bc'}. Best is trial 165 with value: 0.5.
2024-12-06 23:37:31,103 - INFO - Candidate Mean Stats: {'Max': np.float64(3.040044760125298), 'Min': np.float64(-0.9234960323770502), 'Mean': np.float64(0.5262254521359293), 'Std': np.float64(0.5495808833472917)}
2024-12-06 23:37:31,103 - INFO - Candidate Std Stats: {'Max': np.float64(1.3874821545494282), 'Min': np.float64(0.0), 'Mean': np.float64(0.5414761059434898), 'Std': np.float64(0.27702453522766474)}
2024-12-06 23:37:31,115 - INFO - Candidate Mean Stats: {'Max': np.float64(2.9208949679887874), 'Min': np.float64(-1.1265121915541845), 'Mean': np.float64(0.6050398336784398), 'Std': np.float64(0.5409741648910732)}
2024-12-06 23:37:31,115 - INFO - Candidate Std Stats: {'Max': np.float64(1.44234386120268), 'Min': np.float64(0.0), 'Mean': np.float64(0.5346079598259863), 'Std': np.float64(0.28616736895362793)}
[I 2024-12-06 23:37:31,116] Trial 245 finished with value: 0.9285714285714286 and parameters: {'x_0_0': 'bd', 'x_0_1': 'oo', 'x_1_0': 'ab', 'x_1_1': 'bc'}. Best is trial 76 with value: 0.5.
[I 2024-12-06 23:37:31,129] Trial 245 finished with value: 1.0714285714285714 and parameters: {'x_0_0': 'ac', 'x_0_1': 'oo', 'x_1_0': 'ad', 'x_1_1': 'bd'}. Best is trial 63 with value: 0.5.
2024-12-06 23:37:31,290 - INFO - Candidate Mean Stats: {'Max': np.float64(3.52031648903208), 'Min': np.float64(-1.1019499506887864), 'Mean': np.float64(0.5226386304532037), 'Std': np.float64(0.5722971707216366)}
2024-12-06 23:37:31,290 - INFO - Candidate Std Stats: {'Max': np.float64(1.5956613866759752), 'Min': np.float64(0.0), 'Mean': np.float64(0.541090972243894), 'Std': np.float64(0.29372424053978263)}
[I 2024-12-06 23:37:31,304] Trial 244 finished with value: 1.3214285714285714 and parameters: {'x_0_0': 'bd', 'x_0_1': 'cd', 'x_1_0': 'oo', 'x_1_1': 'bc'}. Best is trial 23 with value: 0.5.
2024-12-06 23:37:31,457 - INFO - Candidate Mean Stats: {'Max': np.float64(2.792544488669727), 'Min': np.float64(-1.056698914756187), 'Mean': np.float64(0.5355634270921414), 'Std': np.float64(0.5475329700847201)}
2024-12-06 23:37:31,457 - INFO - Candidate Std Stats: {'Max': np.float64(1.6491142540503916), 'Min': np.float64(0.0), 'Mean': np.float64(0.616174197826237), 'Std': np.float64(0.3177764760391909)}
[I 2024-12-06 23:37:31,471] Trial 246 finished with value: 1.0892857142857144 and parameters: {'x_0_0': 'ab', 'x_0_1': 'oo', 'x_1_0': 'ac', 'x_1_1': 'oo'}. Best is trial 165 with value: 0.5.
2024-12-06 23:37:31,472 - INFO - Candidate Mean Stats: {'Max': np.float64(3.3852198565951235), 'Min': np.float64(-0.9653809616955504), 'Mean': np.float64(0.6188130662652552), 'Std': np.float64(0.5132473540824692)}
2024-12-06 23:37:31,472 - INFO - Candidate Std Stats: {'Max': np.float64(1.6557783902600764), 'Min': np.float64(0.0), 'Mean': np.float64(0.538844540368852), 'Std': np.float64(0.30154063083365523)}
2024-12-06 23:37:31,482 - INFO - Candidate Mean Stats: {'Max': np.float64(3.0687170411162654), 'Min': np.float64(-0.8725624108508366), 'Mean': np.float64(0.5401157808083527), 'Std': np.float64(0.588753866593993)}
2024-12-06 23:37:31,482 - INFO - Candidate Std Stats: {'Max': np.float64(1.432583932780174), 'Min': np.float64(0.0), 'Mean': np.float64(0.5311436511857561), 'Std': np.float64(0.276898100301271)}
[I 2024-12-06 23:37:31,485] Trial 246 finished with value: 1.5 and parameters: {'x_0_0': 'cd', 'x_0_1': 'oo', 'x_1_0': 'ad', 'x_1_1': 'bd'}. Best is trial 76 with value: 0.5.
[I 2024-12-06 23:37:31,495] Trial 246 finished with value: 1.25 and parameters: {'x_0_0': 'oo', 'x_0_1': 'oo', 'x_1_0': 'ad', 'x_1_1': 'oo'}. Best is trial 63 with value: 0.5.
2024-12-06 23:37:31,663 - INFO - Candidate Mean Stats: {'Max': np.float64(2.9759031069159363), 'Min': np.float64(-1.0747478495939764), 'Mean': np.float64(0.5399527733646985), 'Std': np.float64(0.5918429487098598)}
2024-12-06 23:37:31,663 - INFO - Candidate Std Stats: {'Max': np.float64(1.6652563116112895), 'Min': np.float64(0.0), 'Mean': np.float64(0.5801276697073755), 'Std': np.float64(0.31178718084379)}
[I 2024-12-06 23:37:31,677] Trial 245 finished with value: 1.0357142857142856 and parameters: {'x_0_0': 'ac', 'x_0_1': 'ad', 'x_1_0': 'oo', 'x_1_1': 'ad'}. Best is trial 23 with value: 0.5.
2024-12-06 23:37:31,825 - INFO - Candidate Mean Stats: {'Max': np.float64(3.460332416001262), 'Min': np.float64(-1.0846018244839626), 'Mean': np.float64(0.5690476836692477), 'Std': np.float64(0.5570733506268046)}
2024-12-06 23:37:31,825 - INFO - Candidate Std Stats: {'Max': np.float64(1.6939352945539359), 'Min': np.float64(0.0), 'Mean': np.float64(0.5759238267374233), 'Std': np.float64(0.3070583157013163)}
[I 2024-12-06 23:37:31,838] Trial 247 finished with value: 1.0714285714285714 and parameters: {'x_0_0': 'bc', 'x_0_1': 'oo', 'x_1_0': 'ab', 'x_1_1': 'cd'}. Best is trial 165 with value: 0.5.
2024-12-06 23:37:31,840 - INFO - Candidate Mean Stats: {'Max': np.float64(2.9350617850241414), 'Min': np.float64(-0.9363181194539791), 'Mean': np.float64(0.5469586901419738), 'Std': np.float64(0.5375409480575926)}
2024-12-06 23:37:31,840 - INFO - Candidate Std Stats: {'Max': np.float64(1.774199798957883), 'Min': np.float64(0.0), 'Mean': np.float64(0.5715393837763036), 'Std': np.float64(0.31650777320910023)}
2024-12-06 23:37:31,850 - INFO - Candidate Mean Stats: {'Max': np.float64(2.7528185537471654), 'Min': np.float64(-0.9516137513187312), 'Mean': np.float64(0.5780835864848999), 'Std': np.float64(0.4943747215027562)}
2024-12-06 23:37:31,850 - INFO - Candidate Std Stats: {'Max': np.float64(1.666482202408645), 'Min': np.float64(0.0), 'Mean': np.float64(0.5154020830108282), 'Std': np.float64(0.2804482558054335)}
[I 2024-12-06 23:37:31,853] Trial 247 finished with value: 1.5714285714285714 and parameters: {'x_0_0': 'bd', 'x_0_1': 'ac', 'x_1_0': 'cd', 'x_1_1': 'ac'}. Best is trial 76 with value: 0.5.
[I 2024-12-06 23:37:31,863] Trial 247 finished with value: 1.0714285714285714 and parameters: {'x_0_0': 'ac', 'x_0_1': 'oo', 'x_1_0': 'bd', 'x_1_1': 'ad'}. Best is trial 63 with value: 0.5.
2024-12-06 23:37:32,072 - INFO - Candidate Mean Stats: {'Max': np.float64(3.5847578161296254), 'Min': np.float64(-0.8590197280479496), 'Mean': np.float64(0.5795072697518091), 'Std': np.float64(0.5644916857896203)}
2024-12-06 23:37:32,072 - INFO - Candidate Std Stats: {'Max': np.float64(1.7280542800476233), 'Min': np.float64(0.0), 'Mean': np.float64(0.5430856324621515), 'Std': np.float64(0.29833950024341055)}
[I 2024-12-06 23:37:32,085] Trial 246 finished with value: 1.0714285714285714 and parameters: {'x_0_0': 'ad', 'x_0_1': 'oo', 'x_1_0': 'cd', 'x_1_1': 'ac'}. Best is trial 23 with value: 0.5.
2024-12-06 23:37:32,224 - INFO - Candidate Mean Stats: {'Max': np.float64(2.8972768034166934), 'Min': np.float64(-1.0755760874293219), 'Mean': np.float64(0.4814749101988047), 'Std': np.float64(0.6551900789257303)}
2024-12-06 23:37:32,224 - INFO - Candidate Std Stats: {'Max': np.float64(1.6527030987073525), 'Min': np.float64(0.0), 'Mean': np.float64(0.5935507729394071), 'Std': np.float64(0.31768639943919047)}
[I 2024-12-06 23:37:32,238] Trial 248 finished with value: 1.3214285714285714 and parameters: {'x_0_0': 'ad', 'x_0_1': 'cd', 'x_1_0': 'oo', 'x_1_1': 'ad'}. Best is trial 165 with value: 0.5.
2024-12-06 23:37:32,239 - INFO - Candidate Mean Stats: {'Max': np.float64(3.0759610467701166), 'Min': np.float64(-0.764546197519578), 'Mean': np.float64(0.595787001113705), 'Std': np.float64(0.5181900897636077)}
2024-12-06 23:37:32,239 - INFO - Candidate Std Stats: {'Max': np.float64(1.7222840483276538), 'Min': np.float64(0.0), 'Mean': np.float64(0.5983043473285775), 'Std': np.float64(0.3239049860600602)}
2024-12-06 23:37:32,250 - INFO - Candidate Mean Stats: {'Max': np.float64(2.8519408095251757), 'Min': np.float64(-0.8230216171830309), 'Mean': np.float64(0.5542908347272315), 'Std': np.float64(0.5112087059741516)}
2024-12-06 23:37:32,250 - INFO - Candidate Std Stats: {'Max': np.float64(1.691229827974272), 'Min': np.float64(0.0), 'Mean': np.float64(0.5329456540344867), 'Std': np.float64(0.2877566998741019)}
[I 2024-12-06 23:37:32,252] Trial 248 finished with value: 0.9285714285714286 and parameters: {'x_0_0': 'bd', 'x_0_1': 'oo', 'x_1_0': 'ab', 'x_1_1': 'ac'}. Best is trial 76 with value: 0.5.
[I 2024-12-06 23:37:32,264] Trial 248 finished with value: 1.2142857142857144 and parameters: {'x_0_0': 'ab', 'x_0_1': 'oo', 'x_1_0': 'cd', 'x_1_1': 'bd'}. Best is trial 63 with value: 0.5.
2024-12-06 23:37:32,438 - INFO - Candidate Mean Stats: {'Max': np.float64(3.453678370427388), 'Min': np.float64(-0.9623571730082421), 'Mean': np.float64(0.5679815131953354), 'Std': np.float64(0.5892614160185778)}
2024-12-06 23:37:32,438 - INFO - Candidate Std Stats: {'Max': np.float64(1.7400597831022278), 'Min': np.float64(0.0), 'Mean': np.float64(0.5478099831931599), 'Std': np.float64(0.30224288718741843)}
[I 2024-12-06 23:37:32,452] Trial 247 finished with value: 0.9107142857142857 and parameters: {'x_0_0': 'bc', 'x_0_1': 'ac', 'x_1_0': 'oo', 'x_1_1': 'oo'}. Best is trial 23 with value: 0.5.
2024-12-06 23:37:32,591 - INFO - Candidate Mean Stats: {'Max': np.float64(3.0060949557364047), 'Min': np.float64(-0.7732367667208495), 'Mean': np.float64(0.5471144506187605), 'Std': np.float64(0.5389626810290732)}
2024-12-06 23:37:32,591 - INFO - Candidate Std Stats: {'Max': np.float64(1.502019751671289), 'Min': np.float64(0.0), 'Mean': np.float64(0.5811807958388409), 'Std': np.float64(0.29407762569741014)}
2024-12-06 23:37:32,605 - INFO - Candidate Mean Stats: {'Max': np.float64(3.1984231172404476), 'Min': np.float64(-0.9090438188154909), 'Mean': np.float64(0.5324151188117316), 'Std': np.float64(0.5523289534900063)}
2024-12-06 23:37:32,605 - INFO - Candidate Std Stats: {'Max': np.float64(1.520542763868165), 'Min': np.float64(0.0), 'Mean': np.float64(0.5931130863845294), 'Std': np.float64(0.2989146864992661)}
[I 2024-12-06 23:37:32,605] Trial 249 finished with value: 1.0714285714285714 and parameters: {'x_0_0': 'bd', 'x_0_1': 'oo', 'x_1_0': 'ad', 'x_1_1': 'ac'}. Best is trial 165 with value: 0.5.
2024-12-06 23:37:32,617 - INFO - Candidate Mean Stats: {'Max': np.float64(2.6492596735733045), 'Min': np.float64(-0.9457275230914138), 'Mean': np.float64(0.5147240206863544), 'Std': np.float64(0.5219133761166488)}
2024-12-06 23:37:32,617 - INFO - Candidate Std Stats: {'Max': np.float64(1.810771642123635), 'Min': np.float64(0.0), 'Mean': np.float64(0.6049983922962039), 'Std': np.float64(0.3282936216723141)}
[I 2024-12-06 23:37:32,618] Trial 249 finished with value: 1.375 and parameters: {'x_0_0': 'oo', 'x_0_1': 'oo', 'x_1_0': 'cd', 'x_1_1': 'cd'}. Best is trial 76 with value: 0.5.
[I 2024-12-06 23:37:32,630] Trial 249 finished with value: 0.9464285714285714 and parameters: {'x_0_0': 'ac', 'x_0_1': 'oo', 'x_1_0': 'ac', 'x_1_1': 'oo'}. Best is trial 63 with value: 0.5.
2024-12-06 23:37:32,805 - INFO - Candidate Mean Stats: {'Max': np.float64(3.1875066148347786), 'Min': np.float64(-1.0813296664977243), 'Mean': np.float64(0.5496312060387007), 'Std': np.float64(0.6021651359028267)}
2024-12-06 23:37:32,806 - INFO - Candidate Std Stats: {'Max': np.float64(1.6330482635346317), 'Min': np.float64(0.0), 'Mean': np.float64(0.5577943214723428), 'Std': np.float64(0.2886640005168111)}
[I 2024-12-06 23:37:32,819] Trial 248 finished with value: 1.2857142857142856 and parameters: {'x_0_0': 'ac', 'x_0_1': 'ad', 'x_1_0': 'ab', 'x_1_1': 'ad'}. Best is trial 23 with value: 0.5.
2024-12-06 23:37:32,959 - INFO - Candidate Mean Stats: {'Max': np.float64(2.886020588269149), 'Min': np.float64(-1.0881728790054628), 'Mean': np.float64(0.5228931305347437), 'Std': np.float64(0.5952246946585917)}
2024-12-06 23:37:32,960 - INFO - Candidate Std Stats: {'Max': np.float64(1.6637916854470827), 'Min': np.float64(0.0), 'Mean': np.float64(0.5836453912033372), 'Std': np.float64(0.29670367020104194)}
2024-12-06 23:37:32,972 - INFO - Candidate Mean Stats: {'Max': np.float64(2.8346020083929004), 'Min': np.float64(-0.8159942510527628), 'Mean': np.float64(0.6549060158371965), 'Std': np.float64(0.510105278622213)}
2024-12-06 23:37:32,972 - INFO - Candidate Std Stats: {'Max': np.float64(1.4684952107737175), 'Min': np.float64(0.0), 'Mean': np.float64(0.4911965906183192), 'Std': np.float64(0.25389541280754696)}
[I 2024-12-06 23:37:32,973] Trial 250 finished with value: 1.2142857142857144 and parameters: {'x_0_0': 'ab', 'x_0_1': 'oo', 'x_1_0': 'bd', 'x_1_1': 'ad'}. Best is trial 165 with value: 0.5.
2024-12-06 23:37:32,984 - INFO - Candidate Mean Stats: {'Max': np.float64(3.036761781920009), 'Min': np.float64(-1.2539459585302897), 'Mean': np.float64(0.5625425517347257), 'Std': np.float64(0.5419378912502302)}
2024-12-06 23:37:32,984 - INFO - Candidate Std Stats: {'Max': np.float64(1.85096101755252), 'Min': np.float64(0.0), 'Mean': np.float64(0.5483612480305087), 'Std': np.float64(0.29464403398877737)}
[I 2024-12-06 23:37:32,985] Trial 250 finished with value: 0.9642857142857143 and parameters: {'x_0_0': 'ab', 'x_0_1': 'oo', 'x_1_0': 'oo', 'x_1_1': 'bc'}. Best is trial 76 with value: 0.5.
[I 2024-12-06 23:37:32,997] Trial 250 finished with value: 0.9642857142857143 and parameters: {'x_0_0': 'ab', 'x_0_1': 'oo', 'x_1_0': 'oo', 'x_1_1': 'ac'}. Best is trial 63 with value: 0.5.
2024-12-06 23:37:33,175 - INFO - Candidate Mean Stats: {'Max': np.float64(3.1947010532322713), 'Min': np.float64(-0.8632238595787621), 'Mean': np.float64(0.5719869926987023), 'Std': np.float64(0.5658488490665549)}
2024-12-06 23:37:33,175 - INFO - Candidate Std Stats: {'Max': np.float64(1.4782505875037224), 'Min': np.float64(0.0), 'Mean': np.float64(0.5141315592579929), 'Std': np.float64(0.27061931344873785)}
