[I 2024-12-06 23:36:42,877] Trial 115 finished with value: 1.5 and parameters: {'x_0_0': 'cd', 'x_0_1': 'oo', 'x_1_0': 'bd', 'x_1_1': 'bc'}. Best is trial 50 with value: 0.6607142857142857.
2024-12-06 23:36:43,185 - INFO - Candidate Mean Stats: {'Max': np.float64(2.304109583225805), 'Min': np.float64(-1.0667014377220443), 'Mean': np.float64(0.43028144114678607), 'Std': np.float64(0.4767292980781696)}
2024-12-06 23:36:43,185 - INFO - Candidate Std Stats: {'Max': np.float64(1.8652972903727665), 'Min': np.float64(0.0), 'Mean': np.float64(0.5400257479085846), 'Std': np.float64(0.256376546485173)}
[I 2024-12-06 23:36:43,197] Trial 115 finished with value: 0.9642857142857143 and parameters: {'x_0_0': 'ab', 'x_0_1': 'oo', 'x_1_0': 'oo', 'x_1_1': 'ac'}. Best is trial 23 with value: 0.5.
2024-12-06 23:36:43,222 - INFO - Candidate Mean Stats: {'Max': np.float64(2.4841669234836345), 'Min': np.float64(-1.1679899197216401), 'Mean': np.float64(0.364435295934822), 'Std': np.float64(0.5435983417539888)}
2024-12-06 23:36:43,222 - INFO - Candidate Std Stats: {'Max': np.float64(1.6635161647010253), 'Min': np.float64(0.0), 'Mean': np.float64(0.5982632830770346), 'Std': np.float64(0.27677586428648315)}
2024-12-06 23:36:43,227 - INFO - Candidate Mean Stats: {'Max': np.float64(2.3680899175734225), 'Min': np.float64(-1.0840854470147723), 'Mean': np.float64(0.401217601576184), 'Std': np.float64(0.4847493086245826)}
2024-12-06 23:36:43,227 - INFO - Candidate Std Stats: {'Max': np.float64(1.450392243862516), 'Min': np.float64(0.0), 'Mean': np.float64(0.5610830915727552), 'Std': np.float64(0.24529800500157684)}
[I 2024-12-06 23:36:43,235] Trial 116 finished with value: 0.9285714285714286 and parameters: {'x_0_0': 'ad', 'x_0_1': 'oo', 'x_1_0': 'ab', 'x_1_1': 'ac'}. Best is trial 76 with value: 0.5.
[I 2024-12-06 23:36:43,240] Trial 116 finished with value: 0.7857142857142857 and parameters: {'x_0_0': 'ad', 'x_0_1': 'oo', 'x_1_0': 'bd', 'x_1_1': 'bc'}. Best is trial 63 with value: 0.5.
2024-12-06 23:36:43,244 - INFO - Candidate Mean Stats: {'Max': np.float64(2.4807885499627567), 'Min': np.float64(-1.0101085061489292), 'Mean': np.float64(0.30514501207895117), 'Std': np.float64(0.5551439820697377)}
2024-12-06 23:36:43,244 - INFO - Candidate Std Stats: {'Max': np.float64(1.796570476140273), 'Min': np.float64(0.0), 'Mean': np.float64(0.6529242021785461), 'Std': np.float64(0.29948884591841407)}
[I 2024-12-06 23:36:43,257] Trial 116 finished with value: 0.7857142857142857 and parameters: {'x_0_0': 'bd', 'x_0_1': 'oo', 'x_1_0': 'bd', 'x_1_1': 'ad'}. Best is trial 50 with value: 0.6607142857142857.
2024-12-06 23:36:43,567 - INFO - Candidate Mean Stats: {'Max': np.float64(2.394738307194424), 'Min': np.float64(-1.0229067360694883), 'Mean': np.float64(0.4618765779715586), 'Std': np.float64(0.4626054201181481)}
2024-12-06 23:36:43,567 - INFO - Candidate Std Stats: {'Max': np.float64(1.3753551180252634), 'Min': np.float64(0.0), 'Mean': np.float64(0.5678681855801249), 'Std': np.float64(0.2468056394679201)}
[I 2024-12-06 23:36:43,581] Trial 116 finished with value: 1.0714285714285714 and parameters: {'x_0_0': 'ac', 'x_0_1': 'oo', 'x_1_0': 'ac', 'x_1_1': 'bc'}. Best is trial 23 with value: 0.5.
2024-12-06 23:36:43,596 - INFO - Candidate Mean Stats: {'Max': np.float64(2.5339251617927223), 'Min': np.float64(-1.039258359497012), 'Mean': np.float64(0.36889911532939573), 'Std': np.float64(0.49952249399601495)}
2024-12-06 23:36:43,596 - INFO - Candidate Std Stats: {'Max': np.float64(1.6352941320351368), 'Min': np.float64(0.0), 'Mean': np.float64(0.5776343924749776), 'Std': np.float64(0.2570180870236137)}
2024-12-06 23:36:43,604 - INFO - Candidate Mean Stats: {'Max': np.float64(2.413423672043875), 'Min': np.float64(-1.0860634601235177), 'Mean': np.float64(0.3459514386173913), 'Std': np.float64(0.5329709659047298)}
2024-12-06 23:36:43,604 - INFO - Candidate Std Stats: {'Max': np.float64(1.7608601784543807), 'Min': np.float64(0.0), 'Mean': np.float64(0.5959646415721735), 'Std': np.float64(0.2736311795550717)}
[I 2024-12-06 23:36:43,613] Trial 117 finished with value: 1.2142857142857144 and parameters: {'x_0_0': 'ab', 'x_0_1': 'oo', 'x_1_0': 'bc', 'x_1_1': 'cd'}. Best is trial 63 with value: 0.5.
[I 2024-12-06 23:36:43,622] Trial 117 finished with value: 1.0714285714285714 and parameters: {'x_0_0': 'bc', 'x_0_1': 'oo', 'x_1_0': 'cd', 'x_1_1': 'bc'}. Best is trial 76 with value: 0.5.
2024-12-06 23:36:43,627 - INFO - Candidate Mean Stats: {'Max': np.float64(2.614166889423332), 'Min': np.float64(-1.2762486280146021), 'Mean': np.float64(0.37092017992247983), 'Std': np.float64(0.5162790840533176)}
2024-12-06 23:36:43,627 - INFO - Candidate Std Stats: {'Max': np.float64(1.5732843243601986), 'Min': np.float64(0.0), 'Mean': np.float64(0.5807130306564521), 'Std': np.float64(0.27564211630594604)}
[I 2024-12-06 23:36:43,642] Trial 117 finished with value: 0.7857142857142857 and parameters: {'x_0_0': 'bd', 'x_0_1': 'oo', 'x_1_0': 'bc', 'x_1_1': 'bd'}. Best is trial 50 with value: 0.6607142857142857.
2024-12-06 23:36:43,946 - INFO - Candidate Mean Stats: {'Max': np.float64(2.4756418567655514), 'Min': np.float64(-0.688505241470994), 'Mean': np.float64(0.41555743688364694), 'Std': np.float64(0.48117459355613246)}
2024-12-06 23:36:43,946 - INFO - Candidate Std Stats: {'Max': np.float64(1.3355833426237063), 'Min': np.float64(0.0), 'Mean': np.float64(0.5013569728475751), 'Std': np.float64(0.2280455278919305)}
[I 2024-12-06 23:36:43,959] Trial 117 finished with value: 1.0714285714285714 and parameters: {'x_0_0': 'ac', 'x_0_1': 'oo', 'x_1_0': 'ab', 'x_1_1': 'cd'}. Best is trial 23 with value: 0.5.
2024-12-06 23:36:43,969 - INFO - Candidate Mean Stats: {'Max': np.float64(2.066156997853685), 'Min': np.float64(-1.0898875437150681), 'Mean': np.float64(0.3620193980369689), 'Std': np.float64(0.5053070468564969)}
2024-12-06 23:36:43,969 - INFO - Candidate Std Stats: {'Max': np.float64(1.6360888451466085), 'Min': np.float64(0.0), 'Mean': np.float64(0.5899538703948186), 'Std': np.float64(0.28281624878961104)}
2024-12-06 23:36:43,969 - INFO - Candidate Mean Stats: {'Max': np.float64(2.6961419963982673), 'Min': np.float64(-0.9906939831346498), 'Mean': np.float64(0.3860953069510642), 'Std': np.float64(0.53543735914156)}
2024-12-06 23:36:43,969 - INFO - Candidate Std Stats: {'Max': np.float64(1.669079950214159), 'Min': np.float64(0.0), 'Mean': np.float64(0.5647353956686703), 'Std': np.float64(0.2589037043301397)}
[I 2024-12-06 23:36:43,982] Trial 118 finished with value: 1.0714285714285714 and parameters: {'x_0_0': 'bc', 'x_0_1': 'oo', 'x_1_0': 'ab', 'x_1_1': 'cd'}. Best is trial 63 with value: 0.5.
[I 2024-12-06 23:36:43,982] Trial 118 finished with value: 1.0714285714285714 and parameters: {'x_0_0': 'ac', 'x_0_1': 'oo', 'x_1_0': 'ac', 'x_1_1': 'bc'}. Best is trial 76 with value: 0.5.
2024-12-06 23:36:43,991 - INFO - Candidate Mean Stats: {'Max': np.float64(2.34777315824821), 'Min': np.float64(-1.061532755223343), 'Mean': np.float64(0.4076307717335142), 'Std': np.float64(0.47392442817941144)}
2024-12-06 23:36:43,991 - INFO - Candidate Std Stats: {'Max': np.float64(1.4824804123814923), 'Min': np.float64(0.0), 'Mean': np.float64(0.5194529613424356), 'Std': np.float64(0.24075118633489898)}
[I 2024-12-06 23:36:44,003] Trial 118 finished with value: 0.8035714285714286 and parameters: {'x_0_0': 'ad', 'x_0_1': 'oo', 'x_1_0': 'ab', 'x_1_1': 'oo'}. Best is trial 50 with value: 0.6607142857142857.
2024-12-06 23:36:44,288 - INFO - Candidate Mean Stats: {'Max': np.float64(2.534930947686169), 'Min': np.float64(-1.2081516665476775), 'Mean': np.float64(0.38259690484891273), 'Std': np.float64(0.5133290126805687)}
2024-12-06 23:36:44,288 - INFO - Candidate Std Stats: {'Max': np.float64(1.690830177916272), 'Min': np.float64(0.0), 'Mean': np.float64(0.6112923292435448), 'Std': np.float64(0.29219488963702916)}
[I 2024-12-06 23:36:44,305] Trial 118 finished with value: 1.0714285714285714 and parameters: {'x_0_0': 'ad', 'x_0_1': 'oo', 'x_1_0': 'ac', 'x_1_1': 'ac'}. Best is trial 23 with value: 0.5.
2024-12-06 23:36:44,307 - INFO - Candidate Mean Stats: {'Max': np.float64(2.435606635529809), 'Min': np.float64(-0.8473255642072612), 'Mean': np.float64(0.4095540601857877), 'Std': np.float64(0.4498942025011796)}
2024-12-06 23:36:44,307 - INFO - Candidate Std Stats: {'Max': np.float64(1.8033253751574303), 'Min': np.float64(0.0), 'Mean': np.float64(0.5606819086124603), 'Std': np.float64(0.26335171790773415)}
2024-12-06 23:36:44,311 - INFO - Candidate Mean Stats: {'Max': np.float64(2.8437374572754637), 'Min': np.float64(-1.2899660880182737), 'Mean': np.float64(0.2937171940344138), 'Std': np.float64(0.6027925132322202)}
2024-12-06 23:36:44,311 - INFO - Candidate Std Stats: {'Max': np.float64(1.765749939435256), 'Min': np.float64(0.0), 'Mean': np.float64(0.6369922590918459), 'Std': np.float64(0.29461935179973114)}
[I 2024-12-06 23:36:44,320] Trial 119 finished with value: 1.25 and parameters: {'x_0_0': 'oo', 'x_0_1': 'oo', 'x_1_0': 'ac', 'x_1_1': 'oo'}. Best is trial 63 with value: 0.5.
[I 2024-12-06 23:36:44,325] Trial 119 finished with value: 1.0714285714285714 and parameters: {'x_0_0': 'bc', 'x_0_1': 'oo', 'x_1_0': 'ad', 'x_1_1': 'bd'}. Best is trial 76 with value: 0.5.
2024-12-06 23:36:44,332 - INFO - Candidate Mean Stats: {'Max': np.float64(2.293272278630753), 'Min': np.float64(-1.2309425876446687), 'Mean': np.float64(0.36534867556810047), 'Std': np.float64(0.5180487691611505)}
2024-12-06 23:36:44,332 - INFO - Candidate Std Stats: {'Max': np.float64(1.5852184293264495), 'Min': np.float64(0.0), 'Mean': np.float64(0.6084879433170473), 'Std': np.float64(0.27341351841965156)}
[I 2024-12-06 23:36:44,347] Trial 119 finished with value: 0.8035714285714286 and parameters: {'x_0_0': 'bd', 'x_0_1': 'oo', 'x_1_0': 'ab', 'x_1_1': 'oo'}. Best is trial 50 with value: 0.6607142857142857.
2024-12-06 23:36:44,661 - INFO - Candidate Mean Stats: {'Max': np.float64(2.653109744282294), 'Min': np.float64(-1.101797390828309), 'Mean': np.float64(0.4115752120619409), 'Std': np.float64(0.511488707450645)}
2024-12-06 23:36:44,661 - INFO - Candidate Std Stats: {'Max': np.float64(1.5969521082502516), 'Min': np.float64(0.0), 'Mean': np.float64(0.5482356460034087), 'Std': np.float64(0.2545502289452588)}
2024-12-06 23:36:44,674 - INFO - Candidate Mean Stats: {'Max': np.float64(2.3953001248722363), 'Min': np.float64(-1.1730189100267208), 'Mean': np.float64(0.30863857759225705), 'Std': np.float64(0.5185065658422865)}
2024-12-06 23:36:44,674 - INFO - Candidate Std Stats: {'Max': np.float64(1.5430783827894226), 'Min': np.float64(0.0), 'Mean': np.float64(0.5695394051791519), 'Std': np.float64(0.2601265731777222)}
[I 2024-12-06 23:36:44,676] Trial 119 finished with value: 1.5714285714285714 and parameters: {'x_0_0': 'bc', 'x_0_1': 'cd', 'x_1_0': 'ab', 'x_1_1': 'ac'}. Best is trial 23 with value: 0.5.
2024-12-06 23:36:44,684 - INFO - Candidate Mean Stats: {'Max': np.float64(2.5269047375469063), 'Min': np.float64(-0.9231378821319585), 'Mean': np.float64(0.3788022474123973), 'Std': np.float64(0.5089848120812538)}
2024-12-06 23:36:44,684 - INFO - Candidate Std Stats: {'Max': np.float64(1.7885366987759088), 'Min': np.float64(0.0), 'Mean': np.float64(0.6054924133328334), 'Std': np.float64(0.2842140411125839)}
[I 2024-12-06 23:36:44,688] Trial 120 finished with value: 0.8214285714285714 and parameters: {'x_0_0': 'bd', 'x_0_1': 'oo', 'x_1_0': 'oo', 'x_1_1': 'bc'}. Best is trial 63 with value: 0.5.
[I 2024-12-06 23:36:44,697] Trial 120 finished with value: 0.6428571428571428 and parameters: {'x_0_0': 'ad', 'x_0_1': 'oo', 'x_1_0': 'bc', 'x_1_1': 'ab'}. Best is trial 76 with value: 0.5.
2024-12-06 23:36:44,700 - INFO - Candidate Mean Stats: {'Max': np.float64(2.989690873063484), 'Min': np.float64(-1.140992558639908), 'Mean': np.float64(0.4080342664262446), 'Std': np.float64(0.4958285273162372)}
2024-12-06 23:36:44,700 - INFO - Candidate Std Stats: {'Max': np.float64(1.8275884701114793), 'Min': np.float64(0.0), 'Mean': np.float64(0.596229566057947), 'Std': np.float64(0.27629611384813924)}
[I 2024-12-06 23:36:44,715] Trial 120 finished with value: 1.375 and parameters: {'x_0_0': 'oo', 'x_0_1': 'oo', 'x_1_0': 'ad', 'x_1_1': 'bc'}. Best is trial 50 with value: 0.6607142857142857.
2024-12-06 23:36:45,060 - INFO - Candidate Mean Stats: {'Max': np.float64(2.4560408587333344), 'Min': np.float64(-0.9667939687733156), 'Mean': np.float64(0.476488126742711), 'Std': np.float64(0.48042903676376764)}
2024-12-06 23:36:45,060 - INFO - Candidate Std Stats: {'Max': np.float64(1.7349304107043337), 'Min': np.float64(0.0), 'Mean': np.float64(0.5080127758436402), 'Std': np.float64(0.2549148665291055)}
[I 2024-12-06 23:36:45,073] Trial 120 finished with value: 1.0714285714285714 and parameters: {'x_0_0': 'bd', 'x_0_1': 'oo', 'x_1_0': 'ad', 'x_1_1': 'ac'}. Best is trial 23 with value: 0.5.
2024-12-06 23:36:45,075 - INFO - Candidate Mean Stats: {'Max': np.float64(2.317123717468408), 'Min': np.float64(-1.4343496422471897), 'Mean': np.float64(0.29307411036182507), 'Std': np.float64(0.5455122859239768)}
2024-12-06 23:36:45,075 - INFO - Candidate Std Stats: {'Max': np.float64(2.183060598103844), 'Min': np.float64(0.0), 'Mean': np.float64(0.7400618331823431), 'Std': np.float64(0.34768486972318685)}
2024-12-06 23:36:45,082 - INFO - Candidate Mean Stats: {'Max': np.float64(2.739824797635386), 'Min': np.float64(-1.2851358633860757), 'Mean': np.float64(0.37265407189620803), 'Std': np.float64(0.5463690746812948)}
2024-12-06 23:36:45,083 - INFO - Candidate Std Stats: {'Max': np.float64(1.5641025423389128), 'Min': np.float64(0.0), 'Mean': np.float64(0.6008064422107634), 'Std': np.float64(0.2690089849831456)}
[I 2024-12-06 23:36:45,088] Trial 121 finished with value: 0.7857142857142857 and parameters: {'x_0_0': 'bd', 'x_0_1': 'oo', 'x_1_0': 'bd', 'x_1_1': 'cd'}. Best is trial 63 with value: 0.5.
2024-12-06 23:36:45,092 - INFO - Candidate Mean Stats: {'Max': np.float64(2.3749805729603244), 'Min': np.float64(-1.1819922707739088), 'Mean': np.float64(0.40113520798576535), 'Std': np.float64(0.481917699673691)}
2024-12-06 23:36:45,093 - INFO - Candidate Std Stats: {'Max': np.float64(1.5414650847947213), 'Min': np.float64(0.0), 'Mean': np.float64(0.6052362967657324), 'Std': np.float64(0.2763608603176122)}
[I 2024-12-06 23:36:45,096] Trial 121 finished with value: 1.0714285714285714 and parameters: {'x_0_0': 'ad', 'x_0_1': 'oo', 'x_1_0': 'ad', 'x_1_1': 'cd'}. Best is trial 76 with value: 0.5.
[I 2024-12-06 23:36:45,105] Trial 121 finished with value: 1.0714285714285714 and parameters: {'x_0_0': 'bc', 'x_0_1': 'oo', 'x_1_0': 'ac', 'x_1_1': 'bd'}. Best is trial 50 with value: 0.6607142857142857.
2024-12-06 23:36:45,406 - INFO - Candidate Mean Stats: {'Max': np.float64(2.5845431825967755), 'Min': np.float64(-0.7619980223745491), 'Mean': np.float64(0.4704852220712971), 'Std': np.float64(0.4650950929147747)}
2024-12-06 23:36:45,406 - INFO - Candidate Std Stats: {'Max': np.float64(1.7546021916931889), 'Min': np.float64(0.0), 'Mean': np.float64(0.5623892011714455), 'Std': np.float64(0.26277015918044544)}
2024-12-06 23:36:45,414 - INFO - Candidate Mean Stats: {'Max': np.float64(2.0576209684901667), 'Min': np.float64(-0.8833714569686739), 'Mean': np.float64(0.40388861675661597), 'Std': np.float64(0.4662368274472212)}
2024-12-06 23:36:45,414 - INFO - Candidate Std Stats: {'Max': np.float64(1.5003243081086355), 'Min': np.float64(0.0), 'Mean': np.float64(0.5327304533729433), 'Std': np.float64(0.24468310249551103)}
[I 2024-12-06 23:36:45,421] Trial 121 finished with value: 0.8214285714285714 and parameters: {'x_0_0': 'ac', 'x_0_1': 'oo', 'x_1_0': 'oo', 'x_1_1': 'ab'}. Best is trial 23 with value: 0.5.
[I 2024-12-06 23:36:45,428] Trial 122 finished with value: 1.0714285714285714 and parameters: {'x_0_0': 'ac', 'x_0_1': 'oo', 'x_1_0': 'bc', 'x_1_1': 'bc'}. Best is trial 63 with value: 0.5.
2024-12-06 23:36:45,431 - INFO - Candidate Mean Stats: {'Max': np.float64(2.658374714432953), 'Min': np.float64(-1.2205152207719692), 'Mean': np.float64(0.4095117100154692), 'Std': np.float64(0.521099877116325)}
2024-12-06 23:36:45,431 - INFO - Candidate Std Stats: {'Max': np.float64(1.5694598446929315), 'Min': np.float64(0.0), 'Mean': np.float64(0.5675376481234096), 'Std': np.float64(0.2674024889788408)}
2024-12-06 23:36:45,438 - INFO - Candidate Mean Stats: {'Max': np.float64(2.391440019150478), 'Min': np.float64(-1.0951588812848736), 'Mean': np.float64(0.3570343104694107), 'Std': np.float64(0.4949215854956066)}
2024-12-06 23:36:45,438 - INFO - Candidate Std Stats: {'Max': np.float64(1.5803284881990955), 'Min': np.float64(0.0), 'Mean': np.float64(0.613843735734312), 'Std': np.float64(0.2745706244482559)}
[I 2024-12-06 23:36:45,445] Trial 122 finished with value: 1.0714285714285714 and parameters: {'x_0_0': 'ac', 'x_0_1': 'oo', 'x_1_0': 'bc', 'x_1_1': 'ab'}. Best is trial 76 with value: 0.5.
[I 2024-12-06 23:36:45,451] Trial 122 finished with value: 0.8214285714285714 and parameters: {'x_0_0': 'ac', 'x_0_1': 'oo', 'x_1_0': 'oo', 'x_1_1': 'ad'}. Best is trial 50 with value: 0.6607142857142857.
2024-12-06 23:36:45,768 - INFO - Candidate Mean Stats: {'Max': np.float64(2.220088557517415), 'Min': np.float64(-1.435413543679432), 'Mean': np.float64(0.3436924160601401), 'Std': np.float64(0.5476260187010727)}
2024-12-06 23:36:45,768 - INFO - Candidate Std Stats: {'Max': np.float64(1.864133134542742), 'Min': np.float64(0.0), 'Mean': np.float64(0.6693613605701456), 'Std': np.float64(0.30158468736166993)}
2024-12-06 23:36:45,776 - INFO - Candidate Mean Stats: {'Max': np.float64(2.317833233009418), 'Min': np.float64(-1.2192958491520787), 'Mean': np.float64(0.3122387146322329), 'Std': np.float64(0.5748470751434928)}
2024-12-06 23:36:45,776 - INFO - Candidate Std Stats: {'Max': np.float64(1.9221591702986087), 'Min': np.float64(0.0), 'Mean': np.float64(0.6543557139644623), 'Std': np.float64(0.3051643567893418)}
[I 2024-12-06 23:36:45,782] Trial 122 finished with value: 1.0714285714285714 and parameters: {'x_0_0': 'ac', 'x_0_1': 'oo', 'x_1_0': 'ad', 'x_1_1': 'bd'}. Best is trial 23 with value: 0.5.
2024-12-06 23:36:45,788 - INFO - Candidate Mean Stats: {'Max': np.float64(2.5584927307543275), 'Min': np.float64(-1.2553684908200795), 'Mean': np.float64(0.28137287843577174), 'Std': np.float64(0.6279825511603226)}
2024-12-06 23:36:45,788 - INFO - Candidate Std Stats: {'Max': np.float64(1.8002217559239553), 'Min': np.float64(0.0), 'Mean': np.float64(0.6284788596215387), 'Std': np.float64(0.2834405242181456)}
[I 2024-12-06 23:36:45,789] Trial 123 finished with value: 1.5714285714285714 and parameters: {'x_0_0': 'bc', 'x_0_1': 'cd', 'x_1_0': 'ac', 'x_1_1': 'ac'}. Best is trial 63 with value: 0.5.
2024-12-06 23:36:45,796 - INFO - Candidate Mean Stats: {'Max': np.float64(2.269447656080056), 'Min': np.float64(-0.9732414713863455), 'Mean': np.float64(0.4352966077135252), 'Std': np.float64(0.4833365405168109)}
2024-12-06 23:36:45,796 - INFO - Candidate Std Stats: {'Max': np.float64(1.4684640081791807), 'Min': np.float64(0.0), 'Mean': np.float64(0.5190075884118183), 'Std': np.float64(0.24288648971380283)}
[I 2024-12-06 23:36:45,801] Trial 123 finished with value: 1.0357142857142856 and parameters: {'x_0_0': 'bc', 'x_0_1': 'ac', 'x_1_0': 'oo', 'x_1_1': 'ab'}. Best is trial 76 with value: 0.5.
[I 2024-12-06 23:36:45,809] Trial 123 finished with value: 1.5 and parameters: {'x_0_0': 'cd', 'x_0_1': 'oo', 'x_1_0': 'cd', 'x_1_1': 'ad'}. Best is trial 50 with value: 0.6607142857142857.
2024-12-06 23:36:46,126 - INFO - Candidate Mean Stats: {'Max': np.float64(2.194901222664482), 'Min': np.float64(-0.9625554629218518), 'Mean': np.float64(0.38060696546046774), 'Std': np.float64(0.4783207478470745)}
2024-12-06 23:36:46,126 - INFO - Candidate Std Stats: {'Max': np.float64(1.4768151341211153), 'Min': np.float64(0.0), 'Mean': np.float64(0.5130298333965656), 'Std': np.float64(0.24798149401387629)}
2024-12-06 23:36:46,137 - INFO - Candidate Mean Stats: {'Max': np.float64(2.792714214454789), 'Min': np.float64(-0.9075416414244), 'Mean': np.float64(0.42204862745642996), 'Std': np.float64(0.4938952154678475)}
2024-12-06 23:36:46,137 - INFO - Candidate Std Stats: {'Max': np.float64(1.7826153152703064), 'Min': np.float64(0.0), 'Mean': np.float64(0.5226784082221271), 'Std': np.float64(0.2570040667133172)}
[I 2024-12-06 23:36:46,139] Trial 123 finished with value: 1.0714285714285714 and parameters: {'x_0_0': 'bd', 'x_0_1': 'oo', 'x_1_0': 'ad', 'x_1_1': 'bc'}. Best is trial 23 with value: 0.5.
2024-12-06 23:36:46,140 - INFO - Candidate Mean Stats: {'Max': np.float64(2.683092567246291), 'Min': np.float64(-1.1443681712372846), 'Mean': np.float64(0.40984408697000857), 'Std': np.float64(0.5365470912510225)}
2024-12-06 23:36:46,140 - INFO - Candidate Std Stats: {'Max': np.float64(1.6565063044767232), 'Min': np.float64(0.0), 'Mean': np.float64(0.6070350465495521), 'Std': np.float64(0.29011717266092496)}
[I 2024-12-06 23:36:46,150] Trial 124 finished with value: 1.0714285714285714 and parameters: {'x_0_0': 'bd', 'x_0_1': 'oo', 'x_1_0': 'cd', 'x_1_1': 'bd'}. Best is trial 63 with value: 0.5.
[I 2024-12-06 23:36:46,152] Trial 124 finished with value: 1.375 and parameters: {'x_0_0': 'oo', 'x_0_1': 'oo', 'x_1_0': 'ac', 'x_1_1': 'bc'}. Best is trial 76 with value: 0.5.
2024-12-06 23:36:46,157 - INFO - Candidate Mean Stats: {'Max': np.float64(2.49476171017347), 'Min': np.float64(-1.285146448141733), 'Mean': np.float64(0.373126568685492), 'Std': np.float64(0.5445836010963252)}
2024-12-06 23:36:46,157 - INFO - Candidate Std Stats: {'Max': np.float64(1.710436771772324), 'Min': np.float64(0.0), 'Mean': np.float64(0.5830170459065971), 'Std': np.float64(0.27342180044132136)}
