[I 2024-12-06 23:39:05,382] Trial 476 finished with value: 1.25 and parameters: {'x_0_0': 'cd', 'x_0_1': 'oo', 'x_1_0': 'oo', 'x_1_1': 'bc'}. Best is trial 165 with value: 0.5.
2024-12-06 23:39:05,504 - INFO - Candidate Mean Stats: {'Max': np.float64(2.991381334560485), 'Min': np.float64(-0.26925292914140925), 'Mean': np.float64(0.8081876288155676), 'Std': np.float64(0.46429396647577026)}
2024-12-06 23:39:05,505 - INFO - Candidate Std Stats: {'Max': np.float64(1.3062066781800024), 'Min': np.float64(0.0), 'Mean': np.float64(0.45439614592940275), 'Std': np.float64(0.2984801511017251)}
[I 2024-12-06 23:39:05,521] Trial 476 finished with value: 1.4464285714285714 and parameters: {'x_0_0': 'bd', 'x_0_1': 'bc', 'x_1_0': 'cd', 'x_1_1': 'oo'}. Best is trial 63 with value: 0.5.
2024-12-06 23:39:05,852 - INFO - Candidate Mean Stats: {'Max': np.float64(2.8964350740312694), 'Min': np.float64(-0.6018167503259232), 'Mean': np.float64(0.8505628062701979), 'Std': np.float64(0.4958708370508738)}
2024-12-06 23:39:05,852 - INFO - Candidate Std Stats: {'Max': np.float64(1.3843264401912667), 'Min': np.float64(0.0), 'Mean': np.float64(0.43684961437730774), 'Std': np.float64(0.2956344121917262)}
[I 2024-12-06 23:39:05,870] Trial 474 finished with value: 1.1607142857142856 and parameters: {'x_0_0': 'bd', 'x_0_1': 'ad', 'x_1_0': 'bd', 'x_1_1': 'oo'}. Best is trial 23 with value: 0.5.
2024-12-06 23:39:05,903 - INFO - Candidate Mean Stats: {'Max': np.float64(2.93227175819477), 'Min': np.float64(-0.3442250538910646), 'Mean': np.float64(0.8693964592888455), 'Std': np.float64(0.443079672745794)}
2024-12-06 23:39:05,904 - INFO - Candidate Std Stats: {'Max': np.float64(1.8663789193306723), 'Min': np.float64(0.0), 'Mean': np.float64(0.4037302759128743), 'Std': np.float64(0.29403528036563503)}
2024-12-06 23:39:05,906 - INFO - Candidate Mean Stats: {'Max': np.float64(3.203786584947133), 'Min': np.float64(-0.5700875607634804), 'Mean': np.float64(0.819457030475875), 'Std': np.float64(0.5301102659833136)}
2024-12-06 23:39:05,906 - INFO - Candidate Std Stats: {'Max': np.float64(1.6588812308307936), 'Min': np.float64(0.0), 'Mean': np.float64(0.4641546959791659), 'Std': np.float64(0.31006934160966454)}
[I 2024-12-06 23:39:05,923] Trial 477 finished with value: 1.5 and parameters: {'x_0_0': 'cd', 'x_0_1': 'oo', 'x_1_0': 'bc', 'x_1_1': 'cd'}. Best is trial 165 with value: 0.5.
[I 2024-12-06 23:39:05,931] Trial 477 finished with value: 1.0 and parameters: {'x_0_0': 'bc', 'x_0_1': 'ad', 'x_1_0': 'ab', 'x_1_1': 'bc'}. Best is trial 76 with value: 0.5.
2024-12-06 23:39:06,071 - INFO - Candidate Mean Stats: {'Max': np.float64(2.722123010648542), 'Min': np.float64(-0.5118748190496767), 'Mean': np.float64(0.8573895853137702), 'Std': np.float64(0.49086060544549537)}
2024-12-06 23:39:06,071 - INFO - Candidate Std Stats: {'Max': np.float64(2.284065800976882), 'Min': np.float64(0.0), 'Mean': np.float64(0.43461863396660877), 'Std': np.float64(0.3148491399709821)}
[I 2024-12-06 23:39:06,100] Trial 477 finished with value: 2.0 and parameters: {'x_0_0': 'cd', 'x_0_1': 'ac', 'x_1_0': 'bc', 'x_1_1': 'ac'}. Best is trial 63 with value: 0.5.
2024-12-06 23:39:06,403 - INFO - Candidate Mean Stats: {'Max': np.float64(3.1018082146462658), 'Min': np.float64(-0.2883737857949069), 'Mean': np.float64(0.8619307927248795), 'Std': np.float64(0.46584188981529034)}
2024-12-06 23:39:06,404 - INFO - Candidate Std Stats: {'Max': np.float64(1.4096139279203954), 'Min': np.float64(0.0), 'Mean': np.float64(0.4191205979704165), 'Std': np.float64(0.28315317878277224)}
[I 2024-12-06 23:39:06,425] Trial 475 finished with value: 1.4642857142857144 and parameters: {'x_0_0': 'ab', 'x_0_1': 'ac', 'x_1_0': 'oo', 'x_1_1': 'bc'}. Best is trial 23 with value: 0.5.
2024-12-06 23:39:06,440 - INFO - Candidate Mean Stats: {'Max': np.float64(3.521286767252323), 'Min': np.float64(-0.4257510853201264), 'Mean': np.float64(0.8330530578019186), 'Std': np.float64(0.4591361134090078)}
2024-12-06 23:39:06,440 - INFO - Candidate Std Stats: {'Max': np.float64(1.644133272237717), 'Min': np.float64(0.0), 'Mean': np.float64(0.36717750891419276), 'Std': np.float64(0.27442619821940345)}
[I 2024-12-06 23:39:06,457] Trial 478 finished with value: 1.7142857142857144 and parameters: {'x_0_0': 'ab', 'x_0_1': 'ad', 'x_1_0': 'bc', 'x_1_1': 'bc'}. Best is trial 165 with value: 0.5.
2024-12-06 23:39:06,488 - INFO - Candidate Mean Stats: {'Max': np.float64(2.9125690523129473), 'Min': np.float64(-0.3685694854332201), 'Mean': np.float64(0.8207327648304311), 'Std': np.float64(0.4874815960443048)}
2024-12-06 23:39:06,488 - INFO - Candidate Std Stats: {'Max': np.float64(1.6696907308506295), 'Min': np.float64(0.0), 'Mean': np.float64(0.46046317937778686), 'Std': np.float64(0.3234901760303695)}
[I 2024-12-06 23:39:06,517] Trial 478 finished with value: 1.5714285714285714 and parameters: {'x_0_0': 'bc', 'x_0_1': 'bc', 'x_1_0': 'ab', 'x_1_1': 'bc'}. Best is trial 76 with value: 0.5.
2024-12-06 23:39:06,681 - INFO - Candidate Mean Stats: {'Max': np.float64(3.365046892999712), 'Min': np.float64(-0.5930902328738327), 'Mean': np.float64(0.8011911091506273), 'Std': np.float64(0.5065543307508203)}
2024-12-06 23:39:06,681 - INFO - Candidate Std Stats: {'Max': np.float64(1.5941813260121962), 'Min': np.float64(0.0), 'Mean': np.float64(0.45357812809263326), 'Std': np.float64(0.30558941845484755)}
[I 2024-12-06 23:39:06,716] Trial 478 finished with value: 1.375 and parameters: {'x_0_0': 'oo', 'x_0_1': 'oo', 'x_1_0': 'bd', 'x_1_1': 'bc'}. Best is trial 63 with value: 0.5.
2024-12-06 23:39:06,984 - INFO - Candidate Mean Stats: {'Max': np.float64(3.086413781917522), 'Min': np.float64(-0.38908877280991844), 'Mean': np.float64(0.8551442694985524), 'Std': np.float64(0.5219328347796757)}
2024-12-06 23:39:06,984 - INFO - Candidate Std Stats: {'Max': np.float64(1.3347357958651018), 'Min': np.float64(0.0), 'Mean': np.float64(0.42621696111681734), 'Std': np.float64(0.2875137452706317)}
[I 2024-12-06 23:39:07,011] Trial 476 finished with value: 1.3214285714285714 and parameters: {'x_0_0': 'ac', 'x_0_1': 'bd', 'x_1_0': 'oo', 'x_1_1': 'ac'}. Best is trial 23 with value: 0.5.
2024-12-06 23:39:07,029 - INFO - Candidate Mean Stats: {'Max': np.float64(2.7681976285121985), 'Min': np.float64(-0.450888304561149), 'Mean': np.float64(0.802905288077367), 'Std': np.float64(0.5182094269179974)}
2024-12-06 23:39:07,030 - INFO - Candidate Std Stats: {'Max': np.float64(1.4493993975924753), 'Min': np.float64(0.0), 'Mean': np.float64(0.4323907676478547), 'Std': np.float64(0.28828577707865466)}
[I 2024-12-06 23:39:07,050] Trial 479 finished with value: 1.5714285714285714 and parameters: {'x_0_0': 'bc', 'x_0_1': 'cd', 'x_1_0': 'bd', 'x_1_1': 'ad'}. Best is trial 165 with value: 0.5.
2024-12-06 23:39:07,086 - INFO - Candidate Mean Stats: {'Max': np.float64(2.768520098005817), 'Min': np.float64(-0.5785133365274954), 'Mean': np.float64(0.7979498615013837), 'Std': np.float64(0.5068871062002144)}
2024-12-06 23:39:07,087 - INFO - Candidate Std Stats: {'Max': np.float64(1.514139707475392), 'Min': np.float64(0.0), 'Mean': np.float64(0.421229689043758), 'Std': np.float64(0.28786378151396436)}
[I 2024-12-06 23:39:07,109] Trial 479 finished with value: 1.3214285714285714 and parameters: {'x_0_0': 'bc', 'x_0_1': 'cd', 'x_1_0': 'oo', 'x_1_1': 'bc'}. Best is trial 76 with value: 0.5.
2024-12-06 23:39:07,232 - INFO - Candidate Mean Stats: {'Max': np.float64(3.035510658538228), 'Min': np.float64(-0.6971787151120277), 'Mean': np.float64(0.7838760864256804), 'Std': np.float64(0.584373771478087)}
2024-12-06 23:39:07,232 - INFO - Candidate Std Stats: {'Max': np.float64(1.3972616541449516), 'Min': np.float64(0.0), 'Mean': np.float64(0.4314741830925375), 'Std': np.float64(0.2808692066769291)}
[I 2024-12-06 23:39:07,253] Trial 479 finished with value: 1.3214285714285714 and parameters: {'x_0_0': 'ad', 'x_0_1': 'ad', 'x_1_0': 'oo', 'x_1_1': 'ad'}. Best is trial 63 with value: 0.5.
2024-12-06 23:39:07,536 - INFO - Candidate Mean Stats: {'Max': np.float64(3.2373463606979818), 'Min': np.float64(-0.5550104543087142), 'Mean': np.float64(0.8374444412630035), 'Std': np.float64(0.5057423693401192)}
2024-12-06 23:39:07,536 - INFO - Candidate Std Stats: {'Max': np.float64(1.6040555044420066), 'Min': np.float64(0.0), 'Mean': np.float64(0.43993196058111994), 'Std': np.float64(0.30677923304000543)}
[I 2024-12-06 23:39:07,561] Trial 477 finished with value: 1.0 and parameters: {'x_0_0': 'bd', 'x_0_1': 'bc', 'x_1_0': 'bc', 'x_1_1': 'ac'}. Best is trial 23 with value: 0.5.
2024-12-06 23:39:07,575 - INFO - Candidate Mean Stats: {'Max': np.float64(3.1490436934339963), 'Min': np.float64(-0.5157076499144428), 'Mean': np.float64(0.8763491559345183), 'Std': np.float64(0.4473030261564376)}
2024-12-06 23:39:07,575 - INFO - Candidate Std Stats: {'Max': np.float64(1.355419139327058), 'Min': np.float64(0.0), 'Mean': np.float64(0.3550197715784759), 'Std': np.float64(0.24610247150494405)}
[I 2024-12-06 23:39:07,595] Trial 480 finished with value: 1.125 and parameters: {'x_0_0': 'oo', 'x_0_1': 'oo', 'x_1_0': 'oo', 'x_1_1': 'ac'}. Best is trial 165 with value: 0.5.
2024-12-06 23:39:07,637 - INFO - Candidate Mean Stats: {'Max': np.float64(3.0104604986972134), 'Min': np.float64(-0.5857120892018605), 'Mean': np.float64(0.8625546249613854), 'Std': np.float64(0.5099817804524741)}
2024-12-06 23:39:07,637 - INFO - Candidate Std Stats: {'Max': np.float64(1.9144779569113073), 'Min': np.float64(0.0), 'Mean': np.float64(0.40546588556889396), 'Std': np.float64(0.28013306925750625)}
[I 2024-12-06 23:39:07,661] Trial 480 finished with value: 1.1607142857142856 and parameters: {'x_0_0': 'ac', 'x_0_1': 'ad', 'x_1_0': 'bc', 'x_1_1': 'oo'}. Best is trial 76 with value: 0.5.
2024-12-06 23:39:07,756 - INFO - Candidate Mean Stats: {'Max': np.float64(2.904787534126961), 'Min': np.float64(-0.3699657241334028), 'Mean': np.float64(0.870393796792824), 'Std': np.float64(0.4928064561379275)}
2024-12-06 23:39:07,756 - INFO - Candidate Std Stats: {'Max': np.float64(1.5858423520994338), 'Min': np.float64(0.0), 'Mean': np.float64(0.3892340622634798), 'Std': np.float64(0.28414235340207167)}
[I 2024-12-06 23:39:07,774] Trial 480 finished with value: 1.1785714285714286 and parameters: {'x_0_0': 'ac', 'x_0_1': 'ab', 'x_1_0': 'oo', 'x_1_1': 'cd'}. Best is trial 63 with value: 0.5.
2024-12-06 23:39:08,021 - INFO - Candidate Mean Stats: {'Max': np.float64(2.9293078726008135), 'Min': np.float64(-0.4666168922874018), 'Mean': np.float64(0.8125472544217798), 'Std': np.float64(0.548458820615055)}
2024-12-06 23:39:08,021 - INFO - Candidate Std Stats: {'Max': np.float64(1.4901486467970826), 'Min': np.float64(0.0), 'Mean': np.float64(0.436855818193117), 'Std': np.float64(0.29348516558046583)}
[I 2024-12-06 23:39:08,041] Trial 478 finished with value: 1.3214285714285714 and parameters: {'x_0_0': 'bc', 'x_0_1': 'cd', 'x_1_0': 'oo', 'x_1_1': 'ab'}. Best is trial 23 with value: 0.5.
2024-12-06 23:39:08,058 - INFO - Candidate Mean Stats: {'Max': np.float64(2.9284111481877586), 'Min': np.float64(-0.48572640298855607), 'Mean': np.float64(0.8316467464480074), 'Std': np.float64(0.4898074383356828)}
2024-12-06 23:39:08,058 - INFO - Candidate Std Stats: {'Max': np.float64(1.850482358696683), 'Min': np.float64(0.0), 'Mean': np.float64(0.4401043666640339), 'Std': np.float64(0.3112516054985228)}
[I 2024-12-06 23:39:08,081] Trial 481 finished with value: 1.0357142857142856 and parameters: {'x_0_0': 'bc', 'x_0_1': 'ad', 'x_1_0': 'oo', 'x_1_1': 'ac'}. Best is trial 165 with value: 0.5.
2024-12-06 23:39:08,116 - INFO - Candidate Mean Stats: {'Max': np.float64(3.3141526144717433), 'Min': np.float64(-0.25947221568004303), 'Mean': np.float64(0.8349070945359376), 'Std': np.float64(0.4968975154219927)}
2024-12-06 23:39:08,116 - INFO - Candidate Std Stats: {'Max': np.float64(1.4238855566049766), 'Min': np.float64(0.0), 'Mean': np.float64(0.3983589610717119), 'Std': np.float64(0.2663074770706295)}
[I 2024-12-06 23:39:08,136] Trial 481 finished with value: 1.0 and parameters: {'x_0_0': 'bc', 'x_0_1': 'ad', 'x_1_0': 'bc', 'x_1_1': 'bc'}. Best is trial 76 with value: 0.5.
2024-12-06 23:39:08,232 - INFO - Candidate Mean Stats: {'Max': np.float64(3.0617529527205383), 'Min': np.float64(-0.4350804875248871), 'Mean': np.float64(0.884794534320954), 'Std': np.float64(0.46792142935588693)}
2024-12-06 23:39:08,232 - INFO - Candidate Std Stats: {'Max': np.float64(1.3213560595278935), 'Min': np.float64(0.0), 'Mean': np.float64(0.36150579208926376), 'Std': np.float64(0.25654486470089777)}
[I 2024-12-06 23:39:08,251] Trial 481 finished with value: 1.1964285714285714 and parameters: {'x_0_0': 'ad', 'x_0_1': 'ad', 'x_1_0': 'oo', 'x_1_1': 'oo'}. Best is trial 63 with value: 0.5.
2024-12-06 23:39:08,516 - INFO - Candidate Mean Stats: {'Max': np.float64(2.7942304679988617), 'Min': np.float64(-0.44177653741688677), 'Mean': np.float64(0.839834111911088), 'Std': np.float64(0.5059199257575394)}
2024-12-06 23:39:08,516 - INFO - Candidate Std Stats: {'Max': np.float64(1.3418675891784602), 'Min': np.float64(0.0), 'Mean': np.float64(0.4327103714302395), 'Std': np.float64(0.2872190035157807)}
[I 2024-12-06 23:39:08,535] Trial 479 finished with value: 0.8928571428571428 and parameters: {'x_0_0': 'bc', 'x_0_1': 'ad', 'x_1_0': 'oo', 'x_1_1': 'ab'}. Best is trial 23 with value: 0.5.
2024-12-06 23:39:08,549 - INFO - Candidate Mean Stats: {'Max': np.float64(3.1411314953312424), 'Min': np.float64(-0.31443216975267396), 'Mean': np.float64(0.8656117872114468), 'Std': np.float64(0.4440624719882587)}
2024-12-06 23:39:08,549 - INFO - Candidate Std Stats: {'Max': np.float64(1.2965544813665884), 'Min': np.float64(0.0), 'Mean': np.float64(0.38894637291416456), 'Std': np.float64(0.2672348993854136)}
[I 2024-12-06 23:39:08,566] Trial 482 finished with value: 1.375 and parameters: {'x_0_0': 'oo', 'x_0_1': 'oo', 'x_1_0': 'cd', 'x_1_1': 'ac'}. Best is trial 165 with value: 0.5.
2024-12-06 23:39:08,608 - INFO - Candidate Mean Stats: {'Max': np.float64(3.1769463074077082), 'Min': np.float64(-0.47873267777077705), 'Mean': np.float64(0.8078428176870491), 'Std': np.float64(0.534676669780271)}
2024-12-06 23:39:08,608 - INFO - Candidate Std Stats: {'Max': np.float64(1.6392720254365432), 'Min': np.float64(0.0), 'Mean': np.float64(0.4809659395212642), 'Std': np.float64(0.3220898312058798)}
[I 2024-12-06 23:39:08,628] Trial 482 finished with value: 1.2142857142857144 and parameters: {'x_0_0': 'ab', 'x_0_1': 'oo', 'x_1_0': 'ac', 'x_1_1': 'cd'}. Best is trial 76 with value: 0.5.
2024-12-06 23:39:08,749 - INFO - Candidate Mean Stats: {'Max': np.float64(2.8844977611269607), 'Min': np.float64(-0.6558187823065954), 'Mean': np.float64(0.7772156257379208), 'Std': np.float64(0.48341150658632637)}
2024-12-06 23:39:08,749 - INFO - Candidate Std Stats: {'Max': np.float64(1.5756342098520262), 'Min': np.float64(0.0), 'Mean': np.float64(0.5128996905312379), 'Std': np.float64(0.34102472056249156)}
[I 2024-12-06 23:39:08,769] Trial 482 finished with value: 1.25 and parameters: {'x_0_0': 'oo', 'x_0_1': 'oo', 'x_1_0': 'ab', 'x_1_1': 'oo'}. Best is trial 63 with value: 0.5.
2024-12-06 23:39:09,028 - INFO - Candidate Mean Stats: {'Max': np.float64(3.257362061729143), 'Min': np.float64(-0.31083687348612915), 'Mean': np.float64(0.8314367094519194), 'Std': np.float64(0.49840109500806473)}
2024-12-06 23:39:09,028 - INFO - Candidate Std Stats: {'Max': np.float64(1.302255435180608), 'Min': np.float64(0.0), 'Mean': np.float64(0.4207224570578694), 'Std': np.float64(0.2797294999099725)}
[I 2024-12-06 23:39:09,043] Trial 480 finished with value: 1.1607142857142856 and parameters: {'x_0_0': 'bc', 'x_0_1': 'ac', 'x_1_0': 'bd', 'x_1_1': 'oo'}. Best is trial 23 with value: 0.5.
2024-12-06 23:39:09,052 - INFO - Candidate Mean Stats: {'Max': np.float64(2.982561369458625), 'Min': np.float64(-0.4106242441296602), 'Mean': np.float64(0.8681143926404635), 'Std': np.float64(0.4764950402759891)}
2024-12-06 23:39:09,052 - INFO - Candidate Std Stats: {'Max': np.float64(1.4166453393195222), 'Min': np.float64(0.0), 'Mean': np.float64(0.4037178966728099), 'Std': np.float64(0.27689260571015695)}
[I 2024-12-06 23:39:09,068] Trial 483 finished with value: 1.3035714285714286 and parameters: {'x_0_0': 'ad', 'x_0_1': 'ab', 'x_1_0': 'ab', 'x_1_1': 'oo'}. Best is trial 165 with value: 0.5.
2024-12-06 23:39:09,111 - INFO - Candidate Mean Stats: {'Max': np.float64(3.3236878761619932), 'Min': np.float64(-0.3097047425545948), 'Mean': np.float64(0.8562991186505532), 'Std': np.float64(0.49850630505302246)}
2024-12-06 23:39:09,111 - INFO - Candidate Std Stats: {'Max': np.float64(1.4749815753676452), 'Min': np.float64(0.0), 'Mean': np.float64(0.40722856672854574), 'Std': np.float64(0.28706002972866)}
[I 2024-12-06 23:39:09,134] Trial 483 finished with value: 1.1607142857142856 and parameters: {'x_0_0': 'bc', 'x_0_1': 'ad', 'x_1_0': 'ab', 'x_1_1': 'oo'}. Best is trial 76 with value: 0.5.
2024-12-06 23:39:09,238 - INFO - Candidate Mean Stats: {'Max': np.float64(2.991437096328), 'Min': np.float64(-0.3727084182545571), 'Mean': np.float64(0.8352644263701726), 'Std': np.float64(0.5003953330649205)}
2024-12-06 23:39:09,238 - INFO - Candidate Std Stats: {'Max': np.float64(1.6234334778856474), 'Min': np.float64(0.0), 'Mean': np.float64(0.44021882904624904), 'Std': np.float64(0.29661870557620734)}
[I 2024-12-06 23:39:09,260] Trial 483 finished with value: 1.2857142857142856 and parameters: {'x_0_0': 'bd', 'x_0_1': 'cd', 'x_1_0': 'bd', 'x_1_1': 'ad'}. Best is trial 63 with value: 0.5.
2024-12-06 23:39:09,573 - INFO - Candidate Mean Stats: {'Max': np.float64(3.025215173140219), 'Min': np.float64(-0.7236761422649878), 'Mean': np.float64(0.8535717096852664), 'Std': np.float64(0.5397314686034606)}
2024-12-06 23:39:09,573 - INFO - Candidate Std Stats: {'Max': np.float64(1.877194923426362), 'Min': np.float64(0.0), 'Mean': np.float64(0.4218840189798905), 'Std': np.float64(0.2877181619504502)}
[I 2024-12-06 23:39:09,592] Trial 481 finished with value: 1.2857142857142856 and parameters: {'x_0_0': 'bd', 'x_0_1': 'bd', 'x_1_0': 'bc', 'x_1_1': 'bc'}. Best is trial 23 with value: 0.5.
2024-12-06 23:39:09,594 - INFO - Candidate Mean Stats: {'Max': np.float64(3.0161898455111014), 'Min': np.float64(-0.57024794310709), 'Mean': np.float64(0.7678095356613349), 'Std': np.float64(0.4955307819194821)}
2024-12-06 23:39:09,595 - INFO - Candidate Std Stats: {'Max': np.float64(1.6343375417678292), 'Min': np.float64(0.0), 'Mean': np.float64(0.4435591281588662), 'Std': np.float64(0.30451283045442884)}
[I 2024-12-06 23:39:09,618] Trial 484 finished with value: 1.5892857142857144 and parameters: {'x_0_0': 'ab', 'x_0_1': 'ac', 'x_1_0': 'ab', 'x_1_1': 'oo'}. Best is trial 165 with value: 0.5.
2024-12-06 23:39:09,655 - INFO - Candidate Mean Stats: {'Max': np.float64(3.1513837907462503), 'Min': np.float64(-0.5880281000785688), 'Mean': np.float64(0.7643122681573828), 'Std': np.float64(0.566536381780527)}
2024-12-06 23:39:09,655 - INFO - Candidate Std Stats: {'Max': np.float64(1.5426070675785664), 'Min': np.float64(0.0), 'Mean': np.float64(0.46425970304881836), 'Std': np.float64(0.3054412001149553)}
[I 2024-12-06 23:39:09,674] Trial 484 finished with value: 1.5714285714285714 and parameters: {'x_0_0': 'ac', 'x_0_1': 'bd', 'x_1_0': 'cd', 'x_1_1': 'ab'}. Best is trial 76 with value: 0.5.
2024-12-06 23:39:09,765 - INFO - Candidate Mean Stats: {'Max': np.float64(3.025699620868906), 'Min': np.float64(-0.5602050339712501), 'Mean': np.float64(0.8275521795632157), 'Std': np.float64(0.47160966502374063)}
2024-12-06 23:39:09,766 - INFO - Candidate Std Stats: {'Max': np.float64(1.6831680201200996), 'Min': np.float64(0.0), 'Mean': np.float64(0.4937768122380586), 'Std': np.float64(0.3398395667983434)}
[I 2024-12-06 23:39:09,784] Trial 484 finished with value: 1.25 and parameters: {'x_0_0': 'cd', 'x_0_1': 'oo', 'x_1_0': 'oo', 'x_1_1': 'ab'}. Best is trial 63 with value: 0.5.
2024-12-06 23:39:10,044 - INFO - Candidate Mean Stats: {'Max': np.float64(3.0423563807027194), 'Min': np.float64(-0.35124598787646616), 'Mean': np.float64(0.8906055976452072), 'Std': np.float64(0.5050562651519173)}
2024-12-06 23:39:10,044 - INFO - Candidate Std Stats: {'Max': np.float64(1.6883588783889343), 'Min': np.float64(0.0), 'Mean': np.float64(0.37750344732155866), 'Std': np.float64(0.26430385730668404)}
2024-12-06 23:39:10,059 - INFO - Candidate Mean Stats: {'Max': np.float64(3.3951708546234434), 'Min': np.float64(-0.1759136018809267), 'Mean': np.float64(0.8859322369068234), 'Std': np.float64(0.43660094404390404)}
2024-12-06 23:39:10,060 - INFO - Candidate Std Stats: {'Max': np.float64(1.478325467284991), 'Min': np.float64(0.0), 'Mean': np.float64(0.3407503157169521), 'Std': np.float64(0.2537952139061034)}
[I 2024-12-06 23:39:10,061] Trial 482 finished with value: 1.3214285714285714 and parameters: {'x_0_0': 'bc', 'x_0_1': 'bd', 'x_1_0': 'oo', 'x_1_1': 'ab'}. Best is trial 23 with value: 0.5.
[I 2024-12-06 23:39:10,076] Trial 485 finished with value: 1.5 and parameters: {'x_0_0': 'cd', 'x_0_1': 'oo', 'x_1_0': 'ad', 'x_1_1': 'cd'}. Best is trial 165 with value: 0.5.
2024-12-06 23:39:10,108 - INFO - Candidate Mean Stats: {'Max': np.float64(2.951286656997703), 'Min': np.float64(-0.4315111506441722), 'Mean': np.float64(0.880233340009583), 'Std': np.float64(0.5012534012233523)}
2024-12-06 23:39:10,108 - INFO - Candidate Std Stats: {'Max': np.float64(1.5068991016852138), 'Min': np.float64(0.0), 'Mean': np.float64(0.43583054870401644), 'Std': np.float64(0.29246296681697453)}
