[I 2024-12-06 23:37:39,921] Trial 267 finished with value: 1.3214285714285714 and parameters: {'x_0_0': 'ac', 'x_0_1': 'bc', 'x_1_0': 'oo', 'x_1_1': 'cd'}. Best is trial 23 with value: 0.5.
2024-12-06 23:37:40,027 - INFO - Candidate Mean Stats: {'Max': np.float64(3.495945354345982), 'Min': np.float64(-1.0373412727459312), 'Mean': np.float64(0.5458062948942686), 'Std': np.float64(0.646191079682328)}
2024-12-06 23:37:40,027 - INFO - Candidate Std Stats: {'Max': np.float64(1.6488059182178985), 'Min': np.float64(0.0), 'Mean': np.float64(0.6453500550333005), 'Std': np.float64(0.3354000942761933)}
2024-12-06 23:37:40,029 - INFO - Candidate Mean Stats: {'Max': np.float64(2.59311463123123), 'Min': np.float64(-0.90141362513299), 'Mean': np.float64(0.6073272289546479), 'Std': np.float64(0.554897989972151)}
2024-12-06 23:37:40,030 - INFO - Candidate Std Stats: {'Max': np.float64(1.848400771730776), 'Min': np.float64(0.0), 'Mean': np.float64(0.6156144947792304), 'Std': np.float64(0.34457268559465215)}
[I 2024-12-06 23:37:40,042] Trial 269 finished with value: 1.0714285714285714 and parameters: {'x_0_0': 'ac', 'x_0_1': 'oo', 'x_1_0': 'ad', 'x_1_1': 'ad'}. Best is trial 165 with value: 0.5.
[I 2024-12-06 23:37:40,044] Trial 269 finished with value: 1.0357142857142856 and parameters: {'x_0_0': 'bc', 'x_0_1': 'ad', 'x_1_0': 'oo', 'x_1_1': 'ad'}. Best is trial 76 with value: 0.5.
2024-12-06 23:37:40,044 - INFO - Candidate Mean Stats: {'Max': np.float64(2.9942166615428603), 'Min': np.float64(-0.5895926877311333), 'Mean': np.float64(0.6848720443619389), 'Std': np.float64(0.46480481328203094)}
2024-12-06 23:37:40,045 - INFO - Candidate Std Stats: {'Max': np.float64(1.6891410015905632), 'Min': np.float64(0.0), 'Mean': np.float64(0.5052247161532122), 'Std': np.float64(0.29913628843903356)}
[I 2024-12-06 23:37:40,058] Trial 269 finished with value: 1.375 and parameters: {'x_0_0': 'oo', 'x_0_1': 'oo', 'x_1_0': 'ad', 'x_1_1': 'cd'}. Best is trial 63 with value: 0.5.
2024-12-06 23:37:40,279 - INFO - Candidate Mean Stats: {'Max': np.float64(3.583938818087435), 'Min': np.float64(-0.9745794877592004), 'Mean': np.float64(0.5505752404014688), 'Std': np.float64(0.5983004695728062)}
2024-12-06 23:37:40,279 - INFO - Candidate Std Stats: {'Max': np.float64(1.729283808428173), 'Min': np.float64(0.0), 'Mean': np.float64(0.5867463274942947), 'Std': np.float64(0.31123214651208947)}
[I 2024-12-06 23:37:40,293] Trial 268 finished with value: 1.0714285714285714 and parameters: {'x_0_0': 'ac', 'x_0_1': 'oo', 'x_1_0': 'cd', 'x_1_1': 'cd'}. Best is trial 23 with value: 0.5.
2024-12-06 23:37:40,401 - INFO - Candidate Mean Stats: {'Max': np.float64(3.2280356267406525), 'Min': np.float64(-0.9821213338621269), 'Mean': np.float64(0.4716480732586463), 'Std': np.float64(0.6203460107955993)}
2024-12-06 23:37:40,401 - INFO - Candidate Std Stats: {'Max': np.float64(2.006934983549073), 'Min': np.float64(0.0), 'Mean': np.float64(0.6921735670318239), 'Std': np.float64(0.3651559817686344)}
2024-12-06 23:37:40,403 - INFO - Candidate Mean Stats: {'Max': np.float64(3.0290557067855217), 'Min': np.float64(-0.5860436232340179), 'Mean': np.float64(0.6494686187564962), 'Std': np.float64(0.5167004185481519)}
2024-12-06 23:37:40,403 - INFO - Candidate Std Stats: {'Max': np.float64(1.872453763868337), 'Min': np.float64(0.0), 'Mean': np.float64(0.49783350001654864), 'Std': np.float64(0.29723990929415633)}
[I 2024-12-06 23:37:40,415] Trial 270 finished with value: 1.5714285714285714 and parameters: {'x_0_0': 'ad', 'x_0_1': 'bc', 'x_1_0': 'ac', 'x_1_1': 'bd'}. Best is trial 165 with value: 0.5.
[I 2024-12-06 23:37:40,416] Trial 270 finished with value: 1.1607142857142856 and parameters: {'x_0_0': 'bc', 'x_0_1': 'ac', 'x_1_0': 'ab', 'x_1_1': 'oo'}. Best is trial 76 with value: 0.5.
2024-12-06 23:37:40,419 - INFO - Candidate Mean Stats: {'Max': np.float64(3.348049707438311), 'Min': np.float64(-0.8997615605428143), 'Mean': np.float64(0.603614235320769), 'Std': np.float64(0.5704486244860681)}
2024-12-06 23:37:40,420 - INFO - Candidate Std Stats: {'Max': np.float64(1.7588793112369667), 'Min': np.float64(0.0), 'Mean': np.float64(0.5572039760234606), 'Std': np.float64(0.30772538876427474)}
[I 2024-12-06 23:37:40,433] Trial 270 finished with value: 1.1964285714285714 and parameters: {'x_0_0': 'bd', 'x_0_1': 'bd', 'x_1_0': 'oo', 'x_1_1': 'oo'}. Best is trial 63 with value: 0.5.
2024-12-06 23:37:40,654 - INFO - Candidate Mean Stats: {'Max': np.float64(3.557577308691058), 'Min': np.float64(-0.9192577379249801), 'Mean': np.float64(0.5922525042077299), 'Std': np.float64(0.5825348705840643)}
2024-12-06 23:37:40,654 - INFO - Candidate Std Stats: {'Max': np.float64(1.8234290833663132), 'Min': np.float64(0.0), 'Mean': np.float64(0.5576142990846811), 'Std': np.float64(0.3104872722198031)}
[I 2024-12-06 23:37:40,668] Trial 269 finished with value: 1.5714285714285714 and parameters: {'x_0_0': 'bd', 'x_0_1': 'ad', 'x_1_0': 'ad', 'x_1_1': 'bc'}. Best is trial 23 with value: 0.5.
2024-12-06 23:37:40,775 - INFO - Candidate Mean Stats: {'Max': np.float64(3.1064403360538284), 'Min': np.float64(-1.4679293376366933), 'Mean': np.float64(0.5425647232342846), 'Std': np.float64(0.6337715891627275)}
2024-12-06 23:37:40,775 - INFO - Candidate Std Stats: {'Max': np.float64(1.7851310748279254), 'Min': np.float64(0.0), 'Mean': np.float64(0.5813831541662868), 'Std': np.float64(0.31414856948678277)}
2024-12-06 23:37:40,778 - INFO - Candidate Mean Stats: {'Max': np.float64(3.596040583973843), 'Min': np.float64(-0.46152274318750564), 'Mean': np.float64(0.6888090420081505), 'Std': np.float64(0.48686915107453665)}
2024-12-06 23:37:40,778 - INFO - Candidate Std Stats: {'Max': np.float64(1.5955981891580655), 'Min': np.float64(0.0), 'Mean': np.float64(0.46749958659634705), 'Std': np.float64(0.27191836700914623)}
[I 2024-12-06 23:37:40,790] Trial 271 finished with value: 1.0714285714285714 and parameters: {'x_0_0': 'ac', 'x_0_1': 'oo', 'x_1_0': 'ac', 'x_1_1': 'bd'}. Best is trial 165 with value: 0.5.
[I 2024-12-06 23:37:40,792] Trial 271 finished with value: 1.0892857142857144 and parameters: {'x_0_0': 'ab', 'x_0_1': 'oo', 'x_1_0': 'ab', 'x_1_1': 'oo'}. Best is trial 76 with value: 0.5.
2024-12-06 23:37:40,796 - INFO - Candidate Mean Stats: {'Max': np.float64(2.737467783383395), 'Min': np.float64(-0.6222475769666408), 'Mean': np.float64(0.7023165594051032), 'Std': np.float64(0.4632880950126082)}
2024-12-06 23:37:40,796 - INFO - Candidate Std Stats: {'Max': np.float64(1.4610899180410024), 'Min': np.float64(0.0), 'Mean': np.float64(0.4754891078580777), 'Std': np.float64(0.2713784460011191)}
[I 2024-12-06 23:37:40,809] Trial 271 finished with value: 1.5 and parameters: {'x_0_0': 'cd', 'x_0_1': 'oo', 'x_1_0': 'cd', 'x_1_1': 'ad'}. Best is trial 63 with value: 0.5.
2024-12-06 23:37:41,030 - INFO - Candidate Mean Stats: {'Max': np.float64(3.0102435897207775), 'Min': np.float64(-1.2865361480098196), 'Mean': np.float64(0.5563294864392462), 'Std': np.float64(0.585895143611678)}
2024-12-06 23:37:41,030 - INFO - Candidate Std Stats: {'Max': np.float64(1.8176913072999612), 'Min': np.float64(0.0), 'Mean': np.float64(0.6325401144190557), 'Std': np.float64(0.3338300573707228)}
[I 2024-12-06 23:37:41,043] Trial 270 finished with value: 1.0892857142857144 and parameters: {'x_0_0': 'ab', 'x_0_1': 'oo', 'x_1_0': 'bc', 'x_1_1': 'oo'}. Best is trial 23 with value: 0.5.
2024-12-06 23:37:41,147 - INFO - Candidate Mean Stats: {'Max': np.float64(3.1476181675030737), 'Min': np.float64(-1.1283790531201308), 'Mean': np.float64(0.48850575500580184), 'Std': np.float64(0.6415008352821506)}
2024-12-06 23:37:41,147 - INFO - Candidate Std Stats: {'Max': np.float64(1.8016485211914857), 'Min': np.float64(0.0), 'Mean': np.float64(0.6334541660519821), 'Std': np.float64(0.3634052549361829)}
2024-12-06 23:37:41,150 - INFO - Candidate Mean Stats: {'Max': np.float64(2.975190733447171), 'Min': np.float64(-0.5799939760794584), 'Mean': np.float64(0.6447757730656489), 'Std': np.float64(0.4925846973631001)}
2024-12-06 23:37:41,150 - INFO - Candidate Std Stats: {'Max': np.float64(1.489165550082902), 'Min': np.float64(0.0), 'Mean': np.float64(0.5264753271235997), 'Std': np.float64(0.28627733111132103)}
[I 2024-12-06 23:37:41,162] Trial 272 finished with value: 0.9642857142857143 and parameters: {'x_0_0': 'ab', 'x_0_1': 'oo', 'x_1_0': 'oo', 'x_1_1': 'ac'}. Best is trial 165 with value: 0.5.
[I 2024-12-06 23:37:41,164] Trial 272 finished with value: 1.25 and parameters: {'x_0_0': 'oo', 'x_0_1': 'oo', 'x_1_0': 'ad', 'x_1_1': 'oo'}. Best is trial 76 with value: 0.5.
2024-12-06 23:37:41,169 - INFO - Candidate Mean Stats: {'Max': np.float64(3.7597615026296287), 'Min': np.float64(-1.0613602829095983), 'Mean': np.float64(0.6752664714234532), 'Std': np.float64(0.5131388683452189)}
2024-12-06 23:37:41,169 - INFO - Candidate Std Stats: {'Max': np.float64(1.4947964679506094), 'Min': np.float64(0.0), 'Mean': np.float64(0.4583629298663798), 'Std': np.float64(0.2641240891130616)}
[I 2024-12-06 23:37:41,182] Trial 272 finished with value: 0.8214285714285714 and parameters: {'x_0_0': 'ac', 'x_0_1': 'oo', 'x_1_0': 'oo', 'x_1_1': 'bd'}. Best is trial 63 with value: 0.5.
2024-12-06 23:37:41,402 - INFO - Candidate Mean Stats: {'Max': np.float64(3.2952425332914905), 'Min': np.float64(-0.7329668302839026), 'Mean': np.float64(0.6434446285604979), 'Std': np.float64(0.497823998360724)}
2024-12-06 23:37:41,402 - INFO - Candidate Std Stats: {'Max': np.float64(1.5906734720386047), 'Min': np.float64(0.0), 'Mean': np.float64(0.5173775978222468), 'Std': np.float64(0.2810912298497836)}
[I 2024-12-06 23:37:41,417] Trial 271 finished with value: 1.5 and parameters: {'x_0_0': 'cd', 'x_0_1': 'oo', 'x_1_0': 'bc', 'x_1_1': 'bc'}. Best is trial 23 with value: 0.5.
2024-12-06 23:37:41,521 - INFO - Candidate Mean Stats: {'Max': np.float64(2.9326364463788854), 'Min': np.float64(-1.2244243785104365), 'Mean': np.float64(0.49995373088485684), 'Std': np.float64(0.6685117404182245)}
2024-12-06 23:37:41,521 - INFO - Candidate Std Stats: {'Max': np.float64(1.8404094954989547), 'Min': np.float64(0.0), 'Mean': np.float64(0.6605221634977634), 'Std': np.float64(0.35949075718832874)}
2024-12-06 23:37:41,524 - INFO - Candidate Mean Stats: {'Max': np.float64(3.3221990813641975), 'Min': np.float64(-0.824709099048236), 'Mean': np.float64(0.6416777067208218), 'Std': np.float64(0.525262997321075)}
2024-12-06 23:37:41,524 - INFO - Candidate Std Stats: {'Max': np.float64(1.6685910245778994), 'Min': np.float64(0.0), 'Mean': np.float64(0.49234135706822785), 'Std': np.float64(0.2742541769487379)}
[I 2024-12-06 23:37:41,535] Trial 273 finished with value: 1.0892857142857144 and parameters: {'x_0_0': 'ab', 'x_0_1': 'oo', 'x_1_0': 'ad', 'x_1_1': 'oo'}. Best is trial 165 with value: 0.5.
[I 2024-12-06 23:37:41,538] Trial 273 finished with value: 1.0714285714285714 and parameters: {'x_0_0': 'ad', 'x_0_1': 'oo', 'x_1_0': 'ac', 'x_1_1': 'ad'}. Best is trial 76 with value: 0.5.
2024-12-06 23:37:41,543 - INFO - Candidate Mean Stats: {'Max': np.float64(3.192855979038423), 'Min': np.float64(-1.126266536920418), 'Mean': np.float64(0.6522340659453422), 'Std': np.float64(0.4877577050945035)}
2024-12-06 23:37:41,544 - INFO - Candidate Std Stats: {'Max': np.float64(2.132999488338423), 'Min': np.float64(0.0), 'Mean': np.float64(0.5301235421344752), 'Std': np.float64(0.32746442447462015)}
[I 2024-12-06 23:37:41,558] Trial 273 finished with value: 0.9285714285714286 and parameters: {'x_0_0': 'bd', 'x_0_1': 'oo', 'x_1_0': 'ab', 'x_1_1': 'ab'}. Best is trial 63 with value: 0.5.
2024-12-06 23:37:41,778 - INFO - Candidate Mean Stats: {'Max': np.float64(2.834952038014703), 'Min': np.float64(-1.1162722963350409), 'Mean': np.float64(0.6050214852625794), 'Std': np.float64(0.5800912418778312)}
2024-12-06 23:37:41,778 - INFO - Candidate Std Stats: {'Max': np.float64(1.9977542793949847), 'Min': np.float64(0.0), 'Mean': np.float64(0.5906585980279664), 'Std': np.float64(0.32403847321953116)}
[I 2024-12-06 23:37:41,792] Trial 272 finished with value: 1.2142857142857144 and parameters: {'x_0_0': 'ab', 'x_0_1': 'oo', 'x_1_0': 'bc', 'x_1_1': 'cd'}. Best is trial 23 with value: 0.5.
2024-12-06 23:37:41,895 - INFO - Candidate Mean Stats: {'Max': np.float64(3.142489996862617), 'Min': np.float64(-0.9446444862644517), 'Mean': np.float64(0.5978928845092837), 'Std': np.float64(0.5647780900575402)}
2024-12-06 23:37:41,895 - INFO - Candidate Std Stats: {'Max': np.float64(1.494494600073953), 'Min': np.float64(0.0), 'Mean': np.float64(0.5293627709158428), 'Std': np.float64(0.28512902338809815)}
2024-12-06 23:37:41,898 - INFO - Candidate Mean Stats: {'Max': np.float64(2.639558492693006), 'Min': np.float64(-0.9224596492763915), 'Mean': np.float64(0.5944696704834633), 'Std': np.float64(0.5514975543791523)}
2024-12-06 23:37:41,898 - INFO - Candidate Std Stats: {'Max': np.float64(1.601729772334788), 'Min': np.float64(0.0), 'Mean': np.float64(0.5564197333962093), 'Std': np.float64(0.2997732972139558)}
[I 2024-12-06 23:37:41,909] Trial 274 finished with value: 1.0714285714285714 and parameters: {'x_0_0': 'bc', 'x_0_1': 'oo', 'x_1_0': 'bd', 'x_1_1': 'ac'}. Best is trial 165 with value: 0.5.
[I 2024-12-06 23:37:41,912] Trial 274 finished with value: 0.9642857142857143 and parameters: {'x_0_0': 'ab', 'x_0_1': 'oo', 'x_1_0': 'oo', 'x_1_1': 'ac'}. Best is trial 76 with value: 0.5.
2024-12-06 23:37:41,923 - INFO - Candidate Mean Stats: {'Max': np.float64(2.9653563166069548), 'Min': np.float64(-0.8043701596578783), 'Mean': np.float64(0.674718880864611), 'Std': np.float64(0.4702562795824593)}
2024-12-06 23:37:41,923 - INFO - Candidate Std Stats: {'Max': np.float64(2.237413488435774), 'Min': np.float64(0.0), 'Mean': np.float64(0.5609519360915092), 'Std': np.float64(0.3564973704944623)}
[I 2024-12-06 23:37:41,937] Trial 274 finished with value: 1.5 and parameters: {'x_0_0': 'cd', 'x_0_1': 'oo', 'x_1_0': 'ab', 'x_1_1': 'bc'}. Best is trial 63 with value: 0.5.
2024-12-06 23:37:42,155 - INFO - Candidate Mean Stats: {'Max': np.float64(3.2179879334531947), 'Min': np.float64(-0.9816799426001142), 'Mean': np.float64(0.5894130197170705), 'Std': np.float64(0.5894578852414057)}
2024-12-06 23:37:42,155 - INFO - Candidate Std Stats: {'Max': np.float64(1.6430540025689273), 'Min': np.float64(0.0), 'Mean': np.float64(0.5799049484273714), 'Std': np.float64(0.31780709386837447)}
[I 2024-12-06 23:37:42,168] Trial 273 finished with value: 1.2142857142857144 and parameters: {'x_0_0': 'ab', 'x_0_1': 'oo', 'x_1_0': 'cd', 'x_1_1': 'ab'}. Best is trial 23 with value: 0.5.
2024-12-06 23:37:42,268 - INFO - Candidate Mean Stats: {'Max': np.float64(3.007425958091833), 'Min': np.float64(-1.3072121890559896), 'Mean': np.float64(0.5423138912076789), 'Std': np.float64(0.6449330912682829)}
2024-12-06 23:37:42,268 - INFO - Candidate Std Stats: {'Max': np.float64(1.744354316179492), 'Min': np.float64(0.0), 'Mean': np.float64(0.6126958313237659), 'Std': np.float64(0.3331487324801198)}
2024-12-06 23:37:42,273 - INFO - Candidate Mean Stats: {'Max': np.float64(2.981807561954544), 'Min': np.float64(-1.0893601806526805), 'Mean': np.float64(0.521307131768373), 'Std': np.float64(0.5934630902158533)}
2024-12-06 23:37:42,273 - INFO - Candidate Std Stats: {'Max': np.float64(1.6735702166885487), 'Min': np.float64(0.0), 'Mean': np.float64(0.5962030819987024), 'Std': np.float64(0.32942278685332743)}
[I 2024-12-06 23:37:42,283] Trial 275 finished with value: 1.2142857142857144 and parameters: {'x_0_0': 'ab', 'x_0_1': 'oo', 'x_1_0': 'ad', 'x_1_1': 'ad'}. Best is trial 165 with value: 0.5.
[I 2024-12-06 23:37:42,287] Trial 275 finished with value: 0.9285714285714286 and parameters: {'x_0_0': 'bd', 'x_0_1': 'oo', 'x_1_0': 'ab', 'x_1_1': 'ad'}. Best is trial 76 with value: 0.5.
2024-12-06 23:37:42,298 - INFO - Candidate Mean Stats: {'Max': np.float64(3.402632550627948), 'Min': np.float64(-1.1362427701985522), 'Mean': np.float64(0.5787745302828831), 'Std': np.float64(0.5468573535344167)}
2024-12-06 23:37:42,298 - INFO - Candidate Std Stats: {'Max': np.float64(1.5676660158101037), 'Min': np.float64(0.0), 'Mean': np.float64(0.5157449043191052), 'Std': np.float64(0.284329696463225)}
[I 2024-12-06 23:37:42,311] Trial 275 finished with value: 1.0714285714285714 and parameters: {'x_0_0': 'ac', 'x_0_1': 'oo', 'x_1_0': 'ac', 'x_1_1': 'ab'}. Best is trial 63 with value: 0.5.
2024-12-06 23:37:42,530 - INFO - Candidate Mean Stats: {'Max': np.float64(2.611822045951457), 'Min': np.float64(-1.0149050224549034), 'Mean': np.float64(0.578553076202126), 'Std': np.float64(0.5894510243455205)}
2024-12-06 23:37:42,530 - INFO - Candidate Std Stats: {'Max': np.float64(1.6650897477785827), 'Min': np.float64(0.0), 'Mean': np.float64(0.5530907765736602), 'Std': np.float64(0.3017007025662075)}
[I 2024-12-06 23:37:42,545] Trial 274 finished with value: 1.2857142857142856 and parameters: {'x_0_0': 'ac', 'x_0_1': 'ac', 'x_1_0': 'bc', 'x_1_1': 'ad'}. Best is trial 23 with value: 0.5.
2024-12-06 23:37:42,648 - INFO - Candidate Mean Stats: {'Max': np.float64(2.991204349082663), 'Min': np.float64(-0.803432416459214), 'Mean': np.float64(0.6896416760534645), 'Std': np.float64(0.5085400809183976)}
2024-12-06 23:37:42,660 - INFO - Candidate Std Stats: {'Max': np.float64(1.6617464772623252), 'Min': np.float64(0.0), 'Mean': np.float64(0.4687824487022433), 'Std': np.float64(0.2724310571432328)}
2024-12-06 23:37:42,653 - INFO - Candidate Mean Stats: {'Max': np.float64(2.9030340610934173), 'Min': np.float64(-0.9991584126605263), 'Mean': np.float64(0.604960362027292), 'Std': np.float64(0.49668634311694976)}
2024-12-06 23:37:42,660 - INFO - Candidate Std Stats: {'Max': np.float64(1.9309391329193815), 'Min': np.float64(0.0), 'Mean': np.float64(0.5475471926515638), 'Std': np.float64(0.31662093911663525)}
[I 2024-12-06 23:37:42,675] Trial 276 finished with value: 0.9285714285714286 and parameters: {'x_0_0': 'bd', 'x_0_1': 'oo', 'x_1_0': 'ab', 'x_1_1': 'cd'}. Best is trial 165 with value: 0.5.
[I 2024-12-06 23:37:42,676] Trial 276 finished with value: 1.4285714285714286 and parameters: {'x_0_0': 'ad', 'x_0_1': 'bc', 'x_1_0': 'ab', 'x_1_1': 'cd'}. Best is trial 76 with value: 0.5.
2024-12-06 23:37:42,677 - INFO - Candidate Mean Stats: {'Max': np.float64(2.8089024265644027), 'Min': np.float64(-0.7519255033111573), 'Mean': np.float64(0.6561563137898233), 'Std': np.float64(0.42384784764900624)}
2024-12-06 23:37:42,677 - INFO - Candidate Std Stats: {'Max': np.float64(1.8657716435444447), 'Min': np.float64(0.0), 'Mean': np.float64(0.4687816582630328), 'Std': np.float64(0.2915086146586878)}
[I 2024-12-06 23:37:42,690] Trial 276 finished with value: 1.0714285714285714 and parameters: {'x_0_0': 'bc', 'x_0_1': 'oo', 'x_1_0': 'ab', 'x_1_1': 'bd'}. Best is trial 63 with value: 0.5.
2024-12-06 23:37:42,905 - INFO - Candidate Mean Stats: {'Max': np.float64(3.4640801944216206), 'Min': np.float64(-0.6580738584185593), 'Mean': np.float64(0.6217692005252797), 'Std': np.float64(0.5618472708710097)}
2024-12-06 23:37:42,905 - INFO - Candidate Std Stats: {'Max': np.float64(1.4237008527690589), 'Min': np.float64(0.0), 'Mean': np.float64(0.5084776922487902), 'Std': np.float64(0.2742406788100999)}
[I 2024-12-06 23:37:42,919] Trial 275 finished with value: 1.5714285714285714 and parameters: {'x_0_0': 'ad', 'x_0_1': 'ab', 'x_1_0': 'ac', 'x_1_1': 'ab'}. Best is trial 23 with value: 0.5.
2024-12-06 23:37:43,032 - INFO - Candidate Mean Stats: {'Max': np.float64(3.569783258899102), 'Min': np.float64(-1.224260834902212), 'Mean': np.float64(0.48430958513178407), 'Std': np.float64(0.6661615487403646)}
2024-12-06 23:37:43,032 - INFO - Candidate Std Stats: {'Max': np.float64(1.8339651443774163), 'Min': np.float64(0.0), 'Mean': np.float64(0.6564870637968897), 'Std': np.float64(0.347821882255887)}
2024-12-06 23:37:43,036 - INFO - Candidate Mean Stats: {'Max': np.float64(2.9526477220185456), 'Min': np.float64(-0.9368949075237675), 'Mean': np.float64(0.6746550868860663), 'Std': np.float64(0.4776715102681237)}
2024-12-06 23:37:43,036 - INFO - Candidate Std Stats: {'Max': np.float64(1.852078375084298), 'Min': np.float64(0.0), 'Mean': np.float64(0.5232651517256965), 'Std': np.float64(0.30045454335537014)}
[I 2024-12-06 23:37:43,046] Trial 277 finished with value: 1.1785714285714286 and parameters: {'x_0_0': 'bc', 'x_0_1': 'ab', 'x_1_0': 'oo', 'x_1_1': 'cd'}. Best is trial 165 with value: 0.5.
2024-12-06 23:37:43,047 - INFO - Candidate Mean Stats: {'Max': np.float64(2.7072801386555683), 'Min': np.float64(-0.9869285455951049), 'Mean': np.float64(0.5812447352121208), 'Std': np.float64(0.5584158424923297)}
2024-12-06 23:37:43,047 - INFO - Candidate Std Stats: {'Max': np.float64(1.8002117022002873), 'Min': np.float64(0.0), 'Mean': np.float64(0.6006135463215998), 'Std': np.float64(0.3343863393173068)}
[I 2024-12-06 23:37:43,049] Trial 277 finished with value: 1.0714285714285714 and parameters: {'x_0_0': 'bc', 'x_0_1': 'oo', 'x_1_0': 'ac', 'x_1_1': 'ab'}. Best is trial 76 with value: 0.5.
[I 2024-12-06 23:37:43,060] Trial 277 finished with value: 1.2857142857142856 and parameters: {'x_0_0': 'ac', 'x_0_1': 'ac', 'x_1_0': 'cd', 'x_1_1': 'ad'}. Best is trial 63 with value: 0.5.
2024-12-06 23:37:43,279 - INFO - Candidate Mean Stats: {'Max': np.float64(3.133182921022253), 'Min': np.float64(-1.1895212613869361), 'Mean': np.float64(0.5961483885443808), 'Std': np.float64(0.5611526789741663)}
2024-12-06 23:37:43,279 - INFO - Candidate Std Stats: {'Max': np.float64(1.61035990494078), 'Min': np.float64(0.0), 'Mean': np.float64(0.5619766011798101), 'Std': np.float64(0.30341925357899896)}
