[I 2024-12-28 15:03:52,125] Trial 120 finished with value: 1.5 and parameters: {'x_0_0': 'cd', 'x_0_1': 'oo', 'x_1_0': 'ad', 'x_1_1': 'cd'}. Best is trial 110 with value: 0.6964285714285714.
[I 2024-12-28 15:03:52,442] Trial 122 finished with value: 1.625 and parameters: {'x_0_0': 'oo', 'x_0_1': 'ad', 'x_1_0': 'oo', 'x_1_1': 'bc'}. Best is trial 17 with value: 0.5.
[I 2024-12-28 15:03:52,995] Trial 114 finished with value: 1.7142857142857144 and parameters: {'x_0_0': 'ab', 'x_0_1': 'ab', 'x_1_0': 'bd', 'x_1_1': 'ad'}. Best is trial 7 with value: 0.5.
[I 2024-12-28 15:03:53,001] Trial 110 finished with value: 1.4285714285714286 and parameters: {'x_0_0': 'bd', 'x_0_1': 'cd', 'x_1_0': 'ab', 'x_1_1': 'bc'}. Best is trial 47 with value: 0.6964285714285714.
[I 2024-12-28 15:03:53,490] Trial 123 finished with value: 2.0 and parameters: {'x_0_0': 'cd', 'x_0_1': 'ad', 'x_1_0': 'ab', 'x_1_1': 'ad'}. Best is trial 73 with value: 0.7857142857142857.
[I 2024-12-28 15:03:54,097] Trial 123 finished with value: 1.0 and parameters: {'x_0_0': 'bc', 'x_0_1': 'ad', 'x_1_0': 'ad', 'x_1_1': 'bc'}. Best is trial 15 with value: 0.6964285714285714.
[I 2024-12-28 15:03:55,251] Trial 123 finished with value: 1.5714285714285714 and parameters: {'x_0_0': 'bc', 'x_0_1': 'bd', 'x_1_0': 'cd', 'x_1_1': 'ad'}. Best is trial 120 with value: 0.7857142857142857.
[I 2024-12-28 15:03:56,423] Trial 111 finished with value: 1.5 and parameters: {'x_0_0': 'cd', 'x_0_1': 'oo', 'x_1_0': 'ab', 'x_1_1': 'ab'}. Best is trial 43 with value: 0.6964285714285714.
[I 2024-12-28 15:03:58,846] Trial 115 finished with value: 1.7142857142857144 and parameters: {'x_0_0': 'ab', 'x_0_1': 'ab', 'x_1_0': 'ad', 'x_1_1': 'ad'}. Best is trial 7 with value: 0.5.
[I 2024-12-28 15:03:58,857] Trial 121 finished with value: 1.5714285714285714 and parameters: {'x_0_0': 'bd', 'x_0_1': 'ad', 'x_1_0': 'cd', 'x_1_1': 'ab'}. Best is trial 110 with value: 0.6964285714285714.
[I 2024-12-28 15:04:00,190] Trial 124 finished with value: 1.875 and parameters: {'x_0_0': 'cd', 'x_0_1': 'ac', 'x_1_0': 'ac', 'x_1_1': 'oo'}. Best is trial 120 with value: 0.7857142857142857.
[I 2024-12-28 15:04:00,510] Trial 117 finished with value: 1.875 and parameters: {'x_0_0': 'cd', 'x_0_1': 'ac', 'x_1_0': 'ad', 'x_1_1': 'oo'}. Best is trial 107 with value: 0.6607142857142857.
[I 2024-12-28 15:04:01,167] Trial 124 finished with value: 1.0714285714285714 and parameters: {'x_0_0': 'bc', 'x_0_1': 'oo', 'x_1_0': 'ac', 'x_1_1': 'bd'}. Best is trial 73 with value: 0.7857142857142857.
[I 2024-12-28 15:04:01,789] Trial 111 finished with value: 1.4285714285714286 and parameters: {'x_0_0': 'bd', 'x_0_1': 'bc', 'x_1_0': 'ab', 'x_1_1': 'ad'}. Best is trial 47 with value: 0.6964285714285714.
[I 2024-12-28 15:04:02,310] Trial 123 finished with value: 1.3214285714285714 and parameters: {'x_0_0': 'bd', 'x_0_1': 'ad', 'x_1_0': 'oo', 'x_1_1': 'bc'}. Best is trial 17 with value: 0.5.
[I 2024-12-28 15:04:04,318] Trial 124 finished with value: 1.5714285714285714 and parameters: {'x_0_0': 'bc', 'x_0_1': 'bd', 'x_1_0': 'bd', 'x_1_1': 'ac'}. Best is trial 17 with value: 0.7857142857142857.
[I 2024-12-28 15:04:06,487] Trial 116 finished with value: 1.0714285714285714 and parameters: {'x_0_0': 'bd', 'x_0_1': 'oo', 'x_1_0': 'cd', 'x_1_1': 'ac'}. Best is trial 7 with value: 0.5.
[I 2024-12-28 15:04:06,704] Trial 125 finished with value: 1.2857142857142856 and parameters: {'x_0_0': 'bc', 'x_0_1': 'ac', 'x_1_0': 'cd', 'x_1_1': 'bc'}. Best is trial 120 with value: 0.7857142857142857.
[I 2024-12-28 15:04:07,569] Trial 122 finished with value: 1.75 and parameters: {'x_0_0': 'cd', 'x_0_1': 'ad', 'x_1_0': 'oo', 'x_1_1': 'ab'}. Best is trial 110 with value: 0.6964285714285714.
[I 2024-12-28 15:04:07,651] Trial 124 finished with value: 1.2857142857142856 and parameters: {'x_0_0': 'ad', 'x_0_1': 'bc', 'x_1_0': 'bc', 'x_1_1': 'bc'}. Best is trial 15 with value: 0.6964285714285714.
[I 2024-12-28 15:04:09,492] Trial 112 finished with value: 1.5 and parameters: {'x_0_0': 'cd', 'x_0_1': 'oo', 'x_1_0': 'bd', 'x_1_1': 'bd'}. Best is trial 47 with value: 0.6964285714285714.
[I 2024-12-28 15:04:09,523] Trial 112 finished with value: 1.875 and parameters: {'x_0_0': 'oo', 'x_0_1': 'cd', 'x_1_0': 'ab', 'x_1_1': 'bc'}. Best is trial 43 with value: 0.6964285714285714.
[I 2024-12-28 15:04:09,898] Trial 124 finished with value: 1.4285714285714286 and parameters: {'x_0_0': 'bd', 'x_0_1': 'ad', 'x_1_0': 'ab', 'x_1_1': 'bc'}. Best is trial 17 with value: 0.5.
[I 2024-12-28 15:04:11,058] Trial 125 finished with value: 1.5714285714285714 and parameters: {'x_0_0': 'bc', 'x_0_1': 'bd', 'x_1_0': 'bc', 'x_1_1': 'ac'}. Best is trial 17 with value: 0.7857142857142857.
[I 2024-12-28 15:04:12,363] Trial 118 finished with value: 0.9107142857142857 and parameters: {'x_0_0': 'ac', 'x_0_1': 'ac', 'x_1_0': 'oo', 'x_1_1': 'oo'}. Best is trial 107 with value: 0.6607142857142857.
[I 2024-12-28 15:04:13,053] Trial 125 finished with value: 2.0 and parameters: {'x_0_0': 'cd', 'x_0_1': 'ad', 'x_1_0': 'ad', 'x_1_1': 'bd'}. Best is trial 73 with value: 0.7857142857142857.
[I 2024-12-28 15:04:13,161] Trial 126 finished with value: 1.5 and parameters: {'x_0_0': 'cd', 'x_0_1': 'oo', 'x_1_0': 'ac', 'x_1_1': 'ad'}. Best is trial 120 with value: 0.7857142857142857.
[I 2024-12-28 15:04:15,468] Trial 117 finished with value: 2.0 and parameters: {'x_0_0': 'cd', 'x_0_1': 'ad', 'x_1_0': 'ad', 'x_1_1': 'ab'}. Best is trial 7 with value: 0.5.
[I 2024-12-28 15:04:16,771] Trial 113 finished with value: 1.375 and parameters: {'x_0_0': 'oo', 'x_0_1': 'oo', 'x_1_0': 'ab', 'x_1_1': 'ab'}. Best is trial 43 with value: 0.6964285714285714.
[I 2024-12-28 15:04:17,385] Trial 113 finished with value: 1.375 and parameters: {'x_0_0': 'oo', 'x_0_1': 'oo', 'x_1_0': 'ad', 'x_1_1': 'ab'}. Best is trial 47 with value: 0.6964285714285714.
[I 2024-12-28 15:04:19,056] Trial 125 finished with value: 2.0 and parameters: {'x_0_0': 'cd', 'x_0_1': 'bc', 'x_1_0': 'ab', 'x_1_1': 'ac'}. Best is trial 17 with value: 0.5.
[I 2024-12-28 15:04:20,465] Trial 126 finished with value: 1.0357142857142856 and parameters: {'x_0_0': 'bc', 'x_0_1': 'ac', 'x_1_0': 'oo', 'x_1_1': 'ac'}. Best is trial 17 with value: 0.7857142857142857.
[I 2024-12-28 15:04:20,476] Trial 123 finished with value: 0.8214285714285714 and parameters: {'x_0_0': 'ad', 'x_0_1': 'oo', 'x_1_0': 'oo', 'x_1_1': 'bd'}. Best is trial 110 with value: 0.6964285714285714.
[I 2024-12-28 15:04:21,909] Trial 125 finished with value: 1.5714285714285714 and parameters: {'x_0_0': 'bd', 'x_0_1': 'ac', 'x_1_0': 'ad', 'x_1_1': 'bc'}. Best is trial 15 with value: 0.6964285714285714.
[I 2024-12-28 15:04:22,677] Trial 119 finished with value: 1.375 and parameters: {'x_0_0': 'oo', 'x_0_1': 'oo', 'x_1_0': 'ab', 'x_1_1': 'bc'}. Best is trial 107 with value: 0.6607142857142857.
[I 2024-12-28 15:04:24,168] Trial 127 finished with value: 0.6964285714285714 and parameters: {'x_0_0': 'bd', 'x_0_1': 'oo', 'x_1_0': 'oo', 'x_1_1': 'oo'}. Best is trial 127 with value: 0.6964285714285714.
[I 2024-12-28 15:04:27,258] Trial 114 finished with value: 1.0357142857142856 and parameters: {'x_0_0': 'ac', 'x_0_1': 'ac', 'x_1_0': 'oo', 'x_1_1': 'cd'}. Best is trial 43 with value: 0.6964285714285714.
[I 2024-12-28 15:04:27,762] Trial 118 finished with value: 2.0 and parameters: {'x_0_0': 'cd', 'x_0_1': 'ad', 'x_1_0': 'bd', 'x_1_1': 'ac'}. Best is trial 7 with value: 0.5.
[I 2024-12-28 15:04:29,520] Trial 114 finished with value: 1.875 and parameters: {'x_0_0': 'oo', 'x_0_1': 'bc', 'x_1_0': 'ad', 'x_1_1': 'ab'}. Best is trial 47 with value: 0.6964285714285714.
[I 2024-12-28 15:04:29,612] Trial 126 finished with value: 2.0 and parameters: {'x_0_0': 'cd', 'x_0_1': 'cd', 'x_1_0': 'ab', 'x_1_1': 'ac'}. Best is trial 17 with value: 0.5.
[I 2024-12-28 15:04:30,193] Trial 127 finished with value: 1.2857142857142856 and parameters: {'x_0_0': 'bc', 'x_0_1': 'ad', 'x_1_0': 'bd', 'x_1_1': 'ac'}. Best is trial 17 with value: 0.7857142857142857.
[I 2024-12-28 15:04:31,352] Trial 128 finished with value: 2.0 and parameters: {'x_0_0': 'cd', 'x_0_1': 'ab', 'x_1_0': 'cd', 'x_1_1': 'ad'}. Best is trial 127 with value: 0.6964285714285714.
[I 2024-12-28 15:04:31,575] Trial 126 finished with value: 1.2857142857142856 and parameters: {'x_0_0': 'bc', 'x_0_1': 'ac', 'x_1_0': 'ac', 'x_1_1': 'bd'}. Best is trial 73 with value: 0.7857142857142857.
[I 2024-12-28 15:04:31,900] Trial 126 finished with value: 1.7142857142857144 and parameters: {'x_0_0': 'ab', 'x_0_1': 'ad', 'x_1_0': 'ad', 'x_1_1': 'bc'}. Best is trial 15 with value: 0.6964285714285714.
[I 2024-12-28 15:04:32,177] Trial 124 finished with value: 2.0 and parameters: {'x_0_0': 'cd', 'x_0_1': 'ad', 'x_1_0': 'bd', 'x_1_1': 'ab'}. Best is trial 110 with value: 0.6964285714285714.
[I 2024-12-28 15:04:36,719] Trial 128 finished with value: 1.2857142857142856 and parameters: {'x_0_0': 'bc', 'x_0_1': 'ad', 'x_1_0': 'ad', 'x_1_1': 'ac'}. Best is trial 17 with value: 0.7857142857142857.
[I 2024-12-28 15:04:38,285] Trial 115 finished with value: 2.0 and parameters: {'x_0_0': 'cd', 'x_0_1': 'ad', 'x_1_0': 'bc', 'x_1_1': 'ad'}. Best is trial 43 with value: 0.6964285714285714.
[I 2024-12-28 15:04:39,361] Trial 127 finished with value: 1.5714285714285714 and parameters: {'x_0_0': 'bc', 'x_0_1': 'cd', 'x_1_0': 'ab', 'x_1_1': 'bd'}. Best is trial 73 with value: 0.7857142857142857.
[I 2024-12-28 15:04:40,073] Trial 129 finished with value: 1.5 and parameters: {'x_0_0': 'cd', 'x_0_1': 'oo', 'x_1_0': 'ad', 'x_1_1': 'bd'}. Best is trial 127 with value: 0.6964285714285714.
[I 2024-12-28 15:04:40,206] Trial 125 finished with value: 2.0 and parameters: {'x_0_0': 'cd', 'x_0_1': 'ac', 'x_1_0': 'ac', 'x_1_1': 'bd'}. Best is trial 110 with value: 0.6964285714285714.
[I 2024-12-28 15:04:40,731] Trial 120 finished with value: 1.2857142857142856 and parameters: {'x_0_0': 'bd', 'x_0_1': 'cd', 'x_1_0': 'bd', 'x_1_1': 'bc'}. Best is trial 107 with value: 0.6607142857142857.
[I 2024-12-28 15:04:44,916] Trial 127 finished with value: 1.375 and parameters: {'x_0_0': 'oo', 'x_0_1': 'oo', 'x_1_0': 'ab', 'x_1_1': 'bc'}. Best is trial 17 with value: 0.5.
[I 2024-12-28 15:04:45,062] Trial 115 finished with value: 1.75 and parameters: {'x_0_0': 'cd', 'x_0_1': 'bc', 'x_1_0': 'oo', 'x_1_1': 'bc'}. Best is trial 47 with value: 0.6964285714285714.
[I 2024-12-28 15:04:45,078] Trial 128 finished with value: 1.0714285714285714 and parameters: {'x_0_0': 'ac', 'x_0_1': 'oo', 'x_1_0': 'ab', 'x_1_1': 'ac'}. Best is trial 73 with value: 0.7857142857142857.
[I 2024-12-28 15:04:45,139] Trial 119 finished with value: 1.0714285714285714 and parameters: {'x_0_0': 'bc', 'x_0_1': 'oo', 'x_1_0': 'ab', 'x_1_1': 'ad'}. Best is trial 7 with value: 0.5.
[I 2024-12-28 15:04:47,222] Trial 129 finished with value: 1.375 and parameters: {'x_0_0': 'oo', 'x_0_1': 'oo', 'x_1_0': 'cd', 'x_1_1': 'ab'}. Best is trial 17 with value: 0.7857142857142857.
[I 2024-12-28 15:04:47,875] Trial 126 finished with value: 1.3214285714285714 and parameters: {'x_0_0': 'ad', 'x_0_1': 'ac', 'x_1_0': 'oo', 'x_1_1': 'bd'}. Best is trial 110 with value: 0.6964285714285714.
[I 2024-12-28 15:04:47,894] Trial 116 finished with value: 1.625 and parameters: {'x_0_0': 'oo', 'x_0_1': 'cd', 'x_1_0': 'oo', 'x_1_1': 'ad'}. Best is trial 43 with value: 0.6964285714285714.
[I 2024-12-28 15:04:48,165] Trial 127 finished with value: 2.0 and parameters: {'x_0_0': 'cd', 'x_0_1': 'ad', 'x_1_0': 'ac', 'x_1_1': 'ac'}. Best is trial 15 with value: 0.6964285714285714.
[I 2024-12-28 15:04:49,301] Trial 129 finished with value: 0.9285714285714286 and parameters: {'x_0_0': 'bd', 'x_0_1': 'oo', 'x_1_0': 'ab', 'x_1_1': 'cd'}. Best is trial 73 with value: 0.7857142857142857.
[I 2024-12-28 15:04:51,609] Trial 121 finished with value: 1.875 and parameters: {'x_0_0': 'oo', 'x_0_1': 'ab', 'x_1_0': 'ad', 'x_1_1': 'cd'}. Best is trial 107 with value: 0.6607142857142857.
[I 2024-12-28 15:04:52,699] Trial 120 finished with value: 1.0714285714285714 and parameters: {'x_0_0': 'bc', 'x_0_1': 'oo', 'x_1_0': 'ac', 'x_1_1': 'ad'}. Best is trial 7 with value: 0.5.
[I 2024-12-28 15:04:52,920] Trial 127 finished with value: 1.5 and parameters: {'x_0_0': 'cd', 'x_0_1': 'oo', 'x_1_0': 'ac', 'x_1_1': 'bd'}. Best is trial 110 with value: 0.6964285714285714.
[I 2024-12-28 15:04:56,119] Trial 128 finished with value: 1.0714285714285714 and parameters: {'x_0_0': 'bc', 'x_0_1': 'oo', 'x_1_0': 'bc', 'x_1_1': 'bc'}. Best is trial 17 with value: 0.5.
[I 2024-12-28 15:04:56,901] Trial 116 finished with value: 1.875 and parameters: {'x_0_0': 'oo', 'x_0_1': 'bd', 'x_1_0': 'ad', 'x_1_1': 'ab'}. Best is trial 47 with value: 0.6964285714285714.
[I 2024-12-28 15:04:56,995] Trial 130 finished with value: 1.3214285714285714 and parameters: {'x_0_0': 'bc', 'x_0_1': 'bd', 'x_1_0': 'oo', 'x_1_1': 'ad'}. Best is trial 127 with value: 0.6964285714285714.
[I 2024-12-28 15:04:57,180] Trial 128 finished with value: 2.0 and parameters: {'x_0_0': 'cd', 'x_0_1': 'bc', 'x_1_0': 'bc', 'x_1_1': 'bd'}. Best is trial 15 with value: 0.6964285714285714.
[I 2024-12-28 15:04:58,915] Trial 130 finished with value: 1.375 and parameters: {'x_0_0': 'oo', 'x_0_1': 'oo', 'x_1_0': 'ad', 'x_1_1': 'bc'}. Best is trial 17 with value: 0.7857142857142857.
[I 2024-12-28 15:04:59,582] Trial 117 finished with value: 1.7142857142857144 and parameters: {'x_0_0': 'ab', 'x_0_1': 'cd', 'x_1_0': 'bc', 'x_1_1': 'ad'}. Best is trial 43 with value: 0.6964285714285714.
[I 2024-12-28 15:05:01,379] Trial 121 finished with value: 1.2857142857142856 and parameters: {'x_0_0': 'bc', 'x_0_1': 'ad', 'x_1_0': 'bc', 'x_1_1': 'ad'}. Best is trial 7 with value: 0.5.
[I 2024-12-28 15:05:01,475] Trial 130 finished with value: 1.2857142857142856 and parameters: {'x_0_0': 'ad', 'x_0_1': 'bd', 'x_1_0': 'bc', 'x_1_1': 'bd'}. Best is trial 73 with value: 0.7857142857142857.
[I 2024-12-28 15:05:04,551] Trial 129 finished with value: 1.875 and parameters: {'x_0_0': 'oo', 'x_0_1': 'bc', 'x_1_0': 'ab', 'x_1_1': 'bc'}. Best is trial 17 with value: 0.5.
[I 2024-12-28 15:05:05,331] Trial 131 finished with value: 1.5714285714285714 and parameters: {'x_0_0': 'ad', 'x_0_1': 'ac', 'x_1_0': 'ac', 'x_1_1': 'ac'}. Best is trial 127 with value: 0.6964285714285714.
[I 2024-12-28 15:05:06,472] Trial 122 finished with value: 1.3214285714285714 and parameters: {'x_0_0': 'bd', 'x_0_1': 'ab', 'x_1_0': 'oo', 'x_1_1': 'ad'}. Best is trial 7 with value: 0.5.
[I 2024-12-28 15:05:07,101] Trial 129 finished with value: 1.5714285714285714 and parameters: {'x_0_0': 'ad', 'x_0_1': 'ad', 'x_1_0': 'ad', 'x_1_1': 'bc'}. Best is trial 15 with value: 0.6964285714285714.
[I 2024-12-28 15:05:07,561] Trial 128 finished with value: 1.5 and parameters: {'x_0_0': 'cd', 'x_0_1': 'oo', 'x_1_0': 'ac', 'x_1_1': 'bc'}. Best is trial 110 with value: 0.6964285714285714.
[I 2024-12-28 15:05:09,014] Trial 122 finished with value: 1.0714285714285714 and parameters: {'x_0_0': 'bc', 'x_0_1': 'oo', 'x_1_0': 'ad', 'x_1_1': 'cd'}. Best is trial 107 with value: 0.6607142857142857.
[I 2024-12-28 15:05:09,781] Trial 131 finished with value: 1.5714285714285714 and parameters: {'x_0_0': 'ad', 'x_0_1': 'bd', 'x_1_0': 'cd', 'x_1_1': 'bd'}. Best is trial 73 with value: 0.7857142857142857.
[I 2024-12-28 15:05:09,899] Trial 117 finished with value: 2.0 and parameters: {'x_0_0': 'cd', 'x_0_1': 'bc', 'x_1_0': 'bd', 'x_1_1': 'bc'}. Best is trial 47 with value: 0.6964285714285714.
[I 2024-12-28 15:05:11,131] Trial 131 finished with value: 1.375 and parameters: {'x_0_0': 'oo', 'x_0_1': 'oo', 'x_1_0': 'ad', 'x_1_1': 'bd'}. Best is trial 17 with value: 0.7857142857142857.
[I 2024-12-28 15:05:11,485] Trial 118 finished with value: 1.0714285714285714 and parameters: {'x_0_0': 'ac', 'x_0_1': 'oo', 'x_1_0': 'ab', 'x_1_1': 'ad'}. Best is trial 43 with value: 0.6964285714285714.
[I 2024-12-28 15:05:11,530] Trial 132 finished with value: 1.75 and parameters: {'x_0_0': 'cd', 'x_0_1': 'ac', 'x_1_0': 'oo', 'x_1_1': 'cd'}. Best is trial 127 with value: 0.6964285714285714.
[I 2024-12-28 15:05:12,340] Trial 123 finished with value: 1.875 and parameters: {'x_0_0': 'oo', 'x_0_1': 'ad', 'x_1_0': 'ab', 'x_1_1': 'bd'}. Best is trial 7 with value: 0.5.
[I 2024-12-28 15:05:12,470] Trial 132 finished with value: 1.4285714285714286 and parameters: {'x_0_0': 'bd', 'x_0_1': 'ab', 'x_1_0': 'ab', 'x_1_1': 'ac'}. Best is trial 73 with value: 0.7857142857142857.
[I 2024-12-28 15:05:14,194] Trial 129 finished with value: 1.5714285714285714 and parameters: {'x_0_0': 'ac', 'x_0_1': 'bd', 'x_1_0': 'cd', 'x_1_1': 'ac'}. Best is trial 110 with value: 0.6964285714285714.
[I 2024-12-28 15:05:14,960] Trial 130 finished with value: 1.4285714285714286 and parameters: {'x_0_0': 'bd', 'x_0_1': 'ad', 'x_1_0': 'ab', 'x_1_1': 'ac'}. Best is trial 17 with value: 0.5.
[I 2024-12-28 15:05:16,610] Trial 123 finished with value: 1.625 and parameters: {'x_0_0': 'cd', 'x_0_1': 'ac', 'x_1_0': 'oo', 'x_1_1': 'oo'}. Best is trial 107 with value: 0.6607142857142857.
[I 2024-12-28 15:05:16,703] Trial 130 finished with value: 1.4464285714285714 and parameters: {'x_0_0': 'bd', 'x_0_1': 'ad', 'x_1_0': 'ad', 'x_1_1': 'oo'}. Best is trial 15 with value: 0.6964285714285714.
[I 2024-12-28 15:05:18,083] Trial 133 finished with value: 1.5714285714285714 and parameters: {'x_0_0': 'ad', 'x_0_1': 'bd', 'x_1_0': 'ac', 'x_1_1': 'bd'}. Best is trial 73 with value: 0.7857142857142857.
[I 2024-12-28 15:05:18,893] Trial 131 finished with value: 1.4285714285714286 and parameters: {'x_0_0': 'ac', 'x_0_1': 'ab', 'x_1_0': 'bc', 'x_1_1': 'bd'}. Best is trial 17 with value: 0.5.
[I 2024-12-28 15:05:18,943] Trial 124 finished with value: 2.0 and parameters: {'x_0_0': 'cd', 'x_0_1': 'ab', 'x_1_0': 'ad', 'x_1_1': 'ac'}. Best is trial 7 with value: 0.5.
[I 2024-12-28 15:05:21,188] Trial 130 finished with value: 1.5714285714285714 and parameters: {'x_0_0': 'ac', 'x_0_1': 'bd', 'x_1_0': 'ac', 'x_1_1': 'cd'}. Best is trial 110 with value: 0.6964285714285714.
[I 2024-12-28 15:05:21,276] Trial 132 finished with value: 1.7142857142857144 and parameters: {'x_0_0': 'ab', 'x_0_1': 'bc', 'x_1_0': 'ad', 'x_1_1': 'ad'}. Best is trial 17 with value: 0.7857142857142857.
[I 2024-12-28 15:05:21,608] Trial 118 finished with value: 1.5714285714285714 and parameters: {'x_0_0': 'bd', 'x_0_1': 'bd', 'x_1_0': 'ad', 'x_1_1': 'cd'}. Best is trial 47 with value: 0.6964285714285714.
[I 2024-12-28 15:05:25,509] Trial 134 finished with value: 1.0 and parameters: {'x_0_0': 'ad', 'x_0_1': 'bd', 'x_1_0': 'bc', 'x_1_1': 'ad'}. Best is trial 73 with value: 0.7857142857142857.
[I 2024-12-28 15:05:25,815] Trial 133 finished with value: 1.5714285714285714 and parameters: {'x_0_0': 'bd', 'x_0_1': 'ad', 'x_1_0': 'cd', 'x_1_1': 'bc'}. Best is trial 127 with value: 0.6964285714285714.
[I 2024-12-28 15:05:26,463] Trial 133 finished with value: 1.7142857142857144 and parameters: {'x_0_0': 'ab', 'x_0_1': 'bc', 'x_1_0': 'ad', 'x_1_1': 'ac'}. Best is trial 17 with value: 0.7857142857142857.
[I 2024-12-28 15:05:26,673] Trial 119 finished with value: 1.2857142857142856 and parameters: {'x_0_0': 'bd', 'x_0_1': 'bc', 'x_1_0': 'bd', 'x_1_1': 'ab'}. Best is trial 43 with value: 0.6964285714285714.
[I 2024-12-28 15:05:27,139] Trial 132 finished with value: 1.5714285714285714 and parameters: {'x_0_0': 'bd', 'x_0_1': 'bd', 'x_1_0': 'cd', 'x_1_1': 'ad'}. Best is trial 17 with value: 0.5.
[I 2024-12-28 15:05:27,392] Trial 125 finished with value: 2.0 and parameters: {'x_0_0': 'cd', 'x_0_1': 'ad', 'x_1_0': 'ad', 'x_1_1': 'bd'}. Best is trial 7 with value: 0.5.
[I 2024-12-28 15:05:27,839] Trial 131 finished with value: 1.2857142857142856 and parameters: {'x_0_0': 'bc', 'x_0_1': 'ac', 'x_1_0': 'ad', 'x_1_1': 'bc'}. Best is trial 15 with value: 0.6964285714285714.
[I 2024-12-28 15:05:28,548] Trial 124 finished with value: 2.0 and parameters: {'x_0_0': 'cd', 'x_0_1': 'ad', 'x_1_0': 'ab', 'x_1_1': 'bc'}. Best is trial 107 with value: 0.6607142857142857.
[I 2024-12-28 15:05:29,751] Trial 119 finished with value: 1.4285714285714286 and parameters: {'x_0_0': 'bd', 'x_0_1': 'bd', 'x_1_0': 'ab', 'x_1_1': 'cd'}. Best is trial 47 with value: 0.6964285714285714.
[I 2024-12-28 15:05:29,804] Trial 134 finished with value: 1.2142857142857144 and parameters: {'x_0_0': 'ab', 'x_0_1': 'oo', 'x_1_0': 'bd', 'x_1_1': 'ac'}. Best is trial 17 with value: 0.7857142857142857.
[I 2024-12-28 15:05:31,111] Trial 134 finished with value: 1.5714285714285714 and parameters: {'x_0_0': 'bc', 'x_0_1': 'bc', 'x_1_0': 'cd', 'x_1_1': 'ad'}. Best is trial 127 with value: 0.6964285714285714.
[I 2024-12-28 15:05:32,517] Trial 131 finished with value: 1.5 and parameters: {'x_0_0': 'cd', 'x_0_1': 'oo', 'x_1_0': 'cd', 'x_1_1': 'bc'}. Best is trial 110 with value: 0.6964285714285714.
[I 2024-12-28 15:05:32,880] Trial 133 finished with value: 1.2857142857142856 and parameters: {'x_0_0': 'ac', 'x_0_1': 'ac', 'x_1_0': 'bc', 'x_1_1': 'bd'}. Best is trial 17 with value: 0.5.
[I 2024-12-28 15:05:34,763] Trial 135 finished with value: 1.375 and parameters: {'x_0_0': 'oo', 'x_0_1': 'oo', 'x_1_0': 'bc', 'x_1_1': 'ac'}. Best is trial 17 with value: 0.7857142857142857.
[I 2024-12-28 15:05:35,261] Trial 120 finished with value: 1.2857142857142856 and parameters: {'x_0_0': 'bd', 'x_0_1': 'bc', 'x_1_0': 'bd', 'x_1_1': 'bc'}. Best is trial 43 with value: 0.6964285714285714.
[I 2024-12-28 15:05:35,779] Trial 120 finished with value: 1.875 and parameters: {'x_0_0': 'oo', 'x_0_1': 'cd', 'x_1_0': 'ab', 'x_1_1': 'cd'}. Best is trial 47 with value: 0.6964285714285714.
[I 2024-12-28 15:05:35,821] Trial 135 finished with value: 1.4285714285714286 and parameters: {'x_0_0': 'ac', 'x_0_1': 'ab', 'x_1_0': 'ab', 'x_1_1': 'bc'}. Best is trial 73 with value: 0.7857142857142857.
[I 2024-12-28 15:05:39,170] Trial 126 finished with value: 1.5714285714285714 and parameters: {'x_0_0': 'bd', 'x_0_1': 'ab', 'x_1_0': 'ad', 'x_1_1': 'ac'}. Best is trial 7 with value: 0.5.
