[I 2024-12-06 23:42:35,174] Trial 9 finished with value: 1.3666666666666667 and parameters: {'x_0_0': 'bc', 'x_0_1': 'bc', 'x_0_2': 'cd', 'x_1_0': 'oo', 'x_1_1': 'oo', 'x_1_2': 'bd'}. Best is trial 7 with value: 1.077777777777778.
2024-12-06 23:42:35,214 - INFO - Candidate Mean Stats: {'Max': np.float64(1.7), 'Min': np.float64(0.23743763530491369), 'Mean': np.float64(0.4977954508273864), 'Std': np.float64(0.0702044674048157)}
2024-12-06 23:42:35,214 - INFO - Candidate Std Stats: {'Max': np.float64(1.5979335771769692), 'Min': np.float64(0.0), 'Mean': np.float64(0.1256339342088788), 'Std': np.float64(0.06165796629009324)}
[I 2024-12-06 23:42:35,255] Trial 9 finished with value: 1.2666666666666666 and parameters: {'x_0_0': 'bd', 'x_0_1': 'oo', 'x_0_2': 'cd', 'x_1_0': 'cd', 'x_1_1': 'ac', 'x_1_2': 'bc'}. Best is trial 2 with value: 0.9666666666666667.
2024-12-06 23:42:35,702 - INFO - Candidate Mean Stats: {'Max': np.float64(1.9), 'Min': np.float64(0.18857803246095522), 'Mean': np.float64(0.49249612668408954), 'Std': np.float64(0.0680023561232121)}
2024-12-06 23:42:35,703 - INFO - Candidate Std Stats: {'Max': np.float64(1.533860486950609), 'Min': np.float64(0.0), 'Mean': np.float64(0.12105489696187016), 'Std': np.float64(0.06385313787684474)}
[I 2024-12-06 23:42:35,744] Trial 9 finished with value: 1.2 and parameters: {'x_0_0': 'oo', 'x_0_1': 'oo', 'x_0_2': 'oo', 'x_1_0': 'ab', 'x_1_1': 'oo', 'x_1_2': 'oo'}. Best is trial 9 with value: 1.2.
2024-12-06 23:42:55,398 - INFO - Candidate Mean Stats: {'Max': np.float64(1.9), 'Min': np.float64(0.2907338186589433), 'Mean': np.float64(0.48933517233000967), 'Std': np.float64(0.05255372524872168)}
2024-12-06 23:42:55,399 - INFO - Candidate Std Stats: {'Max': np.float64(0.5065315302149456), 'Min': np.float64(0.0), 'Mean': np.float64(0.10137599641075261), 'Std': np.float64(0.04085900130655934)}
[I 2024-12-06 23:42:55,447] Trial 10 finished with value: 1.5555555555555556 and parameters: {'x_0_0': 'ad', 'x_0_1': 'ad', 'x_0_2': 'ad', 'x_1_0': 'ab', 'x_1_1': 'bd', 'x_1_2': 'cd'}. Best is trial 2 with value: 1.2222222222222223.
2024-12-06 23:42:57,142 - INFO - Candidate Mean Stats: {'Max': np.float64(1.9), 'Min': np.float64(0.249933385503251), 'Mean': np.float64(0.47673628400162144), 'Std': np.float64(0.05984523749611148)}
2024-12-06 23:42:57,142 - INFO - Candidate Std Stats: {'Max': np.float64(0.8162863846195549), 'Min': np.float64(0.0), 'Mean': np.float64(0.10692601261263865), 'Std': np.float64(0.04827330607157399)}
[I 2024-12-06 23:42:57,188] Trial 10 finished with value: 1.7777777777777777 and parameters: {'x_0_0': 'ab', 'x_0_1': 'ab', 'x_0_2': 'bc', 'x_1_0': 'ab', 'x_1_1': 'ab', 'x_1_2': 'bc'}. Best is trial 7 with value: 1.077777777777778.
2024-12-06 23:42:57,296 - INFO - Candidate Mean Stats: {'Max': np.float64(1.7), 'Min': np.float64(0.24557713878409623), 'Mean': np.float64(0.487576159875204), 'Std': np.float64(0.05988163367675799)}
2024-12-06 23:42:57,297 - INFO - Candidate Std Stats: {'Max': np.float64(1.568751029354785), 'Min': np.float64(0.0), 'Mean': np.float64(0.11011685820789269), 'Std': np.float64(0.05311688960910885)}
[I 2024-12-06 23:42:57,343] Trial 10 finished with value: 1.4555555555555557 and parameters: {'x_0_0': 'ad', 'x_0_1': 'bc', 'x_0_2': 'bd', 'x_1_0': 'ab', 'x_1_1': 'oo', 'x_1_2': 'bd'}. Best is trial 2 with value: 0.9666666666666667.
2024-12-06 23:42:58,029 - INFO - Candidate Mean Stats: {'Max': np.float64(1.9), 'Min': np.float64(0.2651488183006291), 'Mean': np.float64(0.48810623510695483), 'Std': np.float64(0.06493511987395797)}
2024-12-06 23:42:58,030 - INFO - Candidate Std Stats: {'Max': np.float64(0.7788445981406673), 'Min': np.float64(0.0), 'Mean': np.float64(0.12014093363009808), 'Std': np.float64(0.052634792378060534)}
[I 2024-12-06 23:42:58,080] Trial 10 finished with value: 1.4444444444444444 and parameters: {'x_0_0': 'bd', 'x_0_1': 'cd', 'x_0_2': 'bc', 'x_1_0': 'bd', 'x_1_1': 'bd', 'x_1_2': 'bd'}. Best is trial 9 with value: 1.2.
2024-12-06 23:43:18,282 - INFO - Candidate Mean Stats: {'Max': np.float64(1.9), 'Min': np.float64(0.30968403612801376), 'Mean': np.float64(0.4936132549527677), 'Std': np.float64(0.05227337677824298)}
2024-12-06 23:43:18,283 - INFO - Candidate Std Stats: {'Max': np.float64(0.37228012262346516), 'Min': np.float64(0.0), 'Mean': np.float64(0.1025740526530948), 'Std': np.float64(0.0408475940968402)}
[I 2024-12-06 23:43:18,330] Trial 11 finished with value: 1.7999999999999998 and parameters: {'x_0_0': 'oo', 'x_0_1': 'ad', 'x_0_2': 'bd', 'x_1_0': 'bd', 'x_1_1': 'ab', 'x_1_2': 'oo'}. Best is trial 2 with value: 1.2222222222222223.
2024-12-06 23:43:19,741 - INFO - Candidate Mean Stats: {'Max': np.float64(1.9), 'Min': np.float64(0.2321796887033809), 'Mean': np.float64(0.48478120235429134), 'Std': np.float64(0.0565897453544574)}
2024-12-06 23:43:19,741 - INFO - Candidate Std Stats: {'Max': np.float64(0.44359322604432844), 'Min': np.float64(0.0), 'Mean': np.float64(0.10291225767306533), 'Std': np.float64(0.0441279725510842)}
2024-12-06 23:43:19,773 - INFO - Candidate Mean Stats: {'Max': np.float64(1.7), 'Min': np.float64(0.23425415393741572), 'Mean': np.float64(0.4978426573310364), 'Std': np.float64(0.06051667413088608)}
2024-12-06 23:43:19,773 - INFO - Candidate Std Stats: {'Max': np.float64(0.3582175468962983), 'Min': np.float64(0.0), 'Mean': np.float64(0.09955028732094452), 'Std': np.float64(0.04191175606791724)}
[I 2024-12-06 23:43:19,785] Trial 11 finished with value: 1.7999999999999998 and parameters: {'x_0_0': 'cd', 'x_0_1': 'bd', 'x_0_2': 'ab', 'x_1_0': 'oo', 'x_1_1': 'bd', 'x_1_2': 'bd'}. Best is trial 7 with value: 1.077777777777778.
[I 2024-12-06 23:43:19,815] Trial 11 finished with value: 1.6777777777777776 and parameters: {'x_0_0': 'ab', 'x_0_1': 'ac', 'x_0_2': 'oo', 'x_1_0': 'cd', 'x_1_1': 'cd', 'x_1_2': 'ad'}. Best is trial 2 with value: 0.9666666666666667.
2024-12-06 23:43:20,814 - INFO - Candidate Mean Stats: {'Max': np.float64(1.9), 'Min': np.float64(0.24749093860591573), 'Mean': np.float64(0.494554678926666), 'Std': np.float64(0.059101920833769556)}
2024-12-06 23:43:20,814 - INFO - Candidate Std Stats: {'Max': np.float64(0.41505532172030574), 'Min': np.float64(0.0), 'Mean': np.float64(0.1064480248690836), 'Std': np.float64(0.04332153418162723)}
[I 2024-12-06 23:43:20,866] Trial 11 finished with value: 1.2222222222222223 and parameters: {'x_0_0': 'ac', 'x_0_1': 'ac', 'x_0_2': 'ac', 'x_1_0': 'ac', 'x_1_1': 'bc', 'x_1_2': 'cd'}. Best is trial 9 with value: 1.2.
2024-12-06 23:43:41,611 - INFO - Candidate Mean Stats: {'Max': np.float64(1.9), 'Min': np.float64(0.29605958802020294), 'Mean': np.float64(0.49063878758130464), 'Std': np.float64(0.05611895863134659)}
2024-12-06 23:43:41,612 - INFO - Candidate Std Stats: {'Max': np.float64(0.44555250440878486), 'Min': np.float64(0.0), 'Mean': np.float64(0.09548812992758901), 'Std': np.float64(0.040544618040172176)}
[I 2024-12-06 23:43:41,660] Trial 12 finished with value: 1.2666666666666666 and parameters: {'x_0_0': 'bc', 'x_0_1': 'oo', 'x_0_2': 'ab', 'x_1_0': 'bd', 'x_1_1': 'bc', 'x_1_2': 'cd'}. Best is trial 2 with value: 1.2222222222222223.
2024-12-06 23:43:42,981 - INFO - Candidate Mean Stats: {'Max': np.float64(1.9), 'Min': np.float64(0.22184500831049608), 'Mean': np.float64(0.49129813953837065), 'Std': np.float64(0.06634393007026934)}
2024-12-06 23:43:42,981 - INFO - Candidate Std Stats: {'Max': np.float64(1.1398055298850447), 'Min': np.float64(0.0), 'Mean': np.float64(0.11632543585424741), 'Std': np.float64(0.05437975004136675)}
[I 2024-12-06 23:43:43,027] Trial 12 finished with value: 1.6666666666666665 and parameters: {'x_0_0': 'ac', 'x_0_1': 'bd', 'x_0_2': 'bc', 'x_1_0': 'ad', 'x_1_1': 'ab', 'x_1_2': 'ab'}. Best is trial 7 with value: 1.077777777777778.
2024-12-06 23:43:43,204 - INFO - Candidate Mean Stats: {'Max': np.float64(1.7), 'Min': np.float64(0.26676139711686936), 'Mean': np.float64(0.48774896970296727), 'Std': np.float64(0.06045715626513564)}
2024-12-06 23:43:43,204 - INFO - Candidate Std Stats: {'Max': np.float64(1.3556535839078232), 'Min': np.float64(0.0), 'Mean': np.float64(0.122595814570326), 'Std': np.float64(0.059372872406167905)}
[I 2024-12-06 23:43:43,244] Trial 12 finished with value: 2.0 and parameters: {'x_0_0': 'cd', 'x_0_1': 'bc', 'x_0_2': 'cd', 'x_1_0': 'cd', 'x_1_1': 'ac', 'x_1_2': 'ac'}. Best is trial 2 with value: 0.9666666666666667.
2024-12-06 23:43:44,268 - INFO - Candidate Mean Stats: {'Max': np.float64(1.9), 'Min': np.float64(0.2634522150502542), 'Mean': np.float64(0.4854058625850293), 'Std': np.float64(0.062041444781970954)}
2024-12-06 23:43:44,268 - INFO - Candidate Std Stats: {'Max': np.float64(0.4637043596186097), 'Min': np.float64(0.0), 'Mean': np.float64(0.1075670607455228), 'Std': np.float64(0.048782487653477216)}
[I 2024-12-06 23:43:44,312] Trial 12 finished with value: 1.1444444444444444 and parameters: {'x_0_0': 'ac', 'x_0_1': 'ac', 'x_0_2': 'oo', 'x_1_0': 'bd', 'x_1_1': 'oo', 'x_1_2': 'oo'}. Best is trial 12 with value: 1.1444444444444444.
2024-12-06 23:44:03,529 - INFO - Candidate Mean Stats: {'Max': np.float64(1.9), 'Min': np.float64(0.22285321133460462), 'Mean': np.float64(0.4982511458974602), 'Std': np.float64(0.06671410297731017)}
2024-12-06 23:44:03,530 - INFO - Candidate Std Stats: {'Max': np.float64(0.5027581618141421), 'Min': np.float64(0.0), 'Mean': np.float64(0.10848751900217483), 'Std': np.float64(0.04427065416354531)}
[I 2024-12-06 23:44:03,591] Trial 13 finished with value: 1.4444444444444444 and parameters: {'x_0_0': 'bd', 'x_0_1': 'ac', 'x_0_2': 'ab', 'x_1_0': 'bd', 'x_1_1': 'ab', 'x_1_2': 'bc'}. Best is trial 2 with value: 1.2222222222222223.
2024-12-06 23:44:05,083 - INFO - Candidate Mean Stats: {'Max': np.float64(1.9), 'Min': np.float64(0.26568250197962734), 'Mean': np.float64(0.4890693711275885), 'Std': np.float64(0.0574694495950152)}
2024-12-06 23:44:05,084 - INFO - Candidate Std Stats: {'Max': np.float64(0.7252505809185332), 'Min': np.float64(0.0), 'Mean': np.float64(0.11515104509463547), 'Std': np.float64(0.0518013306123441)}
[I 2024-12-06 23:44:05,137] Trial 13 finished with value: 1.9 and parameters: {'x_0_0': 'oo', 'x_0_1': 'ad', 'x_0_2': 'ad', 'x_1_0': 'ab', 'x_1_1': 'ab', 'x_1_2': 'ab'}. Best is trial 7 with value: 1.077777777777778.
2024-12-06 23:44:05,309 - INFO - Candidate Mean Stats: {'Max': np.float64(2.0), 'Min': np.float64(0.22532622936950344), 'Mean': np.float64(0.47880993695566815), 'Std': np.float64(0.05917627203677071)}
2024-12-06 23:44:05,310 - INFO - Candidate Std Stats: {'Max': np.float64(0.3765570602155107), 'Min': np.float64(0.0), 'Mean': np.float64(0.11102357448676861), 'Std': np.float64(0.04561045862370987)}
[I 2024-12-06 23:44:05,362] Trial 13 finished with value: 1.0 and parameters: {'x_0_0': 'bd', 'x_0_1': 'bc', 'x_0_2': 'bd', 'x_1_0': 'bc', 'x_1_1': 'ac', 'x_1_2': 'ac'}. Best is trial 2 with value: 0.9666666666666667.
2024-12-06 23:44:06,804 - INFO - Candidate Mean Stats: {'Max': np.float64(1.9), 'Min': np.float64(0.26802690272589463), 'Mean': np.float64(0.49026870662060984), 'Std': np.float64(0.05914897056056961)}
2024-12-06 23:44:06,805 - INFO - Candidate Std Stats: {'Max': np.float64(0.3823184826477728), 'Min': np.float64(0.0), 'Mean': np.float64(0.10971837211969389), 'Std': np.float64(0.04619697113679033)}
[I 2024-12-06 23:44:06,863] Trial 13 finished with value: 1.1222222222222222 and parameters: {'x_0_0': 'bd', 'x_0_1': 'bd', 'x_0_2': 'cd', 'x_1_0': 'bc', 'x_1_1': 'ad', 'x_1_2': 'oo'}. Best is trial 13 with value: 1.1222222222222222.
2024-12-06 23:44:28,351 - INFO - Candidate Mean Stats: {'Max': np.float64(1.9), 'Min': np.float64(0.2307876708584403), 'Mean': np.float64(0.4867149041814281), 'Std': np.float64(0.06490385648682712)}
2024-12-06 23:44:28,353 - INFO - Candidate Std Stats: {'Max': np.float64(0.7332392169882564), 'Min': np.float64(0.0), 'Mean': np.float64(0.11805189442921936), 'Std': np.float64(0.05479219025607769)}
[I 2024-12-06 23:44:28,404] Trial 14 finished with value: 1.6 and parameters: {'x_0_0': 'cd', 'x_0_1': 'oo', 'x_0_2': 'bd', 'x_1_0': 'ac', 'x_1_1': 'ab', 'x_1_2': 'bd'}. Best is trial 2 with value: 1.2222222222222223.
2024-12-06 23:44:29,854 - INFO - Candidate Mean Stats: {'Max': np.float64(1.9), 'Min': np.float64(0.19041129240584337), 'Mean': np.float64(0.4949457217700594), 'Std': np.float64(0.06263300085338733)}
2024-12-06 23:44:29,854 - INFO - Candidate Std Stats: {'Max': np.float64(0.4248790294133038), 'Min': np.float64(0.0), 'Mean': np.float64(0.10742873367031158), 'Std': np.float64(0.047003002428155596)}
[I 2024-12-06 23:44:29,907] Trial 14 finished with value: 1.9 and parameters: {'x_0_0': 'cd', 'x_0_1': 'bc', 'x_0_2': 'oo', 'x_1_0': 'ad', 'x_1_1': 'cd', 'x_1_2': 'ab'}. Best is trial 7 with value: 1.077777777777778.
2024-12-06 23:44:29,974 - INFO - Candidate Mean Stats: {'Max': np.float64(2.0), 'Min': np.float64(0.22254753518887319), 'Mean': np.float64(0.4813551655350023), 'Std': np.float64(0.0656811954117278)}
2024-12-06 23:44:29,975 - INFO - Candidate Std Stats: {'Max': np.float64(1.4833201403282077), 'Min': np.float64(0.0), 'Mean': np.float64(0.11461847207495166), 'Std': np.float64(0.06251073744024488)}
[I 2024-12-06 23:44:30,026] Trial 14 finished with value: 1.4777777777777779 and parameters: {'x_0_0': 'ab', 'x_0_1': 'bc', 'x_0_2': 'oo', 'x_1_0': 'bd', 'x_1_1': 'oo', 'x_1_2': 'oo'}. Best is trial 2 with value: 0.9666666666666667.
2024-12-06 23:44:31,728 - INFO - Candidate Mean Stats: {'Max': np.float64(1.9), 'Min': np.float64(0.28298158343457175), 'Mean': np.float64(0.48609243774866473), 'Std': np.float64(0.05158367692193337)}
2024-12-06 23:44:31,729 - INFO - Candidate Std Stats: {'Max': np.float64(0.42407077090928424), 'Min': np.float64(0.0), 'Mean': np.float64(0.10362504926567241), 'Std': np.float64(0.043627247839787366)}
[I 2024-12-06 23:44:31,783] Trial 14 finished with value: 1.7 and parameters: {'x_0_0': 'oo', 'x_0_1': 'ab', 'x_0_2': 'ab', 'x_1_0': 'bc', 'x_1_1': 'oo', 'x_1_2': 'oo'}. Best is trial 13 with value: 1.1222222222222222.
2024-12-06 23:44:49,886 - INFO - Candidate Mean Stats: {'Max': np.float64(1.9), 'Min': np.float64(0.2254709946009852), 'Mean': np.float64(0.491316653802689), 'Std': np.float64(0.05856745977797988)}
2024-12-06 23:44:49,888 - INFO - Candidate Std Stats: {'Max': np.float64(1.5821314117330252), 'Min': np.float64(0.0), 'Mean': np.float64(0.11006610060965771), 'Std': np.float64(0.05448299264312741)}
[I 2024-12-06 23:44:49,939] Trial 15 finished with value: 1.6666666666666665 and parameters: {'x_0_0': 'ad', 'x_0_1': 'cd', 'x_0_2': 'ab', 'x_1_0': 'ad', 'x_1_1': 'ac', 'x_1_2': 'ab'}. Best is trial 2 with value: 1.2222222222222223.
2024-12-06 23:44:51,650 - INFO - Candidate Mean Stats: {'Max': np.float64(1.9), 'Min': np.float64(0.21752210467681996), 'Mean': np.float64(0.48839208580164883), 'Std': np.float64(0.05811357706262314)}
2024-12-06 23:44:51,650 - INFO - Candidate Std Stats: {'Max': np.float64(0.7998406162365993), 'Min': np.float64(0.0), 'Mean': np.float64(0.10235358090653139), 'Std': np.float64(0.049267181959882896)}
[I 2024-12-06 23:44:51,698] Trial 15 finished with value: 1.4666666666666666 and parameters: {'x_0_0': 'bc', 'x_0_1': 'bc', 'x_0_2': 'oo', 'x_1_0': 'bd', 'x_1_1': 'oo', 'x_1_2': 'bc'}. Best is trial 7 with value: 1.077777777777778.
2024-12-06 23:44:51,727 - INFO - Candidate Mean Stats: {'Max': np.float64(2.0), 'Min': np.float64(0.1594270497317114), 'Mean': np.float64(0.4894163599343376), 'Std': np.float64(0.06270407044799418)}
2024-12-06 23:44:51,727 - INFO - Candidate Std Stats: {'Max': np.float64(0.8608176096441496), 'Min': np.float64(0.0), 'Mean': np.float64(0.10974243694813744), 'Std': np.float64(0.0476097241129517)}
[I 2024-12-06 23:44:51,775] Trial 15 finished with value: 1.6666666666666665 and parameters: {'x_0_0': 'bd', 'x_0_1': 'bd', 'x_0_2': 'ab', 'x_1_0': 'ac', 'x_1_1': 'bc', 'x_1_2': 'ab'}. Best is trial 2 with value: 0.9666666666666667.
2024-12-06 23:44:53,561 - INFO - Candidate Mean Stats: {'Max': np.float64(1.9), 'Min': np.float64(0.2823397635346342), 'Mean': np.float64(0.4905201377931055), 'Std': np.float64(0.06028535250394811)}
2024-12-06 23:44:53,562 - INFO - Candidate Std Stats: {'Max': np.float64(0.8649125196433093), 'Min': np.float64(0.0), 'Mean': np.float64(0.10738907647717716), 'Std': np.float64(0.04794685589052696)}
[I 2024-12-06 23:44:53,608] Trial 15 finished with value: 1.6666666666666665 and parameters: {'x_0_0': 'bc', 'x_0_1': 'cd', 'x_0_2': 'ad', 'x_1_0': 'bc', 'x_1_1': 'ac', 'x_1_2': 'ac'}. Best is trial 13 with value: 1.1222222222222222.
2024-12-06 23:45:14,208 - INFO - Candidate Mean Stats: {'Max': np.float64(1.9), 'Min': np.float64(0.2927832499204784), 'Mean': np.float64(0.4965013133523236), 'Std': np.float64(0.05410957882710467)}
2024-12-06 23:45:14,209 - INFO - Candidate Std Stats: {'Max': np.float64(0.3904667818627798), 'Min': np.float64(0.0), 'Mean': np.float64(0.10477235437677411), 'Std': np.float64(0.042533202652896424)}
[I 2024-12-06 23:45:14,258] Trial 16 finished with value: 1.4666666666666666 and parameters: {'x_0_0': 'ad', 'x_0_1': 'ab', 'x_0_2': 'ad', 'x_1_0': 'oo', 'x_1_1': 'bd', 'x_1_2': 'bc'}. Best is trial 2 with value: 1.2222222222222223.
2024-12-06 23:45:16,072 - INFO - Candidate Mean Stats: {'Max': np.float64(1.9), 'Min': np.float64(0.16092364112782515), 'Mean': np.float64(0.4835027245459579), 'Std': np.float64(0.05999911938570127)}
2024-12-06 23:45:16,072 - INFO - Candidate Std Stats: {'Max': np.float64(1.5453082389603172), 'Min': np.float64(0.0), 'Mean': np.float64(0.09819901446377173), 'Std': np.float64(0.05536938822459712)}
2024-12-06 23:45:16,074 - INFO - Candidate Mean Stats: {'Max': np.float64(2.0), 'Min': np.float64(0.25588516715605386), 'Mean': np.float64(0.4913150875220467), 'Std': np.float64(0.05792730740748489)}
2024-12-06 23:45:16,075 - INFO - Candidate Std Stats: {'Max': np.float64(1.6723584881871347), 'Min': np.float64(0.0), 'Mean': np.float64(0.10572254648517167), 'Std': np.float64(0.04922644534782076)}
[I 2024-12-06 23:45:16,122] Trial 16 finished with value: 1.3777777777777778 and parameters: {'x_0_0': 'ab', 'x_0_1': 'oo', 'x_0_2': 'cd', 'x_1_0': 'ad', 'x_1_1': 'bc', 'x_1_2': 'cd'}. Best is trial 7 with value: 1.077777777777778.
[I 2024-12-06 23:45:16,136] Trial 16 finished with value: 1.4555555555555555 and parameters: {'x_0_0': 'bd', 'x_0_1': 'ac', 'x_0_2': 'oo', 'x_1_0': 'ab', 'x_1_1': 'ad', 'x_1_2': 'bd'}. Best is trial 2 with value: 0.9666666666666667.
2024-12-06 23:45:18,282 - INFO - Candidate Mean Stats: {'Max': np.float64(1.9), 'Min': np.float64(0.2639661428684402), 'Mean': np.float64(0.4857682957899254), 'Std': np.float64(0.06237945571257606)}
2024-12-06 23:45:18,284 - INFO - Candidate Std Stats: {'Max': np.float64(0.3807468977553474), 'Min': np.float64(0.0), 'Mean': np.float64(0.10299151958102659), 'Std': np.float64(0.04200004385896757)}
[I 2024-12-06 23:45:18,340] Trial 16 finished with value: 1.6666666666666665 and parameters: {'x_0_0': 'ac', 'x_0_1': 'cd', 'x_0_2': 'ab', 'x_1_0': 'cd', 'x_1_1': 'ab', 'x_1_2': 'cd'}. Best is trial 13 with value: 1.1222222222222222.
2024-12-06 23:45:38,005 - INFO - Candidate Mean Stats: {'Max': np.float64(1.9), 'Min': np.float64(0.11127617241181471), 'Mean': np.float64(0.4751988526784131), 'Std': np.float64(0.068439734642045)}
2024-12-06 23:45:38,006 - INFO - Candidate Std Stats: {'Max': np.float64(0.7130153961429203), 'Min': np.float64(0.0), 'Mean': np.float64(0.11372515181533376), 'Std': np.float64(0.05315158651008873)}
[I 2024-12-06 23:45:38,060] Trial 17 finished with value: 1.7999999999999998 and parameters: {'x_0_0': 'oo', 'x_0_1': 'ad', 'x_0_2': 'bc', 'x_1_0': 'bc', 'x_1_1': 'oo', 'x_1_2': 'ac'}. Best is trial 2 with value: 1.2222222222222223.
2024-12-06 23:45:39,749 - INFO - Candidate Mean Stats: {'Max': np.float64(1.9), 'Min': np.float64(0.2967957903208953), 'Mean': np.float64(0.49139442076393364), 'Std': np.float64(0.05547588056607762)}
2024-12-06 23:45:39,749 - INFO - Candidate Std Stats: {'Max': np.float64(0.47292362840807406), 'Min': np.float64(0.0), 'Mean': np.float64(0.09547145046297022), 'Std': np.float64(0.04036920969023506)}
[I 2024-12-06 23:45:39,807] Trial 17 finished with value: 1.7777777777777777 and parameters: {'x_0_0': 'ab', 'x_0_1': 'bc', 'x_0_2': 'bc', 'x_1_0': 'ab', 'x_1_1': 'bd', 'x_1_2': 'bc'}. Best is trial 7 with value: 1.077777777777778.
2024-12-06 23:45:39,878 - INFO - Candidate Mean Stats: {'Max': np.float64(2.0), 'Min': np.float64(0.2036543447808458), 'Mean': np.float64(0.48911913122841133), 'Std': np.float64(0.06357777254041444)}
2024-12-06 23:45:39,879 - INFO - Candidate Std Stats: {'Max': np.float64(1.6775422921388092), 'Min': np.float64(0.0), 'Mean': np.float64(0.11779251963765075), 'Std': np.float64(0.05388763521883497)}
[I 2024-12-06 23:45:39,922] Trial 17 finished with value: 1.7000000000000002 and parameters: {'x_0_0': 'oo', 'x_0_1': 'ad', 'x_0_2': 'oo', 'x_1_0': 'bd', 'x_1_1': 'ad', 'x_1_2': 'oo'}. Best is trial 2 with value: 0.9666666666666667.
2024-12-06 23:45:41,887 - INFO - Candidate Mean Stats: {'Max': np.float64(1.9), 'Min': np.float64(0.280582279302038), 'Mean': np.float64(0.48710537409811716), 'Std': np.float64(0.05633786595424165)}
2024-12-06 23:45:41,888 - INFO - Candidate Std Stats: {'Max': np.float64(0.4291624221181225), 'Min': np.float64(0.0), 'Mean': np.float64(0.10047736907621058), 'Std': np.float64(0.04249454496712108)}
[I 2024-12-06 23:45:41,930] Trial 17 finished with value: 1.4666666666666668 and parameters: {'x_0_0': 'ac', 'x_0_1': 'bd', 'x_0_2': 'cd', 'x_1_0': 'ac', 'x_1_1': 'oo', 'x_1_2': 'oo'}. Best is trial 13 with value: 1.1222222222222222.
2024-12-06 23:45:58,446 - INFO - Candidate Mean Stats: {'Max': np.float64(1.9), 'Min': np.float64(0.23146419816803862), 'Mean': np.float64(0.4908303456481637), 'Std': np.float64(0.06037861806048025)}
2024-12-06 23:45:58,447 - INFO - Candidate Std Stats: {'Max': np.float64(0.48658572968730013), 'Min': np.float64(0.0), 'Mean': np.float64(0.1064900891339477), 'Std': np.float64(0.0456597570507081)}
