[I 2024-12-06 23:37:43,292] Trial 276 finished with value: 1.0714285714285714 and parameters: {'x_0_0': 'bc', 'x_0_1': 'oo', 'x_1_0': 'ab', 'x_1_1': 'cd'}. Best is trial 23 with value: 0.5.
2024-12-06 23:37:43,405 - INFO - Candidate Mean Stats: {'Max': np.float64(3.1575419289191418), 'Min': np.float64(-0.9027103522293587), 'Mean': np.float64(0.617947147584454), 'Std': np.float64(0.5815575792705199)}
2024-12-06 23:37:43,405 - INFO - Candidate Std Stats: {'Max': np.float64(1.8491015271178812), 'Min': np.float64(0.0), 'Mean': np.float64(0.5693683295863996), 'Std': np.float64(0.3294221201832588)}
2024-12-06 23:37:43,407 - INFO - Candidate Mean Stats: {'Max': np.float64(3.6315786554804506), 'Min': np.float64(-0.7949493976333833), 'Mean': np.float64(0.6452484131255461), 'Std': np.float64(0.5116533147906076)}
2024-12-06 23:37:43,407 - INFO - Candidate Std Stats: {'Max': np.float64(1.5641442645915404), 'Min': np.float64(0.0), 'Mean': np.float64(0.5216542022740454), 'Std': np.float64(0.2910516227448544)}
2024-12-06 23:37:43,419 - INFO - Candidate Mean Stats: {'Max': np.float64(2.986384260081396), 'Min': np.float64(-0.67997484145112), 'Mean': np.float64(0.6271802421768301), 'Std': np.float64(0.5112961140340014)}
2024-12-06 23:37:43,419 - INFO - Candidate Std Stats: {'Max': np.float64(1.743312736317435), 'Min': np.float64(0.0), 'Mean': np.float64(0.518409595334859), 'Std': np.float64(0.284383522472653)}
[I 2024-12-06 23:37:43,419] Trial 278 finished with value: 1.0714285714285714 and parameters: {'x_0_0': 'bc', 'x_0_1': 'oo', 'x_1_0': 'bc', 'x_1_1': 'cd'}. Best is trial 165 with value: 0.5.
[I 2024-12-06 23:37:43,421] Trial 278 finished with value: 1.375 and parameters: {'x_0_0': 'oo', 'x_0_1': 'oo', 'x_1_0': 'ad', 'x_1_1': 'bc'}. Best is trial 76 with value: 0.5.
[I 2024-12-06 23:37:43,433] Trial 278 finished with value: 1.4464285714285714 and parameters: {'x_0_0': 'bd', 'x_0_1': 'ac', 'x_1_0': 'cd', 'x_1_1': 'oo'}. Best is trial 63 with value: 0.5.
2024-12-06 23:37:43,657 - INFO - Candidate Mean Stats: {'Max': np.float64(2.942798305249446), 'Min': np.float64(-0.9830517562571968), 'Mean': np.float64(0.6051694160440582), 'Std': np.float64(0.5190799714898942)}
2024-12-06 23:37:43,657 - INFO - Candidate Std Stats: {'Max': np.float64(1.8829974795230853), 'Min': np.float64(0.0), 'Mean': np.float64(0.5974317586734499), 'Std': np.float64(0.3294257307311769)}
[I 2024-12-06 23:37:43,670] Trial 277 finished with value: 1.0714285714285714 and parameters: {'x_0_0': 'ac', 'x_0_1': 'oo', 'x_1_0': 'bc', 'x_1_1': 'ab'}. Best is trial 23 with value: 0.5.
2024-12-06 23:37:43,780 - INFO - Candidate Mean Stats: {'Max': np.float64(2.9395964539495947), 'Min': np.float64(-0.9647920684501768), 'Mean': np.float64(0.6031158432737153), 'Std': np.float64(0.5426511066697663)}
2024-12-06 23:37:43,780 - INFO - Candidate Std Stats: {'Max': np.float64(1.811306431911889), 'Min': np.float64(0.0), 'Mean': np.float64(0.634824995698794), 'Std': np.float64(0.34965428080295186)}
2024-12-06 23:37:43,784 - INFO - Candidate Mean Stats: {'Max': np.float64(2.9906486479777517), 'Min': np.float64(-1.0541108725783146), 'Mean': np.float64(0.6452843967615713), 'Std': np.float64(0.5689162669230965)}
2024-12-06 23:37:43,784 - INFO - Candidate Std Stats: {'Max': np.float64(1.5960705694756783), 'Min': np.float64(0.0), 'Mean': np.float64(0.5748786523392863), 'Std': np.float64(0.30155439393159067)}
[I 2024-12-06 23:37:43,794] Trial 279 finished with value: 1.2142857142857144 and parameters: {'x_0_0': 'ab', 'x_0_1': 'oo', 'x_1_0': 'bc', 'x_1_1': 'ac'}. Best is trial 165 with value: 0.5.
2024-12-06 23:37:43,796 - INFO - Candidate Mean Stats: {'Max': np.float64(2.9790691226589248), 'Min': np.float64(-0.9665075653638404), 'Mean': np.float64(0.6496947837535313), 'Std': np.float64(0.5411637380191232)}
2024-12-06 23:37:43,796 - INFO - Candidate Std Stats: {'Max': np.float64(1.6222765125111478), 'Min': np.float64(0.0), 'Mean': np.float64(0.563596336387705), 'Std': np.float64(0.31229708402503753)}
[I 2024-12-06 23:37:43,797] Trial 279 finished with value: 1.125 and parameters: {'x_0_0': 'oo', 'x_0_1': 'oo', 'x_1_0': 'oo', 'x_1_1': 'ab'}. Best is trial 76 with value: 0.5.
[I 2024-12-06 23:37:43,809] Trial 279 finished with value: 0.8214285714285714 and parameters: {'x_0_0': 'ad', 'x_0_1': 'oo', 'x_1_0': 'oo', 'x_1_1': 'ad'}. Best is trial 63 with value: 0.5.
2024-12-06 23:37:44,036 - INFO - Candidate Mean Stats: {'Max': np.float64(3.1101097758285854), 'Min': np.float64(-0.7985217622541001), 'Mean': np.float64(0.6555968098750017), 'Std': np.float64(0.536629573828047)}
2024-12-06 23:37:44,036 - INFO - Candidate Std Stats: {'Max': np.float64(1.622476189954915), 'Min': np.float64(0.0), 'Mean': np.float64(0.5362635056105166), 'Std': np.float64(0.3049168471052767)}
[I 2024-12-06 23:37:44,049] Trial 278 finished with value: 1.4285714285714286 and parameters: {'x_0_0': 'bd', 'x_0_1': 'ac', 'x_1_0': 'ab', 'x_1_1': 'cd'}. Best is trial 23 with value: 0.5.
2024-12-06 23:37:44,155 - INFO - Candidate Mean Stats: {'Max': np.float64(3.218397142408348), 'Min': np.float64(-1.146682529899934), 'Mean': np.float64(0.4947857559551212), 'Std': np.float64(0.6897166402108535)}
2024-12-06 23:37:44,155 - INFO - Candidate Std Stats: {'Max': np.float64(2.265000185196724), 'Min': np.float64(0.0), 'Mean': np.float64(0.6889951381692734), 'Std': np.float64(0.3984285808489226)}
2024-12-06 23:37:44,159 - INFO - Candidate Mean Stats: {'Max': np.float64(3.1112650257865107), 'Min': np.float64(-0.8909370913069568), 'Mean': np.float64(0.5324043192529849), 'Std': np.float64(0.5794553692743308)}
2024-12-06 23:37:44,159 - INFO - Candidate Std Stats: {'Max': np.float64(1.569569000268545), 'Min': np.float64(0.0), 'Mean': np.float64(0.6071517510927276), 'Std': np.float64(0.31821311710063394)}
[I 2024-12-06 23:37:44,169] Trial 280 finished with value: 1.2857142857142856 and parameters: {'x_0_0': 'ac', 'x_0_1': 'ac', 'x_1_0': 'ad', 'x_1_1': 'ac'}. Best is trial 165 with value: 0.5.
2024-12-06 23:37:44,171 - INFO - Candidate Mean Stats: {'Max': np.float64(2.8029717074896974), 'Min': np.float64(-0.778237440506444), 'Mean': np.float64(0.6948622239642303), 'Std': np.float64(0.4787353900344844)}
2024-12-06 23:37:44,171 - INFO - Candidate Std Stats: {'Max': np.float64(1.567970635993077), 'Min': np.float64(0.0), 'Mean': np.float64(0.5224506508418608), 'Std': np.float64(0.30031514795290554)}
[I 2024-12-06 23:37:44,172] Trial 280 finished with value: 0.9107142857142857 and parameters: {'x_0_0': 'ac', 'x_0_1': 'ad', 'x_1_0': 'oo', 'x_1_1': 'oo'}. Best is trial 76 with value: 0.5.
[I 2024-12-06 23:37:44,184] Trial 280 finished with value: 0.7857142857142857 and parameters: {'x_0_0': 'ad', 'x_0_1': 'oo', 'x_1_0': 'bd', 'x_1_1': 'ad'}. Best is trial 63 with value: 0.5.
2024-12-06 23:37:44,412 - INFO - Candidate Mean Stats: {'Max': np.float64(2.7521561200448845), 'Min': np.float64(-0.7353489290612558), 'Mean': np.float64(0.6777947322915037), 'Std': np.float64(0.47962798465840645)}
2024-12-06 23:37:44,413 - INFO - Candidate Std Stats: {'Max': np.float64(1.6855254570897533), 'Min': np.float64(0.0), 'Mean': np.float64(0.4924285994409851), 'Std': np.float64(0.2714108909566974)}
[I 2024-12-06 23:37:44,426] Trial 279 finished with value: 0.9107142857142857 and parameters: {'x_0_0': 'ac', 'x_0_1': 'ac', 'x_1_0': 'oo', 'x_1_1': 'oo'}. Best is trial 23 with value: 0.5.
2024-12-06 23:37:44,529 - INFO - Candidate Mean Stats: {'Max': np.float64(2.9709575232170273), 'Min': np.float64(-1.300904899932937), 'Mean': np.float64(0.4889270303039954), 'Std': np.float64(0.6798922831489143)}
2024-12-06 23:37:44,529 - INFO - Candidate Std Stats: {'Max': np.float64(1.7642872234595868), 'Min': np.float64(0.0), 'Mean': np.float64(0.5913268599125666), 'Std': np.float64(0.3226827875221213)}
2024-12-06 23:37:44,532 - INFO - Candidate Mean Stats: {'Max': np.float64(2.9908973699828305), 'Min': np.float64(-0.4573361574599871), 'Mean': np.float64(0.6793182114854031), 'Std': np.float64(0.4692404176162423)}
2024-12-06 23:37:44,533 - INFO - Candidate Std Stats: {'Max': np.float64(1.731945606764686), 'Min': np.float64(0.0), 'Mean': np.float64(0.4353281813677541), 'Std': np.float64(0.2536408498853054)}
[I 2024-12-06 23:37:44,543] Trial 281 finished with value: 1.4285714285714286 and parameters: {'x_0_0': 'ad', 'x_0_1': 'cd', 'x_1_0': 'ab', 'x_1_1': 'cd'}. Best is trial 165 with value: 0.5.
2024-12-06 23:37:44,546 - INFO - Candidate Mean Stats: {'Max': np.float64(2.666020263843818), 'Min': np.float64(-0.7597044702110816), 'Mean': np.float64(0.6867898655444253), 'Std': np.float64(0.45624527535922926)}
2024-12-06 23:37:44,546 - INFO - Candidate Std Stats: {'Max': np.float64(1.5008986109026194), 'Min': np.float64(0.0), 'Mean': np.float64(0.49931498660554036), 'Std': np.float64(0.2734448663934573)}
[I 2024-12-06 23:37:44,546] Trial 281 finished with value: 1.0714285714285714 and parameters: {'x_0_0': 'ac', 'x_0_1': 'oo', 'x_1_0': 'ab', 'x_1_1': 'ab'}. Best is trial 76 with value: 0.5.
[I 2024-12-06 23:37:44,559] Trial 281 finished with value: 0.6607142857142857 and parameters: {'x_0_0': 'ad', 'x_0_1': 'oo', 'x_1_0': 'bc', 'x_1_1': 'oo'}. Best is trial 63 with value: 0.5.
2024-12-06 23:37:44,791 - INFO - Candidate Mean Stats: {'Max': np.float64(2.7479800877850304), 'Min': np.float64(-0.8357947923101678), 'Mean': np.float64(0.579431773804585), 'Std': np.float64(0.5436775351595251)}
2024-12-06 23:37:44,791 - INFO - Candidate Std Stats: {'Max': np.float64(1.765813252956641), 'Min': np.float64(0.0), 'Mean': np.float64(0.5283016302879766), 'Std': np.float64(0.294681977183206)}
[I 2024-12-06 23:37:44,805] Trial 280 finished with value: 1.0714285714285714 and parameters: {'x_0_0': 'ac', 'x_0_1': 'oo', 'x_1_0': 'ab', 'x_1_1': 'bd'}. Best is trial 23 with value: 0.5.
2024-12-06 23:37:44,904 - INFO - Candidate Mean Stats: {'Max': np.float64(3.2116121511654905), 'Min': np.float64(-1.1860632355214091), 'Mean': np.float64(0.5563603980615819), 'Std': np.float64(0.6826881098984084)}
2024-12-06 23:37:44,904 - INFO - Candidate Std Stats: {'Max': np.float64(1.5663312179588373), 'Min': np.float64(0.0), 'Mean': np.float64(0.5692956587470341), 'Std': np.float64(0.3055563411531708)}
2024-12-06 23:37:44,907 - INFO - Candidate Mean Stats: {'Max': np.float64(3.071448491551838), 'Min': np.float64(-0.8681281148603908), 'Mean': np.float64(0.5886436987490454), 'Std': np.float64(0.5417053519940477)}
2024-12-06 23:37:44,907 - INFO - Candidate Std Stats: {'Max': np.float64(1.5059530155362715), 'Min': np.float64(0.0), 'Mean': np.float64(0.5416565915481005), 'Std': np.float64(0.3002111594206985)}
[I 2024-12-06 23:37:44,918] Trial 282 finished with value: 1.0892857142857144 and parameters: {'x_0_0': 'ab', 'x_0_1': 'oo', 'x_1_0': 'ab', 'x_1_1': 'oo'}. Best is trial 165 with value: 0.5.
[I 2024-12-06 23:37:44,920] Trial 282 finished with value: 1.2142857142857144 and parameters: {'x_0_0': 'ab', 'x_0_1': 'oo', 'x_1_0': 'ad', 'x_1_1': 'bc'}. Best is trial 76 with value: 0.5.
2024-12-06 23:37:44,922 - INFO - Candidate Mean Stats: {'Max': np.float64(3.2360154850935148), 'Min': np.float64(-0.7192779993469806), 'Mean': np.float64(0.6393618983080098), 'Std': np.float64(0.5326276151370632)}
2024-12-06 23:37:44,922 - INFO - Candidate Std Stats: {'Max': np.float64(1.6467166584525637), 'Min': np.float64(0.0), 'Mean': np.float64(0.5425901305332786), 'Std': np.float64(0.30578192904239154)}
[I 2024-12-06 23:37:44,936] Trial 282 finished with value: 1.2857142857142856 and parameters: {'x_0_0': 'bc', 'x_0_1': 'ad', 'x_1_0': 'ac', 'x_1_1': 'ac'}. Best is trial 63 with value: 0.5.
2024-12-06 23:37:45,166 - INFO - Candidate Mean Stats: {'Max': np.float64(3.3230057263275086), 'Min': np.float64(-1.108925051089435), 'Mean': np.float64(0.5193999845560419), 'Std': np.float64(0.6194255535992479)}
2024-12-06 23:37:45,166 - INFO - Candidate Std Stats: {'Max': np.float64(1.6697279231469688), 'Min': np.float64(0.0), 'Mean': np.float64(0.6210867562714578), 'Std': np.float64(0.328123233212466)}
[I 2024-12-06 23:37:45,180] Trial 281 finished with value: 0.9285714285714286 and parameters: {'x_0_0': 'ad', 'x_0_1': 'oo', 'x_1_0': 'ab', 'x_1_1': 'ac'}. Best is trial 23 with value: 0.5.
2024-12-06 23:37:45,277 - INFO - Candidate Mean Stats: {'Max': np.float64(3.037183590950594), 'Min': np.float64(-1.306237017421934), 'Mean': np.float64(0.46974079536042795), 'Std': np.float64(0.7001953805909972)}
2024-12-06 23:37:45,277 - INFO - Candidate Std Stats: {'Max': np.float64(2.0763140275208833), 'Min': np.float64(0.0), 'Mean': np.float64(0.6908646683846462), 'Std': np.float64(0.38000855370284414)}
2024-12-06 23:37:45,280 - INFO - Candidate Mean Stats: {'Max': np.float64(3.2605621610592763), 'Min': np.float64(-0.576348783894089), 'Mean': np.float64(0.6305687612049277), 'Std': np.float64(0.5073250134049582)}
2024-12-06 23:37:45,280 - INFO - Candidate Std Stats: {'Max': np.float64(1.5899148495685793), 'Min': np.float64(0.0), 'Mean': np.float64(0.5540170202358605), 'Std': np.float64(0.306464463773454)}
[I 2024-12-06 23:37:45,292] Trial 283 finished with value: 1.4285714285714286 and parameters: {'x_0_0': 'bc', 'x_0_1': 'ab', 'x_1_0': 'ac', 'x_1_1': 'cd'}. Best is trial 165 with value: 0.5.
[I 2024-12-06 23:37:45,294] Trial 283 finished with value: 1.0714285714285714 and parameters: {'x_0_0': 'bc', 'x_0_1': 'oo', 'x_1_0': 'bc', 'x_1_1': 'bd'}. Best is trial 76 with value: 0.5.
2024-12-06 23:37:45,295 - INFO - Candidate Mean Stats: {'Max': np.float64(3.306913713138313), 'Min': np.float64(-0.9867788551425105), 'Mean': np.float64(0.5965474738764223), 'Std': np.float64(0.5532966496762598)}
2024-12-06 23:37:45,295 - INFO - Candidate Std Stats: {'Max': np.float64(1.8961369503215095), 'Min': np.float64(0.0), 'Mean': np.float64(0.5734062316066391), 'Std': np.float64(0.3313460876165118)}
[I 2024-12-06 23:37:45,309] Trial 283 finished with value: 0.9642857142857143 and parameters: {'x_0_0': 'ab', 'x_0_1': 'oo', 'x_1_0': 'oo', 'x_1_1': 'ab'}. Best is trial 63 with value: 0.5.
2024-12-06 23:37:45,545 - INFO - Candidate Mean Stats: {'Max': np.float64(3.647505835196705), 'Min': np.float64(-0.9563894138434073), 'Mean': np.float64(0.6238368776218284), 'Std': np.float64(0.5559378052144809)}
2024-12-06 23:37:45,545 - INFO - Candidate Std Stats: {'Max': np.float64(1.6366455912482074), 'Min': np.float64(0.0), 'Mean': np.float64(0.558909812446487), 'Std': np.float64(0.3050793431825198)}
[I 2024-12-06 23:37:45,559] Trial 282 finished with value: 1.5714285714285714 and parameters: {'x_0_0': 'ac', 'x_0_1': 'cd', 'x_1_0': 'bc', 'x_1_1': 'bc'}. Best is trial 23 with value: 0.5.
2024-12-06 23:37:45,654 - INFO - Candidate Mean Stats: {'Max': np.float64(3.3868413671820834), 'Min': np.float64(-1.1576818945447163), 'Mean': np.float64(0.6514401877966252), 'Std': np.float64(0.5375738851048439)}
2024-12-06 23:37:45,654 - INFO - Candidate Std Stats: {'Max': np.float64(1.9544923382151165), 'Min': np.float64(0.0), 'Mean': np.float64(0.595726147311516), 'Std': np.float64(0.34000944995652527)}
2024-12-06 23:37:45,655 - INFO - Candidate Mean Stats: {'Max': np.float64(3.459394715980131), 'Min': np.float64(-0.6124034039071589), 'Mean': np.float64(0.6736864549351184), 'Std': np.float64(0.5097925162045253)}
2024-12-06 23:37:45,655 - INFO - Candidate Std Stats: {'Max': np.float64(1.5585024627990278), 'Min': np.float64(0.0), 'Mean': np.float64(0.535710359884235), 'Std': np.float64(0.2971934545957569)}
[I 2024-12-06 23:37:45,668] Trial 284 finished with value: 1.375 and parameters: {'x_0_0': 'oo', 'x_0_1': 'oo', 'x_1_0': 'ab', 'x_1_1': 'ac'}. Best is trial 165 with value: 0.5.
[I 2024-12-06 23:37:45,669] Trial 284 finished with value: 1.1607142857142856 and parameters: {'x_0_0': 'bc', 'x_0_1': 'ac', 'x_1_0': 'bc', 'x_1_1': 'oo'}. Best is trial 76 with value: 0.5.
2024-12-06 23:37:45,670 - INFO - Candidate Mean Stats: {'Max': np.float64(2.8998922204893187), 'Min': np.float64(-0.8974579262119413), 'Mean': np.float64(0.627009527431749), 'Std': np.float64(0.5387028600189133)}
2024-12-06 23:37:45,670 - INFO - Candidate Std Stats: {'Max': np.float64(1.5353973663330076), 'Min': np.float64(0.0), 'Mean': np.float64(0.5434918992551918), 'Std': np.float64(0.290723187701808)}
[I 2024-12-06 23:37:45,684] Trial 284 finished with value: 0.8214285714285714 and parameters: {'x_0_0': 'ac', 'x_0_1': 'oo', 'x_1_0': 'oo', 'x_1_1': 'bc'}. Best is trial 63 with value: 0.5.
2024-12-06 23:37:45,922 - INFO - Candidate Mean Stats: {'Max': np.float64(3.269567465910445), 'Min': np.float64(-0.8770520197513466), 'Mean': np.float64(0.6134133777284971), 'Std': np.float64(0.5225600117203061)}
2024-12-06 23:37:45,922 - INFO - Candidate Std Stats: {'Max': np.float64(1.7608074551787518), 'Min': np.float64(0.0), 'Mean': np.float64(0.5716980258974735), 'Std': np.float64(0.3292766864088545)}
[I 2024-12-06 23:37:45,936] Trial 283 finished with value: 1.0714285714285714 and parameters: {'x_0_0': 'bd', 'x_0_1': 'oo', 'x_1_0': 'cd', 'x_1_1': 'ad'}. Best is trial 23 with value: 0.5.
2024-12-06 23:37:46,030 - INFO - Candidate Mean Stats: {'Max': np.float64(3.4170295828284183), 'Min': np.float64(-1.2859696833509737), 'Mean': np.float64(0.5200655170738622), 'Std': np.float64(0.6362510281073097)}
2024-12-06 23:37:46,030 - INFO - Candidate Std Stats: {'Max': np.float64(1.6835297638479434), 'Min': np.float64(0.0), 'Mean': np.float64(0.6473892498697105), 'Std': np.float64(0.3537520624730813)}
2024-12-06 23:37:46,030 - INFO - Candidate Mean Stats: {'Max': np.float64(3.060469773380458), 'Min': np.float64(-0.5563744138313521), 'Mean': np.float64(0.6695350500928956), 'Std': np.float64(0.4721303490466477)}
2024-12-06 23:37:46,030 - INFO - Candidate Std Stats: {'Max': np.float64(1.7522456955226553), 'Min': np.float64(0.0), 'Mean': np.float64(0.4868609321569618), 'Std': np.float64(0.291331890839891)}
[I 2024-12-06 23:37:46,044] Trial 285 finished with value: 1.3035714285714286 and parameters: {'x_0_0': 'bc', 'x_0_1': 'ab', 'x_1_0': 'cd', 'x_1_1': 'oo'}. Best is trial 165 with value: 0.5.
[I 2024-12-06 23:37:46,045] Trial 285 finished with value: 1.375 and parameters: {'x_0_0': 'oo', 'x_0_1': 'oo', 'x_1_0': 'ac', 'x_1_1': 'ac'}. Best is trial 76 with value: 0.5.
2024-12-06 23:37:46,045 - INFO - Candidate Mean Stats: {'Max': np.float64(3.0810282048213553), 'Min': np.float64(-0.5856134468881161), 'Mean': np.float64(0.6559103297295187), 'Std': np.float64(0.5081659318508918)}
2024-12-06 23:37:46,045 - INFO - Candidate Std Stats: {'Max': np.float64(1.535506697435613), 'Min': np.float64(0.0), 'Mean': np.float64(0.5052608435036043), 'Std': np.float64(0.2847790601701568)}
[I 2024-12-06 23:37:46,059] Trial 285 finished with value: 1.25 and parameters: {'x_0_0': 'cd', 'x_0_1': 'oo', 'x_1_0': 'oo', 'x_1_1': 'cd'}. Best is trial 63 with value: 0.5.
2024-12-06 23:37:46,299 - INFO - Candidate Mean Stats: {'Max': np.float64(2.7703619616070654), 'Min': np.float64(-0.8972223385650471), 'Mean': np.float64(0.595118705267336), 'Std': np.float64(0.5454362453727014)}
2024-12-06 23:37:46,299 - INFO - Candidate Std Stats: {'Max': np.float64(1.7434129227851234), 'Min': np.float64(0.0), 'Mean': np.float64(0.5535028730483139), 'Std': np.float64(0.3123453748362493)}
[I 2024-12-06 23:37:46,313] Trial 284 finished with value: 1.0714285714285714 and parameters: {'x_0_0': 'bc', 'x_0_1': 'oo', 'x_1_0': 'ac', 'x_1_1': 'ad'}. Best is trial 23 with value: 0.5.
2024-12-06 23:37:46,404 - INFO - Candidate Mean Stats: {'Max': np.float64(3.413489195896955), 'Min': np.float64(-0.9007133574935213), 'Mean': np.float64(0.6441379204816705), 'Std': np.float64(0.5711504077633908)}
2024-12-06 23:37:46,404 - INFO - Candidate Std Stats: {'Max': np.float64(1.7590680741057951), 'Min': np.float64(0.0), 'Mean': np.float64(0.5372077990308267), 'Std': np.float64(0.30450783957863514)}
2024-12-06 23:37:46,405 - INFO - Candidate Mean Stats: {'Max': np.float64(2.817741419433241), 'Min': np.float64(-0.859412437993084), 'Mean': np.float64(0.5845957559919464), 'Std': np.float64(0.573260977194402)}
2024-12-06 23:37:46,405 - INFO - Candidate Std Stats: {'Max': np.float64(2.018305885909453), 'Min': np.float64(0.0), 'Mean': np.float64(0.5754530965585798), 'Std': np.float64(0.3263112513358658)}
[I 2024-12-06 23:37:46,419] Trial 286 finished with value: 0.9642857142857143 and parameters: {'x_0_0': 'ab', 'x_0_1': 'oo', 'x_1_0': 'oo', 'x_1_1': 'cd'}. Best is trial 76 with value: 0.5.
[I 2024-12-06 23:37:46,419] Trial 286 finished with value: 1.3214285714285714 and parameters: {'x_0_0': 'bc', 'x_0_1': 'cd', 'x_1_0': 'oo', 'x_1_1': 'ab'}. Best is trial 165 with value: 0.5.
2024-12-06 23:37:46,420 - INFO - Candidate Mean Stats: {'Max': np.float64(2.910016991920459), 'Min': np.float64(-0.7625057626949048), 'Mean': np.float64(0.6639125715776333), 'Std': np.float64(0.5129299069018415)}
2024-12-06 23:37:46,420 - INFO - Candidate Std Stats: {'Max': np.float64(1.7685107341157098), 'Min': np.float64(0.0), 'Mean': np.float64(0.524838840945552), 'Std': np.float64(0.2992409533225693)}
[I 2024-12-06 23:37:46,435] Trial 286 finished with value: 1.0714285714285714 and parameters: {'x_0_0': 'bc', 'x_0_1': 'oo', 'x_1_0': 'bc', 'x_1_1': 'bc'}. Best is trial 63 with value: 0.5.
2024-12-06 23:37:46,676 - INFO - Candidate Mean Stats: {'Max': np.float64(2.8333974647539537), 'Min': np.float64(-0.7531356578380904), 'Mean': np.float64(0.6581471639405926), 'Std': np.float64(0.5192239269117391)}
2024-12-06 23:37:46,676 - INFO - Candidate Std Stats: {'Max': np.float64(1.593116209057854), 'Min': np.float64(0.0), 'Mean': np.float64(0.46820228880047393), 'Std': np.float64(0.2660315064533965)}
