[I 2024-12-07 00:09:52,020] Trial 78 finished with value: 1.7777777777777777 and parameters: {'x_0_0': 'ab', 'x_0_1': 'ab', 'x_0_2': 'cd', 'x_1_0': 'ab', 'x_1_1': 'ab', 'x_1_2': 'ab'}. Best is trial 63 with value: 1.1222222222222222.
2024-12-07 00:09:55,057 - INFO - Candidate Mean Stats: {'Max': np.float64(2.0), 'Min': np.float64(0.2604352296159843), 'Mean': np.float64(0.49714445281576447), 'Std': np.float64(0.06391659831304886)}
2024-12-07 00:09:55,058 - INFO - Candidate Std Stats: {'Max': np.float64(1.6422984267830878), 'Min': np.float64(0.0), 'Mean': np.float64(0.10350516696310041), 'Std': np.float64(0.048921351999147905)}
[I 2024-12-07 00:09:55,103] Trial 78 finished with value: 2.0 and parameters: {'x_0_0': 'cd', 'x_0_1': 'cd', 'x_0_2': 'ad', 'x_1_0': 'ad', 'x_1_1': 'ab', 'x_1_2': 'ad'}. Best is trial 49 with value: 0.7999999999999999.
2024-12-07 00:09:57,593 - INFO - Candidate Mean Stats: {'Max': np.float64(2.0), 'Min': np.float64(0.2725715665264703), 'Mean': np.float64(0.48452891223793476), 'Std': np.float64(0.06184774931674844)}
2024-12-07 00:09:57,594 - INFO - Candidate Std Stats: {'Max': np.float64(0.5259351581908305), 'Min': np.float64(0.0), 'Mean': np.float64(0.10560517994080998), 'Std': np.float64(0.043088253234071394)}
[I 2024-12-07 00:09:57,640] Trial 78 finished with value: 1.5555555555555556 and parameters: {'x_0_0': 'ad', 'x_0_1': 'bd', 'x_0_2': 'ab', 'x_1_0': 'ab', 'x_1_1': 'cd', 'x_1_2': 'ac'}. Best is trial 67 with value: 1.0222222222222221.
2024-12-07 00:10:04,819 - INFO - Candidate Mean Stats: {'Max': np.float64(2.0), 'Min': np.float64(0.21636328621640083), 'Mean': np.float64(0.48868807415830723), 'Std': np.float64(0.06926823777347438)}
2024-12-07 00:10:04,820 - INFO - Candidate Std Stats: {'Max': np.float64(1.5212086757897068), 'Min': np.float64(0.0), 'Mean': np.float64(0.11586035426445643), 'Std': np.float64(0.05322897554636321)}
[I 2024-12-07 00:10:04,867] Trial 78 finished with value: 1.1666666666666665 and parameters: {'x_0_0': 'bc', 'x_0_1': 'oo', 'x_0_2': 'ad', 'x_1_0': 'ac', 'x_1_1': 'oo', 'x_1_2': 'ab'}. Best is trial 74 with value: 0.8222222222222222.
2024-12-07 00:10:14,524 - INFO - Candidate Mean Stats: {'Max': np.float64(2.0), 'Min': np.float64(0.24271925158533808), 'Mean': np.float64(0.4803543945855137), 'Std': np.float64(0.06717476397339948)}
2024-12-07 00:10:14,525 - INFO - Candidate Std Stats: {'Max': np.float64(0.5529566631145859), 'Min': np.float64(0.0), 'Mean': np.float64(0.11331214418545892), 'Std': np.float64(0.047149402286949124)}
[I 2024-12-07 00:10:14,572] Trial 79 finished with value: 2.0 and parameters: {'x_0_0': 'cd', 'x_0_1': 'ab', 'x_0_2': 'ab', 'x_1_0': 'ac', 'x_1_1': 'ad', 'x_1_2': 'bc'}. Best is trial 63 with value: 1.1222222222222222.
2024-12-07 00:10:17,674 - INFO - Candidate Mean Stats: {'Max': np.float64(2.0), 'Min': np.float64(0.26103870856303923), 'Mean': np.float64(0.4927779454599379), 'Std': np.float64(0.06480667031243643)}
2024-12-07 00:10:17,675 - INFO - Candidate Std Stats: {'Max': np.float64(0.8184987387275813), 'Min': np.float64(0.0), 'Mean': np.float64(0.1097341353859391), 'Std': np.float64(0.052207362650374636)}
[I 2024-12-07 00:10:17,722] Trial 79 finished with value: 1.6666666666666665 and parameters: {'x_0_0': 'bc', 'x_0_1': 'bd', 'x_0_2': 'ad', 'x_1_0': 'bc', 'x_1_1': 'bc', 'x_1_2': 'bd'}. Best is trial 49 with value: 0.7999999999999999.
2024-12-07 00:10:20,235 - INFO - Candidate Mean Stats: {'Max': np.float64(2.0), 'Min': np.float64(0.19117833814079713), 'Mean': np.float64(0.4910760837532924), 'Std': np.float64(0.06591938111694555)}
2024-12-07 00:10:20,236 - INFO - Candidate Std Stats: {'Max': np.float64(0.482863577362995), 'Min': np.float64(0.0), 'Mean': np.float64(0.10490253013201349), 'Std': np.float64(0.043641170949295115)}
[I 2024-12-07 00:10:20,292] Trial 79 finished with value: 1.5777777777777777 and parameters: {'x_0_0': 'ab', 'x_0_1': 'bd', 'x_0_2': 'bd', 'x_1_0': 'oo', 'x_1_1': 'ad', 'x_1_2': 'ac'}. Best is trial 67 with value: 1.0222222222222221.
2024-12-07 00:10:27,994 - INFO - Candidate Mean Stats: {'Max': np.float64(2.0), 'Min': np.float64(0.23407803422872892), 'Mean': np.float64(0.484708583389938), 'Std': np.float64(0.06647828889901385)}
2024-12-07 00:10:27,995 - INFO - Candidate Std Stats: {'Max': np.float64(0.45914328256108616), 'Min': np.float64(0.0), 'Mean': np.float64(0.10452933222188093), 'Std': np.float64(0.04508342352392294)}
[I 2024-12-07 00:10:28,041] Trial 79 finished with value: 1.1666666666666665 and parameters: {'x_0_0': 'ad', 'x_0_1': 'ad', 'x_0_2': 'oo', 'x_1_0': 'oo', 'x_1_1': 'oo', 'x_1_2': 'oo'}. Best is trial 74 with value: 0.8222222222222222.
2024-12-07 00:10:36,900 - INFO - Candidate Mean Stats: {'Max': np.float64(2.0), 'Min': np.float64(0.2083951650066403), 'Mean': np.float64(0.4896681279656231), 'Std': np.float64(0.06333440855611105)}
2024-12-07 00:10:36,901 - INFO - Candidate Std Stats: {'Max': np.float64(0.43994491102994876), 'Min': np.float64(0.0), 'Mean': np.float64(0.10370289129329224), 'Std': np.float64(0.04271781706001765)}
[I 2024-12-07 00:10:36,945] Trial 80 finished with value: 1.6666666666666665 and parameters: {'x_0_0': 'ac', 'x_0_1': 'bc', 'x_0_2': 'bc', 'x_1_0': 'ab', 'x_1_1': 'ad', 'x_1_2': 'cd'}. Best is trial 63 with value: 1.1222222222222222.
2024-12-07 00:10:40,639 - INFO - Candidate Mean Stats: {'Max': np.float64(2.0), 'Min': np.float64(0.2708255085577823), 'Mean': np.float64(0.4881033075745165), 'Std': np.float64(0.062498477772056096)}
2024-12-07 00:10:40,639 - INFO - Candidate Std Stats: {'Max': np.float64(1.6353669442414422), 'Min': np.float64(0.0), 'Mean': np.float64(0.10174228681870867), 'Std': np.float64(0.053619943364699524)}
[I 2024-12-07 00:10:40,701] Trial 80 finished with value: 1.3666666666666667 and parameters: {'x_0_0': 'bc', 'x_0_1': 'bc', 'x_0_2': 'oo', 'x_1_0': 'oo', 'x_1_1': 'cd', 'x_1_2': 'cd'}. Best is trial 49 with value: 0.7999999999999999.
2024-12-07 00:10:43,231 - INFO - Candidate Mean Stats: {'Max': np.float64(2.0), 'Min': np.float64(0.3402079535475419), 'Mean': np.float64(0.49562559879924295), 'Std': np.float64(0.05609942918409026)}
2024-12-07 00:10:43,231 - INFO - Candidate Std Stats: {'Max': np.float64(0.32086616857081457), 'Min': np.float64(0.0), 'Mean': np.float64(0.09351399217323887), 'Std': np.float64(0.037852418197904664)}
[I 2024-12-07 00:10:43,278] Trial 80 finished with value: 1.9 and parameters: {'x_0_0': 'oo', 'x_0_1': 'ab', 'x_0_2': 'ad', 'x_1_0': 'ab', 'x_1_1': 'ac', 'x_1_2': 'ac'}. Best is trial 67 with value: 1.0222222222222221.
2024-12-07 00:10:50,957 - INFO - Candidate Mean Stats: {'Max': np.float64(2.0), 'Min': np.float64(0.21375414940841475), 'Mean': np.float64(0.49104127819080867), 'Std': np.float64(0.06606188050750855)}
2024-12-07 00:10:50,958 - INFO - Candidate Std Stats: {'Max': np.float64(0.5501341559588774), 'Min': np.float64(0.0), 'Mean': np.float64(0.11021093517327533), 'Std': np.float64(0.04580003135951365)}
[I 2024-12-07 00:10:51,002] Trial 80 finished with value: 1.2777777777777777 and parameters: {'x_0_0': 'ab', 'x_0_1': 'oo', 'x_0_2': 'cd', 'x_1_0': 'bd', 'x_1_1': 'oo', 'x_1_2': 'ac'}. Best is trial 74 with value: 0.8222222222222222.
2024-12-07 00:11:00,959 - INFO - Candidate Mean Stats: {'Max': np.float64(2.0), 'Min': np.float64(0.25330863632166145), 'Mean': np.float64(0.4868415227578552), 'Std': np.float64(0.06257303046164969)}
2024-12-07 00:11:00,960 - INFO - Candidate Std Stats: {'Max': np.float64(0.4205852484790712), 'Min': np.float64(0.0), 'Mean': np.float64(0.09946112922897495), 'Std': np.float64(0.04162299114221792)}
[I 2024-12-07 00:11:01,005] Trial 81 finished with value: 1.5555555555555556 and parameters: {'x_0_0': 'ad', 'x_0_1': 'ab', 'x_0_2': 'ab', 'x_1_0': 'ab', 'x_1_1': 'ab', 'x_1_2': 'bd'}. Best is trial 63 with value: 1.1222222222222222.
2024-12-07 00:11:04,678 - INFO - Candidate Mean Stats: {'Max': np.float64(2.0), 'Min': np.float64(0.23226381176073252), 'Mean': np.float64(0.4876264481465402), 'Std': np.float64(0.060966854662540766)}
2024-12-07 00:11:04,679 - INFO - Candidate Std Stats: {'Max': np.float64(0.5382975409255516), 'Min': np.float64(0.0), 'Mean': np.float64(0.09934455536508716), 'Std': np.float64(0.042220080204376294)}
[I 2024-12-07 00:11:04,726] Trial 81 finished with value: 1.6666666666666665 and parameters: {'x_0_0': 'bd', 'x_0_1': 'ac', 'x_0_2': 'bc', 'x_1_0': 'cd', 'x_1_1': 'bd', 'x_1_2': 'ab'}. Best is trial 49 with value: 0.7999999999999999.
2024-12-07 00:11:07,419 - INFO - Candidate Mean Stats: {'Max': np.float64(2.0), 'Min': np.float64(0.2670166416436942), 'Mean': np.float64(0.48062630036855375), 'Std': np.float64(0.0685127659131144)}
2024-12-07 00:11:07,420 - INFO - Candidate Std Stats: {'Max': np.float64(0.610273899885126), 'Min': np.float64(0.0), 'Mean': np.float64(0.11348754728961448), 'Std': np.float64(0.047651980639595644)}
[I 2024-12-07 00:11:07,478] Trial 81 finished with value: 1.3777777777777778 and parameters: {'x_0_0': 'ab', 'x_0_1': 'oo', 'x_0_2': 'ad', 'x_1_0': 'bc', 'x_1_1': 'ab', 'x_1_2': 'bd'}. Best is trial 67 with value: 1.0222222222222221.
2024-12-07 00:11:15,638 - INFO - Candidate Mean Stats: {'Max': np.float64(2.0), 'Min': np.float64(0.18312057201542725), 'Mean': np.float64(0.48720491812005595), 'Std': np.float64(0.06755954297200385)}
2024-12-07 00:11:15,640 - INFO - Candidate Std Stats: {'Max': np.float64(1.4625258583225953), 'Min': np.float64(0.0), 'Mean': np.float64(0.10841701404703358), 'Std': np.float64(0.053528038234848356)}
[I 2024-12-07 00:11:15,690] Trial 81 finished with value: 1.4444444444444444 and parameters: {'x_0_0': 'bc', 'x_0_1': 'ad', 'x_0_2': 'ac', 'x_1_0': 'ab', 'x_1_1': 'ad', 'x_1_2': 'bc'}. Best is trial 74 with value: 0.8222222222222222.
2024-12-07 00:11:26,013 - INFO - Candidate Mean Stats: {'Max': np.float64(2.0), 'Min': np.float64(0.27552978749573365), 'Mean': np.float64(0.4885552866370427), 'Std': np.float64(0.060958276708880064)}
2024-12-07 00:11:26,014 - INFO - Candidate Std Stats: {'Max': np.float64(0.4902317059104947), 'Min': np.float64(0.0), 'Mean': np.float64(0.10247960071714143), 'Std': np.float64(0.04396674947080223)}
[I 2024-12-07 00:11:26,066] Trial 82 finished with value: 1.5666666666666667 and parameters: {'x_0_0': 'ac', 'x_0_1': 'cd', 'x_0_2': 'ac', 'x_1_0': 'bc', 'x_1_1': 'oo', 'x_1_2': 'ad'}. Best is trial 63 with value: 1.1222222222222222.
2024-12-07 00:11:31,049 - INFO - Candidate Mean Stats: {'Max': np.float64(2.0), 'Min': np.float64(0.27150521273963435), 'Mean': np.float64(0.4922406033718736), 'Std': np.float64(0.06016150227388999)}
2024-12-07 00:11:31,051 - INFO - Candidate Std Stats: {'Max': np.float64(0.8649524709474282), 'Min': np.float64(0.0), 'Mean': np.float64(0.09985302524520225), 'Std': np.float64(0.044170731138478386)}
[I 2024-12-07 00:11:31,107] Trial 82 finished with value: 1.3333333333333333 and parameters: {'x_0_0': 'ac', 'x_0_1': 'ad', 'x_0_2': 'ac', 'x_1_0': 'bc', 'x_1_1': 'ab', 'x_1_2': 'ac'}. Best is trial 49 with value: 0.7999999999999999.
2024-12-07 00:11:33,272 - INFO - Candidate Mean Stats: {'Max': np.float64(2.0), 'Min': np.float64(0.2470778033646044), 'Mean': np.float64(0.4886055227406144), 'Std': np.float64(0.06210329275680286)}
2024-12-07 00:11:33,273 - INFO - Candidate Std Stats: {'Max': np.float64(0.4597588208796911), 'Min': np.float64(0.0), 'Mean': np.float64(0.1051666791954516), 'Std': np.float64(0.041543742729753)}
[I 2024-12-07 00:11:33,326] Trial 82 finished with value: 1.3333333333333333 and parameters: {'x_0_0': 'ac', 'x_0_1': 'ac', 'x_0_2': 'ab', 'x_1_0': 'ab', 'x_1_1': 'ac', 'x_1_2': 'ac'}. Best is trial 67 with value: 1.0222222222222221.
2024-12-07 00:11:41,290 - INFO - Candidate Mean Stats: {'Max': np.float64(2.0), 'Min': np.float64(0.20610530368064106), 'Mean': np.float64(0.4748553998561375), 'Std': np.float64(0.06955769959091904)}
2024-12-07 00:11:41,291 - INFO - Candidate Std Stats: {'Max': np.float64(1.3226827344097907), 'Min': np.float64(0.0), 'Mean': np.float64(0.10915982081201854), 'Std': np.float64(0.05409223536557572)}
[I 2024-12-07 00:11:41,345] Trial 82 finished with value: 1.6666666666666665 and parameters: {'x_0_0': 'ac', 'x_0_1': 'bd', 'x_0_2': 'ac', 'x_1_0': 'bd', 'x_1_1': 'ac', 'x_1_2': 'ac'}. Best is trial 74 with value: 0.8222222222222222.
2024-12-07 00:11:51,117 - INFO - Candidate Mean Stats: {'Max': np.float64(2.0), 'Min': np.float64(0.23770028046783126), 'Mean': np.float64(0.49009208677321353), 'Std': np.float64(0.06599560318928478)}
2024-12-07 00:11:51,118 - INFO - Candidate Std Stats: {'Max': np.float64(0.38469605201255536), 'Min': np.float64(0.0), 'Mean': np.float64(0.10352286705505713), 'Std': np.float64(0.04206209554623608)}
[I 2024-12-07 00:11:51,173] Trial 83 finished with value: 1.6666666666666665 and parameters: {'x_0_0': 'ac', 'x_0_1': 'cd', 'x_0_2': 'ab', 'x_1_0': 'ab', 'x_1_1': 'ab', 'x_1_2': 'bd'}. Best is trial 63 with value: 1.1222222222222222.
2024-12-07 00:11:55,567 - INFO - Candidate Mean Stats: {'Max': np.float64(2.0), 'Min': np.float64(0.2468884906264206), 'Mean': np.float64(0.4795471289277894), 'Std': np.float64(0.06728395599588975)}
2024-12-07 00:11:55,568 - INFO - Candidate Std Stats: {'Max': np.float64(0.5241352961561424), 'Min': np.float64(0.0), 'Mean': np.float64(0.10977064281981891), 'Std': np.float64(0.04680102109279028)}
[I 2024-12-07 00:11:55,621] Trial 83 finished with value: 1.7777777777777777 and parameters: {'x_0_0': 'ab', 'x_0_1': 'ab', 'x_0_2': 'ac', 'x_1_0': 'ac', 'x_1_1': 'bd', 'x_1_2': 'bd'}. Best is trial 49 with value: 0.7999999999999999.
2024-12-07 00:11:57,374 - INFO - Candidate Mean Stats: {'Max': np.float64(2.0), 'Min': np.float64(0.2148042072589062), 'Mean': np.float64(0.4920801846311873), 'Std': np.float64(0.06813510837731773)}
2024-12-07 00:11:57,375 - INFO - Candidate Std Stats: {'Max': np.float64(0.6317398816185509), 'Min': np.float64(0.0), 'Mean': np.float64(0.11900864508492247), 'Std': np.float64(0.05411167313754023)}
[I 2024-12-07 00:11:57,424] Trial 83 finished with value: 1.0666666666666667 and parameters: {'x_0_0': 'ad', 'x_0_1': 'oo', 'x_0_2': 'ab', 'x_1_0': 'oo', 'x_1_1': 'ac', 'x_1_2': 'ab'}. Best is trial 67 with value: 1.0222222222222221.
2024-12-07 00:12:06,266 - INFO - Candidate Mean Stats: {'Max': np.float64(2.0), 'Min': np.float64(0.1811677776513319), 'Mean': np.float64(0.4789438394982705), 'Std': np.float64(0.07888167565985)}
2024-12-07 00:12:06,267 - INFO - Candidate Std Stats: {'Max': np.float64(1.3102330823262085), 'Min': np.float64(0.0), 'Mean': np.float64(0.11935535507594168), 'Std': np.float64(0.061949450179022494)}
[I 2024-12-07 00:12:06,327] Trial 83 finished with value: 1.2555555555555555 and parameters: {'x_0_0': 'bc', 'x_0_1': 'ab', 'x_0_2': 'cd', 'x_1_0': 'oo', 'x_1_1': 'oo', 'x_1_2': 'bc'}. Best is trial 74 with value: 0.8222222222222222.
2024-12-07 00:12:15,664 - INFO - Candidate Mean Stats: {'Max': np.float64(2.0), 'Min': np.float64(0.2314521940245081), 'Mean': np.float64(0.49544342881104836), 'Std': np.float64(0.06597622672966433)}
2024-12-07 00:12:15,665 - INFO - Candidate Std Stats: {'Max': np.float64(0.3771426851787798), 'Min': np.float64(0.0), 'Mean': np.float64(0.1004688096127567), 'Std': np.float64(0.04048225539246916)}
[I 2024-12-07 00:12:15,716] Trial 84 finished with value: 1.7777777777777777 and parameters: {'x_0_0': 'ab', 'x_0_1': 'cd', 'x_0_2': 'ab', 'x_1_0': 'bc', 'x_1_1': 'ad', 'x_1_2': 'bd'}. Best is trial 63 with value: 1.1222222222222222.
2024-12-07 00:12:20,673 - INFO - Candidate Mean Stats: {'Max': np.float64(2.0), 'Min': np.float64(0.1819973773995754), 'Mean': np.float64(0.4878489516502167), 'Std': np.float64(0.0634586516970834)}
2024-12-07 00:12:20,673 - INFO - Candidate Std Stats: {'Max': np.float64(0.3956758121737293), 'Min': np.float64(0.0), 'Mean': np.float64(0.09797091160067907), 'Std': np.float64(0.04218440016659777)}
[I 2024-12-07 00:12:20,721] Trial 84 finished with value: 1.3777777777777778 and parameters: {'x_0_0': 'ab', 'x_0_1': 'bc', 'x_0_2': 'oo', 'x_1_0': 'oo', 'x_1_1': 'oo', 'x_1_2': 'bc'}. Best is trial 49 with value: 0.7999999999999999.
2024-12-07 00:12:22,642 - INFO - Candidate Mean Stats: {'Max': np.float64(2.0), 'Min': np.float64(0.20572170662480316), 'Mean': np.float64(0.4956061386867445), 'Std': np.float64(0.07110237378679694)}
2024-12-07 00:12:22,643 - INFO - Candidate Std Stats: {'Max': np.float64(0.5247630304234162), 'Min': np.float64(0.0), 'Mean': np.float64(0.1116452261625178), 'Std': np.float64(0.04980366711199621)}
[I 2024-12-07 00:12:22,703] Trial 84 finished with value: 2.0 and parameters: {'x_0_0': 'cd', 'x_0_1': 'ac', 'x_0_2': 'cd', 'x_1_0': 'ac', 'x_1_1': 'ad', 'x_1_2': 'ad'}. Best is trial 67 with value: 1.0222222222222221.
2024-12-07 00:12:31,297 - INFO - Candidate Mean Stats: {'Max': np.float64(2.0), 'Min': np.float64(0.2573698691854995), 'Mean': np.float64(0.4850559248178964), 'Std': np.float64(0.0712352946984492)}
2024-12-07 00:12:31,297 - INFO - Candidate Std Stats: {'Max': np.float64(1.4737540864648786), 'Min': np.float64(0.0), 'Mean': np.float64(0.11163468604592208), 'Std': np.float64(0.06292399469131368)}
[I 2024-12-07 00:12:31,342] Trial 84 finished with value: 1.4444444444444444 and parameters: {'x_0_0': 'bc', 'x_0_1': 'ad', 'x_0_2': 'ac', 'x_1_0': 'ab', 'x_1_1': 'cd', 'x_1_2': 'ab'}. Best is trial 74 with value: 0.8222222222222222.
2024-12-07 00:12:40,283 - INFO - Candidate Mean Stats: {'Max': np.float64(2.0), 'Min': np.float64(0.2818634047291292), 'Mean': np.float64(0.49555052376650743), 'Std': np.float64(0.0696738970962905)}
2024-12-07 00:12:40,285 - INFO - Candidate Std Stats: {'Max': np.float64(1.1731263979203654), 'Min': np.float64(0.0), 'Mean': np.float64(0.11085814473132566), 'Std': np.float64(0.054718854782127894)}
[I 2024-12-07 00:12:40,330] Trial 85 finished with value: 1.2444444444444445 and parameters: {'x_0_0': 'bc', 'x_0_1': 'ad', 'x_0_2': 'cd', 'x_1_0': 'oo', 'x_1_1': 'ac', 'x_1_2': 'ad'}. Best is trial 63 with value: 1.1222222222222222.
2024-12-07 00:12:44,264 - INFO - Candidate Mean Stats: {'Max': np.float64(2.0), 'Min': np.float64(0.27581818513394635), 'Mean': np.float64(0.4955197816950716), 'Std': np.float64(0.06664708278140333)}
2024-12-07 00:12:44,264 - INFO - Candidate Std Stats: {'Max': np.float64(1.6496026896207459), 'Min': np.float64(0.0), 'Mean': np.float64(0.1027396688205652), 'Std': np.float64(0.054610339548447955)}
[I 2024-12-07 00:12:44,309] Trial 85 finished with value: 0.9666666666666667 and parameters: {'x_0_0': 'bd', 'x_0_1': 'oo', 'x_0_2': 'bd', 'x_1_0': 'oo', 'x_1_1': 'ab', 'x_1_2': 'oo'}. Best is trial 49 with value: 0.7999999999999999.
2024-12-07 00:12:46,016 - INFO - Candidate Mean Stats: {'Max': np.float64(2.0), 'Min': np.float64(0.22526580707298804), 'Mean': np.float64(0.49066092464504574), 'Std': np.float64(0.06541519223629466)}
2024-12-07 00:12:46,017 - INFO - Candidate Std Stats: {'Max': np.float64(0.4432292907104554), 'Min': np.float64(0.0), 'Mean': np.float64(0.09993613420195784), 'Std': np.float64(0.043106618788407006)}
[I 2024-12-07 00:12:46,062] Trial 85 finished with value: 1.5666666666666667 and parameters: {'x_0_0': 'ac', 'x_0_1': 'bd', 'x_0_2': 'ad', 'x_1_0': 'cd', 'x_1_1': 'ac', 'x_1_2': 'oo'}. Best is trial 67 with value: 1.0222222222222221.
2024-12-07 00:12:53,942 - INFO - Candidate Mean Stats: {'Max': np.float64(2.0), 'Min': np.float64(0.2902106616540424), 'Mean': np.float64(0.4922039245904237), 'Std': np.float64(0.06009656301306059)}
2024-12-07 00:12:53,942 - INFO - Candidate Std Stats: {'Max': np.float64(0.576790313175088), 'Min': np.float64(0.0), 'Mean': np.float64(0.10378852457134365), 'Std': np.float64(0.04379078104080723)}
[I 2024-12-07 00:12:53,992] Trial 85 finished with value: 1.4555555555555557 and parameters: {'x_0_0': 'ad', 'x_0_1': 'ac', 'x_0_2': 'ab', 'x_1_0': 'ab', 'x_1_1': 'oo', 'x_1_2': 'cd'}. Best is trial 74 with value: 0.8222222222222222.
2024-12-07 00:13:02,952 - INFO - Candidate Mean Stats: {'Max': np.float64(2.0), 'Min': np.float64(0.16497547881432606), 'Mean': np.float64(0.4901468696075585), 'Std': np.float64(0.0708952031459224)}
2024-12-07 00:13:02,952 - INFO - Candidate Std Stats: {'Max': np.float64(0.7337897953228372), 'Min': np.float64(0.0), 'Mean': np.float64(0.11386899071577801), 'Std': np.float64(0.05390544878101216)}
[I 2024-12-07 00:13:02,998] Trial 86 finished with value: 1.9 and parameters: {'x_0_0': 'oo', 'x_0_1': 'bc', 'x_0_2': 'bc', 'x_1_0': 'cd', 'x_1_1': 'cd', 'x_1_2': 'bc'}. Best is trial 63 with value: 1.1222222222222222.
2024-12-07 00:13:07,661 - INFO - Candidate Mean Stats: {'Max': np.float64(2.0), 'Min': np.float64(0.18433863964795122), 'Mean': np.float64(0.49348466385739714), 'Std': np.float64(0.06274335835073508)}
2024-12-07 00:13:07,661 - INFO - Candidate Std Stats: {'Max': np.float64(0.44976440936631173), 'Min': np.float64(0.0), 'Mean': np.float64(0.09767282809066019), 'Std': np.float64(0.04417813344455784)}
[I 2024-12-07 00:13:07,711] Trial 86 finished with value: 1.6777777777777778 and parameters: {'x_0_0': 'ab', 'x_0_1': 'ac', 'x_0_2': 'bd', 'x_1_0': 'ab', 'x_1_1': 'oo', 'x_1_2': 'bc'}. Best is trial 49 with value: 0.7999999999999999.
2024-12-07 00:13:09,730 - INFO - Candidate Mean Stats: {'Max': np.float64(2.0), 'Min': np.float64(0.2150678061934384), 'Mean': np.float64(0.48830148346370655), 'Std': np.float64(0.06382610277093463)}
2024-12-07 00:13:09,731 - INFO - Candidate Std Stats: {'Max': np.float64(0.5679882432640808), 'Min': np.float64(0.0), 'Mean': np.float64(0.10465913905797176), 'Std': np.float64(0.046699406219815796)}
