[I 2024-12-28 15:00:22,538] Trial 97 finished with value: 2.0 and parameters: {'x_0_0': 'cd', 'x_0_1': 'ad', 'x_1_0': 'ab', 'x_1_1': 'ab'}. Best is trial 17 with value: 0.5.
[I 2024-12-28 15:00:23,177] Trial 98 finished with value: 2.0 and parameters: {'x_0_0': 'cd', 'x_0_1': 'ac', 'x_1_0': 'cd', 'x_1_1': 'bc'}. Best is trial 15 with value: 0.6964285714285714.
[I 2024-12-28 15:00:23,234] Trial 96 finished with value: 2.0 and parameters: {'x_0_0': 'cd', 'x_0_1': 'cd', 'x_1_0': 'bd', 'x_1_1': 'ac'}. Best is trial 17 with value: 0.7857142857142857.
[I 2024-12-28 15:00:23,559] Trial 89 finished with value: 0.9285714285714286 and parameters: {'x_0_0': 'bd', 'x_0_1': 'oo', 'x_1_0': 'ab', 'x_1_1': 'ab'}. Best is trial 43 with value: 0.6964285714285714.
[I 2024-12-28 15:00:24,382] Trial 91 finished with value: 1.7142857142857144 and parameters: {'x_0_0': 'ab', 'x_0_1': 'ab', 'x_1_0': 'ad', 'x_1_1': 'bc'}. Best is trial 21 with value: 0.7857142857142857.
[I 2024-12-28 15:00:24,685] Trial 85 finished with value: 1.5714285714285714 and parameters: {'x_0_0': 'ac', 'x_0_1': 'cd', 'x_1_0': 'bc', 'x_1_1': 'bc'}. Best is trial 7 with value: 0.5.
[I 2024-12-28 15:00:24,785] Trial 81 finished with value: 1.0714285714285714 and parameters: {'x_0_0': 'ac', 'x_0_1': 'oo', 'x_1_0': 'cd', 'x_1_1': 'ad'}. Best is trial 47 with value: 0.6964285714285714.
[I 2024-12-28 15:00:25,183] Trial 96 finished with value: 1.3214285714285714 and parameters: {'x_0_0': 'ad', 'x_0_1': 'ab', 'x_1_0': 'oo', 'x_1_1': 'bd'}. Best is trial 73 with value: 0.7857142857142857.
[I 2024-12-28 15:00:25,441] Trial 93 finished with value: 0.8214285714285714 and parameters: {'x_0_0': 'bc', 'x_0_1': 'oo', 'x_1_0': 'oo', 'x_1_1': 'cd'}. Best is trial 93 with value: 0.8214285714285714.
[I 2024-12-28 15:00:26,790] Trial 97 finished with value: 1.1428571428571428 and parameters: {'x_0_0': 'bd', 'x_0_1': 'cd', 'x_1_0': 'bc', 'x_1_1': 'ab'}. Best is trial 17 with value: 0.7857142857142857.
[I 2024-12-28 15:00:26,843] Trial 98 finished with value: 0.7857142857142857 and parameters: {'x_0_0': 'ad', 'x_0_1': 'oo', 'x_1_0': 'bc', 'x_1_1': 'bd'}. Best is trial 17 with value: 0.5.
[I 2024-12-28 15:00:27,612] Trial 94 finished with value: 1.5714285714285714 and parameters: {'x_0_0': 'bd', 'x_0_1': 'ad', 'x_1_0': 'ad', 'x_1_1': 'cd'}. Best is trial 93 with value: 0.8214285714285714.
[I 2024-12-28 15:00:29,552] Trial 99 finished with value: 2.0 and parameters: {'x_0_0': 'cd', 'x_0_1': 'ac', 'x_1_0': 'ab', 'x_1_1': 'bc'}. Best is trial 15 with value: 0.6964285714285714.
[I 2024-12-28 15:00:29,957] Trial 92 finished with value: 1.4285714285714286 and parameters: {'x_0_0': 'ad', 'x_0_1': 'ab', 'x_1_0': 'ab', 'x_1_1': 'bc'}. Best is trial 21 with value: 0.7857142857142857.
[I 2024-12-28 15:00:30,454] Trial 82 finished with value: 1.0714285714285714 and parameters: {'x_0_0': 'bc', 'x_0_1': 'oo', 'x_1_0': 'ac', 'x_1_1': 'bc'}. Best is trial 47 with value: 0.6964285714285714.
[I 2024-12-28 15:00:30,690] Trial 90 finished with value: 1.625 and parameters: {'x_0_0': 'oo', 'x_0_1': 'cd', 'x_1_0': 'oo', 'x_1_1': 'bd'}. Best is trial 43 with value: 0.6964285714285714.
[I 2024-12-28 15:00:31,413] Trial 97 finished with value: 1.875 and parameters: {'x_0_0': 'oo', 'x_0_1': 'bd', 'x_1_0': 'ad', 'x_1_1': 'ab'}. Best is trial 73 with value: 0.7857142857142857.
[I 2024-12-28 15:00:31,921] Trial 86 finished with value: 1.3214285714285714 and parameters: {'x_0_0': 'ac', 'x_0_1': 'cd', 'x_1_0': 'oo', 'x_1_1': 'bc'}. Best is trial 7 with value: 0.5.
[I 2024-12-28 15:00:32,461] Trial 98 finished with value: 1.3214285714285714 and parameters: {'x_0_0': 'ad', 'x_0_1': 'bd', 'x_1_0': 'oo', 'x_1_1': 'bc'}. Best is trial 50 with value: 0.8214285714285714.
[I 2024-12-28 15:00:32,617] Trial 93 finished with value: 1.7142857142857144 and parameters: {'x_0_0': 'ab', 'x_0_1': 'ad', 'x_1_0': 'cd', 'x_1_1': 'bc'}. Best is trial 21 with value: 0.7857142857142857.
[I 2024-12-28 15:00:32,954] Trial 83 finished with value: 1.2857142857142856 and parameters: {'x_0_0': 'ac', 'x_0_1': 'ad', 'x_1_0': 'cd', 'x_1_1': 'ad'}. Best is trial 47 with value: 0.6964285714285714.
[I 2024-12-28 15:00:33,545] Trial 99 finished with value: 1.5 and parameters: {'x_0_0': 'cd', 'x_0_1': 'oo', 'x_1_0': 'bd', 'x_1_1': 'ab'}. Best is trial 17 with value: 0.5.
[I 2024-12-28 15:00:34,926] Trial 95 finished with value: 1.5714285714285714 and parameters: {'x_0_0': 'bc', 'x_0_1': 'bc', 'x_1_0': 'ad', 'x_1_1': 'cd'}. Best is trial 93 with value: 0.8214285714285714.
[I 2024-12-28 15:00:35,065] Trial 98 finished with value: 1.75 and parameters: {'x_0_0': 'cd', 'x_0_1': 'bd', 'x_1_0': 'oo', 'x_1_1': 'ab'}. Best is trial 73 with value: 0.7857142857142857.
[I 2024-12-28 15:00:35,201] Trial 87 finished with value: 1.875 and parameters: {'x_0_0': 'cd', 'x_0_1': 'bc', 'x_1_0': 'bc', 'x_1_1': 'oo'}. Best is trial 7 with value: 0.5.
[I 2024-12-28 15:00:35,345] Trial 98 finished with value: 0.7857142857142857 and parameters: {'x_0_0': 'ad', 'x_0_1': 'oo', 'x_1_0': 'bd', 'x_1_1': 'bd'}. Best is trial 17 with value: 0.7857142857142857.
[I 2024-12-28 15:00:36,333] Trial 99 finished with value: 1.3214285714285714 and parameters: {'x_0_0': 'ad', 'x_0_1': 'cd', 'x_1_0': 'oo', 'x_1_1': 'bc'}. Best is trial 50 with value: 0.8214285714285714.
[I 2024-12-28 15:00:36,334] Trial 100 finished with value: 1.2857142857142856 and parameters: {'x_0_0': 'ac', 'x_0_1': 'ac', 'x_1_0': 'ab', 'x_1_1': 'bc'}. Best is trial 15 with value: 0.6964285714285714.
[I 2024-12-28 15:00:37,147] Trial 91 finished with value: 1.4285714285714286 and parameters: {'x_0_0': 'bd', 'x_0_1': 'ac', 'x_1_0': 'ab', 'x_1_1': 'cd'}. Best is trial 43 with value: 0.6964285714285714.
[I 2024-12-28 15:00:37,286] Trial 94 finished with value: 1.875 and parameters: {'x_0_0': 'oo', 'x_0_1': 'ac', 'x_1_0': 'bc', 'x_1_1': 'ac'}. Best is trial 21 with value: 0.7857142857142857.
[I 2024-12-28 15:00:37,448] Trial 84 finished with value: 0.8214285714285714 and parameters: {'x_0_0': 'bc', 'x_0_1': 'oo', 'x_1_0': 'oo', 'x_1_1': 'bc'}. Best is trial 47 with value: 0.6964285714285714.
[I 2024-12-28 15:00:37,965] Trial 99 finished with value: 2.0 and parameters: {'x_0_0': 'cd', 'x_0_1': 'bd', 'x_1_0': 'ac', 'x_1_1': 'ab'}. Best is trial 73 with value: 0.7857142857142857.
[I 2024-12-28 15:00:39,344] Trial 96 finished with value: 1.4285714285714286 and parameters: {'x_0_0': 'ac', 'x_0_1': 'ab', 'x_1_0': 'ac', 'x_1_1': 'ad'}. Best is trial 93 with value: 0.8214285714285714.
[I 2024-12-28 15:00:39,655] Trial 88 finished with value: 1.7142857142857144 and parameters: {'x_0_0': 'ab', 'x_0_1': 'bc', 'x_1_0': 'cd', 'x_1_1': 'ac'}. Best is trial 7 with value: 0.5.
[I 2024-12-28 15:00:39,847] Trial 100 finished with value: 1.5 and parameters: {'x_0_0': 'cd', 'x_0_1': 'oo', 'x_1_0': 'bd', 'x_1_1': 'bc'}. Best is trial 17 with value: 0.5.
[I 2024-12-28 15:00:40,339] Trial 100 finished with value: 1.1428571428571428 and parameters: {'x_0_0': 'bc', 'x_0_1': 'ad', 'x_1_0': 'cd', 'x_1_1': 'ab'}. Best is trial 50 with value: 0.8214285714285714.
[I 2024-12-28 15:00:40,443] Trial 100 finished with value: 1.25 and parameters: {'x_0_0': 'cd', 'x_0_1': 'oo', 'x_1_0': 'oo', 'x_1_1': 'ab'}. Best is trial 73 with value: 0.7857142857142857.
[I 2024-12-28 15:00:40,657] Trial 101 finished with value: 1.0714285714285714 and parameters: {'x_0_0': 'ac', 'x_0_1': 'oo', 'x_1_0': 'ab', 'x_1_1': 'bc'}. Best is trial 15 with value: 0.6964285714285714.
[I 2024-12-28 15:00:42,607] Trial 99 finished with value: 1.2142857142857144 and parameters: {'x_0_0': 'ab', 'x_0_1': 'oo', 'x_1_0': 'bd', 'x_1_1': 'ad'}. Best is trial 17 with value: 0.7857142857142857.
[I 2024-12-28 15:00:42,650] Trial 85 finished with value: 1.5 and parameters: {'x_0_0': 'cd', 'x_0_1': 'oo', 'x_1_0': 'bc', 'x_1_1': 'ad'}. Best is trial 47 with value: 0.6964285714285714.
[I 2024-12-28 15:00:43,328] Trial 89 finished with value: 1.4464285714285714 and parameters: {'x_0_0': 'bc', 'x_0_1': 'bd', 'x_1_0': 'ac', 'x_1_1': 'oo'}. Best is trial 7 with value: 0.5.
[I 2024-12-28 15:00:43,905] Trial 95 finished with value: 1.375 and parameters: {'x_0_0': 'oo', 'x_0_1': 'oo', 'x_1_0': 'bc', 'x_1_1': 'ac'}. Best is trial 21 with value: 0.7857142857142857.
[I 2024-12-28 15:00:45,244] Trial 92 finished with value: 1.375 and parameters: {'x_0_0': 'oo', 'x_0_1': 'oo', 'x_1_0': 'bc', 'x_1_1': 'bd'}. Best is trial 43 with value: 0.6964285714285714.
[I 2024-12-28 15:00:45,979] Trial 101 finished with value: 1.4285714285714286 and parameters: {'x_0_0': 'ac', 'x_0_1': 'ab', 'x_1_0': 'ac', 'x_1_1': 'bc'}. Best is trial 50 with value: 0.8214285714285714.
[I 2024-12-28 15:00:46,246] Trial 101 finished with value: 1.625 and parameters: {'x_0_0': 'oo', 'x_0_1': 'bd', 'x_1_0': 'oo', 'x_1_1': 'ad'}. Best is trial 73 with value: 0.7857142857142857.
[I 2024-12-28 15:00:46,535] Trial 97 finished with value: 1.875 and parameters: {'x_0_0': 'oo', 'x_0_1': 'cd', 'x_1_0': 'ad', 'x_1_1': 'cd'}. Best is trial 93 with value: 0.8214285714285714.
[I 2024-12-28 15:00:49,065] Trial 102 finished with value: 1.5714285714285714 and parameters: {'x_0_0': 'ac', 'x_0_1': 'bd', 'x_1_0': 'ab', 'x_1_1': 'bc'}. Best is trial 15 with value: 0.6964285714285714.
[I 2024-12-28 15:00:49,247] Trial 86 finished with value: 1.5 and parameters: {'x_0_0': 'cd', 'x_0_1': 'oo', 'x_1_0': 'ac', 'x_1_1': 'bc'}. Best is trial 47 with value: 0.6964285714285714.
[I 2024-12-28 15:00:49,533] Trial 96 finished with value: 1.3214285714285714 and parameters: {'x_0_0': 'bd', 'x_0_1': 'ab', 'x_1_0': 'oo', 'x_1_1': 'ab'}. Best is trial 21 with value: 0.7857142857142857.
[I 2024-12-28 15:00:51,058] Trial 102 finished with value: 1.2142857142857144 and parameters: {'x_0_0': 'ab', 'x_0_1': 'oo', 'x_1_0': 'bc', 'x_1_1': 'bd'}. Best is trial 73 with value: 0.7857142857142857.
[I 2024-12-28 15:00:51,833] Trial 103 finished with value: 1.2857142857142856 and parameters: {'x_0_0': 'bc', 'x_0_1': 'ac', 'x_1_0': 'bc', 'x_1_1': 'bc'}. Best is trial 15 with value: 0.6964285714285714.
[I 2024-12-28 15:00:51,875] Trial 100 finished with value: 1.5892857142857144 and parameters: {'x_0_0': 'ab', 'x_0_1': 'bd', 'x_1_0': 'bd', 'x_1_1': 'oo'}. Best is trial 17 with value: 0.7857142857142857.
[I 2024-12-28 15:00:52,371] Trial 98 finished with value: 1.2857142857142856 and parameters: {'x_0_0': 'bc', 'x_0_1': 'ac', 'x_1_0': 'ad', 'x_1_1': 'cd'}. Best is trial 93 with value: 0.8214285714285714.
[I 2024-12-28 15:00:52,467] Trial 101 finished with value: 1.5 and parameters: {'x_0_0': 'cd', 'x_0_1': 'oo', 'x_1_0': 'bd', 'x_1_1': 'cd'}. Best is trial 17 with value: 0.5.
[I 2024-12-28 15:00:52,722] Trial 90 finished with value: 1.5714285714285714 and parameters: {'x_0_0': 'bc', 'x_0_1': 'bd', 'x_1_0': 'ac', 'x_1_1': 'cd'}. Best is trial 7 with value: 0.5.
[I 2024-12-28 15:00:52,908] Trial 102 finished with value: 2.0 and parameters: {'x_0_0': 'cd', 'x_0_1': 'bd', 'x_1_0': 'bc', 'x_1_1': 'bc'}. Best is trial 50 with value: 0.8214285714285714.
[I 2024-12-28 15:00:53,882] Trial 93 finished with value: 1.875 and parameters: {'x_0_0': 'oo', 'x_0_1': 'ac', 'x_1_0': 'bc', 'x_1_1': 'bd'}. Best is trial 43 with value: 0.6964285714285714.

Loaded from prev state!
Loaded from prev state!
Loaded from prev state!
Loaded from prev state!
Loaded from prev state!
Loaded from prev state!
Loaded from prev state!
Loaded from prev state!
Loaded from prev state!
Loaded from prev state!
Loaded from prev state!
Loaded from prev state!
Loaded from prev state!
Loaded from prev state!
Loaded from prev state!
Loaded from prev state!
Loaded from prev state!
Loaded from prev state!
Loaded from prev state!
Loaded from prev state!
Loaded from prev state!
Loaded from prev state!
Loaded from prev state!
Loaded from prev state!
Loaded from prev state!
Loaded from prev state!
Loaded from prev state!
Loaded from prev state!
Loaded from prev state!
Loaded from prev state!
Loaded from prev state!
Loaded from prev state!
Loaded from prev state!
Loaded from prev state!
Loaded from prev state!
Loaded from prev state!
Loaded from prev state!
Loaded from prev state!
Loaded from prev state!
Loaded from prev state!
Loaded from prev state!
Loaded from prev state!
Loaded from prev state!
Loaded from prev state!
Loaded from prev state!
Loaded from prev state!
Loaded from prev state!
Loaded from prev state!
Loaded from prev state!
Loaded from prev state!
Loaded from prev state!
Loaded from prev state!
Loaded from prev state!
Loaded from prev state!
Loaded from prev state!
Loaded from prev state!
Loaded from prev state!
Loaded from prev state!
Loaded from prev state!
Loaded from prev state!
Loaded from prev state!
Loaded from prev state!
Loaded from prev state!
Loaded from prev state!
Loaded from prev state!
Loaded from prev state!
Loaded from prev state!
Loaded from prev state!
Loaded from prev state!
Loaded from prev state!
Loaded from prev state!
Loaded from prev state!
Loaded from prev state!
Loaded from prev state!
Loaded from prev state!
Loaded from prev state!
Loaded from prev state!
Loaded from prev state!
Loaded from prev state!
Loaded from prev state!
Loaded from prev state!
Loaded from prev state!
Loaded from prev state!
Loaded from prev state!
Loaded from prev state!
Loaded from prev state!
Loaded from prev state!
Loaded from prev state!
Loaded from prev state!
Loaded from prev state!
Loaded from prev state!
Loaded from prev state!
Loaded from prev state!
Loaded from prev state!
Loaded from prev state!
Loaded from prev state!
Loaded from prev state!
Loaded from prev state!
Loaded from prev state!
Loaded from prev state!
Loaded from prev state!
Loaded from prev state!
Loaded from prev state!
Loaded from prev state!
Loaded from prev state!
Loaded from prev state!
Loaded from prev state!
Loaded from prev state!
Loaded from prev state!
Loaded from prev state!
Loaded from prev state!
Loaded from prev state!
Loaded from prev state!
Loaded from prev state!
Loaded from prev state!
Loaded from prev state!
Loaded from prev state!
Loaded from prev state!
Loaded from prev state!
Loaded from prev state!
Loaded from prev state!
Loaded from prev state!
Loaded from prev state!
Loaded from prev state!
Loaded from prev state!
Loaded from prev state!
Loaded from prev state!
Loaded from prev state!
Loaded from prev state!
Loaded from prev state!
Loaded from prev state!
Loaded from prev state!
Loaded from prev state!
Loaded from prev state!
Loaded from prev state!
Loaded from prev state!
Loaded from prev state!
Loaded from prev state!
Loaded from prev state!
Loaded from prev state!
Loaded from prev state!
Loaded from prev state!
Loaded from prev state!
Loaded from prev state!
Loaded from prev state!
Loaded from prev state!
Loaded from prev state!
Loaded from prev state!
Loaded from prev state!
Loaded from prev state!
Loaded from prev state!
Loaded from prev state!
Loaded from prev state!
Loaded from prev state!
Loaded from prev state!
Loaded from prev state!
Loaded from prev state!
Loaded from prev state!
Loaded from prev state!
Loaded from prev state!
Loaded from prev state!
Loaded from prev state!
Loaded from prev state!
Loaded from prev state!
Loaded from prev state!
Loaded from prev state!
Loaded from prev state!
Loaded from prev state!
Loaded from prev state!
Loaded from prev state!
Loaded from prev state!
Loaded from prev state!
Loaded from prev state!
Loaded from prev state!
Loaded from prev state!
Loaded from prev state!
Loaded from prev state!
Loaded from prev state!
Loaded from prev state!
Loaded from prev state!
Loaded from prev state!
Loaded from prev state!
Loaded from prev state!
Loaded from prev state!
Loaded from prev state!
Loaded from prev state!
Loaded from prev state!
Loaded from prev state!
Loaded from prev state!
Loaded from prev state!
Loaded from prev state!
Loaded from prev state!
Loaded from prev state!
Loaded from prev state!
Loaded from prev state!
Loaded from prev state!
Loaded from prev state!
Loaded from prev state!
Loaded from prev state!
Loaded from prev state!
Loaded from prev state!
Loaded from prev state!
Loaded from prev state!
Loaded from prev state!
Loaded from prev state!
Loaded from prev state!
Loaded from prev state!
Loaded from prev state!
Loaded from prev state!
Loaded from prev state!
Loaded from prev state!
Loaded from prev state!
Loaded from prev state!
Loaded from prev state!
Loaded from prev state!
Loaded from prev state!
Loaded from prev state!
Loaded from prev state!
Loaded from prev state!
Loaded from prev state!
Loaded from prev state!
Loaded from prev state!
Loaded from prev state!
Loaded from prev state!
Loaded from prev state!
Loaded from prev state!
Loaded from prev state!
Loaded from prev state!
Loaded from prev state!
Loaded from prev state!
Loaded from prev state!
Loaded from prev state!
Loaded from prev state!
Loaded from prev state!
Loaded from prev state!
Loaded from prev state!
Loaded from prev state!
Loaded from prev state!
Loaded from prev state!
Loaded from prev state!
Loaded from prev state!
Loaded from prev state!
Loaded from prev state!
Loaded from prev state!
Loaded from prev state!
Loaded from prev state!
Loaded from prev state!
Loaded from prev state!
Loaded from prev state!
Loaded from prev state!
Loaded from prev state!
Loaded from prev state!
Loaded from prev state!
Loaded from prev state!
Loaded from prev state!
Loaded from prev state!
Loaded from prev state!
Loaded from prev state!
Loaded from prev state!
Loaded from prev state!
Loaded from prev state!
Loaded from prev state!
Loaded from prev state!
Loaded from prev state!
Loaded from prev state!
Loaded from prev state!
Loaded from prev state!
Loaded from prev state!
Loaded from prev state!
Loaded from prev state!
Loaded from prev state!
Loaded from prev state!
Loaded from prev state!
Loaded from prev state!
Loaded from prev state!
Loaded from prev state!
Loaded from prev state!
Loaded from prev state!
Loaded from prev state!
Loaded from prev state!
Loaded from prev state!
Loaded from prev state!
Loaded from prev state!
Loaded from prev state!
Loaded from prev state!
Loaded from prev state!
Loaded from prev state!
Loaded from prev state!
Loaded from prev state!
Loaded from prev state!
Loaded from prev state!
Loaded from prev state!
Loaded from prev state!
Loaded from prev state!
Loaded from prev state!
Loaded from prev state!
Loaded from prev state!
Loaded from prev state!
Loaded from prev state!
Loaded from prev state!
Loaded from prev state!
Loaded from prev state!
Loaded from prev state!
Loaded from prev state!
Loaded from prev state!
Loaded from prev state!
Loaded from prev state!
Loaded from prev state!
Loaded from prev state!
Loaded from prev state!
Loaded from prev state!
Loaded from prev state!
Loaded from prev state!
Loaded from prev state!
Loaded from prev state!
Loaded from prev state!
Loaded from prev state!
Loaded from prev state!
Loaded from prev state!
Loaded from prev state!
Loaded from prev state!
Loaded from prev state!
Loaded from prev state!
Loaded from prev state!
Loaded from prev state!
Loaded from prev state!
Loaded from prev state!
Loaded from prev state!
Loaded from prev state!
Loaded from prev state!
Loaded from prev state!
Loaded from prev state!
Loaded from prev state!
Loaded from prev state!
Loaded from prev state!
Loaded from prev state!
Loaded from prev state!
Loaded from prev state!
Loaded from prev state!
Loaded from prev state!
Loaded from prev state!
Loaded from prev state![I 2024-12-28 15:00:55,045] Trial 101 finished with value: 1.7142857142857144 and parameters: {'x_0_0': 'ab', 'x_0_1': 'bd', 'x_1_0': 'bd', 'x_1_1': 'bc'}. Best is trial 17 with value: 0.7857142857142857.
[I 2024-12-28 15:00:56,330] Trial 103 finished with value: 1.75 and parameters: {'x_0_0': 'oo', 'x_0_1': 'ac', 'x_1_0': 'bd', 'x_1_1': 'oo'}. Best is trial 73 with value: 0.7857142857142857.
[I 2024-12-28 15:00:56,451] Trial 97 finished with value: 1.4464285714285714 and parameters: {'x_0_0': 'bd', 'x_0_1': 'ad', 'x_1_0': 'ac', 'x_1_1': 'oo'}. Best is trial 21 with value: 0.7857142857142857.
[I 2024-12-28 15:00:56,616] Trial 104 finished with value: 1.0357142857142856 and parameters: {'x_0_0': 'bc', 'x_0_1': 'ac', 'x_1_0': 'oo', 'x_1_1': 'bc'}. Best is trial 15 with value: 0.6964285714285714.
[I 2024-12-28 15:00:56,996] Trial 91 finished with value: 1.2857142857142856 and parameters: {'x_0_0': 'bc', 'x_0_1': 'ad', 'x_1_0': 'bd', 'x_1_1': 'ad'}. Best is trial 7 with value: 0.5.
[I 2024-12-28 15:00:59,316] Trial 99 finished with value: 1.2857142857142856 and parameters: {'x_0_0': 'ac', 'x_0_1': 'ad', 'x_1_0': 'ad', 'x_1_1': 'cd'}. Best is trial 93 with value: 0.8214285714285714.
[I 2024-12-28 15:00:59,350] Trial 94 finished with value: 1.875 and parameters: {'x_0_0': 'oo', 'x_0_1': 'bc', 'x_1_0': 'cd', 'x_1_1': 'bc'}. Best is trial 43 with value: 0.6964285714285714.
[I 2024-12-28 15:00:59,785] Trial 102 finished with value: 1.2857142857142856 and parameters: {'x_0_0': 'ad', 'x_0_1': 'cd', 'x_1_0': 'bd', 'x_1_1': 'ac'}. Best is trial 17 with value: 0.7857142857142857.
[I 2024-12-28 15:00:59,929] Trial 103 finished with value: 1.2857142857142856 and parameters: {'x_0_0': 'ad', 'x_0_1': 'ab', 'x_1_0': 'bd', 'x_1_1': 'bc'}. Best is trial 50 with value: 0.8214285714285714.
