[I 2024-12-06 23:37:13,372] Trial 195 finished with value: 1.2142857142857144 and parameters: {'x_0_0': 'ab', 'x_0_1': 'oo', 'x_1_0': 'ad', 'x_1_1': 'ad'}. Best is trial 23 with value: 0.5.
2024-12-06 23:37:13,592 - INFO - Candidate Mean Stats: {'Max': np.float64(2.792779191957025), 'Min': np.float64(-0.71587297403706), 'Mean': np.float64(0.5574638984533113), 'Std': np.float64(0.5368960156013263)}
2024-12-06 23:37:13,593 - INFO - Candidate Std Stats: {'Max': np.float64(1.7392644593783804), 'Min': np.float64(0.0), 'Mean': np.float64(0.5329706709673905), 'Std': np.float64(0.2740210183108598)}
2024-12-06 23:37:13,606 - INFO - Candidate Mean Stats: {'Max': np.float64(2.811153561620363), 'Min': np.float64(-1.0976072931510157), 'Mean': np.float64(0.5444074087198392), 'Std': np.float64(0.5281170406838316)}
2024-12-06 23:37:13,606 - INFO - Candidate Std Stats: {'Max': np.float64(1.473301679714846), 'Min': np.float64(0.0), 'Mean': np.float64(0.5525890192274161), 'Std': np.float64(0.2833885414682348)}
[I 2024-12-06 23:37:13,606] Trial 197 finished with value: 0.5 and parameters: {'x_0_0': 'ad', 'x_0_1': 'oo', 'x_1_0': 'bc', 'x_1_1': 'ac'}. Best is trial 165 with value: 0.5.
2024-12-06 23:37:13,613 - INFO - Candidate Mean Stats: {'Max': np.float64(2.6169242941310826), 'Min': np.float64(-0.9785892924328424), 'Mean': np.float64(0.5069377759544024), 'Std': np.float64(0.5360128856988308)}
2024-12-06 23:37:13,613 - INFO - Candidate Std Stats: {'Max': np.float64(1.5844748613833133), 'Min': np.float64(0.0), 'Mean': np.float64(0.5718416688199851), 'Std': np.float64(0.2859040051401528)}
[I 2024-12-06 23:37:13,619] Trial 197 finished with value: 1.125 and parameters: {'x_0_0': 'oo', 'x_0_1': 'oo', 'x_1_0': 'oo', 'x_1_1': 'bc'}. Best is trial 76 with value: 0.5.
[I 2024-12-06 23:37:13,626] Trial 197 finished with value: 1.0714285714285714 and parameters: {'x_0_0': 'ad', 'x_0_1': 'oo', 'x_1_0': 'ac', 'x_1_1': 'cd'}. Best is trial 63 with value: 0.5.
2024-12-06 23:37:13,722 - INFO - Candidate Mean Stats: {'Max': np.float64(3.23848578068568), 'Min': np.float64(-1.2425618328407118), 'Mean': np.float64(0.5785051793303889), 'Std': np.float64(0.5557560654718153)}
2024-12-06 23:37:13,722 - INFO - Candidate Std Stats: {'Max': np.float64(1.6455108459637098), 'Min': np.float64(0.0), 'Mean': np.float64(0.5916548967731636), 'Std': np.float64(0.2899777992628816)}
[I 2024-12-06 23:37:13,735] Trial 196 finished with value: 1.0892857142857144 and parameters: {'x_0_0': 'ab', 'x_0_1': 'oo', 'x_1_0': 'cd', 'x_1_1': 'oo'}. Best is trial 23 with value: 0.5.
2024-12-06 23:37:13,954 - INFO - Candidate Mean Stats: {'Max': np.float64(2.8467606910842758), 'Min': np.float64(-1.1555228902666115), 'Mean': np.float64(0.4749039784512389), 'Std': np.float64(0.5416826072366416)}
2024-12-06 23:37:13,954 - INFO - Candidate Std Stats: {'Max': np.float64(1.5801680568444247), 'Min': np.float64(0.0), 'Mean': np.float64(0.6167746826856882), 'Std': np.float64(0.3006634952941354)}
2024-12-06 23:37:13,965 - INFO - Candidate Mean Stats: {'Max': np.float64(3.520327372946423), 'Min': np.float64(-1.01558324231075), 'Mean': np.float64(0.5449780322335182), 'Std': np.float64(0.5492105009228818)}
2024-12-06 23:37:13,965 - INFO - Candidate Std Stats: {'Max': np.float64(1.530447493370975), 'Min': np.float64(0.0), 'Mean': np.float64(0.5533965238528952), 'Std': np.float64(0.26866919084212887)}
[I 2024-12-06 23:37:13,967] Trial 198 finished with value: 1.0714285714285714 and parameters: {'x_0_0': 'bd', 'x_0_1': 'oo', 'x_1_0': 'ad', 'x_1_1': 'ab'}. Best is trial 165 with value: 0.5.
2024-12-06 23:37:13,976 - INFO - Candidate Mean Stats: {'Max': np.float64(2.8932405970768533), 'Min': np.float64(-1.0202797425132981), 'Mean': np.float64(0.5058870194427041), 'Std': np.float64(0.528904387889335)}
2024-12-06 23:37:13,977 - INFO - Candidate Std Stats: {'Max': np.float64(1.369531480339013), 'Min': np.float64(0.0), 'Mean': np.float64(0.5288387509319636), 'Std': np.float64(0.26205811520787203)}
[I 2024-12-06 23:37:13,978] Trial 198 finished with value: 1.375 and parameters: {'x_0_0': 'oo', 'x_0_1': 'oo', 'x_1_0': 'ab', 'x_1_1': 'ac'}. Best is trial 76 with value: 0.5.
[I 2024-12-06 23:37:13,990] Trial 198 finished with value: 0.8214285714285714 and parameters: {'x_0_0': 'ad', 'x_0_1': 'oo', 'x_1_0': 'oo', 'x_1_1': 'ac'}. Best is trial 63 with value: 0.5.
2024-12-06 23:37:14,082 - INFO - Candidate Mean Stats: {'Max': np.float64(3.4432876587543872), 'Min': np.float64(-1.0698169454667947), 'Mean': np.float64(0.4766993470868118), 'Std': np.float64(0.5685025402063294)}
2024-12-06 23:37:14,082 - INFO - Candidate Std Stats: {'Max': np.float64(1.7023738412506457), 'Min': np.float64(0.0), 'Mean': np.float64(0.5958244596594345), 'Std': np.float64(0.3062500164065946)}
[I 2024-12-06 23:37:14,094] Trial 197 finished with value: 1.5 and parameters: {'x_0_0': 'cd', 'x_0_1': 'oo', 'x_1_0': 'bd', 'x_1_1': 'bc'}. Best is trial 23 with value: 0.5.
2024-12-06 23:37:14,313 - INFO - Candidate Mean Stats: {'Max': np.float64(2.718595410840272), 'Min': np.float64(-0.9693507674216228), 'Mean': np.float64(0.5263935707108091), 'Std': np.float64(0.5291913484646147)}
2024-12-06 23:37:14,313 - INFO - Candidate Std Stats: {'Max': np.float64(1.780635331687031), 'Min': np.float64(0.0), 'Mean': np.float64(0.5636447604949447), 'Std': np.float64(0.28487381468920897)}
2024-12-06 23:37:14,324 - INFO - Candidate Mean Stats: {'Max': np.float64(2.5573044497699096), 'Min': np.float64(-0.9200208896091336), 'Mean': np.float64(0.5246570645852364), 'Std': np.float64(0.5175865288846518)}
2024-12-06 23:37:14,324 - INFO - Candidate Std Stats: {'Max': np.float64(1.6179619134746221), 'Min': np.float64(0.0), 'Mean': np.float64(0.5497888831089984), 'Std': np.float64(0.293410603863254)}
[I 2024-12-06 23:37:14,326] Trial 199 finished with value: 0.7857142857142857 and parameters: {'x_0_0': 'bd', 'x_0_1': 'oo', 'x_1_0': 'bd', 'x_1_1': 'ab'}. Best is trial 165 with value: 0.5.
[I 2024-12-06 23:37:14,337] Trial 199 finished with value: 1.0714285714285714 and parameters: {'x_0_0': 'ad', 'x_0_1': 'oo', 'x_1_0': 'ac', 'x_1_1': 'cd'}. Best is trial 76 with value: 0.5.
2024-12-06 23:37:14,340 - INFO - Candidate Mean Stats: {'Max': np.float64(2.4799848906036863), 'Min': np.float64(-1.146014101171043), 'Mean': np.float64(0.46982094390640333), 'Std': np.float64(0.5204765301155108)}
2024-12-06 23:37:14,340 - INFO - Candidate Std Stats: {'Max': np.float64(1.5333082266117495), 'Min': np.float64(0.0), 'Mean': np.float64(0.5565291835175205), 'Std': np.float64(0.278056495838631)}
[I 2024-12-06 23:37:14,353] Trial 199 finished with value: 1.0714285714285714 and parameters: {'x_0_0': 'ac', 'x_0_1': 'oo', 'x_1_0': 'cd', 'x_1_1': 'bd'}. Best is trial 63 with value: 0.5.
2024-12-06 23:37:14,443 - INFO - Candidate Mean Stats: {'Max': np.float64(3.2346150889032486), 'Min': np.float64(-0.8504444923419037), 'Mean': np.float64(0.4267485101831795), 'Std': np.float64(0.5575282068738007)}
2024-12-06 23:37:14,443 - INFO - Candidate Std Stats: {'Max': np.float64(1.584362532563809), 'Min': np.float64(0.0), 'Mean': np.float64(0.6274292438234008), 'Std': np.float64(0.3118230056337764)}
[I 2024-12-06 23:37:14,456] Trial 198 finished with value: 1.75 and parameters: {'x_0_0': 'oo', 'x_0_1': 'bd', 'x_1_0': 'ab', 'x_1_1': 'oo'}. Best is trial 23 with value: 0.5.
2024-12-06 23:37:14,673 - INFO - Candidate Mean Stats: {'Max': np.float64(2.6042947836966777), 'Min': np.float64(-1.1021772052713363), 'Mean': np.float64(0.5277335130101474), 'Std': np.float64(0.5374898037194596)}
2024-12-06 23:37:14,673 - INFO - Candidate Std Stats: {'Max': np.float64(1.663756463641251), 'Min': np.float64(0.0), 'Mean': np.float64(0.591184297904389), 'Std': np.float64(0.2957763363269385)}
2024-12-06 23:37:14,684 - INFO - Candidate Mean Stats: {'Max': np.float64(3.151317317788596), 'Min': np.float64(-1.7802401910388297), 'Mean': np.float64(0.3887232557804584), 'Std': np.float64(0.64614053895228)}
2024-12-06 23:37:14,684 - INFO - Candidate Std Stats: {'Max': np.float64(2.2932859649653814), 'Min': np.float64(0.0), 'Mean': np.float64(0.7879194173072097), 'Std': np.float64(0.4079950178043191)}
[I 2024-12-06 23:37:14,687] Trial 200 finished with value: 0.5 and parameters: {'x_0_0': 'bd', 'x_0_1': 'oo', 'x_1_0': 'bc', 'x_1_1': 'ad'}. Best is trial 165 with value: 0.5.
[I 2024-12-06 23:37:14,698] Trial 200 finished with value: 1.0714285714285714 and parameters: {'x_0_0': 'bd', 'x_0_1': 'oo', 'x_1_0': 'ac', 'x_1_1': 'bc'}. Best is trial 76 with value: 0.5.
2024-12-06 23:37:14,701 - INFO - Candidate Mean Stats: {'Max': np.float64(2.5014994397303725), 'Min': np.float64(-0.7853884638427309), 'Mean': np.float64(0.5680930522733048), 'Std': np.float64(0.4754139921329308)}
2024-12-06 23:37:14,701 - INFO - Candidate Std Stats: {'Max': np.float64(1.6172612158522628), 'Min': np.float64(0.0), 'Mean': np.float64(0.5365146257957902), 'Std': np.float64(0.2845719678601116)}
[I 2024-12-06 23:37:14,714] Trial 200 finished with value: 0.7857142857142857 and parameters: {'x_0_0': 'ad', 'x_0_1': 'oo', 'x_1_0': 'bd', 'x_1_1': 'ab'}. Best is trial 63 with value: 0.5.
2024-12-06 23:37:14,806 - INFO - Candidate Mean Stats: {'Max': np.float64(2.829401163330038), 'Min': np.float64(-1.3305830536268957), 'Mean': np.float64(0.4804455770050189), 'Std': np.float64(0.6203702044888181)}
2024-12-06 23:37:14,806 - INFO - Candidate Std Stats: {'Max': np.float64(1.7610206410940077), 'Min': np.float64(0.0), 'Mean': np.float64(0.6325637397393032), 'Std': np.float64(0.3349820486727606)}
[I 2024-12-06 23:37:14,819] Trial 199 finished with value: 1.1964285714285714 and parameters: {'x_0_0': 'bd', 'x_0_1': 'bc', 'x_1_0': 'oo', 'x_1_1': 'oo'}. Best is trial 23 with value: 0.5.
2024-12-06 23:37:15,034 - INFO - Candidate Mean Stats: {'Max': np.float64(2.687301414987112), 'Min': np.float64(-1.0371313935222848), 'Mean': np.float64(0.4603054995464618), 'Std': np.float64(0.5717910447864507)}
2024-12-06 23:37:15,034 - INFO - Candidate Std Stats: {'Max': np.float64(1.5224958386763956), 'Min': np.float64(0.0), 'Mean': np.float64(0.5444873132196287), 'Std': np.float64(0.2729214692657504)}
2024-12-06 23:37:15,042 - INFO - Candidate Mean Stats: {'Max': np.float64(2.921362983607624), 'Min': np.float64(-1.0724504242389927), 'Mean': np.float64(0.5919250977198044), 'Std': np.float64(0.5349592936497656)}
2024-12-06 23:37:15,042 - INFO - Candidate Std Stats: {'Max': np.float64(1.4950145401684778), 'Min': np.float64(0.0), 'Mean': np.float64(0.518096681306777), 'Std': np.float64(0.2721413419095885)}
[I 2024-12-06 23:37:15,048] Trial 201 finished with value: 1.4464285714285714 and parameters: {'x_0_0': 'bd', 'x_0_1': 'cd', 'x_1_0': 'ac', 'x_1_1': 'oo'}. Best is trial 165 with value: 0.5.
[I 2024-12-06 23:37:15,056] Trial 201 finished with value: 1.1607142857142856 and parameters: {'x_0_0': 'ac', 'x_0_1': 'ac', 'x_1_0': 'ab', 'x_1_1': 'oo'}. Best is trial 76 with value: 0.5.
2024-12-06 23:37:15,062 - INFO - Candidate Mean Stats: {'Max': np.float64(2.7071796830259793), 'Min': np.float64(-0.8467322689598428), 'Mean': np.float64(0.5331108378926713), 'Std': np.float64(0.4904211179036578)}
2024-12-06 23:37:15,062 - INFO - Candidate Std Stats: {'Max': np.float64(1.6164201912871936), 'Min': np.float64(0.0), 'Mean': np.float64(0.4692922355339938), 'Std': np.float64(0.2619298891488249)}
[I 2024-12-06 23:37:15,075] Trial 201 finished with value: 1.5 and parameters: {'x_0_0': 'cd', 'x_0_1': 'oo', 'x_1_0': 'bc', 'x_1_1': 'ac'}. Best is trial 63 with value: 0.5.
2024-12-06 23:37:15,167 - INFO - Candidate Mean Stats: {'Max': np.float64(3.096026011790313), 'Min': np.float64(-1.2241431743853513), 'Mean': np.float64(0.45109758411600215), 'Std': np.float64(0.6506725271052477)}
2024-12-06 23:37:15,167 - INFO - Candidate Std Stats: {'Max': np.float64(1.678256712675923), 'Min': np.float64(0.0), 'Mean': np.float64(0.6393996646733024), 'Std': np.float64(0.3181518650705959)}
[I 2024-12-06 23:37:15,180] Trial 200 finished with value: 1.0714285714285714 and parameters: {'x_0_0': 'bc', 'x_0_1': 'oo', 'x_1_0': 'bd', 'x_1_1': 'cd'}. Best is trial 23 with value: 0.5.
2024-12-06 23:37:15,393 - INFO - Candidate Mean Stats: {'Max': np.float64(2.819526394222785), 'Min': np.float64(-0.8167409523305851), 'Mean': np.float64(0.5748503776183381), 'Std': np.float64(0.5053108821189657)}
2024-12-06 23:37:15,393 - INFO - Candidate Std Stats: {'Max': np.float64(1.668587212106471), 'Min': np.float64(0.0), 'Mean': np.float64(0.5451759680536852), 'Std': np.float64(0.2741011415356826)}
2024-12-06 23:37:15,402 - INFO - Candidate Mean Stats: {'Max': np.float64(2.9723501413417237), 'Min': np.float64(-1.2059866790560272), 'Mean': np.float64(0.46721886857434997), 'Std': np.float64(0.5550711080617062)}
2024-12-06 23:37:15,402 - INFO - Candidate Std Stats: {'Max': np.float64(1.795798266200601), 'Min': np.float64(0.0), 'Mean': np.float64(0.6375770238083915), 'Std': np.float64(0.3271014841565956)}
[I 2024-12-06 23:37:15,406] Trial 202 finished with value: 0.7857142857142857 and parameters: {'x_0_0': 'bd', 'x_0_1': 'oo', 'x_1_0': 'bc', 'x_1_1': 'bc'}. Best is trial 165 with value: 0.5.
[I 2024-12-06 23:37:15,415] Trial 202 finished with value: 1.0714285714285714 and parameters: {'x_0_0': 'ac', 'x_0_1': 'oo', 'x_1_0': 'ac', 'x_1_1': 'bd'}. Best is trial 76 with value: 0.5.
2024-12-06 23:37:15,420 - INFO - Candidate Mean Stats: {'Max': np.float64(2.757933248306082), 'Min': np.float64(-1.0917771764613857), 'Mean': np.float64(0.5001036021390762), 'Std': np.float64(0.512257949494283)}
2024-12-06 23:37:15,420 - INFO - Candidate Std Stats: {'Max': np.float64(2.1730488591901156), 'Min': np.float64(0.0), 'Mean': np.float64(0.5341489926268996), 'Std': np.float64(0.286048488772239)}
[I 2024-12-06 23:37:15,433] Trial 202 finished with value: 1.2142857142857144 and parameters: {'x_0_0': 'ab', 'x_0_1': 'oo', 'x_1_0': 'bc', 'x_1_1': 'ab'}. Best is trial 63 with value: 0.5.
2024-12-06 23:37:15,528 - INFO - Candidate Mean Stats: {'Max': np.float64(3.165368405611108), 'Min': np.float64(-1.2001858550411746), 'Mean': np.float64(0.4297249833920813), 'Std': np.float64(0.5855258729590743)}
2024-12-06 23:37:15,530 - INFO - Candidate Std Stats: {'Max': np.float64(1.9077932437464304), 'Min': np.float64(0.0), 'Mean': np.float64(0.6137704167183522), 'Std': np.float64(0.32195009491521176)}
[I 2024-12-06 23:37:15,543] Trial 201 finished with value: 1.0714285714285714 and parameters: {'x_0_0': 'ad', 'x_0_1': 'oo', 'x_1_0': 'ac', 'x_1_1': 'ad'}. Best is trial 23 with value: 0.5.
2024-12-06 23:37:15,753 - INFO - Candidate Mean Stats: {'Max': np.float64(2.919654270433548), 'Min': np.float64(-0.8139111527800121), 'Mean': np.float64(0.5575844767414071), 'Std': np.float64(0.5119537662336993)}
2024-12-06 23:37:15,753 - INFO - Candidate Std Stats: {'Max': np.float64(1.6537511436193075), 'Min': np.float64(0.0), 'Mean': np.float64(0.572353290185182), 'Std': np.float64(0.2951496588460597)}
2024-12-06 23:37:15,761 - INFO - Candidate Mean Stats: {'Max': np.float64(2.88487521389656), 'Min': np.float64(-1.0180996281669554), 'Mean': np.float64(0.5191024426245571), 'Std': np.float64(0.5876056086045498)}
2024-12-06 23:37:15,761 - INFO - Candidate Std Stats: {'Max': np.float64(1.7278624419867483), 'Min': np.float64(0.0), 'Mean': np.float64(0.5660283671534593), 'Std': np.float64(0.2852517749438495)}
[I 2024-12-06 23:37:15,767] Trial 203 finished with value: 1.0714285714285714 and parameters: {'x_0_0': 'bd', 'x_0_1': 'oo', 'x_1_0': 'ac', 'x_1_1': 'ab'}. Best is trial 165 with value: 0.5.
[I 2024-12-06 23:37:15,774] Trial 203 finished with value: 1.0357142857142856 and parameters: {'x_0_0': 'ac', 'x_0_1': 'ac', 'x_1_0': 'oo', 'x_1_1': 'cd'}. Best is trial 76 with value: 0.5.
2024-12-06 23:37:15,782 - INFO - Candidate Mean Stats: {'Max': np.float64(2.4950206321618396), 'Min': np.float64(-0.7614949704101811), 'Mean': np.float64(0.5634231684497114), 'Std': np.float64(0.4902736649388526)}
2024-12-06 23:37:15,782 - INFO - Candidate Std Stats: {'Max': np.float64(1.502625966681888), 'Min': np.float64(0.0), 'Mean': np.float64(0.5102433289909869), 'Std': np.float64(0.2657359686352768)}
[I 2024-12-06 23:37:15,795] Trial 203 finished with value: 1.0714285714285714 and parameters: {'x_0_0': 'ac', 'x_0_1': 'oo', 'x_1_0': 'bd', 'x_1_1': 'ab'}. Best is trial 63 with value: 0.5.
2024-12-06 23:37:15,889 - INFO - Candidate Mean Stats: {'Max': np.float64(2.7390409435074674), 'Min': np.float64(-1.3693475408250015), 'Mean': np.float64(0.3568439773424238), 'Std': np.float64(0.669957394837358)}
2024-12-06 23:37:15,890 - INFO - Candidate Std Stats: {'Max': np.float64(2.191795922266039), 'Min': np.float64(0.0), 'Mean': np.float64(0.6697297392620175), 'Std': np.float64(0.3421071166651071)}
[I 2024-12-06 23:37:15,902] Trial 202 finished with value: 0.9642857142857143 and parameters: {'x_0_0': 'ab', 'x_0_1': 'oo', 'x_1_0': 'oo', 'x_1_1': 'ad'}. Best is trial 23 with value: 0.5.
2024-12-06 23:37:16,113 - INFO - Candidate Mean Stats: {'Max': np.float64(2.684726991481213), 'Min': np.float64(-0.9306691835802358), 'Mean': np.float64(0.5657044533367631), 'Std': np.float64(0.4721591000413203)}
2024-12-06 23:37:16,114 - INFO - Candidate Std Stats: {'Max': np.float64(1.5931105677267385), 'Min': np.float64(0.0), 'Mean': np.float64(0.4957317094296548), 'Std': np.float64(0.27135177669078775)}
2024-12-06 23:37:16,121 - INFO - Candidate Mean Stats: {'Max': np.float64(3.638363061427266), 'Min': np.float64(-1.3847750186504872), 'Mean': np.float64(0.5229820925112215), 'Std': np.float64(0.6257042830035588)}
2024-12-06 23:37:16,121 - INFO - Candidate Std Stats: {'Max': np.float64(1.595878292020581), 'Min': np.float64(0.0), 'Mean': np.float64(0.606833203445331), 'Std': np.float64(0.3040659510790663)}
[I 2024-12-06 23:37:16,128] Trial 204 finished with value: 0.9464285714285714 and parameters: {'x_0_0': 'ac', 'x_0_1': 'oo', 'x_1_0': 'cd', 'x_1_1': 'oo'}. Best is trial 165 with value: 0.5.
[I 2024-12-06 23:37:16,135] Trial 204 finished with value: 1.0714285714285714 and parameters: {'x_0_0': 'bd', 'x_0_1': 'oo', 'x_1_0': 'ac', 'x_1_1': 'ad'}. Best is trial 76 with value: 0.5.
2024-12-06 23:37:16,142 - INFO - Candidate Mean Stats: {'Max': np.float64(2.4723341563826646), 'Min': np.float64(-1.2629535802846026), 'Mean': np.float64(0.44976361081851984), 'Std': np.float64(0.633834872359284)}
2024-12-06 23:37:16,142 - INFO - Candidate Std Stats: {'Max': np.float64(1.5909355888562624), 'Min': np.float64(0.0), 'Mean': np.float64(0.5813053192046803), 'Std': np.float64(0.2972357770161192)}
[I 2024-12-06 23:37:16,155] Trial 204 finished with value: 1.2142857142857144 and parameters: {'x_0_0': 'ab', 'x_0_1': 'oo', 'x_1_0': 'ad', 'x_1_1': 'ad'}. Best is trial 63 with value: 0.5.
2024-12-06 23:37:16,250 - INFO - Candidate Mean Stats: {'Max': np.float64(2.973787165907315), 'Min': np.float64(-1.1478078723188647), 'Mean': np.float64(0.3763817048693274), 'Std': np.float64(0.6039411678228328)}
2024-12-06 23:37:16,250 - INFO - Candidate Std Stats: {'Max': np.float64(1.9339112118828434), 'Min': np.float64(0.0), 'Mean': np.float64(0.6685713141324843), 'Std': np.float64(0.33758280114459077)}
[I 2024-12-06 23:37:16,263] Trial 203 finished with value: 1.3214285714285714 and parameters: {'x_0_0': 'bd', 'x_0_1': 'ad', 'x_1_0': 'oo', 'x_1_1': 'bc'}. Best is trial 23 with value: 0.5.
2024-12-06 23:37:16,474 - INFO - Candidate Mean Stats: {'Max': np.float64(2.6351373938862954), 'Min': np.float64(-0.9706674354207852), 'Mean': np.float64(0.526303622772182), 'Std': np.float64(0.5428104544006803)}
2024-12-06 23:37:16,474 - INFO - Candidate Std Stats: {'Max': np.float64(1.6262482934449751), 'Min': np.float64(0.0), 'Mean': np.float64(0.6088316396969143), 'Std': np.float64(0.3056039210675046)}
2024-12-06 23:37:16,482 - INFO - Candidate Mean Stats: {'Max': np.float64(3.0916112789257952), 'Min': np.float64(-1.399449809014858), 'Mean': np.float64(0.41672367828364876), 'Std': np.float64(0.6347257530059349)}
2024-12-06 23:37:16,482 - INFO - Candidate Std Stats: {'Max': np.float64(1.6903619611639211), 'Min': np.float64(0.0), 'Mean': np.float64(0.640797533707805), 'Std': np.float64(0.32223529944211343)}
[I 2024-12-06 23:37:16,488] Trial 205 finished with value: 1.0714285714285714 and parameters: {'x_0_0': 'ac', 'x_0_1': 'oo', 'x_1_0': 'ac', 'x_1_1': 'bc'}. Best is trial 165 with value: 0.5.
[I 2024-12-06 23:37:16,495] Trial 205 finished with value: 1.0714285714285714 and parameters: {'x_0_0': 'bd', 'x_0_1': 'oo', 'x_1_0': 'cd', 'x_1_1': 'ad'}. Best is trial 76 with value: 0.5.
2024-12-06 23:37:16,501 - INFO - Candidate Mean Stats: {'Max': np.float64(2.8616017359816897), 'Min': np.float64(-0.9944509759432947), 'Mean': np.float64(0.5148430346386008), 'Std': np.float64(0.4720271967032949)}
2024-12-06 23:37:16,501 - INFO - Candidate Std Stats: {'Max': np.float64(1.890111903803076), 'Min': np.float64(0.0), 'Mean': np.float64(0.5265214704199428), 'Std': np.float64(0.28186001181602466)}
[I 2024-12-06 23:37:16,514] Trial 205 finished with value: 1.0714285714285714 and parameters: {'x_0_0': 'bc', 'x_0_1': 'oo', 'x_1_0': 'bd', 'x_1_1': 'ab'}. Best is trial 63 with value: 0.5.
2024-12-06 23:37:16,610 - INFO - Candidate Mean Stats: {'Max': np.float64(3.167401859442262), 'Min': np.float64(-1.0040072480035882), 'Mean': np.float64(0.513829674832039), 'Std': np.float64(0.5466899101703067)}
2024-12-06 23:37:16,611 - INFO - Candidate Std Stats: {'Max': np.float64(1.6857759262571643), 'Min': np.float64(0.0), 'Mean': np.float64(0.5995126765293393), 'Std': np.float64(0.30322544578548805)}
