[I 2024-12-07 01:18:00,676] Trial 264 finished with value: 1.6666666666666665 and parameters: {'x_0_0': 'ad', 'x_0_1': 'cd', 'x_0_2': 'cd', 'x_1_0': 'ad', 'x_1_1': 'bd', 'x_1_2': 'cd'}. Best is trial 74 with value: 0.8222222222222222.
2024-12-07 01:18:07,829 - INFO - Candidate Mean Stats: {'Max': np.float64(2.0), 'Min': np.float64(0.15795038524929123), 'Mean': np.float64(0.49007943996129144), 'Std': np.float64(0.07741117059380097)}
2024-12-07 01:18:07,830 - INFO - Candidate Std Stats: {'Max': np.float64(0.3819835830409612), 'Min': np.float64(0.0), 'Mean': np.float64(0.10144174874555884), 'Std': np.float64(0.04254739706018299)}
[I 2024-12-07 01:18:07,875] Trial 265 finished with value: 1.3444444444444446 and parameters: {'x_0_0': 'bc', 'x_0_1': 'ad', 'x_0_2': 'bc', 'x_1_0': 'cd', 'x_1_1': 'ac', 'x_1_2': 'oo'}. Best is trial 49 with value: 0.7999999999999999.
2024-12-07 01:18:16,188 - INFO - Candidate Mean Stats: {'Max': np.float64(2.0), 'Min': np.float64(0.2397385638901488), 'Mean': np.float64(0.4895315064590599), 'Std': np.float64(0.07816370010620814)}
2024-12-07 01:18:16,189 - INFO - Candidate Std Stats: {'Max': np.float64(0.5965089793557155), 'Min': np.float64(0.0), 'Mean': np.float64(0.11083282702311148), 'Std': np.float64(0.04781037230058179)}
[I 2024-12-07 01:18:16,231] Trial 265 finished with value: 1.6666666666666665 and parameters: {'x_0_0': 'bd', 'x_0_1': 'ab', 'x_0_2': 'bd', 'x_1_0': 'ad', 'x_1_1': 'bd', 'x_1_2': 'ad'}. Best is trial 200 with value: 0.6.
2024-12-07 01:18:17,173 - INFO - Candidate Mean Stats: {'Max': np.float64(2.0), 'Min': np.float64(0.2850317160020141), 'Mean': np.float64(0.4883514074160202), 'Std': np.float64(0.07581170744297908)}
2024-12-07 01:18:17,174 - INFO - Candidate Std Stats: {'Max': np.float64(1.342259108195724), 'Min': np.float64(0.0), 'Mean': np.float64(0.09799399455013323), 'Std': np.float64(0.04947628861276892)}
[I 2024-12-07 01:18:17,218] Trial 266 finished with value: 1.5555555555555556 and parameters: {'x_0_0': 'ad', 'x_0_1': 'ad', 'x_0_2': 'ac', 'x_1_0': 'ab', 'x_1_1': 'ac', 'x_1_2': 'cd'}. Best is trial 148 with value: 0.8333333333333333.
2024-12-07 01:18:21,383 - INFO - Candidate Mean Stats: {'Max': np.float64(2.0), 'Min': np.float64(0.23459290421829876), 'Mean': np.float64(0.4926911269380042), 'Std': np.float64(0.07332717080860313)}
2024-12-07 01:18:21,383 - INFO - Candidate Std Stats: {'Max': np.float64(0.3892178267320107), 'Min': np.float64(0.0), 'Mean': np.float64(0.0975380830969276), 'Std': np.float64(0.04011060107180121)}
[I 2024-12-07 01:18:21,426] Trial 265 finished with value: 1.2666666666666666 and parameters: {'x_0_0': 'ad', 'x_0_1': 'oo', 'x_0_2': 'ac', 'x_1_0': 'ad', 'x_1_1': 'bc', 'x_1_2': 'ab'}. Best is trial 74 with value: 0.8222222222222222.
2024-12-07 01:18:28,216 - INFO - Candidate Mean Stats: {'Max': np.float64(2.0), 'Min': np.float64(0.21945600464393059), 'Mean': np.float64(0.4968434232661603), 'Std': np.float64(0.07984429666529644)}
2024-12-07 01:18:28,218 - INFO - Candidate Std Stats: {'Max': np.float64(0.5121090058961718), 'Min': np.float64(0.0), 'Mean': np.float64(0.10898640131049625), 'Std': np.float64(0.047088885914509986)}
[I 2024-12-07 01:18:28,265] Trial 266 finished with value: 1.5666666666666667 and parameters: {'x_0_0': 'ac', 'x_0_1': 'cd', 'x_0_2': 'ad', 'x_1_0': 'ad', 'x_1_1': 'oo', 'x_1_2': 'bd'}. Best is trial 49 with value: 0.7999999999999999.
2024-12-07 01:18:36,687 - INFO - Candidate Mean Stats: {'Max': np.float64(2.0), 'Min': np.float64(0.23295243381175085), 'Mean': np.float64(0.49468488091389595), 'Std': np.float64(0.07895800872168499)}
2024-12-07 01:18:36,689 - INFO - Candidate Std Stats: {'Max': np.float64(0.7053527035792778), 'Min': np.float64(0.0), 'Mean': np.float64(0.11172958575665426), 'Std': np.float64(0.051069211698939763)}
[I 2024-12-07 01:18:36,734] Trial 266 finished with value: 1.4666666666666666 and parameters: {'x_0_0': 'bc', 'x_0_1': 'bd', 'x_0_2': 'ac', 'x_1_0': 'oo', 'x_1_1': 'bd', 'x_1_2': 'ad'}. Best is trial 200 with value: 0.6.
2024-12-07 01:18:37,433 - INFO - Candidate Mean Stats: {'Max': np.float64(2.0), 'Min': np.float64(0.2391223310036493), 'Mean': np.float64(0.4920718451686064), 'Std': np.float64(0.08148839527900426)}
2024-12-07 01:18:37,433 - INFO - Candidate Std Stats: {'Max': np.float64(0.5610815540891323), 'Min': np.float64(0.0), 'Mean': np.float64(0.10110227375680482), 'Std': np.float64(0.04290417141893774)}
[I 2024-12-07 01:18:37,478] Trial 267 finished with value: 1.6666666666666665 and parameters: {'x_0_0': 'bd', 'x_0_1': 'cd', 'x_0_2': 'bd', 'x_1_0': 'ac', 'x_1_1': 'ac', 'x_1_2': 'ab'}. Best is trial 148 with value: 0.8333333333333333.
2024-12-07 01:18:41,958 - INFO - Candidate Mean Stats: {'Max': np.float64(2.0), 'Min': np.float64(0.25153073010935506), 'Mean': np.float64(0.4901728437450641), 'Std': np.float64(0.07462768974828159)}
2024-12-07 01:18:41,958 - INFO - Candidate Std Stats: {'Max': np.float64(0.4978971829355349), 'Min': np.float64(0.0), 'Mean': np.float64(0.10166431260957443), 'Std': np.float64(0.041969003219882624)}
[I 2024-12-07 01:18:42,003] Trial 266 finished with value: 1.2666666666666666 and parameters: {'x_0_0': 'ac', 'x_0_1': 'oo', 'x_0_2': 'bc', 'x_1_0': 'ad', 'x_1_1': 'bd', 'x_1_2': 'ab'}. Best is trial 74 with value: 0.8222222222222222.
2024-12-07 01:18:48,844 - INFO - Candidate Mean Stats: {'Max': np.float64(2.0), 'Min': np.float64(0.2205376192965664), 'Mean': np.float64(0.48703302725978287), 'Std': np.float64(0.08561087514855319)}
2024-12-07 01:18:48,845 - INFO - Candidate Std Stats: {'Max': np.float64(1.2567302158599807), 'Min': np.float64(0.0), 'Mean': np.float64(0.11679901655521667), 'Std': np.float64(0.062057542794835906)}
[I 2024-12-07 01:18:48,889] Trial 267 finished with value: 1.3666666666666667 and parameters: {'x_0_0': 'bd', 'x_0_1': 'ad', 'x_0_2': 'oo', 'x_1_0': 'cd', 'x_1_1': 'oo', 'x_1_2': 'oo'}. Best is trial 49 with value: 0.7999999999999999.
2024-12-07 01:18:57,216 - INFO - Candidate Mean Stats: {'Max': np.float64(2.0), 'Min': np.float64(0.2758942481169124), 'Mean': np.float64(0.4843760183823851), 'Std': np.float64(0.07570102928429345)}
2024-12-07 01:18:57,216 - INFO - Candidate Std Stats: {'Max': np.float64(0.4758864561309656), 'Min': np.float64(0.0), 'Mean': np.float64(0.09577305894695565), 'Std': np.float64(0.041903917014796094)}
[I 2024-12-07 01:18:57,262] Trial 267 finished with value: 1.4666666666666666 and parameters: {'x_0_0': 'ad', 'x_0_1': 'ac', 'x_0_2': 'oo', 'x_1_0': 'cd', 'x_1_1': 'ad', 'x_1_2': 'oo'}. Best is trial 200 with value: 0.6.
2024-12-07 01:18:57,932 - INFO - Candidate Mean Stats: {'Max': np.float64(2.0), 'Min': np.float64(0.2660732422462181), 'Mean': np.float64(0.48687650597119075), 'Std': np.float64(0.0773502420324804)}
2024-12-07 01:18:57,933 - INFO - Candidate Std Stats: {'Max': np.float64(0.9652699169461424), 'Min': np.float64(0.0), 'Mean': np.float64(0.09382087404514748), 'Std': np.float64(0.04400479607234352)}
[I 2024-12-07 01:18:57,975] Trial 268 finished with value: 1.0444444444444443 and parameters: {'x_0_0': 'bc', 'x_0_1': 'ad', 'x_0_2': 'oo', 'x_1_0': 'oo', 'x_1_1': 'oo', 'x_1_2': 'cd'}. Best is trial 148 with value: 0.8333333333333333.
2024-12-07 01:19:01,859 - INFO - Candidate Mean Stats: {'Max': np.float64(2.0), 'Min': np.float64(0.22413265158794715), 'Mean': np.float64(0.4972659185581192), 'Std': np.float64(0.07540097145158574)}
2024-12-07 01:19:01,860 - INFO - Candidate Std Stats: {'Max': np.float64(1.200913700190148), 'Min': np.float64(0.0), 'Mean': np.float64(0.10246362628164954), 'Std': np.float64(0.050402687085053535)}
[I 2024-12-07 01:19:01,903] Trial 267 finished with value: 1.2555555555555555 and parameters: {'x_0_0': 'ac', 'x_0_1': 'ab', 'x_0_2': 'oo', 'x_1_0': 'ad', 'x_1_1': 'oo', 'x_1_2': 'oo'}. Best is trial 74 with value: 0.8222222222222222.
2024-12-07 01:19:09,180 - INFO - Candidate Mean Stats: {'Max': np.float64(2.0), 'Min': np.float64(0.22778538136125412), 'Mean': np.float64(0.4776629764633236), 'Std': np.float64(0.078234864885079)}
2024-12-07 01:19:09,181 - INFO - Candidate Std Stats: {'Max': np.float64(0.9145471931562388), 'Min': np.float64(0.0), 'Mean': np.float64(0.10796272520204682), 'Std': np.float64(0.04682283777737321)}
[I 2024-12-07 01:19:09,227] Trial 268 finished with value: 1.1444444444444444 and parameters: {'x_0_0': 'bc', 'x_0_1': 'ad', 'x_0_2': 'oo', 'x_1_0': 'oo', 'x_1_1': 'cd', 'x_1_2': 'cd'}. Best is trial 49 with value: 0.7999999999999999.
2024-12-07 01:19:17,490 - INFO - Candidate Mean Stats: {'Max': np.float64(2.0), 'Min': np.float64(0.26623293223858246), 'Mean': np.float64(0.489341738828581), 'Std': np.float64(0.07770188496321369)}
2024-12-07 01:19:17,490 - INFO - Candidate Std Stats: {'Max': np.float64(0.4306907461751738), 'Min': np.float64(0.0), 'Mean': np.float64(0.09560917027022822), 'Std': np.float64(0.04217168370058701)}
[I 2024-12-07 01:19:17,534] Trial 268 finished with value: 1.5 and parameters: {'x_0_0': 'oo', 'x_0_1': 'oo', 'x_0_2': 'ab', 'x_1_0': 'bc', 'x_1_1': 'ac', 'x_1_2': 'ac'}. Best is trial 200 with value: 0.6.
2024-12-07 01:19:18,417 - INFO - Candidate Mean Stats: {'Max': np.float64(2.0), 'Min': np.float64(0.20639938795748133), 'Mean': np.float64(0.49005692766022263), 'Std': np.float64(0.08688430746915501)}
2024-12-07 01:19:18,418 - INFO - Candidate Std Stats: {'Max': np.float64(1.309714489218555), 'Min': np.float64(0.0), 'Mean': np.float64(0.11561176096950443), 'Std': np.float64(0.06120790825814293)}
[I 2024-12-07 01:19:18,459] Trial 269 finished with value: 1.0222222222222221 and parameters: {'x_0_0': 'ac', 'x_0_1': 'ad', 'x_0_2': 'ac', 'x_1_0': 'oo', 'x_1_1': 'bc', 'x_1_2': 'bd'}. Best is trial 148 with value: 0.8333333333333333.
2024-12-07 01:19:22,352 - INFO - Candidate Mean Stats: {'Max': np.float64(2.0), 'Min': np.float64(0.22639946424568164), 'Mean': np.float64(0.4840211870491653), 'Std': np.float64(0.07753673524720757)}
2024-12-07 01:19:22,353 - INFO - Candidate Std Stats: {'Max': np.float64(0.5917277342025191), 'Min': np.float64(0.0), 'Mean': np.float64(0.099732326206994), 'Std': np.float64(0.04087258645848405)}
[I 2024-12-07 01:19:22,397] Trial 268 finished with value: 1.4444444444444444 and parameters: {'x_0_0': 'ac', 'x_0_1': 'ac', 'x_0_2': 'cd', 'x_1_0': 'ab', 'x_1_1': 'bd', 'x_1_2': 'ad'}. Best is trial 74 with value: 0.8222222222222222.
2024-12-07 01:19:29,805 - INFO - Candidate Mean Stats: {'Max': np.float64(2.0), 'Min': np.float64(0.26448349610137817), 'Mean': np.float64(0.4883624666751923), 'Std': np.float64(0.07541698414864997)}
2024-12-07 01:19:29,806 - INFO - Candidate Std Stats: {'Max': np.float64(0.4391858883279083), 'Min': np.float64(0.0), 'Mean': np.float64(0.10055530886614165), 'Std': np.float64(0.04180856595822447)}
[I 2024-12-07 01:19:29,851] Trial 269 finished with value: 1.5555555555555556 and parameters: {'x_0_0': 'bc', 'x_0_1': 'ab', 'x_0_2': 'ab', 'x_1_0': 'bc', 'x_1_1': 'ac', 'x_1_2': 'ab'}. Best is trial 49 with value: 0.7999999999999999.
2024-12-07 01:19:37,957 - INFO - Candidate Mean Stats: {'Max': np.float64(2.0), 'Min': np.float64(0.24989822866074834), 'Mean': np.float64(0.4886237767034579), 'Std': np.float64(0.07540073784060364)}
2024-12-07 01:19:37,957 - INFO - Candidate Std Stats: {'Max': np.float64(0.42970354638905334), 'Min': np.float64(0.0), 'Mean': np.float64(0.09769607997974795), 'Std': np.float64(0.04167299960742012)}
[I 2024-12-07 01:19:38,001] Trial 269 finished with value: 1.2777777777777777 and parameters: {'x_0_0': 'ab', 'x_0_1': 'oo', 'x_0_2': 'bd', 'x_1_0': 'cd', 'x_1_1': 'oo', 'x_1_2': 'ab'}. Best is trial 200 with value: 0.6.
2024-12-07 01:19:38,863 - INFO - Candidate Mean Stats: {'Max': np.float64(2.0), 'Min': np.float64(0.2746778864800127), 'Mean': np.float64(0.4952645544892104), 'Std': np.float64(0.07615727043978665)}
2024-12-07 01:19:38,863 - INFO - Candidate Std Stats: {'Max': np.float64(0.5277875658742323), 'Min': np.float64(0.0), 'Mean': np.float64(0.10780561360054519), 'Std': np.float64(0.04398467364916063)}
[I 2024-12-07 01:19:38,921] Trial 270 finished with value: 1.4666666666666666 and parameters: {'x_0_0': 'ac', 'x_0_1': 'bd', 'x_0_2': 'ab', 'x_1_0': 'oo', 'x_1_1': 'ac', 'x_1_2': 'ab'}. Best is trial 148 with value: 0.8333333333333333.
2024-12-07 01:19:43,117 - INFO - Candidate Mean Stats: {'Max': np.float64(2.0), 'Min': np.float64(0.26752115528994314), 'Mean': np.float64(0.49273365881551057), 'Std': np.float64(0.07245950276272257)}
2024-12-07 01:19:43,117 - INFO - Candidate Std Stats: {'Max': np.float64(0.9595306984005976), 'Min': np.float64(0.0), 'Mean': np.float64(0.09649554958623402), 'Std': np.float64(0.043692646388605906)}
[I 2024-12-07 01:19:43,158] Trial 269 finished with value: 0.9666666666666667 and parameters: {'x_0_0': 'ad', 'x_0_1': 'oo', 'x_0_2': 'oo', 'x_1_0': 'oo', 'x_1_1': 'bd', 'x_1_2': 'bc'}. Best is trial 74 with value: 0.8222222222222222.
2024-12-07 01:19:50,112 - INFO - Candidate Mean Stats: {'Max': np.float64(2.0), 'Min': np.float64(0.20522866332022374), 'Mean': np.float64(0.4867057063700046), 'Std': np.float64(0.08039697998404956)}
2024-12-07 01:19:50,112 - INFO - Candidate Std Stats: {'Max': np.float64(0.4623218086946225), 'Min': np.float64(0.0), 'Mean': np.float64(0.09888267973971948), 'Std': np.float64(0.04464346271621596)}
[I 2024-12-07 01:19:50,158] Trial 270 finished with value: 1.2666666666666666 and parameters: {'x_0_0': 'bc', 'x_0_1': 'oo', 'x_0_2': 'bd', 'x_1_0': 'bd', 'x_1_1': 'ad', 'x_1_2': 'ab'}. Best is trial 49 with value: 0.7999999999999999.
2024-12-07 01:19:58,440 - INFO - Candidate Mean Stats: {'Max': np.float64(2.0), 'Min': np.float64(0.24101241711444374), 'Mean': np.float64(0.4922252753507286), 'Std': np.float64(0.07938501417805145)}
2024-12-07 01:19:58,440 - INFO - Candidate Std Stats: {'Max': np.float64(1.1453168048730202), 'Min': np.float64(0.0), 'Mean': np.float64(0.1094833080536507), 'Std': np.float64(0.05610895485598068)}
[I 2024-12-07 01:19:58,485] Trial 270 finished with value: 1.4444444444444444 and parameters: {'x_0_0': 'bd', 'x_0_1': 'bd', 'x_0_2': 'ad', 'x_1_0': 'bc', 'x_1_1': 'bc', 'x_1_2': 'bd'}. Best is trial 200 with value: 0.6.
2024-12-07 01:19:59,524 - INFO - Candidate Mean Stats: {'Max': np.float64(2.0), 'Min': np.float64(0.17031660435532647), 'Mean': np.float64(0.4908833350467495), 'Std': np.float64(0.08294146665543642)}
2024-12-07 01:19:59,531 - INFO - Candidate Std Stats: {'Max': np.float64(0.44941024863774753), 'Min': np.float64(0.0), 'Mean': np.float64(0.11172092100161601), 'Std': np.float64(0.04888973158335129)}
[I 2024-12-07 01:19:59,576] Trial 271 finished with value: 1.2333333333333332 and parameters: {'x_0_0': 'ac', 'x_0_1': 'ad', 'x_0_2': 'oo', 'x_1_0': 'bc', 'x_1_1': 'ab', 'x_1_2': 'cd'}. Best is trial 148 with value: 0.8333333333333333.
2024-12-07 01:20:04,070 - INFO - Candidate Mean Stats: {'Max': np.float64(2.0), 'Min': np.float64(0.29892491561671064), 'Mean': np.float64(0.48959940994346735), 'Std': np.float64(0.07043158362389705)}
2024-12-07 01:20:04,070 - INFO - Candidate Std Stats: {'Max': np.float64(0.6093442063773583), 'Min': np.float64(0.0), 'Mean': np.float64(0.0959434002485311), 'Std': np.float64(0.04003317984940639)}
[I 2024-12-07 01:20:04,120] Trial 270 finished with value: 0.9666666666666667 and parameters: {'x_0_0': 'bc', 'x_0_1': 'oo', 'x_0_2': 'bd', 'x_1_0': 'oo', 'x_1_1': 'oo', 'x_1_2': 'bc'}. Best is trial 74 with value: 0.8222222222222222.
2024-12-07 01:20:11,128 - INFO - Candidate Mean Stats: {'Max': np.float64(2.0), 'Min': np.float64(0.279951278025956), 'Mean': np.float64(0.49214432126048757), 'Std': np.float64(0.07125052119358094)}
2024-12-07 01:20:11,129 - INFO - Candidate Std Stats: {'Max': np.float64(0.695083354863138), 'Min': np.float64(0.0), 'Mean': np.float64(0.09555085969314983), 'Std': np.float64(0.042835370065700776)}
[I 2024-12-07 01:20:11,173] Trial 271 finished with value: 1.2666666666666666 and parameters: {'x_0_0': 'ad', 'x_0_1': 'oo', 'x_0_2': 'ab', 'x_1_0': 'ad', 'x_1_1': 'cd', 'x_1_2': 'ad'}. Best is trial 49 with value: 0.7999999999999999.
2024-12-07 01:20:19,594 - INFO - Candidate Mean Stats: {'Max': np.float64(2.0), 'Min': np.float64(0.32065405118675466), 'Mean': np.float64(0.5007198754297948), 'Std': np.float64(0.07163720994314449)}
2024-12-07 01:20:19,595 - INFO - Candidate Std Stats: {'Max': np.float64(0.4809712076966453), 'Min': np.float64(0.0), 'Mean': np.float64(0.09972351176391905), 'Std': np.float64(0.041121319741233654)}
[I 2024-12-07 01:20:19,640] Trial 271 finished with value: 1.2444444444444445 and parameters: {'x_0_0': 'bd', 'x_0_1': 'cd', 'x_0_2': 'oo', 'x_1_0': 'bc', 'x_1_1': 'oo', 'x_1_2': 'ab'}. Best is trial 200 with value: 0.6.
2024-12-07 01:20:20,539 - INFO - Candidate Mean Stats: {'Max': np.float64(2.0), 'Min': np.float64(0.31491179532116925), 'Mean': np.float64(0.4947472226611514), 'Std': np.float64(0.07721983666080766)}
2024-12-07 01:20:20,539 - INFO - Candidate Std Stats: {'Max': np.float64(1.0098050093579856), 'Min': np.float64(0.0), 'Mean': np.float64(0.10035884875889355), 'Std': np.float64(0.04788872707130236)}
[I 2024-12-07 01:20:20,584] Trial 272 finished with value: 1.4555555555555557 and parameters: {'x_0_0': 'bc', 'x_0_1': 'ab', 'x_0_2': 'cd', 'x_1_0': 'bd', 'x_1_1': 'ad', 'x_1_2': 'oo'}. Best is trial 148 with value: 0.8333333333333333.
2024-12-07 01:20:25,039 - INFO - Candidate Mean Stats: {'Max': np.float64(2.0), 'Min': np.float64(0.2173130955127025), 'Mean': np.float64(0.4814091590239429), 'Std': np.float64(0.07407153790301481)}
2024-12-07 01:20:25,040 - INFO - Candidate Std Stats: {'Max': np.float64(0.9097908090117705), 'Min': np.float64(0.0), 'Mean': np.float64(0.11169119976697088), 'Std': np.float64(0.052136617122892685)}
[I 2024-12-07 01:20:25,086] Trial 271 finished with value: 0.8222222222222222 and parameters: {'x_0_0': 'bd', 'x_0_1': 'oo', 'x_0_2': 'ad', 'x_1_0': 'bc', 'x_1_1': 'ac', 'x_1_2': 'bc'}. Best is trial 74 with value: 0.8222222222222222.
2024-12-07 01:20:32,092 - INFO - Candidate Mean Stats: {'Max': np.float64(2.0), 'Min': np.float64(0.2072837460005899), 'Mean': np.float64(0.4891397095210079), 'Std': np.float64(0.07651310311299457)}
2024-12-07 01:20:32,092 - INFO - Candidate Std Stats: {'Max': np.float64(0.9166807570277652), 'Min': np.float64(0.0), 'Mean': np.float64(0.09927382003317373), 'Std': np.float64(0.04666206855693428)}
[I 2024-12-07 01:20:32,138] Trial 272 finished with value: 1.3777777777777778 and parameters: {'x_0_0': 'ab', 'x_0_1': 'ad', 'x_0_2': 'oo', 'x_1_0': 'oo', 'x_1_1': 'oo', 'x_1_2': 'cd'}. Best is trial 49 with value: 0.7999999999999999.
2024-12-07 01:20:40,379 - INFO - Candidate Mean Stats: {'Max': np.float64(2.0), 'Min': np.float64(0.18532231738395105), 'Mean': np.float64(0.4814699770231869), 'Std': np.float64(0.08154919444315399)}
2024-12-07 01:20:40,380 - INFO - Candidate Std Stats: {'Max': np.float64(1.6360056875723539), 'Min': np.float64(0.0), 'Mean': np.float64(0.10587601235550755), 'Std': np.float64(0.05886783932976079)}
[I 2024-12-07 01:20:40,424] Trial 272 finished with value: 1.7999999999999998 and parameters: {'x_0_0': 'oo', 'x_0_1': 'cd', 'x_0_2': 'ab', 'x_1_0': 'ad', 'x_1_1': 'ab', 'x_1_2': 'oo'}. Best is trial 200 with value: 0.6.
2024-12-07 01:20:40,979 - INFO - Candidate Mean Stats: {'Max': np.float64(2.0), 'Min': np.float64(0.2274144997419305), 'Mean': np.float64(0.4934427936067424), 'Std': np.float64(0.08309240278970001)}
2024-12-07 01:20:40,979 - INFO - Candidate Std Stats: {'Max': np.float64(0.9130249751026933), 'Min': np.float64(0.0), 'Mean': np.float64(0.10781941589716368), 'Std': np.float64(0.053789990196558585)}
[I 2024-12-07 01:20:41,025] Trial 273 finished with value: 1.6666666666666665 and parameters: {'x_0_0': 'bd', 'x_0_1': 'bd', 'x_0_2': 'ab', 'x_1_0': 'ac', 'x_1_1': 'cd', 'x_1_2': 'cd'}. Best is trial 148 with value: 0.8333333333333333.
2024-12-07 01:20:45,800 - INFO - Candidate Mean Stats: {'Max': np.float64(2.0), 'Min': np.float64(0.2447761069472587), 'Mean': np.float64(0.4906140360931424), 'Std': np.float64(0.07866602927773499)}
2024-12-07 01:20:45,801 - INFO - Candidate Std Stats: {'Max': np.float64(1.2174025781047628), 'Min': np.float64(0.0), 'Mean': np.float64(0.11067705911327748), 'Std': np.float64(0.053242875225108934)}
[I 2024-12-07 01:20:45,843] Trial 272 finished with value: 1.6666666666666665 and parameters: {'x_0_0': 'bc', 'x_0_1': 'bd', 'x_0_2': 'bc', 'x_1_0': 'ac', 'x_1_1': 'bd', 'x_1_2': 'bc'}. Best is trial 74 with value: 0.8222222222222222.
2024-12-07 01:20:52,927 - INFO - Candidate Mean Stats: {'Max': np.float64(2.0), 'Min': np.float64(0.21627394207566386), 'Mean': np.float64(0.4937765321176034), 'Std': np.float64(0.08299911404811748)}
2024-12-07 01:20:52,928 - INFO - Candidate Std Stats: {'Max': np.float64(0.8569412646331728), 'Min': np.float64(0.0), 'Mean': np.float64(0.11429296262737773), 'Std': np.float64(0.05526207088194349)}
[I 2024-12-07 01:20:52,973] Trial 273 finished with value: 1.1555555555555554 and parameters: {'x_0_0': 'ad', 'x_0_1': 'oo', 'x_0_2': 'bd', 'x_1_0': 'ab', 'x_1_1': 'bd', 'x_1_2': 'bc'}. Best is trial 49 with value: 0.7999999999999999.
2024-12-07 01:21:00,842 - INFO - Candidate Mean Stats: {'Max': np.float64(2.0), 'Min': np.float64(0.1580935340105893), 'Mean': np.float64(0.47849562238474597), 'Std': np.float64(0.0820592668869652)}
2024-12-07 01:21:00,842 - INFO - Candidate Std Stats: {'Max': np.float64(1.1508296504003654), 'Min': np.float64(0.0), 'Mean': np.float64(0.10484367057724449), 'Std': np.float64(0.04968790254878933)}
