[I 2024-12-06 23:37:56,949] Trial 312 finished with value: 1.3214285714285714 and parameters: {'x_0_0': 'bd', 'x_0_1': 'bc', 'x_1_0': 'oo', 'x_1_1': 'cd'}. Best is trial 23 with value: 0.5.
2024-12-06 23:37:57,013 - INFO - Candidate Mean Stats: {'Max': np.float64(3.25584149120277), 'Min': np.float64(-0.95267360596751), 'Mean': np.float64(0.6301763046269818), 'Std': np.float64(0.5908996877111344)}
2024-12-06 23:37:57,014 - INFO - Candidate Std Stats: {'Max': np.float64(1.7037652288489826), 'Min': np.float64(0.0), 'Mean': np.float64(0.5605599588972783), 'Std': np.float64(0.31228461898712373)}
2024-12-06 23:37:57,020 - INFO - Candidate Mean Stats: {'Max': np.float64(2.98556207421707), 'Min': np.float64(-0.6603108694161877), 'Mean': np.float64(0.6510947848778653), 'Std': np.float64(0.55599534458861)}
2024-12-06 23:37:57,020 - INFO - Candidate Std Stats: {'Max': np.float64(1.7507158195922756), 'Min': np.float64(0.0), 'Mean': np.float64(0.5410150445276679), 'Std': np.float64(0.31927717372652)}
2024-12-06 23:37:57,025 - INFO - Candidate Mean Stats: {'Max': np.float64(3.0123093538110863), 'Min': np.float64(-0.6665677393811524), 'Mean': np.float64(0.6455397790697419), 'Std': np.float64(0.541899200069153)}
2024-12-06 23:37:57,025 - INFO - Candidate Std Stats: {'Max': np.float64(1.5537905125077651), 'Min': np.float64(0.0), 'Mean': np.float64(0.49047318177464716), 'Std': np.float64(0.28357152731130014)}
[I 2024-12-06 23:37:57,028] Trial 314 finished with value: 1.0714285714285714 and parameters: {'x_0_0': 'ac', 'x_0_1': 'oo', 'x_1_0': 'bc', 'x_1_1': 'bc'}. Best is trial 165 with value: 0.5.
[I 2024-12-06 23:37:57,034] Trial 314 finished with value: 1.2857142857142856 and parameters: {'x_0_0': 'ac', 'x_0_1': 'ac', 'x_1_0': 'ab', 'x_1_1': 'cd'}. Best is trial 76 with value: 0.5.
[I 2024-12-06 23:37:57,039] Trial 314 finished with value: 1.2142857142857144 and parameters: {'x_0_0': 'ab', 'x_0_1': 'oo', 'x_1_0': 'bd', 'x_1_1': 'ad'}. Best is trial 63 with value: 0.5.
2024-12-06 23:37:57,314 - INFO - Candidate Mean Stats: {'Max': np.float64(2.9774859816373676), 'Min': np.float64(-0.7613248116793511), 'Mean': np.float64(0.6768840504269491), 'Std': np.float64(0.530141716544775)}
2024-12-06 23:37:57,314 - INFO - Candidate Std Stats: {'Max': np.float64(1.814510669191938), 'Min': np.float64(0.0), 'Mean': np.float64(0.48333366256398735), 'Std': np.float64(0.2817387829579656)}
[I 2024-12-06 23:37:57,328] Trial 313 finished with value: 1.0714285714285714 and parameters: {'x_0_0': 'bc', 'x_0_1': 'oo', 'x_1_0': 'ac', 'x_1_1': 'bd'}. Best is trial 23 with value: 0.5.
2024-12-06 23:37:57,392 - INFO - Candidate Mean Stats: {'Max': np.float64(2.865758592120866), 'Min': np.float64(-1.1591130016758746), 'Mean': np.float64(0.5455661858687912), 'Std': np.float64(0.6398480990401256)}
2024-12-06 23:37:57,392 - INFO - Candidate Std Stats: {'Max': np.float64(2.228961948483383), 'Min': np.float64(0.0), 'Mean': np.float64(0.6214385961771371), 'Std': np.float64(0.37339664265768024)}
2024-12-06 23:37:57,399 - INFO - Candidate Mean Stats: {'Max': np.float64(2.7448520292680127), 'Min': np.float64(-1.0106044632953808), 'Mean': np.float64(0.6292312973503127), 'Std': np.float64(0.5050803189139563)}
2024-12-06 23:37:57,399 - INFO - Candidate Std Stats: {'Max': np.float64(1.802858865333539), 'Min': np.float64(0.0), 'Mean': np.float64(0.5791004309841749), 'Std': np.float64(0.33430324631304736)}
2024-12-06 23:37:57,404 - INFO - Candidate Mean Stats: {'Max': np.float64(3.016997289086537), 'Min': np.float64(-0.8798255128619396), 'Mean': np.float64(0.6528731224773765), 'Std': np.float64(0.5571091123174399)}
2024-12-06 23:37:57,404 - INFO - Candidate Std Stats: {'Max': np.float64(1.725358358479538), 'Min': np.float64(0.0), 'Mean': np.float64(0.531933927636967), 'Std': np.float64(0.30171426798239703)}
[I 2024-12-06 23:37:57,406] Trial 315 finished with value: 1.3214285714285714 and parameters: {'x_0_0': 'ad', 'x_0_1': 'ab', 'x_1_0': 'oo', 'x_1_1': 'bc'}. Best is trial 165 with value: 0.5.
[I 2024-12-06 23:37:57,414] Trial 315 finished with value: 1.25 and parameters: {'x_0_0': 'oo', 'x_0_1': 'oo', 'x_1_0': 'cd', 'x_1_1': 'oo'}. Best is trial 76 with value: 0.5.
[I 2024-12-06 23:37:57,418] Trial 315 finished with value: 1.0714285714285714 and parameters: {'x_0_0': 'bc', 'x_0_1': 'oo', 'x_1_0': 'ab', 'x_1_1': 'ac'}. Best is trial 63 with value: 0.5.
2024-12-06 23:37:57,693 - INFO - Candidate Mean Stats: {'Max': np.float64(2.9491249575408593), 'Min': np.float64(-0.8523383401775699), 'Mean': np.float64(0.6589589503575284), 'Std': np.float64(0.5538757755974655)}
2024-12-06 23:37:57,693 - INFO - Candidate Std Stats: {'Max': np.float64(2.215502123556616), 'Min': np.float64(0.0), 'Mean': np.float64(0.5249528823793307), 'Std': np.float64(0.31664534540771944)}
[I 2024-12-06 23:37:57,706] Trial 314 finished with value: 1.7142857142857144 and parameters: {'x_0_0': 'ab', 'x_0_1': 'ac', 'x_1_0': 'ac', 'x_1_1': 'ad'}. Best is trial 23 with value: 0.5.
2024-12-06 23:37:57,774 - INFO - Candidate Mean Stats: {'Max': np.float64(3.0183232663811355), 'Min': np.float64(-1.1521014299240846), 'Mean': np.float64(0.6558513142003372), 'Std': np.float64(0.6061213143602716)}
2024-12-06 23:37:57,775 - INFO - Candidate Std Stats: {'Max': np.float64(1.6229986044941695), 'Min': np.float64(0.0), 'Mean': np.float64(0.5490430443287162), 'Std': np.float64(0.3095776273679149)}
2024-12-06 23:37:57,782 - INFO - Candidate Mean Stats: {'Max': np.float64(3.5849246897004994), 'Min': np.float64(-0.43890598552747734), 'Mean': np.float64(0.6958144315080653), 'Std': np.float64(0.5110068634654518)}
2024-12-06 23:37:57,782 - INFO - Candidate Std Stats: {'Max': np.float64(1.6720899282821247), 'Min': np.float64(0.0), 'Mean': np.float64(0.49287360089315757), 'Std': np.float64(0.29290024832222106)}
2024-12-06 23:37:57,787 - INFO - Candidate Mean Stats: {'Max': np.float64(3.102308569669961), 'Min': np.float64(-0.8023728724096071), 'Mean': np.float64(0.6182661575786562), 'Std': np.float64(0.5624571719469755)}
2024-12-06 23:37:57,787 - INFO - Candidate Std Stats: {'Max': np.float64(1.944158327814032), 'Min': np.float64(0.0), 'Mean': np.float64(0.5862228465108321), 'Std': np.float64(0.34149719677662416)}
[I 2024-12-06 23:37:57,790] Trial 316 finished with value: 1.0714285714285714 and parameters: {'x_0_0': 'ac', 'x_0_1': 'oo', 'x_1_0': 'bc', 'x_1_1': 'cd'}. Best is trial 165 with value: 0.5.
[I 2024-12-06 23:37:57,797] Trial 316 finished with value: 1.2142857142857144 and parameters: {'x_0_0': 'ab', 'x_0_1': 'oo', 'x_1_0': 'ad', 'x_1_1': 'ac'}. Best is trial 76 with value: 0.5.
[I 2024-12-06 23:37:57,801] Trial 316 finished with value: 1.7142857142857144 and parameters: {'x_0_0': 'ab', 'x_0_1': 'bd', 'x_1_0': 'ac', 'x_1_1': 'bd'}. Best is trial 63 with value: 0.5.
2024-12-06 23:37:58,075 - INFO - Candidate Mean Stats: {'Max': np.float64(2.7013599680523988), 'Min': np.float64(-0.6347905361708477), 'Mean': np.float64(0.6707095038664066), 'Std': np.float64(0.4694829649478123)}
2024-12-06 23:37:58,075 - INFO - Candidate Std Stats: {'Max': np.float64(1.5534691872396715), 'Min': np.float64(0.0), 'Mean': np.float64(0.4938782109640867), 'Std': np.float64(0.2905021822961143)}
[I 2024-12-06 23:37:58,089] Trial 315 finished with value: 1.875 and parameters: {'x_0_0': 'cd', 'x_0_1': 'bc', 'x_1_0': 'bc', 'x_1_1': 'oo'}. Best is trial 23 with value: 0.5.
2024-12-06 23:37:58,158 - INFO - Candidate Mean Stats: {'Max': np.float64(3.1202213731772033), 'Min': np.float64(-0.833142135181346), 'Mean': np.float64(0.6107222890781043), 'Std': np.float64(0.5735875176477435)}
2024-12-06 23:37:58,158 - INFO - Candidate Std Stats: {'Max': np.float64(1.7938494976783383), 'Min': np.float64(0.0), 'Mean': np.float64(0.617225552100829), 'Std': np.float64(0.33750789106476325)}
2024-12-06 23:37:58,164 - INFO - Candidate Mean Stats: {'Max': np.float64(3.3371377901190384), 'Min': np.float64(-0.9068176828109895), 'Mean': np.float64(0.7172104196317554), 'Std': np.float64(0.5409531568187911)}
2024-12-06 23:37:58,164 - INFO - Candidate Std Stats: {'Max': np.float64(1.591739318880541), 'Min': np.float64(0.0), 'Mean': np.float64(0.5095415613156655), 'Std': np.float64(0.2901981389128881)}
2024-12-06 23:37:58,170 - INFO - Candidate Mean Stats: {'Max': np.float64(3.0665204721416806), 'Min': np.float64(-1.1384949155552215), 'Mean': np.float64(0.5782368538896133), 'Std': np.float64(0.5958505013898608)}
2024-12-06 23:37:58,170 - INFO - Candidate Std Stats: {'Max': np.float64(1.746073203235822), 'Min': np.float64(0.0), 'Mean': np.float64(0.5556900351543881), 'Std': np.float64(0.32696012394759294)}
[I 2024-12-06 23:37:58,173] Trial 317 finished with value: 1.2142857142857144 and parameters: {'x_0_0': 'ab', 'x_0_1': 'oo', 'x_1_0': 'ac', 'x_1_1': 'ab'}. Best is trial 165 with value: 0.5.
[I 2024-12-06 23:37:58,179] Trial 317 finished with value: 1.0714285714285714 and parameters: {'x_0_0': 'ad', 'x_0_1': 'oo', 'x_1_0': 'ac', 'x_1_1': 'ac'}. Best is trial 76 with value: 0.5.
[I 2024-12-06 23:37:58,184] Trial 317 finished with value: 1.3214285714285714 and parameters: {'x_0_0': 'ac', 'x_0_1': 'bc', 'x_1_0': 'oo', 'x_1_1': 'cd'}. Best is trial 63 with value: 0.5.
2024-12-06 23:37:58,456 - INFO - Candidate Mean Stats: {'Max': np.float64(3.1283762963211332), 'Min': np.float64(-0.9404234630474344), 'Mean': np.float64(0.6270210183881106), 'Std': np.float64(0.5428905538784413)}
2024-12-06 23:37:58,456 - INFO - Candidate Std Stats: {'Max': np.float64(1.7006075387845951), 'Min': np.float64(0.0), 'Mean': np.float64(0.5618381693154272), 'Std': np.float64(0.3210661664517457)}
[I 2024-12-06 23:37:58,470] Trial 316 finished with value: 1.1964285714285714 and parameters: {'x_0_0': 'ac', 'x_0_1': 'bd', 'x_1_0': 'oo', 'x_1_1': 'oo'}. Best is trial 23 with value: 0.5.
2024-12-06 23:37:58,540 - INFO - Candidate Mean Stats: {'Max': np.float64(3.0824173729257387), 'Min': np.float64(-0.9216259856631644), 'Mean': np.float64(0.678951904376917), 'Std': np.float64(0.5426956226933994)}
2024-12-06 23:37:58,540 - INFO - Candidate Std Stats: {'Max': np.float64(1.898868987491765), 'Min': np.float64(0.0), 'Mean': np.float64(0.5454125739407402), 'Std': np.float64(0.3346924779419011)}
2024-12-06 23:37:58,546 - INFO - Candidate Mean Stats: {'Max': np.float64(2.8520324835272732), 'Min': np.float64(-0.749395377368702), 'Mean': np.float64(0.607876673685503), 'Std': np.float64(0.5543718710517396)}
2024-12-06 23:37:58,546 - INFO - Candidate Std Stats: {'Max': np.float64(1.4704712379536995), 'Min': np.float64(0.0), 'Mean': np.float64(0.5078054331082481), 'Std': np.float64(0.2899221032233949)}
2024-12-06 23:37:58,550 - INFO - Candidate Mean Stats: {'Max': np.float64(2.9859507111871006), 'Min': np.float64(-0.6392510263806331), 'Mean': np.float64(0.7289656171035053), 'Std': np.float64(0.47638221788196267)}
2024-12-06 23:37:58,550 - INFO - Candidate Std Stats: {'Max': np.float64(1.4851741441996869), 'Min': np.float64(0.0), 'Mean': np.float64(0.4668050004422801), 'Std': np.float64(0.28261319664891593)}
[I 2024-12-06 23:37:58,555] Trial 318 finished with value: 0.6428571428571428 and parameters: {'x_0_0': 'ad', 'x_0_1': 'oo', 'x_1_0': 'bc', 'x_1_1': 'ab'}. Best is trial 165 with value: 0.5.
[I 2024-12-06 23:37:58,561] Trial 318 finished with value: 0.75 and parameters: {'x_0_0': 'ac', 'x_0_1': 'ad', 'x_1_0': 'oo', 'x_1_1': 'bd'}. Best is trial 76 with value: 0.5.
[I 2024-12-06 23:37:58,563] Trial 318 finished with value: 1.4464285714285714 and parameters: {'x_0_0': 'ac', 'x_0_1': 'bc', 'x_1_0': 'bd', 'x_1_1': 'oo'}. Best is trial 63 with value: 0.5.
2024-12-06 23:37:58,838 - INFO - Candidate Mean Stats: {'Max': np.float64(3.3477504462185346), 'Min': np.float64(-0.8282618706018621), 'Mean': np.float64(0.6665264824094826), 'Std': np.float64(0.5374640978272847)}
2024-12-06 23:37:58,838 - INFO - Candidate Std Stats: {'Max': np.float64(1.3655073637658035), 'Min': np.float64(0.0), 'Mean': np.float64(0.5272546090802277), 'Std': np.float64(0.28623117811254883)}
[I 2024-12-06 23:37:58,853] Trial 317 finished with value: 1.0714285714285714 and parameters: {'x_0_0': 'ac', 'x_0_1': 'oo', 'x_1_0': 'bd', 'x_1_1': 'bd'}. Best is trial 23 with value: 0.5.
2024-12-06 23:37:58,922 - INFO - Candidate Mean Stats: {'Max': np.float64(3.123191358442635), 'Min': np.float64(-1.0178338949475076), 'Mean': np.float64(0.618149978076579), 'Std': np.float64(0.5517627590365322)}
2024-12-06 23:37:58,922 - INFO - Candidate Std Stats: {'Max': np.float64(1.6448565752093205), 'Min': np.float64(0.0), 'Mean': np.float64(0.5973312398284671), 'Std': np.float64(0.337004149082643)}
2024-12-06 23:37:58,928 - INFO - Candidate Mean Stats: {'Max': np.float64(3.405937417557477), 'Min': np.float64(-1.1527485634907133), 'Mean': np.float64(0.6594383687993436), 'Std': np.float64(0.5653517105565095)}
2024-12-06 23:37:58,928 - INFO - Candidate Std Stats: {'Max': np.float64(1.5085503202725676), 'Min': np.float64(0.0), 'Mean': np.float64(0.5104997215188691), 'Std': np.float64(0.2917947355292611)}
2024-12-06 23:37:58,932 - INFO - Candidate Mean Stats: {'Max': np.float64(2.71169067105565), 'Min': np.float64(-0.5618197036390064), 'Mean': np.float64(0.7372489781645294), 'Std': np.float64(0.48208692900945693)}
2024-12-06 23:37:58,933 - INFO - Candidate Std Stats: {'Max': np.float64(1.7384175973227414), 'Min': np.float64(0.0), 'Mean': np.float64(0.44310448816592823), 'Std': np.float64(0.2938122021327005)}
[I 2024-12-06 23:37:58,936] Trial 319 finished with value: 1.125 and parameters: {'x_0_0': 'oo', 'x_0_1': 'oo', 'x_1_0': 'oo', 'x_1_1': 'cd'}. Best is trial 165 with value: 0.5.
[I 2024-12-06 23:37:58,942] Trial 319 finished with value: 0.75 and parameters: {'x_0_0': 'ac', 'x_0_1': 'ad', 'x_1_0': 'oo', 'x_1_1': 'bc'}. Best is trial 76 with value: 0.5.
[I 2024-12-06 23:37:58,947] Trial 319 finished with value: 1.125 and parameters: {'x_0_0': 'cd', 'x_0_1': 'oo', 'x_1_0': 'oo', 'x_1_1': 'oo'}. Best is trial 63 with value: 0.5.
2024-12-06 23:37:59,223 - INFO - Candidate Mean Stats: {'Max': np.float64(2.950923481422533), 'Min': np.float64(-0.7117741790454711), 'Mean': np.float64(0.649616816696028), 'Std': np.float64(0.5454762956833576)}
2024-12-06 23:37:59,223 - INFO - Candidate Std Stats: {'Max': np.float64(1.6242427555283996), 'Min': np.float64(0.0), 'Mean': np.float64(0.5608488133993395), 'Std': np.float64(0.32624481713606013)}
[I 2024-12-06 23:37:59,237] Trial 318 finished with value: 1.1964285714285714 and parameters: {'x_0_0': 'ad', 'x_0_1': 'bd', 'x_1_0': 'oo', 'x_1_1': 'oo'}. Best is trial 23 with value: 0.5.
2024-12-06 23:37:59,309 - INFO - Candidate Mean Stats: {'Max': np.float64(2.89399603663292), 'Min': np.float64(-1.053281259560166), 'Mean': np.float64(0.6424593955100619), 'Std': np.float64(0.5953823978896401)}
2024-12-06 23:37:59,309 - INFO - Candidate Std Stats: {'Max': np.float64(1.841854833272177), 'Min': np.float64(0.0), 'Mean': np.float64(0.5928372056211729), 'Std': np.float64(0.3310002139791364)}
2024-12-06 23:37:59,313 - INFO - Candidate Mean Stats: {'Max': np.float64(2.9893767188858336), 'Min': np.float64(-0.6154124377844922), 'Mean': np.float64(0.6448025085885726), 'Std': np.float64(0.5615001907384203)}
2024-12-06 23:37:59,313 - INFO - Candidate Std Stats: {'Max': np.float64(2.0842719705338997), 'Min': np.float64(0.0), 'Mean': np.float64(0.5483037626919884), 'Std': np.float64(0.31428218725190127)}
2024-12-06 23:37:59,318 - INFO - Candidate Mean Stats: {'Max': np.float64(3.2085120501903766), 'Min': np.float64(-0.893594176181711), 'Mean': np.float64(0.6631548409684556), 'Std': np.float64(0.5468318030738328)}
2024-12-06 23:37:59,318 - INFO - Candidate Std Stats: {'Max': np.float64(1.5562252898986204), 'Min': np.float64(0.0), 'Mean': np.float64(0.5306982952398747), 'Std': np.float64(0.30098022609964814)}
[I 2024-12-06 23:37:59,323] Trial 320 finished with value: 1.2142857142857144 and parameters: {'x_0_0': 'ab', 'x_0_1': 'oo', 'x_1_0': 'ad', 'x_1_1': 'ab'}. Best is trial 165 with value: 0.5.
[I 2024-12-06 23:37:59,327] Trial 320 finished with value: 1.375 and parameters: {'x_0_0': 'oo', 'x_0_1': 'oo', 'x_1_0': 'ac', 'x_1_1': 'ab'}. Best is trial 76 with value: 0.5.
[I 2024-12-06 23:37:59,331] Trial 320 finished with value: 1.2142857142857144 and parameters: {'x_0_0': 'ab', 'x_0_1': 'oo', 'x_1_0': 'bd', 'x_1_1': 'ac'}. Best is trial 63 with value: 0.5.
2024-12-06 23:37:59,605 - INFO - Candidate Mean Stats: {'Max': np.float64(3.074286710425482), 'Min': np.float64(-0.9551794338137636), 'Mean': np.float64(0.6696210054209378), 'Std': np.float64(0.5388990151425084)}
2024-12-06 23:37:59,606 - INFO - Candidate Std Stats: {'Max': np.float64(1.7027783858393237), 'Min': np.float64(0.0), 'Mean': np.float64(0.5336353364482316), 'Std': np.float64(0.318292648663418)}
[I 2024-12-06 23:37:59,620] Trial 319 finished with value: 1.0714285714285714 and parameters: {'x_0_0': 'ad', 'x_0_1': 'oo', 'x_1_0': 'ad', 'x_1_1': 'ad'}. Best is trial 23 with value: 0.5.
2024-12-06 23:37:59,691 - INFO - Candidate Mean Stats: {'Max': np.float64(2.6928255617352335), 'Min': np.float64(-0.8645629523120866), 'Mean': np.float64(0.613787279228861), 'Std': np.float64(0.6018378377703111)}
2024-12-06 23:37:59,691 - INFO - Candidate Std Stats: {'Max': np.float64(1.8483228719868299), 'Min': np.float64(0.0), 'Mean': np.float64(0.6381960966864129), 'Std': np.float64(0.3519428641522163)}
2024-12-06 23:37:59,696 - INFO - Candidate Mean Stats: {'Max': np.float64(3.29358611455661), 'Min': np.float64(-0.6432375886363225), 'Mean': np.float64(0.6915168090032692), 'Std': np.float64(0.5695211554029085)}
2024-12-06 23:37:59,696 - INFO - Candidate Std Stats: {'Max': np.float64(1.5063215871198896), 'Min': np.float64(0.0), 'Mean': np.float64(0.5021914633071525), 'Std': np.float64(0.2840892221432085)}
2024-12-06 23:37:59,701 - INFO - Candidate Mean Stats: {'Max': np.float64(3.1244519226800977), 'Min': np.float64(-1.350594844914966), 'Mean': np.float64(0.6118409682481556), 'Std': np.float64(0.6172151141836363)}
2024-12-06 23:37:59,701 - INFO - Candidate Std Stats: {'Max': np.float64(1.6946939217857908), 'Min': np.float64(0.0), 'Mean': np.float64(0.5879533084089322), 'Std': np.float64(0.34504797856993125)}
[I 2024-12-06 23:37:59,705] Trial 321 finished with value: 1.3214285714285714 and parameters: {'x_0_0': 'ad', 'x_0_1': 'ac', 'x_1_0': 'oo', 'x_1_1': 'ad'}. Best is trial 165 with value: 0.5.
[I 2024-12-06 23:37:59,711] Trial 321 finished with value: 0.75 and parameters: {'x_0_0': 'bc', 'x_0_1': 'ad', 'x_1_0': 'oo', 'x_1_1': 'bd'}. Best is trial 76 with value: 0.5.
[I 2024-12-06 23:37:59,716] Trial 321 finished with value: 1.5714285714285714 and parameters: {'x_0_0': 'bd', 'x_0_1': 'bd', 'x_1_0': 'cd', 'x_1_1': 'ad'}. Best is trial 63 with value: 0.5.
2024-12-06 23:37:59,986 - INFO - Candidate Mean Stats: {'Max': np.float64(3.232712635063451), 'Min': np.float64(-0.720101356599978), 'Mean': np.float64(0.7037046020892099), 'Std': np.float64(0.5245551165094988)}
2024-12-06 23:37:59,986 - INFO - Candidate Std Stats: {'Max': np.float64(1.9420029634025988), 'Min': np.float64(0.0), 'Mean': np.float64(0.496130797528207), 'Std': np.float64(0.2836790319035466)}
[I 2024-12-06 23:38:00,000] Trial 320 finished with value: 1.0714285714285714 and parameters: {'x_0_0': 'bc', 'x_0_1': 'oo', 'x_1_0': 'ad', 'x_1_1': 'bd'}. Best is trial 23 with value: 0.5.
2024-12-06 23:38:00,071 - INFO - Candidate Mean Stats: {'Max': np.float64(2.972503411628921), 'Min': np.float64(-0.9024880453629184), 'Mean': np.float64(0.5846276774906413), 'Std': np.float64(0.6037004806473747)}
2024-12-06 23:38:00,071 - INFO - Candidate Std Stats: {'Max': np.float64(1.6335823165186647), 'Min': np.float64(0.0), 'Mean': np.float64(0.6077424727822185), 'Std': np.float64(0.3333414867472452)}
2024-12-06 23:38:00,077 - INFO - Candidate Mean Stats: {'Max': np.float64(3.2928658439759246), 'Min': np.float64(-0.5800841008482258), 'Mean': np.float64(0.6980315663843328), 'Std': np.float64(0.5315445181273419)}
2024-12-06 23:38:00,077 - INFO - Candidate Std Stats: {'Max': np.float64(1.6574484329572312), 'Min': np.float64(0.0), 'Mean': np.float64(0.511101823309972), 'Std': np.float64(0.29405555549391615)}
2024-12-06 23:38:00,083 - INFO - Candidate Mean Stats: {'Max': np.float64(2.946243980857546), 'Min': np.float64(-0.8337877889950691), 'Mean': np.float64(0.6390596590918604), 'Std': np.float64(0.5103795308793775)}
2024-12-06 23:38:00,083 - INFO - Candidate Std Stats: {'Max': np.float64(2.0336872669575765), 'Min': np.float64(0.0), 'Mean': np.float64(0.5887320146890778), 'Std': np.float64(0.3384706495630479)}
[I 2024-12-06 23:38:00,085] Trial 322 finished with value: 1.2142857142857144 and parameters: {'x_0_0': 'ab', 'x_0_1': 'oo', 'x_1_0': 'ad', 'x_1_1': 'ac'}. Best is trial 165 with value: 0.5.
[I 2024-12-06 23:38:00,091] Trial 322 finished with value: 1.875 and parameters: {'x_0_0': 'oo', 'x_0_1': 'ab', 'x_1_0': 'ad', 'x_1_1': 'cd'}. Best is trial 76 with value: 0.5.
[I 2024-12-06 23:38:00,097] Trial 322 finished with value: 1.0714285714285714 and parameters: {'x_0_0': 'bc', 'x_0_1': 'oo', 'x_1_0': 'ac', 'x_1_1': 'bc'}. Best is trial 63 with value: 0.5.
2024-12-06 23:38:00,385 - INFO - Candidate Mean Stats: {'Max': np.float64(3.152351987588661), 'Min': np.float64(-0.6432730049490383), 'Mean': np.float64(0.7895760300475111), 'Std': np.float64(0.5114148373962728)}
2024-12-06 23:38:00,385 - INFO - Candidate Std Stats: {'Max': np.float64(1.5694468036847367), 'Min': np.float64(0.0), 'Mean': np.float64(0.46841679974977185), 'Std': np.float64(0.2707024179248951)}
