[I 2024-12-06 23:37:03,678] Trial 168 finished with value: 1.0714285714285714 and parameters: {'x_0_0': 'ac', 'x_0_1': 'oo', 'x_1_0': 'bc', 'x_1_1': 'ad'}. Best is trial 23 with value: 0.5.
2024-12-06 23:37:03,903 - INFO - Candidate Mean Stats: {'Max': np.float64(2.5944258174034096), 'Min': np.float64(-1.0007990763726204), 'Mean': np.float64(0.4715365761286501), 'Std': np.float64(0.4755551014269782)}
2024-12-06 23:37:03,904 - INFO - Candidate Std Stats: {'Max': np.float64(1.7402441549839045), 'Min': np.float64(0.0), 'Mean': np.float64(0.5641256514928447), 'Std': np.float64(0.29642639649590524)}
2024-12-06 23:37:03,910 - INFO - Candidate Mean Stats: {'Max': np.float64(2.706806273985104), 'Min': np.float64(-1.154454660136447), 'Mean': np.float64(0.28209713436158596), 'Std': np.float64(0.6157224319306464)}
2024-12-06 23:37:03,910 - INFO - Candidate Std Stats: {'Max': np.float64(1.8183905380414727), 'Min': np.float64(0.0), 'Mean': np.float64(0.6622793047184554), 'Std': np.float64(0.32107395833714975)}
2024-12-06 23:37:03,912 - INFO - Candidate Mean Stats: {'Max': np.float64(3.1316775354313746), 'Min': np.float64(-1.0415266785353865), 'Mean': np.float64(0.40831673453134115), 'Std': np.float64(0.595904167146883)}
2024-12-06 23:37:03,912 - INFO - Candidate Std Stats: {'Max': np.float64(1.577240480868891), 'Min': np.float64(0.0), 'Mean': np.float64(0.6118373701005321), 'Std': np.float64(0.2925025209275474)}
[I 2024-12-06 23:37:03,918] Trial 170 finished with value: 1.0714285714285714 and parameters: {'x_0_0': 'bd', 'x_0_1': 'oo', 'x_1_0': 'ac', 'x_1_1': 'bd'}. Best is trial 165 with value: 0.5.
[I 2024-12-06 23:37:03,923] Trial 170 finished with value: 1.5714285714285714 and parameters: {'x_0_0': 'ad', 'x_0_1': 'ad', 'x_1_0': 'ad', 'x_1_1': 'cd'}. Best is trial 63 with value: 0.5.
[I 2024-12-06 23:37:03,926] Trial 170 finished with value: 0.7857142857142857 and parameters: {'x_0_0': 'bd', 'x_0_1': 'oo', 'x_1_0': 'bc', 'x_1_1': 'cd'}. Best is trial 76 with value: 0.5.
2024-12-06 23:37:04,020 - INFO - Candidate Mean Stats: {'Max': np.float64(3.3838335422838726), 'Min': np.float64(-0.8154966360958997), 'Mean': np.float64(0.44804797857837003), 'Std': np.float64(0.5179639027272072)}
2024-12-06 23:37:04,020 - INFO - Candidate Std Stats: {'Max': np.float64(1.6044171787902557), 'Min': np.float64(0.0), 'Mean': np.float64(0.5493652623300946), 'Std': np.float64(0.27291260001428475)}
[I 2024-12-06 23:37:04,033] Trial 169 finished with value: 1.375 and parameters: {'x_0_0': 'oo', 'x_0_1': 'oo', 'x_1_0': 'ad', 'x_1_1': 'bc'}. Best is trial 23 with value: 0.5.
2024-12-06 23:37:04,257 - INFO - Candidate Mean Stats: {'Max': np.float64(2.7324194629374454), 'Min': np.float64(-0.878358365493232), 'Mean': np.float64(0.5452737763171467), 'Std': np.float64(0.4945720937594526)}
2024-12-06 23:37:04,257 - INFO - Candidate Std Stats: {'Max': np.float64(1.5322781151761145), 'Min': np.float64(0.0), 'Mean': np.float64(0.542430502765589), 'Std': np.float64(0.27390264749872845)}
2024-12-06 23:37:04,264 - INFO - Candidate Mean Stats: {'Max': np.float64(2.75022352281371), 'Min': np.float64(-1.1204498795265265), 'Mean': np.float64(0.4268773937568506), 'Std': np.float64(0.5517969750554904)}
2024-12-06 23:37:04,264 - INFO - Candidate Std Stats: {'Max': np.float64(1.8616235287799363), 'Min': np.float64(0.0), 'Mean': np.float64(0.5837642282626763), 'Std': np.float64(0.2818253577181265)}
2024-12-06 23:37:04,267 - INFO - Candidate Mean Stats: {'Max': np.float64(3.746992651088621), 'Min': np.float64(-1.443629697731628), 'Mean': np.float64(0.4099397474243478), 'Std': np.float64(0.6105253509831285)}
2024-12-06 23:37:04,267 - INFO - Candidate Std Stats: {'Max': np.float64(1.7407897639309362), 'Min': np.float64(0.0), 'Mean': np.float64(0.6080153837884026), 'Std': np.float64(0.2886046346450885)}
[I 2024-12-06 23:37:04,271] Trial 171 finished with value: 0.9285714285714286 and parameters: {'x_0_0': 'ad', 'x_0_1': 'oo', 'x_1_0': 'ab', 'x_1_1': 'cd'}. Best is trial 165 with value: 0.5.
[I 2024-12-06 23:37:04,277] Trial 171 finished with value: 1.0714285714285714 and parameters: {'x_0_0': 'bc', 'x_0_1': 'oo', 'x_1_0': 'ac', 'x_1_1': 'ad'}. Best is trial 63 with value: 0.5.
[I 2024-12-06 23:37:04,280] Trial 171 finished with value: 0.8214285714285714 and parameters: {'x_0_0': 'bd', 'x_0_1': 'oo', 'x_1_0': 'oo', 'x_1_1': 'ab'}. Best is trial 76 with value: 0.5.
2024-12-06 23:37:04,373 - INFO - Candidate Mean Stats: {'Max': np.float64(2.7603784651849947), 'Min': np.float64(-1.2081442753136542), 'Mean': np.float64(0.4548481541008625), 'Std': np.float64(0.5392008638494319)}
2024-12-06 23:37:04,373 - INFO - Candidate Std Stats: {'Max': np.float64(1.4710506203992852), 'Min': np.float64(0.0), 'Mean': np.float64(0.5924918141322094), 'Std': np.float64(0.2753715242375619)}
[I 2024-12-06 23:37:04,386] Trial 170 finished with value: 1.0714285714285714 and parameters: {'x_0_0': 'bc', 'x_0_1': 'oo', 'x_1_0': 'bd', 'x_1_1': 'ac'}. Best is trial 23 with value: 0.5.
2024-12-06 23:37:04,612 - INFO - Candidate Mean Stats: {'Max': np.float64(2.957391004923123), 'Min': np.float64(-1.0191905054096186), 'Mean': np.float64(0.4678007662691202), 'Std': np.float64(0.5679476502486017)}
2024-12-06 23:37:04,612 - INFO - Candidate Std Stats: {'Max': np.float64(1.535281088325148), 'Min': np.float64(0.0), 'Mean': np.float64(0.5273995082867892), 'Std': np.float64(0.25778791616562624)}
2024-12-06 23:37:04,617 - INFO - Candidate Mean Stats: {'Max': np.float64(3.0755183433737043), 'Min': np.float64(-1.1319287280167643), 'Mean': np.float64(0.4115394069463153), 'Std': np.float64(0.5384427438492002)}
2024-12-06 23:37:04,617 - INFO - Candidate Std Stats: {'Max': np.float64(1.51499425498478), 'Min': np.float64(0.0), 'Mean': np.float64(0.5693962646288503), 'Std': np.float64(0.27486601369236646)}
2024-12-06 23:37:04,620 - INFO - Candidate Mean Stats: {'Max': np.float64(3.0070646930746703), 'Min': np.float64(-1.3207381100334896), 'Mean': np.float64(0.4428586045315815), 'Std': np.float64(0.5801966679795477)}
2024-12-06 23:37:04,622 - INFO - Candidate Std Stats: {'Max': np.float64(1.7777639462190584), 'Min': np.float64(0.0), 'Mean': np.float64(0.58531710751033), 'Std': np.float64(0.2767660467759199)}
[I 2024-12-06 23:37:04,655] Trial 172 finished with value: 1.0714285714285714 and parameters: {'x_0_0': 'ad', 'x_0_1': 'oo', 'x_1_0': 'ac', 'x_1_1': 'ab'}. Best is trial 165 with value: 0.5.
[I 2024-12-06 23:37:04,658] Trial 172 finished with value: 1.5 and parameters: {'x_0_0': 'cd', 'x_0_1': 'oo', 'x_1_0': 'ac', 'x_1_1': 'bc'}. Best is trial 63 with value: 0.5.
[I 2024-12-06 23:37:04,660] Trial 172 finished with value: 0.9464285714285714 and parameters: {'x_0_0': 'ad', 'x_0_1': 'oo', 'x_1_0': 'ad', 'x_1_1': 'oo'}. Best is trial 76 with value: 0.5.
2024-12-06 23:37:04,724 - INFO - Candidate Mean Stats: {'Max': np.float64(3.440295289730325), 'Min': np.float64(-1.0786258057878637), 'Mean': np.float64(0.394450770989096), 'Std': np.float64(0.5541092967973361)}
2024-12-06 23:37:04,724 - INFO - Candidate Std Stats: {'Max': np.float64(1.987145120192309), 'Min': np.float64(0.0), 'Mean': np.float64(0.6537099205730521), 'Std': np.float64(0.3205034194420613)}
[I 2024-12-06 23:37:04,737] Trial 171 finished with value: 1.0714285714285714 and parameters: {'x_0_0': 'bc', 'x_0_1': 'oo', 'x_1_0': 'cd', 'x_1_1': 'bd'}. Best is trial 23 with value: 0.5.
2024-12-06 23:37:04,992 - INFO - Candidate Mean Stats: {'Max': np.float64(2.713595932916328), 'Min': np.float64(-0.9212652649298165), 'Mean': np.float64(0.5141203865426196), 'Std': np.float64(0.5179159575977241)}
2024-12-06 23:37:04,992 - INFO - Candidate Std Stats: {'Max': np.float64(1.6567619477112965), 'Min': np.float64(0.0), 'Mean': np.float64(0.6122286852546929), 'Std': np.float64(0.2949172794619783)}
2024-12-06 23:37:04,996 - INFO - Candidate Mean Stats: {'Max': np.float64(2.3740274177847533), 'Min': np.float64(-0.9333369089755859), 'Mean': np.float64(0.4363097094659452), 'Std': np.float64(0.48143592918427064)}
2024-12-06 23:37:04,996 - INFO - Candidate Std Stats: {'Max': np.float64(1.8025720714954216), 'Min': np.float64(0.0), 'Mean': np.float64(0.6075771297362709), 'Std': np.float64(0.28836271525042695)}
2024-12-06 23:37:04,998 - INFO - Candidate Mean Stats: {'Max': np.float64(3.59679467249173), 'Min': np.float64(-1.6655068674115703), 'Mean': np.float64(0.30537471682876155), 'Std': np.float64(0.714654794875455)}
2024-12-06 23:37:04,998 - INFO - Candidate Std Stats: {'Max': np.float64(2.0826484641171787), 'Min': np.float64(0.0), 'Mean': np.float64(0.7619803517026404), 'Std': np.float64(0.3712475946009288)}
[I 2024-12-06 23:37:05,006] Trial 173 finished with value: 1.125 and parameters: {'x_0_0': 'oo', 'x_0_1': 'oo', 'x_1_0': 'oo', 'x_1_1': 'bc'}. Best is trial 165 with value: 0.5.
[I 2024-12-06 23:37:05,009] Trial 173 finished with value: 0.8214285714285714 and parameters: {'x_0_0': 'bd', 'x_0_1': 'oo', 'x_1_0': 'oo', 'x_1_1': 'ac'}. Best is trial 63 with value: 0.5.
[I 2024-12-06 23:37:05,011] Trial 173 finished with value: 1.0714285714285714 and parameters: {'x_0_0': 'bd', 'x_0_1': 'oo', 'x_1_0': 'ad', 'x_1_1': 'bc'}. Best is trial 76 with value: 0.5.
2024-12-06 23:37:05,081 - INFO - Candidate Mean Stats: {'Max': np.float64(3.1609569019659203), 'Min': np.float64(-0.9604728848609885), 'Mean': np.float64(0.47867790546516253), 'Std': np.float64(0.537723941627897)}
2024-12-06 23:37:05,081 - INFO - Candidate Std Stats: {'Max': np.float64(1.5629324575835042), 'Min': np.float64(0.0), 'Mean': np.float64(0.5864277400424692), 'Std': np.float64(0.28942712018596634)}
[I 2024-12-06 23:37:05,094] Trial 172 finished with value: 1.0714285714285714 and parameters: {'x_0_0': 'ac', 'x_0_1': 'oo', 'x_1_0': 'ad', 'x_1_1': 'bc'}. Best is trial 23 with value: 0.5.
2024-12-06 23:37:05,346 - INFO - Candidate Mean Stats: {'Max': np.float64(2.664682598729872), 'Min': np.float64(-0.9881122868232503), 'Mean': np.float64(0.5093461153484276), 'Std': np.float64(0.5303795720943792)}
2024-12-06 23:37:05,346 - INFO - Candidate Std Stats: {'Max': np.float64(1.5235558080023146), 'Min': np.float64(0.0), 'Mean': np.float64(0.558503423000627), 'Std': np.float64(0.27409730369903085)}
2024-12-06 23:37:05,349 - INFO - Candidate Mean Stats: {'Max': np.float64(3.0671041512512254), 'Min': np.float64(-0.8685208840966221), 'Mean': np.float64(0.45266720530436333), 'Std': np.float64(0.4783354742075332)}
2024-12-06 23:37:05,349 - INFO - Candidate Std Stats: {'Max': np.float64(1.6342070708272942), 'Min': np.float64(0.0), 'Mean': np.float64(0.5416793939399269), 'Std': np.float64(0.28416380499956306)}
2024-12-06 23:37:05,353 - INFO - Candidate Mean Stats: {'Max': np.float64(3.1578175805410016), 'Min': np.float64(-1.1576614905278113), 'Mean': np.float64(0.4330194904539747), 'Std': np.float64(0.5814745276697247)}
2024-12-06 23:37:05,353 - INFO - Candidate Std Stats: {'Max': np.float64(1.6345065766647806), 'Min': np.float64(0.0), 'Mean': np.float64(0.5699427613896757), 'Std': np.float64(0.2960383720995542)}
[I 2024-12-06 23:37:05,359] Trial 174 finished with value: 0.7857142857142857 and parameters: {'x_0_0': 'ad', 'x_0_1': 'oo', 'x_1_0': 'bc', 'x_1_1': 'bd'}. Best is trial 165 with value: 0.5.
[I 2024-12-06 23:37:05,362] Trial 174 finished with value: 1.0714285714285714 and parameters: {'x_0_0': 'bc', 'x_0_1': 'oo', 'x_1_0': 'bc', 'x_1_1': 'ab'}. Best is trial 63 with value: 0.5.
[I 2024-12-06 23:37:05,366] Trial 174 finished with value: 0.7857142857142857 and parameters: {'x_0_0': 'ad', 'x_0_1': 'oo', 'x_1_0': 'bd', 'x_1_1': 'ac'}. Best is trial 76 with value: 0.5.
2024-12-06 23:37:05,432 - INFO - Candidate Mean Stats: {'Max': np.float64(3.3176229766094414), 'Min': np.float64(-1.351368727312091), 'Mean': np.float64(0.31309732114412714), 'Std': np.float64(0.6509348193406638)}
2024-12-06 23:37:05,432 - INFO - Candidate Std Stats: {'Max': np.float64(2.1527360060632), 'Min': np.float64(0.0), 'Mean': np.float64(0.7265884766499163), 'Std': np.float64(0.3704422215988216)}
[I 2024-12-06 23:37:05,446] Trial 173 finished with value: 1.5714285714285714 and parameters: {'x_0_0': 'bc', 'x_0_1': 'bd', 'x_1_0': 'ac', 'x_1_1': 'bd'}. Best is trial 23 with value: 0.5.
2024-12-06 23:37:05,698 - INFO - Candidate Mean Stats: {'Max': np.float64(2.7451490703140817), 'Min': np.float64(-0.8790412068507212), 'Mean': np.float64(0.5089748772293584), 'Std': np.float64(0.5000781574645111)}
2024-12-06 23:37:05,699 - INFO - Candidate Std Stats: {'Max': np.float64(1.5837769328160924), 'Min': np.float64(0.0), 'Mean': np.float64(0.5975091718247706), 'Std': np.float64(0.2821334589176764)}
2024-12-06 23:37:05,704 - INFO - Candidate Mean Stats: {'Max': np.float64(2.4321637096836914), 'Min': np.float64(-0.8662639369068221), 'Mean': np.float64(0.516432854638943), 'Std': np.float64(0.4735299127569236)}
2024-12-06 23:37:05,704 - INFO - Candidate Std Stats: {'Max': np.float64(1.9532652934441974), 'Min': np.float64(0.0), 'Mean': np.float64(0.5074619186282435), 'Std': np.float64(0.2680689432348182)}
2024-12-06 23:37:05,706 - INFO - Candidate Mean Stats: {'Max': np.float64(2.9440412155378572), 'Min': np.float64(-1.01410634893276), 'Mean': np.float64(0.4741226007820736), 'Std': np.float64(0.5473769687460154)}
2024-12-06 23:37:05,707 - INFO - Candidate Std Stats: {'Max': np.float64(1.5365386926153124), 'Min': np.float64(0.0), 'Mean': np.float64(0.5684589537183837), 'Std': np.float64(0.2913050354660582)}
[I 2024-12-06 23:37:05,712] Trial 175 finished with value: 1.0714285714285714 and parameters: {'x_0_0': 'bc', 'x_0_1': 'oo', 'x_1_0': 'cd', 'x_1_1': 'ab'}. Best is trial 165 with value: 0.5.
[I 2024-12-06 23:37:05,717] Trial 175 finished with value: 1.0892857142857144 and parameters: {'x_0_0': 'ab', 'x_0_1': 'oo', 'x_1_0': 'cd', 'x_1_1': 'oo'}. Best is trial 63 with value: 0.5.
[I 2024-12-06 23:37:05,719] Trial 175 finished with value: 0.7857142857142857 and parameters: {'x_0_0': 'bd', 'x_0_1': 'oo', 'x_1_0': 'bd', 'x_1_1': 'cd'}. Best is trial 76 with value: 0.5.
2024-12-06 23:37:05,788 - INFO - Candidate Mean Stats: {'Max': np.float64(2.950196703748173), 'Min': np.float64(-1.1622453196889306), 'Mean': np.float64(0.46786635714089636), 'Std': np.float64(0.5448204802200346)}
2024-12-06 23:37:05,788 - INFO - Candidate Std Stats: {'Max': np.float64(1.8350424747963756), 'Min': np.float64(0.0), 'Mean': np.float64(0.6337057730495336), 'Std': np.float64(0.3252137205212674)}
[I 2024-12-06 23:37:05,801] Trial 174 finished with value: 1.3214285714285714 and parameters: {'x_0_0': 'bd', 'x_0_1': 'ac', 'x_1_0': 'oo', 'x_1_1': 'bc'}. Best is trial 23 with value: 0.5.
2024-12-06 23:37:06,052 - INFO - Candidate Mean Stats: {'Max': np.float64(2.8245347119805375), 'Min': np.float64(-1.372959065435802), 'Mean': np.float64(0.45444964984177433), 'Std': np.float64(0.5603657043731196)}
2024-12-06 23:37:06,052 - INFO - Candidate Std Stats: {'Max': np.float64(1.5955575463846663), 'Min': np.float64(0.0), 'Mean': np.float64(0.5978371063923462), 'Std': np.float64(0.28539046773010396)}
2024-12-06 23:37:06,059 - INFO - Candidate Mean Stats: {'Max': np.float64(2.6002580123265355), 'Min': np.float64(-0.7642750659730331), 'Mean': np.float64(0.5260223926436163), 'Std': np.float64(0.4888564474519744)}
2024-12-06 23:37:06,059 - INFO - Candidate Std Stats: {'Max': np.float64(1.4756795032049617), 'Min': np.float64(0.0), 'Mean': np.float64(0.536775551640917), 'Std': np.float64(0.270939633849351)}
2024-12-06 23:37:06,061 - INFO - Candidate Mean Stats: {'Max': np.float64(3.1627502286153284), 'Min': np.float64(-1.586204770061727), 'Mean': np.float64(0.37103746093128936), 'Std': np.float64(0.6560633967548869)}
2024-12-06 23:37:06,061 - INFO - Candidate Std Stats: {'Max': np.float64(1.7244160075187298), 'Min': np.float64(0.0), 'Mean': np.float64(0.6064762805903225), 'Std': np.float64(0.3058097881924246)}
[I 2024-12-06 23:37:06,066] Trial 176 finished with value: 1.0714285714285714 and parameters: {'x_0_0': 'ad', 'x_0_1': 'oo', 'x_1_0': 'ad', 'x_1_1': 'ad'}. Best is trial 165 with value: 0.5.
[I 2024-12-06 23:37:06,073] Trial 176 finished with value: 0.7857142857142857 and parameters: {'x_0_0': 'bd', 'x_0_1': 'oo', 'x_1_0': 'bd', 'x_1_1': 'ab'}. Best is trial 63 with value: 0.5.
[I 2024-12-06 23:37:06,074] Trial 176 finished with value: 0.9464285714285714 and parameters: {'x_0_0': 'ac', 'x_0_1': 'oo', 'x_1_0': 'ac', 'x_1_1': 'oo'}. Best is trial 76 with value: 0.5.
2024-12-06 23:37:06,142 - INFO - Candidate Mean Stats: {'Max': np.float64(2.6829013803668973), 'Min': np.float64(-1.6571546489440376), 'Mean': np.float64(0.37587948498934887), 'Std': np.float64(0.6187693076311336)}
2024-12-06 23:37:06,142 - INFO - Candidate Std Stats: {'Max': np.float64(2.012360567330389), 'Min': np.float64(0.0), 'Mean': np.float64(0.6223015129654398), 'Std': np.float64(0.33426488532631593)}
[I 2024-12-06 23:37:06,156] Trial 175 finished with value: 1.0714285714285714 and parameters: {'x_0_0': 'ac', 'x_0_1': 'oo', 'x_1_0': 'ab', 'x_1_1': 'ad'}. Best is trial 23 with value: 0.5.
2024-12-06 23:37:06,406 - INFO - Candidate Mean Stats: {'Max': np.float64(2.3288318516387934), 'Min': np.float64(-0.6708257155221655), 'Mean': np.float64(0.5790994232798218), 'Std': np.float64(0.474688469199354)}
2024-12-06 23:37:06,406 - INFO - Candidate Std Stats: {'Max': np.float64(1.655422379051906), 'Min': np.float64(0.0), 'Mean': np.float64(0.5353433155880771), 'Std': np.float64(0.25742481540653517)}
2024-12-06 23:37:06,414 - INFO - Candidate Mean Stats: {'Max': np.float64(2.514647071119865), 'Min': np.float64(-1.331047161444436), 'Mean': np.float64(0.40476429299742583), 'Std': np.float64(0.541605030028231)}
2024-12-06 23:37:06,414 - INFO - Candidate Std Stats: {'Max': np.float64(2.0159475504591167), 'Min': np.float64(0.0), 'Mean': np.float64(0.5835663852420901), 'Std': np.float64(0.30105724453368155)}
2024-12-06 23:37:06,415 - INFO - Candidate Mean Stats: {'Max': np.float64(3.528148135778081), 'Min': np.float64(-1.2758528070290356), 'Mean': np.float64(0.46010592070673906), 'Std': np.float64(0.5789814866177585)}
2024-12-06 23:37:06,416 - INFO - Candidate Std Stats: {'Max': np.float64(1.8323410969459588), 'Min': np.float64(0.0), 'Mean': np.float64(0.619402006081092), 'Std': np.float64(0.3007123572333123)}
[I 2024-12-06 23:37:06,420] Trial 177 finished with value: 1.0714285714285714 and parameters: {'x_0_0': 'bc', 'x_0_1': 'oo', 'x_1_0': 'bc', 'x_1_1': 'ac'}. Best is trial 165 with value: 0.5.
[I 2024-12-06 23:37:06,427] Trial 177 finished with value: 1.1964285714285714 and parameters: {'x_0_0': 'bd', 'x_0_1': 'bc', 'x_1_0': 'oo', 'x_1_1': 'oo'}. Best is trial 63 with value: 0.5.
[I 2024-12-06 23:37:06,428] Trial 177 finished with value: 1.375 and parameters: {'x_0_0': 'oo', 'x_0_1': 'oo', 'x_1_0': 'ad', 'x_1_1': 'ab'}. Best is trial 76 with value: 0.5.
2024-12-06 23:37:06,501 - INFO - Candidate Mean Stats: {'Max': np.float64(3.2765712443338897), 'Min': np.float64(-1.260746029784229), 'Mean': np.float64(0.43332310663628404), 'Std': np.float64(0.6161673560197922)}
2024-12-06 23:37:06,501 - INFO - Candidate Std Stats: {'Max': np.float64(1.7807778559431442), 'Min': np.float64(0.0), 'Mean': np.float64(0.6327346506737793), 'Std': np.float64(0.30904713128930017)}
[I 2024-12-06 23:37:06,514] Trial 176 finished with value: 0.9464285714285714 and parameters: {'x_0_0': 'ac', 'x_0_1': 'oo', 'x_1_0': 'cd', 'x_1_1': 'oo'}. Best is trial 23 with value: 0.5.
2024-12-06 23:37:06,765 - INFO - Candidate Mean Stats: {'Max': np.float64(2.577441776003714), 'Min': np.float64(-1.0602984599192629), 'Mean': np.float64(0.4575062106126371), 'Std': np.float64(0.508730943152495)}
2024-12-06 23:37:06,765 - INFO - Candidate Std Stats: {'Max': np.float64(1.4554053750951306), 'Min': np.float64(0.0), 'Mean': np.float64(0.5788814054503293), 'Std': np.float64(0.2725047024599048)}
2024-12-06 23:37:06,770 - INFO - Candidate Mean Stats: {'Max': np.float64(2.357945623620842), 'Min': np.float64(-1.3349698368664207), 'Mean': np.float64(0.43564005384550547), 'Std': np.float64(0.5095803764585953)}
2024-12-06 23:37:06,771 - INFO - Candidate Std Stats: {'Max': np.float64(1.6846799013123062), 'Min': np.float64(0.0), 'Mean': np.float64(0.6182713145608488), 'Std': np.float64(0.3109659542315761)}
2024-12-06 23:37:06,776 - INFO - Candidate Mean Stats: {'Max': np.float64(3.144327844805355), 'Min': np.float64(-1.0133785662664072), 'Mean': np.float64(0.42083173229252685), 'Std': np.float64(0.5655581733130061)}
2024-12-06 23:37:06,776 - INFO - Candidate Std Stats: {'Max': np.float64(1.5709575648406018), 'Min': np.float64(0.0), 'Mean': np.float64(0.6546293501325421), 'Std': np.float64(0.3128933959981909)}
[I 2024-12-06 23:37:06,780] Trial 178 finished with value: 1.0714285714285714 and parameters: {'x_0_0': 'ad', 'x_0_1': 'oo', 'x_1_0': 'ad', 'x_1_1': 'ab'}. Best is trial 165 with value: 0.5.
[I 2024-12-06 23:37:06,786] Trial 178 finished with value: 1.375 and parameters: {'x_0_0': 'oo', 'x_0_1': 'oo', 'x_1_0': 'cd', 'x_1_1': 'cd'}. Best is trial 63 with value: 0.5.
[I 2024-12-06 23:37:06,789] Trial 178 finished with value: 0.9464285714285714 and parameters: {'x_0_0': 'bc', 'x_0_1': 'oo', 'x_1_0': 'bd', 'x_1_1': 'oo'}. Best is trial 76 with value: 0.5.
2024-12-06 23:37:06,866 - INFO - Candidate Mean Stats: {'Max': np.float64(2.5882849606343035), 'Min': np.float64(-0.971581100723197), 'Mean': np.float64(0.5085667394265552), 'Std': np.float64(0.5090208046855262)}
2024-12-06 23:37:06,866 - INFO - Candidate Std Stats: {'Max': np.float64(1.623022212174474), 'Min': np.float64(0.0), 'Mean': np.float64(0.5452171950707025), 'Std': np.float64(0.2662686493307781)}
