[I 2024-12-06 23:36:30,663] Trial 79 finished with value: 1.1964285714285714 and parameters: {'x_0_0': 'bd', 'x_0_1': 'bd', 'x_1_0': 'oo', 'x_1_1': 'oo'}. Best is trial 76 with value: 0.5.
2024-12-06 23:36:30,843 - INFO - Candidate Mean Stats: {'Max': np.float64(2.0), 'Min': np.float64(-0.8825259423971967), 'Mean': np.float64(0.32676518694893103), 'Std': np.float64(0.4194894455260097)}
2024-12-06 23:36:30,843 - INFO - Candidate Std Stats: {'Max': np.float64(1.247881724899986), 'Min': np.float64(0.0), 'Mean': np.float64(0.49260316905609575), 'Std': np.float64(0.2138814288885427)}
[I 2024-12-06 23:36:30,855] Trial 79 finished with value: 0.9285714285714286 and parameters: {'x_0_0': 'bd', 'x_0_1': 'oo', 'x_1_0': 'ab', 'x_1_1': 'ac'}. Best is trial 23 with value: 0.5.
2024-12-06 23:36:30,933 - INFO - Candidate Mean Stats: {'Max': np.float64(2.0), 'Min': np.float64(-1.0130914876903965), 'Mean': np.float64(0.305137923020607), 'Std': np.float64(0.4603005670408317)}
2024-12-06 23:36:30,933 - INFO - Candidate Std Stats: {'Max': np.float64(1.4348269264119318), 'Min': np.float64(0.0), 'Mean': np.float64(0.5481871913225772), 'Std': np.float64(0.24215657196086968)}
[I 2024-12-06 23:36:30,945] Trial 80 finished with value: 1.0714285714285714 and parameters: {'x_0_0': 'bd', 'x_0_1': 'oo', 'x_1_0': 'ad', 'x_1_1': 'cd'}. Best is trial 63 with value: 0.5.
2024-12-06 23:36:30,967 - INFO - Candidate Mean Stats: {'Max': np.float64(2.4098915996677746), 'Min': np.float64(-1.3454034014444765), 'Mean': np.float64(0.27949587630519007), 'Std': np.float64(0.49823636201742044)}
2024-12-06 23:36:30,967 - INFO - Candidate Std Stats: {'Max': np.float64(1.9942228813743748), 'Min': np.float64(0.0), 'Mean': np.float64(0.6443042732628557), 'Std': np.float64(0.2947967928175021)}
2024-12-06 23:36:30,975 - INFO - Candidate Mean Stats: {'Max': np.float64(2.0975827945867467), 'Min': np.float64(-0.9839232189680214), 'Mean': np.float64(0.32780822352385547), 'Std': np.float64(0.46410899495814883)}
2024-12-06 23:36:30,975 - INFO - Candidate Std Stats: {'Max': np.float64(1.6687985897307882), 'Min': np.float64(0.0), 'Mean': np.float64(0.5882980902392219), 'Std': np.float64(0.26551927144196014)}
[I 2024-12-06 23:36:30,979] Trial 80 finished with value: 0.8214285714285714 and parameters: {'x_0_0': 'bd', 'x_0_1': 'oo', 'x_1_0': 'oo', 'x_1_1': 'bc'}. Best is trial 50 with value: 0.6607142857142857.
[I 2024-12-06 23:36:30,987] Trial 80 finished with value: 1.1785714285714286 and parameters: {'x_0_0': 'bc', 'x_0_1': 'ab', 'x_1_0': 'oo', 'x_1_1': 'ac'}. Best is trial 76 with value: 0.5.
2024-12-06 23:36:31,169 - INFO - Candidate Mean Stats: {'Max': np.float64(2.0), 'Min': np.float64(-1.1215177925682918), 'Mean': np.float64(0.3667861411816058), 'Std': np.float64(0.4168762290080353)}
2024-12-06 23:36:31,169 - INFO - Candidate Std Stats: {'Max': np.float64(1.4702940454790947), 'Min': np.float64(0.0), 'Mean': np.float64(0.4589785368540583), 'Std': np.float64(0.20656376587831804)}
[I 2024-12-06 23:36:31,180] Trial 80 finished with value: 0.6964285714285714 and parameters: {'x_0_0': 'bd', 'x_0_1': 'oo', 'x_1_0': 'oo', 'x_1_1': 'oo'}. Best is trial 23 with value: 0.5.
2024-12-06 23:36:31,259 - INFO - Candidate Mean Stats: {'Max': np.float64(2.0), 'Min': np.float64(-1.0059668985660393), 'Mean': np.float64(0.34460220908145683), 'Std': np.float64(0.41889286500035605)}
2024-12-06 23:36:31,259 - INFO - Candidate Std Stats: {'Max': np.float64(1.6459026381137318), 'Min': np.float64(0.0), 'Mean': np.float64(0.5601114108413503), 'Std': np.float64(0.26931482559570186)}
[I 2024-12-06 23:36:31,272] Trial 81 finished with value: 1.3214285714285714 and parameters: {'x_0_0': 'ad', 'x_0_1': 'cd', 'x_1_0': 'oo', 'x_1_1': 'bd'}. Best is trial 63 with value: 0.5.
2024-12-06 23:36:31,294 - INFO - Candidate Mean Stats: {'Max': np.float64(2.0), 'Min': np.float64(-1.2483103251261063), 'Mean': np.float64(0.3573650598138996), 'Std': np.float64(0.49340997183490143)}
2024-12-06 23:36:31,294 - INFO - Candidate Std Stats: {'Max': np.float64(1.6925952130789577), 'Min': np.float64(0.0), 'Mean': np.float64(0.5521081592042282), 'Std': np.float64(0.2581786551332003)}
2024-12-06 23:36:31,302 - INFO - Candidate Mean Stats: {'Max': np.float64(2.325203438227097), 'Min': np.float64(-1.020464321598937), 'Mean': np.float64(0.29849843123878383), 'Std': np.float64(0.476458636811575)}
2024-12-06 23:36:31,302 - INFO - Candidate Std Stats: {'Max': np.float64(1.488560269770502), 'Min': np.float64(0.0), 'Mean': np.float64(0.5508906701339858), 'Std': np.float64(0.23474156425459913)}
[I 2024-12-06 23:36:31,308] Trial 81 finished with value: 0.8214285714285714 and parameters: {'x_0_0': 'ad', 'x_0_1': 'oo', 'x_1_0': 'oo', 'x_1_1': 'bc'}. Best is trial 50 with value: 0.6607142857142857.
[I 2024-12-06 23:36:31,315] Trial 81 finished with value: 0.8214285714285714 and parameters: {'x_0_0': 'bc', 'x_0_1': 'oo', 'x_1_0': 'oo', 'x_1_1': 'bc'}. Best is trial 76 with value: 0.5.
2024-12-06 23:36:31,492 - INFO - Candidate Mean Stats: {'Max': np.float64(2.1950336932762973), 'Min': np.float64(-1.016165677902862), 'Mean': np.float64(0.3234526001119525), 'Std': np.float64(0.46781703332337654)}
2024-12-06 23:36:31,492 - INFO - Candidate Std Stats: {'Max': np.float64(1.6349578072199993), 'Min': np.float64(0.0), 'Mean': np.float64(0.5814149590134995), 'Std': np.float64(0.251193212681693)}
[I 2024-12-06 23:36:31,505] Trial 81 finished with value: 1.0714285714285714 and parameters: {'x_0_0': 'bc', 'x_0_1': 'oo', 'x_1_0': 'cd', 'x_1_1': 'ac'}. Best is trial 23 with value: 0.5.
2024-12-06 23:36:31,583 - INFO - Candidate Mean Stats: {'Max': np.float64(2.0), 'Min': np.float64(-0.744694971634714), 'Mean': np.float64(0.29428119943770825), 'Std': np.float64(0.4432956090142292)}
2024-12-06 23:36:31,584 - INFO - Candidate Std Stats: {'Max': np.float64(1.857215918842306), 'Min': np.float64(0.0), 'Mean': np.float64(0.5673694480882515), 'Std': np.float64(0.2601528188587069)}
[I 2024-12-06 23:36:31,596] Trial 82 finished with value: 1.0714285714285714 and parameters: {'x_0_0': 'ac', 'x_0_1': 'oo', 'x_1_0': 'ab', 'x_1_1': 'bc'}. Best is trial 63 with value: 0.5.
2024-12-06 23:36:31,622 - INFO - Candidate Mean Stats: {'Max': np.float64(2.0), 'Min': np.float64(-1.3835517907100987), 'Mean': np.float64(0.22136255865189758), 'Std': np.float64(0.4902202537335985)}
2024-12-06 23:36:31,622 - INFO - Candidate Std Stats: {'Max': np.float64(2.060117322591775), 'Min': np.float64(0.0), 'Mean': np.float64(0.6378170222120182), 'Std': np.float64(0.3117072638383555)}
2024-12-06 23:36:31,627 - INFO - Candidate Mean Stats: {'Max': np.float64(2.2818696594047885), 'Min': np.float64(-0.9644199975628792), 'Mean': np.float64(0.3629464869583969), 'Std': np.float64(0.46670327573739245)}
2024-12-06 23:36:31,627 - INFO - Candidate Std Stats: {'Max': np.float64(1.3545009899350728), 'Min': np.float64(0.0), 'Mean': np.float64(0.4935969109322113), 'Std': np.float64(0.2269590238263609)}
[I 2024-12-06 23:36:31,634] Trial 82 finished with value: 1.0714285714285714 and parameters: {'x_0_0': 'ad', 'x_0_1': 'oo', 'x_1_0': 'ac', 'x_1_1': 'ad'}. Best is trial 50 with value: 0.6607142857142857.
[I 2024-12-06 23:36:31,639] Trial 82 finished with value: 1.0714285714285714 and parameters: {'x_0_0': 'ac', 'x_0_1': 'oo', 'x_1_0': 'bd', 'x_1_1': 'ac'}. Best is trial 76 with value: 0.5.
2024-12-06 23:36:31,825 - INFO - Candidate Mean Stats: {'Max': np.float64(2.0), 'Min': np.float64(-1.136871761629373), 'Mean': np.float64(0.33978410689528893), 'Std': np.float64(0.45620552996759334)}
2024-12-06 23:36:31,825 - INFO - Candidate Std Stats: {'Max': np.float64(1.468017297746651), 'Min': np.float64(0.0), 'Mean': np.float64(0.573433779603954), 'Std': np.float64(0.2470633738346111)}
[I 2024-12-06 23:36:31,836] Trial 82 finished with value: 1.0714285714285714 and parameters: {'x_0_0': 'bc', 'x_0_1': 'oo', 'x_1_0': 'ad', 'x_1_1': 'ac'}. Best is trial 23 with value: 0.5.
2024-12-06 23:36:31,912 - INFO - Candidate Mean Stats: {'Max': np.float64(2.0348132360664155), 'Min': np.float64(-0.9306869190422328), 'Mean': np.float64(0.34940752689477317), 'Std': np.float64(0.48094650531784894)}
2024-12-06 23:36:31,912 - INFO - Candidate Std Stats: {'Max': np.float64(1.5908802163703266), 'Min': np.float64(0.0), 'Mean': np.float64(0.5726777611263465), 'Std': np.float64(0.25767395168571433)}
[I 2024-12-06 23:36:31,924] Trial 83 finished with value: 1.0714285714285714 and parameters: {'x_0_0': 'ac', 'x_0_1': 'oo', 'x_1_0': 'cd', 'x_1_1': 'cd'}. Best is trial 63 with value: 0.5.
2024-12-06 23:36:31,948 - INFO - Candidate Mean Stats: {'Max': np.float64(2.2405840903342176), 'Min': np.float64(-0.8345642977744389), 'Mean': np.float64(0.3703895578700127), 'Std': np.float64(0.4542388124579554)}
2024-12-06 23:36:31,949 - INFO - Candidate Std Stats: {'Max': np.float64(1.4822029815000393), 'Min': np.float64(0.0), 'Mean': np.float64(0.5764861104555187), 'Std': np.float64(0.24826311003250948)}
2024-12-06 23:36:31,955 - INFO - Candidate Mean Stats: {'Max': np.float64(2.0), 'Min': np.float64(-1.253585360192596), 'Mean': np.float64(0.3000324665595575), 'Std': np.float64(0.4969563198258309)}
2024-12-06 23:36:31,955 - INFO - Candidate Std Stats: {'Max': np.float64(1.5965220446487707), 'Min': np.float64(0.0), 'Mean': np.float64(0.5772696668925518), 'Std': np.float64(0.2538264497295323)}
[I 2024-12-06 23:36:31,962] Trial 83 finished with value: 0.7857142857142857 and parameters: {'x_0_0': 'bd', 'x_0_1': 'oo', 'x_1_0': 'bd', 'x_1_1': 'bc'}. Best is trial 50 with value: 0.6607142857142857.
[I 2024-12-06 23:36:31,967] Trial 83 finished with value: 1.1607142857142856 and parameters: {'x_0_0': 'ad', 'x_0_1': 'bd', 'x_1_0': 'bc', 'x_1_1': 'oo'}. Best is trial 76 with value: 0.5.
2024-12-06 23:36:32,156 - INFO - Candidate Mean Stats: {'Max': np.float64(2.0156922894938107), 'Min': np.float64(-0.9604823557095463), 'Mean': np.float64(0.32219294332077775), 'Std': np.float64(0.4693936817361832)}
2024-12-06 23:36:32,156 - INFO - Candidate Std Stats: {'Max': np.float64(1.4520490076750252), 'Min': np.float64(0.0), 'Mean': np.float64(0.5625692095130111), 'Std': np.float64(0.23523284522752183)}
[I 2024-12-06 23:36:32,168] Trial 83 finished with value: 1.0714285714285714 and parameters: {'x_0_0': 'bd', 'x_0_1': 'oo', 'x_1_0': 'ac', 'x_1_1': 'ac'}. Best is trial 23 with value: 0.5.
2024-12-06 23:36:32,242 - INFO - Candidate Mean Stats: {'Max': np.float64(2.1417266622115823), 'Min': np.float64(-1.4127434050086596), 'Mean': np.float64(0.28589108949730174), 'Std': np.float64(0.5072033926129496)}
2024-12-06 23:36:32,242 - INFO - Candidate Std Stats: {'Max': np.float64(1.5193866769675288), 'Min': np.float64(0.0), 'Mean': np.float64(0.5694443151524835), 'Std': np.float64(0.2515362744596096)}
[I 2024-12-06 23:36:32,255] Trial 84 finished with value: 1.0714285714285714 and parameters: {'x_0_0': 'bc', 'x_0_1': 'oo', 'x_1_0': 'bd', 'x_1_1': 'cd'}. Best is trial 63 with value: 0.5.
2024-12-06 23:36:32,285 - INFO - Candidate Mean Stats: {'Max': np.float64(2.5321424264839516), 'Min': np.float64(-1.216469852002711), 'Mean': np.float64(0.36819303595768754), 'Std': np.float64(0.4776256198232722)}
2024-12-06 23:36:32,286 - INFO - Candidate Std Stats: {'Max': np.float64(1.5536263438916025), 'Min': np.float64(0.0), 'Mean': np.float64(0.5371648244684561), 'Std': np.float64(0.2439740777482842)}
2024-12-06 23:36:32,292 - INFO - Candidate Mean Stats: {'Max': np.float64(2.1865421228017405), 'Min': np.float64(-0.9997287918785013), 'Mean': np.float64(0.28571271246383023), 'Std': np.float64(0.4981932490073982)}
2024-12-06 23:36:32,292 - INFO - Candidate Std Stats: {'Max': np.float64(1.7399837208860498), 'Min': np.float64(0.0), 'Mean': np.float64(0.6538227140564409), 'Std': np.float64(0.28495901245895816)}
[I 2024-12-06 23:36:32,300] Trial 84 finished with value: 0.8214285714285714 and parameters: {'x_0_0': 'ad', 'x_0_1': 'oo', 'x_1_0': 'oo', 'x_1_1': 'ac'}. Best is trial 50 with value: 0.6607142857142857.
[I 2024-12-06 23:36:32,305] Trial 84 finished with value: 1.0714285714285714 and parameters: {'x_0_0': 'ad', 'x_0_1': 'oo', 'x_1_0': 'cd', 'x_1_1': 'ac'}. Best is trial 76 with value: 0.5.
2024-12-06 23:36:32,493 - INFO - Candidate Mean Stats: {'Max': np.float64(2.1630534927237113), 'Min': np.float64(-1.2220057751043896), 'Mean': np.float64(0.3357725029416018), 'Std': np.float64(0.44466212049062886)}
2024-12-06 23:36:32,493 - INFO - Candidate Std Stats: {'Max': np.float64(1.6408835349318378), 'Min': np.float64(0.0), 'Mean': np.float64(0.5289660584852374), 'Std': np.float64(0.24144435941527265)}
[I 2024-12-06 23:36:32,509] Trial 84 finished with value: 0.7857142857142857 and parameters: {'x_0_0': 'bd', 'x_0_1': 'oo', 'x_1_0': 'bd', 'x_1_1': 'bc'}. Best is trial 23 with value: 0.5.
2024-12-06 23:36:32,580 - INFO - Candidate Mean Stats: {'Max': np.float64(2.0038209689712145), 'Min': np.float64(-0.8294542599489736), 'Mean': np.float64(0.3169520855891485), 'Std': np.float64(0.4458200382871987)}
2024-12-06 23:36:32,580 - INFO - Candidate Std Stats: {'Max': np.float64(1.5477849826575134), 'Min': np.float64(0.0), 'Mean': np.float64(0.5222769361637537), 'Std': np.float64(0.23390365025514154)}
[I 2024-12-06 23:36:32,593] Trial 85 finished with value: 1.0714285714285714 and parameters: {'x_0_0': 'ac', 'x_0_1': 'oo', 'x_1_0': 'bc', 'x_1_1': 'ad'}. Best is trial 63 with value: 0.5.
2024-12-06 23:36:32,626 - INFO - Candidate Mean Stats: {'Max': np.float64(2.00244324092544), 'Min': np.float64(-0.9611231245887927), 'Mean': np.float64(0.3261914104617189), 'Std': np.float64(0.46028671417798755)}
2024-12-06 23:36:32,626 - INFO - Candidate Std Stats: {'Max': np.float64(1.5096094799117201), 'Min': np.float64(0.0), 'Mean': np.float64(0.5287625344718219), 'Std': np.float64(0.24082843482450977)}
2024-12-06 23:36:32,627 - INFO - Candidate Mean Stats: {'Max': np.float64(2.265324321131837), 'Min': np.float64(-1.1761539206562233), 'Mean': np.float64(0.24372723432632484), 'Std': np.float64(0.49191873893420607)}
2024-12-06 23:36:32,628 - INFO - Candidate Std Stats: {'Max': np.float64(2.0063465615664406), 'Min': np.float64(0.0), 'Mean': np.float64(0.6217713948336093), 'Std': np.float64(0.28637658082114903)}
[I 2024-12-06 23:36:32,639] Trial 85 finished with value: 1.0714285714285714 and parameters: {'x_0_0': 'bc', 'x_0_1': 'oo', 'x_1_0': 'bd', 'x_1_1': 'bc'}. Best is trial 50 with value: 0.6607142857142857.
[I 2024-12-06 23:36:32,640] Trial 85 finished with value: 1.125 and parameters: {'x_0_0': 'oo', 'x_0_1': 'oo', 'x_1_0': 'oo', 'x_1_1': 'ac'}. Best is trial 76 with value: 0.5.
2024-12-06 23:36:32,836 - INFO - Candidate Mean Stats: {'Max': np.float64(2.4071622952755094), 'Min': np.float64(-1.1087933249514137), 'Mean': np.float64(0.37482642272580013), 'Std': np.float64(0.4653988338501007)}
2024-12-06 23:36:32,837 - INFO - Candidate Std Stats: {'Max': np.float64(1.240593135279126), 'Min': np.float64(0.0), 'Mean': np.float64(0.5111680830527223), 'Std': np.float64(0.22139325496164955)}
[I 2024-12-06 23:36:32,849] Trial 85 finished with value: 0.8214285714285714 and parameters: {'x_0_0': 'bd', 'x_0_1': 'oo', 'x_1_0': 'oo', 'x_1_1': 'bc'}. Best is trial 23 with value: 0.5.
2024-12-06 23:36:32,913 - INFO - Candidate Mean Stats: {'Max': np.float64(2.0338861551744403), 'Min': np.float64(-0.8914388894061558), 'Mean': np.float64(0.3696473136704248), 'Std': np.float64(0.459240834529717)}
2024-12-06 23:36:32,913 - INFO - Candidate Std Stats: {'Max': np.float64(1.5583117921861005), 'Min': np.float64(0.0), 'Mean': np.float64(0.5051159999632481), 'Std': np.float64(0.22277237975586214)}
[I 2024-12-06 23:36:32,926] Trial 86 finished with value: 1.0714285714285714 and parameters: {'x_0_0': 'bc', 'x_0_1': 'oo', 'x_1_0': 'ad', 'x_1_1': 'cd'}. Best is trial 63 with value: 0.5.
2024-12-06 23:36:32,957 - INFO - Candidate Mean Stats: {'Max': np.float64(2.0), 'Min': np.float64(-1.169417556698962), 'Mean': np.float64(0.3322772556655745), 'Std': np.float64(0.5288036914440334)}
2024-12-06 23:36:32,957 - INFO - Candidate Std Stats: {'Max': np.float64(1.9338141668683952), 'Min': np.float64(0.0), 'Mean': np.float64(0.6106860826474524), 'Std': np.float64(0.2765916427189867)}
2024-12-06 23:36:32,961 - INFO - Candidate Mean Stats: {'Max': np.float64(2.009426801348645), 'Min': np.float64(-1.1318371461572423), 'Mean': np.float64(0.29626775380174514), 'Std': np.float64(0.4805753785908439)}
2024-12-06 23:36:32,961 - INFO - Candidate Std Stats: {'Max': np.float64(1.8390775065626648), 'Min': np.float64(0.0), 'Mean': np.float64(0.5772285541906933), 'Std': np.float64(0.2697804194603994)}
[I 2024-12-06 23:36:32,971] Trial 86 finished with value: 1.0714285714285714 and parameters: {'x_0_0': 'ad', 'x_0_1': 'oo', 'x_1_0': 'ac', 'x_1_1': 'bc'}. Best is trial 76 with value: 0.5.
[I 2024-12-06 23:36:32,974] Trial 86 finished with value: 1.4464285714285714 and parameters: {'x_0_0': 'bc', 'x_0_1': 'bc', 'x_1_0': 'cd', 'x_1_1': 'oo'}. Best is trial 50 with value: 0.6607142857142857.
2024-12-06 23:36:33,167 - INFO - Candidate Mean Stats: {'Max': np.float64(2.2097509809310814), 'Min': np.float64(-0.9582736678664359), 'Mean': np.float64(0.3091422923476952), 'Std': np.float64(0.4827170612568823)}
2024-12-06 23:36:33,167 - INFO - Candidate Std Stats: {'Max': np.float64(1.5187764956116905), 'Min': np.float64(0.0), 'Mean': np.float64(0.582521940495066), 'Std': np.float64(0.25436898239103195)}
[I 2024-12-06 23:36:33,180] Trial 86 finished with value: 0.6964285714285714 and parameters: {'x_0_0': 'ac', 'x_0_1': 'oo', 'x_1_0': 'oo', 'x_1_1': 'oo'}. Best is trial 23 with value: 0.5.
2024-12-06 23:36:33,253 - INFO - Candidate Mean Stats: {'Max': np.float64(2.0), 'Min': np.float64(-0.7458083414482826), 'Mean': np.float64(0.39893127123030275), 'Std': np.float64(0.388907304520512)}
2024-12-06 23:36:33,253 - INFO - Candidate Std Stats: {'Max': np.float64(1.4237600297172865), 'Min': np.float64(0.0), 'Mean': np.float64(0.4997935114117749), 'Std': np.float64(0.2315361713846786)}
[I 2024-12-06 23:36:33,268] Trial 87 finished with value: 1.0 and parameters: {'x_0_0': 'bd', 'x_0_1': 'cd', 'x_1_0': 'bc', 'x_1_1': 'ad'}. Best is trial 63 with value: 0.5.
2024-12-06 23:36:33,302 - INFO - Candidate Mean Stats: {'Max': np.float64(2.275014241410279), 'Min': np.float64(-1.202998581317985), 'Mean': np.float64(0.2641719223620837), 'Std': np.float64(0.5287362229973375)}
2024-12-06 23:36:33,303 - INFO - Candidate Std Stats: {'Max': np.float64(1.5001587605280193), 'Min': np.float64(0.0), 'Mean': np.float64(0.6040858424977097), 'Std': np.float64(0.2658853697619753)}
2024-12-06 23:36:33,311 - INFO - Candidate Mean Stats: {'Max': np.float64(2.2405656893685872), 'Min': np.float64(-1.0338591869068534), 'Mean': np.float64(0.3867075870953835), 'Std': np.float64(0.42673181353405243)}
2024-12-06 23:36:33,311 - INFO - Candidate Std Stats: {'Max': np.float64(1.4447324402224877), 'Min': np.float64(0.0), 'Mean': np.float64(0.5244690131516768), 'Std': np.float64(0.23015616930867414)}
[I 2024-12-06 23:36:33,316] Trial 87 finished with value: 1.0714285714285714 and parameters: {'x_0_0': 'bd', 'x_0_1': 'oo', 'x_1_0': 'ad', 'x_1_1': 'ab'}. Best is trial 76 with value: 0.5.
[I 2024-12-06 23:36:33,324] Trial 87 finished with value: 1.0714285714285714 and parameters: {'x_0_0': 'ac', 'x_0_1': 'oo', 'x_1_0': 'cd', 'x_1_1': 'bd'}. Best is trial 50 with value: 0.6607142857142857.
2024-12-06 23:36:33,524 - INFO - Candidate Mean Stats: {'Max': np.float64(2.0146036209245533), 'Min': np.float64(-1.0192731949727671), 'Mean': np.float64(0.32942796933261986), 'Std': np.float64(0.4366680205850218)}
2024-12-06 23:36:33,525 - INFO - Candidate Std Stats: {'Max': np.float64(1.718176645808978), 'Min': np.float64(0.0), 'Mean': np.float64(0.5869367556467304), 'Std': np.float64(0.25886803857131446)}
[I 2024-12-06 23:36:33,538] Trial 87 finished with value: 1.0714285714285714 and parameters: {'x_0_0': 'bd', 'x_0_1': 'oo', 'x_1_0': 'ac', 'x_1_1': 'bd'}. Best is trial 23 with value: 0.5.
2024-12-06 23:36:33,593 - INFO - Candidate Mean Stats: {'Max': np.float64(2.281302683592961), 'Min': np.float64(-1.1040034227590374), 'Mean': np.float64(0.2917938918299503), 'Std': np.float64(0.5169055858623425)}
2024-12-06 23:36:33,596 - INFO - Candidate Std Stats: {'Max': np.float64(1.5882400431769887), 'Min': np.float64(0.0), 'Mean': np.float64(0.5779214608707768), 'Std': np.float64(0.2581183779874189)}
[I 2024-12-06 23:36:33,608] Trial 88 finished with value: 1.0714285714285714 and parameters: {'x_0_0': 'ac', 'x_0_1': 'oo', 'x_1_0': 'cd', 'x_1_1': 'ad'}. Best is trial 63 with value: 0.5.
2024-12-06 23:36:33,646 - INFO - Candidate Mean Stats: {'Max': np.float64(2.129083095827478), 'Min': np.float64(-1.0164846443448552), 'Mean': np.float64(0.3598660723637755), 'Std': np.float64(0.47180538600810756)}
2024-12-06 23:36:33,646 - INFO - Candidate Std Stats: {'Max': np.float64(1.660954752028819), 'Min': np.float64(0.0), 'Mean': np.float64(0.6020492184018171), 'Std': np.float64(0.26152749742601006)}
[I 2024-12-06 23:36:33,659] Trial 88 finished with value: 0.8214285714285714 and parameters: {'x_0_0': 'ac', 'x_0_1': 'oo', 'x_1_0': 'oo', 'x_1_1': 'bd'}. Best is trial 76 with value: 0.5.
2024-12-06 23:36:33,659 - INFO - Candidate Mean Stats: {'Max': np.float64(2.22421875264748), 'Min': np.float64(-1.0668885750274333), 'Mean': np.float64(0.2556074169717911), 'Std': np.float64(0.47588866886884945)}
2024-12-06 23:36:33,660 - INFO - Candidate Std Stats: {'Max': np.float64(1.6146051383192053), 'Min': np.float64(0.0), 'Mean': np.float64(0.6242152924202238), 'Std': np.float64(0.2761912688666839)}
