[I 2024-12-06 23:36:14,885] Trial 34 finished with value: 1.1964285714285714 and parameters: {'x_0_0': 'bd', 'x_0_1': 'ab', 'x_1_0': 'oo', 'x_1_1': 'oo'}. Best is trial 31 with value: 0.6964285714285714.
2024-12-06 23:36:15,009 - INFO - Candidate Mean Stats: {'Max': np.float64(2.0), 'Min': np.float64(-1.30765440009696), 'Mean': np.float64(0.20929263302014817), 'Std': np.float64(0.43214722666945465)}
2024-12-06 23:36:15,009 - INFO - Candidate Std Stats: {'Max': np.float64(1.7574483209413139), 'Min': np.float64(0.0), 'Mean': np.float64(0.6146752530373755), 'Std': np.float64(0.25474224734895795)}
[I 2024-12-06 23:36:15,021] Trial 34 finished with value: 1.3214285714285714 and parameters: {'x_0_0': 'bd', 'x_0_1': 'bd', 'x_1_0': 'oo', 'x_1_1': 'ab'}. Best is trial 23 with value: 0.5.
2024-12-06 23:36:15,151 - INFO - Candidate Mean Stats: {'Max': np.float64(2.0), 'Min': np.float64(-1.034178321439137), 'Mean': np.float64(0.24506034446779243), 'Std': np.float64(0.3749419702324632)}
2024-12-06 23:36:15,151 - INFO - Candidate Std Stats: {'Max': np.float64(1.5343663296539705), 'Min': np.float64(0.0), 'Mean': np.float64(0.5299657376304688), 'Std': np.float64(0.22545556652287604)}
[I 2024-12-06 23:36:15,167] Trial 35 finished with value: 1.1785714285714286 and parameters: {'x_0_0': 'bc', 'x_0_1': 'ab', 'x_1_0': 'oo', 'x_1_1': 'ad'}. Best is trial 14 with value: 0.6428571428571428.
2024-12-06 23:36:15,206 - INFO - Candidate Mean Stats: {'Max': np.float64(2.0), 'Min': np.float64(-0.9467533731385803), 'Mean': np.float64(0.24106342640968526), 'Std': np.float64(0.37416031144177503)}
2024-12-06 23:36:15,206 - INFO - Candidate Std Stats: {'Max': np.float64(1.5809223559664929), 'Min': np.float64(0.0), 'Mean': np.float64(0.5686480720258272), 'Std': np.float64(0.23589815994951568)}
[I 2024-12-06 23:36:15,220] Trial 35 finished with value: 1.5714285714285714 and parameters: {'x_0_0': 'ac', 'x_0_1': 'bc', 'x_1_0': 'cd', 'x_1_1': 'ab'}. Best is trial 33 with value: 0.6964285714285714.
2024-12-06 23:36:15,222 - INFO - Candidate Mean Stats: {'Max': np.float64(2.0), 'Min': np.float64(-0.9350832669681374), 'Mean': np.float64(0.22603905942765426), 'Std': np.float64(0.39949177315677087)}
2024-12-06 23:36:15,222 - INFO - Candidate Std Stats: {'Max': np.float64(1.768755803217603), 'Min': np.float64(0.0), 'Mean': np.float64(0.6162487770300485), 'Std': np.float64(0.24918950955961233)}
[I 2024-12-06 23:36:15,236] Trial 35 finished with value: 1.5714285714285714 and parameters: {'x_0_0': 'bd', 'x_0_1': 'ac', 'x_1_0': 'ad', 'x_1_1': 'cd'}. Best is trial 31 with value: 0.6964285714285714.
2024-12-06 23:36:15,379 - INFO - Candidate Mean Stats: {'Max': np.float64(2.0), 'Min': np.float64(-1.1298761808159137), 'Mean': np.float64(0.20258136275084396), 'Std': np.float64(0.3888898739623529)}
2024-12-06 23:36:15,379 - INFO - Candidate Std Stats: {'Max': np.float64(1.5229971193970742), 'Min': np.float64(0.0), 'Mean': np.float64(0.5555694224446837), 'Std': np.float64(0.22336623177651865)}
[I 2024-12-06 23:36:15,393] Trial 35 finished with value: 1.0714285714285714 and parameters: {'x_0_0': 'ac', 'x_0_1': 'oo', 'x_1_0': 'ab', 'x_1_1': 'ac'}. Best is trial 23 with value: 0.5.
2024-12-06 23:36:15,515 - INFO - Candidate Mean Stats: {'Max': np.float64(2.0), 'Min': np.float64(-0.8642367007417615), 'Mean': np.float64(0.24407983908525563), 'Std': np.float64(0.3660000953606216)}
2024-12-06 23:36:15,515 - INFO - Candidate Std Stats: {'Max': np.float64(1.8706607560856636), 'Min': np.float64(0.0), 'Mean': np.float64(0.6581268742545427), 'Std': np.float64(0.2874788714744104)}
[I 2024-12-06 23:36:15,528] Trial 36 finished with value: 0.8214285714285714 and parameters: {'x_0_0': 'bc', 'x_0_1': 'oo', 'x_1_0': 'oo', 'x_1_1': 'ad'}. Best is trial 14 with value: 0.6428571428571428.
2024-12-06 23:36:15,576 - INFO - Candidate Mean Stats: {'Max': np.float64(2.0), 'Min': np.float64(-1.4406726401109595), 'Mean': np.float64(0.10394920499398727), 'Std': np.float64(0.4498033951405437)}
2024-12-06 23:36:15,576 - INFO - Candidate Std Stats: {'Max': np.float64(1.8803564977119105), 'Min': np.float64(0.0), 'Mean': np.float64(0.7169982385313906), 'Std': np.float64(0.2950835047938546)}
2024-12-06 23:36:15,576 - INFO - Candidate Mean Stats: {'Max': np.float64(2.0), 'Min': np.float64(-1.0877841158907906), 'Mean': np.float64(0.09389260199874189), 'Std': np.float64(0.3946649362055868)}
2024-12-06 23:36:15,576 - INFO - Candidate Std Stats: {'Max': np.float64(1.6297833153047405), 'Min': np.float64(0.0), 'Mean': np.float64(0.6249167685071491), 'Std': np.float64(0.2455257809685709)}
[I 2024-12-06 23:36:15,589] Trial 36 finished with value: 1.2857142857142856 and parameters: {'x_0_0': 'ac', 'x_0_1': 'ac', 'x_1_0': 'ad', 'x_1_1': 'ac'}. Best is trial 33 with value: 0.6964285714285714.
[I 2024-12-06 23:36:15,590] Trial 36 finished with value: 0.8214285714285714 and parameters: {'x_0_0': 'bc', 'x_0_1': 'oo', 'x_1_0': 'oo', 'x_1_1': 'ad'}. Best is trial 31 with value: 0.6964285714285714.
2024-12-06 23:36:15,723 - INFO - Candidate Mean Stats: {'Max': np.float64(2.0), 'Min': np.float64(-0.8038763793324835), 'Mean': np.float64(0.27481162370075396), 'Std': np.float64(0.3876758267753907)}
2024-12-06 23:36:15,723 - INFO - Candidate Std Stats: {'Max': np.float64(1.6181295636799151), 'Min': np.float64(0.0), 'Mean': np.float64(0.5406783602151706), 'Std': np.float64(0.22413103918020041)}
[I 2024-12-06 23:36:15,736] Trial 36 finished with value: 1.875 and parameters: {'x_0_0': 'oo', 'x_0_1': 'ad', 'x_1_0': 'bd', 'x_1_1': 'bd'}. Best is trial 23 with value: 0.5.
2024-12-06 23:36:15,862 - INFO - Candidate Mean Stats: {'Max': np.float64(2.0), 'Min': np.float64(-0.9892396326140978), 'Mean': np.float64(0.17187181567568321), 'Std': np.float64(0.3724754045231321)}
2024-12-06 23:36:15,862 - INFO - Candidate Std Stats: {'Max': np.float64(1.7236672047360306), 'Min': np.float64(0.0), 'Mean': np.float64(0.579950193659391), 'Std': np.float64(0.24570623759558485)}
[I 2024-12-06 23:36:15,877] Trial 37 finished with value: 1.2857142857142856 and parameters: {'x_0_0': 'bd', 'x_0_1': 'bc', 'x_1_0': 'bc', 'x_1_1': 'bd'}. Best is trial 14 with value: 0.6428571428571428.
2024-12-06 23:36:15,931 - INFO - Candidate Mean Stats: {'Max': np.float64(2.0), 'Min': np.float64(-1.2504104233995654), 'Mean': np.float64(0.19375018719610765), 'Std': np.float64(0.4385644392521588)}
2024-12-06 23:36:15,931 - INFO - Candidate Std Stats: {'Max': np.float64(1.8353615527389076), 'Min': np.float64(0.0), 'Mean': np.float64(0.6328076319407201), 'Std': np.float64(0.2527440663551376)}
2024-12-06 23:36:15,935 - INFO - Candidate Mean Stats: {'Max': np.float64(2.0), 'Min': np.float64(-1.2202254903366094), 'Mean': np.float64(0.21141465202769663), 'Std': np.float64(0.4422242665435069)}
2024-12-06 23:36:15,935 - INFO - Candidate Std Stats: {'Max': np.float64(1.6677352959170317), 'Min': np.float64(0.0), 'Mean': np.float64(0.6453182095527157), 'Std': np.float64(0.27619778592973177)}
[I 2024-12-06 23:36:15,946] Trial 37 finished with value: 1.0714285714285714 and parameters: {'x_0_0': 'ac', 'x_0_1': 'oo', 'x_1_0': 'bd', 'x_1_1': 'bc'}. Best is trial 33 with value: 0.6964285714285714.
[I 2024-12-06 23:36:15,951] Trial 37 finished with value: 0.8214285714285714 and parameters: {'x_0_0': 'ac', 'x_0_1': 'oo', 'x_1_0': 'oo', 'x_1_1': 'bc'}. Best is trial 31 with value: 0.6964285714285714.
2024-12-06 23:36:16,099 - INFO - Candidate Mean Stats: {'Max': np.float64(2.0), 'Min': np.float64(-0.8889735794424347), 'Mean': np.float64(0.22273316158010434), 'Std': np.float64(0.3489574372496317)}
2024-12-06 23:36:16,099 - INFO - Candidate Std Stats: {'Max': np.float64(1.544661289399244), 'Min': np.float64(0.0), 'Mean': np.float64(0.6015265047655124), 'Std': np.float64(0.25586959015919786)}
[I 2024-12-06 23:36:16,113] Trial 37 finished with value: 1.5714285714285714 and parameters: {'x_0_0': 'ac', 'x_0_1': 'bd', 'x_1_0': 'ac', 'x_1_1': 'cd'}. Best is trial 23 with value: 0.5.
2024-12-06 23:36:16,227 - INFO - Candidate Mean Stats: {'Max': np.float64(2.0), 'Min': np.float64(-0.8733399480229611), 'Mean': np.float64(0.27210061436472394), 'Std': np.float64(0.4159829338605106)}
2024-12-06 23:36:16,227 - INFO - Candidate Std Stats: {'Max': np.float64(1.593856405260964), 'Min': np.float64(0.0), 'Mean': np.float64(0.5979657928904302), 'Std': np.float64(0.25421715300431635)}
[I 2024-12-06 23:36:16,240] Trial 38 finished with value: 1.3214285714285714 and parameters: {'x_0_0': 'ac', 'x_0_1': 'cd', 'x_1_0': 'oo', 'x_1_1': 'bc'}. Best is trial 14 with value: 0.6428571428571428.
2024-12-06 23:36:16,285 - INFO - Candidate Mean Stats: {'Max': np.float64(2.0), 'Min': np.float64(-1.081293179256265), 'Mean': np.float64(0.21182901042173494), 'Std': np.float64(0.4054951583083835)}
2024-12-06 23:36:16,285 - INFO - Candidate Std Stats: {'Max': np.float64(1.6955160359426897), 'Min': np.float64(0.0), 'Mean': np.float64(0.6606180263535747), 'Std': np.float64(0.25953170391013486)}
2024-12-06 23:36:16,290 - INFO - Candidate Mean Stats: {'Max': np.float64(2.0), 'Min': np.float64(-0.8762496377141066), 'Mean': np.float64(0.27413030829234497), 'Std': np.float64(0.38269935492353896)}
2024-12-06 23:36:16,290 - INFO - Candidate Std Stats: {'Max': np.float64(1.485155181038747), 'Min': np.float64(0.0), 'Mean': np.float64(0.5616944570774738), 'Std': np.float64(0.23509962648744864)}
[I 2024-12-06 23:36:16,299] Trial 38 finished with value: 1.5714285714285714 and parameters: {'x_0_0': 'bd', 'x_0_1': 'ab', 'x_1_0': 'cd', 'x_1_1': 'ad'}. Best is trial 31 with value: 0.6964285714285714.
[I 2024-12-06 23:36:16,303] Trial 38 finished with value: 1.125 and parameters: {'x_0_0': 'oo', 'x_0_1': 'oo', 'x_1_0': 'oo', 'x_1_1': 'cd'}. Best is trial 33 with value: 0.6964285714285714.
2024-12-06 23:36:16,440 - INFO - Candidate Mean Stats: {'Max': np.float64(2.0), 'Min': np.float64(-1.0106945391003024), 'Mean': np.float64(0.17950997791676576), 'Std': np.float64(0.37486579794230934)}
2024-12-06 23:36:16,440 - INFO - Candidate Std Stats: {'Max': np.float64(1.3719108382610317), 'Min': np.float64(0.0), 'Mean': np.float64(0.5406520195614137), 'Std': np.float64(0.2169016625039817)}
[I 2024-12-06 23:36:16,458] Trial 38 finished with value: 0.7857142857142857 and parameters: {'x_0_0': 'ad', 'x_0_1': 'oo', 'x_1_0': 'bc', 'x_1_1': 'cd'}. Best is trial 23 with value: 0.5.
2024-12-06 23:36:16,586 - INFO - Candidate Mean Stats: {'Max': np.float64(2.0), 'Min': np.float64(-1.3628763927513579), 'Mean': np.float64(0.2560435347245192), 'Std': np.float64(0.41796651986002037)}
2024-12-06 23:36:16,586 - INFO - Candidate Std Stats: {'Max': np.float64(1.721336653760429), 'Min': np.float64(0.0), 'Mean': np.float64(0.6017453061692967), 'Std': np.float64(0.2504394545663254)}
[I 2024-12-06 23:36:16,608] Trial 39 finished with value: 1.5714285714285714 and parameters: {'x_0_0': 'ad', 'x_0_1': 'ab', 'x_1_0': 'ac', 'x_1_1': 'ab'}. Best is trial 14 with value: 0.6428571428571428.
2024-12-06 23:36:16,642 - INFO - Candidate Mean Stats: {'Max': np.float64(2.0), 'Min': np.float64(-1.216168355248567), 'Mean': np.float64(0.27496414920376555), 'Std': np.float64(0.37335975796353216)}
2024-12-06 23:36:16,642 - INFO - Candidate Std Stats: {'Max': np.float64(1.9404563709140108), 'Min': np.float64(0.0), 'Mean': np.float64(0.5693529317214973), 'Std': np.float64(0.2581033382386777)}
2024-12-06 23:36:16,653 - INFO - Candidate Mean Stats: {'Max': np.float64(2.0), 'Min': np.float64(-0.77747825015905), 'Mean': np.float64(0.3453597323941409), 'Std': np.float64(0.41731776558119227)}
2024-12-06 23:36:16,653 - INFO - Candidate Std Stats: {'Max': np.float64(1.7271481711212133), 'Min': np.float64(0.0), 'Mean': np.float64(0.5589487416697564), 'Std': np.float64(0.25239787086643783)}
[I 2024-12-06 23:36:16,655] Trial 39 finished with value: 0.9464285714285714 and parameters: {'x_0_0': 'ad', 'x_0_1': 'oo', 'x_1_0': 'ad', 'x_1_1': 'oo'}. Best is trial 31 with value: 0.6964285714285714.
[I 2024-12-06 23:36:16,665] Trial 39 finished with value: 0.9107142857142857 and parameters: {'x_0_0': 'ac', 'x_0_1': 'ac', 'x_1_0': 'oo', 'x_1_1': 'oo'}. Best is trial 33 with value: 0.6964285714285714.
2024-12-06 23:36:16,794 - INFO - Candidate Mean Stats: {'Max': np.float64(2.0), 'Min': np.float64(-1.3209382606051685), 'Mean': np.float64(0.10773144317760858), 'Std': np.float64(0.46695359087350585)}
2024-12-06 23:36:16,794 - INFO - Candidate Std Stats: {'Max': np.float64(1.6885397180420587), 'Min': np.float64(0.0), 'Mean': np.float64(0.6610373093652414), 'Std': np.float64(0.2755788642839049)}
[I 2024-12-06 23:36:16,807] Trial 39 finished with value: 0.8214285714285714 and parameters: {'x_0_0': 'ac', 'x_0_1': 'oo', 'x_1_0': 'oo', 'x_1_1': 'bc'}. Best is trial 23 with value: 0.5.
2024-12-06 23:36:16,939 - INFO - Candidate Mean Stats: {'Max': np.float64(2.0), 'Min': np.float64(-1.1803156226501594), 'Mean': np.float64(0.1963452656498059), 'Std': np.float64(0.414895363016679)}
2024-12-06 23:36:16,939 - INFO - Candidate Std Stats: {'Max': np.float64(1.8130292783000834), 'Min': np.float64(0.0), 'Mean': np.float64(0.5950021054381441), 'Std': np.float64(0.25244876430630236)}
[I 2024-12-06 23:36:16,952] Trial 40 finished with value: 1.625 and parameters: {'x_0_0': 'oo', 'x_0_1': 'ab', 'x_1_0': 'oo', 'x_1_1': 'ac'}. Best is trial 14 with value: 0.6428571428571428.
2024-12-06 23:36:16,975 - INFO - Candidate Mean Stats: {'Max': np.float64(2.0), 'Min': np.float64(-0.9185598416199963), 'Mean': np.float64(0.2513418906059555), 'Std': np.float64(0.4314139921330858)}
2024-12-06 23:36:16,975 - INFO - Candidate Std Stats: {'Max': np.float64(1.5294841047751766), 'Min': np.float64(0.0), 'Mean': np.float64(0.631971898698298), 'Std': np.float64(0.2616998097128648)}
2024-12-06 23:36:16,986 - INFO - Candidate Mean Stats: {'Max': np.float64(2.0), 'Min': np.float64(-0.9843756431632181), 'Mean': np.float64(0.2116951607977335), 'Std': np.float64(0.43009825225481524)}
2024-12-06 23:36:16,986 - INFO - Candidate Std Stats: {'Max': np.float64(1.6784615289361358), 'Min': np.float64(0.0), 'Mean': np.float64(0.6067081628256623), 'Std': np.float64(0.26212086283053326)}
[I 2024-12-06 23:36:16,988] Trial 40 finished with value: 1.2857142857142856 and parameters: {'x_0_0': 'ad', 'x_0_1': 'ab', 'x_1_0': 'bd', 'x_1_1': 'cd'}. Best is trial 31 with value: 0.6964285714285714.
[I 2024-12-06 23:36:16,998] Trial 40 finished with value: 1.1785714285714286 and parameters: {'x_0_0': 'bc', 'x_0_1': 'ab', 'x_1_0': 'oo', 'x_1_1': 'cd'}. Best is trial 33 with value: 0.6964285714285714.
2024-12-06 23:36:17,136 - INFO - Candidate Mean Stats: {'Max': np.float64(2.0), 'Min': np.float64(-1.1906744028863934), 'Mean': np.float64(0.12296656029716517), 'Std': np.float64(0.4325976609849973)}
2024-12-06 23:36:17,136 - INFO - Candidate Std Stats: {'Max': np.float64(2.1682071774120266), 'Min': np.float64(0.0), 'Mean': np.float64(0.718373666627972), 'Std': np.float64(0.31671033223315154)}
[I 2024-12-06 23:36:17,149] Trial 40 finished with value: 1.0714285714285714 and parameters: {'x_0_0': 'ac', 'x_0_1': 'oo', 'x_1_0': 'ab', 'x_1_1': 'ab'}. Best is trial 23 with value: 0.5.
2024-12-06 23:36:17,275 - INFO - Candidate Mean Stats: {'Max': np.float64(2.0), 'Min': np.float64(-1.1553118654856984), 'Mean': np.float64(0.19264519061163568), 'Std': np.float64(0.42669509275767414)}
2024-12-06 23:36:17,275 - INFO - Candidate Std Stats: {'Max': np.float64(1.5364802267409052), 'Min': np.float64(0.0), 'Mean': np.float64(0.60964977035716), 'Std': np.float64(0.2468626297299369)}
[I 2024-12-06 23:36:17,289] Trial 41 finished with value: 1.4285714285714286 and parameters: {'x_0_0': 'bc', 'x_0_1': 'ab', 'x_1_0': 'bc', 'x_1_1': 'cd'}. Best is trial 14 with value: 0.6428571428571428.
2024-12-06 23:36:17,312 - INFO - Candidate Mean Stats: {'Max': np.float64(2.0), 'Min': np.float64(-0.9973965556224293), 'Mean': np.float64(0.21690159437186565), 'Std': np.float64(0.4548271045341796)}
2024-12-06 23:36:17,312 - INFO - Candidate Std Stats: {'Max': np.float64(1.6825421939601926), 'Min': np.float64(0.0), 'Mean': np.float64(0.6235978692309895), 'Std': np.float64(0.2610934338899927)}
[I 2024-12-06 23:36:17,325] Trial 41 finished with value: 0.9464285714285714 and parameters: {'x_0_0': 'bc', 'x_0_1': 'oo', 'x_1_0': 'ac', 'x_1_1': 'oo'}. Best is trial 31 with value: 0.6964285714285714.
2024-12-06 23:36:17,327 - INFO - Candidate Mean Stats: {'Max': np.float64(2.0), 'Min': np.float64(-0.6794374648881795), 'Mean': np.float64(0.2583013575210066), 'Std': np.float64(0.34413350840728896)}
2024-12-06 23:36:17,327 - INFO - Candidate Std Stats: {'Max': np.float64(1.5688296707814684), 'Min': np.float64(0.0), 'Mean': np.float64(0.5719724282846396), 'Std': np.float64(0.24558545870745693)}
[I 2024-12-06 23:36:17,339] Trial 41 finished with value: 1.0714285714285714 and parameters: {'x_0_0': 'bc', 'x_0_1': 'oo', 'x_1_0': 'ad', 'x_1_1': 'bc'}. Best is trial 33 with value: 0.6964285714285714.
2024-12-06 23:36:17,475 - INFO - Candidate Mean Stats: {'Max': np.float64(2.0), 'Min': np.float64(-0.8152611349994159), 'Mean': np.float64(0.25651831659341034), 'Std': np.float64(0.36758526541591163)}
2024-12-06 23:36:17,475 - INFO - Candidate Std Stats: {'Max': np.float64(1.4711343315685859), 'Min': np.float64(0.0), 'Mean': np.float64(0.528156234449107), 'Std': np.float64(0.22281264511786802)}
[I 2024-12-06 23:36:17,488] Trial 41 finished with value: 1.5714285714285714 and parameters: {'x_0_0': 'bc', 'x_0_1': 'bc', 'x_1_0': 'ab', 'x_1_1': 'ab'}. Best is trial 23 with value: 0.5.
2024-12-06 23:36:17,611 - INFO - Candidate Mean Stats: {'Max': np.float64(2.0), 'Min': np.float64(-0.9516260040974837), 'Mean': np.float64(0.19764448568611492), 'Std': np.float64(0.41106261395681704)}
2024-12-06 23:36:17,611 - INFO - Candidate Std Stats: {'Max': np.float64(1.7736254673534761), 'Min': np.float64(0.0), 'Mean': np.float64(0.67059811896023), 'Std': np.float64(0.2850248107450992)}
[I 2024-12-06 23:36:17,673] Trial 42 finished with value: 1.3214285714285714 and parameters: {'x_0_0': 'bd', 'x_0_1': 'bc', 'x_1_0': 'oo', 'x_1_1': 'cd'}. Best is trial 14 with value: 0.6428571428571428.
2024-12-06 23:36:17,697 - INFO - Candidate Mean Stats: {'Max': np.float64(2.0), 'Min': np.float64(-0.6782401075539766), 'Mean': np.float64(0.3147626732405971), 'Std': np.float64(0.38113982032394267)}
2024-12-06 23:36:17,697 - INFO - Candidate Std Stats: {'Max': np.float64(1.2819155115849212), 'Min': np.float64(0.0), 'Mean': np.float64(0.5089791983804708), 'Std': np.float64(0.21769407403105015)}
[I 2024-12-06 23:36:17,714] Trial 42 finished with value: 1.2857142857142856 and parameters: {'x_0_0': 'bd', 'x_0_1': 'bd', 'x_1_0': 'bd', 'x_1_1': 'cd'}. Best is trial 31 with value: 0.6964285714285714.
2024-12-06 23:36:17,717 - INFO - Candidate Mean Stats: {'Max': np.float64(2.0), 'Min': np.float64(-0.8097672406304384), 'Mean': np.float64(0.347121475945569), 'Std': np.float64(0.3903940960378685)}
2024-12-06 23:36:17,717 - INFO - Candidate Std Stats: {'Max': np.float64(1.7202090878048149), 'Min': np.float64(0.0), 'Mean': np.float64(0.5616715083988164), 'Std': np.float64(0.2402255472864168)}
[I 2024-12-06 23:36:17,733] Trial 42 finished with value: 0.8214285714285714 and parameters: {'x_0_0': 'ad', 'x_0_1': 'oo', 'x_1_0': 'oo', 'x_1_1': 'ad'}. Best is trial 33 with value: 0.6964285714285714.
2024-12-06 23:36:17,892 - INFO - Candidate Mean Stats: {'Max': np.float64(2.0), 'Min': np.float64(-0.9418502886448612), 'Mean': np.float64(0.20866034827764457), 'Std': np.float64(0.3918589917468594)}
2024-12-06 23:36:17,892 - INFO - Candidate Std Stats: {'Max': np.float64(1.6054808410365862), 'Min': np.float64(0.0), 'Mean': np.float64(0.6198346432257416), 'Std': np.float64(0.2678201335884668)}
[I 2024-12-06 23:36:17,905] Trial 42 finished with value: 0.7857142857142857 and parameters: {'x_0_0': 'ad', 'x_0_1': 'oo', 'x_1_0': 'bd', 'x_1_1': 'ac'}. Best is trial 23 with value: 0.5.
2024-12-06 23:36:18,027 - INFO - Candidate Mean Stats: {'Max': np.float64(2.0), 'Min': np.float64(-0.8038737111709626), 'Mean': np.float64(0.2450983065285757), 'Std': np.float64(0.4082001944387751)}
2024-12-06 23:36:18,028 - INFO - Candidate Std Stats: {'Max': np.float64(1.702679731670504), 'Min': np.float64(0.0), 'Mean': np.float64(0.6730473147949981), 'Std': np.float64(0.27284211194291874)}
[I 2024-12-06 23:36:18,041] Trial 43 finished with value: 1.75 and parameters: {'x_0_0': 'cd', 'x_0_1': 'ac', 'x_1_0': 'oo', 'x_1_1': 'bd'}. Best is trial 14 with value: 0.6428571428571428.
2024-12-06 23:36:18,065 - INFO - Candidate Mean Stats: {'Max': np.float64(2.0), 'Min': np.float64(-0.9195941954368377), 'Mean': np.float64(0.26021536525736594), 'Std': np.float64(0.3993317370018129)}
2024-12-06 23:36:18,065 - INFO - Candidate Std Stats: {'Max': np.float64(1.6280424447649944), 'Min': np.float64(0.0), 'Mean': np.float64(0.5759215686332331), 'Std': np.float64(0.2525319760257651)}
[I 2024-12-06 23:36:18,078] Trial 43 finished with value: 1.5714285714285714 and parameters: {'x_0_0': 'ac', 'x_0_1': 'bd', 'x_1_0': 'bc', 'x_1_1': 'cd'}. Best is trial 31 with value: 0.6964285714285714.
2024-12-06 23:36:18,080 - INFO - Candidate Mean Stats: {'Max': np.float64(2.0), 'Min': np.float64(-0.7147714594771089), 'Mean': np.float64(0.26118032968044247), 'Std': np.float64(0.40596658459907803)}
2024-12-06 23:36:18,080 - INFO - Candidate Std Stats: {'Max': np.float64(1.5591841484703344), 'Min': np.float64(0.0), 'Mean': np.float64(0.5544644000804737), 'Std': np.float64(0.22912419064683512)}
