[I 2024-12-28 14:58:58,606] Trial 40 finished with value: 1.5892857142857144 and parameters: {'x_0_0': 'ab', 'x_0_1': 'ac', 'x_1_0': 'ac', 'x_1_1': 'oo'}. Best is trial 16 with value: 0.8035714285714286.
Loaded from prev state!
Loaded from prev state!
Loaded from prev state!
Loaded from prev state!
Loaded from prev state!
Loaded from prev state!
Loaded from prev state!
Loaded from prev state!
Loaded from prev state!
Loaded from prev state!
Loaded from prev state!
Loaded from prev state!
Loaded from prev state!
Loaded from prev state!
Loaded from prev state!
Loaded from prev state!
Loaded from prev state!
Loaded from prev state!
Loaded from prev state!
Loaded from prev state!
Loaded from prev state!
Loaded from prev state!
Loaded from prev state!
Loaded from prev state!
Loaded from prev state!
Loaded from prev state!
Loaded from prev state!
Loaded from prev state!
Loaded from prev state!
Loaded from prev state!
Loaded from prev state!
Loaded from prev state!
Loaded from prev state!
Loaded from prev state!
Loaded from prev state!
Loaded from prev state!
Loaded from prev state!
Loaded from prev state!
Loaded from prev state!
Loaded from prev state!
Loaded from prev state!
Loaded from prev state!
Loaded from prev state!
Loaded from prev state!
Loaded from prev state!
Loaded from prev state!
Loaded from prev state!
Loaded from prev state!
Loaded from prev state!
Loaded from prev state!
Loaded from prev state!
Loaded from prev state!
Loaded from prev state!
Loaded from prev state!
Loaded from prev state!
Loaded from prev state!
Loaded from prev state!
Loaded from prev state!
Loaded from prev state!
Loaded from prev state!
Loaded from prev state!
Loaded from prev state!
Loaded from prev state!
Loaded from prev state!
Loaded from prev state!
Loaded from prev state!
Loaded from prev state!
Loaded from prev state!
Loaded from prev state!
Loaded from prev state!
Loaded from prev state!
Loaded from prev state!
Loaded from prev state!
Loaded from prev state!
Loaded from prev state!
Loaded from prev state!
Loaded from prev state!
Loaded from prev state!
Loaded from prev state!
Loaded from prev state!
Loaded from prev state!
Loaded from prev state!
Loaded from prev state!
Loaded from prev state!
Loaded from prev state!
Loaded from prev state!
Loaded from prev state!
Loaded from prev state!
Loaded from prev state!
Loaded from prev state!
Loaded from prev state!
Loaded from prev state!
Loaded from prev state!
Loaded from prev state!
Loaded from prev state!
Loaded from prev state!
Loaded from prev state!
Loaded from prev state!
Loaded from prev state!
Loaded from prev state!
Loaded from prev state!
Loaded from prev state!
Loaded from prev state!
Loaded from prev state!
Loaded from prev state!
Loaded from prev state!
Loaded from prev state!
Loaded from prev state!
Loaded from prev state!
Loaded from prev state!
Loaded from prev state!
Loaded from prev state!
Loaded from prev state!
Loaded from prev state!
Loaded from prev state!
Loaded from prev state!
Loaded from prev state!
Loaded from prev state!
Loaded from prev state!
Loaded from prev state!
Loaded from prev state!
Loaded from prev state!
Loaded from prev state!
Loaded from prev state!
Loaded from prev state!
Loaded from prev state!
Loaded from prev state!
Loaded from prev state!
Loaded from prev state!
Loaded from prev state!
Loaded from prev state!
Loaded from prev state!
Loaded from prev state!
Loaded from prev state!
Loaded from prev state!
Loaded from prev state!
Loaded from prev state!
Loaded from prev state!
Loaded from prev state!
Loaded from prev state!
Loaded from prev state!
Loaded from prev state!
Loaded from prev state!
Loaded from prev state!
Loaded from prev state!
Loaded from prev state!
Loaded from prev state!
Loaded from prev state!
Loaded from prev state!
Loaded from prev state!
Loaded from prev state!
Loaded from prev state!
Loaded from prev state!
Loaded from prev state!
Loaded from prev state!
Loaded from prev state!
Loaded from prev state!
Loaded from prev state!
Loaded from prev state!
Loaded from prev state!
Loaded from prev state!
Loaded from prev state!
Loaded from prev state!
Loaded from prev state!
Loaded from prev state!
Loaded from prev state!
Loaded from prev state!
Loaded from prev state!
Loaded from prev state!
Loaded from prev state!
Loaded from prev state!
Loaded from prev state!
Loaded from prev state!
Loaded from prev state!
Loaded from prev state!
Loaded from prev state!
Loaded from prev state!
Loaded from prev state!
Loaded from prev state!
Loaded from prev state!
Loaded from prev state!
Loaded from prev state!
Loaded from prev state!
Loaded from prev state!
Loaded from prev state!
Loaded from prev state!
Loaded from prev state!
Loaded from prev state!
Loaded from prev state!
Loaded from prev state!
Loaded from prev state!
Loaded from prev state!
Loaded from prev state!
Loaded from prev state!
Loaded from prev state!
Loaded from prev state!
Loaded from prev state!
Loaded from prev state!
Loaded from prev state!
Loaded from prev state!
Loaded from prev state!
Loaded from prev state!
Loaded from prev state!
Loaded from prev state!
Loaded from prev state!
Loaded from prev state!
Loaded from prev state!
Loaded from prev state!
Loaded from prev state!
Loaded from prev state!
Loaded from prev state!
Loaded from prev state!
Loaded from prev state!
Loaded from prev state!
Loaded from prev state!
Loaded from prev state!
Loaded from prev state!
Loaded from prev state!
Loaded from prev state!
Loaded from prev state!
Loaded from prev state!
Loaded from prev state!
Loaded from prev state!
Loaded from prev state!
Loaded from prev state!
Loaded from prev state!
Loaded from prev state!
Loaded from prev state!
Loaded from prev state!
Loaded from prev state!
Loaded from prev state!
Loaded from prev state!
Loaded from prev state!
Loaded from prev state!
Loaded from prev state!
Loaded from prev state!
Loaded from prev state!
Loaded from prev state!
Loaded from prev state!
Loaded from prev state!
Loaded from prev state!
Loaded from prev state!
Loaded from prev state!
Loaded from prev state!
Loaded from prev state!
Loaded from prev state!
Loaded from prev state!
Loaded from prev state!
Loaded from prev state!
Loaded from prev state!
Loaded from prev state!
Loaded from prev state!
Loaded from prev state!
Loaded from prev state!
Loaded from prev state!
Loaded from prev state!
Loaded from prev state!
Loaded from prev state!
Loaded from prev state!
Loaded from prev state!
Loaded from prev state!
Loaded from prev state!
Loaded from prev state!
Loaded from prev state!
Loaded from prev state!
Loaded from prev state!
Loaded from prev state!
Loaded from prev state!
Loaded from prev state!
Loaded from prev state!
Loaded from prev state!
Loaded from prev state!
Loaded from prev state!
Loaded from prev state!
Loaded from prev state!
Loaded from prev state!
Loaded from prev state!
Loaded from prev state!
Loaded from prev state!
Loaded from prev state!
Loaded from prev state!
Loaded from prev state!
Loaded from prev state!
Loaded from prev state!
Loaded from prev state!
Loaded from prev state!
Loaded from prev state!
Loaded from prev state!
Loaded from prev state!
Loaded from prev state!
Loaded from prev state!
Loaded from prev state!
Loaded from prev state!
Loaded from prev state!
Loaded from prev state!
Loaded from prev state!
Loaded from prev state!
Loaded from prev state!
Loaded from prev state!
Loaded from prev state!
Loaded from prev state!
Loaded from prev state!
Loaded from prev state!
Loaded from prev state!
Loaded from prev state!
Loaded from prev state!
Loaded from prev state!
Loaded from prev state!
Loaded from prev state!
Loaded from prev state!
Loaded from prev state!
Loaded from prev state!
Loaded from prev state!
Loaded from prev state!
Loaded from prev state!
Loaded from prev state!
Loaded from prev state!
Loaded from prev state!
Loaded from prev state!
Loaded from prev state!
Loaded from prev state!
Loaded from prev state!
Loaded from prev state!
Loaded from prev state!
Loaded from prev state!
Loaded from prev state!
Loaded from prev state!
Loaded from prev state!
Loaded from prev state!
Loaded from prev state!
Loaded from prev state!
Loaded from prev state!
Loaded from prev state!
Loaded from prev state!
Loaded from prev state!
Loaded from prev state!
Loaded from prev state!
Loaded from prev state!
Loaded from prev state!
Loaded from prev state!
Loaded from prev state!
Loaded from prev state![I 2024-12-28 14:58:58,694] Trial 48 finished with value: 1.2857142857142856 and parameters: {'x_0_0': 'bd', 'x_0_1': 'ad', 'x_1_0': 'bd', 'x_1_1': 'ac'}. Best is trial 17 with value: 0.7857142857142857.
[I 2024-12-28 14:58:58,733] Trial 36 finished with value: 1.7142857142857144 and parameters: {'x_0_0': 'ab', 'x_0_1': 'bd', 'x_1_0': 'bd', 'x_1_1': 'cd'}. Best is trial 15 with value: 0.6964285714285714.
[I 2024-12-28 14:58:58,744] Trial 48 finished with value: 0.9464285714285714 and parameters: {'x_0_0': 'ac', 'x_0_1': 'oo', 'x_1_0': 'cd', 'x_1_1': 'oo'}. Best is trial 48 with value: 0.9464285714285714.
[I 2024-12-28 14:58:58,826] Trial 40 finished with value: 1.625 and parameters: {'x_0_0': 'oo', 'x_0_1': 'ad', 'x_1_0': 'oo', 'x_1_1': 'cd'}. Best is trial 7 with value: 0.5.
[I 2024-12-28 14:58:58,864] Trial 41 finished with value: 1.7142857142857144 and parameters: {'x_0_0': 'ab', 'x_0_1': 'bd', 'x_1_0': 'bd', 'x_1_1': 'cd'}. Best is trial 16 with value: 0.8035714285714286.
[I 2024-12-28 14:58:58,914] Trial 49 finished with value: 0.8214285714285714 and parameters: {'x_0_0': 'bc', 'x_0_1': 'oo', 'x_1_0': 'oo', 'x_1_1': 'ac'}. Best is trial 21 with value: 0.7857142857142857.
[I 2024-12-28 14:58:58,994] Trial 49 finished with value: 1.5714285714285714 and parameters: {'x_0_0': 'ad', 'x_0_1': 'ac', 'x_1_0': 'ac', 'x_1_1': 'cd'}. Best is trial 17 with value: 0.7857142857142857.
[I 2024-12-28 14:58:59,020] Trial 46 finished with value: 1.0 and parameters: {'x_0_0': 'bd', 'x_0_1': 'bc', 'x_1_0': 'bc', 'x_1_1': 'ad'}. Best is trial 17 with value: 0.5.
[I 2024-12-28 14:58:59,043] Trial 36 finished with value: 1.4285714285714286 and parameters: {'x_0_0': 'ad', 'x_0_1': 'ad', 'x_1_0': 'ab', 'x_1_1': 'cd'}. Best is trial 3 with value: 0.7857142857142857.
[I 2024-12-28 14:58:59,054] Trial 43 finished with value: 1.2857142857142856 and parameters: {'x_0_0': 'bc', 'x_0_1': 'ac', 'x_1_0': 'bc', 'x_1_1': 'bc'}. Best is trial 29 with value: 1.0.
[I 2024-12-28 14:58:59,175] Trial 42 finished with value: 1.5714285714285714 and parameters: {'x_0_0': 'bd', 'x_0_1': 'bc', 'x_1_0': 'cd', 'x_1_1': 'cd'}. Best is trial 16 with value: 0.8035714285714286.
[I 2024-12-28 14:58:59,245] Trial 37 finished with value: 1.875 and parameters: {'x_0_0': 'oo', 'x_0_1': 'ac', 'x_1_0': 'ac', 'x_1_1': 'bd'}. Best is trial 15 with value: 0.6964285714285714.
[I 2024-12-28 14:58:59,271] Trial 50 finished with value: 1.7142857142857144 and parameters: {'x_0_0': 'ab', 'x_0_1': 'bc', 'x_1_0': 'cd', 'x_1_1': 'cd'}. Best is trial 17 with value: 0.7857142857142857.
[I 2024-12-28 14:58:59,275] Trial 47 finished with value: 2.0 and parameters: {'x_0_0': 'cd', 'x_0_1': 'ac', 'x_1_0': 'bc', 'x_1_1': 'ab'}. Best is trial 17 with value: 0.5.
[I 2024-12-28 14:58:59,312] Trial 49 finished with value: 1.0714285714285714 and parameters: {'x_0_0': 'bd', 'x_0_1': 'oo', 'x_1_0': 'ac', 'x_1_1': 'cd'}. Best is trial 48 with value: 0.9464285714285714.
[I 2024-12-28 14:58:59,326] Trial 50 finished with value: 1.125 and parameters: {'x_0_0': 'oo', 'x_0_1': 'oo', 'x_1_0': 'oo', 'x_1_1': 'ad'}. Best is trial 21 with value: 0.7857142857142857.
[I 2024-12-28 14:58:59,381] Trial 37 finished with value: 1.5 and parameters: {'x_0_0': 'cd', 'x_0_1': 'oo', 'x_1_0': 'bd', 'x_1_1': 'bd'}. Best is trial 3 with value: 0.7857142857142857.
[I 2024-12-28 14:58:59,398] Trial 41 finished with value: 1.875 and parameters: {'x_0_0': 'cd', 'x_0_1': 'cd', 'x_1_0': 'ad', 'x_1_1': 'oo'}. Best is trial 7 with value: 0.5.
[I 2024-12-28 14:58:59,509] Trial 43 finished with value: 1.4285714285714286 and parameters: {'x_0_0': 'ad', 'x_0_1': 'ad', 'x_1_0': 'ab', 'x_1_1': 'bd'}. Best is trial 16 with value: 0.8035714285714286.
[I 2024-12-28 14:58:59,561] Trial 51 finished with value: 1.7142857142857144 and parameters: {'x_0_0': 'ab', 'x_0_1': 'ac', 'x_1_0': 'bc', 'x_1_1': 'cd'}. Best is trial 17 with value: 0.7857142857142857.
[I 2024-12-28 14:58:59,710] Trial 48 finished with value: 2.0 and parameters: {'x_0_0': 'cd', 'x_0_1': 'ad', 'x_1_0': 'bc', 'x_1_1': 'ab'}. Best is trial 17 with value: 0.5.
[I 2024-12-28 14:58:59,801] Trial 52 finished with value: 1.4285714285714286 and parameters: {'x_0_0': 'bd', 'x_0_1': 'ac', 'x_1_0': 'ab', 'x_1_1': 'cd'}. Best is trial 17 with value: 0.7857142857142857.
[I 2024-12-28 14:58:59,806] Trial 51 finished with value: 1.875 and parameters: {'x_0_0': 'oo', 'x_0_1': 'ab', 'x_1_0': 'bc', 'x_1_1': 'bd'}. Best is trial 21 with value: 0.7857142857142857.
[I 2024-12-28 14:58:59,857] Trial 38 finished with value: 1.875 and parameters: {'x_0_0': 'cd', 'x_0_1': 'cd', 'x_1_0': 'ad', 'x_1_1': 'oo'}. Best is trial 15 with value: 0.6964285714285714.
[I 2024-12-28 14:58:59,859] Trial 44 finished with value: 1.5 and parameters: {'x_0_0': 'cd', 'x_0_1': 'oo', 'x_1_0': 'bd', 'x_1_1': 'bc'}. Best is trial 16 with value: 0.8035714285714286.
[I 2024-12-28 14:58:59,880] Trial 50 finished with value: 0.8214285714285714 and parameters: {'x_0_0': 'ac', 'x_0_1': 'oo', 'x_1_0': 'oo', 'x_1_1': 'bd'}. Best is trial 50 with value: 0.8214285714285714.
[I 2024-12-28 14:58:59,882] Trial 38 finished with value: 1.7142857142857144 and parameters: {'x_0_0': 'ab', 'x_0_1': 'ac', 'x_1_0': 'cd', 'x_1_1': 'ab'}. Best is trial 3 with value: 0.7857142857142857.
[I 2024-12-28 14:58:59,901] Trial 44 finished with value: 1.5714285714285714 and parameters: {'x_0_0': 'bc', 'x_0_1': 'cd', 'x_1_0': 'ab', 'x_1_1': 'ab'}. Best is trial 29 with value: 1.0.
