[I 2024-12-06 23:37:16,624] Trial 204 finished with value: 0.7857142857142857 and parameters: {'x_0_0': 'bd', 'x_0_1': 'oo', 'x_1_0': 'bd', 'x_1_1': 'ad'}. Best is trial 23 with value: 0.5.
2024-12-06 23:37:16,833 - INFO - Candidate Mean Stats: {'Max': np.float64(2.7633326062884493), 'Min': np.float64(-1.055731688190384), 'Mean': np.float64(0.4263548983349758), 'Std': np.float64(0.592440082464102)}
2024-12-06 23:37:16,833 - INFO - Candidate Std Stats: {'Max': np.float64(1.6783386206019342), 'Min': np.float64(0.0), 'Mean': np.float64(0.5695568624522678), 'Std': np.float64(0.28524948477587303)}
2024-12-06 23:37:16,843 - INFO - Candidate Mean Stats: {'Max': np.float64(3.069402800534811), 'Min': np.float64(-1.0036863778618907), 'Mean': np.float64(0.5531185820907688), 'Std': np.float64(0.5914761881225151)}
2024-12-06 23:37:16,843 - INFO - Candidate Std Stats: {'Max': np.float64(1.9427175857728112), 'Min': np.float64(0.0), 'Mean': np.float64(0.568966916288779), 'Std': np.float64(0.2921706465458056)}
[I 2024-12-06 23:37:16,846] Trial 206 finished with value: 1.1428571428571428 and parameters: {'x_0_0': 'bc', 'x_0_1': 'ad', 'x_1_0': 'cd', 'x_1_1': 'ab'}. Best is trial 165 with value: 0.5.
[I 2024-12-06 23:37:16,856] Trial 206 finished with value: 1.3214285714285714 and parameters: {'x_0_0': 'ac', 'x_0_1': 'cd', 'x_1_0': 'oo', 'x_1_1': 'ac'}. Best is trial 76 with value: 0.5.
2024-12-06 23:37:16,861 - INFO - Candidate Mean Stats: {'Max': np.float64(2.849190710301369), 'Min': np.float64(-1.149744880476233), 'Mean': np.float64(0.49294313369111387), 'Std': np.float64(0.5322153163662295)}
2024-12-06 23:37:16,861 - INFO - Candidate Std Stats: {'Max': np.float64(1.619010922605753), 'Min': np.float64(0.0), 'Mean': np.float64(0.5574833262114941), 'Std': np.float64(0.2745093699018082)}
[I 2024-12-06 23:37:16,874] Trial 206 finished with value: 1.0714285714285714 and parameters: {'x_0_0': 'bd', 'x_0_1': 'oo', 'x_1_0': 'ac', 'x_1_1': 'bd'}. Best is trial 63 with value: 0.5.
2024-12-06 23:37:16,973 - INFO - Candidate Mean Stats: {'Max': np.float64(2.846533325368616), 'Min': np.float64(-0.9424240519234157), 'Mean': np.float64(0.4505447756606498), 'Std': np.float64(0.5671518885918921)}
2024-12-06 23:37:16,973 - INFO - Candidate Std Stats: {'Max': np.float64(1.661748688176456), 'Min': np.float64(0.0), 'Mean': np.float64(0.6175463489282614), 'Std': np.float64(0.29704675899507377)}
[I 2024-12-06 23:37:16,986] Trial 205 finished with value: 1.0357142857142856 and parameters: {'x_0_0': 'ac', 'x_0_1': 'ac', 'x_1_0': 'oo', 'x_1_1': 'ad'}. Best is trial 23 with value: 0.5.
2024-12-06 23:37:17,196 - INFO - Candidate Mean Stats: {'Max': np.float64(2.829993756733469), 'Min': np.float64(-0.7159664526241634), 'Mean': np.float64(0.5375580320302399), 'Std': np.float64(0.5242176639174814)}
2024-12-06 23:37:17,196 - INFO - Candidate Std Stats: {'Max': np.float64(1.57867468708213), 'Min': np.float64(0.0), 'Mean': np.float64(0.5572782356829141), 'Std': np.float64(0.27932710564946456)}
2024-12-06 23:37:17,204 - INFO - Candidate Mean Stats: {'Max': np.float64(3.3135226502195096), 'Min': np.float64(-1.4372937961902719), 'Mean': np.float64(0.4476144134712488), 'Std': np.float64(0.6559645626664447)}
2024-12-06 23:37:17,204 - INFO - Candidate Std Stats: {'Max': np.float64(1.7702397522499869), 'Min': np.float64(0.0), 'Mean': np.float64(0.6401149529770271), 'Std': np.float64(0.30802313071849613)}
[I 2024-12-06 23:37:17,210] Trial 207 finished with value: 0.9285714285714286 and parameters: {'x_0_0': 'bd', 'x_0_1': 'oo', 'x_1_0': 'ab', 'x_1_1': 'ad'}. Best is trial 165 with value: 0.5.
[I 2024-12-06 23:37:17,217] Trial 207 finished with value: 1.0714285714285714 and parameters: {'x_0_0': 'bc', 'x_0_1': 'oo', 'x_1_0': 'ac', 'x_1_1': 'bd'}. Best is trial 76 with value: 0.5.
2024-12-06 23:37:17,222 - INFO - Candidate Mean Stats: {'Max': np.float64(2.5873543509634365), 'Min': np.float64(-0.8614921474793255), 'Mean': np.float64(0.5278138282696292), 'Std': np.float64(0.5233276243976904)}
2024-12-06 23:37:17,222 - INFO - Candidate Std Stats: {'Max': np.float64(1.6525501992449734), 'Min': np.float64(0.0), 'Mean': np.float64(0.5634135362389878), 'Std': np.float64(0.30213289645025593)}
[I 2024-12-06 23:37:17,235] Trial 207 finished with value: 1.375 and parameters: {'x_0_0': 'oo', 'x_0_1': 'oo', 'x_1_0': 'bc', 'x_1_1': 'ac'}. Best is trial 63 with value: 0.5.
2024-12-06 23:37:17,339 - INFO - Candidate Mean Stats: {'Max': np.float64(2.517403030162394), 'Min': np.float64(-1.440026247161298), 'Mean': np.float64(0.417286946953439), 'Std': np.float64(0.6240828129408545)}
2024-12-06 23:37:17,340 - INFO - Candidate Std Stats: {'Max': np.float64(1.7473709904954111), 'Min': np.float64(0.0), 'Mean': np.float64(0.6664131292626486), 'Std': np.float64(0.33289502467808596)}
[I 2024-12-06 23:37:17,353] Trial 206 finished with value: 1.1607142857142856 and parameters: {'x_0_0': 'ad', 'x_0_1': 'ac', 'x_1_0': 'bd', 'x_1_1': 'oo'}. Best is trial 23 with value: 0.5.
2024-12-06 23:37:17,558 - INFO - Candidate Mean Stats: {'Max': np.float64(2.8727945280894547), 'Min': np.float64(-1.206535240979873), 'Mean': np.float64(0.48971444232831285), 'Std': np.float64(0.5782999591371706)}
2024-12-06 23:37:17,558 - INFO - Candidate Std Stats: {'Max': np.float64(1.5048934563996879), 'Min': np.float64(0.0), 'Mean': np.float64(0.6192775761583463), 'Std': np.float64(0.3082096837114355)}
2024-12-06 23:37:17,565 - INFO - Candidate Mean Stats: {'Max': np.float64(3.0298914562046066), 'Min': np.float64(-1.0437595014010328), 'Mean': np.float64(0.439894427320636), 'Std': np.float64(0.5566900849017632)}
2024-12-06 23:37:17,565 - INFO - Candidate Std Stats: {'Max': np.float64(1.8503575310165312), 'Min': np.float64(0.0), 'Mean': np.float64(0.6268106020598948), 'Std': np.float64(0.32784089180490067)}
[I 2024-12-06 23:37:17,571] Trial 208 finished with value: 1.0714285714285714 and parameters: {'x_0_0': 'bd', 'x_0_1': 'oo', 'x_1_0': 'cd', 'x_1_1': 'ad'}. Best is trial 165 with value: 0.5.
[I 2024-12-06 23:37:17,578] Trial 208 finished with value: 0.9285714285714286 and parameters: {'x_0_0': 'ad', 'x_0_1': 'oo', 'x_1_0': 'ab', 'x_1_1': 'bc'}. Best is trial 76 with value: 0.5.
2024-12-06 23:37:17,583 - INFO - Candidate Mean Stats: {'Max': np.float64(3.2314556029745987), 'Min': np.float64(-0.9045581543658562), 'Mean': np.float64(0.5679616481685497), 'Std': np.float64(0.5077448735618072)}
2024-12-06 23:37:17,583 - INFO - Candidate Std Stats: {'Max': np.float64(1.5375473056621878), 'Min': np.float64(0.0), 'Mean': np.float64(0.5009028685047044), 'Std': np.float64(0.2633621789734434)}
[I 2024-12-06 23:37:17,596] Trial 208 finished with value: 1.1607142857142856 and parameters: {'x_0_0': 'ad', 'x_0_1': 'bc', 'x_1_0': 'bd', 'x_1_1': 'oo'}. Best is trial 63 with value: 0.5.
2024-12-06 23:37:17,703 - INFO - Candidate Mean Stats: {'Max': np.float64(3.375574154803904), 'Min': np.float64(-0.9511248312971855), 'Mean': np.float64(0.4997112443273338), 'Std': np.float64(0.5429443047660787)}
2024-12-06 23:37:17,703 - INFO - Candidate Std Stats: {'Max': np.float64(1.7729092283278813), 'Min': np.float64(0.0), 'Mean': np.float64(0.5649178293577339), 'Std': np.float64(0.2921750948708366)}
[I 2024-12-06 23:37:17,716] Trial 207 finished with value: 1.0714285714285714 and parameters: {'x_0_0': 'bc', 'x_0_1': 'oo', 'x_1_0': 'cd', 'x_1_1': 'bc'}. Best is trial 23 with value: 0.5.
2024-12-06 23:37:17,918 - INFO - Candidate Mean Stats: {'Max': np.float64(3.019159915846875), 'Min': np.float64(-1.1545474354224878), 'Mean': np.float64(0.5380459511981105), 'Std': np.float64(0.5352651234786826)}
2024-12-06 23:37:17,918 - INFO - Candidate Std Stats: {'Max': np.float64(1.4519659757946366), 'Min': np.float64(0.0), 'Mean': np.float64(0.527003917553546), 'Std': np.float64(0.2725357003358754)}
2024-12-06 23:37:17,925 - INFO - Candidate Mean Stats: {'Max': np.float64(3.6245196899631216), 'Min': np.float64(-1.1918019756049292), 'Mean': np.float64(0.5288079860335022), 'Std': np.float64(0.6301039099673896)}
2024-12-06 23:37:17,925 - INFO - Candidate Std Stats: {'Max': np.float64(1.8172339403566269), 'Min': np.float64(0.0), 'Mean': np.float64(0.5713664181160207), 'Std': np.float64(0.29951493840204274)}
[I 2024-12-06 23:37:17,932] Trial 209 finished with value: 1.5 and parameters: {'x_0_0': 'cd', 'x_0_1': 'oo', 'x_1_0': 'ac', 'x_1_1': 'ab'}. Best is trial 165 with value: 0.5.
[I 2024-12-06 23:37:17,939] Trial 209 finished with value: 1.0714285714285714 and parameters: {'x_0_0': 'bc', 'x_0_1': 'oo', 'x_1_0': 'cd', 'x_1_1': 'cd'}. Best is trial 76 with value: 0.5.
2024-12-06 23:37:17,944 - INFO - Candidate Mean Stats: {'Max': np.float64(2.732335255790738), 'Min': np.float64(-0.9774903305968176), 'Mean': np.float64(0.49075115798957236), 'Std': np.float64(0.4972673104137806)}
2024-12-06 23:37:17,945 - INFO - Candidate Std Stats: {'Max': np.float64(1.9090786849129087), 'Min': np.float64(0.0), 'Mean': np.float64(0.5851253530276558), 'Std': np.float64(0.3076606020917608)}
[I 2024-12-06 23:37:17,957] Trial 209 finished with value: 1.1607142857142856 and parameters: {'x_0_0': 'bd', 'x_0_1': 'cd', 'x_1_0': 'bd', 'x_1_1': 'oo'}. Best is trial 63 with value: 0.5.
2024-12-06 23:37:18,069 - INFO - Candidate Mean Stats: {'Max': np.float64(3.1028264727775117), 'Min': np.float64(-0.8959205347923742), 'Mean': np.float64(0.5638472242777174), 'Std': np.float64(0.5510027797084346)}
2024-12-06 23:37:18,069 - INFO - Candidate Std Stats: {'Max': np.float64(1.4417923583256897), 'Min': np.float64(0.0), 'Mean': np.float64(0.5274216495197692), 'Std': np.float64(0.26514337036824487)}
[I 2024-12-06 23:37:18,082] Trial 208 finished with value: 1.0714285714285714 and parameters: {'x_0_0': 'bd', 'x_0_1': 'oo', 'x_1_0': 'cd', 'x_1_1': 'bd'}. Best is trial 23 with value: 0.5.
2024-12-06 23:37:18,282 - INFO - Candidate Mean Stats: {'Max': np.float64(2.999995123404193), 'Min': np.float64(-0.8760851668917748), 'Mean': np.float64(0.5079493398076927), 'Std': np.float64(0.5555515355469854)}
2024-12-06 23:37:18,282 - INFO - Candidate Std Stats: {'Max': np.float64(1.46160853582425), 'Min': np.float64(0.0), 'Mean': np.float64(0.5525771058941682), 'Std': np.float64(0.28619835098900037)}
2024-12-06 23:37:18,288 - INFO - Candidate Mean Stats: {'Max': np.float64(2.973621426913671), 'Min': np.float64(-1.1039424988195923), 'Mean': np.float64(0.39062321321278276), 'Std': np.float64(0.6469111014957887)}
2024-12-06 23:37:18,288 - INFO - Candidate Std Stats: {'Max': np.float64(1.923386963260183), 'Min': np.float64(0.0), 'Mean': np.float64(0.7217149448694467), 'Std': np.float64(0.37293782052604696)}
[I 2024-12-06 23:37:18,296] Trial 210 finished with value: 1.0714285714285714 and parameters: {'x_0_0': 'bc', 'x_0_1': 'oo', 'x_1_0': 'ad', 'x_1_1': 'bd'}. Best is trial 165 with value: 0.5.
[I 2024-12-06 23:37:18,301] Trial 210 finished with value: 1.3214285714285714 and parameters: {'x_0_0': 'bc', 'x_0_1': 'bd', 'x_1_0': 'oo', 'x_1_1': 'cd'}. Best is trial 76 with value: 0.5.
2024-12-06 23:37:18,307 - INFO - Candidate Mean Stats: {'Max': np.float64(2.710975571533235), 'Min': np.float64(-0.9418838641382086), 'Mean': np.float64(0.516686377956086), 'Std': np.float64(0.5291584472833546)}
2024-12-06 23:37:18,307 - INFO - Candidate Std Stats: {'Max': np.float64(1.5849776492151106), 'Min': np.float64(0.0), 'Mean': np.float64(0.5438128205910682), 'Std': np.float64(0.28084437897817977)}
[I 2024-12-06 23:37:18,320] Trial 210 finished with value: 1.0714285714285714 and parameters: {'x_0_0': 'ad', 'x_0_1': 'oo', 'x_1_0': 'ad', 'x_1_1': 'ad'}. Best is trial 63 with value: 0.5.
2024-12-06 23:37:18,433 - INFO - Candidate Mean Stats: {'Max': np.float64(3.9370686519667095), 'Min': np.float64(-0.8310729441709224), 'Mean': np.float64(0.5823268372991696), 'Std': np.float64(0.5097097226072997)}
2024-12-06 23:37:18,433 - INFO - Candidate Std Stats: {'Max': np.float64(1.659810474844942), 'Min': np.float64(0.0), 'Mean': np.float64(0.5399838754636905), 'Std': np.float64(0.2766629588165351)}
[I 2024-12-06 23:37:18,447] Trial 209 finished with value: 1.0714285714285714 and parameters: {'x_0_0': 'ac', 'x_0_1': 'oo', 'x_1_0': 'cd', 'x_1_1': 'ac'}. Best is trial 23 with value: 0.5.
2024-12-06 23:37:18,645 - INFO - Candidate Mean Stats: {'Max': np.float64(2.9021623204605076), 'Min': np.float64(-1.0225574044744932), 'Mean': np.float64(0.5335616628732653), 'Std': np.float64(0.5162292172059232)}
2024-12-06 23:37:18,645 - INFO - Candidate Std Stats: {'Max': np.float64(1.6904841125354808), 'Min': np.float64(0.0), 'Mean': np.float64(0.6037335842716451), 'Std': np.float64(0.3020165954556925)}
2024-12-06 23:37:18,650 - INFO - Candidate Mean Stats: {'Max': np.float64(3.205943246570887), 'Min': np.float64(-0.9621262364801026), 'Mean': np.float64(0.4781726454751385), 'Std': np.float64(0.6024871077308254)}
2024-12-06 23:37:18,650 - INFO - Candidate Std Stats: {'Max': np.float64(1.6359274610084693), 'Min': np.float64(0.0), 'Mean': np.float64(0.6114440286096973), 'Std': np.float64(0.32038421164317105)}
[I 2024-12-06 23:37:18,659] Trial 211 finished with value: 1.0714285714285714 and parameters: {'x_0_0': 'ad', 'x_0_1': 'oo', 'x_1_0': 'cd', 'x_1_1': 'ab'}. Best is trial 165 with value: 0.5.
[I 2024-12-06 23:37:18,663] Trial 211 finished with value: 0.8214285714285714 and parameters: {'x_0_0': 'bd', 'x_0_1': 'oo', 'x_1_0': 'oo', 'x_1_1': 'ad'}. Best is trial 76 with value: 0.5.
2024-12-06 23:37:18,671 - INFO - Candidate Mean Stats: {'Max': np.float64(2.4939172190536536), 'Min': np.float64(-1.025013873180984), 'Mean': np.float64(0.518395654285691), 'Std': np.float64(0.48505154356724023)}
2024-12-06 23:37:18,671 - INFO - Candidate Std Stats: {'Max': np.float64(1.693701871988863), 'Min': np.float64(0.0), 'Mean': np.float64(0.5536356386538309), 'Std': np.float64(0.2858886588201807)}
[I 2024-12-06 23:37:18,684] Trial 211 finished with value: 0.9464285714285714 and parameters: {'x_0_0': 'bc', 'x_0_1': 'oo', 'x_1_0': 'ad', 'x_1_1': 'oo'}. Best is trial 63 with value: 0.5.
2024-12-06 23:37:18,800 - INFO - Candidate Mean Stats: {'Max': np.float64(2.765555693985119), 'Min': np.float64(-1.0937417473199766), 'Mean': np.float64(0.4765356975303112), 'Std': np.float64(0.5666790201598642)}
2024-12-06 23:37:18,801 - INFO - Candidate Std Stats: {'Max': np.float64(1.8925162073856272), 'Min': np.float64(0.0), 'Mean': np.float64(0.6089700231219575), 'Std': np.float64(0.31045580663918537)}
[I 2024-12-06 23:37:18,814] Trial 210 finished with value: 1.5714285714285714 and parameters: {'x_0_0': 'bd', 'x_0_1': 'ac', 'x_1_0': 'ad', 'x_1_1': 'ac'}. Best is trial 23 with value: 0.5.
2024-12-06 23:37:19,007 - INFO - Candidate Mean Stats: {'Max': np.float64(2.576405020289225), 'Min': np.float64(-0.9098301863490456), 'Mean': np.float64(0.497210594850608), 'Std': np.float64(0.5250460921915298)}
2024-12-06 23:37:19,008 - INFO - Candidate Std Stats: {'Max': np.float64(1.9119199193828615), 'Min': np.float64(0.0), 'Mean': np.float64(0.5751507814152064), 'Std': np.float64(0.2908203891881819)}
2024-12-06 23:37:19,014 - INFO - Candidate Mean Stats: {'Max': np.float64(2.8279518539730435), 'Min': np.float64(-1.2137609809769085), 'Mean': np.float64(0.4655366332031728), 'Std': np.float64(0.6353531755110166)}
2024-12-06 23:37:19,014 - INFO - Candidate Std Stats: {'Max': np.float64(2.6901099156443324), 'Min': np.float64(0.0), 'Mean': np.float64(0.6502011322261663), 'Std': np.float64(0.34193679115489556)}
[I 2024-12-06 23:37:19,022] Trial 212 finished with value: 1.4285714285714286 and parameters: {'x_0_0': 'ad', 'x_0_1': 'ab', 'x_1_0': 'ab', 'x_1_1': 'ac'}. Best is trial 165 with value: 0.5.
[I 2024-12-06 23:37:19,027] Trial 212 finished with value: 1.5714285714285714 and parameters: {'x_0_0': 'bc', 'x_0_1': 'bc', 'x_1_0': 'bc', 'x_1_1': 'ab'}. Best is trial 76 with value: 0.5.
2024-12-06 23:37:19,033 - INFO - Candidate Mean Stats: {'Max': np.float64(2.4147470090158656), 'Min': np.float64(-1.0029052518463928), 'Mean': np.float64(0.5084843073279186), 'Std': np.float64(0.4970942369283744)}
2024-12-06 23:37:19,033 - INFO - Candidate Std Stats: {'Max': np.float64(1.5925091419537691), 'Min': np.float64(0.0), 'Mean': np.float64(0.5863266094817043), 'Std': np.float64(0.2975725419768856)}
[I 2024-12-06 23:37:19,046] Trial 212 finished with value: 1.0714285714285714 and parameters: {'x_0_0': 'ad', 'x_0_1': 'oo', 'x_1_0': 'ad', 'x_1_1': 'bd'}. Best is trial 63 with value: 0.5.
2024-12-06 23:37:19,162 - INFO - Candidate Mean Stats: {'Max': np.float64(3.0591759735355564), 'Min': np.float64(-0.9300334510280335), 'Mean': np.float64(0.4895287127213575), 'Std': np.float64(0.5253429268487491)}
2024-12-06 23:37:19,163 - INFO - Candidate Std Stats: {'Max': np.float64(1.6763753746540149), 'Min': np.float64(0.0), 'Mean': np.float64(0.5935194869700698), 'Std': np.float64(0.3072625589610981)}
[I 2024-12-06 23:37:19,176] Trial 211 finished with value: 1.0714285714285714 and parameters: {'x_0_0': 'ad', 'x_0_1': 'oo', 'x_1_0': 'ad', 'x_1_1': 'cd'}. Best is trial 23 with value: 0.5.
2024-12-06 23:37:19,370 - INFO - Candidate Mean Stats: {'Max': np.float64(2.591459748856663), 'Min': np.float64(-0.8842371565089546), 'Mean': np.float64(0.5576728295011715), 'Std': np.float64(0.5299230801995505)}
2024-12-06 23:37:19,370 - INFO - Candidate Std Stats: {'Max': np.float64(1.6287922070547507), 'Min': np.float64(0.0), 'Mean': np.float64(0.561520565064157), 'Std': np.float64(0.29607049819678527)}
2024-12-06 23:37:19,377 - INFO - Candidate Mean Stats: {'Max': np.float64(2.962194652345487), 'Min': np.float64(-1.045061351545457), 'Mean': np.float64(0.48984464683245854), 'Std': np.float64(0.6247725467349657)}
2024-12-06 23:37:19,377 - INFO - Candidate Std Stats: {'Max': np.float64(1.9326122493840758), 'Min': np.float64(0.0), 'Mean': np.float64(0.6477839805419318), 'Std': np.float64(0.3386557234266275)}
[I 2024-12-06 23:37:19,384] Trial 213 finished with value: 1.2142857142857144 and parameters: {'x_0_0': 'ab', 'x_0_1': 'oo', 'x_1_0': 'bc', 'x_1_1': 'ad'}. Best is trial 165 with value: 0.5.
[I 2024-12-06 23:37:19,390] Trial 213 finished with value: 0.8214285714285714 and parameters: {'x_0_0': 'ad', 'x_0_1': 'oo', 'x_1_0': 'oo', 'x_1_1': 'bd'}. Best is trial 76 with value: 0.5.
2024-12-06 23:37:19,396 - INFO - Candidate Mean Stats: {'Max': np.float64(3.265201576567874), 'Min': np.float64(-0.628824618575954), 'Mean': np.float64(0.5979215156537273), 'Std': np.float64(0.4841727092752887)}
2024-12-06 23:37:19,396 - INFO - Candidate Std Stats: {'Max': np.float64(1.5653367263979907), 'Min': np.float64(0.0), 'Mean': np.float64(0.4808193896417179), 'Std': np.float64(0.25416759006239764)}
[I 2024-12-06 23:37:19,409] Trial 213 finished with value: 0.8214285714285714 and parameters: {'x_0_0': 'ad', 'x_0_1': 'oo', 'x_1_0': 'oo', 'x_1_1': 'ab'}. Best is trial 63 with value: 0.5.
2024-12-06 23:37:19,525 - INFO - Candidate Mean Stats: {'Max': np.float64(3.115037031469307), 'Min': np.float64(-1.1510423869870023), 'Mean': np.float64(0.5056665956267522), 'Std': np.float64(0.5943085800980957)}
2024-12-06 23:37:19,526 - INFO - Candidate Std Stats: {'Max': np.float64(1.8692816431123043), 'Min': np.float64(0.0), 'Mean': np.float64(0.6100272401646056), 'Std': np.float64(0.3086540863320778)}
[I 2024-12-06 23:37:19,539] Trial 212 finished with value: 1.0714285714285714 and parameters: {'x_0_0': 'ad', 'x_0_1': 'oo', 'x_1_0': 'cd', 'x_1_1': 'bc'}. Best is trial 23 with value: 0.5.
2024-12-06 23:37:19,734 - INFO - Candidate Mean Stats: {'Max': np.float64(3.025559812554712), 'Min': np.float64(-1.0392231894669042), 'Mean': np.float64(0.5078735678653625), 'Std': np.float64(0.5231544392854142)}
2024-12-06 23:37:19,734 - INFO - Candidate Std Stats: {'Max': np.float64(1.6510763177788677), 'Min': np.float64(0.0), 'Mean': np.float64(0.5991519844812283), 'Std': np.float64(0.3143671915033076)}
2024-12-06 23:37:19,740 - INFO - Candidate Mean Stats: {'Max': np.float64(2.7030537195297653), 'Min': np.float64(-1.0229756173285534), 'Mean': np.float64(0.4432938998073232), 'Std': np.float64(0.5600388022815452)}
2024-12-06 23:37:19,740 - INFO - Candidate Std Stats: {'Max': np.float64(1.6672620588016416), 'Min': np.float64(0.0), 'Mean': np.float64(0.5977231285255227), 'Std': np.float64(0.30988482887515567)}
[I 2024-12-06 23:37:19,748] Trial 214 finished with value: 1.0714285714285714 and parameters: {'x_0_0': 'ac', 'x_0_1': 'oo', 'x_1_0': 'bd', 'x_1_1': 'ab'}. Best is trial 165 with value: 0.5.
[I 2024-12-06 23:37:19,754] Trial 214 finished with value: 1.0714285714285714 and parameters: {'x_0_0': 'ac', 'x_0_1': 'oo', 'x_1_0': 'ad', 'x_1_1': 'bd'}. Best is trial 76 with value: 0.5.
2024-12-06 23:37:19,760 - INFO - Candidate Mean Stats: {'Max': np.float64(2.2967459264843577), 'Min': np.float64(-1.0179909829558789), 'Mean': np.float64(0.5173466454004998), 'Std': np.float64(0.5338039712346326)}
2024-12-06 23:37:19,760 - INFO - Candidate Std Stats: {'Max': np.float64(2.201191434981278), 'Min': np.float64(0.0), 'Mean': np.float64(0.608844435723562), 'Std': np.float64(0.32060193754438127)}
[I 2024-12-06 23:37:19,773] Trial 214 finished with value: 1.0714285714285714 and parameters: {'x_0_0': 'ad', 'x_0_1': 'oo', 'x_1_0': 'ac', 'x_1_1': 'bd'}. Best is trial 63 with value: 0.5.
2024-12-06 23:37:19,890 - INFO - Candidate Mean Stats: {'Max': np.float64(2.9285690867168714), 'Min': np.float64(-0.9645129993498008), 'Mean': np.float64(0.47887035781773485), 'Std': np.float64(0.5629370669207795)}
2024-12-06 23:37:19,891 - INFO - Candidate Std Stats: {'Max': np.float64(1.8401142841195666), 'Min': np.float64(0.0), 'Mean': np.float64(0.6838688476778347), 'Std': np.float64(0.34409074107854)}
