[I 2024-12-06 23:37:50,097] Trial 294 finished with value: 1.4464285714285714 and parameters: {'x_0_0': 'bd', 'x_0_1': 'ac', 'x_1_0': 'ac', 'x_1_1': 'oo'}. Best is trial 23 with value: 0.5.
2024-12-06 23:37:50,174 - INFO - Candidate Mean Stats: {'Max': np.float64(3.29193774397814), 'Min': np.float64(-1.2481962924061147), 'Mean': np.float64(0.6201335465073369), 'Std': np.float64(0.5437115711313033)}
2024-12-06 23:37:50,174 - INFO - Candidate Std Stats: {'Max': np.float64(1.9028037538554998), 'Min': np.float64(0.0), 'Mean': np.float64(0.565634429415515), 'Std': np.float64(0.3283134750341372)}
2024-12-06 23:37:50,176 - INFO - Candidate Mean Stats: {'Max': np.float64(3.0735424655487718), 'Min': np.float64(-0.7845787938715579), 'Mean': np.float64(0.6413383633829388), 'Std': np.float64(0.5417089858150977)}
2024-12-06 23:37:50,176 - INFO - Candidate Std Stats: {'Max': np.float64(1.9741394236497294), 'Min': np.float64(0.0), 'Mean': np.float64(0.5875968930935623), 'Std': np.float64(0.31926181243040375)}
2024-12-06 23:37:50,187 - INFO - Candidate Mean Stats: {'Max': np.float64(2.9927170081267502), 'Min': np.float64(-1.016387525244002), 'Mean': np.float64(0.5929416548950518), 'Std': np.float64(0.5603408014325716)}
2024-12-06 23:37:50,187 - INFO - Candidate Std Stats: {'Max': np.float64(1.8784365798148288), 'Min': np.float64(0.0), 'Mean': np.float64(0.577193340628846), 'Std': np.float64(0.32281494642025543)}
[I 2024-12-06 23:37:50,188] Trial 296 finished with value: 1.0714285714285714 and parameters: {'x_0_0': 'ac', 'x_0_1': 'oo', 'x_1_0': 'cd', 'x_1_1': 'ad'}. Best is trial 165 with value: 0.5.
[I 2024-12-06 23:37:50,190] Trial 296 finished with value: 1.0892857142857144 and parameters: {'x_0_0': 'ab', 'x_0_1': 'oo', 'x_1_0': 'bc', 'x_1_1': 'oo'}. Best is trial 76 with value: 0.5.
[I 2024-12-06 23:37:50,200] Trial 296 finished with value: 1.0714285714285714 and parameters: {'x_0_0': 'bc', 'x_0_1': 'oo', 'x_1_0': 'ac', 'x_1_1': 'ac'}. Best is trial 63 with value: 0.5.
2024-12-06 23:37:50,461 - INFO - Candidate Mean Stats: {'Max': np.float64(3.722550624819057), 'Min': np.float64(-0.8214354886026352), 'Mean': np.float64(0.7126102966108194), 'Std': np.float64(0.48038666790955925)}
2024-12-06 23:37:50,461 - INFO - Candidate Std Stats: {'Max': np.float64(1.684039461409665), 'Min': np.float64(0.0), 'Mean': np.float64(0.4682161025185549), 'Std': np.float64(0.28089511945563617)}
[I 2024-12-06 23:37:50,475] Trial 295 finished with value: 1.2142857142857144 and parameters: {'x_0_0': 'ab', 'x_0_1': 'oo', 'x_1_0': 'bd', 'x_1_1': 'ad'}. Best is trial 23 with value: 0.5.
2024-12-06 23:37:50,550 - INFO - Candidate Mean Stats: {'Max': np.float64(3.1498222488700645), 'Min': np.float64(-1.3232911014377362), 'Mean': np.float64(0.5843040975663414), 'Std': np.float64(0.5783938073805729)}
2024-12-06 23:37:50,550 - INFO - Candidate Std Stats: {'Max': np.float64(1.925612724295883), 'Min': np.float64(0.0), 'Mean': np.float64(0.5996198073637695), 'Std': np.float64(0.34807495441109343)}
2024-12-06 23:37:50,553 - INFO - Candidate Mean Stats: {'Max': np.float64(2.9666196046526143), 'Min': np.float64(-0.6594685732146409), 'Mean': np.float64(0.5939098667985955), 'Std': np.float64(0.5682831451804085)}
2024-12-06 23:37:50,553 - INFO - Candidate Std Stats: {'Max': np.float64(1.5664045805699969), 'Min': np.float64(0.0), 'Mean': np.float64(0.547026722808032), 'Std': np.float64(0.29804053477816983)}
2024-12-06 23:37:50,562 - INFO - Candidate Mean Stats: {'Max': np.float64(3.2656392042646645), 'Min': np.float64(-0.7303025490846327), 'Mean': np.float64(0.6248568611071503), 'Std': np.float64(0.5493211766383358)}
2024-12-06 23:37:50,562 - INFO - Candidate Std Stats: {'Max': np.float64(1.5966798738564612), 'Min': np.float64(0.0), 'Mean': np.float64(0.5348824112502856), 'Std': np.float64(0.307328714257402)}
[I 2024-12-06 23:37:50,564] Trial 297 finished with value: 1.0714285714285714 and parameters: {'x_0_0': 'bc', 'x_0_1': 'oo', 'x_1_0': 'bc', 'x_1_1': 'ab'}. Best is trial 165 with value: 0.5.
[I 2024-12-06 23:37:50,567] Trial 297 finished with value: 1.1607142857142856 and parameters: {'x_0_0': 'bc', 'x_0_1': 'ac', 'x_1_0': 'ad', 'x_1_1': 'oo'}. Best is trial 76 with value: 0.5.
[I 2024-12-06 23:37:50,575] Trial 297 finished with value: 1.5714285714285714 and parameters: {'x_0_0': 'bd', 'x_0_1': 'ad', 'x_1_0': 'cd', 'x_1_1': 'ab'}. Best is trial 63 with value: 0.5.
2024-12-06 23:37:50,839 - INFO - Candidate Mean Stats: {'Max': np.float64(3.776576580081438), 'Min': np.float64(-0.8370496840704265), 'Mean': np.float64(0.6914706142783345), 'Std': np.float64(0.5302674615201893)}
2024-12-06 23:37:50,840 - INFO - Candidate Std Stats: {'Max': np.float64(1.5895870744853373), 'Min': np.float64(0.0), 'Mean': np.float64(0.5414347002773149), 'Std': np.float64(0.3135944848324892)}
[I 2024-12-06 23:37:50,853] Trial 296 finished with value: 1.2142857142857144 and parameters: {'x_0_0': 'ab', 'x_0_1': 'oo', 'x_1_0': 'cd', 'x_1_1': 'ad'}. Best is trial 23 with value: 0.5.
2024-12-06 23:37:50,927 - INFO - Candidate Mean Stats: {'Max': np.float64(3.104870747188485), 'Min': np.float64(-0.7564233051721215), 'Mean': np.float64(0.6567350400281499), 'Std': np.float64(0.5036005005038882)}
2024-12-06 23:37:50,927 - INFO - Candidate Std Stats: {'Max': np.float64(1.6199414692916587), 'Min': np.float64(0.0), 'Mean': np.float64(0.5110643582944966), 'Std': np.float64(0.30111582614802207)}
2024-12-06 23:37:50,933 - INFO - Candidate Mean Stats: {'Max': np.float64(3.3186188906407765), 'Min': np.float64(-0.8478833339004508), 'Mean': np.float64(0.6430980693461598), 'Std': np.float64(0.519902149903537)}
2024-12-06 23:37:50,933 - INFO - Candidate Std Stats: {'Max': np.float64(1.5972994453231077), 'Min': np.float64(0.0), 'Mean': np.float64(0.5569463065773355), 'Std': np.float64(0.3184007472239996)}
2024-12-06 23:37:50,939 - INFO - Candidate Mean Stats: {'Max': np.float64(2.941352462758948), 'Min': np.float64(-0.8853584830204708), 'Mean': np.float64(0.6088482538467985), 'Std': np.float64(0.5784950473083019)}
2024-12-06 23:37:50,939 - INFO - Candidate Std Stats: {'Max': np.float64(1.7100886991579713), 'Min': np.float64(0.0), 'Mean': np.float64(0.5799233661688518), 'Std': np.float64(0.32073692195181935)}
[I 2024-12-06 23:37:50,942] Trial 298 finished with value: 1.0714285714285714 and parameters: {'x_0_0': 'ac', 'x_0_1': 'oo', 'x_1_0': 'bc', 'x_1_1': 'ad'}. Best is trial 165 with value: 0.5.
[I 2024-12-06 23:37:50,947] Trial 298 finished with value: 1.375 and parameters: {'x_0_0': 'oo', 'x_0_1': 'oo', 'x_1_0': 'cd', 'x_1_1': 'ac'}. Best is trial 76 with value: 0.5.
[I 2024-12-06 23:37:50,953] Trial 298 finished with value: 1.3214285714285714 and parameters: {'x_0_0': 'ad', 'x_0_1': 'cd', 'x_1_0': 'oo', 'x_1_1': 'cd'}. Best is trial 63 with value: 0.5.
2024-12-06 23:37:51,219 - INFO - Candidate Mean Stats: {'Max': np.float64(3.020753118532859), 'Min': np.float64(-0.56992321832968), 'Mean': np.float64(0.697170266693186), 'Std': np.float64(0.4839340915504696)}
2024-12-06 23:37:51,219 - INFO - Candidate Std Stats: {'Max': np.float64(1.3563408293960575), 'Min': np.float64(0.0), 'Mean': np.float64(0.49705420656059274), 'Std': np.float64(0.2756589940138403)}
[I 2024-12-06 23:37:51,232] Trial 297 finished with value: 1.0714285714285714 and parameters: {'x_0_0': 'bc', 'x_0_1': 'oo', 'x_1_0': 'ad', 'x_1_1': 'ad'}. Best is trial 23 with value: 0.5.
2024-12-06 23:37:51,304 - INFO - Candidate Mean Stats: {'Max': np.float64(3.009679840565156), 'Min': np.float64(-1.5174123341976757), 'Mean': np.float64(0.4912700629485701), 'Std': np.float64(0.6696394650269996)}
2024-12-06 23:37:51,304 - INFO - Candidate Std Stats: {'Max': np.float64(1.789040032844158), 'Min': np.float64(0.0), 'Mean': np.float64(0.6604272116883944), 'Std': np.float64(0.36095750167592316)}
2024-12-06 23:37:51,312 - INFO - Candidate Mean Stats: {'Max': np.float64(2.7732329267241593), 'Min': np.float64(-0.85567999663925), 'Mean': np.float64(0.6997104770313161), 'Std': np.float64(0.4977346144074833)}
2024-12-06 23:37:51,312 - INFO - Candidate Std Stats: {'Max': np.float64(1.4094128048851944), 'Min': np.float64(0.0), 'Mean': np.float64(0.4810077651325197), 'Std': np.float64(0.27281346016390795)}
2024-12-06 23:37:51,315 - INFO - Candidate Mean Stats: {'Max': np.float64(2.8155223507788483), 'Min': np.float64(-0.9920080768138154), 'Mean': np.float64(0.6404032999077798), 'Std': np.float64(0.5441090700846335)}
2024-12-06 23:37:51,315 - INFO - Candidate Std Stats: {'Max': np.float64(1.7807827043386333), 'Min': np.float64(0.0), 'Mean': np.float64(0.5531205256099293), 'Std': np.float64(0.3113553342535418)}
[I 2024-12-06 23:37:51,319] Trial 299 finished with value: 1.4285714285714286 and parameters: {'x_0_0': 'bc', 'x_0_1': 'ab', 'x_1_0': 'bc', 'x_1_1': 'bd'}. Best is trial 165 with value: 0.5.
[I 2024-12-06 23:37:51,327] Trial 299 finished with value: 0.7857142857142857 and parameters: {'x_0_0': 'bd', 'x_0_1': 'oo', 'x_1_0': 'bd', 'x_1_1': 'bd'}. Best is trial 76 with value: 0.5.
[I 2024-12-06 23:37:51,328] Trial 299 finished with value: 1.0714285714285714 and parameters: {'x_0_0': 'ac', 'x_0_1': 'oo', 'x_1_0': 'bc', 'x_1_1': 'ac'}. Best is trial 63 with value: 0.5.
2024-12-06 23:37:51,599 - INFO - Candidate Mean Stats: {'Max': np.float64(3.2924195093679076), 'Min': np.float64(-0.7041654627899917), 'Mean': np.float64(0.6107883741892524), 'Std': np.float64(0.5787449444897812)}
2024-12-06 23:37:51,600 - INFO - Candidate Std Stats: {'Max': np.float64(1.4908283759116703), 'Min': np.float64(0.0), 'Mean': np.float64(0.5276748781172623), 'Std': np.float64(0.30103453183574724)}
[I 2024-12-06 23:37:51,614] Trial 298 finished with value: 1.5714285714285714 and parameters: {'x_0_0': 'bd', 'x_0_1': 'ac', 'x_1_0': 'cd', 'x_1_1': 'ac'}. Best is trial 23 with value: 0.5.
2024-12-06 23:37:51,683 - INFO - Candidate Mean Stats: {'Max': np.float64(2.987016719523357), 'Min': np.float64(-0.8833687141696066), 'Mean': np.float64(0.6275733236881403), 'Std': np.float64(0.5457786417290079)}
2024-12-06 23:37:51,683 - INFO - Candidate Std Stats: {'Max': np.float64(1.7165412217277993), 'Min': np.float64(0.0), 'Mean': np.float64(0.5639495035065026), 'Std': np.float64(0.31352985438014175)}
2024-12-06 23:37:51,689 - INFO - Candidate Mean Stats: {'Max': np.float64(3.032644566854373), 'Min': np.float64(-0.9781568798511913), 'Mean': np.float64(0.6386615872215242), 'Std': np.float64(0.587237953775989)}
2024-12-06 23:37:51,689 - INFO - Candidate Std Stats: {'Max': np.float64(1.7199943062358594), 'Min': np.float64(0.0), 'Mean': np.float64(0.5937963183099656), 'Std': np.float64(0.33865777486994375)}
2024-12-06 23:37:51,697 - INFO - Candidate Mean Stats: {'Max': np.float64(3.1749222345569548), 'Min': np.float64(-0.956168572657156), 'Mean': np.float64(0.6021166436640187), 'Std': np.float64(0.5567192558859041)}
2024-12-06 23:37:51,698 - INFO - Candidate Std Stats: {'Max': np.float64(1.520926670370975), 'Min': np.float64(0.0), 'Mean': np.float64(0.5589187523736061), 'Std': np.float64(0.3126750205370682)}
[I 2024-12-06 23:37:51,698] Trial 300 finished with value: 1.0714285714285714 and parameters: {'x_0_0': 'ac', 'x_0_1': 'oo', 'x_1_0': 'ac', 'x_1_1': 'cd'}. Best is trial 165 with value: 0.5.
[I 2024-12-06 23:37:51,703] Trial 300 finished with value: 1.2142857142857144 and parameters: {'x_0_0': 'ab', 'x_0_1': 'oo', 'x_1_0': 'ab', 'x_1_1': 'ac'}. Best is trial 76 with value: 0.5.
[I 2024-12-06 23:37:51,711] Trial 300 finished with value: 1.2142857142857144 and parameters: {'x_0_0': 'ab', 'x_0_1': 'oo', 'x_1_0': 'ab', 'x_1_1': 'ad'}. Best is trial 63 with value: 0.5.
2024-12-06 23:37:51,980 - INFO - Candidate Mean Stats: {'Max': np.float64(2.8332148519717757), 'Min': np.float64(-1.0063230156539444), 'Mean': np.float64(0.6416381122240743), 'Std': np.float64(0.573460234613045)}
2024-12-06 23:37:51,980 - INFO - Candidate Std Stats: {'Max': np.float64(1.6870962536664542), 'Min': np.float64(0.0), 'Mean': np.float64(0.5470663608089611), 'Std': np.float64(0.3003927950623629)}
[I 2024-12-06 23:37:51,994] Trial 299 finished with value: 1.3214285714285714 and parameters: {'x_0_0': 'bd', 'x_0_1': 'ad', 'x_1_0': 'oo', 'x_1_1': 'cd'}. Best is trial 23 with value: 0.5.
2024-12-06 23:37:52,062 - INFO - Candidate Mean Stats: {'Max': np.float64(3.407314680312189), 'Min': np.float64(-0.9716350104202902), 'Mean': np.float64(0.7138167617515465), 'Std': np.float64(0.5922916456616036)}
2024-12-06 23:37:52,062 - INFO - Candidate Std Stats: {'Max': np.float64(1.7824345982047891), 'Min': np.float64(0.0), 'Mean': np.float64(0.49828868476032473), 'Std': np.float64(0.28565387009045123)}
2024-12-06 23:37:52,066 - INFO - Candidate Mean Stats: {'Max': np.float64(2.864729805825749), 'Min': np.float64(-0.6970051651782971), 'Mean': np.float64(0.6409737981393383), 'Std': np.float64(0.5468900903081295)}
2024-12-06 23:37:52,066 - INFO - Candidate Std Stats: {'Max': np.float64(1.8720679700793406), 'Min': np.float64(0.0), 'Mean': np.float64(0.5474884686261524), 'Std': np.float64(0.3147468294182248)}
2024-12-06 23:37:52,075 - INFO - Candidate Mean Stats: {'Max': np.float64(3.093716017302106), 'Min': np.float64(-1.234752741255307), 'Mean': np.float64(0.509045074730634), 'Std': np.float64(0.6120852085317866)}
2024-12-06 23:37:52,075 - INFO - Candidate Std Stats: {'Max': np.float64(1.6463046047858472), 'Min': np.float64(0.0), 'Mean': np.float64(0.6698322040974155), 'Std': np.float64(0.38015074812177774)}
[I 2024-12-06 23:37:52,076] Trial 301 finished with value: 1.1607142857142856 and parameters: {'x_0_0': 'ac', 'x_0_1': 'ad', 'x_1_0': 'ac', 'x_1_1': 'oo'}. Best is trial 165 with value: 0.5.
[I 2024-12-06 23:37:52,081] Trial 301 finished with value: 0.9107142857142857 and parameters: {'x_0_0': 'bc', 'x_0_1': 'ad', 'x_1_0': 'oo', 'x_1_1': 'oo'}. Best is trial 76 with value: 0.5.
[I 2024-12-06 23:37:52,089] Trial 301 finished with value: 1.2142857142857144 and parameters: {'x_0_0': 'ab', 'x_0_1': 'oo', 'x_1_0': 'ac', 'x_1_1': 'ad'}. Best is trial 63 with value: 0.5.
2024-12-06 23:37:52,358 - INFO - Candidate Mean Stats: {'Max': np.float64(2.87551181554598), 'Min': np.float64(-0.8282729919753375), 'Mean': np.float64(0.6419531602068396), 'Std': np.float64(0.5327289370773827)}
2024-12-06 23:37:52,358 - INFO - Candidate Std Stats: {'Max': np.float64(1.5545115727267036), 'Min': np.float64(0.0), 'Mean': np.float64(0.5093483832599175), 'Std': np.float64(0.2839993035116425)}
[I 2024-12-06 23:37:52,372] Trial 300 finished with value: 1.3214285714285714 and parameters: {'x_0_0': 'ac', 'x_0_1': 'bd', 'x_1_0': 'oo', 'x_1_1': 'bc'}. Best is trial 23 with value: 0.5.
2024-12-06 23:37:52,441 - INFO - Candidate Mean Stats: {'Max': np.float64(3.635991374089587), 'Min': np.float64(-0.9411320717111428), 'Mean': np.float64(0.6124347962153213), 'Std': np.float64(0.6016343191366433)}
2024-12-06 23:37:52,441 - INFO - Candidate Std Stats: {'Max': np.float64(1.7331563171889985), 'Min': np.float64(0.0), 'Mean': np.float64(0.5735812312431832), 'Std': np.float64(0.3235718392671307)}
2024-12-06 23:37:52,445 - INFO - Candidate Mean Stats: {'Max': np.float64(2.925874721957287), 'Min': np.float64(-0.5787096294269032), 'Mean': np.float64(0.6851692859136348), 'Std': np.float64(0.49240056676296756)}
2024-12-06 23:37:52,445 - INFO - Candidate Std Stats: {'Max': np.float64(1.597681312681918), 'Min': np.float64(0.0), 'Mean': np.float64(0.4764905032176371), 'Std': np.float64(0.27409773838969126)}
[I 2024-12-06 23:37:52,455] Trial 302 finished with value: 1.0714285714285714 and parameters: {'x_0_0': 'bc', 'x_0_1': 'oo', 'x_1_0': 'ab', 'x_1_1': 'bd'}. Best is trial 165 with value: 0.5.
2024-12-06 23:37:52,458 - INFO - Candidate Mean Stats: {'Max': np.float64(2.824019409256936), 'Min': np.float64(-0.6343170146296873), 'Mean': np.float64(0.644983779131032), 'Std': np.float64(0.541150795655186)}
2024-12-06 23:37:52,458 - INFO - Candidate Std Stats: {'Max': np.float64(1.4916393725016894), 'Min': np.float64(0.0), 'Mean': np.float64(0.5557894853571196), 'Std': np.float64(0.31324490276457356)}
[I 2024-12-06 23:37:52,459] Trial 302 finished with value: 1.0714285714285714 and parameters: {'x_0_0': 'bc', 'x_0_1': 'oo', 'x_1_0': 'bc', 'x_1_1': 'ad'}. Best is trial 76 with value: 0.5.
[I 2024-12-06 23:37:52,471] Trial 302 finished with value: 1.2857142857142856 and parameters: {'x_0_0': 'bd', 'x_0_1': 'ab', 'x_1_0': 'bc', 'x_1_1': 'cd'}. Best is trial 63 with value: 0.5.
2024-12-06 23:37:52,742 - INFO - Candidate Mean Stats: {'Max': np.float64(2.9382451557723313), 'Min': np.float64(-0.823680622065368), 'Mean': np.float64(0.6497297955530994), 'Std': np.float64(0.5455862746038922)}
2024-12-06 23:37:52,742 - INFO - Candidate Std Stats: {'Max': np.float64(1.6506402735411967), 'Min': np.float64(0.0), 'Mean': np.float64(0.5664015846629594), 'Std': np.float64(0.3233369560023648)}
[I 2024-12-06 23:37:52,756] Trial 301 finished with value: 1.3035714285714286 and parameters: {'x_0_0': 'bd', 'x_0_1': 'ac', 'x_1_0': 'ab', 'x_1_1': 'oo'}. Best is trial 23 with value: 0.5.
2024-12-06 23:37:52,821 - INFO - Candidate Mean Stats: {'Max': np.float64(2.877672928294859), 'Min': np.float64(-0.7599590491340117), 'Mean': np.float64(0.6908711331965739), 'Std': np.float64(0.5380483986897006)}
2024-12-06 23:37:52,821 - INFO - Candidate Std Stats: {'Max': np.float64(1.5074819826416244), 'Min': np.float64(0.0), 'Mean': np.float64(0.5297667362698546), 'Std': np.float64(0.2954264231279772)}
2024-12-06 23:37:52,824 - INFO - Candidate Mean Stats: {'Max': np.float64(2.8231917425910433), 'Min': np.float64(-0.6472256343705437), 'Mean': np.float64(0.6358704356331935), 'Std': np.float64(0.5356241476299036)}
2024-12-06 23:37:52,824 - INFO - Candidate Std Stats: {'Max': np.float64(1.754637310704288), 'Min': np.float64(0.0), 'Mean': np.float64(0.5577664510261521), 'Std': np.float64(0.31581911911442145)}
[I 2024-12-06 23:37:52,836] Trial 303 finished with value: 1.2142857142857144 and parameters: {'x_0_0': 'ab', 'x_0_1': 'oo', 'x_1_0': 'ad', 'x_1_1': 'cd'}. Best is trial 165 with value: 0.5.
2024-12-06 23:37:52,837 - INFO - Candidate Mean Stats: {'Max': np.float64(2.827106773446745), 'Min': np.float64(-0.9196051374111629), 'Mean': np.float64(0.6133656579945191), 'Std': np.float64(0.5845683730955751)}
2024-12-06 23:37:52,837 - INFO - Candidate Std Stats: {'Max': np.float64(1.7231934055946039), 'Min': np.float64(0.0), 'Mean': np.float64(0.5860176966877068), 'Std': np.float64(0.32706043928834033)}
[I 2024-12-06 23:37:52,838] Trial 303 finished with value: 1.0714285714285714 and parameters: {'x_0_0': 'bd', 'x_0_1': 'oo', 'x_1_0': 'ad', 'x_1_1': 'ad'}. Best is trial 76 with value: 0.5.
[I 2024-12-06 23:37:52,850] Trial 303 finished with value: 1.4464285714285714 and parameters: {'x_0_0': 'ad', 'x_0_1': 'bc', 'x_1_0': 'cd', 'x_1_1': 'oo'}. Best is trial 63 with value: 0.5.
2024-12-06 23:37:53,124 - INFO - Candidate Mean Stats: {'Max': np.float64(3.295551332594836), 'Min': np.float64(-0.7759339232838796), 'Mean': np.float64(0.7093586221200632), 'Std': np.float64(0.5291679327932604)}
2024-12-06 23:37:53,124 - INFO - Candidate Std Stats: {'Max': np.float64(1.6804792169444516), 'Min': np.float64(0.0), 'Mean': np.float64(0.4950003049878511), 'Std': np.float64(0.2883235901267045)}
[I 2024-12-06 23:37:53,138] Trial 302 finished with value: 1.4285714285714286 and parameters: {'x_0_0': 'bc', 'x_0_1': 'ab', 'x_1_0': 'bd', 'x_1_1': 'ad'}. Best is trial 23 with value: 0.5.
2024-12-06 23:37:53,200 - INFO - Candidate Mean Stats: {'Max': np.float64(3.250322587813737), 'Min': np.float64(-1.0085240379721179), 'Mean': np.float64(0.5724781614710908), 'Std': np.float64(0.6250806102855204)}
2024-12-06 23:37:53,202 - INFO - Candidate Std Stats: {'Max': np.float64(1.820860428367689), 'Min': np.float64(0.0), 'Mean': np.float64(0.603639325912159), 'Std': np.float64(0.3541653967289625)}
2024-12-06 23:37:53,204 - INFO - Candidate Mean Stats: {'Max': np.float64(3.38915100292461), 'Min': np.float64(-0.5977543433825677), 'Mean': np.float64(0.6945892174694273), 'Std': np.float64(0.5070003122815091)}
2024-12-06 23:37:53,206 - INFO - Candidate Std Stats: {'Max': np.float64(1.486036371239078), 'Min': np.float64(0.0), 'Mean': np.float64(0.47845036675238933), 'Std': np.float64(0.27189872222476713)}
2024-12-06 23:37:53,213 - INFO - Candidate Mean Stats: {'Max': np.float64(2.9863571129104782), 'Min': np.float64(-0.5800398292873732), 'Mean': np.float64(0.619849415555538), 'Std': np.float64(0.5385482450987166)}
2024-12-06 23:37:53,214 - INFO - Candidate Std Stats: {'Max': np.float64(1.5015122031885642), 'Min': np.float64(0.0), 'Mean': np.float64(0.5426817173426352), 'Std': np.float64(0.3063673651594277)}
[I 2024-12-06 23:37:53,230] Trial 304 finished with value: 1.3214285714285714 and parameters: {'x_0_0': 'bd', 'x_0_1': 'bd', 'x_1_0': 'oo', 'x_1_1': 'ad'}. Best is trial 165 with value: 0.5.
[I 2024-12-06 23:37:53,230] Trial 304 finished with value: 1.1607142857142856 and parameters: {'x_0_0': 'bd', 'x_0_1': 'ad', 'x_1_0': 'bc', 'x_1_1': 'oo'}. Best is trial 76 with value: 0.5.
[I 2024-12-06 23:37:53,231] Trial 304 finished with value: 1.0714285714285714 and parameters: {'x_0_0': 'ac', 'x_0_1': 'oo', 'x_1_0': 'ab', 'x_1_1': 'ac'}. Best is trial 63 with value: 0.5.
2024-12-06 23:37:53,500 - INFO - Candidate Mean Stats: {'Max': np.float64(3.0501937284380345), 'Min': np.float64(-0.9823520172388769), 'Mean': np.float64(0.6620564653984895), 'Std': np.float64(0.5484384620264176)}
2024-12-06 23:37:53,500 - INFO - Candidate Std Stats: {'Max': np.float64(1.6977698578234182), 'Min': np.float64(0.0), 'Mean': np.float64(0.4874812636493435), 'Std': np.float64(0.2864774692811028)}
