[I 2024-12-06 23:38:21,279] Trial 377 finished with value: 1.3392857142857144 and parameters: {'x_0_0': 'ab', 'x_0_1': 'bd', 'x_1_0': 'oo', 'x_1_1': 'oo'}. Best is trial 165 with value: 0.5.
[I 2024-12-06 23:38:21,285] Trial 375 finished with value: 1.1964285714285714 and parameters: {'x_0_0': 'bd', 'x_0_1': 'ad', 'x_1_0': 'oo', 'x_1_1': 'oo'}. Best is trial 23 with value: 0.5.
2024-12-06 23:38:21,294 - INFO - Candidate Mean Stats: {'Max': np.float64(2.79969716533408), 'Min': np.float64(-0.5284357247136949), 'Mean': np.float64(0.7594735408605743), 'Std': np.float64(0.46985569886195433)}
2024-12-06 23:38:21,294 - INFO - Candidate Std Stats: {'Max': np.float64(1.7177095570108185), 'Min': np.float64(0.0), 'Mean': np.float64(0.43616668217629617), 'Std': np.float64(0.2824441851126384)}
[I 2024-12-06 23:38:21,308] Trial 377 finished with value: 1.125 and parameters: {'x_0_0': 'oo', 'x_0_1': 'oo', 'x_1_0': 'oo', 'x_1_1': 'bc'}. Best is trial 63 with value: 0.5.
2024-12-06 23:38:21,594 - INFO - Candidate Mean Stats: {'Max': np.float64(3.254242092139131), 'Min': np.float64(-0.6681128603548181), 'Mean': np.float64(0.7360433558639418), 'Std': np.float64(0.5463750606048076)}
2024-12-06 23:38:21,594 - INFO - Candidate Std Stats: {'Max': np.float64(1.4547237319855089), 'Min': np.float64(0.0), 'Mean': np.float64(0.47246397492016695), 'Std': np.float64(0.28080282516290145)}
[I 2024-12-06 23:38:21,612] Trial 378 finished with value: 1.3214285714285714 and parameters: {'x_0_0': 'bc', 'x_0_1': 'cd', 'x_1_0': 'oo', 'x_1_1': 'bd'}. Best is trial 76 with value: 0.5.
2024-12-06 23:38:21,654 - INFO - Candidate Mean Stats: {'Max': np.float64(3.01777800264725), 'Min': np.float64(-0.7209806532729515), 'Mean': np.float64(0.7479135605538856), 'Std': np.float64(0.5111548851332296)}
2024-12-06 23:38:21,654 - INFO - Candidate Std Stats: {'Max': np.float64(1.6582765211195567), 'Min': np.float64(0.0), 'Mean': np.float64(0.4414771753666292), 'Std': np.float64(0.29072365289720936)}
2024-12-06 23:38:21,664 - INFO - Candidate Mean Stats: {'Max': np.float64(3.3096780523874636), 'Min': np.float64(-0.6270297554035493), 'Mean': np.float64(0.7876613156391177), 'Std': np.float64(0.4839278261039744)}
2024-12-06 23:38:21,665 - INFO - Candidate Std Stats: {'Max': np.float64(1.4456389904405187), 'Min': np.float64(0.0), 'Mean': np.float64(0.4800329479657029), 'Std': np.float64(0.28782663106955714)}
[I 2024-12-06 23:38:21,668] Trial 378 finished with value: 1.5 and parameters: {'x_0_0': 'cd', 'x_0_1': 'oo', 'x_1_0': 'ad', 'x_1_1': 'bc'}. Best is trial 165 with value: 0.5.
[I 2024-12-06 23:38:21,678] Trial 376 finished with value: 1.5 and parameters: {'x_0_0': 'cd', 'x_0_1': 'oo', 'x_1_0': 'ad', 'x_1_1': 'bd'}. Best is trial 23 with value: 0.5.
2024-12-06 23:38:21,682 - INFO - Candidate Mean Stats: {'Max': np.float64(2.995798602690009), 'Min': np.float64(-0.3831905633752533), 'Mean': np.float64(0.8006918370063782), 'Std': np.float64(0.4806737521253122)}
2024-12-06 23:38:21,682 - INFO - Candidate Std Stats: {'Max': np.float64(2.0657780269742188), 'Min': np.float64(0.0), 'Mean': np.float64(0.4358278593835087), 'Std': np.float64(0.2970279097371729)}
[I 2024-12-06 23:38:21,696] Trial 378 finished with value: 1.5 and parameters: {'x_0_0': 'cd', 'x_0_1': 'oo', 'x_1_0': 'ab', 'x_1_1': 'ad'}. Best is trial 63 with value: 0.5.
2024-12-06 23:38:21,981 - INFO - Candidate Mean Stats: {'Max': np.float64(2.7929598490045655), 'Min': np.float64(-0.3681785712412159), 'Mean': np.float64(0.8079022570739112), 'Std': np.float64(0.46822298934584283)}
2024-12-06 23:38:21,982 - INFO - Candidate Std Stats: {'Max': np.float64(1.881159982564219), 'Min': np.float64(0.0), 'Mean': np.float64(0.4608907868929768), 'Std': np.float64(0.3241751020048001)}
[I 2024-12-06 23:38:21,996] Trial 379 finished with value: 1.0714285714285714 and parameters: {'x_0_0': 'ac', 'x_0_1': 'oo', 'x_1_0': 'bc', 'x_1_1': 'bd'}. Best is trial 76 with value: 0.5.
2024-12-06 23:38:22,040 - INFO - Candidate Mean Stats: {'Max': np.float64(3.1562785632874277), 'Min': np.float64(-0.6209227694598252), 'Mean': np.float64(0.65729561164047), 'Std': np.float64(0.5551861069964071)}
2024-12-06 23:38:22,040 - INFO - Candidate Std Stats: {'Max': np.float64(1.6086662084398455), 'Min': np.float64(0.0), 'Mean': np.float64(0.5559015038029542), 'Std': np.float64(0.32835247349303054)}
2024-12-06 23:38:22,051 - INFO - Candidate Mean Stats: {'Max': np.float64(3.0475022210988905), 'Min': np.float64(-0.4743481479090147), 'Mean': np.float64(0.81449530904525), 'Std': np.float64(0.4842056470592595)}
2024-12-06 23:38:22,051 - INFO - Candidate Std Stats: {'Max': np.float64(1.4653575600052933), 'Min': np.float64(0.0), 'Mean': np.float64(0.43401673766012194), 'Std': np.float64(0.28888772420316483)}
[I 2024-12-06 23:38:22,054] Trial 379 finished with value: 1.4464285714285714 and parameters: {'x_0_0': 'bc', 'x_0_1': 'bd', 'x_1_0': 'ad', 'x_1_1': 'oo'}. Best is trial 165 with value: 0.5.
[I 2024-12-06 23:38:22,065] Trial 377 finished with value: 1.5714285714285714 and parameters: {'x_0_0': 'bd', 'x_0_1': 'ad', 'x_1_0': 'cd', 'x_1_1': 'bc'}. Best is trial 23 with value: 0.5.
2024-12-06 23:38:22,068 - INFO - Candidate Mean Stats: {'Max': np.float64(3.260902292161904), 'Min': np.float64(-1.0988754685032835), 'Mean': np.float64(0.6642240040396764), 'Std': np.float64(0.5984538709446521)}
2024-12-06 23:38:22,068 - INFO - Candidate Std Stats: {'Max': np.float64(1.4661290210050812), 'Min': np.float64(0.0), 'Mean': np.float64(0.5057015196747389), 'Std': np.float64(0.30750818212245223)}
[I 2024-12-06 23:38:22,081] Trial 379 finished with value: 1.1785714285714286 and parameters: {'x_0_0': 'bc', 'x_0_1': 'ab', 'x_1_0': 'oo', 'x_1_1': 'cd'}. Best is trial 63 with value: 0.5.
2024-12-06 23:38:22,366 - INFO - Candidate Mean Stats: {'Max': np.float64(2.8893152826663324), 'Min': np.float64(-0.977333794150046), 'Mean': np.float64(0.5715648107396301), 'Std': np.float64(0.6423820111527395)}
2024-12-06 23:38:22,366 - INFO - Candidate Std Stats: {'Max': np.float64(1.5811977577787621), 'Min': np.float64(0.0), 'Mean': np.float64(0.5532259782976876), 'Std': np.float64(0.33496998102196246)}
[I 2024-12-06 23:38:22,380] Trial 380 finished with value: 1.2857142857142856 and parameters: {'x_0_0': 'ad', 'x_0_1': 'ad', 'x_1_0': 'bd', 'x_1_1': 'ab'}. Best is trial 76 with value: 0.5.
2024-12-06 23:38:22,425 - INFO - Candidate Mean Stats: {'Max': np.float64(3.3569507689806812), 'Min': np.float64(-0.949164085407228), 'Mean': np.float64(0.7342166223250268), 'Std': np.float64(0.5788421355738882)}
2024-12-06 23:38:22,425 - INFO - Candidate Std Stats: {'Max': np.float64(1.5283327844518069), 'Min': np.float64(0.0), 'Mean': np.float64(0.46912167896633256), 'Std': np.float64(0.2853514950886515)}
2024-12-06 23:38:22,440 - INFO - Candidate Mean Stats: {'Max': np.float64(2.714723583696817), 'Min': np.float64(-0.9205292547216487), 'Mean': np.float64(0.6979702224216553), 'Std': np.float64(0.537378353035873)}
2024-12-06 23:38:22,440 - INFO - Candidate Std Stats: {'Max': np.float64(1.510400023690961), 'Min': np.float64(0.0), 'Mean': np.float64(0.5116036730239887), 'Std': np.float64(0.313105281162092)}
[I 2024-12-06 23:38:22,440] Trial 380 finished with value: 1.1785714285714286 and parameters: {'x_0_0': 'bc', 'x_0_1': 'ab', 'x_1_0': 'oo', 'x_1_1': 'bc'}. Best is trial 165 with value: 0.5.
[I 2024-12-06 23:38:22,454] Trial 378 finished with value: 1.2857142857142856 and parameters: {'x_0_0': 'ac', 'x_0_1': 'ac', 'x_1_0': 'ab', 'x_1_1': 'bc'}. Best is trial 23 with value: 0.5.
2024-12-06 23:38:22,454 - INFO - Candidate Mean Stats: {'Max': np.float64(3.7588453461921034), 'Min': np.float64(-0.9127005707219993), 'Mean': np.float64(0.6329861721516651), 'Std': np.float64(0.6607839081669199)}
2024-12-06 23:38:22,454 - INFO - Candidate Std Stats: {'Max': np.float64(1.7709466396066773), 'Min': np.float64(0.0), 'Mean': np.float64(0.5590920335971578), 'Std': np.float64(0.33889898769183296)}
[I 2024-12-06 23:38:22,468] Trial 380 finished with value: 1.1607142857142856 and parameters: {'x_0_0': 'bd', 'x_0_1': 'ab', 'x_1_0': 'bd', 'x_1_1': 'oo'}. Best is trial 63 with value: 0.5.
2024-12-06 23:38:22,800 - INFO - Candidate Mean Stats: {'Max': np.float64(3.488341033925206), 'Min': np.float64(-0.8714880021825685), 'Mean': np.float64(0.6831241426510486), 'Std': np.float64(0.5757752412855394)}
2024-12-06 23:38:22,800 - INFO - Candidate Std Stats: {'Max': np.float64(1.6837768908308932), 'Min': np.float64(0.0), 'Mean': np.float64(0.521364108596801), 'Std': np.float64(0.3266483787033366)}
[I 2024-12-06 23:38:22,814] Trial 381 finished with value: 1.2857142857142856 and parameters: {'x_0_0': 'ac', 'x_0_1': 'ac', 'x_1_0': 'ac', 'x_1_1': 'bd'}. Best is trial 76 with value: 0.5.
2024-12-06 23:38:22,852 - INFO - Candidate Mean Stats: {'Max': np.float64(3.50559149623843), 'Min': np.float64(-0.606039113740055), 'Mean': np.float64(0.6712120927496849), 'Std': np.float64(0.572505568798039)}
2024-12-06 23:38:22,853 - INFO - Candidate Std Stats: {'Max': np.float64(1.6950113865794794), 'Min': np.float64(0.0), 'Mean': np.float64(0.5486016642935149), 'Std': np.float64(0.3262521168088165)}
[I 2024-12-06 23:38:22,866] Trial 381 finished with value: 1.4285714285714286 and parameters: {'x_0_0': 'bc', 'x_0_1': 'ab', 'x_1_0': 'bc', 'x_1_1': 'cd'}. Best is trial 165 with value: 0.5.
2024-12-06 23:38:22,874 - INFO - Candidate Mean Stats: {'Max': np.float64(3.3696100898731522), 'Min': np.float64(-0.478769443902131), 'Mean': np.float64(0.7555771345371949), 'Std': np.float64(0.46746814059979264)}
2024-12-06 23:38:22,874 - INFO - Candidate Std Stats: {'Max': np.float64(1.3969417814246277), 'Min': np.float64(0.0), 'Mean': np.float64(0.44915301100801347), 'Std': np.float64(0.2660904915700257)}
2024-12-06 23:38:22,886 - INFO - Candidate Mean Stats: {'Max': np.float64(3.0495696758029496), 'Min': np.float64(-0.7222058236834711), 'Mean': np.float64(0.7090356423020137), 'Std': np.float64(0.547473331945917)}
2024-12-06 23:38:22,886 - INFO - Candidate Std Stats: {'Max': np.float64(1.94453028095033), 'Min': np.float64(0.0), 'Mean': np.float64(0.5240963130884421), 'Std': np.float64(0.32438592248234777)}
[I 2024-12-06 23:38:22,888] Trial 379 finished with value: 1.3214285714285714 and parameters: {'x_0_0': 'bc', 'x_0_1': 'bc', 'x_1_0': 'oo', 'x_1_1': 'ac'}. Best is trial 23 with value: 0.5.
[I 2024-12-06 23:38:22,900] Trial 381 finished with value: 1.5714285714285714 and parameters: {'x_0_0': 'ad', 'x_0_1': 'ac', 'x_1_0': 'cd', 'x_1_1': 'cd'}. Best is trial 63 with value: 0.5.
2024-12-06 23:38:23,181 - INFO - Candidate Mean Stats: {'Max': np.float64(3.1052848559197903), 'Min': np.float64(-0.951541863470808), 'Mean': np.float64(0.6831647130554187), 'Std': np.float64(0.5834610954926054)}
2024-12-06 23:38:23,181 - INFO - Candidate Std Stats: {'Max': np.float64(1.46419634168852), 'Min': np.float64(0.0), 'Mean': np.float64(0.48100043192399844), 'Std': np.float64(0.29104153557900986)}
[I 2024-12-06 23:38:23,195] Trial 382 finished with value: 1.1607142857142856 and parameters: {'x_0_0': 'ac', 'x_0_1': 'ad', 'x_1_0': 'ab', 'x_1_1': 'oo'}. Best is trial 76 with value: 0.5.
2024-12-06 23:38:23,236 - INFO - Candidate Mean Stats: {'Max': np.float64(3.3272448925484), 'Min': np.float64(-0.7371561100476827), 'Mean': np.float64(0.6898513978798984), 'Std': np.float64(0.5798037777931963)}
2024-12-06 23:38:23,236 - INFO - Candidate Std Stats: {'Max': np.float64(1.7858800861146937), 'Min': np.float64(0.0), 'Mean': np.float64(0.5320862151844648), 'Std': np.float64(0.3258208320421062)}
[I 2024-12-06 23:38:23,249] Trial 382 finished with value: 1.2857142857142856 and parameters: {'x_0_0': 'ad', 'x_0_1': 'ac', 'x_1_0': 'bd', 'x_1_1': 'cd'}. Best is trial 165 with value: 0.5.
2024-12-06 23:38:23,263 - INFO - Candidate Mean Stats: {'Max': np.float64(3.3037509379865098), 'Min': np.float64(-0.5848855142427096), 'Mean': np.float64(0.8038008799765505), 'Std': np.float64(0.5034113837148196)}
2024-12-06 23:38:23,263 - INFO - Candidate Std Stats: {'Max': np.float64(1.4728452516978385), 'Min': np.float64(0.0), 'Mean': np.float64(0.4620119289851344), 'Std': np.float64(0.28123189759532247)}
2024-12-06 23:38:23,269 - INFO - Candidate Mean Stats: {'Max': np.float64(2.7774799305270195), 'Min': np.float64(-0.5220309283035032), 'Mean': np.float64(0.8034891495327351), 'Std': np.float64(0.4532782474143201)}
2024-12-06 23:38:23,269 - INFO - Candidate Std Stats: {'Max': np.float64(1.4631596996067484), 'Min': np.float64(0.0), 'Mean': np.float64(0.4258084447056808), 'Std': np.float64(0.2790751087459665)}
[I 2024-12-06 23:38:23,278] Trial 380 finished with value: 0.9642857142857143 and parameters: {'x_0_0': 'ab', 'x_0_1': 'oo', 'x_1_0': 'oo', 'x_1_1': 'bd'}. Best is trial 23 with value: 0.5.
[I 2024-12-06 23:38:23,283] Trial 382 finished with value: 1.375 and parameters: {'x_0_0': 'oo', 'x_0_1': 'oo', 'x_1_0': 'bc', 'x_1_1': 'ad'}. Best is trial 63 with value: 0.5.
2024-12-06 23:38:23,566 - INFO - Candidate Mean Stats: {'Max': np.float64(3.1222919004741008), 'Min': np.float64(-0.8599634553991319), 'Mean': np.float64(0.7138828687482259), 'Std': np.float64(0.5981980007173299)}
2024-12-06 23:38:23,566 - INFO - Candidate Std Stats: {'Max': np.float64(1.7216566089263272), 'Min': np.float64(0.0), 'Mean': np.float64(0.5534240619548657), 'Std': np.float64(0.34475019406692653)}
[I 2024-12-06 23:38:23,581] Trial 383 finished with value: 1.1964285714285714 and parameters: {'x_0_0': 'bc', 'x_0_1': 'bc', 'x_1_0': 'oo', 'x_1_1': 'oo'}. Best is trial 76 with value: 0.5.
2024-12-06 23:38:23,619 - INFO - Candidate Mean Stats: {'Max': np.float64(2.7512591366976986), 'Min': np.float64(-0.5574528642994956), 'Mean': np.float64(0.6879155524071469), 'Std': np.float64(0.4997108420870525)}
2024-12-06 23:38:23,620 - INFO - Candidate Std Stats: {'Max': np.float64(2.028412984163776), 'Min': np.float64(0.0), 'Mean': np.float64(0.5782063251046042), 'Std': np.float64(0.36272703368652787)}
[I 2024-12-06 23:38:23,634] Trial 383 finished with value: 1.375 and parameters: {'x_0_0': 'oo', 'x_0_1': 'oo', 'x_1_0': 'ab', 'x_1_1': 'ab'}. Best is trial 165 with value: 0.5.
2024-12-06 23:38:23,655 - INFO - Candidate Mean Stats: {'Max': np.float64(2.9571730934476395), 'Min': np.float64(-0.6033047707799519), 'Mean': np.float64(0.7330006068311221), 'Std': np.float64(0.5196182860429377)}
2024-12-06 23:38:23,655 - INFO - Candidate Std Stats: {'Max': np.float64(1.5799604105265677), 'Min': np.float64(0.0), 'Mean': np.float64(0.5237367364523045), 'Std': np.float64(0.31240615839361663)}
2024-12-06 23:38:23,657 - INFO - Candidate Mean Stats: {'Max': np.float64(3.149317708971387), 'Min': np.float64(-0.7660477984983303), 'Mean': np.float64(0.7374333709499158), 'Std': np.float64(0.5256437360937175)}
2024-12-06 23:38:23,657 - INFO - Candidate Std Stats: {'Max': np.float64(1.4863067045406428), 'Min': np.float64(0.0), 'Mean': np.float64(0.4800904514302667), 'Std': np.float64(0.29367737719176334)}
[I 2024-12-06 23:38:23,670] Trial 383 finished with value: 1.1964285714285714 and parameters: {'x_0_0': 'bc', 'x_0_1': 'bd', 'x_1_0': 'oo', 'x_1_1': 'oo'}. Best is trial 63 with value: 0.5.
[I 2024-12-06 23:38:23,671] Trial 381 finished with value: 1.5 and parameters: {'x_0_0': 'cd', 'x_0_1': 'oo', 'x_1_0': 'bd', 'x_1_1': 'cd'}. Best is trial 23 with value: 0.5.
2024-12-06 23:38:23,951 - INFO - Candidate Mean Stats: {'Max': np.float64(2.7227483617612895), 'Min': np.float64(-0.8797762799664579), 'Mean': np.float64(0.677419540414814), 'Std': np.float64(0.5130089623643873)}
2024-12-06 23:38:23,951 - INFO - Candidate Std Stats: {'Max': np.float64(1.7866518956033801), 'Min': np.float64(0.0), 'Mean': np.float64(0.5219864865074719), 'Std': np.float64(0.3307133359672481)}
[I 2024-12-06 23:38:23,965] Trial 384 finished with value: 1.3214285714285714 and parameters: {'x_0_0': 'ad', 'x_0_1': 'ad', 'x_1_0': 'oo', 'x_1_1': 'ac'}. Best is trial 76 with value: 0.5.
2024-12-06 23:38:24,007 - INFO - Candidate Mean Stats: {'Max': np.float64(3.2111021294000333), 'Min': np.float64(-0.9031574325489258), 'Mean': np.float64(0.6630843229703333), 'Std': np.float64(0.6574939659251665)}
2024-12-06 23:38:24,007 - INFO - Candidate Std Stats: {'Max': np.float64(1.5016494717628965), 'Min': np.float64(0.0), 'Mean': np.float64(0.5205600322781996), 'Std': np.float64(0.3092925966727419)}
[I 2024-12-06 23:38:24,021] Trial 384 finished with value: 1.3214285714285714 and parameters: {'x_0_0': 'ad', 'x_0_1': 'ac', 'x_1_0': 'oo', 'x_1_1': 'bc'}. Best is trial 165 with value: 0.5.
2024-12-06 23:38:24,041 - INFO - Candidate Mean Stats: {'Max': np.float64(3.281946606170391), 'Min': np.float64(-0.30085574061438247), 'Mean': np.float64(0.835426731133849), 'Std': np.float64(0.43392634868144075)}
2024-12-06 23:38:24,041 - INFO - Candidate Std Stats: {'Max': np.float64(1.6642077850871648), 'Min': np.float64(0.0), 'Mean': np.float64(0.3947936931689684), 'Std': np.float64(0.27162365279254824)}
2024-12-06 23:38:24,047 - INFO - Candidate Mean Stats: {'Max': np.float64(2.933045907173876), 'Min': np.float64(-0.46884008515987946), 'Mean': np.float64(0.7864354274261317), 'Std': np.float64(0.5201705124895152)}
2024-12-06 23:38:24,047 - INFO - Candidate Std Stats: {'Max': np.float64(1.4776061392272122), 'Min': np.float64(0.0), 'Mean': np.float64(0.4688857594466163), 'Std': np.float64(0.27704151658333315)}
[I 2024-12-06 23:38:24,056] Trial 384 finished with value: 1.375 and parameters: {'x_0_0': 'oo', 'x_0_1': 'oo', 'x_1_0': 'ac', 'x_1_1': 'ac'}. Best is trial 63 with value: 0.5.
[I 2024-12-06 23:38:24,061] Trial 382 finished with value: 1.2142857142857144 and parameters: {'x_0_0': 'ab', 'x_0_1': 'oo', 'x_1_0': 'ac', 'x_1_1': 'ab'}. Best is trial 23 with value: 0.5.
2024-12-06 23:38:24,335 - INFO - Candidate Mean Stats: {'Max': np.float64(2.9683504262694136), 'Min': np.float64(-0.6170751434413095), 'Mean': np.float64(0.7911691551088484), 'Std': np.float64(0.5397249658715205)}
2024-12-06 23:38:24,335 - INFO - Candidate Std Stats: {'Max': np.float64(1.4468485535103324), 'Min': np.float64(0.0), 'Mean': np.float64(0.4800410187542393), 'Std': np.float64(0.28905397129114724)}
[I 2024-12-06 23:38:24,349] Trial 385 finished with value: 1.2142857142857144 and parameters: {'x_0_0': 'ab', 'x_0_1': 'oo', 'x_1_0': 'ab', 'x_1_1': 'bc'}. Best is trial 76 with value: 0.5.
2024-12-06 23:38:24,391 - INFO - Candidate Mean Stats: {'Max': np.float64(3.2994339765497855), 'Min': np.float64(-0.6617681468443305), 'Mean': np.float64(0.7084859004961925), 'Std': np.float64(0.5666765133305476)}
2024-12-06 23:38:24,391 - INFO - Candidate Std Stats: {'Max': np.float64(2.009193969492862), 'Min': np.float64(0.0), 'Mean': np.float64(0.5252207784181213), 'Std': np.float64(0.3200989398233069)}
[I 2024-12-06 23:38:24,405] Trial 385 finished with value: 1.2857142857142856 and parameters: {'x_0_0': 'ad', 'x_0_1': 'ac', 'x_1_0': 'bd', 'x_1_1': 'ab'}. Best is trial 165 with value: 0.5.
2024-12-06 23:38:24,429 - INFO - Candidate Mean Stats: {'Max': np.float64(3.063324872497116), 'Min': np.float64(-0.3964598570665553), 'Mean': np.float64(0.8162303712078716), 'Std': np.float64(0.4671940871633399)}
2024-12-06 23:38:24,429 - INFO - Candidate Std Stats: {'Max': np.float64(1.6136613927040668), 'Min': np.float64(0.0), 'Mean': np.float64(0.4776446223385455), 'Std': np.float64(0.29982152029005515)}
2024-12-06 23:38:24,436 - INFO - Candidate Mean Stats: {'Max': np.float64(2.8919989362772753), 'Min': np.float64(-0.6260362905839344), 'Mean': np.float64(0.747360192804347), 'Std': np.float64(0.5237858312028724)}
2024-12-06 23:38:24,436 - INFO - Candidate Std Stats: {'Max': np.float64(1.9431697894771027), 'Min': np.float64(0.0), 'Mean': np.float64(0.5293384525509516), 'Std': np.float64(0.3154469766346594)}
[I 2024-12-06 23:38:24,444] Trial 385 finished with value: 1.75 and parameters: {'x_0_0': 'cd', 'x_0_1': 'ab', 'x_1_0': 'oo', 'x_1_1': 'ac'}. Best is trial 63 with value: 0.5.
[I 2024-12-06 23:38:24,450] Trial 383 finished with value: 1.2857142857142856 and parameters: {'x_0_0': 'bd', 'x_0_1': 'ad', 'x_1_0': 'bc', 'x_1_1': 'cd'}. Best is trial 23 with value: 0.5.
2024-12-06 23:38:24,722 - INFO - Candidate Mean Stats: {'Max': np.float64(3.076312246269703), 'Min': np.float64(-0.8024468558990387), 'Mean': np.float64(0.6976967488188203), 'Std': np.float64(0.5714777252411972)}
2024-12-06 23:38:24,722 - INFO - Candidate Std Stats: {'Max': np.float64(1.6004948342721619), 'Min': np.float64(0.0), 'Mean': np.float64(0.5156774298400498), 'Std': np.float64(0.3121061901989164)}
[I 2024-12-06 23:38:24,737] Trial 386 finished with value: 1.3214285714285714 and parameters: {'x_0_0': 'ad', 'x_0_1': 'bd', 'x_1_0': 'oo', 'x_1_1': 'bd'}. Best is trial 76 with value: 0.5.
2024-12-06 23:38:24,777 - INFO - Candidate Mean Stats: {'Max': np.float64(2.8302995448393444), 'Min': np.float64(-0.695548583510232), 'Mean': np.float64(0.713996848652779), 'Std': np.float64(0.5516543509155192)}
2024-12-06 23:38:24,777 - INFO - Candidate Std Stats: {'Max': np.float64(1.7075302682786313), 'Min': np.float64(0.0), 'Mean': np.float64(0.5568713705200204), 'Std': np.float64(0.3390618217034391)}
