[I 2024-12-06 23:38:24,791] Trial 386 finished with value: 1.2142857142857144 and parameters: {'x_0_0': 'ab', 'x_0_1': 'oo', 'x_1_0': 'bd', 'x_1_1': 'bc'}. Best is trial 165 with value: 0.5.
2024-12-06 23:38:24,816 - INFO - Candidate Mean Stats: {'Max': np.float64(2.6454043783554733), 'Min': np.float64(-0.4427924170649938), 'Mean': np.float64(0.8332461160155342), 'Std': np.float64(0.4442740986437598)}
2024-12-06 23:38:24,816 - INFO - Candidate Std Stats: {'Max': np.float64(1.5979627281730135), 'Min': np.float64(0.0), 'Mean': np.float64(0.4309620798749667), 'Std': np.float64(0.28204558827630477)}
2024-12-06 23:38:24,828 - INFO - Candidate Mean Stats: {'Max': np.float64(3.1225650298867804), 'Min': np.float64(-0.5398026577575432), 'Mean': np.float64(0.7719142987427681), 'Std': np.float64(0.5223353636312696)}
2024-12-06 23:38:24,829 - INFO - Candidate Std Stats: {'Max': np.float64(1.4190843323296536), 'Min': np.float64(0.0), 'Mean': np.float64(0.4413628062126794), 'Std': np.float64(0.27355633691952214)}
[I 2024-12-06 23:38:24,830] Trial 386 finished with value: 0.9285714285714286 and parameters: {'x_0_0': 'ad', 'x_0_1': 'oo', 'x_1_0': 'ab', 'x_1_1': 'ab'}. Best is trial 63 with value: 0.5.
[I 2024-12-06 23:38:24,842] Trial 384 finished with value: 1.3214285714285714 and parameters: {'x_0_0': 'ad', 'x_0_1': 'bc', 'x_1_0': 'oo', 'x_1_1': 'ad'}. Best is trial 23 with value: 0.5.
2024-12-06 23:38:25,110 - INFO - Candidate Mean Stats: {'Max': np.float64(3.2611146979792003), 'Min': np.float64(-0.8536541118231937), 'Mean': np.float64(0.6770414251940058), 'Std': np.float64(0.5705190885865334)}
2024-12-06 23:38:25,110 - INFO - Candidate Std Stats: {'Max': np.float64(1.8265521745076796), 'Min': np.float64(0.0), 'Mean': np.float64(0.5202292706472337), 'Std': np.float64(0.32271048291832655)}
[I 2024-12-06 23:38:25,124] Trial 387 finished with value: 1.3214285714285714 and parameters: {'x_0_0': 'ad', 'x_0_1': 'ad', 'x_1_0': 'oo', 'x_1_1': 'ab'}. Best is trial 76 with value: 0.5.
2024-12-06 23:38:25,161 - INFO - Candidate Mean Stats: {'Max': np.float64(3.475637634828066), 'Min': np.float64(-1.0431960878173587), 'Mean': np.float64(0.6457626633036421), 'Std': np.float64(0.6232936623015278)}
2024-12-06 23:38:25,161 - INFO - Candidate Std Stats: {'Max': np.float64(1.8513826164120695), 'Min': np.float64(0.0), 'Mean': np.float64(0.5636790186975458), 'Std': np.float64(0.3459970223112951)}
[I 2024-12-06 23:38:25,176] Trial 387 finished with value: 1.2857142857142856 and parameters: {'x_0_0': 'bc', 'x_0_1': 'ad', 'x_1_0': 'bd', 'x_1_1': 'cd'}. Best is trial 165 with value: 0.5.
2024-12-06 23:38:25,204 - INFO - Candidate Mean Stats: {'Max': np.float64(3.079281980753212), 'Min': np.float64(-1.0837255206493173), 'Mean': np.float64(0.6645706095255868), 'Std': np.float64(0.6085358111837617)}
2024-12-06 23:38:25,204 - INFO - Candidate Std Stats: {'Max': np.float64(1.9331058362900024), 'Min': np.float64(0.0), 'Mean': np.float64(0.5015074758981555), 'Std': np.float64(0.31719478251662475)}
2024-12-06 23:38:25,215 - INFO - Candidate Mean Stats: {'Max': np.float64(2.9836921928896465), 'Min': np.float64(-0.6308652083885926), 'Mean': np.float64(0.7734467005651768), 'Std': np.float64(0.5077157185897817)}
2024-12-06 23:38:25,215 - INFO - Candidate Std Stats: {'Max': np.float64(1.3888092580293177), 'Min': np.float64(0.0), 'Mean': np.float64(0.48262757276500917), 'Std': np.float64(0.2903710641690892)}
[I 2024-12-06 23:38:25,218] Trial 387 finished with value: 1.3214285714285714 and parameters: {'x_0_0': 'bc', 'x_0_1': 'bd', 'x_1_0': 'oo', 'x_1_1': 'ac'}. Best is trial 63 with value: 0.5.
[I 2024-12-06 23:38:25,228] Trial 385 finished with value: 1.2142857142857144 and parameters: {'x_0_0': 'ab', 'x_0_1': 'oo', 'x_1_0': 'bd', 'x_1_1': 'ac'}. Best is trial 23 with value: 0.5.
2024-12-06 23:38:25,496 - INFO - Candidate Mean Stats: {'Max': np.float64(3.0368467426019676), 'Min': np.float64(-0.8126050526637876), 'Mean': np.float64(0.704585755322837), 'Std': np.float64(0.5687709303207877)}
2024-12-06 23:38:25,496 - INFO - Candidate Std Stats: {'Max': np.float64(1.6385810104521494), 'Min': np.float64(0.0), 'Mean': np.float64(0.5147959139927267), 'Std': np.float64(0.32349858060774483)}
[I 2024-12-06 23:38:25,511] Trial 388 finished with value: 1.1964285714285714 and parameters: {'x_0_0': 'ac', 'x_0_1': 'bd', 'x_1_0': 'oo', 'x_1_1': 'oo'}. Best is trial 76 with value: 0.5.
2024-12-06 23:38:25,546 - INFO - Candidate Mean Stats: {'Max': np.float64(3.4972592455440767), 'Min': np.float64(-0.7155049080283826), 'Mean': np.float64(0.7608002720367163), 'Std': np.float64(0.5329517070322028)}
2024-12-06 23:38:25,546 - INFO - Candidate Std Stats: {'Max': np.float64(1.9179054507748698), 'Min': np.float64(0.0), 'Mean': np.float64(0.4614232325540109), 'Std': np.float64(0.3247844521185506)}
[I 2024-12-06 23:38:25,561] Trial 388 finished with value: 1.25 and parameters: {'x_0_0': 'cd', 'x_0_1': 'oo', 'x_1_0': 'oo', 'x_1_1': 'ac'}. Best is trial 165 with value: 0.5.
2024-12-06 23:38:25,591 - INFO - Candidate Mean Stats: {'Max': np.float64(3.1053717323592194), 'Min': np.float64(-0.5009148622655932), 'Mean': np.float64(0.7852841295914981), 'Std': np.float64(0.5212105561627183)}
2024-12-06 23:38:25,591 - INFO - Candidate Std Stats: {'Max': np.float64(1.6449499543191402), 'Min': np.float64(0.0), 'Mean': np.float64(0.42592835008729135), 'Std': np.float64(0.265854764074033)}
2024-12-06 23:38:25,602 - INFO - Candidate Mean Stats: {'Max': np.float64(3.420354024161102), 'Min': np.float64(-0.32095682189167174), 'Mean': np.float64(0.7943530009400459), 'Std': np.float64(0.47848299880378037)}
2024-12-06 23:38:25,603 - INFO - Candidate Std Stats: {'Max': np.float64(1.7663990517422017), 'Min': np.float64(0.0), 'Mean': np.float64(0.4472052165483751), 'Std': np.float64(0.28382179115867684)}
[I 2024-12-06 23:38:25,604] Trial 388 finished with value: 1.4464285714285714 and parameters: {'x_0_0': 'bc', 'x_0_1': 'bc', 'x_1_0': 'ab', 'x_1_1': 'oo'}. Best is trial 63 with value: 0.5.
[I 2024-12-06 23:38:25,616] Trial 386 finished with value: 1.0357142857142856 and parameters: {'x_0_0': 'bc', 'x_0_1': 'ad', 'x_1_0': 'oo', 'x_1_1': 'ad'}. Best is trial 23 with value: 0.5.
2024-12-06 23:38:25,884 - INFO - Candidate Mean Stats: {'Max': np.float64(3.546553533803838), 'Min': np.float64(-0.5758186279591687), 'Mean': np.float64(0.76911787731479), 'Std': np.float64(0.5336512090535422)}
2024-12-06 23:38:25,885 - INFO - Candidate Std Stats: {'Max': np.float64(1.5875326703687143), 'Min': np.float64(0.0), 'Mean': np.float64(0.4794146443031008), 'Std': np.float64(0.2993257914705856)}
[I 2024-12-06 23:38:25,899] Trial 389 finished with value: 1.5 and parameters: {'x_0_0': 'cd', 'x_0_1': 'oo', 'x_1_0': 'ad', 'x_1_1': 'ad'}. Best is trial 76 with value: 0.5.
2024-12-06 23:38:25,934 - INFO - Candidate Mean Stats: {'Max': np.float64(3.4495984763952023), 'Min': np.float64(-0.4829485947090265), 'Mean': np.float64(0.7447495546510116), 'Std': np.float64(0.535618060185986)}
2024-12-06 23:38:25,934 - INFO - Candidate Std Stats: {'Max': np.float64(1.5971443700505963), 'Min': np.float64(0.0), 'Mean': np.float64(0.5087828438747549), 'Std': np.float64(0.31653877009995707)}
[I 2024-12-06 23:38:25,948] Trial 389 finished with value: 1.75 and parameters: {'x_0_0': 'cd', 'x_0_1': 'cd', 'x_1_0': 'oo', 'x_1_1': 'ad'}. Best is trial 165 with value: 0.5.
2024-12-06 23:38:25,980 - INFO - Candidate Mean Stats: {'Max': np.float64(3.4473021511951885), 'Min': np.float64(-0.41409376940297254), 'Mean': np.float64(0.8040530792813818), 'Std': np.float64(0.5108708108581586)}
2024-12-06 23:38:25,981 - INFO - Candidate Std Stats: {'Max': np.float64(1.7264992913621995), 'Min': np.float64(0.0), 'Mean': np.float64(0.41856456853503743), 'Std': np.float64(0.28691672587994066)}
2024-12-06 23:38:25,993 - INFO - Candidate Mean Stats: {'Max': np.float64(3.1690298535884223), 'Min': np.float64(-0.5468331842559133), 'Mean': np.float64(0.7758880992720365), 'Std': np.float64(0.5001986967417195)}
2024-12-06 23:38:25,993 - INFO - Candidate Std Stats: {'Max': np.float64(1.554686048982425), 'Min': np.float64(0.0), 'Mean': np.float64(0.47804425192872796), 'Std': np.float64(0.2912193670496307)}
[I 2024-12-06 23:38:25,994] Trial 389 finished with value: 1.1964285714285714 and parameters: {'x_0_0': 'ac', 'x_0_1': 'cd', 'x_1_0': 'oo', 'x_1_1': 'oo'}. Best is trial 63 with value: 0.5.
[I 2024-12-06 23:38:26,007] Trial 387 finished with value: 1.0357142857142856 and parameters: {'x_0_0': 'bc', 'x_0_1': 'ad', 'x_1_0': 'oo', 'x_1_1': 'cd'}. Best is trial 23 with value: 0.5.
2024-12-06 23:38:26,270 - INFO - Candidate Mean Stats: {'Max': np.float64(2.9962914606613174), 'Min': np.float64(-0.6889564184222057), 'Mean': np.float64(0.7630509755301061), 'Std': np.float64(0.5357568293739636)}
2024-12-06 23:38:26,270 - INFO - Candidate Std Stats: {'Max': np.float64(1.6889148234822853), 'Min': np.float64(0.0), 'Mean': np.float64(0.5241587476323065), 'Std': np.float64(0.32113879846753407)}
[I 2024-12-06 23:38:26,284] Trial 390 finished with value: 1.2142857142857144 and parameters: {'x_0_0': 'ab', 'x_0_1': 'oo', 'x_1_0': 'cd', 'x_1_1': 'bd'}. Best is trial 76 with value: 0.5.
2024-12-06 23:38:26,324 - INFO - Candidate Mean Stats: {'Max': np.float64(3.261232664037613), 'Min': np.float64(-0.413172994576579), 'Mean': np.float64(0.7830070582665539), 'Std': np.float64(0.5216139609496023)}
2024-12-06 23:38:26,325 - INFO - Candidate Std Stats: {'Max': np.float64(1.646814745516438), 'Min': np.float64(0.0), 'Mean': np.float64(0.4567303649223845), 'Std': np.float64(0.29010422167282457)}
[I 2024-12-06 23:38:26,339] Trial 390 finished with value: 1.5714285714285714 and parameters: {'x_0_0': 'bc', 'x_0_1': 'bd', 'x_1_0': 'ab', 'x_1_1': 'ab'}. Best is trial 165 with value: 0.5.
2024-12-06 23:38:26,369 - INFO - Candidate Mean Stats: {'Max': np.float64(2.875364129195755), 'Min': np.float64(-0.7429213183325218), 'Mean': np.float64(0.7370295892982274), 'Std': np.float64(0.5519593621391116)}
2024-12-06 23:38:26,369 - INFO - Candidate Std Stats: {'Max': np.float64(1.5056836919936225), 'Min': np.float64(0.0), 'Mean': np.float64(0.49675426207326523), 'Std': np.float64(0.3123411305358404)}
[I 2024-12-06 23:38:26,383] Trial 390 finished with value: 1.2857142857142856 and parameters: {'x_0_0': 'ac', 'x_0_1': 'ac', 'x_1_0': 'bc', 'x_1_1': 'bd'}. Best is trial 63 with value: 0.5.
2024-12-06 23:38:26,387 - INFO - Candidate Mean Stats: {'Max': np.float64(3.102776496827848), 'Min': np.float64(-0.70161079363629), 'Mean': np.float64(0.7408078257281655), 'Std': np.float64(0.538379083093969)}
2024-12-06 23:38:26,387 - INFO - Candidate Std Stats: {'Max': np.float64(1.4189118573777544), 'Min': np.float64(0.0), 'Mean': np.float64(0.49865466290187815), 'Std': np.float64(0.29680050186007706)}
[I 2024-12-06 23:38:26,400] Trial 388 finished with value: 1.0357142857142856 and parameters: {'x_0_0': 'ac', 'x_0_1': 'ad', 'x_1_0': 'oo', 'x_1_1': 'ac'}. Best is trial 23 with value: 0.5.
2024-12-06 23:38:26,657 - INFO - Candidate Mean Stats: {'Max': np.float64(3.0660097125900476), 'Min': np.float64(-0.53650031184856), 'Mean': np.float64(0.7623427780036434), 'Std': np.float64(0.5517938245474405)}
2024-12-06 23:38:26,657 - INFO - Candidate Std Stats: {'Max': np.float64(1.5035485985326864), 'Min': np.float64(0.0), 'Mean': np.float64(0.4667517796320824), 'Std': np.float64(0.2908644567321396)}
[I 2024-12-06 23:38:26,671] Trial 391 finished with value: 1.1607142857142856 and parameters: {'x_0_0': 'bd', 'x_0_1': 'cd', 'x_1_0': 'bd', 'x_1_1': 'oo'}. Best is trial 76 with value: 0.5.
2024-12-06 23:38:26,713 - INFO - Candidate Mean Stats: {'Max': np.float64(3.7082619511841366), 'Min': np.float64(-0.8874627088215508), 'Mean': np.float64(0.7327724337499223), 'Std': np.float64(0.5543621339730975)}
2024-12-06 23:38:26,713 - INFO - Candidate Std Stats: {'Max': np.float64(1.7498301536876408), 'Min': np.float64(0.0), 'Mean': np.float64(0.5213986306323907), 'Std': np.float64(0.3266904006448185)}
[I 2024-12-06 23:38:26,727] Trial 391 finished with value: 1.2857142857142856 and parameters: {'x_0_0': 'ac', 'x_0_1': 'ad', 'x_1_0': 'bd', 'x_1_1': 'ad'}. Best is trial 165 with value: 0.5.
2024-12-06 23:38:26,756 - INFO - Candidate Mean Stats: {'Max': np.float64(3.094509092908002), 'Min': np.float64(-0.4632365482746055), 'Mean': np.float64(0.7835435988849576), 'Std': np.float64(0.4809767919167399)}
2024-12-06 23:38:26,756 - INFO - Candidate Std Stats: {'Max': np.float64(1.5860989662173297), 'Min': np.float64(0.0), 'Mean': np.float64(0.4555931687253955), 'Std': np.float64(0.29122208633789687)}
[I 2024-12-06 23:38:26,770] Trial 391 finished with value: 1.5714285714285714 and parameters: {'x_0_0': 'bc', 'x_0_1': 'bc', 'x_1_0': 'bc', 'x_1_1': 'cd'}. Best is trial 63 with value: 0.5.
2024-12-06 23:38:26,776 - INFO - Candidate Mean Stats: {'Max': np.float64(2.8247236856856506), 'Min': np.float64(-0.5518726535976712), 'Mean': np.float64(0.7073084153103351), 'Std': np.float64(0.5222328643417057)}
2024-12-06 23:38:26,776 - INFO - Candidate Std Stats: {'Max': np.float64(1.455384042240561), 'Min': np.float64(0.0), 'Mean': np.float64(0.5315965698725871), 'Std': np.float64(0.30485857991831544)}
[I 2024-12-06 23:38:26,790] Trial 389 finished with value: 1.0357142857142856 and parameters: {'x_0_0': 'ac', 'x_0_1': 'ac', 'x_1_0': 'oo', 'x_1_1': 'ab'}. Best is trial 23 with value: 0.5.
2024-12-06 23:38:27,042 - INFO - Candidate Mean Stats: {'Max': np.float64(2.690630747654187), 'Min': np.float64(-0.5999779972536485), 'Mean': np.float64(0.6719132979841198), 'Std': np.float64(0.5469695089763431)}
2024-12-06 23:38:27,042 - INFO - Candidate Std Stats: {'Max': np.float64(1.5991332415423585), 'Min': np.float64(0.0), 'Mean': np.float64(0.5396286582310952), 'Std': np.float64(0.332665145300554)}
[I 2024-12-06 23:38:27,056] Trial 392 finished with value: 1.3035714285714286 and parameters: {'x_0_0': 'bd', 'x_0_1': 'ad', 'x_1_0': 'ab', 'x_1_1': 'oo'}. Best is trial 76 with value: 0.5.
2024-12-06 23:38:27,100 - INFO - Candidate Mean Stats: {'Max': np.float64(3.758087929843981), 'Min': np.float64(-0.5863737927085055), 'Mean': np.float64(0.7688814307599156), 'Std': np.float64(0.5661372300225792)}
2024-12-06 23:38:27,100 - INFO - Candidate Std Stats: {'Max': np.float64(1.3366365587911349), 'Min': np.float64(0.0), 'Mean': np.float64(0.4414620091182367), 'Std': np.float64(0.27747013845270585)}
[I 2024-12-06 23:38:27,114] Trial 392 finished with value: 1.0 and parameters: {'x_0_0': 'bd', 'x_0_1': 'cd', 'x_1_0': 'bc', 'x_1_1': 'ad'}. Best is trial 165 with value: 0.5.
2024-12-06 23:38:27,144 - INFO - Candidate Mean Stats: {'Max': np.float64(2.8425189852584887), 'Min': np.float64(-0.7727640422837172), 'Mean': np.float64(0.7221226560025645), 'Std': np.float64(0.5543121507948087)}
2024-12-06 23:38:27,144 - INFO - Candidate Std Stats: {'Max': np.float64(1.6019511852936483), 'Min': np.float64(0.0), 'Mean': np.float64(0.5472655958065877), 'Std': np.float64(0.34055687301658405)}
[I 2024-12-06 23:38:27,159] Trial 392 finished with value: 1.0357142857142856 and parameters: {'x_0_0': 'ac', 'x_0_1': 'ac', 'x_1_0': 'oo', 'x_1_1': 'ad'}. Best is trial 63 with value: 0.5.
2024-12-06 23:38:27,165 - INFO - Candidate Mean Stats: {'Max': np.float64(3.3293388059163034), 'Min': np.float64(-0.44564419255148513), 'Mean': np.float64(0.8530608296787333), 'Std': np.float64(0.4227235144415002)}
2024-12-06 23:38:27,165 - INFO - Candidate Std Stats: {'Max': np.float64(1.6714985753199496), 'Min': np.float64(0.0), 'Mean': np.float64(0.3843201538699391), 'Std': np.float64(0.26293469321932395)}
[I 2024-12-06 23:38:27,179] Trial 390 finished with value: 1.0714285714285714 and parameters: {'x_0_0': 'ad', 'x_0_1': 'oo', 'x_1_0': 'cd', 'x_1_1': 'ad'}. Best is trial 23 with value: 0.5.
2024-12-06 23:38:27,428 - INFO - Candidate Mean Stats: {'Max': np.float64(2.9167606180362364), 'Min': np.float64(-0.5772610097489655), 'Mean': np.float64(0.7260731744442211), 'Std': np.float64(0.5375042135394947)}
2024-12-06 23:38:27,428 - INFO - Candidate Std Stats: {'Max': np.float64(1.5511273359279028), 'Min': np.float64(0.0), 'Mean': np.float64(0.5053930071365702), 'Std': np.float64(0.321037170751126)}
[I 2024-12-06 23:38:27,443] Trial 393 finished with value: 1.1964285714285714 and parameters: {'x_0_0': 'ac', 'x_0_1': 'cd', 'x_1_0': 'oo', 'x_1_1': 'oo'}. Best is trial 76 with value: 0.5.
2024-12-06 23:38:27,488 - INFO - Candidate Mean Stats: {'Max': np.float64(3.0194759315906174), 'Min': np.float64(-0.583401304493468), 'Mean': np.float64(0.7255453342630875), 'Std': np.float64(0.5519374848615296)}
2024-12-06 23:38:27,488 - INFO - Candidate Std Stats: {'Max': np.float64(1.4303419123846333), 'Min': np.float64(0.0), 'Mean': np.float64(0.5192241080787849), 'Std': np.float64(0.31016898598195364)}
[I 2024-12-06 23:38:27,503] Trial 393 finished with value: 1.1607142857142856 and parameters: {'x_0_0': 'ac', 'x_0_1': 'ac', 'x_1_0': 'cd', 'x_1_1': 'oo'}. Best is trial 165 with value: 0.5.
2024-12-06 23:38:27,534 - INFO - Candidate Mean Stats: {'Max': np.float64(2.8710866985729084), 'Min': np.float64(-0.7097778113575091), 'Mean': np.float64(0.744208475498958), 'Std': np.float64(0.5621534598113428)}
2024-12-06 23:38:27,534 - INFO - Candidate Std Stats: {'Max': np.float64(1.4230715549131625), 'Min': np.float64(0.0), 'Mean': np.float64(0.4983169984466907), 'Std': np.float64(0.2926985245161293)}
[I 2024-12-06 23:38:27,548] Trial 393 finished with value: 1.0714285714285714 and parameters: {'x_0_0': 'ac', 'x_0_1': 'oo', 'x_1_0': 'ad', 'x_1_1': 'ab'}. Best is trial 63 with value: 0.5.
2024-12-06 23:38:27,557 - INFO - Candidate Mean Stats: {'Max': np.float64(3.034114417208497), 'Min': np.float64(-0.5354936705429129), 'Mean': np.float64(0.8432358467167896), 'Std': np.float64(0.48047784775763164)}
2024-12-06 23:38:27,557 - INFO - Candidate Std Stats: {'Max': np.float64(1.3692783615081738), 'Min': np.float64(0.0), 'Mean': np.float64(0.43482439661560324), 'Std': np.float64(0.2722689248247565)}
[I 2024-12-06 23:38:27,571] Trial 391 finished with value: 1.3214285714285714 and parameters: {'x_0_0': 'ad', 'x_0_1': 'bd', 'x_1_0': 'oo', 'x_1_1': 'ad'}. Best is trial 23 with value: 0.5.
2024-12-06 23:38:27,817 - INFO - Candidate Mean Stats: {'Max': np.float64(2.8507807794304534), 'Min': np.float64(-0.5621806637783824), 'Mean': np.float64(0.7658927719715822), 'Std': np.float64(0.4981785304912158)}
2024-12-06 23:38:27,817 - INFO - Candidate Std Stats: {'Max': np.float64(1.8253039704240641), 'Min': np.float64(0.0), 'Mean': np.float64(0.5144063039054737), 'Std': np.float64(0.3277985746850865)}
[I 2024-12-06 23:38:27,832] Trial 394 finished with value: 1.375 and parameters: {'x_0_0': 'cd', 'x_0_1': 'oo', 'x_1_0': 'cd', 'x_1_1': 'oo'}. Best is trial 76 with value: 0.5.
2024-12-06 23:38:27,879 - INFO - Candidate Mean Stats: {'Max': np.float64(2.8505307956565455), 'Min': np.float64(-1.1020877888244662), 'Mean': np.float64(0.607545331009929), 'Std': np.float64(0.6524829717852697)}
2024-12-06 23:38:27,879 - INFO - Candidate Std Stats: {'Max': np.float64(1.9807856135140913), 'Min': np.float64(0.0), 'Mean': np.float64(0.6680265417046137), 'Std': np.float64(0.4172459137360732)}
[I 2024-12-06 23:38:27,893] Trial 394 finished with value: 1.2857142857142856 and parameters: {'x_0_0': 'bc', 'x_0_1': 'ac', 'x_1_0': 'bd', 'x_1_1': 'ad'}. Best is trial 165 with value: 0.5.
2024-12-06 23:38:27,923 - INFO - Candidate Mean Stats: {'Max': np.float64(3.0937021984376307), 'Min': np.float64(-0.8491019360725763), 'Mean': np.float64(0.7623099763841066), 'Std': np.float64(0.5441294124365083)}
2024-12-06 23:38:27,924 - INFO - Candidate Std Stats: {'Max': np.float64(1.5870926922729582), 'Min': np.float64(0.0), 'Mean': np.float64(0.49712580386559835), 'Std': np.float64(0.3043991264835498)}
[I 2024-12-06 23:38:27,939] Trial 394 finished with value: 1.1607142857142856 and parameters: {'x_0_0': 'ac', 'x_0_1': 'ac', 'x_1_0': 'bd', 'x_1_1': 'oo'}. Best is trial 63 with value: 0.5.
2024-12-06 23:38:27,947 - INFO - Candidate Mean Stats: {'Max': np.float64(3.3944262509522636), 'Min': np.float64(-0.48847297688332175), 'Mean': np.float64(0.7354536292948332), 'Std': np.float64(0.5170824630282668)}
2024-12-06 23:38:27,947 - INFO - Candidate Std Stats: {'Max': np.float64(1.4734676366344246), 'Min': np.float64(0.0), 'Mean': np.float64(0.481443143020689), 'Std': np.float64(0.3014071377315977)}
[I 2024-12-06 23:38:27,960] Trial 392 finished with value: 1.3214285714285714 and parameters: {'x_0_0': 'bc', 'x_0_1': 'cd', 'x_1_0': 'oo', 'x_1_1': 'bc'}. Best is trial 23 with value: 0.5.
2024-12-06 23:38:28,204 - INFO - Candidate Mean Stats: {'Max': np.float64(3.3148955524659107), 'Min': np.float64(-0.7493106195228084), 'Mean': np.float64(0.7151521416093016), 'Std': np.float64(0.5619252342390066)}
2024-12-06 23:38:28,204 - INFO - Candidate Std Stats: {'Max': np.float64(1.3811260498870968), 'Min': np.float64(0.0), 'Mean': np.float64(0.4761458976501885), 'Std': np.float64(0.28615422248971567)}
[I 2024-12-06 23:38:28,219] Trial 395 finished with value: 0.8928571428571428 and parameters: {'x_0_0': 'bc', 'x_0_1': 'ad', 'x_1_0': 'oo', 'x_1_1': 'ab'}. Best is trial 76 with value: 0.5.
2024-12-06 23:38:28,267 - INFO - Candidate Mean Stats: {'Max': np.float64(3.7219008603033017), 'Min': np.float64(-0.655676340512509), 'Mean': np.float64(0.7480338572137272), 'Std': np.float64(0.545573722883071)}
2024-12-06 23:38:28,267 - INFO - Candidate Std Stats: {'Max': np.float64(2.1173690559953133), 'Min': np.float64(0.0), 'Mean': np.float64(0.5361880374839887), 'Std': np.float64(0.3590893481771886)}
