[I 2024-12-07 00:03:20,180] Trial 61 finished with value: 1.6666666666666665 and parameters: {'x_0_0': 'bc', 'x_0_1': 'bc', 'x_0_2': 'cd', 'x_1_0': 'bc', 'x_1_1': 'ac', 'x_1_2': 'ad'}. Best is trial 22 with value: 1.1666666666666665.
2024-12-07 00:03:22,118 - INFO - Candidate Mean Stats: {'Max': np.float64(2.0), 'Min': np.float64(0.25967338454754746), 'Mean': np.float64(0.4877622519585208), 'Std': np.float64(0.06433775342510088)}
2024-12-07 00:03:22,119 - INFO - Candidate Std Stats: {'Max': np.float64(0.6534269166166183), 'Min': np.float64(0.0), 'Mean': np.float64(0.11112986529156374), 'Std': np.float64(0.046449668331905745)}
[I 2024-12-07 00:03:22,198] Trial 61 finished with value: 1.2333333333333334 and parameters: {'x_0_0': 'bc', 'x_0_1': 'ac', 'x_0_2': 'ab', 'x_1_0': 'ac', 'x_1_1': 'oo', 'x_1_2': 'bd'}. Best is trial 49 with value: 0.7999999999999999.
2024-12-07 00:03:22,779 - INFO - Candidate Mean Stats: {'Max': np.float64(2.0), 'Min': np.float64(0.2460288319317478), 'Mean': np.float64(0.4921505547053788), 'Std': np.float64(0.06246473190111709)}
2024-12-07 00:03:22,780 - INFO - Candidate Std Stats: {'Max': np.float64(0.3689442950073202), 'Min': np.float64(0.0), 'Mean': np.float64(0.10263697536002889), 'Std': np.float64(0.04254879287042635)}
[I 2024-12-07 00:03:22,818] Trial 61 finished with value: 1.6666666666666665 and parameters: {'x_0_0': 'bc', 'x_0_1': 'bd', 'x_0_2': 'cd', 'x_1_0': 'bd', 'x_1_1': 'ab', 'x_1_2': 'cd'}. Best is trial 47 with value: 1.0666666666666667.
2024-12-07 00:03:30,745 - INFO - Candidate Mean Stats: {'Max': np.float64(2.0), 'Min': np.float64(0.2686304613132573), 'Mean': np.float64(0.489320194288086), 'Std': np.float64(0.06220158221262326)}
2024-12-07 00:03:30,746 - INFO - Candidate Std Stats: {'Max': np.float64(0.6434938778157802), 'Min': np.float64(0.0), 'Mean': np.float64(0.10529308412303341), 'Std': np.float64(0.04615567623923786)}
[I 2024-12-07 00:03:30,790] Trial 61 finished with value: 1.4444444444444444 and parameters: {'x_0_0': 'bc', 'x_0_1': 'ac', 'x_0_2': 'bc', 'x_1_0': 'bc', 'x_1_1': 'ad', 'x_1_2': 'ad'}. Best is trial 32 with value: 0.9444444444444444.
2024-12-07 00:03:38,918 - INFO - Candidate Mean Stats: {'Max': np.float64(2.0), 'Min': np.float64(0.2532941263597889), 'Mean': np.float64(0.4894043424768517), 'Std': np.float64(0.061431226851039786)}
2024-12-07 00:03:38,919 - INFO - Candidate Std Stats: {'Max': np.float64(0.4325286718026317), 'Min': np.float64(0.0), 'Mean': np.float64(0.10045249126967908), 'Std': np.float64(0.04018184431355551)}
[I 2024-12-07 00:03:38,963] Trial 62 finished with value: 1.5555555555555556 and parameters: {'x_0_0': 'ad', 'x_0_1': 'bd', 'x_0_2': 'bc', 'x_1_0': 'ab', 'x_1_1': 'ab', 'x_1_2': 'ab'}. Best is trial 22 with value: 1.1666666666666665.
2024-12-07 00:03:40,674 - INFO - Candidate Mean Stats: {'Max': np.float64(2.0), 'Min': np.float64(0.2576655233557859), 'Mean': np.float64(0.4889294377211915), 'Std': np.float64(0.057097597668951276)}
2024-12-07 00:03:40,675 - INFO - Candidate Std Stats: {'Max': np.float64(0.31504055841274714), 'Min': np.float64(0.0), 'Mean': np.float64(0.09869148679129483), 'Std': np.float64(0.03920788688218105)}
[I 2024-12-07 00:03:40,715] Trial 62 finished with value: 1.3777777777777778 and parameters: {'x_0_0': 'ab', 'x_0_1': 'bd', 'x_0_2': 'oo', 'x_1_0': 'oo', 'x_1_1': 'ac', 'x_1_2': 'oo'}. Best is trial 49 with value: 0.7999999999999999.
2024-12-07 00:03:41,798 - INFO - Candidate Mean Stats: {'Max': np.float64(2.0), 'Min': np.float64(0.24761972897005924), 'Mean': np.float64(0.4899806946553793), 'Std': np.float64(0.0667033249143144)}
2024-12-07 00:03:41,799 - INFO - Candidate Std Stats: {'Max': np.float64(0.43665144463152533), 'Min': np.float64(0.0), 'Mean': np.float64(0.1029644629957249), 'Std': np.float64(0.04174333059690048)}
[I 2024-12-07 00:03:41,847] Trial 62 finished with value: 1.2777777777777777 and parameters: {'x_0_0': 'ab', 'x_0_1': 'oo', 'x_0_2': 'cd', 'x_1_0': 'bc', 'x_1_1': 'cd', 'x_1_2': 'oo'}. Best is trial 47 with value: 1.0666666666666667.
2024-12-07 00:03:50,635 - INFO - Candidate Mean Stats: {'Max': np.float64(2.0), 'Min': np.float64(0.25098399891476325), 'Mean': np.float64(0.4926201143243874), 'Std': np.float64(0.05985373824576618)}
2024-12-07 00:03:50,636 - INFO - Candidate Std Stats: {'Max': np.float64(0.423771400526334), 'Min': np.float64(0.0), 'Mean': np.float64(0.10529050246597162), 'Std': np.float64(0.044447222402244795)}
[I 2024-12-07 00:03:50,677] Trial 62 finished with value: 1.0444444444444443 and parameters: {'x_0_0': 'ac', 'x_0_1': 'ac', 'x_0_2': 'bc', 'x_1_0': 'oo', 'x_1_1': 'oo', 'x_1_2': 'oo'}. Best is trial 32 with value: 0.9444444444444444.
2024-12-07 00:04:00,294 - INFO - Candidate Mean Stats: {'Max': np.float64(2.0), 'Min': np.float64(0.2249078903257621), 'Mean': np.float64(0.4927485997152955), 'Std': np.float64(0.06530680067908913)}
2024-12-07 00:04:00,295 - INFO - Candidate Std Stats: {'Max': np.float64(0.6769016948899582), 'Min': np.float64(0.0), 'Mean': np.float64(0.11243120683524617), 'Std': np.float64(0.05250737330816272)}
[I 2024-12-07 00:04:00,337] Trial 63 finished with value: 1.1222222222222222 and parameters: {'x_0_0': 'ac', 'x_0_1': 'ac', 'x_0_2': 'ac', 'x_1_0': 'ad', 'x_1_1': 'oo', 'x_1_2': 'bd'}. Best is trial 63 with value: 1.1222222222222222.
2024-12-07 00:04:02,063 - INFO - Candidate Mean Stats: {'Max': np.float64(2.0), 'Min': np.float64(0.27341543227072646), 'Mean': np.float64(0.47867661272258655), 'Std': np.float64(0.060617919010838815)}
2024-12-07 00:04:02,064 - INFO - Candidate Std Stats: {'Max': np.float64(0.9613058905434715), 'Min': np.float64(0.0), 'Mean': np.float64(0.09546465630292471), 'Std': np.float64(0.04281698537478606)}
[I 2024-12-07 00:04:02,107] Trial 63 finished with value: 1.5666666666666667 and parameters: {'x_0_0': 'bc', 'x_0_1': 'bc', 'x_0_2': 'ac', 'x_1_0': 'bc', 'x_1_1': 'bd', 'x_1_2': 'oo'}. Best is trial 49 with value: 0.7999999999999999.
2024-12-07 00:04:03,265 - INFO - Candidate Mean Stats: {'Max': np.float64(2.0), 'Min': np.float64(0.22776593642974968), 'Mean': np.float64(0.4900704716848098), 'Std': np.float64(0.0626221252717433)}
2024-12-07 00:04:03,266 - INFO - Candidate Std Stats: {'Max': np.float64(0.3475298651433153), 'Min': np.float64(0.0), 'Mean': np.float64(0.10558774238414494), 'Std': np.float64(0.04240577882945371)}
[I 2024-12-07 00:04:03,307] Trial 63 finished with value: 1.4 and parameters: {'x_0_0': 'oo', 'x_0_1': 'oo', 'x_0_2': 'ad', 'x_1_0': 'bd', 'x_1_1': 'bd', 'x_1_2': 'oo'}. Best is trial 47 with value: 1.0666666666666667.
2024-12-07 00:04:11,554 - INFO - Candidate Mean Stats: {'Max': np.float64(2.0), 'Min': np.float64(0.2637843870427669), 'Mean': np.float64(0.4808449536755128), 'Std': np.float64(0.06471284124243921)}
2024-12-07 00:04:11,555 - INFO - Candidate Std Stats: {'Max': np.float64(0.5194272981928029), 'Min': np.float64(0.0), 'Mean': np.float64(0.10315022183386473), 'Std': np.float64(0.04481992236543465)}
[I 2024-12-07 00:04:11,595] Trial 63 finished with value: 2.0 and parameters: {'x_0_0': 'cd', 'x_0_1': 'ad', 'x_0_2': 'ad', 'x_1_0': 'ac', 'x_1_1': 'ad', 'x_1_2': 'ac'}. Best is trial 32 with value: 0.9444444444444444.
2024-12-07 00:04:20,714 - INFO - Candidate Mean Stats: {'Max': np.float64(2.0), 'Min': np.float64(0.2485766080135427), 'Mean': np.float64(0.48700633131391274), 'Std': np.float64(0.06895857265093361)}
2024-12-07 00:04:20,716 - INFO - Candidate Std Stats: {'Max': np.float64(1.4166067313620379), 'Min': np.float64(0.0), 'Mean': np.float64(0.11374945189847076), 'Std': np.float64(0.058809416904324424)}
[I 2024-12-07 00:04:20,759] Trial 64 finished with value: 1.5555555555555556 and parameters: {'x_0_0': 'ad', 'x_0_1': 'cd', 'x_0_2': 'ad', 'x_1_0': 'ab', 'x_1_1': 'ad', 'x_1_2': 'bc'}. Best is trial 63 with value: 1.1222222222222222.
2024-12-07 00:04:22,295 - INFO - Candidate Mean Stats: {'Max': np.float64(2.0), 'Min': np.float64(0.25371210514198794), 'Mean': np.float64(0.4947865834259665), 'Std': np.float64(0.05977329718228108)}
2024-12-07 00:04:22,296 - INFO - Candidate Std Stats: {'Max': np.float64(0.6915759040936963), 'Min': np.float64(0.0), 'Mean': np.float64(0.10585905404108256), 'Std': np.float64(0.04440545986215644)}
[I 2024-12-07 00:04:22,338] Trial 64 finished with value: 1.3444444444444446 and parameters: {'x_0_0': 'bc', 'x_0_1': 'ad', 'x_0_2': 'cd', 'x_1_0': 'bc', 'x_1_1': 'cd', 'x_1_2': 'oo'}. Best is trial 49 with value: 0.7999999999999999.
2024-12-07 00:04:24,043 - INFO - Candidate Mean Stats: {'Max': np.float64(2.0), 'Min': np.float64(0.2396986341582922), 'Mean': np.float64(0.4852323128336219), 'Std': np.float64(0.06832353896075323)}
2024-12-07 00:04:24,044 - INFO - Candidate Std Stats: {'Max': np.float64(0.6482975116829255), 'Min': np.float64(0.0), 'Mean': np.float64(0.1145885491639728), 'Std': np.float64(0.051116327235132424)}
[I 2024-12-07 00:04:24,088] Trial 64 finished with value: 1.7 and parameters: {'x_0_0': 'oo', 'x_0_1': 'ac', 'x_0_2': 'cd', 'x_1_0': 'oo', 'x_1_1': 'bd', 'x_1_2': 'ab'}. Best is trial 47 with value: 1.0666666666666667.
2024-12-07 00:04:32,309 - INFO - Candidate Mean Stats: {'Max': np.float64(2.0), 'Min': np.float64(0.2619924351930975), 'Mean': np.float64(0.4883804980532012), 'Std': np.float64(0.06331591362328663)}
2024-12-07 00:04:32,309 - INFO - Candidate Std Stats: {'Max': np.float64(0.4868468155916025), 'Min': np.float64(0.0), 'Mean': np.float64(0.11159904606395114), 'Std': np.float64(0.04555662846071442)}
[I 2024-12-07 00:04:32,352] Trial 64 finished with value: 1.2444444444444445 and parameters: {'x_0_0': 'ac', 'x_0_1': 'ad', 'x_0_2': 'oo', 'x_1_0': 'ab', 'x_1_1': 'oo', 'x_1_2': 'ad'}. Best is trial 32 with value: 0.9444444444444444.
2024-12-07 00:04:42,199 - INFO - Candidate Mean Stats: {'Max': np.float64(2.0), 'Min': np.float64(0.21119962977346168), 'Mean': np.float64(0.48266062944351873), 'Std': np.float64(0.07045246790742869)}
2024-12-07 00:04:42,199 - INFO - Candidate Std Stats: {'Max': np.float64(0.9660895930138225), 'Min': np.float64(0.0), 'Mean': np.float64(0.1141394099531393), 'Std': np.float64(0.06112605532826806)}
[I 2024-12-07 00:04:42,245] Trial 65 finished with value: 1.4666666666666666 and parameters: {'x_0_0': 'bc', 'x_0_1': 'cd', 'x_0_2': 'oo', 'x_1_0': 'bc', 'x_1_1': 'ab', 'x_1_2': 'oo'}. Best is trial 63 with value: 1.1222222222222222.
2024-12-07 00:04:43,558 - INFO - Candidate Mean Stats: {'Max': np.float64(2.0), 'Min': np.float64(0.32047340387135054), 'Mean': np.float64(0.5003537297080211), 'Std': np.float64(0.06105776996477977)}
2024-12-07 00:04:43,558 - INFO - Candidate Std Stats: {'Max': np.float64(0.4511201873747667), 'Min': np.float64(0.0), 'Mean': np.float64(0.1081736670367724), 'Std': np.float64(0.04363664574873464)}
[I 2024-12-07 00:04:43,603] Trial 65 finished with value: 1.6666666666666665 and parameters: {'x_0_0': 'ac', 'x_0_1': 'bd', 'x_0_2': 'ad', 'x_1_0': 'ab', 'x_1_1': 'ac', 'x_1_2': 'ac'}. Best is trial 49 with value: 0.7999999999999999.
2024-12-07 00:04:45,603 - INFO - Candidate Mean Stats: {'Max': np.float64(2.0), 'Min': np.float64(0.2303355799275975), 'Mean': np.float64(0.49511375158873017), 'Std': np.float64(0.06538923211968944)}
2024-12-07 00:04:45,603 - INFO - Candidate Std Stats: {'Max': np.float64(0.3507073862111737), 'Min': np.float64(0.0), 'Mean': np.float64(0.1002891494325623), 'Std': np.float64(0.04123829675108373)}
[I 2024-12-07 00:04:45,646] Trial 65 finished with value: 1.6666666666666665 and parameters: {'x_0_0': 'bd', 'x_0_1': 'ad', 'x_0_2': 'ad', 'x_1_0': 'ad', 'x_1_1': 'bc', 'x_1_2': 'bd'}. Best is trial 47 with value: 1.0666666666666667.
2024-12-07 00:04:54,013 - INFO - Candidate Mean Stats: {'Max': np.float64(2.0), 'Min': np.float64(0.24387856452798648), 'Mean': np.float64(0.4906771806092969), 'Std': np.float64(0.056513996258796904)}
2024-12-07 00:04:54,013 - INFO - Candidate Std Stats: {'Max': np.float64(0.34184237487041264), 'Min': np.float64(0.0), 'Mean': np.float64(0.09966668748161958), 'Std': np.float64(0.04045861976269306)}
[I 2024-12-07 00:04:54,058] Trial 65 finished with value: 1.0222222222222221 and parameters: {'x_0_0': 'bc', 'x_0_1': 'ad', 'x_0_2': 'cd', 'x_1_0': 'oo', 'x_1_1': 'bd', 'x_1_2': 'bc'}. Best is trial 32 with value: 0.9444444444444444.
2024-12-07 00:05:03,525 - INFO - Candidate Mean Stats: {'Max': np.float64(2.0), 'Min': np.float64(0.2577400762912315), 'Mean': np.float64(0.4879140609920729), 'Std': np.float64(0.062727569685687)}
2024-12-07 00:05:03,525 - INFO - Candidate Std Stats: {'Max': np.float64(0.5545779954400103), 'Min': np.float64(0.0), 'Mean': np.float64(0.10513338890784997), 'Std': np.float64(0.044075184480328294)}
[I 2024-12-07 00:05:03,569] Trial 66 finished with value: 1.7999999999999998 and parameters: {'x_0_0': 'oo', 'x_0_1': 'ac', 'x_0_2': 'ad', 'x_1_0': 'cd', 'x_1_1': 'oo', 'x_1_2': 'cd'}. Best is trial 63 with value: 1.1222222222222222.
2024-12-07 00:05:05,108 - INFO - Candidate Mean Stats: {'Max': np.float64(2.0), 'Min': np.float64(0.23903080865398638), 'Mean': np.float64(0.49771666128660647), 'Std': np.float64(0.06127837072480439)}
2024-12-07 00:05:05,108 - INFO - Candidate Std Stats: {'Max': np.float64(1.6853283407397195), 'Min': np.float64(0.0), 'Mean': np.float64(0.104440796868177), 'Std': np.float64(0.04895303307323127)}
[I 2024-12-07 00:05:05,164] Trial 66 finished with value: 1.6666666666666665 and parameters: {'x_0_0': 'bd', 'x_0_1': 'cd', 'x_0_2': 'bd', 'x_1_0': 'cd', 'x_1_1': 'ab', 'x_1_2': 'cd'}. Best is trial 49 with value: 0.7999999999999999.
2024-12-07 00:05:07,743 - INFO - Candidate Mean Stats: {'Max': np.float64(2.0), 'Min': np.float64(0.24994953845143844), 'Mean': np.float64(0.4855131983914706), 'Std': np.float64(0.06430565739730221)}
2024-12-07 00:05:07,743 - INFO - Candidate Std Stats: {'Max': np.float64(1.209483716034427), 'Min': np.float64(0.0), 'Mean': np.float64(0.1055233097387921), 'Std': np.float64(0.04746155130556512)}
[I 2024-12-07 00:05:07,788] Trial 66 finished with value: 1.5666666666666667 and parameters: {'x_0_0': 'bd', 'x_0_1': 'ac', 'x_0_2': 'bc', 'x_1_0': 'ad', 'x_1_1': 'oo', 'x_1_2': 'ab'}. Best is trial 47 with value: 1.0666666666666667.
2024-12-07 00:05:16,743 - INFO - Candidate Mean Stats: {'Max': np.float64(2.0), 'Min': np.float64(0.23069498899662957), 'Mean': np.float64(0.4957073553119735), 'Std': np.float64(0.061338330541313206)}
2024-12-07 00:05:16,744 - INFO - Candidate Std Stats: {'Max': np.float64(0.5084052704652152), 'Min': np.float64(0.0), 'Mean': np.float64(0.10101176652396188), 'Std': np.float64(0.0430595700878813)}
[I 2024-12-07 00:05:16,790] Trial 66 finished with value: 1.1666666666666665 and parameters: {'x_0_0': 'ac', 'x_0_1': 'oo', 'x_0_2': 'bc', 'x_1_0': 'bd', 'x_1_1': 'ac', 'x_1_2': 'oo'}. Best is trial 32 with value: 0.9444444444444444.
2024-12-07 00:05:27,258 - INFO - Candidate Mean Stats: {'Max': np.float64(2.0), 'Min': np.float64(0.31900018247364365), 'Mean': np.float64(0.49514961782842387), 'Std': np.float64(0.05556413430591227)}
2024-12-07 00:05:27,259 - INFO - Candidate Std Stats: {'Max': np.float64(0.5064800497348373), 'Min': np.float64(0.0), 'Mean': np.float64(0.10417020960351259), 'Std': np.float64(0.04246139136365355)}
[I 2024-12-07 00:05:27,311] Trial 67 finished with value: 1.6666666666666665 and parameters: {'x_0_0': 'ac', 'x_0_1': 'bd', 'x_0_2': 'cd', 'x_1_0': 'bc', 'x_1_1': 'bd', 'x_1_2': 'bc'}. Best is trial 63 with value: 1.1222222222222222.
2024-12-07 00:05:29,001 - INFO - Candidate Mean Stats: {'Max': np.float64(2.0), 'Min': np.float64(0.28827855078506415), 'Mean': np.float64(0.4876470916995913), 'Std': np.float64(0.060481257305065324)}
2024-12-07 00:05:29,002 - INFO - Candidate Std Stats: {'Max': np.float64(0.4357405966069945), 'Min': np.float64(0.0), 'Mean': np.float64(0.10139948121847342), 'Std': np.float64(0.04107213830388107)}
[I 2024-12-07 00:05:29,048] Trial 67 finished with value: 1.3444444444444443 and parameters: {'x_0_0': 'bd', 'x_0_1': 'ab', 'x_0_2': 'oo', 'x_1_0': 'bc', 'x_1_1': 'bd', 'x_1_2': 'ad'}. Best is trial 49 with value: 0.7999999999999999.
2024-12-07 00:05:31,706 - INFO - Candidate Mean Stats: {'Max': np.float64(2.0), 'Min': np.float64(0.22035714516917676), 'Mean': np.float64(0.4877830011621405), 'Std': np.float64(0.06210530783130307)}
2024-12-07 00:05:31,707 - INFO - Candidate Std Stats: {'Max': np.float64(1.6683365756259316), 'Min': np.float64(0.0), 'Mean': np.float64(0.10766920291771953), 'Std': np.float64(0.04772436795776197)}
[I 2024-12-07 00:05:31,752] Trial 67 finished with value: 1.0222222222222221 and parameters: {'x_0_0': 'bc', 'x_0_1': 'ac', 'x_0_2': 'ad', 'x_1_0': 'oo', 'x_1_1': 'bd', 'x_1_2': 'ad'}. Best is trial 67 with value: 1.0222222222222221.
2024-12-07 00:05:40,979 - INFO - Candidate Mean Stats: {'Max': np.float64(2.0), 'Min': np.float64(0.28636667785875036), 'Mean': np.float64(0.4973946499571205), 'Std': np.float64(0.0589668475982424)}
2024-12-07 00:05:40,980 - INFO - Candidate Std Stats: {'Max': np.float64(0.9309874766950657), 'Min': np.float64(0.0), 'Mean': np.float64(0.10552845916207314), 'Std': np.float64(0.050326385630671856)}
[I 2024-12-07 00:05:41,025] Trial 67 finished with value: 1.9 and parameters: {'x_0_0': 'cd', 'x_0_1': 'bd', 'x_0_2': 'bc', 'x_1_0': 'ac', 'x_1_1': 'cd', 'x_1_2': 'oo'}. Best is trial 32 with value: 0.9444444444444444.
2024-12-07 00:05:50,716 - INFO - Candidate Mean Stats: {'Max': np.float64(2.0), 'Min': np.float64(0.2535937439577699), 'Mean': np.float64(0.49445963608513727), 'Std': np.float64(0.059845828541850214)}
2024-12-07 00:05:50,717 - INFO - Candidate Std Stats: {'Max': np.float64(0.358786405559717), 'Min': np.float64(0.0), 'Mean': np.float64(0.1033759807999238), 'Std': np.float64(0.0411206840093081)}
[I 2024-12-07 00:05:50,764] Trial 68 finished with value: 1.8 and parameters: {'x_0_0': 'oo', 'x_0_1': 'bd', 'x_0_2': 'oo', 'x_1_0': 'ab', 'x_1_1': 'cd', 'x_1_2': 'bd'}. Best is trial 63 with value: 1.1222222222222222.
2024-12-07 00:05:52,803 - INFO - Candidate Mean Stats: {'Max': np.float64(2.0), 'Min': np.float64(0.26700600376496525), 'Mean': np.float64(0.5006766242975937), 'Std': np.float64(0.06298627949770477)}
2024-12-07 00:05:52,803 - INFO - Candidate Std Stats: {'Max': np.float64(0.3612781725694207), 'Min': np.float64(0.0), 'Mean': np.float64(0.10208211406159654), 'Std': np.float64(0.043597480148320156)}
[I 2024-12-07 00:05:52,853] Trial 68 finished with value: 1.6777777777777776 and parameters: {'x_0_0': 'ab', 'x_0_1': 'bd', 'x_0_2': 'oo', 'x_1_0': 'ab', 'x_1_1': 'bd', 'x_1_2': 'ac'}. Best is trial 49 with value: 0.7999999999999999.
2024-12-07 00:05:55,249 - INFO - Candidate Mean Stats: {'Max': np.float64(2.0), 'Min': np.float64(0.2379166912197676), 'Mean': np.float64(0.48133895551532907), 'Std': np.float64(0.0704373749026139)}
2024-12-07 00:05:55,249 - INFO - Candidate Std Stats: {'Max': np.float64(0.985275102786536), 'Min': np.float64(0.0), 'Mean': np.float64(0.10884740536841142), 'Std': np.float64(0.04966435973217437)}
[I 2024-12-07 00:05:55,313] Trial 68 finished with value: 1.2666666666666666 and parameters: {'x_0_0': 'bc', 'x_0_1': 'oo', 'x_0_2': 'ab', 'x_1_0': 'bc', 'x_1_1': 'ac', 'x_1_2': 'bc'}. Best is trial 67 with value: 1.0222222222222221.
2024-12-07 00:06:04,801 - INFO - Candidate Mean Stats: {'Max': np.float64(2.0), 'Min': np.float64(0.2878875576745573), 'Mean': np.float64(0.4814727411377013), 'Std': np.float64(0.06511930795364983)}
2024-12-07 00:06:04,802 - INFO - Candidate Std Stats: {'Max': np.float64(1.17604199187307), 'Min': np.float64(0.0), 'Mean': np.float64(0.11105905095173275), 'Std': np.float64(0.053757144947117745)}
[I 2024-12-07 00:06:04,851] Trial 68 finished with value: 1.5555555555555556 and parameters: {'x_0_0': 'bd', 'x_0_1': 'ad', 'x_0_2': 'ab', 'x_1_0': 'ab', 'x_1_1': 'bd', 'x_1_2': 'cd'}. Best is trial 32 with value: 0.9444444444444444.
2024-12-07 00:06:15,581 - INFO - Candidate Mean Stats: {'Max': np.float64(2.0), 'Min': np.float64(0.27385698276527864), 'Mean': np.float64(0.48279497248530534), 'Std': np.float64(0.06311973349701311)}
2024-12-07 00:06:15,581 - INFO - Candidate Std Stats: {'Max': np.float64(0.48742123824639616), 'Min': np.float64(0.0), 'Mean': np.float64(0.1048879445493687), 'Std': np.float64(0.04398707665675562)}
[I 2024-12-07 00:06:15,625] Trial 69 finished with value: 1.1666666666666665 and parameters: {'x_0_0': 'ac', 'x_0_1': 'oo', 'x_0_2': 'ac', 'x_1_0': 'cd', 'x_1_1': 'ab', 'x_1_2': 'oo'}. Best is trial 63 with value: 1.1222222222222222.
2024-12-07 00:06:17,565 - INFO - Candidate Mean Stats: {'Max': np.float64(2.0), 'Min': np.float64(0.30220412962053145), 'Mean': np.float64(0.48232083472702686), 'Std': np.float64(0.0574753231379338)}
2024-12-07 00:06:17,566 - INFO - Candidate Std Stats: {'Max': np.float64(0.3584934209137117), 'Min': np.float64(0.0), 'Mean': np.float64(0.10345866134984617), 'Std': np.float64(0.040681667121054615)}
[I 2024-12-07 00:06:17,611] Trial 69 finished with value: 1.2222222222222223 and parameters: {'x_0_0': 'ac', 'x_0_1': 'ac', 'x_0_2': 'ac', 'x_1_0': 'bd', 'x_1_1': 'cd', 'x_1_2': 'bc'}. Best is trial 49 with value: 0.7999999999999999.
2024-12-07 00:06:20,184 - INFO - Candidate Mean Stats: {'Max': np.float64(2.0), 'Min': np.float64(0.2388787838882831), 'Mean': np.float64(0.4852806349944269), 'Std': np.float64(0.07080729419062719)}
2024-12-07 00:06:20,184 - INFO - Candidate Std Stats: {'Max': np.float64(0.717609225353196), 'Min': np.float64(0.0), 'Mean': np.float64(0.11614329381558675), 'Std': np.float64(0.05231346374691317)}
