[I 2024-12-06 23:38:42,417] Trial 431 finished with value: 1.3214285714285714 and parameters: {'x_0_0': 'bd', 'x_0_1': 'ab', 'x_1_0': 'oo', 'x_1_1': 'ad'}. Best is trial 165 with value: 0.5.
2024-12-06 23:38:42,467 - INFO - Candidate Mean Stats: {'Max': np.float64(2.7090303215306486), 'Min': np.float64(-0.41247839896411875), 'Mean': np.float64(0.7937166742797104), 'Std': np.float64(0.5360778735548494)}
2024-12-06 23:38:42,467 - INFO - Candidate Std Stats: {'Max': np.float64(1.405249177245717), 'Min': np.float64(0.0), 'Mean': np.float64(0.43642107164843197), 'Std': np.float64(0.2736289086005063)}
[I 2024-12-06 23:38:42,481] Trial 431 finished with value: 1.3214285714285714 and parameters: {'x_0_0': 'ac', 'x_0_1': 'cd', 'x_1_0': 'oo', 'x_1_1': 'ad'}. Best is trial 63 with value: 0.5.
2024-12-06 23:38:42,564 - INFO - Candidate Mean Stats: {'Max': np.float64(2.8384972647149826), 'Min': np.float64(-0.5753614499201571), 'Mean': np.float64(0.8579153663616086), 'Std': np.float64(0.42991861512150326)}
2024-12-06 23:38:42,564 - INFO - Candidate Std Stats: {'Max': np.float64(1.5674336302172773), 'Min': np.float64(0.0), 'Mean': np.float64(0.40764828258792113), 'Std': np.float64(0.2790533556192398)}
[I 2024-12-06 23:38:42,578] Trial 429 finished with value: 1.5 and parameters: {'x_0_0': 'cd', 'x_0_1': 'oo', 'x_1_0': 'cd', 'x_1_1': 'bc'}. Best is trial 23 with value: 0.5.
2024-12-06 23:38:42,738 - INFO - Candidate Mean Stats: {'Max': np.float64(3.0219347476451714), 'Min': np.float64(-0.7431518263236266), 'Mean': np.float64(0.8059056060984315), 'Std': np.float64(0.5399553620676291)}
2024-12-06 23:38:42,738 - INFO - Candidate Std Stats: {'Max': np.float64(1.3400232094960671), 'Min': np.float64(0.0), 'Mean': np.float64(0.4827691420365389), 'Std': np.float64(0.30715943299455106)}
[I 2024-12-06 23:38:42,752] Trial 432 finished with value: 1.0535714285714286 and parameters: {'x_0_0': 'bc', 'x_0_1': 'ab', 'x_1_0': 'oo', 'x_1_1': 'oo'}. Best is trial 76 with value: 0.5.
2024-12-06 23:38:42,797 - INFO - Candidate Mean Stats: {'Max': np.float64(3.723602940410713), 'Min': np.float64(-0.8629097383208476), 'Mean': np.float64(0.761916634794515), 'Std': np.float64(0.5851232610907762)}
2024-12-06 23:38:42,798 - INFO - Candidate Std Stats: {'Max': np.float64(1.52603039428657), 'Min': np.float64(0.0), 'Mean': np.float64(0.5172921969920744), 'Std': np.float64(0.32793596071404424)}
[I 2024-12-06 23:38:42,811] Trial 432 finished with value: 1.3214285714285714 and parameters: {'x_0_0': 'ad', 'x_0_1': 'ad', 'x_1_0': 'oo', 'x_1_1': 'bc'}. Best is trial 165 with value: 0.5.
2024-12-06 23:38:42,860 - INFO - Candidate Mean Stats: {'Max': np.float64(2.9436315564804394), 'Min': np.float64(-0.3656881942599307), 'Mean': np.float64(0.8351039818684123), 'Std': np.float64(0.5115870771762862)}
2024-12-06 23:38:42,860 - INFO - Candidate Std Stats: {'Max': np.float64(1.6100530286870816), 'Min': np.float64(0.0), 'Mean': np.float64(0.4294100063851788), 'Std': np.float64(0.27019889119748985)}
[I 2024-12-06 23:38:42,874] Trial 432 finished with value: 1.2857142857142856 and parameters: {'x_0_0': 'ac', 'x_0_1': 'ac', 'x_1_0': 'ad', 'x_1_1': 'ac'}. Best is trial 63 with value: 0.5.
2024-12-06 23:38:42,962 - INFO - Candidate Mean Stats: {'Max': np.float64(3.3374683783868213), 'Min': np.float64(-0.4290958391386238), 'Mean': np.float64(0.8187539917501446), 'Std': np.float64(0.46418865475683685)}
2024-12-06 23:38:42,962 - INFO - Candidate Std Stats: {'Max': np.float64(1.3762460499656186), 'Min': np.float64(0.0), 'Mean': np.float64(0.3961422928562252), 'Std': np.float64(0.2590427174194381)}
[I 2024-12-06 23:38:42,975] Trial 430 finished with value: 1.1607142857142856 and parameters: {'x_0_0': 'ac', 'x_0_1': 'ac', 'x_1_0': 'bd', 'x_1_1': 'oo'}. Best is trial 23 with value: 0.5.
2024-12-06 23:38:43,128 - INFO - Candidate Mean Stats: {'Max': np.float64(3.0445742743143605), 'Min': np.float64(-0.4167888674589035), 'Mean': np.float64(0.8865331506483011), 'Std': np.float64(0.5036406747555406)}
2024-12-06 23:38:43,128 - INFO - Candidate Std Stats: {'Max': np.float64(1.6775939267391913), 'Min': np.float64(0.0), 'Mean': np.float64(0.4452801949988975), 'Std': np.float64(0.2876001011399247)}
[I 2024-12-06 23:38:43,142] Trial 433 finished with value: 1.2857142857142856 and parameters: {'x_0_0': 'bc', 'x_0_1': 'ac', 'x_1_0': 'bd', 'x_1_1': 'ac'}. Best is trial 76 with value: 0.5.
2024-12-06 23:38:43,191 - INFO - Candidate Mean Stats: {'Max': np.float64(2.873286704764751), 'Min': np.float64(-0.7439960447212444), 'Mean': np.float64(0.7071029492939135), 'Std': np.float64(0.5632366436594666)}
2024-12-06 23:38:43,191 - INFO - Candidate Std Stats: {'Max': np.float64(1.8602892755922547), 'Min': np.float64(0.0), 'Mean': np.float64(0.5337868009487838), 'Std': np.float64(0.3529950161540917)}
[I 2024-12-06 23:38:43,205] Trial 433 finished with value: 1.5714285714285714 and parameters: {'x_0_0': 'bd', 'x_0_1': 'bc', 'x_1_0': 'ac', 'x_1_1': 'ab'}. Best is trial 165 with value: 0.5.
2024-12-06 23:38:43,255 - INFO - Candidate Mean Stats: {'Max': np.float64(3.3747385102998835), 'Min': np.float64(-0.6316803903660777), 'Mean': np.float64(0.8075143168202772), 'Std': np.float64(0.5245314082911144)}
2024-12-06 23:38:43,255 - INFO - Candidate Std Stats: {'Max': np.float64(1.334625457462812), 'Min': np.float64(0.0), 'Mean': np.float64(0.430143891312974), 'Std': np.float64(0.2773197332392572)}
[I 2024-12-06 23:38:43,268] Trial 433 finished with value: 1.1607142857142856 and parameters: {'x_0_0': 'ad', 'x_0_1': 'cd', 'x_1_0': 'bd', 'x_1_1': 'oo'}. Best is trial 63 with value: 0.5.
2024-12-06 23:38:43,357 - INFO - Candidate Mean Stats: {'Max': np.float64(3.466517603580221), 'Min': np.float64(-0.43232782599814196), 'Mean': np.float64(0.824457321383155), 'Std': np.float64(0.49193777547381684)}
2024-12-06 23:38:43,358 - INFO - Candidate Std Stats: {'Max': np.float64(1.472017523520369), 'Min': np.float64(0.0), 'Mean': np.float64(0.4297958007063272), 'Std': np.float64(0.2725177902588438)}
[I 2024-12-06 23:38:43,372] Trial 431 finished with value: 0.7857142857142857 and parameters: {'x_0_0': 'ad', 'x_0_1': 'oo', 'x_1_0': 'bc', 'x_1_1': 'bd'}. Best is trial 23 with value: 0.5.
2024-12-06 23:38:43,522 - INFO - Candidate Mean Stats: {'Max': np.float64(2.938076176976486), 'Min': np.float64(-0.3362767308962633), 'Mean': np.float64(0.8404809082723431), 'Std': np.float64(0.4775589588729008)}
2024-12-06 23:38:43,522 - INFO - Candidate Std Stats: {'Max': np.float64(1.507768455368491), 'Min': np.float64(0.0), 'Mean': np.float64(0.4385258789128839), 'Std': np.float64(0.28210979391024943)}
[I 2024-12-06 23:38:43,536] Trial 434 finished with value: 1.2142857142857144 and parameters: {'x_0_0': 'ab', 'x_0_1': 'oo', 'x_1_0': 'ac', 'x_1_1': 'bc'}. Best is trial 76 with value: 0.5.
2024-12-06 23:38:43,582 - INFO - Candidate Mean Stats: {'Max': np.float64(2.879151573789743), 'Min': np.float64(-0.7872550800074384), 'Mean': np.float64(0.7838737952116481), 'Std': np.float64(0.5434708525536429)}
2024-12-06 23:38:43,583 - INFO - Candidate Std Stats: {'Max': np.float64(1.7231027910899785), 'Min': np.float64(0.0), 'Mean': np.float64(0.4667830419828886), 'Std': np.float64(0.3028319557361133)}
[I 2024-12-06 23:38:43,597] Trial 434 finished with value: 1.4464285714285714 and parameters: {'x_0_0': 'bd', 'x_0_1': 'ad', 'x_1_0': 'ad', 'x_1_1': 'oo'}. Best is trial 165 with value: 0.5.
2024-12-06 23:38:43,646 - INFO - Candidate Mean Stats: {'Max': np.float64(3.238939234071708), 'Min': np.float64(-0.34320857327387544), 'Mean': np.float64(0.8257982236551201), 'Std': np.float64(0.5020654255244367)}
2024-12-06 23:38:43,646 - INFO - Candidate Std Stats: {'Max': np.float64(1.4208754732233595), 'Min': np.float64(0.0), 'Mean': np.float64(0.43168657107970254), 'Std': np.float64(0.2755354447766518)}
[I 2024-12-06 23:38:43,660] Trial 434 finished with value: 1.2857142857142856 and parameters: {'x_0_0': 'ac', 'x_0_1': 'ac', 'x_1_0': 'bc', 'x_1_1': 'bc'}. Best is trial 63 with value: 0.5.
2024-12-06 23:38:43,755 - INFO - Candidate Mean Stats: {'Max': np.float64(2.7945955439998102), 'Min': np.float64(-0.3831135215233103), 'Mean': np.float64(0.8587468786793466), 'Std': np.float64(0.47076180145560936)}
2024-12-06 23:38:43,755 - INFO - Candidate Std Stats: {'Max': np.float64(1.2555522145181335), 'Min': np.float64(0.0), 'Mean': np.float64(0.4056015828008571), 'Std': np.float64(0.2545293498916527)}
[I 2024-12-06 23:38:43,769] Trial 432 finished with value: 1.0714285714285714 and parameters: {'x_0_0': 'bc', 'x_0_1': 'oo', 'x_1_0': 'bd', 'x_1_1': 'bd'}. Best is trial 23 with value: 0.5.
2024-12-06 23:38:43,913 - INFO - Candidate Mean Stats: {'Max': np.float64(3.4992695482963163), 'Min': np.float64(-0.8104564184268874), 'Mean': np.float64(0.7873888336752346), 'Std': np.float64(0.5592478217836946)}
2024-12-06 23:38:43,913 - INFO - Candidate Std Stats: {'Max': np.float64(1.909628483577275), 'Min': np.float64(0.0), 'Mean': np.float64(0.504905943677389), 'Std': np.float64(0.33456199130880887)}
[I 2024-12-06 23:38:43,928] Trial 435 finished with value: 1.3214285714285714 and parameters: {'x_0_0': 'bd', 'x_0_1': 'cd', 'x_1_0': 'oo', 'x_1_1': 'cd'}. Best is trial 76 with value: 0.5.
2024-12-06 23:38:43,977 - INFO - Candidate Mean Stats: {'Max': np.float64(3.035184369360576), 'Min': np.float64(-0.29712530378215074), 'Mean': np.float64(0.8171141439855162), 'Std': np.float64(0.43270384540279927)}
2024-12-06 23:38:43,977 - INFO - Candidate Std Stats: {'Max': np.float64(1.4081139316787743), 'Min': np.float64(0.0), 'Mean': np.float64(0.4339600741957316), 'Std': np.float64(0.27921695629978704)}
[I 2024-12-06 23:38:43,992] Trial 435 finished with value: 1.5 and parameters: {'x_0_0': 'cd', 'x_0_1': 'oo', 'x_1_0': 'ab', 'x_1_1': 'cd'}. Best is trial 165 with value: 0.5.
2024-12-06 23:38:44,038 - INFO - Candidate Mean Stats: {'Max': np.float64(3.139767044639762), 'Min': np.float64(-0.37241320807294337), 'Mean': np.float64(0.8060958355510995), 'Std': np.float64(0.4552984813255197)}
2024-12-06 23:38:44,038 - INFO - Candidate Std Stats: {'Max': np.float64(1.9138453718981463), 'Min': np.float64(0.0), 'Mean': np.float64(0.43259033976076766), 'Std': np.float64(0.2998120099137188)}
[I 2024-12-06 23:38:44,052] Trial 435 finished with value: 1.0714285714285714 and parameters: {'x_0_0': 'bc', 'x_0_1': 'oo', 'x_1_0': 'ad', 'x_1_1': 'ab'}. Best is trial 63 with value: 0.5.
2024-12-06 23:38:44,154 - INFO - Candidate Mean Stats: {'Max': np.float64(3.0188345800136336), 'Min': np.float64(-0.31516593763603973), 'Mean': np.float64(0.831054070487995), 'Std': np.float64(0.4584130028343015)}
2024-12-06 23:38:44,154 - INFO - Candidate Std Stats: {'Max': np.float64(1.442005859405494), 'Min': np.float64(0.0), 'Mean': np.float64(0.446448362903087), 'Std': np.float64(0.2766746063872662)}
[I 2024-12-06 23:38:44,169] Trial 433 finished with value: 1.3214285714285714 and parameters: {'x_0_0': 'bc', 'x_0_1': 'bd', 'x_1_0': 'oo', 'x_1_1': 'bc'}. Best is trial 23 with value: 0.5.
2024-12-06 23:38:44,313 - INFO - Candidate Mean Stats: {'Max': np.float64(3.0958544127588743), 'Min': np.float64(-0.6485611382387626), 'Mean': np.float64(0.7997114595661434), 'Std': np.float64(0.5123511828321827)}
2024-12-06 23:38:44,313 - INFO - Candidate Std Stats: {'Max': np.float64(1.3785319499011377), 'Min': np.float64(0.0), 'Mean': np.float64(0.41345799348038953), 'Std': np.float64(0.2620424887972541)}
[I 2024-12-06 23:38:44,328] Trial 436 finished with value: 1.2142857142857144 and parameters: {'x_0_0': 'ab', 'x_0_1': 'oo', 'x_1_0': 'ab', 'x_1_1': 'cd'}. Best is trial 76 with value: 0.5.
2024-12-06 23:38:44,372 - INFO - Candidate Mean Stats: {'Max': np.float64(2.7550021696371454), 'Min': np.float64(-0.39972191796438616), 'Mean': np.float64(0.8512456155503483), 'Std': np.float64(0.4681588763505439)}
2024-12-06 23:38:44,372 - INFO - Candidate Std Stats: {'Max': np.float64(1.613448890500797), 'Min': np.float64(0.0), 'Mean': np.float64(0.4108586578696855), 'Std': np.float64(0.28225896013358326)}
[I 2024-12-06 23:38:44,387] Trial 436 finished with value: 1.5 and parameters: {'x_0_0': 'cd', 'x_0_1': 'oo', 'x_1_0': 'bd', 'x_1_1': 'ac'}. Best is trial 165 with value: 0.5.
2024-12-06 23:38:44,431 - INFO - Candidate Mean Stats: {'Max': np.float64(2.7129367576070234), 'Min': np.float64(-0.506918488848031), 'Mean': np.float64(0.8218971399437105), 'Std': np.float64(0.5186405565375821)}
2024-12-06 23:38:44,431 - INFO - Candidate Std Stats: {'Max': np.float64(1.3928024655620674), 'Min': np.float64(0.0), 'Mean': np.float64(0.4549948348434665), 'Std': np.float64(0.2838142136336485)}
[I 2024-12-06 23:38:44,446] Trial 436 finished with value: 1.1964285714285714 and parameters: {'x_0_0': 'bc', 'x_0_1': 'cd', 'x_1_0': 'oo', 'x_1_1': 'oo'}. Best is trial 63 with value: 0.5.
2024-12-06 23:38:44,550 - INFO - Candidate Mean Stats: {'Max': np.float64(2.7719079969016898), 'Min': np.float64(-0.7331692413119404), 'Mean': np.float64(0.8142417212757643), 'Std': np.float64(0.541070197565122)}
2024-12-06 23:38:44,550 - INFO - Candidate Std Stats: {'Max': np.float64(1.556946450687815), 'Min': np.float64(0.0), 'Mean': np.float64(0.4678434075187896), 'Std': np.float64(0.2976984548587701)}
[I 2024-12-06 23:38:44,565] Trial 434 finished with value: 1.2142857142857144 and parameters: {'x_0_0': 'ab', 'x_0_1': 'oo', 'x_1_0': 'bc', 'x_1_1': 'ac'}. Best is trial 23 with value: 0.5.
2024-12-06 23:38:44,708 - INFO - Candidate Mean Stats: {'Max': np.float64(3.1654452438720826), 'Min': np.float64(-0.8252244476026179), 'Mean': np.float64(0.7843008198227498), 'Std': np.float64(0.5517501354213885)}
2024-12-06 23:38:44,709 - INFO - Candidate Std Stats: {'Max': np.float64(1.4699869362984452), 'Min': np.float64(0.0), 'Mean': np.float64(0.4676881500292432), 'Std': np.float64(0.2978529787222167)}
[I 2024-12-06 23:38:44,723] Trial 437 finished with value: 1.2857142857142856 and parameters: {'x_0_0': 'ad', 'x_0_1': 'ac', 'x_1_0': 'bd', 'x_1_1': 'ab'}. Best is trial 76 with value: 0.5.
2024-12-06 23:38:44,769 - INFO - Candidate Mean Stats: {'Max': np.float64(3.1103016715012957), 'Min': np.float64(-0.4299991242928637), 'Mean': np.float64(0.7734658103315545), 'Std': np.float64(0.5326556564801048)}
2024-12-06 23:38:44,769 - INFO - Candidate Std Stats: {'Max': np.float64(1.3978008859500677), 'Min': np.float64(0.0), 'Mean': np.float64(0.46795050332579285), 'Std': np.float64(0.3026353740039783)}
[I 2024-12-06 23:38:44,783] Trial 437 finished with value: 1.1607142857142856 and parameters: {'x_0_0': 'ac', 'x_0_1': 'ad', 'x_1_0': 'bd', 'x_1_1': 'oo'}. Best is trial 165 with value: 0.5.
2024-12-06 23:38:44,828 - INFO - Candidate Mean Stats: {'Max': np.float64(3.0080960605328917), 'Min': np.float64(-0.2729239057621704), 'Mean': np.float64(0.8660833358870609), 'Std': np.float64(0.4589147604421853)}
2024-12-06 23:38:44,829 - INFO - Candidate Std Stats: {'Max': np.float64(1.3966479133059333), 'Min': np.float64(0.0), 'Mean': np.float64(0.44144127100296343), 'Std': np.float64(0.2850182549331384)}
[I 2024-12-06 23:38:44,843] Trial 437 finished with value: 1.375 and parameters: {'x_0_0': 'oo', 'x_0_1': 'oo', 'x_1_0': 'ab', 'x_1_1': 'bc'}. Best is trial 63 with value: 0.5.
2024-12-06 23:38:44,948 - INFO - Candidate Mean Stats: {'Max': np.float64(3.1729512725627296), 'Min': np.float64(-0.11494994374223681), 'Mean': np.float64(0.8555086438508464), 'Std': np.float64(0.45564301638850885)}
2024-12-06 23:38:44,948 - INFO - Candidate Std Stats: {'Max': np.float64(1.5545916325169469), 'Min': np.float64(0.0), 'Mean': np.float64(0.3850105819192387), 'Std': np.float64(0.2503970820156568)}
[I 2024-12-06 23:38:44,962] Trial 435 finished with value: 1.0 and parameters: {'x_0_0': 'ac', 'x_0_1': 'ad', 'x_1_0': 'ac', 'x_1_1': 'bc'}. Best is trial 23 with value: 0.5.
2024-12-06 23:38:45,100 - INFO - Candidate Mean Stats: {'Max': np.float64(3.119436332341683), 'Min': np.float64(-0.8160339345351317), 'Mean': np.float64(0.7293720015908552), 'Std': np.float64(0.5645704575987962)}
2024-12-06 23:38:45,100 - INFO - Candidate Std Stats: {'Max': np.float64(1.6820537725893316), 'Min': np.float64(0.0), 'Mean': np.float64(0.5296827839570951), 'Std': np.float64(0.3368965934558556)}
[I 2024-12-06 23:38:45,116] Trial 438 finished with value: 1.3214285714285714 and parameters: {'x_0_0': 'ad', 'x_0_1': 'ac', 'x_1_0': 'oo', 'x_1_1': 'bc'}. Best is trial 76 with value: 0.5.
2024-12-06 23:38:45,163 - INFO - Candidate Mean Stats: {'Max': np.float64(3.1523021057449645), 'Min': np.float64(-0.7389189544925359), 'Mean': np.float64(0.7744384023305926), 'Std': np.float64(0.5381835392447812)}
2024-12-06 23:38:45,163 - INFO - Candidate Std Stats: {'Max': np.float64(1.675191540118069), 'Min': np.float64(0.0), 'Mean': np.float64(0.4553151006443088), 'Std': np.float64(0.30202204990861575)}
[I 2024-12-06 23:38:45,177] Trial 438 finished with value: 1.1607142857142856 and parameters: {'x_0_0': 'ac', 'x_0_1': 'ad', 'x_1_0': 'ad', 'x_1_1': 'oo'}. Best is trial 165 with value: 0.5.
2024-12-06 23:38:45,223 - INFO - Candidate Mean Stats: {'Max': np.float64(3.1250652093583455), 'Min': np.float64(-0.6575382512655851), 'Mean': np.float64(0.7731617404903984), 'Std': np.float64(0.5005538187516181)}
2024-12-06 23:38:45,224 - INFO - Candidate Std Stats: {'Max': np.float64(1.7199532371519894), 'Min': np.float64(0.0), 'Mean': np.float64(0.4727662555647382), 'Std': np.float64(0.3039903956498478)}
[I 2024-12-06 23:38:45,238] Trial 438 finished with value: 1.1964285714285714 and parameters: {'x_0_0': 'bd', 'x_0_1': 'ab', 'x_1_0': 'oo', 'x_1_1': 'oo'}. Best is trial 63 with value: 0.5.
2024-12-06 23:38:45,346 - INFO - Candidate Mean Stats: {'Max': np.float64(3.115037189472842), 'Min': np.float64(-0.4854676598348295), 'Mean': np.float64(0.800042386159024), 'Std': np.float64(0.5247711117716429)}
2024-12-06 23:38:45,346 - INFO - Candidate Std Stats: {'Max': np.float64(1.4740277826604484), 'Min': np.float64(0.0), 'Mean': np.float64(0.44208576369606095), 'Std': np.float64(0.288112145390484)}
[I 2024-12-06 23:38:45,360] Trial 436 finished with value: 1.1785714285714286 and parameters: {'x_0_0': 'bc', 'x_0_1': 'ab', 'x_1_0': 'oo', 'x_1_1': 'cd'}. Best is trial 23 with value: 0.5.
2024-12-06 23:38:45,495 - INFO - Candidate Mean Stats: {'Max': np.float64(3.4787963417276186), 'Min': np.float64(-0.4143707308318678), 'Mean': np.float64(0.8515737757874714), 'Std': np.float64(0.49974918286638703)}
2024-12-06 23:38:45,495 - INFO - Candidate Std Stats: {'Max': np.float64(1.5718701887439672), 'Min': np.float64(0.0), 'Mean': np.float64(0.4193507019383095), 'Std': np.float64(0.27055109142261957)}
[I 2024-12-06 23:38:45,510] Trial 439 finished with value: 1.5 and parameters: {'x_0_0': 'cd', 'x_0_1': 'oo', 'x_1_0': 'ab', 'x_1_1': 'bd'}. Best is trial 76 with value: 0.5.
2024-12-06 23:38:45,559 - INFO - Candidate Mean Stats: {'Max': np.float64(2.925468654328492), 'Min': np.float64(-0.5815160162713982), 'Mean': np.float64(0.8148186894186392), 'Std': np.float64(0.5302391936017562)}
2024-12-06 23:38:45,559 - INFO - Candidate Std Stats: {'Max': np.float64(1.6343926898511347), 'Min': np.float64(0.0), 'Mean': np.float64(0.4846982032920196), 'Std': np.float64(0.3103492499920187)}
[I 2024-12-06 23:38:45,573] Trial 439 finished with value: 1.4464285714285714 and parameters: {'x_0_0': 'bd', 'x_0_1': 'ac', 'x_1_0': 'cd', 'x_1_1': 'oo'}. Best is trial 165 with value: 0.5.
2024-12-06 23:38:45,621 - INFO - Candidate Mean Stats: {'Max': np.float64(3.5145518887895846), 'Min': np.float64(-0.3381072680600735), 'Mean': np.float64(0.8469690099973213), 'Std': np.float64(0.4757596351013335)}
2024-12-06 23:38:45,621 - INFO - Candidate Std Stats: {'Max': np.float64(1.6598755552834354), 'Min': np.float64(0.0), 'Mean': np.float64(0.4190901525588233), 'Std': np.float64(0.2768055654665535)}
[I 2024-12-06 23:38:45,636] Trial 439 finished with value: 1.2857142857142856 and parameters: {'x_0_0': 'bd', 'x_0_1': 'ac', 'x_1_0': 'bd', 'x_1_1': 'bc'}. Best is trial 63 with value: 0.5.
2024-12-06 23:38:45,743 - INFO - Candidate Mean Stats: {'Max': np.float64(3.2075042596993564), 'Min': np.float64(-0.4762047659057894), 'Mean': np.float64(0.8027990994576883), 'Std': np.float64(0.5472411909152362)}
2024-12-06 23:38:45,743 - INFO - Candidate Std Stats: {'Max': np.float64(1.643477501000045), 'Min': np.float64(0.0), 'Mean': np.float64(0.42972833633349106), 'Std': np.float64(0.2824766457441555)}
[I 2024-12-06 23:38:45,758] Trial 437 finished with value: 1.3214285714285714 and parameters: {'x_0_0': 'ad', 'x_0_1': 'bd', 'x_1_0': 'oo', 'x_1_1': 'bd'}. Best is trial 23 with value: 0.5.
2024-12-06 23:38:45,890 - INFO - Candidate Mean Stats: {'Max': np.float64(3.420332024743535), 'Min': np.float64(-0.6411313479230976), 'Mean': np.float64(0.829710713196698), 'Std': np.float64(0.5245298854599079)}
2024-12-06 23:38:45,890 - INFO - Candidate Std Stats: {'Max': np.float64(1.7128896617419336), 'Min': np.float64(0.0), 'Mean': np.float64(0.49045933580162276), 'Std': np.float64(0.32999317460699995)}
[I 2024-12-06 23:38:45,905] Trial 440 finished with value: 1.2142857142857144 and parameters: {'x_0_0': 'ab', 'x_0_1': 'oo', 'x_1_0': 'bd', 'x_1_1': 'cd'}. Best is trial 76 with value: 0.5.
2024-12-06 23:38:45,955 - INFO - Candidate Mean Stats: {'Max': np.float64(3.0524033535700412), 'Min': np.float64(-0.5296462454151146), 'Mean': np.float64(0.8110656666584298), 'Std': np.float64(0.5342586279182056)}
2024-12-06 23:38:45,955 - INFO - Candidate Std Stats: {'Max': np.float64(1.7002522665316935), 'Min': np.float64(0.0), 'Mean': np.float64(0.4768927831991351), 'Std': np.float64(0.31706379232356147)}
