[I 2024-12-06 23:36:56,720] Trial 150 finished with value: 1.3214285714285714 and parameters: {'x_0_0': 'ac', 'x_0_1': 'bc', 'x_1_0': 'oo', 'x_1_1': 'bc'}. Best is trial 23 with value: 0.5.
2024-12-06 23:36:57,058 - INFO - Candidate Mean Stats: {'Max': np.float64(2.9891349336875463), 'Min': np.float64(-0.9431597939487844), 'Mean': np.float64(0.4307862793042026), 'Std': np.float64(0.5282153642527013)}
2024-12-06 23:36:57,058 - INFO - Candidate Std Stats: {'Max': np.float64(1.6675306441060886), 'Min': np.float64(0.0), 'Mean': np.float64(0.5772908692785119), 'Std': np.float64(0.2860957982058429)}
2024-12-06 23:36:57,066 - INFO - Candidate Mean Stats: {'Max': np.float64(2.465279074033517), 'Min': np.float64(-1.2654847160900944), 'Mean': np.float64(0.3877024336782792), 'Std': np.float64(0.5277333886199111)}
2024-12-06 23:36:57,066 - INFO - Candidate Std Stats: {'Max': np.float64(2.0755134041799534), 'Min': np.float64(0.0), 'Mean': np.float64(0.5871450069589962), 'Std': np.float64(0.30245238752185033)}
[I 2024-12-06 23:36:57,072] Trial 152 finished with value: 0.8214285714285714 and parameters: {'x_0_0': 'ad', 'x_0_1': 'oo', 'x_1_0': 'oo', 'x_1_1': 'cd'}. Best is trial 50 with value: 0.6607142857142857.
2024-12-06 23:36:57,083 - INFO - Candidate Mean Stats: {'Max': np.float64(3.2189109864845356), 'Min': np.float64(-1.4249273043619546), 'Mean': np.float64(0.33343540434056135), 'Std': np.float64(0.6246369547184768)}
2024-12-06 23:36:57,083 - INFO - Candidate Std Stats: {'Max': np.float64(1.7787201773508736), 'Min': np.float64(0.0), 'Mean': np.float64(0.6495580692826826), 'Std': np.float64(0.2986625461482816)}
[I 2024-12-06 23:36:57,083] Trial 152 finished with value: 1.2857142857142856 and parameters: {'x_0_0': 'bd', 'x_0_1': 'bc', 'x_1_0': 'bd', 'x_1_1': 'bc'}. Best is trial 63 with value: 0.5.
[I 2024-12-06 23:36:57,096] Trial 152 finished with value: 0.7857142857142857 and parameters: {'x_0_0': 'ad', 'x_0_1': 'oo', 'x_1_0': 'bc', 'x_1_1': 'cd'}. Best is trial 76 with value: 0.5.
2024-12-06 23:36:57,118 - INFO - Candidate Mean Stats: {'Max': np.float64(2.5870228273163547), 'Min': np.float64(-0.9419275609031713), 'Mean': np.float64(0.47093488360305064), 'Std': np.float64(0.5450659595959223)}
2024-12-06 23:36:57,118 - INFO - Candidate Std Stats: {'Max': np.float64(1.6162162003293123), 'Min': np.float64(0.0), 'Mean': np.float64(0.5443943202961324), 'Std': np.float64(0.2611065470900133)}
[I 2024-12-06 23:36:57,134] Trial 151 finished with value: 0.9464285714285714 and parameters: {'x_0_0': 'bc', 'x_0_1': 'oo', 'x_1_0': 'ad', 'x_1_1': 'oo'}. Best is trial 23 with value: 0.5.
2024-12-06 23:36:57,447 - INFO - Candidate Mean Stats: {'Max': np.float64(2.636040617279428), 'Min': np.float64(-1.2272616784877954), 'Mean': np.float64(0.37256829392500257), 'Std': np.float64(0.6209065974642668)}
2024-12-06 23:36:57,447 - INFO - Candidate Std Stats: {'Max': np.float64(1.6480766729256207), 'Min': np.float64(0.0), 'Mean': np.float64(0.6193026769927326), 'Std': np.float64(0.295785313975332)}
2024-12-06 23:36:57,457 - INFO - Candidate Mean Stats: {'Max': np.float64(2.832589256760595), 'Min': np.float64(-0.9669318082806987), 'Mean': np.float64(0.46035745736812084), 'Std': np.float64(0.5339335427011822)}
2024-12-06 23:36:57,457 - INFO - Candidate Std Stats: {'Max': np.float64(1.7004239454017722), 'Min': np.float64(0.0), 'Mean': np.float64(0.5650869743225589), 'Std': np.float64(0.266757707478146)}
[I 2024-12-06 23:36:57,461] Trial 153 finished with value: 0.9285714285714286 and parameters: {'x_0_0': 'bd', 'x_0_1': 'oo', 'x_1_0': 'ab', 'x_1_1': 'ab'}. Best is trial 50 with value: 0.6607142857142857.
2024-12-06 23:36:57,468 - INFO - Candidate Mean Stats: {'Max': np.float64(2.990736210484953), 'Min': np.float64(-1.065587857868445), 'Mean': np.float64(0.434892558525366), 'Std': np.float64(0.5576165362649466)}
2024-12-06 23:36:57,468 - INFO - Candidate Std Stats: {'Max': np.float64(1.7634127999955813), 'Min': np.float64(0.0), 'Mean': np.float64(0.6503355296367408), 'Std': np.float64(0.3197546880536021)}
[I 2024-12-06 23:36:57,471] Trial 153 finished with value: 0.9464285714285714 and parameters: {'x_0_0': 'bd', 'x_0_1': 'oo', 'x_1_0': 'ac', 'x_1_1': 'oo'}. Best is trial 63 with value: 0.5.
[I 2024-12-06 23:36:57,482] Trial 153 finished with value: 1.2142857142857144 and parameters: {'x_0_0': 'ab', 'x_0_1': 'oo', 'x_1_0': 'bc', 'x_1_1': 'ac'}. Best is trial 76 with value: 0.5.
2024-12-06 23:36:57,526 - INFO - Candidate Mean Stats: {'Max': np.float64(2.6915896791446134), 'Min': np.float64(-1.2801047854447216), 'Mean': np.float64(0.37382879932385554), 'Std': np.float64(0.5798731713786747)}
2024-12-06 23:36:57,527 - INFO - Candidate Std Stats: {'Max': np.float64(1.6157712128043453), 'Min': np.float64(0.0), 'Mean': np.float64(0.6509199516605297), 'Std': np.float64(0.3084386541816901)}
[I 2024-12-06 23:36:57,543] Trial 152 finished with value: 1.0 and parameters: {'x_0_0': 'bd', 'x_0_1': 'bd', 'x_1_0': 'bc', 'x_1_1': 'ac'}. Best is trial 23 with value: 0.5.
2024-12-06 23:36:57,829 - INFO - Candidate Mean Stats: {'Max': np.float64(2.7526664109033314), 'Min': np.float64(-0.7380692436794623), 'Mean': np.float64(0.4323755610811702), 'Std': np.float64(0.5284675683921495)}
2024-12-06 23:36:57,829 - INFO - Candidate Std Stats: {'Max': np.float64(1.5246231020366998), 'Min': np.float64(0.0), 'Mean': np.float64(0.5725415503218466), 'Std': np.float64(0.2680432245512642)}
2024-12-06 23:36:57,836 - INFO - Candidate Mean Stats: {'Max': np.float64(2.3350322244535286), 'Min': np.float64(-1.0384587039847855), 'Mean': np.float64(0.41889670403193724), 'Std': np.float64(0.514807585338677)}
2024-12-06 23:36:57,837 - INFO - Candidate Std Stats: {'Max': np.float64(1.5579070122430827), 'Min': np.float64(0.0), 'Mean': np.float64(0.531232253001309), 'Std': np.float64(0.2589566892675421)}
[I 2024-12-06 23:36:57,845] Trial 154 finished with value: 1.5714285714285714 and parameters: {'x_0_0': 'ac', 'x_0_1': 'bc', 'x_1_0': 'cd', 'x_1_1': 'bc'}. Best is trial 50 with value: 0.6607142857142857.
2024-12-06 23:36:57,847 - INFO - Candidate Mean Stats: {'Max': np.float64(2.621738850797275), 'Min': np.float64(-1.1757836384307485), 'Mean': np.float64(0.3629040499805342), 'Std': np.float64(0.583245941294057)}
2024-12-06 23:36:57,847 - INFO - Candidate Std Stats: {'Max': np.float64(1.9443114927034206), 'Min': np.float64(0.0), 'Mean': np.float64(0.6852836277286967), 'Std': np.float64(0.34858807243413586)}
[I 2024-12-06 23:36:57,853] Trial 154 finished with value: 1.0714285714285714 and parameters: {'x_0_0': 'ad', 'x_0_1': 'oo', 'x_1_0': 'cd', 'x_1_1': 'ad'}. Best is trial 63 with value: 0.5.
[I 2024-12-06 23:36:57,862] Trial 154 finished with value: 0.7857142857142857 and parameters: {'x_0_0': 'bd', 'x_0_1': 'oo', 'x_1_0': 'bd', 'x_1_1': 'bc'}. Best is trial 76 with value: 0.5.
2024-12-06 23:36:57,909 - INFO - Candidate Mean Stats: {'Max': np.float64(2.6693545972340678), 'Min': np.float64(-1.1048766226344402), 'Mean': np.float64(0.3852704373603937), 'Std': np.float64(0.5530645840596541)}
2024-12-06 23:36:57,909 - INFO - Candidate Std Stats: {'Max': np.float64(2.0753302241096594), 'Min': np.float64(0.0), 'Mean': np.float64(0.636224083818637), 'Std': np.float64(0.3089989991838789)}
[I 2024-12-06 23:36:57,925] Trial 153 finished with value: 0.9464285714285714 and parameters: {'x_0_0': 'ac', 'x_0_1': 'oo', 'x_1_0': 'ad', 'x_1_1': 'oo'}. Best is trial 23 with value: 0.5.
2024-12-06 23:36:58,204 - INFO - Candidate Mean Stats: {'Max': np.float64(2.3873244795879898), 'Min': np.float64(-1.042864815105799), 'Mean': np.float64(0.3990552442821624), 'Std': np.float64(0.5407482208597486)}
2024-12-06 23:36:58,204 - INFO - Candidate Std Stats: {'Max': np.float64(1.6408706777810902), 'Min': np.float64(0.0), 'Mean': np.float64(0.6342679913061564), 'Std': np.float64(0.29087713649734454)}
[I 2024-12-06 23:36:58,217] Trial 155 finished with value: 1.0714285714285714 and parameters: {'x_0_0': 'bc', 'x_0_1': 'oo', 'x_1_0': 'ab', 'x_1_1': 'bc'}. Best is trial 50 with value: 0.6607142857142857.
2024-12-06 23:36:58,217 - INFO - Candidate Mean Stats: {'Max': np.float64(2.19414802690091), 'Min': np.float64(-0.8676935484439845), 'Mean': np.float64(0.4772179873455403), 'Std': np.float64(0.4562820920371087)}
2024-12-06 23:36:58,217 - INFO - Candidate Std Stats: {'Max': np.float64(1.558408945787966), 'Min': np.float64(0.0), 'Mean': np.float64(0.5486941564383431), 'Std': np.float64(0.27241894031950276)}
2024-12-06 23:36:58,221 - INFO - Candidate Mean Stats: {'Max': np.float64(2.9994494719357685), 'Min': np.float64(-1.0482095180442377), 'Mean': np.float64(0.38429844842412625), 'Std': np.float64(0.5926237864627799)}
2024-12-06 23:36:58,221 - INFO - Candidate Std Stats: {'Max': np.float64(1.7307581522539688), 'Min': np.float64(0.0), 'Mean': np.float64(0.6561099091586245), 'Std': np.float64(0.3088562467499819)}
[I 2024-12-06 23:36:58,232] Trial 155 finished with value: 0.8035714285714286 and parameters: {'x_0_0': 'ad', 'x_0_1': 'oo', 'x_1_0': 'ab', 'x_1_1': 'oo'}. Best is trial 63 with value: 0.5.
[I 2024-12-06 23:36:58,235] Trial 155 finished with value: 0.9464285714285714 and parameters: {'x_0_0': 'bc', 'x_0_1': 'oo', 'x_1_0': 'ad', 'x_1_1': 'oo'}. Best is trial 76 with value: 0.5.
2024-12-06 23:36:58,299 - INFO - Candidate Mean Stats: {'Max': np.float64(2.635755068327493), 'Min': np.float64(-1.0085775288117977), 'Mean': np.float64(0.45330782365666905), 'Std': np.float64(0.5636551134140061)}
2024-12-06 23:36:58,299 - INFO - Candidate Std Stats: {'Max': np.float64(1.9868884030184195), 'Min': np.float64(0.0), 'Mean': np.float64(0.6031673136522806), 'Std': np.float64(0.2991022677104382)}
[I 2024-12-06 23:36:58,323] Trial 154 finished with value: 1.0714285714285714 and parameters: {'x_0_0': 'bc', 'x_0_1': 'oo', 'x_1_0': 'bd', 'x_1_1': 'bc'}. Best is trial 23 with value: 0.5.
2024-12-06 23:36:58,684 - INFO - Candidate Mean Stats: {'Max': np.float64(3.0234667289999773), 'Min': np.float64(-1.172838697456483), 'Mean': np.float64(0.4381891454939194), 'Std': np.float64(0.5665919923128185)}
2024-12-06 23:36:58,684 - INFO - Candidate Std Stats: {'Max': np.float64(1.567637879849378), 'Min': np.float64(0.0), 'Mean': np.float64(0.5720529603439666), 'Std': np.float64(0.26397996919927824)}
[I 2024-12-06 23:36:58,701] Trial 156 finished with value: 0.9285714285714286 and parameters: {'x_0_0': 'bd', 'x_0_1': 'oo', 'x_1_0': 'ab', 'x_1_1': 'bc'}. Best is trial 50 with value: 0.6607142857142857.
2024-12-06 23:36:58,703 - INFO - Candidate Mean Stats: {'Max': np.float64(3.2661370774828304), 'Min': np.float64(-1.0340821837600163), 'Mean': np.float64(0.4422735432811387), 'Std': np.float64(0.5784055871397342)}
2024-12-06 23:36:58,703 - INFO - Candidate Std Stats: {'Max': np.float64(1.8556332966078286), 'Min': np.float64(0.0), 'Mean': np.float64(0.6082577730427806), 'Std': np.float64(0.31150184277219095)}
2024-12-06 23:36:58,715 - INFO - Candidate Mean Stats: {'Max': np.float64(2.5359901017295927), 'Min': np.float64(-1.5709082128601204), 'Mean': np.float64(0.378993184826755), 'Std': np.float64(0.5664344873796501)}
2024-12-06 23:36:58,715 - INFO - Candidate Std Stats: {'Max': np.float64(1.946031383847589), 'Min': np.float64(0.0), 'Mean': np.float64(0.6319350002378992), 'Std': np.float64(0.31012727656750816)}
[I 2024-12-06 23:36:58,718] Trial 156 finished with value: 0.9464285714285714 and parameters: {'x_0_0': 'bc', 'x_0_1': 'oo', 'x_1_0': 'ab', 'x_1_1': 'oo'}. Best is trial 76 with value: 0.5.
[I 2024-12-06 23:36:58,732] Trial 156 finished with value: 0.8214285714285714 and parameters: {'x_0_0': 'bc', 'x_0_1': 'oo', 'x_1_0': 'oo', 'x_1_1': 'ac'}. Best is trial 63 with value: 0.5.
2024-12-06 23:36:58,788 - INFO - Candidate Mean Stats: {'Max': np.float64(2.6802883856259414), 'Min': np.float64(-0.821658567948037), 'Mean': np.float64(0.46609272474175134), 'Std': np.float64(0.5014068387142948)}
2024-12-06 23:36:58,788 - INFO - Candidate Std Stats: {'Max': np.float64(1.6204086438732657), 'Min': np.float64(0.0), 'Mean': np.float64(0.6018807171133216), 'Std': np.float64(0.2806262954190698)}
[I 2024-12-06 23:36:58,805] Trial 155 finished with value: 1.0714285714285714 and parameters: {'x_0_0': 'bc', 'x_0_1': 'oo', 'x_1_0': 'ad', 'x_1_1': 'bc'}. Best is trial 23 with value: 0.5.
2024-12-06 23:36:59,075 - INFO - Candidate Mean Stats: {'Max': np.float64(2.771799269548167), 'Min': np.float64(-1.0020405816035702), 'Mean': np.float64(0.4371262645024576), 'Std': np.float64(0.5244448016157318)}
2024-12-06 23:36:59,075 - INFO - Candidate Std Stats: {'Max': np.float64(1.3839604981429052), 'Min': np.float64(0.0), 'Mean': np.float64(0.568958138193463), 'Std': np.float64(0.2620285589330498)}
[I 2024-12-06 23:36:59,089] Trial 157 finished with value: 1.0714285714285714 and parameters: {'x_0_0': 'bc', 'x_0_1': 'oo', 'x_1_0': 'bc', 'x_1_1': 'ad'}. Best is trial 50 with value: 0.6607142857142857.
2024-12-06 23:36:59,091 - INFO - Candidate Mean Stats: {'Max': np.float64(2.8930948506577034), 'Min': np.float64(-1.4097010552184284), 'Mean': np.float64(0.384860882965492), 'Std': np.float64(0.6073181470804804)}
2024-12-06 23:36:59,091 - INFO - Candidate Std Stats: {'Max': np.float64(1.8354070009636552), 'Min': np.float64(0.0), 'Mean': np.float64(0.6068200846649894), 'Std': np.float64(0.28517744361912567)}
[I 2024-12-06 23:36:59,107] Trial 157 finished with value: 1.0714285714285714 and parameters: {'x_0_0': 'bc', 'x_0_1': 'oo', 'x_1_0': 'ab', 'x_1_1': 'bc'}. Best is trial 76 with value: 0.5.
2024-12-06 23:36:59,109 - INFO - Candidate Mean Stats: {'Max': np.float64(2.935578535080311), 'Min': np.float64(-1.0668922857951046), 'Mean': np.float64(0.42621367317227243), 'Std': np.float64(0.5429223122109176)}
2024-12-06 23:36:59,109 - INFO - Candidate Std Stats: {'Max': np.float64(1.8387386827181513), 'Min': np.float64(0.0), 'Mean': np.float64(0.5868530728185922), 'Std': np.float64(0.27708926465935435)}
[I 2024-12-06 23:36:59,124] Trial 157 finished with value: 1.0714285714285714 and parameters: {'x_0_0': 'bd', 'x_0_1': 'oo', 'x_1_0': 'ad', 'x_1_1': 'ac'}. Best is trial 63 with value: 0.5.
2024-12-06 23:36:59,178 - INFO - Candidate Mean Stats: {'Max': np.float64(2.718964684695041), 'Min': np.float64(-0.8789596835950928), 'Mean': np.float64(0.45160599102783333), 'Std': np.float64(0.570598955199173)}
2024-12-06 23:36:59,178 - INFO - Candidate Std Stats: {'Max': np.float64(1.7047482555671776), 'Min': np.float64(0.0), 'Mean': np.float64(0.6032954422876522), 'Std': np.float64(0.28575200828783814)}
[I 2024-12-06 23:36:59,197] Trial 156 finished with value: 1.3214285714285714 and parameters: {'x_0_0': 'ad', 'x_0_1': 'bd', 'x_1_0': 'oo', 'x_1_1': 'ac'}. Best is trial 23 with value: 0.5.
2024-12-06 23:36:59,485 - INFO - Candidate Mean Stats: {'Max': np.float64(2.9588779629162123), 'Min': np.float64(-1.3692773961779956), 'Mean': np.float64(0.40201655059181296), 'Std': np.float64(0.5870258039053905)}
2024-12-06 23:36:59,485 - INFO - Candidate Std Stats: {'Max': np.float64(1.7523097158955996), 'Min': np.float64(0.0), 'Mean': np.float64(0.5904636937194394), 'Std': np.float64(0.28704406953939937)}
2024-12-06 23:36:59,497 - INFO - Candidate Mean Stats: {'Max': np.float64(3.056357900311899), 'Min': np.float64(-1.9747722676579251), 'Mean': np.float64(0.39046641099498264), 'Std': np.float64(0.6449419894098412)}
2024-12-06 23:36:59,497 - INFO - Candidate Std Stats: {'Max': np.float64(1.6221324467368947), 'Min': np.float64(0.0), 'Mean': np.float64(0.6069639084876262), 'Std': np.float64(0.2941143271088249)}
[I 2024-12-06 23:36:59,499] Trial 158 finished with value: 1.0714285714285714 and parameters: {'x_0_0': 'bd', 'x_0_1': 'oo', 'x_1_0': 'cd', 'x_1_1': 'bd'}. Best is trial 50 with value: 0.6607142857142857.
[I 2024-12-06 23:36:59,512] Trial 158 finished with value: 0.7857142857142857 and parameters: {'x_0_0': 'ad', 'x_0_1': 'oo', 'x_1_0': 'bc', 'x_1_1': 'bc'}. Best is trial 76 with value: 0.5.
2024-12-06 23:36:59,515 - INFO - Candidate Mean Stats: {'Max': np.float64(2.518698184392691), 'Min': np.float64(-1.3678807779940418), 'Mean': np.float64(0.3949462234526584), 'Std': np.float64(0.551044091251699)}
2024-12-06 23:36:59,515 - INFO - Candidate Std Stats: {'Max': np.float64(1.9603684745295111), 'Min': np.float64(0.0), 'Mean': np.float64(0.6169007307926115), 'Std': np.float64(0.31540151253847853)}
[I 2024-12-06 23:36:59,530] Trial 158 finished with value: 1.0714285714285714 and parameters: {'x_0_0': 'ac', 'x_0_1': 'oo', 'x_1_0': 'bc', 'x_1_1': 'cd'}. Best is trial 63 with value: 0.5.
2024-12-06 23:36:59,587 - INFO - Candidate Mean Stats: {'Max': np.float64(2.8060177418365297), 'Min': np.float64(-0.8607886431404704), 'Mean': np.float64(0.44498071295485586), 'Std': np.float64(0.5108843826215176)}
2024-12-06 23:36:59,587 - INFO - Candidate Std Stats: {'Max': np.float64(1.472997236077496), 'Min': np.float64(0.0), 'Mean': np.float64(0.5362443761663301), 'Std': np.float64(0.2712730515628119)}
[I 2024-12-06 23:36:59,600] Trial 157 finished with value: 1.2857142857142856 and parameters: {'x_0_0': 'bd', 'x_0_1': 'bd', 'x_1_0': 'bc', 'x_1_1': 'bd'}. Best is trial 23 with value: 0.5.
2024-12-06 23:36:59,890 - INFO - Candidate Mean Stats: {'Max': np.float64(2.540774712267053), 'Min': np.float64(-0.9140837954699791), 'Mean': np.float64(0.4476471056656828), 'Std': np.float64(0.5107128814413561)}
2024-12-06 23:36:59,891 - INFO - Candidate Std Stats: {'Max': np.float64(1.5232282215254065), 'Min': np.float64(0.0), 'Mean': np.float64(0.5696171161399555), 'Std': np.float64(0.2677567308625444)}
2024-12-06 23:36:59,904 - INFO - Candidate Mean Stats: {'Max': np.float64(2.7684863368512898), 'Min': np.float64(-1.2596763135167426), 'Mean': np.float64(0.3941885682044822), 'Std': np.float64(0.6290372029812681)}
2024-12-06 23:36:59,904 - INFO - Candidate Std Stats: {'Max': np.float64(1.811054840900429), 'Min': np.float64(0.0), 'Mean': np.float64(0.6692731164635345), 'Std': np.float64(0.31467784800161747)}
[I 2024-12-06 23:36:59,905] Trial 159 finished with value: 1.4285714285714286 and parameters: {'x_0_0': 'bd', 'x_0_1': 'cd', 'x_1_0': 'ab', 'x_1_1': 'ab'}. Best is trial 50 with value: 0.6607142857142857.
2024-12-06 23:36:59,914 - INFO - Candidate Mean Stats: {'Max': np.float64(2.894144672223873), 'Min': np.float64(-1.148159095236983), 'Mean': np.float64(0.4289627898489708), 'Std': np.float64(0.5518427252217917)}
2024-12-06 23:36:59,914 - INFO - Candidate Std Stats: {'Max': np.float64(1.465769481184265), 'Min': np.float64(0.0), 'Mean': np.float64(0.5490321136289881), 'Std': np.float64(0.26501648464156147)}
[I 2024-12-06 23:36:59,920] Trial 159 finished with value: 0.7857142857142857 and parameters: {'x_0_0': 'ad', 'x_0_1': 'oo', 'x_1_0': 'bd', 'x_1_1': 'ab'}. Best is trial 76 with value: 0.5.
[I 2024-12-06 23:36:59,928] Trial 159 finished with value: 1.0714285714285714 and parameters: {'x_0_0': 'bc', 'x_0_1': 'oo', 'x_1_0': 'cd', 'x_1_1': 'ab'}. Best is trial 63 with value: 0.5.
2024-12-06 23:36:59,994 - INFO - Candidate Mean Stats: {'Max': np.float64(2.54754071919775), 'Min': np.float64(-1.1292134316049975), 'Mean': np.float64(0.43326236668873264), 'Std': np.float64(0.5474941622139187)}
2024-12-06 23:36:59,994 - INFO - Candidate Std Stats: {'Max': np.float64(1.7446176026330242), 'Min': np.float64(0.0), 'Mean': np.float64(0.6248642559721979), 'Std': np.float64(0.29854680651338394)}
[I 2024-12-06 23:37:00,009] Trial 158 finished with value: 0.9464285714285714 and parameters: {'x_0_0': 'bd', 'x_0_1': 'oo', 'x_1_0': 'cd', 'x_1_1': 'oo'}. Best is trial 23 with value: 0.5.
2024-12-06 23:37:00,258 - INFO - Candidate Mean Stats: {'Max': np.float64(2.790057537651257), 'Min': np.float64(-1.006553589575764), 'Mean': np.float64(0.48618991541745404), 'Std': np.float64(0.5186571122906846)}
2024-12-06 23:37:00,258 - INFO - Candidate Std Stats: {'Max': np.float64(1.5737232826305296), 'Min': np.float64(0.0), 'Mean': np.float64(0.49729282214405074), 'Std': np.float64(0.24539392085992795)}
[I 2024-12-06 23:37:00,271] Trial 160 finished with value: 0.9285714285714286 and parameters: {'x_0_0': 'ad', 'x_0_1': 'oo', 'x_1_0': 'ab', 'x_1_1': 'ab'}. Best is trial 50 with value: 0.6607142857142857.
2024-12-06 23:37:00,276 - INFO - Candidate Mean Stats: {'Max': np.float64(2.8431221062171375), 'Min': np.float64(-1.3139913523809499), 'Mean': np.float64(0.34863269266474145), 'Std': np.float64(0.6445784862442137)}
2024-12-06 23:37:00,276 - INFO - Candidate Std Stats: {'Max': np.float64(1.7598946634004518), 'Min': np.float64(0.0), 'Mean': np.float64(0.6754892229391766), 'Std': np.float64(0.3224327846251306)}
2024-12-06 23:37:00,284 - INFO - Candidate Mean Stats: {'Max': np.float64(2.843965113125274), 'Min': np.float64(-1.1260724007234917), 'Mean': np.float64(0.42733578445357995), 'Std': np.float64(0.5139466933571357)}
2024-12-06 23:37:00,284 - INFO - Candidate Std Stats: {'Max': np.float64(1.7555306138836453), 'Min': np.float64(0.0), 'Mean': np.float64(0.5486736628141978), 'Std': np.float64(0.27513637068732955)}
[I 2024-12-06 23:37:00,290] Trial 160 finished with value: 1.0714285714285714 and parameters: {'x_0_0': 'bc', 'x_0_1': 'oo', 'x_1_0': 'cd', 'x_1_1': 'ad'}. Best is trial 76 with value: 0.5.
[I 2024-12-06 23:37:00,297] Trial 160 finished with value: 0.9464285714285714 and parameters: {'x_0_0': 'bc', 'x_0_1': 'oo', 'x_1_0': 'ac', 'x_1_1': 'oo'}. Best is trial 63 with value: 0.5.
2024-12-06 23:37:00,359 - INFO - Candidate Mean Stats: {'Max': np.float64(3.0243799681771), 'Min': np.float64(-0.9729923775844848), 'Mean': np.float64(0.47934110778450945), 'Std': np.float64(0.5665130166689476)}
2024-12-06 23:37:00,359 - INFO - Candidate Std Stats: {'Max': np.float64(1.5214594728633342), 'Min': np.float64(0.0), 'Mean': np.float64(0.5463592491567718), 'Std': np.float64(0.25528154059801367)}
