[I 2024-12-06 23:38:45,969] Trial 440 finished with value: 1.2142857142857144 and parameters: {'x_0_0': 'ab', 'x_0_1': 'oo', 'x_1_0': 'bd', 'x_1_1': 'ac'}. Best is trial 165 with value: 0.5.
2024-12-06 23:38:46,018 - INFO - Candidate Mean Stats: {'Max': np.float64(2.871770635332888), 'Min': np.float64(-0.6720096587278996), 'Mean': np.float64(0.7587682540001165), 'Std': np.float64(0.5289357056664837)}
2024-12-06 23:38:46,018 - INFO - Candidate Std Stats: {'Max': np.float64(1.5615166494165333), 'Min': np.float64(0.0), 'Mean': np.float64(0.4873950746858839), 'Std': np.float64(0.32049952859281533)}
[I 2024-12-06 23:38:46,033] Trial 440 finished with value: 1.1428571428571428 and parameters: {'x_0_0': 'ad', 'x_0_1': 'ab', 'x_1_0': 'bc', 'x_1_1': 'ab'}. Best is trial 63 with value: 0.5.
2024-12-06 23:38:46,140 - INFO - Candidate Mean Stats: {'Max': np.float64(2.6059395634776577), 'Min': np.float64(-0.4023083026083861), 'Mean': np.float64(0.8814844221753712), 'Std': np.float64(0.4472544515224374)}
2024-12-06 23:38:46,140 - INFO - Candidate Std Stats: {'Max': np.float64(1.5420551794632955), 'Min': np.float64(0.0), 'Mean': np.float64(0.4218138909075609), 'Std': np.float64(0.2719139330995686)}
[I 2024-12-06 23:38:46,153] Trial 438 finished with value: 1.125 and parameters: {'x_0_0': 'oo', 'x_0_1': 'oo', 'x_1_0': 'oo', 'x_1_1': 'bd'}. Best is trial 23 with value: 0.5.
2024-12-06 23:38:46,284 - INFO - Candidate Mean Stats: {'Max': np.float64(3.1665799711466525), 'Min': np.float64(-0.5930254384032005), 'Mean': np.float64(0.8464218684010142), 'Std': np.float64(0.4801505919858687)}
2024-12-06 23:38:46,285 - INFO - Candidate Std Stats: {'Max': np.float64(1.5655789305143137), 'Min': np.float64(0.0), 'Mean': np.float64(0.4362857929096914), 'Std': np.float64(0.2879302216414284)}
[I 2024-12-06 23:38:46,299] Trial 441 finished with value: 1.5 and parameters: {'x_0_0': 'cd', 'x_0_1': 'oo', 'x_1_0': 'bd', 'x_1_1': 'ac'}. Best is trial 76 with value: 0.5.
2024-12-06 23:38:46,350 - INFO - Candidate Mean Stats: {'Max': np.float64(3.649185771667274), 'Min': np.float64(-0.46116045418051177), 'Mean': np.float64(0.7445265305269408), 'Std': np.float64(0.5761201826075167)}
2024-12-06 23:38:46,350 - INFO - Candidate Std Stats: {'Max': np.float64(1.5135834130620613), 'Min': np.float64(0.0), 'Mean': np.float64(0.4905526721964882), 'Std': np.float64(0.3149960097435309)}
[I 2024-12-06 23:38:46,365] Trial 441 finished with value: 1.5714285714285714 and parameters: {'x_0_0': 'bd', 'x_0_1': 'bd', 'x_1_0': 'cd', 'x_1_1': 'cd'}. Best is trial 165 with value: 0.5.
2024-12-06 23:38:46,414 - INFO - Candidate Mean Stats: {'Max': np.float64(3.2624005923274226), 'Min': np.float64(-0.2343106066608917), 'Mean': np.float64(0.8148523592701471), 'Std': np.float64(0.469778173238307)}
2024-12-06 23:38:46,414 - INFO - Candidate Std Stats: {'Max': np.float64(1.6650340700428208), 'Min': np.float64(0.0), 'Mean': np.float64(0.41738567604837545), 'Std': np.float64(0.28487998083521254)}
[I 2024-12-06 23:38:46,428] Trial 441 finished with value: 1.4464285714285714 and parameters: {'x_0_0': 'bd', 'x_0_1': 'ab', 'x_1_0': 'cd', 'x_1_1': 'oo'}. Best is trial 63 with value: 0.5.
2024-12-06 23:38:46,536 - INFO - Candidate Mean Stats: {'Max': np.float64(2.990751620136743), 'Min': np.float64(-0.41516177144933303), 'Mean': np.float64(0.8159740196040298), 'Std': np.float64(0.4762875657105445)}
2024-12-06 23:38:46,536 - INFO - Candidate Std Stats: {'Max': np.float64(1.6004867888281575), 'Min': np.float64(0.0), 'Mean': np.float64(0.44308531806138024), 'Std': np.float64(0.2884955462337275)}
[I 2024-12-06 23:38:46,553] Trial 439 finished with value: 1.375 and parameters: {'x_0_0': 'oo', 'x_0_1': 'oo', 'x_1_0': 'cd', 'x_1_1': 'cd'}. Best is trial 23 with value: 0.5.
2024-12-06 23:38:46,720 - INFO - Candidate Mean Stats: {'Max': np.float64(3.228349002456883), 'Min': np.float64(-0.8458574972614029), 'Mean': np.float64(0.7992889636441111), 'Std': np.float64(0.5591885317427947)}
2024-12-06 23:38:46,721 - INFO - Candidate Std Stats: {'Max': np.float64(1.514571966467379), 'Min': np.float64(0.0), 'Mean': np.float64(0.4762315559855182), 'Std': np.float64(0.3089780452122252)}
[I 2024-12-06 23:38:46,779] Trial 442 finished with value: 1.3035714285714286 and parameters: {'x_0_0': 'ac', 'x_0_1': 'ab', 'x_1_0': 'ab', 'x_1_1': 'oo'}. Best is trial 76 with value: 0.5.
2024-12-06 23:38:46,806 - INFO - Candidate Mean Stats: {'Max': np.float64(2.8048367302952384), 'Min': np.float64(-0.4150071347566575), 'Mean': np.float64(0.7852875869275259), 'Std': np.float64(0.49056716005015166)}
2024-12-06 23:38:46,806 - INFO - Candidate Std Stats: {'Max': np.float64(1.7426238449862619), 'Min': np.float64(0.0), 'Mean': np.float64(0.47531860697797335), 'Std': np.float64(0.32086655973566985)}
[I 2024-12-06 23:38:46,824] Trial 442 finished with value: 1.375 and parameters: {'x_0_0': 'oo', 'x_0_1': 'oo', 'x_1_0': 'bc', 'x_1_1': 'ad'}. Best is trial 165 with value: 0.5.
2024-12-06 23:38:46,878 - INFO - Candidate Mean Stats: {'Max': np.float64(2.987170658356623), 'Min': np.float64(-0.5306071457384908), 'Mean': np.float64(0.8058210691494716), 'Std': np.float64(0.5547916405225682)}
2024-12-06 23:38:46,879 - INFO - Candidate Std Stats: {'Max': np.float64(1.493283608335504), 'Min': np.float64(0.0), 'Mean': np.float64(0.46429443179652397), 'Std': np.float64(0.2997117219144007)}
[I 2024-12-06 23:38:46,899] Trial 442 finished with value: 1.375 and parameters: {'x_0_0': 'oo', 'x_0_1': 'oo', 'x_1_0': 'ab', 'x_1_1': 'cd'}. Best is trial 63 with value: 0.5.
2024-12-06 23:38:47,016 - INFO - Candidate Mean Stats: {'Max': np.float64(3.0616137909156147), 'Min': np.float64(-0.6858167113805437), 'Mean': np.float64(0.8168459867540134), 'Std': np.float64(0.49066544327959444)}
2024-12-06 23:38:47,017 - INFO - Candidate Std Stats: {'Max': np.float64(1.6382702799597373), 'Min': np.float64(0.0), 'Mean': np.float64(0.5173944468984272), 'Std': np.float64(0.3277749581459204)}
[I 2024-12-06 23:38:47,033] Trial 440 finished with value: 1.3214285714285714 and parameters: {'x_0_0': 'ad', 'x_0_1': 'ac', 'x_1_0': 'oo', 'x_1_1': 'bc'}. Best is trial 23 with value: 0.5.
2024-12-06 23:38:47,174 - INFO - Candidate Mean Stats: {'Max': np.float64(2.96075341589506), 'Min': np.float64(-0.7182402621821948), 'Mean': np.float64(0.7508113835744078), 'Std': np.float64(0.5643647841418288)}
2024-12-06 23:38:47,175 - INFO - Candidate Std Stats: {'Max': np.float64(1.5859509754827703), 'Min': np.float64(0.0), 'Mean': np.float64(0.4992176531739506), 'Std': np.float64(0.3273273178740757)}
[I 2024-12-06 23:38:47,189] Trial 443 finished with value: 1.2142857142857144 and parameters: {'x_0_0': 'ab', 'x_0_1': 'oo', 'x_1_0': 'ab', 'x_1_1': 'ad'}. Best is trial 76 with value: 0.5.
2024-12-06 23:38:47,240 - INFO - Candidate Mean Stats: {'Max': np.float64(3.4205696835270536), 'Min': np.float64(-0.8380032367944821), 'Mean': np.float64(0.7603622230448848), 'Std': np.float64(0.598981524515179)}
2024-12-06 23:38:47,241 - INFO - Candidate Std Stats: {'Max': np.float64(1.4486974949204912), 'Min': np.float64(0.0), 'Mean': np.float64(0.5034593869083288), 'Std': np.float64(0.31639773444692315)}
[I 2024-12-06 23:38:47,270] Trial 443 finished with value: 1.4285714285714286 and parameters: {'x_0_0': 'ac', 'x_0_1': 'ab', 'x_1_0': 'ad', 'x_1_1': 'bd'}. Best is trial 165 with value: 0.5.
2024-12-06 23:38:47,327 - INFO - Candidate Mean Stats: {'Max': np.float64(3.311074277431037), 'Min': np.float64(-0.7760135885529635), 'Mean': np.float64(0.796979348852517), 'Std': np.float64(0.5306562278522939)}
2024-12-06 23:38:47,327 - INFO - Candidate Std Stats: {'Max': np.float64(1.5674460828455579), 'Min': np.float64(0.0), 'Mean': np.float64(0.48349565190355553), 'Std': np.float64(0.3121863010174578)}
[I 2024-12-06 23:38:47,342] Trial 443 finished with value: 1.125 and parameters: {'x_0_0': 'oo', 'x_0_1': 'oo', 'x_1_0': 'oo', 'x_1_1': 'bd'}. Best is trial 63 with value: 0.5.
2024-12-06 23:38:47,494 - INFO - Candidate Mean Stats: {'Max': np.float64(2.67459038645668), 'Min': np.float64(-0.5978797715780435), 'Mean': np.float64(0.7814029573770565), 'Std': np.float64(0.5485634871233868)}
2024-12-06 23:38:47,494 - INFO - Candidate Std Stats: {'Max': np.float64(1.3942979911261266), 'Min': np.float64(0.0), 'Mean': np.float64(0.4450207755112257), 'Std': np.float64(0.2852382564020326)}
[I 2024-12-06 23:38:47,509] Trial 441 finished with value: 1.0357142857142856 and parameters: {'x_0_0': 'bc', 'x_0_1': 'ac', 'x_1_0': 'oo', 'x_1_1': 'ac'}. Best is trial 23 with value: 0.5.
2024-12-06 23:38:47,648 - INFO - Candidate Mean Stats: {'Max': np.float64(2.8821698580179103), 'Min': np.float64(-0.6756938992847521), 'Mean': np.float64(0.8080174380167491), 'Std': np.float64(0.5220743482432539)}
2024-12-06 23:38:47,648 - INFO - Candidate Std Stats: {'Max': np.float64(1.6298954655703273), 'Min': np.float64(0.0), 'Mean': np.float64(0.49930290457283616), 'Std': np.float64(0.31975532439168936)}
[I 2024-12-06 23:38:47,670] Trial 444 finished with value: 1.2857142857142856 and parameters: {'x_0_0': 'ac', 'x_0_1': 'ac', 'x_1_0': 'ac', 'x_1_1': 'ab'}. Best is trial 76 with value: 0.5.
2024-12-06 23:38:47,708 - INFO - Candidate Mean Stats: {'Max': np.float64(3.115906204796409), 'Min': np.float64(-0.48326969730179964), 'Mean': np.float64(0.8210187539262997), 'Std': np.float64(0.5203913623679954)}
2024-12-06 23:38:47,708 - INFO - Candidate Std Stats: {'Max': np.float64(1.8690896726948842), 'Min': np.float64(0.0), 'Mean': np.float64(0.41651322728658763), 'Std': np.float64(0.2904511152184444)}
[I 2024-12-06 23:38:47,722] Trial 444 finished with value: 1.4285714285714286 and parameters: {'x_0_0': 'ac', 'x_0_1': 'ab', 'x_1_0': 'ad', 'x_1_1': 'ad'}. Best is trial 165 with value: 0.5.
2024-12-06 23:38:47,777 - INFO - Candidate Mean Stats: {'Max': np.float64(3.1193951015338404), 'Min': np.float64(-0.359075881188848), 'Mean': np.float64(0.8436507147178588), 'Std': np.float64(0.4558639151635154)}
2024-12-06 23:38:47,777 - INFO - Candidate Std Stats: {'Max': np.float64(1.643147260289764), 'Min': np.float64(0.0), 'Mean': np.float64(0.43853682596016164), 'Std': np.float64(0.3060586379695322)}
[I 2024-12-06 23:38:47,792] Trial 444 finished with value: 1.5 and parameters: {'x_0_0': 'cd', 'x_0_1': 'oo', 'x_1_0': 'ac', 'x_1_1': 'cd'}. Best is trial 63 with value: 0.5.
2024-12-06 23:38:47,911 - INFO - Candidate Mean Stats: {'Max': np.float64(3.2806249506005125), 'Min': np.float64(-0.3537397513855613), 'Mean': np.float64(0.8127190077485147), 'Std': np.float64(0.47692398816579473)}
2024-12-06 23:38:47,911 - INFO - Candidate Std Stats: {'Max': np.float64(1.8354748282909767), 'Min': np.float64(0.0), 'Mean': np.float64(0.393530185598137), 'Std': np.float64(0.2785243757749424)}
[I 2024-12-06 23:38:47,928] Trial 442 finished with value: 1.5892857142857144 and parameters: {'x_0_0': 'ab', 'x_0_1': 'cd', 'x_1_0': 'bd', 'x_1_1': 'oo'}. Best is trial 23 with value: 0.5.
2024-12-06 23:38:48,086 - INFO - Candidate Mean Stats: {'Max': np.float64(3.149617308157075), 'Min': np.float64(-1.0635256867475593), 'Mean': np.float64(0.7701216540862088), 'Std': np.float64(0.5864591535672102)}
2024-12-06 23:38:48,086 - INFO - Candidate Std Stats: {'Max': np.float64(1.4118295857905478), 'Min': np.float64(0.0), 'Mean': np.float64(0.4494706412476502), 'Std': np.float64(0.2930823307375428)}
[I 2024-12-06 23:38:48,103] Trial 445 finished with value: 1.3214285714285714 and parameters: {'x_0_0': 'bd', 'x_0_1': 'ac', 'x_1_0': 'oo', 'x_1_1': 'bd'}. Best is trial 76 with value: 0.5.
2024-12-06 23:38:48,131 - INFO - Candidate Mean Stats: {'Max': np.float64(3.5425541102997897), 'Min': np.float64(-0.6193814649328797), 'Mean': np.float64(0.8471082770241168), 'Std': np.float64(0.5187728530259372)}
2024-12-06 23:38:48,131 - INFO - Candidate Std Stats: {'Max': np.float64(1.4713004383746664), 'Min': np.float64(0.0), 'Mean': np.float64(0.43511047248966284), 'Std': np.float64(0.2946459473752018)}
[I 2024-12-06 23:38:48,146] Trial 445 finished with value: 1.1607142857142856 and parameters: {'x_0_0': 'ac', 'x_0_1': 'ad', 'x_1_0': 'ab', 'x_1_1': 'oo'}. Best is trial 165 with value: 0.5.
2024-12-06 23:38:48,199 - INFO - Candidate Mean Stats: {'Max': np.float64(2.7349970498277316), 'Min': np.float64(-0.4488043102458935), 'Mean': np.float64(0.7709117759357933), 'Std': np.float64(0.4946909139102205)}
2024-12-06 23:38:48,199 - INFO - Candidate Std Stats: {'Max': np.float64(1.643233310452208), 'Min': np.float64(0.0), 'Mean': np.float64(0.4537833032697733), 'Std': np.float64(0.29456336262291566)}
[I 2024-12-06 23:38:48,214] Trial 445 finished with value: 1.75 and parameters: {'x_0_0': 'oo', 'x_0_1': 'ab', 'x_1_0': 'ac', 'x_1_1': 'oo'}. Best is trial 63 with value: 0.5.
2024-12-06 23:38:48,340 - INFO - Candidate Mean Stats: {'Max': np.float64(3.377087887550539), 'Min': np.float64(-0.37968415124330734), 'Mean': np.float64(0.8277228332169593), 'Std': np.float64(0.5114126753193481)}
2024-12-06 23:38:48,340 - INFO - Candidate Std Stats: {'Max': np.float64(1.3771178651247813), 'Min': np.float64(0.0), 'Mean': np.float64(0.4531030623900631), 'Std': np.float64(0.29516962828155685)}
[I 2024-12-06 23:38:48,354] Trial 443 finished with value: 1.0 and parameters: {'x_0_0': 'ad', 'x_0_1': 'ac', 'x_1_0': 'bc', 'x_1_1': 'ad'}. Best is trial 23 with value: 0.5.
2024-12-06 23:38:48,497 - INFO - Candidate Mean Stats: {'Max': np.float64(2.8494661752707677), 'Min': np.float64(-0.4520919026813995), 'Mean': np.float64(0.8305941238356378), 'Std': np.float64(0.5121583542429995)}
2024-12-06 23:38:48,497 - INFO - Candidate Std Stats: {'Max': np.float64(1.348027096182384), 'Min': np.float64(0.0), 'Mean': np.float64(0.44177529290926754), 'Std': np.float64(0.2937076058603445)}
[I 2024-12-06 23:38:48,513] Trial 446 finished with value: 1.375 and parameters: {'x_0_0': 'oo', 'x_0_1': 'oo', 'x_1_0': 'ab', 'x_1_1': 'bd'}. Best is trial 76 with value: 0.5.
2024-12-06 23:38:48,540 - INFO - Candidate Mean Stats: {'Max': np.float64(3.065834697347823), 'Min': np.float64(-0.5807323250992333), 'Mean': np.float64(0.8572682914900547), 'Std': np.float64(0.5181419498695958)}
2024-12-06 23:38:48,540 - INFO - Candidate Std Stats: {'Max': np.float64(1.456026610751472), 'Min': np.float64(0.0), 'Mean': np.float64(0.4100145533210884), 'Std': np.float64(0.27728590795186864)}
[I 2024-12-06 23:38:48,555] Trial 446 finished with value: 1.0357142857142856 and parameters: {'x_0_0': 'ac', 'x_0_1': 'ad', 'x_1_0': 'oo', 'x_1_1': 'ac'}. Best is trial 165 with value: 0.5.
2024-12-06 23:38:48,607 - INFO - Candidate Mean Stats: {'Max': np.float64(2.9967052749702043), 'Min': np.float64(-0.27735000939736626), 'Mean': np.float64(0.8622965652930327), 'Std': np.float64(0.4268606878342246)}
2024-12-06 23:38:48,607 - INFO - Candidate Std Stats: {'Max': np.float64(1.3308687061852873), 'Min': np.float64(0.0), 'Mean': np.float64(0.3872333677613703), 'Std': np.float64(0.2662584348087223)}
[I 2024-12-06 23:38:48,622] Trial 446 finished with value: 1.0714285714285714 and parameters: {'x_0_0': 'bc', 'x_0_1': 'oo', 'x_1_0': 'ab', 'x_1_1': 'ab'}. Best is trial 63 with value: 0.5.
2024-12-06 23:38:48,760 - INFO - Candidate Mean Stats: {'Max': np.float64(3.1943708332223184), 'Min': np.float64(-0.3708022086410422), 'Mean': np.float64(0.8988065734154774), 'Std': np.float64(0.4301317614903567)}
2024-12-06 23:38:48,760 - INFO - Candidate Std Stats: {'Max': np.float64(1.5817061292139984), 'Min': np.float64(0.0), 'Mean': np.float64(0.40278319584768013), 'Std': np.float64(0.26269379513227564)}
[I 2024-12-06 23:38:48,776] Trial 444 finished with value: 1.75 and parameters: {'x_0_0': 'cd', 'x_0_1': 'ac', 'x_1_0': 'oo', 'x_1_1': 'bc'}. Best is trial 23 with value: 0.5.
2024-12-06 23:38:48,912 - INFO - Candidate Mean Stats: {'Max': np.float64(3.186168338456758), 'Min': np.float64(-0.6719114409291762), 'Mean': np.float64(0.7669966337951385), 'Std': np.float64(0.5563372719252144)}
2024-12-06 23:38:48,912 - INFO - Candidate Std Stats: {'Max': np.float64(1.4674013455687587), 'Min': np.float64(0.0), 'Mean': np.float64(0.49896907861116796), 'Std': np.float64(0.3157714187392328)}
[I 2024-12-06 23:38:48,927] Trial 447 finished with value: 1.1964285714285714 and parameters: {'x_0_0': 'bc', 'x_0_1': 'bd', 'x_1_0': 'oo', 'x_1_1': 'oo'}. Best is trial 76 with value: 0.5.
2024-12-06 23:38:48,963 - INFO - Candidate Mean Stats: {'Max': np.float64(3.3610412816421755), 'Min': np.float64(-0.5286509769420977), 'Mean': np.float64(0.8090663602880646), 'Std': np.float64(0.502151378447148)}
2024-12-06 23:38:48,963 - INFO - Candidate Std Stats: {'Max': np.float64(1.6105660400505935), 'Min': np.float64(0.0), 'Mean': np.float64(0.4865521296244459), 'Std': np.float64(0.32089089363288026)}
[I 2024-12-06 23:38:48,978] Trial 447 finished with value: 1.2857142857142856 and parameters: {'x_0_0': 'bd', 'x_0_1': 'ad', 'x_1_0': 'bd', 'x_1_1': 'ab'}. Best is trial 165 with value: 0.5.
2024-12-06 23:38:49,028 - INFO - Candidate Mean Stats: {'Max': np.float64(3.0478692875344597), 'Min': np.float64(-0.5197212369951388), 'Mean': np.float64(0.8243857826881406), 'Std': np.float64(0.5076245495178444)}
2024-12-06 23:38:49,028 - INFO - Candidate Std Stats: {'Max': np.float64(1.5469736414714006), 'Min': np.float64(0.0), 'Mean': np.float64(0.45158207674355055), 'Std': np.float64(0.2988883553537492)}
[I 2024-12-06 23:38:49,043] Trial 447 finished with value: 1.1607142857142856 and parameters: {'x_0_0': 'bd', 'x_0_1': 'ac', 'x_1_0': 'bc', 'x_1_1': 'oo'}. Best is trial 63 with value: 0.5.
2024-12-06 23:38:49,174 - INFO - Candidate Mean Stats: {'Max': np.float64(3.07713430172885), 'Min': np.float64(-0.37008102536184484), 'Mean': np.float64(0.8376229551458851), 'Std': np.float64(0.5049945247194548)}
2024-12-06 23:38:49,174 - INFO - Candidate Std Stats: {'Max': np.float64(1.4777269999130862), 'Min': np.float64(0.0), 'Mean': np.float64(0.44179522475731076), 'Std': np.float64(0.2938203842940528)}
[I 2024-12-06 23:38:49,190] Trial 445 finished with value: 1.5 and parameters: {'x_0_0': 'cd', 'x_0_1': 'oo', 'x_1_0': 'ab', 'x_1_1': 'bd'}. Best is trial 23 with value: 0.5.
2024-12-06 23:38:49,342 - INFO - Candidate Mean Stats: {'Max': np.float64(2.869205602835483), 'Min': np.float64(-0.5862752978942504), 'Mean': np.float64(0.796948393058562), 'Std': np.float64(0.5030121134788765)}
2024-12-06 23:38:49,342 - INFO - Candidate Std Stats: {'Max': np.float64(1.334230414052894), 'Min': np.float64(0.0), 'Mean': np.float64(0.48307317156840324), 'Std': np.float64(0.30462875165374703)}
[I 2024-12-06 23:38:49,357] Trial 448 finished with value: 1.2857142857142856 and parameters: {'x_0_0': 'bc', 'x_0_1': 'ad', 'x_1_0': 'bc', 'x_1_1': 'cd'}. Best is trial 76 with value: 0.5.
2024-12-06 23:38:49,399 - INFO - Candidate Mean Stats: {'Max': np.float64(3.706253396652248), 'Min': np.float64(-0.4007650177264554), 'Mean': np.float64(0.8404233588062188), 'Std': np.float64(0.4924803153300497)}
2024-12-06 23:38:49,400 - INFO - Candidate Std Stats: {'Max': np.float64(1.795104783848057), 'Min': np.float64(0.0), 'Mean': np.float64(0.43203718891393833), 'Std': np.float64(0.29364552340536393)}
[I 2024-12-06 23:38:49,415] Trial 448 finished with value: 1.5 and parameters: {'x_0_0': 'cd', 'x_0_1': 'oo', 'x_1_0': 'ad', 'x_1_1': 'ab'}. Best is trial 165 with value: 0.5.
2024-12-06 23:38:49,451 - INFO - Candidate Mean Stats: {'Max': np.float64(2.560145983284756), 'Min': np.float64(-1.1392409857998853), 'Mean': np.float64(0.8047425150401057), 'Std': np.float64(0.5547625478270956)}
2024-12-06 23:38:49,451 - INFO - Candidate Std Stats: {'Max': np.float64(1.6833067830551314), 'Min': np.float64(0.0), 'Mean': np.float64(0.49108096058800815), 'Std': np.float64(0.315344284577496)}
[I 2024-12-06 23:38:49,466] Trial 448 finished with value: 1.375 and parameters: {'x_0_0': 'oo', 'x_0_1': 'oo', 'x_1_0': 'ad', 'x_1_1': 'ad'}. Best is trial 63 with value: 0.5.
2024-12-06 23:38:49,604 - INFO - Candidate Mean Stats: {'Max': np.float64(2.888890495079073), 'Min': np.float64(-0.4882192287472284), 'Mean': np.float64(0.8488163281757326), 'Std': np.float64(0.4718274371664095)}
2024-12-06 23:38:49,604 - INFO - Candidate Std Stats: {'Max': np.float64(1.388798118253715), 'Min': np.float64(0.0), 'Mean': np.float64(0.4170927422576476), 'Std': np.float64(0.27334122343919964)}
[I 2024-12-06 23:38:49,620] Trial 446 finished with value: 1.4464285714285714 and parameters: {'x_0_0': 'ad', 'x_0_1': 'ac', 'x_1_0': 'cd', 'x_1_1': 'oo'}. Best is trial 23 with value: 0.5.
2024-12-06 23:38:49,926 - INFO - Candidate Mean Stats: {'Max': np.float64(3.1555287172357835), 'Min': np.float64(-0.6867146412526981), 'Mean': np.float64(0.7997124803202005), 'Std': np.float64(0.5529205145023605)}
2024-12-06 23:38:49,926 - INFO - Candidate Std Stats: {'Max': np.float64(1.4383110087026052), 'Min': np.float64(0.0), 'Mean': np.float64(0.4919952065929176), 'Std': np.float64(0.3140052351759487)}
[I 2024-12-06 23:38:49,942] Trial 449 finished with value: 1.0357142857142856 and parameters: {'x_0_0': 'ac', 'x_0_1': 'ac', 'x_1_0': 'oo', 'x_1_1': 'bc'}. Best is trial 76 with value: 0.5.
2024-12-06 23:38:49,970 - INFO - Candidate Mean Stats: {'Max': np.float64(3.2911606794287422), 'Min': np.float64(-0.7266084604498724), 'Mean': np.float64(0.8167703921406501), 'Std': np.float64(0.5140227389513996)}
2024-12-06 23:38:49,970 - INFO - Candidate Std Stats: {'Max': np.float64(1.9952432771574897), 'Min': np.float64(0.0), 'Mean': np.float64(0.45548156285674485), 'Std': np.float64(0.3182630813544822)}
