[I 2024-12-06 23:37:26,515] Trial 231 finished with value: 1.0714285714285714 and parameters: {'x_0_0': 'ac', 'x_0_1': 'oo', 'x_1_0': 'cd', 'x_1_1': 'bc'}. Best is trial 23 with value: 0.5.
2024-12-06 23:37:26,686 - INFO - Candidate Mean Stats: {'Max': np.float64(2.5613168862396694), 'Min': np.float64(-0.8398685752710133), 'Mean': np.float64(0.5894259796312113), 'Std': np.float64(0.5709371365536272)}
2024-12-06 23:37:26,686 - INFO - Candidate Std Stats: {'Max': np.float64(1.4836384823693864), 'Min': np.float64(0.0), 'Mean': np.float64(0.5537142542376565), 'Std': np.float64(0.29122181177879036)}
2024-12-06 23:37:26,696 - INFO - Candidate Mean Stats: {'Max': np.float64(2.6891593954804485), 'Min': np.float64(-1.472677460722433), 'Mean': np.float64(0.5699033547325513), 'Std': np.float64(0.5400991426434943)}
2024-12-06 23:37:26,696 - INFO - Candidate Std Stats: {'Max': np.float64(1.602218569118199), 'Min': np.float64(0.0), 'Mean': np.float64(0.5524774529430009), 'Std': np.float64(0.2939881102717882)}
[I 2024-12-06 23:37:26,699] Trial 233 finished with value: 0.9464285714285714 and parameters: {'x_0_0': 'ac', 'x_0_1': 'oo', 'x_1_0': 'ac', 'x_1_1': 'oo'}. Best is trial 165 with value: 0.5.
[I 2024-12-06 23:37:26,709] Trial 233 finished with value: 1.0714285714285714 and parameters: {'x_0_0': 'bc', 'x_0_1': 'oo', 'x_1_0': 'bd', 'x_1_1': 'cd'}. Best is trial 76 with value: 0.5.
2024-12-06 23:37:26,712 - INFO - Candidate Mean Stats: {'Max': np.float64(2.9091145375099905), 'Min': np.float64(-0.9806919561298006), 'Mean': np.float64(0.5283579055635639), 'Std': np.float64(0.578861852864994)}
2024-12-06 23:37:26,712 - INFO - Candidate Std Stats: {'Max': np.float64(1.7119537907527316), 'Min': np.float64(0.0), 'Mean': np.float64(0.6003383992204268), 'Std': np.float64(0.30524479412136607)}
[I 2024-12-06 23:37:26,725] Trial 233 finished with value: 1.0714285714285714 and parameters: {'x_0_0': 'ac', 'x_0_1': 'oo', 'x_1_0': 'ac', 'x_1_1': 'cd'}. Best is trial 63 with value: 0.5.
2024-12-06 23:37:26,865 - INFO - Candidate Mean Stats: {'Max': np.float64(2.9742202614252276), 'Min': np.float64(-1.0306216804010397), 'Mean': np.float64(0.5044815314365471), 'Std': np.float64(0.5622376175916901)}
2024-12-06 23:37:26,865 - INFO - Candidate Std Stats: {'Max': np.float64(1.945569544154795), 'Min': np.float64(0.0), 'Mean': np.float64(0.6117373959459219), 'Std': np.float64(0.3189238832314003)}
[I 2024-12-06 23:37:26,879] Trial 232 finished with value: 1.5 and parameters: {'x_0_0': 'cd', 'x_0_1': 'oo', 'x_1_0': 'bd', 'x_1_1': 'ac'}. Best is trial 23 with value: 0.5.
2024-12-06 23:37:27,049 - INFO - Candidate Mean Stats: {'Max': np.float64(2.642297994341955), 'Min': np.float64(-0.9723844318968279), 'Mean': np.float64(0.5873710477609533), 'Std': np.float64(0.5602978105607238)}
2024-12-06 23:37:27,049 - INFO - Candidate Std Stats: {'Max': np.float64(1.5363103801050169), 'Min': np.float64(0.0), 'Mean': np.float64(0.5785984811190251), 'Std': np.float64(0.2963048749637336)}
2024-12-06 23:37:27,060 - INFO - Candidate Mean Stats: {'Max': np.float64(2.6606885918047416), 'Min': np.float64(-0.9610298150718217), 'Mean': np.float64(0.5975580707065814), 'Std': np.float64(0.5446126594311786)}
2024-12-06 23:37:27,061 - INFO - Candidate Std Stats: {'Max': np.float64(1.5236059963487945), 'Min': np.float64(0.0), 'Mean': np.float64(0.576058734600075), 'Std': np.float64(0.30176541011651237)}
[I 2024-12-06 23:37:27,063] Trial 234 finished with value: 1.2142857142857144 and parameters: {'x_0_0': 'ab', 'x_0_1': 'oo', 'x_1_0': 'ad', 'x_1_1': 'bc'}. Best is trial 165 with value: 0.5.
[I 2024-12-06 23:37:27,074] Trial 234 finished with value: 1.4464285714285714 and parameters: {'x_0_0': 'ac', 'x_0_1': 'bd', 'x_1_0': 'ac', 'x_1_1': 'oo'}. Best is trial 76 with value: 0.5.
2024-12-06 23:37:27,077 - INFO - Candidate Mean Stats: {'Max': np.float64(2.691003206180011), 'Min': np.float64(-1.3002196575238103), 'Mean': np.float64(0.531555844436803), 'Std': np.float64(0.5946341901516864)}
2024-12-06 23:37:27,077 - INFO - Candidate Std Stats: {'Max': np.float64(1.5705743455783492), 'Min': np.float64(0.0), 'Mean': np.float64(0.5989032538032003), 'Std': np.float64(0.30768183816421135)}
[I 2024-12-06 23:37:27,090] Trial 234 finished with value: 1.0714285714285714 and parameters: {'x_0_0': 'ac', 'x_0_1': 'oo', 'x_1_0': 'ac', 'x_1_1': 'bd'}. Best is trial 63 with value: 0.5.
2024-12-06 23:37:27,230 - INFO - Candidate Mean Stats: {'Max': np.float64(2.9275658135969542), 'Min': np.float64(-1.0369377576407552), 'Mean': np.float64(0.6126351479734564), 'Std': np.float64(0.5138167226775667)}
2024-12-06 23:37:27,230 - INFO - Candidate Std Stats: {'Max': np.float64(1.6258377060752014), 'Min': np.float64(0.0), 'Mean': np.float64(0.5835348088707205), 'Std': np.float64(0.30030148929280115)}
[I 2024-12-06 23:37:27,245] Trial 233 finished with value: 1.2142857142857144 and parameters: {'x_0_0': 'ab', 'x_0_1': 'oo', 'x_1_0': 'ab', 'x_1_1': 'ad'}. Best is trial 23 with value: 0.5.
2024-12-06 23:37:27,418 - INFO - Candidate Mean Stats: {'Max': np.float64(2.729476762413502), 'Min': np.float64(-0.9545263128353623), 'Mean': np.float64(0.5559990288163706), 'Std': np.float64(0.5673166746922568)}
2024-12-06 23:37:27,418 - INFO - Candidate Std Stats: {'Max': np.float64(1.7787953105257042), 'Min': np.float64(0.0), 'Mean': np.float64(0.604438965867588), 'Std': np.float64(0.31164571347909237)}
2024-12-06 23:37:27,425 - INFO - Candidate Mean Stats: {'Max': np.float64(2.8921043439245526), 'Min': np.float64(-1.064216487894996), 'Mean': np.float64(0.5082256419327333), 'Std': np.float64(0.5663948440115837)}
2024-12-06 23:37:27,425 - INFO - Candidate Std Stats: {'Max': np.float64(1.4507922506216053), 'Min': np.float64(0.0), 'Mean': np.float64(0.5714910844768529), 'Std': np.float64(0.2943815544760914)}
[I 2024-12-06 23:37:27,433] Trial 235 finished with value: 0.9642857142857143 and parameters: {'x_0_0': 'ab', 'x_0_1': 'oo', 'x_1_0': 'oo', 'x_1_1': 'bd'}. Best is trial 165 with value: 0.5.
[I 2024-12-06 23:37:27,439] Trial 235 finished with value: 1.0714285714285714 and parameters: {'x_0_0': 'ad', 'x_0_1': 'oo', 'x_1_0': 'cd', 'x_1_1': 'ab'}. Best is trial 76 with value: 0.5.
2024-12-06 23:37:27,443 - INFO - Candidate Mean Stats: {'Max': np.float64(3.1078078695241578), 'Min': np.float64(-1.2795401379962674), 'Mean': np.float64(0.5159176556303557), 'Std': np.float64(0.5554964722877401)}
2024-12-06 23:37:27,443 - INFO - Candidate Std Stats: {'Max': np.float64(1.8647983487242648), 'Min': np.float64(0.0), 'Mean': np.float64(0.5759715279089412), 'Std': np.float64(0.30305560381261853)}
[I 2024-12-06 23:37:27,456] Trial 235 finished with value: 1.5714285714285714 and parameters: {'x_0_0': 'bc', 'x_0_1': 'cd', 'x_1_0': 'bd', 'x_1_1': 'ab'}. Best is trial 63 with value: 0.5.
2024-12-06 23:37:27,599 - INFO - Candidate Mean Stats: {'Max': np.float64(3.0421250500563586), 'Min': np.float64(-0.8900681927060232), 'Mean': np.float64(0.5052834785008878), 'Std': np.float64(0.6095037095328628)}
2024-12-06 23:37:27,599 - INFO - Candidate Std Stats: {'Max': np.float64(1.6926957524040434), 'Min': np.float64(0.0), 'Mean': np.float64(0.6069016058336698), 'Std': np.float64(0.32350198832722976)}
[I 2024-12-06 23:37:27,613] Trial 234 finished with value: 1.2142857142857144 and parameters: {'x_0_0': 'ab', 'x_0_1': 'oo', 'x_1_0': 'cd', 'x_1_1': 'cd'}. Best is trial 23 with value: 0.5.
2024-12-06 23:37:27,787 - INFO - Candidate Mean Stats: {'Max': np.float64(2.7011176647393755), 'Min': np.float64(-1.325252352631367), 'Mean': np.float64(0.44520098719769946), 'Std': np.float64(0.6435550010525178)}
2024-12-06 23:37:27,787 - INFO - Candidate Std Stats: {'Max': np.float64(1.7452077427727009), 'Min': np.float64(0.0), 'Mean': np.float64(0.662378349645358), 'Std': np.float64(0.3432000087523644)}
2024-12-06 23:37:27,795 - INFO - Candidate Mean Stats: {'Max': np.float64(2.8747266354066454), 'Min': np.float64(-1.0022450748468419), 'Mean': np.float64(0.5425665823958662), 'Std': np.float64(0.5646912256224869)}
2024-12-06 23:37:27,795 - INFO - Candidate Std Stats: {'Max': np.float64(1.5483738524987547), 'Min': np.float64(0.0), 'Mean': np.float64(0.5661254128744341), 'Std': np.float64(0.3065092747473087)}
[I 2024-12-06 23:37:27,801] Trial 236 finished with value: 1.0714285714285714 and parameters: {'x_0_0': 'bc', 'x_0_1': 'oo', 'x_1_0': 'ac', 'x_1_1': 'cd'}. Best is trial 165 with value: 0.5.
[I 2024-12-06 23:37:27,808] Trial 236 finished with value: 1.25 and parameters: {'x_0_0': 'oo', 'x_0_1': 'oo', 'x_1_0': 'ac', 'x_1_1': 'oo'}. Best is trial 76 with value: 0.5.
2024-12-06 23:37:27,811 - INFO - Candidate Mean Stats: {'Max': np.float64(2.7646483214519906), 'Min': np.float64(-1.51993291774255), 'Mean': np.float64(0.4769992517748554), 'Std': np.float64(0.6039687359856465)}
2024-12-06 23:37:27,811 - INFO - Candidate Std Stats: {'Max': np.float64(1.9495228408359728), 'Min': np.float64(0.0), 'Mean': np.float64(0.6287599802387029), 'Std': np.float64(0.35448819107392043)}
[I 2024-12-06 23:37:27,825] Trial 236 finished with value: 1.1607142857142856 and parameters: {'x_0_0': 'bd', 'x_0_1': 'bc', 'x_1_0': 'bd', 'x_1_1': 'oo'}. Best is trial 63 with value: 0.5.
2024-12-06 23:37:27,967 - INFO - Candidate Mean Stats: {'Max': np.float64(3.048465385910725), 'Min': np.float64(-0.9980002611373797), 'Mean': np.float64(0.5364595051780547), 'Std': np.float64(0.5949099421090989)}
2024-12-06 23:37:27,967 - INFO - Candidate Std Stats: {'Max': np.float64(1.6447297911025625), 'Min': np.float64(0.0), 'Mean': np.float64(0.5753974841544733), 'Std': np.float64(0.3080438971001694)}
[I 2024-12-06 23:37:27,980] Trial 235 finished with value: 1.2142857142857144 and parameters: {'x_0_0': 'ab', 'x_0_1': 'oo', 'x_1_0': 'cd', 'x_1_1': 'bd'}. Best is trial 23 with value: 0.5.
2024-12-06 23:37:28,155 - INFO - Candidate Mean Stats: {'Max': np.float64(2.9322910290824935), 'Min': np.float64(-0.9912280926207468), 'Mean': np.float64(0.4900065065991329), 'Std': np.float64(0.5745872600271624)}
2024-12-06 23:37:28,155 - INFO - Candidate Std Stats: {'Max': np.float64(1.8179350376737178), 'Min': np.float64(0.0), 'Mean': np.float64(0.6134643533080997), 'Std': np.float64(0.32108953176714544)}
2024-12-06 23:37:28,163 - INFO - Candidate Mean Stats: {'Max': np.float64(2.6479657842655167), 'Min': np.float64(-0.8436159291667344), 'Mean': np.float64(0.598391420720535), 'Std': np.float64(0.5855003213275252)}
2024-12-06 23:37:28,163 - INFO - Candidate Std Stats: {'Max': np.float64(1.6950116873904735), 'Min': np.float64(0.0), 'Mean': np.float64(0.524742541479262), 'Std': np.float64(0.2787230828996482)}
[I 2024-12-06 23:37:28,169] Trial 237 finished with value: 0.7857142857142857 and parameters: {'x_0_0': 'ad', 'x_0_1': 'oo', 'x_1_0': 'bd', 'x_1_1': 'ac'}. Best is trial 165 with value: 0.5.
[I 2024-12-06 23:37:28,177] Trial 237 finished with value: 1.0714285714285714 and parameters: {'x_0_0': 'bd', 'x_0_1': 'oo', 'x_1_0': 'cd', 'x_1_1': 'bd'}. Best is trial 76 with value: 0.5.
2024-12-06 23:37:28,178 - INFO - Candidate Mean Stats: {'Max': np.float64(2.52143298143226), 'Min': np.float64(-0.7305523020898713), 'Mean': np.float64(0.5047963735077631), 'Std': np.float64(0.4948845159372277)}
2024-12-06 23:37:28,178 - INFO - Candidate Std Stats: {'Max': np.float64(1.4778640987537943), 'Min': np.float64(0.0), 'Mean': np.float64(0.5668989105113246), 'Std': np.float64(0.2819413626639967)}
[I 2024-12-06 23:37:28,192] Trial 237 finished with value: 1.5714285714285714 and parameters: {'x_0_0': 'bd', 'x_0_1': 'cd', 'x_1_0': 'ad', 'x_1_1': 'ab'}. Best is trial 63 with value: 0.5.
2024-12-06 23:37:28,333 - INFO - Candidate Mean Stats: {'Max': np.float64(3.0835284658100632), 'Min': np.float64(-0.8631764878662654), 'Mean': np.float64(0.6138218766252042), 'Std': np.float64(0.5788445196671136)}
2024-12-06 23:37:28,333 - INFO - Candidate Std Stats: {'Max': np.float64(1.3631930189742312), 'Min': np.float64(0.0), 'Mean': np.float64(0.5251799281325041), 'Std': np.float64(0.2682351326864819)}
[I 2024-12-06 23:37:28,347] Trial 236 finished with value: 1.5 and parameters: {'x_0_0': 'cd', 'x_0_1': 'oo', 'x_1_0': 'ad', 'x_1_1': 'ab'}. Best is trial 23 with value: 0.5.
2024-12-06 23:37:28,522 - INFO - Candidate Mean Stats: {'Max': np.float64(3.4610716501926397), 'Min': np.float64(-1.099321612381588), 'Mean': np.float64(0.5846426200600006), 'Std': np.float64(0.5818911385924981)}
2024-12-06 23:37:28,522 - INFO - Candidate Std Stats: {'Max': np.float64(1.4551042049362393), 'Min': np.float64(0.0), 'Mean': np.float64(0.5576773792924904), 'Std': np.float64(0.28607416677299763)}
2024-12-06 23:37:28,530 - INFO - Candidate Mean Stats: {'Max': np.float64(3.2729093391982174), 'Min': np.float64(-1.2567123286278035), 'Mean': np.float64(0.428421623656247), 'Std': np.float64(0.6467291531111804)}
2024-12-06 23:37:28,530 - INFO - Candidate Std Stats: {'Max': np.float64(2.1076644112821), 'Min': np.float64(0.0), 'Mean': np.float64(0.6499625171209251), 'Std': np.float64(0.34933807949020507)}
[I 2024-12-06 23:37:28,536] Trial 238 finished with value: 1.0714285714285714 and parameters: {'x_0_0': 'ac', 'x_0_1': 'oo', 'x_1_0': 'ac', 'x_1_1': 'ad'}. Best is trial 165 with value: 0.5.
[I 2024-12-06 23:37:28,543] Trial 238 finished with value: 1.2857142857142856 and parameters: {'x_0_0': 'ac', 'x_0_1': 'ac', 'x_1_0': 'cd', 'x_1_1': 'ac'}. Best is trial 76 with value: 0.5.
2024-12-06 23:37:28,545 - INFO - Candidate Mean Stats: {'Max': np.float64(3.1044451778747217), 'Min': np.float64(-0.7572166600990884), 'Mean': np.float64(0.5947829289022635), 'Std': np.float64(0.5200661511545613)}
2024-12-06 23:37:28,545 - INFO - Candidate Std Stats: {'Max': np.float64(1.4247809174692698), 'Min': np.float64(0.0), 'Mean': np.float64(0.5136465789811917), 'Std': np.float64(0.2742119925917879)}
[I 2024-12-06 23:37:28,559] Trial 238 finished with value: 0.8214285714285714 and parameters: {'x_0_0': 'ac', 'x_0_1': 'oo', 'x_1_0': 'oo', 'x_1_1': 'ab'}. Best is trial 63 with value: 0.5.
2024-12-06 23:37:28,702 - INFO - Candidate Mean Stats: {'Max': np.float64(3.123660918693247), 'Min': np.float64(-1.2514284527533879), 'Mean': np.float64(0.5553319724263079), 'Std': np.float64(0.5601261156152494)}
2024-12-06 23:37:28,703 - INFO - Candidate Std Stats: {'Max': np.float64(1.5279732852952579), 'Min': np.float64(0.0), 'Mean': np.float64(0.5441203575727862), 'Std': np.float64(0.28439465811408843)}
[I 2024-12-06 23:37:28,716] Trial 237 finished with value: 1.0714285714285714 and parameters: {'x_0_0': 'ad', 'x_0_1': 'oo', 'x_1_0': 'ad', 'x_1_1': 'ab'}. Best is trial 23 with value: 0.5.
2024-12-06 23:37:28,889 - INFO - Candidate Mean Stats: {'Max': np.float64(2.953518026421215), 'Min': np.float64(-1.4110440382698133), 'Mean': np.float64(0.5190659002496572), 'Std': np.float64(0.6232004250257611)}
2024-12-06 23:37:28,889 - INFO - Candidate Std Stats: {'Max': np.float64(1.7164339542086462), 'Min': np.float64(0.0), 'Mean': np.float64(0.646511547552669), 'Std': np.float64(0.33718632952100736)}
2024-12-06 23:37:28,899 - INFO - Candidate Mean Stats: {'Max': np.float64(2.812719439692762), 'Min': np.float64(-1.171288291040032), 'Mean': np.float64(0.48515563608615525), 'Std': np.float64(0.5777390392595384)}
2024-12-06 23:37:28,899 - INFO - Candidate Std Stats: {'Max': np.float64(2.6018889333211592), 'Min': np.float64(0.0), 'Mean': np.float64(0.6117810839339685), 'Std': np.float64(0.35040266655424973)}
[I 2024-12-06 23:37:28,904] Trial 239 finished with value: 1.0714285714285714 and parameters: {'x_0_0': 'ad', 'x_0_1': 'oo', 'x_1_0': 'cd', 'x_1_1': 'cd'}. Best is trial 165 with value: 0.5.
2024-12-06 23:37:28,912 - INFO - Candidate Mean Stats: {'Max': np.float64(2.851292444360729), 'Min': np.float64(-0.8246677598015744), 'Mean': np.float64(0.604990770493065), 'Std': np.float64(0.5134670206662623)}
[I 2024-12-06 23:37:28,912] Trial 239 finished with value: 0.6607142857142857 and parameters: {'x_0_0': 'ad', 'x_0_1': 'oo', 'x_1_0': 'bd', 'x_1_1': 'oo'}. Best is trial 76 with value: 0.5.
2024-12-06 23:37:28,912 - INFO - Candidate Std Stats: {'Max': np.float64(1.6552164541599241), 'Min': np.float64(0.0), 'Mean': np.float64(0.5490547271038106), 'Std': np.float64(0.29716997082195273)}
[I 2024-12-06 23:37:28,925] Trial 239 finished with value: 0.7857142857142857 and parameters: {'x_0_0': 'bd', 'x_0_1': 'oo', 'x_1_0': 'bd', 'x_1_1': 'bd'}. Best is trial 63 with value: 0.5.
2024-12-06 23:37:29,071 - INFO - Candidate Mean Stats: {'Max': np.float64(3.237023591410657), 'Min': np.float64(-0.9544398876511755), 'Mean': np.float64(0.5055831924141637), 'Std': np.float64(0.592716830430468)}
2024-12-06 23:37:29,072 - INFO - Candidate Std Stats: {'Max': np.float64(1.7316185308519965), 'Min': np.float64(0.0), 'Mean': np.float64(0.5989156399467617), 'Std': np.float64(0.295256999057303)}
[I 2024-12-06 23:37:29,085] Trial 238 finished with value: 1.0892857142857144 and parameters: {'x_0_0': 'ab', 'x_0_1': 'oo', 'x_1_0': 'bd', 'x_1_1': 'oo'}. Best is trial 23 with value: 0.5.
2024-12-06 23:37:29,257 - INFO - Candidate Mean Stats: {'Max': np.float64(3.0211758324275726), 'Min': np.float64(-0.8985929456266639), 'Mean': np.float64(0.5945884935927245), 'Std': np.float64(0.5158272249328905)}
2024-12-06 23:37:29,257 - INFO - Candidate Std Stats: {'Max': np.float64(1.6037463074986116), 'Min': np.float64(0.0), 'Mean': np.float64(0.5639913436401804), 'Std': np.float64(0.29050368006744165)}
2024-12-06 23:37:29,269 - INFO - Candidate Mean Stats: {'Max': np.float64(2.782070402502167), 'Min': np.float64(-0.9430353104115226), 'Mean': np.float64(0.5027561021808155), 'Std': np.float64(0.6067075822639676)}
2024-12-06 23:37:29,269 - INFO - Candidate Std Stats: {'Max': np.float64(1.7510940161890796), 'Min': np.float64(0.0), 'Mean': np.float64(0.6091067798755395), 'Std': np.float64(0.3176855133783922)}
[I 2024-12-06 23:37:29,270] Trial 240 finished with value: 1.0714285714285714 and parameters: {'x_0_0': 'bc', 'x_0_1': 'oo', 'x_1_0': 'cd', 'x_1_1': 'cd'}. Best is trial 165 with value: 0.5.
[I 2024-12-06 23:37:29,282] Trial 240 finished with value: 1.0714285714285714 and parameters: {'x_0_0': 'bc', 'x_0_1': 'oo', 'x_1_0': 'ac', 'x_1_1': 'ad'}. Best is trial 76 with value: 0.5.
2024-12-06 23:37:29,282 - INFO - Candidate Mean Stats: {'Max': np.float64(2.9046305788317914), 'Min': np.float64(-0.8958736719540996), 'Mean': np.float64(0.5691445999182537), 'Std': np.float64(0.48951064707267417)}
2024-12-06 23:37:29,282 - INFO - Candidate Std Stats: {'Max': np.float64(1.6280457458476483), 'Min': np.float64(0.0), 'Mean': np.float64(0.5027737341815843), 'Std': np.float64(0.2691892685925479)}
[I 2024-12-06 23:37:29,296] Trial 240 finished with value: 0.8214285714285714 and parameters: {'x_0_0': 'ac', 'x_0_1': 'oo', 'x_1_0': 'oo', 'x_1_1': 'ac'}. Best is trial 63 with value: 0.5.
2024-12-06 23:37:29,444 - INFO - Candidate Mean Stats: {'Max': np.float64(3.18987380670721), 'Min': np.float64(-0.9112204835562207), 'Mean': np.float64(0.6340399483843633), 'Std': np.float64(0.5466802150012235)}
2024-12-06 23:37:29,445 - INFO - Candidate Std Stats: {'Max': np.float64(1.531897946340769), 'Min': np.float64(0.0), 'Mean': np.float64(0.5098479075707962), 'Std': np.float64(0.2609033298766444)}
[I 2024-12-06 23:37:29,459] Trial 239 finished with value: 1.0714285714285714 and parameters: {'x_0_0': 'ac', 'x_0_1': 'oo', 'x_1_0': 'cd', 'x_1_1': 'bd'}. Best is trial 23 with value: 0.5.
2024-12-06 23:37:29,623 - INFO - Candidate Mean Stats: {'Max': np.float64(2.9246461366522896), 'Min': np.float64(-0.840989513324887), 'Mean': np.float64(0.5540792336525895), 'Std': np.float64(0.5568896830382157)}
2024-12-06 23:37:29,623 - INFO - Candidate Std Stats: {'Max': np.float64(1.6544604384892718), 'Min': np.float64(0.0), 'Mean': np.float64(0.5820654871005738), 'Std': np.float64(0.3105626055605762)}
2024-12-06 23:37:29,636 - INFO - Candidate Mean Stats: {'Max': np.float64(2.932882375327873), 'Min': np.float64(-0.9890101654125389), 'Mean': np.float64(0.6038783038375422), 'Std': np.float64(0.5515462578544257)}
2024-12-06 23:37:29,636 - INFO - Candidate Std Stats: {'Max': np.float64(2.2501959640153406), 'Min': np.float64(0.0), 'Mean': np.float64(0.5720073140554391), 'Std': np.float64(0.32843948574267934)}
[I 2024-12-06 23:37:29,637] Trial 241 finished with value: 0.6428571428571428 and parameters: {'x_0_0': 'bd', 'x_0_1': 'oo', 'x_1_0': 'bc', 'x_1_1': 'ab'}. Best is trial 165 with value: 0.5.
[I 2024-12-06 23:37:29,649] Trial 241 finished with value: 1.4464285714285714 and parameters: {'x_0_0': 'ac', 'x_0_1': 'cd', 'x_1_0': 'cd', 'x_1_1': 'oo'}. Best is trial 76 with value: 0.5.
2024-12-06 23:37:29,651 - INFO - Candidate Mean Stats: {'Max': np.float64(2.8553200499575504), 'Min': np.float64(-0.645081214768159), 'Mean': np.float64(0.5848526595812792), 'Std': np.float64(0.49778710178345836)}
2024-12-06 23:37:29,651 - INFO - Candidate Std Stats: {'Max': np.float64(1.5630743020587112), 'Min': np.float64(0.0), 'Mean': np.float64(0.48865844765274585), 'Std': np.float64(0.28704691168553775)}
[I 2024-12-06 23:37:29,664] Trial 241 finished with value: 1.25 and parameters: {'x_0_0': 'cd', 'x_0_1': 'oo', 'x_1_0': 'oo', 'x_1_1': 'ac'}. Best is trial 63 with value: 0.5.
2024-12-06 23:37:29,817 - INFO - Candidate Mean Stats: {'Max': np.float64(3.015957678479415), 'Min': np.float64(-1.0034961706092744), 'Mean': np.float64(0.5683120895593738), 'Std': np.float64(0.5338198427673376)}
2024-12-06 23:37:29,817 - INFO - Candidate Std Stats: {'Max': np.float64(1.600468033304715), 'Min': np.float64(0.0), 'Mean': np.float64(0.5389919435080218), 'Std': np.float64(0.28523423258099584)}
