[I 2024-12-06 23:52:21,173] Trial 35 finished with value: 1.3666666666666667 and parameters: {'x_0_0': 'ad', 'x_0_1': 'ad', 'x_0_2': 'oo', 'x_1_0': 'oo', 'x_1_1': 'ab', 'x_1_2': 'bd'}. Best is trial 2 with value: 0.9666666666666667.
2024-12-06 23:52:21,873 - INFO - Candidate Mean Stats: {'Max': np.float64(2.0), 'Min': np.float64(0.2689338114052427), 'Mean': np.float64(0.4878981089200879), 'Std': np.float64(0.056929999595328136)}
2024-12-06 23:52:21,873 - INFO - Candidate Std Stats: {'Max': np.float64(0.4222060414807119), 'Min': np.float64(0.0), 'Mean': np.float64(0.09696188550791553), 'Std': np.float64(0.039767940949612286)}
[I 2024-12-06 23:52:21,919] Trial 35 finished with value: 1.2666666666666666 and parameters: {'x_0_0': 'ad', 'x_0_1': 'oo', 'x_0_2': 'ac', 'x_1_0': 'ac', 'x_1_1': 'ab', 'x_1_2': 'ad'}. Best is trial 7 with value: 1.077777777777778.
2024-12-06 23:52:27,207 - INFO - Candidate Mean Stats: {'Max': np.float64(1.9), 'Min': np.float64(0.27767752221660225), 'Mean': np.float64(0.4903515855265522), 'Std': np.float64(0.06019427147274003)}
2024-12-06 23:52:27,208 - INFO - Candidate Std Stats: {'Max': np.float64(1.568688303896639), 'Min': np.float64(0.0), 'Mean': np.float64(0.10624489874083992), 'Std': np.float64(0.05111491951770616)}
[I 2024-12-06 23:52:27,251] Trial 35 finished with value: 1.2222222222222223 and parameters: {'x_0_0': 'bc', 'x_0_1': 'ac', 'x_0_2': 'ac', 'x_1_0': 'bd', 'x_1_1': 'ad', 'x_1_2': 'ad'}. Best is trial 32 with value: 0.9444444444444444.
2024-12-06 23:52:40,351 - INFO - Candidate Mean Stats: {'Max': np.float64(2.0), 'Min': np.float64(0.24497249424755924), 'Mean': np.float64(0.48490486063775823), 'Std': np.float64(0.06638727940978757)}
2024-12-06 23:52:40,351 - INFO - Candidate Std Stats: {'Max': np.float64(1.635876130602935), 'Min': np.float64(0.0), 'Mean': np.float64(0.11430772889604895), 'Std': np.float64(0.060887347445325535)}
[I 2024-12-06 23:52:40,395] Trial 36 finished with value: 1.5555555555555556 and parameters: {'x_0_0': 'ad', 'x_0_1': 'ad', 'x_0_2': 'ab', 'x_1_0': 'ab', 'x_1_1': 'ab', 'x_1_2': 'ac'}. Best is trial 22 with value: 1.1666666666666665.
2024-12-06 23:52:41,573 - INFO - Candidate Mean Stats: {'Max': np.float64(2.0), 'Min': np.float64(0.2845022674178389), 'Mean': np.float64(0.47998020158875926), 'Std': np.float64(0.05855821296070897)}
2024-12-06 23:52:41,573 - INFO - Candidate Std Stats: {'Max': np.float64(0.4641098407319481), 'Min': np.float64(0.0), 'Mean': np.float64(0.10212857868881654), 'Std': np.float64(0.0435387015756023)}
[I 2024-12-06 23:52:41,618] Trial 36 finished with value: 1.7777777777777777 and parameters: {'x_0_0': 'ab', 'x_0_1': 'ab', 'x_0_2': 'bd', 'x_1_0': 'cd', 'x_1_1': 'cd', 'x_1_2': 'ad'}. Best is trial 2 with value: 0.9666666666666667.
2024-12-06 23:52:42,515 - INFO - Candidate Mean Stats: {'Max': np.float64(2.0), 'Min': np.float64(0.2880349601264807), 'Mean': np.float64(0.49237523514737724), 'Std': np.float64(0.061846859200137175)}
2024-12-06 23:52:42,516 - INFO - Candidate Std Stats: {'Max': np.float64(0.5151155709672053), 'Min': np.float64(0.0), 'Mean': np.float64(0.10363774133294151), 'Std': np.float64(0.04474521113591402)}
[I 2024-12-06 23:52:42,560] Trial 36 finished with value: 1.4666666666666666 and parameters: {'x_0_0': 'bd', 'x_0_1': 'bd', 'x_0_2': 'ab', 'x_1_0': 'oo', 'x_1_1': 'ab', 'x_1_2': 'cd'}. Best is trial 7 with value: 1.077777777777778.
2024-12-06 23:52:48,065 - INFO - Candidate Mean Stats: {'Max': np.float64(1.9), 'Min': np.float64(0.29273298330187913), 'Mean': np.float64(0.4864212530559872), 'Std': np.float64(0.062336458852086815)}
2024-12-06 23:52:48,066 - INFO - Candidate Std Stats: {'Max': np.float64(0.3695583987531056), 'Min': np.float64(0.0), 'Mean': np.float64(0.10040658788757112), 'Std': np.float64(0.04218230406386368)}
[I 2024-12-06 23:52:48,106] Trial 36 finished with value: 1.7777777777777777 and parameters: {'x_0_0': 'ab', 'x_0_1': 'bd', 'x_0_2': 'ac', 'x_1_0': 'bc', 'x_1_1': 'bc', 'x_1_2': 'ab'}. Best is trial 32 with value: 0.9444444444444444.
2024-12-06 23:53:01,123 - INFO - Candidate Mean Stats: {'Max': np.float64(2.0), 'Min': np.float64(0.24161587395377343), 'Mean': np.float64(0.4877212477351381), 'Std': np.float64(0.05981763958826742)}
2024-12-06 23:53:01,123 - INFO - Candidate Std Stats: {'Max': np.float64(0.4321083745773643), 'Min': np.float64(0.0), 'Mean': np.float64(0.09849972924373164), 'Std': np.float64(0.03960542106285856)}
[I 2024-12-06 23:53:01,171] Trial 37 finished with value: 1.2666666666666666 and parameters: {'x_0_0': 'ac', 'x_0_1': 'oo', 'x_0_2': 'cd', 'x_1_0': 'bd', 'x_1_1': 'ac', 'x_1_2': 'bd'}. Best is trial 22 with value: 1.1666666666666665.
2024-12-06 23:53:01,890 - INFO - Candidate Mean Stats: {'Max': np.float64(2.0), 'Min': np.float64(0.22359208167270417), 'Mean': np.float64(0.4835638765817375), 'Std': np.float64(0.06112260949261374)}
2024-12-06 23:53:01,890 - INFO - Candidate Std Stats: {'Max': np.float64(0.8899511331612181), 'Min': np.float64(0.0), 'Mean': np.float64(0.1104777189907982), 'Std': np.float64(0.051954055996552645)}
[I 2024-12-06 23:53:01,934] Trial 37 finished with value: 2.0 and parameters: {'x_0_0': 'cd', 'x_0_1': 'bc', 'x_0_2': 'cd', 'x_1_0': 'ac', 'x_1_1': 'ac', 'x_1_2': 'ab'}. Best is trial 2 with value: 0.9666666666666667.
2024-12-06 23:53:03,115 - INFO - Candidate Mean Stats: {'Max': np.float64(2.0), 'Min': np.float64(0.2891940084171355), 'Mean': np.float64(0.4935809156508509), 'Std': np.float64(0.059494893094928274)}
2024-12-06 23:53:03,115 - INFO - Candidate Std Stats: {'Max': np.float64(0.42079957445747784), 'Min': np.float64(0.0), 'Mean': np.float64(0.10461916513539438), 'Std': np.float64(0.04440383885140767)}
[I 2024-12-06 23:53:03,160] Trial 37 finished with value: 1.7777777777777777 and parameters: {'x_0_0': 'ab', 'x_0_1': 'ad', 'x_0_2': 'bc', 'x_1_0': 'bd', 'x_1_1': 'cd', 'x_1_2': 'bc'}. Best is trial 7 with value: 1.077777777777778.
2024-12-06 23:53:08,973 - INFO - Candidate Mean Stats: {'Max': np.float64(1.9), 'Min': np.float64(0.2920608964162892), 'Mean': np.float64(0.4825707311357641), 'Std': np.float64(0.055427499808760175)}
2024-12-06 23:53:08,973 - INFO - Candidate Std Stats: {'Max': np.float64(0.4295088168782905), 'Min': np.float64(0.0), 'Mean': np.float64(0.09778952445314282), 'Std': np.float64(0.03998972939885566)}
[I 2024-12-06 23:53:09,019] Trial 37 finished with value: 1.5555555555555556 and parameters: {'x_0_0': 'ad', 'x_0_1': 'bc', 'x_0_2': 'bd', 'x_1_0': 'ab', 'x_1_1': 'ad', 'x_1_2': 'ab'}. Best is trial 32 with value: 0.9444444444444444.
2024-12-06 23:53:22,150 - INFO - Candidate Mean Stats: {'Max': np.float64(2.0), 'Min': np.float64(0.27433022516598526), 'Mean': np.float64(0.48907034249105813), 'Std': np.float64(0.05785466517048636)}
2024-12-06 23:53:22,152 - INFO - Candidate Std Stats: {'Max': np.float64(0.38764610087302925), 'Min': np.float64(0.0), 'Mean': np.float64(0.09927583769154856), 'Std': np.float64(0.040151344804480814)}
[I 2024-12-06 23:53:22,199] Trial 38 finished with value: 1.5666666666666664 and parameters: {'x_0_0': 'ac', 'x_0_1': 'bd', 'x_0_2': 'oo', 'x_1_0': 'ad', 'x_1_1': 'ab', 'x_1_2': 'cd'}. Best is trial 22 with value: 1.1666666666666665.
2024-12-06 23:53:22,631 - INFO - Candidate Mean Stats: {'Max': np.float64(2.0), 'Min': np.float64(0.29335332932280284), 'Mean': np.float64(0.4955384112528067), 'Std': np.float64(0.06083704285873075)}
2024-12-06 23:53:22,631 - INFO - Candidate Std Stats: {'Max': np.float64(0.40776439564840233), 'Min': np.float64(0.0), 'Mean': np.float64(0.09683640897893811), 'Std': np.float64(0.04113376926191151)}
[I 2024-12-06 23:53:22,676] Trial 38 finished with value: 1.1777777777777778 and parameters: {'x_0_0': 'ab', 'x_0_1': 'oo', 'x_0_2': 'oo', 'x_1_0': 'ac', 'x_1_1': 'oo', 'x_1_2': 'bc'}. Best is trial 2 with value: 0.9666666666666667.
2024-12-06 23:53:23,675 - INFO - Candidate Mean Stats: {'Max': np.float64(2.0), 'Min': np.float64(0.23196969415822757), 'Mean': np.float64(0.4835614991188978), 'Std': np.float64(0.062192059188588375)}
2024-12-06 23:53:23,675 - INFO - Candidate Std Stats: {'Max': np.float64(0.44467338451940003), 'Min': np.float64(0.0), 'Mean': np.float64(0.11259997624377055), 'Std': np.float64(0.04738162477157096)}
[I 2024-12-06 23:53:23,720] Trial 38 finished with value: 1.3555555555555556 and parameters: {'x_0_0': 'ad', 'x_0_1': 'ad', 'x_0_2': 'cd', 'x_1_0': 'ab', 'x_1_1': 'oo', 'x_1_2': 'oo'}. Best is trial 7 with value: 1.077777777777778.
2024-12-06 23:53:29,917 - INFO - Candidate Mean Stats: {'Max': np.float64(1.9), 'Min': np.float64(0.29537493603328213), 'Mean': np.float64(0.5012492171650355), 'Std': np.float64(0.05708584483217573)}
2024-12-06 23:53:29,918 - INFO - Candidate Std Stats: {'Max': np.float64(0.3741431363200589), 'Min': np.float64(0.0), 'Mean': np.float64(0.1059923584579378), 'Std': np.float64(0.04202391225767237)}
[I 2024-12-06 23:53:29,962] Trial 38 finished with value: 1.3777777777777778 and parameters: {'x_0_0': 'ab', 'x_0_1': 'oo', 'x_0_2': 'bd', 'x_1_0': 'bc', 'x_1_1': 'ad', 'x_1_2': 'ad'}. Best is trial 32 with value: 0.9444444444444444.
2024-12-06 23:53:43,004 - INFO - Candidate Mean Stats: {'Max': np.float64(2.0), 'Min': np.float64(0.15623293419645368), 'Mean': np.float64(0.49548590770660067), 'Std': np.float64(0.06801518403638511)}
2024-12-06 23:53:43,005 - INFO - Candidate Std Stats: {'Max': np.float64(0.5086085506911633), 'Min': np.float64(0.0), 'Mean': np.float64(0.10427519616101977), 'Std': np.float64(0.047414948555344574)}
[I 2024-12-06 23:53:43,048] Trial 39 finished with value: 1.5666666666666664 and parameters: {'x_0_0': 'ad', 'x_0_1': 'ab', 'x_0_2': 'oo', 'x_1_0': 'ac', 'x_1_1': 'ad', 'x_1_2': 'ac'}. Best is trial 22 with value: 1.1666666666666665.
2024-12-06 23:53:43,411 - INFO - Candidate Mean Stats: {'Max': np.float64(2.0), 'Min': np.float64(0.2542280334608062), 'Mean': np.float64(0.4846143698878826), 'Std': np.float64(0.056705778369054195)}
2024-12-06 23:53:43,412 - INFO - Candidate Std Stats: {'Max': np.float64(0.39129522984565396), 'Min': np.float64(0.0), 'Mean': np.float64(0.09994892952063451), 'Std': np.float64(0.04179728414191065)}
[I 2024-12-06 23:53:43,457] Trial 39 finished with value: 1.2333333333333334 and parameters: {'x_0_0': 'bc', 'x_0_1': 'ac', 'x_0_2': 'ab', 'x_1_0': 'ac', 'x_1_1': 'bd', 'x_1_2': 'oo'}. Best is trial 2 with value: 0.9666666666666667.
2024-12-06 23:53:44,364 - INFO - Candidate Mean Stats: {'Max': np.float64(2.0), 'Min': np.float64(0.308951100585081), 'Mean': np.float64(0.49534697011518), 'Std': np.float64(0.05707827801904007)}
2024-12-06 23:53:44,365 - INFO - Candidate Std Stats: {'Max': np.float64(0.48753603860312356), 'Min': np.float64(0.0), 'Mean': np.float64(0.09827615619132943), 'Std': np.float64(0.04121654433578181)}
[I 2024-12-06 23:53:44,407] Trial 39 finished with value: 1.1666666666666665 and parameters: {'x_0_0': 'bc', 'x_0_1': 'oo', 'x_0_2': 'ad', 'x_1_0': 'ac', 'x_1_1': 'ac', 'x_1_2': 'oo'}. Best is trial 7 with value: 1.077777777777778.
2024-12-06 23:53:50,656 - INFO - Candidate Mean Stats: {'Max': np.float64(1.9), 'Min': np.float64(0.2889325799943699), 'Mean': np.float64(0.48653940336775087), 'Std': np.float64(0.059156011556768716)}
2024-12-06 23:53:50,657 - INFO - Candidate Std Stats: {'Max': np.float64(0.3737527935240913), 'Min': np.float64(0.0), 'Mean': np.float64(0.10504976029767357), 'Std': np.float64(0.04443491322178844)}
[I 2024-12-06 23:53:50,703] Trial 39 finished with value: 1.6666666666666665 and parameters: {'x_0_0': 'ad', 'x_0_1': 'bc', 'x_0_2': 'bc', 'x_1_0': 'cd', 'x_1_1': 'bc', 'x_1_2': 'cd'}. Best is trial 32 with value: 0.9444444444444444.
2024-12-06 23:54:03,358 - INFO - Candidate Mean Stats: {'Max': np.float64(2.0), 'Min': np.float64(0.2835275980642298), 'Mean': np.float64(0.49802735017304933), 'Std': np.float64(0.06276402296761434)}
2024-12-06 23:54:03,359 - INFO - Candidate Std Stats: {'Max': np.float64(1.3242722334964274), 'Min': np.float64(0.0), 'Mean': np.float64(0.11369607881438935), 'Std': np.float64(0.05661682701801616)}
[I 2024-12-06 23:54:03,403] Trial 40 finished with value: 2.0 and parameters: {'x_0_0': 'cd', 'x_0_1': 'bc', 'x_0_2': 'bc', 'x_1_0': 'ad', 'x_1_1': 'ad', 'x_1_2': 'ad'}. Best is trial 22 with value: 1.1666666666666665.
2024-12-06 23:54:03,759 - INFO - Candidate Mean Stats: {'Max': np.float64(2.0), 'Min': np.float64(0.2591405664665725), 'Mean': np.float64(0.4818033681691987), 'Std': np.float64(0.0574003072008079)}
2024-12-06 23:54:03,759 - INFO - Candidate Std Stats: {'Max': np.float64(0.5663423700259647), 'Min': np.float64(0.0), 'Mean': np.float64(0.10427633216550769), 'Std': np.float64(0.04491932467462592)}
[I 2024-12-06 23:54:03,803] Trial 40 finished with value: 1.6777777777777776 and parameters: {'x_0_0': 'ab', 'x_0_1': 'bd', 'x_0_2': 'oo', 'x_1_0': 'ad', 'x_1_1': 'ab', 'x_1_2': 'cd'}. Best is trial 2 with value: 0.9666666666666667.
2024-12-06 23:54:04,570 - INFO - Candidate Mean Stats: {'Max': np.float64(2.0), 'Min': np.float64(0.1947392780748914), 'Mean': np.float64(0.48843965072369994), 'Std': np.float64(0.061140426376920215)}
2024-12-06 23:54:04,571 - INFO - Candidate Std Stats: {'Max': np.float64(0.4787620584999758), 'Min': np.float64(0.0), 'Mean': np.float64(0.10145573044192115), 'Std': np.float64(0.04367613623590689)}
[I 2024-12-06 23:54:04,615] Trial 40 finished with value: 1.6 and parameters: {'x_0_0': 'oo', 'x_0_1': 'ac', 'x_0_2': 'ad', 'x_1_0': 'oo', 'x_1_1': 'ac', 'x_1_2': 'oo'}. Best is trial 7 with value: 1.077777777777778.
2024-12-06 23:54:11,098 - INFO - Candidate Mean Stats: {'Max': np.float64(1.9), 'Min': np.float64(0.29191655274387157), 'Mean': np.float64(0.4890581491260577), 'Std': np.float64(0.06277305516185504)}
2024-12-06 23:54:11,099 - INFO - Candidate Std Stats: {'Max': np.float64(0.44058504319809844), 'Min': np.float64(0.0), 'Mean': np.float64(0.10431485873911808), 'Std': np.float64(0.042295568863232755)}
[I 2024-12-06 23:54:11,143] Trial 40 finished with value: 1.5666666666666667 and parameters: {'x_0_0': 'ad', 'x_0_1': 'ab', 'x_0_2': 'ad', 'x_1_0': 'ad', 'x_1_1': 'oo', 'x_1_2': 'ad'}. Best is trial 32 with value: 0.9444444444444444.
2024-12-06 23:54:23,906 - INFO - Candidate Mean Stats: {'Max': np.float64(2.0), 'Min': np.float64(0.21007187509623382), 'Mean': np.float64(0.4871139868364408), 'Std': np.float64(0.07048646689160394)}
2024-12-06 23:54:23,908 - INFO - Candidate Std Stats: {'Max': np.float64(0.9409335561211886), 'Min': np.float64(0.0), 'Mean': np.float64(0.11982251146717328), 'Std': np.float64(0.05885775035329277)}
[I 2024-12-06 23:54:23,952] Trial 41 finished with value: 1.7777777777777777 and parameters: {'x_0_0': 'ab', 'x_0_1': 'bd', 'x_0_2': 'ad', 'x_1_0': 'bd', 'x_1_1': 'bd', 'x_1_2': 'ab'}. Best is trial 22 with value: 1.1666666666666665.
2024-12-06 23:54:24,433 - INFO - Candidate Mean Stats: {'Max': np.float64(2.0), 'Min': np.float64(0.2559529505571391), 'Mean': np.float64(0.48040479496654226), 'Std': np.float64(0.06863036250348123)}
2024-12-06 23:54:24,434 - INFO - Candidate Std Stats: {'Max': np.float64(1.621997379972305), 'Min': np.float64(0.0), 'Mean': np.float64(0.12443502609776778), 'Std': np.float64(0.06410973972859994)}
2024-12-06 23:54:24,451 - INFO - Candidate Mean Stats: {'Max': np.float64(2.0), 'Min': np.float64(0.23952454967825929), 'Mean': np.float64(0.48994350596402825), 'Std': np.float64(0.06437938195174374)}
2024-12-06 23:54:24,451 - INFO - Candidate Std Stats: {'Max': np.float64(0.46657625001516445), 'Min': np.float64(0.0), 'Mean': np.float64(0.10302260443182026), 'Std': np.float64(0.042591654757658116)}
[I 2024-12-06 23:54:24,476] Trial 41 finished with value: 1.5555555555555556 and parameters: {'x_0_0': 'ad', 'x_0_1': 'cd', 'x_0_2': 'cd', 'x_1_0': 'ab', 'x_1_1': 'bd', 'x_1_2': 'ac'}. Best is trial 7 with value: 1.077777777777778.
[I 2024-12-06 23:54:24,492] Trial 41 finished with value: 1.4555555555555557 and parameters: {'x_0_0': 'ad', 'x_0_1': 'bd', 'x_0_2': 'ac', 'x_1_0': 'ab', 'x_1_1': 'bc', 'x_1_2': 'oo'}. Best is trial 2 with value: 0.9666666666666667.
2024-12-06 23:54:31,919 - INFO - Candidate Mean Stats: {'Max': np.float64(1.9), 'Min': np.float64(0.2169552459284651), 'Mean': np.float64(0.4860056257186452), 'Std': np.float64(0.06434927900352214)}
2024-12-06 23:54:31,920 - INFO - Candidate Std Stats: {'Max': np.float64(0.39830381807238774), 'Min': np.float64(0.0), 'Mean': np.float64(0.10328723193814776), 'Std': np.float64(0.04185679349876698)}
[I 2024-12-06 23:54:31,962] Trial 41 finished with value: 1.6666666666666665 and parameters: {'x_0_0': 'ac', 'x_0_1': 'bc', 'x_0_2': 'ac', 'x_1_0': 'bc', 'x_1_1': 'ab', 'x_1_2': 'bd'}. Best is trial 32 with value: 0.9444444444444444.
2024-12-06 23:54:45,310 - INFO - Candidate Mean Stats: {'Max': np.float64(2.0), 'Min': np.float64(0.24567303905680804), 'Mean': np.float64(0.49157925315303447), 'Std': np.float64(0.060270028365344085)}
2024-12-06 23:54:45,311 - INFO - Candidate Std Stats: {'Max': np.float64(1.798561919877996), 'Min': np.float64(0.0), 'Mean': np.float64(0.10136715588177053), 'Std': np.float64(0.050191823948266004)}
[I 2024-12-06 23:54:45,367] Trial 42 finished with value: 1.4444444444444444 and parameters: {'x_0_0': 'bd', 'x_0_1': 'ad', 'x_0_2': 'ac', 'x_1_0': 'bc', 'x_1_1': 'bc', 'x_1_2': 'bd'}. Best is trial 22 with value: 1.1666666666666665.
2024-12-06 23:54:45,749 - INFO - Candidate Mean Stats: {'Max': np.float64(2.0), 'Min': np.float64(0.2943645293389903), 'Mean': np.float64(0.49568301350504), 'Std': np.float64(0.05810438000441623)}
2024-12-06 23:54:45,749 - INFO - Candidate Std Stats: {'Max': np.float64(0.7025522457746258), 'Min': np.float64(0.0), 'Mean': np.float64(0.10211484754815846), 'Std': np.float64(0.0434121948635613)}
[I 2024-12-06 23:54:45,794] Trial 42 finished with value: 1.6666666666666665 and parameters: {'x_0_0': 'ac', 'x_0_1': 'bd', 'x_0_2': 'ab', 'x_1_0': 'cd', 'x_1_1': 'bd', 'x_1_2': 'ac'}. Best is trial 2 with value: 0.9666666666666667.
2024-12-06 23:54:45,891 - INFO - Candidate Mean Stats: {'Max': np.float64(2.0), 'Min': np.float64(0.2535240710209744), 'Mean': np.float64(0.48181041017799625), 'Std': np.float64(0.07233546750640403)}
2024-12-06 23:54:45,892 - INFO - Candidate Std Stats: {'Max': np.float64(1.380009614781556), 'Min': np.float64(0.0), 'Mean': np.float64(0.12391991509868362), 'Std': np.float64(0.06845538759825931)}
[I 2024-12-06 23:54:45,934] Trial 42 finished with value: 1.9 and parameters: {'x_0_0': 'oo', 'x_0_1': 'ab', 'x_0_2': 'bc', 'x_1_0': 'ac', 'x_1_1': 'ab', 'x_1_2': 'ac'}. Best is trial 7 with value: 1.077777777777778.
2024-12-06 23:56:23,179 - INFO - Candidate Mean Stats: {'Max': np.float64(1.9), 'Min': np.float64(0.26697052332448523), 'Mean': np.float64(0.4838541322212873), 'Std': np.float64(0.056530704244476974)}
2024-12-06 23:56:23,179 - INFO - Candidate Std Stats: {'Max': np.float64(0.7419491063271983), 'Min': np.float64(0.0), 'Mean': np.float64(0.11054349430802814), 'Std': np.float64(0.04779191802649588)}
[I 2024-12-06 23:56:23,228] Trial 42 finished with value: 1.4444444444444444 and parameters: {'x_0_0': 'ac', 'x_0_1': 'ad', 'x_0_2': 'bd', 'x_1_0': 'ad', 'x_1_1': 'ac', 'x_1_2': 'bd'}. Best is trial 32 with value: 0.9444444444444444.
2024-12-06 23:56:32,900 - INFO - Candidate Mean Stats: {'Max': np.float64(2.0), 'Min': np.float64(0.2533437782072764), 'Mean': np.float64(0.49394833755993334), 'Std': np.float64(0.06204758996316284)}
2024-12-06 23:56:32,902 - INFO - Candidate Std Stats: {'Max': np.float64(0.3691929808762837), 'Min': np.float64(0.0), 'Mean': np.float64(0.10439032710500078), 'Std': np.float64(0.04182670000072552)}
[I 2024-12-06 23:56:32,941] Trial 43 finished with value: 2.0 and parameters: {'x_0_0': 'cd', 'x_0_1': 'ab', 'x_0_2': 'ab', 'x_1_0': 'cd', 'x_1_1': 'ab', 'x_1_2': 'ac'}. Best is trial 22 with value: 1.1666666666666665.
2024-12-06 23:56:33,322 - INFO - Candidate Mean Stats: {'Max': np.float64(2.0), 'Min': np.float64(0.2121089617630366), 'Mean': np.float64(0.48085921944284254), 'Std': np.float64(0.0669920736628238)}
2024-12-06 23:56:33,323 - INFO - Candidate Std Stats: {'Max': np.float64(0.8833741652856469), 'Min': np.float64(0.0), 'Mean': np.float64(0.12012493074616591), 'Std': np.float64(0.05428704801652042)}
[I 2024-12-06 23:56:33,370] Trial 43 finished with value: 2.0 and parameters: {'x_0_0': 'cd', 'x_0_1': 'cd', 'x_0_2': 'ab', 'x_1_0': 'bc', 'x_1_1': 'bd', 'x_1_2': 'bc'}. Best is trial 2 with value: 0.9666666666666667.
2024-12-06 23:56:33,547 - INFO - Candidate Mean Stats: {'Max': np.float64(2.0), 'Min': np.float64(0.22930248258307123), 'Mean': np.float64(0.491653314529796), 'Std': np.float64(0.0652172357876065)}
2024-12-06 23:56:33,548 - INFO - Candidate Std Stats: {'Max': np.float64(1.6637292035150697), 'Min': np.float64(0.0), 'Mean': np.float64(0.10802587283003255), 'Std': np.float64(0.04839663079184093)}
[I 2024-12-06 23:56:33,594] Trial 43 finished with value: 1.7777777777777777 and parameters: {'x_0_0': 'ab', 'x_0_1': 'ab', 'x_0_2': 'bd', 'x_1_0': 'ab', 'x_1_1': 'bd', 'x_1_2': 'bc'}. Best is trial 7 with value: 1.077777777777778.
2024-12-06 23:56:39,468 - INFO - Candidate Mean Stats: {'Max': np.float64(1.9), 'Min': np.float64(0.21751707543542026), 'Mean': np.float64(0.4719591237969354), 'Std': np.float64(0.05639824378608288)}
2024-12-06 23:56:39,470 - INFO - Candidate Std Stats: {'Max': np.float64(1.4752805910813906), 'Min': np.float64(0.0), 'Mean': np.float64(0.10243485080118654), 'Std': np.float64(0.04624029674708025)}
