[I 2024-12-06 23:36:05,339] Trial 7 finished with value: 1.5892857142857144 and parameters: {'x_0_0': 'ab', 'x_0_1': 'ad', 'x_1_0': 'bc', 'x_1_1': 'oo'}. Best is trial 2 with value: 1.125.
[I 2024-12-06 23:36:05,339] Trial 7 finished with value: 1.4464285714285714 and parameters: {'x_0_0': 'ad', 'x_0_1': 'ab', 'x_1_0': 'ac', 'x_1_1': 'oo'}. Best is trial 2 with value: 0.9285714285714286.
[I 2024-12-06 23:36:05,340] Trial 7 finished with value: 1.75 and parameters: {'x_0_0': 'cd', 'x_0_1': 'bd', 'x_1_0': 'oo', 'x_1_1': 'bd'}. Best is trial 3 with value: 0.9642857142857143.
[I 2024-12-06 23:36:05,347] Trial 7 finished with value: 0.6607142857142857 and parameters: {'x_0_0': 'bd', 'x_0_1': 'oo', 'x_1_0': 'bc', 'x_1_1': 'oo'}. Best is trial 7 with value: 0.6607142857142857.
2024-12-06 23:36:05,660 - INFO - Candidate Mean Stats: {'Max': np.float64(1.875), 'Min': np.float64(-1.3046341427269854), 'Mean': np.float64(0.14181784222803384), 'Std': np.float64(0.4224978164612928)}
2024-12-06 23:36:05,660 - INFO - Candidate Std Stats: {'Max': np.float64(1.766579441269969), 'Min': np.float64(0.0), 'Mean': np.float64(0.6975878849749307), 'Std': np.float64(0.2634273616099249)}
2024-12-06 23:36:05,663 - INFO - Candidate Mean Stats: {'Max': np.float64(2.0), 'Min': np.float64(-0.8665212093977605), 'Mean': np.float64(0.19526662853282226), 'Std': np.float64(0.34940604411528337)}
2024-12-06 23:36:05,663 - INFO - Candidate Std Stats: {'Max': np.float64(1.6114083278954747), 'Min': np.float64(0.0), 'Mean': np.float64(0.6115025433731497), 'Std': np.float64(0.23485846686690373)}
2024-12-06 23:36:05,664 - INFO - Candidate Mean Stats: {'Max': np.float64(1.875), 'Min': np.float64(-1.0033569883980527), 'Mean': np.float64(0.17330961221798052), 'Std': np.float64(0.3605342285952639)}
2024-12-06 23:36:05,664 - INFO - Candidate Std Stats: {'Max': np.float64(1.6103589914839775), 'Min': np.float64(0.0), 'Mean': np.float64(0.6458808632687209), 'Std': np.float64(0.24993473136899638)}
2024-12-06 23:36:05,675 - INFO - Candidate Mean Stats: {'Max': np.float64(1.75), 'Min': np.float64(-1.1507650412257784), 'Mean': np.float64(0.16573607005036672), 'Std': np.float64(0.3749530758174986)}
2024-12-06 23:36:05,675 - INFO - Candidate Std Stats: {'Max': np.float64(1.5741471196269492), 'Min': np.float64(0.0), 'Mean': np.float64(0.6273640627002176), 'Std': np.float64(0.2475195129316127)}
[I 2024-12-06 23:36:05,676] Trial 8 finished with value: 1.3214285714285714 and parameters: {'x_0_0': 'ad', 'x_0_1': 'ab', 'x_1_0': 'oo', 'x_1_1': 'cd'}. Best is trial 2 with value: 0.9285714285714286.
[I 2024-12-06 23:36:05,678] Trial 8 finished with value: 1.4285714285714286 and parameters: {'x_0_0': 'ad', 'x_0_1': 'bd', 'x_1_0': 'ab', 'x_1_1': 'cd'}. Best is trial 3 with value: 0.9642857142857143.
[I 2024-12-06 23:36:05,679] Trial 8 finished with value: 1.2857142857142856 and parameters: {'x_0_0': 'bc', 'x_0_1': 'ac', 'x_1_0': 'bd', 'x_1_1': 'ad'}. Best is trial 2 with value: 1.125.
[I 2024-12-06 23:36:05,688] Trial 8 finished with value: 1.5714285714285714 and parameters: {'x_0_0': 'bd', 'x_0_1': 'bd', 'x_1_0': 'ad', 'x_1_1': 'ad'}. Best is trial 7 with value: 0.6607142857142857.
2024-12-06 23:36:05,996 - INFO - Candidate Mean Stats: {'Max': np.float64(1.875), 'Min': np.float64(-0.9921418924527952), 'Mean': np.float64(0.15153801185321436), 'Std': np.float64(0.39514944728087426)}
2024-12-06 23:36:05,996 - INFO - Candidate Std Stats: {'Max': np.float64(1.6998672811925934), 'Min': np.float64(0.0), 'Mean': np.float64(0.639642891026383), 'Std': np.float64(0.2506066241916647)}
2024-12-06 23:36:05,998 - INFO - Candidate Mean Stats: {'Max': np.float64(2.0), 'Min': np.float64(-0.8992853991108394), 'Mean': np.float64(0.18915021445441446), 'Std': np.float64(0.3765741711106464)}
2024-12-06 23:36:05,998 - INFO - Candidate Std Stats: {'Max': np.float64(1.4916926311810785), 'Min': np.float64(0.0), 'Mean': np.float64(0.5579868052735265), 'Std': np.float64(0.21607236524889914)}
2024-12-06 23:36:06,000 - INFO - Candidate Mean Stats: {'Max': np.float64(1.875), 'Min': np.float64(-0.9665116784335887), 'Mean': np.float64(0.13004847156677465), 'Std': np.float64(0.3310251503864922)}
2024-12-06 23:36:06,000 - INFO - Candidate Std Stats: {'Max': np.float64(1.914091135405675), 'Min': np.float64(0.0), 'Mean': np.float64(0.6331713422637144), 'Std': np.float64(0.2523040542757329)}
2024-12-06 23:36:06,010 - INFO - Candidate Mean Stats: {'Max': np.float64(1.75), 'Min': np.float64(-1.0640361079486536), 'Mean': np.float64(0.1324083679214758), 'Std': np.float64(0.40504910620029627)}
2024-12-06 23:36:06,010 - INFO - Candidate Std Stats: {'Max': np.float64(1.7436611436584406), 'Min': np.float64(0.0), 'Mean': np.float64(0.7132909280437784), 'Std': np.float64(0.27553382535831966)}
[I 2024-12-06 23:36:06,010] Trial 9 finished with value: 0.9107142857142857 and parameters: {'x_0_0': 'ac', 'x_0_1': 'ac', 'x_1_0': 'oo', 'x_1_1': 'oo'}. Best is trial 9 with value: 0.9107142857142857.
[I 2024-12-06 23:36:06,013] Trial 9 finished with value: 1.1964285714285714 and parameters: {'x_0_0': 'ad', 'x_0_1': 'ac', 'x_1_0': 'oo', 'x_1_1': 'oo'}. Best is trial 3 with value: 0.9642857142857143.
[I 2024-12-06 23:36:06,014] Trial 9 finished with value: 1.0714285714285714 and parameters: {'x_0_0': 'ad', 'x_0_1': 'oo', 'x_1_0': 'cd', 'x_1_1': 'ad'}. Best is trial 9 with value: 1.0714285714285714.
[I 2024-12-06 23:36:06,021] Trial 9 finished with value: 1.375 and parameters: {'x_0_0': 'oo', 'x_0_1': 'oo', 'x_1_0': 'bd', 'x_1_1': 'ab'}. Best is trial 7 with value: 0.6607142857142857.
2024-12-06 23:36:06,334 - INFO - Candidate Mean Stats: {'Max': np.float64(1.875), 'Min': np.float64(-1.1646376735655044), 'Mean': np.float64(0.098675587749035), 'Std': np.float64(0.40585016637346844)}
2024-12-06 23:36:06,334 - INFO - Candidate Std Stats: {'Max': np.float64(2.0892316582985506), 'Min': np.float64(0.0), 'Mean': np.float64(0.7471201094537147), 'Std': np.float64(0.30735641177944906)}
2024-12-06 23:36:06,345 - INFO - Candidate Mean Stats: {'Max': np.float64(1.875), 'Min': np.float64(-0.929485589598589), 'Mean': np.float64(0.20150405825780643), 'Std': np.float64(0.3655058106081826)}
2024-12-06 23:36:06,345 - INFO - Candidate Std Stats: {'Max': np.float64(1.7325879959727881), 'Min': np.float64(0.0), 'Mean': np.float64(0.6613990040920913), 'Std': np.float64(0.25890574374098896)}
2024-12-06 23:36:06,346 - INFO - Candidate Mean Stats: {'Max': np.float64(2.0), 'Min': np.float64(-0.8535969082198329), 'Mean': np.float64(0.19311313310530356), 'Std': np.float64(0.3289612591446113)}
2024-12-06 23:36:06,346 - INFO - Candidate Std Stats: {'Max': np.float64(1.677290235803443), 'Min': np.float64(0.0), 'Mean': np.float64(0.629910406418429), 'Std': np.float64(0.26887100869899905)}
[I 2024-12-06 23:36:06,354] Trial 10 finished with value: 2.0 and parameters: {'x_0_0': 'cd', 'x_0_1': 'bc', 'x_1_0': 'ad', 'x_1_1': 'ab'}. Best is trial 9 with value: 0.9107142857142857.
2024-12-06 23:36:06,355 - INFO - Candidate Mean Stats: {'Max': np.float64(1.75), 'Min': np.float64(-0.8120372689879523), 'Mean': np.float64(0.2377084892606337), 'Std': np.float64(0.3098020233250662)}
2024-12-06 23:36:06,355 - INFO - Candidate Std Stats: {'Max': np.float64(1.5052907818302288), 'Min': np.float64(0.0), 'Mean': np.float64(0.5786859395763307), 'Std': np.float64(0.23244004750603134)}
[I 2024-12-06 23:36:06,364] Trial 10 finished with value: 1.7142857142857144 and parameters: {'x_0_0': 'ab', 'x_0_1': 'bd', 'x_1_0': 'ac', 'x_1_1': 'ac'}. Best is trial 3 with value: 0.9642857142857143.
[I 2024-12-06 23:36:06,365] Trial 10 finished with value: 1.2857142857142856 and parameters: {'x_0_0': 'bd', 'x_0_1': 'cd', 'x_1_0': 'bd', 'x_1_1': 'bc'}. Best is trial 9 with value: 1.0714285714285714.
[I 2024-12-06 23:36:06,372] Trial 10 finished with value: 1.7142857142857144 and parameters: {'x_0_0': 'ab', 'x_0_1': 'ad', 'x_1_0': 'bc', 'x_1_1': 'bd'}. Best is trial 7 with value: 0.6607142857142857.
2024-12-06 23:36:06,699 - INFO - Candidate Mean Stats: {'Max': np.float64(2.0), 'Min': np.float64(-0.9631568365384332), 'Mean': np.float64(0.20138145057603027), 'Std': np.float64(0.36157961921700565)}
2024-12-06 23:36:06,700 - INFO - Candidate Std Stats: {'Max': np.float64(1.6639920382945934), 'Min': np.float64(0.0), 'Mean': np.float64(0.6400246391168612), 'Std': np.float64(0.2642581403382339)}
2024-12-06 23:36:06,708 - INFO - Candidate Mean Stats: {'Max': np.float64(1.875), 'Min': np.float64(-1.1519377031659892), 'Mean': np.float64(0.1870950300486981), 'Std': np.float64(0.3477995620970152)}
2024-12-06 23:36:06,708 - INFO - Candidate Std Stats: {'Max': np.float64(1.4922138219608898), 'Min': np.float64(0.0), 'Mean': np.float64(0.6363251793551697), 'Std': np.float64(0.23928230135541356)}
2024-12-06 23:36:06,711 - INFO - Candidate Mean Stats: {'Max': np.float64(2.0), 'Min': np.float64(-1.1774630266732689), 'Mean': np.float64(0.2015654941094274), 'Std': np.float64(0.3867279692277426)}
2024-12-06 23:36:06,711 - INFO - Candidate Std Stats: {'Max': np.float64(1.7027674576494622), 'Min': np.float64(0.0), 'Mean': np.float64(0.624915646782741), 'Std': np.float64(0.25124467384799526)}
[I 2024-12-06 23:36:06,714] Trial 11 finished with value: 1.2142857142857144 and parameters: {'x_0_0': 'ab', 'x_0_1': 'oo', 'x_1_0': 'cd', 'x_1_1': 'ab'}. Best is trial 9 with value: 0.9107142857142857.
2024-12-06 23:36:06,722 - INFO - Candidate Mean Stats: {'Max': np.float64(1.75), 'Min': np.float64(-0.8428688770829422), 'Mean': np.float64(0.16740127327671303), 'Std': np.float64(0.351111023403781)}
2024-12-06 23:36:06,722 - INFO - Candidate Std Stats: {'Max': np.float64(1.6991675886880826), 'Min': np.float64(0.0), 'Mean': np.float64(0.6564407782223448), 'Std': np.float64(0.2513766634266015)}
[I 2024-12-06 23:36:06,723] Trial 11 finished with value: 1.5714285714285714 and parameters: {'x_0_0': 'bc', 'x_0_1': 'bd', 'x_1_0': 'ab', 'x_1_1': 'bc'}. Best is trial 9 with value: 1.0714285714285714.
[I 2024-12-06 23:36:06,725] Trial 11 finished with value: 0.7857142857142857 and parameters: {'x_0_0': 'bd', 'x_0_1': 'oo', 'x_1_0': 'bd', 'x_1_1': 'ac'}. Best is trial 11 with value: 0.7857142857142857.
[I 2024-12-06 23:36:06,734] Trial 11 finished with value: 1.5714285714285714 and parameters: {'x_0_0': 'ac', 'x_0_1': 'cd', 'x_1_0': 'bd', 'x_1_1': 'cd'}. Best is trial 7 with value: 0.6607142857142857.
2024-12-06 23:36:07,039 - INFO - Candidate Mean Stats: {'Max': np.float64(2.0), 'Min': np.float64(-1.379170335184628), 'Mean': np.float64(0.09292378628442681), 'Std': np.float64(0.4498774187925658)}
2024-12-06 23:36:07,039 - INFO - Candidate Std Stats: {'Max': np.float64(1.717740710830605), 'Min': np.float64(0.0), 'Mean': np.float64(0.6497644902267606), 'Std': np.float64(0.25493545731930417)}
2024-12-06 23:36:07,047 - INFO - Candidate Mean Stats: {'Max': np.float64(1.875), 'Min': np.float64(-0.7475922064921532), 'Mean': np.float64(0.18995071425873655), 'Std': np.float64(0.3569828712693366)}
2024-12-06 23:36:07,047 - INFO - Candidate Std Stats: {'Max': np.float64(1.5257526769676302), 'Min': np.float64(0.0), 'Mean': np.float64(0.6080890605874615), 'Std': np.float64(0.24605797792575468)}
2024-12-06 23:36:07,051 - INFO - Candidate Mean Stats: {'Max': np.float64(2.0), 'Min': np.float64(-0.8262181699909347), 'Mean': np.float64(0.20406566274159862), 'Std': np.float64(0.3024673590194986)}
2024-12-06 23:36:07,051 - INFO - Candidate Std Stats: {'Max': np.float64(1.454938333806359), 'Min': np.float64(0.0), 'Mean': np.float64(0.5863353049690939), 'Std': np.float64(0.22838232550401277)}
[I 2024-12-06 23:36:07,052] Trial 12 finished with value: 1.2857142857142856 and parameters: {'x_0_0': 'ac', 'x_0_1': 'ac', 'x_1_0': 'cd', 'x_1_1': 'ac'}. Best is trial 9 with value: 0.9107142857142857.
[I 2024-12-06 23:36:07,061] Trial 12 finished with value: 1.4285714285714286 and parameters: {'x_0_0': 'ad', 'x_0_1': 'bd', 'x_1_0': 'ab', 'x_1_1': 'bd'}. Best is trial 9 with value: 1.0714285714285714.
[I 2024-12-06 23:36:07,067] Trial 12 finished with value: 1.2857142857142856 and parameters: {'x_0_0': 'ac', 'x_0_1': 'ac', 'x_1_0': 'bc', 'x_1_1': 'ad'}. Best is trial 11 with value: 0.7857142857142857.
2024-12-06 23:36:07,068 - INFO - Candidate Mean Stats: {'Max': np.float64(1.75), 'Min': np.float64(-1.0271362886495696), 'Mean': np.float64(0.19974564995092126), 'Std': np.float64(0.3384182226423446)}
2024-12-06 23:36:07,068 - INFO - Candidate Std Stats: {'Max': np.float64(1.7709199570725687), 'Min': np.float64(0.0), 'Mean': np.float64(0.6731198612026795), 'Std': np.float64(0.2634888700506712)}
[I 2024-12-06 23:36:07,080] Trial 12 finished with value: 1.875 and parameters: {'x_0_0': 'oo', 'x_0_1': 'cd', 'x_1_0': 'ac', 'x_1_1': 'cd'}. Best is trial 7 with value: 0.6607142857142857.
2024-12-06 23:36:07,380 - INFO - Candidate Mean Stats: {'Max': np.float64(2.0), 'Min': np.float64(-0.6570043383922559), 'Mean': np.float64(0.3118048496673787), 'Std': np.float64(0.31616264927005366)}
2024-12-06 23:36:07,380 - INFO - Candidate Std Stats: {'Max': np.float64(1.4727858898027106), 'Min': np.float64(0.0), 'Mean': np.float64(0.5898583394815021), 'Std': np.float64(0.23394416503722126)}
[I 2024-12-06 23:36:07,393] Trial 13 finished with value: 1.875 and parameters: {'x_0_0': 'oo', 'x_0_1': 'ac', 'x_1_0': 'ab', 'x_1_1': 'ab'}. Best is trial 9 with value: 0.9107142857142857.
2024-12-06 23:36:07,393 - INFO - Candidate Mean Stats: {'Max': np.float64(2.0), 'Min': np.float64(-0.8441420575844709), 'Mean': np.float64(0.1608795951577062), 'Std': np.float64(0.36507797258527214)}
2024-12-06 23:36:07,393 - INFO - Candidate Std Stats: {'Max': np.float64(1.762579687564481), 'Min': np.float64(0.0), 'Mean': np.float64(0.5826166778833954), 'Std': np.float64(0.2448813681941704)}
2024-12-06 23:36:07,394 - INFO - Candidate Mean Stats: {'Max': np.float64(1.875), 'Min': np.float64(-1.0880071111457255), 'Mean': np.float64(0.1497605146364086), 'Std': np.float64(0.4247743430946055)}
2024-12-06 23:36:07,394 - INFO - Candidate Std Stats: {'Max': np.float64(1.8629353907882886), 'Min': np.float64(0.0), 'Mean': np.float64(0.7104168072948204), 'Std': np.float64(0.2842335230934356)}
[I 2024-12-06 23:36:07,409] Trial 13 finished with value: 1.5714285714285714 and parameters: {'x_0_0': 'ac', 'x_0_1': 'bd', 'x_1_0': 'ad', 'x_1_1': 'bc'}. Best is trial 11 with value: 0.7857142857142857.
[I 2024-12-06 23:36:07,409] Trial 13 finished with value: 1.0714285714285714 and parameters: {'x_0_0': 'ac', 'x_0_1': 'oo', 'x_1_0': 'ad', 'x_1_1': 'ab'}. Best is trial 9 with value: 1.0714285714285714.
2024-12-06 23:36:07,422 - INFO - Candidate Mean Stats: {'Max': np.float64(1.875), 'Min': np.float64(-0.9449458968574378), 'Mean': np.float64(0.1879735167285014), 'Std': np.float64(0.387820242696619)}
2024-12-06 23:36:07,422 - INFO - Candidate Std Stats: {'Max': np.float64(1.53494030890586), 'Min': np.float64(0.0), 'Mean': np.float64(0.6202782317093509), 'Std': np.float64(0.2418209620344716)}
[I 2024-12-06 23:36:07,435] Trial 13 finished with value: 1.5714285714285714 and parameters: {'x_0_0': 'ad', 'x_0_1': 'cd', 'x_1_0': 'cd', 'x_1_1': 'bd'}. Best is trial 7 with value: 0.6607142857142857.
2024-12-06 23:36:07,828 - INFO - Candidate Mean Stats: {'Max': np.float64(2.0), 'Min': np.float64(-0.9945467629879378), 'Mean': np.float64(0.1740264996372213), 'Std': np.float64(0.37263581787830286)}
2024-12-06 23:36:07,828 - INFO - Candidate Std Stats: {'Max': np.float64(1.7566188151646696), 'Min': np.float64(0.0), 'Mean': np.float64(0.6476670160893983), 'Std': np.float64(0.26567071753266325)}
2024-12-06 23:36:07,831 - INFO - Candidate Mean Stats: {'Max': np.float64(1.875), 'Min': np.float64(-0.9361297714770347), 'Mean': np.float64(0.14470134688027902), 'Std': np.float64(0.3483418654220951)}
2024-12-06 23:36:07,831 - INFO - Candidate Std Stats: {'Max': np.float64(1.7660100214664027), 'Min': np.float64(0.0), 'Mean': np.float64(0.645030423816296), 'Std': np.float64(0.25278322112748985)}
2024-12-06 23:36:07,831 - INFO - Candidate Mean Stats: {'Max': np.float64(2.0), 'Min': np.float64(-0.9715883315523499), 'Mean': np.float64(0.16257854860285623), 'Std': np.float64(0.3762431066870526)}
2024-12-06 23:36:07,832 - INFO - Candidate Std Stats: {'Max': np.float64(1.6157316878424102), 'Min': np.float64(0.0), 'Mean': np.float64(0.6242021980955724), 'Std': np.float64(0.24961864003888193)}
[I 2024-12-06 23:36:07,845] Trial 14 finished with value: 0.6428571428571428 and parameters: {'x_0_0': 'bd', 'x_0_1': 'oo', 'x_1_0': 'bc', 'x_1_1': 'ab'}. Best is trial 14 with value: 0.6428571428571428.
[I 2024-12-06 23:36:07,849] Trial 14 finished with value: 1.1607142857142856 and parameters: {'x_0_0': 'bc', 'x_0_1': 'ac', 'x_1_0': 'bc', 'x_1_1': 'oo'}. Best is trial 11 with value: 0.7857142857142857.
[I 2024-12-06 23:36:07,849] Trial 14 finished with value: 1.7142857142857144 and parameters: {'x_0_0': 'ab', 'x_0_1': 'bd', 'x_1_0': 'ab', 'x_1_1': 'ad'}. Best is trial 9 with value: 1.0714285714285714.
2024-12-06 23:36:07,867 - INFO - Candidate Mean Stats: {'Max': np.float64(1.875), 'Min': np.float64(-0.6783592186992273), 'Mean': np.float64(0.2394422385920033), 'Std': np.float64(0.3273870665540248)}
2024-12-06 23:36:07,867 - INFO - Candidate Std Stats: {'Max': np.float64(1.384804748473781), 'Min': np.float64(0.0), 'Mean': np.float64(0.5487132781723171), 'Std': np.float64(0.21675234856330944)}
[I 2024-12-06 23:36:07,880] Trial 14 finished with value: 1.875 and parameters: {'x_0_0': 'cd', 'x_0_1': 'cd', 'x_1_0': 'ac', 'x_1_1': 'oo'}. Best is trial 7 with value: 0.6607142857142857.
2024-12-06 23:36:08,131 - INFO - Candidate Mean Stats: {'Max': np.float64(2.0), 'Min': np.float64(-0.9469955454827691), 'Mean': np.float64(0.20174965151675242), 'Std': np.float64(0.3267331391555729)}
2024-12-06 23:36:08,131 - INFO - Candidate Std Stats: {'Max': np.float64(1.2702370196061412), 'Min': np.float64(0.0), 'Mean': np.float64(0.5657252071368335), 'Std': np.float64(0.215194713534385)}
[I 2024-12-06 23:36:08,147] Trial 15 finished with value: 0.8214285714285714 and parameters: {'x_0_0': 'bc', 'x_0_1': 'oo', 'x_1_0': 'oo', 'x_1_1': 'bc'}. Best is trial 14 with value: 0.6428571428571428.
2024-12-06 23:36:08,192 - INFO - Candidate Mean Stats: {'Max': np.float64(2.0), 'Min': np.float64(-0.8817022162455604), 'Mean': np.float64(0.1727342324837343), 'Std': np.float64(0.40851204407472136)}
2024-12-06 23:36:08,194 - INFO - Candidate Std Stats: {'Max': np.float64(1.6911329413099865), 'Min': np.float64(0.0), 'Mean': np.float64(0.6510169415186179), 'Std': np.float64(0.25768898628101056)}
2024-12-06 23:36:08,217 - INFO - Candidate Mean Stats: {'Max': np.float64(1.875), 'Min': np.float64(-1.0086706323192527), 'Mean': np.float64(0.22650447392354608), 'Std': np.float64(0.3647622094324132)}
2024-12-06 23:36:08,218 - INFO - Candidate Std Stats: {'Max': np.float64(1.4323458047854678), 'Min': np.float64(0.0), 'Mean': np.float64(0.6181936538750016), 'Std': np.float64(0.2378437763305627)}
[I 2024-12-06 23:36:08,234] Trial 15 finished with value: 1.1964285714285714 and parameters: {'x_0_0': 'bd', 'x_0_1': 'bd', 'x_1_0': 'oo', 'x_1_1': 'oo'}. Best is trial 11 with value: 0.7857142857142857.
[I 2024-12-06 23:36:08,260] Trial 15 finished with value: 0.7857142857142857 and parameters: {'x_0_0': 'ad', 'x_0_1': 'oo', 'x_1_0': 'bd', 'x_1_1': 'ad'}. Best is trial 15 with value: 0.7857142857142857.
2024-12-06 23:36:08,281 - INFO - Candidate Mean Stats: {'Max': np.float64(1.875), 'Min': np.float64(-1.0333181005376777), 'Mean': np.float64(0.1612527925811666), 'Std': np.float64(0.40069066526194386)}
2024-12-06 23:36:08,281 - INFO - Candidate Std Stats: {'Max': np.float64(1.8256652961638942), 'Min': np.float64(0.0), 'Mean': np.float64(0.696941757942043), 'Std': np.float64(0.2663294343973078)}
[I 2024-12-06 23:36:08,343] Trial 15 finished with value: 1.2857142857142856 and parameters: {'x_0_0': 'bc', 'x_0_1': 'ad', 'x_1_0': 'bd', 'x_1_1': 'ac'}. Best is trial 7 with value: 0.6607142857142857.
2024-12-06 23:36:08,593 - INFO - Candidate Mean Stats: {'Max': np.float64(2.0), 'Min': np.float64(-0.9399893752993395), 'Mean': np.float64(0.1894864154398482), 'Std': np.float64(0.38641814832316246)}
2024-12-06 23:36:08,593 - INFO - Candidate Std Stats: {'Max': np.float64(1.713775490635561), 'Min': np.float64(0.0), 'Mean': np.float64(0.6278978900297228), 'Std': np.float64(0.2519675938618648)}
[I 2024-12-06 23:36:08,607] Trial 16 finished with value: 0.6607142857142857 and parameters: {'x_0_0': 'bd', 'x_0_1': 'oo', 'x_1_0': 'bc', 'x_1_1': 'oo'}. Best is trial 14 with value: 0.6428571428571428.
2024-12-06 23:36:08,644 - INFO - Candidate Mean Stats: {'Max': np.float64(2.0), 'Min': np.float64(-1.098832295372834), 'Mean': np.float64(0.2737319736914006), 'Std': np.float64(0.3674181870905799)}
2024-12-06 23:36:08,644 - INFO - Candidate Std Stats: {'Max': np.float64(1.7379212216967392), 'Min': np.float64(0.0), 'Mean': np.float64(0.5916995551132765), 'Std': np.float64(0.24040234546717978)}
2024-12-06 23:36:08,654 - INFO - Candidate Mean Stats: {'Max': np.float64(1.875), 'Min': np.float64(-0.9158854177450252), 'Mean': np.float64(0.18926917436788215), 'Std': np.float64(0.3762022351469142)}
2024-12-06 23:36:08,654 - INFO - Candidate Std Stats: {'Max': np.float64(1.7810834340232413), 'Min': np.float64(0.0), 'Mean': np.float64(0.6368494387593915), 'Std': np.float64(0.257463545137375)}
[I 2024-12-06 23:36:08,662] Trial 16 finished with value: 1.1785714285714286 and parameters: {'x_0_0': 'ac', 'x_0_1': 'ab', 'x_1_0': 'oo', 'x_1_1': 'ad'}. Best is trial 11 with value: 0.7857142857142857.
