[I 2024-12-06 23:38:10,799] Trial 348 finished with value: 0.9642857142857143 and parameters: {'x_0_0': 'ab', 'x_0_1': 'oo', 'x_1_0': 'oo', 'x_1_1': 'ab'}. Best is trial 23 with value: 0.5.
2024-12-06 23:38:10,836 - INFO - Candidate Mean Stats: {'Max': np.float64(3.646839972161345), 'Min': np.float64(-0.852291528355746), 'Mean': np.float64(0.6630171765880314), 'Std': np.float64(0.6132578583435899)}
2024-12-06 23:38:10,836 - INFO - Candidate Std Stats: {'Max': np.float64(1.5380002341632344), 'Min': np.float64(0.0), 'Mean': np.float64(0.5471696222190552), 'Std': np.float64(0.32337422381288133)}
2024-12-06 23:38:10,845 - INFO - Candidate Mean Stats: {'Max': np.float64(3.0408077842304655), 'Min': np.float64(-0.6683292079068732), 'Mean': np.float64(0.7531059686769327), 'Std': np.float64(0.5080557335228548)}
2024-12-06 23:38:10,845 - INFO - Candidate Std Stats: {'Max': np.float64(1.7934784202866154), 'Min': np.float64(0.0), 'Mean': np.float64(0.5187980271671577), 'Std': np.float64(0.32548028566977794)}
[I 2024-12-06 23:38:10,850] Trial 350 finished with value: 1.2142857142857144 and parameters: {'x_0_0': 'ab', 'x_0_1': 'oo', 'x_1_0': 'cd', 'x_1_1': 'ad'}. Best is trial 76 with value: 0.5.
[I 2024-12-06 23:38:10,860] Trial 350 finished with value: 1.2142857142857144 and parameters: {'x_0_0': 'ab', 'x_0_1': 'oo', 'x_1_0': 'bd', 'x_1_1': 'cd'}. Best is trial 165 with value: 0.5.
2024-12-06 23:38:10,860 - INFO - Candidate Mean Stats: {'Max': np.float64(2.7339512259215017), 'Min': np.float64(-0.6961771777698943), 'Mean': np.float64(0.7312420482924533), 'Std': np.float64(0.46252715809357975)}
2024-12-06 23:38:10,860 - INFO - Candidate Std Stats: {'Max': np.float64(1.8566627707909997), 'Min': np.float64(0.0), 'Mean': np.float64(0.5114211558819044), 'Std': np.float64(0.30757179464423484)}
[I 2024-12-06 23:38:10,874] Trial 350 finished with value: 0.9285714285714286 and parameters: {'x_0_0': 'bd', 'x_0_1': 'oo', 'x_1_0': 'ab', 'x_1_1': 'bc'}. Best is trial 63 with value: 0.5.
2024-12-06 23:38:11,168 - INFO - Candidate Mean Stats: {'Max': np.float64(2.9230027916487433), 'Min': np.float64(-1.1099967454031183), 'Mean': np.float64(0.6765503863182109), 'Std': np.float64(0.573905277041811)}
2024-12-06 23:38:11,168 - INFO - Candidate Std Stats: {'Max': np.float64(1.8607484415619375), 'Min': np.float64(0.0), 'Mean': np.float64(0.5667532680037457), 'Std': np.float64(0.32873086448306177)}
[I 2024-12-06 23:38:11,182] Trial 349 finished with value: 1.3214285714285714 and parameters: {'x_0_0': 'ac', 'x_0_1': 'bd', 'x_1_0': 'oo', 'x_1_1': 'ab'}. Best is trial 23 with value: 0.5.
2024-12-06 23:38:11,187 - INFO - Candidate Mean Stats: {'Max': np.float64(3.230986886819447), 'Min': np.float64(-0.8807441523418917), 'Mean': np.float64(0.64848826053521), 'Std': np.float64(0.5852110539674185)}
2024-12-06 23:38:11,187 - INFO - Candidate Std Stats: {'Max': np.float64(1.824891277085967), 'Min': np.float64(0.0), 'Mean': np.float64(0.5309617175750319), 'Std': np.float64(0.32569871444455867)}
[I 2024-12-06 23:38:11,200] Trial 351 finished with value: 1.3214285714285714 and parameters: {'x_0_0': 'bd', 'x_0_1': 'ad', 'x_1_0': 'oo', 'x_1_1': 'bd'}. Best is trial 76 with value: 0.5.
2024-12-06 23:38:11,228 - INFO - Candidate Mean Stats: {'Max': np.float64(3.312336249866641), 'Min': np.float64(-0.8750302681113287), 'Mean': np.float64(0.7317939657002858), 'Std': np.float64(0.5515979220464489)}
2024-12-06 23:38:11,228 - INFO - Candidate Std Stats: {'Max': np.float64(1.722418350680734), 'Min': np.float64(0.0), 'Mean': np.float64(0.5079711327593844), 'Std': np.float64(0.30115033059086493)}
[I 2024-12-06 23:38:11,242] Trial 351 finished with value: 1.2142857142857144 and parameters: {'x_0_0': 'ab', 'x_0_1': 'oo', 'x_1_0': 'bc', 'x_1_1': 'bd'}. Best is trial 165 with value: 0.5.
2024-12-06 23:38:11,242 - INFO - Candidate Mean Stats: {'Max': np.float64(3.2250990334100917), 'Min': np.float64(-0.6905062135378592), 'Mean': np.float64(0.7268830071061787), 'Std': np.float64(0.4896655351080637)}
2024-12-06 23:38:11,243 - INFO - Candidate Std Stats: {'Max': np.float64(1.7662498952565924), 'Min': np.float64(0.0), 'Mean': np.float64(0.48570364382577846), 'Std': np.float64(0.30522380296828444)}
[I 2024-12-06 23:38:11,256] Trial 351 finished with value: 1.0714285714285714 and parameters: {'x_0_0': 'ac', 'x_0_1': 'oo', 'x_1_0': 'ab', 'x_1_1': 'ab'}. Best is trial 63 with value: 0.5.
2024-12-06 23:38:11,552 - INFO - Candidate Mean Stats: {'Max': np.float64(2.940145475478917), 'Min': np.float64(-1.0162085656569793), 'Mean': np.float64(0.7271371792919996), 'Std': np.float64(0.5628444628113789)}
2024-12-06 23:38:11,553 - INFO - Candidate Std Stats: {'Max': np.float64(1.4979119645136276), 'Min': np.float64(0.0), 'Mean': np.float64(0.5042095674163044), 'Std': np.float64(0.3041093309773896)}
[I 2024-12-06 23:38:11,567] Trial 350 finished with value: 1.2142857142857144 and parameters: {'x_0_0': 'ab', 'x_0_1': 'oo', 'x_1_0': 'bd', 'x_1_1': 'ab'}. Best is trial 23 with value: 0.5.
2024-12-06 23:38:11,572 - INFO - Candidate Mean Stats: {'Max': np.float64(3.0591843268631265), 'Min': np.float64(-1.1418608586327859), 'Mean': np.float64(0.653170783095221), 'Std': np.float64(0.6263958155461399)}
2024-12-06 23:38:11,572 - INFO - Candidate Std Stats: {'Max': np.float64(1.792487459140952), 'Min': np.float64(0.0), 'Mean': np.float64(0.5220564301143551), 'Std': np.float64(0.30855308546936744)}
[I 2024-12-06 23:38:11,586] Trial 352 finished with value: 1.4285714285714286 and parameters: {'x_0_0': 'bd', 'x_0_1': 'ab', 'x_1_0': 'ab', 'x_1_1': 'bc'}. Best is trial 76 with value: 0.5.
2024-12-06 23:38:11,612 - INFO - Candidate Mean Stats: {'Max': np.float64(3.2331045217730825), 'Min': np.float64(-0.8475179816057601), 'Mean': np.float64(0.6685764171446331), 'Std': np.float64(0.5482777878177135)}
2024-12-06 23:38:11,612 - INFO - Candidate Std Stats: {'Max': np.float64(1.954709844492243), 'Min': np.float64(0.0), 'Mean': np.float64(0.5679597369957817), 'Std': np.float64(0.336239392131847)}
[I 2024-12-06 23:38:11,626] Trial 352 finished with value: 1.0892857142857144 and parameters: {'x_0_0': 'ab', 'x_0_1': 'oo', 'x_1_0': 'cd', 'x_1_1': 'oo'}. Best is trial 165 with value: 0.5.
2024-12-06 23:38:11,627 - INFO - Candidate Mean Stats: {'Max': np.float64(3.101925611587375), 'Min': np.float64(-0.6631062645464644), 'Mean': np.float64(0.7065137723938826), 'Std': np.float64(0.560257973880285)}
2024-12-06 23:38:11,627 - INFO - Candidate Std Stats: {'Max': np.float64(1.596813715649449), 'Min': np.float64(0.0), 'Mean': np.float64(0.5174862460580256), 'Std': np.float64(0.30220588623844064)}
[I 2024-12-06 23:38:11,641] Trial 352 finished with value: 1.3214285714285714 and parameters: {'x_0_0': 'bd', 'x_0_1': 'ab', 'x_1_0': 'oo', 'x_1_1': 'cd'}. Best is trial 63 with value: 0.5.
2024-12-06 23:38:11,941 - INFO - Candidate Mean Stats: {'Max': np.float64(3.2604669568355336), 'Min': np.float64(-0.5353068295384531), 'Mean': np.float64(0.7141983315066667), 'Std': np.float64(0.5064004031667031)}
2024-12-06 23:38:11,941 - INFO - Candidate Std Stats: {'Max': np.float64(1.6210178822989743), 'Min': np.float64(0.0), 'Mean': np.float64(0.5371018088532878), 'Std': np.float64(0.3198024875923846)}
2024-12-06 23:38:11,954 - INFO - Candidate Mean Stats: {'Max': np.float64(3.265544298875489), 'Min': np.float64(-0.6111868909131324), 'Mean': np.float64(0.6742433466798301), 'Std': np.float64(0.5549111626548952)}
2024-12-06 23:38:11,955 - INFO - Candidate Std Stats: {'Max': np.float64(1.8869819521796298), 'Min': np.float64(0.0), 'Mean': np.float64(0.5551714926002196), 'Std': np.float64(0.3253620600239271)}
[I 2024-12-06 23:38:11,955] Trial 351 finished with value: 1.0357142857142856 and parameters: {'x_0_0': 'ac', 'x_0_1': 'ac', 'x_1_0': 'oo', 'x_1_1': 'bd'}. Best is trial 23 with value: 0.5.
[I 2024-12-06 23:38:11,968] Trial 353 finished with value: 1.2142857142857144 and parameters: {'x_0_0': 'ab', 'x_0_1': 'oo', 'x_1_0': 'bd', 'x_1_1': 'ab'}. Best is trial 76 with value: 0.5.
2024-12-06 23:38:11,994 - INFO - Candidate Mean Stats: {'Max': np.float64(3.202040158334637), 'Min': np.float64(-0.7866307142085267), 'Mean': np.float64(0.7470683104131258), 'Std': np.float64(0.514082175485142)}
2024-12-06 23:38:11,994 - INFO - Candidate Std Stats: {'Max': np.float64(1.9392873210320767), 'Min': np.float64(0.0), 'Mean': np.float64(0.5200188062936604), 'Std': np.float64(0.3258333263846508)}
[I 2024-12-06 23:38:12,008] Trial 353 finished with value: 1.25 and parameters: {'x_0_0': 'cd', 'x_0_1': 'oo', 'x_1_0': 'oo', 'x_1_1': 'cd'}. Best is trial 165 with value: 0.5.
2024-12-06 23:38:12,012 - INFO - Candidate Mean Stats: {'Max': np.float64(3.148318475113135), 'Min': np.float64(-1.0607896971682005), 'Mean': np.float64(0.7122752405684403), 'Std': np.float64(0.5198091237389098)}
2024-12-06 23:38:12,012 - INFO - Candidate Std Stats: {'Max': np.float64(1.9141702107513285), 'Min': np.float64(0.0), 'Mean': np.float64(0.524423376453102), 'Std': np.float64(0.3174549493705646)}
[I 2024-12-06 23:38:12,025] Trial 353 finished with value: 1.2142857142857144 and parameters: {'x_0_0': 'ab', 'x_0_1': 'oo', 'x_1_0': 'ac', 'x_1_1': 'ab'}. Best is trial 63 with value: 0.5.
2024-12-06 23:38:12,326 - INFO - Candidate Mean Stats: {'Max': np.float64(2.934021610340282), 'Min': np.float64(-0.5320081628240618), 'Mean': np.float64(0.7783567558961987), 'Std': np.float64(0.4645335250196667)}
2024-12-06 23:38:12,326 - INFO - Candidate Std Stats: {'Max': np.float64(1.3402762232866103), 'Min': np.float64(0.0), 'Mean': np.float64(0.4385954681136761), 'Std': np.float64(0.25928345655193646)}
2024-12-06 23:38:12,334 - INFO - Candidate Mean Stats: {'Max': np.float64(3.045328159021346), 'Min': np.float64(-0.9326201125203282), 'Mean': np.float64(0.6255185690916684), 'Std': np.float64(0.5875248229775594)}
2024-12-06 23:38:12,334 - INFO - Candidate Std Stats: {'Max': np.float64(1.5879880419782124), 'Min': np.float64(0.0), 'Mean': np.float64(0.5639212938111119), 'Std': np.float64(0.3247357773141666)}
[I 2024-12-06 23:38:12,341] Trial 352 finished with value: 1.5714285714285714 and parameters: {'x_0_0': 'ac', 'x_0_1': 'bd', 'x_1_0': 'bd', 'x_1_1': 'ad'}. Best is trial 23 with value: 0.5.
[I 2024-12-06 23:38:12,349] Trial 354 finished with value: 1.0357142857142856 and parameters: {'x_0_0': 'ac', 'x_0_1': 'ad', 'x_1_0': 'oo', 'x_1_1': 'cd'}. Best is trial 76 with value: 0.5.
2024-12-06 23:38:12,375 - INFO - Candidate Mean Stats: {'Max': np.float64(3.1823222575597785), 'Min': np.float64(-0.7218247115235352), 'Mean': np.float64(0.6949772610962417), 'Std': np.float64(0.61377944738285)}
2024-12-06 23:38:12,375 - INFO - Candidate Std Stats: {'Max': np.float64(1.7846554404480404), 'Min': np.float64(0.0), 'Mean': np.float64(0.579505051515265), 'Std': np.float64(0.3489665159504394)}
[I 2024-12-06 23:38:12,389] Trial 354 finished with value: 1.3214285714285714 and parameters: {'x_0_0': 'bd', 'x_0_1': 'bc', 'x_1_0': 'oo', 'x_1_1': 'ad'}. Best is trial 165 with value: 0.5.
2024-12-06 23:38:12,394 - INFO - Candidate Mean Stats: {'Max': np.float64(3.623995912801925), 'Min': np.float64(-0.7997821015446462), 'Mean': np.float64(0.664095310418277), 'Std': np.float64(0.5829395159349218)}
2024-12-06 23:38:12,394 - INFO - Candidate Std Stats: {'Max': np.float64(1.797586628399727), 'Min': np.float64(0.0), 'Mean': np.float64(0.5205962625953923), 'Std': np.float64(0.3032754349167882)}
[I 2024-12-06 23:38:12,408] Trial 354 finished with value: 1.375 and parameters: {'x_0_0': 'oo', 'x_0_1': 'oo', 'x_1_0': 'ac', 'x_1_1': 'ad'}. Best is trial 63 with value: 0.5.
2024-12-06 23:38:12,723 - INFO - Candidate Mean Stats: {'Max': np.float64(3.171647909966358), 'Min': np.float64(-0.8361050391411944), 'Mean': np.float64(0.7137923574642175), 'Std': np.float64(0.5541147123542697)}
2024-12-06 23:38:12,723 - INFO - Candidate Std Stats: {'Max': np.float64(1.4416724737229796), 'Min': np.float64(0.0), 'Mean': np.float64(0.5041806377925506), 'Std': np.float64(0.3050351918382432)}
2024-12-06 23:38:12,729 - INFO - Candidate Mean Stats: {'Max': np.float64(2.9787071370242764), 'Min': np.float64(-0.9815191225563937), 'Mean': np.float64(0.7173862295639625), 'Std': np.float64(0.5617807746256789)}
2024-12-06 23:38:12,729 - INFO - Candidate Std Stats: {'Max': np.float64(1.5321178397698811), 'Min': np.float64(0.0), 'Mean': np.float64(0.5148874702139501), 'Std': np.float64(0.3020889258495369)}
[I 2024-12-06 23:38:12,739] Trial 353 finished with value: 1.0357142857142856 and parameters: {'x_0_0': 'ac', 'x_0_1': 'ad', 'x_1_0': 'oo', 'x_1_1': 'cd'}. Best is trial 23 with value: 0.5.
[I 2024-12-06 23:38:12,744] Trial 355 finished with value: 0.7857142857142857 and parameters: {'x_0_0': 'ad', 'x_0_1': 'oo', 'x_1_0': 'bd', 'x_1_1': 'bd'}. Best is trial 76 with value: 0.5.
2024-12-06 23:38:12,777 - INFO - Candidate Mean Stats: {'Max': np.float64(3.0566862006976505), 'Min': np.float64(-0.6191696619816366), 'Mean': np.float64(0.7393507021698121), 'Std': np.float64(0.5183747289134183)}
2024-12-06 23:38:12,777 - INFO - Candidate Std Stats: {'Max': np.float64(1.600249622773042), 'Min': np.float64(0.0), 'Mean': np.float64(0.4986151309797639), 'Std': np.float64(0.31510073224565077)}
[I 2024-12-06 23:38:12,791] Trial 355 finished with value: 1.3214285714285714 and parameters: {'x_0_0': 'ad', 'x_0_1': 'ab', 'x_1_0': 'oo', 'x_1_1': 'cd'}. Best is trial 165 with value: 0.5.
2024-12-06 23:38:12,797 - INFO - Candidate Mean Stats: {'Max': np.float64(3.1693807422074847), 'Min': np.float64(-0.6515637799141142), 'Mean': np.float64(0.7616006942248097), 'Std': np.float64(0.49685372280412793)}
2024-12-06 23:38:12,798 - INFO - Candidate Std Stats: {'Max': np.float64(1.7116050663685376), 'Min': np.float64(0.0), 'Mean': np.float64(0.43658805710588927), 'Std': np.float64(0.2687564157602607)}
[I 2024-12-06 23:38:12,811] Trial 355 finished with value: 1.5 and parameters: {'x_0_0': 'cd', 'x_0_1': 'oo', 'x_1_0': 'cd', 'x_1_1': 'ab'}. Best is trial 63 with value: 0.5.
2024-12-06 23:38:13,113 - INFO - Candidate Mean Stats: {'Max': np.float64(2.9872921175275335), 'Min': np.float64(-0.8793265204246727), 'Mean': np.float64(0.7016589312252755), 'Std': np.float64(0.5402445835988606)}
2024-12-06 23:38:13,113 - INFO - Candidate Std Stats: {'Max': np.float64(1.5890610581055604), 'Min': np.float64(0.0), 'Mean': np.float64(0.5274115480927688), 'Std': np.float64(0.3154135708122658)}
2024-12-06 23:38:13,113 - INFO - Candidate Mean Stats: {'Max': np.float64(3.043838654423995), 'Min': np.float64(-0.7676870666405332), 'Mean': np.float64(0.6936295664542226), 'Std': np.float64(0.6062956623188481)}
2024-12-06 23:38:13,113 - INFO - Candidate Std Stats: {'Max': np.float64(1.6241805165436305), 'Min': np.float64(0.0), 'Mean': np.float64(0.5769466256142617), 'Std': np.float64(0.33244708089796243)}
[I 2024-12-06 23:38:13,129] Trial 356 finished with value: 1.2857142857142856 and parameters: {'x_0_0': 'bc', 'x_0_1': 'ad', 'x_1_0': 'bd', 'x_1_1': 'cd'}. Best is trial 76 with value: 0.5.
[I 2024-12-06 23:38:13,129] Trial 354 finished with value: 1.4464285714285714 and parameters: {'x_0_0': 'bd', 'x_0_1': 'ab', 'x_1_0': 'cd', 'x_1_1': 'oo'}. Best is trial 23 with value: 0.5.
2024-12-06 23:38:13,162 - INFO - Candidate Mean Stats: {'Max': np.float64(3.3782028082121536), 'Min': np.float64(-0.697457822071903), 'Mean': np.float64(0.6879854384909421), 'Std': np.float64(0.5209697993881863)}
2024-12-06 23:38:13,163 - INFO - Candidate Std Stats: {'Max': np.float64(1.6568763171678598), 'Min': np.float64(0.0), 'Mean': np.float64(0.5315968175392205), 'Std': np.float64(0.3201170365221378)}
[I 2024-12-06 23:38:13,176] Trial 356 finished with value: 1.1428571428571428 and parameters: {'x_0_0': 'bc', 'x_0_1': 'ad', 'x_1_0': 'bd', 'x_1_1': 'ab'}. Best is trial 165 with value: 0.5.
2024-12-06 23:38:13,183 - INFO - Candidate Mean Stats: {'Max': np.float64(2.946344126981652), 'Min': np.float64(-0.7644544326172685), 'Mean': np.float64(0.673564996503779), 'Std': np.float64(0.5801754955116275)}
2024-12-06 23:38:13,183 - INFO - Candidate Std Stats: {'Max': np.float64(1.6748952400281234), 'Min': np.float64(0.0), 'Mean': np.float64(0.5211956005597397), 'Std': np.float64(0.30745703269632196)}
[I 2024-12-06 23:38:13,197] Trial 356 finished with value: 1.1964285714285714 and parameters: {'x_0_0': 'ac', 'x_0_1': 'bc', 'x_1_0': 'oo', 'x_1_1': 'oo'}. Best is trial 63 with value: 0.5.
2024-12-06 23:38:13,496 - INFO - Candidate Mean Stats: {'Max': np.float64(3.0024719760302956), 'Min': np.float64(-0.8704319742955539), 'Mean': np.float64(0.6165291841168873), 'Std': np.float64(0.608524202336328)}
2024-12-06 23:38:13,496 - INFO - Candidate Std Stats: {'Max': np.float64(1.7719548007635997), 'Min': np.float64(0.0), 'Mean': np.float64(0.5746256613666691), 'Std': np.float64(0.3459875219009902)}
2024-12-06 23:38:13,498 - INFO - Candidate Mean Stats: {'Max': np.float64(3.395993691026592), 'Min': np.float64(-0.3558375605067764), 'Mean': np.float64(0.7961902292089056), 'Std': np.float64(0.4772163938743436)}
2024-12-06 23:38:13,498 - INFO - Candidate Std Stats: {'Max': np.float64(1.4972994273726359), 'Min': np.float64(0.0), 'Mean': np.float64(0.45059339947589144), 'Std': np.float64(0.27042347548539597)}
[I 2024-12-06 23:38:13,511] Trial 357 finished with value: 1.2142857142857144 and parameters: {'x_0_0': 'ab', 'x_0_1': 'oo', 'x_1_0': 'ab', 'x_1_1': 'bd'}. Best is trial 76 with value: 0.5.
[I 2024-12-06 23:38:13,512] Trial 355 finished with value: 1.25 and parameters: {'x_0_0': 'cd', 'x_0_1': 'oo', 'x_1_0': 'oo', 'x_1_1': 'ac'}. Best is trial 23 with value: 0.5.
2024-12-06 23:38:13,545 - INFO - Candidate Mean Stats: {'Max': np.float64(3.09736371004053), 'Min': np.float64(-0.7051409423849825), 'Mean': np.float64(0.6890212615884665), 'Std': np.float64(0.576160122709099)}
2024-12-06 23:38:13,545 - INFO - Candidate Std Stats: {'Max': np.float64(2.1419016445953623), 'Min': np.float64(0.0), 'Mean': np.float64(0.5979500608185805), 'Std': np.float64(0.36591384638254476)}
[I 2024-12-06 23:38:13,559] Trial 357 finished with value: 1.0357142857142856 and parameters: {'x_0_0': 'bc', 'x_0_1': 'ac', 'x_1_0': 'oo', 'x_1_1': 'ac'}. Best is trial 165 with value: 0.5.
2024-12-06 23:38:13,570 - INFO - Candidate Mean Stats: {'Max': np.float64(3.206984668449791), 'Min': np.float64(-0.6980506062422789), 'Mean': np.float64(0.6633897018500589), 'Std': np.float64(0.5487706963351141)}
2024-12-06 23:38:13,570 - INFO - Candidate Std Stats: {'Max': np.float64(1.760556573290496), 'Min': np.float64(0.0), 'Mean': np.float64(0.5579654378161797), 'Std': np.float64(0.33320462215714064)}
[I 2024-12-06 23:38:13,584] Trial 357 finished with value: 1.0714285714285714 and parameters: {'x_0_0': 'ac', 'x_0_1': 'oo', 'x_1_0': 'ab', 'x_1_1': 'ad'}. Best is trial 63 with value: 0.5.
2024-12-06 23:38:13,888 - INFO - Candidate Mean Stats: {'Max': np.float64(3.3328154341533995), 'Min': np.float64(-0.9633987289344379), 'Mean': np.float64(0.6026481905900118), 'Std': np.float64(0.6302476314501607)}
2024-12-06 23:38:13,888 - INFO - Candidate Std Stats: {'Max': np.float64(1.4459497744239658), 'Min': np.float64(0.0), 'Mean': np.float64(0.5294424232344571), 'Std': np.float64(0.31072422155082524)}
2024-12-06 23:38:13,897 - INFO - Candidate Mean Stats: {'Max': np.float64(3.240139709256604), 'Min': np.float64(-0.5415015815948108), 'Mean': np.float64(0.7717817326507302), 'Std': np.float64(0.48992247344939316)}
2024-12-06 23:38:13,897 - INFO - Candidate Std Stats: {'Max': np.float64(1.456753760727307), 'Min': np.float64(0.0), 'Mean': np.float64(0.4694828749899416), 'Std': np.float64(0.2820653551674874)}
[I 2024-12-06 23:38:13,902] Trial 358 finished with value: 1.1607142857142856 and parameters: {'x_0_0': 'bc', 'x_0_1': 'ac', 'x_1_0': 'bd', 'x_1_1': 'oo'}. Best is trial 76 with value: 0.5.
[I 2024-12-06 23:38:13,911] Trial 356 finished with value: 1.0714285714285714 and parameters: {'x_0_0': 'ac', 'x_0_1': 'oo', 'x_1_0': 'ac', 'x_1_1': 'cd'}. Best is trial 23 with value: 0.5.
2024-12-06 23:38:13,940 - INFO - Candidate Mean Stats: {'Max': np.float64(2.8782380286164737), 'Min': np.float64(-0.7077014041088525), 'Mean': np.float64(0.7214577278954812), 'Std': np.float64(0.5316473395233818)}
2024-12-06 23:38:13,940 - INFO - Candidate Std Stats: {'Max': np.float64(1.8635217707827532), 'Min': np.float64(0.0), 'Mean': np.float64(0.4901481392714084), 'Std': np.float64(0.30776650268083766)}
[I 2024-12-06 23:38:13,955] Trial 358 finished with value: 1.4285714285714286 and parameters: {'x_0_0': 'bd', 'x_0_1': 'ac', 'x_1_0': 'ab', 'x_1_1': 'ad'}. Best is trial 165 with value: 0.5.
2024-12-06 23:38:13,965 - INFO - Candidate Mean Stats: {'Max': np.float64(3.148210434122869), 'Min': np.float64(-0.4757519070045621), 'Mean': np.float64(0.7768248773009141), 'Std': np.float64(0.48567211247441183)}
2024-12-06 23:38:13,965 - INFO - Candidate Std Stats: {'Max': np.float64(1.8401172285674663), 'Min': np.float64(0.0), 'Mean': np.float64(0.4547839897840283), 'Std': np.float64(0.30925857981432253)}
[I 2024-12-06 23:38:13,978] Trial 358 finished with value: 1.5 and parameters: {'x_0_0': 'cd', 'x_0_1': 'oo', 'x_1_0': 'ac', 'x_1_1': 'ab'}. Best is trial 63 with value: 0.5.
2024-12-06 23:38:14,272 - INFO - Candidate Mean Stats: {'Max': np.float64(3.5615675794852657), 'Min': np.float64(-0.7700134726167496), 'Mean': np.float64(0.6521751067810232), 'Std': np.float64(0.6237676324594073)}
2024-12-06 23:38:14,272 - INFO - Candidate Std Stats: {'Max': np.float64(1.7649312377097255), 'Min': np.float64(0.0), 'Mean': np.float64(0.5286366191142565), 'Std': np.float64(0.3151036573013179)}
2024-12-06 23:38:14,283 - INFO - Candidate Mean Stats: {'Max': np.float64(3.0112213987254774), 'Min': np.float64(-0.7646979857942953), 'Mean': np.float64(0.7354838376945628), 'Std': np.float64(0.5329650640329968)}
2024-12-06 23:38:14,283 - INFO - Candidate Std Stats: {'Max': np.float64(1.3400469456535706), 'Min': np.float64(0.0), 'Mean': np.float64(0.4642684555593397), 'Std': np.float64(0.28037151321016146)}
