[I 2024-12-28 14:59:19,516] Trial 69 finished with value: 1.1607142857142856 and parameters: {'x_0_0': 'ad', 'x_0_1': 'bd', 'x_1_0': 'bd', 'x_1_1': 'oo'}. Best is trial 43 with value: 0.6964285714285714.

Loaded from prev state!
Loaded from prev state!
Loaded from prev state!
Loaded from prev state!
Loaded from prev state!
Loaded from prev state!
Loaded from prev state!
Loaded from prev state!
Loaded from prev state!
Loaded from prev state!
Loaded from prev state!
Loaded from prev state!
Loaded from prev state!
Loaded from prev state!
Loaded from prev state!
Loaded from prev state!
Loaded from prev state!
Loaded from prev state!
Loaded from prev state!
Loaded from prev state!
Loaded from prev state!
Loaded from prev state!
Loaded from prev state!
Loaded from prev state!
Loaded from prev state!
Loaded from prev state!
Loaded from prev state!
Loaded from prev state!
Loaded from prev state!
Loaded from prev state!
Loaded from prev state!
Loaded from prev state!
Loaded from prev state!
Loaded from prev state!
Loaded from prev state!
Loaded from prev state!
Loaded from prev state!
Loaded from prev state!
Loaded from prev state!
Loaded from prev state!
Loaded from prev state!
Loaded from prev state!
Loaded from prev state!
Loaded from prev state!
Loaded from prev state!
Loaded from prev state!
Loaded from prev state!
Loaded from prev state!
Loaded from prev state!
Loaded from prev state!
Loaded from prev state!
Loaded from prev state!
Loaded from prev state!
Loaded from prev state!
Loaded from prev state!
Loaded from prev state!
Loaded from prev state!
Loaded from prev state!
Loaded from prev state!
Loaded from prev state!
Loaded from prev state!
Loaded from prev state!
Loaded from prev state!
Loaded from prev state!
Loaded from prev state!
Loaded from prev state!
Loaded from prev state!
Loaded from prev state!
Loaded from prev state!
Loaded from prev state!
Loaded from prev state!
Loaded from prev state!
Loaded from prev state!
Loaded from prev state!
Loaded from prev state!
Loaded from prev state!
Loaded from prev state!
Loaded from prev state!
Loaded from prev state!
Loaded from prev state!
Loaded from prev state!
Loaded from prev state!
Loaded from prev state!
Loaded from prev state!
Loaded from prev state!
Loaded from prev state!
Loaded from prev state!
Loaded from prev state!
Loaded from prev state!
Loaded from prev state!
Loaded from prev state!
Loaded from prev state!
Loaded from prev state!
Loaded from prev state!
Loaded from prev state!
Loaded from prev state!
Loaded from prev state!
Loaded from prev state!
Loaded from prev state!
Loaded from prev state!
Loaded from prev state!
Loaded from prev state!
Loaded from prev state!
Loaded from prev state!
Loaded from prev state!
Loaded from prev state!
Loaded from prev state!
Loaded from prev state!
Loaded from prev state!
Loaded from prev state!
Loaded from prev state!
Loaded from prev state!
Loaded from prev state!
Loaded from prev state!
Loaded from prev state!
Loaded from prev state!
Loaded from prev state!
Loaded from prev state!
Loaded from prev state!
Loaded from prev state!
Loaded from prev state!
Loaded from prev state!
Loaded from prev state!
Loaded from prev state!
Loaded from prev state!
Loaded from prev state!
Loaded from prev state!
Loaded from prev state!
Loaded from prev state!
Loaded from prev state!
Loaded from prev state!
Loaded from prev state!
Loaded from prev state!
Loaded from prev state!
Loaded from prev state!
Loaded from prev state!
Loaded from prev state!
Loaded from prev state!
Loaded from prev state!
Loaded from prev state!
Loaded from prev state!
Loaded from prev state!
Loaded from prev state!
Loaded from prev state!
Loaded from prev state!
Loaded from prev state!
Loaded from prev state!
Loaded from prev state!
Loaded from prev state!
Loaded from prev state!
Loaded from prev state!
Loaded from prev state!
Loaded from prev state!
Loaded from prev state!
Loaded from prev state!
Loaded from prev state!
Loaded from prev state!
Loaded from prev state!
Loaded from prev state!
Loaded from prev state!
Loaded from prev state!
Loaded from prev state!
Loaded from prev state!
Loaded from prev state!
Loaded from prev state!
Loaded from prev state!
Loaded from prev state!
Loaded from prev state!
Loaded from prev state!
Loaded from prev state!
Loaded from prev state!
Loaded from prev state!
Loaded from prev state!
Loaded from prev state!
Loaded from prev state!
Loaded from prev state!
Loaded from prev state!
Loaded from prev state!
Loaded from prev state!
Loaded from prev state!
Loaded from prev state!
Loaded from prev state!
Loaded from prev state!
Loaded from prev state!
Loaded from prev state!
Loaded from prev state!
Loaded from prev state!
Loaded from prev state!
Loaded from prev state!
Loaded from prev state!
Loaded from prev state!
Loaded from prev state!
Loaded from prev state!
Loaded from prev state!
Loaded from prev state!
Loaded from prev state!
Loaded from prev state!
Loaded from prev state!
Loaded from prev state!
Loaded from prev state!
Loaded from prev state!
Loaded from prev state!
Loaded from prev state!
Loaded from prev state!
Loaded from prev state!
Loaded from prev state!
Loaded from prev state!
Loaded from prev state!
Loaded from prev state!
Loaded from prev state!
Loaded from prev state!
Loaded from prev state!
Loaded from prev state!
Loaded from prev state!
Loaded from prev state!
Loaded from prev state!
Loaded from prev state!
Loaded from prev state!
Loaded from prev state!
Loaded from prev state!
Loaded from prev state!
Loaded from prev state!
Loaded from prev state!
Loaded from prev state!
Loaded from prev state!
Loaded from prev state!
Loaded from prev state!
Loaded from prev state!
Loaded from prev state!
Loaded from prev state!
Loaded from prev state!
Loaded from prev state!
Loaded from prev state!
Loaded from prev state!
Loaded from prev state!
Loaded from prev state!
Loaded from prev state!
Loaded from prev state!
Loaded from prev state!
Loaded from prev state!
Loaded from prev state!
Loaded from prev state!
Loaded from prev state!
Loaded from prev state!
Loaded from prev state!
Loaded from prev state!
Loaded from prev state!
Loaded from prev state!
Loaded from prev state!
Loaded from prev state!
Loaded from prev state!
Loaded from prev state!
Loaded from prev state!
Loaded from prev state!
Loaded from prev state!
Loaded from prev state!
Loaded from prev state!
Loaded from prev state!
Loaded from prev state!
Loaded from prev state!
Loaded from prev state!
Loaded from prev state!
Loaded from prev state!
Loaded from prev state!
Loaded from prev state!
Loaded from prev state!
Loaded from prev state!
Loaded from prev state!
Loaded from prev state!
Loaded from prev state!
Loaded from prev state!
Loaded from prev state!
Loaded from prev state!
Loaded from prev state!
Loaded from prev state!
Loaded from prev state!
Loaded from prev state!
Loaded from prev state!
Loaded from prev state!
Loaded from prev state!
Loaded from prev state!
Loaded from prev state!
Loaded from prev state!
Loaded from prev state!
Loaded from prev state!
Loaded from prev state!
Loaded from prev state!
Loaded from prev state!
Loaded from prev state!
Loaded from prev state!
Loaded from prev state!
Loaded from prev state!
Loaded from prev state!
Loaded from prev state!
Loaded from prev state!
Loaded from prev state!
Loaded from prev state!
Loaded from prev state!
Loaded from prev state!
Loaded from prev state!
Loaded from prev state!
Loaded from prev state!
Loaded from prev state!
Loaded from prev state!
Loaded from prev state!
Loaded from prev state!
Loaded from prev state!
Loaded from prev state!
Loaded from prev state!
Loaded from prev state!
Loaded from prev state!
Loaded from prev state!
Loaded from prev state!
Loaded from prev state!
Loaded from prev state!
Loaded from prev state!
Loaded from prev state!
Loaded from prev state!
Loaded from prev state!
Loaded from prev state!
Loaded from prev state!
Loaded from prev state!
Loaded from prev state!
Loaded from prev state!
Loaded from prev state!
Loaded from prev state!
Loaded from prev state!
Loaded from prev state!
Loaded from prev state!
Loaded from prev state!
Loaded from prev state!
Loaded from prev state!
Loaded from prev state!
Loaded from prev state!
Loaded from prev state!
Loaded from prev state!
Loaded from prev state!
Loaded from prev state!
Loaded from prev state!
Loaded from prev state!
Loaded from prev state!
Loaded from prev state![I 2024-12-28 14:59:19,739] Trial 71 finished with value: 1.875 and parameters: {'x_0_0': 'oo', 'x_0_1': 'cd', 'x_1_0': 'bd', 'x_1_1': 'ad'}. Best is trial 16 with value: 0.8035714285714286.
[I 2024-12-28 14:59:19,752] Trial 73 finished with value: 1.75 and parameters: {'x_0_0': 'cd', 'x_0_1': 'bd', 'x_1_0': 'oo', 'x_1_1': 'ac'}. Best is trial 17 with value: 0.5.
[I 2024-12-28 14:59:19,915] Trial 74 finished with value: 1.5892857142857144 and parameters: {'x_0_0': 'ab', 'x_0_1': 'bd', 'x_1_0': 'bc', 'x_1_1': 'oo'}. Best is trial 29 with value: 1.0.
[I 2024-12-28 14:59:19,935] Trial 79 finished with value: 1.5714285714285714 and parameters: {'x_0_0': 'ac', 'x_0_1': 'bd', 'x_1_0': 'cd', 'x_1_1': 'bc'}. Best is trial 50 with value: 0.8214285714285714.
[I 2024-12-28 14:59:19,982] Trial 59 finished with value: 1.2142857142857144 and parameters: {'x_0_0': 'ab', 'x_0_1': 'oo', 'x_1_0': 'ac', 'x_1_1': 'ab'}. Best is trial 47 with value: 0.6964285714285714.
[I 2024-12-28 14:59:20,012] Trial 71 finished with value: 1.7142857142857144 and parameters: {'x_0_0': 'ab', 'x_0_1': 'bc', 'x_1_0': 'bc', 'x_1_1': 'cd'}. Best is trial 21 with value: 0.7857142857142857.
[I 2024-12-28 14:59:20,240] Trial 65 finished with value: 2.0 and parameters: {'x_0_0': 'cd', 'x_0_1': 'bc', 'x_1_0': 'ab', 'x_1_1': 'ac'}. Best is trial 7 with value: 0.5.
[I 2024-12-28 14:59:20,324] Trial 72 finished with value: 1.5714285714285714 and parameters: {'x_0_0': 'ac', 'x_0_1': 'cd', 'x_1_0': 'bd', 'x_1_1': 'ad'}. Best is trial 16 with value: 0.8035714285714286.
[I 2024-12-28 14:59:20,652] Trial 74 finished with value: 1.0714285714285714 and parameters: {'x_0_0': 'ac', 'x_0_1': 'oo', 'x_1_0': 'ac', 'x_1_1': 'ac'}. Best is trial 15 with value: 0.6964285714285714.
[I 2024-12-28 14:59:20,684] Trial 60 finished with value: 1.5 and parameters: {'x_0_0': 'cd', 'x_0_1': 'oo', 'x_1_0': 'ad', 'x_1_1': 'bd'}. Best is trial 47 with value: 0.6964285714285714.
[I 2024-12-28 14:59:20,767] Trial 74 finished with value: 1.0357142857142856 and parameters: {'x_0_0': 'ac', 'x_0_1': 'ac', 'x_1_0': 'oo', 'x_1_1': 'bc'}. Best is trial 17 with value: 0.5.
[I 2024-12-28 14:59:20,795] Trial 77 finished with value: 1.875 and parameters: {'x_0_0': 'oo', 'x_0_1': 'bc', 'x_1_0': 'bc', 'x_1_1': 'ac'}. Best is trial 17 with value: 0.7857142857142857.
[I 2024-12-28 14:59:20,848] Trial 73 finished with value: 0.7857142857142857 and parameters: {'x_0_0': 'bd', 'x_0_1': 'oo', 'x_1_0': 'bd', 'x_1_1': 'ad'}. Best is trial 73 with value: 0.7857142857142857.
[I 2024-12-28 14:59:20,890] Trial 75 finished with value: 1.75 and parameters: {'x_0_0': 'oo', 'x_0_1': 'bd', 'x_1_0': 'cd', 'x_1_1': 'oo'}. Best is trial 29 with value: 1.0.
[I 2024-12-28 14:59:21,098] Trial 70 finished with value: 1.4285714285714286 and parameters: {'x_0_0': 'ad', 'x_0_1': 'bd', 'x_1_0': 'ab', 'x_1_1': 'ad'}. Best is trial 43 with value: 0.6964285714285714.
[I 2024-12-28 14:59:21,598] Trial 75 finished with value: 2.0 and parameters: {'x_0_0': 'cd', 'x_0_1': 'ac', 'x_1_0': 'bd', 'x_1_1': 'bd'}. Best is trial 17 with value: 0.5.
[I 2024-12-28 14:59:21,709] Trial 76 finished with value: 1.4464285714285714 and parameters: {'x_0_0': 'ac', 'x_0_1': 'bd', 'x_1_0': 'bd', 'x_1_1': 'oo'}. Best is trial 29 with value: 1.0.
[I 2024-12-28 14:59:22,055] Trial 78 finished with value: 1.0 and parameters: {'x_0_0': 'bd', 'x_0_1': 'bc', 'x_1_0': 'bc', 'x_1_1': 'ad'}. Best is trial 17 with value: 0.7857142857142857.
[I 2024-12-28 14:59:22,165] Trial 71 finished with value: 1.5892857142857144 and parameters: {'x_0_0': 'ab', 'x_0_1': 'bd', 'x_1_0': 'ab', 'x_1_1': 'oo'}. Best is trial 43 with value: 0.6964285714285714.
[I 2024-12-28 14:59:22,185] Trial 75 finished with value: 1.5714285714285714 and parameters: {'x_0_0': 'bc', 'x_0_1': 'cd', 'x_1_0': 'ab', 'x_1_1': 'bd'}. Best is trial 15 with value: 0.6964285714285714.
[I 2024-12-28 14:59:22,311] Trial 72 finished with value: 1.7142857142857144 and parameters: {'x_0_0': 'ab', 'x_0_1': 'ad', 'x_1_0': 'bc', 'x_1_1': 'bd'}. Best is trial 21 with value: 0.7857142857142857.
[I 2024-12-28 14:59:22,469] Trial 80 finished with value: 1.875 and parameters: {'x_0_0': 'oo', 'x_0_1': 'bd', 'x_1_0': 'bc', 'x_1_1': 'bd'}. Best is trial 50 with value: 0.8214285714285714.
[I 2024-12-28 14:59:22,605] Trial 77 finished with value: 1.75 and parameters: {'x_0_0': 'oo', 'x_0_1': 'ac', 'x_1_0': 'cd', 'x_1_1': 'oo'}. Best is trial 29 with value: 1.0.
[I 2024-12-28 14:59:22,724] Trial 61 finished with value: 1.25 and parameters: {'x_0_0': 'cd', 'x_0_1': 'oo', 'x_1_0': 'oo', 'x_1_1': 'ab'}. Best is trial 47 with value: 0.6964285714285714.
[I 2024-12-28 14:59:22,798] Trial 76 finished with value: 1.2857142857142856 and parameters: {'x_0_0': 'bd', 'x_0_1': 'bc', 'x_1_0': 'bd', 'x_1_1': 'ac'}. Best is trial 17 with value: 0.5.
[I 2024-12-28 14:59:22,869] Trial 76 finished with value: 1.5714285714285714 and parameters: {'x_0_0': 'bc', 'x_0_1': 'cd', 'x_1_0': 'ac', 'x_1_1': 'bd'}. Best is trial 15 with value: 0.6964285714285714.
[I 2024-12-28 14:59:22,904] Trial 66 finished with value: 2.0 and parameters: {'x_0_0': 'cd', 'x_0_1': 'bc', 'x_1_0': 'cd', 'x_1_1': 'ac'}. Best is trial 7 with value: 0.5.
[I 2024-12-28 14:59:23,454] Trial 72 finished with value: 1.4642857142857144 and parameters: {'x_0_0': 'ab', 'x_0_1': 'bd', 'x_1_0': 'oo', 'x_1_1': 'ab'}. Best is trial 43 with value: 0.6964285714285714.
[I 2024-12-28 14:59:23,483] Trial 74 finished with value: 2.0 and parameters: {'x_0_0': 'cd', 'x_0_1': 'ac', 'x_1_0': 'bc', 'x_1_1': 'ad'}. Best is trial 73 with value: 0.7857142857142857.
[I 2024-12-28 14:59:23,570] Trial 77 finished with value: 0.8214285714285714 and parameters: {'x_0_0': 'bc', 'x_0_1': 'oo', 'x_1_0': 'oo', 'x_1_1': 'ac'}. Best is trial 17 with value: 0.5.
[I 2024-12-28 14:59:24,222] Trial 75 finished with value: 1.25 and parameters: {'x_0_0': 'cd', 'x_0_1': 'oo', 'x_1_0': 'oo', 'x_1_1': 'bd'}. Best is trial 73 with value: 0.7857142857142857.
[I 2024-12-28 14:59:24,250] Trial 62 finished with value: 1.2857142857142856 and parameters: {'x_0_0': 'ac', 'x_0_1': 'ad', 'x_1_0': 'ac', 'x_1_1': 'cd'}. Best is trial 47 with value: 0.6964285714285714.
[I 2024-12-28 14:59:24,492] Trial 73 finished with value: 1.5892857142857144 and parameters: {'x_0_0': 'ab', 'x_0_1': 'bd', 'x_1_0': 'ad', 'x_1_1': 'oo'}. Best is trial 43 with value: 0.6964285714285714.
[I 2024-12-28 14:59:24,498] Trial 67 finished with value: 2.0 and parameters: {'x_0_0': 'cd', 'x_0_1': 'bc', 'x_1_0': 'ad', 'x_1_1': 'ab'}. Best is trial 7 with value: 0.5.
[I 2024-12-28 14:59:24,521] Trial 73 finished with value: 2.0 and parameters: {'x_0_0': 'cd', 'x_0_1': 'ad', 'x_1_0': 'bc', 'x_1_1': 'cd'}. Best is trial 21 with value: 0.7857142857142857.
[I 2024-12-28 14:59:24,680] Trial 78 finished with value: 1.875 and parameters: {'x_0_0': 'oo', 'x_0_1': 'bd', 'x_1_0': 'ab', 'x_1_1': 'ac'}. Best is trial 29 with value: 1.0.
[I 2024-12-28 14:59:24,918] Trial 63 finished with value: 1.0 and parameters: {'x_0_0': 'ac', 'x_0_1': 'ad', 'x_1_0': 'ac', 'x_1_1': 'bd'}. Best is trial 47 with value: 0.6964285714285714.
[I 2024-12-28 14:59:25,038] Trial 79 finished with value: 1.5714285714285714 and parameters: {'x_0_0': 'bd', 'x_0_1': 'bc', 'x_1_0': 'ac', 'x_1_1': 'ab'}. Best is trial 17 with value: 0.7857142857142857.
[I 2024-12-28 14:59:25,342] Trial 78 finished with value: 1.4464285714285714 and parameters: {'x_0_0': 'ad', 'x_0_1': 'bd', 'x_1_0': 'cd', 'x_1_1': 'oo'}. Best is trial 17 with value: 0.5.
[I 2024-12-28 14:59:25,444] Trial 81 finished with value: 2.0 and parameters: {'x_0_0': 'cd', 'x_0_1': 'bd', 'x_1_0': 'cd', 'x_1_1': 'bd'}. Best is trial 50 with value: 0.8214285714285714.
[I 2024-12-28 14:59:25,927] Trial 79 finished with value: 1.4464285714285714 and parameters: {'x_0_0': 'ac', 'x_0_1': 'bd', 'x_1_0': 'ab', 'x_1_1': 'oo'}. Best is trial 29 with value: 1.0.
[I 2024-12-28 14:59:25,959] Trial 77 finished with value: 1.75 and parameters: {'x_0_0': 'cd', 'x_0_1': 'bd', 'x_1_0': 'oo', 'x_1_1': 'bd'}. Best is trial 15 with value: 0.6964285714285714.
[I 2024-12-28 14:59:26,318] Trial 64 finished with value: 1.5714285714285714 and parameters: {'x_0_0': 'bd', 'x_0_1': 'bc', 'x_1_0': 'ac', 'x_1_1': 'bc'}. Best is trial 47 with value: 0.6964285714285714.
[I 2024-12-28 14:59:26,652] Trial 68 finished with value: 2.0 and parameters: {'x_0_0': 'cd', 'x_0_1': 'ad', 'x_1_0': 'bd', 'x_1_1': 'ab'}. Best is trial 7 with value: 0.5.
[I 2024-12-28 14:59:26,718] Trial 76 finished with value: 2.0 and parameters: {'x_0_0': 'cd', 'x_0_1': 'ab', 'x_1_0': 'bc', 'x_1_1': 'bd'}. Best is trial 73 with value: 0.7857142857142857.
[I 2024-12-28 14:59:26,747] Trial 65 finished with value: 1.75 and parameters: {'x_0_0': 'cd', 'x_0_1': 'bd', 'x_1_0': 'oo', 'x_1_1': 'cd'}. Best is trial 47 with value: 0.6964285714285714.
[I 2024-12-28 14:59:26,970] Trial 78 finished with value: 1.625 and parameters: {'x_0_0': 'oo', 'x_0_1': 'bd', 'x_1_0': 'oo', 'x_1_1': 'bd'}. Best is trial 15 with value: 0.6964285714285714.
[I 2024-12-28 14:59:27,004] Trial 80 finished with value: 1.4285714285714286 and parameters: {'x_0_0': 'bd', 'x_0_1': 'bc', 'x_1_0': 'ab', 'x_1_1': 'ac'}. Best is trial 17 with value: 0.7857142857142857.
[I 2024-12-28 14:59:27,082] Trial 79 finished with value: 1.875 and parameters: {'x_0_0': 'oo', 'x_0_1': 'bd', 'x_1_0': 'bc', 'x_1_1': 'ab'}. Best is trial 17 with value: 0.5.
[I 2024-12-28 14:59:27,477] Trial 82 finished with value: 1.4464285714285714 and parameters: {'x_0_0': 'ad', 'x_0_1': 'bd', 'x_1_0': 'cd', 'x_1_1': 'oo'}. Best is trial 50 with value: 0.8214285714285714.
[I 2024-12-28 14:59:27,481] Trial 66 finished with value: 1.875 and parameters: {'x_0_0': 'cd', 'x_0_1': 'cd', 'x_1_0': 'ac', 'x_1_1': 'oo'}. Best is trial 47 with value: 0.6964285714285714.
[I 2024-12-28 14:59:27,790] Trial 79 finished with value: 1.4642857142857144 and parameters: {'x_0_0': 'ab', 'x_0_1': 'bd', 'x_1_0': 'oo', 'x_1_1': 'bd'}. Best is trial 15 with value: 0.6964285714285714.
[I 2024-12-28 14:59:27,893] Trial 74 finished with value: 1.4285714285714286 and parameters: {'x_0_0': 'bd', 'x_0_1': 'ac', 'x_1_0': 'ab', 'x_1_1': 'cd'}. Best is trial 21 with value: 0.7857142857142857.
[I 2024-12-28 14:59:27,986] Trial 74 finished with value: 1.5714285714285714 and parameters: {'x_0_0': 'ac', 'x_0_1': 'bd', 'x_1_0': 'ad', 'x_1_1': 'ad'}. Best is trial 43 with value: 0.6964285714285714.
[I 2024-12-28 14:59:28,303] Trial 83 finished with value: 1.875 and parameters: {'x_0_0': 'cd', 'x_0_1': 'bd', 'x_1_0': 'cd', 'x_1_1': 'oo'}. Best is trial 50 with value: 0.8214285714285714.
[I 2024-12-28 14:59:28,389] Trial 80 finished with value: 0.8214285714285714 and parameters: {'x_0_0': 'ac', 'x_0_1': 'oo', 'x_1_0': 'oo', 'x_1_1': 'bd'}. Best is trial 15 with value: 0.6964285714285714.
[I 2024-12-28 14:59:28,722] Trial 81 finished with value: 1.1428571428571428 and parameters: {'x_0_0': 'bd', 'x_0_1': 'ab', 'x_1_0': 'bc', 'x_1_1': 'ab'}. Best is trial 17 with value: 0.7857142857142857.
[I 2024-12-28 14:59:29,247] Trial 69 finished with value: 2.0 and parameters: {'x_0_0': 'cd', 'x_0_1': 'ab', 'x_1_0': 'bd', 'x_1_1': 'cd'}. Best is trial 7 with value: 0.5.
[I 2024-12-28 14:59:29,299] Trial 77 finished with value: 1.875 and parameters: {'x_0_0': 'cd', 'x_0_1': 'ab', 'x_1_0': 'bd', 'x_1_1': 'oo'}. Best is trial 73 with value: 0.7857142857142857.
[I 2024-12-28 14:59:29,402] Trial 75 finished with value: 1.4285714285714286 and parameters: {'x_0_0': 'bd', 'x_0_1': 'ac', 'x_1_0': 'ab', 'x_1_1': 'bc'}. Best is trial 21 with value: 0.7857142857142857.
[I 2024-12-28 14:59:29,693] Trial 80 finished with value: 1.625 and parameters: {'x_0_0': 'cd', 'x_0_1': 'ad', 'x_1_0': 'oo', 'x_1_1': 'oo'}. Best is trial 17 with value: 0.5.
[I 2024-12-28 14:59:29,699] Trial 67 finished with value: 1.3214285714285714 and parameters: {'x_0_0': 'bd', 'x_0_1': 'cd', 'x_1_0': 'oo', 'x_1_1': 'ac'}. Best is trial 47 with value: 0.6964285714285714.
[I 2024-12-28 14:59:29,873] Trial 75 finished with value: 1.3035714285714286 and parameters: {'x_0_0': 'ad', 'x_0_1': 'bd', 'x_1_0': 'ab', 'x_1_1': 'oo'}. Best is trial 43 with value: 0.6964285714285714.
[I 2024-12-28 14:59:30,299] Trial 82 finished with value: 1.875 and parameters: {'x_0_0': 'oo', 'x_0_1': 'bc', 'x_1_0': 'ac', 'x_1_1': 'ab'}. Best is trial 17 with value: 0.7857142857142857.
[I 2024-12-28 14:59:30,388] Trial 78 finished with value: 2.0 and parameters: {'x_0_0': 'cd', 'x_0_1': 'ab', 'x_1_0': 'ad', 'x_1_1': 'bd'}. Best is trial 73 with value: 0.7857142857142857.
[I 2024-12-28 14:59:30,582] Trial 80 finished with value: 1.875 and parameters: {'x_0_0': 'oo', 'x_0_1': 'ac', 'x_1_0': 'bd', 'x_1_1': 'ad'}. Best is trial 29 with value: 1.0.
[I 2024-12-28 14:59:30,738] Trial 81 finished with value: 1.75 and parameters: {'x_0_0': 'cd', 'x_0_1': 'bc', 'x_1_0': 'oo', 'x_1_1': 'ab'}. Best is trial 15 with value: 0.6964285714285714.
[I 2024-12-28 14:59:30,796] Trial 81 finished with value: 1.0714285714285714 and parameters: {'x_0_0': 'bd', 'x_0_1': 'oo', 'x_1_0': 'cd', 'x_1_1': 'cd'}. Best is trial 17 with value: 0.5.
[I 2024-12-28 14:59:31,399] Trial 84 finished with value: 1.5714285714285714 and parameters: {'x_0_0': 'ad', 'x_0_1': 'cd', 'x_1_0': 'cd', 'x_1_1': 'ad'}. Best is trial 50 with value: 0.8214285714285714.
