[I 2024-12-07 00:13:09,778] Trial 86 finished with value: 1.3444444444444446 and parameters: {'x_0_0': 'bd', 'x_0_1': 'ad', 'x_0_2': 'ab', 'x_1_0': 'bc', 'x_1_1': 'oo', 'x_1_2': 'bd'}. Best is trial 67 with value: 1.0222222222222221.
2024-12-07 00:13:18,711 - INFO - Candidate Mean Stats: {'Max': np.float64(2.0), 'Min': np.float64(0.156208253839486), 'Mean': np.float64(0.49494581017697525), 'Std': np.float64(0.07819576024197196)}
2024-12-07 00:13:18,711 - INFO - Candidate Std Stats: {'Max': np.float64(0.48853081367527973), 'Min': np.float64(0.0), 'Mean': np.float64(0.1191087024396653), 'Std': np.float64(0.05262004057000472)}
[I 2024-12-07 00:13:18,771] Trial 86 finished with value: 1.5555555555555556 and parameters: {'x_0_0': 'ac', 'x_0_1': 'ab', 'x_0_2': 'bc', 'x_1_0': 'ac', 'x_1_1': 'cd', 'x_1_2': 'cd'}. Best is trial 74 with value: 0.8222222222222222.
2024-12-07 00:13:27,457 - INFO - Candidate Mean Stats: {'Max': np.float64(2.0), 'Min': np.float64(0.2778772180164481), 'Mean': np.float64(0.49067788509261107), 'Std': np.float64(0.06460412724488009)}
2024-12-07 00:13:27,457 - INFO - Candidate Std Stats: {'Max': np.float64(0.3807413840010619), 'Min': np.float64(0.0), 'Mean': np.float64(0.10032947134031647), 'Std': np.float64(0.04151401364934708)}
[I 2024-12-07 00:13:27,505] Trial 87 finished with value: 1.2444444444444445 and parameters: {'x_0_0': 'ac', 'x_0_1': 'ac', 'x_0_2': 'bd', 'x_1_0': 'oo', 'x_1_1': 'ac', 'x_1_2': 'ad'}. Best is trial 63 with value: 1.1222222222222222.
2024-12-07 00:13:31,468 - INFO - Candidate Mean Stats: {'Max': np.float64(2.0), 'Min': np.float64(0.2569333938807767), 'Mean': np.float64(0.5000049641421551), 'Std': np.float64(0.06447646635752212)}
2024-12-07 00:13:31,468 - INFO - Candidate Std Stats: {'Max': np.float64(0.4117497782998946), 'Min': np.float64(0.0), 'Mean': np.float64(0.10211713406384851), 'Std': np.float64(0.04186486900011934)}
[I 2024-12-07 00:13:31,520] Trial 87 finished with value: 1.7777777777777777 and parameters: {'x_0_0': 'ab', 'x_0_1': 'ac', 'x_0_2': 'ad', 'x_1_0': 'ad', 'x_1_1': 'bd', 'x_1_2': 'bc'}. Best is trial 49 with value: 0.7999999999999999.
2024-12-07 00:13:33,125 - INFO - Candidate Mean Stats: {'Max': np.float64(2.0), 'Min': np.float64(0.2907123914122206), 'Mean': np.float64(0.4849574177852811), 'Std': np.float64(0.0707817114466202)}
2024-12-07 00:13:33,126 - INFO - Candidate Std Stats: {'Max': np.float64(1.6120199797081254), 'Min': np.float64(0.0), 'Mean': np.float64(0.11621222541099141), 'Std': np.float64(0.05851205959574639)}
[I 2024-12-07 00:13:33,172] Trial 87 finished with value: 1.5666666666666667 and parameters: {'x_0_0': 'bc', 'x_0_1': 'bc', 'x_0_2': 'ab', 'x_1_0': 'bd', 'x_1_1': 'bc', 'x_1_2': 'oo'}. Best is trial 67 with value: 1.0222222222222221.
2024-12-07 00:13:42,677 - INFO - Candidate Mean Stats: {'Max': np.float64(2.0), 'Min': np.float64(0.2802662784638363), 'Mean': np.float64(0.4847204475275219), 'Std': np.float64(0.0650117015527429)}
2024-12-07 00:13:42,678 - INFO - Candidate Std Stats: {'Max': np.float64(0.5241545308119212), 'Min': np.float64(0.0), 'Mean': np.float64(0.1059750664571491), 'Std': np.float64(0.04526299513976781)}
[I 2024-12-07 00:13:42,741] Trial 87 finished with value: 1.1666666666666665 and parameters: {'x_0_0': 'bd', 'x_0_1': 'oo', 'x_0_2': 'cd', 'x_1_0': 'cd', 'x_1_1': 'ad', 'x_1_2': 'oo'}. Best is trial 74 with value: 0.8222222222222222.
2024-12-07 00:13:51,217 - INFO - Candidate Mean Stats: {'Max': np.float64(2.0), 'Min': np.float64(0.23524771839982508), 'Mean': np.float64(0.49145440358158915), 'Std': np.float64(0.07142794601311996)}
2024-12-07 00:13:51,217 - INFO - Candidate Std Stats: {'Max': np.float64(0.4299332799377105), 'Min': np.float64(0.0), 'Mean': np.float64(0.1085884978949854), 'Std': np.float64(0.04498764162128795)}
[I 2024-12-07 00:13:51,267] Trial 88 finished with value: 1.0666666666666667 and parameters: {'x_0_0': 'bc', 'x_0_1': 'oo', 'x_0_2': 'cd', 'x_1_0': 'ac', 'x_1_1': 'oo', 'x_1_2': 'oo'}. Best is trial 88 with value: 1.0666666666666667.
2024-12-07 00:13:55,652 - INFO - Candidate Mean Stats: {'Max': np.float64(2.0), 'Min': np.float64(0.1815784196818387), 'Mean': np.float64(0.4904060427308129), 'Std': np.float64(0.06830774484089774)}
2024-12-07 00:13:55,654 - INFO - Candidate Std Stats: {'Max': np.float64(0.6475949107462151), 'Min': np.float64(0.0), 'Mean': np.float64(0.10404887419488959), 'Std': np.float64(0.04677456162767262)}
[I 2024-12-07 00:13:55,703] Trial 88 finished with value: 1.5555555555555556 and parameters: {'x_0_0': 'bd', 'x_0_1': 'ad', 'x_0_2': 'cd', 'x_1_0': 'ab', 'x_1_1': 'bc', 'x_1_2': 'ab'}. Best is trial 49 with value: 0.7999999999999999.
2024-12-07 00:13:57,523 - INFO - Candidate Mean Stats: {'Max': np.float64(2.0), 'Min': np.float64(0.12200066812300539), 'Mean': np.float64(0.4882681452046653), 'Std': np.float64(0.07537567889622229)}
2024-12-07 00:13:57,524 - INFO - Candidate Std Stats: {'Max': np.float64(1.2052663476904073), 'Min': np.float64(0.0), 'Mean': np.float64(0.12044638218355254), 'Std': np.float64(0.0581304545704696)}
[I 2024-12-07 00:13:57,575] Trial 88 finished with value: 1.4555555555555557 and parameters: {'x_0_0': 'bc', 'x_0_1': 'ab', 'x_0_2': 'ac', 'x_1_0': 'ad', 'x_1_1': 'bd', 'x_1_2': 'oo'}. Best is trial 67 with value: 1.0222222222222221.
2024-12-07 00:14:07,079 - INFO - Candidate Mean Stats: {'Max': np.float64(2.0), 'Min': np.float64(0.22142477090374837), 'Mean': np.float64(0.48783776261546835), 'Std': np.float64(0.07120487294049017)}
2024-12-07 00:14:07,079 - INFO - Candidate Std Stats: {'Max': np.float64(0.9788952308666796), 'Min': np.float64(0.0), 'Mean': np.float64(0.11434383153772538), 'Std': np.float64(0.05462713882071961)}
[I 2024-12-07 00:14:07,127] Trial 88 finished with value: 1.1555555555555554 and parameters: {'x_0_0': 'ad', 'x_0_1': 'oo', 'x_0_2': 'cd', 'x_1_0': 'ab', 'x_1_1': 'ac', 'x_1_2': 'ac'}. Best is trial 74 with value: 0.8222222222222222.
2024-12-07 00:14:14,565 - INFO - Candidate Mean Stats: {'Max': np.float64(2.0), 'Min': np.float64(0.2577442895811279), 'Mean': np.float64(0.4952332420005559), 'Std': np.float64(0.06571115770381036)}
2024-12-07 00:14:14,567 - INFO - Candidate Std Stats: {'Max': np.float64(0.3591095780414774), 'Min': np.float64(0.0), 'Mean': np.float64(0.09839478165769396), 'Std': np.float64(0.0407223915972836)}
[I 2024-12-07 00:14:14,632] Trial 89 finished with value: 1.5555555555555556 and parameters: {'x_0_0': 'bc', 'x_0_1': 'ab', 'x_0_2': 'bc', 'x_1_0': 'bd', 'x_1_1': 'bd', 'x_1_2': 'bd'}. Best is trial 88 with value: 1.0666666666666667.
2024-12-07 00:14:18,439 - INFO - Candidate Mean Stats: {'Max': np.float64(2.0), 'Min': np.float64(0.19365227141567307), 'Mean': np.float64(0.48531297695164805), 'Std': np.float64(0.072981262733739)}
2024-12-07 00:14:18,440 - INFO - Candidate Std Stats: {'Max': np.float64(1.0008739360730605), 'Min': np.float64(0.0), 'Mean': np.float64(0.117084191065896), 'Std': np.float64(0.053653813819790244)}
[I 2024-12-07 00:14:18,486] Trial 89 finished with value: 1.7 and parameters: {'x_0_0': 'oo', 'x_0_1': 'ab', 'x_0_2': 'ad', 'x_1_0': 'oo', 'x_1_1': 'ab', 'x_1_2': 'ac'}. Best is trial 49 with value: 0.7999999999999999.
2024-12-07 00:14:20,344 - INFO - Candidate Mean Stats: {'Max': np.float64(2.0), 'Min': np.float64(0.27647082984700644), 'Mean': np.float64(0.4912746163582932), 'Std': np.float64(0.0677035956295015)}
2024-12-07 00:14:20,344 - INFO - Candidate Std Stats: {'Max': np.float64(0.9737098522658159), 'Min': np.float64(0.0), 'Mean': np.float64(0.10804827746777275), 'Std': np.float64(0.047198549052058884)}
[I 2024-12-07 00:14:20,391] Trial 89 finished with value: 1.6666666666666665 and parameters: {'x_0_0': 'ad', 'x_0_1': 'bd', 'x_0_2': 'cd', 'x_1_0': 'cd', 'x_1_1': 'ad', 'x_1_2': 'cd'}. Best is trial 67 with value: 1.0222222222222221.
2024-12-07 00:14:30,205 - INFO - Candidate Mean Stats: {'Max': np.float64(2.0), 'Min': np.float64(0.1655802089006812), 'Mean': np.float64(0.4825486222153034), 'Std': np.float64(0.062246293860293775)}
2024-12-07 00:14:30,206 - INFO - Candidate Std Stats: {'Max': np.float64(0.40537642506359134), 'Min': np.float64(0.0), 'Mean': np.float64(0.10573931344576822), 'Std': np.float64(0.04528372140801879)}
[I 2024-12-07 00:14:30,257] Trial 89 finished with value: 1.4666666666666666 and parameters: {'x_0_0': 'bc', 'x_0_1': 'bc', 'x_0_2': 'ac', 'x_1_0': 'oo', 'x_1_1': 'bd', 'x_1_2': 'ad'}. Best is trial 74 with value: 0.8222222222222222.
2024-12-07 00:14:40,846 - INFO - Candidate Mean Stats: {'Max': np.float64(2.0), 'Min': np.float64(0.17748502695427631), 'Mean': np.float64(0.47943463583066265), 'Std': np.float64(0.07082822815983651)}
2024-12-07 00:14:40,847 - INFO - Candidate Std Stats: {'Max': np.float64(0.7321176576194002), 'Min': np.float64(0.0), 'Mean': np.float64(0.11028089654573159), 'Std': np.float64(0.0510485029148004)}
[I 2024-12-07 00:14:40,898] Trial 90 finished with value: 1.3444444444444446 and parameters: {'x_0_0': 'bd', 'x_0_1': 'ab', 'x_0_2': 'bd', 'x_1_0': 'bc', 'x_1_1': 'oo', 'x_1_2': 'bc'}. Best is trial 88 with value: 1.0666666666666667.
2024-12-07 00:14:44,370 - INFO - Candidate Mean Stats: {'Max': np.float64(2.0), 'Min': np.float64(0.2660403511549711), 'Mean': np.float64(0.49616683104959214), 'Std': np.float64(0.06875668233949148)}
2024-12-07 00:14:44,370 - INFO - Candidate Std Stats: {'Max': np.float64(0.6960404532236926), 'Min': np.float64(0.0), 'Mean': np.float64(0.1075433328231029), 'Std': np.float64(0.04710218301019921)}
[I 2024-12-07 00:14:44,419] Trial 90 finished with value: 1.1222222222222222 and parameters: {'x_0_0': 'bc', 'x_0_1': 'ad', 'x_0_2': 'ad', 'x_1_0': 'cd', 'x_1_1': 'bc', 'x_1_2': 'oo'}. Best is trial 49 with value: 0.7999999999999999.
2024-12-07 00:14:46,515 - INFO - Candidate Mean Stats: {'Max': np.float64(2.0), 'Min': np.float64(0.25172657988391284), 'Mean': np.float64(0.5005657033807239), 'Std': np.float64(0.07093457114649458)}
2024-12-07 00:14:46,516 - INFO - Candidate Std Stats: {'Max': np.float64(0.44524987141006667), 'Min': np.float64(0.0), 'Mean': np.float64(0.10767211195835628), 'Std': np.float64(0.04455615708993265)}
[I 2024-12-07 00:14:46,566] Trial 90 finished with value: 1.4555555555555557 and parameters: {'x_0_0': 'bd', 'x_0_1': 'bc', 'x_0_2': 'bc', 'x_1_0': 'ab', 'x_1_1': 'bd', 'x_1_2': 'oo'}. Best is trial 67 with value: 1.0222222222222221.
2024-12-07 00:14:55,678 - INFO - Candidate Mean Stats: {'Max': np.float64(2.0), 'Min': np.float64(0.21590246133103771), 'Mean': np.float64(0.49431837760449326), 'Std': np.float64(0.06441718499957168)}
2024-12-07 00:14:55,678 - INFO - Candidate Std Stats: {'Max': np.float64(0.42114461686127247), 'Min': np.float64(0.0), 'Mean': np.float64(0.10964817620784151), 'Std': np.float64(0.045707830414898946)}
[I 2024-12-07 00:14:55,726] Trial 90 finished with value: 1.4444444444444444 and parameters: {'x_0_0': 'bd', 'x_0_1': 'ab', 'x_0_2': 'bc', 'x_1_0': 'bd', 'x_1_1': 'ab', 'x_1_2': 'ab'}. Best is trial 74 with value: 0.8222222222222222.
2024-12-07 00:15:03,391 - INFO - Candidate Mean Stats: {'Max': np.float64(2.0), 'Min': np.float64(0.28704338459789264), 'Mean': np.float64(0.489767777898506), 'Std': np.float64(0.05845378968211626)}
2024-12-07 00:15:03,391 - INFO - Candidate Std Stats: {'Max': np.float64(0.39608776440484766), 'Min': np.float64(0.0), 'Mean': np.float64(0.10721195723022486), 'Std': np.float64(0.04382535710044548)}
[I 2024-12-07 00:15:03,445] Trial 91 finished with value: 1.4444444444444444 and parameters: {'x_0_0': 'ad', 'x_0_1': 'bd', 'x_0_2': 'ad', 'x_1_0': 'bd', 'x_1_1': 'bd', 'x_1_2': 'bc'}. Best is trial 88 with value: 1.0666666666666667.
2024-12-07 00:15:06,912 - INFO - Candidate Mean Stats: {'Max': np.float64(2.0), 'Min': np.float64(0.300008458748832), 'Mean': np.float64(0.4841547943686272), 'Std': np.float64(0.0631420988821487)}
2024-12-07 00:15:06,912 - INFO - Candidate Std Stats: {'Max': np.float64(0.8811896589129761), 'Min': np.float64(0.0), 'Mean': np.float64(0.10640049102312364), 'Std': np.float64(0.04840982544791114)}
[I 2024-12-07 00:15:06,963] Trial 91 finished with value: 1.4666666666666666 and parameters: {'x_0_0': 'bd', 'x_0_1': 'ac', 'x_0_2': 'ab', 'x_1_0': 'oo', 'x_1_1': 'ac', 'x_1_2': 'ac'}. Best is trial 49 with value: 0.7999999999999999.
2024-12-07 00:15:08,900 - INFO - Candidate Mean Stats: {'Max': np.float64(2.0), 'Min': np.float64(0.24364277230149484), 'Mean': np.float64(0.49265380465154013), 'Std': np.float64(0.06202377600540198)}
2024-12-07 00:15:08,900 - INFO - Candidate Std Stats: {'Max': np.float64(1.167798555738928), 'Min': np.float64(0.0), 'Mean': np.float64(0.10111103283836867), 'Std': np.float64(0.04566280256711374)}
[I 2024-12-07 00:15:08,945] Trial 91 finished with value: 1.6666666666666665 and parameters: {'x_0_0': 'bc', 'x_0_1': 'bd', 'x_0_2': 'ac', 'x_1_0': 'bc', 'x_1_1': 'bc', 'x_1_2': 'ad'}. Best is trial 67 with value: 1.0222222222222221.
2024-12-07 00:15:18,175 - INFO - Candidate Mean Stats: {'Max': np.float64(2.0), 'Min': np.float64(0.2512570282490682), 'Mean': np.float64(0.4861711300877138), 'Std': np.float64(0.06554667972112693)}
2024-12-07 00:15:18,175 - INFO - Candidate Std Stats: {'Max': np.float64(1.3926526536495758), 'Min': np.float64(0.0), 'Mean': np.float64(0.11196135413153147), 'Std': np.float64(0.05585530375890162)}
[I 2024-12-07 00:15:18,222] Trial 91 finished with value: 1.3333333333333333 and parameters: {'x_0_0': 'ac', 'x_0_1': 'ac', 'x_0_2': 'ab', 'x_1_0': 'bc', 'x_1_1': 'bd', 'x_1_2': 'ab'}. Best is trial 74 with value: 0.8222222222222222.
2024-12-07 00:15:25,674 - INFO - Candidate Mean Stats: {'Max': np.float64(2.0), 'Min': np.float64(0.263512578393856), 'Mean': np.float64(0.4929700738998695), 'Std': np.float64(0.06404953369997914)}
2024-12-07 00:15:25,675 - INFO - Candidate Std Stats: {'Max': np.float64(0.357878107507898), 'Min': np.float64(0.0), 'Mean': np.float64(0.10364411251758249), 'Std': np.float64(0.04185087724960417)}
[I 2024-12-07 00:15:25,721] Trial 92 finished with value: 1.4444444444444444 and parameters: {'x_0_0': 'ad', 'x_0_1': 'cd', 'x_0_2': 'ad', 'x_1_0': 'bd', 'x_1_1': 'bc', 'x_1_2': 'ac'}. Best is trial 88 with value: 1.0666666666666667.
2024-12-07 00:15:29,038 - INFO - Candidate Mean Stats: {'Max': np.float64(2.0), 'Min': np.float64(0.2846116772255887), 'Mean': np.float64(0.4948143605574034), 'Std': np.float64(0.06000560028965788)}
2024-12-07 00:15:29,038 - INFO - Candidate Std Stats: {'Max': np.float64(0.44420014083037035), 'Min': np.float64(0.0), 'Mean': np.float64(0.11366829088417256), 'Std': np.float64(0.04577170658562318)}
[I 2024-12-07 00:15:29,085] Trial 92 finished with value: 1.4444444444444444 and parameters: {'x_0_0': 'ac', 'x_0_1': 'ad', 'x_0_2': 'bd', 'x_1_0': 'bd', 'x_1_1': 'ad', 'x_1_2': 'ac'}. Best is trial 49 with value: 0.7999999999999999.
2024-12-07 00:15:31,163 - INFO - Candidate Mean Stats: {'Max': np.float64(2.0), 'Min': np.float64(0.19404776666729084), 'Mean': np.float64(0.4831975762589695), 'Std': np.float64(0.07034251622228048)}
2024-12-07 00:15:31,164 - INFO - Candidate Std Stats: {'Max': np.float64(0.5278876350518381), 'Min': np.float64(0.0), 'Mean': np.float64(0.11463833494995605), 'Std': np.float64(0.05091897331723963)}
[I 2024-12-07 00:15:31,209] Trial 92 finished with value: 1.2444444444444445 and parameters: {'x_0_0': 'bc', 'x_0_1': 'ac', 'x_0_2': 'oo', 'x_1_0': 'bd', 'x_1_1': 'oo', 'x_1_2': 'ac'}. Best is trial 67 with value: 1.0222222222222221.
2024-12-07 00:15:40,678 - INFO - Candidate Mean Stats: {'Max': np.float64(2.0), 'Min': np.float64(0.255476906592579), 'Mean': np.float64(0.4833780237736616), 'Std': np.float64(0.0685622410466451)}
2024-12-07 00:15:40,678 - INFO - Candidate Std Stats: {'Max': np.float64(1.971077048929136), 'Min': np.float64(0.0), 'Mean': np.float64(0.11227826361493545), 'Std': np.float64(0.059277369764862864)}
[I 2024-12-07 00:15:40,728] Trial 92 finished with value: 1.2666666666666666 and parameters: {'x_0_0': 'ac', 'x_0_1': 'oo', 'x_0_2': 'bd', 'x_1_0': 'cd', 'x_1_1': 'ac', 'x_1_2': 'bd'}. Best is trial 74 with value: 0.8222222222222222.
2024-12-07 00:15:47,894 - INFO - Candidate Mean Stats: {'Max': np.float64(2.0), 'Min': np.float64(0.21966354944872934), 'Mean': np.float64(0.4776788076571768), 'Std': np.float64(0.07138858783464215)}
2024-12-07 00:15:47,896 - INFO - Candidate Std Stats: {'Max': np.float64(1.5763888502663765), 'Min': np.float64(0.0), 'Mean': np.float64(0.1064525918549821), 'Std': np.float64(0.052782459320767715)}
[I 2024-12-07 00:15:47,941] Trial 93 finished with value: 1.5777777777777777 and parameters: {'x_0_0': 'ab', 'x_0_1': 'cd', 'x_0_2': 'ad', 'x_1_0': 'oo', 'x_1_1': 'ab', 'x_1_2': 'ac'}. Best is trial 88 with value: 1.0666666666666667.
2024-12-07 00:15:51,027 - INFO - Candidate Mean Stats: {'Max': np.float64(2.0), 'Min': np.float64(0.16282722150496265), 'Mean': np.float64(0.4941618221496292), 'Std': np.float64(0.062422353203612516)}
2024-12-07 00:15:51,028 - INFO - Candidate Std Stats: {'Max': np.float64(0.8483647966211396), 'Min': np.float64(0.0), 'Mean': np.float64(0.10841673600103019), 'Std': np.float64(0.0526435487587351)}
[I 2024-12-07 00:15:51,081] Trial 93 finished with value: 1.7777777777777777 and parameters: {'x_0_0': 'ab', 'x_0_1': 'ac', 'x_0_2': 'ad', 'x_1_0': 'bc', 'x_1_1': 'ad', 'x_1_2': 'ab'}. Best is trial 49 with value: 0.7999999999999999.
2024-12-07 00:15:53,496 - INFO - Candidate Mean Stats: {'Max': np.float64(2.0), 'Min': np.float64(0.21910866081118793), 'Mean': np.float64(0.48518184260833613), 'Std': np.float64(0.06511722167335172)}
2024-12-07 00:15:53,497 - INFO - Candidate Std Stats: {'Max': np.float64(0.5129034170784125), 'Min': np.float64(0.0), 'Mean': np.float64(0.10960137551179414), 'Std': np.float64(0.04950489390833627)}
[I 2024-12-07 00:15:53,542] Trial 93 finished with value: 1.2222222222222223 and parameters: {'x_0_0': 'ad', 'x_0_1': 'ab', 'x_0_2': 'ad', 'x_1_0': 'bc', 'x_1_1': 'ad', 'x_1_2': 'bc'}. Best is trial 67 with value: 1.0222222222222221.
2024-12-07 00:16:03,531 - INFO - Candidate Mean Stats: {'Max': np.float64(2.0), 'Min': np.float64(0.2731543316705131), 'Mean': np.float64(0.49279128564234526), 'Std': np.float64(0.06377069218827296)}
2024-12-07 00:16:03,532 - INFO - Candidate Std Stats: {'Max': np.float64(0.3820025550358037), 'Min': np.float64(0.0), 'Mean': np.float64(0.10746505548503538), 'Std': np.float64(0.04329910451191882)}
[I 2024-12-07 00:16:03,577] Trial 93 finished with value: 1.3777777777777778 and parameters: {'x_0_0': 'ab', 'x_0_1': 'bd', 'x_0_2': 'ac', 'x_1_0': 'oo', 'x_1_1': 'oo', 'x_1_2': 'oo'}. Best is trial 74 with value: 0.8222222222222222.
2024-12-07 00:16:10,500 - INFO - Candidate Mean Stats: {'Max': np.float64(2.0), 'Min': np.float64(0.26260517512346004), 'Mean': np.float64(0.47689566029158487), 'Std': np.float64(0.06951576201116844)}
2024-12-07 00:16:10,501 - INFO - Candidate Std Stats: {'Max': np.float64(1.1654712988149312), 'Min': np.float64(0.0), 'Mean': np.float64(0.11932988662200777), 'Std': np.float64(0.0575779701048179)}
[I 2024-12-07 00:16:10,547] Trial 94 finished with value: 1.2222222222222223 and parameters: {'x_0_0': 'ac', 'x_0_1': 'ad', 'x_0_2': 'bd', 'x_1_0': 'ac', 'x_1_1': 'bc', 'x_1_2': 'bc'}. Best is trial 88 with value: 1.0666666666666667.
2024-12-07 00:16:14,195 - INFO - Candidate Mean Stats: {'Max': np.float64(2.0), 'Min': np.float64(0.321824366484642), 'Mean': np.float64(0.49906992581734544), 'Std': np.float64(0.059582708962570986)}
2024-12-07 00:16:14,195 - INFO - Candidate Std Stats: {'Max': np.float64(0.6504757206603377), 'Min': np.float64(0.0), 'Mean': np.float64(0.10044331397180108), 'Std': np.float64(0.043254681249133405)}
[I 2024-12-07 00:16:14,247] Trial 94 finished with value: 0.9444444444444444 and parameters: {'x_0_0': 'bd', 'x_0_1': 'oo', 'x_0_2': 'oo', 'x_1_0': 'bc', 'x_1_1': 'bc', 'x_1_2': 'bc'}. Best is trial 49 with value: 0.7999999999999999.
2024-12-07 00:16:16,664 - INFO - Candidate Mean Stats: {'Max': np.float64(2.0), 'Min': np.float64(0.1933985757768381), 'Mean': np.float64(0.4774608670516357), 'Std': np.float64(0.06603031592140114)}
2024-12-07 00:16:16,665 - INFO - Candidate Std Stats: {'Max': np.float64(0.4612581841124412), 'Min': np.float64(0.0), 'Mean': np.float64(0.1113050322514461), 'Std': np.float64(0.05004011474738079)}
[I 2024-12-07 00:16:16,710] Trial 94 finished with value: 1.0444444444444443 and parameters: {'x_0_0': 'ad', 'x_0_1': 'oo', 'x_0_2': 'bc', 'x_1_0': 'bd', 'x_1_1': 'bd', 'x_1_2': 'ab'}. Best is trial 67 with value: 1.0222222222222221.
2024-12-07 00:16:26,927 - INFO - Candidate Mean Stats: {'Max': np.float64(2.0), 'Min': np.float64(0.29868297884753975), 'Mean': np.float64(0.4924922490455156), 'Std': np.float64(0.0658312227989201)}
2024-12-07 00:16:26,928 - INFO - Candidate Std Stats: {'Max': np.float64(0.6026505918653952), 'Min': np.float64(0.0), 'Mean': np.float64(0.10774689675639545), 'Std': np.float64(0.047985475639643504)}
[I 2024-12-07 00:16:26,974] Trial 94 finished with value: 1.4666666666666666 and parameters: {'x_0_0': 'bd', 'x_0_1': 'ac', 'x_0_2': 'ab', 'x_1_0': 'oo', 'x_1_1': 'bd', 'x_1_2': 'bd'}. Best is trial 74 with value: 0.8222222222222222.
2024-12-07 00:16:33,838 - INFO - Candidate Mean Stats: {'Max': np.float64(2.0), 'Min': np.float64(0.27928208830600987), 'Mean': np.float64(0.4978301703659389), 'Std': np.float64(0.06392852667467329)}
2024-12-07 00:16:33,839 - INFO - Candidate Std Stats: {'Max': np.float64(0.3788551513812839), 'Min': np.float64(0.0), 'Mean': np.float64(0.10978329447097322), 'Std': np.float64(0.0440389866958765)}
