[I 2024-12-06 23:36:27,689] Trial 70 finished with value: 0.8214285714285714 and parameters: {'x_0_0': 'ad', 'x_0_1': 'oo', 'x_1_0': 'oo', 'x_1_1': 'ab'}. Best is trial 50 with value: 0.6607142857142857.
2024-12-06 23:36:27,864 - INFO - Candidate Mean Stats: {'Max': np.float64(2.0), 'Min': np.float64(-1.1543711749899526), 'Mean': np.float64(0.2795230353880127), 'Std': np.float64(0.4345040465928847)}
2024-12-06 23:36:27,864 - INFO - Candidate Std Stats: {'Max': np.float64(1.7501929154954181), 'Min': np.float64(0.0), 'Mean': np.float64(0.6377054762659097), 'Std': np.float64(0.28303428151714555)}
[I 2024-12-06 23:36:27,876] Trial 70 finished with value: 1.0714285714285714 and parameters: {'x_0_0': 'bc', 'x_0_1': 'oo', 'x_1_0': 'bc', 'x_1_1': 'ab'}. Best is trial 23 with value: 0.5.
2024-12-06 23:36:27,964 - INFO - Candidate Mean Stats: {'Max': np.float64(2.0), 'Min': np.float64(-0.9929549402994937), 'Mean': np.float64(0.2672745467646328), 'Std': np.float64(0.4601412343000475)}
2024-12-06 23:36:27,964 - INFO - Candidate Std Stats: {'Max': np.float64(1.819937328030732), 'Min': np.float64(0.0), 'Mean': np.float64(0.5853185646130596), 'Std': np.float64(0.2496340513618718)}
[I 2024-12-06 23:36:27,976] Trial 71 finished with value: 1.0714285714285714 and parameters: {'x_0_0': 'bc', 'x_0_1': 'oo', 'x_1_0': 'cd', 'x_1_1': 'cd'}. Best is trial 63 with value: 0.5.
2024-12-06 23:36:27,997 - INFO - Candidate Mean Stats: {'Max': np.float64(2.0080833173859096), 'Min': np.float64(-1.1508993377686676), 'Mean': np.float64(0.2434171956007635), 'Std': np.float64(0.48869288334769523)}
2024-12-06 23:36:27,997 - INFO - Candidate Std Stats: {'Max': np.float64(1.6634988547320262), 'Min': np.float64(0.0), 'Mean': np.float64(0.7095996497554807), 'Std': np.float64(0.29161323680217704)}
2024-12-06 23:36:28,003 - INFO - Candidate Mean Stats: {'Max': np.float64(2.384703605151585), 'Min': np.float64(-1.30849776743587), 'Mean': np.float64(0.23831031547549433), 'Std': np.float64(0.5254156979195401)}
2024-12-06 23:36:28,003 - INFO - Candidate Std Stats: {'Max': np.float64(1.7089571061009545), 'Min': np.float64(0.0), 'Mean': np.float64(0.6185164608809176), 'Std': np.float64(0.26626157351803437)}
[I 2024-12-06 23:36:28,009] Trial 71 finished with value: 1.3214285714285714 and parameters: {'x_0_0': 'ad', 'x_0_1': 'ab', 'x_1_0': 'oo', 'x_1_1': 'bc'}. Best is trial 68 with value: 0.6607142857142857.
[I 2024-12-06 23:36:28,015] Trial 71 finished with value: 1.1964285714285714 and parameters: {'x_0_0': 'bc', 'x_0_1': 'cd', 'x_1_0': 'oo', 'x_1_1': 'oo'}. Best is trial 50 with value: 0.6607142857142857.
2024-12-06 23:36:28,190 - INFO - Candidate Mean Stats: {'Max': np.float64(2.0), 'Min': np.float64(-1.1457940828257633), 'Mean': np.float64(0.3182166098200887), 'Std': np.float64(0.4355902604541344)}
2024-12-06 23:36:28,190 - INFO - Candidate Std Stats: {'Max': np.float64(1.6439854047132338), 'Min': np.float64(0.0), 'Mean': np.float64(0.5622850913264267), 'Std': np.float64(0.24421628618431562)}
[I 2024-12-06 23:36:28,203] Trial 71 finished with value: 1.0714285714285714 and parameters: {'x_0_0': 'bc', 'x_0_1': 'oo', 'x_1_0': 'ac', 'x_1_1': 'ac'}. Best is trial 23 with value: 0.5.
2024-12-06 23:36:28,288 - INFO - Candidate Mean Stats: {'Max': np.float64(2.0), 'Min': np.float64(-0.882302297144655), 'Mean': np.float64(0.2637163985735611), 'Std': np.float64(0.42961345430012604)}
2024-12-06 23:36:28,288 - INFO - Candidate Std Stats: {'Max': np.float64(1.796822893213855), 'Min': np.float64(0.0), 'Mean': np.float64(0.5918302974755106), 'Std': np.float64(0.2569179467054362)}
[I 2024-12-06 23:36:28,300] Trial 72 finished with value: 1.2857142857142856 and parameters: {'x_0_0': 'ad', 'x_0_1': 'bc', 'x_1_0': 'bc', 'x_1_1': 'bd'}. Best is trial 63 with value: 0.5.
2024-12-06 23:36:28,324 - INFO - Candidate Mean Stats: {'Max': np.float64(2.1399019865338422), 'Min': np.float64(-1.2099052345414925), 'Mean': np.float64(0.23515876582909498), 'Std': np.float64(0.5187198233723043)}
2024-12-06 23:36:28,324 - INFO - Candidate Std Stats: {'Max': np.float64(1.573892064328241), 'Min': np.float64(0.0), 'Mean': np.float64(0.5967227518795982), 'Std': np.float64(0.25307861912386664)}
2024-12-06 23:36:28,328 - INFO - Candidate Mean Stats: {'Max': np.float64(2.0662644766535667), 'Min': np.float64(-0.9802030091489261), 'Mean': np.float64(0.32482608430984533), 'Std': np.float64(0.4450062620081685)}
2024-12-06 23:36:28,328 - INFO - Candidate Std Stats: {'Max': np.float64(1.8307305113896748), 'Min': np.float64(0.0), 'Mean': np.float64(0.5684331064965059), 'Std': np.float64(0.2518469560951939)}
[I 2024-12-06 23:36:28,337] Trial 72 finished with value: 0.8214285714285714 and parameters: {'x_0_0': 'ac', 'x_0_1': 'oo', 'x_1_0': 'oo', 'x_1_1': 'ad'}. Best is trial 68 with value: 0.6607142857142857.
[I 2024-12-06 23:36:28,340] Trial 72 finished with value: 1.4464285714285714 and parameters: {'x_0_0': 'ad', 'x_0_1': 'cd', 'x_1_0': 'ac', 'x_1_1': 'oo'}. Best is trial 50 with value: 0.6607142857142857.
2024-12-06 23:36:28,516 - INFO - Candidate Mean Stats: {'Max': np.float64(2.0), 'Min': np.float64(-0.957178278262243), 'Mean': np.float64(0.26596583433201415), 'Std': np.float64(0.44200357753061287)}
2024-12-06 23:36:28,516 - INFO - Candidate Std Stats: {'Max': np.float64(1.7106855313350788), 'Min': np.float64(0.0), 'Mean': np.float64(0.5433572693465062), 'Std': np.float64(0.24237181315543835)}
[I 2024-12-06 23:36:28,528] Trial 72 finished with value: 1.2857142857142856 and parameters: {'x_0_0': 'ad', 'x_0_1': 'bc', 'x_1_0': 'bd', 'x_1_1': 'bc'}. Best is trial 23 with value: 0.5.
2024-12-06 23:36:28,619 - INFO - Candidate Mean Stats: {'Max': np.float64(2.0), 'Min': np.float64(-1.0144545582865259), 'Mean': np.float64(0.35739896297490553), 'Std': np.float64(0.44605873970903104)}
2024-12-06 23:36:28,619 - INFO - Candidate Std Stats: {'Max': np.float64(1.6889905175557534), 'Min': np.float64(0.0), 'Mean': np.float64(0.5053465578533654), 'Std': np.float64(0.24012696327371238)}
[I 2024-12-06 23:36:28,632] Trial 73 finished with value: 1.0714285714285714 and parameters: {'x_0_0': 'bd', 'x_0_1': 'oo', 'x_1_0': 'ad', 'x_1_1': 'ad'}. Best is trial 63 with value: 0.5.
2024-12-06 23:36:28,656 - INFO - Candidate Mean Stats: {'Max': np.float64(2.288971134329699), 'Min': np.float64(-1.4732636239590955), 'Mean': np.float64(0.30454896916268837), 'Std': np.float64(0.48336312724451364)}
2024-12-06 23:36:28,656 - INFO - Candidate Std Stats: {'Max': np.float64(1.4108524029831728), 'Min': np.float64(0.0), 'Mean': np.float64(0.5554151553457559), 'Std': np.float64(0.2524734120448765)}
2024-12-06 23:36:28,657 - INFO - Candidate Mean Stats: {'Max': np.float64(2.0), 'Min': np.float64(-1.2445164983541828), 'Mean': np.float64(0.321338855001207), 'Std': np.float64(0.4721027647163934)}
2024-12-06 23:36:28,657 - INFO - Candidate Std Stats: {'Max': np.float64(1.6922582639327945), 'Min': np.float64(0.0), 'Mean': np.float64(0.5696791440983163), 'Std': np.float64(0.2525241576798209)}
[I 2024-12-06 23:36:28,670] Trial 73 finished with value: 1.0714285714285714 and parameters: {'x_0_0': 'ac', 'x_0_1': 'oo', 'x_1_0': 'ac', 'x_1_1': 'cd'}. Best is trial 68 with value: 0.6607142857142857.
[I 2024-12-06 23:36:28,671] Trial 73 finished with value: 1.25 and parameters: {'x_0_0': 'oo', 'x_0_1': 'oo', 'x_1_0': 'ad', 'x_1_1': 'oo'}. Best is trial 50 with value: 0.6607142857142857.
2024-12-06 23:36:28,846 - INFO - Candidate Mean Stats: {'Max': np.float64(2.0), 'Min': np.float64(-0.9099147659992974), 'Mean': np.float64(0.2800847887518808), 'Std': np.float64(0.4453430910571086)}
2024-12-06 23:36:28,846 - INFO - Candidate Std Stats: {'Max': np.float64(1.7184007524198108), 'Min': np.float64(0.0), 'Mean': np.float64(0.6179798114662625), 'Std': np.float64(0.2643856252785033)}
[I 2024-12-06 23:36:28,858] Trial 73 finished with value: 1.2142857142857144 and parameters: {'x_0_0': 'ab', 'x_0_1': 'oo', 'x_1_0': 'ab', 'x_1_1': 'bc'}. Best is trial 23 with value: 0.5.
2024-12-06 23:36:28,958 - INFO - Candidate Mean Stats: {'Max': np.float64(2.0), 'Min': np.float64(-0.9338186710254094), 'Mean': np.float64(0.25698358126870857), 'Std': np.float64(0.4388436553098771)}
2024-12-06 23:36:28,958 - INFO - Candidate Std Stats: {'Max': np.float64(1.6272024490151225), 'Min': np.float64(0.0), 'Mean': np.float64(0.5330470405098218), 'Std': np.float64(0.24006992744406724)}
[I 2024-12-06 23:36:28,970] Trial 74 finished with value: 0.9285714285714286 and parameters: {'x_0_0': 'ad', 'x_0_1': 'oo', 'x_1_0': 'ab', 'x_1_1': 'cd'}. Best is trial 63 with value: 0.5.
2024-12-06 23:36:28,987 - INFO - Candidate Mean Stats: {'Max': np.float64(2.3416241125835624), 'Min': np.float64(-1.4956390949784246), 'Mean': np.float64(0.2444609546824484), 'Std': np.float64(0.5327224919176852)}
2024-12-06 23:36:28,987 - INFO - Candidate Std Stats: {'Max': np.float64(1.579349544916546), 'Min': np.float64(0.0), 'Mean': np.float64(0.6204258252218278), 'Std': np.float64(0.27335196036100134)}
2024-12-06 23:36:28,989 - INFO - Candidate Mean Stats: {'Max': np.float64(2.247283165829413), 'Min': np.float64(-1.0974518072806467), 'Mean': np.float64(0.3264843079911046), 'Std': np.float64(0.46723579925996267)}
2024-12-06 23:36:28,989 - INFO - Candidate Std Stats: {'Max': np.float64(1.747404954586391), 'Min': np.float64(0.0), 'Mean': np.float64(0.5779980876703182), 'Std': np.float64(0.24895275464763825)}
[I 2024-12-06 23:36:29,001] Trial 74 finished with value: 1.0714285714285714 and parameters: {'x_0_0': 'bc', 'x_0_1': 'oo', 'x_1_0': 'ad', 'x_1_1': 'bc'}. Best is trial 50 with value: 0.6607142857142857.
[I 2024-12-06 23:36:29,002] Trial 74 finished with value: 1.0714285714285714 and parameters: {'x_0_0': 'bd', 'x_0_1': 'oo', 'x_1_0': 'ac', 'x_1_1': 'ac'}. Best is trial 68 with value: 0.6607142857142857.
2024-12-06 23:36:29,185 - INFO - Candidate Mean Stats: {'Max': np.float64(2.0), 'Min': np.float64(-1.1346701837367448), 'Mean': np.float64(0.32625668885594133), 'Std': np.float64(0.4426096086912118)}
2024-12-06 23:36:29,185 - INFO - Candidate Std Stats: {'Max': np.float64(1.5596310295085591), 'Min': np.float64(0.0), 'Mean': np.float64(0.5433477060505045), 'Std': np.float64(0.24265770249845514)}
[I 2024-12-06 23:36:29,200] Trial 74 finished with value: 0.9464285714285714 and parameters: {'x_0_0': 'ac', 'x_0_1': 'oo', 'x_1_0': 'ab', 'x_1_1': 'oo'}. Best is trial 23 with value: 0.5.
2024-12-06 23:36:29,305 - INFO - Candidate Mean Stats: {'Max': np.float64(2.0), 'Min': np.float64(-0.8425672802715198), 'Mean': np.float64(0.322823273382226), 'Std': np.float64(0.4050267505317515)}
2024-12-06 23:36:29,305 - INFO - Candidate Std Stats: {'Max': np.float64(1.8459727140680429), 'Min': np.float64(0.0), 'Mean': np.float64(0.5426590522699267), 'Std': np.float64(0.2558598729234428)}
[I 2024-12-06 23:36:29,318] Trial 75 finished with value: 1.0714285714285714 and parameters: {'x_0_0': 'bd', 'x_0_1': 'oo', 'x_1_0': 'cd', 'x_1_1': 'ac'}. Best is trial 63 with value: 0.5.
2024-12-06 23:36:29,330 - INFO - Candidate Mean Stats: {'Max': np.float64(2.0), 'Min': np.float64(-1.454865960514703), 'Mean': np.float64(0.2441357434578326), 'Std': np.float64(0.4754332109519826)}
2024-12-06 23:36:29,330 - INFO - Candidate Std Stats: {'Max': np.float64(1.6990217561456273), 'Min': np.float64(0.0), 'Mean': np.float64(0.6165873209150065), 'Std': np.float64(0.28424434628778517)}
2024-12-06 23:36:29,337 - INFO - Candidate Mean Stats: {'Max': np.float64(2.46680177519674), 'Min': np.float64(-1.1605482117989734), 'Mean': np.float64(0.2997512184831914), 'Std': np.float64(0.4671932195320387)}
2024-12-06 23:36:29,337 - INFO - Candidate Std Stats: {'Max': np.float64(1.552346114633486), 'Min': np.float64(0.0), 'Mean': np.float64(0.6109408889896638), 'Std': np.float64(0.26436218243697746)}
[I 2024-12-06 23:36:29,342] Trial 75 finished with value: 0.7857142857142857 and parameters: {'x_0_0': 'ad', 'x_0_1': 'oo', 'x_1_0': 'bd', 'x_1_1': 'ad'}. Best is trial 50 with value: 0.6607142857142857.
[I 2024-12-06 23:36:29,349] Trial 75 finished with value: 0.8214285714285714 and parameters: {'x_0_0': 'bc', 'x_0_1': 'oo', 'x_1_0': 'oo', 'x_1_1': 'ab'}. Best is trial 68 with value: 0.6607142857142857.
2024-12-06 23:36:29,524 - INFO - Candidate Mean Stats: {'Max': np.float64(2.0), 'Min': np.float64(-1.0940129081637953), 'Mean': np.float64(0.31371743161715954), 'Std': np.float64(0.4427595252354307)}
2024-12-06 23:36:29,524 - INFO - Candidate Std Stats: {'Max': np.float64(1.6409874400262625), 'Min': np.float64(0.0), 'Mean': np.float64(0.6276560768705411), 'Std': np.float64(0.2791331022809073)}
[I 2024-12-06 23:36:29,536] Trial 75 finished with value: 1.0714285714285714 and parameters: {'x_0_0': 'ad', 'x_0_1': 'oo', 'x_1_0': 'ac', 'x_1_1': 'bc'}. Best is trial 23 with value: 0.5.
2024-12-06 23:36:29,630 - INFO - Candidate Mean Stats: {'Max': np.float64(2.16069607811147), 'Min': np.float64(-0.754178007726222), 'Mean': np.float64(0.2904761252444211), 'Std': np.float64(0.40733460908179914)}
2024-12-06 23:36:29,631 - INFO - Candidate Std Stats: {'Max': np.float64(1.4984028883839968), 'Min': np.float64(0.0), 'Mean': np.float64(0.5040139818266473), 'Std': np.float64(0.2261064311601671)}
[I 2024-12-06 23:36:29,643] Trial 76 finished with value: 1.0714285714285714 and parameters: {'x_0_0': 'bd', 'x_0_1': 'oo', 'x_1_0': 'cd', 'x_1_1': 'cd'}. Best is trial 63 with value: 0.5.
2024-12-06 23:36:29,657 - INFO - Candidate Mean Stats: {'Max': np.float64(2.1102349689879007), 'Min': np.float64(-1.1666947580791263), 'Mean': np.float64(0.21854699527902827), 'Std': np.float64(0.5151931818561751)}
2024-12-06 23:36:29,657 - INFO - Candidate Std Stats: {'Max': np.float64(2.1504294795322285), 'Min': np.float64(0.0), 'Mean': np.float64(0.708365355474714), 'Std': np.float64(0.3083921851607759)}
2024-12-06 23:36:29,665 - INFO - Candidate Mean Stats: {'Max': np.float64(2.0), 'Min': np.float64(-0.9635102176400185), 'Mean': np.float64(0.3442610243315894), 'Std': np.float64(0.45465855847339914)}
2024-12-06 23:36:29,665 - INFO - Candidate Std Stats: {'Max': np.float64(1.6879049889781637), 'Min': np.float64(0.0), 'Mean': np.float64(0.6115069297570985), 'Std': np.float64(0.26160353795339875)}
[I 2024-12-06 23:36:29,669] Trial 76 finished with value: 1.0714285714285714 and parameters: {'x_0_0': 'bd', 'x_0_1': 'oo', 'x_1_0': 'ac', 'x_1_1': 'ad'}. Best is trial 50 with value: 0.6607142857142857.
[I 2024-12-06 23:36:29,677] Trial 76 finished with value: 0.5 and parameters: {'x_0_0': 'ad', 'x_0_1': 'oo', 'x_1_0': 'bc', 'x_1_1': 'ac'}. Best is trial 76 with value: 0.5.
2024-12-06 23:36:29,854 - INFO - Candidate Mean Stats: {'Max': np.float64(2.0), 'Min': np.float64(-0.9075302113744735), 'Mean': np.float64(0.3200577915199905), 'Std': np.float64(0.4166395783292698)}
2024-12-06 23:36:29,854 - INFO - Candidate Std Stats: {'Max': np.float64(1.4973781360342024), 'Min': np.float64(0.0), 'Mean': np.float64(0.5477825012784092), 'Std': np.float64(0.24963643247184403)}
[I 2024-12-06 23:36:29,866] Trial 76 finished with value: 0.6964285714285714 and parameters: {'x_0_0': 'bc', 'x_0_1': 'oo', 'x_1_0': 'oo', 'x_1_1': 'oo'}. Best is trial 23 with value: 0.5.
2024-12-06 23:36:29,955 - INFO - Candidate Mean Stats: {'Max': np.float64(2.0), 'Min': np.float64(-1.269442704585534), 'Mean': np.float64(0.18917439910758266), 'Std': np.float64(0.48330937921617395)}
2024-12-06 23:36:29,955 - INFO - Candidate Std Stats: {'Max': np.float64(1.6339432234699), 'Min': np.float64(0.0), 'Mean': np.float64(0.6855110641678919), 'Std': np.float64(0.2959130953673093)}
[I 2024-12-06 23:36:29,967] Trial 77 finished with value: 0.8214285714285714 and parameters: {'x_0_0': 'ad', 'x_0_1': 'oo', 'x_1_0': 'oo', 'x_1_1': 'bc'}. Best is trial 63 with value: 0.5.
2024-12-06 23:36:29,982 - INFO - Candidate Mean Stats: {'Max': np.float64(2.0), 'Min': np.float64(-1.0175394251876857), 'Mean': np.float64(0.3473202024686881), 'Std': np.float64(0.45558073581202063)}
2024-12-06 23:36:29,982 - INFO - Candidate Std Stats: {'Max': np.float64(1.986112356761741), 'Min': np.float64(0.0), 'Mean': np.float64(0.625090514246092), 'Std': np.float64(0.2906312822076948)}
2024-12-06 23:36:29,991 - INFO - Candidate Mean Stats: {'Max': np.float64(2.0216733694292572), 'Min': np.float64(-1.178098085032596), 'Mean': np.float64(0.3507847845812147), 'Std': np.float64(0.5002911277998956)}
2024-12-06 23:36:29,991 - INFO - Candidate Std Stats: {'Max': np.float64(1.4602892313037967), 'Min': np.float64(0.0), 'Mean': np.float64(0.5720763694874382), 'Std': np.float64(0.24571072699977642)}
[I 2024-12-06 23:36:29,995] Trial 77 finished with value: 1.125 and parameters: {'x_0_0': 'oo', 'x_0_1': 'oo', 'x_1_0': 'oo', 'x_1_1': 'ad'}. Best is trial 50 with value: 0.6607142857142857.
[I 2024-12-06 23:36:30,003] Trial 77 finished with value: 1.0714285714285714 and parameters: {'x_0_0': 'ac', 'x_0_1': 'oo', 'x_1_0': 'ad', 'x_1_1': 'ac'}. Best is trial 76 with value: 0.5.
2024-12-06 23:36:30,181 - INFO - Candidate Mean Stats: {'Max': np.float64(2.063022393513164), 'Min': np.float64(-1.2186708146872895), 'Mean': np.float64(0.32176662781995985), 'Std': np.float64(0.46479822735617454)}
2024-12-06 23:36:30,181 - INFO - Candidate Std Stats: {'Max': np.float64(1.748197099714612), 'Min': np.float64(0.0), 'Mean': np.float64(0.5774300966612129), 'Std': np.float64(0.2560853595724476)}
[I 2024-12-06 23:36:30,194] Trial 77 finished with value: 0.8214285714285714 and parameters: {'x_0_0': 'bc', 'x_0_1': 'oo', 'x_1_0': 'oo', 'x_1_1': 'ac'}. Best is trial 23 with value: 0.5.
2024-12-06 23:36:30,280 - INFO - Candidate Mean Stats: {'Max': np.float64(2.0), 'Min': np.float64(-0.9908921572372311), 'Mean': np.float64(0.32813314400811516), 'Std': np.float64(0.4325925487319993)}
2024-12-06 23:36:30,280 - INFO - Candidate Std Stats: {'Max': np.float64(1.3067443080838081), 'Min': np.float64(0.0), 'Mean': np.float64(0.5247057719764939), 'Std': np.float64(0.22110194778327552)}
[I 2024-12-06 23:36:30,293] Trial 78 finished with value: 0.5 and parameters: {'x_0_0': 'ad', 'x_0_1': 'oo', 'x_1_0': 'bc', 'x_1_1': 'ad'}. Best is trial 63 with value: 0.5.
2024-12-06 23:36:30,309 - INFO - Candidate Mean Stats: {'Max': np.float64(2.093691440455453), 'Min': np.float64(-1.3240881226241235), 'Mean': np.float64(0.2799861170607744), 'Std': np.float64(0.4877379541204268)}
2024-12-06 23:36:30,309 - INFO - Candidate Std Stats: {'Max': np.float64(1.592733122700145), 'Min': np.float64(0.0), 'Mean': np.float64(0.6076679007077871), 'Std': np.float64(0.26979573990782535)}
[I 2024-12-06 23:36:30,321] Trial 78 finished with value: 1.0714285714285714 and parameters: {'x_0_0': 'bd', 'x_0_1': 'oo', 'x_1_0': 'cd', 'x_1_1': 'bc'}. Best is trial 50 with value: 0.6607142857142857.
2024-12-06 23:36:30,322 - INFO - Candidate Mean Stats: {'Max': np.float64(2.2848043079708056), 'Min': np.float64(-0.9928984341419188), 'Mean': np.float64(0.24989311435934847), 'Std': np.float64(0.4891281615603305)}
2024-12-06 23:36:30,322 - INFO - Candidate Std Stats: {'Max': np.float64(1.9154229642042164), 'Min': np.float64(0.0), 'Mean': np.float64(0.6192916167477717), 'Std': np.float64(0.27115527854431104)}
[I 2024-12-06 23:36:30,334] Trial 78 finished with value: 1.25 and parameters: {'x_0_0': 'oo', 'x_0_1': 'oo', 'x_1_0': 'ab', 'x_1_1': 'oo'}. Best is trial 76 with value: 0.5.
2024-12-06 23:36:30,515 - INFO - Candidate Mean Stats: {'Max': np.float64(2.0), 'Min': np.float64(-1.077765265039194), 'Mean': np.float64(0.2951719450509777), 'Std': np.float64(0.441902577656044)}
2024-12-06 23:36:30,515 - INFO - Candidate Std Stats: {'Max': np.float64(1.823149480479898), 'Min': np.float64(0.0), 'Mean': np.float64(0.5973806521255852), 'Std': np.float64(0.2613779164238322)}
[I 2024-12-06 23:36:30,527] Trial 78 finished with value: 0.8214285714285714 and parameters: {'x_0_0': 'bc', 'x_0_1': 'oo', 'x_1_0': 'oo', 'x_1_1': 'ab'}. Best is trial 23 with value: 0.5.
2024-12-06 23:36:30,606 - INFO - Candidate Mean Stats: {'Max': np.float64(2.0), 'Min': np.float64(-1.1991931758129495), 'Mean': np.float64(0.25685265700788235), 'Std': np.float64(0.5085182953599078)}
2024-12-06 23:36:30,606 - INFO - Candidate Std Stats: {'Max': np.float64(1.656484587551605), 'Min': np.float64(0.0), 'Mean': np.float64(0.6361574569636167), 'Std': np.float64(0.2706768358136497)}
[I 2024-12-06 23:36:30,619] Trial 79 finished with value: 0.8214285714285714 and parameters: {'x_0_0': 'bc', 'x_0_1': 'oo', 'x_1_0': 'oo', 'x_1_1': 'cd'}. Best is trial 63 with value: 0.5.
2024-12-06 23:36:30,638 - INFO - Candidate Mean Stats: {'Max': np.float64(2.105249304962873), 'Min': np.float64(-0.9367637453825136), 'Mean': np.float64(0.35061288271691426), 'Std': np.float64(0.4411966628410086)}
2024-12-06 23:36:30,638 - INFO - Candidate Std Stats: {'Max': np.float64(1.3362506617982912), 'Min': np.float64(0.0), 'Mean': np.float64(0.5354806076774268), 'Std': np.float64(0.22576288468104982)}
2024-12-06 23:36:30,650 - INFO - Candidate Mean Stats: {'Max': np.float64(2.2415346593177183), 'Min': np.float64(-1.2879427379972053), 'Mean': np.float64(0.27433360186261185), 'Std': np.float64(0.5362695446389335)}
2024-12-06 23:36:30,650 - INFO - Candidate Std Stats: {'Max': np.float64(1.8152460206167225), 'Min': np.float64(0.0), 'Mean': np.float64(0.6016520453823597), 'Std': np.float64(0.2596022725727309)}
[I 2024-12-06 23:36:30,650] Trial 79 finished with value: 1.5 and parameters: {'x_0_0': 'cd', 'x_0_1': 'oo', 'x_1_0': 'bd', 'x_1_1': 'cd'}. Best is trial 50 with value: 0.6607142857142857.
