[I 2024-12-06 23:38:14,286] Trial 359 finished with value: 1.1607142857142856 and parameters: {'x_0_0': 'bc', 'x_0_1': 'ad', 'x_1_0': 'bd', 'x_1_1': 'oo'}. Best is trial 76 with value: 0.5.
[I 2024-12-06 23:38:14,297] Trial 357 finished with value: 1.0357142857142856 and parameters: {'x_0_0': 'ac', 'x_0_1': 'ac', 'x_1_0': 'oo', 'x_1_1': 'ac'}. Best is trial 23 with value: 0.5.
2024-12-06 23:38:14,324 - INFO - Candidate Mean Stats: {'Max': np.float64(3.600496943556999), 'Min': np.float64(-1.1146560562153358), 'Mean': np.float64(0.6799470805357561), 'Std': np.float64(0.6040092332449641)}
2024-12-06 23:38:14,324 - INFO - Candidate Std Stats: {'Max': np.float64(1.6737371802212824), 'Min': np.float64(0.0), 'Mean': np.float64(0.5197805324135256), 'Std': np.float64(0.3181721216305956)}
[I 2024-12-06 23:38:14,338] Trial 359 finished with value: 1.2142857142857144 and parameters: {'x_0_0': 'ab', 'x_0_1': 'oo', 'x_1_0': 'ac', 'x_1_1': 'cd'}. Best is trial 165 with value: 0.5.
2024-12-06 23:38:14,348 - INFO - Candidate Mean Stats: {'Max': np.float64(3.2701435685939577), 'Min': np.float64(-0.6424483641845151), 'Mean': np.float64(0.7013241063575244), 'Std': np.float64(0.5493917149808838)}
2024-12-06 23:38:14,348 - INFO - Candidate Std Stats: {'Max': np.float64(1.583678456610482), 'Min': np.float64(0.0), 'Mean': np.float64(0.5222971623083301), 'Std': np.float64(0.30516079552465636)}
[I 2024-12-06 23:38:14,362] Trial 359 finished with value: 1.0535714285714286 and parameters: {'x_0_0': 'ac', 'x_0_1': 'ab', 'x_1_0': 'oo', 'x_1_1': 'oo'}. Best is trial 63 with value: 0.5.
2024-12-06 23:38:14,660 - INFO - Candidate Mean Stats: {'Max': np.float64(3.5719237931791823), 'Min': np.float64(-0.7809452680183325), 'Mean': np.float64(0.6803762577021862), 'Std': np.float64(0.5885914976547931)}
2024-12-06 23:38:14,660 - INFO - Candidate Std Stats: {'Max': np.float64(1.9931585545522943), 'Min': np.float64(0.0), 'Mean': np.float64(0.5409965497777379), 'Std': np.float64(0.32600707996949346)}
2024-12-06 23:38:14,674 - INFO - Candidate Mean Stats: {'Max': np.float64(3.0408807847510073), 'Min': np.float64(-0.5299121204612323), 'Mean': np.float64(0.780189514381103), 'Std': np.float64(0.5133486186832119)}
2024-12-06 23:38:14,674 - INFO - Candidate Std Stats: {'Max': np.float64(1.7159133649998488), 'Min': np.float64(0.0), 'Mean': np.float64(0.4774864037830189), 'Std': np.float64(0.2912489528022809)}
[I 2024-12-06 23:38:14,675] Trial 360 finished with value: 1.2857142857142856 and parameters: {'x_0_0': 'ac', 'x_0_1': 'ac', 'x_1_0': 'ac', 'x_1_1': 'bc'}. Best is trial 76 with value: 0.5.
[I 2024-12-06 23:38:14,688] Trial 358 finished with value: 1.5 and parameters: {'x_0_0': 'cd', 'x_0_1': 'oo', 'x_1_0': 'ac', 'x_1_1': 'ac'}. Best is trial 23 with value: 0.5.
2024-12-06 23:38:14,709 - INFO - Candidate Mean Stats: {'Max': np.float64(3.3424655452926126), 'Min': np.float64(-0.6788911033081316), 'Mean': np.float64(0.726691520132095), 'Std': np.float64(0.5214500237875419)}
2024-12-06 23:38:14,710 - INFO - Candidate Std Stats: {'Max': np.float64(1.5090800030545848), 'Min': np.float64(0.0), 'Mean': np.float64(0.5449770816519741), 'Std': np.float64(0.32407940406121777)}
[I 2024-12-06 23:38:14,723] Trial 360 finished with value: 1.2142857142857144 and parameters: {'x_0_0': 'ab', 'x_0_1': 'oo', 'x_1_0': 'ab', 'x_1_1': 'cd'}. Best is trial 165 with value: 0.5.
2024-12-06 23:38:14,735 - INFO - Candidate Mean Stats: {'Max': np.float64(3.0322936139856482), 'Min': np.float64(-0.6362092576689984), 'Mean': np.float64(0.7316043676126613), 'Std': np.float64(0.5303687141503846)}
2024-12-06 23:38:14,735 - INFO - Candidate Std Stats: {'Max': np.float64(1.5214116457867046), 'Min': np.float64(0.0), 'Mean': np.float64(0.48447196897277967), 'Std': np.float64(0.2871067168556844)}
[I 2024-12-06 23:38:14,749] Trial 360 finished with value: 0.9107142857142857 and parameters: {'x_0_0': 'bc', 'x_0_1': 'ac', 'x_1_0': 'oo', 'x_1_1': 'oo'}. Best is trial 63 with value: 0.5.
2024-12-06 23:38:15,044 - INFO - Candidate Mean Stats: {'Max': np.float64(3.509087696710118), 'Min': np.float64(-0.9915348055498141), 'Mean': np.float64(0.659268671890102), 'Std': np.float64(0.6039349777125236)}
2024-12-06 23:38:15,044 - INFO - Candidate Std Stats: {'Max': np.float64(1.5867125372375837), 'Min': np.float64(0.0), 'Mean': np.float64(0.5397759699921234), 'Std': np.float64(0.316548347048495)}
[I 2024-12-06 23:38:15,058] Trial 361 finished with value: 1.1964285714285714 and parameters: {'x_0_0': 'ad', 'x_0_1': 'ac', 'x_1_0': 'oo', 'x_1_1': 'oo'}. Best is trial 76 with value: 0.5.
2024-12-06 23:38:15,061 - INFO - Candidate Mean Stats: {'Max': np.float64(2.920458679270551), 'Min': np.float64(-0.724199513697765), 'Mean': np.float64(0.727544920758023), 'Std': np.float64(0.5291268138883122)}
2024-12-06 23:38:15,061 - INFO - Candidate Std Stats: {'Max': np.float64(1.3643950735611239), 'Min': np.float64(0.0), 'Mean': np.float64(0.4959010401619481), 'Std': np.float64(0.2939502276839114)}
[I 2024-12-06 23:38:15,075] Trial 359 finished with value: 1.3214285714285714 and parameters: {'x_0_0': 'bd', 'x_0_1': 'bd', 'x_1_0': 'oo', 'x_1_1': 'ac'}. Best is trial 23 with value: 0.5.
2024-12-06 23:38:15,097 - INFO - Candidate Mean Stats: {'Max': np.float64(3.08788292690151), 'Min': np.float64(-0.7714445387901769), 'Mean': np.float64(0.6660994748930229), 'Std': np.float64(0.5796348060614119)}
2024-12-06 23:38:15,097 - INFO - Candidate Std Stats: {'Max': np.float64(1.7460711311943327), 'Min': np.float64(0.0), 'Mean': np.float64(0.5646705033469974), 'Std': np.float64(0.33631793945694083)}
[I 2024-12-06 23:38:15,111] Trial 361 finished with value: 1.2142857142857144 and parameters: {'x_0_0': 'ab', 'x_0_1': 'oo', 'x_1_0': 'cd', 'x_1_1': 'ac'}. Best is trial 165 with value: 0.5.
2024-12-06 23:38:15,122 - INFO - Candidate Mean Stats: {'Max': np.float64(2.898878459243011), 'Min': np.float64(-0.3483451553798466), 'Mean': np.float64(0.7949103023494192), 'Std': np.float64(0.44287058150630154)}
2024-12-06 23:38:15,122 - INFO - Candidate Std Stats: {'Max': np.float64(2.3519127520732335), 'Min': np.float64(0.0), 'Mean': np.float64(0.4526089663805625), 'Std': np.float64(0.3360868739872315)}
[I 2024-12-06 23:38:15,135] Trial 361 finished with value: 1.4464285714285714 and parameters: {'x_0_0': 'bd', 'x_0_1': 'ad', 'x_1_0': 'ac', 'x_1_1': 'oo'}. Best is trial 63 with value: 0.5.
2024-12-06 23:38:15,428 - INFO - Candidate Mean Stats: {'Max': np.float64(3.4271765515288237), 'Min': np.float64(-0.6854406848348329), 'Mean': np.float64(0.7145481525257132), 'Std': np.float64(0.5611811871837341)}
2024-12-06 23:38:15,428 - INFO - Candidate Std Stats: {'Max': np.float64(1.3911181856601829), 'Min': np.float64(0.0), 'Mean': np.float64(0.49831933098362713), 'Std': np.float64(0.2926813751635823)}
[I 2024-12-06 23:38:15,442] Trial 362 finished with value: 1.0 and parameters: {'x_0_0': 'bc', 'x_0_1': 'ad', 'x_1_0': 'bd', 'x_1_1': 'bd'}. Best is trial 76 with value: 0.5.
2024-12-06 23:38:15,445 - INFO - Candidate Mean Stats: {'Max': np.float64(3.565319018925128), 'Min': np.float64(-0.49073777409796077), 'Mean': np.float64(0.7639476151688671), 'Std': np.float64(0.5171042166194421)}
2024-12-06 23:38:15,445 - INFO - Candidate Std Stats: {'Max': np.float64(1.3180489512670839), 'Min': np.float64(0.0), 'Mean': np.float64(0.4841576262692974), 'Std': np.float64(0.2774372846849892)}
[I 2024-12-06 23:38:15,459] Trial 360 finished with value: 1.0714285714285714 and parameters: {'x_0_0': 'bc', 'x_0_1': 'oo', 'x_1_0': 'ac', 'x_1_1': 'cd'}. Best is trial 23 with value: 0.5.
2024-12-06 23:38:15,485 - INFO - Candidate Mean Stats: {'Max': np.float64(3.2568567975880733), 'Min': np.float64(-0.6232335162867132), 'Mean': np.float64(0.7008884626767059), 'Std': np.float64(0.560922329646207)}
2024-12-06 23:38:15,485 - INFO - Candidate Std Stats: {'Max': np.float64(1.772938839878411), 'Min': np.float64(0.0), 'Mean': np.float64(0.5259565321134021), 'Std': np.float64(0.3230005135619921)}
[I 2024-12-06 23:38:15,498] Trial 362 finished with value: 1.2142857142857144 and parameters: {'x_0_0': 'ab', 'x_0_1': 'oo', 'x_1_0': 'cd', 'x_1_1': 'cd'}. Best is trial 165 with value: 0.5.
2024-12-06 23:38:15,507 - INFO - Candidate Mean Stats: {'Max': np.float64(3.0393556967006248), 'Min': np.float64(-0.2969151644611867), 'Mean': np.float64(0.7493949495212558), 'Std': np.float64(0.4384150450838605)}
2024-12-06 23:38:15,507 - INFO - Candidate Std Stats: {'Max': np.float64(1.5020225099923137), 'Min': np.float64(0.0), 'Mean': np.float64(0.4438752807541408), 'Std': np.float64(0.27872061936895254)}
[I 2024-12-06 23:38:15,521] Trial 362 finished with value: 1.375 and parameters: {'x_0_0': 'oo', 'x_0_1': 'oo', 'x_1_0': 'bc', 'x_1_1': 'bc'}. Best is trial 63 with value: 0.5.
2024-12-06 23:38:15,814 - INFO - Candidate Mean Stats: {'Max': np.float64(2.984925917509836), 'Min': np.float64(-0.6302457926581633), 'Mean': np.float64(0.6473735344077801), 'Std': np.float64(0.5835670116506365)}
2024-12-06 23:38:15,814 - INFO - Candidate Std Stats: {'Max': np.float64(1.5446143724526498), 'Min': np.float64(0.0), 'Mean': np.float64(0.5623465383733829), 'Std': np.float64(0.3336501087839441)}
[I 2024-12-06 23:38:15,828] Trial 363 finished with value: 1.5714285714285714 and parameters: {'x_0_0': 'ad', 'x_0_1': 'bd', 'x_1_0': 'cd', 'x_1_1': 'ac'}. Best is trial 76 with value: 0.5.
2024-12-06 23:38:15,831 - INFO - Candidate Mean Stats: {'Max': np.float64(2.7647036005116767), 'Min': np.float64(-0.7981102928613697), 'Mean': np.float64(0.7090956502550997), 'Std': np.float64(0.5699202614782864)}
2024-12-06 23:38:15,831 - INFO - Candidate Std Stats: {'Max': np.float64(1.5890041411663363), 'Min': np.float64(0.0), 'Mean': np.float64(0.5297273623551685), 'Std': np.float64(0.3164373570184128)}
[I 2024-12-06 23:38:15,845] Trial 361 finished with value: 1.2857142857142856 and parameters: {'x_0_0': 'bc', 'x_0_1': 'ac', 'x_1_0': 'cd', 'x_1_1': 'bc'}. Best is trial 23 with value: 0.5.
2024-12-06 23:38:15,870 - INFO - Candidate Mean Stats: {'Max': np.float64(3.1509930819332284), 'Min': np.float64(-0.9493418540630957), 'Mean': np.float64(0.6057546455256215), 'Std': np.float64(0.6416393077084422)}
2024-12-06 23:38:15,870 - INFO - Candidate Std Stats: {'Max': np.float64(2.0359134686217883), 'Min': np.float64(0.0), 'Mean': np.float64(0.5997351849949913), 'Std': np.float64(0.36033288620506226)}
[I 2024-12-06 23:38:15,883] Trial 363 finished with value: 1.3214285714285714 and parameters: {'x_0_0': 'bd', 'x_0_1': 'ab', 'x_1_0': 'oo', 'x_1_1': 'cd'}. Best is trial 165 with value: 0.5.
2024-12-06 23:38:15,894 - INFO - Candidate Mean Stats: {'Max': np.float64(2.6543712729290077), 'Min': np.float64(-0.6509745912282979), 'Mean': np.float64(0.7330541657318973), 'Std': np.float64(0.5269251127138816)}
2024-12-06 23:38:15,894 - INFO - Candidate Std Stats: {'Max': np.float64(1.5131069341977281), 'Min': np.float64(0.0), 'Mean': np.float64(0.5107742972071501), 'Std': np.float64(0.3021406687572636)}
[I 2024-12-06 23:38:15,908] Trial 363 finished with value: 1.1964285714285714 and parameters: {'x_0_0': 'bc', 'x_0_1': 'bc', 'x_1_0': 'oo', 'x_1_1': 'oo'}. Best is trial 63 with value: 0.5.
2024-12-06 23:38:16,199 - INFO - Candidate Mean Stats: {'Max': np.float64(2.8483040854033197), 'Min': np.float64(-0.921570354305851), 'Mean': np.float64(0.6380176266459897), 'Std': np.float64(0.567139371999791)}
2024-12-06 23:38:16,199 - INFO - Candidate Std Stats: {'Max': np.float64(1.8931264829511762), 'Min': np.float64(0.0), 'Mean': np.float64(0.594667825391881), 'Std': np.float64(0.35756473617353923)}
[I 2024-12-06 23:38:16,213] Trial 364 finished with value: 1.2142857142857144 and parameters: {'x_0_0': 'ab', 'x_0_1': 'oo', 'x_1_0': 'bc', 'x_1_1': 'cd'}. Best is trial 76 with value: 0.5.
2024-12-06 23:38:16,218 - INFO - Candidate Mean Stats: {'Max': np.float64(2.9866181738720874), 'Min': np.float64(-0.6244846748146815), 'Mean': np.float64(0.741628088404997), 'Std': np.float64(0.5102179974831476)}
2024-12-06 23:38:16,218 - INFO - Candidate Std Stats: {'Max': np.float64(1.5027523236963707), 'Min': np.float64(0.0), 'Mean': np.float64(0.4659499117436627), 'Std': np.float64(0.2803956802821729)}
[I 2024-12-06 23:38:16,231] Trial 362 finished with value: 1.2142857142857144 and parameters: {'x_0_0': 'ab', 'x_0_1': 'oo', 'x_1_0': 'ab', 'x_1_1': 'ab'}. Best is trial 23 with value: 0.5.
2024-12-06 23:38:16,254 - INFO - Candidate Mean Stats: {'Max': np.float64(2.861917194821203), 'Min': np.float64(-0.9915590884656569), 'Mean': np.float64(0.7048045726931468), 'Std': np.float64(0.5951991594243456)}
2024-12-06 23:38:16,254 - INFO - Candidate Std Stats: {'Max': np.float64(1.7616645831365223), 'Min': np.float64(0.0), 'Mean': np.float64(0.524157623661337), 'Std': np.float64(0.31515952378559614)}
[I 2024-12-06 23:38:16,268] Trial 364 finished with value: 1.375 and parameters: {'x_0_0': 'oo', 'x_0_1': 'oo', 'x_1_0': 'ac', 'x_1_1': 'cd'}. Best is trial 165 with value: 0.5.
2024-12-06 23:38:16,279 - INFO - Candidate Mean Stats: {'Max': np.float64(3.450145263706493), 'Min': np.float64(-0.6661205426149129), 'Mean': np.float64(0.733280074224966), 'Std': np.float64(0.4770929786432955)}
2024-12-06 23:38:16,279 - INFO - Candidate Std Stats: {'Max': np.float64(1.8626664771368768), 'Min': np.float64(0.0), 'Mean': np.float64(0.5133557115253473), 'Std': np.float64(0.32199279645365975)}
[I 2024-12-06 23:38:16,293] Trial 364 finished with value: 1.375 and parameters: {'x_0_0': 'oo', 'x_0_1': 'oo', 'x_1_0': 'bd', 'x_1_1': 'ad'}. Best is trial 63 with value: 0.5.
2024-12-06 23:38:16,586 - INFO - Candidate Mean Stats: {'Max': np.float64(3.329841564965199), 'Min': np.float64(-1.3086596472554868), 'Mean': np.float64(0.6945200835129798), 'Std': np.float64(0.6057979255585325)}
2024-12-06 23:38:16,586 - INFO - Candidate Std Stats: {'Max': np.float64(1.5078032852561507), 'Min': np.float64(0.0), 'Mean': np.float64(0.5251551927729554), 'Std': np.float64(0.30731589161521333)}
[I 2024-12-06 23:38:16,600] Trial 365 finished with value: 1.4464285714285714 and parameters: {'x_0_0': 'ac', 'x_0_1': 'bd', 'x_1_0': 'bd', 'x_1_1': 'oo'}. Best is trial 76 with value: 0.5.
2024-12-06 23:38:16,607 - INFO - Candidate Mean Stats: {'Max': np.float64(2.9057345047783647), 'Min': np.float64(-0.5578962246339866), 'Mean': np.float64(0.7667389597236789), 'Std': np.float64(0.4891954014892518)}
2024-12-06 23:38:16,607 - INFO - Candidate Std Stats: {'Max': np.float64(1.4112665985700856), 'Min': np.float64(0.0), 'Mean': np.float64(0.47779435261130354), 'Std': np.float64(0.2888716938748721)}
[I 2024-12-06 23:38:16,620] Trial 363 finished with value: 1.1607142857142856 and parameters: {'x_0_0': 'ac', 'x_0_1': 'ac', 'x_1_0': 'ad', 'x_1_1': 'oo'}. Best is trial 23 with value: 0.5.
2024-12-06 23:38:16,639 - INFO - Candidate Mean Stats: {'Max': np.float64(3.7088793582697734), 'Min': np.float64(-0.7733682576448795), 'Mean': np.float64(0.7390508270788098), 'Std': np.float64(0.494146531243257)}
2024-12-06 23:38:16,639 - INFO - Candidate Std Stats: {'Max': np.float64(1.709629468823985), 'Min': np.float64(0.0), 'Mean': np.float64(0.5173833073897738), 'Std': np.float64(0.31221356927950594)}
[I 2024-12-06 23:38:16,653] Trial 365 finished with value: 1.125 and parameters: {'x_0_0': 'cd', 'x_0_1': 'oo', 'x_1_0': 'oo', 'x_1_1': 'oo'}. Best is trial 165 with value: 0.5.
2024-12-06 23:38:16,668 - INFO - Candidate Mean Stats: {'Max': np.float64(3.0509127786958152), 'Min': np.float64(-0.6672755875038673), 'Mean': np.float64(0.6806753912071866), 'Std': np.float64(0.569856628655195)}
2024-12-06 23:38:16,668 - INFO - Candidate Std Stats: {'Max': np.float64(1.6147137544242676), 'Min': np.float64(0.0), 'Mean': np.float64(0.5600926777168548), 'Std': np.float64(0.3314667121429736)}
[I 2024-12-06 23:38:16,682] Trial 365 finished with value: 1.2857142857142856 and parameters: {'x_0_0': 'ad', 'x_0_1': 'bc', 'x_1_0': 'bd', 'x_1_1': 'ad'}. Best is trial 63 with value: 0.5.
2024-12-06 23:38:16,969 - INFO - Candidate Mean Stats: {'Max': np.float64(3.389598997274882), 'Min': np.float64(-1.0578437033858061), 'Mean': np.float64(0.6928004918020735), 'Std': np.float64(0.5798595248362022)}
2024-12-06 23:38:16,969 - INFO - Candidate Std Stats: {'Max': np.float64(1.68966922356949), 'Min': np.float64(0.0), 'Mean': np.float64(0.5291716789207618), 'Std': np.float64(0.32119402434132915)}
[I 2024-12-06 23:38:16,983] Trial 366 finished with value: 1.375 and parameters: {'x_0_0': 'cd', 'x_0_1': 'oo', 'x_1_0': 'bc', 'x_1_1': 'oo'}. Best is trial 76 with value: 0.5.
2024-12-06 23:38:16,997 - INFO - Candidate Mean Stats: {'Max': np.float64(3.110896567313576), 'Min': np.float64(-0.5374501052473449), 'Mean': np.float64(0.7587997982805746), 'Std': np.float64(0.45238398319485434)}
2024-12-06 23:38:16,997 - INFO - Candidate Std Stats: {'Max': np.float64(1.7916073259175729), 'Min': np.float64(0.0), 'Mean': np.float64(0.47955343801854966), 'Std': np.float64(0.29246861125827545)}
[I 2024-12-06 23:38:17,011] Trial 364 finished with value: 1.2142857142857144 and parameters: {'x_0_0': 'ab', 'x_0_1': 'oo', 'x_1_0': 'ad', 'x_1_1': 'bd'}. Best is trial 23 with value: 0.5.
2024-12-06 23:38:17,024 - INFO - Candidate Mean Stats: {'Max': np.float64(3.062165863768375), 'Min': np.float64(-0.5036201022774566), 'Mean': np.float64(0.7402814704165653), 'Std': np.float64(0.495215649174892)}
2024-12-06 23:38:17,024 - INFO - Candidate Std Stats: {'Max': np.float64(1.648949275953168), 'Min': np.float64(0.0), 'Mean': np.float64(0.5167715213440482), 'Std': np.float64(0.3121325250870375)}
[I 2024-12-06 23:38:17,038] Trial 366 finished with value: 1.2142857142857144 and parameters: {'x_0_0': 'ab', 'x_0_1': 'oo', 'x_1_0': 'cd', 'x_1_1': 'bd'}. Best is trial 165 with value: 0.5.
2024-12-06 23:38:17,054 - INFO - Candidate Mean Stats: {'Max': np.float64(3.0826433460155727), 'Min': np.float64(-0.40130365115374245), 'Mean': np.float64(0.7638200036418715), 'Std': np.float64(0.47111783153349646)}
2024-12-06 23:38:17,054 - INFO - Candidate Std Stats: {'Max': np.float64(1.4780246136834927), 'Min': np.float64(0.0), 'Mean': np.float64(0.4411074314862848), 'Std': np.float64(0.2808442352715287)}
[I 2024-12-06 23:38:17,067] Trial 366 finished with value: 1.25 and parameters: {'x_0_0': 'cd', 'x_0_1': 'oo', 'x_1_0': 'oo', 'x_1_1': 'bc'}. Best is trial 63 with value: 0.5.
2024-12-06 23:38:17,355 - INFO - Candidate Mean Stats: {'Max': np.float64(2.7567810058229867), 'Min': np.float64(-0.9042799229202417), 'Mean': np.float64(0.6960263914258433), 'Std': np.float64(0.5619218710887177)}
2024-12-06 23:38:17,355 - INFO - Candidate Std Stats: {'Max': np.float64(1.7016675507940446), 'Min': np.float64(0.0), 'Mean': np.float64(0.5147011320930156), 'Std': np.float64(0.3103979018905853)}
[I 2024-12-06 23:38:17,368] Trial 367 finished with value: 1.5 and parameters: {'x_0_0': 'cd', 'x_0_1': 'oo', 'x_1_0': 'bd', 'x_1_1': 'bc'}. Best is trial 76 with value: 0.5.
2024-12-06 23:38:17,387 - INFO - Candidate Mean Stats: {'Max': np.float64(3.3093798094382736), 'Min': np.float64(-0.553464738626576), 'Mean': np.float64(0.7500167566148206), 'Std': np.float64(0.4845009878063542)}
2024-12-06 23:38:17,388 - INFO - Candidate Std Stats: {'Max': np.float64(1.450364572747626), 'Min': np.float64(0.0), 'Mean': np.float64(0.48348820735852965), 'Std': np.float64(0.288894678032295)}
[I 2024-12-06 23:38:17,401] Trial 365 finished with value: 1.4464285714285714 and parameters: {'x_0_0': 'ac', 'x_0_1': 'cd', 'x_1_0': 'ad', 'x_1_1': 'oo'}. Best is trial 23 with value: 0.5.
2024-12-06 23:38:17,409 - INFO - Candidate Mean Stats: {'Max': np.float64(3.167224959803338), 'Min': np.float64(-0.6922511311251462), 'Mean': np.float64(0.7099826499404951), 'Std': np.float64(0.5613239915324456)}
2024-12-06 23:38:17,409 - INFO - Candidate Std Stats: {'Max': np.float64(2.102965916285397), 'Min': np.float64(0.0), 'Mean': np.float64(0.5703475804813162), 'Std': np.float64(0.36169754489052064)}
[I 2024-12-06 23:38:17,423] Trial 367 finished with value: 1.0892857142857144 and parameters: {'x_0_0': 'ab', 'x_0_1': 'oo', 'x_1_0': 'bc', 'x_1_1': 'oo'}. Best is trial 165 with value: 0.5.
2024-12-06 23:38:17,442 - INFO - Candidate Mean Stats: {'Max': np.float64(2.7180358433535643), 'Min': np.float64(-0.6007822177598878), 'Mean': np.float64(0.7040536841474275), 'Std': np.float64(0.5086053066580971)}
2024-12-06 23:38:17,442 - INFO - Candidate Std Stats: {'Max': np.float64(1.7022167129661436), 'Min': np.float64(0.0), 'Mean': np.float64(0.5377387958529211), 'Std': np.float64(0.3073102304522575)}
[I 2024-12-06 23:38:17,455] Trial 367 finished with value: 1.1607142857142856 and parameters: {'x_0_0': 'bd', 'x_0_1': 'bd', 'x_1_0': 'bc', 'x_1_1': 'oo'}. Best is trial 63 with value: 0.5.
2024-12-06 23:38:17,739 - INFO - Candidate Mean Stats: {'Max': np.float64(3.217984766555234), 'Min': np.float64(-1.010675475446417), 'Mean': np.float64(0.6693998217131963), 'Std': np.float64(0.6158368679085024)}
2024-12-06 23:38:17,739 - INFO - Candidate Std Stats: {'Max': np.float64(1.7815959255954679), 'Min': np.float64(0.0), 'Mean': np.float64(0.5526906429950936), 'Std': np.float64(0.33211884853527784)}
[I 2024-12-06 23:38:17,754] Trial 368 finished with value: 0.9107142857142857 and parameters: {'x_0_0': 'bc', 'x_0_1': 'ac', 'x_1_0': 'oo', 'x_1_1': 'oo'}. Best is trial 76 with value: 0.5.
2024-12-06 23:38:17,771 - INFO - Candidate Mean Stats: {'Max': np.float64(3.2245305566991975), 'Min': np.float64(-0.6153915963504797), 'Mean': np.float64(0.7293086011807518), 'Std': np.float64(0.5417442611020532)}
2024-12-06 23:38:17,771 - INFO - Candidate Std Stats: {'Max': np.float64(1.4522580807075882), 'Min': np.float64(0.0), 'Mean': np.float64(0.4578572129427404), 'Std': np.float64(0.2827120380692788)}
