[I 2024-12-28 14:58:55,856] Trial 37 finished with value: 1.2857142857142856 and parameters: {'x_0_0': 'ac', 'x_0_1': 'ac', 'x_1_0': 'cd', 'x_1_1': 'ab'}. Best is trial 29 with value: 1.0.
[I 2024-12-28 14:58:55,870] Trial 38 finished with value: 1.75 and parameters: {'x_0_0': 'oo', 'x_0_1': 'bc', 'x_1_0': 'bc', 'x_1_1': 'oo'}. Best is trial 17 with value: 0.5.
[I 2024-12-28 14:58:55,892] Trial 28 finished with value: 2.0 and parameters: {'x_0_0': 'cd', 'x_0_1': 'ab', 'x_1_0': 'bd', 'x_1_1': 'bc'}. Best is trial 4 with value: 1.0714285714285714.
[I 2024-12-28 14:58:55,920] Trial 42 finished with value: 1.75 and parameters: {'x_0_0': 'cd', 'x_0_1': 'cd', 'x_1_0': 'oo', 'x_1_1': 'cd'}. Best is trial 21 with value: 0.7857142857142857.
[I 2024-12-28 14:58:55,950] Trial 42 finished with value: 1.5714285714285714 and parameters: {'x_0_0': 'bd', 'x_0_1': 'ad', 'x_1_0': 'ac', 'x_1_1': 'ab'}. Best is trial 1 with value: 1.0.
[I 2024-12-28 14:58:55,951] Trial 30 finished with value: 1.0714285714285714 and parameters: {'x_0_0': 'bc', 'x_0_1': 'oo', 'x_1_0': 'ab', 'x_1_1': 'bd'}. Best is trial 3 with value: 0.7857142857142857.
[I 2024-12-28 14:58:56,066] Trial 30 finished with value: 1.0714285714285714 and parameters: {'x_0_0': 'bc', 'x_0_1': 'oo', 'x_1_0': 'cd', 'x_1_1': 'ad'}. Best is trial 15 with value: 0.6964285714285714.
[I 2024-12-28 14:58:56,096] Trial 42 finished with value: 1.4642857142857144 and parameters: {'x_0_0': 'ab', 'x_0_1': 'ab', 'x_1_0': 'oo', 'x_1_1': 'ac'}. Best is trial 17 with value: 0.7857142857142857.
[I 2024-12-28 14:58:56,139] Trial 34 finished with value: 1.5714285714285714 and parameters: {'x_0_0': 'ac', 'x_0_1': 'bc', 'x_1_0': 'bc', 'x_1_1': 'ac'}. Best is trial 7 with value: 0.5.
[I 2024-12-28 14:58:56,150] Trial 32 finished with value: 2.0 and parameters: {'x_0_0': 'cd', 'x_0_1': 'bc', 'x_1_0': 'ab', 'x_1_1': 'ac'}. Best is trial 16 with value: 0.8035714285714286.
[I 2024-12-28 14:58:56,185] Trial 39 finished with value: 1.125 and parameters: {'x_0_0': 'oo', 'x_0_1': 'oo', 'x_1_0': 'oo', 'x_1_1': 'ac'}. Best is trial 17 with value: 0.5.
[I 2024-12-28 14:58:56,186] Trial 43 finished with value: 1.875 and parameters: {'x_0_0': 'oo', 'x_0_1': 'bc', 'x_1_0': 'ac', 'x_1_1': 'ab'}. Best is trial 1 with value: 1.0.
[I 2024-12-28 14:58:56,301] Trial 43 finished with value: 1.75 and parameters: {'x_0_0': 'cd', 'x_0_1': 'ad', 'x_1_0': 'oo', 'x_1_1': 'ad'}. Best is trial 17 with value: 0.7857142857142857.
[I 2024-12-28 14:58:56,380] Trial 43 finished with value: 1.3214285714285714 and parameters: {'x_0_0': 'ad', 'x_0_1': 'ab', 'x_1_0': 'oo', 'x_1_1': 'ab'}. Best is trial 21 with value: 0.7857142857142857.
[I 2024-12-28 14:58:56,400] Trial 38 finished with value: 2.0 and parameters: {'x_0_0': 'cd', 'x_0_1': 'ad', 'x_1_0': 'bd', 'x_1_1': 'ad'}. Best is trial 29 with value: 1.0.
[I 2024-12-28 14:58:56,429] Trial 31 finished with value: 1.5714285714285714 and parameters: {'x_0_0': 'bc', 'x_0_1': 'cd', 'x_1_0': 'bc', 'x_1_1': 'ab'}. Best is trial 15 with value: 0.6964285714285714.
[I 2024-12-28 14:58:56,429] Trial 40 finished with value: 1.625 and parameters: {'x_0_0': 'oo', 'x_0_1': 'ab', 'x_1_0': 'oo', 'x_1_1': 'cd'}. Best is trial 17 with value: 0.5.
[I 2024-12-28 14:58:56,448] Trial 44 finished with value: 1.2857142857142856 and parameters: {'x_0_0': 'ac', 'x_0_1': 'ac', 'x_1_0': 'ac', 'x_1_1': 'ab'}. Best is trial 1 with value: 1.0.
[I 2024-12-28 14:58:56,463] Trial 35 finished with value: 1.4285714285714286 and parameters: {'x_0_0': 'ac', 'x_0_1': 'ab', 'x_1_0': 'cd', 'x_1_1': 'ac'}. Best is trial 7 with value: 0.5.
Loaded from prev state!
Loaded from prev state!
Loaded from prev state!
Loaded from prev state!
Loaded from prev state!
Loaded from prev state!
Loaded from prev state!
Loaded from prev state!
Loaded from prev state!
Loaded from prev state!
Loaded from prev state!
Loaded from prev state!
Loaded from prev state!
Loaded from prev state!
Loaded from prev state!
Loaded from prev state!
Loaded from prev state!
Loaded from prev state!
Loaded from prev state!
Loaded from prev state!
Loaded from prev state!
Loaded from prev state!
Loaded from prev state!
Loaded from prev state!
Loaded from prev state!
Loaded from prev state!
Loaded from prev state!
Loaded from prev state!
Loaded from prev state!
Loaded from prev state!
Loaded from prev state!
Loaded from prev state!
Loaded from prev state!
Loaded from prev state!
Loaded from prev state!
Loaded from prev state!
Loaded from prev state!
Loaded from prev state!
Loaded from prev state!
Loaded from prev state!
Loaded from prev state!
Loaded from prev state!
Loaded from prev state!
Loaded from prev state!
Loaded from prev state!
Loaded from prev state!
Loaded from prev state!
Loaded from prev state!
Loaded from prev state!
Loaded from prev state!
Loaded from prev state!
Loaded from prev state!
Loaded from prev state!
Loaded from prev state!
Loaded from prev state!
Loaded from prev state!
Loaded from prev state!
Loaded from prev state!
Loaded from prev state!
Loaded from prev state!
Loaded from prev state!
Loaded from prev state!
Loaded from prev state!
Loaded from prev state!
Loaded from prev state!
Loaded from prev state!
Loaded from prev state!
Loaded from prev state!
Loaded from prev state!
Loaded from prev state!
Loaded from prev state!
Loaded from prev state!
Loaded from prev state!
Loaded from prev state!
Loaded from prev state!
Loaded from prev state!
Loaded from prev state!
Loaded from prev state!
Loaded from prev state!
Loaded from prev state!
Loaded from prev state!
Loaded from prev state!
Loaded from prev state!
Loaded from prev state!
Loaded from prev state!
Loaded from prev state!
Loaded from prev state!
Loaded from prev state!
Loaded from prev state!
Loaded from prev state!
Loaded from prev state!
Loaded from prev state!
Loaded from prev state!
Loaded from prev state!
Loaded from prev state!
Loaded from prev state!
Loaded from prev state!
Loaded from prev state!
Loaded from prev state!
Loaded from prev state!
Loaded from prev state!
Loaded from prev state!
Loaded from prev state!
Loaded from prev state!
Loaded from prev state!
Loaded from prev state!
Loaded from prev state!
Loaded from prev state!
Loaded from prev state!
Loaded from prev state!
Loaded from prev state!
Loaded from prev state!
Loaded from prev state!
Loaded from prev state!
Loaded from prev state!
Loaded from prev state!
Loaded from prev state!
Loaded from prev state!
Loaded from prev state!
Loaded from prev state!
Loaded from prev state!
Loaded from prev state!
Loaded from prev state!
Loaded from prev state!
Loaded from prev state!
Loaded from prev state!
Loaded from prev state!
Loaded from prev state!
Loaded from prev state!
Loaded from prev state!
Loaded from prev state!
Loaded from prev state!
Loaded from prev state!
Loaded from prev state!
Loaded from prev state!
Loaded from prev state!
Loaded from prev state!
Loaded from prev state!
Loaded from prev state!
Loaded from prev state!
Loaded from prev state!
Loaded from prev state!
Loaded from prev state!
Loaded from prev state!
Loaded from prev state!
Loaded from prev state!
Loaded from prev state!
Loaded from prev state!
Loaded from prev state!
Loaded from prev state!
Loaded from prev state!
Loaded from prev state!
Loaded from prev state!
Loaded from prev state!
Loaded from prev state!
Loaded from prev state!
Loaded from prev state!
Loaded from prev state!
Loaded from prev state!
Loaded from prev state!
Loaded from prev state!
Loaded from prev state!
Loaded from prev state!
Loaded from prev state!
Loaded from prev state!
Loaded from prev state!
Loaded from prev state!
Loaded from prev state!
Loaded from prev state!
Loaded from prev state!
Loaded from prev state!
Loaded from prev state!
Loaded from prev state!
Loaded from prev state!
Loaded from prev state!
Loaded from prev state!
Loaded from prev state!
Loaded from prev state!
Loaded from prev state!
Loaded from prev state!
Loaded from prev state!
Loaded from prev state!
Loaded from prev state!
Loaded from prev state!
Loaded from prev state!
Loaded from prev state!
Loaded from prev state!
Loaded from prev state!
Loaded from prev state!
Loaded from prev state!
Loaded from prev state!
Loaded from prev state!
Loaded from prev state!
Loaded from prev state!
Loaded from prev state!
Loaded from prev state!
Loaded from prev state!
Loaded from prev state!
Loaded from prev state!
Loaded from prev state!
Loaded from prev state!
Loaded from prev state!
Loaded from prev state!
Loaded from prev state!
Loaded from prev state!
Loaded from prev state!
Loaded from prev state!
Loaded from prev state!
Loaded from prev state!
Loaded from prev state!
Loaded from prev state!
Loaded from prev state!
Loaded from prev state!
Loaded from prev state!
Loaded from prev state!
Loaded from prev state!
Loaded from prev state!
Loaded from prev state!
Loaded from prev state!
Loaded from prev state!
Loaded from prev state!
Loaded from prev state!
Loaded from prev state!
Loaded from prev state!
Loaded from prev state!
Loaded from prev state!
Loaded from prev state!
Loaded from prev state!
Loaded from prev state!
Loaded from prev state!
Loaded from prev state!
Loaded from prev state!
Loaded from prev state!
Loaded from prev state!
Loaded from prev state!
Loaded from prev state!
Loaded from prev state!
Loaded from prev state!
Loaded from prev state!
Loaded from prev state!
Loaded from prev state!
Loaded from prev state!
Loaded from prev state!
Loaded from prev state!
Loaded from prev state!
Loaded from prev state!
Loaded from prev state!
Loaded from prev state!
Loaded from prev state!
Loaded from prev state!
Loaded from prev state!
Loaded from prev state!
Loaded from prev state!
Loaded from prev state!
Loaded from prev state!
Loaded from prev state!
Loaded from prev state!
Loaded from prev state!
Loaded from prev state!
Loaded from prev state!
Loaded from prev state!
Loaded from prev state!
Loaded from prev state!
Loaded from prev state!
Loaded from prev state!
Loaded from prev state!
Loaded from prev state!
Loaded from prev state!
Loaded from prev state!
Loaded from prev state!
Loaded from prev state!
Loaded from prev state!
Loaded from prev state!
Loaded from prev state!
Loaded from prev state!
Loaded from prev state!
Loaded from prev state!
Loaded from prev state!
Loaded from prev state!
Loaded from prev state!
Loaded from prev state!
Loaded from prev state!
Loaded from prev state!
Loaded from prev state!
Loaded from prev state!
Loaded from prev state!
Loaded from prev state!
Loaded from prev state!
Loaded from prev state!
Loaded from prev state!
Loaded from prev state!
Loaded from prev state!
Loaded from prev state!
Loaded from prev state!
Loaded from prev state!
Loaded from prev state!
Loaded from prev state!
Loaded from prev state!
Loaded from prev state!
Loaded from prev state!
Loaded from prev state!
Loaded from prev state!
Loaded from prev state!
Loaded from prev state!
Loaded from prev state!
Loaded from prev state!
Loaded from prev state!
Loaded from prev state!
Loaded from prev state!
Loaded from prev state!
Loaded from prev state!
Loaded from prev state!
Loaded from prev state!
Loaded from prev state!
Loaded from prev state!
Loaded from prev state!
Loaded from prev state!
Loaded from prev state!
Loaded from prev state!
Loaded from prev state!
Loaded from prev state!
Loaded from prev state!
Loaded from prev state!
Loaded from prev state!
Loaded from prev state!
Loaded from prev state!
Loaded from prev state!
Loaded from prev state!
Loaded from prev state!
Loaded from prev state!
Loaded from prev state!
Loaded from prev state!
Loaded from prev state!
Loaded from prev state!
Loaded from prev state!
Loaded from prev state!
Loaded from prev state!
Loaded from prev state!
Loaded from prev state!
Loaded from prev state!
Loaded from prev state!
Loaded from prev state![I 2024-12-28 14:58:56,574] Trial 33 finished with value: 1.375 and parameters: {'x_0_0': 'oo', 'x_0_1': 'oo', 'x_1_0': 'cd', 'x_1_1': 'bd'}. Best is trial 16 with value: 0.8035714285714286.
[I 2024-12-28 14:58:56,585] Trial 29 finished with value: 1.4464285714285714 and parameters: {'x_0_0': 'bc', 'x_0_1': 'bd', 'x_1_0': 'ad', 'x_1_1': 'oo'}. Best is trial 4 with value: 1.0714285714285714.
[I 2024-12-28 14:58:56,660] Trial 36 finished with value: 1.875 and parameters: {'x_0_0': 'oo', 'x_0_1': 'bc', 'x_1_0': 'bd', 'x_1_1': 'ac'}. Best is trial 7 with value: 0.5.
[I 2024-12-28 14:58:56,689] Trial 32 finished with value: 1.0714285714285714 and parameters: {'x_0_0': 'ac', 'x_0_1': 'oo', 'x_1_0': 'bc', 'x_1_1': 'cd'}. Best is trial 15 with value: 0.6964285714285714.
[I 2024-12-28 14:58:56,722] Trial 45 finished with value: 1.1428571428571428 and parameters: {'x_0_0': 'ac', 'x_0_1': 'ad', 'x_1_0': 'ac', 'x_1_1': 'ab'}. Best is trial 1 with value: 1.0.
[I 2024-12-28 14:58:56,746] Trial 31 finished with value: 1.7142857142857144 and parameters: {'x_0_0': 'ab', 'x_0_1': 'ab', 'x_1_0': 'bd', 'x_1_1': 'ab'}. Best is trial 3 with value: 0.7857142857142857.
[I 2024-12-28 14:58:56,762] Trial 44 finished with value: 1.875 and parameters: {'x_0_0': 'oo', 'x_0_1': 'bd', 'x_1_0': 'bc', 'x_1_1': 'ab'}. Best is trial 21 with value: 0.7857142857142857.
[I 2024-12-28 14:58:56,778] Trial 44 finished with value: 1.75 and parameters: {'x_0_0': 'oo', 'x_0_1': 'bd', 'x_1_0': 'bc', 'x_1_1': 'oo'}. Best is trial 17 with value: 0.7857142857142857.
[I 2024-12-28 14:58:56,861] Trial 34 finished with value: 1.0714285714285714 and parameters: {'x_0_0': 'bc', 'x_0_1': 'oo', 'x_1_0': 'ad', 'x_1_1': 'ab'}. Best is trial 16 with value: 0.8035714285714286.
[I 2024-12-28 14:58:56,874] Trial 41 finished with value: 1.2857142857142856 and parameters: {'x_0_0': 'bc', 'x_0_1': 'ad', 'x_1_0': 'bc', 'x_1_1': 'cd'}. Best is trial 17 with value: 0.5.
[I 2024-12-28 14:58:57,045] Trial 32 finished with value: 1.4464285714285714 and parameters: {'x_0_0': 'bc', 'x_0_1': 'bc', 'x_1_0': 'cd', 'x_1_1': 'oo'}. Best is trial 3 with value: 0.7857142857142857.
[I 2024-12-28 14:58:57,053] Trial 30 finished with value: 1.375 and parameters: {'x_0_0': 'oo', 'x_0_1': 'oo', 'x_1_0': 'bc', 'x_1_1': 'bc'}. Best is trial 4 with value: 1.0714285714285714.
[I 2024-12-28 14:58:57,072] Trial 39 finished with value: 1.5714285714285714 and parameters: {'x_0_0': 'bc', 'x_0_1': 'bd', 'x_1_0': 'ac', 'x_1_1': 'cd'}. Best is trial 29 with value: 1.0.
[I 2024-12-28 14:58:57,076] Trial 33 finished with value: 1.875 and parameters: {'x_0_0': 'oo', 'x_0_1': 'ad', 'x_1_0': 'ac', 'x_1_1': 'ad'}. Best is trial 15 with value: 0.6964285714285714.
[I 2024-12-28 14:58:57,147] Trial 45 finished with value: 1.0 and parameters: {'x_0_0': 'ad', 'x_0_1': 'ad', 'x_1_0': 'bc', 'x_1_1': 'ad'}. Best is trial 21 with value: 0.7857142857142857.
[I 2024-12-28 14:58:57,171] Trial 42 finished with value: 1.2857142857142856 and parameters: {'x_0_0': 'bd', 'x_0_1': 'ab', 'x_1_0': 'bc', 'x_1_1': 'cd'}. Best is trial 17 with value: 0.5.
[I 2024-12-28 14:58:57,216] Trial 45 finished with value: 0.7857142857142857 and parameters: {'x_0_0': 'bd', 'x_0_1': 'oo', 'x_1_0': 'bc', 'x_1_1': 'cd'}. Best is trial 17 with value: 0.7857142857142857.
[I 2024-12-28 14:58:57,216] Trial 35 finished with value: 1.5714285714285714 and parameters: {'x_0_0': 'bd', 'x_0_1': 'ac', 'x_1_0': 'ac', 'x_1_1': 'ab'}. Best is trial 16 with value: 0.8035714285714286.
