[I 2024-12-06 23:38:38,879] Trial 422 finished with value: 1.2857142857142856 and parameters: {'x_0_0': 'bc', 'x_0_1': 'ac', 'x_1_0': 'bc', 'x_1_1': 'bd'}. Best is trial 165 with value: 0.5.
2024-12-06 23:38:38,934 - INFO - Candidate Mean Stats: {'Max': np.float64(2.719407315799964), 'Min': np.float64(-0.3631886131534842), 'Mean': np.float64(0.827987954724658), 'Std': np.float64(0.4368201721372029)}
2024-12-06 23:38:38,934 - INFO - Candidate Std Stats: {'Max': np.float64(1.5601207270734652), 'Min': np.float64(0.0), 'Mean': np.float64(0.4204179410617768), 'Std': np.float64(0.2818156074493755)}
[I 2024-12-06 23:38:38,949] Trial 422 finished with value: 1.1428571428571428 and parameters: {'x_0_0': 'ad', 'x_0_1': 'bd', 'x_1_0': 'bc', 'x_1_1': 'ab'}. Best is trial 63 with value: 0.5.
2024-12-06 23:38:38,996 - INFO - Candidate Mean Stats: {'Max': np.float64(2.776931683859157), 'Min': np.float64(-0.33553137974651354), 'Mean': np.float64(0.8240778674136544), 'Std': np.float64(0.4599991301121129)}
2024-12-06 23:38:38,996 - INFO - Candidate Std Stats: {'Max': np.float64(1.3824559137913999), 'Min': np.float64(0.0), 'Mean': np.float64(0.43698747480768835), 'Std': np.float64(0.28590163636600613)}
[I 2024-12-06 23:38:39,010] Trial 420 finished with value: 1.4464285714285714 and parameters: {'x_0_0': 'ad', 'x_0_1': 'bd', 'x_1_0': 'ad', 'x_1_1': 'oo'}. Best is trial 23 with value: 0.5.
2024-12-06 23:38:39,190 - INFO - Candidate Mean Stats: {'Max': np.float64(2.9783690346040665), 'Min': np.float64(-0.65871783343176), 'Mean': np.float64(0.7426607114274351), 'Std': np.float64(0.5458516522663895)}
2024-12-06 23:38:39,190 - INFO - Candidate Std Stats: {'Max': np.float64(1.6094320040756123), 'Min': np.float64(0.0), 'Mean': np.float64(0.5470632293005778), 'Std': np.float64(0.33410046733321896)}
[I 2024-12-06 23:38:39,205] Trial 423 finished with value: 1.0357142857142856 and parameters: {'x_0_0': 'ac', 'x_0_1': 'ac', 'x_1_0': 'oo', 'x_1_1': 'ab'}. Best is trial 76 with value: 0.5.
2024-12-06 23:38:39,259 - INFO - Candidate Mean Stats: {'Max': np.float64(2.905503829443078), 'Min': np.float64(-0.9002811195539839), 'Mean': np.float64(0.6643956195519564), 'Std': np.float64(0.6412694781640429)}
2024-12-06 23:38:39,260 - INFO - Candidate Std Stats: {'Max': np.float64(1.5266569830078802), 'Min': np.float64(0.0), 'Mean': np.float64(0.5274194838672651), 'Std': np.float64(0.3287090286092273)}
[I 2024-12-06 23:38:39,275] Trial 423 finished with value: 1.0357142857142856 and parameters: {'x_0_0': 'ac', 'x_0_1': 'ad', 'x_1_0': 'oo', 'x_1_1': 'ad'}. Best is trial 165 with value: 0.5.
2024-12-06 23:38:39,325 - INFO - Candidate Mean Stats: {'Max': np.float64(2.8267215324597204), 'Min': np.float64(-0.5588704387640983), 'Mean': np.float64(0.788854043237423), 'Std': np.float64(0.5203472807818506)}
2024-12-06 23:38:39,325 - INFO - Candidate Std Stats: {'Max': np.float64(1.441554884317971), 'Min': np.float64(0.0), 'Mean': np.float64(0.4622287299889612), 'Std': np.float64(0.3002477785754069)}
[I 2024-12-06 23:38:39,339] Trial 423 finished with value: 1.1607142857142856 and parameters: {'x_0_0': 'ac', 'x_0_1': 'ac', 'x_1_0': 'ad', 'x_1_1': 'oo'}. Best is trial 63 with value: 0.5.
2024-12-06 23:38:39,389 - INFO - Candidate Mean Stats: {'Max': np.float64(3.1839857271079834), 'Min': np.float64(-0.6681654472696479), 'Mean': np.float64(0.8113911373102916), 'Std': np.float64(0.5283983023366683)}
2024-12-06 23:38:39,389 - INFO - Candidate Std Stats: {'Max': np.float64(1.4247260900479513), 'Min': np.float64(0.0), 'Mean': np.float64(0.4386217094272043), 'Std': np.float64(0.27859702079066617)}
[I 2024-12-06 23:38:39,403] Trial 421 finished with value: 1.3214285714285714 and parameters: {'x_0_0': 'ad', 'x_0_1': 'cd', 'x_1_0': 'oo', 'x_1_1': 'ac'}. Best is trial 23 with value: 0.5.
2024-12-06 23:38:39,583 - INFO - Candidate Mean Stats: {'Max': np.float64(3.315040901170016), 'Min': np.float64(-0.8285920361792579), 'Mean': np.float64(0.7283672670016519), 'Std': np.float64(0.6055572844844963)}
2024-12-06 23:38:39,583 - INFO - Candidate Std Stats: {'Max': np.float64(1.6139735892145515), 'Min': np.float64(0.0), 'Mean': np.float64(0.497796773412154), 'Std': np.float64(0.32145767195383607)}
[I 2024-12-06 23:38:39,597] Trial 424 finished with value: 1.3214285714285714 and parameters: {'x_0_0': 'ad', 'x_0_1': 'ac', 'x_1_0': 'oo', 'x_1_1': 'ac'}. Best is trial 76 with value: 0.5.
2024-12-06 23:38:39,650 - INFO - Candidate Mean Stats: {'Max': np.float64(2.954139740674433), 'Min': np.float64(-0.31577587419027353), 'Mean': np.float64(0.7914742837446662), 'Std': np.float64(0.4596226489163679)}
2024-12-06 23:38:39,650 - INFO - Candidate Std Stats: {'Max': np.float64(1.644593744306435), 'Min': np.float64(0.0), 'Mean': np.float64(0.458155542101183), 'Std': np.float64(0.2974514660602906)}
[I 2024-12-06 23:38:39,664] Trial 424 finished with value: 1.0714285714285714 and parameters: {'x_0_0': 'ac', 'x_0_1': 'oo', 'x_1_0': 'ab', 'x_1_1': 'bd'}. Best is trial 165 with value: 0.5.
2024-12-06 23:38:39,718 - INFO - Candidate Mean Stats: {'Max': np.float64(3.0034351053568518), 'Min': np.float64(-0.2213909636484841), 'Mean': np.float64(0.8106228686995061), 'Std': np.float64(0.4214352962733855)}
2024-12-06 23:38:39,718 - INFO - Candidate Std Stats: {'Max': np.float64(1.6893379813405955), 'Min': np.float64(0.0), 'Mean': np.float64(0.4094227394964357), 'Std': np.float64(0.2790876021497469)}
[I 2024-12-06 23:38:39,732] Trial 424 finished with value: 1.3214285714285714 and parameters: {'x_0_0': 'bd', 'x_0_1': 'bd', 'x_1_0': 'oo', 'x_1_1': 'ab'}. Best is trial 63 with value: 0.5.
2024-12-06 23:38:39,785 - INFO - Candidate Mean Stats: {'Max': np.float64(3.0306877532310175), 'Min': np.float64(-0.37623973485075396), 'Mean': np.float64(0.8445650236263398), 'Std': np.float64(0.506785538023077)}
2024-12-06 23:38:39,785 - INFO - Candidate Std Stats: {'Max': np.float64(1.4159143243370471), 'Min': np.float64(0.0), 'Mean': np.float64(0.4271387662475702), 'Std': np.float64(0.2795170106999799)}
[I 2024-12-06 23:38:39,799] Trial 422 finished with value: 1.4464285714285714 and parameters: {'x_0_0': 'ad', 'x_0_1': 'ac', 'x_1_0': 'ad', 'x_1_1': 'oo'}. Best is trial 23 with value: 0.5.
2024-12-06 23:38:39,972 - INFO - Candidate Mean Stats: {'Max': np.float64(2.941920939038458), 'Min': np.float64(-0.7904692354579609), 'Mean': np.float64(0.7565626365997172), 'Std': np.float64(0.5499434503377777)}
2024-12-06 23:38:39,972 - INFO - Candidate Std Stats: {'Max': np.float64(1.5851666672456441), 'Min': np.float64(0.0), 'Mean': np.float64(0.4832625693011059), 'Std': np.float64(0.31618451680140175)}
[I 2024-12-06 23:38:39,986] Trial 425 finished with value: 1.0357142857142856 and parameters: {'x_0_0': 'bc', 'x_0_1': 'ac', 'x_1_0': 'oo', 'x_1_1': 'ac'}. Best is trial 76 with value: 0.5.
2024-12-06 23:38:40,039 - INFO - Candidate Mean Stats: {'Max': np.float64(2.8517206538112148), 'Min': np.float64(-0.6677723237596849), 'Mean': np.float64(0.7537741348849137), 'Std': np.float64(0.5385132221151093)}
2024-12-06 23:38:40,039 - INFO - Candidate Std Stats: {'Max': np.float64(2.018366537479396), 'Min': np.float64(0.0), 'Mean': np.float64(0.4933905716831665), 'Std': np.float64(0.3340075456747037)}
[I 2024-12-06 23:38:40,053] Trial 425 finished with value: 1.4285714285714286 and parameters: {'x_0_0': 'bc', 'x_0_1': 'ab', 'x_1_0': 'ad', 'x_1_1': 'ac'}. Best is trial 165 with value: 0.5.
2024-12-06 23:38:40,109 - INFO - Candidate Mean Stats: {'Max': np.float64(3.0215667706699714), 'Min': np.float64(-0.3275566610494316), 'Mean': np.float64(0.8103282499175436), 'Std': np.float64(0.48157473366718173)}
2024-12-06 23:38:40,109 - INFO - Candidate Std Stats: {'Max': np.float64(1.3130732088591135), 'Min': np.float64(0.0), 'Mean': np.float64(0.40732085475604696), 'Std': np.float64(0.26955078313240416)}
[I 2024-12-06 23:38:40,123] Trial 425 finished with value: 1.3214285714285714 and parameters: {'x_0_0': 'bd', 'x_0_1': 'cd', 'x_1_0': 'oo', 'x_1_1': 'ab'}. Best is trial 63 with value: 0.5.
2024-12-06 23:38:40,179 - INFO - Candidate Mean Stats: {'Max': np.float64(2.8549030949404037), 'Min': np.float64(-0.5485126548234505), 'Mean': np.float64(0.814064972377219), 'Std': np.float64(0.502287995278541)}
2024-12-06 23:38:40,179 - INFO - Candidate Std Stats: {'Max': np.float64(1.6203247473436104), 'Min': np.float64(0.0), 'Mean': np.float64(0.4441192272162811), 'Std': np.float64(0.28745977292902936)}
[I 2024-12-06 23:38:40,194] Trial 423 finished with value: 1.1785714285714286 and parameters: {'x_0_0': 'ac', 'x_0_1': 'ab', 'x_1_0': 'oo', 'x_1_1': 'ad'}. Best is trial 23 with value: 0.5.
2024-12-06 23:38:40,363 - INFO - Candidate Mean Stats: {'Max': np.float64(3.7754057069648668), 'Min': np.float64(-0.7232084124567971), 'Mean': np.float64(0.7808908102612455), 'Std': np.float64(0.5688599557977578)}
2024-12-06 23:38:40,363 - INFO - Candidate Std Stats: {'Max': np.float64(1.2855826908524415), 'Min': np.float64(0.0), 'Mean': np.float64(0.4339998931131237), 'Std': np.float64(0.263401559673664)}
[I 2024-12-06 23:38:40,377] Trial 426 finished with value: 1.2857142857142856 and parameters: {'x_0_0': 'ad', 'x_0_1': 'ad', 'x_1_0': 'bd', 'x_1_1': 'bc'}. Best is trial 76 with value: 0.5.
2024-12-06 23:38:40,432 - INFO - Candidate Mean Stats: {'Max': np.float64(2.914307948420999), 'Min': np.float64(-0.7411877427037805), 'Mean': np.float64(0.6703025011045483), 'Std': np.float64(0.61986337220183)}
2024-12-06 23:38:40,432 - INFO - Candidate Std Stats: {'Max': np.float64(1.678877644542756), 'Min': np.float64(0.0), 'Mean': np.float64(0.5540896076610834), 'Std': np.float64(0.34622827348608703)}
[I 2024-12-06 23:38:40,447] Trial 426 finished with value: 1.2857142857142856 and parameters: {'x_0_0': 'ad', 'x_0_1': 'ac', 'x_1_0': 'bd', 'x_1_1': 'bc'}. Best is trial 165 with value: 0.5.
2024-12-06 23:38:40,499 - INFO - Candidate Mean Stats: {'Max': np.float64(3.294863477462924), 'Min': np.float64(-0.42676222123805096), 'Mean': np.float64(0.8138039597452477), 'Std': np.float64(0.45148435490479694)}
2024-12-06 23:38:40,499 - INFO - Candidate Std Stats: {'Max': np.float64(1.4441800015118271), 'Min': np.float64(0.0), 'Mean': np.float64(0.3926066129309453), 'Std': np.float64(0.2660243692075543)}
[I 2024-12-06 23:38:40,514] Trial 426 finished with value: 1.375 and parameters: {'x_0_0': 'oo', 'x_0_1': 'oo', 'x_1_0': 'bd', 'x_1_1': 'ac'}. Best is trial 63 with value: 0.5.
2024-12-06 23:38:40,578 - INFO - Candidate Mean Stats: {'Max': np.float64(2.9807484760194), 'Min': np.float64(-0.6082518800592941), 'Mean': np.float64(0.819164836578308), 'Std': np.float64(0.5085096594926255)}
2024-12-06 23:38:40,578 - INFO - Candidate Std Stats: {'Max': np.float64(1.4128488952195182), 'Min': np.float64(0.0), 'Mean': np.float64(0.44597551933356594), 'Std': np.float64(0.2832381854217885)}
[I 2024-12-06 23:38:40,593] Trial 424 finished with value: 1.1964285714285714 and parameters: {'x_0_0': 'bd', 'x_0_1': 'bd', 'x_1_0': 'oo', 'x_1_1': 'oo'}. Best is trial 23 with value: 0.5.
2024-12-06 23:38:40,758 - INFO - Candidate Mean Stats: {'Max': np.float64(3.3915829021947), 'Min': np.float64(-0.5157624136438046), 'Mean': np.float64(0.7096323838477149), 'Std': np.float64(0.533478178620292)}
2024-12-06 23:38:40,758 - INFO - Candidate Std Stats: {'Max': np.float64(1.6669969356023087), 'Min': np.float64(0.0), 'Mean': np.float64(0.5068792111184771), 'Std': np.float64(0.3192436083472925)}
[I 2024-12-06 23:38:40,772] Trial 427 finished with value: 1.2857142857142856 and parameters: {'x_0_0': 'bc', 'x_0_1': 'ad', 'x_1_0': 'ab', 'x_1_1': 'cd'}. Best is trial 76 with value: 0.5.
2024-12-06 23:38:40,826 - INFO - Candidate Mean Stats: {'Max': np.float64(3.424292899338661), 'Min': np.float64(-0.518685826256046), 'Mean': np.float64(0.8159849539653341), 'Std': np.float64(0.5424806974633499)}
2024-12-06 23:38:40,826 - INFO - Candidate Std Stats: {'Max': np.float64(1.631407379609689), 'Min': np.float64(0.0), 'Mean': np.float64(0.47072002160106524), 'Std': np.float64(0.29564614433720254)}
[I 2024-12-06 23:38:40,840] Trial 427 finished with value: 1.2857142857142856 and parameters: {'x_0_0': 'bd', 'x_0_1': 'ac', 'x_1_0': 'bd', 'x_1_1': 'ab'}. Best is trial 165 with value: 0.5.
2024-12-06 23:38:40,892 - INFO - Candidate Mean Stats: {'Max': np.float64(2.948752832377541), 'Min': np.float64(-0.36323206412707065), 'Mean': np.float64(0.8601613398177058), 'Std': np.float64(0.4552544179567088)}
2024-12-06 23:38:40,893 - INFO - Candidate Std Stats: {'Max': np.float64(1.8734343852965396), 'Min': np.float64(0.0), 'Mean': np.float64(0.38713293269995763), 'Std': np.float64(0.28104871567521245)}
[I 2024-12-06 23:38:40,907] Trial 427 finished with value: 1.5714285714285714 and parameters: {'x_0_0': 'ac', 'x_0_1': 'cd', 'x_1_0': 'bc', 'x_1_1': 'ab'}. Best is trial 63 with value: 0.5.
2024-12-06 23:38:40,976 - INFO - Candidate Mean Stats: {'Max': np.float64(2.9159791648283075), 'Min': np.float64(-0.39547016294168247), 'Mean': np.float64(0.8080000633287143), 'Std': np.float64(0.4743506819929507)}
2024-12-06 23:38:40,976 - INFO - Candidate Std Stats: {'Max': np.float64(1.3501443615925586), 'Min': np.float64(0.0), 'Mean': np.float64(0.41259192669002775), 'Std': np.float64(0.26617533920829106)}
[I 2024-12-06 23:38:40,990] Trial 425 finished with value: 1.2142857142857144 and parameters: {'x_0_0': 'ab', 'x_0_1': 'oo', 'x_1_0': 'ac', 'x_1_1': 'bd'}. Best is trial 23 with value: 0.5.
2024-12-06 23:38:41,166 - INFO - Candidate Mean Stats: {'Max': np.float64(3.3896649208365894), 'Min': np.float64(-0.580296941936659), 'Mean': np.float64(0.7719839866021879), 'Std': np.float64(0.5356059607509239)}
2024-12-06 23:38:41,166 - INFO - Candidate Std Stats: {'Max': np.float64(1.4406217550340226), 'Min': np.float64(0.0), 'Mean': np.float64(0.47374767046289906), 'Std': np.float64(0.30676244225331045)}
[I 2024-12-06 23:38:41,180] Trial 428 finished with value: 1.3214285714285714 and parameters: {'x_0_0': 'ac', 'x_0_1': 'bc', 'x_1_0': 'oo', 'x_1_1': 'ac'}. Best is trial 76 with value: 0.5.
2024-12-06 23:38:41,226 - INFO - Candidate Mean Stats: {'Max': np.float64(3.035599044576592), 'Min': np.float64(-0.6793109495908904), 'Mean': np.float64(0.735799732695364), 'Std': np.float64(0.5526893502963144)}
2024-12-06 23:38:41,226 - INFO - Candidate Std Stats: {'Max': np.float64(1.8074805199732906), 'Min': np.float64(0.0), 'Mean': np.float64(0.5154678292302683), 'Std': np.float64(0.3336037106090407)}
[I 2024-12-06 23:38:41,241] Trial 428 finished with value: 1.375 and parameters: {'x_0_0': 'oo', 'x_0_1': 'oo', 'x_1_0': 'ad', 'x_1_1': 'ad'}. Best is trial 165 with value: 0.5.
2024-12-06 23:38:41,291 - INFO - Candidate Mean Stats: {'Max': np.float64(3.029352388269037), 'Min': np.float64(-0.28925227649385093), 'Mean': np.float64(0.8076229493597906), 'Std': np.float64(0.46642162771942897)}
2024-12-06 23:38:41,291 - INFO - Candidate Std Stats: {'Max': np.float64(1.5259047201778346), 'Min': np.float64(0.0), 'Mean': np.float64(0.38933362318438386), 'Std': np.float64(0.25535121860246063)}
[I 2024-12-06 23:38:41,305] Trial 428 finished with value: 1.3214285714285714 and parameters: {'x_0_0': 'bc', 'x_0_1': 'bd', 'x_1_0': 'oo', 'x_1_1': 'bc'}. Best is trial 63 with value: 0.5.
2024-12-06 23:38:41,377 - INFO - Candidate Mean Stats: {'Max': np.float64(3.032200691245021), 'Min': np.float64(-0.519048152999307), 'Mean': np.float64(0.8066880099973067), 'Std': np.float64(0.5039100224276957)}
2024-12-06 23:38:41,377 - INFO - Candidate Std Stats: {'Max': np.float64(1.3963691577352548), 'Min': np.float64(0.0), 'Mean': np.float64(0.44578660409897825), 'Std': np.float64(0.2808565666817284)}
[I 2024-12-06 23:38:41,391] Trial 426 finished with value: 1.2857142857142856 and parameters: {'x_0_0': 'bc', 'x_0_1': 'ad', 'x_1_0': 'bc', 'x_1_1': 'ad'}. Best is trial 23 with value: 0.5.
2024-12-06 23:38:41,558 - INFO - Candidate Mean Stats: {'Max': np.float64(2.9273550975016827), 'Min': np.float64(-0.5281558901867026), 'Mean': np.float64(0.7153816728963521), 'Std': np.float64(0.5421534970103067)}
2024-12-06 23:38:41,558 - INFO - Candidate Std Stats: {'Max': np.float64(1.5173323385648476), 'Min': np.float64(0.0), 'Mean': np.float64(0.5092028134539699), 'Std': np.float64(0.3116766438820097)}
[I 2024-12-06 23:38:41,572] Trial 429 finished with value: 1.5714285714285714 and parameters: {'x_0_0': 'ad', 'x_0_1': 'ab', 'x_1_0': 'ac', 'x_1_1': 'ad'}. Best is trial 76 with value: 0.5.
2024-12-06 23:38:41,618 - INFO - Candidate Mean Stats: {'Max': np.float64(3.0826263530087337), 'Min': np.float64(-0.5658138536044921), 'Mean': np.float64(0.8109706794371635), 'Std': np.float64(0.5073455094297527)}
2024-12-06 23:38:41,618 - INFO - Candidate Std Stats: {'Max': np.float64(1.5731833809846028), 'Min': np.float64(0.0), 'Mean': np.float64(0.47006002745667186), 'Std': np.float64(0.29992547029379585)}
[I 2024-12-06 23:38:41,632] Trial 429 finished with value: 1.1607142857142856 and parameters: {'x_0_0': 'ad', 'x_0_1': 'ad', 'x_1_0': 'bd', 'x_1_1': 'oo'}. Best is trial 165 with value: 0.5.
2024-12-06 23:38:41,682 - INFO - Candidate Mean Stats: {'Max': np.float64(2.5948540113601597), 'Min': np.float64(-0.6887132781539144), 'Mean': np.float64(0.7913754077422033), 'Std': np.float64(0.5111237316598977)}
2024-12-06 23:38:41,682 - INFO - Candidate Std Stats: {'Max': np.float64(1.4148375699271885), 'Min': np.float64(0.0), 'Mean': np.float64(0.4251839224311251), 'Std': np.float64(0.26905067837608065)}
[I 2024-12-06 23:38:41,696] Trial 429 finished with value: 1.2857142857142856 and parameters: {'x_0_0': 'ad', 'x_0_1': 'ab', 'x_1_0': 'bd', 'x_1_1': 'bd'}. Best is trial 63 with value: 0.5.
2024-12-06 23:38:41,770 - INFO - Candidate Mean Stats: {'Max': np.float64(3.0110830983186263), 'Min': np.float64(-0.4947896433634914), 'Mean': np.float64(0.8103519516725347), 'Std': np.float64(0.49491692514329255)}
2024-12-06 23:38:41,771 - INFO - Candidate Std Stats: {'Max': np.float64(1.2005391264237781), 'Min': np.float64(0.0), 'Mean': np.float64(0.41910885506488155), 'Std': np.float64(0.2647299164526021)}
[I 2024-12-06 23:38:41,784] Trial 427 finished with value: 1.2857142857142856 and parameters: {'x_0_0': 'ac', 'x_0_1': 'ac', 'x_1_0': 'bd', 'x_1_1': 'bc'}. Best is trial 23 with value: 0.5.
2024-12-06 23:38:41,948 - INFO - Candidate Mean Stats: {'Max': np.float64(3.453893983313651), 'Min': np.float64(-0.4681975812625975), 'Mean': np.float64(0.7926948469747099), 'Std': np.float64(0.5141702546253151)}
2024-12-06 23:38:41,949 - INFO - Candidate Std Stats: {'Max': np.float64(1.5756838025776951), 'Min': np.float64(0.0), 'Mean': np.float64(0.4452942130839089), 'Std': np.float64(0.2821186904187977)}
[I 2024-12-06 23:38:41,964] Trial 430 finished with value: 1.2857142857142856 and parameters: {'x_0_0': 'bc', 'x_0_1': 'ac', 'x_1_0': 'ab', 'x_1_1': 'bd'}. Best is trial 76 with value: 0.5.
2024-12-06 23:38:42,007 - INFO - Candidate Mean Stats: {'Max': np.float64(3.4372465129327407), 'Min': np.float64(-0.6320425874667881), 'Mean': np.float64(0.7514410324171478), 'Std': np.float64(0.5459420782524274)}
2024-12-06 23:38:42,008 - INFO - Candidate Std Stats: {'Max': np.float64(1.4732059277417582), 'Min': np.float64(0.0), 'Mean': np.float64(0.5032412960564844), 'Std': np.float64(0.3242819180553231)}
[I 2024-12-06 23:38:42,022] Trial 430 finished with value: 1.375 and parameters: {'x_0_0': 'oo', 'x_0_1': 'oo', 'x_1_0': 'ac', 'x_1_1': 'bd'}. Best is trial 165 with value: 0.5.
2024-12-06 23:38:42,074 - INFO - Candidate Mean Stats: {'Max': np.float64(2.744352357753631), 'Min': np.float64(-0.4951992012177491), 'Mean': np.float64(0.8142474703859482), 'Std': np.float64(0.5031669943072796)}
2024-12-06 23:38:42,074 - INFO - Candidate Std Stats: {'Max': np.float64(1.415571894033397), 'Min': np.float64(0.0), 'Mean': np.float64(0.45149983404736116), 'Std': np.float64(0.2875857375394871)}
[I 2024-12-06 23:38:42,088] Trial 430 finished with value: 1.2142857142857144 and parameters: {'x_0_0': 'ab', 'x_0_1': 'oo', 'x_1_0': 'ab', 'x_1_1': 'cd'}. Best is trial 63 with value: 0.5.
2024-12-06 23:38:42,164 - INFO - Candidate Mean Stats: {'Max': np.float64(3.163743282637615), 'Min': np.float64(-0.24059188054218322), 'Mean': np.float64(0.8355038707079351), 'Std': np.float64(0.4596889915656386)}
2024-12-06 23:38:42,164 - INFO - Candidate Std Stats: {'Max': np.float64(1.4833446803747765), 'Min': np.float64(0.0), 'Mean': np.float64(0.43036808579194125), 'Std': np.float64(0.2822590903842367)}
[I 2024-12-06 23:38:42,179] Trial 428 finished with value: 1.2142857142857144 and parameters: {'x_0_0': 'ab', 'x_0_1': 'oo', 'x_1_0': 'ab', 'x_1_1': 'ac'}. Best is trial 23 with value: 0.5.
2024-12-06 23:38:42,341 - INFO - Candidate Mean Stats: {'Max': np.float64(3.035751693542968), 'Min': np.float64(-0.8261797156613199), 'Mean': np.float64(0.7763821680772612), 'Std': np.float64(0.5347362326368349)}
2024-12-06 23:38:42,341 - INFO - Candidate Std Stats: {'Max': np.float64(1.678189228539378), 'Min': np.float64(0.0), 'Mean': np.float64(0.5137783865064883), 'Std': np.float64(0.32795039232175055)}
[I 2024-12-06 23:38:42,356] Trial 431 finished with value: 1.625 and parameters: {'x_0_0': 'oo', 'x_0_1': 'ad', 'x_1_0': 'oo', 'x_1_1': 'bc'}. Best is trial 76 with value: 0.5.
2024-12-06 23:38:42,403 - INFO - Candidate Mean Stats: {'Max': np.float64(3.0392633820407897), 'Min': np.float64(-0.9831784733299207), 'Mean': np.float64(0.7427802336617911), 'Std': np.float64(0.5517079862449783)}
2024-12-06 23:38:42,403 - INFO - Candidate Std Stats: {'Max': np.float64(1.7119080820693031), 'Min': np.float64(0.0), 'Mean': np.float64(0.519377465380664), 'Std': np.float64(0.3332367998888561)}
