[I 2024-12-07 00:16:33,884] Trial 95 finished with value: 1.4 and parameters: {'x_0_0': 'cd', 'x_0_1': 'oo', 'x_0_2': 'bd', 'x_1_0': 'oo', 'x_1_1': 'ad', 'x_1_2': 'bd'}. Best is trial 88 with value: 1.0666666666666667.
2024-12-07 00:16:36,843 - INFO - Candidate Mean Stats: {'Max': np.float64(2.0), 'Min': np.float64(0.18857913231621182), 'Mean': np.float64(0.48759709175691157), 'Std': np.float64(0.07386481852300487)}
2024-12-07 00:16:36,844 - INFO - Candidate Std Stats: {'Max': np.float64(0.479246998172381), 'Min': np.float64(0.0), 'Mean': np.float64(0.11477579544991678), 'Std': np.float64(0.04819155799951837)}
[I 2024-12-07 00:16:36,894] Trial 95 finished with value: 2.0 and parameters: {'x_0_0': 'cd', 'x_0_1': 'ac', 'x_0_2': 'bd', 'x_1_0': 'ad', 'x_1_1': 'ab', 'x_1_2': 'ad'}. Best is trial 49 with value: 0.7999999999999999.
2024-12-07 00:16:39,866 - INFO - Candidate Mean Stats: {'Max': np.float64(2.0), 'Min': np.float64(0.22731598050911628), 'Mean': np.float64(0.48885590041829724), 'Std': np.float64(0.06303238997002684)}
2024-12-07 00:16:39,867 - INFO - Candidate Std Stats: {'Max': np.float64(0.4855994972317478), 'Min': np.float64(0.0), 'Mean': np.float64(0.10791652376859213), 'Std': np.float64(0.047508496683495965)}
[I 2024-12-07 00:16:39,928] Trial 95 finished with value: 1.2666666666666666 and parameters: {'x_0_0': 'bc', 'x_0_1': 'oo', 'x_0_2': 'cd', 'x_1_0': 'ad', 'x_1_1': 'ab', 'x_1_2': 'ac'}. Best is trial 67 with value: 1.0222222222222221.
2024-12-07 00:16:51,461 - INFO - Candidate Mean Stats: {'Max': np.float64(2.0), 'Min': np.float64(0.2303389922127843), 'Mean': np.float64(0.48702337586095934), 'Std': np.float64(0.06163919402652183)}
2024-12-07 00:16:51,462 - INFO - Candidate Std Stats: {'Max': np.float64(0.5157187207756141), 'Min': np.float64(0.0), 'Mean': np.float64(0.11112155321020355), 'Std': np.float64(0.045619292686462684)}
[I 2024-12-07 00:16:51,525] Trial 95 finished with value: 1.7999999999999998 and parameters: {'x_0_0': 'cd', 'x_0_1': 'bd', 'x_0_2': 'oo', 'x_1_0': 'ad', 'x_1_1': 'bd', 'x_1_2': 'oo'}. Best is trial 74 with value: 0.8222222222222222.
2024-12-07 00:16:59,706 - INFO - Candidate Mean Stats: {'Max': np.float64(2.0), 'Min': np.float64(0.2785684408120751), 'Mean': np.float64(0.49353678529216705), 'Std': np.float64(0.059260680447347454)}
2024-12-07 00:16:59,706 - INFO - Candidate Std Stats: {'Max': np.float64(0.4257469315920374), 'Min': np.float64(0.0), 'Mean': np.float64(0.09498255459431698), 'Std': np.float64(0.03903362453787762)}
[I 2024-12-07 00:16:59,769] Trial 96 finished with value: 1.6777777777777778 and parameters: {'x_0_0': 'ab', 'x_0_1': 'bd', 'x_0_2': 'ad', 'x_1_0': 'ab', 'x_1_1': 'ab', 'x_1_2': 'oo'}. Best is trial 88 with value: 1.0666666666666667.
2024-12-07 00:17:03,234 - INFO - Candidate Mean Stats: {'Max': np.float64(2.0), 'Min': np.float64(0.246224244632689), 'Mean': np.float64(0.4860415130146106), 'Std': np.float64(0.06588087635844678)}
2024-12-07 00:17:03,235 - INFO - Candidate Std Stats: {'Max': np.float64(0.46882278667338423), 'Min': np.float64(0.0), 'Mean': np.float64(0.1076067902270819), 'Std': np.float64(0.047204686674500236)}
[I 2024-12-07 00:17:03,286] Trial 96 finished with value: 1.4666666666666666 and parameters: {'x_0_0': 'bc', 'x_0_1': 'cd', 'x_0_2': 'ad', 'x_1_0': 'oo', 'x_1_1': 'cd', 'x_1_2': 'ad'}. Best is trial 49 with value: 0.7999999999999999.
2024-12-07 00:17:05,936 - INFO - Candidate Mean Stats: {'Max': np.float64(2.0), 'Min': np.float64(0.27835251064763555), 'Mean': np.float64(0.4861553300013877), 'Std': np.float64(0.07011782566861621)}
2024-12-07 00:17:05,937 - INFO - Candidate Std Stats: {'Max': np.float64(0.7966535487935693), 'Min': np.float64(0.0), 'Mean': np.float64(0.10603259679087217), 'Std': np.float64(0.04876189988423206)}
[I 2024-12-07 00:17:05,986] Trial 96 finished with value: 1.7777777777777777 and parameters: {'x_0_0': 'ab', 'x_0_1': 'ab', 'x_0_2': 'bc', 'x_1_0': 'cd', 'x_1_1': 'ad', 'x_1_2': 'ac'}. Best is trial 67 with value: 1.0222222222222221.
2024-12-07 00:17:16,582 - INFO - Candidate Mean Stats: {'Max': np.float64(2.0), 'Min': np.float64(0.3034645391817701), 'Mean': np.float64(0.4936543215327358), 'Std': np.float64(0.06033961186665376)}
2024-12-07 00:17:16,583 - INFO - Candidate Std Stats: {'Max': np.float64(1.7069962938747423), 'Min': np.float64(0.0), 'Mean': np.float64(0.09946665764932522), 'Std': np.float64(0.049863648045208216)}
[I 2024-12-07 00:17:16,629] Trial 96 finished with value: 1.2666666666666666 and parameters: {'x_0_0': 'bd', 'x_0_1': 'oo', 'x_0_2': 'bd', 'x_1_0': 'ac', 'x_1_1': 'bd', 'x_1_2': 'cd'}. Best is trial 74 with value: 0.8222222222222222.
2024-12-07 00:17:24,417 - INFO - Candidate Mean Stats: {'Max': np.float64(2.0), 'Min': np.float64(0.3139839527983046), 'Mean': np.float64(0.4919279194503937), 'Std': np.float64(0.06564580764123074)}
2024-12-07 00:17:24,418 - INFO - Candidate Std Stats: {'Max': np.float64(0.5520563135247102), 'Min': np.float64(0.0), 'Mean': np.float64(0.10667274026277518), 'Std': np.float64(0.046404915735306494)}
[I 2024-12-07 00:17:24,476] Trial 97 finished with value: 1.6777777777777778 and parameters: {'x_0_0': 'ab', 'x_0_1': 'ac', 'x_0_2': 'cd', 'x_1_0': 'ad', 'x_1_1': 'oo', 'x_1_2': 'cd'}. Best is trial 88 with value: 1.0666666666666667.
2024-12-07 00:17:27,760 - INFO - Candidate Mean Stats: {'Max': np.float64(2.0), 'Min': np.float64(0.1336600333365075), 'Mean': np.float64(0.48191312318880264), 'Std': np.float64(0.07701627983379716)}
2024-12-07 00:17:27,760 - INFO - Candidate Std Stats: {'Max': np.float64(1.303925013319272), 'Min': np.float64(0.0), 'Mean': np.float64(0.12075634934337695), 'Std': np.float64(0.06439657597758812)}
[I 2024-12-07 00:17:27,808] Trial 97 finished with value: 1.4444444444444444 and parameters: {'x_0_0': 'ad', 'x_0_1': 'ac', 'x_0_2': 'ab', 'x_1_0': 'bd', 'x_1_1': 'ab', 'x_1_2': 'ab'}. Best is trial 49 with value: 0.7999999999999999.
2024-12-07 00:17:31,717 - INFO - Candidate Mean Stats: {'Max': np.float64(2.0), 'Min': np.float64(0.27351692530460714), 'Mean': np.float64(0.4934298307764078), 'Std': np.float64(0.0614564753230208)}
2024-12-07 00:17:31,718 - INFO - Candidate Std Stats: {'Max': np.float64(0.7854568756250442), 'Min': np.float64(0.0), 'Mean': np.float64(0.10712228389372289), 'Std': np.float64(0.0483156311034264)}
[I 2024-12-07 00:17:31,770] Trial 97 finished with value: 1.5666666666666667 and parameters: {'x_0_0': 'ac', 'x_0_1': 'bd', 'x_0_2': 'ab', 'x_1_0': 'ab', 'x_1_1': 'cd', 'x_1_2': 'oo'}. Best is trial 67 with value: 1.0222222222222221.
2024-12-07 00:17:42,844 - INFO - Candidate Mean Stats: {'Max': np.float64(2.0), 'Min': np.float64(0.2863073929211707), 'Mean': np.float64(0.4903178343530823), 'Std': np.float64(0.06405124357685679)}
2024-12-07 00:17:42,845 - INFO - Candidate Std Stats: {'Max': np.float64(0.4205859043295726), 'Min': np.float64(0.0), 'Mean': np.float64(0.11010937882710656), 'Std': np.float64(0.045026686927548666)}
[I 2024-12-07 00:17:42,893] Trial 97 finished with value: 0.9666666666666667 and parameters: {'x_0_0': 'bd', 'x_0_1': 'oo', 'x_0_2': 'oo', 'x_1_0': 'oo', 'x_1_1': 'ac', 'x_1_2': 'bc'}. Best is trial 74 with value: 0.8222222222222222.
2024-12-07 00:17:50,316 - INFO - Candidate Mean Stats: {'Max': np.float64(2.0), 'Min': np.float64(0.18050432013406087), 'Mean': np.float64(0.48121818890476287), 'Std': np.float64(0.07466609125727613)}
2024-12-07 00:17:50,317 - INFO - Candidate Std Stats: {'Max': np.float64(1.5113515888015687), 'Min': np.float64(0.0), 'Mean': np.float64(0.12298201978854838), 'Std': np.float64(0.06235616795707759)}
[I 2024-12-07 00:17:50,367] Trial 98 finished with value: 1.6666666666666665 and parameters: {'x_0_0': 'bc', 'x_0_1': 'bc', 'x_0_2': 'bc', 'x_1_0': 'cd', 'x_1_1': 'ab', 'x_1_2': 'ac'}. Best is trial 88 with value: 1.0666666666666667.
2024-12-07 00:17:53,481 - INFO - Candidate Mean Stats: {'Max': np.float64(2.0), 'Min': np.float64(0.2999683505531087), 'Mean': np.float64(0.4864499722414598), 'Std': np.float64(0.06081435797355687)}
2024-12-07 00:17:53,481 - INFO - Candidate Std Stats: {'Max': np.float64(0.4872005541317695), 'Min': np.float64(0.0), 'Mean': np.float64(0.09984081542891407), 'Std': np.float64(0.04218287580276812)}
[I 2024-12-07 00:17:53,538] Trial 98 finished with value: 1.3444444444444446 and parameters: {'x_0_0': 'ad', 'x_0_1': 'ad', 'x_0_2': 'ac', 'x_1_0': 'bc', 'x_1_1': 'bc', 'x_1_2': 'oo'}. Best is trial 49 with value: 0.7999999999999999.
2024-12-07 00:17:57,410 - INFO - Candidate Mean Stats: {'Max': np.float64(2.0), 'Min': np.float64(0.2739522618544744), 'Mean': np.float64(0.48657795360960515), 'Std': np.float64(0.06487857122965751)}
2024-12-07 00:17:57,411 - INFO - Candidate Std Stats: {'Max': np.float64(0.3463828711929205), 'Min': np.float64(0.0), 'Mean': np.float64(0.10832440951264298), 'Std': np.float64(0.04124964158144773)}
[I 2024-12-07 00:17:57,468] Trial 98 finished with value: 1.2666666666666666 and parameters: {'x_0_0': 'bc', 'x_0_1': 'oo', 'x_0_2': 'bc', 'x_1_0': 'cd', 'x_1_1': 'cd', 'x_1_2': 'bc'}. Best is trial 67 with value: 1.0222222222222221.
2024-12-07 00:18:07,700 - INFO - Candidate Mean Stats: {'Max': np.float64(2.0), 'Min': np.float64(0.1535674187804766), 'Mean': np.float64(0.48001682376235055), 'Std': np.float64(0.06741580585389663)}
2024-12-07 00:18:07,701 - INFO - Candidate Std Stats: {'Max': np.float64(0.6588609430137907), 'Min': np.float64(0.0), 'Mean': np.float64(0.10384029304327688), 'Std': np.float64(0.04902293741528579)}
[I 2024-12-07 00:18:07,746] Trial 98 finished with value: 1.2444444444444445 and parameters: {'x_0_0': 'ac', 'x_0_1': 'ac', 'x_0_2': 'oo', 'x_1_0': 'bc', 'x_1_1': 'ad', 'x_1_2': 'oo'}. Best is trial 74 with value: 0.8222222222222222.
2024-12-07 00:18:14,595 - INFO - Candidate Mean Stats: {'Max': np.float64(2.0), 'Min': np.float64(0.20130999064235483), 'Mean': np.float64(0.485010970217839), 'Std': np.float64(0.07441131283367977)}
2024-12-07 00:18:14,595 - INFO - Candidate Std Stats: {'Max': np.float64(1.2000649038161957), 'Min': np.float64(0.0), 'Mean': np.float64(0.12276841647125437), 'Std': np.float64(0.06304465530370836)}
[I 2024-12-07 00:18:14,645] Trial 99 finished with value: 2.0 and parameters: {'x_0_0': 'cd', 'x_0_1': 'cd', 'x_0_2': 'cd', 'x_1_0': 'bc', 'x_1_1': 'ab', 'x_1_2': 'bc'}. Best is trial 88 with value: 1.0666666666666667.
2024-12-07 00:18:17,304 - INFO - Candidate Mean Stats: {'Max': np.float64(2.0), 'Min': np.float64(0.2289915983925634), 'Mean': np.float64(0.48587859842619896), 'Std': np.float64(0.06481458892050454)}
2024-12-07 00:18:17,305 - INFO - Candidate Std Stats: {'Max': np.float64(0.5602193115241656), 'Min': np.float64(0.0), 'Mean': np.float64(0.1092928437486459), 'Std': np.float64(0.048117333814132864)}
[I 2024-12-07 00:18:17,354] Trial 99 finished with value: 1.7 and parameters: {'x_0_0': 'oo', 'x_0_1': 'bc', 'x_0_2': 'ac', 'x_1_0': 'oo', 'x_1_1': 'ad', 'x_1_2': 'ad'}. Best is trial 49 with value: 0.7999999999999999.
2024-12-07 00:18:19,979 - INFO - Candidate Mean Stats: {'Max': np.float64(2.0), 'Min': np.float64(0.2153455434039168), 'Mean': np.float64(0.4844448665870914), 'Std': np.float64(0.0697061518037699)}
2024-12-07 00:18:19,979 - INFO - Candidate Std Stats: {'Max': np.float64(1.451737208409022), 'Min': np.float64(0.0), 'Mean': np.float64(0.11387493925356364), 'Std': np.float64(0.059429373685359534)}
[I 2024-12-07 00:18:20,027] Trial 99 finished with value: 0.9444444444444444 and parameters: {'x_0_0': 'bd', 'x_0_1': 'oo', 'x_0_2': 'bc', 'x_1_0': 'bc', 'x_1_1': 'oo', 'x_1_2': 'bc'}. Best is trial 99 with value: 0.9444444444444444.
2024-12-07 00:18:31,635 - INFO - Candidate Mean Stats: {'Max': np.float64(2.0), 'Min': np.float64(0.2772888198937381), 'Mean': np.float64(0.4841003275969001), 'Std': np.float64(0.06454395571542662)}
2024-12-07 00:18:31,636 - INFO - Candidate Std Stats: {'Max': np.float64(0.32690987226352053), 'Min': np.float64(0.0), 'Mean': np.float64(0.09707795755097519), 'Std': np.float64(0.03839215635023076)}
[I 2024-12-07 00:18:31,688] Trial 99 finished with value: 1.1555555555555554 and parameters: {'x_0_0': 'bd', 'x_0_1': 'oo', 'x_0_2': 'bc', 'x_1_0': 'ab', 'x_1_1': 'ad', 'x_1_2': 'ab'}. Best is trial 74 with value: 0.8222222222222222.
2024-12-07 00:18:38,874 - INFO - Candidate Mean Stats: {'Max': np.float64(2.0), 'Min': np.float64(0.27967975438170606), 'Mean': np.float64(0.493986910171253), 'Std': np.float64(0.06730713212900821)}
2024-12-07 00:18:38,874 - INFO - Candidate Std Stats: {'Max': np.float64(1.4263475198249582), 'Min': np.float64(0.0), 'Mean': np.float64(0.10552383290887303), 'Std': np.float64(0.05027029492369077)}
[I 2024-12-07 00:18:38,926] Trial 100 finished with value: 1.6666666666666665 and parameters: {'x_0_0': 'bc', 'x_0_1': 'bc', 'x_0_2': 'ac', 'x_1_0': 'ab', 'x_1_1': 'ab', 'x_1_2': 'ab'}. Best is trial 88 with value: 1.0666666666666667.
2024-12-07 00:18:42,059 - INFO - Candidate Mean Stats: {'Max': np.float64(2.0), 'Min': np.float64(0.276130594562564), 'Mean': np.float64(0.4983258549570864), 'Std': np.float64(0.07102110393157743)}
2024-12-07 00:18:42,060 - INFO - Candidate Std Stats: {'Max': np.float64(0.7167787282290238), 'Min': np.float64(0.0), 'Mean': np.float64(0.10614296287242408), 'Std': np.float64(0.047111007248907995)}
[I 2024-12-07 00:18:42,112] Trial 100 finished with value: 1.6777777777777778 and parameters: {'x_0_0': 'ab', 'x_0_1': 'ac', 'x_0_2': 'bc', 'x_1_0': 'ab', 'x_1_1': 'ab', 'x_1_2': 'oo'}. Best is trial 49 with value: 0.7999999999999999.
2024-12-07 00:18:44,549 - INFO - Candidate Mean Stats: {'Max': np.float64(2.0), 'Min': np.float64(0.2970965194978685), 'Mean': np.float64(0.49239137364810504), 'Std': np.float64(0.06411157802307495)}
2024-12-07 00:18:44,549 - INFO - Candidate Std Stats: {'Max': np.float64(0.700134873607735), 'Min': np.float64(0.0), 'Mean': np.float64(0.10353350481712145), 'Std': np.float64(0.04401091628491016)}
[I 2024-12-07 00:18:44,600] Trial 100 finished with value: 1.3666666666666667 and parameters: {'x_0_0': 'bc', 'x_0_1': 'bd', 'x_0_2': 'oo', 'x_1_0': 'oo', 'x_1_1': 'ac', 'x_1_2': 'ad'}. Best is trial 99 with value: 0.9444444444444444.
2024-12-07 00:18:56,743 - INFO - Candidate Mean Stats: {'Max': np.float64(2.0), 'Min': np.float64(0.2853234247218383), 'Mean': np.float64(0.4923148827022355), 'Std': np.float64(0.07134341232804046)}
2024-12-07 00:18:56,744 - INFO - Candidate Std Stats: {'Max': np.float64(1.5907717677262745), 'Min': np.float64(0.0), 'Mean': np.float64(0.11180986478979608), 'Std': np.float64(0.05375086235493402)}
[I 2024-12-07 00:18:56,800] Trial 100 finished with value: 1.6666666666666665 and parameters: {'x_0_0': 'bc', 'x_0_1': 'bd', 'x_0_2': 'bc', 'x_1_0': 'ab', 'x_1_1': 'bc', 'x_1_2': 'cd'}. Best is trial 74 with value: 0.8222222222222222.
2024-12-07 00:19:03,700 - INFO - Candidate Mean Stats: {'Max': np.float64(2.0), 'Min': np.float64(0.270526445871598), 'Mean': np.float64(0.48927967642993764), 'Std': np.float64(0.06572268483044687)}
2024-12-07 00:19:03,701 - INFO - Candidate Std Stats: {'Max': np.float64(0.8797838749854271), 'Min': np.float64(0.0), 'Mean': np.float64(0.09895524713232584), 'Std': np.float64(0.04326426213390375)}
[I 2024-12-07 00:19:03,753] Trial 101 finished with value: 1.5777777777777777 and parameters: {'x_0_0': 'ab', 'x_0_1': 'ab', 'x_0_2': 'cd', 'x_1_0': 'oo', 'x_1_1': 'bd', 'x_1_2': 'bc'}. Best is trial 88 with value: 1.0666666666666667.
2024-12-07 00:19:06,910 - INFO - Candidate Mean Stats: {'Max': np.float64(2.0), 'Min': np.float64(0.282227751169933), 'Mean': np.float64(0.4937470412689477), 'Std': np.float64(0.0630070324532054)}
2024-12-07 00:19:06,910 - INFO - Candidate Std Stats: {'Max': np.float64(0.61134947118897), 'Min': np.float64(0.0), 'Mean': np.float64(0.09907126617900278), 'Std': np.float64(0.04136077101539942)}
[I 2024-12-07 00:19:06,957] Trial 101 finished with value: 1.2444444444444445 and parameters: {'x_0_0': 'ac', 'x_0_1': 'ac', 'x_0_2': 'cd', 'x_1_0': 'oo', 'x_1_1': 'ad', 'x_1_2': 'ac'}. Best is trial 49 with value: 0.7999999999999999.
2024-12-07 00:19:08,863 - INFO - Candidate Mean Stats: {'Max': np.float64(2.0), 'Min': np.float64(0.24991641097784845), 'Mean': np.float64(0.49077129656085383), 'Std': np.float64(0.06752074569968956)}
2024-12-07 00:19:08,864 - INFO - Candidate Std Stats: {'Max': np.float64(1.505130027057087), 'Min': np.float64(0.0), 'Mean': np.float64(0.1028676426787937), 'Std': np.float64(0.048543334133383256)}
[I 2024-12-07 00:19:08,913] Trial 101 finished with value: 1.6666666666666665 and parameters: {'x_0_0': 'bc', 'x_0_1': 'cd', 'x_0_2': 'ab', 'x_1_0': 'ab', 'x_1_1': 'ac', 'x_1_2': 'bc'}. Best is trial 99 with value: 0.9444444444444444.
2024-12-07 00:19:20,834 - INFO - Candidate Mean Stats: {'Max': np.float64(2.0), 'Min': np.float64(0.1985458072344139), 'Mean': np.float64(0.48348695029111294), 'Std': np.float64(0.06886674144257843)}
2024-12-07 00:19:20,835 - INFO - Candidate Std Stats: {'Max': np.float64(0.5229067132838545), 'Min': np.float64(0.0), 'Mean': np.float64(0.10664019692992358), 'Std': np.float64(0.04907043027204629)}
[I 2024-12-07 00:19:20,880] Trial 101 finished with value: 1.6 and parameters: {'x_0_0': 'cd', 'x_0_1': 'oo', 'x_0_2': 'ac', 'x_1_0': 'ad', 'x_1_1': 'bc', 'x_1_2': 'ad'}. Best is trial 74 with value: 0.8222222222222222.
2024-12-07 00:19:27,285 - INFO - Candidate Mean Stats: {'Max': np.float64(2.0), 'Min': np.float64(0.2061457774362181), 'Mean': np.float64(0.4893241303951541), 'Std': np.float64(0.06724861582686413)}
2024-12-07 00:19:27,286 - INFO - Candidate Std Stats: {'Max': np.float64(1.514102864288803), 'Min': np.float64(0.0), 'Mean': np.float64(0.10175278875604309), 'Std': np.float64(0.046117746581119376)}
[I 2024-12-07 00:19:27,337] Trial 102 finished with value: 1.5555555555555556 and parameters: {'x_0_0': 'ac', 'x_0_1': 'ab', 'x_0_2': 'bd', 'x_1_0': 'bd', 'x_1_1': 'ad', 'x_1_2': 'ad'}. Best is trial 88 with value: 1.0666666666666667.
2024-12-07 00:19:29,801 - INFO - Candidate Mean Stats: {'Max': np.float64(2.0), 'Min': np.float64(0.25646472214471505), 'Mean': np.float64(0.4862494067010597), 'Std': np.float64(0.06357288000421925)}
2024-12-07 00:19:29,801 - INFO - Candidate Std Stats: {'Max': np.float64(0.3145450486011389), 'Min': np.float64(0.0), 'Mean': np.float64(0.0996228059618024), 'Std': np.float64(0.03947806681481165)}
[I 2024-12-07 00:19:29,851] Trial 102 finished with value: 1.4444444444444444 and parameters: {'x_0_0': 'bd', 'x_0_1': 'ad', 'x_0_2': 'ad', 'x_1_0': 'bd', 'x_1_1': 'bc', 'x_1_2': 'ac'}. Best is trial 49 with value: 0.7999999999999999.
2024-12-07 00:19:32,255 - INFO - Candidate Mean Stats: {'Max': np.float64(2.0), 'Min': np.float64(0.2676139568200236), 'Mean': np.float64(0.49481609053600467), 'Std': np.float64(0.06481643232240308)}
2024-12-07 00:19:32,256 - INFO - Candidate Std Stats: {'Max': np.float64(0.42158191093919195), 'Min': np.float64(0.0), 'Mean': np.float64(0.10738439893679443), 'Std': np.float64(0.044391681012453874)}
[I 2024-12-07 00:19:32,306] Trial 102 finished with value: 1.4555555555555555 and parameters: {'x_0_0': 'bd', 'x_0_1': 'ac', 'x_0_2': 'oo', 'x_1_0': 'ab', 'x_1_1': 'ad', 'x_1_2': 'ab'}. Best is trial 99 with value: 0.9444444444444444.
2024-12-07 00:19:43,873 - INFO - Candidate Mean Stats: {'Max': np.float64(2.0), 'Min': np.float64(0.27332786374704293), 'Mean': np.float64(0.48340662115193567), 'Std': np.float64(0.06611891070967842)}
2024-12-07 00:19:43,874 - INFO - Candidate Std Stats: {'Max': np.float64(1.4838786640131996), 'Min': np.float64(0.0), 'Mean': np.float64(0.10968174833268517), 'Std': np.float64(0.05225698386229575)}
[I 2024-12-07 00:19:43,926] Trial 102 finished with value: 1.3444444444444446 and parameters: {'x_0_0': 'bd', 'x_0_1': 'bc', 'x_0_2': 'cd', 'x_1_0': 'bd', 'x_1_1': 'ab', 'x_1_2': 'oo'}. Best is trial 74 with value: 0.8222222222222222.
2024-12-07 00:19:52,600 - INFO - Candidate Mean Stats: {'Max': np.float64(2.0), 'Min': np.float64(0.2695930524787785), 'Mean': np.float64(0.4953343411175672), 'Std': np.float64(0.06615343027978662)}
2024-12-07 00:19:52,601 - INFO - Candidate Std Stats: {'Max': np.float64(0.4281408290490903), 'Min': np.float64(0.0), 'Mean': np.float64(0.10541988423039825), 'Std': np.float64(0.04518628706471882)}
[I 2024-12-07 00:19:52,653] Trial 103 finished with value: 1.4555555555555557 and parameters: {'x_0_0': 'ac', 'x_0_1': 'ab', 'x_0_2': 'ac', 'x_1_0': 'ac', 'x_1_1': 'ad', 'x_1_2': 'oo'}. Best is trial 88 with value: 1.0666666666666667.
2024-12-07 00:19:55,177 - INFO - Candidate Mean Stats: {'Max': np.float64(2.0), 'Min': np.float64(0.1778962757493036), 'Mean': np.float64(0.4862684647908635), 'Std': np.float64(0.07582955490540952)}
2024-12-07 00:19:55,178 - INFO - Candidate Std Stats: {'Max': np.float64(1.6545949686756125), 'Min': np.float64(0.0), 'Mean': np.float64(0.11201632830909744), 'Std': np.float64(0.06315787323237258)}
[I 2024-12-07 00:19:55,232] Trial 103 finished with value: 1.5666666666666664 and parameters: {'x_0_0': 'ad', 'x_0_1': 'ad', 'x_0_2': 'oo', 'x_1_0': 'cd', 'x_1_1': 'bc', 'x_1_2': 'ab'}. Best is trial 49 with value: 0.7999999999999999.
2024-12-07 00:19:57,855 - INFO - Candidate Mean Stats: {'Max': np.float64(2.0), 'Min': np.float64(0.2702516654723149), 'Mean': np.float64(0.4976205445214082), 'Std': np.float64(0.06910510481621905)}
2024-12-07 00:19:57,856 - INFO - Candidate Std Stats: {'Max': np.float64(0.863389145868364), 'Min': np.float64(0.0), 'Mean': np.float64(0.11288631262951558), 'Std': np.float64(0.05717728530345538)}
