[I 2024-12-07 01:09:15,490] Trial 239 finished with value: 1.0444444444444443 and parameters: {'x_0_0': 'bd', 'x_0_1': 'oo', 'x_0_2': 'bc', 'x_1_0': 'bc', 'x_1_1': 'bc', 'x_1_2': 'ad'}. Best is trial 200 with value: 0.6.
2024-12-07 01:09:20,118 - INFO - Candidate Mean Stats: {'Max': np.float64(2.0), 'Min': np.float64(0.22021239760297667), 'Mean': np.float64(0.4949991203677807), 'Std': np.float64(0.08233238564269939)}
2024-12-07 01:09:20,119 - INFO - Candidate Std Stats: {'Max': np.float64(0.7142528264178813), 'Min': np.float64(0.0), 'Mean': np.float64(0.11006848956507338), 'Std': np.float64(0.04903665355332918)}
[I 2024-12-07 01:09:20,165] Trial 240 finished with value: 1.2666666666666666 and parameters: {'x_0_0': 'bd', 'x_0_1': 'oo', 'x_0_2': 'bd', 'x_1_0': 'cd', 'x_1_1': 'bd', 'x_1_2': 'bd'}. Best is trial 148 with value: 0.8333333333333333.
2024-12-07 01:09:20,606 - INFO - Candidate Mean Stats: {'Max': np.float64(2.0), 'Min': np.float64(0.28875314741352076), 'Mean': np.float64(0.49947254700334826), 'Std': np.float64(0.07127640409677352)}
2024-12-07 01:09:20,606 - INFO - Candidate Std Stats: {'Max': np.float64(0.4358523845953453), 'Min': np.float64(0.0), 'Mean': np.float64(0.10772904305356036), 'Std': np.float64(0.04531428698577236)}
[I 2024-12-07 01:09:20,651] Trial 239 finished with value: 1.3777777777777778 and parameters: {'x_0_0': 'ab', 'x_0_1': 'ad', 'x_0_2': 'ab', 'x_1_0': 'oo', 'x_1_1': 'oo', 'x_1_2': 'oo'}. Best is trial 74 with value: 0.8222222222222222.
2024-12-07 01:09:27,776 - INFO - Candidate Mean Stats: {'Max': np.float64(2.0), 'Min': np.float64(0.2756899685018539), 'Mean': np.float64(0.4850527036622972), 'Std': np.float64(0.06888430813294907)}
2024-12-07 01:09:27,776 - INFO - Candidate Std Stats: {'Max': np.float64(0.5732715183302746), 'Min': np.float64(0.0), 'Mean': np.float64(0.10033807694226975), 'Std': np.float64(0.041885138785703824)}
[I 2024-12-07 01:09:27,823] Trial 240 finished with value: 1.4666666666666666 and parameters: {'x_0_0': 'ac', 'x_0_1': 'bc', 'x_0_2': 'ab', 'x_1_0': 'oo', 'x_1_1': 'ab', 'x_1_2': 'cd'}. Best is trial 49 with value: 0.7999999999999999.
2024-12-07 01:09:37,138 - INFO - Candidate Mean Stats: {'Max': np.float64(2.0), 'Min': np.float64(0.25460751796638986), 'Mean': np.float64(0.4871549851673996), 'Std': np.float64(0.07539704469552083)}
2024-12-07 01:09:37,139 - INFO - Candidate Std Stats: {'Max': np.float64(0.7665457275411307), 'Min': np.float64(0.0), 'Mean': np.float64(0.10679269452603128), 'Std': np.float64(0.044933471584450456)}
[I 2024-12-07 01:09:37,184] Trial 240 finished with value: 1.077777777777778 and parameters: {'x_0_0': 'ab', 'x_0_1': 'oo', 'x_0_2': 'ad', 'x_1_0': 'oo', 'x_1_1': 'oo', 'x_1_2': 'ad'}. Best is trial 200 with value: 0.6.
2024-12-07 01:09:41,309 - INFO - Candidate Mean Stats: {'Max': np.float64(2.0), 'Min': np.float64(0.2370554757009784), 'Mean': np.float64(0.48073985720133056), 'Std': np.float64(0.07606565075917834)}
2024-12-07 01:09:41,311 - INFO - Candidate Std Stats: {'Max': np.float64(0.3365575658581066), 'Min': np.float64(0.0), 'Mean': np.float64(0.10270071689144153), 'Std': np.float64(0.040864294038383986)}
[I 2024-12-07 01:09:41,355] Trial 241 finished with value: 1.1666666666666665 and parameters: {'x_0_0': 'bc', 'x_0_1': 'oo', 'x_0_2': 'bd', 'x_1_0': 'bc', 'x_1_1': 'oo', 'x_1_2': 'ab'}. Best is trial 148 with value: 0.8333333333333333.
2024-12-07 01:09:42,109 - INFO - Candidate Mean Stats: {'Max': np.float64(2.0), 'Min': np.float64(0.22853174563939677), 'Mean': np.float64(0.48996501562310685), 'Std': np.float64(0.07737799848170282)}
2024-12-07 01:09:42,110 - INFO - Candidate Std Stats: {'Max': np.float64(0.9939023051162248), 'Min': np.float64(0.0), 'Mean': np.float64(0.10716756077718806), 'Std': np.float64(0.053440965062558715)}
[I 2024-12-07 01:09:42,154] Trial 240 finished with value: 1.4444444444444444 and parameters: {'x_0_0': 'ad', 'x_0_1': 'cd', 'x_0_2': 'cd', 'x_1_0': 'bc', 'x_1_1': 'cd', 'x_1_2': 'ad'}. Best is trial 74 with value: 0.8222222222222222.
2024-12-07 01:09:48,523 - INFO - Candidate Mean Stats: {'Max': np.float64(2.0), 'Min': np.float64(0.1992406903714769), 'Mean': np.float64(0.4869338148881557), 'Std': np.float64(0.08308867905030227)}
2024-12-07 01:09:48,524 - INFO - Candidate Std Stats: {'Max': np.float64(1.3788330655292915), 'Min': np.float64(0.0), 'Mean': np.float64(0.11125257018084363), 'Std': np.float64(0.05307542474481796)}
[I 2024-12-07 01:09:48,567] Trial 241 finished with value: 1.0666666666666667 and parameters: {'x_0_0': 'bd', 'x_0_1': 'oo', 'x_0_2': 'bc', 'x_1_0': 'oo', 'x_1_1': 'ad', 'x_1_2': 'bc'}. Best is trial 49 with value: 0.7999999999999999.
2024-12-07 01:09:57,645 - INFO - Candidate Mean Stats: {'Max': np.float64(2.0), 'Min': np.float64(0.21436267597390715), 'Mean': np.float64(0.4965544631400271), 'Std': np.float64(0.07542174958021998)}
2024-12-07 01:09:57,645 - INFO - Candidate Std Stats: {'Max': np.float64(0.46863962182387237), 'Min': np.float64(0.0), 'Mean': np.float64(0.1080673220292777), 'Std': np.float64(0.04404290174615384)}
[I 2024-12-07 01:09:57,689] Trial 241 finished with value: 1.6666666666666665 and parameters: {'x_0_0': 'ac', 'x_0_1': 'bc', 'x_0_2': 'cd', 'x_1_0': 'bd', 'x_1_1': 'ab', 'x_1_2': 'cd'}. Best is trial 200 with value: 0.6.
2024-12-07 01:10:02,193 - INFO - Candidate Mean Stats: {'Max': np.float64(2.0), 'Min': np.float64(0.20035487924262832), 'Mean': np.float64(0.49479101317214863), 'Std': np.float64(0.08207447423493448)}
2024-12-07 01:10:02,193 - INFO - Candidate Std Stats: {'Max': np.float64(0.5518817981654277), 'Min': np.float64(0.0), 'Mean': np.float64(0.10611596828288332), 'Std': np.float64(0.04589845133037403)}
[I 2024-12-07 01:10:02,237] Trial 242 finished with value: 1.3444444444444443 and parameters: {'x_0_0': 'bc', 'x_0_1': 'ac', 'x_0_2': 'oo', 'x_1_0': 'ac', 'x_1_1': 'ad', 'x_1_2': 'bd'}. Best is trial 148 with value: 0.8333333333333333.
2024-12-07 01:10:03,148 - INFO - Candidate Mean Stats: {'Max': np.float64(2.0), 'Min': np.float64(0.22590361824374772), 'Mean': np.float64(0.48110097241101535), 'Std': np.float64(0.07894146603435938)}
2024-12-07 01:10:03,148 - INFO - Candidate Std Stats: {'Max': np.float64(0.37621937689265655), 'Min': np.float64(0.0), 'Mean': np.float64(0.10946465362580074), 'Std': np.float64(0.043893323762691706)}
[I 2024-12-07 01:10:03,194] Trial 241 finished with value: 1.0333333333333332 and parameters: {'x_0_0': 'bc', 'x_0_1': 'ad', 'x_0_2': 'ad', 'x_1_0': 'oo', 'x_1_1': 'ab', 'x_1_2': 'oo'}. Best is trial 74 with value: 0.8222222222222222.
2024-12-07 01:10:09,210 - INFO - Candidate Mean Stats: {'Max': np.float64(2.0), 'Min': np.float64(0.2583615980479317), 'Mean': np.float64(0.49777343236107147), 'Std': np.float64(0.07341600377347193)}
2024-12-07 01:10:09,210 - INFO - Candidate Std Stats: {'Max': np.float64(0.34303924320660983), 'Min': np.float64(0.0), 'Mean': np.float64(0.10296439335477488), 'Std': np.float64(0.042600371886390605)}
[I 2024-12-07 01:10:09,255] Trial 242 finished with value: 1.2666666666666666 and parameters: {'x_0_0': 'bc', 'x_0_1': 'oo', 'x_0_2': 'ab', 'x_1_0': 'bc', 'x_1_1': 'bc', 'x_1_2': 'ac'}. Best is trial 49 with value: 0.7999999999999999.
2024-12-07 01:10:18,381 - INFO - Candidate Mean Stats: {'Max': np.float64(2.0), 'Min': np.float64(0.23065124641357054), 'Mean': np.float64(0.4993491889765816), 'Std': np.float64(0.07879195342107488)}
2024-12-07 01:10:18,382 - INFO - Candidate Std Stats: {'Max': np.float64(1.2539694938633712), 'Min': np.float64(0.0), 'Mean': np.float64(0.10619643247764649), 'Std': np.float64(0.04985781153845374)}
[I 2024-12-07 01:10:18,428] Trial 242 finished with value: 1.0555555555555556 and parameters: {'x_0_0': 'ad', 'x_0_1': 'oo', 'x_0_2': 'oo', 'x_1_0': 'ab', 'x_1_1': 'ac', 'x_1_2': 'cd'}. Best is trial 200 with value: 0.6.
2024-12-07 01:10:23,029 - INFO - Candidate Mean Stats: {'Max': np.float64(2.0), 'Min': np.float64(0.18950140510290242), 'Mean': np.float64(0.4907809369880906), 'Std': np.float64(0.07536367834752607)}
2024-12-07 01:10:23,030 - INFO - Candidate Std Stats: {'Max': np.float64(1.685114171169987), 'Min': np.float64(0.0), 'Mean': np.float64(0.10524025242049768), 'Std': np.float64(0.052010948420871096)}
[I 2024-12-07 01:10:23,076] Trial 243 finished with value: 1.6666666666666665 and parameters: {'x_0_0': 'ad', 'x_0_1': 'ad', 'x_0_2': 'ad', 'x_1_0': 'cd', 'x_1_1': 'ac', 'x_1_2': 'ab'}. Best is trial 148 with value: 0.8333333333333333.
2024-12-07 01:10:24,059 - INFO - Candidate Mean Stats: {'Max': np.float64(2.0), 'Min': np.float64(0.23434663619216528), 'Mean': np.float64(0.48784079360414323), 'Std': np.float64(0.07861991023521495)}
2024-12-07 01:10:24,060 - INFO - Candidate Std Stats: {'Max': np.float64(1.1663651449762213), 'Min': np.float64(0.0), 'Mean': np.float64(0.10859270935743566), 'Std': np.float64(0.05236770728933974)}
[I 2024-12-07 01:10:24,104] Trial 242 finished with value: 1.5555555555555556 and parameters: {'x_0_0': 'bc', 'x_0_1': 'ab', 'x_0_2': 'ab', 'x_1_0': 'cd', 'x_1_1': 'ac', 'x_1_2': 'cd'}. Best is trial 74 with value: 0.8222222222222222.
2024-12-07 01:10:30,542 - INFO - Candidate Mean Stats: {'Max': np.float64(2.0), 'Min': np.float64(0.21124404746310552), 'Mean': np.float64(0.4920690736456915), 'Std': np.float64(0.07151198852382071)}
2024-12-07 01:10:30,543 - INFO - Candidate Std Stats: {'Max': np.float64(0.3525661646061447), 'Min': np.float64(0.0), 'Mean': np.float64(0.09823684081815125), 'Std': np.float64(0.04090420362566434)}
[I 2024-12-07 01:10:30,589] Trial 243 finished with value: 1.2444444444444445 and parameters: {'x_0_0': 'ac', 'x_0_1': 'ad', 'x_0_2': 'oo', 'x_1_0': 'cd', 'x_1_1': 'cd', 'x_1_2': 'oo'}. Best is trial 49 with value: 0.7999999999999999.
2024-12-07 01:10:39,661 - INFO - Candidate Mean Stats: {'Max': np.float64(2.0), 'Min': np.float64(0.2596309196926291), 'Mean': np.float64(0.49254649852506577), 'Std': np.float64(0.07110533578189564)}
2024-12-07 01:10:39,662 - INFO - Candidate Std Stats: {'Max': np.float64(0.7479609037505863), 'Min': np.float64(0.0), 'Mean': np.float64(0.09930608433431191), 'Std': np.float64(0.04476015522333271)}
[I 2024-12-07 01:10:39,705] Trial 243 finished with value: 1.6777777777777778 and parameters: {'x_0_0': 'ab', 'x_0_1': 'bc', 'x_0_2': 'cd', 'x_1_0': 'ab', 'x_1_1': 'cd', 'x_1_2': 'oo'}. Best is trial 200 with value: 0.6.
2024-12-07 01:10:44,153 - INFO - Candidate Mean Stats: {'Max': np.float64(2.0), 'Min': np.float64(0.29210065701117494), 'Mean': np.float64(0.49556745810038055), 'Std': np.float64(0.07415202538414467)}
2024-12-07 01:10:44,153 - INFO - Candidate Std Stats: {'Max': np.float64(0.370585416674812), 'Min': np.float64(0.0), 'Mean': np.float64(0.10682590181060693), 'Std': np.float64(0.043792306422119565)}
[I 2024-12-07 01:10:44,198] Trial 244 finished with value: 1.4666666666666666 and parameters: {'x_0_0': 'ac', 'x_0_1': 'bd', 'x_0_2': 'ac', 'x_1_0': 'oo', 'x_1_1': 'ab', 'x_1_2': 'ad'}. Best is trial 148 with value: 0.8333333333333333.
2024-12-07 01:10:45,416 - INFO - Candidate Mean Stats: {'Max': np.float64(2.0), 'Min': np.float64(0.21754817705922194), 'Mean': np.float64(0.49088822274948674), 'Std': np.float64(0.0757817573607981)}
2024-12-07 01:10:45,416 - INFO - Candidate Std Stats: {'Max': np.float64(0.5960561233798157), 'Min': np.float64(0.0), 'Mean': np.float64(0.108036363988054), 'Std': np.float64(0.04952561084190762)}
[I 2024-12-07 01:10:45,460] Trial 243 finished with value: 1.6777777777777778 and parameters: {'x_0_0': 'ab', 'x_0_1': 'ab', 'x_0_2': 'ac', 'x_1_0': 'ab', 'x_1_1': 'ab', 'x_1_2': 'oo'}. Best is trial 74 with value: 0.8222222222222222.
2024-12-07 01:10:51,393 - INFO - Candidate Mean Stats: {'Max': np.float64(2.0), 'Min': np.float64(0.18626930131918296), 'Mean': np.float64(0.4986359076272733), 'Std': np.float64(0.07679152734224712)}
2024-12-07 01:10:51,393 - INFO - Candidate Std Stats: {'Max': np.float64(0.3509553449677134), 'Min': np.float64(0.0), 'Mean': np.float64(0.10217008197342961), 'Std': np.float64(0.04173023671277615)}
[I 2024-12-07 01:10:51,437] Trial 244 finished with value: 1.3666666666666667 and parameters: {'x_0_0': 'bd', 'x_0_1': 'bd', 'x_0_2': 'ac', 'x_1_0': 'oo', 'x_1_1': 'oo', 'x_1_2': 'bc'}. Best is trial 49 with value: 0.7999999999999999.
2024-12-07 01:11:00,407 - INFO - Candidate Mean Stats: {'Max': np.float64(2.0), 'Min': np.float64(0.2076701376500556), 'Mean': np.float64(0.4894539383169146), 'Std': np.float64(0.0792189899223098)}
2024-12-07 01:11:00,407 - INFO - Candidate Std Stats: {'Max': np.float64(0.5733091595882082), 'Min': np.float64(0.0), 'Mean': np.float64(0.11196951998994077), 'Std': np.float64(0.05043601124731086)}
[I 2024-12-07 01:11:00,455] Trial 244 finished with value: 1.2777777777777777 and parameters: {'x_0_0': 'ab', 'x_0_1': 'oo', 'x_0_2': 'oo', 'x_1_0': 'bc', 'x_1_1': 'ab', 'x_1_2': 'ab'}. Best is trial 200 with value: 0.6.
2024-12-07 01:11:04,895 - INFO - Candidate Mean Stats: {'Max': np.float64(2.0), 'Min': np.float64(0.19408046154175698), 'Mean': np.float64(0.48595756147931596), 'Std': np.float64(0.07958974242451415)}
2024-12-07 01:11:04,895 - INFO - Candidate Std Stats: {'Max': np.float64(0.6221215675879422), 'Min': np.float64(0.0), 'Mean': np.float64(0.1020832476698269), 'Std': np.float64(0.04435200267967738)}
[I 2024-12-07 01:11:04,937] Trial 245 finished with value: 1.2666666666666666 and parameters: {'x_0_0': 'ac', 'x_0_1': 'oo', 'x_0_2': 'bc', 'x_1_0': 'ab', 'x_1_1': 'ac', 'x_1_2': 'ac'}. Best is trial 148 with value: 0.8333333333333333.
2024-12-07 01:11:05,661 - INFO - Candidate Mean Stats: {'Max': np.float64(2.0), 'Min': np.float64(0.2964781052903658), 'Mean': np.float64(0.49544686743690086), 'Std': np.float64(0.07365889433886523)}
2024-12-07 01:11:05,662 - INFO - Candidate Std Stats: {'Max': np.float64(1.4165512014623134), 'Min': np.float64(0.0), 'Mean': np.float64(0.1037869638983065), 'Std': np.float64(0.054307020782936755)}
[I 2024-12-07 01:11:05,706] Trial 244 finished with value: 1.4666666666666666 and parameters: {'x_0_0': 'ad', 'x_0_1': 'ab', 'x_0_2': 'ac', 'x_1_0': 'oo', 'x_1_1': 'ad', 'x_1_2': 'ad'}. Best is trial 74 with value: 0.8222222222222222.
2024-12-07 01:11:12,294 - INFO - Candidate Mean Stats: {'Max': np.float64(2.0), 'Min': np.float64(0.2523448211122696), 'Mean': np.float64(0.4956225724292249), 'Std': np.float64(0.07637245702656209)}
2024-12-07 01:11:12,295 - INFO - Candidate Std Stats: {'Max': np.float64(1.4311131099976764), 'Min': np.float64(0.0), 'Mean': np.float64(0.10221198870748309), 'Std': np.float64(0.04709961031092162)}
[I 2024-12-07 01:11:12,339] Trial 245 finished with value: 1.2444444444444445 and parameters: {'x_0_0': 'bc', 'x_0_1': 'ad', 'x_0_2': 'bd', 'x_1_0': 'oo', 'x_1_1': 'ac', 'x_1_2': 'bd'}. Best is trial 49 with value: 0.7999999999999999.
2024-12-07 01:11:21,392 - INFO - Candidate Mean Stats: {'Max': np.float64(2.0), 'Min': np.float64(0.2461776368010356), 'Mean': np.float64(0.4891516833075978), 'Std': np.float64(0.07274249408675293)}
2024-12-07 01:11:21,393 - INFO - Candidate Std Stats: {'Max': np.float64(0.8720801306566792), 'Min': np.float64(0.0), 'Mean': np.float64(0.10993125946715857), 'Std': np.float64(0.04998410892740803)}
[I 2024-12-07 01:11:21,437] Trial 245 finished with value: 1.1666666666666665 and parameters: {'x_0_0': 'bd', 'x_0_1': 'oo', 'x_0_2': 'bd', 'x_1_0': 'ac', 'x_1_1': 'ab', 'x_1_2': 'oo'}. Best is trial 200 with value: 0.6.
2024-12-07 01:11:25,216 - INFO - Candidate Mean Stats: {'Max': np.float64(2.0), 'Min': np.float64(0.22888182013178246), 'Mean': np.float64(0.48701975171439543), 'Std': np.float64(0.08195259745575624)}
2024-12-07 01:11:25,217 - INFO - Candidate Std Stats: {'Max': np.float64(1.573572768236219), 'Min': np.float64(0.0), 'Mean': np.float64(0.11125729341243723), 'Std': np.float64(0.05489566292833386)}
[I 2024-12-07 01:11:25,262] Trial 246 finished with value: 1.6666666666666665 and parameters: {'x_0_0': 'bd', 'x_0_1': 'ac', 'x_0_2': 'cd', 'x_1_0': 'ac', 'x_1_1': 'ab', 'x_1_2': 'cd'}. Best is trial 148 with value: 0.8333333333333333.
2024-12-07 01:11:26,324 - INFO - Candidate Mean Stats: {'Max': np.float64(2.0), 'Min': np.float64(0.18507208080656234), 'Mean': np.float64(0.4788694023795589), 'Std': np.float64(0.09232560732105002)}
2024-12-07 01:11:26,325 - INFO - Candidate Std Stats: {'Max': np.float64(1.3606189486405005), 'Min': np.float64(0.0), 'Mean': np.float64(0.14359742030159403), 'Std': np.float64(0.07397009875534381)}
[I 2024-12-07 01:11:26,370] Trial 245 finished with value: 1.6666666666666665 and parameters: {'x_0_0': 'bc', 'x_0_1': 'bc', 'x_0_2': 'ab', 'x_1_0': 'cd', 'x_1_1': 'bc', 'x_1_2': 'ab'}. Best is trial 74 with value: 0.8222222222222222.
2024-12-07 01:11:33,282 - INFO - Candidate Mean Stats: {'Max': np.float64(2.0), 'Min': np.float64(0.2506317992358572), 'Mean': np.float64(0.48878214596174435), 'Std': np.float64(0.07046786946890914)}
2024-12-07 01:11:33,282 - INFO - Candidate Std Stats: {'Max': np.float64(0.41767159795367065), 'Min': np.float64(0.0), 'Mean': np.float64(0.10485499203579501), 'Std': np.float64(0.04405002354805369)}
[I 2024-12-07 01:11:33,326] Trial 246 finished with value: 1.3333333333333333 and parameters: {'x_0_0': 'bc', 'x_0_1': 'ac', 'x_0_2': 'ab', 'x_1_0': 'bc', 'x_1_1': 'cd', 'x_1_2': 'ad'}. Best is trial 49 with value: 0.7999999999999999.
2024-12-07 01:11:42,170 - INFO - Candidate Mean Stats: {'Max': np.float64(2.0), 'Min': np.float64(0.2411849843742731), 'Mean': np.float64(0.4771149100814028), 'Std': np.float64(0.07522944286799185)}
2024-12-07 01:11:42,170 - INFO - Candidate Std Stats: {'Max': np.float64(1.6843306775104483), 'Min': np.float64(0.0), 'Mean': np.float64(0.10684445342396774), 'Std': np.float64(0.05228601249132478)}
[I 2024-12-07 01:11:42,214] Trial 246 finished with value: 1.4555555555555555 and parameters: {'x_0_0': 'bc', 'x_0_1': 'ab', 'x_0_2': 'oo', 'x_1_0': 'bc', 'x_1_1': 'cd', 'x_1_2': 'bc'}. Best is trial 200 with value: 0.6.
2024-12-07 01:11:45,798 - INFO - Candidate Mean Stats: {'Max': np.float64(2.0), 'Min': np.float64(0.23223947171340073), 'Mean': np.float64(0.4881737516360966), 'Std': np.float64(0.0793277903989248)}
2024-12-07 01:11:45,798 - INFO - Candidate Std Stats: {'Max': np.float64(0.6795152655783201), 'Min': np.float64(0.0), 'Mean': np.float64(0.11020228387027307), 'Std': np.float64(0.04822053151832692)}
[I 2024-12-07 01:11:45,838] Trial 247 finished with value: 1.4444444444444444 and parameters: {'x_0_0': 'ac', 'x_0_1': 'ad', 'x_0_2': 'ab', 'x_1_0': 'ad', 'x_1_1': 'ac', 'x_1_2': 'ac'}. Best is trial 148 with value: 0.8333333333333333.
2024-12-07 01:11:47,038 - INFO - Candidate Mean Stats: {'Max': np.float64(2.0), 'Min': np.float64(0.2688577261883861), 'Mean': np.float64(0.48983392757144156), 'Std': np.float64(0.07586301370814319)}
2024-12-07 01:11:47,039 - INFO - Candidate Std Stats: {'Max': np.float64(1.4313679231169036), 'Min': np.float64(0.0), 'Mean': np.float64(0.11054829184892546), 'Std': np.float64(0.05034008105282252)}
[I 2024-12-07 01:11:47,080] Trial 246 finished with value: 1.3444444444444443 and parameters: {'x_0_0': 'bd', 'x_0_1': 'ac', 'x_0_2': 'oo', 'x_1_0': 'bd', 'x_1_1': 'cd', 'x_1_2': 'ac'}. Best is trial 74 with value: 0.8222222222222222.
2024-12-07 01:11:54,011 - INFO - Candidate Mean Stats: {'Max': np.float64(2.0), 'Min': np.float64(0.29456671564153597), 'Mean': np.float64(0.4951782246368891), 'Std': np.float64(0.07519211721463902)}
2024-12-07 01:11:54,011 - INFO - Candidate Std Stats: {'Max': np.float64(1.2050710126316693), 'Min': np.float64(0.0), 'Mean': np.float64(0.09716502999910806), 'Std': np.float64(0.04657929005729015)}
[I 2024-12-07 01:11:54,058] Trial 247 finished with value: 1.3666666666666667 and parameters: {'x_0_0': 'ac', 'x_0_1': 'bd', 'x_0_2': 'bc', 'x_1_0': 'oo', 'x_1_1': 'bc', 'x_1_2': 'oo'}. Best is trial 49 with value: 0.7999999999999999.
2024-12-07 01:12:03,084 - INFO - Candidate Mean Stats: {'Max': np.float64(2.0), 'Min': np.float64(0.2627049048231648), 'Mean': np.float64(0.49116841381372756), 'Std': np.float64(0.07715492680776627)}
2024-12-07 01:12:03,085 - INFO - Candidate Std Stats: {'Max': np.float64(0.8161959349301078), 'Min': np.float64(0.0), 'Mean': np.float64(0.10765696166876254), 'Std': np.float64(0.04665448422885801)}
[I 2024-12-07 01:12:03,130] Trial 247 finished with value: 1.4666666666666666 and parameters: {'x_0_0': 'bd', 'x_0_1': 'bd', 'x_0_2': 'cd', 'x_1_0': 'oo', 'x_1_1': 'ab', 'x_1_2': 'ad'}. Best is trial 200 with value: 0.6.
2024-12-07 01:12:06,518 - INFO - Candidate Mean Stats: {'Max': np.float64(2.0), 'Min': np.float64(0.22951039526145228), 'Mean': np.float64(0.48784041149613117), 'Std': np.float64(0.08137807732871544)}
2024-12-07 01:12:06,519 - INFO - Candidate Std Stats: {'Max': np.float64(0.8024874474685126), 'Min': np.float64(0.0), 'Mean': np.float64(0.10475978260062282), 'Std': np.float64(0.04481818300219257)}
[I 2024-12-07 01:12:06,564] Trial 248 finished with value: 1.1222222222222222 and parameters: {'x_0_0': 'ac', 'x_0_1': 'ad', 'x_0_2': 'bc', 'x_1_0': 'ab', 'x_1_1': 'bc', 'x_1_2': 'oo'}. Best is trial 148 with value: 0.8333333333333333.
2024-12-07 01:12:08,015 - INFO - Candidate Mean Stats: {'Max': np.float64(2.0), 'Min': np.float64(0.24813772155081565), 'Mean': np.float64(0.49106543426884935), 'Std': np.float64(0.07390182381791122)}
2024-12-07 01:12:08,016 - INFO - Candidate Std Stats: {'Max': np.float64(0.32113163808410977), 'Min': np.float64(0.0), 'Mean': np.float64(0.09991805950077488), 'Std': np.float64(0.03926533315662092)}
