[I 2024-12-07 00:54:38,430] Trial 197 finished with value: 1.2666666666666666 and parameters: {'x_0_0': 'ad', 'x_0_1': 'ad', 'x_0_2': 'oo', 'x_1_0': 'oo', 'x_1_1': 'oo', 'x_1_2': 'cd'}. Best is trial 148 with value: 0.8333333333333333.
2024-12-07 00:54:41,000 - INFO - Candidate Mean Stats: {'Max': np.float64(2.0), 'Min': np.float64(0.18998067156693743), 'Mean': np.float64(0.4880586876382153), 'Std': np.float64(0.07297692340714552)}
2024-12-07 00:54:41,001 - INFO - Candidate Std Stats: {'Max': np.float64(1.390636520089158), 'Min': np.float64(0.0), 'Mean': np.float64(0.10690485703915181), 'Std': np.float64(0.053532908444943315)}
[I 2024-12-07 00:54:41,046] Trial 197 finished with value: 1.5666666666666667 and parameters: {'x_0_0': 'ac', 'x_0_1': 'cd', 'x_0_2': 'ac', 'x_1_0': 'ad', 'x_1_1': 'oo', 'x_1_2': 'bc'}. Best is trial 49 with value: 0.7999999999999999.
2024-12-07 00:54:48,570 - INFO - Candidate Mean Stats: {'Max': np.float64(2.0), 'Min': np.float64(0.28449808373947516), 'Mean': np.float64(0.5008213874404928), 'Std': np.float64(0.07303433085475236)}
2024-12-07 00:54:48,571 - INFO - Candidate Std Stats: {'Max': np.float64(0.7333825040845077), 'Min': np.float64(0.0), 'Mean': np.float64(0.10410663422273841), 'Std': np.float64(0.04460505758786644)}
[I 2024-12-07 00:54:48,615] Trial 197 finished with value: 1.4555555555555557 and parameters: {'x_0_0': 'ad', 'x_0_1': 'bd', 'x_0_2': 'bc', 'x_1_0': 'ab', 'x_1_1': 'oo', 'x_1_2': 'ac'}. Best is trial 179 with value: 0.8333333333333333.
2024-12-07 00:54:54,626 - INFO - Candidate Mean Stats: {'Max': np.float64(2.0), 'Min': np.float64(0.0016304124889339633), 'Mean': np.float64(0.47978381214384386), 'Std': np.float64(0.08216466325753997)}
2024-12-07 00:54:54,627 - INFO - Candidate Std Stats: {'Max': np.float64(1.5843545976410132), 'Min': np.float64(0.0), 'Mean': np.float64(0.1148133005462939), 'Std': np.float64(0.06489947988177042)}
[I 2024-12-07 00:54:54,670] Trial 197 finished with value: 1.5666666666666667 and parameters: {'x_0_0': 'bc', 'x_0_1': 'cd', 'x_0_2': 'ab', 'x_1_0': 'cd', 'x_1_1': 'ab', 'x_1_2': 'oo'}. Best is trial 74 with value: 0.8222222222222222.
2024-12-07 00:54:58,793 - INFO - Candidate Mean Stats: {'Max': np.float64(2.0), 'Min': np.float64(0.2344183828092959), 'Mean': np.float64(0.4955676353333176), 'Std': np.float64(0.07415567549357302)}
2024-12-07 00:54:58,793 - INFO - Candidate Std Stats: {'Max': np.float64(1.4011785730050546), 'Min': np.float64(0.0), 'Mean': np.float64(0.10318857585800277), 'Std': np.float64(0.047817026710440094)}
[I 2024-12-07 00:54:58,834] Trial 198 finished with value: 1.1666666666666665 and parameters: {'x_0_0': 'bd', 'x_0_1': 'oo', 'x_0_2': 'bd', 'x_1_0': 'cd', 'x_1_1': 'ac', 'x_1_2': 'oo'}. Best is trial 148 with value: 0.8333333333333333.
2024-12-07 00:55:01,582 - INFO - Candidate Mean Stats: {'Max': np.float64(2.0), 'Min': np.float64(0.2862008452598347), 'Mean': np.float64(0.4858313964128802), 'Std': np.float64(0.06474867262498207)}
2024-12-07 00:55:01,582 - INFO - Candidate Std Stats: {'Max': np.float64(0.43941372149828684), 'Min': np.float64(0.0), 'Mean': np.float64(0.09819583444665572), 'Std': np.float64(0.03971628073787818)}
[I 2024-12-07 00:55:01,626] Trial 198 finished with value: 1.5 and parameters: {'x_0_0': 'cd', 'x_0_1': 'oo', 'x_0_2': 'bc', 'x_1_0': 'bc', 'x_1_1': 'oo', 'x_1_2': 'ad'}. Best is trial 49 with value: 0.7999999999999999.
2024-12-07 00:55:09,322 - INFO - Candidate Mean Stats: {'Max': np.float64(2.0), 'Min': np.float64(0.16277557464519118), 'Mean': np.float64(0.4904831775466438), 'Std': np.float64(0.07171686889302474)}
2024-12-07 00:55:09,322 - INFO - Candidate Std Stats: {'Max': np.float64(0.6381127578938168), 'Min': np.float64(0.0), 'Mean': np.float64(0.10869592181192411), 'Std': np.float64(0.051198585541935036)}
[I 2024-12-07 00:55:09,366] Trial 198 finished with value: 1.1555555555555554 and parameters: {'x_0_0': 'bd', 'x_0_1': 'oo', 'x_0_2': 'ab', 'x_1_0': 'ab', 'x_1_1': 'ac', 'x_1_2': 'ab'}. Best is trial 179 with value: 0.8333333333333333.
2024-12-07 00:55:15,184 - INFO - Candidate Mean Stats: {'Max': np.float64(2.0), 'Min': np.float64(0.30313166960892335), 'Mean': np.float64(0.4870348706836901), 'Std': np.float64(0.06584761567828483)}
2024-12-07 00:55:15,184 - INFO - Candidate Std Stats: {'Max': np.float64(0.36109156091272426), 'Min': np.float64(0.0), 'Mean': np.float64(0.09768569665246218), 'Std': np.float64(0.03919031861286536)}
[I 2024-12-07 00:55:15,229] Trial 198 finished with value: 1.6666666666666665 and parameters: {'x_0_0': 'ac', 'x_0_1': 'cd', 'x_0_2': 'bc', 'x_1_0': 'bc', 'x_1_1': 'bc', 'x_1_2': 'ab'}. Best is trial 74 with value: 0.8222222222222222.
2024-12-07 00:55:19,444 - INFO - Candidate Mean Stats: {'Max': np.float64(2.0), 'Min': np.float64(0.2732192756488053), 'Mean': np.float64(0.4870729417211995), 'Std': np.float64(0.07165892347410738)}
2024-12-07 00:55:19,444 - INFO - Candidate Std Stats: {'Max': np.float64(0.5209167485561615), 'Min': np.float64(0.0), 'Mean': np.float64(0.0922400192857948), 'Std': np.float64(0.03936344222935278)}
[I 2024-12-07 00:55:19,488] Trial 199 finished with value: 1.077777777777778 and parameters: {'x_0_0': 'ab', 'x_0_1': 'oo', 'x_0_2': 'ad', 'x_1_0': 'oo', 'x_1_1': 'bc', 'x_1_2': 'oo'}. Best is trial 148 with value: 0.8333333333333333.
2024-12-07 00:55:22,304 - INFO - Candidate Mean Stats: {'Max': np.float64(2.0), 'Min': np.float64(0.27707500939998586), 'Mean': np.float64(0.48309761051707245), 'Std': np.float64(0.07535862598747843)}
2024-12-07 00:55:22,304 - INFO - Candidate Std Stats: {'Max': np.float64(1.4235078755828794), 'Min': np.float64(0.0), 'Mean': np.float64(0.10666859903782927), 'Std': np.float64(0.050262505897523624)}
[I 2024-12-07 00:55:22,348] Trial 199 finished with value: 1.0666666666666667 and parameters: {'x_0_0': 'bc', 'x_0_1': 'oo', 'x_0_2': 'bd', 'x_1_0': 'oo', 'x_1_1': 'bc', 'x_1_2': 'bd'}. Best is trial 49 with value: 0.7999999999999999.
2024-12-07 00:55:29,912 - INFO - Candidate Mean Stats: {'Max': np.float64(2.0), 'Min': np.float64(0.2721295534199045), 'Mean': np.float64(0.49095537891264973), 'Std': np.float64(0.0698579078229463)}
2024-12-07 00:55:29,912 - INFO - Candidate Std Stats: {'Max': np.float64(0.46667214377134447), 'Min': np.float64(0.0), 'Mean': np.float64(0.0984096907985637), 'Std': np.float64(0.043153398510479904)}
[I 2024-12-07 00:55:29,959] Trial 199 finished with value: 1.6666666666666665 and parameters: {'x_0_0': 'ad', 'x_0_1': 'bd', 'x_0_2': 'ac', 'x_1_0': 'ad', 'x_1_1': 'ad', 'x_1_2': 'bc'}. Best is trial 179 with value: 0.8333333333333333.
2024-12-07 00:55:35,845 - INFO - Candidate Mean Stats: {'Max': np.float64(2.0), 'Min': np.float64(0.15296896651542016), 'Mean': np.float64(0.48420321406228145), 'Std': np.float64(0.07501020409533585)}
2024-12-07 00:55:35,845 - INFO - Candidate Std Stats: {'Max': np.float64(1.3404875333526258), 'Min': np.float64(0.0), 'Mean': np.float64(0.1099799553223952), 'Std': np.float64(0.05968486205246343)}
[I 2024-12-07 00:55:35,888] Trial 199 finished with value: 1.3666666666666667 and parameters: {'x_0_0': 'ad', 'x_0_1': 'cd', 'x_0_2': 'bc', 'x_1_0': 'oo', 'x_1_1': 'bc', 'x_1_2': 'oo'}. Best is trial 74 with value: 0.8222222222222222.
2024-12-07 00:55:39,844 - INFO - Candidate Mean Stats: {'Max': np.float64(2.0), 'Min': np.float64(0.1956601572812922), 'Mean': np.float64(0.49305888571941126), 'Std': np.float64(0.07368452980105014)}
2024-12-07 00:55:39,844 - INFO - Candidate Std Stats: {'Max': np.float64(0.4364841991053651), 'Min': np.float64(0.0), 'Mean': np.float64(0.10458584192036519), 'Std': np.float64(0.0440826460199263)}
[I 2024-12-07 00:55:39,887] Trial 200 finished with value: 1.4666666666666666 and parameters: {'x_0_0': 'ad', 'x_0_1': 'ac', 'x_0_2': 'oo', 'x_1_0': 'ac', 'x_1_1': 'cd', 'x_1_2': 'oo'}. Best is trial 148 with value: 0.8333333333333333.
2024-12-07 00:55:42,781 - INFO - Candidate Mean Stats: {'Max': np.float64(2.0), 'Min': np.float64(0.23326913933580626), 'Mean': np.float64(0.48420204305200026), 'Std': np.float64(0.0774961673222444)}
2024-12-07 00:55:42,782 - INFO - Candidate Std Stats: {'Max': np.float64(0.5545334726647897), 'Min': np.float64(0.0), 'Mean': np.float64(0.11230742241215112), 'Std': np.float64(0.04818684048302711)}
[I 2024-12-07 00:55:42,828] Trial 200 finished with value: 1.1666666666666665 and parameters: {'x_0_0': 'bc', 'x_0_1': 'oo', 'x_0_2': 'ad', 'x_1_0': 'ad', 'x_1_1': 'ad', 'x_1_2': 'oo'}. Best is trial 49 with value: 0.7999999999999999.
2024-12-07 00:55:50,317 - INFO - Candidate Mean Stats: {'Max': np.float64(2.0), 'Min': np.float64(0.20453837668145763), 'Mean': np.float64(0.4836070638502738), 'Std': np.float64(0.08015960848596268)}
2024-12-07 00:55:50,317 - INFO - Candidate Std Stats: {'Max': np.float64(0.49953239057463744), 'Min': np.float64(0.0), 'Mean': np.float64(0.10983640574401465), 'Std': np.float64(0.04563388351977634)}
[I 2024-12-07 00:55:50,359] Trial 200 finished with value: 0.6 and parameters: {'x_0_0': 'ad', 'x_0_1': 'oo', 'x_0_2': 'bd', 'x_1_0': 'bc', 'x_1_1': 'ac', 'x_1_2': 'ac'}. Best is trial 200 with value: 0.6.
2024-12-07 00:55:56,156 - INFO - Candidate Mean Stats: {'Max': np.float64(2.0), 'Min': np.float64(0.2536506907772482), 'Mean': np.float64(0.5010258459092752), 'Std': np.float64(0.0750330340677807)}
2024-12-07 00:55:56,156 - INFO - Candidate Std Stats: {'Max': np.float64(0.4764948356177463), 'Min': np.float64(0.0), 'Mean': np.float64(0.10962637707225777), 'Std': np.float64(0.04487696685195758)}
[I 2024-12-07 00:55:56,197] Trial 200 finished with value: 1.1777777777777778 and parameters: {'x_0_0': 'ab', 'x_0_1': 'oo', 'x_0_2': 'bc', 'x_1_0': 'oo', 'x_1_1': 'ab', 'x_1_2': 'ab'}. Best is trial 74 with value: 0.8222222222222222.
2024-12-07 00:56:00,273 - INFO - Candidate Mean Stats: {'Max': np.float64(2.0), 'Min': np.float64(0.227103330381662), 'Mean': np.float64(0.4857466586595262), 'Std': np.float64(0.07337606061823053)}
2024-12-07 00:56:00,273 - INFO - Candidate Std Stats: {'Max': np.float64(0.758534662497834), 'Min': np.float64(0.0), 'Mean': np.float64(0.10718650373358413), 'Std': np.float64(0.04655029424589462)}
[I 2024-12-07 00:56:00,317] Trial 201 finished with value: 1.3444444444444443 and parameters: {'x_0_0': 'bd', 'x_0_1': 'bd', 'x_0_2': 'oo', 'x_1_0': 'bd', 'x_1_1': 'cd', 'x_1_2': 'bd'}. Best is trial 148 with value: 0.8333333333333333.
2024-12-07 00:56:03,374 - INFO - Candidate Mean Stats: {'Max': np.float64(2.0), 'Min': np.float64(0.23848603510035646), 'Mean': np.float64(0.4886034773268308), 'Std': np.float64(0.07154203994379355)}
2024-12-07 00:56:03,374 - INFO - Candidate Std Stats: {'Max': np.float64(0.39028479921987985), 'Min': np.float64(0.0), 'Mean': np.float64(0.10479086933535825), 'Std': np.float64(0.04429132408033217)}
[I 2024-12-07 00:56:03,417] Trial 201 finished with value: 1.2666666666666666 and parameters: {'x_0_0': 'bc', 'x_0_1': 'bd', 'x_0_2': 'bd', 'x_1_0': 'oo', 'x_1_1': 'oo', 'x_1_2': 'oo'}. Best is trial 49 with value: 0.7999999999999999.
2024-12-07 00:56:10,665 - INFO - Candidate Mean Stats: {'Max': np.float64(2.0), 'Min': np.float64(0.16729381520832096), 'Mean': np.float64(0.48649116468382175), 'Std': np.float64(0.07630362951619701)}
2024-12-07 00:56:10,665 - INFO - Candidate Std Stats: {'Max': np.float64(1.8024495159840392), 'Min': np.float64(0.0), 'Mean': np.float64(0.11026133676256683), 'Std': np.float64(0.061145189920714355)}
[I 2024-12-07 00:56:10,720] Trial 201 finished with value: 1.4444444444444444 and parameters: {'x_0_0': 'bc', 'x_0_1': 'ac', 'x_0_2': 'bc', 'x_1_0': 'bc', 'x_1_1': 'bd', 'x_1_2': 'cd'}. Best is trial 200 with value: 0.6.
2024-12-07 00:56:16,634 - INFO - Candidate Mean Stats: {'Max': np.float64(2.0), 'Min': np.float64(0.20874454833573766), 'Mean': np.float64(0.4893730376058139), 'Std': np.float64(0.07210205774752756)}
2024-12-07 00:56:16,634 - INFO - Candidate Std Stats: {'Max': np.float64(0.3753097910601535), 'Min': np.float64(0.0), 'Mean': np.float64(0.10220230098592764), 'Std': np.float64(0.043558691668066384)}
[I 2024-12-07 00:56:16,674] Trial 201 finished with value: 1.4555555555555555 and parameters: {'x_0_0': 'ac', 'x_0_1': 'ab', 'x_0_2': 'oo', 'x_1_0': 'ab', 'x_1_1': 'bd', 'x_1_2': 'bd'}. Best is trial 74 with value: 0.8222222222222222.
2024-12-07 00:56:20,686 - INFO - Candidate Mean Stats: {'Max': np.float64(2.0), 'Min': np.float64(0.2419320209321266), 'Mean': np.float64(0.49199618539876044), 'Std': np.float64(0.07569767957159337)}
2024-12-07 00:56:20,686 - INFO - Candidate Std Stats: {'Max': np.float64(0.5259123602760971), 'Min': np.float64(0.0), 'Mean': np.float64(0.10071031488937071), 'Std': np.float64(0.043949916077674074)}
[I 2024-12-07 00:56:20,729] Trial 202 finished with value: 1.2666666666666666 and parameters: {'x_0_0': 'ac', 'x_0_1': 'oo', 'x_0_2': 'ab', 'x_1_0': 'ad', 'x_1_1': 'ac', 'x_1_2': 'bd'}. Best is trial 148 with value: 0.8333333333333333.
2024-12-07 00:56:23,702 - INFO - Candidate Mean Stats: {'Max': np.float64(2.0), 'Min': np.float64(0.2847377274058251), 'Mean': np.float64(0.4984288608887941), 'Std': np.float64(0.06761739022821982)}
2024-12-07 00:56:23,702 - INFO - Candidate Std Stats: {'Max': np.float64(0.3943174915276071), 'Min': np.float64(0.0), 'Mean': np.float64(0.10336406958890791), 'Std': np.float64(0.04273826046357168)}
[I 2024-12-07 00:56:23,746] Trial 202 finished with value: 1.4666666666666668 and parameters: {'x_0_0': 'ad', 'x_0_1': 'bc', 'x_0_2': 'bd', 'x_1_0': 'ac', 'x_1_1': 'oo', 'x_1_2': 'oo'}. Best is trial 49 with value: 0.7999999999999999.
2024-12-07 00:56:31,392 - INFO - Candidate Mean Stats: {'Max': np.float64(2.0), 'Min': np.float64(0.2977022011980255), 'Mean': np.float64(0.49709826968659926), 'Std': np.float64(0.0679518757437421)}
2024-12-07 00:56:31,393 - INFO - Candidate Std Stats: {'Max': np.float64(0.3729246612512993), 'Min': np.float64(0.0), 'Mean': np.float64(0.10061994857986967), 'Std': np.float64(0.040878952130947596)}
[I 2024-12-07 00:56:31,437] Trial 202 finished with value: 1.6666666666666665 and parameters: {'x_0_0': 'ad', 'x_0_1': 'ad', 'x_0_2': 'cd', 'x_1_0': 'ac', 'x_1_1': 'ac', 'x_1_2': 'ac'}. Best is trial 200 with value: 0.6.
2024-12-07 00:56:37,176 - INFO - Candidate Mean Stats: {'Max': np.float64(2.0), 'Min': np.float64(0.27590811341443966), 'Mean': np.float64(0.4899449075041958), 'Std': np.float64(0.07030476454623522)}
2024-12-07 00:56:37,176 - INFO - Candidate Std Stats: {'Max': np.float64(0.8619898555082064), 'Min': np.float64(0.0), 'Mean': np.float64(0.10085124913725466), 'Std': np.float64(0.04688438321792649)}
[I 2024-12-07 00:56:37,217] Trial 202 finished with value: 1.3 and parameters: {'x_0_0': 'oo', 'x_0_1': 'oo', 'x_0_2': 'bc', 'x_1_0': 'oo', 'x_1_1': 'cd', 'x_1_2': 'ab'}. Best is trial 74 with value: 0.8222222222222222.
2024-12-07 00:56:41,195 - INFO - Candidate Mean Stats: {'Max': np.float64(2.0), 'Min': np.float64(0.20486044003956044), 'Mean': np.float64(0.48678309782776147), 'Std': np.float64(0.074892605862936)}
2024-12-07 00:56:41,196 - INFO - Candidate Std Stats: {'Max': np.float64(0.5607271745544383), 'Min': np.float64(0.0), 'Mean': np.float64(0.10887118276581574), 'Std': np.float64(0.04781607924655197)}
[I 2024-12-07 00:56:41,241] Trial 203 finished with value: 1.2222222222222223 and parameters: {'x_0_0': 'ad', 'x_0_1': 'ad', 'x_0_2': 'ac', 'x_1_0': 'bc', 'x_1_1': 'ad', 'x_1_2': 'ab'}. Best is trial 148 with value: 0.8333333333333333.
2024-12-07 00:56:44,421 - INFO - Candidate Mean Stats: {'Max': np.float64(2.0), 'Min': np.float64(0.04858339451992365), 'Mean': np.float64(0.4939749715708137), 'Std': np.float64(0.07477929429199669)}
2024-12-07 00:56:44,421 - INFO - Candidate Std Stats: {'Max': np.float64(0.58784652718282), 'Min': np.float64(0.0), 'Mean': np.float64(0.10767381369611681), 'Std': np.float64(0.04657478403104335)}
[I 2024-12-07 00:56:44,467] Trial 203 finished with value: 1.6666666666666665 and parameters: {'x_0_0': 'ac', 'x_0_1': 'bd', 'x_0_2': 'cd', 'x_1_0': 'ab', 'x_1_1': 'bc', 'x_1_2': 'ad'}. Best is trial 49 with value: 0.7999999999999999.
2024-12-07 00:56:51,800 - INFO - Candidate Mean Stats: {'Max': np.float64(2.0), 'Min': np.float64(0.2376859575056666), 'Mean': np.float64(0.4933181018944009), 'Std': np.float64(0.07594921100993285)}
2024-12-07 00:56:51,800 - INFO - Candidate Std Stats: {'Max': np.float64(0.8553077657976103), 'Min': np.float64(0.0), 'Mean': np.float64(0.11017782165280357), 'Std': np.float64(0.05045167001946549)}
[I 2024-12-07 00:56:51,844] Trial 203 finished with value: 1.3777777777777778 and parameters: {'x_0_0': 'ab', 'x_0_1': 'oo', 'x_0_2': 'ab', 'x_1_0': 'ad', 'x_1_1': 'bc', 'x_1_2': 'ac'}. Best is trial 200 with value: 0.6.
2024-12-07 00:56:57,810 - INFO - Candidate Mean Stats: {'Max': np.float64(2.0), 'Min': np.float64(0.2749470801221327), 'Mean': np.float64(0.495606187724253), 'Std': np.float64(0.07081713210683345)}
2024-12-07 00:56:57,810 - INFO - Candidate Std Stats: {'Max': np.float64(0.3286952238116303), 'Min': np.float64(0.0), 'Mean': np.float64(0.10202678768347892), 'Std': np.float64(0.039746768567588894)}
[I 2024-12-07 00:56:57,854] Trial 203 finished with value: 1.6666666666666665 and parameters: {'x_0_0': 'ac', 'x_0_1': 'cd', 'x_0_2': 'ad', 'x_1_0': 'bd', 'x_1_1': 'cd', 'x_1_2': 'ad'}. Best is trial 74 with value: 0.8222222222222222.
2024-12-07 00:57:01,686 - INFO - Candidate Mean Stats: {'Max': np.float64(2.0), 'Min': np.float64(0.23120577278386065), 'Mean': np.float64(0.4911483740375752), 'Std': np.float64(0.07501725079790228)}
2024-12-07 00:57:01,686 - INFO - Candidate Std Stats: {'Max': np.float64(0.6278280682511547), 'Min': np.float64(0.0), 'Mean': np.float64(0.10417708019382377), 'Std': np.float64(0.04852399496645886)}
[I 2024-12-07 00:57:01,729] Trial 204 finished with value: 1.4666666666666666 and parameters: {'x_0_0': 'ac', 'x_0_1': 'cd', 'x_0_2': 'ab', 'x_1_0': 'oo', 'x_1_1': 'cd', 'x_1_2': 'ab'}. Best is trial 148 with value: 0.8333333333333333.
2024-12-07 00:57:04,861 - INFO - Candidate Mean Stats: {'Max': np.float64(2.0), 'Min': np.float64(0.17728326337781336), 'Mean': np.float64(0.4800241682308057), 'Std': np.float64(0.07259500762029565)}
2024-12-07 00:57:04,861 - INFO - Candidate Std Stats: {'Max': np.float64(0.34264271763137194), 'Min': np.float64(0.0), 'Mean': np.float64(0.10246492436280477), 'Std': np.float64(0.041565879502622416)}
[I 2024-12-07 00:57:04,907] Trial 204 finished with value: 1.5666666666666667 and parameters: {'x_0_0': 'bd', 'x_0_1': 'bd', 'x_0_2': 'bd', 'x_1_0': 'ac', 'x_1_1': 'ac', 'x_1_2': 'oo'}. Best is trial 49 with value: 0.7999999999999999.
2024-12-07 00:57:12,355 - INFO - Candidate Mean Stats: {'Max': np.float64(2.0), 'Min': np.float64(0.23775345215756666), 'Mean': np.float64(0.49218739613823514), 'Std': np.float64(0.07552930085115812)}
2024-12-07 00:57:12,355 - INFO - Candidate Std Stats: {'Max': np.float64(0.405515803394277), 'Min': np.float64(0.0), 'Mean': np.float64(0.10146270313470769), 'Std': np.float64(0.043914627678309434)}
[I 2024-12-07 00:57:12,400] Trial 204 finished with value: 1.4555555555555557 and parameters: {'x_0_0': 'ac', 'x_0_1': 'ab', 'x_0_2': 'ab', 'x_1_0': 'ad', 'x_1_1': 'bc', 'x_1_2': 'oo'}. Best is trial 200 with value: 0.6.
2024-12-07 00:57:18,227 - INFO - Candidate Mean Stats: {'Max': np.float64(2.0), 'Min': np.float64(0.28674503845688915), 'Mean': np.float64(0.504290226218181), 'Std': np.float64(0.06927753638181566)}
2024-12-07 00:57:18,227 - INFO - Candidate Std Stats: {'Max': np.float64(0.35574019649167027), 'Min': np.float64(0.0), 'Mean': np.float64(0.09361293960265905), 'Std': np.float64(0.03634967527346161)}
[I 2024-12-07 00:57:18,269] Trial 204 finished with value: 1.3444444444444446 and parameters: {'x_0_0': 'bd', 'x_0_1': 'ad', 'x_0_2': 'bc', 'x_1_0': 'bd', 'x_1_1': 'bd', 'x_1_2': 'oo'}. Best is trial 74 with value: 0.8222222222222222.
2024-12-07 00:57:22,133 - INFO - Candidate Mean Stats: {'Max': np.float64(2.0), 'Min': np.float64(0.25926815302410106), 'Mean': np.float64(0.49248218579386704), 'Std': np.float64(0.07128853820811179)}
2024-12-07 00:57:22,133 - INFO - Candidate Std Stats: {'Max': np.float64(0.4339199029027378), 'Min': np.float64(0.0), 'Mean': np.float64(0.1058177614469686), 'Std': np.float64(0.04409116887415821)}
[I 2024-12-07 00:57:22,178] Trial 205 finished with value: 1.4666666666666666 and parameters: {'x_0_0': 'ac', 'x_0_1': 'bc', 'x_0_2': 'bd', 'x_1_0': 'oo', 'x_1_1': 'bd', 'x_1_2': 'ab'}. Best is trial 148 with value: 0.8333333333333333.
2024-12-07 00:57:25,562 - INFO - Candidate Mean Stats: {'Max': np.float64(2.0), 'Min': np.float64(0.21169426388646273), 'Mean': np.float64(0.4973406240678109), 'Std': np.float64(0.07252823756907832)}
2024-12-07 00:57:25,563 - INFO - Candidate Std Stats: {'Max': np.float64(0.3782028570799453), 'Min': np.float64(0.0), 'Mean': np.float64(0.10016376698645255), 'Std': np.float64(0.041966742425794984)}
[I 2024-12-07 00:57:25,605] Trial 205 finished with value: 1.1555555555555554 and parameters: {'x_0_0': 'ad', 'x_0_1': 'oo', 'x_0_2': 'bd', 'x_1_0': 'ab', 'x_1_1': 'bd', 'x_1_2': 'cd'}. Best is trial 49 with value: 0.7999999999999999.
2024-12-07 00:57:33,182 - INFO - Candidate Mean Stats: {'Max': np.float64(2.0), 'Min': np.float64(0.22580166245108976), 'Mean': np.float64(0.49562660988702684), 'Std': np.float64(0.0778103166931174)}
2024-12-07 00:57:33,182 - INFO - Candidate Std Stats: {'Max': np.float64(1.1593708699529512), 'Min': np.float64(0.0), 'Mean': np.float64(0.11441625434330531), 'Std': np.float64(0.0558988778145679)}
