[I 2024-12-07 01:12:08,062] Trial 247 finished with value: 1.2666666666666666 and parameters: {'x_0_0': 'ad', 'x_0_1': 'bd', 'x_0_2': 'oo', 'x_1_0': 'oo', 'x_1_1': 'oo', 'x_1_2': 'ad'}. Best is trial 74 with value: 0.8222222222222222.
2024-12-07 01:12:15,188 - INFO - Candidate Mean Stats: {'Max': np.float64(2.0), 'Min': np.float64(0.26136788079981443), 'Mean': np.float64(0.4987846444438438), 'Std': np.float64(0.07606692689039346)}
2024-12-07 01:12:15,188 - INFO - Candidate Std Stats: {'Max': np.float64(0.4382859238375027), 'Min': np.float64(0.0), 'Mean': np.float64(0.11485545990211561), 'Std': np.float64(0.04749024586332188)}
[I 2024-12-07 01:12:15,231] Trial 248 finished with value: 0.9666666666666667 and parameters: {'x_0_0': 'bd', 'x_0_1': 'oo', 'x_0_2': 'ac', 'x_1_0': 'oo', 'x_1_1': 'oo', 'x_1_2': 'bd'}. Best is trial 49 with value: 0.7999999999999999.
2024-12-07 01:12:24,103 - INFO - Candidate Mean Stats: {'Max': np.float64(2.0), 'Min': np.float64(0.2657953537020855), 'Mean': np.float64(0.4770015658018225), 'Std': np.float64(0.07716111194792573)}
2024-12-07 01:12:24,107 - INFO - Candidate Std Stats: {'Max': np.float64(0.9308350458966098), 'Min': np.float64(0.0), 'Mean': np.float64(0.11106405607526183), 'Std': np.float64(0.05181498540180906)}
[I 2024-12-07 01:12:24,159] Trial 248 finished with value: 0.9444444444444444 and parameters: {'x_0_0': 'bd', 'x_0_1': 'oo', 'x_0_2': 'ac', 'x_1_0': 'bc', 'x_1_1': 'cd', 'x_1_2': 'oo'}. Best is trial 200 with value: 0.6.
2024-12-07 01:12:27,394 - INFO - Candidate Mean Stats: {'Max': np.float64(2.0), 'Min': np.float64(0.28312125943885974), 'Mean': np.float64(0.5004144738191154), 'Std': np.float64(0.07507960138447257)}
2024-12-07 01:12:27,395 - INFO - Candidate Std Stats: {'Max': np.float64(0.322775186027292), 'Min': np.float64(0.0), 'Mean': np.float64(0.1005963033194903), 'Std': np.float64(0.03894172169875407)}
[I 2024-12-07 01:12:27,443] Trial 249 finished with value: 1.4444444444444444 and parameters: {'x_0_0': 'bd', 'x_0_1': 'ac', 'x_0_2': 'ad', 'x_1_0': 'bd', 'x_1_1': 'ad', 'x_1_2': 'bc'}. Best is trial 148 with value: 0.8333333333333333.
2024-12-07 01:12:28,588 - INFO - Candidate Mean Stats: {'Max': np.float64(2.0), 'Min': np.float64(0.26367424901657843), 'Mean': np.float64(0.4839276023466381), 'Std': np.float64(0.07493386218349128)}
2024-12-07 01:12:28,588 - INFO - Candidate Std Stats: {'Max': np.float64(1.1801269767587172), 'Min': np.float64(0.0), 'Mean': np.float64(0.10380556644306614), 'Std': np.float64(0.046996406674216284)}
[I 2024-12-07 01:12:28,631] Trial 248 finished with value: 1.0444444444444443 and parameters: {'x_0_0': 'ad', 'x_0_1': 'oo', 'x_0_2': 'ad', 'x_1_0': 'bd', 'x_1_1': 'ad', 'x_1_2': 'ac'}. Best is trial 74 with value: 0.8222222222222222.
2024-12-07 01:12:36,025 - INFO - Candidate Mean Stats: {'Max': np.float64(2.0), 'Min': np.float64(0.23335166817189795), 'Mean': np.float64(0.4904151017823569), 'Std': np.float64(0.07921601633779347)}
2024-12-07 01:12:36,026 - INFO - Candidate Std Stats: {'Max': np.float64(0.34882745548325406), 'Min': np.float64(0.0), 'Mean': np.float64(0.09686796388146995), 'Std': np.float64(0.037737209274208025)}
[I 2024-12-07 01:12:36,071] Trial 249 finished with value: 1.1333333333333333 and parameters: {'x_0_0': 'bc', 'x_0_1': 'ad', 'x_0_2': 'ad', 'x_1_0': 'oo', 'x_1_1': 'ab', 'x_1_2': 'ad'}. Best is trial 49 with value: 0.7999999999999999.
2024-12-07 01:12:45,172 - INFO - Candidate Mean Stats: {'Max': np.float64(2.0), 'Min': np.float64(0.2659001258367576), 'Mean': np.float64(0.4858063046544873), 'Std': np.float64(0.07309447394170676)}
2024-12-07 01:12:45,173 - INFO - Candidate Std Stats: {'Max': np.float64(0.45137149290502665), 'Min': np.float64(0.0), 'Mean': np.float64(0.098152027526871), 'Std': np.float64(0.04245222204660002)}
[I 2024-12-07 01:12:45,218] Trial 249 finished with value: 1.5666666666666667 and parameters: {'x_0_0': 'ac', 'x_0_1': 'bd', 'x_0_2': 'ab', 'x_1_0': 'ab', 'x_1_1': 'oo', 'x_1_2': 'ab'}. Best is trial 200 with value: 0.6.
2024-12-07 01:12:48,226 - INFO - Candidate Mean Stats: {'Max': np.float64(2.0), 'Min': np.float64(0.2339864656171556), 'Mean': np.float64(0.4784207576259478), 'Std': np.float64(0.07953761500409685)}
2024-12-07 01:12:48,226 - INFO - Candidate Std Stats: {'Max': np.float64(1.7638663632004343), 'Min': np.float64(0.0), 'Mean': np.float64(0.11370692685292769), 'Std': np.float64(0.0565764115664701)}
[I 2024-12-07 01:12:48,273] Trial 250 finished with value: 1.2222222222222223 and parameters: {'x_0_0': 'bc', 'x_0_1': 'ad', 'x_0_2': 'ac', 'x_1_0': 'bc', 'x_1_1': 'bd', 'x_1_2': 'cd'}. Best is trial 148 with value: 0.8333333333333333.
2024-12-07 01:12:49,762 - INFO - Candidate Mean Stats: {'Max': np.float64(2.0), 'Min': np.float64(0.20885185283729912), 'Mean': np.float64(0.48946276860823523), 'Std': np.float64(0.07565953282095782)}
2024-12-07 01:12:49,763 - INFO - Candidate Std Stats: {'Max': np.float64(0.577470744176862), 'Min': np.float64(0.0), 'Mean': np.float64(0.10462753629617585), 'Std': np.float64(0.04379399031706191)}
[I 2024-12-07 01:12:49,806] Trial 249 finished with value: 1.1111111111111112 and parameters: {'x_0_0': 'ac', 'x_0_1': 'ac', 'x_0_2': 'ad', 'x_1_0': 'bd', 'x_1_1': 'bd', 'x_1_2': 'ab'}. Best is trial 74 with value: 0.8222222222222222.
2024-12-07 01:12:56,615 - INFO - Candidate Mean Stats: {'Max': np.float64(2.0), 'Min': np.float64(0.25774235147372226), 'Mean': np.float64(0.49369235473512607), 'Std': np.float64(0.06964097242493154)}
2024-12-07 01:12:56,615 - INFO - Candidate Std Stats: {'Max': np.float64(0.468679817625972), 'Min': np.float64(0.0), 'Mean': np.float64(0.09627476725465885), 'Std': np.float64(0.03984811042898205)}
[I 2024-12-07 01:12:56,658] Trial 250 finished with value: 1.2555555555555555 and parameters: {'x_0_0': 'bc', 'x_0_1': 'ab', 'x_0_2': 'bc', 'x_1_0': 'oo', 'x_1_1': 'cd', 'x_1_2': 'oo'}. Best is trial 49 with value: 0.7999999999999999.
2024-12-07 01:13:05,896 - INFO - Candidate Mean Stats: {'Max': np.float64(2.0), 'Min': np.float64(0.2979565856851017), 'Mean': np.float64(0.49098287709086136), 'Std': np.float64(0.0727470070704284)}
2024-12-07 01:13:05,896 - INFO - Candidate Std Stats: {'Max': np.float64(0.29970642832039124), 'Min': np.float64(0.0), 'Mean': np.float64(0.09448835012628713), 'Std': np.float64(0.0377410979990194)}
[I 2024-12-07 01:13:05,942] Trial 250 finished with value: 1.6666666666666665 and parameters: {'x_0_0': 'bc', 'x_0_1': 'bd', 'x_0_2': 'ab', 'x_1_0': 'ad', 'x_1_1': 'ac', 'x_1_2': 'ab'}. Best is trial 200 with value: 0.6.
2024-12-07 01:13:09,238 - INFO - Candidate Mean Stats: {'Max': np.float64(2.0), 'Min': np.float64(0.23661509764865016), 'Mean': np.float64(0.4872574835370274), 'Std': np.float64(0.08552954438069556)}
2024-12-07 01:13:09,239 - INFO - Candidate Std Stats: {'Max': np.float64(1.0059141281449988), 'Min': np.float64(0.0), 'Mean': np.float64(0.12373042905992535), 'Std': np.float64(0.05673290597221869)}
[I 2024-12-07 01:13:09,289] Trial 251 finished with value: 1.2666666666666666 and parameters: {'x_0_0': 'bc', 'x_0_1': 'oo', 'x_0_2': 'bd', 'x_1_0': 'cd', 'x_1_1': 'ac', 'x_1_2': 'cd'}. Best is trial 148 with value: 0.8333333333333333.
2024-12-07 01:13:10,538 - INFO - Candidate Mean Stats: {'Max': np.float64(2.0), 'Min': np.float64(0.2561991778539739), 'Mean': np.float64(0.4882580880314675), 'Std': np.float64(0.07751423736855577)}
2024-12-07 01:13:10,538 - INFO - Candidate Std Stats: {'Max': np.float64(0.5369597396573459), 'Min': np.float64(0.0), 'Mean': np.float64(0.10443630568630682), 'Std': np.float64(0.044383076692447884)}
[I 2024-12-07 01:13:10,581] Trial 250 finished with value: 1.3333333333333333 and parameters: {'x_0_0': 'bd', 'x_0_1': 'ab', 'x_0_2': 'bc', 'x_1_0': 'bc', 'x_1_1': 'ab', 'x_1_2': 'bc'}. Best is trial 74 with value: 0.8222222222222222.
2024-12-07 01:13:17,929 - INFO - Candidate Mean Stats: {'Max': np.float64(2.0), 'Min': np.float64(0.23328593777483872), 'Mean': np.float64(0.4907030339745358), 'Std': np.float64(0.07600513877326864)}
2024-12-07 01:13:17,929 - INFO - Candidate Std Stats: {'Max': np.float64(1.001329990619986), 'Min': np.float64(0.0), 'Mean': np.float64(0.11536099127577575), 'Std': np.float64(0.050300789547054386)}
[I 2024-12-07 01:13:17,974] Trial 251 finished with value: 1.3444444444444446 and parameters: {'x_0_0': 'ac', 'x_0_1': 'ac', 'x_0_2': 'bc', 'x_1_0': 'ac', 'x_1_1': 'oo', 'x_1_2': 'ac'}. Best is trial 49 with value: 0.7999999999999999.
2024-12-07 01:13:27,020 - INFO - Candidate Mean Stats: {'Max': np.float64(2.0), 'Min': np.float64(0.27538034401794187), 'Mean': np.float64(0.4936740026522652), 'Std': np.float64(0.07971794654218015)}
2024-12-07 01:13:27,021 - INFO - Candidate Std Stats: {'Max': np.float64(0.918045571730749), 'Min': np.float64(0.0), 'Mean': np.float64(0.11926252966832089), 'Std': np.float64(0.059935660424818606)}
[I 2024-12-07 01:13:27,065] Trial 251 finished with value: 1.2777777777777777 and parameters: {'x_0_0': 'ab', 'x_0_1': 'oo', 'x_0_2': 'oo', 'x_1_0': 'ad', 'x_1_1': 'ad', 'x_1_2': 'ac'}. Best is trial 200 with value: 0.6.
2024-12-07 01:13:30,145 - INFO - Candidate Mean Stats: {'Max': np.float64(2.0), 'Min': np.float64(0.24365782539833974), 'Mean': np.float64(0.4978781972650311), 'Std': np.float64(0.07766060130127694)}
2024-12-07 01:13:30,146 - INFO - Candidate Std Stats: {'Max': np.float64(0.8800377156157864), 'Min': np.float64(0.0), 'Mean': np.float64(0.10315878493374592), 'Std': np.float64(0.04559834038201931)}
[I 2024-12-07 01:13:30,191] Trial 252 finished with value: 1.3777777777777778 and parameters: {'x_0_0': 'ab', 'x_0_1': 'bc', 'x_0_2': 'oo', 'x_1_0': 'oo', 'x_1_1': 'oo', 'x_1_2': 'ab'}. Best is trial 148 with value: 0.8333333333333333.
2024-12-07 01:13:31,526 - INFO - Candidate Mean Stats: {'Max': np.float64(2.0), 'Min': np.float64(0.27791188047616394), 'Mean': np.float64(0.4858569579202057), 'Std': np.float64(0.07571523520801977)}
2024-12-07 01:13:31,526 - INFO - Candidate Std Stats: {'Max': np.float64(0.4576381241102288), 'Min': np.float64(0.0), 'Mean': np.float64(0.11068762940854301), 'Std': np.float64(0.046777032221381555)}
[I 2024-12-07 01:13:31,575] Trial 251 finished with value: 1.7777777777777777 and parameters: {'x_0_0': 'ab', 'x_0_1': 'ad', 'x_0_2': 'ad', 'x_1_0': 'ad', 'x_1_1': 'ac', 'x_1_2': 'ad'}. Best is trial 74 with value: 0.8222222222222222.
2024-12-07 01:13:38,709 - INFO - Candidate Mean Stats: {'Max': np.float64(2.0), 'Min': np.float64(0.2512765498666973), 'Mean': np.float64(0.4904761195708866), 'Std': np.float64(0.07665886942114769)}
2024-12-07 01:13:38,709 - INFO - Candidate Std Stats: {'Max': np.float64(1.4229111329264899), 'Min': np.float64(0.0), 'Mean': np.float64(0.09560987690282065), 'Std': np.float64(0.044578640838897565)}
[I 2024-12-07 01:13:38,752] Trial 252 finished with value: 1.2666666666666666 and parameters: {'x_0_0': 'ac', 'x_0_1': 'oo', 'x_0_2': 'ad', 'x_1_0': 'ab', 'x_1_1': 'ad', 'x_1_2': 'ac'}. Best is trial 49 with value: 0.7999999999999999.
2024-12-07 01:13:47,541 - INFO - Candidate Mean Stats: {'Max': np.float64(2.0), 'Min': np.float64(0.25109480248658705), 'Mean': np.float64(0.4942577742038465), 'Std': np.float64(0.07596959202099884)}
2024-12-07 01:13:47,542 - INFO - Candidate Std Stats: {'Max': np.float64(0.3549360869657721), 'Min': np.float64(0.0), 'Mean': np.float64(0.09440359994608903), 'Std': np.float64(0.039526213212848535)}
[I 2024-12-07 01:13:47,587] Trial 252 finished with value: 1.2777777777777777 and parameters: {'x_0_0': 'ab', 'x_0_1': 'oo', 'x_0_2': 'bc', 'x_1_0': 'bc', 'x_1_1': 'oo', 'x_1_2': 'cd'}. Best is trial 200 with value: 0.6.
2024-12-07 01:13:50,420 - INFO - Candidate Mean Stats: {'Max': np.float64(2.0), 'Min': np.float64(0.22154412023309358), 'Mean': np.float64(0.48125624052252514), 'Std': np.float64(0.08054053090704076)}
2024-12-07 01:13:50,421 - INFO - Candidate Std Stats: {'Max': np.float64(1.4729700757241444), 'Min': np.float64(0.0), 'Mean': np.float64(0.10958746233222186), 'Std': np.float64(0.05459769559623379)}
[I 2024-12-07 01:13:50,465] Trial 253 finished with value: 1.4444444444444444 and parameters: {'x_0_0': 'ad', 'x_0_1': 'bd', 'x_0_2': 'cd', 'x_1_0': 'bd', 'x_1_1': 'bd', 'x_1_2': 'ab'}. Best is trial 148 with value: 0.8333333333333333.
2024-12-07 01:13:52,291 - INFO - Candidate Mean Stats: {'Max': np.float64(2.0), 'Min': np.float64(0.2515764948403763), 'Mean': np.float64(0.483096987056297), 'Std': np.float64(0.07980063653374175)}
2024-12-07 01:13:52,292 - INFO - Candidate Std Stats: {'Max': np.float64(0.7529891331772016), 'Min': np.float64(0.0), 'Mean': np.float64(0.10486570671860956), 'Std': np.float64(0.045636423566683564)}
[I 2024-12-07 01:13:52,338] Trial 252 finished with value: 1.3444444444444446 and parameters: {'x_0_0': 'bd', 'x_0_1': 'ab', 'x_0_2': 'ac', 'x_1_0': 'bc', 'x_1_1': 'oo', 'x_1_2': 'ac'}. Best is trial 74 with value: 0.8222222222222222.
2024-12-07 01:13:59,329 - INFO - Candidate Mean Stats: {'Max': np.float64(2.0), 'Min': np.float64(0.2715618235759337), 'Mean': np.float64(0.49920995282947656), 'Std': np.float64(0.0750833292662674)}
2024-12-07 01:13:59,330 - INFO - Candidate Std Stats: {'Max': np.float64(0.5882594039870498), 'Min': np.float64(0.0), 'Mean': np.float64(0.10381208366342017), 'Std': np.float64(0.044798984923079765)}
[I 2024-12-07 01:13:59,373] Trial 253 finished with value: 1.4555555555555557 and parameters: {'x_0_0': 'bd', 'x_0_1': 'bc', 'x_0_2': 'bc', 'x_1_0': 'ab', 'x_1_1': 'oo', 'x_1_2': 'bc'}. Best is trial 49 with value: 0.7999999999999999.
2024-12-07 01:14:08,192 - INFO - Candidate Mean Stats: {'Max': np.float64(2.0), 'Min': np.float64(0.2682768672366579), 'Mean': np.float64(0.48371197520284026), 'Std': np.float64(0.07483914293295746)}
2024-12-07 01:14:08,192 - INFO - Candidate Std Stats: {'Max': np.float64(0.4295377843579992), 'Min': np.float64(0.0), 'Mean': np.float64(0.10272368340532935), 'Std': np.float64(0.04419105717679629)}
[I 2024-12-07 01:14:08,248] Trial 253 finished with value: 1.0666666666666667 and parameters: {'x_0_0': 'ad', 'x_0_1': 'oo', 'x_0_2': 'bc', 'x_1_0': 'oo', 'x_1_1': 'ab', 'x_1_2': 'bd'}. Best is trial 200 with value: 0.6.
2024-12-07 01:14:11,026 - INFO - Candidate Mean Stats: {'Max': np.float64(2.0), 'Min': np.float64(0.23914446487027347), 'Mean': np.float64(0.4854725226870298), 'Std': np.float64(0.07514311100981572)}
2024-12-07 01:14:11,026 - INFO - Candidate Std Stats: {'Max': np.float64(0.6106243377486348), 'Min': np.float64(0.0), 'Mean': np.float64(0.10529563356316), 'Std': np.float64(0.04591261699274852)}
[I 2024-12-07 01:14:11,072] Trial 254 finished with value: 1.4444444444444444 and parameters: {'x_0_0': 'bc', 'x_0_1': 'ad', 'x_0_2': 'ad', 'x_1_0': 'bc', 'x_1_1': 'cd', 'x_1_2': 'ad'}. Best is trial 148 with value: 0.8333333333333333.
2024-12-07 01:14:12,931 - INFO - Candidate Mean Stats: {'Max': np.float64(2.0), 'Min': np.float64(0.21383018124426453), 'Mean': np.float64(0.4931927434256811), 'Std': np.float64(0.07729770106985609)}
2024-12-07 01:14:12,931 - INFO - Candidate Std Stats: {'Max': np.float64(0.4106304797286181), 'Min': np.float64(0.0), 'Mean': np.float64(0.10734143061506779), 'Std': np.float64(0.046564528020706736)}
[I 2024-12-07 01:14:12,975] Trial 253 finished with value: 0.9666666666666667 and parameters: {'x_0_0': 'bc', 'x_0_1': 'oo', 'x_0_2': 'bd', 'x_1_0': 'oo', 'x_1_1': 'ac', 'x_1_2': 'oo'}. Best is trial 74 with value: 0.8222222222222222.
2024-12-07 01:14:19,744 - INFO - Candidate Mean Stats: {'Max': np.float64(2.0), 'Min': np.float64(0.2554633982329693), 'Mean': np.float64(0.4887725575516787), 'Std': np.float64(0.07313404930768762)}
2024-12-07 01:14:19,745 - INFO - Candidate Std Stats: {'Max': np.float64(1.008643457893077), 'Min': np.float64(0.0), 'Mean': np.float64(0.10093032132060945), 'Std': np.float64(0.0475596202134956)}
[I 2024-12-07 01:14:19,790] Trial 254 finished with value: 1.4444444444444444 and parameters: {'x_0_0': 'bc', 'x_0_1': 'ad', 'x_0_2': 'ab', 'x_1_0': 'ac', 'x_1_1': 'cd', 'x_1_2': 'cd'}. Best is trial 49 with value: 0.7999999999999999.
2024-12-07 01:14:28,612 - INFO - Candidate Mean Stats: {'Max': np.float64(2.0), 'Min': np.float64(0.07733477230718175), 'Mean': np.float64(0.49730170105449795), 'Std': np.float64(0.07928943832300897)}
2024-12-07 01:14:28,613 - INFO - Candidate Std Stats: {'Max': np.float64(0.71421594858291), 'Min': np.float64(0.0), 'Mean': np.float64(0.10125758087836322), 'Std': np.float64(0.05486341757327996)}
[I 2024-12-07 01:14:28,658] Trial 254 finished with value: 1.3666666666666667 and parameters: {'x_0_0': 'ad', 'x_0_1': 'bd', 'x_0_2': 'cd', 'x_1_0': 'oo', 'x_1_1': 'bc', 'x_1_2': 'oo'}. Best is trial 200 with value: 0.6.
2024-12-07 01:14:31,466 - INFO - Candidate Mean Stats: {'Max': np.float64(2.0), 'Min': np.float64(0.22313802629135626), 'Mean': np.float64(0.49180010837578864), 'Std': np.float64(0.08275038030128014)}
2024-12-07 01:14:31,466 - INFO - Candidate Std Stats: {'Max': np.float64(1.2555986923713462), 'Min': np.float64(0.0), 'Mean': np.float64(0.10462869210553163), 'Std': np.float64(0.051333985044590275)}
[I 2024-12-07 01:14:31,511] Trial 255 finished with value: 1.5555555555555556 and parameters: {'x_0_0': 'bc', 'x_0_1': 'ab', 'x_0_2': 'bc', 'x_1_0': 'ab', 'x_1_1': 'ac', 'x_1_2': 'cd'}. Best is trial 148 with value: 0.8333333333333333.
2024-12-07 01:14:33,500 - INFO - Candidate Mean Stats: {'Max': np.float64(2.0), 'Min': np.float64(0.28239860801414435), 'Mean': np.float64(0.49483968945305745), 'Std': np.float64(0.07442231055673461)}
2024-12-07 01:14:33,500 - INFO - Candidate Std Stats: {'Max': np.float64(0.3386220573785222), 'Min': np.float64(0.0), 'Mean': np.float64(0.0961146737784912), 'Std': np.float64(0.03857491002899211)}
[I 2024-12-07 01:14:33,545] Trial 254 finished with value: 1.0666666666666667 and parameters: {'x_0_0': 'bd', 'x_0_1': 'oo', 'x_0_2': 'ab', 'x_1_0': 'oo', 'x_1_1': 'ac', 'x_1_2': 'bd'}. Best is trial 74 with value: 0.8222222222222222.
2024-12-07 01:14:40,309 - INFO - Candidate Mean Stats: {'Max': np.float64(2.0), 'Min': np.float64(0.28901445858701325), 'Mean': np.float64(0.49256958104521714), 'Std': np.float64(0.06971740690854904)}
2024-12-07 01:14:40,310 - INFO - Candidate Std Stats: {'Max': np.float64(0.5697826210519915), 'Min': np.float64(0.0), 'Mean': np.float64(0.09607859487725799), 'Std': np.float64(0.04307516403729989)}
[I 2024-12-07 01:14:40,355] Trial 255 finished with value: 1.0555555555555556 and parameters: {'x_0_0': 'bd', 'x_0_1': 'oo', 'x_0_2': 'oo', 'x_1_0': 'ab', 'x_1_1': 'ad', 'x_1_2': 'ab'}. Best is trial 49 with value: 0.7999999999999999.
2024-12-07 01:14:49,114 - INFO - Candidate Mean Stats: {'Max': np.float64(2.0), 'Min': np.float64(0.1433734890052391), 'Mean': np.float64(0.4787934048854788), 'Std': np.float64(0.07977993313707772)}
2024-12-07 01:14:49,115 - INFO - Candidate Std Stats: {'Max': np.float64(1.36004329539751), 'Min': np.float64(0.0), 'Mean': np.float64(0.1083870816427348), 'Std': np.float64(0.05160093505855942)}
[I 2024-12-07 01:14:49,158] Trial 255 finished with value: 1.2666666666666666 and parameters: {'x_0_0': 'ac', 'x_0_1': 'oo', 'x_0_2': 'ac', 'x_1_0': 'ad', 'x_1_1': 'cd', 'x_1_2': 'ac'}. Best is trial 200 with value: 0.6.
2024-12-07 01:14:52,104 - INFO - Candidate Mean Stats: {'Max': np.float64(2.0), 'Min': np.float64(0.26203178578650993), 'Mean': np.float64(0.4823874158020033), 'Std': np.float64(0.07611300371573868)}
2024-12-07 01:14:52,105 - INFO - Candidate Std Stats: {'Max': np.float64(0.29787672024859163), 'Min': np.float64(0.0), 'Mean': np.float64(0.09774170619092443), 'Std': np.float64(0.03787705857143719)}
[I 2024-12-07 01:14:52,149] Trial 256 finished with value: 1.6666666666666665 and parameters: {'x_0_0': 'bc', 'x_0_1': 'bc', 'x_0_2': 'ad', 'x_1_0': 'ad', 'x_1_1': 'cd', 'x_1_2': 'ac'}. Best is trial 148 with value: 0.8333333333333333.
2024-12-07 01:14:54,089 - INFO - Candidate Mean Stats: {'Max': np.float64(2.0), 'Min': np.float64(0.21817747796581285), 'Mean': np.float64(0.4880269003627126), 'Std': np.float64(0.07677704201252605)}
2024-12-07 01:14:54,089 - INFO - Candidate Std Stats: {'Max': np.float64(0.8945516750428023), 'Min': np.float64(0.0), 'Mean': np.float64(0.10846520169166748), 'Std': np.float64(0.049515980887713876)}
[I 2024-12-07 01:14:54,133] Trial 255 finished with value: 0.9444444444444444 and parameters: {'x_0_0': 'bd', 'x_0_1': 'oo', 'x_0_2': 'oo', 'x_1_0': 'bd', 'x_1_1': 'cd', 'x_1_2': 'bc'}. Best is trial 74 with value: 0.8222222222222222.
2024-12-07 01:15:00,969 - INFO - Candidate Mean Stats: {'Max': np.float64(2.0), 'Min': np.float64(0.27708173685385934), 'Mean': np.float64(0.49871644657041736), 'Std': np.float64(0.06937964936721176)}
2024-12-07 01:15:00,969 - INFO - Candidate Std Stats: {'Max': np.float64(0.39354464111376625), 'Min': np.float64(0.0), 'Mean': np.float64(0.09734054197694005), 'Std': np.float64(0.04005905019459056)}
[I 2024-12-07 01:15:01,014] Trial 256 finished with value: 1.4666666666666666 and parameters: {'x_0_0': 'bc', 'x_0_1': 'bc', 'x_0_2': 'oo', 'x_1_0': 'ac', 'x_1_1': 'ad', 'x_1_2': 'oo'}. Best is trial 49 with value: 0.7999999999999999.
2024-12-07 01:15:09,679 - INFO - Candidate Mean Stats: {'Max': np.float64(2.0), 'Min': np.float64(0.26825516667311006), 'Mean': np.float64(0.49573288580383434), 'Std': np.float64(0.07089355952715556)}
2024-12-07 01:15:09,679 - INFO - Candidate Std Stats: {'Max': np.float64(0.36686577946433885), 'Min': np.float64(0.0), 'Mean': np.float64(0.09496278692611171), 'Std': np.float64(0.040934314947100175)}
