[I 2024-12-06 23:39:00,806] Trial 467 finished with value: 1.3214285714285714 and parameters: {'x_0_0': 'bc', 'x_0_1': 'bd', 'x_1_0': 'oo', 'x_1_1': 'ac'}. Best is trial 165 with value: 0.5.
2024-12-06 23:39:00,865 - INFO - Candidate Mean Stats: {'Max': np.float64(2.9588975664197386), 'Min': np.float64(-0.46656319898319965), 'Mean': np.float64(0.8089808161100817), 'Std': np.float64(0.5336055130364518)}
2024-12-06 23:39:00,865 - INFO - Candidate Std Stats: {'Max': np.float64(1.3828778655611906), 'Min': np.float64(0.0), 'Mean': np.float64(0.39714531995964725), 'Std': np.float64(0.2575110996597763)}
[I 2024-12-06 23:39:00,880] Trial 467 finished with value: 1.3214285714285714 and parameters: {'x_0_0': 'ad', 'x_0_1': 'ac', 'x_1_0': 'oo', 'x_1_1': 'cd'}. Best is trial 63 with value: 0.5.
2024-12-06 23:39:01,120 - INFO - Candidate Mean Stats: {'Max': np.float64(2.849589317053575), 'Min': np.float64(-0.32513497658521323), 'Mean': np.float64(0.8397443518509315), 'Std': np.float64(0.5069130739884471)}
2024-12-06 23:39:01,120 - INFO - Candidate Std Stats: {'Max': np.float64(1.2688327742844285), 'Min': np.float64(0.0), 'Mean': np.float64(0.4011313342878623), 'Std': np.float64(0.25911811471514395)}
[I 2024-12-06 23:39:01,165] Trial 465 finished with value: 1.3214285714285714 and parameters: {'x_0_0': 'bd', 'x_0_1': 'ad', 'x_1_0': 'oo', 'x_1_1': 'ad'}. Best is trial 23 with value: 0.5.
2024-12-06 23:39:01,255 - INFO - Candidate Mean Stats: {'Max': np.float64(2.640274016855497), 'Min': np.float64(-0.5499772199326255), 'Mean': np.float64(0.8101684764204571), 'Std': np.float64(0.5079337253521645)}
2024-12-06 23:39:01,255 - INFO - Candidate Std Stats: {'Max': np.float64(1.4308048585438262), 'Min': np.float64(0.0), 'Mean': np.float64(0.45168330843448196), 'Std': np.float64(0.2981135859702459)}
[I 2024-12-06 23:39:01,278] Trial 468 finished with value: 1.1607142857142856 and parameters: {'x_0_0': 'bd', 'x_0_1': 'ac', 'x_1_0': 'bd', 'x_1_1': 'oo'}. Best is trial 76 with value: 0.5.
2024-12-06 23:39:01,357 - INFO - Candidate Mean Stats: {'Max': np.float64(2.7974539265980725), 'Min': np.float64(-0.8675052354274483), 'Mean': np.float64(0.7926673089397812), 'Std': np.float64(0.5531389820981081)}
2024-12-06 23:39:01,357 - INFO - Candidate Std Stats: {'Max': np.float64(1.637648741676372), 'Min': np.float64(0.0), 'Mean': np.float64(0.4655198143093038), 'Std': np.float64(0.2998339541893865)}
[I 2024-12-06 23:39:01,407] Trial 468 finished with value: 1.3214285714285714 and parameters: {'x_0_0': 'bd', 'x_0_1': 'ad', 'x_1_0': 'oo', 'x_1_1': 'ab'}. Best is trial 165 with value: 0.5.
2024-12-06 23:39:01,509 - INFO - Candidate Mean Stats: {'Max': np.float64(2.887088400698067), 'Min': np.float64(-0.2720555949255739), 'Mean': np.float64(0.8990670642951788), 'Std': np.float64(0.4585406788285716)}
2024-12-06 23:39:01,511 - INFO - Candidate Std Stats: {'Max': np.float64(1.7316139933642942), 'Min': np.float64(0.0), 'Mean': np.float64(0.3658740773929728), 'Std': np.float64(0.2618633118709444)}
[I 2024-12-06 23:39:01,544] Trial 468 finished with value: 1.5 and parameters: {'x_0_0': 'cd', 'x_0_1': 'oo', 'x_1_0': 'cd', 'x_1_1': 'bd'}. Best is trial 63 with value: 0.5.
2024-12-06 23:39:01,840 - INFO - Candidate Mean Stats: {'Max': np.float64(3.087965388014923), 'Min': np.float64(-0.49980244375025373), 'Mean': np.float64(0.8097921434594393), 'Std': np.float64(0.5165743562679153)}
2024-12-06 23:39:01,840 - INFO - Candidate Std Stats: {'Max': np.float64(1.3095270199092315), 'Min': np.float64(0.0), 'Mean': np.float64(0.4506571238749224), 'Std': np.float64(0.29072243693488653)}
[I 2024-12-06 23:39:01,856] Trial 466 finished with value: 1.0 and parameters: {'x_0_0': 'bd', 'x_0_1': 'bd', 'x_1_0': 'bc', 'x_1_1': 'ad'}. Best is trial 23 with value: 0.5.
2024-12-06 23:39:01,915 - INFO - Candidate Mean Stats: {'Max': np.float64(3.3552086665252423), 'Min': np.float64(-0.7796768972010106), 'Mean': np.float64(0.7565405230735158), 'Std': np.float64(0.5535549137100603)}
2024-12-06 23:39:01,915 - INFO - Candidate Std Stats: {'Max': np.float64(1.684451256231408), 'Min': np.float64(0.0), 'Mean': np.float64(0.48888652538655036), 'Std': np.float64(0.31212787110656415)}
[I 2024-12-06 23:39:01,933] Trial 469 finished with value: 1.0357142857142856 and parameters: {'x_0_0': 'ac', 'x_0_1': 'ac', 'x_1_0': 'oo', 'x_1_1': 'ac'}. Best is trial 76 with value: 0.5.
2024-12-06 23:39:01,967 - INFO - Candidate Mean Stats: {'Max': np.float64(3.3841508346468756), 'Min': np.float64(-0.38829417644185904), 'Mean': np.float64(0.7934922996546817), 'Std': np.float64(0.47913952295513723)}
2024-12-06 23:39:01,967 - INFO - Candidate Std Stats: {'Max': np.float64(1.8215006199182961), 'Min': np.float64(0.0), 'Mean': np.float64(0.4657304974554088), 'Std': np.float64(0.31137815801581914)}
[I 2024-12-06 23:39:01,985] Trial 469 finished with value: 1.5714285714285714 and parameters: {'x_0_0': 'bc', 'x_0_1': 'cd', 'x_1_0': 'bc', 'x_1_1': 'ab'}. Best is trial 165 with value: 0.5.
2024-12-06 23:39:02,062 - INFO - Candidate Mean Stats: {'Max': np.float64(3.106189812930594), 'Min': np.float64(-0.41976220355409133), 'Mean': np.float64(0.8009624750006676), 'Std': np.float64(0.4556932248511099)}
2024-12-06 23:39:02,062 - INFO - Candidate Std Stats: {'Max': np.float64(1.5257273999711367), 'Min': np.float64(0.0), 'Mean': np.float64(0.47143031485699555), 'Std': np.float64(0.3232716044654573)}
[I 2024-12-06 23:39:02,078] Trial 469 finished with value: 1.2142857142857144 and parameters: {'x_0_0': 'ab', 'x_0_1': 'oo', 'x_1_0': 'ab', 'x_1_1': 'bd'}. Best is trial 63 with value: 0.5.
2024-12-06 23:39:02,285 - INFO - Candidate Mean Stats: {'Max': np.float64(3.2204822586668223), 'Min': np.float64(-0.46820591303129977), 'Mean': np.float64(0.831856301917835), 'Std': np.float64(0.5077666681976057)}
2024-12-06 23:39:02,285 - INFO - Candidate Std Stats: {'Max': np.float64(1.9276153371239761), 'Min': np.float64(0.0), 'Mean': np.float64(0.4371739293689716), 'Std': np.float64(0.3121944361394218)}
[I 2024-12-06 23:39:02,300] Trial 467 finished with value: 1.2857142857142856 and parameters: {'x_0_0': 'bc', 'x_0_1': 'ac', 'x_1_0': 'ac', 'x_1_1': 'bd'}. Best is trial 23 with value: 0.5.
2024-12-06 23:39:02,364 - INFO - Candidate Mean Stats: {'Max': np.float64(2.826388587209922), 'Min': np.float64(-0.5996002602567717), 'Mean': np.float64(0.8567481968294824), 'Std': np.float64(0.4824141062676759)}
2024-12-06 23:39:02,364 - INFO - Candidate Std Stats: {'Max': np.float64(1.6654840001489604), 'Min': np.float64(0.0), 'Mean': np.float64(0.4372206070960965), 'Std': np.float64(0.2964809422953051)}
[I 2024-12-06 23:39:02,379] Trial 470 finished with value: 1.3214285714285714 and parameters: {'x_0_0': 'bc', 'x_0_1': 'bd', 'x_1_0': 'oo', 'x_1_1': 'ac'}. Best is trial 76 with value: 0.5.
2024-12-06 23:39:02,402 - INFO - Candidate Mean Stats: {'Max': np.float64(3.1647908410350922), 'Min': np.float64(-0.6373443269296138), 'Mean': np.float64(0.8757681402995882), 'Std': np.float64(0.46000673165658434)}
2024-12-06 23:39:02,402 - INFO - Candidate Std Stats: {'Max': np.float64(1.523971627971699), 'Min': np.float64(0.0), 'Mean': np.float64(0.3983176867113255), 'Std': np.float64(0.27321340750477646)}
[I 2024-12-06 23:39:02,417] Trial 470 finished with value: 1.5 and parameters: {'x_0_0': 'cd', 'x_0_1': 'oo', 'x_1_0': 'ac', 'x_1_1': 'ac'}. Best is trial 165 with value: 0.5.
2024-12-06 23:39:02,485 - INFO - Candidate Mean Stats: {'Max': np.float64(2.7972769963517785), 'Min': np.float64(-0.24890723727252112), 'Mean': np.float64(0.7947512199817449), 'Std': np.float64(0.49592986908320214)}
2024-12-06 23:39:02,485 - INFO - Candidate Std Stats: {'Max': np.float64(1.552762189092263), 'Min': np.float64(0.0), 'Mean': np.float64(0.4231868110481541), 'Std': np.float64(0.2814316367389195)}
[I 2024-12-06 23:39:02,525] Trial 470 finished with value: 1.5714285714285714 and parameters: {'x_0_0': 'bd', 'x_0_1': 'bd', 'x_1_0': 'ac', 'x_1_1': 'ab'}. Best is trial 63 with value: 0.5.
2024-12-06 23:39:02,784 - INFO - Candidate Mean Stats: {'Max': np.float64(3.175319214879734), 'Min': np.float64(-0.38518391224268606), 'Mean': np.float64(0.87141724665944), 'Std': np.float64(0.5028037827128325)}
2024-12-06 23:39:02,785 - INFO - Candidate Std Stats: {'Max': np.float64(1.1733994877837899), 'Min': np.float64(0.0), 'Mean': np.float64(0.3759345738387706), 'Std': np.float64(0.2504344759968377)}
[I 2024-12-06 23:39:02,814] Trial 468 finished with value: 1.1964285714285714 and parameters: {'x_0_0': 'bc', 'x_0_1': 'bd', 'x_1_0': 'oo', 'x_1_1': 'oo'}. Best is trial 23 with value: 0.5.
2024-12-06 23:39:02,887 - INFO - Candidate Mean Stats: {'Max': np.float64(3.5331057549438514), 'Min': np.float64(-0.760418136009282), 'Mean': np.float64(0.7899967672983254), 'Std': np.float64(0.558274587690001)}
2024-12-06 23:39:02,887 - INFO - Candidate Std Stats: {'Max': np.float64(1.5758572712921062), 'Min': np.float64(0.0), 'Mean': np.float64(0.4997502362337085), 'Std': np.float64(0.34727138663629015)}
[I 2024-12-06 23:39:02,908] Trial 471 finished with value: 1.1785714285714286 and parameters: {'x_0_0': 'bc', 'x_0_1': 'ab', 'x_1_0': 'oo', 'x_1_1': 'ab'}. Best is trial 76 with value: 0.5.
2024-12-06 23:39:02,922 - INFO - Candidate Mean Stats: {'Max': np.float64(3.2772546528463877), 'Min': np.float64(-0.5654428394823319), 'Mean': np.float64(0.7991475027523091), 'Std': np.float64(0.4960657603211261)}
2024-12-06 23:39:02,922 - INFO - Candidate Std Stats: {'Max': np.float64(1.3163768038731176), 'Min': np.float64(0.0), 'Mean': np.float64(0.45907007821584034), 'Std': np.float64(0.30523454085432233)}
[I 2024-12-06 23:39:02,938] Trial 471 finished with value: 1.5 and parameters: {'x_0_0': 'cd', 'x_0_1': 'oo', 'x_1_0': 'ac', 'x_1_1': 'bc'}. Best is trial 165 with value: 0.5.
2024-12-06 23:39:03,036 - INFO - Candidate Mean Stats: {'Max': np.float64(3.1281400226873064), 'Min': np.float64(-0.5085645000215553), 'Mean': np.float64(0.8373391007971884), 'Std': np.float64(0.4902117532476696)}
2024-12-06 23:39:03,036 - INFO - Candidate Std Stats: {'Max': np.float64(1.5207565716651483), 'Min': np.float64(0.0), 'Mean': np.float64(0.43743195388132416), 'Std': np.float64(0.28220595949155997)}
[I 2024-12-06 23:39:03,055] Trial 471 finished with value: 1.2857142857142856 and parameters: {'x_0_0': 'ac', 'x_0_1': 'ac', 'x_1_0': 'bc', 'x_1_1': 'ad'}. Best is trial 63 with value: 0.5.
2024-12-06 23:39:03,263 - INFO - Candidate Mean Stats: {'Max': np.float64(2.6188942953672703), 'Min': np.float64(-0.38849737283256164), 'Mean': np.float64(0.8582590851427871), 'Std': np.float64(0.49359703431377566)}
2024-12-06 23:39:03,263 - INFO - Candidate Std Stats: {'Max': np.float64(1.416491335332695), 'Min': np.float64(0.0), 'Mean': np.float64(0.4047621304605726), 'Std': np.float64(0.2722048482263398)}
[I 2024-12-06 23:39:03,279] Trial 469 finished with value: 1.0 and parameters: {'x_0_0': 'bc', 'x_0_1': 'ad', 'x_1_0': 'ac', 'x_1_1': 'bc'}. Best is trial 23 with value: 0.5.
2024-12-06 23:39:03,347 - INFO - Candidate Mean Stats: {'Max': np.float64(2.883462361204679), 'Min': np.float64(-0.5473105861259978), 'Mean': np.float64(0.8310002895955318), 'Std': np.float64(0.5152531414883277)}
2024-12-06 23:39:03,347 - INFO - Candidate Std Stats: {'Max': np.float64(1.718046642111635), 'Min': np.float64(0.0), 'Mean': np.float64(0.47112384924296946), 'Std': np.float64(0.3135781081044372)}
[I 2024-12-06 23:39:03,363] Trial 472 finished with value: 1.2142857142857144 and parameters: {'x_0_0': 'ab', 'x_0_1': 'oo', 'x_1_0': 'bc', 'x_1_1': 'ad'}. Best is trial 76 with value: 0.5.
2024-12-06 23:39:03,374 - INFO - Candidate Mean Stats: {'Max': np.float64(2.82714029765382), 'Min': np.float64(-0.34302020518958554), 'Mean': np.float64(0.8229864654860254), 'Std': np.float64(0.44947817438657817)}
2024-12-06 23:39:03,375 - INFO - Candidate Std Stats: {'Max': np.float64(1.5764571002946666), 'Min': np.float64(0.0), 'Mean': np.float64(0.4151764936773438), 'Std': np.float64(0.284775248002739)}
[I 2024-12-06 23:39:03,391] Trial 472 finished with value: 1.4642857142857144 and parameters: {'x_0_0': 'ab', 'x_0_1': 'ad', 'x_1_0': 'oo', 'x_1_1': 'ab'}. Best is trial 165 with value: 0.5.
2024-12-06 23:39:03,479 - INFO - Candidate Mean Stats: {'Max': np.float64(3.085894226010229), 'Min': np.float64(-0.8375809923916956), 'Mean': np.float64(0.7768830939151412), 'Std': np.float64(0.5871503624562122)}
2024-12-06 23:39:03,479 - INFO - Candidate Std Stats: {'Max': np.float64(1.7611223412865127), 'Min': np.float64(0.0), 'Mean': np.float64(0.5002169823698109), 'Std': np.float64(0.33419159838691387)}
[I 2024-12-06 23:39:03,501] Trial 472 finished with value: 1.0 and parameters: {'x_0_0': 'bd', 'x_0_1': 'ad', 'x_1_0': 'bc', 'x_1_1': 'ad'}. Best is trial 63 with value: 0.5.
2024-12-06 23:39:03,693 - INFO - Candidate Mean Stats: {'Max': np.float64(3.449003631976712), 'Min': np.float64(-0.35490444257950077), 'Mean': np.float64(0.8417041356461055), 'Std': np.float64(0.49332446536362107)}
2024-12-06 23:39:03,693 - INFO - Candidate Std Stats: {'Max': np.float64(1.4325335610007834), 'Min': np.float64(0.0), 'Mean': np.float64(0.3905617125822766), 'Std': np.float64(0.2673368469239993)}
[I 2024-12-06 23:39:03,725] Trial 470 finished with value: 1.1607142857142856 and parameters: {'x_0_0': 'bc', 'x_0_1': 'ad', 'x_1_0': 'ab', 'x_1_1': 'oo'}. Best is trial 23 with value: 0.5.
2024-12-06 23:39:03,786 - INFO - Candidate Mean Stats: {'Max': np.float64(2.8280777715233016), 'Min': np.float64(-0.590525586676824), 'Mean': np.float64(0.8254422002718506), 'Std': np.float64(0.5202629159828415)}
2024-12-06 23:39:03,786 - INFO - Candidate Std Stats: {'Max': np.float64(1.8080885478846291), 'Min': np.float64(0.0), 'Mean': np.float64(0.47307687684796573), 'Std': np.float64(0.31357450995531616)}
[I 2024-12-06 23:39:03,802] Trial 473 finished with value: 1.2142857142857144 and parameters: {'x_0_0': 'ab', 'x_0_1': 'oo', 'x_1_0': 'ac', 'x_1_1': 'ad'}. Best is trial 76 with value: 0.5.
2024-12-06 23:39:03,818 - INFO - Candidate Mean Stats: {'Max': np.float64(2.8218585052261806), 'Min': np.float64(-0.4408727851367596), 'Mean': np.float64(0.8172295466130478), 'Std': np.float64(0.5101868718170119)}
2024-12-06 23:39:03,818 - INFO - Candidate Std Stats: {'Max': np.float64(1.5151831920790118), 'Min': np.float64(0.0), 'Mean': np.float64(0.44317640840856287), 'Std': np.float64(0.31056238332867264)}
[I 2024-12-06 23:39:03,836] Trial 473 finished with value: 1.4464285714285714 and parameters: {'x_0_0': 'ac', 'x_0_1': 'bd', 'x_1_0': 'ad', 'x_1_1': 'oo'}. Best is trial 165 with value: 0.5.
2024-12-06 23:39:03,934 - INFO - Candidate Mean Stats: {'Max': np.float64(2.594664763053047), 'Min': np.float64(-0.31312429416804666), 'Mean': np.float64(0.8673309987200724), 'Std': np.float64(0.47431479615944605)}
2024-12-06 23:39:03,934 - INFO - Candidate Std Stats: {'Max': np.float64(1.2548826909919681), 'Min': np.float64(0.0), 'Mean': np.float64(0.3756308529699246), 'Std': np.float64(0.25300962912131175)}
[I 2024-12-06 23:39:03,949] Trial 473 finished with value: 1.125 and parameters: {'x_0_0': 'oo', 'x_0_1': 'oo', 'x_1_0': 'oo', 'x_1_1': 'ab'}. Best is trial 63 with value: 0.5.
2024-12-06 23:39:04,160 - INFO - Candidate Mean Stats: {'Max': np.float64(2.8714225022836892), 'Min': np.float64(-0.3552705191773136), 'Mean': np.float64(0.8637431986379812), 'Std': np.float64(0.501798381855957)}
2024-12-06 23:39:04,160 - INFO - Candidate Std Stats: {'Max': np.float64(1.3199504160895577), 'Min': np.float64(0.0), 'Mean': np.float64(0.43918568157654225), 'Std': np.float64(0.28694170447328615)}
[I 2024-12-06 23:39:04,178] Trial 471 finished with value: 1.5 and parameters: {'x_0_0': 'cd', 'x_0_1': 'oo', 'x_1_0': 'ab', 'x_1_1': 'cd'}. Best is trial 23 with value: 0.5.
2024-12-06 23:39:04,245 - INFO - Candidate Mean Stats: {'Max': np.float64(3.133594303321673), 'Min': np.float64(-0.3996355541896759), 'Mean': np.float64(0.8219866175619169), 'Std': np.float64(0.4897989451776772)}
2024-12-06 23:39:04,247 - INFO - Candidate Std Stats: {'Max': np.float64(1.4025601628822904), 'Min': np.float64(0.0), 'Mean': np.float64(0.4137298750511765), 'Std': np.float64(0.27846951943442033)}
[I 2024-12-06 23:39:04,269] Trial 474 finished with value: 1.4464285714285714 and parameters: {'x_0_0': 'ac', 'x_0_1': 'bc', 'x_1_0': 'ac', 'x_1_1': 'oo'}. Best is trial 76 with value: 0.5.
2024-12-06 23:39:04,276 - INFO - Candidate Mean Stats: {'Max': np.float64(3.011707903062488), 'Min': np.float64(-0.4060841512114708), 'Mean': np.float64(0.8790056558243275), 'Std': np.float64(0.41523235819511345)}
2024-12-06 23:39:04,277 - INFO - Candidate Std Stats: {'Max': np.float64(1.4918641757190128), 'Min': np.float64(0.0), 'Mean': np.float64(0.3582721151854169), 'Std': np.float64(0.2638635431369351)}
[I 2024-12-06 23:39:04,296] Trial 474 finished with value: 1.25 and parameters: {'x_0_0': 'oo', 'x_0_1': 'oo', 'x_1_0': 'bd', 'x_1_1': 'oo'}. Best is trial 165 with value: 0.5.
2024-12-06 23:39:04,402 - INFO - Candidate Mean Stats: {'Max': np.float64(2.769470942883213), 'Min': np.float64(-0.4435208834009357), 'Mean': np.float64(0.8506981589725133), 'Std': np.float64(0.4564120589457186)}
2024-12-06 23:39:04,402 - INFO - Candidate Std Stats: {'Max': np.float64(1.3626237748485668), 'Min': np.float64(0.0), 'Mean': np.float64(0.42048730168185683), 'Std': np.float64(0.2833053171134131)}
[I 2024-12-06 23:39:04,420] Trial 474 finished with value: 1.2857142857142856 and parameters: {'x_0_0': 'ad', 'x_0_1': 'ab', 'x_1_0': 'bd', 'x_1_1': 'bc'}. Best is trial 63 with value: 0.5.
2024-12-06 23:39:04,718 - INFO - Candidate Mean Stats: {'Max': np.float64(2.834510010455788), 'Min': np.float64(-0.4570766468208549), 'Mean': np.float64(0.8710954390536808), 'Std': np.float64(0.5196659857725001)}
2024-12-06 23:39:04,718 - INFO - Candidate Std Stats: {'Max': np.float64(1.3504370918311388), 'Min': np.float64(0.0), 'Mean': np.float64(0.3948292193300009), 'Std': np.float64(0.25991617858968413)}
[I 2024-12-06 23:39:04,747] Trial 472 finished with value: 1.0357142857142856 and parameters: {'x_0_0': 'bc', 'x_0_1': 'ac', 'x_1_0': 'oo', 'x_1_1': 'bd'}. Best is trial 23 with value: 0.5.
2024-12-06 23:39:04,808 - INFO - Candidate Mean Stats: {'Max': np.float64(2.936903470857858), 'Min': np.float64(-0.4663990987852656), 'Mean': np.float64(0.7988462785304206), 'Std': np.float64(0.5149724071471722)}
2024-12-06 23:39:04,808 - INFO - Candidate Std Stats: {'Max': np.float64(1.6707032398144754), 'Min': np.float64(0.0), 'Mean': np.float64(0.48367445016159344), 'Std': np.float64(0.33001986482072787)}
[I 2024-12-06 23:39:04,848] Trial 475 finished with value: 1.3214285714285714 and parameters: {'x_0_0': 'ac', 'x_0_1': 'bc', 'x_1_0': 'oo', 'x_1_1': 'ab'}. Best is trial 76 with value: 0.5.
2024-12-06 23:39:04,850 - INFO - Candidate Mean Stats: {'Max': np.float64(3.113952211172487), 'Min': np.float64(-0.7586157550728474), 'Mean': np.float64(0.7813114014767288), 'Std': np.float64(0.5614050210002186)}
2024-12-06 23:39:04,850 - INFO - Candidate Std Stats: {'Max': np.float64(1.7438254580654613), 'Min': np.float64(0.0), 'Mean': np.float64(0.4479447676213311), 'Std': np.float64(0.3160133597623067)}
[I 2024-12-06 23:39:04,868] Trial 475 finished with value: 1.5714285714285714 and parameters: {'x_0_0': 'ac', 'x_0_1': 'cd', 'x_1_0': 'ab', 'x_1_1': 'cd'}. Best is trial 165 with value: 0.5.
2024-12-06 23:39:04,975 - INFO - Candidate Mean Stats: {'Max': np.float64(2.893657025038625), 'Min': np.float64(-0.3231880412153546), 'Mean': np.float64(0.8340561495755952), 'Std': np.float64(0.44796125875940085)}
2024-12-06 23:39:04,976 - INFO - Candidate Std Stats: {'Max': np.float64(1.5268134661334338), 'Min': np.float64(0.0), 'Mean': np.float64(0.4237157456856674), 'Std': np.float64(0.2846065206466529)}
[I 2024-12-06 23:39:04,992] Trial 475 finished with value: 1.5714285714285714 and parameters: {'x_0_0': 'bc', 'x_0_1': 'bd', 'x_1_0': 'bc', 'x_1_1': 'ab'}. Best is trial 63 with value: 0.5.
2024-12-06 23:39:05,297 - INFO - Candidate Mean Stats: {'Max': np.float64(3.1097950940759995), 'Min': np.float64(-0.42143215224444247), 'Mean': np.float64(0.8462438622143773), 'Std': np.float64(0.5129533300906974)}
2024-12-06 23:39:05,297 - INFO - Candidate Std Stats: {'Max': np.float64(1.6570875934836629), 'Min': np.float64(0.0), 'Mean': np.float64(0.4243260687403004), 'Std': np.float64(0.2931298975416805)}
[I 2024-12-06 23:39:05,315] Trial 473 finished with value: 1.1785714285714286 and parameters: {'x_0_0': 'ac', 'x_0_1': 'ab', 'x_1_0': 'oo', 'x_1_1': 'ac'}. Best is trial 23 with value: 0.5.
2024-12-06 23:39:05,353 - INFO - Candidate Mean Stats: {'Max': np.float64(3.236996428741714), 'Min': np.float64(-0.4182463621232966), 'Mean': np.float64(0.8294023962381635), 'Std': np.float64(0.5552415733582559)}
2024-12-06 23:39:05,353 - INFO - Candidate Std Stats: {'Max': np.float64(1.7012180570319715), 'Min': np.float64(0.0), 'Mean': np.float64(0.44196870975420194), 'Std': np.float64(0.30089003267045167)}
2024-12-06 23:39:05,365 - INFO - Candidate Mean Stats: {'Max': np.float64(2.862850845077514), 'Min': np.float64(-0.47451792870730836), 'Mean': np.float64(0.8599143909423496), 'Std': np.float64(0.49448214758284237)}
2024-12-06 23:39:05,366 - INFO - Candidate Std Stats: {'Max': np.float64(1.5440283501820908), 'Min': np.float64(0.0), 'Mean': np.float64(0.38833750960674934), 'Std': np.float64(0.27905598341159205)}
[I 2024-12-06 23:39:05,373] Trial 476 finished with value: 1.0 and parameters: {'x_0_0': 'bc', 'x_0_1': 'ad', 'x_1_0': 'ab', 'x_1_1': 'bd'}. Best is trial 76 with value: 0.5.
