[I 2024-12-06 23:36:24,741] Trial 61 finished with value: 0.8214285714285714 and parameters: {'x_0_0': 'bc', 'x_0_1': 'oo', 'x_1_0': 'oo', 'x_1_1': 'bc'}. Best is trial 50 with value: 0.6607142857142857.
2024-12-06 23:36:24,918 - INFO - Candidate Mean Stats: {'Max': np.float64(2.0), 'Min': np.float64(-0.9744741181516448), 'Mean': np.float64(0.26794971431426784), 'Std': np.float64(0.39180398642030745)}
2024-12-06 23:36:24,918 - INFO - Candidate Std Stats: {'Max': np.float64(1.543145503916529), 'Min': np.float64(0.0), 'Mean': np.float64(0.585769125861634), 'Std': np.float64(0.24451666063011737)}
[I 2024-12-06 23:36:24,931] Trial 61 finished with value: 1.0714285714285714 and parameters: {'x_0_0': 'bc', 'x_0_1': 'oo', 'x_1_0': 'bc', 'x_1_1': 'bc'}. Best is trial 23 with value: 0.5.
2024-12-06 23:36:25,044 - INFO - Candidate Mean Stats: {'Max': np.float64(2.0), 'Min': np.float64(-0.806934475829696), 'Mean': np.float64(0.23000326260356677), 'Std': np.float64(0.4242397773815907)}
2024-12-06 23:36:25,044 - INFO - Candidate Std Stats: {'Max': np.float64(1.4549657344484388), 'Min': np.float64(0.0), 'Mean': np.float64(0.5964707226603115), 'Std': np.float64(0.23990146560254905)}
[I 2024-12-06 23:36:25,057] Trial 62 finished with value: 1.0714285714285714 and parameters: {'x_0_0': 'bc', 'x_0_1': 'oo', 'x_1_0': 'ac', 'x_1_1': 'cd'}. Best is trial 14 with value: 0.6428571428571428.
2024-12-06 23:36:25,066 - INFO - Candidate Mean Stats: {'Max': np.float64(2.0), 'Min': np.float64(-1.2300708153815212), 'Mean': np.float64(0.25114635061643026), 'Std': np.float64(0.45620881738632973)}
2024-12-06 23:36:25,066 - INFO - Candidate Std Stats: {'Max': np.float64(1.8307651029130156), 'Min': np.float64(0.0), 'Mean': np.float64(0.6739501219333822), 'Std': np.float64(0.2906289610901016)}
2024-12-06 23:36:25,072 - INFO - Candidate Mean Stats: {'Max': np.float64(2.0), 'Min': np.float64(-1.0012471568956218), 'Mean': np.float64(0.2813375999368412), 'Std': np.float64(0.44025318787620454)}
2024-12-06 23:36:25,073 - INFO - Candidate Std Stats: {'Max': np.float64(1.611469644958254), 'Min': np.float64(0.0), 'Mean': np.float64(0.6229955213710916), 'Std': np.float64(0.2660331928166654)}
[I 2024-12-06 23:36:25,080] Trial 62 finished with value: 0.6964285714285714 and parameters: {'x_0_0': 'ac', 'x_0_1': 'oo', 'x_1_0': 'oo', 'x_1_1': 'oo'}. Best is trial 33 with value: 0.6964285714285714.
[I 2024-12-06 23:36:25,086] Trial 62 finished with value: 1.0714285714285714 and parameters: {'x_0_0': 'bc', 'x_0_1': 'oo', 'x_1_0': 'bd', 'x_1_1': 'ad'}. Best is trial 50 with value: 0.6607142857142857.
2024-12-06 23:36:25,251 - INFO - Candidate Mean Stats: {'Max': np.float64(2.0), 'Min': np.float64(-0.6831921037036109), 'Mean': np.float64(0.347099241722021), 'Std': np.float64(0.3795552653807693)}
2024-12-06 23:36:25,251 - INFO - Candidate Std Stats: {'Max': np.float64(1.4933002326354032), 'Min': np.float64(0.0), 'Mean': np.float64(0.5287051896683119), 'Std': np.float64(0.24119381204263182)}
[I 2024-12-06 23:36:25,264] Trial 62 finished with value: 1.0714285714285714 and parameters: {'x_0_0': 'bc', 'x_0_1': 'oo', 'x_1_0': 'bc', 'x_1_1': 'cd'}. Best is trial 23 with value: 0.5.
2024-12-06 23:36:25,373 - INFO - Candidate Mean Stats: {'Max': np.float64(2.0), 'Min': np.float64(-1.029292765191133), 'Mean': np.float64(0.28738894350150257), 'Std': np.float64(0.44158032458947283)}
2024-12-06 23:36:25,373 - INFO - Candidate Std Stats: {'Max': np.float64(1.7587923047331475), 'Min': np.float64(0.0), 'Mean': np.float64(0.6123186694383419), 'Std': np.float64(0.27153342788425894)}
[I 2024-12-06 23:36:25,386] Trial 63 finished with value: 0.5 and parameters: {'x_0_0': 'bd', 'x_0_1': 'oo', 'x_1_0': 'bc', 'x_1_1': 'ad'}. Best is trial 63 with value: 0.5.
2024-12-06 23:36:25,395 - INFO - Candidate Mean Stats: {'Max': np.float64(2.1503582859114494), 'Min': np.float64(-1.0843839208783967), 'Mean': np.float64(0.2976689109000502), 'Std': np.float64(0.5081352060631829)}
2024-12-06 23:36:25,395 - INFO - Candidate Std Stats: {'Max': np.float64(1.5153965889099092), 'Min': np.float64(0.0), 'Mean': np.float64(0.6185404281447525), 'Std': np.float64(0.26309850881849445)}
2024-12-06 23:36:25,403 - INFO - Candidate Mean Stats: {'Max': np.float64(2.2185420285216164), 'Min': np.float64(-1.0686541806262992), 'Mean': np.float64(0.22001667528583146), 'Std': np.float64(0.47975508432072755)}
2024-12-06 23:36:25,403 - INFO - Candidate Std Stats: {'Max': np.float64(1.9826235184356944), 'Min': np.float64(0.0), 'Mean': np.float64(0.6645615789671792), 'Std': np.float64(0.30781571925003137)}
[I 2024-12-06 23:36:25,408] Trial 63 finished with value: 0.9464285714285714 and parameters: {'x_0_0': 'ac', 'x_0_1': 'oo', 'x_1_0': 'cd', 'x_1_1': 'oo'}. Best is trial 33 with value: 0.6964285714285714.
[I 2024-12-06 23:36:25,416] Trial 63 finished with value: 1.5714285714285714 and parameters: {'x_0_0': 'ac', 'x_0_1': 'cd', 'x_1_0': 'ac', 'x_1_1': 'bd'}. Best is trial 50 with value: 0.6607142857142857.
2024-12-06 23:36:25,582 - INFO - Candidate Mean Stats: {'Max': np.float64(2.0), 'Min': np.float64(-1.120041904511883), 'Mean': np.float64(0.26430797331325157), 'Std': np.float64(0.44144665868834093)}
2024-12-06 23:36:25,582 - INFO - Candidate Std Stats: {'Max': np.float64(1.7018463435379636), 'Min': np.float64(0.0), 'Mean': np.float64(0.5628182326211315), 'Std': np.float64(0.24343291853810256)}
[I 2024-12-06 23:36:25,595] Trial 63 finished with value: 0.8214285714285714 and parameters: {'x_0_0': 'ac', 'x_0_1': 'oo', 'x_1_0': 'oo', 'x_1_1': 'ac'}. Best is trial 23 with value: 0.5.
2024-12-06 23:36:25,699 - INFO - Candidate Mean Stats: {'Max': np.float64(2.0), 'Min': np.float64(-1.3313959974908776), 'Mean': np.float64(0.20841100461654374), 'Std': np.float64(0.47701009951876416)}
2024-12-06 23:36:25,699 - INFO - Candidate Std Stats: {'Max': np.float64(1.6520213324218616), 'Min': np.float64(0.0), 'Mean': np.float64(0.6546970184100248), 'Std': np.float64(0.279031640811091)}
[I 2024-12-06 23:36:25,712] Trial 64 finished with value: 0.7857142857142857 and parameters: {'x_0_0': 'bd', 'x_0_1': 'oo', 'x_1_0': 'bc', 'x_1_1': 'bc'}. Best is trial 63 with value: 0.5.
2024-12-06 23:36:25,723 - INFO - Candidate Mean Stats: {'Max': np.float64(2.0), 'Min': np.float64(-1.1280428775157432), 'Mean': np.float64(0.27338338946833074), 'Std': np.float64(0.46396924639936193)}
2024-12-06 23:36:25,723 - INFO - Candidate Std Stats: {'Max': np.float64(1.664135832853762), 'Min': np.float64(0.0), 'Mean': np.float64(0.6691464728061689), 'Std': np.float64(0.27343931376097547)}
2024-12-06 23:36:25,730 - INFO - Candidate Mean Stats: {'Max': np.float64(2.051857637936486), 'Min': np.float64(-0.8468239063221883), 'Mean': np.float64(0.2998454218426789), 'Std': np.float64(0.46765332580350266)}
2024-12-06 23:36:25,730 - INFO - Candidate Std Stats: {'Max': np.float64(1.6294055511328625), 'Min': np.float64(0.0), 'Mean': np.float64(0.5690917265247687), 'Std': np.float64(0.23964892535267213)}
[I 2024-12-06 23:36:25,736] Trial 64 finished with value: 0.8214285714285714 and parameters: {'x_0_0': 'bd', 'x_0_1': 'oo', 'x_1_0': 'oo', 'x_1_1': 'ac'}. Best is trial 33 with value: 0.6964285714285714.
[I 2024-12-06 23:36:25,742] Trial 64 finished with value: 0.7857142857142857 and parameters: {'x_0_0': 'ad', 'x_0_1': 'oo', 'x_1_0': 'bd', 'x_1_1': 'ab'}. Best is trial 50 with value: 0.6607142857142857.
2024-12-06 23:36:25,909 - INFO - Candidate Mean Stats: {'Max': np.float64(2.0), 'Min': np.float64(-0.6624790833940299), 'Mean': np.float64(0.3212366274807282), 'Std': np.float64(0.3707360064203148)}
2024-12-06 23:36:25,909 - INFO - Candidate Std Stats: {'Max': np.float64(1.5267036912284389), 'Min': np.float64(0.0), 'Mean': np.float64(0.49260555445548104), 'Std': np.float64(0.22613695806942813)}
[I 2024-12-06 23:36:25,921] Trial 64 finished with value: 0.5 and parameters: {'x_0_0': 'ad', 'x_0_1': 'oo', 'x_1_0': 'bc', 'x_1_1': 'ac'}. Best is trial 23 with value: 0.5.
2024-12-06 23:36:26,023 - INFO - Candidate Mean Stats: {'Max': np.float64(2.0), 'Min': np.float64(-1.3205618013971478), 'Mean': np.float64(0.20984867128559198), 'Std': np.float64(0.47815778647885265)}
2024-12-06 23:36:26,023 - INFO - Candidate Std Stats: {'Max': np.float64(1.5945425871449515), 'Min': np.float64(0.0), 'Mean': np.float64(0.581680532032166), 'Std': np.float64(0.2562375581918996)}
[I 2024-12-06 23:36:26,035] Trial 65 finished with value: 0.5 and parameters: {'x_0_0': 'ad', 'x_0_1': 'oo', 'x_1_0': 'bc', 'x_1_1': 'ac'}. Best is trial 63 with value: 0.5.
2024-12-06 23:36:26,048 - INFO - Candidate Mean Stats: {'Max': np.float64(2.324764269220209), 'Min': np.float64(-1.0042243622153018), 'Mean': np.float64(0.27428856545321345), 'Std': np.float64(0.4909619245616201)}
2024-12-06 23:36:26,048 - INFO - Candidate Std Stats: {'Max': np.float64(1.6132063804745926), 'Min': np.float64(0.0), 'Mean': np.float64(0.5585528689667382), 'Std': np.float64(0.24152741139252298)}
2024-12-06 23:36:26,053 - INFO - Candidate Mean Stats: {'Max': np.float64(2.0), 'Min': np.float64(-1.1618267057859093), 'Mean': np.float64(0.29495457410304904), 'Std': np.float64(0.45436240347911233)}
2024-12-06 23:36:26,053 - INFO - Candidate Std Stats: {'Max': np.float64(1.5458723587721768), 'Min': np.float64(0.0), 'Mean': np.float64(0.5796704018596959), 'Std': np.float64(0.24619070088744485)}
[I 2024-12-06 23:36:26,060] Trial 65 finished with value: 0.8214285714285714 and parameters: {'x_0_0': 'bc', 'x_0_1': 'oo', 'x_1_0': 'oo', 'x_1_1': 'bd'}. Best is trial 33 with value: 0.6964285714285714.
[I 2024-12-06 23:36:26,065] Trial 65 finished with value: 1.4285714285714286 and parameters: {'x_0_0': 'bc', 'x_0_1': 'ab', 'x_1_0': 'ad', 'x_1_1': 'ad'}. Best is trial 50 with value: 0.6607142857142857.
2024-12-06 23:36:26,231 - INFO - Candidate Mean Stats: {'Max': np.float64(2.0), 'Min': np.float64(-1.2478305899492266), 'Mean': np.float64(0.2968294180775221), 'Std': np.float64(0.4166420132859851)}
2024-12-06 23:36:26,232 - INFO - Candidate Std Stats: {'Max': np.float64(1.8838409128570721), 'Min': np.float64(0.0), 'Mean': np.float64(0.5874972633262636), 'Std': np.float64(0.27118274972756196)}
[I 2024-12-06 23:36:26,243] Trial 65 finished with value: 1.0714285714285714 and parameters: {'x_0_0': 'ac', 'x_0_1': 'oo', 'x_1_0': 'ab', 'x_1_1': 'bc'}. Best is trial 23 with value: 0.5.
2024-12-06 23:36:26,345 - INFO - Candidate Mean Stats: {'Max': np.float64(2.0), 'Min': np.float64(-0.8789448815582368), 'Mean': np.float64(0.240585436186392), 'Std': np.float64(0.45343748376656384)}
2024-12-06 23:36:26,345 - INFO - Candidate Std Stats: {'Max': np.float64(1.3682775142303343), 'Min': np.float64(0.0), 'Mean': np.float64(0.5635865708234219), 'Std': np.float64(0.23192160956039043)}
[I 2024-12-06 23:36:26,358] Trial 66 finished with value: 1.0 and parameters: {'x_0_0': 'ad', 'x_0_1': 'cd', 'x_1_0': 'bc', 'x_1_1': 'ac'}. Best is trial 63 with value: 0.5.
2024-12-06 23:36:26,372 - INFO - Candidate Mean Stats: {'Max': np.float64(2.0), 'Min': np.float64(-0.8349900957859365), 'Mean': np.float64(0.35453224054459337), 'Std': np.float64(0.4371598190244429)}
2024-12-06 23:36:26,372 - INFO - Candidate Std Stats: {'Max': np.float64(1.5905653136697522), 'Min': np.float64(0.0), 'Mean': np.float64(0.5761633709914401), 'Std': np.float64(0.24445332436577608)}
2024-12-06 23:36:26,378 - INFO - Candidate Mean Stats: {'Max': np.float64(2.0), 'Min': np.float64(-1.0605358918437895), 'Mean': np.float64(0.26662348967807775), 'Std': np.float64(0.43699421117603543)}
2024-12-06 23:36:26,378 - INFO - Candidate Std Stats: {'Max': np.float64(1.5813786776970356), 'Min': np.float64(0.0), 'Mean': np.float64(0.5931637021619164), 'Std': np.float64(0.2519325983255479)}
[I 2024-12-06 23:36:26,385] Trial 66 finished with value: 1.0714285714285714 and parameters: {'x_0_0': 'bc', 'x_0_1': 'oo', 'x_1_0': 'ad', 'x_1_1': 'ac'}. Best is trial 33 with value: 0.6964285714285714.
[I 2024-12-06 23:36:26,390] Trial 66 finished with value: 0.9464285714285714 and parameters: {'x_0_0': 'ac', 'x_0_1': 'oo', 'x_1_0': 'bd', 'x_1_1': 'oo'}. Best is trial 50 with value: 0.6607142857142857.
2024-12-06 23:36:26,557 - INFO - Candidate Mean Stats: {'Max': np.float64(2.0), 'Min': np.float64(-0.9377901803801828), 'Mean': np.float64(0.33872665231898924), 'Std': np.float64(0.4244940218148906)}
2024-12-06 23:36:26,557 - INFO - Candidate Std Stats: {'Max': np.float64(1.7061466682699293), 'Min': np.float64(0.0), 'Mean': np.float64(0.5548097677355216), 'Std': np.float64(0.2557435914829302)}
[I 2024-12-06 23:36:26,570] Trial 66 finished with value: 0.9285714285714286 and parameters: {'x_0_0': 'ad', 'x_0_1': 'oo', 'x_1_0': 'ab', 'x_1_1': 'cd'}. Best is trial 23 with value: 0.5.
2024-12-06 23:36:26,669 - INFO - Candidate Mean Stats: {'Max': np.float64(2.0), 'Min': np.float64(-0.8700136928779217), 'Mean': np.float64(0.21643693844223447), 'Std': np.float64(0.4309286818990879)}
2024-12-06 23:36:26,669 - INFO - Candidate Std Stats: {'Max': np.float64(1.584896457589167), 'Min': np.float64(0.0), 'Mean': np.float64(0.5928276062803514), 'Std': np.float64(0.25355232538599093)}
[I 2024-12-06 23:36:26,681] Trial 67 finished with value: 0.9464285714285714 and parameters: {'x_0_0': 'bd', 'x_0_1': 'oo', 'x_1_0': 'cd', 'x_1_1': 'oo'}. Best is trial 63 with value: 0.5.
2024-12-06 23:36:26,697 - INFO - Candidate Mean Stats: {'Max': np.float64(2.0362252690773586), 'Min': np.float64(-1.2283357165106794), 'Mean': np.float64(0.2687806580480341), 'Std': np.float64(0.49924103713923107)}
2024-12-06 23:36:26,697 - INFO - Candidate Std Stats: {'Max': np.float64(1.4831893927059978), 'Min': np.float64(0.0), 'Mean': np.float64(0.6105982807393603), 'Std': np.float64(0.2577452742569743)}
2024-12-06 23:36:26,702 - INFO - Candidate Mean Stats: {'Max': np.float64(2.0), 'Min': np.float64(-0.8978700384681304), 'Mean': np.float64(0.3071982091810805), 'Std': np.float64(0.43942318141871883)}
2024-12-06 23:36:26,702 - INFO - Candidate Std Stats: {'Max': np.float64(1.5917358032982896), 'Min': np.float64(0.0), 'Mean': np.float64(0.5632601493808954), 'Std': np.float64(0.2385147663403878)}
[I 2024-12-06 23:36:26,710] Trial 67 finished with value: 1.5714285714285714 and parameters: {'x_0_0': 'ad', 'x_0_1': 'ac', 'x_1_0': 'cd', 'x_1_1': 'bc'}. Best is trial 33 with value: 0.6964285714285714.
[I 2024-12-06 23:36:26,714] Trial 67 finished with value: 1.0714285714285714 and parameters: {'x_0_0': 'ad', 'x_0_1': 'oo', 'x_1_0': 'ad', 'x_1_1': 'ac'}. Best is trial 50 with value: 0.6607142857142857.
2024-12-06 23:36:26,885 - INFO - Candidate Mean Stats: {'Max': np.float64(2.0), 'Min': np.float64(-1.0128207952413095), 'Mean': np.float64(0.3123289158878309), 'Std': np.float64(0.4442417234953398)}
2024-12-06 23:36:26,885 - INFO - Candidate Std Stats: {'Max': np.float64(1.6064169502069978), 'Min': np.float64(0.0), 'Mean': np.float64(0.5793421015770708), 'Std': np.float64(0.2561194646427664)}
[I 2024-12-06 23:36:26,897] Trial 67 finished with value: 1.0714285714285714 and parameters: {'x_0_0': 'ac', 'x_0_1': 'oo', 'x_1_0': 'bd', 'x_1_1': 'ac'}. Best is trial 23 with value: 0.5.
2024-12-06 23:36:26,990 - INFO - Candidate Mean Stats: {'Max': np.float64(2.0), 'Min': np.float64(-0.8876632131823714), 'Mean': np.float64(0.2773920212896634), 'Std': np.float64(0.412521376057241)}
2024-12-06 23:36:26,990 - INFO - Candidate Std Stats: {'Max': np.float64(1.4884298079339624), 'Min': np.float64(0.0), 'Mean': np.float64(0.5538063773203388), 'Std': np.float64(0.23736971214950078)}
[I 2024-12-06 23:36:27,003] Trial 68 finished with value: 1.0714285714285714 and parameters: {'x_0_0': 'bc', 'x_0_1': 'oo', 'x_1_0': 'bc', 'x_1_1': 'ad'}. Best is trial 63 with value: 0.5.
2024-12-06 23:36:27,020 - INFO - Candidate Mean Stats: {'Max': np.float64(2.0603373287136324), 'Min': np.float64(-1.041230423091553), 'Mean': np.float64(0.30909555163054), 'Std': np.float64(0.47083165870574134)}
2024-12-06 23:36:27,021 - INFO - Candidate Std Stats: {'Max': np.float64(1.5064769700690979), 'Min': np.float64(0.0), 'Mean': np.float64(0.5505399867254699), 'Std': np.float64(0.23795065705254365)}
2024-12-06 23:36:27,026 - INFO - Candidate Mean Stats: {'Max': np.float64(2.218746616110023), 'Min': np.float64(-0.8141369732317021), 'Mean': np.float64(0.28616471554808487), 'Std': np.float64(0.43661185339149944)}
2024-12-06 23:36:27,026 - INFO - Candidate Std Stats: {'Max': np.float64(1.6748082351320752), 'Min': np.float64(0.0), 'Mean': np.float64(0.5813665291106145), 'Std': np.float64(0.24565413063593797)}
[I 2024-12-06 23:36:27,033] Trial 68 finished with value: 0.6607142857142857 and parameters: {'x_0_0': 'ad', 'x_0_1': 'oo', 'x_1_0': 'bc', 'x_1_1': 'oo'}. Best is trial 68 with value: 0.6607142857142857.
[I 2024-12-06 23:36:27,039] Trial 68 finished with value: 1.0714285714285714 and parameters: {'x_0_0': 'bc', 'x_0_1': 'oo', 'x_1_0': 'ad', 'x_1_1': 'ac'}. Best is trial 50 with value: 0.6607142857142857.
2024-12-06 23:36:27,207 - INFO - Candidate Mean Stats: {'Max': np.float64(2.0), 'Min': np.float64(-1.0463061638826323), 'Mean': np.float64(0.25524535373722024), 'Std': np.float64(0.4220626848783935)}
2024-12-06 23:36:27,207 - INFO - Candidate Std Stats: {'Max': np.float64(1.7401194590632079), 'Min': np.float64(0.0), 'Mean': np.float64(0.527709426377646), 'Std': np.float64(0.22899126772539147)}
[I 2024-12-06 23:36:27,219] Trial 68 finished with value: 1.0714285714285714 and parameters: {'x_0_0': 'ad', 'x_0_1': 'oo', 'x_1_0': 'ad', 'x_1_1': 'ac'}. Best is trial 23 with value: 0.5.
2024-12-06 23:36:27,312 - INFO - Candidate Mean Stats: {'Max': np.float64(2.0), 'Min': np.float64(-1.0192288676161705), 'Mean': np.float64(0.25274206893178247), 'Std': np.float64(0.4539161739665319)}
2024-12-06 23:36:27,312 - INFO - Candidate Std Stats: {'Max': np.float64(1.4522228728060869), 'Min': np.float64(0.0), 'Mean': np.float64(0.5943492441463771), 'Std': np.float64(0.24946750550522057)}
[I 2024-12-06 23:36:27,324] Trial 69 finished with value: 0.5 and parameters: {'x_0_0': 'bd', 'x_0_1': 'oo', 'x_1_0': 'bc', 'x_1_1': 'ac'}. Best is trial 63 with value: 0.5.
2024-12-06 23:36:27,343 - INFO - Candidate Mean Stats: {'Max': np.float64(2.0), 'Min': np.float64(-0.8986839386982488), 'Mean': np.float64(0.37684184200007276), 'Std': np.float64(0.4368575007396215)}
2024-12-06 23:36:27,343 - INFO - Candidate Std Stats: {'Max': np.float64(1.5640621048066923), 'Min': np.float64(0.0), 'Mean': np.float64(0.493797568264865), 'Std': np.float64(0.23501699116191485)}
2024-12-06 23:36:27,349 - INFO - Candidate Mean Stats: {'Max': np.float64(2.0), 'Min': np.float64(-0.828402728172706), 'Mean': np.float64(0.3017929309470118), 'Std': np.float64(0.4589910466492958)}
2024-12-06 23:36:27,349 - INFO - Candidate Std Stats: {'Max': np.float64(1.552923769790623), 'Min': np.float64(0.0), 'Mean': np.float64(0.5508824501675899), 'Std': np.float64(0.2353872560623904)}
[I 2024-12-06 23:36:27,355] Trial 69 finished with value: 1.625 and parameters: {'x_0_0': 'oo', 'x_0_1': 'cd', 'x_1_0': 'oo', 'x_1_1': 'bd'}. Best is trial 68 with value: 0.6607142857142857.
[I 2024-12-06 23:36:27,362] Trial 69 finished with value: 1.0714285714285714 and parameters: {'x_0_0': 'bc', 'x_0_1': 'oo', 'x_1_0': 'bd', 'x_1_1': 'cd'}. Best is trial 50 with value: 0.6607142857142857.
2024-12-06 23:36:27,535 - INFO - Candidate Mean Stats: {'Max': np.float64(2.0106935927748384), 'Min': np.float64(-0.8271282771104433), 'Mean': np.float64(0.30185576222514415), 'Std': np.float64(0.4224898552410524)}
2024-12-06 23:36:27,536 - INFO - Candidate Std Stats: {'Max': np.float64(1.3443843257853791), 'Min': np.float64(0.0), 'Mean': np.float64(0.5074140567223077), 'Std': np.float64(0.2148649469096354)}
[I 2024-12-06 23:36:27,548] Trial 69 finished with value: 1.0714285714285714 and parameters: {'x_0_0': 'ac', 'x_0_1': 'oo', 'x_1_0': 'bc', 'x_1_1': 'cd'}. Best is trial 23 with value: 0.5.
2024-12-06 23:36:27,637 - INFO - Candidate Mean Stats: {'Max': np.float64(2.0), 'Min': np.float64(-1.048319632597401), 'Mean': np.float64(0.31893623219414713), 'Std': np.float64(0.42639237611788156)}
2024-12-06 23:36:27,637 - INFO - Candidate Std Stats: {'Max': np.float64(1.4653871921232937), 'Min': np.float64(0.0), 'Mean': np.float64(0.5145973550442733), 'Std': np.float64(0.23379475459578708)}
[I 2024-12-06 23:36:27,650] Trial 70 finished with value: 0.7857142857142857 and parameters: {'x_0_0': 'bd', 'x_0_1': 'oo', 'x_1_0': 'bc', 'x_1_1': 'cd'}. Best is trial 63 with value: 0.5.
2024-12-06 23:36:27,672 - INFO - Candidate Mean Stats: {'Max': np.float64(2.0), 'Min': np.float64(-1.1999820001396992), 'Mean': np.float64(0.3552773818902921), 'Std': np.float64(0.43961666412892275)}
2024-12-06 23:36:27,672 - INFO - Candidate Std Stats: {'Max': np.float64(1.5996130572575165), 'Min': np.float64(0.0), 'Mean': np.float64(0.5718691547384626), 'Std': np.float64(0.2597104633905726)}
2024-12-06 23:36:27,677 - INFO - Candidate Mean Stats: {'Max': np.float64(2.0524548693568634), 'Min': np.float64(-1.4171150306747118), 'Mean': np.float64(0.24349028957977764), 'Std': np.float64(0.524471368612483)}
2024-12-06 23:36:27,677 - INFO - Candidate Std Stats: {'Max': np.float64(1.7900209229648876), 'Min': np.float64(0.0), 'Mean': np.float64(0.6921593035667248), 'Std': np.float64(0.27623810450701924)}
[I 2024-12-06 23:36:27,685] Trial 70 finished with value: 0.8214285714285714 and parameters: {'x_0_0': 'bc', 'x_0_1': 'oo', 'x_1_0': 'oo', 'x_1_1': 'ac'}. Best is trial 68 with value: 0.6607142857142857.
