[I 2024-12-06 23:37:23,189] Trial 222 finished with value: 1.0714285714285714 and parameters: {'x_0_0': 'bc', 'x_0_1': 'oo', 'x_1_0': 'bd', 'x_1_1': 'ab'}. Best is trial 23 with value: 0.5.
2024-12-06 23:37:23,379 - INFO - Candidate Mean Stats: {'Max': np.float64(3.103056343784764), 'Min': np.float64(-1.056488577765395), 'Mean': np.float64(0.5486069624426563), 'Std': np.float64(0.5690076313802485)}
2024-12-06 23:37:23,379 - INFO - Candidate Std Stats: {'Max': np.float64(1.9299669701235502), 'Min': np.float64(0.0), 'Mean': np.float64(0.5914859796564865), 'Std': np.float64(0.3133361122772301)}
2024-12-06 23:37:23,385 - INFO - Candidate Mean Stats: {'Max': np.float64(3.4646630787436252), 'Min': np.float64(-1.142073109235033), 'Mean': np.float64(0.527361786046684), 'Std': np.float64(0.6250942230917191)}
2024-12-06 23:37:23,385 - INFO - Candidate Std Stats: {'Max': np.float64(1.5812874919493254), 'Min': np.float64(0.0), 'Mean': np.float64(0.5394971408134834), 'Std': np.float64(0.27905331078831946)}
[I 2024-12-06 23:37:23,393] Trial 224 finished with value: 1.875 and parameters: {'x_0_0': 'oo', 'x_0_1': 'ad', 'x_1_0': 'cd', 'x_1_1': 'bc'}. Best is trial 165 with value: 0.5.
2024-12-06 23:37:23,398 - INFO - Candidate Mean Stats: {'Max': np.float64(2.77181991661216), 'Min': np.float64(-0.8546624288631273), 'Mean': np.float64(0.4992433766099368), 'Std': np.float64(0.530637139886006)}
2024-12-06 23:37:23,398 - INFO - Candidate Std Stats: {'Max': np.float64(1.7394125601972779), 'Min': np.float64(0.0), 'Mean': np.float64(0.5879832911176459), 'Std': np.float64(0.300174435584032)}
[I 2024-12-06 23:37:23,399] Trial 224 finished with value: 1.0 and parameters: {'x_0_0': 'bc', 'x_0_1': 'ad', 'x_1_0': 'ad', 'x_1_1': 'bc'}. Best is trial 76 with value: 0.5.
[I 2024-12-06 23:37:23,411] Trial 224 finished with value: 1.0892857142857144 and parameters: {'x_0_0': 'ab', 'x_0_1': 'oo', 'x_1_0': 'ac', 'x_1_1': 'oo'}. Best is trial 63 with value: 0.5.
2024-12-06 23:37:23,541 - INFO - Candidate Mean Stats: {'Max': np.float64(3.2008509490852832), 'Min': np.float64(-1.0960886899169044), 'Mean': np.float64(0.4996339075842714), 'Std': np.float64(0.5656246202383857)}
2024-12-06 23:37:23,541 - INFO - Candidate Std Stats: {'Max': np.float64(1.620910479159617), 'Min': np.float64(0.0), 'Mean': np.float64(0.6146300299361874), 'Std': np.float64(0.3124145560634926)}
[I 2024-12-06 23:37:23,555] Trial 223 finished with value: 1.0714285714285714 and parameters: {'x_0_0': 'ac', 'x_0_1': 'oo', 'x_1_0': 'ad', 'x_1_1': 'cd'}. Best is trial 23 with value: 0.5.
2024-12-06 23:37:23,744 - INFO - Candidate Mean Stats: {'Max': np.float64(2.7344850698497067), 'Min': np.float64(-1.1069528695665962), 'Mean': np.float64(0.5599888511387784), 'Std': np.float64(0.5650877764834612)}
2024-12-06 23:37:23,744 - INFO - Candidate Std Stats: {'Max': np.float64(1.9790459688818758), 'Min': np.float64(0.0), 'Mean': np.float64(0.6067889158019646), 'Std': np.float64(0.32800338603790324)}
2024-12-06 23:37:23,756 - INFO - Candidate Mean Stats: {'Max': np.float64(3.204068917020367), 'Min': np.float64(-0.886620158278814), 'Mean': np.float64(0.47213156270675743), 'Std': np.float64(0.585441260938475)}
2024-12-06 23:37:23,757 - INFO - Candidate Std Stats: {'Max': np.float64(1.7605561239236416), 'Min': np.float64(0.0), 'Mean': np.float64(0.5771729335719707), 'Std': np.float64(0.29388653394930675)}
[I 2024-12-06 23:37:23,757] Trial 225 finished with value: 1.2142857142857144 and parameters: {'x_0_0': 'ab', 'x_0_1': 'oo', 'x_1_0': 'bd', 'x_1_1': 'bd'}. Best is trial 165 with value: 0.5.
2024-12-06 23:37:23,763 - INFO - Candidate Mean Stats: {'Max': np.float64(2.8942142553207226), 'Min': np.float64(-0.74446311257175), 'Mean': np.float64(0.5895182289967014), 'Std': np.float64(0.4508561978307888)}
2024-12-06 23:37:23,764 - INFO - Candidate Std Stats: {'Max': np.float64(1.8055338326492463), 'Min': np.float64(0.0), 'Mean': np.float64(0.46829462633961483), 'Std': np.float64(0.28721974477946804)}
[I 2024-12-06 23:37:23,770] Trial 225 finished with value: 1.5714285714285714 and parameters: {'x_0_0': 'bc', 'x_0_1': 'bd', 'x_1_0': 'ad', 'x_1_1': 'cd'}. Best is trial 76 with value: 0.5.
[I 2024-12-06 23:37:23,777] Trial 225 finished with value: 0.8214285714285714 and parameters: {'x_0_0': 'bc', 'x_0_1': 'oo', 'x_1_0': 'oo', 'x_1_1': 'ab'}. Best is trial 63 with value: 0.5.
2024-12-06 23:37:23,908 - INFO - Candidate Mean Stats: {'Max': np.float64(2.649293334172267), 'Min': np.float64(-1.1391759280754006), 'Mean': np.float64(0.4926400792123594), 'Std': np.float64(0.5775917472728089)}
2024-12-06 23:37:23,908 - INFO - Candidate Std Stats: {'Max': np.float64(1.57119881772724), 'Min': np.float64(0.0), 'Mean': np.float64(0.586460450543166), 'Std': np.float64(0.29648352429858793)}
[I 2024-12-06 23:37:23,922] Trial 224 finished with value: 1.3035714285714286 and parameters: {'x_0_0': 'ac', 'x_0_1': 'ab', 'x_1_0': 'bd', 'x_1_1': 'oo'}. Best is trial 23 with value: 0.5.
2024-12-06 23:37:24,107 - INFO - Candidate Mean Stats: {'Max': np.float64(2.940872084186786), 'Min': np.float64(-0.8684011854019594), 'Mean': np.float64(0.5486860318998004), 'Std': np.float64(0.5200312168470567)}
2024-12-06 23:37:24,107 - INFO - Candidate Std Stats: {'Max': np.float64(1.7983308166666905), 'Min': np.float64(0.0), 'Mean': np.float64(0.5491874570742299), 'Std': np.float64(0.2962335517351926)}
2024-12-06 23:37:24,119 - INFO - Candidate Mean Stats: {'Max': np.float64(3.3988743316158065), 'Min': np.float64(-0.9050501063558223), 'Mean': np.float64(0.5576543452737187), 'Std': np.float64(0.5614160539715685)}
2024-12-06 23:37:24,119 - INFO - Candidate Std Stats: {'Max': np.float64(1.466316451968393), 'Min': np.float64(0.0), 'Mean': np.float64(0.5755822009819763), 'Std': np.float64(0.29716156719291764)}
[I 2024-12-06 23:37:24,121] Trial 226 finished with value: 1.0714285714285714 and parameters: {'x_0_0': 'bc', 'x_0_1': 'oo', 'x_1_0': 'ac', 'x_1_1': 'ad'}. Best is trial 165 with value: 0.5.
2024-12-06 23:37:24,127 - INFO - Candidate Mean Stats: {'Max': np.float64(2.97011315345162), 'Min': np.float64(-0.8451343247193919), 'Mean': np.float64(0.5254438142275801), 'Std': np.float64(0.5247174828049589)}
2024-12-06 23:37:24,127 - INFO - Candidate Std Stats: {'Max': np.float64(1.5922919142317498), 'Min': np.float64(0.0), 'Mean': np.float64(0.5606231182967776), 'Std': np.float64(0.30803070914281644)}
[I 2024-12-06 23:37:24,133] Trial 226 finished with value: 1.5 and parameters: {'x_0_0': 'cd', 'x_0_1': 'oo', 'x_1_0': 'bc', 'x_1_1': 'bc'}. Best is trial 76 with value: 0.5.
[I 2024-12-06 23:37:24,140] Trial 226 finished with value: 1.0714285714285714 and parameters: {'x_0_0': 'ac', 'x_0_1': 'oo', 'x_1_0': 'bd', 'x_1_1': 'ac'}. Best is trial 63 with value: 0.5.
2024-12-06 23:37:24,295 - INFO - Candidate Mean Stats: {'Max': np.float64(3.155416654503579), 'Min': np.float64(-0.788975023664426), 'Mean': np.float64(0.5350168865736408), 'Std': np.float64(0.5228927789719818)}
2024-12-06 23:37:24,295 - INFO - Candidate Std Stats: {'Max': np.float64(1.650261563609746), 'Min': np.float64(0.0), 'Mean': np.float64(0.592906480414469), 'Std': np.float64(0.3056968268163881)}
[I 2024-12-06 23:37:24,309] Trial 225 finished with value: 1.25 and parameters: {'x_0_0': 'cd', 'x_0_1': 'oo', 'x_1_0': 'oo', 'x_1_1': 'ab'}. Best is trial 23 with value: 0.5.
2024-12-06 23:37:24,490 - INFO - Candidate Mean Stats: {'Max': np.float64(2.8339284823723707), 'Min': np.float64(-1.2050806294738423), 'Mean': np.float64(0.5438577430277466), 'Std': np.float64(0.561560841077241)}
2024-12-06 23:37:24,490 - INFO - Candidate Std Stats: {'Max': np.float64(1.564182157775823), 'Min': np.float64(0.0), 'Mean': np.float64(0.5704629503193266), 'Std': np.float64(0.29238906453267294)}
2024-12-06 23:37:24,499 - INFO - Candidate Mean Stats: {'Max': np.float64(3.010370767977368), 'Min': np.float64(-0.9109732595593718), 'Mean': np.float64(0.5005251633788576), 'Std': np.float64(0.5814635959168899)}
2024-12-06 23:37:24,500 - INFO - Candidate Std Stats: {'Max': np.float64(1.6175576417460744), 'Min': np.float64(0.0), 'Mean': np.float64(0.5895940029312987), 'Std': np.float64(0.3021284197014408)}
[I 2024-12-06 23:37:24,504] Trial 227 finished with value: 0.8214285714285714 and parameters: {'x_0_0': 'ac', 'x_0_1': 'oo', 'x_1_0': 'oo', 'x_1_1': 'cd'}. Best is trial 165 with value: 0.5.
2024-12-06 23:37:24,511 - INFO - Candidate Mean Stats: {'Max': np.float64(2.835959759055932), 'Min': np.float64(-1.1066338285834962), 'Mean': np.float64(0.5758904477415856), 'Std': np.float64(0.5106118408558274)}
2024-12-06 23:37:24,511 - INFO - Candidate Std Stats: {'Max': np.float64(1.6473936141853476), 'Min': np.float64(0.0), 'Mean': np.float64(0.5233472828449258), 'Std': np.float64(0.2821501532009764)}
[I 2024-12-06 23:37:24,513] Trial 227 finished with value: 1.4464285714285714 and parameters: {'x_0_0': 'bd', 'x_0_1': 'cd', 'x_1_0': 'ad', 'x_1_1': 'oo'}. Best is trial 76 with value: 0.5.
[I 2024-12-06 23:37:24,524] Trial 227 finished with value: 1.0714285714285714 and parameters: {'x_0_0': 'ad', 'x_0_1': 'oo', 'x_1_0': 'ac', 'x_1_1': 'ad'}. Best is trial 63 with value: 0.5.
2024-12-06 23:37:24,662 - INFO - Candidate Mean Stats: {'Max': np.float64(3.6097094800750336), 'Min': np.float64(-1.1224604988539895), 'Mean': np.float64(0.5698038098116238), 'Std': np.float64(0.5495082986046731)}
2024-12-06 23:37:24,662 - INFO - Candidate Std Stats: {'Max': np.float64(1.6842719539645175), 'Min': np.float64(0.0), 'Mean': np.float64(0.5966553646912198), 'Std': np.float64(0.31667429115576073)}
[I 2024-12-06 23:37:24,675] Trial 226 finished with value: 1.25 and parameters: {'x_0_0': 'cd', 'x_0_1': 'oo', 'x_1_0': 'oo', 'x_1_1': 'cd'}. Best is trial 23 with value: 0.5.
2024-12-06 23:37:24,854 - INFO - Candidate Mean Stats: {'Max': np.float64(2.6657562473040906), 'Min': np.float64(-1.3433580059556842), 'Mean': np.float64(0.42084662256162897), 'Std': np.float64(0.6416948602040964)}
2024-12-06 23:37:24,854 - INFO - Candidate Std Stats: {'Max': np.float64(1.685447607203742), 'Min': np.float64(0.0), 'Mean': np.float64(0.6450698366583504), 'Std': np.float64(0.33114131396154267)}
2024-12-06 23:37:24,865 - INFO - Candidate Mean Stats: {'Max': np.float64(2.8281750939457075), 'Min': np.float64(-1.3001096602818665), 'Mean': np.float64(0.447022370961124), 'Std': np.float64(0.6511003925101121)}
2024-12-06 23:37:24,865 - INFO - Candidate Std Stats: {'Max': np.float64(2.019826294619763), 'Min': np.float64(0.0), 'Mean': np.float64(0.655259744686907), 'Std': np.float64(0.3357266378136162)}
[I 2024-12-06 23:37:24,868] Trial 228 finished with value: 1.0714285714285714 and parameters: {'x_0_0': 'ac', 'x_0_1': 'oo', 'x_1_0': 'ad', 'x_1_1': 'ab'}. Best is trial 165 with value: 0.5.
2024-12-06 23:37:24,876 - INFO - Candidate Mean Stats: {'Max': np.float64(3.3025986753163843), 'Min': np.float64(-1.0124561500933797), 'Mean': np.float64(0.5716516023765617), 'Std': np.float64(0.5083479167790861)}
2024-12-06 23:37:24,876 - INFO - Candidate Std Stats: {'Max': np.float64(1.5424279149144868), 'Min': np.float64(0.0), 'Mean': np.float64(0.4991510171382147), 'Std': np.float64(0.27126278656486)}
[I 2024-12-06 23:37:24,879] Trial 228 finished with value: 1.4464285714285714 and parameters: {'x_0_0': 'bd', 'x_0_1': 'ac', 'x_1_0': 'ac', 'x_1_1': 'oo'}. Best is trial 76 with value: 0.5.
[I 2024-12-06 23:37:24,889] Trial 228 finished with value: 1.2142857142857144 and parameters: {'x_0_0': 'ab', 'x_0_1': 'oo', 'x_1_0': 'bd', 'x_1_1': 'bc'}. Best is trial 63 with value: 0.5.
2024-12-06 23:37:25,031 - INFO - Candidate Mean Stats: {'Max': np.float64(3.7476911336481153), 'Min': np.float64(-1.0388172101325495), 'Mean': np.float64(0.5823616012576054), 'Std': np.float64(0.547183871932083)}
2024-12-06 23:37:25,031 - INFO - Candidate Std Stats: {'Max': np.float64(1.5763525537936507), 'Min': np.float64(0.0), 'Mean': np.float64(0.5212337667585939), 'Std': np.float64(0.2672386854386214)}
[I 2024-12-06 23:37:25,045] Trial 227 finished with value: 1.0714285714285714 and parameters: {'x_0_0': 'bd', 'x_0_1': 'oo', 'x_1_0': 'cd', 'x_1_1': 'cd'}. Best is trial 23 with value: 0.5.
2024-12-06 23:37:25,221 - INFO - Candidate Mean Stats: {'Max': np.float64(3.0198568072164447), 'Min': np.float64(-0.837030588714207), 'Mean': np.float64(0.5404788722760774), 'Std': np.float64(0.5349816886876915)}
2024-12-06 23:37:25,221 - INFO - Candidate Std Stats: {'Max': np.float64(1.6074516468632034), 'Min': np.float64(0.0), 'Mean': np.float64(0.5589048866824199), 'Std': np.float64(0.29675002400768524)}
2024-12-06 23:37:25,232 - INFO - Candidate Mean Stats: {'Max': np.float64(2.766227615322731), 'Min': np.float64(-1.0199149475882952), 'Mean': np.float64(0.5261634900898854), 'Std': np.float64(0.5724057642382608)}
2024-12-06 23:37:25,232 - INFO - Candidate Std Stats: {'Max': np.float64(1.7910792886753535), 'Min': np.float64(0.0), 'Mean': np.float64(0.6616686348133258), 'Std': np.float64(0.3375876275081773)}
[I 2024-12-06 23:37:25,234] Trial 229 finished with value: 1.1607142857142856 and parameters: {'x_0_0': 'ac', 'x_0_1': 'ac', 'x_1_0': 'bd', 'x_1_1': 'oo'}. Best is trial 165 with value: 0.5.
2024-12-06 23:37:25,241 - INFO - Candidate Mean Stats: {'Max': np.float64(2.509015083374069), 'Min': np.float64(-0.900203350412788), 'Mean': np.float64(0.5544834497098255), 'Std': np.float64(0.5292194087987248)}
2024-12-06 23:37:25,241 - INFO - Candidate Std Stats: {'Max': np.float64(1.5928218596024573), 'Min': np.float64(0.0), 'Mean': np.float64(0.5524290591509671), 'Std': np.float64(0.285389342171468)}
[I 2024-12-06 23:37:25,245] Trial 229 finished with value: 1.0714285714285714 and parameters: {'x_0_0': 'ac', 'x_0_1': 'oo', 'x_1_0': 'cd', 'x_1_1': 'bd'}. Best is trial 76 with value: 0.5.
[I 2024-12-06 23:37:25,255] Trial 229 finished with value: 1.0714285714285714 and parameters: {'x_0_0': 'ac', 'x_0_1': 'oo', 'x_1_0': 'bd', 'x_1_1': 'bc'}. Best is trial 63 with value: 0.5.
2024-12-06 23:37:25,398 - INFO - Candidate Mean Stats: {'Max': np.float64(2.5649300286439525), 'Min': np.float64(-0.7698831954335545), 'Mean': np.float64(0.5970617372313467), 'Std': np.float64(0.49605788171324944)}
2024-12-06 23:37:25,398 - INFO - Candidate Std Stats: {'Max': np.float64(1.6050986891050343), 'Min': np.float64(0.0), 'Mean': np.float64(0.5359104760506491), 'Std': np.float64(0.28263026579931194)}
[I 2024-12-06 23:37:25,412] Trial 228 finished with value: 1.0714285714285714 and parameters: {'x_0_0': 'bd', 'x_0_1': 'oo', 'x_1_0': 'ad', 'x_1_1': 'ad'}. Best is trial 23 with value: 0.5.
2024-12-06 23:37:25,587 - INFO - Candidate Mean Stats: {'Max': np.float64(2.644560387062229), 'Min': np.float64(-0.923539246112138), 'Mean': np.float64(0.5829606895286179), 'Std': np.float64(0.5593840832570439)}
2024-12-06 23:37:25,587 - INFO - Candidate Std Stats: {'Max': np.float64(1.4407359781788431), 'Min': np.float64(0.0), 'Mean': np.float64(0.5734102154388412), 'Std': np.float64(0.28010184338771676)}
2024-12-06 23:37:25,599 - INFO - Candidate Mean Stats: {'Max': np.float64(2.808033375239471), 'Min': np.float64(-0.8372765047092713), 'Mean': np.float64(0.5503278769912756), 'Std': np.float64(0.5452276277728454)}
2024-12-06 23:37:25,599 - INFO - Candidate Std Stats: {'Max': np.float64(1.686318305158353), 'Min': np.float64(0.0), 'Mean': np.float64(0.5978434488655522), 'Std': np.float64(0.3184029952629743)}
[I 2024-12-06 23:37:25,601] Trial 230 finished with value: 1.3214285714285714 and parameters: {'x_0_0': 'ad', 'x_0_1': 'bc', 'x_1_0': 'oo', 'x_1_1': 'ad'}. Best is trial 165 with value: 0.5.
2024-12-06 23:37:25,608 - INFO - Candidate Mean Stats: {'Max': np.float64(2.628267960054539), 'Min': np.float64(-1.237882779328301), 'Mean': np.float64(0.4594034597575666), 'Std': np.float64(0.6084191461916834)}
2024-12-06 23:37:25,608 - INFO - Candidate Std Stats: {'Max': np.float64(2.1028314420515257), 'Min': np.float64(0.0), 'Mean': np.float64(0.5772987239980004), 'Std': np.float64(0.3173910015855546)}
[I 2024-12-06 23:37:25,613] Trial 230 finished with value: 1.75 and parameters: {'x_0_0': 'cd', 'x_0_1': 'ac', 'x_1_0': 'oo', 'x_1_1': 'ad'}. Best is trial 76 with value: 0.5.
[I 2024-12-06 23:37:25,622] Trial 230 finished with value: 1.2857142857142856 and parameters: {'x_0_0': 'bc', 'x_0_1': 'ad', 'x_1_0': 'ad', 'x_1_1': 'ad'}. Best is trial 63 with value: 0.5.
2024-12-06 23:37:25,767 - INFO - Candidate Mean Stats: {'Max': np.float64(3.040550174267029), 'Min': np.float64(-1.0660216430851184), 'Mean': np.float64(0.5550393925478843), 'Std': np.float64(0.5556719249708983)}
2024-12-06 23:37:25,767 - INFO - Candidate Std Stats: {'Max': np.float64(1.891916419840514), 'Min': np.float64(0.0), 'Mean': np.float64(0.6244764313323155), 'Std': np.float64(0.32709496653291625)}
[I 2024-12-06 23:37:25,781] Trial 229 finished with value: 0.9285714285714286 and parameters: {'x_0_0': 'ad', 'x_0_1': 'oo', 'x_1_0': 'ab', 'x_1_1': 'ad'}. Best is trial 23 with value: 0.5.
2024-12-06 23:37:25,954 - INFO - Candidate Mean Stats: {'Max': np.float64(2.804864508135597), 'Min': np.float64(-1.1196704560972064), 'Mean': np.float64(0.5115127730647184), 'Std': np.float64(0.5931550159272492)}
2024-12-06 23:37:25,954 - INFO - Candidate Std Stats: {'Max': np.float64(1.685923130488477), 'Min': np.float64(0.0), 'Mean': np.float64(0.5804500235445499), 'Std': np.float64(0.306265685424794)}
2024-12-06 23:37:25,966 - INFO - Candidate Mean Stats: {'Max': np.float64(3.3302438209114604), 'Min': np.float64(-0.8980326114682253), 'Mean': np.float64(0.5602700742300809), 'Std': np.float64(0.5475067053825096)}
2024-12-06 23:37:25,966 - INFO - Candidate Std Stats: {'Max': np.float64(1.5688771688281735), 'Min': np.float64(0.0), 'Mean': np.float64(0.5855633577367638), 'Std': np.float64(0.3025033890055479)}
[I 2024-12-06 23:37:25,968] Trial 231 finished with value: 1.2857142857142856 and parameters: {'x_0_0': 'bc', 'x_0_1': 'ac', 'x_1_0': 'bd', 'x_1_1': 'bd'}. Best is trial 165 with value: 0.5.
2024-12-06 23:37:25,976 - INFO - Candidate Mean Stats: {'Max': np.float64(2.953738254565333), 'Min': np.float64(-1.1667646857502278), 'Mean': np.float64(0.5004097496437353), 'Std': np.float64(0.5371899353835242)}
2024-12-06 23:37:25,976 - INFO - Candidate Std Stats: {'Max': np.float64(1.673237127039829), 'Min': np.float64(0.0), 'Mean': np.float64(0.5996484969573066), 'Std': np.float64(0.316295728881729)}
[I 2024-12-06 23:37:25,979] Trial 231 finished with value: 0.9285714285714286 and parameters: {'x_0_0': 'ad', 'x_0_1': 'oo', 'x_1_0': 'ab', 'x_1_1': 'bd'}. Best is trial 76 with value: 0.5.
[I 2024-12-06 23:37:25,989] Trial 231 finished with value: 1.0714285714285714 and parameters: {'x_0_0': 'bc', 'x_0_1': 'oo', 'x_1_0': 'bc', 'x_1_1': 'bd'}. Best is trial 63 with value: 0.5.
2024-12-06 23:37:26,134 - INFO - Candidate Mean Stats: {'Max': np.float64(3.101239355316424), 'Min': np.float64(-0.7598527865691246), 'Mean': np.float64(0.6095301215960494), 'Std': np.float64(0.5041993268193855)}
2024-12-06 23:37:26,134 - INFO - Candidate Std Stats: {'Max': np.float64(1.8047161471313589), 'Min': np.float64(0.0), 'Mean': np.float64(0.5263825784313007), 'Std': np.float64(0.28350765101867903)}
[I 2024-12-06 23:37:26,148] Trial 230 finished with value: 1.2142857142857144 and parameters: {'x_0_0': 'ab', 'x_0_1': 'oo', 'x_1_0': 'ad', 'x_1_1': 'bc'}. Best is trial 23 with value: 0.5.
2024-12-06 23:37:26,319 - INFO - Candidate Mean Stats: {'Max': np.float64(2.5230566896403532), 'Min': np.float64(-1.405968476458302), 'Mean': np.float64(0.455076091664314), 'Std': np.float64(0.6400513066712862)}
2024-12-06 23:37:26,319 - INFO - Candidate Std Stats: {'Max': np.float64(1.9114664625688147), 'Min': np.float64(0.0), 'Mean': np.float64(0.6737638535753104), 'Std': np.float64(0.34575048191148094)}
2024-12-06 23:37:26,330 - INFO - Candidate Mean Stats: {'Max': np.float64(3.045404708614905), 'Min': np.float64(-1.3040707056137966), 'Mean': np.float64(0.49669348520123535), 'Std': np.float64(0.6451938551690473)}
2024-12-06 23:37:26,330 - INFO - Candidate Std Stats: {'Max': np.float64(1.9173854600522158), 'Min': np.float64(0.0), 'Mean': np.float64(0.6116911181659824), 'Std': np.float64(0.33117678898587144)}
[I 2024-12-06 23:37:26,333] Trial 232 finished with value: 1.0714285714285714 and parameters: {'x_0_0': 'ad', 'x_0_1': 'oo', 'x_1_0': 'cd', 'x_1_1': 'ad'}. Best is trial 165 with value: 0.5.
2024-12-06 23:37:26,343 - INFO - Candidate Mean Stats: {'Max': np.float64(2.94646934817652), 'Min': np.float64(-0.8238128964633038), 'Mean': np.float64(0.565110478541774), 'Std': np.float64(0.5480849539747663)}
2024-12-06 23:37:26,343 - INFO - Candidate Std Stats: {'Max': np.float64(1.5695024571421823), 'Min': np.float64(0.0), 'Mean': np.float64(0.5514499406302832), 'Std': np.float64(0.28492359265936207)}
[I 2024-12-06 23:37:26,343] Trial 232 finished with value: 1.0714285714285714 and parameters: {'x_0_0': 'ad', 'x_0_1': 'oo', 'x_1_0': 'ac', 'x_1_1': 'bd'}. Best is trial 76 with value: 0.5.
[I 2024-12-06 23:37:26,357] Trial 232 finished with value: 1.0714285714285714 and parameters: {'x_0_0': 'ac', 'x_0_1': 'oo', 'x_1_0': 'bd', 'x_1_1': 'bd'}. Best is trial 63 with value: 0.5.
2024-12-06 23:37:26,501 - INFO - Candidate Mean Stats: {'Max': np.float64(3.0207238493830713), 'Min': np.float64(-1.1765716715415473), 'Mean': np.float64(0.4735688300912012), 'Std': np.float64(0.633193663259869)}
2024-12-06 23:37:26,501 - INFO - Candidate Std Stats: {'Max': np.float64(1.7164944077391995), 'Min': np.float64(0.0), 'Mean': np.float64(0.5941052246461633), 'Std': np.float64(0.32114539667914926)}
