[I 2024-12-06 23:36:08,674] Trial 16 finished with value: 1.7142857142857144 and parameters: {'x_0_0': 'ab', 'x_0_1': 'ab', 'x_1_0': 'bd', 'x_1_1': 'bd'}. Best is trial 15 with value: 0.7857142857142857.
2024-12-06 23:36:08,709 - INFO - Candidate Mean Stats: {'Max': np.float64(1.875), 'Min': np.float64(-1.1121104626242153), 'Mean': np.float64(0.1369986687636567), 'Std': np.float64(0.37775114762429735)}
2024-12-06 23:36:08,710 - INFO - Candidate Std Stats: {'Max': np.float64(1.7577200358022782), 'Min': np.float64(0.0), 'Mean': np.float64(0.671331453599796), 'Std': np.float64(0.26023087706675757)}
[I 2024-12-06 23:36:08,727] Trial 16 finished with value: 0.7857142857142857 and parameters: {'x_0_0': 'bd', 'x_0_1': 'oo', 'x_1_0': 'bc', 'x_1_1': 'cd'}. Best is trial 7 with value: 0.6607142857142857.
2024-12-06 23:36:09,022 - INFO - Candidate Mean Stats: {'Max': np.float64(2.0), 'Min': np.float64(-0.8445911251825088), 'Mean': np.float64(0.12047948870894581), 'Std': np.float64(0.37843904728856337)}
2024-12-06 23:36:09,022 - INFO - Candidate Std Stats: {'Max': np.float64(2.047913599044868), 'Min': np.float64(0.0), 'Mean': np.float64(0.7764635691295718), 'Std': np.float64(0.29933617006797486)}
[I 2024-12-06 23:36:09,037] Trial 17 finished with value: 1.2857142857142856 and parameters: {'x_0_0': 'bd', 'x_0_1': 'bc', 'x_1_0': 'bd', 'x_1_1': 'cd'}. Best is trial 14 with value: 0.6428571428571428.
2024-12-06 23:36:09,065 - INFO - Candidate Mean Stats: {'Max': np.float64(2.0), 'Min': np.float64(-1.1063908568833722), 'Mean': np.float64(0.10107910369778324), 'Std': np.float64(0.4304305419704953)}
2024-12-06 23:36:09,065 - INFO - Candidate Std Stats: {'Max': np.float64(1.8832174162803519), 'Min': np.float64(0.0), 'Mean': np.float64(0.7322849434682942), 'Std': np.float64(0.27866563259088395)}
[I 2024-12-06 23:36:09,080] Trial 17 finished with value: 1.3214285714285714 and parameters: {'x_0_0': 'bd', 'x_0_1': 'ac', 'x_1_0': 'oo', 'x_1_1': 'ac'}. Best is trial 11 with value: 0.7857142857142857.
2024-12-06 23:36:09,084 - INFO - Candidate Mean Stats: {'Max': np.float64(1.875), 'Min': np.float64(-0.8403812706881653), 'Mean': np.float64(0.2073206729457244), 'Std': np.float64(0.35441022048913473)}
2024-12-06 23:36:09,084 - INFO - Candidate Std Stats: {'Max': np.float64(1.8488310285332508), 'Min': np.float64(0.0), 'Mean': np.float64(0.6011119236916741), 'Std': np.float64(0.25354511992764023)}
[I 2024-12-06 23:36:09,100] Trial 17 finished with value: 1.2142857142857144 and parameters: {'x_0_0': 'ab', 'x_0_1': 'oo', 'x_1_0': 'ad', 'x_1_1': 'ab'}. Best is trial 15 with value: 0.7857142857142857.
2024-12-06 23:36:09,148 - INFO - Candidate Mean Stats: {'Max': np.float64(1.875), 'Min': np.float64(-0.720725240066194), 'Mean': np.float64(0.21293862569339603), 'Std': np.float64(0.33051178336340614)}
2024-12-06 23:36:09,148 - INFO - Candidate Std Stats: {'Max': np.float64(1.7550403053889956), 'Min': np.float64(0.0), 'Mean': np.float64(0.6667991457417596), 'Std': np.float64(0.2802818789557884)}
[I 2024-12-06 23:36:09,164] Trial 17 finished with value: 1.5714285714285714 and parameters: {'x_0_0': 'bc', 'x_0_1': 'bc', 'x_1_0': 'cd', 'x_1_1': 'ab'}. Best is trial 7 with value: 0.6607142857142857.
2024-12-06 23:36:09,385 - INFO - Candidate Mean Stats: {'Max': np.float64(2.0), 'Min': np.float64(-0.8125136336543932), 'Mean': np.float64(0.1559921759810624), 'Std': np.float64(0.35573348319697606)}
2024-12-06 23:36:09,385 - INFO - Candidate Std Stats: {'Max': np.float64(1.8028453167670444), 'Min': np.float64(0.0), 'Mean': np.float64(0.7028419530017348), 'Std': np.float64(0.2718211477056996)}
[I 2024-12-06 23:36:09,400] Trial 18 finished with value: 1.3035714285714286 and parameters: {'x_0_0': 'ad', 'x_0_1': 'cd', 'x_1_0': 'ab', 'x_1_1': 'oo'}. Best is trial 14 with value: 0.6428571428571428.
2024-12-06 23:36:09,435 - INFO - Candidate Mean Stats: {'Max': np.float64(2.0), 'Min': np.float64(-0.7783491600422618), 'Mean': np.float64(0.19357218060852904), 'Std': np.float64(0.33486187725523514)}
2024-12-06 23:36:09,435 - INFO - Candidate Std Stats: {'Max': np.float64(1.5656348531752171), 'Min': np.float64(0.0), 'Mean': np.float64(0.5763175009112841), 'Std': np.float64(0.2472668304726487)}
[I 2024-12-06 23:36:09,450] Trial 18 finished with value: 1.875 and parameters: {'x_0_0': 'oo', 'x_0_1': 'ac', 'x_1_0': 'bc', 'x_1_1': 'ab'}. Best is trial 11 with value: 0.7857142857142857.
2024-12-06 23:36:09,458 - INFO - Candidate Mean Stats: {'Max': np.float64(1.875), 'Min': np.float64(-1.1442952580695613), 'Mean': np.float64(0.17538030179447242), 'Std': np.float64(0.39659267789878844)}
2024-12-06 23:36:09,458 - INFO - Candidate Std Stats: {'Max': np.float64(1.8832292367408712), 'Min': np.float64(0.0), 'Mean': np.float64(0.6424187720987449), 'Std': np.float64(0.2599873635300492)}
[I 2024-12-06 23:36:09,472] Trial 18 finished with value: 1.5714285714285714 and parameters: {'x_0_0': 'bc', 'x_0_1': 'cd', 'x_1_0': 'ac', 'x_1_1': 'bc'}. Best is trial 15 with value: 0.7857142857142857.
2024-12-06 23:36:09,509 - INFO - Candidate Mean Stats: {'Max': np.float64(1.875), 'Min': np.float64(-0.9175758500988686), 'Mean': np.float64(0.1613949681976696), 'Std': np.float64(0.36490261699222026)}
2024-12-06 23:36:09,510 - INFO - Candidate Std Stats: {'Max': np.float64(1.47964866833012), 'Min': np.float64(0.0), 'Mean': np.float64(0.602073384133202), 'Std': np.float64(0.24192204090558497)}
[I 2024-12-06 23:36:09,523] Trial 18 finished with value: 1.875 and parameters: {'x_0_0': 'oo', 'x_0_1': 'bc', 'x_1_0': 'ad', 'x_1_1': 'ad'}. Best is trial 7 with value: 0.6607142857142857.
2024-12-06 23:36:09,735 - INFO - Candidate Mean Stats: {'Max': np.float64(2.0), 'Min': np.float64(-1.1242823155433534), 'Mean': np.float64(0.056771145286545456), 'Std': np.float64(0.39601400826762784)}
2024-12-06 23:36:09,735 - INFO - Candidate Std Stats: {'Max': np.float64(1.9582189786335442), 'Min': np.float64(0.0), 'Mean': np.float64(0.7351641442063654), 'Std': np.float64(0.30004974920338956)}
[I 2024-12-06 23:36:09,748] Trial 19 finished with value: 1.2857142857142856 and parameters: {'x_0_0': 'bc', 'x_0_1': 'ac', 'x_1_0': 'bd', 'x_1_1': 'cd'}. Best is trial 14 with value: 0.6428571428571428.
2024-12-06 23:36:09,776 - INFO - Candidate Mean Stats: {'Max': np.float64(2.0), 'Min': np.float64(-1.0710067575651387), 'Mean': np.float64(0.1544326082732515), 'Std': np.float64(0.4024834096581925)}
2024-12-06 23:36:09,776 - INFO - Candidate Std Stats: {'Max': np.float64(1.6992583265878558), 'Min': np.float64(0.0), 'Mean': np.float64(0.6518055990517874), 'Std': np.float64(0.26166332704861495)}
[I 2024-12-06 23:36:09,789] Trial 19 finished with value: 1.0714285714285714 and parameters: {'x_0_0': 'bd', 'x_0_1': 'oo', 'x_1_0': 'ac', 'x_1_1': 'bc'}. Best is trial 11 with value: 0.7857142857142857.
2024-12-06 23:36:09,794 - INFO - Candidate Mean Stats: {'Max': np.float64(1.875), 'Min': np.float64(-1.0759794578024493), 'Mean': np.float64(0.19666373121041902), 'Std': np.float64(0.3732484513396889)}
2024-12-06 23:36:09,794 - INFO - Candidate Std Stats: {'Max': np.float64(1.8760122148556146), 'Min': np.float64(0.0), 'Mean': np.float64(0.623119036190426), 'Std': np.float64(0.2753970091170458)}
[I 2024-12-06 23:36:09,806] Trial 19 finished with value: 0.8214285714285714 and parameters: {'x_0_0': 'ad', 'x_0_1': 'oo', 'x_1_0': 'oo', 'x_1_1': 'ac'}. Best is trial 15 with value: 0.7857142857142857.
2024-12-06 23:36:09,852 - INFO - Candidate Mean Stats: {'Max': np.float64(1.875), 'Min': np.float64(-0.7217047283355024), 'Mean': np.float64(0.2436021419962809), 'Std': np.float64(0.35492940105938703)}
2024-12-06 23:36:09,853 - INFO - Candidate Std Stats: {'Max': np.float64(1.5557715045367044), 'Min': np.float64(0.0), 'Mean': np.float64(0.5890298578367671), 'Std': np.float64(0.24051318083817777)}
[I 2024-12-06 23:36:09,867] Trial 19 finished with value: 1.2857142857142856 and parameters: {'x_0_0': 'bc', 'x_0_1': 'ad', 'x_1_0': 'ad', 'x_1_1': 'cd'}. Best is trial 7 with value: 0.6607142857142857.
2024-12-06 23:36:10,092 - INFO - Candidate Mean Stats: {'Max': np.float64(2.0), 'Min': np.float64(-1.274313517601786), 'Mean': np.float64(0.16973886411934086), 'Std': np.float64(0.41991546331825774)}
2024-12-06 23:36:10,093 - INFO - Candidate Std Stats: {'Max': np.float64(1.6729772420906375), 'Min': np.float64(0.0), 'Mean': np.float64(0.648897703614997), 'Std': np.float64(0.26472437492521445)}
[I 2024-12-06 23:36:10,108] Trial 20 finished with value: 1.3214285714285714 and parameters: {'x_0_0': 'bd', 'x_0_1': 'cd', 'x_1_0': 'oo', 'x_1_1': 'bc'}. Best is trial 14 with value: 0.6428571428571428.
2024-12-06 23:36:10,144 - INFO - Candidate Mean Stats: {'Max': np.float64(2.0), 'Min': np.float64(-1.0025394342812401), 'Mean': np.float64(0.2066303925011832), 'Std': np.float64(0.4040087824868388)}
2024-12-06 23:36:10,144 - INFO - Candidate Std Stats: {'Max': np.float64(1.599533314824398), 'Min': np.float64(0.0), 'Mean': np.float64(0.6241475748581954), 'Std': np.float64(0.25629742617644397)}
[I 2024-12-06 23:36:10,157] Trial 20 finished with value: 1.0714285714285714 and parameters: {'x_0_0': 'ac', 'x_0_1': 'oo', 'x_1_0': 'ad', 'x_1_1': 'cd'}. Best is trial 11 with value: 0.7857142857142857.
2024-12-06 23:36:10,161 - INFO - Candidate Mean Stats: {'Max': np.float64(1.875), 'Min': np.float64(-0.7907836273628587), 'Mean': np.float64(0.21271405107842709), 'Std': np.float64(0.35242619887880144)}
2024-12-06 23:36:10,161 - INFO - Candidate Std Stats: {'Max': np.float64(1.5513172413705458), 'Min': np.float64(0.0), 'Mean': np.float64(0.6177520884008791), 'Std': np.float64(0.24939333216543652)}
[I 2024-12-06 23:36:10,175] Trial 20 finished with value: 2.0 and parameters: {'x_0_0': 'cd', 'x_0_1': 'cd', 'x_1_0': 'ab', 'x_1_1': 'ab'}. Best is trial 15 with value: 0.7857142857142857.
2024-12-06 23:36:10,215 - INFO - Candidate Mean Stats: {'Max': np.float64(1.875), 'Min': np.float64(-0.8647907324733266), 'Mean': np.float64(0.17675243571110436), 'Std': np.float64(0.3748459700547954)}
2024-12-06 23:36:10,215 - INFO - Candidate Std Stats: {'Max': np.float64(1.5545792075732632), 'Min': np.float64(0.0), 'Mean': np.float64(0.5993106327013005), 'Std': np.float64(0.24800479499044056)}
[I 2024-12-06 23:36:10,228] Trial 20 finished with value: 1.0714285714285714 and parameters: {'x_0_0': 'bc', 'x_0_1': 'oo', 'x_1_0': 'cd', 'x_1_1': 'cd'}. Best is trial 7 with value: 0.6607142857142857.
2024-12-06 23:36:10,425 - INFO - Candidate Mean Stats: {'Max': np.float64(2.0), 'Min': np.float64(-0.6998100105596384), 'Mean': np.float64(0.20097840114979768), 'Std': np.float64(0.3575487040225213)}
2024-12-06 23:36:10,425 - INFO - Candidate Std Stats: {'Max': np.float64(1.6456781901179718), 'Min': np.float64(0.0), 'Mean': np.float64(0.6233722070911144), 'Std': np.float64(0.2522108385455133)}
[I 2024-12-06 23:36:10,437] Trial 21 finished with value: 1.1607142857142856 and parameters: {'x_0_0': 'ad', 'x_0_1': 'ab', 'x_1_0': 'bc', 'x_1_1': 'oo'}. Best is trial 14 with value: 0.6428571428571428.
2024-12-06 23:36:10,474 - INFO - Candidate Mean Stats: {'Max': np.float64(2.0), 'Min': np.float64(-1.0130367254518995), 'Mean': np.float64(0.21936344330600854), 'Std': np.float64(0.37338479533852487)}
2024-12-06 23:36:10,474 - INFO - Candidate Std Stats: {'Max': np.float64(1.5385575996084124), 'Min': np.float64(0.0), 'Mean': np.float64(0.612086653976564), 'Std': np.float64(0.24052217327114253)}
[I 2024-12-06 23:36:10,487] Trial 21 finished with value: 1.0714285714285714 and parameters: {'x_0_0': 'bc', 'x_0_1': 'oo', 'x_1_0': 'bc', 'x_1_1': 'bc'}. Best is trial 11 with value: 0.7857142857142857.
2024-12-06 23:36:10,489 - INFO - Candidate Mean Stats: {'Max': np.float64(2.0), 'Min': np.float64(-0.8682122598950418), 'Mean': np.float64(0.2471176149271718), 'Std': np.float64(0.35793940845149125)}
2024-12-06 23:36:10,489 - INFO - Candidate Std Stats: {'Max': np.float64(1.3403181960158086), 'Min': np.float64(0.0), 'Mean': np.float64(0.5537091580026204), 'Std': np.float64(0.2252786450488798)}
[I 2024-12-06 23:36:10,502] Trial 21 finished with value: 0.7857142857142857 and parameters: {'x_0_0': 'ad', 'x_0_1': 'oo', 'x_1_0': 'bd', 'x_1_1': 'cd'}. Best is trial 15 with value: 0.7857142857142857.
2024-12-06 23:36:10,546 - INFO - Candidate Mean Stats: {'Max': np.float64(1.875), 'Min': np.float64(-1.2452840111196255), 'Mean': np.float64(0.0998663090167393), 'Std': np.float64(0.4066580423525784)}
2024-12-06 23:36:10,546 - INFO - Candidate Std Stats: {'Max': np.float64(1.6217340425330238), 'Min': np.float64(0.0), 'Mean': np.float64(0.6897933943785094), 'Std': np.float64(0.26829869673031015)}
[I 2024-12-06 23:36:10,559] Trial 21 finished with value: 1.7142857142857144 and parameters: {'x_0_0': 'ab', 'x_0_1': 'ab', 'x_1_0': 'bc', 'x_1_1': 'ac'}. Best is trial 7 with value: 0.6607142857142857.
2024-12-06 23:36:10,754 - INFO - Candidate Mean Stats: {'Max': np.float64(2.0), 'Min': np.float64(-0.913618820564208), 'Mean': np.float64(0.19999334385948297), 'Std': np.float64(0.38030527647850165)}
2024-12-06 23:36:10,754 - INFO - Candidate Std Stats: {'Max': np.float64(1.7136410051779434), 'Min': np.float64(0.0), 'Mean': np.float64(0.6228332186543898), 'Std': np.float64(0.26594601664179346)}
[I 2024-12-06 23:36:10,766] Trial 22 finished with value: 1.5714285714285714 and parameters: {'x_0_0': 'bd', 'x_0_1': 'cd', 'x_1_0': 'cd', 'x_1_1': 'bc'}. Best is trial 14 with value: 0.6428571428571428.
2024-12-06 23:36:10,802 - INFO - Candidate Mean Stats: {'Max': np.float64(2.0), 'Min': np.float64(-0.9761164172884268), 'Mean': np.float64(0.17674646640701347), 'Std': np.float64(0.3960961302200807)}
2024-12-06 23:36:10,802 - INFO - Candidate Std Stats: {'Max': np.float64(1.5569404501419652), 'Min': np.float64(0.0), 'Mean': np.float64(0.579494372239363), 'Std': np.float64(0.23928172197087508)}
[I 2024-12-06 23:36:10,815] Trial 22 finished with value: 1.3214285714285714 and parameters: {'x_0_0': 'bc', 'x_0_1': 'bc', 'x_1_0': 'oo', 'x_1_1': 'cd'}. Best is trial 11 with value: 0.7857142857142857.
2024-12-06 23:36:10,818 - INFO - Candidate Mean Stats: {'Max': np.float64(2.0), 'Min': np.float64(-1.4442968742963267), 'Mean': np.float64(0.20298511334836467), 'Std': np.float64(0.41496652023786806)}
2024-12-06 23:36:10,818 - INFO - Candidate Std Stats: {'Max': np.float64(1.727371755994658), 'Min': np.float64(0.0), 'Mean': np.float64(0.5964576942599216), 'Std': np.float64(0.252244915149264)}
[I 2024-12-06 23:36:10,830] Trial 22 finished with value: 0.8214285714285714 and parameters: {'x_0_0': 'ad', 'x_0_1': 'oo', 'x_1_0': 'oo', 'x_1_1': 'bc'}. Best is trial 15 with value: 0.7857142857142857.
2024-12-06 23:36:10,878 - INFO - Candidate Mean Stats: {'Max': np.float64(1.875), 'Min': np.float64(-0.7694539471103423), 'Mean': np.float64(0.20817704822514685), 'Std': np.float64(0.35639378027392205)}
2024-12-06 23:36:10,878 - INFO - Candidate Std Stats: {'Max': np.float64(1.9939953334631435), 'Min': np.float64(0.0), 'Mean': np.float64(0.6055046508404214), 'Std': np.float64(0.255106508083332)}
[I 2024-12-06 23:36:10,890] Trial 22 finished with value: 1.5714285714285714 and parameters: {'x_0_0': 'bd', 'x_0_1': 'bd', 'x_1_0': 'cd', 'x_1_1': 'cd'}. Best is trial 7 with value: 0.6607142857142857.
2024-12-06 23:36:11,079 - INFO - Candidate Mean Stats: {'Max': np.float64(2.0), 'Min': np.float64(-1.2591685495956546), 'Mean': np.float64(0.13176140336085448), 'Std': np.float64(0.3921799556080919)}
2024-12-06 23:36:11,079 - INFO - Candidate Std Stats: {'Max': np.float64(1.6264816088383622), 'Min': np.float64(0.0), 'Mean': np.float64(0.6452082270190984), 'Std': np.float64(0.2599796290563741)}
[I 2024-12-06 23:36:11,092] Trial 23 finished with value: 1.5714285714285714 and parameters: {'x_0_0': 'bc', 'x_0_1': 'bc', 'x_1_0': 'ab', 'x_1_1': 'bd'}. Best is trial 14 with value: 0.6428571428571428.
2024-12-06 23:36:11,126 - INFO - Candidate Mean Stats: {'Max': np.float64(2.0), 'Min': np.float64(-0.817061035062007), 'Mean': np.float64(0.21767996057788225), 'Std': np.float64(0.3575098513729244)}
2024-12-06 23:36:11,126 - INFO - Candidate Std Stats: {'Max': np.float64(1.4195149421400546), 'Min': np.float64(0.0), 'Mean': np.float64(0.577626176096529), 'Std': np.float64(0.2298839699913722)}
[I 2024-12-06 23:36:11,138] Trial 23 finished with value: 1.5714285714285714 and parameters: {'x_0_0': 'ac', 'x_0_1': 'cd', 'x_1_0': 'bc', 'x_1_1': 'bc'}. Best is trial 11 with value: 0.7857142857142857.
2024-12-06 23:36:11,142 - INFO - Candidate Mean Stats: {'Max': np.float64(2.0), 'Min': np.float64(-0.7166931768498793), 'Mean': np.float64(0.2827923319013921), 'Std': np.float64(0.33460084767494913)}
2024-12-06 23:36:11,142 - INFO - Candidate Std Stats: {'Max': np.float64(1.4835839776671584), 'Min': np.float64(0.0), 'Mean': np.float64(0.5875591826988419), 'Std': np.float64(0.24278308895896658)}
[I 2024-12-06 23:36:11,154] Trial 23 finished with value: 2.0 and parameters: {'x_0_0': 'cd', 'x_0_1': 'ad', 'x_1_0': 'ac', 'x_1_1': 'ac'}. Best is trial 15 with value: 0.7857142857142857.
2024-12-06 23:36:11,205 - INFO - Candidate Mean Stats: {'Max': np.float64(1.875), 'Min': np.float64(-0.9158376395994651), 'Mean': np.float64(0.27339960482404646), 'Std': np.float64(0.39597044413096133)}
2024-12-06 23:36:11,205 - INFO - Candidate Std Stats: {'Max': np.float64(1.7925809326070454), 'Min': np.float64(0.0), 'Mean': np.float64(0.6086591073671508), 'Std': np.float64(0.24913425584836807)}
[I 2024-12-06 23:36:11,217] Trial 23 finished with value: 0.5 and parameters: {'x_0_0': 'bd', 'x_0_1': 'oo', 'x_1_0': 'bc', 'x_1_1': 'ad'}. Best is trial 23 with value: 0.5.
2024-12-06 23:36:11,403 - INFO - Candidate Mean Stats: {'Max': np.float64(2.0), 'Min': np.float64(-1.0904347367079257), 'Mean': np.float64(0.2417866745195805), 'Std': np.float64(0.3878410501218619)}
2024-12-06 23:36:11,403 - INFO - Candidate Std Stats: {'Max': np.float64(1.5873272500740647), 'Min': np.float64(0.0), 'Mean': np.float64(0.5994573751741255), 'Std': np.float64(0.2613843067750708)}
[I 2024-12-06 23:36:11,416] Trial 24 finished with value: 1.875 and parameters: {'x_0_0': 'cd', 'x_0_1': 'ad', 'x_1_0': 'bc', 'x_1_1': 'oo'}. Best is trial 14 with value: 0.6428571428571428.
2024-12-06 23:36:11,449 - INFO - Candidate Mean Stats: {'Max': np.float64(2.0), 'Min': np.float64(-0.839116794443947), 'Mean': np.float64(0.18224103537031228), 'Std': np.float64(0.3752110206140657)}
2024-12-06 23:36:11,449 - INFO - Candidate Std Stats: {'Max': np.float64(1.517953248195666), 'Min': np.float64(0.0), 'Mean': np.float64(0.6226348450969984), 'Std': np.float64(0.24820928460806854)}
[I 2024-12-06 23:36:11,462] Trial 24 finished with value: 0.9464285714285714 and parameters: {'x_0_0': 'bc', 'x_0_1': 'oo', 'x_1_0': 'cd', 'x_1_1': 'oo'}. Best is trial 11 with value: 0.7857142857142857.
2024-12-06 23:36:11,466 - INFO - Candidate Mean Stats: {'Max': np.float64(2.0), 'Min': np.float64(-1.051177355007599), 'Mean': np.float64(0.1880098711381925), 'Std': np.float64(0.3991146756539699)}
2024-12-06 23:36:11,466 - INFO - Candidate Std Stats: {'Max': np.float64(1.619945859936948), 'Min': np.float64(0.0), 'Mean': np.float64(0.6405362319122854), 'Std': np.float64(0.25144519909617347)}
[I 2024-12-06 23:36:11,478] Trial 24 finished with value: 1.3214285714285714 and parameters: {'x_0_0': 'ad', 'x_0_1': 'ac', 'x_1_0': 'oo', 'x_1_1': 'ad'}. Best is trial 15 with value: 0.7857142857142857.
2024-12-06 23:36:11,531 - INFO - Candidate Mean Stats: {'Max': np.float64(1.875), 'Min': np.float64(-0.9515593798701213), 'Mean': np.float64(0.15172931108734863), 'Std': np.float64(0.37724553911791886)}
2024-12-06 23:36:11,531 - INFO - Candidate Std Stats: {'Max': np.float64(1.580333784710361), 'Min': np.float64(0.0), 'Mean': np.float64(0.6631766186130298), 'Std': np.float64(0.2500482420501537)}
[I 2024-12-06 23:36:11,554] Trial 24 finished with value: 1.5714285714285714 and parameters: {'x_0_0': 'ad', 'x_0_1': 'ab', 'x_1_0': 'cd', 'x_1_1': 'bc'}. Best is trial 23 with value: 0.5.
2024-12-06 23:36:11,728 - INFO - Candidate Mean Stats: {'Max': np.float64(2.0), 'Min': np.float64(-0.9489688766479766), 'Mean': np.float64(0.24530882877261442), 'Std': np.float64(0.3608890890501392)}
2024-12-06 23:36:11,728 - INFO - Candidate Std Stats: {'Max': np.float64(1.5241878189785578), 'Min': np.float64(0.0), 'Mean': np.float64(0.5961965291016023), 'Std': np.float64(0.23612956169514457)}
[I 2024-12-06 23:36:11,739] Trial 25 finished with value: 0.6964285714285714 and parameters: {'x_0_0': 'bd', 'x_0_1': 'oo', 'x_1_0': 'oo', 'x_1_1': 'oo'}. Best is trial 14 with value: 0.6428571428571428.
2024-12-06 23:36:11,774 - INFO - Candidate Mean Stats: {'Max': np.float64(2.0), 'Min': np.float64(-0.9444555409252615), 'Mean': np.float64(0.222357546549563), 'Std': np.float64(0.41667372837421857)}
2024-12-06 23:36:11,774 - INFO - Candidate Std Stats: {'Max': np.float64(1.7669022499720999), 'Min': np.float64(0.0), 'Mean': np.float64(0.6749954551178238), 'Std': np.float64(0.27378764295958574)}
[I 2024-12-06 23:36:11,786] Trial 25 finished with value: 1.3214285714285714 and parameters: {'x_0_0': 'ad', 'x_0_1': 'ad', 'x_1_0': 'oo', 'x_1_1': 'ab'}. Best is trial 11 with value: 0.7857142857142857.
2024-12-06 23:36:11,791 - INFO - Candidate Mean Stats: {'Max': np.float64(2.0), 'Min': np.float64(-0.8610842865346988), 'Mean': np.float64(0.29216854001277404), 'Std': np.float64(0.37075709372347104)}
2024-12-06 23:36:11,791 - INFO - Candidate Std Stats: {'Max': np.float64(1.5895790568545733), 'Min': np.float64(0.0), 'Mean': np.float64(0.593821453714092), 'Std': np.float64(0.24526086430602137)}
