[I 2024-12-28 15:01:05,808] Trial 103 finished with value: 1.7142857142857144 and parameters: {'x_0_0': 'ab', 'x_0_1': 'ad', 'x_1_0': 'bd', 'x_1_1': 'ad'}. Best is trial 17 with value: 0.7857142857142857.

Loaded from prev state!
Loaded from prev state!
Loaded from prev state!
Loaded from prev state!
Loaded from prev state!
Loaded from prev state!
Loaded from prev state!
Loaded from prev state!
Loaded from prev state!
Loaded from prev state!
Loaded from prev state!
Loaded from prev state!
Loaded from prev state!
Loaded from prev state!
Loaded from prev state!
Loaded from prev state!
Loaded from prev state!
Loaded from prev state!
Loaded from prev state!
Loaded from prev state!
Loaded from prev state!
Loaded from prev state!
Loaded from prev state!
Loaded from prev state!
Loaded from prev state!
Loaded from prev state!
Loaded from prev state!
Loaded from prev state!
Loaded from prev state!
Loaded from prev state!
Loaded from prev state!
Loaded from prev state!
Loaded from prev state!
Loaded from prev state!
Loaded from prev state!
Loaded from prev state!
Loaded from prev state!
Loaded from prev state!
Loaded from prev state!
Loaded from prev state!
Loaded from prev state!
Loaded from prev state!
Loaded from prev state!
Loaded from prev state!
Loaded from prev state!
Loaded from prev state!
Loaded from prev state!
Loaded from prev state!
Loaded from prev state!
Loaded from prev state!
Loaded from prev state!
Loaded from prev state!
Loaded from prev state!
Loaded from prev state!
Loaded from prev state!
Loaded from prev state!
Loaded from prev state!
Loaded from prev state!
Loaded from prev state!
Loaded from prev state!
Loaded from prev state!
Loaded from prev state!
Loaded from prev state!
Loaded from prev state!
Loaded from prev state!
Loaded from prev state!
Loaded from prev state!
Loaded from prev state!
Loaded from prev state!
Loaded from prev state!
Loaded from prev state!
Loaded from prev state!
Loaded from prev state!
Loaded from prev state!
Loaded from prev state!
Loaded from prev state!
Loaded from prev state!
Loaded from prev state!
Loaded from prev state!
Loaded from prev state!
Loaded from prev state!
Loaded from prev state!
Loaded from prev state!
Loaded from prev state!
Loaded from prev state!
Loaded from prev state!
Loaded from prev state!
Loaded from prev state!
Loaded from prev state!
Loaded from prev state!
Loaded from prev state!
Loaded from prev state!
Loaded from prev state!
Loaded from prev state!
Loaded from prev state!
Loaded from prev state!
Loaded from prev state!
Loaded from prev state!
Loaded from prev state!
Loaded from prev state!
Loaded from prev state!
Loaded from prev state!
Loaded from prev state!
Loaded from prev state!
Loaded from prev state!
Loaded from prev state!
Loaded from prev state!
Loaded from prev state!
Loaded from prev state!
Loaded from prev state!
Loaded from prev state!
Loaded from prev state!
Loaded from prev state!
Loaded from prev state!
Loaded from prev state!
Loaded from prev state!
Loaded from prev state!
Loaded from prev state!
Loaded from prev state!
Loaded from prev state!
Loaded from prev state!
Loaded from prev state!
Loaded from prev state!
Loaded from prev state!
Loaded from prev state!
Loaded from prev state!
Loaded from prev state!
Loaded from prev state!
Loaded from prev state!
Loaded from prev state!
Loaded from prev state!
Loaded from prev state!
Loaded from prev state!
Loaded from prev state!
Loaded from prev state!
Loaded from prev state!
Loaded from prev state!
Loaded from prev state!
Loaded from prev state!
Loaded from prev state!
Loaded from prev state!
Loaded from prev state!
Loaded from prev state!
Loaded from prev state!
Loaded from prev state!
Loaded from prev state!
Loaded from prev state!
Loaded from prev state!
Loaded from prev state!
Loaded from prev state!
Loaded from prev state!
Loaded from prev state!
Loaded from prev state!
Loaded from prev state!
Loaded from prev state!
Loaded from prev state!
Loaded from prev state!
Loaded from prev state!
Loaded from prev state!
Loaded from prev state!
Loaded from prev state!
Loaded from prev state!
Loaded from prev state!
Loaded from prev state!
Loaded from prev state!
Loaded from prev state!
Loaded from prev state!
Loaded from prev state!
Loaded from prev state!
Loaded from prev state!
Loaded from prev state!
Loaded from prev state!
Loaded from prev state!
Loaded from prev state!
Loaded from prev state!
Loaded from prev state!
Loaded from prev state!
Loaded from prev state!
Loaded from prev state!
Loaded from prev state!
Loaded from prev state!
Loaded from prev state!
Loaded from prev state!
Loaded from prev state!
Loaded from prev state!
Loaded from prev state!
Loaded from prev state!
Loaded from prev state!
Loaded from prev state!
Loaded from prev state!
Loaded from prev state!
Loaded from prev state!
Loaded from prev state!
Loaded from prev state!
Loaded from prev state!
Loaded from prev state!
Loaded from prev state!
Loaded from prev state!
Loaded from prev state!
Loaded from prev state!
Loaded from prev state!
Loaded from prev state!
Loaded from prev state!
Loaded from prev state!
Loaded from prev state!
Loaded from prev state!
Loaded from prev state!
Loaded from prev state!
Loaded from prev state!
Loaded from prev state!
Loaded from prev state!
Loaded from prev state!
Loaded from prev state!
Loaded from prev state!
Loaded from prev state!
Loaded from prev state!
Loaded from prev state!
Loaded from prev state!
Loaded from prev state!
Loaded from prev state!
Loaded from prev state!
Loaded from prev state!
Loaded from prev state!
Loaded from prev state!
Loaded from prev state!
Loaded from prev state!
Loaded from prev state!
Loaded from prev state!
Loaded from prev state!
Loaded from prev state!
Loaded from prev state!
Loaded from prev state!
Loaded from prev state!
Loaded from prev state!
Loaded from prev state!
Loaded from prev state!
Loaded from prev state!
Loaded from prev state!
Loaded from prev state!
Loaded from prev state!
Loaded from prev state!
Loaded from prev state!
Loaded from prev state!
Loaded from prev state!
Loaded from prev state!
Loaded from prev state!
Loaded from prev state!
Loaded from prev state!
Loaded from prev state!
Loaded from prev state!
Loaded from prev state!
Loaded from prev state!
Loaded from prev state!
Loaded from prev state!
Loaded from prev state!
Loaded from prev state!
Loaded from prev state!
Loaded from prev state!
Loaded from prev state!
Loaded from prev state!
Loaded from prev state!
Loaded from prev state!
Loaded from prev state!
Loaded from prev state!
Loaded from prev state!
Loaded from prev state!
Loaded from prev state!
Loaded from prev state!
Loaded from prev state!
Loaded from prev state!
Loaded from prev state!
Loaded from prev state!
Loaded from prev state!
Loaded from prev state!
Loaded from prev state!
Loaded from prev state!
Loaded from prev state!
Loaded from prev state!
Loaded from prev state!
Loaded from prev state!
Loaded from prev state!
Loaded from prev state!
Loaded from prev state!
Loaded from prev state!
Loaded from prev state!
Loaded from prev state!
Loaded from prev state!
Loaded from prev state!
Loaded from prev state!
Loaded from prev state!
Loaded from prev state!
Loaded from prev state!
Loaded from prev state!
Loaded from prev state!
Loaded from prev state!
Loaded from prev state!
Loaded from prev state!
Loaded from prev state!
Loaded from prev state!
Loaded from prev state!
Loaded from prev state!
Loaded from prev state!
Loaded from prev state!
Loaded from prev state!
Loaded from prev state!
Loaded from prev state!
Loaded from prev state!
Loaded from prev state!
Loaded from prev state!
Loaded from prev state!
Loaded from prev state!
Loaded from prev state!
Loaded from prev state!
Loaded from prev state!
Loaded from prev state!
Loaded from prev state!
Loaded from prev state!
Loaded from prev state!
Loaded from prev state!
Loaded from prev state!
Loaded from prev state!
Loaded from prev state!
Loaded from prev state!
Loaded from prev state!
Loaded from prev state!
Loaded from prev state!
Loaded from prev state!
Loaded from prev state!
Loaded from prev state!
Loaded from prev state!
Loaded from prev state!
Loaded from prev state!
Loaded from prev state!
Loaded from prev state!
Loaded from prev state!
Loaded from prev state!
Loaded from prev state!
Loaded from prev state!
Loaded from prev state!
Loaded from prev state!
Loaded from prev state!
Loaded from prev state![I 2024-12-28 15:01:08,160] Trial 105 finished with value: 1.75 and parameters: {'x_0_0': 'cd', 'x_0_1': 'bd', 'x_1_0': 'oo', 'x_1_1': 'bc'}. Best is trial 50 with value: 0.8214285714285714.
[I 2024-12-28 15:01:09,139] Trial 92 finished with value: 1.2857142857142856 and parameters: {'x_0_0': 'bc', 'x_0_1': 'ac', 'x_1_0': 'ac', 'x_1_1': 'ad'}. Best is trial 7 with value: 0.5.
[I 2024-12-28 15:01:09,157] Trial 104 finished with value: 1.875 and parameters: {'x_0_0': 'oo', 'x_0_1': 'ac', 'x_1_0': 'bc', 'x_1_1': 'bc'}. Best is trial 73 with value: 0.7857142857142857.
[I 2024-12-28 15:01:09,555] Trial 106 finished with value: 1.1785714285714286 and parameters: {'x_0_0': 'ac', 'x_0_1': 'ab', 'x_1_0': 'oo', 'x_1_1': 'bc'}. Best is trial 15 with value: 0.6964285714285714.
[I 2024-12-28 15:01:09,846] Trial 99 finished with value: 1.375 and parameters: {'x_0_0': 'oo', 'x_0_1': 'oo', 'x_1_0': 'ad', 'x_1_1': 'ab'}. Best is trial 21 with value: 0.7857142857142857.
[I 2024-12-28 15:01:10,538] Trial 104 finished with value: 1.375 and parameters: {'x_0_0': 'oo', 'x_0_1': 'oo', 'x_1_0': 'ad', 'x_1_1': 'ad'}. Best is trial 17 with value: 0.7857142857142857.
[I 2024-12-28 15:01:11,972] Trial 101 finished with value: 2.0 and parameters: {'x_0_0': 'cd', 'x_0_1': 'bd', 'x_1_0': 'cd', 'x_1_1': 'bc'}. Best is trial 93 with value: 0.8214285714285714.
[I 2024-12-28 15:01:12,959] Trial 88 finished with value: 1.4285714285714286 and parameters: {'x_0_0': 'bc', 'x_0_1': 'ab', 'x_1_0': 'cd', 'x_1_1': 'bd'}. Best is trial 47 with value: 0.6964285714285714.
[I 2024-12-28 15:01:13,640] Trial 96 finished with value: 2.0 and parameters: {'x_0_0': 'cd', 'x_0_1': 'bc', 'x_1_0': 'bd', 'x_1_1': 'ad'}. Best is trial 43 with value: 0.6964285714285714.
[I 2024-12-28 15:01:13,774] Trial 105 finished with value: 2.0 and parameters: {'x_0_0': 'cd', 'x_0_1': 'ad', 'x_1_0': 'ac', 'x_1_1': 'bc'}. Best is trial 73 with value: 0.7857142857142857.
[I 2024-12-28 15:01:14,201] Trial 103 finished with value: 1.5 and parameters: {'x_0_0': 'cd', 'x_0_1': 'oo', 'x_1_0': 'bd', 'x_1_1': 'ac'}. Best is trial 17 with value: 0.5.
[I 2024-12-28 15:01:15,350] Trial 93 finished with value: 1.2857142857142856 and parameters: {'x_0_0': 'bc', 'x_0_1': 'ac', 'x_1_0': 'ad', 'x_1_1': 'ad'}. Best is trial 7 with value: 0.5.
[I 2024-12-28 15:01:15,430] Trial 100 finished with value: 1.2142857142857144 and parameters: {'x_0_0': 'ab', 'x_0_1': 'oo', 'x_1_0': 'ab', 'x_1_1': 'ac'}. Best is trial 21 with value: 0.7857142857142857.
[I 2024-12-28 15:01:16,229] Trial 107 finished with value: 1.75 and parameters: {'x_0_0': 'cd', 'x_0_1': 'cd', 'x_1_0': 'oo', 'x_1_1': 'ad'}. Best is trial 15 with value: 0.6964285714285714.
[I 2024-12-28 15:01:16,497] Trial 106 finished with value: 1.4285714285714286 and parameters: {'x_0_0': 'ad', 'x_0_1': 'ac', 'x_1_0': 'ab', 'x_1_1': 'ac'}. Best is trial 50 with value: 0.8214285714285714.
[I 2024-12-28 15:01:18,637] Trial 102 finished with value: 1.875 and parameters: {'x_0_0': 'oo', 'x_0_1': 'cd', 'x_1_0': 'bc', 'x_1_1': 'ad'}. Best is trial 93 with value: 0.8214285714285714.

Loaded from prev state!
Loaded from prev state!
Loaded from prev state!
Loaded from prev state!
Loaded from prev state!
Loaded from prev state!
Loaded from prev state!
Loaded from prev state!
Loaded from prev state!
Loaded from prev state!
Loaded from prev state!
Loaded from prev state!
Loaded from prev state!
Loaded from prev state!
Loaded from prev state!
Loaded from prev state!
Loaded from prev state!
Loaded from prev state!
Loaded from prev state!
Loaded from prev state!
Loaded from prev state!
Loaded from prev state!
Loaded from prev state!
Loaded from prev state!
Loaded from prev state!
Loaded from prev state!
Loaded from prev state!
Loaded from prev state!
Loaded from prev state!
Loaded from prev state!
Loaded from prev state!
Loaded from prev state!
Loaded from prev state!
Loaded from prev state!
Loaded from prev state!
Loaded from prev state!
Loaded from prev state!
Loaded from prev state!
Loaded from prev state!
Loaded from prev state!
Loaded from prev state!
Loaded from prev state!
Loaded from prev state!
Loaded from prev state!
Loaded from prev state!
Loaded from prev state!
Loaded from prev state!
Loaded from prev state!
Loaded from prev state!
Loaded from prev state!
Loaded from prev state!
Loaded from prev state!
Loaded from prev state!
Loaded from prev state!
Loaded from prev state!
Loaded from prev state!
Loaded from prev state!
Loaded from prev state!
Loaded from prev state!
Loaded from prev state!
Loaded from prev state!
Loaded from prev state!
Loaded from prev state!
Loaded from prev state!
Loaded from prev state!
Loaded from prev state!
Loaded from prev state!
Loaded from prev state!
Loaded from prev state!
Loaded from prev state!
Loaded from prev state!
Loaded from prev state!
Loaded from prev state!
Loaded from prev state!
Loaded from prev state!
Loaded from prev state!
Loaded from prev state!
Loaded from prev state!
Loaded from prev state!
Loaded from prev state!
Loaded from prev state!
Loaded from prev state!
Loaded from prev state!
Loaded from prev state!
Loaded from prev state!
Loaded from prev state!
Loaded from prev state!
Loaded from prev state!
Loaded from prev state!
Loaded from prev state!
Loaded from prev state!
Loaded from prev state!
Loaded from prev state!
Loaded from prev state!
Loaded from prev state!
Loaded from prev state!
Loaded from prev state!
Loaded from prev state!
Loaded from prev state!
Loaded from prev state!
Loaded from prev state!
Loaded from prev state!
Loaded from prev state!
Loaded from prev state!
Loaded from prev state!
Loaded from prev state!
Loaded from prev state!
Loaded from prev state!
Loaded from prev state!
Loaded from prev state!
Loaded from prev state!
Loaded from prev state!
Loaded from prev state!
Loaded from prev state!
Loaded from prev state!
Loaded from prev state!
Loaded from prev state!
Loaded from prev state!
Loaded from prev state!
Loaded from prev state!
Loaded from prev state!
Loaded from prev state!
Loaded from prev state!
Loaded from prev state!
Loaded from prev state!
Loaded from prev state!
Loaded from prev state!
Loaded from prev state!
Loaded from prev state!
Loaded from prev state!
Loaded from prev state!
Loaded from prev state!
Loaded from prev state!
Loaded from prev state!
Loaded from prev state!
Loaded from prev state!
Loaded from prev state!
Loaded from prev state!
Loaded from prev state!
Loaded from prev state!
Loaded from prev state!
Loaded from prev state!
Loaded from prev state!
Loaded from prev state!
Loaded from prev state!
Loaded from prev state!
Loaded from prev state!
Loaded from prev state!
Loaded from prev state!
Loaded from prev state!
Loaded from prev state!
Loaded from prev state!
Loaded from prev state!
Loaded from prev state!
Loaded from prev state!
Loaded from prev state!
Loaded from prev state!
Loaded from prev state!
Loaded from prev state!
Loaded from prev state!
Loaded from prev state!
Loaded from prev state!
Loaded from prev state!
Loaded from prev state!
Loaded from prev state!
Loaded from prev state!
Loaded from prev state!
Loaded from prev state!
Loaded from prev state!
Loaded from prev state!
Loaded from prev state!
Loaded from prev state!
Loaded from prev state!
Loaded from prev state!
Loaded from prev state!
Loaded from prev state!
Loaded from prev state!
Loaded from prev state!
Loaded from prev state!
Loaded from prev state!
Loaded from prev state!
Loaded from prev state!
Loaded from prev state!
Loaded from prev state!
Loaded from prev state!
Loaded from prev state!
Loaded from prev state!
Loaded from prev state!
Loaded from prev state!
Loaded from prev state!
Loaded from prev state!
Loaded from prev state!
Loaded from prev state!
Loaded from prev state!
Loaded from prev state!
Loaded from prev state!
Loaded from prev state!
Loaded from prev state!
Loaded from prev state!
Loaded from prev state!
Loaded from prev state!
Loaded from prev state!
Loaded from prev state!
Loaded from prev state!
Loaded from prev state!
Loaded from prev state!
Loaded from prev state!
Loaded from prev state!
Loaded from prev state!
Loaded from prev state!
Loaded from prev state!
Loaded from prev state!
Loaded from prev state!
Loaded from prev state!
Loaded from prev state!
Loaded from prev state!
Loaded from prev state!
Loaded from prev state!
Loaded from prev state!
Loaded from prev state!
Loaded from prev state!
Loaded from prev state!
Loaded from prev state!
Loaded from prev state!
Loaded from prev state!
Loaded from prev state!
Loaded from prev state!
Loaded from prev state!
Loaded from prev state!
Loaded from prev state!
Loaded from prev state!
Loaded from prev state!
Loaded from prev state!
Loaded from prev state!
Loaded from prev state!
Loaded from prev state!
Loaded from prev state!
Loaded from prev state!
Loaded from prev state!
Loaded from prev state!
Loaded from prev state!
Loaded from prev state!
Loaded from prev state!
Loaded from prev state!
Loaded from prev state!
Loaded from prev state!
Loaded from prev state!
Loaded from prev state!
Loaded from prev state!
Loaded from prev state!
Loaded from prev state!
Loaded from prev state!
Loaded from prev state!
Loaded from prev state!
Loaded from prev state!
Loaded from prev state!
Loaded from prev state!
Loaded from prev state!
Loaded from prev state!
Loaded from prev state!
Loaded from prev state!
Loaded from prev state!
Loaded from prev state!
Loaded from prev state!
Loaded from prev state!
Loaded from prev state!
Loaded from prev state!
Loaded from prev state!
Loaded from prev state!
Loaded from prev state!
Loaded from prev state!
Loaded from prev state!
Loaded from prev state!
Loaded from prev state!
Loaded from prev state!
Loaded from prev state!
Loaded from prev state!
Loaded from prev state!
Loaded from prev state!
Loaded from prev state!
Loaded from prev state!
Loaded from prev state!
Loaded from prev state!
Loaded from prev state!
Loaded from prev state!
Loaded from prev state!
Loaded from prev state!
Loaded from prev state!
Loaded from prev state!
Loaded from prev state!
Loaded from prev state!
Loaded from prev state!
Loaded from prev state!
Loaded from prev state!
Loaded from prev state!
Loaded from prev state!
Loaded from prev state!
Loaded from prev state!
Loaded from prev state!
Loaded from prev state!
Loaded from prev state!
Loaded from prev state!
Loaded from prev state!
Loaded from prev state!
Loaded from prev state!
Loaded from prev state!
Loaded from prev state!
Loaded from prev state!
Loaded from prev state!
Loaded from prev state!
Loaded from prev state!
Loaded from prev state!
Loaded from prev state!
Loaded from prev state!
Loaded from prev state!
Loaded from prev state!
Loaded from prev state!
Loaded from prev state!
Loaded from prev state!
Loaded from prev state!
Loaded from prev state!
Loaded from prev state!
Loaded from prev state!
Loaded from prev state!
Loaded from prev state!
Loaded from prev state!
Loaded from prev state!
Loaded from prev state!
Loaded from prev state!
Loaded from prev state!
Loaded from prev state!
Loaded from prev state!
Loaded from prev state!
Loaded from prev state!
Loaded from prev state!
Loaded from prev state!
Loaded from prev state!
Loaded from prev state!
Loaded from prev state!
Loaded from prev state!
Loaded from prev state!
Loaded from prev state![I 2024-12-28 15:01:19,149] Trial 94 finished with value: 1.5714285714285714 and parameters: {'x_0_0': 'bc', 'x_0_1': 'bd', 'x_1_0': 'bd', 'x_1_1': 'cd'}. Best is trial 7 with value: 0.5.
[I 2024-12-28 15:01:19,528] Trial 89 finished with value: 1.0714285714285714 and parameters: {'x_0_0': 'bc', 'x_0_1': 'oo', 'x_1_0': 'ac', 'x_1_1': 'ad'}. Best is trial 47 with value: 0.6964285714285714.
[I 2024-12-28 15:01:20,439] Trial 104 finished with value: 1.0357142857142856 and parameters: {'x_0_0': 'bc', 'x_0_1': 'ac', 'x_1_0': 'oo', 'x_1_1': 'ab'}. Best is trial 17 with value: 0.5.
[I 2024-12-28 15:01:20,802] Trial 106 finished with value: 1.25 and parameters: {'x_0_0': 'oo', 'x_0_1': 'oo', 'x_1_0': 'bc', 'x_1_1': 'oo'}. Best is trial 73 with value: 0.7857142857142857.
[I 2024-12-28 15:01:20,869] Trial 101 finished with value: 1.2142857142857144 and parameters: {'x_0_0': 'ab', 'x_0_1': 'oo', 'x_1_0': 'ab', 'x_1_1': 'ab'}. Best is trial 21 with value: 0.7857142857142857.
[I 2024-12-28 15:01:22,244] Trial 105 finished with value: 1.5 and parameters: {'x_0_0': 'cd', 'x_0_1': 'oo', 'x_1_0': 'ac', 'x_1_1': 'bd'}. Best is trial 17 with value: 0.7857142857142857.
[I 2024-12-28 15:01:23,130] Trial 108 finished with value: 1.7142857142857144 and parameters: {'x_0_0': 'ab', 'x_0_1': 'ac', 'x_1_0': 'ab', 'x_1_1': 'bc'}. Best is trial 15 with value: 0.6964285714285714.
[I 2024-12-28 15:01:23,308] Trial 97 finished with value: 2.0 and parameters: {'x_0_0': 'cd', 'x_0_1': 'bc', 'x_1_0': 'bd', 'x_1_1': 'ab'}. Best is trial 43 with value: 0.6964285714285714.
[I 2024-12-28 15:01:23,897] Trial 90 finished with value: 1.75 and parameters: {'x_0_0': 'cd', 'x_0_1': 'ab', 'x_1_0': 'oo', 'x_1_1': 'ad'}. Best is trial 47 with value: 0.6964285714285714.
[I 2024-12-28 15:01:25,886] Trial 107 finished with value: 2.0 and parameters: {'x_0_0': 'cd', 'x_0_1': 'ad', 'x_1_0': 'bc', 'x_1_1': 'ab'}. Best is trial 50 with value: 0.8214285714285714.
[I 2024-12-28 15:01:26,223] Trial 95 finished with value: 1.2857142857142856 and parameters: {'x_0_0': 'bc', 'x_0_1': 'ad', 'x_1_0': 'ac', 'x_1_1': 'ad'}. Best is trial 7 with value: 0.5.
