[I 2024-12-07 01:21:00,887] Trial 273 finished with value: 1.2666666666666666 and parameters: {'x_0_0': 'bd', 'x_0_1': 'oo', 'x_0_2': 'bd', 'x_1_0': 'cd', 'x_1_1': 'bd', 'x_1_2': 'ad'}. Best is trial 200 with value: 0.6.
2024-12-07 01:21:01,448 - INFO - Candidate Mean Stats: {'Max': np.float64(2.0), 'Min': np.float64(0.19147320351515879), 'Mean': np.float64(0.48578696106327957), 'Std': np.float64(0.08082943028245662)}
2024-12-07 01:21:01,448 - INFO - Candidate Std Stats: {'Max': np.float64(0.619813688362563), 'Min': np.float64(0.0), 'Mean': np.float64(0.11191577593975556), 'Std': np.float64(0.04712386816371758)}
[I 2024-12-07 01:21:01,491] Trial 274 finished with value: 0.9222222222222222 and parameters: {'x_0_0': 'bc', 'x_0_1': 'ac', 'x_0_2': 'ad', 'x_1_0': 'oo', 'x_1_1': 'cd', 'x_1_2': 'oo'}. Best is trial 148 with value: 0.8333333333333333.
2024-12-07 01:21:06,245 - INFO - Candidate Mean Stats: {'Max': np.float64(2.0), 'Min': np.float64(0.2673988803562859), 'Mean': np.float64(0.47970051149983), 'Std': np.float64(0.07494020141209548)}
2024-12-07 01:21:06,246 - INFO - Candidate Std Stats: {'Max': np.float64(0.8798376785196403), 'Min': np.float64(0.0), 'Mean': np.float64(0.09993947397768191), 'Std': np.float64(0.04493665415996608)}
[I 2024-12-07 01:21:06,292] Trial 273 finished with value: 1.2444444444444445 and parameters: {'x_0_0': 'ac', 'x_0_1': 'ad', 'x_0_2': 'oo', 'x_1_0': 'bc', 'x_1_1': 'cd', 'x_1_2': 'oo'}. Best is trial 74 with value: 0.8222222222222222.
2024-12-07 01:21:13,296 - INFO - Candidate Mean Stats: {'Max': np.float64(2.0), 'Min': np.float64(0.256413379257239), 'Mean': np.float64(0.49276299137050183), 'Std': np.float64(0.0774626818986058)}
2024-12-07 01:21:13,297 - INFO - Candidate Std Stats: {'Max': np.float64(0.9977875604273811), 'Min': np.float64(0.0), 'Mean': np.float64(0.10235352590661842), 'Std': np.float64(0.047919196717982254)}
[I 2024-12-07 01:21:13,374] Trial 274 finished with value: 1.4555555555555555 and parameters: {'x_0_0': 'bd', 'x_0_1': 'bc', 'x_0_2': 'oo', 'x_1_0': 'ab', 'x_1_1': 'ab', 'x_1_2': 'ad'}. Best is trial 49 with value: 0.7999999999999999.
2024-12-07 01:21:21,293 - INFO - Candidate Mean Stats: {'Max': np.float64(2.0), 'Min': np.float64(0.2384867545825129), 'Mean': np.float64(0.4857283735256135), 'Std': np.float64(0.07778180640163329)}
2024-12-07 01:21:21,294 - INFO - Candidate Std Stats: {'Max': np.float64(0.3663438874402216), 'Min': np.float64(0.0), 'Mean': np.float64(0.09852826317181827), 'Std': np.float64(0.039534317883061505)}
[I 2024-12-07 01:21:21,339] Trial 274 finished with value: 1.3777777777777778 and parameters: {'x_0_0': 'ab', 'x_0_1': 'oo', 'x_0_2': 'bc', 'x_1_0': 'bc', 'x_1_1': 'bc', 'x_1_2': 'bd'}. Best is trial 200 with value: 0.6.
2024-12-07 01:21:21,748 - INFO - Candidate Mean Stats: {'Max': np.float64(2.0), 'Min': np.float64(0.241356540473271), 'Mean': np.float64(0.4912744948923588), 'Std': np.float64(0.07938963460669204)}
2024-12-07 01:21:21,749 - INFO - Candidate Std Stats: {'Max': np.float64(0.5390464633488842), 'Min': np.float64(0.0), 'Mean': np.float64(0.09960008691414989), 'Std': np.float64(0.043828552125756794)}
[I 2024-12-07 01:21:21,791] Trial 275 finished with value: 1.1444444444444444 and parameters: {'x_0_0': 'bc', 'x_0_1': 'ad', 'x_0_2': 'oo', 'x_1_0': 'oo', 'x_1_1': 'ad', 'x_1_2': 'cd'}. Best is trial 148 with value: 0.8333333333333333.
2024-12-07 01:21:27,048 - INFO - Candidate Mean Stats: {'Max': np.float64(2.0), 'Min': np.float64(0.2711402288400061), 'Mean': np.float64(0.49650950304637387), 'Std': np.float64(0.07236956932206905)}
2024-12-07 01:21:27,048 - INFO - Candidate Std Stats: {'Max': np.float64(0.6178748216859642), 'Min': np.float64(0.0), 'Mean': np.float64(0.10040421270704802), 'Std': np.float64(0.04443470167795157)}
[I 2024-12-07 01:21:27,097] Trial 274 finished with value: 1.0666666666666667 and parameters: {'x_0_0': 'ac', 'x_0_1': 'oo', 'x_0_2': 'bc', 'x_1_0': 'bd', 'x_1_1': 'oo', 'x_1_2': 'oo'}. Best is trial 74 with value: 0.8222222222222222.
2024-12-07 01:21:33,863 - INFO - Candidate Mean Stats: {'Max': np.float64(2.0), 'Min': np.float64(0.21700035963522352), 'Mean': np.float64(0.48883704773193226), 'Std': np.float64(0.08766832978663286)}
2024-12-07 01:21:33,864 - INFO - Candidate Std Stats: {'Max': np.float64(0.4085744244470869), 'Min': np.float64(0.0), 'Mean': np.float64(0.10010769879345176), 'Std': np.float64(0.0439238242288428)}
[I 2024-12-07 01:21:33,908] Trial 275 finished with value: 1.1666666666666665 and parameters: {'x_0_0': 'ac', 'x_0_1': 'oo', 'x_0_2': 'ab', 'x_1_0': 'cd', 'x_1_1': 'bc', 'x_1_2': 'oo'}. Best is trial 49 with value: 0.7999999999999999.
2024-12-07 01:21:41,629 - INFO - Candidate Mean Stats: {'Max': np.float64(2.0), 'Min': np.float64(0.23813755139327336), 'Mean': np.float64(0.49704475313988383), 'Std': np.float64(0.07368616046876175)}
2024-12-07 01:21:41,630 - INFO - Candidate Std Stats: {'Max': np.float64(0.5666305857830977), 'Min': np.float64(0.0), 'Mean': np.float64(0.10351233728646869), 'Std': np.float64(0.042674469962566304)}
[I 2024-12-07 01:21:41,677] Trial 275 finished with value: 1.3333333333333333 and parameters: {'x_0_0': 'bc', 'x_0_1': 'ad', 'x_0_2': 'ad', 'x_1_0': 'bc', 'x_1_1': 'ab', 'x_1_2': 'cd'}. Best is trial 200 with value: 0.6.
2024-12-07 01:21:41,977 - INFO - Candidate Mean Stats: {'Max': np.float64(2.0), 'Min': np.float64(0.2467801619048431), 'Mean': np.float64(0.4914249111889728), 'Std': np.float64(0.08076493357196018)}
2024-12-07 01:21:41,978 - INFO - Candidate Std Stats: {'Max': np.float64(0.5278787913830763), 'Min': np.float64(0.0), 'Mean': np.float64(0.10459078716838734), 'Std': np.float64(0.04506732058468084)}
[I 2024-12-07 01:21:42,023] Trial 276 finished with value: 1.6666666666666665 and parameters: {'x_0_0': 'bd', 'x_0_1': 'bc', 'x_0_2': 'ac', 'x_1_0': 'ad', 'x_1_1': 'cd', 'x_1_2': 'ad'}. Best is trial 148 with value: 0.8333333333333333.
2024-12-07 01:21:47,802 - INFO - Candidate Mean Stats: {'Max': np.float64(2.0), 'Min': np.float64(0.17101703467652946), 'Mean': np.float64(0.4840252060907924), 'Std': np.float64(0.08124228858382496)}
2024-12-07 01:21:47,802 - INFO - Candidate Std Stats: {'Max': np.float64(0.6347940147039273), 'Min': np.float64(0.0), 'Mean': np.float64(0.10739121590190825), 'Std': np.float64(0.04721784512048811)}
[I 2024-12-07 01:21:47,844] Trial 275 finished with value: 1.0666666666666667 and parameters: {'x_0_0': 'ac', 'x_0_1': 'oo', 'x_0_2': 'bd', 'x_1_0': 'oo', 'x_1_1': 'ab', 'x_1_2': 'ad'}. Best is trial 74 with value: 0.8222222222222222.
2024-12-07 01:21:54,207 - INFO - Candidate Mean Stats: {'Max': np.float64(2.0), 'Min': np.float64(0.28699803885509245), 'Mean': np.float64(0.48957641477099023), 'Std': np.float64(0.07373286151750165)}
2024-12-07 01:21:54,207 - INFO - Candidate Std Stats: {'Max': np.float64(0.3767417169029017), 'Min': np.float64(0.0), 'Mean': np.float64(0.09447074776547036), 'Std': np.float64(0.039250551037495744)}
[I 2024-12-07 01:21:54,252] Trial 276 finished with value: 1.7999999999999998 and parameters: {'x_0_0': 'oo', 'x_0_1': 'bc', 'x_0_2': 'bc', 'x_1_0': 'bc', 'x_1_1': 'cd', 'x_1_2': 'oo'}. Best is trial 49 with value: 0.7999999999999999.
2024-12-07 01:22:02,299 - INFO - Candidate Mean Stats: {'Max': np.float64(2.0), 'Min': np.float64(0.23415803866377108), 'Mean': np.float64(0.4978285536703408), 'Std': np.float64(0.08085448558626106)}
2024-12-07 01:22:02,300 - INFO - Candidate Std Stats: {'Max': np.float64(0.36894421767490443), 'Min': np.float64(0.0), 'Mean': np.float64(0.09377209538503467), 'Std': np.float64(0.03807218518838406)}
[I 2024-12-07 01:22:02,347] Trial 276 finished with value: 1.1666666666666665 and parameters: {'x_0_0': 'ad', 'x_0_1': 'oo', 'x_0_2': 'ac', 'x_1_0': 'cd', 'x_1_1': 'bd', 'x_1_2': 'oo'}. Best is trial 200 with value: 0.6.
2024-12-07 01:22:02,474 - INFO - Candidate Mean Stats: {'Max': np.float64(2.0), 'Min': np.float64(0.14802774866209495), 'Mean': np.float64(0.48367193505225936), 'Std': np.float64(0.08484729881007105)}
2024-12-07 01:22:02,475 - INFO - Candidate Std Stats: {'Max': np.float64(1.4381715551240595), 'Min': np.float64(0.0), 'Mean': np.float64(0.11152945947137963), 'Std': np.float64(0.058411652762644574)}
[I 2024-12-07 01:22:02,516] Trial 277 finished with value: 1.4666666666666666 and parameters: {'x_0_0': 'ad', 'x_0_1': 'ad', 'x_0_2': 'ad', 'x_1_0': 'oo', 'x_1_1': 'ac', 'x_1_2': 'bd'}. Best is trial 148 with value: 0.8333333333333333.
2024-12-07 01:22:08,444 - INFO - Candidate Mean Stats: {'Max': np.float64(2.0), 'Min': np.float64(0.1452316469833781), 'Mean': np.float64(0.49144349345995514), 'Std': np.float64(0.07773564401390971)}
2024-12-07 01:22:08,445 - INFO - Candidate Std Stats: {'Max': np.float64(1.0382677830162959), 'Min': np.float64(0.0), 'Mean': np.float64(0.10880799033688061), 'Std': np.float64(0.05334585468010032)}
[I 2024-12-07 01:22:08,490] Trial 276 finished with value: 1.1666666666666665 and parameters: {'x_0_0': 'bc', 'x_0_1': 'oo', 'x_0_2': 'ab', 'x_1_0': 'bd', 'x_1_1': 'ad', 'x_1_2': 'oo'}. Best is trial 74 with value: 0.8222222222222222.
2024-12-07 01:22:14,888 - INFO - Candidate Mean Stats: {'Max': np.float64(2.0), 'Min': np.float64(0.23497611778886993), 'Mean': np.float64(0.489591815257017), 'Std': np.float64(0.0812379934813586)}
2024-12-07 01:22:14,888 - INFO - Candidate Std Stats: {'Max': np.float64(0.5174000653128797), 'Min': np.float64(0.0), 'Mean': np.float64(0.10762788414144402), 'Std': np.float64(0.04738891371278604)}
[I 2024-12-07 01:22:14,931] Trial 277 finished with value: 1.3 and parameters: {'x_0_0': 'oo', 'x_0_1': 'oo', 'x_0_2': 'ad', 'x_1_0': 'oo', 'x_1_1': 'ac', 'x_1_2': 'ab'}. Best is trial 49 with value: 0.7999999999999999.
2024-12-07 01:22:22,948 - INFO - Candidate Mean Stats: {'Max': np.float64(2.0), 'Min': np.float64(0.20298507695435597), 'Mean': np.float64(0.488228544309015), 'Std': np.float64(0.0825716477762841)}
2024-12-07 01:22:22,949 - INFO - Candidate Std Stats: {'Max': np.float64(0.3781337042701424), 'Min': np.float64(0.0), 'Mean': np.float64(0.1004606839190773), 'Std': np.float64(0.04359815185257539)}
[I 2024-12-07 01:22:22,993] Trial 278 finished with value: 1.1666666666666665 and parameters: {'x_0_0': 'ac', 'x_0_1': 'oo', 'x_0_2': 'ac', 'x_1_0': 'cd', 'x_1_1': 'ac', 'x_1_2': 'oo'}. Best is trial 148 with value: 0.8333333333333333.
2024-12-07 01:22:23,025 - INFO - Candidate Mean Stats: {'Max': np.float64(2.0), 'Min': np.float64(0.2673483965395534), 'Mean': np.float64(0.486739445571389), 'Std': np.float64(0.08170622732314574)}
2024-12-07 01:22:23,026 - INFO - Candidate Std Stats: {'Max': np.float64(1.8855089892919712), 'Min': np.float64(0.0), 'Mean': np.float64(0.09750116043873437), 'Std': np.float64(0.05132867742585754)}
[I 2024-12-07 01:22:23,072] Trial 277 finished with value: 1.7000000000000002 and parameters: {'x_0_0': 'oo', 'x_0_1': 'ac', 'x_0_2': 'oo', 'x_1_0': 'ab', 'x_1_1': 'oo', 'x_1_2': 'bc'}. Best is trial 200 with value: 0.6.
2024-12-07 01:22:28,858 - INFO - Candidate Mean Stats: {'Max': np.float64(2.0), 'Min': np.float64(0.2599701713426281), 'Mean': np.float64(0.49408458473268935), 'Std': np.float64(0.08468767101480762)}
2024-12-07 01:22:28,859 - INFO - Candidate Std Stats: {'Max': np.float64(0.5760783006027075), 'Min': np.float64(0.0), 'Mean': np.float64(0.10708117795552016), 'Std': np.float64(0.049139352688522396)}
[I 2024-12-07 01:22:28,902] Trial 277 finished with value: 1.5666666666666667 and parameters: {'x_0_0': 'bd', 'x_0_1': 'cd', 'x_0_2': 'cd', 'x_1_0': 'ad', 'x_1_1': 'oo', 'x_1_2': 'ab'}. Best is trial 74 with value: 0.8222222222222222.
2024-12-07 01:22:35,348 - INFO - Candidate Mean Stats: {'Max': np.float64(2.0), 'Min': np.float64(0.2649135045891803), 'Mean': np.float64(0.49245259326381147), 'Std': np.float64(0.07616089479334855)}
2024-12-07 01:22:35,349 - INFO - Candidate Std Stats: {'Max': np.float64(0.36039918015126876), 'Min': np.float64(0.0), 'Mean': np.float64(0.10206602593262501), 'Std': np.float64(0.040718496714638557)}
[I 2024-12-07 01:22:35,392] Trial 278 finished with value: 0.9666666666666667 and parameters: {'x_0_0': 'ac', 'x_0_1': 'oo', 'x_0_2': 'ad', 'x_1_0': 'oo', 'x_1_1': 'cd', 'x_1_2': 'oo'}. Best is trial 49 with value: 0.7999999999999999.
2024-12-07 01:22:43,210 - INFO - Candidate Mean Stats: {'Max': np.float64(2.0), 'Min': np.float64(0.18653738204551099), 'Mean': np.float64(0.4917131674466943), 'Std': np.float64(0.08070261885657733)}
2024-12-07 01:22:43,210 - INFO - Candidate Std Stats: {'Max': np.float64(0.38563260170547653), 'Min': np.float64(0.0), 'Mean': np.float64(0.10222670691024878), 'Std': np.float64(0.04315244705714336)}
[I 2024-12-07 01:22:43,253] Trial 279 finished with value: 1.1666666666666665 and parameters: {'x_0_0': 'ac', 'x_0_1': 'oo', 'x_0_2': 'bc', 'x_1_0': 'ad', 'x_1_1': 'ad', 'x_1_2': 'oo'}. Best is trial 148 with value: 0.8333333333333333.
2024-12-07 01:22:43,634 - INFO - Candidate Mean Stats: {'Max': np.float64(2.0), 'Min': np.float64(0.2251565218058857), 'Mean': np.float64(0.487256427563729), 'Std': np.float64(0.07713050541997908)}
2024-12-07 01:22:43,634 - INFO - Candidate Std Stats: {'Max': np.float64(0.40119742901849137), 'Min': np.float64(0.0), 'Mean': np.float64(0.10128696227527216), 'Std': np.float64(0.04443318683384189)}
[I 2024-12-07 01:22:43,676] Trial 278 finished with value: 1.0666666666666667 and parameters: {'x_0_0': 'bc', 'x_0_1': 'oo', 'x_0_2': 'ad', 'x_1_0': 'bd', 'x_1_1': 'oo', 'x_1_2': 'oo'}. Best is trial 200 with value: 0.6.
2024-12-07 01:22:49,376 - INFO - Candidate Mean Stats: {'Max': np.float64(2.0), 'Min': np.float64(0.15587337334694423), 'Mean': np.float64(0.4839763502358731), 'Std': np.float64(0.08152175868483401)}
2024-12-07 01:22:49,376 - INFO - Candidate Std Stats: {'Max': np.float64(1.6848344371623458), 'Min': np.float64(0.0), 'Mean': np.float64(0.1046265125691256), 'Std': np.float64(0.05015429940264212)}
[I 2024-12-07 01:22:49,421] Trial 278 finished with value: 1.4666666666666666 and parameters: {'x_0_0': 'bd', 'x_0_1': 'ac', 'x_0_2': 'ab', 'x_1_0': 'oo', 'x_1_1': 'bd', 'x_1_2': 'ad'}. Best is trial 74 with value: 0.8222222222222222.
2024-12-07 01:22:55,711 - INFO - Candidate Mean Stats: {'Max': np.float64(2.0), 'Min': np.float64(0.24294750297390894), 'Mean': np.float64(0.4895369261642883), 'Std': np.float64(0.07706035192299052)}
2024-12-07 01:22:55,711 - INFO - Candidate Std Stats: {'Max': np.float64(0.3838176080477951), 'Min': np.float64(0.0), 'Mean': np.float64(0.09669000467815879), 'Std': np.float64(0.03899536086779537)}
[I 2024-12-07 01:22:55,755] Trial 279 finished with value: 0.9666666666666667 and parameters: {'x_0_0': 'bc', 'x_0_1': 'oo', 'x_0_2': 'oo', 'x_1_0': 'oo', 'x_1_1': 'bc', 'x_1_2': 'bc'}. Best is trial 49 with value: 0.7999999999999999.
2024-12-07 01:23:03,613 - INFO - Candidate Mean Stats: {'Max': np.float64(2.0), 'Min': np.float64(0.20158070698371042), 'Mean': np.float64(0.49646955243977164), 'Std': np.float64(0.08554632976043752)}
2024-12-07 01:23:03,613 - INFO - Candidate Std Stats: {'Max': np.float64(0.9234711367631848), 'Min': np.float64(0.0), 'Mean': np.float64(0.11440463259282926), 'Std': np.float64(0.05168321499189656)}
[I 2024-12-07 01:23:03,657] Trial 280 finished with value: 1.2666666666666666 and parameters: {'x_0_0': 'bc', 'x_0_1': 'oo', 'x_0_2': 'bd', 'x_1_0': 'bd', 'x_1_1': 'bd', 'x_1_2': 'ab'}. Best is trial 148 with value: 0.8333333333333333.
2024-12-07 01:23:04,205 - INFO - Candidate Mean Stats: {'Max': np.float64(2.0), 'Min': np.float64(0.284435732520157), 'Mean': np.float64(0.4912678985524392), 'Std': np.float64(0.07856204857737985)}
2024-12-07 01:23:04,205 - INFO - Candidate Std Stats: {'Max': np.float64(1.0801675007076181), 'Min': np.float64(0.0), 'Mean': np.float64(0.11523892192885912), 'Std': np.float64(0.05163874779927325)}
[I 2024-12-07 01:23:04,252] Trial 279 finished with value: 1.7777777777777777 and parameters: {'x_0_0': 'ab', 'x_0_1': 'bd', 'x_0_2': 'bd', 'x_1_0': 'bc', 'x_1_1': 'bd', 'x_1_2': 'bd'}. Best is trial 200 with value: 0.6.
2024-12-07 01:23:09,900 - INFO - Candidate Mean Stats: {'Max': np.float64(2.0), 'Min': np.float64(0.2671223993138506), 'Mean': np.float64(0.4957254599819865), 'Std': np.float64(0.08230056410500099)}
2024-12-07 01:23:09,900 - INFO - Candidate Std Stats: {'Max': np.float64(0.7656246580817865), 'Min': np.float64(0.0), 'Mean': np.float64(0.1115941517156564), 'Std': np.float64(0.05055181877011298)}
[I 2024-12-07 01:23:09,945] Trial 279 finished with value: 1.1666666666666665 and parameters: {'x_0_0': 'bc', 'x_0_1': 'oo', 'x_0_2': 'ac', 'x_1_0': 'ad', 'x_1_1': 'oo', 'x_1_2': 'cd'}. Best is trial 74 with value: 0.8222222222222222.
2024-12-07 01:23:15,895 - INFO - Candidate Mean Stats: {'Max': np.float64(2.0), 'Min': np.float64(0.2627600929162791), 'Mean': np.float64(0.4863648717655288), 'Std': np.float64(0.07962744472486258)}
2024-12-07 01:23:15,896 - INFO - Candidate Std Stats: {'Max': np.float64(0.9001071611160304), 'Min': np.float64(0.0), 'Mean': np.float64(0.10320203816793529), 'Std': np.float64(0.04478787893727234)}
[I 2024-12-07 01:23:15,940] Trial 280 finished with value: 1.3666666666666667 and parameters: {'x_0_0': 'bd', 'x_0_1': 'ab', 'x_0_2': 'oo', 'x_1_0': 'oo', 'x_1_1': 'ac', 'x_1_2': 'bd'}. Best is trial 49 with value: 0.7999999999999999.
2024-12-07 01:23:23,985 - INFO - Candidate Mean Stats: {'Max': np.float64(2.0), 'Min': np.float64(0.2506414709791146), 'Mean': np.float64(0.4955202310373624), 'Std': np.float64(0.08283187128426697)}
2024-12-07 01:23:23,986 - INFO - Candidate Std Stats: {'Max': np.float64(0.42784294890413105), 'Min': np.float64(0.0), 'Mean': np.float64(0.10896226764031895), 'Std': np.float64(0.046398441905384336)}
[I 2024-12-07 01:23:24,027] Trial 281 finished with value: 1.3666666666666667 and parameters: {'x_0_0': 'bc', 'x_0_1': 'cd', 'x_0_2': 'oo', 'x_1_0': 'oo', 'x_1_1': 'bd', 'x_1_2': 'cd'}. Best is trial 148 with value: 0.8333333333333333.
2024-12-07 01:23:24,534 - INFO - Candidate Mean Stats: {'Max': np.float64(2.0), 'Min': np.float64(0.22970738962112563), 'Mean': np.float64(0.48591480858825625), 'Std': np.float64(0.08646995595679693)}
2024-12-07 01:23:24,535 - INFO - Candidate Std Stats: {'Max': np.float64(1.1898476691890711), 'Min': np.float64(0.0), 'Mean': np.float64(0.11956614586577474), 'Std': np.float64(0.05983993660113586)}
[I 2024-12-07 01:23:24,579] Trial 280 finished with value: 1.6666666666666665 and parameters: {'x_0_0': 'ad', 'x_0_1': 'cd', 'x_0_2': 'bd', 'x_1_0': 'ad', 'x_1_1': 'cd', 'x_1_2': 'cd'}. Best is trial 200 with value: 0.6.
2024-12-07 01:23:30,447 - INFO - Candidate Mean Stats: {'Max': np.float64(2.0), 'Min': np.float64(0.15846648168212965), 'Mean': np.float64(0.4851885851270583), 'Std': np.float64(0.0804343572632841)}
2024-12-07 01:23:30,448 - INFO - Candidate Std Stats: {'Max': np.float64(1.6255469163977299), 'Min': np.float64(0.0), 'Mean': np.float64(0.10064847683732978), 'Std': np.float64(0.054773803117176625)}
[I 2024-12-07 01:23:30,493] Trial 280 finished with value: 0.6222222222222222 and parameters: {'x_0_0': 'bd', 'x_0_1': 'oo', 'x_0_2': 'oo', 'x_1_0': 'bc', 'x_1_1': 'ad', 'x_1_2': 'oo'}. Best is trial 280 with value: 0.6222222222222222.
2024-12-07 01:23:36,078 - INFO - Candidate Mean Stats: {'Max': np.float64(2.0), 'Min': np.float64(0.2542339251173135), 'Mean': np.float64(0.4919068968660152), 'Std': np.float64(0.07775742731851215)}
2024-12-07 01:23:36,078 - INFO - Candidate Std Stats: {'Max': np.float64(0.3089803935781106), 'Min': np.float64(0.0), 'Mean': np.float64(0.09987862625779712), 'Std': np.float64(0.04028292385891837)}
[I 2024-12-07 01:23:36,125] Trial 281 finished with value: 1.4666666666666666 and parameters: {'x_0_0': 'bd', 'x_0_1': 'ad', 'x_0_2': 'oo', 'x_1_0': 'ad', 'x_1_1': 'ab', 'x_1_2': 'oo'}. Best is trial 49 with value: 0.7999999999999999.
2024-12-07 01:23:44,431 - INFO - Candidate Mean Stats: {'Max': np.float64(2.0), 'Min': np.float64(0.2718429010686593), 'Mean': np.float64(0.4948786501695253), 'Std': np.float64(0.07631297850585132)}
2024-12-07 01:23:44,432 - INFO - Candidate Std Stats: {'Max': np.float64(0.4350494500254449), 'Min': np.float64(0.0), 'Mean': np.float64(0.1037273198450167), 'Std': np.float64(0.04176691844674783)}
[I 2024-12-07 01:23:44,476] Trial 282 finished with value: 1.4555555555555555 and parameters: {'x_0_0': 'bd', 'x_0_1': 'ac', 'x_0_2': 'oo', 'x_1_0': 'ab', 'x_1_1': 'ad', 'x_1_2': 'ad'}. Best is trial 148 with value: 0.8333333333333333.
2024-12-07 01:23:45,119 - INFO - Candidate Mean Stats: {'Max': np.float64(2.0), 'Min': np.float64(0.2358540222003173), 'Mean': np.float64(0.4903477514163473), 'Std': np.float64(0.07891576942152775)}
2024-12-07 01:23:45,119 - INFO - Candidate Std Stats: {'Max': np.float64(1.4312383132977538), 'Min': np.float64(0.0), 'Mean': np.float64(0.10399573187392218), 'Std': np.float64(0.05013951862419159)}
[I 2024-12-07 01:23:45,172] Trial 281 finished with value: 1.5666666666666664 and parameters: {'x_0_0': 'bd', 'x_0_1': 'ad', 'x_0_2': 'oo', 'x_1_0': 'ac', 'x_1_1': 'bd', 'x_1_2': 'ac'}. Best is trial 200 with value: 0.6.
2024-12-07 01:23:51,416 - INFO - Candidate Mean Stats: {'Max': np.float64(2.0), 'Min': np.float64(0.2538059907931973), 'Mean': np.float64(0.49411339311045377), 'Std': np.float64(0.07557143859254985)}
2024-12-07 01:23:51,416 - INFO - Candidate Std Stats: {'Max': np.float64(1.3620877565422855), 'Min': np.float64(0.0), 'Mean': np.float64(0.10266799481108456), 'Std': np.float64(0.04892252461058887)}
