Running: python3 experiments/tf_continual.py --timestamp 2024-12-28_14-58-36 --function warcraft --seed 0 --map_option 1 --tf_method cp --tf_rank 3 --tf_lr 0.01 --tf_tol 1e-6 --tf_reg_lambda 0 --tf_constraint_lambda 3.0 --decomp_iter_num 10 --mask_ratio 1 --n_startup_trials 1 --acquisition_function ucb --acq_trade_off_param 1.0 --iter_bo 2000 --plot_save_dir results/2024-12-28_14-58-36/plots
Running: python3 experiments/tf_continual.py --timestamp 2024-12-28_14-58-36 --function warcraft --seed 1 --map_option 1 --tf_method cp --tf_rank 3 --tf_lr 0.01 --tf_tol 1e-6 --tf_reg_lambda 0 --tf_constraint_lambda 3.0 --decomp_iter_num 10 --mask_ratio 1 --n_startup_trials 1 --acquisition_function ucb --acq_trade_off_param 1.0 --iter_bo 2000 --plot_save_dir results/2024-12-28_14-58-36/plots
Running: python3 experiments/tf_continual.py --timestamp 2024-12-28_14-58-36 --function warcraft --seed 2 --map_option 1 --tf_method cp --tf_rank 3 --tf_lr 0.01 --tf_tol 1e-6 --tf_reg_lambda 0 --tf_constraint_lambda 3.0 --decomp_iter_num 10 --mask_ratio 1 --n_startup_trials 1 --acquisition_function ucb --acq_trade_off_param 1.0 --iter_bo 2000 --plot_save_dir results/2024-12-28_14-58-36/plots
Running: python3 experiments/tf_continual.py --timestamp 2024-12-28_14-58-36 --function warcraft --seed 3 --map_option 1 --tf_method cp --tf_rank 3 --tf_lr 0.01 --tf_tol 1e-6 --tf_reg_lambda 0 --tf_constraint_lambda 3.0 --decomp_iter_num 10 --mask_ratio 1 --n_startup_trials 1 --acquisition_function ucb --acq_trade_off_param 1.0 --iter_bo 2000 --plot_save_dir results/2024-12-28_14-58-36/plots
Running: python3 experiments/tf_continual.py --timestamp 2024-12-28_14-58-36 --function warcraft --seed 4 --map_option 1 --tf_method cp --tf_rank 3 --tf_lr 0.01 --tf_tol 1e-6 --tf_reg_lambda 0 --tf_constraint_lambda 3.0 --decomp_iter_num 10 --mask_ratio 1 --n_startup_trials 1 --acquisition_function ucb --acq_trade_off_param 1.0 --iter_bo 2000 --plot_save_dir results/2024-12-28_14-58-36/plots
Running: python3 experiments/tf_continual.py --timestamp 2024-12-28_14-58-36 --function warcraft --seed 5 --map_option 1 --tf_method cp --tf_rank 3 --tf_lr 0.01 --tf_tol 1e-6 --tf_reg_lambda 0 --tf_constraint_lambda 3.0 --decomp_iter_num 10 --mask_ratio 1 --n_startup_trials 1 --acquisition_function ucb --acq_trade_off_param 1.0 --iter_bo 2000 --plot_save_dir results/2024-12-28_14-58-36/plots
Running: python3 experiments/tf_continual.py --timestamp 2024-12-28_14-58-36 --function warcraft --seed 6 --map_option 1 --tf_method cp --tf_rank 3 --tf_lr 0.01 --tf_tol 1e-6 --tf_reg_lambda 0 --tf_constraint_lambda 3.0 --decomp_iter_num 10 --mask_ratio 1 --n_startup_trials 1 --acquisition_function ucb --acq_trade_off_param 1.0 --iter_bo 2000 --plot_save_dir results/2024-12-28_14-58-36/plots
Running: python3 experiments/tf_continual.py --timestamp 2024-12-28_14-58-36 --function warcraft --seed 7 --map_option 1 --tf_method cp --tf_rank 3 --tf_lr 0.01 --tf_tol 1e-6 --tf_reg_lambda 0 --tf_constraint_lambda 3.0 --decomp_iter_num 10 --mask_ratio 1 --n_startup_trials 1 --acquisition_function ucb --acq_trade_off_param 1.0 --iter_bo 2000 --plot_save_dir results/2024-12-28_14-58-36/plots
Running: python3 experiments/tf_continual.py --timestamp 2024-12-28_14-58-36 --function warcraft --seed 8 --map_option 1 --tf_method cp --tf_rank 3 --tf_lr 0.01 --tf_tol 1e-6 --tf_reg_lambda 0 --tf_constraint_lambda 3.0 --decomp_iter_num 10 --mask_ratio 1 --n_startup_trials 1 --acquisition_function ucb --acq_trade_off_param 1.0 --iter_bo 2000 --plot_save_dir results/2024-12-28_14-58-36/plots
Running: python3 experiments/tf_continual.py --timestamp 2024-12-28_14-58-36 --function warcraft --seed 9 --map_option 1 --tf_method cp --tf_rank 3 --tf_lr 0.01 --tf_tol 1e-6 --tf_reg_lambda 0 --tf_constraint_lambda 3.0 --decomp_iter_num 10 --mask_ratio 1 --n_startup_trials 1 --acquisition_function ucb --acq_trade_off_param 1.0 --iter_bo 2000 --plot_save_dir results/2024-12-28_14-58-36/plots
2024-12-28 14:58:39,392 - INFO - Experiment settings: {'name': '2024-12-28_14-58-36_warcraft_map1_cp_seed6', 'seed': 6, 'dimension': 2, 'function': 'warcraft', 'constraint': False, 'direction': False, 'map': array([[0.125, 0.5  ],
       [0.25 , 0.125]]), 'iter_bo': 2000, 'storage': 'sqlite:///results/2024-12-28_14-58-36/warcraft_map1_cp_seed6.db', 'plot_save_dir': 'results/2024-12-28_14-58-36/plots', 'tf_settings': {'method': 'cp', 'rank': 3, 'optim_params': {'lr': 0.01, 'max_iter': None, 'tol': 1e-06, 'reg_lambda': 0.0, 'constraint_lambda': 3.0}}, 'acqf_settings': {'acquisition_function': 'ucb', 'trade_off_param': 1.0}, 'sampler_settings': {'decomp_iter_num': 10, 'mask_ratio': 1.0, 'include_observed_points': False, 'unique_sampling': False, 'n_startup_trials': 1}}
2024-12-28 14:58:39,392 - INFO - Experiment settings: {'name': '2024-12-28_14-58-36_warcraft_map1_cp_seed1', 'seed': 1, 'dimension': 2, 'function': 'warcraft', 'constraint': False, 'direction': False, 'map': array([[0.125, 0.5  ],
       [0.25 , 0.125]]), 'iter_bo': 2000, 'storage': 'sqlite:///results/2024-12-28_14-58-36/warcraft_map1_cp_seed1.db', 'plot_save_dir': 'results/2024-12-28_14-58-36/plots', 'tf_settings': {'method': 'cp', 'rank': 3, 'optim_params': {'lr': 0.01, 'max_iter': None, 'tol': 1e-06, 'reg_lambda': 0.0, 'constraint_lambda': 3.0}}, 'acqf_settings': {'acquisition_function': 'ucb', 'trade_off_param': 1.0}, 'sampler_settings': {'decomp_iter_num': 10, 'mask_ratio': 1.0, 'include_observed_points': False, 'unique_sampling': False, 'n_startup_trials': 1}}
2024-12-28 14:58:39,392 - INFO - Experiment settings: {'name': '2024-12-28_14-58-36_warcraft_map1_cp_seed0', 'seed': 0, 'dimension': 2, 'function': 'warcraft', 'constraint': False, 'direction': False, 'map': array([[0.125, 0.5  ],
       [0.25 , 0.125]]), 'iter_bo': 2000, 'storage': 'sqlite:///results/2024-12-28_14-58-36/warcraft_map1_cp_seed0.db', 'plot_save_dir': 'results/2024-12-28_14-58-36/plots', 'tf_settings': {'method': 'cp', 'rank': 3, 'optim_params': {'lr': 0.01, 'max_iter': None, 'tol': 1e-06, 'reg_lambda': 0.0, 'constraint_lambda': 3.0}}, 'acqf_settings': {'acquisition_function': 'ucb', 'trade_off_param': 1.0}, 'sampler_settings': {'decomp_iter_num': 10, 'mask_ratio': 1.0, 'include_observed_points': False, 'unique_sampling': False, 'n_startup_trials': 1}}
2024-12-28 14:58:39,394 - INFO - Experiment settings: {'name': '2024-12-28_14-58-36_warcraft_map1_cp_seed4', 'seed': 4, 'dimension': 2, 'function': 'warcraft', 'constraint': False, 'direction': False, 'map': array([[0.125, 0.5  ],
       [0.25 , 0.125]]), 'iter_bo': 2000, 'storage': 'sqlite:///results/2024-12-28_14-58-36/warcraft_map1_cp_seed4.db', 'plot_save_dir': 'results/2024-12-28_14-58-36/plots', 'tf_settings': {'method': 'cp', 'rank': 3, 'optim_params': {'lr': 0.01, 'max_iter': None, 'tol': 1e-06, 'reg_lambda': 0.0, 'constraint_lambda': 3.0}}, 'acqf_settings': {'acquisition_function': 'ucb', 'trade_off_param': 1.0}, 'sampler_settings': {'decomp_iter_num': 10, 'mask_ratio': 1.0, 'include_observed_points': False, 'unique_sampling': False, 'n_startup_trials': 1}}
2024-12-28 14:58:39,394 - INFO - Experiment settings: {'name': '2024-12-28_14-58-36_warcraft_map1_cp_seed3', 'seed': 3, 'dimension': 2, 'function': 'warcraft', 'constraint': False, 'direction': False, 'map': array([[0.125, 0.5  ],
       [0.25 , 0.125]]), 'iter_bo': 2000, 'storage': 'sqlite:///results/2024-12-28_14-58-36/warcraft_map1_cp_seed3.db', 'plot_save_dir': 'results/2024-12-28_14-58-36/plots', 'tf_settings': {'method': 'cp', 'rank': 3, 'optim_params': {'lr': 0.01, 'max_iter': None, 'tol': 1e-06, 'reg_lambda': 0.0, 'constraint_lambda': 3.0}}, 'acqf_settings': {'acquisition_function': 'ucb', 'trade_off_param': 1.0}, 'sampler_settings': {'decomp_iter_num': 10, 'mask_ratio': 1.0, 'include_observed_points': False, 'unique_sampling': False, 'n_startup_trials': 1}}
2024-12-28 14:58:39,395 - INFO - Experiment settings: {'name': '2024-12-28_14-58-36_warcraft_map1_cp_seed5', 'seed': 5, 'dimension': 2, 'function': 'warcraft', 'constraint': False, 'direction': False, 'map': array([[0.125, 0.5  ],
       [0.25 , 0.125]]), 'iter_bo': 2000, 'storage': 'sqlite:///results/2024-12-28_14-58-36/warcraft_map1_cp_seed5.db', 'plot_save_dir': 'results/2024-12-28_14-58-36/plots', 'tf_settings': {'method': 'cp', 'rank': 3, 'optim_params': {'lr': 0.01, 'max_iter': None, 'tol': 1e-06, 'reg_lambda': 0.0, 'constraint_lambda': 3.0}}, 'acqf_settings': {'acquisition_function': 'ucb', 'trade_off_param': 1.0}, 'sampler_settings': {'decomp_iter_num': 10, 'mask_ratio': 1.0, 'include_observed_points': False, 'unique_sampling': False, 'n_startup_trials': 1}}
2024-12-28 14:58:39,397 - INFO - Experiment settings: {'name': '2024-12-28_14-58-36_warcraft_map1_cp_seed2', 'seed': 2, 'dimension': 2, 'function': 'warcraft', 'constraint': False, 'direction': False, 'map': array([[0.125, 0.5  ],
       [0.25 , 0.125]]), 'iter_bo': 2000, 'storage': 'sqlite:///results/2024-12-28_14-58-36/warcraft_map1_cp_seed2.db', 'plot_save_dir': 'results/2024-12-28_14-58-36/plots', 'tf_settings': {'method': 'cp', 'rank': 3, 'optim_params': {'lr': 0.01, 'max_iter': None, 'tol': 1e-06, 'reg_lambda': 0.0, 'constraint_lambda': 3.0}}, 'acqf_settings': {'acquisition_function': 'ucb', 'trade_off_param': 1.0}, 'sampler_settings': {'decomp_iter_num': 10, 'mask_ratio': 1.0, 'include_observed_points': False, 'unique_sampling': False, 'n_startup_trials': 1}}
2024-12-28 14:58:39,416 - INFO - Experiment settings: {'name': '2024-12-28_14-58-36_warcraft_map1_cp_seed8', 'seed': 8, 'dimension': 2, 'function': 'warcraft', 'constraint': False, 'direction': False, 'map': array([[0.125, 0.5  ],
       [0.25 , 0.125]]), 'iter_bo': 2000, 'storage': 'sqlite:///results/2024-12-28_14-58-36/warcraft_map1_cp_seed8.db', 'plot_save_dir': 'results/2024-12-28_14-58-36/plots', 'tf_settings': {'method': 'cp', 'rank': 3, 'optim_params': {'lr': 0.01, 'max_iter': None, 'tol': 1e-06, 'reg_lambda': 0.0, 'constraint_lambda': 3.0}}, 'acqf_settings': {'acquisition_function': 'ucb', 'trade_off_param': 1.0}, 'sampler_settings': {'decomp_iter_num': 10, 'mask_ratio': 1.0, 'include_observed_points': False, 'unique_sampling': False, 'n_startup_trials': 1}}
2024-12-28 14:58:39,476 - INFO - Experiment settings: {'name': '2024-12-28_14-58-36_warcraft_map1_cp_seed9', 'seed': 9, 'dimension': 2, 'function': 'warcraft', 'constraint': False, 'direction': False, 'map': array([[0.125, 0.5  ],
       [0.25 , 0.125]]), 'iter_bo': 2000, 'storage': 'sqlite:///results/2024-12-28_14-58-36/warcraft_map1_cp_seed9.db', 'plot_save_dir': 'results/2024-12-28_14-58-36/plots', 'tf_settings': {'method': 'cp', 'rank': 3, 'optim_params': {'lr': 0.01, 'max_iter': None, 'tol': 1e-06, 'reg_lambda': 0.0, 'constraint_lambda': 3.0}}, 'acqf_settings': {'acquisition_function': 'ucb', 'trade_off_param': 1.0}, 'sampler_settings': {'decomp_iter_num': 10, 'mask_ratio': 1.0, 'include_observed_points': False, 'unique_sampling': False, 'n_startup_trials': 1}}
2024-12-28 14:58:39,478 - INFO - Experiment settings: {'name': '2024-12-28_14-58-36_warcraft_map1_cp_seed7', 'seed': 7, 'dimension': 2, 'function': 'warcraft', 'constraint': False, 'direction': False, 'map': array([[0.125, 0.5  ],
       [0.25 , 0.125]]), 'iter_bo': 2000, 'storage': 'sqlite:///results/2024-12-28_14-58-36/warcraft_map1_cp_seed7.db', 'plot_save_dir': 'results/2024-12-28_14-58-36/plots', 'tf_settings': {'method': 'cp', 'rank': 3, 'optim_params': {'lr': 0.01, 'max_iter': None, 'tol': 1e-06, 'reg_lambda': 0.0, 'constraint_lambda': 3.0}}, 'acqf_settings': {'acquisition_function': 'ucb', 'trade_off_param': 1.0}, 'sampler_settings': {'decomp_iter_num': 10, 'mask_ratio': 1.0, 'include_observed_points': False, 'unique_sampling': False, 'n_startup_trials': 1}}
[I 2024-12-28 14:58:40,085] A new study created in RDB with name: 2024-12-28_14-58-36_warcraft_map1_cp_seed2
[I 2024-12-28 14:58:40,087] A new study created in RDB with name: 2024-12-28_14-58-36_warcraft_map1_cp_seed1
[I 2024-12-28 14:58:40,096] A new study created in RDB with name: 2024-12-28_14-58-36_warcraft_map1_cp_seed3
[I 2024-12-28 14:58:40,107] A new study created in RDB with name: 2024-12-28_14-58-36_warcraft_map1_cp_seed4
[I 2024-12-28 14:58:40,111] A new study created in RDB with name: 2024-12-28_14-58-36_warcraft_map1_cp_seed5
2024-12-28 14:58:40,117 - INFO - Using sample_independent for sampling with RandomSampler sampler.
2024-12-28 14:58:40,125 - INFO - Using sample_independent for sampling with RandomSampler sampler.
2024-12-28 14:58:40,132 - INFO - Using sample_independent for sampling with RandomSampler sampler.
[I 2024-12-28 14:58:40,134] A new study created in RDB with name: 2024-12-28_14-58-36_warcraft_map1_cp_seed6
2024-12-28 14:58:40,134 - INFO - Using sample_independent for sampling with RandomSampler sampler.
2024-12-28 14:58:40,136 - INFO - Using sample_independent for sampling with RandomSampler sampler.
2024-12-28 14:58:40,137 - INFO - Using sample_independent for sampling with RandomSampler sampler.
2024-12-28 14:58:40,138 - INFO - Using sample_independent for sampling with RandomSampler sampler.
2024-12-28 14:58:40,140 - INFO - Using sample_independent for sampling with RandomSampler sampler.
2024-12-28 14:58:40,141 - INFO - Using sample_independent for sampling with RandomSampler sampler.
2024-12-28 14:58:40,146 - INFO - Using sample_independent for sampling with RandomSampler sampler.
2024-12-28 14:58:40,148 - INFO - Using sample_independent for sampling with RandomSampler sampler.
2024-12-28 14:58:40,150 - INFO - Using sample_independent for sampling with RandomSampler sampler.
2024-12-28 14:58:40,152 - INFO - Using sample_independent for sampling with RandomSampler sampler.
2024-12-28 14:58:40,152 - INFO - Using sample_independent for sampling with RandomSampler sampler.
2024-12-28 14:58:40,154 - INFO - Using sample_independent for sampling with RandomSampler sampler.
[I 2024-12-28 14:58:40,155] Trial 0 finished with value: 1.3214285714285714 and parameters: {'x_0_0': 'bd', 'x_0_1': 'bd', 'x_1_0': 'oo', 'x_1_1': 'bc'}. Best is trial 0 with value: 1.3214285714285714.
2024-12-28 14:58:40,155 - INFO - Using sample_independent for sampling with RandomSampler sampler.
2024-12-28 14:58:40,160 - INFO - Using sample_independent for sampling with RandomSampler sampler.
2024-12-28 14:58:40,161 - INFO - Using sample_independent for sampling with RandomSampler sampler.
2024-12-28 14:58:40,162 - INFO - Using sample_independent for sampling with RandomSampler sampler.
2024-12-28 14:58:40,164 - INFO - Using sample_independent for sampling with RandomSampler sampler.
2024-12-28 14:58:40,165 - INFO - Using sample_independent for sampling with RandomSampler sampler.
2024-12-28 14:58:40,166 - INFO - Using sample_independent for sampling with RandomSampler sampler.
[I 2024-12-28 14:58:40,167] A new study created in RDB with name: 2024-12-28_14-58-36_warcraft_map1_cp_seed0
2024-12-28 14:58:40,168 - INFO - Using sample_independent for sampling with RandomSampler sampler.
[I 2024-12-28 14:58:40,169] Trial 0 finished with value: 1.0 and parameters: {'x_0_0': 'ac', 'x_0_1': 'ad', 'x_1_0': 'ac', 'x_1_1': 'bc'}. Best is trial 0 with value: 1.0.
2024-12-28 14:58:40,170 - INFO - Using sample_independent for sampling with RandomSampler sampler.
[I 2024-12-28 14:58:40,176] Trial 0 finished with value: 1.5892857142857144 and parameters: {'x_0_0': 'ab', 'x_0_1': 'cd', 'x_1_0': 'cd', 'x_1_1': 'oo'}. Best is trial 0 with value: 1.5892857142857144.
[I 2024-12-28 14:58:40,182] Trial 0 finished with value: 1.875 and parameters: {'x_0_0': 'oo', 'x_0_1': 'bc', 'x_1_0': 'ab', 'x_1_1': 'cd'}. Best is trial 0 with value: 1.875.
[I 2024-12-28 14:58:40,186] A new study created in RDB with name: 2024-12-28_14-58-36_warcraft_map1_cp_seed8
[I 2024-12-28 14:58:40,189] Trial 0 finished with value: 1.3214285714285714 and parameters: {'x_0_0': 'ad', 'x_0_1': 'bc', 'x_1_0': 'oo', 'x_1_1': 'cd'}. Best is trial 0 with value: 1.3214285714285714.
[I 2024-12-28 14:58:40,190] Trial 0 finished with value: 1.875 and parameters: {'x_0_0': 'cd', 'x_0_1': 'cd', 'x_1_0': 'bd', 'x_1_1': 'oo'}. Best is trial 0 with value: 1.875.
2024-12-28 14:58:40,212 - INFO - Using sample_independent for sampling with RandomSampler sampler.
[I 2024-12-28 14:58:40,216] A new study created in RDB with name: 2024-12-28_14-58-36_warcraft_map1_cp_seed9
2024-12-28 14:58:40,216 - INFO - Using sample_independent for sampling with RandomSampler sampler.
2024-12-28 14:58:40,222 - INFO - Using sample_independent for sampling with RandomSampler sampler.
2024-12-28 14:58:40,223 - INFO - Using sample_independent for sampling with RandomSampler sampler.
2024-12-28 14:58:40,226 - INFO - Using sample_independent for sampling with RandomSampler sampler.
2024-12-28 14:58:40,229 - INFO - Using sample_independent for sampling with RandomSampler sampler.
[I 2024-12-28 14:58:40,229] A new study created in RDB with name: 2024-12-28_14-58-36_warcraft_map1_cp_seed7
2024-12-28 14:58:40,232 - INFO - Using sample_independent for sampling with RandomSampler sampler.
2024-12-28 14:58:40,234 - INFO - Using sample_independent for sampling with RandomSampler sampler.
[I 2024-12-28 14:58:40,244] Trial 0 finished with value: 1.5892857142857144 and parameters: {'x_0_0': 'ab', 'x_0_1': 'bd', 'x_1_0': 'ad', 'x_1_1': 'oo'}. Best is trial 0 with value: 1.5892857142857144.
[I 2024-12-28 14:58:40,246] Trial 0 finished with value: 1.7142857142857144 and parameters: {'x_0_0': 'ab', 'x_0_1': 'ab', 'x_1_0': 'cd', 'x_1_1': 'cd'}. Best is trial 0 with value: 1.7142857142857144.
2024-12-28 14:58:40,263 - INFO - Using sample_independent for sampling with RandomSampler sampler.
2024-12-28 14:58:40,267 - INFO - Using sample_independent for sampling with RandomSampler sampler.
2024-12-28 14:58:40,268 - INFO - Using sample_independent for sampling with RandomSampler sampler.
2024-12-28 14:58:40,268 - INFO - Using sample_independent for sampling with RandomSampler sampler.
2024-12-28 14:58:40,270 - INFO - Using sample_independent for sampling with RandomSampler sampler.
2024-12-28 14:58:40,270 - INFO - Using sample_independent for sampling with RandomSampler sampler.
2024-12-28 14:58:40,272 - INFO - Using sample_independent for sampling with RandomSampler sampler.
2024-12-28 14:58:40,273 - INFO - Using sample_independent for sampling with RandomSampler sampler.
[I 2024-12-28 14:58:40,286] Trial 0 finished with value: 1.7142857142857144 and parameters: {'x_0_0': 'ab', 'x_0_1': 'bd', 'x_1_0': 'ac', 'x_1_1': 'bd'}. Best is trial 0 with value: 1.7142857142857144.
[I 2024-12-28 14:58:40,296] Trial 0 finished with value: 1.4464285714285714 and parameters: {'x_0_0': 'bc', 'x_0_1': 'bc', 'x_1_0': 'bc', 'x_1_1': 'oo'}. Best is trial 0 with value: 1.4464285714285714.
[I 2024-12-28 14:58:41,133] Trial 1 finished with value: 1.7142857142857144 and parameters: {'x_0_0': 'ab', 'x_0_1': 'cd', 'x_1_0': 'ab', 'x_1_1': 'bd'}. Best is trial 0 with value: 1.3214285714285714.
[I 2024-12-28 14:58:41,147] Trial 1 finished with value: 1.0 and parameters: {'x_0_0': 'bc', 'x_0_1': 'ad', 'x_1_0': 'ac', 'x_1_1': 'bc'}. Best is trial 1 with value: 1.0.
[I 2024-12-28 14:58:41,153] Trial 1 finished with value: 1.0714285714285714 and parameters: {'x_0_0': 'ac', 'x_0_1': 'oo', 'x_1_0': 'bc', 'x_1_1': 'ac'}. Best is trial 1 with value: 1.0714285714285714.
[I 2024-12-28 14:58:41,165] Trial 1 finished with value: 1.2857142857142856 and parameters: {'x_0_0': 'bd', 'x_0_1': 'bc', 'x_1_0': 'bc', 'x_1_1': 'bd'}. Best is trial 1 with value: 1.2857142857142856.
[I 2024-12-28 14:58:41,182] Trial 1 finished with value: 1.2857142857142856 and parameters: {'x_0_0': 'bc', 'x_0_1': 'ac', 'x_1_0': 'cd', 'x_1_1': 'ac'}. Best is trial 1 with value: 1.2857142857142856.
[I 2024-12-28 14:58:41,275] Trial 1 finished with value: 2.0 and parameters: {'x_0_0': 'cd', 'x_0_1': 'ac', 'x_1_0': 'cd', 'x_1_1': 'bd'}. Best is trial 0 with value: 1.7142857142857144.
[I 2024-12-28 14:58:41,282] Trial 1 finished with value: 1.625 and parameters: {'x_0_0': 'oo', 'x_0_1': 'ab', 'x_1_0': 'oo', 'x_1_1': 'ad'}. Best is trial 0 with value: 1.0.
[I 2024-12-28 14:58:41,285] Trial 1 finished with value: 1.7142857142857144 and parameters: {'x_0_0': 'ab', 'x_0_1': 'cd', 'x_1_0': 'cd', 'x_1_1': 'ab'}. Best is trial 0 with value: 1.7142857142857144.
[I 2024-12-28 14:58:41,329] Trial 1 finished with value: 1.4464285714285714 and parameters: {'x_0_0': 'ad', 'x_0_1': 'bd', 'x_1_0': 'cd', 'x_1_1': 'oo'}. Best is trial 1 with value: 1.4464285714285714.
[I 2024-12-28 14:58:41,356] Trial 1 finished with value: 1.4464285714285714 and parameters: {'x_0_0': 'bc', 'x_0_1': 'cd', 'x_1_0': 'bd', 'x_1_1': 'oo'}. Best is trial 0 with value: 1.4464285714285714.
[I 2024-12-28 14:58:41,609] Trial 2 finished with value: 1.2857142857142856 and parameters: {'x_0_0': 'ac', 'x_0_1': 'ac', 'x_1_0': 'bd', 'x_1_1': 'bc'}. Best is trial 2 with value: 1.2857142857142856.
[I 2024-12-28 14:58:41,613] Trial 2 finished with value: 1.1428571428571428 and parameters: {'x_0_0': 'bd', 'x_0_1': 'ac', 'x_1_0': 'bc', 'x_1_1': 'ab'}. Best is trial 2 with value: 1.1428571428571428.
[I 2024-12-28 14:58:41,672] Trial 2 finished with value: 1.625 and parameters: {'x_0_0': 'oo', 'x_0_1': 'bc', 'x_1_0': 'oo', 'x_1_1': 'ac'}. Best is trial 0 with value: 1.3214285714285714.
[I 2024-12-28 14:58:41,672] Trial 2 finished with value: 2.0 and parameters: {'x_0_0': 'cd', 'x_0_1': 'cd', 'x_1_0': 'ac', 'x_1_1': 'bd'}. Best is trial 1 with value: 1.0.
[I 2024-12-28 14:58:41,718] Trial 2 finished with value: 1.875 and parameters: {'x_0_0': 'oo', 'x_0_1': 'ac', 'x_1_0': 'cd', 'x_1_1': 'ac'}. Best is trial 1 with value: 1.0714285714285714.
[I 2024-12-28 14:58:41,742] Trial 2 finished with value: 1.875 and parameters: {'x_0_0': 'oo', 'x_0_1': 'ad', 'x_1_0': 'bc', 'x_1_1': 'ad'}. Best is trial 1 with value: 1.2857142857142856.
[I 2024-12-28 14:58:41,747] Trial 2 finished with value: 1.1964285714285714 and parameters: {'x_0_0': 'bc', 'x_0_1': 'cd', 'x_1_0': 'oo', 'x_1_1': 'oo'}. Best is trial 2 with value: 1.1964285714285714.
