[I 2024-12-06 23:37:06,879] Trial 177 finished with value: 1.125 and parameters: {'x_0_0': 'oo', 'x_0_1': 'oo', 'x_1_0': 'oo', 'x_1_1': 'bc'}. Best is trial 23 with value: 0.5.
2024-12-06 23:37:07,127 - INFO - Candidate Mean Stats: {'Max': np.float64(2.703746320583919), 'Min': np.float64(-1.2200126250424428), 'Mean': np.float64(0.4506483533224487), 'Std': np.float64(0.5682254977557816)}
2024-12-06 23:37:07,127 - INFO - Candidate Std Stats: {'Max': np.float64(1.6661036359443873), 'Min': np.float64(0.0), 'Mean': np.float64(0.6516811465286807), 'Std': np.float64(0.30962771197197925)}
2024-12-06 23:37:07,131 - INFO - Candidate Mean Stats: {'Max': np.float64(2.7216496131718477), 'Min': np.float64(-1.2094396764613047), 'Mean': np.float64(0.4816403404405028), 'Std': np.float64(0.5042218600594871)}
2024-12-06 23:37:07,132 - INFO - Candidate Std Stats: {'Max': np.float64(1.5515788213412993), 'Min': np.float64(0.0), 'Mean': np.float64(0.5677868458025225), 'Std': np.float64(0.2800624581138071)}
2024-12-06 23:37:07,133 - INFO - Candidate Mean Stats: {'Max': np.float64(2.8526506553606037), 'Min': np.float64(-1.2058160123053403), 'Mean': np.float64(0.3666055161991889), 'Std': np.float64(0.6189137250698349)}
2024-12-06 23:37:07,133 - INFO - Candidate Std Stats: {'Max': np.float64(1.5996975908713038), 'Min': np.float64(0.0), 'Mean': np.float64(0.6319072285199606), 'Std': np.float64(0.3080660764812075)}
[I 2024-12-06 23:37:07,142] Trial 179 finished with value: 1.0714285714285714 and parameters: {'x_0_0': 'ad', 'x_0_1': 'oo', 'x_1_0': 'cd', 'x_1_1': 'ac'}. Best is trial 165 with value: 0.5.
[I 2024-12-06 23:37:07,145] Trial 179 finished with value: 1.0714285714285714 and parameters: {'x_0_0': 'bc', 'x_0_1': 'oo', 'x_1_0': 'bd', 'x_1_1': 'ac'}. Best is trial 63 with value: 0.5.
[I 2024-12-06 23:37:07,147] Trial 179 finished with value: 0.6428571428571428 and parameters: {'x_0_0': 'bd', 'x_0_1': 'oo', 'x_1_0': 'bc', 'x_1_1': 'ab'}. Best is trial 76 with value: 0.5.
2024-12-06 23:37:07,223 - INFO - Candidate Mean Stats: {'Max': np.float64(3.214643202105228), 'Min': np.float64(-1.5824356025491901), 'Mean': np.float64(0.32312471462696774), 'Std': np.float64(0.6351495774001455)}
2024-12-06 23:37:07,224 - INFO - Candidate Std Stats: {'Max': np.float64(2.053838188909186), 'Min': np.float64(0.0), 'Mean': np.float64(0.7416171236301115), 'Std': np.float64(0.3589753624038786)}
[I 2024-12-06 23:37:07,237] Trial 178 finished with value: 0.7857142857142857 and parameters: {'x_0_0': 'bd', 'x_0_1': 'oo', 'x_1_0': 'bd', 'x_1_1': 'cd'}. Best is trial 23 with value: 0.5.
2024-12-06 23:37:07,482 - INFO - Candidate Mean Stats: {'Max': np.float64(2.6027724633102176), 'Min': np.float64(-0.9793514829702593), 'Mean': np.float64(0.5241001630529677), 'Std': np.float64(0.46091112350962476)}
2024-12-06 23:37:07,482 - INFO - Candidate Std Stats: {'Max': np.float64(1.7823878974048413), 'Min': np.float64(0.0), 'Mean': np.float64(0.5417292379076983), 'Std': np.float64(0.2897728871207966)}
2024-12-06 23:37:07,488 - INFO - Candidate Mean Stats: {'Max': np.float64(2.821248724553911), 'Min': np.float64(-0.9462700329990328), 'Mean': np.float64(0.4662957862239418), 'Std': np.float64(0.5195030329192393)}
2024-12-06 23:37:07,489 - INFO - Candidate Std Stats: {'Max': np.float64(1.7549606950938457), 'Min': np.float64(0.0), 'Mean': np.float64(0.5654492145397969), 'Std': np.float64(0.28589869718445576)}
2024-12-06 23:37:07,489 - INFO - Candidate Mean Stats: {'Max': np.float64(3.2551260719441735), 'Min': np.float64(-1.2904677037300218), 'Mean': np.float64(0.39866818996192954), 'Std': np.float64(0.6001726050065522)}
2024-12-06 23:37:07,489 - INFO - Candidate Std Stats: {'Max': np.float64(2.9217206405748897), 'Min': np.float64(0.0), 'Mean': np.float64(0.7274497771123352), 'Std': np.float64(0.46456486249750834)}
[I 2024-12-06 23:37:07,497] Trial 180 finished with value: 0.8214285714285714 and parameters: {'x_0_0': 'bc', 'x_0_1': 'oo', 'x_1_0': 'oo', 'x_1_1': 'bd'}. Best is trial 165 with value: 0.5.
[I 2024-12-06 23:37:07,502] Trial 180 finished with value: 0.7857142857142857 and parameters: {'x_0_0': 'bd', 'x_0_1': 'oo', 'x_1_0': 'bd', 'x_1_1': 'ac'}. Best is trial 63 with value: 0.5.
[I 2024-12-06 23:37:07,503] Trial 180 finished with value: 1.5714285714285714 and parameters: {'x_0_0': 'bd', 'x_0_1': 'ab', 'x_1_0': 'ad', 'x_1_1': 'ab'}. Best is trial 76 with value: 0.5.
2024-12-06 23:37:07,583 - INFO - Candidate Mean Stats: {'Max': np.float64(2.828688808368517), 'Min': np.float64(-1.2169126731318252), 'Mean': np.float64(0.4525483748192838), 'Std': np.float64(0.5939266684475129)}
2024-12-06 23:37:07,583 - INFO - Candidate Std Stats: {'Max': np.float64(1.7147957394923468), 'Min': np.float64(0.0), 'Mean': np.float64(0.5557679726042908), 'Std': np.float64(0.2648945749650343)}
[I 2024-12-06 23:37:07,596] Trial 179 finished with value: 0.7857142857142857 and parameters: {'x_0_0': 'ad', 'x_0_1': 'oo', 'x_1_0': 'bd', 'x_1_1': 'ad'}. Best is trial 23 with value: 0.5.
2024-12-06 23:37:07,837 - INFO - Candidate Mean Stats: {'Max': np.float64(2.777351746967132), 'Min': np.float64(-1.0726356869087545), 'Mean': np.float64(0.4500744775507993), 'Std': np.float64(0.5363791278339484)}
2024-12-06 23:37:07,837 - INFO - Candidate Std Stats: {'Max': np.float64(1.818602871613193), 'Min': np.float64(0.0), 'Mean': np.float64(0.5810547403148674), 'Std': np.float64(0.2954233426842707)}
2024-12-06 23:37:07,845 - INFO - Candidate Mean Stats: {'Max': np.float64(3.1719366754250444), 'Min': np.float64(-1.2654791530222735), 'Mean': np.float64(0.41584972224907263), 'Std': np.float64(0.640441709827208)}
2024-12-06 23:37:07,845 - INFO - Candidate Std Stats: {'Max': np.float64(1.691559240627929), 'Min': np.float64(0.0), 'Mean': np.float64(0.6266991484334815), 'Std': np.float64(0.30476244667261304)}
2024-12-06 23:37:07,845 - INFO - Candidate Mean Stats: {'Max': np.float64(2.68846484095386), 'Min': np.float64(-0.9776954759365866), 'Mean': np.float64(0.44364206239045945), 'Std': np.float64(0.5195201697708156)}
2024-12-06 23:37:07,846 - INFO - Candidate Std Stats: {'Max': np.float64(1.5172704764307516), 'Min': np.float64(0.0), 'Mean': np.float64(0.5635899195437616), 'Std': np.float64(0.27472795052522503)}
[I 2024-12-06 23:37:07,851] Trial 181 finished with value: 0.7857142857142857 and parameters: {'x_0_0': 'ad', 'x_0_1': 'oo', 'x_1_0': 'bc', 'x_1_1': 'cd'}. Best is trial 165 with value: 0.5.
[I 2024-12-06 23:37:07,858] Trial 181 finished with value: 1.1428571428571428 and parameters: {'x_0_0': 'ad', 'x_0_1': 'cd', 'x_1_0': 'bc', 'x_1_1': 'ab'}. Best is trial 63 with value: 0.5.
[I 2024-12-06 23:37:07,858] Trial 181 finished with value: 1.4285714285714286 and parameters: {'x_0_0': 'bd', 'x_0_1': 'bc', 'x_1_0': 'ab', 'x_1_1': 'ac'}. Best is trial 76 with value: 0.5.
2024-12-06 23:37:07,938 - INFO - Candidate Mean Stats: {'Max': np.float64(3.0414376413969983), 'Min': np.float64(-1.1388870283432273), 'Mean': np.float64(0.42453881714533354), 'Std': np.float64(0.5927276218654107)}
2024-12-06 23:37:07,938 - INFO - Candidate Std Stats: {'Max': np.float64(1.5419953694835054), 'Min': np.float64(0.0), 'Mean': np.float64(0.649144419198656), 'Std': np.float64(0.31498679519545286)}
[I 2024-12-06 23:37:07,951] Trial 180 finished with value: 1.0714285714285714 and parameters: {'x_0_0': 'ac', 'x_0_1': 'oo', 'x_1_0': 'bd', 'x_1_1': 'ad'}. Best is trial 23 with value: 0.5.
2024-12-06 23:37:08,190 - INFO - Candidate Mean Stats: {'Max': np.float64(2.7076486080416893), 'Min': np.float64(-1.091009393290793), 'Mean': np.float64(0.4423931545665719), 'Std': np.float64(0.5714187228794062)}
2024-12-06 23:37:08,190 - INFO - Candidate Std Stats: {'Max': np.float64(2.0120045671604863), 'Min': np.float64(0.0), 'Mean': np.float64(0.6267655017812997), 'Std': np.float64(0.30879268553571315)}
2024-12-06 23:37:08,198 - INFO - Candidate Mean Stats: {'Max': np.float64(3.211022610091333), 'Min': np.float64(-1.0493227589968088), 'Mean': np.float64(0.446585940978315), 'Std': np.float64(0.5613999585281302)}
2024-12-06 23:37:08,198 - INFO - Candidate Std Stats: {'Max': np.float64(1.9242280902509168), 'Min': np.float64(0.0), 'Mean': np.float64(0.5753485693172289), 'Std': np.float64(0.2878433442294742)}
2024-12-06 23:37:08,200 - INFO - Candidate Mean Stats: {'Max': np.float64(3.025295884255927), 'Min': np.float64(-1.258525756486342), 'Mean': np.float64(0.42872809936664136), 'Std': np.float64(0.5415925465990129)}
2024-12-06 23:37:08,200 - INFO - Candidate Std Stats: {'Max': np.float64(1.6811960974535005), 'Min': np.float64(0.0), 'Mean': np.float64(0.538053294003557), 'Std': np.float64(0.2871131793603466)}
[I 2024-12-06 23:37:08,203] Trial 182 finished with value: 1.0714285714285714 and parameters: {'x_0_0': 'bd', 'x_0_1': 'oo', 'x_1_0': 'ad', 'x_1_1': 'bd'}. Best is trial 165 with value: 0.5.
[I 2024-12-06 23:37:08,211] Trial 182 finished with value: 0.9464285714285714 and parameters: {'x_0_0': 'ac', 'x_0_1': 'oo', 'x_1_0': 'bc', 'x_1_1': 'oo'}. Best is trial 76 with value: 0.5.
[I 2024-12-06 23:37:08,213] Trial 182 finished with value: 1.0714285714285714 and parameters: {'x_0_0': 'ac', 'x_0_1': 'oo', 'x_1_0': 'cd', 'x_1_1': 'ab'}. Best is trial 63 with value: 0.5.
2024-12-06 23:37:08,296 - INFO - Candidate Mean Stats: {'Max': np.float64(2.636062591597636), 'Min': np.float64(-0.9323225421008068), 'Mean': np.float64(0.47556225264326774), 'Std': np.float64(0.5614768520910371)}
2024-12-06 23:37:08,297 - INFO - Candidate Std Stats: {'Max': np.float64(1.6239266049381138), 'Min': np.float64(0.0), 'Mean': np.float64(0.5963954610436123), 'Std': np.float64(0.2901844807446677)}
[I 2024-12-06 23:37:08,309] Trial 181 finished with value: 1.1607142857142856 and parameters: {'x_0_0': 'bd', 'x_0_1': 'bd', 'x_1_0': 'bd', 'x_1_1': 'oo'}. Best is trial 23 with value: 0.5.
2024-12-06 23:37:08,548 - INFO - Candidate Mean Stats: {'Max': np.float64(2.953869514303713), 'Min': np.float64(-0.9046852140464388), 'Mean': np.float64(0.4734634580500195), 'Std': np.float64(0.539528271488955)}
2024-12-06 23:37:08,548 - INFO - Candidate Std Stats: {'Max': np.float64(1.4190078475714316), 'Min': np.float64(0.0), 'Mean': np.float64(0.5591352615685572), 'Std': np.float64(0.27446194932101553)}
2024-12-06 23:37:08,557 - INFO - Candidate Mean Stats: {'Max': np.float64(3.0052582542536372), 'Min': np.float64(-1.1466134553106158), 'Mean': np.float64(0.4396305839461182), 'Std': np.float64(0.5737493354859449)}
2024-12-06 23:37:08,557 - INFO - Candidate Std Stats: {'Max': np.float64(1.7578677439625365), 'Min': np.float64(0.0), 'Mean': np.float64(0.6776349429729339), 'Std': np.float64(0.32065530570282885)}
2024-12-06 23:37:08,560 - INFO - Candidate Mean Stats: {'Max': np.float64(3.0628191643958433), 'Min': np.float64(-1.022366705156038), 'Mean': np.float64(0.4684290163546283), 'Std': np.float64(0.5238365289485132)}
2024-12-06 23:37:08,560 - INFO - Candidate Std Stats: {'Max': np.float64(2.0211830001658178), 'Min': np.float64(0.0), 'Mean': np.float64(0.5582869116868737), 'Std': np.float64(0.29058691440756174)}
[I 2024-12-06 23:37:08,562] Trial 183 finished with value: 1.2142857142857144 and parameters: {'x_0_0': 'ab', 'x_0_1': 'oo', 'x_1_0': 'bc', 'x_1_1': 'bc'}. Best is trial 165 with value: 0.5.
[I 2024-12-06 23:37:08,570] Trial 183 finished with value: 0.7857142857142857 and parameters: {'x_0_0': 'ad', 'x_0_1': 'oo', 'x_1_0': 'bd', 'x_1_1': 'bc'}. Best is trial 76 with value: 0.5.
[I 2024-12-06 23:37:08,573] Trial 183 finished with value: 1.5 and parameters: {'x_0_0': 'cd', 'x_0_1': 'oo', 'x_1_0': 'cd', 'x_1_1': 'bc'}. Best is trial 63 with value: 0.5.
2024-12-06 23:37:08,652 - INFO - Candidate Mean Stats: {'Max': np.float64(3.3104980348619377), 'Min': np.float64(-1.3456411431928321), 'Mean': np.float64(0.4334541240752061), 'Std': np.float64(0.5727035326439118)}
2024-12-06 23:37:08,652 - INFO - Candidate Std Stats: {'Max': np.float64(2.26821373121219), 'Min': np.float64(0.0), 'Mean': np.float64(0.5897105498724666), 'Std': np.float64(0.30523302973888883)}
[I 2024-12-06 23:37:08,665] Trial 182 finished with value: 1.125 and parameters: {'x_0_0': 'oo', 'x_0_1': 'oo', 'x_1_0': 'oo', 'x_1_1': 'ab'}. Best is trial 23 with value: 0.5.
2024-12-06 23:37:08,905 - INFO - Candidate Mean Stats: {'Max': np.float64(3.079419485782027), 'Min': np.float64(-0.8481762444773814), 'Mean': np.float64(0.5040732111210389), 'Std': np.float64(0.5440504656227149)}
2024-12-06 23:37:08,905 - INFO - Candidate Std Stats: {'Max': np.float64(1.555028021191746), 'Min': np.float64(0.0), 'Mean': np.float64(0.5800885212561591), 'Std': np.float64(0.28104132897321443)}
2024-12-06 23:37:08,914 - INFO - Candidate Mean Stats: {'Max': np.float64(2.995176611530428), 'Min': np.float64(-1.4851427789860538), 'Mean': np.float64(0.3752952349353773), 'Std': np.float64(0.6415765176478477)}
2024-12-06 23:37:08,914 - INFO - Candidate Std Stats: {'Max': np.float64(2.025389293055098), 'Min': np.float64(0.0), 'Mean': np.float64(0.6890653570467771), 'Std': np.float64(0.3392421055721823)}
2024-12-06 23:37:08,917 - INFO - Candidate Mean Stats: {'Max': np.float64(3.00978417566981), 'Min': np.float64(-1.184078347989501), 'Mean': np.float64(0.47682426010444545), 'Std': np.float64(0.511798650158565)}
2024-12-06 23:37:08,917 - INFO - Candidate Std Stats: {'Max': np.float64(1.6227781841344717), 'Min': np.float64(0.0), 'Mean': np.float64(0.5921711056006185), 'Std': np.float64(0.2948236618985947)}
[I 2024-12-06 23:37:08,919] Trial 184 finished with value: 1.2857142857142856 and parameters: {'x_0_0': 'bc', 'x_0_1': 'ad', 'x_1_0': 'bc', 'x_1_1': 'ac'}. Best is trial 165 with value: 0.5.
[I 2024-12-06 23:37:08,928] Trial 184 finished with value: 1.2857142857142856 and parameters: {'x_0_0': 'bd', 'x_0_1': 'ac', 'x_1_0': 'bc', 'x_1_1': 'bc'}. Best is trial 76 with value: 0.5.
[I 2024-12-06 23:37:08,930] Trial 184 finished with value: 1.0714285714285714 and parameters: {'x_0_0': 'bc', 'x_0_1': 'oo', 'x_1_0': 'ac', 'x_1_1': 'ab'}. Best is trial 63 with value: 0.5.
2024-12-06 23:37:09,011 - INFO - Candidate Mean Stats: {'Max': np.float64(3.136516805481489), 'Min': np.float64(-0.8645013181730773), 'Mean': np.float64(0.4978680595689639), 'Std': np.float64(0.5438173186854749)}
2024-12-06 23:37:09,011 - INFO - Candidate Std Stats: {'Max': np.float64(1.6175989882269997), 'Min': np.float64(0.0), 'Mean': np.float64(0.5888493163534296), 'Std': np.float64(0.2859846447198333)}
[I 2024-12-06 23:37:09,024] Trial 183 finished with value: 0.9464285714285714 and parameters: {'x_0_0': 'ad', 'x_0_1': 'oo', 'x_1_0': 'ac', 'x_1_1': 'oo'}. Best is trial 23 with value: 0.5.
2024-12-06 23:37:09,262 - INFO - Candidate Mean Stats: {'Max': np.float64(2.6593936877579405), 'Min': np.float64(-0.8788249468042595), 'Mean': np.float64(0.5550106344649747), 'Std': np.float64(0.5125235643859765)}
2024-12-06 23:37:09,262 - INFO - Candidate Std Stats: {'Max': np.float64(1.520163380897431), 'Min': np.float64(0.0), 'Mean': np.float64(0.5719825827008076), 'Std': np.float64(0.2773240838915474)}
2024-12-06 23:37:09,272 - INFO - Candidate Mean Stats: {'Max': np.float64(3.0229740703844294), 'Min': np.float64(-1.3258093875219423), 'Mean': np.float64(0.4831854797006594), 'Std': np.float64(0.5599423931963239)}
2024-12-06 23:37:09,272 - INFO - Candidate Std Stats: {'Max': np.float64(1.8426930691937966), 'Min': np.float64(0.0), 'Mean': np.float64(0.5380279313507224), 'Std': np.float64(0.2909426301041538)}
[I 2024-12-06 23:37:09,275] Trial 185 finished with value: 0.7857142857142857 and parameters: {'x_0_0': 'ad', 'x_0_1': 'oo', 'x_1_0': 'bd', 'x_1_1': 'bc'}. Best is trial 165 with value: 0.5.
2024-12-06 23:37:09,276 - INFO - Candidate Mean Stats: {'Max': np.float64(2.42252756790156), 'Min': np.float64(-0.8814247054062797), 'Mean': np.float64(0.49360808490294267), 'Std': np.float64(0.4994709961602968)}
2024-12-06 23:37:09,276 - INFO - Candidate Std Stats: {'Max': np.float64(1.6101669556436593), 'Min': np.float64(0.0), 'Mean': np.float64(0.5552964842049298), 'Std': np.float64(0.2742512872694195)}
[I 2024-12-06 23:37:09,286] Trial 185 finished with value: 1.5 and parameters: {'x_0_0': 'cd', 'x_0_1': 'oo', 'x_1_0': 'bd', 'x_1_1': 'cd'}. Best is trial 76 with value: 0.5.
[I 2024-12-06 23:37:09,289] Trial 185 finished with value: 0.8214285714285714 and parameters: {'x_0_0': 'bd', 'x_0_1': 'oo', 'x_1_0': 'oo', 'x_1_1': 'ab'}. Best is trial 63 with value: 0.5.
2024-12-06 23:37:09,369 - INFO - Candidate Mean Stats: {'Max': np.float64(2.7731238324938445), 'Min': np.float64(-1.0421513998489464), 'Mean': np.float64(0.4617079091642712), 'Std': np.float64(0.5540307593835337)}
2024-12-06 23:37:09,369 - INFO - Candidate Std Stats: {'Max': np.float64(1.6104713206169206), 'Min': np.float64(0.0), 'Mean': np.float64(0.5811752136175138), 'Std': np.float64(0.294419583761244)}
[I 2024-12-06 23:37:09,382] Trial 184 finished with value: 1.0714285714285714 and parameters: {'x_0_0': 'bd', 'x_0_1': 'oo', 'x_1_0': 'ad', 'x_1_1': 'cd'}. Best is trial 23 with value: 0.5.
2024-12-06 23:37:09,620 - INFO - Candidate Mean Stats: {'Max': np.float64(2.5545529563002285), 'Min': np.float64(-1.21848895978154), 'Mean': np.float64(0.40375935004489855), 'Std': np.float64(0.6022525780248951)}
2024-12-06 23:37:09,620 - INFO - Candidate Std Stats: {'Max': np.float64(1.6732822234409301), 'Min': np.float64(0.0), 'Mean': np.float64(0.6043824306885126), 'Std': np.float64(0.29418154836776705)}
2024-12-06 23:37:09,629 - INFO - Candidate Mean Stats: {'Max': np.float64(3.366804594218391), 'Min': np.float64(-1.2620380033744987), 'Mean': np.float64(0.38399638192490515), 'Std': np.float64(0.5957484926849346)}
2024-12-06 23:37:09,629 - INFO - Candidate Std Stats: {'Max': np.float64(1.7423813575122287), 'Min': np.float64(0.0), 'Mean': np.float64(0.6100385577661988), 'Std': np.float64(0.29728181074362225)}
[I 2024-12-06 23:37:09,634] Trial 186 finished with value: 1.0714285714285714 and parameters: {'x_0_0': 'ad', 'x_0_1': 'oo', 'x_1_0': 'ad', 'x_1_1': 'cd'}. Best is trial 165 with value: 0.5.
2024-12-06 23:37:09,636 - INFO - Candidate Mean Stats: {'Max': np.float64(2.800754758232457), 'Min': np.float64(-1.0415244723429282), 'Mean': np.float64(0.429299028506413), 'Std': np.float64(0.5613908827136985)}
2024-12-06 23:37:09,636 - INFO - Candidate Std Stats: {'Max': np.float64(1.73644500981924), 'Min': np.float64(0.0), 'Mean': np.float64(0.6293609511209476), 'Std': np.float64(0.2953745876811059)}
[I 2024-12-06 23:37:09,642] Trial 186 finished with value: 0.8214285714285714 and parameters: {'x_0_0': 'ad', 'x_0_1': 'oo', 'x_1_0': 'oo', 'x_1_1': 'ab'}. Best is trial 76 with value: 0.5.
[I 2024-12-06 23:37:09,648] Trial 186 finished with value: 0.9642857142857143 and parameters: {'x_0_0': 'ab', 'x_0_1': 'oo', 'x_1_0': 'oo', 'x_1_1': 'ad'}. Best is trial 63 with value: 0.5.
2024-12-06 23:37:09,729 - INFO - Candidate Mean Stats: {'Max': np.float64(2.8235135705772785), 'Min': np.float64(-0.8365584955081093), 'Mean': np.float64(0.4983920521284456), 'Std': np.float64(0.553498916770619)}
2024-12-06 23:37:09,729 - INFO - Candidate Std Stats: {'Max': np.float64(1.344096423132294), 'Min': np.float64(0.0), 'Mean': np.float64(0.5716137591346601), 'Std': np.float64(0.27168068310761)}
[I 2024-12-06 23:37:09,742] Trial 185 finished with value: 0.9285714285714286 and parameters: {'x_0_0': 'bd', 'x_0_1': 'oo', 'x_1_0': 'ab', 'x_1_1': 'bd'}. Best is trial 23 with value: 0.5.
2024-12-06 23:37:09,977 - INFO - Candidate Mean Stats: {'Max': np.float64(2.945631747901556), 'Min': np.float64(-1.3945569173702839), 'Mean': np.float64(0.34936240422163156), 'Std': np.float64(0.6504067863969704)}
2024-12-06 23:37:09,977 - INFO - Candidate Std Stats: {'Max': np.float64(2.098775861002882), 'Min': np.float64(0.0), 'Mean': np.float64(0.6948748749143812), 'Std': np.float64(0.33833123368958273)}
2024-12-06 23:37:09,989 - INFO - Candidate Mean Stats: {'Max': np.float64(2.9647119194222906), 'Min': np.float64(-1.1828587142942988), 'Mean': np.float64(0.459169633399392), 'Std': np.float64(0.5576882186697436)}
2024-12-06 23:37:09,989 - INFO - Candidate Std Stats: {'Max': np.float64(1.5279973518147358), 'Min': np.float64(0.0), 'Mean': np.float64(0.5627524814911742), 'Std': np.float64(0.28094108890657343)}
[I 2024-12-06 23:37:09,990] Trial 187 finished with value: 1.0714285714285714 and parameters: {'x_0_0': 'bd', 'x_0_1': 'oo', 'x_1_0': 'ac', 'x_1_1': 'cd'}. Best is trial 165 with value: 0.5.
2024-12-06 23:37:09,996 - INFO - Candidate Mean Stats: {'Max': np.float64(2.7491756454449714), 'Min': np.float64(-1.188622146730022), 'Mean': np.float64(0.49534651579982997), 'Std': np.float64(0.5246399585966144)}
2024-12-06 23:37:09,996 - INFO - Candidate Std Stats: {'Max': np.float64(1.5656381233746883), 'Min': np.float64(0.0), 'Mean': np.float64(0.5297470129139742), 'Std': np.float64(0.262597335871291)}
[I 2024-12-06 23:37:10,002] Trial 187 finished with value: 1.0714285714285714 and parameters: {'x_0_0': 'bc', 'x_0_1': 'oo', 'x_1_0': 'ab', 'x_1_1': 'cd'}. Best is trial 76 with value: 0.5.
[I 2024-12-06 23:37:10,009] Trial 187 finished with value: 0.9464285714285714 and parameters: {'x_0_0': 'ac', 'x_0_1': 'oo', 'x_1_0': 'bd', 'x_1_1': 'oo'}. Best is trial 63 with value: 0.5.
2024-12-06 23:37:10,094 - INFO - Candidate Mean Stats: {'Max': np.float64(2.9414742929308852), 'Min': np.float64(-1.3662924649367851), 'Mean': np.float64(0.38477344324770674), 'Std': np.float64(0.6514124227745034)}
2024-12-06 23:37:10,094 - INFO - Candidate Std Stats: {'Max': np.float64(1.7003539816181206), 'Min': np.float64(0.0), 'Mean': np.float64(0.6297652682989379), 'Std': np.float64(0.3093859610635638)}
