[I 2024-12-07 00:19:57,903] Trial 103 finished with value: 1.5666666666666667 and parameters: {'x_0_0': 'bc', 'x_0_1': 'bd', 'x_0_2': 'bc', 'x_1_0': 'ab', 'x_1_1': 'bc', 'x_1_2': 'oo'}. Best is trial 99 with value: 0.9444444444444444.
2024-12-07 00:20:10,194 - INFO - Candidate Mean Stats: {'Max': np.float64(2.0), 'Min': np.float64(0.267232369933147), 'Mean': np.float64(0.4968916914277664), 'Std': np.float64(0.06311896754643609)}
2024-12-07 00:20:10,194 - INFO - Candidate Std Stats: {'Max': np.float64(0.48409914793144093), 'Min': np.float64(0.0), 'Mean': np.float64(0.10466311273710885), 'Std': np.float64(0.043618285514809056)}
[I 2024-12-07 00:20:10,243] Trial 103 finished with value: 1.5666666666666667 and parameters: {'x_0_0': 'ac', 'x_0_1': 'bc', 'x_0_2': 'cd', 'x_1_0': 'bc', 'x_1_1': 'oo', 'x_1_2': 'ad'}. Best is trial 74 with value: 0.8222222222222222.
2024-12-07 00:20:17,463 - INFO - Candidate Mean Stats: {'Max': np.float64(2.0), 'Min': np.float64(0.2860073959447265), 'Mean': np.float64(0.49111842193644084), 'Std': np.float64(0.06655392290012084)}
2024-12-07 00:20:17,463 - INFO - Candidate Std Stats: {'Max': np.float64(0.49001150926053477), 'Min': np.float64(0.0), 'Mean': np.float64(0.10961629144419564), 'Std': np.float64(0.04663872691333667)}
[I 2024-12-07 00:20:17,519] Trial 104 finished with value: 1.9 and parameters: {'x_0_0': 'oo', 'x_0_1': 'ab', 'x_0_2': 'bd', 'x_1_0': 'bd', 'x_1_1': 'bc', 'x_1_2': 'bd'}. Best is trial 88 with value: 1.0666666666666667.
2024-12-07 00:20:20,048 - INFO - Candidate Mean Stats: {'Max': np.float64(2.0), 'Min': np.float64(0.22549015339100142), 'Mean': np.float64(0.48381313742044413), 'Std': np.float64(0.07641506582452942)}
2024-12-07 00:20:20,048 - INFO - Candidate Std Stats: {'Max': np.float64(1.8397757414281435), 'Min': np.float64(0.0), 'Mean': np.float64(0.11596910607002982), 'Std': np.float64(0.07069400822078427)}
[I 2024-12-07 00:20:20,101] Trial 104 finished with value: 0.8222222222222222 and parameters: {'x_0_0': 'ad', 'x_0_1': 'oo', 'x_0_2': 'ad', 'x_1_0': 'bc', 'x_1_1': 'ac', 'x_1_2': 'bd'}. Best is trial 49 with value: 0.7999999999999999.
2024-12-07 00:20:22,769 - INFO - Candidate Mean Stats: {'Max': np.float64(2.0), 'Min': np.float64(0.2542129845869324), 'Mean': np.float64(0.4880013611423666), 'Std': np.float64(0.06283264860043135)}
2024-12-07 00:20:22,770 - INFO - Candidate Std Stats: {'Max': np.float64(0.3591632801894538), 'Min': np.float64(0.0), 'Mean': np.float64(0.10117421559227888), 'Std': np.float64(0.04095374374868944)}
[I 2024-12-07 00:20:22,821] Trial 104 finished with value: 1.6777777777777778 and parameters: {'x_0_0': 'ab', 'x_0_1': 'cd', 'x_0_2': 'ab', 'x_1_0': 'bc', 'x_1_1': 'oo', 'x_1_2': 'bc'}. Best is trial 99 with value: 0.9444444444444444.
2024-12-07 00:20:35,590 - INFO - Candidate Mean Stats: {'Max': np.float64(2.0), 'Min': np.float64(0.2510503398418674), 'Mean': np.float64(0.4930275008399792), 'Std': np.float64(0.06858426873158732)}
2024-12-07 00:20:35,591 - INFO - Candidate Std Stats: {'Max': np.float64(1.1298227902285298), 'Min': np.float64(0.0), 'Mean': np.float64(0.10045822442236489), 'Std': np.float64(0.04533145199460064)}
[I 2024-12-07 00:20:35,645] Trial 104 finished with value: 1.2444444444444445 and parameters: {'x_0_0': 'ac', 'x_0_1': 'ac', 'x_0_2': 'bc', 'x_1_0': 'oo', 'x_1_1': 'ad', 'x_1_2': 'bd'}. Best is trial 74 with value: 0.8222222222222222.
2024-12-07 00:20:42,896 - INFO - Candidate Mean Stats: {'Max': np.float64(2.0), 'Min': np.float64(0.17575229369666792), 'Mean': np.float64(0.49106800412912244), 'Std': np.float64(0.0741501195723793)}
2024-12-07 00:20:42,897 - INFO - Candidate Std Stats: {'Max': np.float64(1.0363403360095806), 'Min': np.float64(0.0), 'Mean': np.float64(0.11503816631916267), 'Std': np.float64(0.05429807001477031)}
[I 2024-12-07 00:20:42,952] Trial 105 finished with value: 1.3666666666666667 and parameters: {'x_0_0': 'bc', 'x_0_1': 'bd', 'x_0_2': 'ab', 'x_1_0': 'oo', 'x_1_1': 'oo', 'x_1_2': 'ab'}. Best is trial 88 with value: 1.0666666666666667.
2024-12-07 00:20:45,175 - INFO - Candidate Mean Stats: {'Max': np.float64(2.0), 'Min': np.float64(0.2971957494952463), 'Mean': np.float64(0.4834463396105996), 'Std': np.float64(0.05912242018972618)}
2024-12-07 00:20:45,176 - INFO - Candidate Std Stats: {'Max': np.float64(0.5274811750704588), 'Min': np.float64(0.0), 'Mean': np.float64(0.09754490630588507), 'Std': np.float64(0.0426300942170987)}
[I 2024-12-07 00:20:45,230] Trial 105 finished with value: 1.5555555555555556 and parameters: {'x_0_0': 'ac', 'x_0_1': 'ab', 'x_0_2': 'bc', 'x_1_0': 'ac', 'x_1_1': 'ab', 'x_1_2': 'cd'}. Best is trial 49 with value: 0.7999999999999999.
2024-12-07 00:20:48,270 - INFO - Candidate Mean Stats: {'Max': np.float64(2.0), 'Min': np.float64(0.11258874593796012), 'Mean': np.float64(0.48956510748640275), 'Std': np.float64(0.07258475823424011)}
2024-12-07 00:20:48,271 - INFO - Candidate Std Stats: {'Max': np.float64(1.745229444051733), 'Min': np.float64(0.0), 'Mean': np.float64(0.11035987381696044), 'Std': np.float64(0.05715984803417824)}
[I 2024-12-07 00:20:48,321] Trial 105 finished with value: 1.7777777777777777 and parameters: {'x_0_0': 'ab', 'x_0_1': 'cd', 'x_0_2': 'bd', 'x_1_0': 'ac', 'x_1_1': 'cd', 'x_1_2': 'bd'}. Best is trial 99 with value: 0.9444444444444444.
2024-12-07 00:21:00,261 - INFO - Candidate Mean Stats: {'Max': np.float64(2.0), 'Min': np.float64(0.20892043408791192), 'Mean': np.float64(0.4869874211663005), 'Std': np.float64(0.06442777876301568)}
2024-12-07 00:21:00,261 - INFO - Candidate Std Stats: {'Max': np.float64(0.4122612161412858), 'Min': np.float64(0.0), 'Mean': np.float64(0.10522351238439676), 'Std': np.float64(0.04347200706242297)}
[I 2024-12-07 00:21:00,310] Trial 105 finished with value: 1.5 and parameters: {'x_0_0': 'cd', 'x_0_1': 'oo', 'x_0_2': 'oo', 'x_1_0': 'cd', 'x_1_1': 'ad', 'x_1_2': 'bc'}. Best is trial 74 with value: 0.8222222222222222.
2024-12-07 00:21:07,328 - INFO - Candidate Mean Stats: {'Max': np.float64(2.0), 'Min': np.float64(0.18759406457085498), 'Mean': np.float64(0.4904376818325504), 'Std': np.float64(0.06695172120942136)}
2024-12-07 00:21:07,328 - INFO - Candidate Std Stats: {'Max': np.float64(0.4779738710053716), 'Min': np.float64(0.0), 'Mean': np.float64(0.10807183459266158), 'Std': np.float64(0.04615195759377928)}
[I 2024-12-07 00:21:07,380] Trial 106 finished with value: 1.3333333333333333 and parameters: {'x_0_0': 'bd', 'x_0_1': 'bd', 'x_0_2': 'ab', 'x_1_0': 'bc', 'x_1_1': 'ab', 'x_1_2': 'ab'}. Best is trial 88 with value: 1.0666666666666667.
2024-12-07 00:21:09,480 - INFO - Candidate Mean Stats: {'Max': np.float64(2.0), 'Min': np.float64(0.22185834715798972), 'Mean': np.float64(0.4924177717521019), 'Std': np.float64(0.06345046751094388)}
2024-12-07 00:21:09,480 - INFO - Candidate Std Stats: {'Max': np.float64(0.5528271155062651), 'Min': np.float64(0.0), 'Mean': np.float64(0.09884079916023983), 'Std': np.float64(0.04628502625997856)}
[I 2024-12-07 00:21:09,530] Trial 106 finished with value: 1.6666666666666665 and parameters: {'x_0_0': 'bc', 'x_0_1': 'bc', 'x_0_2': 'ab', 'x_1_0': 'bd', 'x_1_1': 'ab', 'x_1_2': 'ab'}. Best is trial 49 with value: 0.7999999999999999.
2024-12-07 00:21:12,853 - INFO - Candidate Mean Stats: {'Max': np.float64(2.0), 'Min': np.float64(0.23552114145192724), 'Mean': np.float64(0.48150183640577643), 'Std': np.float64(0.07353797407711332)}
2024-12-07 00:21:12,853 - INFO - Candidate Std Stats: {'Max': np.float64(1.5396447215609705), 'Min': np.float64(0.0), 'Mean': np.float64(0.11564293453218356), 'Std': np.float64(0.06591322696883163)}
[I 2024-12-07 00:21:12,905] Trial 106 finished with value: 1.7777777777777777 and parameters: {'x_0_0': 'ab', 'x_0_1': 'cd', 'x_0_2': 'bd', 'x_1_0': 'ab', 'x_1_1': 'bc', 'x_1_2': 'bc'}. Best is trial 99 with value: 0.9444444444444444.
2024-12-07 00:21:25,780 - INFO - Candidate Mean Stats: {'Max': np.float64(2.0), 'Min': np.float64(0.18626044894393595), 'Mean': np.float64(0.4898304953615692), 'Std': np.float64(0.07032215063536194)}
2024-12-07 00:21:25,780 - INFO - Candidate Std Stats: {'Max': np.float64(0.4925135234319524), 'Min': np.float64(0.0), 'Mean': np.float64(0.1132558494863024), 'Std': np.float64(0.04972296276069273)}
[I 2024-12-07 00:21:25,834] Trial 106 finished with value: 1.5555555555555556 and parameters: {'x_0_0': 'bc', 'x_0_1': 'ab', 'x_0_2': 'ac', 'x_1_0': 'ab', 'x_1_1': 'ac', 'x_1_2': 'bc'}. Best is trial 74 with value: 0.8222222222222222.
2024-12-07 00:21:33,177 - INFO - Candidate Mean Stats: {'Max': np.float64(2.0), 'Min': np.float64(0.1908479187527392), 'Mean': np.float64(0.4925901552796513), 'Std': np.float64(0.06902364846658472)}
2024-12-07 00:21:33,177 - INFO - Candidate Std Stats: {'Max': np.float64(0.5971439816771512), 'Min': np.float64(0.0), 'Mean': np.float64(0.1033981449917741), 'Std': np.float64(0.0451551818504966)}
[I 2024-12-07 00:21:33,238] Trial 107 finished with value: 1.5666666666666664 and parameters: {'x_0_0': 'ac', 'x_0_1': 'bc', 'x_0_2': 'oo', 'x_1_0': 'cd', 'x_1_1': 'bd', 'x_1_2': 'ac'}. Best is trial 88 with value: 1.0666666666666667.
2024-12-07 00:21:35,239 - INFO - Candidate Mean Stats: {'Max': np.float64(2.0), 'Min': np.float64(0.2871432334242837), 'Mean': np.float64(0.48467218693305514), 'Std': np.float64(0.0646492981610059)}
2024-12-07 00:21:35,239 - INFO - Candidate Std Stats: {'Max': np.float64(0.5675725388657362), 'Min': np.float64(0.0), 'Mean': np.float64(0.10797531893844002), 'Std': np.float64(0.04766258541369406)}
[I 2024-12-07 00:21:35,289] Trial 107 finished with value: 1.4444444444444444 and parameters: {'x_0_0': 'bd', 'x_0_1': 'cd', 'x_0_2': 'cd', 'x_1_0': 'bd', 'x_1_1': 'bc', 'x_1_2': 'ad'}. Best is trial 49 with value: 0.7999999999999999.
2024-12-07 00:21:38,748 - INFO - Candidate Mean Stats: {'Max': np.float64(2.0), 'Min': np.float64(0.2619434190978065), 'Mean': np.float64(0.4928238722946353), 'Std': np.float64(0.06830121052963553)}
2024-12-07 00:21:38,748 - INFO - Candidate Std Stats: {'Max': np.float64(1.0948970072052338), 'Min': np.float64(0.0), 'Mean': np.float64(0.10722213062917926), 'Std': np.float64(0.04435144070668533)}
[I 2024-12-07 00:21:38,800] Trial 107 finished with value: 1.4555555555555557 and parameters: {'x_0_0': 'ad', 'x_0_1': 'ac', 'x_0_2': 'ad', 'x_1_0': 'ab', 'x_1_1': 'ad', 'x_1_2': 'oo'}. Best is trial 99 with value: 0.9444444444444444.
2024-12-07 00:21:51,473 - INFO - Candidate Mean Stats: {'Max': np.float64(2.0), 'Min': np.float64(0.20524277323574816), 'Mean': np.float64(0.48426948522152524), 'Std': np.float64(0.06607059058739734)}
2024-12-07 00:21:51,473 - INFO - Candidate Std Stats: {'Max': np.float64(0.5616783051319983), 'Min': np.float64(0.0), 'Mean': np.float64(0.10454163358105441), 'Std': np.float64(0.04759470854193322)}
[I 2024-12-07 00:21:51,524] Trial 107 finished with value: 1.0666666666666667 and parameters: {'x_0_0': 'bc', 'x_0_1': 'oo', 'x_0_2': 'bd', 'x_1_0': 'oo', 'x_1_1': 'cd', 'x_1_2': 'ad'}. Best is trial 74 with value: 0.8222222222222222.
2024-12-07 00:21:59,244 - INFO - Candidate Mean Stats: {'Max': np.float64(2.0), 'Min': np.float64(0.1724562606289775), 'Mean': np.float64(0.4999701207979069), 'Std': np.float64(0.06876550414983532)}
2024-12-07 00:21:59,246 - INFO - Candidate Std Stats: {'Max': np.float64(0.552235905989766), 'Min': np.float64(0.0), 'Mean': np.float64(0.11912703120939916), 'Std': np.float64(0.0550137320904502)}
[I 2024-12-07 00:21:59,299] Trial 108 finished with value: 0.9666666666666667 and parameters: {'x_0_0': 'ac', 'x_0_1': 'oo', 'x_0_2': 'ad', 'x_1_0': 'oo', 'x_1_1': 'ac', 'x_1_2': 'oo'}. Best is trial 108 with value: 0.9666666666666667.
2024-12-07 00:22:01,177 - INFO - Candidate Mean Stats: {'Max': np.float64(2.0), 'Min': np.float64(0.2899982805726156), 'Mean': np.float64(0.48841991448741173), 'Std': np.float64(0.06156770225961772)}
2024-12-07 00:22:01,177 - INFO - Candidate Std Stats: {'Max': np.float64(1.1209952308783302), 'Min': np.float64(0.0), 'Mean': np.float64(0.10393650895467817), 'Std': np.float64(0.050039963267411135)}
[I 2024-12-07 00:22:01,234] Trial 108 finished with value: 1.3666666666666667 and parameters: {'x_0_0': 'bc', 'x_0_1': 'bc', 'x_0_2': 'ac', 'x_1_0': 'oo', 'x_1_1': 'cd', 'x_1_2': 'oo'}. Best is trial 49 with value: 0.7999999999999999.
2024-12-07 00:22:04,341 - INFO - Candidate Mean Stats: {'Max': np.float64(2.0), 'Min': np.float64(0.2526561889432507), 'Mean': np.float64(0.4992612103638948), 'Std': np.float64(0.06977100332393965)}
2024-12-07 00:22:04,342 - INFO - Candidate Std Stats: {'Max': np.float64(0.46389156559566175), 'Min': np.float64(0.0), 'Mean': np.float64(0.11099987561658091), 'Std': np.float64(0.04878970083381312)}
[I 2024-12-07 00:22:04,396] Trial 108 finished with value: 1.1666666666666665 and parameters: {'x_0_0': 'bc', 'x_0_1': 'oo', 'x_0_2': 'bc', 'x_1_0': 'ab', 'x_1_1': 'oo', 'x_1_2': 'ab'}. Best is trial 99 with value: 0.9444444444444444.
2024-12-07 00:22:17,657 - INFO - Candidate Mean Stats: {'Max': np.float64(2.0), 'Min': np.float64(0.25797811058976405), 'Mean': np.float64(0.4921330089201461), 'Std': np.float64(0.0698659865807862)}
2024-12-07 00:22:17,658 - INFO - Candidate Std Stats: {'Max': np.float64(1.3291781322608245), 'Min': np.float64(0.0), 'Mean': np.float64(0.11164627444696099), 'Std': np.float64(0.05540240845205471)}
[I 2024-12-07 00:22:17,712] Trial 108 finished with value: 2.0 and parameters: {'x_0_0': 'cd', 'x_0_1': 'bd', 'x_0_2': 'ac', 'x_1_0': 'ac', 'x_1_1': 'ad', 'x_1_2': 'bc'}. Best is trial 74 with value: 0.8222222222222222.
2024-12-07 00:22:25,460 - INFO - Candidate Mean Stats: {'Max': np.float64(2.0), 'Min': np.float64(0.18607455026793102), 'Mean': np.float64(0.4865497247603072), 'Std': np.float64(0.06927626551618321)}
2024-12-07 00:22:25,461 - INFO - Candidate Std Stats: {'Max': np.float64(0.7210669443491837), 'Min': np.float64(0.0), 'Mean': np.float64(0.10917435714623927), 'Std': np.float64(0.05117446729964518)}
[I 2024-12-07 00:22:25,513] Trial 109 finished with value: 1.6666666666666665 and parameters: {'x_0_0': 'bd', 'x_0_1': 'cd', 'x_0_2': 'ad', 'x_1_0': 'cd', 'x_1_1': 'ac', 'x_1_2': 'ab'}. Best is trial 108 with value: 0.9666666666666667.
2024-12-07 00:22:27,502 - INFO - Candidate Mean Stats: {'Max': np.float64(2.0), 'Min': np.float64(0.28088014250746063), 'Mean': np.float64(0.4963842737611966), 'Std': np.float64(0.06420694548727311)}
2024-12-07 00:22:27,502 - INFO - Candidate Std Stats: {'Max': np.float64(0.5023644338414145), 'Min': np.float64(0.0), 'Mean': np.float64(0.10805386113643903), 'Std': np.float64(0.04540592866813885)}
[I 2024-12-07 00:22:27,554] Trial 109 finished with value: 1.7777777777777777 and parameters: {'x_0_0': 'ab', 'x_0_1': 'bd', 'x_0_2': 'ab', 'x_1_0': 'ac', 'x_1_1': 'ab', 'x_1_2': 'cd'}. Best is trial 49 with value: 0.7999999999999999.
2024-12-07 00:22:30,235 - INFO - Candidate Mean Stats: {'Max': np.float64(2.0), 'Min': np.float64(0.2569391763669332), 'Mean': np.float64(0.4840032681670665), 'Std': np.float64(0.06353177190514804)}
2024-12-07 00:22:30,236 - INFO - Candidate Std Stats: {'Max': np.float64(0.4302475223292324), 'Min': np.float64(0.0), 'Mean': np.float64(0.10277289980382619), 'Std': np.float64(0.04400404903535809)}
[I 2024-12-07 00:22:30,286] Trial 109 finished with value: 1.3555555555555556 and parameters: {'x_0_0': 'bc', 'x_0_1': 'ab', 'x_0_2': 'cd', 'x_1_0': 'oo', 'x_1_1': 'ac', 'x_1_2': 'bc'}. Best is trial 99 with value: 0.9444444444444444.
2024-12-07 00:22:42,408 - INFO - Candidate Mean Stats: {'Max': np.float64(2.0), 'Min': np.float64(0.276424395594723), 'Mean': np.float64(0.4886719000961786), 'Std': np.float64(0.06541595027559828)}
2024-12-07 00:22:42,408 - INFO - Candidate Std Stats: {'Max': np.float64(1.5468385655692964), 'Min': np.float64(0.0), 'Mean': np.float64(0.10854368040484108), 'Std': np.float64(0.05274408895243987)}
[I 2024-12-07 00:22:42,459] Trial 109 finished with value: 1.3555555555555556 and parameters: {'x_0_0': 'ac', 'x_0_1': 'ab', 'x_0_2': 'oo', 'x_1_0': 'bd', 'x_1_1': 'cd', 'x_1_2': 'oo'}. Best is trial 74 with value: 0.8222222222222222.
2024-12-07 00:22:50,117 - INFO - Candidate Mean Stats: {'Max': np.float64(2.0), 'Min': np.float64(0.2544014875606512), 'Mean': np.float64(0.4923545552032809), 'Std': np.float64(0.0666839285482056)}
2024-12-07 00:22:50,118 - INFO - Candidate Std Stats: {'Max': np.float64(0.9071155594177536), 'Min': np.float64(0.0), 'Mean': np.float64(0.10208971767398374), 'Std': np.float64(0.04685047173546487)}
[I 2024-12-07 00:22:50,169] Trial 110 finished with value: 1.6666666666666665 and parameters: {'x_0_0': 'ac', 'x_0_1': 'cd', 'x_0_2': 'cd', 'x_1_0': 'bd', 'x_1_1': 'cd', 'x_1_2': 'ad'}. Best is trial 108 with value: 0.9666666666666667.
2024-12-07 00:22:52,300 - INFO - Candidate Mean Stats: {'Max': np.float64(2.0), 'Min': np.float64(0.15499669883573314), 'Mean': np.float64(0.49530822967824384), 'Std': np.float64(0.07058079960829604)}
2024-12-07 00:22:52,300 - INFO - Candidate Std Stats: {'Max': np.float64(0.6759550620546287), 'Min': np.float64(0.0), 'Mean': np.float64(0.10641022860921902), 'Std': np.float64(0.05067425689630062)}
[I 2024-12-07 00:22:52,350] Trial 110 finished with value: 1.3444444444444446 and parameters: {'x_0_0': 'ad', 'x_0_1': 'ac', 'x_0_2': 'ab', 'x_1_0': 'bd', 'x_1_1': 'ab', 'x_1_2': 'oo'}. Best is trial 49 with value: 0.7999999999999999.
2024-12-07 00:22:54,506 - INFO - Candidate Mean Stats: {'Max': np.float64(2.0), 'Min': np.float64(0.2789485378500075), 'Mean': np.float64(0.48898725014110533), 'Std': np.float64(0.06312299493780434)}
2024-12-07 00:22:54,507 - INFO - Candidate Std Stats: {'Max': np.float64(0.35362740284398536), 'Min': np.float64(0.0), 'Mean': np.float64(0.09780902359554187), 'Std': np.float64(0.03920904436168342)}
[I 2024-12-07 00:22:54,554] Trial 110 finished with value: 1.2222222222222223 and parameters: {'x_0_0': 'ad', 'x_0_1': 'ab', 'x_0_2': 'bc', 'x_1_0': 'bc', 'x_1_1': 'ad', 'x_1_2': 'bd'}. Best is trial 99 with value: 0.9444444444444444.
2024-12-07 00:23:06,835 - INFO - Candidate Mean Stats: {'Max': np.float64(2.0), 'Min': np.float64(0.2866950417738725), 'Mean': np.float64(0.48200168543954464), 'Std': np.float64(0.06465895739086537)}
2024-12-07 00:23:06,835 - INFO - Candidate Std Stats: {'Max': np.float64(1.1188488109826362), 'Min': np.float64(0.0), 'Mean': np.float64(0.09732672209144268), 'Std': np.float64(0.0451395911680983)}
[I 2024-12-07 00:23:06,885] Trial 110 finished with value: 1.4555555555555555 and parameters: {'x_0_0': 'bc', 'x_0_1': 'ab', 'x_0_2': 'oo', 'x_1_0': 'ac', 'x_1_1': 'cd', 'x_1_2': 'cd'}. Best is trial 74 with value: 0.8222222222222222.
2024-12-07 00:23:15,023 - INFO - Candidate Mean Stats: {'Max': np.float64(2.0), 'Min': np.float64(0.25244407617788744), 'Mean': np.float64(0.4796569387049488), 'Std': np.float64(0.07495475809870925)}
2024-12-07 00:23:15,024 - INFO - Candidate Std Stats: {'Max': np.float64(1.5123671697530157), 'Min': np.float64(0.0), 'Mean': np.float64(0.12174010574751246), 'Std': np.float64(0.06656555393484427)}
[I 2024-12-07 00:23:15,134] Trial 111 finished with value: 1.7 and parameters: {'x_0_0': 'oo', 'x_0_1': 'cd', 'x_0_2': 'ab', 'x_1_0': 'oo', 'x_1_1': 'bc', 'x_1_2': 'cd'}. Best is trial 108 with value: 0.9666666666666667.
2024-12-07 00:23:18,958 - INFO - Candidate Mean Stats: {'Max': np.float64(2.0), 'Min': np.float64(0.2782671199285068), 'Mean': np.float64(0.4867477186730586), 'Std': np.float64(0.06724897564731103)}
2024-12-07 00:23:18,958 - INFO - Candidate Std Stats: {'Max': np.float64(0.5948916320093787), 'Min': np.float64(0.0), 'Mean': np.float64(0.11140792730491886), 'Std': np.float64(0.046973707309373024)}
[I 2024-12-07 00:23:19,059] Trial 111 finished with value: 1.5555555555555556 and parameters: {'x_0_0': 'ad', 'x_0_1': 'ad', 'x_0_2': 'ab', 'x_1_0': 'ab', 'x_1_1': 'cd', 'x_1_2': 'ac'}. Best is trial 49 with value: 0.7999999999999999.
2024-12-07 00:23:21,727 - INFO - Candidate Mean Stats: {'Max': np.float64(2.0), 'Min': np.float64(0.18642469059057665), 'Mean': np.float64(0.4899861900036782), 'Std': np.float64(0.07042744555955566)}
2024-12-07 00:23:21,728 - INFO - Candidate Std Stats: {'Max': np.float64(0.7897582474764856), 'Min': np.float64(0.0), 'Mean': np.float64(0.10968793470468795), 'Std': np.float64(0.054089983850659426)}
[I 2024-12-07 00:23:21,773] Trial 111 finished with value: 1.9 and parameters: {'x_0_0': 'oo', 'x_0_1': 'bc', 'x_0_2': 'ab', 'x_1_0': 'bd', 'x_1_1': 'ad', 'x_1_2': 'bc'}. Best is trial 99 with value: 0.9444444444444444.
2024-12-07 00:23:32,931 - INFO - Candidate Mean Stats: {'Max': np.float64(2.0), 'Min': np.float64(0.30613260304443213), 'Mean': np.float64(0.49784956129840185), 'Std': np.float64(0.06283501783944552)}
2024-12-07 00:23:32,931 - INFO - Candidate Std Stats: {'Max': np.float64(0.5149012812229102), 'Min': np.float64(0.0), 'Mean': np.float64(0.10641010297382453), 'Std': np.float64(0.04520214071122695)}
[I 2024-12-07 00:23:32,980] Trial 111 finished with value: 1.0222222222222221 and parameters: {'x_0_0': 'bc', 'x_0_1': 'ac', 'x_0_2': 'ac', 'x_1_0': 'oo', 'x_1_1': 'ab', 'x_1_2': 'bc'}. Best is trial 74 with value: 0.8222222222222222.
2024-12-07 00:23:39,695 - INFO - Candidate Mean Stats: {'Max': np.float64(2.0), 'Min': np.float64(0.24114306540794134), 'Mean': np.float64(0.4842767710311615), 'Std': np.float64(0.06838221306159048)}
2024-12-07 00:23:39,696 - INFO - Candidate Std Stats: {'Max': np.float64(0.6067543557608953), 'Min': np.float64(0.0), 'Mean': np.float64(0.10385805737890717), 'Std': np.float64(0.04712081832213942)}
