[I 2024-12-07 00:31:50,755] Trial 129 finished with value: 1.2666666666666666 and parameters: {'x_0_0': 'bc', 'x_0_1': 'oo', 'x_0_2': 'ab', 'x_1_0': 'cd', 'x_1_1': 'ad', 'x_1_2': 'cd'}. Best is trial 108 with value: 0.9666666666666667.
2024-12-07 00:31:53,922 - INFO - Candidate Mean Stats: {'Max': np.float64(2.0), 'Min': np.float64(0.23607862122828244), 'Mean': np.float64(0.5043905781441872), 'Std': np.float64(0.06955405415547074)}
2024-12-07 00:31:53,922 - INFO - Candidate Std Stats: {'Max': np.float64(0.5260771669549562), 'Min': np.float64(0.0), 'Mean': np.float64(0.10948724505132124), 'Std': np.float64(0.047725759224490856)}
[I 2024-12-07 00:31:53,965] Trial 129 finished with value: 1.4666666666666668 and parameters: {'x_0_0': 'ac', 'x_0_1': 'cd', 'x_0_2': 'ab', 'x_1_0': 'bd', 'x_1_1': 'oo', 'x_1_2': 'oo'}. Best is trial 49 with value: 0.7999999999999999.
2024-12-07 00:31:55,577 - INFO - Candidate Mean Stats: {'Max': np.float64(2.0), 'Min': np.float64(0.2079130793520972), 'Mean': np.float64(0.48767934435600646), 'Std': np.float64(0.0660230951437462)}
2024-12-07 00:31:55,577 - INFO - Candidate Std Stats: {'Max': np.float64(0.44367338416627333), 'Min': np.float64(0.0), 'Mean': np.float64(0.10687774299562829), 'Std': np.float64(0.04409308770816693)}
[I 2024-12-07 00:31:55,619] Trial 129 finished with value: 1.577777777777778 and parameters: {'x_0_0': 'ab', 'x_0_1': 'cd', 'x_0_2': 'ab', 'x_1_0': 'ac', 'x_1_1': 'oo', 'x_1_2': 'oo'}. Best is trial 118 with value: 0.8666666666666667.
2024-12-07 00:32:04,617 - INFO - Candidate Mean Stats: {'Max': np.float64(2.0), 'Min': np.float64(0.23333161428441174), 'Mean': np.float64(0.48874655278425355), 'Std': np.float64(0.0656056910535924)}
2024-12-07 00:32:04,617 - INFO - Candidate Std Stats: {'Max': np.float64(0.5195026207605079), 'Min': np.float64(0.0), 'Mean': np.float64(0.10294129007188685), 'Std': np.float64(0.04407082908504149)}
[I 2024-12-07 00:32:04,657] Trial 129 finished with value: 1.8 and parameters: {'x_0_0': 'oo', 'x_0_1': 'bc', 'x_0_2': 'oo', 'x_1_0': 'bd', 'x_1_1': 'bd', 'x_1_2': 'bc'}. Best is trial 74 with value: 0.8222222222222222.
2024-12-07 00:32:10,051 - INFO - Candidate Mean Stats: {'Max': np.float64(2.0), 'Min': np.float64(0.2556250199017546), 'Mean': np.float64(0.4924168087642859), 'Std': np.float64(0.06950558025258458)}
2024-12-07 00:32:10,052 - INFO - Candidate Std Stats: {'Max': np.float64(0.7899755171953128), 'Min': np.float64(0.0), 'Mean': np.float64(0.10904963088206576), 'Std': np.float64(0.04577264581785785)}
[I 2024-12-07 00:32:10,094] Trial 130 finished with value: 1.5 and parameters: {'x_0_0': 'oo', 'x_0_1': 'oo', 'x_0_2': 'ac', 'x_1_0': 'ad', 'x_1_1': 'bd', 'x_1_2': 'ad'}. Best is trial 108 with value: 0.9666666666666667.
2024-12-07 00:32:13,213 - INFO - Candidate Mean Stats: {'Max': np.float64(2.0), 'Min': np.float64(0.2391383639433668), 'Mean': np.float64(0.49128332777936623), 'Std': np.float64(0.07325660444526269)}
2024-12-07 00:32:13,214 - INFO - Candidate Std Stats: {'Max': np.float64(0.5244751796176454), 'Min': np.float64(0.0), 'Mean': np.float64(0.10811035259681519), 'Std': np.float64(0.0470646692637722)}
[I 2024-12-07 00:32:13,255] Trial 130 finished with value: 1.4555555555555557 and parameters: {'x_0_0': 'bc', 'x_0_1': 'ab', 'x_0_2': 'cd', 'x_1_0': 'ad', 'x_1_1': 'bd', 'x_1_2': 'oo'}. Best is trial 49 with value: 0.7999999999999999.
2024-12-07 00:32:14,977 - INFO - Candidate Mean Stats: {'Max': np.float64(2.0), 'Min': np.float64(0.2828641994721404), 'Mean': np.float64(0.5002990826744274), 'Std': np.float64(0.07210067716959472)}
2024-12-07 00:32:14,978 - INFO - Candidate Std Stats: {'Max': np.float64(0.3295392771850614), 'Min': np.float64(0.0), 'Mean': np.float64(0.10109287228578794), 'Std': np.float64(0.04237940409824816)}
[I 2024-12-07 00:32:15,021] Trial 130 finished with value: 1.6666666666666665 and parameters: {'x_0_0': 'bd', 'x_0_1': 'ac', 'x_0_2': 'ab', 'x_1_0': 'ac', 'x_1_1': 'cd', 'x_1_2': 'bd'}. Best is trial 118 with value: 0.8666666666666667.
2024-12-07 00:32:24,405 - INFO - Candidate Mean Stats: {'Max': np.float64(2.0), 'Min': np.float64(0.27150949422929366), 'Mean': np.float64(0.49516025024675964), 'Std': np.float64(0.0640014912715148)}
2024-12-07 00:32:24,406 - INFO - Candidate Std Stats: {'Max': np.float64(0.35433322243979226), 'Min': np.float64(0.0), 'Mean': np.float64(0.09825848082994021), 'Std': np.float64(0.04170219652939369)}
[I 2024-12-07 00:32:24,448] Trial 130 finished with value: 1.3555555555555556 and parameters: {'x_0_0': 'ac', 'x_0_1': 'ab', 'x_0_2': 'ac', 'x_1_0': 'oo', 'x_1_1': 'ad', 'x_1_2': 'ad'}. Best is trial 74 with value: 0.8222222222222222.
2024-12-07 00:32:29,379 - INFO - Candidate Mean Stats: {'Max': np.float64(2.0), 'Min': np.float64(0.23409737552305013), 'Mean': np.float64(0.48647480719151326), 'Std': np.float64(0.06874626300996628)}
2024-12-07 00:32:29,380 - INFO - Candidate Std Stats: {'Max': np.float64(0.38268493857861213), 'Min': np.float64(0.0), 'Mean': np.float64(0.1057741550285549), 'Std': np.float64(0.043324878595085554)}
[I 2024-12-07 00:32:29,423] Trial 131 finished with value: 1.4666666666666666 and parameters: {'x_0_0': 'bc', 'x_0_1': 'bd', 'x_0_2': 'ad', 'x_1_0': 'oo', 'x_1_1': 'ac', 'x_1_2': 'ad'}. Best is trial 108 with value: 0.9666666666666667.
2024-12-07 00:32:31,743 - INFO - Candidate Mean Stats: {'Max': np.float64(2.0), 'Min': np.float64(0.2149274617715223), 'Mean': np.float64(0.48651779459314504), 'Std': np.float64(0.07069623589148406)}
2024-12-07 00:32:31,743 - INFO - Candidate Std Stats: {'Max': np.float64(1.5042160711496146), 'Min': np.float64(0.0), 'Mean': np.float64(0.10855161298540955), 'Std': np.float64(0.04809418606809983)}
[I 2024-12-07 00:32:31,786] Trial 131 finished with value: 1.7777777777777777 and parameters: {'x_0_0': 'ab', 'x_0_1': 'ac', 'x_0_2': 'ab', 'x_1_0': 'ad', 'x_1_1': 'ac', 'x_1_2': 'bd'}. Best is trial 49 with value: 0.7999999999999999.
2024-12-07 00:32:33,900 - INFO - Candidate Mean Stats: {'Max': np.float64(2.0), 'Min': np.float64(0.2818451197308482), 'Mean': np.float64(0.49085517715630045), 'Std': np.float64(0.070008965164707)}
2024-12-07 00:32:33,900 - INFO - Candidate Std Stats: {'Max': np.float64(1.3552617284728519), 'Min': np.float64(0.0), 'Mean': np.float64(0.1052994214277086), 'Std': np.float64(0.04810771654614473)}
[I 2024-12-07 00:32:33,942] Trial 131 finished with value: 1.6666666666666665 and parameters: {'x_0_0': 'ac', 'x_0_1': 'cd', 'x_0_2': 'ad', 'x_1_0': 'bc', 'x_1_1': 'ab', 'x_1_2': 'ac'}. Best is trial 118 with value: 0.8666666666666667.
2024-12-07 00:32:43,865 - INFO - Candidate Mean Stats: {'Max': np.float64(2.0), 'Min': np.float64(0.2159422817839653), 'Mean': np.float64(0.48314899091462316), 'Std': np.float64(0.07535699949309564)}
2024-12-07 00:32:43,865 - INFO - Candidate Std Stats: {'Max': np.float64(0.9517258782259852), 'Min': np.float64(0.0), 'Mean': np.float64(0.11864648984333155), 'Std': np.float64(0.05598085986092195)}
[I 2024-12-07 00:32:43,907] Trial 131 finished with value: 1.9 and parameters: {'x_0_0': 'oo', 'x_0_1': 'ac', 'x_0_2': 'bc', 'x_1_0': 'ad', 'x_1_1': 'ac', 'x_1_2': 'ac'}. Best is trial 74 with value: 0.8222222222222222.
2024-12-07 00:32:49,127 - INFO - Candidate Mean Stats: {'Max': np.float64(2.0), 'Min': np.float64(0.24372979795880217), 'Mean': np.float64(0.49196491473717574), 'Std': np.float64(0.07051844879587404)}
2024-12-07 00:32:49,127 - INFO - Candidate Std Stats: {'Max': np.float64(1.0131660161048033), 'Min': np.float64(0.0), 'Mean': np.float64(0.11106937822407974), 'Std': np.float64(0.0502205498165212)}
[I 2024-12-07 00:32:49,167] Trial 132 finished with value: 1.4444444444444444 and parameters: {'x_0_0': 'ad', 'x_0_1': 'bd', 'x_0_2': 'ab', 'x_1_0': 'bd', 'x_1_1': 'ab', 'x_1_2': 'bd'}. Best is trial 108 with value: 0.9666666666666667.
2024-12-07 00:32:51,217 - INFO - Candidate Mean Stats: {'Max': np.float64(2.0), 'Min': np.float64(0.27755358435242145), 'Mean': np.float64(0.4903703143881134), 'Std': np.float64(0.07099580271983941)}
2024-12-07 00:32:51,217 - INFO - Candidate Std Stats: {'Max': np.float64(0.8167577660577194), 'Min': np.float64(0.0), 'Mean': np.float64(0.10711763331195538), 'Std': np.float64(0.04977783072552006)}
[I 2024-12-07 00:32:51,260] Trial 132 finished with value: 1.3666666666666667 and parameters: {'x_0_0': 'ad', 'x_0_1': 'bc', 'x_0_2': 'oo', 'x_1_0': 'oo', 'x_1_1': 'bc', 'x_1_2': 'cd'}. Best is trial 49 with value: 0.7999999999999999.
2024-12-07 00:32:53,299 - INFO - Candidate Mean Stats: {'Max': np.float64(2.0), 'Min': np.float64(0.26061542336620225), 'Mean': np.float64(0.49807924011760385), 'Std': np.float64(0.06987648784095034)}
2024-12-07 00:32:53,299 - INFO - Candidate Std Stats: {'Max': np.float64(0.6326510843095104), 'Min': np.float64(0.0), 'Mean': np.float64(0.110768073669987), 'Std': np.float64(0.04964258318584852)}
[I 2024-12-07 00:32:53,341] Trial 132 finished with value: 1.1777777777777778 and parameters: {'x_0_0': 'ab', 'x_0_1': 'oo', 'x_0_2': 'ac', 'x_1_0': 'oo', 'x_1_1': 'bc', 'x_1_2': 'cd'}. Best is trial 118 with value: 0.8666666666666667.
2024-12-07 00:33:03,371 - INFO - Candidate Mean Stats: {'Max': np.float64(2.0), 'Min': np.float64(0.1912285639226877), 'Mean': np.float64(0.4811980220976891), 'Std': np.float64(0.08192766197101235)}
2024-12-07 00:33:03,372 - INFO - Candidate Std Stats: {'Max': np.float64(1.2765897477665908), 'Min': np.float64(0.0), 'Mean': np.float64(0.1215926907964341), 'Std': np.float64(0.06340806818879896)}
[I 2024-12-07 00:33:03,414] Trial 132 finished with value: 1.4444444444444444 and parameters: {'x_0_0': 'ad', 'x_0_1': 'ab', 'x_0_2': 'bc', 'x_1_0': 'bd', 'x_1_1': 'bd', 'x_1_2': 'bc'}. Best is trial 74 with value: 0.8222222222222222.
2024-12-07 00:33:08,540 - INFO - Candidate Mean Stats: {'Max': np.float64(2.0), 'Min': np.float64(0.18817949737405884), 'Mean': np.float64(0.48963439221845373), 'Std': np.float64(0.07164068441289038)}
2024-12-07 00:33:08,541 - INFO - Candidate Std Stats: {'Max': np.float64(0.9165763152409124), 'Min': np.float64(0.0), 'Mean': np.float64(0.10482514432894507), 'Std': np.float64(0.04947064165084769)}
[I 2024-12-07 00:33:08,584] Trial 133 finished with value: 1.4666666666666666 and parameters: {'x_0_0': 'ad', 'x_0_1': 'ac', 'x_0_2': 'cd', 'x_1_0': 'oo', 'x_1_1': 'ac', 'x_1_2': 'ab'}. Best is trial 108 with value: 0.9666666666666667.
2024-12-07 00:33:10,915 - INFO - Candidate Mean Stats: {'Max': np.float64(2.0), 'Min': np.float64(0.26510720732443743), 'Mean': np.float64(0.493257256618437), 'Std': np.float64(0.0668476505681131)}
2024-12-07 00:33:10,916 - INFO - Candidate Std Stats: {'Max': np.float64(0.5441151241778649), 'Min': np.float64(0.0), 'Mean': np.float64(0.10444339787714411), 'Std': np.float64(0.04338840018746436)}
[I 2024-12-07 00:33:10,959] Trial 133 finished with value: 1.4444444444444444 and parameters: {'x_0_0': 'ad', 'x_0_1': 'bd', 'x_0_2': 'cd', 'x_1_0': 'bd', 'x_1_1': 'cd', 'x_1_2': 'ad'}. Best is trial 49 with value: 0.7999999999999999.
2024-12-07 00:33:12,835 - INFO - Candidate Mean Stats: {'Max': np.float64(2.0), 'Min': np.float64(0.19064005059543593), 'Mean': np.float64(0.4921217403411919), 'Std': np.float64(0.06946447019503081)}
2024-12-07 00:33:12,836 - INFO - Candidate Std Stats: {'Max': np.float64(0.3514446669956329), 'Min': np.float64(0.0), 'Mean': np.float64(0.1077898586775721), 'Std': np.float64(0.04348888872307737)}
[I 2024-12-07 00:33:12,879] Trial 133 finished with value: 1.4444444444444444 and parameters: {'x_0_0': 'ad', 'x_0_1': 'cd', 'x_0_2': 'ab', 'x_1_0': 'bd', 'x_1_1': 'ac', 'x_1_2': 'bd'}. Best is trial 118 with value: 0.8666666666666667.
2024-12-07 00:33:23,044 - INFO - Candidate Mean Stats: {'Max': np.float64(2.0), 'Min': np.float64(0.22357220746672857), 'Mean': np.float64(0.4885196469847185), 'Std': np.float64(0.06765962193900782)}
2024-12-07 00:33:23,044 - INFO - Candidate Std Stats: {'Max': np.float64(0.39866819540155396), 'Min': np.float64(0.0), 'Mean': np.float64(0.09954141755311062), 'Std': np.float64(0.04225710031621484)}
[I 2024-12-07 00:33:23,087] Trial 133 finished with value: 1.6666666666666665 and parameters: {'x_0_0': 'bc', 'x_0_1': 'bd', 'x_0_2': 'ac', 'x_1_0': 'ac', 'x_1_1': 'bc', 'x_1_2': 'ad'}. Best is trial 74 with value: 0.8222222222222222.
2024-12-07 00:33:28,146 - INFO - Candidate Mean Stats: {'Max': np.float64(2.0), 'Min': np.float64(0.25494588826266745), 'Mean': np.float64(0.4875894836701363), 'Std': np.float64(0.06905464473847031)}
2024-12-07 00:33:28,146 - INFO - Candidate Std Stats: {'Max': np.float64(1.4490036242262354), 'Min': np.float64(0.0), 'Mean': np.float64(0.10268710166997157), 'Std': np.float64(0.046592698110218767)}
[I 2024-12-07 00:33:28,188] Trial 134 finished with value: 1.5555555555555556 and parameters: {'x_0_0': 'ac', 'x_0_1': 'ab', 'x_0_2': 'bd', 'x_1_0': 'ab', 'x_1_1': 'bc', 'x_1_2': 'ab'}. Best is trial 108 with value: 0.9666666666666667.
2024-12-07 00:33:30,663 - INFO - Candidate Mean Stats: {'Max': np.float64(2.0), 'Min': np.float64(0.23189353793093975), 'Mean': np.float64(0.48353700114609943), 'Std': np.float64(0.08170584764980576)}
2024-12-07 00:33:30,664 - INFO - Candidate Std Stats: {'Max': np.float64(1.4563522815937773), 'Min': np.float64(0.0), 'Mean': np.float64(0.13378883194652202), 'Std': np.float64(0.07610583639075298)}
[I 2024-12-07 00:33:30,703] Trial 134 finished with value: 1.2444444444444445 and parameters: {'x_0_0': 'bc', 'x_0_1': 'ac', 'x_0_2': 'bc', 'x_1_0': 'oo', 'x_1_1': 'bc', 'x_1_2': 'ac'}. Best is trial 49 with value: 0.7999999999999999.
2024-12-07 00:33:32,727 - INFO - Candidate Mean Stats: {'Max': np.float64(2.0), 'Min': np.float64(0.2273381793628781), 'Mean': np.float64(0.47856487279162435), 'Std': np.float64(0.07708614051769502)}
2024-12-07 00:33:32,727 - INFO - Candidate Std Stats: {'Max': np.float64(1.4842195147182182), 'Min': np.float64(0.0), 'Mean': np.float64(0.12093445223495326), 'Std': np.float64(0.06979383683346699)}
[I 2024-12-07 00:33:32,768] Trial 134 finished with value: 1.0444444444444443 and parameters: {'x_0_0': 'bd', 'x_0_1': 'oo', 'x_0_2': 'bc', 'x_1_0': 'bd', 'x_1_1': 'ab', 'x_1_2': 'bd'}. Best is trial 118 with value: 0.8666666666666667.
2024-12-07 00:33:42,863 - INFO - Candidate Mean Stats: {'Max': np.float64(2.0), 'Min': np.float64(0.27819475492722334), 'Mean': np.float64(0.4852537305469236), 'Std': np.float64(0.06587481420609527)}
2024-12-07 00:33:42,863 - INFO - Candidate Std Stats: {'Max': np.float64(1.2700059907570704), 'Min': np.float64(0.0), 'Mean': np.float64(0.10364703818238499), 'Std': np.float64(0.04610961321249446)}
[I 2024-12-07 00:33:42,906] Trial 134 finished with value: 1.2222222222222223 and parameters: {'x_0_0': 'ad', 'x_0_1': 'ac', 'x_0_2': 'ab', 'x_1_0': 'bc', 'x_1_1': 'ad', 'x_1_2': 'ad'}. Best is trial 74 with value: 0.8222222222222222.
2024-12-07 00:33:48,332 - INFO - Candidate Mean Stats: {'Max': np.float64(2.0), 'Min': np.float64(0.2653060907479361), 'Mean': np.float64(0.49177144868989925), 'Std': np.float64(0.06816591025926233)}
2024-12-07 00:33:48,333 - INFO - Candidate Std Stats: {'Max': np.float64(1.1891169317837107), 'Min': np.float64(0.0), 'Mean': np.float64(0.10407937029545497), 'Std': np.float64(0.050342591034239034)}
[I 2024-12-07 00:33:48,378] Trial 135 finished with value: 1.5666666666666667 and parameters: {'x_0_0': 'ac', 'x_0_1': 'bd', 'x_0_2': 'bd', 'x_1_0': 'ad', 'x_1_1': 'ac', 'x_1_2': 'oo'}. Best is trial 108 with value: 0.9666666666666667.
2024-12-07 00:33:50,628 - INFO - Candidate Mean Stats: {'Max': np.float64(2.0), 'Min': np.float64(0.2615905444403497), 'Mean': np.float64(0.4930913491885141), 'Std': np.float64(0.07377196201352029)}
2024-12-07 00:33:50,629 - INFO - Candidate Std Stats: {'Max': np.float64(0.8117520747671118), 'Min': np.float64(0.0), 'Mean': np.float64(0.10741674199495631), 'Std': np.float64(0.04835131580216964)}
[I 2024-12-07 00:33:50,674] Trial 135 finished with value: 1.3444444444444446 and parameters: {'x_0_0': 'bc', 'x_0_1': 'ad', 'x_0_2': 'ad', 'x_1_0': 'bd', 'x_1_1': 'ac', 'x_1_2': 'oo'}. Best is trial 49 with value: 0.7999999999999999.
2024-12-07 00:33:52,865 - INFO - Candidate Mean Stats: {'Max': np.float64(2.0), 'Min': np.float64(0.27016123950202425), 'Mean': np.float64(0.4967715645614293), 'Std': np.float64(0.0687329574803842)}
2024-12-07 00:33:52,866 - INFO - Candidate Std Stats: {'Max': np.float64(0.38690683027704714), 'Min': np.float64(0.0), 'Mean': np.float64(0.10262555563881932), 'Std': np.float64(0.04344788062070082)}
[I 2024-12-07 00:33:52,912] Trial 135 finished with value: 1.6777777777777778 and parameters: {'x_0_0': 'ab', 'x_0_1': 'cd', 'x_0_2': 'bc', 'x_1_0': 'cd', 'x_1_1': 'ad', 'x_1_2': 'oo'}. Best is trial 118 with value: 0.8666666666666667.
2024-12-07 00:34:02,782 - INFO - Candidate Mean Stats: {'Max': np.float64(2.0), 'Min': np.float64(0.26085297081869346), 'Mean': np.float64(0.4863197363482675), 'Std': np.float64(0.07357590444939216)}
2024-12-07 00:34:02,782 - INFO - Candidate Std Stats: {'Max': np.float64(1.2680959679223767), 'Min': np.float64(0.0), 'Mean': np.float64(0.10965617570630473), 'Std': np.float64(0.052015685326961034)}
[I 2024-12-07 00:34:02,828] Trial 135 finished with value: 1.4666666666666666 and parameters: {'x_0_0': 'bd', 'x_0_1': 'cd', 'x_0_2': 'cd', 'x_1_0': 'oo', 'x_1_1': 'ac', 'x_1_2': 'bc'}. Best is trial 74 with value: 0.8222222222222222.
2024-12-07 00:34:08,153 - INFO - Candidate Mean Stats: {'Max': np.float64(2.0), 'Min': np.float64(0.2579448081388849), 'Mean': np.float64(0.4887138384739285), 'Std': np.float64(0.07052084766687676)}
2024-12-07 00:34:08,153 - INFO - Candidate Std Stats: {'Max': np.float64(0.9473262155004034), 'Min': np.float64(0.0), 'Mean': np.float64(0.10920056557441805), 'Std': np.float64(0.04887665137872936)}
[I 2024-12-07 00:34:08,200] Trial 136 finished with value: 1.6666666666666665 and parameters: {'x_0_0': 'ac', 'x_0_1': 'cd', 'x_0_2': 'cd', 'x_1_0': 'ac', 'x_1_1': 'bc', 'x_1_2': 'ab'}. Best is trial 108 with value: 0.9666666666666667.
2024-12-07 00:34:10,472 - INFO - Candidate Mean Stats: {'Max': np.float64(2.0), 'Min': np.float64(0.21072631945143455), 'Mean': np.float64(0.4917085892884041), 'Std': np.float64(0.06674675463421252)}
2024-12-07 00:34:10,473 - INFO - Candidate Std Stats: {'Max': np.float64(0.3836307027477617), 'Min': np.float64(0.0), 'Mean': np.float64(0.09609059540493102), 'Std': np.float64(0.04197231437867909)}
[I 2024-12-07 00:34:10,516] Trial 136 finished with value: 1.2666666666666666 and parameters: {'x_0_0': 'ac', 'x_0_1': 'oo', 'x_0_2': 'ab', 'x_1_0': 'bd', 'x_1_1': 'ab', 'x_1_2': 'ad'}. Best is trial 49 with value: 0.7999999999999999.
2024-12-07 00:34:12,726 - INFO - Candidate Mean Stats: {'Max': np.float64(2.0), 'Min': np.float64(0.24102791338560073), 'Mean': np.float64(0.4867747411762935), 'Std': np.float64(0.0684678832972058)}
2024-12-07 00:34:12,727 - INFO - Candidate Std Stats: {'Max': np.float64(0.8818085253181271), 'Min': np.float64(0.0), 'Mean': np.float64(0.10963277797945206), 'Std': np.float64(0.05048292715673368)}
[I 2024-12-07 00:34:12,770] Trial 136 finished with value: 1.6666666666666665 and parameters: {'x_0_0': 'bd', 'x_0_1': 'ad', 'x_0_2': 'bd', 'x_1_0': 'ac', 'x_1_1': 'bd', 'x_1_2': 'ad'}. Best is trial 118 with value: 0.8666666666666667.
2024-12-07 00:34:22,665 - INFO - Candidate Mean Stats: {'Max': np.float64(2.0), 'Min': np.float64(0.26870307857941267), 'Mean': np.float64(0.4912861311169195), 'Std': np.float64(0.06756670561141397)}
2024-12-07 00:34:22,665 - INFO - Candidate Std Stats: {'Max': np.float64(0.8013522724537666), 'Min': np.float64(0.0), 'Mean': np.float64(0.11096019259330021), 'Std': np.float64(0.047184652525746856)}
[I 2024-12-07 00:34:22,707] Trial 136 finished with value: 1.6666666666666665 and parameters: {'x_0_0': 'ac', 'x_0_1': 'cd', 'x_0_2': 'ab', 'x_1_0': 'bd', 'x_1_1': 'bc', 'x_1_2': 'ab'}. Best is trial 74 with value: 0.8222222222222222.
2024-12-07 00:34:28,103 - INFO - Candidate Mean Stats: {'Max': np.float64(2.0), 'Min': np.float64(0.2939381486636124), 'Mean': np.float64(0.4967611648832418), 'Std': np.float64(0.06500004087228581)}
2024-12-07 00:34:28,103 - INFO - Candidate Std Stats: {'Max': np.float64(0.4109735378102299), 'Min': np.float64(0.0), 'Mean': np.float64(0.09925084301416785), 'Std': np.float64(0.04152540498555427)}
[I 2024-12-07 00:34:28,146] Trial 137 finished with value: 1.3444444444444446 and parameters: {'x_0_0': 'bc', 'x_0_1': 'ac', 'x_0_2': 'cd', 'x_1_0': 'ab', 'x_1_1': 'oo', 'x_1_2': 'ad'}. Best is trial 108 with value: 0.9666666666666667.
2024-12-07 00:34:29,901 - INFO - Candidate Mean Stats: {'Max': np.float64(2.0), 'Min': np.float64(0.20027604863157591), 'Mean': np.float64(0.4823772022208716), 'Std': np.float64(0.07278450148546409)}
2024-12-07 00:34:29,901 - INFO - Candidate Std Stats: {'Max': np.float64(1.7291025212146398), 'Min': np.float64(0.0), 'Mean': np.float64(0.10541875980735675), 'Std': np.float64(0.05246685482156522)}
[I 2024-12-07 00:34:29,943] Trial 137 finished with value: 1.5555555555555556 and parameters: {'x_0_0': 'ad', 'x_0_1': 'bc', 'x_0_2': 'bc', 'x_1_0': 'ab', 'x_1_1': 'ac', 'x_1_2': 'ab'}. Best is trial 49 with value: 0.7999999999999999.
2024-12-07 00:34:32,613 - INFO - Candidate Mean Stats: {'Max': np.float64(2.0), 'Min': np.float64(0.251428356402717), 'Mean': np.float64(0.483566346050569), 'Std': np.float64(0.06830658295963889)}
2024-12-07 00:34:32,614 - INFO - Candidate Std Stats: {'Max': np.float64(0.6072777647599907), 'Min': np.float64(0.0), 'Mean': np.float64(0.10649481560883664), 'Std': np.float64(0.04586636941491456)}
