[I 2024-12-07 00:51:43,831] Trial 188 finished with value: 1.4666666666666666 and parameters: {'x_0_0': 'ad', 'x_0_1': 'ac', 'x_0_2': 'cd', 'x_1_0': 'oo', 'x_1_1': 'ac', 'x_1_2': 'cd'}. Best is trial 179 with value: 0.8333333333333333.
2024-12-07 00:51:49,940 - INFO - Candidate Mean Stats: {'Max': np.float64(2.0), 'Min': np.float64(0.1982906595462191), 'Mean': np.float64(0.4889076498948407), 'Std': np.float64(0.07458228419230008)}
2024-12-07 00:51:49,940 - INFO - Candidate Std Stats: {'Max': np.float64(1.836478651306813), 'Min': np.float64(0.0), 'Mean': np.float64(0.10811786706651953), 'Std': np.float64(0.05387044439072864)}
[I 2024-12-07 00:51:49,984] Trial 188 finished with value: 1.2666666666666666 and parameters: {'x_0_0': 'ac', 'x_0_1': 'oo', 'x_0_2': 'ad', 'x_1_0': 'bc', 'x_1_1': 'ad', 'x_1_2': 'bd'}. Best is trial 74 with value: 0.8222222222222222.
2024-12-07 00:51:54,147 - INFO - Candidate Mean Stats: {'Max': np.float64(2.0), 'Min': np.float64(0.29399451476016913), 'Mean': np.float64(0.4905252370080678), 'Std': np.float64(0.07254366357171962)}
2024-12-07 00:51:54,147 - INFO - Candidate Std Stats: {'Max': np.float64(0.43925557091594114), 'Min': np.float64(0.0), 'Mean': np.float64(0.10233320804307743), 'Std': np.float64(0.04354926010107618)}
[I 2024-12-07 00:51:54,186] Trial 189 finished with value: 1.2666666666666666 and parameters: {'x_0_0': 'bc', 'x_0_1': 'oo', 'x_0_2': 'ab', 'x_1_0': 'bd', 'x_1_1': 'bd', 'x_1_2': 'bc'}. Best is trial 148 with value: 0.8333333333333333.
2024-12-07 00:51:56,345 - INFO - Candidate Mean Stats: {'Max': np.float64(2.0), 'Min': np.float64(0.24164204414668852), 'Mean': np.float64(0.4897371024770563), 'Std': np.float64(0.07402045831890523)}
2024-12-07 00:51:56,345 - INFO - Candidate Std Stats: {'Max': np.float64(1.1994972559640231), 'Min': np.float64(0.0), 'Mean': np.float64(0.10490145101146922), 'Std': np.float64(0.04371074721406227)}
[I 2024-12-07 00:51:56,388] Trial 189 finished with value: 1.1666666666666665 and parameters: {'x_0_0': 'bd', 'x_0_1': 'oo', 'x_0_2': 'ac', 'x_1_0': 'cd', 'x_1_1': 'ad', 'x_1_2': 'oo'}. Best is trial 49 with value: 0.7999999999999999.
2024-12-07 00:52:04,024 - INFO - Candidate Mean Stats: {'Max': np.float64(2.0), 'Min': np.float64(0.20978843439387349), 'Mean': np.float64(0.4890733714388749), 'Std': np.float64(0.06994133204683921)}
2024-12-07 00:52:04,024 - INFO - Candidate Std Stats: {'Max': np.float64(0.7780342143501864), 'Min': np.float64(0.0), 'Mean': np.float64(0.1061458492354507), 'Std': np.float64(0.04681212709317123)}
[I 2024-12-07 00:52:04,068] Trial 189 finished with value: 1.2333333333333332 and parameters: {'x_0_0': 'ad', 'x_0_1': 'ac', 'x_0_2': 'oo', 'x_1_0': 'bc', 'x_1_1': 'ab', 'x_1_2': 'bc'}. Best is trial 179 with value: 0.8333333333333333.
2024-12-07 00:52:10,337 - INFO - Candidate Mean Stats: {'Max': np.float64(2.0), 'Min': np.float64(0.26228134534187364), 'Mean': np.float64(0.488820348048531), 'Std': np.float64(0.07324858831553897)}
2024-12-07 00:52:10,338 - INFO - Candidate Std Stats: {'Max': np.float64(1.313417570640167), 'Min': np.float64(0.0), 'Mean': np.float64(0.10847008811221551), 'Std': np.float64(0.05222012752735889)}
[I 2024-12-07 00:52:10,403] Trial 189 finished with value: 1.6666666666666665 and parameters: {'x_0_0': 'ac', 'x_0_1': 'bd', 'x_0_2': 'bc', 'x_1_0': 'bc', 'x_1_1': 'ad', 'x_1_2': 'cd'}. Best is trial 74 with value: 0.8222222222222222.
2024-12-07 00:52:14,450 - INFO - Candidate Mean Stats: {'Max': np.float64(2.0), 'Min': np.float64(0.24586470342762526), 'Mean': np.float64(0.4976557183136835), 'Std': np.float64(0.07666542558959377)}
2024-12-07 00:52:14,451 - INFO - Candidate Std Stats: {'Max': np.float64(1.7247620846954483), 'Min': np.float64(0.0), 'Mean': np.float64(0.11011134087239141), 'Std': np.float64(0.05239855314865637)}
[I 2024-12-07 00:52:14,496] Trial 190 finished with value: 1.4666666666666666 and parameters: {'x_0_0': 'bc', 'x_0_1': 'cd', 'x_0_2': 'ad', 'x_1_0': 'oo', 'x_1_1': 'bd', 'x_1_2': 'bd'}. Best is trial 148 with value: 0.8333333333333333.
2024-12-07 00:52:16,780 - INFO - Candidate Mean Stats: {'Max': np.float64(2.0), 'Min': np.float64(0.2715312036254559), 'Mean': np.float64(0.49089594326967767), 'Std': np.float64(0.07726197948139832)}
2024-12-07 00:52:16,781 - INFO - Candidate Std Stats: {'Max': np.float64(0.8410706458757283), 'Min': np.float64(0.0), 'Mean': np.float64(0.10910355868713321), 'Std': np.float64(0.04971662268256498)}
[I 2024-12-07 00:52:16,826] Trial 190 finished with value: 1.5555555555555556 and parameters: {'x_0_0': 'ac', 'x_0_1': 'ab', 'x_0_2': 'ac', 'x_1_0': 'ad', 'x_1_1': 'cd', 'x_1_2': 'ab'}. Best is trial 49 with value: 0.7999999999999999.
2024-12-07 00:52:24,294 - INFO - Candidate Mean Stats: {'Max': np.float64(2.0), 'Min': np.float64(0.22389194388695452), 'Mean': np.float64(0.4949576593663425), 'Std': np.float64(0.0765805996854331)}
2024-12-07 00:52:24,295 - INFO - Candidate Std Stats: {'Max': np.float64(1.1831952250561357), 'Min': np.float64(0.0), 'Mean': np.float64(0.11966885890068912), 'Std': np.float64(0.05920919536691093)}
[I 2024-12-07 00:52:24,338] Trial 190 finished with value: 1.0666666666666667 and parameters: {'x_0_0': 'ac', 'x_0_1': 'oo', 'x_0_2': 'bc', 'x_1_0': 'oo', 'x_1_1': 'ab', 'x_1_2': 'cd'}. Best is trial 179 with value: 0.8333333333333333.
2024-12-07 00:52:30,750 - INFO - Candidate Mean Stats: {'Max': np.float64(2.0), 'Min': np.float64(0.27159595435776446), 'Mean': np.float64(0.4837108467363184), 'Std': np.float64(0.07429082220330646)}
2024-12-07 00:52:30,750 - INFO - Candidate Std Stats: {'Max': np.float64(0.4992007614150812), 'Min': np.float64(0.0), 'Mean': np.float64(0.10465560103786758), 'Std': np.float64(0.04402005576203043)}
[I 2024-12-07 00:52:30,795] Trial 190 finished with value: 1.1444444444444444 and parameters: {'x_0_0': 'ac', 'x_0_1': 'ad', 'x_0_2': 'bc', 'x_1_0': 'oo', 'x_1_1': 'ac', 'x_1_2': 'oo'}. Best is trial 74 with value: 0.8222222222222222.
2024-12-07 00:52:34,572 - INFO - Candidate Mean Stats: {'Max': np.float64(2.0), 'Min': np.float64(0.27657695441999597), 'Mean': np.float64(0.49364983275438984), 'Std': np.float64(0.07387681254694685)}
2024-12-07 00:52:34,572 - INFO - Candidate Std Stats: {'Max': np.float64(0.5532801656617068), 'Min': np.float64(0.0), 'Mean': np.float64(0.10680983066063034), 'Std': np.float64(0.04570556287793156)}
[I 2024-12-07 00:52:34,616] Trial 191 finished with value: 1.4777777777777779 and parameters: {'x_0_0': 'ab', 'x_0_1': 'ac', 'x_0_2': 'bc', 'x_1_0': 'oo', 'x_1_1': 'bc', 'x_1_2': 'oo'}. Best is trial 148 with value: 0.8333333333333333.
2024-12-07 00:52:36,750 - INFO - Candidate Mean Stats: {'Max': np.float64(2.0), 'Min': np.float64(0.2813858488157327), 'Mean': np.float64(0.49049633753069016), 'Std': np.float64(0.06874532442196135)}
2024-12-07 00:52:36,750 - INFO - Candidate Std Stats: {'Max': np.float64(0.4261687000906739), 'Min': np.float64(0.0), 'Mean': np.float64(0.11123303209541816), 'Std': np.float64(0.04493356635462147)}
[I 2024-12-07 00:52:36,794] Trial 191 finished with value: 1.5666666666666667 and parameters: {'x_0_0': 'bc', 'x_0_1': 'bd', 'x_0_2': 'ab', 'x_1_0': 'ab', 'x_1_1': 'oo', 'x_1_2': 'ad'}. Best is trial 49 with value: 0.7999999999999999.
2024-12-07 00:52:44,428 - INFO - Candidate Mean Stats: {'Max': np.float64(2.0), 'Min': np.float64(0.2188820962702891), 'Mean': np.float64(0.48458432252466976), 'Std': np.float64(0.0745946976536518)}
2024-12-07 00:52:44,428 - INFO - Candidate Std Stats: {'Max': np.float64(1.3589501057677962), 'Min': np.float64(0.0), 'Mean': np.float64(0.10953266609842172), 'Std': np.float64(0.05328982266799225)}
[I 2024-12-07 00:52:44,473] Trial 191 finished with value: 0.9222222222222222 and parameters: {'x_0_0': 'bc', 'x_0_1': 'ac', 'x_0_2': 'ad', 'x_1_0': 'oo', 'x_1_1': 'oo', 'x_1_2': 'cd'}. Best is trial 179 with value: 0.8333333333333333.
2024-12-07 00:52:50,978 - INFO - Candidate Mean Stats: {'Max': np.float64(2.0), 'Min': np.float64(0.250902437866637), 'Mean': np.float64(0.4888958221710169), 'Std': np.float64(0.07722989860011291)}
2024-12-07 00:52:50,979 - INFO - Candidate Std Stats: {'Max': np.float64(1.2207468871597797), 'Min': np.float64(0.0), 'Mean': np.float64(0.11414774565250645), 'Std': np.float64(0.056703019530451294)}
[I 2024-12-07 00:52:51,022] Trial 191 finished with value: 1.3444444444444446 and parameters: {'x_0_0': 'bd', 'x_0_1': 'bc', 'x_0_2': 'ad', 'x_1_0': 'bd', 'x_1_1': 'bc', 'x_1_2': 'oo'}. Best is trial 74 with value: 0.8222222222222222.
2024-12-07 00:52:55,002 - INFO - Candidate Mean Stats: {'Max': np.float64(2.0), 'Min': np.float64(0.2399993986243994), 'Mean': np.float64(0.4959989171897935), 'Std': np.float64(0.0711402663120958)}
2024-12-07 00:52:55,003 - INFO - Candidate Std Stats: {'Max': np.float64(0.39359030423873503), 'Min': np.float64(0.0), 'Mean': np.float64(0.1085588521161404), 'Std': np.float64(0.043780465394441186)}
[I 2024-12-07 00:52:55,047] Trial 192 finished with value: 1.6666666666666665 and parameters: {'x_0_0': 'bc', 'x_0_1': 'bd', 'x_0_2': 'bd', 'x_1_0': 'ac', 'x_1_1': 'cd', 'x_1_2': 'bd'}. Best is trial 148 with value: 0.8333333333333333.
2024-12-07 00:52:57,155 - INFO - Candidate Mean Stats: {'Max': np.float64(2.0), 'Min': np.float64(0.27049306861603956), 'Mean': np.float64(0.49343688929121216), 'Std': np.float64(0.069378140715737)}
2024-12-07 00:52:57,155 - INFO - Candidate Std Stats: {'Max': np.float64(0.33757846700128474), 'Min': np.float64(0.0), 'Mean': np.float64(0.10078989611512945), 'Std': np.float64(0.04166648114987298)}
[I 2024-12-07 00:52:57,200] Trial 192 finished with value: 1.6666666666666665 and parameters: {'x_0_0': 'bd', 'x_0_1': 'ad', 'x_0_2': 'bd', 'x_1_0': 'ac', 'x_1_1': 'bc', 'x_1_2': 'ad'}. Best is trial 49 with value: 0.7999999999999999.
2024-12-07 00:53:04,962 - INFO - Candidate Mean Stats: {'Max': np.float64(2.0), 'Min': np.float64(0.3130783016783928), 'Mean': np.float64(0.49704249719597005), 'Std': np.float64(0.07487040536761813)}
2024-12-07 00:53:04,963 - INFO - Candidate Std Stats: {'Max': np.float64(1.069895222263381), 'Min': np.float64(0.0), 'Mean': np.float64(0.11081825141281744), 'Std': np.float64(0.05616012600107897)}
[I 2024-12-07 00:53:05,006] Trial 192 finished with value: 1.6666666666666665 and parameters: {'x_0_0': 'bc', 'x_0_1': 'bc', 'x_0_2': 'ad', 'x_1_0': 'bc', 'x_1_1': 'bd', 'x_1_2': 'bd'}. Best is trial 179 with value: 0.8333333333333333.
2024-12-07 00:53:11,350 - INFO - Candidate Mean Stats: {'Max': np.float64(2.0), 'Min': np.float64(0.26285953010786933), 'Mean': np.float64(0.49920450662182325), 'Std': np.float64(0.07098213221766958)}
2024-12-07 00:53:11,351 - INFO - Candidate Std Stats: {'Max': np.float64(0.3654963239549507), 'Min': np.float64(0.0), 'Mean': np.float64(0.10413030005292277), 'Std': np.float64(0.0429369070278879)}
[I 2024-12-07 00:53:11,396] Trial 192 finished with value: 1.2666666666666666 and parameters: {'x_0_0': 'bd', 'x_0_1': 'oo', 'x_0_2': 'cd', 'x_1_0': 'ac', 'x_1_1': 'bc', 'x_1_2': 'cd'}. Best is trial 74 with value: 0.8222222222222222.
2024-12-07 00:53:15,586 - INFO - Candidate Mean Stats: {'Max': np.float64(2.0), 'Min': np.float64(0.23346126639465817), 'Mean': np.float64(0.49013512064843917), 'Std': np.float64(0.07537006402591183)}
2024-12-07 00:53:15,587 - INFO - Candidate Std Stats: {'Max': np.float64(0.44813119835786375), 'Min': np.float64(0.0), 'Mean': np.float64(0.10637970843589523), 'Std': np.float64(0.04307661649152255)}
[I 2024-12-07 00:53:15,629] Trial 193 finished with value: 1.1444444444444444 and parameters: {'x_0_0': 'bc', 'x_0_1': 'ad', 'x_0_2': 'oo', 'x_1_0': 'oo', 'x_1_1': 'ac', 'x_1_2': 'ad'}. Best is trial 148 with value: 0.8333333333333333.
2024-12-07 00:53:17,722 - INFO - Candidate Mean Stats: {'Max': np.float64(2.0), 'Min': np.float64(0.2562738183749381), 'Mean': np.float64(0.49378043318902576), 'Std': np.float64(0.07439587748089202)}
2024-12-07 00:53:17,723 - INFO - Candidate Std Stats: {'Max': np.float64(0.45203952977045575), 'Min': np.float64(0.0), 'Mean': np.float64(0.09994383032913515), 'Std': np.float64(0.04156604394634778)}
[I 2024-12-07 00:53:17,767] Trial 193 finished with value: 0.9444444444444444 and parameters: {'x_0_0': 'ad', 'x_0_1': 'oo', 'x_0_2': 'ab', 'x_1_0': 'bc', 'x_1_1': 'cd', 'x_1_2': 'oo'}. Best is trial 49 with value: 0.7999999999999999.
2024-12-07 00:53:25,748 - INFO - Candidate Mean Stats: {'Max': np.float64(2.0), 'Min': np.float64(0.20940801984850715), 'Mean': np.float64(0.49895195518682217), 'Std': np.float64(0.0744287955528387)}
2024-12-07 00:53:25,749 - INFO - Candidate Std Stats: {'Max': np.float64(0.5191557255717582), 'Min': np.float64(0.0), 'Mean': np.float64(0.10690110155832662), 'Std': np.float64(0.04696870987386807)}
[I 2024-12-07 00:53:25,796] Trial 193 finished with value: 1.1333333333333333 and parameters: {'x_0_0': 'bc', 'x_0_1': 'ac', 'x_0_2': 'ab', 'x_1_0': 'cd', 'x_1_1': 'oo', 'x_1_2': 'oo'}. Best is trial 179 with value: 0.8333333333333333.
2024-12-07 00:53:31,984 - INFO - Candidate Mean Stats: {'Max': np.float64(2.0), 'Min': np.float64(0.15840087511392792), 'Mean': np.float64(0.49053655842084537), 'Std': np.float64(0.07095087480970154)}
2024-12-07 00:53:31,985 - INFO - Candidate Std Stats: {'Max': np.float64(0.4104615294361853), 'Min': np.float64(0.0), 'Mean': np.float64(0.10113944094111177), 'Std': np.float64(0.04392394553319832)}
[I 2024-12-07 00:53:32,032] Trial 193 finished with value: 0.9444444444444444 and parameters: {'x_0_0': 'ad', 'x_0_1': 'oo', 'x_0_2': 'bd', 'x_1_0': 'bd', 'x_1_1': 'ab', 'x_1_2': 'oo'}. Best is trial 74 with value: 0.8222222222222222.
2024-12-07 00:53:36,387 - INFO - Candidate Mean Stats: {'Max': np.float64(2.0), 'Min': np.float64(0.2593214475856013), 'Mean': np.float64(0.47893071382069907), 'Std': np.float64(0.07164589257556386)}
2024-12-07 00:53:36,388 - INFO - Candidate Std Stats: {'Max': np.float64(0.5573886725254107), 'Min': np.float64(0.0), 'Mean': np.float64(0.09934576478250703), 'Std': np.float64(0.04286117567615012)}
[I 2024-12-07 00:53:36,433] Trial 194 finished with value: 1.4666666666666666 and parameters: {'x_0_0': 'ac', 'x_0_1': 'bc', 'x_0_2': 'oo', 'x_1_0': 'bc', 'x_1_1': 'ac', 'x_1_2': 'oo'}. Best is trial 148 with value: 0.8333333333333333.
2024-12-07 00:53:38,820 - INFO - Candidate Mean Stats: {'Max': np.float64(2.0), 'Min': np.float64(0.25190640456146807), 'Mean': np.float64(0.4900334808970187), 'Std': np.float64(0.06710366135538832)}
2024-12-07 00:53:38,821 - INFO - Candidate Std Stats: {'Max': np.float64(0.452034752696527), 'Min': np.float64(0.0), 'Mean': np.float64(0.09902570001146695), 'Std': np.float64(0.039743481964744594)}
[I 2024-12-07 00:53:38,866] Trial 194 finished with value: 1.1666666666666665 and parameters: {'x_0_0': 'ac', 'x_0_1': 'oo', 'x_0_2': 'bc', 'x_1_0': 'bd', 'x_1_1': 'cd', 'x_1_2': 'oo'}. Best is trial 49 with value: 0.7999999999999999.
2024-12-07 00:53:46,787 - INFO - Candidate Mean Stats: {'Max': np.float64(2.0), 'Min': np.float64(0.2259130059402407), 'Mean': np.float64(0.4892098590450266), 'Std': np.float64(0.07783037197523948)}
2024-12-07 00:53:46,788 - INFO - Candidate Std Stats: {'Max': np.float64(1.7954471212779053), 'Min': np.float64(0.0), 'Mean': np.float64(0.107205239879447), 'Std': np.float64(0.050509741617041255)}
[I 2024-12-07 00:53:46,834] Trial 194 finished with value: 1.2222222222222223 and parameters: {'x_0_0': 'bd', 'x_0_1': 'bd', 'x_0_2': 'bd', 'x_1_0': 'bc', 'x_1_1': 'ad', 'x_1_2': 'cd'}. Best is trial 179 with value: 0.8333333333333333.
2024-12-07 00:53:52,967 - INFO - Candidate Mean Stats: {'Max': np.float64(2.0), 'Min': np.float64(0.2753971932431397), 'Mean': np.float64(0.4948689645775959), 'Std': np.float64(0.07453980958292605)}
2024-12-07 00:53:52,968 - INFO - Candidate Std Stats: {'Max': np.float64(1.5367521767157701), 'Min': np.float64(0.0), 'Mean': np.float64(0.11327081035193401), 'Std': np.float64(0.0538804853871514)}
[I 2024-12-07 00:53:53,013] Trial 194 finished with value: 0.9666666666666667 and parameters: {'x_0_0': 'ac', 'x_0_1': 'oo', 'x_0_2': 'oo', 'x_1_0': 'oo', 'x_1_1': 'ac', 'x_1_2': 'cd'}. Best is trial 74 with value: 0.8222222222222222.
2024-12-07 00:53:57,293 - INFO - Candidate Mean Stats: {'Max': np.float64(2.0), 'Min': np.float64(0.22762603911156637), 'Mean': np.float64(0.4841390987714382), 'Std': np.float64(0.07203903285199403)}
2024-12-07 00:53:57,294 - INFO - Candidate Std Stats: {'Max': np.float64(0.4245794856976171), 'Min': np.float64(0.0), 'Mean': np.float64(0.09803404726316926), 'Std': np.float64(0.04171790624573094)}
[I 2024-12-07 00:53:57,336] Trial 195 finished with value: 1.0666666666666667 and parameters: {'x_0_0': 'ac', 'x_0_1': 'oo', 'x_0_2': 'oo', 'x_1_0': 'bc', 'x_1_1': 'ad', 'x_1_2': 'oo'}. Best is trial 148 with value: 0.8333333333333333.
2024-12-07 00:53:59,666 - INFO - Candidate Mean Stats: {'Max': np.float64(2.0), 'Min': np.float64(0.1913470053106371), 'Mean': np.float64(0.4814793440923265), 'Std': np.float64(0.07200176966116908)}
2024-12-07 00:53:59,667 - INFO - Candidate Std Stats: {'Max': np.float64(0.5193657596884518), 'Min': np.float64(0.0), 'Mean': np.float64(0.1120745412098574), 'Std': np.float64(0.05227512546439656)}
[I 2024-12-07 00:53:59,718] Trial 195 finished with value: 1.3444444444444446 and parameters: {'x_0_0': 'bc', 'x_0_1': 'ad', 'x_0_2': 'cd', 'x_1_0': 'ab', 'x_1_1': 'oo', 'x_1_2': 'cd'}. Best is trial 49 with value: 0.7999999999999999.
2024-12-07 00:54:07,409 - INFO - Candidate Mean Stats: {'Max': np.float64(2.0), 'Min': np.float64(0.2770348682241349), 'Mean': np.float64(0.4881642645787766), 'Std': np.float64(0.07351521025622432)}
2024-12-07 00:54:07,410 - INFO - Candidate Std Stats: {'Max': np.float64(0.47724459973127464), 'Min': np.float64(0.0), 'Mean': np.float64(0.10809109102812381), 'Std': np.float64(0.04463610563921206)}
[I 2024-12-07 00:54:07,454] Trial 195 finished with value: 1.7 and parameters: {'x_0_0': 'oo', 'x_0_1': 'ad', 'x_0_2': 'bd', 'x_1_0': 'oo', 'x_1_1': 'bc', 'x_1_2': 'ab'}. Best is trial 179 with value: 0.8333333333333333.
2024-12-07 00:54:13,477 - INFO - Candidate Mean Stats: {'Max': np.float64(2.0), 'Min': np.float64(0.105837800701301), 'Mean': np.float64(0.4949847815320772), 'Std': np.float64(0.07285329171095593)}
2024-12-07 00:54:13,478 - INFO - Candidate Std Stats: {'Max': np.float64(0.8523309204038544), 'Min': np.float64(0.0), 'Mean': np.float64(0.10148001776560302), 'Std': np.float64(0.048183003442116526)}
[I 2024-12-07 00:54:13,520] Trial 195 finished with value: 1.3333333333333333 and parameters: {'x_0_0': 'ac', 'x_0_1': 'ac', 'x_0_2': 'ab', 'x_1_0': 'cd', 'x_1_1': 'bc', 'x_1_2': 'ab'}. Best is trial 74 with value: 0.8222222222222222.
2024-12-07 00:54:17,701 - INFO - Candidate Mean Stats: {'Max': np.float64(2.0), 'Min': np.float64(0.23979071068863012), 'Mean': np.float64(0.4862498883071439), 'Std': np.float64(0.0742791529454581)}
2024-12-07 00:54:17,701 - INFO - Candidate Std Stats: {'Max': np.float64(1.6697528328202553), 'Min': np.float64(0.0), 'Mean': np.float64(0.10533121665929411), 'Std': np.float64(0.05306466158643313)}
[I 2024-12-07 00:54:17,745] Trial 196 finished with value: 1.1222222222222222 and parameters: {'x_0_0': 'bc', 'x_0_1': 'ac', 'x_0_2': 'ad', 'x_1_0': 'ab', 'x_1_1': 'ad', 'x_1_2': 'oo'}. Best is trial 148 with value: 0.8333333333333333.
2024-12-07 00:54:20,413 - INFO - Candidate Mean Stats: {'Max': np.float64(2.0), 'Min': np.float64(0.2163998096052925), 'Mean': np.float64(0.4814464446805497), 'Std': np.float64(0.07366762265910319)}
2024-12-07 00:54:20,413 - INFO - Candidate Std Stats: {'Max': np.float64(0.7289331281505976), 'Min': np.float64(0.0), 'Mean': np.float64(0.10604438596475459), 'Std': np.float64(0.046210400556596386)}
[I 2024-12-07 00:54:20,459] Trial 196 finished with value: 1.2444444444444445 and parameters: {'x_0_0': 'ad', 'x_0_1': 'ac', 'x_0_2': 'ad', 'x_1_0': 'bc', 'x_1_1': 'oo', 'x_1_2': 'oo'}. Best is trial 49 with value: 0.7999999999999999.
2024-12-07 00:54:27,783 - INFO - Candidate Mean Stats: {'Max': np.float64(2.0), 'Min': np.float64(0.23707333229459687), 'Mean': np.float64(0.49668058928599784), 'Std': np.float64(0.06984729807733243)}
2024-12-07 00:54:27,783 - INFO - Candidate Std Stats: {'Max': np.float64(0.4306485390884187), 'Min': np.float64(0.0), 'Mean': np.float64(0.10144603712110851), 'Std': np.float64(0.04286818814940001)}
[I 2024-12-07 00:54:27,830] Trial 196 finished with value: 1.7 and parameters: {'x_0_0': 'oo', 'x_0_1': 'ad', 'x_0_2': 'ad', 'x_1_0': 'oo', 'x_1_1': 'ac', 'x_1_2': 'ac'}. Best is trial 179 with value: 0.8333333333333333.
2024-12-07 00:54:34,129 - INFO - Candidate Mean Stats: {'Max': np.float64(2.0), 'Min': np.float64(0.225686925056159), 'Mean': np.float64(0.4825535537556027), 'Std': np.float64(0.07474386949991996)}
2024-12-07 00:54:34,131 - INFO - Candidate Std Stats: {'Max': np.float64(0.49920725373059016), 'Min': np.float64(0.0), 'Mean': np.float64(0.10070386738563795), 'Std': np.float64(0.042430043153754184)}
[I 2024-12-07 00:54:34,181] Trial 196 finished with value: 1.0444444444444443 and parameters: {'x_0_0': 'ad', 'x_0_1': 'oo', 'x_0_2': 'bd', 'x_1_0': 'bd', 'x_1_1': 'ac', 'x_1_2': 'cd'}. Best is trial 74 with value: 0.8222222222222222.
2024-12-07 00:54:38,388 - INFO - Candidate Mean Stats: {'Max': np.float64(2.0), 'Min': np.float64(0.2615743036412577), 'Mean': np.float64(0.4907995074398065), 'Std': np.float64(0.07403724357083787)}
2024-12-07 00:54:38,389 - INFO - Candidate Std Stats: {'Max': np.float64(1.398430198974272), 'Min': np.float64(0.0), 'Mean': np.float64(0.10712162429616352), 'Std': np.float64(0.05035965659858371)}
