[I 2024-12-06 23:36:49,574] Trial 132 finished with value: 0.8214285714285714 and parameters: {'x_0_0': 'bd', 'x_0_1': 'oo', 'x_1_0': 'oo', 'x_1_1': 'bd'}. Best is trial 23 with value: 0.5.
2024-12-06 23:36:50,047 - INFO - Candidate Mean Stats: {'Max': np.float64(2.4547104168136165), 'Min': np.float64(-0.98503620396888), 'Mean': np.float64(0.40728199143071414), 'Std': np.float64(0.5068731900582806)}
2024-12-06 23:36:50,048 - INFO - Candidate Std Stats: {'Max': np.float64(1.6645887359335552), 'Min': np.float64(0.0), 'Mean': np.float64(0.5681647233315885), 'Std': np.float64(0.2770409709601394)}
2024-12-06 23:36:50,048 - INFO - Candidate Mean Stats: {'Max': np.float64(2.6301991457120772), 'Min': np.float64(-1.2527847622717645), 'Mean': np.float64(0.42195989900666064), 'Std': np.float64(0.5539349875089585)}
2024-12-06 23:36:50,049 - INFO - Candidate Std Stats: {'Max': np.float64(1.7006586404115374), 'Min': np.float64(0.0), 'Mean': np.float64(0.6216825385286447), 'Std': np.float64(0.29194069563635283)}
2024-12-06 23:36:50,061 - INFO - Candidate Mean Stats: {'Max': np.float64(2.2580492039837736), 'Min': np.float64(-0.9397510780610092), 'Mean': np.float64(0.42509795571940906), 'Std': np.float64(0.4713682017761686)}
[I 2024-12-06 23:36:50,062] Trial 134 finished with value: 0.7857142857142857 and parameters: {'x_0_0': 'bd', 'x_0_1': 'oo', 'x_1_0': 'bd', 'x_1_1': 'ab'}. Best is trial 76 with value: 0.5.
[I 2024-12-06 23:36:50,063] Trial 134 finished with value: 1.3214285714285714 and parameters: {'x_0_0': 'ad', 'x_0_1': 'cd', 'x_1_0': 'oo', 'x_1_1': 'ac'}. Best is trial 50 with value: 0.6607142857142857.
2024-12-06 23:36:50,061 - INFO - Candidate Std Stats: {'Max': np.float64(1.6047288574966778), 'Min': np.float64(0.0), 'Mean': np.float64(0.5136080273460868), 'Std': np.float64(0.25218613821623365)}
2024-12-06 23:36:50,067 - INFO - Candidate Mean Stats: {'Max': np.float64(2.201229293490311), 'Min': np.float64(-1.220307487405762), 'Mean': np.float64(0.33021636080677397), 'Std': np.float64(0.5159789488601825)}
2024-12-06 23:36:50,067 - INFO - Candidate Std Stats: {'Max': np.float64(1.664722026336524), 'Min': np.float64(0.0), 'Mean': np.float64(0.6115841871682495), 'Std': np.float64(0.27548896680184964)}
[I 2024-12-06 23:36:50,078] Trial 134 finished with value: 1.0714285714285714 and parameters: {'x_0_0': 'bd', 'x_0_1': 'oo', 'x_1_0': 'ac', 'x_1_1': 'ab'}. Best is trial 63 with value: 0.5.
[I 2024-12-06 23:36:50,079] Trial 133 finished with value: 0.8214285714285714 and parameters: {'x_0_0': 'bd', 'x_0_1': 'oo', 'x_1_0': 'oo', 'x_1_1': 'ad'}. Best is trial 23 with value: 0.5.
2024-12-06 23:36:50,434 - INFO - Candidate Mean Stats: {'Max': np.float64(2.5769381739531285), 'Min': np.float64(-1.4241642810686765), 'Mean': np.float64(0.35305718460844415), 'Std': np.float64(0.5347151363772492)}
2024-12-06 23:36:50,434 - INFO - Candidate Std Stats: {'Max': np.float64(2.001617396547728), 'Min': np.float64(0.0), 'Mean': np.float64(0.5876502427465942), 'Std': np.float64(0.31840245083363905)}
2024-12-06 23:36:50,439 - INFO - Candidate Mean Stats: {'Max': np.float64(2.6561671297951976), 'Min': np.float64(-1.3684690959271417), 'Mean': np.float64(0.38702286286894216), 'Std': np.float64(0.5543892215102492)}
2024-12-06 23:36:50,439 - INFO - Candidate Std Stats: {'Max': np.float64(1.87605591002914), 'Min': np.float64(0.0), 'Mean': np.float64(0.6487510329106104), 'Std': np.float64(0.31738330011463667)}
2024-12-06 23:36:50,446 - INFO - Candidate Mean Stats: {'Max': np.float64(2.512084493702848), 'Min': np.float64(-0.9253061856059199), 'Mean': np.float64(0.42981171826255055), 'Std': np.float64(0.4791071945561501)}
2024-12-06 23:36:50,446 - INFO - Candidate Std Stats: {'Max': np.float64(1.3692990094208193), 'Min': np.float64(0.0), 'Mean': np.float64(0.5324298296332297), 'Std': np.float64(0.2451854312860473)}
[I 2024-12-06 23:36:50,453] Trial 135 finished with value: 1.1607142857142856 and parameters: {'x_0_0': 'bc', 'x_0_1': 'ac', 'x_1_0': 'ab', 'x_1_1': 'oo'}. Best is trial 50 with value: 0.6607142857142857.
[I 2024-12-06 23:36:50,453] Trial 135 finished with value: 1.0714285714285714 and parameters: {'x_0_0': 'bc', 'x_0_1': 'oo', 'x_1_0': 'bc', 'x_1_1': 'ac'}. Best is trial 76 with value: 0.5.
2024-12-06 23:36:50,456 - INFO - Candidate Mean Stats: {'Max': np.float64(3.0403061490929413), 'Min': np.float64(-1.2114140294325284), 'Mean': np.float64(0.3522140715426737), 'Std': np.float64(0.5409543869317519)}
2024-12-06 23:36:50,456 - INFO - Candidate Std Stats: {'Max': np.float64(1.9052908365227519), 'Min': np.float64(0.0), 'Mean': np.float64(0.6584643725518193), 'Std': np.float64(0.3063950863371282)}
[I 2024-12-06 23:36:50,460] Trial 135 finished with value: 1.0714285714285714 and parameters: {'x_0_0': 'ad', 'x_0_1': 'oo', 'x_1_0': 'cd', 'x_1_1': 'bd'}. Best is trial 63 with value: 0.5.
[I 2024-12-06 23:36:50,472] Trial 134 finished with value: 1.25 and parameters: {'x_0_0': 'cd', 'x_0_1': 'oo', 'x_1_0': 'oo', 'x_1_1': 'bc'}. Best is trial 23 with value: 0.5.
2024-12-06 23:36:50,798 - INFO - Candidate Mean Stats: {'Max': np.float64(3.2676234118998457), 'Min': np.float64(-1.1480679228487145), 'Mean': np.float64(0.3514881539952522), 'Std': np.float64(0.5675217477901915)}
2024-12-06 23:36:50,798 - INFO - Candidate Std Stats: {'Max': np.float64(1.5738114062151283), 'Min': np.float64(0.0), 'Mean': np.float64(0.5740562409406719), 'Std': np.float64(0.2740908164270831)}
2024-12-06 23:36:50,803 - INFO - Candidate Mean Stats: {'Max': np.float64(2.668629616378115), 'Min': np.float64(-1.1371152775921232), 'Mean': np.float64(0.39865542190902514), 'Std': np.float64(0.5549540107319977)}
2024-12-06 23:36:50,803 - INFO - Candidate Std Stats: {'Max': np.float64(1.6201144006288712), 'Min': np.float64(0.0), 'Mean': np.float64(0.6501515268564564), 'Std': np.float64(0.2936303515302113)}
[I 2024-12-06 23:36:50,814] Trial 136 finished with value: 1.5714285714285714 and parameters: {'x_0_0': 'ac', 'x_0_1': 'bd', 'x_1_0': 'bc', 'x_1_1': 'ac'}. Best is trial 76 with value: 0.5.
2024-12-06 23:36:50,816 - INFO - Candidate Mean Stats: {'Max': np.float64(2.2493642936016833), 'Min': np.float64(-1.138332939638879), 'Mean': np.float64(0.29894217686602825), 'Std': np.float64(0.5242241820412166)}
2024-12-06 23:36:50,816 - INFO - Candidate Std Stats: {'Max': np.float64(1.703810993069781), 'Min': np.float64(0.0), 'Mean': np.float64(0.6610048622917692), 'Std': np.float64(0.2978625157266835)}
[I 2024-12-06 23:36:50,816] Trial 136 finished with value: 1.0714285714285714 and parameters: {'x_0_0': 'bc', 'x_0_1': 'oo', 'x_1_0': 'ab', 'x_1_1': 'ac'}. Best is trial 50 with value: 0.6607142857142857.
2024-12-06 23:36:50,827 - INFO - Candidate Mean Stats: {'Max': np.float64(2.373619535136862), 'Min': np.float64(-1.208951354170248), 'Mean': np.float64(0.4133003842272402), 'Std': np.float64(0.56098692587552)}
2024-12-06 23:36:50,827 - INFO - Candidate Std Stats: {'Max': np.float64(1.4655273743431312), 'Min': np.float64(0.0), 'Mean': np.float64(0.5895757485990032), 'Std': np.float64(0.28139911647847654)}
[I 2024-12-06 23:36:50,833] Trial 136 finished with value: 1.0714285714285714 and parameters: {'x_0_0': 'ad', 'x_0_1': 'oo', 'x_1_0': 'ac', 'x_1_1': 'ab'}. Best is trial 63 with value: 0.5.
[I 2024-12-06 23:36:50,842] Trial 135 finished with value: 1.2857142857142856 and parameters: {'x_0_0': 'bd', 'x_0_1': 'ac', 'x_1_0': 'bd', 'x_1_1': 'bc'}. Best is trial 23 with value: 0.5.
2024-12-06 23:36:51,162 - INFO - Candidate Mean Stats: {'Max': np.float64(2.534504689857799), 'Min': np.float64(-1.2377041537286733), 'Mean': np.float64(0.34507149859575004), 'Std': np.float64(0.5873065292290396)}
2024-12-06 23:36:51,162 - INFO - Candidate Std Stats: {'Max': np.float64(1.661679833587843), 'Min': np.float64(0.0), 'Mean': np.float64(0.5708345349183734), 'Std': np.float64(0.26853233177966884)}
2024-12-06 23:36:51,165 - INFO - Candidate Mean Stats: {'Max': np.float64(2.6574973233069006), 'Min': np.float64(-1.3964171061795476), 'Mean': np.float64(0.364060384259147), 'Std': np.float64(0.5681820628553357)}
2024-12-06 23:36:51,165 - INFO - Candidate Std Stats: {'Max': np.float64(1.554618053737901), 'Min': np.float64(0.0), 'Mean': np.float64(0.6255610390079959), 'Std': np.float64(0.302102971868972)}
[I 2024-12-06 23:36:51,177] Trial 137 finished with value: 1.2857142857142856 and parameters: {'x_0_0': 'ac', 'x_0_1': 'ac', 'x_1_0': 'ab', 'x_1_1': 'ac'}. Best is trial 76 with value: 0.5.
[I 2024-12-06 23:36:51,178] Trial 137 finished with value: 0.8214285714285714 and parameters: {'x_0_0': 'ad', 'x_0_1': 'oo', 'x_1_0': 'oo', 'x_1_1': 'bd'}. Best is trial 50 with value: 0.6607142857142857.
2024-12-06 23:36:51,183 - INFO - Candidate Mean Stats: {'Max': np.float64(2.898740820302142), 'Min': np.float64(-0.971302376745137), 'Mean': np.float64(0.36310721871687), 'Std': np.float64(0.5054071901748364)}
2024-12-06 23:36:51,183 - INFO - Candidate Std Stats: {'Max': np.float64(1.6296610565386134), 'Min': np.float64(0.0), 'Mean': np.float64(0.6075795681016664), 'Std': np.float64(0.28476361526677973)}
2024-12-06 23:36:51,189 - INFO - Candidate Mean Stats: {'Max': np.float64(2.522526791568768), 'Min': np.float64(-1.1042497860157199), 'Mean': np.float64(0.3913103071528944), 'Std': np.float64(0.5485729846262964)}
2024-12-06 23:36:51,189 - INFO - Candidate Std Stats: {'Max': np.float64(1.593467673329241), 'Min': np.float64(0.0), 'Mean': np.float64(0.6314015310826837), 'Std': np.float64(0.29209774153265816)}
[I 2024-12-06 23:36:51,196] Trial 137 finished with value: 1.2142857142857144 and parameters: {'x_0_0': 'ab', 'x_0_1': 'oo', 'x_1_0': 'cd', 'x_1_1': 'cd'}. Best is trial 63 with value: 0.5.
[I 2024-12-06 23:36:51,201] Trial 136 finished with value: 0.8214285714285714 and parameters: {'x_0_0': 'ad', 'x_0_1': 'oo', 'x_1_0': 'oo', 'x_1_1': 'ab'}. Best is trial 23 with value: 0.5.
2024-12-06 23:36:51,533 - INFO - Candidate Mean Stats: {'Max': np.float64(2.6808876764647374), 'Min': np.float64(-1.368355939976734), 'Mean': np.float64(0.45410290492046407), 'Std': np.float64(0.5169034435857331)}
2024-12-06 23:36:51,533 - INFO - Candidate Std Stats: {'Max': np.float64(1.853784649004835), 'Min': np.float64(0.0), 'Mean': np.float64(0.6027392408578625), 'Std': np.float64(0.2782675900690553)}
2024-12-06 23:36:51,541 - INFO - Candidate Mean Stats: {'Max': np.float64(2.6572020441194866), 'Min': np.float64(-0.9766228571115031), 'Mean': np.float64(0.3887148570714125), 'Std': np.float64(0.5318868680143881)}
2024-12-06 23:36:51,541 - INFO - Candidate Std Stats: {'Max': np.float64(1.5927936324494494), 'Min': np.float64(0.0), 'Mean': np.float64(0.5822771509336299), 'Std': np.float64(0.2769341999454305)}
[I 2024-12-06 23:36:51,597] Trial 138 finished with value: 1.0714285714285714 and parameters: {'x_0_0': 'ac', 'x_0_1': 'oo', 'x_1_0': 'cd', 'x_1_1': 'ab'}. Best is trial 76 with value: 0.5.
2024-12-06 23:36:51,605 - INFO - Candidate Mean Stats: {'Max': np.float64(2.270973692722958), 'Min': np.float64(-1.0936684247142874), 'Mean': np.float64(0.41088811573005496), 'Std': np.float64(0.498256125559272)}
2024-12-06 23:36:51,605 - INFO - Candidate Std Stats: {'Max': np.float64(1.6383770881835389), 'Min': np.float64(0.0), 'Mean': np.float64(0.6037506046621384), 'Std': np.float64(0.28180783606053855)}
[I 2024-12-06 23:36:51,623] Trial 138 finished with value: 1.0714285714285714 and parameters: {'x_0_0': 'ac', 'x_0_1': 'oo', 'x_1_0': 'ab', 'x_1_1': 'ac'}. Best is trial 50 with value: 0.6607142857142857.
2024-12-06 23:36:51,640 - INFO - Candidate Mean Stats: {'Max': np.float64(2.816403910458775), 'Min': np.float64(-1.1134666252109426), 'Mean': np.float64(0.4252511830725358), 'Std': np.float64(0.5309814759690045)}
2024-12-06 23:36:51,640 - INFO - Candidate Std Stats: {'Max': np.float64(1.8088638173377685), 'Min': np.float64(0.0), 'Mean': np.float64(0.6207606919914054), 'Std': np.float64(0.29774234341049605)}
[I 2024-12-06 23:36:51,640] Trial 138 finished with value: 0.9464285714285714 and parameters: {'x_0_0': 'ad', 'x_0_1': 'oo', 'x_1_0': 'cd', 'x_1_1': 'oo'}. Best is trial 63 with value: 0.5.
[I 2024-12-06 23:36:51,670] Trial 137 finished with value: 0.9464285714285714 and parameters: {'x_0_0': 'bd', 'x_0_1': 'oo', 'x_1_0': 'ac', 'x_1_1': 'oo'}. Best is trial 23 with value: 0.5.
2024-12-06 23:36:52,002 - INFO - Candidate Mean Stats: {'Max': np.float64(2.714726878241359), 'Min': np.float64(-1.1946156412066724), 'Mean': np.float64(0.3710054761419174), 'Std': np.float64(0.5837767644389061)}
2024-12-06 23:36:52,003 - INFO - Candidate Std Stats: {'Max': np.float64(1.6346188849880765), 'Min': np.float64(0.0), 'Mean': np.float64(0.6120429072307217), 'Std': np.float64(0.2836304750508093)}
2024-12-06 23:36:52,011 - INFO - Candidate Mean Stats: {'Max': np.float64(2.5038647991365393), 'Min': np.float64(-1.0980397022184367), 'Mean': np.float64(0.3878090437807932), 'Std': np.float64(0.5141999930877594)}
2024-12-06 23:36:52,011 - INFO - Candidate Std Stats: {'Max': np.float64(1.8626693559466867), 'Min': np.float64(0.0), 'Mean': np.float64(0.6084089010846612), 'Std': np.float64(0.295524968486746)}
[I 2024-12-06 23:36:52,020] Trial 139 finished with value: 0.9464285714285714 and parameters: {'x_0_0': 'bd', 'x_0_1': 'oo', 'x_1_0': 'cd', 'x_1_1': 'oo'}. Best is trial 76 with value: 0.5.
2024-12-06 23:36:52,026 - INFO - Candidate Mean Stats: {'Max': np.float64(2.4221171314668744), 'Min': np.float64(-1.3475009243528706), 'Mean': np.float64(0.3693955794525506), 'Std': np.float64(0.544809218251704)}
2024-12-06 23:36:52,026 - INFO - Candidate Std Stats: {'Max': np.float64(1.7182199640741616), 'Min': np.float64(0.0), 'Mean': np.float64(0.6010839505636953), 'Std': np.float64(0.28157445207397763)}
[I 2024-12-06 23:36:52,029] Trial 139 finished with value: 1.3035714285714286 and parameters: {'x_0_0': 'ad', 'x_0_1': 'bc', 'x_1_0': 'ab', 'x_1_1': 'oo'}. Best is trial 50 with value: 0.6607142857142857.
[I 2024-12-06 23:36:52,043] Trial 139 finished with value: 0.6964285714285714 and parameters: {'x_0_0': 'bc', 'x_0_1': 'oo', 'x_1_0': 'oo', 'x_1_1': 'oo'}. Best is trial 63 with value: 0.5.
2024-12-06 23:36:52,052 - INFO - Candidate Mean Stats: {'Max': np.float64(2.7446362803403694), 'Min': np.float64(-1.196402212568254), 'Mean': np.float64(0.4320799978226929), 'Std': np.float64(0.5070637349842628)}
2024-12-06 23:36:52,052 - INFO - Candidate Std Stats: {'Max': np.float64(1.537417941808184), 'Min': np.float64(0.0), 'Mean': np.float64(0.5753334776188008), 'Std': np.float64(0.27421356196590896)}
[I 2024-12-06 23:36:52,071] Trial 138 finished with value: 0.8214285714285714 and parameters: {'x_0_0': 'ad', 'x_0_1': 'oo', 'x_1_0': 'oo', 'x_1_1': 'ad'}. Best is trial 23 with value: 0.5.
2024-12-06 23:36:52,374 - INFO - Candidate Mean Stats: {'Max': np.float64(2.6432350763978842), 'Min': np.float64(-1.588216032684496), 'Mean': np.float64(0.3521396157071471), 'Std': np.float64(0.642355618497235)}
2024-12-06 23:36:52,375 - INFO - Candidate Std Stats: {'Max': np.float64(1.6324440061983072), 'Min': np.float64(0.0), 'Mean': np.float64(0.6183810510531332), 'Std': np.float64(0.2915799097211605)}
2024-12-06 23:36:52,389 - INFO - Candidate Mean Stats: {'Max': np.float64(2.526539100063066), 'Min': np.float64(-1.0114748298159884), 'Mean': np.float64(0.26338574807388637), 'Std': np.float64(0.5941315985544141)}
2024-12-06 23:36:52,389 - INFO - Candidate Std Stats: {'Max': np.float64(1.6859105165706332), 'Min': np.float64(0.0), 'Mean': np.float64(0.6467766248787139), 'Std': np.float64(0.30732247513446437)}
[I 2024-12-06 23:36:52,390] Trial 140 finished with value: 0.9285714285714286 and parameters: {'x_0_0': 'bd', 'x_0_1': 'oo', 'x_1_0': 'ab', 'x_1_1': 'bd'}. Best is trial 76 with value: 0.5.
2024-12-06 23:36:52,399 - INFO - Candidate Mean Stats: {'Max': np.float64(2.2954235549698616), 'Min': np.float64(-0.9440423799674015), 'Mean': np.float64(0.41732463903234907), 'Std': np.float64(0.5051582634830013)}
2024-12-06 23:36:52,399 - INFO - Candidate Std Stats: {'Max': np.float64(1.668292838890259), 'Min': np.float64(0.0), 'Mean': np.float64(0.5647370373521794), 'Std': np.float64(0.26526785046433243)}
[I 2024-12-06 23:36:52,408] Trial 140 finished with value: 0.8214285714285714 and parameters: {'x_0_0': 'bc', 'x_0_1': 'oo', 'x_1_0': 'oo', 'x_1_1': 'ab'}. Best is trial 50 with value: 0.6607142857142857.
[I 2024-12-06 23:36:52,415] Trial 140 finished with value: 1.0714285714285714 and parameters: {'x_0_0': 'ad', 'x_0_1': 'oo', 'x_1_0': 'cd', 'x_1_1': 'ac'}. Best is trial 63 with value: 0.5.
2024-12-06 23:36:52,430 - INFO - Candidate Mean Stats: {'Max': np.float64(3.02833836197979), 'Min': np.float64(-0.9701344371975864), 'Mean': np.float64(0.41915700749518436), 'Std': np.float64(0.5207282570459426)}
2024-12-06 23:36:52,431 - INFO - Candidate Std Stats: {'Max': np.float64(1.7969350309682968), 'Min': np.float64(0.0), 'Mean': np.float64(0.5716068239043894), 'Std': np.float64(0.2792105110899735)}
[I 2024-12-06 23:36:52,446] Trial 139 finished with value: 0.9285714285714286 and parameters: {'x_0_0': 'ad', 'x_0_1': 'oo', 'x_1_0': 'ab', 'x_1_1': 'bc'}. Best is trial 23 with value: 0.5.
2024-12-06 23:36:52,768 - INFO - Candidate Mean Stats: {'Max': np.float64(2.946726811505516), 'Min': np.float64(-1.623914922694765), 'Mean': np.float64(0.31568873128656544), 'Std': np.float64(0.6178723815144778)}
2024-12-06 23:36:52,768 - INFO - Candidate Std Stats: {'Max': np.float64(1.9627482243212098), 'Min': np.float64(0.0), 'Mean': np.float64(0.6818162705794043), 'Std': np.float64(0.33194857901152225)}
2024-12-06 23:36:52,781 - INFO - Candidate Mean Stats: {'Max': np.float64(2.375168762320462), 'Min': np.float64(-1.0838214293558524), 'Mean': np.float64(0.34649306268480273), 'Std': np.float64(0.6083246425940831)}
2024-12-06 23:36:52,782 - INFO - Candidate Std Stats: {'Max': np.float64(1.595183314617805), 'Min': np.float64(0.0), 'Mean': np.float64(0.6102818736133837), 'Std': np.float64(0.2841647290819072)}
2024-12-06 23:36:52,782 - INFO - Candidate Mean Stats: {'Max': np.float64(2.2927407822120527), 'Min': np.float64(-0.9919718859598611), 'Mean': np.float64(0.4086441759830441), 'Std': np.float64(0.5542007290161486)}
2024-12-06 23:36:52,782 - INFO - Candidate Std Stats: {'Max': np.float64(1.606099033575383), 'Min': np.float64(0.0), 'Mean': np.float64(0.5769663013043062), 'Std': np.float64(0.27253389428588964)}
[I 2024-12-06 23:36:52,785] Trial 141 finished with value: 1.0714285714285714 and parameters: {'x_0_0': 'bc', 'x_0_1': 'oo', 'x_1_0': 'bd', 'x_1_1': 'ab'}. Best is trial 76 with value: 0.5.
[I 2024-12-06 23:36:52,797] Trial 141 finished with value: 1.4285714285714286 and parameters: {'x_0_0': 'bc', 'x_0_1': 'ab', 'x_1_0': 'bc', 'x_1_1': 'bc'}. Best is trial 63 with value: 0.5.
[I 2024-12-06 23:36:52,798] Trial 141 finished with value: 1.0714285714285714 and parameters: {'x_0_0': 'bc', 'x_0_1': 'oo', 'x_1_0': 'ab', 'x_1_1': 'ad'}. Best is trial 50 with value: 0.6607142857142857.
2024-12-06 23:36:52,827 - INFO - Candidate Mean Stats: {'Max': np.float64(3.245259474212132), 'Min': np.float64(-0.881713030889), 'Mean': np.float64(0.43474554852268205), 'Std': np.float64(0.513489275569932)}
2024-12-06 23:36:52,828 - INFO - Candidate Std Stats: {'Max': np.float64(1.7027449067034546), 'Min': np.float64(0.0), 'Mean': np.float64(0.5571658162244224), 'Std': np.float64(0.27826571368448183)}
[I 2024-12-06 23:36:52,842] Trial 140 finished with value: 0.9642857142857143 and parameters: {'x_0_0': 'ab', 'x_0_1': 'oo', 'x_1_0': 'oo', 'x_1_1': 'cd'}. Best is trial 23 with value: 0.5.
2024-12-06 23:36:53,176 - INFO - Candidate Mean Stats: {'Max': np.float64(2.4494089947713684), 'Min': np.float64(-1.2243968430151586), 'Mean': np.float64(0.460883199189479), 'Std': np.float64(0.4925770516395512)}
2024-12-06 23:36:53,176 - INFO - Candidate Std Stats: {'Max': np.float64(1.9048024994864794), 'Min': np.float64(0.0), 'Mean': np.float64(0.5108560375020544), 'Std': np.float64(0.2564125773216038)}
2024-12-06 23:36:53,177 - INFO - Candidate Mean Stats: {'Max': np.float64(2.3333279263338613), 'Min': np.float64(-0.8476578102091835), 'Mean': np.float64(0.40896557506978115), 'Std': np.float64(0.5069574192049411)}
2024-12-06 23:36:53,177 - INFO - Candidate Std Stats: {'Max': np.float64(1.8344722963869897), 'Min': np.float64(0.0), 'Mean': np.float64(0.5406418026306028), 'Std': np.float64(0.2550768382454195)}
2024-12-06 23:36:53,178 - INFO - Candidate Mean Stats: {'Max': np.float64(2.747544757772536), 'Min': np.float64(-1.1446375643998299), 'Mean': np.float64(0.456011061542294), 'Std': np.float64(0.5241463601377527)}
2024-12-06 23:36:53,178 - INFO - Candidate Std Stats: {'Max': np.float64(1.8090803413689176), 'Min': np.float64(0.0), 'Mean': np.float64(0.6500571965671963), 'Std': np.float64(0.3010940413689948)}
[I 2024-12-06 23:36:53,193] Trial 142 finished with value: 0.9464285714285714 and parameters: {'x_0_0': 'ac', 'x_0_1': 'oo', 'x_1_0': 'ad', 'x_1_1': 'oo'}. Best is trial 63 with value: 0.5.
[I 2024-12-06 23:36:53,194] Trial 142 finished with value: 1.0714285714285714 and parameters: {'x_0_0': 'ad', 'x_0_1': 'oo', 'x_1_0': 'ad', 'x_1_1': 'bd'}. Best is trial 50 with value: 0.6607142857142857.
[I 2024-12-06 23:36:53,195] Trial 142 finished with value: 1.0714285714285714 and parameters: {'x_0_0': 'ad', 'x_0_1': 'oo', 'x_1_0': 'ad', 'x_1_1': 'ab'}. Best is trial 76 with value: 0.5.
2024-12-06 23:36:53,217 - INFO - Candidate Mean Stats: {'Max': np.float64(2.8713416771859643), 'Min': np.float64(-1.1148640850112213), 'Mean': np.float64(0.3903527769834194), 'Std': np.float64(0.5211047868556309)}
2024-12-06 23:36:53,217 - INFO - Candidate Std Stats: {'Max': np.float64(1.762880335058853), 'Min': np.float64(0.0), 'Mean': np.float64(0.5795139597030109), 'Std': np.float64(0.2731718855095478)}
