[I 2024-12-06 23:38:00,399] Trial 321 finished with value: 1.0714285714285714 and parameters: {'x_0_0': 'ac', 'x_0_1': 'oo', 'x_1_0': 'ad', 'x_1_1': 'ad'}. Best is trial 23 with value: 0.5.
2024-12-06 23:38:00,471 - INFO - Candidate Mean Stats: {'Max': np.float64(3.011422695649843), 'Min': np.float64(-0.7038116115931634), 'Mean': np.float64(0.7446046372883585), 'Std': np.float64(0.5046807741014461)}
2024-12-06 23:38:00,471 - INFO - Candidate Std Stats: {'Max': np.float64(1.421780062834918), 'Min': np.float64(0.0), 'Mean': np.float64(0.4954179227512192), 'Std': np.float64(0.28745905303573643)}
2024-12-06 23:38:00,472 - INFO - Candidate Mean Stats: {'Max': np.float64(3.2094687615154123), 'Min': np.float64(-0.9342686903064564), 'Mean': np.float64(0.5916298677312145), 'Std': np.float64(0.6225180200204191)}
2024-12-06 23:38:00,472 - INFO - Candidate Std Stats: {'Max': np.float64(1.8629609377232066), 'Min': np.float64(0.0), 'Mean': np.float64(0.5106372953559365), 'Std': np.float64(0.3014339301614117)}
2024-12-06 23:38:00,480 - INFO - Candidate Mean Stats: {'Max': np.float64(2.9783428440499713), 'Min': np.float64(-0.6471506427514484), 'Mean': np.float64(0.6622394289571113), 'Std': np.float64(0.5307719688251911)}
2024-12-06 23:38:00,480 - INFO - Candidate Std Stats: {'Max': np.float64(1.6610726705946408), 'Min': np.float64(0.0), 'Mean': np.float64(0.5263960204262591), 'Std': np.float64(0.30198045625715625)}
[I 2024-12-06 23:38:00,486] Trial 323 finished with value: 1.0714285714285714 and parameters: {'x_0_0': 'ac', 'x_0_1': 'oo', 'x_1_0': 'bd', 'x_1_1': 'ac'}. Best is trial 165 with value: 0.5.
[I 2024-12-06 23:38:00,486] Trial 323 finished with value: 1.1607142857142856 and parameters: {'x_0_0': 'bd', 'x_0_1': 'ad', 'x_1_0': 'bd', 'x_1_1': 'oo'}. Best is trial 76 with value: 0.5.
[I 2024-12-06 23:38:00,494] Trial 323 finished with value: 0.9285714285714286 and parameters: {'x_0_0': 'ad', 'x_0_1': 'oo', 'x_1_0': 'ab', 'x_1_1': 'ac'}. Best is trial 63 with value: 0.5.
2024-12-06 23:38:00,769 - INFO - Candidate Mean Stats: {'Max': np.float64(3.380182264918947), 'Min': np.float64(-0.45551578065050835), 'Mean': np.float64(0.8010234019960836), 'Std': np.float64(0.4660095836568825)}
2024-12-06 23:38:00,770 - INFO - Candidate Std Stats: {'Max': np.float64(1.3401075046853024), 'Min': np.float64(0.0), 'Mean': np.float64(0.4466066646599598), 'Std': np.float64(0.25410029101715)}
[I 2024-12-06 23:38:00,784] Trial 322 finished with value: 1.4464285714285714 and parameters: {'x_0_0': 'bc', 'x_0_1': 'bd', 'x_1_0': 'bd', 'x_1_1': 'oo'}. Best is trial 23 with value: 0.5.
2024-12-06 23:38:00,853 - INFO - Candidate Mean Stats: {'Max': np.float64(2.818346770193548), 'Min': np.float64(-0.9059307203282272), 'Mean': np.float64(0.6828537181703874), 'Std': np.float64(0.5514041681975598)}
2024-12-06 23:38:00,853 - INFO - Candidate Std Stats: {'Max': np.float64(1.8252262929115348), 'Min': np.float64(0.0), 'Mean': np.float64(0.5663548104328937), 'Std': np.float64(0.3385337874140979)}
2024-12-06 23:38:00,857 - INFO - Candidate Mean Stats: {'Max': np.float64(2.8851407332123515), 'Min': np.float64(-0.914265837023984), 'Mean': np.float64(0.7041877679939241), 'Std': np.float64(0.5686949531647946)}
2024-12-06 23:38:00,857 - INFO - Candidate Std Stats: {'Max': np.float64(1.5548156828663735), 'Min': np.float64(0.0), 'Mean': np.float64(0.5083450821607073), 'Std': np.float64(0.2916041804809696)}
2024-12-06 23:38:00,862 - INFO - Candidate Mean Stats: {'Max': np.float64(2.8493216879696606), 'Min': np.float64(-0.7142360981923557), 'Mean': np.float64(0.7053020100279541), 'Std': np.float64(0.505843472672054)}
2024-12-06 23:38:00,862 - INFO - Candidate Std Stats: {'Max': np.float64(1.4675168759347752), 'Min': np.float64(0.0), 'Mean': np.float64(0.5116875203781605), 'Std': np.float64(0.2916197647556127)}
[I 2024-12-06 23:38:00,868] Trial 324 finished with value: 1.5 and parameters: {'x_0_0': 'cd', 'x_0_1': 'oo', 'x_1_0': 'ad', 'x_1_1': 'ac'}. Best is trial 165 with value: 0.5.
[I 2024-12-06 23:38:00,873] Trial 324 finished with value: 1.2142857142857144 and parameters: {'x_0_0': 'ab', 'x_0_1': 'oo', 'x_1_0': 'cd', 'x_1_1': 'ab'}. Best is trial 76 with value: 0.5.
[I 2024-12-06 23:38:00,877] Trial 324 finished with value: 0.9285714285714286 and parameters: {'x_0_0': 'ad', 'x_0_1': 'oo', 'x_1_0': 'ab', 'x_1_1': 'ad'}. Best is trial 63 with value: 0.5.
2024-12-06 23:38:01,156 - INFO - Candidate Mean Stats: {'Max': np.float64(2.851839236017401), 'Min': np.float64(-0.7642619412457734), 'Mean': np.float64(0.7297314371667234), 'Std': np.float64(0.4780198077464902)}
2024-12-06 23:38:01,156 - INFO - Candidate Std Stats: {'Max': np.float64(1.8171631006254447), 'Min': np.float64(0.0), 'Mean': np.float64(0.5153312974839488), 'Std': np.float64(0.3028331484448298)}
[I 2024-12-06 23:38:01,170] Trial 323 finished with value: 0.9285714285714286 and parameters: {'x_0_0': 'ad', 'x_0_1': 'oo', 'x_1_0': 'ab', 'x_1_1': 'ab'}. Best is trial 23 with value: 0.5.
2024-12-06 23:38:01,237 - INFO - Candidate Mean Stats: {'Max': np.float64(2.923915840766871), 'Min': np.float64(-0.9001380308780966), 'Mean': np.float64(0.5559004080285485), 'Std': np.float64(0.5779660812556734)}
2024-12-06 23:38:01,237 - INFO - Candidate Std Stats: {'Max': np.float64(1.8609419321783471), 'Min': np.float64(0.0), 'Mean': np.float64(0.6261230253721926), 'Std': np.float64(0.3479242468936011)}
2024-12-06 23:38:01,240 - INFO - Candidate Mean Stats: {'Max': np.float64(2.8941047584103807), 'Min': np.float64(-0.8949148712767119), 'Mean': np.float64(0.6468948140717201), 'Std': np.float64(0.6087878269779834)}
2024-12-06 23:38:01,240 - INFO - Candidate Std Stats: {'Max': np.float64(1.824712404186826), 'Min': np.float64(0.0), 'Mean': np.float64(0.5815463808002286), 'Std': np.float64(0.3331144582772186)}
2024-12-06 23:38:01,246 - INFO - Candidate Mean Stats: {'Max': np.float64(3.345048781936378), 'Min': np.float64(-0.9115780272460592), 'Mean': np.float64(0.5915194906148821), 'Std': np.float64(0.6045725342545386)}
2024-12-06 23:38:01,246 - INFO - Candidate Std Stats: {'Max': np.float64(1.7297004674504148), 'Min': np.float64(0.0), 'Mean': np.float64(0.5894579767200203), 'Std': np.float64(0.36076194660126537)}
[I 2024-12-06 23:38:01,251] Trial 325 finished with value: 1.375 and parameters: {'x_0_0': 'oo', 'x_0_1': 'oo', 'x_1_0': 'ab', 'x_1_1': 'cd'}. Best is trial 165 with value: 0.5.
[I 2024-12-06 23:38:01,255] Trial 325 finished with value: 1.1428571428571428 and parameters: {'x_0_0': 'bc', 'x_0_1': 'ad', 'x_1_0': 'bd', 'x_1_1': 'ab'}. Best is trial 76 with value: 0.5.
[I 2024-12-06 23:38:01,260] Trial 325 finished with value: 1.375 and parameters: {'x_0_0': 'oo', 'x_0_1': 'oo', 'x_1_0': 'cd', 'x_1_1': 'bc'}. Best is trial 63 with value: 0.5.
2024-12-06 23:38:01,541 - INFO - Candidate Mean Stats: {'Max': np.float64(3.0086016589822577), 'Min': np.float64(-0.6859038531629471), 'Mean': np.float64(0.6967789471070219), 'Std': np.float64(0.5093864483635726)}
2024-12-06 23:38:01,541 - INFO - Candidate Std Stats: {'Max': np.float64(1.4080376722595869), 'Min': np.float64(0.0), 'Mean': np.float64(0.5043939246528292), 'Std': np.float64(0.28468395238856486)}
[I 2024-12-06 23:38:01,556] Trial 324 finished with value: 1.0714285714285714 and parameters: {'x_0_0': 'bc', 'x_0_1': 'oo', 'x_1_0': 'ab', 'x_1_1': 'ab'}. Best is trial 23 with value: 0.5.
2024-12-06 23:38:01,621 - INFO - Candidate Mean Stats: {'Max': np.float64(3.4039481409181107), 'Min': np.float64(-0.8398346053882475), 'Mean': np.float64(0.6240265419722013), 'Std': np.float64(0.5787280821525228)}
2024-12-06 23:38:01,621 - INFO - Candidate Std Stats: {'Max': np.float64(1.712290496954238), 'Min': np.float64(0.0), 'Mean': np.float64(0.580705227862811), 'Std': np.float64(0.3380535467318119)}
2024-12-06 23:38:01,624 - INFO - Candidate Mean Stats: {'Max': np.float64(2.8372710187332295), 'Min': np.float64(-0.8474159102763471), 'Mean': np.float64(0.6599760583767788), 'Std': np.float64(0.5822194027796559)}
2024-12-06 23:38:01,624 - INFO - Candidate Std Stats: {'Max': np.float64(1.4779537080016938), 'Min': np.float64(0.0), 'Mean': np.float64(0.5542569428252179), 'Std': np.float64(0.3116718348900925)}
2024-12-06 23:38:01,631 - INFO - Candidate Mean Stats: {'Max': np.float64(2.905279208691771), 'Min': np.float64(-0.5856384618251791), 'Mean': np.float64(0.7226996255145374), 'Std': np.float64(0.4739787437847103)}
2024-12-06 23:38:01,631 - INFO - Candidate Std Stats: {'Max': np.float64(1.8202428771584196), 'Min': np.float64(0.0), 'Mean': np.float64(0.5190819248501776), 'Std': np.float64(0.3015075194919168)}
[I 2024-12-06 23:38:01,636] Trial 326 finished with value: 1.0357142857142856 and parameters: {'x_0_0': 'bc', 'x_0_1': 'ad', 'x_1_0': 'oo', 'x_1_1': 'ad'}. Best is trial 165 with value: 0.5.
[I 2024-12-06 23:38:01,639] Trial 326 finished with value: 1.3035714285714286 and parameters: {'x_0_0': 'bd', 'x_0_1': 'ac', 'x_1_0': 'ab', 'x_1_1': 'oo'}. Best is trial 76 with value: 0.5.
[I 2024-12-06 23:38:01,645] Trial 326 finished with value: 1.0714285714285714 and parameters: {'x_0_0': 'bc', 'x_0_1': 'oo', 'x_1_0': 'ab', 'x_1_1': 'ad'}. Best is trial 63 with value: 0.5.
2024-12-06 23:38:01,925 - INFO - Candidate Mean Stats: {'Max': np.float64(3.139648478710067), 'Min': np.float64(-1.058223077687043), 'Mean': np.float64(0.607107373061998), 'Std': np.float64(0.599416265975157)}
2024-12-06 23:38:01,925 - INFO - Candidate Std Stats: {'Max': np.float64(1.6178949879158453), 'Min': np.float64(0.0), 'Mean': np.float64(0.558615297612164), 'Std': np.float64(0.32122944140043386)}
[I 2024-12-06 23:38:01,940] Trial 325 finished with value: 1.0714285714285714 and parameters: {'x_0_0': 'ad', 'x_0_1': 'oo', 'x_1_0': 'cd', 'x_1_1': 'bd'}. Best is trial 23 with value: 0.5.
2024-12-06 23:38:02,004 - INFO - Candidate Mean Stats: {'Max': np.float64(2.913571100759925), 'Min': np.float64(-0.7643686485502161), 'Mean': np.float64(0.7042521189347914), 'Std': np.float64(0.5366707964075151)}
2024-12-06 23:38:02,004 - INFO - Candidate Std Stats: {'Max': np.float64(2.1380368110086008), 'Min': np.float64(0.0), 'Mean': np.float64(0.5165395028575672), 'Std': np.float64(0.32135656571909915)}
2024-12-06 23:38:02,006 - INFO - Candidate Mean Stats: {'Max': np.float64(3.383386080829289), 'Min': np.float64(-1.3444550953198404), 'Mean': np.float64(0.6108517388494353), 'Std': np.float64(0.6264184734659995)}
2024-12-06 23:38:02,006 - INFO - Candidate Std Stats: {'Max': np.float64(1.6218523915858936), 'Min': np.float64(0.0), 'Mean': np.float64(0.5308967940515342), 'Std': np.float64(0.3063349173264507)}
2024-12-06 23:38:02,011 - INFO - Candidate Mean Stats: {'Max': np.float64(3.0698576555650936), 'Min': np.float64(-0.43188468033269356), 'Mean': np.float64(0.7227764552870055), 'Std': np.float64(0.49411542082262677)}
2024-12-06 23:38:02,011 - INFO - Candidate Std Stats: {'Max': np.float64(1.517014578479777), 'Min': np.float64(0.0), 'Mean': np.float64(0.44872927098990856), 'Std': np.float64(0.26738865756115715)}
[I 2024-12-06 23:38:02,018] Trial 327 finished with value: 1.4285714285714286 and parameters: {'x_0_0': 'ac', 'x_0_1': 'ab', 'x_1_0': 'ad', 'x_1_1': 'ab'}. Best is trial 165 with value: 0.5.
[I 2024-12-06 23:38:02,020] Trial 327 finished with value: 1.1607142857142856 and parameters: {'x_0_0': 'ac', 'x_0_1': 'ad', 'x_1_0': 'bd', 'x_1_1': 'oo'}. Best is trial 76 with value: 0.5.
[I 2024-12-06 23:38:02,025] Trial 327 finished with value: 0.9285714285714286 and parameters: {'x_0_0': 'ad', 'x_0_1': 'oo', 'x_1_0': 'ab', 'x_1_1': 'bc'}. Best is trial 63 with value: 0.5.
2024-12-06 23:38:02,311 - INFO - Candidate Mean Stats: {'Max': np.float64(2.759893062168719), 'Min': np.float64(-1.146303138698735), 'Mean': np.float64(0.7237327652408018), 'Std': np.float64(0.5729644252101119)}
2024-12-06 23:38:02,311 - INFO - Candidate Std Stats: {'Max': np.float64(1.5163175882208673), 'Min': np.float64(0.0), 'Mean': np.float64(0.5056189397192637), 'Std': np.float64(0.2958380517974019)}
[I 2024-12-06 23:38:02,325] Trial 326 finished with value: 1.4464285714285714 and parameters: {'x_0_0': 'ad', 'x_0_1': 'ad', 'x_1_0': 'ad', 'x_1_1': 'oo'}. Best is trial 23 with value: 0.5.
2024-12-06 23:38:02,387 - INFO - Candidate Mean Stats: {'Max': np.float64(2.6987473745757242), 'Min': np.float64(-0.9269915555846453), 'Mean': np.float64(0.6262319080095675), 'Std': np.float64(0.5951428888224065)}
2024-12-06 23:38:02,387 - INFO - Candidate Std Stats: {'Max': np.float64(1.7954135533308777), 'Min': np.float64(0.0), 'Mean': np.float64(0.5708569099719465), 'Std': np.float64(0.330281330419729)}
2024-12-06 23:38:02,387 - INFO - Candidate Mean Stats: {'Max': np.float64(2.715800186868179), 'Min': np.float64(-0.9720069151817539), 'Mean': np.float64(0.6039668237713025), 'Std': np.float64(0.594539183243849)}
2024-12-06 23:38:02,388 - INFO - Candidate Std Stats: {'Max': np.float64(1.678863786631405), 'Min': np.float64(0.0), 'Mean': np.float64(0.6286735756637912), 'Std': np.float64(0.3462371973535824)}
2024-12-06 23:38:02,393 - INFO - Candidate Mean Stats: {'Max': np.float64(3.4112400849015403), 'Min': np.float64(-0.9458551095810975), 'Mean': np.float64(0.6924809760008511), 'Std': np.float64(0.5210729403859219)}
2024-12-06 23:38:02,393 - INFO - Candidate Std Stats: {'Max': np.float64(1.9604039388609436), 'Min': np.float64(0.0), 'Mean': np.float64(0.5176596984851547), 'Std': np.float64(0.3197476320725202)}
[I 2024-12-06 23:38:02,402] Trial 328 finished with value: 1.3214285714285714 and parameters: {'x_0_0': 'ad', 'x_0_1': 'ac', 'x_1_0': 'oo', 'x_1_1': 'ac'}. Best is trial 165 with value: 0.5.
[I 2024-12-06 23:38:02,402] Trial 328 finished with value: 0.5 and parameters: {'x_0_0': 'ad', 'x_0_1': 'oo', 'x_1_0': 'bc', 'x_1_1': 'ad'}. Best is trial 76 with value: 0.5.
[I 2024-12-06 23:38:02,407] Trial 328 finished with value: 1.5714285714285714 and parameters: {'x_0_0': 'bd', 'x_0_1': 'cd', 'x_1_0': 'ad', 'x_1_1': 'bc'}. Best is trial 63 with value: 0.5.
2024-12-06 23:38:02,694 - INFO - Candidate Mean Stats: {'Max': np.float64(3.027588537130564), 'Min': np.float64(-0.4493925488286643), 'Mean': np.float64(0.7357585141411672), 'Std': np.float64(0.48414148043236666)}
2024-12-06 23:38:02,694 - INFO - Candidate Std Stats: {'Max': np.float64(1.5043264389331423), 'Min': np.float64(0.0), 'Mean': np.float64(0.4827815378013944), 'Std': np.float64(0.2780327933812187)}
[I 2024-12-06 23:38:02,708] Trial 327 finished with value: 0.7857142857142857 and parameters: {'x_0_0': 'bd', 'x_0_1': 'oo', 'x_1_0': 'bd', 'x_1_1': 'bd'}. Best is trial 23 with value: 0.5.
2024-12-06 23:38:02,770 - INFO - Candidate Mean Stats: {'Max': np.float64(3.3580256393228587), 'Min': np.float64(-0.8643706589861949), 'Mean': np.float64(0.6359872899645115), 'Std': np.float64(0.5754985897748187)}
2024-12-06 23:38:02,770 - INFO - Candidate Std Stats: {'Max': np.float64(1.64959098537759), 'Min': np.float64(0.0), 'Mean': np.float64(0.5299726887918158), 'Std': np.float64(0.3077767778856402)}
2024-12-06 23:38:02,773 - INFO - Candidate Mean Stats: {'Max': np.float64(3.2474331248368413), 'Min': np.float64(-0.8661811483510794), 'Mean': np.float64(0.7579619220156313), 'Std': np.float64(0.5248550212798662)}
2024-12-06 23:38:02,773 - INFO - Candidate Std Stats: {'Max': np.float64(1.489616055012386), 'Min': np.float64(0.0), 'Mean': np.float64(0.4985452216215889), 'Std': np.float64(0.2868908631999671)}
2024-12-06 23:38:02,776 - INFO - Candidate Mean Stats: {'Max': np.float64(2.9954346756611487), 'Min': np.float64(-1.0028674479142339), 'Mean': np.float64(0.6482865756635817), 'Std': np.float64(0.4884104760835284)}
2024-12-06 23:38:02,776 - INFO - Candidate Std Stats: {'Max': np.float64(1.916644019696941), 'Min': np.float64(0.0), 'Mean': np.float64(0.5319772273312963), 'Std': np.float64(0.33185948550841843)}
[I 2024-12-06 23:38:02,785] Trial 329 finished with value: 1.2142857142857144 and parameters: {'x_0_0': 'ab', 'x_0_1': 'oo', 'x_1_0': 'cd', 'x_1_1': 'bc'}. Best is trial 76 with value: 0.5.
[I 2024-12-06 23:38:02,787] Trial 329 finished with value: 1.2142857142857144 and parameters: {'x_0_0': 'ab', 'x_0_1': 'oo', 'x_1_0': 'ac', 'x_1_1': 'ad'}. Best is trial 165 with value: 0.5.
[I 2024-12-06 23:38:02,789] Trial 329 finished with value: 1.5 and parameters: {'x_0_0': 'cd', 'x_0_1': 'oo', 'x_1_0': 'ac', 'x_1_1': 'ac'}. Best is trial 63 with value: 0.5.
2024-12-06 23:38:03,076 - INFO - Candidate Mean Stats: {'Max': np.float64(2.6984470619712786), 'Min': np.float64(-0.6718246982058604), 'Mean': np.float64(0.6434151977670416), 'Std': np.float64(0.5541175977644347)}
2024-12-06 23:38:03,077 - INFO - Candidate Std Stats: {'Max': np.float64(1.3773490515912943), 'Min': np.float64(0.0), 'Mean': np.float64(0.5389030531647625), 'Std': np.float64(0.3047304028520205)}
[I 2024-12-06 23:38:03,091] Trial 328 finished with value: 1.2142857142857144 and parameters: {'x_0_0': 'ab', 'x_0_1': 'oo', 'x_1_0': 'ad', 'x_1_1': 'ab'}. Best is trial 23 with value: 0.5.
2024-12-06 23:38:03,149 - INFO - Candidate Mean Stats: {'Max': np.float64(3.363969244745033), 'Min': np.float64(-1.1545772884926995), 'Mean': np.float64(0.6476199952736454), 'Std': np.float64(0.6066484790119581)}
2024-12-06 23:38:03,149 - INFO - Candidate Std Stats: {'Max': np.float64(1.5651853329173997), 'Min': np.float64(0.0), 'Mean': np.float64(0.5760692224682971), 'Std': np.float64(0.32949626278631083)}
2024-12-06 23:38:03,154 - INFO - Candidate Mean Stats: {'Max': np.float64(3.1107333299222937), 'Min': np.float64(-0.9844023660068795), 'Mean': np.float64(0.6872338573665417), 'Std': np.float64(0.5032489912049798)}
2024-12-06 23:38:03,154 - INFO - Candidate Std Stats: {'Max': np.float64(1.6783493080787495), 'Min': np.float64(0.0), 'Mean': np.float64(0.5471673292161002), 'Std': np.float64(0.3222706371353201)}
2024-12-06 23:38:03,156 - INFO - Candidate Mean Stats: {'Max': np.float64(2.946906507560876), 'Min': np.float64(-0.6151120947351337), 'Mean': np.float64(0.7209626693652077), 'Std': np.float64(0.5032353176495215)}
2024-12-06 23:38:03,156 - INFO - Candidate Std Stats: {'Max': np.float64(1.658964149578083), 'Min': np.float64(0.0), 'Mean': np.float64(0.49488248772275717), 'Std': np.float64(0.28645306188173497)}
[I 2024-12-06 23:38:03,165] Trial 330 finished with value: 1.3214285714285714 and parameters: {'x_0_0': 'ad', 'x_0_1': 'ad', 'x_1_0': 'oo', 'x_1_1': 'bc'}. Best is trial 76 with value: 0.5.
[I 2024-12-06 23:38:03,169] Trial 330 finished with value: 1.0714285714285714 and parameters: {'x_0_0': 'ac', 'x_0_1': 'oo', 'x_1_0': 'bc', 'x_1_1': 'ac'}. Best is trial 165 with value: 0.5.
[I 2024-12-06 23:38:03,170] Trial 330 finished with value: 1.25 and parameters: {'x_0_0': 'oo', 'x_0_1': 'oo', 'x_1_0': 'bd', 'x_1_1': 'oo'}. Best is trial 63 with value: 0.5.
2024-12-06 23:38:03,462 - INFO - Candidate Mean Stats: {'Max': np.float64(3.1102954197498347), 'Min': np.float64(-1.0212708215635649), 'Mean': np.float64(0.6432347320995073), 'Std': np.float64(0.5598076101420051)}
2024-12-06 23:38:03,462 - INFO - Candidate Std Stats: {'Max': np.float64(1.847864758564826), 'Min': np.float64(0.0), 'Mean': np.float64(0.5353145580429287), 'Std': np.float64(0.30329143933633707)}
[I 2024-12-06 23:38:03,477] Trial 329 finished with value: 1.3214285714285714 and parameters: {'x_0_0': 'ad', 'x_0_1': 'ad', 'x_1_0': 'oo', 'x_1_1': 'cd'}. Best is trial 23 with value: 0.5.
2024-12-06 23:38:03,531 - INFO - Candidate Mean Stats: {'Max': np.float64(3.1195953494681623), 'Min': np.float64(-0.9946561427703706), 'Mean': np.float64(0.6575029906587064), 'Std': np.float64(0.6052069846171626)}
2024-12-06 23:38:03,531 - INFO - Candidate Std Stats: {'Max': np.float64(1.7166914686035908), 'Min': np.float64(0.0), 'Mean': np.float64(0.5790366898569773), 'Std': np.float64(0.3269559533654112)}
2024-12-06 23:38:03,536 - INFO - Candidate Mean Stats: {'Max': np.float64(3.602049578099691), 'Min': np.float64(-0.8565122266273125), 'Mean': np.float64(0.6529447035304831), 'Std': np.float64(0.5851523546894025)}
2024-12-06 23:38:03,536 - INFO - Candidate Std Stats: {'Max': np.float64(1.7940108508005457), 'Min': np.float64(0.0), 'Mean': np.float64(0.5673328244326373), 'Std': np.float64(0.3316451286736334)}
2024-12-06 23:38:03,538 - INFO - Candidate Mean Stats: {'Max': np.float64(3.2273878930671303), 'Min': np.float64(-1.1796071360425913), 'Mean': np.float64(0.5347944230315214), 'Std': np.float64(0.6460115673961061)}
2024-12-06 23:38:03,538 - INFO - Candidate Std Stats: {'Max': np.float64(2.07095552117793), 'Min': np.float64(0.0), 'Mean': np.float64(0.6244464359454973), 'Std': np.float64(0.3657795712984828)}
[I 2024-12-06 23:38:03,546] Trial 331 finished with value: 1.0714285714285714 and parameters: {'x_0_0': 'ac', 'x_0_1': 'oo', 'x_1_0': 'bd', 'x_1_1': 'bd'}. Best is trial 76 with value: 0.5.
[I 2024-12-06 23:38:03,550] Trial 331 finished with value: 1.1607142857142856 and parameters: {'x_0_0': 'bc', 'x_0_1': 'ad', 'x_1_0': 'bd', 'x_1_1': 'oo'}. Best is trial 165 with value: 0.5.
[I 2024-12-06 23:38:03,552] Trial 331 finished with value: 1.2857142857142856 and parameters: {'x_0_0': 'ad', 'x_0_1': 'ab', 'x_1_0': 'bc', 'x_1_1': 'bd'}. Best is trial 63 with value: 0.5.
2024-12-06 23:38:03,876 - INFO - Candidate Mean Stats: {'Max': np.float64(2.8403238393066266), 'Min': np.float64(-0.45051823479366726), 'Mean': np.float64(0.7520637008319788), 'Std': np.float64(0.49228491642243355)}
2024-12-06 23:38:03,876 - INFO - Candidate Std Stats: {'Max': np.float64(1.762924180195604), 'Min': np.float64(0.0), 'Mean': np.float64(0.48014907009377106), 'Std': np.float64(0.28554121443517205)}
