[I 2024-12-06 23:39:14,515] Trial 494 finished with value: 1.2142857142857144 and parameters: {'x_0_0': 'ab', 'x_0_1': 'oo', 'x_1_0': 'ac', 'x_1_1': 'ac'}. Best is trial 76 with value: 0.5.
2024-12-06 23:39:14,594 - INFO - Candidate Mean Stats: {'Max': np.float64(2.964731854641273), 'Min': np.float64(-0.33189338742080243), 'Mean': np.float64(0.8708360112702676), 'Std': np.float64(0.4731765672857892)}
2024-12-06 23:39:14,595 - INFO - Candidate Std Stats: {'Max': np.float64(1.619215246715303), 'Min': np.float64(0.0), 'Mean': np.float64(0.3899939716922753), 'Std': np.float64(0.27806544947346507)}
[I 2024-12-06 23:39:14,614] Trial 494 finished with value: 1.3214285714285714 and parameters: {'x_0_0': 'ad', 'x_0_1': 'bc', 'x_1_0': 'oo', 'x_1_1': 'ac'}. Best is trial 63 with value: 0.5.
2024-12-06 23:39:14,905 - INFO - Candidate Mean Stats: {'Max': np.float64(2.6442252702730014), 'Min': np.float64(-0.35705475530283426), 'Mean': np.float64(0.8545169617343954), 'Std': np.float64(0.4543243658412686)}
2024-12-06 23:39:14,906 - INFO - Candidate Std Stats: {'Max': np.float64(1.4961504821917386), 'Min': np.float64(0.0), 'Mean': np.float64(0.39569895268714866), 'Std': np.float64(0.2745576481354686)}
[I 2024-12-06 23:39:14,922] Trial 495 finished with value: 1.375 and parameters: {'x_0_0': 'oo', 'x_0_1': 'oo', 'x_1_0': 'bd', 'x_1_1': 'ad'}. Best is trial 165 with value: 0.5.
2024-12-06 23:39:14,935 - INFO - Candidate Mean Stats: {'Max': np.float64(3.2691614634870567), 'Min': np.float64(-0.3323713615185049), 'Mean': np.float64(0.8861045989283546), 'Std': np.float64(0.4558688621261442)}
2024-12-06 23:39:14,935 - INFO - Candidate Std Stats: {'Max': np.float64(1.2823640713610964), 'Min': np.float64(0.0), 'Mean': np.float64(0.3840818553804043), 'Std': np.float64(0.26072162995340786)}
[I 2024-12-06 23:39:14,952] Trial 492 finished with value: 1.1607142857142856 and parameters: {'x_0_0': 'bc', 'x_0_1': 'ad', 'x_1_0': 'cd', 'x_1_1': 'oo'}. Best is trial 23 with value: 0.5.
2024-12-06 23:39:14,961 - INFO - Candidate Mean Stats: {'Max': np.float64(3.4225436565798795), 'Min': np.float64(-0.5927544721798195), 'Mean': np.float64(0.8587960444369509), 'Std': np.float64(0.49329458801827064)}
2024-12-06 23:39:14,961 - INFO - Candidate Std Stats: {'Max': np.float64(1.6741190462821722), 'Min': np.float64(0.0), 'Mean': np.float64(0.41204140160851693), 'Std': np.float64(0.29186869931057563)}
[I 2024-12-06 23:39:14,980] Trial 495 finished with value: 1.5 and parameters: {'x_0_0': 'cd', 'x_0_1': 'oo', 'x_1_0': 'bc', 'x_1_1': 'ad'}. Best is trial 76 with value: 0.5.
2024-12-06 23:39:15,062 - INFO - Candidate Mean Stats: {'Max': np.float64(3.348311394611571), 'Min': np.float64(-0.6174894155364711), 'Mean': np.float64(0.8408378292389104), 'Std': np.float64(0.5222039401936036)}
2024-12-06 23:39:15,062 - INFO - Candidate Std Stats: {'Max': np.float64(1.412368141406562), 'Min': np.float64(0.0), 'Mean': np.float64(0.3771208391289253), 'Std': np.float64(0.27113201717966356)}
[I 2024-12-06 23:39:15,078] Trial 495 finished with value: 1.3214285714285714 and parameters: {'x_0_0': 'bd', 'x_0_1': 'ac', 'x_1_0': 'oo', 'x_1_1': 'ab'}. Best is trial 63 with value: 0.5.
2024-12-06 23:39:15,356 - INFO - Candidate Mean Stats: {'Max': np.float64(3.2059566619362507), 'Min': np.float64(-0.36809352214859975), 'Mean': np.float64(0.8693618880869715), 'Std': np.float64(0.4811415367046601)}
2024-12-06 23:39:15,356 - INFO - Candidate Std Stats: {'Max': np.float64(1.6496049480221162), 'Min': np.float64(0.0), 'Mean': np.float64(0.42055153307468385), 'Std': np.float64(0.30212872579605393)}
[I 2024-12-06 23:39:15,373] Trial 496 finished with value: 1.5 and parameters: {'x_0_0': 'cd', 'x_0_1': 'oo', 'x_1_0': 'ad', 'x_1_1': 'bd'}. Best is trial 165 with value: 0.5.
2024-12-06 23:39:15,389 - INFO - Candidate Mean Stats: {'Max': np.float64(3.1399573040385214), 'Min': np.float64(-0.2461007139677825), 'Mean': np.float64(0.8406253243330748), 'Std': np.float64(0.4792311739723345)}
2024-12-06 23:39:15,389 - INFO - Candidate Std Stats: {'Max': np.float64(1.486208632916339), 'Min': np.float64(0.0), 'Mean': np.float64(0.41668081519552735), 'Std': np.float64(0.28961370037993245)}
[I 2024-12-06 23:39:15,405] Trial 493 finished with value: 1.1785714285714286 and parameters: {'x_0_0': 'bc', 'x_0_1': 'ab', 'x_1_0': 'oo', 'x_1_1': 'bc'}. Best is trial 23 with value: 0.5.
2024-12-06 23:39:15,409 - INFO - Candidate Mean Stats: {'Max': np.float64(3.109685818778509), 'Min': np.float64(-0.9200896146579133), 'Mean': np.float64(0.7262126519130533), 'Std': np.float64(0.6165540947791799)}
2024-12-06 23:39:15,409 - INFO - Candidate Std Stats: {'Max': np.float64(1.4581728178144509), 'Min': np.float64(0.0), 'Mean': np.float64(0.4686273560831028), 'Std': np.float64(0.31696577608310045)}
[I 2024-12-06 23:39:15,424] Trial 496 finished with value: 1.7142857142857144 and parameters: {'x_0_0': 'ab', 'x_0_1': 'ad', 'x_1_0': 'bc', 'x_1_1': 'bc'}. Best is trial 76 with value: 0.5.
2024-12-06 23:39:15,500 - INFO - Candidate Mean Stats: {'Max': np.float64(3.2521462613047625), 'Min': np.float64(-0.47313216675374914), 'Mean': np.float64(0.7501621226513975), 'Std': np.float64(0.6099053453078024)}
2024-12-06 23:39:15,500 - INFO - Candidate Std Stats: {'Max': np.float64(1.5040081182309006), 'Min': np.float64(0.0), 'Mean': np.float64(0.43443625115084716), 'Std': np.float64(0.29632576805260913)}
[I 2024-12-06 23:39:15,515] Trial 496 finished with value: 1.5714285714285714 and parameters: {'x_0_0': 'ad', 'x_0_1': 'bd', 'x_1_0': 'ad', 'x_1_1': 'bc'}. Best is trial 63 with value: 0.5.
2024-12-06 23:39:15,781 - INFO - Candidate Mean Stats: {'Max': np.float64(2.9089887165655317), 'Min': np.float64(-0.3814021241695296), 'Mean': np.float64(0.8849805770683598), 'Std': np.float64(0.46718818545079527)}
2024-12-06 23:39:15,781 - INFO - Candidate Std Stats: {'Max': np.float64(1.5457964604745802), 'Min': np.float64(0.0), 'Mean': np.float64(0.38223105724856044), 'Std': np.float64(0.2655353752629178)}
[I 2024-12-06 23:39:15,795] Trial 497 finished with value: 1.3214285714285714 and parameters: {'x_0_0': 'bd', 'x_0_1': 'ad', 'x_1_0': 'oo', 'x_1_1': 'ac'}. Best is trial 165 with value: 0.5.
2024-12-06 23:39:15,820 - INFO - Candidate Mean Stats: {'Max': np.float64(3.2501037536881703), 'Min': np.float64(-0.40289448422521446), 'Mean': np.float64(0.8184705684386939), 'Std': np.float64(0.5305528423686539)}
2024-12-06 23:39:15,820 - INFO - Candidate Std Stats: {'Max': np.float64(1.6251942143340397), 'Min': np.float64(0.0), 'Mean': np.float64(0.48557868006896554), 'Std': np.float64(0.3289518636483547)}
2024-12-06 23:39:15,832 - INFO - Candidate Mean Stats: {'Max': np.float64(3.1328148562347566), 'Min': np.float64(-0.47832707602799046), 'Mean': np.float64(0.8592718379190245), 'Std': np.float64(0.5151883001185692)}
2024-12-06 23:39:15,832 - INFO - Candidate Std Stats: {'Max': np.float64(1.4296429449584682), 'Min': np.float64(0.0), 'Mean': np.float64(0.4535110800285634), 'Std': np.float64(0.30800750072457445)}
[I 2024-12-06 23:39:15,836] Trial 494 finished with value: 1.2857142857142856 and parameters: {'x_0_0': 'bc', 'x_0_1': 'ac', 'x_1_0': 'bd', 'x_1_1': 'cd'}. Best is trial 23 with value: 0.5.
[I 2024-12-06 23:39:15,846] Trial 497 finished with value: 1.1607142857142856 and parameters: {'x_0_0': 'ac', 'x_0_1': 'ad', 'x_1_0': 'ad', 'x_1_1': 'oo'}. Best is trial 76 with value: 0.5.
2024-12-06 23:39:15,923 - INFO - Candidate Mean Stats: {'Max': np.float64(2.9522957925007924), 'Min': np.float64(-0.4582793273895353), 'Mean': np.float64(0.8300096025186896), 'Std': np.float64(0.5424480083442182)}
2024-12-06 23:39:15,923 - INFO - Candidate Std Stats: {'Max': np.float64(2.1187222096893974), 'Min': np.float64(0.0), 'Mean': np.float64(0.4837125817436308), 'Std': np.float64(0.32380780318700786)}
[I 2024-12-06 23:39:15,939] Trial 497 finished with value: 1.2142857142857144 and parameters: {'x_0_0': 'ab', 'x_0_1': 'oo', 'x_1_0': 'ac', 'x_1_1': 'bc'}. Best is trial 63 with value: 0.5.
2024-12-06 23:39:16,200 - INFO - Candidate Mean Stats: {'Max': np.float64(2.569735659317933), 'Min': np.float64(-0.4348687257197815), 'Mean': np.float64(0.8546475778789369), 'Std': np.float64(0.4617631554280297)}
2024-12-06 23:39:16,200 - INFO - Candidate Std Stats: {'Max': np.float64(1.4503686609913), 'Min': np.float64(0.0), 'Mean': np.float64(0.3727053867860915), 'Std': np.float64(0.26389106534337087)}
[I 2024-12-06 23:39:16,215] Trial 498 finished with value: 1.5 and parameters: {'x_0_0': 'cd', 'x_0_1': 'oo', 'x_1_0': 'ab', 'x_1_1': 'ac'}. Best is trial 165 with value: 0.5.
2024-12-06 23:39:16,247 - INFO - Candidate Mean Stats: {'Max': np.float64(3.354537945207172), 'Min': np.float64(-0.4500601169430241), 'Mean': np.float64(0.8406458796812382), 'Std': np.float64(0.5079156010726035)}
2024-12-06 23:39:16,247 - INFO - Candidate Std Stats: {'Max': np.float64(1.5988009510242571), 'Min': np.float64(0.0), 'Mean': np.float64(0.42948107230857074), 'Std': np.float64(0.3122024127224488)}
2024-12-06 23:39:16,251 - INFO - Candidate Mean Stats: {'Max': np.float64(3.0391244427090056), 'Min': np.float64(-0.8330327092303064), 'Mean': np.float64(0.7409144411636903), 'Std': np.float64(0.6221697863043979)}
2024-12-06 23:39:16,251 - INFO - Candidate Std Stats: {'Max': np.float64(1.51467202634999), 'Min': np.float64(0.0), 'Mean': np.float64(0.4692752134690042), 'Std': np.float64(0.3067361503379492)}
[I 2024-12-06 23:39:16,262] Trial 495 finished with value: 1.1785714285714286 and parameters: {'x_0_0': 'bc', 'x_0_1': 'ab', 'x_1_0': 'oo', 'x_1_1': 'ad'}. Best is trial 23 with value: 0.5.
[I 2024-12-06 23:39:16,265] Trial 498 finished with value: 1.2857142857142856 and parameters: {'x_0_0': 'bc', 'x_0_1': 'ac', 'x_1_0': 'ab', 'x_1_1': 'bc'}. Best is trial 76 with value: 0.5.
2024-12-06 23:39:16,342 - INFO - Candidate Mean Stats: {'Max': np.float64(3.150311223610114), 'Min': np.float64(-0.35153119171525005), 'Mean': np.float64(0.8388887818657778), 'Std': np.float64(0.5174305402512192)}
2024-12-06 23:39:16,342 - INFO - Candidate Std Stats: {'Max': np.float64(1.6107978616305274), 'Min': np.float64(0.0), 'Mean': np.float64(0.44877351316114145), 'Std': np.float64(0.31966809638463045)}
[I 2024-12-06 23:39:16,357] Trial 498 finished with value: 1.3214285714285714 and parameters: {'x_0_0': 'bd', 'x_0_1': 'bd', 'x_1_0': 'oo', 'x_1_1': 'ad'}. Best is trial 63 with value: 0.5.
2024-12-06 23:39:16,621 - INFO - Candidate Mean Stats: {'Max': np.float64(3.115757899572887), 'Min': np.float64(-0.37454690259735357), 'Mean': np.float64(0.8565572325624369), 'Std': np.float64(0.50296683570589)}
2024-12-06 23:39:16,621 - INFO - Candidate Std Stats: {'Max': np.float64(1.5391042304660856), 'Min': np.float64(0.0), 'Mean': np.float64(0.4251790244971026), 'Std': np.float64(0.2984451365632859)}
[I 2024-12-06 23:39:16,636] Trial 499 finished with value: 0.75 and parameters: {'x_0_0': 'bc', 'x_0_1': 'ad', 'x_1_0': 'oo', 'x_1_1': 'bc'}. Best is trial 165 with value: 0.5.
2024-12-06 23:39:16,639 - INFO - Best value: 0.5
2024-12-06 23:39:16,641 - INFO - Best params: {'x_0_0': 'ad', 'x_0_1': 'oo', 'x_1_0': 'bc', 'x_1_1': 'ad'}
2024-12-06 23:39:16,650 - INFO - Best Direction Matrix:
[['ad' 'oo']
 ['bc' 'ad']]
2024-12-06 23:39:16,666 - INFO - Candidate Mean Stats: {'Max': np.float64(3.1193437241712108), 'Min': np.float64(-0.3224581789560129), 'Mean': np.float64(0.8812313025342409), 'Std': np.float64(0.46098644089285495)}
2024-12-06 23:39:16,666 - INFO - Candidate Std Stats: {'Max': np.float64(1.4218006774261827), 'Min': np.float64(0.0), 'Mean': np.float64(0.3572738491170535), 'Std': np.float64(0.25006466831977014)}
2024-12-06 23:39:16,669 - INFO - Candidate Mean Stats: {'Max': np.float64(2.719819507283821), 'Min': np.float64(-0.510685202475536), 'Mean': np.float64(0.8298750662789647), 'Std': np.float64(0.5088447025102181)}
2024-12-06 23:39:16,669 - INFO - Candidate Std Stats: {'Max': np.float64(1.5656831089300853), 'Min': np.float64(0.0), 'Mean': np.float64(0.45456780525987583), 'Std': np.float64(0.30463091768324824)}
[I 2024-12-06 23:39:16,681] Trial 496 finished with value: 1.3214285714285714 and parameters: {'x_0_0': 'bd', 'x_0_1': 'cd', 'x_1_0': 'oo', 'x_1_1': 'ab'}. Best is trial 23 with value: 0.5.
[I 2024-12-06 23:39:16,684] Trial 499 finished with value: 1.2857142857142856 and parameters: {'x_0_0': 'bc', 'x_0_1': 'ad', 'x_1_0': 'ab', 'x_1_1': 'ad'}. Best is trial 76 with value: 0.5.
2024-12-06 23:39:16,687 - INFO - Best value: 0.5
2024-12-06 23:39:16,689 - INFO - Best params: {'x_0_0': 'ad', 'x_0_1': 'oo', 'x_1_0': 'bc', 'x_1_1': 'ac'}
2024-12-06 23:39:16,699 - INFO - Best Direction Matrix:
[['ad' 'oo']
 ['bc' 'ac']]
2024-12-06 23:39:16,759 - INFO - Candidate Mean Stats: {'Max': np.float64(3.1907835085735985), 'Min': np.float64(-0.7133715943013837), 'Mean': np.float64(0.8530116717991877), 'Std': np.float64(0.5109073338598292)}
2024-12-06 23:39:16,759 - INFO - Candidate Std Stats: {'Max': np.float64(1.5439504628659382), 'Min': np.float64(0.0), 'Mean': np.float64(0.4136478079306411), 'Std': np.float64(0.2894094627338)}
[I 2024-12-06 23:39:16,776] Trial 499 finished with value: 1.5714285714285714 and parameters: {'x_0_0': 'ad', 'x_0_1': 'ac', 'x_1_0': 'ad', 'x_1_1': 'cd'}. Best is trial 63 with value: 0.5.
2024-12-06 23:39:16,781 - INFO - Best value: 0.5
2024-12-06 23:39:16,784 - INFO - Best params: {'x_0_0': 'bd', 'x_0_1': 'oo', 'x_1_0': 'bc', 'x_1_1': 'ad'}
2024-12-06 23:39:16,794 - INFO - Best Direction Matrix:
[['bd' 'oo']
 ['bc' 'ad']]
2024-12-06 23:39:17,069 - INFO - Candidate Mean Stats: {'Max': np.float64(2.8215090039463067), 'Min': np.float64(-0.3243907970373951), 'Mean': np.float64(0.8658224911484068), 'Std': np.float64(0.483889829665678)}
2024-12-06 23:39:17,069 - INFO - Candidate Std Stats: {'Max': np.float64(1.381174656464883), 'Min': np.float64(0.0), 'Mean': np.float64(0.38924792727051166), 'Std': np.float64(0.2638304557830185)}
[I 2024-12-06 23:39:17,085] Trial 497 finished with value: 1.1607142857142856 and parameters: {'x_0_0': 'ac', 'x_0_1': 'ad', 'x_1_0': 'bd', 'x_1_1': 'oo'}. Best is trial 23 with value: 0.5.
2024-12-06 23:39:17,447 - INFO - Candidate Mean Stats: {'Max': np.float64(2.963284349505517), 'Min': np.float64(-0.5104948535533934), 'Mean': np.float64(0.8207204993556568), 'Std': np.float64(0.5610062357000047)}
2024-12-06 23:39:17,447 - INFO - Candidate Std Stats: {'Max': np.float64(1.4419102113977267), 'Min': np.float64(0.0), 'Mean': np.float64(0.4415606585086371), 'Std': np.float64(0.2999419158028629)}
[I 2024-12-06 23:39:17,461] Trial 498 finished with value: 1.5714285714285714 and parameters: {'x_0_0': 'bc', 'x_0_1': 'bd', 'x_1_0': 'cd', 'x_1_1': 'bc'}. Best is trial 23 with value: 0.5.
2024-12-06 23:39:17,818 - INFO - Candidate Mean Stats: {'Max': np.float64(2.8796622751033856), 'Min': np.float64(-0.4069971648080587), 'Mean': np.float64(0.8599468003421428), 'Std': np.float64(0.49859904670450356)}
2024-12-06 23:39:17,818 - INFO - Candidate Std Stats: {'Max': np.float64(1.4763575014850658), 'Min': np.float64(0.0), 'Mean': np.float64(0.4110937005465188), 'Std': np.float64(0.28079326774297503)}
[I 2024-12-06 23:39:17,832] Trial 499 finished with value: 1.5 and parameters: {'x_0_0': 'cd', 'x_0_1': 'oo', 'x_1_0': 'ad', 'x_1_1': 'bc'}. Best is trial 23 with value: 0.5.
2024-12-06 23:39:17,835 - INFO - Best value: 0.5
2024-12-06 23:39:17,837 - INFO - Best params: {'x_0_0': 'bd', 'x_0_1': 'oo', 'x_1_0': 'bc', 'x_1_1': 'ad'}
2024-12-06 23:39:17,845 - INFO - Best Direction Matrix:
[['bd' 'oo']
 ['bc' 'ad']]
2024-12-06 23:39:21,106 - INFO - Experiment settings: {'name': '2024-12-06_23-36-00_warcraft_map2_parafac_seed3', 'seed': 3, 'dimension': 2, 'function': 'warcraft', 'map': array([[0.1, 0.4, 0.1],
       [0.2, 0.1, 0.1]]), 'iter_bo': 500, 'storage': 'sqlite:///results/2024-12-06_23-36-00/warcraft_map2_parafac_seed3.db', 'sampler': 'parafac', 'unique_sampling': False, 'decomp_num': 5, 'cp_settings': {'rank': 3, 'als_iterations': 100, 'mask_ratio': 0.9, 'random_dist_type': 'normal', 'include_observed_points': False}, 'acqf_settings': {'acquisition_function': 'ei', 'trade_off_param': 1.0, 'batch_size': 1, 'maximize': False}, 'n_startup_trials': 1}
2024-12-06 23:39:21,106 - INFO - Experiment settings: {'name': '2024-12-06_23-36-00_warcraft_map2_parafac_seed1', 'seed': 1, 'dimension': 2, 'function': 'warcraft', 'map': array([[0.1, 0.4, 0.1],
       [0.2, 0.1, 0.1]]), 'iter_bo': 500, 'storage': 'sqlite:///results/2024-12-06_23-36-00/warcraft_map2_parafac_seed1.db', 'sampler': 'parafac', 'unique_sampling': False, 'decomp_num': 5, 'cp_settings': {'rank': 3, 'als_iterations': 100, 'mask_ratio': 0.9, 'random_dist_type': 'normal', 'include_observed_points': False}, 'acqf_settings': {'acquisition_function': 'ei', 'trade_off_param': 1.0, 'batch_size': 1, 'maximize': False}, 'n_startup_trials': 1}
2024-12-06 23:39:21,106 - INFO - Experiment settings: {'name': '2024-12-06_23-36-00_warcraft_map2_parafac_seed0', 'seed': 0, 'dimension': 2, 'function': 'warcraft', 'map': array([[0.1, 0.4, 0.1],
       [0.2, 0.1, 0.1]]), 'iter_bo': 500, 'storage': 'sqlite:///results/2024-12-06_23-36-00/warcraft_map2_parafac_seed0.db', 'sampler': 'parafac', 'unique_sampling': False, 'decomp_num': 5, 'cp_settings': {'rank': 3, 'als_iterations': 100, 'mask_ratio': 0.9, 'random_dist_type': 'normal', 'include_observed_points': False}, 'acqf_settings': {'acquisition_function': 'ei', 'trade_off_param': 1.0, 'batch_size': 1, 'maximize': False}, 'n_startup_trials': 1}
2024-12-06 23:39:21,107 - INFO - Experiment settings: {'name': '2024-12-06_23-36-00_warcraft_map2_parafac_seed2', 'seed': 2, 'dimension': 2, 'function': 'warcraft', 'map': array([[0.1, 0.4, 0.1],
       [0.2, 0.1, 0.1]]), 'iter_bo': 500, 'storage': 'sqlite:///results/2024-12-06_23-36-00/warcraft_map2_parafac_seed2.db', 'sampler': 'parafac', 'unique_sampling': False, 'decomp_num': 5, 'cp_settings': {'rank': 3, 'als_iterations': 100, 'mask_ratio': 0.9, 'random_dist_type': 'normal', 'include_observed_points': False}, 'acqf_settings': {'acquisition_function': 'ei', 'trade_off_param': 1.0, 'batch_size': 1, 'maximize': False}, 'n_startup_trials': 1}
[I 2024-12-06 23:39:21,566] A new study created in RDB with name: 2024-12-06_23-36-00_warcraft_map2_parafac_seed0
[I 2024-12-06 23:39:21,566] A new study created in RDB with name: 2024-12-06_23-36-00_warcraft_map2_parafac_seed3
[I 2024-12-06 23:39:21,566] A new study created in RDB with name: 2024-12-06_23-36-00_warcraft_map2_parafac_seed1
[I 2024-12-06 23:39:21,567] A new study created in RDB with name: 2024-12-06_23-36-00_warcraft_map2_parafac_seed2
2024-12-06 23:39:21,568 - INFO - Created new study '2024-12-06_23-36-00_warcraft_map2_parafac_seed0' in sqlite:///results/2024-12-06_23-36-00/warcraft_map2_parafac_seed0.db
2024-12-06 23:39:21,568 - INFO - Created new study '2024-12-06_23-36-00_warcraft_map2_parafac_seed1' in sqlite:///results/2024-12-06_23-36-00/warcraft_map2_parafac_seed1.db
2024-12-06 23:39:21,568 - INFO - Created new study '2024-12-06_23-36-00_warcraft_map2_parafac_seed3' in sqlite:///results/2024-12-06_23-36-00/warcraft_map2_parafac_seed3.db
2024-12-06 23:39:21,568 - INFO - Created new study '2024-12-06_23-36-00_warcraft_map2_parafac_seed2' in sqlite:///results/2024-12-06_23-36-00/warcraft_map2_parafac_seed2.db
2024-12-06 23:39:21,582 - INFO - Using sample_independent for sampling with random sampler.
2024-12-06 23:39:21,582 - INFO - Using sample_independent for sampling with random sampler.
2024-12-06 23:39:21,582 - INFO - Using sample_independent for sampling with random sampler.
2024-12-06 23:39:21,583 - INFO - Using sample_independent for sampling with random sampler.
2024-12-06 23:39:21,586 - INFO - Using sample_independent for sampling with random sampler.
2024-12-06 23:39:21,586 - INFO - Using sample_independent for sampling with random sampler.
2024-12-06 23:39:21,586 - INFO - Using sample_independent for sampling with random sampler.
2024-12-06 23:39:21,586 - INFO - Using sample_independent for sampling with random sampler.
2024-12-06 23:39:21,588 - INFO - Using sample_independent for sampling with random sampler.
2024-12-06 23:39:21,588 - INFO - Using sample_independent for sampling with random sampler.
2024-12-06 23:39:21,588 - INFO - Using sample_independent for sampling with random sampler.
2024-12-06 23:39:21,589 - INFO - Using sample_independent for sampling with random sampler.
2024-12-06 23:39:21,590 - INFO - Using sample_independent for sampling with random sampler.
2024-12-06 23:39:21,590 - INFO - Using sample_independent for sampling with random sampler.
2024-12-06 23:39:21,590 - INFO - Using sample_independent for sampling with random sampler.
2024-12-06 23:39:21,591 - INFO - Using sample_independent for sampling with random sampler.
2024-12-06 23:39:21,592 - INFO - Using sample_independent for sampling with random sampler.
2024-12-06 23:39:21,592 - INFO - Using sample_independent for sampling with random sampler.
2024-12-06 23:39:21,592 - INFO - Using sample_independent for sampling with random sampler.
2024-12-06 23:39:21,593 - INFO - Using sample_independent for sampling with random sampler.
2024-12-06 23:39:21,594 - INFO - Using sample_independent for sampling with random sampler.
2024-12-06 23:39:21,594 - INFO - Using sample_independent for sampling with random sampler.
2024-12-06 23:39:21,594 - INFO - Using sample_independent for sampling with random sampler.
2024-12-06 23:39:21,595 - INFO - Using sample_independent for sampling with random sampler.
[I 2024-12-06 23:39:21,608] Trial 0 finished with value: 1.7777777777777777 and parameters: {'x_0_0': 'ab', 'x_0_1': 'ab', 'x_0_2': 'ab', 'x_1_0': 'ab', 'x_1_1': 'ab', 'x_1_2': 'ab'}. Best is trial 0 with value: 1.7777777777777777.
[I 2024-12-06 23:39:21,608] Trial 0 finished with value: 1.4444444444444444 and parameters: {'x_0_0': 'bd', 'x_0_1': 'bd', 'x_0_2': 'bd', 'x_1_0': 'bd', 'x_1_1': 'bd', 'x_1_2': 'bd'}. Best is trial 0 with value: 1.4444444444444444.
