[I 2024-12-07 01:00:25,205] Trial 214 finished with value: 1.8 and parameters: {'x_0_0': 'oo', 'x_0_1': 'ab', 'x_0_2': 'oo', 'x_1_0': 'bc', 'x_1_1': 'cd', 'x_1_2': 'ab'}. Best is trial 148 with value: 0.8333333333333333.
2024-12-07 01:00:29,762 - INFO - Candidate Mean Stats: {'Max': np.float64(2.0), 'Min': np.float64(0.2529918648189325), 'Mean': np.float64(0.4832219915163027), 'Std': np.float64(0.0777082549128088)}
2024-12-07 01:00:29,762 - INFO - Candidate Std Stats: {'Max': np.float64(1.2650353361778137), 'Min': np.float64(0.0), 'Mean': np.float64(0.11625416001173555), 'Std': np.float64(0.05634606654951786)}
[I 2024-12-07 01:00:29,807] Trial 214 finished with value: 1.3666666666666667 and parameters: {'x_0_0': 'bd', 'x_0_1': 'bc', 'x_0_2': 'ac', 'x_1_0': 'oo', 'x_1_1': 'oo', 'x_1_2': 'cd'}. Best is trial 49 with value: 0.7999999999999999.
2024-12-07 01:00:38,359 - INFO - Candidate Mean Stats: {'Max': np.float64(2.0), 'Min': np.float64(0.21828924474006), 'Mean': np.float64(0.48324201790111715), 'Std': np.float64(0.07288482434207333)}
2024-12-07 01:00:38,360 - INFO - Candidate Std Stats: {'Max': np.float64(0.3823188926731779), 'Min': np.float64(0.0), 'Mean': np.float64(0.10399816589241066), 'Std': np.float64(0.04362067328384576)}
[I 2024-12-07 01:00:38,403] Trial 214 finished with value: 1.4666666666666666 and parameters: {'x_0_0': 'ac', 'x_0_1': 'bc', 'x_0_2': 'oo', 'x_1_0': 'bc', 'x_1_1': 'oo', 'x_1_2': 'cd'}. Best is trial 200 with value: 0.6.
2024-12-07 01:00:44,401 - INFO - Candidate Mean Stats: {'Max': np.float64(2.0), 'Min': np.float64(0.26815225337384857), 'Mean': np.float64(0.4909799659031074), 'Std': np.float64(0.07183621575854755)}
2024-12-07 01:00:44,403 - INFO - Candidate Std Stats: {'Max': np.float64(0.33656559968526595), 'Min': np.float64(0.0), 'Mean': np.float64(0.09830199792550895), 'Std': np.float64(0.040880413461078395)}
[I 2024-12-07 01:00:44,446] Trial 214 finished with value: 1.3555555555555556 and parameters: {'x_0_0': 'ac', 'x_0_1': 'ab', 'x_0_2': 'bc', 'x_1_0': 'oo', 'x_1_1': 'bd', 'x_1_2': 'cd'}. Best is trial 74 with value: 0.8222222222222222.
2024-12-07 01:00:45,683 - INFO - Candidate Mean Stats: {'Max': np.float64(2.0), 'Min': np.float64(0.23351003392343075), 'Mean': np.float64(0.4965171331307982), 'Std': np.float64(0.07316950565811992)}
2024-12-07 01:00:45,684 - INFO - Candidate Std Stats: {'Max': np.float64(0.3977997450359718), 'Min': np.float64(0.0), 'Mean': np.float64(0.10804249183258867), 'Std': np.float64(0.041230690784883915)}
[I 2024-12-07 01:00:45,727] Trial 215 finished with value: 1.0666666666666667 and parameters: {'x_0_0': 'ac', 'x_0_1': 'oo', 'x_0_2': 'ab', 'x_1_0': 'oo', 'x_1_1': 'cd', 'x_1_2': 'ad'}. Best is trial 148 with value: 0.8333333333333333.
2024-12-07 01:00:50,407 - INFO - Candidate Mean Stats: {'Max': np.float64(2.0), 'Min': np.float64(0.15218215306420044), 'Mean': np.float64(0.4844787221716177), 'Std': np.float64(0.07725909529153067)}
2024-12-07 01:00:50,408 - INFO - Candidate Std Stats: {'Max': np.float64(1.2110835791212033), 'Min': np.float64(0.0), 'Mean': np.float64(0.11026117564882852), 'Std': np.float64(0.05430112359695038)}
[I 2024-12-07 01:00:50,452] Trial 215 finished with value: 1.5666666666666667 and parameters: {'x_0_0': 'bc', 'x_0_1': 'bd', 'x_0_2': 'bd', 'x_1_0': 'bd', 'x_1_1': 'ad', 'x_1_2': 'oo'}. Best is trial 49 with value: 0.7999999999999999.
2024-12-07 01:00:58,910 - INFO - Candidate Mean Stats: {'Max': np.float64(2.0), 'Min': np.float64(0.27608732117455037), 'Mean': np.float64(0.4832055330610503), 'Std': np.float64(0.07206823386418476)}
2024-12-07 01:00:58,911 - INFO - Candidate Std Stats: {'Max': np.float64(0.4537725804728898), 'Min': np.float64(0.0), 'Mean': np.float64(0.10262872066875868), 'Std': np.float64(0.040715517914911216)}
[I 2024-12-07 01:00:58,955] Trial 215 finished with value: 1.2666666666666666 and parameters: {'x_0_0': 'bc', 'x_0_1': 'oo', 'x_0_2': 'bd', 'x_1_0': 'cd', 'x_1_1': 'ad', 'x_1_2': 'cd'}. Best is trial 200 with value: 0.6.
2024-12-07 01:01:04,879 - INFO - Candidate Mean Stats: {'Max': np.float64(2.0), 'Min': np.float64(0.2703966153210623), 'Mean': np.float64(0.49684985558744893), 'Std': np.float64(0.07136958813530106)}
2024-12-07 01:01:04,879 - INFO - Candidate Std Stats: {'Max': np.float64(0.45884983008203595), 'Min': np.float64(0.0), 'Mean': np.float64(0.10694190789725884), 'Std': np.float64(0.04367371438124804)}
[I 2024-12-07 01:01:04,922] Trial 215 finished with value: 1.1666666666666665 and parameters: {'x_0_0': 'ac', 'x_0_1': 'oo', 'x_0_2': 'oo', 'x_1_0': 'bd', 'x_1_1': 'ad', 'x_1_2': 'cd'}. Best is trial 74 with value: 0.8222222222222222.
2024-12-07 01:01:06,272 - INFO - Candidate Mean Stats: {'Max': np.float64(2.0), 'Min': np.float64(0.2126691829013611), 'Mean': np.float64(0.4875274097599472), 'Std': np.float64(0.0750187918815538)}
2024-12-07 01:01:06,272 - INFO - Candidate Std Stats: {'Max': np.float64(0.7535410773898468), 'Min': np.float64(0.0), 'Mean': np.float64(0.11236791140810938), 'Std': np.float64(0.052479964882003405)}
[I 2024-12-07 01:01:06,315] Trial 216 finished with value: 1.4666666666666666 and parameters: {'x_0_0': 'bd', 'x_0_1': 'cd', 'x_0_2': 'ab', 'x_1_0': 'oo', 'x_1_1': 'ad', 'x_1_2': 'ac'}. Best is trial 148 with value: 0.8333333333333333.
2024-12-07 01:01:10,872 - INFO - Candidate Mean Stats: {'Max': np.float64(2.0), 'Min': np.float64(0.20940639525392757), 'Mean': np.float64(0.47909368487723697), 'Std': np.float64(0.07466030482482612)}
2024-12-07 01:01:10,872 - INFO - Candidate Std Stats: {'Max': np.float64(1.1572003319305604), 'Min': np.float64(0.0), 'Mean': np.float64(0.10243008034489069), 'Std': np.float64(0.047242365802920856)}
[I 2024-12-07 01:01:10,918] Trial 216 finished with value: 1.5666666666666667 and parameters: {'x_0_0': 'ad', 'x_0_1': 'cd', 'x_0_2': 'bc', 'x_1_0': 'ac', 'x_1_1': 'bc', 'x_1_2': 'oo'}. Best is trial 49 with value: 0.7999999999999999.
2024-12-07 01:01:19,408 - INFO - Candidate Mean Stats: {'Max': np.float64(2.0), 'Min': np.float64(0.06725761045645302), 'Mean': np.float64(0.4953104675187662), 'Std': np.float64(0.08522659269042246)}
2024-12-07 01:01:19,409 - INFO - Candidate Std Stats: {'Max': np.float64(1.5929470397854855), 'Min': np.float64(0.0), 'Mean': np.float64(0.12410162456825502), 'Std': np.float64(0.07516371922980247)}
[I 2024-12-07 01:01:19,451] Trial 216 finished with value: 1.0444444444444443 and parameters: {'x_0_0': 'ad', 'x_0_1': 'oo', 'x_0_2': 'cd', 'x_1_0': 'bd', 'x_1_1': 'ab', 'x_1_2': 'ac'}. Best is trial 200 with value: 0.6.
2024-12-07 01:01:25,433 - INFO - Candidate Mean Stats: {'Max': np.float64(2.0), 'Min': np.float64(0.2457672555673081), 'Mean': np.float64(0.4899217404555634), 'Std': np.float64(0.06924949443621685)}
2024-12-07 01:01:25,433 - INFO - Candidate Std Stats: {'Max': np.float64(0.5454999788510185), 'Min': np.float64(0.0), 'Mean': np.float64(0.10198525280791812), 'Std': np.float64(0.04456952271048333)}
[I 2024-12-07 01:01:25,477] Trial 216 finished with value: 1.2444444444444445 and parameters: {'x_0_0': 'bd', 'x_0_1': 'ad', 'x_0_2': 'oo', 'x_1_0': 'bd', 'x_1_1': 'oo', 'x_1_2': 'bd'}. Best is trial 74 with value: 0.8222222222222222.
2024-12-07 01:01:26,788 - INFO - Candidate Mean Stats: {'Max': np.float64(2.0), 'Min': np.float64(0.12449257765756302), 'Mean': np.float64(0.4883387226259984), 'Std': np.float64(0.07764230533385974)}
2024-12-07 01:01:26,788 - INFO - Candidate Std Stats: {'Max': np.float64(0.5261929953357591), 'Min': np.float64(0.0), 'Mean': np.float64(0.11081888497374581), 'Std': np.float64(0.04924505661829355)}
[I 2024-12-07 01:01:26,837] Trial 217 finished with value: 1.5666666666666664 and parameters: {'x_0_0': 'ac', 'x_0_1': 'cd', 'x_0_2': 'oo', 'x_1_0': 'bd', 'x_1_1': 'bc', 'x_1_2': 'ac'}. Best is trial 148 with value: 0.8333333333333333.
2024-12-07 01:01:31,423 - INFO - Candidate Mean Stats: {'Max': np.float64(2.0), 'Min': np.float64(0.26301805680649676), 'Mean': np.float64(0.48668496153409785), 'Std': np.float64(0.07406935798792816)}
2024-12-07 01:01:31,423 - INFO - Candidate Std Stats: {'Max': np.float64(1.1132436444506517), 'Min': np.float64(0.0), 'Mean': np.float64(0.10135217193857758), 'Std': np.float64(0.05009669651196618)}
[I 2024-12-07 01:01:31,466] Trial 217 finished with value: 1.6666666666666665 and parameters: {'x_0_0': 'bd', 'x_0_1': 'cd', 'x_0_2': 'bd', 'x_1_0': 'ac', 'x_1_1': 'cd', 'x_1_2': 'ab'}. Best is trial 49 with value: 0.7999999999999999.
2024-12-07 01:01:40,053 - INFO - Candidate Mean Stats: {'Max': np.float64(2.0), 'Min': np.float64(0.2760953283589155), 'Mean': np.float64(0.4910520528014072), 'Std': np.float64(0.07029272997262606)}
2024-12-07 01:01:40,053 - INFO - Candidate Std Stats: {'Max': np.float64(0.6273231501213761), 'Min': np.float64(0.0), 'Mean': np.float64(0.10628807951190349), 'Std': np.float64(0.04586926097677821)}
[I 2024-12-07 01:01:40,099] Trial 217 finished with value: 1.4666666666666666 and parameters: {'x_0_0': 'ad', 'x_0_1': 'bc', 'x_0_2': 'bd', 'x_1_0': 'oo', 'x_1_1': 'ab', 'x_1_2': 'cd'}. Best is trial 200 with value: 0.6.
2024-12-07 01:01:45,929 - INFO - Candidate Mean Stats: {'Max': np.float64(2.0), 'Min': np.float64(0.1786289294328569), 'Mean': np.float64(0.4828976505121924), 'Std': np.float64(0.08477098531006722)}
2024-12-07 01:01:45,929 - INFO - Candidate Std Stats: {'Max': np.float64(1.4162963425347956), 'Min': np.float64(0.0), 'Mean': np.float64(0.12617409935844912), 'Std': np.float64(0.06475190636295454)}
[I 2024-12-07 01:01:45,973] Trial 217 finished with value: 0.8666666666666667 and parameters: {'x_0_0': 'bc', 'x_0_1': 'oo', 'x_0_2': 'oo', 'x_1_0': 'oo', 'x_1_1': 'oo', 'x_1_2': 'ab'}. Best is trial 74 with value: 0.8222222222222222.
2024-12-07 01:01:47,006 - INFO - Candidate Mean Stats: {'Max': np.float64(2.0), 'Min': np.float64(0.2642325019406331), 'Mean': np.float64(0.4919949773666325), 'Std': np.float64(0.07707817520569742)}
2024-12-07 01:01:47,006 - INFO - Candidate Std Stats: {'Max': np.float64(1.0818026918376051), 'Min': np.float64(0.0), 'Mean': np.float64(0.10046903418254781), 'Std': np.float64(0.047959196387948703)}
[I 2024-12-07 01:01:47,050] Trial 218 finished with value: 1.7999999999999998 and parameters: {'x_0_0': 'cd', 'x_0_1': 'ad', 'x_0_2': 'bd', 'x_1_0': 'oo', 'x_1_1': 'ac', 'x_1_2': 'cd'}. Best is trial 148 with value: 0.8333333333333333.
2024-12-07 01:01:52,141 - INFO - Candidate Mean Stats: {'Max': np.float64(2.0), 'Min': np.float64(0.1962537765066225), 'Mean': np.float64(0.4871938474567666), 'Std': np.float64(0.07567706823890662)}
2024-12-07 01:01:52,141 - INFO - Candidate Std Stats: {'Max': np.float64(0.8081237531113882), 'Min': np.float64(0.0), 'Mean': np.float64(0.10875289024595648), 'Std': np.float64(0.044872078012490525)}
[I 2024-12-07 01:01:52,185] Trial 218 finished with value: 1.6777777777777778 and parameters: {'x_0_0': 'ab', 'x_0_1': 'ac', 'x_0_2': 'bc', 'x_1_0': 'bc', 'x_1_1': 'oo', 'x_1_2': 'bc'}. Best is trial 49 with value: 0.7999999999999999.
2024-12-07 01:02:00,563 - INFO - Candidate Mean Stats: {'Max': np.float64(2.0), 'Min': np.float64(0.2671614768854399), 'Mean': np.float64(0.4852830489596289), 'Std': np.float64(0.07239640869018515)}
2024-12-07 01:02:00,563 - INFO - Candidate Std Stats: {'Max': np.float64(0.4090183741330461), 'Min': np.float64(0.0), 'Mean': np.float64(0.10993616059554685), 'Std': np.float64(0.0435880076228833)}
[I 2024-12-07 01:02:00,605] Trial 218 finished with value: 1.6666666666666665 and parameters: {'x_0_0': 'bc', 'x_0_1': 'bd', 'x_0_2': 'ab', 'x_1_0': 'bd', 'x_1_1': 'ab', 'x_1_2': 'cd'}. Best is trial 200 with value: 0.6.
2024-12-07 01:02:06,343 - INFO - Candidate Mean Stats: {'Max': np.float64(2.0), 'Min': np.float64(0.21493457225197435), 'Mean': np.float64(0.49221907878952637), 'Std': np.float64(0.07608118502397386)}
2024-12-07 01:02:06,343 - INFO - Candidate Std Stats: {'Max': np.float64(1.5694156558140218), 'Min': np.float64(0.0), 'Mean': np.float64(0.11509959866450681), 'Std': np.float64(0.05867436810281503)}
[I 2024-12-07 01:02:06,386] Trial 218 finished with value: 1.6777777777777776 and parameters: {'x_0_0': 'ab', 'x_0_1': 'ad', 'x_0_2': 'oo', 'x_1_0': 'bc', 'x_1_1': 'cd', 'x_1_2': 'ac'}. Best is trial 74 with value: 0.8222222222222222.
2024-12-07 01:02:07,632 - INFO - Candidate Mean Stats: {'Max': np.float64(2.0), 'Min': np.float64(0.2312342000236421), 'Mean': np.float64(0.48053513586047153), 'Std': np.float64(0.08121761198813805)}
2024-12-07 01:02:07,632 - INFO - Candidate Std Stats: {'Max': np.float64(1.4939559337182942), 'Min': np.float64(0.0), 'Mean': np.float64(0.11369592478691871), 'Std': np.float64(0.05131721323161076)}
[I 2024-12-07 01:02:07,675] Trial 219 finished with value: 1.6666666666666665 and parameters: {'x_0_0': 'bc', 'x_0_1': 'cd', 'x_0_2': 'bc', 'x_1_0': 'ab', 'x_1_1': 'bd', 'x_1_2': 'bd'}. Best is trial 148 with value: 0.8333333333333333.
2024-12-07 01:02:12,734 - INFO - Candidate Mean Stats: {'Max': np.float64(2.0), 'Min': np.float64(0.17625879554750792), 'Mean': np.float64(0.4868446985351047), 'Std': np.float64(0.073004354304907)}
2024-12-07 01:02:12,734 - INFO - Candidate Std Stats: {'Max': np.float64(0.5113137299616561), 'Min': np.float64(0.0), 'Mean': np.float64(0.11839494510579911), 'Std': np.float64(0.05146253389378759)}
[I 2024-12-07 01:02:12,780] Trial 219 finished with value: 1.0666666666666667 and parameters: {'x_0_0': 'ad', 'x_0_1': 'oo', 'x_0_2': 'ac', 'x_1_0': 'oo', 'x_1_1': 'ab', 'x_1_2': 'bd'}. Best is trial 49 with value: 0.7999999999999999.
2024-12-07 01:02:20,985 - INFO - Candidate Mean Stats: {'Max': np.float64(2.0), 'Min': np.float64(0.1833725444625732), 'Mean': np.float64(0.4862447626601917), 'Std': np.float64(0.07721397588341294)}
2024-12-07 01:02:20,985 - INFO - Candidate Std Stats: {'Max': np.float64(0.34567652854979347), 'Min': np.float64(0.0), 'Mean': np.float64(0.1060114722843666), 'Std': np.float64(0.04344123872147956)}
[I 2024-12-07 01:02:21,029] Trial 219 finished with value: 1.6666666666666665 and parameters: {'x_0_0': 'bc', 'x_0_1': 'cd', 'x_0_2': 'ad', 'x_1_0': 'bc', 'x_1_1': 'cd', 'x_1_2': 'cd'}. Best is trial 200 with value: 0.6.
2024-12-07 01:02:27,284 - INFO - Candidate Mean Stats: {'Max': np.float64(2.0), 'Min': np.float64(0.23686669621178663), 'Mean': np.float64(0.48738020691774786), 'Std': np.float64(0.0739621760653106)}
2024-12-07 01:02:27,285 - INFO - Candidate Std Stats: {'Max': np.float64(0.35037561113791704), 'Min': np.float64(0.0), 'Mean': np.float64(0.09808225233799675), 'Std': np.float64(0.0407045321875013)}
[I 2024-12-07 01:02:27,330] Trial 219 finished with value: 1.1666666666666665 and parameters: {'x_0_0': 'ac', 'x_0_1': 'oo', 'x_0_2': 'ab', 'x_1_0': 'ad', 'x_1_1': 'oo', 'x_1_2': 'ad'}. Best is trial 74 with value: 0.8222222222222222.
2024-12-07 01:02:28,387 - INFO - Candidate Mean Stats: {'Max': np.float64(2.0), 'Min': np.float64(0.20230454132449932), 'Mean': np.float64(0.4852732112087412), 'Std': np.float64(0.08162840718091942)}
2024-12-07 01:02:28,388 - INFO - Candidate Std Stats: {'Max': np.float64(0.7818674275611692), 'Min': np.float64(0.0), 'Mean': np.float64(0.11037107846935143), 'Std': np.float64(0.0506821737517847)}
[I 2024-12-07 01:02:28,433] Trial 220 finished with value: 1.4555555555555557 and parameters: {'x_0_0': 'ad', 'x_0_1': 'bd', 'x_0_2': 'ab', 'x_1_0': 'ab', 'x_1_1': 'ab', 'x_1_2': 'oo'}. Best is trial 148 with value: 0.8333333333333333.
2024-12-07 01:02:33,182 - INFO - Candidate Mean Stats: {'Max': np.float64(2.0), 'Min': np.float64(0.2070381501037108), 'Mean': np.float64(0.49472039233248527), 'Std': np.float64(0.07742648848965147)}
2024-12-07 01:02:33,182 - INFO - Candidate Std Stats: {'Max': np.float64(0.369020035004465), 'Min': np.float64(0.0), 'Mean': np.float64(0.10422567231131034), 'Std': np.float64(0.04299215789916857)}
[I 2024-12-07 01:02:33,225] Trial 220 finished with value: 1.6666666666666665 and parameters: {'x_0_0': 'bd', 'x_0_1': 'ab', 'x_0_2': 'bd', 'x_1_0': 'ac', 'x_1_1': 'ac', 'x_1_2': 'ad'}. Best is trial 49 with value: 0.7999999999999999.
2024-12-07 01:02:41,606 - INFO - Candidate Mean Stats: {'Max': np.float64(2.0), 'Min': np.float64(0.25446811471849534), 'Mean': np.float64(0.4958318061282886), 'Std': np.float64(0.07378412519789282)}
2024-12-07 01:02:41,606 - INFO - Candidate Std Stats: {'Max': np.float64(1.7827748940592436), 'Min': np.float64(0.0), 'Mean': np.float64(0.10287148065226488), 'Std': np.float64(0.04610063023062053)}
[I 2024-12-07 01:02:41,650] Trial 220 finished with value: 1.6666666666666665 and parameters: {'x_0_0': 'bc', 'x_0_1': 'cd', 'x_0_2': 'ad', 'x_1_0': 'cd', 'x_1_1': 'ad', 'x_1_2': 'cd'}. Best is trial 200 with value: 0.6.
2024-12-07 01:02:47,898 - INFO - Candidate Mean Stats: {'Max': np.float64(2.0), 'Min': np.float64(0.19350273040830612), 'Mean': np.float64(0.4999938680656375), 'Std': np.float64(0.0774324422045204)}
2024-12-07 01:02:47,898 - INFO - Candidate Std Stats: {'Max': np.float64(0.394237633771051), 'Min': np.float64(0.0), 'Mean': np.float64(0.11589901748436911), 'Std': np.float64(0.04841580913892688)}
[I 2024-12-07 01:02:47,941] Trial 220 finished with value: 1.9 and parameters: {'x_0_0': 'cd', 'x_0_1': 'cd', 'x_0_2': 'cd', 'x_1_0': 'ad', 'x_1_1': 'ab', 'x_1_2': 'oo'}. Best is trial 74 with value: 0.8222222222222222.
2024-12-07 01:02:48,876 - INFO - Candidate Mean Stats: {'Max': np.float64(2.0), 'Min': np.float64(0.2498600384404041), 'Mean': np.float64(0.4912624469245164), 'Std': np.float64(0.07145293342378566)}
2024-12-07 01:02:48,876 - INFO - Candidate Std Stats: {'Max': np.float64(0.4979107980482859), 'Min': np.float64(0.0), 'Mean': np.float64(0.105165328326077), 'Std': np.float64(0.04446119664952617)}
[I 2024-12-07 01:02:48,919] Trial 221 finished with value: 1.3444444444444443 and parameters: {'x_0_0': 'ac', 'x_0_1': 'ad', 'x_0_2': 'oo', 'x_1_0': 'bc', 'x_1_1': 'ad', 'x_1_2': 'bd'}. Best is trial 148 with value: 0.8333333333333333.
2024-12-07 01:02:53,590 - INFO - Candidate Mean Stats: {'Max': np.float64(2.0), 'Min': np.float64(0.21734685790442984), 'Mean': np.float64(0.4947599420632393), 'Std': np.float64(0.07384150094540352)}
2024-12-07 01:02:53,590 - INFO - Candidate Std Stats: {'Max': np.float64(0.44862140955764546), 'Min': np.float64(0.0), 'Mean': np.float64(0.1096797970601673), 'Std': np.float64(0.047787663954828655)}
[I 2024-12-07 01:02:53,633] Trial 221 finished with value: 1.6777777777777778 and parameters: {'x_0_0': 'ab', 'x_0_1': 'bd', 'x_0_2': 'cd', 'x_1_0': 'bc', 'x_1_1': 'ac', 'x_1_2': 'oo'}. Best is trial 49 with value: 0.7999999999999999.
2024-12-07 01:03:02,251 - INFO - Candidate Mean Stats: {'Max': np.float64(2.0), 'Min': np.float64(0.16732741765055326), 'Mean': np.float64(0.4803566928958671), 'Std': np.float64(0.07409201941564982)}
2024-12-07 01:03:02,251 - INFO - Candidate Std Stats: {'Max': np.float64(0.3783438667465364), 'Min': np.float64(0.0), 'Mean': np.float64(0.10491965696867925), 'Std': np.float64(0.04289327842842347)}
[I 2024-12-07 01:03:02,293] Trial 221 finished with value: 1.0666666666666667 and parameters: {'x_0_0': 'bc', 'x_0_1': 'oo', 'x_0_2': 'oo', 'x_1_0': 'ac', 'x_1_1': 'oo', 'x_1_2': 'cd'}. Best is trial 200 with value: 0.6.
2024-12-07 01:03:08,289 - INFO - Candidate Mean Stats: {'Max': np.float64(2.0), 'Min': np.float64(0.2781612937587888), 'Mean': np.float64(0.5026732854351716), 'Std': np.float64(0.06794389948655473)}
2024-12-07 01:03:08,289 - INFO - Candidate Std Stats: {'Max': np.float64(0.6197581103324197), 'Min': np.float64(0.0), 'Mean': np.float64(0.09692312895127769), 'Std': np.float64(0.04211475098993734)}
[I 2024-12-07 01:03:08,333] Trial 221 finished with value: 1.5666666666666667 and parameters: {'x_0_0': 'ac', 'x_0_1': 'bc', 'x_0_2': 'ab', 'x_1_0': 'ad', 'x_1_1': 'cd', 'x_1_2': 'oo'}. Best is trial 74 with value: 0.8222222222222222.
2024-12-07 01:03:09,284 - INFO - Candidate Mean Stats: {'Max': np.float64(2.0), 'Min': np.float64(0.2319454206705661), 'Mean': np.float64(0.49247155272695076), 'Std': np.float64(0.07292560860045989)}
2024-12-07 01:03:09,284 - INFO - Candidate Std Stats: {'Max': np.float64(0.4980041247716052), 'Min': np.float64(0.0), 'Mean': np.float64(0.11040779397432678), 'Std': np.float64(0.04758097451172422)}
[I 2024-12-07 01:03:09,328] Trial 222 finished with value: 1.4444444444444444 and parameters: {'x_0_0': 'bd', 'x_0_1': 'bd', 'x_0_2': 'cd', 'x_1_0': 'bd', 'x_1_1': 'ab', 'x_1_2': 'cd'}. Best is trial 148 with value: 0.8333333333333333.
2024-12-07 01:03:14,179 - INFO - Candidate Mean Stats: {'Max': np.float64(2.0), 'Min': np.float64(0.24620367040190216), 'Mean': np.float64(0.49737576781475884), 'Std': np.float64(0.07182468985668493)}
2024-12-07 01:03:14,179 - INFO - Candidate Std Stats: {'Max': np.float64(0.55772591660905), 'Min': np.float64(0.0), 'Mean': np.float64(0.10731563171434289), 'Std': np.float64(0.045723032948982285)}
[I 2024-12-07 01:03:14,223] Trial 222 finished with value: 1.6666666666666665 and parameters: {'x_0_0': 'ac', 'x_0_1': 'cd', 'x_0_2': 'ab', 'x_1_0': 'bd', 'x_1_1': 'ab', 'x_1_2': 'ab'}. Best is trial 49 with value: 0.7999999999999999.
2024-12-07 01:03:22,816 - INFO - Candidate Mean Stats: {'Max': np.float64(2.0), 'Min': np.float64(0.25178492467930597), 'Mean': np.float64(0.4893005252988209), 'Std': np.float64(0.07815272160748686)}
2024-12-07 01:03:22,818 - INFO - Candidate Std Stats: {'Max': np.float64(0.5347083353843705), 'Min': np.float64(0.0), 'Mean': np.float64(0.11356152031011232), 'Std': np.float64(0.05002697431989362)}
