[I 2024-12-06 23:36:33,672] Trial 88 finished with value: 1.0714285714285714 and parameters: {'x_0_0': 'bc', 'x_0_1': 'oo', 'x_1_0': 'bc', 'x_1_1': 'bd'}. Best is trial 50 with value: 0.6607142857142857.
2024-12-06 23:36:33,867 - INFO - Candidate Mean Stats: {'Max': np.float64(2.4228425760038776), 'Min': np.float64(-1.0825443479593253), 'Mean': np.float64(0.2995997079620413), 'Std': np.float64(0.4717924959911264)}
2024-12-06 23:36:33,867 - INFO - Candidate Std Stats: {'Max': np.float64(1.4410635328623778), 'Min': np.float64(0.0), 'Mean': np.float64(0.5446766035420916), 'Std': np.float64(0.2460237343240891)}
[I 2024-12-06 23:36:33,879] Trial 88 finished with value: 1.0714285714285714 and parameters: {'x_0_0': 'ac', 'x_0_1': 'oo', 'x_1_0': 'ac', 'x_1_1': 'ac'}. Best is trial 23 with value: 0.5.
2024-12-06 23:36:33,942 - INFO - Candidate Mean Stats: {'Max': np.float64(2.0110781140209952), 'Min': np.float64(-1.111735438208343), 'Mean': np.float64(0.31215618185510746), 'Std': np.float64(0.4849442495671899)}
2024-12-06 23:36:33,942 - INFO - Candidate Std Stats: {'Max': np.float64(1.597684910206955), 'Min': np.float64(0.0), 'Mean': np.float64(0.6570189876706856), 'Std': np.float64(0.273323993109849)}
[I 2024-12-06 23:36:33,955] Trial 89 finished with value: 1.5714285714285714 and parameters: {'x_0_0': 'ac', 'x_0_1': 'cd', 'x_1_0': 'bc', 'x_1_1': 'cd'}. Best is trial 63 with value: 0.5.
2024-12-06 23:36:33,981 - INFO - Candidate Mean Stats: {'Max': np.float64(2.328696930123936), 'Min': np.float64(-1.2205706912678764), 'Mean': np.float64(0.28662329651914914), 'Std': np.float64(0.5098134604917488)}
2024-12-06 23:36:33,981 - INFO - Candidate Std Stats: {'Max': np.float64(2.1616940186125877), 'Min': np.float64(0.0), 'Mean': np.float64(0.6380569746455085), 'Std': np.float64(0.28732428748794864)}
[I 2024-12-06 23:36:33,993] Trial 89 finished with value: 0.9464285714285714 and parameters: {'x_0_0': 'ac', 'x_0_1': 'oo', 'x_1_0': 'ad', 'x_1_1': 'oo'}. Best is trial 76 with value: 0.5.
2024-12-06 23:36:33,996 - INFO - Candidate Mean Stats: {'Max': np.float64(2.12066868892749), 'Min': np.float64(-1.3110104205184239), 'Mean': np.float64(0.3427973993032066), 'Std': np.float64(0.49877517895220075)}
2024-12-06 23:36:33,997 - INFO - Candidate Std Stats: {'Max': np.float64(1.634967490697319), 'Min': np.float64(0.0), 'Mean': np.float64(0.5950833038912862), 'Std': np.float64(0.2631215238496215)}
[I 2024-12-06 23:36:34,009] Trial 89 finished with value: 0.8214285714285714 and parameters: {'x_0_0': 'bc', 'x_0_1': 'oo', 'x_1_0': 'oo', 'x_1_1': 'cd'}. Best is trial 50 with value: 0.6607142857142857.
2024-12-06 23:36:34,195 - INFO - Candidate Mean Stats: {'Max': np.float64(2.112286647073989), 'Min': np.float64(-1.1283583830707111), 'Mean': np.float64(0.34669806989877316), 'Std': np.float64(0.4895818996810704)}
2024-12-06 23:36:34,195 - INFO - Candidate Std Stats: {'Max': np.float64(1.724612041936019), 'Min': np.float64(0.0), 'Mean': np.float64(0.5676084190538241), 'Std': np.float64(0.25258955597913746)}
[I 2024-12-06 23:36:34,210] Trial 89 finished with value: 1.0714285714285714 and parameters: {'x_0_0': 'bc', 'x_0_1': 'oo', 'x_1_0': 'ab', 'x_1_1': 'ac'}. Best is trial 23 with value: 0.5.
2024-12-06 23:36:34,276 - INFO - Candidate Mean Stats: {'Max': np.float64(2.0929458685219426), 'Min': np.float64(-1.1022898176854405), 'Mean': np.float64(0.33649261721641444), 'Std': np.float64(0.4708688178679788)}
2024-12-06 23:36:34,276 - INFO - Candidate Std Stats: {'Max': np.float64(1.4825555427432155), 'Min': np.float64(0.0), 'Mean': np.float64(0.5389082150798707), 'Std': np.float64(0.250879184621431)}
[I 2024-12-06 23:36:34,291] Trial 90 finished with value: 1.5 and parameters: {'x_0_0': 'cd', 'x_0_1': 'oo', 'x_1_0': 'bd', 'x_1_1': 'ad'}. Best is trial 63 with value: 0.5.
2024-12-06 23:36:34,313 - INFO - Candidate Mean Stats: {'Max': np.float64(2.344780491799638), 'Min': np.float64(-1.3952091907646083), 'Mean': np.float64(0.3619021097640631), 'Std': np.float64(0.5481190241110361)}
2024-12-06 23:36:34,313 - INFO - Candidate Std Stats: {'Max': np.float64(1.4292165798249927), 'Min': np.float64(0.0), 'Mean': np.float64(0.5444029142516907), 'Std': np.float64(0.23916963943691757)}
[I 2024-12-06 23:36:34,325] Trial 90 finished with value: 0.9464285714285714 and parameters: {'x_0_0': 'bc', 'x_0_1': 'oo', 'x_1_0': 'bc', 'x_1_1': 'oo'}. Best is trial 76 with value: 0.5.
2024-12-06 23:36:34,333 - INFO - Candidate Mean Stats: {'Max': np.float64(2.3301976106542575), 'Min': np.float64(-1.1348682948039102), 'Mean': np.float64(0.35570162235262526), 'Std': np.float64(0.48272228934199574)}
2024-12-06 23:36:34,333 - INFO - Candidate Std Stats: {'Max': np.float64(1.4821416087023853), 'Min': np.float64(0.0), 'Mean': np.float64(0.6094357406947668), 'Std': np.float64(0.2643964161873501)}
[I 2024-12-06 23:36:34,347] Trial 90 finished with value: 0.9642857142857143 and parameters: {'x_0_0': 'ab', 'x_0_1': 'oo', 'x_1_0': 'oo', 'x_1_1': 'bc'}. Best is trial 50 with value: 0.6607142857142857.
2024-12-06 23:36:34,537 - INFO - Candidate Mean Stats: {'Max': np.float64(2.149147999437613), 'Min': np.float64(-1.3017823800334134), 'Mean': np.float64(0.3586253558433589), 'Std': np.float64(0.4941234173559361)}
2024-12-06 23:36:34,537 - INFO - Candidate Std Stats: {'Max': np.float64(1.9308727872214742), 'Min': np.float64(0.0), 'Mean': np.float64(0.5895833073499444), 'Std': np.float64(0.2731216970017475)}
[I 2024-12-06 23:36:34,550] Trial 90 finished with value: 1.0714285714285714 and parameters: {'x_0_0': 'ac', 'x_0_1': 'oo', 'x_1_0': 'bc', 'x_1_1': 'bc'}. Best is trial 23 with value: 0.5.
2024-12-06 23:36:34,608 - INFO - Candidate Mean Stats: {'Max': np.float64(2.0187089718876026), 'Min': np.float64(-1.068234001442112), 'Mean': np.float64(0.27452480360450543), 'Std': np.float64(0.4642716797291021)}
2024-12-06 23:36:34,608 - INFO - Candidate Std Stats: {'Max': np.float64(1.6534574421829622), 'Min': np.float64(0.0), 'Mean': np.float64(0.5821227599398483), 'Std': np.float64(0.24862670904397724)}
[I 2024-12-06 23:36:34,624] Trial 91 finished with value: 1.2142857142857144 and parameters: {'x_0_0': 'ab', 'x_0_1': 'oo', 'x_1_0': 'cd', 'x_1_1': 'ac'}. Best is trial 63 with value: 0.5.
2024-12-06 23:36:34,642 - INFO - Candidate Mean Stats: {'Max': np.float64(2.4732664582689567), 'Min': np.float64(-0.969076181091437), 'Mean': np.float64(0.3394468813400784), 'Std': np.float64(0.49472404106353596)}
2024-12-06 23:36:34,642 - INFO - Candidate Std Stats: {'Max': np.float64(1.579101831940078), 'Min': np.float64(0.0), 'Mean': np.float64(0.5570785560290689), 'Std': np.float64(0.24938653750538056)}
[I 2024-12-06 23:36:34,655] Trial 91 finished with value: 0.9464285714285714 and parameters: {'x_0_0': 'ac', 'x_0_1': 'oo', 'x_1_0': 'bd', 'x_1_1': 'oo'}. Best is trial 76 with value: 0.5.
2024-12-06 23:36:34,663 - INFO - Candidate Mean Stats: {'Max': np.float64(2.1864124938803497), 'Min': np.float64(-1.0079606580079712), 'Mean': np.float64(0.3244419739914003), 'Std': np.float64(0.4501341558600553)}
2024-12-06 23:36:34,664 - INFO - Candidate Std Stats: {'Max': np.float64(1.5099968013998823), 'Min': np.float64(0.0), 'Mean': np.float64(0.5374448208658619), 'Std': np.float64(0.24077510864377039)}
[I 2024-12-06 23:36:34,676] Trial 91 finished with value: 1.0714285714285714 and parameters: {'x_0_0': 'bc', 'x_0_1': 'oo', 'x_1_0': 'cd', 'x_1_1': 'bc'}. Best is trial 50 with value: 0.6607142857142857.
2024-12-06 23:36:34,868 - INFO - Candidate Mean Stats: {'Max': np.float64(2.214246911570746), 'Min': np.float64(-1.2363235904245802), 'Mean': np.float64(0.3378302976875794), 'Std': np.float64(0.4992074903481641)}
2024-12-06 23:36:34,868 - INFO - Candidate Std Stats: {'Max': np.float64(1.559103272458747), 'Min': np.float64(0.0), 'Mean': np.float64(0.5755009047511748), 'Std': np.float64(0.25365680521257583)}
[I 2024-12-06 23:36:34,882] Trial 91 finished with value: 1.5 and parameters: {'x_0_0': 'cd', 'x_0_1': 'oo', 'x_1_0': 'ab', 'x_1_1': 'bc'}. Best is trial 23 with value: 0.5.
2024-12-06 23:36:34,940 - INFO - Candidate Mean Stats: {'Max': np.float64(2.0084369288620025), 'Min': np.float64(-1.0062696366609651), 'Mean': np.float64(0.32433875936904666), 'Std': np.float64(0.4660558634056525)}
2024-12-06 23:36:34,941 - INFO - Candidate Std Stats: {'Max': np.float64(1.5828476294296743), 'Min': np.float64(0.0), 'Mean': np.float64(0.5415110039235551), 'Std': np.float64(0.25152905397596836)}
[I 2024-12-06 23:36:34,954] Trial 92 finished with value: 1.0714285714285714 and parameters: {'x_0_0': 'bd', 'x_0_1': 'oo', 'x_1_0': 'cd', 'x_1_1': 'bc'}. Best is trial 63 with value: 0.5.
2024-12-06 23:36:34,972 - INFO - Candidate Mean Stats: {'Max': np.float64(2.6920873316157015), 'Min': np.float64(-1.152204869574312), 'Mean': np.float64(0.3302350845735535), 'Std': np.float64(0.5447213761355889)}
2024-12-06 23:36:34,973 - INFO - Candidate Std Stats: {'Max': np.float64(1.4222787906864998), 'Min': np.float64(0.0), 'Mean': np.float64(0.5436245821338824), 'Std': np.float64(0.23604171965476)}
[I 2024-12-06 23:36:34,985] Trial 92 finished with value: 1.25 and parameters: {'x_0_0': 'cd', 'x_0_1': 'oo', 'x_1_0': 'oo', 'x_1_1': 'bc'}. Best is trial 76 with value: 0.5.
2024-12-06 23:36:34,995 - INFO - Candidate Mean Stats: {'Max': np.float64(2.6714727858129255), 'Min': np.float64(-0.7528554365638508), 'Mean': np.float64(0.35945917979992326), 'Std': np.float64(0.4600279263205612)}
2024-12-06 23:36:34,995 - INFO - Candidate Std Stats: {'Max': np.float64(1.3861706561933331), 'Min': np.float64(0.0), 'Mean': np.float64(0.5416900800380473), 'Std': np.float64(0.24043895475683075)}
[I 2024-12-06 23:36:35,008] Trial 92 finished with value: 0.9464285714285714 and parameters: {'x_0_0': 'bd', 'x_0_1': 'oo', 'x_1_0': 'cd', 'x_1_1': 'oo'}. Best is trial 50 with value: 0.6607142857142857.
2024-12-06 23:36:35,210 - INFO - Candidate Mean Stats: {'Max': np.float64(2.0), 'Min': np.float64(-0.8944817723126108), 'Mean': np.float64(0.3697132669815869), 'Std': np.float64(0.46630283379430376)}
2024-12-06 23:36:35,210 - INFO - Candidate Std Stats: {'Max': np.float64(1.528259872981657), 'Min': np.float64(0.0), 'Mean': np.float64(0.5487868386550595), 'Std': np.float64(0.25066954945675146)}
[I 2024-12-06 23:36:35,222] Trial 92 finished with value: 1.0714285714285714 and parameters: {'x_0_0': 'bd', 'x_0_1': 'oo', 'x_1_0': 'cd', 'x_1_1': 'bc'}. Best is trial 23 with value: 0.5.
2024-12-06 23:36:35,280 - INFO - Candidate Mean Stats: {'Max': np.float64(2.2073447231319494), 'Min': np.float64(-1.0326485296386942), 'Mean': np.float64(0.34673384737795726), 'Std': np.float64(0.5131983446861639)}
2024-12-06 23:36:35,280 - INFO - Candidate Std Stats: {'Max': np.float64(1.8136021282942623), 'Min': np.float64(0.0), 'Mean': np.float64(0.5812153877760015), 'Std': np.float64(0.26500993161685116)}
[I 2024-12-06 23:36:35,293] Trial 93 finished with value: 1.0714285714285714 and parameters: {'x_0_0': 'bd', 'x_0_1': 'oo', 'x_1_0': 'ad', 'x_1_1': 'bc'}. Best is trial 63 with value: 0.5.
2024-12-06 23:36:35,300 - INFO - Candidate Mean Stats: {'Max': np.float64(2.1070502106545934), 'Min': np.float64(-1.0809505704900644), 'Mean': np.float64(0.3112123111226189), 'Std': np.float64(0.4856602617661313)}
2024-12-06 23:36:35,300 - INFO - Candidate Std Stats: {'Max': np.float64(1.826426299878447), 'Min': np.float64(0.0), 'Mean': np.float64(0.6029800868702291), 'Std': np.float64(0.27341008107667786)}
[I 2024-12-06 23:36:35,312] Trial 93 finished with value: 1.0714285714285714 and parameters: {'x_0_0': 'ac', 'x_0_1': 'oo', 'x_1_0': 'ac', 'x_1_1': 'ab'}. Best is trial 76 with value: 0.5.
2024-12-06 23:36:35,323 - INFO - Candidate Mean Stats: {'Max': np.float64(2.3131113179370972), 'Min': np.float64(-1.2698191680907036), 'Mean': np.float64(0.3310045731360816), 'Std': np.float64(0.5147859600433883)}
2024-12-06 23:36:35,323 - INFO - Candidate Std Stats: {'Max': np.float64(1.565507042606833), 'Min': np.float64(0.0), 'Mean': np.float64(0.5774032951766267), 'Std': np.float64(0.24589560832568585)}
[I 2024-12-06 23:36:35,335] Trial 93 finished with value: 1.0714285714285714 and parameters: {'x_0_0': 'bc', 'x_0_1': 'oo', 'x_1_0': 'bd', 'x_1_1': 'bd'}. Best is trial 50 with value: 0.6607142857142857.
2024-12-06 23:36:35,539 - INFO - Candidate Mean Stats: {'Max': np.float64(2.0), 'Min': np.float64(-1.0460397465267328), 'Mean': np.float64(0.34813635697546447), 'Std': np.float64(0.4562670925734529)}
2024-12-06 23:36:35,539 - INFO - Candidate Std Stats: {'Max': np.float64(1.3641791168377413), 'Min': np.float64(0.0), 'Mean': np.float64(0.5349852135814598), 'Std': np.float64(0.2407988917160826)}
[I 2024-12-06 23:36:35,551] Trial 93 finished with value: 0.8214285714285714 and parameters: {'x_0_0': 'bd', 'x_0_1': 'oo', 'x_1_0': 'oo', 'x_1_1': 'ab'}. Best is trial 23 with value: 0.5.
2024-12-06 23:36:35,608 - INFO - Candidate Mean Stats: {'Max': np.float64(2.0152071450891267), 'Min': np.float64(-1.0664878220542682), 'Mean': np.float64(0.3225481368571953), 'Std': np.float64(0.4844055403730505)}
2024-12-06 23:36:35,609 - INFO - Candidate Std Stats: {'Max': np.float64(1.692424992611495), 'Min': np.float64(0.0), 'Mean': np.float64(0.5530827347359264), 'Std': np.float64(0.2514596571151647)}
[I 2024-12-06 23:36:35,621] Trial 94 finished with value: 1.2142857142857144 and parameters: {'x_0_0': 'ab', 'x_0_1': 'oo', 'x_1_0': 'ac', 'x_1_1': 'ac'}. Best is trial 63 with value: 0.5.
2024-12-06 23:36:35,627 - INFO - Candidate Mean Stats: {'Max': np.float64(2.3189228499981462), 'Min': np.float64(-1.3486543765588253), 'Mean': np.float64(0.22706213684371399), 'Std': np.float64(0.5730827050904344)}
2024-12-06 23:36:35,627 - INFO - Candidate Std Stats: {'Max': np.float64(1.8116916630593354), 'Min': np.float64(0.0), 'Mean': np.float64(0.6675057540991697), 'Std': np.float64(0.2957668947229403)}
[I 2024-12-06 23:36:35,640] Trial 94 finished with value: 0.8214285714285714 and parameters: {'x_0_0': 'bd', 'x_0_1': 'oo', 'x_1_0': 'oo', 'x_1_1': 'cd'}. Best is trial 76 with value: 0.5.
2024-12-06 23:36:35,651 - INFO - Candidate Mean Stats: {'Max': np.float64(2.293355543729267), 'Min': np.float64(-1.174750075326574), 'Mean': np.float64(0.3147774201820504), 'Std': np.float64(0.5173003930059914)}
2024-12-06 23:36:35,651 - INFO - Candidate Std Stats: {'Max': np.float64(1.8621975913780013), 'Min': np.float64(0.0), 'Mean': np.float64(0.6629238254102524), 'Std': np.float64(0.3104030298766361)}
[I 2024-12-06 23:36:35,664] Trial 94 finished with value: 0.7857142857142857 and parameters: {'x_0_0': 'bd', 'x_0_1': 'oo', 'x_1_0': 'bd', 'x_1_1': 'bd'}. Best is trial 50 with value: 0.6607142857142857.
2024-12-06 23:36:35,871 - INFO - Candidate Mean Stats: {'Max': np.float64(2.0), 'Min': np.float64(-0.9127705960666603), 'Mean': np.float64(0.35198031892821285), 'Std': np.float64(0.44770647062237906)}
2024-12-06 23:36:35,871 - INFO - Candidate Std Stats: {'Max': np.float64(1.721066120024405), 'Min': np.float64(0.0), 'Mean': np.float64(0.5564108598927169), 'Std': np.float64(0.2510737456547452)}
[I 2024-12-06 23:36:35,884] Trial 94 finished with value: 0.8214285714285714 and parameters: {'x_0_0': 'bd', 'x_0_1': 'oo', 'x_1_0': 'oo', 'x_1_1': 'cd'}. Best is trial 23 with value: 0.5.
2024-12-06 23:36:35,939 - INFO - Candidate Mean Stats: {'Max': np.float64(2.4714054050402323), 'Min': np.float64(-1.1782940193644404), 'Mean': np.float64(0.2658068713283821), 'Std': np.float64(0.49510557588337856)}
2024-12-06 23:36:35,939 - INFO - Candidate Std Stats: {'Max': np.float64(1.6324480838945914), 'Min': np.float64(0.0), 'Mean': np.float64(0.6169008929084757), 'Std': np.float64(0.267620471128346)}
[I 2024-12-06 23:36:35,952] Trial 95 finished with value: 0.7857142857142857 and parameters: {'x_0_0': 'bd', 'x_0_1': 'oo', 'x_1_0': 'bd', 'x_1_1': 'bc'}. Best is trial 63 with value: 0.5.
2024-12-06 23:36:35,955 - INFO - Candidate Mean Stats: {'Max': np.float64(2.3834732765244517), 'Min': np.float64(-1.242425306776974), 'Mean': np.float64(0.3018357141641752), 'Std': np.float64(0.5547465898561221)}
2024-12-06 23:36:35,955 - INFO - Candidate Std Stats: {'Max': np.float64(1.4998825034488352), 'Min': np.float64(0.0), 'Mean': np.float64(0.57144953121583), 'Std': np.float64(0.24547797968553423)}
[I 2024-12-06 23:36:35,968] Trial 95 finished with value: 1.0714285714285714 and parameters: {'x_0_0': 'bc', 'x_0_1': 'oo', 'x_1_0': 'ad', 'x_1_1': 'ab'}. Best is trial 76 with value: 0.5.
2024-12-06 23:36:35,978 - INFO - Candidate Mean Stats: {'Max': np.float64(2.377107791378622), 'Min': np.float64(-1.1905376289816951), 'Mean': np.float64(0.38205756155957316), 'Std': np.float64(0.4869270513915938)}
2024-12-06 23:36:35,978 - INFO - Candidate Std Stats: {'Max': np.float64(1.7281245741347842), 'Min': np.float64(0.0), 'Mean': np.float64(0.6238957991812287), 'Std': np.float64(0.2771414076472912)}
[I 2024-12-06 23:36:35,991] Trial 95 finished with value: 1.0714285714285714 and parameters: {'x_0_0': 'ac', 'x_0_1': 'oo', 'x_1_0': 'bd', 'x_1_1': 'bc'}. Best is trial 50 with value: 0.6607142857142857.
2024-12-06 23:36:36,198 - INFO - Candidate Mean Stats: {'Max': np.float64(2.2834056865044525), 'Min': np.float64(-0.8550186130293526), 'Mean': np.float64(0.3697665229213187), 'Std': np.float64(0.466883167564685)}
2024-12-06 23:36:36,198 - INFO - Candidate Std Stats: {'Max': np.float64(1.6772586205473587), 'Min': np.float64(0.0), 'Mean': np.float64(0.5253204058446281), 'Std': np.float64(0.2504368387342084)}
[I 2024-12-06 23:36:36,211] Trial 95 finished with value: 0.8392857142857143 and parameters: {'x_0_0': 'ab', 'x_0_1': 'oo', 'x_1_0': 'oo', 'x_1_1': 'oo'}. Best is trial 23 with value: 0.5.
2024-12-06 23:36:36,268 - INFO - Candidate Mean Stats: {'Max': np.float64(2.0), 'Min': np.float64(-0.8857356533039134), 'Mean': np.float64(0.3146709760836714), 'Std': np.float64(0.4303149251067234)}
2024-12-06 23:36:36,269 - INFO - Candidate Std Stats: {'Max': np.float64(1.6778492845091018), 'Min': np.float64(0.0), 'Mean': np.float64(0.5547040819050926), 'Std': np.float64(0.26033893879800857)}
2024-12-06 23:36:36,281 - INFO - Candidate Mean Stats: {'Max': np.float64(2.451118488719433), 'Min': np.float64(-0.9817228200135466), 'Mean': np.float64(0.379678452854929), 'Std': np.float64(0.47397343172177075)}
2024-12-06 23:36:36,282 - INFO - Candidate Std Stats: {'Max': np.float64(1.5723157809016486), 'Min': np.float64(0.0), 'Mean': np.float64(0.5296198156042664), 'Std': np.float64(0.25013669315366627)}
[I 2024-12-06 23:36:36,282] Trial 96 finished with value: 0.8214285714285714 and parameters: {'x_0_0': 'bd', 'x_0_1': 'oo', 'x_1_0': 'oo', 'x_1_1': 'ad'}. Best is trial 63 with value: 0.5.
[I 2024-12-06 23:36:36,294] Trial 96 finished with value: 1.375 and parameters: {'x_0_0': 'cd', 'x_0_1': 'oo', 'x_1_0': 'bd', 'x_1_1': 'oo'}. Best is trial 76 with value: 0.5.
2024-12-06 23:36:36,305 - INFO - Candidate Mean Stats: {'Max': np.float64(2.257089026756392), 'Min': np.float64(-0.9739015045133985), 'Mean': np.float64(0.36374975083062494), 'Std': np.float64(0.4530277479489738)}
2024-12-06 23:36:36,305 - INFO - Candidate Std Stats: {'Max': np.float64(1.736040342261136), 'Min': np.float64(0.0), 'Mean': np.float64(0.5486613485532263), 'Std': np.float64(0.2536400603438371)}
[I 2024-12-06 23:36:36,317] Trial 96 finished with value: 0.6607142857142857 and parameters: {'x_0_0': 'ad', 'x_0_1': 'oo', 'x_1_0': 'bc', 'x_1_1': 'oo'}. Best is trial 50 with value: 0.6607142857142857.
2024-12-06 23:36:36,532 - INFO - Candidate Mean Stats: {'Max': np.float64(2.288448228153499), 'Min': np.float64(-0.9691101740146886), 'Mean': np.float64(0.3847714004439447), 'Std': np.float64(0.4530000800246996)}
2024-12-06 23:36:36,532 - INFO - Candidate Std Stats: {'Max': np.float64(1.496677479137092), 'Min': np.float64(0.0), 'Mean': np.float64(0.5097198242687276), 'Std': np.float64(0.23757861530943522)}
[I 2024-12-06 23:36:36,545] Trial 96 finished with value: 0.8214285714285714 and parameters: {'x_0_0': 'bc', 'x_0_1': 'oo', 'x_1_0': 'oo', 'x_1_1': 'cd'}. Best is trial 23 with value: 0.5.
2024-12-06 23:36:36,599 - INFO - Candidate Mean Stats: {'Max': np.float64(2.2991909268451964), 'Min': np.float64(-1.3011477037736587), 'Mean': np.float64(0.26423158999286506), 'Std': np.float64(0.4827741798938443)}
2024-12-06 23:36:36,599 - INFO - Candidate Std Stats: {'Max': np.float64(1.9946775565501753), 'Min': np.float64(0.0), 'Mean': np.float64(0.6192456243755435), 'Std': np.float64(0.2846234065588004)}
2024-12-06 23:36:36,611 - INFO - Candidate Mean Stats: {'Max': np.float64(2.5848705041146167), 'Min': np.float64(-1.3185075393432109), 'Mean': np.float64(0.3465654706801649), 'Std': np.float64(0.5426166955185431)}
2024-12-06 23:36:36,611 - INFO - Candidate Std Stats: {'Max': np.float64(1.6297153531504964), 'Min': np.float64(0.0), 'Mean': np.float64(0.6358930442248446), 'Std': np.float64(0.28552958043189963)}
[I 2024-12-06 23:36:36,611] Trial 97 finished with value: 1.0714285714285714 and parameters: {'x_0_0': 'bd', 'x_0_1': 'oo', 'x_1_0': 'ac', 'x_1_1': 'bc'}. Best is trial 63 with value: 0.5.
[I 2024-12-06 23:36:36,623] Trial 97 finished with value: 0.9464285714285714 and parameters: {'x_0_0': 'ac', 'x_0_1': 'oo', 'x_1_0': 'ab', 'x_1_1': 'oo'}. Best is trial 76 with value: 0.5.
2024-12-06 23:36:36,634 - INFO - Candidate Mean Stats: {'Max': np.float64(2.4738193537880506), 'Min': np.float64(-0.9144673365536725), 'Mean': np.float64(0.33580809390563066), 'Std': np.float64(0.4553507590568641)}
2024-12-06 23:36:36,634 - INFO - Candidate Std Stats: {'Max': np.float64(1.446774254350577), 'Min': np.float64(0.0), 'Mean': np.float64(0.5170435520436403), 'Std': np.float64(0.22756453308011074)}
