[I 2024-12-07 00:00:00,065] Trial 52 finished with value: 1.6777777777777778 and parameters: {'x_0_0': 'ab', 'x_0_1': 'ab', 'x_0_2': 'ac', 'x_1_0': 'ab', 'x_1_1': 'ad', 'x_1_2': 'oo'}. Best is trial 49 with value: 0.7999999999999999.
2024-12-07 00:00:00,947 - INFO - Candidate Mean Stats: {'Max': np.float64(2.0), 'Min': np.float64(0.2911009504857316), 'Mean': np.float64(0.49509553506421805), 'Std': np.float64(0.0658304372705423)}
2024-12-07 00:00:00,947 - INFO - Candidate Std Stats: {'Max': np.float64(0.6513978084701861), 'Min': np.float64(0.0), 'Mean': np.float64(0.10959581406497926), 'Std': np.float64(0.04812319561097701)}
[I 2024-12-07 00:00:00,994] Trial 52 finished with value: 1.3777777777777778 and parameters: {'x_0_0': 'ab', 'x_0_1': 'bd', 'x_0_2': 'cd', 'x_1_0': 'oo', 'x_1_1': 'oo', 'x_1_2': 'oo'}. Best is trial 47 with value: 1.0666666666666667.
2024-12-07 00:00:08,311 - INFO - Candidate Mean Stats: {'Max': np.float64(2.0), 'Min': np.float64(0.27350814338970064), 'Mean': np.float64(0.48950892873247254), 'Std': np.float64(0.06120078523520946)}
2024-12-07 00:00:08,312 - INFO - Candidate Std Stats: {'Max': np.float64(0.74817835677001), 'Min': np.float64(0.0), 'Mean': np.float64(0.10259023737690287), 'Std': np.float64(0.04395129945959367)}
[I 2024-12-07 00:00:08,351] Trial 52 finished with value: 1.0 and parameters: {'x_0_0': 'bc', 'x_0_1': 'ad', 'x_0_2': 'bc', 'x_1_0': 'bc', 'x_1_1': 'bc', 'x_1_2': 'ac'}. Best is trial 32 with value: 0.9444444444444444.
2024-12-07 00:00:17,172 - INFO - Candidate Mean Stats: {'Max': np.float64(2.0), 'Min': np.float64(0.25428488321828746), 'Mean': np.float64(0.48716438463109596), 'Std': np.float64(0.0630150142606426)}
2024-12-07 00:00:17,173 - INFO - Candidate Std Stats: {'Max': np.float64(0.44597177409963645), 'Min': np.float64(0.0), 'Mean': np.float64(0.1068910176577525), 'Std': np.float64(0.04327101239650596)}
[I 2024-12-07 00:00:17,213] Trial 53 finished with value: 1.9 and parameters: {'x_0_0': 'oo', 'x_0_1': 'cd', 'x_0_2': 'bd', 'x_1_0': 'bd', 'x_1_1': 'cd', 'x_1_2': 'cd'}. Best is trial 22 with value: 1.1666666666666665.
2024-12-07 00:00:18,697 - INFO - Candidate Mean Stats: {'Max': np.float64(2.0), 'Min': np.float64(0.2756012958170491), 'Mean': np.float64(0.48959357526503405), 'Std': np.float64(0.0591972030498399)}
2024-12-07 00:00:18,698 - INFO - Candidate Std Stats: {'Max': np.float64(0.8144278702123869), 'Min': np.float64(0.0), 'Mean': np.float64(0.09234017177823367), 'Std': np.float64(0.04529767299201293)}
[I 2024-12-07 00:00:18,737] Trial 53 finished with value: 1.2777777777777777 and parameters: {'x_0_0': 'ab', 'x_0_1': 'oo', 'x_0_2': 'oo', 'x_1_0': 'cd', 'x_1_1': 'ab', 'x_1_2': 'ab'}. Best is trial 49 with value: 0.7999999999999999.
2024-12-07 00:00:19,558 - INFO - Candidate Mean Stats: {'Max': np.float64(2.0), 'Min': np.float64(0.30616539056256853), 'Mean': np.float64(0.4901503562733005), 'Std': np.float64(0.061206248110772084)}
2024-12-07 00:00:19,559 - INFO - Candidate Std Stats: {'Max': np.float64(0.47652545291672704), 'Min': np.float64(0.0), 'Mean': np.float64(0.09767022841594888), 'Std': np.float64(0.042408264761975824)}
[I 2024-12-07 00:00:19,599] Trial 53 finished with value: 1.4444444444444444 and parameters: {'x_0_0': 'ac', 'x_0_1': 'ad', 'x_0_2': 'ad', 'x_1_0': 'bc', 'x_1_1': 'ad', 'x_1_2': 'cd'}. Best is trial 47 with value: 1.0666666666666667.
2024-12-07 00:00:27,080 - INFO - Candidate Mean Stats: {'Max': np.float64(2.0), 'Min': np.float64(0.2556674149987043), 'Mean': np.float64(0.4993588728952888), 'Std': np.float64(0.06449588734284996)}
2024-12-07 00:00:27,081 - INFO - Candidate Std Stats: {'Max': np.float64(0.49981181482794684), 'Min': np.float64(0.0), 'Mean': np.float64(0.11046844282497725), 'Std': np.float64(0.04552159392236765)}
[I 2024-12-07 00:00:27,121] Trial 53 finished with value: 1.4444444444444444 and parameters: {'x_0_0': 'bd', 'x_0_1': 'ab', 'x_0_2': 'ac', 'x_1_0': 'bd', 'x_1_1': 'bd', 'x_1_2': 'cd'}. Best is trial 32 with value: 0.9444444444444444.
2024-12-07 00:00:36,339 - INFO - Candidate Mean Stats: {'Max': np.float64(2.0), 'Min': np.float64(0.26923388718185304), 'Mean': np.float64(0.489417535860793), 'Std': np.float64(0.06414093929533507)}
2024-12-07 00:00:36,340 - INFO - Candidate Std Stats: {'Max': np.float64(0.47035371262535447), 'Min': np.float64(0.0), 'Mean': np.float64(0.11018962362154179), 'Std': np.float64(0.0455564210026479)}
[I 2024-12-07 00:00:36,380] Trial 54 finished with value: 1.9 and parameters: {'x_0_0': 'oo', 'x_0_1': 'bd', 'x_0_2': 'ad', 'x_1_0': 'bd', 'x_1_1': 'ab', 'x_1_2': 'cd'}. Best is trial 22 with value: 1.1666666666666665.
2024-12-07 00:00:37,846 - INFO - Candidate Mean Stats: {'Max': np.float64(2.0), 'Min': np.float64(0.3027989320692156), 'Mean': np.float64(0.4911430545455005), 'Std': np.float64(0.055606970427510796)}
2024-12-07 00:00:37,847 - INFO - Candidate Std Stats: {'Max': np.float64(0.4587518924986194), 'Min': np.float64(0.0), 'Mean': np.float64(0.09838500993495401), 'Std': np.float64(0.040962412575133916)}
[I 2024-12-07 00:00:37,887] Trial 54 finished with value: 1.9 and parameters: {'x_0_0': 'cd', 'x_0_1': 'ac', 'x_0_2': 'ac', 'x_1_0': 'bc', 'x_1_1': 'bd', 'x_1_2': 'oo'}. Best is trial 49 with value: 0.7999999999999999.
2024-12-07 00:00:38,493 - INFO - Candidate Mean Stats: {'Max': np.float64(2.0), 'Min': np.float64(0.20181497778384147), 'Mean': np.float64(0.4864756426164763), 'Std': np.float64(0.05994661544974859)}
2024-12-07 00:00:38,494 - INFO - Candidate Std Stats: {'Max': np.float64(0.4317483540556805), 'Min': np.float64(0.0), 'Mean': np.float64(0.10373319714950752), 'Std': np.float64(0.042549509049626455)}
[I 2024-12-07 00:00:38,532] Trial 54 finished with value: 1.6666666666666665 and parameters: {'x_0_0': 'bc', 'x_0_1': 'bd', 'x_0_2': 'ac', 'x_1_0': 'bc', 'x_1_1': 'ab', 'x_1_2': 'bd'}. Best is trial 47 with value: 1.0666666666666667.
2024-12-07 00:00:46,001 - INFO - Candidate Mean Stats: {'Max': np.float64(2.0), 'Min': np.float64(0.24348337047621937), 'Mean': np.float64(0.4953927270554466), 'Std': np.float64(0.061061853539514085)}
2024-12-07 00:00:46,001 - INFO - Candidate Std Stats: {'Max': np.float64(0.6328186121503427), 'Min': np.float64(0.0), 'Mean': np.float64(0.10756742186504674), 'Std': np.float64(0.048832082899825095)}
[I 2024-12-07 00:00:46,041] Trial 54 finished with value: 1.9 and parameters: {'x_0_0': 'oo', 'x_0_1': 'ad', 'x_0_2': 'bd', 'x_1_0': 'cd', 'x_1_1': 'ac', 'x_1_2': 'ac'}. Best is trial 32 with value: 0.9444444444444444.
2024-12-07 00:00:55,410 - INFO - Candidate Mean Stats: {'Max': np.float64(2.0), 'Min': np.float64(0.27929289975086324), 'Mean': np.float64(0.48357160831865725), 'Std': np.float64(0.05841573510554964)}
2024-12-07 00:00:55,411 - INFO - Candidate Std Stats: {'Max': np.float64(1.2656263692126748), 'Min': np.float64(0.0), 'Mean': np.float64(0.10184786581972341), 'Std': np.float64(0.04937604386461837)}
[I 2024-12-07 00:00:55,451] Trial 55 finished with value: 1.9 and parameters: {'x_0_0': 'oo', 'x_0_1': 'bd', 'x_0_2': 'bd', 'x_1_0': 'ab', 'x_1_1': 'ad', 'x_1_2': 'ac'}. Best is trial 22 with value: 1.1666666666666665.
2024-12-07 00:00:56,884 - INFO - Candidate Mean Stats: {'Max': np.float64(2.0), 'Min': np.float64(0.24534342157110917), 'Mean': np.float64(0.4887535748350455), 'Std': np.float64(0.07045770909625575)}
2024-12-07 00:00:56,885 - INFO - Candidate Std Stats: {'Max': np.float64(1.698949687885465), 'Min': np.float64(0.0), 'Mean': np.float64(0.1130757894037067), 'Std': np.float64(0.059782075349959475)}
[I 2024-12-07 00:00:56,926] Trial 55 finished with value: 1.2666666666666666 and parameters: {'x_0_0': 'bc', 'x_0_1': 'oo', 'x_0_2': 'cd', 'x_1_0': 'ab', 'x_1_1': 'ad', 'x_1_2': 'ac'}. Best is trial 49 with value: 0.7999999999999999.
2024-12-07 00:00:57,615 - INFO - Candidate Mean Stats: {'Max': np.float64(2.0), 'Min': np.float64(0.2707117879034113), 'Mean': np.float64(0.49076960250942675), 'Std': np.float64(0.06125976274046613)}
2024-12-07 00:00:57,616 - INFO - Candidate Std Stats: {'Max': np.float64(0.8159826342657648), 'Min': np.float64(0.0), 'Mean': np.float64(0.102972689011439), 'Std': np.float64(0.045390806409342836)}
[I 2024-12-07 00:00:57,656] Trial 55 finished with value: 1.7777777777777777 and parameters: {'x_0_0': 'ab', 'x_0_1': 'ac', 'x_0_2': 'cd', 'x_1_0': 'bc', 'x_1_1': 'cd', 'x_1_2': 'ab'}. Best is trial 47 with value: 1.0666666666666667.
2024-12-07 00:01:05,269 - INFO - Candidate Mean Stats: {'Max': np.float64(2.0), 'Min': np.float64(0.2655164357740818), 'Mean': np.float64(0.4881772400899744), 'Std': np.float64(0.0736306393458935)}
2024-12-07 00:01:05,270 - INFO - Candidate Std Stats: {'Max': np.float64(1.3041110925525752), 'Min': np.float64(0.0), 'Mean': np.float64(0.11764655410046079), 'Std': np.float64(0.060595892005967184)}
[I 2024-12-07 00:01:05,309] Trial 55 finished with value: 1.4444444444444444 and parameters: {'x_0_0': 'bd', 'x_0_1': 'ac', 'x_0_2': 'cd', 'x_1_0': 'bd', 'x_1_1': 'ad', 'x_1_2': 'ab'}. Best is trial 32 with value: 0.9444444444444444.
2024-12-07 00:01:14,658 - INFO - Candidate Mean Stats: {'Max': np.float64(2.0), 'Min': np.float64(0.27560059887224525), 'Mean': np.float64(0.49409788231950585), 'Std': np.float64(0.05983013111780243)}
2024-12-07 00:01:14,659 - INFO - Candidate Std Stats: {'Max': np.float64(0.4458963019764815), 'Min': np.float64(0.0), 'Mean': np.float64(0.0993393168596044), 'Std': np.float64(0.04027851622154032)}
[I 2024-12-07 00:01:14,702] Trial 56 finished with value: 1.6 and parameters: {'x_0_0': 'oo', 'x_0_1': 'ac', 'x_0_2': 'oo', 'x_1_0': 'oo', 'x_1_1': 'cd', 'x_1_2': 'ac'}. Best is trial 22 with value: 1.1666666666666665.
2024-12-07 00:01:16,439 - INFO - Candidate Mean Stats: {'Max': np.float64(2.0), 'Min': np.float64(0.1851097046453571), 'Mean': np.float64(0.4881522541476535), 'Std': np.float64(0.06513283284679752)}
2024-12-07 00:01:16,440 - INFO - Candidate Std Stats: {'Max': np.float64(0.41851463452068405), 'Min': np.float64(0.0), 'Mean': np.float64(0.10517073374932), 'Std': np.float64(0.047263112422370156)}
[I 2024-12-07 00:01:16,482] Trial 56 finished with value: 1.6666666666666665 and parameters: {'x_0_0': 'ac', 'x_0_1': 'bc', 'x_0_2': 'ac', 'x_1_0': 'bc', 'x_1_1': 'ab', 'x_1_2': 'cd'}. Best is trial 49 with value: 0.7999999999999999.
2024-12-07 00:01:17,114 - INFO - Candidate Mean Stats: {'Max': np.float64(2.0), 'Min': np.float64(0.30501153042632995), 'Mean': np.float64(0.49658906885572623), 'Std': np.float64(0.05686470491615636)}
2024-12-07 00:01:17,115 - INFO - Candidate Std Stats: {'Max': np.float64(0.40032913507436413), 'Min': np.float64(0.0), 'Mean': np.float64(0.09551006360666715), 'Std': np.float64(0.038886721588318164)}
[I 2024-12-07 00:01:17,156] Trial 56 finished with value: 1.7777777777777777 and parameters: {'x_0_0': 'ab', 'x_0_1': 'bd', 'x_0_2': 'cd', 'x_1_0': 'ac', 'x_1_1': 'ac', 'x_1_2': 'ad'}. Best is trial 47 with value: 1.0666666666666667.
2024-12-07 00:01:24,913 - INFO - Candidate Mean Stats: {'Max': np.float64(2.0), 'Min': np.float64(0.2851418050550531), 'Mean': np.float64(0.4853640334523682), 'Std': np.float64(0.06766926060486347)}
2024-12-07 00:01:24,914 - INFO - Candidate Std Stats: {'Max': np.float64(0.9689238277014023), 'Min': np.float64(0.0), 'Mean': np.float64(0.11273119965526386), 'Std': np.float64(0.056957000057421284)}
[I 2024-12-07 00:01:24,956] Trial 56 finished with value: 1.6 and parameters: {'x_0_0': 'cd', 'x_0_1': 'ac', 'x_0_2': 'oo', 'x_1_0': 'oo', 'x_1_1': 'ad', 'x_1_2': 'oo'}. Best is trial 32 with value: 0.9444444444444444.
2024-12-07 00:01:34,438 - INFO - Candidate Mean Stats: {'Max': np.float64(2.0), 'Min': np.float64(0.23620815223216912), 'Mean': np.float64(0.4884387394864907), 'Std': np.float64(0.07219634401449336)}
2024-12-07 00:01:34,439 - INFO - Candidate Std Stats: {'Max': np.float64(1.2547486844403177), 'Min': np.float64(0.0), 'Mean': np.float64(0.12022348480605112), 'Std': np.float64(0.05632961574252844)}
[I 2024-12-07 00:01:34,479] Trial 57 finished with value: 2.0 and parameters: {'x_0_0': 'cd', 'x_0_1': 'ac', 'x_0_2': 'ab', 'x_1_0': 'ad', 'x_1_1': 'ab', 'x_1_2': 'ac'}. Best is trial 22 with value: 1.1666666666666665.
2024-12-07 00:01:36,022 - INFO - Candidate Mean Stats: {'Max': np.float64(2.0), 'Min': np.float64(0.2730816312620562), 'Mean': np.float64(0.4858659974091105), 'Std': np.float64(0.061564689621142754)}
2024-12-07 00:01:36,023 - INFO - Candidate Std Stats: {'Max': np.float64(0.6995834597328529), 'Min': np.float64(0.0), 'Mean': np.float64(0.10448447481988504), 'Std': np.float64(0.043965234750482834)}
[I 2024-12-07 00:01:36,065] Trial 57 finished with value: 1.1666666666666665 and parameters: {'x_0_0': 'ac', 'x_0_1': 'oo', 'x_0_2': 'ad', 'x_1_0': 'bd', 'x_1_1': 'ab', 'x_1_2': 'oo'}. Best is trial 49 with value: 0.7999999999999999.
2024-12-07 00:01:36,949 - INFO - Candidate Mean Stats: {'Max': np.float64(2.0), 'Min': np.float64(0.23118517966701368), 'Mean': np.float64(0.48123998438018234), 'Std': np.float64(0.060891561963299416)}
2024-12-07 00:01:36,950 - INFO - Candidate Std Stats: {'Max': np.float64(0.36430833472917173), 'Min': np.float64(0.0), 'Mean': np.float64(0.10784806208519146), 'Std': np.float64(0.04507285901939117)}
[I 2024-12-07 00:01:36,992] Trial 57 finished with value: 1.4444444444444444 and parameters: {'x_0_0': 'bd', 'x_0_1': 'bd', 'x_0_2': 'ab', 'x_1_0': 'bc', 'x_1_1': 'bc', 'x_1_2': 'ad'}. Best is trial 47 with value: 1.0666666666666667.
2024-12-07 00:01:44,914 - INFO - Candidate Mean Stats: {'Max': np.float64(2.0), 'Min': np.float64(0.3085952907808841), 'Mean': np.float64(0.4825498531872115), 'Std': np.float64(0.05958246817228989)}
2024-12-07 00:01:44,915 - INFO - Candidate Std Stats: {'Max': np.float64(1.6455221611961879), 'Min': np.float64(0.0), 'Mean': np.float64(0.10404430735400047), 'Std': np.float64(0.05008911636025767)}
[I 2024-12-07 00:01:44,956] Trial 57 finished with value: 1.2222222222222223 and parameters: {'x_0_0': 'ac', 'x_0_1': 'ac', 'x_0_2': 'ac', 'x_1_0': 'bd', 'x_1_1': 'bd', 'x_1_2': 'bc'}. Best is trial 32 with value: 0.9444444444444444.
2024-12-07 00:01:54,383 - INFO - Candidate Mean Stats: {'Max': np.float64(2.0), 'Min': np.float64(0.2385977860320462), 'Mean': np.float64(0.4816747779138264), 'Std': np.float64(0.07018578252493356)}
2024-12-07 00:01:54,383 - INFO - Candidate Std Stats: {'Max': np.float64(1.115555206691722), 'Min': np.float64(0.0), 'Mean': np.float64(0.11485697163743602), 'Std': np.float64(0.05313495298092116)}
[I 2024-12-07 00:01:54,426] Trial 58 finished with value: 1.6666666666666665 and parameters: {'x_0_0': 'ad', 'x_0_1': 'ad', 'x_0_2': 'ac', 'x_1_0': 'ac', 'x_1_1': 'ac', 'x_1_2': 'bc'}. Best is trial 22 with value: 1.1666666666666665.
2024-12-07 00:01:56,195 - INFO - Candidate Mean Stats: {'Max': np.float64(2.0), 'Min': np.float64(0.30050645031673207), 'Mean': np.float64(0.48906487025384454), 'Std': np.float64(0.06001781449068953)}
2024-12-07 00:01:56,196 - INFO - Candidate Std Stats: {'Max': np.float64(1.5915352422822575), 'Min': np.float64(0.0), 'Mean': np.float64(0.10034776590923151), 'Std': np.float64(0.048653117499089675)}
[I 2024-12-07 00:01:56,237] Trial 58 finished with value: 1.5777777777777777 and parameters: {'x_0_0': 'ab', 'x_0_1': 'cd', 'x_0_2': 'ab', 'x_1_0': 'oo', 'x_1_1': 'bc', 'x_1_2': 'ac'}. Best is trial 49 with value: 0.7999999999999999.
2024-12-07 00:01:57,062 - INFO - Candidate Mean Stats: {'Max': np.float64(2.0), 'Min': np.float64(0.2709655645025034), 'Mean': np.float64(0.4984508341238411), 'Std': np.float64(0.060940801929017865)}
2024-12-07 00:01:57,063 - INFO - Candidate Std Stats: {'Max': np.float64(0.5624941336498938), 'Min': np.float64(0.0), 'Mean': np.float64(0.1085875606061331), 'Std': np.float64(0.04837238530328056)}
[I 2024-12-07 00:01:57,103] Trial 58 finished with value: 1.5666666666666667 and parameters: {'x_0_0': 'bd', 'x_0_1': 'bd', 'x_0_2': 'ad', 'x_1_0': 'cd', 'x_1_1': 'oo', 'x_1_2': 'cd'}. Best is trial 47 with value: 1.0666666666666667.
2024-12-07 00:02:04,705 - INFO - Candidate Mean Stats: {'Max': np.float64(2.0), 'Min': np.float64(0.22974706116641735), 'Mean': np.float64(0.4873880160143182), 'Std': np.float64(0.0694878166996191)}
2024-12-07 00:02:04,706 - INFO - Candidate Std Stats: {'Max': np.float64(0.6221958562738009), 'Min': np.float64(0.0), 'Mean': np.float64(0.10769587417643875), 'Std': np.float64(0.04689183231037805)}
[I 2024-12-07 00:02:04,748] Trial 58 finished with value: 1.3666666666666667 and parameters: {'x_0_0': 'ac', 'x_0_1': 'bd', 'x_0_2': 'bc', 'x_1_0': 'oo', 'x_1_1': 'bd', 'x_1_2': 'oo'}. Best is trial 32 with value: 0.9444444444444444.
2024-12-07 00:02:13,940 - INFO - Candidate Mean Stats: {'Max': np.float64(2.0), 'Min': np.float64(0.2499786516209273), 'Mean': np.float64(0.49339045861990605), 'Std': np.float64(0.06537743999546598)}
2024-12-07 00:02:13,941 - INFO - Candidate Std Stats: {'Max': np.float64(1.0499469807604647), 'Min': np.float64(0.0), 'Mean': np.float64(0.10623855332726376), 'Std': np.float64(0.048468276381752114)}
[I 2024-12-07 00:02:13,981] Trial 59 finished with value: 1.5777777777777777 and parameters: {'x_0_0': 'ab', 'x_0_1': 'bd', 'x_0_2': 'ac', 'x_1_0': 'oo', 'x_1_1': 'bd', 'x_1_2': 'bd'}. Best is trial 22 with value: 1.1666666666666665.
2024-12-07 00:02:15,876 - INFO - Candidate Mean Stats: {'Max': np.float64(2.0), 'Min': np.float64(0.2933218709117723), 'Mean': np.float64(0.4932717495730016), 'Std': np.float64(0.057546770698415496)}
2024-12-07 00:02:15,877 - INFO - Candidate Std Stats: {'Max': np.float64(1.5722220490430616), 'Min': np.float64(0.0), 'Mean': np.float64(0.09990723428016056), 'Std': np.float64(0.04640634513261447)}
[I 2024-12-07 00:02:15,920] Trial 59 finished with value: 1.2222222222222223 and parameters: {'x_0_0': 'ad', 'x_0_1': 'ab', 'x_0_2': 'bc', 'x_1_0': 'bc', 'x_1_1': 'ad', 'x_1_2': 'bd'}. Best is trial 49 with value: 0.7999999999999999.
2024-12-07 00:02:16,706 - INFO - Candidate Mean Stats: {'Max': np.float64(2.0), 'Min': np.float64(0.29559096344260133), 'Mean': np.float64(0.49014345882174376), 'Std': np.float64(0.059362101621276975)}
2024-12-07 00:02:16,707 - INFO - Candidate Std Stats: {'Max': np.float64(1.3256945924871921), 'Min': np.float64(0.0), 'Mean': np.float64(0.10041597237666876), 'Std': np.float64(0.04812885823487595)}
[I 2024-12-07 00:02:16,745] Trial 59 finished with value: 1.5777777777777777 and parameters: {'x_0_0': 'ab', 'x_0_1': 'cd', 'x_0_2': 'ab', 'x_1_0': 'oo', 'x_1_1': 'bc', 'x_1_2': 'ac'}. Best is trial 47 with value: 1.0666666666666667.
2024-12-07 00:02:24,715 - INFO - Candidate Mean Stats: {'Max': np.float64(2.0), 'Min': np.float64(0.19941351874031807), 'Mean': np.float64(0.47639445339574665), 'Std': np.float64(0.06436898193771404)}
2024-12-07 00:02:24,716 - INFO - Candidate Std Stats: {'Max': np.float64(0.47158112734106306), 'Min': np.float64(0.0), 'Mean': np.float64(0.10844228457294644), 'Std': np.float64(0.04626629002468174)}
[I 2024-12-07 00:02:24,755] Trial 59 finished with value: 1.3333333333333333 and parameters: {'x_0_0': 'ac', 'x_0_1': 'ad', 'x_0_2': 'ac', 'x_1_0': 'ab', 'x_1_1': 'ab', 'x_1_2': 'bd'}. Best is trial 32 with value: 0.9444444444444444.
2024-12-07 00:02:33,716 - INFO - Candidate Mean Stats: {'Max': np.float64(2.0), 'Min': np.float64(0.20625090085820705), 'Mean': np.float64(0.47796601286442825), 'Std': np.float64(0.06600266258399776)}
2024-12-07 00:02:33,717 - INFO - Candidate Std Stats: {'Max': np.float64(0.6127645460984478), 'Min': np.float64(0.0), 'Mean': np.float64(0.10458789337994756), 'Std': np.float64(0.047604752575300543)}
[I 2024-12-07 00:02:33,759] Trial 60 finished with value: 1.8 and parameters: {'x_0_0': 'oo', 'x_0_1': 'ad', 'x_0_2': 'oo', 'x_1_0': 'ac', 'x_1_1': 'ac', 'x_1_2': 'ac'}. Best is trial 22 with value: 1.1666666666666665.
2024-12-07 00:02:35,821 - INFO - Candidate Mean Stats: {'Max': np.float64(2.0), 'Min': np.float64(0.23760769998036765), 'Mean': np.float64(0.494800083500893), 'Std': np.float64(0.061419424147783015)}
2024-12-07 00:02:35,822 - INFO - Candidate Std Stats: {'Max': np.float64(0.6334001136868536), 'Min': np.float64(0.0), 'Mean': np.float64(0.1049393778799234), 'Std': np.float64(0.04576864078954462)}
[I 2024-12-07 00:02:35,864] Trial 60 finished with value: 1.1 and parameters: {'x_0_0': 'oo', 'x_0_1': 'oo', 'x_0_2': 'oo', 'x_1_0': 'oo', 'x_1_1': 'cd', 'x_1_2': 'oo'}. Best is trial 49 with value: 0.7999999999999999.
2024-12-07 00:02:36,539 - INFO - Candidate Mean Stats: {'Max': np.float64(2.0), 'Min': np.float64(0.19078345603893127), 'Mean': np.float64(0.4856221251411128), 'Std': np.float64(0.06131054836053478)}
2024-12-07 00:02:36,540 - INFO - Candidate Std Stats: {'Max': np.float64(0.5133616662162951), 'Min': np.float64(0.0), 'Mean': np.float64(0.10867943276671449), 'Std': np.float64(0.04289496092803974)}
[I 2024-12-07 00:02:36,582] Trial 60 finished with value: 1.9 and parameters: {'x_0_0': 'cd', 'x_0_1': 'bc', 'x_0_2': 'bd', 'x_1_0': 'ad', 'x_1_1': 'oo', 'x_1_2': 'bd'}. Best is trial 47 with value: 1.0666666666666667.
2024-12-07 00:02:44,689 - INFO - Candidate Mean Stats: {'Max': np.float64(2.0), 'Min': np.float64(0.2783304793244686), 'Mean': np.float64(0.4859787871475505), 'Std': np.float64(0.06333791520092308)}
2024-12-07 00:02:44,690 - INFO - Candidate Std Stats: {'Max': np.float64(0.39644337325473294), 'Min': np.float64(0.0), 'Mean': np.float64(0.10452906163605338), 'Std': np.float64(0.041058893843126366)}
[I 2024-12-07 00:02:44,731] Trial 60 finished with value: 1.6777777777777778 and parameters: {'x_0_0': 'ab', 'x_0_1': 'bd', 'x_0_2': 'cd', 'x_1_0': 'bc', 'x_1_1': 'oo', 'x_1_2': 'ac'}. Best is trial 32 with value: 0.9444444444444444.
2024-12-07 00:03:20,125 - INFO - Candidate Mean Stats: {'Max': np.float64(2.0), 'Min': np.float64(0.2730363856472781), 'Mean': np.float64(0.48709991836569677), 'Std': np.float64(0.06574057940307532)}
2024-12-07 00:03:20,126 - INFO - Candidate Std Stats: {'Max': np.float64(0.4094293207462478), 'Min': np.float64(0.0), 'Mean': np.float64(0.10687823436745446), 'Std': np.float64(0.04280409471936523)}
