[I 2024-12-06 23:45:58,489] Trial 18 finished with value: 1.3666666666666667 and parameters: {'x_0_0': 'bd', 'x_0_1': 'bd', 'x_0_2': 'oo', 'x_1_0': 'oo', 'x_1_1': 'bd', 'x_1_2': 'cd'}. Best is trial 2 with value: 1.2222222222222223.
2024-12-06 23:46:00,088 - INFO - Candidate Mean Stats: {'Max': np.float64(1.9), 'Min': np.float64(0.2659176068164924), 'Mean': np.float64(0.48334672247024013), 'Std': np.float64(0.06169833700624774)}
2024-12-06 23:46:00,089 - INFO - Candidate Std Stats: {'Max': np.float64(0.9981383412268521), 'Min': np.float64(0.0), 'Mean': np.float64(0.1156711104973194), 'Std': np.float64(0.05268324753103949)}
[I 2024-12-06 23:46:00,132] Trial 18 finished with value: 1.8 and parameters: {'x_0_0': 'oo', 'x_0_1': 'ad', 'x_0_2': 'oo', 'x_1_0': 'bd', 'x_1_1': 'cd', 'x_1_2': 'ad'}. Best is trial 7 with value: 1.077777777777778.
2024-12-06 23:46:00,306 - INFO - Candidate Mean Stats: {'Max': np.float64(2.0), 'Min': np.float64(0.29342376841754125), 'Mean': np.float64(0.48926023708613187), 'Std': np.float64(0.058814528321551436)}
2024-12-06 23:46:00,307 - INFO - Candidate Std Stats: {'Max': np.float64(0.7363378058121021), 'Min': np.float64(0.0), 'Mean': np.float64(0.10483997848600976), 'Std': np.float64(0.04549075520819231)}
[I 2024-12-06 23:46:00,358] Trial 18 finished with value: 2.0 and parameters: {'x_0_0': 'cd', 'x_0_1': 'ab', 'x_0_2': 'ad', 'x_1_0': 'ad', 'x_1_1': 'cd', 'x_1_2': 'cd'}. Best is trial 2 with value: 0.9666666666666667.
2024-12-06 23:46:02,250 - INFO - Candidate Mean Stats: {'Max': np.float64(1.9), 'Min': np.float64(0.2449499135597745), 'Mean': np.float64(0.4908706182696704), 'Std': np.float64(0.06010008990046547)}
2024-12-06 23:46:02,251 - INFO - Candidate Std Stats: {'Max': np.float64(0.5266517953929336), 'Min': np.float64(0.0), 'Mean': np.float64(0.11160421564935569), 'Std': np.float64(0.04720294294341931)}
[I 2024-12-06 23:46:02,303] Trial 18 finished with value: 1.1222222222222222 and parameters: {'x_0_0': 'bc', 'x_0_1': 'ac', 'x_0_2': 'ac', 'x_1_0': 'ac', 'x_1_1': 'oo', 'x_1_2': 'ad'}. Best is trial 13 with value: 1.1222222222222222.
2024-12-06 23:46:18,501 - INFO - Candidate Mean Stats: {'Max': np.float64(1.9), 'Min': np.float64(0.2432970589389763), 'Mean': np.float64(0.48760348151473565), 'Std': np.float64(0.06027501706495257)}
2024-12-06 23:46:18,502 - INFO - Candidate Std Stats: {'Max': np.float64(1.3462454476537593), 'Min': np.float64(0.0), 'Mean': np.float64(0.1035284864642233), 'Std': np.float64(0.0479561235218219)}
[I 2024-12-06 23:46:18,544] Trial 19 finished with value: 2.0 and parameters: {'x_0_0': 'cd', 'x_0_1': 'ac', 'x_0_2': 'ad', 'x_1_0': 'ad', 'x_1_1': 'bc', 'x_1_2': 'bd'}. Best is trial 2 with value: 1.2222222222222223.
2024-12-06 23:46:20,182 - INFO - Candidate Mean Stats: {'Max': np.float64(1.9), 'Min': np.float64(0.2237393591637667), 'Mean': np.float64(0.4885068422113022), 'Std': np.float64(0.06122832978497989)}
2024-12-06 23:46:20,182 - INFO - Candidate Std Stats: {'Max': np.float64(0.43583694670423645), 'Min': np.float64(0.0), 'Mean': np.float64(0.10421531710540363), 'Std': np.float64(0.04097889195151382)}
[I 2024-12-06 23:46:20,227] Trial 19 finished with value: 1.5555555555555556 and parameters: {'x_0_0': 'ad', 'x_0_1': 'ab', 'x_0_2': 'ac', 'x_1_0': 'ab', 'x_1_1': 'ac', 'x_1_2': 'ac'}. Best is trial 7 with value: 1.077777777777778.
2024-12-06 23:46:20,484 - INFO - Candidate Mean Stats: {'Max': np.float64(2.0), 'Min': np.float64(0.25381903617895707), 'Mean': np.float64(0.4878832326439526), 'Std': np.float64(0.06496675496930808)}
2024-12-06 23:46:20,484 - INFO - Candidate Std Stats: {'Max': np.float64(1.2076722797084496), 'Min': np.float64(0.0), 'Mean': np.float64(0.10588213804065168), 'Std': np.float64(0.05184165144436353)}
[I 2024-12-06 23:46:20,526] Trial 19 finished with value: 1.5555555555555556 and parameters: {'x_0_0': 'bc', 'x_0_1': 'ab', 'x_0_2': 'cd', 'x_1_0': 'ab', 'x_1_1': 'cd', 'x_1_2': 'ab'}. Best is trial 2 with value: 0.9666666666666667.
2024-12-06 23:46:22,416 - INFO - Candidate Mean Stats: {'Max': np.float64(1.9), 'Min': np.float64(0.18683901132972358), 'Mean': np.float64(0.4926880914188027), 'Std': np.float64(0.06426121991247884)}
2024-12-06 23:46:22,417 - INFO - Candidate Std Stats: {'Max': np.float64(0.5541952712201784), 'Min': np.float64(0.0), 'Mean': np.float64(0.11079911908328513), 'Std': np.float64(0.04701041127654763)}
[I 2024-12-06 23:46:22,459] Trial 19 finished with value: 1.9 and parameters: {'x_0_0': 'oo', 'x_0_1': 'ad', 'x_0_2': 'bd', 'x_1_0': 'cd', 'x_1_1': 'ab', 'x_1_2': 'ad'}. Best is trial 13 with value: 1.1222222222222222.
2024-12-06 23:46:38,934 - INFO - Candidate Mean Stats: {'Max': np.float64(2.0), 'Min': np.float64(0.2174351288236843), 'Mean': np.float64(0.4845895922541636), 'Std': np.float64(0.0684488778494499)}
2024-12-06 23:46:38,935 - INFO - Candidate Std Stats: {'Max': np.float64(1.5814024796953434), 'Min': np.float64(0.0), 'Mean': np.float64(0.1211112391705027), 'Std': np.float64(0.0579558949062857)}
[I 2024-12-06 23:46:38,995] Trial 20 finished with value: 1.4444444444444444 and parameters: {'x_0_0': 'ac', 'x_0_1': 'ad', 'x_0_2': 'cd', 'x_1_0': 'ac', 'x_1_1': 'cd', 'x_1_2': 'ad'}. Best is trial 2 with value: 1.2222222222222223.
2024-12-06 23:46:41,146 - INFO - Candidate Mean Stats: {'Max': np.float64(1.9), 'Min': np.float64(0.21985776087931744), 'Mean': np.float64(0.49506207660388485), 'Std': np.float64(0.06461017516986188)}
2024-12-06 23:46:41,147 - INFO - Candidate Std Stats: {'Max': np.float64(1.6914439719969945), 'Min': np.float64(0.0), 'Mean': np.float64(0.10995519042746145), 'Std': np.float64(0.05553637524823251)}
[I 2024-12-06 23:46:41,199] Trial 20 finished with value: 1.5555555555555556 and parameters: {'x_0_0': 'ac', 'x_0_1': 'ab', 'x_0_2': 'bd', 'x_1_0': 'cd', 'x_1_1': 'ad', 'x_1_2': 'bd'}. Best is trial 7 with value: 1.077777777777778.
2024-12-06 23:46:41,376 - INFO - Candidate Mean Stats: {'Max': np.float64(2.0), 'Min': np.float64(0.2879066768214015), 'Mean': np.float64(0.48673849927452234), 'Std': np.float64(0.05666343613882717)}
2024-12-06 23:46:41,376 - INFO - Candidate Std Stats: {'Max': np.float64(0.3741116351958649), 'Min': np.float64(0.0), 'Mean': np.float64(0.10293896249315451), 'Std': np.float64(0.04128965423898232)}
[I 2024-12-06 23:46:41,418] Trial 20 finished with value: 1.6666666666666665 and parameters: {'x_0_0': 'ac', 'x_0_1': 'cd', 'x_0_2': 'bd', 'x_1_0': 'cd', 'x_1_1': 'ad', 'x_1_2': 'ab'}. Best is trial 2 with value: 0.9666666666666667.
2024-12-06 23:46:43,647 - INFO - Candidate Mean Stats: {'Max': np.float64(1.9), 'Min': np.float64(0.2825730205417817), 'Mean': np.float64(0.491890088067126), 'Std': np.float64(0.06298233193088901)}
2024-12-06 23:46:43,648 - INFO - Candidate Std Stats: {'Max': np.float64(1.3079018315473303), 'Min': np.float64(0.0), 'Mean': np.float64(0.11490318083435644), 'Std': np.float64(0.05327992433089135)}
[I 2024-12-06 23:46:43,690] Trial 20 finished with value: 1.7777777777777777 and parameters: {'x_0_0': 'ab', 'x_0_1': 'bc', 'x_0_2': 'cd', 'x_1_0': 'bc', 'x_1_1': 'ad', 'x_1_2': 'ab'}. Best is trial 13 with value: 1.1222222222222222.
2024-12-06 23:47:01,970 - INFO - Candidate Mean Stats: {'Max': np.float64(2.0), 'Min': np.float64(0.29138384738188694), 'Mean': np.float64(0.48715915835569146), 'Std': np.float64(0.0562222791315971)}
2024-12-06 23:47:01,971 - INFO - Candidate Std Stats: {'Max': np.float64(0.9972156071288961), 'Min': np.float64(0.0), 'Mean': np.float64(0.09694484332517657), 'Std': np.float64(0.04261733922355659)}
[I 2024-12-06 23:47:02,019] Trial 21 finished with value: 1.9 and parameters: {'x_0_0': 'oo', 'x_0_1': 'ac', 'x_0_2': 'bd', 'x_1_0': 'ac', 'x_1_1': 'ad', 'x_1_2': 'ab'}. Best is trial 2 with value: 1.2222222222222223.
2024-12-06 23:47:04,020 - INFO - Candidate Mean Stats: {'Max': np.float64(1.9), 'Min': np.float64(0.16560953399368583), 'Mean': np.float64(0.4929384997575625), 'Std': np.float64(0.06442608629797278)}
2024-12-06 23:47:04,020 - INFO - Candidate Std Stats: {'Max': np.float64(1.8070056285447353), 'Min': np.float64(0.0), 'Mean': np.float64(0.10849536655005988), 'Std': np.float64(0.06077144501400144)}
[I 2024-12-06 23:47:04,069] Trial 21 finished with value: 2.0 and parameters: {'x_0_0': 'cd', 'x_0_1': 'ab', 'x_0_2': 'ac', 'x_1_0': 'ad', 'x_1_1': 'ac', 'x_1_2': 'ab'}. Best is trial 7 with value: 1.077777777777778.
2024-12-06 23:47:04,395 - INFO - Candidate Mean Stats: {'Max': np.float64(2.0), 'Min': np.float64(0.20253534227543318), 'Mean': np.float64(0.48994508500403827), 'Std': np.float64(0.06354524546219403)}
2024-12-06 23:47:04,396 - INFO - Candidate Std Stats: {'Max': np.float64(0.7115651600937531), 'Min': np.float64(0.0), 'Mean': np.float64(0.10408347163876282), 'Std': np.float64(0.04999613437751547)}
[I 2024-12-06 23:47:04,492] Trial 21 finished with value: 1.7 and parameters: {'x_0_0': 'cd', 'x_0_1': 'bc', 'x_0_2': 'oo', 'x_1_0': 'bc', 'x_1_1': 'oo', 'x_1_2': 'oo'}. Best is trial 2 with value: 0.9666666666666667.
2024-12-06 23:47:06,776 - INFO - Candidate Mean Stats: {'Max': np.float64(1.9), 'Min': np.float64(0.23820401475032052), 'Mean': np.float64(0.4924989359706508), 'Std': np.float64(0.06015162489957582)}
2024-12-06 23:47:06,777 - INFO - Candidate Std Stats: {'Max': np.float64(0.4543859533919091), 'Min': np.float64(0.0), 'Mean': np.float64(0.10297559200176794), 'Std': np.float64(0.042081060529706255)}
[I 2024-12-06 23:47:06,832] Trial 21 finished with value: 1.4555555555555555 and parameters: {'x_0_0': 'ad', 'x_0_1': 'ac', 'x_0_2': 'oo', 'x_1_0': 'ab', 'x_1_1': 'ab', 'x_1_2': 'ad'}. Best is trial 13 with value: 1.1222222222222222.
2024-12-06 23:47:25,464 - INFO - Candidate Mean Stats: {'Max': np.float64(2.0), 'Min': np.float64(0.1641779667933243), 'Mean': np.float64(0.4811784021063914), 'Std': np.float64(0.06438381642274264)}
2024-12-06 23:47:25,465 - INFO - Candidate Std Stats: {'Max': np.float64(1.7054011425789353), 'Min': np.float64(0.0), 'Mean': np.float64(0.10937286803867596), 'Std': np.float64(0.05852865572249155)}
[I 2024-12-06 23:47:25,521] Trial 22 finished with value: 1.1666666666666665 and parameters: {'x_0_0': 'bc', 'x_0_1': 'oo', 'x_0_2': 'oo', 'x_1_0': 'ad', 'x_1_1': 'cd', 'x_1_2': 'bc'}. Best is trial 22 with value: 1.1666666666666665.
2024-12-06 23:47:27,364 - INFO - Candidate Mean Stats: {'Max': np.float64(2.0), 'Min': np.float64(0.3074910180167654), 'Mean': np.float64(0.493236784222621), 'Std': np.float64(0.05730629895653334)}
2024-12-06 23:47:27,365 - INFO - Candidate Std Stats: {'Max': np.float64(0.36927129820507554), 'Min': np.float64(0.0), 'Mean': np.float64(0.099762438520133), 'Std': np.float64(0.03944648070452632)}
[I 2024-12-06 23:47:27,414] Trial 22 finished with value: 2.0 and parameters: {'x_0_0': 'cd', 'x_0_1': 'ab', 'x_0_2': 'ac', 'x_1_0': 'bd', 'x_1_1': 'ad', 'x_1_2': 'ab'}. Best is trial 7 with value: 1.077777777777778.
2024-12-06 23:47:27,598 - INFO - Candidate Mean Stats: {'Max': np.float64(2.0), 'Min': np.float64(0.22129564208978697), 'Mean': np.float64(0.4877847593177415), 'Std': np.float64(0.06170315618300879)}
2024-12-06 23:47:27,598 - INFO - Candidate Std Stats: {'Max': np.float64(1.5284848938132225), 'Min': np.float64(0.0), 'Mean': np.float64(0.11104168563686673), 'Std': np.float64(0.0538784503020263)}
[I 2024-12-06 23:47:27,695] Trial 22 finished with value: 1.5555555555555556 and parameters: {'x_0_0': 'ac', 'x_0_1': 'ab', 'x_0_2': 'bc', 'x_1_0': 'ac', 'x_1_1': 'bc', 'x_1_2': 'bc'}. Best is trial 2 with value: 0.9666666666666667.
2024-12-06 23:47:31,674 - INFO - Candidate Mean Stats: {'Max': np.float64(1.9), 'Min': np.float64(0.326415538305309), 'Mean': np.float64(0.5000375909300863), 'Std': np.float64(0.05334536455168943)}
2024-12-06 23:47:31,676 - INFO - Candidate Std Stats: {'Max': np.float64(0.4503535066668877), 'Min': np.float64(0.0), 'Mean': np.float64(0.0986197226840021), 'Std': np.float64(0.040944277307917665)}
[I 2024-12-06 23:47:31,743] Trial 22 finished with value: 1.6777777777777778 and parameters: {'x_0_0': 'ab', 'x_0_1': 'ab', 'x_0_2': 'cd', 'x_1_0': 'ac', 'x_1_1': 'oo', 'x_1_2': 'ac'}. Best is trial 13 with value: 1.1222222222222222.
2024-12-06 23:47:48,439 - INFO - Candidate Mean Stats: {'Max': np.float64(2.0), 'Min': np.float64(0.2503278808070295), 'Mean': np.float64(0.4964515086028274), 'Std': np.float64(0.06784774698329052)}
2024-12-06 23:47:48,440 - INFO - Candidate Std Stats: {'Max': np.float64(0.4580825489784788), 'Min': np.float64(0.0), 'Mean': np.float64(0.10728358529955165), 'Std': np.float64(0.04491788511902261)}
[I 2024-12-06 23:47:48,493] Trial 23 finished with value: 1.4 and parameters: {'x_0_0': 'cd', 'x_0_1': 'oo', 'x_0_2': 'cd', 'x_1_0': 'oo', 'x_1_1': 'bd', 'x_1_2': 'bd'}. Best is trial 22 with value: 1.1666666666666665.
2024-12-06 23:47:50,595 - INFO - Candidate Mean Stats: {'Max': np.float64(2.0), 'Min': np.float64(0.24810016311315639), 'Mean': np.float64(0.4882777750389995), 'Std': np.float64(0.060925192789988446)}
2024-12-06 23:47:50,596 - INFO - Candidate Std Stats: {'Max': np.float64(0.3588580588369962), 'Min': np.float64(0.0), 'Mean': np.float64(0.10654215760984154), 'Std': np.float64(0.043603224914729496)}
[I 2024-12-06 23:47:50,655] Trial 23 finished with value: 1.2666666666666666 and parameters: {'x_0_0': 'bd', 'x_0_1': 'oo', 'x_0_2': 'bd', 'x_1_0': 'ac', 'x_1_1': 'ad', 'x_1_2': 'ad'}. Best is trial 7 with value: 1.077777777777778.
2024-12-06 23:47:50,874 - INFO - Candidate Mean Stats: {'Max': np.float64(2.0), 'Min': np.float64(0.28791006194717494), 'Mean': np.float64(0.47826172447221826), 'Std': np.float64(0.06043744064451397)}
2024-12-06 23:47:50,875 - INFO - Candidate Std Stats: {'Max': np.float64(0.6121170266829344), 'Min': np.float64(0.0), 'Mean': np.float64(0.10038016334539937), 'Std': np.float64(0.04453608286542002)}
[I 2024-12-06 23:47:50,926] Trial 23 finished with value: 1.2666666666666666 and parameters: {'x_0_0': 'bd', 'x_0_1': 'oo', 'x_0_2': 'ac', 'x_1_0': 'ac', 'x_1_1': 'bd', 'x_1_2': 'ac'}. Best is trial 2 with value: 0.9666666666666667.
2024-12-06 23:47:53,811 - INFO - Candidate Mean Stats: {'Max': np.float64(1.9), 'Min': np.float64(0.16579677977218205), 'Mean': np.float64(0.48300429723767996), 'Std': np.float64(0.06113273291032191)}
2024-12-06 23:47:53,812 - INFO - Candidate Std Stats: {'Max': np.float64(0.42094352934332013), 'Min': np.float64(0.0), 'Mean': np.float64(0.1008033416788753), 'Std': np.float64(0.04161482447269518)}
[I 2024-12-06 23:47:53,865] Trial 23 finished with value: 1.7777777777777777 and parameters: {'x_0_0': 'ab', 'x_0_1': 'bc', 'x_0_2': 'ab', 'x_1_0': 'ac', 'x_1_1': 'ad', 'x_1_2': 'bc'}. Best is trial 13 with value: 1.1222222222222222.
2024-12-06 23:48:11,369 - INFO - Candidate Mean Stats: {'Max': np.float64(2.0), 'Min': np.float64(0.27223513209300093), 'Mean': np.float64(0.48431387676335497), 'Std': np.float64(0.06527133333853792)}
2024-12-06 23:48:11,371 - INFO - Candidate Std Stats: {'Max': np.float64(1.031649684533497), 'Min': np.float64(0.0), 'Mean': np.float64(0.10956325706309099), 'Std': np.float64(0.05180032469876713)}
[I 2024-12-06 23:48:11,424] Trial 24 finished with value: 1.6 and parameters: {'x_0_0': 'oo', 'x_0_1': 'bd', 'x_0_2': 'ac', 'x_1_0': 'oo', 'x_1_1': 'oo', 'x_1_2': 'cd'}. Best is trial 22 with value: 1.1666666666666665.
2024-12-06 23:48:14,550 - INFO - Candidate Mean Stats: {'Max': np.float64(2.0), 'Min': np.float64(0.26670445152902456), 'Mean': np.float64(0.4789440090955603), 'Std': np.float64(0.05254230045721423)}
2024-12-06 23:48:14,551 - INFO - Candidate Std Stats: {'Max': np.float64(0.6234525116774512), 'Min': np.float64(0.0), 'Mean': np.float64(0.09517395945715405), 'Std': np.float64(0.03852384725980318)}
[I 2024-12-06 23:48:14,626] Trial 24 finished with value: 1.4555555555555557 and parameters: {'x_0_0': 'ad', 'x_0_1': 'cd', 'x_0_2': 'ab', 'x_1_0': 'ab', 'x_1_1': 'oo', 'x_1_2': 'bc'}. Best is trial 7 with value: 1.077777777777778.
2024-12-06 23:48:14,843 - INFO - Candidate Mean Stats: {'Max': np.float64(2.0), 'Min': np.float64(0.2205447238721284), 'Mean': np.float64(0.4877946801423617), 'Std': np.float64(0.056908181760546045)}
2024-12-06 23:48:14,844 - INFO - Candidate Std Stats: {'Max': np.float64(0.4134625626087054), 'Min': np.float64(0.0), 'Mean': np.float64(0.10446872158797711), 'Std': np.float64(0.04394829611904787)}
[I 2024-12-06 23:48:14,971] Trial 24 finished with value: 1.6 and parameters: {'x_0_0': 'cd', 'x_0_1': 'oo', 'x_0_2': 'ad', 'x_1_0': 'ab', 'x_1_1': 'ab', 'x_1_2': 'ac'}. Best is trial 2 with value: 0.9666666666666667.
2024-12-06 23:48:18,371 - INFO - Candidate Mean Stats: {'Max': np.float64(1.9), 'Min': np.float64(0.28470929414501345), 'Mean': np.float64(0.4890842520287315), 'Std': np.float64(0.05964130812184372)}
2024-12-06 23:48:18,372 - INFO - Candidate Std Stats: {'Max': np.float64(1.1175496836898566), 'Min': np.float64(0.0), 'Mean': np.float64(0.10693700411267584), 'Std': np.float64(0.05567881439123054)}
[I 2024-12-06 23:48:18,437] Trial 24 finished with value: 1.6666666666666665 and parameters: {'x_0_0': 'ad', 'x_0_1': 'bc', 'x_0_2': 'bc', 'x_1_0': 'ad', 'x_1_1': 'ac', 'x_1_2': 'bc'}. Best is trial 13 with value: 1.1222222222222222.
2024-12-06 23:48:37,082 - INFO - Candidate Mean Stats: {'Max': np.float64(2.0), 'Min': np.float64(0.25115028998552913), 'Mean': np.float64(0.48709633822048193), 'Std': np.float64(0.06076013067949966)}
2024-12-06 23:48:37,083 - INFO - Candidate Std Stats: {'Max': np.float64(0.5111633004755202), 'Min': np.float64(0.0), 'Mean': np.float64(0.10871474065479089), 'Std': np.float64(0.04273682592441108)}
[I 2024-12-06 23:48:37,155] Trial 25 finished with value: 1.6777777777777778 and parameters: {'x_0_0': 'ab', 'x_0_1': 'bd', 'x_0_2': 'bc', 'x_1_0': 'ac', 'x_1_1': 'oo', 'x_1_2': 'ab'}. Best is trial 22 with value: 1.1666666666666665.
2024-12-06 23:48:39,402 - INFO - Candidate Mean Stats: {'Max': np.float64(2.0), 'Min': np.float64(0.267417951785628), 'Mean': np.float64(0.4886279731608084), 'Std': np.float64(0.05453448383488972)}
2024-12-06 23:48:39,403 - INFO - Candidate Std Stats: {'Max': np.float64(0.43632560468933884), 'Min': np.float64(0.0), 'Mean': np.float64(0.10642951433629853), 'Std': np.float64(0.04231405313766118)}
[I 2024-12-06 23:48:39,455] Trial 25 finished with value: 2.0 and parameters: {'x_0_0': 'cd', 'x_0_1': 'ad', 'x_0_2': 'cd', 'x_1_0': 'bc', 'x_1_1': 'bc', 'x_1_2': 'bd'}. Best is trial 7 with value: 1.077777777777778.
2024-12-06 23:48:39,514 - INFO - Candidate Mean Stats: {'Max': np.float64(2.0), 'Min': np.float64(0.16540171784186586), 'Mean': np.float64(0.48657361601884874), 'Std': np.float64(0.06177694364172498)}
2024-12-06 23:48:39,514 - INFO - Candidate Std Stats: {'Max': np.float64(0.5947550336084207), 'Min': np.float64(0.0), 'Mean': np.float64(0.10640587233125519), 'Std': np.float64(0.04673807850709286)}
[I 2024-12-06 23:48:39,566] Trial 25 finished with value: 1.5777777777777777 and parameters: {'x_0_0': 'ab', 'x_0_1': 'bd', 'x_0_2': 'ad', 'x_1_0': 'oo', 'x_1_1': 'cd', 'x_1_2': 'ad'}. Best is trial 2 with value: 0.9666666666666667.
2024-12-06 23:48:42,993 - INFO - Candidate Mean Stats: {'Max': np.float64(1.9), 'Min': np.float64(0.300271788092778), 'Mean': np.float64(0.4843324365152416), 'Std': np.float64(0.05756556990395772)}
2024-12-06 23:48:42,995 - INFO - Candidate Std Stats: {'Max': np.float64(1.4491955124317515), 'Min': np.float64(0.0), 'Mean': np.float64(0.10069604517155277), 'Std': np.float64(0.049290685624951126)}
[I 2024-12-06 23:48:43,048] Trial 25 finished with value: 1.2444444444444445 and parameters: {'x_0_0': 'ac', 'x_0_1': 'ac', 'x_0_2': 'bd', 'x_1_0': 'oo', 'x_1_1': 'bd', 'x_1_2': 'ad'}. Best is trial 13 with value: 1.1222222222222222.
2024-12-06 23:48:59,657 - INFO - Candidate Mean Stats: {'Max': np.float64(2.0), 'Min': np.float64(0.29431615063672195), 'Mean': np.float64(0.4907603351499355), 'Std': np.float64(0.05755786768561187)}
2024-12-06 23:48:59,659 - INFO - Candidate Std Stats: {'Max': np.float64(0.7883222096832221), 'Min': np.float64(0.0), 'Mean': np.float64(0.10353805957094024), 'Std': np.float64(0.04675073354311689)}
[I 2024-12-06 23:48:59,712] Trial 26 finished with value: 1.6666666666666665 and parameters: {'x_0_0': 'ad', 'x_0_1': 'ac', 'x_0_2': 'cd', 'x_1_0': 'ad', 'x_1_1': 'ab', 'x_1_2': 'bc'}. Best is trial 22 with value: 1.1666666666666665.
2024-12-06 23:49:01,145 - INFO - Candidate Mean Stats: {'Max': np.float64(2.0), 'Min': np.float64(0.25113882725990194), 'Mean': np.float64(0.4852063823542107), 'Std': np.float64(0.0711090223158821)}
2024-12-06 23:49:01,145 - INFO - Candidate Std Stats: {'Max': np.float64(1.411370538448211), 'Min': np.float64(0.0), 'Mean': np.float64(0.11874559375129407), 'Std': np.float64(0.058484279122656926)}
[I 2024-12-06 23:49:01,192] Trial 26 finished with value: 1.3444444444444446 and parameters: {'x_0_0': 'bd', 'x_0_1': 'bc', 'x_0_2': 'bd', 'x_1_0': 'bd', 'x_1_1': 'ad', 'x_1_2': 'oo'}. Best is trial 2 with value: 0.9666666666666667.
2024-12-06 23:49:01,599 - INFO - Candidate Mean Stats: {'Max': np.float64(2.0), 'Min': np.float64(0.24972910861598843), 'Mean': np.float64(0.49262425344154515), 'Std': np.float64(0.062154404438652576)}
2024-12-06 23:49:01,599 - INFO - Candidate Std Stats: {'Max': np.float64(1.5577920612209215), 'Min': np.float64(0.0), 'Mean': np.float64(0.09521982013095566), 'Std': np.float64(0.05202868030954806)}
[I 2024-12-06 23:49:01,644] Trial 26 finished with value: 1.9 and parameters: {'x_0_0': 'oo', 'x_0_1': 'ab', 'x_0_2': 'bc', 'x_1_0': 'ad', 'x_1_1': 'bd', 'x_1_2': 'bd'}. Best is trial 7 with value: 1.077777777777778.
2024-12-06 23:49:05,619 - INFO - Candidate Mean Stats: {'Max': np.float64(1.9), 'Min': np.float64(0.20540551204991825), 'Mean': np.float64(0.48482942950329516), 'Std': np.float64(0.06493464386684551)}
2024-12-06 23:49:05,620 - INFO - Candidate Std Stats: {'Max': np.float64(0.886940490636992), 'Min': np.float64(0.0), 'Mean': np.float64(0.11080594853444589), 'Std': np.float64(0.05226173035869163)}
