2024-12-06 23:36:02,432 - INFO - Experiment settings: {'name': '2024-12-06_23-36-00_warcraft_map1_parafac_seed3', 'seed': 3, 'dimension': 2, 'function': 'warcraft', 'map': array([[0.125, 0.5  ],
       [0.25 , 0.125]]), 'iter_bo': 500, 'storage': 'sqlite:///results/2024-12-06_23-36-00/warcraft_map1_parafac_seed3.db', 'sampler': 'parafac', 'unique_sampling': False, 'decomp_num': 5, 'cp_settings': {'rank': 3, 'als_iterations': 100, 'mask_ratio': 0.9, 'random_dist_type': 'normal', 'include_observed_points': False}, 'acqf_settings': {'acquisition_function': 'ei', 'trade_off_param': 1.0, 'batch_size': 1, 'maximize': False}, 'n_startup_trials': 1}
2024-12-06 23:36:02,432 - INFO - Experiment settings: {'name': '2024-12-06_23-36-00_warcraft_map1_parafac_seed1', 'seed': 1, 'dimension': 2, 'function': 'warcraft', 'map': array([[0.125, 0.5  ],
       [0.25 , 0.125]]), 'iter_bo': 500, 'storage': 'sqlite:///results/2024-12-06_23-36-00/warcraft_map1_parafac_seed1.db', 'sampler': 'parafac', 'unique_sampling': False, 'decomp_num': 5, 'cp_settings': {'rank': 3, 'als_iterations': 100, 'mask_ratio': 0.9, 'random_dist_type': 'normal', 'include_observed_points': False}, 'acqf_settings': {'acquisition_function': 'ei', 'trade_off_param': 1.0, 'batch_size': 1, 'maximize': False}, 'n_startup_trials': 1}
2024-12-06 23:36:02,432 - INFO - Experiment settings: {'name': '2024-12-06_23-36-00_warcraft_map1_parafac_seed2', 'seed': 2, 'dimension': 2, 'function': 'warcraft', 'map': array([[0.125, 0.5  ],
       [0.25 , 0.125]]), 'iter_bo': 500, 'storage': 'sqlite:///results/2024-12-06_23-36-00/warcraft_map1_parafac_seed2.db', 'sampler': 'parafac', 'unique_sampling': False, 'decomp_num': 5, 'cp_settings': {'rank': 3, 'als_iterations': 100, 'mask_ratio': 0.9, 'random_dist_type': 'normal', 'include_observed_points': False}, 'acqf_settings': {'acquisition_function': 'ei', 'trade_off_param': 1.0, 'batch_size': 1, 'maximize': False}, 'n_startup_trials': 1}
2024-12-06 23:36:02,432 - INFO - Experiment settings: {'name': '2024-12-06_23-36-00_warcraft_map1_parafac_seed0', 'seed': 0, 'dimension': 2, 'function': 'warcraft', 'map': array([[0.125, 0.5  ],
       [0.25 , 0.125]]), 'iter_bo': 500, 'storage': 'sqlite:///results/2024-12-06_23-36-00/warcraft_map1_parafac_seed0.db', 'sampler': 'parafac', 'unique_sampling': False, 'decomp_num': 5, 'cp_settings': {'rank': 3, 'als_iterations': 100, 'mask_ratio': 0.9, 'random_dist_type': 'normal', 'include_observed_points': False}, 'acqf_settings': {'acquisition_function': 'ei', 'trade_off_param': 1.0, 'batch_size': 1, 'maximize': False}, 'n_startup_trials': 1}
[I 2024-12-06 23:36:02,856] A new study created in RDB with name: 2024-12-06_23-36-00_warcraft_map1_parafac_seed3
[I 2024-12-06 23:36:02,856] A new study created in RDB with name: 2024-12-06_23-36-00_warcraft_map1_parafac_seed0
[I 2024-12-06 23:36:02,856] A new study created in RDB with name: 2024-12-06_23-36-00_warcraft_map1_parafac_seed1
[I 2024-12-06 23:36:02,856] A new study created in RDB with name: 2024-12-06_23-36-00_warcraft_map1_parafac_seed2
2024-12-06 23:36:02,858 - INFO - Created new study '2024-12-06_23-36-00_warcraft_map1_parafac_seed1' in sqlite:///results/2024-12-06_23-36-00/warcraft_map1_parafac_seed1.db
2024-12-06 23:36:02,858 - INFO - Created new study '2024-12-06_23-36-00_warcraft_map1_parafac_seed0' in sqlite:///results/2024-12-06_23-36-00/warcraft_map1_parafac_seed0.db
2024-12-06 23:36:02,858 - INFO - Created new study '2024-12-06_23-36-00_warcraft_map1_parafac_seed3' in sqlite:///results/2024-12-06_23-36-00/warcraft_map1_parafac_seed3.db
2024-12-06 23:36:02,858 - INFO - Created new study '2024-12-06_23-36-00_warcraft_map1_parafac_seed2' in sqlite:///results/2024-12-06_23-36-00/warcraft_map1_parafac_seed2.db
2024-12-06 23:36:02,870 - INFO - Using sample_independent for sampling with random sampler.
2024-12-06 23:36:02,870 - INFO - Using sample_independent for sampling with random sampler.
2024-12-06 23:36:02,871 - INFO - Using sample_independent for sampling with random sampler.
2024-12-06 23:36:02,871 - INFO - Using sample_independent for sampling with random sampler.
2024-12-06 23:36:02,874 - INFO - Using sample_independent for sampling with random sampler.
2024-12-06 23:36:02,874 - INFO - Using sample_independent for sampling with random sampler.
2024-12-06 23:36:02,874 - INFO - Using sample_independent for sampling with random sampler.
2024-12-06 23:36:02,874 - INFO - Using sample_independent for sampling with random sampler.
2024-12-06 23:36:02,876 - INFO - Using sample_independent for sampling with random sampler.
2024-12-06 23:36:02,876 - INFO - Using sample_independent for sampling with random sampler.
2024-12-06 23:36:02,876 - INFO - Using sample_independent for sampling with random sampler.
2024-12-06 23:36:02,876 - INFO - Using sample_independent for sampling with random sampler.
2024-12-06 23:36:02,878 - INFO - Using sample_independent for sampling with random sampler.
2024-12-06 23:36:02,878 - INFO - Using sample_independent for sampling with random sampler.
2024-12-06 23:36:02,878 - INFO - Using sample_independent for sampling with random sampler.
2024-12-06 23:36:02,878 - INFO - Using sample_independent for sampling with random sampler.
[I 2024-12-06 23:36:02,888] Trial 0 finished with value: 1.2857142857142856 and parameters: {'x_0_0': 'bd', 'x_0_1': 'bd', 'x_1_0': 'bd', 'x_1_1': 'bd'}. Best is trial 0 with value: 1.2857142857142856.
[I 2024-12-06 23:36:02,888] Trial 0 finished with value: 1.2857142857142856 and parameters: {'x_0_0': 'ac', 'x_0_1': 'ac', 'x_1_0': 'ac', 'x_1_1': 'ac'}. Best is trial 0 with value: 1.2857142857142856.
[I 2024-12-06 23:36:02,888] Trial 0 finished with value: 1.7142857142857144 and parameters: {'x_0_0': 'ab', 'x_0_1': 'ab', 'x_1_0': 'ab', 'x_1_1': 'ab'}. Best is trial 0 with value: 1.7142857142857144.
[I 2024-12-06 23:36:02,888] Trial 0 finished with value: 1.7142857142857144 and parameters: {'x_0_0': 'ab', 'x_0_1': 'ab', 'x_1_0': 'ab', 'x_1_1': 'ab'}. Best is trial 0 with value: 1.7142857142857144.
2024-12-06 23:36:03,206 - INFO - Candidate Mean Stats: {'Max': np.float64(1.7142857142857144), 'Min': np.float64(-0.7744393296531364), 'Mean': np.float64(0.19573124568757186), 'Std': np.float64(0.3309324023575183)}
2024-12-06 23:36:03,206 - INFO - Candidate Std Stats: {'Max': np.float64(1.5641477753764672), 'Min': np.float64(0.0), 'Mean': np.float64(0.6759567829511101), 'Std': np.float64(0.2404483285688686)}
2024-12-06 23:36:03,208 - INFO - Candidate Mean Stats: {'Max': np.float64(1.2857142857142856), 'Min': np.float64(-1.2251125230527833), 'Mean': np.float64(0.012962492694223645), 'Std': np.float64(0.35735804178953023)}
2024-12-06 23:36:03,208 - INFO - Candidate Std Stats: {'Max': np.float64(1.9533362753098125), 'Min': np.float64(0.0), 'Mean': np.float64(0.7576159050358164), 'Std': np.float64(0.2835911803219326)}
2024-12-06 23:36:03,210 - INFO - Candidate Mean Stats: {'Max': np.float64(1.7142857142857144), 'Min': np.float64(-0.9298073141846755), 'Mean': np.float64(0.24392289167288458), 'Std': np.float64(0.34697580786168564)}
2024-12-06 23:36:03,210 - INFO - Candidate Std Stats: {'Max': np.float64(1.6431964961950765), 'Min': np.float64(0.0), 'Mean': np.float64(0.6559384087588715), 'Std': np.float64(0.2415199978574377)}
2024-12-06 23:36:03,211 - INFO - Candidate Mean Stats: {'Max': np.float64(1.3767788050059524), 'Min': np.float64(-0.7428554535281311), 'Mean': np.float64(0.18397505117132074), 'Std': np.float64(0.32567427776999935)}
2024-12-06 23:36:03,211 - INFO - Candidate Std Stats: {'Max': np.float64(1.5093082664474238), 'Min': np.float64(0.0), 'Mean': np.float64(0.6091992176023506), 'Std': np.float64(0.23931472952218005)}
[I 2024-12-06 23:36:03,221] Trial 1 finished with value: 1.2857142857142856 and parameters: {'x_0_0': 'bd', 'x_0_1': 'ac', 'x_1_0': 'bc', 'x_1_1': 'cd'}. Best is trial 1 with value: 1.2857142857142856.
[I 2024-12-06 23:36:03,222] Trial 1 finished with value: 1.875 and parameters: {'x_0_0': 'oo', 'x_0_1': 'ad', 'x_1_0': 'bd', 'x_1_1': 'bd'}. Best is trial 0 with value: 1.2857142857142856.
[I 2024-12-06 23:36:03,223] Trial 1 finished with value: 2.0 and parameters: {'x_0_0': 'cd', 'x_0_1': 'ad', 'x_1_0': 'ab', 'x_1_1': 'bd'}. Best is trial 0 with value: 1.7142857142857144.
[I 2024-12-06 23:36:03,224] Trial 1 finished with value: 1.3214285714285714 and parameters: {'x_0_0': 'bd', 'x_0_1': 'ab', 'x_1_0': 'oo', 'x_1_1': 'bc'}. Best is trial 0 with value: 1.2857142857142856.
2024-12-06 23:36:03,530 - INFO - Candidate Mean Stats: {'Max': np.float64(2.0), 'Min': np.float64(-1.2300019601225287), 'Mean': np.float64(0.007061563036960021), 'Std': np.float64(0.3798950411740024)}
2024-12-06 23:36:03,530 - INFO - Candidate Std Stats: {'Max': np.float64(1.9784501888071426), 'Min': np.float64(0.0), 'Mean': np.float64(0.8052522945104302), 'Std': np.float64(0.29752578693894355)}
2024-12-06 23:36:03,532 - INFO - Candidate Mean Stats: {'Max': np.float64(1.875), 'Min': np.float64(-1.2451689348797057), 'Mean': np.float64(0.1071977526262014), 'Std': np.float64(0.39312007032344193)}
2024-12-06 23:36:03,533 - INFO - Candidate Std Stats: {'Max': np.float64(1.9532665783255434), 'Min': np.float64(0.0), 'Mean': np.float64(0.7685275699397411), 'Std': np.float64(0.2963352340478131)}
2024-12-06 23:36:03,535 - INFO - Candidate Mean Stats: {'Max': np.float64(1.3214285714285714), 'Min': np.float64(-0.685428411687773), 'Mean': np.float64(0.19171823676960675), 'Std': np.float64(0.32084899986726184)}
2024-12-06 23:36:03,535 - INFO - Candidate Std Stats: {'Max': np.float64(1.5878672412228725), 'Min': np.float64(0.0), 'Mean': np.float64(0.6605987477870625), 'Std': np.float64(0.2422259046735981)}
2024-12-06 23:36:03,539 - INFO - Candidate Mean Stats: {'Max': np.float64(1.7142857142857144), 'Min': np.float64(-1.1231247975145997), 'Mean': np.float64(0.17658326523578777), 'Std': np.float64(0.386141424170891)}
2024-12-06 23:36:03,539 - INFO - Candidate Std Stats: {'Max': np.float64(1.5572453806908084), 'Min': np.float64(0.0), 'Mean': np.float64(0.6345917012576714), 'Std': np.float64(0.23968361604015137)}
[I 2024-12-06 23:36:03,544] Trial 2 finished with value: 1.875 and parameters: {'x_0_0': 'oo', 'x_0_1': 'bc', 'x_1_0': 'bd', 'x_1_1': 'ac'}. Best is trial 0 with value: 1.7142857142857144.
[I 2024-12-06 23:36:03,548] Trial 2 finished with value: 0.9285714285714286 and parameters: {'x_0_0': 'ad', 'x_0_1': 'oo', 'x_1_0': 'ab', 'x_1_1': 'bd'}. Best is trial 2 with value: 0.9285714285714286.
[I 2024-12-06 23:36:03,548] Trial 2 finished with value: 1.125 and parameters: {'x_0_0': 'cd', 'x_0_1': 'oo', 'x_1_0': 'oo', 'x_1_1': 'oo'}. Best is trial 2 with value: 1.125.
[I 2024-12-06 23:36:03,552] Trial 2 finished with value: 1.0 and parameters: {'x_0_0': 'ac', 'x_0_1': 'ad', 'x_1_0': 'ac', 'x_1_1': 'bd'}. Best is trial 2 with value: 1.0.
2024-12-06 23:36:03,853 - INFO - Candidate Mean Stats: {'Max': np.float64(2.0), 'Min': np.float64(-1.0488487347168938), 'Mean': np.float64(0.06521074898546819), 'Std': np.float64(0.41663361726536013)}
2024-12-06 23:36:03,854 - INFO - Candidate Std Stats: {'Max': np.float64(1.9793464576521411), 'Min': np.float64(0.0), 'Mean': np.float64(0.7508463999488106), 'Std': np.float64(0.2928961142923303)}
2024-12-06 23:36:03,857 - INFO - Candidate Mean Stats: {'Max': np.float64(1.875), 'Min': np.float64(-0.9942322747536974), 'Mean': np.float64(0.11352953568592111), 'Std': np.float64(0.39574661125841754)}
2024-12-06 23:36:03,857 - INFO - Candidate Std Stats: {'Max': np.float64(2.019300556954682), 'Min': np.float64(0.0), 'Mean': np.float64(0.7883410726922883), 'Std': np.float64(0.3011763724155871)}
2024-12-06 23:36:03,857 - INFO - Candidate Mean Stats: {'Max': np.float64(1.3214285714285714), 'Min': np.float64(-0.8647062716780745), 'Mean': np.float64(0.1731292048544216), 'Std': np.float64(0.33656385759778323)}
2024-12-06 23:36:03,857 - INFO - Candidate Std Stats: {'Max': np.float64(1.7585611215497976), 'Min': np.float64(0.0), 'Mean': np.float64(0.6326618022585603), 'Std': np.float64(0.24383811404950564)}
2024-12-06 23:36:03,865 - INFO - Candidate Mean Stats: {'Max': np.float64(1.7142857142857144), 'Min': np.float64(-0.9895959482326836), 'Mean': np.float64(0.0008992843736114057), 'Std': np.float64(0.366116410892494)}
2024-12-06 23:36:03,865 - INFO - Candidate Std Stats: {'Max': np.float64(1.8679203090032), 'Min': np.float64(0.0), 'Mean': np.float64(0.7500936560586776), 'Std': np.float64(0.2909588163812453)}
[I 2024-12-06 23:36:03,867] Trial 3 finished with value: 0.9642857142857143 and parameters: {'x_0_0': 'ab', 'x_0_1': 'oo', 'x_1_0': 'oo', 'x_1_1': 'cd'}. Best is trial 3 with value: 0.9642857142857143.
[I 2024-12-06 23:36:03,870] Trial 3 finished with value: 1.875 and parameters: {'x_0_0': 'oo', 'x_0_1': 'bc', 'x_1_0': 'bc', 'x_1_1': 'bd'}. Best is trial 2 with value: 1.125.
[I 2024-12-06 23:36:03,871] Trial 3 finished with value: 1.3035714285714286 and parameters: {'x_0_0': 'ac', 'x_0_1': 'ab', 'x_1_0': 'bc', 'x_1_1': 'oo'}. Best is trial 2 with value: 0.9285714285714286.
[I 2024-12-06 23:36:03,877] Trial 3 finished with value: 1.2857142857142856 and parameters: {'x_0_0': 'ac', 'x_0_1': 'ad', 'x_1_0': 'ac', 'x_1_1': 'ad'}. Best is trial 2 with value: 1.0.
2024-12-06 23:36:04,233 - INFO - Candidate Mean Stats: {'Max': np.float64(1.875), 'Min': np.float64(-1.014872931466065), 'Mean': np.float64(0.1521540823691057), 'Std': np.float64(0.40595888024118115)}
2024-12-06 23:36:04,233 - INFO - Candidate Std Stats: {'Max': np.float64(1.534428280780091), 'Min': np.float64(0.0), 'Mean': np.float64(0.6602808233610427), 'Std': np.float64(0.25159328112115414)}
2024-12-06 23:36:04,234 - INFO - Candidate Mean Stats: {'Max': np.float64(1.875), 'Min': np.float64(-0.7473987908735134), 'Mean': np.float64(0.16500103043520364), 'Std': np.float64(0.34034860617876433)}
2024-12-06 23:36:04,234 - INFO - Candidate Std Stats: {'Max': np.float64(1.6005210258882494), 'Min': np.float64(0.0), 'Mean': np.float64(0.6523825572777364), 'Std': np.float64(0.25400293834191984)}
[I 2024-12-06 23:36:04,248] Trial 4 finished with value: 1.4285714285714286 and parameters: {'x_0_0': 'bd', 'x_0_1': 'ac', 'x_1_0': 'ab', 'x_1_1': 'cd'}. Best is trial 2 with value: 0.9285714285714286.
2024-12-06 23:36:04,248 - INFO - Candidate Mean Stats: {'Max': np.float64(2.0), 'Min': np.float64(-0.9820905199629675), 'Mean': np.float64(0.18405841850278776), 'Std': np.float64(0.39343426350420657)}
2024-12-06 23:36:04,248 - INFO - Candidate Std Stats: {'Max': np.float64(1.62139275923446), 'Min': np.float64(0.0), 'Mean': np.float64(0.7118068836281709), 'Std': np.float64(0.25755028409458386)}
[I 2024-12-06 23:36:04,250] Trial 4 finished with value: 1.4642857142857144 and parameters: {'x_0_0': 'ab', 'x_0_1': 'ab', 'x_1_0': 'oo', 'x_1_1': 'ab'}. Best is trial 2 with value: 1.125.
[I 2024-12-06 23:36:04,264] Trial 4 finished with value: 1.0714285714285714 and parameters: {'x_0_0': 'ac', 'x_0_1': 'oo', 'x_1_0': 'bd', 'x_1_1': 'cd'}. Best is trial 3 with value: 0.9642857142857143.
2024-12-06 23:36:04,269 - INFO - Candidate Mean Stats: {'Max': np.float64(1.7142857142857144), 'Min': np.float64(-0.8382789365892286), 'Mean': np.float64(0.11899427803614797), 'Std': np.float64(0.3762608638971825)}
2024-12-06 23:36:04,269 - INFO - Candidate Std Stats: {'Max': np.float64(1.855131949633999), 'Min': np.float64(0.0), 'Mean': np.float64(0.6624110766050606), 'Std': np.float64(0.25914512605598866)}
[I 2024-12-06 23:36:04,284] Trial 4 finished with value: 1.75 and parameters: {'x_0_0': 'cd', 'x_0_1': 'ab', 'x_1_0': 'oo', 'x_1_1': 'bd'}. Best is trial 2 with value: 1.0.
2024-12-06 23:36:04,599 - INFO - Candidate Mean Stats: {'Max': np.float64(1.875), 'Min': np.float64(-1.0142346583508814), 'Mean': np.float64(0.18934926985667272), 'Std': np.float64(0.3743690178305444)}
2024-12-06 23:36:04,599 - INFO - Candidate Std Stats: {'Max': np.float64(1.8236106987820542), 'Min': np.float64(0.0), 'Mean': np.float64(0.7107223966514943), 'Std': np.float64(0.2715662382555993)}
2024-12-06 23:36:04,604 - INFO - Candidate Mean Stats: {'Max': np.float64(1.875), 'Min': np.float64(-1.106138962131265), 'Mean': np.float64(0.1319097572610413), 'Std': np.float64(0.359335338935827)}
2024-12-06 23:36:04,604 - INFO - Candidate Std Stats: {'Max': np.float64(1.6592190457134703), 'Min': np.float64(0.0), 'Mean': np.float64(0.6624790331202882), 'Std': np.float64(0.25932712449225914)}
2024-12-06 23:36:04,609 - INFO - Candidate Mean Stats: {'Max': np.float64(2.0), 'Min': np.float64(-1.107415473141397), 'Mean': np.float64(0.1738107803791746), 'Std': np.float64(0.4157960539742598)}
2024-12-06 23:36:04,609 - INFO - Candidate Std Stats: {'Max': np.float64(1.578152738138322), 'Min': np.float64(0.0), 'Mean': np.float64(0.6775479286112454), 'Std': np.float64(0.2541660006782889)}
[I 2024-12-06 23:36:04,613] Trial 5 finished with value: 1.1607142857142856 and parameters: {'x_0_0': 'ad', 'x_0_1': 'ac', 'x_1_0': 'bd', 'x_1_1': 'oo'}. Best is trial 2 with value: 0.9285714285714286.
[I 2024-12-06 23:36:04,618] Trial 5 finished with value: 1.5714285714285714 and parameters: {'x_0_0': 'ad', 'x_0_1': 'ad', 'x_1_0': 'ad', 'x_1_1': 'ad'}. Best is trial 2 with value: 1.125.
[I 2024-12-06 23:36:04,622] Trial 5 finished with value: 1.7142857142857144 and parameters: {'x_0_0': 'ab', 'x_0_1': 'ad', 'x_1_0': 'cd', 'x_1_1': 'cd'}. Best is trial 3 with value: 0.9642857142857143.
2024-12-06 23:36:04,628 - INFO - Candidate Mean Stats: {'Max': np.float64(1.75), 'Min': np.float64(-0.689924342283654), 'Mean': np.float64(0.18471158278782318), 'Std': np.float64(0.3587237975889097)}
2024-12-06 23:36:04,628 - INFO - Candidate Std Stats: {'Max': np.float64(2.0319364059156935), 'Min': np.float64(0.0), 'Mean': np.float64(0.6505685512840583), 'Std': np.float64(0.2537994465775826)}
[I 2024-12-06 23:36:04,642] Trial 5 finished with value: 1.5714285714285714 and parameters: {'x_0_0': 'ac', 'x_0_1': 'bc', 'x_1_0': 'bc', 'x_1_1': 'ab'}. Best is trial 2 with value: 1.0.
2024-12-06 23:36:04,977 - INFO - Candidate Mean Stats: {'Max': np.float64(1.875), 'Min': np.float64(-0.8749148611553309), 'Mean': np.float64(0.19084045796375607), 'Std': np.float64(0.3411408978036007)}
2024-12-06 23:36:04,977 - INFO - Candidate Std Stats: {'Max': np.float64(1.6342572493756544), 'Min': np.float64(0.0), 'Mean': np.float64(0.5841919265912602), 'Std': np.float64(0.2394968605671704)}
2024-12-06 23:36:04,978 - INFO - Candidate Mean Stats: {'Max': np.float64(2.0), 'Min': np.float64(-0.908063461458994), 'Mean': np.float64(0.11879677103964409), 'Std': np.float64(0.33034769584877094)}
2024-12-06 23:36:04,978 - INFO - Candidate Std Stats: {'Max': np.float64(1.7106529274200764), 'Min': np.float64(0.0), 'Mean': np.float64(0.6566391368249951), 'Std': np.float64(0.25675256617534065)}
2024-12-06 23:36:04,979 - INFO - Candidate Mean Stats: {'Max': np.float64(1.875), 'Min': np.float64(-0.5552204016155697), 'Mean': np.float64(0.22306363193939543), 'Std': np.float64(0.28356028180443044)}
2024-12-06 23:36:04,979 - INFO - Candidate Std Stats: {'Max': np.float64(1.4703863171990224), 'Min': np.float64(0.0), 'Mean': np.float64(0.5911916952221787), 'Std': np.float64(0.22358901710389048)}
[I 2024-12-06 23:36:04,995] Trial 6 finished with value: 1.2857142857142856 and parameters: {'x_0_0': 'bc', 'x_0_1': 'ac', 'x_1_0': 'bc', 'x_1_1': 'ac'}. Best is trial 3 with value: 0.9642857142857143.
[I 2024-12-06 23:36:04,995] Trial 6 finished with value: 1.7142857142857144 and parameters: {'x_0_0': 'ab', 'x_0_1': 'cd', 'x_1_0': 'ac', 'x_1_1': 'cd'}. Best is trial 2 with value: 1.125.
[I 2024-12-06 23:36:04,995] Trial 6 finished with value: 1.3214285714285714 and parameters: {'x_0_0': 'bd', 'x_0_1': 'bd', 'x_1_0': 'oo', 'x_1_1': 'bd'}. Best is trial 2 with value: 0.9285714285714286.
2024-12-06 23:36:04,997 - INFO - Candidate Mean Stats: {'Max': np.float64(1.75), 'Min': np.float64(-0.8723516215333035), 'Mean': np.float64(0.2643708640111065), 'Std': np.float64(0.36494376914884946)}
2024-12-06 23:36:04,997 - INFO - Candidate Std Stats: {'Max': np.float64(1.446744994285389), 'Min': np.float64(0.0), 'Mean': np.float64(0.5598810513237705), 'Std': np.float64(0.22204321598187235)}
[I 2024-12-06 23:36:05,010] Trial 6 finished with value: 1.5714285714285714 and parameters: {'x_0_0': 'ad', 'x_0_1': 'ac', 'x_1_0': 'cd', 'x_1_1': 'cd'}. Best is trial 2 with value: 1.0.
2024-12-06 23:36:05,323 - INFO - Candidate Mean Stats: {'Max': np.float64(1.875), 'Min': np.float64(-0.8690954572574519), 'Mean': np.float64(0.18519964572665876), 'Std': np.float64(0.3751220274818779)}
2024-12-06 23:36:05,324 - INFO - Candidate Std Stats: {'Max': np.float64(1.4527050022456633), 'Min': np.float64(0.0), 'Mean': np.float64(0.6194260180626033), 'Std': np.float64(0.23332598861753523)}
2024-12-06 23:36:05,325 - INFO - Candidate Mean Stats: {'Max': np.float64(1.875), 'Min': np.float64(-1.2691238140800736), 'Mean': np.float64(0.04169312320115322), 'Std': np.float64(0.4355903204764873)}
2024-12-06 23:36:05,325 - INFO - Candidate Std Stats: {'Max': np.float64(2.173587341974328), 'Min': np.float64(0.0), 'Mean': np.float64(0.76977493863305), 'Std': np.float64(0.28347534236989114)}
2024-12-06 23:36:05,326 - INFO - Candidate Mean Stats: {'Max': np.float64(2.0), 'Min': np.float64(-0.7164289026306043), 'Mean': np.float64(0.23394701727950123), 'Std': np.float64(0.323969696721745)}
2024-12-06 23:36:05,326 - INFO - Candidate Std Stats: {'Max': np.float64(1.5880826095241578), 'Min': np.float64(0.0), 'Mean': np.float64(0.6156804162222784), 'Std': np.float64(0.25439503708079364)}
2024-12-06 23:36:05,335 - INFO - Candidate Mean Stats: {'Max': np.float64(1.75), 'Min': np.float64(-0.8540512603066002), 'Mean': np.float64(0.2664667992541532), 'Std': np.float64(0.3377712840427982)}
2024-12-06 23:36:05,335 - INFO - Candidate Std Stats: {'Max': np.float64(1.4463345805157493), 'Min': np.float64(0.0), 'Mean': np.float64(0.5979517331643721), 'Std': np.float64(0.2156366067188254)}
