[I 2024-12-06 23:36:53,231] Trial 141 finished with value: 1.1964285714285714 and parameters: {'x_0_0': 'bd', 'x_0_1': 'ac', 'x_1_0': 'oo', 'x_1_1': 'oo'}. Best is trial 23 with value: 0.5.
2024-12-06 23:36:53,565 - INFO - Candidate Mean Stats: {'Max': np.float64(2.313206125961681), 'Min': np.float64(-1.0421192435180724), 'Mean': np.float64(0.4063605318280255), 'Std': np.float64(0.530734545757486)}
2024-12-06 23:36:53,565 - INFO - Candidate Std Stats: {'Max': np.float64(1.711365945244414), 'Min': np.float64(0.0), 'Mean': np.float64(0.598304324489993), 'Std': np.float64(0.29737415914882187)}
2024-12-06 23:36:53,573 - INFO - Candidate Mean Stats: {'Max': np.float64(3.0897993760583913), 'Min': np.float64(-1.5023267747683542), 'Mean': np.float64(0.3265699261230868), 'Std': np.float64(0.6231416971269153)}
2024-12-06 23:36:53,573 - INFO - Candidate Std Stats: {'Max': np.float64(1.6808277775602312), 'Min': np.float64(0.0), 'Mean': np.float64(0.6573199679744813), 'Std': np.float64(0.30458863914787837)}
[I 2024-12-06 23:36:53,581] Trial 143 finished with value: 1.0714285714285714 and parameters: {'x_0_0': 'ad', 'x_0_1': 'oo', 'x_1_0': 'ad', 'x_1_1': 'bc'}. Best is trial 63 with value: 0.5.
2024-12-06 23:36:53,587 - INFO - Candidate Mean Stats: {'Max': np.float64(2.974656793133827), 'Min': np.float64(-1.4767305217726385), 'Mean': np.float64(0.36278500262233476), 'Std': np.float64(0.6026329133430581)}
2024-12-06 23:36:53,587 - INFO - Candidate Std Stats: {'Max': np.float64(1.5854790262424576), 'Min': np.float64(0.0), 'Mean': np.float64(0.6029166971784711), 'Std': np.float64(0.2891673936006677)}
[I 2024-12-06 23:36:53,589] Trial 143 finished with value: 0.9464285714285714 and parameters: {'x_0_0': 'bc', 'x_0_1': 'oo', 'x_1_0': 'cd', 'x_1_1': 'oo'}. Best is trial 76 with value: 0.5.
[I 2024-12-06 23:36:53,603] Trial 143 finished with value: 1.375 and parameters: {'x_0_0': 'oo', 'x_0_1': 'oo', 'x_1_0': 'ac', 'x_1_1': 'ad'}. Best is trial 50 with value: 0.6607142857142857.
2024-12-06 23:36:53,632 - INFO - Candidate Mean Stats: {'Max': np.float64(2.824353946337157), 'Min': np.float64(-1.0827892274276205), 'Mean': np.float64(0.43357694423945614), 'Std': np.float64(0.5294616143945582)}
2024-12-06 23:36:53,633 - INFO - Candidate Std Stats: {'Max': np.float64(1.553352280090735), 'Min': np.float64(0.0), 'Mean': np.float64(0.5478076004868208), 'Std': np.float64(0.2642224338232829)}
[I 2024-12-06 23:36:53,648] Trial 142 finished with value: 1.1964285714285714 and parameters: {'x_0_0': 'ad', 'x_0_1': 'ac', 'x_1_0': 'oo', 'x_1_1': 'oo'}. Best is trial 23 with value: 0.5.
2024-12-06 23:36:53,955 - INFO - Candidate Mean Stats: {'Max': np.float64(2.479121205661813), 'Min': np.float64(-0.958367294845222), 'Mean': np.float64(0.409979722527589), 'Std': np.float64(0.5486033516215302)}
2024-12-06 23:36:53,955 - INFO - Candidate Std Stats: {'Max': np.float64(1.7638769209780467), 'Min': np.float64(0.0), 'Mean': np.float64(0.5700142372177204), 'Std': np.float64(0.26318273559820965)}
2024-12-06 23:36:53,964 - INFO - Candidate Mean Stats: {'Max': np.float64(2.6102650876302453), 'Min': np.float64(-1.3431395182675367), 'Mean': np.float64(0.4312645587694659), 'Std': np.float64(0.5166904659937726)}
2024-12-06 23:36:53,965 - INFO - Candidate Std Stats: {'Max': np.float64(1.6796258132369495), 'Min': np.float64(0.0), 'Mean': np.float64(0.593027897738205), 'Std': np.float64(0.29067227191768613)}
[I 2024-12-06 23:36:53,971] Trial 144 finished with value: 1.3214285714285714 and parameters: {'x_0_0': 'bd', 'x_0_1': 'ac', 'x_1_0': 'oo', 'x_1_1': 'ab'}. Best is trial 76 with value: 0.5.
2024-12-06 23:36:53,971 - INFO - Candidate Mean Stats: {'Max': np.float64(2.473519224926245), 'Min': np.float64(-1.099460011370698), 'Mean': np.float64(0.48056487745685444), 'Std': np.float64(0.5055749886359246)}
2024-12-06 23:36:53,972 - INFO - Candidate Std Stats: {'Max': np.float64(1.6803512117755919), 'Min': np.float64(0.0), 'Mean': np.float64(0.5801418776402375), 'Std': np.float64(0.2734947438389403)}
[I 2024-12-06 23:36:53,982] Trial 144 finished with value: 1.0714285714285714 and parameters: {'x_0_0': 'bc', 'x_0_1': 'oo', 'x_1_0': 'ad', 'x_1_1': 'ad'}. Best is trial 63 with value: 0.5.
[I 2024-12-06 23:36:53,987] Trial 144 finished with value: 1.0714285714285714 and parameters: {'x_0_0': 'ad', 'x_0_1': 'oo', 'x_1_0': 'cd', 'x_1_1': 'bc'}. Best is trial 50 with value: 0.6607142857142857.
2024-12-06 23:36:54,009 - INFO - Candidate Mean Stats: {'Max': np.float64(2.6624103537238946), 'Min': np.float64(-0.9934649651157873), 'Mean': np.float64(0.4547434424919322), 'Std': np.float64(0.5019553663202387)}
2024-12-06 23:36:54,009 - INFO - Candidate Std Stats: {'Max': np.float64(1.4444887753435716), 'Min': np.float64(0.0), 'Mean': np.float64(0.5345997581002542), 'Std': np.float64(0.250393238634377)}
[I 2024-12-06 23:36:54,023] Trial 143 finished with value: 1.0892857142857144 and parameters: {'x_0_0': 'ab', 'x_0_1': 'oo', 'x_1_0': 'ad', 'x_1_1': 'oo'}. Best is trial 23 with value: 0.5.
2024-12-06 23:36:54,351 - INFO - Candidate Mean Stats: {'Max': np.float64(3.4826433927610077), 'Min': np.float64(-1.1516089221537689), 'Mean': np.float64(0.3977674542291091), 'Std': np.float64(0.5605716936572993)}
2024-12-06 23:36:54,351 - INFO - Candidate Std Stats: {'Max': np.float64(1.6281870875882083), 'Min': np.float64(0.0), 'Mean': np.float64(0.5684125740272552), 'Std': np.float64(0.27209950274359146)}
2024-12-06 23:36:54,358 - INFO - Candidate Mean Stats: {'Max': np.float64(2.5460885494163925), 'Min': np.float64(-1.2987206895757404), 'Mean': np.float64(0.4713304210302032), 'Std': np.float64(0.5521638101285791)}
2024-12-06 23:36:54,358 - INFO - Candidate Std Stats: {'Max': np.float64(1.491012966096637), 'Min': np.float64(0.0), 'Mean': np.float64(0.543679479978279), 'Std': np.float64(0.25578828617373106)}
2024-12-06 23:36:54,360 - INFO - Candidate Mean Stats: {'Max': np.float64(2.78155744922273), 'Min': np.float64(-1.0326985696956925), 'Mean': np.float64(0.4370707031565809), 'Std': np.float64(0.5320724418826634)}
2024-12-06 23:36:54,360 - INFO - Candidate Std Stats: {'Max': np.float64(1.5009177165358332), 'Min': np.float64(0.0), 'Mean': np.float64(0.5927196625747365), 'Std': np.float64(0.2704935750273464)}
[I 2024-12-06 23:36:54,369] Trial 145 finished with value: 1.0714285714285714 and parameters: {'x_0_0': 'bc', 'x_0_1': 'oo', 'x_1_0': 'bd', 'x_1_1': 'ac'}. Best is trial 76 with value: 0.5.
[I 2024-12-06 23:36:54,375] Trial 145 finished with value: 0.9285714285714286 and parameters: {'x_0_0': 'ad', 'x_0_1': 'oo', 'x_1_0': 'ab', 'x_1_1': 'ac'}. Best is trial 50 with value: 0.6607142857142857.
[I 2024-12-06 23:36:54,376] Trial 145 finished with value: 1.0714285714285714 and parameters: {'x_0_0': 'bc', 'x_0_1': 'oo', 'x_1_0': 'bd', 'x_1_1': 'bc'}. Best is trial 63 with value: 0.5.
2024-12-06 23:36:54,395 - INFO - Candidate Mean Stats: {'Max': np.float64(2.679801175003532), 'Min': np.float64(-1.24923406294537), 'Mean': np.float64(0.4305713102259508), 'Std': np.float64(0.5421252639695906)}
2024-12-06 23:36:54,395 - INFO - Candidate Std Stats: {'Max': np.float64(1.6557446580509891), 'Min': np.float64(0.0), 'Mean': np.float64(0.5688947065041312), 'Std': np.float64(0.27232523462169383)}
[I 2024-12-06 23:36:54,411] Trial 144 finished with value: 0.9464285714285714 and parameters: {'x_0_0': 'bc', 'x_0_1': 'oo', 'x_1_0': 'bd', 'x_1_1': 'oo'}. Best is trial 23 with value: 0.5.
2024-12-06 23:36:54,719 - INFO - Candidate Mean Stats: {'Max': np.float64(2.4907106992696675), 'Min': np.float64(-1.0786414151985884), 'Mean': np.float64(0.4089047568357295), 'Std': np.float64(0.5359654550809401)}
2024-12-06 23:36:54,720 - INFO - Candidate Std Stats: {'Max': np.float64(1.6467268649776285), 'Min': np.float64(0.0), 'Mean': np.float64(0.622723494048633), 'Std': np.float64(0.2925563070710889)}
2024-12-06 23:36:54,725 - INFO - Candidate Mean Stats: {'Max': np.float64(2.6338645585707314), 'Min': np.float64(-1.053880665672444), 'Mean': np.float64(0.4279978228084774), 'Std': np.float64(0.5185521459886944)}
2024-12-06 23:36:54,725 - INFO - Candidate Std Stats: {'Max': np.float64(1.799818832641824), 'Min': np.float64(0.0), 'Mean': np.float64(0.5799212155231642), 'Std': np.float64(0.2798218837971477)}
2024-12-06 23:36:54,733 - INFO - Candidate Mean Stats: {'Max': np.float64(2.6868078291978437), 'Min': np.float64(-0.860681376645473), 'Mean': np.float64(0.4474709626731204), 'Std': np.float64(0.4778710244936723)}
2024-12-06 23:36:54,733 - INFO - Candidate Std Stats: {'Max': np.float64(1.601460792595973), 'Min': np.float64(0.0), 'Mean': np.float64(0.603878677228012), 'Std': np.float64(0.28656473106362457)}
[I 2024-12-06 23:36:54,736] Trial 146 finished with value: 1.0714285714285714 and parameters: {'x_0_0': 'bc', 'x_0_1': 'oo', 'x_1_0': 'bd', 'x_1_1': 'bc'}. Best is trial 76 with value: 0.5.
[I 2024-12-06 23:36:54,742] Trial 146 finished with value: 1.0714285714285714 and parameters: {'x_0_0': 'ac', 'x_0_1': 'oo', 'x_1_0': 'bd', 'x_1_1': 'bd'}. Best is trial 50 with value: 0.6607142857142857.
[I 2024-12-06 23:36:54,750] Trial 146 finished with value: 0.9642857142857143 and parameters: {'x_0_0': 'ab', 'x_0_1': 'oo', 'x_1_0': 'oo', 'x_1_1': 'cd'}. Best is trial 63 with value: 0.5.
2024-12-06 23:36:54,767 - INFO - Candidate Mean Stats: {'Max': np.float64(3.3004760941800706), 'Min': np.float64(-1.368023778728014), 'Mean': np.float64(0.33888378459105956), 'Std': np.float64(0.5654732589608663)}
2024-12-06 23:36:54,767 - INFO - Candidate Std Stats: {'Max': np.float64(1.7227689152701435), 'Min': np.float64(0.0), 'Mean': np.float64(0.6030127586616112), 'Std': np.float64(0.27659477954721484)}
[I 2024-12-06 23:36:54,783] Trial 145 finished with value: 1.375 and parameters: {'x_0_0': 'cd', 'x_0_1': 'oo', 'x_1_0': 'ad', 'x_1_1': 'oo'}. Best is trial 23 with value: 0.5.
2024-12-06 23:36:55,167 - INFO - Candidate Mean Stats: {'Max': np.float64(2.7819552375420473), 'Min': np.float64(-1.0795916836420731), 'Mean': np.float64(0.4230192556607337), 'Std': np.float64(0.5352622161931158)}
2024-12-06 23:36:55,167 - INFO - Candidate Std Stats: {'Max': np.float64(1.9171788966992704), 'Min': np.float64(0.0), 'Mean': np.float64(0.6447986969569399), 'Std': np.float64(0.31232707169253604)}
2024-12-06 23:36:55,168 - INFO - Candidate Mean Stats: {'Max': np.float64(2.9217359931281672), 'Min': np.float64(-1.060890403732073), 'Mean': np.float64(0.38426870880798475), 'Std': np.float64(0.5686302797948731)}
2024-12-06 23:36:55,168 - INFO - Candidate Std Stats: {'Max': np.float64(1.7203870285981788), 'Min': np.float64(0.0), 'Mean': np.float64(0.6041011493186002), 'Std': np.float64(0.299819026151427)}
2024-12-06 23:36:55,170 - INFO - Candidate Mean Stats: {'Max': np.float64(2.4268726294671152), 'Min': np.float64(-0.9529715940463911), 'Mean': np.float64(0.4513892596657409), 'Std': np.float64(0.4969721107212395)}
2024-12-06 23:36:55,170 - INFO - Candidate Std Stats: {'Max': np.float64(1.5677990909134953), 'Min': np.float64(0.0), 'Mean': np.float64(0.561125195952177), 'Std': np.float64(0.2634403013430365)}
[I 2024-12-06 23:36:55,185] Trial 147 finished with value: 1.2857142857142856 and parameters: {'x_0_0': 'ad', 'x_0_1': 'ad', 'x_1_0': 'bd', 'x_1_1': 'ab'}. Best is trial 50 with value: 0.6607142857142857.
[I 2024-12-06 23:36:55,188] Trial 147 finished with value: 0.6607142857142857 and parameters: {'x_0_0': 'bd', 'x_0_1': 'oo', 'x_1_0': 'bd', 'x_1_1': 'oo'}. Best is trial 63 with value: 0.5.
[I 2024-12-06 23:36:55,188] Trial 147 finished with value: 1.0714285714285714 and parameters: {'x_0_0': 'bd', 'x_0_1': 'oo', 'x_1_0': 'cd', 'x_1_1': 'ac'}. Best is trial 76 with value: 0.5.
2024-12-06 23:36:55,210 - INFO - Candidate Mean Stats: {'Max': np.float64(2.993716758592845), 'Min': np.float64(-0.7547790908128875), 'Mean': np.float64(0.454794173519227), 'Std': np.float64(0.4709885805427723)}
2024-12-06 23:36:55,211 - INFO - Candidate Std Stats: {'Max': np.float64(1.596431694044587), 'Min': np.float64(0.0), 'Mean': np.float64(0.6030163963475929), 'Std': np.float64(0.277293023151334)}
[I 2024-12-06 23:36:55,228] Trial 146 finished with value: 1.0892857142857144 and parameters: {'x_0_0': 'ab', 'x_0_1': 'oo', 'x_1_0': 'ac', 'x_1_1': 'oo'}. Best is trial 23 with value: 0.5.
2024-12-06 23:36:55,572 - INFO - Candidate Mean Stats: {'Max': np.float64(2.6402603544400494), 'Min': np.float64(-1.2919769252207842), 'Mean': np.float64(0.38153810707737423), 'Std': np.float64(0.5710703184141795)}
2024-12-06 23:36:55,572 - INFO - Candidate Std Stats: {'Max': np.float64(1.8920992823551888), 'Min': np.float64(0.0), 'Mean': np.float64(0.6692539484146727), 'Std': np.float64(0.32167239616669363)}
2024-12-06 23:36:55,586 - INFO - Candidate Mean Stats: {'Max': np.float64(2.174593838595597), 'Min': np.float64(-0.8560717306975929), 'Mean': np.float64(0.39008150058065505), 'Std': np.float64(0.47772821829709056)}
2024-12-06 23:36:55,586 - INFO - Candidate Std Stats: {'Max': np.float64(1.732554598274307), 'Min': np.float64(0.0), 'Mean': np.float64(0.5864755234736583), 'Std': np.float64(0.29788067038520394)}
[I 2024-12-06 23:36:55,587] Trial 148 finished with value: 1.0714285714285714 and parameters: {'x_0_0': 'bc', 'x_0_1': 'oo', 'x_1_0': 'ad', 'x_1_1': 'cd'}. Best is trial 50 with value: 0.6607142857142857.
2024-12-06 23:36:55,593 - INFO - Candidate Mean Stats: {'Max': np.float64(2.574169234962883), 'Min': np.float64(-1.340564105857159), 'Mean': np.float64(0.42928154586705614), 'Std': np.float64(0.5774174157307961)}
2024-12-06 23:36:55,593 - INFO - Candidate Std Stats: {'Max': np.float64(1.5230052814564707), 'Min': np.float64(0.0), 'Mean': np.float64(0.5814549263548902), 'Std': np.float64(0.27000425218343554)}
[I 2024-12-06 23:36:55,602] Trial 148 finished with value: 0.7857142857142857 and parameters: {'x_0_0': 'ad', 'x_0_1': 'oo', 'x_1_0': 'bd', 'x_1_1': 'cd'}. Best is trial 63 with value: 0.5.
[I 2024-12-06 23:36:55,609] Trial 148 finished with value: 0.9464285714285714 and parameters: {'x_0_0': 'bd', 'x_0_1': 'oo', 'x_1_0': 'ad', 'x_1_1': 'oo'}. Best is trial 76 with value: 0.5.
2024-12-06 23:36:55,620 - INFO - Candidate Mean Stats: {'Max': np.float64(2.4491547713211137), 'Min': np.float64(-1.0257283249927318), 'Mean': np.float64(0.39449520683445705), 'Std': np.float64(0.5560452132303573)}
2024-12-06 23:36:55,620 - INFO - Candidate Std Stats: {'Max': np.float64(1.6576377048941666), 'Min': np.float64(0.0), 'Mean': np.float64(0.634511034706692), 'Std': np.float64(0.290013451068853)}
[I 2024-12-06 23:36:55,633] Trial 147 finished with value: 1.0714285714285714 and parameters: {'x_0_0': 'ac', 'x_0_1': 'oo', 'x_1_0': 'ac', 'x_1_1': 'bd'}. Best is trial 23 with value: 0.5.
2024-12-06 23:36:55,938 - INFO - Candidate Mean Stats: {'Max': np.float64(2.8137688070456806), 'Min': np.float64(-1.375856545860097), 'Mean': np.float64(0.3857704200211175), 'Std': np.float64(0.5521553948078011)}
2024-12-06 23:36:55,938 - INFO - Candidate Std Stats: {'Max': np.float64(1.5100323645162468), 'Min': np.float64(0.0), 'Mean': np.float64(0.5513707824056928), 'Std': np.float64(0.27080118396007147)}
2024-12-06 23:36:55,944 - INFO - Candidate Mean Stats: {'Max': np.float64(2.339732085182966), 'Min': np.float64(-1.0201751341543333), 'Mean': np.float64(0.41039434881525816), 'Std': np.float64(0.48689337148133094)}
2024-12-06 23:36:55,944 - INFO - Candidate Std Stats: {'Max': np.float64(1.516020692438367), 'Min': np.float64(0.0), 'Mean': np.float64(0.5448476209047651), 'Std': np.float64(0.2654276811013772)}
[I 2024-12-06 23:36:55,952] Trial 149 finished with value: 1.5714285714285714 and parameters: {'x_0_0': 'bc', 'x_0_1': 'bc', 'x_1_0': 'ad', 'x_1_1': 'bd'}. Best is trial 50 with value: 0.6607142857142857.
2024-12-06 23:36:55,956 - INFO - Candidate Mean Stats: {'Max': np.float64(2.8989447525490535), 'Min': np.float64(-1.2040336471543513), 'Mean': np.float64(0.4281444631971434), 'Std': np.float64(0.5605306342777595)}
2024-12-06 23:36:55,956 - INFO - Candidate Std Stats: {'Max': np.float64(1.6106609504571736), 'Min': np.float64(0.0), 'Mean': np.float64(0.6239632880277629), 'Std': np.float64(0.2942724116617785)}
[I 2024-12-06 23:36:55,958] Trial 149 finished with value: 0.6964285714285714 and parameters: {'x_0_0': 'ac', 'x_0_1': 'oo', 'x_1_0': 'oo', 'x_1_1': 'oo'}. Best is trial 63 with value: 0.5.
[I 2024-12-06 23:36:55,969] Trial 149 finished with value: 1.0714285714285714 and parameters: {'x_0_0': 'ac', 'x_0_1': 'oo', 'x_1_0': 'ac', 'x_1_1': 'ad'}. Best is trial 76 with value: 0.5.
2024-12-06 23:36:55,986 - INFO - Candidate Mean Stats: {'Max': np.float64(2.98871632801692), 'Min': np.float64(-0.96845091651627), 'Mean': np.float64(0.4376192755801519), 'Std': np.float64(0.5430304639985146)}
2024-12-06 23:36:55,986 - INFO - Candidate Std Stats: {'Max': np.float64(1.5972913556495538), 'Min': np.float64(0.0), 'Mean': np.float64(0.5808020879984145), 'Std': np.float64(0.278009186526105)}
[I 2024-12-06 23:36:55,999] Trial 148 finished with value: 1.0 and parameters: {'x_0_0': 'oo', 'x_0_1': 'oo', 'x_1_0': 'oo', 'x_1_1': 'oo'}. Best is trial 23 with value: 0.5.
2024-12-06 23:36:56,298 - INFO - Candidate Mean Stats: {'Max': np.float64(2.6410705970909722), 'Min': np.float64(-1.056930703412352), 'Mean': np.float64(0.45837663306005033), 'Std': np.float64(0.5434500917718654)}
2024-12-06 23:36:56,298 - INFO - Candidate Std Stats: {'Max': np.float64(1.4335370257791098), 'Min': np.float64(0.0), 'Mean': np.float64(0.5568275045509312), 'Std': np.float64(0.2689486851516547)}
[I 2024-12-06 23:36:56,311] Trial 150 finished with value: 0.9285714285714286 and parameters: {'x_0_0': 'ad', 'x_0_1': 'oo', 'x_1_0': 'ab', 'x_1_1': 'bc'}. Best is trial 50 with value: 0.6607142857142857.
2024-12-06 23:36:56,314 - INFO - Candidate Mean Stats: {'Max': np.float64(2.231788589370999), 'Min': np.float64(-0.8456342117786683), 'Mean': np.float64(0.4233890518267847), 'Std': np.float64(0.4894333382054547)}
2024-12-06 23:36:56,315 - INFO - Candidate Std Stats: {'Max': np.float64(1.589523412190542), 'Min': np.float64(0.0), 'Mean': np.float64(0.555645904342278), 'Std': np.float64(0.2679984500078198)}
2024-12-06 23:36:56,317 - INFO - Candidate Mean Stats: {'Max': np.float64(2.969986425360946), 'Min': np.float64(-1.234734645917877), 'Mean': np.float64(0.3533837805040021), 'Std': np.float64(0.5597017795477168)}
2024-12-06 23:36:56,317 - INFO - Candidate Std Stats: {'Max': np.float64(1.6429880260450263), 'Min': np.float64(0.0), 'Mean': np.float64(0.6216913018711012), 'Std': np.float64(0.30036460231572515)}
[I 2024-12-06 23:36:56,327] Trial 150 finished with value: 0.6428571428571428 and parameters: {'x_0_0': 'ad', 'x_0_1': 'oo', 'x_1_0': 'bc', 'x_1_1': 'ab'}. Best is trial 63 with value: 0.5.
[I 2024-12-06 23:36:56,330] Trial 150 finished with value: 1.0714285714285714 and parameters: {'x_0_0': 'ac', 'x_0_1': 'oo', 'x_1_0': 'bd', 'x_1_1': 'cd'}. Best is trial 76 with value: 0.5.
2024-12-06 23:36:56,345 - INFO - Candidate Mean Stats: {'Max': np.float64(3.0447490291706214), 'Min': np.float64(-1.0826319100014605), 'Mean': np.float64(0.43700521100693945), 'Std': np.float64(0.5143048305761385)}
2024-12-06 23:36:56,345 - INFO - Candidate Std Stats: {'Max': np.float64(1.9233768124115798), 'Min': np.float64(0.0), 'Mean': np.float64(0.6159318352486196), 'Std': np.float64(0.28953553798546494)}
[I 2024-12-06 23:36:56,358] Trial 149 finished with value: 0.9285714285714286 and parameters: {'x_0_0': 'bd', 'x_0_1': 'oo', 'x_1_0': 'ab', 'x_1_1': 'ad'}. Best is trial 23 with value: 0.5.
2024-12-06 23:36:56,658 - INFO - Candidate Mean Stats: {'Max': np.float64(2.789684911418965), 'Min': np.float64(-1.1430820973848976), 'Mean': np.float64(0.4619345368624645), 'Std': np.float64(0.5363199465099364)}
2024-12-06 23:36:56,658 - INFO - Candidate Std Stats: {'Max': np.float64(1.9492026365065136), 'Min': np.float64(0.0), 'Mean': np.float64(0.5805788707102794), 'Std': np.float64(0.2841140725221722)}
[I 2024-12-06 23:36:56,671] Trial 151 finished with value: 0.8214285714285714 and parameters: {'x_0_0': 'ac', 'x_0_1': 'oo', 'x_1_0': 'oo', 'x_1_1': 'ac'}. Best is trial 50 with value: 0.6607142857142857.
2024-12-06 23:36:56,673 - INFO - Candidate Mean Stats: {'Max': np.float64(2.7508940112733353), 'Min': np.float64(-1.2018387985938654), 'Mean': np.float64(0.3787085674278865), 'Std': np.float64(0.5357205490551381)}
2024-12-06 23:36:56,674 - INFO - Candidate Std Stats: {'Max': np.float64(1.610953836390986), 'Min': np.float64(0.0), 'Mean': np.float64(0.5697032173034808), 'Std': np.float64(0.2784133387852536)}
2024-12-06 23:36:56,679 - INFO - Candidate Mean Stats: {'Max': np.float64(2.973656080252953), 'Min': np.float64(-1.2175831000483615), 'Mean': np.float64(0.3744776707176016), 'Std': np.float64(0.5738778182531741)}
2024-12-06 23:36:56,679 - INFO - Candidate Std Stats: {'Max': np.float64(1.7603537476295874), 'Min': np.float64(0.0), 'Mean': np.float64(0.6860882680475542), 'Std': np.float64(0.31308399521413643)}
[I 2024-12-06 23:36:56,688] Trial 151 finished with value: 1.0714285714285714 and parameters: {'x_0_0': 'bc', 'x_0_1': 'oo', 'x_1_0': 'bc', 'x_1_1': 'ac'}. Best is trial 63 with value: 0.5.
[I 2024-12-06 23:36:56,691] Trial 151 finished with value: 1.0714285714285714 and parameters: {'x_0_0': 'bd', 'x_0_1': 'oo', 'x_1_0': 'ac', 'x_1_1': 'cd'}. Best is trial 76 with value: 0.5.
2024-12-06 23:36:56,707 - INFO - Candidate Mean Stats: {'Max': np.float64(3.1495933982202553), 'Min': np.float64(-1.2274235863283587), 'Mean': np.float64(0.44879565169604246), 'Std': np.float64(0.5704426468547767)}
2024-12-06 23:36:56,707 - INFO - Candidate Std Stats: {'Max': np.float64(1.6364769151579137), 'Min': np.float64(0.0), 'Mean': np.float64(0.6637975423584477), 'Std': np.float64(0.3114733060913127)}
