[I 2024-12-07 00:43:12,716] Trial 163 finished with value: 1.4555555555555555 and parameters: {'x_0_0': 'ad', 'x_0_1': 'ab', 'x_0_2': 'oo', 'x_1_0': 'ab', 'x_1_1': 'cd', 'x_1_2': 'bd'}. Best is trial 49 with value: 0.7999999999999999.
2024-12-07 00:43:13,228 - INFO - Candidate Mean Stats: {'Max': np.float64(2.0), 'Min': np.float64(0.26558065322896773), 'Mean': np.float64(0.49466241979668907), 'Std': np.float64(0.07456177745560716)}
2024-12-07 00:43:13,229 - INFO - Candidate Std Stats: {'Max': np.float64(1.025185693737358), 'Min': np.float64(0.0), 'Mean': np.float64(0.1140633610522968), 'Std': np.float64(0.05019174481384368)}
[I 2024-12-07 00:43:13,271] Trial 163 finished with value: 1.5777777777777777 and parameters: {'x_0_0': 'ab', 'x_0_1': 'ac', 'x_0_2': 'bd', 'x_1_0': 'oo', 'x_1_1': 'bd', 'x_1_2': 'bc'}. Best is trial 148 with value: 0.8333333333333333.
2024-12-07 00:43:20,700 - INFO - Candidate Mean Stats: {'Max': np.float64(2.0), 'Min': np.float64(0.25598170812660587), 'Mean': np.float64(0.49168112323654617), 'Std': np.float64(0.06905399859073479)}
2024-12-07 00:43:20,700 - INFO - Candidate Std Stats: {'Max': np.float64(2.0145267186973466), 'Min': np.float64(0.0), 'Mean': np.float64(0.0946893631032169), 'Std': np.float64(0.04647134806511571)}
[I 2024-12-07 00:43:20,743] Trial 163 finished with value: 1.3777777777777778 and parameters: {'x_0_0': 'ab', 'x_0_1': 'oo', 'x_0_2': 'bd', 'x_1_0': 'bd', 'x_1_1': 'ab', 'x_1_2': 'ad'}. Best is trial 118 with value: 0.8666666666666667.
2024-12-07 00:43:28,065 - INFO - Candidate Mean Stats: {'Max': np.float64(2.0), 'Min': np.float64(0.25092543835229036), 'Mean': np.float64(0.4910223193147285), 'Std': np.float64(0.0699189111329741)}
2024-12-07 00:43:28,066 - INFO - Candidate Std Stats: {'Max': np.float64(0.5877429547301577), 'Min': np.float64(0.0), 'Mean': np.float64(0.10576924023557949), 'Std': np.float64(0.04768824683000949)}
[I 2024-12-07 00:43:28,109] Trial 163 finished with value: 1.1222222222222222 and parameters: {'x_0_0': 'bc', 'x_0_1': 'ac', 'x_0_2': 'ac', 'x_1_0': 'ab', 'x_1_1': 'oo', 'x_1_2': 'bc'}. Best is trial 74 with value: 0.8222222222222222.
2024-12-07 00:43:32,754 - INFO - Candidate Mean Stats: {'Max': np.float64(2.0), 'Min': np.float64(0.25955945243506967), 'Mean': np.float64(0.4862287839012805), 'Std': np.float64(0.07207143118297922)}
2024-12-07 00:43:32,754 - INFO - Candidate Std Stats: {'Max': np.float64(0.43945018183123213), 'Min': np.float64(0.0), 'Mean': np.float64(0.11221346382761208), 'Std': np.float64(0.04596185129914658)}
[I 2024-12-07 00:43:32,796] Trial 164 finished with value: 1.5555555555555556 and parameters: {'x_0_0': 'ac', 'x_0_1': 'ab', 'x_0_2': 'ab', 'x_1_0': 'bd', 'x_1_1': 'ac', 'x_1_2': 'ab'}. Best is trial 49 with value: 0.7999999999999999.
2024-12-07 00:43:33,100 - INFO - Candidate Mean Stats: {'Max': np.float64(2.0), 'Min': np.float64(0.24026031733961178), 'Mean': np.float64(0.48758666319431565), 'Std': np.float64(0.0710555389667467)}
2024-12-07 00:43:33,100 - INFO - Candidate Std Stats: {'Max': np.float64(0.49180271301430056), 'Min': np.float64(0.0), 'Mean': np.float64(0.11013785772139527), 'Std': np.float64(0.048489438068482854)}
[I 2024-12-07 00:43:33,143] Trial 164 finished with value: 1.3 and parameters: {'x_0_0': 'oo', 'x_0_1': 'oo', 'x_0_2': 'ad', 'x_1_0': 'oo', 'x_1_1': 'bc', 'x_1_2': 'bc'}. Best is trial 148 with value: 0.8333333333333333.
2024-12-07 00:43:40,741 - INFO - Candidate Mean Stats: {'Max': np.float64(2.0), 'Min': np.float64(0.2504226515674879), 'Mean': np.float64(0.49035251891572296), 'Std': np.float64(0.06668075635850979)}
2024-12-07 00:43:40,742 - INFO - Candidate Std Stats: {'Max': np.float64(0.44494243908045794), 'Min': np.float64(0.0), 'Mean': np.float64(0.10186198586579144), 'Std': np.float64(0.043993120869524525)}
[I 2024-12-07 00:43:40,784] Trial 164 finished with value: 1.2777777777777777 and parameters: {'x_0_0': 'ab', 'x_0_1': 'oo', 'x_0_2': 'ab', 'x_1_0': 'cd', 'x_1_1': 'oo', 'x_1_2': 'ac'}. Best is trial 118 with value: 0.8666666666666667.
2024-12-07 00:43:48,323 - INFO - Candidate Mean Stats: {'Max': np.float64(2.0), 'Min': np.float64(0.1369253022637375), 'Mean': np.float64(0.4851835804769359), 'Std': np.float64(0.07370324533149371)}
2024-12-07 00:43:48,324 - INFO - Candidate Std Stats: {'Max': np.float64(0.38068717168517996), 'Min': np.float64(0.0), 'Mean': np.float64(0.10979303832744922), 'Std': np.float64(0.046575062468767685)}
[I 2024-12-07 00:43:48,366] Trial 164 finished with value: 1.2444444444444445 and parameters: {'x_0_0': 'ac', 'x_0_1': 'ad', 'x_0_2': 'ad', 'x_1_0': 'bc', 'x_1_1': 'oo', 'x_1_2': 'oo'}. Best is trial 74 with value: 0.8222222222222222.
2024-12-07 00:43:52,647 - INFO - Candidate Mean Stats: {'Max': np.float64(2.0), 'Min': np.float64(0.2537586578866877), 'Mean': np.float64(0.4920075329568496), 'Std': np.float64(0.06904044770387455)}
2024-12-07 00:43:52,648 - INFO - Candidate Std Stats: {'Max': np.float64(0.8160989183273998), 'Min': np.float64(0.0), 'Mean': np.float64(0.10713930242561077), 'Std': np.float64(0.04688188923159284)}
[I 2024-12-07 00:43:52,689] Trial 165 finished with value: 1.5666666666666667 and parameters: {'x_0_0': 'bc', 'x_0_1': 'bc', 'x_0_2': 'bc', 'x_1_0': 'cd', 'x_1_1': 'bc', 'x_1_2': 'oo'}. Best is trial 49 with value: 0.7999999999999999.
2024-12-07 00:43:53,183 - INFO - Candidate Mean Stats: {'Max': np.float64(2.0), 'Min': np.float64(0.27678439369816504), 'Mean': np.float64(0.4943578541278243), 'Std': np.float64(0.07048593408792729)}
2024-12-07 00:43:53,184 - INFO - Candidate Std Stats: {'Max': np.float64(0.5106275067008147), 'Min': np.float64(0.0), 'Mean': np.float64(0.1070309905560746), 'Std': np.float64(0.04291532627319967)}
[I 2024-12-07 00:43:53,227] Trial 165 finished with value: 1.2222222222222223 and parameters: {'x_0_0': 'ac', 'x_0_1': 'ad', 'x_0_2': 'ab', 'x_1_0': 'cd', 'x_1_1': 'bd', 'x_1_2': 'bd'}. Best is trial 148 with value: 0.8333333333333333.
2024-12-07 00:44:00,571 - INFO - Candidate Mean Stats: {'Max': np.float64(2.0), 'Min': np.float64(0.2754885466394771), 'Mean': np.float64(0.5033209979526416), 'Std': np.float64(0.07349954041948079)}
2024-12-07 00:44:00,571 - INFO - Candidate Std Stats: {'Max': np.float64(1.1019163405457182), 'Min': np.float64(0.0), 'Mean': np.float64(0.11641246849224715), 'Std': np.float64(0.05738412176351492)}
[I 2024-12-07 00:44:00,613] Trial 165 finished with value: 1.1666666666666665 and parameters: {'x_0_0': 'bc', 'x_0_1': 'oo', 'x_0_2': 'oo', 'x_1_0': 'ab', 'x_1_1': 'ab', 'x_1_2': 'bc'}. Best is trial 118 with value: 0.8666666666666667.
2024-12-07 00:44:08,192 - INFO - Candidate Mean Stats: {'Max': np.float64(2.0), 'Min': np.float64(0.30949397834824277), 'Mean': np.float64(0.4939166665183285), 'Std': np.float64(0.06753587738870663)}
2024-12-07 00:44:08,192 - INFO - Candidate Std Stats: {'Max': np.float64(0.5911896716195962), 'Min': np.float64(0.0), 'Mean': np.float64(0.09994855344400655), 'Std': np.float64(0.04283636831301363)}
[I 2024-12-07 00:44:08,236] Trial 165 finished with value: 1.5666666666666664 and parameters: {'x_0_0': 'ac', 'x_0_1': 'bd', 'x_0_2': 'oo', 'x_1_0': 'ac', 'x_1_1': 'cd', 'x_1_2': 'cd'}. Best is trial 74 with value: 0.8222222222222222.
2024-12-07 00:44:12,746 - INFO - Candidate Mean Stats: {'Max': np.float64(2.0), 'Min': np.float64(0.2664704456002789), 'Mean': np.float64(0.48170886054316664), 'Std': np.float64(0.07151884769929216)}
2024-12-07 00:44:12,747 - INFO - Candidate Std Stats: {'Max': np.float64(1.3412880106595377), 'Min': np.float64(0.0), 'Mean': np.float64(0.1106017947131672), 'Std': np.float64(0.05506687037700315)}
[I 2024-12-07 00:44:12,789] Trial 166 finished with value: 1.7999999999999998 and parameters: {'x_0_0': 'cd', 'x_0_1': 'ad', 'x_0_2': 'ad', 'x_1_0': 'oo', 'x_1_1': 'cd', 'x_1_2': 'cd'}. Best is trial 49 with value: 0.7999999999999999.
2024-12-07 00:44:13,043 - INFO - Candidate Mean Stats: {'Max': np.float64(2.0), 'Min': np.float64(0.29979709732162074), 'Mean': np.float64(0.4878426278353877), 'Std': np.float64(0.06634043792479954)}
2024-12-07 00:44:13,044 - INFO - Candidate Std Stats: {'Max': np.float64(0.3906896125037886), 'Min': np.float64(0.0), 'Mean': np.float64(0.09727646083323489), 'Std': np.float64(0.041174972240795665)}
[I 2024-12-07 00:44:13,086] Trial 166 finished with value: 0.8999999999999999 and parameters: {'x_0_0': 'bd', 'x_0_1': 'bd', 'x_0_2': 'oo', 'x_1_0': 'bc', 'x_1_1': 'ac', 'x_1_2': 'ac'}. Best is trial 148 with value: 0.8333333333333333.
2024-12-07 00:44:20,440 - INFO - Candidate Mean Stats: {'Max': np.float64(2.0), 'Min': np.float64(0.2606204992388876), 'Mean': np.float64(0.48730252790686274), 'Std': np.float64(0.07077652497008291)}
2024-12-07 00:44:20,440 - INFO - Candidate Std Stats: {'Max': np.float64(0.47856983350591886), 'Min': np.float64(0.0), 'Mean': np.float64(0.10601643156540032), 'Std': np.float64(0.04459768567562622)}
[I 2024-12-07 00:44:20,481] Trial 166 finished with value: 1.3666666666666667 and parameters: {'x_0_0': 'bd', 'x_0_1': 'bd', 'x_0_2': 'cd', 'x_1_0': 'oo', 'x_1_1': 'ab', 'x_1_2': 'oo'}. Best is trial 118 with value: 0.8666666666666667.
2024-12-07 00:44:28,229 - INFO - Candidate Mean Stats: {'Max': np.float64(2.0), 'Min': np.float64(0.28235534857749534), 'Mean': np.float64(0.4978133503624633), 'Std': np.float64(0.07310991218181782)}
2024-12-07 00:44:28,229 - INFO - Candidate Std Stats: {'Max': np.float64(0.5709168990490523), 'Min': np.float64(0.0), 'Mean': np.float64(0.10692036034268268), 'Std': np.float64(0.04520771146513888)}
[I 2024-12-07 00:44:28,270] Trial 166 finished with value: 1.7 and parameters: {'x_0_0': 'cd', 'x_0_1': 'bd', 'x_0_2': 'oo', 'x_1_0': 'oo', 'x_1_1': 'ab', 'x_1_2': 'cd'}. Best is trial 74 with value: 0.8222222222222222.
2024-12-07 00:44:32,997 - INFO - Candidate Mean Stats: {'Max': np.float64(2.0), 'Min': np.float64(0.27008143255821276), 'Mean': np.float64(0.4920322945077737), 'Std': np.float64(0.0732284817186699)}
2024-12-07 00:44:32,998 - INFO - Candidate Std Stats: {'Max': np.float64(0.5588357035229494), 'Min': np.float64(0.0), 'Mean': np.float64(0.10580875320641912), 'Std': np.float64(0.04677019577517854)}
[I 2024-12-07 00:44:33,045] Trial 167 finished with value: 2.0 and parameters: {'x_0_0': 'cd', 'x_0_1': 'ad', 'x_0_2': 'ac', 'x_1_0': 'ab', 'x_1_1': 'ac', 'x_1_2': 'ac'}. Best is trial 49 with value: 0.7999999999999999.
2024-12-07 00:44:33,129 - INFO - Candidate Mean Stats: {'Max': np.float64(2.0), 'Min': np.float64(0.24626252490280304), 'Mean': np.float64(0.4997299195591898), 'Std': np.float64(0.07249229886170269)}
2024-12-07 00:44:33,130 - INFO - Candidate Std Stats: {'Max': np.float64(0.5584267403895975), 'Min': np.float64(0.0), 'Mean': np.float64(0.10238028780725719), 'Std': np.float64(0.04586713962051611)}
[I 2024-12-07 00:44:33,173] Trial 167 finished with value: 1.6666666666666665 and parameters: {'x_0_0': 'ac', 'x_0_1': 'bd', 'x_0_2': 'bd', 'x_1_0': 'ad', 'x_1_1': 'ad', 'x_1_2': 'ad'}. Best is trial 148 with value: 0.8333333333333333.
2024-12-07 00:44:40,576 - INFO - Candidate Mean Stats: {'Max': np.float64(2.0), 'Min': np.float64(0.270674484750177), 'Mean': np.float64(0.48285737711679294), 'Std': np.float64(0.06622766866686139)}
2024-12-07 00:44:40,577 - INFO - Candidate Std Stats: {'Max': np.float64(0.34313321083293463), 'Min': np.float64(0.0), 'Mean': np.float64(0.10772329700238864), 'Std': np.float64(0.04134120829483306)}
[I 2024-12-07 00:44:40,619] Trial 167 finished with value: 1.3444444444444443 and parameters: {'x_0_0': 'bd', 'x_0_1': 'ac', 'x_0_2': 'oo', 'x_1_0': 'bc', 'x_1_1': 'bc', 'x_1_2': 'ad'}. Best is trial 118 with value: 0.8666666666666667.
2024-12-07 00:44:48,286 - INFO - Candidate Mean Stats: {'Max': np.float64(2.0), 'Min': np.float64(0.28185175118345995), 'Mean': np.float64(0.4900120285452081), 'Std': np.float64(0.07048131154308387)}
2024-12-07 00:44:48,287 - INFO - Candidate Std Stats: {'Max': np.float64(0.8266041702550658), 'Min': np.float64(0.0), 'Mean': np.float64(0.10978748693979852), 'Std': np.float64(0.04645269810659803)}
[I 2024-12-07 00:44:48,331] Trial 167 finished with value: 1.5777777777777777 and parameters: {'x_0_0': 'ab', 'x_0_1': 'ac', 'x_0_2': 'oo', 'x_1_0': 'ac', 'x_1_1': 'oo', 'x_1_2': 'ad'}. Best is trial 74 with value: 0.8222222222222222.
2024-12-07 00:44:53,249 - INFO - Candidate Mean Stats: {'Max': np.float64(2.0), 'Min': np.float64(0.2823944262953055), 'Mean': np.float64(0.48443937675271953), 'Std': np.float64(0.07093478039161256)}
2024-12-07 00:44:53,250 - INFO - Candidate Std Stats: {'Max': np.float64(0.3931248893634293), 'Min': np.float64(0.0), 'Mean': np.float64(0.10528906677885229), 'Std': np.float64(0.044029357495555886)}
[I 2024-12-07 00:44:53,292] Trial 168 finished with value: 1.7000000000000002 and parameters: {'x_0_0': 'oo', 'x_0_1': 'bd', 'x_0_2': 'oo', 'x_1_0': 'bd', 'x_1_1': 'ac', 'x_1_2': 'oo'}. Best is trial 148 with value: 0.8333333333333333.
2024-12-07 00:44:53,295 - INFO - Candidate Mean Stats: {'Max': np.float64(2.0), 'Min': np.float64(0.2617839906904551), 'Mean': np.float64(0.4921722403270575), 'Std': np.float64(0.07097368535891742)}
2024-12-07 00:44:53,295 - INFO - Candidate Std Stats: {'Max': np.float64(0.6429805332233031), 'Min': np.float64(0.0), 'Mean': np.float64(0.10635343620536117), 'Std': np.float64(0.04597277298965789)}
[I 2024-12-07 00:44:53,335] Trial 168 finished with value: 1.1666666666666665 and parameters: {'x_0_0': 'ac', 'x_0_1': 'oo', 'x_0_2': 'oo', 'x_1_0': 'bd', 'x_1_1': 'ac', 'x_1_2': 'bc'}. Best is trial 49 with value: 0.7999999999999999.
2024-12-07 00:45:00,611 - INFO - Candidate Mean Stats: {'Max': np.float64(2.0), 'Min': np.float64(0.299074580071106), 'Mean': np.float64(0.49110879380426775), 'Std': np.float64(0.06821503175836305)}
2024-12-07 00:45:00,611 - INFO - Candidate Std Stats: {'Max': np.float64(0.4235941659164796), 'Min': np.float64(0.0), 'Mean': np.float64(0.09811830950052339), 'Std': np.float64(0.04129720309743682)}
[I 2024-12-07 00:45:00,654] Trial 168 finished with value: 1.4666666666666666 and parameters: {'x_0_0': 'ad', 'x_0_1': 'cd', 'x_0_2': 'bc', 'x_1_0': 'oo', 'x_1_1': 'ab', 'x_1_2': 'bd'}. Best is trial 118 with value: 0.8666666666666667.
2024-12-07 00:45:08,373 - INFO - Candidate Mean Stats: {'Max': np.float64(2.0), 'Min': np.float64(0.25744905463339557), 'Mean': np.float64(0.48755057007053615), 'Std': np.float64(0.06716100686521848)}
2024-12-07 00:45:08,373 - INFO - Candidate Std Stats: {'Max': np.float64(0.37707576691945305), 'Min': np.float64(0.0), 'Mean': np.float64(0.09995968381663145), 'Std': np.float64(0.041152924544200775)}
[I 2024-12-07 00:45:08,417] Trial 168 finished with value: 1.2222222222222223 and parameters: {'x_0_0': 'ac', 'x_0_1': 'ac', 'x_0_2': 'ac', 'x_1_0': 'ad', 'x_1_1': 'bd', 'x_1_2': 'ad'}. Best is trial 74 with value: 0.8222222222222222.
2024-12-07 00:45:13,253 - INFO - Candidate Mean Stats: {'Max': np.float64(2.0), 'Min': np.float64(0.23305391629625832), 'Mean': np.float64(0.48270582235818243), 'Std': np.float64(0.07820649568028096)}
2024-12-07 00:45:13,254 - INFO - Candidate Std Stats: {'Max': np.float64(0.91146896646958), 'Min': np.float64(0.0), 'Mean': np.float64(0.11716370609699872), 'Std': np.float64(0.05179741747108414)}
[I 2024-12-07 00:45:13,295] Trial 169 finished with value: 1.2555555555555555 and parameters: {'x_0_0': 'ac', 'x_0_1': 'ab', 'x_0_2': 'oo', 'x_1_0': 'oo', 'x_1_1': 'ac', 'x_1_2': 'ac'}. Best is trial 49 with value: 0.7999999999999999.
2024-12-07 00:45:13,447 - INFO - Candidate Mean Stats: {'Max': np.float64(2.0), 'Min': np.float64(0.17141660481067592), 'Mean': np.float64(0.4853282881627688), 'Std': np.float64(0.07361217640730708)}
2024-12-07 00:45:13,447 - INFO - Candidate Std Stats: {'Max': np.float64(0.38260313514938726), 'Min': np.float64(0.0), 'Mean': np.float64(0.10106062799627975), 'Std': np.float64(0.04252245435853387)}
[I 2024-12-07 00:45:13,486] Trial 169 finished with value: 1.4555555555555555 and parameters: {'x_0_0': 'bd', 'x_0_1': 'ab', 'x_0_2': 'oo', 'x_1_0': 'ab', 'x_1_1': 'ad', 'x_1_2': 'cd'}. Best is trial 148 with value: 0.8333333333333333.
2024-12-07 00:45:20,655 - INFO - Candidate Mean Stats: {'Max': np.float64(2.0), 'Min': np.float64(0.21412726375366442), 'Mean': np.float64(0.4819277435247389), 'Std': np.float64(0.06951782818758535)}
2024-12-07 00:45:20,655 - INFO - Candidate Std Stats: {'Max': np.float64(0.397550041625282), 'Min': np.float64(0.0), 'Mean': np.float64(0.10803277597792706), 'Std': np.float64(0.04536240026617505)}
[I 2024-12-07 00:45:20,697] Trial 169 finished with value: 1.1666666666666665 and parameters: {'x_0_0': 'ac', 'x_0_1': 'oo', 'x_0_2': 'cd', 'x_1_0': 'cd', 'x_1_1': 'cd', 'x_1_2': 'oo'}. Best is trial 118 with value: 0.8666666666666667.
2024-12-07 00:45:28,659 - INFO - Candidate Mean Stats: {'Max': np.float64(2.0), 'Min': np.float64(0.2731422693673167), 'Mean': np.float64(0.48545154844644445), 'Std': np.float64(0.07188027295949409)}
2024-12-07 00:45:28,660 - INFO - Candidate Std Stats: {'Max': np.float64(1.385577189777809), 'Min': np.float64(0.0), 'Mean': np.float64(0.10495454858138585), 'Std': np.float64(0.05514513768715459)}
[I 2024-12-07 00:45:28,702] Trial 169 finished with value: 1.1666666666666665 and parameters: {'x_0_0': 'ac', 'x_0_1': 'oo', 'x_0_2': 'bc', 'x_1_0': 'ac', 'x_1_1': 'oo', 'x_1_2': 'bc'}. Best is trial 74 with value: 0.8222222222222222.
2024-12-07 00:45:32,008 - INFO - Candidate Mean Stats: {'Max': np.float64(2.0), 'Min': np.float64(0.22882832185493016), 'Mean': np.float64(0.48653409564211514), 'Std': np.float64(0.07661952124918527)}
2024-12-07 00:45:32,009 - INFO - Candidate Std Stats: {'Max': np.float64(1.569156211672487), 'Min': np.float64(0.0), 'Mean': np.float64(0.11556222946029368), 'Std': np.float64(0.06088087581293825)}
[I 2024-12-07 00:45:32,051] Trial 170 finished with value: 1.6666666666666665 and parameters: {'x_0_0': 'bc', 'x_0_1': 'bd', 'x_0_2': 'ab', 'x_1_0': 'cd', 'x_1_1': 'cd', 'x_1_2': 'bd'}. Best is trial 148 with value: 0.8333333333333333.
2024-12-07 00:45:33,430 - INFO - Candidate Mean Stats: {'Max': np.float64(2.0), 'Min': np.float64(0.2567676344015648), 'Mean': np.float64(0.4843286255807995), 'Std': np.float64(0.0696872351108173)}
2024-12-07 00:45:33,431 - INFO - Candidate Std Stats: {'Max': np.float64(0.6406901761781502), 'Min': np.float64(0.0), 'Mean': np.float64(0.10825106526998017), 'Std': np.float64(0.04502886059624153)}
[I 2024-12-07 00:45:33,473] Trial 170 finished with value: 1.3666666666666667 and parameters: {'x_0_0': 'ac', 'x_0_1': 'bd', 'x_0_2': 'bc', 'x_1_0': 'oo', 'x_1_1': 'oo', 'x_1_2': 'ac'}. Best is trial 49 with value: 0.7999999999999999.
2024-12-07 00:45:40,876 - INFO - Candidate Mean Stats: {'Max': np.float64(2.0), 'Min': np.float64(0.23825462370460476), 'Mean': np.float64(0.49057978991115936), 'Std': np.float64(0.07308935881916649)}
2024-12-07 00:45:40,877 - INFO - Candidate Std Stats: {'Max': np.float64(0.4708191403784917), 'Min': np.float64(0.0), 'Mean': np.float64(0.10851513208536807), 'Std': np.float64(0.04890782048302177)}
[I 2024-12-07 00:45:40,917] Trial 170 finished with value: 1.4 and parameters: {'x_0_0': 'cd', 'x_0_1': 'oo', 'x_0_2': 'ad', 'x_1_0': 'oo', 'x_1_1': 'ac', 'x_1_2': 'bd'}. Best is trial 118 with value: 0.8666666666666667.
2024-12-07 00:45:48,577 - INFO - Candidate Mean Stats: {'Max': np.float64(2.0), 'Min': np.float64(0.27396327335376347), 'Mean': np.float64(0.4920404762457117), 'Std': np.float64(0.068359416289138)}
2024-12-07 00:45:48,577 - INFO - Candidate Std Stats: {'Max': np.float64(0.4980844889192539), 'Min': np.float64(0.0), 'Mean': np.float64(0.10924284387835298), 'Std': np.float64(0.048187282223904164)}
[I 2024-12-07 00:45:48,622] Trial 170 finished with value: 1.1222222222222222 and parameters: {'x_0_0': 'bd', 'x_0_1': 'ad', 'x_0_2': 'bd', 'x_1_0': 'bc', 'x_1_1': 'ad', 'x_1_2': 'oo'}. Best is trial 74 with value: 0.8222222222222222.
2024-12-07 00:45:52,060 - INFO - Candidate Mean Stats: {'Max': np.float64(2.0), 'Min': np.float64(0.24767599536639), 'Mean': np.float64(0.49743007636223385), 'Std': np.float64(0.07498716715081377)}
2024-12-07 00:45:52,060 - INFO - Candidate Std Stats: {'Max': np.float64(0.41940156765784076), 'Min': np.float64(0.0), 'Mean': np.float64(0.10129981112854781), 'Std': np.float64(0.0433765148360628)}
[I 2024-12-07 00:45:52,102] Trial 171 finished with value: 1.5666666666666667 and parameters: {'x_0_0': 'ad', 'x_0_1': 'bc', 'x_0_2': 'cd', 'x_1_0': 'ad', 'x_1_1': 'bd', 'x_1_2': 'oo'}. Best is trial 148 with value: 0.8333333333333333.
2024-12-07 00:45:53,459 - INFO - Candidate Mean Stats: {'Max': np.float64(2.0), 'Min': np.float64(0.289660153335724), 'Mean': np.float64(0.4869181443991335), 'Std': np.float64(0.06728658856896959)}
2024-12-07 00:45:53,459 - INFO - Candidate Std Stats: {'Max': np.float64(0.34412723419459273), 'Min': np.float64(0.0), 'Mean': np.float64(0.10274246669072075), 'Std': np.float64(0.04249023333575872)}
[I 2024-12-07 00:45:53,501] Trial 171 finished with value: 1.5666666666666667 and parameters: {'x_0_0': 'ac', 'x_0_1': 'cd', 'x_0_2': 'ad', 'x_1_0': 'ab', 'x_1_1': 'oo', 'x_1_2': 'bc'}. Best is trial 49 with value: 0.7999999999999999.
2024-12-07 00:46:00,837 - INFO - Candidate Mean Stats: {'Max': np.float64(2.0), 'Min': np.float64(0.16894476586506899), 'Mean': np.float64(0.4870021364611014), 'Std': np.float64(0.07480633195865154)}
2024-12-07 00:46:00,837 - INFO - Candidate Std Stats: {'Max': np.float64(0.5743448865480026), 'Min': np.float64(0.0), 'Mean': np.float64(0.10867129988934393), 'Std': np.float64(0.04624152963894936)}
