[I 2024-12-07 00:40:17,082] Trial 154 finished with value: 1.9 and parameters: {'x_0_0': 'cd', 'x_0_1': 'ac', 'x_0_2': 'ab', 'x_1_0': 'bd', 'x_1_1': 'ab', 'x_1_2': 'oo'}. Best is trial 118 with value: 0.8666666666666667.
2024-12-07 00:40:25,096 - INFO - Candidate Mean Stats: {'Max': np.float64(2.0), 'Min': np.float64(0.30454729405517417), 'Mean': np.float64(0.4903296181873188), 'Std': np.float64(0.06587625172259787)}
2024-12-07 00:40:25,097 - INFO - Candidate Std Stats: {'Max': np.float64(0.5359260247841454), 'Min': np.float64(0.0), 'Mean': np.float64(0.10343898802866755), 'Std': np.float64(0.0442106463586354)}
[I 2024-12-07 00:40:25,141] Trial 154 finished with value: 1.4444444444444444 and parameters: {'x_0_0': 'bc', 'x_0_1': 'ac', 'x_0_2': 'cd', 'x_1_0': 'bd', 'x_1_1': 'ab', 'x_1_2': 'bc'}. Best is trial 74 with value: 0.8222222222222222.
2024-12-07 00:40:30,847 - INFO - Candidate Mean Stats: {'Max': np.float64(2.0), 'Min': np.float64(0.2605003654749075), 'Mean': np.float64(0.4971182922378914), 'Std': np.float64(0.06879170565734948)}
2024-12-07 00:40:30,848 - INFO - Candidate Std Stats: {'Max': np.float64(0.43136363657389754), 'Min': np.float64(0.0), 'Mean': np.float64(0.10540349950500935), 'Std': np.float64(0.04361395490497753)}
[I 2024-12-07 00:40:30,893] Trial 155 finished with value: 1.4666666666666668 and parameters: {'x_0_0': 'ac', 'x_0_1': 'bc', 'x_0_2': 'ac', 'x_1_0': 'bd', 'x_1_1': 'oo', 'x_1_2': 'oo'}. Best is trial 49 with value: 0.7999999999999999.
2024-12-07 00:40:31,078 - INFO - Candidate Mean Stats: {'Max': np.float64(2.0), 'Min': np.float64(0.29340458762407906), 'Mean': np.float64(0.4945507169801148), 'Std': np.float64(0.0649806667292529)}
2024-12-07 00:40:31,079 - INFO - Candidate Std Stats: {'Max': np.float64(0.47545400428935775), 'Min': np.float64(0.0), 'Mean': np.float64(0.10951767596326854), 'Std': np.float64(0.044793279447583885)}
[I 2024-12-07 00:40:31,121] Trial 155 finished with value: 1.6666666666666665 and parameters: {'x_0_0': 'bc', 'x_0_1': 'cd', 'x_0_2': 'bd', 'x_1_0': 'ac', 'x_1_1': 'bc', 'x_1_2': 'ab'}. Best is trial 148 with value: 0.8333333333333333.
2024-12-07 00:40:37,279 - INFO - Candidate Mean Stats: {'Max': np.float64(2.0), 'Min': np.float64(0.2529021495463695), 'Mean': np.float64(0.4978916840939865), 'Std': np.float64(0.06948102515942382)}
2024-12-07 00:40:37,281 - INFO - Candidate Std Stats: {'Max': np.float64(0.42067951894111494), 'Min': np.float64(0.0), 'Mean': np.float64(0.09652729618163733), 'Std': np.float64(0.04072860383522279)}
[I 2024-12-07 00:40:37,321] Trial 155 finished with value: 1.7777777777777777 and parameters: {'x_0_0': 'ab', 'x_0_1': 'bd', 'x_0_2': 'bd', 'x_1_0': 'cd', 'x_1_1': 'ac', 'x_1_2': 'ad'}. Best is trial 118 with value: 0.8666666666666667.
2024-12-07 00:40:45,381 - INFO - Candidate Mean Stats: {'Max': np.float64(2.0), 'Min': np.float64(0.23826347462034284), 'Mean': np.float64(0.49174094752724096), 'Std': np.float64(0.06863136038572128)}
2024-12-07 00:40:45,382 - INFO - Candidate Std Stats: {'Max': np.float64(0.8219626507539611), 'Min': np.float64(0.0), 'Mean': np.float64(0.10562584001011056), 'Std': np.float64(0.051092926544333984)}
[I 2024-12-07 00:40:45,425] Trial 155 finished with value: 1.2222222222222223 and parameters: {'x_0_0': 'ac', 'x_0_1': 'ac', 'x_0_2': 'ad', 'x_1_0': 'ab', 'x_1_1': 'bd', 'x_1_2': 'ac'}. Best is trial 74 with value: 0.8222222222222222.
2024-12-07 00:40:50,787 - INFO - Candidate Mean Stats: {'Max': np.float64(2.0), 'Min': np.float64(0.199871005820453), 'Mean': np.float64(0.4876382635684661), 'Std': np.float64(0.07027757394615934)}
2024-12-07 00:40:50,787 - INFO - Candidate Std Stats: {'Max': np.float64(0.4547377366219692), 'Min': np.float64(0.0), 'Mean': np.float64(0.11080611310725243), 'Std': np.float64(0.0488933262076451)}
[I 2024-12-07 00:40:50,832] Trial 156 finished with value: 1.7 and parameters: {'x_0_0': 'oo', 'x_0_1': 'cd', 'x_0_2': 'bd', 'x_1_0': 'oo', 'x_1_1': 'ab', 'x_1_2': 'bc'}. Best is trial 49 with value: 0.7999999999999999.
2024-12-07 00:40:51,145 - INFO - Candidate Mean Stats: {'Max': np.float64(2.0), 'Min': np.float64(0.234263075375571), 'Mean': np.float64(0.4867633391702941), 'Std': np.float64(0.07431804822756943)}
2024-12-07 00:40:51,146 - INFO - Candidate Std Stats: {'Max': np.float64(0.7998765414057312), 'Min': np.float64(0.0), 'Mean': np.float64(0.11643406296162044), 'Std': np.float64(0.054884554570007835)}
[I 2024-12-07 00:40:51,191] Trial 156 finished with value: 1.4444444444444444 and parameters: {'x_0_0': 'bc', 'x_0_1': 'ad', 'x_0_2': 'bd', 'x_1_0': 'ab', 'x_1_1': 'cd', 'x_1_2': 'ad'}. Best is trial 148 with value: 0.8333333333333333.
2024-12-07 00:40:57,437 - INFO - Candidate Mean Stats: {'Max': np.float64(2.0), 'Min': np.float64(0.2818500875635349), 'Mean': np.float64(0.48683084015019695), 'Std': np.float64(0.06765818414856994)}
2024-12-07 00:40:57,437 - INFO - Candidate Std Stats: {'Max': np.float64(0.5100578465283381), 'Min': np.float64(0.0), 'Mean': np.float64(0.10200847676091168), 'Std': np.float64(0.04395908352952174)}
[I 2024-12-07 00:40:57,482] Trial 156 finished with value: 1.2666666666666666 and parameters: {'x_0_0': 'bd', 'x_0_1': 'bd', 'x_0_2': 'oo', 'x_1_0': 'oo', 'x_1_1': 'bd', 'x_1_2': 'oo'}. Best is trial 118 with value: 0.8666666666666667.
2024-12-07 00:41:05,575 - INFO - Candidate Mean Stats: {'Max': np.float64(2.0), 'Min': np.float64(0.10767658062120092), 'Mean': np.float64(0.4961099422966903), 'Std': np.float64(0.07194950867101056)}
2024-12-07 00:41:05,576 - INFO - Candidate Std Stats: {'Max': np.float64(0.8471376928838628), 'Min': np.float64(0.0), 'Mean': np.float64(0.10624904280392113), 'Std': np.float64(0.05044970049707688)}
[I 2024-12-07 00:41:05,619] Trial 156 finished with value: 1.577777777777778 and parameters: {'x_0_0': 'ab', 'x_0_1': 'bd', 'x_0_2': 'ab', 'x_1_0': 'ab', 'x_1_1': 'oo', 'x_1_2': 'oo'}. Best is trial 74 with value: 0.8222222222222222.
2024-12-07 00:41:11,059 - INFO - Candidate Mean Stats: {'Max': np.float64(2.0), 'Min': np.float64(0.1728171231443128), 'Mean': np.float64(0.49568158641979837), 'Std': np.float64(0.07322613399572289)}
2024-12-07 00:41:11,059 - INFO - Candidate Std Stats: {'Max': np.float64(0.5247088453231774), 'Min': np.float64(0.0), 'Mean': np.float64(0.10696937732592476), 'Std': np.float64(0.04688632705121137)}
[I 2024-12-07 00:41:11,102] Trial 157 finished with value: 0.9666666666666667 and parameters: {'x_0_0': 'ac', 'x_0_1': 'oo', 'x_0_2': 'bd', 'x_1_0': 'oo', 'x_1_1': 'ac', 'x_1_2': 'oo'}. Best is trial 49 with value: 0.7999999999999999.
2024-12-07 00:41:11,520 - INFO - Candidate Mean Stats: {'Max': np.float64(2.0), 'Min': np.float64(0.27286584635422295), 'Mean': np.float64(0.4794419010025334), 'Std': np.float64(0.07097149252886416)}
2024-12-07 00:41:11,521 - INFO - Candidate Std Stats: {'Max': np.float64(0.4474260287088384), 'Min': np.float64(0.0), 'Mean': np.float64(0.1074026861695147), 'Std': np.float64(0.04643248876408341)}
[I 2024-12-07 00:41:11,563] Trial 157 finished with value: 1.5555555555555556 and parameters: {'x_0_0': 'ad', 'x_0_1': 'bd', 'x_0_2': 'ac', 'x_1_0': 'ab', 'x_1_1': 'bc', 'x_1_2': 'bd'}. Best is trial 148 with value: 0.8333333333333333.
2024-12-07 00:41:17,926 - INFO - Candidate Mean Stats: {'Max': np.float64(2.0), 'Min': np.float64(0.21604989711107275), 'Mean': np.float64(0.48211993345876697), 'Std': np.float64(0.07425657977326014)}
2024-12-07 00:41:17,927 - INFO - Candidate Std Stats: {'Max': np.float64(1.3529097184692094), 'Min': np.float64(0.0), 'Mean': np.float64(0.10956311668378507), 'Std': np.float64(0.05444645492551213)}
[I 2024-12-07 00:41:17,971] Trial 157 finished with value: 1.5666666666666667 and parameters: {'x_0_0': 'ad', 'x_0_1': 'bd', 'x_0_2': 'ac', 'x_1_0': 'ac', 'x_1_1': 'ac', 'x_1_2': 'oo'}. Best is trial 118 with value: 0.8666666666666667.
2024-12-07 00:41:25,960 - INFO - Candidate Mean Stats: {'Max': np.float64(2.0), 'Min': np.float64(0.30766882028582754), 'Mean': np.float64(0.4981945289416091), 'Std': np.float64(0.06372186556050545)}
2024-12-07 00:41:25,961 - INFO - Candidate Std Stats: {'Max': np.float64(0.44984588816902793), 'Min': np.float64(0.0), 'Mean': np.float64(0.10053106183629122), 'Std': np.float64(0.04072413431829984)}
[I 2024-12-07 00:41:26,005] Trial 157 finished with value: 1.7777777777777777 and parameters: {'x_0_0': 'ab', 'x_0_1': 'cd', 'x_0_2': 'ab', 'x_1_0': 'ab', 'x_1_1': 'ad', 'x_1_2': 'ac'}. Best is trial 74 with value: 0.8222222222222222.
2024-12-07 00:41:31,311 - INFO - Candidate Mean Stats: {'Max': np.float64(2.0), 'Min': np.float64(0.2614926635711492), 'Mean': np.float64(0.4885400658867344), 'Std': np.float64(0.0649468615819507)}
2024-12-07 00:41:31,311 - INFO - Candidate Std Stats: {'Max': np.float64(0.8967226292419346), 'Min': np.float64(0.0), 'Mean': np.float64(0.09447162082242226), 'Std': np.float64(0.04161194680016126)}
[I 2024-12-07 00:41:31,356] Trial 158 finished with value: 1.4666666666666666 and parameters: {'x_0_0': 'bc', 'x_0_1': 'bd', 'x_0_2': 'cd', 'x_1_0': 'oo', 'x_1_1': 'ac', 'x_1_2': 'cd'}. Best is trial 49 with value: 0.7999999999999999.
2024-12-07 00:41:31,946 - INFO - Candidate Mean Stats: {'Max': np.float64(2.0), 'Min': np.float64(0.2681812798245068), 'Mean': np.float64(0.48771144644849895), 'Std': np.float64(0.07272776564936488)}
2024-12-07 00:41:31,947 - INFO - Candidate Std Stats: {'Max': np.float64(0.47350917601092196), 'Min': np.float64(0.0), 'Mean': np.float64(0.09590945573533537), 'Std': np.float64(0.04048576863563486)}
[I 2024-12-07 00:41:31,990] Trial 158 finished with value: 1.3444444444444446 and parameters: {'x_0_0': 'bc', 'x_0_1': 'ad', 'x_0_2': 'ad', 'x_1_0': 'bd', 'x_1_1': 'ac', 'x_1_2': 'oo'}. Best is trial 148 with value: 0.8333333333333333.
2024-12-07 00:41:38,275 - INFO - Candidate Mean Stats: {'Max': np.float64(2.0), 'Min': np.float64(0.22389223848374903), 'Mean': np.float64(0.48438243352462124), 'Std': np.float64(0.07758757587587137)}
2024-12-07 00:41:38,276 - INFO - Candidate Std Stats: {'Max': np.float64(0.695051510752676), 'Min': np.float64(0.0), 'Mean': np.float64(0.11905769345074166), 'Std': np.float64(0.05312062592843895)}
[I 2024-12-07 00:41:38,317] Trial 158 finished with value: 1.1666666666666665 and parameters: {'x_0_0': 'bc', 'x_0_1': 'oo', 'x_0_2': 'ad', 'x_1_0': 'ab', 'x_1_1': 'bd', 'x_1_2': 'oo'}. Best is trial 118 with value: 0.8666666666666667.
2024-12-07 00:41:46,231 - INFO - Candidate Mean Stats: {'Max': np.float64(2.0), 'Min': np.float64(0.2771043984549678), 'Mean': np.float64(0.48987761197343843), 'Std': np.float64(0.07015157415774328)}
2024-12-07 00:41:46,231 - INFO - Candidate Std Stats: {'Max': np.float64(1.3793061856037039), 'Min': np.float64(0.0), 'Mean': np.float64(0.11341813775525214), 'Std': np.float64(0.05389622858767849)}
[I 2024-12-07 00:41:46,274] Trial 158 finished with value: 1.6666666666666665 and parameters: {'x_0_0': 'ac', 'x_0_1': 'bc', 'x_0_2': 'bd', 'x_1_0': 'bd', 'x_1_1': 'ab', 'x_1_2': 'bd'}. Best is trial 74 with value: 0.8222222222222222.
2024-12-07 00:41:51,431 - INFO - Candidate Mean Stats: {'Max': np.float64(2.0), 'Min': np.float64(0.2785822600235061), 'Mean': np.float64(0.49021086914005135), 'Std': np.float64(0.0726544328457683)}
2024-12-07 00:41:51,431 - INFO - Candidate Std Stats: {'Max': np.float64(0.8973007132398833), 'Min': np.float64(0.0), 'Mean': np.float64(0.11137374601101575), 'Std': np.float64(0.04846964293250454)}
[I 2024-12-07 00:41:51,475] Trial 159 finished with value: 1.3444444444444443 and parameters: {'x_0_0': 'bd', 'x_0_1': 'bd', 'x_0_2': 'oo', 'x_1_0': 'bd', 'x_1_1': 'cd', 'x_1_2': 'bd'}. Best is trial 49 with value: 0.7999999999999999.
2024-12-07 00:41:52,168 - INFO - Candidate Mean Stats: {'Max': np.float64(2.0), 'Min': np.float64(0.292000976129045), 'Mean': np.float64(0.4916933511539237), 'Std': np.float64(0.06717454585570377)}
2024-12-07 00:41:52,168 - INFO - Candidate Std Stats: {'Max': np.float64(1.8962709040736234), 'Min': np.float64(0.0), 'Mean': np.float64(0.10335375846402081), 'Std': np.float64(0.047820129746696916)}
[I 2024-12-07 00:41:52,212] Trial 159 finished with value: 1.8 and parameters: {'x_0_0': 'oo', 'x_0_1': 'ad', 'x_0_2': 'oo', 'x_1_0': 'ab', 'x_1_1': 'bc', 'x_1_2': 'ac'}. Best is trial 148 with value: 0.8333333333333333.
2024-12-07 00:41:58,614 - INFO - Candidate Mean Stats: {'Max': np.float64(2.0), 'Min': np.float64(0.002549867284998386), 'Mean': np.float64(0.48398127540197994), 'Std': np.float64(0.07410733028526752)}
2024-12-07 00:41:58,614 - INFO - Candidate Std Stats: {'Max': np.float64(0.7515263130120764), 'Min': np.float64(0.0), 'Mean': np.float64(0.11333952637917365), 'Std': np.float64(0.05475268828638443)}
[I 2024-12-07 00:41:58,658] Trial 159 finished with value: 1.5666666666666664 and parameters: {'x_0_0': 'bd', 'x_0_1': 'ac', 'x_0_2': 'oo', 'x_1_0': 'cd', 'x_1_1': 'bd', 'x_1_2': 'bd'}. Best is trial 118 with value: 0.8666666666666667.
2024-12-07 00:42:06,468 - INFO - Candidate Mean Stats: {'Max': np.float64(2.0), 'Min': np.float64(0.22734947802716787), 'Mean': np.float64(0.4893303600456799), 'Std': np.float64(0.0754111211500045)}
2024-12-07 00:42:06,468 - INFO - Candidate Std Stats: {'Max': np.float64(0.4717504976700465), 'Min': np.float64(0.0), 'Mean': np.float64(0.11035598647040216), 'Std': np.float64(0.047416548294340485)}
[I 2024-12-07 00:42:06,509] Trial 159 finished with value: 1.6666666666666665 and parameters: {'x_0_0': 'bc', 'x_0_1': 'cd', 'x_0_2': 'ad', 'x_1_0': 'cd', 'x_1_1': 'ac', 'x_1_2': 'ab'}. Best is trial 74 with value: 0.8222222222222222.
2024-12-07 00:42:11,750 - INFO - Candidate Mean Stats: {'Max': np.float64(2.0), 'Min': np.float64(0.2513989887229411), 'Mean': np.float64(0.4925765599039889), 'Std': np.float64(0.07137701497153022)}
2024-12-07 00:42:11,751 - INFO - Candidate Std Stats: {'Max': np.float64(0.3936042598732451), 'Min': np.float64(0.0), 'Mean': np.float64(0.10715779665322962), 'Std': np.float64(0.04444543491154429)}
[I 2024-12-07 00:42:11,794] Trial 160 finished with value: 1.0444444444444443 and parameters: {'x_0_0': 'ac', 'x_0_1': 'ac', 'x_0_2': 'oo', 'x_1_0': 'oo', 'x_1_1': 'cd', 'x_1_2': 'oo'}. Best is trial 49 with value: 0.7999999999999999.
2024-12-07 00:42:12,462 - INFO - Candidate Mean Stats: {'Max': np.float64(2.0), 'Min': np.float64(0.2660876275900216), 'Mean': np.float64(0.49071281436277675), 'Std': np.float64(0.07115140357713604)}
2024-12-07 00:42:12,462 - INFO - Candidate Std Stats: {'Max': np.float64(1.0187980477516503), 'Min': np.float64(0.0), 'Mean': np.float64(0.10628813116973204), 'Std': np.float64(0.04688566552014969)}
[I 2024-12-07 00:42:12,505] Trial 160 finished with value: 1.1666666666666665 and parameters: {'x_0_0': 'bd', 'x_0_1': 'oo', 'x_0_2': 'oo', 'x_1_0': 'cd', 'x_1_1': 'cd', 'x_1_2': 'ad'}. Best is trial 148 with value: 0.8333333333333333.
2024-12-07 00:42:18,887 - INFO - Candidate Mean Stats: {'Max': np.float64(2.0), 'Min': np.float64(0.24975963808987994), 'Mean': np.float64(0.4918764660775742), 'Std': np.float64(0.07688409735822406)}
2024-12-07 00:42:18,887 - INFO - Candidate Std Stats: {'Max': np.float64(1.2656645852124224), 'Min': np.float64(0.0), 'Mean': np.float64(0.11414392867763215), 'Std': np.float64(0.059773988699444745)}
[I 2024-12-07 00:42:18,929] Trial 160 finished with value: 1.6666666666666665 and parameters: {'x_0_0': 'ad', 'x_0_1': 'cd', 'x_0_2': 'bd', 'x_1_0': 'ac', 'x_1_1': 'cd', 'x_1_2': 'cd'}. Best is trial 118 with value: 0.8666666666666667.
2024-12-07 00:42:26,807 - INFO - Candidate Mean Stats: {'Max': np.float64(2.0), 'Min': np.float64(0.1675967373340703), 'Mean': np.float64(0.48366075448883816), 'Std': np.float64(0.07134633585899947)}
2024-12-07 00:42:26,808 - INFO - Candidate Std Stats: {'Max': np.float64(1.3561222494829), 'Min': np.float64(0.0), 'Mean': np.float64(0.11016390156831693), 'Std': np.float64(0.05653975915729824)}
[I 2024-12-07 00:42:26,853] Trial 160 finished with value: 1.3444444444444443 and parameters: {'x_0_0': 'bd', 'x_0_1': 'ad', 'x_0_2': 'oo', 'x_1_0': 'bd', 'x_1_1': 'bd', 'x_1_2': 'cd'}. Best is trial 74 with value: 0.8222222222222222.
2024-12-07 00:42:31,901 - INFO - Candidate Mean Stats: {'Max': np.float64(2.0), 'Min': np.float64(0.09072983375830775), 'Mean': np.float64(0.48840220958812736), 'Std': np.float64(0.0788945927584762)}
2024-12-07 00:42:31,901 - INFO - Candidate Std Stats: {'Max': np.float64(1.6488602930480136), 'Min': np.float64(0.0), 'Mean': np.float64(0.11422554080787432), 'Std': np.float64(0.06207928132616828)}
[I 2024-12-07 00:42:31,951] Trial 161 finished with value: 1.0 and parameters: {'x_0_0': 'bc', 'x_0_1': 'ad', 'x_0_2': 'bd', 'x_1_0': 'ac', 'x_1_1': 'bc', 'x_1_2': 'ad'}. Best is trial 49 with value: 0.7999999999999999.
2024-12-07 00:42:32,634 - INFO - Candidate Mean Stats: {'Max': np.float64(2.0), 'Min': np.float64(0.2777667625216037), 'Mean': np.float64(0.48328940682874044), 'Std': np.float64(0.07552608436129986)}
2024-12-07 00:42:32,634 - INFO - Candidate Std Stats: {'Max': np.float64(0.38773820347294097), 'Min': np.float64(0.0), 'Mean': np.float64(0.10277174222984196), 'Std': np.float64(0.04292207213834435)}
[I 2024-12-07 00:42:32,676] Trial 161 finished with value: 1.5555555555555556 and parameters: {'x_0_0': 'ad', 'x_0_1': 'ad', 'x_0_2': 'bc', 'x_1_0': 'ab', 'x_1_1': 'ac', 'x_1_2': 'ac'}. Best is trial 148 with value: 0.8333333333333333.
2024-12-07 00:42:39,399 - INFO - Candidate Mean Stats: {'Max': np.float64(2.0), 'Min': np.float64(0.2125038263027231), 'Mean': np.float64(0.4879209916488242), 'Std': np.float64(0.07290110410348002)}
2024-12-07 00:42:39,401 - INFO - Candidate Std Stats: {'Max': np.float64(0.4448971911496889), 'Min': np.float64(0.0), 'Mean': np.float64(0.1061790248999081), 'Std': np.float64(0.04679147790481666)}
[I 2024-12-07 00:42:39,443] Trial 161 finished with value: 1.1222222222222222 and parameters: {'x_0_0': 'bd', 'x_0_1': 'ac', 'x_0_2': 'ad', 'x_1_0': 'bc', 'x_1_1': 'ad', 'x_1_2': 'oo'}. Best is trial 118 with value: 0.8666666666666667.
2024-12-07 00:42:47,731 - INFO - Candidate Mean Stats: {'Max': np.float64(2.0), 'Min': np.float64(0.2731402741813247), 'Mean': np.float64(0.48939578887397206), 'Std': np.float64(0.06988648596956064)}
2024-12-07 00:42:47,731 - INFO - Candidate Std Stats: {'Max': np.float64(0.5628804423920655), 'Min': np.float64(0.0), 'Mean': np.float64(0.1068049793253659), 'Std': np.float64(0.04671540934728884)}
[I 2024-12-07 00:42:47,775] Trial 161 finished with value: 1.2222222222222223 and parameters: {'x_0_0': 'bc', 'x_0_1': 'ac', 'x_0_2': 'ac', 'x_1_0': 'cd', 'x_1_1': 'ab', 'x_1_2': 'ab'}. Best is trial 74 with value: 0.8222222222222222.
2024-12-07 00:42:52,706 - INFO - Candidate Mean Stats: {'Max': np.float64(2.0), 'Min': np.float64(0.25338281525876327), 'Mean': np.float64(0.4931577306308507), 'Std': np.float64(0.06628293984766159)}
2024-12-07 00:42:52,707 - INFO - Candidate Std Stats: {'Max': np.float64(1.0085777181888451), 'Min': np.float64(0.0), 'Mean': np.float64(0.10464298516325043), 'Std': np.float64(0.048355395277685974)}
[I 2024-12-07 00:42:52,750] Trial 162 finished with value: 1.5555555555555556 and parameters: {'x_0_0': 'ac', 'x_0_1': 'ab', 'x_0_2': 'cd', 'x_1_0': 'bc', 'x_1_1': 'ac', 'x_1_2': 'ab'}. Best is trial 49 with value: 0.7999999999999999.
2024-12-07 00:42:53,254 - INFO - Candidate Mean Stats: {'Max': np.float64(2.0), 'Min': np.float64(0.23669471771715153), 'Mean': np.float64(0.4866725431114437), 'Std': np.float64(0.07365894002572958)}
2024-12-07 00:42:53,254 - INFO - Candidate Std Stats: {'Max': np.float64(0.4421649514725071), 'Min': np.float64(0.0), 'Mean': np.float64(0.09674016538081096), 'Std': np.float64(0.040838564899974436)}
[I 2024-12-07 00:42:53,296] Trial 162 finished with value: 1.1666666666666665 and parameters: {'x_0_0': 'bc', 'x_0_1': 'oo', 'x_0_2': 'oo', 'x_1_0': 'ac', 'x_1_1': 'cd', 'x_1_2': 'bc'}. Best is trial 148 with value: 0.8333333333333333.
2024-12-07 00:43:00,402 - INFO - Candidate Mean Stats: {'Max': np.float64(2.0), 'Min': np.float64(0.2220981979058841), 'Mean': np.float64(0.4848485115140543), 'Std': np.float64(0.07609045853185777)}
2024-12-07 00:43:00,402 - INFO - Candidate Std Stats: {'Max': np.float64(1.7676598789260025), 'Min': np.float64(0.0), 'Mean': np.float64(0.10902584409243478), 'Std': np.float64(0.05114115776882638)}
[I 2024-12-07 00:43:00,445] Trial 162 finished with value: 1.6666666666666665 and parameters: {'x_0_0': 'ac', 'x_0_1': 'cd', 'x_0_2': 'bd', 'x_1_0': 'bd', 'x_1_1': 'ad', 'x_1_2': 'bc'}. Best is trial 118 with value: 0.8666666666666667.
2024-12-07 00:43:07,783 - INFO - Candidate Mean Stats: {'Max': np.float64(2.0), 'Min': np.float64(0.27074171368399624), 'Mean': np.float64(0.48890985092009764), 'Std': np.float64(0.07278652735774135)}
2024-12-07 00:43:07,783 - INFO - Candidate Std Stats: {'Max': np.float64(0.7528994105805638), 'Min': np.float64(0.0), 'Mean': np.float64(0.10831103004746678), 'Std': np.float64(0.04767278879847368)}
[I 2024-12-07 00:43:07,826] Trial 162 finished with value: 1.6666666666666665 and parameters: {'x_0_0': 'bc', 'x_0_1': 'bd', 'x_0_2': 'ad', 'x_1_0': 'ab', 'x_1_1': 'ab', 'x_1_2': 'ac'}. Best is trial 74 with value: 0.8222222222222222.
2024-12-07 00:43:12,676 - INFO - Candidate Mean Stats: {'Max': np.float64(2.0), 'Min': np.float64(0.28729196998172435), 'Mean': np.float64(0.48315616304380626), 'Std': np.float64(0.06706490640939537)}
2024-12-07 00:43:12,676 - INFO - Candidate Std Stats: {'Max': np.float64(0.34084562876463975), 'Min': np.float64(0.0), 'Mean': np.float64(0.10039884285141368), 'Std': np.float64(0.03993347428922407)}
