[I 2024-12-28 14:58:57,230] Trial 46 finished with value: 2.0 and parameters: {'x_0_0': 'cd', 'x_0_1': 'cd', 'x_1_0': 'bd', 'x_1_1': 'ab'}. Best is trial 1 with value: 1.0.
Loaded from prev state!
Loaded from prev state!
Loaded from prev state!
Loaded from prev state!
Loaded from prev state!
Loaded from prev state!
Loaded from prev state!
Loaded from prev state!
Loaded from prev state!
Loaded from prev state!
Loaded from prev state!
Loaded from prev state!
Loaded from prev state!
Loaded from prev state!
Loaded from prev state!
Loaded from prev state!
Loaded from prev state!
Loaded from prev state!
Loaded from prev state!
Loaded from prev state!
Loaded from prev state!
Loaded from prev state!
Loaded from prev state!
Loaded from prev state!
Loaded from prev state!
Loaded from prev state!
Loaded from prev state!
Loaded from prev state!
Loaded from prev state!
Loaded from prev state!
Loaded from prev state!
Loaded from prev state!
Loaded from prev state!
Loaded from prev state!
Loaded from prev state!
Loaded from prev state!
Loaded from prev state!
Loaded from prev state!
Loaded from prev state!
Loaded from prev state!
Loaded from prev state!
Loaded from prev state!
Loaded from prev state!
Loaded from prev state!
Loaded from prev state!
Loaded from prev state!
Loaded from prev state!
Loaded from prev state!
Loaded from prev state!
Loaded from prev state!
Loaded from prev state!
Loaded from prev state!
Loaded from prev state!
Loaded from prev state!
Loaded from prev state!
Loaded from prev state!
Loaded from prev state!
Loaded from prev state!
Loaded from prev state!
Loaded from prev state!
Loaded from prev state!
Loaded from prev state!
Loaded from prev state!
Loaded from prev state!
Loaded from prev state!
Loaded from prev state!
Loaded from prev state!
Loaded from prev state!
Loaded from prev state!
Loaded from prev state!
Loaded from prev state!
Loaded from prev state!
Loaded from prev state!
Loaded from prev state!
Loaded from prev state!
Loaded from prev state!
Loaded from prev state!
Loaded from prev state!
Loaded from prev state!
Loaded from prev state!
Loaded from prev state!
Loaded from prev state!
Loaded from prev state!
Loaded from prev state!
Loaded from prev state!
Loaded from prev state!
Loaded from prev state!
Loaded from prev state!
Loaded from prev state!
Loaded from prev state!
Loaded from prev state!
Loaded from prev state!
Loaded from prev state!
Loaded from prev state!
Loaded from prev state!
Loaded from prev state!
Loaded from prev state!
Loaded from prev state!
Loaded from prev state!
Loaded from prev state!
Loaded from prev state!
Loaded from prev state!
Loaded from prev state!
Loaded from prev state!
Loaded from prev state!
Loaded from prev state!
Loaded from prev state!
Loaded from prev state!
Loaded from prev state!
Loaded from prev state!
Loaded from prev state!
Loaded from prev state!
Loaded from prev state!
Loaded from prev state!
Loaded from prev state!
Loaded from prev state!
Loaded from prev state!
Loaded from prev state!
Loaded from prev state!
Loaded from prev state!
Loaded from prev state!
Loaded from prev state!
Loaded from prev state!
Loaded from prev state!
Loaded from prev state!
Loaded from prev state!
Loaded from prev state!
Loaded from prev state!
Loaded from prev state!
Loaded from prev state!
Loaded from prev state!
Loaded from prev state!
Loaded from prev state!
Loaded from prev state!
Loaded from prev state!
Loaded from prev state!
Loaded from prev state!
Loaded from prev state!
Loaded from prev state!
Loaded from prev state!
Loaded from prev state!
Loaded from prev state!
Loaded from prev state!
Loaded from prev state!
Loaded from prev state!
Loaded from prev state!
Loaded from prev state!
Loaded from prev state!
Loaded from prev state!
Loaded from prev state!
Loaded from prev state!
Loaded from prev state!
Loaded from prev state!
Loaded from prev state!
Loaded from prev state!
Loaded from prev state!
Loaded from prev state!
Loaded from prev state!
Loaded from prev state!
Loaded from prev state!
Loaded from prev state!
Loaded from prev state!
Loaded from prev state!
Loaded from prev state!
Loaded from prev state!
Loaded from prev state!
Loaded from prev state!
Loaded from prev state!
Loaded from prev state!
Loaded from prev state!
Loaded from prev state!
Loaded from prev state!
Loaded from prev state!
Loaded from prev state!
Loaded from prev state!
Loaded from prev state!
Loaded from prev state!
Loaded from prev state!
Loaded from prev state!
Loaded from prev state!
Loaded from prev state!
Loaded from prev state!
Loaded from prev state!
Loaded from prev state!
Loaded from prev state!
Loaded from prev state!
Loaded from prev state!
Loaded from prev state!
Loaded from prev state!
Loaded from prev state!
Loaded from prev state!
Loaded from prev state!
Loaded from prev state!
Loaded from prev state!
Loaded from prev state!
Loaded from prev state!
Loaded from prev state!
Loaded from prev state!
Loaded from prev state!
Loaded from prev state!
Loaded from prev state!
Loaded from prev state!
Loaded from prev state!
Loaded from prev state!
Loaded from prev state!
Loaded from prev state!
Loaded from prev state!
Loaded from prev state!
Loaded from prev state!
Loaded from prev state!
Loaded from prev state!
Loaded from prev state!
Loaded from prev state!
Loaded from prev state!
Loaded from prev state!
Loaded from prev state!
Loaded from prev state!
Loaded from prev state!
Loaded from prev state!
Loaded from prev state!
Loaded from prev state!
Loaded from prev state!
Loaded from prev state!
Loaded from prev state!
Loaded from prev state!
Loaded from prev state!
Loaded from prev state!
Loaded from prev state!
Loaded from prev state!
Loaded from prev state!
Loaded from prev state!
Loaded from prev state!
Loaded from prev state!
Loaded from prev state!
Loaded from prev state!
Loaded from prev state!
Loaded from prev state!
Loaded from prev state!
Loaded from prev state!
Loaded from prev state!
Loaded from prev state!
Loaded from prev state!
Loaded from prev state!
Loaded from prev state!
Loaded from prev state!
Loaded from prev state!
Loaded from prev state!
Loaded from prev state!
Loaded from prev state!
Loaded from prev state!
Loaded from prev state!
Loaded from prev state!
Loaded from prev state!
Loaded from prev state!
Loaded from prev state!
Loaded from prev state!
Loaded from prev state!
Loaded from prev state!
Loaded from prev state!
Loaded from prev state!
Loaded from prev state!
Loaded from prev state!
Loaded from prev state!
Loaded from prev state!
Loaded from prev state!
Loaded from prev state!
Loaded from prev state!
Loaded from prev state!
Loaded from prev state!
Loaded from prev state!
Loaded from prev state!
Loaded from prev state!
Loaded from prev state!
Loaded from prev state!
Loaded from prev state!
Loaded from prev state!
Loaded from prev state!
Loaded from prev state!
Loaded from prev state!
Loaded from prev state!
Loaded from prev state!
Loaded from prev state!
Loaded from prev state!
Loaded from prev state!
Loaded from prev state!
Loaded from prev state!
Loaded from prev state!
Loaded from prev state!
Loaded from prev state!
Loaded from prev state!
Loaded from prev state!
Loaded from prev state!
Loaded from prev state!
Loaded from prev state!
Loaded from prev state!
Loaded from prev state!
Loaded from prev state!
Loaded from prev state!
Loaded from prev state!
Loaded from prev state!
Loaded from prev state!
Loaded from prev state!
Loaded from prev state!
Loaded from prev state!
Loaded from prev state!
Loaded from prev state!
Loaded from prev state!
Loaded from prev state!
Loaded from prev state!
Loaded from prev state!
Loaded from prev state!
Loaded from prev state!
Loaded from prev state!
Loaded from prev state!
Loaded from prev state!
Loaded from prev state!
Loaded from prev state!
Loaded from prev state!
Loaded from prev state!
Loaded from prev state!
Loaded from prev state!
Loaded from prev state!
Loaded from prev state!
Loaded from prev state!
Loaded from prev state!
Loaded from prev state!
Loaded from prev state!
Loaded from prev state!
Loaded from prev state!
Loaded from prev state!
Loaded from prev state!
Loaded from prev state!
Loaded from prev state!
Loaded from prev state!
Loaded from prev state!
Loaded from prev state!
Loaded from prev state!
Loaded from prev state!
Loaded from prev state!
Loaded from prev state!
Loaded from prev state!
Loaded from prev state![I 2024-12-28 14:58:57,332] Trial 33 finished with value: 1.75 and parameters: {'x_0_0': 'oo', 'x_0_1': 'bd', 'x_1_0': 'bd', 'x_1_1': 'oo'}. Best is trial 3 with value: 0.7857142857142857.
[I 2024-12-28 14:58:57,332] Trial 31 finished with value: 1.5 and parameters: {'x_0_0': 'cd', 'x_0_1': 'oo', 'x_1_0': 'ab', 'x_1_1': 'cd'}. Best is trial 4 with value: 1.0714285714285714.
[I 2024-12-28 14:58:57,403] Trial 46 finished with value: 2.0 and parameters: {'x_0_0': 'cd', 'x_0_1': 'bd', 'x_1_0': 'bc', 'x_1_1': 'ac'}. Best is trial 21 with value: 0.7857142857142857.
[I 2024-12-28 14:58:57,442] Trial 37 finished with value: 1.4464285714285714 and parameters: {'x_0_0': 'ac', 'x_0_1': 'bc', 'x_1_0': 'ab', 'x_1_1': 'oo'}. Best is trial 7 with value: 0.5.
[I 2024-12-28 14:58:57,458] Trial 40 finished with value: 1.0 and parameters: {'x_0_0': 'bd', 'x_0_1': 'bd', 'x_1_0': 'bc', 'x_1_1': 'ac'}. Best is trial 29 with value: 1.0.
[I 2024-12-28 14:58:57,503] Trial 36 finished with value: 1.4464285714285714 and parameters: {'x_0_0': 'ac', 'x_0_1': 'cd', 'x_1_0': 'bc', 'x_1_1': 'oo'}. Best is trial 16 with value: 0.8035714285714286.
[I 2024-12-28 14:58:57,632] Trial 46 finished with value: 1.125 and parameters: {'x_0_0': 'oo', 'x_0_1': 'oo', 'x_1_0': 'oo', 'x_1_1': 'cd'}. Best is trial 17 with value: 0.7857142857142857.
[I 2024-12-28 14:58:57,656] Trial 43 finished with value: 1.5714285714285714 and parameters: {'x_0_0': 'bd', 'x_0_1': 'bc', 'x_1_0': 'cd', 'x_1_1': 'ad'}. Best is trial 17 with value: 0.5.
[I 2024-12-28 14:58:57,724] Trial 47 finished with value: 1.7142857142857144 and parameters: {'x_0_0': 'ab', 'x_0_1': 'ac', 'x_1_0': 'ac', 'x_1_1': 'ad'}. Best is trial 21 with value: 0.7857142857142857.
[I 2024-12-28 14:58:57,736] Trial 37 finished with value: 1.1964285714285714 and parameters: {'x_0_0': 'ac', 'x_0_1': 'bd', 'x_1_0': 'oo', 'x_1_1': 'oo'}. Best is trial 16 with value: 0.8035714285714286.
[I 2024-12-28 14:58:57,757] Trial 32 finished with value: 1.4464285714285714 and parameters: {'x_0_0': 'bd', 'x_0_1': 'ab', 'x_1_0': 'ad', 'x_1_1': 'oo'}. Best is trial 4 with value: 1.0714285714285714.
[I 2024-12-28 14:58:57,775] Trial 34 finished with value: 0.9464285714285714 and parameters: {'x_0_0': 'ac', 'x_0_1': 'oo', 'x_1_0': 'cd', 'x_1_1': 'oo'}. Best is trial 15 with value: 0.6964285714285714.
[I 2024-12-28 14:58:57,961] Trial 38 finished with value: 1.375 and parameters: {'x_0_0': 'oo', 'x_0_1': 'oo', 'x_1_0': 'bc', 'x_1_1': 'ac'}. Best is trial 7 with value: 0.5.
[I 2024-12-28 14:58:57,973] Trial 34 finished with value: 2.0 and parameters: {'x_0_0': 'cd', 'x_0_1': 'ac', 'x_1_0': 'bc', 'x_1_1': 'cd'}. Best is trial 3 with value: 0.7857142857142857.
[I 2024-12-28 14:58:57,985] Trial 41 finished with value: 2.0 and parameters: {'x_0_0': 'cd', 'x_0_1': 'ac', 'x_1_0': 'bd', 'x_1_1': 'ab'}. Best is trial 29 with value: 1.0.
[I 2024-12-28 14:58:58,025] Trial 38 finished with value: 1.5 and parameters: {'x_0_0': 'cd', 'x_0_1': 'oo', 'x_1_0': 'bc', 'x_1_1': 'ac'}. Best is trial 16 with value: 0.8035714285714286.
[I 2024-12-28 14:58:58,041] Trial 33 finished with value: 2.0 and parameters: {'x_0_0': 'cd', 'x_0_1': 'ab', 'x_1_0': 'ac', 'x_1_1': 'ac'}. Best is trial 4 with value: 1.0714285714285714.
[I 2024-12-28 14:58:58,078] Trial 44 finished with value: 1.625 and parameters: {'x_0_0': 'oo', 'x_0_1': 'ac', 'x_1_0': 'oo', 'x_1_1': 'cd'}. Best is trial 17 with value: 0.5.
[I 2024-12-28 14:58:58,105] Trial 48 finished with value: 2.0 and parameters: {'x_0_0': 'cd', 'x_0_1': 'cd', 'x_1_0': 'ac', 'x_1_1': 'bc'}. Best is trial 21 with value: 0.7857142857142857.
[I 2024-12-28 14:58:58,291] Trial 47 finished with value: 1.0714285714285714 and parameters: {'x_0_0': 'bd', 'x_0_1': 'oo', 'x_1_0': 'cd', 'x_1_1': 'bd'}. Best is trial 1 with value: 1.0.
[I 2024-12-28 14:58:58,319] Trial 47 finished with value: 2.0 and parameters: {'x_0_0': 'cd', 'x_0_1': 'bd', 'x_1_0': 'bc', 'x_1_1': 'ac'}. Best is trial 17 with value: 0.7857142857142857.
[I 2024-12-28 14:58:58,334] Trial 39 finished with value: 1.7142857142857144 and parameters: {'x_0_0': 'ab', 'x_0_1': 'bd', 'x_1_0': 'bc', 'x_1_1': 'ab'}. Best is trial 16 with value: 0.8035714285714286.
[I 2024-12-28 14:58:58,353] Trial 35 finished with value: 1.5714285714285714 and parameters: {'x_0_0': 'bc', 'x_0_1': 'bc', 'x_1_0': 'cd', 'x_1_1': 'bd'}. Best is trial 15 with value: 0.6964285714285714.
[I 2024-12-28 14:58:58,414] Trial 42 finished with value: 1.2857142857142856 and parameters: {'x_0_0': 'bd', 'x_0_1': 'ac', 'x_1_0': 'bd', 'x_1_1': 'ac'}. Best is trial 29 with value: 1.0.
[I 2024-12-28 14:58:58,454] Trial 45 finished with value: 2.0 and parameters: {'x_0_0': 'cd', 'x_0_1': 'bd', 'x_1_0': 'ab', 'x_1_1': 'bd'}. Best is trial 17 with value: 0.5.
Loaded from prev state!
Loaded from prev state!
Loaded from prev state!
Loaded from prev state!
Loaded from prev state!
Loaded from prev state!
Loaded from prev state!
Loaded from prev state!
Loaded from prev state!
Loaded from prev state!
Loaded from prev state!
Loaded from prev state!
Loaded from prev state!
Loaded from prev state!
Loaded from prev state!
Loaded from prev state!
Loaded from prev state!
Loaded from prev state!
Loaded from prev state!
Loaded from prev state!
Loaded from prev state!
Loaded from prev state!
Loaded from prev state!
Loaded from prev state!
Loaded from prev state!
Loaded from prev state!
Loaded from prev state!
Loaded from prev state!
Loaded from prev state!
Loaded from prev state!
Loaded from prev state!
Loaded from prev state!
Loaded from prev state!
Loaded from prev state!
Loaded from prev state!
Loaded from prev state!
Loaded from prev state!
Loaded from prev state!
Loaded from prev state!
Loaded from prev state!
Loaded from prev state!
Loaded from prev state!
Loaded from prev state!
Loaded from prev state!
Loaded from prev state!
Loaded from prev state!
Loaded from prev state!
Loaded from prev state!
Loaded from prev state!
Loaded from prev state!
Loaded from prev state!
Loaded from prev state!
Loaded from prev state!
Loaded from prev state!
Loaded from prev state!
Loaded from prev state!
Loaded from prev state!
Loaded from prev state!
Loaded from prev state!
Loaded from prev state!
Loaded from prev state!
Loaded from prev state!
Loaded from prev state!
Loaded from prev state!
Loaded from prev state!
Loaded from prev state!
Loaded from prev state!
Loaded from prev state!
Loaded from prev state!
Loaded from prev state!
Loaded from prev state!
Loaded from prev state!
Loaded from prev state!
Loaded from prev state!
Loaded from prev state!
Loaded from prev state!
Loaded from prev state!
Loaded from prev state!
Loaded from prev state!
Loaded from prev state!
Loaded from prev state!
Loaded from prev state!
Loaded from prev state!
Loaded from prev state!
Loaded from prev state!
Loaded from prev state!
Loaded from prev state!
Loaded from prev state!
Loaded from prev state!
Loaded from prev state!
Loaded from prev state!
Loaded from prev state!
Loaded from prev state!
Loaded from prev state!
Loaded from prev state!
Loaded from prev state!
Loaded from prev state!
Loaded from prev state!
Loaded from prev state!
Loaded from prev state!
Loaded from prev state!
Loaded from prev state!
Loaded from prev state!
Loaded from prev state!
Loaded from prev state!
Loaded from prev state!
Loaded from prev state!
Loaded from prev state!
Loaded from prev state!
Loaded from prev state!
Loaded from prev state!
Loaded from prev state!
Loaded from prev state!
Loaded from prev state!
Loaded from prev state!
Loaded from prev state!
Loaded from prev state!
Loaded from prev state!
Loaded from prev state!
Loaded from prev state!
Loaded from prev state!
Loaded from prev state!
Loaded from prev state!
Loaded from prev state!
Loaded from prev state!
Loaded from prev state!
Loaded from prev state!
Loaded from prev state!
Loaded from prev state!
Loaded from prev state!
Loaded from prev state!
Loaded from prev state!
Loaded from prev state!
Loaded from prev state!
Loaded from prev state!
Loaded from prev state!
Loaded from prev state!
Loaded from prev state!
Loaded from prev state!
Loaded from prev state!
Loaded from prev state!
Loaded from prev state!
Loaded from prev state!
Loaded from prev state!
Loaded from prev state!
Loaded from prev state!
Loaded from prev state!
Loaded from prev state!
Loaded from prev state!
Loaded from prev state!
Loaded from prev state!
Loaded from prev state!
Loaded from prev state!
Loaded from prev state!
Loaded from prev state!
Loaded from prev state!
Loaded from prev state!
Loaded from prev state!
Loaded from prev state!
Loaded from prev state!
Loaded from prev state!
Loaded from prev state!
Loaded from prev state!
Loaded from prev state!
Loaded from prev state!
Loaded from prev state!
Loaded from prev state!
Loaded from prev state!
Loaded from prev state!
Loaded from prev state!
Loaded from prev state!
Loaded from prev state!
Loaded from prev state!
Loaded from prev state!
Loaded from prev state!
Loaded from prev state!
Loaded from prev state!
Loaded from prev state!
Loaded from prev state!
Loaded from prev state!
Loaded from prev state!
Loaded from prev state!
Loaded from prev state!
Loaded from prev state!
Loaded from prev state!
Loaded from prev state!
Loaded from prev state!
Loaded from prev state!
Loaded from prev state!
Loaded from prev state!
Loaded from prev state!
Loaded from prev state!
Loaded from prev state!
Loaded from prev state!
Loaded from prev state!
Loaded from prev state!
Loaded from prev state!
Loaded from prev state!
Loaded from prev state!
Loaded from prev state!
Loaded from prev state!
Loaded from prev state!
Loaded from prev state!
Loaded from prev state!
Loaded from prev state!
Loaded from prev state!
Loaded from prev state!
Loaded from prev state!
Loaded from prev state!
Loaded from prev state!
Loaded from prev state!
Loaded from prev state!
Loaded from prev state!
Loaded from prev state!
Loaded from prev state!
Loaded from prev state!
Loaded from prev state!
Loaded from prev state!
Loaded from prev state!
Loaded from prev state!
Loaded from prev state!
Loaded from prev state!
Loaded from prev state!
Loaded from prev state!
Loaded from prev state!
Loaded from prev state!
Loaded from prev state!
Loaded from prev state!
Loaded from prev state!
Loaded from prev state!
Loaded from prev state!
Loaded from prev state!
Loaded from prev state!
Loaded from prev state!
Loaded from prev state!
Loaded from prev state!
Loaded from prev state!
Loaded from prev state!
Loaded from prev state!
Loaded from prev state!
Loaded from prev state!
Loaded from prev state!
Loaded from prev state!
Loaded from prev state!
Loaded from prev state!
Loaded from prev state!
Loaded from prev state!
Loaded from prev state!
Loaded from prev state!
Loaded from prev state!
Loaded from prev state!
Loaded from prev state!
Loaded from prev state!
Loaded from prev state!
Loaded from prev state!
Loaded from prev state!
Loaded from prev state!
Loaded from prev state!
Loaded from prev state!
Loaded from prev state!
Loaded from prev state!
Loaded from prev state!
Loaded from prev state!
Loaded from prev state!
Loaded from prev state!
Loaded from prev state!
Loaded from prev state!
Loaded from prev state!
Loaded from prev state!
Loaded from prev state!
Loaded from prev state!
Loaded from prev state!
Loaded from prev state!
Loaded from prev state!
Loaded from prev state!
Loaded from prev state!
Loaded from prev state!
Loaded from prev state!
Loaded from prev state!
Loaded from prev state!
Loaded from prev state!
Loaded from prev state!
Loaded from prev state!
Loaded from prev state!
Loaded from prev state!
Loaded from prev state!
Loaded from prev state!
Loaded from prev state!
Loaded from prev state!
Loaded from prev state!
Loaded from prev state!
Loaded from prev state!
Loaded from prev state!
Loaded from prev state!
Loaded from prev state!
Loaded from prev state!
Loaded from prev state!
Loaded from prev state!
Loaded from prev state!
Loaded from prev state!
Loaded from prev state!
Loaded from prev state!
Loaded from prev state!
Loaded from prev state!
Loaded from prev state!
Loaded from prev state!
Loaded from prev state!
Loaded from prev state!
Loaded from prev state!
Loaded from prev state!
Loaded from prev state!
Loaded from prev state!
Loaded from prev state!
Loaded from prev state!
Loaded from prev state!
Loaded from prev state!
Loaded from prev state!
Loaded from prev state!
Loaded from prev state!
Loaded from prev state!
Loaded from prev state!
Loaded from prev state!
Loaded from prev state!
Loaded from prev state!
Loaded from prev state!
Loaded from prev state!
Loaded from prev state!
Loaded from prev state!
Loaded from prev state!
Loaded from prev state!
Loaded from prev state!
Loaded from prev state!
Loaded from prev state!
Loaded from prev state!
Loaded from prev state!
Loaded from prev state!
Loaded from prev state!
Loaded from prev state!
Loaded from prev state!
Loaded from prev state!
Loaded from prev state!
Loaded from prev state![I 2024-12-28 14:58:58,519] Trial 39 finished with value: 2.0 and parameters: {'x_0_0': 'cd', 'x_0_1': 'cd', 'x_1_0': 'ab', 'x_1_1': 'cd'}. Best is trial 7 with value: 0.5.
[I 2024-12-28 14:58:58,528] Trial 34 finished with value: 1.0 and parameters: {'x_0_0': 'ac', 'x_0_1': 'ad', 'x_1_0': 'ad', 'x_1_1': 'bc'}. Best is trial 34 with value: 1.0.
[I 2024-12-28 14:58:58,577] Trial 35 finished with value: 1.2142857142857144 and parameters: {'x_0_0': 'ab', 'x_0_1': 'oo', 'x_1_0': 'ad', 'x_1_1': 'ab'}. Best is trial 3 with value: 0.7857142857142857.
