[I 2024-12-07 01:26:49,308] Trial 291 finished with value: 1.2666666666666666 and parameters: {'x_0_0': 'bc', 'x_0_1': 'oo', 'x_0_2': 'bc', 'x_1_0': 'bd', 'x_1_1': 'ad', 'x_1_2': 'cd'}. Best is trial 148 with value: 0.8333333333333333.
2024-12-07 01:26:50,204 - INFO - Candidate Mean Stats: {'Max': np.float64(2.0), 'Min': np.float64(0.2494006728778675), 'Mean': np.float64(0.48965733016775), 'Std': np.float64(0.07518838221451914)}
2024-12-07 01:26:50,204 - INFO - Candidate Std Stats: {'Max': np.float64(0.4117847002094712), 'Min': np.float64(0.0), 'Mean': np.float64(0.09679663800154614), 'Std': np.float64(0.03977143403735417)}
[I 2024-12-07 01:26:50,245] Trial 290 finished with value: 0.9555555555555556 and parameters: {'x_0_0': 'ad', 'x_0_1': 'oo', 'x_0_2': 'oo', 'x_1_0': 'ab', 'x_1_1': 'oo', 'x_1_2': 'ac'}. Best is trial 200 with value: 0.6.
2024-12-07 01:26:57,621 - INFO - Candidate Mean Stats: {'Max': np.float64(2.0), 'Min': np.float64(0.2522928434926225), 'Mean': np.float64(0.4981202402334906), 'Std': np.float64(0.07449396223835916)}
2024-12-07 01:26:57,622 - INFO - Candidate Std Stats: {'Max': np.float64(0.4793790025245164), 'Min': np.float64(0.0), 'Mean': np.float64(0.10583943613937344), 'Std': np.float64(0.04794996943994072)}
[I 2024-12-07 01:26:57,664] Trial 290 finished with value: 1.1666666666666665 and parameters: {'x_0_0': 'bd', 'x_0_1': 'oo', 'x_0_2': 'ad', 'x_1_0': 'cd', 'x_1_1': 'bc', 'x_1_2': 'oo'}. Best is trial 280 with value: 0.6222222222222222.
2024-12-07 01:26:58,749 - INFO - Candidate Mean Stats: {'Max': np.float64(2.0), 'Min': np.float64(0.24820319244053213), 'Mean': np.float64(0.48952563167446955), 'Std': np.float64(0.08095499918031814)}
2024-12-07 01:26:58,749 - INFO - Candidate Std Stats: {'Max': np.float64(1.8363950898143575), 'Min': np.float64(0.0), 'Mean': np.float64(0.09968803919834424), 'Std': np.float64(0.053398286426188483)}
[I 2024-12-07 01:26:58,793] Trial 291 finished with value: 1.1666666666666665 and parameters: {'x_0_0': 'bc', 'x_0_1': 'oo', 'x_0_2': 'ab', 'x_1_0': 'bc', 'x_1_1': 'bc', 'x_1_2': 'oo'}. Best is trial 49 with value: 0.7999999999999999.
2024-12-07 01:27:10,205 - INFO - Candidate Mean Stats: {'Max': np.float64(2.0), 'Min': np.float64(0.24326271187488507), 'Mean': np.float64(0.48944862487114454), 'Std': np.float64(0.0824779915150875)}
2024-12-07 01:27:10,206 - INFO - Candidate Std Stats: {'Max': np.float64(0.8854350883447872), 'Min': np.float64(0.0), 'Mean': np.float64(0.10242097095362489), 'Std': np.float64(0.05122560726239259)}
[I 2024-12-07 01:27:10,251] Trial 292 finished with value: 1.7777777777777777 and parameters: {'x_0_0': 'ab', 'x_0_1': 'bd', 'x_0_2': 'ab', 'x_1_0': 'bc', 'x_1_1': 'cd', 'x_1_2': 'cd'}. Best is trial 148 with value: 0.8333333333333333.
2024-12-07 01:27:11,253 - INFO - Candidate Mean Stats: {'Max': np.float64(2.0), 'Min': np.float64(0.2686734269332134), 'Mean': np.float64(0.48320803549966046), 'Std': np.float64(0.07966332300836385)}
2024-12-07 01:27:11,254 - INFO - Candidate Std Stats: {'Max': np.float64(1.3046706844961018), 'Min': np.float64(0.0), 'Mean': np.float64(0.10626333002427144), 'Std': np.float64(0.053405644022063076)}
[I 2024-12-07 01:27:11,298] Trial 291 finished with value: 0.9666666666666667 and parameters: {'x_0_0': 'ac', 'x_0_1': 'oo', 'x_0_2': 'cd', 'x_1_0': 'oo', 'x_1_1': 'oo', 'x_1_2': 'cd'}. Best is trial 200 with value: 0.6.
2024-12-07 01:27:18,678 - INFO - Candidate Mean Stats: {'Max': np.float64(2.0), 'Min': np.float64(0.2816108607598834), 'Mean': np.float64(0.49300064908787483), 'Std': np.float64(0.07111896607064283)}
2024-12-07 01:27:18,680 - INFO - Candidate Std Stats: {'Max': np.float64(0.4558134695663342), 'Min': np.float64(0.0), 'Mean': np.float64(0.09889408499230172), 'Std': np.float64(0.04128741249755882)}
[I 2024-12-07 01:27:18,724] Trial 291 finished with value: 1.0666666666666667 and parameters: {'x_0_0': 'ad', 'x_0_1': 'oo', 'x_0_2': 'ad', 'x_1_0': 'oo', 'x_1_1': 'bc', 'x_1_2': 'cd'}. Best is trial 280 with value: 0.6222222222222222.
2024-12-07 01:27:19,861 - INFO - Candidate Mean Stats: {'Max': np.float64(2.0), 'Min': np.float64(0.27146710365219723), 'Mean': np.float64(0.48820066793313516), 'Std': np.float64(0.07856254824973412)}
2024-12-07 01:27:19,861 - INFO - Candidate Std Stats: {'Max': np.float64(0.4334952999459425), 'Min': np.float64(0.0), 'Mean': np.float64(0.1123295810297149), 'Std': np.float64(0.04635180582418977)}
[I 2024-12-07 01:27:19,904] Trial 292 finished with value: 1.5777777777777777 and parameters: {'x_0_0': 'ab', 'x_0_1': 'bd', 'x_0_2': 'oo', 'x_1_0': 'bc', 'x_1_1': 'oo', 'x_1_2': 'cd'}. Best is trial 49 with value: 0.7999999999999999.
2024-12-07 01:27:30,728 - INFO - Candidate Mean Stats: {'Max': np.float64(2.0), 'Min': np.float64(0.2935487108176937), 'Mean': np.float64(0.4977902037366973), 'Std': np.float64(0.08023999230082363)}
2024-12-07 01:27:30,729 - INFO - Candidate Std Stats: {'Max': np.float64(0.6687597750930129), 'Min': np.float64(0.0), 'Mean': np.float64(0.11138915826151663), 'Std': np.float64(0.04702035452065238)}
[I 2024-12-07 01:27:30,771] Trial 293 finished with value: 1.2666666666666666 and parameters: {'x_0_0': 'ac', 'x_0_1': 'oo', 'x_0_2': 'bd', 'x_1_0': 'bc', 'x_1_1': 'bc', 'x_1_2': 'bc'}. Best is trial 148 with value: 0.8333333333333333.
2024-12-07 01:27:32,113 - INFO - Candidate Mean Stats: {'Max': np.float64(2.0), 'Min': np.float64(0.21621649210994637), 'Mean': np.float64(0.4846170129915143), 'Std': np.float64(0.07879237371900874)}
2024-12-07 01:27:32,113 - INFO - Candidate Std Stats: {'Max': np.float64(0.426575841450606), 'Min': np.float64(0.0), 'Mean': np.float64(0.10154571247726829), 'Std': np.float64(0.04290392892492887)}
[I 2024-12-07 01:27:32,155] Trial 292 finished with value: 1.1666666666666665 and parameters: {'x_0_0': 'bd', 'x_0_1': 'oo', 'x_0_2': 'oo', 'x_1_0': 'ad', 'x_1_1': 'bd', 'x_1_2': 'ac'}. Best is trial 200 with value: 0.6.
2024-12-07 01:27:39,424 - INFO - Candidate Mean Stats: {'Max': np.float64(2.0), 'Min': np.float64(0.270273110723369), 'Mean': np.float64(0.4913638794408887), 'Std': np.float64(0.07510653737948876)}
2024-12-07 01:27:39,424 - INFO - Candidate Std Stats: {'Max': np.float64(1.3579165859207336), 'Min': np.float64(0.0), 'Mean': np.float64(0.09929793545222934), 'Std': np.float64(0.04575902395680771)}
[I 2024-12-07 01:27:39,468] Trial 292 finished with value: 1.1444444444444444 and parameters: {'x_0_0': 'bc', 'x_0_1': 'ad', 'x_0_2': 'oo', 'x_1_0': 'oo', 'x_1_1': 'cd', 'x_1_2': 'bd'}. Best is trial 280 with value: 0.6222222222222222.
2024-12-07 01:27:40,453 - INFO - Candidate Mean Stats: {'Max': np.float64(2.0), 'Min': np.float64(0.17280111692661554), 'Mean': np.float64(0.49353030634177447), 'Std': np.float64(0.08350212085742978)}
2024-12-07 01:27:40,453 - INFO - Candidate Std Stats: {'Max': np.float64(1.3281155277319554), 'Min': np.float64(0.0), 'Mean': np.float64(0.11254271108251887), 'Std': np.float64(0.05330465261249641)}
[I 2024-12-07 01:27:40,495] Trial 293 finished with value: 1.0666666666666667 and parameters: {'x_0_0': 'bc', 'x_0_1': 'oo', 'x_0_2': 'ac', 'x_1_0': 'oo', 'x_1_1': 'ad', 'x_1_2': 'bd'}. Best is trial 49 with value: 0.7999999999999999.
2024-12-07 01:27:49,991 - INFO - Candidate Mean Stats: {'Max': np.float64(2.0), 'Min': np.float64(0.2096802418792135), 'Mean': np.float64(0.49057903822114896), 'Std': np.float64(0.07910847571279317)}
2024-12-07 01:27:49,991 - INFO - Candidate Std Stats: {'Max': np.float64(1.8142405405618949), 'Min': np.float64(0.0), 'Mean': np.float64(0.09719720722863953), 'Std': np.float64(0.05089921580862098)}
[I 2024-12-07 01:27:50,034] Trial 294 finished with value: 1.3666666666666667 and parameters: {'x_0_0': 'ac', 'x_0_1': 'bc', 'x_0_2': 'bd', 'x_1_0': 'oo', 'x_1_1': 'ac', 'x_1_2': 'oo'}. Best is trial 148 with value: 0.8333333333333333.
2024-12-07 01:27:52,547 - INFO - Candidate Mean Stats: {'Max': np.float64(2.0), 'Min': np.float64(0.2815108383880942), 'Mean': np.float64(0.48765585943263756), 'Std': np.float64(0.08034469465183391)}
2024-12-07 01:27:52,547 - INFO - Candidate Std Stats: {'Max': np.float64(1.3391849296964058), 'Min': np.float64(0.0), 'Mean': np.float64(0.11342382959091608), 'Std': np.float64(0.05756737560464983)}
[I 2024-12-07 01:27:52,591] Trial 293 finished with value: 1.5666666666666664 and parameters: {'x_0_0': 'bd', 'x_0_1': 'bd', 'x_0_2': 'oo', 'x_1_0': 'ac', 'x_1_1': 'ab', 'x_1_2': 'bd'}. Best is trial 200 with value: 0.6.
2024-12-07 01:27:59,962 - INFO - Candidate Mean Stats: {'Max': np.float64(2.0), 'Min': np.float64(0.1644678356833578), 'Mean': np.float64(0.48923104193025235), 'Std': np.float64(0.08100281042648341)}
2024-12-07 01:27:59,962 - INFO - Candidate Std Stats: {'Max': np.float64(1.5643606521918896), 'Min': np.float64(0.0), 'Mean': np.float64(0.10718194695269151), 'Std': np.float64(0.05189944775477598)}
[I 2024-12-07 01:28:00,008] Trial 293 finished with value: 0.9666666666666667 and parameters: {'x_0_0': 'ac', 'x_0_1': 'oo', 'x_0_2': 'bd', 'x_1_0': 'oo', 'x_1_1': 'oo', 'x_1_2': 'ab'}. Best is trial 280 with value: 0.6222222222222222.
2024-12-07 01:28:00,758 - INFO - Candidate Mean Stats: {'Max': np.float64(2.0), 'Min': np.float64(0.2658115145811874), 'Mean': np.float64(0.48417843459488974), 'Std': np.float64(0.08175615021599336)}
2024-12-07 01:28:00,759 - INFO - Candidate Std Stats: {'Max': np.float64(1.5888777254551372), 'Min': np.float64(0.0), 'Mean': np.float64(0.10303578001982912), 'Std': np.float64(0.05233408830218134)}
[I 2024-12-07 01:28:00,801] Trial 294 finished with value: 1.1666666666666665 and parameters: {'x_0_0': 'ac', 'x_0_1': 'oo', 'x_0_2': 'oo', 'x_1_0': 'bc', 'x_1_1': 'ab', 'x_1_2': 'bc'}. Best is trial 49 with value: 0.7999999999999999.
2024-12-07 01:28:10,419 - INFO - Candidate Mean Stats: {'Max': np.float64(2.0), 'Min': np.float64(0.2568984848454601), 'Mean': np.float64(0.485571538436086), 'Std': np.float64(0.07714945555655355)}
2024-12-07 01:28:10,420 - INFO - Candidate Std Stats: {'Max': np.float64(1.81659376620205), 'Min': np.float64(0.0), 'Mean': np.float64(0.09585133960760725), 'Std': np.float64(0.04376852392497237)}
[I 2024-12-07 01:28:10,465] Trial 295 finished with value: 1.0222222222222221 and parameters: {'x_0_0': 'ac', 'x_0_1': 'ad', 'x_0_2': 'cd', 'x_1_0': 'oo', 'x_1_1': 'bd', 'x_1_2': 'bd'}. Best is trial 148 with value: 0.8333333333333333.
2024-12-07 01:28:13,149 - INFO - Candidate Mean Stats: {'Max': np.float64(2.0), 'Min': np.float64(0.23437824007718802), 'Mean': np.float64(0.4885943055463136), 'Std': np.float64(0.08170481546973674)}
2024-12-07 01:28:13,149 - INFO - Candidate Std Stats: {'Max': np.float64(0.3994691188063215), 'Min': np.float64(0.0), 'Mean': np.float64(0.10023007926154233), 'Std': np.float64(0.0428806259183753)}
[I 2024-12-07 01:28:13,190] Trial 294 finished with value: 1.1666666666666665 and parameters: {'x_0_0': 'ad', 'x_0_1': 'oo', 'x_0_2': 'oo', 'x_1_0': 'ac', 'x_1_1': 'bd', 'x_1_2': 'cd'}. Best is trial 200 with value: 0.6.
2024-12-07 01:28:20,556 - INFO - Candidate Mean Stats: {'Max': np.float64(2.0), 'Min': np.float64(0.2791185850455802), 'Mean': np.float64(0.48737716024479766), 'Std': np.float64(0.08073308578839512)}
2024-12-07 01:28:20,557 - INFO - Candidate Std Stats: {'Max': np.float64(1.4385908602731206), 'Min': np.float64(0.0), 'Mean': np.float64(0.1144760765325941), 'Std': np.float64(0.055166538523456946)}
[I 2024-12-07 01:28:20,602] Trial 294 finished with value: 1.2666666666666666 and parameters: {'x_0_0': 'bd', 'x_0_1': 'oo', 'x_0_2': 'ac', 'x_1_0': 'ac', 'x_1_1': 'bc', 'x_1_2': 'cd'}. Best is trial 280 with value: 0.6222222222222222.
2024-12-07 01:28:21,326 - INFO - Candidate Mean Stats: {'Max': np.float64(2.0), 'Min': np.float64(0.2387613256775322), 'Mean': np.float64(0.4916392836567044), 'Std': np.float64(0.0855447864967513)}
2024-12-07 01:28:21,326 - INFO - Candidate Std Stats: {'Max': np.float64(1.201166094551209), 'Min': np.float64(0.0), 'Mean': np.float64(0.10940566100862444), 'Std': np.float64(0.054841754488254256)}
[I 2024-12-07 01:28:21,372] Trial 295 finished with value: 1.0666666666666667 and parameters: {'x_0_0': 'bd', 'x_0_1': 'oo', 'x_0_2': 'bd', 'x_1_0': 'oo', 'x_1_1': 'ad', 'x_1_2': 'ac'}. Best is trial 49 with value: 0.7999999999999999.
2024-12-07 01:28:30,809 - INFO - Candidate Mean Stats: {'Max': np.float64(2.0), 'Min': np.float64(0.3135668062680939), 'Mean': np.float64(0.49581586990566434), 'Std': np.float64(0.07133051065368985)}
2024-12-07 01:28:30,811 - INFO - Candidate Std Stats: {'Max': np.float64(0.29496150186677383), 'Min': np.float64(0.0), 'Mean': np.float64(0.09256608553973672), 'Std': np.float64(0.03786234636812534)}
[I 2024-12-07 01:28:30,859] Trial 296 finished with value: 1.1666666666666665 and parameters: {'x_0_0': 'bc', 'x_0_1': 'oo', 'x_0_2': 'oo', 'x_1_0': 'bd', 'x_1_1': 'cd', 'x_1_2': 'ad'}. Best is trial 148 with value: 0.8333333333333333.
2024-12-07 01:28:33,695 - INFO - Candidate Mean Stats: {'Max': np.float64(2.0), 'Min': np.float64(0.23462477354810468), 'Mean': np.float64(0.4878324668158273), 'Std': np.float64(0.08038282589774409)}
2024-12-07 01:28:33,696 - INFO - Candidate Std Stats: {'Max': np.float64(0.7207229854783533), 'Min': np.float64(0.0), 'Mean': np.float64(0.11145023977605434), 'Std': np.float64(0.0495293130602158)}
[I 2024-12-07 01:28:33,743] Trial 295 finished with value: 1.1555555555555554 and parameters: {'x_0_0': 'ac', 'x_0_1': 'ab', 'x_0_2': 'oo', 'x_1_0': 'oo', 'x_1_1': 'oo', 'x_1_2': 'bc'}. Best is trial 200 with value: 0.6.
2024-12-07 01:28:41,335 - INFO - Candidate Mean Stats: {'Max': np.float64(2.0), 'Min': np.float64(0.23619953897058038), 'Mean': np.float64(0.49067727031195), 'Std': np.float64(0.07981438944697362)}
2024-12-07 01:28:41,336 - INFO - Candidate Std Stats: {'Max': np.float64(0.781977759800037), 'Min': np.float64(0.0), 'Mean': np.float64(0.11803762983463062), 'Std': np.float64(0.05356967666658514)}
[I 2024-12-07 01:28:41,378] Trial 295 finished with value: 1.0666666666666667 and parameters: {'x_0_0': 'bc', 'x_0_1': 'oo', 'x_0_2': 'oo', 'x_1_0': 'bd', 'x_1_1': 'ab', 'x_1_2': 'oo'}. Best is trial 280 with value: 0.6222222222222222.
2024-12-07 01:28:41,995 - INFO - Candidate Mean Stats: {'Max': np.float64(2.0), 'Min': np.float64(0.1701846963567703), 'Mean': np.float64(0.4887635416596168), 'Std': np.float64(0.07334997849990887)}
2024-12-07 01:28:41,996 - INFO - Candidate Std Stats: {'Max': np.float64(0.3996682314906257), 'Min': np.float64(0.0), 'Mean': np.float64(0.09727357761674783), 'Std': np.float64(0.04249956052260716)}
[I 2024-12-07 01:28:42,038] Trial 296 finished with value: 1.2444444444444445 and parameters: {'x_0_0': 'ac', 'x_0_1': 'ad', 'x_0_2': 'oo', 'x_1_0': 'bd', 'x_1_1': 'oo', 'x_1_2': 'ab'}. Best is trial 49 with value: 0.7999999999999999.
2024-12-07 01:28:51,509 - INFO - Candidate Mean Stats: {'Max': np.float64(2.0), 'Min': np.float64(0.22718930178898158), 'Mean': np.float64(0.4852371923064092), 'Std': np.float64(0.07825601100240406)}
2024-12-07 01:28:51,510 - INFO - Candidate Std Stats: {'Max': np.float64(0.4020765020440557), 'Min': np.float64(0.0), 'Mean': np.float64(0.10248492799432249), 'Std': np.float64(0.04344480280294881)}
[I 2024-12-07 01:28:51,553] Trial 297 finished with value: 1.0444444444444443 and parameters: {'x_0_0': 'ac', 'x_0_1': 'ad', 'x_0_2': 'ad', 'x_1_0': 'oo', 'x_1_1': 'oo', 'x_1_2': 'oo'}. Best is trial 148 with value: 0.8333333333333333.
2024-12-07 01:28:54,371 - INFO - Candidate Mean Stats: {'Max': np.float64(2.0), 'Min': np.float64(0.28175544660883783), 'Mean': np.float64(0.48730208023625987), 'Std': np.float64(0.07890891216583819)}
2024-12-07 01:28:54,372 - INFO - Candidate Std Stats: {'Max': np.float64(0.5082394078101746), 'Min': np.float64(0.0), 'Mean': np.float64(0.10231263194959754), 'Std': np.float64(0.04232990462008672)}
[I 2024-12-07 01:28:54,418] Trial 296 finished with value: 1.2666666666666666 and parameters: {'x_0_0': 'bc', 'x_0_1': 'oo', 'x_0_2': 'bd', 'x_1_0': 'bd', 'x_1_1': 'ac', 'x_1_2': 'cd'}. Best is trial 200 with value: 0.6.
2024-12-07 01:29:01,984 - INFO - Candidate Mean Stats: {'Max': np.float64(2.0), 'Min': np.float64(0.24162741409584915), 'Mean': np.float64(0.5022485182855297), 'Std': np.float64(0.07570749666234307)}
2024-12-07 01:29:01,986 - INFO - Candidate Std Stats: {'Max': np.float64(0.9905694949370866), 'Min': np.float64(0.0), 'Mean': np.float64(0.10922911916507486), 'Std': np.float64(0.05337147187663537)}
[I 2024-12-07 01:29:02,034] Trial 296 finished with value: 1.3 and parameters: {'x_0_0': 'oo', 'x_0_1': 'oo', 'x_0_2': 'ab', 'x_1_0': 'bc', 'x_1_1': 'oo', 'x_1_2': 'oo'}. Best is trial 280 with value: 0.6222222222222222.
2024-12-07 01:29:02,667 - INFO - Candidate Mean Stats: {'Max': np.float64(2.0), 'Min': np.float64(0.21863880276724473), 'Mean': np.float64(0.4891224192519955), 'Std': np.float64(0.07790825810498697)}
2024-12-07 01:29:02,668 - INFO - Candidate Std Stats: {'Max': np.float64(0.590001167964103), 'Min': np.float64(0.0), 'Mean': np.float64(0.10727672262823157), 'Std': np.float64(0.049225947575385905)}
[I 2024-12-07 01:29:02,713] Trial 297 finished with value: 1.7777777777777777 and parameters: {'x_0_0': 'ab', 'x_0_1': 'ac', 'x_0_2': 'cd', 'x_1_0': 'bc', 'x_1_1': 'ac', 'x_1_2': 'bd'}. Best is trial 49 with value: 0.7999999999999999.
2024-12-07 01:29:11,938 - INFO - Candidate Mean Stats: {'Max': np.float64(2.0), 'Min': np.float64(0.23878932778017928), 'Mean': np.float64(0.4896150670308278), 'Std': np.float64(0.08107740837419561)}
2024-12-07 01:29:11,939 - INFO - Candidate Std Stats: {'Max': np.float64(0.45169135860575355), 'Min': np.float64(0.0), 'Mean': np.float64(0.10644642367363635), 'Std': np.float64(0.04612983948111825)}
[I 2024-12-07 01:29:11,981] Trial 298 finished with value: 1.2666666666666666 and parameters: {'x_0_0': 'ac', 'x_0_1': 'bd', 'x_0_2': 'oo', 'x_1_0': 'oo', 'x_1_1': 'cd', 'x_1_2': 'oo'}. Best is trial 148 with value: 0.8333333333333333.
2024-12-07 01:29:15,174 - INFO - Candidate Mean Stats: {'Max': np.float64(2.0), 'Min': np.float64(0.24994048276161845), 'Mean': np.float64(0.48536520294022034), 'Std': np.float64(0.07399151365424758)}
2024-12-07 01:29:15,175 - INFO - Candidate Std Stats: {'Max': np.float64(0.3801909348614653), 'Min': np.float64(0.0), 'Mean': np.float64(0.09434144207285956), 'Std': np.float64(0.03957483612950975)}
[I 2024-12-07 01:29:15,220] Trial 297 finished with value: 1.1666666666666665 and parameters: {'x_0_0': 'ac', 'x_0_1': 'oo', 'x_0_2': 'ab', 'x_1_0': 'bc', 'x_1_1': 'oo', 'x_1_2': 'cd'}. Best is trial 200 with value: 0.6.
2024-12-07 01:29:22,771 - INFO - Candidate Mean Stats: {'Max': np.float64(2.0), 'Min': np.float64(0.27401933912858434), 'Mean': np.float64(0.4980517341444659), 'Std': np.float64(0.07751995328510944)}
2024-12-07 01:29:22,772 - INFO - Candidate Std Stats: {'Max': np.float64(0.4906184919769733), 'Min': np.float64(0.0), 'Mean': np.float64(0.10570788982910861), 'Std': np.float64(0.044869012565461844)}
[I 2024-12-07 01:29:22,815] Trial 297 finished with value: 1.2 and parameters: {'x_0_0': 'oo', 'x_0_1': 'oo', 'x_0_2': 'bc', 'x_1_0': 'oo', 'x_1_1': 'oo', 'x_1_2': 'ac'}. Best is trial 280 with value: 0.6222222222222222.
2024-12-07 01:29:23,450 - INFO - Candidate Mean Stats: {'Max': np.float64(2.0), 'Min': np.float64(0.17522279293055174), 'Mean': np.float64(0.48518128429210294), 'Std': np.float64(0.08425760750547558)}
2024-12-07 01:29:23,450 - INFO - Candidate Std Stats: {'Max': np.float64(1.1557831475980425), 'Min': np.float64(0.0), 'Mean': np.float64(0.11577752291521322), 'Std': np.float64(0.0554169595003182)}
[I 2024-12-07 01:29:23,494] Trial 298 finished with value: 0.9666666666666667 and parameters: {'x_0_0': 'ac', 'x_0_1': 'oo', 'x_0_2': 'ad', 'x_1_0': 'oo', 'x_1_1': 'oo', 'x_1_2': 'ab'}. Best is trial 49 with value: 0.7999999999999999.
2024-12-07 01:29:32,289 - INFO - Candidate Mean Stats: {'Max': np.float64(2.0), 'Min': np.float64(0.2351036066663949), 'Mean': np.float64(0.49068015451624425), 'Std': np.float64(0.07715476790369226)}
2024-12-07 01:29:32,290 - INFO - Candidate Std Stats: {'Max': np.float64(0.33155065902315556), 'Min': np.float64(0.0), 'Mean': np.float64(0.09909530468580705), 'Std': np.float64(0.04074547935113108)}
[I 2024-12-07 01:29:32,334] Trial 299 finished with value: 1.2666666666666666 and parameters: {'x_0_0': 'ac', 'x_0_1': 'oo', 'x_0_2': 'ac', 'x_1_0': 'cd', 'x_1_1': 'bc', 'x_1_2': 'cd'}. Best is trial 148 with value: 0.8333333333333333.
2024-12-07 01:29:35,452 - INFO - Candidate Mean Stats: {'Max': np.float64(2.0), 'Min': np.float64(0.18064782902943838), 'Mean': np.float64(0.483172776908823), 'Std': np.float64(0.08570784818240451)}
2024-12-07 01:29:35,453 - INFO - Candidate Std Stats: {'Max': np.float64(1.723240283346663), 'Min': np.float64(0.0), 'Mean': np.float64(0.11693638221735608), 'Std': np.float64(0.06767338367327588)}
[I 2024-12-07 01:29:35,495] Trial 298 finished with value: 1.6666666666666665 and parameters: {'x_0_0': 'bc', 'x_0_1': 'cd', 'x_0_2': 'ab', 'x_1_0': 'ac', 'x_1_1': 'cd', 'x_1_2': 'ad'}. Best is trial 200 with value: 0.6.
2024-12-07 01:29:43,399 - INFO - Candidate Mean Stats: {'Max': np.float64(2.0), 'Min': np.float64(0.2134682508891111), 'Mean': np.float64(0.4847837616577947), 'Std': np.float64(0.08276530213283352)}
2024-12-07 01:29:43,400 - INFO - Candidate Std Stats: {'Max': np.float64(1.5090301492504419), 'Min': np.float64(0.0), 'Mean': np.float64(0.10401012560292783), 'Std': np.float64(0.04985185315513264)}
