[I 2024-12-28 14:58:52,092] Trial 19 finished with value: 2.0 and parameters: {'x_0_0': 'cd', 'x_0_1': 'bd', 'x_1_0': 'ab', 'x_1_1': 'cd'}. Best is trial 3 with value: 0.7857142857142857.
[I 2024-12-28 14:58:52,123] Trial 22 finished with value: 1.0714285714285714 and parameters: {'x_0_0': 'ad', 'x_0_1': 'oo', 'x_1_0': 'ac', 'x_1_1': 'cd'}. Best is trial 16 with value: 0.8035714285714286.
[I 2024-12-28 14:58:52,136] Trial 29 finished with value: 1.5714285714285714 and parameters: {'x_0_0': 'bd', 'x_0_1': 'ac', 'x_1_0': 'cd', 'x_1_1': 'cd'}. Best is trial 21 with value: 0.7857142857142857.
[I 2024-12-28 14:58:52,169] Trial 27 finished with value: 1.4285714285714286 and parameters: {'x_0_0': 'bd', 'x_0_1': 'ad', 'x_1_0': 'ab', 'x_1_1': 'cd'}. Best is trial 17 with value: 0.5.
[I 2024-12-28 14:58:52,169] Trial 30 finished with value: 1.2142857142857144 and parameters: {'x_0_0': 'ab', 'x_0_1': 'oo', 'x_1_0': 'bd', 'x_1_1': 'cd'}. Best is trial 17 with value: 0.7857142857142857.
[I 2024-12-28 14:58:52,210] Trial 24 finished with value: 1.1785714285714286 and parameters: {'x_0_0': 'ac', 'x_0_1': 'ab', 'x_1_0': 'oo', 'x_1_1': 'ab'}. Best is trial 7 with value: 0.5.
[I 2024-12-28 14:58:52,227] Trial 21 finished with value: 2.0 and parameters: {'x_0_0': 'cd', 'x_0_1': 'bd', 'x_1_0': 'cd', 'x_1_1': 'cd'}. Best is trial 15 with value: 0.6964285714285714.
[I 2024-12-28 14:58:52,257] Trial 21 finished with value: 1.0714285714285714 and parameters: {'x_0_0': 'bc', 'x_0_1': 'oo', 'x_1_0': 'ad', 'x_1_1': 'ac'}. Best is trial 4 with value: 1.0714285714285714.
[I 2024-12-28 14:58:52,286] Trial 28 finished with value: 1.0357142857142856 and parameters: {'x_0_0': 'ac', 'x_0_1': 'ac', 'x_1_0': 'oo', 'x_1_1': 'ad'}. Best is trial 16 with value: 1.0357142857142856.
[I 2024-12-28 14:58:52,366] Trial 32 finished with value: 2.0 and parameters: {'x_0_0': 'cd', 'x_0_1': 'cd', 'x_1_0': 'cd', 'x_1_1': 'ab'}. Best is trial 1 with value: 1.0.
[I 2024-12-28 14:58:52,417] Trial 30 finished with value: 1.3214285714285714 and parameters: {'x_0_0': 'ad', 'x_0_1': 'cd', 'x_1_0': 'oo', 'x_1_1': 'ad'}. Best is trial 21 with value: 0.7857142857142857.
[I 2024-12-28 14:58:52,456] Trial 25 finished with value: 1.875 and parameters: {'x_0_0': 'oo', 'x_0_1': 'ac', 'x_1_0': 'bc', 'x_1_1': 'bd'}. Best is trial 7 with value: 0.5.
[I 2024-12-28 14:58:52,467] Trial 23 finished with value: 2.0 and parameters: {'x_0_0': 'cd', 'x_0_1': 'bd', 'x_1_0': 'bd', 'x_1_1': 'bd'}. Best is trial 16 with value: 0.8035714285714286.
[I 2024-12-28 14:58:52,488] Trial 31 finished with value: 1.5 and parameters: {'x_0_0': 'cd', 'x_0_1': 'oo', 'x_1_0': 'cd', 'x_1_1': 'ad'}. Best is trial 17 with value: 0.7857142857142857.
[I 2024-12-28 14:58:52,637] Trial 28 finished with value: 1.1428571428571428 and parameters: {'x_0_0': 'bc', 'x_0_1': 'ad', 'x_1_0': 'cd', 'x_1_1': 'ab'}. Best is trial 17 with value: 0.5.
[I 2024-12-28 14:58:52,658] Trial 31 finished with value: 1.2857142857142856 and parameters: {'x_0_0': 'bc', 'x_0_1': 'ad', 'x_1_0': 'ad', 'x_1_1': 'ad'}. Best is trial 21 with value: 0.7857142857142857.
[I 2024-12-28 14:58:52,691] Trial 26 finished with value: 1.0714285714285714 and parameters: {'x_0_0': 'ad', 'x_0_1': 'oo', 'x_1_0': 'ac', 'x_1_1': 'bd'}. Best is trial 7 with value: 0.5.
[I 2024-12-28 14:58:52,702] Trial 20 finished with value: 1.25 and parameters: {'x_0_0': 'cd', 'x_0_1': 'oo', 'x_1_0': 'oo', 'x_1_1': 'bd'}. Best is trial 3 with value: 0.7857142857142857.
[I 2024-12-28 14:58:52,720] Trial 32 finished with value: 1.2857142857142856 and parameters: {'x_0_0': 'bd', 'x_0_1': 'bc', 'x_1_0': 'bc', 'x_1_1': 'bd'}. Best is trial 17 with value: 0.7857142857142857.
[I 2024-12-28 14:58:52,720] Trial 29 finished with value: 1.0 and parameters: {'x_0_0': 'ac', 'x_0_1': 'ad', 'x_1_0': 'bd', 'x_1_1': 'bc'}. Best is trial 29 with value: 1.0.
[I 2024-12-28 14:58:52,760] Trial 33 finished with value: 2.0 and parameters: {'x_0_0': 'cd', 'x_0_1': 'ad', 'x_1_0': 'ad', 'x_1_1': 'bc'}. Best is trial 1 with value: 1.0.
[I 2024-12-28 14:58:52,800] Trial 22 finished with value: 1.875 and parameters: {'x_0_0': 'oo', 'x_0_1': 'cd', 'x_1_0': 'bc', 'x_1_1': 'ad'}. Best is trial 15 with value: 0.6964285714285714.
[I 2024-12-28 14:58:52,800] Trial 32 finished with value: 2.0 and parameters: {'x_0_0': 'cd', 'x_0_1': 'ab', 'x_1_0': 'bc', 'x_1_1': 'cd'}. Best is trial 21 with value: 0.7857142857142857.
[I 2024-12-28 14:58:52,841] Trial 24 finished with value: 1.4464285714285714 and parameters: {'x_0_0': 'ac', 'x_0_1': 'cd', 'x_1_0': 'ab', 'x_1_1': 'oo'}. Best is trial 16 with value: 0.8035714285714286.
[I 2024-12-28 14:58:52,964] Trial 29 finished with value: 1.5714285714285714 and parameters: {'x_0_0': 'ac', 'x_0_1': 'bc', 'x_1_0': 'bc', 'x_1_1': 'ab'}. Best is trial 17 with value: 0.5.
[I 2024-12-28 14:58:53,013] Trial 27 finished with value: 1.875 and parameters: {'x_0_0': 'oo', 'x_0_1': 'ab', 'x_1_0': 'ac', 'x_1_1': 'ad'}. Best is trial 7 with value: 0.5.
[I 2024-12-28 14:58:53,087] Trial 25 finished with value: 1.7142857142857144 and parameters: {'x_0_0': 'ab', 'x_0_1': 'ac', 'x_1_0': 'ab', 'x_1_1': 'cd'}. Best is trial 16 with value: 0.8035714285714286.
[I 2024-12-28 14:58:53,101] Trial 21 finished with value: 1.7142857142857144 and parameters: {'x_0_0': 'ab', 'x_0_1': 'cd', 'x_1_0': 'bc', 'x_1_1': 'ab'}. Best is trial 3 with value: 0.7857142857142857.
[I 2024-12-28 14:58:53,123] Trial 34 finished with value: 1.5714285714285714 and parameters: {'x_0_0': 'ac', 'x_0_1': 'bc', 'x_1_0': 'ad', 'x_1_1': 'ad'}. Best is trial 1 with value: 1.0.
[I 2024-12-28 14:58:53,141] Trial 33 finished with value: 1.5714285714285714 and parameters: {'x_0_0': 'ad', 'x_0_1': 'ad', 'x_1_0': 'cd', 'x_1_1': 'ab'}. Best is trial 17 with value: 0.7857142857142857.
[I 2024-12-28 14:58:53,159] Trial 33 finished with value: 1.875 and parameters: {'x_0_0': 'cd', 'x_0_1': 'ab', 'x_1_0': 'cd', 'x_1_1': 'oo'}. Best is trial 21 with value: 0.7857142857142857.
[I 2024-12-28 14:58:53,184] Trial 22 finished with value: 1.2142857142857144 and parameters: {'x_0_0': 'ab', 'x_0_1': 'oo', 'x_1_0': 'bc', 'x_1_1': 'ac'}. Best is trial 4 with value: 1.0714285714285714.
[I 2024-12-28 14:58:53,278] Trial 30 finished with value: 1.0714285714285714 and parameters: {'x_0_0': 'ac', 'x_0_1': 'oo', 'x_1_0': 'bc', 'x_1_1': 'cd'}. Best is trial 17 with value: 0.5.
[I 2024-12-28 14:58:53,294] Trial 23 finished with value: 1.75 and parameters: {'x_0_0': 'oo', 'x_0_1': 'bd', 'x_1_0': 'cd', 'x_1_1': 'oo'}. Best is trial 15 with value: 0.6964285714285714.
[I 2024-12-28 14:58:53,327] Trial 28 finished with value: 1.875 and parameters: {'x_0_0': 'oo', 'x_0_1': 'ab', 'x_1_0': 'bc', 'x_1_1': 'cd'}. Best is trial 7 with value: 0.5.
[I 2024-12-28 14:58:53,339] Trial 35 finished with value: 1.1607142857142856 and parameters: {'x_0_0': 'bc', 'x_0_1': 'ad', 'x_1_0': 'ac', 'x_1_1': 'oo'}. Best is trial 1 with value: 1.0.
[I 2024-12-28 14:58:53,377] Trial 30 finished with value: 2.0 and parameters: {'x_0_0': 'cd', 'x_0_1': 'bc', 'x_1_0': 'bc', 'x_1_1': 'ab'}. Best is trial 29 with value: 1.0.
[I 2024-12-28 14:58:53,382] Trial 34 finished with value: 1.5714285714285714 and parameters: {'x_0_0': 'ac', 'x_0_1': 'bc', 'x_1_0': 'ac', 'x_1_1': 'bd'}. Best is trial 21 with value: 0.7857142857142857.
[I 2024-12-28 14:58:53,428] Trial 22 finished with value: 1.4285714285714286 and parameters: {'x_0_0': 'ad', 'x_0_1': 'ab', 'x_1_0': 'ab', 'x_1_1': 'ab'}. Best is trial 3 with value: 0.7857142857142857.
Loaded from prev state!
Loaded from prev state!
Loaded from prev state!
Loaded from prev state!
Loaded from prev state!
Loaded from prev state!
Loaded from prev state!
Loaded from prev state!
Loaded from prev state!
Loaded from prev state!
Loaded from prev state!
Loaded from prev state!
Loaded from prev state!
Loaded from prev state!
Loaded from prev state!
Loaded from prev state!
Loaded from prev state!
Loaded from prev state!
Loaded from prev state!
Loaded from prev state!
Loaded from prev state!
Loaded from prev state!
Loaded from prev state!
Loaded from prev state!
Loaded from prev state!
Loaded from prev state!
Loaded from prev state!
Loaded from prev state!
Loaded from prev state!
Loaded from prev state!
Loaded from prev state!
Loaded from prev state!
Loaded from prev state!
Loaded from prev state!
Loaded from prev state!
Loaded from prev state!
Loaded from prev state!
Loaded from prev state!
Loaded from prev state!
Loaded from prev state!
Loaded from prev state!
Loaded from prev state!
Loaded from prev state!
Loaded from prev state!
Loaded from prev state!
Loaded from prev state!
Loaded from prev state!
Loaded from prev state!
Loaded from prev state!
Loaded from prev state!
Loaded from prev state!
Loaded from prev state!
Loaded from prev state!
Loaded from prev state!
Loaded from prev state!
Loaded from prev state!
Loaded from prev state!
Loaded from prev state!
Loaded from prev state!
Loaded from prev state!
Loaded from prev state!
Loaded from prev state!
Loaded from prev state!
Loaded from prev state!
Loaded from prev state!
Loaded from prev state!
Loaded from prev state!
Loaded from prev state!
Loaded from prev state!
Loaded from prev state!
Loaded from prev state!
Loaded from prev state!
Loaded from prev state!
Loaded from prev state!
Loaded from prev state!
Loaded from prev state!
Loaded from prev state!
Loaded from prev state!
Loaded from prev state!
Loaded from prev state!
Loaded from prev state!
Loaded from prev state!
Loaded from prev state!
Loaded from prev state!
Loaded from prev state!
Loaded from prev state!
Loaded from prev state!
Loaded from prev state!
Loaded from prev state!
Loaded from prev state!
Loaded from prev state!
Loaded from prev state!
Loaded from prev state!
Loaded from prev state!
Loaded from prev state!
Loaded from prev state!
Loaded from prev state!
Loaded from prev state!
Loaded from prev state!
Loaded from prev state!
Loaded from prev state!
Loaded from prev state!
Loaded from prev state!
Loaded from prev state!
Loaded from prev state!
Loaded from prev state!
Loaded from prev state!
Loaded from prev state!
Loaded from prev state!
Loaded from prev state!
Loaded from prev state!
Loaded from prev state!
Loaded from prev state!
Loaded from prev state!
Loaded from prev state!
Loaded from prev state!
Loaded from prev state!
Loaded from prev state!
Loaded from prev state!
Loaded from prev state!
Loaded from prev state!
Loaded from prev state!
Loaded from prev state!
Loaded from prev state!
Loaded from prev state!
Loaded from prev state!
Loaded from prev state!
Loaded from prev state!
Loaded from prev state!
Loaded from prev state!
Loaded from prev state!
Loaded from prev state!
Loaded from prev state!
Loaded from prev state!
Loaded from prev state!
Loaded from prev state!
Loaded from prev state!
Loaded from prev state!
Loaded from prev state!
Loaded from prev state!
Loaded from prev state!
Loaded from prev state!
Loaded from prev state!
Loaded from prev state!
Loaded from prev state!
Loaded from prev state!
Loaded from prev state!
Loaded from prev state!
Loaded from prev state!
Loaded from prev state!
Loaded from prev state!
Loaded from prev state!
Loaded from prev state!
Loaded from prev state!
Loaded from prev state!
Loaded from prev state!
Loaded from prev state!
Loaded from prev state!
Loaded from prev state!
Loaded from prev state!
Loaded from prev state!
Loaded from prev state!
Loaded from prev state!
Loaded from prev state!
Loaded from prev state!
Loaded from prev state!
Loaded from prev state!
Loaded from prev state!
Loaded from prev state!
Loaded from prev state!
Loaded from prev state!
Loaded from prev state!
Loaded from prev state!
Loaded from prev state!
Loaded from prev state!
Loaded from prev state!
Loaded from prev state!
Loaded from prev state!
Loaded from prev state!
Loaded from prev state!
Loaded from prev state!
Loaded from prev state!
Loaded from prev state!
Loaded from prev state!
Loaded from prev state!
Loaded from prev state!
Loaded from prev state!
Loaded from prev state!
Loaded from prev state!
Loaded from prev state!
Loaded from prev state!
Loaded from prev state!
Loaded from prev state!
Loaded from prev state!
Loaded from prev state!
Loaded from prev state!
Loaded from prev state!
Loaded from prev state!
Loaded from prev state!
Loaded from prev state!
Loaded from prev state!
Loaded from prev state!
Loaded from prev state!
Loaded from prev state!
Loaded from prev state!
Loaded from prev state!
Loaded from prev state!
Loaded from prev state!
Loaded from prev state!
Loaded from prev state!
Loaded from prev state!
Loaded from prev state!
Loaded from prev state!
Loaded from prev state!
Loaded from prev state!
Loaded from prev state!
Loaded from prev state!
Loaded from prev state!
Loaded from prev state!
Loaded from prev state!
Loaded from prev state!
Loaded from prev state!
Loaded from prev state!
Loaded from prev state!
Loaded from prev state!
Loaded from prev state!
Loaded from prev state!
Loaded from prev state!
Loaded from prev state!
Loaded from prev state!
Loaded from prev state!
Loaded from prev state!
Loaded from prev state!
Loaded from prev state!
Loaded from prev state!
Loaded from prev state!
Loaded from prev state!
Loaded from prev state!
Loaded from prev state!
Loaded from prev state!
Loaded from prev state!
Loaded from prev state!
Loaded from prev state!
Loaded from prev state!
Loaded from prev state!
Loaded from prev state!
Loaded from prev state!
Loaded from prev state!
Loaded from prev state!
Loaded from prev state!
Loaded from prev state!
Loaded from prev state!
Loaded from prev state!
Loaded from prev state!
Loaded from prev state!
Loaded from prev state!
Loaded from prev state!
Loaded from prev state!
Loaded from prev state!
Loaded from prev state!
Loaded from prev state!
Loaded from prev state!
Loaded from prev state!
Loaded from prev state!
Loaded from prev state!
Loaded from prev state!
Loaded from prev state!
Loaded from prev state!
Loaded from prev state!
Loaded from prev state!
Loaded from prev state!
Loaded from prev state!
Loaded from prev state!
Loaded from prev state!
Loaded from prev state!
Loaded from prev state!
Loaded from prev state!
Loaded from prev state!
Loaded from prev state!
Loaded from prev state!
Loaded from prev state!
Loaded from prev state!
Loaded from prev state!
Loaded from prev state!
Loaded from prev state!
Loaded from prev state!
Loaded from prev state!
Loaded from prev state!
Loaded from prev state!
Loaded from prev state!
Loaded from prev state!
Loaded from prev state!
Loaded from prev state!
Loaded from prev state!
Loaded from prev state!
Loaded from prev state!
Loaded from prev state!
Loaded from prev state!
Loaded from prev state!
Loaded from prev state!
Loaded from prev state!
Loaded from prev state!
Loaded from prev state!
Loaded from prev state!
Loaded from prev state!
Loaded from prev state!
Loaded from prev state!
Loaded from prev state!
Loaded from prev state!
Loaded from prev state!
Loaded from prev state!
Loaded from prev state!
Loaded from prev state!
Loaded from prev state!
Loaded from prev state!
Loaded from prev state!
Loaded from prev state!
Loaded from prev state!
Loaded from prev state!
Loaded from prev state!
Loaded from prev state!
Loaded from prev state!
Loaded from prev state!
Loaded from prev state!
Loaded from prev state!
Loaded from prev state!
Loaded from prev state!
Loaded from prev state!
Loaded from prev state!
Loaded from prev state!
Loaded from prev state!
Loaded from prev state!
Loaded from prev state!
Loaded from prev state!
Loaded from prev state!
Loaded from prev state!
Loaded from prev state!
Loaded from prev state!
Loaded from prev state!
Loaded from prev state!
Loaded from prev state!
Loaded from prev state![I 2024-12-28 14:58:53,468] Trial 34 finished with value: 1.875 and parameters: {'x_0_0': 'oo', 'x_0_1': 'ad', 'x_1_0': 'ab', 'x_1_1': 'bc'}. Best is trial 17 with value: 0.7857142857142857.
[I 2024-12-28 14:58:53,524] Trial 26 finished with value: 1.5714285714285714 and parameters: {'x_0_0': 'ac', 'x_0_1': 'bd', 'x_1_0': 'ac', 'x_1_1': 'ac'}. Best is trial 16 with value: 0.8035714285714286.
[I 2024-12-28 14:58:53,613] Trial 31 finished with value: 1.875 and parameters: {'x_0_0': 'oo', 'x_0_1': 'ab', 'x_1_0': 'bc', 'x_1_1': 'ab'}. Best is trial 17 with value: 0.5.
[I 2024-12-28 14:58:53,665] Trial 35 finished with value: 1.1785714285714286 and parameters: {'x_0_0': 'bc', 'x_0_1': 'ab', 'x_1_0': 'oo', 'x_1_1': 'bc'}. Best is trial 21 with value: 0.7857142857142857.
[I 2024-12-28 14:58:53,674] Trial 31 finished with value: 2.0 and parameters: {'x_0_0': 'cd', 'x_0_1': 'ac', 'x_1_0': 'bc', 'x_1_1': 'ac'}. Best is trial 29 with value: 1.0.
