[I 2024-12-07 00:06:20,228] Trial 69 finished with value: 1.2666666666666666 and parameters: {'x_0_0': 'bc', 'x_0_1': 'oo', 'x_0_2': 'ad', 'x_1_0': 'cd', 'x_1_1': 'ad', 'x_1_2': 'ad'}. Best is trial 67 with value: 1.0222222222222221.
2024-12-07 00:06:28,516 - INFO - Candidate Mean Stats: {'Max': np.float64(2.0), 'Min': np.float64(0.2875944701132501), 'Mean': np.float64(0.4770806160068442), 'Std': np.float64(0.063014226195677)}
2024-12-07 00:06:28,516 - INFO - Candidate Std Stats: {'Max': np.float64(1.5695475341052563), 'Min': np.float64(0.0), 'Mean': np.float64(0.10270303384479411), 'Std': np.float64(0.05062998531695936)}
[I 2024-12-07 00:06:28,560] Trial 69 finished with value: 1.8 and parameters: {'x_0_0': 'oo', 'x_0_1': 'ab', 'x_0_2': 'oo', 'x_1_0': 'ad', 'x_1_1': 'ac', 'x_1_2': 'cd'}. Best is trial 32 with value: 0.9444444444444444.
2024-12-07 00:06:37,689 - INFO - Candidate Mean Stats: {'Max': np.float64(2.0), 'Min': np.float64(0.27662325684143324), 'Mean': np.float64(0.500850834571365), 'Std': np.float64(0.06608265629543615)}
2024-12-07 00:06:37,689 - INFO - Candidate Std Stats: {'Max': np.float64(0.36892491567554825), 'Min': np.float64(0.0), 'Mean': np.float64(0.10813790307303729), 'Std': np.float64(0.04396087940006475)}
[I 2024-12-07 00:06:37,736] Trial 70 finished with value: 1.4666666666666666 and parameters: {'x_0_0': 'bd', 'x_0_1': 'ad', 'x_0_2': 'cd', 'x_1_0': 'oo', 'x_1_1': 'ac', 'x_1_2': 'bd'}. Best is trial 63 with value: 1.1222222222222222.
2024-12-07 00:06:40,130 - INFO - Candidate Mean Stats: {'Max': np.float64(2.0), 'Min': np.float64(0.31312712547643295), 'Mean': np.float64(0.49282036524938055), 'Std': np.float64(0.057793113375478475)}
2024-12-07 00:06:40,130 - INFO - Candidate Std Stats: {'Max': np.float64(0.5092046916595467), 'Min': np.float64(0.0), 'Mean': np.float64(0.09796274321242489), 'Std': np.float64(0.043648181557025496)}
[I 2024-12-07 00:06:40,183] Trial 70 finished with value: 1.6666666666666665 and parameters: {'x_0_0': 'ac', 'x_0_1': 'bc', 'x_0_2': 'bd', 'x_1_0': 'ad', 'x_1_1': 'bc', 'x_1_2': 'ad'}. Best is trial 49 with value: 0.7999999999999999.
2024-12-07 00:06:42,620 - INFO - Candidate Mean Stats: {'Max': np.float64(2.0), 'Min': np.float64(0.24995954584619723), 'Mean': np.float64(0.4837829931701239), 'Std': np.float64(0.06329958178708868)}
2024-12-07 00:06:42,621 - INFO - Candidate Std Stats: {'Max': np.float64(0.3688994380757949), 'Min': np.float64(0.0), 'Mean': np.float64(0.1063825098084686), 'Std': np.float64(0.04253737018750239)}
[I 2024-12-07 00:06:42,681] Trial 70 finished with value: 1.7777777777777777 and parameters: {'x_0_0': 'ab', 'x_0_1': 'cd', 'x_0_2': 'cd', 'x_1_0': 'bd', 'x_1_1': 'ad', 'x_1_2': 'bc'}. Best is trial 67 with value: 1.0222222222222221.
2024-12-07 00:06:52,009 - INFO - Candidate Mean Stats: {'Max': np.float64(2.0), 'Min': np.float64(0.26393505305390497), 'Mean': np.float64(0.4875772043126255), 'Std': np.float64(0.06212595148174702)}
2024-12-07 00:06:52,009 - INFO - Candidate Std Stats: {'Max': np.float64(0.3977280773183323), 'Min': np.float64(0.0), 'Mean': np.float64(0.10071114911424726), 'Std': np.float64(0.04047716069475989)}
[I 2024-12-07 00:06:52,054] Trial 70 finished with value: 1.9 and parameters: {'x_0_0': 'cd', 'x_0_1': 'bc', 'x_0_2': 'ac', 'x_1_0': 'ab', 'x_1_1': 'oo', 'x_1_2': 'ac'}. Best is trial 32 with value: 0.9444444444444444.
2024-12-07 00:07:01,754 - INFO - Candidate Mean Stats: {'Max': np.float64(2.0), 'Min': np.float64(0.26604298191104386), 'Mean': np.float64(0.49132520499966403), 'Std': np.float64(0.06557694853369289)}
2024-12-07 00:07:01,754 - INFO - Candidate Std Stats: {'Max': np.float64(0.4084362208224288), 'Min': np.float64(0.0), 'Mean': np.float64(0.10241646891014583), 'Std': np.float64(0.04033926950240483)}
[I 2024-12-07 00:07:01,797] Trial 71 finished with value: 1.7777777777777777 and parameters: {'x_0_0': 'ab', 'x_0_1': 'ad', 'x_0_2': 'bc', 'x_1_0': 'bd', 'x_1_1': 'ad', 'x_1_2': 'bd'}. Best is trial 63 with value: 1.1222222222222222.
2024-12-07 00:07:04,157 - INFO - Candidate Mean Stats: {'Max': np.float64(2.0), 'Min': np.float64(0.2589461312181481), 'Mean': np.float64(0.488038206476431), 'Std': np.float64(0.06324490992918946)}
2024-12-07 00:07:04,157 - INFO - Candidate Std Stats: {'Max': np.float64(0.4792540887409138), 'Min': np.float64(0.0), 'Mean': np.float64(0.1037260979659069), 'Std': np.float64(0.04216808544679311)}
[I 2024-12-07 00:07:04,199] Trial 71 finished with value: 1.3444444444444446 and parameters: {'x_0_0': 'ad', 'x_0_1': 'ac', 'x_0_2': 'bc', 'x_1_0': 'bd', 'x_1_1': 'bc', 'x_1_2': 'oo'}. Best is trial 49 with value: 0.7999999999999999.
2024-12-07 00:07:06,713 - INFO - Candidate Mean Stats: {'Max': np.float64(2.0), 'Min': np.float64(0.2728649588905537), 'Mean': np.float64(0.4915070259006711), 'Std': np.float64(0.06338886011592273)}
2024-12-07 00:07:06,713 - INFO - Candidate Std Stats: {'Max': np.float64(0.38082640995870765), 'Min': np.float64(0.0), 'Mean': np.float64(0.10719566026404719), 'Std': np.float64(0.04137487403766102)}
[I 2024-12-07 00:07:06,761] Trial 71 finished with value: 1.3666666666666667 and parameters: {'x_0_0': 'bc', 'x_0_1': 'bd', 'x_0_2': 'oo', 'x_1_0': 'oo', 'x_1_1': 'bc', 'x_1_2': 'bc'}. Best is trial 67 with value: 1.0222222222222221.
2024-12-07 00:07:15,595 - INFO - Candidate Mean Stats: {'Max': np.float64(2.0), 'Min': np.float64(0.25912126555253756), 'Mean': np.float64(0.4855461493130684), 'Std': np.float64(0.06410622077946374)}
2024-12-07 00:07:15,596 - INFO - Candidate Std Stats: {'Max': np.float64(1.1459029370184195), 'Min': np.float64(0.0), 'Mean': np.float64(0.1101395233406642), 'Std': np.float64(0.051097202642568104)}
[I 2024-12-07 00:07:15,646] Trial 71 finished with value: 1.2333333333333334 and parameters: {'x_0_0': 'ac', 'x_0_1': 'ac', 'x_0_2': 'ab', 'x_1_0': 'bd', 'x_1_1': 'bc', 'x_1_2': 'oo'}. Best is trial 32 with value: 0.9444444444444444.
2024-12-07 00:07:26,144 - INFO - Candidate Mean Stats: {'Max': np.float64(2.0), 'Min': np.float64(0.2628384450387115), 'Mean': np.float64(0.48030292079681003), 'Std': np.float64(0.06366078427690462)}
2024-12-07 00:07:26,145 - INFO - Candidate Std Stats: {'Max': np.float64(1.5675563621278923), 'Min': np.float64(0.0), 'Mean': np.float64(0.10628939085835304), 'Std': np.float64(0.050741555945640344)}
[I 2024-12-07 00:07:26,197] Trial 72 finished with value: 1.2666666666666666 and parameters: {'x_0_0': 'ad', 'x_0_1': 'oo', 'x_0_2': 'ab', 'x_1_0': 'cd', 'x_1_1': 'ab', 'x_1_2': 'cd'}. Best is trial 63 with value: 1.1222222222222222.
2024-12-07 00:07:29,113 - INFO - Candidate Mean Stats: {'Max': np.float64(2.0), 'Min': np.float64(0.30657197276712106), 'Mean': np.float64(0.4964950780631602), 'Std': np.float64(0.05779447984921913)}
2024-12-07 00:07:29,115 - INFO - Candidate Std Stats: {'Max': np.float64(0.3076102465852203), 'Min': np.float64(0.0), 'Mean': np.float64(0.09698376273662145), 'Std': np.float64(0.039647656142448244)}
[I 2024-12-07 00:07:29,181] Trial 72 finished with value: 1.3333333333333333 and parameters: {'x_0_0': 'bc', 'x_0_1': 'ad', 'x_0_2': 'bc', 'x_1_0': 'ab', 'x_1_1': 'ab', 'x_1_2': 'cd'}. Best is trial 49 with value: 0.7999999999999999.
2024-12-07 00:07:32,074 - INFO - Candidate Mean Stats: {'Max': np.float64(2.0), 'Min': np.float64(0.24519202408212748), 'Mean': np.float64(0.4858072751077253), 'Std': np.float64(0.07329662455678974)}
2024-12-07 00:07:32,076 - INFO - Candidate Std Stats: {'Max': np.float64(1.0694716507243252), 'Min': np.float64(0.0), 'Mean': np.float64(0.11645994823137108), 'Std': np.float64(0.05787100820124989)}
[I 2024-12-07 00:07:32,125] Trial 72 finished with value: 1.5555555555555556 and parameters: {'x_0_0': 'ac', 'x_0_1': 'ab', 'x_0_2': 'ac', 'x_1_0': 'bc', 'x_1_1': 'bd', 'x_1_2': 'ad'}. Best is trial 67 with value: 1.0222222222222221.
2024-12-07 00:07:38,905 - INFO - Candidate Mean Stats: {'Max': np.float64(2.0), 'Min': np.float64(0.20968555544991113), 'Mean': np.float64(0.48903666848432387), 'Std': np.float64(0.06918586830707592)}
2024-12-07 00:07:38,907 - INFO - Candidate Std Stats: {'Max': np.float64(1.4907402209477174), 'Min': np.float64(0.0), 'Mean': np.float64(0.11433831298583164), 'Std': np.float64(0.054083989052164286)}
[I 2024-12-07 00:07:38,951] Trial 72 finished with value: 1.3666666666666667 and parameters: {'x_0_0': 'bc', 'x_0_1': 'cd', 'x_0_2': 'bc', 'x_1_0': 'oo', 'x_1_1': 'oo', 'x_1_2': 'bd'}. Best is trial 32 with value: 0.9444444444444444.
2024-12-07 00:07:51,453 - INFO - Candidate Mean Stats: {'Max': np.float64(2.0), 'Min': np.float64(0.25497016528379524), 'Mean': np.float64(0.4862079089713344), 'Std': np.float64(0.06959083545568263)}
2024-12-07 00:07:51,454 - INFO - Candidate Std Stats: {'Max': np.float64(1.5432720756559029), 'Min': np.float64(0.0), 'Mean': np.float64(0.11159049134126962), 'Std': np.float64(0.056409899181607326)}
[I 2024-12-07 00:07:51,502] Trial 73 finished with value: 1.5555555555555556 and parameters: {'x_0_0': 'ad', 'x_0_1': 'ad', 'x_0_2': 'ab', 'x_1_0': 'ab', 'x_1_1': 'bd', 'x_1_2': 'bd'}. Best is trial 63 with value: 1.1222222222222222.
2024-12-07 00:07:53,940 - INFO - Candidate Mean Stats: {'Max': np.float64(2.0), 'Min': np.float64(0.19278192769346147), 'Mean': np.float64(0.4857130212008599), 'Std': np.float64(0.06238317174777836)}
2024-12-07 00:07:53,942 - INFO - Candidate Std Stats: {'Max': np.float64(0.4469221360466062), 'Min': np.float64(0.0), 'Mean': np.float64(0.11856994145581319), 'Std': np.float64(0.04918211295351202)}
[I 2024-12-07 00:07:53,988] Trial 73 finished with value: 1.5 and parameters: {'x_0_0': 'oo', 'x_0_1': 'oo', 'x_0_2': 'ac', 'x_1_0': 'ad', 'x_1_1': 'ac', 'x_1_2': 'bd'}. Best is trial 49 with value: 0.7999999999999999.
2024-12-07 00:07:56,604 - INFO - Candidate Mean Stats: {'Max': np.float64(2.0), 'Min': np.float64(0.22286042642037618), 'Mean': np.float64(0.4874697758523133), 'Std': np.float64(0.06823757916340535)}
2024-12-07 00:07:56,604 - INFO - Candidate Std Stats: {'Max': np.float64(0.556069283367503), 'Min': np.float64(0.0), 'Mean': np.float64(0.1117837412779787), 'Std': np.float64(0.048718031272475745)}
[I 2024-12-07 00:07:56,651] Trial 73 finished with value: 1.4777777777777779 and parameters: {'x_0_0': 'ab', 'x_0_1': 'ac', 'x_0_2': 'ad', 'x_1_0': 'oo', 'x_1_1': 'cd', 'x_1_2': 'oo'}. Best is trial 67 with value: 1.0222222222222221.
2024-12-07 00:08:02,697 - INFO - Candidate Mean Stats: {'Max': np.float64(2.0), 'Min': np.float64(0.18983891025996197), 'Mean': np.float64(0.48617515488150825), 'Std': np.float64(0.06515958146704352)}
2024-12-07 00:08:02,698 - INFO - Candidate Std Stats: {'Max': np.float64(0.7847057790681659), 'Min': np.float64(0.0), 'Mean': np.float64(0.11377506672912797), 'Std': np.float64(0.05273846337034353)}
[I 2024-12-07 00:08:02,745] Trial 73 finished with value: 1.6666666666666665 and parameters: {'x_0_0': 'ac', 'x_0_1': 'bd', 'x_0_2': 'cd', 'x_1_0': 'ad', 'x_1_1': 'cd', 'x_1_2': 'cd'}. Best is trial 32 with value: 0.9444444444444444.
2024-12-07 00:08:14,226 - INFO - Candidate Mean Stats: {'Max': np.float64(2.0), 'Min': np.float64(0.2854436622314087), 'Mean': np.float64(0.49682851372856435), 'Std': np.float64(0.061953536778331396)}
2024-12-07 00:08:14,227 - INFO - Candidate Std Stats: {'Max': np.float64(0.5224540875471192), 'Min': np.float64(0.0), 'Mean': np.float64(0.1030077482825638), 'Std': np.float64(0.042225570430666055)}
[I 2024-12-07 00:08:14,276] Trial 74 finished with value: 2.0 and parameters: {'x_0_0': 'cd', 'x_0_1': 'bd', 'x_0_2': 'ac', 'x_1_0': 'ad', 'x_1_1': 'ac', 'x_1_2': 'ab'}. Best is trial 63 with value: 1.1222222222222222.
2024-12-07 00:08:17,088 - INFO - Candidate Mean Stats: {'Max': np.float64(2.0), 'Min': np.float64(0.25390100035261814), 'Mean': np.float64(0.48364146658983287), 'Std': np.float64(0.06375124490567047)}
2024-12-07 00:08:17,089 - INFO - Candidate Std Stats: {'Max': np.float64(0.6673263385219922), 'Min': np.float64(0.0), 'Mean': np.float64(0.10303093241541393), 'Std': np.float64(0.044890727979033894)}
[I 2024-12-07 00:08:17,146] Trial 74 finished with value: 1.3666666666666667 and parameters: {'x_0_0': 'ad', 'x_0_1': 'ad', 'x_0_2': 'ad', 'x_1_0': 'oo', 'x_1_1': 'oo', 'x_1_2': 'ad'}. Best is trial 49 with value: 0.7999999999999999.
2024-12-07 00:08:20,109 - INFO - Candidate Mean Stats: {'Max': np.float64(2.0), 'Min': np.float64(0.30736041189682717), 'Mean': np.float64(0.48252466907738084), 'Std': np.float64(0.06547225946115237)}
2024-12-07 00:08:20,110 - INFO - Candidate Std Stats: {'Max': np.float64(1.4504327449846104), 'Min': np.float64(0.0), 'Mean': np.float64(0.10490020375088058), 'Std': np.float64(0.05373697738247526)}
[I 2024-12-07 00:08:20,170] Trial 74 finished with value: 1.6666666666666665 and parameters: {'x_0_0': 'bd', 'x_0_1': 'bd', 'x_0_2': 'ab', 'x_1_0': 'ac', 'x_1_1': 'cd', 'x_1_2': 'ab'}. Best is trial 67 with value: 1.0222222222222221.
2024-12-07 00:08:27,246 - INFO - Candidate Mean Stats: {'Max': np.float64(2.0), 'Min': np.float64(0.23097278202628008), 'Mean': np.float64(0.4891276486799198), 'Std': np.float64(0.06473008893771383)}
2024-12-07 00:08:27,247 - INFO - Candidate Std Stats: {'Max': np.float64(0.37948104111440556), 'Min': np.float64(0.0), 'Mean': np.float64(0.10966573721444443), 'Std': np.float64(0.04528958935293177)}
[I 2024-12-07 00:08:27,305] Trial 74 finished with value: 0.8222222222222222 and parameters: {'x_0_0': 'bd', 'x_0_1': 'oo', 'x_0_2': 'ab', 'x_1_0': 'bc', 'x_1_1': 'ad', 'x_1_2': 'ac'}. Best is trial 74 with value: 0.8222222222222222.
2024-12-07 00:08:37,672 - INFO - Candidate Mean Stats: {'Max': np.float64(2.0), 'Min': np.float64(0.24632580175898355), 'Mean': np.float64(0.480441873839617), 'Std': np.float64(0.06327487354797832)}
2024-12-07 00:08:37,674 - INFO - Candidate Std Stats: {'Max': np.float64(0.41798328030480886), 'Min': np.float64(0.0), 'Mean': np.float64(0.10569922378573454), 'Std': np.float64(0.04284509354333068)}
[I 2024-12-07 00:08:37,808] Trial 75 finished with value: 1.3555555555555556 and parameters: {'x_0_0': 'bc', 'x_0_1': 'ab', 'x_0_2': 'oo', 'x_1_0': 'bd', 'x_1_1': 'bd', 'x_1_2': 'oo'}. Best is trial 63 with value: 1.1222222222222222.
2024-12-07 00:08:40,281 - INFO - Candidate Mean Stats: {'Max': np.float64(2.0), 'Min': np.float64(0.27672415680092827), 'Mean': np.float64(0.49978825930980164), 'Std': np.float64(0.06333214485710117)}
2024-12-07 00:08:40,282 - INFO - Candidate Std Stats: {'Max': np.float64(0.7036422814446326), 'Min': np.float64(0.0), 'Mean': np.float64(0.10086591930444445), 'Std': np.float64(0.04269437544363729)}
[I 2024-12-07 00:08:40,328] Trial 75 finished with value: 1.2666666666666666 and parameters: {'x_0_0': 'ac', 'x_0_1': 'oo', 'x_0_2': 'ab', 'x_1_0': 'bd', 'x_1_1': 'ac', 'x_1_2': 'bc'}. Best is trial 49 with value: 0.7999999999999999.
2024-12-07 00:08:42,947 - INFO - Candidate Mean Stats: {'Max': np.float64(2.0), 'Min': np.float64(0.24667636424201472), 'Mean': np.float64(0.48868673938306856), 'Std': np.float64(0.06874686468334171)}
2024-12-07 00:08:42,948 - INFO - Candidate Std Stats: {'Max': np.float64(0.36420292983073593), 'Min': np.float64(0.0), 'Mean': np.float64(0.10770849454251549), 'Std': np.float64(0.04259678599711026)}
[I 2024-12-07 00:08:42,993] Trial 75 finished with value: 1.4555555555555555 and parameters: {'x_0_0': 'bd', 'x_0_1': 'ab', 'x_0_2': 'oo', 'x_1_0': 'ab', 'x_1_1': 'ab', 'x_1_2': 'ac'}. Best is trial 67 with value: 1.0222222222222221.
2024-12-07 00:08:48,912 - INFO - Candidate Mean Stats: {'Max': np.float64(2.0), 'Min': np.float64(0.2795701812217074), 'Mean': np.float64(0.4925205979429618), 'Std': np.float64(0.060887156227356166)}
2024-12-07 00:08:48,914 - INFO - Candidate Std Stats: {'Max': np.float64(0.7477442701649735), 'Min': np.float64(0.0), 'Mean': np.float64(0.10512569335940772), 'Std': np.float64(0.04630761404027466)}
[I 2024-12-07 00:08:48,957] Trial 75 finished with value: 1.3777777777777778 and parameters: {'x_0_0': 'ab', 'x_0_1': 'oo', 'x_0_2': 'ac', 'x_1_0': 'bd', 'x_1_1': 'ab', 'x_1_2': 'ab'}. Best is trial 74 with value: 0.8222222222222222.
2024-12-07 00:08:58,979 - INFO - Candidate Mean Stats: {'Max': np.float64(2.0), 'Min': np.float64(0.262202031407985), 'Mean': np.float64(0.48427826151482395), 'Std': np.float64(0.06462823381734939)}
2024-12-07 00:08:58,980 - INFO - Candidate Std Stats: {'Max': np.float64(0.33196741597934587), 'Min': np.float64(0.0), 'Mean': np.float64(0.1053596892174266), 'Std': np.float64(0.04138924194398012)}
[I 2024-12-07 00:08:59,025] Trial 76 finished with value: 1.6666666666666665 and parameters: {'x_0_0': 'bc', 'x_0_1': 'bc', 'x_0_2': 'ad', 'x_1_0': 'bc', 'x_1_1': 'bd', 'x_1_2': 'ac'}. Best is trial 63 with value: 1.1222222222222222.
2024-12-07 00:09:01,615 - INFO - Candidate Mean Stats: {'Max': np.float64(2.0), 'Min': np.float64(0.26407568350603555), 'Mean': np.float64(0.49360718169733747), 'Std': np.float64(0.06432408626771521)}
2024-12-07 00:09:01,616 - INFO - Candidate Std Stats: {'Max': np.float64(0.45732721154574474), 'Min': np.float64(0.0), 'Mean': np.float64(0.10925849339323206), 'Std': np.float64(0.04594490728069938)}
[I 2024-12-07 00:09:01,661] Trial 76 finished with value: 1.2666666666666666 and parameters: {'x_0_0': 'bd', 'x_0_1': 'oo', 'x_0_2': 'ab', 'x_1_0': 'cd', 'x_1_1': 'cd', 'x_1_2': 'ab'}. Best is trial 49 with value: 0.7999999999999999.
2024-12-07 00:09:03,978 - INFO - Candidate Mean Stats: {'Max': np.float64(2.0), 'Min': np.float64(0.27692264248920784), 'Mean': np.float64(0.4961545232150128), 'Std': np.float64(0.06618457872437793)}
2024-12-07 00:09:03,978 - INFO - Candidate Std Stats: {'Max': np.float64(0.5728478638426073), 'Min': np.float64(0.0), 'Mean': np.float64(0.1049406897427019), 'Std': np.float64(0.04616298585951784)}
[I 2024-12-07 00:09:04,022] Trial 76 finished with value: 1.2666666666666666 and parameters: {'x_0_0': 'bc', 'x_0_1': 'oo', 'x_0_2': 'bd', 'x_1_0': 'ac', 'x_1_1': 'ab', 'x_1_2': 'ac'}. Best is trial 67 with value: 1.0222222222222221.
2024-12-07 00:09:13,891 - INFO - Candidate Mean Stats: {'Max': np.float64(2.0), 'Min': np.float64(0.2642563598555968), 'Mean': np.float64(0.49258671957715666), 'Std': np.float64(0.06285849023864375)}
2024-12-07 00:09:13,893 - INFO - Candidate Std Stats: {'Max': np.float64(1.6550224554158997), 'Min': np.float64(0.0), 'Mean': np.float64(0.09835156040757936), 'Std': np.float64(0.044099148726875974)}
[I 2024-12-07 00:09:14,025] Trial 76 finished with value: 1.6666666666666665 and parameters: {'x_0_0': 'ad', 'x_0_1': 'ad', 'x_0_2': 'ac', 'x_1_0': 'cd', 'x_1_1': 'ad', 'x_1_2': 'cd'}. Best is trial 74 with value: 0.8222222222222222.
2024-12-07 00:09:26,780 - INFO - Candidate Mean Stats: {'Max': np.float64(2.0), 'Min': np.float64(0.19141607718396508), 'Mean': np.float64(0.48708271017630317), 'Std': np.float64(0.0691866956732399)}
2024-12-07 00:09:26,780 - INFO - Candidate Std Stats: {'Max': np.float64(0.5263137519333395), 'Min': np.float64(0.0), 'Mean': np.float64(0.11103927609258665), 'Std': np.float64(0.04812110111364558)}
[I 2024-12-07 00:09:26,830] Trial 77 finished with value: 1.9 and parameters: {'x_0_0': 'oo', 'x_0_1': 'ab', 'x_0_2': 'ad', 'x_1_0': 'bc', 'x_1_1': 'bd', 'x_1_2': 'ad'}. Best is trial 63 with value: 1.1222222222222222.
2024-12-07 00:09:30,151 - INFO - Candidate Mean Stats: {'Max': np.float64(2.0), 'Min': np.float64(0.20850520072953665), 'Mean': np.float64(0.48325607055686004), 'Std': np.float64(0.06724528341760355)}
2024-12-07 00:09:30,152 - INFO - Candidate Std Stats: {'Max': np.float64(1.3918634922369884), 'Min': np.float64(0.0), 'Mean': np.float64(0.12052237271532305), 'Std': np.float64(0.05418398145435253)}
[I 2024-12-07 00:09:30,211] Trial 77 finished with value: 1.3666666666666667 and parameters: {'x_0_0': 'bd', 'x_0_1': 'cd', 'x_0_2': 'oo', 'x_1_0': 'oo', 'x_1_1': 'ab', 'x_1_2': 'ab'}. Best is trial 49 with value: 0.7999999999999999.
2024-12-07 00:09:33,354 - INFO - Candidate Mean Stats: {'Max': np.float64(2.0), 'Min': np.float64(0.17862840707722535), 'Mean': np.float64(0.4842478040152832), 'Std': np.float64(0.06188311152326803)}
2024-12-07 00:09:33,355 - INFO - Candidate Std Stats: {'Max': np.float64(0.5779952962635658), 'Min': np.float64(0.0), 'Mean': np.float64(0.10222477922605112), 'Std': np.float64(0.043556279354028435)}
[I 2024-12-07 00:09:33,419] Trial 77 finished with value: 1.6 and parameters: {'x_0_0': 'cd', 'x_0_1': 'oo', 'x_0_2': 'ab', 'x_1_0': 'bc', 'x_1_1': 'ac', 'x_1_2': 'cd'}. Best is trial 67 with value: 1.0222222222222221.
2024-12-07 00:09:41,035 - INFO - Candidate Mean Stats: {'Max': np.float64(2.0), 'Min': np.float64(0.28008864483881807), 'Mean': np.float64(0.4947452066076535), 'Std': np.float64(0.06679048722879953)}
2024-12-07 00:09:41,037 - INFO - Candidate Std Stats: {'Max': np.float64(1.673197001964826), 'Min': np.float64(0.0), 'Mean': np.float64(0.1088549492203939), 'Std': np.float64(0.05926240826999556)}
[I 2024-12-07 00:09:41,107] Trial 77 finished with value: 1.6666666666666665 and parameters: {'x_0_0': 'bd', 'x_0_1': 'cd', 'x_0_2': 'ab', 'x_1_0': 'ad', 'x_1_1': 'ab', 'x_1_2': 'cd'}. Best is trial 74 with value: 0.8222222222222222.
2024-12-07 00:09:51,971 - INFO - Candidate Mean Stats: {'Max': np.float64(2.0), 'Min': np.float64(0.2319704473072115), 'Mean': np.float64(0.47928829379853477), 'Std': np.float64(0.07376218117318258)}
2024-12-07 00:09:51,972 - INFO - Candidate Std Stats: {'Max': np.float64(1.341392859083431), 'Min': np.float64(0.0), 'Mean': np.float64(0.11467606194512917), 'Std': np.float64(0.061499966356597276)}
