[I 2024-12-06 23:38:56,454] Trial 458 finished with value: 1.2142857142857144 and parameters: {'x_0_0': 'ab', 'x_0_1': 'oo', 'x_1_0': 'bc', 'x_1_1': 'ab'}. Best is trial 165 with value: 0.5.
2024-12-06 23:38:56,495 - INFO - Candidate Mean Stats: {'Max': np.float64(2.709506971061435), 'Min': np.float64(-0.18498393966684318), 'Mean': np.float64(0.8531161512213952), 'Std': np.float64(0.43648265543516007)}
2024-12-06 23:38:56,495 - INFO - Candidate Std Stats: {'Max': np.float64(1.6600015475234402), 'Min': np.float64(0.0), 'Mean': np.float64(0.41731211359114284), 'Std': np.float64(0.2897661839659646)}
[I 2024-12-06 23:38:56,509] Trial 458 finished with value: 1.3214285714285714 and parameters: {'x_0_0': 'ad', 'x_0_1': 'cd', 'x_1_0': 'oo', 'x_1_1': 'ac'}. Best is trial 63 with value: 0.5.
2024-12-06 23:38:56,771 - INFO - Candidate Mean Stats: {'Max': np.float64(2.8290305216286717), 'Min': np.float64(-0.5410003477268092), 'Mean': np.float64(0.8326024733485315), 'Std': np.float64(0.5357775186238839)}
2024-12-06 23:38:56,771 - INFO - Candidate Std Stats: {'Max': np.float64(1.755702693036792), 'Min': np.float64(0.0), 'Mean': np.float64(0.41609071581998414), 'Std': np.float64(0.2791527499706406)}
[I 2024-12-06 23:38:56,788] Trial 456 finished with value: 1.1607142857142856 and parameters: {'x_0_0': 'bc', 'x_0_1': 'ad', 'x_1_0': 'ad', 'x_1_1': 'oo'}. Best is trial 23 with value: 0.5.
2024-12-06 23:38:56,858 - INFO - Candidate Mean Stats: {'Max': np.float64(2.8470736653288884), 'Min': np.float64(-0.4468052368968857), 'Mean': np.float64(0.8216576139223376), 'Std': np.float64(0.5181091275376417)}
2024-12-06 23:38:56,858 - INFO - Candidate Std Stats: {'Max': np.float64(1.6212066324402987), 'Min': np.float64(0.0), 'Mean': np.float64(0.45114579908959124), 'Std': np.float64(0.3007383297519574)}
[I 2024-12-06 23:38:56,877] Trial 459 finished with value: 1.4464285714285714 and parameters: {'x_0_0': 'ad', 'x_0_1': 'ac', 'x_1_0': 'ac', 'x_1_1': 'oo'}. Best is trial 76 with value: 0.5.
2024-12-06 23:38:56,926 - INFO - Candidate Mean Stats: {'Max': np.float64(2.9495578650230327), 'Min': np.float64(-0.6542612844105393), 'Mean': np.float64(0.7604134421181269), 'Std': np.float64(0.5552685080907828)}
2024-12-06 23:38:56,926 - INFO - Candidate Std Stats: {'Max': np.float64(1.503881185292462), 'Min': np.float64(0.0), 'Mean': np.float64(0.4887423967757406), 'Std': np.float64(0.31028503616138375)}
[I 2024-12-06 23:38:56,949] Trial 459 finished with value: 1.4464285714285714 and parameters: {'x_0_0': 'ad', 'x_0_1': 'ab', 'x_1_0': 'ad', 'x_1_1': 'oo'}. Best is trial 165 with value: 0.5.
2024-12-06 23:38:56,997 - INFO - Candidate Mean Stats: {'Max': np.float64(2.8869908358906846), 'Min': np.float64(-0.556188080910357), 'Mean': np.float64(0.8240417672692969), 'Std': np.float64(0.49083328681006316)}
2024-12-06 23:38:56,997 - INFO - Candidate Std Stats: {'Max': np.float64(1.6550745992641112), 'Min': np.float64(0.0), 'Mean': np.float64(0.4123169229390271), 'Std': np.float64(0.28274186188808986)}
[I 2024-12-06 23:38:57,031] Trial 459 finished with value: 1.0357142857142856 and parameters: {'x_0_0': 'ac', 'x_0_1': 'ac', 'x_1_0': 'oo', 'x_1_1': 'cd'}. Best is trial 63 with value: 0.5.
2024-12-06 23:38:57,314 - INFO - Candidate Mean Stats: {'Max': np.float64(2.9440222872285795), 'Min': np.float64(-0.4221503662226544), 'Mean': np.float64(0.8396764759056958), 'Std': np.float64(0.4738817221320962)}
2024-12-06 23:38:57,314 - INFO - Candidate Std Stats: {'Max': np.float64(1.2627973350679051), 'Min': np.float64(0.0), 'Mean': np.float64(0.3763125095313601), 'Std': np.float64(0.25300258913082296)}
[I 2024-12-06 23:38:57,345] Trial 457 finished with value: 1.4285714285714286 and parameters: {'x_0_0': 'ac', 'x_0_1': 'ab', 'x_1_0': 'bd', 'x_1_1': 'ad'}. Best is trial 23 with value: 0.5.
2024-12-06 23:38:57,420 - INFO - Candidate Mean Stats: {'Max': np.float64(3.6083541265069634), 'Min': np.float64(-0.5628828592369262), 'Mean': np.float64(0.810641801739706), 'Std': np.float64(0.5263303282928479)}
2024-12-06 23:38:57,420 - INFO - Candidate Std Stats: {'Max': np.float64(1.475635082469684), 'Min': np.float64(0.0), 'Mean': np.float64(0.41008136873107787), 'Std': np.float64(0.26639846141396945)}
[I 2024-12-06 23:38:57,449] Trial 460 finished with value: 1.2857142857142856 and parameters: {'x_0_0': 'bc', 'x_0_1': 'ac', 'x_1_0': 'bd', 'x_1_1': 'ab'}. Best is trial 76 with value: 0.5.
2024-12-06 23:38:57,489 - INFO - Candidate Mean Stats: {'Max': np.float64(3.4877892258324557), 'Min': np.float64(-0.4513541452606855), 'Mean': np.float64(0.8474547755582795), 'Std': np.float64(0.49279652177614786)}
2024-12-06 23:38:57,489 - INFO - Candidate Std Stats: {'Max': np.float64(1.4592898426719103), 'Min': np.float64(0.0), 'Mean': np.float64(0.4257102570020179), 'Std': np.float64(0.2807281665269123)}
[I 2024-12-06 23:38:57,506] Trial 460 finished with value: 1.4464285714285714 and parameters: {'x_0_0': 'ad', 'x_0_1': 'ad', 'x_1_0': 'ac', 'x_1_1': 'oo'}. Best is trial 165 with value: 0.5.
2024-12-06 23:38:57,557 - INFO - Candidate Mean Stats: {'Max': np.float64(3.333709508721337), 'Min': np.float64(-0.2410291582145442), 'Mean': np.float64(0.8582300583500045), 'Std': np.float64(0.4321172893049418)}
2024-12-06 23:38:57,557 - INFO - Candidate Std Stats: {'Max': np.float64(1.873047134086843), 'Min': np.float64(0.0), 'Mean': np.float64(0.41434260533064354), 'Std': np.float64(0.3052763446540348)}
[I 2024-12-06 23:38:57,574] Trial 460 finished with value: 1.0714285714285714 and parameters: {'x_0_0': 'ad', 'x_0_1': 'oo', 'x_1_0': 'ad', 'x_1_1': 'ab'}. Best is trial 63 with value: 0.5.
2024-12-06 23:38:57,792 - INFO - Candidate Mean Stats: {'Max': np.float64(2.918604007059477), 'Min': np.float64(-0.3571909905717452), 'Mean': np.float64(0.8376906813599323), 'Std': np.float64(0.5248891078089207)}
2024-12-06 23:38:57,792 - INFO - Candidate Std Stats: {'Max': np.float64(1.5410794644204542), 'Min': np.float64(0.0), 'Mean': np.float64(0.40492966473725656), 'Std': np.float64(0.26902439813425466)}
[I 2024-12-06 23:38:57,807] Trial 458 finished with value: 1.5714285714285714 and parameters: {'x_0_0': 'ad', 'x_0_1': 'bd', 'x_1_0': 'ad', 'x_1_1': 'ac'}. Best is trial 23 with value: 0.5.
2024-12-06 23:38:57,867 - INFO - Candidate Mean Stats: {'Max': np.float64(3.521628599076057), 'Min': np.float64(-0.9923378852843623), 'Mean': np.float64(0.8116514561137828), 'Std': np.float64(0.5686280524837432)}
2024-12-06 23:38:57,868 - INFO - Candidate Std Stats: {'Max': np.float64(1.4051237880876748), 'Min': np.float64(0.0), 'Mean': np.float64(0.42385447572804463), 'Std': np.float64(0.27898846412098594)}
[I 2024-12-06 23:38:57,883] Trial 461 finished with value: 1.625 and parameters: {'x_0_0': 'oo', 'x_0_1': 'ad', 'x_1_0': 'oo', 'x_1_1': 'ab'}. Best is trial 76 with value: 0.5.
2024-12-06 23:38:57,927 - INFO - Candidate Mean Stats: {'Max': np.float64(3.759270660536925), 'Min': np.float64(-0.40418474768308166), 'Mean': np.float64(0.8267905399815374), 'Std': np.float64(0.5113482362768434)}
2024-12-06 23:38:57,927 - INFO - Candidate Std Stats: {'Max': np.float64(1.4460023124277828), 'Min': np.float64(0.0), 'Mean': np.float64(0.4346661753696052), 'Std': np.float64(0.293160061192837)}
[I 2024-12-06 23:38:57,942] Trial 461 finished with value: 1.0535714285714286 and parameters: {'x_0_0': 'ac', 'x_0_1': 'ab', 'x_1_0': 'oo', 'x_1_1': 'oo'}. Best is trial 165 with value: 0.5.
2024-12-06 23:38:57,994 - INFO - Candidate Mean Stats: {'Max': np.float64(2.7967851677713154), 'Min': np.float64(-0.2525598810916983), 'Mean': np.float64(0.8449785536023253), 'Std': np.float64(0.4683516474375869)}
2024-12-06 23:38:57,994 - INFO - Candidate Std Stats: {'Max': np.float64(1.2934505833763947), 'Min': np.float64(0.0), 'Mean': np.float64(0.3606572546374239), 'Std': np.float64(0.24860980100502525)}
[I 2024-12-06 23:38:58,011] Trial 461 finished with value: 1.2142857142857144 and parameters: {'x_0_0': 'ab', 'x_0_1': 'oo', 'x_1_0': 'ab', 'x_1_1': 'ac'}. Best is trial 63 with value: 0.5.
2024-12-06 23:38:58,228 - INFO - Candidate Mean Stats: {'Max': np.float64(2.9210678494098405), 'Min': np.float64(-0.41048827127344245), 'Mean': np.float64(0.8423304982888724), 'Std': np.float64(0.515352009265867)}
2024-12-06 23:38:58,228 - INFO - Candidate Std Stats: {'Max': np.float64(1.365173514914116), 'Min': np.float64(0.0), 'Mean': np.float64(0.42526128883861825), 'Std': np.float64(0.28078688492947623)}
[I 2024-12-06 23:38:58,244] Trial 459 finished with value: 1.3214285714285714 and parameters: {'x_0_0': 'bd', 'x_0_1': 'cd', 'x_1_0': 'oo', 'x_1_1': 'ac'}. Best is trial 23 with value: 0.5.
2024-12-06 23:38:58,300 - INFO - Candidate Mean Stats: {'Max': np.float64(2.9727337730549), 'Min': np.float64(-0.7806837787656613), 'Mean': np.float64(0.8234361490338393), 'Std': np.float64(0.558122789939591)}
2024-12-06 23:38:58,300 - INFO - Candidate Std Stats: {'Max': np.float64(1.4295129661194799), 'Min': np.float64(0.0), 'Mean': np.float64(0.45461749682234875), 'Std': np.float64(0.3079459471764396)}
[I 2024-12-06 23:38:58,315] Trial 462 finished with value: 1.0714285714285714 and parameters: {'x_0_0': 'bc', 'x_0_1': 'oo', 'x_1_0': 'ab', 'x_1_1': 'ab'}. Best is trial 76 with value: 0.5.
2024-12-06 23:38:58,360 - INFO - Candidate Mean Stats: {'Max': np.float64(3.431372405951474), 'Min': np.float64(-0.4743035868361246), 'Mean': np.float64(0.7614034549046216), 'Std': np.float64(0.5473872344125651)}
2024-12-06 23:38:58,360 - INFO - Candidate Std Stats: {'Max': np.float64(1.692814176446359), 'Min': np.float64(0.0), 'Mean': np.float64(0.5123131263751076), 'Std': np.float64(0.33635157232401325)}
[I 2024-12-06 23:38:58,375] Trial 462 finished with value: 1.4464285714285714 and parameters: {'x_0_0': 'bd', 'x_0_1': 'cd', 'x_1_0': 'ad', 'x_1_1': 'oo'}. Best is trial 165 with value: 0.5.
2024-12-06 23:38:58,424 - INFO - Candidate Mean Stats: {'Max': np.float64(3.040725223304438), 'Min': np.float64(-0.25716725075987745), 'Mean': np.float64(0.8318380692718326), 'Std': np.float64(0.4506353202663521)}
2024-12-06 23:38:58,424 - INFO - Candidate Std Stats: {'Max': np.float64(1.5681949606560739), 'Min': np.float64(0.0), 'Mean': np.float64(0.48419676971891146), 'Std': np.float64(0.3258890078822744)}
[I 2024-12-06 23:38:58,440] Trial 462 finished with value: 1.2857142857142856 and parameters: {'x_0_0': 'ac', 'x_0_1': 'ac', 'x_1_0': 'ab', 'x_1_1': 'ad'}. Best is trial 63 with value: 0.5.
2024-12-06 23:38:58,662 - INFO - Candidate Mean Stats: {'Max': np.float64(3.1121519927156345), 'Min': np.float64(-0.42938640340041345), 'Mean': np.float64(0.8296599458549656), 'Std': np.float64(0.520503595198945)}
2024-12-06 23:38:58,662 - INFO - Candidate Std Stats: {'Max': np.float64(1.6302462847448058), 'Min': np.float64(0.0), 'Mean': np.float64(0.4532160979216797), 'Std': np.float64(0.2968597806953186)}
[I 2024-12-06 23:38:58,679] Trial 460 finished with value: 1.5714285714285714 and parameters: {'x_0_0': 'ad', 'x_0_1': 'ac', 'x_1_0': 'ad', 'x_1_1': 'ab'}. Best is trial 23 with value: 0.5.
2024-12-06 23:38:58,736 - INFO - Candidate Mean Stats: {'Max': np.float64(2.904103289177858), 'Min': np.float64(-0.33662033138802655), 'Mean': np.float64(0.8257122088494196), 'Std': np.float64(0.4645058938952965)}
2024-12-06 23:38:58,737 - INFO - Candidate Std Stats: {'Max': np.float64(1.3754762089174648), 'Min': np.float64(0.0), 'Mean': np.float64(0.42472888466687164), 'Std': np.float64(0.2793199859116705)}
[I 2024-12-06 23:38:58,781] Trial 463 finished with value: 1.1785714285714286 and parameters: {'x_0_0': 'bc', 'x_0_1': 'ab', 'x_1_0': 'oo', 'x_1_1': 'bc'}. Best is trial 76 with value: 0.5.
2024-12-06 23:38:58,853 - INFO - Candidate Mean Stats: {'Max': np.float64(3.394273164205066), 'Min': np.float64(-0.5826495568742931), 'Mean': np.float64(0.8186627390899898), 'Std': np.float64(0.5142528975456584)}
2024-12-06 23:38:58,854 - INFO - Candidate Std Stats: {'Max': np.float64(1.388101135121547), 'Min': np.float64(0.0), 'Mean': np.float64(0.4104155994592118), 'Std': np.float64(0.2760806903554219)}
[I 2024-12-06 23:38:58,875] Trial 463 finished with value: 1.5714285714285714 and parameters: {'x_0_0': 'bd', 'x_0_1': 'ad', 'x_1_0': 'ac', 'x_1_1': 'ac'}. Best is trial 165 with value: 0.5.
2024-12-06 23:38:58,950 - INFO - Candidate Mean Stats: {'Max': np.float64(3.287761754505978), 'Min': np.float64(-0.6826736165597228), 'Mean': np.float64(0.7634726658451926), 'Std': np.float64(0.5469755865496767)}
2024-12-06 23:38:58,950 - INFO - Candidate Std Stats: {'Max': np.float64(1.348575646438309), 'Min': np.float64(0.0), 'Mean': np.float64(0.41648899067918244), 'Std': np.float64(0.27861197803721643)}
[I 2024-12-06 23:38:58,985] Trial 463 finished with value: 1.5714285714285714 and parameters: {'x_0_0': 'ac', 'x_0_1': 'bd', 'x_1_0': 'cd', 'x_1_1': 'ac'}. Best is trial 63 with value: 0.5.
2024-12-06 23:38:59,251 - INFO - Candidate Mean Stats: {'Max': np.float64(3.0557061111583286), 'Min': np.float64(-0.4931673801244318), 'Mean': np.float64(0.8647047764563921), 'Std': np.float64(0.5210950198512696)}
2024-12-06 23:38:59,252 - INFO - Candidate Std Stats: {'Max': np.float64(1.7232247746692595), 'Min': np.float64(0.0), 'Mean': np.float64(0.3948071846839413), 'Std': np.float64(0.26962104717361746)}
[I 2024-12-06 23:38:59,267] Trial 461 finished with value: 1.2857142857142856 and parameters: {'x_0_0': 'bd', 'x_0_1': 'bd', 'x_1_0': 'bd', 'x_1_1': 'cd'}. Best is trial 23 with value: 0.5.
2024-12-06 23:38:59,328 - INFO - Candidate Mean Stats: {'Max': np.float64(3.178349025946696), 'Min': np.float64(-0.6108022514385768), 'Mean': np.float64(0.816763574902528), 'Std': np.float64(0.5192984198341833)}
2024-12-06 23:38:59,329 - INFO - Candidate Std Stats: {'Max': np.float64(1.454793450113576), 'Min': np.float64(0.0), 'Mean': np.float64(0.42509055302491794), 'Std': np.float64(0.28631964633206897)}
[I 2024-12-06 23:38:59,344] Trial 464 finished with value: 1.375 and parameters: {'x_0_0': 'oo', 'x_0_1': 'oo', 'x_1_0': 'ab', 'x_1_1': 'cd'}. Best is trial 76 with value: 0.5.
2024-12-06 23:38:59,393 - INFO - Candidate Mean Stats: {'Max': np.float64(2.982456338682794), 'Min': np.float64(-0.35892215035426744), 'Mean': np.float64(0.8406876820613359), 'Std': np.float64(0.46477131388676124)}
2024-12-06 23:38:59,394 - INFO - Candidate Std Stats: {'Max': np.float64(1.3417948673206912), 'Min': np.float64(0.0), 'Mean': np.float64(0.4113366788401421), 'Std': np.float64(0.2765477038584653)}
[I 2024-12-06 23:38:59,409] Trial 464 finished with value: 1.1428571428571428 and parameters: {'x_0_0': 'ac', 'x_0_1': 'ad', 'x_1_0': 'ab', 'x_1_1': 'ab'}. Best is trial 165 with value: 0.5.
2024-12-06 23:38:59,490 - INFO - Candidate Mean Stats: {'Max': np.float64(3.1705425915956336), 'Min': np.float64(-0.4038077654255746), 'Mean': np.float64(0.8804561393762433), 'Std': np.float64(0.4512400052754603)}
2024-12-06 23:38:59,490 - INFO - Candidate Std Stats: {'Max': np.float64(1.51048783128386), 'Min': np.float64(0.0), 'Mean': np.float64(0.4181863355293061), 'Std': np.float64(0.2807072407344499)}
[I 2024-12-06 23:38:59,512] Trial 464 finished with value: 1.375 and parameters: {'x_0_0': 'oo', 'x_0_1': 'oo', 'x_1_0': 'cd', 'x_1_1': 'ab'}. Best is trial 63 with value: 0.5.
2024-12-06 23:38:59,739 - INFO - Candidate Mean Stats: {'Max': np.float64(3.2256991653781575), 'Min': np.float64(-0.4288925452341803), 'Mean': np.float64(0.8053544062384743), 'Std': np.float64(0.531010281551093)}
2024-12-06 23:38:59,739 - INFO - Candidate Std Stats: {'Max': np.float64(1.5846425439474896), 'Min': np.float64(0.0), 'Mean': np.float64(0.4857617231099818), 'Std': np.float64(0.3207130827110095)}
[I 2024-12-06 23:38:59,756] Trial 462 finished with value: 1.5714285714285714 and parameters: {'x_0_0': 'ac', 'x_0_1': 'bd', 'x_1_0': 'bd', 'x_1_1': 'cd'}. Best is trial 23 with value: 0.5.
2024-12-06 23:38:59,807 - INFO - Candidate Mean Stats: {'Max': np.float64(3.584435056378573), 'Min': np.float64(-0.4675531030218864), 'Mean': np.float64(0.7971294919708553), 'Std': np.float64(0.505264146000974)}
2024-12-06 23:38:59,807 - INFO - Candidate Std Stats: {'Max': np.float64(1.2315455358917708), 'Min': np.float64(0.0), 'Mean': np.float64(0.42588843634072143), 'Std': np.float64(0.27006455768184606)}
[I 2024-12-06 23:38:59,842] Trial 465 finished with value: 1.0357142857142856 and parameters: {'x_0_0': 'bc', 'x_0_1': 'ac', 'x_1_0': 'oo', 'x_1_1': 'bd'}. Best is trial 76 with value: 0.5.
2024-12-06 23:38:59,902 - INFO - Candidate Mean Stats: {'Max': np.float64(2.792560036186946), 'Min': np.float64(-0.4499679081051767), 'Mean': np.float64(0.8153725844063916), 'Std': np.float64(0.4877109643672591)}
2024-12-06 23:38:59,902 - INFO - Candidate Std Stats: {'Max': np.float64(1.6044606707254099), 'Min': np.float64(0.0), 'Mean': np.float64(0.473792818857481), 'Std': np.float64(0.31956850369880524)}
[I 2024-12-06 23:38:59,929] Trial 465 finished with value: 1.3392857142857144 and parameters: {'x_0_0': 'ab', 'x_0_1': 'ab', 'x_1_0': 'oo', 'x_1_1': 'oo'}. Best is trial 165 with value: 0.5.
2024-12-06 23:39:00,017 - INFO - Candidate Mean Stats: {'Max': np.float64(2.869364205896626), 'Min': np.float64(-0.35544863992603154), 'Mean': np.float64(0.849876647771001), 'Std': np.float64(0.4866826435344761)}
2024-12-06 23:39:00,017 - INFO - Candidate Std Stats: {'Max': np.float64(1.4243393836727958), 'Min': np.float64(0.0), 'Mean': np.float64(0.4275951267131069), 'Std': np.float64(0.29044865973002465)}
[I 2024-12-06 23:39:00,035] Trial 465 finished with value: 1.2142857142857144 and parameters: {'x_0_0': 'ab', 'x_0_1': 'oo', 'x_1_0': 'ad', 'x_1_1': 'ab'}. Best is trial 63 with value: 0.5.
2024-12-06 23:39:00,245 - INFO - Candidate Mean Stats: {'Max': np.float64(2.883295883567054), 'Min': np.float64(-0.3862960685888086), 'Mean': np.float64(0.8705605063233944), 'Std': np.float64(0.5057966563468304)}
2024-12-06 23:39:00,245 - INFO - Candidate Std Stats: {'Max': np.float64(1.2113698413442975), 'Min': np.float64(0.0), 'Mean': np.float64(0.3995027140052146), 'Std': np.float64(0.26206409139317927)}
[I 2024-12-06 23:39:00,260] Trial 463 finished with value: 0.75 and parameters: {'x_0_0': 'bc', 'x_0_1': 'ad', 'x_1_0': 'oo', 'x_1_1': 'bc'}. Best is trial 23 with value: 0.5.
2024-12-06 23:39:00,311 - INFO - Candidate Mean Stats: {'Max': np.float64(2.799158355773201), 'Min': np.float64(-0.4306777288455533), 'Mean': np.float64(0.8717659168815645), 'Std': np.float64(0.4783617896341582)}
2024-12-06 23:39:00,311 - INFO - Candidate Std Stats: {'Max': np.float64(1.5916423021875712), 'Min': np.float64(0.0), 'Mean': np.float64(0.41469958347668645), 'Std': np.float64(0.2778796813942024)}
[I 2024-12-06 23:39:00,327] Trial 466 finished with value: 1.0 and parameters: {'x_0_0': 'ac', 'x_0_1': 'ad', 'x_1_0': 'ab', 'x_1_1': 'bc'}. Best is trial 76 with value: 0.5.
2024-12-06 23:39:00,370 - INFO - Candidate Mean Stats: {'Max': np.float64(3.4212264041564304), 'Min': np.float64(-0.7787673216627234), 'Mean': np.float64(0.8282577257549913), 'Std': np.float64(0.4947846383313375)}
2024-12-06 23:39:00,370 - INFO - Candidate Std Stats: {'Max': np.float64(1.4698909534511921), 'Min': np.float64(0.0), 'Mean': np.float64(0.45970328913794817), 'Std': np.float64(0.3001734817115235)}
[I 2024-12-06 23:39:00,387] Trial 466 finished with value: 0.8928571428571428 and parameters: {'x_0_0': 'bc', 'x_0_1': 'ad', 'x_1_0': 'oo', 'x_1_1': 'ab'}. Best is trial 165 with value: 0.5.
2024-12-06 23:39:00,451 - INFO - Candidate Mean Stats: {'Max': np.float64(2.9833434712350386), 'Min': np.float64(-0.07372502907190452), 'Mean': np.float64(0.9136940176777686), 'Std': np.float64(0.4384949129412107)}
2024-12-06 23:39:00,451 - INFO - Candidate Std Stats: {'Max': np.float64(1.4513584695859711), 'Min': np.float64(0.0), 'Mean': np.float64(0.36129166147884834), 'Std': np.float64(0.2554735246728082)}
[I 2024-12-06 23:39:00,466] Trial 466 finished with value: 1.0714285714285714 and parameters: {'x_0_0': 'bd', 'x_0_1': 'oo', 'x_1_0': 'ad', 'x_1_1': 'ab'}. Best is trial 63 with value: 0.5.
2024-12-06 23:39:00,667 - INFO - Candidate Mean Stats: {'Max': np.float64(3.3580458678350062), 'Min': np.float64(-0.5164024551788686), 'Mean': np.float64(0.8025333075015446), 'Std': np.float64(0.5531850788462874)}
2024-12-06 23:39:00,667 - INFO - Candidate Std Stats: {'Max': np.float64(1.591619554708284), 'Min': np.float64(0.0), 'Mean': np.float64(0.4386131862883496), 'Std': np.float64(0.2855308015304747)}
[I 2024-12-06 23:39:00,683] Trial 464 finished with value: 1.3214285714285714 and parameters: {'x_0_0': 'bd', 'x_0_1': 'ab', 'x_1_0': 'oo', 'x_1_1': 'ad'}. Best is trial 23 with value: 0.5.
2024-12-06 23:39:00,729 - INFO - Candidate Mean Stats: {'Max': np.float64(3.334711861393167), 'Min': np.float64(-0.41911676392787395), 'Mean': np.float64(0.863665015151048), 'Std': np.float64(0.4976523399861556)}
2024-12-06 23:39:00,729 - INFO - Candidate Std Stats: {'Max': np.float64(1.4951434446076275), 'Min': np.float64(0.0), 'Mean': np.float64(0.43788708104489266), 'Std': np.float64(0.29427567388610903)}
[I 2024-12-06 23:39:00,746] Trial 467 finished with value: 1.5 and parameters: {'x_0_0': 'cd', 'x_0_1': 'oo', 'x_1_0': 'bc', 'x_1_1': 'cd'}. Best is trial 76 with value: 0.5.
2024-12-06 23:39:00,790 - INFO - Candidate Mean Stats: {'Max': np.float64(3.344202789371166), 'Min': np.float64(-0.5061758872497305), 'Mean': np.float64(0.7921243589251724), 'Std': np.float64(0.5557462443895431)}
2024-12-06 23:39:00,790 - INFO - Candidate Std Stats: {'Max': np.float64(1.6048051581108262), 'Min': np.float64(0.0), 'Mean': np.float64(0.4754076941122838), 'Std': np.float64(0.3139963752983457)}
