[I 2024-12-07 00:23:39,740] Trial 112 finished with value: 1.4444444444444444 and parameters: {'x_0_0': 'bd', 'x_0_1': 'bd', 'x_0_2': 'ab', 'x_1_0': 'bc', 'x_1_1': 'bc', 'x_1_2': 'ad'}. Best is trial 108 with value: 0.9666666666666667.
2024-12-07 00:23:41,518 - INFO - Candidate Mean Stats: {'Max': np.float64(2.0), 'Min': np.float64(0.26727355403768227), 'Mean': np.float64(0.4799114729537422), 'Std': np.float64(0.06721624189662774)}
2024-12-07 00:23:41,518 - INFO - Candidate Std Stats: {'Max': np.float64(0.4305906513633855), 'Min': np.float64(0.0), 'Mean': np.float64(0.10519199009288646), 'Std': np.float64(0.043095097799762554)}
[I 2024-12-07 00:23:41,563] Trial 112 finished with value: 1.5666666666666664 and parameters: {'x_0_0': 'ac', 'x_0_1': 'cd', 'x_0_2': 'oo', 'x_1_0': 'ad', 'x_1_1': 'bc', 'x_1_2': 'ad'}. Best is trial 49 with value: 0.7999999999999999.
2024-12-07 00:23:43,659 - INFO - Candidate Mean Stats: {'Max': np.float64(2.0), 'Min': np.float64(0.27560128040537624), 'Mean': np.float64(0.49799450265493406), 'Std': np.float64(0.0676220030868538)}
2024-12-07 00:23:43,659 - INFO - Candidate Std Stats: {'Max': np.float64(1.7815236869289242), 'Min': np.float64(0.0), 'Mean': np.float64(0.11173488093495511), 'Std': np.float64(0.05376248366888546)}
[I 2024-12-07 00:23:43,703] Trial 112 finished with value: 1.9 and parameters: {'x_0_0': 'cd', 'x_0_1': 'ac', 'x_0_2': 'ac', 'x_1_0': 'ab', 'x_1_1': 'bc', 'x_1_2': 'oo'}. Best is trial 99 with value: 0.9444444444444444.
2024-12-07 00:23:56,470 - INFO - Candidate Mean Stats: {'Max': np.float64(2.0), 'Min': np.float64(0.24199841594465915), 'Mean': np.float64(0.49364592979913685), 'Std': np.float64(0.06533085715611701)}
2024-12-07 00:23:56,471 - INFO - Candidate Std Stats: {'Max': np.float64(0.44790480622417844), 'Min': np.float64(0.0), 'Mean': np.float64(0.1032538364522944), 'Std': np.float64(0.04344748769116949)}
[I 2024-12-07 00:23:56,524] Trial 112 finished with value: 1.9 and parameters: {'x_0_0': 'cd', 'x_0_1': 'cd', 'x_0_2': 'cd', 'x_1_0': 'bd', 'x_1_1': 'oo', 'x_1_2': 'ab'}. Best is trial 74 with value: 0.8222222222222222.
2024-12-07 00:24:04,579 - INFO - Candidate Mean Stats: {'Max': np.float64(2.0), 'Min': np.float64(0.24427994548243642), 'Mean': np.float64(0.48292992170758775), 'Std': np.float64(0.07786662565169082)}
2024-12-07 00:24:04,580 - INFO - Candidate Std Stats: {'Max': np.float64(1.5190958541130002), 'Min': np.float64(0.0), 'Mean': np.float64(0.12329622568580113), 'Std': np.float64(0.06522091405348804)}
[I 2024-12-07 00:24:04,629] Trial 113 finished with value: 1.2444444444444445 and parameters: {'x_0_0': 'bc', 'x_0_1': 'ad', 'x_0_2': 'ac', 'x_1_0': 'oo', 'x_1_1': 'ac', 'x_1_2': 'ac'}. Best is trial 108 with value: 0.9666666666666667.
2024-12-07 00:24:06,944 - INFO - Candidate Mean Stats: {'Max': np.float64(2.0), 'Min': np.float64(0.21509781598095273), 'Mean': np.float64(0.49387094326731923), 'Std': np.float64(0.06908309272146786)}
2024-12-07 00:24:06,944 - INFO - Candidate Std Stats: {'Max': np.float64(0.9779483135353558), 'Min': np.float64(0.0), 'Mean': np.float64(0.10797776785431606), 'Std': np.float64(0.051910797644893675)}
[I 2024-12-07 00:24:06,995] Trial 113 finished with value: 1.6666666666666665 and parameters: {'x_0_0': 'ac', 'x_0_1': 'bc', 'x_0_2': 'bc', 'x_1_0': 'cd', 'x_1_1': 'ac', 'x_1_2': 'bc'}. Best is trial 49 with value: 0.7999999999999999.
2024-12-07 00:24:09,166 - INFO - Candidate Mean Stats: {'Max': np.float64(2.0), 'Min': np.float64(0.2922862847092952), 'Mean': np.float64(0.48870167780529905), 'Std': np.float64(0.06633067756334543)}
2024-12-07 00:24:09,167 - INFO - Candidate Std Stats: {'Max': np.float64(0.5432884566631025), 'Min': np.float64(0.0), 'Mean': np.float64(0.10561984195576488), 'Std': np.float64(0.04516344904410286)}
[I 2024-12-07 00:24:09,222] Trial 113 finished with value: 1.4777777777777779 and parameters: {'x_0_0': 'ab', 'x_0_1': 'cd', 'x_0_2': 'bc', 'x_1_0': 'oo', 'x_1_1': 'oo', 'x_1_2': 'cd'}. Best is trial 99 with value: 0.9444444444444444.
2024-12-07 00:24:22,117 - INFO - Candidate Mean Stats: {'Max': np.float64(2.0), 'Min': np.float64(0.25475996993847605), 'Mean': np.float64(0.4867316793992799), 'Std': np.float64(0.06794267127018594)}
2024-12-07 00:24:22,118 - INFO - Candidate Std Stats: {'Max': np.float64(0.3959715728525401), 'Min': np.float64(0.0), 'Mean': np.float64(0.09805393168849813), 'Std': np.float64(0.041339227276149706)}
[I 2024-12-07 00:24:22,175] Trial 113 finished with value: 1.5666666666666664 and parameters: {'x_0_0': 'bc', 'x_0_1': 'bc', 'x_0_2': 'oo', 'x_1_0': 'bc', 'x_1_1': 'cd', 'x_1_2': 'ad'}. Best is trial 74 with value: 0.8222222222222222.
2024-12-07 00:24:28,872 - INFO - Candidate Mean Stats: {'Max': np.float64(2.0), 'Min': np.float64(0.0982753326763984), 'Mean': np.float64(0.4790219821386978), 'Std': np.float64(0.08589995810012621)}
2024-12-07 00:24:28,873 - INFO - Candidate Std Stats: {'Max': np.float64(1.6995599902844838), 'Min': np.float64(0.0), 'Mean': np.float64(0.1333226139664022), 'Std': np.float64(0.07297505173967622)}
[I 2024-12-07 00:24:28,925] Trial 114 finished with value: 1.5555555555555556 and parameters: {'x_0_0': 'ac', 'x_0_1': 'ab', 'x_0_2': 'ad', 'x_1_0': 'bc', 'x_1_1': 'bc', 'x_1_2': 'ab'}. Best is trial 108 with value: 0.9666666666666667.
2024-12-07 00:24:30,946 - INFO - Candidate Mean Stats: {'Max': np.float64(2.0), 'Min': np.float64(0.25972501182062013), 'Mean': np.float64(0.49419466558547187), 'Std': np.float64(0.06389833108190512)}
2024-12-07 00:24:30,946 - INFO - Candidate Std Stats: {'Max': np.float64(0.43226076802931956), 'Min': np.float64(0.0), 'Mean': np.float64(0.10349178528496178), 'Std': np.float64(0.045360147139626654)}
[I 2024-12-07 00:24:30,992] Trial 114 finished with value: 0.8666666666666667 and parameters: {'x_0_0': 'ac', 'x_0_1': 'oo', 'x_0_2': 'oo', 'x_1_0': 'oo', 'x_1_1': 'oo', 'x_1_2': 'ad'}. Best is trial 49 with value: 0.7999999999999999.
2024-12-07 00:24:32,875 - INFO - Candidate Mean Stats: {'Max': np.float64(2.0), 'Min': np.float64(0.21733207975208607), 'Mean': np.float64(0.49577774401127955), 'Std': np.float64(0.06914874131208883)}
2024-12-07 00:24:32,875 - INFO - Candidate Std Stats: {'Max': np.float64(0.9991338664392536), 'Min': np.float64(0.0), 'Mean': np.float64(0.10716738809736234), 'Std': np.float64(0.04511653223173846)}
[I 2024-12-07 00:24:32,925] Trial 114 finished with value: 1.3666666666666667 and parameters: {'x_0_0': 'ac', 'x_0_1': 'bd', 'x_0_2': 'oo', 'x_1_0': 'ac', 'x_1_1': 'oo', 'x_1_2': 'oo'}. Best is trial 99 with value: 0.9444444444444444.
2024-12-07 00:24:45,296 - INFO - Candidate Mean Stats: {'Max': np.float64(2.0), 'Min': np.float64(0.22039049113879544), 'Mean': np.float64(0.4881787229236363), 'Std': np.float64(0.07943875458471822)}
2024-12-07 00:24:45,297 - INFO - Candidate Std Stats: {'Max': np.float64(1.6729727634072367), 'Min': np.float64(0.0), 'Mean': np.float64(0.119220281305404), 'Std': np.float64(0.06659318437395269)}
[I 2024-12-07 00:24:45,342] Trial 114 finished with value: 1.5555555555555556 and parameters: {'x_0_0': 'bc', 'x_0_1': 'ab', 'x_0_2': 'bc', 'x_1_0': 'bd', 'x_1_1': 'bd', 'x_1_2': 'ad'}. Best is trial 74 with value: 0.8222222222222222.
2024-12-07 00:24:53,116 - INFO - Candidate Mean Stats: {'Max': np.float64(2.0), 'Min': np.float64(0.24178627597898578), 'Mean': np.float64(0.501430965115915), 'Std': np.float64(0.06980621855427807)}
2024-12-07 00:24:53,118 - INFO - Candidate Std Stats: {'Max': np.float64(1.1302201553689095), 'Min': np.float64(0.0), 'Mean': np.float64(0.11292758524272747), 'Std': np.float64(0.05238197631121903)}
[I 2024-12-07 00:24:53,164] Trial 115 finished with value: 1.1777777777777778 and parameters: {'x_0_0': 'ab', 'x_0_1': 'oo', 'x_0_2': 'bd', 'x_1_0': 'oo', 'x_1_1': 'bc', 'x_1_2': 'bd'}. Best is trial 108 with value: 0.9666666666666667.
2024-12-07 00:25:38,674 - INFO - Candidate Mean Stats: {'Max': np.float64(2.0), 'Min': np.float64(0.2623053134726208), 'Mean': np.float64(0.49615811327981696), 'Std': np.float64(0.06705098627179917)}
2024-12-07 00:25:38,674 - INFO - Candidate Std Stats: {'Max': np.float64(0.6627089940629972), 'Min': np.float64(0.0), 'Mean': np.float64(0.10591325473092772), 'Std': np.float64(0.047741423171205034)}
[I 2024-12-07 00:25:38,724] Trial 115 finished with value: 1.7999999999999998 and parameters: {'x_0_0': 'cd', 'x_0_1': 'bc', 'x_0_2': 'oo', 'x_1_0': 'bc', 'x_1_1': 'oo', 'x_1_2': 'ac'}. Best is trial 49 with value: 0.7999999999999999.
2024-12-07 00:25:41,031 - INFO - Candidate Mean Stats: {'Max': np.float64(2.0), 'Min': np.float64(0.25799220335801765), 'Mean': np.float64(0.4891242210554687), 'Std': np.float64(0.06722247137955192)}
2024-12-07 00:25:41,032 - INFO - Candidate Std Stats: {'Max': np.float64(0.8355389653489076), 'Min': np.float64(0.0), 'Mean': np.float64(0.09925353325636233), 'Std': np.float64(0.043720056348782434)}
[I 2024-12-07 00:25:41,082] Trial 115 finished with value: 1.6666666666666665 and parameters: {'x_0_0': 'bd', 'x_0_1': 'ac', 'x_0_2': 'cd', 'x_1_0': 'cd', 'x_1_1': 'ab', 'x_1_2': 'cd'}. Best is trial 99 with value: 0.9444444444444444.
2024-12-07 00:25:49,313 - INFO - Candidate Mean Stats: {'Max': np.float64(2.0), 'Min': np.float64(0.25048495193110315), 'Mean': np.float64(0.4846600637644655), 'Std': np.float64(0.0638035759815042)}
2024-12-07 00:25:49,314 - INFO - Candidate Std Stats: {'Max': np.float64(0.5036144903544859), 'Min': np.float64(0.0), 'Mean': np.float64(0.10152428432151271), 'Std': np.float64(0.044219361562777504)}
[I 2024-12-07 00:25:49,361] Trial 115 finished with value: 1.5555555555555556 and parameters: {'x_0_0': 'ac', 'x_0_1': 'ab', 'x_0_2': 'bc', 'x_1_0': 'bd', 'x_1_1': 'cd', 'x_1_2': 'bc'}. Best is trial 74 with value: 0.8222222222222222.
2024-12-07 00:25:54,671 - INFO - Candidate Mean Stats: {'Max': np.float64(2.0), 'Min': np.float64(0.28460841562136047), 'Mean': np.float64(0.49324019858285956), 'Std': np.float64(0.07033538382041679)}
2024-12-07 00:25:54,672 - INFO - Candidate Std Stats: {'Max': np.float64(1.2851084977276488), 'Min': np.float64(0.0), 'Mean': np.float64(0.10565261225381335), 'Std': np.float64(0.054979289454044476)}
[I 2024-12-07 00:25:54,714] Trial 116 finished with value: 1.6777777777777778 and parameters: {'x_0_0': 'ab', 'x_0_1': 'ab', 'x_0_2': 'bd', 'x_1_0': 'cd', 'x_1_1': 'oo', 'x_1_2': 'bd'}. Best is trial 108 with value: 0.9666666666666667.
2024-12-07 00:25:56,580 - INFO - Candidate Mean Stats: {'Max': np.float64(2.0), 'Min': np.float64(0.2503653021878023), 'Mean': np.float64(0.49877556013628715), 'Std': np.float64(0.06282320073916045)}
2024-12-07 00:25:56,580 - INFO - Candidate Std Stats: {'Max': np.float64(0.4957978560314546), 'Min': np.float64(0.0), 'Mean': np.float64(0.10670990562895734), 'Std': np.float64(0.047217275600389325)}
[I 2024-12-07 00:25:56,624] Trial 116 finished with value: 1.9 and parameters: {'x_0_0': 'cd', 'x_0_1': 'ab', 'x_0_2': 'bc', 'x_1_0': 'bd', 'x_1_1': 'oo', 'x_1_2': 'bc'}. Best is trial 49 with value: 0.7999999999999999.
2024-12-07 00:25:58,106 - INFO - Candidate Mean Stats: {'Max': np.float64(2.0), 'Min': np.float64(0.15401509397657492), 'Mean': np.float64(0.49548084246902885), 'Std': np.float64(0.07238136875240449)}
2024-12-07 00:25:58,106 - INFO - Candidate Std Stats: {'Max': np.float64(0.6406379692042968), 'Min': np.float64(0.0), 'Mean': np.float64(0.11279835250358389), 'Std': np.float64(0.05394673703870195)}
[I 2024-12-07 00:25:58,159] Trial 116 finished with value: 1.6666666666666665 and parameters: {'x_0_0': 'bd', 'x_0_1': 'ad', 'x_0_2': 'ac', 'x_1_0': 'cd', 'x_1_1': 'cd', 'x_1_2': 'bc'}. Best is trial 99 with value: 0.9444444444444444.
2024-12-07 00:26:06,992 - INFO - Candidate Mean Stats: {'Max': np.float64(2.0), 'Min': np.float64(0.2918563644439539), 'Mean': np.float64(0.48946740856720067), 'Std': np.float64(0.06137796835746095)}
2024-12-07 00:26:06,992 - INFO - Candidate Std Stats: {'Max': np.float64(0.3694889608102859), 'Min': np.float64(0.0), 'Mean': np.float64(0.09698086486299864), 'Std': np.float64(0.03943016916534569)}
[I 2024-12-07 00:26:07,031] Trial 116 finished with value: 1.9 and parameters: {'x_0_0': 'cd', 'x_0_1': 'ab', 'x_0_2': 'bd', 'x_1_0': 'bd', 'x_1_1': 'oo', 'x_1_2': 'bc'}. Best is trial 74 with value: 0.8222222222222222.
2024-12-07 00:26:12,821 - INFO - Candidate Mean Stats: {'Max': np.float64(2.0), 'Min': np.float64(0.25184403829717344), 'Mean': np.float64(0.4820912165316239), 'Std': np.float64(0.07079867189672538)}
2024-12-07 00:26:12,822 - INFO - Candidate Std Stats: {'Max': np.float64(0.43244905359866265), 'Min': np.float64(0.0), 'Mean': np.float64(0.09988655044868333), 'Std': np.float64(0.04252908896395952)}
[I 2024-12-07 00:26:12,862] Trial 117 finished with value: 1.5555555555555556 and parameters: {'x_0_0': 'ad', 'x_0_1': 'bd', 'x_0_2': 'bd', 'x_1_0': 'ab', 'x_1_1': 'ac', 'x_1_2': 'bc'}. Best is trial 108 with value: 0.9666666666666667.
2024-12-07 00:26:14,599 - INFO - Candidate Mean Stats: {'Max': np.float64(2.0), 'Min': np.float64(0.07320944312134071), 'Mean': np.float64(0.4923800172526579), 'Std': np.float64(0.0684012195420723)}
2024-12-07 00:26:14,599 - INFO - Candidate Std Stats: {'Max': np.float64(0.542474101305088), 'Min': np.float64(0.0), 'Mean': np.float64(0.10451003298007379), 'Std': np.float64(0.05405502425451025)}
[I 2024-12-07 00:26:14,640] Trial 117 finished with value: 1.4444444444444444 and parameters: {'x_0_0': 'bd', 'x_0_1': 'ac', 'x_0_2': 'ab', 'x_1_0': 'bd', 'x_1_1': 'ac', 'x_1_2': 'ac'}. Best is trial 49 with value: 0.7999999999999999.
2024-12-07 00:26:16,265 - INFO - Candidate Mean Stats: {'Max': np.float64(2.0), 'Min': np.float64(0.23284493340164486), 'Mean': np.float64(0.48779437108310936), 'Std': np.float64(0.06745351016638239)}
2024-12-07 00:26:16,265 - INFO - Candidate Std Stats: {'Max': np.float64(1.6067972446134318), 'Min': np.float64(0.0), 'Mean': np.float64(0.10725763895612131), 'Std': np.float64(0.054663772880619285)}
[I 2024-12-07 00:26:16,307] Trial 117 finished with value: 1.2666666666666666 and parameters: {'x_0_0': 'ac', 'x_0_1': 'oo', 'x_0_2': 'bc', 'x_1_0': 'bd', 'x_1_1': 'bc', 'x_1_2': 'cd'}. Best is trial 99 with value: 0.9444444444444444.
2024-12-07 00:28:24,402 - INFO - Candidate Mean Stats: {'Max': np.float64(2.0), 'Min': np.float64(0.26587280140134284), 'Mean': np.float64(0.4904270736600678), 'Std': np.float64(0.06133181487114017)}
2024-12-07 00:28:24,403 - INFO - Candidate Std Stats: {'Max': np.float64(0.4621195997093898), 'Min': np.float64(0.0), 'Mean': np.float64(0.10407731259889683), 'Std': np.float64(0.045018111717382285)}
[I 2024-12-07 00:28:24,439] Trial 117 finished with value: 1.7777777777777777 and parameters: {'x_0_0': 'ab', 'x_0_1': 'bc', 'x_0_2': 'ac', 'x_1_0': 'ac', 'x_1_1': 'ac', 'x_1_2': 'bd'}. Best is trial 74 with value: 0.8222222222222222.
2024-12-07 00:28:30,671 - INFO - Candidate Mean Stats: {'Max': np.float64(2.0), 'Min': np.float64(0.2707467439621626), 'Mean': np.float64(0.47984587247197635), 'Std': np.float64(0.06996260796166888)}
2024-12-07 00:28:30,673 - INFO - Candidate Std Stats: {'Max': np.float64(0.9021515268560473), 'Min': np.float64(0.0), 'Mean': np.float64(0.10905995686302175), 'Std': np.float64(0.05209161170078066)}
[I 2024-12-07 00:28:30,729] Trial 118 finished with value: 1.3444444444444446 and parameters: {'x_0_0': 'ad', 'x_0_1': 'ad', 'x_0_2': 'cd', 'x_1_0': 'bd', 'x_1_1': 'ab', 'x_1_2': 'oo'}. Best is trial 108 with value: 0.9666666666666667.
2024-12-07 00:28:32,455 - INFO - Candidate Mean Stats: {'Max': np.float64(2.0), 'Min': np.float64(0.22347711664801562), 'Mean': np.float64(0.48846351800109095), 'Std': np.float64(0.06913729239919127)}
2024-12-07 00:28:32,456 - INFO - Candidate Std Stats: {'Max': np.float64(1.217662252690059), 'Min': np.float64(0.0), 'Mean': np.float64(0.1088011795597715), 'Std': np.float64(0.05379289052473738)}
[I 2024-12-07 00:28:32,498] Trial 118 finished with value: 1.5777777777777777 and parameters: {'x_0_0': 'ab', 'x_0_1': 'ab', 'x_0_2': 'ad', 'x_1_0': 'oo', 'x_1_1': 'ac', 'x_1_2': 'ac'}. Best is trial 49 with value: 0.7999999999999999.
2024-12-07 00:28:33,818 - INFO - Candidate Mean Stats: {'Max': np.float64(2.0), 'Min': np.float64(0.26047856598496666), 'Mean': np.float64(0.49107423837293096), 'Std': np.float64(0.06920181978905247)}
2024-12-07 00:28:33,819 - INFO - Candidate Std Stats: {'Max': np.float64(1.0543383422572363), 'Min': np.float64(0.0), 'Mean': np.float64(0.11089765639309321), 'Std': np.float64(0.05586916350248512)}
[I 2024-12-07 00:28:33,884] Trial 118 finished with value: 0.8666666666666667 and parameters: {'x_0_0': 'bd', 'x_0_1': 'oo', 'x_0_2': 'oo', 'x_1_0': 'oo', 'x_1_1': 'bc', 'x_1_2': 'oo'}. Best is trial 118 with value: 0.8666666666666667.
2024-12-07 00:28:42,280 - INFO - Candidate Mean Stats: {'Max': np.float64(2.0), 'Min': np.float64(0.23994971730221168), 'Mean': np.float64(0.48869260069959286), 'Std': np.float64(0.06421598313864396)}
2024-12-07 00:28:42,281 - INFO - Candidate Std Stats: {'Max': np.float64(0.3022328602444743), 'Min': np.float64(0.0), 'Mean': np.float64(0.09322281271902949), 'Std': np.float64(0.037096209320213784)}
[I 2024-12-07 00:28:42,324] Trial 118 finished with value: 1.6777777777777778 and parameters: {'x_0_0': 'ab', 'x_0_1': 'ab', 'x_0_2': 'cd', 'x_1_0': 'ac', 'x_1_1': 'oo', 'x_1_2': 'bd'}. Best is trial 74 with value: 0.8222222222222222.
2024-12-07 00:28:46,960 - INFO - Candidate Mean Stats: {'Max': np.float64(2.0), 'Min': np.float64(0.23544610124937743), 'Mean': np.float64(0.4869580621699623), 'Std': np.float64(0.06940957145911959)}
2024-12-07 00:28:46,961 - INFO - Candidate Std Stats: {'Max': np.float64(1.0852281479267154), 'Min': np.float64(0.0), 'Mean': np.float64(0.10727930082457325), 'Std': np.float64(0.05247649594100415)}
[I 2024-12-07 00:28:46,997] Trial 119 finished with value: 1.9 and parameters: {'x_0_0': 'oo', 'x_0_1': 'cd', 'x_0_2': 'bd', 'x_1_0': 'cd', 'x_1_1': 'ab', 'x_1_2': 'bd'}. Best is trial 108 with value: 0.9666666666666667.
2024-12-07 00:28:48,812 - INFO - Candidate Mean Stats: {'Max': np.float64(2.0), 'Min': np.float64(0.25661686257832506), 'Mean': np.float64(0.481919979902688), 'Std': np.float64(0.07228217861328362)}
2024-12-07 00:28:48,813 - INFO - Candidate Std Stats: {'Max': np.float64(1.413994893109641), 'Min': np.float64(0.0), 'Mean': np.float64(0.11323015794830586), 'Std': np.float64(0.055449261745745014)}
[I 2024-12-07 00:28:48,851] Trial 119 finished with value: 1.5 and parameters: {'x_0_0': 'oo', 'x_0_1': 'oo', 'x_0_2': 'ad', 'x_1_0': 'ab', 'x_1_1': 'ad', 'x_1_2': 'cd'}. Best is trial 49 with value: 0.7999999999999999.
2024-12-07 00:28:50,293 - INFO - Candidate Mean Stats: {'Max': np.float64(2.0), 'Min': np.float64(0.20075894051737872), 'Mean': np.float64(0.4900631422269143), 'Std': np.float64(0.0667304806884731)}
2024-12-07 00:28:50,294 - INFO - Candidate Std Stats: {'Max': np.float64(0.5057909993990447), 'Min': np.float64(0.0), 'Mean': np.float64(0.10753556905872494), 'Std': np.float64(0.04849576518428386)}
[I 2024-12-07 00:28:50,329] Trial 119 finished with value: 1.4444444444444444 and parameters: {'x_0_0': 'ad', 'x_0_1': 'cd', 'x_0_2': 'ab', 'x_1_0': 'bc', 'x_1_1': 'bc', 'x_1_2': 'cd'}. Best is trial 118 with value: 0.8666666666666667.
2024-12-07 00:28:58,365 - INFO - Candidate Mean Stats: {'Max': np.float64(2.0), 'Min': np.float64(0.23812955018339693), 'Mean': np.float64(0.4872308936547544), 'Std': np.float64(0.07350974884703115)}
2024-12-07 00:28:58,365 - INFO - Candidate Std Stats: {'Max': np.float64(1.6206909486130665), 'Min': np.float64(0.0), 'Mean': np.float64(0.11579879275664415), 'Std': np.float64(0.05663697613351309)}
[I 2024-12-07 00:28:58,404] Trial 119 finished with value: 1.2444444444444445 and parameters: {'x_0_0': 'ac', 'x_0_1': 'ac', 'x_0_2': 'bd', 'x_1_0': 'oo', 'x_1_1': 'ab', 'x_1_2': 'ab'}. Best is trial 74 with value: 0.8222222222222222.
2024-12-07 00:29:03,390 - INFO - Candidate Mean Stats: {'Max': np.float64(2.0), 'Min': np.float64(0.28077192987405974), 'Mean': np.float64(0.4946283813779487), 'Std': np.float64(0.06635471504740684)}
2024-12-07 00:29:03,390 - INFO - Candidate Std Stats: {'Max': np.float64(0.4031245232859499), 'Min': np.float64(0.0), 'Mean': np.float64(0.09568144816867234), 'Std': np.float64(0.03725261717766374)}
[I 2024-12-07 00:29:03,429] Trial 120 finished with value: 1.5777777777777777 and parameters: {'x_0_0': 'ab', 'x_0_1': 'bd', 'x_0_2': 'ab', 'x_1_0': 'oo', 'x_1_1': 'bd', 'x_1_2': 'bd'}. Best is trial 108 with value: 0.9666666666666667.
2024-12-07 00:29:05,534 - INFO - Candidate Mean Stats: {'Max': np.float64(2.0), 'Min': np.float64(0.10947203389582298), 'Mean': np.float64(0.4899873301360037), 'Std': np.float64(0.07015939309368188)}
2024-12-07 00:29:05,534 - INFO - Candidate Std Stats: {'Max': np.float64(0.4714359289351295), 'Min': np.float64(0.0), 'Mean': np.float64(0.11429599730596149), 'Std': np.float64(0.04986682193929193)}
[I 2024-12-07 00:29:05,573] Trial 120 finished with value: 1.4444444444444444 and parameters: {'x_0_0': 'bd', 'x_0_1': 'ad', 'x_0_2': 'ab', 'x_1_0': 'bd', 'x_1_1': 'bd', 'x_1_2': 'ab'}. Best is trial 49 with value: 0.7999999999999999.
2024-12-07 00:29:06,984 - INFO - Candidate Mean Stats: {'Max': np.float64(2.0), 'Min': np.float64(0.2637678195451616), 'Mean': np.float64(0.49347370267033674), 'Std': np.float64(0.06883947102946743)}
2024-12-07 00:29:06,985 - INFO - Candidate Std Stats: {'Max': np.float64(0.4192699071686725), 'Min': np.float64(0.0), 'Mean': np.float64(0.10734331669943237), 'Std': np.float64(0.04422739867186528)}
