[I 2024-12-07 01:23:51,462] Trial 281 finished with value: 1.3666666666666667 and parameters: {'x_0_0': 'bd', 'x_0_1': 'ac', 'x_0_2': 'ad', 'x_1_0': 'oo', 'x_1_1': 'oo', 'x_1_2': 'bc'}. Best is trial 280 with value: 0.6222222222222222.
2024-12-07 01:23:57,243 - INFO - Candidate Mean Stats: {'Max': np.float64(2.0), 'Min': np.float64(0.24453018841770277), 'Mean': np.float64(0.48620217534056126), 'Std': np.float64(0.07683302240107238)}
2024-12-07 01:23:57,244 - INFO - Candidate Std Stats: {'Max': np.float64(0.394474346353317), 'Min': np.float64(0.0), 'Mean': np.float64(0.09986441939185153), 'Std': np.float64(0.04147472703150109)}
[I 2024-12-07 01:23:57,288] Trial 282 finished with value: 1.1444444444444444 and parameters: {'x_0_0': 'bc', 'x_0_1': 'ad', 'x_0_2': 'ad', 'x_1_0': 'oo', 'x_1_1': 'cd', 'x_1_2': 'oo'}. Best is trial 49 with value: 0.7999999999999999.
2024-12-07 01:24:05,364 - INFO - Candidate Mean Stats: {'Max': np.float64(2.0), 'Min': np.float64(0.25845040803384167), 'Mean': np.float64(0.4843679224490528), 'Std': np.float64(0.07689551219860305)}
2024-12-07 01:24:05,364 - INFO - Candidate Std Stats: {'Max': np.float64(0.5380757537589606), 'Min': np.float64(0.0), 'Mean': np.float64(0.09980843834666386), 'Std': np.float64(0.04219657971282409)}
[I 2024-12-07 01:24:05,409] Trial 283 finished with value: 1.6777777777777776 and parameters: {'x_0_0': 'ab', 'x_0_1': 'bd', 'x_0_2': 'oo', 'x_1_0': 'ab', 'x_1_1': 'bd', 'x_1_2': 'ac'}. Best is trial 148 with value: 0.8333333333333333.
2024-12-07 01:24:05,912 - INFO - Candidate Mean Stats: {'Max': np.float64(2.0), 'Min': np.float64(0.22167595156624417), 'Mean': np.float64(0.4893515173515737), 'Std': np.float64(0.08653965575045137)}
2024-12-07 01:24:05,913 - INFO - Candidate Std Stats: {'Max': np.float64(1.9161904019803542), 'Min': np.float64(0.0), 'Mean': np.float64(0.1106605816757973), 'Std': np.float64(0.050691499363792934)}
[I 2024-12-07 01:24:05,955] Trial 282 finished with value: 1.5555555555555556 and parameters: {'x_0_0': 'ac', 'x_0_1': 'ab', 'x_0_2': 'ac', 'x_1_0': 'ab', 'x_1_1': 'ac', 'x_1_2': 'ad'}. Best is trial 200 with value: 0.6.
2024-12-07 01:24:12,286 - INFO - Candidate Mean Stats: {'Max': np.float64(2.0), 'Min': np.float64(0.1516458734478027), 'Mean': np.float64(0.492278705906341), 'Std': np.float64(0.07548560317997438)}
2024-12-07 01:24:12,287 - INFO - Candidate Std Stats: {'Max': np.float64(0.4442316234743849), 'Min': np.float64(0.0), 'Mean': np.float64(0.10311016666521995), 'Std': np.float64(0.04587503171785356)}
[I 2024-12-07 01:24:12,332] Trial 282 finished with value: 1.3444444444444443 and parameters: {'x_0_0': 'ad', 'x_0_1': 'ac', 'x_0_2': 'oo', 'x_1_0': 'bd', 'x_1_1': 'ad', 'x_1_2': 'bc'}. Best is trial 280 with value: 0.6222222222222222.
2024-12-07 01:24:16,899 - INFO - Candidate Mean Stats: {'Max': np.float64(2.0), 'Min': np.float64(0.28284467200119284), 'Mean': np.float64(0.4949842922232744), 'Std': np.float64(0.07437871165828774)}
2024-12-07 01:24:16,900 - INFO - Candidate Std Stats: {'Max': np.float64(1.6483702383564895), 'Min': np.float64(0.0), 'Mean': np.float64(0.10218044190674451), 'Std': np.float64(0.047590527246096984)}
[I 2024-12-07 01:24:16,944] Trial 283 finished with value: 1.5666666666666667 and parameters: {'x_0_0': 'ac', 'x_0_1': 'cd', 'x_0_2': 'ad', 'x_1_0': 'ad', 'x_1_1': 'bd', 'x_1_2': 'oo'}. Best is trial 49 with value: 0.7999999999999999.
2024-12-07 01:24:25,888 - INFO - Candidate Mean Stats: {'Max': np.float64(2.0), 'Min': np.float64(0.21441485041739927), 'Mean': np.float64(0.4943241551757403), 'Std': np.float64(0.07889989774192312)}
2024-12-07 01:24:25,889 - INFO - Candidate Std Stats: {'Max': np.float64(0.47887674765073285), 'Min': np.float64(0.0), 'Mean': np.float64(0.10543664266387534), 'Std': np.float64(0.045082054795881)}
[I 2024-12-07 01:24:25,931] Trial 284 finished with value: 1.0222222222222221 and parameters: {'x_0_0': 'bc', 'x_0_1': 'ad', 'x_0_2': 'ac', 'x_1_0': 'oo', 'x_1_1': 'bc', 'x_1_2': 'cd'}. Best is trial 148 with value: 0.8333333333333333.
2024-12-07 01:24:26,287 - INFO - Candidate Mean Stats: {'Max': np.float64(2.0), 'Min': np.float64(0.2207209377700609), 'Mean': np.float64(0.494552654273611), 'Std': np.float64(0.07814791446986104)}
2024-12-07 01:24:26,287 - INFO - Candidate Std Stats: {'Max': np.float64(1.3455049793192626), 'Min': np.float64(0.0), 'Mean': np.float64(0.10878165081229933), 'Std': np.float64(0.05116771668929655)}
[I 2024-12-07 01:24:26,332] Trial 283 finished with value: 1.0444444444444443 and parameters: {'x_0_0': 'ad', 'x_0_1': 'oo', 'x_0_2': 'ad', 'x_1_0': 'bd', 'x_1_1': 'cd', 'x_1_2': 'ac'}. Best is trial 200 with value: 0.6.
2024-12-07 01:24:33,172 - INFO - Candidate Mean Stats: {'Max': np.float64(2.0), 'Min': np.float64(0.20382984344082428), 'Mean': np.float64(0.48159156528370517), 'Std': np.float64(0.08897473964947163)}
2024-12-07 01:24:33,173 - INFO - Candidate Std Stats: {'Max': np.float64(1.3556822446668793), 'Min': np.float64(0.0), 'Mean': np.float64(0.12108080874201606), 'Std': np.float64(0.06731540534123415)}
[I 2024-12-07 01:24:33,219] Trial 283 finished with value: 1.4666666666666666 and parameters: {'x_0_0': 'bd', 'x_0_1': 'ac', 'x_0_2': 'bc', 'x_1_0': 'oo', 'x_1_1': 'ad', 'x_1_2': 'cd'}. Best is trial 280 with value: 0.6222222222222222.
2024-12-07 01:24:37,512 - INFO - Candidate Mean Stats: {'Max': np.float64(2.0), 'Min': np.float64(0.2288504722355995), 'Mean': np.float64(0.4904804483958625), 'Std': np.float64(0.07686218970339496)}
2024-12-07 01:24:37,512 - INFO - Candidate Std Stats: {'Max': np.float64(0.5473978061399764), 'Min': np.float64(0.0), 'Mean': np.float64(0.10235022464754785), 'Std': np.float64(0.04470015852866409)}
[I 2024-12-07 01:24:37,556] Trial 284 finished with value: 0.9444444444444444 and parameters: {'x_0_0': 'ad', 'x_0_1': 'oo', 'x_0_2': 'oo', 'x_1_0': 'bd', 'x_1_1': 'ad', 'x_1_2': 'bd'}. Best is trial 49 with value: 0.7999999999999999.
2024-12-07 01:24:46,106 - INFO - Candidate Mean Stats: {'Max': np.float64(2.0), 'Min': np.float64(0.24955210922528387), 'Mean': np.float64(0.4963200162555507), 'Std': np.float64(0.08266965310631579)}
2024-12-07 01:24:46,107 - INFO - Candidate Std Stats: {'Max': np.float64(0.9977615393717628), 'Min': np.float64(0.0), 'Mean': np.float64(0.11328313874550441), 'Std': np.float64(0.05030152092564811)}
[I 2024-12-07 01:24:46,151] Trial 285 finished with value: 1.4444444444444444 and parameters: {'x_0_0': 'ad', 'x_0_1': 'ac', 'x_0_2': 'ad', 'x_1_0': 'bd', 'x_1_1': 'bd', 'x_1_2': 'bc'}. Best is trial 148 with value: 0.8333333333333333.
2024-12-07 01:24:46,812 - INFO - Candidate Mean Stats: {'Max': np.float64(2.0), 'Min': np.float64(0.23312061233018042), 'Mean': np.float64(0.489378996771276), 'Std': np.float64(0.07694363205291074)}
2024-12-07 01:24:46,812 - INFO - Candidate Std Stats: {'Max': np.float64(0.4198925455753683), 'Min': np.float64(0.0), 'Mean': np.float64(0.10219849477649813), 'Std': np.float64(0.04443828972804283)}
[I 2024-12-07 01:24:46,857] Trial 284 finished with value: 1.2666666666666666 and parameters: {'x_0_0': 'bc', 'x_0_1': 'oo', 'x_0_2': 'bd', 'x_1_0': 'ad', 'x_1_1': 'bd', 'x_1_2': 'bd'}. Best is trial 200 with value: 0.6.
2024-12-07 01:24:53,578 - INFO - Candidate Mean Stats: {'Max': np.float64(2.0), 'Min': np.float64(0.26583380141994994), 'Mean': np.float64(0.48347367301583816), 'Std': np.float64(0.07491404659540633)}
2024-12-07 01:24:53,579 - INFO - Candidate Std Stats: {'Max': np.float64(0.7314262257030201), 'Min': np.float64(0.0), 'Mean': np.float64(0.09930316916558211), 'Std': np.float64(0.04366074132630703)}
[I 2024-12-07 01:24:53,624] Trial 284 finished with value: 1.0444444444444443 and parameters: {'x_0_0': 'bd', 'x_0_1': 'oo', 'x_0_2': 'bd', 'x_1_0': 'bd', 'x_1_1': 'bc', 'x_1_2': 'cd'}. Best is trial 280 with value: 0.6222222222222222.
2024-12-07 01:24:58,242 - INFO - Candidate Mean Stats: {'Max': np.float64(2.0), 'Min': np.float64(0.26723122703830476), 'Mean': np.float64(0.49229062782482946), 'Std': np.float64(0.07682472515525984)}
2024-12-07 01:24:58,243 - INFO - Candidate Std Stats: {'Max': np.float64(0.4395308953751899), 'Min': np.float64(0.0), 'Mean': np.float64(0.10519001336700592), 'Std': np.float64(0.04298229945019522)}
[I 2024-12-07 01:24:58,289] Trial 285 finished with value: 1.1444444444444444 and parameters: {'x_0_0': 'bd', 'x_0_1': 'ac', 'x_0_2': 'oo', 'x_1_0': 'bd', 'x_1_1': 'oo', 'x_1_2': 'oo'}. Best is trial 49 with value: 0.7999999999999999.
2024-12-07 01:25:06,860 - INFO - Candidate Mean Stats: {'Max': np.float64(2.0), 'Min': np.float64(0.17357302897792148), 'Mean': np.float64(0.49192804665342776), 'Std': np.float64(0.08625302058394593)}
2024-12-07 01:25:06,860 - INFO - Candidate Std Stats: {'Max': np.float64(0.6326977247748188), 'Min': np.float64(0.0), 'Mean': np.float64(0.10971421299348497), 'Std': np.float64(0.04871047292199613)}
[I 2024-12-07 01:25:06,904] Trial 286 finished with value: 0.8666666666666667 and parameters: {'x_0_0': 'ac', 'x_0_1': 'oo', 'x_0_2': 'oo', 'x_1_0': 'oo', 'x_1_1': 'oo', 'x_1_2': 'bd'}. Best is trial 148 with value: 0.8333333333333333.
2024-12-07 01:25:07,510 - INFO - Candidate Mean Stats: {'Max': np.float64(2.0), 'Min': np.float64(0.2710118190572604), 'Mean': np.float64(0.4869699480079529), 'Std': np.float64(0.07819069638927188)}
2024-12-07 01:25:07,511 - INFO - Candidate Std Stats: {'Max': np.float64(0.3963391053060409), 'Min': np.float64(0.0), 'Mean': np.float64(0.09975038640371223), 'Std': np.float64(0.04366914101472226)}
[I 2024-12-07 01:25:07,556] Trial 285 finished with value: 1.6777777777777776 and parameters: {'x_0_0': 'ab', 'x_0_1': 'bc', 'x_0_2': 'oo', 'x_1_0': 'bd', 'x_1_1': 'bc', 'x_1_2': 'bc'}. Best is trial 200 with value: 0.6.
2024-12-07 01:25:14,553 - INFO - Candidate Mean Stats: {'Max': np.float64(2.0), 'Min': np.float64(0.21095435016292918), 'Mean': np.float64(0.49145612919797305), 'Std': np.float64(0.08070573485032628)}
2024-12-07 01:25:14,554 - INFO - Candidate Std Stats: {'Max': np.float64(0.5809379226322092), 'Min': np.float64(0.0), 'Mean': np.float64(0.10640506697605849), 'Std': np.float64(0.0452685513446562)}
[I 2024-12-07 01:25:14,599] Trial 285 finished with value: 1.2777777777777777 and parameters: {'x_0_0': 'ab', 'x_0_1': 'oo', 'x_0_2': 'ab', 'x_1_0': 'ac', 'x_1_1': 'oo', 'x_1_2': 'ac'}. Best is trial 280 with value: 0.6222222222222222.
2024-12-07 01:25:16,168 - INFO - Candidate Mean Stats: {'Max': np.float64(2.0), 'Min': np.float64(0.15839951468558539), 'Mean': np.float64(0.4771762145848504), 'Std': np.float64(0.08929336984350746)}
2024-12-07 01:25:16,169 - INFO - Candidate Std Stats: {'Max': np.float64(1.6404188498637977), 'Min': np.float64(0.0), 'Mean': np.float64(0.12224544893768063), 'Std': np.float64(0.07109918876969705)}
[I 2024-12-07 01:25:16,212] Trial 286 finished with value: 1.1666666666666665 and parameters: {'x_0_0': 'ac', 'x_0_1': 'oo', 'x_0_2': 'oo', 'x_1_0': 'ad', 'x_1_1': 'ad', 'x_1_2': 'ad'}. Best is trial 49 with value: 0.7999999999999999.
2024-12-07 01:25:27,336 - INFO - Candidate Mean Stats: {'Max': np.float64(2.0), 'Min': np.float64(0.21794639042018787), 'Mean': np.float64(0.49101892837245253), 'Std': np.float64(0.07662538070915091)}
2024-12-07 01:25:27,337 - INFO - Candidate Std Stats: {'Max': np.float64(0.663269150898955), 'Min': np.float64(0.0), 'Mean': np.float64(0.10107536133299673), 'Std': np.float64(0.04678065952903196)}
[I 2024-12-07 01:25:27,382] Trial 287 finished with value: 1.1222222222222222 and parameters: {'x_0_0': 'bc', 'x_0_1': 'ad', 'x_0_2': 'oo', 'x_1_0': 'ab', 'x_1_1': 'bd', 'x_1_2': 'bc'}. Best is trial 148 with value: 0.8333333333333333.
2024-12-07 01:25:28,061 - INFO - Candidate Mean Stats: {'Max': np.float64(2.0), 'Min': np.float64(0.24629283796012674), 'Mean': np.float64(0.4885033660573279), 'Std': np.float64(0.07648444851337803)}
2024-12-07 01:25:28,064 - INFO - Candidate Std Stats: {'Max': np.float64(0.366211058836641), 'Min': np.float64(0.0), 'Mean': np.float64(0.09444770773125645), 'Std': np.float64(0.03814643202598665)}
[I 2024-12-07 01:25:28,117] Trial 286 finished with value: 1.4666666666666666 and parameters: {'x_0_0': 'ac', 'x_0_1': 'bc', 'x_0_2': 'oo', 'x_1_0': 'bd', 'x_1_1': 'oo', 'x_1_2': 'ac'}. Best is trial 200 with value: 0.6.
2024-12-07 01:25:35,201 - INFO - Candidate Mean Stats: {'Max': np.float64(2.0), 'Min': np.float64(0.24237740025332144), 'Mean': np.float64(0.49156965421316107), 'Std': np.float64(0.07457877578096236)}
2024-12-07 01:25:35,201 - INFO - Candidate Std Stats: {'Max': np.float64(0.4890537549132293), 'Min': np.float64(0.0), 'Mean': np.float64(0.10464347402969731), 'Std': np.float64(0.04585099842176524)}
[I 2024-12-07 01:25:35,251] Trial 286 finished with value: 1.6 and parameters: {'x_0_0': 'oo', 'x_0_1': 'ac', 'x_0_2': 'bc', 'x_1_0': 'oo', 'x_1_1': 'ad', 'x_1_2': 'oo'}. Best is trial 280 with value: 0.6222222222222222.
2024-12-07 01:25:36,760 - INFO - Candidate Mean Stats: {'Max': np.float64(2.0), 'Min': np.float64(0.2555410770231365), 'Mean': np.float64(0.48712282278060265), 'Std': np.float64(0.08106647519748182)}
2024-12-07 01:25:36,761 - INFO - Candidate Std Stats: {'Max': np.float64(1.329307567686312), 'Min': np.float64(0.0), 'Mean': np.float64(0.1112117221626717), 'Std': np.float64(0.05706396078350999)}
[I 2024-12-07 01:25:36,805] Trial 287 finished with value: 1.2666666666666666 and parameters: {'x_0_0': 'ac', 'x_0_1': 'bd', 'x_0_2': 'oo', 'x_1_0': 'oo', 'x_1_1': 'oo', 'x_1_2': 'ac'}. Best is trial 49 with value: 0.7999999999999999.
2024-12-07 01:25:47,845 - INFO - Candidate Mean Stats: {'Max': np.float64(2.0), 'Min': np.float64(0.27003687940747023), 'Mean': np.float64(0.48929585207271364), 'Std': np.float64(0.08101930615296002)}
2024-12-07 01:25:47,845 - INFO - Candidate Std Stats: {'Max': np.float64(1.0973557951875987), 'Min': np.float64(0.0), 'Mean': np.float64(0.10227918650236409), 'Std': np.float64(0.046419867348196246)}
[I 2024-12-07 01:25:47,892] Trial 288 finished with value: 0.9666666666666667 and parameters: {'x_0_0': 'bd', 'x_0_1': 'oo', 'x_0_2': 'ad', 'x_1_0': 'oo', 'x_1_1': 'oo', 'x_1_2': 'bd'}. Best is trial 148 with value: 0.8333333333333333.
2024-12-07 01:25:48,527 - INFO - Candidate Mean Stats: {'Max': np.float64(2.0), 'Min': np.float64(0.25923898624831215), 'Mean': np.float64(0.4922059385569472), 'Std': np.float64(0.08057204220729344)}
2024-12-07 01:25:48,528 - INFO - Candidate Std Stats: {'Max': np.float64(1.3767115646752461), 'Min': np.float64(0.0), 'Mean': np.float64(0.10998741105581658), 'Std': np.float64(0.04946031648685798)}
[I 2024-12-07 01:25:48,573] Trial 287 finished with value: 1.4444444444444444 and parameters: {'x_0_0': 'bd', 'x_0_1': 'cd', 'x_0_2': 'ac', 'x_1_0': 'bc', 'x_1_1': 'bd', 'x_1_2': 'bc'}. Best is trial 200 with value: 0.6.
2024-12-07 01:25:55,667 - INFO - Candidate Mean Stats: {'Max': np.float64(2.0), 'Min': np.float64(0.262290278385708), 'Mean': np.float64(0.49603175589241044), 'Std': np.float64(0.07539026078826926)}
2024-12-07 01:25:55,668 - INFO - Candidate Std Stats: {'Max': np.float64(1.130566589109762), 'Min': np.float64(0.0), 'Mean': np.float64(0.10463186814966736), 'Std': np.float64(0.052002088090216766)}
[I 2024-12-07 01:25:55,712] Trial 287 finished with value: 1.0444444444444443 and parameters: {'x_0_0': 'ad', 'x_0_1': 'oo', 'x_0_2': 'bd', 'x_1_0': 'bd', 'x_1_1': 'bc', 'x_1_2': 'cd'}. Best is trial 280 with value: 0.6222222222222222.
2024-12-07 01:25:57,145 - INFO - Candidate Mean Stats: {'Max': np.float64(2.0), 'Min': np.float64(0.25175541279665603), 'Mean': np.float64(0.48593196876860106), 'Std': np.float64(0.07686605896404386)}
2024-12-07 01:25:57,146 - INFO - Candidate Std Stats: {'Max': np.float64(0.634172665218511), 'Min': np.float64(0.0), 'Mean': np.float64(0.10321313510467295), 'Std': np.float64(0.04542043556536705)}
[I 2024-12-07 01:25:57,190] Trial 288 finished with value: 1.6666666666666665 and parameters: {'x_0_0': 'ad', 'x_0_1': 'bd', 'x_0_2': 'ab', 'x_1_0': 'ad', 'x_1_1': 'ac', 'x_1_2': 'ac'}. Best is trial 49 with value: 0.7999999999999999.
2024-12-07 01:26:08,343 - INFO - Candidate Mean Stats: {'Max': np.float64(2.0), 'Min': np.float64(0.2438826810310757), 'Mean': np.float64(0.4946781921152657), 'Std': np.float64(0.08061086853058036)}
2024-12-07 01:26:08,344 - INFO - Candidate Std Stats: {'Max': np.float64(0.7574529213478766), 'Min': np.float64(0.0), 'Mean': np.float64(0.10714658296878975), 'Std': np.float64(0.0462083041171697)}
[I 2024-12-07 01:26:08,387] Trial 289 finished with value: 1.1777777777777778 and parameters: {'x_0_0': 'ab', 'x_0_1': 'oo', 'x_0_2': 'bc', 'x_1_0': 'oo', 'x_1_1': 'cd', 'x_1_2': 'bd'}. Best is trial 148 with value: 0.8333333333333333.
2024-12-07 01:26:09,180 - INFO - Candidate Mean Stats: {'Max': np.float64(2.0), 'Min': np.float64(0.242446753118751), 'Mean': np.float64(0.4932684157582349), 'Std': np.float64(0.0805527954522702)}
2024-12-07 01:26:09,180 - INFO - Candidate Std Stats: {'Max': np.float64(0.3794180356664841), 'Min': np.float64(0.0), 'Mean': np.float64(0.10383867318322633), 'Std': np.float64(0.046111975129905454)}
[I 2024-12-07 01:26:09,225] Trial 288 finished with value: 1.0 and parameters: {'x_0_0': 'ac', 'x_0_1': 'ac', 'x_0_2': 'ad', 'x_1_0': 'cd', 'x_1_1': 'bc', 'x_1_2': 'bc'}. Best is trial 200 with value: 0.6.
2024-12-07 01:26:16,478 - INFO - Candidate Mean Stats: {'Max': np.float64(2.0), 'Min': np.float64(0.19051556063191039), 'Mean': np.float64(0.49316236885251513), 'Std': np.float64(0.07680557848992553)}
2024-12-07 01:26:16,479 - INFO - Candidate Std Stats: {'Max': np.float64(0.3885174627065159), 'Min': np.float64(0.0), 'Mean': np.float64(0.10758187641786393), 'Std': np.float64(0.04571359768954058)}
[I 2024-12-07 01:26:16,524] Trial 288 finished with value: 1.7 and parameters: {'x_0_0': 'cd', 'x_0_1': 'bd', 'x_0_2': 'oo', 'x_1_0': 'oo', 'x_1_1': 'ac', 'x_1_2': 'ac'}. Best is trial 280 with value: 0.6222222222222222.
2024-12-07 01:26:17,864 - INFO - Candidate Mean Stats: {'Max': np.float64(2.0), 'Min': np.float64(0.2505503462906188), 'Mean': np.float64(0.4948977919787421), 'Std': np.float64(0.0823823882924181)}
2024-12-07 01:26:17,864 - INFO - Candidate Std Stats: {'Max': np.float64(1.432592653195856), 'Min': np.float64(0.0), 'Mean': np.float64(0.11586155466633558), 'Std': np.float64(0.0645714473023151)}
[I 2024-12-07 01:26:17,909] Trial 289 finished with value: 1.1555555555555554 and parameters: {'x_0_0': 'bd', 'x_0_1': 'oo', 'x_0_2': 'bc', 'x_1_0': 'ab', 'x_1_1': 'ab', 'x_1_2': 'ad'}. Best is trial 49 with value: 0.7999999999999999.
2024-12-07 01:26:28,911 - INFO - Candidate Mean Stats: {'Max': np.float64(2.0), 'Min': np.float64(0.2696540503663708), 'Mean': np.float64(0.48742511578442466), 'Std': np.float64(0.07961988426851398)}
2024-12-07 01:26:28,912 - INFO - Candidate Std Stats: {'Max': np.float64(0.6673686728311672), 'Min': np.float64(0.0), 'Mean': np.float64(0.10890052545010827), 'Std': np.float64(0.04699612313449184)}
[I 2024-12-07 01:26:28,955] Trial 290 finished with value: 1.2666666666666666 and parameters: {'x_0_0': 'bc', 'x_0_1': 'oo', 'x_0_2': 'bc', 'x_1_0': 'ad', 'x_1_1': 'ac', 'x_1_2': 'cd'}. Best is trial 148 with value: 0.8333333333333333.
2024-12-07 01:26:29,654 - INFO - Candidate Mean Stats: {'Max': np.float64(2.0), 'Min': np.float64(0.24751197124350796), 'Mean': np.float64(0.4876068198781569), 'Std': np.float64(0.07938814626556746)}
2024-12-07 01:26:29,655 - INFO - Candidate Std Stats: {'Max': np.float64(0.47233593746994035), 'Min': np.float64(0.0), 'Mean': np.float64(0.11000211466636635), 'Std': np.float64(0.048563047699536746)}
[I 2024-12-07 01:26:29,699] Trial 289 finished with value: 2.0 and parameters: {'x_0_0': 'cd', 'x_0_1': 'cd', 'x_0_2': 'ac', 'x_1_0': 'ab', 'x_1_1': 'ab', 'x_1_2': 'bc'}. Best is trial 200 with value: 0.6.
2024-12-07 01:26:37,097 - INFO - Candidate Mean Stats: {'Max': np.float64(2.0), 'Min': np.float64(0.2505384270857165), 'Mean': np.float64(0.4848846688460289), 'Std': np.float64(0.07810476000671336)}
2024-12-07 01:26:37,098 - INFO - Candidate Std Stats: {'Max': np.float64(0.7108903640906999), 'Min': np.float64(0.0), 'Mean': np.float64(0.10469993061940708), 'Std': np.float64(0.049911265717519096)}
[I 2024-12-07 01:26:37,143] Trial 289 finished with value: 1.2666666666666666 and parameters: {'x_0_0': 'ac', 'x_0_1': 'oo', 'x_0_2': 'bc', 'x_1_0': 'ab', 'x_1_1': 'ac', 'x_1_2': 'ac'}. Best is trial 280 with value: 0.6222222222222222.
2024-12-07 01:26:38,364 - INFO - Candidate Mean Stats: {'Max': np.float64(2.0), 'Min': np.float64(0.24144105063005808), 'Mean': np.float64(0.49102322193250786), 'Std': np.float64(0.08373564204425891)}
2024-12-07 01:26:38,365 - INFO - Candidate Std Stats: {'Max': np.float64(1.2323002981089153), 'Min': np.float64(0.0), 'Mean': np.float64(0.11179619263188824), 'Std': np.float64(0.05438247359306242)}
[I 2024-12-07 01:26:38,409] Trial 290 finished with value: 1.2666666666666666 and parameters: {'x_0_0': 'bc', 'x_0_1': 'oo', 'x_0_2': 'bd', 'x_1_0': 'ad', 'x_1_1': 'ac', 'x_1_2': 'cd'}. Best is trial 49 with value: 0.7999999999999999.
2024-12-07 01:26:49,265 - INFO - Candidate Mean Stats: {'Max': np.float64(2.0), 'Min': np.float64(0.23859582382830666), 'Mean': np.float64(0.48521272911463453), 'Std': np.float64(0.08011003663495764)}
2024-12-07 01:26:49,266 - INFO - Candidate Std Stats: {'Max': np.float64(0.5890136524536266), 'Min': np.float64(0.0), 'Mean': np.float64(0.11218872218539075), 'Std': np.float64(0.046443335446264195)}
