[I 2024-12-07 00:37:28,080] Trial 146 finished with value: 1.2666666666666666 and parameters: {'x_0_0': 'ac', 'x_0_1': 'oo', 'x_0_2': 'ac', 'x_1_0': 'cd', 'x_1_1': 'bc', 'x_1_2': 'bc'}. Best is trial 108 with value: 0.9666666666666667.
2024-12-07 00:37:29,769 - INFO - Candidate Mean Stats: {'Max': np.float64(2.0), 'Min': np.float64(0.20806971124579343), 'Mean': np.float64(0.48029688163605516), 'Std': np.float64(0.08041392422618152)}
2024-12-07 00:37:29,770 - INFO - Candidate Std Stats: {'Max': np.float64(1.2935965557605849), 'Min': np.float64(0.0), 'Mean': np.float64(0.13122587224617416), 'Std': np.float64(0.07080990793560676)}
[I 2024-12-07 00:37:29,810] Trial 146 finished with value: 1.6666666666666665 and parameters: {'x_0_0': 'bd', 'x_0_1': 'bc', 'x_0_2': 'cd', 'x_1_0': 'cd', 'x_1_1': 'ac', 'x_1_2': 'ad'}. Best is trial 49 with value: 0.7999999999999999.
2024-12-07 00:37:33,569 - INFO - Candidate Mean Stats: {'Max': np.float64(2.0), 'Min': np.float64(0.2744437793812491), 'Mean': np.float64(0.49250104145696555), 'Std': np.float64(0.0688680283743374)}
2024-12-07 00:37:33,570 - INFO - Candidate Std Stats: {'Max': np.float64(1.0404685539565908), 'Min': np.float64(0.0), 'Mean': np.float64(0.10649854165919424), 'Std': np.float64(0.04916271269183492)}
[I 2024-12-07 00:37:33,613] Trial 146 finished with value: 1.4666666666666666 and parameters: {'x_0_0': 'ad', 'x_0_1': 'ad', 'x_0_2': 'cd', 'x_1_0': 'oo', 'x_1_1': 'ab', 'x_1_2': 'bc'}. Best is trial 118 with value: 0.8666666666666667.
2024-12-07 00:37:41,654 - INFO - Candidate Mean Stats: {'Max': np.float64(2.0), 'Min': np.float64(0.2516605769966457), 'Mean': np.float64(0.48917171800467046), 'Std': np.float64(0.07155382806279816)}
2024-12-07 00:37:41,655 - INFO - Candidate Std Stats: {'Max': np.float64(0.5395478465214392), 'Min': np.float64(0.0), 'Mean': np.float64(0.10212083481471161), 'Std': np.float64(0.04336995584176612)}
[I 2024-12-07 00:37:41,696] Trial 146 finished with value: 1.3666666666666667 and parameters: {'x_0_0': 'bd', 'x_0_1': 'ab', 'x_0_2': 'ac', 'x_1_0': 'oo', 'x_1_1': 'oo', 'x_1_2': 'ab'}. Best is trial 74 with value: 0.8222222222222222.
2024-12-07 00:37:47,962 - INFO - Candidate Mean Stats: {'Max': np.float64(2.0), 'Min': np.float64(0.24914675946644502), 'Mean': np.float64(0.4886424472762519), 'Std': np.float64(0.07129752698504443)}
2024-12-07 00:37:47,962 - INFO - Candidate Std Stats: {'Max': np.float64(0.7898211546988292), 'Min': np.float64(0.0), 'Mean': np.float64(0.10813615615652865), 'Std': np.float64(0.047384319835030844)}
[I 2024-12-07 00:37:48,004] Trial 147 finished with value: 1.1666666666666665 and parameters: {'x_0_0': 'bc', 'x_0_1': 'oo', 'x_0_2': 'ad', 'x_1_0': 'ab', 'x_1_1': 'bd', 'x_1_2': 'oo'}. Best is trial 108 with value: 0.9666666666666667.
2024-12-07 00:37:49,931 - INFO - Candidate Mean Stats: {'Max': np.float64(2.0), 'Min': np.float64(0.2773169710719182), 'Mean': np.float64(0.49703924176160663), 'Std': np.float64(0.07013170042010664)}
2024-12-07 00:37:49,931 - INFO - Candidate Std Stats: {'Max': np.float64(0.4010721259522816), 'Min': np.float64(0.0), 'Mean': np.float64(0.10257203008770113), 'Std': np.float64(0.041630922158959)}
[I 2024-12-07 00:37:49,972] Trial 147 finished with value: 1.5555555555555556 and parameters: {'x_0_0': 'bd', 'x_0_1': 'bd', 'x_0_2': 'bc', 'x_1_0': 'ab', 'x_1_1': 'ac', 'x_1_2': 'cd'}. Best is trial 49 with value: 0.7999999999999999.
2024-12-07 00:37:53,567 - INFO - Candidate Mean Stats: {'Max': np.float64(2.0), 'Min': np.float64(0.2744035295026378), 'Mean': np.float64(0.4880722093248609), 'Std': np.float64(0.0638288011917691)}
2024-12-07 00:37:53,567 - INFO - Candidate Std Stats: {'Max': np.float64(0.4281089773331166), 'Min': np.float64(0.0), 'Mean': np.float64(0.10712560929783621), 'Std': np.float64(0.04134471767651649)}
[I 2024-12-07 00:37:53,608] Trial 147 finished with value: 1.4555555555555555 and parameters: {'x_0_0': 'bd', 'x_0_1': 'ad', 'x_0_2': 'oo', 'x_1_0': 'ab', 'x_1_1': 'ac', 'x_1_2': 'cd'}. Best is trial 118 with value: 0.8666666666666667.
2024-12-07 00:38:01,463 - INFO - Candidate Mean Stats: {'Max': np.float64(2.0), 'Min': np.float64(0.27164647892034993), 'Mean': np.float64(0.4924849227252343), 'Std': np.float64(0.06943476829930173)}
2024-12-07 00:38:01,464 - INFO - Candidate Std Stats: {'Max': np.float64(0.8716105540666738), 'Min': np.float64(0.0), 'Mean': np.float64(0.1029474632576284), 'Std': np.float64(0.049039828645284805)}
[I 2024-12-07 00:38:01,505] Trial 147 finished with value: 1.3444444444444443 and parameters: {'x_0_0': 'bc', 'x_0_1': 'ac', 'x_0_2': 'oo', 'x_1_0': 'cd', 'x_1_1': 'cd', 'x_1_2': 'bd'}. Best is trial 74 with value: 0.8222222222222222.
2024-12-07 00:38:08,092 - INFO - Candidate Mean Stats: {'Max': np.float64(2.0), 'Min': np.float64(0.23342195634060414), 'Mean': np.float64(0.4850790880333624), 'Std': np.float64(0.07127221480773198)}
2024-12-07 00:38:08,093 - INFO - Candidate Std Stats: {'Max': np.float64(0.49153155736374265), 'Min': np.float64(0.0), 'Mean': np.float64(0.10684953253911006), 'Std': np.float64(0.04477148086125042)}
[I 2024-12-07 00:38:08,139] Trial 148 finished with value: 0.8333333333333333 and parameters: {'x_0_0': 'ad', 'x_0_1': 'oo', 'x_0_2': 'ad', 'x_1_0': 'bc', 'x_1_1': 'ab', 'x_1_2': 'oo'}. Best is trial 148 with value: 0.8333333333333333.
2024-12-07 00:38:10,015 - INFO - Candidate Mean Stats: {'Max': np.float64(2.0), 'Min': np.float64(0.24558816398527958), 'Mean': np.float64(0.48549619169331376), 'Std': np.float64(0.07027334053633809)}
2024-12-07 00:38:10,016 - INFO - Candidate Std Stats: {'Max': np.float64(1.2121967081319203), 'Min': np.float64(0.0), 'Mean': np.float64(0.10265561721807918), 'Std': np.float64(0.049785107808242184)}
[I 2024-12-07 00:38:10,062] Trial 148 finished with value: 1.4666666666666666 and parameters: {'x_0_0': 'ad', 'x_0_1': 'bc', 'x_0_2': 'ac', 'x_1_0': 'oo', 'x_1_1': 'ac', 'x_1_2': 'cd'}. Best is trial 49 with value: 0.7999999999999999.
2024-12-07 00:38:13,872 - INFO - Candidate Mean Stats: {'Max': np.float64(2.0), 'Min': np.float64(0.24704813104036666), 'Mean': np.float64(0.48997429779286705), 'Std': np.float64(0.07345972242407244)}
2024-12-07 00:38:13,872 - INFO - Candidate Std Stats: {'Max': np.float64(1.9118404215078681), 'Min': np.float64(0.0), 'Mean': np.float64(0.11570868332122322), 'Std': np.float64(0.05727445022449075)}
[I 2024-12-07 00:38:13,915] Trial 148 finished with value: 1.4666666666666666 and parameters: {'x_0_0': 'ad', 'x_0_1': 'bd', 'x_0_2': 'bc', 'x_1_0': 'oo', 'x_1_1': 'ad', 'x_1_2': 'bc'}. Best is trial 118 with value: 0.8666666666666667.
2024-12-07 00:38:21,975 - INFO - Candidate Mean Stats: {'Max': np.float64(2.0), 'Min': np.float64(0.24319648270399155), 'Mean': np.float64(0.48195046290244575), 'Std': np.float64(0.06882040198521844)}
2024-12-07 00:38:21,976 - INFO - Candidate Std Stats: {'Max': np.float64(0.3822707003711535), 'Min': np.float64(0.0), 'Mean': np.float64(0.10363292721126914), 'Std': np.float64(0.04294770388853522)}
[I 2024-12-07 00:38:22,017] Trial 148 finished with value: 1.4666666666666666 and parameters: {'x_0_0': 'bd', 'x_0_1': 'bc', 'x_0_2': 'bc', 'x_1_0': 'oo', 'x_1_1': 'cd', 'x_1_2': 'bc'}. Best is trial 74 with value: 0.8222222222222222.
2024-12-07 00:38:28,625 - INFO - Candidate Mean Stats: {'Max': np.float64(2.0), 'Min': np.float64(0.26541121319397787), 'Mean': np.float64(0.48443128606902747), 'Std': np.float64(0.06893040737493822)}
2024-12-07 00:38:28,626 - INFO - Candidate Std Stats: {'Max': np.float64(0.5789215452841465), 'Min': np.float64(0.0), 'Mean': np.float64(0.09745114554121327), 'Std': np.float64(0.04351532278962556)}
[I 2024-12-07 00:38:28,668] Trial 149 finished with value: 1.4444444444444444 and parameters: {'x_0_0': 'ac', 'x_0_1': 'ad', 'x_0_2': 'bd', 'x_1_0': 'ad', 'x_1_1': 'ac', 'x_1_2': 'ac'}. Best is trial 148 with value: 0.8333333333333333.
2024-12-07 00:38:30,712 - INFO - Candidate Mean Stats: {'Max': np.float64(2.0), 'Min': np.float64(0.26387969840664566), 'Mean': np.float64(0.4928278274945419), 'Std': np.float64(0.06993750957449621)}
2024-12-07 00:38:30,713 - INFO - Candidate Std Stats: {'Max': np.float64(0.6938279224462435), 'Min': np.float64(0.0), 'Mean': np.float64(0.09974229049624368), 'Std': np.float64(0.04318877544087049)}
[I 2024-12-07 00:38:30,758] Trial 149 finished with value: 1.6666666666666665 and parameters: {'x_0_0': 'bc', 'x_0_1': 'cd', 'x_0_2': 'cd', 'x_1_0': 'ab', 'x_1_1': 'bd', 'x_1_2': 'ad'}. Best is trial 49 with value: 0.7999999999999999.
2024-12-07 00:38:34,045 - INFO - Candidate Mean Stats: {'Max': np.float64(2.0), 'Min': np.float64(0.2591855848323101), 'Mean': np.float64(0.49524235280046625), 'Std': np.float64(0.07618592608303823)}
2024-12-07 00:38:34,045 - INFO - Candidate Std Stats: {'Max': np.float64(0.5225416014037413), 'Min': np.float64(0.0), 'Mean': np.float64(0.11999780545795388), 'Std': np.float64(0.049541939863325904)}
[I 2024-12-07 00:38:34,089] Trial 149 finished with value: 1.5 and parameters: {'x_0_0': 'oo', 'x_0_1': 'oo', 'x_0_2': 'cd', 'x_1_0': 'bc', 'x_1_1': 'bc', 'x_1_2': 'ad'}. Best is trial 118 with value: 0.8666666666666667.
2024-12-07 00:38:42,508 - INFO - Candidate Mean Stats: {'Max': np.float64(2.0), 'Min': np.float64(0.242512261242764), 'Mean': np.float64(0.4920714634340818), 'Std': np.float64(0.07502939445213627)}
2024-12-07 00:38:42,509 - INFO - Candidate Std Stats: {'Max': np.float64(1.4926239298632282), 'Min': np.float64(0.0), 'Mean': np.float64(0.11534770490051843), 'Std': np.float64(0.05760793379644251)}
[I 2024-12-07 00:38:42,550] Trial 149 finished with value: 0.8444444444444444 and parameters: {'x_0_0': 'ad', 'x_0_1': 'oo', 'x_0_2': 'oo', 'x_1_0': 'bd', 'x_1_1': 'oo', 'x_1_2': 'ad'}. Best is trial 74 with value: 0.8222222222222222.
2024-12-07 00:38:49,032 - INFO - Candidate Mean Stats: {'Max': np.float64(2.0), 'Min': np.float64(0.297092792760478), 'Mean': np.float64(0.5052988863421876), 'Std': np.float64(0.06479071805404381)}
2024-12-07 00:38:49,033 - INFO - Candidate Std Stats: {'Max': np.float64(0.39821731595075127), 'Min': np.float64(0.0), 'Mean': np.float64(0.09611946027174796), 'Std': np.float64(0.039017281500763994)}
[I 2024-12-07 00:38:49,076] Trial 150 finished with value: 1.4444444444444444 and parameters: {'x_0_0': 'bd', 'x_0_1': 'ac', 'x_0_2': 'cd', 'x_1_0': 'bd', 'x_1_1': 'bc', 'x_1_2': 'bd'}. Best is trial 148 with value: 0.8333333333333333.
2024-12-07 00:38:51,334 - INFO - Candidate Mean Stats: {'Max': np.float64(2.0), 'Min': np.float64(0.23590520527035874), 'Mean': np.float64(0.48667243123629506), 'Std': np.float64(0.066371357989855)}
2024-12-07 00:38:51,335 - INFO - Candidate Std Stats: {'Max': np.float64(0.5680191221390801), 'Min': np.float64(0.0), 'Mean': np.float64(0.1046167312444819), 'Std': np.float64(0.04261556342949475)}
[I 2024-12-07 00:38:51,378] Trial 150 finished with value: 1.2777777777777777 and parameters: {'x_0_0': 'ab', 'x_0_1': 'oo', 'x_0_2': 'ac', 'x_1_0': 'cd', 'x_1_1': 'oo', 'x_1_2': 'ac'}. Best is trial 49 with value: 0.7999999999999999.
2024-12-07 00:38:54,586 - INFO - Candidate Mean Stats: {'Max': np.float64(2.0), 'Min': np.float64(0.25584747402165997), 'Mean': np.float64(0.4855413953021862), 'Std': np.float64(0.0682022980794225)}
2024-12-07 00:38:54,587 - INFO - Candidate Std Stats: {'Max': np.float64(0.7883506505557677), 'Min': np.float64(0.0), 'Mean': np.float64(0.10368280908557177), 'Std': np.float64(0.04673760931854751)}
[I 2024-12-07 00:38:54,629] Trial 150 finished with value: 1.6666666666666665 and parameters: {'x_0_0': 'ac', 'x_0_1': 'bc', 'x_0_2': 'cd', 'x_1_0': 'cd', 'x_1_1': 'ac', 'x_1_2': 'bc'}. Best is trial 118 with value: 0.8666666666666667.
2024-12-07 00:39:02,871 - INFO - Candidate Mean Stats: {'Max': np.float64(2.0), 'Min': np.float64(0.2771400029909274), 'Mean': np.float64(0.48646204492777795), 'Std': np.float64(0.06966778696716772)}
2024-12-07 00:39:02,871 - INFO - Candidate Std Stats: {'Max': np.float64(0.42744979994248444), 'Min': np.float64(0.0), 'Mean': np.float64(0.10790986676232014), 'Std': np.float64(0.04360036648764298)}
[I 2024-12-07 00:39:02,914] Trial 150 finished with value: 1.2666666666666666 and parameters: {'x_0_0': 'bc', 'x_0_1': 'oo', 'x_0_2': 'ad', 'x_1_0': 'bd', 'x_1_1': 'bd', 'x_1_2': 'ac'}. Best is trial 74 with value: 0.8222222222222222.
2024-12-07 00:39:09,145 - INFO - Candidate Mean Stats: {'Max': np.float64(2.0), 'Min': np.float64(0.175882845327663), 'Mean': np.float64(0.4713843013868925), 'Std': np.float64(0.0749668197720999)}
2024-12-07 00:39:09,146 - INFO - Candidate Std Stats: {'Max': np.float64(1.564635346349964), 'Min': np.float64(0.0), 'Mean': np.float64(0.1173726611278876), 'Std': np.float64(0.06181611226446588)}
[I 2024-12-07 00:39:09,189] Trial 151 finished with value: 1.2555555555555555 and parameters: {'x_0_0': 'ac', 'x_0_1': 'ab', 'x_0_2': 'ac', 'x_1_0': 'oo', 'x_1_1': 'bc', 'x_1_2': 'oo'}. Best is trial 49 with value: 0.7999999999999999.
2024-12-07 00:39:09,192 - INFO - Candidate Mean Stats: {'Max': np.float64(2.0), 'Min': np.float64(0.21853314440708016), 'Mean': np.float64(0.48338787022750057), 'Std': np.float64(0.07285338884257067)}
2024-12-07 00:39:09,193 - INFO - Candidate Std Stats: {'Max': np.float64(0.6420090459037159), 'Min': np.float64(0.0), 'Mean': np.float64(0.11426307420321341), 'Std': np.float64(0.05060176760113906)}
[I 2024-12-07 00:39:09,236] Trial 151 finished with value: 1.3444444444444446 and parameters: {'x_0_0': 'bc', 'x_0_1': 'ad', 'x_0_2': 'bd', 'x_1_0': 'bc', 'x_1_1': 'oo', 'x_1_2': 'ad'}. Best is trial 148 with value: 0.8333333333333333.
2024-12-07 00:39:14,968 - INFO - Candidate Mean Stats: {'Max': np.float64(2.0), 'Min': np.float64(0.23744859470076754), 'Mean': np.float64(0.48449621815561095), 'Std': np.float64(0.066349175677899)}
2024-12-07 00:39:14,969 - INFO - Candidate Std Stats: {'Max': np.float64(0.37595133771688855), 'Min': np.float64(0.0), 'Mean': np.float64(0.10169318731749932), 'Std': np.float64(0.04094094966574318)}
[I 2024-12-07 00:39:15,011] Trial 151 finished with value: 1.3444444444444446 and parameters: {'x_0_0': 'ad', 'x_0_1': 'ad', 'x_0_2': 'ab', 'x_1_0': 'bc', 'x_1_1': 'oo', 'x_1_2': 'ab'}. Best is trial 118 with value: 0.8666666666666667.
2024-12-07 00:39:22,994 - INFO - Candidate Mean Stats: {'Max': np.float64(2.0), 'Min': np.float64(0.18840850498293182), 'Mean': np.float64(0.4892928014350616), 'Std': np.float64(0.07666729294533313)}
2024-12-07 00:39:22,994 - INFO - Candidate Std Stats: {'Max': np.float64(1.5901213242691787), 'Min': np.float64(0.0), 'Mean': np.float64(0.11666694363471743), 'Std': np.float64(0.06323385593047114)}
[I 2024-12-07 00:39:23,039] Trial 151 finished with value: 1.9 and parameters: {'x_0_0': 'cd', 'x_0_1': 'ac', 'x_0_2': 'cd', 'x_1_0': 'bd', 'x_1_1': 'cd', 'x_1_2': 'oo'}. Best is trial 74 with value: 0.8222222222222222.
2024-12-07 00:39:29,450 - INFO - Candidate Mean Stats: {'Max': np.float64(2.0), 'Min': np.float64(0.07291883796605196), 'Mean': np.float64(0.4702897318743894), 'Std': np.float64(0.09111583885722033)}
2024-12-07 00:39:29,451 - INFO - Candidate Std Stats: {'Max': np.float64(1.3084061292114726), 'Min': np.float64(0.0), 'Mean': np.float64(0.12797416052355343), 'Std': np.float64(0.08322465102582205)}
[I 2024-12-07 00:39:29,493] Trial 152 finished with value: 1.6 and parameters: {'x_0_0': 'oo', 'x_0_1': 'ac', 'x_0_2': 'bd', 'x_1_0': 'oo', 'x_1_1': 'ad', 'x_1_2': 'oo'}. Best is trial 49 with value: 0.7999999999999999.
2024-12-07 00:39:29,507 - INFO - Candidate Mean Stats: {'Max': np.float64(2.0), 'Min': np.float64(0.27572588668055864), 'Mean': np.float64(0.4873154663169338), 'Std': np.float64(0.06750572299665132)}
2024-12-07 00:39:29,508 - INFO - Candidate Std Stats: {'Max': np.float64(0.3864774974795643), 'Min': np.float64(0.0), 'Mean': np.float64(0.09915925779754849), 'Std': np.float64(0.0398513097682593)}
[I 2024-12-07 00:39:29,549] Trial 152 finished with value: 1.1222222222222222 and parameters: {'x_0_0': 'ad', 'x_0_1': 'bd', 'x_0_2': 'oo', 'x_1_0': 'bc', 'x_1_1': 'ac', 'x_1_2': 'cd'}. Best is trial 148 with value: 0.8333333333333333.
2024-12-07 00:39:35,896 - INFO - Candidate Mean Stats: {'Max': np.float64(2.0), 'Min': np.float64(0.2676567890616789), 'Mean': np.float64(0.488809823504534), 'Std': np.float64(0.06487504947028172)}
2024-12-07 00:39:35,896 - INFO - Candidate Std Stats: {'Max': np.float64(0.3633719656981952), 'Min': np.float64(0.0), 'Mean': np.float64(0.09357676517762915), 'Std': np.float64(0.03812019807483923)}
[I 2024-12-07 00:39:35,942] Trial 152 finished with value: 1.2666666666666666 and parameters: {'x_0_0': 'bc', 'x_0_1': 'oo', 'x_0_2': 'ab', 'x_1_0': 'ac', 'x_1_1': 'bd', 'x_1_2': 'cd'}. Best is trial 118 with value: 0.8666666666666667.
2024-12-07 00:39:44,270 - INFO - Candidate Mean Stats: {'Max': np.float64(2.0), 'Min': np.float64(0.2829754888046106), 'Mean': np.float64(0.48682691685098695), 'Std': np.float64(0.06590391689053274)}
2024-12-07 00:39:44,271 - INFO - Candidate Std Stats: {'Max': np.float64(0.47108765576148615), 'Min': np.float64(0.0), 'Mean': np.float64(0.10588059167687836), 'Std': np.float64(0.047203875495881675)}
[I 2024-12-07 00:39:44,315] Trial 152 finished with value: 1.5666666666666667 and parameters: {'x_0_0': 'ac', 'x_0_1': 'cd', 'x_0_2': 'bd', 'x_1_0': 'bd', 'x_1_1': 'cd', 'x_1_2': 'oo'}. Best is trial 74 with value: 0.8222222222222222.
2024-12-07 00:39:50,675 - INFO - Candidate Mean Stats: {'Max': np.float64(2.0), 'Min': np.float64(0.30669823631214355), 'Mean': np.float64(0.48805053873020127), 'Std': np.float64(0.06842510694104056)}
2024-12-07 00:39:50,676 - INFO - Candidate Std Stats: {'Max': np.float64(0.6181628380212117), 'Min': np.float64(0.0), 'Mean': np.float64(0.10022407608197217), 'Std': np.float64(0.045841522995823177)}
[I 2024-12-07 00:39:50,718] Trial 153 finished with value: 1.4444444444444444 and parameters: {'x_0_0': 'ad', 'x_0_1': 'ac', 'x_0_2': 'ac', 'x_1_0': 'bd', 'x_1_1': 'bc', 'x_1_2': 'cd'}. Best is trial 49 with value: 0.7999999999999999.
2024-12-07 00:39:50,849 - INFO - Candidate Mean Stats: {'Max': np.float64(2.0), 'Min': np.float64(0.2728333879384197), 'Mean': np.float64(0.48466308191693375), 'Std': np.float64(0.06963175953489965)}
2024-12-07 00:39:50,849 - INFO - Candidate Std Stats: {'Max': np.float64(0.8114082606159645), 'Min': np.float64(0.0), 'Mean': np.float64(0.10516088152558503), 'Std': np.float64(0.046276360554914756)}
[I 2024-12-07 00:39:50,890] Trial 153 finished with value: 0.9666666666666667 and parameters: {'x_0_0': 'ac', 'x_0_1': 'oo', 'x_0_2': 'oo', 'x_1_0': 'oo', 'x_1_1': 'bd', 'x_1_2': 'ab'}. Best is trial 148 with value: 0.8333333333333333.
2024-12-07 00:39:56,827 - INFO - Candidate Mean Stats: {'Max': np.float64(2.0), 'Min': np.float64(0.3190329164815932), 'Mean': np.float64(0.498231532129071), 'Std': np.float64(0.05880573418475827)}
2024-12-07 00:39:56,828 - INFO - Candidate Std Stats: {'Max': np.float64(0.30668024675270394), 'Min': np.float64(0.0), 'Mean': np.float64(0.08968444490022785), 'Std': np.float64(0.03507496013933453)}
[I 2024-12-07 00:39:56,868] Trial 153 finished with value: 1.0444444444444443 and parameters: {'x_0_0': 'bd', 'x_0_1': 'oo', 'x_0_2': 'ab', 'x_1_0': 'bc', 'x_1_1': 'bc', 'x_1_2': 'ab'}. Best is trial 118 with value: 0.8666666666666667.
2024-12-07 00:40:04,693 - INFO - Candidate Mean Stats: {'Max': np.float64(2.0), 'Min': np.float64(0.28964422888195684), 'Mean': np.float64(0.4913753612395111), 'Std': np.float64(0.06389805535513028)}
2024-12-07 00:40:04,694 - INFO - Candidate Std Stats: {'Max': np.float64(0.3611514644441506), 'Min': np.float64(0.0), 'Mean': np.float64(0.0991935355701165), 'Std': np.float64(0.04098436747699682)}
[I 2024-12-07 00:40:04,737] Trial 153 finished with value: 1.2666666666666666 and parameters: {'x_0_0': 'bd', 'x_0_1': 'oo', 'x_0_2': 'cd', 'x_1_0': 'cd', 'x_1_1': 'bc', 'x_1_2': 'ad'}. Best is trial 74 with value: 0.8222222222222222.
2024-12-07 00:40:10,626 - INFO - Candidate Mean Stats: {'Max': np.float64(2.0), 'Min': np.float64(0.17334796793216398), 'Mean': np.float64(0.4866928254786351), 'Std': np.float64(0.0697405226391051)}
2024-12-07 00:40:10,626 - INFO - Candidate Std Stats: {'Max': np.float64(1.295915294473225), 'Min': np.float64(0.0), 'Mean': np.float64(0.10931811173692792), 'Std': np.float64(0.05174931879257929)}
2024-12-07 00:40:10,662 - INFO - Candidate Mean Stats: {'Max': np.float64(2.0), 'Min': np.float64(0.26553220172530945), 'Mean': np.float64(0.48861267810102854), 'Std': np.float64(0.07632860540656491)}
2024-12-07 00:40:10,662 - INFO - Candidate Std Stats: {'Max': np.float64(2.0416114984468994), 'Min': np.float64(0.0), 'Mean': np.float64(0.11114482402000915), 'Std': np.float64(0.061430862195999004)}
[I 2024-12-07 00:40:10,669] Trial 154 finished with value: 1.9 and parameters: {'x_0_0': 'oo', 'x_0_1': 'bc', 'x_0_2': 'ac', 'x_1_0': 'bd', 'x_1_1': 'bc', 'x_1_2': 'bd'}. Best is trial 49 with value: 0.7999999999999999.
[I 2024-12-07 00:40:10,704] Trial 154 finished with value: 1.3444444444444446 and parameters: {'x_0_0': 'bd', 'x_0_1': 'ad', 'x_0_2': 'ab', 'x_1_0': 'bc', 'x_1_1': 'bd', 'x_1_2': 'oo'}. Best is trial 148 with value: 0.8333333333333333.
2024-12-07 00:40:17,040 - INFO - Candidate Mean Stats: {'Max': np.float64(2.0), 'Min': np.float64(0.17770883398000986), 'Mean': np.float64(0.4827981738567371), 'Std': np.float64(0.07504396716666237)}
2024-12-07 00:40:17,040 - INFO - Candidate Std Stats: {'Max': np.float64(1.6959077813752865), 'Min': np.float64(0.0), 'Mean': np.float64(0.1092167123844768), 'Std': np.float64(0.055223041772139596)}
