[I 2024-12-06 23:36:46,169] Trial 124 finished with value: 0.7857142857142857 and parameters: {'x_0_0': 'bd', 'x_0_1': 'oo', 'x_1_0': 'bc', 'x_1_1': 'cd'}. Best is trial 50 with value: 0.6607142857142857.
2024-12-06 23:36:46,481 - INFO - Candidate Mean Stats: {'Max': np.float64(2.691252533922834), 'Min': np.float64(-0.8640112002445595), 'Mean': np.float64(0.3959482686381969), 'Std': np.float64(0.49569739561857157)}
2024-12-06 23:36:46,481 - INFO - Candidate Std Stats: {'Max': np.float64(1.3913311346077935), 'Min': np.float64(0.0), 'Mean': np.float64(0.5702320111755449), 'Std': np.float64(0.2668058915890326)}
2024-12-06 23:36:46,488 - INFO - Candidate Mean Stats: {'Max': np.float64(2.454618971220964), 'Min': np.float64(-0.9520559494066585), 'Mean': np.float64(0.4547415405491663), 'Std': np.float64(0.5001897815812891)}
2024-12-06 23:36:46,488 - INFO - Candidate Std Stats: {'Max': np.float64(1.3043006801524617), 'Min': np.float64(0.0), 'Mean': np.float64(0.5144714457506888), 'Std': np.float64(0.23361470248205374)}
2024-12-06 23:36:46,490 - INFO - Candidate Mean Stats: {'Max': np.float64(2.6657597450444186), 'Min': np.float64(-1.2958279440155747), 'Mean': np.float64(0.3762072089347297), 'Std': np.float64(0.5529472805440342)}
2024-12-06 23:36:46,490 - INFO - Candidate Std Stats: {'Max': np.float64(1.7674422738423108), 'Min': np.float64(0.0), 'Mean': np.float64(0.623502717492468), 'Std': np.float64(0.291502252702251)}
[I 2024-12-06 23:36:46,495] Trial 124 finished with value: 1.0714285714285714 and parameters: {'x_0_0': 'ac', 'x_0_1': 'oo', 'x_1_0': 'bc', 'x_1_1': 'ac'}. Best is trial 23 with value: 0.5.
[I 2024-12-06 23:36:46,502] Trial 125 finished with value: 0.7857142857142857 and parameters: {'x_0_0': 'ad', 'x_0_1': 'oo', 'x_1_0': 'bc', 'x_1_1': 'bd'}. Best is trial 63 with value: 0.5.
[I 2024-12-06 23:36:46,504] Trial 125 finished with value: 1.0714285714285714 and parameters: {'x_0_0': 'bd', 'x_0_1': 'oo', 'x_1_0': 'ad', 'x_1_1': 'ac'}. Best is trial 76 with value: 0.5.
2024-12-06 23:36:46,509 - INFO - Candidate Mean Stats: {'Max': np.float64(2.3103713061074957), 'Min': np.float64(-1.056061845224312), 'Mean': np.float64(0.4729697436830557), 'Std': np.float64(0.45968779028314594)}
2024-12-06 23:36:46,509 - INFO - Candidate Std Stats: {'Max': np.float64(1.3821001895199434), 'Min': np.float64(0.0), 'Mean': np.float64(0.5533239662629065), 'Std': np.float64(0.248246589954557)}
[I 2024-12-06 23:36:46,522] Trial 125 finished with value: 1.0 and parameters: {'x_0_0': 'oo', 'x_0_1': 'oo', 'x_1_0': 'oo', 'x_1_1': 'oo'}. Best is trial 50 with value: 0.6607142857142857.
2024-12-06 23:36:46,853 - INFO - Candidate Mean Stats: {'Max': np.float64(3.1196759825173523), 'Min': np.float64(-1.6000964360347196), 'Mean': np.float64(0.22850128895644997), 'Std': np.float64(0.6216068467811314)}
2024-12-06 23:36:46,853 - INFO - Candidate Std Stats: {'Max': np.float64(1.7873201349050611), 'Min': np.float64(0.0), 'Mean': np.float64(0.7029151376255409), 'Std': np.float64(0.32346650205643823)}
2024-12-06 23:36:46,856 - INFO - Candidate Mean Stats: {'Max': np.float64(2.502445614543787), 'Min': np.float64(-0.8141777356578441), 'Mean': np.float64(0.4660449404209841), 'Std': np.float64(0.4979607556539604)}
2024-12-06 23:36:46,856 - INFO - Candidate Std Stats: {'Max': np.float64(1.5719087149698694), 'Min': np.float64(0.0), 'Mean': np.float64(0.481795395010194), 'Std': np.float64(0.23889143425923634)}
2024-12-06 23:36:46,860 - INFO - Candidate Mean Stats: {'Max': np.float64(2.2968733236123997), 'Min': np.float64(-1.2087354304683795), 'Mean': np.float64(0.24554400247062233), 'Std': np.float64(0.5422719559468714)}
2024-12-06 23:36:46,860 - INFO - Candidate Std Stats: {'Max': np.float64(1.8886249184044481), 'Min': np.float64(0.0), 'Mean': np.float64(0.6851370459754803), 'Std': np.float64(0.3268608374851654)}
[I 2024-12-06 23:36:46,870] Trial 126 finished with value: 0.5 and parameters: {'x_0_0': 'bd', 'x_0_1': 'oo', 'x_1_0': 'bc', 'x_1_1': 'ac'}. Best is trial 76 with value: 0.5.
[I 2024-12-06 23:36:46,873] Trial 125 finished with value: 0.6607142857142857 and parameters: {'x_0_0': 'ad', 'x_0_1': 'oo', 'x_1_0': 'bc', 'x_1_1': 'oo'}. Best is trial 23 with value: 0.5.
[I 2024-12-06 23:36:46,874] Trial 126 finished with value: 0.6964285714285714 and parameters: {'x_0_0': 'ad', 'x_0_1': 'oo', 'x_1_0': 'oo', 'x_1_1': 'oo'}. Best is trial 63 with value: 0.5.
2024-12-06 23:36:46,878 - INFO - Candidate Mean Stats: {'Max': np.float64(2.6000175918309885), 'Min': np.float64(-0.8681347694960779), 'Mean': np.float64(0.3499651456479156), 'Std': np.float64(0.518326896502705)}
2024-12-06 23:36:46,878 - INFO - Candidate Std Stats: {'Max': np.float64(1.6073945987669795), 'Min': np.float64(0.0), 'Mean': np.float64(0.53579843846778), 'Std': np.float64(0.2554968655918049)}
[I 2024-12-06 23:36:46,891] Trial 126 finished with value: 1.1964285714285714 and parameters: {'x_0_0': 'bd', 'x_0_1': 'bc', 'x_1_0': 'oo', 'x_1_1': 'oo'}. Best is trial 50 with value: 0.6607142857142857.
2024-12-06 23:36:47,234 - INFO - Candidate Mean Stats: {'Max': np.float64(2.909895396482306), 'Min': np.float64(-0.9694554552446943), 'Mean': np.float64(0.4184423327102035), 'Std': np.float64(0.5341373238676802)}
2024-12-06 23:36:47,234 - INFO - Candidate Std Stats: {'Max': np.float64(1.7206926831615736), 'Min': np.float64(0.0), 'Mean': np.float64(0.5794024933918717), 'Std': np.float64(0.2535431570956465)}
2024-12-06 23:36:47,240 - INFO - Candidate Mean Stats: {'Max': np.float64(2.6113126778030784), 'Min': np.float64(-0.9902187755552013), 'Mean': np.float64(0.40419295172382286), 'Std': np.float64(0.4723984322254041)}
2024-12-06 23:36:47,240 - INFO - Candidate Std Stats: {'Max': np.float64(1.8326546000221593), 'Min': np.float64(0.0), 'Mean': np.float64(0.4973293195151447), 'Std': np.float64(0.24868244865539163)}
2024-12-06 23:36:47,244 - INFO - Candidate Mean Stats: {'Max': np.float64(2.677079839740935), 'Min': np.float64(-1.254473307787542), 'Mean': np.float64(0.4032364231244419), 'Std': np.float64(0.5362188296421211)}
2024-12-06 23:36:47,244 - INFO - Candidate Std Stats: {'Max': np.float64(1.4091860098848332), 'Min': np.float64(0.0), 'Mean': np.float64(0.5925231732222663), 'Std': np.float64(0.2688959135287441)}
[I 2024-12-06 23:36:47,248] Trial 127 finished with value: 1.0714285714285714 and parameters: {'x_0_0': 'bc', 'x_0_1': 'oo', 'x_1_0': 'ad', 'x_1_1': 'cd'}. Best is trial 76 with value: 0.5.
[I 2024-12-06 23:36:47,254] Trial 127 finished with value: 0.9464285714285714 and parameters: {'x_0_0': 'ad', 'x_0_1': 'oo', 'x_1_0': 'ad', 'x_1_1': 'oo'}. Best is trial 63 with value: 0.5.
2024-12-06 23:36:47,256 - INFO - Candidate Mean Stats: {'Max': np.float64(2.413110329567913), 'Min': np.float64(-0.9488703441049922), 'Mean': np.float64(0.4128089436467649), 'Std': np.float64(0.49668322138831966)}
2024-12-06 23:36:47,256 - INFO - Candidate Std Stats: {'Max': np.float64(1.6593600139692948), 'Min': np.float64(0.0), 'Mean': np.float64(0.5653856440393604), 'Std': np.float64(0.28021861554228855)}
[I 2024-12-06 23:36:47,257] Trial 126 finished with value: 1.0714285714285714 and parameters: {'x_0_0': 'bd', 'x_0_1': 'oo', 'x_1_0': 'ac', 'x_1_1': 'bc'}. Best is trial 23 with value: 0.5.
[I 2024-12-06 23:36:47,269] Trial 127 finished with value: 0.9464285714285714 and parameters: {'x_0_0': 'ac', 'x_0_1': 'oo', 'x_1_0': 'ab', 'x_1_1': 'oo'}. Best is trial 50 with value: 0.6607142857142857.
2024-12-06 23:36:47,586 - INFO - Candidate Mean Stats: {'Max': np.float64(2.386792795948639), 'Min': np.float64(-1.1025251532246565), 'Mean': np.float64(0.38656179132207397), 'Std': np.float64(0.5114488601359805)}
2024-12-06 23:36:47,586 - INFO - Candidate Std Stats: {'Max': np.float64(1.7840869733364524), 'Min': np.float64(0.0), 'Mean': np.float64(0.5486080434450127), 'Std': np.float64(0.2542461037219539)}
2024-12-06 23:36:47,591 - INFO - Candidate Mean Stats: {'Max': np.float64(2.654955528310389), 'Min': np.float64(-0.8985880481872641), 'Mean': np.float64(0.46554262730122387), 'Std': np.float64(0.45983397204782256)}
2024-12-06 23:36:47,592 - INFO - Candidate Std Stats: {'Max': np.float64(1.5603426487053484), 'Min': np.float64(0.0), 'Mean': np.float64(0.5553709041874086), 'Std': np.float64(0.27578691803693384)}
2024-12-06 23:36:47,593 - INFO - Candidate Mean Stats: {'Max': np.float64(2.5595326395754325), 'Min': np.float64(-1.1454932358194234), 'Mean': np.float64(0.3355611055631875), 'Std': np.float64(0.5229114904812642)}
2024-12-06 23:36:47,593 - INFO - Candidate Std Stats: {'Max': np.float64(1.4645066610437658), 'Min': np.float64(0.0), 'Mean': np.float64(0.5696946759422281), 'Std': np.float64(0.2599820988469857)}
2024-12-06 23:36:47,598 - INFO - Candidate Mean Stats: {'Max': np.float64(2.5384953279123836), 'Min': np.float64(-1.1992436223101226), 'Mean': np.float64(0.34095533130915945), 'Std': np.float64(0.5228891495249849)}
2024-12-06 23:36:47,598 - INFO - Candidate Std Stats: {'Max': np.float64(1.5419144266528622), 'Min': np.float64(0.0), 'Mean': np.float64(0.6134428640483031), 'Std': np.float64(0.2856723905805625)}
[I 2024-12-06 23:36:47,599] Trial 128 finished with value: 0.8214285714285714 and parameters: {'x_0_0': 'bd', 'x_0_1': 'oo', 'x_1_0': 'oo', 'x_1_1': 'bc'}. Best is trial 76 with value: 0.5.
[I 2024-12-06 23:36:47,605] Trial 127 finished with value: 1.0714285714285714 and parameters: {'x_0_0': 'bd', 'x_0_1': 'oo', 'x_1_0': 'ac', 'x_1_1': 'cd'}. Best is trial 23 with value: 0.5.
[I 2024-12-06 23:36:47,607] Trial 128 finished with value: 1.2857142857142856 and parameters: {'x_0_0': 'bd', 'x_0_1': 'bd', 'x_1_0': 'bc', 'x_1_1': 'cd'}. Best is trial 63 with value: 0.5.
[I 2024-12-06 23:36:47,613] Trial 128 finished with value: 1.0714285714285714 and parameters: {'x_0_0': 'bd', 'x_0_1': 'oo', 'x_1_0': 'ad', 'x_1_1': 'ad'}. Best is trial 50 with value: 0.6607142857142857.
2024-12-06 23:36:47,943 - INFO - Candidate Mean Stats: {'Max': np.float64(2.4985740144235646), 'Min': np.float64(-1.3585015227521893), 'Mean': np.float64(0.35525800582994443), 'Std': np.float64(0.562223650436183)}
2024-12-06 23:36:47,943 - INFO - Candidate Std Stats: {'Max': np.float64(1.5693965862218273), 'Min': np.float64(0.0), 'Mean': np.float64(0.6027098011835825), 'Std': np.float64(0.29097725129046)}
2024-12-06 23:36:47,947 - INFO - Candidate Mean Stats: {'Max': np.float64(2.369894794562656), 'Min': np.float64(-1.3754434964536735), 'Mean': np.float64(0.3196591367977259), 'Std': np.float64(0.5578052828410978)}
2024-12-06 23:36:47,947 - INFO - Candidate Std Stats: {'Max': np.float64(1.7278549070940354), 'Min': np.float64(0.0), 'Mean': np.float64(0.6452452265240123), 'Std': np.float64(0.2955886094221158)}
2024-12-06 23:36:47,947 - INFO - Candidate Mean Stats: {'Max': np.float64(2.3838008496486873), 'Min': np.float64(-0.9183997971635158), 'Mean': np.float64(0.3804668172187718), 'Std': np.float64(0.5131061357358887)}
2024-12-06 23:36:47,947 - INFO - Candidate Std Stats: {'Max': np.float64(1.6001678016545664), 'Min': np.float64(0.0), 'Mean': np.float64(0.5797411056676519), 'Std': np.float64(0.2661067012494447)}
2024-12-06 23:36:47,950 - INFO - Candidate Mean Stats: {'Max': np.float64(2.7047153210775514), 'Min': np.float64(-1.1009937229624982), 'Mean': np.float64(0.3951757999251689), 'Std': np.float64(0.4937511159274924)}
2024-12-06 23:36:47,950 - INFO - Candidate Std Stats: {'Max': np.float64(1.6774195063908515), 'Min': np.float64(0.0), 'Mean': np.float64(0.4851085689277788), 'Std': np.float64(0.22246142501046984)}
[I 2024-12-06 23:36:47,958] Trial 129 finished with value: 0.9464285714285714 and parameters: {'x_0_0': 'bd', 'x_0_1': 'oo', 'x_1_0': 'ac', 'x_1_1': 'oo'}. Best is trial 76 with value: 0.5.
[I 2024-12-06 23:36:47,962] Trial 129 finished with value: 1.0714285714285714 and parameters: {'x_0_0': 'ac', 'x_0_1': 'oo', 'x_1_0': 'ad', 'x_1_1': 'bc'}. Best is trial 63 with value: 0.5.
[I 2024-12-06 23:36:47,963] Trial 128 finished with value: 0.6607142857142857 and parameters: {'x_0_0': 'ad', 'x_0_1': 'oo', 'x_1_0': 'bd', 'x_1_1': 'oo'}. Best is trial 23 with value: 0.5.
[I 2024-12-06 23:36:47,965] Trial 129 finished with value: 1.25 and parameters: {'x_0_0': 'oo', 'x_0_1': 'oo', 'x_1_0': 'ab', 'x_1_1': 'oo'}. Best is trial 50 with value: 0.6607142857142857.
2024-12-06 23:36:48,295 - INFO - Candidate Mean Stats: {'Max': np.float64(2.819694248016114), 'Min': np.float64(-1.3477174092456994), 'Mean': np.float64(0.3443330056890436), 'Std': np.float64(0.5356179809617031)}
2024-12-06 23:36:48,295 - INFO - Candidate Std Stats: {'Max': np.float64(1.6077154921712897), 'Min': np.float64(0.0), 'Mean': np.float64(0.6272684921394945), 'Std': np.float64(0.28526813480107793)}
2024-12-06 23:36:48,299 - INFO - Candidate Mean Stats: {'Max': np.float64(2.580761444704978), 'Min': np.float64(-0.988466507508743), 'Mean': np.float64(0.4236315499684999), 'Std': np.float64(0.505323589975756)}
2024-12-06 23:36:48,299 - INFO - Candidate Std Stats: {'Max': np.float64(1.6966294206235646), 'Min': np.float64(0.0), 'Mean': np.float64(0.5870601833833288), 'Std': np.float64(0.28046016257107986)}
2024-12-06 23:36:48,305 - INFO - Candidate Mean Stats: {'Max': np.float64(2.3736661576253457), 'Min': np.float64(-1.2862586336241981), 'Mean': np.float64(0.4569809460830796), 'Std': np.float64(0.5107327165624875)}
2024-12-06 23:36:48,305 - INFO - Candidate Std Stats: {'Max': np.float64(1.7457203351032122), 'Min': np.float64(0.0), 'Mean': np.float64(0.5748987901976633), 'Std': np.float64(0.2768320268267728)}
[I 2024-12-06 23:36:48,308] Trial 130 finished with value: 1.0714285714285714 and parameters: {'x_0_0': 'bc', 'x_0_1': 'oo', 'x_1_0': 'bc', 'x_1_1': 'ab'}. Best is trial 76 with value: 0.5.
2024-12-06 23:36:48,312 - INFO - Candidate Mean Stats: {'Max': np.float64(2.373887340181998), 'Min': np.float64(-1.0699997731919462), 'Mean': np.float64(0.3777005526535886), 'Std': np.float64(0.5177343964119877)}
2024-12-06 23:36:48,312 - INFO - Candidate Std Stats: {'Max': np.float64(1.7254870305679044), 'Min': np.float64(0.0), 'Mean': np.float64(0.5579053204749711), 'Std': np.float64(0.26244737149961694)}
[I 2024-12-06 23:36:48,312] Trial 129 finished with value: 0.9464285714285714 and parameters: {'x_0_0': 'ac', 'x_0_1': 'oo', 'x_1_0': 'bd', 'x_1_1': 'oo'}. Best is trial 23 with value: 0.5.
[I 2024-12-06 23:36:48,320] Trial 130 finished with value: 1.0892857142857144 and parameters: {'x_0_0': 'ab', 'x_0_1': 'oo', 'x_1_0': 'ad', 'x_1_1': 'oo'}. Best is trial 63 with value: 0.5.
[I 2024-12-06 23:36:48,325] Trial 130 finished with value: 1.0714285714285714 and parameters: {'x_0_0': 'bc', 'x_0_1': 'oo', 'x_1_0': 'cd', 'x_1_1': 'ac'}. Best is trial 50 with value: 0.6607142857142857.
2024-12-06 23:36:48,638 - INFO - Candidate Mean Stats: {'Max': np.float64(3.1684396249681157), 'Min': np.float64(-1.2524885787709976), 'Mean': np.float64(0.3362829413396794), 'Std': np.float64(0.5722991084317957)}
2024-12-06 23:36:48,638 - INFO - Candidate Std Stats: {'Max': np.float64(1.9403760469344373), 'Min': np.float64(0.0), 'Mean': np.float64(0.652952419524778), 'Std': np.float64(0.29826294853954094)}
2024-12-06 23:36:48,646 - INFO - Candidate Mean Stats: {'Max': np.float64(2.668180316053139), 'Min': np.float64(-0.9142904792482284), 'Mean': np.float64(0.4078695570624493), 'Std': np.float64(0.48471043596666274)}
2024-12-06 23:36:48,646 - INFO - Candidate Std Stats: {'Max': np.float64(1.7722328275809256), 'Min': np.float64(0.0), 'Mean': np.float64(0.6062696970120696), 'Std': np.float64(0.2876533372661326)}
[I 2024-12-06 23:36:48,652] Trial 131 finished with value: 0.9285714285714286 and parameters: {'x_0_0': 'bd', 'x_0_1': 'oo', 'x_1_0': 'ab', 'x_1_1': 'cd'}. Best is trial 76 with value: 0.5.
2024-12-06 23:36:48,653 - INFO - Candidate Mean Stats: {'Max': np.float64(2.4075045713304033), 'Min': np.float64(-0.9567747667552389), 'Mean': np.float64(0.33429762736414154), 'Std': np.float64(0.5153591754024369)}
2024-12-06 23:36:48,653 - INFO - Candidate Std Stats: {'Max': np.float64(1.5696323375873333), 'Min': np.float64(0.0), 'Mean': np.float64(0.5883266676312461), 'Std': np.float64(0.2641426297532596)}
2024-12-06 23:36:48,661 - INFO - Candidate Mean Stats: {'Max': np.float64(2.458124175036762), 'Min': np.float64(-1.3800489306901242), 'Mean': np.float64(0.4122762542665905), 'Std': np.float64(0.51723662513182)}
2024-12-06 23:36:48,661 - INFO - Candidate Std Stats: {'Max': np.float64(2.0709087722969968), 'Min': np.float64(0.0), 'Mean': np.float64(0.5857572193197285), 'Std': np.float64(0.2827450559361243)}
[I 2024-12-06 23:36:48,664] Trial 130 finished with value: 0.8214285714285714 and parameters: {'x_0_0': 'ad', 'x_0_1': 'oo', 'x_1_0': 'oo', 'x_1_1': 'bc'}. Best is trial 23 with value: 0.5.
[I 2024-12-06 23:36:48,671] Trial 131 finished with value: 1.2142857142857144 and parameters: {'x_0_0': 'ab', 'x_0_1': 'oo', 'x_1_0': 'ad', 'x_1_1': 'bc'}. Best is trial 63 with value: 0.5.
[I 2024-12-06 23:36:48,678] Trial 131 finished with value: 1.875 and parameters: {'x_0_0': 'cd', 'x_0_1': 'bc', 'x_1_0': 'bc', 'x_1_1': 'oo'}. Best is trial 50 with value: 0.6607142857142857.
2024-12-06 23:36:48,985 - INFO - Candidate Mean Stats: {'Max': np.float64(3.0324580662500904), 'Min': np.float64(-1.6559824241719092), 'Mean': np.float64(0.2944767647520294), 'Std': np.float64(0.6256751108818291)}
2024-12-06 23:36:48,985 - INFO - Candidate Std Stats: {'Max': np.float64(1.9495813881568844), 'Min': np.float64(0.0), 'Mean': np.float64(0.6708817475035503), 'Std': np.float64(0.32417522908963214)}
[I 2024-12-06 23:36:48,998] Trial 132 finished with value: 1.0714285714285714 and parameters: {'x_0_0': 'bd', 'x_0_1': 'oo', 'x_1_0': 'ad', 'x_1_1': 'bd'}. Best is trial 76 with value: 0.5.
2024-12-06 23:36:48,998 - INFO - Candidate Mean Stats: {'Max': np.float64(2.8890483166393324), 'Min': np.float64(-1.0244959327630943), 'Mean': np.float64(0.3873489287856434), 'Std': np.float64(0.5289199118393298)}
2024-12-06 23:36:48,998 - INFO - Candidate Std Stats: {'Max': np.float64(1.9286638117435373), 'Min': np.float64(0.0), 'Mean': np.float64(0.633543858266205), 'Std': np.float64(0.3208430601614539)}
2024-12-06 23:36:49,002 - INFO - Candidate Mean Stats: {'Max': np.float64(2.3665748967617923), 'Min': np.float64(-1.231467884695882), 'Mean': np.float64(0.42624865491003755), 'Std': np.float64(0.5149592394254993)}
2024-12-06 23:36:49,003 - INFO - Candidate Std Stats: {'Max': np.float64(1.5350167198942204), 'Min': np.float64(0.0), 'Mean': np.float64(0.5689554773907469), 'Std': np.float64(0.2706478712268954)}
2024-12-06 23:36:49,004 - INFO - Candidate Mean Stats: {'Max': np.float64(2.5535915112792056), 'Min': np.float64(-1.1327369081160596), 'Mean': np.float64(0.3601172433443064), 'Std': np.float64(0.55011539091608)}
2024-12-06 23:36:49,004 - INFO - Candidate Std Stats: {'Max': np.float64(1.288542431855074), 'Min': np.float64(0.0), 'Mean': np.float64(0.5226670643095821), 'Std': np.float64(0.22995414567628392)}
[I 2024-12-06 23:36:49,011] Trial 132 finished with value: 1.2142857142857144 and parameters: {'x_0_0': 'ab', 'x_0_1': 'oo', 'x_1_0': 'ad', 'x_1_1': 'cd'}. Best is trial 63 with value: 0.5.
[I 2024-12-06 23:36:49,016] Trial 132 finished with value: 1.0714285714285714 and parameters: {'x_0_0': 'ad', 'x_0_1': 'oo', 'x_1_0': 'ac', 'x_1_1': 'bc'}. Best is trial 50 with value: 0.6607142857142857.
[I 2024-12-06 23:36:49,018] Trial 131 finished with value: 0.9464285714285714 and parameters: {'x_0_0': 'bc', 'x_0_1': 'oo', 'x_1_0': 'bc', 'x_1_1': 'oo'}. Best is trial 23 with value: 0.5.
2024-12-06 23:36:49,527 - INFO - Candidate Mean Stats: {'Max': np.float64(2.404226622604436), 'Min': np.float64(-1.6528823026584702), 'Mean': np.float64(0.24650399527899056), 'Std': np.float64(0.6272503962478597)}
2024-12-06 23:36:49,528 - INFO - Candidate Std Stats: {'Max': np.float64(1.8333556894814709), 'Min': np.float64(0.0), 'Mean': np.float64(0.7177475578392201), 'Std': np.float64(0.33229282195120935)}
2024-12-06 23:36:49,528 - INFO - Candidate Mean Stats: {'Max': np.float64(2.85460486175358), 'Min': np.float64(-1.0163194140590242), 'Mean': np.float64(0.35262739206569066), 'Std': np.float64(0.5259921445932298)}
2024-12-06 23:36:49,528 - INFO - Candidate Std Stats: {'Max': np.float64(1.3314504982323716), 'Min': np.float64(0.0), 'Mean': np.float64(0.5617926173269546), 'Std': np.float64(0.24692440676106875)}
2024-12-06 23:36:49,543 - INFO - Candidate Mean Stats: {'Max': np.float64(2.543234399910408), 'Min': np.float64(-1.1425629529623524), 'Mean': np.float64(0.40118395930039036), 'Std': np.float64(0.5246194628058702)}
2024-12-06 23:36:49,543 - INFO - Candidate Std Stats: {'Max': np.float64(1.6093988174230938), 'Min': np.float64(0.0), 'Mean': np.float64(0.5979140897269172), 'Std': np.float64(0.27771305350501946)}
2024-12-06 23:36:49,544 - INFO - Candidate Mean Stats: {'Max': np.float64(2.2704423620747467), 'Min': np.float64(-1.0619298083353776), 'Mean': np.float64(0.40292307061596416), 'Std': np.float64(0.5153677225675376)}
2024-12-06 23:36:49,544 - INFO - Candidate Std Stats: {'Max': np.float64(1.5677788353921864), 'Min': np.float64(0.0), 'Mean': np.float64(0.5563394393420149), 'Std': np.float64(0.25478630326209406)}
[I 2024-12-06 23:36:49,547] Trial 133 finished with value: 1.1785714285714286 and parameters: {'x_0_0': 'ac', 'x_0_1': 'ab', 'x_1_0': 'oo', 'x_1_1': 'ac'}. Best is trial 76 with value: 0.5.
[I 2024-12-06 23:36:49,550] Trial 133 finished with value: 1.3035714285714286 and parameters: {'x_0_0': 'bc', 'x_0_1': 'ab', 'x_1_0': 'bd', 'x_1_1': 'oo'}. Best is trial 50 with value: 0.6607142857142857.
[I 2024-12-06 23:36:49,570] Trial 133 finished with value: 0.9464285714285714 and parameters: {'x_0_0': 'ac', 'x_0_1': 'oo', 'x_1_0': 'cd', 'x_1_1': 'oo'}. Best is trial 63 with value: 0.5.
