[I 2024-12-06 23:37:00,372] Trial 159 finished with value: 1.0714285714285714 and parameters: {'x_0_0': 'ad', 'x_0_1': 'oo', 'x_1_0': 'ad', 'x_1_1': 'bc'}. Best is trial 23 with value: 0.5.
2024-12-06 23:37:00,609 - INFO - Candidate Mean Stats: {'Max': np.float64(2.9763948123578934), 'Min': np.float64(-0.8318905275050488), 'Mean': np.float64(0.5050292844619517), 'Std': np.float64(0.4768006391309804)}
2024-12-06 23:37:00,609 - INFO - Candidate Std Stats: {'Max': np.float64(1.5868857061126669), 'Min': np.float64(0.0), 'Mean': np.float64(0.5412638687377613), 'Std': np.float64(0.2554474190308436)}
[I 2024-12-06 23:37:00,622] Trial 161 finished with value: 0.9285714285714286 and parameters: {'x_0_0': 'bd', 'x_0_1': 'oo', 'x_1_0': 'ab', 'x_1_1': 'ac'}. Best is trial 50 with value: 0.6607142857142857.
2024-12-06 23:37:00,627 - INFO - Candidate Mean Stats: {'Max': np.float64(3.0583947024991707), 'Min': np.float64(-1.2231467765536301), 'Mean': np.float64(0.3892569576480043), 'Std': np.float64(0.6000983020250236)}
2024-12-06 23:37:00,627 - INFO - Candidate Std Stats: {'Max': np.float64(1.9034222762701318), 'Min': np.float64(0.0), 'Mean': np.float64(0.6052214787688335), 'Std': np.float64(0.3029526837063183)}
2024-12-06 23:37:00,637 - INFO - Candidate Mean Stats: {'Max': np.float64(2.351897167029295), 'Min': np.float64(-1.1989981203704194), 'Mean': np.float64(0.3922514687293875), 'Std': np.float64(0.5666314845553796)}
2024-12-06 23:37:00,637 - INFO - Candidate Std Stats: {'Max': np.float64(1.9180020880252204), 'Min': np.float64(0.0), 'Mean': np.float64(0.643615452743176), 'Std': np.float64(0.3132905492627815)}
[I 2024-12-06 23:37:00,640] Trial 161 finished with value: 1.375 and parameters: {'x_0_0': 'oo', 'x_0_1': 'oo', 'x_1_0': 'bd', 'x_1_1': 'ab'}. Best is trial 76 with value: 0.5.
[I 2024-12-06 23:37:00,650] Trial 161 finished with value: 1.0714285714285714 and parameters: {'x_0_0': 'ac', 'x_0_1': 'oo', 'x_1_0': 'bd', 'x_1_1': 'cd'}. Best is trial 63 with value: 0.5.
2024-12-06 23:37:00,713 - INFO - Candidate Mean Stats: {'Max': np.float64(2.772862389687089), 'Min': np.float64(-1.34175088097579), 'Mean': np.float64(0.24309919530000662), 'Std': np.float64(0.6242282056005759)}
2024-12-06 23:37:00,713 - INFO - Candidate Std Stats: {'Max': np.float64(1.9143810635539114), 'Min': np.float64(0.0), 'Mean': np.float64(0.6928815164897024), 'Std': np.float64(0.33233584445346154)}
[I 2024-12-06 23:37:00,727] Trial 160 finished with value: 1.3035714285714286 and parameters: {'x_0_0': 'ad', 'x_0_1': 'bd', 'x_1_0': 'ab', 'x_1_1': 'oo'}. Best is trial 23 with value: 0.5.
2024-12-06 23:37:00,985 - INFO - Candidate Mean Stats: {'Max': np.float64(2.8645034115891512), 'Min': np.float64(-1.0145433127433037), 'Mean': np.float64(0.4601885921182855), 'Std': np.float64(0.5783654668515512)}
2024-12-06 23:37:00,985 - INFO - Candidate Std Stats: {'Max': np.float64(1.73905422592591), 'Min': np.float64(0.0), 'Mean': np.float64(0.5708578176181328), 'Std': np.float64(0.2757840583613063)}
2024-12-06 23:37:00,994 - INFO - Candidate Mean Stats: {'Max': np.float64(3.417589400821484), 'Min': np.float64(-1.3452520564913648), 'Mean': np.float64(0.37403178456577946), 'Std': np.float64(0.6276406671612149)}
2024-12-06 23:37:00,994 - INFO - Candidate Std Stats: {'Max': np.float64(2.2615272036908154), 'Min': np.float64(0.0), 'Mean': np.float64(0.6498783922678365), 'Std': np.float64(0.33822541745442886)}
[I 2024-12-06 23:37:00,998] Trial 162 finished with value: 1.375 and parameters: {'x_0_0': 'oo', 'x_0_1': 'oo', 'x_1_0': 'ab', 'x_1_1': 'ad'}. Best is trial 50 with value: 0.6607142857142857.
2024-12-06 23:37:01,000 - INFO - Candidate Mean Stats: {'Max': np.float64(2.961358214755102), 'Min': np.float64(-1.4032316191826797), 'Mean': np.float64(0.32793877241866454), 'Std': np.float64(0.5843621013613699)}
2024-12-06 23:37:01,001 - INFO - Candidate Std Stats: {'Max': np.float64(1.8847419600774251), 'Min': np.float64(0.0), 'Mean': np.float64(0.6686697618093013), 'Std': np.float64(0.31954424949172094)}
[I 2024-12-06 23:37:01,009] Trial 162 finished with value: 0.6607142857142857 and parameters: {'x_0_0': 'bd', 'x_0_1': 'oo', 'x_1_0': 'bd', 'x_1_1': 'oo'}. Best is trial 76 with value: 0.5.
[I 2024-12-06 23:37:01,013] Trial 162 finished with value: 1.0714285714285714 and parameters: {'x_0_0': 'ac', 'x_0_1': 'oo', 'x_1_0': 'ad', 'x_1_1': 'cd'}. Best is trial 63 with value: 0.5.
2024-12-06 23:37:01,090 - INFO - Candidate Mean Stats: {'Max': np.float64(2.8446795395517546), 'Min': np.float64(-1.0768296346882074), 'Mean': np.float64(0.40770809998359603), 'Std': np.float64(0.5844705863573206)}
2024-12-06 23:37:01,091 - INFO - Candidate Std Stats: {'Max': np.float64(1.9579905009947305), 'Min': np.float64(0.0), 'Mean': np.float64(0.629045328857748), 'Std': np.float64(0.32392256600355)}
[I 2024-12-06 23:37:01,104] Trial 161 finished with value: 1.375 and parameters: {'x_0_0': 'oo', 'x_0_1': 'oo', 'x_1_0': 'ac', 'x_1_1': 'ac'}. Best is trial 23 with value: 0.5.
2024-12-06 23:37:01,354 - INFO - Candidate Mean Stats: {'Max': np.float64(2.7795315877250113), 'Min': np.float64(-1.2337015906869147), 'Mean': np.float64(0.38860020253608424), 'Std': np.float64(0.5599964894279522)}
2024-12-06 23:37:01,354 - INFO - Candidate Std Stats: {'Max': np.float64(1.7844074128700322), 'Min': np.float64(0.0), 'Mean': np.float64(0.629060311882482), 'Std': np.float64(0.29246828419932314)}
2024-12-06 23:37:01,367 - INFO - Candidate Mean Stats: {'Max': np.float64(2.9864341512020274), 'Min': np.float64(-1.0403534286244605), 'Mean': np.float64(0.45342474302583374), 'Std': np.float64(0.5482579691760865)}
2024-12-06 23:37:01,367 - INFO - Candidate Std Stats: {'Max': np.float64(1.9741484349709042), 'Min': np.float64(0.0), 'Mean': np.float64(0.6315553248662279), 'Std': np.float64(0.3020161557306588)}
[I 2024-12-06 23:37:01,368] Trial 163 finished with value: 1.0714285714285714 and parameters: {'x_0_0': 'ad', 'x_0_1': 'oo', 'x_1_0': 'ad', 'x_1_1': 'bc'}. Best is trial 50 with value: 0.6607142857142857.
2024-12-06 23:37:01,370 - INFO - Candidate Mean Stats: {'Max': np.float64(2.2284733494797804), 'Min': np.float64(-0.9558497081844239), 'Mean': np.float64(0.507099783074453), 'Std': np.float64(0.4779900015228164)}
2024-12-06 23:37:01,370 - INFO - Candidate Std Stats: {'Max': np.float64(1.4957243366092514), 'Min': np.float64(0.0), 'Mean': np.float64(0.4946930203859951), 'Std': np.float64(0.25665233955594896)}
[I 2024-12-06 23:37:01,381] Trial 163 finished with value: 0.9464285714285714 and parameters: {'x_0_0': 'ad', 'x_0_1': 'oo', 'x_1_0': 'cd', 'x_1_1': 'oo'}. Best is trial 76 with value: 0.5.
[I 2024-12-06 23:37:01,383] Trial 163 finished with value: 1.2142857142857144 and parameters: {'x_0_0': 'ab', 'x_0_1': 'oo', 'x_1_0': 'bc', 'x_1_1': 'ad'}. Best is trial 63 with value: 0.5.
2024-12-06 23:37:01,466 - INFO - Candidate Mean Stats: {'Max': np.float64(2.7122541943134086), 'Min': np.float64(-1.1881013970327374), 'Mean': np.float64(0.46205627389228826), 'Std': np.float64(0.5507807424933524)}
2024-12-06 23:37:01,466 - INFO - Candidate Std Stats: {'Max': np.float64(1.850000598919677), 'Min': np.float64(0.0), 'Mean': np.float64(0.5922022808084872), 'Std': np.float64(0.2955512421707717)}
[I 2024-12-06 23:37:01,480] Trial 162 finished with value: 1.2142857142857144 and parameters: {'x_0_0': 'ab', 'x_0_1': 'oo', 'x_1_0': 'ac', 'x_1_1': 'bc'}. Best is trial 23 with value: 0.5.
2024-12-06 23:37:01,762 - INFO - Candidate Mean Stats: {'Max': np.float64(2.6646102589739002), 'Min': np.float64(-1.111153055222625), 'Mean': np.float64(0.46900150146290814), 'Std': np.float64(0.556394037903959)}
2024-12-06 23:37:01,762 - INFO - Candidate Std Stats: {'Max': np.float64(1.761645770423708), 'Min': np.float64(0.0), 'Mean': np.float64(0.5765040818210568), 'Std': np.float64(0.26850634815496277)}
[I 2024-12-06 23:37:01,774] Trial 164 finished with value: 0.8214285714285714 and parameters: {'x_0_0': 'bd', 'x_0_1': 'oo', 'x_1_0': 'oo', 'x_1_1': 'ac'}. Best is trial 50 with value: 0.6607142857142857.
2024-12-06 23:37:01,775 - INFO - Candidate Mean Stats: {'Max': np.float64(2.436777473573699), 'Min': np.float64(-0.9337404112244461), 'Mean': np.float64(0.42259749768722177), 'Std': np.float64(0.5261504286774352)}
2024-12-06 23:37:01,775 - INFO - Candidate Std Stats: {'Max': np.float64(1.667317100728606), 'Min': np.float64(0.0), 'Mean': np.float64(0.5249330450406554), 'Std': np.float64(0.2745479692175831)}
2024-12-06 23:37:01,780 - INFO - Candidate Mean Stats: {'Max': np.float64(2.8290519958400924), 'Min': np.float64(-1.179686784628954), 'Mean': np.float64(0.46130188141005474), 'Std': np.float64(0.522259276897058)}
2024-12-06 23:37:01,781 - INFO - Candidate Std Stats: {'Max': np.float64(1.5950567033527157), 'Min': np.float64(0.0), 'Mean': np.float64(0.5529560830663197), 'Std': np.float64(0.2687129268280394)}
[I 2024-12-06 23:37:01,789] Trial 164 finished with value: 0.9464285714285714 and parameters: {'x_0_0': 'bc', 'x_0_1': 'oo', 'x_1_0': 'cd', 'x_1_1': 'oo'}. Best is trial 63 with value: 0.5.
[I 2024-12-06 23:37:01,794] Trial 164 finished with value: 0.8035714285714286 and parameters: {'x_0_0': 'bd', 'x_0_1': 'oo', 'x_1_0': 'ab', 'x_1_1': 'oo'}. Best is trial 76 with value: 0.5.
2024-12-06 23:37:01,871 - INFO - Candidate Mean Stats: {'Max': np.float64(3.026071071352727), 'Min': np.float64(-1.0219406858059348), 'Mean': np.float64(0.49712919017245744), 'Std': np.float64(0.5272410037576717)}
2024-12-06 23:37:01,871 - INFO - Candidate Std Stats: {'Max': np.float64(1.7027698605171464), 'Min': np.float64(0.0), 'Mean': np.float64(0.5407767675887081), 'Std': np.float64(0.26433599654011325)}
[I 2024-12-06 23:37:01,885] Trial 163 finished with value: 1.0714285714285714 and parameters: {'x_0_0': 'bc', 'x_0_1': 'oo', 'x_1_0': 'bd', 'x_1_1': 'ad'}. Best is trial 23 with value: 0.5.
2024-12-06 23:37:02,123 - INFO - Candidate Mean Stats: {'Max': np.float64(2.694112641931832), 'Min': np.float64(-0.9649645796845929), 'Mean': np.float64(0.4247582978731114), 'Std': np.float64(0.5696291934064769)}
2024-12-06 23:37:02,123 - INFO - Candidate Std Stats: {'Max': np.float64(1.5162487191945424), 'Min': np.float64(0.0), 'Mean': np.float64(0.5565177341030635), 'Std': np.float64(0.2610560769530434)}
2024-12-06 23:37:02,133 - INFO - Candidate Mean Stats: {'Max': np.float64(2.5158409915078273), 'Min': np.float64(-1.1273026240431456), 'Mean': np.float64(0.42059418358265954), 'Std': np.float64(0.5205154964014944)}
2024-12-06 23:37:02,133 - INFO - Candidate Std Stats: {'Max': np.float64(2.1174581143803635), 'Min': np.float64(0.0), 'Mean': np.float64(0.6115349741234668), 'Std': np.float64(0.324382762062096)}
[I 2024-12-06 23:37:02,136] Trial 165 finished with value: 0.5 and parameters: {'x_0_0': 'ad', 'x_0_1': 'oo', 'x_1_0': 'bc', 'x_1_1': 'ad'}. Best is trial 165 with value: 0.5.
2024-12-06 23:37:02,138 - INFO - Candidate Mean Stats: {'Max': np.float64(3.217575543689249), 'Min': np.float64(-1.1769982984606338), 'Mean': np.float64(0.3721243314871528), 'Std': np.float64(0.5658632220382489)}
2024-12-06 23:37:02,138 - INFO - Candidate Std Stats: {'Max': np.float64(1.8712450255931832), 'Min': np.float64(0.0), 'Mean': np.float64(0.6820194544706597), 'Std': np.float64(0.34385279341757935)}
[I 2024-12-06 23:37:02,147] Trial 165 finished with value: 1.3035714285714286 and parameters: {'x_0_0': 'ad', 'x_0_1': 'bc', 'x_1_0': 'ab', 'x_1_1': 'oo'}. Best is trial 63 with value: 0.5.
[I 2024-12-06 23:37:02,152] Trial 165 finished with value: 1.5714285714285714 and parameters: {'x_0_0': 'bd', 'x_0_1': 'ad', 'x_1_0': 'cd', 'x_1_1': 'ab'}. Best is trial 76 with value: 0.5.
2024-12-06 23:37:02,232 - INFO - Candidate Mean Stats: {'Max': np.float64(2.7668454032766214), 'Min': np.float64(-1.0376440490764185), 'Mean': np.float64(0.4881183458738805), 'Std': np.float64(0.5289986691920995)}
2024-12-06 23:37:02,232 - INFO - Candidate Std Stats: {'Max': np.float64(1.6707812522286862), 'Min': np.float64(0.0), 'Mean': np.float64(0.577759667104478), 'Std': np.float64(0.28467582025878635)}
[I 2024-12-06 23:37:02,245] Trial 164 finished with value: 1.0714285714285714 and parameters: {'x_0_0': 'ad', 'x_0_1': 'oo', 'x_1_0': 'ac', 'x_1_1': 'cd'}. Best is trial 23 with value: 0.5.
2024-12-06 23:37:02,476 - INFO - Candidate Mean Stats: {'Max': np.float64(2.6202961012286607), 'Min': np.float64(-1.0445123708135324), 'Mean': np.float64(0.4277740982785339), 'Std': np.float64(0.5415215602233322)}
2024-12-06 23:37:02,476 - INFO - Candidate Std Stats: {'Max': np.float64(1.6034934202090214), 'Min': np.float64(0.0), 'Mean': np.float64(0.5697120941636414), 'Std': np.float64(0.27392660387879153)}
2024-12-06 23:37:02,488 - INFO - Candidate Mean Stats: {'Max': np.float64(2.9635622495383593), 'Min': np.float64(-1.261927466048653), 'Mean': np.float64(0.37583808076124), 'Std': np.float64(0.5707766663960705)}
2024-12-06 23:37:02,488 - INFO - Candidate Std Stats: {'Max': np.float64(1.6054015166813003), 'Min': np.float64(0.0), 'Mean': np.float64(0.6129609831047769), 'Std': np.float64(0.29067837786820333)}
[I 2024-12-06 23:37:02,489] Trial 166 finished with value: 0.8214285714285714 and parameters: {'x_0_0': 'bd', 'x_0_1': 'oo', 'x_1_0': 'oo', 'x_1_1': 'bd'}. Best is trial 165 with value: 0.5.
2024-12-06 23:37:02,490 - INFO - Candidate Mean Stats: {'Max': np.float64(3.6304208219202416), 'Min': np.float64(-1.414295957428467), 'Mean': np.float64(0.3974473296020651), 'Std': np.float64(0.6487709832659015)}
2024-12-06 23:37:02,490 - INFO - Candidate Std Stats: {'Max': np.float64(1.7658014145211103), 'Min': np.float64(0.0), 'Mean': np.float64(0.6178108532582142), 'Std': np.float64(0.2961174587451746)}
[I 2024-12-06 23:37:02,501] Trial 166 finished with value: 1.0714285714285714 and parameters: {'x_0_0': 'ac', 'x_0_1': 'oo', 'x_1_0': 'bc', 'x_1_1': 'ab'}. Best is trial 63 with value: 0.5.
[I 2024-12-06 23:37:02,504] Trial 166 finished with value: 1.0357142857142856 and parameters: {'x_0_0': 'bc', 'x_0_1': 'ac', 'x_1_0': 'oo', 'x_1_1': 'cd'}. Best is trial 76 with value: 0.5.
2024-12-06 23:37:02,593 - INFO - Candidate Mean Stats: {'Max': np.float64(3.347166905558313), 'Min': np.float64(-1.0181765126893094), 'Mean': np.float64(0.4306711105371234), 'Std': np.float64(0.5895693978571529)}
2024-12-06 23:37:02,593 - INFO - Candidate Std Stats: {'Max': np.float64(1.583048991468208), 'Min': np.float64(0.0), 'Mean': np.float64(0.6017831285283585), 'Std': np.float64(0.2862682961978269)}
[I 2024-12-06 23:37:02,605] Trial 165 finished with value: 0.9464285714285714 and parameters: {'x_0_0': 'bc', 'x_0_1': 'oo', 'x_1_0': 'cd', 'x_1_1': 'oo'}. Best is trial 23 with value: 0.5.
2024-12-06 23:37:02,840 - INFO - Candidate Mean Stats: {'Max': np.float64(2.8833836504407593), 'Min': np.float64(-1.1925440689277067), 'Mean': np.float64(0.41458098656128617), 'Std': np.float64(0.5312770639376516)}
2024-12-06 23:37:02,840 - INFO - Candidate Std Stats: {'Max': np.float64(1.5471671489241747), 'Min': np.float64(0.0), 'Mean': np.float64(0.5845180380248305), 'Std': np.float64(0.28423926858972465)}
2024-12-06 23:37:02,845 - INFO - Candidate Mean Stats: {'Max': np.float64(2.7300440586808588), 'Min': np.float64(-1.0849164839485703), 'Mean': np.float64(0.43567693669627816), 'Std': np.float64(0.5149182474251384)}
2024-12-06 23:37:02,845 - INFO - Candidate Std Stats: {'Max': np.float64(1.8423911387813718), 'Min': np.float64(0.0), 'Mean': np.float64(0.5705070647688159), 'Std': np.float64(0.2855693470825819)}
2024-12-06 23:37:02,850 - INFO - Candidate Mean Stats: {'Max': np.float64(2.9144950538383894), 'Min': np.float64(-1.0546734763648475), 'Mean': np.float64(0.4199845527790026), 'Std': np.float64(0.5548941111975377)}
2024-12-06 23:37:02,850 - INFO - Candidate Std Stats: {'Max': np.float64(1.8577943316662806), 'Min': np.float64(0.0), 'Mean': np.float64(0.5826299392851757), 'Std': np.float64(0.2817161870154914)}
[I 2024-12-06 23:37:02,854] Trial 167 finished with value: 1.0714285714285714 and parameters: {'x_0_0': 'ac', 'x_0_1': 'oo', 'x_1_0': 'ab', 'x_1_1': 'ad'}. Best is trial 165 with value: 0.5.
[I 2024-12-06 23:37:02,859] Trial 167 finished with value: 1.0714285714285714 and parameters: {'x_0_0': 'bc', 'x_0_1': 'oo', 'x_1_0': 'ac', 'x_1_1': 'bd'}. Best is trial 63 with value: 0.5.
[I 2024-12-06 23:37:02,863] Trial 167 finished with value: 0.6607142857142857 and parameters: {'x_0_0': 'bd', 'x_0_1': 'oo', 'x_1_0': 'bc', 'x_1_1': 'oo'}. Best is trial 76 with value: 0.5.
2024-12-06 23:37:02,949 - INFO - Candidate Mean Stats: {'Max': np.float64(2.72106004556595), 'Min': np.float64(-1.1260263888677333), 'Mean': np.float64(0.44899065288160406), 'Std': np.float64(0.5086232847312746)}
2024-12-06 23:37:02,949 - INFO - Candidate Std Stats: {'Max': np.float64(1.766145538710577), 'Min': np.float64(0.0), 'Mean': np.float64(0.6125010918597009), 'Std': np.float64(0.3104964409887052)}
[I 2024-12-06 23:37:02,962] Trial 166 finished with value: 1.0714285714285714 and parameters: {'x_0_0': 'ac', 'x_0_1': 'oo', 'x_1_0': 'ad', 'x_1_1': 'ab'}. Best is trial 23 with value: 0.5.
2024-12-06 23:37:03,197 - INFO - Candidate Mean Stats: {'Max': np.float64(2.6805268288759883), 'Min': np.float64(-1.0699796854754573), 'Mean': np.float64(0.5036362894938624), 'Std': np.float64(0.5510778778178909)}
2024-12-06 23:37:03,197 - INFO - Candidate Std Stats: {'Max': np.float64(1.579430827946613), 'Min': np.float64(0.0), 'Mean': np.float64(0.5515743194679298), 'Std': np.float64(0.2744290484549873)}
2024-12-06 23:37:03,202 - INFO - Candidate Mean Stats: {'Max': np.float64(2.9979990968851937), 'Min': np.float64(-0.9749205404414031), 'Mean': np.float64(0.5171256989653713), 'Std': np.float64(0.46748198654873063)}
2024-12-06 23:37:03,202 - INFO - Candidate Std Stats: {'Max': np.float64(1.7055721977656402), 'Min': np.float64(0.0), 'Mean': np.float64(0.47853209557192417), 'Std': np.float64(0.2723249285455168)}
2024-12-06 23:37:03,207 - INFO - Candidate Mean Stats: {'Max': np.float64(2.8293750037725496), 'Min': np.float64(-1.6085535948394347), 'Mean': np.float64(0.42803901856500326), 'Std': np.float64(0.5979633175454641)}
2024-12-06 23:37:03,207 - INFO - Candidate Std Stats: {'Max': np.float64(1.989627080457111), 'Min': np.float64(0.0), 'Mean': np.float64(0.6176867874912723), 'Std': np.float64(0.31037157505940416)}
[I 2024-12-06 23:37:03,211] Trial 168 finished with value: 0.5 and parameters: {'x_0_0': 'bd', 'x_0_1': 'oo', 'x_1_0': 'bc', 'x_1_1': 'ac'}. Best is trial 165 with value: 0.5.
[I 2024-12-06 23:37:03,216] Trial 168 finished with value: 0.6607142857142857 and parameters: {'x_0_0': 'ad', 'x_0_1': 'oo', 'x_1_0': 'bd', 'x_1_1': 'oo'}. Best is trial 63 with value: 0.5.
[I 2024-12-06 23:37:03,220] Trial 168 finished with value: 1.375 and parameters: {'x_0_0': 'oo', 'x_0_1': 'oo', 'x_1_0': 'ad', 'x_1_1': 'ac'}. Best is trial 76 with value: 0.5.
2024-12-06 23:37:03,309 - INFO - Candidate Mean Stats: {'Max': np.float64(3.114474385982611), 'Min': np.float64(-1.091851827423875), 'Mean': np.float64(0.48410427284755914), 'Std': np.float64(0.5487935951944665)}
2024-12-06 23:37:03,309 - INFO - Candidate Std Stats: {'Max': np.float64(1.5520539384146628), 'Min': np.float64(0.0), 'Mean': np.float64(0.6054471198448139), 'Std': np.float64(0.28882297618627334)}
[I 2024-12-06 23:37:03,321] Trial 167 finished with value: 1.0714285714285714 and parameters: {'x_0_0': 'bc', 'x_0_1': 'oo', 'x_1_0': 'bc', 'x_1_1': 'ad'}. Best is trial 23 with value: 0.5.
2024-12-06 23:37:03,550 - INFO - Candidate Mean Stats: {'Max': np.float64(2.7921519515059865), 'Min': np.float64(-1.1514045062271219), 'Mean': np.float64(0.4706275537798326), 'Std': np.float64(0.5951222899367903)}
2024-12-06 23:37:03,550 - INFO - Candidate Std Stats: {'Max': np.float64(1.395622637581258), 'Min': np.float64(0.0), 'Mean': np.float64(0.5796150833530163), 'Std': np.float64(0.2785885863710233)}
2024-12-06 23:37:03,557 - INFO - Candidate Mean Stats: {'Max': np.float64(2.5167675070098747), 'Min': np.float64(-1.0406556627834818), 'Mean': np.float64(0.41905036568698245), 'Std': np.float64(0.5095356895975856)}
2024-12-06 23:37:03,557 - INFO - Candidate Std Stats: {'Max': np.float64(1.7307409271325096), 'Min': np.float64(0.0), 'Mean': np.float64(0.5654338332050197), 'Std': np.float64(0.27455397422204253)}
2024-12-06 23:37:03,560 - INFO - Candidate Mean Stats: {'Max': np.float64(3.0702663339751846), 'Min': np.float64(-0.8680456169339343), 'Mean': np.float64(0.48780852192283614), 'Std': np.float64(0.5357860051961836)}
2024-12-06 23:37:03,560 - INFO - Candidate Std Stats: {'Max': np.float64(1.8429514143893753), 'Min': np.float64(0.0), 'Mean': np.float64(0.5371636797242643), 'Std': np.float64(0.29020892781121815)}
[I 2024-12-06 23:37:03,564] Trial 169 finished with value: 1.0357142857142856 and parameters: {'x_0_0': 'bc', 'x_0_1': 'ac', 'x_1_0': 'oo', 'x_1_1': 'ad'}. Best is trial 165 with value: 0.5.
[I 2024-12-06 23:37:03,570] Trial 169 finished with value: 1.0714285714285714 and parameters: {'x_0_0': 'ac', 'x_0_1': 'oo', 'x_1_0': 'ad', 'x_1_1': 'ad'}. Best is trial 63 with value: 0.5.
[I 2024-12-06 23:37:03,573] Trial 169 finished with value: 1.0714285714285714 and parameters: {'x_0_0': 'ac', 'x_0_1': 'oo', 'x_1_0': 'ad', 'x_1_1': 'ad'}. Best is trial 76 with value: 0.5.
2024-12-06 23:37:03,665 - INFO - Candidate Mean Stats: {'Max': np.float64(2.9101694112462346), 'Min': np.float64(-1.082005813480294), 'Mean': np.float64(0.4185055201170615), 'Std': np.float64(0.5786084920624754)}
2024-12-06 23:37:03,665 - INFO - Candidate Std Stats: {'Max': np.float64(1.7544422382914189), 'Min': np.float64(0.0), 'Mean': np.float64(0.5947780859985926), 'Std': np.float64(0.2916253277072624)}
