[I 2024-12-06 23:36:36,646] Trial 97 finished with value: 0.9464285714285714 and parameters: {'x_0_0': 'bc', 'x_0_1': 'oo', 'x_1_0': 'ab', 'x_1_1': 'oo'}. Best is trial 50 with value: 0.6607142857142857.
2024-12-06 23:36:36,862 - INFO - Candidate Mean Stats: {'Max': np.float64(2.3304663431598724), 'Min': np.float64(-1.2184945299494214), 'Mean': np.float64(0.3134326560852827), 'Std': np.float64(0.476759526882196)}
2024-12-06 23:36:36,862 - INFO - Candidate Std Stats: {'Max': np.float64(1.4079301441913412), 'Min': np.float64(0.0), 'Mean': np.float64(0.5599137322705586), 'Std': np.float64(0.23977582536003447)}
[I 2024-12-06 23:36:36,875] Trial 97 finished with value: 0.9464285714285714 and parameters: {'x_0_0': 'ac', 'x_0_1': 'oo', 'x_1_0': 'bc', 'x_1_1': 'oo'}. Best is trial 23 with value: 0.5.
2024-12-06 23:36:36,927 - INFO - Candidate Mean Stats: {'Max': np.float64(2.3934231756719493), 'Min': np.float64(-1.5445737873094232), 'Mean': np.float64(0.3387567916868275), 'Std': np.float64(0.5008056472635538)}
2024-12-06 23:36:36,928 - INFO - Candidate Std Stats: {'Max': np.float64(1.4191284149916914), 'Min': np.float64(0.0), 'Mean': np.float64(0.5592885635190408), 'Std': np.float64(0.248674074605379)}
2024-12-06 23:36:36,938 - INFO - Candidate Mean Stats: {'Max': np.float64(2.4294507551405533), 'Min': np.float64(-1.352633008264323), 'Mean': np.float64(0.30731037921928955), 'Std': np.float64(0.5651350934431851)}
2024-12-06 23:36:36,938 - INFO - Candidate Std Stats: {'Max': np.float64(1.5168178378785997), 'Min': np.float64(0.0), 'Mean': np.float64(0.5984894372072067), 'Std': np.float64(0.2726269553961464)}
[I 2024-12-06 23:36:36,941] Trial 98 finished with value: 1.0714285714285714 and parameters: {'x_0_0': 'ad', 'x_0_1': 'oo', 'x_1_0': 'ad', 'x_1_1': 'cd'}. Best is trial 63 with value: 0.5.
[I 2024-12-06 23:36:36,951] Trial 98 finished with value: 1.0714285714285714 and parameters: {'x_0_0': 'ac', 'x_0_1': 'oo', 'x_1_0': 'bc', 'x_1_1': 'ac'}. Best is trial 76 with value: 0.5.
2024-12-06 23:36:36,960 - INFO - Candidate Mean Stats: {'Max': np.float64(2.258873458224984), 'Min': np.float64(-1.1485832247478065), 'Mean': np.float64(0.363338817850766), 'Std': np.float64(0.5004445337887639)}
2024-12-06 23:36:36,960 - INFO - Candidate Std Stats: {'Max': np.float64(1.7520356002131834), 'Min': np.float64(0.0), 'Mean': np.float64(0.5813037001941724), 'Std': np.float64(0.26737581020707013)}
[I 2024-12-06 23:36:36,972] Trial 98 finished with value: 0.9464285714285714 and parameters: {'x_0_0': 'bc', 'x_0_1': 'oo', 'x_1_0': 'bc', 'x_1_1': 'oo'}. Best is trial 50 with value: 0.6607142857142857.
2024-12-06 23:36:37,190 - INFO - Candidate Mean Stats: {'Max': np.float64(2.550494790253775), 'Min': np.float64(-1.1390625096639213), 'Mean': np.float64(0.390182132027303), 'Std': np.float64(0.4982194012076354)}
2024-12-06 23:36:37,190 - INFO - Candidate Std Stats: {'Max': np.float64(1.5632403813737252), 'Min': np.float64(0.0), 'Mean': np.float64(0.5621148840536301), 'Std': np.float64(0.24817617519518362)}
[I 2024-12-06 23:36:37,203] Trial 98 finished with value: 0.7857142857142857 and parameters: {'x_0_0': 'ad', 'x_0_1': 'oo', 'x_1_0': 'bc', 'x_1_1': 'bc'}. Best is trial 23 with value: 0.5.
2024-12-06 23:36:37,257 - INFO - Candidate Mean Stats: {'Max': np.float64(2.1634438359461847), 'Min': np.float64(-1.1908959853702623), 'Mean': np.float64(0.3750370705628386), 'Std': np.float64(0.4973708250713879)}
2024-12-06 23:36:37,257 - INFO - Candidate Std Stats: {'Max': np.float64(1.5042342785317928), 'Min': np.float64(0.0), 'Mean': np.float64(0.5170755121038696), 'Std': np.float64(0.23770767992533565)}
2024-12-06 23:36:37,267 - INFO - Candidate Mean Stats: {'Max': np.float64(2.6200903325691995), 'Min': np.float64(-1.3237872095814704), 'Mean': np.float64(0.3398579027241647), 'Std': np.float64(0.5423224724865905)}
2024-12-06 23:36:37,267 - INFO - Candidate Std Stats: {'Max': np.float64(1.3691660146371563), 'Min': np.float64(0.0), 'Mean': np.float64(0.551937011009465), 'Std': np.float64(0.24613233722950895)}
[I 2024-12-06 23:36:37,270] Trial 99 finished with value: 1.0714285714285714 and parameters: {'x_0_0': 'ad', 'x_0_1': 'oo', 'x_1_0': 'cd', 'x_1_1': 'bc'}. Best is trial 63 with value: 0.5.
[I 2024-12-06 23:36:37,280] Trial 99 finished with value: 1.0714285714285714 and parameters: {'x_0_0': 'ac', 'x_0_1': 'oo', 'x_1_0': 'cd', 'x_1_1': 'ac'}. Best is trial 76 with value: 0.5.
2024-12-06 23:36:37,289 - INFO - Candidate Mean Stats: {'Max': np.float64(2.4778460965204183), 'Min': np.float64(-0.8691688136228372), 'Mean': np.float64(0.3468272202835081), 'Std': np.float64(0.4693700927119493)}
2024-12-06 23:36:37,289 - INFO - Candidate Std Stats: {'Max': np.float64(2.052139913533277), 'Min': np.float64(0.0), 'Mean': np.float64(0.5521537470078807), 'Std': np.float64(0.24811694550833005)}
[I 2024-12-06 23:36:37,301] Trial 99 finished with value: 1.4642857142857144 and parameters: {'x_0_0': 'ab', 'x_0_1': 'ac', 'x_1_0': 'oo', 'x_1_1': 'ad'}. Best is trial 50 with value: 0.6607142857142857.
2024-12-06 23:36:37,520 - INFO - Candidate Mean Stats: {'Max': np.float64(2.0346321635100866), 'Min': np.float64(-0.9949703769099673), 'Mean': np.float64(0.34885309468982223), 'Std': np.float64(0.4606711574148709)}
2024-12-06 23:36:37,520 - INFO - Candidate Std Stats: {'Max': np.float64(1.7974319377855108), 'Min': np.float64(0.0), 'Mean': np.float64(0.6125488572919018), 'Std': np.float64(0.2826184267388461)}
[I 2024-12-06 23:36:37,533] Trial 99 finished with value: 0.6607142857142857 and parameters: {'x_0_0': 'bd', 'x_0_1': 'oo', 'x_1_0': 'bd', 'x_1_1': 'oo'}. Best is trial 23 with value: 0.5.
2024-12-06 23:36:37,589 - INFO - Candidate Mean Stats: {'Max': np.float64(2.0), 'Min': np.float64(-0.8628370958556891), 'Mean': np.float64(0.34038900021602747), 'Std': np.float64(0.4677230824263678)}
2024-12-06 23:36:37,589 - INFO - Candidate Std Stats: {'Max': np.float64(1.563767063721291), 'Min': np.float64(0.0), 'Mean': np.float64(0.5459687719442718), 'Std': np.float64(0.24454415209237554)}
2024-12-06 23:36:37,596 - INFO - Candidate Mean Stats: {'Max': np.float64(2.676968391550491), 'Min': np.float64(-1.6423823444172903), 'Mean': np.float64(0.34868479910485184), 'Std': np.float64(0.54391018231482)}
2024-12-06 23:36:37,596 - INFO - Candidate Std Stats: {'Max': np.float64(1.8142079693127893), 'Min': np.float64(0.0), 'Mean': np.float64(0.6095517969245294), 'Std': np.float64(0.28156337917557805)}
[I 2024-12-06 23:36:37,602] Trial 100 finished with value: 1.0714285714285714 and parameters: {'x_0_0': 'bd', 'x_0_1': 'oo', 'x_1_0': 'ad', 'x_1_1': 'bd'}. Best is trial 63 with value: 0.5.
[I 2024-12-06 23:36:37,609] Trial 100 finished with value: 0.8214285714285714 and parameters: {'x_0_0': 'bd', 'x_0_1': 'oo', 'x_1_0': 'oo', 'x_1_1': 'bd'}. Best is trial 76 with value: 0.5.
2024-12-06 23:36:37,620 - INFO - Candidate Mean Stats: {'Max': np.float64(2.39832449853288), 'Min': np.float64(-0.9618543641425326), 'Mean': np.float64(0.2371678943927894), 'Std': np.float64(0.4840464704468577)}
2024-12-06 23:36:37,621 - INFO - Candidate Std Stats: {'Max': np.float64(1.4972178006918206), 'Min': np.float64(0.0), 'Mean': np.float64(0.592293990045045), 'Std': np.float64(0.2526947955000364)}
[I 2024-12-06 23:36:37,633] Trial 100 finished with value: 1.0714285714285714 and parameters: {'x_0_0': 'bc', 'x_0_1': 'oo', 'x_1_0': 'ac', 'x_1_1': 'ab'}. Best is trial 50 with value: 0.6607142857142857.
2024-12-06 23:36:37,864 - INFO - Candidate Mean Stats: {'Max': np.float64(2.332618274645048), 'Min': np.float64(-0.9125233537514678), 'Mean': np.float64(0.41009635504296693), 'Std': np.float64(0.47217006944306145)}
2024-12-06 23:36:37,864 - INFO - Candidate Std Stats: {'Max': np.float64(1.509303545883928), 'Min': np.float64(0.0), 'Mean': np.float64(0.54680723916789), 'Std': np.float64(0.24122627937419847)}
[I 2024-12-06 23:36:37,879] Trial 100 finished with value: 1.1607142857142856 and parameters: {'x_0_0': 'ac', 'x_0_1': 'ac', 'x_1_0': 'ab', 'x_1_1': 'oo'}. Best is trial 23 with value: 0.5.
2024-12-06 23:36:37,932 - INFO - Candidate Mean Stats: {'Max': np.float64(2.0910839443522917), 'Min': np.float64(-1.1474611914776383), 'Mean': np.float64(0.37340479967193374), 'Std': np.float64(0.4925018823283477)}
2024-12-06 23:36:37,932 - INFO - Candidate Std Stats: {'Max': np.float64(1.609761679655244), 'Min': np.float64(0.0), 'Mean': np.float64(0.6062909101559156), 'Std': np.float64(0.2648923157360673)}
[I 2024-12-06 23:36:37,944] Trial 101 finished with value: 1.0714285714285714 and parameters: {'x_0_0': 'ac', 'x_0_1': 'oo', 'x_1_0': 'cd', 'x_1_1': 'ac'}. Best is trial 63 with value: 0.5.
2024-12-06 23:36:37,945 - INFO - Candidate Mean Stats: {'Max': np.float64(2.3698967126440076), 'Min': np.float64(-1.3108334885993176), 'Mean': np.float64(0.3472131373970586), 'Std': np.float64(0.522215075329136)}
2024-12-06 23:36:37,945 - INFO - Candidate Std Stats: {'Max': np.float64(1.6281773504607466), 'Min': np.float64(0.0), 'Mean': np.float64(0.6055547411424457), 'Std': np.float64(0.2712533710212027)}
[I 2024-12-06 23:36:37,957] Trial 101 finished with value: 0.6964285714285714 and parameters: {'x_0_0': 'bd', 'x_0_1': 'oo', 'x_1_0': 'oo', 'x_1_1': 'oo'}. Best is trial 76 with value: 0.5.
2024-12-06 23:36:37,963 - INFO - Candidate Mean Stats: {'Max': np.float64(2.4077153751566582), 'Min': np.float64(-0.9789667179894963), 'Mean': np.float64(0.3664887558718439), 'Std': np.float64(0.49282799042291103)}
2024-12-06 23:36:37,963 - INFO - Candidate Std Stats: {'Max': np.float64(1.7197637452086865), 'Min': np.float64(0.0), 'Mean': np.float64(0.5676786425571612), 'Std': np.float64(0.2667402343762681)}
[I 2024-12-06 23:36:37,975] Trial 101 finished with value: 0.7857142857142857 and parameters: {'x_0_0': 'ad', 'x_0_1': 'oo', 'x_1_0': 'bc', 'x_1_1': 'bc'}. Best is trial 50 with value: 0.6607142857142857.
2024-12-06 23:36:38,199 - INFO - Candidate Mean Stats: {'Max': np.float64(2.3751933770617817), 'Min': np.float64(-1.2629969296662038), 'Mean': np.float64(0.327177047869485), 'Std': np.float64(0.49226051112024344)}
2024-12-06 23:36:38,199 - INFO - Candidate Std Stats: {'Max': np.float64(1.8660374781063427), 'Min': np.float64(0.0), 'Mean': np.float64(0.5974540149574837), 'Std': np.float64(0.272183321159184)}
[I 2024-12-06 23:36:38,212] Trial 101 finished with value: 0.8035714285714286 and parameters: {'x_0_0': 'bd', 'x_0_1': 'oo', 'x_1_0': 'ab', 'x_1_1': 'oo'}. Best is trial 23 with value: 0.5.
2024-12-06 23:36:38,264 - INFO - Candidate Mean Stats: {'Max': np.float64(2.0346122962730293), 'Min': np.float64(-0.9253867999168666), 'Mean': np.float64(0.37535487131473344), 'Std': np.float64(0.45529983613838915)}
2024-12-06 23:36:38,264 - INFO - Candidate Std Stats: {'Max': np.float64(1.5344538529277134), 'Min': np.float64(0.0), 'Mean': np.float64(0.5586678793806383), 'Std': np.float64(0.25012671332526787)}
2024-12-06 23:36:38,274 - INFO - Candidate Mean Stats: {'Max': np.float64(2.412201341635614), 'Min': np.float64(-1.1011046977541201), 'Mean': np.float64(0.3200488771627394), 'Std': np.float64(0.5367177302441072)}
2024-12-06 23:36:38,274 - INFO - Candidate Std Stats: {'Max': np.float64(1.4691984561393638), 'Min': np.float64(0.0), 'Mean': np.float64(0.6044422556405765), 'Std': np.float64(0.2632380620917072)}
[I 2024-12-06 23:36:38,279] Trial 102 finished with value: 1.0714285714285714 and parameters: {'x_0_0': 'bd', 'x_0_1': 'oo', 'x_1_0': 'ac', 'x_1_1': 'cd'}. Best is trial 63 with value: 0.5.
[I 2024-12-06 23:36:38,286] Trial 102 finished with value: 1.0 and parameters: {'x_0_0': 'ac', 'x_0_1': 'ad', 'x_1_0': 'ab', 'x_1_1': 'bd'}. Best is trial 76 with value: 0.5.
2024-12-06 23:36:38,290 - INFO - Candidate Mean Stats: {'Max': np.float64(2.924416767947083), 'Min': np.float64(-1.2824006228366591), 'Mean': np.float64(0.3316444904593284), 'Std': np.float64(0.5310746815047594)}
2024-12-06 23:36:38,290 - INFO - Candidate Std Stats: {'Max': np.float64(1.7568922590646072), 'Min': np.float64(0.0), 'Mean': np.float64(0.5926205021059472), 'Std': np.float64(0.2792988262016047)}
[I 2024-12-06 23:36:38,303] Trial 102 finished with value: 1.5 and parameters: {'x_0_0': 'cd', 'x_0_1': 'oo', 'x_1_0': 'cd', 'x_1_1': 'bc'}. Best is trial 50 with value: 0.6607142857142857.
2024-12-06 23:36:38,528 - INFO - Candidate Mean Stats: {'Max': np.float64(2.7124952410385887), 'Min': np.float64(-0.9828125221050212), 'Mean': np.float64(0.35191367529560236), 'Std': np.float64(0.46914823746206047)}
2024-12-06 23:36:38,528 - INFO - Candidate Std Stats: {'Max': np.float64(1.5070606340562758), 'Min': np.float64(0.0), 'Mean': np.float64(0.5186356907511366), 'Std': np.float64(0.24288370216424976)}
[I 2024-12-06 23:36:38,541] Trial 102 finished with value: 0.9285714285714286 and parameters: {'x_0_0': 'bd', 'x_0_1': 'oo', 'x_1_0': 'ab', 'x_1_1': 'cd'}. Best is trial 23 with value: 0.5.
2024-12-06 23:36:38,597 - INFO - Candidate Mean Stats: {'Max': np.float64(2.0057444823418225), 'Min': np.float64(-0.8790452339873532), 'Mean': np.float64(0.36928247043918466), 'Std': np.float64(0.48946647822486505)}
2024-12-06 23:36:38,597 - INFO - Candidate Std Stats: {'Max': np.float64(1.3499445764535003), 'Min': np.float64(0.0), 'Mean': np.float64(0.5457985303855942), 'Std': np.float64(0.24308985605185643)}
2024-12-06 23:36:38,600 - INFO - Candidate Mean Stats: {'Max': np.float64(2.605474633531807), 'Min': np.float64(-0.9067864376143145), 'Mean': np.float64(0.3154158991732761), 'Std': np.float64(0.55344719763897)}
2024-12-06 23:36:38,600 - INFO - Candidate Std Stats: {'Max': np.float64(1.4410644986471586), 'Min': np.float64(0.0), 'Mean': np.float64(0.5783769587236905), 'Std': np.float64(0.25266415710944534)}
[I 2024-12-06 23:36:38,610] Trial 103 finished with value: 1.0714285714285714 and parameters: {'x_0_0': 'bc', 'x_0_1': 'oo', 'x_1_0': 'ad', 'x_1_1': 'bc'}. Best is trial 63 with value: 0.5.
[I 2024-12-06 23:36:38,613] Trial 103 finished with value: 1.625 and parameters: {'x_0_0': 'cd', 'x_0_1': 'bc', 'x_1_0': 'oo', 'x_1_1': 'oo'}. Best is trial 76 with value: 0.5.
2024-12-06 23:36:38,618 - INFO - Candidate Mean Stats: {'Max': np.float64(2.306465908298224), 'Min': np.float64(-1.016929631995017), 'Mean': np.float64(0.3889575718167172), 'Std': np.float64(0.5046933105501801)}
2024-12-06 23:36:38,618 - INFO - Candidate Std Stats: {'Max': np.float64(1.4639750753920908), 'Min': np.float64(0.0), 'Mean': np.float64(0.5561219864126438), 'Std': np.float64(0.24409311099810235)}
[I 2024-12-06 23:36:38,630] Trial 103 finished with value: 0.8214285714285714 and parameters: {'x_0_0': 'ad', 'x_0_1': 'oo', 'x_1_0': 'oo', 'x_1_1': 'ad'}. Best is trial 50 with value: 0.6607142857142857.
2024-12-06 23:36:38,863 - INFO - Candidate Mean Stats: {'Max': np.float64(2.436665436366013), 'Min': np.float64(-1.1724098092383466), 'Mean': np.float64(0.40977958468077835), 'Std': np.float64(0.47909026101514607)}
2024-12-06 23:36:38,863 - INFO - Candidate Std Stats: {'Max': np.float64(1.5966705382355197), 'Min': np.float64(0.0), 'Mean': np.float64(0.48508924317332397), 'Std': np.float64(0.21718562039713746)}
[I 2024-12-06 23:36:38,876] Trial 103 finished with value: 0.9464285714285714 and parameters: {'x_0_0': 'bc', 'x_0_1': 'oo', 'x_1_0': 'ac', 'x_1_1': 'oo'}. Best is trial 23 with value: 0.5.
2024-12-06 23:36:38,935 - INFO - Candidate Mean Stats: {'Max': np.float64(2.9553354802595893), 'Min': np.float64(-1.139286743581919), 'Mean': np.float64(0.394728889318482), 'Std': np.float64(0.5114367783014667)}
2024-12-06 23:36:38,935 - INFO - Candidate Std Stats: {'Max': np.float64(1.423243636796513), 'Min': np.float64(0.0), 'Mean': np.float64(0.5568228497307502), 'Std': np.float64(0.24933433738384148)}
[I 2024-12-06 23:36:38,948] Trial 104 finished with value: 1.0714285714285714 and parameters: {'x_0_0': 'ad', 'x_0_1': 'oo', 'x_1_0': 'ad', 'x_1_1': 'ac'}. Best is trial 76 with value: 0.5.
2024-12-06 23:36:38,948 - INFO - Candidate Mean Stats: {'Max': np.float64(2.53740722960426), 'Min': np.float64(-0.9951318210172093), 'Mean': np.float64(0.29563336716579436), 'Std': np.float64(0.5101840892786981)}
2024-12-06 23:36:38,948 - INFO - Candidate Std Stats: {'Max': np.float64(1.81155834808763), 'Min': np.float64(0.0), 'Mean': np.float64(0.6118743215007681), 'Std': np.float64(0.27941926134831924)}
[I 2024-12-06 23:36:38,960] Trial 104 finished with value: 0.9464285714285714 and parameters: {'x_0_0': 'ad', 'x_0_1': 'oo', 'x_1_0': 'ac', 'x_1_1': 'oo'}. Best is trial 63 with value: 0.5.
2024-12-06 23:36:38,968 - INFO - Candidate Mean Stats: {'Max': np.float64(2.532559514458253), 'Min': np.float64(-1.351748151994554), 'Mean': np.float64(0.2735041804056431), 'Std': np.float64(0.5562334825904726)}
2024-12-06 23:36:38,968 - INFO - Candidate Std Stats: {'Max': np.float64(1.6238840377043706), 'Min': np.float64(0.0), 'Mean': np.float64(0.6749774087270661), 'Std': np.float64(0.2851586921363609)}
[I 2024-12-06 23:36:38,981] Trial 104 finished with value: 0.6964285714285714 and parameters: {'x_0_0': 'ac', 'x_0_1': 'oo', 'x_1_0': 'oo', 'x_1_1': 'oo'}. Best is trial 50 with value: 0.6607142857142857.
2024-12-06 23:36:39,193 - INFO - Candidate Mean Stats: {'Max': np.float64(2.0), 'Min': np.float64(-1.2006880802035582), 'Mean': np.float64(0.2757263917951902), 'Std': np.float64(0.5096239753612397)}
2024-12-06 23:36:39,193 - INFO - Candidate Std Stats: {'Max': np.float64(1.7411365836792057), 'Min': np.float64(0.0), 'Mean': np.float64(0.5864592369965401), 'Std': np.float64(0.2660104366977261)}
[I 2024-12-06 23:36:39,206] Trial 104 finished with value: 0.9464285714285714 and parameters: {'x_0_0': 'ad', 'x_0_1': 'oo', 'x_1_0': 'ad', 'x_1_1': 'oo'}. Best is trial 23 with value: 0.5.
2024-12-06 23:36:39,263 - INFO - Candidate Mean Stats: {'Max': np.float64(2.551909883418397), 'Min': np.float64(-1.2672943421584724), 'Mean': np.float64(0.32452344623437757), 'Std': np.float64(0.5187449735915463)}
2024-12-06 23:36:39,263 - INFO - Candidate Std Stats: {'Max': np.float64(1.6395623762565115), 'Min': np.float64(0.0), 'Mean': np.float64(0.6060079778550914), 'Std': np.float64(0.27138230141169495)}
[I 2024-12-06 23:36:39,276] Trial 105 finished with value: 1.0714285714285714 and parameters: {'x_0_0': 'bc', 'x_0_1': 'oo', 'x_1_0': 'bc', 'x_1_1': 'bc'}. Best is trial 76 with value: 0.5.
2024-12-06 23:36:39,279 - INFO - Candidate Mean Stats: {'Max': np.float64(2.1889352209777924), 'Min': np.float64(-1.2047332484506208), 'Mean': np.float64(0.2913242259879742), 'Std': np.float64(0.5253216743749083)}
2024-12-06 23:36:39,279 - INFO - Candidate Std Stats: {'Max': np.float64(1.812814738419421), 'Min': np.float64(0.0), 'Mean': np.float64(0.6703213267788213), 'Std': np.float64(0.30793349853630675)}
[I 2024-12-06 23:36:39,291] Trial 105 finished with value: 0.7857142857142857 and parameters: {'x_0_0': 'ad', 'x_0_1': 'oo', 'x_1_0': 'bc', 'x_1_1': 'bc'}. Best is trial 63 with value: 0.5.
2024-12-06 23:36:39,296 - INFO - Candidate Mean Stats: {'Max': np.float64(2.481706232673194), 'Min': np.float64(-0.8161418371731155), 'Mean': np.float64(0.3591474915730145), 'Std': np.float64(0.5064187029871451)}
2024-12-06 23:36:39,296 - INFO - Candidate Std Stats: {'Max': np.float64(1.3691650381795706), 'Min': np.float64(0.0), 'Mean': np.float64(0.5472671963880721), 'Std': np.float64(0.23347233494749065)}
[I 2024-12-06 23:36:39,309] Trial 105 finished with value: 0.9464285714285714 and parameters: {'x_0_0': 'bd', 'x_0_1': 'oo', 'x_1_0': 'ad', 'x_1_1': 'oo'}. Best is trial 50 with value: 0.6607142857142857.
2024-12-06 23:36:39,559 - INFO - Candidate Mean Stats: {'Max': np.float64(2.3967868591055796), 'Min': np.float64(-0.7135218209137424), 'Mean': np.float64(0.44703470921175104), 'Std': np.float64(0.4271627281691646)}
2024-12-06 23:36:39,559 - INFO - Candidate Std Stats: {'Max': np.float64(1.4965598840351984), 'Min': np.float64(0.0), 'Mean': np.float64(0.4986909888465611), 'Std': np.float64(0.24397488128712827)}
[I 2024-12-06 23:36:39,572] Trial 105 finished with value: 0.6964285714285714 and parameters: {'x_0_0': 'ad', 'x_0_1': 'oo', 'x_1_0': 'oo', 'x_1_1': 'oo'}. Best is trial 23 with value: 0.5.
2024-12-06 23:36:39,626 - INFO - Candidate Mean Stats: {'Max': np.float64(2.311000788817764), 'Min': np.float64(-1.1276368380941038), 'Mean': np.float64(0.3316804392884567), 'Std': np.float64(0.5275096005671988)}
2024-12-06 23:36:39,626 - INFO - Candidate Std Stats: {'Max': np.float64(1.774262717153915), 'Min': np.float64(0.0), 'Mean': np.float64(0.6380884076895036), 'Std': np.float64(0.28277194207841294)}
[I 2024-12-06 23:36:39,639] Trial 106 finished with value: 1.0714285714285714 and parameters: {'x_0_0': 'bd', 'x_0_1': 'oo', 'x_1_0': 'ad', 'x_1_1': 'cd'}. Best is trial 76 with value: 0.5.
2024-12-06 23:36:39,641 - INFO - Candidate Mean Stats: {'Max': np.float64(2.776662378565513), 'Min': np.float64(-1.2019930134822097), 'Mean': np.float64(0.41022381481592834), 'Std': np.float64(0.5138583776857437)}
2024-12-06 23:36:39,641 - INFO - Candidate Std Stats: {'Max': np.float64(1.5667953945916593), 'Min': np.float64(0.0), 'Mean': np.float64(0.58715019502668), 'Std': np.float64(0.2568548152025035)}
[I 2024-12-06 23:36:39,654] Trial 106 finished with value: 1.0714285714285714 and parameters: {'x_0_0': 'ad', 'x_0_1': 'oo', 'x_1_0': 'ac', 'x_1_1': 'bc'}. Best is trial 63 with value: 0.5.
2024-12-06 23:36:39,659 - INFO - Candidate Mean Stats: {'Max': np.float64(2.2745082319741248), 'Min': np.float64(-0.8227887758371445), 'Mean': np.float64(0.4288229346316368), 'Std': np.float64(0.45527566294132416)}
2024-12-06 23:36:39,659 - INFO - Candidate Std Stats: {'Max': np.float64(1.714336128808646), 'Min': np.float64(0.0), 'Mean': np.float64(0.5510993307768575), 'Std': np.float64(0.26538448802562065)}
