[I 2024-12-06 23:38:31,765] Trial 404 finished with value: 1.25 and parameters: {'x_0_0': 'oo', 'x_0_1': 'oo', 'x_1_0': 'cd', 'x_1_1': 'oo'}. Best is trial 165 with value: 0.5.
2024-12-06 23:38:31,801 - INFO - Candidate Mean Stats: {'Max': np.float64(2.8509275014046063), 'Min': np.float64(-0.39450472289764177), 'Mean': np.float64(0.7699525199662525), 'Std': np.float64(0.5097658654148067)}
2024-12-06 23:38:31,801 - INFO - Candidate Std Stats: {'Max': np.float64(1.5648005615050828), 'Min': np.float64(0.0), 'Mean': np.float64(0.46829146092204155), 'Std': np.float64(0.29822969956011436)}
[I 2024-12-06 23:38:31,815] Trial 404 finished with value: 1.4285714285714286 and parameters: {'x_0_0': 'ac', 'x_0_1': 'ab', 'x_1_0': 'cd', 'x_1_1': 'bd'}. Best is trial 63 with value: 0.5.
2024-12-06 23:38:31,843 - INFO - Candidate Mean Stats: {'Max': np.float64(3.247003806585056), 'Min': np.float64(-0.34706555478594003), 'Mean': np.float64(0.7885403755489245), 'Std': np.float64(0.46330821770245334)}
2024-12-06 23:38:31,843 - INFO - Candidate Std Stats: {'Max': np.float64(1.566910824996847), 'Min': np.float64(0.0), 'Mean': np.float64(0.4179339126071945), 'Std': np.float64(0.265727976428686)}
[I 2024-12-06 23:38:31,857] Trial 402 finished with value: 1.2142857142857144 and parameters: {'x_0_0': 'ab', 'x_0_1': 'oo', 'x_1_0': 'bc', 'x_1_1': 'ad'}. Best is trial 23 with value: 0.5.
2024-12-06 23:38:32,072 - INFO - Candidate Mean Stats: {'Max': np.float64(3.6723036569186562), 'Min': np.float64(-0.45455595837004115), 'Mean': np.float64(0.7794046963277719), 'Std': np.float64(0.5083473803930295)}
2024-12-06 23:38:32,072 - INFO - Candidate Std Stats: {'Max': np.float64(1.5227459625654702), 'Min': np.float64(0.0), 'Mean': np.float64(0.4089508973281193), 'Std': np.float64(0.2660695850971684)}
[I 2024-12-06 23:38:32,086] Trial 405 finished with value: 1.3214285714285714 and parameters: {'x_0_0': 'bd', 'x_0_1': 'ad', 'x_1_0': 'oo', 'x_1_1': 'ab'}. Best is trial 76 with value: 0.5.
2024-12-06 23:38:32,139 - INFO - Candidate Mean Stats: {'Max': np.float64(3.1107387335434984), 'Min': np.float64(-0.6016085418787144), 'Mean': np.float64(0.7152251030666915), 'Std': np.float64(0.5587700711491356)}
2024-12-06 23:38:32,139 - INFO - Candidate Std Stats: {'Max': np.float64(1.7142162579451872), 'Min': np.float64(0.0), 'Mean': np.float64(0.5509038544427199), 'Std': np.float64(0.33884370319941143)}
[I 2024-12-06 23:38:32,153] Trial 405 finished with value: 1.1964285714285714 and parameters: {'x_0_0': 'bd', 'x_0_1': 'ad', 'x_1_0': 'oo', 'x_1_1': 'oo'}. Best is trial 165 with value: 0.5.
2024-12-06 23:38:32,188 - INFO - Candidate Mean Stats: {'Max': np.float64(3.0325743166458836), 'Min': np.float64(-0.6104588481944251), 'Mean': np.float64(0.8278951249290173), 'Std': np.float64(0.4676529276784456)}
2024-12-06 23:38:32,188 - INFO - Candidate Std Stats: {'Max': np.float64(1.6678182572796747), 'Min': np.float64(0.0), 'Mean': np.float64(0.38004812904392776), 'Std': np.float64(0.2570167610697782)}
[I 2024-12-06 23:38:32,203] Trial 405 finished with value: 1.4464285714285714 and parameters: {'x_0_0': 'ac', 'x_0_1': 'cd', 'x_1_0': 'ad', 'x_1_1': 'oo'}. Best is trial 63 with value: 0.5.
2024-12-06 23:38:32,232 - INFO - Candidate Mean Stats: {'Max': np.float64(3.145848473550842), 'Min': np.float64(-0.41558136264592027), 'Mean': np.float64(0.8020592316670581), 'Std': np.float64(0.4830358298415859)}
2024-12-06 23:38:32,232 - INFO - Candidate Std Stats: {'Max': np.float64(1.5070466666065334), 'Min': np.float64(0.0), 'Mean': np.float64(0.4526926481960201), 'Std': np.float64(0.28523715957672613)}
[I 2024-12-06 23:38:32,247] Trial 403 finished with value: 1.375 and parameters: {'x_0_0': 'oo', 'x_0_1': 'oo', 'x_1_0': 'cd', 'x_1_1': 'ac'}. Best is trial 23 with value: 0.5.
2024-12-06 23:38:32,460 - INFO - Candidate Mean Stats: {'Max': np.float64(2.968217925731671), 'Min': np.float64(-0.581643694594107), 'Mean': np.float64(0.7652847340209871), 'Std': np.float64(0.5528242107821117)}
2024-12-06 23:38:32,460 - INFO - Candidate Std Stats: {'Max': np.float64(2.081530848948368), 'Min': np.float64(0.0), 'Mean': np.float64(0.5006253859736973), 'Std': np.float64(0.3116354184923665)}
[I 2024-12-06 23:38:32,475] Trial 406 finished with value: 1.2857142857142856 and parameters: {'x_0_0': 'ac', 'x_0_1': 'ac', 'x_1_0': 'ac', 'x_1_1': 'cd'}. Best is trial 76 with value: 0.5.
2024-12-06 23:38:32,527 - INFO - Candidate Mean Stats: {'Max': np.float64(2.903409003372694), 'Min': np.float64(-0.7834515590005127), 'Mean': np.float64(0.7128157483833684), 'Std': np.float64(0.5866959026142634)}
2024-12-06 23:38:32,527 - INFO - Candidate Std Stats: {'Max': np.float64(1.753368169950115), 'Min': np.float64(0.0), 'Mean': np.float64(0.5016391491089779), 'Std': np.float64(0.3130099630530193)}
[I 2024-12-06 23:38:32,542] Trial 406 finished with value: 0.9107142857142857 and parameters: {'x_0_0': 'bc', 'x_0_1': 'ad', 'x_1_0': 'oo', 'x_1_1': 'oo'}. Best is trial 165 with value: 0.5.
2024-12-06 23:38:32,578 - INFO - Candidate Mean Stats: {'Max': np.float64(2.705841977052964), 'Min': np.float64(-0.8274784129054445), 'Mean': np.float64(0.7251228445210274), 'Std': np.float64(0.5718867027692938)}
2024-12-06 23:38:32,578 - INFO - Candidate Std Stats: {'Max': np.float64(1.9224691847898072), 'Min': np.float64(0.0), 'Mean': np.float64(0.4971665390816861), 'Std': np.float64(0.3175869561701901)}
[I 2024-12-06 23:38:32,592] Trial 406 finished with value: 1.5714285714285714 and parameters: {'x_0_0': 'bc', 'x_0_1': 'cd', 'x_1_0': 'ab', 'x_1_1': 'cd'}. Best is trial 63 with value: 0.5.
2024-12-06 23:38:32,624 - INFO - Candidate Mean Stats: {'Max': np.float64(2.635922040380462), 'Min': np.float64(-0.7046906793508587), 'Mean': np.float64(0.7713029418968662), 'Std': np.float64(0.5312656529451873)}
2024-12-06 23:38:32,624 - INFO - Candidate Std Stats: {'Max': np.float64(1.3359285468476194), 'Min': np.float64(0.0), 'Mean': np.float64(0.43823760275718665), 'Std': np.float64(0.2716277639451432)}
[I 2024-12-06 23:38:32,638] Trial 404 finished with value: 1.0357142857142856 and parameters: {'x_0_0': 'bc', 'x_0_1': 'ac', 'x_1_0': 'oo', 'x_1_1': 'ab'}. Best is trial 23 with value: 0.5.
2024-12-06 23:38:32,849 - INFO - Candidate Mean Stats: {'Max': np.float64(2.898879691328524), 'Min': np.float64(-0.6391690283422553), 'Mean': np.float64(0.7548997362435386), 'Std': np.float64(0.5299002200525932)}
2024-12-06 23:38:32,849 - INFO - Candidate Std Stats: {'Max': np.float64(1.6912109439387872), 'Min': np.float64(0.0), 'Mean': np.float64(0.5050989049889147), 'Std': np.float64(0.31321565609755175)}
[I 2024-12-06 23:38:32,864] Trial 407 finished with value: 1.1428571428571428 and parameters: {'x_0_0': 'ac', 'x_0_1': 'ad', 'x_1_0': 'bd', 'x_1_1': 'ab'}. Best is trial 76 with value: 0.5.
2024-12-06 23:38:32,916 - INFO - Candidate Mean Stats: {'Max': np.float64(3.091704653292224), 'Min': np.float64(-0.9361930427285319), 'Mean': np.float64(0.6645861701328363), 'Std': np.float64(0.5791713268640171)}
2024-12-06 23:38:32,916 - INFO - Candidate Std Stats: {'Max': np.float64(1.6634277624892548), 'Min': np.float64(0.0), 'Mean': np.float64(0.5175600168206406), 'Std': np.float64(0.3157401706914446)}
[I 2024-12-06 23:38:32,931] Trial 407 finished with value: 1.4464285714285714 and parameters: {'x_0_0': 'ad', 'x_0_1': 'bd', 'x_1_0': 'cd', 'x_1_1': 'oo'}. Best is trial 165 with value: 0.5.
2024-12-06 23:38:32,967 - INFO - Candidate Mean Stats: {'Max': np.float64(2.658140121064058), 'Min': np.float64(-0.8332857323244965), 'Mean': np.float64(0.7244435313022081), 'Std': np.float64(0.5681061255947879)}
2024-12-06 23:38:32,967 - INFO - Candidate Std Stats: {'Max': np.float64(1.7440097994233739), 'Min': np.float64(0.0), 'Mean': np.float64(0.5080538225700342), 'Std': np.float64(0.3211994050739893)}
[I 2024-12-06 23:38:32,982] Trial 407 finished with value: 1.1964285714285714 and parameters: {'x_0_0': 'ad', 'x_0_1': 'bd', 'x_1_0': 'oo', 'x_1_1': 'oo'}. Best is trial 63 with value: 0.5.
2024-12-06 23:38:33,016 - INFO - Candidate Mean Stats: {'Max': np.float64(2.6874804656352085), 'Min': np.float64(-0.44657535731757403), 'Mean': np.float64(0.8136863103637306), 'Std': np.float64(0.49802203120535127)}
2024-12-06 23:38:33,016 - INFO - Candidate Std Stats: {'Max': np.float64(1.1756103994496099), 'Min': np.float64(0.0), 'Mean': np.float64(0.412476619604794), 'Std': np.float64(0.25485021343692016)}
[I 2024-12-06 23:38:33,030] Trial 405 finished with value: 1.375 and parameters: {'x_0_0': 'oo', 'x_0_1': 'oo', 'x_1_0': 'bc', 'x_1_1': 'bc'}. Best is trial 23 with value: 0.5.
2024-12-06 23:38:33,236 - INFO - Candidate Mean Stats: {'Max': np.float64(3.455314214709195), 'Min': np.float64(-0.5370602558337036), 'Mean': np.float64(0.7500890455162039), 'Std': np.float64(0.5459745311477952)}
2024-12-06 23:38:33,236 - INFO - Candidate Std Stats: {'Max': np.float64(1.528874108744649), 'Min': np.float64(0.0), 'Mean': np.float64(0.4707405083734911), 'Std': np.float64(0.30139915756457564)}
[I 2024-12-06 23:38:33,251] Trial 408 finished with value: 1.1964285714285714 and parameters: {'x_0_0': 'bd', 'x_0_1': 'ad', 'x_1_0': 'oo', 'x_1_1': 'oo'}. Best is trial 76 with value: 0.5.
2024-12-06 23:38:33,305 - INFO - Candidate Mean Stats: {'Max': np.float64(2.8128651853166384), 'Min': np.float64(-0.8960320572691114), 'Mean': np.float64(0.6377329069307052), 'Std': np.float64(0.6299000519959751)}
2024-12-06 23:38:33,305 - INFO - Candidate Std Stats: {'Max': np.float64(1.6793117214938378), 'Min': np.float64(0.0), 'Mean': np.float64(0.551259154401741), 'Std': np.float64(0.3440245802865072)}
[I 2024-12-06 23:38:33,319] Trial 408 finished with value: 1.5714285714285714 and parameters: {'x_0_0': 'bc', 'x_0_1': 'cd', 'x_1_0': 'bc', 'x_1_1': 'cd'}. Best is trial 165 with value: 0.5.
2024-12-06 23:38:33,354 - INFO - Candidate Mean Stats: {'Max': np.float64(3.012756519167291), 'Min': np.float64(-0.6391482958659058), 'Mean': np.float64(0.760175836838567), 'Std': np.float64(0.5112269350120465)}
2024-12-06 23:38:33,354 - INFO - Candidate Std Stats: {'Max': np.float64(1.5456194015601221), 'Min': np.float64(0.0), 'Mean': np.float64(0.4759381107685907), 'Std': np.float64(0.30352911731046245)}
[I 2024-12-06 23:38:33,369] Trial 408 finished with value: 1.4464285714285714 and parameters: {'x_0_0': 'bc', 'x_0_1': 'bd', 'x_1_0': 'bc', 'x_1_1': 'oo'}. Best is trial 63 with value: 0.5.
2024-12-06 23:38:33,405 - INFO - Candidate Mean Stats: {'Max': np.float64(3.0518245747212496), 'Min': np.float64(-0.4928808252328376), 'Mean': np.float64(0.7779556852580238), 'Std': np.float64(0.4932620742309576)}
2024-12-06 23:38:33,405 - INFO - Candidate Std Stats: {'Max': np.float64(1.5193672596749321), 'Min': np.float64(0.0), 'Mean': np.float64(0.45411276547168894), 'Std': np.float64(0.2945466290974974)}
[I 2024-12-06 23:38:33,419] Trial 406 finished with value: 1.3214285714285714 and parameters: {'x_0_0': 'bd', 'x_0_1': 'ac', 'x_1_0': 'oo', 'x_1_1': 'cd'}. Best is trial 23 with value: 0.5.
2024-12-06 23:38:33,626 - INFO - Candidate Mean Stats: {'Max': np.float64(3.0513795023895893), 'Min': np.float64(-0.7143826662081203), 'Mean': np.float64(0.8106243667291989), 'Std': np.float64(0.5235517323342237)}
2024-12-06 23:38:33,626 - INFO - Candidate Std Stats: {'Max': np.float64(1.4184776530609193), 'Min': np.float64(0.0), 'Mean': np.float64(0.46824732184458695), 'Std': np.float64(0.2945210928121575)}
[I 2024-12-06 23:38:33,641] Trial 409 finished with value: 1.4464285714285714 and parameters: {'x_0_0': 'bc', 'x_0_1': 'cd', 'x_1_0': 'bd', 'x_1_1': 'oo'}. Best is trial 76 with value: 0.5.
2024-12-06 23:38:33,696 - INFO - Candidate Mean Stats: {'Max': np.float64(2.981426282233446), 'Min': np.float64(-0.46211458563646335), 'Mean': np.float64(0.763511871233694), 'Std': np.float64(0.5272964315752628)}
2024-12-06 23:38:33,698 - INFO - Candidate Std Stats: {'Max': np.float64(1.523858094473536), 'Min': np.float64(0.0), 'Mean': np.float64(0.4559275691097757), 'Std': np.float64(0.28672568900010287)}
[I 2024-12-06 23:38:33,713] Trial 409 finished with value: 1.3214285714285714 and parameters: {'x_0_0': 'bd', 'x_0_1': 'ac', 'x_1_0': 'oo', 'x_1_1': 'bc'}. Best is trial 165 with value: 0.5.
2024-12-06 23:38:33,745 - INFO - Candidate Mean Stats: {'Max': np.float64(2.714473581191609), 'Min': np.float64(-0.5220469196802611), 'Mean': np.float64(0.8267928589742672), 'Std': np.float64(0.4459050956936435)}
2024-12-06 23:38:33,745 - INFO - Candidate Std Stats: {'Max': np.float64(1.7373319170233785), 'Min': np.float64(0.0), 'Mean': np.float64(0.4303260123005375), 'Std': np.float64(0.2935218034749473)}
[I 2024-12-06 23:38:33,759] Trial 409 finished with value: 1.1964285714285714 and parameters: {'x_0_0': 'ad', 'x_0_1': 'ac', 'x_1_0': 'oo', 'x_1_1': 'oo'}. Best is trial 63 with value: 0.5.
2024-12-06 23:38:33,797 - INFO - Candidate Mean Stats: {'Max': np.float64(3.364009070443804), 'Min': np.float64(-0.47173003821491005), 'Mean': np.float64(0.7867999707151608), 'Std': np.float64(0.5164417433924104)}
2024-12-06 23:38:33,797 - INFO - Candidate Std Stats: {'Max': np.float64(1.6581209504634131), 'Min': np.float64(0.0), 'Mean': np.float64(0.4375569598178412), 'Std': np.float64(0.28666254564450344)}
[I 2024-12-06 23:38:33,811] Trial 407 finished with value: 1.3214285714285714 and parameters: {'x_0_0': 'ad', 'x_0_1': 'ac', 'x_1_0': 'oo', 'x_1_1': 'ab'}. Best is trial 23 with value: 0.5.
2024-12-06 23:38:34,031 - INFO - Candidate Mean Stats: {'Max': np.float64(3.0006168989880733), 'Min': np.float64(-0.5974343106757728), 'Mean': np.float64(0.7602619803520956), 'Std': np.float64(0.5002483574520633)}
2024-12-06 23:38:34,031 - INFO - Candidate Std Stats: {'Max': np.float64(1.786098537864102), 'Min': np.float64(0.0), 'Mean': np.float64(0.5076629398858995), 'Std': np.float64(0.33104632098022363)}
[I 2024-12-06 23:38:34,045] Trial 410 finished with value: 1.0535714285714286 and parameters: {'x_0_0': 'ac', 'x_0_1': 'ab', 'x_1_0': 'oo', 'x_1_1': 'oo'}. Best is trial 76 with value: 0.5.
2024-12-06 23:38:34,104 - INFO - Candidate Mean Stats: {'Max': np.float64(3.1045589162608698), 'Min': np.float64(-0.40141350258018227), 'Mean': np.float64(0.7843343037418318), 'Std': np.float64(0.42914688212223495)}
2024-12-06 23:38:34,104 - INFO - Candidate Std Stats: {'Max': np.float64(1.7763638915870197), 'Min': np.float64(0.0), 'Mean': np.float64(0.4149308921012196), 'Std': np.float64(0.29400597570762754)}
[I 2024-12-06 23:38:34,118] Trial 410 finished with value: 1.0714285714285714 and parameters: {'x_0_0': 'ac', 'x_0_1': 'oo', 'x_1_0': 'cd', 'x_1_1': 'ab'}. Best is trial 165 with value: 0.5.
2024-12-06 23:38:34,152 - INFO - Candidate Mean Stats: {'Max': np.float64(2.7409445152346086), 'Min': np.float64(-0.48240929479907424), 'Mean': np.float64(0.8086952791221323), 'Std': np.float64(0.4765220404668594)}
2024-12-06 23:38:34,152 - INFO - Candidate Std Stats: {'Max': np.float64(1.8918732985753945), 'Min': np.float64(0.0), 'Mean': np.float64(0.506637213316404), 'Std': np.float64(0.31069689421059354)}
[I 2024-12-06 23:38:34,167] Trial 410 finished with value: 1.1607142857142856 and parameters: {'x_0_0': 'bd', 'x_0_1': 'ac', 'x_1_0': 'bd', 'x_1_1': 'oo'}. Best is trial 63 with value: 0.5.
2024-12-06 23:38:34,207 - INFO - Candidate Mean Stats: {'Max': np.float64(3.1057131087154493), 'Min': np.float64(-0.3918283386994775), 'Mean': np.float64(0.7980546906676504), 'Std': np.float64(0.4557708819382164)}
2024-12-06 23:38:34,207 - INFO - Candidate Std Stats: {'Max': np.float64(1.4472730696804397), 'Min': np.float64(0.0), 'Mean': np.float64(0.423601321158702), 'Std': np.float64(0.26552073234588924)}
[I 2024-12-06 23:38:34,222] Trial 408 finished with value: 1.2142857142857144 and parameters: {'x_0_0': 'ab', 'x_0_1': 'oo', 'x_1_0': 'ac', 'x_1_1': 'ac'}. Best is trial 23 with value: 0.5.
2024-12-06 23:38:34,417 - INFO - Candidate Mean Stats: {'Max': np.float64(3.006800830207581), 'Min': np.float64(-1.0188471376016515), 'Mean': np.float64(0.7295876220640403), 'Std': np.float64(0.603198920613162)}
2024-12-06 23:38:34,417 - INFO - Candidate Std Stats: {'Max': np.float64(1.7345540357250986), 'Min': np.float64(0.0), 'Mean': np.float64(0.5265539517722599), 'Std': np.float64(0.32504788545677676)}
[I 2024-12-06 23:38:34,431] Trial 411 finished with value: 1.1785714285714286 and parameters: {'x_0_0': 'ac', 'x_0_1': 'ab', 'x_1_0': 'oo', 'x_1_1': 'bc'}. Best is trial 76 with value: 0.5.
2024-12-06 23:38:34,494 - INFO - Candidate Mean Stats: {'Max': np.float64(2.924265606868878), 'Min': np.float64(-0.8238234693484318), 'Mean': np.float64(0.7938579906723336), 'Std': np.float64(0.49024640441405204)}
2024-12-06 23:38:34,494 - INFO - Candidate Std Stats: {'Max': np.float64(1.580160892558543), 'Min': np.float64(0.0), 'Mean': np.float64(0.43901159261127465), 'Std': np.float64(0.2846705025070276)}
[I 2024-12-06 23:38:34,508] Trial 411 finished with value: 1.5 and parameters: {'x_0_0': 'cd', 'x_0_1': 'oo', 'x_1_0': 'bc', 'x_1_1': 'ac'}. Best is trial 165 with value: 0.5.
2024-12-06 23:38:34,541 - INFO - Candidate Mean Stats: {'Max': np.float64(2.672795149126213), 'Min': np.float64(-0.42907328184952576), 'Mean': np.float64(0.7226670985437447), 'Std': np.float64(0.5412812905134482)}
2024-12-06 23:38:34,541 - INFO - Candidate Std Stats: {'Max': np.float64(1.720592501548439), 'Min': np.float64(0.0), 'Mean': np.float64(0.5027874544664499), 'Std': np.float64(0.3214366816878966)}
[I 2024-12-06 23:38:34,556] Trial 411 finished with value: 1.1964285714285714 and parameters: {'x_0_0': 'bd', 'x_0_1': 'cd', 'x_1_0': 'oo', 'x_1_1': 'oo'}. Best is trial 63 with value: 0.5.
2024-12-06 23:38:34,598 - INFO - Candidate Mean Stats: {'Max': np.float64(3.2322917523169465), 'Min': np.float64(-0.5534612989401684), 'Mean': np.float64(0.7668726568059955), 'Std': np.float64(0.5188801902369751)}
2024-12-06 23:38:34,598 - INFO - Candidate Std Stats: {'Max': np.float64(1.6077990708341454), 'Min': np.float64(0.0), 'Mean': np.float64(0.4547405720842802), 'Std': np.float64(0.29677536673535176)}
[I 2024-12-06 23:38:34,612] Trial 409 finished with value: 1.3214285714285714 and parameters: {'x_0_0': 'ad', 'x_0_1': 'cd', 'x_1_0': 'oo', 'x_1_1': 'ab'}. Best is trial 23 with value: 0.5.
2024-12-06 23:38:34,807 - INFO - Candidate Mean Stats: {'Max': np.float64(2.7927032933906957), 'Min': np.float64(-0.675910353364702), 'Mean': np.float64(0.740250696785358), 'Std': np.float64(0.5418813859035652)}
2024-12-06 23:38:34,807 - INFO - Candidate Std Stats: {'Max': np.float64(1.6054839042845628), 'Min': np.float64(0.0), 'Mean': np.float64(0.49110860541487783), 'Std': np.float64(0.3024270412767818)}
[I 2024-12-06 23:38:34,822] Trial 412 finished with value: 1.2142857142857144 and parameters: {'x_0_0': 'ab', 'x_0_1': 'oo', 'x_1_0': 'bd', 'x_1_1': 'bc'}. Best is trial 76 with value: 0.5.
2024-12-06 23:38:34,883 - INFO - Candidate Mean Stats: {'Max': np.float64(2.8809333966916126), 'Min': np.float64(-0.6359789404956417), 'Mean': np.float64(0.7132413434589728), 'Std': np.float64(0.533675008732485)}
2024-12-06 23:38:34,883 - INFO - Candidate Std Stats: {'Max': np.float64(1.5427189602312914), 'Min': np.float64(0.0), 'Mean': np.float64(0.520026975502029), 'Std': np.float64(0.32772164112094726)}
[I 2024-12-06 23:38:34,897] Trial 412 finished with value: 1.1607142857142856 and parameters: {'x_0_0': 'bc', 'x_0_1': 'ad', 'x_1_0': 'ad', 'x_1_1': 'oo'}. Best is trial 165 with value: 0.5.
2024-12-06 23:38:34,929 - INFO - Candidate Mean Stats: {'Max': np.float64(2.7805331019287047), 'Min': np.float64(-0.44074487215834746), 'Mean': np.float64(0.8015713523196202), 'Std': np.float64(0.5111010692132422)}
2024-12-06 23:38:34,930 - INFO - Candidate Std Stats: {'Max': np.float64(1.5374928013289837), 'Min': np.float64(0.0), 'Mean': np.float64(0.45638329415685647), 'Std': np.float64(0.2921527342593439)}
[I 2024-12-06 23:38:34,944] Trial 412 finished with value: 1.1607142857142856 and parameters: {'x_0_0': 'ac', 'x_0_1': 'ac', 'x_1_0': 'bc', 'x_1_1': 'oo'}. Best is trial 63 with value: 0.5.
2024-12-06 23:38:34,988 - INFO - Candidate Mean Stats: {'Max': np.float64(3.0353581887616583), 'Min': np.float64(-0.43155637972152017), 'Mean': np.float64(0.8553799694339896), 'Std': np.float64(0.4710700475866673)}
2024-12-06 23:38:34,989 - INFO - Candidate Std Stats: {'Max': np.float64(1.791110944593429), 'Min': np.float64(0.0), 'Mean': np.float64(0.4406639333645848), 'Std': np.float64(0.2960216707179253)}
[I 2024-12-06 23:38:35,002] Trial 410 finished with value: 1.125 and parameters: {'x_0_0': 'oo', 'x_0_1': 'oo', 'x_1_0': 'oo', 'x_1_1': 'cd'}. Best is trial 23 with value: 0.5.
2024-12-06 23:38:35,195 - INFO - Candidate Mean Stats: {'Max': np.float64(2.867938721576654), 'Min': np.float64(-0.4099249889648382), 'Mean': np.float64(0.7991177696164746), 'Std': np.float64(0.526939412414301)}
2024-12-06 23:38:35,195 - INFO - Candidate Std Stats: {'Max': np.float64(1.7297751954301477), 'Min': np.float64(0.0), 'Mean': np.float64(0.47895446219844806), 'Std': np.float64(0.31073878284621215)}
[I 2024-12-06 23:38:35,209] Trial 413 finished with value: 1.5714285714285714 and parameters: {'x_0_0': 'bc', 'x_0_1': 'bd', 'x_1_0': 'bc', 'x_1_1': 'ab'}. Best is trial 76 with value: 0.5.
2024-12-06 23:38:35,273 - INFO - Candidate Mean Stats: {'Max': np.float64(3.4189404733656703), 'Min': np.float64(-0.8734283536974529), 'Mean': np.float64(0.8130099068900621), 'Std': np.float64(0.5033165640434261)}
2024-12-06 23:38:35,273 - INFO - Candidate Std Stats: {'Max': np.float64(1.594076201849481), 'Min': np.float64(0.0), 'Mean': np.float64(0.42863898679725093), 'Std': np.float64(0.2813200141264729)}
